"Unique.ID","Samp.ID","Sampling.date","year","month","day","ACROLOXUS SP.","AESHNA SP.","AMPHARETIDAE GEN. SP.","AMPHINEMURA SP.","ANAX SP.","ANODONTA SP.","ANTHURIDAE GEN. SP.","APHELOCHEIRUS SP.","APLEXA SP.","ARCTOCORISA SP.","ARGULIDAE GEN. SP.","ASELLIDAE GEN. SP.","ASTACIDAE GEN. SP.","ATHERICIDAE GEN. SP.","ATYIDAE GEN. SP.","BAETIS SP.","BDELLOCEPHALA SP.","BERAEIDAE GEN. SP.","BITHYNIA SP.","BRACHYTRON SP.","BRANCHIOBDELLIDAE GEN. SP.","BYTHINELLA SP.","CAENIS SP.","CALLICORIXA SP.","CALOPTERYX SP.","CAMBARIDAE GEN. SP.","CENTROPTILUM SP.","CERATOPOGONIDAE GEN. SP.","CHAOBORIDAE GEN. SP.","CHIRONOMIDAE GEN. SP.","CLOEON SP.","COENAGRION SP.","CORBICULA SP.","CORDULEGASTER SP.","CORDULIA SP.","CORIXA SP.","COROPHIIDAE GEN. SP.","CRANGONYCTIDAE GEN. SP.","CULICIDAE GEN. SP.","CYLINDROTOMIDAE GEN. SP.","CYMATIA SP.","DECAPODA GEN. SP.","DENDROCOELUM SP.","DIXIDAE GEN. SP.","DOLICHOPODIDAE GEN. SP.","DREISSENIDAE GEN. SP.","DRYOPIDAE GEN. SP.","DUGESIA SP.","DYTISCIDAE GEN. SP.","ECNOMUS SP.","ELMIDAE GEN. SP.","EMPIDIDAE GEN. SP.","ENALLAGMA SP.","EPHEMERA SP.","EPHEMERELLA SP.","EPHYDRIDAE GEN. SP.","ERISTALINAE GEN. SP.","ERPOBDELLA SP.","ERYTHROMMA SP.","GAMMARIDAE GEN. SP.","GERRIS SP.","GLOSSIPHONIA SP.","GLOSSOSOMATIDAE GEN. SP.","GOERIDAE GEN. SP.","GOMPHUS SP.","GYRINIDAE GEN. SP.","HABROPHLEBIA SP.","HAEMOPIS SP.","HALIPLIDAE GEN. SP.","HEBRUS SP.","HELOBDELLA SP.","HEMICLEPSIS SP.","HEPTAGENIA SP.","HESPEROCORIXA SP.","HYDRA SP.","HYDRACHNIDIA GEN. SP.","HYDRAENIDAE GEN. SP.","HYDROMETRA SP.","HYDROPHILIDAE GEN. SP.","HYDROPSYCHIDAE GEN. SP.","HYDROPTILIDAE GEN. SP.","HYGROBIIDAE GEN. SP.","ILYOCORIS SP.","ISCHNURA SP.","JANIRIDAE GEN. SP.","LEPIDOSTOMATIDAE GEN. SP.","LEPTOCERIDAE GEN. SP.","LESTES SP.","LEUCORRHINIA SP.","LEUCTRA SP.","LIBELLULA SP.","LIMNADIIDAE GEN. SP.","LIMNEPHILIDAE GEN. SP.","LIMONIIDAE GEN. SP.","LITHOGLYPHUS SP.","LYMNAEA SP.","MESOVELIA SP.","MICRONECTA SP.","MICROVELIA SP.","MOLANNIDAE GEN. SP.","MUSCIDAE GEN. SP.","MYSIDAE GEN. SP.","MYXAS SP.","NAUCORIS SP.","NEHALENNIA SP.","NEMATODA GEN. SP.","NEMATOMORPHA GEN. SP.","NEMOURA SP.","NEMURELLA SP.","NEPA SP.","NOTERIDAE GEN. SP.","NOTONECTA SP.","OLIGOCHAETA GEN. SP.","ORTHETRUM SP.","PALAEMONIDAE GEN. SP.","PARACORIXA SP.","PARALEPTOPHLEBIA SP.","PERLODES SP.","PHRYGANEIDAE GEN. SP.","PHYSA SP.","PHYSELLA SP.","PISCICOLA SP.","PISIDIUM SP.","PLACOBDELLA SP.","PLANARIA SP.","PLANORBIDAE GEN. SP.","PLATYCNEMIS SP.","PLEA SP.","POLYCELIS SP.","POLYCENTROPODIDAE GEN. SP.","POLYCHAETA GEN. SP.","POTAMOPYRGUS SP.","PROCLOEON SP.","PROTONEMURA SP.","PSEUDAMNICOLA SP.","PSYCHODIDAE GEN. SP.","PSYCHOMYIIDAE GEN. SP.","PTYCHOPTERIDAE GEN. SP.","PYRRHOSOMA SP.","RANATRA SP.","RHAGIONIDAE GEN. SP.","RHYACOPHILIDAE GEN. SP.","SABELLIDAE GEN. SP.","SCATOPHAGIDAE GEN. SP.","SCIOMYZIDAE GEN. SP.","SCIRTIDAE GEN. SP.","SERICOSTOMATIDAE GEN. SP.","SIALIS SP.","SIGARA SP.","SIMULIIDAE GEN. SP.","SOMATOCHLORA SP.","SPHAERIUM SP.","STRATIOMYIDAE GEN. SP.","SYMPECMA SP.","SYMPETRUM SP.","TABANIDAE GEN. SP.","TAENIOPTERYX SP.","TALITRIDAE GEN. SP.","THEODOXUS SP.","THEROMYZON SP.","TIPULIDAE GEN. SP.","TROCHETA SP.","UNIO SP.","VALVATA SP.","VELIA SP.","VIVIPARUS SP."
"BEL_005_MZB_LO_1","BEL_005_MZB_LO_1-04.07.1991","04.07.1991",1991,7,4,2,0,0,0,0,0,0,0,0,0,0,51,0,0,0,0,0,0,2,0,0,0,2,0,0,0,0,0,0,13,0,0,0,0,0,2,0,0,0,0,0,0,0,0,0,0,0,0,0,0,0,0,0,0,0,0,0,0,0,0,0,2,0,0,0,0,0,0,2,0,2,0,0,0,0,0,0,0,0,0,0,0,0,0,0,0,0,2,0,0,0,0,0,2,0,2,0,0,0,0,0,0,0,0,0,0,0,0,0,0,0,0,11,0,0,0,0,0,0,2,0,0,0,0,0,15,0,0,0,2,0,101,0,0,0,0,0,0,0,0,0,0,0,0,0,0,1,0,0,0,0,0,0,0,0,0,0,0,0,0,0,0,0,11,0,0
"BEL_005_MZB_LO_1","BEL_005_MZB_LO_1-17.07.1992","17.07.1992",1992,7,17,11,0,0,0,0,2,0,0,0,0,0,11,0,0,0,0,0,0,2,0,0,0,2,0,0,0,0,0,0,2,2,0,0,0,0,0,0,0,0,0,0,0,2,0,0,2,0,11,2,2,0,0,0,0,0,0,0,0,0,0,0,2,0,0,0,0,0,0,2,0,11,0,0,0,0,2,0,0,0,0,0,0,0,2,0,0,0,0,0,0,0,0,0,0,0,2,0,2,0,0,0,0,0,0,0,0,0,0,0,0,2,0,4,0,0,0,0,0,0,0,0,2,0,0,0,11,0,0,0,2,0,11,0,0,0,0,0,0,0,0,0,0,0,0,0,0,0,0,2,0,0,0,0,0,0,0,0,0,0,0,0,0,0,2,0,0
"BEL_005_MZB_LO_1","BEL_005_MZB_LO_1-25.07.1997","25.07.1997",1997,7,25,0,0,0,0,0,0,0,0,0,0,0,11,0,0,0,0,0,0,11,0,0,0,2,0,0,0,0,0,0,11,0,0,0,0,0,0,0,0,0,0,0,0,0,0,0,0,0,0,0,0,0,0,0,0,0,0,0,0,0,0,0,2,0,0,0,0,0,0,11,0,2,0,0,0,0,0,0,0,0,0,0,0,0,2,0,0,2,0,0,0,0,0,0,0,0,0,0,0,0,0,0,0,0,0,0,0,0,0,0,0,0,0,2,0,0,0,0,0,1,0,0,0,2,0,0,4,0,0,0,2,0,2,0,0,0,0,0,0,0,0,0,0,0,0,0,0,0,0,0,0,0,0,0,0,0,0,0,0,0,0,0,0,0,2,0,0
"BEL_005_MZB_LO_1","BEL_005_MZB_LO_1-30.06.1999","30.06.1999",1999,6,30,0,0,0,0,0,0,0,0,0,0,0,51,0,0,0,0,0,0,2,0,0,0,11,0,0,0,0,0,0,11,11,0,0,0,0,0,0,0,0,0,0,0,0,0,0,2,0,11,11,0,0,0,0,0,0,0,0,11,0,0,0,0,0,0,0,0,0,0,11,0,0,2,0,0,0,0,0,0,0,0,0,0,0,2,0,0,0,0,0,0,0,0,0,0,0,0,0,11,0,0,0,0,0,0,0,0,0,0,0,0,0,0,15,0,0,0,0,0,1,0,0,1,0,0,0,3,0,0,0,11,0,11,0,0,0,0,0,0,0,0,0,0,0,0,0,0,0,0,11,0,0,0,0,0,0,0,0,0,0,0,0,0,0,2,0,0
"BEL_005_MZB_LO_1","BEL_005_MZB_LO_1-09.06.2000","09.06.2000",2000,6,9,2,0,0,0,0,0,0,0,0,0,0,11,0,0,0,0,0,0,51,0,0,0,2,0,0,0,0,1,0,62,2,0,0,0,0,0,0,2,0,0,0,0,2,0,0,0,0,2,2,0,0,0,0,0,0,0,0,0,0,0,0,2,0,0,0,2,0,0,1,0,2,1,0,0,0,0,0,0,0,0,0,0,0,11,0,0,1,0,0,0,0,0,0,0,0,2,0,51,0,0,0,0,0,0,0,0,0,0,0,0,1,0,15,0,0,0,0,0,0,2,0,2,0,0,0,62,0,0,0,11,0,0,0,0,0,1,0,0,0,0,0,0,0,0,0,0,0,0,11,0,0,0,0,0,0,0,0,0,0,0,0,0,0,11,0,0
"BEL_005_MZB_LO_10","BEL_005_MZB_LO_10-17.10.1989","17.10.1989",1989,10,17,0,0,0,0,0,0,0,0,0,0,0,0,0,0,0,0,0,0,0,0,0,0,0,0,0,0,0,0,0,101,0,0,0,0,0,0,0,0,0,0,0,0,0,0,0,0,0,0,2,0,0,0,0,0,0,0,0,0,0,11,0,1,0,0,0,0,0,0,0,0,2,0,0,0,0,0,0,0,0,0,0,0,0,0,0,0,0,0,0,0,0,0,0,0,0,0,0,0,0,0,0,0,0,0,0,0,0,0,0,0,0,0,101,0,0,0,0,0,0,0,0,0,11,0,0,0,0,0,0,0,0,0,0,0,0,0,0,0,0,0,0,0,0,0,0,0,0,2,0,11,0,0,0,0,0,1,0,0,0,0,0,0,0,0,0,0
"BEL_005_MZB_LO_10","BEL_005_MZB_LO_10-15.10.1992","15.10.1992",1992,10,15,0,0,0,0,0,0,0,0,0,0,0,1,0,0,0,0,0,0,0,0,0,0,0,0,0,0,0,0,0,11,0,0,0,0,0,0,0,0,0,0,0,0,0,0,0,0,0,0,2,0,0,0,0,0,0,0,0,0,0,11,0,0,0,0,0,0,0,0,0,0,0,0,0,0,0,0,0,0,0,0,0,0,0,0,0,0,0,0,0,0,0,0,0,2,0,1,0,0,0,0,0,0,0,0,0,0,0,0,0,0,0,0,16,0,0,0,0,0,0,0,0,0,11,0,0,0,0,0,0,0,0,0,0,0,0,2,0,0,0,0,0,0,0,0,0,0,0,2,0,2,0,0,2,0,0,0,0,0,0,0,0,0,0,0,0,0
"BEL_005_MZB_LO_10","BEL_005_MZB_LO_10-26.09.1994","26.09.1994",1994,9,26,0,0,0,0,0,0,0,0,0,0,0,2,0,0,0,0,0,0,0,0,0,0,0,0,0,0,0,0,0,53,0,0,0,0,0,0,0,0,0,0,0,0,0,0,0,0,0,0,2,0,0,0,0,0,0,0,0,0,0,11,0,1,0,0,0,0,0,0,0,0,0,0,0,0,0,0,0,0,0,0,0,0,0,0,0,0,0,0,0,0,0,0,1,0,0,0,0,0,0,0,0,0,0,0,0,0,0,0,0,0,0,0,51,0,0,0,0,0,0,0,0,0,2,0,0,0,0,0,0,0,0,0,0,0,0,0,0,0,0,0,0,0,0,0,0,0,0,0,0,11,0,0,0,0,0,0,0,0,0,0,0,0,0,0,0,0
"BEL_005_MZB_LO_10","BEL_005_MZB_LO_10-19.09.1996","19.09.1996",1996,9,19,0,0,0,0,0,0,0,0,0,0,0,0,0,0,0,1,0,0,0,0,0,0,0,0,0,0,0,0,0,11,0,0,0,0,0,0,0,0,0,0,0,0,0,0,0,0,0,0,0,0,0,0,0,0,0,0,0,0,0,51,0,1,0,0,0,0,0,0,0,0,0,0,0,0,0,0,0,0,0,0,0,0,0,0,0,0,0,0,0,0,0,0,2,2,0,0,0,0,0,0,0,0,0,0,0,0,0,0,0,0,0,0,13,0,0,0,0,0,0,0,0,0,0,0,0,0,0,0,0,0,0,0,0,0,0,0,0,0,0,0,0,0,0,0,0,0,0,2,0,2,0,0,0,0,0,0,0,0,0,0,0,0,0,0,0,0
"BEL_005_MZB_LO_10","BEL_005_MZB_LO_10-07.08.1998","07.08.1998",1998,8,7,0,0,0,0,0,0,0,0,0,0,0,11,0,0,0,0,0,0,0,0,0,0,0,0,0,0,0,0,0,12,0,0,0,0,0,0,0,0,0,0,0,0,0,0,0,0,0,0,2,0,0,0,0,0,0,0,0,2,0,51,0,0,0,0,0,0,0,0,0,0,0,0,0,0,0,0,0,0,0,0,0,0,0,0,0,0,0,0,0,0,0,0,0,0,0,0,0,0,0,0,0,0,0,0,0,0,0,0,0,0,0,0,11,0,0,0,0,0,0,0,0,0,11,0,0,0,0,0,0,0,0,0,0,0,0,2,0,0,0,0,0,0,0,0,0,0,0,0,0,2,0,0,0,0,0,0,0,0,0,0,1,0,0,0,0,0
"BEL_005_MZB_LO_10","BEL_005_MZB_LO_10-06.08.1999","06.08.1999",1999,8,6,0,0,0,0,0,0,0,0,0,0,0,0,0,0,0,7,0,0,0,0,0,0,0,0,0,0,0,0,0,2,0,0,0,0,0,0,0,0,2,0,0,0,0,0,0,0,0,0,0,0,0,0,0,0,0,0,0,0,0,11,0,0,0,0,0,0,0,0,0,0,2,0,0,0,0,0,0,0,0,0,0,0,0,0,0,0,2,0,0,0,0,0,1,7,0,0,0,0,0,0,0,0,0,0,0,0,0,0,7,0,0,2,2,0,0,0,0,0,0,0,0,0,1,0,0,0,0,0,0,0,0,0,0,0,0,0,0,0,0,0,0,0,0,0,0,0,0,0,2,11,0,0,0,0,0,0,0,0,0,0,0,0,0,0,0,0
"BEL_005_MZB_LO_10","BEL_005_MZB_LO_10-18.10.2001","18.10.2001",2001,10,18,0,0,0,0,0,0,0,0,0,0,0,2,0,0,0,2,0,0,0,0,0,0,0,0,0,0,0,0,0,11,0,0,0,0,0,0,0,0,0,0,0,0,0,0,0,0,0,0,4,0,0,0,0,0,0,0,0,0,0,6,0,1,0,0,0,0,0,0,0,0,0,0,0,0,0,0,0,0,0,0,0,0,0,0,0,0,1,0,0,0,0,0,2,0,0,0,0,0,0,0,0,0,0,0,0,0,0,0,0,0,0,0,8,0,0,0,0,0,0,0,0,0,5,0,0,0,0,0,0,0,0,0,0,0,0,1,0,0,0,0,0,0,0,0,0,0,0,0,0,2,0,0,0,0,0,0,0,0,0,0,0,0,0,0,1,0
"BEL_005_MZB_LO_100","BEL_005_MZB_LO_100-06.09.1994","06.09.1994",1994,9,6,0,0,0,0,0,0,0,0,0,0,0,2,0,0,0,0,0,0,0,0,0,0,0,0,0,0,0,0,0,2,0,0,0,0,0,0,0,0,0,0,0,0,0,0,0,0,0,0,2,0,0,0,0,0,0,0,0,2,0,1,0,0,0,0,0,0,0,0,2,0,0,0,0,0,0,2,0,0,0,0,0,0,0,0,0,0,0,0,0,0,0,0,1,1,0,2,0,0,0,0,0,0,0,0,0,0,0,0,0,0,0,0,53,0,0,0,0,0,0,0,0,0,11,0,0,0,0,0,0,0,0,0,0,0,0,0,0,0,0,0,0,0,0,0,0,0,0,0,2,0,0,11,0,0,0,0,0,0,0,0,0,0,0,0,0,0
"BEL_005_MZB_LO_100","BEL_005_MZB_LO_100-17.08.1995","17.08.1995",1995,8,17,0,0,0,0,0,0,0,0,0,0,0,2,0,0,0,1,0,0,0,0,0,0,0,0,0,0,0,0,0,13,0,0,0,0,0,0,0,0,0,0,0,0,0,0,0,0,0,0,2,0,0,0,0,0,0,0,0,2,0,1,2,2,0,0,0,0,0,0,0,0,2,0,0,0,0,0,0,0,0,0,0,0,0,0,0,0,0,0,0,0,0,0,0,0,0,0,0,0,0,0,0,0,0,0,0,1,0,0,0,0,0,2,13,0,0,0,0,0,0,0,0,0,51,0,0,1,0,0,0,0,0,0,0,0,0,0,0,0,0,0,0,0,0,0,0,0,0,2,11,0,0,2,0,0,0,0,0,0,0,0,0,0,0,0,0,0
"BEL_005_MZB_LO_100","BEL_005_MZB_LO_100-11.09.1996","11.09.1996",1996,9,11,0,0,0,0,0,0,0,0,0,0,0,11,0,0,0,2,0,0,0,0,0,0,0,0,0,0,0,0,0,12,1,0,0,0,0,1,0,0,0,0,0,0,0,0,0,0,0,0,2,0,0,0,0,0,0,0,0,2,0,0,0,1,0,0,0,0,0,0,1,0,2,0,0,2,0,1,0,0,0,0,0,0,0,0,0,0,0,0,0,0,0,0,0,1,0,2,0,0,0,0,0,0,0,0,0,0,0,0,0,0,0,1,13,0,0,0,0,0,0,0,0,0,11,0,0,3,0,0,0,0,0,0,0,0,0,0,0,0,0,0,0,0,0,0,0,0,0,2,11,1,0,2,0,0,0,0,0,0,0,0,0,0,0,0,0,0
"BEL_005_MZB_LO_100","BEL_005_MZB_LO_100-03.08.2000","03.08.2000",2000,8,3,0,0,0,0,0,0,0,0,0,0,0,11,0,0,0,11,0,0,0,0,0,0,0,0,0,0,0,0,0,14,0,0,0,0,0,0,0,0,0,0,0,0,0,0,0,0,0,0,11,0,0,0,0,0,0,0,0,4,0,3,0,0,0,0,0,0,0,0,0,0,1,0,0,1,0,1,0,0,0,0,0,0,0,0,0,0,0,0,0,0,0,0,0,0,0,0,0,0,0,0,0,0,0,0,0,0,0,0,0,0,0,1,8,0,0,0,0,0,1,0,0,0,0,0,0,2,0,0,0,2,0,0,0,0,0,0,0,0,0,0,0,0,0,0,0,0,0,1,2,7,0,1,0,0,0,0,0,0,0,0,0,0,0,0,1,0
"BEL_005_MZB_LO_100","BEL_005_MZB_LO_100-26.08.2002","26.08.2002",2002,8,26,0,0,0,0,0,0,0,0,0,0,0,11,0,0,0,11,0,0,0,0,0,0,0,0,0,0,0,0,0,11,11,0,0,0,0,0,0,0,0,0,0,0,0,0,1,0,1,0,3,0,1,0,0,0,0,0,0,3,0,3,0,0,0,0,0,0,0,0,51,0,0,0,0,3,0,7,0,0,0,1,2,0,0,0,0,0,0,0,0,0,0,0,0,0,0,0,0,0,0,0,0,0,0,0,0,0,0,0,0,0,0,0,14,0,0,0,0,0,0,0,0,0,1,0,0,0,0,0,0,0,0,0,0,0,0,3,0,0,0,0,0,0,0,0,0,0,0,1,2,11,0,1,0,0,0,0,0,0,0,0,0,0,0,0,0,0
"BEL_005_MZB_LO_100","BEL_005_MZB_LO_100-27.09.2005","27.09.2005",2005,9,27,0,0,0,0,0,0,0,0,0,0,0,60,0,0,0,0,0,0,0,0,0,0,0,0,1,0,0,0,0,10,3,0,0,0,0,0,0,0,2,0,0,0,0,0,0,0,0,0,3,0,0,0,0,0,0,0,0,21,0,25,0,0,0,0,0,0,0,0,1,0,1,0,0,0,0,70,0,0,0,0,0,0,0,1,0,0,4,0,0,0,0,0,1,0,0,3,0,0,0,1,0,0,0,0,0,0,0,0,0,0,0,2,46,0,0,0,0,0,0,0,0,1,10,0,0,5,0,0,0,0,0,0,0,0,0,0,0,0,0,0,0,0,0,0,0,0,0,3,5,0,0,3,0,0,0,0,0,0,0,0,0,0,0,12,0,0
"BEL_005_MZB_LO_100","BEL_005_MZB_LO_100-18.10.2007","18.10.2007",2007,10,18,0,0,0,0,0,0,0,0,0,0,0,10,0,0,0,0,0,0,0,0,0,0,1,0,4,0,0,0,0,6,5,0,0,0,0,0,0,0,0,0,0,0,0,0,0,0,0,0,0,0,2,0,0,0,0,0,0,5,0,25,0,0,0,0,0,0,0,0,0,0,1,1,0,0,0,4,0,0,0,1,0,0,0,1,0,0,10,0,0,0,0,0,0,0,0,1,0,0,0,1,0,0,0,0,0,0,0,0,0,0,0,4,12,0,0,0,0,0,0,0,0,0,7,0,0,2,0,0,0,0,0,0,0,0,0,0,0,0,0,0,0,0,0,0,0,0,0,0,8,0,0,0,0,0,0,0,0,0,0,0,0,0,0,2,0,0
"BEL_005_MZB_LO_100","BEL_005_MZB_LO_100-19.10.2017","19.10.2017",2017,10,19,0,0,0,0,0,0,0,0,0,0,0,150,0,0,0,5,0,0,1,0,0,0,0,1,17,0,0,0,0,60,0,0,0,0,0,0,0,3,0,0,0,0,0,0,0,0,0,0,8,0,0,0,0,0,0,0,1,4,0,1500,20,0,0,0,0,20,0,0,0,0,0,0,0,0,0,3,0,0,0,0,0,0,0,0,0,0,0,0,0,0,0,0,0,0,0,45,0,0,0,0,0,0,0,0,0,0,0,0,0,0,0,4,26,0,0,0,0,0,0,11,0,0,150,0,0,207,0,0,0,0,0,0,0,0,0,0,0,0,3,0,0,0,0,0,0,0,0,40,11,1,0,9,0,0,0,0,0,0,0,0,0,0,0,3,0,0
"BEL_005_MZB_LO_101","BEL_005_MZB_LO_101-09.10.1989","09.10.1989",1989,10,9,0,1,0,0,0,0,0,0,0,0,0,101,0,0,0,101,0,0,0,0,0,0,0,2,2,0,0,0,0,101,0,2,0,0,0,0,0,0,0,0,0,0,0,0,0,0,0,0,2,0,1,0,0,1,0,0,0,11,0,101,0,3,0,0,0,11,0,0,2,0,4,0,0,0,0,0,0,0,0,51,0,0,0,0,0,0,0,0,0,0,0,0,0,0,0,101,0,0,0,0,0,0,0,0,0,0,0,0,0,0,0,0,13,0,0,0,0,0,0,11,0,0,11,0,0,0,0,0,0,0,0,0,0,0,0,0,0,0,0,0,0,0,0,0,0,0,0,0,11,51,0,11,0,0,0,0,0,0,0,0,1,0,0,0,0,0
"BEL_005_MZB_LO_101","BEL_005_MZB_LO_101-06.09.1994","06.09.1994",1994,9,6,0,0,0,0,0,0,0,0,0,0,0,11,0,0,0,11,0,0,0,0,0,0,2,0,2,0,0,1,0,11,0,0,0,0,0,0,0,0,0,0,0,0,0,0,0,0,0,0,1,0,2,0,0,0,0,0,0,2,0,11,0,2,0,0,0,0,0,0,2,0,2,0,0,0,0,0,0,0,0,11,11,0,0,0,0,0,2,0,0,0,0,0,0,0,0,2,0,0,0,0,0,0,0,0,0,0,0,0,0,0,0,0,13,0,0,2,0,0,0,0,0,0,2,0,0,4,0,0,0,0,0,0,0,0,0,0,0,0,0,0,0,0,0,0,0,0,0,0,2,11,0,0,0,0,0,0,0,0,0,0,0,0,0,0,0,0
"BEL_005_MZB_LO_101","BEL_005_MZB_LO_101-11.09.1996","11.09.1996",1996,9,11,0,0,0,0,0,0,0,0,0,0,0,51,0,1,0,101,0,0,2,0,0,0,0,0,1,0,0,0,0,2,0,0,0,0,0,0,0,0,0,0,0,0,0,0,0,0,0,0,0,0,0,0,0,0,0,0,0,2,0,11,0,0,0,0,0,0,0,0,2,0,11,0,0,0,0,11,0,0,0,11,11,0,0,0,0,0,2,0,0,0,0,0,0,0,0,11,0,0,0,0,0,0,0,0,0,0,0,0,0,0,0,0,53,0,0,0,0,0,0,1,0,0,11,0,0,2,0,0,0,0,0,0,0,0,0,0,0,0,0,0,0,0,0,101,0,11,0,0,0,0,0,0,0,0,0,0,0,0,0,0,0,0,0,0,0,0
"BEL_005_MZB_LO_101","BEL_005_MZB_LO_101-19.10.1999","19.10.1999",1999,10,19,0,0,0,0,0,0,0,0,0,0,0,11,0,0,1,2,0,0,0,0,0,0,0,1,11,0,0,1,0,2,11,0,0,0,0,0,0,0,0,0,0,0,0,0,0,0,0,0,1,0,0,0,0,1,0,0,0,2,0,51,0,0,0,0,0,0,0,0,0,0,1,0,0,0,0,0,0,0,0,11,0,0,0,0,0,0,0,0,0,0,0,0,0,0,0,11,0,0,0,0,0,0,0,0,0,0,0,0,0,0,0,0,12,0,0,0,0,0,0,2,0,0,2,0,0,4,2,0,2,0,0,0,0,0,0,0,0,0,0,0,0,0,0,0,0,0,0,1,11,11,0,2,0,0,0,0,0,0,0,0,0,0,0,0,0,0
"BEL_005_MZB_LO_101","BEL_005_MZB_LO_101-17.10.2001","17.10.2001",2001,10,17,0,0,0,0,0,0,0,2,0,0,0,11,0,0,0,11,0,0,0,0,0,0,0,0,3,0,0,0,0,6,11,0,3,0,0,0,0,0,0,0,0,0,0,0,0,0,0,0,0,0,0,2,0,0,0,0,0,5,0,11,0,5,0,0,0,0,0,0,1,0,0,0,0,0,0,1,0,0,0,11,0,0,0,2,0,0,2,0,0,0,0,0,0,0,0,11,0,0,0,0,0,0,0,0,0,0,0,0,0,0,0,0,22,0,0,0,0,0,0,5,0,0,3,0,0,15,1,0,1,0,0,0,0,0,0,0,0,0,2,0,0,0,0,0,0,0,0,0,11,0,0,0,0,0,0,0,0,0,0,0,0,0,0,0,0,0
"BEL_005_MZB_LO_101","BEL_005_MZB_LO_101-24.10.2007","24.10.2007",2007,10,24,0,0,0,0,0,0,0,1,0,0,0,40,0,0,0,20,0,0,15,0,0,0,0,0,7,0,0,0,0,10,0,0,0,0,0,0,0,0,0,0,0,0,0,0,0,0,0,2,0,0,0,0,0,0,0,0,0,2,0,180,0,0,0,0,0,0,0,0,0,0,0,0,0,0,0,0,0,0,0,4,0,0,0,0,0,0,0,0,0,0,0,0,0,0,0,0,0,0,0,0,0,0,0,0,0,0,0,0,0,0,0,0,65,0,0,0,0,0,0,1,0,1,95,0,0,2,0,0,0,0,0,0,0,0,0,0,0,0,0,0,0,0,0,0,0,0,0,2,2,68,0,8,0,0,0,0,0,0,0,0,0,0,0,0,0,0
"BEL_005_MZB_LO_101","BEL_005_MZB_LO_101-13.10.2009","13.10.2009",2009,10,13,0,0,0,0,0,0,0,0,0,0,0,200,0,0,0,0,0,0,5,0,0,0,0,0,5,0,0,0,0,5,100,0,0,0,0,0,0,0,0,0,0,0,1,0,0,0,0,2,1,0,0,0,0,0,0,0,0,8,0,6,0,1,0,0,0,0,0,0,0,0,0,1,0,0,0,10,0,0,0,0,1,0,0,2,0,0,0,0,0,0,0,0,0,0,0,20,0,3,0,0,0,0,0,0,0,0,0,0,0,0,0,3,314,0,0,0,0,0,0,20,0,0,20,0,0,58,0,0,0,0,0,0,0,0,0,0,0,0,0,0,0,0,0,0,0,0,0,1,19,0,0,4,0,0,0,0,0,0,0,0,0,0,0,0,0,0
"BEL_005_MZB_LO_101","BEL_005_MZB_LO_101-17.10.2017","17.10.2017",2017,10,17,0,0,0,0,0,0,0,0,0,0,0,150,0,0,0,11,0,0,1,0,0,0,1,0,30,1,0,3,0,35,0,0,0,0,0,0,0,20,0,0,0,0,0,0,0,0,0,1,2,0,0,1,0,1,0,0,0,6,0,150,1,0,0,0,0,0,0,0,7,0,0,0,0,0,0,2,0,0,1,11,3,0,0,11,0,0,40,0,0,0,0,0,2,0,0,1,0,3,0,0,1,0,0,0,0,0,0,0,0,0,0,0,250,0,0,0,0,0,1,0,0,0,6,0,0,6,9,0,0,0,0,0,0,0,0,0,0,0,0,0,0,0,0,0,0,0,0,25,2,4,0,0,0,0,0,0,0,0,0,0,1,0,0,0,0,0
"BEL_005_MZB_LO_102","BEL_005_MZB_LO_102-09.10.1989","09.10.1989",1989,10,9,0,0,0,0,0,0,0,0,0,0,0,11,0,0,0,51,0,0,1,0,0,0,0,1,1,0,0,0,0,112,0,0,0,0,0,0,0,0,0,0,0,0,0,0,0,0,0,0,1,0,0,0,0,0,0,0,0,1,0,0,0,0,0,0,0,0,0,0,2,0,7,0,0,0,0,0,0,0,0,51,0,0,0,0,0,0,0,0,0,0,0,0,0,0,0,2,1,0,0,0,0,0,0,0,0,0,0,0,0,0,0,1,1001,0,0,0,0,0,0,0,0,0,2,0,0,0,0,0,0,0,0,0,0,0,0,11,0,0,0,0,0,0,0,0,0,0,0,0,2,51,0,1,0,0,0,0,0,0,0,0,0,0,0,0,1,0
"BEL_005_MZB_LO_102","BEL_005_MZB_LO_102-12.10.1994","12.10.1994",1994,10,12,0,0,0,0,0,0,0,0,0,0,0,11,0,0,0,2,0,0,2,0,0,0,0,0,1,0,0,0,0,0,0,0,0,0,0,0,0,0,0,0,0,0,0,0,0,0,0,0,1,0,0,0,0,0,0,0,0,11,0,2,0,2,0,0,0,0,0,0,0,0,11,1,0,0,0,0,0,0,0,2,0,0,0,1,0,0,1,0,0,0,0,0,0,1,0,1,0,0,0,0,0,0,0,0,0,0,0,0,0,0,0,0,55,0,0,0,0,0,0,1,0,0,2,0,0,2,0,0,0,0,0,0,0,0,0,2,0,0,0,0,0,0,0,0,0,0,0,2,11,0,0,2,0,0,0,0,0,0,0,0,0,0,0,0,0,0
"BEL_005_MZB_LO_102","BEL_005_MZB_LO_102-21.08.1995","21.08.1995",1995,8,21,0,0,0,0,0,0,0,0,0,0,0,11,0,1,0,11,0,0,2,0,0,0,0,0,2,0,0,0,0,2,2,0,0,0,0,0,0,0,0,0,0,0,2,0,0,0,0,2,2,0,0,0,0,0,0,0,0,11,0,11,0,2,0,0,0,0,0,0,1,0,2,0,0,0,0,2,0,0,0,0,1,0,0,0,0,0,2,0,0,0,0,0,0,0,0,0,0,0,0,0,0,0,0,0,0,0,0,0,0,0,0,1,103,0,0,0,0,0,0,0,0,0,0,0,0,0,0,0,0,0,0,0,0,0,0,0,0,0,0,0,0,0,0,0,0,0,0,0,2,0,0,11,0,0,0,0,0,0,0,0,0,0,0,0,0,0
"BEL_005_MZB_LO_102","BEL_005_MZB_LO_102-11.09.1996","11.09.1996",1996,9,11,0,0,0,0,0,0,0,0,0,0,0,101,0,0,0,11,0,0,11,0,0,0,0,0,0,0,0,0,0,13,0,0,0,0,0,0,0,0,0,0,0,0,11,0,0,0,0,2,2,0,0,0,0,0,0,0,0,11,0,51,0,1,0,0,0,0,0,0,2,0,11,0,0,0,0,1,0,0,0,2,11,0,0,0,0,0,2,0,0,0,0,0,0,0,0,11,0,0,0,0,0,0,0,0,0,0,0,0,0,0,0,1,112,0,0,0,0,0,0,11,0,0,2,0,0,2,2,0,0,0,0,0,0,0,0,0,2,0,0,0,0,0,0,0,0,0,0,2,11,11,0,11,0,0,0,0,0,0,0,0,0,0,0,0,0,0
"BEL_005_MZB_LO_102","BEL_005_MZB_LO_102-07.08.1997","07.08.1997",1997,8,7,0,0,0,0,0,0,0,0,0,0,0,51,0,0,0,11,0,0,2,0,0,0,0,0,0,0,0,0,0,11,0,0,0,0,0,0,0,0,0,0,0,0,2,0,0,0,0,2,2,0,0,0,0,0,0,0,0,2,0,101,2,1,0,0,0,0,0,0,0,0,2,0,0,0,0,2,0,0,0,2,0,0,0,0,0,0,2,0,0,0,0,0,0,0,0,2,0,0,0,0,0,0,0,0,0,0,0,0,0,0,0,0,112,0,0,0,0,0,0,1,0,0,2,0,0,1,0,0,1,0,0,0,0,0,0,0,0,0,0,0,0,0,0,0,0,0,0,0,2,11,0,11,0,0,0,0,0,0,0,0,0,0,0,0,0,0
"BEL_005_MZB_LO_102","BEL_005_MZB_LO_102-10.08.1998","10.08.1998",1998,8,10,0,0,0,0,0,0,0,0,0,0,0,11,0,0,0,11,0,0,2,0,0,0,0,0,0,0,0,0,0,53,0,0,0,0,0,0,0,0,1,0,0,0,0,0,0,0,0,0,1,0,0,0,0,0,0,0,0,11,0,51,0,2,0,0,0,2,0,0,1,0,2,0,0,0,0,0,0,0,0,11,0,0,0,0,0,0,0,0,0,0,0,0,0,1,0,2,0,0,0,0,0,0,0,0,0,0,0,0,0,1,0,0,103,0,0,0,0,0,0,0,0,0,2,0,0,0,0,0,0,0,0,0,0,0,0,0,0,0,0,0,0,0,0,0,0,0,0,2,1,11,0,11,0,0,0,0,0,0,0,0,1,0,0,0,0,0
"BEL_005_MZB_LO_102","BEL_005_MZB_LO_102-03.08.2000","03.08.2000",2000,8,3,0,0,0,0,0,0,0,0,0,0,0,11,0,2,0,11,0,0,2,0,0,0,0,0,0,0,0,0,0,13,0,0,0,0,0,0,0,0,0,0,0,0,1,0,0,0,0,2,1,0,0,0,0,0,0,0,0,11,0,11,0,4,0,0,0,0,0,0,2,0,11,3,0,0,0,2,0,0,0,1,0,0,0,0,0,0,4,0,0,0,0,0,0,0,0,1,0,0,0,0,0,0,0,0,0,0,0,0,0,0,0,0,22,0,0,0,0,0,0,2,0,0,0,0,0,1,0,0,1,0,0,0,0,0,0,1,0,0,0,0,0,0,0,0,0,0,0,1,0,3,0,4,0,0,0,0,0,0,0,0,0,0,0,0,0,0
"BEL_005_MZB_LO_102","BEL_005_MZB_LO_102-09.09.2002","09.09.2002",2002,9,9,0,0,0,0,0,0,0,0,0,0,0,11,0,2,0,11,0,0,11,0,0,0,0,0,6,0,0,0,0,11,0,0,1,0,0,0,0,0,0,0,0,0,0,0,0,0,0,3,1,0,0,0,0,0,0,0,0,11,0,51,11,2,0,0,0,2,0,0,3,0,2,0,0,0,0,6,0,0,0,11,1,0,0,0,0,0,4,0,0,0,0,0,3,0,0,1,0,0,0,0,0,0,0,0,0,0,0,0,0,0,0,0,23,0,0,0,0,0,0,2,0,0,1,0,0,4,0,0,0,0,0,0,0,0,0,0,0,0,0,0,0,0,0,0,0,0,0,1,11,11,0,3,0,0,0,0,0,0,0,0,0,0,0,0,0,0
"BEL_005_MZB_LO_102","BEL_005_MZB_LO_102-10.09.2004","10.09.2004",2004,9,10,0,1,0,0,0,0,0,1,0,0,0,11,0,4,0,2,0,0,11,0,0,0,1,0,4,1,0,0,0,11,0,0,0,0,0,0,0,0,0,0,0,0,0,0,0,0,0,4,8,0,0,0,0,0,0,0,0,11,0,11,0,3,0,0,0,5,0,0,2,0,11,1,0,0,0,11,0,0,0,11,1,0,0,0,0,0,11,0,0,0,0,0,1,0,0,4,0,0,0,0,0,0,0,0,0,0,0,0,0,0,0,1,12,0,0,0,0,0,0,1,0,0,2,0,0,2,2,0,0,0,0,0,0,0,0,0,2,0,0,0,0,0,0,0,0,0,0,1,0,8,0,11,0,0,0,0,0,0,0,0,0,0,0,0,0,0
"BEL_005_MZB_LO_102","BEL_005_MZB_LO_102-09.10.2006","09.10.2006",2006,10,9,0,0,0,0,0,0,0,0,0,0,0,230,0,0,0,20,0,0,22,0,0,0,0,0,27,0,0,0,0,4,0,0,0,0,0,0,0,0,0,0,0,0,3,0,0,0,0,0,2,0,0,0,0,0,0,0,0,15,0,210,30,1,0,0,0,20,0,0,0,0,2,1,0,0,0,0,0,0,0,0,0,0,0,4,0,0,5,0,0,0,0,0,3,0,0,9,0,0,0,0,0,0,0,0,0,0,0,0,0,0,0,0,557,0,0,0,0,0,0,24,0,0,41,0,0,25,0,0,1,0,0,0,0,0,0,0,0,0,1,0,0,0,0,0,0,0,0,8,23,1,0,100,0,0,0,0,0,0,0,1,0,0,0,0,0,0
"BEL_005_MZB_LO_102","BEL_005_MZB_LO_102-13.10.2009","13.10.2009",2009,10,13,0,0,0,0,0,0,0,0,0,0,0,80,0,0,0,35,0,0,5,0,0,0,0,0,50,0,0,0,0,25,0,0,0,0,0,0,0,0,0,0,0,0,0,0,0,0,0,4,1,0,0,0,0,0,0,0,0,13,0,160,0,2,0,0,0,0,0,0,0,0,3,0,0,0,0,0,0,0,0,2,0,0,0,0,0,0,10,0,0,0,0,0,0,0,0,3,0,0,0,18,0,0,0,0,0,0,0,0,0,0,0,0,180,0,0,0,0,0,0,100,0,0,7,0,0,21,0,0,0,3,0,0,0,0,0,0,0,0,0,0,0,0,0,0,0,0,0,3,50,2,0,150,0,0,0,0,0,0,0,0,0,0,0,0,0,0
"BEL_005_MZB_LO_102","BEL_005_MZB_LO_102-17.10.2017","17.10.2017",2017,10,17,0,0,0,0,0,0,0,0,0,0,0,250,0,0,0,5,0,0,6,0,0,0,0,0,45,0,0,0,0,60,9,0,0,0,0,0,0,0,0,0,0,0,1,0,0,0,0,1,2,0,0,0,0,0,0,0,0,30,0,500,1,3,0,0,0,3,0,0,1,0,5,3,0,0,0,30,0,0,1,70,0,0,0,3,0,0,17,0,0,0,0,0,0,0,0,15,0,0,0,4,0,0,0,0,0,0,0,0,0,0,0,0,87,0,0,0,0,0,0,25,0,0,20,0,0,50,0,0,1,2,0,0,0,0,0,0,6,0,0,0,0,0,0,0,0,0,0,6,20,5,0,35,0,0,0,1,0,0,0,1,0,0,0,15,0,0
"BEL_005_MZB_LO_102","BEL_005_MZB_LO_102-18.09.2020","18.09.2020",2020,9,18,2,0,0,0,0,0,0,0,0,0,0,300,0,0,0,0,0,0,80,0,0,0,0,0,41,1,0,2,0,165,32,0,0,0,0,0,0,2,1,0,0,0,0,0,0,0,0,0,4,0,0,0,0,0,0,6,0,4,0,22,6,0,0,0,0,34,0,0,1,0,0,0,0,1,0,17,0,0,0,4,6,0,0,17,0,0,42,0,0,0,0,0,0,0,0,90,0,0,0,0,0,0,0,0,0,0,0,0,0,0,0,3,40,0,0,0,0,0,0,0,320,1,40,0,0,205,12,0,0,0,0,0,0,0,0,0,0,0,0,0,0,0,0,0,1,0,0,14,14,3,0,11,1,0,0,0,0,0,0,0,0,0,0,3,0,0
"BEL_005_MZB_LO_102","BEL_005_MZB_LO_102-11.10.2023","11.10.2023",2023,10,11,11,0,0,0,0,0,0,0,0,0,0,150,0,0,0,23,0,0,0,0,0,0,1,0,94,1,0,5,0,53,0,0,0,0,0,0,0,0,0,0,0,0,10,0,0,0,0,4,0,0,0,0,0,1,0,1,0,5,0,6120,4,3,0,0,0,2,0,0,0,0,0,2,0,0,2,26,0,0,0,20,0,0,0,2,0,0,20,0,0,0,0,0,0,0,0,0,0,0,0,0,0,0,0,0,0,0,0,0,0,0,0,1,1500,0,0,0,0,0,0,0,0,0,17,0,0,11,1,1,1,0,0,0,0,0,0,0,0,0,0,0,0,0,0,0,0,0,0,0,0,29,0,1,0,0,0,0,0,0,0,1,0,0,0,0,0,0
"BEL_005_MZB_LO_103","BEL_005_MZB_LO_103-09.10.1989","09.10.1989",1989,10,9,0,0,0,0,0,0,0,0,0,0,0,101,0,0,0,51,0,0,11,0,0,0,0,0,0,0,0,0,0,11,0,0,0,0,0,0,0,0,0,0,0,0,0,0,0,0,0,0,0,0,0,0,0,0,0,0,0,11,0,51,0,2,0,0,0,3,0,0,2,0,11,0,0,1,0,0,0,0,0,11,0,0,0,0,0,0,0,0,0,0,0,0,0,2,0,11,0,0,0,0,0,0,0,0,0,0,0,0,0,0,0,0,112,0,0,0,0,0,0,0,0,0,101,0,0,0,0,0,0,0,0,0,0,0,0,0,0,0,0,0,0,0,0,0,0,0,0,1,1,101,0,101,0,0,0,0,0,0,0,0,1,0,0,0,0,0
"BEL_005_MZB_LO_103","BEL_005_MZB_LO_103-12.10.1994","12.10.1994",1994,10,12,0,0,0,0,0,0,0,0,0,0,0,11,0,0,0,11,0,0,11,0,0,0,0,0,2,0,0,0,0,2,0,0,0,0,0,0,0,0,0,0,0,0,0,0,0,0,0,0,2,0,0,0,0,0,0,0,0,2,0,11,0,0,0,0,0,0,0,0,1,0,2,0,0,2,0,0,0,0,0,2,0,0,0,1,0,0,2,0,0,0,0,0,0,0,0,2,0,0,0,0,0,0,0,0,0,0,0,0,0,0,0,0,62,0,0,0,0,0,0,2,0,0,2,0,0,3,0,0,0,0,0,0,0,0,0,0,0,0,0,0,0,0,0,0,0,0,0,11,11,1,0,2,0,0,0,0,0,0,0,0,0,0,0,0,0,0
"BEL_005_MZB_LO_103","BEL_005_MZB_LO_103-21.08.1995","21.08.1995",1995,8,21,0,0,0,0,0,0,0,0,0,0,0,51,0,0,0,11,0,0,11,0,0,0,0,0,11,0,0,0,0,11,2,0,0,0,0,0,0,0,0,0,0,0,0,0,0,0,0,1,0,0,0,0,0,0,0,0,0,2,0,11,0,1,0,0,0,0,0,0,0,0,2,0,0,2,0,0,0,0,0,11,2,0,0,0,0,0,2,0,0,0,0,0,0,0,0,0,0,0,0,0,0,0,0,0,0,0,0,0,0,0,0,0,13,0,0,0,0,0,0,2,0,0,2,0,0,2,0,0,0,1,0,0,0,0,0,0,0,0,0,0,0,0,0,0,0,0,0,0,2,11,0,11,0,0,0,0,0,0,0,0,0,0,0,0,0,0
"BEL_005_MZB_LO_103","BEL_005_MZB_LO_103-11.09.1996","11.09.1996",1996,9,11,0,0,0,0,0,0,0,0,0,0,0,51,0,0,0,0,0,0,11,0,0,0,11,0,0,0,0,0,0,11,0,0,0,0,0,0,0,0,0,0,0,0,2,0,0,0,0,2,2,0,0,0,0,0,0,0,0,11,0,101,0,2,0,0,0,0,0,0,0,0,11,0,0,0,0,0,0,0,0,11,11,0,0,0,0,0,2,0,0,0,0,0,0,0,0,2,0,0,0,0,0,0,0,0,0,0,0,0,0,0,0,0,13,0,0,0,0,0,0,2,0,0,1,0,0,4,0,0,0,0,0,0,0,0,0,0,0,0,0,0,0,0,0,0,0,0,0,0,2,101,0,11,0,0,0,0,0,0,0,0,0,0,0,0,0,0
"BEL_005_MZB_LO_103","BEL_005_MZB_LO_103-07.08.1997","07.08.1997",1997,8,7,0,0,0,0,0,0,0,0,0,0,0,51,0,0,0,51,0,0,2,0,0,0,0,0,0,0,0,0,0,2,0,0,0,0,0,0,0,0,0,0,0,0,2,0,0,0,0,0,0,0,0,0,0,0,0,0,0,2,0,11,0,2,0,0,0,0,0,0,0,0,2,0,0,0,0,0,0,0,0,2,0,0,0,0,0,0,0,0,0,0,0,0,0,0,0,2,0,0,0,0,0,0,0,0,0,0,0,0,0,0,0,0,6,0,0,0,0,0,0,1,0,0,0,0,0,0,0,0,0,0,0,0,0,0,0,0,0,0,0,0,0,0,0,101,0,0,0,0,0,0,0,2,0,0,0,0,0,0,0,0,0,0,0,0,0,0
"BEL_005_MZB_LO_103","BEL_005_MZB_LO_103-10.08.1998","10.08.1998",1998,8,10,0,0,0,0,0,0,0,0,0,0,0,11,0,0,0,101,0,0,2,0,0,0,0,0,0,0,0,0,0,2,0,0,0,0,0,0,0,0,0,0,0,0,0,0,0,0,0,0,0,0,0,0,0,0,0,0,0,2,0,11,0,1,0,0,0,0,0,0,0,0,0,0,0,0,0,2,0,0,0,11,0,0,0,0,0,0,0,0,0,0,0,0,2,0,0,0,0,0,0,0,0,0,0,0,0,0,0,0,0,0,0,0,13,0,0,0,0,0,0,0,0,0,0,0,0,1,0,0,0,0,0,0,0,0,0,0,0,0,0,0,0,0,0,0,0,0,0,0,0,101,0,2,0,0,0,0,0,0,0,0,0,0,0,0,0,0
"BEL_005_MZB_LO_103","BEL_005_MZB_LO_103-03.08.2000","03.08.2000",2000,8,3,0,0,0,0,0,0,0,0,0,0,0,11,0,0,0,11,0,0,1,0,0,0,0,0,0,0,0,0,0,11,5,0,0,0,0,0,0,0,0,0,0,0,0,0,0,0,0,0,2,0,0,0,0,0,0,0,0,6,0,11,0,1,0,0,0,0,0,0,3,0,3,0,0,0,0,0,0,0,0,1,0,0,0,0,0,0,0,0,0,0,0,0,0,0,0,3,0,0,0,0,0,0,0,0,0,0,0,0,0,0,0,0,9,0,0,0,0,0,0,2,0,0,2,0,0,0,0,0,0,0,0,0,0,0,0,0,0,0,0,0,0,0,0,0,0,0,0,1,11,4,0,0,0,0,0,0,0,0,0,0,0,0,0,0,0,0
"BEL_005_MZB_LO_103","BEL_005_MZB_LO_103-17.10.2001","17.10.2001",2001,10,17,0,0,0,0,0,0,0,0,0,0,0,11,0,0,0,2,0,0,3,0,0,0,3,0,11,0,0,0,0,11,0,0,0,0,0,0,0,0,0,0,0,0,2,0,0,0,0,1,0,0,0,0,0,0,0,0,0,11,0,11,0,4,0,0,0,1,0,0,1,0,3,1,0,0,0,2,0,0,0,11,0,0,0,2,0,0,11,0,0,0,0,0,1,0,0,7,0,0,0,0,0,0,0,0,0,0,0,0,0,0,0,0,11,0,0,0,0,0,0,11,0,0,1,0,0,3,2,0,0,2,0,0,0,0,0,0,0,0,0,0,0,0,0,0,0,0,0,2,11,1,0,0,0,0,0,0,0,0,0,0,0,0,0,0,0,0
"BEL_005_MZB_LO_103","BEL_005_MZB_LO_103-09.09.2002","09.09.2002",2002,9,9,0,1,0,0,0,0,0,0,0,0,0,11,0,3,0,8,0,0,9,0,0,0,0,0,11,1,0,0,0,11,1,0,0,0,0,0,0,0,0,0,0,0,0,0,0,0,0,1,6,0,0,0,0,0,0,0,0,7,0,11,11,0,0,0,0,3,0,0,4,0,0,0,0,0,0,2,0,0,0,11,3,0,0,0,0,0,11,0,0,0,0,0,0,0,0,9,0,0,0,0,0,0,0,0,0,0,0,0,0,0,0,0,24,0,0,0,0,0,0,51,0,1,0,0,0,11,0,0,0,2,0,0,0,0,0,0,0,0,0,0,0,0,0,0,0,0,0,1,11,11,0,2,0,0,0,0,0,0,0,0,0,0,0,0,0,0
"BEL_005_MZB_LO_103","BEL_005_MZB_LO_103-10.09.2004","10.09.2004",2004,9,10,0,0,0,0,0,0,0,0,0,0,0,11,0,1,0,11,0,0,5,0,0,0,4,0,2,6,0,1,0,11,0,0,0,0,0,0,0,0,0,0,0,0,0,0,0,0,0,0,0,0,1,0,0,0,0,0,0,4,0,11,11,0,0,0,0,1,0,0,0,0,5,0,0,0,0,11,0,0,0,5,2,0,0,0,0,0,7,0,0,0,0,0,1,0,0,1,0,0,0,0,0,0,0,0,0,0,0,0,0,0,0,0,11,0,0,0,0,0,0,0,0,0,11,0,0,3,0,0,0,4,0,0,0,0,0,0,0,0,0,0,0,0,0,0,0,0,0,4,1,11,0,4,0,0,0,0,0,0,0,0,0,0,0,0,0,0
"BEL_005_MZB_LO_103","BEL_005_MZB_LO_103-20.10.2017","20.10.2017",2017,10,20,0,0,0,0,0,0,0,0,0,0,0,248,0,0,0,12,0,0,0,0,0,0,0,0,107,0,0,0,0,12,0,2,0,0,0,0,0,0,0,0,0,0,0,0,0,0,0,0,0,0,0,0,0,0,0,1,0,3,0,1505,0,0,0,0,0,22,0,0,0,0,0,0,0,0,0,8,0,0,0,5,0,0,0,0,0,0,8,0,0,0,0,0,0,0,0,1,0,0,0,0,0,0,0,0,0,0,0,0,0,0,0,1,2,0,0,0,0,0,1,15,36,0,7,0,0,49,0,0,0,2,0,0,0,0,0,0,1,0,0,0,0,0,0,0,0,0,0,2,6,17,0,0,0,0,0,0,0,0,0,1,0,0,0,0,0,0
"BEL_005_MZB_LO_104","BEL_005_MZB_LO_104-04.10.1989","04.10.1989",1989,10,4,0,0,0,0,0,0,0,0,0,0,0,2,0,0,0,0,0,0,0,0,0,0,0,0,0,0,0,2,0,2,0,0,0,0,0,0,0,0,0,0,0,0,0,0,0,0,0,0,0,0,51,0,0,1,0,0,0,1,0,0,0,1,0,0,0,0,0,0,2,0,0,0,0,0,0,0,0,0,0,0,0,0,0,0,0,0,2,0,0,0,0,0,2,2,0,2,0,0,0,0,0,0,0,0,0,0,0,0,0,0,0,0,11,0,0,0,0,0,0,0,0,0,101,0,0,0,0,0,0,0,0,0,0,0,0,2,0,0,0,0,0,0,0,0,0,0,4,2,0,2,0,0,0,0,0,2,0,0,0,0,6,0,0,0,0,0
"BEL_005_MZB_LO_104","BEL_005_MZB_LO_104-16.10.1990","16.10.1990",1990,10,16,0,0,0,0,0,0,0,0,0,0,0,11,0,0,0,2,0,0,0,0,0,0,0,0,0,0,0,1,0,2,11,2,0,0,0,0,0,0,0,0,0,0,0,0,0,0,0,0,2,0,2,0,0,0,0,0,0,0,0,2,0,8,0,0,0,0,0,0,3,0,2,0,0,0,0,0,0,0,0,0,0,0,0,0,0,0,0,0,0,0,0,0,0,3,0,101,0,0,0,0,0,0,0,0,0,0,0,0,0,0,0,0,51,0,0,0,0,0,0,0,0,0,101,0,0,0,0,0,0,0,0,0,0,0,0,0,0,0,0,0,0,0,0,0,0,0,0,2,51,0,0,0,0,0,0,0,0,0,0,0,0,0,0,0,0,0
"BEL_005_MZB_LO_104","BEL_005_MZB_LO_104-17.08.1995","17.08.1995",1995,8,17,0,0,0,0,0,0,0,1,0,0,0,0,0,0,0,2,0,0,0,0,0,0,0,0,2,0,0,0,0,11,0,0,0,0,0,0,0,0,0,0,0,0,0,0,0,0,0,0,1,0,0,0,0,2,0,0,0,0,0,51,2,1,0,0,0,0,0,0,0,0,1,0,0,0,0,0,0,0,0,11,0,0,0,0,0,0,2,0,0,0,0,0,2,2,0,0,1,0,0,0,0,0,0,0,0,0,0,0,0,0,0,0,2,0,0,0,0,0,0,0,0,0,2,0,0,0,2,0,0,0,0,0,0,0,0,0,0,0,0,0,0,0,0,0,0,0,0,0,0,1,0,0,0,0,0,0,0,0,0,0,0,0,0,0,0,0
"BEL_005_MZB_LO_104","BEL_005_MZB_LO_104-07.08.1997","07.08.1997",1997,8,7,0,0,0,0,0,0,0,0,0,0,0,11,0,0,0,11,0,0,0,0,0,0,0,0,0,2,0,0,0,13,0,0,0,0,0,0,0,0,0,0,0,0,0,0,0,0,0,0,2,0,1,0,0,1,0,0,0,0,0,11,2,2,0,0,0,0,0,0,0,0,0,0,0,0,0,0,0,0,0,2,0,0,0,0,0,0,11,0,0,0,0,0,1,2,0,2,0,0,0,0,0,0,0,0,0,0,0,0,0,1,0,0,11,0,0,0,0,0,0,2,0,0,2,0,0,0,0,0,0,0,0,0,0,0,0,0,0,0,0,0,0,0,0,0,0,0,0,2,2,0,0,0,0,0,0,0,0,0,0,1,0,0,0,0,0,0
"BEL_005_MZB_LO_104","BEL_005_MZB_LO_104-03.08.2000","03.08.2000",2000,8,3,0,0,0,0,0,0,0,0,0,0,0,1,0,0,0,11,0,0,0,0,0,0,0,0,0,0,0,0,0,14,0,0,0,0,0,0,0,0,0,0,0,0,0,0,0,0,0,0,1,0,0,0,0,0,0,0,0,0,0,11,0,0,0,0,0,0,0,0,0,0,1,0,0,0,0,0,0,0,0,4,0,0,0,0,0,0,0,0,0,0,0,0,0,3,0,1,0,0,0,0,0,0,0,0,0,0,0,0,0,1,0,0,11,0,0,0,0,0,1,0,0,0,1,0,0,0,0,0,0,0,0,0,0,0,0,0,0,0,0,0,0,0,0,0,0,0,0,0,0,11,0,0,0,0,0,0,0,0,0,0,0,0,0,0,5,0
"BEL_005_MZB_LO_104","BEL_005_MZB_LO_104-18.08.2003","18.08.2003",2003,8,18,0,0,0,0,0,0,0,0,0,0,0,4,0,0,0,0,0,0,0,0,0,0,2,0,11,1,0,0,0,102,0,0,0,0,0,0,0,0,0,0,0,0,0,0,0,0,0,0,0,0,3,0,0,7,0,0,0,0,0,51,0,2,0,0,1,0,0,0,1,0,0,0,0,0,0,3,0,0,0,0,0,0,0,0,0,0,11,0,0,0,0,0,0,0,0,6,0,0,0,0,0,0,0,0,0,0,0,0,0,0,0,0,11,0,0,0,0,0,0,0,0,0,2,0,0,0,0,0,0,0,0,2,0,0,0,0,0,0,0,0,0,0,0,0,0,0,0,2,0,0,0,0,0,0,0,9,0,0,0,0,0,0,0,0,0,0
"BEL_005_MZB_LO_104","BEL_005_MZB_LO_104-13.10.2009","13.10.2009",2009,10,13,0,0,0,0,0,0,0,0,0,0,0,0,0,0,0,0,0,0,0,0,0,0,0,0,0,0,0,0,0,0,0,0,0,0,0,0,0,0,0,0,0,0,0,0,0,0,0,0,0,0,0,0,0,0,0,0,0,4,0,0,0,2,0,0,0,0,0,0,0,0,0,0,0,0,0,0,0,0,0,0,0,0,0,0,0,0,0,0,0,0,0,0,0,0,0,0,0,0,0,0,0,0,0,0,0,0,0,0,0,0,0,0,6,0,0,0,0,0,0,0,0,0,6,0,0,0,0,0,0,0,0,0,0,0,0,0,0,1,0,0,0,0,0,0,0,0,0,5,0,0,0,0,0,0,0,0,0,0,0,0,50,0,0,0,0,0
"BEL_005_MZB_LO_104","BEL_005_MZB_LO_104-30.10.2017","30.10.2017",2017,10,30,0,0,0,0,0,0,0,0,0,0,0,15,0,0,0,0,0,0,0,0,0,0,0,0,0,0,0,2,0,90,0,0,0,0,0,0,0,0,0,0,0,0,0,0,0,0,0,0,1,0,0,0,0,0,0,0,0,1,0,70,0,16,0,0,0,0,0,0,2,0,0,0,0,2,0,12,0,0,0,0,0,0,0,0,0,0,0,0,0,0,0,0,7,0,0,200,0,0,0,0,0,0,0,0,0,0,0,0,0,1,0,0,40,0,0,0,0,0,0,0,0,0,11,0,0,0,0,0,0,0,0,20,0,0,0,0,0,0,0,0,0,0,0,0,0,0,50,30,0,0,0,0,0,0,0,0,0,0,0,0,0,0,0,0,0,0
"BEL_005_MZB_LO_105","BEL_005_MZB_LO_105-14.10.1994","14.10.1994",1994,10,14,0,0,0,0,0,0,0,0,0,0,0,11,0,0,0,2,0,0,2,0,0,0,0,2,0,0,0,0,0,2,0,0,0,0,0,0,0,0,0,0,0,0,0,0,0,0,0,2,0,0,0,0,0,0,0,0,0,11,0,0,0,0,0,0,0,0,0,0,1,0,11,0,0,0,1,0,0,0,0,0,0,0,0,0,0,0,0,0,0,0,0,0,0,0,0,0,0,0,0,0,0,0,0,0,0,0,0,0,0,0,0,0,11,0,0,0,0,0,0,1,0,0,0,1,0,0,0,0,0,0,0,0,0,0,0,0,0,0,1,0,0,0,0,0,0,0,0,0,0,0,0,2,0,0,0,0,0,0,0,0,0,0,0,2,0,0
"BEL_005_MZB_LO_105","BEL_005_MZB_LO_105-02.08.1996","02.08.1996",1996,8,2,0,0,0,0,0,0,0,0,0,0,0,11,0,0,0,0,0,0,0,0,0,0,0,0,0,0,0,0,0,51,0,0,0,0,0,0,0,0,0,0,0,0,0,0,0,0,0,2,0,0,0,0,0,0,0,0,0,51,0,0,0,11,0,0,0,0,0,0,0,0,11,0,0,0,0,0,0,0,0,0,0,0,0,0,0,0,0,0,0,0,0,0,0,0,0,0,0,0,0,0,0,0,0,0,0,0,0,0,0,0,0,0,103,0,0,0,0,0,0,0,0,0,0,0,0,11,0,0,0,0,0,0,0,0,0,0,0,0,0,0,0,0,0,0,0,0,0,0,1,0,0,0,0,0,0,0,0,0,0,1,1,0,0,2,0,0
"BEL_005_MZB_LO_105","BEL_005_MZB_LO_105-19.09.1997","19.09.1997",1997,9,19,0,0,0,0,0,0,0,0,0,0,0,101,0,0,0,0,0,0,1,0,0,0,0,0,0,0,0,0,0,11,11,0,0,0,0,0,0,0,0,0,0,0,0,0,0,0,0,11,0,0,0,0,0,0,0,0,0,51,0,0,0,11,0,0,0,0,0,0,0,0,11,1,0,0,0,0,0,0,0,0,0,0,0,0,0,0,0,0,0,0,0,0,0,0,0,2,0,0,0,0,0,0,0,0,0,0,0,0,0,0,0,0,22,0,0,0,0,0,0,0,0,0,2,0,0,2,0,0,0,0,0,0,0,0,0,0,0,0,0,0,0,0,0,0,0,0,0,0,11,11,0,0,0,0,0,0,0,0,0,1,0,0,0,11,0,0
"BEL_005_MZB_LO_105","BEL_005_MZB_LO_105-14.08.1998","14.08.1998",1998,8,14,0,0,0,0,0,0,0,0,0,0,0,11,0,0,0,2,0,0,0,0,0,0,0,0,0,0,0,0,0,2,0,0,0,0,0,0,0,0,0,0,0,0,0,0,0,0,0,0,0,0,0,0,0,0,0,0,0,11,0,0,0,11,0,0,0,0,0,0,2,0,2,0,0,0,0,0,0,0,0,0,0,0,0,0,0,0,0,0,0,0,0,0,0,0,0,0,0,0,0,0,0,0,0,0,0,0,0,0,0,0,0,0,6,0,0,0,0,0,0,0,0,0,2,0,0,2,0,0,1,0,0,0,0,0,0,0,0,0,0,0,0,0,0,0,0,0,0,0,1,2,0,2,0,0,0,0,0,0,0,0,0,0,0,0,0,0
"BEL_005_MZB_LO_105","BEL_005_MZB_LO_105-08.09.1999","08.09.1999",1999,9,8,0,0,0,0,0,0,0,0,0,0,0,11,0,0,0,0,0,0,0,0,0,0,0,0,0,0,0,0,0,11,2,0,0,0,0,0,0,0,0,0,0,0,0,0,0,0,0,0,0,0,0,0,0,0,0,0,0,11,0,0,0,1,0,0,0,0,0,0,11,0,11,2,0,0,0,0,0,0,0,0,0,0,0,0,0,0,0,0,0,0,0,0,0,0,0,0,0,0,0,0,0,0,0,0,0,0,0,0,0,0,0,0,13,0,0,0,0,0,0,0,0,0,1,0,0,2,1,0,0,0,0,0,0,0,0,0,0,0,0,0,0,0,0,0,0,0,0,0,11,51,0,0,0,0,0,0,0,0,0,2,0,0,0,0,0,0
"BEL_005_MZB_LO_105","BEL_005_MZB_LO_105-31.08.2000","31.08.2000",2000,8,31,0,0,0,0,0,0,0,0,0,0,0,51,0,0,0,1,0,0,0,0,0,0,0,0,0,0,0,0,0,2,0,0,0,0,0,0,0,0,0,0,0,0,0,0,0,0,0,0,0,0,0,0,0,0,0,0,0,11,0,0,0,2,0,0,0,0,0,0,1,0,11,2,0,0,0,0,0,0,0,0,0,0,0,0,0,0,0,0,0,0,0,0,0,0,0,1,0,0,0,0,0,0,0,0,0,0,0,0,0,1,0,0,4,0,0,0,0,0,0,0,0,0,0,0,0,2,0,0,2,0,0,0,0,0,0,0,0,0,0,0,0,0,0,0,0,0,0,0,2,51,0,2,0,0,0,0,0,0,0,0,0,0,0,0,0,0
"BEL_005_MZB_LO_105","BEL_005_MZB_LO_105-18.10.2001","18.10.2001",2001,10,18,0,0,0,0,0,0,0,0,0,0,0,101,0,0,0,0,0,0,0,0,0,0,0,0,0,0,0,0,0,3,0,0,0,0,0,0,0,0,0,0,0,0,0,0,0,0,0,11,0,0,0,0,0,0,0,0,0,11,0,0,0,5,0,0,0,0,0,0,1,0,11,0,0,0,0,0,0,0,0,2,0,0,0,3,0,0,0,0,0,0,0,0,0,0,0,0,0,0,0,0,0,0,0,0,0,0,0,0,0,0,0,0,13,0,0,0,0,0,0,0,0,0,0,0,0,4,0,0,0,0,0,0,0,0,0,1,0,0,0,0,0,0,0,0,0,0,0,0,2,0,0,8,0,0,0,0,0,0,0,3,0,0,0,0,0,0
"BEL_005_MZB_LO_105","BEL_005_MZB_LO_105-01.10.2002","01.10.2002",2002,10,1,0,0,0,0,0,0,0,0,0,0,0,11,0,0,0,0,0,0,0,0,0,0,0,0,0,0,0,0,0,9,3,0,0,0,0,0,0,0,0,0,0,0,0,0,0,0,0,4,0,0,0,0,0,0,0,0,0,51,0,0,0,11,0,0,0,0,0,0,0,0,51,0,0,0,0,0,0,0,0,1,0,0,0,0,0,0,0,0,0,0,0,0,0,0,0,0,0,0,0,0,0,0,0,0,0,0,0,0,0,0,0,0,55,0,0,0,0,0,0,0,0,0,0,0,0,22,0,0,1,0,0,0,0,0,0,0,0,0,0,0,0,0,0,0,0,0,0,0,11,2,0,11,0,0,0,0,0,0,0,2,0,0,0,0,0,0
"BEL_005_MZB_LO_105","BEL_005_MZB_LO_105-09.09.2003","09.09.2003",2003,9,9,0,0,0,0,0,0,0,0,0,0,0,101,0,0,0,0,0,0,0,0,0,0,0,0,0,0,0,0,0,11,3,0,0,0,0,0,0,0,0,0,0,0,0,0,0,0,0,6,1,0,0,0,0,0,0,0,0,51,0,0,0,11,0,0,0,0,0,0,11,0,51,0,0,0,0,1,0,0,0,11,0,0,0,0,0,0,0,0,0,0,0,0,0,0,0,2,0,0,0,0,0,0,0,0,0,0,0,0,0,0,0,0,22,0,0,0,0,0,0,0,0,0,0,0,0,12,0,0,0,0,0,0,0,0,0,0,0,0,0,0,0,0,0,0,0,0,0,0,1,11,0,6,0,0,0,0,0,0,0,1,0,0,0,0,0,0
"BEL_005_MZB_LO_105","BEL_005_MZB_LO_105-01.09.2005","01.09.2005",2005,9,1,0,0,0,0,0,0,0,0,0,0,0,40,0,0,0,0,0,0,1,0,0,0,0,0,0,0,0,0,0,25,30,0,0,0,0,0,0,0,3,0,0,0,0,0,0,0,0,2,0,0,0,0,0,0,0,0,0,50,0,0,20,7,0,0,0,0,0,0,32,0,12,1,0,0,0,0,0,0,0,0,0,0,0,3,0,0,0,0,0,0,0,0,0,0,0,1,0,2,0,0,0,0,0,0,0,0,0,0,0,0,0,0,60,0,0,0,0,0,0,0,0,0,0,0,0,14,0,0,6,0,0,0,0,0,0,0,0,0,0,0,0,0,0,0,0,0,0,0,60,3,0,12,0,0,0,0,0,0,0,2,0,0,0,0,0,0
"BEL_005_MZB_LO_105","BEL_005_MZB_LO_105-18.09.2006","18.09.2006",2006,9,18,0,0,0,0,0,0,0,0,0,0,0,60,0,0,0,0,0,0,0,0,0,0,0,0,2,0,0,0,0,2,0,0,0,0,0,0,0,0,0,0,0,0,0,0,0,0,0,2,0,0,0,0,0,0,0,0,0,38,0,0,20,2,0,0,0,0,0,0,2,0,8,0,0,0,0,0,0,0,0,0,0,0,0,0,0,0,0,0,0,0,0,0,0,0,0,0,0,0,0,0,0,0,0,0,0,0,0,0,0,0,0,0,37,0,0,0,0,0,0,0,0,0,0,0,0,4,0,0,10,0,0,0,0,0,0,0,0,0,0,0,0,0,0,0,0,0,0,0,0,0,0,2,0,0,0,0,0,0,0,4,0,0,0,0,0,0
"BEL_005_MZB_LO_105","BEL_005_MZB_LO_105-31.10.2007","31.10.2007",2007,10,31,0,0,0,0,0,0,0,0,0,0,0,220,0,0,0,0,0,1,0,0,0,0,0,0,0,0,0,0,0,18,35,0,0,0,0,0,0,0,0,0,0,0,10,0,0,0,0,4,0,0,0,0,0,0,0,0,0,50,0,40,0,8,0,0,0,0,0,0,3,0,20,0,0,0,0,0,0,0,0,1,0,0,0,1,0,0,0,0,0,0,0,0,0,0,0,0,0,0,0,0,0,0,0,0,0,0,0,0,0,0,0,0,17,0,0,0,0,0,0,0,0,0,0,0,0,41,0,0,20,0,0,0,0,0,0,0,0,0,0,0,0,0,0,0,0,0,0,0,14,0,0,5,0,0,0,0,0,0,0,4,0,0,0,0,0,0
"BEL_005_MZB_LO_105","BEL_005_MZB_LO_105-05.10.2011","05.10.2011",2011,10,5,0,0,0,0,0,0,0,0,0,0,0,30,0,0,0,16,0,0,1,0,0,0,0,0,0,0,0,0,0,23,0,0,0,0,0,0,0,0,0,0,0,0,0,0,0,0,0,0,0,0,1,0,0,0,0,0,0,20,0,12,30,0,0,0,0,0,0,0,3,0,5,0,0,0,0,3,0,0,0,1,0,0,0,0,0,0,0,0,0,0,0,0,2,0,0,1,0,0,0,0,0,0,0,0,0,0,0,0,0,0,0,0,17,0,0,0,0,0,0,0,3,0,1,0,0,83,0,0,0,0,0,0,0,0,0,0,0,0,0,0,0,0,0,0,0,0,0,0,2,7,0,2,0,0,0,0,0,0,0,1,0,0,0,6,0,0
"BEL_005_MZB_LO_105","BEL_005_MZB_LO_105-10.09.2014","10.09.2014",2014,9,10,0,0,0,0,0,0,0,0,0,0,0,100,0,0,0,34,0,0,7,0,0,0,0,0,10,0,0,0,0,17,6,4,0,0,0,0,0,24,0,0,0,0,0,0,0,0,0,0,0,0,0,0,0,0,0,0,0,26,0,0,20,0,0,0,0,1,0,0,6,0,6,0,0,0,0,11,0,0,0,80,3,0,0,0,0,0,2,0,0,0,0,0,0,0,0,0,0,0,0,0,0,0,0,0,0,0,0,0,0,0,0,0,16,0,0,0,0,0,0,0,0,0,3,0,0,34,0,0,0,1,0,0,0,0,0,0,1,0,0,0,0,0,0,0,0,0,0,0,42,9,0,32,0,0,0,0,0,0,0,1,0,0,0,8,0,0
"BEL_005_MZB_LO_105","BEL_005_MZB_LO_105-26.10.2017","26.10.2017",2017,10,26,0,0,0,0,0,0,0,0,0,0,0,18,0,0,0,23,0,0,5,0,0,0,0,0,3,0,0,0,0,48,2,0,0,0,0,0,0,0,0,0,0,0,0,0,0,0,0,3,0,0,0,0,0,0,0,1,0,17,0,0,0,2,0,0,0,0,0,0,5,0,2,0,0,0,2,4,0,0,0,31,1,0,0,3,0,0,5,0,0,0,0,0,5,0,0,1,0,0,0,0,3,0,0,0,0,0,0,0,0,0,0,0,26,0,0,0,0,0,0,0,0,0,11,0,0,18,0,0,1,1,0,0,0,0,0,0,8,0,0,0,0,0,0,0,0,0,0,0,0,0,0,9,0,0,0,0,0,0,0,1,0,0,0,1,1,0
"BEL_005_MZB_LO_105","BEL_005_MZB_LO_105-16.10.2020","16.10.2020",2020,10,16,0,0,0,0,0,0,0,0,0,0,0,212,0,0,0,4,0,0,9,0,0,0,0,0,12,0,0,0,0,310,16,13,0,0,0,0,0,2,0,0,0,0,0,0,0,0,0,8,0,0,1,3,0,0,0,1,0,18,0,0,0,0,0,0,0,0,0,0,2,0,3,0,0,0,1,7,0,0,0,500,3,0,0,0,0,0,7,0,0,0,0,0,1,0,0,3,0,0,0,0,0,0,0,0,0,0,0,0,0,0,0,0,24,0,0,0,0,0,0,0,0,6,18,0,0,78,0,0,0,2,0,0,0,0,0,0,0,0,0,0,0,0,0,0,0,0,0,0,0,20,0,57,0,0,0,0,0,0,0,1,1,0,0,0,0,0
"BEL_005_MZB_LO_105","BEL_005_MZB_LO_105-25.10.2023","25.10.2023",2023,10,25,0,0,0,0,1,0,0,0,0,0,0,250,0,0,1,2,0,0,0,0,0,0,0,0,28,0,0,0,0,104,25,10,0,0,0,0,0,5,0,0,0,1,0,0,0,0,0,2,0,0,1,6,0,0,0,5,0,6,0,0,0,0,0,0,0,0,0,0,1,0,0,0,0,0,0,0,0,0,0,250,0,0,0,1,0,0,15,0,0,0,0,0,3,0,0,4,0,0,0,0,0,0,0,0,0,0,0,0,0,0,0,0,14,0,0,0,0,0,0,0,0,3,51,0,0,60,0,0,0,0,0,0,0,0,0,3,3,0,0,0,0,0,0,0,0,0,0,0,0,1,0,10,0,0,0,0,0,0,0,0,1,0,0,1,0,0
"BEL_005_MZB_LO_106","BEL_005_MZB_LO_106-03.10.1989","03.10.1989",1989,10,3,0,0,0,0,0,0,0,0,0,0,0,2,0,0,0,0,0,0,0,0,0,0,0,0,0,0,0,0,0,51,0,0,0,0,0,0,0,0,0,0,0,0,0,0,0,0,0,0,1,0,0,0,0,0,0,0,0,9,0,1,0,4,0,0,0,1,0,0,2,0,10,0,0,0,0,0,0,0,0,0,0,0,0,1,0,0,0,0,0,0,0,0,0,0,0,11,0,0,0,0,0,0,0,0,0,0,0,0,0,0,0,0,62,0,0,0,0,0,0,0,0,0,0,0,0,0,0,0,0,0,0,0,0,0,0,0,0,0,0,0,0,0,0,0,0,0,0,0,1,0,0,0,0,0,0,0,0,0,0,0,1,0,0,1,0,0
"BEL_005_MZB_LO_106","BEL_005_MZB_LO_106-01.08.1996","01.08.1996",1996,8,1,0,0,0,0,0,0,0,0,0,0,0,11,0,0,0,0,0,0,0,0,0,0,0,0,0,0,0,0,0,22,0,0,0,0,0,0,0,0,0,0,0,0,0,0,0,0,0,11,11,0,0,0,0,0,0,0,0,11,0,0,0,1,0,0,0,0,0,0,1,0,51,0,0,0,0,0,0,0,0,0,0,0,0,0,0,0,0,0,0,0,0,0,0,0,0,0,0,0,0,0,0,0,0,0,0,0,0,0,0,0,0,0,101,0,0,0,0,0,0,0,0,0,2,0,0,4,0,0,0,0,0,0,0,0,0,0,0,0,0,0,0,0,0,0,0,0,0,0,2,0,0,2,0,0,0,0,0,0,0,0,0,0,0,11,0,0
"BEL_005_MZB_LO_106","BEL_005_MZB_LO_106-28.08.1997","28.08.1997",1997,8,28,0,0,0,0,0,0,0,0,0,0,0,101,0,0,0,0,0,0,0,0,0,0,0,0,0,0,0,0,0,22,11,0,0,0,0,1,0,0,2,0,0,0,0,0,0,0,0,51,2,0,0,0,0,0,0,0,0,11,0,0,1,2,0,0,0,0,0,0,0,0,11,1,0,0,0,0,0,0,0,0,0,0,0,1,0,0,0,0,0,0,0,0,0,0,0,2,0,0,0,0,0,0,0,0,0,0,0,0,0,0,0,1,202,0,0,0,0,0,0,0,0,0,0,0,0,4,0,0,2,0,0,0,0,0,0,0,0,0,0,0,0,0,0,0,0,0,0,0,51,0,0,0,1,0,0,0,0,0,0,0,0,1,0,0,0,0
"BEL_005_MZB_LO_106","BEL_005_MZB_LO_106-12.08.1998","12.08.1998",1998,8,12,0,0,0,0,0,0,0,0,0,0,0,11,0,0,0,0,0,0,0,0,0,0,0,0,0,0,0,0,0,62,1,0,0,0,0,0,0,0,0,0,0,0,0,0,0,0,0,2,2,0,0,0,0,0,0,0,0,51,0,0,0,0,0,0,0,0,0,0,0,0,51,0,0,0,0,0,0,0,0,0,0,0,0,0,0,0,0,0,0,0,0,0,0,0,0,0,0,0,0,0,0,0,0,0,0,0,0,0,0,1,0,2,1102,0,0,0,0,0,0,0,0,0,0,0,0,13,0,0,0,0,0,0,0,0,0,0,0,0,0,0,0,0,0,0,0,0,0,0,11,0,0,1,0,0,0,0,0,0,0,0,0,0,0,1,0,0
"BEL_005_MZB_LO_106","BEL_005_MZB_LO_106-08.09.1999","08.09.1999",1999,9,8,0,0,0,0,0,0,0,0,0,0,0,11,0,0,0,0,0,0,0,0,0,0,0,2,0,0,0,0,0,13,11,0,0,0,0,0,0,0,0,0,0,0,0,0,0,0,0,0,0,0,0,0,0,0,0,0,0,11,0,0,0,0,0,0,0,0,0,0,1,0,11,0,0,0,0,0,0,0,0,0,0,0,0,2,0,0,0,0,0,0,0,0,0,0,0,0,0,0,0,0,0,0,0,0,0,0,0,0,0,0,0,2,152,0,0,0,0,0,0,0,0,0,0,0,0,2,0,0,0,0,0,0,0,0,0,0,0,0,0,0,0,0,0,0,0,0,0,0,11,0,0,0,0,0,0,0,0,0,0,0,0,0,0,0,0,0
"BEL_005_MZB_LO_106","BEL_005_MZB_LO_106-31.08.2000","31.08.2000",2000,8,31,0,0,0,0,0,0,0,0,0,0,0,11,0,0,0,0,0,0,0,0,0,0,0,0,0,0,0,0,0,13,0,0,0,0,0,0,0,0,0,0,0,0,0,0,0,0,0,11,2,0,0,0,0,0,0,0,0,51,0,0,0,0,0,0,0,0,0,1,0,0,51,0,0,0,0,0,0,0,0,0,0,0,0,0,0,0,0,0,0,0,0,0,0,0,0,0,0,0,0,0,0,0,0,0,0,0,0,0,0,0,0,1,152,0,0,0,0,0,0,2,0,0,0,0,0,3,0,0,2,0,0,0,0,0,0,0,0,0,0,0,0,0,0,0,0,0,0,0,2,0,0,0,0,0,0,0,0,0,0,0,0,0,0,0,0,0
"BEL_005_MZB_LO_106","BEL_005_MZB_LO_106-18.10.2001","18.10.2001",2001,10,18,0,0,0,0,0,0,0,0,0,0,0,51,0,0,0,0,0,0,0,0,0,0,0,0,0,0,0,0,0,0,8,0,0,0,0,0,0,0,0,0,0,0,2,0,0,0,0,5,0,0,0,0,0,0,0,0,0,51,0,0,0,0,0,0,0,0,0,0,0,0,51,0,0,0,0,0,0,0,0,0,0,0,0,3,0,0,0,0,0,0,0,0,0,0,0,0,0,0,0,0,0,0,0,0,0,0,0,0,0,0,0,0,112,0,0,0,0,0,0,0,0,0,1,0,0,18,0,0,0,0,0,0,0,0,0,0,0,0,0,0,0,0,0,0,0,0,0,0,51,0,0,0,0,0,0,0,0,0,0,0,0,0,0,0,0,0
"BEL_005_MZB_LO_106","BEL_005_MZB_LO_106-01.10.2002","01.10.2002",2002,10,1,0,0,0,0,0,0,0,0,0,0,0,101,0,0,0,2,0,0,0,0,0,0,0,0,0,0,0,0,0,11,0,0,0,0,0,0,0,0,0,0,0,0,0,0,0,0,0,11,1,0,0,0,0,0,0,0,0,51,0,1,0,3,0,0,0,0,0,0,0,0,101,0,0,0,0,0,0,0,0,0,0,0,0,0,0,0,0,0,0,0,0,0,0,0,0,7,0,0,0,0,0,0,0,0,0,0,0,0,0,0,0,0,152,0,0,0,0,0,0,0,0,0,3,0,0,12,0,0,0,0,0,0,0,0,0,0,0,0,0,0,0,0,0,0,0,0,0,0,51,2,0,0,0,0,0,0,0,0,0,0,0,0,0,0,0,0
"BEL_005_MZB_LO_106","BEL_005_MZB_LO_106-18.09.2006","18.09.2006",2006,9,18,0,0,0,0,0,0,0,0,0,0,0,100,0,0,0,0,0,0,0,0,0,0,0,0,0,0,0,0,0,3,2,0,0,0,0,0,0,0,0,0,0,0,0,0,0,0,0,9,0,0,0,0,0,0,0,0,0,45,0,1,20,1,0,0,0,0,0,0,3,0,9,0,0,0,0,0,0,0,0,0,0,0,0,2,0,0,0,0,0,0,0,0,0,0,0,0,0,0,0,0,0,0,0,0,0,0,0,0,0,0,0,0,12,0,0,0,0,0,0,0,0,0,0,0,0,7,0,0,0,0,0,0,0,0,0,0,0,0,0,0,0,0,0,0,0,0,0,0,70,0,0,0,0,0,0,0,0,0,0,2,0,0,0,0,0,0
"BEL_005_MZB_LO_106","BEL_005_MZB_LO_106-04.10.2011","04.10.2011",2011,10,4,0,0,0,0,0,0,0,0,0,0,0,70,0,0,0,2,0,0,0,0,0,0,0,0,0,0,0,0,0,3,0,0,0,0,0,0,0,0,0,0,0,0,0,0,0,0,0,0,0,0,0,0,0,0,0,0,0,34,0,0,0,2,0,0,0,0,0,0,8,0,3,0,0,0,0,0,0,0,0,0,0,0,0,0,0,0,0,0,0,0,0,0,0,0,0,13,0,0,0,0,0,0,0,0,0,0,0,0,0,0,0,0,75,0,0,0,0,0,0,0,0,0,0,0,0,28,0,0,2,0,0,0,0,0,0,0,0,0,0,0,0,0,0,0,0,0,0,0,50,0,0,1,0,0,0,0,0,0,0,0,0,0,0,0,0,0
"BEL_005_MZB_LO_106","BEL_005_MZB_LO_106-10.09.2014","10.09.2014",2014,9,10,0,0,0,0,0,0,0,0,0,0,0,320,0,0,0,220,0,0,0,0,0,0,0,0,3,0,0,0,0,29,0,0,0,0,0,0,0,105,0,0,0,0,0,0,0,0,0,8,0,0,0,1,0,0,0,7,0,97,0,0,0,0,0,0,0,0,0,0,8,0,53,0,0,0,0,16,0,0,0,0,2,0,0,0,0,0,0,0,0,0,0,0,0,0,0,16,0,0,0,0,0,0,0,0,0,0,0,0,0,0,0,0,504,0,0,0,0,0,0,0,0,0,0,0,0,36,0,0,21,0,0,0,0,0,0,0,0,0,0,0,0,0,0,0,0,0,0,0,110,27,0,4,0,0,0,0,0,0,0,0,0,0,0,10,0,0
"BEL_005_MZB_LO_107","BEL_005_MZB_LO_107-03.10.1989","03.10.1989",1989,10,3,0,0,0,0,0,0,0,0,0,0,0,11,0,0,0,2,0,0,0,0,0,0,0,0,0,0,0,0,0,13,0,0,0,0,0,0,0,0,0,0,0,0,0,0,0,0,0,0,0,0,0,0,0,0,0,0,0,11,0,0,0,1,0,0,0,0,0,0,2,0,11,0,0,0,0,0,0,0,0,0,0,0,0,0,0,0,0,0,0,0,0,0,0,0,0,51,0,0,0,0,0,0,0,0,0,0,0,0,0,0,0,0,101,0,0,0,0,0,0,2,0,0,1001,0,0,0,0,0,0,0,0,0,0,0,0,0,0,0,0,0,0,0,0,0,0,0,0,3,2,0,0,101,0,0,0,0,0,0,0,0,0,0,0,101,0,0
"BEL_005_MZB_LO_107","BEL_005_MZB_LO_107-01.08.1996","01.08.1996",1996,8,1,0,0,0,0,0,0,0,0,0,0,0,11,0,0,0,0,0,0,0,0,0,0,0,0,0,0,0,0,0,11,2,0,0,0,0,0,0,0,0,0,0,0,0,0,0,0,0,0,11,0,0,0,0,0,0,0,0,51,0,0,0,2,0,0,0,0,0,0,2,0,11,0,0,0,0,0,0,0,0,0,0,0,0,0,0,0,0,0,0,0,0,0,0,0,0,0,0,0,0,0,0,0,0,0,0,0,0,0,0,0,0,0,52,0,0,0,0,0,0,0,0,0,11,0,0,11,0,0,0,0,0,0,0,0,0,0,0,0,0,0,0,0,0,0,0,0,0,2,11,0,0,2,0,0,0,0,0,0,0,0,0,0,0,101,0,0
"BEL_005_MZB_LO_107","BEL_005_MZB_LO_107-28.08.1997","28.08.1997",1997,8,28,0,0,0,0,0,0,0,0,0,0,0,51,0,0,0,0,0,0,0,0,0,0,0,0,0,0,0,0,0,11,51,0,0,0,0,2,0,0,1,0,0,0,0,0,0,0,0,0,1,0,0,0,0,0,0,0,0,51,0,0,0,11,0,0,0,0,0,1,1,0,2,0,0,0,0,2,0,0,1,0,1,0,0,1,0,0,0,0,0,0,0,0,0,0,0,2,0,0,0,0,0,0,0,0,0,0,0,0,0,0,0,0,103,0,0,0,0,0,0,0,0,0,11,0,0,11,0,0,0,0,0,0,0,0,0,0,0,0,0,0,0,0,0,0,0,0,0,1,11,0,0,11,0,0,0,0,0,0,0,0,0,0,0,11,0,0
"BEL_005_MZB_LO_107","BEL_005_MZB_LO_107-12.08.1998","12.08.1998",1998,8,12,0,0,0,0,0,0,0,0,0,0,0,11,0,0,0,0,0,0,0,0,0,0,0,0,0,0,0,0,0,11,2,0,0,0,0,0,0,0,0,0,0,0,0,0,0,0,0,0,2,0,0,0,0,0,0,0,0,11,0,0,0,2,0,0,0,0,0,0,1,0,11,0,0,1,0,0,0,0,0,0,0,0,0,0,0,0,0,0,0,0,0,0,0,0,0,0,0,0,0,0,0,0,0,0,0,0,0,0,0,0,0,1,4,0,0,0,0,0,0,0,0,0,2,0,0,1,0,0,0,0,0,0,0,0,0,0,0,0,0,0,0,0,0,0,0,0,0,1,2,0,0,2,0,0,0,0,0,0,0,2,0,0,0,2,0,0
"BEL_005_MZB_LO_107","BEL_005_MZB_LO_107-08.09.1999","08.09.1999",1999,9,8,0,0,0,0,0,0,0,0,0,0,0,11,0,0,0,2,0,0,0,0,0,0,0,0,0,0,0,0,0,13,0,0,0,0,0,0,0,0,0,0,0,0,0,0,0,0,0,0,0,0,0,0,0,0,0,0,0,11,0,0,0,0,0,0,0,0,0,0,0,0,11,0,0,0,0,0,0,0,0,1,0,0,0,0,0,0,0,0,0,0,0,0,0,0,0,1,0,0,0,0,0,0,0,0,0,0,0,0,0,0,0,0,13,0,0,0,0,0,0,0,0,0,2,0,0,0,0,0,0,0,0,0,0,0,0,0,0,0,0,0,0,0,0,0,0,0,0,0,11,2,0,0,0,0,0,0,0,0,0,0,0,0,0,0,0,0
"BEL_005_MZB_LO_107","BEL_005_MZB_LO_107-31.08.2000","31.08.2000",2000,8,31,0,0,0,0,0,0,0,0,0,0,0,11,0,0,0,1,0,0,0,0,0,0,0,0,0,0,0,0,0,51,0,0,0,0,0,0,0,0,0,0,0,0,0,0,0,0,0,0,0,0,0,0,0,0,0,0,0,2,0,0,0,0,0,0,0,0,0,0,0,0,11,0,0,0,0,0,0,0,0,0,0,0,0,0,0,0,0,0,0,0,0,0,0,0,0,0,0,0,0,0,0,0,0,0,0,0,0,0,0,0,0,0,62,0,0,0,0,0,0,0,0,0,2,0,0,0,0,0,0,0,0,0,0,0,0,1,0,0,0,0,0,0,0,0,0,0,0,1,1,51,0,0,0,0,0,0,0,0,0,2,0,0,0,0,0,0
"BEL_005_MZB_LO_107","BEL_005_MZB_LO_107-01.10.2002","01.10.2002",2002,10,1,0,0,0,0,0,0,0,0,0,0,0,11,0,0,0,0,0,0,0,0,0,0,0,0,0,0,0,0,0,4,0,0,0,0,0,0,0,0,0,0,0,0,0,0,0,0,0,2,0,0,0,0,0,0,0,0,0,51,0,0,0,0,0,0,0,0,0,0,1,0,11,0,0,0,0,0,0,0,0,0,0,0,0,0,0,0,0,0,0,0,0,0,0,0,0,0,0,0,0,0,0,0,0,0,0,11,0,0,0,0,0,1,73,0,0,0,0,0,0,0,0,0,2,0,0,3,0,0,0,0,0,0,0,0,0,0,0,0,0,0,0,0,0,0,0,0,0,0,0,0,0,0,0,0,0,0,0,0,0,0,0,0,0,0,0,0
"BEL_005_MZB_LO_107","BEL_005_MZB_LO_107-18.09.2006","18.09.2006",2006,9,18,0,0,0,0,0,0,0,0,0,0,0,10,0,0,0,0,0,0,0,0,0,0,0,0,1,0,0,0,0,2,0,0,0,0,0,0,0,0,0,0,0,0,0,0,0,0,0,0,0,0,0,0,0,0,0,0,0,27,0,20,0,1,0,0,0,0,0,0,2,0,7,0,0,0,0,0,0,0,0,0,0,0,0,2,0,0,0,0,0,0,0,0,0,0,0,2,0,0,0,0,0,0,0,0,0,0,0,0,0,0,0,0,34,0,0,0,0,0,0,0,4,0,1,0,0,7,0,0,0,0,0,0,0,0,0,0,0,0,0,0,0,0,0,0,0,0,0,1,50,0,0,0,0,0,0,0,0,0,0,0,0,0,0,17,0,0
"BEL_005_MZB_LO_107","BEL_005_MZB_LO_107-04.10.2011","04.10.2011",2011,10,4,0,0,0,0,0,0,0,0,0,0,0,25,0,0,0,9,0,0,0,0,0,0,0,0,2,0,0,1,0,4,0,0,0,0,0,0,0,0,0,0,0,0,0,0,0,0,0,0,2,0,0,0,0,0,0,0,0,7,0,12,0,1,0,0,0,0,0,0,0,0,1,0,0,0,0,2,0,0,0,12,0,0,0,0,0,0,0,0,0,0,0,0,0,0,0,30,0,0,0,0,0,0,0,0,0,0,0,0,0,0,0,0,52,0,0,0,0,0,0,0,0,0,0,0,0,6,0,0,0,0,0,0,0,0,0,0,0,0,0,0,0,0,0,0,0,0,0,6,14,21,0,1,0,0,0,0,0,0,0,0,0,0,0,9,0,0
"BEL_005_MZB_LO_107","BEL_005_MZB_LO_107-10.09.2014","10.09.2014",2014,9,10,0,0,0,0,0,0,0,0,0,0,0,184,0,0,0,15,0,0,0,0,0,0,0,0,0,0,0,0,0,338,0,0,0,0,0,0,0,36,0,0,0,0,0,0,0,0,0,1,4,0,0,0,0,0,0,4,0,47,0,0,2,1,0,0,0,0,0,0,3,0,4,0,0,0,0,0,0,0,0,3,0,0,0,0,0,0,0,0,0,0,0,0,0,2,0,53,0,0,0,0,0,0,0,0,0,0,0,0,0,1,0,0,173,0,0,0,0,0,0,0,10,0,2,0,0,21,0,0,5,0,0,0,0,0,0,1,0,0,0,0,0,0,0,0,0,0,0,4,9,348,0,3,0,0,0,0,0,0,0,2,0,0,0,89,0,0
"BEL_005_MZB_LO_107","BEL_005_MZB_LO_107-10.10.2018","10.10.2018",2018,10,10,0,0,0,0,2,0,0,0,0,0,0,0,0,0,0,10,0,0,0,0,0,0,0,0,0,0,0,0,0,125,0,5,0,0,0,0,0,2,0,0,0,0,0,0,0,0,0,0,2,0,0,0,0,0,0,3,0,1,0,0,50,0,0,0,0,0,0,0,1,0,0,0,0,0,0,4,0,0,0,0,0,0,0,0,0,0,0,0,0,0,0,0,0,0,0,6,0,0,0,0,0,0,0,0,0,0,0,0,0,0,0,1,24,0,0,0,0,0,0,0,0,0,1,0,0,12,0,0,0,0,0,0,0,0,0,0,0,0,0,0,0,0,0,0,0,0,0,1,52,0,0,1,0,0,0,0,0,0,0,0,0,0,0,7,0,0
"BEL_005_MZB_LO_108","BEL_005_MZB_LO_108-12.08.1998","12.08.1998",1998,8,12,0,0,0,0,0,0,0,0,0,0,0,2,0,0,0,2,0,0,0,0,0,0,0,0,0,0,0,0,0,22,0,0,0,0,0,0,0,0,2,0,0,0,0,0,0,0,0,0,11,0,0,0,0,0,0,0,0,0,0,0,0,0,0,0,0,0,0,0,1,0,11,0,0,0,0,0,0,0,0,0,0,0,0,0,0,0,0,0,0,0,0,0,0,0,0,2,0,0,0,0,0,0,0,0,0,2,0,0,0,0,0,0,2,0,0,0,0,0,0,0,0,0,2,0,0,0,0,0,0,0,0,0,0,0,0,0,0,0,0,0,0,0,0,0,0,0,0,0,1,0,0,0,0,0,0,0,0,0,0,0,0,0,0,0,0,0
"BEL_005_MZB_LO_108","BEL_005_MZB_LO_108-31.08.2000","31.08.2000",2000,8,31,0,0,0,0,0,0,0,0,0,0,0,2,0,0,0,0,0,0,0,0,0,0,0,0,0,0,0,0,0,2,0,0,0,0,0,0,0,0,1,0,0,0,0,0,0,0,0,0,0,0,0,0,0,0,0,0,0,2,0,0,0,11,0,0,0,0,0,0,0,0,0,0,0,0,0,0,0,0,0,0,0,0,0,0,0,0,0,0,0,0,0,0,0,0,0,0,0,0,0,0,0,0,0,0,0,0,0,0,0,0,0,0,51,0,0,0,0,0,0,0,0,0,11,0,0,0,0,0,0,0,0,0,0,0,0,0,0,0,0,0,0,0,0,0,0,0,0,0,0,2,0,2,0,0,0,0,0,0,0,0,0,0,0,0,0,0
"BEL_005_MZB_LO_108","BEL_005_MZB_LO_108-09.09.2003","09.09.2003",2003,9,9,0,0,0,0,0,0,0,0,0,0,0,0,0,0,0,0,0,0,0,0,0,0,0,0,0,0,0,0,0,8,0,0,0,0,0,0,0,0,0,0,0,0,0,0,0,0,0,0,0,0,0,0,0,0,0,0,0,0,0,0,0,0,0,0,0,0,0,0,0,0,11,0,0,0,0,0,0,0,0,0,0,0,0,0,0,0,0,0,0,0,0,0,0,0,0,0,0,0,0,0,0,0,0,0,0,0,0,0,0,0,0,0,55,0,0,0,0,0,0,2,0,0,5,0,0,0,0,0,0,0,0,0,0,0,0,2,0,0,0,0,0,0,0,0,0,0,0,0,0,0,0,0,0,0,0,0,0,0,0,0,0,0,0,0,0,0
"BEL_005_MZB_LO_108","BEL_005_MZB_LO_108-05.10.2009","05.10.2009",2009,10,5,0,0,0,0,0,0,0,0,0,0,0,0,0,0,0,0,0,0,0,0,0,0,0,0,0,0,0,0,0,5,0,0,0,0,0,0,0,0,0,0,0,0,0,0,0,0,0,0,0,0,0,0,0,0,0,0,0,3,0,0,0,0,0,0,0,0,0,0,0,0,0,60,0,0,0,0,0,0,0,0,0,0,0,0,0,0,0,0,0,0,0,0,0,0,0,0,0,0,0,0,0,0,0,0,0,0,0,0,0,0,0,0,290,0,0,0,0,0,0,0,0,0,0,0,0,0,0,0,0,0,0,0,0,0,0,0,0,0,0,0,0,0,0,0,0,0,0,0,0,0,0,0,0,0,0,0,0,0,0,0,0,0,0,1,0,0
"BEL_005_MZB_LO_108","BEL_005_MZB_LO_108-04.10.2011","04.10.2011",2011,10,4,0,0,0,0,0,0,0,0,0,0,0,9,0,0,0,0,0,0,0,0,0,0,0,0,0,0,0,0,0,27,0,0,0,0,0,0,0,0,0,0,0,0,0,0,0,0,0,0,0,0,0,0,0,0,0,0,0,0,0,0,0,0,0,0,0,0,0,0,0,0,9,0,0,0,0,0,0,0,0,0,0,0,0,0,0,0,0,0,0,0,0,0,0,0,0,0,0,0,0,0,0,0,0,0,0,0,0,0,0,0,0,1,60,0,0,0,0,0,0,0,0,0,1,0,0,5,0,0,0,0,0,0,0,0,0,0,0,0,0,0,0,0,0,0,0,0,0,0,0,0,0,0,0,0,0,0,0,0,0,0,0,0,0,0,0,0
"BEL_005_MZB_LO_108","BEL_005_MZB_LO_108-04.09.2014","04.09.2014",2014,9,4,0,0,0,0,0,0,0,0,0,0,0,17,0,0,0,1,0,0,0,0,0,0,0,0,0,0,0,1,0,562,1,0,0,0,0,0,0,1,0,0,0,0,0,0,0,0,0,0,0,0,0,0,0,0,0,0,0,9,0,0,0,1,0,0,0,0,0,0,1,0,226,0,0,0,0,1,0,0,2,0,0,0,0,1,0,0,0,0,0,0,0,0,0,0,0,1,0,0,0,0,0,0,0,0,0,0,0,0,0,0,0,0,5309,0,0,0,0,0,0,0,1,0,1,0,0,0,0,0,0,0,0,0,0,0,0,0,0,0,0,0,0,0,0,0,0,0,0,0,2,1,0,0,0,0,0,0,0,0,0,1,0,0,0,1,1,0
"BEL_005_MZB_LO_108","BEL_005_MZB_LO_108-04.10.2017","04.10.2017",2017,10,4,0,0,0,0,0,0,0,0,0,0,0,8,0,0,0,1,0,0,0,0,0,0,0,0,0,0,0,0,0,55,0,0,0,0,0,1,0,0,0,0,0,0,0,0,0,0,0,0,0,0,0,0,0,0,0,1,0,4,0,0,0,0,0,0,0,0,0,0,0,0,40,0,0,0,0,0,0,0,0,0,0,0,0,0,0,0,0,0,0,0,0,0,0,0,0,3,0,0,0,0,0,0,0,0,0,0,0,0,0,0,0,0,170,0,0,0,0,0,0,0,0,0,0,0,0,0,0,0,0,0,0,0,0,0,0,1,0,0,0,0,0,0,0,0,0,0,0,1,0,0,0,0,0,0,0,0,0,0,0,0,0,0,0,0,0,0
"BEL_005_MZB_LO_108","BEL_005_MZB_LO_108-05.10.2020","05.10.2020",2020,10,5,0,0,0,0,0,0,0,0,0,0,0,41,0,0,0,0,0,0,0,0,0,0,0,0,0,0,0,0,0,18,0,0,0,0,0,0,0,0,0,0,0,0,0,0,0,0,0,0,0,0,0,0,0,0,0,0,0,0,0,0,0,1,0,0,0,0,0,0,0,0,10,0,0,0,0,0,0,0,0,0,0,0,0,0,0,0,0,0,0,0,0,0,0,0,0,0,0,0,0,0,0,0,0,0,0,0,0,0,0,0,0,0,350,0,0,0,0,0,0,0,1,0,0,0,0,0,0,0,0,0,0,0,0,0,0,6,0,0,0,0,0,0,0,0,0,0,0,0,0,0,0,1,0,0,0,0,0,0,0,0,0,0,0,0,0,0
"BEL_005_MZB_LO_109","BEL_005_MZB_LO_109-09.10.1996","09.10.1996",1996,10,9,0,0,0,0,0,0,0,0,0,0,0,0,0,0,0,0,0,0,0,0,0,0,0,0,0,0,0,2,0,103,0,0,0,0,0,0,0,0,0,0,0,0,0,0,0,0,0,0,0,0,0,0,0,0,0,0,0,0,0,0,0,2,0,0,0,0,0,0,0,0,0,0,0,0,0,0,0,0,0,0,0,0,0,0,0,0,0,0,0,0,0,0,0,0,0,0,0,0,0,0,0,0,0,0,0,0,0,0,0,0,0,0,53,0,0,0,0,0,0,0,0,0,0,0,0,0,0,0,0,0,0,0,0,0,0,0,0,0,0,0,0,0,0,0,0,0,0,0,1,0,0,0,0,0,0,0,0,0,0,0,0,0,0,0,0,0
"BEL_005_MZB_LO_109","BEL_005_MZB_LO_109-18.10.2001","18.10.2001",2001,10,18,0,0,0,0,0,0,0,0,0,0,0,11,0,0,0,11,0,0,0,0,0,0,0,0,5,0,0,1,0,17,2,0,0,0,0,0,0,0,0,0,0,0,0,0,0,0,0,0,6,0,0,0,0,0,0,0,0,4,0,0,11,1,0,0,0,0,0,0,1,0,6,0,0,0,0,0,0,0,0,5,0,0,0,3,0,0,0,0,0,0,0,0,0,0,0,5,1,0,0,0,0,0,0,0,0,0,0,0,0,0,0,0,202,0,0,0,0,0,0,7,0,0,2,0,0,15,0,0,1,1,0,0,0,0,0,0,0,0,0,0,0,0,0,0,0,0,0,0,11,1,0,2,0,0,0,0,0,0,0,0,0,0,0,11,0,0
"BEL_005_MZB_LO_109","BEL_005_MZB_LO_109-16.09.2003","16.09.2003",2003,9,16,0,0,0,0,0,0,0,0,0,0,0,11,0,0,0,0,0,0,0,0,0,0,0,0,0,0,0,11,0,18,7,0,0,0,0,1,0,0,11,0,0,0,0,0,0,0,0,8,0,0,0,0,0,0,0,0,0,9,0,1,0,5,0,0,0,0,0,0,11,0,6,3,0,3,0,0,0,0,0,0,0,0,0,3,0,0,0,0,0,0,0,0,0,0,0,3,0,0,0,0,0,0,0,0,0,0,0,0,0,0,0,3,11,0,0,0,0,0,0,0,0,0,11,0,0,1,2,0,0,0,0,0,0,0,0,2,0,0,0,0,0,0,0,0,0,0,0,3,51,0,0,11,0,0,0,0,0,0,0,0,1,0,0,11,0,0
"BEL_005_MZB_LO_109","BEL_005_MZB_LO_109-24.08.2005","24.08.2005",2005,8,24,0,0,0,0,0,0,0,0,0,0,0,15,0,0,0,0,0,0,0,0,0,0,0,0,0,0,0,1,0,30,5,0,0,0,0,2,0,0,0,0,0,0,0,0,0,0,0,0,2,0,0,0,0,0,0,0,0,8,0,25,20,6,0,0,0,0,0,0,14,0,3,1,0,0,0,0,0,0,0,0,0,0,0,0,0,0,1,0,0,0,0,0,0,0,0,0,0,0,0,0,0,0,0,0,0,0,0,0,0,0,0,2,20,0,0,0,0,0,0,0,0,0,25,0,0,3,1,0,0,0,0,1,0,0,0,0,0,0,0,0,0,0,0,0,0,0,0,0,30,0,0,20,0,0,0,2,0,0,0,0,0,0,0,12,0,0
"BEL_005_MZB_LO_109","BEL_005_MZB_LO_109-16.09.2014","16.09.2014",2014,9,16,0,0,0,0,0,0,0,0,0,0,0,76,0,0,0,8,0,0,0,0,0,0,0,0,22,0,0,0,0,291,1,0,0,0,0,0,0,176,0,0,0,0,0,4,0,0,0,0,1,0,0,0,0,0,0,0,0,0,0,6,7,0,0,0,0,0,0,0,0,0,1,0,0,0,0,0,0,0,0,0,0,0,0,1,0,0,0,0,0,0,0,0,0,0,0,2,0,0,0,0,0,0,0,0,0,0,0,0,0,0,0,2,342,0,0,0,0,0,0,0,1520,0,360,0,0,29,0,0,1,0,0,30,0,0,0,0,0,0,0,0,0,0,0,0,0,0,0,0,3,1,0,0,0,0,0,0,0,0,0,0,0,0,0,19,0,0
"BEL_005_MZB_LO_11","BEL_005_MZB_LO_11-27.08.1993","27.08.1993",1993,8,27,0,0,0,0,0,0,0,0,0,0,0,2,0,0,0,2,0,1,2,0,0,0,0,0,0,0,0,0,0,11,0,0,0,0,0,0,0,0,1,0,0,0,0,0,1,0,0,1,2,0,0,0,0,0,0,0,0,2,0,2,2,11,0,0,0,0,0,0,2,0,2,0,0,0,0,0,0,0,0,0,0,0,0,0,0,0,0,0,0,0,0,0,0,0,0,2,0,0,0,0,0,0,0,0,0,0,0,0,0,0,0,1,53,0,0,0,0,0,0,0,0,0,11,0,0,11,0,0,0,0,0,0,0,0,0,0,0,0,0,0,0,0,0,0,0,0,0,0,11,0,0,11,0,0,0,0,0,0,0,2,0,0,0,11,0,0
"BEL_005_MZB_LO_11","BEL_005_MZB_LO_11-18.08.1994","18.08.1994",1994,8,18,0,0,0,0,0,0,0,0,0,0,0,2,0,0,0,0,0,0,2,0,0,0,0,0,0,0,0,0,0,11,2,0,0,0,0,0,0,0,0,0,0,0,0,0,0,0,0,0,0,0,0,0,0,0,0,0,0,2,0,2,2,11,0,0,0,0,0,0,2,0,2,0,0,11,0,0,0,0,0,0,0,0,0,0,0,0,0,0,0,0,0,0,0,0,0,2,0,0,0,0,0,0,0,0,0,0,0,0,0,0,0,1,22,0,0,0,0,0,0,0,0,0,2,0,0,6,0,0,0,0,0,0,0,0,0,0,0,0,0,0,0,0,0,0,0,0,0,11,11,0,0,51,0,0,0,0,0,0,0,1,0,0,0,11,0,0
"BEL_005_MZB_LO_11","BEL_005_MZB_LO_11-05.09.1995","05.09.1995",1995,9,5,0,0,0,0,0,0,0,0,0,0,0,11,0,0,0,2,0,0,11,0,0,0,0,0,0,0,0,0,0,51,2,0,0,0,0,0,0,0,1,0,0,0,1,0,0,0,0,2,11,0,0,0,0,0,0,0,0,11,0,11,0,11,0,0,0,2,0,0,11,0,2,0,0,0,0,0,0,0,0,0,0,0,0,0,0,0,0,0,0,0,0,0,0,0,0,11,0,0,0,0,0,0,0,0,0,0,0,0,0,0,0,11,16,0,0,0,0,0,0,0,0,0,2,0,0,17,2,0,0,0,0,0,0,0,0,0,0,0,0,0,0,0,0,0,0,0,0,11,51,0,0,11,0,0,0,0,0,0,0,0,0,0,0,11,0,0
"BEL_005_MZB_LO_11","BEL_005_MZB_LO_11-18.09.1996","18.09.1996",1996,9,18,0,0,0,0,0,0,0,0,0,0,0,51,0,0,0,2,0,0,2,0,0,0,0,0,0,0,0,0,0,11,0,0,0,0,0,0,0,0,0,0,0,0,0,0,0,0,0,2,1,0,0,0,0,0,0,0,0,11,0,11,0,11,0,0,0,0,0,0,1,0,2,0,0,0,0,1,0,0,0,0,0,0,0,0,0,0,2,0,0,0,0,0,0,0,0,2,0,0,0,0,0,0,0,0,0,0,0,0,0,0,0,2,22,0,0,0,0,0,0,0,0,0,0,0,0,13,2,0,0,0,0,0,0,0,0,0,0,0,0,0,0,0,0,0,0,0,0,11,2,0,0,2,0,0,0,0,0,0,0,0,0,0,0,1,0,0
"BEL_005_MZB_LO_11","BEL_005_MZB_LO_11-05.08.1999","05.08.1999",1999,8,5,0,0,0,0,0,0,0,0,0,2,0,0,0,0,0,0,0,0,2,0,0,0,0,0,0,0,0,0,0,11,0,0,0,0,0,0,0,0,0,0,0,0,0,0,0,0,0,0,2,0,0,0,0,0,0,0,0,7,0,11,0,7,0,0,0,0,0,0,2,0,1,0,0,0,0,0,0,0,0,0,0,0,0,0,0,0,0,0,0,0,0,0,0,0,0,0,0,0,0,0,0,0,0,0,0,0,0,0,0,0,0,1,7,0,0,0,0,0,0,0,0,0,7,0,0,4,0,0,0,0,0,41,0,0,0,0,0,0,0,0,0,0,0,0,0,0,0,0,2,0,0,7,0,0,0,0,0,0,0,0,0,0,0,11,0,0
"BEL_005_MZB_LO_11","BEL_005_MZB_LO_11-03.08.2005","03.08.2005",2005,8,3,0,0,0,0,0,0,0,0,0,0,0,3,0,0,0,4,0,0,1,0,0,0,0,0,0,0,0,0,0,31,0,0,0,0,0,0,0,0,0,0,0,0,0,0,0,0,0,0,1,0,0,0,0,0,0,0,0,10,0,0,1,31,0,0,0,0,0,0,7,0,6,0,0,0,0,3,0,0,0,0,0,0,0,0,0,0,19,0,0,0,0,0,0,0,0,1,0,0,0,0,0,0,0,0,0,0,0,0,0,1,0,0,20,0,0,0,0,0,0,0,0,0,24,0,0,49,0,0,0,0,0,9,0,0,0,1,1,0,0,0,0,0,0,0,0,0,0,0,0,1,0,1,0,0,0,0,0,0,0,0,0,0,0,8,0,0
"BEL_005_MZB_LO_11","BEL_005_MZB_LO_11-25.08.2006","25.08.2006",2006,8,25,0,0,0,0,0,0,0,0,0,0,0,30,0,0,0,0,0,0,10,0,0,0,0,0,0,0,0,0,0,30,0,0,0,0,0,0,0,0,0,0,0,0,0,0,0,0,0,2,3,0,0,0,0,0,0,0,0,22,0,40,0,40,0,0,0,0,0,0,4,0,60,0,0,0,0,9,0,0,0,0,0,0,0,0,0,0,0,0,0,0,0,0,0,0,0,4,0,0,0,0,0,0,0,0,0,0,0,0,0,2,0,0,13,0,0,0,0,0,0,0,0,0,1200,0,0,37,0,0,0,0,0,6,0,0,0,1,0,0,0,0,0,0,0,0,0,0,0,1,0,0,0,16,0,0,0,14,0,0,0,1,0,0,0,22,0,0
"BEL_005_MZB_LO_11","BEL_005_MZB_LO_11-16.10.2018","16.10.2018",2018,10,16,0,0,0,0,0,0,0,0,0,0,0,15,0,0,0,0,0,0,7,0,0,0,0,0,0,0,0,0,0,12,0,1,0,0,0,0,0,0,0,0,0,0,0,0,0,0,0,11,0,0,0,0,0,0,0,0,0,4,0,0,0,1,0,0,0,0,0,0,0,0,3,0,0,0,0,3,0,0,0,0,0,0,0,0,0,0,0,0,0,0,0,0,0,0,0,0,0,0,0,0,0,0,0,0,0,0,0,0,0,0,0,0,10,0,0,0,0,0,0,0,0,0,5,0,0,3,0,0,1,0,0,0,0,0,0,0,0,0,0,0,0,0,0,0,0,0,0,0,0,0,0,19,0,0,0,0,0,0,0,0,0,0,0,9,0,0
"BEL_005_MZB_LO_110","BEL_005_MZB_LO_110-20.09.1996","20.09.1996",1996,9,20,0,0,0,0,0,0,0,0,0,0,0,51,0,0,0,11,0,0,11,0,0,0,0,0,1,0,0,0,0,13,11,0,0,0,0,0,0,0,2,0,0,0,0,0,0,0,0,2,0,2,0,0,0,0,0,0,0,11,0,0,0,2,0,0,0,0,0,0,1,0,51,1,0,0,0,0,0,0,0,0,0,0,0,0,0,0,0,0,0,0,0,0,0,0,0,1,0,0,0,0,0,0,0,0,0,0,0,0,0,0,0,0,152,0,0,0,0,0,0,11,0,0,51,0,0,13,11,0,0,0,0,0,0,0,0,0,0,0,0,0,0,0,0,0,0,0,0,2,51,1,0,2,0,0,0,0,0,0,0,0,0,0,0,101,0,0
"BEL_005_MZB_LO_110","BEL_005_MZB_LO_110-05.08.1999","05.08.1999",1999,8,5,0,0,0,0,0,0,0,0,0,0,0,11,0,0,0,0,0,0,2,0,0,0,0,0,0,0,0,0,0,11,2,0,0,0,0,2,0,0,0,0,0,0,0,0,0,0,0,2,2,0,0,0,0,0,0,0,0,11,0,0,0,2,0,0,0,0,0,0,0,0,11,0,0,0,0,0,0,0,0,0,0,0,0,2,0,0,2,0,0,0,0,0,0,0,0,0,0,0,0,0,0,0,0,0,0,0,0,0,0,0,0,2,13,0,0,0,0,0,0,0,0,0,11,0,0,0,0,0,0,1,0,0,0,0,0,0,0,0,0,0,0,0,0,0,0,0,0,2,11,1,0,2,0,0,0,0,0,0,0,0,0,0,0,2,0,0
"BEL_005_MZB_LO_110","BEL_005_MZB_LO_110-14.10.2003","14.10.2003",2003,10,14,0,0,0,0,0,0,0,0,0,0,0,11,0,0,0,0,0,0,11,0,0,0,0,0,1,0,0,0,0,13,9,0,0,0,0,0,0,0,0,0,0,0,0,0,0,0,0,2,1,0,0,0,0,0,0,0,0,9,0,11,11,2,0,0,0,0,0,0,0,0,11,0,0,2,0,0,0,0,0,0,0,0,0,3,0,0,0,0,0,0,0,0,0,0,0,6,0,0,0,0,0,0,0,0,0,0,0,0,0,0,0,1,9,0,0,0,0,0,0,2,0,0,11,0,0,3,6,0,3,0,0,0,0,0,0,0,0,0,1,0,0,0,0,0,0,0,0,1,11,0,0,6,0,0,0,0,0,0,0,0,0,0,0,11,0,0
"BEL_005_MZB_LO_110","BEL_005_MZB_LO_110-24.09.2008","24.09.2008",2008,9,24,0,0,0,0,0,0,0,0,0,0,0,80,0,0,0,0,0,0,60,0,0,0,0,0,0,0,0,0,0,15,20,0,0,0,0,5,0,0,0,0,0,0,0,2,0,0,0,0,5,0,0,0,0,0,0,0,0,13,0,40,22,1,0,0,0,0,0,0,0,0,27,0,0,0,0,0,0,0,0,1,0,0,0,10,0,0,1,0,0,0,0,0,0,0,0,4,0,0,0,0,0,0,0,0,0,0,0,0,0,0,0,4,34,0,0,0,0,0,0,0,30,0,110,0,0,16,0,0,3,23,0,0,0,0,0,0,0,0,0,0,0,0,0,0,0,0,0,5,80,0,0,15,0,0,0,0,0,0,0,0,0,0,0,30,0,0
"BEL_005_MZB_LO_110","BEL_005_MZB_LO_110-23.10.2012","23.10.2012",2012,10,23,0,0,0,0,0,0,0,0,0,0,0,40,0,0,0,0,0,0,50,0,0,0,0,0,0,0,0,0,0,14,1,0,0,0,0,0,0,0,0,0,0,0,0,0,0,0,0,0,0,0,0,0,0,0,0,0,0,25,0,8,10,9,0,0,0,0,0,0,0,0,25,0,0,0,0,0,0,0,0,0,0,0,0,0,0,0,0,0,0,0,0,0,0,0,0,1,0,0,0,0,0,0,0,0,0,0,0,0,0,0,0,0,3,0,0,0,0,0,0,0,0,1,25,0,1,18,0,0,17,0,0,0,0,0,0,0,0,0,0,0,0,0,0,0,0,0,0,1,2,0,0,20,0,0,0,0,0,0,0,0,0,0,0,15,0,0
"BEL_005_MZB_LO_110","BEL_005_MZB_LO_110-17.10.2014","17.10.2014",2014,10,17,0,0,0,0,0,0,0,0,0,0,0,200,0,0,0,0,0,0,36,0,0,0,0,0,0,0,0,0,0,46,0,0,0,0,0,0,0,52,0,0,0,0,0,0,0,0,0,3,1,0,0,0,0,0,0,0,0,29,0,0,30,2,0,0,0,0,0,0,0,0,20,1,0,0,0,0,0,0,0,0,0,0,0,0,0,0,0,0,0,0,0,0,0,0,0,0,0,0,0,0,0,0,0,0,0,0,0,0,0,0,0,0,4,0,0,0,0,0,1,0,0,1,490,0,0,24,0,0,7,0,0,0,0,0,0,0,0,0,0,0,0,0,0,0,0,0,0,59,5,1,0,39,0,0,0,0,0,0,0,0,0,0,0,308,0,0
"BEL_005_MZB_LO_110","BEL_005_MZB_LO_110-16.10.2017","16.10.2017",2017,10,16,1,0,0,0,0,0,0,0,0,0,0,875,0,0,0,0,0,0,4,0,0,0,0,0,6,0,0,0,0,145,36,26,0,0,0,0,0,32,1,0,0,0,0,0,0,0,0,2,1,0,0,0,0,0,0,0,0,15,0,0,50,3,0,0,0,1,0,0,0,0,15,0,0,0,0,0,2,0,0,0,2,0,0,0,0,0,0,0,0,0,0,0,10,0,0,11,0,0,0,0,0,0,0,0,0,0,0,0,0,0,0,0,24,0,0,0,0,0,0,0,0,2,41,0,0,27,4,0,1,18,0,0,0,0,0,0,0,0,0,0,0,0,0,0,0,0,0,4,48,2,0,2,0,0,0,0,0,0,0,0,0,0,0,3,0,0
"BEL_005_MZB_LO_110","BEL_005_MZB_LO_110-29.09.2020","29.09.2020",2020,9,29,2,0,0,0,0,0,0,0,0,0,0,510,0,0,0,1,0,0,100,0,0,0,1,0,5,0,0,0,0,300,16,0,0,0,0,0,0,8,1,0,0,0,2,1,0,0,0,0,0,0,1,0,0,0,0,5,0,60,0,2,21,5,0,0,0,0,0,0,3,0,8,1,0,0,2,2,0,0,0,4,3,0,1,0,0,0,6,0,0,0,3,0,0,2,0,0,0,0,0,0,0,0,0,0,0,0,0,0,0,1,0,0,190,0,0,0,0,0,0,0,0,0,130,0,0,15,4,0,1,92,0,0,0,0,0,0,0,0,1,0,0,0,0,0,0,0,0,30,37,0,0,20,0,0,0,0,0,0,0,0,0,0,0,470,0,0
"BEL_005_MZB_LO_110","BEL_005_MZB_LO_110-29.09.2022","29.09.2022",2022,9,29,7,0,0,0,0,0,0,0,0,0,0,4200,0,0,0,3,0,0,56,0,0,0,0,0,8,0,0,0,0,100,11,3,0,0,0,1,0,17,0,0,0,0,4,1,0,0,0,0,0,0,0,0,1,0,0,5,0,74,0,98,0,3,0,0,0,0,0,0,0,0,24,0,0,0,0,7,0,0,1,3,0,0,0,0,0,0,0,0,0,0,2,0,0,2,0,0,0,3,1,0,0,0,0,0,0,0,0,0,0,0,0,0,1135,0,0,0,0,0,0,0,0,0,45,0,0,23,1,0,3,89,0,0,0,0,0,2,0,0,0,0,0,0,0,0,0,0,0,27,8,130,0,0,0,0,0,0,0,0,0,0,0,0,0,5,0,0
"BEL_005_MZB_LO_111","BEL_005_MZB_LO_111-29.10.1991","29.10.1991",1991,10,29,2,0,0,0,0,0,0,0,0,0,0,11,0,0,0,0,0,0,0,0,0,0,0,0,0,0,0,0,0,62,0,0,0,0,0,0,0,0,0,0,0,0,0,0,0,0,0,0,0,0,0,0,0,0,0,0,0,11,0,0,0,2,0,0,0,0,0,0,0,0,51,0,0,0,0,0,0,0,0,0,0,0,0,0,0,0,0,0,0,0,0,0,0,0,0,0,0,0,0,0,0,0,0,0,0,0,0,0,0,0,0,0,152,0,0,0,0,0,0,11,0,0,11,0,0,1,0,0,0,0,0,0,0,0,0,1,0,0,0,0,0,0,0,0,0,0,0,0,0,0,0,0,0,0,0,0,0,0,0,0,0,0,0,11,0,0
"BEL_005_MZB_LO_111","BEL_005_MZB_LO_111-17.10.1994","17.10.1994",1994,10,17,0,0,0,0,0,0,0,0,0,0,0,11,0,0,0,0,0,0,0,0,0,0,0,0,0,0,0,0,0,11,0,0,0,0,0,0,0,0,0,0,0,0,0,0,0,0,0,0,0,0,0,0,0,0,0,0,0,2,0,0,0,1,0,0,0,0,0,0,0,0,11,0,0,0,0,0,0,0,0,0,0,0,0,2,0,0,0,0,0,0,0,0,0,0,0,0,0,0,0,0,0,0,0,0,0,0,0,0,0,0,0,0,66,0,0,0,0,0,0,2,0,0,2,0,0,0,0,0,0,0,0,0,0,0,0,0,0,0,0,0,0,0,0,0,0,0,0,0,0,0,0,1,0,0,0,0,0,0,0,0,0,0,0,2,0,0
"BEL_005_MZB_LO_111","BEL_005_MZB_LO_111-20.09.1995","20.09.1995",1995,9,20,0,0,0,0,0,0,0,2,0,0,0,11,0,0,0,2,0,0,0,0,0,0,0,0,2,0,0,0,0,2,2,0,0,0,0,0,0,0,0,0,0,0,0,0,0,0,0,1,0,0,0,0,0,0,0,0,0,11,0,0,0,2,0,0,0,0,0,0,2,0,11,0,0,0,0,0,0,0,0,0,0,0,0,0,0,0,0,0,0,0,0,0,0,0,0,0,0,0,0,0,0,0,0,0,0,0,0,0,0,0,1,0,11,0,0,0,0,0,0,2,0,0,2,0,0,2,11,0,0,11,0,0,0,0,0,0,0,0,0,0,0,0,0,0,0,0,0,0,51,2,0,2,0,0,0,0,0,0,0,0,0,0,0,2,0,0
"BEL_005_MZB_LO_111","BEL_005_MZB_LO_111-20.09.1996","20.09.1996",1996,9,20,0,0,0,0,0,0,0,0,0,0,0,11,0,0,0,1,0,0,0,0,0,0,0,0,0,0,0,0,0,11,0,0,0,0,0,0,0,0,0,0,0,0,0,0,0,0,0,0,1,0,0,0,0,0,0,0,0,11,0,0,0,2,0,0,0,0,0,0,0,0,11,0,0,0,0,0,0,0,0,0,0,0,0,2,0,0,0,0,0,0,0,0,0,0,0,2,0,0,0,0,0,0,0,0,0,0,0,0,0,0,0,0,13,0,0,0,0,0,0,11,0,0,0,0,0,0,0,0,0,0,0,0,0,0,0,0,0,0,0,0,0,0,0,0,0,0,0,0,2,11,0,2,0,0,0,0,0,0,0,0,0,0,0,2,0,0
"BEL_005_MZB_LO_111","BEL_005_MZB_LO_111-25.08.1997","25.08.1997",1997,8,25,2,0,0,0,0,0,0,0,0,0,0,51,0,0,0,11,0,0,0,0,0,0,0,1,1,0,0,0,0,51,0,0,0,0,0,0,0,0,0,0,0,0,0,0,0,0,0,2,0,0,0,0,0,0,0,0,0,11,0,0,0,2,0,0,0,0,0,0,0,0,11,0,0,0,0,0,0,0,0,0,2,0,0,0,0,0,0,0,0,0,0,0,0,0,0,2,0,0,0,0,0,0,0,0,0,0,0,0,0,0,0,0,112,0,0,0,0,0,0,2,0,0,51,0,0,0,2,0,0,2,0,0,0,0,0,0,0,0,0,0,0,0,0,0,0,0,0,0,11,2,0,2,0,0,0,0,0,0,0,0,0,0,0,2,0,0
"BEL_005_MZB_LO_111","BEL_005_MZB_LO_111-05.08.1999","05.08.1999",1999,8,5,0,0,0,0,0,0,0,0,0,0,0,11,0,0,0,11,0,0,0,0,0,0,0,0,0,1,0,0,0,11,1,0,0,0,0,0,0,0,0,0,0,0,0,0,0,0,0,1,0,0,0,0,0,0,0,0,0,11,2,0,0,0,0,0,0,0,0,0,1,0,11,1,0,0,0,0,0,0,0,1,2,0,0,0,0,0,0,0,0,0,0,0,0,0,0,0,0,0,0,0,0,0,0,0,0,0,0,0,0,0,0,0,4,0,0,0,0,0,0,2,0,0,0,0,0,0,0,0,0,2,0,0,0,0,0,0,0,0,2,0,0,0,0,0,0,0,0,0,11,2,0,0,0,0,0,0,0,0,0,0,0,0,0,0,0,0
"BEL_005_MZB_LO_111","BEL_005_MZB_LO_111-30.08.2000","30.08.2000",2000,8,30,0,0,0,0,0,0,0,0,0,0,0,11,0,0,0,11,0,0,0,0,0,0,0,0,0,0,0,0,0,12,0,0,0,0,0,0,0,0,0,0,0,0,0,0,0,0,0,0,0,0,0,0,0,0,0,0,0,4,0,0,0,1,0,0,0,0,0,0,0,0,11,0,0,0,0,0,0,0,0,0,5,0,0,0,0,0,0,0,0,0,0,0,0,0,0,0,0,0,0,0,0,0,0,0,0,0,0,0,0,0,0,0,14,0,0,0,0,0,0,0,0,0,3,0,0,0,2,0,0,3,0,0,0,0,0,0,0,0,0,0,0,0,0,0,0,0,0,0,3,11,0,0,0,0,0,0,0,0,0,0,0,0,0,2,0,0
"BEL_005_MZB_LO_111","BEL_005_MZB_LO_111-22.10.2001","22.10.2001",2001,10,22,0,0,0,0,0,0,0,0,0,0,0,11,0,0,0,11,0,0,0,0,0,0,0,0,7,0,0,0,0,11,0,0,0,0,0,0,0,0,0,0,0,0,2,0,0,0,0,11,0,0,0,0,0,0,0,0,0,11,0,0,0,11,0,0,0,0,0,0,0,0,11,4,0,0,0,0,0,0,0,11,0,0,0,5,0,0,0,0,0,0,0,0,0,0,0,0,0,0,0,0,0,0,0,0,0,11,0,0,0,0,0,0,27,0,0,0,0,0,0,11,0,0,5,0,0,15,0,0,0,11,0,0,0,0,0,0,0,0,0,0,0,0,0,0,0,0,0,0,2,0,0,0,0,0,0,0,0,0,0,0,0,0,0,0,0,0
"BEL_005_MZB_LO_111","BEL_005_MZB_LO_111-12.09.2002","12.09.2002",2002,9,12,0,0,0,0,0,0,0,0,0,0,0,11,0,0,0,2,0,0,0,0,0,0,0,0,0,0,0,0,0,11,0,0,0,0,0,0,0,0,0,0,0,0,0,0,0,0,0,2,1,0,0,0,0,0,0,0,0,11,0,0,11,51,0,0,0,0,0,0,3,0,51,2,0,0,0,1,0,0,0,1,0,0,0,0,0,0,0,0,0,0,0,0,0,0,0,6,0,0,0,0,0,0,0,0,0,0,0,0,0,0,0,0,11,0,0,0,0,0,0,11,0,0,3,0,0,17,0,0,0,0,0,0,0,0,0,0,0,0,0,0,0,0,0,0,0,0,0,0,11,0,0,0,0,0,0,0,0,0,0,1,0,0,0,0,0,0
"BEL_005_MZB_LO_111","BEL_005_MZB_LO_111-28.08.2003","28.08.2003",2003,8,28,0,1,0,0,0,0,0,0,0,0,0,11,0,0,0,8,0,0,0,0,0,0,0,0,11,0,0,0,0,8,1,0,0,0,0,0,0,0,0,0,0,0,0,0,0,0,0,0,0,0,0,0,0,0,0,0,0,11,0,0,11,1,0,0,0,0,0,0,0,0,11,0,0,0,0,2,0,0,0,1,3,0,0,4,0,0,5,0,0,0,0,0,0,0,0,0,0,2,0,0,0,0,0,0,0,0,0,0,0,0,0,0,12,0,0,0,0,0,0,0,0,1,11,0,0,2,0,0,0,3,0,0,0,0,0,0,0,0,0,0,0,0,0,0,0,0,0,0,2,8,0,2,0,0,0,0,0,0,0,0,0,0,0,1,0,0
"BEL_005_MZB_LO_111","BEL_005_MZB_LO_111-01.09.2005","01.09.2005",2005,9,1,2,0,0,0,0,0,0,0,0,0,0,11,0,0,0,11,0,0,0,0,0,0,0,0,2,0,0,0,0,8,0,0,0,0,0,0,0,0,0,0,0,0,2,0,0,0,0,1,0,0,0,0,0,0,0,0,0,11,0,1,11,0,0,0,0,0,0,0,3,0,11,2,0,0,0,0,0,0,0,1,11,0,0,6,0,0,9,0,0,0,0,0,0,0,0,0,0,2,0,0,0,0,0,0,0,0,0,0,0,0,0,0,22,0,0,0,0,0,4,2,0,1,4,0,0,14,2,0,1,0,0,0,0,0,0,0,2,0,0,0,0,0,0,0,0,0,0,0,11,6,0,6,0,0,0,0,0,0,0,0,0,0,0,11,0,0
"BEL_005_MZB_LO_111","BEL_005_MZB_LO_111-15.09.2006","15.09.2006",2006,9,15,0,0,0,0,0,0,0,0,0,0,0,15,0,0,0,0,0,0,0,0,0,0,0,0,8,0,0,0,0,4,0,0,0,0,0,0,0,0,0,0,0,0,0,0,0,0,0,0,0,0,0,0,0,0,0,0,0,6,0,3,20,0,0,0,0,0,0,0,0,0,5,2,0,0,0,0,0,0,0,1,0,0,0,6,0,0,3,0,0,0,0,0,0,0,0,3,0,0,0,0,0,0,0,0,0,0,0,0,0,0,0,0,20,0,0,0,0,0,0,0,0,1,25,0,0,5,0,0,0,0,0,0,0,0,0,0,0,0,0,0,0,0,0,0,0,0,0,0,3,0,0,0,0,0,0,0,0,0,0,2,0,0,0,70,0,0
"BEL_005_MZB_LO_111","BEL_005_MZB_LO_111-24.09.2008","24.09.2008",2008,9,24,0,0,0,0,0,0,0,0,0,0,0,40,0,0,0,55,0,0,0,0,0,0,0,0,2,0,0,0,0,0,0,0,0,0,0,0,0,0,0,0,0,0,2,0,0,0,0,2,0,0,0,0,0,0,0,0,0,26,0,2,20,0,0,0,0,0,0,0,0,0,28,0,0,0,0,0,0,0,0,3,0,0,0,1,0,0,2,0,0,0,0,0,0,0,0,0,0,0,0,0,0,0,0,0,0,0,0,0,0,0,0,0,80,0,0,0,0,0,1,12,0,0,90,0,0,9,0,0,1,10,0,0,0,0,0,0,0,0,0,0,0,0,0,0,0,0,0,0,0,120,0,0,1,0,0,0,0,0,0,0,0,0,0,60,0,0
"BEL_005_MZB_LO_111","BEL_005_MZB_LO_111-19.10.2010","19.10.2010",2010,10,19,0,1,0,0,0,0,0,0,0,0,0,40,0,0,0,3,0,0,0,0,0,0,0,0,10,0,0,0,0,52,0,0,0,0,0,0,0,0,0,0,0,0,2,0,0,0,0,2,0,0,0,0,0,0,0,0,0,20,0,5,0,1,0,0,0,0,0,0,0,0,15,1,0,0,0,0,0,0,0,1,0,0,1,40,0,0,1,0,0,0,0,0,0,0,0,2,0,0,0,0,0,0,0,0,0,0,0,0,0,0,0,0,50,0,0,0,0,0,0,16,0,1,50,0,0,10,0,0,0,30,0,0,0,0,0,0,0,0,0,0,0,0,0,0,0,0,0,0,0,0,0,0,0,0,0,0,0,0,0,0,0,0,0,60,0,0
"BEL_005_MZB_LO_111","BEL_005_MZB_LO_111-19.10.2015","19.10.2015",2015,10,19,0,0,0,0,0,0,0,0,0,0,0,150,0,0,0,33,0,0,0,0,0,0,1,0,36,0,0,3,0,91,1,0,0,0,0,0,0,4,0,0,0,0,0,0,0,0,0,1,1,0,0,0,0,0,0,6,0,6,0,2,0,0,0,0,0,4,0,0,0,0,5,0,0,0,0,4,0,0,0,0,5,0,0,51,0,0,49,0,0,0,0,0,0,0,0,0,0,0,0,0,0,0,0,0,0,0,0,0,0,0,0,0,95,0,0,0,0,0,1,0,155,0,93,0,0,15,6,0,2,35,0,0,0,0,0,0,0,0,3,0,0,0,0,0,0,0,0,0,0,11,0,0,0,0,0,0,0,0,0,0,0,0,0,5,0,0
"BEL_005_MZB_LO_111","BEL_005_MZB_LO_111-29.09.2020","29.09.2020",2020,9,29,0,0,0,0,0,0,0,0,0,0,0,1300,0,0,0,78,0,0,0,0,0,0,0,0,26,0,0,1,0,65,0,0,0,0,0,0,0,43,0,0,0,0,0,0,0,0,0,3,0,0,0,0,0,0,0,1,0,7,0,0,0,2,0,0,0,7,0,0,0,0,13,1,0,0,0,3,0,0,0,3,1,0,0,30,0,0,20,0,0,0,0,0,0,0,0,1,0,0,0,0,0,0,0,0,0,0,0,0,0,0,0,0,323,0,0,0,0,0,0,5,5,0,60,0,0,2,5,0,3,16,0,0,0,0,0,37,0,0,0,0,0,0,0,0,0,0,0,4,5,450,0,0,0,0,0,0,0,0,0,0,0,0,0,0,0,0
"BEL_005_MZB_LO_112","BEL_005_MZB_LO_112-09.09.1996","09.09.1996",1996,9,9,0,0,0,0,0,0,0,0,0,0,0,11,0,0,0,11,0,0,0,0,0,0,0,0,0,0,0,0,0,51,0,0,0,0,0,0,0,0,0,0,0,0,0,0,0,0,0,0,0,0,0,0,0,0,0,0,0,0,0,0,0,0,0,0,0,0,0,0,0,0,0,0,0,0,0,2,0,0,0,11,0,0,0,0,0,0,2,0,0,0,0,0,0,0,0,2,0,0,0,0,0,0,0,0,0,0,0,0,0,0,0,0,11,0,0,0,0,0,0,0,0,0,0,0,0,1,0,0,0,0,0,0,0,0,0,1,0,0,0,0,0,0,0,0,0,0,0,0,0,101,0,0,0,0,0,0,0,0,0,0,0,0,0,0,0,0
"BEL_005_MZB_LO_112","BEL_005_MZB_LO_112-04.08.1999","04.08.1999",1999,8,4,0,1,0,0,0,0,0,0,0,0,0,2,0,0,0,11,0,0,0,0,0,0,0,0,0,0,0,0,0,3,0,0,0,0,0,0,0,0,0,0,0,0,0,0,0,0,0,0,1,0,0,0,0,0,0,2,0,1,0,0,2,1,0,0,0,0,0,0,0,0,0,0,0,0,0,0,0,0,0,0,0,0,0,0,0,0,0,0,0,0,0,0,2,1,0,1,0,0,0,0,0,0,0,0,0,0,0,0,0,2,0,0,4,0,0,0,0,0,0,0,0,0,0,0,0,0,0,0,0,0,0,0,0,0,0,0,0,0,0,0,0,0,0,0,0,0,0,0,0,2,0,0,0,0,0,2,0,0,0,0,0,0,0,0,0,0
"BEL_005_MZB_LO_112","BEL_005_MZB_LO_112-08.09.2003","08.09.2003",2003,9,8,0,0,1,0,0,0,0,0,0,0,0,11,0,2,0,11,0,0,0,0,0,0,2,0,11,0,0,5,0,11,0,0,0,0,0,0,0,0,0,0,0,0,0,0,0,0,0,0,1,0,0,0,0,0,1,0,0,6,0,0,11,0,0,0,0,0,0,0,0,0,2,0,0,0,0,4,0,0,0,8,2,0,0,3,0,0,11,0,0,0,0,0,1,0,0,3,0,0,0,0,0,0,0,0,0,0,0,51,0,0,0,0,6,0,0,0,0,0,0,1,0,0,2,0,0,0,0,0,0,0,0,0,0,0,0,0,1,0,0,0,0,0,0,0,0,0,0,0,0,11,0,0,0,0,0,1,0,0,0,0,0,0,0,0,0,0
"BEL_005_MZB_LO_112","BEL_005_MZB_LO_112-01.10.2004","01.10.2004",2004,10,1,0,0,0,0,0,0,0,0,0,0,0,11,0,0,0,11,0,0,0,0,0,0,3,0,11,0,0,3,0,5,0,0,0,0,0,0,0,0,0,0,0,0,0,0,0,0,2,0,0,0,1,0,0,1,0,0,0,6,0,0,11,1,0,0,0,3,0,0,0,0,0,0,0,0,0,0,0,0,0,11,0,0,0,0,0,0,5,0,0,0,0,0,1,3,0,2,0,0,0,0,0,0,0,0,0,0,0,11,0,0,0,0,8,0,0,0,0,0,0,0,0,0,0,0,0,0,0,0,0,0,0,0,0,0,0,4,1,0,0,0,0,0,0,0,0,0,1,0,0,4,0,1,0,0,0,0,0,0,0,0,1,0,0,0,0,0
"BEL_005_MZB_LO_112","BEL_005_MZB_LO_112-18.08.2005","18.08.2005",2005,8,18,0,0,0,0,0,0,0,0,0,0,0,7,0,0,0,70,0,0,0,0,0,0,1,0,14,0,0,0,0,11,2,0,0,0,0,0,0,0,0,0,0,0,0,0,0,0,0,0,20,0,13,0,0,0,0,0,0,2,0,0,20,0,0,0,0,1,0,0,0,0,0,0,0,0,0,1,0,0,0,1,0,0,0,0,0,0,5,0,0,0,0,0,0,0,0,0,0,0,0,0,0,0,0,0,0,0,0,80,0,0,0,0,10,0,0,0,0,0,0,0,0,0,0,0,0,0,2,0,0,0,0,0,0,0,0,0,1,0,0,0,0,0,0,0,0,0,0,0,0,6,0,0,0,0,0,2,0,0,0,0,1,0,0,0,0,0
"BEL_005_MZB_LO_112","BEL_005_MZB_LO_112-20.09.2006","20.09.2006",2006,9,20,0,0,0,0,0,0,0,0,0,0,0,60,0,0,0,26,0,2,0,0,0,0,3,0,26,0,0,0,0,11,0,0,0,0,0,0,0,0,0,0,0,0,0,0,0,0,0,0,0,0,20,0,0,3,0,0,0,7,0,0,20,0,0,0,0,14,0,0,0,0,1,0,0,0,0,1,0,0,0,2,0,0,0,0,0,0,21,0,0,0,0,0,0,3,0,1,0,0,0,0,0,0,0,0,0,0,0,68,0,0,0,0,20,0,0,0,0,0,0,0,0,0,0,0,0,2,2,0,0,0,0,0,0,0,0,10,2,0,0,0,0,0,0,0,0,0,0,0,0,11,0,1,0,0,0,0,0,0,0,0,0,0,0,0,0,0
"BEL_005_MZB_LO_112","BEL_005_MZB_LO_112-12.10.2007","12.10.2007",2007,10,12,0,0,0,0,0,0,0,0,0,0,0,25,0,0,0,20,0,0,0,0,0,0,0,0,34,0,0,0,0,16,0,0,0,0,0,0,0,0,0,0,0,0,0,0,0,0,0,0,0,0,6,0,0,3,0,0,0,3,0,0,20,1,0,0,0,43,0,0,0,0,0,0,0,0,0,3,0,0,0,10,0,0,0,0,0,0,1,0,0,0,0,0,0,3,0,0,0,0,0,0,0,0,0,0,0,0,0,70,0,0,0,0,22,0,0,0,0,0,0,0,0,0,0,0,0,1,0,0,0,2,0,0,0,0,0,2,3,0,0,0,0,0,0,0,0,0,0,0,0,28,0,0,1,0,0,0,0,0,0,0,0,0,0,0,0,0
"BEL_005_MZB_LO_112","BEL_005_MZB_LO_112-20.10.2014","20.10.2014",2014,10,20,0,0,0,0,0,0,0,0,0,0,0,272,0,0,0,15,0,0,0,0,0,0,2,0,41,0,0,2,0,39,0,0,0,0,0,0,0,76,0,0,0,0,0,0,0,0,0,0,0,0,82,1,0,7,0,1,0,39,0,0,0,0,0,0,0,0,0,0,0,0,5,0,0,0,0,2,0,0,0,97,0,0,0,0,0,0,181,0,0,0,0,0,4,0,0,33,0,0,0,0,1,0,0,0,0,0,0,210,0,0,0,0,79,0,0,0,0,0,0,0,0,0,16,0,0,182,0,0,4,0,0,0,0,0,0,1,2,0,0,0,0,0,0,0,0,0,1,0,0,28,0,0,0,0,0,0,0,0,0,0,0,0,0,0,0,0
"BEL_005_MZB_LO_112","BEL_005_MZB_LO_112-24.10.2016","24.10.2016",2016,10,24,0,0,0,0,0,0,0,0,0,0,0,150,0,0,0,12,0,0,0,0,0,0,4,0,60,0,0,0,0,30,0,0,0,0,0,0,0,10,0,0,0,0,0,0,0,0,4,0,0,0,25,0,0,1,0,0,0,3,0,0,3,0,0,0,0,1,0,0,1,0,0,0,0,0,0,17,1,0,4,4,0,0,0,0,0,0,7,0,0,0,0,0,18,8,0,7,0,0,0,0,0,0,0,0,0,0,0,0,0,0,0,0,25,0,0,0,0,0,0,0,0,0,0,0,0,0,0,0,0,0,0,0,0,0,0,3,1,0,0,0,0,0,0,0,0,0,0,0,0,12,0,1,0,0,2,0,0,0,0,0,0,0,0,0,2,0
"BEL_005_MZB_LO_112","BEL_005_MZB_LO_112-29.09.2022","29.09.2022",2022,9,29,0,0,0,0,0,0,0,0,0,0,0,630,0,0,0,45,0,0,0,0,0,0,0,0,175,0,0,8,0,209,6,0,0,0,0,0,0,15,0,0,0,0,1,0,0,0,0,0,6,0,305,8,0,6,0,30,0,17,0,0,50,0,0,0,0,132,0,0,1,0,0,1,0,1,0,3,0,0,0,17,10,0,0,0,0,0,300,0,0,0,0,0,0,2,0,100,0,0,0,0,0,0,0,0,0,0,0,18,0,0,0,1,25,0,0,0,0,0,0,17,0,0,12,0,0,30,1,0,1,65,0,0,0,0,0,1,5,0,2,0,0,0,0,0,0,0,2,0,0,62,0,0,0,0,50,1,0,0,0,0,4,0,0,0,0,0
"BEL_005_MZB_LO_113","BEL_005_MZB_LO_113-22.10.1992","22.10.1992",1992,10,22,0,0,0,0,0,0,0,0,0,0,0,2,0,0,0,2,0,0,0,0,0,0,0,0,0,0,0,0,0,11,0,0,0,0,0,0,0,0,0,0,0,0,0,0,0,0,0,0,2,1,0,0,0,0,0,0,0,0,0,2,0,0,0,0,0,0,0,0,2,0,2,0,0,0,0,0,0,0,0,0,0,0,0,0,0,0,0,0,0,0,0,0,0,2,0,1,0,0,0,0,0,0,0,0,0,0,0,0,1,0,0,0,13,0,0,0,0,0,0,0,0,0,1,0,0,0,0,0,0,0,0,0,0,0,0,0,0,0,0,0,0,0,0,0,0,0,0,0,2,0,0,0,0,0,0,0,0,0,0,1,2,0,0,0,0,0
"BEL_005_MZB_LO_113","BEL_005_MZB_LO_113-02.10.1995","02.10.1995",1995,10,2,0,0,0,0,0,0,0,0,0,0,0,2,0,0,0,0,0,0,0,0,0,0,0,0,0,0,0,0,0,2,0,0,0,0,0,0,0,0,0,0,0,0,0,0,0,0,0,0,1,0,0,0,0,0,0,0,0,0,0,0,0,0,0,0,0,0,0,0,1,0,0,0,0,0,0,0,0,0,0,2,0,0,0,0,0,0,0,0,0,0,0,0,0,0,0,2,0,0,0,0,0,0,0,0,0,0,0,0,0,0,0,0,51,0,0,0,0,0,0,0,0,0,2,0,0,0,0,0,0,0,0,0,0,0,0,0,0,0,0,0,0,0,0,0,0,0,0,2,11,1,0,0,0,0,0,0,0,0,0,0,0,0,0,0,0,0
"BEL_005_MZB_LO_113","BEL_005_MZB_LO_113-02.09.1998","02.09.1998",1998,9,2,0,0,0,0,0,0,0,0,0,0,0,2,0,0,0,11,0,2,0,0,0,0,0,0,0,0,0,0,0,11,0,0,0,0,0,0,0,0,0,0,0,0,0,0,0,0,0,0,2,0,0,0,0,0,0,0,0,0,0,0,0,0,0,0,0,2,0,0,1,0,2,0,0,0,0,2,0,0,0,2,0,0,0,0,0,0,0,0,0,0,0,0,1,2,0,0,0,0,0,0,0,0,0,0,0,0,0,0,0,0,0,0,13,0,0,0,0,0,0,0,0,0,1,0,0,0,0,0,0,0,0,0,0,0,0,0,0,0,0,0,0,0,0,0,0,0,0,1,0,11,0,11,0,0,0,0,0,0,0,0,1,0,0,0,0,0
"BEL_005_MZB_LO_113","BEL_005_MZB_LO_113-28.08.2000","28.08.2000",2000,8,28,0,0,0,0,0,0,0,0,0,0,0,7,0,3,0,11,0,0,0,0,0,0,0,0,0,0,0,0,0,11,0,0,0,0,0,0,0,0,0,0,0,0,0,0,0,0,0,0,1,0,0,0,0,0,0,0,0,0,0,1,0,0,0,0,0,0,0,0,0,0,1,0,0,0,1,2,0,0,0,2,0,0,0,0,0,0,0,0,0,0,0,0,0,0,0,3,0,0,0,0,0,0,0,0,0,0,0,0,0,0,0,1,16,0,0,0,0,0,0,0,0,0,3,0,0,1,0,0,0,0,0,0,0,0,0,0,0,0,0,0,0,0,0,0,0,0,0,0,0,6,0,4,0,0,0,0,0,0,0,0,1,0,0,0,0,0
"BEL_005_MZB_LO_113","BEL_005_MZB_LO_113-23.08.2002","23.08.2002",2002,8,23,0,0,0,0,0,0,0,0,0,0,0,11,0,0,0,11,0,0,0,0,0,0,0,0,0,0,0,1,0,11,0,0,0,0,0,0,0,0,0,0,0,0,0,0,0,0,0,0,2,0,0,0,0,0,2,0,0,0,0,4,0,0,0,0,0,1,0,0,4,0,0,0,0,0,0,0,0,0,0,7,1,0,0,0,0,0,2,0,0,0,0,0,2,1,0,0,0,0,0,0,0,0,0,0,0,0,1,6,0,0,0,0,14,0,0,0,0,0,0,11,0,0,11,0,0,4,0,0,0,0,0,0,0,0,0,0,0,0,0,0,0,0,0,0,0,0,0,2,0,51,0,0,0,0,0,0,0,0,0,0,0,0,0,0,0,0
"BEL_005_MZB_LO_113","BEL_005_MZB_LO_113-01.10.2004","01.10.2004",2004,10,1,0,0,0,0,0,0,0,0,0,0,0,51,0,0,0,11,0,2,0,0,0,0,0,0,11,0,0,1,0,7,2,0,0,0,0,0,0,0,0,0,0,0,0,0,0,0,0,0,1,0,0,0,0,0,0,0,0,1,0,4,11,1,0,0,0,6,0,0,0,0,0,0,0,0,0,2,0,0,0,4,0,0,0,0,0,0,2,0,0,0,0,0,0,0,0,3,0,0,0,0,0,0,0,0,0,0,0,11,0,2,0,0,64,0,0,0,0,0,0,0,0,0,11,0,0,3,0,0,0,4,0,0,0,0,0,1,0,0,0,0,0,0,0,0,0,0,0,1,0,2,0,11,0,0,0,0,0,0,0,0,0,0,0,0,0,0
"BEL_005_MZB_LO_113","BEL_005_MZB_LO_113-22.09.2006","22.09.2006",2006,9,22,0,0,0,0,0,0,0,3,0,0,0,38,0,1,0,41,0,0,0,0,0,0,0,0,5,0,0,2,0,29,0,0,0,0,0,0,0,0,0,0,0,0,0,0,0,0,0,0,3,0,1,0,0,0,0,0,0,2,0,4,20,4,0,0,0,20,0,0,0,0,1,0,0,0,0,2,0,0,0,21,0,0,0,0,0,0,17,0,0,0,0,0,0,1,0,1,0,0,0,0,0,0,0,0,0,0,0,43,0,0,0,0,30,0,0,0,0,0,0,0,0,0,0,0,0,0,0,0,0,1,0,0,0,0,0,0,2,0,0,0,0,0,0,0,0,0,0,0,0,68,0,60,0,0,0,0,0,0,0,1,1,0,0,0,0,0
"BEL_005_MZB_LO_113","BEL_005_MZB_LO_113-25.09.2008","25.09.2008",2008,9,25,0,0,0,0,0,0,0,1,0,0,0,25,0,2,0,80,0,0,0,0,0,0,0,0,4,0,0,0,0,7,0,0,0,0,0,0,0,0,0,0,0,0,0,0,0,0,0,0,1,0,0,0,0,0,0,0,0,15,0,9,21,1,0,0,0,5,0,0,0,0,1,0,0,0,0,4,0,0,1,20,1,0,0,0,0,0,3,0,0,0,0,0,0,2,0,3,0,0,0,0,0,0,0,0,0,0,0,10,0,0,0,0,4,0,0,0,0,0,0,0,12,0,60,0,0,0,0,0,0,0,0,0,0,0,0,1,0,0,0,0,0,0,0,0,0,0,0,2,10,16,0,20,0,0,0,0,0,0,0,1,0,0,0,0,0,0
"BEL_005_MZB_LO_113","BEL_005_MZB_LO_113-09.10.2013","09.10.2013",2013,10,9,0,0,0,0,0,0,0,3,0,0,0,50,0,0,0,15,0,0,0,0,0,0,0,0,15,0,0,0,0,10,0,0,0,0,0,0,0,0,0,0,0,0,0,0,0,0,0,0,2,0,0,0,0,1,0,0,0,25,0,50,20,0,0,0,0,5,0,0,0,0,0,0,0,0,0,0,0,0,0,25,0,0,0,0,0,0,15,0,0,0,0,0,0,0,0,0,0,0,0,0,0,0,0,0,0,0,0,20,0,1,0,0,10,0,0,0,0,0,0,2,0,0,0,0,0,18,0,0,0,4,0,0,0,0,0,0,0,0,0,0,0,0,0,0,0,0,0,10,20,15,0,25,0,0,0,0,0,0,0,0,0,0,0,0,0,0
"BEL_005_MZB_LO_113","BEL_005_MZB_LO_113-20.10.2014","20.10.2014",2014,10,20,0,0,0,0,0,0,0,1,0,0,0,1800,0,0,0,34,0,1,0,0,0,0,0,0,19,0,0,0,0,116,0,0,0,0,0,0,0,300,0,0,0,0,0,0,0,0,0,0,1,0,0,1,0,0,0,0,0,161,0,3000,10,3,0,0,0,40,0,0,0,0,1,0,0,0,0,7,0,0,0,7,0,0,0,0,0,0,16,0,0,0,0,0,8,2,0,4,0,0,0,0,0,0,0,0,0,0,0,13,0,0,0,0,80,0,0,0,0,0,0,0,12,0,30,0,0,15,0,0,0,9,0,0,0,0,0,0,2,0,0,0,0,0,0,0,0,0,15,39,3,600,0,200,0,0,0,0,0,0,0,0,0,0,0,0,1,0
"BEL_005_MZB_LO_113","BEL_005_MZB_LO_113-16.10.2017","16.10.2017",2017,10,16,0,0,0,0,0,0,0,0,0,0,0,18,0,0,0,6,0,2,0,0,0,0,0,0,45,0,0,6,0,21,1,0,0,0,0,0,0,67,0,0,0,0,0,1,0,0,0,0,0,0,0,0,0,0,0,0,0,7,0,16,3,0,0,0,0,9,0,0,0,0,0,0,0,0,0,1,0,0,2,0,2,0,0,0,0,0,0,0,0,0,0,0,4,0,0,8,0,0,0,0,0,0,0,0,0,0,0,19,0,0,0,0,38,0,0,0,0,0,0,0,9,2,12,0,0,6,0,0,0,1,0,0,0,0,0,4,0,0,0,0,0,0,0,0,0,0,1,2,0,1,0,0,0,0,0,0,0,0,0,0,1,0,0,0,0,0
"BEL_005_MZB_LO_113","BEL_005_MZB_LO_113-12.10.2022","12.10.2022",2022,10,12,0,0,0,0,0,0,0,0,0,0,0,68,0,0,0,0,0,0,1,0,0,0,0,0,29,0,0,0,0,61,0,0,0,0,0,0,0,33,2,0,0,0,7,2,0,0,0,1,0,0,0,4,0,0,0,1,0,11,0,2,0,1,0,0,0,5,0,0,0,0,0,0,0,1,0,5,0,0,2,4,0,0,0,2,0,0,5,0,0,0,0,0,1,0,0,2,0,0,0,0,0,0,0,0,0,0,0,1,0,0,0,1,57,0,0,0,0,0,0,0,1,4,4,0,0,26,1,0,0,3,0,0,0,0,0,1,0,0,0,0,0,0,0,0,0,0,0,1,2,86,0,0,0,0,0,0,0,0,0,0,0,0,0,0,0,0
"BEL_005_MZB_LO_114","BEL_005_MZB_LO_114-12.10.1994","12.10.1994",1994,10,12,0,0,0,0,0,0,0,0,0,0,0,2,0,0,0,0,0,0,2,0,0,0,11,0,0,0,0,2,0,112,101,0,0,0,0,0,0,0,0,0,0,0,0,0,0,0,0,0,0,0,0,0,0,0,0,0,0,0,0,0,0,1,0,0,0,0,0,0,0,0,2,0,0,0,0,0,0,0,0,0,0,0,0,0,0,0,0,0,0,0,0,0,0,0,0,0,0,0,0,0,0,0,0,0,0,0,0,0,0,0,0,0,101,0,0,0,0,0,0,0,0,0,0,0,0,11,0,0,0,0,0,0,0,0,0,0,0,0,0,0,0,0,0,0,0,0,0,0,0,0,0,0,0,0,0,0,0,0,0,1,0,0,0,11,0,0
"BEL_005_MZB_LO_114","BEL_005_MZB_LO_114-15.10.1998","15.10.1998",1998,10,15,0,0,0,0,0,0,0,0,0,0,0,2,0,0,0,0,0,0,2,0,0,0,0,0,0,0,0,0,0,2,2,0,0,0,0,0,0,0,0,0,0,0,0,0,0,0,0,0,0,0,0,0,0,0,0,0,0,2,0,2,0,2,0,0,0,0,0,0,0,0,2,0,0,0,0,0,0,0,0,0,0,0,0,0,0,0,0,0,0,0,0,0,0,0,0,2,0,0,0,0,0,0,0,0,0,0,0,0,0,0,0,0,6,0,0,0,0,0,0,2,0,0,0,0,0,8,0,0,0,0,0,0,0,0,0,1,0,0,0,0,0,0,0,0,0,0,0,1,0,0,0,0,0,0,0,0,0,0,0,2,2,0,0,0,0,0
"BEL_005_MZB_LO_114","BEL_005_MZB_LO_114-02.10.2002","02.10.2002",2002,10,2,0,0,0,0,2,1,0,0,0,0,0,2,0,0,0,0,0,0,101,0,0,0,0,0,0,0,0,0,0,13,11,2,0,0,0,0,0,0,1,0,0,0,0,0,0,0,1,51,2,0,0,0,0,0,0,0,0,2,0,0,0,11,0,0,0,0,0,0,0,0,51,1,0,1,0,0,0,0,2,0,0,0,0,51,0,0,0,0,0,0,0,0,0,0,0,11,0,1,0,0,0,0,0,0,0,0,0,0,0,0,0,0,114,0,0,0,0,0,0,2,0,0,11,0,0,97,0,0,1,0,0,0,0,0,0,0,0,0,0,0,0,0,0,0,0,0,0,2,2,0,0,11,1,0,0,0,0,0,0,1,2,0,0,101,0,0
"BEL_005_MZB_LO_114","BEL_005_MZB_LO_114-03.10.2003","03.10.2003",2003,10,3,0,0,0,0,0,0,0,0,0,0,0,0,0,0,0,0,0,0,2,0,0,0,2,0,0,0,0,0,0,101,51,2,0,0,0,0,0,0,2,0,0,0,0,0,0,0,0,0,2,0,0,0,0,0,0,0,0,1,0,0,0,2,0,0,0,0,0,0,0,0,1,0,0,0,0,2,0,0,0,0,0,0,2,11,0,0,0,0,0,0,0,0,0,0,0,2,0,0,0,0,0,0,0,0,0,0,0,0,0,0,0,1,22,0,0,0,0,0,0,0,0,2,0,0,0,2,0,0,0,0,0,0,0,0,0,0,0,0,0,0,0,0,0,0,0,0,0,0,11,0,0,0,0,0,0,0,0,0,0,0,0,0,0,0,0,0
"BEL_005_MZB_LO_114","BEL_005_MZB_LO_114-25.08.2004","25.08.2004",2004,8,25,0,2,0,0,1,0,0,0,0,0,0,11,0,0,0,0,0,0,51,0,0,0,1,0,0,0,0,1,0,101,101,0,0,0,0,0,0,2,11,0,0,0,0,0,0,0,0,51,2,0,0,0,0,0,0,0,0,2,0,0,2,11,0,0,0,0,0,0,0,0,11,2,0,0,0,0,0,0,11,0,0,0,2,11,0,0,2,0,0,0,0,0,0,0,0,11,0,0,0,0,0,0,0,0,0,0,0,0,0,0,0,11,62,0,0,0,0,0,0,2,0,11,0,0,0,39,0,0,0,0,0,0,0,0,0,0,0,0,0,0,0,0,0,0,1,0,0,1,0,0,0,11,0,0,0,0,0,0,0,2,0,0,0,51,0,0
"BEL_005_MZB_LO_115","BEL_005_MZB_LO_115-01.08.1991","01.08.1991",1991,8,1,0,0,0,0,0,0,0,0,0,0,0,51,0,0,0,0,0,0,1,0,0,0,0,0,0,0,0,0,0,112,0,0,0,0,0,0,0,0,0,0,0,0,0,0,0,0,0,0,0,0,0,0,0,0,0,0,0,0,0,0,0,1,0,0,0,0,0,0,0,0,51,0,0,0,0,2,0,0,0,0,0,0,0,0,0,0,0,0,0,0,0,0,0,0,0,0,0,0,0,0,0,0,0,0,0,0,0,0,0,0,0,0,112,0,0,0,0,0,0,0,0,0,0,0,0,3,0,0,0,0,0,0,0,0,0,0,0,0,0,0,0,0,0,0,0,0,0,0,0,0,0,0,0,0,0,0,0,0,0,0,0,0,0,0,0,0
"BEL_005_MZB_LO_115","BEL_005_MZB_LO_115-03.06.1992","03.06.1992",1992,6,3,2,0,0,0,0,0,0,0,0,0,0,101,0,0,11,0,0,0,11,0,0,0,0,0,0,0,0,0,0,22,0,0,0,0,0,0,0,0,0,0,0,0,0,0,0,0,0,0,0,0,0,0,0,0,0,0,0,0,0,0,0,2,0,0,0,0,0,0,0,0,51,11,0,0,0,0,0,0,0,0,0,0,0,0,0,0,0,1,0,0,0,0,0,0,0,0,0,0,0,0,0,0,0,0,0,0,0,0,0,0,0,0,112,0,0,0,0,0,0,2,0,1,0,0,0,13,0,0,1,0,0,0,0,0,0,0,0,0,0,0,0,0,0,0,0,0,0,0,0,0,0,0,0,0,0,0,0,0,0,0,2,0,0,0,0,0
"BEL_005_MZB_LO_115","BEL_005_MZB_LO_115-29.08.1993","29.08.1993",1993,8,29,0,0,0,0,0,0,0,0,0,0,0,11,0,0,2,0,0,0,0,0,0,0,0,0,0,0,0,0,0,51,0,0,0,0,0,0,0,0,0,0,0,0,0,0,0,0,0,0,0,0,0,0,0,0,0,0,0,2,0,11,0,0,0,1,0,0,0,0,0,0,2,2,0,0,0,0,0,0,0,0,0,0,0,0,0,0,0,0,0,0,0,0,0,0,0,0,0,0,0,0,0,0,0,0,0,0,0,0,0,0,0,0,2,0,0,0,0,0,0,0,0,0,0,0,0,6,0,0,0,0,0,0,0,0,0,0,0,0,0,0,0,0,0,0,0,0,0,0,0,0,0,0,0,0,0,0,0,0,0,0,0,0,0,0,0,0
"BEL_005_MZB_LO_115","BEL_005_MZB_LO_115-30.06.1994","30.06.1994",1994,6,30,0,0,0,0,0,0,0,0,0,0,0,1001,0,0,0,0,0,0,51,0,0,0,0,0,0,11,0,0,0,51,0,0,0,0,0,0,0,0,0,0,0,0,0,0,0,0,0,2,0,0,0,0,0,0,0,0,0,11,0,0,0,11,0,0,0,0,0,0,0,0,11,0,0,0,0,0,0,0,0,0,0,0,0,0,0,0,0,0,0,0,0,0,0,0,0,0,0,0,0,0,0,0,0,0,0,0,0,0,0,0,0,0,6,0,0,0,0,0,0,0,0,2,0,0,0,12,0,0,0,0,0,1,0,0,0,0,0,0,0,0,0,0,0,0,0,0,0,0,0,0,0,0,0,0,0,0,0,0,0,0,0,0,0,0,0,0
"BEL_005_MZB_LO_115","BEL_005_MZB_LO_115-01.07.2020","01.07.2020",2020,7,1,0,0,0,0,0,0,0,0,0,0,0,0,0,0,0,0,0,0,10,0,0,0,0,0,0,3,0,0,0,15,0,0,0,0,0,0,120,0,0,0,0,0,0,0,0,50,0,0,0,0,0,0,0,0,0,0,0,1,0,210,0,0,0,0,0,0,0,0,0,0,0,0,0,0,0,0,0,0,0,13,0,0,0,0,0,0,0,0,0,0,0,0,0,0,0,0,0,0,0,0,0,0,0,0,0,0,0,0,0,0,0,0,0,0,0,0,0,0,0,0,0,0,0,0,0,0,0,0,0,0,0,0,0,0,0,0,0,0,0,0,0,0,0,0,0,0,0,0,0,0,0,0,0,0,0,0,0,0,0,0,0,0,0,0,0,0
"BEL_005_MZB_LO_116","BEL_005_MZB_LO_116-01.08.1991","01.08.1991",1991,8,1,0,0,0,0,0,0,0,0,0,0,0,11,0,0,0,2,0,0,0,0,0,0,0,0,0,0,0,1,0,0,0,0,0,0,0,0,0,0,0,0,0,0,0,0,0,0,0,2,2,0,0,0,0,0,0,0,0,0,0,51,0,2,0,0,0,0,0,0,2,0,2,0,0,0,0,0,0,0,0,11,0,0,0,0,0,0,0,0,0,0,0,0,0,11,0,11,0,0,0,0,0,0,0,0,0,0,0,0,0,0,0,0,62,0,0,0,0,0,0,0,0,0,11,0,0,4,0,0,0,0,0,11,0,0,0,1,0,0,0,0,0,0,0,0,0,0,0,11,2,0,0,11,0,0,0,0,0,0,0,0,0,0,0,2,0,0
"BEL_005_MZB_LO_116","BEL_005_MZB_LO_116-09.07.1992","09.07.1992",1992,7,9,0,0,0,0,0,0,0,0,0,0,0,11,0,0,0,51,0,0,0,0,0,0,0,0,0,0,0,2,0,51,0,0,0,0,0,0,0,0,0,0,0,0,2,0,0,0,0,1,1,0,0,0,0,0,0,0,0,11,0,11,0,51,0,0,0,0,0,0,2,0,0,0,0,0,0,0,0,0,0,11,0,0,0,0,0,0,0,0,0,0,0,0,0,2,0,0,0,0,0,0,0,0,0,0,0,0,0,0,0,0,0,0,62,0,0,0,0,0,0,0,0,0,11,0,0,2,0,0,0,0,0,51,0,0,0,0,0,0,0,0,0,0,0,0,0,0,0,2,0,0,0,51,0,0,0,0,0,0,0,0,0,0,0,11,0,0
"BEL_005_MZB_LO_116","BEL_005_MZB_LO_116-03.06.1993","03.06.1993",1993,6,3,0,0,0,0,0,0,0,0,0,0,0,11,0,0,0,11,0,0,0,0,0,0,0,0,0,0,0,1,0,12,0,0,0,0,0,0,0,0,0,0,0,0,1,0,0,0,0,2,2,0,0,0,0,0,0,0,1,2,0,101,0,2,0,0,0,0,0,0,0,0,2,0,0,0,0,0,0,0,0,11,1,0,0,0,0,0,0,0,0,0,0,0,0,2,0,2,0,0,0,0,0,0,0,0,0,0,0,0,0,0,0,0,11,0,0,0,0,0,0,0,0,0,2,0,0,2,0,0,0,0,0,2,0,0,0,0,0,0,0,0,0,0,0,0,0,0,0,0,0,0,0,2,2,0,0,0,0,0,0,1,2,0,2,0,0,0
"BEL_005_MZB_LO_116","BEL_005_MZB_LO_116-08.06.1995","08.06.1995",1995,6,8,0,0,0,0,0,0,0,0,0,0,0,11,0,0,0,101,0,0,11,0,0,0,0,0,0,0,0,0,0,13,0,0,0,0,0,0,0,0,0,0,0,0,0,0,0,0,0,0,0,0,0,1,0,0,0,0,0,2,0,51,0,2,0,0,0,0,0,0,0,0,0,0,0,0,0,0,0,0,1,0,0,0,0,2,0,0,0,0,0,0,0,0,0,2,0,0,0,0,0,0,0,0,0,0,0,0,0,0,0,0,0,0,114,0,0,0,0,0,0,0,0,0,0,0,0,1,0,0,0,0,0,11,0,0,0,0,0,0,0,0,0,0,0,0,0,0,0,2,0,0,0,0,0,0,0,0,0,0,0,0,0,0,0,11,0,0
"BEL_005_MZB_LO_116","BEL_005_MZB_LO_116-05.06.1998","05.06.1998",1998,6,5,0,0,0,0,0,0,0,0,0,0,0,2,0,0,0,11,0,0,2,0,0,0,0,0,0,0,0,2,0,13,0,0,0,0,0,0,0,0,0,0,0,0,0,0,0,0,0,1,2,0,0,0,0,0,0,0,0,2,0,11,0,1,0,0,0,0,0,0,2,0,0,0,0,0,0,0,0,0,0,0,0,0,0,0,0,0,0,0,0,0,0,0,0,0,0,11,0,0,0,0,0,0,0,0,0,0,0,0,0,0,0,0,13,0,0,0,0,0,0,0,0,0,11,0,0,2,0,0,0,0,0,0,0,0,0,0,0,0,0,0,0,0,0,0,0,0,0,1,0,1,0,0,0,0,0,0,0,0,0,0,0,0,0,2,0,0
"BEL_005_MZB_LO_116","BEL_005_MZB_LO_116-22.06.2001","22.06.2001",2001,6,22,2,0,0,0,0,0,0,0,0,0,0,3,0,0,0,11,0,0,2,0,0,0,0,0,2,0,0,1,0,11,0,0,0,0,0,0,0,0,0,0,0,0,0,0,0,0,0,0,0,0,0,0,0,0,0,0,0,0,0,11,0,0,0,0,0,0,0,0,0,0,0,0,0,0,0,0,0,0,0,11,2,0,0,2,0,0,0,0,0,0,0,0,0,4,0,8,0,0,0,0,0,0,0,0,0,0,0,0,0,0,0,0,5,0,0,0,0,0,0,7,0,0,0,0,0,1,0,0,0,0,0,0,0,0,0,0,0,0,0,0,0,0,0,0,0,0,0,1,0,11,0,0,0,0,0,0,0,0,0,0,1,0,0,2,0,0
"BEL_005_MZB_LO_116","BEL_005_MZB_LO_116-19.08.2010","19.08.2010",2010,8,19,0,0,0,0,0,0,0,0,0,0,0,18,0,0,0,4,0,0,12,0,0,0,0,0,10,0,0,0,0,78,0,0,0,0,0,0,0,0,0,0,0,0,0,0,0,0,0,0,1,0,0,0,0,0,0,0,0,2,0,60,0,0,0,0,0,0,0,0,0,0,0,1,0,0,0,0,0,0,0,7,0,0,0,0,0,0,0,0,0,0,0,0,2,1,0,0,0,0,0,1,0,0,0,0,0,0,0,0,0,0,0,1,22,0,0,0,0,0,0,0,0,0,0,0,0,4,0,0,0,1,0,0,0,0,0,0,0,0,0,0,0,0,0,0,0,0,0,6,5,10,0,6,0,0,0,0,0,0,0,0,0,0,0,11,0,0
"BEL_005_MZB_LO_118","BEL_005_MZB_LO_118-01.06.1994","01.06.1994",1994,6,1,0,0,0,0,0,0,0,0,0,0,0,0,0,0,0,2,0,0,0,0,0,0,0,0,0,0,0,0,0,2,0,0,0,0,0,0,0,0,0,0,0,0,0,0,0,0,0,0,0,0,0,0,0,0,0,0,0,0,0,11,0,0,0,0,0,0,0,0,0,0,0,0,1,0,0,0,0,0,0,2,0,0,0,0,0,0,0,0,0,0,0,0,2,2,0,0,0,0,0,0,0,0,0,0,0,0,0,0,0,0,0,0,13,0,0,0,0,0,0,0,0,0,2,0,0,1,0,0,0,0,0,0,0,0,0,0,0,0,0,0,0,0,0,0,2,0,0,2,0,0,0,0,0,0,0,0,0,0,0,0,0,0,0,0,0,0
"BEL_005_MZB_LO_118","BEL_005_MZB_LO_118-02.06.1998","02.06.1998",1998,6,2,0,0,0,0,0,0,0,0,0,0,0,0,0,0,0,2,0,0,0,0,0,0,0,0,0,0,0,0,0,11,0,0,0,0,0,0,0,0,0,0,0,0,0,0,0,0,0,2,0,0,0,0,0,0,0,0,0,2,0,11,0,1,0,0,1,0,0,0,1,0,0,0,0,0,0,0,0,0,0,0,0,0,0,0,0,0,11,0,0,0,0,0,2,11,0,2,0,0,0,0,0,0,0,0,0,0,0,0,0,0,0,0,4,0,0,0,0,0,0,0,0,0,11,0,0,0,0,0,0,0,0,2,0,0,0,2,0,0,0,0,0,2,0,0,0,0,0,2,0,2,0,0,0,0,0,0,0,0,0,0,0,0,0,0,2,0
"BEL_005_MZB_LO_118","BEL_005_MZB_LO_118-14.05.1999","14.05.1999",1999,5,14,0,0,0,0,0,0,0,0,0,0,0,0,0,0,0,41,0,11,0,0,0,0,1,0,0,0,0,0,0,7,0,0,0,0,0,0,0,0,0,0,0,0,0,0,0,0,0,2,0,0,0,0,0,0,0,0,0,7,0,41,0,2,0,0,0,0,0,0,0,0,0,0,1,0,0,2,0,0,0,0,0,0,0,0,0,0,0,0,0,0,0,0,11,7,0,7,0,0,0,0,0,0,0,0,0,0,0,0,0,0,0,0,44,0,0,0,0,0,0,0,0,0,2,0,0,0,0,0,0,0,0,1,0,0,0,0,0,0,0,0,0,7,0,0,0,0,0,0,0,41,0,0,0,0,0,0,0,0,0,0,0,0,0,0,0,0
"BEL_005_MZB_LO_118","BEL_005_MZB_LO_118-14.06.2004","14.06.2004",2004,6,14,0,0,0,0,0,0,0,0,0,0,0,0,0,0,0,8,0,0,0,0,0,0,0,0,0,0,0,3,0,52,0,0,0,0,0,0,0,0,0,0,0,0,0,0,0,0,0,0,0,0,0,1,0,0,0,0,0,0,0,11,0,0,0,0,0,0,0,0,0,0,0,0,0,0,0,0,0,0,3,1,0,0,0,0,0,0,0,0,0,0,0,0,8,26,0,0,0,0,0,0,0,0,0,0,0,0,0,0,0,0,0,0,9,0,0,0,0,0,0,0,0,0,2,0,0,0,0,0,0,0,0,0,0,0,0,1,0,0,0,0,0,0,0,0,0,1,2,1,0,1,0,0,0,0,0,0,0,0,0,0,2,0,0,0,2,0
"BEL_005_MZB_LO_118","BEL_005_MZB_LO_118-09.05.2008","09.05.2008",2008,5,9,0,0,0,0,0,0,0,0,0,0,0,0,0,0,0,25,0,0,0,0,0,0,0,0,0,0,0,0,0,40,0,0,0,0,0,0,0,0,0,0,0,0,0,0,0,0,0,1,0,0,3,0,0,0,0,0,0,0,0,90,0,0,0,0,0,0,0,0,1,0,0,0,0,0,0,2,0,0,0,1,0,0,0,0,0,0,0,0,0,0,0,0,45,3,0,0,0,0,0,0,0,0,0,0,0,0,0,0,0,0,0,0,6,0,0,0,0,0,0,0,0,0,20,0,0,0,0,0,0,0,0,2,0,0,0,0,1,0,0,0,0,0,0,0,0,1,13,0,0,0,0,0,1,0,0,0,0,0,0,0,1,0,0,0,3,0
"BEL_005_MZB_LO_118","BEL_005_MZB_LO_118-08.07.2021","08.07.2021",2021,7,8,0,0,0,0,0,0,0,0,0,0,0,0,0,0,0,9,0,0,0,0,0,0,0,0,0,0,0,0,0,37,0,0,0,0,0,0,0,16,0,0,0,0,0,0,0,0,1,0,0,0,0,0,0,0,0,0,0,0,0,50,0,1,0,0,0,2,0,0,0,0,0,0,0,0,0,0,0,0,3,0,0,0,0,0,0,0,0,0,0,0,0,0,40,6,0,0,0,0,0,0,0,0,0,0,0,0,0,0,0,0,0,0,18,0,0,0,0,0,0,0,0,0,3,0,0,0,0,0,0,0,0,250,0,0,0,0,0,0,0,0,0,0,0,0,0,0,4,0,0,56,0,0,0,0,0,0,0,0,0,0,0,0,0,0,10,0
"BEL_005_MZB_LO_119","BEL_005_MZB_LO_119-09.08.1995","09.08.1995",1995,8,9,0,2,0,0,0,0,0,0,0,0,0,0,0,0,0,0,0,0,2,0,0,0,0,0,0,0,0,0,0,11,0,0,0,0,0,0,0,0,0,0,0,0,0,0,0,0,0,0,11,0,0,0,0,0,0,0,0,0,2,0,0,11,0,0,0,0,0,0,0,0,11,0,0,0,0,0,1,0,1,0,0,0,0,0,0,0,0,0,0,0,0,0,0,0,0,2,0,0,0,0,0,0,0,0,0,0,0,0,0,0,0,0,15,0,0,0,0,0,0,0,0,0,1,0,0,33,1,0,0,0,0,0,0,0,0,0,0,0,0,0,0,0,0,0,0,0,0,0,11,0,0,0,0,0,0,0,0,0,0,0,0,0,0,2,0,0
"BEL_005_MZB_LO_119","BEL_005_MZB_LO_119-29.08.1997","29.08.1997",1997,8,29,0,0,0,0,0,0,0,0,0,0,0,11,0,0,0,0,0,0,0,0,0,0,0,0,0,0,0,0,0,13,0,0,0,0,0,0,0,0,11,0,0,0,0,0,0,0,0,0,1,0,0,0,0,0,0,0,0,1,0,0,0,0,0,0,0,0,0,0,0,0,11,0,0,0,0,0,0,0,0,0,0,0,0,0,0,0,0,0,0,0,0,0,0,0,0,11,0,0,0,0,0,0,0,0,0,0,0,0,0,1,0,1,53,0,0,0,0,0,0,11,0,0,0,0,0,0,0,0,0,0,0,0,0,0,0,0,0,0,0,0,0,0,0,0,0,0,0,0,0,0,0,0,0,0,0,0,0,0,0,0,0,0,0,0,0,0
"BEL_005_MZB_LO_119","BEL_005_MZB_LO_119-05.08.2003","05.08.2003",2003,8,5,0,0,0,0,0,0,0,0,0,0,0,11,0,0,0,0,0,0,0,0,0,0,0,0,0,0,0,0,0,11,26,5,0,0,0,0,0,0,0,0,0,0,0,0,0,0,0,0,4,0,0,0,0,0,0,0,0,0,0,0,0,5,0,0,0,0,0,0,0,0,26,0,0,0,0,0,0,0,6,0,0,0,1,0,0,0,0,0,0,0,0,0,0,0,0,0,0,0,0,0,0,0,0,0,0,0,0,0,0,0,4,1,7,0,0,0,0,0,0,0,0,0,0,0,0,2,0,0,0,0,0,0,0,0,0,0,0,0,0,0,0,0,0,0,0,7,0,0,11,0,0,0,0,0,0,0,0,0,0,0,0,0,0,1,0,0
"BEL_005_MZB_LO_119","BEL_005_MZB_LO_119-09.08.2005","09.08.2005",2005,8,9,0,0,0,0,0,0,0,0,0,0,0,23,0,0,0,3,0,0,0,0,0,0,0,0,0,0,0,0,0,15,0,0,0,0,0,0,0,0,0,0,0,0,0,0,0,0,0,0,0,0,0,0,0,0,0,0,0,0,0,0,0,6,0,0,0,0,0,0,3,0,28,0,0,0,0,0,0,0,0,0,0,0,0,0,0,0,0,0,0,0,0,0,0,0,0,0,0,0,0,0,0,0,0,0,0,0,0,0,0,0,0,0,5,0,0,0,0,0,0,0,0,0,0,0,0,2,0,0,0,0,0,0,0,0,0,0,0,1,0,0,0,0,0,0,0,0,0,0,3,0,0,0,0,0,0,0,0,0,0,0,0,0,0,0,0,0
"BEL_005_MZB_LO_119","BEL_005_MZB_LO_119-11.10.2006","11.10.2006",2006,10,11,28,1,0,0,0,0,0,0,0,0,0,14,0,0,0,0,0,0,0,0,0,0,0,0,0,0,0,0,1,42,72,2,0,0,0,0,0,0,0,0,0,0,0,0,0,0,0,0,4,0,0,0,0,0,0,0,0,0,0,0,0,5,0,0,0,0,0,0,0,0,11,0,0,0,0,0,0,0,0,0,0,0,0,3,0,0,0,0,0,0,0,0,0,0,0,0,0,0,0,0,0,0,0,0,0,0,0,0,0,0,0,21,4,0,0,0,0,0,0,0,46,0,0,0,0,1,0,0,0,0,0,0,0,0,0,3,0,0,0,0,0,0,0,0,0,0,0,0,12,0,0,0,0,0,0,0,0,0,0,1,0,0,0,30,0,0
"BEL_005_MZB_LO_119","BEL_005_MZB_LO_119-06.09.2007","06.09.2007",2007,9,6,60,0,0,0,0,0,0,0,0,0,0,25,0,0,0,0,0,0,0,0,0,0,0,0,0,0,0,0,0,95,2,5,0,0,0,0,0,0,0,0,0,0,0,1,0,0,0,0,2,0,0,0,0,0,0,0,0,0,0,0,0,9,0,0,0,0,0,0,1,0,17,0,0,0,0,0,0,0,0,0,0,0,0,0,0,0,0,0,0,0,0,0,0,0,0,0,0,0,0,0,0,0,0,0,0,0,0,0,0,0,0,3,3,0,0,0,0,0,0,0,7,0,0,0,0,15,0,0,0,0,0,0,0,0,0,0,0,0,1,0,0,0,0,0,0,0,0,0,0,0,0,0,0,0,0,0,0,0,0,0,0,0,0,2,0,0
"BEL_005_MZB_LO_12","BEL_005_MZB_LO_12-14.10.1989","14.10.1989",1989,10,14,2,0,0,0,0,0,0,0,0,0,0,2,0,0,0,0,0,0,11,0,0,0,0,0,0,0,0,0,0,11,0,0,0,0,0,0,0,0,0,0,0,0,0,0,0,0,0,51,0,0,0,0,0,0,0,0,0,2,0,1,0,2,0,0,0,0,0,0,0,0,0,0,0,0,0,0,0,0,0,2,0,0,0,0,0,0,0,0,0,0,0,0,0,0,0,11,0,0,0,0,0,0,0,0,0,0,0,0,0,0,0,0,13,0,0,0,0,0,0,2,0,0,2,0,0,2,0,0,0,0,0,0,0,0,0,0,0,0,0,0,0,0,0,0,0,0,0,0,0,0,0,0,0,0,0,0,0,0,0,0,0,0,0,0,0,0
"BEL_005_MZB_LO_12","BEL_005_MZB_LO_12-12.10.1990","12.10.1990",1990,10,12,2,0,0,0,0,0,0,0,0,0,0,51,0,0,0,0,0,0,11,0,0,0,0,0,0,0,0,0,0,11,0,0,0,0,0,0,0,0,0,0,0,0,0,0,0,1,0,2,0,0,0,0,0,0,0,0,0,11,0,0,0,11,0,0,0,0,0,0,2,0,2,0,0,0,0,0,0,0,0,0,0,0,0,0,0,0,0,0,0,0,0,0,0,0,0,2,0,0,0,0,0,0,0,0,0,0,0,0,0,0,0,0,51,0,0,0,0,0,0,2,0,0,0,0,0,1,0,0,0,0,0,0,0,0,0,0,0,0,0,0,0,0,0,0,0,0,0,0,1,0,0,2,0,0,0,0,0,0,0,0,0,0,2,1,0,0
"BEL_005_MZB_LO_12","BEL_005_MZB_LO_12-11.09.1991","11.09.1991",1991,9,11,11,0,0,0,0,0,0,0,0,0,0,11,0,0,0,0,0,0,11,0,0,0,0,0,0,0,0,0,0,11,0,0,0,0,0,0,0,0,0,0,0,0,2,0,0,11,0,2,0,0,0,0,0,0,0,0,0,51,0,0,0,11,0,0,0,0,0,0,2,0,11,0,0,0,0,0,0,0,0,0,0,0,0,0,0,0,0,0,0,0,0,0,0,0,0,0,0,0,0,0,0,0,0,0,0,0,0,0,0,0,0,0,112,0,0,0,0,0,0,2,0,0,0,0,0,0,0,0,0,0,0,2,0,0,0,0,0,0,0,0,0,0,0,0,0,0,0,0,0,0,0,11,0,0,0,0,0,0,0,0,0,0,2,0,0,0
"BEL_005_MZB_LO_12","BEL_005_MZB_LO_12-14.10.1992","14.10.1992",1992,10,14,0,0,0,0,0,0,0,0,0,0,0,11,0,0,0,0,0,0,11,0,0,0,2,0,0,0,0,0,0,11,0,0,0,0,0,0,0,0,0,0,0,0,2,0,0,2,0,2,0,2,0,0,0,0,0,0,0,11,0,0,0,11,0,0,0,0,0,0,0,0,0,1,0,0,0,0,0,0,0,0,0,0,0,0,0,0,0,0,0,0,0,0,0,0,0,2,0,0,0,0,0,0,0,0,0,0,0,0,0,0,0,0,0,0,0,0,0,0,0,0,0,0,2,0,0,2,0,0,0,0,0,0,0,0,0,0,0,0,0,0,0,0,0,0,0,0,0,0,0,0,0,0,0,0,0,0,0,0,0,0,0,0,0,0,0,0
"BEL_005_MZB_LO_12","BEL_005_MZB_LO_12-04.08.1995","04.08.1995",1995,8,4,2,0,0,0,0,0,0,0,0,0,0,11,0,0,0,0,0,0,101,0,0,0,0,0,0,0,0,0,0,101,0,0,0,0,0,0,0,0,0,0,0,0,11,0,0,11,0,11,0,11,0,0,0,0,0,0,0,11,0,1,0,2,0,0,0,0,0,0,0,0,2,0,0,0,0,0,0,0,0,2,0,0,0,0,0,0,0,0,0,0,0,0,0,0,0,2,0,0,0,0,0,0,0,0,0,0,0,0,0,0,0,0,3,0,0,0,0,0,0,0,0,0,0,0,0,4,0,0,0,0,0,0,0,0,0,0,0,0,0,0,0,0,0,0,0,0,0,0,0,0,0,2,0,0,0,0,0,0,0,0,0,0,0,0,0,0
"BEL_005_MZB_LO_12","BEL_005_MZB_LO_12-02.09.1996","02.09.1996",1996,9,2,11,0,0,0,0,0,0,0,0,0,0,11,0,0,0,0,0,0,11,0,0,0,0,0,0,0,0,0,0,11,0,0,0,0,0,0,0,0,0,0,0,0,2,0,0,11,0,2,0,2,0,0,0,0,0,0,0,11,0,1,0,11,0,0,0,0,0,0,0,0,11,0,0,0,0,0,0,0,0,0,0,0,0,0,0,0,1,0,0,0,0,0,0,0,0,2,0,0,0,0,0,0,0,0,0,0,0,0,0,0,0,0,11,0,0,0,0,0,0,2,0,1,0,0,0,7,0,0,0,0,0,0,0,0,0,0,0,0,0,0,0,0,0,0,0,0,0,0,2,0,0,2,0,0,0,0,0,0,0,2,0,0,0,0,0,0
"BEL_005_MZB_LO_12","BEL_005_MZB_LO_12-08.08.1997","08.08.1997",1997,8,8,1,0,0,0,0,0,0,0,0,0,0,11,0,0,0,1,0,0,0,0,0,0,1,0,0,0,0,0,0,11,0,0,0,0,0,0,0,0,0,0,0,0,2,0,0,0,0,2,0,11,0,0,0,0,0,0,0,11,0,0,0,2,0,0,0,0,0,0,0,0,1,0,0,0,0,0,0,0,0,0,0,0,0,0,0,0,2,0,0,0,0,0,0,0,0,2,0,0,0,0,0,0,0,0,0,0,0,0,0,0,0,0,2,0,0,0,0,0,0,0,0,0,2,0,0,0,0,0,0,0,0,0,0,0,0,0,0,0,0,0,0,0,0,0,0,0,0,0,0,0,0,0,0,0,0,0,0,0,0,0,0,0,0,0,0,0
"BEL_005_MZB_LO_12","BEL_005_MZB_LO_12-26.08.1998","26.08.1998",1998,8,26,0,0,0,0,0,0,0,0,0,0,0,11,0,0,0,0,0,0,11,0,0,0,0,0,0,0,0,1,0,11,2,0,0,0,0,0,0,0,0,0,0,0,11,0,0,2,0,11,0,11,0,0,0,0,0,0,0,11,0,2,0,11,0,0,0,0,0,0,2,0,2,0,0,0,0,0,0,0,0,0,2,0,0,0,0,0,2,0,0,0,0,0,0,0,0,2,0,0,0,0,0,0,0,0,0,0,0,0,0,0,0,0,5,0,0,0,0,0,0,2,0,0,2,0,0,3,0,0,0,0,0,0,0,0,0,0,0,0,0,2,0,0,0,0,0,0,0,0,0,0,0,0,0,0,0,0,0,0,0,2,0,0,0,0,0,0
"BEL_005_MZB_LO_12","BEL_005_MZB_LO_12-22.08.2000","22.08.2000",2000,8,22,2,0,0,0,0,0,0,0,0,0,0,11,0,0,0,0,0,0,11,0,0,0,2,0,0,0,0,0,0,22,0,0,0,0,0,0,0,0,0,0,0,0,49,0,0,11,0,49,0,9,0,0,0,0,0,0,0,49,0,49,0,1,0,0,0,0,0,0,0,0,0,0,0,0,0,0,0,0,0,0,9,0,0,0,0,0,0,0,0,0,0,0,0,0,0,49,0,0,0,0,0,0,0,0,0,0,0,0,0,0,0,0,60,0,0,0,0,0,0,0,0,0,0,0,0,2,0,0,0,0,0,0,0,0,0,0,0,0,0,0,0,0,0,0,0,0,0,0,0,0,0,0,0,0,0,0,0,0,0,0,0,0,0,0,0,0
"BEL_005_MZB_LO_12","BEL_005_MZB_LO_12-10.09.2004","10.09.2004",2004,9,10,1,0,0,0,0,0,0,0,0,0,0,3,0,0,0,0,0,0,4,0,0,0,51,0,0,0,0,0,0,121,0,0,0,0,0,0,0,0,0,0,0,0,0,0,0,13,0,0,0,0,0,0,0,0,0,0,0,1,0,212,0,0,0,0,0,0,0,0,0,0,0,0,0,0,0,0,0,0,0,0,0,0,0,0,0,0,0,0,0,0,0,0,0,0,0,0,0,0,0,0,0,0,0,0,0,0,0,0,0,0,0,0,16,0,0,0,0,0,0,0,0,0,0,0,0,0,0,0,0,1,0,0,0,0,0,0,5,0,0,0,0,0,0,0,0,0,0,0,0,0,0,0,0,0,0,0,0,0,0,0,0,0,0,0,0,0
"BEL_005_MZB_LO_12","BEL_005_MZB_LO_12-24.10.2006","24.10.2006",2006,10,24,2,0,0,0,0,0,0,0,0,0,0,3,0,0,0,0,0,0,10,0,0,0,2,0,0,0,0,0,0,1,0,0,0,0,0,0,0,0,0,0,0,0,0,0,0,1,0,2,0,0,0,0,0,0,0,0,0,2,0,44,0,0,0,0,0,0,0,0,0,0,0,0,0,0,0,0,0,0,0,0,0,0,0,0,0,0,0,0,0,0,0,0,0,0,0,13,0,0,0,0,0,0,0,0,0,0,0,0,0,0,0,0,0,0,0,0,0,0,0,1,0,0,0,0,0,2,0,0,0,0,0,0,0,0,0,0,0,0,0,0,0,0,0,0,0,0,0,0,0,0,0,0,0,0,0,0,0,0,0,1,0,0,0,0,0,0
"BEL_005_MZB_LO_12","BEL_005_MZB_LO_12-09.08.2007","09.08.2007",2007,8,9,1,0,0,0,0,0,0,0,0,0,0,6,0,0,0,0,0,0,25,0,0,0,1,0,0,0,0,0,0,4,0,0,3,0,0,0,0,0,0,0,0,0,0,0,0,24,0,9,0,0,0,0,0,0,0,0,0,5,0,0,0,3,0,0,0,0,0,0,0,0,1,1,0,0,0,0,0,0,0,0,1,0,0,0,0,0,1,0,0,0,0,0,0,0,0,13,0,0,0,0,0,0,0,0,0,0,0,0,0,0,0,0,5,0,0,0,0,0,0,1,0,1,0,0,0,3,0,0,0,0,0,3,0,0,0,0,0,0,0,0,0,0,0,0,0,0,0,0,0,0,0,1,0,0,0,0,0,0,0,2,0,0,0,30,0,0
"BEL_005_MZB_LO_12","BEL_005_MZB_LO_12-09.10.2013","09.10.2013",2013,10,9,1,0,11,0,0,0,0,0,0,0,0,0,0,0,0,0,0,0,12,0,0,0,7,0,4,0,0,0,0,20,0,0,4,0,0,0,30,0,0,0,0,0,0,0,0,30,0,0,0,4,0,0,0,0,0,0,0,3,0,25,0,0,0,0,0,0,0,0,0,0,0,0,0,0,0,0,0,0,0,0,6,0,0,3,7,0,2,0,0,0,0,0,0,0,0,8,0,0,0,0,0,4,0,0,0,0,0,0,0,0,0,0,3,0,0,0,0,0,0,0,0,1,2,0,0,34,0,0,0,1,0,0,0,0,0,0,5,0,0,0,0,0,0,0,0,0,0,0,0,1,0,0,0,0,0,0,0,0,0,0,0,0,0,1,0,0
"BEL_005_MZB_LO_120","BEL_005_MZB_LO_120-28.10.1991","28.10.1991",1991,10,28,0,0,0,0,0,0,0,0,0,0,0,0,0,0,0,0,0,0,0,0,0,0,0,0,0,0,0,0,0,0,0,0,0,0,0,0,0,0,0,0,0,0,0,0,0,0,0,0,0,0,0,0,0,0,0,0,0,0,0,0,0,0,0,0,0,0,0,0,0,0,0,0,0,0,0,0,0,0,0,0,0,0,0,0,0,0,0,0,0,0,0,0,0,0,0,0,0,0,0,0,0,0,0,0,0,0,0,0,0,0,0,0,62,0,0,0,0,0,0,0,0,0,0,0,0,0,0,0,0,0,0,0,0,0,0,0,0,0,0,0,0,0,0,0,0,0,0,0,0,0,0,0,0,0,0,0,0,0,0,0,0,0,0,0,0,0
"BEL_005_MZB_LO_120","BEL_005_MZB_LO_120-16.08.1994","16.08.1994",1994,8,16,0,0,0,0,0,0,0,0,0,0,0,0,0,0,0,0,0,0,0,0,0,0,0,0,0,0,0,0,0,22,0,0,0,0,0,0,0,0,0,0,0,0,0,0,0,0,0,0,0,0,0,0,0,0,0,0,0,0,0,0,0,0,0,0,0,0,0,0,0,0,51,0,0,0,0,0,0,0,0,0,0,0,0,0,0,0,0,0,0,0,0,0,0,0,0,0,0,0,0,0,0,0,0,0,0,0,0,0,0,0,0,0,202,0,0,0,0,0,0,2,0,0,0,0,0,0,0,0,0,0,0,0,0,0,0,0,0,0,0,0,0,0,0,0,0,0,0,0,0,0,0,0,0,0,0,0,0,0,0,0,0,0,0,0,0,0
"BEL_005_MZB_LO_120","BEL_005_MZB_LO_120-11.08.1995","11.08.1995",1995,8,11,0,0,0,0,0,0,0,0,0,0,0,11,0,0,0,0,0,0,0,0,0,0,0,0,0,0,0,0,0,51,0,0,0,0,0,0,0,0,2,0,0,0,0,0,0,0,0,0,0,0,0,0,0,0,0,0,0,11,0,0,0,51,0,0,0,0,0,0,0,0,11,0,0,0,0,0,0,0,0,1,0,0,0,0,0,0,0,0,0,0,0,0,0,0,0,0,0,0,0,0,0,0,0,0,0,0,0,0,0,0,0,0,152,0,0,0,0,0,0,101,0,0,0,0,0,1,0,0,0,0,0,0,0,0,0,0,0,0,0,0,0,0,0,0,0,0,0,0,11,11,0,0,0,0,0,0,0,0,0,0,0,0,0,0,0,0
"BEL_005_MZB_LO_120","BEL_005_MZB_LO_120-09.08.1996","09.08.1996",1996,8,9,1,0,0,0,0,0,0,0,0,0,0,11,0,0,0,0,0,0,0,0,0,0,0,0,0,0,0,0,0,22,0,0,0,0,0,0,0,0,0,0,0,0,0,0,0,0,0,0,0,0,0,0,0,0,0,0,0,2,0,0,0,2,0,0,0,0,0,0,0,0,11,0,0,0,0,0,0,0,0,0,0,0,0,0,0,0,0,0,0,0,0,0,0,0,0,1,0,0,0,0,0,0,0,0,0,0,0,0,0,0,0,0,13,0,0,0,0,0,0,2,0,0,0,0,0,0,0,0,0,0,0,0,0,0,0,0,0,0,0,0,0,0,0,0,0,0,0,0,2,2,0,0,0,0,0,0,0,0,0,0,0,0,0,0,0,0
"BEL_005_MZB_LO_120","BEL_005_MZB_LO_120-19.09.1997","19.09.1997",1997,9,19,2,0,0,0,0,0,0,0,0,1,0,51,0,0,0,0,0,0,0,0,0,0,0,0,0,0,0,0,0,2,0,0,0,0,0,0,0,0,0,0,0,0,0,0,0,0,0,0,0,0,0,0,0,0,0,0,0,2,0,0,0,11,0,0,0,0,0,0,0,0,11,0,0,0,0,0,0,0,0,0,0,0,0,0,0,0,0,0,0,0,0,0,0,0,0,0,0,0,0,0,0,0,0,0,0,0,0,0,0,0,0,0,62,0,0,0,0,0,0,11,0,0,0,0,0,0,0,0,0,0,0,0,0,0,0,0,0,0,0,0,0,0,0,0,0,0,0,0,11,2,0,0,0,0,0,0,0,0,0,0,0,0,0,0,0,0
"BEL_005_MZB_LO_120","BEL_005_MZB_LO_120-27.10.1998","27.10.1998",1998,10,27,0,0,0,0,0,0,0,0,0,0,0,2,0,0,0,0,0,0,0,0,0,0,0,0,0,0,0,0,0,2,0,0,0,0,0,0,0,0,0,0,0,0,0,0,0,0,0,0,0,0,0,0,0,0,0,0,0,0,0,0,0,0,0,0,0,0,0,0,0,0,0,0,0,0,0,0,0,0,0,0,0,0,0,0,0,0,0,0,0,0,0,0,0,0,0,0,0,0,0,0,0,0,0,0,0,0,0,0,0,0,0,0,53,0,0,0,0,0,0,0,0,0,0,0,0,0,0,0,0,0,0,0,0,0,0,0,0,0,0,0,0,0,0,0,0,0,0,0,0,0,0,0,0,0,0,0,0,0,0,0,0,0,0,0,0,0
"BEL_005_MZB_LO_120","BEL_005_MZB_LO_120-27.08.1999","27.08.1999",1999,8,27,2,0,0,0,0,0,0,0,0,0,0,41,0,0,0,0,0,0,0,0,0,0,0,0,0,0,0,0,0,0,0,0,0,0,0,0,0,0,0,0,0,0,0,0,0,0,0,11,0,0,0,0,0,0,0,0,0,11,0,0,0,7,0,0,0,0,0,0,0,0,2,0,0,0,0,0,0,0,0,0,0,0,0,0,0,0,0,0,0,0,0,0,0,0,0,0,0,0,0,0,0,0,0,0,0,0,0,0,0,0,0,0,11,0,0,0,0,0,0,0,0,0,0,0,0,0,0,0,0,0,0,0,0,0,0,0,0,0,0,0,0,0,0,0,0,0,0,0,0,11,0,0,0,0,0,0,0,0,0,0,0,0,0,0,0,0
"BEL_005_MZB_LO_120","BEL_005_MZB_LO_120-12.09.2000","12.09.2000",2000,9,12,8,0,0,0,0,0,0,0,0,0,0,11,0,0,0,0,0,0,0,0,0,0,0,0,0,0,0,0,0,51,0,0,0,0,0,0,0,0,0,0,0,0,0,0,0,0,0,7,0,0,0,0,0,0,0,0,0,11,0,0,0,1,0,0,0,0,0,0,0,0,0,0,0,0,0,0,0,0,0,0,0,0,0,0,0,0,0,0,0,0,0,0,0,0,0,1,0,0,0,0,0,0,0,0,0,0,0,0,0,0,0,0,14,0,0,0,0,0,0,0,0,0,0,0,0,0,0,0,0,0,0,0,0,0,0,0,0,0,0,0,0,0,0,0,0,0,0,0,0,11,0,11,0,0,0,0,0,0,0,0,0,0,0,0,0,0
"BEL_005_MZB_LO_120","BEL_005_MZB_LO_120-14.08.2001","14.08.2001",2001,8,14,5,0,0,0,0,0,0,0,0,0,0,11,0,0,0,0,0,0,0,0,0,0,0,0,0,0,0,0,0,7,0,0,0,0,0,0,0,0,0,0,0,0,0,0,0,0,0,11,0,0,0,0,0,0,0,0,0,11,0,0,0,11,0,0,0,0,0,0,0,0,0,0,0,0,0,0,0,0,0,1,0,0,0,0,0,0,0,0,0,0,0,0,0,0,0,0,0,0,0,0,0,0,0,0,0,0,0,0,0,0,0,0,9,0,0,0,0,0,0,0,0,0,0,0,0,0,0,0,0,0,0,0,0,0,0,0,0,0,0,0,0,0,0,0,0,0,0,0,0,2,0,11,0,0,0,0,0,0,0,0,0,0,0,0,0,0
"BEL_005_MZB_LO_120","BEL_005_MZB_LO_120-06.09.2002","06.09.2002",2002,9,6,2,0,0,0,0,0,0,0,0,0,0,11,0,0,0,1,0,0,0,0,0,0,0,0,0,0,0,0,0,8,0,0,0,0,0,0,0,0,0,0,0,0,0,0,0,0,0,4,0,0,0,0,0,0,0,0,0,11,0,0,0,6,0,0,0,0,0,0,0,0,11,1,0,0,0,0,0,0,0,0,0,0,0,0,0,0,0,0,0,0,0,0,0,0,0,1,0,0,0,0,0,0,0,0,0,0,0,0,0,0,0,0,53,0,0,0,0,0,0,0,0,0,0,0,0,0,0,0,1,0,0,0,0,0,0,0,0,0,0,0,0,0,0,0,0,0,0,0,0,11,0,6,0,0,0,0,0,0,0,1,0,0,0,0,0,0
"BEL_005_MZB_LO_120","BEL_005_MZB_LO_120-02.09.2004","02.09.2004",2004,9,2,0,0,0,0,0,0,0,0,0,0,0,11,0,0,0,0,0,0,2,0,0,0,0,0,0,0,0,0,0,11,0,0,0,0,0,0,0,0,0,0,0,0,2,0,0,0,0,11,0,0,0,0,0,0,0,0,0,6,0,0,0,2,0,0,0,0,0,0,1,0,0,0,0,0,0,0,0,0,0,0,0,0,0,0,0,0,0,0,0,0,0,0,0,0,0,0,0,0,0,0,0,0,0,0,0,0,0,0,0,0,0,0,13,0,0,0,0,0,0,0,0,0,0,0,0,0,0,0,3,0,0,0,0,0,0,0,0,0,0,0,0,0,0,0,0,0,0,0,0,101,0,6,0,0,0,0,0,0,0,0,0,0,0,0,0,0
"BEL_005_MZB_LO_120","BEL_005_MZB_LO_120-10.08.2006","10.08.2006",2006,8,10,1,0,0,0,0,0,0,0,0,0,0,32,0,0,0,0,0,0,8,0,0,0,0,0,0,0,0,0,0,3,0,0,0,0,0,0,0,0,0,0,0,0,1,0,0,0,0,73,0,0,0,0,0,0,0,0,0,6,0,0,0,0,0,0,0,0,0,0,0,0,1,0,0,0,0,0,0,0,0,0,0,0,0,0,0,0,0,0,0,0,0,0,0,0,0,0,0,0,0,0,0,0,0,0,0,0,0,0,0,0,0,0,28,0,0,0,0,0,0,0,0,0,1,0,0,0,0,0,0,0,0,0,0,0,0,0,0,0,0,0,0,0,0,0,0,0,0,0,0,63,0,12,0,0,0,0,0,0,0,2,0,0,0,0,0,0
"BEL_005_MZB_LO_120","BEL_005_MZB_LO_120-23.09.2010","23.09.2010",2010,9,23,1,0,0,0,0,0,0,0,0,0,0,50,0,0,0,1,0,0,34,0,0,0,0,0,0,0,0,0,0,6,0,2,0,0,0,0,0,0,0,0,0,0,1,0,0,0,0,40,0,0,0,0,0,0,0,0,0,1,0,13,0,1,0,0,0,0,0,0,13,0,0,0,0,0,0,0,0,0,0,0,1,0,0,0,0,0,0,0,0,0,0,0,0,0,0,0,0,0,0,0,0,0,0,0,0,0,0,0,0,0,0,0,25,0,0,0,0,0,0,0,0,0,30,0,0,0,0,0,0,0,0,0,0,0,0,0,0,0,0,0,0,0,0,0,0,0,0,0,0,50,0,60,0,0,0,0,0,0,0,1,0,0,0,0,0,0
"BEL_005_MZB_LO_120","BEL_005_MZB_LO_120-06.08.2020","06.08.2020",2020,8,6,2,0,0,0,0,0,0,0,0,0,0,5,0,0,0,200,0,0,0,0,0,0,0,0,0,0,0,0,0,50,0,0,1,0,0,0,0,0,0,0,0,1,0,0,0,0,0,0,0,0,0,0,0,0,0,0,0,0,0,110,0,0,0,0,0,0,0,0,0,0,0,0,0,0,0,6,0,0,0,30,60,0,0,0,0,0,2,0,0,0,0,0,0,0,0,0,0,0,0,0,0,0,0,0,0,0,0,0,0,0,0,0,0,0,0,0,0,0,0,0,1,0,3,0,0,0,0,0,0,0,0,0,0,0,0,0,0,0,0,0,0,0,0,0,0,0,0,0,0,100,0,6,0,0,0,0,0,0,0,0,0,0,0,0,0,0
"BEL_005_MZB_LO_121","BEL_005_MZB_LO_121-09.08.1996","09.08.1996",1996,8,9,0,0,0,0,0,0,0,0,0,0,0,11,0,0,0,0,0,0,0,0,0,0,0,0,0,0,0,0,0,62,0,0,0,0,0,0,0,0,0,0,0,0,0,2,0,0,0,0,0,0,0,0,0,0,0,0,0,0,0,0,0,0,0,0,0,0,0,0,0,0,11,0,0,0,0,0,0,0,0,0,0,0,0,0,0,0,0,0,0,0,0,0,0,0,0,0,0,0,0,0,0,0,0,0,0,0,0,0,0,0,0,0,13,0,0,0,0,0,0,2,0,0,0,0,0,0,0,0,0,0,0,0,0,0,0,0,0,0,0,0,0,0,0,0,0,0,0,0,2,11,0,0,0,0,0,0,0,0,0,0,0,0,0,0,0,0
"BEL_005_MZB_LO_121","BEL_005_MZB_LO_121-05.09.1997","05.09.1997",1997,9,5,0,0,0,0,0,0,0,0,0,0,0,11,0,0,0,0,0,0,0,0,0,0,0,0,0,0,0,0,0,2,2,0,0,0,0,0,0,0,2,0,0,0,0,0,0,0,0,0,0,0,0,0,0,0,0,0,0,2,0,0,0,0,0,0,0,0,0,0,0,0,11,0,0,0,0,0,0,0,0,0,0,0,0,0,0,0,0,0,0,0,0,0,0,0,0,2,0,0,0,0,0,0,0,0,0,0,0,0,0,0,0,2,13,0,0,0,0,0,0,51,0,0,0,0,0,0,0,0,0,0,0,0,0,0,0,0,0,0,0,0,0,0,0,0,0,0,0,0,11,0,0,0,0,0,0,0,0,0,0,0,0,0,0,0,0,0
"BEL_005_MZB_LO_121","BEL_005_MZB_LO_121-27.10.1998","27.10.1998",1998,10,27,0,0,0,0,0,0,0,0,0,0,0,2,0,0,0,0,0,0,0,0,0,0,0,0,0,0,0,0,0,0,0,0,0,0,0,0,0,0,0,0,0,0,0,0,0,0,0,0,0,0,0,0,0,0,0,0,0,2,0,0,0,0,0,0,0,0,0,0,0,0,0,0,0,0,0,0,0,0,0,0,0,0,0,0,0,0,0,0,0,0,0,0,0,0,0,1,0,0,0,0,0,0,0,0,0,0,0,0,0,0,0,0,62,0,0,0,0,0,0,0,0,0,0,0,0,0,0,0,0,0,0,0,0,0,0,0,0,0,0,0,0,0,0,0,0,0,0,0,0,0,0,0,0,0,0,0,0,0,0,0,0,0,0,0,0,0
"BEL_005_MZB_LO_121","BEL_005_MZB_LO_121-27.08.1999","27.08.1999",1999,8,27,0,0,0,0,0,0,0,0,0,0,0,11,0,0,0,11,0,0,0,0,0,0,0,0,0,0,0,0,0,8,0,0,0,0,0,0,0,0,0,0,0,0,0,0,0,0,0,0,0,0,0,0,0,0,0,0,0,7,0,0,0,7,0,0,0,0,0,0,2,0,7,1,0,0,0,0,0,0,0,0,0,0,0,2,0,0,0,0,0,0,0,0,0,0,0,0,0,0,0,0,0,0,0,0,0,0,0,0,0,0,0,0,7,0,0,0,0,0,0,11,0,0,0,0,0,0,0,0,0,0,0,0,0,0,0,0,0,0,0,0,0,0,0,0,0,0,0,0,2,0,0,0,0,0,0,0,0,0,0,1,0,0,0,0,0,0
"BEL_005_MZB_LO_121","BEL_005_MZB_LO_121-12.09.2000","12.09.2000",2000,9,12,11,0,0,0,0,0,0,0,0,0,0,11,0,0,0,0,0,0,0,0,0,0,0,0,0,0,0,0,0,5,0,0,0,0,0,0,0,0,0,0,0,0,0,0,0,0,0,8,0,0,0,0,0,0,0,0,0,11,0,0,0,1,0,0,0,0,0,0,0,0,2,0,0,0,0,0,0,0,0,0,0,0,0,0,0,0,0,0,0,0,0,0,0,0,0,0,0,0,0,0,0,0,0,0,0,0,0,0,0,0,0,0,13,0,0,0,0,0,0,0,0,0,0,0,0,3,0,0,0,0,0,0,0,0,0,0,0,0,0,0,0,0,0,0,0,0,0,0,0,4,0,0,0,0,0,0,0,0,0,0,0,0,0,0,0,0
"BEL_005_MZB_LO_121","BEL_005_MZB_LO_121-14.08.2001","14.08.2001",2001,8,14,0,0,0,0,0,0,0,0,0,0,0,11,0,0,0,2,0,0,0,0,0,0,0,0,0,0,0,0,0,11,0,0,0,0,0,0,0,0,0,0,0,0,0,0,0,0,0,20,0,0,0,0,0,0,0,0,0,11,0,0,0,11,0,0,0,0,0,0,0,0,8,0,0,11,0,0,0,0,0,0,0,0,0,0,0,0,0,0,0,0,0,0,0,0,0,1,0,0,0,0,0,0,0,0,0,0,0,0,0,0,0,0,13,0,0,0,0,0,0,0,0,0,0,0,1,0,0,0,0,0,0,0,0,0,0,0,0,0,0,0,0,0,0,0,0,0,0,0,3,0,0,0,0,0,0,0,0,0,0,1,0,0,0,0,0,0
"BEL_005_MZB_LO_121","BEL_005_MZB_LO_121-06.09.2002","06.09.2002",2002,9,6,11,0,0,0,0,0,0,0,0,0,0,11,0,0,0,11,0,0,0,0,0,0,0,0,0,0,0,0,0,6,0,0,0,0,0,0,0,0,0,0,0,0,0,0,0,0,0,4,0,0,0,0,0,0,0,0,0,51,0,0,0,2,0,0,0,0,0,0,0,0,4,0,0,0,0,0,0,0,0,0,0,0,0,0,0,0,0,0,0,0,0,0,0,0,0,0,0,0,0,0,0,0,0,0,0,0,0,0,0,0,0,0,3,0,0,0,0,0,0,0,0,0,0,0,0,0,0,0,0,0,0,0,0,0,0,0,0,0,0,0,0,0,0,0,0,0,0,0,0,51,0,9,0,0,0,0,0,0,0,0,0,0,0,0,0,0
"BEL_005_MZB_LO_121","BEL_005_MZB_LO_121-05.08.2004","05.08.2004",2004,8,5,0,0,0,0,0,0,0,0,0,0,0,51,0,0,0,4,0,0,0,0,0,0,0,0,0,0,0,0,0,2,0,0,0,0,0,0,0,0,0,0,0,0,0,0,0,0,0,4,0,0,0,0,0,0,0,0,0,76,0,0,0,11,0,0,0,0,0,0,2,0,26,0,0,0,0,0,0,0,0,2,0,0,0,0,0,0,0,0,0,0,0,0,0,0,0,0,0,0,0,0,0,0,0,0,0,0,0,0,0,0,0,0,9,0,0,0,0,0,0,0,0,0,0,0,0,1,0,0,0,0,0,0,0,0,0,0,0,0,0,0,0,0,0,0,0,0,0,0,0,11,0,3,0,0,0,0,0,0,0,2,0,0,0,0,0,0
