"Unique.ID","Samp.ID","Sampling.date","year","month","day","ACROLOXUS LACUSTRIS","AESHNA SP.","ALBOGLOSSIPHONIA HETEROCLITA","AMELETUS SP.","ANISOPTERA GEN. SP.","APATANIA SP.","APHELOCHEIRUS AESTIVALIS","ARANEAE GEN. SP.","ASELLUS SP.","ASTACUS SP.","ATHERICIDAE GEN. SP.","BAETIDAE GEN. SP.","BERAEA PULLATA","BERAEODES MINUTUS","BITHYNIIDAE GEN. SP.","BRACHYCENTRUS SUBNUBILUS","CAENIS SP.","CALOPTERYGIDAE GEN. SP.","CAPNIIDAE GEN. SP.","CATACLYSTA LEMNATA","CERATOPOGONIDAE GEN. SP.","CHAOBORUS SP.","CHIMARRA MARGINATA","CHIRONOMIDAE GEN. SP.","CHLOROPERLIDAE GEN. SP.","CHRYSOMELIDAE GEN. SP.","CHRYSOPILUS SP.","COENAGRIONIDAE GEN. SP.","COLEOPTERA GEN. SP.","CORDULEGASTER SP.","CORDULIIDAE GEN. SP.","CORIXIDAE GEN. SP.","CULICIDAE GEN. SP.","CURCULIONIDAE GEN. SP.","CYANOPHTHALMA OBSCURA","DENDROCOELUM LACTEUM","DICRANOTA SP.","DINA LINEATA","DIPTERA GEN. SP.","DIXIDAE GEN. SP.","DOLICHOPODIDAE GEN. SP.","DYTISCIDAE GEN. SP.","ECNOMUS TENELLUS","ELMIDAE GEN. SP.","ELOPHILA SP.","EMPIDIDAE GEN. SP.","EPHEMERA SP.","EPHEMERELLA SP.","EPHEMEROPTERA GEN. SP.","EPHYDATIA MUELLERI","EPHYDRIDAE GEN. SP.","ERPOBDELLA SP.","FREDERICELLA SP.","GAMMARIDAE GEN. SP.","GASTROPODA GEN. SP.","GERRIDAE GEN. SP.","GLOSSIPHONIA SP.","GLOSSOSOMATIDAE GEN. SP.","GOERA SP.","GOMPHIDAE GEN. SP.","GYRINIDAE GEN. SP.","HAEMOPIS SANGUISUGA","HALIPLIDAE GEN. SP.","HELOBDELLA STAGNALIS","HELOPHORUS SP.","HEMICLEPSIS MARGINATA","HEPTAGENIIDAE GEN. SP.","HETEROPTERA GEN. SP.","HYDRA SP.","HYDRACHNIDIA GEN. SP.","HYDRAENIDAE GEN. SP.","HYDROCHUS SP.","HYDROPHILIDAE GEN. SP.","HYDROPSYCHIDAE GEN. SP.","HYDROPTILIDAE GEN. SP.","HYDROZOA GEN. SP.","LEPIDOPTERA GEN. SP.","LEPIDOSTOMA HIRTUM","LEPTOCERIDAE GEN. SP.","LEPTOPHLEBIIDAE GEN. SP.","LEUCTRA SP.","LIMNEPHILIDAE GEN. SP.","LIMONIIDAE GEN. SP.","LYMNAEIDAE GEN. SP.","MEGALOPTERA GEN. SP.","MERMITHIDAE GEN. SP.","MESOVELIA SP.","METRETOPUS SP.","MICRASEMA SP.","MOLANNIDAE GEN. SP.","MUSCIDAE GEN. SP.","NEMATODA GEN. SP.","NEMATOMORPHA GEN. SP.","NEMOURIDAE GEN. SP.","NEPA CINEREA","NOTONECTA SP.","NYMPHULA SP.","ODONATA GEN. SP.","OLIGOCHAETA GEN. SP.","PALUDICELLA SP.","PEDICIA SP.","PERLODIDAE GEN. SP.","PHRYGANEIDAE GEN. SP.","PHYSIDAE GEN. SP.","PISCICOLA GEOMETRA","PLANARIIDAE GEN. SP.","PLANORBIDAE GEN. SP.","PLATYCNEMIS PENNIPES","PLECOPTERA GEN. SP.","POLYCENTROPODIDAE GEN. SP.","POTAMANTHUS LUTEUS","POTAMOPYRGUS ANTIPODARUM","PROSTOMA SP.","PSYCHODIDAE GEN. SP.","PSYCHOMYIIDAE GEN. SP.","PTYCHOPTERIDAE GEN. SP.","RHABDIOPTERYX ACUMINATA","RHYACOPHILIDAE GEN. SP.","SCIOMYZIDAE GEN. SP.","SCIRTIDAE GEN. SP.","SERICOSTOMATIDAE GEN. SP.","SERRATELLA SP.","SIALIDAE GEN. SP.","SILO PALLIPES","SIMULIIDAE GEN. SP.","SIPHLONURIDAE GEN. SP.","SISYRA SP.","SPHAERIIDAE GEN. SP.","TABANIDAE GEN. SP.","TAENIOPTERYX NEBULOSA","THEODOXUS FLUVIATILIS SSP.","THEROMYZON TESSULATUM","TIPULIDAE GEN. SP.","TRICHOPTERA GEN. SP.","TRICLADIDA GEN. SP.","TURBELLARIA GEN. SP.","UNIONIDAE GEN. SP.","VALVATA SP.","VELIA SP.","ZYGOPTERA GEN. SP."
"FIN_004_MZB_LO_1","FIN_004_MZB_LO_1-24.09.2009","24.09.2009",2009,9,24,0,0,0,0,0,0,0,0,46,0,0,6,0,0,0,0,0,0,0,0,4,0,0,267,0,0,0,0,0,0,0,0,0,0,0,0,2,0,0,0,0,0,0,42,0,0,0,0,0,0,0,1,0,0,0,0,0,3,0,0,0,0,0,0,0,0,51,0,0,6,0,0,0,51,62,0,0,2,1,54,0,34,0,0,0,0,0,0,0,0,6,3,0,82,0,0,0,0,37,0,0,39,0,0,0,0,0,0,0,89,0,0,0,0,0,0,0,9,0,0,0,0,0,0,197,0,0,0,0,11,0,0,2,0,0,0,0,0,0,0
"FIN_004_MZB_LO_1","FIN_004_MZB_LO_1-31.10.2010","31.10.2010",2010,10,31,0,0,0,0,0,0,0,0,22,0,0,3,0,0,0,0,0,0,0,0,8,0,0,60,0,0,0,0,0,0,0,1,0,0,0,0,0,0,0,0,0,0,0,1,0,0,0,0,0,0,0,5,0,0,0,0,0,0,0,0,0,0,0,0,0,0,13,0,0,3,0,0,0,34,28,0,0,6,0,27,0,5,0,0,0,0,0,0,0,0,0,0,0,37,0,0,0,0,4,0,0,102,0,0,0,0,0,0,0,84,0,0,0,0,0,0,0,16,0,0,0,0,0,0,5,0,0,3,0,62,0,0,0,0,0,0,0,0,0,0
"FIN_004_MZB_LO_1","FIN_004_MZB_LO_1-23.11.2011","23.11.2011",2011,11,23,0,0,0,0,0,0,0,0,76,0,0,0,0,0,0,0,0,0,0,0,0,0,0,2,0,0,0,0,0,0,0,0,0,0,0,0,0,0,0,0,0,0,0,0,0,0,0,0,0,0,0,1,0,0,0,0,0,0,0,0,0,0,0,0,0,0,15,0,0,0,0,0,0,88,0,0,0,0,0,1,0,1,0,0,0,0,0,0,0,0,0,0,0,0,0,0,0,0,0,0,0,27,0,0,0,0,0,0,0,2,0,0,0,0,0,0,0,6,0,0,0,0,0,0,3,0,0,0,0,21,0,0,0,0,0,3,0,0,0,0
"FIN_004_MZB_LO_1","FIN_004_MZB_LO_1-04.11.2012","04.11.2012",2012,11,4,0,1,0,0,0,0,0,0,149,0,0,0,0,0,0,0,0,0,0,0,0,0,0,98,0,0,0,0,0,0,0,1,0,0,0,0,2,0,0,0,0,0,0,7,0,0,0,0,0,0,0,8,0,0,0,0,0,1,0,0,0,0,0,0,0,0,23,0,0,0,0,0,0,25,1,0,0,0,0,52,0,15,0,0,0,0,0,0,0,0,0,0,0,87,0,0,0,0,3,0,0,9,1,0,0,0,0,0,0,40,0,0,0,0,0,0,0,18,0,0,0,0,0,0,58,0,0,0,0,163,0,0,0,0,0,3,0,0,0,0
"FIN_004_MZB_LO_1","FIN_004_MZB_LO_1-02.10.2013","02.10.2013",2013,10,2,0,0,0,0,0,0,0,0,134,0,0,7,0,0,0,0,0,0,0,0,0,0,0,58,0,0,0,0,0,0,1,1,0,0,0,0,2,0,0,0,0,0,0,8,0,0,0,0,0,0,0,2,0,0,0,0,0,0,0,0,0,0,0,0,0,0,217,0,0,0,0,0,0,42,0,0,0,39,4,41,0,1,0,0,0,0,0,0,0,0,1,0,0,7,0,0,0,0,4,0,0,18,0,0,0,0,0,0,0,12,0,0,0,0,0,0,0,22,0,0,0,0,2,0,4,0,0,0,0,32,0,0,3,0,0,0,0,0,0,0
"FIN_004_MZB_LO_1","FIN_004_MZB_LO_1-30.09.2014","30.09.2014",2014,9,30,0,0,0,0,0,0,0,0,124,0,0,15,0,0,0,0,0,1,0,0,2,0,0,96,0,0,0,0,0,0,0,0,0,0,0,0,1,0,0,0,0,0,0,5,0,0,0,2,0,0,0,4,0,0,0,0,0,0,0,0,0,0,0,0,0,0,75,0,0,16,0,0,0,40,1,0,0,51,7,91,0,1,0,0,0,0,0,0,0,1,7,0,0,0,0,0,0,0,4,0,0,71,0,0,0,0,0,0,0,2,0,0,0,0,2,0,0,14,0,0,0,0,0,0,9,0,0,0,0,187,0,0,6,0,0,1,0,0,0,0
"FIN_004_MZB_LO_1","FIN_004_MZB_LO_1-22.09.2016","22.09.2016",2016,9,22,0,0,0,0,0,0,0,0,157,0,0,20,0,0,0,0,0,0,0,0,0,0,0,11,0,0,0,0,0,0,0,0,0,0,0,0,0,0,0,0,0,0,0,9,0,0,0,0,0,0,0,4,0,0,0,0,0,10,0,0,0,0,0,0,0,0,64,0,0,0,0,0,0,86,0,0,0,13,1,7,0,1,0,0,0,0,0,0,0,0,0,0,0,2,0,0,0,0,0,0,0,34,0,0,0,0,0,0,0,11,0,0,0,0,0,0,0,43,0,0,0,0,0,0,85,0,0,0,0,156,0,0,0,0,0,0,0,0,0,0
"FIN_004_MZB_LO_1","FIN_004_MZB_LO_1-04.10.2018","04.10.2018",2018,10,4,0,0,0,0,0,0,0,0,76,0,0,8,0,0,0,0,0,0,0,0,0,0,0,214,0,0,0,0,0,0,0,0,0,0,0,0,0,0,0,0,0,0,0,5,0,0,0,0,0,0,0,0,0,0,0,0,0,0,0,0,0,0,0,0,0,0,25,0,0,0,0,0,0,4,32,0,0,9,6,15,0,0,0,0,0,0,0,0,0,0,3,0,0,1,0,0,0,0,0,0,0,71,0,0,0,0,0,0,0,26,0,0,0,0,0,0,0,19,0,0,0,0,0,0,55,0,0,2,0,3,0,0,0,0,0,0,0,0,0,0
"FIN_004_MZB_LO_1","FIN_004_MZB_LO_1-09.10.2019","09.10.2019",2019,10,9,0,0,0,0,0,0,0,0,83,0,0,17,0,0,0,0,0,0,0,0,0,0,0,94,0,0,0,0,0,0,0,0,0,0,0,0,0,0,0,0,0,0,0,7,0,0,0,0,0,0,0,4,0,0,0,0,0,0,0,0,0,0,0,0,0,0,50,0,0,0,0,0,0,25,7,0,0,8,4,70,0,3,0,0,0,0,0,0,0,0,2,0,0,3,0,0,0,0,14,0,0,55,0,0,0,0,1,0,0,23,0,0,0,0,0,0,0,21,0,0,0,0,0,0,596,0,0,8,0,8,0,0,0,0,0,2,0,0,0,0
"FIN_004_MZB_LO_1","FIN_004_MZB_LO_1-21.09.2020","21.09.2020",2020,9,21,0,0,0,0,0,0,0,0,125,0,0,0,0,0,0,0,0,0,0,0,0,0,0,19,0,0,0,0,0,0,0,0,0,0,0,0,0,0,0,0,0,0,0,18,0,0,0,0,0,0,0,4,0,0,0,0,0,1,0,0,0,0,0,0,0,0,4,0,0,0,0,0,0,8,1,0,0,1,0,19,0,17,0,0,0,0,0,0,0,0,3,0,0,5,0,0,0,0,3,0,0,3,0,0,0,0,0,0,0,55,0,0,0,0,0,0,0,3,0,0,0,0,1,0,19,0,0,1,0,0,0,0,0,0,0,2,0,0,0,0
"FIN_004_MZB_LO_1","FIN_004_MZB_LO_1-28.09.2021","28.09.2021",2021,9,28,0,0,0,0,0,0,0,0,32,0,0,13,0,0,0,0,0,0,0,0,1,0,0,76,0,0,0,0,0,0,0,0,0,0,0,0,0,0,0,0,0,0,0,7,0,0,0,0,0,0,0,1,0,0,0,0,0,2,0,0,0,0,0,0,0,0,35,0,0,0,0,0,0,28,6,0,0,0,3,222,0,5,0,0,0,0,0,0,0,0,5,0,0,1,0,0,0,0,1,0,0,27,0,0,0,0,0,0,0,173,0,0,0,0,0,0,0,2,0,0,0,0,0,0,7,0,0,2,0,32,0,0,0,0,0,0,0,0,0,0
"FIN_004_MZB_LO_10","FIN_004_MZB_LO_10-16.09.2008","16.09.2008",2008,9,16,0,0,0,2,0,0,0,0,15,1,0,861,0,0,0,0,0,0,0,0,57,0,0,118,0,0,0,0,0,0,0,0,0,0,0,0,16,0,0,0,0,0,0,60,0,0,0,33,0,0,0,0,0,0,0,0,0,2,0,15,0,0,0,0,0,0,211,0,0,3,0,0,0,141,55,0,0,1,2,169,150,2,0,0,0,0,0,0,0,0,0,0,0,178,0,0,0,0,66,0,0,31,0,0,0,0,0,0,0,63,0,0,0,0,1,0,0,10,0,0,0,0,2,0,50,0,0,193,2,26,0,0,0,0,0,0,0,0,0,0
"FIN_004_MZB_LO_10","FIN_004_MZB_LO_10-21.09.2009","21.09.2009",2009,9,21,0,0,0,0,0,0,0,0,1,0,0,477,0,0,0,0,0,0,0,0,10,0,0,106,0,0,0,0,0,0,0,0,0,0,0,0,3,0,0,0,0,0,0,58,0,0,0,30,0,0,0,0,0,0,0,0,0,1,0,0,0,0,0,0,0,0,99,0,0,0,0,0,0,45,62,0,0,26,0,11,72,0,0,0,0,0,0,0,0,0,0,0,0,7,0,0,0,0,0,0,0,70,0,0,0,0,1,0,0,27,0,0,0,0,0,0,0,2,0,0,0,0,0,0,0,0,0,43,0,21,0,0,1,0,0,0,0,0,0,0
"FIN_004_MZB_LO_10","FIN_004_MZB_LO_10-20.09.2010","20.09.2010",2010,9,20,0,0,0,0,0,0,0,0,9,0,0,262,0,0,0,0,0,0,0,0,0,0,0,56,0,0,0,0,0,0,0,0,0,0,0,0,7,0,0,0,0,0,0,68,0,0,0,22,0,0,0,0,0,0,0,0,0,0,0,11,0,0,0,0,0,0,85,0,0,0,0,0,0,78,1,0,0,22,0,38,44,1,0,0,0,0,0,0,0,0,1,0,0,42,0,0,0,0,47,0,0,35,0,0,0,0,0,0,0,15,0,0,0,0,2,0,0,6,0,0,0,0,0,0,1,0,0,9,0,12,0,0,0,0,0,0,0,0,0,0
"FIN_004_MZB_LO_10","FIN_004_MZB_LO_10-08.11.2011","08.11.2011",2011,11,8,0,0,0,0,0,0,0,0,0,0,0,722,0,0,0,0,0,2,0,0,11,0,0,495,0,0,0,0,0,0,0,0,0,0,0,0,2,0,0,0,0,0,0,6,0,0,0,45,0,0,0,0,0,0,0,0,0,0,0,0,0,0,0,0,0,0,52,0,0,0,0,0,0,41,9,0,0,4,3,9,19,3,0,0,0,0,0,0,0,0,0,0,0,41,0,0,0,0,7,0,0,65,0,0,0,0,0,0,0,9,0,0,0,0,2,0,0,10,0,0,0,0,2,0,317,0,0,63,0,8,0,0,0,0,0,0,0,0,0,0
"FIN_004_MZB_LO_10","FIN_004_MZB_LO_10-08.10.2012","08.10.2012",2012,10,8,0,0,0,0,0,0,0,0,1,1,0,0,0,0,0,0,17,0,0,0,3,0,0,136,0,0,0,0,0,1,0,0,0,0,0,0,0,0,0,0,0,0,0,27,0,0,0,0,0,0,0,0,0,0,0,0,0,0,0,9,0,0,0,0,0,0,129,0,0,0,0,0,0,145,0,0,0,21,3,481,46,0,6,0,0,0,0,0,0,0,1,0,0,59,0,0,0,0,31,0,0,23,0,0,0,0,0,0,0,7,0,0,0,0,1,0,0,37,0,0,0,0,0,0,60,0,0,179,0,22,0,0,0,0,0,0,0,0,0,0
"FIN_004_MZB_LO_10","FIN_004_MZB_LO_10-23.10.2013","23.10.2013",2013,10,23,0,0,0,0,0,0,0,0,10,0,0,1903,0,0,0,0,0,1,0,0,0,0,0,105,0,0,0,0,0,0,0,0,0,0,0,0,6,0,0,0,0,0,0,17,0,1,0,47,0,0,0,0,0,0,0,0,0,0,0,1,0,0,0,0,0,0,94,0,0,7,0,0,0,25,55,0,0,11,0,52,19,13,0,0,0,0,0,0,0,0,0,0,0,27,0,0,0,0,11,0,0,61,0,0,0,0,0,0,0,2,0,0,0,0,1,0,0,6,0,0,0,0,0,0,112,0,0,28,0,6,0,0,0,0,0,1,0,0,0,0
"FIN_004_MZB_LO_10","FIN_004_MZB_LO_10-03.10.2017","03.10.2017",2017,10,3,0,0,0,0,0,0,0,0,7,0,0,146,0,0,0,0,0,0,0,0,5,0,0,28,0,0,0,0,0,0,0,0,0,0,0,0,0,0,0,0,0,0,0,7,0,0,0,25,0,0,0,0,0,0,0,0,0,0,0,0,0,0,0,0,0,0,21,0,0,0,0,0,0,28,0,0,0,17,1,8,10,3,0,0,0,0,0,0,0,0,1,0,0,29,0,0,0,0,18,0,0,17,0,0,0,0,0,0,0,1,0,0,0,0,0,0,0,1,0,1,0,0,0,0,0,0,0,6,0,4,0,0,0,0,0,0,0,0,0,0
"FIN_004_MZB_LO_10","FIN_004_MZB_LO_10-08.10.2019","08.10.2019",2019,10,8,0,0,0,0,0,0,0,0,21,0,0,174,0,0,0,0,0,1,0,0,1,0,0,5,1,0,0,0,0,0,0,0,0,0,0,0,6,0,0,0,0,0,0,30,0,0,0,12,0,0,0,0,0,0,0,0,0,7,0,0,0,0,0,0,0,0,28,0,0,0,0,0,0,3,2,0,0,30,0,16,9,45,1,0,0,0,0,0,0,0,1,0,0,14,0,0,0,0,4,0,0,15,0,0,0,0,0,0,0,2,0,0,0,0,0,0,0,0,0,0,0,0,0,0,4,0,0,22,0,6,0,0,2,0,0,0,0,0,0,0
"FIN_004_MZB_LO_100","FIN_004_MZB_LO_100-01.10.2006","01.10.2006",2006,10,1,0,0,0,0,0,0,0,0,0,0,0,50,0,0,0,0,0,0,0,0,5,0,0,7,0,0,0,0,0,0,0,0,0,0,0,0,0,0,0,0,0,0,0,56,0,0,0,0,0,0,0,0,0,0,0,0,0,2,0,3,23,0,0,0,0,0,9,0,0,2,4,0,0,64,0,0,0,3,0,0,0,0,0,0,0,0,0,0,0,0,0,0,0,1,0,0,0,0,57,0,0,0,0,0,0,0,0,0,0,0,0,0,0,0,0,0,0,0,0,0,0,0,0,0,8,0,0,0,0,2,0,0,1,0,0,1,0,0,0,0
"FIN_004_MZB_LO_100","FIN_004_MZB_LO_100-05.10.2009","05.10.2009",2009,10,5,0,0,0,0,0,0,0,0,90,0,0,50,0,0,1,0,0,7,0,0,4,0,0,170,0,0,0,0,1,0,0,1,0,0,0,0,0,0,0,0,0,0,0,67,0,5,5,0,0,0,0,10,0,7,0,0,0,22,0,1,30,0,0,1,0,0,3,0,0,0,1,0,0,294,1,0,0,13,7,1,0,2,0,2,0,3,0,0,0,0,0,0,0,2,0,0,0,0,103,0,0,2,0,0,0,0,1,0,0,11,0,0,0,0,3,0,0,14,0,0,0,0,0,0,33,0,0,55,0,0,0,0,0,0,0,2,0,0,0,0
"FIN_004_MZB_LO_100","FIN_004_MZB_LO_100-03.10.2012","03.10.2012",2012,10,3,0,0,0,0,0,0,0,0,56,0,0,191,0,0,0,0,5,1,0,0,14,0,0,143,0,0,0,0,0,0,0,0,0,0,0,0,0,0,0,0,0,0,0,162,0,1,0,0,0,0,0,22,0,0,0,0,9,7,0,0,34,0,0,0,0,0,6,0,13,0,4,0,0,414,0,0,0,17,36,0,0,31,1,1,0,0,0,0,0,0,0,1,0,11,0,0,0,0,250,0,1,5,0,0,0,1,1,0,0,2,0,0,0,10,6,0,0,20,0,1,0,0,0,0,246,0,0,178,0,1,0,0,3,0,0,0,0,0,0,0
"FIN_004_MZB_LO_100","FIN_004_MZB_LO_100-11.10.2016","11.10.2016",2016,10,11,0,0,0,0,0,0,0,0,363,0,0,62,0,0,0,0,0,0,0,0,6,0,0,107,0,0,0,0,0,0,0,0,0,0,0,0,0,0,0,0,0,0,0,80,0,1,0,0,0,0,0,13,0,0,0,0,2,0,0,1,44,0,0,2,0,0,0,0,0,0,0,0,0,1626,0,0,0,2,1,0,0,7,0,5,0,0,0,0,2,0,0,0,0,0,0,0,0,0,64,0,0,0,0,0,0,2,2,0,0,0,0,0,0,0,0,0,0,27,0,0,0,0,0,0,158,0,0,590,0,0,0,0,0,0,0,0,0,0,0,0
"FIN_004_MZB_LO_100","FIN_004_MZB_LO_100-28.09.2020","28.09.2020",2020,9,28,0,0,0,0,0,0,0,0,248,0,0,76,0,0,0,0,0,0,0,0,20,0,0,92,0,0,0,0,0,0,0,0,0,0,0,0,0,0,0,0,0,0,0,925,0,0,0,0,0,0,0,15,0,0,0,0,5,0,0,0,47,0,0,0,0,0,9,0,0,4,0,0,0,2002,0,0,0,156,61,0,0,4,0,1,0,4,0,0,22,0,5,0,0,0,0,0,0,0,239,0,0,0,0,0,0,28,1,0,0,8,0,0,0,0,0,0,0,114,0,0,0,0,0,0,211,0,0,342,0,0,0,0,0,0,0,0,0,0,0,0
"FIN_004_MZB_LO_101","FIN_004_MZB_LO_101-21.09.1998","21.09.1998",1998,9,21,3,0,0,0,0,0,0,0,0,0,1,26,0,0,0,0,0,0,0,0,1,0,0,14,3,0,0,0,0,0,0,0,0,0,0,0,0,0,0,0,0,0,0,133,0,0,0,0,0,0,0,0,0,0,0,0,0,0,0,5,0,0,0,0,0,0,28,0,0,0,0,0,0,8,0,0,0,2,0,0,0,2,2,0,0,0,0,0,0,0,0,0,0,2,0,0,0,0,12,0,0,7,0,0,0,0,0,0,0,0,0,0,0,0,1,0,0,3,0,0,3,2,0,0,0,0,0,5,0,0,0,0,0,0,0,0,0,0,0,0
"FIN_004_MZB_LO_101","FIN_004_MZB_LO_101-20.10.2004","20.10.2004",2004,10,20,0,0,0,0,0,0,0,0,0,0,0,9,0,0,0,2,0,0,0,0,1,0,0,3,5,0,0,0,0,0,0,0,0,0,0,0,0,0,0,0,0,0,0,6,0,0,0,0,0,0,0,0,0,0,0,0,0,0,0,3,0,0,0,0,0,0,4,0,0,0,0,0,0,7,0,0,0,0,0,0,0,2,4,0,0,0,0,0,0,0,0,0,0,16,0,0,0,0,7,0,0,1,0,0,0,0,0,0,0,0,0,0,0,0,0,0,0,0,0,0,0,0,0,0,2,0,0,0,0,2,0,0,1,0,0,0,0,0,0,0
"FIN_004_MZB_LO_101","FIN_004_MZB_LO_101-01.10.2006","01.10.2006",2006,10,1,0,0,0,0,0,0,0,0,0,0,0,93,0,0,0,11,0,0,0,0,3,0,0,109,33,0,0,0,0,0,0,0,0,0,0,0,0,0,0,0,0,0,0,105,0,2,1,0,0,0,0,0,0,0,0,0,0,1,0,15,6,0,0,0,0,0,23,0,0,7,3,0,0,9,1,0,0,9,3,0,0,0,13,0,0,0,0,0,0,0,0,0,0,5,0,0,0,0,11,0,0,28,0,0,0,0,37,0,0,5,0,0,0,2,3,0,0,0,0,0,0,0,0,0,5,0,0,7,0,12,0,0,6,0,0,0,0,0,0,0
"FIN_004_MZB_LO_101","FIN_004_MZB_LO_101-23.09.2010","23.09.2010",2010,9,23,0,0,0,0,0,0,0,0,0,0,0,99,0,0,0,0,0,0,0,0,4,0,0,61,70,0,0,0,0,0,0,0,0,0,0,0,0,0,0,0,0,0,0,344,0,1,4,0,0,0,0,0,0,0,0,0,0,0,0,30,17,0,0,0,0,0,58,0,0,0,4,0,0,115,0,0,0,50,38,0,0,0,0,0,0,1,0,0,0,0,0,4,0,7,0,0,0,0,45,0,0,84,0,0,0,0,1,0,0,4,0,0,0,0,4,0,0,0,0,0,24,0,0,0,0,0,0,6,0,17,0,0,23,0,0,0,0,0,0,0
"FIN_004_MZB_LO_101","FIN_004_MZB_LO_101-20.10.2014","20.10.2014",2014,10,20,0,0,0,0,0,0,0,0,0,0,0,305,0,0,1,15,0,0,0,0,2,0,0,76,25,0,0,0,0,0,0,0,0,0,0,0,0,0,2,0,0,0,0,63,0,2,7,0,0,0,0,0,0,0,0,0,0,3,0,6,2,0,0,0,0,0,80,0,0,0,1,0,0,0,1,0,0,25,3,9,1,11,4,0,0,0,0,0,0,0,0,0,0,34,0,0,0,0,48,0,0,19,0,0,0,0,5,0,0,1,0,0,0,0,9,0,0,0,0,0,0,0,0,0,49,0,0,19,0,13,0,0,1,0,0,0,0,0,0,0
"FIN_004_MZB_LO_101","FIN_004_MZB_LO_101-19.10.2018","19.10.2018",2018,10,19,0,0,0,0,0,0,0,0,0,0,0,249,0,0,0,33,0,0,2,0,6,0,0,164,33,0,0,0,0,0,0,0,0,0,0,0,2,0,0,0,0,0,0,47,0,0,3,0,0,0,0,0,0,0,0,0,0,1,0,7,4,0,0,0,0,0,0,0,0,0,0,0,0,5,1,0,0,45,3,3,0,23,2,0,0,0,0,0,0,0,0,0,0,0,0,0,0,0,7,0,0,27,0,0,0,1,5,0,0,1,0,0,0,0,8,0,0,0,0,0,0,0,0,0,7,0,0,11,0,4,0,0,1,0,0,0,0,0,0,0
"FIN_004_MZB_LO_101","FIN_004_MZB_LO_101-05.10.2021","05.10.2021",2021,10,5,0,0,0,0,0,0,0,0,0,0,0,314,0,0,0,5,0,0,4,0,0,0,0,92,42,0,0,0,0,0,0,0,0,0,0,0,0,0,0,0,0,0,0,224,0,6,3,0,0,0,0,0,0,0,0,0,0,0,0,13,15,0,0,0,0,0,92,0,0,0,4,0,0,49,2,0,0,63,26,7,0,18,3,0,0,0,0,0,0,0,0,0,0,34,0,0,0,0,49,0,0,20,0,0,0,0,5,0,0,3,0,0,0,10,7,0,0,1,0,1,0,0,0,1,28,0,0,17,1,24,0,0,10,0,0,0,0,0,0,0
"FIN_004_MZB_LO_102","FIN_004_MZB_LO_102-10.09.2007","10.09.2007",2007,9,10,0,0,0,0,0,0,0,0,7,0,0,12,0,0,0,0,0,0,0,0,0,0,0,15,0,0,0,0,0,0,0,0,0,0,0,2,0,0,0,0,0,0,0,7,0,0,0,0,0,0,0,4,0,13,0,0,0,0,0,0,0,0,0,2,0,0,0,0,0,0,0,0,0,225,0,0,0,0,3,0,0,1,0,0,0,0,0,0,0,0,67,0,0,0,0,0,0,0,3,0,0,0,0,0,0,0,0,0,0,0,0,0,0,0,0,0,0,2,0,0,0,0,0,0,18,0,0,0,0,0,0,0,0,0,0,0,0,0,0,0
"FIN_004_MZB_LO_102","FIN_004_MZB_LO_102-09.09.2010","09.09.2010",2010,9,9,0,0,0,0,0,0,0,0,0,0,0,50,0,0,0,0,0,0,0,0,0,0,0,81,0,0,0,0,0,0,0,0,0,0,0,0,0,0,0,0,0,0,0,61,0,2,0,0,0,0,0,2,0,16,0,0,0,0,0,0,0,0,0,0,0,0,3,0,0,0,3,0,0,292,0,0,0,0,4,0,0,0,0,4,0,0,0,0,0,0,4,0,0,3,0,0,0,0,7,0,0,0,0,0,0,0,2,0,0,0,0,0,0,0,16,0,0,15,0,0,0,0,0,0,16,0,0,5,0,0,0,0,4,0,0,0,0,0,0,0
"FIN_004_MZB_LO_102","FIN_004_MZB_LO_102-09.09.2013","09.09.2013",2013,9,9,0,0,0,0,0,0,0,0,7,0,0,295,0,0,0,0,0,3,0,0,0,0,0,378,0,0,0,0,0,0,0,9,0,0,0,0,0,0,0,0,0,0,0,127,0,2,0,0,0,0,0,0,0,389,0,0,0,0,0,0,0,0,5,0,0,0,10,0,0,4,4,0,0,138,0,0,0,0,46,0,0,6,2,56,0,0,0,0,0,0,88,0,0,12,0,0,0,0,17,0,0,0,0,0,0,0,0,0,0,4,0,0,0,3,2,0,0,6,0,9,0,3,0,0,4,0,0,9,0,0,0,0,12,0,0,0,0,0,0,0
"FIN_004_MZB_LO_102","FIN_004_MZB_LO_102-01.10.2015","01.10.2015",2015,10,1,0,0,0,0,0,0,0,0,40,0,0,476,0,0,0,0,0,4,0,0,0,0,0,204,0,0,0,0,0,0,0,4,0,0,0,0,0,0,0,0,0,0,0,80,0,4,0,0,0,0,0,8,0,84,0,0,0,0,0,0,0,0,0,0,0,0,0,0,0,4,0,0,0,128,0,0,0,0,16,0,0,0,0,12,0,0,0,0,0,0,8,0,0,4,0,0,0,0,44,0,0,0,0,0,0,0,0,0,0,8,0,0,0,0,0,0,0,36,0,0,0,0,0,0,552,0,0,32,0,0,0,0,0,0,0,12,0,0,0,0
"FIN_004_MZB_LO_102","FIN_004_MZB_LO_102-08.10.2018","08.10.2018",2018,10,8,0,0,0,0,0,0,0,0,1,0,0,12,0,0,0,0,0,1,0,0,1,0,0,293,0,0,0,0,0,0,0,0,0,0,0,0,0,0,0,0,0,0,0,17,0,0,0,0,0,0,0,2,0,4,0,0,0,0,0,0,0,0,0,0,0,0,0,0,0,0,0,0,0,199,0,0,0,1,1,0,0,0,0,1,0,0,0,0,0,0,2,0,0,0,0,0,0,0,41,0,0,0,0,0,0,0,0,0,0,56,0,0,0,0,2,0,0,9,0,0,0,0,0,0,6,0,0,10,0,0,0,0,0,0,0,13,1,0,0,0
"FIN_004_MZB_LO_103","FIN_004_MZB_LO_103-10.09.2007","10.09.2007",2007,9,10,0,0,0,0,0,0,0,0,17,0,0,30,0,0,0,0,0,0,0,0,2,0,0,33,0,0,0,0,0,0,0,0,0,0,0,0,2,0,0,0,0,3,0,70,0,1,0,0,0,0,0,0,0,0,0,0,0,0,0,0,0,0,0,0,0,0,0,0,0,0,46,0,1,8,0,0,0,3,0,3,172,0,0,0,0,0,0,0,0,0,1,0,0,203,0,0,0,0,3,0,0,1,0,0,0,0,0,0,0,0,0,0,0,0,0,0,0,6,0,0,0,0,1,0,27,0,0,1,0,50,0,0,0,0,0,0,0,0,0,0
"FIN_004_MZB_LO_103","FIN_004_MZB_LO_103-28.09.2010","28.09.2010",2010,9,28,0,0,0,0,0,0,0,0,26,0,0,1094,0,0,0,0,0,0,23,0,0,0,0,99,0,0,0,0,0,0,0,0,0,0,0,0,18,0,0,0,0,0,0,57,0,0,0,0,0,0,0,0,0,0,0,0,0,0,0,0,0,0,0,0,0,0,0,0,0,5,30,0,0,0,0,0,0,0,0,16,283,15,2,0,0,0,0,0,0,0,0,0,0,101,0,0,0,0,3,0,0,13,1,0,0,0,0,0,0,14,0,0,0,0,3,0,0,23,0,0,0,0,1,0,5,0,0,1,0,92,0,0,0,0,0,0,0,0,0,0
"FIN_004_MZB_LO_103","FIN_004_MZB_LO_103-18.09.2014","18.09.2014",2014,9,18,0,0,0,0,0,0,0,0,16,0,0,993,0,0,0,0,0,0,2,0,1,0,0,213,0,0,0,0,0,0,0,0,0,0,0,0,15,0,0,0,0,0,0,184,0,0,0,0,0,0,0,0,0,0,0,0,0,0,0,0,0,0,0,0,0,0,0,0,0,0,105,0,0,1,0,0,0,0,0,6,204,5,1,0,0,0,0,0,0,0,0,0,0,20,0,0,0,0,1,0,0,16,0,0,0,0,0,0,0,4,0,0,0,0,0,0,0,55,0,0,0,0,0,0,6,0,0,0,0,325,0,0,0,0,0,0,0,0,0,0
"FIN_004_MZB_LO_103","FIN_004_MZB_LO_103-20.09.2017","20.09.2017",2017,9,20,0,0,0,0,0,0,0,0,10,0,0,200,0,0,0,0,0,0,1,0,0,0,0,1,0,0,0,0,0,0,0,0,0,0,0,0,5,0,0,0,0,0,0,64,0,0,0,1,0,0,0,0,0,0,0,0,0,0,0,0,0,0,0,0,0,0,0,0,0,0,45,0,0,0,0,0,0,0,0,0,48,2,0,0,0,0,0,0,0,0,0,0,0,14,0,0,0,0,0,0,0,5,0,0,0,0,0,0,0,3,0,0,0,0,0,0,0,17,0,0,0,0,0,0,1,0,0,0,0,47,0,0,0,0,0,0,0,0,0,0
"FIN_004_MZB_LO_103","FIN_004_MZB_LO_103-22.09.2020","22.09.2020",2020,9,22,0,0,0,0,0,0,0,0,6,0,0,133,0,0,0,0,0,0,8,0,0,0,0,24,0,0,0,0,0,0,0,0,0,0,0,0,4,0,0,0,0,0,0,104,0,0,0,0,0,0,0,0,0,0,0,0,0,0,0,0,0,0,0,0,0,0,0,0,0,0,31,0,0,0,0,0,0,0,0,0,84,5,1,0,0,0,0,0,0,0,0,0,0,26,0,0,0,0,17,0,0,2,0,0,0,0,0,0,0,5,0,0,0,0,0,0,0,15,0,0,0,0,0,0,1,0,0,0,0,16,0,0,0,0,0,0,0,0,0,0
"FIN_004_MZB_LO_104","FIN_004_MZB_LO_104-21.09.2004","21.09.2004",2004,9,21,0,0,0,0,0,0,0,0,4,0,0,7,0,0,0,0,0,0,0,0,0,0,0,43,0,0,0,0,0,0,0,0,0,0,0,0,0,0,0,0,0,0,0,48,0,0,0,0,0,0,0,0,0,0,0,0,0,0,0,0,0,0,0,0,0,0,16,0,0,1,0,0,0,9,60,0,0,91,0,4,11,1,0,0,0,0,0,0,0,0,0,0,0,42,0,0,0,0,58,0,0,0,0,0,0,0,0,0,0,22,0,0,0,0,0,0,0,8,0,0,0,0,0,0,3,0,0,123,0,2,0,0,0,0,0,0,0,0,0,0
"FIN_004_MZB_LO_104","FIN_004_MZB_LO_104-04.09.2007","04.09.2007",2007,9,4,0,0,0,0,0,0,0,0,26,0,0,44,0,0,0,0,0,0,0,0,1,0,0,6,0,0,0,0,0,0,0,0,0,0,0,0,0,0,0,0,0,0,0,8,0,0,0,0,0,0,0,0,0,0,0,0,0,0,1,0,0,0,0,0,0,0,40,0,0,3,0,0,0,17,1,0,0,4,2,11,3,0,0,0,0,0,0,0,0,0,0,0,0,25,0,0,0,0,11,0,0,2,0,0,0,1,0,0,0,7,0,0,0,0,1,0,0,10,0,0,0,0,0,0,81,0,0,6,0,21,0,0,0,0,0,0,0,0,0,0
"FIN_004_MZB_LO_104","FIN_004_MZB_LO_104-14.09.2011","14.09.2011",2011,9,14,0,0,0,0,0,0,0,0,28,0,0,20,0,0,0,0,0,0,1,0,0,0,0,12,0,0,0,0,0,0,0,0,0,0,0,0,0,0,0,0,0,0,0,7,0,1,0,0,0,0,0,0,0,0,0,0,0,9,0,0,0,0,0,0,0,0,93,0,0,2,0,0,0,24,2,0,0,18,2,4,65,1,0,0,0,0,0,0,0,0,0,0,0,74,0,0,0,0,2,0,0,30,0,0,0,0,0,0,0,5,0,0,0,0,0,0,0,42,0,0,4,0,0,0,58,0,0,2,0,23,0,0,0,0,0,0,0,0,0,0
"FIN_004_MZB_LO_104","FIN_004_MZB_LO_104-14.09.2015","14.09.2015",2015,9,14,0,0,0,0,0,0,0,0,6,0,0,29,0,0,0,0,0,0,0,0,0,0,0,8,0,0,0,0,0,0,0,0,0,0,0,0,1,0,0,0,0,0,0,40,0,0,0,1,0,0,0,0,0,0,0,0,0,4,0,0,0,0,0,0,0,0,142,0,0,0,0,0,0,3,0,0,0,3,3,2,44,5,0,0,0,0,0,0,0,0,0,0,0,24,0,0,0,0,15,0,0,2,0,0,0,0,0,0,0,3,0,0,0,0,0,0,0,31,0,0,1,0,0,0,23,0,0,2,0,80,0,0,0,0,0,0,0,0,0,0
"FIN_004_MZB_LO_104","FIN_004_MZB_LO_104-23.09.2019","23.09.2019",2019,9,23,0,0,0,0,0,0,0,0,40,0,0,14,0,0,0,0,0,0,1,0,0,0,0,28,0,0,0,0,0,0,0,0,0,0,0,0,0,0,0,0,0,0,0,17,0,0,0,0,0,0,0,2,0,0,0,0,0,1,0,0,0,0,0,0,0,0,70,0,0,0,0,0,0,14,2,0,0,7,2,12,22,32,0,0,0,0,0,0,1,0,0,0,0,12,0,0,0,0,15,0,0,5,0,0,0,0,0,0,0,29,0,0,0,0,0,0,0,14,0,0,1,0,0,1,10,0,0,13,0,13,0,0,0,0,0,1,0,0,0,0
"FIN_004_MZB_LO_105","FIN_004_MZB_LO_105-17.09.2007","17.09.2007",2007,9,17,0,0,0,0,0,0,0,0,480,0,0,824,0,0,1,0,28,2,0,0,5,0,0,119,0,0,0,0,0,0,0,0,0,0,0,0,0,0,0,1,0,0,0,1319,0,35,0,0,0,0,0,9,0,0,0,0,0,8,0,0,37,0,0,0,0,0,67,0,0,2,0,0,0,1008,5,0,0,354,110,30,0,0,0,0,0,0,0,0,0,0,0,0,0,3,0,0,0,0,143,0,0,0,0,0,0,1,0,0,0,0,0,0,0,0,44,0,0,35,0,0,0,5,0,0,97,0,0,83,16,117,0,0,0,0,0,0,0,2,0,0
"FIN_004_MZB_LO_105","FIN_004_MZB_LO_105-11.09.2013","11.09.2013",2013,9,11,0,0,0,0,0,0,0,0,497,0,0,242,0,0,0,0,3,4,0,0,0,0,0,45,0,0,0,0,0,0,0,0,0,0,0,0,0,0,0,0,0,0,0,1298,0,3,0,0,0,0,0,25,0,0,0,0,0,6,0,0,0,0,0,3,0,0,45,0,0,23,12,0,0,137,230,0,0,783,150,11,0,10,0,0,0,0,0,0,0,0,12,9,0,19,0,0,0,0,189,0,0,0,0,0,0,0,0,0,0,0,0,0,0,0,10,0,0,3,0,0,0,0,0,0,0,0,0,0,0,24,0,0,0,0,0,33,0,0,0,0
"FIN_004_MZB_LO_105","FIN_004_MZB_LO_105-24.09.2014","24.09.2014",2014,9,24,0,0,0,0,0,0,0,0,130,0,0,312,0,0,0,0,0,0,0,0,0,0,0,26,0,0,0,0,0,0,0,0,0,0,0,0,2,0,0,0,0,0,0,348,0,10,0,0,0,0,0,6,0,0,0,0,0,8,0,0,2,0,0,0,0,0,6,0,0,24,8,0,0,210,56,0,0,276,20,0,0,0,0,0,0,0,0,0,0,0,8,0,0,0,0,0,0,0,12,0,0,0,0,0,0,0,0,0,0,0,0,0,0,8,0,0,0,18,0,0,0,4,0,0,40,0,0,30,0,0,0,0,0,0,0,4,0,0,0,0
"FIN_004_MZB_LO_105","FIN_004_MZB_LO_105-24.09.2015","24.09.2015",2015,9,24,0,0,0,0,0,0,0,0,231,0,0,293,0,0,0,0,0,0,0,0,0,0,0,10,0,0,0,0,0,0,0,0,0,0,0,0,0,0,0,0,0,0,0,773,0,8,0,0,0,0,0,30,0,0,0,0,0,1,0,0,8,0,7,0,0,0,9,0,0,1,0,0,0,293,2,0,0,344,10,2,0,1,0,0,0,0,0,0,0,0,91,0,0,0,0,0,0,0,17,0,0,0,0,0,0,0,0,0,0,0,0,0,0,8,0,0,0,20,0,0,0,0,0,0,38,0,0,32,0,29,0,0,2,0,0,8,0,0,0,0
"FIN_004_MZB_LO_105","FIN_004_MZB_LO_105-09.10.2018","09.10.2018",2018,10,9,0,0,0,0,0,0,0,0,894,0,0,120,0,0,0,0,0,0,0,0,0,0,0,2,0,0,0,0,0,0,0,0,0,0,0,0,0,0,0,0,0,0,0,492,0,0,6,0,0,0,0,17,0,0,0,0,0,2,0,0,1,0,2,0,0,0,3,0,0,18,4,0,0,1257,19,0,0,381,49,10,0,17,0,0,0,0,0,0,0,0,17,0,0,0,0,0,0,0,8,0,0,0,0,1,0,0,0,0,0,0,0,0,0,0,0,0,0,5,0,0,0,0,0,0,521,0,0,1,0,4,0,0,1,0,0,36,0,0,0,0
"FIN_004_MZB_LO_106","FIN_004_MZB_LO_106-29.09.2008","29.09.2008",2008,9,29,0,0,0,0,0,0,0,0,12,0,0,456,0,0,0,0,0,0,150,0,16,0,0,1225,0,0,0,0,0,0,0,0,0,0,0,0,32,0,0,0,0,0,0,936,0,4,24,0,0,0,0,0,0,0,0,0,0,359,0,0,0,0,0,0,0,0,2,0,0,3,0,0,0,60,0,0,0,64,6,69,1037,16,109,0,0,0,0,0,0,0,0,0,0,243,0,0,0,0,192,0,0,6,0,0,0,0,9,0,0,34,0,0,0,2,30,0,0,20,0,0,9,0,0,4,122,0,0,138,0,17,0,0,0,2,0,4,0,0,0,0
"FIN_004_MZB_LO_106","FIN_004_MZB_LO_106-22.09.2010","22.09.2010",2010,9,22,0,0,0,0,0,0,0,0,3,0,0,16,0,0,0,0,0,0,0,0,2,0,0,19,0,0,0,0,0,0,0,0,0,0,0,0,8,0,0,0,0,0,0,371,0,1,19,0,0,0,0,0,0,0,0,0,0,10,0,0,0,0,0,0,0,0,1,0,0,13,9,0,0,26,3,0,0,100,10,20,199,4,13,0,0,16,0,0,0,0,2,0,0,30,0,0,0,0,6,0,0,1,0,0,0,0,16,0,0,27,0,0,0,0,1,0,0,2,0,0,7,0,0,0,1,0,0,30,0,0,0,0,1,0,0,0,0,0,0,0
"FIN_004_MZB_LO_106","FIN_004_MZB_LO_106-11.09.2013","11.09.2013",2013,9,11,0,0,0,0,0,0,0,0,15,0,0,193,0,0,0,0,0,6,0,0,0,0,0,50,0,0,0,0,0,0,0,0,0,0,0,0,14,0,0,0,0,0,0,1101,0,7,29,0,0,0,0,0,0,0,0,0,0,33,0,0,0,0,0,0,0,0,0,0,0,14,6,0,0,124,0,0,0,25,19,18,547,2,9,0,0,0,0,0,0,0,0,0,0,34,0,0,0,0,27,0,0,0,0,0,0,0,6,0,0,13,0,0,0,0,4,0,0,6,0,0,22,0,3,0,1,0,0,50,0,3,0,0,1,0,0,0,0,0,0,0
"FIN_004_MZB_LO_106","FIN_004_MZB_LO_106-29.09.2014","29.09.2014",2014,9,29,0,0,0,0,0,0,0,0,60,0,0,359,0,0,0,0,0,0,0,0,16,0,0,158,0,0,0,0,0,0,0,0,0,0,0,0,58,0,0,0,0,0,0,733,0,0,28,0,0,0,0,0,0,0,0,0,0,9,0,0,0,0,0,0,0,0,3,0,0,34,15,0,0,31,0,0,0,367,6,0,716,0,0,0,0,0,0,0,0,0,4,0,0,4,0,0,0,0,18,0,0,4,0,0,0,0,2,0,0,31,0,0,0,0,2,0,0,1,0,0,4,0,0,0,0,0,0,22,0,0,0,0,0,0,0,3,0,0,0,0
"FIN_004_MZB_LO_106","FIN_004_MZB_LO_106-09.10.2018","09.10.2018",2018,10,9,0,0,0,0,0,0,0,0,22,0,0,256,0,0,0,0,0,0,11,0,7,0,0,18,0,0,0,0,0,1,0,0,0,0,0,0,13,0,0,0,0,0,0,799,0,0,26,0,0,0,0,2,0,0,0,0,1,21,0,0,0,0,2,0,0,0,0,0,0,56,20,0,0,44,0,0,0,30,9,0,332,0,5,1,0,0,0,0,0,0,0,0,0,7,0,0,0,0,19,0,0,0,0,0,0,0,6,0,0,6,0,0,0,0,2,0,0,6,0,0,14,0,1,0,26,0,0,17,0,1,0,0,3,0,0,0,0,0,0,0
"FIN_004_MZB_LO_107","FIN_004_MZB_LO_107-23.09.2008","23.09.2008",2008,9,23,0,0,0,0,0,0,0,0,3,0,0,328,0,0,0,0,74,0,0,0,8,0,0,112,0,0,0,0,2,0,0,0,0,0,0,0,0,0,2,0,0,0,0,77,0,3,38,0,0,0,0,1,0,0,0,0,0,0,0,0,2,0,0,0,0,0,10,0,0,5,0,0,0,142,47,0,0,4,8,27,0,0,0,0,0,0,0,0,0,0,8,0,0,19,0,0,0,0,49,0,0,0,0,0,0,0,0,0,0,14,0,0,0,0,1,0,0,63,0,0,0,0,0,0,24,0,0,26,0,534,0,0,0,0,0,1,0,0,0,0
"FIN_004_MZB_LO_107","FIN_004_MZB_LO_107-16.09.2010","16.09.2010",2010,9,16,0,0,0,0,0,0,0,0,2,0,0,173,0,0,0,0,2,6,0,0,0,0,0,23,0,0,0,0,0,0,0,0,0,0,0,0,0,0,0,4,0,1,0,98,0,0,0,0,0,0,0,2,0,0,0,0,0,0,0,2,6,0,0,0,0,0,14,0,0,2,9,0,0,462,7,0,0,24,1,2,0,2,0,0,0,0,0,0,0,0,43,0,0,6,0,0,0,0,2,0,0,2,0,0,0,0,0,0,0,9,0,0,0,26,0,0,0,5,0,2,0,1,0,0,13,0,0,0,0,397,0,0,5,0,0,0,0,0,0,0
"FIN_004_MZB_LO_107","FIN_004_MZB_LO_107-30.09.2013","30.09.2013",2013,9,30,0,0,0,0,0,0,0,0,24,0,0,579,0,0,0,0,12,0,0,0,0,0,0,84,0,0,0,0,0,0,0,0,0,0,0,0,0,0,0,0,0,0,0,78,0,3,0,0,0,0,0,3,0,0,0,0,0,0,0,9,0,0,0,0,0,0,60,0,0,18,6,0,0,195,129,0,0,93,3,9,0,6,0,0,0,0,0,0,0,0,3,0,0,12,0,0,0,0,3,0,0,3,0,0,0,0,0,0,0,30,0,0,0,0,18,0,0,6,0,0,0,3,0,0,81,0,0,0,0,258,0,0,0,0,0,0,0,0,0,0
"FIN_004_MZB_LO_107","FIN_004_MZB_LO_107-06.10.2016","06.10.2016",2016,10,6,0,0,0,0,0,0,0,0,14,0,0,64,0,0,0,0,63,0,0,0,0,0,0,5,0,0,0,0,0,0,0,0,0,0,0,0,0,0,0,0,0,1,0,113,0,5,0,0,0,0,0,6,0,0,0,0,0,0,0,0,0,0,0,0,0,0,145,0,0,0,3,0,0,611,3,0,0,328,3,16,0,0,0,0,0,0,0,0,0,0,4,0,0,11,0,0,0,0,0,0,0,1,0,0,0,0,0,0,0,1,0,0,0,4,10,0,2,28,0,0,0,0,0,0,1,0,0,4,0,15,0,0,0,0,0,0,0,0,0,0
"FIN_004_MZB_LO_107","FIN_004_MZB_LO_107-14.10.2019","14.10.2019",2019,10,14,0,4,0,0,0,0,0,0,12,0,0,1514,0,0,0,0,98,4,0,0,6,0,0,244,0,0,0,0,0,0,0,0,0,0,0,0,0,0,0,0,0,0,0,270,0,2,12,0,0,0,0,10,0,0,0,0,0,0,0,8,24,0,0,4,0,0,40,0,0,14,0,0,0,232,586,0,0,198,24,102,0,108,0,0,0,0,0,0,0,0,16,0,0,36,0,0,0,0,76,0,0,0,0,0,0,0,36,0,0,32,0,0,0,0,12,0,0,66,0,0,0,0,0,0,752,0,0,200,0,60,0,0,0,0,0,8,0,0,0,0
"FIN_004_MZB_LO_108","FIN_004_MZB_LO_108-26.09.2007","26.09.2007",2007,9,26,0,0,0,0,0,0,0,0,1770,0,0,126,0,0,0,0,0,0,0,0,42,6,0,1512,0,0,0,0,0,12,6,0,0,0,0,0,0,0,0,0,0,0,0,798,0,18,0,0,0,0,0,30,0,0,0,0,6,42,0,12,0,0,0,0,0,0,114,0,0,0,0,0,0,3156,72,0,0,378,228,60,0,0,0,6,0,0,0,0,6,12,0,0,0,360,0,0,0,0,300,0,0,18,0,0,0,0,6,0,0,540,0,0,0,0,6,0,0,168,0,0,0,0,0,0,66,0,0,1548,0,0,0,0,24,0,0,6,0,6,0,0
"FIN_004_MZB_LO_108","FIN_004_MZB_LO_108-14.10.2010","14.10.2010",2010,10,14,0,0,0,0,0,0,0,0,0,0,0,92,0,0,0,0,0,0,0,0,3,0,0,120,0,0,0,0,0,1,0,0,0,0,0,0,0,0,0,0,0,0,0,35,0,1,0,0,0,0,0,0,0,0,0,0,3,3,0,6,0,0,0,0,0,0,6,0,0,0,0,0,0,2,0,0,0,14,2,43,15,0,2,0,0,0,0,0,0,0,0,0,0,5,0,0,0,0,15,0,0,1,0,0,0,0,0,0,0,55,0,0,0,0,4,0,0,0,0,0,0,0,3,1,10,0,0,114,0,3,0,0,0,0,0,1,0,0,0,0
"FIN_004_MZB_LO_108","FIN_004_MZB_LO_108-27.09.2013","27.09.2013",2013,9,27,0,0,0,0,0,0,0,0,3,0,0,462,0,0,0,0,0,0,0,0,1,0,0,28,0,0,0,0,0,4,0,0,0,0,0,0,0,0,0,0,0,0,0,90,0,0,0,0,0,0,0,0,0,0,0,0,0,4,0,15,0,0,0,0,0,0,37,0,0,0,0,0,0,176,0,0,0,8,0,6,89,1,4,0,0,0,0,0,0,0,0,0,0,42,0,0,0,0,32,0,0,3,0,0,0,0,0,0,0,105,0,0,0,0,1,0,0,6,0,0,0,0,3,0,3,0,0,182,0,3,0,0,0,0,0,0,0,0,0,0
"FIN_004_MZB_LO_108","FIN_004_MZB_LO_108-12.10.2017","12.10.2017",2017,10,12,0,0,0,0,0,0,0,0,0,0,0,660,0,0,0,0,1,0,0,0,3,0,0,171,0,0,0,0,0,1,0,0,0,0,0,0,0,0,0,0,0,0,0,28,0,5,0,0,0,0,0,0,0,0,0,0,0,16,0,4,0,0,0,0,0,0,27,0,0,3,0,0,0,251,1,0,0,3,1,6,181,4,0,0,0,0,0,0,0,0,0,0,0,489,0,0,0,0,18,0,0,2,0,0,0,0,0,0,0,98,0,0,0,0,4,0,0,14,0,0,0,0,0,1,320,0,0,237,0,0,0,0,0,0,0,0,0,0,0,0
"FIN_004_MZB_LO_108","FIN_004_MZB_LO_108-28.09.2020","28.09.2020",2020,9,28,0,0,0,0,0,0,0,0,0,0,0,861,0,0,0,0,0,2,1,0,76,0,0,1340,0,0,0,0,0,0,0,0,0,0,0,0,4,0,0,0,0,0,0,106,0,36,2,0,0,0,0,0,0,0,0,0,0,15,0,1,0,0,0,0,0,0,4,0,0,7,1,0,0,390,2,0,0,9,0,5,454,5,6,0,0,0,0,0,27,0,1,0,0,106,0,0,0,0,97,0,0,24,0,0,0,0,0,0,0,90,0,0,0,1,5,0,0,101,0,0,0,0,2,41,334,0,0,275,0,17,0,0,0,0,0,0,0,0,0,0
"FIN_004_MZB_LO_109","FIN_004_MZB_LO_109-03.10.2007","03.10.2007",2007,10,3,0,0,0,0,0,0,0,0,0,0,0,158,0,0,0,0,0,0,0,0,0,0,0,15,0,0,0,0,0,0,0,0,0,0,0,0,0,0,0,0,0,0,0,32,0,0,0,0,0,0,0,0,0,0,0,0,0,0,0,0,0,0,0,0,0,0,1,0,0,1,0,0,0,23,9,0,0,12,4,2,0,0,0,0,0,0,0,0,32,0,0,0,0,45,0,0,0,0,8,0,0,2,0,0,0,0,1,0,0,3,0,0,0,2,0,0,0,3,0,0,0,0,0,0,20,0,0,16,0,25,0,0,1,0,0,0,0,0,0,0
"FIN_004_MZB_LO_109","FIN_004_MZB_LO_109-09.09.2008","09.09.2008",2008,9,9,0,0,0,0,0,0,0,0,56,0,0,39,0,0,0,0,0,0,0,0,24,0,5,84,0,0,0,0,0,3,0,1,0,0,0,0,0,0,0,0,0,0,0,306,0,3,1,0,0,0,0,14,0,0,0,0,0,43,1,1,1,0,0,3,0,0,37,0,0,12,6,0,0,6,8,0,0,38,21,0,5,6,11,0,0,0,0,0,0,7,0,2,0,11,0,0,0,0,383,0,0,2,0,0,0,0,9,0,0,0,0,0,0,1,0,0,0,15,0,0,0,1,0,0,123,0,0,124,0,0,0,0,5,0,0,36,0,0,0,0
"FIN_004_MZB_LO_109","FIN_004_MZB_LO_109-13.09.2010","13.09.2010",2010,9,13,0,0,0,0,0,0,0,0,9,0,0,233,0,0,0,0,0,0,0,0,2,0,272,14,0,0,0,0,0,0,0,0,0,0,0,0,0,0,0,0,0,0,0,148,0,5,0,0,0,0,0,0,0,0,0,0,0,1,0,0,4,0,0,0,0,0,63,0,0,0,2,0,0,73,3,0,0,48,6,0,0,0,0,0,0,0,0,0,10,0,0,0,0,59,0,0,0,0,143,0,0,14,0,0,0,0,39,0,0,0,0,0,0,0,0,0,0,33,0,0,0,0,0,11,27,0,0,13,0,11,0,0,0,0,0,3,0,0,0,0
"FIN_004_MZB_LO_109","FIN_004_MZB_LO_109-03.09.2014","03.09.2014",2014,9,3,0,0,0,0,0,0,0,0,32,0,0,51,0,0,0,0,0,0,0,0,0,0,75,18,0,0,0,0,0,0,0,0,0,0,0,0,1,0,0,0,1,0,0,625,0,0,0,0,0,0,0,1,0,0,0,0,0,9,0,0,2,0,0,0,0,0,15,0,0,1,2,0,0,37,149,0,0,85,4,2,10,0,3,0,0,0,0,0,11,3,10,0,0,11,0,0,0,0,25,0,0,5,0,0,0,0,0,0,0,6,0,0,0,1,1,0,0,0,0,8,0,0,0,0,32,0,0,0,1,2,0,0,6,0,0,0,0,0,0,0
"FIN_004_MZB_LO_109","FIN_004_MZB_LO_109-16.10.2018","16.10.2018",2018,10,16,0,0,0,0,0,0,0,0,12,0,0,337,0,0,0,0,0,0,0,0,0,0,8,5,1,0,0,0,0,0,0,0,0,0,0,0,0,0,0,0,0,0,0,52,0,0,0,0,0,0,0,8,0,0,0,0,0,4,0,0,0,0,0,0,0,0,174,0,0,0,0,0,0,266,3,0,0,22,0,0,0,0,0,0,0,0,0,0,21,0,1,0,0,6,0,0,0,0,61,0,0,3,0,0,0,1,19,0,0,5,0,0,0,0,0,0,0,8,0,0,0,0,0,2,3,0,0,0,0,0,0,0,0,0,0,0,0,0,0,0
"FIN_004_MZB_LO_11","FIN_004_MZB_LO_11-17.09.2009","17.09.2009",2009,9,17,0,0,0,0,0,0,0,0,10,0,0,34,0,0,0,0,0,3,5,0,16,0,0,487,0,0,0,0,0,0,0,0,0,0,0,0,7,0,0,0,0,2,0,50,0,0,0,0,0,0,0,0,0,0,0,0,0,0,0,0,0,0,0,0,0,0,20,0,0,2,1,0,0,2,0,0,0,0,4,241,5,2,0,0,0,0,0,0,0,0,0,1,0,13,0,0,0,0,43,0,0,0,1,0,0,0,0,0,0,9,0,0,0,0,0,0,0,7,0,0,0,0,0,0,6,0,0,3,0,54,0,0,0,0,0,0,0,0,0,0
"FIN_004_MZB_LO_11","FIN_004_MZB_LO_11-20.09.2010","20.09.2010",2010,9,20,0,0,0,0,0,0,0,0,0,0,0,20,0,0,0,0,0,1,0,0,0,0,0,33,0,0,0,0,0,0,0,2,0,0,0,0,3,0,0,0,0,1,0,6,0,0,1,0,0,0,0,0,0,0,0,0,0,0,0,0,0,0,0,0,0,0,17,0,0,0,0,0,1,20,1,0,0,0,7,14,6,0,0,0,0,4,0,0,0,0,0,0,0,3,0,0,0,0,5,0,0,1,0,0,0,0,0,0,0,15,0,0,0,0,0,0,0,4,0,0,0,1,0,0,2,0,0,0,0,19,0,0,0,0,0,0,0,0,0,0
"FIN_004_MZB_LO_11","FIN_004_MZB_LO_11-19.09.2011","19.09.2011",2011,9,19,0,0,0,0,0,0,0,0,0,0,0,93,0,0,0,0,0,0,2,0,4,0,0,391,0,0,0,0,0,0,0,0,0,0,0,0,3,0,0,0,0,0,0,274,0,0,0,2,0,0,0,0,0,0,0,0,0,1,0,0,0,0,0,0,0,0,24,0,0,7,22,0,0,22,0,0,0,0,1,11,24,0,0,0,0,0,0,0,0,0,0,0,0,101,0,0,0,0,80,0,0,0,0,0,0,0,0,0,0,1,0,0,0,0,1,0,0,30,0,0,0,0,0,0,9,0,0,4,0,8,0,0,0,0,0,0,0,0,0,0
"FIN_004_MZB_LO_11","FIN_004_MZB_LO_11-25.09.2012","25.09.2012",2012,9,25,0,0,0,0,0,0,0,0,1,0,0,786,0,0,0,0,0,0,0,0,3,0,0,186,0,0,0,0,0,0,0,1,0,0,0,0,15,0,0,0,0,0,0,145,0,0,0,0,0,0,0,0,0,0,0,0,0,3,0,0,0,0,0,0,0,0,98,0,0,10,14,0,0,8,0,0,0,0,1,4,47,4,0,0,0,0,0,0,0,0,0,0,0,84,0,0,0,0,63,0,0,4,0,0,0,0,0,0,0,0,0,0,0,0,0,0,0,45,0,0,0,13,0,0,28,0,0,0,0,58,0,0,0,0,0,0,0,0,0,0
"FIN_004_MZB_LO_11","FIN_004_MZB_LO_11-25.09.2013","25.09.2013",2013,9,25,0,0,0,0,0,0,0,0,10,0,0,494,0,0,0,0,0,0,0,0,1,0,0,68,0,0,0,0,0,0,0,0,0,0,0,0,24,0,0,0,0,0,0,180,0,2,0,0,0,0,0,0,0,0,0,0,0,0,0,0,0,0,0,0,0,0,115,0,0,0,5,0,0,6,0,0,0,0,0,43,59,7,0,0,0,0,0,0,1,0,1,0,0,56,0,0,0,0,10,0,0,1,0,0,0,0,0,0,0,1,0,0,0,4,1,0,0,16,0,0,1,30,0,0,16,0,0,1,0,24,0,0,1,0,0,0,0,0,0,0
"FIN_004_MZB_LO_11","FIN_004_MZB_LO_11-23.09.2014","23.09.2014",2014,9,23,0,0,0,0,0,0,0,0,0,0,0,552,0,0,0,0,0,1,0,0,11,0,0,113,0,0,0,0,0,0,0,0,0,0,0,0,36,0,0,0,0,0,0,126,0,4,0,0,0,0,0,0,0,0,0,0,0,0,0,0,0,0,0,0,0,0,94,0,0,63,17,0,0,125,0,0,0,0,5,7,83,4,0,0,0,0,0,0,8,0,8,0,0,11,0,0,0,0,17,0,0,11,0,0,0,0,0,0,0,8,0,0,0,0,0,0,0,36,0,0,0,0,0,0,19,0,0,0,0,24,0,0,0,0,0,0,0,0,0,0
"FIN_004_MZB_LO_11","FIN_004_MZB_LO_11-28.09.2015","28.09.2015",2015,9,28,0,0,0,0,0,0,0,0,2,0,0,96,0,0,0,0,0,0,0,0,3,0,0,4,0,0,0,0,0,0,0,0,0,0,0,0,15,0,0,0,0,0,0,133,0,1,0,0,0,0,0,0,0,0,0,0,0,2,0,0,0,0,0,0,0,0,32,0,0,5,21,0,0,9,0,0,0,0,1,1,23,3,1,0,0,0,0,0,3,0,0,0,0,19,0,0,0,0,32,0,0,7,0,0,0,0,0,0,0,12,0,0,0,0,1,0,0,6,0,0,0,5,0,0,25,0,0,0,0,6,0,0,0,0,0,0,0,0,0,0
"FIN_004_MZB_LO_11","FIN_004_MZB_LO_11-26.09.2016","26.09.2016",2016,9,26,0,0,0,0,0,0,0,0,1,0,0,204,0,0,0,0,0,0,13,0,0,0,0,9,0,0,0,0,0,0,0,1,0,0,0,0,4,0,0,0,0,0,0,53,0,0,0,1,0,0,0,0,0,0,0,0,0,1,0,0,0,0,0,0,0,0,17,0,0,2,17,0,0,1,0,0,0,0,0,10,24,2,0,0,0,0,0,0,1,0,0,0,0,20,0,0,0,0,0,0,0,0,0,0,0,0,0,0,0,3,0,0,0,0,2,0,0,5,0,0,0,5,1,0,23,0,0,0,0,6,0,0,0,0,0,0,0,0,0,0
"FIN_004_MZB_LO_11","FIN_004_MZB_LO_11-19.09.2017","19.09.2017",2017,9,19,0,0,0,0,0,0,0,0,7,0,0,105,0,0,0,0,0,0,1,0,2,0,0,51,0,0,0,0,0,0,1,0,0,0,0,0,6,0,0,0,0,0,0,292,0,0,1,0,0,0,0,0,0,0,0,0,0,13,0,0,0,0,0,0,0,0,38,0,0,6,37,0,0,8,0,0,0,0,9,10,114,2,1,0,0,0,0,0,10,0,0,0,0,28,0,0,0,0,33,0,0,4,0,0,0,0,0,0,0,6,0,0,0,0,3,0,0,14,0,0,1,5,0,3,0,0,0,10,0,16,0,0,0,0,0,0,0,0,0,0
"FIN_004_MZB_LO_11","FIN_004_MZB_LO_11-11.10.2018","11.10.2018",2018,10,11,0,0,0,0,0,0,0,0,0,0,0,0,0,0,0,0,0,0,0,0,1,1,0,2,0,0,0,0,0,0,0,0,0,0,0,0,2,0,0,0,0,0,0,235,0,0,0,0,0,0,0,0,0,0,0,0,0,0,0,0,0,0,0,0,0,0,0,0,0,1,20,0,0,0,0,0,0,0,0,0,0,1,0,0,0,0,0,0,1,0,3,0,0,0,0,0,0,0,36,0,0,0,0,0,0,0,0,0,0,0,0,0,0,0,0,0,0,0,0,0,0,0,0,0,3,0,0,2,0,0,0,0,4,0,0,0,0,0,0,0
"FIN_004_MZB_LO_11","FIN_004_MZB_LO_11-07.10.2019","07.10.2019",2019,10,7,0,0,0,0,0,0,0,0,3,0,0,30,0,0,0,0,0,0,0,0,0,0,0,16,0,0,0,0,0,0,0,1,0,0,0,0,1,0,0,0,0,0,0,37,0,0,0,0,0,0,0,0,0,0,0,0,0,0,1,0,0,0,0,0,0,0,4,0,0,0,9,0,0,0,0,0,0,0,1,9,0,8,0,0,0,0,0,0,0,0,4,0,0,98,0,0,0,0,36,0,0,8,0,0,0,0,0,0,0,0,0,0,0,0,0,0,0,1,0,0,0,3,0,0,169,0,0,0,0,0,0,0,2,0,0,0,0,0,0,0
"FIN_004_MZB_LO_11","FIN_004_MZB_LO_11-07.09.2020","07.09.2020",2020,9,7,0,0,0,0,0,0,0,0,9,0,0,64,0,0,0,0,1,0,1,0,16,0,0,85,0,0,0,0,0,0,0,0,0,0,0,0,0,0,0,0,0,6,0,156,0,0,1,0,0,0,0,0,0,0,0,0,0,0,0,0,0,0,0,1,0,0,65,0,0,9,12,0,0,3,0,0,0,0,2,110,7,3,0,0,0,0,0,0,0,0,0,0,0,21,0,0,0,0,106,0,0,3,0,0,0,0,0,0,0,14,0,0,0,0,0,0,0,7,0,0,0,28,0,0,2,0,0,2,0,0,0,0,0,0,0,2,0,0,0,2
"FIN_004_MZB_LO_110","FIN_004_MZB_LO_110-25.09.2007","25.09.2007",2007,9,25,0,0,0,0,0,0,0,0,0,0,0,7,0,0,0,0,0,0,0,0,5,3,0,584,0,0,0,0,0,1,4,0,0,0,0,0,2,0,0,0,0,0,0,39,0,0,0,1,0,0,0,0,0,0,0,0,0,0,0,0,0,0,0,0,0,0,16,0,0,3,0,0,0,0,55,0,0,0,4,686,4,43,0,0,0,0,0,0,51,4,1,9,0,79,0,0,0,0,20,0,0,4,5,0,0,0,0,0,0,29,0,0,0,2,0,0,0,0,0,0,0,0,16,0,2,0,0,28,0,22,0,0,4,0,0,0,0,0,0,0
"FIN_004_MZB_LO_110","FIN_004_MZB_LO_110-29.09.2009","29.09.2009",2009,9,29,0,0,0,0,0,0,0,0,0,0,4,19,0,0,0,1,0,0,0,0,0,0,0,142,0,0,0,0,0,2,0,1,0,0,0,0,0,0,0,0,0,0,0,36,0,0,0,6,0,0,0,0,0,0,0,0,0,0,0,0,0,0,0,0,0,0,91,0,0,3,0,0,0,4,55,0,0,16,1,329,57,6,0,0,0,0,0,0,4,0,0,0,0,100,0,0,0,0,7,0,0,16,0,0,0,0,0,0,0,12,0,0,0,0,0,0,0,5,0,0,0,0,1,0,18,0,0,11,0,148,0,0,0,0,0,0,0,0,0,0
"FIN_004_MZB_LO_110","FIN_004_MZB_LO_110-01.09.2010","01.09.2010",2010,9,1,0,0,0,0,0,0,0,0,0,0,0,226,0,0,0,0,0,0,0,0,0,0,0,351,0,0,0,0,0,0,0,0,0,0,0,0,0,0,0,0,0,0,0,61,0,0,0,8,0,0,0,1,0,0,0,0,0,0,0,0,0,0,0,0,0,0,120,0,0,6,0,0,0,9,206,0,0,31,0,32,11,0,0,0,0,0,0,0,1,0,1,0,0,11,0,0,0,0,9,0,0,40,0,0,0,0,0,0,0,5,0,0,0,0,0,0,0,17,0,0,0,0,0,0,5,0,0,0,0,177,0,0,0,0,0,0,0,0,0,0
"FIN_004_MZB_LO_110","FIN_004_MZB_LO_110-28.09.2011","28.09.2011",2011,9,28,0,0,0,0,0,0,0,0,4,0,0,17,0,0,0,5,0,0,0,0,2,0,0,232,0,0,0,0,0,28,5,0,0,0,0,0,0,0,0,0,0,0,0,83,0,0,0,44,0,0,0,3,0,0,0,0,0,0,0,0,0,0,0,0,0,0,47,0,0,0,0,0,0,22,291,0,0,44,1,43,30,4,0,0,0,0,0,0,62,1,2,0,0,12,0,0,0,0,8,0,0,33,0,0,0,0,0,0,0,4,0,0,0,0,0,0,0,4,0,0,0,0,2,0,17,0,0,101,0,75,0,0,2,0,0,3,0,0,0,0
"FIN_004_MZB_LO_110","FIN_004_MZB_LO_110-26.09.2012","26.09.2012",2012,9,26,0,0,0,0,0,0,0,0,0,0,0,3,0,0,0,0,0,0,1,0,2,0,0,99,0,0,0,0,0,0,4,2,0,0,0,0,0,0,0,0,0,0,0,13,0,0,0,2,0,0,0,0,0,0,0,0,0,0,0,0,0,0,0,0,0,0,58,0,0,3,0,0,0,2,1,0,0,0,0,399,81,30,3,0,0,0,0,0,5,3,0,0,0,76,0,0,0,0,0,0,0,5,0,0,0,0,0,1,0,9,0,0,0,0,0,0,0,1,0,0,0,0,3,0,29,0,0,18,0,77,0,0,0,0,0,1,0,0,0,0
"FIN_004_MZB_LO_110","FIN_004_MZB_LO_110-01.10.2013","01.10.2013",2013,10,1,0,0,0,0,0,0,0,0,0,0,0,9,0,0,0,2,0,0,0,0,0,0,0,41,0,0,0,0,0,0,0,0,0,0,0,0,0,0,0,0,0,0,0,29,0,0,0,5,0,0,0,0,0,0,0,0,0,0,0,0,0,0,0,0,0,0,45,0,0,0,0,0,0,11,37,0,0,15,0,18,42,0,0,0,0,0,0,0,16,0,1,0,0,27,0,0,0,0,6,0,0,68,0,0,0,0,0,0,0,2,0,0,0,0,0,0,0,7,0,0,0,0,0,0,38,0,0,9,0,127,0,0,0,0,0,0,0,0,0,0
"FIN_004_MZB_LO_110","FIN_004_MZB_LO_110-06.10.2014","06.10.2014",2014,10,6,0,0,0,0,0,0,0,0,0,0,0,10,0,0,0,0,0,0,0,0,0,0,0,60,0,0,0,0,0,1,0,0,0,0,0,0,0,0,0,0,0,0,0,36,0,0,0,3,0,0,0,1,0,0,0,0,0,0,0,0,0,0,0,0,0,0,37,0,0,1,0,0,0,8,119,0,0,40,3,33,27,0,0,0,0,0,0,0,49,0,0,0,0,24,0,0,0,0,6,0,0,31,0,0,0,0,0,0,0,32,0,0,0,0,0,0,0,3,0,0,0,0,0,0,2,0,0,28,0,39,0,0,0,0,0,0,0,0,0,0
"FIN_004_MZB_LO_110","FIN_004_MZB_LO_110-04.10.2015","04.10.2015",2015,10,4,0,0,0,0,0,0,0,0,0,0,0,39,0,0,0,2,0,1,0,0,0,0,0,114,0,0,0,0,0,2,2,0,0,0,0,0,0,0,0,0,0,0,0,16,0,0,0,0,0,0,0,0,0,0,0,0,0,0,0,0,0,0,0,0,0,0,62,0,0,0,0,0,0,2,20,0,0,12,1,433,55,41,0,0,0,0,0,0,55,0,0,0,0,54,0,0,0,0,3,0,0,37,0,0,0,0,0,0,0,10,0,0,0,0,0,0,0,6,0,0,0,0,5,0,128,0,0,144,0,115,0,0,3,0,0,0,0,0,0,0
"FIN_004_MZB_LO_110","FIN_004_MZB_LO_110-03.10.2016","03.10.2016",2016,10,3,0,0,0,0,0,0,0,0,1,0,0,12,0,0,0,0,0,0,0,0,0,0,0,60,1,0,0,0,0,0,0,0,0,0,0,0,0,0,0,0,0,0,0,55,0,0,0,5,0,0,0,0,0,0,0,0,0,0,0,0,0,0,0,0,0,0,42,0,0,7,0,0,0,4,47,0,0,12,0,29,30,4,0,0,0,0,0,0,17,0,0,0,0,71,0,0,0,0,1,0,0,155,1,0,0,0,0,0,0,7,0,0,0,0,0,0,0,3,0,0,0,0,1,0,8,0,0,44,0,78,0,0,0,0,0,0,0,0,0,0
"FIN_004_MZB_LO_112","FIN_004_MZB_LO_112-10.10.2007","10.10.2007",2007,10,10,0,0,0,0,0,0,10,0,0,0,0,81,0,0,0,0,0,0,0,0,98,0,0,300,0,0,0,0,0,18,0,0,0,0,0,0,0,0,0,0,0,0,0,199,0,0,0,0,0,0,0,3,0,0,0,0,4,0,0,0,0,0,0,4,0,0,15,0,0,4,0,0,0,3,118,0,0,43,17,107,0,10,0,3,0,0,0,0,0,0,0,0,0,6,0,0,0,0,112,0,0,12,1,0,0,0,52,0,0,163,0,0,0,1,5,0,0,0,0,0,0,0,0,0,3,0,0,451,3,61,0,0,0,0,0,1,0,0,0,0
"FIN_004_MZB_LO_112","FIN_004_MZB_LO_112-14.10.2009","14.10.2009",2009,10,14,0,0,0,0,0,0,17,0,0,0,0,90,0,0,0,26,0,0,3,0,26,0,0,419,0,0,0,0,0,0,0,0,0,0,0,0,3,0,0,0,0,0,0,12,0,0,0,10,0,0,0,1,0,0,0,0,2,0,0,0,0,0,0,0,0,0,80,0,0,3,0,0,0,46,167,0,0,30,6,69,2,0,0,5,0,0,0,0,8,1,0,0,0,2,0,0,0,0,6,0,0,20,0,0,0,0,20,0,0,532,0,0,0,0,5,0,0,3,0,0,0,0,0,0,2,0,0,93,0,46,0,0,0,0,0,0,0,0,0,0
"FIN_004_MZB_LO_112","FIN_004_MZB_LO_112-03.10.2012","03.10.2012",2012,10,3,0,0,0,0,0,0,52,0,0,0,0,7,0,0,0,2,0,0,8,0,0,0,0,34,0,0,0,0,0,0,0,0,0,0,0,0,0,0,0,0,0,0,0,4,0,0,0,0,0,0,0,1,0,0,0,0,2,0,0,0,0,0,0,0,0,0,82,0,0,1,0,0,0,44,46,0,0,16,3,6,1,0,0,1,0,0,0,0,2,0,1,0,0,0,0,0,0,0,4,0,0,20,0,0,0,0,1,0,0,288,0,0,0,0,1,0,0,1,0,0,0,0,0,0,3,0,0,517,1,32,0,0,0,0,0,0,0,0,0,0
"FIN_004_MZB_LO_112","FIN_004_MZB_LO_112-29.10.2014","29.10.2014",2014,10,29,0,0,0,0,0,0,20,0,1,0,0,384,0,0,0,1,2,0,0,0,0,0,0,316,0,0,0,0,0,0,0,0,0,0,0,0,0,0,0,0,0,0,0,4,0,0,0,3,0,0,0,2,0,0,0,0,1,0,0,0,0,0,0,0,0,0,33,0,0,0,0,0,0,3,64,0,0,35,5,133,0,0,0,45,0,0,0,0,5,0,0,0,0,1,0,0,0,0,0,0,0,11,0,0,0,0,10,0,0,97,0,0,0,0,1,0,0,0,0,0,0,0,0,0,1,0,0,453,0,25,0,0,0,0,0,0,0,0,0,0
"FIN_004_MZB_LO_112","FIN_004_MZB_LO_112-08.10.2015","08.10.2015",2015,10,8,0,0,0,0,0,0,12,0,0,0,0,241,0,0,0,5,0,0,4,0,7,0,0,74,0,0,0,0,0,0,0,0,0,0,0,0,0,0,0,0,0,0,0,1,0,0,0,2,0,0,0,1,0,0,0,0,3,0,0,0,0,0,0,1,0,0,45,0,0,0,0,0,0,6,340,0,0,74,9,59,0,1,0,9,0,0,0,0,12,0,0,0,0,2,0,0,0,0,0,0,0,32,0,0,0,0,7,0,0,821,0,0,0,0,1,0,0,0,0,0,0,0,0,0,3,0,0,451,0,74,0,0,0,0,0,0,0,0,0,0
"FIN_004_MZB_LO_112","FIN_004_MZB_LO_112-25.09.2017","25.09.2017",2017,9,25,0,0,0,0,0,0,66,0,0,0,1,13,0,0,0,4,0,0,0,0,0,0,0,27,0,0,0,0,0,0,0,0,0,0,0,0,0,0,0,0,0,0,0,6,0,0,0,0,0,0,0,1,0,0,0,0,2,0,0,0,0,0,0,3,0,0,15,0,0,0,0,0,0,44,117,0,0,8,0,3,1,0,0,16,0,0,0,0,22,0,0,0,0,0,0,0,0,0,29,0,0,18,0,0,0,0,67,0,0,361,0,0,0,0,0,0,0,0,0,0,0,0,0,0,6,0,0,471,0,107,0,0,0,0,0,1,0,0,0,0
"FIN_004_MZB_LO_112","FIN_004_MZB_LO_112-25.09.2018","25.09.2018",2018,9,25,0,0,0,0,0,0,13,0,0,0,0,20,0,0,0,8,1,0,1,0,1,0,0,156,0,0,0,0,0,0,0,0,0,0,0,0,0,0,0,0,0,0,0,1,0,1,0,1,0,0,0,0,0,0,0,0,0,0,0,0,0,0,0,0,0,0,21,0,0,0,0,0,0,8,24,0,0,35,18,20,0,0,0,1,0,0,0,0,0,0,0,0,0,0,0,0,0,0,26,0,0,12,0,0,0,0,0,0,0,148,0,0,0,0,1,0,0,0,0,0,0,0,0,0,1,0,0,29,0,35,0,0,0,0,0,0,0,0,0,0
"FIN_004_MZB_LO_113","FIN_004_MZB_LO_113-28.09.2007","28.09.2007",2007,9,28,0,0,0,0,0,0,0,0,3,0,0,81,0,0,0,0,1,0,0,0,0,0,0,9,0,0,0,0,0,0,0,0,0,0,0,0,0,0,0,0,0,0,0,1,0,0,0,119,0,0,0,0,0,0,0,0,0,17,0,1,93,0,0,1,0,0,425,0,0,0,0,0,0,499,0,0,0,17,3,0,1,0,0,0,0,0,0,0,17,0,0,0,0,2,0,0,0,0,62,0,0,17,0,0,0,0,0,0,0,209,67,0,0,0,0,0,0,29,0,0,0,1,0,0,1,0,0,1601,0,10,0,0,0,0,0,0,0,0,0,0
"FIN_004_MZB_LO_113","FIN_004_MZB_LO_113-07.09.2009","07.09.2009",2009,9,7,0,0,0,0,0,0,0,0,0,0,0,112,0,0,0,0,0,0,0,0,4,0,0,122,0,0,0,0,0,0,0,0,0,0,0,0,3,0,0,0,0,0,0,2,0,21,0,16,0,0,0,0,0,0,0,0,0,40,0,0,198,0,0,0,0,0,248,0,0,0,0,0,0,4182,18,0,0,4,13,0,15,0,2,0,0,0,0,0,38,0,0,2,0,9,0,0,0,0,74,0,0,11,0,0,0,0,0,0,0,235,80,0,0,0,0,0,0,140,0,0,0,0,0,0,12,0,0,1019,0,1,0,0,0,0,0,0,0,0,0,0
"FIN_004_MZB_LO_113","FIN_004_MZB_LO_113-12.09.2010","12.09.2010",2010,9,12,0,0,0,0,0,0,0,0,0,0,0,216,0,0,0,0,0,0,0,0,9,0,0,134,0,0,0,0,0,0,0,0,0,0,0,0,0,0,0,0,0,0,0,1,0,7,0,5,0,0,0,0,0,0,0,0,0,40,0,0,109,0,0,0,0,0,406,0,0,5,0,0,0,9720,123,0,0,12,8,0,0,0,0,0,0,0,0,0,39,0,0,4,0,6,0,0,0,0,97,0,0,11,0,0,0,0,0,0,0,162,113,0,0,0,0,0,0,120,0,0,0,0,0,0,73,0,0,1720,0,2,0,0,0,0,0,1,0,0,0,0
"FIN_004_MZB_LO_113","FIN_004_MZB_LO_113-11.09.2011","11.09.2011",2011,9,11,0,0,0,0,0,0,0,0,1,0,0,49,0,0,0,0,0,1,0,0,2,0,0,59,0,0,0,0,0,0,0,0,0,0,0,0,0,0,0,0,0,0,0,7,0,0,0,3,0,0,0,1,0,0,0,0,2,20,0,0,111,0,0,0,0,0,53,0,0,0,0,0,0,356,23,0,0,14,7,1,0,0,2,0,0,0,0,0,35,0,0,0,0,1,0,0,0,0,103,0,0,1,0,0,0,0,0,0,0,45,76,0,0,0,2,0,0,15,0,0,0,0,0,0,83,0,0,1,0,9,0,0,0,0,0,0,0,0,0,0
"FIN_004_MZB_LO_113","FIN_004_MZB_LO_113-09.09.2012","09.09.2012",2012,9,9,0,0,0,0,0,0,0,0,0,0,0,196,0,0,0,0,0,0,0,0,0,0,0,8,0,0,0,0,0,0,0,0,0,0,0,0,0,0,0,0,0,0,0,5,0,1,0,4,0,0,0,0,0,0,0,0,1,28,0,0,141,0,0,0,0,0,270,0,0,0,1,0,0,979,6,0,0,11,16,0,0,0,0,0,0,0,0,0,19,0,0,0,0,3,0,0,0,0,0,0,0,17,0,0,0,0,0,0,0,94,1,0,0,0,0,0,0,50,0,0,0,0,0,0,17,0,0,6,0,2,0,0,0,0,0,1,0,0,0,0
"FIN_004_MZB_LO_113","FIN_004_MZB_LO_113-09.09.2013","09.09.2013",2013,9,9,0,0,0,0,0,0,0,0,0,0,0,39,0,0,0,0,0,0,0,0,0,0,0,4,0,0,0,0,0,0,0,0,0,0,0,0,0,0,0,0,0,0,0,2,0,0,0,0,0,0,0,1,0,0,0,0,0,14,0,1,119,0,0,0,0,0,34,0,0,0,0,0,0,243,2,0,0,4,27,0,2,0,0,0,0,0,0,0,2,0,0,0,0,5,0,0,0,0,30,0,0,4,0,0,0,0,0,0,0,67,14,0,0,0,2,0,0,11,0,0,0,1,0,0,20,0,0,478,0,2,0,0,0,0,0,0,0,0,0,0
"FIN_004_MZB_LO_113","FIN_004_MZB_LO_113-10.09.2014","10.09.2014",2014,9,10,0,0,0,0,0,0,0,0,0,0,0,82,0,0,0,0,0,2,0,0,0,0,0,57,0,0,0,0,0,0,0,0,0,0,0,0,1,0,0,0,0,0,0,2,0,0,0,2,0,0,0,0,0,0,0,0,0,33,0,1,22,0,0,0,0,0,63,0,0,0,1,0,0,581,21,0,0,33,5,1,0,0,0,0,0,0,0,0,33,0,0,0,0,1,0,0,0,0,37,0,0,7,0,0,0,0,0,0,0,263,90,0,0,0,5,0,0,9,0,0,0,1,0,0,15,0,0,311,0,3,0,0,0,0,0,0,0,0,0,0
"FIN_004_MZB_LO_113","FIN_004_MZB_LO_113-12.09.2017","12.09.2017",2017,9,12,0,0,0,0,0,0,0,0,10,0,0,26,0,0,0,0,0,0,0,0,16,0,0,86,0,0,0,0,0,0,0,0,0,0,0,0,0,0,0,0,0,0,0,4,0,0,0,0,0,0,0,2,0,0,0,0,0,2,0,0,26,0,0,0,0,0,20,0,0,0,0,0,0,26,20,0,0,0,74,22,2,0,0,0,0,0,0,0,10,0,0,4,0,16,0,0,0,0,46,0,0,0,0,0,0,0,0,0,0,312,36,0,0,0,0,0,0,2,0,0,0,2,0,0,0,0,0,50,0,4,0,0,2,0,0,0,0,0,0,0
"FIN_004_MZB_LO_114","FIN_004_MZB_LO_114-21.09.2007","21.09.2007",2007,9,21,0,0,0,0,0,0,0,0,5,0,0,0,0,0,0,0,0,0,0,0,0,0,0,208,0,0,0,0,0,0,0,0,0,0,0,0,0,0,0,1,0,0,0,59,0,0,0,0,0,0,0,0,0,0,0,0,0,0,0,0,0,0,0,0,0,0,0,0,0,2,0,0,0,2,0,0,0,0,0,4,0,13,2,0,0,0,0,0,0,0,0,4,0,13,0,0,0,0,58,0,0,7,0,0,0,0,0,0,0,666,0,0,0,0,4,0,0,27,0,0,0,0,7,0,0,0,0,0,0,17,0,0,0,0,0,0,0,0,0,0
"FIN_004_MZB_LO_114","FIN_004_MZB_LO_114-07.09.2008","07.09.2008",2008,9,7,0,0,0,0,0,0,0,0,4,0,0,0,0,0,0,0,0,0,0,0,0,0,0,1251,0,0,0,0,0,2,0,0,0,0,0,0,7,0,0,0,0,0,0,33,0,0,0,0,0,0,0,0,0,0,0,0,0,0,0,0,0,0,0,0,0,0,0,0,0,0,0,0,0,170,0,0,0,4,0,56,36,2,2,0,0,0,0,0,0,0,193,12,0,133,0,0,0,0,28,0,0,13,1,0,0,0,0,0,0,683,0,0,0,0,0,0,0,72,0,0,0,0,4,0,378,0,0,0,0,26,0,0,0,0,0,0,0,0,0,0
"FIN_004_MZB_LO_114","FIN_004_MZB_LO_114-07.09.2010","07.09.2010",2010,9,7,0,0,0,0,0,0,0,0,26,0,0,2,0,0,0,0,0,0,0,0,24,0,0,898,0,0,0,0,0,10,0,0,0,0,0,0,0,0,0,0,0,0,0,142,0,0,0,0,0,0,0,0,0,0,0,0,0,0,0,0,0,0,0,12,0,0,4,0,0,0,0,0,0,648,2,0,0,82,0,854,24,0,22,0,0,4,0,0,0,2,68,0,0,64,0,0,0,0,126,0,0,8,1,0,0,0,0,0,0,292,0,0,0,0,6,0,0,2,0,0,0,0,18,0,46,0,0,2,0,20,0,0,18,0,0,0,0,0,0,0
"FIN_004_MZB_LO_114","FIN_004_MZB_LO_114-24.09.2014","24.09.2014",2014,9,24,0,0,0,0,0,0,0,0,15,0,0,0,0,0,0,0,0,0,0,0,0,0,0,447,0,0,0,0,0,0,0,0,0,0,0,0,0,0,0,0,0,0,0,108,0,0,0,0,0,0,0,0,0,0,0,0,0,0,0,0,0,0,0,0,0,0,15,0,0,0,0,0,6,120,0,0,0,108,0,51,24,15,0,0,0,0,0,0,0,0,21,0,0,45,0,0,0,0,135,0,0,6,0,0,0,0,0,0,0,1095,0,0,0,0,0,0,0,3,0,0,0,0,3,0,18,0,0,3,0,6,0,0,33,0,0,0,0,0,0,0
"FIN_004_MZB_LO_114","FIN_004_MZB_LO_114-03.10.2019","03.10.2019",2019,10,3,0,0,0,0,0,0,0,0,25,0,0,397,0,0,0,0,0,0,0,0,10,0,0,2368,0,0,0,0,0,0,0,0,0,0,0,0,0,0,1,0,0,0,0,77,0,0,0,0,0,0,0,0,0,0,0,0,0,0,0,1,0,0,0,1,0,0,0,0,0,12,8,0,0,1033,0,0,0,141,0,141,45,41,0,0,0,0,0,0,0,0,0,0,0,921,0,0,0,0,47,0,0,130,0,0,0,0,0,0,0,478,0,0,0,0,0,0,0,141,0,0,0,0,3,0,209,0,0,4,0,0,0,0,4,0,0,0,0,0,0,0
"FIN_004_MZB_LO_115","FIN_004_MZB_LO_115-09.10.2007","09.10.2007",2007,10,9,0,0,0,0,0,0,0,0,5,0,0,110,0,0,0,0,331,0,0,0,9,0,0,79,0,0,0,1,0,0,0,5,0,0,0,0,0,0,1,0,0,0,0,12,0,0,17,0,0,0,0,0,0,0,0,0,0,0,0,0,0,0,0,0,0,0,0,0,0,7,1,0,0,0,0,0,0,0,9,1,0,1,0,0,0,0,0,0,0,0,0,0,0,2,0,0,0,0,79,0,0,0,0,0,0,0,2,0,0,20,0,0,0,0,4,0,0,0,0,0,0,0,0,0,0,0,0,0,0,0,0,0,0,0,0,0,2,0,0,0
"FIN_004_MZB_LO_115","FIN_004_MZB_LO_115-29.09.2008","29.09.2008",2008,9,29,0,0,0,0,0,0,0,5,1,0,0,60,0,0,0,0,4,0,0,0,3,0,0,10,0,0,0,0,0,0,0,20,0,0,0,0,0,0,0,0,0,0,0,14,0,2,1,0,0,1,0,0,0,2,0,0,0,0,0,0,3,0,0,0,0,0,13,0,0,52,0,0,0,28,1,0,0,2,16,0,0,0,0,0,0,0,0,0,0,0,0,0,0,1,0,0,0,0,10,0,0,0,0,0,0,0,17,0,0,25,0,0,0,0,28,0,0,2,0,1,0,0,0,0,7,0,0,2,0,9,0,0,0,0,0,0,0,0,0,0
"FIN_004_MZB_LO_115","FIN_004_MZB_LO_115-18.10.2010","18.10.2010",2010,10,18,0,0,0,0,0,0,0,0,1,0,0,70,0,0,0,0,81,3,0,0,2,0,0,91,0,0,0,0,0,0,0,8,0,0,0,0,0,0,0,0,0,0,0,1,0,0,23,0,0,0,0,1,0,0,0,0,0,0,0,0,2,0,0,4,0,0,2,0,0,0,0,0,0,6,0,0,0,0,9,5,0,1,0,1,0,0,0,0,0,0,0,0,0,0,0,0,0,0,22,0,0,0,0,0,0,0,0,0,0,10,0,0,0,0,0,0,0,0,0,0,0,0,0,0,0,0,0,0,0,2,0,0,0,0,0,0,0,0,0,0
"FIN_004_MZB_LO_115","FIN_004_MZB_LO_115-25.09.2013","25.09.2013",2013,9,25,0,0,0,0,0,0,0,0,0,0,0,36,0,0,0,0,89,1,0,0,1,0,0,143,0,0,0,0,0,0,0,0,0,0,0,0,0,0,0,0,0,1,0,20,0,0,5,0,0,0,0,0,0,0,0,0,0,0,0,1,2,0,0,1,0,0,5,0,0,2,0,0,0,5,0,0,0,2,12,24,0,0,0,0,0,0,0,0,0,0,0,1,0,0,0,0,0,0,22,0,0,0,0,0,0,0,4,0,0,7,0,0,0,0,10,0,0,1,0,0,0,0,0,0,0,0,0,1,0,3,0,0,0,0,0,0,0,0,0,0
"FIN_004_MZB_LO_115","FIN_004_MZB_LO_115-27.09.2016","27.09.2016",2016,9,27,0,0,0,0,0,0,0,0,0,0,0,7,0,0,0,0,0,0,0,0,0,0,0,7,0,0,0,0,0,0,0,0,0,0,0,0,0,0,0,0,0,0,0,11,0,0,0,0,0,0,0,0,0,1,0,0,0,0,0,0,0,0,0,0,0,0,40,0,0,2,0,0,0,26,0,0,0,5,8,0,0,0,0,0,0,0,0,0,0,0,0,0,0,0,0,0,0,0,32,0,0,0,0,0,0,0,6,0,0,5,0,0,0,0,11,0,0,1,0,0,0,0,0,0,0,0,0,0,0,2,0,0,0,0,0,0,0,0,0,0
"FIN_004_MZB_LO_116","FIN_004_MZB_LO_116-16.09.2007","16.09.2007",2007,9,16,0,0,0,0,0,0,0,0,24,0,0,0,0,0,0,0,0,0,6,0,0,0,0,35,0,0,0,0,0,0,0,0,0,0,0,0,3,0,0,0,0,0,0,258,0,0,0,0,0,0,0,0,0,0,0,0,0,0,0,0,0,0,0,0,0,0,3,0,0,2,0,0,0,0,24,0,0,0,0,345,89,5,0,0,0,0,0,0,26,0,0,0,0,79,0,0,0,0,29,0,0,0,3,0,0,0,0,0,0,27,0,0,0,0,0,0,0,2,0,0,0,0,1,1,40,0,0,1,0,7,0,0,0,0,0,0,0,0,0,0
"FIN_004_MZB_LO_116","FIN_004_MZB_LO_116-08.09.2009","08.09.2009",2009,9,8,0,0,0,0,0,0,0,0,0,0,0,1,0,0,0,0,0,0,0,0,1,0,0,24,0,0,0,0,0,0,0,0,0,0,0,0,9,0,0,0,0,0,0,0,0,0,0,0,0,0,0,0,0,0,0,0,0,0,0,0,0,0,0,0,0,0,0,0,0,0,0,0,0,0,0,0,0,0,0,3,2,5,1,0,0,0,0,0,0,0,0,0,0,15,0,0,0,0,16,0,0,4,2,0,0,0,0,0,0,28,0,0,0,0,0,0,0,9,0,0,0,0,1,0,2,0,0,1,0,6,0,0,0,0,0,0,0,0,0,0
"FIN_004_MZB_LO_116","FIN_004_MZB_LO_116-03.10.2011","03.10.2011",2011,10,3,0,0,0,0,0,0,0,0,2,0,0,0,0,0,0,0,0,0,0,0,0,0,0,2,0,0,0,0,0,0,0,1,0,0,0,0,0,0,0,0,0,1,0,26,0,0,0,0,0,0,0,0,0,0,0,0,0,0,0,0,0,0,0,0,0,0,0,0,0,0,0,0,0,0,0,0,0,0,0,21,15,7,0,0,0,0,0,0,1,0,0,0,0,30,0,0,0,0,1,0,0,1,0,0,0,0,0,0,0,6,0,0,0,0,1,0,0,1,0,0,0,0,0,0,62,0,0,0,0,12,0,0,0,0,0,0,0,0,0,0
"FIN_004_MZB_LO_116","FIN_004_MZB_LO_116-19.11.2013","19.11.2013",2013,11,19,0,0,0,0,0,0,0,0,7,0,0,0,0,0,0,0,0,0,0,0,0,0,0,7,0,0,0,0,0,0,0,0,0,0,0,0,8,0,0,0,0,0,0,2,0,0,0,0,0,0,0,0,0,0,0,0,0,0,0,0,0,0,0,0,0,0,0,0,0,0,0,0,0,0,0,0,0,0,0,1,20,4,0,0,0,0,0,0,0,0,0,0,0,29,0,0,0,0,1,0,0,1,1,0,0,0,0,0,0,43,0,0,0,0,0,0,0,3,0,0,0,0,2,0,47,0,0,0,0,4,0,0,1,0,0,0,0,0,0,0
"FIN_004_MZB_LO_116","FIN_004_MZB_LO_116-27.09.2018","27.09.2018",2018,9,27,0,0,0,0,0,0,0,0,9,0,0,7,0,0,0,0,0,0,1,0,1,0,0,92,0,0,0,0,0,0,0,0,0,0,0,0,9,0,0,0,0,0,0,77,0,0,0,0,0,0,0,0,0,0,0,0,0,0,0,0,0,0,0,0,0,0,0,0,0,11,0,0,0,3,31,0,0,0,0,100,88,5,2,0,0,0,0,0,0,0,0,0,0,87,0,0,0,0,2,0,0,1,0,0,0,0,0,0,0,31,0,0,0,0,0,0,0,2,0,0,0,0,0,1,7,0,0,2,0,17,0,0,1,0,0,0,0,0,0,0
"FIN_004_MZB_LO_117","FIN_004_MZB_LO_117-17.09.2007","17.09.2007",2007,9,17,0,0,0,0,0,0,0,0,0,0,0,199,0,1,0,0,0,0,13,0,19,0,0,145,16,0,0,0,0,0,0,0,0,0,0,0,11,0,0,0,0,0,0,98,0,2,0,0,0,0,0,0,0,0,0,0,0,0,0,14,0,0,2,1,0,0,10,0,0,2,1,0,0,14,1,0,0,12,1,1,169,31,22,0,0,0,0,0,0,0,1,1,0,49,0,0,0,0,15,0,0,4,0,0,0,0,0,0,0,0,0,0,0,12,4,0,0,5,0,0,1,2,0,0,26,0,0,93,3,3,0,0,0,0,0,0,0,0,0,0
"FIN_004_MZB_LO_117","FIN_004_MZB_LO_117-05.10.2009","05.10.2009",2009,10,5,0,0,0,0,0,0,0,0,0,0,0,158,0,0,0,0,0,0,0,0,0,0,0,705,16,0,0,0,0,1,0,0,0,0,0,0,4,0,0,0,0,0,0,5,0,1,0,0,0,0,0,0,0,0,0,0,0,0,0,1,0,0,0,0,0,0,0,0,0,0,0,0,0,15,0,0,0,3,1,0,127,3,0,0,0,0,0,0,0,0,0,0,0,3,0,0,0,0,6,0,0,8,0,0,0,0,0,0,0,0,0,0,0,0,0,0,0,3,0,0,0,0,0,0,46,0,0,0,0,8,0,0,1,0,0,0,0,0,0,0
"FIN_004_MZB_LO_117","FIN_004_MZB_LO_117-05.10.2011","05.10.2011",2011,10,5,0,0,0,0,0,0,0,0,0,0,0,21,0,0,0,0,0,0,0,0,0,0,0,19,0,0,0,0,0,0,0,0,0,0,0,0,0,0,0,0,0,0,0,6,0,0,0,0,0,0,0,0,0,0,0,0,0,0,0,4,0,0,0,0,0,0,0,0,0,0,0,0,0,5,0,0,0,3,0,0,36,3,0,0,0,0,0,0,0,0,0,0,0,0,0,0,0,0,1,0,0,0,0,0,0,0,0,0,0,1,0,0,0,0,0,0,0,0,0,0,0,0,0,0,50,0,0,3,0,0,0,0,0,0,0,0,0,0,0,0
"FIN_004_MZB_LO_117","FIN_004_MZB_LO_117-26.11.2013","26.11.2013",2013,11,26,0,0,0,0,0,0,0,0,0,0,0,23,0,0,0,0,0,0,0,0,0,0,0,18,0,0,0,0,0,0,0,0,0,0,0,0,2,0,0,0,0,0,0,0,0,0,0,0,0,0,0,0,0,0,0,0,0,0,0,1,0,0,0,0,0,0,1,0,0,0,0,0,0,11,0,0,0,6,0,0,21,15,0,0,0,0,0,0,0,0,3,0,0,0,0,0,0,0,0,0,0,1,0,0,0,0,0,0,0,1,0,0,0,0,0,0,0,9,0,0,0,0,0,0,0,0,0,0,0,0,0,0,0,0,0,0,0,0,0,0
"FIN_004_MZB_LO_117","FIN_004_MZB_LO_117-25.09.2017","25.09.2017",2017,9,25,0,0,0,0,0,0,0,0,0,0,0,79,0,0,0,0,0,0,0,0,0,0,0,17,4,0,0,0,0,0,0,0,0,0,0,0,0,0,0,0,0,0,0,80,0,1,0,0,0,0,0,0,0,0,0,0,0,0,0,3,0,0,0,0,0,0,0,0,0,5,2,0,0,2,0,0,0,0,1,0,4,4,0,0,0,0,0,0,1,0,0,0,0,2,0,0,0,0,6,0,0,27,0,0,0,0,0,0,0,1,0,0,0,0,2,0,0,2,0,0,0,0,1,0,0,0,0,2,0,11,0,0,0,0,0,0,0,0,0,0
"FIN_004_MZB_LO_117","FIN_004_MZB_LO_117-20.09.2020","20.09.2020",2020,9,20,0,0,0,0,0,0,0,0,0,0,0,1337,0,0,0,0,0,0,7,0,0,0,0,370,64,0,0,0,0,0,0,0,0,0,0,0,4,0,0,0,0,0,0,180,0,0,0,0,0,0,0,0,0,0,0,0,0,2,0,22,0,0,0,0,0,0,53,0,0,367,16,0,0,35,7,0,0,25,5,11,64,17,0,0,0,0,0,0,0,0,2,0,0,9,0,0,0,0,14,0,0,65,0,0,0,0,0,0,43,0,0,0,0,6,0,0,0,27,0,1,0,0,0,0,24,0,0,1,0,32,0,0,0,0,0,0,0,0,0,0
"FIN_004_MZB_LO_118","FIN_004_MZB_LO_118-22.10.2007","22.10.2007",2007,10,22,0,0,0,0,0,0,0,0,10,0,6,70,0,0,0,31,1,0,0,0,1,0,0,63,0,0,0,0,0,0,0,0,0,0,0,0,0,0,0,0,0,0,0,26,0,2,0,85,0,0,0,3,0,0,0,0,1,7,0,0,0,0,0,1,0,0,70,0,0,5,0,0,0,28,2,0,0,12,5,12,7,6,0,11,0,0,0,0,0,0,0,0,0,35,0,0,0,0,5,0,0,51,0,0,0,0,3,0,0,24,0,0,0,0,0,0,0,20,0,0,0,0,0,0,29,0,0,108,0,25,0,0,0,0,0,0,0,0,0,0
"FIN_004_MZB_LO_118","FIN_004_MZB_LO_118-20.09.2011","20.09.2011",2011,9,20,0,0,0,0,0,1,0,0,0,0,36,1206,0,0,0,45,36,0,4,0,8,0,0,1800,4,0,0,0,0,0,0,0,0,0,0,0,16,0,0,0,0,0,0,508,0,88,0,500,0,0,0,2,0,0,0,0,0,20,0,0,0,0,0,0,0,0,488,0,0,52,0,0,0,291,8,0,0,88,27,12,132,0,0,4,0,0,0,0,0,0,0,0,0,920,0,0,0,0,32,0,0,441,0,0,0,0,16,0,0,524,0,0,0,0,0,0,0,124,0,0,0,8,0,0,296,0,0,57,0,188,0,0,0,0,0,0,0,0,0,0
"FIN_004_MZB_LO_118","FIN_004_MZB_LO_118-08.09.2015","08.09.2015",2015,9,8,0,0,0,0,0,0,0,0,3,0,40,16,0,0,0,24,2,0,0,0,0,0,0,59,0,0,0,0,0,0,0,0,0,0,0,0,3,0,0,0,0,0,0,150,0,0,0,1,0,0,0,3,0,0,0,0,0,17,0,0,0,0,0,0,0,0,47,0,0,1,0,0,0,129,0,0,0,7,24,6,1,0,0,1,0,3,0,0,0,0,0,0,0,7,0,0,0,0,27,0,0,20,0,0,0,0,0,0,0,69,0,0,0,0,0,0,0,15,0,0,0,0,0,0,15,0,0,80,0,115,0,0,0,0,0,0,0,0,0,0
"FIN_004_MZB_LO_118","FIN_004_MZB_LO_118-16.10.2019","16.10.2019",2019,10,16,0,0,0,0,0,0,0,0,0,0,170,403,0,0,0,39,128,0,4,0,0,0,0,225,0,0,0,0,0,0,0,0,0,0,0,0,2,0,0,0,0,0,0,434,0,0,0,952,0,0,0,0,0,0,0,0,0,7,0,0,0,0,0,0,0,0,390,0,0,0,0,0,0,153,38,0,0,73,31,55,41,2,0,17,0,0,0,0,0,0,0,0,0,583,0,0,0,0,283,0,0,166,0,0,0,0,59,0,0,21,0,0,0,0,0,0,0,32,0,0,0,0,2,0,199,0,0,91,0,56,0,0,0,0,0,0,0,0,0,0
"FIN_004_MZB_LO_118","FIN_004_MZB_LO_118-07.09.2021","07.09.2021",2021,9,7,0,0,0,0,0,0,0,0,0,0,258,51,0,0,0,0,0,0,0,0,0,0,0,29,0,0,0,0,0,0,0,0,0,0,0,0,1,0,0,0,0,0,0,135,0,0,0,2,0,0,0,1,0,0,0,0,0,0,0,0,0,0,0,0,0,0,41,0,0,0,0,0,0,36,2,0,0,0,1,4,1,0,0,1,0,0,0,0,0,0,0,1,0,2,0,0,0,0,36,0,0,23,0,0,0,0,0,0,0,2,0,0,0,0,0,0,0,2,0,0,0,0,0,0,78,0,0,23,0,15,0,0,0,0,0,0,0,0,0,0
"FIN_004_MZB_LO_119","FIN_004_MZB_LO_119-23.10.2007","23.10.2007",2007,10,23,0,0,0,0,0,0,0,0,2,0,0,225,0,0,0,0,0,0,0,0,0,0,0,136,0,0,0,0,0,0,0,0,0,0,0,0,2,0,0,0,0,0,0,12,0,2,0,72,0,0,0,0,0,0,0,0,0,8,0,0,0,0,0,0,0,0,23,0,0,1,0,0,0,71,2,0,0,2,0,9,46,3,0,14,0,0,0,0,0,0,0,0,0,93,0,0,0,0,1,0,0,16,0,0,0,0,0,0,0,1,0,0,0,0,0,0,0,26,0,0,1,0,0,0,64,0,0,2,0,53,0,0,0,0,0,0,0,0,0,0
"FIN_004_MZB_LO_119","FIN_004_MZB_LO_119-20.09.2011","20.09.2011",2011,9,20,0,0,0,0,0,1,0,0,0,0,6,594,0,0,0,0,7,0,25,0,0,0,0,761,3,0,0,0,0,0,0,0,0,0,0,0,10,0,0,0,0,0,0,102,0,5,0,81,0,0,0,0,0,0,0,0,0,8,0,0,0,0,0,0,0,0,103,0,0,16,0,0,0,41,10,0,0,60,12,11,110,0,0,2,0,0,0,0,12,0,0,0,0,328,0,0,0,0,4,0,0,40,0,0,0,0,2,0,0,0,0,0,0,0,0,0,0,65,0,0,7,0,0,0,62,0,0,11,0,18,0,0,0,0,0,0,0,0,0,0
"FIN_004_MZB_LO_119","FIN_004_MZB_LO_119-08.09.2015","08.09.2015",2015,9,8,0,0,0,0,0,0,0,0,1,0,2,233,0,0,0,2,1,0,0,0,0,0,0,25,0,0,0,0,0,0,0,0,0,0,0,0,2,0,0,0,0,0,0,116,0,2,0,8,0,0,0,0,0,0,0,0,0,45,0,0,0,0,0,0,0,0,36,0,0,5,1,0,0,54,8,0,0,1,6,2,21,4,0,5,0,0,0,0,19,0,0,0,0,193,0,0,0,0,6,0,0,14,0,0,0,0,0,0,0,5,0,0,0,0,0,0,0,20,0,0,0,5,0,0,22,0,0,2,0,48,0,0,0,0,0,0,0,0,0,0
"FIN_004_MZB_LO_119","FIN_004_MZB_LO_119-16.10.2019","16.10.2019",2019,10,16,0,0,0,0,0,0,0,0,5,0,0,218,0,0,0,1,32,1,8,0,0,0,0,115,6,0,0,0,0,0,0,11,0,0,0,0,1,0,0,0,0,0,0,81,0,0,0,246,0,0,0,0,0,0,0,0,0,8,0,0,0,0,0,0,0,0,86,0,0,0,0,0,0,34,6,0,0,51,5,54,15,33,0,21,0,0,0,0,4,0,0,0,0,80,0,0,0,0,25,0,0,22,0,0,0,0,11,0,0,2,0,0,0,0,0,0,0,14,0,0,0,0,0,0,35,0,0,3,0,25,0,0,0,0,0,0,0,0,0,0
"FIN_004_MZB_LO_119","FIN_004_MZB_LO_119-07.09.2021","07.09.2021",2021,9,7,0,0,0,0,0,0,0,0,0,0,34,187,0,0,0,1,1,1,0,0,19,0,0,60,0,0,0,0,0,0,0,0,0,0,0,0,0,0,0,0,0,0,0,302,0,4,0,23,0,0,0,0,0,0,0,0,0,4,0,0,0,0,0,0,0,0,32,0,0,1,3,0,0,29,24,0,0,7,4,1,18,8,0,60,0,0,0,0,8,0,0,0,0,41,0,0,0,0,14,0,0,37,0,0,0,0,11,0,0,2,0,0,0,0,0,0,0,13,0,0,0,2,0,0,41,0,0,14,0,70,0,0,2,0,0,0,0,0,0,0
"FIN_004_MZB_LO_12","FIN_004_MZB_LO_12-28.09.2009","28.09.2009",2009,9,28,0,0,0,0,0,0,0,0,52,0,0,201,0,0,0,0,0,0,0,0,4,0,0,474,0,0,0,0,0,0,0,1,0,0,0,0,0,0,0,0,0,0,0,0,0,0,0,10,0,0,0,8,0,0,0,0,0,0,0,0,0,0,0,0,0,0,11,0,0,2,0,0,0,68,0,0,0,16,10,8,0,2,0,0,0,0,0,0,0,0,4,0,0,8,0,0,0,0,11,0,0,1,0,0,0,0,0,0,0,190,0,0,0,0,3,0,0,44,0,0,0,0,0,0,81,0,0,179,0,52,0,0,0,0,0,0,0,0,0,0
"FIN_004_MZB_LO_12","FIN_004_MZB_LO_12-21.09.2010","21.09.2010",2010,9,21,0,0,0,0,0,0,0,0,64,0,0,123,0,0,0,0,0,0,0,0,0,0,0,116,0,0,0,0,0,0,0,0,0,0,0,0,0,0,0,0,0,0,0,1,0,1,0,5,0,0,0,7,0,0,0,0,0,0,0,0,0,0,0,1,0,0,69,0,0,0,0,0,0,333,0,0,0,14,9,19,0,2,0,0,0,10,0,0,0,0,0,0,0,0,0,0,0,0,2,0,0,1,0,0,0,0,0,0,0,17,0,0,0,0,0,0,0,31,0,0,0,0,0,0,9,0,0,14,0,17,0,0,0,0,0,0,0,0,0,0
"FIN_004_MZB_LO_12","FIN_004_MZB_LO_12-22.09.2011","22.09.2011",2011,9,22,0,0,0,0,0,0,0,0,43,0,0,28,0,0,0,0,0,0,0,0,6,0,0,209,0,0,0,0,0,0,0,0,0,0,0,0,0,0,0,0,0,0,0,4,0,0,1,3,0,0,0,1,0,0,0,0,0,0,0,0,0,0,0,1,0,0,33,0,0,0,0,0,0,309,0,0,0,0,0,22,0,0,0,0,0,0,0,0,0,0,0,0,0,0,0,0,0,0,18,0,0,3,0,0,0,0,0,0,0,146,0,0,0,0,3,0,0,64,0,0,0,0,1,0,19,0,0,103,0,6,0,0,0,0,0,0,0,0,0,0
"FIN_004_MZB_LO_12","FIN_004_MZB_LO_12-24.09.2012","24.09.2012",2012,9,24,0,0,0,0,0,0,0,0,75,0,0,29,0,0,0,0,1,0,0,0,4,0,0,391,0,0,0,0,0,0,0,0,0,0,0,0,0,0,0,0,0,0,0,4,0,0,0,34,0,0,0,9,0,0,0,0,7,0,0,0,0,0,0,1,0,0,143,0,0,0,0,0,0,269,0,0,0,3,1,22,0,0,0,0,0,0,0,0,0,0,0,0,0,5,0,0,0,0,77,0,0,9,0,0,0,0,0,0,0,92,0,0,0,0,1,0,0,55,0,0,0,0,0,0,33,0,0,210,0,11,0,0,0,2,0,0,0,0,0,0
"FIN_004_MZB_LO_12","FIN_004_MZB_LO_12-25.09.2013","25.09.2013",2013,9,25,0,0,0,0,0,0,0,0,11,0,0,10,0,0,0,0,0,0,0,0,0,0,0,169,0,0,0,0,0,0,0,0,0,0,0,0,0,0,0,0,0,0,0,0,0,0,0,16,0,0,0,1,0,0,0,0,0,0,0,0,0,0,0,0,0,0,64,0,0,0,0,0,0,74,0,0,0,1,0,4,0,2,0,0,0,0,0,0,0,0,0,0,0,0,0,0,0,0,3,0,0,10,0,0,0,0,0,0,0,164,0,0,0,0,0,0,0,31,0,0,0,0,0,0,4,0,0,25,0,0,0,0,0,0,0,1,0,0,0,0
"FIN_004_MZB_LO_12","FIN_004_MZB_LO_12-24.09.2014","24.09.2014",2014,9,24,0,0,0,0,0,0,0,0,13,0,0,15,0,0,0,0,0,0,0,0,0,0,0,60,0,0,0,0,0,0,0,0,0,0,0,0,0,0,0,0,0,0,0,0,0,0,0,0,0,0,0,10,0,0,0,0,0,0,0,0,0,0,0,0,0,0,35,0,0,1,0,0,0,54,0,0,0,1,0,16,0,0,0,0,0,0,0,0,0,0,0,0,0,0,0,0,0,0,2,0,0,0,0,0,0,0,0,0,0,88,0,0,0,0,2,0,0,4,0,0,0,0,0,0,7,0,0,3,0,0,0,0,0,0,0,4,0,0,0,0
"FIN_004_MZB_LO_12","FIN_004_MZB_LO_12-19.10.2015","19.10.2015",2015,10,19,0,0,0,0,0,0,0,0,31,0,0,69,0,0,0,0,0,0,1,0,4,0,0,52,0,0,0,0,0,0,0,0,0,0,0,0,0,0,0,0,0,0,0,2,0,0,0,4,0,0,0,2,0,0,0,0,0,0,0,0,0,0,0,0,0,0,55,0,0,1,0,0,0,210,0,0,0,1,0,0,0,0,0,0,0,0,0,0,0,0,0,0,0,0,0,0,0,0,11,0,0,5,0,0,0,0,0,0,0,208,0,0,0,0,2,0,0,62,0,0,0,0,0,0,238,0,0,19,0,1,0,0,0,0,0,2,0,0,0,0
"FIN_004_MZB_LO_12","FIN_004_MZB_LO_12-28.09.2016","28.09.2016",2016,9,28,0,0,0,0,0,0,0,0,40,0,0,8,0,0,0,0,0,0,0,0,0,0,0,73,0,0,0,0,0,0,0,0,0,0,0,0,0,0,0,0,0,0,0,0,0,0,0,17,0,0,0,1,0,0,0,0,0,0,0,0,0,0,0,0,0,0,247,0,0,0,0,0,0,163,0,0,0,0,1,8,0,0,0,0,0,0,0,0,0,0,0,0,0,0,0,0,0,0,0,0,0,11,0,0,0,0,0,0,0,99,0,0,0,0,2,0,0,52,0,0,0,3,0,0,13,0,0,6,0,11,0,0,0,0,0,0,0,0,0,0
"FIN_004_MZB_LO_12","FIN_004_MZB_LO_12-24.10.2017","24.10.2017",2017,10,24,0,0,0,0,0,0,0,0,22,0,0,35,0,0,0,0,0,0,0,0,1,0,0,112,0,0,0,0,0,0,0,0,0,0,0,0,0,0,0,0,0,0,0,0,0,1,0,22,0,0,0,11,0,0,0,0,0,0,0,0,0,0,0,2,0,0,55,0,0,0,1,0,0,26,0,0,0,4,0,11,0,1,0,0,0,0,0,0,0,0,0,0,0,2,0,0,0,0,7,0,0,19,0,0,0,0,0,0,0,18,0,0,0,0,3,0,0,118,0,0,0,0,0,0,45,0,0,7,0,1,0,0,0,0,0,6,0,0,0,0
"FIN_004_MZB_LO_12","FIN_004_MZB_LO_12-06.09.2018","06.09.2018",2018,9,6,0,0,0,0,0,0,0,0,72,0,0,10,0,0,0,0,0,0,0,0,0,0,0,181,0,0,0,0,0,0,0,0,0,0,0,0,0,0,0,0,0,0,0,1,0,0,0,0,0,0,0,12,0,0,0,0,0,0,0,0,0,0,0,0,0,0,17,0,0,0,0,0,0,14,0,0,0,3,5,15,0,0,0,0,0,0,0,0,0,0,2,0,0,0,0,0,0,0,28,0,0,0,0,0,0,0,0,0,0,18,0,0,0,0,21,0,0,0,0,0,0,0,0,0,0,0,1,0,0,1,0,0,9,0,0,1,0,0,0,0
"FIN_004_MZB_LO_12","FIN_004_MZB_LO_12-01.10.2019","01.10.2019",2019,10,1,0,0,0,0,0,0,0,0,9,0,0,1449,0,0,0,0,1,0,0,0,2,0,0,124,0,0,0,0,0,0,0,0,0,0,0,0,0,0,0,0,0,0,0,0,0,1,0,21,0,0,0,0,0,0,0,0,0,0,0,0,0,0,0,0,0,0,109,0,0,6,0,0,0,116,0,0,0,9,0,1,0,5,0,0,0,0,0,0,0,0,0,0,0,1,0,0,0,0,2,0,0,34,0,0,0,0,0,0,0,7,0,0,0,0,5,0,0,60,0,0,0,1,0,0,9,0,0,120,0,2,0,0,0,0,0,0,0,0,0,0
"FIN_004_MZB_LO_12","FIN_004_MZB_LO_12-07.09.2020","07.09.2020",2020,9,7,0,0,0,0,0,0,0,0,3,0,0,63,0,0,0,0,0,0,0,0,0,0,0,116,0,0,0,0,0,0,0,0,0,0,0,0,0,0,0,0,0,0,0,0,0,0,0,6,0,0,0,0,0,0,0,0,0,0,0,0,0,0,0,0,0,0,130,0,0,0,1,0,0,283,0,0,0,0,1,3,0,0,0,0,0,0,0,0,0,0,0,0,0,0,0,0,0,0,3,0,0,21,0,0,0,0,0,0,0,239,0,0,0,0,7,0,0,32,0,0,0,0,0,0,63,0,0,30,0,0,0,0,0,0,0,1,0,0,0,0
"FIN_004_MZB_LO_120","FIN_004_MZB_LO_120-19.09.2007","19.09.2007",2007,9,19,0,0,0,0,0,0,0,0,7,0,22,6,0,0,0,0,0,0,0,0,0,0,0,5,0,0,0,0,0,0,0,0,0,0,0,0,0,0,0,0,0,0,0,24,0,0,0,7,0,0,0,0,0,0,0,0,0,3,0,0,0,0,0,0,0,0,20,0,0,0,0,0,0,0,0,0,0,0,0,0,1,1,0,4,0,0,0,0,38,0,1,0,0,2,0,0,0,0,5,0,0,4,0,0,0,0,0,0,0,1,0,0,0,0,0,0,0,1,0,0,0,0,0,0,2,0,0,10,0,2,0,0,1,0,0,0,0,0,0,0
"FIN_004_MZB_LO_120","FIN_004_MZB_LO_120-21.09.2011","21.09.2011",2011,9,21,0,0,0,0,0,0,0,0,2,0,1,232,0,0,0,0,0,0,11,0,0,0,0,94,1,0,0,0,0,0,0,0,0,0,0,0,0,0,0,0,0,0,0,49,0,7,0,99,0,0,0,0,0,0,0,0,0,2,0,0,0,0,0,0,0,0,42,0,0,8,0,0,0,13,12,0,0,106,1,0,0,2,0,0,0,0,0,0,30,0,0,0,0,24,0,0,0,0,0,0,0,14,0,0,0,0,0,0,0,0,0,0,0,0,3,0,0,14,0,0,0,0,0,0,7,0,0,5,0,36,0,0,0,0,0,0,0,0,0,0
"FIN_004_MZB_LO_120","FIN_004_MZB_LO_120-20.10.2015","20.10.2015",2015,10,20,0,0,0,0,0,0,0,0,1,0,1,10,0,0,0,0,0,0,18,0,3,0,0,28,0,0,0,0,0,1,0,0,0,0,0,0,8,0,0,0,0,0,0,38,0,0,0,85,0,0,0,0,0,0,0,0,0,10,0,0,0,0,0,0,0,0,42,0,0,1,0,0,0,13,12,0,0,2,2,0,0,1,0,0,0,0,0,0,34,0,0,0,0,78,0,0,0,0,40,0,0,17,0,0,0,0,0,0,0,0,0,0,0,0,0,0,0,18,0,0,2,0,0,0,403,0,0,3,0,13,0,0,0,0,0,6,0,0,0,0
"FIN_004_MZB_LO_120","FIN_004_MZB_LO_120-09.10.2019","09.10.2019",2019,10,9,0,0,0,0,0,0,0,0,2,0,1,158,0,0,0,0,1,0,59,0,1,0,0,40,6,0,0,0,0,0,0,0,0,0,0,0,0,0,0,0,0,0,0,62,0,0,0,242,0,0,0,0,0,0,0,0,0,4,0,0,0,0,0,0,0,0,217,0,0,1,0,0,0,87,2,0,0,59,6,0,1,1,0,0,0,0,0,0,5,0,0,0,0,33,0,0,0,0,70,0,0,10,0,0,0,0,0,0,0,0,0,0,0,0,3,0,0,17,0,0,0,1,0,0,44,0,0,10,0,58,0,0,1,0,0,4,0,0,0,0
"FIN_004_MZB_LO_120","FIN_004_MZB_LO_120-11.10.2021","11.10.2021",2021,10,11,0,0,0,0,0,0,0,0,11,0,23,10,0,0,0,25,1,0,6,0,0,0,0,6,1,0,0,0,0,0,0,0,0,0,0,0,6,0,0,0,0,0,0,107,0,1,0,17,0,0,0,1,0,0,0,0,0,2,0,0,0,0,0,0,0,0,85,0,0,0,0,0,0,61,10,0,0,56,15,0,0,0,0,10,0,0,0,0,26,0,0,0,0,5,0,0,0,0,20,0,0,13,0,0,0,0,0,0,0,0,0,0,0,0,0,0,0,1,0,0,1,0,0,0,9,0,0,66,0,19,0,0,0,0,0,1,0,0,0,0
"FIN_004_MZB_LO_121","FIN_004_MZB_LO_121-19.09.2007","19.09.2007",2007,9,19,0,0,0,0,0,0,0,0,19,0,1,5,0,0,0,0,0,8,0,0,0,0,0,16,0,0,0,0,0,4,1,0,0,0,0,0,0,0,0,0,0,0,0,10,0,0,0,1,0,0,0,1,0,0,0,0,12,0,0,0,0,0,0,0,0,0,2,0,0,0,0,0,0,0,1,0,0,10,2,23,0,4,0,12,0,0,0,0,0,0,0,0,0,8,0,0,0,0,6,0,0,2,0,0,0,0,5,0,0,10,0,0,0,0,0,0,0,2,0,0,0,0,0,0,3,0,0,66,0,8,0,0,0,0,0,0,0,0,0,0
"FIN_004_MZB_LO_121","FIN_004_MZB_LO_121-20.09.2011","20.09.2011",2011,9,20,0,0,0,0,0,0,0,0,0,0,0,24,0,0,0,0,0,0,26,0,1,0,0,117,0,0,0,0,0,0,0,0,0,0,0,0,1,0,0,0,0,0,0,110,0,11,0,14,0,0,0,0,0,0,0,0,0,0,0,0,0,0,0,0,0,0,89,0,0,26,0,0,0,33,60,0,0,62,3,13,5,1,0,3,0,0,0,0,35,0,0,0,0,104,0,0,0,0,4,0,0,19,0,0,0,0,0,0,0,6,0,0,0,0,0,0,0,34,0,0,2,0,0,0,5,0,0,30,0,7,0,0,0,0,0,0,0,0,0,0
"FIN_004_MZB_LO_121","FIN_004_MZB_LO_121-27.09.2015","27.09.2015",2015,9,27,0,0,0,0,0,3,0,0,4,0,4,0,0,0,0,0,0,0,18,0,2,0,0,13,0,0,0,0,0,0,0,0,0,0,0,0,3,0,0,0,0,0,0,177,0,11,0,7,0,0,0,0,0,0,0,0,0,1,2,0,0,0,0,0,0,0,83,0,0,3,0,0,0,19,0,0,0,41,5,2,4,4,3,9,0,0,0,0,35,0,0,0,0,51,0,0,0,0,51,0,0,8,1,0,0,0,0,0,0,10,0,0,0,0,0,0,0,22,0,0,4,0,0,0,13,0,0,30,0,86,0,0,0,0,0,1,0,0,0,0
"FIN_004_MZB_LO_121","FIN_004_MZB_LO_121-08.10.2019","08.10.2019",2019,10,8,0,0,0,0,0,0,0,0,4,0,0,20,0,0,0,0,0,0,9,0,0,0,0,94,0,0,0,0,0,0,0,0,0,0,0,0,2,0,0,0,0,0,0,42,0,0,0,32,0,0,0,0,0,0,0,0,0,1,0,0,0,0,0,0,0,0,83,0,0,0,0,0,0,18,2,0,0,11,4,82,5,3,0,0,0,0,0,0,14,0,0,0,0,63,0,0,0,0,24,0,0,21,0,0,0,0,0,0,0,26,0,0,0,0,0,0,0,4,0,0,0,0,1,0,24,0,0,4,0,38,0,0,0,0,0,0,0,0,0,0
"FIN_004_MZB_LO_121","FIN_004_MZB_LO_121-11.10.2021","11.10.2021",2021,10,11,0,0,0,0,0,0,0,0,6,0,0,0,0,0,0,0,0,0,2,0,0,0,0,47,0,0,0,0,0,0,0,0,0,0,0,0,0,0,0,0,0,0,0,106,0,2,0,1,0,0,0,0,0,0,0,0,0,0,0,0,0,0,0,0,0,0,62,0,0,0,0,0,0,15,15,0,0,17,1,1,5,8,0,2,0,0,0,0,14,0,0,0,0,13,0,0,0,0,44,0,0,13,0,0,0,0,0,0,0,25,0,0,0,0,0,0,0,7,0,0,2,0,0,0,14,0,0,5,0,52,0,0,0,0,0,0,0,0,0,0
"FIN_004_MZB_LO_122","FIN_004_MZB_LO_122-19.09.2007","19.09.2007",2007,9,19,0,0,0,0,0,0,0,0,3,0,2,9,0,0,0,0,0,0,0,0,0,0,0,4,0,0,0,0,0,0,0,1,0,0,0,0,0,0,0,0,0,0,0,26,0,0,0,3,0,0,0,0,0,0,0,0,0,1,0,0,0,0,0,0,0,0,6,0,0,0,0,0,0,1,0,0,0,3,0,0,0,1,0,15,0,0,0,0,1,0,0,0,0,0,0,0,0,0,3,0,0,2,0,0,0,0,0,0,0,1,0,0,0,0,0,0,0,0,0,0,0,4,0,0,2,0,0,2,0,17,0,0,5,0,0,0,0,0,0,0
"FIN_004_MZB_LO_122","FIN_004_MZB_LO_122-20.09.2011","20.09.2011",2011,9,20,0,0,0,0,0,0,0,0,1,0,0,135,0,0,0,0,5,0,0,0,1,0,0,260,1,0,0,0,0,0,0,0,0,0,0,0,6,0,0,0,0,0,0,47,0,4,0,152,0,0,0,0,0,0,0,0,0,2,0,0,0,0,0,0,0,0,54,0,0,24,0,0,0,20,16,0,0,75,6,0,0,0,0,0,0,0,0,0,27,0,0,0,0,88,0,0,0,0,2,0,0,19,0,0,0,0,2,0,0,1,0,0,0,0,2,0,0,24,0,0,0,2,0,0,18,0,0,94,0,48,0,0,0,0,0,0,0,0,0,0
"FIN_004_MZB_LO_122","FIN_004_MZB_LO_122-20.10.2015","20.10.2015",2015,10,20,0,0,0,0,0,0,0,0,8,0,1,22,0,0,0,0,0,0,26,0,0,0,0,16,2,0,0,0,0,0,0,0,0,0,0,0,0,0,0,0,0,0,0,19,0,0,0,19,0,0,0,0,0,0,0,0,0,1,0,0,0,0,0,0,0,0,70,0,0,1,0,0,0,18,1,0,0,10,0,1,2,4,0,1,0,0,0,0,6,0,0,0,0,18,0,0,0,0,10,0,0,3,0,0,0,0,1,0,0,0,0,0,0,0,0,0,0,14,0,0,0,0,0,0,74,0,0,0,0,31,0,0,0,0,0,2,0,0,0,0
"FIN_004_MZB_LO_122","FIN_004_MZB_LO_122-08.10.2019","08.10.2019",2019,10,8,0,0,0,0,0,0,0,0,1,0,0,148,0,0,0,0,6,0,4,0,0,0,0,121,0,0,0,0,0,0,0,0,0,0,0,0,0,0,0,0,0,0,0,26,0,0,0,58,0,0,0,0,0,0,0,0,0,0,0,0,0,0,0,0,0,0,102,0,0,1,0,0,0,32,5,0,0,33,2,2,0,1,0,1,0,0,0,0,1,0,0,0,0,18,0,0,0,0,6,0,0,8,0,0,0,0,1,0,0,0,0,0,0,0,0,0,0,14,0,0,0,0,0,0,3,0,0,7,0,49,0,0,1,0,0,2,0,0,0,0
"FIN_004_MZB_LO_122","FIN_004_MZB_LO_122-12.10.2021","12.10.2021",2021,10,12,0,0,0,0,0,0,0,0,35,0,0,3,0,0,0,0,7,0,16,0,0,0,0,35,1,0,0,0,0,0,1,13,0,0,0,0,0,0,0,0,0,0,0,10,0,0,0,7,0,0,0,5,0,0,0,0,0,1,0,0,0,0,0,0,0,0,25,0,0,0,0,0,0,2,2,0,0,7,4,47,0,15,0,2,0,0,0,0,0,0,0,0,0,10,0,0,0,0,12,0,0,2,0,0,0,0,3,0,0,4,0,0,0,0,0,0,0,1,0,0,0,0,0,0,1,0,0,7,0,7,0,0,0,0,0,0,0,0,0,0
"FIN_004_MZB_LO_123","FIN_004_MZB_LO_123-11.09.2007","11.09.2007",2007,9,11,0,0,0,0,0,0,0,0,3,0,0,128,0,0,0,0,0,0,0,0,0,0,0,90,0,0,0,0,0,0,0,0,0,0,0,0,0,0,0,0,0,0,0,0,0,1,0,2,0,0,0,2,0,0,0,0,0,2,0,0,0,0,0,0,0,0,1,0,0,0,0,0,0,250,0,0,0,0,0,0,1,0,0,0,0,0,0,0,0,0,0,0,0,0,0,0,0,0,40,0,0,1,0,0,0,0,0,0,0,95,0,0,0,0,22,0,0,3,0,0,0,0,0,0,7,0,0,39,0,0,0,0,0,0,0,2,0,0,0,0
"FIN_004_MZB_LO_123","FIN_004_MZB_LO_123-18.10.2010","18.10.2010",2010,10,18,0,0,0,0,0,0,0,0,28,0,0,125,0,0,0,0,0,0,0,0,0,0,0,122,0,0,0,0,0,0,0,0,0,0,0,0,0,2,0,0,0,0,0,0,0,0,0,2,0,0,0,7,0,0,0,0,0,0,0,0,0,0,0,0,0,0,4,0,0,0,0,0,0,1068,0,0,0,0,2,0,0,0,0,1,0,0,0,0,0,0,15,0,0,0,0,0,0,0,5,0,0,0,0,0,0,0,0,0,0,194,0,0,0,0,18,0,0,6,0,0,0,0,0,0,33,0,0,50,0,1,0,0,0,0,0,1,0,0,0,0
"FIN_004_MZB_LO_123","FIN_004_MZB_LO_123-18.11.2013","18.11.2013",2013,11,18,0,0,0,0,0,0,0,0,0,0,0,21,0,0,0,0,0,0,0,0,0,0,0,25,0,0,0,0,0,0,0,0,0,0,0,0,0,0,0,0,0,0,0,0,0,0,0,1,0,0,0,0,0,0,0,0,0,0,0,0,0,0,0,0,0,0,3,0,0,0,0,0,0,43,0,0,0,0,0,0,0,2,0,0,0,0,0,0,0,0,0,1,0,0,0,0,0,0,1,0,0,0,0,0,0,0,0,0,0,6,0,0,0,0,7,0,0,5,0,0,0,0,0,0,2,0,0,16,0,0,0,0,0,0,0,0,0,0,0,0
"FIN_004_MZB_LO_123","FIN_004_MZB_LO_123-31.10.2016","31.10.2016",2016,10,31,0,0,0,0,0,0,0,0,0,0,0,24,0,0,0,0,1,0,0,0,0,0,0,90,0,0,0,0,0,0,0,0,0,0,0,0,0,0,0,0,0,0,0,0,0,0,0,38,0,0,0,0,0,0,0,0,0,3,0,0,0,0,0,0,0,0,14,0,0,0,0,0,0,573,0,0,0,0,1,0,0,1,0,0,0,0,0,0,0,0,0,0,0,0,0,0,0,0,25,0,0,0,0,0,0,0,0,0,0,99,0,0,0,0,7,0,0,12,0,0,0,0,0,0,64,0,0,20,0,1,0,0,0,0,0,2,0,0,0,0
"FIN_004_MZB_LO_123","FIN_004_MZB_LO_123-12.11.2019","12.11.2019",2019,11,12,0,0,0,0,0,0,0,0,82,0,0,355,0,0,0,0,2,0,0,0,2,0,0,247,0,0,0,0,0,0,0,0,0,0,0,0,0,0,0,0,0,0,0,1,0,0,0,29,0,0,0,10,0,0,0,0,0,0,0,0,0,0,0,0,0,0,81,0,0,0,0,0,0,1848,1,0,0,0,3,4,0,2,0,0,0,0,0,0,0,0,2,10,0,0,0,0,0,0,167,0,0,4,0,0,0,0,0,0,0,424,0,0,0,0,13,0,0,21,0,0,0,0,0,0,2,0,0,58,0,4,0,0,1,0,0,146,0,0,0,0
"FIN_004_MZB_LO_124","FIN_004_MZB_LO_124-18.09.2007","18.09.2007",2007,9,18,0,0,0,0,0,0,0,0,137,0,0,235,0,0,0,0,0,0,0,0,30,3,0,274,0,0,0,0,0,0,0,0,0,0,0,0,0,0,0,0,0,0,0,9,0,12,0,41,0,0,0,10,0,0,0,0,0,0,0,0,0,0,0,0,0,0,104,0,0,0,0,0,0,339,0,0,0,7,21,12,0,0,0,0,0,0,0,0,0,0,0,0,0,121,0,0,0,0,163,0,0,53,0,0,0,0,0,0,0,2839,0,0,0,0,0,0,0,75,0,0,0,0,0,0,57,0,0,106,0,0,0,0,0,0,0,12,0,0,0,0
"FIN_004_MZB_LO_124","FIN_004_MZB_LO_124-02.11.2010","02.11.2010",2010,11,2,0,0,0,0,0,0,0,0,55,0,0,52,0,0,0,0,0,0,0,0,0,0,0,57,0,0,0,0,0,0,0,0,0,0,0,0,0,0,0,0,0,0,0,0,0,0,0,3,0,0,0,2,0,0,0,0,2,0,0,0,0,0,0,0,0,0,18,0,0,0,0,0,0,212,0,0,0,1,9,0,0,2,0,0,0,0,0,0,0,0,0,0,0,2,0,0,0,0,7,0,0,17,0,0,0,0,0,0,0,200,0,0,0,0,2,0,0,8,0,0,0,0,0,0,60,0,0,15,0,0,0,0,0,0,0,3,0,0,0,0
"FIN_004_MZB_LO_124","FIN_004_MZB_LO_124-25.11.2013","25.11.2013",2013,11,25,0,0,0,0,0,0,0,0,43,0,0,28,0,0,0,0,0,0,0,0,0,0,0,16,0,0,0,0,0,0,0,0,0,0,0,0,2,0,0,0,0,0,0,0,0,0,0,1,0,0,0,1,0,0,0,0,0,0,0,0,0,0,0,0,0,0,14,0,0,0,0,0,0,43,0,0,0,2,1,1,0,10,0,0,0,0,0,0,0,0,1,1,0,1,0,0,0,0,8,0,0,2,0,0,0,0,0,0,0,7,0,0,0,0,0,0,0,2,0,0,0,0,0,0,0,0,0,2,0,1,0,0,0,0,0,1,0,0,0,0
"FIN_004_MZB_LO_124","FIN_004_MZB_LO_124-21.09.2016","21.09.2016",2016,9,21,0,0,0,0,0,0,0,0,4,0,0,22,0,0,0,0,0,1,0,0,0,0,0,3,0,0,0,0,0,0,0,0,0,0,0,0,0,0,0,0,0,0,0,1,0,0,0,0,0,0,0,0,0,0,0,0,0,4,0,0,0,0,0,0,0,0,27,0,0,0,0,0,0,365,0,0,0,0,4,0,0,2,0,0,0,0,0,0,0,0,0,0,0,3,0,0,0,0,0,0,0,7,0,0,0,0,0,0,0,158,0,0,0,0,0,0,0,34,0,0,0,0,0,0,0,0,0,65,0,17,0,0,0,0,0,0,0,0,0,0
"FIN_004_MZB_LO_124","FIN_004_MZB_LO_124-01.10.2019","01.10.2019",2019,10,1,0,0,0,0,0,0,0,0,77,0,0,95,0,0,0,0,0,0,0,0,1,0,0,2,0,0,0,0,0,0,1,0,0,0,0,0,0,0,0,0,0,0,0,1,0,0,0,3,0,0,0,6,0,0,0,0,1,0,0,0,0,0,0,0,0,0,58,0,0,0,0,0,0,265,0,0,0,8,0,7,0,61,0,0,0,0,0,0,0,0,12,0,0,3,0,0,0,0,11,0,0,4,0,0,0,0,0,0,0,15,0,0,0,0,0,0,0,4,0,0,0,0,0,0,24,0,0,46,0,9,0,0,4,0,0,4,0,0,0,0
"FIN_004_MZB_LO_125","FIN_004_MZB_LO_125-04.09.2008","04.09.2008",2008,9,4,0,0,0,0,0,0,0,0,24,0,0,337,0,0,0,0,0,0,0,0,22,0,0,47,0,0,0,0,0,0,0,0,0,0,0,0,0,0,0,0,0,0,0,50,0,1,0,2,0,0,0,8,0,0,0,0,1,0,0,0,0,0,0,0,0,0,89,0,0,1,0,0,0,23,0,0,0,4,0,29,0,0,0,0,0,0,0,0,0,0,0,0,0,93,0,0,0,0,91,0,0,1,0,0,0,0,0,0,0,0,0,0,0,0,0,0,0,31,0,0,0,4,0,0,38,0,0,9,0,5,0,0,0,0,0,0,0,0,0,0
"FIN_004_MZB_LO_125","FIN_004_MZB_LO_125-21.09.2011","21.09.2011",2011,9,21,0,0,0,0,0,0,0,0,31,0,0,229,0,0,0,0,0,0,0,0,4,0,0,116,0,0,0,0,0,0,3,0,0,0,0,0,0,0,0,0,0,0,0,28,0,1,0,2,0,0,0,3,0,0,0,0,0,0,0,0,0,0,0,1,0,0,18,0,0,0,0,0,0,111,0,0,0,25,10,55,0,12,0,0,0,0,0,0,0,0,0,0,0,43,0,0,0,0,14,0,0,6,0,0,0,0,0,0,0,20,0,0,0,0,0,0,0,17,0,0,0,0,0,0,98,0,0,51,0,2,0,0,1,0,0,0,0,0,0,0
"FIN_004_MZB_LO_125","FIN_004_MZB_LO_125-02.10.2014","02.10.2014",2014,10,2,0,0,0,0,0,0,0,0,142,0,0,417,0,0,0,0,0,0,0,0,10,0,0,276,0,0,0,0,0,0,0,1,0,0,0,0,0,0,0,0,0,0,0,38,0,12,0,7,0,0,0,14,0,0,0,0,0,0,0,0,0,0,0,1,0,0,21,0,0,8,0,0,0,66,0,0,0,59,9,17,0,0,0,0,0,0,0,0,0,0,3,0,0,10,0,0,0,0,64,0,0,4,0,0,0,0,0,0,0,1,0,0,0,0,1,0,0,35,0,0,0,0,0,0,24,0,0,149,0,9,0,0,1,0,0,5,0,0,0,0
"FIN_004_MZB_LO_125","FIN_004_MZB_LO_125-30.09.2015","30.09.2015",2015,9,30,0,0,0,0,0,0,0,0,137,0,0,536,0,0,0,0,0,0,0,0,7,0,0,36,0,0,1,0,0,0,0,0,0,0,0,0,3,0,0,0,0,0,0,192,0,0,0,13,0,0,0,6,0,0,0,0,3,0,0,0,0,0,0,0,0,0,84,0,0,2,4,0,0,98,0,0,0,40,1,43,6,12,0,0,0,0,0,0,0,0,2,0,0,32,0,0,0,0,93,0,0,6,0,0,0,0,0,0,0,79,0,0,0,1,1,0,0,84,0,4,0,0,0,0,291,0,0,92,0,30,0,0,3,0,0,3,0,0,0,0
"FIN_004_MZB_LO_125","FIN_004_MZB_LO_125-27.09.2018","27.09.2018",2018,9,27,0,0,0,0,0,0,0,0,32,0,0,213,0,0,0,0,0,0,0,0,6,0,0,279,0,0,0,0,0,0,0,0,0,0,0,0,0,0,0,0,0,0,0,2,0,18,0,7,0,0,0,5,0,0,0,0,0,0,0,0,0,0,0,0,0,0,33,0,0,0,0,0,0,26,0,0,0,22,4,3,3,2,0,0,0,0,0,0,0,0,2,0,0,3,0,0,0,0,12,0,0,10,0,0,0,0,0,0,0,1,0,0,0,0,1,0,0,17,0,0,0,0,0,0,4,0,0,30,0,1,0,0,1,0,0,0,0,0,0,0
"FIN_004_MZB_LO_126","FIN_004_MZB_LO_126-04.09.2008","04.09.2008",2008,9,4,0,0,0,0,0,0,0,0,74,0,0,121,0,0,0,0,0,0,0,0,18,0,0,163,0,0,0,0,0,0,0,0,0,0,0,0,0,0,0,0,0,0,0,22,0,0,0,2,0,0,0,2,0,0,0,0,0,0,0,0,0,0,0,0,0,0,4,0,0,0,0,0,0,335,0,0,0,0,2,0,0,0,0,0,0,0,0,0,0,0,0,3,0,0,0,0,0,0,90,0,0,4,0,0,0,0,0,0,0,200,0,0,0,0,0,0,0,49,0,0,0,16,0,0,81,0,0,119,0,0,0,0,0,0,0,1,0,0,0,0
"FIN_004_MZB_LO_126","FIN_004_MZB_LO_126-26.09.2011","26.09.2011",2011,9,26,0,0,0,0,0,0,0,0,150,0,0,259,0,0,0,0,0,0,0,0,23,0,0,321,0,0,0,0,0,0,0,0,0,0,0,0,0,0,0,0,0,0,0,22,1,6,0,24,0,0,0,6,0,0,0,0,10,0,0,0,0,0,0,5,0,0,41,0,0,0,0,0,0,2991,0,0,0,21,56,3,0,0,0,1,0,0,0,0,0,0,8,0,0,6,0,0,0,0,56,0,0,11,0,0,0,0,0,0,0,114,0,0,0,0,41,0,0,61,0,0,0,1,0,0,433,0,0,622,0,2,0,0,0,0,0,0,0,0,0,0
"FIN_004_MZB_LO_126","FIN_004_MZB_LO_126-01.10.2014","01.10.2014",2014,10,1,0,0,0,0,0,0,0,0,83,0,0,123,0,0,0,0,0,0,0,0,38,0,0,1067,0,0,0,0,0,0,0,0,0,0,0,0,0,0,0,0,0,0,0,7,0,23,0,29,0,0,0,5,0,0,0,0,6,0,0,0,0,0,0,0,0,0,32,0,0,12,0,0,0,775,0,0,0,12,9,0,0,0,0,0,0,0,0,0,0,0,1,1,0,8,0,0,0,0,54,0,0,0,0,0,0,0,0,0,0,13,0,0,0,0,29,0,0,56,0,0,0,0,0,0,254,0,0,20,0,2,0,0,0,0,0,1,0,0,0,0
"FIN_004_MZB_LO_126","FIN_004_MZB_LO_126-22.09.2015","22.09.2015",2015,9,22,0,0,0,0,0,0,0,0,194,0,0,220,0,0,0,0,1,0,0,0,39,0,0,563,0,0,0,0,0,0,0,0,0,0,0,0,0,0,0,0,0,0,0,3,0,4,0,15,0,0,0,27,0,0,0,0,7,0,0,0,0,0,0,1,0,0,24,0,0,5,0,0,0,764,0,0,0,1,7,1,1,1,0,0,0,0,0,0,0,0,2,5,0,3,0,0,0,0,186,0,0,5,0,0,0,0,0,0,0,1745,0,0,0,0,5,0,0,141,0,0,0,2,0,0,20,0,0,373,0,0,0,0,0,0,0,35,0,0,0,0
"FIN_004_MZB_LO_126","FIN_004_MZB_LO_126-08.10.2019","08.10.2019",2019,10,8,0,0,0,0,0,0,0,0,50,0,0,5,0,0,0,0,0,0,0,0,5,0,0,243,0,0,0,1,0,0,0,2,0,0,0,0,0,0,0,0,0,7,0,0,0,0,0,0,0,0,0,5,0,0,0,0,0,0,0,0,0,0,0,0,0,0,20,0,0,1,0,0,0,63,0,0,0,0,0,51,0,48,0,0,0,0,0,0,0,0,0,0,0,3,0,0,0,0,7,0,0,0,0,0,0,0,0,0,0,163,0,0,0,0,0,0,0,4,0,0,0,0,0,0,0,0,0,78,0,0,0,0,0,0,0,0,0,0,0,0
"FIN_004_MZB_LO_127","FIN_004_MZB_LO_127-28.09.2008","28.09.2008",2008,9,28,0,0,0,0,0,0,0,5,62,0,0,413,0,0,0,0,3,2,0,0,0,0,0,93,0,0,0,0,0,0,0,0,0,0,0,0,0,0,0,0,0,0,0,57,0,0,0,0,0,0,0,0,0,0,0,0,0,0,0,0,0,0,0,0,0,0,12,0,0,5,0,0,0,306,0,0,0,0,22,0,0,5,2,0,0,0,0,0,0,0,0,0,0,0,0,0,0,0,119,0,0,0,2,0,0,0,2,0,0,0,0,0,0,1,0,0,0,12,0,3,0,0,0,0,328,0,0,4,0,1,0,0,0,0,0,10,0,0,0,0
"FIN_004_MZB_LO_127","FIN_004_MZB_LO_127-12.10.2010","12.10.2010",2010,10,12,0,0,0,0,0,0,0,0,47,0,0,39,0,0,0,0,1,0,0,0,0,0,0,9,0,0,0,0,0,0,0,0,0,0,0,0,0,0,0,0,0,0,0,70,0,0,0,0,0,0,0,0,0,0,0,0,0,0,0,0,0,0,0,0,0,0,10,0,0,0,0,0,0,315,0,0,0,0,21,0,0,0,0,2,0,0,0,0,0,0,0,0,0,1,0,0,0,0,2,0,0,0,0,2,0,0,15,0,0,1,0,0,0,0,0,0,0,19,0,2,0,0,0,0,57,0,0,14,0,7,0,0,1,0,0,1,0,0,0,0
"FIN_004_MZB_LO_127","FIN_004_MZB_LO_127-18.09.2013","18.09.2013",2013,9,18,0,0,0,0,0,0,0,0,133,0,0,155,0,0,0,0,8,2,0,0,0,0,0,37,0,0,0,0,0,0,0,0,0,0,0,0,0,0,0,0,0,0,0,510,0,0,31,0,0,0,0,5,0,0,0,0,0,1,0,0,0,0,0,3,0,0,1,0,0,2,1,0,0,171,0,0,0,0,52,7,0,15,0,11,0,0,0,0,0,0,24,0,0,1,0,0,0,0,18,0,0,0,0,0,0,0,17,0,0,0,0,0,0,0,5,0,0,13,0,1,0,0,0,0,8,0,0,29,0,5,0,0,0,0,0,1,0,0,0,0
"FIN_004_MZB_LO_127","FIN_004_MZB_LO_127-05.10.2016","05.10.2016",2016,10,5,0,0,0,0,0,0,0,0,14,0,0,383,0,0,0,0,0,0,0,0,0,0,0,50,0,0,0,0,0,0,0,1,0,0,0,0,1,0,0,0,0,0,0,21,0,2,0,0,0,0,0,5,0,0,0,0,0,0,0,0,0,0,0,4,0,2,3,0,0,1,0,0,0,65,0,0,0,370,20,3,0,20,0,21,0,0,0,0,0,0,4,0,0,0,0,0,0,0,2,0,0,0,0,0,0,0,5,0,0,2,0,0,0,0,3,0,0,52,0,0,0,0,0,0,9,0,2,0,0,2,0,0,3,0,0,0,0,0,0,0
"FIN_004_MZB_LO_127","FIN_004_MZB_LO_127-01.11.2019","01.11.2019",2019,11,1,0,0,0,0,0,0,0,0,272,0,0,444,0,0,0,0,8,0,0,0,52,0,0,948,0,0,0,0,0,0,0,0,0,0,0,0,0,0,0,0,0,0,0,228,0,36,0,0,0,0,0,12,0,0,0,0,0,0,0,0,0,0,0,0,0,0,12,0,0,0,0,0,0,80,0,0,0,496,4,8,0,56,4,44,0,0,0,0,0,0,24,1,0,8,0,0,0,0,84,0,0,0,0,20,0,0,72,0,0,16,0,0,0,0,0,0,0,180,0,0,0,0,0,0,1124,0,0,32,0,0,0,0,4,0,0,84,0,0,0,4
"FIN_004_MZB_LO_128","FIN_004_MZB_LO_128-28.10.2007","28.10.2007",2007,10,28,0,0,0,0,0,0,0,0,1,0,0,56,0,0,0,0,53,2,0,0,10,0,0,117,16,0,0,0,0,0,0,0,0,0,0,0,7,0,0,0,0,0,0,99,0,0,0,125,0,0,0,0,0,0,0,0,0,10,0,8,0,0,0,0,0,0,62,0,0,69,1,0,0,57,3,0,0,17,14,11,39,4,0,17,0,0,0,0,35,0,0,0,0,45,0,0,0,0,30,0,0,18,0,0,0,0,14,0,0,2,0,0,0,4,15,0,0,6,0,0,4,0,0,0,52,0,0,83,0,42,0,0,0,0,0,0,0,0,0,0
"FIN_004_MZB_LO_128","FIN_004_MZB_LO_128-05.09.2010","05.09.2010",2010,9,5,0,0,0,0,0,0,0,0,0,0,0,127,0,0,0,0,21,1,1,0,18,0,0,389,18,0,0,0,0,0,0,0,0,0,0,0,24,0,0,0,0,0,0,373,0,0,0,93,0,0,0,0,0,0,0,0,0,51,0,7,0,0,0,0,0,0,111,0,0,73,1,0,0,1239,35,0,0,45,165,0,76,1,2,24,0,0,0,0,14,0,0,4,0,6,0,0,0,0,271,0,0,23,0,0,0,0,30,0,0,0,0,0,0,0,87,0,0,2,0,0,0,2,0,0,20,0,0,328,0,240,0,0,0,0,0,0,0,0,0,0
"FIN_004_MZB_LO_128","FIN_004_MZB_LO_128-08.10.2013","08.10.2013",2013,10,8,0,0,0,0,0,0,0,0,0,0,0,64,0,0,0,0,6,0,3,0,3,0,0,643,12,0,0,0,0,0,0,0,0,0,0,0,0,0,0,0,0,0,0,19,0,0,0,119,0,0,0,0,0,0,0,0,0,0,0,0,0,0,0,0,0,0,18,0,0,7,0,0,0,175,120,0,0,9,5,1,14,5,0,0,0,0,0,0,0,0,0,0,0,8,0,0,0,0,12,0,0,29,0,0,0,0,0,0,0,0,0,0,0,0,0,0,0,11,0,0,0,0,0,0,1480,0,0,15,0,83,0,0,0,0,0,0,0,0,0,0
"FIN_004_MZB_LO_128","FIN_004_MZB_LO_128-26.09.2016","26.09.2016",2016,9,26,0,0,0,0,0,0,0,0,0,0,0,11,0,0,0,0,0,0,0,0,23,0,0,84,10,0,0,0,0,0,0,0,0,0,0,0,11,0,0,0,0,0,0,30,0,0,50,253,0,0,0,0,0,0,0,0,0,31,0,0,0,0,0,0,0,0,14,0,0,1,0,0,0,368,14,0,0,0,4,0,26,0,1,0,0,0,0,0,0,0,0,0,0,14,0,0,0,0,14,0,0,92,0,0,0,0,3,0,0,0,0,0,0,0,0,0,0,23,0,0,0,6,0,0,120,0,0,33,0,168,0,0,0,0,0,0,0,0,0,0
"FIN_004_MZB_LO_128","FIN_004_MZB_LO_128-11.09.2019","11.09.2019",2019,9,11,0,0,0,0,0,1,0,0,2,0,0,155,0,0,0,0,75,0,0,0,0,0,0,47,6,0,0,0,0,0,0,3,0,0,0,0,2,1,0,0,0,0,0,53,0,0,0,142,0,0,0,0,0,0,0,0,0,1,0,4,0,0,0,0,0,0,59,0,0,0,0,0,0,233,25,0,0,7,42,1,21,0,1,24,0,0,0,0,4,0,0,0,0,23,0,0,0,0,7,0,0,10,0,0,0,0,33,0,0,0,0,0,0,0,3,0,0,9,0,0,0,12,0,1,10,0,0,276,0,322,0,0,0,0,0,0,2,0,0,0
"FIN_004_MZB_LO_129","FIN_004_MZB_LO_129-28.10.2007","28.10.2007",2007,10,28,0,0,0,0,0,0,0,0,24,0,0,153,0,0,0,0,4,1,0,0,4,0,0,95,1,0,0,0,0,0,0,2,0,0,0,0,0,0,0,0,0,0,0,100,0,0,0,29,0,0,0,5,0,0,0,0,3,2,1,0,0,0,0,0,0,0,29,0,0,34,0,0,0,72,2,0,0,28,12,12,25,5,1,3,0,0,0,0,77,0,0,0,0,7,0,0,0,0,19,0,0,3,0,0,0,0,36,0,0,13,0,0,0,0,1,0,0,13,0,0,0,0,0,0,39,0,0,141,0,28,0,0,0,0,0,0,0,0,0,0
"FIN_004_MZB_LO_129","FIN_004_MZB_LO_129-05.09.2010","05.09.2010",2010,9,5,0,0,0,0,0,0,0,0,90,0,0,542,0,0,0,2,23,6,1,0,0,0,0,23,4,0,0,0,0,0,0,0,0,0,0,0,0,0,0,0,0,0,0,303,0,4,0,51,0,0,0,2,0,0,0,0,18,4,0,2,0,0,0,0,0,0,155,0,0,20,0,0,0,377,314,0,0,229,89,4,2,0,0,15,0,0,0,0,236,0,0,0,0,2,0,0,0,0,30,0,0,21,0,0,0,2,13,0,0,0,0,0,0,0,0,0,0,5,0,0,0,2,0,0,22,0,0,605,0,114,0,0,0,0,0,0,0,0,0,0
"FIN_004_MZB_LO_129","FIN_004_MZB_LO_129-05.11.2013","05.11.2013",2013,11,5,0,0,0,0,0,0,0,0,12,0,0,97,0,0,0,0,3,0,14,0,6,0,0,72,2,0,0,0,0,0,0,0,0,0,0,0,0,0,0,0,0,0,0,25,0,0,1,4,0,0,0,0,0,0,0,0,0,0,0,0,0,0,0,0,0,0,26,0,0,0,0,0,0,0,1,0,0,2,0,28,0,2,1,0,0,0,0,0,0,0,0,0,0,2,0,0,0,0,77,0,0,0,0,0,0,0,1,0,0,5,0,0,0,0,0,0,0,0,0,0,0,0,0,0,141,0,0,8,0,5,0,0,0,0,0,1,0,0,0,0
"FIN_004_MZB_LO_129","FIN_004_MZB_LO_129-19.10.2016","19.10.2016",2016,10,19,0,0,0,0,0,0,0,0,25,0,0,376,0,0,0,0,2,2,35,0,9,0,0,127,3,0,0,0,0,0,0,0,0,0,0,0,0,0,0,0,0,0,0,40,0,2,0,207,0,0,0,2,0,0,0,0,1,3,0,0,0,0,0,0,0,0,39,0,0,1,0,0,0,79,44,0,0,17,4,1,0,0,0,1,0,0,0,0,9,0,0,0,0,0,0,0,0,0,12,0,0,49,0,0,0,0,3,0,0,3,0,0,0,2,0,0,0,22,0,0,1,0,0,0,525,0,0,9,0,44,0,0,0,0,0,0,0,0,0,0
"FIN_004_MZB_LO_129","FIN_004_MZB_LO_129-12.09.2019","12.09.2019",2019,9,12,0,0,0,0,0,0,0,0,30,0,0,201,0,0,0,0,6,0,1,0,0,0,0,70,0,0,0,0,0,0,0,0,0,0,0,0,0,0,0,0,0,0,0,99,0,0,2,26,0,0,0,2,0,0,0,0,4,2,0,1,0,0,0,0,0,0,33,0,0,1,0,0,0,357,44,0,0,7,3,13,0,0,0,4,0,0,0,0,26,0,6,0,0,1,0,0,0,0,21,0,0,8,0,0,0,0,1,0,0,1,0,0,0,0,0,0,0,31,0,0,0,1,0,0,11,0,0,192,0,71,0,0,3,0,0,0,0,0,0,0
"FIN_004_MZB_LO_13","FIN_004_MZB_LO_13-28.09.2009","28.09.2009",2009,9,28,0,0,0,0,0,0,0,0,0,0,0,329,0,0,0,0,0,2,0,0,17,0,0,312,0,0,0,0,0,2,2,0,0,0,0,0,0,0,0,0,0,0,0,49,0,2,0,0,0,0,0,5,0,0,0,0,1,0,0,0,0,0,0,0,0,0,63,0,0,2,0,0,0,93,208,0,0,6,6,575,10,1,0,0,0,0,0,0,118,0,0,0,0,35,0,0,0,0,2,0,0,77,0,0,0,0,0,0,0,204,0,0,0,0,0,0,0,3,0,0,0,0,0,0,35,0,0,70,0,64,0,0,0,0,0,0,0,0,0,0
"FIN_004_MZB_LO_13","FIN_004_MZB_LO_13-10.09.2013","10.09.2013",2013,9,10,0,0,0,0,4,0,0,0,0,0,0,767,0,0,0,0,0,10,0,0,2,0,0,275,0,0,0,0,0,0,2,0,0,0,0,0,0,0,0,0,0,0,0,41,0,1,0,3,0,0,0,14,0,0,0,0,1,1,0,0,0,0,0,0,0,0,212,0,0,4,0,0,0,97,546,0,0,307,71,446,9,0,0,0,0,0,0,0,34,0,1,1,0,59,0,0,0,0,7,0,0,185,0,0,0,0,34,0,0,139,0,0,0,0,1,0,0,30,0,0,0,0,0,0,35,0,0,332,0,103,0,0,4,0,0,1,0,0,0,0
"FIN_004_MZB_LO_13","FIN_004_MZB_LO_13-29.09.2015","29.09.2015",2015,9,29,0,0,0,0,0,0,0,0,0,0,0,87,0,0,0,0,0,0,0,0,0,0,0,6,0,0,0,0,0,0,0,0,0,0,0,0,0,0,0,0,0,0,0,51,0,4,0,5,0,0,0,2,0,0,0,0,3,0,0,0,0,0,0,0,0,0,24,0,0,0,0,0,0,77,41,0,0,6,1,74,17,0,0,0,0,0,0,0,130,0,0,0,0,82,0,0,0,0,0,0,0,55,0,0,0,0,0,0,0,14,0,0,0,0,0,0,0,6,0,0,0,0,0,0,33,0,0,34,0,94,0,0,0,0,0,2,0,0,0,0
"FIN_004_MZB_LO_13","FIN_004_MZB_LO_13-26.10.2016","26.10.2016",2016,10,26,0,0,0,0,0,0,0,0,0,0,0,163,0,0,0,0,0,0,0,0,0,0,0,71,0,0,0,0,0,0,0,0,0,0,0,0,0,0,0,0,0,0,0,76,0,12,0,0,0,0,0,0,0,0,0,0,0,0,0,0,0,0,0,0,0,0,32,0,0,0,0,0,0,266,0,0,0,3,1,13,17,0,0,0,0,0,0,0,3,0,0,0,0,137,0,0,0,0,0,0,0,203,0,0,0,0,0,0,0,7,0,0,0,0,0,0,0,14,0,0,0,0,0,0,181,0,0,14,0,51,0,0,0,0,0,0,0,0,0,0
"FIN_004_MZB_LO_13","FIN_004_MZB_LO_13-19.09.2017","19.09.2017",2017,9,19,0,0,0,0,0,0,0,0,0,0,0,16,0,0,0,0,0,0,0,0,0,0,0,13,0,0,0,0,0,0,0,0,0,0,0,0,0,0,0,0,0,0,0,31,0,1,0,0,0,0,0,3,0,0,0,0,0,0,0,0,0,0,0,0,0,0,45,0,0,0,0,0,0,180,0,0,0,3,1,16,39,1,0,0,0,0,0,0,10,0,0,0,0,109,0,0,0,0,0,0,0,31,0,0,0,0,1,0,0,24,0,0,0,0,0,0,0,11,0,0,0,0,1,0,11,0,0,654,0,79,0,0,0,0,0,0,0,0,0,0
"FIN_004_MZB_LO_13","FIN_004_MZB_LO_13-19.09.2018","19.09.2018",2018,9,19,0,0,0,0,0,0,0,0,0,0,0,18,0,0,0,0,0,0,0,0,0,0,0,19,0,0,0,0,0,0,0,0,0,0,0,0,0,0,0,0,0,0,0,56,0,0,0,0,0,0,0,0,0,0,0,0,0,0,0,0,0,0,0,0,0,0,57,0,0,0,0,0,0,223,1,0,0,4,6,83,10,0,0,0,0,0,0,0,13,0,0,0,0,83,0,0,0,0,0,0,0,59,0,0,0,0,0,0,0,22,0,0,0,0,1,0,0,20,0,0,0,0,0,0,42,0,0,35,0,37,0,0,0,0,0,0,0,0,0,0
"FIN_004_MZB_LO_13","FIN_004_MZB_LO_13-23.10.2019","23.10.2019",2019,10,23,0,0,0,0,0,0,0,0,0,0,0,90,0,0,0,0,0,4,0,0,17,0,0,1489,0,0,0,0,0,0,13,0,0,0,0,0,1,0,0,0,0,0,0,65,0,2,0,0,0,0,0,1,0,0,0,0,0,0,0,0,0,0,0,0,0,0,48,0,0,4,0,0,0,17,7,0,0,11,3,524,13,45,0,0,0,0,0,0,47,0,1,0,0,100,0,0,0,0,21,0,0,40,1,0,0,0,0,0,0,24,0,0,0,0,0,0,0,1,0,0,0,0,0,0,6,0,0,94,0,18,0,0,5,0,0,1,0,0,0,1
"FIN_004_MZB_LO_13","FIN_004_MZB_LO_13-10.11.2020","10.11.2020",2020,11,10,0,0,0,0,0,0,0,0,0,0,0,93,0,0,0,0,1,0,0,0,0,0,0,119,0,0,0,0,0,0,0,0,0,0,0,0,0,0,0,0,0,0,0,138,0,7,0,0,0,0,0,0,0,0,0,0,0,0,0,0,0,0,0,0,0,0,52,0,0,1,0,0,0,222,2,0,0,2,3,19,10,11,0,0,0,0,0,0,18,0,4,0,0,127,0,0,0,0,3,0,0,141,0,0,0,0,7,0,0,8,0,0,0,0,0,0,0,11,0,0,0,0,0,0,83,0,0,145,0,10,0,0,0,0,0,0,0,0,0,0
"FIN_004_MZB_LO_130","FIN_004_MZB_LO_130-28.10.2007","28.10.2007",2007,10,28,0,0,0,0,0,0,0,0,57,0,0,254,0,0,0,0,17,0,0,0,13,0,0,521,0,0,0,0,0,0,0,0,0,0,0,0,0,0,0,0,0,0,0,107,0,0,0,107,0,0,0,3,0,0,0,0,2,9,0,0,0,0,0,0,0,0,18,0,0,19,0,0,0,158,0,0,0,36,22,48,8,3,0,11,0,0,0,0,71,0,2,0,0,10,0,0,0,0,17,0,0,1,0,0,0,0,6,1,0,102,0,0,0,1,0,0,0,23,0,0,0,0,0,0,145,0,0,242,0,26,0,0,2,0,0,0,0,4,0,0
"FIN_004_MZB_LO_130","FIN_004_MZB_LO_130-05.09.2010","05.09.2010",2010,9,5,0,0,0,0,0,0,0,0,5,0,0,294,0,0,4,0,10,1,0,0,5,0,0,169,0,0,0,0,0,0,0,0,0,0,0,0,0,0,0,0,0,0,0,85,0,0,0,280,0,0,0,1,0,0,0,0,0,18,0,2,0,0,0,0,0,0,30,0,0,10,0,0,0,1426,19,0,0,28,50,1,12,0,0,0,0,0,0,0,34,0,1,2,0,7,0,0,0,0,102,0,0,9,0,0,0,0,3,0,0,59,0,0,0,0,17,0,0,12,0,0,0,15,0,0,7,0,6,512,0,37,0,0,0,0,0,0,0,0,0,0
"FIN_004_MZB_LO_130","FIN_004_MZB_LO_130-21.10.2013","21.10.2013",2013,10,21,0,0,0,0,0,0,0,0,1,0,0,74,0,0,0,0,2,0,17,0,11,0,0,676,0,0,0,0,0,0,0,0,0,0,0,0,8,0,0,0,0,0,0,14,0,0,0,41,0,0,0,2,0,0,0,0,0,6,1,0,0,0,0,0,0,0,53,0,0,0,0,0,0,2064,0,0,0,9,0,0,11,0,0,0,0,0,0,0,4,0,1,0,0,5,0,0,0,0,30,0,0,24,0,0,0,0,0,0,0,25,0,0,0,0,5,0,0,24,0,0,0,0,0,0,20,0,0,170,0,7,0,0,0,0,0,0,0,0,0,0
"FIN_004_MZB_LO_130","FIN_004_MZB_LO_130-30.10.2016","30.10.2016",2016,10,30,0,0,0,0,0,0,0,0,7,0,0,83,0,0,0,0,0,0,3,0,8,0,0,276,0,0,0,0,0,0,0,1,0,0,0,0,0,0,0,0,0,0,0,9,0,0,0,31,0,0,0,0,0,0,0,0,0,1,0,0,0,0,0,0,0,0,32,0,0,0,0,0,0,371,6,0,0,1,1,18,11,9,0,0,0,0,0,0,0,0,0,0,0,29,0,0,0,0,11,0,0,7,0,0,0,0,1,0,0,48,0,0,0,0,2,0,0,18,0,0,0,0,0,0,92,0,0,38,0,13,0,0,0,0,0,0,0,0,0,0
"FIN_004_MZB_LO_130","FIN_004_MZB_LO_130-12.09.2019","12.09.2019",2019,9,12,0,0,0,0,0,0,0,0,5,0,0,37,0,0,0,0,49,0,2,0,6,0,0,728,0,0,0,0,0,0,0,0,0,0,0,0,0,0,0,0,0,4,0,19,0,0,0,233,0,0,0,1,0,0,0,0,1,0,0,2,0,0,0,0,0,0,38,0,0,0,1,0,0,308,3,0,0,4,36,9,3,0,0,2,0,0,0,0,19,0,0,0,0,12,0,0,0,0,35,0,0,7,0,0,0,0,0,0,0,38,0,0,0,0,0,0,0,33,0,0,0,7,0,0,8,0,0,184,0,50,0,0,0,0,0,0,0,0,0,0
"FIN_004_MZB_LO_131","FIN_004_MZB_LO_131-01.10.2008","01.10.2008",2008,10,1,0,0,0,0,0,0,0,0,0,0,0,0,0,0,0,0,0,0,0,0,0,0,0,3444,0,0,0,0,0,0,0,0,0,0,0,0,1,0,0,0,0,0,0,80,0,2,0,0,0,0,0,0,0,0,0,0,0,0,0,0,0,0,0,0,0,0,13,0,0,2,0,0,0,1,0,0,0,0,0,180,198,26,0,0,0,0,0,0,0,0,0,8,0,394,0,0,0,0,79,0,0,4,0,0,0,0,0,0,0,247,0,0,0,0,0,0,0,60,0,0,0,0,1,0,3260,0,0,0,0,62,0,0,0,0,0,0,0,0,0,0
"FIN_004_MZB_LO_131","FIN_004_MZB_LO_131-07.09.2010","07.09.2010",2010,9,7,0,0,0,0,0,0,0,0,0,0,0,0,0,0,0,0,0,0,0,0,0,0,0,186,0,0,0,0,0,0,4,0,0,0,0,0,0,0,0,0,0,0,0,7,0,0,0,0,0,0,0,0,0,0,0,0,0,0,0,0,0,0,0,0,0,0,0,0,0,0,0,0,0,0,0,0,0,1,1,1,1,0,0,0,0,0,0,0,0,0,0,0,0,6,0,0,0,0,67,0,0,0,0,0,0,0,0,0,0,50,0,0,0,0,0,0,0,0,0,0,0,0,5,0,56,0,0,0,0,1,0,0,0,0,0,0,0,0,0,0
"FIN_004_MZB_LO_131","FIN_004_MZB_LO_131-09.09.2012","09.09.2012",2012,9,9,0,0,0,0,0,0,0,0,0,0,0,0,0,0,0,0,0,0,0,0,0,0,0,12,0,0,0,0,0,0,0,0,0,0,0,0,0,0,0,0,0,0,0,1,0,0,0,0,0,0,0,0,0,0,0,0,0,0,0,0,0,0,0,0,0,0,1,0,0,0,0,0,0,1,0,0,0,0,0,1,54,2,0,0,0,0,0,0,0,0,0,1,0,26,0,0,0,0,12,0,0,3,0,0,0,0,0,0,0,37,0,0,0,0,0,0,0,4,0,0,0,0,1,0,1,0,0,0,0,44,0,0,0,0,0,0,0,0,0,0
"FIN_004_MZB_LO_131","FIN_004_MZB_LO_131-02.09.2013","02.09.2013",2013,9,2,0,0,0,0,0,0,0,0,0,0,0,0,0,0,0,0,0,0,0,0,0,0,0,52,0,0,0,0,0,0,0,0,0,0,0,0,0,0,0,0,0,0,0,5,0,0,0,0,0,0,0,0,0,0,0,0,0,0,0,0,0,0,0,0,0,0,1,0,0,0,0,0,0,15,0,0,0,3,1,0,2,3,0,0,0,0,0,0,0,0,0,0,0,18,0,0,0,0,18,0,0,4,0,0,0,0,0,0,0,9,0,0,0,0,1,0,0,6,0,0,0,0,2,0,110,0,0,4,0,6,0,0,0,0,0,0,0,0,0,0
"FIN_004_MZB_LO_131","FIN_004_MZB_LO_131-09.09.2015","09.09.2015",2015,9,9,0,0,0,0,0,0,0,0,1,0,0,0,0,0,0,0,0,0,0,0,0,0,0,12,0,0,0,0,0,0,0,1,0,0,0,0,0,0,0,0,0,0,0,24,0,0,0,0,0,0,4,0,0,0,0,0,0,0,0,0,0,0,0,0,0,0,1,0,0,0,0,0,0,82,11,0,0,0,0,1,19,1,0,0,0,0,0,0,0,0,0,0,0,143,0,0,0,0,12,0,0,8,0,0,0,0,0,0,0,56,0,0,0,0,0,0,0,8,0,0,0,0,0,0,2,0,0,12,0,160,0,0,0,0,0,0,0,0,0,0
"FIN_004_MZB_LO_131","FIN_004_MZB_LO_131-07.10.2018","07.10.2018",2018,10,7,0,0,0,0,0,0,0,0,5,0,0,7,0,0,0,0,0,0,0,0,0,0,0,34,0,0,0,0,0,0,1,0,0,0,0,0,1,0,0,0,0,0,0,16,0,0,0,0,0,0,0,0,0,0,0,0,0,0,0,0,0,0,0,0,0,0,8,0,0,0,0,0,0,21,9,0,0,6,0,115,59,3,0,0,0,0,0,0,0,0,0,0,0,24,0,0,0,0,2,0,0,22,0,0,0,0,0,0,0,49,0,0,0,0,1,0,0,10,0,0,0,0,5,0,27,0,0,5,0,53,0,0,0,0,0,0,0,0,0,0
"FIN_004_MZB_LO_131","FIN_004_MZB_LO_131-15.09.2021","15.09.2021",2021,9,15,0,0,0,0,0,0,0,0,4,0,0,8,0,0,0,0,0,0,0,0,32,0,0,232,0,0,0,0,0,0,0,0,0,0,0,0,0,0,0,0,0,0,0,44,0,0,0,0,0,0,0,0,0,0,0,0,0,0,0,0,0,0,0,0,0,0,0,0,0,0,0,0,0,119,0,0,0,4,4,152,448,8,0,0,0,0,0,0,0,0,4,0,0,54,0,0,0,0,22,0,0,34,4,0,0,0,0,0,0,220,0,0,0,0,0,0,0,16,0,0,0,0,8,0,18,0,0,98,0,28,0,0,2,0,0,0,0,0,0,0
"FIN_004_MZB_LO_132","FIN_004_MZB_LO_132-30.09.2008","30.09.2008",2008,9,30,0,0,0,0,0,0,0,0,0,0,0,0,0,0,0,0,0,0,0,0,0,0,0,459,0,0,0,0,0,0,0,0,0,0,0,0,0,0,0,0,0,0,0,4,0,0,0,0,0,0,0,0,0,0,0,0,0,0,0,0,0,0,0,0,0,0,0,0,0,2,0,0,0,0,0,0,0,0,0,13,0,4,0,0,0,0,0,0,0,0,0,0,0,371,0,0,0,0,1,0,0,0,0,0,0,0,0,0,0,20,0,0,0,0,0,0,0,30,0,0,0,0,0,0,124,0,0,0,0,41,0,0,0,0,0,0,0,0,0,0
"FIN_004_MZB_LO_132","FIN_004_MZB_LO_132-08.09.2010","08.09.2010",2010,9,8,0,0,0,0,0,0,0,0,4,0,0,0,0,0,0,0,0,0,0,0,0,0,0,45,0,0,0,0,0,0,0,0,0,0,0,0,0,0,0,0,0,0,0,6,0,0,0,0,0,0,0,0,0,0,0,0,0,0,0,0,0,0,0,0,0,0,0,0,0,0,0,0,0,1,0,0,0,0,0,0,0,2,0,0,0,0,0,0,0,0,3,0,0,3,0,0,0,0,0,0,0,10,0,0,0,0,0,0,0,63,0,0,0,0,0,0,0,2,0,0,0,0,0,0,3,0,0,0,0,452,0,0,18,0,0,0,0,0,0,0
"FIN_004_MZB_LO_132","FIN_004_MZB_LO_132-13.09.2012","13.09.2012",2012,9,13,0,0,0,0,0,0,0,0,12,0,0,0,0,0,0,0,0,0,0,0,0,0,0,10,0,0,0,0,0,0,0,0,0,0,0,0,1,0,0,0,0,0,0,1,0,0,0,0,0,0,0,0,0,0,0,0,0,0,0,0,0,0,0,0,0,0,0,0,0,0,0,0,0,8,0,0,0,0,0,0,0,2,0,0,0,0,0,0,0,0,0,0,0,2,0,0,0,0,2,0,0,2,0,0,0,0,0,0,0,35,0,0,0,0,0,0,0,5,0,0,0,0,0,0,2,0,0,6,0,153,0,0,0,0,0,0,0,0,0,0
"FIN_004_MZB_LO_132","FIN_004_MZB_LO_132-02.09.2013","02.09.2013",2013,9,2,0,0,0,0,0,0,0,0,282,0,0,1,0,0,0,0,0,2,0,0,1,0,0,69,0,0,0,0,0,0,0,0,0,0,0,0,3,0,0,0,0,0,0,56,0,1,0,0,0,0,0,0,0,0,0,0,0,0,0,0,0,0,0,0,0,0,0,0,0,0,0,0,0,56,2,0,0,1,0,3,3,1,0,0,0,0,0,0,0,0,1,0,0,6,0,0,0,0,29,0,0,3,0,0,0,0,0,0,0,81,0,0,0,0,0,0,0,3,0,0,0,0,10,0,38,0,0,716,0,95,0,0,15,0,0,0,0,0,0,0
"FIN_004_MZB_LO_132","FIN_004_MZB_LO_132-09.09.2015","09.09.2015",2015,9,9,0,0,0,0,0,0,0,0,60,0,0,14,0,0,0,0,0,0,5,0,0,0,0,27,0,0,0,0,0,0,0,0,0,0,0,0,1,0,0,0,0,0,0,5,0,0,0,0,0,0,0,0,0,0,0,0,0,0,0,0,0,0,0,0,0,0,1,0,0,0,0,0,0,15,0,0,0,0,0,2,12,2,0,0,0,0,0,0,0,0,0,0,0,78,0,0,0,0,11,0,0,6,0,0,0,0,0,0,0,89,0,0,0,0,0,0,0,41,0,0,0,0,0,0,23,0,0,1276,0,826,0,0,0,0,0,0,0,0,0,0
"FIN_004_MZB_LO_132","FIN_004_MZB_LO_132-08.10.2018","08.10.2018",2018,10,8,0,0,0,0,0,0,0,0,27,0,0,1,0,0,0,0,0,0,0,0,2,0,0,216,0,0,0,0,0,0,0,0,0,0,0,0,0,0,0,0,0,0,0,5,0,0,0,0,0,0,0,0,0,0,0,0,1,0,0,0,0,0,0,0,0,0,2,0,0,0,0,0,0,8,0,0,0,0,0,98,85,5,0,0,0,0,0,0,0,0,2,0,0,15,0,0,0,0,0,0,0,24,1,0,0,0,0,0,0,100,0,0,0,0,0,0,0,8,0,0,0,0,4,0,151,0,0,60,0,41,0,0,0,0,0,0,0,0,0,0
"FIN_004_MZB_LO_132","FIN_004_MZB_LO_132-20.09.2021","20.09.2021",2021,9,20,0,0,0,0,0,0,0,0,21,0,0,0,0,0,0,0,0,0,0,0,114,0,0,210,0,0,0,0,0,0,6,0,0,0,0,0,0,0,0,0,0,0,0,0,0,0,0,0,0,0,0,0,0,0,0,0,15,0,0,0,0,0,0,0,0,0,9,0,0,0,0,0,0,42,0,0,0,0,0,226,2,8,0,0,0,0,0,0,0,0,0,0,0,23,0,0,0,0,27,0,0,3,0,0,0,0,0,0,0,8,0,0,0,0,0,0,0,3,0,0,0,0,1,0,78,0,0,128,0,64,0,0,6,0,0,0,0,0,0,0
"FIN_004_MZB_LO_133","FIN_004_MZB_LO_133-30.09.2008","30.09.2008",2008,9,30,0,0,0,0,0,0,0,0,0,0,0,61,0,0,0,0,0,0,4,0,6,0,0,443,1,0,0,0,0,1,0,0,0,0,0,0,4,0,0,0,0,0,0,57,0,11,0,0,0,0,0,0,0,0,0,0,0,0,0,0,0,0,0,0,0,0,54,0,0,49,10,0,0,8,2,0,0,0,0,83,377,0,0,0,0,0,0,0,1,0,0,7,0,228,0,0,0,0,82,0,0,9,0,0,0,0,0,0,0,80,0,0,0,0,0,0,0,39,0,0,0,0,0,0,313,0,0,4,0,61,0,0,0,0,0,0,0,0,0,0
"FIN_004_MZB_LO_133","FIN_004_MZB_LO_133-07.09.2010","07.09.2010",2010,9,7,0,0,0,0,0,0,0,0,0,0,0,58,0,0,0,0,0,0,0,0,2,0,0,179,0,0,0,0,0,0,0,0,0,0,0,0,0,0,0,0,0,0,0,130,0,1,0,0,0,0,0,0,0,0,0,0,0,0,0,0,0,0,0,0,0,0,41,0,0,2,6,0,0,172,0,0,0,26,3,180,35,0,0,0,0,0,0,0,0,0,0,3,0,77,0,0,0,0,28,0,0,9,0,0,0,0,0,0,0,335,0,0,0,0,0,0,0,25,0,0,0,0,1,0,30,0,0,0,0,100,0,0,0,0,0,0,0,0,0,0
"FIN_004_MZB_LO_133","FIN_004_MZB_LO_133-11.09.2012","11.09.2012",2012,9,11,0,0,0,0,0,0,0,0,1,0,0,1,0,0,0,0,0,0,0,0,0,0,0,27,0,0,0,0,0,0,0,0,0,0,0,0,0,0,0,0,0,0,0,17,0,1,0,0,0,0,0,0,0,0,0,0,0,0,0,0,0,0,0,0,0,0,92,0,0,0,0,0,0,79,0,0,0,1,0,26,29,1,0,0,0,0,0,0,0,0,0,0,0,86,0,0,0,0,10,0,0,1,0,0,0,0,0,0,0,20,0,0,0,0,1,0,0,5,0,2,0,0,0,0,35,0,0,2,0,58,0,0,0,0,0,0,0,0,0,0
"FIN_004_MZB_LO_133","FIN_004_MZB_LO_133-02.09.2013","02.09.2013",2013,9,2,0,0,0,0,0,0,0,0,8,0,0,159,0,0,0,0,0,1,1,0,0,0,0,84,2,0,0,0,0,0,0,0,0,0,0,0,0,0,0,0,0,0,0,26,0,0,0,0,0,0,0,0,0,0,0,0,0,0,0,0,0,0,0,0,0,0,192,0,0,6,0,0,0,28,8,0,0,13,4,121,37,2,0,0,0,0,0,0,0,0,0,0,0,739,0,0,0,0,12,0,0,29,0,0,0,0,0,0,0,56,0,0,0,0,0,0,0,40,0,0,2,0,0,0,34,0,0,5,0,133,0,0,0,0,0,0,0,0,0,0
"FIN_004_MZB_LO_133","FIN_004_MZB_LO_133-09.09.2015","09.09.2015",2015,9,9,0,0,0,0,0,0,0,0,0,0,0,155,0,0,0,0,0,0,0,0,0,0,0,17,0,0,0,0,0,0,0,0,0,0,0,0,1,0,0,0,0,0,0,16,0,0,0,0,0,0,0,0,0,0,0,0,0,0,0,0,0,0,0,0,0,0,50,0,0,0,10,0,0,12,5,0,0,1,0,28,39,0,0,0,0,0,0,0,0,0,0,1,0,185,0,0,0,0,21,0,0,11,0,0,0,0,0,0,0,15,0,0,0,0,0,0,0,9,0,0,1,0,0,0,19,0,0,4,0,75,0,0,0,0,0,0,0,0,0,0
"FIN_004_MZB_LO_133","FIN_004_MZB_LO_133-07.10.2018","07.10.2018",2018,10,7,0,0,0,0,0,0,0,0,22,0,0,78,0,0,0,0,0,0,0,0,1,0,0,3,0,0,0,0,0,0,0,0,0,0,0,0,0,0,0,0,0,0,0,12,0,0,0,0,0,0,0,0,0,0,0,0,0,2,0,0,0,0,0,0,0,0,14,0,0,1,3,0,0,24,2,0,0,1,0,166,238,0,0,0,0,0,0,0,0,0,0,0,0,39,0,0,0,0,2,0,0,91,0,0,0,0,0,0,0,13,0,0,0,0,0,0,0,0,0,0,0,0,0,0,26,0,0,5,0,15,0,0,0,0,0,1,0,0,0,0
"FIN_004_MZB_LO_133","FIN_004_MZB_LO_133-13.09.2021","13.09.2021",2021,9,13,0,0,0,0,0,0,0,0,13,0,0,88,0,0,0,0,0,0,0,0,45,0,0,110,1,0,0,0,0,0,0,0,0,0,0,0,0,0,0,0,0,0,0,128,0,0,2,0,0,0,0,0,0,0,0,0,0,0,0,0,0,0,0,1,0,0,52,0,0,0,14,0,0,117,3,0,0,4,0,428,315,7,0,0,0,0,0,0,0,0,0,3,0,5,0,0,0,0,50,0,0,31,1,0,0,0,0,0,0,48,0,0,0,0,0,0,0,0,0,0,0,2,3,0,12,0,0,91,0,32,0,0,0,0,0,0,0,0,0,0
"FIN_004_MZB_LO_136","FIN_004_MZB_LO_136-01.09.2008","01.09.2008",2008,9,1,0,0,0,0,0,0,0,0,4,0,0,9,0,0,0,1,2,0,0,0,0,0,0,38,0,0,0,0,0,0,0,0,0,0,0,0,0,0,0,0,0,0,0,27,0,0,0,0,0,0,0,0,0,0,0,0,0,0,0,0,0,0,0,0,0,0,6,0,0,2,0,0,0,65,0,0,0,0,0,0,1,0,0,0,0,0,0,0,0,0,0,0,0,0,0,0,0,0,6,0,0,16,0,0,0,0,5,0,0,4,0,0,0,1,0,0,0,32,0,0,0,21,0,0,27,0,0,2,0,216,0,0,0,0,0,0,0,0,0,0
"FIN_004_MZB_LO_136","FIN_004_MZB_LO_136-18.09.2011","18.09.2011",2011,9,18,0,0,0,0,0,0,0,0,22,0,0,6,0,0,0,26,41,0,0,0,15,0,0,66,2,0,0,0,0,0,0,0,0,0,0,0,0,0,0,0,0,0,0,51,0,0,0,13,0,0,0,1,0,0,0,0,0,1,0,0,0,0,0,1,0,0,42,0,0,5,0,0,0,17,0,0,0,54,40,4,2,0,0,3,0,0,0,0,6,0,0,0,0,0,0,0,0,0,83,0,0,4,1,0,0,0,1,0,0,4,0,0,0,0,8,0,0,0,0,0,0,0,0,0,0,0,0,177,0,5,0,0,0,0,0,0,1,0,0,0
"FIN_004_MZB_LO_136","FIN_004_MZB_LO_136-24.11.2014","24.11.2014",2014,11,24,0,0,0,0,0,0,0,0,14,0,0,4,0,0,0,0,1,0,29,0,4,3,0,30,1,0,0,0,0,0,0,0,0,0,0,0,2,0,0,0,0,0,0,11,0,0,0,39,0,0,0,9,0,0,0,0,0,0,0,0,0,0,0,0,0,0,18,0,0,0,0,0,0,10,0,0,0,13,0,1,0,2,0,0,0,0,0,0,0,0,0,0,0,2,0,0,0,0,22,0,0,4,0,0,0,0,2,0,0,1,0,0,0,0,3,0,0,0,0,0,0,0,0,0,1,0,0,8,0,5,0,0,0,0,0,0,1,0,0,0
"FIN_004_MZB_LO_136","FIN_004_MZB_LO_136-04.10.2017","04.10.2017",2017,10,4,0,0,0,0,0,0,0,0,3,0,0,26,0,0,0,0,0,0,6,0,0,0,0,14,2,0,0,0,0,0,0,0,0,0,0,0,31,0,0,0,0,0,0,48,0,0,0,11,0,0,0,0,0,0,0,0,0,21,0,0,0,0,0,0,0,0,27,0,0,1,0,0,0,69,0,0,0,5,1,0,16,1,0,0,0,0,0,0,0,0,0,0,0,9,0,0,0,0,3,0,0,10,0,0,0,0,1,0,0,1,0,0,0,1,1,0,0,50,0,0,0,1,0,0,17,0,0,16,0,11,0,0,0,0,0,0,0,0,0,0
"FIN_004_MZB_LO_136","FIN_004_MZB_LO_136-02.09.2020","02.09.2020",2020,9,2,0,0,0,0,0,0,0,0,21,0,0,44,0,0,0,0,2,0,0,0,0,0,0,11,1,0,0,0,0,0,0,0,0,0,0,0,0,0,0,0,0,0,0,69,0,0,1,2,0,0,0,2,0,0,0,0,0,0,0,0,0,0,0,0,0,0,39,0,0,2,1,0,0,92,0,0,0,1,3,2,2,0,0,1,0,0,0,0,9,0,0,0,0,0,0,0,0,0,19,0,0,1,0,0,0,0,5,0,0,33,0,0,0,0,1,0,0,5,0,0,0,1,0,0,5,0,0,10,0,1,0,0,0,0,0,0,0,0,0,0
"FIN_004_MZB_LO_137","FIN_004_MZB_LO_137-31.08.2008","31.08.2008",2008,8,31,0,0,0,0,0,0,0,0,30,0,0,13,0,0,0,0,0,0,0,0,3,0,0,12,0,0,0,0,0,0,1,0,0,0,0,0,0,0,0,0,0,0,0,9,0,0,0,0,0,0,0,1,0,0,0,0,0,0,0,1,0,0,0,0,0,0,9,0,0,0,0,0,0,34,0,0,0,0,1,0,4,0,0,0,0,0,0,0,0,0,0,0,0,0,0,0,0,0,12,0,0,5,0,0,0,0,0,0,0,16,0,0,0,0,0,0,0,58,0,0,0,0,0,0,123,0,0,0,0,60,0,0,0,0,0,0,0,0,0,0
"FIN_004_MZB_LO_137","FIN_004_MZB_LO_137-19.10.2011","19.10.2011",2011,10,19,0,0,0,0,0,0,0,0,27,0,0,23,0,0,0,0,0,0,0,0,16,0,0,16,0,0,0,0,0,0,0,0,0,0,0,0,0,0,0,0,0,0,0,39,0,0,4,7,0,0,0,3,0,0,0,0,0,2,0,0,0,0,0,0,0,0,135,0,0,0,0,0,0,37,0,0,0,29,9,0,0,0,0,0,0,0,0,0,0,0,1,0,0,10,0,0,0,0,41,0,0,8,0,0,0,0,0,0,0,4,0,0,0,0,0,0,0,5,0,0,0,0,0,0,1,0,0,19,0,0,0,0,0,0,0,1,0,0,0,0
"FIN_004_MZB_LO_137","FIN_004_MZB_LO_137-28.10.2014","28.10.2014",2014,10,28,0,0,0,0,0,0,0,0,17,0,0,10,0,0,0,0,0,0,5,0,2,0,0,38,0,0,0,0,0,0,0,2,0,0,0,0,0,0,0,0,0,0,0,2,0,0,0,6,0,0,0,3,0,0,0,0,0,0,0,0,0,0,0,0,0,0,24,0,0,0,0,0,0,2,0,0,0,5,4,5,0,12,4,0,0,0,0,0,0,0,0,0,0,0,0,0,0,0,63,0,0,1,0,0,0,0,1,0,0,1,0,0,0,0,0,0,0,0,0,0,0,0,0,0,0,0,0,9,0,1,0,0,1,0,0,0,0,0,0,0
"FIN_004_MZB_LO_137","FIN_004_MZB_LO_137-26.09.2017","26.09.2017",2017,9,26,0,0,0,0,0,0,0,0,64,0,0,32,0,0,0,1,1,0,1,0,0,0,0,31,0,0,0,0,0,0,0,1,0,0,0,0,0,0,0,0,0,0,0,9,0,0,0,37,0,0,0,0,0,0,0,0,0,0,0,0,0,0,0,0,0,0,11,0,0,3,0,0,0,29,0,0,0,4,3,1,0,4,0,0,0,0,0,0,0,0,0,0,0,4,0,0,0,0,10,0,0,2,0,0,0,0,0,0,0,5,0,0,0,0,0,0,0,4,0,0,0,5,0,0,35,0,0,0,0,10,0,0,0,0,0,0,0,0,0,0
"FIN_004_MZB_LO_137","FIN_004_MZB_LO_137-31.08.2020","31.08.2020",2020,8,31,0,0,0,0,0,0,0,0,2,0,0,55,0,0,0,0,3,0,0,0,0,0,0,5,0,0,0,0,0,0,0,0,0,0,0,0,0,0,0,0,0,0,0,1,0,0,0,3,0,0,0,0,0,0,0,0,0,0,0,0,0,0,0,0,0,0,64,0,0,0,0,0,0,36,0,0,0,0,0,0,0,0,0,0,0,0,0,0,0,0,0,0,0,0,0,0,0,0,0,0,0,3,0,0,0,0,0,0,0,3,0,0,0,0,0,0,0,8,0,0,0,0,0,0,1,0,0,0,0,3,0,0,0,0,0,0,0,0,0,0
"FIN_004_MZB_LO_138","FIN_004_MZB_LO_138-03.09.2008","03.09.2008",2008,9,3,0,0,0,0,0,0,0,0,45,0,0,76,0,0,0,0,0,0,0,0,15,0,0,83,0,0,0,0,0,0,0,0,0,0,0,0,4,0,0,0,0,0,0,3,0,32,0,0,0,0,0,0,0,0,0,0,0,0,0,0,0,0,0,0,0,0,0,0,0,1,0,0,0,2,0,0,0,0,0,1,24,19,0,0,0,0,0,1,0,0,0,0,0,122,0,0,0,0,8,0,0,10,0,0,0,0,0,0,0,8,0,0,0,0,0,0,0,6,0,0,0,0,1,0,4,0,0,0,0,16,0,0,0,0,0,0,0,0,0,0
"FIN_004_MZB_LO_138","FIN_004_MZB_LO_138-18.10.2011","18.10.2011",2011,10,18,0,0,0,0,0,0,0,0,2,0,0,22,0,0,0,0,0,0,20,0,25,0,0,49,0,0,0,0,0,0,0,0,0,0,0,0,3,0,0,0,0,0,0,3,0,1,0,0,0,0,0,0,0,0,0,0,0,0,0,0,0,0,0,0,0,0,1,0,0,3,0,0,0,9,0,0,0,0,0,6,44,3,0,0,0,0,0,0,0,0,0,0,0,9,0,0,0,0,23,0,0,5,0,0,0,0,0,0,0,15,0,0,0,0,0,0,0,3,0,0,0,0,2,0,2,0,0,1,0,1,0,0,0,0,0,0,0,0,0,0
"FIN_004_MZB_LO_138","FIN_004_MZB_LO_138-29.10.2014","29.10.2014",2014,10,29,0,0,0,0,0,0,0,0,3,0,0,131,0,0,0,0,0,0,11,0,0,0,0,97,0,0,0,0,0,0,0,2,0,0,0,0,21,0,0,0,0,0,0,1,0,0,0,0,0,0,0,0,0,0,0,0,0,0,0,0,0,0,0,0,0,0,0,0,0,1,0,0,1,66,0,0,0,0,0,14,301,24,1,0,0,0,0,0,0,0,0,0,0,5,0,0,0,0,6,0,0,4,0,0,0,0,0,0,0,26,0,0,0,0,2,0,0,13,0,0,0,0,1,0,0,0,0,2,0,1,0,0,0,0,0,0,0,0,0,0
"FIN_004_MZB_LO_138","FIN_004_MZB_LO_138-01.10.2017","01.10.2017",2017,10,1,0,0,0,0,0,0,0,0,1,0,0,59,0,0,0,0,0,0,10,0,0,0,0,100,0,0,0,0,0,0,0,0,0,0,0,0,10,0,0,0,0,0,0,1,0,0,0,0,0,0,0,0,0,0,0,0,0,0,0,0,0,0,0,0,0,0,0,0,0,1,0,0,0,18,0,0,0,0,0,16,213,6,0,0,0,0,0,0,0,0,0,0,0,66,0,0,0,0,1,0,0,8,0,0,0,0,0,0,0,4,0,0,0,0,0,0,0,14,0,0,0,0,0,0,8,0,0,0,0,8,0,0,0,0,0,0,0,0,0,0
"FIN_004_MZB_LO_138","FIN_004_MZB_LO_138-01.09.2020","01.09.2020",2020,9,1,0,0,0,0,0,0,0,0,1,0,0,46,0,0,0,0,0,0,6,0,1,0,0,79,0,0,0,0,0,0,0,0,0,0,0,0,10,0,0,0,0,0,0,9,0,0,0,0,0,0,0,0,0,0,0,0,0,0,0,0,0,0,0,0,0,0,0,0,0,16,0,0,0,14,0,0,0,0,0,3,114,8,4,0,0,0,0,0,0,0,0,0,0,19,0,0,0,0,109,0,0,0,0,0,0,0,0,0,0,17,0,0,0,0,1,0,0,3,0,1,0,0,0,0,0,0,0,0,0,5,0,0,0,0,0,0,0,0,0,0
"FIN_004_MZB_LO_139","FIN_004_MZB_LO_139-03.09.2008","03.09.2008",2008,9,3,0,0,0,0,0,0,0,0,15,0,0,15,0,0,0,0,0,0,0,0,1,0,0,88,0,0,0,0,0,0,0,0,0,0,0,0,10,0,0,0,0,0,0,153,0,0,0,0,0,0,0,0,0,0,0,0,0,0,0,0,0,0,0,0,0,0,0,0,0,0,0,0,0,8,0,0,0,0,0,2,31,2,2,0,0,0,0,0,0,0,0,0,0,126,0,0,0,0,29,0,0,7,0,0,0,0,0,0,0,10,0,0,0,0,0,0,0,16,0,0,0,0,0,0,49,0,0,14,0,12,0,0,0,0,0,0,0,0,0,0
"FIN_004_MZB_LO_139","FIN_004_MZB_LO_139-18.10.2011","18.10.2011",2011,10,18,0,0,0,0,0,0,0,0,13,0,0,234,0,0,0,0,0,0,50,0,7,0,0,165,0,0,0,0,0,0,0,0,0,0,0,0,3,0,0,0,0,0,0,24,0,0,0,0,0,0,0,2,0,0,0,0,0,0,0,0,0,0,0,0,0,0,0,0,0,3,1,0,0,6,0,0,0,0,0,4,82,5,1,2,0,0,0,0,0,0,0,0,0,47,0,0,0,0,24,0,0,4,0,0,0,0,0,0,0,25,0,0,0,0,2,0,0,9,0,0,0,0,8,0,72,0,0,18,0,0,0,0,0,0,0,0,0,0,0,0
"FIN_004_MZB_LO_139","FIN_004_MZB_LO_139-29.10.2014","29.10.2014",2014,10,29,0,0,0,0,0,0,0,0,32,0,0,199,0,0,0,0,0,0,18,0,2,0,0,85,0,0,0,0,0,0,0,1,0,0,0,0,0,0,0,0,0,0,0,6,0,0,0,0,0,0,0,1,0,0,0,0,3,0,0,0,0,0,0,0,0,0,3,0,0,0,0,0,0,4,0,0,0,0,0,21,61,35,0,2,0,0,0,0,0,1,0,0,0,52,0,0,0,0,26,0,0,6,0,0,0,0,2,0,0,31,0,0,0,0,9,0,0,6,0,0,0,0,9,0,10,0,0,173,0,0,0,0,0,0,0,2,0,0,0,0
"FIN_004_MZB_LO_139","FIN_004_MZB_LO_139-01.10.2017","01.10.2017",2017,10,1,0,0,0,0,0,0,0,0,1,0,0,168,0,0,0,0,0,0,30,0,0,0,0,18,0,0,0,0,0,0,0,0,0,0,0,0,2,0,0,0,0,0,0,7,0,0,0,0,0,0,0,0,0,0,0,0,0,0,0,0,0,0,0,0,0,0,1,0,0,0,1,0,0,1,0,0,0,0,0,11,392,13,2,0,0,0,0,0,0,0,0,0,0,294,0,0,0,0,4,0,0,7,0,0,0,0,0,0,0,4,0,0,0,0,0,0,0,28,1,0,0,0,0,0,169,0,0,2,0,4,0,0,0,0,0,0,0,0,0,0
"FIN_004_MZB_LO_139","FIN_004_MZB_LO_139-01.09.2020","01.09.2020",2020,9,1,0,0,0,0,0,0,0,0,42,0,0,70,0,0,0,0,0,0,0,0,1,0,0,101,0,0,0,0,0,0,0,1,0,0,0,0,1,0,0,0,0,0,0,92,0,0,0,0,0,0,0,2,0,0,0,0,0,0,0,0,0,0,0,2,0,0,6,0,0,4,2,0,0,5,0,0,0,0,0,96,27,31,0,16,0,0,0,0,0,0,0,0,0,7,0,0,0,0,374,0,0,5,1,0,0,0,17,0,0,55,0,0,0,0,4,0,0,2,2,0,0,0,1,0,0,0,0,19,0,0,0,0,0,0,0,0,0,0,0,0
"FIN_004_MZB_LO_14","FIN_004_MZB_LO_14-03.10.2006","03.10.2006",2006,10,3,0,0,0,0,0,0,0,0,0,0,0,214,0,0,0,0,0,0,0,0,17,0,0,583,10,0,0,0,0,1,0,3,0,0,0,0,0,0,0,0,0,1,0,49,0,10,0,39,0,0,2,0,0,0,0,0,0,3,0,0,0,0,0,2,0,0,45,0,0,2,1,0,0,48,64,0,0,40,9,432,64,176,0,42,0,0,0,0,0,0,0,1,0,130,0,0,0,0,85,0,0,12,0,0,0,0,61,0,0,26,0,0,0,2,0,0,0,11,0,0,0,0,0,0,28,0,0,13,0,0,0,0,2,0,0,0,0,0,0,0
"FIN_004_MZB_LO_14","FIN_004_MZB_LO_14-06.09.2010","06.09.2010",2010,9,6,0,0,0,0,0,0,0,0,0,0,0,91,0,0,0,0,0,1,0,0,6,0,0,228,22,0,0,0,0,0,0,0,0,0,0,0,1,0,0,0,0,0,0,39,0,23,0,5,0,0,0,0,0,0,0,0,0,7,0,0,0,0,0,0,0,0,52,0,0,4,1,0,0,45,16,0,0,22,11,43,89,0,1,15,0,0,0,0,0,0,0,0,0,17,0,0,0,0,5,0,0,13,0,0,0,0,74,0,0,7,0,0,0,0,0,0,0,7,0,0,5,0,0,0,48,0,1,54,0,7,0,0,0,0,0,1,0,0,0,0
"FIN_004_MZB_LO_14","FIN_004_MZB_LO_14-07.09.2011","07.09.2011",2011,9,7,0,0,0,0,0,0,0,0,0,0,0,189,0,0,0,0,0,1,0,0,18,0,0,82,11,0,0,0,0,11,0,0,0,0,0,0,1,0,0,0,0,0,0,29,0,30,0,18,0,0,0,0,0,0,0,0,0,17,0,0,0,0,0,0,0,0,39,0,0,4,1,0,0,48,73,0,0,60,3,59,57,8,1,21,0,0,0,0,0,0,1,0,0,15,0,0,0,0,18,0,0,7,0,0,0,0,210,0,0,18,0,0,0,0,0,0,0,11,0,0,5,0,0,0,33,0,1,22,0,8,0,0,1,0,0,2,0,0,0,0
"FIN_004_MZB_LO_14","FIN_004_MZB_LO_14-20.09.2012","20.09.2012",2012,9,20,0,0,0,0,0,0,0,0,0,0,0,221,0,0,0,0,0,4,0,0,6,0,0,74,5,0,0,0,0,1,0,13,0,0,0,0,4,0,0,0,0,1,0,23,0,3,1,4,0,0,0,0,0,0,0,0,0,5,0,0,0,0,0,3,0,0,24,0,0,2,1,0,0,56,5,0,0,20,25,72,360,46,0,5,0,0,0,0,0,0,0,0,0,54,0,0,0,0,13,0,0,15,1,0,0,0,76,0,0,9,0,0,0,0,0,0,5,13,0,0,0,0,0,0,21,0,0,54,0,14,0,0,0,0,0,0,0,0,0,0
"FIN_004_MZB_LO_14","FIN_004_MZB_LO_14-06.09.2013","06.09.2013",2013,9,6,0,0,0,0,0,0,0,0,0,0,0,107,0,0,0,0,0,11,0,0,19,0,0,416,3,0,0,0,0,10,0,8,0,0,0,0,0,0,0,0,0,0,0,14,0,6,8,3,0,0,0,0,0,3,0,0,1,1,0,0,0,0,0,4,0,0,9,0,0,1,0,0,0,4,14,0,0,27,12,299,49,12,2,46,0,0,0,0,0,7,0,0,0,44,0,0,0,0,8,0,0,8,2,0,0,0,113,0,0,21,0,0,0,0,3,0,0,1,0,0,4,0,36,0,3,0,0,174,0,2,0,0,0,0,0,0,0,0,0,0
"FIN_004_MZB_LO_14","FIN_004_MZB_LO_14-10.10.2014","10.10.2014",2014,10,10,0,0,0,0,0,0,0,0,0,0,0,170,0,0,0,0,0,0,6,0,0,0,0,58,17,0,0,0,0,0,0,0,0,0,0,0,1,0,0,0,0,0,0,13,0,1,0,474,0,0,0,0,0,0,0,0,0,33,0,0,0,0,0,0,0,0,65,0,0,1,0,0,0,32,3,0,0,39,10,37,98,4,0,13,0,0,0,0,0,0,1,0,0,64,0,0,0,0,3,0,0,32,0,0,0,0,87,0,0,9,0,0,0,0,0,0,17,18,0,0,3,0,0,0,89,0,0,69,0,4,0,0,0,0,0,0,0,0,0,0
