"Unique.ID","Samp.ID","Sampling.date","year","month","day","ACENTRIA SP.","ACROLOXUS LACUSTRIS","AESHNIDAE GEN. SP.","AMETROPUS FRAGILIS","ANCYLUS FLUVIATILIS","ANISOPTERA GEN. SP.","ANISUS SPIRORBIS","APHELOCHEIRUS AESTIVALIS","ARANEAE GEN. SP.","ARGULUS SP.","ARGYRONETA AQUATICA","ASELLUS AQUATICUS","ASTACIDAE GEN. SP.","ATHERICIDAE GEN. SP.","BAETIDAE GEN. SP.","BATHYOMPHALUS CONTORTUS","BITHYNIA LEACHII LEACHII","BITHYNIA TENTACULATA","BITHYNIA TRANSSILVANICA","BRACHYCENTRUS SUBNUBILUS","BRACHYPTERA RISI","BRANCHIOBDELLA PARASITA","BRANCHIPUS SP.","BRYOZOA GEN. SP.","CAENIDAE GEN. SP.","CALOPTERYGIDAE GEN. SP.","CATACLYSTA SP.","CERATOPOGONIDAE GEN. SP.","CHAOBORUS SP.","CHIRONOMIDAE GEN. SP.","CHLOROPERLA TRIPUNCTATA","CHRYSOMELIDAE GEN. SP.","COENAGRIONIDAE GEN. SP.","COLEOPTERA GEN. SP.","CORBICULA SP.","CORDULIIDAE GEN. SP.","CORIXIDAE GEN. SP.","COROPHIIDAE GEN. SP.","CRUNOECIA IRRORATA IRRORATA","CULICIDAE GEN. SP.","CURCULIONIDAE GEN. SP.","DECAPODA GEN. SP.","DENDROCOELIDAE GEN. SP.","DIPTERA GEN. SP.","DIXIDAE GEN. SP.","DOLICHOPODIDAE GEN. SP.","DREISSENA POLYMORPHA","DREISSENA ROSTRIFORMIS BUGENSIS","DRYOPIDAE GEN. SP.","DUGESIA SP.","DYTISCIDAE GEN. SP.","ECNOMUS TENELLUS","ELMIDAE GEN. SP.","ELOPHILA SP.","EPHEMERA SP.","EPHEMERELLA SP.","EPHORON VIRGO","EPHYDRIDAE GEN. SP.","ERPOBDELLIDAE GEN. SP.","ESPERIANA SP.","EURYLOPHELLA KARELICA","FERRISSIA CLESSINIANA","FREDERICELLA SP.","GAMMARIDAE GEN. SP.","GERRIDAE GEN. SP.","GLOSSIPHONIIDAE GEN. SP.","GLOSSOSOMATIDAE GEN. SP.","GOERIDAE GEN. SP.","GOMPHIDAE GEN. SP.","GORDIUS AQUATICUS","GYRAULUS SP.","GYRINIDAE GEN. SP.","HAEMOPIS SANGUISUGA","HALIPLIDAE GEN. SP.","HEBRUS SP.","HELOPHORUS SP.","HEPTAGENIIDAE GEN. SP.","HIPPEUTIS COMPLANATUS","HIRUDINEA GEN. SP.","HIRUDO MEDICINALIS","HOLANDRIANA SP.","HYDRACHNIDAE GEN. SP.","HYDRACHNIDIA GEN. SP.","HYDRAENIDAE GEN. SP.","HYDROBIIDAE GEN. SP.","HYDROCHUS SP.","HYDROMETRA SP.","HYDROPHILIDAE GEN. SP.","HYDROPSYCHIDAE GEN. SP.","HYDROPTILIDAE GEN. SP.","HYPANIA INVALIDA","ISONYCHIA IGNOTA","JAERA ISTRI","LEPIDOPTERA GEN. SP.","LEPIDOSTOMA BASALE","LEPTOCERIDAE GEN. SP.","LEPTOPHLEBIIDAE GEN. SP.","LEUCTRIDAE GEN. SP.","LIBELLULIDAE GEN. SP.","LIMNEPHILIDAE GEN. SP.","LIMONIIDAE GEN. SP.","LYMNAEIDAE GEN. SP.","LYPE REDUCTA","MELANOPSIS SP.","MESOVELIA FURCATA","METRELETUS BALCANICUS","MUSCIDAE GEN. SP.","MYSIDAE GEN. SP.","NAUCORIDAE GEN. SP.","NEMOURA SP.","NEOEPHEMERA MAXIMA","NEPA CINEREA","NOTERUS SP.","NOTONECTIDAE GEN. SP.","NYMPHULA SP.","OLIGOCHAETA GEN. SP.","OLIGONEURIELLA SP.","ORCHESTIA CAVIMANA","ORCONECTES LIMOSUS","PALINGENIA LONGICAUDA","PARAPOYNX SP.","PEDICIIDAE GEN. SP.","PERLIDAE GEN. SP.","PERLODIDAE GEN. SP.","PHRYGANEIDAE GEN. SP.","PHYSIDAE GEN. SP.","PISCICOLIDAE GEN. SP.","PLANARIIDAE GEN. SP.","PLANORBARIUS CORNEUS","PLANORBIS SP.","PLATYCNEMIDIDAE GEN. SP.","PLEA MINUTISSIMA MINUTISSIMA","PLECOPTERA GEN. SP.","POLYCENTROPODIDAE GEN. SP.","PORIFERA GEN. SP.","POTAMANTHUS LUTEUS","PSYCHODIDAE GEN. SP.","PSYCHOMYIA PUSILLA","PTYCHOPTERA SP.","RANATRA LINEARIS","RHAGIONIDAE GEN. SP.","RHYACOPHILA SP.","SCIOMYZIDAE GEN. SP.","SCIRTIDAE GEN. SP.","SEGMENTINA NITIDA","SERRATELLA IGNITA","SIALIDAE GEN. SP.","SIMULIIDAE GEN. SP.","SIPHLONURUS LACUSTRIS","SIPHONOPERLA SP.","SISYRIDAE GEN. SP.","SPERCHEUS EMARGINATUS","SPHAERIIDAE GEN. SP.","SPONGILLA LACUSTRIS","STRATIOMYIDAE GEN. SP.","SYNURELLA AMBULANS","SYRPHIDAE GEN. SP.","TABANIDAE GEN. SP.","TAENIOPTERYX SP.","THEODOXUS SP.","TINODES ASSIMILIS","TINODES ROSTOCKI","TINODES WAENERI SSP.","TIPULIDAE GEN. SP.","TRICHOPTERA GEN. SP.","TURBELLARIA GEN. SP.","UNIONIDAE GEN. SP.","VALVATIDAE GEN. SP.","VELIIDAE GEN. SP.","VIVIPARUS SP.","WORMALDIA SUBNIGRA"
"HUN_022_MZB_LO_1","HUN_022_MZB_LO_1-19.09.2007","19.09.2007",2007,9,19,0,0,0,0,0,0,0,0,0,0,0,0,0,0,3.2,0,0,0,0,0,0,0,0,0,0,11.2,0,4.8,0,91.2,0,0,0,0,0,0,1.6,0,0,0,0,0,0,3.2,0,0,0,0,0,0,0,0,0,0,0,0,0,0,0,0,0,0,0,0,1.6,1.6,0,0,0,12.8,0,0,0,0,0,0,0,0,0,0,0,0,0,0,0,0,0,0,0,0,0,0,0,0,0,0,0,0,0,0,0,0,0,0,0,0,0,0,0,0,0,0,0,0,0,46.4,0,0,0,0,0,0,0,0,0,0,0,0,0,1.6,9.6,0,0,0,0,0,0,0,0,0,0,0,0,0,0,0,0,0,0,0,0,0,0,0,0,0,0,0,0,0,0,0,0,0,0,0,3.2,0,0,0,0
"HUN_022_MZB_LO_1","HUN_022_MZB_LO_1-07.10.2008","07.10.2008",2008,10,7,0,0,0,0,0,0,0,0,0,0,0,0,0,0,1.6,0,0,0,0,0,0,0,0,0,0,0,0,0,0,0,0,0,0,0,0,0,0,0,0,0,0,0,0,0,0,0,0,0,0,0,0,0,0,0,0,0,0,0,0,0,0,0,0,0,0,0,0,0,0,0,0,0,0,0,0,0,0,0,0,0,0,0,0,0,0,0,0,0,0,0,0,0,0,0,0,0,0,0,0,0,0,1.6,0,0,0,0,0,0,0,0,0,0,0,0,1.6,0,0,0,0,0,1.6,0,0,0,0,0,0,0,0,3.2,0,0,0,0,0,0,0,0,0,0,0,0,0,0,0,0,0,0,0,0,0,0,0,0,0,0,0,0,0,0,0,0,0,0,0,0,0,0,0,0,0
"HUN_022_MZB_LO_1","HUN_022_MZB_LO_1-02.09.2009","02.09.2009",2009,9,2,0,0,0,0,0,0,0,0,0,0,0,0,0,0,0,0,0,0,0,0,0,0,0,0,0,0,0,0,0,1.6,0,0,0,0,0,0,0,0,0,0,0,0,0,0,0,0,0,0,1.6,0,0,0,0,0,0,0,0,0,0,0,0,0,0,0,0,0,0,0,0,0,0,0,0,0,0,0,0,0,0,0,0,0,0,0,0,0,0,0,0,0,0,0,0,0,0,0,0,0,0,0,0,0,0,0,0,0,0,0,0,0,0,0,0,0,0,3.2,0,0,0,0,0,0,0,0,0,0,0,0,0,0,0,0,0,0,0,0,0,0,0,0,0,0,0,0,0,0,0,0,0,0,0,0,0,0,0,0,0,0,0,0,0,0,0,0,0,0,0,0,0,0,0
"HUN_022_MZB_LO_1","HUN_022_MZB_LO_1-06.09.2010","06.09.2010",2010,9,6,0,0,0,0,0,0,0,0,0,0,0,0,0,0,0,0,0,0,0,0,0,0,0,0,0,0,0,3.2,0,3.2,0,0,4.8,0,0,0,0,0,0,0,0,0,0,0,0,0,0,0,0,0,0,0,0,0,0,0,0,0,6.4,0,0,0,0,0,0,0,0,0,0,0,0,0,0,0,0,0,0,0,0,0,0,0,0,0,0,0,0,0,0,0,0,0,0,0,0,0,0,0,0,0,0,0,0,0,0,0,0,0,0,0,0,0,0,0,0,24,0,0,0,0,0,0,0,0,0,0,0,0,0,0,0,0,0,0,0,0,0,0,0,0,0,0,0,0,0,0,0,0,0,0,0,0,0,0,1.6,0,0,0,0,0,0,0,0,0,0,0,0,0,0,0,0
"HUN_022_MZB_LO_1","HUN_022_MZB_LO_1-13.09.2011","13.09.2011",2011,9,13,0,0,0,0,0,0,0,0,0,0,0,0,0,0,0,0,0,1.6,0,0,0,0,0,0,0,0,0,0,0,6.4,0,0,0,0,0,0,28.8,0,0,0,0,0,0,0,0,0,0,0,0,0,0,0,0,1.6,0,0,0,0,0,0,0,0,0,0,3.2,0,0,0,0,0,0,0,0,1.6,0,0,0,0,0,0,0,0,0,0,0,0,0,0,0,0,0,0,0,0,0,0,0,0,0,0,0,0,0,0,0,0,0,0,0,0,0,0,0,0,0,3275.2,0,0,0,0,0,0,0,0,0,19.2,0,0,0,0,0,0,0,0,0,0,0,0,0,0,0,0,0,0,0,0,0,0,0,0,0,0,0,0,0,0,0,0,0,0,0,0,0,0,0,0,1.6,3.2,0,0,0
"HUN_022_MZB_LO_1","HUN_022_MZB_LO_1-26.09.2012","26.09.2012",2012,9,26,0,0,0,0,0,0,0,0,0,0,0,0,0,0,0,0,0,0,0,0,0,0,0,0,0,1.6,0,0,0,6.4,0,0,64,0,0,0,1.6,0,0,0,0,0,0,0,0,0,0,0,0,0,9.6,0,0,0,0,0,0,0,0,0,0,0,0,0,1.6,0,0,0,0,0,0,0,0,0,0,0,0,0,0,0,0,0,0,0,0,0,0,6.4,0,0,0,0,0,0,0,0,0,0,0,0,0,0,0,0,0,0,0,0,0,0,0,0,0,0,0,1.6,0,0,0,0,0,0,0,0,0,20.8,0,0,0,0,8,1.6,0,0,0,0,0,0,0,0,0,0,0,0,0,0,0,1.6,0,0,0,0,0,0,0,0,0,0,0,0,0,0,0,0,0,0,0,0,0,0,0
"HUN_022_MZB_LO_1","HUN_022_MZB_LO_1-20.09.2013","20.09.2013",2013,9,20,0,0,0,0,0,0,0,0,0,0,0,0,0,0,0,0,0,0,0,0,0,0,0,0,0,1.6,0,0,0,12.8,0,0,0,0,0,0,0,0,0,0,0,0,0,0,0,0,0,0,0,0,0,0,0,0,0,0,0,0,6.4,0,0,0,0,0,0,0,0,0,3.2,0,0,0,0,0,0,0,0,0,0,0,0,0,0,0,0,0,0,0,9.6,0,0,0,0,0,0,0,0,0,0,0,0,0,0,0,0,0,0,0,0,0,0,0,0,0,0,3.2,0,0,0,0,0,0,0,0,0,0,0,0,0,0,0,0,0,0,0,0,0,0,0,0,0,0,0,0,0,0,0,0,0,0,0,0,0,0,0,0,0,0,0,0,0,0,0,0,0,0,1.6,0,0,0,0
"HUN_022_MZB_LO_1","HUN_022_MZB_LO_1-08.10.2014","08.10.2014",2014,10,8,0,0,0,0,0,0,0,0,0,0,0,0,0,0,123.2,0,0,0,0,0,0,0,0,0,0,3.2,0,0,0,300.8,0,0,1.6,0,0,0,0,0,0,0,0,0,0,0,0,0,0,0,0,0,0,0,0,0,0,0,0,0,0,0,0,0,0,3.2,0,0,0,0,0,0,0,0,0,0,0,0,0,0,0,0,0,0,0,0,0,0,0,0,0,0,0,0,0,0,0,0,0,0,0,0,0,1.6,0,0,0,0,0,14.4,0,0,0,0,0,0,0,9.6,0,0,0,0,0,0,0,0,0,40,1.6,0,0,0,0,0,0,0,0,0,0,0,0,0,0,0,0,0,0,0,0,1.6,0,0,0,0,0,0,0,0,0,0,0,0,0,0,0,0,0,0,0,0,0,0,0
"HUN_022_MZB_LO_1","HUN_022_MZB_LO_1-24.09.2015","24.09.2015",2015,9,24,0,0,0,0,0,0,0,0,1.6,0,0,0,0,0,4.8,0,0,0,0,0,0,0,0,0,0,30.4,0,0,0,27.2,0,0,19.2,0,0,0,3.2,0,0,0,0,0,0,0,0,0,0,0,0,0,1.6,0,0,1.6,0,0,0,0,0,0,0,0,0,8,8,0,0,0,1.6,0,0,0,0,0,0,0,0,0,0,0,0,0,0,0,0,0,0,0,1.6,0,0,0,0,0,0,0,0,0,0,0,0,0,0,0,0,0,0,1.6,0,0,0,0,0,0,0,1.6,0,0,0,0,0,0,0,0,0,17.6,0,0,0,0,0,0,0,8,0,0,0,0,0,0,0,0,0,0,0,0,0,0,0,0,0,0,0,0,0,0,0,0,0,0,0,0,0,0,0,0,0,0,0,0,0
"HUN_022_MZB_LO_1","HUN_022_MZB_LO_1-14.09.2016","14.09.2016",2016,9,14,0,0,0,0,0,0,0,0,0,0,0,0,0,0,0,0,0,0,0,0,0,0,0,0,0,80,0,0,0,16,0,0,4.8,0,0,0,0,0,0,0,0,0,0,0,0,0,0,0,0,0,11.2,0,0,0,0,0,0,0,0,0,0,0,0,302.4,0,0,0,0,0,0,0,0,0,0,0,0,0,0,0,0,0,0,0,0,0,0,0,0,1.6,0,0,0,0,1.6,0,0,0,0,0,0,0,3.2,0,0,0,0,0,0,0,0,0,0,0,1.6,0,1.6,0,0,0,0,0,0,0,0,0,16,0,0,0,0,0,0,0,89.6,0,0,0,0,0,0,0,0,0,0,0,0,0,0,0,0,0,0,0,0,0,0,0,0,0,0,0,0,0,0,0,0,0,0,0,0,0
"HUN_022_MZB_LO_10","HUN_022_MZB_LO_10-07.10.2007","07.10.2007",2007,10,7,0,0,0,0,0,0,0,4.8,0,0,0,0,0,0,32.8,0,0,0,0,0,0,0,0,0,0,0,0,0,0,1.6,0,0,0,0,0,0,0,0,0,0,0,0,0,0,0,0,0,0,0,0.8,0,0,0,0,0,0,0,0,0,0,0,0,0,2.4,0,0,0,3.2,0,0,0,0,0,0,0,0,2.4,0,0,0,0,0,0,0,0,0,0,0,16.8,0.8,0,0,0,0,0,0.8,0,0,0,0,3.2,0,0,0,0,0,0,0,0,0,0,0,0,0,0,2.4,0,0,0,0,0,0,0,0,0,0,0,0,0,0,0,0,0,0,0,1.6,0,3.2,0,0,1.6,0,0,0,0,0,0,0.8,0,0,0,0,1.6,0,0,0,0,0,0,0,0,0,0,0.8,0,0,0,0,0,0,0
"HUN_022_MZB_LO_10","HUN_022_MZB_LO_10-12.09.2008","12.09.2008",2008,9,12,0,0,0,0,0,0,0,4,0,0,0,0,0.8,0,48,0,0,0,0,0,0,0,0,0,3.2,0,0,0.8,0,120,0,0,0,0,0,0,0,0,0,0,0,0,0,0,0,0,0,0,0,0,0.8,0,1.6,0,0,0,0,0,0,0,0,0,0,28,0,0,0,0,1.6,0,0,0,0,0,0,0,17.6,0,0,0,0,0,0,0.8,0,0,0,0,12,0.8,0,0.8,0,0,0,0,0,0,0,0,4,0,0,0,0,0,0,0,0,0,0,0,0,0,0,16,0,0,0,0,0,0,0,0.8,0,0,0,0,0,0,0,0,0,0,0,1.6,0,1.6,0,0,0,0,0,0,0,0.8,0,4,0,0,0,0,1.6,0,0,0,0,0,0,0,0,0,0,0,0,0,0.8,0,0,0,0
"HUN_022_MZB_LO_10","HUN_022_MZB_LO_10-27.10.2009","27.10.2009",2009,10,27,0,0,0,0,0,0,0,0,0,0,0,0,0,0.8,5.6,0,0,0,0,0,0,0,0,0,0,0.8,0,0,0,12.8,0,0,0,0,0,0,0,0,0,0,0,0,0,0,0,0,0,0,0,0,0.8,0,0,0,0,0,0,0,0,0,0,0,0,14.4,0,0,0,0,0,0,0,0,0,0,0,0,12,0,0,0,0,0,0,0,0,0,0,0,12.8,0,0,0,0,0,0,0,0,0,0,0,0.8,0,0,0,0,0,0,0,0,0,0,0,0,0,0,216.8,0,0,0,0,0,0,0,0,0,0,0,0,0,0,0,0,0,0,0,0,0,4,0,0,0,0.8,0,0,0,0,0,0,0,0,0,0,0,0,0,0,0,0,0,0,0,0,0,0,0,0,0,0,0,0,0
"HUN_022_MZB_LO_10","HUN_022_MZB_LO_10-20.08.2010","20.08.2010",2010,8,20,0,0,0,0,0,0,0,0,0,0,0,0,3.692307692,0,1.230769231,0,0,0,0,0,0,0,0,0,4.923076923,0,0,0,0,2.461538462,0,0,0,0,0,0,0,0,0,0,0,0,0,0,0,0,0,0,0,0,0,0,0,0,0,0,0,0,0,0,0,0,0,1195.076923,0,0,0,0,3.692307693,0,0,0,0,0,0,0,18.461538464,0,0,0,0,0,0,0,0,0,0,0,2.461538462,0,0,0,0,0,0,0,2.461538462,0,0,1.230769231,0,0,0,0,0,0,0,0,0,0,0,0,0,0,0,6.153846154,0,0,0,0,0,0,0,0,0,0,0,0,0,0,0,0,0,0,0,0,0,0,0,0,0,0,0,0,0,0,0,0,0,0,0,0,0,0,0,0,0,0,0,0,0,0,0,0,0,0,0,0,0,0,0
"HUN_022_MZB_LO_10","HUN_022_MZB_LO_10-18.08.2011","18.08.2011",2011,8,18,0,0,0,0,0,0,0,0,0,0,0,0,1.454545455,0,8.727272727,0,0,0,0,0,0,1.454545455,0,0,2.909090909,0,0,0,0,5.818181818,0,0,0,0,0,0,0,0,0,0,0,0,0,0,0,0,0,0,0,0,0,0,0,0,0,0,0,0,0,0,0,0,0,119.2727273,0,0,0,0,5.818181819,0,0,0,0,0,0,0,40.727272725,0,0,0,0,0,0,0,0,0,0,0,1.454545455,0,0,0,0,0,0,0,0,1.454545455,0,2.90909091,0,0,0,0,0,0,0,0,0,0,0,0,0,0,0,16.000000005,0,0,0,0,0,0,0,0,0,0,0,0,0,0,0,0,0,0,0,0,0,0,0,0,0,0,0,0,0,1.454545455,0,0,0,0,0,0,0,0,0,0,0,0,0,0,0,0,0,0,0,0,0,0,0,0,0
"HUN_022_MZB_LO_10","HUN_022_MZB_LO_10-30.08.2012","30.08.2012",2012,8,30,0,0,0,0,0.8,0,0,28.8,0,0,0,0,0,19.2,124,0,0,0,0,0,0,0,0,0,44.8,0.8,0,3.2,0,30.4,0,0,0,0,0,0,0,0,0,0,0,0,0,0,0,0,0,0,0,0,0,0,5.6,0,0,0,0,0,0,0,0,0,5.6,244,0,0,0,0,17.6,0,0,0,0,0,0,0,121.6,0,0,0,0,0,0,0,0,0,0,0,51.2,3.2,0,0,0,0,0,0,3.2,1.6,0,0,24,0,0,0,0,0,0,0,0,0,0,0,0,0,0,13.6,0,0,0,0,0,0,0,1.6,0,0,0,0,0,0,0,0,0,1.6,0,0,0,2.4,0,0,0,0,0,0,0,22.4,0,12.8,0,0,0,0,0,0,0,0,0,0,0,0,0,0,0,0,0,0,0,0,0,0,0
"HUN_022_MZB_LO_10","HUN_022_MZB_LO_10-12.09.2013","12.09.2013",2013,9,12,0,0,0,0,0,0,0,76.8,0,0,0,0,0,1.6,246.4,0,0,0,0,0,0,0,0,0,8,2.4,0,0,0,19.2,0,0,0,0,0,0,0,0,0,0,0,0,0,0,0,0,0,0,0,0,0,0,0,0,0,0,0,0,0,0,0,0,0,78.4,0.8,0,0,0,12,0,0,0,0,0,0,0,31.2,0,0,0,0,0,0,0.8,0,0,0,0,80,1.6,0,0,0,0,0,0,0.8,0,0,0,26.4,0,0,0,0,0,0,0,0,0,0,0,0,0,0,296,0,0,0,0,0,0,0,0,0,0,0,0,0,0,0,0,0,0,0,3.2,0,0,0,0,0,0,0,0.8,0,0,0,14.4,0,0,0,0,0,0,0,0,0,0,0,0,0,0,0,0,0,0,0,0,0,0,0
"HUN_022_MZB_LO_10","HUN_022_MZB_LO_10-26.08.2014","26.08.2014",2014,8,26,0,0,0,0,0,0,0,80,0,0,0,0,0,6.4,84,0,0,0,0,1.6,0,0,0,0,0,8.8,0,0.8,0,4,0,0,0,0,0,0,0,0,0,0,0,0,0,0,0,0,0,0,0,0,0,0,2.4,0,0,0,0,0,0,0,0,0,0,672,0,0,0,0,2.4,0,0,0.8,0,0,0,0,144,0,0,0,0,0,0,0,0,0,0,0,384,0,0,0,0,0,0,0,0,0.8,0,0.8,10.4,0,0,0,0,0,0,0,0,0,0.8,0,0,0,0,0.8,0,0,0,0,0,1.6,0,0,0,0,1.6,0,0,0,0,0,0,0,0,0,0,0,0,0,0,0,0,0,0,0.8,0,4,0,0,0,0,0.8,0,0,0,0,0.8,0,0,0,0,0,0,0,0,2.4,0,0,0,0
"HUN_022_MZB_LO_10","HUN_022_MZB_LO_10-15.09.2015","15.09.2015",2015,9,15,0,0,0,0,0.8,0,0,5.6,0,0,0,0,0,0.8,205.6,0,0,0,0,0,0,0,0,0,8.8,0,0,0.8,0,55.2,0,0,0,0,0,0,0,0,0,0,0,0,0,0,0,0,0,0,0.8,0,0,0,4.8,0,0,0,0,0,0,0,0,0,0,316.8,0,0,0,0,6.4,0,0,0,0,0,0,0,112.8,0,0,0,0,0,0,1.6,0,0,0,0,81.6,1.6,0,0,0,0,0,0.8,0,0,0,0,36,0,0,0,0,0,0,0,0,0,0,0,0,0,0,50.4,0,0,0,0,0,0,0,0,0,0,0,0,0,0,0,0,0,0,0,0,0,0.8,0,0,0,0,0,0,0,0,0,0.8,0,0,0,0,0,0,0,0,0,0,0,0,0,0,0,0,0,0,0,0,0,0,0
"HUN_022_MZB_LO_10","HUN_022_MZB_LO_10-19.09.2016","19.09.2016",2016,9,19,0,0,0,0,16,0,0,2.4,0,0,0,0,0,1.6,488,0,0,0,0,0,0,0,0,0,2.4,0,0,0,0,7.2,0,0,0,0,0,0,0,0,0,0,0,0,0,0,0,0,0,0,0.8,0,0,0,0,0,0,0,0,0,0,0,0,0,0.8,1680,0,0,0,0.8,17.6,0,0,0,0,0,0,0,656,0,0,0,0,0,0,1.6,0,0,0,0,116,0.8,0,0,0,0,0,0,1.6,0.8,0,0,4,0,0,0,0,0,0,0,0,0,0,0,0,0,0,3.2,0,0,0,0,0,0.8,0,0,0,0,0,0,0,0,0,0,0,0,0,0.8,0,2.4,0,0,0,0,0,0,0,0,0,3.2,0,0,0,0,0,0,0,0,0,0,0,0,0,0,0,9.6,0,0,0,0,0,0,0
"HUN_022_MZB_LO_11","HUN_022_MZB_LO_11-15.10.2001","15.10.2001",2001,10,15,0,0,0,0,0,0,0,0,0,0,0,0,0,0,1.6,0,0,0,0,0,0,0,0,0,0,0,0,0,0,0,0,0,1.6,0,0,0,0,1.6,0,0,0,0,0,0,0,0,0,0,0,0,0,0,0,0,0,0,0,0,1.6,0,0,0,0,0,0,3.2,0,0,1.6,0,0,0,0,0,0,0,0,0,0,0,0,0,0,0,1.6,0,0,0,0,0,0,0,0,0,0,1.6,0,0,0,0,0,0,0,0,0,0,0,0,0,0,0,0,0,0,0,1.6,0,0,0,0,0,0,0,0,0,0,0,0,0,0,0,0,0,0,0,0,0,0,0,0,0,0,0,0,0,0,1.6,0,0,0,0,0,1.6,0,0,0,0,0,0,0,0,0,0,0,0,0,4.8,0,0,1.6,0
"HUN_022_MZB_LO_11","HUN_022_MZB_LO_11-16.10.2002","16.10.2002",2002,10,16,0,0,0,0,0,0,0,0,0,0,0,0,0,0,0,0,0,0,0,0,0,0,0,0,0,0,0,0,0,1.6,0,0,0,0,0,0,0,0,0,0,0,0,0,0,0,0,0,0,0,0,0,0,0,0,0,0,0,0,1.6,0,0,0,0,0,0,1.6,0,0,0,0,0,0,0,0,0,0,0,0,0,0,0,0,0,0,1.6,0,0,0,0,0,0,0,0,0,0,0,0,0,0,0,0,0,0,0,0,0,0,1.6,0,0,0,0,0,0,0,1.6,0,0,0,0,0,0,0,0,0,0,0,0,0,0,0,0,0,0,0,0,0,0,0,0,0,0,0,0,0,0,1.6,0,0,0,0,0,1.6,0,0,0,0,0,0,0,0,0,0,0,0,0,4.8,1.6,0,1.6,0
"HUN_022_MZB_LO_11","HUN_022_MZB_LO_11-20.10.2004","20.10.2004",2004,10,20,0,0,0,0,0,0,0,0,0,0,0,0,0,0,0,0,0,1.6,0,0,0,0,0,0,1.6,0,0,1.6,0,1.6,0,0,0,0,0,0,0,0,0,0,0,0,0,0,0,0,0,0,0,0,0,0,0,0,0,0,0,0,1.6,0,0,0,0,0,0,1.6,0,0,3.2,0,0,0,0,0,0,0,0,0,0,0,0,0,0,0,1.6,0,0,0,1.6,0,0,0,0,0,0,1.6,0,0,0,0,0,0,0,0,0,0,0,0,0,0,0,0,0,0,0,1.6,0,0,0,0,0,0,0,0,0,1.6,0,0,0,0,0,0,0,1.6,0,1.6,0,0,0,0,0,0,0,0,0,0,1.6,0,0,0,0,0,3.2,0,0,0,0,1.6,0,0,0,0,0,0,0,0,1.6,0,0,1.6,0
"HUN_022_MZB_LO_11","HUN_022_MZB_LO_11-04.10.2005","04.10.2005",2005,10,4,0,0,0,0,0,0,0,0,0,0,0,0,0,0,0,0,0,3.2,0,0,0,0,0,0,0,0,0,0,0,0,0,0,0,0,0,0,0,0,0,0,0,0,0,0,0,0,1.6,0,0,0,0,0,1.6,0,0,0,0,0,6.4,0,0,0,0,0,0,6.4,0,0,6.4,0,0,0,0,0,0,0,0,0,0,0,0,0,0,0,4.8,0,0,0,0,0,0,0,0,0,0,0,0,0,0,0,0,0,0,0,0,0,0,0,0,0,0,0,0,0,0,32,0,0,0,0,0,0,0,0,0,0,0,0,0,0,1.6,0,0,65.6,0,0,0,0,0,0,0,0,0,0,0,0,6.4,0,0,0,0,0,8,0,0,0,0,3.2,0,0,0,0,0,0,0,0,4.8,1.6,0,4.8,0
"HUN_022_MZB_LO_11","HUN_022_MZB_LO_11-16.10.2007","16.10.2007",2007,10,16,0,0,0,0,0,0,0,4.8,0,0,0,0,0,0,0,0,0,0,0,0,0,0,0,0,1.6,3.2,0,3.2,0,1.6,0,0,3.2,0,0,0,3.2,6.4,0,0,0,0,0,0,0,0,1.6,0,0,0,0,4.8,1.6,0,9.6,0,0,0,3.2,0,0,0,0,1.6,0,8,0,0,4.8,0,0,0,0,0,0,0,0,0,0,0,0,0,0,0,0,0,0,0,1.6,0,16,0,0,0,0,0,0,0,0,0,0,0,0,0,0,0,0,1.6,0,0,0,0,0,0,0,240,0,0,0,0,0,0,0,0,0,0,0,0,0,0,0,0,0,6.4,0,528,0,0,0,0,0,0,0,0,0,0,12.8,0,0,0,0,0,17.6,0,0,0,0,0,0,0,0,0,0,0,0,0,11.2,6.4,0,4.8,0
"HUN_022_MZB_LO_11","HUN_022_MZB_LO_11-05.09.2008","05.09.2008",2008,9,5,0,0,0,0,0,0,0,1.333333333,0,0,0,0,1.333333333,0,0,0,0,0,0,0,0,0,0,0,5.333333333,0,0,0,0,13.33333333,0,0,0,0,0,0,0,1.333333333,0,0,0,0,0,0,0,0,1.333333333,0,0,0,0,0,0,0,17.33333333,0,0,0,8,0,0,0,0,0,0,11.999999999,0,0,4,0,0,0,0,0,0,0,0,0,0,0,0,0,0,0,2.666666667,0,0,0,0,0,10.66666667,0,0,0,0,0,0,0,0,0,0,0,0,0,0,0,0,1.333333333,0,0,0,0,0,0,0,333.3333333,0,0,0,0,0,0,0,0,0,0,1.333333333,0,0,0,2.666666667,0,0,100,0,0,0,0,0,0,0,0,0,0,0,0,22.66666667,0,0,0,0,0,16,0,0,0,0,0,0,0,0,0,0,0,0,0,5.333333332,122.6666667,0,6.666666667,0
"HUN_022_MZB_LO_11","HUN_022_MZB_LO_11-09.10.2009","09.10.2009",2009,10,9,0,0,0,0,0,0,0,14.4,0,0,0,0,0,0,0,0,0,0,0,0,0,0,0,0,7.2,0,0,16,0,0.8,0,0,0,0,20,0,0,256,0,0,0,0,0,0,0,0,0,0,0,0.8,0,0,3.2,0,0,0,0,0,4,0,0,0,0,4.8,0,3.2,0,0,37.6,0,0,0,0,0,0,0,6.4,0,0,0,0,0,0,0,27.2,0,0,0,5.6,0,56,0,0,0.8,0,0,0,0,0,0,0,0,0,0,0,0,0,1.6,0,0,0,0,0,0,0,280,0,0,0,0,0,0,0,0,0,0.8,1.6,0,0,0,0,0,0,432,0,5.6,0,0,0,0,0,0,0,0,0,0,0,0,0,0,0,0,56,0,0,0,0,0,4,0,0,0,0,0,0,0,9.6,0,0,1.6,0
"HUN_022_MZB_LO_11","HUN_022_MZB_LO_11-15.10.2010","15.10.2010",2010,10,15,0,0,0,0,0,0,0,1.6,0,0,0,0,0,0.8,0,0,0,0,0,0,0,0,0,0,0.8,3.2,0,0.8,0,2.4,0,0,0.8,0,76.8,0,0,19.2,0,0,0,0,0,0,0,0,0.8,0,0,0,0,0,0,0,3.2,0,0,0,0.8,0,0,0,0,1.6,0,1.6,0,0,10.4,0,0,0,0,0,0,0,0.8,0,0,0,0,0,0,0,17.6,0,0,0,0.8,0,4.8,0,0,0,0,0,0.8,0,0,0,0,0.8,0,0,0,0,0,33.6,0,0,0,0,0,0.8,0,960,0,0,0,0,0,0,0,0,0,0,0,0,0,0,0,0,0,152,0,0.8,0,0,0,0,0,0,0,0,0,0,0,0,0,0,0,0,41.6,0,0,0,0,0,0,0.8,0,0,0,0,0,0,3.2,0.8,0,0,0
"HUN_022_MZB_LO_11","HUN_022_MZB_LO_11-30.08.2011","30.08.2011",2011,8,30,0,0,0,0,0,0,0,2.4,0,0,0,0,0,0,0.8,0,0,0.8,0,2.4,0,0,0,0,3.2,1.6,0,0.8,0,16.8,0,0,0,0,15.2,0,0,38.4,0,0,0,0,0,0,0,0,1.6,0,0,0.8,0.8,0,1.6,0,0,0,0,0,0.8,0,0,0,0,5.6,0,4.8,0,0,48,0,0,0,0,0,0,0,26.4,0,0,0,0,0,0,0,96,0,0,0,0,0,11.2,0,0,0,0,0.8,0,0,0,0,0,1.6,0,0,0,0,0,0,0,0,0,0,0,0,0,372,0,0,0,0,0,0,0,0,0,1.6,1.6,0,0,0,0,0,0,19.2,0,1.6,0,0,0,0,0,0,0,0,0,0,0,0.8,0,0,0,0,143.2,0,0,0,0,0,0,2.4,0,0,0,0,0,0,8.8,0,0,1.6,0
"HUN_022_MZB_LO_11","HUN_022_MZB_LO_11-03.10.2013","03.10.2013",2013,10,3,0,0,0,0,0,0,0,0,0,0,0,0,0,0,3.2,0,0,0,0,0,0,0,0,0,0,2.4,0,10.4,0,16.8,0,0,1.6,0,4.8,0,0,3.2,0,0,0,0,0,0,0,0,0.8,0,0,0,0.8,0,1.6,0,0,0,0,0,0,0,0,0,0,0.8,0.8,0,0,0,3.2,0,0,0.8,0,0,0,0,4.8,0,0,0,0,0,0,0,1296,0,0,0.8,0.8,0.8,0,0,0,0,0,0,0.8,0,0,0,0,0,0,0,0,0,0,0.8,0,0,0,0,0,0,0,984,0,0,0,0,0,0,0,0,0,4,0,0,0,0,2.4,0,0,0,0,1.6,0,0,0,0,0,0,0,0,0,0,0.8,0,0,0,0,0,4,0,0,0,0,0.8,0,0,0,0,0,0,0,0,4.8,0,0,0,0
"HUN_022_MZB_LO_11","HUN_022_MZB_LO_11-02.09.2015","02.09.2015",2015,9,2,0,0,0,0,0,0,0,0,0,0,0,0,0,0,0.8,0,0,3.2,0,0,0,0,0,0,1.6,6.4,0,0,0,92,0,0,0,0,1.6,0,0,17.6,0,0,0,0,0,0,0,0,4,0,0,1.6,0,0,1.6,0,3.2,0,0,0,0.8,0,0,0,0,0.8,0,0,0,0,7.2,0,0,0,0,0,0,0,0,0,0,0,0,0,0,0,84,0,0,0,1.6,0,0,0,0,0,0,0,0,0,0,0,0,0.8,0,0,0,0,0,0,0,0,0,0,0,0,0,256,0,0,0,0,0,0,0,0,0,4.8,0,0,0,0,8,0,0,0,0,0,0,0,0,0,0,0,0,0,0,0,0,0,0,0,0,0,4,0,0,0,0,0,0,4.8,0,0,0,0,0,0,8.8,2.4,0,0,0
"HUN_022_MZB_LO_11","HUN_022_MZB_LO_11-30.08.2016","30.08.2016",2016,8,30,0,0,0,0,0,0,0,36,0,0.8,0,0,0,0,0,0,0,0.8,0,0,0,0,0,0,1.6,0.8,0,0,0,1.6,0,0,0,0,168,0,0,0.8,0,0,0,0,0,0,0,0,1.6,0,0,0,0,0,0.8,0,0,0,0,0,0,0,0,0,0.8,51.2,0,0.8,0,0,12,0,0,0,0,0,0,0,18.4,0,0,0,0,0,0,0,60,0,0,0,0,0,0,0,0,0,0,0,0,0,0,0.8,0.8,0,0,0,0,0,0,0,0,0,0,0,0,0,0,74.4,0.8,0,0,0.8,0,0,0,0,0,0,0,0,0,0,0.8,0,0,4.8,0,0.8,0,0,0,0,0,0,0,0,0,0,0,0.8,0,0,0,0,2.4,0,0,0,0,0,0,3.2,0,0,0,0,0,0,2.4,0,0,0.8,0
"HUN_022_MZB_LO_12","HUN_022_MZB_LO_12-07.10.2007","07.10.2007",2007,10,7,0,0,0,0,0,0,0,76,0,0,0,0,0,0,12,0,0,0,0,6.4,0,0,0,0,0,0,0,0,0,4,0,0,0,0,0,0,0,0,0,0,0,0.8,0,0,0,0,0,0,0,0,0,0,4.8,0,0,0,0,0,0,0,0,0,0,56,0.8,0,0,0,4.8,0,0,3.2,0,0,0,0,44,0,0,0,0,0,0,0,0,0,0,0,63.2,0,0,0,0,0,0,3.2,0,0,0,0,4.8,0,0,0,0,0,0,0,0,0,0,0,0,0,0,8,0,0,0,0,0,0,0.8,6.4,0,0,0,0,0,0,0,0,0,0,0,16,0,3.2,0,0,4.8,0,0,0,0,0,0,4,0,0,0,0,0.8,0,0,0,0,0,0,0,0,0,0,0,0,6.4,0,0,0,0,0
"HUN_022_MZB_LO_12","HUN_022_MZB_LO_12-12.09.2008","12.09.2008",2008,9,12,0,0,0,0,1.6,0,0,40,0,0,0,0,0.8,5.6,128,0,0,0,0,9.6,0,0,0,0,2.4,0.8,0,0,0,80,0,0,0,0,0,0,0,0,0,0,0,0,0,0,0,0,0,0,0,0,0,0,4.8,0,0,0,0,0,0,0,0,0,0,100,0,0,0,0,4,0,0,0.8,0,0,0,0,32,0,0,0,0,0,0,0,2.4,0,0,0,27.2,0.8,0,0,0,0,0,0,0.8,5.6,0,0,8,0,0,0,0,0,0,0,0,0,0,0,0,0,0,320,0,0,0,0,0,0,0,0.8,0,0,0,0,0,0,0,0,0,0,0,11.2,0,3.2,0,0,0,0.8,0,0,0,6.4,0,6.4,0,0,0,0,0,0,0,0,0,0,0,0,0,0,0,0,0,0,0,0,0,0,0
"HUN_022_MZB_LO_12","HUN_022_MZB_LO_12-27.10.2009","27.10.2009",2009,10,27,0,0,0,0,0,0,0,3.2,0,0,0,0,0,1.6,4.8,0,0,0,0,18.4,0.8,0,0,0,0,0,0,0,0,14.4,0,0,0,0,0,0,0,0,0,0,0,0,0,0,0,0,0,0,0,0,0,0,0,0,0,0,0,0,0,0,0,0,0,468,0,0,0,0,1.6,0,0,0.8,0,0,0,0,12.8,0,0,0,0,0,0,0,0,0,0,0,15.2,0,0,0,0,0,0,0,0,0,0,0,3.2,0,0,0,0,0,0,0,0,0,0,0,0,0,0,25.6,0,0,0,0,0,0,0.8,0.8,0,0,0,0,0,0,0,0,0,0,0,0,0,0,0,0,0,0.8,0,0,0,0,0,2.4,0,0,0,0,0,0,0,0,0,0,0.8,0,0,0,0,0,0,0,0,0,0,0,0
"HUN_022_MZB_LO_12","HUN_022_MZB_LO_12-20.08.2010","20.08.2010",2010,8,20,0,0,0,0,0,0,0,128,0,0,0,0,0,2.666666667,0,0,0,0,0,21.33333333,0,0,0,0,0,0,0,0,0,0,0,0,0,0,0,0,0,0,0,0,0,0,0,0,0,0,0,0,0,0,0,0,0,0,0,0,0,0,0,0,0,0,0,77.33333333,0,0,0,0,2.666666667,0,0,0,0,0,0,0,21.333333337,0,0,0,0,0,0,0,0,0,0,0,16.000000003,0,0,0,0,0,0,2.666666667,0,5.333333333,0,0,56,0,0,0,0,0,0,0,0,0,0,0,0,0,0,21.33333333,0,0,0,0,0,0,0,0,0,0,0,0,0,0,0,0,0,0,0,0,0,0,0,0,0,0,0,0,0,2.666666667,0,0,0,0,0,0,0,0,0,0,0,0,0,0,0,0,0,0,0,0,0,0,0,0,0
"HUN_022_MZB_LO_12","HUN_022_MZB_LO_12-18.08.2011","18.08.2011",2011,8,18,0,0,0,0,27.2,0,0,41.6,0,0,0,0,1.6,3.2,11.2,0,0,0,0,22.4,0,0,0,0,8,0,0,0,0,3.2,0,0,0,0,0,0,0,0,0,0,0,0,0,0,0,0,0,0,0,0,0,0,0,0,0,0,0,0,0,0,0,0,0,1414.4,0,0,0,0,17.6,0,0,0,0,0,0,0,46.4,0,0,0,0,0,0,0,0,0,0,0,11.2,0,0,0,0,0,0,0,0,1.6,0,0,36.8,0,0,0,0,0,0,0,0,0,0,0,0,0,0,0,0,0,0,0,0,0,1.6,0,0,1.6,0,0,0,0,0,0,0,0,0,0,0,0,0,0,0,0,0,0,0,27.2,0,0,0,0,0,0,0,0,0,0,0,0,0,0,0,0,0,0,0,0,0,0,0,0,0
"HUN_022_MZB_LO_12","HUN_022_MZB_LO_12-30.08.2012","30.08.2012",2012,8,30,0,0,0,0,7.2,0,0,20,0,0,0,0,0.8,2.4,304,0,0,0,0,48,0,0,0,0,32,0,0,0.8,0,216,0,0,0,0,0,0,0,0,0,0,0,0,0,0,0,0,0,0,6.4,0.8,0,0,1.6,0,0,0,0,0,0,0,0,0,0,752,0,0,0,0,52.8,0,0,0.8,0,0,0,0,91.2,0,0,0,0,0,0,0,0,0,0,0,39.2,0.8,0,0,0,0,0,0,0,8.8,0,0.8,72,0,0,0,0,0,0,0,0,0,0,0,0,0,0,20,0,0,0,0,0,0,0,0.8,0,0.8,0,0,0,0,0,0,0,0,0,0,0,0,0,0,0,0.8,0,0,0,160,0,40,0,0,0,0,3.2,0,0,0,0,0.8,0,0,0,0,0,0,0,0,0,0,0,0,0
"HUN_022_MZB_LO_12","HUN_022_MZB_LO_12-12.09.2013","12.09.2013",2013,9,12,0,0,0,0,4,0,0,57.6,0,0,0,0,0,1.6,249.6,0,0,0,0,0,0,0,0,0,54.4,0.8,0,1.6,0,67.2,0,0,0,0,0,0,0,0,0,0,0,0,0,0,0,0,0,0,0,0,0.8,0,4,0,0,0,0,0,0,0,0,0,0,43.2,4.8,0,0,1.6,15.2,0,0,0.8,0,0,0,0,31.2,0,0,0,0,0,0,0,0,0,0,0.8,20,0.8,0,0,0,0,0,0,0,16,0,0,15.2,0,0,0,0,0,0,0,0,0,0,0,0,0,0,18.4,0,0,0,0,0,0,0,0.8,0,0.8,0,0,0,0,0,0,0,0,0,28,0,0,0,0,0,0,0,0,0,0,0,8.8,0,0,0,0,0,0,0,0,0,0,0,0,0,0,0,0.8,0,0,0,0,0,0,0
"HUN_022_MZB_LO_12","HUN_022_MZB_LO_12-26.08.2014","26.08.2014",2014,8,26,0,0,0,0,0,0,0,80,0,0,0,0,0,0,120,0,0,0,0,2.4,0,0,0,0,3.2,1.6,0,0,0,6.4,0,0.8,0,0,0,0,0,0,0,0,0,0,0,0,0,0,0,0,0.8,0,0,0,0.8,0,0,0,0,0,0,0,0,0,0,328,0,0,0,0,11.2,0,0,0,0,0,0,0,48,0,0,0,0,0,0,0,0,0,0,0,2.4,0,0,0,0,0,0,0,0.8,1.6,0,0,67.2,0,0,0,0,0,0,0,0,0,0,0,0,0,0,1.6,0,0,0,0,0,0,0,0,0,0,0,0,0,0,0,0,0,0,0,0,0,0,0,0,0,0,0,0,0,12,0,2.4,0,0,0,0,0,0,0,0,0,0,0,0,0,0,0,0,0,0,0,0,0,0,0
"HUN_022_MZB_LO_12","HUN_022_MZB_LO_12-15.09.2015","15.09.2015",2015,9,15,0,0,0,0,11.2,0,0,80,0,0,0,0,0,0,156,0,0,0,0,4,0,0,0,0,344,0.8,0,0.8,0,432,0,0,0,0,0,0,0,0,0,0,0.8,0,0,0,0,0,0,0,0.8,1.6,0,0,1.6,0,0,0,0,0,0,0,0,0,0,4,0.8,0,0,0,13.6,0,0,0,0,0,0,0,13.6,0,0,0,0,0,0,0,0,0,0,0,120,1.6,0,0,0,0,0,0,0,4.8,0,2.4,7.2,0,0.8,0,0,0,0,0,0,0,0.8,0,0,0,0,44,0,0,0,0,0,0,0,0,0,0,0,0,0,0,0,0,0,0,0,2.4,0,0,0,0,0,0.8,0,0,0,1.6,0,0.8,0,0,0,0,4.8,0,0,0,0,0,0,0,0,0,0,0,0,0,0,0,0,0,0
"HUN_022_MZB_LO_12","HUN_022_MZB_LO_12-19.09.2016","19.09.2016",2016,9,19,0,0,0,0,0.8,0,0,19.2,0,0,0,0,0.8,0,47.2,0,0,0,0,2.4,0,0,0,0,9.6,0,0,0.8,0,12.8,0,0,0,0,0,0,0,0,0,0,0,0,0,0,0,0,0,0,0,0,0,0,0.8,0,0,0,0,0,0,0,0,0,0,256,0,0,0,0,9.6,0,0,0,0,0,0,0,140.8,0,0,0,0,0,0,0,0,0,0,0,22.4,0.8,0,0,0,0,0,0,0,2.4,0,0,39.2,0,0,0,0,0,0,0,0,0,0,0,0,0,0,27.2,0,0,0,0,0,1.6,0,0,0,0,0,0,0,0,0,0,0,0,0,4.8,0,0.8,0,0,0,0,0,0,0,16.8,0,0,0,0,0,0,0.8,0,0,0,0,0,0,0,0,0,0,2.4,0,0,0,0,0,0,0
"HUN_022_MZB_LO_13","HUN_022_MZB_LO_13-02.09.2007","02.09.2007",2007,9,2,0,0,0,0,0,0,0,4,0,0,0,0,0,0,4.8,0,0,0,0,0,0,0,0,0,0.8,1.6,0,0,0,6.4,0,0,0,0,0,0,0,0,0,0,0,0,0,0,0,0,0,0,0,0,0.8,0,2.4,0,0,0,0,0,0,0,0,0,0,40,0.8,0,0,0,8.8,0,0,0.8,0,0,0,0,2.4,0,0,0,0,0,0,0,0,0,0,0,1.6,0,0,0,0,0,0,0,0,1.6,0,0,1.6,0,0,0,0,0,0,0,0,0,0,0,0,0,0,1.6,0,0,0,0,0,0,0,0,0,0,0,0,0,0,0,0,0,0,0,0,0,0.8,0,0,1.6,0,0,0,0,0,0,0,0,0,0,0,0.8,0,0,0,0,0,0,0,0,0,0,0,0,0,0,0,0,0,0
"HUN_022_MZB_LO_13","HUN_022_MZB_LO_13-09.09.2008","09.09.2008",2008,9,9,0,0,0,0,0,0,0,12,0,0,0,0,0,0.8,28,0,0,0,0,0,0,0,0,0,0.8,1.6,0,0.8,0,24,0,0,0,0,0,0,0,0,0,0,0,0,0,0,0,0,0,0,0,0,0,0,0.8,0,0,0,0,0,0,0,0,0,0,64,0,0,0.8,0.8,6.4,0,0,4,0,0,0,0,30.4,0,0,0,0,0,0,3.2,0,0,0,0,24.8,0,0,0,0,0,0,0,0.8,16,0,0,4,0,0,0,0,0,0,0,0,0,0,0,0,0,0,4,0,0,0,0,0,0,0,0,0,0,0,0,0,0,0,0,0,0,0,0,0,0,0,0,0,0,0,0,0,8,0,1.6,0,0,0,0,0,0,0,0,0,0,0,0,0,0,0,0,0,0,0,0,0,0,0
"HUN_022_MZB_LO_13","HUN_022_MZB_LO_13-24.08.2009","24.08.2009",2009,8,24,0,0,0,0,0,0,0,4,0,0,0,0,0,0.8,45.6,0,0,0,0,0,0,0,0,0,0.8,3.2,0,0,0,4.8,0,0,0,0,0,0,0,0,0,0,0,0,0,0,0,0,0,0,0,0,0.8,0,0,0,0,0,0,0,0,0,0,0,0,136,1.6,0,0,0,0.8,0,0,0,0,0,0,0,8.8,0,0,0,0,0,0,0,0,0,0,0,8.8,0,0,0,0,0,0,0,0,0,0,0,8.8,0,0,0,0,0,0,0,0,0,0,0,0,0,0,5.6,0,0,0,0,0,0,0,0.8,0,0,0,0,0,0,0,0,0,0,0,0,0,0,0,0,0,0,0,0,0,10.4,0,0.8,0,0,0,0,0,0,0,0,0,0,0,0,0,0,0,3.2,0,0,0,0,0,0,0
"HUN_022_MZB_LO_13","HUN_022_MZB_LO_13-20.08.2010","20.08.2010",2010,8,20,0,0,0,0,3.555555556,0,0,0,0,0,0,0,0,0,47.999999998,0,0,0,0,1.777777778,0,0,0,0,0,7.111111111,0,0,0,5.333333333,0,0,0,0,0,0,0,0,0,0,0,0,0,0,0,0,0,0,0,0,3.555555556,0,1.777777778,0,0,0,0,0,0,0,0,0,0,544,0,0,0,0,5.333333334,0,0,0,0,0,0,0,71.111111113,0,0,0,0,0,0,0,0,0,0,0,12.444444448,0,0,0,0,0,0,0,0,3.555555556,0,7.111111112,1.777777778,0,0,0,0,0,0,0,0,0,0,0,0,0,0,1.777777778,0,0,0,0,0,0,0,0,0,0,0,0,0,0,0,0,0,0,0,0,0,0,0,0,0,0,0,0,0,46.22222222,0,3.555555556,0,0,0,0,0,0,0,0,0,0,0,0,0,0,0,0,0,0,0,0,0,0,0
"HUN_022_MZB_LO_13","HUN_022_MZB_LO_13-18.08.2011","18.08.2011",2011,8,18,0,0,0,0,0,0,0,0,0,0,0,0,0,0,30.4,0,0,0,0,0,0,0,0,0,1.6,16,0,0,0,6.4,0,0,0,0,0,0,0,0,0,0,0,0,0,0,0,0,0,0,0,0,3.2,0,0,0,0,0,0,0,0,0,0,0,0,209.6,0,0,0,0,6.4,0,0,0,0,0,0,0,25.6,0,0,0,0,0,0,0,0,0,0,0,3.2,0,0,0,0,0,0,0,0,3.2,0,14.4,0,0,0,0,0,0,0,0,0,0,0,0,0,0,0,0,0,0,0,0,0,0,0,0,0,0,0,0,0,0,0,0,0,0,0,0,0,0,0,0,0,0,0,0,0,4.8,0,3.2,0,0,0,0,0,0,0,0,0,1.6,0,0,0,0,0,0,0,0,0,0,0,0,0
"HUN_022_MZB_LO_13","HUN_022_MZB_LO_13-04.10.2012","04.10.2012",2012,10,4,0,0,0,0,0.8,0,0,25.6,0,0,0,0,0,1.6,58.4,0,0,0,0,0,0,0,0,0,0.8,17.6,0,1.6,0,24,1.6,0,0,0,0,0,0,0,0,0,0,0,0.8,0,0,0,0,0,1.6,1.6,10.4,0,2.4,0,4.8,0,0,0,0.8,0,0,0,0,16,0,0,0,0.8,31.2,0,0,0.8,0,0,0,0,41.6,0,0,0,0,0,0,0,0,0,0,0,49.6,0.8,0,0,0,0,0,3.2,8.8,0,0,0.8,6.4,0,0,0,0,0,0,0,0,0,0,0,0,0,0,33.6,0,0,0,0,0,0,0,0,0,3.2,0,0,0,0,1.6,0,0,0,0,0,0,3.2,0,0,0,0,0,0,0,3.2,0,3.2,0,0,0,0,2.4,0,0,0,0,4.8,0,0,0,0,0,3.2,0,0,0,0,0,0,0
"HUN_022_MZB_LO_13","HUN_022_MZB_LO_13-12.09.2013","12.09.2013",2013,9,12,0,0,0,0,1.6,0,0,3.2,0,0,0,0,0,0.8,34.4,0,0,0,0,0,0,0,0,0,0,17.6,0,0,0,36,0,0,0,0,0,0,0,0,0,0,0,0,0,0,0,0,0,0,4,0.8,7.2,0,6.4,0,2.4,0,0,0,0,0,0,0,0,67.2,0,0,0,1.6,48,0,0,1.6,0,0,0,0,34.4,0,0,0,0,0,0,4,0,0,0,0,19.2,2.4,0,0,0,0,0,2.4,4.8,4,0,3.2,8,0,0,0,0,0,0,0,0,0,0,0,0,0,0,24,0,0,0,0,0,0,0,0,0,0,0,0,0,0,0,0,0,0,0,0,0,0,0,0,0,0,0,0,0,3.2,0,0.8,0,0,0,0,0,0,0,0,0,0.8,0,0,0,0,0,0,0,0,0,0,0,0,0
"HUN_022_MZB_LO_13","HUN_022_MZB_LO_13-26.08.2014","26.08.2014",2014,8,26,0,0,0,0,2.4,0,0,43.2,0,0,0,0,0.8,0.8,43.2,0,0,0,0,0.8,0,0,0,0,0.8,1.6,0,0,0,4.8,0,0,0,0,0,0,0,0,0,0,0,0,0,0,0,0,0,0,0,0,0,0,0.8,0,0,9.6,0,0,0,0,0,0,0,74.4,0,0,0,0,10.4,0,0,0,0,0,0,0,51.2,0,0,0,0,0,0,0,0,0,0,0,55.2,0,0,0,0,0,0,0,0,4,0,0,25.6,0,0,0,0,0,0,0,0,0,0,0,0,0,0,4,0,0,0,0,0,0,0,0,0,0,0,0,0,0,0,0,0,0,0,0,0,0,0,0,0,0,0,0,0,72,0,1.6,0,0,0,0,0,0,0,0,0,0,0,0,0,0,0,0,0,0,0,0,0,0,0
"HUN_022_MZB_LO_13","HUN_022_MZB_LO_13-15.09.2015","15.09.2015",2015,9,15,0,0,0,0,4,0,0,32,0,0,0,0,0,0,49.6,0,0,0,0,0,0,0,0,0,4,7.2,0,0.8,0,72,0,0,0,0,0,0,0,0,0,0,0,0,0,0,0,0,0,0,0.8,0,0,0,4.8,0,1.6,0,0,0,0,0,0,0,0,200,0,0,0,0,16,0,0,0,0,0,0,0,32.8,0,0,0,0,0,0,0.8,0,0,0,0,5.6,3.2,0,0,0,0,0,0.8,6.4,8.8,0,2.4,8,0,0,0,0,0,0,0,0,0,0,0,0,0,0,60,0,0,0,0,0,0,0,0,0,0,0,0,0,0,3.2,0,0,4,0,0,0,0,0,0,0,0,0,0,0,3.2,0,0,0,0,0,0,0,0,0,0,0,0.8,0,0,0,0,0,0,0,0,0,0,0,0,0
"HUN_022_MZB_LO_13","HUN_022_MZB_LO_13-20.09.2016","20.09.2016",2016,9,20,0,0.8,0,0,2.4,0,0,3.2,0,0,0,0,0,0,40,0,0,0,0,0,0,0,0,0,0,1.6,0,0.8,0,1.6,0,0,0,0,0,0,0,0,0,0,0.8,0,0,0,0,0,0,0,3.2,0,0,0,2.4,0,0,0,0,0,0,0,0,0,0,1176,0.8,0,0,0,17.6,0,0,1.6,0,0,0,0,110.4,0,0,0,0,0,0,1.6,0,0,0,0,40,0,0,0,0,0,0,0,8.8,1.6,0,0,2.4,0,0,0,0,0,0,0,0,0,0.8,0,0,0,0,192,0,0,0,0,0,0,0,1.6,0,0,0,0,0,0,0,0,0,0.8,0,0,0,0.8,0,0,0,0,0,0,0,12,0,1.6,0,0,0,0,0,0,0,0,0,0,0,0,0,0,0,0,0,0,0,0,0,0,0
"HUN_022_MZB_LO_14","HUN_022_MZB_LO_14-16.10.2000","16.10.2000",2000,10,16,0,0,0,0,0,0,0,1.6,0,0,0,0,0,0,0,0,0,1.6,0,0,0,0,0,0,0,0,0,0,0,0,0,0,1.6,0,0,0,3.2,0,0,0,0,0,0,0,0,0,0,0,0,0,0,0,0,0,0,0,0,0,1.6,0,0,0,0,1.6,0,0,0,0,0,0,0,0,0,0,0,0,0,0,0,0,0,0,0,0,0,0,0,0,1.6,0,0,0,0,0,0,0,0,0,0,1.6,0,3.2,0,0,0,0,0,0,0,0,0,0,0,0,0,1.6,0,0,0,0,0,0,0,0,0,0,0,0,0,0,1.6,0,0,0,0,0,0,0,0,0,0,0,0,0,0,0,0,0,0,0,0,0,0,0,0,0,0,0,0,0,0,0,0,0,0,0,1.6,1.6,0,0,0
"HUN_022_MZB_LO_14","HUN_022_MZB_LO_14-03.09.2001","03.09.2001",2001,9,3,0,0,1.6,0,0,0,1.6,0,0,0,0,0,0,0,0,0,0,0,0,0,0,0,0,0,0,0,0,0,0,1.6,0,0,1.6,0,0,0,0,0,0,0,0,0,0,0,0,0,0,0,0,0,0,0,0,0,0,0,0,0,1.6,0,0,0,0,0,1.6,1.6,0,0,0,0,0,0,0,1.6,0,0,0,0,0,0,0,0,0,0,3.2,0,0,0,0,0,0,0,0,1.6,0,0,0,0,0,0,0,0,0,0,0,0,0,0,0,0,0,0,0,0,0,0,0,0,0,0,0,0,0,0,0,1.6,0,0,0,1.6,0,0,0,0,0,0,0,0,0,0,0,0,0,0,0,0,1.6,0,0,0,0,0,0,0,0,0,0,1.6,0,0,0,0,0,0,0,0,0,1.6,0,0,0
"HUN_022_MZB_LO_14","HUN_022_MZB_LO_14-16.10.2002","16.10.2002",2002,10,16,0,0,0,0,0,0,0,0,0,0,0,0,0,0,1.6,0,0,1.6,0,0,0,0,0,0,1.6,0,0,0,0,1.6,0,0,1.6,0,0,0,1.6,0,0,0,0,0,0,0,0,0,0,0,0,0,0,0,0,0,0,0,0,0,1.6,0,0,0,0,0,0,3.2,0,0,0,0,1.6,0,0,1.6,0,0,0,0,0,0,0,0,0,0,1.6,0,0,0,0,0,0,0,0,0,0,0,0,0,0,0,0,3.2,0,0,0,0,0,0,1.6,0,0,0,0,0,0,0,0,0,0,0,0,0,0,0,0,0,0,0,1.6,0,0,0,0,0,0,0,0,0,0,0,0,0,0,0,0,0,0,0,0,0,0,0,1.6,0,0,0,0,0,0,0,0,0,0,0,0,0,0,1.6,0,0,0
"HUN_022_MZB_LO_14","HUN_022_MZB_LO_14-20.10.2004","20.10.2004",2004,10,20,0,0,3.2,0,0,0,0,0,0,0,0,1.6,0,0,1.6,0,0,1.6,0,0,0,0,0,0,3.2,1.6,0,0,0,1.6,0,0,1.6,0,0,0,0,0,0,0,0,0,0,0,0,0,0,0,0,0,1.6,0,0,0,0,0,0,0,0,0,0,0,0,1.6,1.6,1.6,0,0,0,0,1.6,0,0,1.6,0,0,0,0,0,0,0,0,0,0,0,0,0,0,3.2,1.6,0,0,0,0,0,1.6,0,0,0,0,0,0,0,0,0,0,0,0,1.6,0,0,0,0,0,0,1.6,0,0,0,0,0,0,0,0,0,0,0,0,1.6,0,1.6,0,0,0,0,0,0,0,0,0,0,0,0,0,0,0,1.6,0,0,0,0,0,3.2,0,0,0,0,0,0,0,0,0,0,0,0,0,1.6,0,0,0,0
"HUN_022_MZB_LO_14","HUN_022_MZB_LO_14-07.09.2005","07.09.2005",2005,9,7,0,0,0,0,0,0,0,0,0,0,0,3.2,0,0,0,0,0,4.8,0,0,0,0,0,0,0,19.2,0,0,0,8,0,0,3.2,0,0,0,1.6,0,0,0,0,0,0,0,0,0,0,0,0,0,0,0,0,0,1.6,0,0,0,1.6,0,0,0,0,20.8,0,1.6,0,0,0,0,0,0,0,4.8,0,0,0,0,0,0,0,0,0,0,0,0,0,0,4.8,0,0,0,0,0,0,1.6,0,0,3.2,0,0,6.4,0,0,0,0,0,0,1.6,0,0,0,0,0,0,3.2,0,0,0,0,0,0,0,0,0,0,0,0,1.6,0,32,0,0,16,0,0,0,0,0,0,0,0,0,0,0,0,6.4,4.8,0,0,0,0,3.2,0,0,0,0,0,0,0,0,0,0,0,0,1.6,0,3.2,0,0,0
"HUN_022_MZB_LO_14","HUN_022_MZB_LO_14-21.09.2006","21.09.2006",2006,9,21,0,0,3.2,0,0,0,0,0,0,0,0,3.2,0,0,11.2,0,1.6,32,0,0,0,0,0,0,1.6,1.6,0,0,0,9.6,0,0,11.2,0,0,0,0,0,0,0,0,0,0,0,0,0,0,0,0,0,12.8,0,0,0,17.6,0,0,0,1.6,0,0,0,0,1.6,1.6,3.2,0,0,0,0,1.6,0,0,4.8,0,0,0,0,0,0,0,0,0,0,0,0,0,0,0,0,0,0,0,1.6,0,11.2,0,0,1.6,0,0,0,0,0,0,0,0,0,1.6,0,0,0,0,1.6,0,1.6,0,0,0,0,0,0,0,0,0,54.4,3.2,3.2,4.8,0,3.2,0,0,0,0,0,0,0,0,0,0,0,0,0,0,0,4.8,0,0,0,0,0,20.8,0,0,0,0,3.2,0,0,0,0,0,0,0,0,1.6,4.8,0,0,0
"HUN_022_MZB_LO_14","HUN_022_MZB_LO_14-24.09.2007","24.09.2007",2007,9,24,0,0,0,0,0,0,0,0,0,0,0,0,0,0,0,0,0,24,0,0,0,0,0,0,0,16,0,0,0,40,0,0,11.2,0,0,0,0,0,0,0,0,0,0,0,0,0,0,0,0,0,1.6,0,0,0,8,0,0,0,8,0,0,0,0,1.6,1.6,1.6,0,0,0,0,0,0,0,4.8,0,0,0,0,0,0,0,0,0,0,0,0,0,0,0,3.2,0,0,0,0,0,4.8,0,0,1.6,0,0,4.8,0,0,0,0,0,0,0,0,0,0,0,0,0,8,0,0,0,0,0,0,0,0,0,1.6,0,0,1.6,0,14.4,0,0,0,0,0,0,0,0,0,0,0,0,0,0,0,1.6,0,0,0,0,0,14.4,0,1.6,0,0,1.6,0,0,0,0,0,0,0,0,0,0,0,0,0
"HUN_022_MZB_LO_14","HUN_022_MZB_LO_14-04.09.2008","04.09.2008",2008,9,4,0,0,0,0,0,0,0,0,0,0,0,0,0,0,4.266666667,2.133333333,1.066666667,64,0,0,0,0,0,0,1.066666667,3.2,0,0,0,5.333333333,0,0,5.333333333,0,0,0,0,0,0,0,0,0,0,0,0,0,0,0,0,0,3.2,0,0,0,27.73333333,0,0,0,4.266666667,0,0,0,0,0,1.066666667,0,0,0,0,0,85.33333333,0,0,1.066666667,0,0,0,0,0,0,0,0,0,0,0,0,0,1.066666667,0,2.133333334,0,0,0,0,0,2.133333333,0,0,1.066666667,2.133333333,0,5.333333333,0,0,0,0,0,0,1.066666667,0,0,0,0,0,0,0,0,0,0,0,0,0,0,0,1.066666667,10.66666667,0,0,1.066666667,0,6.4,1.066666667,0,0,0,0,0,0,0,0,0,0,0,0,0,0,2.133333333,0,0,0,0,0,5.333333333,0,0,0,0,1.066666667,0,0,0,0,0,0,0,0,1.066666667,53.33333333,0,0,0
"HUN_022_MZB_LO_14","HUN_022_MZB_LO_14-09.10.2009","09.10.2009",2009,10,9,0,0,6.4,0,0,0,0,0,0,0,0,0,0,0,544,0,1.6,9.6,0,0,0,0,0,0,104,52.8,0,0,0,256,0,0,38.4,0,0,0,1.6,0,0,0,0,0,0,3.2,0,0,0,0,0,0,4.8,0,0,0,12.8,0,0,0,17.6,0,0,0,0,14.4,3.2,1.6,0,0,1.6,0,30.4,0,0,3.2,0,0,0,0,0,0,0,0,0,0,0,0,0,0,83.2,6.4,0,0,0,4.8,0,6.4,0,0,3.2,0,0,30.4,0,0,0,0,0,0,0,0,0,0,0,0,0,0,0,0,0,0,0,0,0,0,1.6,3.2,6.4,0,0,0,9.6,0,0,17.6,0,0,0,0,0,0,0,0,0,0,0,0,0,12.8,0,0,0,0,30.4,0,0,0,0,1.6,0,0,0,0,0,0,0,0,6.4,1.6,0,0,0
"HUN_022_MZB_LO_14","HUN_022_MZB_LO_14-15.10.2010","15.10.2010",2010,10,15,0,0,0,0,0,0,0,0,0,0,0,0,0,0,0,0,3.2,2.4,0,0,0,0,0,0,0,2.4,0,0,0,0.8,0,0,1.6,0,0,0,0,0,0,0,0,0,0,0,0,0,0,0,0,0,0.8,0,0,0,3.2,0,0,0,1.6,0,0,0,0,4.8,0,3.2,0,0,0,0,0,0,0,0,0,0,0,0,0,0,0,0,0,0,0,0,0,0,16.8,0,0,0,0,0,0,0,0,0,0,0,0,0,0,0,0,0,0,0,0,0,0,0,0,0,0,312,0,0,0,0,0,0,0,0,0,0,0,0,0,0,4.8,0,0,0,0,0,0,0,0,0,0,0,0,0,0,0,0.8,1.6,0,0,0,0,6.4,0,0,1.6,0,2.4,0,0,0,0,0,0,0,0,0,0.8,0,0,0
"HUN_022_MZB_LO_14","HUN_022_MZB_LO_14-30.08.2011","30.08.2011",2011,8,30,0,0,0,0,0,0,0,0,0,0,0,0,0,0,70.4,0,0.8,3.2,0,0,0,0,0,0,8,8.8,0,0,0,912,0,0,0.8,0,0,0,0.8,0,0,0.8,0,0,0,0,0,0,0,0,0,0,4.8,0,0.8,0,6.4,0,0,0,2.4,0,0,0,0,49.6,0.8,0,0,0,1.6,0,0,0,0,3.2,0,0,0.8,0,0,0,0,0,0,0,0,0,0,0,5.6,0,0,0,0,0,0,7.2,0,0,0,0,0,2.4,0,0,0,0,0,0,0,0,0,0.8,0,0,0,312,0,0,0,0,0,0,0,0,0,0,0,0,0,3.2,2.4,0,0,0.8,0.8,0,0,0,0,0,0,0,0,0,0,0,4,0,0,0,3.2,0,29.6,0,0,0,0,0.8,0,0,0,0,0,0,0,0,0.8,0,0,0,0
"HUN_022_MZB_LO_14","HUN_022_MZB_LO_14-23.09.2013","23.09.2013",2013,9,23,0,0,2.4,0,0,0,0,0,0,0,0,0,0,0,42.4,0,0,48,0,0,0,0,0,0,14.4,120,0,0,0,76.8,0,0,8.8,0,0,0,0.8,0,0,0,0,0,0,0,0.8,0,0,0,0,0,4.8,0,2.4,0,12.8,0,0,0,7.2,0,0,0,0,12,2.4,0,0,1.6,4.8,0,2.4,0,0,24.8,0,0,0,0,0,0,0,0,0,0,0,0,0,0,5.6,86.4,0,0,0,0,0,4,0,0,0.8,0.8,0,8.8,0,0,1.6,0,0,0,0,0,0,0,0,0,0,0.8,0,0,0,0,0,0,0,0,0.8,2.4,0,0,0,0,21.6,0,0,5.6,0.8,0,0,0,0,0,0,0,0,0,0,0,0.8,136,0,0,5.6,0,5.6,0,0,0,0,0.8,0,0,0,0,0,0,0,0,1.6,0.8,0,0,0
"HUN_022_MZB_LO_14","HUN_022_MZB_LO_14-08.10.2014","08.10.2014",2014,10,8,0,0,0.8,0,0,0,0,0,0,0,0,2.4,0,0,72,0,7.2,38.4,0,0,0,0,0,0,8.8,52,0,0,0,1.6,0,0,13.6,0,0,0,0,0,0,0,0,0,0,0,0,0,0,0,0,0,0.8,0,0,0,8.8,0,0,0,24,0,0,0,0,86.4,0,2.4,0,0,1.6,0,1.6,0.8,0,4,0,0,0,0,0,0,0,0,0,0,0,0,0,0,5.6,0.8,0,0,0,0,0,0,0,0,6.4,0,0,3.2,0,0,0,0,0,0,0,0,0,0,0,0,0,1.6,0,0,0,0,0,0,0,0,0,12.8,1.6,0,0,0,48,0,0,11.2,0.8,0,0,0,0,0,0,0,0,0,0,0,1.6,76,0,0,0,0,4.8,0,0.8,0,0,0.8,0,0,0,0,0,0,0,0,0,4.8,0,0,0
"HUN_022_MZB_LO_14","HUN_022_MZB_LO_14-08.09.2015","08.09.2015",2015,9,8,0,0,0.8,0,0,0,0,0,0,0,0,0,0,0,25.6,0,0,3.2,0,0,0,0,0,0,0,128,0,0,0,348,0,0,3.2,0,0,0,0.8,0,0,2.4,0,0,0,0,0,0,0,0,0,0,0.8,0,0.8,0,120,0,0,0,3.2,0,0,0,0,9.6,1.6,0,0,0,0.8,0,2.4,0.8,0,0.8,0,0,0.8,0,0,0,0,0,0,0,0,0,0,0,4,5.6,0,0,0,0.8,0,0,0,0,2.4,0,0.8,2.4,0,0,0,0,0,0,0.8,0,0,0,0,0,0,0.8,0,0,0,0,0,0,0,0,0.8,0,1.6,0,0,0,33.6,0,0,3.2,0,0,0,0,0,0,0,0,0,0,0,0,2.4,0.8,0,0,0,0,5.6,0,0.8,0,0,0,0,0,0,0,0,0,0,0,0,0.8,0,0,0
"HUN_022_MZB_LO_14","HUN_022_MZB_LO_14-17.08.2016","17.08.2016",2016,8,17,0,0,1.6,0,0,0,0,0,0,0,0,0.8,0,0,147.2,0,0,26.4,0,0,0,0,0,0,0.8,72,0,0,0,64,0,0,14.4,0,0,0,0,0,0,0,0,0,0,0,0,0,0,0,0,0.8,1.6,0,0,0,28.8,0,0,0,1.6,0,0,0,0,96,1.6,0,0,0,0,0,14.4,0,0.8,0,0,0,0,0,0,0,0,0,0,0,0,0,0,2.4,9.6,3.2,0,0,0,0,0,0.8,0,0,1.6,2.4,0,4,0,0,0,0,0,0,3.2,0,0,0,2.4,0.8,0,0,0,0,0,0,0,0,0,0,0,19.2,0,0,0,0,4,0,0,4,0,0,0,0,0,0.8,0,0,0,0,0,0,0,8.8,0,0,0,0,2.4,0,0,0,0,0,0,0,0,0,0.8,0,0,0,0.8,0,0,0,0
"HUN_022_MZB_LO_15","HUN_022_MZB_LO_15-21.09.2000","21.09.2000",2000,9,21,0,0,0,0,0,0,0,0,0,0,0,1.6,0,0,1.6,0,0,1.6,0,0,0,0,0,0,0,1.6,0,0,0,1.6,0,0,0,0,0,0,0,0,0,0,0,0,0,0,0,0,0,0,0,0,0,0,0,0,0,0,0,0,1.6,0,0,0,0,0,0,1.6,0,0,0,0,0,0,0,0,0,0,0,0,0,0,0,0,0,0,0,0,0,0,1.6,0,0,0,0,0,0,0,0,0,0,0,0,4.8,0,0,0,0,0,0,0,0,0,0,0,0,0,0,0,0,0,0,0,0,0,0,0,1.6,0,0,1.6,1.6,1.6,0,0,0,0,0,0,0,0,0,0,0,0,0,0,0,0,0,0,0,0,0,3.2,0,0,0,0,1.6,0,0,0,0,0,0,0,0,0,0,0,0,0
"HUN_022_MZB_LO_15","HUN_022_MZB_LO_15-17.09.2001","17.09.2001",2001,9,17,0,0,0,0,0,0,0,0,0,0,0,1.6,0,0,0,0,0,1.6,0,0,0,0,0,0,0,0,0,0,0,1.6,0,0,0,0,0,0,0,0,0,0,0,0,0,0,0,0,0,0,0,0,0,0,0,0,0,0,0,0,1.6,0,0,0,0,0,0,3.2,0,0,0,0,0,0,0,0,0,0,0,0,0,0,0,0,0,0,0,0,0,0,0,0,0,0,0,0,0,0,0,0,0,0,0,1.6,0,0,0,0,0,0,0,0,0,0,0,0,0,0,0,0,0,0,0,0,0,0,0,0,0,0,1.6,1.6,0,0,0,0,0,0,0,0,0,0,0,0,0,0,0,0,0,0,0,0,0,0,3.2,0,0,0,0,1.6,0,0,0,0,0,0,0,0,1.6,1.6,0,0,0
"HUN_022_MZB_LO_15","HUN_022_MZB_LO_15-21.10.2002","21.10.2002",2002,10,21,0,0,0,0,0,0,0,0,0,0,0,1.6,0,0,0,0,0,1.6,0,0,0,0,0,0,0,0,0,1.6,0,1.6,0,0,1.6,0,0,0,0,0,0,0,0,0,0,0,0,0,0,0,0,0,1.6,0,0,0,0,0,0,0,3.2,0,0,0,0,0,1.6,3.2,0,0,0,0,0,0,0,1.6,0,0,0,0,0,0,0,0,0,0,0,0,0,0,0,0,0,0,0,0,0,0,0,0,1.6,0,0,0,0,0,0,0,0,0,0,0,0,0,0,0,0,1.6,0,0,0,0,0,0,0,0,0,0,0,0,0,1.6,0,0,0,0,0,0,0,0,0,0,0,0,0,0,0,0,0,1.6,0,0,0,0,3.2,0,0,0,0,0,0,0,0,0,0,0,0,0,0,0,0,0,0
"HUN_022_MZB_LO_15","HUN_022_MZB_LO_15-29.10.2003","29.10.2003",2003,10,29,0,0,0,0,0,0,0,0,0,0,0,1.6,0,0,1.6,0,0,1.6,0,0,0,0,0,0,0,0,0,1.6,0,1.6,0,0,0,0,0,0,0,0,0,0,0,0,0,0,0,0,0,0,0,0,0,0,0,0,0,0,0,0,1.6,0,0,0,0,0,0,4.8,0,0,0,0,0,0,0,0,0,0,0,0,0,0,0,0,0,0,0,0,0,0,0,0,0,0,0,0,0,0,0,0,0,0,0,1.6,0,0,0,0,0,0,1.6,0,0,0,0,0,0,1.6,0,0,0,0,0,0,0,0,0,0,0,0,1.6,1.6,0,0,0,0,0,0,0,0,0,0,0,0,0,0,0,0,0,1.6,0,0,0,0,3.2,0,0,0,0,1.6,0,0,0,0,0,1.6,0,0,1.6,0,0,0,0
"HUN_022_MZB_LO_15","HUN_022_MZB_LO_15-28.09.2004","28.09.2004",2004,9,28,0,0,0,0,0,0,0,0,0,0,0,1.6,0,0,0,0,0,1.6,0,0,0,0,0,0,0,1.6,0,0,0,1.6,0,0,1.6,0,0,0,1.6,0,0,0,0,0,1.6,0,0,0,0,0,0,0,0,0,0,0,0,0,0,0,3.2,0,0,0,0,0,0,3.2,0,0,0,0,1.6,0,0,3.2,0,0,0,0,0,0,0,0,0,0,0,0,0,0,0,0,0,0,0,0,0,0,0,0,0,0,0,4.8,0,0,0,0,0,0,1.6,0,0,0,0,0,0,0,0,0,0,0,0,0,0,0,0,0,0,0,1.6,1.6,0,0,0,0,0,0,0,0,0,0,0,0,0,0,0,0,0,0,0,0,0,0,3.2,0,0,0,0,1.6,0,0,0,0,0,0,0,0,1.6,1.6,0,0,0
"HUN_022_MZB_LO_15","HUN_022_MZB_LO_15-21.09.2005","21.09.2005",2005,9,21,0,0,0,0,0,0,0,0,0,0,0,1.6,0,0,3.2,0,0,3.2,0,0,0,0,0,0,0,3.2,0,0,0,6.4,0,0,59.2,0,0,0,0,0,0,0,0,0,0,0,0,0,0,0,0,0,0,0,0,0,0,0,0,0,4.8,0,0,0,0,0,3.2,6.4,0,0,0,0,0,0,0,6.4,0,0,0,0,0,0,0,0,0,0,0,0,0,0,0,0,0,0,0,3.2,0,1.6,0,0,0,0,0,9.6,0,0,0,0,0,0,4.8,0,0,1.6,0,0,0,4.8,0,0,0,0,0,0,0,0,0,0,1.6,0,3.2,3.2,0,0,0,0,0,0,0,0,0,0,0,0,0,0,0,0,0,1.6,0,0,0,0,0,0,0,0,0,0,0,0,0,0,0,1.6,0,0,3.2,3.2,0,0,0
"HUN_022_MZB_LO_15","HUN_022_MZB_LO_15-31.08.2006","31.08.2006",2006,8,31,0,0,0,0,0,0,0,0,0,0,0,193.6,0,0,54.4,0,0,1.6,0,0,0,0,0,0,8,0,0,0,0,3.2,0,0,35.2,0,0,0,1.6,0,0,0,0,0,0,0,0,0,0,0,0,0,0,0,0,0,0,0,0,0,54.4,0,0,0,0,0,1.6,1.6,0,0,0,0,0,0,0,8,0,0,0,0,0,0,0,0,0,0,0,0,0,0,3.2,0,0,0,0,0,0,0,0,0,0,0,0,1.6,0,0,0,0,0,0,4.8,0,0,1.6,0,0,0,16,0,0,0,0,0,0,0,0,0,0,3.2,0,0,0,4.8,0,0,0,0,0,0,0,0,0,0,0,0,0,0,0,0,16,0,0,0,0,3.2,0,0,0,0,1.6,0,0,0,0,0,0,0,0,0,11.2,0,0,0
"HUN_022_MZB_LO_15","HUN_022_MZB_LO_15-14.09.2007","14.09.2007",2007,9,14,0,0,0,0,0,0,0,0,0,0,0,240,0,0,72,0,0,1.6,0,0,0,0,0,0,0,0,0,8,0,48,0,0,52,0,0,0,1.6,0,0,0,0,0,0,0,0,0,0,0,0,0,0,0,0,0,0,0,0,0,8,0,0,0,0,0,3.2,10.4,0,0,0,0,0,0,0,10.4,0,0,0,0,0,0,0,0,0,0,0,0,0,0,8,0,0,0,0,0,0,20,0,0,3.2,0,0,3.2,0,0,0,0,0,0,1.6,0,0,0,0,0,0,88,0,0,0,0,0,0,0,0,0,0,0,0.8,0.8,0,0,0,0,0,0,0,0,0,0,0.8,0,0,0,0,0,0,12,0,0,0,0,0,6.4,0,0,8,0,0,0,0,0,0,0,0,0,0,0,0.8,0,0,0
"HUN_022_MZB_LO_15","HUN_022_MZB_LO_15-12.09.2008","12.09.2008",2008,9,12,0,0,0,0,0,0,0,0,0,0,0,240,0,0,80,0,0,9.6,0,0,0,0,0,0,48,0,0,0,0,208,0,0,8,0,0,0,1.6,0,0,0,0,0,0,0,0,0,0,0,0,0,0,0,0,0,0,0,0,0,40,0,0,0,0,1.6,3.2,25.6,0,0,0,0,1.6,0,0,14.4,0,0,0,0,0,0,0,0,0,0,0,0,0,0,0,0,0,0,0,1.6,0,0,0,0,8,0,0,3.2,0,0,0,0,0,0,4.8,0,0,1.6,0,1.6,0,320,0,0,0,0,0,0,0,0,0,0,3.2,16,1.6,1.6,0,0,0,0,0,0,0,0,0,1.6,0,0,0,0,0,0,9.6,0,0,0,0,0,140.8,0,0,0,0,0,0,0,0,0,0,0,0,0,1.6,12.8,0,0,0
"HUN_022_MZB_LO_15","HUN_022_MZB_LO_15-16.09.2009","16.09.2009",2009,9,16,0,0,0,0,0,0,0,0,0,0,0,700,0,0,104,0,0,9.333333333,0,0,0,0,0,0,1.333333333,0,0,20,0,186.6666667,0,0,10.666666666,0,0,0,2.666666667,0,0,0,0,0,0,0,0,0,0,0,0,0,1.333333333,0,0,0,0,0,0,0,133.3333333,0,0,0,0,0,6.666666667,587.999999963,0,0,0,0,0,0,0,37.333333333,0,0,0,0,0,0,0,0,0,0,0,0,0,1.333333333,10.66666667,0,0,0,0,0,0,4,0,0,0,1.333333333,0,4,0,0,0,0,0,0,1.333333333,0,0,0,1.333333333,1.333333333,0,426.6666667,0,0,0,0,0,0,0,0,2.666666667,0,4,40,1.333333333,0,1.333333333,0,0,0,0,0,0,0,0,1.333333333,0,0,0,0,0,0,0,4,0,0,0,0,41.333333333,0,0,0,0,0,0,0,0,0,0,0,0,0,1.333333333,0,0,0,0
"HUN_022_MZB_LO_15","HUN_022_MZB_LO_15-26.08.2010","26.08.2010",2010,8,26,0,0,0,0,0,0,0,0,0,0,0,8.8,0,0,45.6,0,0.8,8.8,0,0,0,0,0,0,0,6.4,0,0,0,15.2,0,0,3.2,0,0,0,0,0,0,0,0,0,0,0,0,0,0,0,0,0,0,0,0,0,0,0,0,0,9.6,0,0,0,0,0,2.4,6.4,0,0,0,0,0,0,2.4,8.8,0,0,0,0,0,0,0,0,0,0,0,0,0,0,23.2,3.2,0,0,0,0,0,0.8,0,0,0.8,5.6,0,3.2,0,0,0,0,0,0,0.8,0,0,2.4,0.8,0.8,0,23.2,0,0,0,0,0,0,0,0,0,0,0.8,0,0,0,4,0,0,2.4,0.8,0,0,0,0,0,0,0,0,0,0,0,0,16,0,0,0,0,6.4,0,0,0,0,0.8,0,0,0,0,0,0,0,0,1.6,1.6,0,0,0
"HUN_022_MZB_LO_15","HUN_022_MZB_LO_15-11.08.2011","11.08.2011",2011,8,11,0,0,0,0,0,0,0,0,0,0,0,36,0,0,212,0,0,1.6,0,0,0,0,0,0,0,3.2,0,0.8,0,360,0,0,7.2,0,0,0,0,0,0,0,0,0,0,0,0,0,0,0,0,0,1.6,0,0,0,0,0,0,0,3.2,0,0,0,0,0,1.6,0,0,0,0,0,0,0,0,0,0,0,0,0,0,0,0,0,0,0,0,0,0,0,75.2,1.6,0,0,0,0,0,0,0,0,0,1.6,0.8,4,0,0,0,0,0,0,0,0,0,0.8,0.8,0.8,0,1080,0,0,0,0,0,0,0,0,0,1.6,0,0,0.8,0.8,2.4,0,0,0,0,0,0,0,0,0,0,0,0,0,0,0,0,480,0,0,0,0,43.2,0,0,0.8,0,0.8,0,0,0,0,0,0.8,0,0,0,0,0,0,0
"HUN_022_MZB_LO_15","HUN_022_MZB_LO_15-04.10.2012","04.10.2012",2012,10,4,0,0,0,0,0,0,0,0,0,0,0,515.5555556,0,0,18.66666667,0,2.666666667,8.888888889,0,0,0,0,0,0,5.333333334,26.66666667,0,0,0,3.555555556,0,0,138.66666667,0,0,0,7.111111112,0,0,0,0,0.888888889,0,0,0,0,0,0,0,0,0,0,2.666666667,0,0,0,0,0,28.444444448,0,0,0.888888889,0,4.444444444,2.666666667,8.888888889,0,0,0,0,14.22222222,0,0,11.555555556,0,0,0,0,0,0,0,0,0,0,0,0,0,0,53.33333333,0.888888889,0,0,0,0.888888889,0,7.111111111,0,0,6.222222222,0,0,15.111111111,0,0,0,0,0,0,0,0,0,0,0,2.666666667,0,7.111111111,0,0,0,0,0,0,0,0,0,5.333333333,3.555555556,0.888888889,0,2.666666667,144,0,0,3.555555556,0,0,0,0,0,0,0,0,0,0,0,0,0,3.555555556,0,0,0,0,156.44444441,0,0,0,0,30.22222222,0,0,0,0,0,0,0,0,5.333333334,69.33333333,0,0,0
"HUN_022_MZB_LO_15","HUN_022_MZB_LO_15-23.09.2013","23.09.2013",2013,9,23,0,0,1.6,0,0,0,0,0,0,0,0,480,0,0,85.6,0,0,15.2,0,0,0,0,0,0,2.4,176,0,0,0,76.8,0,0,72,0,0,0,54.4,0,0,0,0,0,0,0,0,0,0,0,0,0,0.8,0,0.8,0,0,0,0,0,52,0,0,0,0,0,0.8,4.8,0,0,0,0,0,0,0,35.2,0,0,0,0,0,0,0,0,0,0,0,0,0,0,182.4,0,0,0,0,0,0,8.8,0,0,5.6,0,0,8,0,0,0,0,0,0,0.8,0,0,0.8,0,2.4,0,64,0,0,0,0,0,0,0,0,0,4.8,3.2,0,0.8,48,136,0,0,0.8,0,0,0,0,0,1.6,0,0,0,0,0,0,0,19.2,0,0,0,0,85.6,0,0,0,0,192,0,0,0,0,0,0,0,0,5.6,8,0,0,0
"HUN_022_MZB_LO_15","HUN_022_MZB_LO_15-03.09.2014","03.09.2014",2014,9,3,0,0,0,0,0,0,0,0,0,0,0,168,0,0,11.2,0,0,16.8,0,0,0,0,0,0,0.8,9.6,0,0,0,0.8,0,0,2.4,0,0,0,1.6,0,0,0,0,0,0,0,0,0,0,0,0,0,0,0,0,0,0,0,0,0,3.2,0,0,0,0,0,0.8,5.6,0,0,0,0,0.8,0,0,0.8,0,0,0,0,0,0,0,0,0,0,0,0,0,1.6,57.6,0,0,0,0,0,0,4,0,0,0,2.4,0,2.4,0,0,0,0,0,0,0,0,0,0.8,0.8,0,0,0.8,0,0,0.8,0,0,0,0,0,0,0.8,0,0,0.8,0.8,0.8,0,0,0,0,0,0,0,0,0,0,0,0,0,0,0,0,96,0,0,0,0,68.8,0,0,0,0,0,0,0,0,0,0,0,0,0,0,1.6,0,0,0
"HUN_022_MZB_LO_15","HUN_022_MZB_LO_15-08.09.2015","08.09.2015",2015,9,8,0,0,1.6,0,0,0,0,0,0,0,0,6.4,0,0,16,0,0,20,0,0,0,0,0,0,0,48,0,0,0,31.2,0,0,8,0,0,0,0,0,0,0,0,0,0,0,0,0,0,0,0,0,0.8,0,0,0,0,0,0,0,6.4,0,0,0,0,0,1.6,6.4,0,0,0,0,0.8,0,0,18.4,0,0,0,0,0,0,0,0,0,0,0,0,0,0.8,86.4,4,0,0,0,0,0,1.6,0,0,2.4,0,0,0,0,0,0,0,0,0,2.4,0,0,0,0,0.8,0,11.2,0,0,0,0,0,0,0,0,0,0.8,0,0,1.6,0,3.2,0,0,0.8,0,0,0,0,0,0,0,0,0,0,0,0,0,8,0,0,0,0,43.2,0,0,0,0,2.4,0,0,0,0,0,0,0,0,1.6,8.8,0,0,0
"HUN_022_MZB_LO_15","HUN_022_MZB_LO_15-09.08.2016","09.08.2016",2016,8,9,0,0,1.6,0,0,0,0,0,0,0,0,1.6,0,0,84,0,0,8.8,0,0,0,0,0,0,0,28.8,0,0,0,0.8,0,0,1.6,0,0,0,0,0,0,0,0,0,0,0,0,0,0,0,0,0,0,0,0,0,0,0,0,0,3.2,0,0,0,0,0,1.6,1.6,0,0,0,0,0.8,0,0,4.8,0,0,0,0,0,0,0,0,0,0,0,0,0,0,172.8,10.4,0,0,0,0,0,0,0,0,2.4,0.8,0,3.2,0,0,0,0,0,0,4,0,0,0.8,0,0.8,0,11.2,0,0,0,0,0,0,0,0,0,0.8,0.8,0,2.4,0.8,0,0,0,0,0.8,0,0,0,0,0,0,0,0,0,0,0,0,152,0,0,0,0,130.4,0,0,0,0,0,0,0,0,0,0,0,0,0,0,6.4,0,0,0
"HUN_022_MZB_LO_16","HUN_022_MZB_LO_16-14.09.2007","14.09.2007",2007,9,14,0,0,0,0,0,0,0,0,0,0,0,160,0,0,88,0,0,0,0,0,0,0,0,0,0,0,0,36,0,120,0,0,144,0,0,0,8,0,0,0.8,0,0,0,0,0,0,0,0,0,0,0.8,0,0,0,0,0,0,0,8,0,0,0,0,0,1.6,32,0,0,0,0,0,0,0,9.6,0,0,0,0,0,0,0,0,0,0,0,0,0,0,0,0,0,0,0,0,0,0,0,0,4,0,0,0,0,0,0,0,0,0,0,0,0,0,0,0,0,160,0,0,0,0,0,0,0,0,0,280,0,0,0,0,8,0,0,0,0,0,0,0,0,0,0,0,0,0,0,0,0,36,0,0,0,0,0,0,0,0,0,0,0,0,0,0,0,0,0,0,0,0.8,0,0,0
"HUN_022_MZB_LO_16","HUN_022_MZB_LO_16-12.09.2008","12.09.2008",2008,9,12,0,0,0,0,0,0,0,0,0,0,0,21.33333333,0,0,106.6666667,0,0,0,0,0,0,0,0,0,0,0,0,32,0,138.6666667,0,0,17.06666667,0,0,0,237.866666637,0,0,64,0,0,0,0,0,0,0,0,0,0,0,0,0,0,0,0,0,0,8.533333333,0,0,0,0,0,1.066666667,27.73333333,0,0,0,0,0,0,0,12.800000004,0,0,0,0,0,0,0,0,0,0,0,0,0,0,0,0,0,0,0,0,0,0,0,0,1.066666667,0,0,0,0,0,0,0,0,0,0,0,0,0,0,1.066666667,0,160,0,0,0,0,0,0,0,0,0,266.6666667,0,0,0,2.133333333,0,0,0,0,0,0,0,0,0,0,0,0,0,0,0,0,0,1.066666667,0,0,0,0,0,0,0,0,0,0,0,0,0,0,0,0,0,0,0,0,0,0,0
"HUN_022_MZB_LO_16","HUN_022_MZB_LO_16-16.09.2009","16.09.2009",2009,9,16,0,0,0.8,0,0,0,0,0,0,0,0,336,0,0,1.6,0,0,0,0,0,0,0,0,0,0,0,0,0.8,0,512,0,0,128,0,0,0,12,0,0,0,0,0,0,0,0,0,0,0,0,0,0.8,0,0,0,0,0,0,0,152,0,0,0,0,0,0.8,200.8,0,0,0,0,5.6,0,0.8,14.4,0,0,0,0,0,0,0,0,0,0,0,0,0.8,1.6,0,0,0,0,0,0,0,0,0,0,1.6,0,0,27.2,0,0,0,0,0,0,0,0,0,0,0,0.8,0,960,0,0,0,0,0,0,0,0,0,128,0,0,1.6,0,0.8,0,0,0,0,0,0,0,0,0,0,0,0,0,0,0,0,144,0,0,0,0,0,0,0,0,0,1.6,0,0,0,0,0,0,0,0,0,0,0,0,0
"HUN_022_MZB_LO_16","HUN_022_MZB_LO_16-26.08.2010","26.08.2010",2010,8,26,0,0,0,0,0,0,0,0,0,0,0,48,0,0,304,0,0,0.8,0,0,0,0,0,0,0,0.8,0,0,0,840,0,0,2.4,0,0,0,0,0,0,0,0,0,0,0,0,0,0,0,0,0,0,0,0,0,0,0,0,0,46.4,0,0,0,0,1.6,2.4,12,0,0,0,0,0,0,0,0,0,0,0,0,0,0,0,0,0,0,0,0,0,0,84,0,0,0,0,0,0,0,0,0,1.6,0,0,0,0,0,0,0,0,0,0,0,0,0,0,0,0,640,0,0,0,0,0,0,0,0,0,17.6,0,0,0,0,0,0,0,1.6,0,0,0,0,0,0,0,0,0,0,0,0,0,208,0,0,0,0,0,0,0,0,0,0.8,0,0,0,0,0,0,0,0,0,0,0,0,0
"HUN_022_MZB_LO_16","HUN_022_MZB_LO_16-11.08.2011","11.08.2011",2011,8,11,0,0,0.8,0,0,0,0,0,0,0,0,400,0,0,491.2,0,0,0,0,0,0,0,0,0,0,0.8,0,0,0,480,0,0,8.8,0,0,0,60,0,0,0,0,0,0.8,0,0,0,0,0,0,0.8,0,0,0,0,0,0,0,0,33.6,0,0,0,0,0,1.6,300.8,0,0,0,0,0,0,0,1.6,0,0,0,0,0,0,0,0,0,0,0,0,0,1.6,1.6,0,0,0,0,0,0,0,0,0,0,0,0,0,0,0,0,0,0,0,0,0,0,0,0,0.8,0,1680,0,0,0,0,0,0,0,0,0,45.6,0,0,0,0,0,0,0,0,0,0,0,0,0,0,0,0,0,0,0,0,0,600,0,0,0,0,0,0,0,0,0,0,0,0,0,0,0,0,0,0,0,1.6,0,0,0
"HUN_022_MZB_LO_16","HUN_022_MZB_LO_16-05.10.2012","05.10.2012",2012,10,5,0,0,0,0,0,0,0,0,0,0,0,53.33333333,0,0,269.333333367,0,0,0,0,0,0,0,0,0,2.666666667,0,0,2.666666667,0,773.3333333,0,0,304,0,0,0,17.333333333,0,0,0,0,0,0,0,0,0,0,0,0,0,1.333333333,0,0,0,0,0,0,0,64,0,0,0,0,0,5.333333333,60,0,0,0,0,0,0,0,14.666666666,0,0,0,0,0,0,0,0,0,0,0,0,0,0,6.666666667,0,0,0,0,0,0,18.66666667,0,0,2.666666666,0,1.333333333,6.666666666,0,0,0,0,0,0,1.333333333,0,0,0,1.333333333,1.333333333,0,493.3333333,0,0,0,0,0,0,0,0,0,288,0,0,0,0,0,0,0,0,0,0,0,0,0,0,0,0,0,0,0,0,0,640,0,0,0,0,0,0,0,0,0,1.333333333,0,0,0,0,0,8,0,0,0,1.333333333,0,0,0
"HUN_022_MZB_LO_16","HUN_022_MZB_LO_16-05.09.2013","05.09.2013",2013,9,5,0,0,1.6,0,0,0,0,0,0,0,0,177.6,0,0,734.4,0,0,1.6,0,0,0,0,0,0,2.4,14.4,0,0,0,3.2,0,0,41.6,0,0,0,48,0,0,0,0,0,0,0,0,0,0,0,0,0,0,0,0,0,0,0,0,0,76.8,0,0,0,0,0,4,6.4,0,0,0,0,1.6,0,0,105.6,0,0,0,0,0,0,0,0,0,0,2.4,0,0,0.8,56,6.4,0,0,0,0,0,0,0,0,6.4,0,0,0.8,0,0,0,0,0,0,0.8,0,0,0.8,0,0.8,0,393.6,0,0,0,0,0,0,0,0,0,0.8,0,0.8,0,0,19.2,0,0,2.4,0,0,0,0,0,0,0,0,0,0,0,0,0,273.6,0,0,0,0,0,0,0,0,0,2.4,0,0,0,0,0,0,0,0,0.8,2.4,0,0.8,0
"HUN_022_MZB_LO_16","HUN_022_MZB_LO_16-03.09.2014","03.09.2014",2014,9,3,0,0,0,0,0,0,0,0,0,0,0,6.4,0,0,40,0,0,2.4,0,0,0,0,0,0,0,21.6,0,0,0,5.6,0,0,8,0,0,0,0,0,0,0,0,0,0,0,0,0,0,0,0,0.8,0,0,0,0,0,0,0,0,14.4,0,0,0,0,0,0.8,3.2,0,1.6,0,0,27.2,0,0,1.6,0,0,0,0,0,0,0,0,0,0,44,0,0,0,33.6,0.8,0,0,0,0,0,0.8,0,0,0,0,0,1.6,0,0,0,0,0,0,0,0,0,2.4,0,0,0,160,0,0,0,0,0,0,0,0,0,0.8,0,0,0,0,8,0,0,0,0,0,0,0,0,0,0,0,0,0,0,0,0,88,0,0,0,0,0,0,0,0,0,0,0,0,0,0,0,0,0,0,0,3.2,0,0.8,0
"HUN_022_MZB_LO_16","HUN_022_MZB_LO_16-09.09.2015","09.09.2015",2015,9,9,0,0,1.6,0,0,0,0,0,0,0,0,50.4,0,0,15.2,0,0,5.6,0,0,0,0,0,0,0,38.4,0,0.8,0,27.2,0,0,16,0,0,0,0,0,0,0,0,0,0,0,0,0,0,0,0,0,0,0,0,0,0,0,0,0,11.2,0,0,0,0,0,1.6,4,0,0,0,0,0,0,0,4.8,0,0,0,0,0,0,0,0,0,0,6.4,0,0,0,1.6,0,0,0,0,0,0,4.8,0,0,8,0,0,0.8,0,0,0,0,0,0,0,0,0,0,0,3.2,0,13.6,0,0,0,0,0,0,0,0,0,1.6,0,0,0,0,128,0,0,0,0,0,0,0,0,0,0,0,0,0,0,0,0,6.4,0,0,0,0,4,0,0,0,0,1.6,0,0,0,0,0,0,0,0,0,18.4,0,0,0
"HUN_022_MZB_LO_16","HUN_022_MZB_LO_16-09.08.2016","09.08.2016",2016,8,9,0,0,0,0,0,0,0,0,0,0,0,4,0,0,4,0,0,1.6,0,0,0,0,0,0,0,38.4,0,0,0,11.2,0,0,45.6,0,0,0,0,0,0,0,0,0,0,0,0,0,0,0,0,2.4,0,0,0,0,0,0,0,0,67.2,0,0,0,0.8,0,1.6,0,0,0,0.8,0,0,0,0,37.6,0,0,0,0,0,0,0,0,0,0,0,0,0,1.6,240,10.4,0,0,0,0,0,12,0,0,7.2,0,0,2.4,0,0,0,0,0,0,0.8,0,0,0.8,0,0,0,33.6,0,0,0,0,0,0,0,0,0,0.8,0,0,0.8,0,19.2,0,0,2.4,0,0,0,0,0,0,0,0,0,0,0,0,1.6,1.6,0,0,0,0,0.8,0,0,0,0,0,0,0,0,0,0,0,0,0,0,4,0,4,0
"HUN_022_MZB_LO_17","HUN_022_MZB_LO_17-04.09.2001","04.09.2001",2001,9,4,0,0,0,0,0,0,0,0,0,0,0,0,0,0,1.6,0,0,0,0,0,0,0,0,0,0,0,0,0,0,1.6,0,0,0,0,0,0,0,0,0,0,0,0,0,0,0,0,0,0,0,0,0,0,0,0,0,0,0,0,1.6,0,0,0,0,1.6,0,1.6,0,0,0,0,0,0,0,0,0,0,0,0,0,0,0,0,0,0,0,0,0,0,1.6,1.6,0,0,0,0,0,0,0,0,0,0,0,0,0,0,0,0,0,0,0,0,0,0,0,0,0,1.6,0,0,0,0,0,0,0,0,0,0,0,0,0,0,0,0,0,0,0,0,0,0,0,0,0,0,0,0,0,0,0,1.6,0,0,0,0,0,0,0,0,0,0,0,0,0,0,0,0,0,0,0,0,0,0,0
"HUN_022_MZB_LO_17","HUN_022_MZB_LO_17-29.10.2002","29.10.2002",2002,10,29,0,0,0,0,0,0,0,0,0,0,0,1.6,0,0,1.6,0,0,0,0,0,0,0,0,0,0,0,0,0,0,1.6,0,0,0,0,0,0,0,0,0,0,0,0,0,0,0,0,0,0,0,0,0,0,0,0,0,0,0,0,0,0,0,0,0,1.6,0,0,0,0,0,0,0,0,0,0,0,0,0,0,0,0,0,0,0,0,0,0,0,0,0,0,0,0,0,0,0,0,0,0,0,0,0,0,0,0,0,0,0,0,0,0,0,0,0,0,0,1.6,0,0,0,0,0,0,0,0,0,0,0,0,0,0,0,0,0,0,0,0,0,0,0,0,0,0,0,0,0,0,0,0,0,0,0,0,0,0,0,0,0,0,0,0,0,0,0,0,0,0,0,0,0,0,0
"HUN_022_MZB_LO_17","HUN_022_MZB_LO_17-13.10.2004","13.10.2004",2004,10,13,0,0,0,0,0,0,0,0,0,0,0,0,0,0,0,0,0,0,0,0,0,0,0,0,0,0,0,0,0,1.6,0,0,0,0,0,0,1.6,0,0,0,0,0,0,0,0,0,0,0,0,0,0,0,0,0,0,0,0,0,0,0,0,0,0,0,0,0,0,0,0,0,0,0,0,0,0,0,0,0,0,0,0,0,0,0,0,0,0,0,0,0,0,0,0,0,0,0,0,0,0,0,0,0,0,0,0,0,0,0,0,0,0,0,0,0,0,1.6,0,0,0,0,0,0,0,0,0,0,0,0,0,0,0,0,0,0,0,0,0,0,0,0,0,0,0,0,0,0,0,3.2,0,0,0,0,0,0,0,0,0,0,0,0,0,0,0,0,0,0,0,0,0,0,0
"HUN_022_MZB_LO_17","HUN_022_MZB_LO_17-17.10.2005","17.10.2005",2005,10,17,0,0,0,0,0,0,0,0,0,0,0,32,0,0,14.4,0,0,0,0,0,0,0,0,0,0,0,0,0,0,48,0,0,0,0,0,0,0,0,0,0,0,0,0,0,0,0,0,0,0,0,1.6,0,0,0,0,0,0,0,4.8,0,0,0,0,0,0,8,0,0,0,0,0,0,0,0,0,0,0,0,0,0,0,0,0,0,0,0,0,0,0,0,0,0,0,0,0,0,0,0,0,0,0,0,0,0,0,0,0,0,0,0,0,0,0,0,0,32,0,0,0,0,0,0,0,0,0,0,0,0,0,0,0,0,0,0,0,0,0,0,0,0,0,0,0,0,0,0,0,12.8,0,0,0,0,0,0,0,0,0,0,0,0,0,0,0,8,0,0,0,0,0,0,0
"HUN_022_MZB_LO_17","HUN_022_MZB_LO_17-12.10.2006","12.10.2006",2006,10,12,0,0,0,0,0,0,0,0,0,0,0,169.6,0,0,110.4,0,0,0,0,0,0,0,0,0,0,0,0,0,0,8,0,0,0,0,0,0,0,0,0,0,0,0,0,0,1.6,0,0,0,0,0,0,0,0,0,0,0,0,0,12.8,0,0,0,0,0,0,1.6,0,0,0,0,0,0,0,0,0,0,0,0,0,0,0,0,0,0,0,0,1.6,3.2,6.4,9.6,0,0,0,0,0,0,0,0,0,0,0,4.8,0,0,0,0,0,0,0,0,0,0,0,0,0,72,0,0,0,0,0,0,0,0,0,0,0,0,0,0,0,0,0,0,0,0,0,0,0,0,0,0,0,0,0,0,0,8,0,0,0,0,0,0,0,0,0,0,0,0,0,0,0,4.8,0,0,0,0,0,0,0
"HUN_022_MZB_LO_17","HUN_022_MZB_LO_17-14.09.2007","14.09.2007",2007,9,14,0,0,0,0,0,0,0,0,0,0,0,160,0,0,56,0,0,0,0,0,0,0,0,0,0,0,0,0,0,96,0,0,16,0,0,0,8,0,0,0.8,0,0,0,0,0,0,0,0,0,0,0,0,0,0,0,0,0,0,104,0,0,0,0,0,0,24,0,0,0,0,0,0,0,8,0,0,0,0,0,0,0,0,0,0,0,0,0,0,0.8,0,0,0,0,0,0,0,0,0,0.8,0,0,0,0,0,0,0,0,0,0,0,0,0,0,0,0,120,0,0,0,0,0,0,0,0,0,6.4,0,0,0,0,0,0,0,0,0,0,0,0,0,0,0,0,0,0,0,0,0,16,0,0,0,0,0,0,0,0,0,0,0,0,0,0,0,0,0,0,0,0,0,0,0
"HUN_022_MZB_LO_17","HUN_022_MZB_LO_17-30.09.2008","30.09.2008",2008,9,30,0,0,0,0,0,0,0,0,0,0,0,1600,0,0,960,0,0,0,0,0,0,0,0,0,0,9.6,0,0,0,320,0,0,0,0,0,0,0,0,0,0,0,0,0,0,0,0,0,0,0,0,0,0,0,0,0,0,0,0,48,0,0,0,0,0,3.2,40,0,0,0,0,0,0,0,4.8,0,0,0,0,0,0,0,0,0,0,0,0,0,1.6,8,0,0,0,0,0,0,0,0,0,0,0,0,4.8,0,0,0,0,0,0,0,0,0,0,0,4.8,0,80,0,0,0,0,0,0,0,0,0,12.8,0,0,0,0,0,0,0,0,0,0,0,0,0,0,0,0,0,0,0,0,0,160,0,0,0,0,0,0,1.6,0,0,0,0,0,0,0,0,1.6,0,0,0,0,0,0,0
"HUN_022_MZB_LO_17","HUN_022_MZB_LO_17-18.09.2009","18.09.2009",2009,9,18,0,0,0,0,0,0,0,0,0,0,0,341.3333333,0,0,67.2,0,0,0,0,0,0,0,0,0,0,11.73333333,0,0,0,9.6,0,1.066666667,0,0,0,0,1.066666667,0,0,0,0,0,0,0,0,0,0,0,0,0,0,0,0,0,0,0,0,0,70.4,0,0,0,0,5.333333333,1.066666667,1.066666667,0,0,0,0,0,0,0,1.066666667,0,0,0,0,0,0,0,0,0,0,0,0,1.066666667,1.066666667,0,0,0,0,0,0,0,0,0,0,0,0,1.066666667,1.066666667,0,0,0,0,0,0,0,0,0,1.066666667,0,0,0,3200,0,0,0,0,0,0,0,0,0,1.066666667,0,0,0,0,0,0,0,0,0,0,0,0,0,0,0,0,0,0,0,0,0,320,0,0,0,0,0,0,0,0,0,0,0,0,0,0,0,0,0,0,0,0,0,0,0
"HUN_022_MZB_LO_17","HUN_022_MZB_LO_17-23.09.2010","23.09.2010",2010,9,23,0,0,0,0,0,0,0,0,0,0,0,224,0,0,115.2,0,0,0,0,0,0,0,0,0,0,5.333333333,0,1.066666667,0,506.6666667,0,0,0,0,0,0,0,0,0,0,0,0,0,0,0,0,0,0,0,0,0,0,0,0,0,0,0,0,27.73333333,0,0,0,0,20.266666667,0,0,0,0,0,0,0,0,1.066666667,0,0,0,0,0,0,0,0,0,0,0,0,0,0,0,2.133333333,0,0,0,0,0,0,0,0,0,0,0,0,0,0,0,0,0,0,0,0,0,0,1.066666667,0,0,0,80,0,0,0,0,0,0,0,0,0,0,0,0,0,0,0,0,0,0,0,0,3.2,0,0,0,0,0,0,0,0,0,0,320,0,0,0,0,0,0,0,0,0,0,0,0,0,0,0,0,0,0,0,0,0,0,0
"HUN_022_MZB_LO_17","HUN_022_MZB_LO_17-19.10.2011","19.10.2011",2011,10,19,0,0,0,0,0,0,0,0,0,0,0,163.2,0,0,462.4,0,0,0,0,0,0,0,0,0,0,40,0,1.6,0,101.6,0,0,0,0,0,0,0,0,0,0,0,0,0,0,0,0,0,0,0,0,0,0,0,0,0,0,0,0,54.4,0,0,0,0,195.2,0,3.2,0,0,0,0,0,0,1.6,0,0,0,0,0,0,0,0,0,0,0,0,0,0,0.8,85.6,0,0,0,0,0,0,0,0,0,0,0,0,0,0,0,0,0,0,0,0,0,0,0,0,0,0,1152.8,0,0,0,0,0,0,0,0,1.6,3.2,0,0,0,0,0,0,0,0,0,0,0,0,0,0,0,0,0,0,0,0,0,13.6,0,0,0,0,0.8,0,0,0,0,0,0,0,0,0,0,3.2,0,0,0,0,0,0,0
"HUN_022_MZB_LO_17","HUN_022_MZB_LO_17-05.09.2013","05.09.2013",2013,9,5,0,0,0,0,0,0,0,0,0,0,0,216,0,0,326.4,0,0,0,0,0,0,0,0,0,0,0.8,0,0,0,88,0,0,0,0,0,0,10.4,0,0,0,0,0,0,0,0,0,0,0,0,0,5.6,0,0,0,0,0,0,0,240,0,0,0,0,0.8,0.8,2.4,0,0,0,0,0,0,0,22.4,0,0.8,0,0,0,0,0,0,0,4,0,0,0,5.6,0.8,0,0,0,0,0,0,0,0,0,0,0,0,0,0,0,0,0,0,0,0,0,0,0,0,10.4,0,16,0,0,0,0,0,0,0,0,0,2.4,0,0,0,0,0,0,0,0,0,0,0,0,0,0,0,0,0,0,0,0,0,72,0,0,0,0,0,0,0,0,0,0,0,0,0,0,0,0,0,0,0,0,0,0,0
"HUN_022_MZB_LO_17","HUN_022_MZB_LO_17-18.08.2014","18.08.2014",2014,8,18,0,0,0,0,0,0,0,0,0,0,0,504,0,0,67.2,0,0,0,0,0,0,0,0,0,0,0.8,0,0,0,288,0,0,0,0,0,0,4,0,0,0.8,0,0,0,0,0,0,0,0,0,0,0,0,0,0,0,0,0,0,96,0,0,0,0,6.4,0,14.4,0,0,0,0,0,0.8,0,16,0,0,0,0,0,0,0,0,0,0,0,0,0,0.8,0,0.8,0,0,0,0,0,0,0,0,0,0,0,0,0,0,0,0,0,0,0,0,0,1.6,0,0.8,0,360,0,0,0,0,0,0,0,0,0,0,0,0,0,0,0,0,0,0,0,0,0,0,0,0,0,0,0,0,0,0,0,0.8,0,0,0,0,0,0,0,0,0,0.8,0,0,0,0,0,0,0,0,0,0,0,0,0
"HUN_022_MZB_LO_17","HUN_022_MZB_LO_17-09.09.2015","09.09.2015",2015,9,9,0,0,0,0,0,0,0,0,0,0,0,636,0,0,2.4,0,0,0,0,0,0,0,0,0,0,0,0,0,0,17.6,0,0,7.2,0,0,0,1.6,0,0,0,0,0,0,0,0,0,0,0,0,0,1.6,0,0,0,0,0,0,0,38.4,0,0,0,0,40.8,1.6,2.4,0,0,0,0,0,0,0,3.2,0,0,0,0,0,0,0,0,0,0,0,0,0.8,0.8,2.4,0,0,0,0,0,0,0,0,0,0.8,0,1.6,0.8,0,0,0,0,0,0,0,0,0,0.8,0,4,0,0,0,0,0,0,0,0,0,0,0,0.8,0,0,0,0,0,0,0,0,0,0,0,0,0,0,0,0,0,0,0,0,0,2.4,0,0,0,0,0.8,0,0,0,0,0,0,0,0,0,0,0,0,0,0,0,0,0,0
"HUN_022_MZB_LO_18","HUN_022_MZB_LO_18-12.10.2004","12.10.2004",2004,10,12,0,0,0,0,0,0,0,0,0,0,0,0,0,0,20.8,0,0,0,0,0,0,0,0,0,0,4.8,0,0,0,24,0,0,0,0,0,0,0,0,0,0,0,0,0,3.2,0,0,0,0,0,0,0,0,0,0,0,0,0,0,0,0,0,0,0,0,0,0,0,0,0,0,0,11.2,0,1.6,0,0,0,0,0,0,0,0,0,0,0,0,0,0,17.6,0,0,0,0,0,0,4.8,0,0,0,0,0,0,0,0,0,0,0,0,0,0,0,0,0,0,0,3.2,0,0,0,0,0,0,0,0,0,0,0,0,0,0,0,0,0,0,0,0,0,0,0,0,0,0,0,0,0,0,0,0,0,0,0,0,0,0,0,0,0,0,0,0,0,0,0,0,0,0,0,0,0,0,0
"HUN_022_MZB_LO_18","HUN_022_MZB_LO_18-11.10.2005","11.10.2005",2005,10,11,0,0,0,0,0,0,0,0,0,0,0,19.2,0,0,0,0,0,0,0,0,0,0,0,0,3.2,145.6,0,0,0,51.2,0,0,0,0,0,0,0,0,0,0,0,0,0,0,0,0,0,0,0,0,8,0,0,0,0,0,0,0,1.6,0,0,0,0,9.6,0,0,0,0,0,0,0,0,0,0,0,0,0,0,0,0,0,0,0,0,0,0,0,0,8,0,0,0,0,0,0,49.6,0,0,0,0,3.2,0,0,0,0,0,0,0,0,0,0,0,0,0,0,0,0,0,0,0,0,0,0,0,0,0,0,0,0,0,8,0,0,0,0,3.2,0,0,0,0,0,0,0,0,0,0,0,25.6,0,0,0,0,9.6,0,0,0,0,3.2,0,0,0,0,0,0,0,0,0,0,0,0,0
"HUN_022_MZB_LO_18","HUN_022_MZB_LO_18-02.10.2006","02.10.2006",2006,10,2,0,0,0,0,0,0,0,0,0,0,0,6.4,0,3.2,17.6,0,0,0,0,0,0,0,0,0,0,9.6,0,0,0,28.8,0,0,0,0,0,0,11.2,0,0,0,0,0,0,0,0,0,0,0,0,0,3.2,0,0,0,0,0,0,0,1.6,0,0,0,0,84.8,0,0,0,0,1.6,0,0,0,0,0,0,0,0,0,0,0,0,0,0,0,0,0,0,0,8,0,0,0,0,0,0,0,0,0,0,0,0,0,0,0,0,0,0,0,0,0,0,0,0,0,0,56,0,0,0,0,0,0,0,0,0,0,0,0,0,0,11.2,0,0,0,0,1.6,0,0,0,0,0,0,0,0,0,0,0,192,0,0,0,0,12.8,0,0,0,0,1.6,0,0,0,0,0,3.2,0,0,0,0,0,0,0
"HUN_022_MZB_LO_18","HUN_022_MZB_LO_18-01.10.2007","01.10.2007",2007,10,1,0,0,0,0,0,0,0,12.8,0,0,0,0,0,0,8,0,0,0,0,0,0,0,0,0,0,27.2,0,0,0,3.2,0,0,0,0,0,0,0,0,0,0,0,0,0,0,0,0,0,0,0,0,1.6,0,0,0,0,0,0,0,6.4,0,0,0,0,140.8,0,0,0,0,35.2,0,0,0,0,6.4,0,0,0,0,0,0,0,0,0,0,0,0,0,0,24,3.2,0,0,0,0,0,0,0,0,0,0,3.2,0,0,0,0,0,0,0,0,0,0,0,0,0,0,3.2,0,0,0,0,0,0,0,0,0,0,0,0,0,0,1.6,0,0,0,0,132.8,0,1.6,0,0,0,0,0,0,0,0,1.6,11.2,0,0,0,0,11.2,0,0,0,0,0,0,0,0,0,0,0,0,0,0,0,0,0,0
"HUN_022_MZB_LO_18","HUN_022_MZB_LO_18-10.09.2009","10.09.2009",2009,9,10,0,0,0,0,0,0,0,28,0,0,0,0,0,0,1.6,0,0,2.4,0,0,0,0,0,0,4,16,0,0,0,80,0,0,0,0,0,0,0,0,0,0,0,0,0,0,0,0,0,0,0,0,0,0,0,0,0,0,0,0,0,0,0,0,0,64,0,0,0,0,16,0,0,0,0,0,0,0,0,0,0,0,0,0,0,0,0,0,0,0,16,0,0,0,0,0,0,0.8,0,0,0,0,0,0,0,0,0,0,0,0,0,0,0,0,0,0,0,32,0,0,0,0,0,0,0,0,0,0,0,0,0.8,0,0,0,0,0,0,0.8,0,0,0,0,0,0.8,0,0,0,0,0,21.6,0,0,0,0,24,0,0,0,0,0,0,0,0,0,0,0,0,0,0,0,0,0,0
"HUN_022_MZB_LO_18","HUN_022_MZB_LO_18-13.10.2010","13.10.2010",2010,10,13,0,0,0,0,0,0,0,0,0,0,0,4,0,0,5.6,0,0,0,0,0,0,0,0,0,0,2.4,0,0.8,0,0,0,0,0,0,0,0,2.4,0,0,0,0,0,0,0,0,0,0,0,0,0,0,0,0,0,0,0,0,0,0,0,0,0,0,53.6,0,0,0,0,0.8,0,0,0,0,0,0,0,0,0,0,0,0,0,0,0,0,0,0,0,24,0,0,0,0,0,0,0,0,0,0,0,0,0,0,0,0,0,0,0,0,0,0,0,0,0,0,7.2,0,0,0,0,0,0,0,0,0,0,0.8,0,0,0,0,0,0,0,0,0,0,0,0,0,0,0.8,0,0,0,0,0,0,0,0,0,0,0,0,0,0,0,0,0,0,0,0,0,0,0,0,0,0,0,0,0
"HUN_022_MZB_LO_18","HUN_022_MZB_LO_18-12.10.2011","12.10.2011",2011,10,12,0,0,0,0,1.6,0,0,96,0,0,0,0,0,0,12.8,0,0,0,0,0,0,0,0,0,1.6,0,0,0,0,48,0,0,0,0,0,0,1.6,0,0,0,0,0,0,0,0,0,0,0,0,0,0,0,0,0,0,0,0,0,0,0,0,0,0,76.8,0,0,0,0,1.6,0,0,0,0,0,0,0,0,0,0,0,0,0,0,0,0,0,0,0,14.4,0,0,0,0,0,0,0,0,0,0,0,9.6,0,0,0,0,0,0,0,0,0,0,0,0,0,0,28.8,0,0,0,0,0,0,0,0,0,0,0,0,0,0,0,0,0,0,0,0,0,0,0,0,0,0,0,0,0,0,0,8,0,0,0,0,1.6,0,0,0,0,0,0,0,0,0,0,0,0,3.2,0,0,0,0,0
"HUN_022_MZB_LO_18","HUN_022_MZB_LO_18-07.08.2012","07.08.2012",2012,8,7,0,0,0,0,1.6,0,0,17.6,0,0,0,0,0,0,12.8,0,0,0,0,0,0,0,0,0,0,6.4,0,0,0,49.6,0,0,0,0,0,0,0,0,0,0,0,0,0,0,0,0,0,0,0,0,0,0,0,0,0,0,0,0,0,0,0,0,0,4.8,0,0,0,0,38.4,4.8,0,0,0,0,0,0,0,0,0,0,0,0,0,0,0,0,0,0,0,4.8,0,0,0,0,0,1.6,0,0,0,0,3.2,0,0,0,0,0,0,0,0,0,0,0,0,0,0,25.6,0,0,0,0,0,0,0,0,0,0,0,0,0,0,3.2,0,0,0,0,28.8,0,0,0,0,0,0,0,0,0,0,0,16,0,0,0,0,20.8,0,0,0,0,0,0,0,0,0,0,0,0,1.6,0,0,0,0,0
"HUN_022_MZB_LO_18","HUN_022_MZB_LO_18-01.10.2013","01.10.2013",2013,10,1,0,0,0,0,0,0,0,19.2,0,0,0,3.2,0,0,102.4,0,0,3.2,0,0,0,0,0,0,12.8,107.2,0,3.2,0,200,0,0,0,0,0,0,0,0,0,0,0,0,0,0,0,0,0,0,0,0,3.2,0,19.2,0,0,0,0,0,0,0,0,0,0,131.2,0,0,0,0,0,0,0,1.6,0,0,0,0,28.8,0,0,0,0,0,0,0,0,0,0,0,32,17.6,0,0,0,0,0,1.6,0,0,0,0,0,0,0,0,0,0,0,0,16,0,0,0,0,0,0,11.2,0,0,0,0,0,0,0,3.2,0,0,0,0,0,0,9.6,0,3.2,0,0,112,0,0,0,0,0,12.8,0,0,0,0,0,16,0,0,0,0,9.6,0,0,0,0,3.2,0,0,0,0,0,0,0,0,0,0,0,0,0
"HUN_022_MZB_LO_18","HUN_022_MZB_LO_18-17.10.2014","17.10.2014",2014,10,17,0,1.6,0,0,0,0,0,0,0,0,0,1.6,0,0,4.8,0,0,3.2,0,0,0,0,0,0,3.2,24,0,6.4,0,35.2,0,0,0,0,0,0,0,0,0,0,0,0,0,0,0,0,0,0,0,0,1.6,0,0,0,19.2,0,0,0,1.6,0,0,0,0,209.6,0,0,0,0,16,0,0,0,0,0,0,0,65.6,0,0,0,0,0,0,0,0,0,0,0,0,0,0,0,0,0,0,1.6,0,0,0,0,0,0,0,0,0,0,0,0,0,0,0,0,0,0,0,105.6,0,0,0,0,0,0,0,1.6,0,0,0,0,0,0,1.6,0,0,3.2,0,59.2,0,0,0,0,0,0,0,0,0,0,0,0,0,0,0,0,8,0,0,0,0,6.4,0,0,0,0,0,0,0,1.6,0,0,0,0,0
"HUN_022_MZB_LO_18","HUN_022_MZB_LO_18-16.09.2015","16.09.2015",2015,9,16,0,1.6,0,0,0,0,0,60.8,0,0,0,0,0,0,0,0,0,0,0,0,0,0,0,0,0,1.6,0,0,0,152,0,0,0,0,0,0,0,0,0,0,0,0,0,0,0,0,0,0,0,0,8,0,0,0,0,0,0,0,0,0,0,0,0,688,0,0,0,0,0,0,0,0,0,0,0,0,0,0,0,0,0,0,0,0,0,0,0,0,4.8,6.4,0,0,0,0,0,0,0,0,0,0,0,0,0,0,0,0,0,0,0,0,0,0,0,0,0,9.6,0,0,0,0,0,0,0,0,0,0,0,0,0,0,0,0,0,0,0,0,0,0,0,0,0,0,0,0,0,0,0,190.4,0,0,0,0,0,0,0,0,0,11.2,0,0,0,0,0,0,0,0,0,0,0,0,0
"HUN_022_MZB_LO_18","HUN_022_MZB_LO_18-07.09.2016","07.09.2016",2016,9,7,0,4.8,0,0,0,0,0,14.4,0,0,0,0,0,0,12.8,0,0,0,0,0,0,0,0,0,1.6,3.2,0,0,0,36.8,0,0,0,0,0,0,0,0,0,0,0,0,0,0,0,0,0,0,0,0,0,0,0,0,0,0,0,0,0,0,0,0,0,859.2,0,0,0,0,0,0,0,0,0,0,0,0,0,0,0,0,0,0,0,0,0,0,0,0,1.6,4.8,0,0,0,0,0,0,0,0,0,0,0,0,0,0,0,0,0,0,0,0,0,0,0,0,0,8,0,0,0,0,0,0,0,0,0,0,0,0,0,0,0,0,0,0,0,0,0,0,0,0,0,0,0,0,0,0,0,62.4,0,0,0,0,0,0,0,0,0,0,0,0,0,0,0,0,0,0,0,0,0,0,0
"HUN_022_MZB_LO_19","HUN_022_MZB_LO_19-11.10.2004","11.10.2004",2004,10,11,0,0,0,0,0,0,0,19.2,0,0,0,0,0,0,0,0,0,1.6,0,0,0,0,0,0,0,0,0,0,0,76.8,0,0,0,0,0,0,0,0,0,0,0,0,0,3.2,0,0,0,0,0,0,0,0,0,0,43.2,0,0,0,0,0,0,0,0,0,0,0,0,0,8,0,0,0,0,0,0,0,3.2,0,0,0,0,0,0,0,1.6,0,0,0,134.4,0,0,0,0,0,0,8,0,0,0,0,0,0,0,0,0,0,0,1.6,0,0,0,0,0,0,0,0,0,0,0,0,0,0,0,0,0,0,0,0,0,0,6.4,0,0,0,0,80,0,0,0,0,0,0,0,0,0,0,0,0,0,0,0,0,22.4,0,0,0,0,0,0,43.2,1.6,0,0,0,0,0,1.6,0,0,0,0
"HUN_022_MZB_LO_19","HUN_022_MZB_LO_19-10.10.2005","10.10.2005",2005,10,10,0,0,0,0,0,0,0,48,0,0,0,0,0,0,24,0,0,0,0,6.4,0,0,0,0,3.2,32,0,0,0,0,0,0,0,0,0,0,0,0,0,0,0,0,0,0,0,0,0,0,0,0,3.2,0,6.4,0,19.2,0,0,0,0,0,0,0,0,0,0,0,0,0,12.8,0,0,1.6,0,0,0,0,12.8,0,0,0,0,0,0,0,0,0,0,0,57.6,0,0,0,0,0,0,16,0,0,0,0,1.6,0,0,0,0,0,0,0,0,0,0,1.6,0,0,0,0,0,0,0,0,0,0,0,0,0,1.6,0,0,0,0,12.8,0,0,0,0,32,0,0,0,0,1.6,0,0,0,0,0,0,9.6,0,0,0,0,11.2,0,0,0,0,0,0,48,0,0,0,0,0,0,1.6,0,0,0,0
"HUN_022_MZB_LO_19","HUN_022_MZB_LO_19-02.10.2006","02.10.2006",2006,10,2,0,0,0,0,0,0,0,3.2,0,0,0,0,0,1.6,8,0,0,0,0,0,0,0,0,0,8,4.8,0,0,0,88,0,0,0,0,0,0,0,0,0,0,0,0,0,0,0,0,0,0,4.8,0,0,0,0,0,3.2,0,0,0,0,0,0,0,0,1.6,0,0,0,0,0,0,0,1.6,0,0,0,0,4.8,0,0,0,0,0,0,0,0,0,0,0,6.4,0,0,0,0,0,0,0,0,0,0,0,0,0,0,0,0,0,0,0,0,0,0,0,0,0,0,1.6,0,0,0,0,0,6.4,0,0,0,0,0,0,0,0,0,0,0,0,0,80,0,0,0,0,0,0,0,0,0,0,0,9.6,0,0,0,0,1.6,0,0,0,0,1.6,0,4.8,0,0,0,0,0,0,1.6,0,0,0,0
"HUN_022_MZB_LO_19","HUN_022_MZB_LO_19-01.10.2007","01.10.2007",2007,10,1,0,0,0,0,0,0,0,6.4,0,0,0,0,0,33.6,0,0,0,8,0,0,0,0,0,0,0,1.6,0,0,0,14.4,0,0,0,0,0,0,0,0,0,0,0,0,0,0,0,0,0,0,0,0,0,0,6.4,0,14.4,0,0,0,0,0,0,0,0,0,0,0,0,0,3.2,0,0,0,0,0,0,0,0,0,0,0,0,0,0,0,3.2,0,0,0,0,0,0,0,0,0,0,0,0,0,0,0,0,11.2,0,0,0,0,0,0,0,0,0,0,0,0,0,0,0,0,0,0,0,0,0,0,0,12.8,0,0,0,0,8,0,0,1.6,0,12.8,0,0,0,0,0,0,0,0,0,0,3.2,0,0,0,0,0,4.8,0,0,0,0,1.6,0,0,0,0,0,0,0,0,8,0,0,0,0
"HUN_022_MZB_LO_19","HUN_022_MZB_LO_19-12.08.2009","12.08.2009",2009,8,12,0,0,0,0,0,0,0,0.8,0,0,0,0,0,0,20,0,0,0.8,0,0,0,0,0,0,68.8,10.4,0,0,0,178.4,0,0,0,0,0.8,0,0,0,0,0,0,0,0,0,0,0,0,0,0,0,0.8,0,1.6,0,2.4,0,0,0,0,0,0,0,0,0,0,0,0,0,0.8,0,0,0,0,0,0,0,0,0,0,0,0,0,0,0,1.6,0,0,0,0,0,0,0,0,0,0,0.8,0,0,0,0,0,0,0,0,0,0,0,0,0,0,0,0,0,0,0,0,0,0,0,0,0,0,0,0,0,0,0,0,0,0,4,0,0,0,0,1.6,0,0,0,0,0,0,0,0,0,0,0,0,0,0,0,0,30.4,0,0,0,0,16.8,0,18.4,0,0,0,0,0,0,2.4,0,0,0,0
"HUN_022_MZB_LO_19","HUN_022_MZB_LO_19-26.10.2010","26.10.2010",2010,10,26,0,0,0,0,0,0,0,0,0,0,0,0.8,0,0,24,0,0,0,0,0,0,0,0,0,22.4,1.6,0,2.4,0,20,0,0,0,0,0,0,0,0,0,0,0,0,0,0,0,0,0,0,0,0,0,0,0,0,12,0,0,0,0,0,0,0,0,0,0,0,0,0,1.6,0,0,0,0,0,0,0,78.4,0,0,0,0,0,0,0,0,0,0,0,16,0,0,0,0,0,0,0,0,0,0,0,0,0,0,0,0,0,0,0,2.4,0,0,0,0,0,0,31.2,0,0,0,0,0,0,0,0,0,0,2.4,0,0,0,0,0,0,0,0,24.8,0,0,0,0,0,0,0,0,0,0,0,2.4,0,0,0,0,2.4,0,0,0,0,2.4,0,0.8,0,0,0,0,0,0,0,0,0,0,0
"HUN_022_MZB_LO_19","HUN_022_MZB_LO_19-12.10.2011","12.10.2011",2011,10,12,0,0,0,0,0,0,0,24,0,0,0,0,0,0,3.2,0,0,0,0,0,0,0,0,0,22.4,3.2,0,0,0,17.6,0,0,0,0,0,0,0,0,0,0,0,0,0,0,0,0,0,0,0,0,0,0,1.6,0,3.2,0,0,0,0,0,0,0,0,3.2,0,0,0,0,0,0,0,0,0,0,0,0,0,0,0,0,0,0,0,0,0,0,0,0,0,0,0,0,0,0,0,0,0,0,0,0,0,0,0,0,0,0,0,0,0,0,0,0,0,0,0,3.2,0,0,0,0,0,0,0,0,0,0,0,0,0,0,0,0,0,0,0,0,0,0,0,0,0,0,0,0,0,0,0,0,0,0,0,0,0,0,0,0,0,0,0,0,0,0,0,0,0,0,1.6,0,0,0,0
"HUN_022_MZB_LO_19","HUN_022_MZB_LO_19-24.10.2013","24.10.2013",2013,10,24,0,0,0,0,0,0,0,0,0,0,0,0,0,0,3.2,0,0,0,0,4.8,0,0,0,0,1.6,46.4,0,14.4,0,89.6,0,0,0,0,0,0,11.2,0,0,0,0,0,0,0,0,0,0,0,0,0,0,0,16,0,1.6,0,0,0,0,0,0,0,0,0,0,0,0,0,0,0,0,0,0,0,0,0,0,0,0,0,0,0,0,0,0,0,0,0,0,0,0,0,0,0,0,0,0,0,0,27.2,0,19.2,0,0,0,0,0,0,1.6,0,0,0,0,0,0,57.6,0,0,0,0,0,0,0,0,0,11.2,0,0,0,0,40,0,0,0,0,1.6,0,0,0,1.6,0,0,0,0,0,0,0,0,0,0,0,0,11.2,0,0,0,0,0,0,0,0,0,0,0,0,0,0,0,0,0,0
"HUN_022_MZB_LO_2","HUN_022_MZB_LO_2-21.09.2000","21.09.2000",2000,9,21,0,0,0,0,1.6,0,0,0,0,0,0,0,0,0,0,0,0,1.6,0,0,0,0,0,0,0,0,0,0,0,1.6,0,0,0,0,0,0,0,0,0,0,0,0,0,0,0,0,1.6,0,0,0,0,0,0,0,0,0,0,0,3.2,0,0,0,0,1.6,0,0,0,0,0,0,0,0,0,0,0,0,0,0,0,0,0,0,0,0,3.2,0,0,0,0,0,0,0,1.6,0,0,0,0,0,0,1.6,0,1.6,0,0,0,0,0,1.6,0,0,0,0,0,0,0,0,0,0,0,0,0,0,0,0,0,0,0,0,0,0,0,0,0,0,0,0,0,0,0,0,0,0,0,0,0,0,0,0,0,0,0,0,3.2,0,0,0,0,0,0,0,0,0,0,0,0,0,6.4,1.6,0,1.6,0
"HUN_022_MZB_LO_2","HUN_022_MZB_LO_2-15.10.2001","15.10.2001",2001,10,15,0,0,0,0,1.6,0,0,0,0,0,0,0,0,0,0,0,0,1.6,0,0,0,0,0,0,0,0,0,0,0,1.6,0,0,0,0,0,0,0,1.6,0,0,0,0,1.6,0,0,0,1.6,0,0,0,0,0,0,0,0,0,0,0,0,0,0,0,0,1.6,0,0,0,0,0,0,0,0,0,0,0,0,0,0,0,0,0,0,0,0,1.6,0,0,0,0,0,1.6,0,1.6,0,0,0,0,0,0,0,0,1.6,0,0,0,0,0,1.6,0,0,0,0,0,0,0,1.6,0,0,0,0,0,0,0,0,0,0,0,0,0,0,0,0,0,0,0,0,0,0,0,0,0,0,0,0,0,0,0,0,0,0,0,0,1.6,0,0,0,0,0,0,0,0,0,0,0,1.6,0,0,0,0,0,0
"HUN_022_MZB_LO_2","HUN_022_MZB_LO_2-28.10.2002","28.10.2002",2002,10,28,0,0,0,0,1.6,0,0,0,0,0,0,0,0,0,0,0,0,0,0,0,0,0,0,0,0,0,0,0,0,1.6,0,0,0,0,0,0,0,1.6,0,0,0,0,0,0,0,0,1.6,0,0,0,0,0,0,0,0,0,0,0,0,0,0,0,0,1.6,0,0,0,0,0,0,0,0,0,0,0,0,0,0,0,0,0,0,0,0,3.2,0,0,0,0,0,1.6,0,1.6,0,0,0,0,0,0,0,0,1.6,0,0,0,0,0,1.6,0,0,0,0,0,0,0,1.6,0,0,0,0,0,0,0,0,0,0,0,0,0,0,0,0,0,0,0,0,0,0,0,0,0,0,0,0,0,0,0,0,0,0,0,0,1.6,0,0,0,0,0,0,0,0,0,0,0,0,0,1.6,0,0,0,0
"HUN_022_MZB_LO_2","HUN_022_MZB_LO_2-20.10.2004","20.10.2004",2004,10,20,0,0,0,0,1.6,0,0,0,0,0,0,0,0,0,0,0,1.6,1.6,0,1.6,0,0,0,0,1.6,0,0,0,0,1.6,0,0,0,0,1.6,0,0,1.6,0,0,0,0,0,0,0,0,0,0,0,0,0,0,0,0,0,0,0,0,1.6,0,0,0,0,3.2,0,1.6,0,0,0,0,3.2,0,0,0,0,0,0,0,0,0,0,0,0,0,3.2,0,0,0,0,0,1.6,0,1.6,0,0,1.6,0,0,0,0,0,1.6,0,0,0,0,0,1.6,0,0,0,0,0,0,0,1.6,0,0,0,0,0,0,0,0,0,1.6,0,0,0,0,0,0,0,0,0,0,0,0,0,0,0,0,0,0,0,0,0,0,0,0,0,0,3.2,0,0,0,0,0,0,0,0,0,0,0,0,0,0,0,0,0,0
"HUN_022_MZB_LO_2","HUN_022_MZB_LO_2-28.09.2006","28.09.2006",2006,9,28,0,0,0,0,0,0,0,0,0,0,0,0,0,0,0,0,0,0,0,9.6,0,0,0,0,0,0,0,0,0,25.6,0,0,0,0,12.8,0,0,81.6,0,0,0,0,0,0,0,0,1.6,0,0,0,0,0,0,0,3.2,0,0,0,1.6,0,0,0,8,97.6,0,0,0,0,0,0,0,0,0,0,0,0,0,0,0,0,0,0,0,0,32,0,0,0,0,0,4.8,0,24,0,0,0,0,0,0,0,0,1.6,0,0,0,0,0,6.4,0,0,0,0,0,0,0,12.8,0,0,0,0,0,0,0,0,0,0,0,0,0,0,0,0,0,0,0,0,0,0,0,0,0,0,0,0,0,0,0,0,0,0,0,0,0,0,0,0,0,0,0,0,0,0,0,0,0,0,0,4.8,0,0,0
"HUN_022_MZB_LO_2","HUN_022_MZB_LO_2-17.08.2007","17.08.2007",2007,8,17,0,0,0,0,0,0,0,0,0,0,0,0,0,0,0.8,0,0,1.6,0,1.6,0,0,0,0,14.4,0,0,0,0,280,0,0,1.6,0,32,0,0,12,0,0,0,0,0,0,0,0,6.4,0,0,0,0,0.8,0,0,0.8,0,0,0,0,0,0,0,0,65.6,0,0,0,0,0.8,0,0,0,0,0.8,0,0,0,0,0,0,0,0,0,0,8.8,0,0,0,0,0,3.2,0,0,0,0,0.8,0,0,0,0,0,8,0,0,0,0,0,24,0,0,0,0,0,0,0,8,0,0,0,0,0,0,0,0,0,1.6,0,0,0,0,0,0,0,0,0,0,0,0,0,0,0,0,0,0,0,0,0,0,0,0,0,0,5.6,0,0,0,0,0,0,0,0,0,0,0,0,0,0.8,48,0,0,0
"HUN_022_MZB_LO_2","HUN_022_MZB_LO_2-19.09.2008","19.09.2008",2008,9,19,0,0,0,0,1.333333333,0,0,0,0,0,0,0,0,0,0,0,0,0,0,0,0,0,0,0,0,0,0,0,0,120,0,0,0,0,66.66666667,0,0,40,0,0,0,0,0,0,0,2.666666667,1.333333333,0,0,0,0,0,0,0,0,0,0,0,2.666666667,0,0,0,0,97.333333333,0,5.333333333,0,0,0,0,0,0,0,0,0,0,0,0,0,0,0,0,0,0,32.000000003,0,0,0,0,0,10.66666667,0,0,0,0,0,0,0,0,0,0,2.666666667,0,0,0,0,0,80,0,0,0,0,0,0,0,60,0,0,0,0,0,0,0,0,0,9.333333333,1.333333333,0,0,0,0,0,0,0,0,0,0,0,0,0,0,0,0,0,0,0,0,0,0,0,0,0,5.333333333,0,0,0,0,0,0,0,0,0,0,0,0,0,0,1.333333333,0,0,0
"HUN_022_MZB_LO_2","HUN_022_MZB_LO_2-22.09.2009","22.09.2009",2009,9,22,0,0,0,0,1.6,0,0,0,0,0,0,0,0,0,0.8,0,0,0,0,0,0,0,0,0,0,0,0,0,0,100,0,0,0,0,4,0,0,161.6,0,0,0,0,0,0,0,0,0.8,1.6,0,0,0,0,0,0,0.8,0,0,0,0.8,0,0,0,0,408,0,0,0,0,0,0,0,0,0,0,0,0,0,0,0,0,0,0,0,0,0.8,0,0,0,0,0,3.2,0,40,0,0,0,0,0,0,0,0,0.8,0,0,0,0,0,76,0,0,0,0,0,0,0,192,0,0,0,0,0,0,0,0,0,0,0,0,0,0,0,0,0,0,0,0,0,0,0,0,0,0,0,0,0,0,0,0,0,0,0,0,0,0,0,0,0,0,0,2.4,0,0,0,0,0,0,4,0,0,0,0
"HUN_022_MZB_LO_2","HUN_022_MZB_LO_2-29.10.2010","29.10.2010",2010,10,29,0,0,0,0,0,0,0,0,0,0,0,0,0,0,0,0,0,0,0,0.8,0,0,0,0,0.8,0,0,0,0,96,0,0,0,0,7.2,0,0,80,0,0,0,0,0,0,0,0,0,0,0,0,0,0,0,0,0,0,0,0,0.8,0,0,0,0,153.6,0,0,0,0,0,0,0,0,0,0,0,0,0,0,0,0,0,0,0,0,0,0,0,0,0,0,2.4,0,0.8,0,0,0,0,0,0,0,0,0,0,0,0,0,0,34.4,0,0,0,0,0,0,0,180,0,0,0,0,0,0,0,0,0,0,0,0,0,0,0,0,0,0,0,0.8,0,0,0,0,0,0,0,0,0,0,0,0,0,0,0,0,0,0,0,0,0,0,0,0,0,0,0,0,0,0,0,0,0,0,0
"HUN_022_MZB_LO_2","HUN_022_MZB_LO_2-27.10.2011","27.10.2011",2011,10,27,0,0,0,0,0,0,0,0,0,0,0,0,0,0,0,0,0,0.8,0,0.8,0,0,0,0,0.8,0,0,0.8,0,4.8,0,0,0,0,15.2,0,0,25.6,0,0,0,0,1.6,0,0,5.6,0,0,0,0,0,0,0,0,0,0,0,0,0.8,0,0,0,0,67.2,0,0.8,0,0,0,0,0.8,0,0,0,0,0,0,0,0,0,0,0,0,0,5.6,0,0,0,0,0,5.6,0,2.4,0,0,0,0,0,0,0,0,1.6,0,0,0,0,0,3.2,0,0,0,0,0,0,0,328,0,0,0,0,0,0,0,0,0,0,0,0,0,0,0,0,0,0,0,0,0,0,0,0,0,0,0,0,0,0,0,0,0,0,0,0,0.8,0,0,0,0,0,0,0,0,0,0,0,0,0,0.8,0,0,0,0
"HUN_022_MZB_LO_2","HUN_022_MZB_LO_2-12.10.2012","12.10.2012",2012,10,12,0,0,0,0,0,0,0,0,0,0,0,0,0,0,0,0,0,0,0,0.8,0,0,0,0,0,0,0,0,0,1.6,0,0,0.8,0,44.8,0,0.8,0.8,0,0,0,0,0,0,0,1.6,1.6,0,0,0,0,0,0,0,0,0,0,0,0,0,0,0,0,32.8,0,0,0,0,0,0,0,0,0,0,0,0,0,0,0,0,0,0,0,0,17.6,0,0,0,0,0,0.8,0,0.8,0,0,0,0,0,0,0,0,1.6,0,0,0,0,0,12.8,0,0,0,0,0,0,0,8,0,0,0,0,0,0,0,0,0,0,0,0,0,0,0,0,0,0,0,0,0,0,0,0,0,0,0,0,0,0,0,0,0,0,0,0,0,0,0,0,0,0,0,0,0,0,0,0,0,0,0,1.6,0,0,0
"HUN_022_MZB_LO_2","HUN_022_MZB_LO_2-03.10.2013","03.10.2013",2013,10,3,0,0,0,0,0,0,0,0,0,0,0,0,0,0,0,0,0,0,0,0.8,0,0,0,0,0,0,0,0,0,5.6,0,0,0,0,11.2,0,0,5.6,0,0,0,0,0,0,0,0,0,0.8,0,0,0,0,0,0,0,0,0,0,0.8,0,0,0,0,68,0,0,0,0,0,0,0,0,0,0,0,0,0,0,0,0,0,0,0,0,3.2,0,0,0,0,0,0,0,1.6,0,0,0,0,0,0,0,0,1.6,0,0,0,0,0,3.2,0,0,0,0,0,0,0,24,0,0,0,0,0,0,0,0,0,0,0,0,0,0,0,0,0,0,0,0.8,0,0,0,0,0,0,0,0,0,0,0,0,0,0,0,0,0,0,0,0,0,0,0,6.4,0,0,0,0,0,0,0.8,0.8,0,0,0
"HUN_022_MZB_LO_2","HUN_022_MZB_LO_2-10.10.2014","10.10.2014",2014,10,10,0,0,0,0,0,0,0,0,0,0,0,0,0,0,0,0,0,0,0,0.8,0,0,0,0,0,1.6,0,0,0,0.8,0,0,0.8,0,4,0,0,10.4,0,0,0,0,1.6,0,0,0,0.8,0,0,0,0,0,0,0,0,0,0,0,0.8,0,0,0,0,172.8,0.8,0,0,0,0,0,0,0,0,0,0,0,0.8,0,0,0,0,0,0,0,16,0,0,0,0,0,4,0,52,0,0,0,0,0,0,0,0,0,0,0,0,0,0,25.6,0,0,0,0,0,0,0,160,0,0,0,0,0,0,0,0,0,0.8,0,0,0,0,0,0,0,0,0,0,0,0,0,0,0,0,0,0,0,0,0,0,0,0,0,0,0.8,0,0,0,0,0,0,4.8,0,0,0,0,0,0,1.6,0,0,0,0
"HUN_022_MZB_LO_2","HUN_022_MZB_LO_2-01.10.2015","01.10.2015",2015,10,1,0,0,0,0,0.8,0,0,0,0,0,0,0,0,0,0,0,0,0,0,0,0,0,0,0,0,0,0,0,0,0,0,0,0,0,7.2,0,0,2.4,0,0,0,0,0,0,0,0,0,0,0,0.8,0,0.8,0,0,0,0,0,0,0,0,0,0,0,56.8,0,0,0,0,0,0,0,0,0,0,0,0,0,0,0,0,0,0,0,0,5.6,0,0,0,0,0,11.2,0,8.8,0,0,0,0,0,0,0,0,0,0,0,0,0,0,0,0,0,0,0,0,0,0,16,0,0,0,0,0,0,0,0,0,0,0,0,0,0,0,0,0,0,0,0,0,0,0,0,0,0,0,0,0,0,0,0,0,0,0,0,0,0,0,0,0,0,0,12.8,0,0,0,0,0,0,0,0,0,0,0
"HUN_022_MZB_LO_2","HUN_022_MZB_LO_2-31.08.2016","31.08.2016",2016,8,31,0,0,0,0,0.8,0,0,0,0,0,0,0,0,0,0,0,0,0,0,0.8,0,0,0,0,0,0,0,0,0,7.2,0,0,0,0,0,0,0,3.2,0,0,0,0,0,0,0,0,0,0,0,0,0,0,0,0,0,0,0,0,0,0,0,0,0.8,67.2,0,0,0,0,0,0,0,0,0,0,0,0,0,0,0,0,0,0,0,0,3.2,0,0,0,0,0.8,7.2,0,10.4,0,0,0,0,0,0,0,0,0,0,0,0,0,0,5.6,0,0,0,0,0,0,0,3.2,0,0,0,0,0,0,0,0,0,0,0,0,0,0,0.8,0,0,0,0,0,0,0,0,0,0,0,0,0,0,0,0,0,0,0,0,0,0,0,0,0,0,0,0,3.2,0,0,0,0,0,0,0,0,0,0,0
"HUN_022_MZB_LO_2","HUN_022_MZB_LO_2-31.08.2017","31.08.2017",2017,8,31,0,0,0,0,0,0,0,0,0,0,0,0,0,0,0,0,0,0,0,0,0,0,0,0,0,0,0,0,0,0,0,0,0,0,4,0,0,4,0,0,0,0,0,0,0,0,0,0,0,0,0,0,0,0,0,0,0,0,0,0,0,0,0.8,72,0,0,0,0,0,0,0,0,0,0,0,0,0,0,0,0,0,0,0,0,0.8,0,0,0,0,0,2.4,0,18.4,0,0,0,0,0,0,0,0,0,0,0,0,0,0,0.8,0,0,0,0,0,0,0,0.8,0,0,0,0,0,0,0,0,0,0,0,0,0,0,0,0,0,0,0,0,0,0,0,0,0,0,0,0,0,0,0,0,0,0,0,0,0,0,0,0,0,0,0,4,0,0,0,0,0,0,0,0,0,0,0
"HUN_022_MZB_LO_20","HUN_022_MZB_LO_20-09.06.2008","09.06.2008",2008,6,9,0,0,0,0,0,0,0,0,0,0,0,4,0,0,1.6,0,0,31.2,0,0,0,0,0,0,19.2,0,0,0,0,0,0,0,8,0,0,0,1.6,0,0,0,0,0,0,0,0,0,0,0,0,0,8.8,0,0,0,0,0,0,0,11.2,0,0,0,0,0,0,3.2,0,0,0,0,0,0.8,0,8,0,0.8,0,0,0,0,0,0,0,0,0,0,0,0.8,0,0,0,0,0,0,0,1.6,0,0,5.6,0,0,20,0,0,0,0,0,0,0,0,0,0,0.8,1.6,0,0,0,0,0,0,0,0,0,0,0,0,0,0,0,0,0,24,0,0,0,0,0,0,0,0,0,0,0,0,0,0,0,0,0,0,0,0,0,0,3.2,0,0,0,0,0,0,0,0,0,0,0,0,2.4,0,0,0
"HUN_022_MZB_LO_20","HUN_022_MZB_LO_20-25.05.2009","25.05.2009",2009,5,25,0,0,0,0,0,0,0,0,0,0,0,800,0,0,0,0,0,5.6,0,0,0,0,0,0,70.4,0,0,0,0,0,0,0,0.8,0,0,0,0,0,0,0,0,0,0,0,0,0,0,0,0,0,9.6,0,0.8,0,0,0,0,0,2.4,0,0,0,0,5.6,0,4,0,0,0,0,0,0,0,39.2,0,0,0,0.8,0,0,0,0,0,0,0,0,0,4,0,0,0,0,0,0,0,4.8,0,0,0.8,0,0,0,0,0,0,0,0,0,2.4,0,0,0,2.4,9.6,0,0,0,0,0,0,0,0,0,0,0,4,0,0,1.6,0,0,3.2,0,0,0,0,0,0,0,0,0,0,0,0,0,0,0.8,0,0,0,0,0,0,0,1.6,6.4,0,0,0,0,0,0,0,0,0,0,0,0,0,0,0
"HUN_022_MZB_LO_20","HUN_022_MZB_LO_20-04.05.2011","04.05.2011",2011,5,4,0,0,0,0,0,0,44.8,0,0,0,0,565.3333333,0,0,68.26666667,0,0,35.2,0,0,0,0,0,0,2.133333333,0,0,1.066666667,0,19.2,0,0,7.466666667,0,0,0,1.066666667,0,0,3.2,0,0,0,0,0,0,0,0,0,0,39.466666663,0,4.266666667,0,0,0,0,0,1.066666667,0,0,0,0,34.13333333,2.133333334,3.2,0,0,0,0,16.000000003,0,0,7.466666667,0,0,0,1.066666667,0,0,0,0,0,0,0,0,0,14.933333333,0,0,0,0,0,0,0,0,0,0,0,0,0,0,0,0,0,0,0,0,0,0,0,0,3.2,8.533333333,0,0,0,0,0,0,0,0,0,0,0,30.93333333,1.066666667,2.133333333,4.266666667,0,0,1.066666667,0,0,0,0,0,0,0,0,0,0,0,0,11.73333333,0,0,19.2,0,0,4.266666667,0,1.066666667,0,33.06666667,50.13333333,0,0,0,0,0,0,0,0,0,0,0,24.53333333,0,0,0
"HUN_022_MZB_LO_20","HUN_022_MZB_LO_20-09.05.2012","09.05.2012",2012,5,9,0,0,0,0,0,0,4.266666667,0,0,0,0,387.2,0,0,15.999999997,0,0,20.26666667,0,0,0,0,0,0,1.066666667,0,0,1.066666667,0,11.733333334,0,0,11.733333333,0,0,0,1.066666667,0,0,0,0,0,0,0,0,0,0,0,0,0,6.4,0,0,0,0,0,0,0,7.466666667,0,0,0,0,2.133333333,0,1.066666667,0,0,0,0,0,0,0,39.466666667,0,0,0,0,0,1.066666667,0,0,0,0,0,0,0,0,0,0,0,0,0,0,0,0,12.8,0,0,0,0,0,0,0,0,0,0,0,5.333333333,0,0,0,3.2,3.2,0,0,0,0,0,0,0,0,0,0,0,0,0,0,1.066666667,0,0,3.2,0,0,0,0,0,0,0,0,0,0,0,0,0,0,0,39.46666667,0,0,1.066666667,0,0,0,0,1.066666667,0,0,0,0,0,0,0,0,0,0,0,0,0,0,0
"HUN_022_MZB_LO_20","HUN_022_MZB_LO_20-07.05.2013","07.05.2013",2013,5,7,0,0,0,0,0,0,6.4,0,0,0,0,657.6,0,0,1.6,0,0,59.2,0,0,0,0,0,0,3.2,0,0,0,0,4.8,0,0,0.8,0,0,0,7.2,0,0,1.6,0,0,0,0,0,0,0,0,1.6,0,28,0,0,0,0,0,0,0,16,0,0,0,0,1.6,0,2.4,0,0,0,0,0,0,0,88.8,0,0.8,0,0,0,0,0,0,0,0,0,0,0,2.4,0,0,0,0,0,0,0,0,1.6,0,0,0,0,0,0,0,0,0,0,0,8,0,0,1.6,11.2,4.8,0,0,0,0,0,0,0,0,0,0,0,9.6,0,14.4,2.4,0.8,0,84,0,0,0,0,0,0,0,0,0,0,0,12,0,0,0,0.8,0,0,0,0.8,0,0,0.8,24.8,0,0,0,0,0,0,0,0,0,0,0,0,0,1.6,0
"HUN_022_MZB_LO_20","HUN_022_MZB_LO_20-05.06.2014","05.06.2014",2014,6,5,0,0,0,0,0,0,2.4,0,0,0,0,183.2,0,0,56,0,0,26.4,0,0,0,0,0,0,2.4,0,0,0,0,14.4,0,0,5.6,0,0,0,4.8,0,0,0,0,0,0,0,0,0,0,0,0,0,8.8,0,0.8,0,0,0,0,0,9.6,0,0,0,0,4,0.8,4.8,0,0,0,0,0,0,0,19.2,0,0,0,0,0,0,0,0,0,0,0,0,0,3.2,0,0,0,0,0,0,0,3.2,0,0,15.2,0,0,0,0,0,0,0,0,0,2.4,0,0,0,0,11.2,0,0,0,0,0,0,0,0,0,0,0,6.4,0,0,1.6,0,0,21.6,0,0,0,0,0,0,0,0,0,0,0,0,0.8,0,0,0,0,0,0,0,0,0,0,0.8,0,0,0,0,0,0,0,0,0,0,0,0,0,0.8,0
"HUN_022_MZB_LO_20","HUN_022_MZB_LO_20-18.05.2015","18.05.2015",2015,5,18,0,0,0,0,0,0,12.8,0,0,0,0,221.6,0,0,301.6,0,0,12.8,0,0,0,0,0,0,7.2,0,0,0.8,0,2.4,0,0,6.4,0,0,0,0,0,0,0,0,0,0,0,0,0,0,0,0,0,17.6,0,0,0,0,0,0,0,1.6,0,0,0,0,0,0.8,1.6,0,0,0,0,5.6,0,0,0.8,0,0,0,0,0,0.8,0,0,0,0,0,0,1.6,4,0,0,0,0,0,0,0,0,0,0,0,0,0,0,0,0,0,0,0,0,1.6,0,0,0,3.2,18.4,0,0,0,0,0,0,0,0,0,0,0,44.8,5.6,0.8,0.8,0.8,0,0,0,0,0,0,0,0,0,0,0,0,0,2.4,0,0,0,59.2,0,0,0,0,0,0,0,1.6,0,0,0,0,0,0,0,0,0,0,0,0,0,0.8,0
"HUN_022_MZB_LO_20","HUN_022_MZB_LO_20-10.05.2016","10.05.2016",2016,5,10,0,0,0,0,0,0,8,0,0,0,0,974.4,0,0,10.4,0,0,8.8,0,0,0,0,0,0,7.2,0,0,0.8,0,27.2,0,0,0,0,0,0,0,0,0,0,0,0,0,0,0,0,0,0,0,0,8.8,0,0,0,0,0,0,0,0.8,0,0,0,0,65.6,0,6.4,0,0,0,0,1.6,0,0,0,0,0,0,0,0,0.8,0,0,0,0,0,0,0.8,1.6,0,0,0,0,0,0,0,0.8,1.6,0,1.6,0,0,0,0,0,0,0,0,0,2.4,0,0,0,1.6,21.6,0,0.8,0,0,0,0,0,0,0,0,0,4.8,2.4,0.8,1.6,0,0,0.8,0,0,0,0,0,0,0,0,0,0,0,0,0,0,0,188.8,0,0,0,0,0,0,0.8,24.8,0,0,0,0,0,0,0,0,0,0,0,0,0,4,0
"HUN_022_MZB_LO_20","HUN_022_MZB_LO_20-19.06.2017","19.06.2017",2017,6,19,0,0,0,0,0,0,0.8,0,0,0,0,604,0,0,190.4,0,0,10.4,0,0,0,0,0,0,43.2,0,0,0,0,4.8,0,0,0,0,0,0,0.8,0,0,0,0,0,0,0,0,0,0,0,0,0,17.6,0,0,0,0,0,0,0,57.6,0,0,0,0,28,0.8,34.4,0,0,0,0,0,1.6,0,8,0,0.8,0,0,0,0,0,0,0,0,0,0,0,5.6,0,0,0,0,0,0,0,0,0,0,14.4,0,0,0,0,0,0,0,0,0,28.8,0,0,0,4.8,15.2,0,0,0,0,0,0,0,0,0,0,0,136.8,1.6,4.8,8,0,0,0,0,0,0,0,0,0,0,0,0,0,0,0,0,0,0,0,0,0,0,0,0,0,0,1.6,0,0,0,0,0,0,0,0,0,0,0,0,0,4.8,0
"HUN_022_MZB_LO_21","HUN_022_MZB_LO_21-08.09.2008","08.09.2008",2008,9,8,0,0,0,0,0,0,0,0,0,0,0,1.6,0,0,1.6,0,0,1.6,0,0,0,0,0,0,4.8,0,0,0,0,0,0,0,113.6,0,0,0,0,0,0,1.6,0,0,0,0,0,0,0,0,0,0,0,0,0,0,0,0,0,0,0,0,0,0,0,0,49.6,0,0,0,0,0,0,0,0,0,0,0,0,0,0,0,0,0,0,0,0,0,0,0,0,0,0,0,0,0,0,0,0,0,14.4,0,0,0,0,0,1.6,0,0,0,0,0,0,0,0,0,0,0,0,0,0,0,0,0,0,0,0,1.6,0,0,0,0,4.8,3.2,0,0,0,0,0,0,0,0,0,0,0,0,0,0,0,0,0,0,0,0,0,0,0,0,0,0,0,0,0,0,0,0,0,0,0,0,0,16,0
"HUN_022_MZB_LO_21","HUN_022_MZB_LO_21-12.08.2009","12.08.2009",2009,8,12,0,0,4.8,0,0,0,0,0,0,0,0,0.8,10.4,0,0.8,0,0.8,0,0,0,0,0,0,0,0,0,0,0,0,0,0,0,9.6,0,0,0,1.6,0,0,0,0,0,0,0,0,0,0,0,0,0,15.2,0,0,0,0,0,0,0,0,0,0,0,0,0,4,0,0,0,0,0,0,0,0,0,0,0,0,0,0,0,0,0,0,0,0,0,0,0.8,0,0,0,0,0,0,0,0,0,0,1.6,0,0,0,0,0,0,0,0,0,0,0,0,0,0.8,0,0,0,0,0,0,0,0,0,0,0,0,12,0,0,0,0,1.6,0,0,0,0,0,0,0,0,0,0,0,0,0,0,0,0,0,0,0,0,0,0,0,0,0,0,0,0,0,0,0,0,0,0,0,0,0,0,4.8,0
"HUN_022_MZB_LO_21","HUN_022_MZB_LO_21-30.08.2010","30.08.2010",2010,8,30,0,5.333333333,3.2,0,0,0,0,0,0,0,0,11.73333333,1.066666667,0,26.66666667,0,0,6.4,0,0,0,0,0,0,11.73333333,0,0,0,0,12.8,0,0,562.133333367,0,0,0,0,0,0,6.4,0,0,0,0,0,0,0,0,0,0,3.200000001,0,0,0,0,0,0,0,0,0,0,0,0,0,1.066666667,0,0,0,0,0,3.2,0,0,0,0,0,0,0,0,0,0,0,0,0,0,0,0,2.133333333,0,0,0,0,0,0,0,0,0,0,6.400000001,0,0,0,0,0,0,0,0,0,3.2,0,0,0,0,0,0,0,0,0,0,0,0,0,0,0,0,37.33333333,0,2.133333333,0,0,5.333333333,44.8,0,0,0,0,0,0,0,2.133333333,0,0,0,0,0,0,0,0,0,0,1.066666667,0,0,0,0,0,0,0,0,0,0,0,0,1.066666667,0,0,8.533333334,3.2,0,3.2,0
"HUN_022_MZB_LO_21","HUN_022_MZB_LO_21-21.09.2011","21.09.2011",2011,9,21,0,0,5.333333333,0,0,0,0,0,0,0,0,9.6,1.066666667,0,0,0,1.066666667,5.333333333,0,0,0,0,0,0,1.066666667,0,0,0,0,0,0,0,173.86666663,0,0,0,0,0,0,0,0,0,0,0,0,0,0,0,0,0,2.133333333,0,0,0,0,0,0,0,1.066666667,0,0,0,0,0,7.466666667,0,0,0,0,0,0,0,0,0,0,0,0,0,0,0,0,0,0,0,0,0,0,0,0,0,0,0,0,0,0,3.2,0,0,9.6,0,0,0,0,0,0,0,0,0,1.066666667,0,0,0,0,0,0,0,0,0,0,0,0,0,0,0,0,21.33333333,0,0,0,0,0,19.2,0,0,0,0,0,0,0,0,0,0,0,0,0,0,0,0,0,0,0,0,0,0,0,0,0,0,0,0,0,0,0,0,0,0,1.066666667,0,0,1.066666667,0
"HUN_022_MZB_LO_21","HUN_022_MZB_LO_21-01.08.2012","01.08.2012",2012,8,1,0,0,1.6,0,0,0,0,0,0,0,0,0.8,2.4,0,4.8,0,0,0.8,0,0,0,0,0,0,5.6,0,0,0,0,2.4,0,0,12.8,0,0,0,2.4,0,0,0,0,0,0,0,0,0,0,0,0,0,3.2,0,0,0,0,0,0,0,0,0,0,0,0,0,12,0,0,0,0,0,0,0,0,0.8,0,0,0,0,0,0,0,0,0,0,0,0,0.8,0,0,0,0,0,0,0,0,0,0,0,0.8,0,0.8,0,0,0,0,0,0,8,4,0,0,0.8,0,0,0,0,0,0,0,0,0,0,0,0,0,4.8,0,0,0,0,0.8,20.8,0,0.8,0,0,0,0,0,0,0,0,0,0,0,0,0,0,0,0,0,0,0,0,0,0,0,0,0,0,0,0,0,0,0,0,0,0,0,4.8,0
"HUN_022_MZB_LO_21","HUN_022_MZB_LO_21-11.09.2013","11.09.2013",2013,9,11,0,0,0,0,0,0,0,0,0,0,0,14.4,1.6,0,0,0,1.6,4.8,0,0,0,0,0,0,0,0,0,0,0,0.8,0,0,52,0,0,0.8,0,0,0,1.6,0,0,0,0,0,0,1.6,0,0,0,2.4,0,0,0,0,0,0,0,0,0,0,0,0,0,0,0,0,0,0,0,0,0,0,0.8,0,0,0,0,0,0,0,0,0,0,0,0,0,0,0,0,0,0,0,0,0,0,0,0,22.4,0,0,0,0,0,0,0,0,0,5.6,0,0,0,0.8,0,0,0,0,0,0,0,0,0,0,0,0,40,0,0.8,0,0,4,13.6,0,0,0,0,0,0,0,0,0,0,0,0,0,0,1.6,0,0,0,0,0,0,0,0,0,0.8,0,0,0,0,0,0,0,0,0,3.2,0,0,4.8,0
"HUN_022_MZB_LO_21","HUN_022_MZB_LO_21-06.08.2014","06.08.2014",2014,8,6,0,0,0.8,0,0,0,0,0,0,0,0,0.8,0,0,1.6,0,0,0,0,0,0,0,0,0,0.8,0,0,0,0,0,0,0,1.6,0,0,0.8,1.6,0,0,0,0,0,0,0,0,0,0,0,0,0,0,0,0,0,0,0,0,0,0,0,0,0,0,0,0.8,0,0,0,0,0,0.8,0,0,0,0,0,0,0,0,0,0,0,0,0,0,0,0,0,0,0,0,0,0,0,0,0,0,0,7.2,0,0,0,0,0,0,0,0,0,0.8,0,0,0,0.8,0,0,0,0,0,4,0,0,0,0,0,0,2.4,0,0,0,0,0,4,0,0,0,0,0,0,0,0,0,0,0,0,0,0,0,0,0,0,0,0,0,0,0,0,0,0,0,0,0,0,0,0,0,0,1.6,0,0,0.8,0
"HUN_022_MZB_LO_21","HUN_022_MZB_LO_21-07.09.2016","07.09.2016",2016,9,7,0,0,9.6,0,0,0,0,0,0,0,0,0,9.6,0,0,0,0,4.266666667,0,0,0,0,0,0,0,0,0,0,0,70.4,0,0,50.666666668,0,0,0,2.666666667,0,0,6.933333333,0,0,0,0,0,0,5.866666667,0,0,0,0,0,0,0,0,0,0,0,0,0,0,0,0,0,14.4,0,0,0,1.6,0,0,0,0,0,0,0,0,0,0,0,0,0,0,0,0,0,0,0,0,0,0,0,0,0,0,0,0,0,37.33333333,0,2.666666667,0,0,0,0,0,0,6.4,0,0,0,0,0,0,0,1.6,0,0,0,0,0,0,0,0,0,4.8,0,0,0,0,1.6,0,0,0,0,0,0,0,0,0,0,0,0,0,0,0,6.4,0,0,0,0,0,0,0,0,0,0,0,0,0,0,0,0,0,0,0,0,2.666666667,0,3.2,0
"HUN_022_MZB_LO_21","HUN_022_MZB_LO_21-06.09.2017","06.09.2017",2017,9,6,0,0,9.6,0,0,0,0,0,0,0,0,0,0,0,3.2,0,0,3.2,0,0,0,0,0,0,8,0,0,0,0,12.8,0,0,113.6,0,0,0,0,0,0,6.4,0,0,0,0,0,0,4.8,0,0,0,1.6,0,0,0,0,0,0,0,0,0,0,0,0,0,16,0,0,0,0,0,0,0,0,0,0,0,0,0,0,0,0,0,0,0,0,0,0,0,0,0,0,0,0,0,0,0,0,0,20.8,0,0,3.2,0,0,9.6,0,0,0,0,0,0,0,0,0,0,3.2,0,0,0,0,0,0,0,0,0,12.8,0,0,0,0,0,0,0,0,0,0,0,0,0,0,0,0,0,0,0,0,6.4,0,0,0,0,0,0,0,0,0,0,0,0,0,0,0,0,0,0,0,0,6.4,12.8,0,0
"HUN_022_MZB_LO_22","HUN_022_MZB_LO_22-11.08.2005","11.08.2005",2005,8,11,0,0,0,0,0,0,0,0,0,0,0,0,1.6,0,0,0,0,0,0,0,0,0,0,0,0,1.6,0,0,0,3.2,0,0,0,0,0,0,0,12.8,0,0,0,0,0,0,0,0,4.8,0,0,0,0,0,0,0,0,0,0,0,0,0,0,0,0,16,0,0,0,0,4.8,0,0,0,0,0,0,0,3.2,0,0,0,0,0,0,0,174.4,0,0,0,0,0,0,0,0,0,0,0,0,0,0,0,0,0,0,0,0,0,0,0,0,0,0,0,0,0,0,1.6,0,0,0,0,0,0,0,0,0,0,0,0,0,0,0,0,0,0,0,0,0,0,0,0,0,0,0,0,0,0,0,0,0,0,0,0,0,0,0,0,0,0,0,0,0,0,0,0,0,0,40,0,0,0,0
"HUN_022_MZB_LO_22","HUN_022_MZB_LO_22-13.09.2006","13.09.2006",2006,9,13,0,0,0,0,0,0,0,0,0,0,0,0,0,0,0,0,0,0,0,0,0,0,0,0,0,0,0,0,0,0,0,0,0,0,0,0,0,8,0,0,0,0,0,0,0,0,0,0,0,0,0,0,0,0,0,0,0,0,0,0,0,0,0,19.2,0,0,0,0,4.8,0,0,0,0,0,0,0,3.2,0,0,0,0,0,0,0,160,0,0,0,0,0,0,0,0,0,0,0,0,0,0,0,0,0,0,0,0,0,0,0,0,0,0,0,0,0,0,3.2,0,0,0,0,0,0,0,0,0,0,0,0,0,0,0,0,0,0,0,0,0,0,0,0,0,0,0,0,0,0,0,0,0,0,0,0,0,0,0,0,0,0,0,8,0,0,0,0,0,0,16,0,0,0,0
"HUN_022_MZB_LO_22","HUN_022_MZB_LO_22-18.10.2007","18.10.2007",2007,10,18,0,0,0,0,0,0,0,0,0,0,0,0,0,0,0,0,0,0,0,0,0,0,0,0,0,0,0,0,0,0,0,0,0,0,0,0,0,125.6,0,0,0,0,0,0,0,0,0.8,0,0,0,0,0,0,0,0,0,0,0,0,0,0,0,0,26.4,0,0,0,0,9.6,0,0,0,0,0,0,0,1.6,0,0,0,0,0,0,0,316,0,0,0,0,0,0,0,0,0,0,0,0,0,0,0,0,0,0,0,0,0,0,0,0,0,0,0,0,0,0,10.4,0,0,0,0,0,0,0,0,0,0,0,0,0,0,0,0,0,0,0,0,0,0,0,0,0,0,0,0,0,0,0,0,0,0,0,0,0,0,0,0,0,0,0,10.4,0,0,0,0,1.6,0,12,0,0,0,0
"HUN_022_MZB_LO_22","HUN_022_MZB_LO_22-29.10.2008","29.10.2008",2008,10,29,0,0,0,0,0,0,0,0,0,0,0,0,0,0,0,0,0,0,0,0,0,0,0,0,0,0,0,0,0,0,0,0,0,0,0,0,0,20.8,0,0,0,0,0,0,0,0,0,0,0,0,0,0,0,0,0,0,0,0,0,0,0,0,0,12,0,0,0,0,11.2,0,0,0,0,0,0,0,0,0,0,0,0,0,0,0,432,0,0,0,0,0,0,0,0,0,0,0,0,0,0,0,0,0,0,0,0,0,0,0,0,0,0,0,0,0,0,48,0,0,0,0,0,0,0,0,0,0,0,0,0,0,0,0,0,0,0,0,0,0,0,0,0,0,0,0,0,0,0,0,0,0,0,0,0.8,0,0,0,0,0,0,0,0,0,0,0,0,0,2.4,0,0,0,0
"HUN_022_MZB_LO_22","HUN_022_MZB_LO_22-24.09.2009","24.09.2009",2009,9,24,0,0,0,0,0,0,0,0,0,0,0,0,0,0,0,0,0,0,0,0,0,0,0,0,0,6.4,0,0,0,0,0,0,1.066666667,0,18.13333333,0,0,108.8,0,0,0,0,0,0,0,0,8.533333333,0,0,0,0,0,0,0,0,0,0,0,0,0,0,0,0,0,0,0,0,0,50.13333333,0,0,0,0,0,0,0,2.133333334,0,0,0,0,0,0,0,594.1333333,0,0,0,0,0,0,0,0,0,0,0,0,0,0,0,0,2.133333333,0,0,0,0,0,1.066666667,1.066666667,0,0,0,0,0,0,22.4,0,0,0,0,0,0,0,0,0,13.86666667,0,0,0,0,26.66666667,1.066666667,0,0,0,0,0,0,0,0,0,0,0,0,0,0,0,0,0,0,0,0,2.133333333,0,0,0,0,0,0,106.6666667,0,0,0,0,0,0,16,0,0,0,0
"HUN_022_MZB_LO_22","HUN_022_MZB_LO_22-06.09.2010","06.09.2010",2010,9,6,0,0,0,0,0,0,0,0,0,0,0,0,0.8,0,0,0,0,0,0,0,0,0,0,0,0,0,0,0,0,0,0,0,0,0,0,0,0,3.2,0,0,0,0,0,0,0,0,1.6,0,0,0,0,0,0,0,0,0,0,0,0,0,0,0,0,10.4,0,0,0,0,1.6,0,0,0,0,0,0,0,1.6,0,0,0,0,0,0,0,572,0,0,0,0,0,0,0,0,0,0,0,0,0,0,0,0,0,0,0,0,0,0,1.6,0,0,0,0,0,0,0,7.2,0,0,0,0,0,0,0,0,0,0,0,0,0,0,0,0,0,0,0,0,0,0,0,0,0,0,0,0,0,0,0,0,0,0,0,0,0,0,0,0,0,0,0,0,0,0,0,0,0,0,0,0,0,0,0
"HUN_022_MZB_LO_22","HUN_022_MZB_LO_22-25.08.2011","25.08.2011",2011,8,25,0,0,0,0,0,0,0,0,0,0,0,0,0,0,0,0,0,0,0,0,0,0,0,0,0,0,0,0,0,0,0,0,2.133333333,0,0,0,0,59.73333333,0,0,0,0,0,0,0,0,7.466666667,0,0,0,0,0,0,0,0,0,0,0,0,0,0,0,0,94.93333333,9.6,0,0,0,11.73333333,0,0,0,0,0,0,0,1.066666667,0,0,0,0,0,0,0,178.1333333,0,0,0,0,0,0,0,0,0,0,0,0,0,0,0,0,1.066666667,0,0,0,0,0,133.3333333,0,0,0,0,0,0,0,10.66666667,0,0,0,1.066666667,0,0,0,0,0,1.066666667,0,0,0,0,0,0,0,1.066666667,0,0,0,0,0,0,0,0,0,0,0,0,0,0,0,0,0,0,3.200000001,0,0,0,0,0,0,0,0,0,0,0,0,0,24.533333337,0,0,0,0
"HUN_022_MZB_LO_22","HUN_022_MZB_LO_22-06.09.2012","06.09.2012",2012,9,6,0,0,0,0,0,0,0,0,0,0,0,0,0,0,0,0,0,0,0,0,0,0,0,0,0,4.8,0,0,0,0,0,0,0,0,4,0,0,52.8,0,0,0,0,0,0,0,0,34.4,0,0,0,0,0,0,0,0,0,0,0,0,0,0,0,0,19.2,2.4,0,0,0,10.4,0,0,0,0,0,0,0,0.8,0,0,0,0,0,0,0,136.8,0,0,0,0,0,0,0,0,0,0,0,0,0,0.8,0,0,1.6,0,0,0,0,0,0,0,0,0,0,0,0,0,63.2,0,0,0,0,0,0,0,0,0,8,0,0,0,0,0.8,0,0,0.8,0,0,0,0,0,0,0,0,0,0,0,0,0,0,0,0,0,0,0,0,0,0,0,0,0,14.4,0,0,0,0,0,0,18.4,0,0,0,0
"HUN_022_MZB_LO_22","HUN_022_MZB_LO_22-02.09.2014","02.09.2014",2014,9,2,0,0,0,0,0,0,0,0,0,0,0,0,1.6,0,0,0,0,0,0,0,0,0,0,0,0,5.6,0,0,0,0,0,0,0,0,0,0,0,0,0,0,0,0,0,0,0,0,10.4,0,0,0,0,0,0.8,0,0,0,0,0,0,0,0,0,0,4,1.6,0,0,0,4.8,0,0,0,0,0,0,0,6.4,0,0,0,0,0,0,0,275.2,0,0,0,0,0,0,0,0,0,0,0,0,0,0,0,0,0.8,0,0,0,0,0,0,0.8,0,0,0,0,0,0,12.8,0,0,0,0,0,0,0,0,0,0.8,0,0,0,0,0.8,0,0,0,0,0,0,0,0,0,0,0,0,0,0,0,0,0,0,0,0,0,4,0,0,0,0,0,0,26.4,0,0,0,0,0,0,0,0.8,0,0.8,0
"HUN_022_MZB_LO_22","HUN_022_MZB_LO_22-18.09.2015","18.09.2015",2015,9,18,0,0,0,0,0,0,0,0,0,0,0,0,0,0,0.8,0,0,0,0,0,0,0,0,0,0,0,0,0,0,0,0,0,1.6,0,1.6,0,0,0.8,0,0,0,0,0,0,0,0,8.8,0,0,0,0,0,0,0,0,0,0,0,0,0,0,0,0,16,0,0,0,0,0.8,0,0,0,0,0,0,0,0,0,0,0,0,0,0,0,104,0,0,0,0,0,0,0,0,0,0,0,0,0,0,0,0,0.8,0,0,0,0,0,0,0,0,0,0,0,0,0,25.6,0,0,0,0,0,0,0,0,0,8.8,0,0,0,0,8,0,0,0,0,0,0,0,0,0,0,0,0,0,0,0,0,0,0,0,0,0,0,0,0,0,0,0,0,13.6,0,0,0,0,0,0,12,0,0,0,0
"HUN_022_MZB_LO_22","HUN_022_MZB_LO_22-08.09.2016","08.09.2016",2016,9,8,0,0,0,0,0,0,0,0,0,0,0,0,0.8,0,0,0,0,0,0,0,0,0,0,0,0,0.8,0,0,0,0,0,0,0,0,0,0,0,21.6,0,0,0,0,0,0,0,0,2.4,0,0,0,0,0,0,0,0,0,0,0,0,0,0,0,0,4,0,0,0,0,4.8,0,0,0,0,0,0,0,2.4,0,0,0,0,0,0,0,36,0,0,0,0,0,0,0,0,0,0,0,0,0,0,0,0,0,0,0,0,0,0,0,0,0,0,0,0.8,0,0,8,0,0,0,0,0,0,0,0,0,0,0,0,0,0,0,0,0,0,0,0,0,0,0,0,0,0,0,0,0,0,0,0,0,0,0,0,0,0,0,0,0,0,0,9.6,0,0,0,0,0,0,4.8,0,0,0,0
"HUN_022_MZB_LO_22","HUN_022_MZB_LO_22-02.10.2017","02.10.2017",2017,10,2,0,0,0,0,0,0,0,0,0,0,0,0,0,0,0,0,0,0,0,0,0,0,0,0,0,2.4,0,0,0,0,0,0,4,0,2.4,0,0,81.6,0,0,0,0,0,0,0,0,1.6,0,0,0,0,0,0,0,0,0,0,0,0,0,0,0,0,0.8,0,0,0,0,0.8,0,0,0,0,0,0,0,0,0,0,0,0,0,0,0,440,0,0,0,0,0,0,0,0,0,0,0,0,0,0,0,0,0,0,0,0,0,0,0,0,0,0,0,0,0,0,70.4,0,0,0,0,0,0,0,0,0,0,0,0,0,0,0.8,0,0,0,0,0,0,0,0,0,0,0,0,0,0,0,0,0,0,0,0,0,0,0,0,0,0,0,0,9.6,0,0,0,0,0,0,3.2,0,0,0,0
"HUN_022_MZB_LO_23","HUN_022_MZB_LO_23-17.10.2001","17.10.2001",2001,10,17,0,0,0,0,0,0,0,0,0,0,0,0,0,0,0,0,0,1.6,0,0,0,0,0,0,0,0,0,1.6,0,1.6,0,0,0,0,0,0,0,1.6,0,0,0,0,0,0,0,0,0,0,0,0,0,0,0,0,0,0,0,0,0,0,0,0,0,1.6,0,0,0,0,0,0,0,0,0,0,0,0,0,0,0,0,0,0,0,0,1.6,0,0,0,0,0,0,0,0,0,0,0,0,0,0,0,0,0,0,0,0,0,0,1.6,0,0,0,0,0,0,0,1.6,0,0,0,0,0,0,0,0,0,0,0,0,0,0,1.6,0,0,0,0,0,0,0,0,0,0,0,0,0,0,0,0,0,0,0,0,0,1.6,0,0,0,0,0,0,0,0,0,0,0,0,0,1.6,0,0,0,0
"HUN_022_MZB_LO_23","HUN_022_MZB_LO_23-17.09.2002","17.09.2002",2002,9,17,0,0,0,0,0,0,0,0,0,0,0,0,1.6,0,0,0,0,0,0,0,0,0,0,0,0,1.6,0,0,0,1.6,0,0,1.6,0,0,0,0,1.6,0,0,0,0,0,0,0,0,0,0,0,0,0,1.6,0,0,0,0,0,0,0,0,0,0,0,0,0,0,0,0,0,0,0,0,0,0,0,0,0,0,0,0,0,0,0,0,0,0,0,0,0,0,0,0,0,0,0,0,0,0,1.6,0,0,0,0,0,0,0,0,1.6,1.6,0,0,0,0,0,0,0,0,0,0,0,0,0,0,0,0,1.6,0,0,1.6,0,1.6,0,0,0,0,0,0,0,0,0,0,0,0,0,0,0,0,0,0,0,0,0,1.6,0,0,0,0,0,0,0,0,0,0,0,0,0,4.8,0,0,0,0
"HUN_022_MZB_LO_23","HUN_022_MZB_LO_23-22.09.2003","22.09.2003",2003,9,22,0,0,0,0,0,0,0,0,0,0,0,0,0,0,0,0,0,0,0,0,0,0,0,0,0,0,0,0,0,0,0,0,0,0,0,0,0,0,0,0,0,0,0,0,0,0,0,0,0,0,0,0,0,0,0,0,0,0,0,0,0,0,0,0,0,0,0,0,0,0,0,0,0,0,0,0,0,0,0,0,0,0,0,0,0,0,0,0,0,0,0,0,0,0,0,0,0,0,1.6,0,0,0,0,0,0,0,0,1.6,0,0,0,0,0,0,0,1.6,0,0,0,0,0,0,0,0,0,0,0,0,0,0,0,0,0,0,0,0,0,0,0,0,0,0,0,0,0,0,0,0,0,0,0,0,0,0,0,0,0,0,0,0,0,0,0,0,0,0,0,0,0,0,0
"HUN_022_MZB_LO_23","HUN_022_MZB_LO_23-18.09.2007","18.09.2007",2007,9,18,0,0,0,0,0,0,0,0,0,0,0,0,0,0,4.8,0,0,0,0,0,0,0,0,0,0,0,0,0,0,3.2,0,0,11.2,0,0,0,0,0,0,0,0,0,0,0,0,0,0,0,0,0,0,0,0,0,0,0,0,0,0,0,0,0,0,0,0,0,0,0,0,0,0,0,0,0,0,1.6,0,0,0,0,0,0,0,0,0,0,0,0,0,0,0,0,0,0,0,0,0,0,0,0,0,0,0,0,0,0,0,1.6,0,0,0,0,0,0,0,3.2,0,0,0,0,0,0,0,0,0,0,0,0,0,0,4.8,0,0,0,0,0,0,0,0,0,0,0,0,0,0,0,0,0,0,0,0,0,0,0,0,0,0,0,0,0,0,0,0,0,0,0,0,0,0,0,0
"HUN_022_MZB_LO_23","HUN_022_MZB_LO_23-14.10.2008","14.10.2008",2008,10,14,0,0,0,0,0,0,0,0,0,0,0,0,0,0,0,0,0,0,0,0,0,0,12.8,0,0,0,0,0,0,1.6,0,0,0,0,0,0,1.6,0,0,0,0,0,0,0,0,0,0,0,0,0,0,0,0,0,0,0,0,0,0,0,0,0,0,0,0,0,0,0,0,0,0,0,0,0,0,0,0,0,0,0,0,0,0,0,0,0,0,0,0,0,0,0,0,0,0,0,0,0,0,0,0,1.6,0,0,0,0,0,0,0,0,0,0,0,0,0,70.4,0,0,0,0,0,0,0,0,0,0,0,0,0,0,1.6,0,0,0,0,0,0,0,0,0,0,0,0,0,0,0,0,0,0,0,0,0,0,0,0,0,0,0,0,0,0,0,0,0,0,0,0,0,0,0,0
"HUN_022_MZB_LO_23","HUN_022_MZB_LO_23-01.09.2009","01.09.2009",2009,9,1,0,0,0,0,0,0,0,0,0,0,0,0,0,0,0,0,0,0,0,0,0,0,0,0,0,0,0,0,0,24,0,0,0,0,0,1.6,0,0,0,0,0,0,0,0,0,0,0,0,0,0,0,0,0,0,0,0,0,0,0,0,0,0,0,1.6,0,0,0,0,0,0,0,0,0,0,0,0,0,0,0,0,0,0,0,0,0,0,0,0,0,0,0,0,0,0,0,0,0,0,0,0,0,3.2,0,0,0,0,0,0,0,0,0,0,0,0,0,0,0,0,0,0,0,0,0,0,0,1.6,0,0,0,0,0,0,0,0,0,0,0,0,0,0,0,0,0,0,0,0,0,0,0,0,0,0,0,0,0,0,0,0,0,0,0,0,0,0,0,0,3.2,1.6,0,1.6,0
"HUN_022_MZB_LO_23","HUN_022_MZB_LO_23-13.09.2011","13.09.2011",2011,9,13,0,0,0,0,0,0,0,0,0,0,0,0,0,0,0,0,0,0,0,0,0,0,0,0,0,1.6,0,0,0,9.6,0,0,1.6,0,0,0,0,0,0,0,0,0,0,0,0,0,0,0,0,0,0,0,0,0,0,0,0,0,0,0,0,0,0,1.6,0,0,0,0,1.6,0,0,0,0,0,0,0,0,0,0,0,0,0,0,0,1.6,0,0,0,0,0,0,0,0,0,0,0,0,0,4.8,0,0,3.2,0,0,0,0,0,4.8,0,0,0,0,0,0,0,4078.4,0,0,0,0,0,0,0,0,0,30.4,0,0,0,0,0,0,0,0,0,0,0,0,0,0,0,0,0,0,0,0,3.2,0,0,0,0,0,0,0,0,0,0,0,0,0,0,0,0,0,0,0,0,0,0,0,0
"HUN_022_MZB_LO_23","HUN_022_MZB_LO_23-26.09.2012","26.09.2012",2012,9,26,0,0,0,0,0,0,0,0,0,0,0,0,0,0,0,0,0,1.6,0,0,0,0,0,0,0,0,0,0,0,30.4,0,0,14.4,0,0,0,0,0,0,0,0,0,0,0,0,0,0,0,0,0,3.2,0,0,0,0,0,0,0,0,0,0,0,0,3.2,0,0,0,0,0,0,0,0,0,0,0,0,0,0,0,0,0,0,0,0,0,0,0,0,0,0,0,0,0,0,0,0,0,0,14.4,0,0,0,0,0,0,0,0,1.6,0,0,0,1.6,0,0,0,12.8,0,0,0,0,0,0,0,0,0,6.4,0,0,0,0,0,0,0,0,0,0,0,0,0,1.6,0,0,0,0,0,0,0,0,0,0,0,0,0,0,0,0,0,0,0,0,0,0,0,0,0,0,0,0,0,0,0
"HUN_022_MZB_LO_23","HUN_022_MZB_LO_23-20.09.2013","20.09.2013",2013,9,20,0,0,0,0,0,0,0,0,0,0,0,0,0,0,0,0,0,0,0,0,0,0,0,0,0,1.6,0,0,0,148.8,0,0,12.8,0,0,0,1.6,3.2,0,0,0,0,0,0,0,0,0,0,0,0,0,0,0,0,0,0,0,0,0,0,0,0,0,8,4.8,0,0,0,0,0,0,0,0,0,0,0,0,0,0,0,0,0,0,0,0,0,0,0,0,0,0,0,0,1.6,0,0,0,0,3.2,0,0,3.2,0,0,0,0,0,96,0,0,0,0,0,0,0,1819.2,0,0,0,0,0,0,0,0,0,32,0,0,0,0,4.8,0,0,0,0,0,0,0,0,0,0,0,0,0,0,0,0,0,0,0,0,0,0,0,0,0,0,0,0,0,0,0,0,0,0,0,3.2,0,0,0,0
"HUN_022_MZB_LO_23","HUN_022_MZB_LO_23-14.10.2014","14.10.2014",2014,10,14,0,0,0,0,0,0,0,0,0,0,0,0,0,0,40,0,0,0,0,0,0,0,0,0,0,0,0,0,0,91.2,0,0,3.2,0,0,0,0,1.6,0,0,0,0,0,0,0,0,0,0,0,0,3.2,0,0,0,0,0,0,0,0,0,0,0,0,6.4,0,0,0,0,0,0,0,0,0,0,0,0,0,0,0,0,0,0,0,0,0,0,0,0,0,0,0,0,0,0,0,0,0,0,0,0,0,0,0,0,0,0,0,16,0,0,0,0,0,0,0,8,0,0,0,0,0,0,0,0,0,12.8,0,0,0,0,0,0,0,0,0,0,20.8,0,0,0,0,0,0,0,0,0,0,0,0,0,0,0,0,0,0,0,0,0,0,0,0,0,0,0,0,0,0,0,0,3.2,0
"HUN_022_MZB_LO_23","HUN_022_MZB_LO_23-24.09.2015","24.09.2015",2015,9,24,0,0,0,0,0,0,0,0,0,0,0,0,0,0,0,0,0,0,0,0,0,0,0,0,0,1.6,0,0,0,19.2,0,0,0,0,1.6,0,0,0,0,0,0,0,0,0,0,0,0,0,0,0,3.2,0,0,0,0,0,0,0,0,0,0,0,0,4.8,0,0,0,0,0,0,0,0,0,0,0,0,0,0,0,0,0,0,0,0,0,0,0,0,0,0,0,0,0,0,0,0,0,0,0,0,0,0,0,0,0,0,0,44.8,0,0,0,0,0,0,0,4.8,0,0,0,0,0,0,0,0,0,0,0,0,0,0,8,0,0,0,0,0,0,0,0,0,0,0,0,0,0,0,0,0,0,0,0,0,0,0,0,0,0,0,0,0,0,0,0,0,0,0,0,0,0,3.2,0
"HUN_022_MZB_LO_23","HUN_022_MZB_LO_23-14.09.2016","14.09.2016",2016,9,14,0,0,0,0,0,0,0,0,0,0,0,0,0,0,0,0,0,0,0,0,0,0,0,0,1.6,1.6,0,0,0,14.4,0,0,0,0,0,0,0,11.2,0,0,0,0,0,0,0,0,0,0,0,0,1.6,0,0,0,0,0,0,0,0,0,0,0,0,6.4,0,0,0,0,0,0,0,0,0,0,0,0,0,0,0,0,0,0,0,0,1.6,0,0,0,0,0,0,0,0,0,0,0,0,0,0,0,0,0,0,0,0,0,0,11.2,0,0,0,0,0,0,0,305.6,0,0,0,0,0,0,0,0,0,0,0,0,0,0,1.6,0,0,0,0,0,0,0,0,0,0,0,0,0,0,0,0,0,0,0,0,0,1.6,0,0,0,0,0,0,0,0,0,0,0,0,0,6.4,0,0,0,0
"HUN_022_MZB_LO_24","HUN_022_MZB_LO_24-17.10.2001","17.10.2001",2001,10,17,0,0,0,0,0,0,0,1.6,0,0,0,0,0,0,0,0,0,1.6,0,0,0,0,0,0,0,0,0,0,0,1.6,0,0,0,0,0,0,0,0,0,0,0,0,0,0,0,0,0,0,0,0,0,0,1.6,0,0,0,0,0,0,0,0,0,0,1.6,0,0,0,0,0,0,0,0,0,0,0,0,0,0,0,0,0,0,0,0,0,0,0,0,4.8,0,0,0,0,0,0,1.6,0,0,0,0,0,0,0,0,0,0,0,0,0,0,0,0,0,0,0,1.6,0,0,0,0,0,0,0,0,0,1.6,0,0,0,1.6,0,0,0,0,0,0,0,0,0,0,0,0,0,0,0,0,0,0,0,0,0,0,1.6,0,0,0,0,0,0,0,0,0,0,0,0,0,1.6,1.6,0,0,0
"HUN_022_MZB_LO_24","HUN_022_MZB_LO_24-17.09.2002","17.09.2002",2002,9,17,0,0,0,0,0,0,0,1.6,0,0,0,0,0,0,1.6,0,0,0,0,0,0,0,0,0,0,1.6,0,0,0,1.6,0,0,0,0,0,0,0,0,0,0,0,0,0,0,0,0,0,0,0,0,0,0,0,0,0,0,0,0,0,0,0,0,0,1.6,1.6,0,0,0,1.6,0,0,0,0,0,0,0,1.6,0,0,0,0,0,0,0,0,0,0,0,3.2,0,0,0,0,0,0,0,0,0,0,0,0,0,0,0,0,0,0,0,0,0,0,0,0,0,0,1.6,0,0,0,0,0,0,0,0,0,1.6,0,0,0,0,1.6,0,0,0,0,0,0,0,0,0,0,0,0,0,0,0,0,0,0,0,0,0,1.6,0,0,0,0,0,0,0,0,0,0,0,0,0,1.6,0,0,0,0
"HUN_022_MZB_LO_24","HUN_022_MZB_LO_24-22.09.2003","22.09.2003",2003,9,22,0,0,0,0,0,0,0,1.6,0,0,0,0,0,0,0,0,0,0,0,0,0,0,0,0,1.6,0,0,0,0,1.6,0,0,0,0,0,0,0,0,0,0,0,0,0,0,0,0,0,0,0,0,0,0,1.6,0,0,0,0,0,0,0,0,0,0,0,0,0,0,0,1.6,0,0,0,0,0,0,0,1.6,0,0,0,0,0,0,0,0,0,0,0,3.2,0,0,0,0,0,0,0,0,0,0,0,0,0,0,0,0,0,0,0,0,0,0,0,0,0,0,1.6,0,0,0,0,0,0,0,0,0,0,0,0,0,0,0,0,0,0,0,0,0,0,0,0,0,0,0,0,0,0,0,0,0,0,0,0,1.6,0,0,0,0,0,0,0,0,0,0,0,0,0,4.8,0,0,0,0
"HUN_022_MZB_LO_24","HUN_022_MZB_LO_24-18.09.2007","18.09.2007",2007,9,18,0,0,32,0,0,0,0,160,0,0,0,0,0,0,25.6,0,0,6.4,0,0,0,0,0,0,0,3.2,0,6.4,0,867.2,0,0,0,0,0,0,3.2,0,0,0,0,0,0,0,0,0,0,0,0,0,0,0,0,0,0,0,0,0,0,0,0,0,0,0,0,0,0,0,0,0,0,0,0,0,0,0,3.2,0,0,0,0,0,0,0,0,0,0,0,32,0,0,0,0,0,0,0,0,0,0,0,0,0,0,0,0,0,0,0,0,0,0,0,0,0,0,70.4,0,0,0,0,0,0,0,0,0,0,0,0,0,3.2,0,0,0,3.2,0,0,0,0,0,0,0,0,0,0,0,0,0,0,0,0,0,0,0,0,0,0,0,0,0,0,0,0,0,0,0,0,0,0,0,0,0
"HUN_022_MZB_LO_24","HUN_022_MZB_LO_24-07.10.2008","07.10.2008",2008,10,7,0,0,0,0,0,0,0,288,0,0,0,0,0,0,67.2,0,0,0,0,0,0,0,0,0,9.6,0,0,0,0,268.8,0,0,0,0,0,0,0,0,0,0,0,0,0,0,0,0,0,0,0,0,6.4,0,0,0,0,0,0,0,0,0,0,0,0,294.4,0,0,0,0,6.4,0,0,0,0,0,0,0,9.6,0,0,0,0,0,0,0,0,0,0,0,569.6,0,0,0,0,0,0,0,0,0,0,0,0,3.2,0,0,0,0,0,0,0,0,0,0,0,0,0,0,0,0,3.2,0,0,0,0,0,0,0,0,0,0,0,0,0,0,0,0,0,0,0,0,0,0,0,0,0,0,0,0,0,0,0,0,0,16,0,0,0,0,3.2,0,0,0,0,0,0,0,0,3.2,0,0,0,0
"HUN_022_MZB_LO_24","HUN_022_MZB_LO_24-06.09.2010","06.09.2010",2010,9,6,0,0,0,0,0,0,0,0,0,0,0,0,0,0,0,0,0,0,0,0,0,0,0,0,0,0,0,0,0,8,0,0,0,0,0,0,0,0,0,0,0,0,0,0,0,0,0,0,0,0,0,0,0,0,0,0,0,0,0,0,0,0,0,0,0,0,0,0,0,0,0,0,0,0,0,0,0,0,0,0,0,0,0,0,0,0,0,0,0,0,0,0,0,0,0,0,0,0,0,0,0,0,0,0,0,0,0,0,0,0,0,0,0,0,0,11.2,0,0,0,0,0,0,0,0,0,0,0,0,0,0,0,0,0,0,0,0,0,0,0,0,0,0,0,0,0,0,0,0,0,0,0,0,0,0,0,0,0,0,0,0,0,0,0,0,0,0,0,0,0,0,0
"HUN_022_MZB_LO_24","HUN_022_MZB_LO_24-13.09.2011","13.09.2011",2011,9,13,0,0,0,0,9.6,0,2.133333333,0,0,0,0,0,0,0,5.333333333,2.133333333,17.06666667,4.266666667,0,0,0,0,0,0,0,4.266666667,0,0,0,81.06666666,0,0,0,0,0,0,0,0,0,0,0,0,0,0,0,0,0,0,0,0,0,0,0,1.066666667,0,0,0,0,0,0,0,0,0,59.733333333,0,0,0,0,0,0,0,0,0,0,0,0,0,2.133333333,0,0,0,0,0,0,0,0,0,1.066666667,160.00000003,0,0,0,0,0,0,0,0,0,0,0,0,1.066666667,0,0,0,0,0,0,0,0,0,0,0,0,0,23.466666663,0,0,0,0,0,0,0,0,0,3.2,0,0,0,0,0,0,0,0,0,0,0,0,0,0,0,0,0,0,0,0,0,0,0,0,0,0,13.866666667,0,0,0,0,0,0,0,0,0,0,0,0,0,0,18.133333337,0,0,0
"HUN_022_MZB_LO_24","HUN_022_MZB_LO_24-26.09.2012","26.09.2012",2012,9,26,0,0,0,0,0,0,0,0,0,0,0,0,0,0,28.8,0,0,0,0,0,0,0,0,0,0,6.4,0,0,0,22.4,0,0,0,0,0,0,0,0,0,0,0,0,0,0,0,0,0,0,0,0,0,3.2,0,0,0,0,0,0,0,0,0,0,0,91.2,1.6,0,0,0,0,0,0,0,0,0,0,0,0,0,0,0,0,0,0,0,0,0,0,1.6,1211.2,0,0,0,0,0,0,0,0,0,0,0,0,0,0,0,0,0,0,0,0,0,0,0,0,0,0,43.2,0,0,0,0,0,0,0,0,0,9.6,0,0,0,0,0,0,0,0,0,0,0,0,0,0,0,0,0,0,0,0,0,4.8,0,0,0,0,0,0,0,0,0,1.6,0,0,0,0,0,1.6,0,0,1.6,0,0,0,0
"HUN_022_MZB_LO_24","HUN_022_MZB_LO_24-20.09.2013","20.09.2013",2013,9,20,0,0,0,0,0,0,0,0,0,0,0,0,0,0,0,0,0,0,0,0,0,0,0,0,0,0,0,0,0,4,0,0,5.333333333,0,0,0,2.666666666,0,0,0,0,0,0,0,0,0,0,0,0,0,0,1.333333333,0,0,0,0,0,0,2.666666667,0,0,0,0,30.66666667,0,0,0,0,2.666666667,0,0,0,0,0,0,0,0,0,0,0,0,0,0,0,0,0,0,0,0,0,0,0,0,0,0,0,0,0,0,0,0,0,0,0,0,0,0,0,0,0,0,0,0,0,0,4,0,0,0,0,0,0,0,0,0,1.333333333,0,0,0,0,4,0,0,0,0,0,0,0,0,0,0,0,0,0,0,0,0,0,0,0,0,0,0,0,0,0,0,0,0,0,0,0,0,0,0,0,0,0,0,0,0
"HUN_022_MZB_LO_24","HUN_022_MZB_LO_24-14.10.2014","14.10.2014",2014,10,14,0,0,0,0,0,0,0,0,0,0,0,1.6,0,0,3.2,0,0,0,0,0,0,0,0,0,0,19.2,0,0,0,6.4,0,0,0,0,0,0,1.6,0,0,0,0,0,0,0,0,0,0,0,0,0,1.6,0,0,0,0,0,0,0,3.2,0,0,0,0,630.4,1.6,0,0,0,0,0,0,0,0,0,0,0,3.2,0,0,0,0,0,0,0,0,0,0,0,11.2,0,0,0,0,0,0,0,0,0,0,0,0,0,0,0,0,0,0,0,0,0,0,0,0,0,0,11.2,0,0,0,0,0,0,0,0,0,160,1.6,0,0,0,20.8,0,0,0,0,0,0,0,0,0,0,0,0,0,0,0,0,0,0,0,0,0,4.8,0,0,0,0,0,0,0,0,0,0,0,0,0,0,0,0,0,0
"HUN_022_MZB_LO_24","HUN_022_MZB_LO_24-24.09.2015","24.09.2015",2015,9,24,0,0,0,0,0,0,0,0,0,0,0,0,0,0,0,0,0,0,0,0,0,0,0,0,0,11.2,0,0,0,8,0,0,3.2,0,0,0,1.6,0,0,0,0,0,0,0,0,0,0,0,0,0,1.6,0,0,0,0,0,0,0,3.2,0,0,0,0,68.8,0,0,0,0,1.6,0,0,0,0,0,0,0,0,0,0,0,0,0,0,0,0,0,0,0,0,0,0,0,0,0,0,0,0,0,0,0,0,0,0,0,0,0,0,0,0,0,0,0,0,0,0,27.2,0,0,0,0,0,0,0,0,0,0,0,0,0,0,8,0,0,0,0,0,0,0,0,0,0,0,0,0,0,0,0,0,0,0,0,0,0,0,0,0,0,0,0,0,0,0,0,0,0,0,0,0,0,0,0
"HUN_022_MZB_LO_24","HUN_022_MZB_LO_24-14.09.2016","14.09.2016",2016,9,14,0,0,0,0,0,0,0,0,0,0,0,0,0,0,100.8,0,0,0,0,0,0,0,0,0,0,33.6,0,0,0,12.8,0,0,0,0,113.6,0,0,0,0,0,0,0,0,0,0,0,0,0,0,0,0,0,3.2,0,0,0,0,0,3.2,0,0,0,0,275.2,0,0,0,0,0,0,0,1.6,0,0,0,0,56,0,0,0,0,0,0,0,0,0,0,0,376,0,0,0,0,0,0,0,0,0,0,0,0,0,0,0,0,0,0,0,0,0,0,0,0,0,0,9.6,0,0,0,0,0,0,0,0,0,0,0,0,0,0,1.6,0,0,0,0,0,0,0,0,0,0,0,0,0,0,0,0,44.8,0,0,0,0,49.6,0,0,0,0,0,0,0,0,0,0,0,0,0,0,0,0,0,0
"HUN_022_MZB_LO_25","HUN_022_MZB_LO_25-09.09.2008","09.09.2008",2008,9,9,0,0,0,0,0,0,0,0,0,0,0,0,0,0,0,0,0,0,0,0,0,0,0,0,0,0,0,2,0,18,0,0,0,0,38,0,8,0,0,0,0,0,0,0,0,0,1,0,0,0,0,0,0,0,0,0,0,0,1,39,0,0,0,205,0,0,0,0,0,0,0,0,0,0,0,0,0,0,0,0,0,0,0,0,23,0,0,0,14,0,0,0,6,0,0,0,0,0,0,0,0,0,0,0,0,0,0,0,0,0,0,0,0,0,0,27,0,0,0,0,0,0,0,0,0,0,0,0,0,0,1,0,0,0,0,0,0,0,0,0,0,0,0,0,0,0,0,0,0,0,0,0,0,0,0,0,0,0,0,428,0,0,0,0,0,0,4,0,0,0,0
"HUN_022_MZB_LO_25","HUN_022_MZB_LO_25-10.09.2009","10.09.2009",2009,9,10,0,0,0,0,0,0,0,0,0,0,0,0,0,0,1.6,0,0,0,0,0,0,0,0,0,0,0,0,0,0,36.8,0,0,0,0,11.2,0,0,1.6,0,0,0,0,0,0,0,0,0,0,0,0,0,0,0,0,0,0,0,0,0,6.4,0,0,0,382.4,0,0,0,0,0,0,0,0,0,0,0,0,0,0,0,0,0,0,0,0,33.6,0,0,0,11.2,0,0,0,1.6,0,0,1.6,0,0,0,0,0,0,0,0,0,0,0,0,0,0,0,0,0,0,0,19.2,0,0,0,0,0,0,0,0,0,3.2,0,0,0,0,0,0,0,0,0,0,0,0,0,0,0,0,0,0,0,0,0,0,0,0,0,0,0,0,0,0,0,0,0,9.6,0,0,0,0,0,0,0,0,0,0,0
"HUN_022_MZB_LO_25","HUN_022_MZB_LO_25-05.10.2011","05.10.2011",2011,10,5,0,0,0,0,0,0,0,0,0,0,0,0,0,0,0,0,0,0,0,0,0,0,0,0,0,0,0,0,0,0,0,0,0,0,99.2,0,0,17.6,0,0,0,0,0,0,0,0,6.4,0,0,0,0,0,0,0,0,0,0,0,0,3.2,0,0,0,364.8,0,0,0,0,0,0,0,0,0,0,0,0,0,0,0,0,0,0,0,0,408,0,0,0,1.6,0,0,0,196.8,0,0,0,0,0,0,0,0,0,0,0,0,0,0,0,0,0,0,0,0,0,0,57.6,0,0,0,0,0,0,0,0,0,0,0,0,0,0,0,0,0,0,0,0,0,0,0,0,0,0,0,0,0,0,0,0,0,0,0,0,0,0,0,0,0,0,0,804.8,0,0,0,0,0,0,4.8,0,0,0,0
"HUN_022_MZB_LO_25","HUN_022_MZB_LO_25-23.08.2012","23.08.2012",2012,8,23,0,0,0,0,0,0,0,0,0,0,0,0,0,0,0,0,0,0,0,0,0,0,0,0,0,0,0,0,0,11.2,0,0,0,0,137.6,0,6.4,27.2,0,0,0,0,0,0,0,0,4.8,0,0,0,0,0,0,0,0,0,0,0,0,38.4,0,0,0,446.4,0,0,0,0,0,0,0,0,0,0,0,0,0,0,0,0,0,0,0,0,846.4,0,0,0,108.8,0,0,0,20.8,0,0,0,0,0,0,0,0,0,0,0,0,0,0,0,0,0,0,0,0,0,0,24,0,0,0,0,0,0,0,0,0,0,0,0,0,0,0,0,0,0,0,0,0,0,0,0,0,0,0,0,0,0,0,0,0,0,0,0,27.2,0,0,0,0,0,0,1913.6,0,0,0,0,0,0,4.8,0,0,1.6,0
"HUN_022_MZB_LO_25","HUN_022_MZB_LO_25-10.09.2013","10.09.2013",2013,9,10,0,0,0,0,0,0,0,0,0,0,0,0,0,0,0,0,0,0,0,1.6,0,0,0,0,0,0,0,0,0,4.8,0,0,0,0,3876.8,0,0,195.2,0,0,0,0,0,0,0,0,9.6,0,0,0,0,0,0,0,0,0,0,0,0,65.6,0,0,0,2304,0,1.6,0,0,0,0,0,0,0,0,0,0,9.6,0,0,0,0,0,0,0,272,0,0,0,1531.2,0,0,0,512,0,0,4.8,0,0,0,0,0,0,0,0,0,0,0,0,0,0,0,0,0,0,0,72,0,0,0,0,0,0,0,0,0,0,0,0,0,0,0,0,0,0,0,0,0,0,0,0,0,0,0,0,0,0,0,56,0,0,0,0,0,0,0,0,0,0,0,1326.4,0,0,0,0,0,0,3.2,0,0,0,0
"HUN_022_MZB_LO_25","HUN_022_MZB_LO_25-22.10.2014","22.10.2014",2014,10,22,0,0,0,0,0,0,0,0,0,0,0,0,0,0,0,0,0,0,0,3.2,0,0,0,0,0,0,0,0,0,16,0,0,1.6,0,1100.8,0,0,0,0,0,0,0,0,0,0,0,6.4,0,0,0,6.4,0,0,0,0,0,0,0,12.8,36.8,0,0,0,705.6,0,0,0,0,0,0,0,0,0,0,0,0,0,0,0,0,0,0,0,0,945.6,0,0,0,25.6,0,0,0,38.4,0,0,0,0,0,0,0,0,0,0,0,0,0,0,6.4,0,0,0,0,0,0,0,83.2,0,0,0,0,0,0,0,0,0,0,0,0,0,0,0,0,0,0,0,0,0,0,0,0,0,0,0,0,0,0,0,0,0,0,0,0,0,0,0,0,0,0,0,902.4,0,0,0,0,0,0,9.6,0,0,6.4,0
"HUN_022_MZB_LO_25","HUN_022_MZB_LO_25-01.09.2016","01.09.2016",2016,9,1,0,0,0,0,0,0,0,0,0,0,0,0,0,0,1.6,0,0,1.6,0,0,0,0,0,0,0,0,0,0,0,318.4,0,0,0,0,43.2,0,0,0,0,0,0,0,0,0,0,0,0,0,0,0,1.6,0,0,0,0,0,0,0,1.6,25.6,0,0,0,248,1.6,0,0,0,0,0,0,0,0,0,0,0,0,0,0,0,0,0,0,0,97.6,0,0,0,25.6,0,0,0,33.6,0,0,0,0,0,0,0,0,0,0,0,0,0,0,3.2,0,0,0,0,0,0,0,153.6,0,0,0,0,0,0,0,0,0,16,0,0,0,0,3.2,1.6,0,0,0,0,0,0,0,0,0,0,0,0,0,0,0,0,0,0,0,0,0,0,0,0,0,0,0,936,0,0,0,0,0,0,1.6,0,0,0,0
"HUN_022_MZB_LO_25","HUN_022_MZB_LO_25-27.10.2017","27.10.2017",2017,10,27,0,0,0,0,0,0,0,0,0,0,0,0,0,0,0,0,0,0,0,0,0,0,0,0,0,0,0,0,0,25.6,0,0,0,0,19.2,0,0,0,0,0,0,0,0,0,0,0,0,0,0,0,0,0,0,0,0,0,0,0,0,12.8,0,0,0,307.2,0,0,0,0,0,0,0,0,0,0,0,0,0,0,0,0,0,0,0,0,211.2,0,0,0,19.2,0,0,0,4.8,0,0,0,0,0,1.6,0,0,0,0,0,0,0,0,3.2,0,0,0,0,0,0,0,80,0,0,0,0,0,0,0,0,0,0,0,0,0,0,0,0,0,0,0,0,0,0,0,0,0,0,0,0,0,0,0,0,0,0,0,0,1.6,0,0,0,0,0,0,388.8,0,0,0,0,0,0,0,0,0,1.6,0
