"Unique.ID","Samp.ID","Sampling.date","year","month","day","ABLABESMYIA MONILIS","ACENTRIA EPHEMERELLA","ACROLOXUS LACUSTRIS","AESHNIDAE GEN. SP.","AGRYPNIA OBSOLETA","AGRYPNIA PAGETANA","AGRYPNIA VARIA","ALBOGLOSSIPHONIA HETEROCLITA","AMETROPUS SP.","AMPULLACEANA AMPLA","AMPULLACEANA BALTHICA","AMPULLACEANA LAGOTIS","ANODONTA SP.","APATANIA SP.","APHELOCHEIRUS AESTIVALIS","AQUARIUS NAJAS","ASELLUS AQUATICUS","ASTACUS SP.","ATHERICIDAE GEN. SP.","BAETIDAE GEN. SP.","BERAEA SP.","BERAEODES MINUTUS","BITHYNIA SP.","BORYSTHENIA NATICINA","BRACHYCENTRUS SP.","CAENIDAE GEN. SP.","CALOPTERYX SP.","CALOPTERYX SPLENDENS","CAPNIA SP.","CAPNOPSIS SCHILLERI SSP.","CATACLYSTA LEMNATA","CERATOPOGONIDAE GEN. SP.","CHAOBORUS SP.","CHIRONOMIDAE GEN. SP.","CHLOROPERLA SP.","CHRYSOPILUS SP.","COENAGRIONIDAE GEN. SP.","CORDULEGASTER BOLTONII","CORDULIA AENEA","CORIXIDAE GEN. SP.","COROPHIIDAE GEN. SP.","CRANGONYCTIDAE GEN. SP.","CRUNOECIA SP.","CULICIDAE GEN. SP.","CYLINDROTOMIDAE GEN. SP.","DENDROCOELUM LACTEUM","DICRANOTA BIMACULATA","DIXIDAE GEN. SP.","DOLICHOPODIDAE GEN. SP.","DREISSENA POLYMORPHA","DRYOPIDAE GEN. SP.","DUGESIIDAE GEN. SP.","DYTISCIDAE GEN. SP.","ECHINOGAMMARUS WARPACHOWSKYI","ELMIDAE GEN. SP.","ELOPHILA SP.","EMPIDIDAE GEN. SP.","EPHEMERA SP.","EPHEMERELLA SP.","EPHYDRIDAE GEN. SP.","EPITHECA BIMACULATA","ERPOBDELLA SP.","EURYLOPHELLA KARELICA","GALBA TRUNCATULA","GAMMARUS SP.","GLOSSIPHONIA SP.","GLOSSOSOMATIDAE GEN. SP.","GOERIDAE GEN. SP.","GOMPHUS SP.","GORDIUS AQUATICUS","GYRINIDAE GEN. SP.","HAEMOPIS SANGUISUGA","HALIPLIDAE GEN. SP.","HELOBDELLA SP.","HELOPHORUS SP.","HEMICLEPSIS MARGINATA","HEPTAGENIA SP.","HYDRAENIDAE GEN. SP.","HYDROCHUS SP.","HYDROPHILIDAE GEN. SP.","HYDROPSYCHIDAE GEN. SP.","HYDROPTILIDAE GEN. SP.","ILYOCORIS CIMICOIDES SSP.","ISOPTENA SERRICORNIS","KAGERONIA FUSCOGRISEA","LEPIDOSTOMA BASALE","LEPIDOSTOMA HIRTUM","LEPTOCERIDAE GEN. SP.","LEPTOPHLEBIIDAE GEN. SP.","LESTIDAE GEN. SP.","LEUCTRA SP.","LIBELLULA SP.","LIMNEPHILIDAE GEN. SP.","LIMONIIDAE GEN. SP.","LITHOGLYPHUS NATICOIDES","LYMNAEA SP.","LYPE PHAEOPA","LYPE REDUCTA","MICRASEMA SP.","MOLANNA SP.","MUSCIDAE GEN. SP.","MYSIDAE GEN. SP.","MYXAS GLUTINOSA","NEMOURA SP.","NEMURELLA PICTETII","NEPA CINEREA","NOTIDOBIA CILIARIS","NOTONECTA SP.","OBESOGAMMARUS CRASSUS","ODELES MARGINATA","ODONTOCERUM ALBICORNE","OLIGOCHAETA GEN. SP.","OLIGOSTOMIS RETICULATA","OMPHISCOLA GLABRA","ONYCHOGOMPHUS FORCIPATUS","OPHIOGOMPHUS CECILIA","ORCONECTES LIMOSUS","ORTHETRUM SP.","PARAPOYNX SP.","PEDICIA SP.","PEREGRIANA PEREGRA","PERLODIDAE GEN. SP.","PHRYGANEA BIPUNCTATA","PHRYGANEA GRANDIS SSP.","PHYSA SP.","PHYSELLA ACUTA","PISCICOLA GEOMETRA","PLACOBDELLA COSTATA","PLANARIA SP.","PLANORBIDAE GEN. SP.","PLATYCNEMIS SP.","PLEA SP.","POLYCENTROPODIDAE GEN. SP.","PONTOGAMMARUS SP.","POTAMANTHUS LUTEUS","POTAMOPYRGUS ANTIPODARUM","PROTONEMURA SP.","PSEUDANODONTA SP.","PSYCHODIDAE GEN. SP.","PSYCHOMYIA SP.","PTYCHOPTERA SP.","RADIX SP.","RANATRA LINEARIS","RHYACOPHILIDAE GEN. SP.","SERICOSTOMA SP.","SERRATELLA IGNITA","SIALIS SP.","SIMULIIDAE GEN. SP.","SOMATOCHLORA SP.","SPHAERIIDAE GEN. SP.","STAGNICOLA CORVUS","STAGNICOLA PALUSTRIS","STRATIOMYIDAE GEN. SP.","SYMPETRUM SP.","SYRPHIDAE GEN. SP.","TABANIDAE GEN. SP.","TAENIOPTERYX NEBULOSA","THEODOXUS FLUVIATILIS SSP.","THEROMYZON TESSULATUM","TINODES SP.","TIPULIDAE GEN. SP.","UNIO SP.","VALVATA SP.","VIVIPARUS SP."
"LTU_053_MZB_LO_1","LTU_053_MZB_LO_1-04.10.2010","04.10.2010",2010,10,4,0,0,0,0,0,0,0,0,4,0,0,0,0,0,3,0,22,0,0,33,0,0,0,0,40,0,8,8,0,0,0,0,0,59,0,0,0,0,0,0,31,0,0,0,0,0,0,0,0,0,0,0,2,0,1,0,0,1,0,0,0,25,0,0,66,0,0,0,3,0,2,0,0,0,0,0,29,0,0,0,43,0,0,0,0,0,0,0,0,0,0,0,4,0,0,5,0,0,0,0,0,0,0,1,0,0,0,0,0,0,0,17,0,0,2,0,0,0,0,0,0,0,0,0,0,0,1,0,0,0,8,0,0,0,5,0,0,0,0,0,0,0,0,0,0,0,0,11,0,2,0,0,0,0,0,0,0,0,0,0,4,0,0,0
"LTU_053_MZB_LO_1","LTU_053_MZB_LO_1-03.10.2011","03.10.2011",2011,10,3,0,0,0,0,0,0,0,0,0,0,0,0,0,0,9,0,169,0,0,140,0,0,0,0,72,0,189,189,0,0,0,0,0,217,0,0,0,0,49,0,16,0,0,0,0,0,0,88,0,0,0,0,0,0,92,0,0,0,0,0,0,69,0,0,157,0,0,0,56,0,0,0,0,0,0,0,24,0,0,0,460,0,0,0,0,0,0,0,0,0,0,0,64,0,72,76,0,0,0,0,64,0,0,0,0,1,0,0,0,0,0,56,0,0,0,0,0,0,0,0,0,0,0,0,0,0,0,0,0,0,69,0,0,0,0,0,0,0,0,0,0,0,0,36,0,0,0,0,0,208,0,0,0,0,0,0,0,0,0,0,85,0,0,0
"LTU_053_MZB_LO_1","LTU_053_MZB_LO_1-01.10.2012","01.10.2012",2012,10,1,0,0,0,0,0,0,0,0,0,0,0,0,0,0,28,0,0,0,16,19,0,0,18,51,0,0,28,28,0,0,0,0,0,214,0,0,0,0,0,0,39,0,0,0,0,0,18,1,0,0,0,0,0,0,0,0,0,24,0,0,0,44,0,0,54,0,0,0,8,0,0,0,0,21,0,0,0,0,0,0,0,0,0,0,0,0,0,0,0,0,0,0,4,0,0,170,0,0,0,0,0,0,0,0,0,1,0,0,0,0,0,178,0,0,0,0,0,0,0,0,0,0,0,0,0,0,0,0,0,46,16,0,0,0,0,0,0,0,0,0,0,0,0,0,0,0,0,0,0,120,0,0,0,0,0,58,0,0,0,0,24,17,0,0
"LTU_053_MZB_LO_1","LTU_053_MZB_LO_1-07.10.2013","07.10.2013",2013,10,7,0,0,0,0,0,0,0,0,0,0,0,0,0,0,199,0,37,0,58,234,0,0,0,0,92,0,21,21,0,0,0,0,0,271,0,0,21,0,0,25,0,0,0,0,0,0,108,0,0,0,0,0,0,0,0,0,0,0,0,0,0,25,0,0,35,0,0,0,9,0,0,0,0,0,0,0,149,0,0,0,372,0,0,0,37,0,0,0,0,0,0,0,0,0,0,77,0,0,0,0,0,0,0,0,0,0,0,7,0,0,0,249,0,0,0,0,0,0,0,0,0,0,0,0,0,0,0,0,0,0,21,0,0,0,0,0,0,0,0,0,32,8,0,0,0,0,0,0,0,116,0,0,0,0,0,36,0,0,0,0,68,4,0,0
"LTU_053_MZB_LO_1","LTU_053_MZB_LO_1-06.10.2014","06.10.2014",2014,10,6,0,0,0,0,0,0,0,0,0,0,0,0,0,0,39,0,22,0,10,60,0,0,20,24,39,0,39,39,0,0,0,0,0,88,0,0,0,0,0,0,0,0,0,0,0,0,39,0,0,0,0,0,0,0,0,0,0,0,0,0,0,6,0,0,46,0,0,0,4,0,11,0,0,0,0,0,0,0,0,0,45,0,0,0,0,0,0,0,0,0,0,0,0,0,0,20,0,0,0,0,0,12,0,0,0,0,0,0,0,0,0,119,0,0,0,0,0,0,0,0,0,0,0,0,0,0,0,0,0,0,0,0,18,0,0,0,0,0,0,0,0,0,0,0,0,0,0,0,0,49,0,0,0,0,0,0,0,0,0,0,46,0,0,0
"LTU_053_MZB_LO_1","LTU_053_MZB_LO_1-05.10.2015","05.10.2015",2015,10,5,0,0,0,0,0,0,0,0,0,0,0,0,0,0,13,0,5,0,0,46,0,0,0,26,62,18,4,4,8,0,0,0,0,59,0,0,6,0,0,0,0,5,0,0,0,0,0,0,0,0,0,0,0,0,0,0,0,3,0,0,0,4,0,0,11,0,0,0,0,0,0,0,0,0,0,0,46,0,0,0,48,0,0,0,0,0,0,38,0,0,0,0,0,0,78,75,0,0,0,0,35,16,0,0,0,0,0,0,0,0,0,250,0,0,0,0,0,0,0,0,0,0,0,0,0,0,0,0,0,55,8,0,0,0,0,0,0,0,0,0,0,8,0,0,0,0,0,30,0,271,0,0,0,0,0,8,0,18,0,0,67,18,0,0
"LTU_053_MZB_LO_1","LTU_053_MZB_LO_1-03.10.2016","03.10.2016",2016,10,3,0,0,0,0,0,0,0,0,0,0,0,0,0,0,10,0,47,0,0,0,0,0,0,0,0,0,19,19,0,0,0,0,0,413,0,0,6,0,0,16,0,1,0,0,0,0,0,0,0,0,0,0,0,0,0,0,0,0,0,0,0,5,0,0,49,1,0,0,0,0,0,0,0,3,0,0,25,0,0,0,33,0,0,0,0,0,0,0,0,0,0,0,0,0,491,38,0,0,0,0,0,0,0,0,0,0,0,0,0,0,0,1200,0,0,1,0,0,0,0,0,0,0,0,0,0,0,1,0,0,0,4,0,23,0,0,0,0,0,0,0,0,0,0,0,0,0,0,680,0,34,0,0,0,0,0,6,0,0,0,0,1,0,0,22
"LTU_053_MZB_LO_1","LTU_053_MZB_LO_1-02.10.2017","02.10.2017",2017,10,2,0,0,0,0,0,0,0,0,0,0,0,0,0,0,0,0,28,0,0,119,0,0,12,0,0,28,22,22,0,0,0,0,0,58,0,0,0,0,0,23,0,38,0,0,0,0,0,11,0,0,0,0,1,0,0,0,0,6,0,0,0,8,0,0,144,0,0,0,0,0,0,0,0,0,0,0,0,0,0,0,29,0,1,0,0,0,0,0,0,0,0,0,0,0,87,43,0,0,0,0,0,0,0,0,0,3,0,0,0,0,0,124,0,0,0,0,0,0,0,0,0,0,0,0,47,0,1,0,0,53,0,0,0,0,0,0,0,0,0,0,0,8,1,0,0,0,0,48,0,37,0,0,0,0,0,6,0,0,0,0,0,0,0,4
"LTU_053_MZB_LO_1","LTU_053_MZB_LO_1-05.10.2020","05.10.2020",2020,10,5,0,0,0,0,0,0,0,0,0,0,14,0,0,0,0,0,7,0,0,62,0,0,18,26,0,0,24,24,0,0,0,0,0,56,0,0,9,0,6,11,0,0,0,0,0,0,19,0,0,0,0,0,0,0,0,0,0,0,0,0,7,15,0,0,39,0,0,0,12,0,0,0,0,0,0,0,0,0,0,0,11,0,0,0,0,0,0,0,0,11,0,0,0,0,36,29,0,0,0,0,0,0,0,0,0,0,0,0,0,0,0,76,0,0,0,4,0,0,0,0,4,0,0,0,0,0,0,0,0,6,7,1,8,0,0,0,0,0,0,0,0,9,0,0,0,0,0,0,0,51,0,0,0,0,0,8,0,0,0,0,18,1,0,0
"LTU_053_MZB_LO_10","LTU_053_MZB_LO_10-29.09.2010","29.09.2010",2010,9,29,0,0,0,1,0,0,0,0,0,0,0,0,0,0,0,0,0,0,38,1,0,0,0,0,87,0,16,16,0,0,0,0,0,4,0,0,0,0,0,0,0,0,1,0,0,0,6,2,0,0,0,0,0,0,140,0,0,61,0,0,0,0,0,0,0,0,1,14,0,0,11,0,0,0,0,0,31,0,0,0,13,0,0,0,0,48,0,1,25,0,117,0,0,15,0,3,3,0,0,0,0,0,0,22,0,0,0,0,0,0,0,22,0,0,4,0,0,0,0,0,0,34,0,0,0,0,0,0,0,0,0,0,11,0,0,0,0,0,0,0,0,0,0,0,15,0,1,1,0,8,0,0,0,0,0,1,0,0,0,0,4,0,0,0
"LTU_053_MZB_LO_10","LTU_053_MZB_LO_10-10.10.2013","10.10.2013",2013,10,10,0,0,0,0,0,0,0,0,0,0,0,0,0,0,64,0,0,0,84,115,0,0,0,0,232,0,0,0,0,0,0,0,0,345,0,0,0,0,0,0,0,0,0,0,0,0,0,0,0,0,0,0,0,0,157,0,0,54,0,0,0,0,0,0,0,0,0,0,13,0,0,0,0,0,0,0,0,0,0,0,47,0,0,0,0,0,0,295,138,0,95,0,0,0,0,48,0,0,168,0,0,0,0,0,0,0,40,0,0,0,0,0,0,0,0,0,0,0,0,0,0,0,0,0,0,0,0,0,0,0,0,0,0,0,0,0,0,0,0,0,0,0,0,62,62,0,0,0,0,0,0,0,0,0,0,0,0,0,0,0,0,0,0,0
"LTU_053_MZB_LO_10","LTU_053_MZB_LO_10-13.10.2015","13.10.2015",2015,10,13,0,0,0,0,0,0,0,0,0,0,0,0,0,0,0,0,0,0,39,75,0,0,25,0,112,0,0,0,19,0,0,0,0,0,4,0,0,5,0,0,0,0,0,0,0,0,0,0,0,0,0,0,0,0,75,0,0,7,0,0,0,0,0,0,0,0,0,31,0,0,0,0,0,0,0,0,26,0,0,0,61,0,0,0,0,0,0,113,0,0,71,0,0,0,0,40,0,0,55,0,0,0,0,36,0,0,60,0,0,0,0,55,0,0,3,0,0,0,0,0,0,13,0,0,0,0,10,0,0,32,0,0,0,0,0,0,71,0,0,0,0,0,0,0,0,0,0,0,0,128,0,0,0,0,0,0,0,0,0,0,12,0,0,0
"LTU_053_MZB_LO_10","LTU_053_MZB_LO_10-14.10.2019","14.10.2019",2019,10,14,0,0,0,0,0,0,0,0,0,0,0,0,0,0,0,0,0,0,12,6,0,0,0,0,15,0,1,1,0,0,0,0,0,1,0,0,0,0,0,0,0,0,0,0,0,0,12,0,0,0,0,0,11,0,0,0,0,18,0,0,0,0,0,0,0,0,0,0,1,0,0,0,0,0,0,0,11,0,0,0,18,0,0,0,0,8,9,23,0,0,34,0,1,0,0,18,0,0,0,0,0,0,0,0,0,0,51,0,0,0,0,111,0,0,0,2,0,0,0,0,0,4,0,0,0,0,1,0,0,0,0,0,0,0,0,0,0,0,7,0,0,0,0,0,0,0,0,1,0,60,0,0,0,0,0,5,0,0,0,0,20,0,0,0
"LTU_053_MZB_LO_10","LTU_053_MZB_LO_10-17.10.2022","17.10.2022",2022,10,17,0,0,0,0,0,0,0,0,0,0,1,0,0,0,0,1,0,0,32,40,0,0,0,0,13,0,5,5,0,0,0,0,0,3,0,0,0,2,0,42,0,3,0,0,0,0,11,0,0,0,0,0,0,0,15,0,0,119,0,0,0,0,0,0,0,0,0,7,6,0,26,0,0,0,0,0,6,2,0,0,43,0,0,0,0,38,0,0,15,0,217,0,0,17,0,0,0,4,5,0,0,0,0,9,0,0,0,2,0,0,0,27,0,0,0,13,0,0,0,0,0,17,0,0,0,0,8,0,0,1,0,0,8,0,0,0,12,0,0,0,0,0,0,6,89,0,1,13,0,7,0,0,0,0,0,0,6,0,0,0,5,0,0,0
"LTU_053_MZB_LO_11","LTU_053_MZB_LO_11-11.10.2010","11.10.2010",2010,10,11,0,0,0,0,0,0,0,0,0,0,0,0,0,0,0,0,0,0,0,0,0,0,4,0,0,14,0,0,0,0,0,0,0,87,0,0,0,0,0,0,0,0,0,0,0,0,0,0,0,4,0,0,0,0,0,0,0,0,0,0,0,0,0,0,1,0,0,0,1,0,0,0,0,0,0,0,0,0,0,0,0,0,0,0,0,0,0,0,0,0,0,0,0,0,0,1,0,0,0,0,0,0,0,0,0,0,0,0,0,0,0,43,0,0,0,0,0,0,0,0,0,0,0,0,0,0,0,0,0,0,0,0,0,0,0,0,0,0,0,0,0,12,0,0,0,0,0,0,0,39,0,0,0,0,0,0,0,0,0,0,0,8,28,0
"LTU_053_MZB_LO_11","LTU_053_MZB_LO_11-12.09.2011","12.09.2011",2011,9,12,0,0,0,0,0,0,0,0,0,0,0,0,0,0,0,0,0,0,0,0,0,0,13,0,0,2,1,1,0,0,0,4,0,53,0,0,0,0,0,0,16,0,0,0,0,0,0,0,0,4,0,0,0,0,0,0,0,0,0,0,0,0,0,0,14,1,0,0,0,0,0,0,0,0,0,0,0,0,0,0,0,0,0,0,0,0,0,0,0,0,0,0,0,0,19,0,0,0,0,0,0,8,0,0,0,0,0,0,0,0,0,35,0,0,0,0,0,0,1,0,0,0,0,0,0,0,0,0,0,0,0,0,0,0,0,0,0,0,0,0,0,22,0,0,0,0,0,0,0,25,0,0,0,0,0,0,0,0,0,0,0,0,12,0
"LTU_053_MZB_LO_11","LTU_053_MZB_LO_11-08.10.2012","08.10.2012",2012,10,8,0,0,0,0,0,0,0,0,0,0,0,0,0,0,0,0,0,0,0,0,0,0,2,0,0,0,0,0,0,0,0,0,0,0,0,0,0,0,0,0,0,0,0,0,0,0,0,0,0,0,0,0,0,0,0,0,0,0,0,0,0,0,0,0,23,0,0,0,0,0,0,0,0,0,0,0,0,0,0,0,0,0,0,0,0,0,0,0,0,0,0,0,0,0,2,1,0,0,0,0,0,0,0,0,0,0,0,0,0,0,0,0,0,0,0,0,0,0,0,0,0,0,0,0,0,0,0,0,1,0,0,0,0,0,0,0,0,0,0,0,0,3,0,0,0,0,0,0,0,0,0,0,0,0,0,0,0,0,0,0,0,0,0,2
"LTU_053_MZB_LO_11","LTU_053_MZB_LO_11-30.09.2013","30.09.2013",2013,9,30,0,0,0,0,0,0,0,0,0,0,0,3,0,0,0,0,0,0,0,0,0,0,0,0,0,0,0,0,0,0,0,0,0,57,0,0,1,0,0,0,0,0,0,0,0,0,0,0,0,2,0,0,0,0,0,0,0,0,0,0,0,0,0,0,1,0,0,0,0,0,0,0,0,0,0,0,0,0,0,0,0,0,0,0,0,0,0,0,0,0,0,0,0,0,9,0,0,0,0,0,0,41,0,0,0,1,0,0,0,0,0,18,0,0,0,0,0,0,0,0,0,0,0,0,0,0,0,0,0,0,0,0,0,37,0,0,0,0,0,0,0,3,0,0,0,0,0,0,0,3,0,0,0,0,0,2,0,0,0,0,0,0,0,0
"LTU_053_MZB_LO_11","LTU_053_MZB_LO_11-13.10.2014","13.10.2014",2014,10,13,0,0,0,0,0,0,0,0,0,0,0,0,0,0,0,0,0,0,0,0,0,0,3,0,0,0,0,0,0,0,0,0,0,67,0,0,1,0,0,0,28,0,0,0,0,0,0,0,0,43,0,0,0,0,0,0,0,0,0,0,0,8,0,0,0,0,0,0,0,0,0,0,0,0,0,0,0,0,0,0,0,0,0,0,0,0,0,0,0,0,0,0,0,0,36,0,0,0,0,0,0,4,0,0,0,0,0,0,9,0,0,62,0,0,0,0,0,0,0,0,0,0,0,0,0,1,0,0,1,0,0,0,0,0,0,0,0,0,0,0,0,7,0,0,0,0,0,0,0,8,0,0,0,0,0,0,0,0,0,0,0,0,0,20
"LTU_053_MZB_LO_11","LTU_053_MZB_LO_11-12.10.2015","12.10.2015",2015,10,12,0,0,0,0,0,0,0,0,0,0,0,0,0,0,0,0,4,0,0,14,0,0,0,0,0,0,0,0,0,0,0,0,0,45,0,0,0,0,0,8,240,0,0,0,0,0,0,0,0,0,0,0,0,100,0,0,0,0,0,0,0,0,0,0,0,0,0,0,0,0,0,0,0,0,0,0,0,0,0,0,0,0,0,0,0,0,0,0,0,0,0,0,0,0,0,0,0,0,0,0,0,401,0,0,0,0,0,0,300,0,0,24,0,0,0,0,0,0,0,0,0,0,0,0,0,0,6,0,0,0,0,0,0,151,0,0,0,0,0,0,0,0,0,0,0,0,0,0,0,5,0,0,0,0,0,0,0,0,0,0,0,0,0,0
"LTU_053_MZB_LO_11","LTU_053_MZB_LO_11-12.09.2016","12.09.2016",2016,9,12,0,0,0,0,0,0,0,0,0,9,25,0,0,0,0,0,0,0,0,0,0,0,10,0,0,1,8,8,0,0,0,0,0,552,0,0,2,0,0,0,0,0,0,0,0,0,0,0,0,22,0,0,0,36,0,0,0,0,0,0,0,6,0,0,0,0,0,0,1,0,0,0,2,6,0,0,0,0,0,0,0,0,0,0,0,0,0,0,0,0,0,0,2,0,30,18,0,0,0,0,0,92,0,0,0,0,0,0,99,0,0,50,0,0,0,0,0,0,0,0,0,0,0,0,0,0,2,0,0,0,0,0,0,68,0,0,0,0,0,0,0,0,0,0,0,0,0,0,0,4,0,0,0,0,0,1,0,0,0,0,0,0,0,8
"LTU_053_MZB_LO_11","LTU_053_MZB_LO_11-04.10.2017","04.10.2017",2017,10,4,0,0,0,0,0,0,0,0,0,0,0,0,0,0,0,0,0,0,0,0,0,0,9,0,0,0,4,4,0,0,0,0,0,12,0,0,0,0,0,8,7,0,0,0,0,0,0,0,0,9,0,0,0,0,0,0,0,0,0,0,0,7,0,0,0,0,0,0,0,0,0,0,0,0,0,0,0,0,0,0,4,0,0,0,0,0,0,2,0,0,0,0,0,0,26,13,0,0,0,0,0,441,0,0,0,0,0,0,0,0,0,24,0,0,0,0,0,0,0,0,0,0,0,0,0,0,0,0,0,2,0,0,0,265,0,0,0,0,0,0,0,6,0,0,0,0,0,0,0,9,0,0,0,0,0,0,0,0,1,0,0,1,0,8
"LTU_053_MZB_LO_11","LTU_053_MZB_LO_11-14.09.2020","14.09.2020",2020,9,14,0,0,0,0,0,0,0,0,0,0,1,0,0,0,0,0,218,0,0,8,0,0,122,0,0,4,25,25,0,0,5,0,0,2200,0,0,11,0,0,3,448,0,0,0,0,0,0,0,0,7,0,0,4,256,0,0,0,0,0,0,0,16,0,0,0,10,0,0,0,0,0,0,0,3,0,0,0,0,0,0,0,8,0,0,0,0,0,2,0,0,0,0,0,0,92,133,0,0,0,0,0,672,0,0,0,0,0,0,0,0,0,640,0,0,0,0,0,0,7,0,0,0,1,0,0,12,2,0,0,46,0,0,0,1866,0,0,0,0,0,0,0,36,0,0,0,0,0,0,0,583,0,0,0,0,0,10,0,0,0,0,0,0,142,46
"LTU_053_MZB_LO_12","LTU_053_MZB_LO_12-04.10.2010","04.10.2010",2010,10,4,0,0,0,0,0,0,0,0,0,0,0,0,0,0,0,0,4,0,19,47,0,1,0,0,1,0,5,5,0,0,0,1,0,40,0,0,0,0,0,2,0,0,0,0,0,0,0,1,0,0,0,0,19,0,14,0,0,6,0,0,0,2,0,0,0,0,0,0,0,0,0,0,0,1,0,0,0,0,0,0,0,0,0,0,0,555,25,0,24,0,0,0,8,5,0,0,0,1,0,0,0,0,0,36,0,0,0,0,0,0,0,17,0,0,0,0,0,0,0,0,0,2,0,0,0,0,3,0,0,0,0,0,4,0,0,0,0,0,0,0,2,0,0,0,0,0,1,0,0,0,0,0,1,0,0,0,0,0,0,0,1,0,0,0
"LTU_053_MZB_LO_12","LTU_053_MZB_LO_12-03.10.2011","03.10.2011",2011,10,3,0,0,0,0,0,0,0,0,0,0,0,0,0,0,0,0,68,0,0,92,0,0,0,0,0,0,33,33,0,0,0,0,0,120,0,0,0,0,0,1,0,0,0,0,0,0,0,0,0,0,0,0,45,0,0,0,0,65,0,0,0,0,0,0,0,0,0,0,0,0,0,0,0,56,0,0,0,0,0,0,0,0,0,0,0,0,0,0,0,0,132,0,16,0,0,0,0,0,0,0,0,0,0,0,0,0,1400,0,0,0,0,480,0,0,0,0,0,0,0,0,0,0,0,0,0,0,0,0,0,0,0,0,168,0,0,0,0,0,0,0,0,0,0,64,0,0,56,112,0,280,0,0,0,0,0,56,0,0,0,0,0,0,0,0
"LTU_053_MZB_LO_12","LTU_053_MZB_LO_12-10.10.2012","10.10.2012",2012,10,10,0,0,0,0,0,0,0,0,0,0,0,0,0,0,0,0,0,0,96,73,0,64,0,0,0,0,0,0,0,0,0,0,0,109,41,0,0,0,0,0,0,0,36,0,0,0,60,0,0,0,0,0,81,0,0,0,0,33,0,0,0,0,0,0,0,0,0,0,0,0,0,0,0,21,0,0,0,0,0,0,0,0,0,0,0,0,0,156,0,0,0,0,676,0,0,0,0,0,0,0,0,0,0,0,0,0,76,0,0,0,0,125,0,0,0,0,0,0,0,0,0,0,0,0,0,0,0,0,0,0,0,0,70,0,0,0,0,0,0,0,16,0,0,0,96,0,0,0,0,72,0,0,0,0,0,0,0,0,0,0,0,0,0,0
"LTU_053_MZB_LO_12","LTU_053_MZB_LO_12-07.10.2013","07.10.2013",2013,10,7,0,0,0,0,0,0,0,0,0,0,0,0,0,0,0,0,0,0,0,67,0,0,16,0,0,0,0,0,0,0,0,0,0,178,0,0,0,0,0,39,0,0,0,0,0,0,0,25,0,0,0,0,70,0,0,0,0,55,0,0,0,0,0,0,0,0,0,0,16,0,25,0,0,0,0,0,157,0,0,0,61,0,0,0,17,0,0,0,88,0,96,0,210,0,0,0,0,0,0,0,0,0,0,0,0,0,75,0,0,0,0,101,0,0,0,0,0,0,0,0,0,0,0,0,0,0,0,0,0,0,0,0,29,0,0,0,0,0,0,37,12,0,0,0,45,0,35,57,0,89,0,0,0,0,0,0,0,0,0,0,15,0,0,0
"LTU_053_MZB_LO_12","LTU_053_MZB_LO_12-06.10.2014","06.10.2014",2014,10,6,0,0,0,0,0,0,0,0,0,0,0,0,0,0,39,0,0,0,0,38,0,0,0,8,0,0,0,0,0,0,0,0,0,41,0,0,0,0,0,1,0,0,0,0,0,0,32,0,0,0,0,0,0,0,0,0,0,13,0,0,0,5,0,0,0,0,0,0,0,0,0,0,0,0,0,0,0,0,0,0,22,0,0,0,0,0,0,0,0,0,0,0,70,0,0,0,0,0,0,0,0,0,0,32,0,0,46,0,0,0,0,42,0,0,0,0,0,0,0,0,0,6,0,0,0,0,0,0,0,10,0,0,0,0,0,0,0,0,0,0,26,0,0,28,0,0,0,27,0,9,0,0,0,0,0,0,0,0,0,0,36,0,0,0
"LTU_053_MZB_LO_12","LTU_053_MZB_LO_12-12.10.2015","12.10.2015",2015,10,12,0,0,0,0,0,0,0,0,0,0,0,0,0,0,0,0,0,0,29,103,0,33,14,0,11,0,0,0,47,0,0,0,0,27,0,0,0,0,0,0,0,0,0,0,0,0,57,0,0,0,0,0,4,0,54,0,0,12,0,0,0,13,0,0,0,0,0,12,0,0,0,0,0,0,0,0,0,0,0,0,14,0,0,0,0,0,0,0,10,0,0,0,18,0,0,0,0,0,28,0,6,0,0,30,0,0,33,0,0,0,0,13,0,0,0,0,0,0,0,0,0,9,0,0,0,0,9,0,0,0,0,0,0,0,0,0,40,0,5,0,0,0,0,12,0,0,0,6,0,134,0,0,0,0,0,0,0,0,0,0,12,0,0,0
"LTU_053_MZB_LO_12","LTU_053_MZB_LO_12-17.10.2016","17.10.2016",2016,10,17,0,0,0,0,0,0,0,0,0,0,0,0,0,0,0,0,0,0,9,221,0,0,0,0,0,0,1,1,0,0,0,0,0,72,0,0,0,0,0,20,0,0,0,0,0,0,44,0,0,0,0,0,32,0,0,0,0,9,0,0,0,20,0,0,0,0,0,0,0,0,20,0,0,0,0,0,0,0,0,0,85,0,0,0,0,0,0,0,0,0,220,0,0,20,0,12,0,0,0,0,0,0,0,0,0,0,37,0,0,0,0,72,0,0,0,0,0,0,0,0,0,248,0,0,0,0,0,0,0,0,0,0,20,0,0,0,0,0,0,0,0,0,0,0,32,0,0,44,0,14,0,0,0,0,0,0,0,0,0,0,0,0,0,0
"LTU_053_MZB_LO_12","LTU_053_MZB_LO_12-16.10.2017","16.10.2017",2017,10,16,0,0,0,0,0,0,0,0,0,0,0,0,0,0,12,0,0,0,1,68,0,0,13,0,0,0,0,0,0,0,3,0,0,34,0,0,0,0,0,12,0,0,0,0,0,0,15,11,0,0,0,0,20,0,0,0,0,15,0,0,0,2,0,0,0,0,0,0,0,0,8,0,0,0,0,0,0,0,0,0,27,0,0,0,0,0,0,85,22,0,0,0,91,0,0,0,0,0,0,0,0,0,0,0,0,0,73,0,0,0,0,39,0,0,0,0,0,0,0,0,2,42,8,0,0,0,3,0,0,0,0,0,23,0,0,0,0,0,0,0,14,0,0,0,0,38,7,27,0,38,0,0,0,0,0,8,0,0,0,0,13,0,0,0
"LTU_053_MZB_LO_12","LTU_053_MZB_LO_12-13.10.2020","13.10.2020",2020,10,13,0,0,0,0,0,0,0,0,0,0,0,0,0,0,0,0,0,0,11,0,0,0,0,0,0,0,22,22,0,0,0,0,0,18,0,0,0,0,0,5,0,0,0,0,0,0,0,0,0,0,0,0,0,0,0,0,0,9,0,0,0,0,0,0,0,0,0,0,0,0,0,0,0,0,0,0,0,0,0,0,8,0,0,0,0,0,0,0,0,0,0,0,15,0,0,12,0,0,0,0,0,0,0,0,0,0,12,5,0,0,0,35,0,0,0,0,0,0,0,0,0,0,0,0,0,0,0,0,0,0,1,0,1,0,0,0,0,0,0,0,0,0,0,0,3,0,5,0,0,15,0,0,0,0,0,0,0,0,0,0,3,0,0,0
"LTU_053_MZB_LO_13","LTU_053_MZB_LO_13-04.10.2010","04.10.2010",2010,10,4,0,0,0,0,0,0,0,0,0,0,0,0,0,0,0,0,577,0,0,79,0,0,102,0,0,0,6,6,0,0,0,0,0,22,0,0,7,0,0,22,0,0,0,0,0,0,0,0,0,0,0,0,6,0,0,0,0,0,0,0,0,5,0,0,0,0,0,0,0,0,0,0,0,0,0,0,0,0,0,0,0,0,0,0,0,0,0,0,0,0,0,0,5,0,0,0,0,0,0,0,0,0,0,0,0,0,0,0,0,0,0,0,0,0,0,0,0,0,0,0,0,0,0,0,213,0,0,0,0,0,5,0,12,0,0,0,0,0,0,0,0,0,0,0,0,0,8,0,0,330,0,0,7,0,0,0,0,0,0,0,0,0,0,0
"LTU_053_MZB_LO_13","LTU_053_MZB_LO_13-18.09.2013","18.09.2013",2013,9,18,0,0,88,13,0,0,0,0,0,0,0,0,0,0,0,0,73,0,0,746,0,0,208,80,0,0,36,36,0,0,0,0,0,144,0,0,148,0,0,36,0,0,0,0,0,0,48,0,0,0,0,0,56,0,380,0,0,68,0,0,0,30,0,0,135,0,0,0,24,0,32,0,0,20,0,0,0,0,0,0,208,0,16,0,0,0,0,0,0,0,73,0,484,0,0,233,0,0,0,0,0,0,0,0,0,0,0,32,0,0,0,176,0,0,0,0,0,0,24,0,0,0,0,0,168,0,32,0,0,397,0,0,112,0,0,0,0,0,0,0,0,72,0,0,0,0,69,0,0,289,0,0,0,0,0,12,0,0,0,0,68,0,0,0
"LTU_053_MZB_LO_13","LTU_053_MZB_LO_13-21.09.2016","21.09.2016",2016,9,21,0,0,38,4,0,0,0,0,0,0,0,0,0,0,0,0,69,0,0,199,0,0,99,36,0,0,0,0,0,0,26,0,0,76,0,0,8,0,2,4,0,0,0,0,0,0,0,0,0,0,0,0,14,0,86,0,0,0,0,0,0,0,0,0,0,0,0,0,0,0,0,0,0,0,0,0,17,0,0,0,0,0,0,0,0,0,0,22,0,0,0,0,43,0,0,85,0,0,0,0,0,0,0,0,0,10,0,7,0,0,0,90,0,0,0,0,0,0,0,0,0,0,0,0,44,0,0,0,0,69,0,0,40,0,0,0,0,0,0,0,0,2,2,0,0,0,37,0,0,247,0,0,0,0,0,0,0,0,0,0,0,0,0,20
"LTU_053_MZB_LO_13","LTU_053_MZB_LO_13-17.09.2019","17.09.2019",2019,9,17,0,0,0,2,0,0,0,0,0,0,0,0,0,0,0,0,5,0,0,24,0,0,68,0,0,15,16,16,0,0,0,0,0,23,0,0,0,0,0,0,0,0,0,0,0,0,0,0,0,0,0,0,1,0,0,0,0,0,0,0,0,5,0,0,0,0,0,6,0,0,0,0,0,6,0,0,0,0,0,0,1,0,1,0,1,0,0,0,0,0,0,0,15,0,0,74,0,0,0,0,0,0,0,0,0,1,0,0,0,0,0,28,0,0,0,0,0,0,0,0,0,0,0,0,0,0,0,0,0,193,0,0,8,0,0,0,0,0,0,0,0,0,0,0,0,0,7,0,0,293,0,42,0,0,0,0,0,0,0,0,0,0,0,0
"LTU_053_MZB_LO_13","LTU_053_MZB_LO_13-22.09.2022","22.09.2022",2022,9,22,0,0,0,4,2,0,0,0,0,0,0,0,0,0,0,0,28,0,0,318,0,0,10,0,0,0,0,0,0,0,0,0,0,45,0,0,3,0,0,13,0,0,0,0,0,0,0,0,0,0,0,0,1,0,0,0,0,0,0,0,0,3,0,0,0,0,0,0,0,0,0,0,0,0,0,1,0,0,0,0,0,0,0,0,0,0,0,0,0,0,0,0,0,0,0,1,0,0,0,0,0,0,0,0,0,0,0,0,0,0,0,11,0,0,0,0,0,0,0,0,0,0,0,0,4,0,0,0,0,2,0,0,36,0,0,0,0,0,0,0,0,0,0,0,0,0,1,0,1,12,0,0,0,0,0,0,0,0,0,0,0,0,0,0
"LTU_053_MZB_LO_14","LTU_053_MZB_LO_14-28.09.2010","28.09.2010",2010,9,28,0,0,0,0,0,0,0,0,0,0,0,0,0,0,1,0,0,0,0,39,0,0,27,0,0,0,11,11,0,0,0,0,0,0,0,0,0,0,0,18,0,0,0,0,0,0,0,1,0,0,0,0,0,0,0,0,0,0,0,0,0,0,0,0,0,0,0,0,1,0,0,0,0,0,0,0,0,0,0,0,25,0,0,0,0,0,0,0,0,0,0,0,0,0,0,19,0,0,0,0,0,0,0,0,0,0,0,0,0,0,0,0,0,0,0,0,0,0,0,0,0,0,0,0,0,0,0,0,0,39,0,0,0,0,0,0,0,0,0,0,0,0,0,0,0,0,0,0,0,30,0,0,0,0,0,0,29,0,0,0,0,0,0,0
"LTU_053_MZB_LO_14","LTU_053_MZB_LO_14-19.09.2011","19.09.2011",2011,9,19,0,0,0,0,0,0,0,0,0,0,0,0,0,0,80,0,0,0,35,116,0,0,12,0,3,1,21,21,0,0,0,0,0,63,0,0,12,0,0,45,0,0,0,0,0,0,0,1,0,0,0,0,2,0,58,0,0,48,0,0,0,1,0,0,0,1,0,0,9,0,0,0,10,0,0,0,31,0,0,0,44,0,0,0,3,0,0,9,1,0,5,0,1,3,0,20,0,0,0,0,0,0,0,0,0,1,1,1,0,0,0,0,0,0,4,0,0,0,0,0,0,0,0,0,0,0,1,0,0,5,14,0,0,0,1,0,0,0,0,7,0,0,0,0,0,0,0,34,0,0,0,0,0,0,0,3,0,0,0,0,1,4,0,0
"LTU_053_MZB_LO_14","LTU_053_MZB_LO_14-24.09.2012","24.09.2012",2012,9,24,0,0,0,0,0,0,0,1,0,0,0,0,0,0,35,0,0,0,8,13,0,0,0,0,9,0,18,18,0,0,0,0,0,0,0,0,0,0,0,0,0,0,0,0,0,0,0,0,0,0,0,0,0,0,4,0,0,10,0,0,0,2,0,0,0,0,0,0,7,0,0,0,0,0,0,0,9,0,0,0,9,0,0,0,0,0,0,1,3,0,0,0,0,2,0,2,0,0,0,0,0,0,0,4,0,0,0,0,0,0,0,0,0,0,5,0,0,0,0,0,0,0,0,0,0,0,2,0,0,0,0,0,0,0,6,0,0,0,0,3,0,0,0,0,0,0,0,0,0,1,0,0,0,0,0,1,0,0,1,0,3,0,0,0
"LTU_053_MZB_LO_14","LTU_053_MZB_LO_14-18.09.2013","18.09.2013",2013,9,18,0,0,0,0,0,0,0,0,0,0,0,0,0,0,73,0,0,0,77,116,0,0,88,0,88,0,14,14,0,0,0,0,0,47,0,0,0,0,0,44,0,0,0,0,0,0,26,0,0,0,0,0,0,0,0,0,0,37,0,0,0,0,0,0,0,0,0,0,33,0,0,0,0,0,0,0,82,0,0,0,123,0,0,0,72,0,0,0,0,0,59,0,0,0,0,73,0,0,0,0,0,0,0,1,0,0,0,0,0,0,0,36,0,0,0,0,0,0,27,0,0,26,0,0,0,0,0,0,0,133,0,0,0,0,0,0,0,0,0,0,0,5,0,0,0,0,0,137,0,0,0,0,0,0,0,0,0,36,0,0,16,0,0,0
"LTU_053_MZB_LO_14","LTU_053_MZB_LO_14-15.09.2014","15.09.2014",2014,9,15,0,0,0,0,0,0,0,0,0,0,0,0,0,0,37,0,0,0,33,55,0,0,43,0,0,0,8,8,0,0,22,0,0,69,0,0,0,0,0,1,0,0,0,0,0,0,0,0,0,0,0,0,0,0,44,0,0,59,0,0,0,0,0,0,0,0,0,0,8,0,0,0,0,0,0,0,0,0,0,0,36,32,0,0,0,13,17,0,0,0,0,0,22,0,0,72,0,0,0,0,0,0,0,0,0,0,0,0,0,0,0,74,0,0,7,0,0,0,0,0,0,0,0,0,36,0,0,0,0,77,0,0,0,0,36,0,0,0,0,0,0,0,0,0,0,0,0,36,0,104,0,0,0,0,0,0,0,21,0,0,0,4,0,0
"LTU_053_MZB_LO_14","LTU_053_MZB_LO_14-23.09.2015","23.09.2015",2015,9,23,0,0,14,0,0,0,0,0,0,0,0,0,0,0,20,0,0,0,14,87,0,0,36,0,87,0,6,6,0,0,0,0,0,23,0,0,0,0,0,0,0,0,0,0,0,0,0,0,0,0,0,0,0,0,34,0,0,39,0,0,0,5,0,0,0,0,0,0,12,0,16,0,0,0,0,0,27,0,0,0,71,0,0,0,0,0,7,8,65,0,0,0,0,0,0,15,0,0,0,0,0,0,0,0,0,0,0,0,0,0,0,29,0,0,0,3,0,0,0,0,0,0,0,0,0,0,0,0,0,89,1,0,50,0,13,0,0,0,0,0,0,0,0,0,0,0,0,0,0,76,0,0,0,0,0,3,0,31,0,0,6,0,0,0
"LTU_053_MZB_LO_14","LTU_053_MZB_LO_14-27.09.2016","27.09.2016",2016,9,27,0,0,0,0,0,0,0,0,0,0,0,0,0,0,6,0,0,0,7,57,0,0,60,15,38,0,30,30,0,0,0,0,0,24,0,0,0,0,0,7,0,0,0,0,0,0,0,0,0,0,0,0,9,0,23,0,0,15,0,0,0,0,0,0,0,0,0,19,2,0,0,0,6,0,0,0,0,0,0,0,9,33,0,0,0,0,0,9,30,0,0,0,0,0,0,24,0,0,0,0,0,0,0,0,0,0,0,0,0,0,0,0,0,0,2,0,0,0,0,0,0,0,0,0,19,0,1,0,0,45,0,0,14,0,10,0,0,0,0,0,0,4,0,0,0,0,0,7,0,0,0,0,0,0,0,0,0,17,0,0,9,0,0,0
"LTU_053_MZB_LO_14","LTU_053_MZB_LO_14-26.10.2017","26.10.2017",2017,10,26,0,0,0,0,0,0,0,0,0,0,0,0,0,8,0,0,0,0,1,97,0,0,0,0,9,0,18,18,0,0,0,5,0,19,0,0,0,0,0,35,0,0,0,0,0,0,0,0,0,0,9,0,4,0,0,0,0,0,0,0,0,0,0,0,0,0,0,0,0,0,13,0,0,0,0,0,1,0,0,0,1,15,0,0,0,0,0,0,835,0,0,0,78,0,0,8,0,0,0,0,0,0,0,0,0,0,0,13,0,0,0,0,0,0,0,0,0,0,0,0,0,0,0,0,7,0,1,0,0,0,1,0,0,0,0,0,0,0,0,0,0,3,0,0,0,0,0,9,0,0,0,0,0,0,0,0,0,0,0,0,0,0,0,0
"LTU_053_MZB_LO_14","LTU_053_MZB_LO_14-21.09.2020","21.09.2020",2020,9,21,0,0,0,0,0,0,0,0,0,0,0,0,0,0,36,0,0,0,11,7,0,0,0,0,0,0,7,7,0,0,0,0,0,1,0,0,0,0,0,1,0,0,0,0,0,0,0,0,0,0,0,0,0,0,13,0,0,22,0,0,0,0,0,0,0,0,0,0,4,0,2,0,0,0,0,0,1,0,0,0,11,0,0,0,0,0,0,0,0,0,0,0,0,0,0,1,0,0,0,0,0,0,0,1,0,0,0,0,0,0,0,2,0,0,10,0,0,0,0,0,0,0,0,0,0,0,0,0,0,0,0,0,0,0,0,0,0,0,0,0,0,12,0,0,0,0,0,2,0,4,0,0,0,0,0,2,0,4,0,0,0,0,0,0
"LTU_053_MZB_LO_15","LTU_053_MZB_LO_15-01.10.2010","01.10.2010",2010,10,1,0,0,0,0,0,0,0,0,0,0,0,0,0,0,0,0,0,0,56,60,0,0,0,0,0,0,8,8,0,0,0,0,0,0,0,0,0,0,0,29,0,0,0,0,6,0,54,0,0,0,0,0,0,0,247,0,0,58,0,0,0,0,0,0,0,0,0,30,0,0,0,0,0,0,0,0,313,0,0,0,69,0,0,0,0,0,0,33,8,0,0,0,1,0,0,22,0,0,0,0,0,0,0,1,0,0,64,0,0,0,0,30,0,0,0,0,0,0,0,0,0,21,0,0,0,0,0,0,0,31,0,0,0,0,0,0,0,0,0,0,0,0,0,0,0,0,0,0,0,113,0,0,0,0,0,18,0,0,0,0,43,0,0,0
"LTU_053_MZB_LO_15","LTU_053_MZB_LO_15-17.09.2013","17.09.2013",2013,9,17,0,0,0,0,0,0,0,0,0,0,0,0,0,0,140,0,0,0,216,197,0,0,36,0,248,0,0,0,0,0,0,0,0,241,0,0,0,0,0,0,0,0,0,0,0,0,132,0,0,0,0,0,0,0,330,0,0,78,0,0,0,0,0,0,0,12,0,0,12,0,0,0,0,32,0,0,145,0,0,0,366,88,0,0,0,0,0,112,278,0,0,0,69,0,0,153,0,0,0,0,12,0,0,0,0,0,0,0,0,0,0,72,0,0,0,0,0,0,0,0,0,72,0,0,0,0,61,0,0,0,0,0,144,0,0,0,0,0,0,0,0,9,0,96,0,0,0,144,0,0,0,0,0,0,0,92,0,0,0,0,68,0,0,0
"LTU_053_MZB_LO_15","LTU_053_MZB_LO_15-20.09.2016","20.09.2016",2016,9,20,0,0,0,0,0,0,0,0,0,0,0,0,0,0,25,0,0,0,20,65,0,0,13,0,0,60,9,9,0,0,14,0,0,23,0,0,0,0,0,0,0,0,0,0,0,0,27,0,0,0,0,0,20,0,40,0,0,20,0,0,0,0,0,0,0,0,0,2,6,0,0,0,0,0,0,0,71,0,0,0,66,0,0,0,0,0,0,60,46,0,38,0,17,0,0,0,0,0,0,0,0,0,0,25,0,0,0,0,0,0,12,64,0,0,3,0,0,0,0,0,0,56,0,0,0,0,0,0,0,36,0,0,13,0,0,0,0,0,16,0,0,0,0,21,0,0,0,28,0,126,0,0,0,0,0,2,0,0,0,0,10,0,0,0
"LTU_053_MZB_LO_15","LTU_053_MZB_LO_15-18.09.2019","18.09.2019",2019,9,18,0,0,0,0,0,0,0,0,0,0,0,0,0,0,0,0,0,0,7,60,0,0,14,0,31,0,0,0,0,0,0,0,0,53,0,0,0,0,0,0,0,0,38,0,0,0,17,0,0,0,0,0,0,0,0,0,0,8,0,0,0,5,0,0,0,0,0,0,3,0,0,0,0,0,0,0,0,0,0,0,74,0,0,0,1,36,31,41,0,0,0,0,7,0,0,33,0,0,0,0,0,0,0,0,0,0,10,0,0,0,0,61,0,0,0,0,0,0,0,0,0,12,0,0,0,0,0,0,0,68,0,0,8,0,0,0,0,0,0,0,0,8,0,0,0,0,0,0,0,48,0,0,0,0,0,6,0,0,0,0,33,0,0,0
"LTU_053_MZB_LO_15","LTU_053_MZB_LO_15-19.09.2022","19.09.2022",2022,9,19,0,0,0,0,0,0,0,0,0,0,0,0,0,0,2,0,0,0,11,188,0,0,0,0,0,0,3,3,1,0,0,0,0,51,0,0,0,1,0,0,0,0,0,0,0,0,63,0,0,0,0,0,0,0,54,0,0,27,0,0,0,0,0,0,0,3,1,5,0,0,4,0,0,0,0,0,92,1,0,0,56,0,0,0,0,0,8,0,12,0,18,0,5,4,0,0,0,0,0,0,0,0,0,0,0,0,2,0,0,0,0,13,0,0,0,14,0,0,0,0,0,18,0,0,0,0,0,0,0,1,0,0,0,0,0,0,0,0,0,0,0,0,0,0,0,0,0,17,0,9,0,0,0,0,0,3,0,0,0,0,10,0,0,0
"LTU_053_MZB_LO_16","LTU_053_MZB_LO_16-01.10.2010","01.10.2010",2010,10,1,0,0,0,0,0,0,0,0,0,0,0,0,0,0,145,0,0,0,0,140,0,0,0,0,0,0,0,0,129,0,0,0,0,62,0,0,0,0,0,0,0,0,0,0,0,0,162,0,0,0,0,0,0,0,604,0,0,79,0,0,0,0,0,0,0,0,0,0,0,0,14,0,0,0,0,0,164,0,0,0,259,0,0,0,0,0,0,440,0,0,0,0,29,0,0,0,0,0,0,0,0,0,0,0,0,0,0,0,0,0,0,497,0,0,0,0,0,0,0,0,0,0,0,0,0,0,0,0,0,178,0,0,93,0,0,0,0,0,0,0,0,0,0,0,0,0,0,0,0,195,0,0,0,0,0,0,0,0,0,0,210,0,0,0
"LTU_053_MZB_LO_16","LTU_053_MZB_LO_16-17.09.2013","17.09.2013",2013,9,17,0,0,0,0,0,0,0,0,0,0,0,0,0,0,70,0,0,0,56,177,0,0,101,0,176,70,39,39,0,0,0,0,0,84,0,0,0,0,0,16,0,0,0,0,0,0,56,0,0,0,0,0,0,0,96,0,0,0,0,0,0,4,0,0,0,0,0,0,0,0,0,0,0,0,0,0,64,0,0,0,130,0,0,0,35,0,0,206,305,0,0,0,90,0,0,69,0,0,0,0,0,0,0,0,0,0,0,0,0,0,0,286,0,0,0,0,0,0,0,0,0,0,0,0,0,0,0,0,0,0,0,0,46,0,0,0,0,0,0,72,0,0,0,0,0,0,0,120,0,78,0,0,0,0,0,12,0,0,0,0,16,0,0,0
"LTU_053_MZB_LO_16","LTU_053_MZB_LO_16-22.09.2015","22.09.2015",2015,9,22,0,0,0,0,0,0,0,0,0,0,0,0,0,0,24,0,0,0,17,48,0,0,0,0,39,0,0,0,11,0,0,0,0,32,0,0,0,0,0,0,0,0,0,0,0,0,0,0,0,0,0,0,0,0,12,0,0,12,0,0,0,0,0,10,0,0,0,20,1,0,0,0,0,0,0,0,17,0,0,0,33,24,0,0,0,0,0,0,43,0,0,0,16,0,0,15,0,0,0,0,0,0,0,0,0,0,0,0,0,0,0,35,0,0,0,0,0,0,0,0,0,9,0,0,0,0,0,0,0,29,0,0,0,0,0,0,0,0,0,0,0,0,0,0,0,6,0,0,0,12,0,0,0,0,0,8,0,0,0,0,0,1,0,0
"LTU_053_MZB_LO_16","LTU_053_MZB_LO_16-20.09.2018","20.09.2018",2018,9,20,0,0,0,0,0,0,0,0,0,0,0,0,0,0,74,0,0,0,73,315,0,41,1,0,94,0,28,28,0,0,52,0,0,103,0,0,0,0,0,0,0,0,0,0,0,0,92,0,0,0,0,0,66,0,152,0,0,25,0,0,0,37,0,0,0,0,0,24,3,0,29,0,0,0,0,0,99,0,0,0,293,0,0,0,0,0,0,108,0,0,34,0,0,0,0,13,0,0,0,0,0,0,0,77,0,6,101,0,0,0,0,82,0,0,0,0,0,0,9,0,0,99,0,0,0,0,0,0,0,16,11,0,54,0,0,0,0,0,0,0,0,0,0,0,0,0,0,85,0,82,0,0,0,0,0,0,0,0,0,0,1,0,0,0
"LTU_053_MZB_LO_16","LTU_053_MZB_LO_16-20.09.2021","20.09.2021",2021,9,20,0,0,0,0,0,0,0,0,0,0,0,0,0,0,159,0,0,0,1,313,0,0,13,0,5,0,39,39,0,0,0,0,0,18,0,0,0,0,0,0,0,0,0,0,0,0,0,0,0,0,0,0,0,0,74,0,0,43,0,0,0,5,0,0,0,2,0,4,5,0,36,0,0,0,0,0,11,0,0,0,400,0,0,0,0,0,0,0,3,0,0,0,0,0,0,0,0,0,0,0,0,0,0,0,0,0,0,0,0,0,0,118,0,0,0,0,1,0,0,0,0,1,0,0,0,0,0,0,0,3,0,0,0,0,2,0,0,0,0,0,0,0,0,17,0,0,0,269,0,3,0,0,0,0,0,0,0,0,0,0,2,0,0,0
"LTU_053_MZB_LO_17","LTU_053_MZB_LO_17-05.10.2010","05.10.2010",2010,10,5,0,0,0,0,0,0,0,0,0,0,0,0,0,0,0,0,0,0,0,0,0,0,41,0,0,0,9,9,0,0,0,0,0,1,0,0,0,0,0,0,0,0,0,0,0,0,0,0,0,0,0,0,8,0,0,0,0,0,0,0,0,0,0,0,0,0,0,0,12,0,0,0,0,0,0,0,0,0,0,0,18,0,0,0,13,0,0,45,28,0,0,0,0,0,0,34,0,0,0,0,0,0,0,0,0,0,21,0,0,0,0,75,0,0,0,0,0,0,0,0,0,0,0,0,0,0,0,0,0,0,0,0,0,0,0,0,0,0,0,0,0,0,0,0,0,0,0,0,0,0,0,0,0,0,0,0,0,0,0,0,0,0,0,0
"LTU_053_MZB_LO_17","LTU_053_MZB_LO_17-04.10.2011","04.10.2011",2011,10,4,0,0,0,0,0,0,0,0,0,0,0,0,0,0,13,0,0,0,8,265,0,0,28,0,296,0,6,6,0,0,0,4,0,0,0,0,0,0,0,0,0,0,0,0,0,0,1,0,0,0,0,0,0,0,6,0,0,3,0,0,0,0,0,0,0,0,0,0,2,0,1,0,1,0,0,0,38,0,0,0,145,2,0,0,0,0,0,7,11,0,0,0,0,0,0,0,0,0,0,0,0,0,0,34,0,0,0,0,0,0,0,33,0,0,8,0,0,0,0,0,0,7,0,0,0,0,0,0,0,0,0,0,0,0,1,0,0,0,0,0,0,0,0,0,0,0,0,55,0,22,0,0,0,0,0,0,0,33,0,0,2,1,0,0
"LTU_053_MZB_LO_17","LTU_053_MZB_LO_17-02.10.2012","02.10.2012",2012,10,2,0,0,0,0,0,0,0,0,0,0,0,0,0,0,41,0,0,0,0,0,0,0,164,0,90,0,0,0,0,0,0,0,0,0,0,0,0,0,0,0,0,0,0,0,0,0,0,0,0,0,0,0,0,0,0,0,0,0,0,0,0,0,0,0,0,0,0,0,24,0,0,0,0,20,0,0,0,0,0,0,132,0,0,0,0,0,0,112,0,0,0,0,0,0,0,0,0,0,49,0,0,0,0,0,0,0,0,0,0,0,0,64,0,0,0,0,0,0,0,0,0,0,0,0,0,0,4,0,0,0,0,0,24,0,0,0,0,0,0,0,0,0,0,0,0,0,0,0,0,240,0,0,0,0,0,0,0,252,0,0,0,0,0,0
"LTU_053_MZB_LO_17","LTU_053_MZB_LO_17-08.10.2013","08.10.2013",2013,10,8,0,0,0,0,0,0,0,0,0,0,0,0,0,0,0,0,0,0,0,45,0,0,36,0,0,0,0,0,0,0,0,0,0,39,0,0,8,0,2,0,0,0,0,0,0,0,23,0,0,0,0,0,0,0,0,0,0,24,0,0,0,10,0,0,0,4,0,0,7,0,0,0,0,7,0,0,0,0,0,0,0,0,0,0,0,0,0,63,0,0,0,0,0,0,0,37,0,0,0,0,0,0,0,0,0,0,0,0,0,0,0,49,0,0,0,2,0,0,0,0,0,0,0,0,0,0,5,0,0,0,10,0,0,0,1,0,0,0,0,0,0,8,0,0,0,0,0,0,0,0,0,0,0,0,0,18,0,0,0,0,12,0,0,0
"LTU_053_MZB_LO_17","LTU_053_MZB_LO_17-07.10.2014","07.10.2014",2014,10,7,0,0,0,0,0,0,0,0,0,0,0,0,0,0,0,0,0,0,0,31,0,0,49,39,31,0,37,37,0,0,0,0,0,31,0,0,0,0,0,15,0,0,38,0,0,0,0,0,0,0,0,0,4,0,24,0,0,11,0,0,0,24,0,0,0,0,0,0,4,0,9,0,0,0,0,0,0,0,0,0,20,0,0,0,0,0,25,33,79,0,0,0,19,0,0,70,0,0,0,0,0,0,0,0,0,0,12,0,0,0,0,40,0,0,0,0,0,0,0,0,0,0,0,0,58,0,19,0,0,56,24,0,0,0,0,0,0,0,0,0,0,12,0,0,0,0,0,0,0,170,0,0,0,0,0,9,0,73,0,0,0,0,0,0
"LTU_053_MZB_LO_17","LTU_053_MZB_LO_17-06.10.2015","06.10.2015",2015,10,6,0,0,0,0,0,0,0,0,0,0,0,0,0,0,0,0,0,0,22,98,0,56,0,0,34,40,0,0,12,0,0,0,0,46,0,0,3,0,0,0,0,0,87,0,0,0,13,0,0,0,0,0,12,0,183,0,0,5,0,0,0,4,0,0,0,0,0,14,0,0,24,0,8,6,0,0,52,0,0,0,31,238,0,0,0,0,54,226,33,0,0,0,38,0,0,38,0,0,0,0,0,0,0,11,0,0,18,0,0,0,0,22,0,0,0,0,0,0,0,0,0,0,0,0,0,0,3,0,0,50,0,0,17,0,0,0,0,0,0,0,0,6,0,0,12,0,0,0,0,0,0,0,0,0,0,0,0,0,0,0,29,0,0,0
"LTU_053_MZB_LO_17","LTU_053_MZB_LO_17-04.10.2016","04.10.2016",2016,10,4,0,0,0,0,0,0,0,0,0,0,0,0,0,0,1,0,0,0,0,0,0,0,0,0,0,0,0,0,0,0,0,0,0,0,0,0,0,0,0,0,0,0,0,0,0,0,0,0,0,0,0,0,0,0,18,0,0,5,0,0,0,3,0,0,0,0,0,0,4,0,6,0,0,0,0,0,0,0,0,0,0,0,0,0,0,0,0,0,0,0,0,0,0,0,0,5,0,0,0,0,0,0,0,0,0,0,0,0,0,0,0,0,0,0,0,0,0,0,0,0,0,0,0,0,0,0,6,0,0,0,0,0,0,0,0,0,0,0,0,0,0,0,0,0,0,0,0,0,0,24,0,0,0,0,0,0,0,0,0,0,0,0,0,0
"LTU_053_MZB_LO_17","LTU_053_MZB_LO_17-03.10.2017","03.10.2017",2017,10,3,0,0,0,0,0,0,0,0,0,0,0,0,0,0,14,0,0,0,0,0,0,0,18,0,17,0,1,1,0,0,0,0,0,0,0,0,0,0,0,0,0,0,0,0,0,0,0,0,0,0,0,0,0,0,0,0,0,0,0,0,0,6,0,0,0,0,0,0,1,0,0,0,0,0,0,0,0,0,0,0,18,0,0,0,0,0,0,0,0,0,0,0,0,0,9,0,0,0,0,0,0,0,0,0,0,0,0,0,0,0,0,0,0,0,0,0,0,0,0,0,0,11,0,0,0,0,0,0,0,16,0,0,0,0,0,0,0,0,0,0,0,0,0,0,0,0,0,0,0,23,0,0,0,0,0,0,0,0,0,0,0,0,0,0
"LTU_053_MZB_LO_17","LTU_053_MZB_LO_17-06.10.2020","06.10.2020",2020,10,6,0,0,0,0,0,0,0,0,0,0,6,0,0,0,8,0,0,0,0,0,0,0,8,0,0,0,4,4,0,0,0,0,0,14,0,0,0,0,0,7,0,0,0,0,0,0,0,0,0,0,0,0,4,0,0,0,0,5,0,0,0,3,0,0,0,0,0,0,0,0,2,0,0,0,0,0,0,0,0,0,6,0,0,0,0,0,0,0,0,0,0,0,0,0,0,8,0,0,0,0,0,0,0,0,0,0,0,0,0,0,0,0,0,0,0,0,0,0,0,0,4,0,0,0,0,0,0,0,0,0,6,0,0,0,0,0,0,0,0,0,0,0,0,0,0,0,0,16,0,0,0,0,0,0,0,0,0,0,0,0,0,0,0,0
"LTU_053_MZB_LO_18","LTU_053_MZB_LO_18-07.10.2010","07.10.2010",2010,10,7,0,0,0,0,0,0,0,0,0,0,0,0,0,0,42,0,0,0,0,30,0,0,0,0,2,0,0,0,0,0,0,0,0,1,0,0,0,0,0,0,0,0,0,0,0,0,3,0,0,0,0,0,2,0,2,0,0,28,0,0,0,0,0,0,0,0,0,0,2,0,0,0,0,0,0,0,0,0,0,0,8,0,0,0,1,0,0,0,19,0,0,0,0,0,0,0,0,0,0,0,0,0,0,25,0,0,0,0,0,0,0,8,0,0,4,0,0,0,0,0,0,5,0,0,1,0,0,0,0,0,0,0,1,0,66,0,0,0,0,0,0,0,0,0,0,0,0,0,0,0,0,0,0,0,0,0,0,0,0,0,0,0,0,0
"LTU_053_MZB_LO_18","LTU_053_MZB_LO_18-05.10.2011","05.10.2011",2011,10,5,0,0,0,0,0,0,0,0,0,0,0,0,0,0,61,0,0,0,0,60,0,0,28,24,56,0,1,1,0,0,0,0,0,69,0,0,0,0,0,0,0,0,0,0,0,0,0,0,0,0,0,0,0,0,48,0,0,105,0,0,0,1,0,0,0,0,0,44,25,0,0,0,0,0,0,0,88,0,0,0,121,0,0,0,0,0,56,124,1,0,28,0,24,0,40,32,0,0,0,0,0,0,0,49,0,0,25,0,0,0,0,53,0,0,0,0,0,0,0,0,0,60,0,0,0,0,0,0,0,60,0,0,33,0,45,0,0,0,0,0,0,0,0,0,0,0,0,0,0,136,0,0,0,0,0,32,72,32,0,0,0,0,0,0
"LTU_053_MZB_LO_18","LTU_053_MZB_LO_18-03.10.2012","03.10.2012",2012,10,3,0,0,0,0,0,0,0,0,0,0,0,0,0,0,49,0,0,0,12,45,0,0,88,0,273,0,0,0,0,0,0,0,0,48,0,0,0,0,0,0,0,0,0,0,0,0,0,0,0,0,0,0,0,0,272,0,0,117,0,0,0,0,0,0,0,0,0,0,5,0,0,0,0,0,0,0,86,0,0,0,52,180,0,0,0,0,0,176,0,0,0,0,0,0,0,0,0,0,169,0,0,0,0,0,0,0,32,0,0,0,0,340,0,0,0,0,0,0,0,0,0,0,0,0,0,0,0,0,0,288,0,0,0,0,289,0,0,0,0,0,0,0,0,0,48,0,0,0,0,337,0,0,0,0,0,12,0,64,0,0,0,0,0,0
"LTU_053_MZB_LO_18","LTU_053_MZB_LO_18-10.10.2013","10.10.2013",2013,10,10,0,0,0,0,0,0,0,0,0,0,0,0,0,0,29,0,4,0,0,20,0,0,0,0,43,0,9,9,0,0,0,0,0,30,23,0,0,0,11,14,0,0,37,0,0,0,0,0,0,0,0,0,9,0,0,0,0,42,0,0,6,4,0,0,0,0,0,0,11,0,0,0,0,0,0,0,0,0,0,0,0,69,0,0,0,0,0,35,0,0,0,4,0,0,0,0,0,0,0,0,0,0,0,0,0,0,0,0,0,0,0,33,0,0,0,0,0,0,0,0,0,18,0,0,0,0,4,0,0,0,0,0,0,0,0,0,0,0,0,0,0,2,0,0,0,0,0,28,0,35,0,0,0,0,0,0,36,0,0,0,0,0,0,0
"LTU_053_MZB_LO_18","LTU_053_MZB_LO_18-09.10.2014","09.10.2014",2014,10,9,0,0,0,0,0,0,0,0,0,0,0,0,0,0,21,0,0,0,3,5,0,0,1,0,3,0,1,1,0,0,0,0,0,0,0,0,0,0,0,0,0,0,0,0,0,0,0,0,0,0,0,0,1,0,71,0,0,18,0,0,0,0,0,0,0,0,0,0,20,0,0,0,0,0,0,0,2,0,0,0,2,0,0,0,1,0,0,3,5,0,0,0,0,0,0,1,0,0,2,0,0,0,0,7,0,0,0,0,0,0,0,0,0,0,4,0,0,0,0,0,0,0,0,0,0,0,0,0,0,0,0,0,1,0,0,0,0,0,0,1,0,0,0,0,0,0,0,0,0,1,0,0,0,0,0,0,0,1,0,0,2,0,0,0
"LTU_053_MZB_LO_18","LTU_053_MZB_LO_18-01.10.2015","01.10.2015",2015,10,1,0,0,0,0,0,0,0,0,0,0,0,0,0,0,18,0,0,0,6,6,0,0,0,0,0,4,2,2,0,0,0,1,0,23,0,0,0,0,0,0,0,0,0,0,0,0,0,0,0,0,0,0,3,0,71,0,0,2,0,0,0,0,0,0,0,0,0,0,2,0,0,0,0,0,0,0,0,0,0,0,5,82,0,0,0,0,0,25,14,0,1,1,0,0,0,1,0,0,4,0,0,0,0,15,0,0,0,0,0,0,0,0,0,0,3,0,0,0,0,0,0,0,0,0,0,0,0,0,0,0,1,0,2,0,2,0,0,0,0,0,0,0,0,0,0,0,0,0,0,5,0,0,0,0,0,2,0,0,0,0,2,0,0,0
"LTU_053_MZB_LO_18","LTU_053_MZB_LO_18-11.10.2016","11.10.2016",2016,10,11,0,0,0,0,0,0,0,0,0,0,0,0,0,0,17,0,0,0,0,29,0,0,14,0,18,16,0,0,0,0,0,0,0,25,0,0,0,0,0,0,0,0,0,0,0,0,0,0,0,0,0,0,0,0,32,0,0,0,0,0,0,4,0,0,0,0,0,0,1,0,0,0,0,0,0,0,0,0,0,0,0,17,0,0,0,0,0,0,25,0,0,0,0,0,0,13,0,0,0,0,0,0,0,0,0,0,0,0,0,0,0,38,0,0,0,3,0,0,0,0,0,0,0,0,0,0,1,0,0,23,0,0,0,0,0,0,0,0,0,0,0,2,0,0,0,0,0,0,0,48,0,0,0,0,0,0,0,10,0,0,0,0,0,0
"LTU_053_MZB_LO_18","LTU_053_MZB_LO_18-03.10.2017","03.10.2017",2017,10,3,0,0,0,0,0,0,0,0,0,0,0,0,0,0,20,0,0,0,9,32,0,0,0,0,48,0,1,1,0,0,0,0,0,17,0,0,0,0,0,0,0,0,0,0,0,0,1,0,0,0,0,0,0,0,33,0,0,1,0,0,0,3,0,0,0,0,0,0,6,0,0,0,0,0,0,0,0,0,0,0,0,0,0,0,0,0,0,0,0,0,0,0,0,0,0,0,0,0,0,0,0,0,0,6,0,0,0,0,0,0,0,34,0,0,0,0,0,0,0,0,0,5,0,0,8,0,0,0,0,0,0,0,0,0,0,0,0,0,0,0,0,0,0,0,0,0,0,0,0,61,0,0,0,0,0,0,0,0,0,0,1,0,0,0
"LTU_053_MZB_LO_18","LTU_053_MZB_LO_18-07.10.2020","07.10.2020",2020,10,7,0,0,0,0,0,0,0,0,0,0,8,0,0,0,35,0,0,0,0,38,0,0,28,0,13,0,22,22,0,0,0,0,0,44,0,0,0,0,1,26,0,0,0,0,0,0,0,0,0,0,0,0,0,0,20,0,0,10,0,0,0,3,0,0,0,0,0,0,1,0,0,0,0,0,0,0,0,0,0,0,0,0,0,0,0,0,0,0,0,0,0,0,0,0,0,71,0,0,0,0,0,0,0,0,0,0,8,0,0,0,0,35,0,0,0,0,0,0,0,0,2,0,0,0,0,0,0,0,0,0,13,0,10,0,0,0,0,0,0,0,0,4,0,0,0,0,0,0,0,79,0,0,0,0,0,0,21,9,0,0,0,0,0,0
"LTU_053_MZB_LO_19","LTU_053_MZB_LO_19-05.10.2011","05.10.2011",2011,10,5,0,0,0,0,0,0,0,0,0,0,0,0,0,0,22,0,0,0,17,21,0,0,0,0,0,0,0,0,0,0,0,0,0,165,0,0,0,0,0,0,0,0,0,0,0,0,0,0,0,0,0,0,0,0,0,0,0,0,0,0,0,0,0,0,57,0,0,0,0,0,0,0,0,0,0,0,0,0,0,0,196,0,0,0,0,0,0,0,0,0,0,0,0,0,64,24,0,0,0,0,0,0,0,0,0,0,0,0,0,0,0,248,0,0,0,0,0,0,0,0,0,0,0,0,0,0,0,0,0,80,0,0,20,0,0,0,0,0,0,0,0,0,0,0,0,0,0,0,0,0,0,0,0,0,0,0,0,0,0,0,0,6,0,0
"LTU_053_MZB_LO_19","LTU_053_MZB_LO_19-09.10.2013","09.10.2013",2013,10,9,0,0,0,0,0,0,0,0,0,0,0,0,0,0,0,0,0,0,0,0,0,0,11,0,0,0,0,0,0,0,0,0,0,79,0,0,0,0,0,0,0,7,0,0,0,0,0,0,0,0,0,0,0,0,0,0,0,0,0,0,0,7,0,0,0,0,0,0,0,0,0,0,0,5,0,0,0,0,0,0,49,0,0,0,0,0,0,0,0,0,0,0,4,0,182,0,0,0,0,0,0,147,0,0,0,0,0,0,0,0,0,346,0,0,0,0,0,0,0,0,0,0,0,0,0,0,0,0,0,0,0,0,0,0,0,0,0,0,0,0,0,0,0,0,0,0,0,0,0,23,0,0,0,0,0,0,0,0,0,0,0,0,0,0
"LTU_053_MZB_LO_19","LTU_053_MZB_LO_19-08.10.2014","08.10.2014",2014,10,8,0,0,0,0,0,0,0,0,0,0,0,0,0,0,23,0,19,0,0,18,0,0,81,0,0,0,0,0,0,0,0,0,0,103,0,0,0,0,0,9,0,28,0,0,0,0,0,0,0,19,0,0,0,0,28,0,0,0,0,0,0,48,0,0,123,0,0,0,0,0,6,0,8,29,0,0,0,0,0,0,44,0,0,0,0,0,0,26,0,0,0,0,5,0,51,116,0,0,0,0,0,21,0,0,0,0,0,0,0,0,0,205,0,0,0,0,0,0,3,0,0,0,2,0,48,0,16,0,0,64,0,0,36,0,0,0,0,0,0,3,0,4,0,16,0,0,0,46,0,304,0,0,0,0,0,0,0,0,0,0,0,0,0,3
"LTU_053_MZB_LO_19","LTU_053_MZB_LO_19-07.10.2015","07.10.2015",2015,10,7,0,0,0,0,0,0,0,0,0,0,0,0,0,0,0,0,0,0,0,0,0,0,18,22,13,0,4,4,0,0,0,0,0,33,0,0,0,0,0,2,0,0,0,0,0,0,9,0,0,19,0,0,9,0,16,0,0,0,0,0,0,6,0,0,22,0,0,0,0,0,0,0,0,0,0,0,0,0,0,0,2,0,0,0,0,0,9,0,0,0,0,0,0,0,16,10,0,0,0,0,0,9,0,0,0,0,3,0,0,0,0,43,0,0,0,0,0,0,0,0,0,0,0,0,0,0,0,0,0,42,0,0,0,0,0,0,0,0,0,0,0,0,0,0,0,0,0,0,0,63,0,0,0,0,0,0,0,0,0,0,36,0,0,0
"LTU_053_MZB_LO_19","LTU_053_MZB_LO_19-05.10.2016","05.10.2016",2016,10,5,0,0,0,0,0,0,0,0,0,0,0,0,0,0,1,0,0,0,0,0,0,0,22,0,0,0,2,2,1,0,1,0,0,68,0,0,0,0,0,0,0,0,0,0,0,0,0,0,0,28,0,0,0,0,0,0,0,0,0,0,0,6,0,0,4,0,0,0,0,0,0,0,0,0,0,0,0,0,0,0,24,28,0,0,0,0,0,0,0,0,0,0,0,0,38,21,0,0,0,0,0,8,0,0,0,0,0,0,0,0,0,0,0,0,0,0,0,0,0,0,0,0,0,0,0,0,0,0,0,23,0,0,0,0,0,0,0,0,0,0,0,0,0,0,0,0,0,0,0,25,0,0,0,0,0,0,0,0,0,0,0,0,0,0
"LTU_053_MZB_LO_19","LTU_053_MZB_LO_19-04.10.2017","04.10.2017",2017,10,4,0,0,0,0,0,0,0,0,0,0,0,0,0,0,5,0,13,0,8,12,0,0,18,0,16,0,1,1,0,0,0,0,0,19,0,0,1,0,0,4,0,1,0,0,0,0,14,0,0,0,0,0,3,0,0,0,0,0,0,0,0,7,0,0,4,0,0,0,0,0,0,1,0,0,0,0,0,0,0,0,9,0,0,0,0,0,0,0,0,0,0,0,0,0,49,24,0,0,0,0,3,0,0,0,0,0,0,2,0,0,0,27,0,0,0,0,0,0,0,0,0,0,0,0,0,0,2,0,0,0,0,0,6,0,0,0,0,0,0,0,0,2,0,0,0,0,2,0,0,69,0,0,0,0,0,0,0,0,0,0,10,0,0,0
"LTU_053_MZB_LO_19","LTU_053_MZB_LO_19-09.10.2019","09.10.2019",2019,10,9,0,0,0,0,0,0,0,0,0,0,0,0,0,0,0,0,0,0,0,0,0,0,13,0,0,0,8,8,0,0,2,0,0,34,0,0,12,0,0,0,0,3,0,0,0,0,0,0,0,3,0,0,0,0,0,0,0,0,0,0,0,0,0,0,14,3,0,0,0,0,0,0,0,1,0,0,0,0,0,0,0,0,0,0,0,0,0,0,0,0,0,0,0,0,18,0,0,0,0,0,0,0,0,0,0,0,0,0,0,0,0,25,0,0,0,0,0,0,0,0,0,0,0,0,0,0,1,0,0,0,0,0,0,0,0,0,0,0,0,0,0,2,0,0,0,0,0,0,0,45,0,0,0,0,0,2,0,0,0,0,0,0,0,0
"LTU_053_MZB_LO_19","LTU_053_MZB_LO_19-05.10.2022","05.10.2022",2022,10,5,0,0,0,0,0,0,0,0,0,0,0,0,0,0,0,0,1,0,0,7,0,0,0,0,0,0,1,1,0,0,0,0,0,3,0,0,2,0,0,1,0,0,0,0,0,0,0,0,0,0,0,0,0,0,0,0,0,0,0,0,0,3,0,0,25,0,0,0,0,0,0,0,0,0,0,0,0,0,0,0,3,0,0,0,0,0,0,0,0,0,0,0,0,0,0,0,0,0,0,0,0,0,0,0,0,0,0,1,0,0,0,10,0,0,0,0,0,0,0,0,0,0,0,0,0,0,0,0,0,0,0,0,0,0,0,0,0,0,0,0,0,0,0,0,0,0,0,2,0,0,0,0,0,0,0,0,0,0,0,0,0,0,0,0
"LTU_053_MZB_LO_2","LTU_053_MZB_LO_2-04.10.2010","04.10.2010",2010,10,4,0,0,0,0,0,0,0,0,0,0,0,0,0,0,0,0,15,0,0,0,0,0,13,0,0,0,3,3,0,0,0,0,0,5,0,0,0,0,0,3,0,0,0,0,0,0,0,0,0,0,0,0,2,0,0,0,0,3,0,0,0,14,0,0,43,13,0,0,0,0,0,0,0,2,0,0,0,0,0,0,0,0,0,0,1,0,0,0,0,0,0,0,6,0,0,2,0,0,0,1,0,0,0,0,0,1,1,0,0,0,0,69,0,0,0,0,0,0,0,0,0,0,0,0,2,0,0,0,0,0,0,0,0,0,0,0,0,0,0,0,3,0,0,0,0,0,14,0,0,79,0,0,1,0,0,0,0,0,0,0,0,0,0,0
"LTU_053_MZB_LO_2","LTU_053_MZB_LO_2-07.10.2013","07.10.2013",2013,10,7,0,0,0,0,0,0,0,0,0,0,0,0,0,0,0,0,7,0,0,35,0,1,1,0,0,1,2,2,0,0,0,0,0,49,0,0,1,0,0,11,0,0,0,0,0,0,0,0,0,0,0,0,7,0,5,0,0,1,0,0,1,3,0,0,2,0,0,0,0,0,0,0,3,0,0,0,0,0,0,0,0,0,0,0,0,0,0,0,28,0,0,0,3,0,0,2,0,0,0,1,0,0,0,0,0,0,1,1,0,0,0,18,0,0,0,0,0,0,0,0,0,0,0,0,0,0,2,0,0,0,0,0,0,0,0,0,0,0,0,0,0,0,0,0,0,0,3,0,0,0,0,0,0,0,0,1,0,0,0,0,0,0,0,0
"LTU_053_MZB_LO_2","LTU_053_MZB_LO_2-27.09.2016","27.09.2016",2016,9,27,0,0,0,0,0,0,0,0,0,0,0,0,0,0,0,0,32,0,0,44,0,0,1,0,0,0,2,2,0,0,0,0,0,0,0,0,0,0,0,3,0,0,0,0,0,0,0,2,0,0,0,0,1,0,4,0,0,7,0,0,1,2,0,0,316,2,0,0,0,0,4,0,0,0,0,0,0,0,0,0,0,0,0,0,0,0,0,0,0,0,0,0,3,0,0,0,0,0,0,2,0,0,0,0,0,1,0,0,0,0,0,0,1,0,0,0,0,0,0,0,0,0,0,0,0,0,0,0,0,0,0,0,1,0,0,0,0,0,0,0,0,0,0,0,0,0,2,2,0,0,0,0,0,0,0,1,0,0,0,0,0,0,0,0
"LTU_053_MZB_LO_2","LTU_053_MZB_LO_2-25.09.2019","25.09.2019",2019,9,25,0,0,0,0,0,0,0,0,0,0,0,1,0,0,0,0,20,0,0,57,0,0,13,0,0,58,61,61,0,0,0,98,0,1354,0,0,0,0,0,8,0,0,0,0,0,0,0,0,0,0,0,0,33,0,157,0,0,27,0,0,0,26,0,0,17,0,0,0,8,0,9,0,28,0,0,0,0,0,0,0,66,288,0,0,0,0,0,0,65,0,0,0,35,0,0,1,0,0,0,9,0,0,0,0,0,0,25,0,0,0,0,719,0,0,0,0,0,0,0,0,0,0,2,0,1,0,2,0,0,28,0,0,0,0,0,0,0,0,0,0,0,0,0,0,0,0,0,7,0,64,0,0,0,0,0,0,0,0,0,0,2,0,0,0
"LTU_053_MZB_LO_2","LTU_053_MZB_LO_2-04.10.2022","04.10.2022",2022,10,4,0,0,0,0,0,0,0,0,0,0,0,0,0,0,0,0,10,0,0,2,0,0,4,0,0,4,13,13,0,0,3,0,0,42,0,0,0,0,0,10,0,0,0,0,0,0,0,1,0,0,0,0,0,0,0,0,0,13,0,0,0,3,0,0,16,0,0,0,0,0,5,0,0,0,0,0,0,0,0,0,15,11,0,0,0,0,0,0,9,0,0,0,22,0,0,0,0,0,0,0,0,0,0,0,0,0,0,3,0,0,0,14,0,0,0,0,0,0,0,0,0,0,0,0,0,0,0,0,1,0,0,0,8,2,0,0,0,0,0,0,0,0,0,0,0,0,0,0,0,0,0,0,0,0,0,0,0,0,0,0,0,0,0,0
"LTU_053_MZB_LO_20","LTU_053_MZB_LO_20-27.09.2010","27.09.2010",2010,9,27,0,0,0,0,0,0,0,0,0,0,0,0,0,0,0,0,0,0,0,0,0,0,0,0,0,18,9,9,0,0,0,0,0,25,0,0,1,0,0,12,0,0,0,0,0,0,0,0,0,0,0,0,6,0,0,0,0,8,0,0,0,0,0,0,3,0,0,0,2,0,0,0,0,0,0,0,0,0,0,0,0,35,0,0,0,0,0,0,10,0,0,0,8,0,0,0,0,0,0,0,0,0,0,0,0,0,0,0,0,0,0,28,0,0,0,0,0,0,0,0,0,0,0,0,0,0,0,0,0,0,0,0,0,0,0,0,0,0,0,0,0,0,0,0,0,0,0,0,0,18,0,0,0,0,0,0,0,0,0,0,0,0,0,5
"LTU_053_MZB_LO_20","LTU_053_MZB_LO_20-13.10.2011","13.10.2011",2011,10,13,0,0,6,0,0,0,0,0,0,0,0,0,0,0,0,0,0,0,0,0,0,0,10,0,0,0,12,12,0,0,0,0,0,38,0,0,0,0,0,0,0,0,0,0,0,0,0,0,0,0,0,0,0,0,0,0,0,5,0,0,0,0,0,0,15,0,0,0,6,0,0,0,0,0,0,0,0,0,0,0,0,0,0,0,0,0,0,0,0,0,0,0,8,0,0,22,0,0,0,0,0,0,0,0,0,0,0,0,0,0,0,0,0,0,0,0,0,0,0,0,0,0,0,0,0,0,0,0,0,0,8,0,0,0,0,0,0,0,0,0,0,0,3,0,0,0,0,0,0,48,0,0,0,0,0,0,0,0,0,0,0,0,0,0
"LTU_053_MZB_LO_20","LTU_053_MZB_LO_20-25.09.2012","25.09.2012",2012,9,25,0,0,0,0,0,0,0,0,0,0,0,0,0,0,0,0,0,0,0,41,0,0,0,0,0,0,8,8,0,0,0,0,0,61,0,0,0,0,0,0,0,0,0,0,0,0,0,0,0,0,0,0,14,0,51,0,0,0,0,0,0,9,0,0,0,0,0,41,0,0,0,0,0,0,0,0,0,0,0,0,89,0,0,0,19,0,0,0,0,0,0,0,68,0,0,19,0,0,0,0,0,0,0,0,0,0,0,16,0,0,0,23,0,0,0,0,0,0,0,0,0,0,0,0,0,0,0,0,0,0,0,0,0,0,0,0,0,0,0,0,0,0,0,0,0,0,0,0,0,0,0,0,0,0,0,0,0,0,0,0,0,0,0,0
"LTU_053_MZB_LO_20","LTU_053_MZB_LO_20-10.10.2013","10.10.2013",2013,10,10,0,0,0,0,0,0,0,0,0,0,0,0,0,0,19,0,35,0,21,0,0,0,28,20,40,0,9,9,0,0,0,0,0,21,19,0,0,0,0,0,0,0,0,0,0,0,0,0,0,0,0,0,10,0,73,0,0,18,0,0,0,9,0,0,0,0,0,0,2,0,8,0,0,0,0,0,37,0,0,0,57,38,0,0,0,0,0,31,57,0,0,0,0,0,0,25,0,0,0,0,0,0,0,0,0,0,0,0,0,0,0,35,0,0,0,0,0,0,12,0,0,0,0,0,0,0,0,0,0,59,10,0,0,0,0,0,0,0,0,0,0,0,0,0,0,0,16,47,0,167,0,0,0,0,0,0,34,0,0,0,8,0,0,0
"LTU_053_MZB_LO_20","LTU_053_MZB_LO_20-30.09.2014","30.09.2014",2014,9,30,0,0,0,0,0,0,0,0,0,0,0,0,0,0,0,0,0,0,0,12,0,0,6,15,0,5,1,1,0,0,0,0,0,10,0,0,9,0,0,0,0,0,0,0,0,0,0,0,0,0,0,0,0,0,0,0,0,0,0,0,0,0,0,0,11,0,0,1,3,0,0,0,0,0,0,0,0,0,0,0,6,8,0,0,0,0,0,7,0,0,0,0,0,0,0,0,0,0,0,3,0,0,0,0,0,0,0,0,0,0,0,10,0,0,0,0,0,0,1,0,0,0,0,0,0,0,0,0,0,11,4,0,0,0,0,0,0,0,0,0,0,0,0,0,0,0,0,0,0,9,0,0,0,0,0,0,0,2,0,0,0,0,0,4
"LTU_053_MZB_LO_20","LTU_053_MZB_LO_20-05.10.2015","05.10.2015",2015,10,5,0,0,0,0,0,0,0,0,0,0,0,0,0,0,0,0,0,0,0,0,0,0,55,25,8,13,6,6,0,0,0,0,0,17,0,0,1,0,0,0,0,0,7,0,0,0,0,0,0,0,0,0,2,0,25,0,0,3,0,0,0,0,0,0,0,0,0,0,3,0,0,0,0,0,0,0,0,0,0,0,0,54,0,0,0,0,0,0,0,0,0,0,2,0,0,17,0,0,6,1,0,0,0,0,0,0,0,0,0,0,0,0,0,0,0,6,0,0,0,0,0,0,0,0,0,0,1,0,0,37,10,0,1,0,0,0,0,0,0,0,0,3,1,0,0,0,0,0,0,67,0,0,0,0,0,0,0,26,0,0,0,0,0,16
"LTU_053_MZB_LO_20","LTU_053_MZB_LO_20-10.10.2016","10.10.2016",2016,10,10,0,0,0,0,0,0,0,0,0,0,0,0,0,0,13,0,1,0,5,222,0,0,4,0,4,1,5,5,0,0,0,0,0,0,0,0,1,0,0,0,0,0,0,0,0,0,3,0,0,0,0,0,2,0,62,0,0,1,0,0,0,22,0,0,0,0,0,0,0,0,0,0,1,1,0,0,1,6,0,0,7,0,0,0,0,0,5,18,10,0,25,0,0,0,0,2,0,0,0,0,0,0,0,0,0,0,0,0,0,0,0,0,0,0,0,0,0,0,0,0,0,0,0,0,0,0,0,0,0,4,0,0,12,0,0,0,0,0,0,0,0,0,0,0,0,3,0,5,0,4,0,0,0,0,0,0,0,0,0,0,0,0,0,0
"LTU_053_MZB_LO_20","LTU_053_MZB_LO_20-02.10.2017","02.10.2017",2017,10,2,0,0,0,0,0,0,0,0,0,0,0,0,0,0,7,0,5,0,0,17,0,0,0,0,0,0,1,1,0,0,0,0,0,15,0,0,0,0,0,0,0,0,0,0,0,0,2,0,0,0,0,0,0,0,1,0,0,0,0,0,0,0,0,0,0,0,0,0,11,0,0,0,0,0,0,0,0,0,0,0,6,0,0,0,0,0,0,5,0,0,0,0,0,0,0,8,0,0,0,0,0,0,0,0,0,0,0,0,0,0,0,23,0,0,0,0,0,0,0,0,0,9,0,0,0,0,0,0,0,9,0,0,0,0,0,0,0,0,0,0,0,0,0,0,0,12,0,0,0,15,0,0,0,0,0,2,0,0,0,0,0,0,4,0
"LTU_053_MZB_LO_20","LTU_053_MZB_LO_20-08.10.2020","08.10.2020",2020,10,8,0,0,0,0,0,0,0,0,0,0,0,0,0,0,0,0,0,0,0,63,0,0,0,0,0,25,14,14,0,0,0,0,0,108,0,0,5,0,0,0,0,1,0,0,0,0,0,0,0,4,0,0,5,0,0,0,0,4,0,0,0,0,0,0,6,1,0,6,0,0,0,0,0,1,0,0,0,0,0,0,0,0,0,0,0,0,0,45,0,0,0,0,0,0,0,8,0,0,0,0,0,0,0,0,0,0,0,0,0,0,0,43,0,0,0,0,0,0,0,0,0,0,0,0,0,0,0,0,0,8,9,0,0,0,0,0,0,0,0,0,0,2,1,0,0,0,0,0,0,20,0,0,0,0,0,0,0,0,0,0,0,0,0,0
"LTU_053_MZB_LO_21","LTU_053_MZB_LO_21-07.10.2010","07.10.2010",2010,10,7,0,0,0,0,0,0,0,0,0,0,0,0,0,0,0,0,0,0,0,2,0,0,0,0,0,1,4,4,0,0,0,0,0,3,0,0,0,0,0,3,0,0,0,0,0,0,0,0,0,0,0,0,1,0,4,0,0,1,0,0,0,1,0,0,34,0,0,0,0,0,1,0,0,0,0,0,1,0,0,0,5,0,0,0,0,51,0,0,1,0,9,0,0,0,0,0,0,0,0,0,0,0,0,27,0,0,0,0,0,0,0,0,0,0,0,0,0,0,0,0,0,3,0,0,0,0,4,0,0,1,0,0,4,0,0,0,0,0,0,0,0,0,0,0,2,0,1,0,0,0,0,0,0,0,0,0,0,0,0,0,2,0,0,0
"LTU_053_MZB_LO_21","LTU_053_MZB_LO_21-05.10.2011","05.10.2011",2011,10,5,0,0,0,0,0,0,0,0,0,0,0,0,0,0,0,0,0,0,32,0,0,0,0,0,0,0,0,0,0,0,0,0,0,38,0,0,0,0,0,36,0,0,0,0,0,0,1,0,0,0,0,0,0,0,0,0,0,0,0,0,0,0,0,0,13,0,0,0,1,0,0,0,0,0,0,0,1,0,0,0,38,0,0,0,0,0,0,570,0,0,0,0,12,0,0,0,0,0,0,0,0,0,0,0,27,0,1,0,0,0,0,0,0,0,0,0,0,0,0,0,0,0,0,0,0,0,0,0,0,96,0,0,1,0,0,0,0,0,0,0,0,0,0,0,0,0,0,0,0,0,0,0,0,0,0,0,1,0,0,0,1,0,0,0
"LTU_053_MZB_LO_21","LTU_053_MZB_LO_21-03.10.2012","03.10.2012",2012,10,3,0,0,0,0,0,0,0,0,0,0,0,0,0,0,73,0,0,0,0,0,0,0,56,0,152,0,0,0,0,0,0,0,0,0,33,0,0,0,0,81,0,0,0,0,0,0,0,0,0,0,0,0,0,0,180,0,0,137,0,0,0,56,0,0,29,0,0,96,4,0,57,0,0,0,0,0,172,0,0,0,128,0,0,0,72,0,0,496,0,0,0,0,144,0,0,0,0,0,0,0,0,0,0,0,0,0,112,0,0,0,0,148,0,0,0,0,0,0,0,0,0,41,0,0,0,0,0,0,0,80,0,0,0,0,0,0,0,0,0,0,0,0,0,0,76,0,0,0,0,172,0,0,0,0,0,0,0,0,0,0,0,0,0,0
"LTU_053_MZB_LO_21","LTU_053_MZB_LO_21-10.10.2013","10.10.2013",2013,10,10,0,0,0,0,0,0,0,0,0,0,0,0,0,0,0,0,0,0,0,26,0,0,0,0,0,0,8,8,0,0,0,0,0,33,26,0,0,0,0,0,0,0,0,0,0,0,0,0,0,0,0,0,0,0,59,0,0,10,0,0,0,0,0,0,17,0,0,8,0,0,11,0,0,0,0,0,0,0,0,0,76,0,0,0,0,0,0,18,0,0,0,0,0,0,0,0,0,0,0,0,0,0,0,0,0,0,20,0,0,0,0,29,0,0,0,0,0,0,0,0,0,19,0,0,0,0,0,0,0,0,0,0,18,0,0,0,0,0,0,0,12,0,0,0,47,0,0,18,0,0,0,0,0,0,0,8,0,0,0,0,10,0,0,0
"LTU_053_MZB_LO_21","LTU_053_MZB_LO_21-09.10.2014","09.10.2014",2014,10,9,0,0,0,0,0,0,0,0,0,0,0,0,0,0,0,0,1,0,1,93,0,0,0,0,0,0,1,1,0,0,0,0,0,0,0,0,0,1,0,2,0,0,0,0,0,0,1,3,0,0,0,0,0,0,20,0,0,6,0,0,0,0,0,0,8,0,0,1,0,0,3,0,0,0,0,0,5,6,0,0,8,0,0,1,0,65,0,0,0,0,73,0,0,3,0,0,0,2,0,0,0,0,0,34,0,0,0,0,0,0,0,0,0,0,0,0,0,0,0,0,0,14,0,0,0,0,2,0,0,6,0,0,5,0,0,0,0,0,0,0,0,0,0,1,4,0,0,0,0,0,0,0,0,0,0,0,0,0,0,0,0,0,0,0
"LTU_053_MZB_LO_21","LTU_053_MZB_LO_21-01.10.2015","01.10.2015",2015,10,1,0,0,0,0,0,0,0,0,0,0,0,0,0,0,0,0,0,2,1,167,0,0,0,0,36,0,1,1,0,0,0,0,0,0,0,0,0,1,0,0,0,0,0,0,0,0,2,1,0,0,0,0,0,0,23,0,0,3,0,1,0,0,0,0,16,0,8,16,0,0,1,0,0,0,0,0,15,15,10,0,13,28,0,0,1,93,0,0,20,0,50,0,1,0,0,0,0,0,1,0,0,0,0,43,0,0,0,0,0,0,0,0,0,0,0,0,0,0,0,0,0,37,0,0,0,0,1,0,0,11,0,0,2,0,0,0,0,0,1,0,0,0,0,3,8,1,0,28,0,0,0,0,0,0,0,0,0,0,0,0,0,0,0,0
"LTU_053_MZB_LO_21","LTU_053_MZB_LO_21-11.10.2016","11.10.2016",2016,10,11,0,0,0,0,0,0,0,0,0,0,0,0,0,0,0,0,0,0,0,64,0,0,5,0,0,12,0,0,0,0,0,0,0,24,68,0,0,1,0,0,0,0,0,0,0,0,16,0,0,0,0,0,0,0,85,0,0,7,0,0,0,0,0,0,14,0,0,9,1,0,5,0,0,0,0,0,15,0,0,0,62,0,0,0,0,0,0,17,0,0,100,0,5,0,0,3,0,0,0,0,0,0,0,0,0,0,44,0,0,0,0,62,0,0,0,0,0,0,0,0,0,45,0,0,0,0,0,0,0,0,0,0,17,0,0,0,0,0,0,0,0,0,0,15,47,0,0,36,0,0,0,0,0,0,0,0,0,0,0,0,0,0,0,0
"LTU_053_MZB_LO_21","LTU_053_MZB_LO_21-03.10.2017","03.10.2017",2017,10,3,0,0,0,0,0,0,0,0,0,0,0,0,0,0,0,0,0,0,3,17,0,0,0,0,1,0,0,0,0,0,0,0,0,0,0,0,0,0,0,0,0,1,0,0,0,0,0,0,0,0,0,0,5,0,0,0,0,24,0,0,0,0,0,0,38,0,0,0,0,0,6,0,0,0,0,0,0,0,0,0,1,0,0,0,0,0,0,1,19,0,18,0,19,0,0,0,0,0,0,0,0,0,0,0,0,0,19,0,0,0,0,9,0,0,0,0,0,0,0,0,0,0,0,0,0,0,0,0,0,0,0,0,0,0,0,0,0,0,0,0,0,0,0,0,0,0,0,0,0,0,0,0,0,0,0,0,1,0,0,0,0,0,0,0
"LTU_053_MZB_LO_21","LTU_053_MZB_LO_21-07.10.2020","07.10.2020",2020,10,7,0,0,0,0,0,0,0,0,0,0,0,0,0,0,0,0,0,3,44,39,0,0,0,0,111,31,12,12,0,0,0,12,0,19,0,0,0,0,1,0,0,0,0,0,0,0,0,0,0,0,0,0,0,0,39,0,0,17,0,0,0,11,0,0,12,0,0,16,0,0,0,0,0,0,0,0,0,0,0,0,17,82,0,0,0,0,11,102,25,0,0,0,14,0,0,0,0,0,0,0,0,0,0,0,0,0,21,0,0,0,0,45,0,0,0,0,0,0,0,0,0,8,0,0,0,0,1,0,0,0,6,0,0,0,0,0,0,0,0,0,0,0,0,1,8,0,0,9,0,0,0,0,0,0,0,13,12,0,0,0,8,0,0,0
"LTU_053_MZB_LO_22","LTU_053_MZB_LO_22-27.09.2010","27.09.2010",2010,9,27,0,0,0,0,0,0,0,0,0,0,0,0,0,0,0,0,1,0,0,1,0,0,0,0,0,0,0,0,9,0,0,0,0,1,0,0,0,0,0,0,0,0,0,0,0,0,10,0,0,0,0,0,1,0,0,0,0,0,0,0,0,0,0,0,0,0,0,1,0,0,0,0,0,0,0,0,0,0,0,0,9,0,0,0,0,0,1,0,0,0,0,0,0,0,0,1,0,0,0,0,0,0,0,3,0,0,0,0,0,0,0,2,0,0,0,0,0,0,0,0,0,43,0,0,0,0,0,0,0,0,0,0,1,0,0,0,0,0,0,0,0,0,0,8,0,0,0,4,0,0,0,0,0,0,0,0,0,0,0,0,0,0,0,0
"LTU_053_MZB_LO_22","LTU_053_MZB_LO_22-25.09.2013","25.09.2013",2013,9,25,0,0,0,0,0,0,0,0,0,0,0,0,0,0,29,0,0,0,0,171,0,0,0,0,0,0,11,11,0,0,0,0,0,546,0,0,0,0,0,0,0,0,0,0,0,0,36,0,0,0,0,0,19,0,0,0,0,0,0,0,0,0,0,0,0,0,0,0,0,0,0,0,0,0,0,0,0,0,0,0,35,0,0,0,0,0,0,0,167,0,0,0,0,0,0,0,0,0,0,0,0,0,0,0,0,0,0,0,0,0,0,15,0,0,0,0,0,0,0,0,0,0,0,0,0,0,0,0,0,0,0,0,38,0,0,0,0,0,0,24,0,0,0,1,0,0,0,174,0,7,0,0,0,0,0,0,0,0,0,0,6,0,0,0
"LTU_053_MZB_LO_22","LTU_053_MZB_LO_22-28.09.2016","28.09.2016",2016,9,28,0,0,0,0,0,0,0,0,0,0,0,0,0,0,0,0,0,0,0,430,0,0,0,0,0,0,0,0,0,0,0,0,0,0,0,0,0,0,0,5,0,0,0,0,0,0,7,0,0,0,0,0,7,0,10,0,0,0,0,0,0,0,0,0,0,0,2,0,0,0,0,0,0,0,0,0,1,0,0,0,0,0,0,0,0,0,0,0,7,0,263,0,5,0,0,0,0,0,0,0,0,0,0,34,0,0,0,0,0,0,0,0,0,0,0,0,0,0,0,0,0,12,0,0,0,0,0,0,0,0,0,0,0,0,0,0,0,0,14,0,0,0,0,11,32,0,1,0,0,0,0,0,0,0,0,0,0,0,0,0,2,0,0,0
"LTU_053_MZB_LO_22","LTU_053_MZB_LO_22-30.09.2019","30.09.2019",2019,9,30,0,0,0,0,0,0,0,0,0,0,0,0,0,0,0,0,0,0,0,43,0,0,0,0,0,0,0,0,0,0,1,0,0,36,0,0,0,0,0,9,0,0,0,0,0,0,23,0,0,0,0,0,22,0,0,0,0,0,0,0,0,2,0,0,0,0,0,6,0,0,0,0,0,0,0,0,0,0,0,0,0,0,0,0,0,0,3,0,28,0,0,0,0,0,0,0,0,0,0,0,0,0,0,18,0,0,17,0,0,0,0,18,0,0,0,0,0,0,0,0,0,12,0,0,0,0,0,0,0,1,0,0,21,0,0,0,0,0,0,0,0,0,0,14,0,0,0,0,0,18,0,0,0,0,0,0,0,0,0,0,8,0,0,0
"LTU_053_MZB_LO_22","LTU_053_MZB_LO_22-26.09.2022","26.09.2022",2022,9,26,0,0,0,0,0,0,0,0,0,0,0,0,0,0,0,0,6,0,0,20,0,0,0,0,0,0,0,0,0,0,0,0,0,57,0,0,0,0,0,35,0,0,0,0,0,0,11,2,0,0,0,0,58,0,0,0,0,22,0,0,0,0,0,0,0,0,0,0,0,0,0,0,0,0,0,0,0,0,0,0,0,0,0,0,0,0,0,0,7,0,0,0,11,2,0,0,0,0,0,0,0,0,0,6,0,1,0,0,0,11,0,31,0,0,0,0,0,0,0,0,0,8,0,0,0,0,0,0,0,0,0,0,0,0,0,0,0,0,0,0,0,0,0,3,25,0,0,4,0,0,0,0,0,0,0,6,0,0,0,0,13,0,0,0
"LTU_053_MZB_LO_23","LTU_053_MZB_LO_23-05.10.2010","05.10.2010",2010,10,5,0,0,0,0,0,0,0,0,0,0,0,0,0,0,0,0,257,0,0,1,0,0,8,0,0,0,3,3,0,0,0,0,0,6,0,0,0,0,0,59,0,1,0,0,0,0,0,0,0,0,0,0,0,0,0,0,0,5,0,0,0,2,0,0,4,2,0,0,0,0,0,0,0,0,0,0,0,0,0,0,12,0,0,0,3,0,0,2,1,0,0,0,1,0,0,0,0,0,0,3,0,0,0,0,0,1,29,0,0,0,0,0,0,0,0,0,0,0,0,0,0,0,0,0,7,0,0,0,0,1,0,0,5,0,0,0,0,0,0,0,0,0,0,0,0,0,15,0,1,0,0,0,0,0,0,0,0,0,0,0,0,0,0,4
"LTU_053_MZB_LO_23","LTU_053_MZB_LO_23-07.10.2013","07.10.2013",2013,10,7,0,0,0,0,0,0,0,0,0,0,0,0,0,0,0,0,63,0,0,1,0,0,0,0,0,0,21,21,0,0,0,0,0,4,0,0,1,0,0,12,0,0,0,0,0,0,0,0,0,0,0,0,0,0,0,0,0,11,0,0,0,5,0,0,14,1,0,0,0,0,1,0,0,0,0,0,0,2,0,0,0,22,0,0,9,0,0,1,2,0,0,0,13,0,0,1,0,0,0,2,0,0,0,0,0,1,6,2,0,0,0,0,0,0,0,0,0,0,0,0,0,0,0,0,1,0,0,0,0,0,0,0,15,0,0,0,0,0,0,0,0,0,0,0,0,0,0,0,2,0,0,0,0,0,0,0,0,0,0,0,0,0,0,0
"LTU_053_MZB_LO_23","LTU_053_MZB_LO_23-27.09.2016","27.09.2016",2016,9,27,0,0,0,3,0,0,0,0,0,0,0,0,0,0,0,0,5,0,0,0,0,0,10,0,0,11,1,1,0,0,0,0,0,0,0,0,0,0,0,1,0,0,0,0,0,0,0,0,0,0,0,0,0,0,0,0,0,7,0,0,0,3,0,0,3,0,0,0,0,0,0,0,0,0,0,0,0,0,0,0,0,0,0,0,0,0,0,19,18,0,0,0,6,0,0,0,0,0,0,0,0,0,0,0,0,0,10,13,0,0,0,24,0,0,0,0,0,0,0,0,0,0,0,0,5,0,0,0,0,0,0,0,7,0,0,0,0,0,0,0,0,0,0,0,0,0,0,0,0,0,0,0,0,0,0,0,0,0,0,0,0,0,0,1
"LTU_053_MZB_LO_23","LTU_053_MZB_LO_23-25.09.2019","25.09.2019",2019,9,25,0,0,58,5,0,0,0,0,0,0,0,0,0,0,0,0,347,0,0,504,0,0,148,0,0,28,21,21,0,0,28,0,0,40,0,0,22,0,0,0,0,0,0,1,0,0,0,0,0,0,0,0,6,0,0,0,0,23,0,0,0,14,0,0,86,5,0,0,0,0,0,0,0,0,0,0,1,0,0,0,0,0,0,0,18,0,0,1,16,0,0,0,115,0,0,1,0,0,0,13,0,0,1,0,0,5,0,6,0,0,0,260,0,0,0,0,0,0,0,0,0,0,0,0,254,0,0,0,0,12,0,0,43,0,0,0,0,0,0,0,0,0,0,0,0,0,13,0,0,118,0,0,0,0,0,0,0,0,0,0,0,0,0,0
"LTU_053_MZB_LO_23","LTU_053_MZB_LO_23-04.10.2022","04.10.2022",2022,10,4,0,0,0,0,0,0,0,0,0,0,0,0,0,0,0,0,17,0,0,7,0,0,1,0,0,0,4,4,0,0,0,0,0,0,0,0,4,0,0,1,0,0,0,0,0,0,0,0,0,0,0,0,0,0,0,0,0,18,0,0,0,4,0,0,0,1,0,0,0,0,1,0,0,0,0,0,0,0,0,0,5,0,0,0,0,0,0,0,0,0,0,0,3,15,0,0,0,0,0,0,0,0,0,0,0,0,0,2,0,0,0,13,0,0,0,0,0,0,0,0,0,0,0,0,0,0,0,0,0,0,0,0,0,0,0,0,0,0,0,0,0,0,0,0,0,0,0,0,0,8,0,0,0,0,0,0,0,0,0,0,5,0,0,0
"LTU_053_MZB_LO_24","LTU_053_MZB_LO_24-11.10.2010","11.10.2010",2010,10,11,0,0,0,0,0,0,0,0,0,0,0,1,0,0,0,0,6,0,0,0,0,0,0,0,0,35,3,3,0,0,0,0,0,4,0,0,0,0,0,0,0,0,0,0,0,0,0,0,0,0,0,0,0,0,2,0,0,70,0,0,0,0,0,0,0,1,0,0,0,0,0,0,4,0,0,0,0,0,0,0,0,0,5,0,0,0,0,4,5,0,0,0,0,0,0,1,0,0,0,0,0,0,0,0,0,0,0,0,0,0,0,12,0,0,0,0,0,0,0,0,0,1,0,0,9,0,0,0,4,0,1,0,0,0,0,0,0,0,0,0,0,0,0,0,0,0,1,0,0,13,0,0,0,0,0,0,0,0,0,0,0,0,17,0
"LTU_053_MZB_LO_24","LTU_053_MZB_LO_24-12.09.2011","12.09.2011",2011,9,12,0,0,0,0,0,0,0,0,0,0,0,0,0,0,0,0,0,0,0,0,0,0,7,0,0,0,1,1,0,0,0,0,0,16,0,0,0,0,0,0,0,0,0,0,0,0,0,0,0,0,0,0,0,0,0,0,0,0,0,0,0,0,0,0,0,0,0,0,1,0,0,0,2,0,0,0,0,0,0,0,0,0,0,0,0,0,0,0,0,0,0,0,0,0,0,1,0,0,0,0,0,0,0,0,0,0,0,0,0,0,0,27,0,0,0,0,0,0,0,0,0,0,0,0,0,0,0,0,0,0,0,0,0,0,0,0,0,0,0,0,0,0,0,0,0,0,3,0,0,0,0,0,0,0,0,0,0,0,0,0,0,0,0,8
"LTU_053_MZB_LO_24","LTU_053_MZB_LO_24-18.10.2012","18.10.2012",2012,10,18,0,0,0,0,0,0,0,0,0,0,0,1,0,0,0,0,0,0,0,0,0,0,13,0,0,3,0,0,0,0,0,0,0,7,0,0,0,0,0,0,0,0,0,0,0,0,0,0,0,0,6,0,2,0,2,0,0,1,0,0,0,0,0,0,0,0,0,0,0,0,0,0,0,0,0,0,0,0,0,1,0,0,0,0,0,0,0,3,0,0,0,0,0,0,0,1,0,0,0,0,0,0,0,0,0,0,0,0,0,0,0,6,0,0,0,0,0,0,0,0,0,0,0,0,0,0,0,0,0,2,0,0,0,0,0,0,0,0,0,0,0,0,0,0,0,0,0,0,0,19,0,0,0,0,0,0,0,0,0,0,0,0,2,0
"LTU_053_MZB_LO_24","LTU_053_MZB_LO_24-25.09.2013","25.09.2013",2013,9,25,0,1,0,0,0,0,0,0,0,0,0,1,0,0,0,0,0,0,0,0,0,0,12,0,0,16,7,7,0,0,0,2,0,5,0,0,0,0,0,1,0,0,0,0,0,0,0,0,2,0,9,0,0,0,1,0,0,4,0,0,0,0,0,0,0,0,0,0,0,0,0,0,0,0,0,0,0,0,0,0,0,14,0,0,0,0,0,3,6,0,0,0,8,0,0,0,0,0,0,0,0,0,0,0,0,2,0,0,0,0,0,12,0,0,0,0,0,0,0,0,0,2,0,0,4,0,1,0,0,0,0,0,3,0,0,0,0,0,0,0,0,0,0,0,0,0,4,0,0,6,0,0,0,0,0,1,0,0,0,0,1,0,0,0
"LTU_053_MZB_LO_24","LTU_053_MZB_LO_24-13.10.2014","13.10.2014",2014,10,13,10,0,7,0,0,0,0,0,0,0,0,0,0,0,7,0,0,0,0,31,0,2,10,0,4,1,25,25,0,0,0,0,0,48,0,0,0,0,0,24,0,0,0,0,0,0,0,0,0,0,0,0,0,0,16,0,0,9,0,0,0,0,0,0,0,0,0,6,3,0,0,0,0,0,0,0,0,0,0,0,7,27,0,0,0,0,0,0,0,0,0,0,5,0,0,0,0,0,3,0,0,0,0,2,0,0,0,0,0,0,0,12,0,0,0,0,0,0,0,0,0,0,0,0,17,0,0,0,0,42,0,0,14,0,0,0,0,0,0,0,0,0,0,0,6,0,0,0,0,42,0,4,0,0,0,0,0,0,0,0,0,0,9,0
"LTU_053_MZB_LO_24","LTU_053_MZB_LO_24-12.10.2015","12.10.2015",2015,10,12,0,0,0,0,0,0,0,0,0,0,29,0,0,0,0,0,0,0,6,17,0,0,6,0,21,0,0,0,0,0,0,0,0,32,0,0,0,0,0,0,0,0,0,0,0,0,0,4,0,0,0,0,0,0,67,0,0,4,0,0,0,4,0,0,0,1,0,0,0,0,0,0,0,0,0,0,5,0,0,0,34,8,0,0,0,0,0,0,8,0,0,0,0,7,0,0,0,0,0,0,3,0,0,2,0,0,260,0,0,0,0,22,0,0,0,0,0,0,0,0,0,0,0,0,0,0,0,0,0,43,0,0,12,0,0,0,0,0,8,0,0,12,0,0,0,0,0,10,0,31,0,0,0,0,0,0,0,0,0,0,9,0,0,0
"LTU_053_MZB_LO_24","LTU_053_MZB_LO_24-12.09.2016","12.09.2016",2016,9,12,0,0,0,0,0,0,0,0,0,0,0,0,0,0,0,0,0,0,0,4,0,0,4,0,7,0,0,0,0,0,0,5,0,9,0,0,0,0,0,0,0,0,0,0,0,0,0,0,0,0,29,0,0,0,22,0,0,0,0,0,0,0,0,0,0,0,0,4,1,0,0,0,4,0,0,0,0,0,0,0,19,16,0,0,0,0,0,0,0,0,0,0,12,0,0,0,0,0,0,0,0,0,0,0,0,0,0,0,0,0,0,3,0,0,0,0,0,0,0,0,0,0,0,0,0,0,0,0,0,6,0,0,0,0,0,0,0,0,0,0,0,0,0,0,5,0,3,0,0,9,0,0,0,0,0,0,0,0,0,0,0,0,0,0
"LTU_053_MZB_LO_24","LTU_053_MZB_LO_24-04.10.2017","04.10.2017",2017,10,4,0,0,7,0,0,0,0,0,0,0,8,0,0,0,2,0,0,0,0,15,0,0,9,0,0,0,7,7,0,0,9,0,0,18,0,0,0,0,0,9,0,0,0,0,0,0,0,0,0,0,6,0,2,0,0,0,0,23,0,0,0,15,0,0,64,4,0,7,1,0,0,0,0,3,0,0,0,0,0,0,0,0,0,0,0,0,0,0,0,2,0,0,1,0,0,1,0,0,0,2,0,0,0,0,0,0,0,0,0,0,0,16,0,0,0,0,0,0,0,0,0,0,0,0,29,0,0,0,0,4,0,0,4,0,0,0,0,0,0,0,0,0,0,0,0,0,0,0,0,39,0,0,0,0,0,0,0,0,0,0,0,0,4,0
"LTU_053_MZB_LO_24","LTU_053_MZB_LO_24-14.09.2020","14.09.2020",2020,9,14,0,0,8,1,0,0,0,0,0,0,0,0,0,0,36,0,71,0,2,40,0,0,3,0,0,56,8,8,0,0,6,0,0,97,0,0,0,0,0,0,0,0,0,0,0,0,0,0,0,0,112,0,4,0,0,0,0,34,0,0,0,23,0,0,0,1,0,0,0,0,0,0,4,0,0,0,0,0,0,0,0,74,0,0,0,0,0,23,0,0,0,0,18,0,0,4,0,0,0,3,0,0,0,0,0,0,0,0,0,0,0,27,0,0,0,0,1,0,0,0,8,0,0,0,114,0,0,0,0,5,0,0,9,0,0,0,0,0,0,0,0,6,0,0,0,0,0,0,0,24,0,0,0,0,0,0,0,0,0,19,0,0,0,0
"LTU_053_MZB_LO_25","LTU_053_MZB_LO_25-19.10.2010","19.10.2010",2010,10,19,0,0,0,1,0,0,0,0,0,0,0,0,0,0,0,0,2,0,0,16,0,0,0,0,0,0,0,0,0,0,0,0,1,1,0,0,0,0,0,0,0,0,0,0,0,0,0,0,0,0,0,0,10,0,0,0,0,0,0,0,0,0,0,0,3,0,0,0,0,0,0,0,0,0,0,0,0,0,0,0,7,0,0,0,0,0,0,0,0,0,0,0,0,0,0,0,0,0,0,0,0,0,0,0,0,1,0,0,0,0,0,2,0,0,0,0,0,0,0,0,0,0,0,0,0,0,0,0,0,0,0,0,0,0,0,0,0,0,0,0,0,0,0,0,0,0,0,0,0,9,0,0,0,0,0,0,0,0,0,0,0,0,0,0
"LTU_053_MZB_LO_25","LTU_053_MZB_LO_25-27.09.2012","27.09.2012",2012,9,27,0,0,0,1,0,0,0,0,0,0,0,0,0,0,0,0,0,0,0,0,0,0,38,0,0,0,0,0,0,0,0,0,0,23,0,0,1,0,0,0,0,0,0,0,0,0,0,0,0,0,0,0,0,0,0,0,0,0,0,0,0,6,0,0,0,9,0,0,0,0,0,0,0,0,0,0,0,0,0,0,0,0,0,0,0,0,0,0,0,0,0,0,0,0,0,0,0,0,0,0,0,0,0,0,0,0,0,0,0,0,0,4,0,0,0,0,0,0,0,0,0,0,2,0,0,0,0,0,0,27,0,0,0,0,0,0,0,0,0,0,0,0,0,0,0,0,0,0,0,10,0,0,0,0,0,0,0,0,0,0,0,0,0,0
"LTU_053_MZB_LO_25","LTU_053_MZB_LO_25-20.09.2016","20.09.2016",2016,9,20,0,0,0,0,0,0,0,0,0,0,0,0,0,0,17,0,47,0,6,12,0,7,10,0,0,27,0,0,0,0,0,12,0,74,0,0,0,0,0,0,0,0,0,0,0,0,0,0,0,0,43,0,8,0,36,0,0,8,0,0,0,9,0,0,65,2,0,0,0,0,0,0,8,0,0,0,0,0,0,0,0,0,0,0,0,0,0,0,0,0,0,0,0,0,0,1,0,0,0,4,0,0,0,0,0,6,0,2,0,0,0,25,0,0,0,0,0,0,0,0,3,0,0,0,19,0,0,0,0,17,0,0,0,0,0,0,0,0,0,0,0,1,0,0,0,0,14,0,0,35,0,0,0,0,0,2,0,0,0,0,3,0,0,0
"LTU_053_MZB_LO_25","LTU_053_MZB_LO_25-09.10.2019","09.10.2019",2019,10,9,42,0,0,0,0,0,0,0,0,0,0,0,0,0,0,0,324,0,0,247,0,14,25,0,0,84,0,0,0,0,0,0,0,116,0,0,0,0,0,0,0,0,0,0,0,0,0,8,0,0,0,0,7,0,127,0,0,97,0,0,0,19,0,0,196,6,0,0,0,0,0,0,0,0,0,0,15,12,0,0,0,0,0,0,0,0,0,0,0,0,36,0,9,6,0,0,0,9,0,8,0,0,0,0,0,0,0,0,0,0,0,194,0,0,0,0,0,0,0,0,0,0,0,0,60,0,1,0,0,28,0,0,0,0,0,0,0,0,11,0,22,0,0,0,0,0,4,26,0,83,0,0,0,0,0,10,0,0,0,0,5,0,0,0
"LTU_053_MZB_LO_25","LTU_053_MZB_LO_25-22.09.2022","22.09.2022",2022,9,22,0,0,13,0,0,0,0,0,0,0,3,0,0,0,0,0,116,0,0,12,0,0,0,0,0,38,0,0,0,0,2,0,0,218,0,0,0,0,0,0,0,0,0,0,0,0,0,0,0,0,0,0,1,0,0,0,0,0,0,0,0,5,0,0,24,0,0,0,0,0,0,0,1,3,0,0,0,0,0,0,0,0,0,0,0,0,0,0,18,0,0,0,3,0,0,0,0,0,0,0,0,0,0,0,0,0,0,0,0,0,0,210,0,0,0,0,0,0,0,0,1,0,0,0,0,0,0,0,0,115,0,0,0,0,0,0,0,0,0,0,0,0,0,0,0,0,20,0,0,4,0,0,0,0,0,0,0,0,0,0,0,0,0,0
"LTU_053_MZB_LO_26","LTU_053_MZB_LO_26-30.09.2010","30.09.2010",2010,9,30,0,0,0,0,0,0,0,0,0,0,0,0,0,0,0,0,7,0,0,2,0,3,6,0,0,0,0,0,0,0,0,0,0,4,0,0,0,0,0,1,0,0,0,0,0,0,0,0,0,0,0,0,4,0,10,0,0,0,1,0,0,0,0,0,0,0,0,2,0,0,1,0,0,0,0,0,0,0,0,0,0,0,0,0,1,0,0,5,1,0,0,0,14,0,0,1,1,0,0,2,0,0,0,0,0,0,0,0,0,0,0,0,0,0,0,0,0,0,0,0,0,0,0,0,1,0,0,0,0,0,2,0,0,0,0,0,2,0,0,0,0,0,0,0,0,0,1,0,0,0,0,0,0,0,0,0,0,0,0,0,0,0,0,0
"LTU_053_MZB_LO_26","LTU_053_MZB_LO_26-08.10.2013","08.10.2013",2013,10,8,0,0,0,0,0,0,0,0,0,0,0,0,0,0,0,0,26,0,0,78,0,0,1,0,0,0,0,0,0,0,0,2,0,0,0,0,30,0,0,1,0,0,0,0,0,0,0,0,0,0,0,0,19,0,0,0,0,24,0,0,1,8,0,0,13,1,0,0,0,0,0,0,1,0,0,0,0,1,0,0,0,0,0,0,1,0,0,1,1,0,0,0,2,0,0,0,0,0,0,0,0,0,0,0,0,3,0,0,0,0,0,3,0,0,0,0,0,0,0,0,0,0,0,0,2,0,3,0,0,0,1,1,1,0,0,0,0,0,0,0,0,0,0,0,0,0,0,0,0,0,0,0,0,0,0,0,0,0,0,0,0,0,0,0
"LTU_053_MZB_LO_26","LTU_053_MZB_LO_26-29.09.2016","29.09.2016",2016,9,29,0,0,0,0,0,0,0,0,0,0,0,0,0,0,0,0,22,0,0,30,0,0,20,0,0,0,12,12,0,0,0,0,0,32,0,0,7,0,1,17,0,12,0,0,0,0,0,0,0,0,0,0,1,0,0,0,0,14,0,0,0,5,0,0,27,0,0,0,0,0,1,0,9,9,0,0,0,0,0,0,0,0,0,0,0,0,0,0,0,0,0,0,44,0,0,19,0,0,0,0,0,0,0,0,0,0,0,0,0,0,0,46,0,0,0,0,0,0,0,0,0,0,0,0,19,0,1,0,0,51,0,13,31,0,0,0,0,0,0,0,0,1,1,0,0,0,0,0,0,14,0,0,0,0,0,0,0,0,0,0,0,0,0,1
"LTU_053_MZB_LO_26","LTU_053_MZB_LO_26-02.10.2019","02.10.2019",2019,10,2,0,0,0,2,0,0,0,0,0,0,0,0,2,0,0,0,5,0,0,181,0,0,24,0,0,0,0,0,0,0,0,0,0,85,0,0,29,0,1,15,0,0,0,0,0,0,0,0,0,0,0,0,1,0,0,0,0,5,0,0,0,6,0,0,9,0,0,0,0,0,0,0,8,0,0,0,0,0,0,0,0,0,4,0,0,0,0,0,0,0,0,0,5,0,0,25,0,0,0,0,0,0,0,0,0,0,0,3,0,0,0,38,0,0,0,0,0,0,0,0,0,0,0,0,0,0,2,0,0,22,0,7,14,0,0,0,0,0,0,0,0,3,0,0,0,0,4,0,0,44,0,0,0,0,0,0,0,0,0,0,0,0,0,0
"LTU_053_MZB_LO_26","LTU_053_MZB_LO_26-05.10.2022","05.10.2022",2022,10,5,0,0,0,2,0,0,0,0,0,0,1,0,0,0,0,0,15,0,0,28,0,0,9,0,0,0,1,1,0,0,0,0,0,31,0,0,0,0,0,2,0,1,0,0,0,0,0,0,0,0,0,0,3,0,0,0,0,14,0,0,0,17,0,0,9,0,0,0,0,0,0,0,2,0,0,0,0,0,0,0,0,0,0,0,0,0,0,0,0,0,0,1,2,0,0,0,0,0,0,0,0,0,0,0,0,0,0,1,0,0,0,10,0,0,0,0,0,0,0,0,0,0,0,0,3,0,0,0,1,0,4,0,4,0,0,0,0,0,0,0,0,0,0,0,0,0,0,0,0,0,0,0,0,0,0,0,0,0,0,0,0,0,0,0
"LTU_053_MZB_LO_27","LTU_053_MZB_LO_27-25.09.2010","25.09.2010",2010,9,25,0,0,0,0,0,0,0,0,0,0,0,0,0,0,0,0,9,0,0,16,0,0,4,0,0,16,0,0,0,0,0,0,0,4,0,0,1,0,0,1,0,0,0,0,0,0,0,0,0,0,0,0,1,0,0,0,0,2,0,0,0,1,0,0,4,0,0,0,1,0,0,0,0,1,0,0,0,0,0,0,0,0,0,0,2,0,0,0,0,0,0,0,1,0,0,2,0,0,0,0,0,0,0,0,0,2,0,0,0,0,0,0,0,0,0,0,0,0,0,0,0,0,0,0,0,0,0,0,0,0,2,0,0,0,0,0,0,0,0,0,0,0,0,0,0,0,1,0,0,0,0,0,0,0,0,2,0,0,0,0,0,2,0,0
"LTU_053_MZB_LO_27","LTU_053_MZB_LO_27-27.09.2011","27.09.2011",2011,9,27,0,0,0,0,0,0,0,0,0,0,0,0,0,0,0,0,1,0,0,7,0,0,15,0,0,103,8,8,0,0,0,3,0,28,0,0,5,0,0,32,0,0,0,0,0,0,0,0,0,18,0,0,3,0,35,0,0,6,0,0,0,5,0,0,7,0,0,0,0,0,1,0,0,0,0,0,5,0,0,0,47,2,0,0,0,0,0,19,8,0,0,0,5,0,0,1,0,0,0,1,0,0,0,0,0,0,0,0,0,0,0,0,0,0,1,0,0,0,0,0,0,0,0,0,0,0,1,0,0,0,0,0,29,0,0,0,0,0,0,0,0,0,0,0,0,0,0,1,1,1,0,0,0,0,0,15,0,0,0,0,3,0,0,2
"LTU_053_MZB_LO_27","LTU_053_MZB_LO_27-30.09.2015","30.09.2015",2015,9,30,0,0,0,0,0,0,0,0,0,0,0,0,2,0,0,0,2,0,0,19,0,0,3,0,0,0,0,0,0,0,0,0,0,4,0,0,4,0,0,1,0,0,0,0,0,0,0,0,0,0,0,0,0,0,0,0,0,1,0,0,0,2,0,0,1,0,0,0,3,0,0,0,0,0,0,0,0,0,0,0,0,0,0,0,1,0,0,0,1,0,0,0,0,0,0,0,0,0,0,1,0,0,0,0,0,0,0,0,0,0,0,0,0,0,0,0,0,0,0,0,0,0,0,0,4,0,0,0,0,1,4,0,1,0,0,0,0,0,0,0,0,0,0,0,0,0,1,0,0,12,0,0,0,0,0,1,0,0,0,0,0,0,0,0
"LTU_053_MZB_LO_27","LTU_053_MZB_LO_27-04.10.2018","04.10.2018",2018,10,4,0,0,0,0,0,0,0,0,0,0,0,0,0,0,0,0,0,0,0,1,0,0,0,0,0,11,1,1,0,0,0,0,0,0,0,0,0,0,0,0,0,0,0,0,0,0,0,0,0,0,2,0,0,0,0,0,0,4,0,0,0,7,0,0,0,1,0,0,1,0,0,0,1,0,0,0,0,0,0,0,0,0,0,0,0,0,0,0,0,0,0,0,0,0,0,0,0,0,0,0,0,0,0,0,0,0,0,1,0,0,0,5,0,0,0,0,0,0,0,0,0,0,0,0,0,0,2,0,0,0,0,1,0,0,0,0,0,0,0,0,0,0,1,0,0,0,0,0,0,0,0,0,0,0,0,3,0,0,0,0,0,2,0,0
"LTU_053_MZB_LO_27","LTU_053_MZB_LO_27-28.09.2021","28.09.2021",2021,9,28,0,0,0,1,0,0,0,0,0,0,0,0,0,0,0,0,1,0,0,249,0,0,0,0,0,0,0,0,0,0,4,0,0,11,0,0,28,0,0,0,0,0,0,0,0,0,0,0,0,0,0,0,1,0,1,0,0,0,0,0,0,1,0,0,13,0,0,0,0,0,0,0,0,0,0,0,0,0,0,0,0,0,1,0,0,0,0,0,0,0,0,1,1,0,0,0,0,0,0,0,0,0,0,0,0,1,0,1,0,0,0,9,0,0,0,0,0,0,0,0,2,0,0,0,0,0,0,0,0,1,0,1,0,0,0,0,0,0,0,0,0,0,0,0,0,0,0,0,0,0,0,0,0,0,0,0,0,0,1,0,0,0,0,0
"LTU_053_MZB_LO_28","LTU_053_MZB_LO_28-30.09.2010","30.09.2010",2010,9,30,0,0,0,0,0,0,0,0,0,0,0,0,0,0,0,0,0,0,0,0,0,0,0,1,0,0,0,0,0,0,0,0,0,0,0,0,0,0,0,0,0,0,0,0,0,0,0,0,0,0,0,0,0,0,0,0,0,0,0,0,0,0,0,0,0,0,0,0,0,0,0,0,0,0,0,0,0,0,0,0,0,0,0,0,0,0,0,0,0,0,0,0,3,0,0,0,0,0,0,0,0,0,0,0,0,0,0,0,0,0,0,1,0,0,0,0,0,0,0,0,0,0,0,0,0,0,0,0,0,1,0,0,0,0,0,0,0,0,0,0,0,0,0,0,0,0,0,0,0,0,0,0,0,0,0,0,0,0,0,0,0,0,0,0
"LTU_053_MZB_LO_28","LTU_053_MZB_LO_28-02.10.2013","02.10.2013",2013,10,2,0,0,0,0,0,0,0,0,0,0,0,0,0,0,0,0,0,0,6,22,0,0,0,0,0,37,0,0,0,0,0,0,0,21,0,0,0,0,0,0,0,0,0,0,0,0,20,0,0,0,0,0,0,0,0,0,0,18,0,0,0,3,0,0,0,0,0,0,0,0,23,0,0,0,0,0,41,0,0,0,49,0,0,0,6,0,0,0,27,0,0,0,17,0,0,0,0,0,0,0,0,0,0,0,0,0,8,0,0,0,0,22,0,0,0,0,0,0,0,0,0,0,0,0,0,0,0,0,0,0,0,0,0,0,0,0,0,0,0,0,0,0,0,10,13,0,0,0,0,22,0,0,0,0,0,2,0,0,0,0,0,0,0,0
"LTU_053_MZB_LO_28","LTU_053_MZB_LO_28-30.09.2015","30.09.2015",2015,9,30,0,0,0,0,0,0,0,0,0,0,0,0,0,0,28,0,0,0,0,63,0,32,12,14,0,38,1,1,5,0,0,0,0,26,0,0,0,0,0,32,0,0,0,0,0,0,19,0,0,0,0,0,3,0,0,0,0,27,0,4,0,4,0,2,0,0,0,0,1,0,0,0,0,6,0,0,15,0,0,0,23,0,0,0,0,0,0,19,0,0,13,0,0,0,0,25,0,0,0,0,0,0,0,0,0,0,0,0,0,0,0,28,0,0,1,0,0,0,0,0,0,3,0,0,24,0,4,0,0,33,0,0,0,0,0,0,0,0,0,0,0,0,0,0,0,0,0,0,0,96,0,0,0,0,0,0,0,0,0,0,38,0,0,0
"LTU_053_MZB_LO_28","LTU_053_MZB_LO_28-16.10.2018","16.10.2018",2018,10,16,0,0,0,0,0,0,0,0,0,0,16,0,0,0,7,0,0,0,10,0,0,0,0,0,0,0,4,4,0,0,0,0,0,0,0,0,0,0,0,1,0,0,0,0,0,0,0,0,0,0,0,0,0,0,1,0,0,1,0,0,0,1,0,0,0,0,0,0,0,0,0,0,0,0,0,0,0,0,0,0,9,1,0,0,15,0,0,0,11,0,2,0,4,0,0,0,0,0,0,0,1,0,0,0,0,0,0,0,0,0,0,1,0,0,0,0,0,0,0,0,0,0,0,0,0,0,0,0,0,0,0,0,6,0,0,0,0,0,0,0,0,0,0,0,0,0,0,0,0,30,0,0,0,0,0,0,0,0,0,0,0,1,0,0
"LTU_053_MZB_LO_28","LTU_053_MZB_LO_28-28.09.2021","28.09.2021",2021,9,28,0,0,0,0,0,0,0,0,0,0,0,0,0,0,8,0,0,0,0,8,0,0,0,0,0,0,12,12,12,0,4,0,0,6,0,0,1,0,0,53,0,0,0,0,0,0,27,0,0,0,0,0,0,0,36,0,0,5,0,0,0,6,0,0,0,0,0,1,0,0,5,0,0,1,0,0,8,2,0,0,67,3,0,0,0,0,0,1,3,0,0,0,6,0,0,0,0,0,0,0,1,0,0,0,0,1,0,0,0,0,0,21,0,0,0,0,0,0,0,0,0,0,0,0,0,0,1,0,0,4,3,0,0,0,0,0,0,0,0,0,0,1,0,0,0,0,0,0,0,2,0,0,0,0,0,0,0,0,0,0,1,0,0,0
"LTU_053_MZB_LO_29","LTU_053_MZB_LO_29-05.10.2010","05.10.2010",2010,10,5,0,0,0,0,0,0,0,0,0,0,0,0,0,0,0,0,5,0,0,1,0,0,2,0,0,0,5,5,0,0,0,0,0,30,0,0,0,0,0,2,0,0,0,0,0,0,0,0,0,0,0,0,10,0,3,0,0,8,0,0,0,2,0,0,0,0,0,0,0,0,0,0,0,0,0,2,0,0,0,0,0,0,0,0,0,0,0,0,8,0,0,0,10,0,0,0,0,0,0,3,0,0,0,8,0,0,0,0,0,0,0,0,0,0,0,0,0,0,0,0,0,0,0,0,0,0,1,0,0,0,0,0,0,0,0,0,0,0,0,0,0,0,0,0,0,0,2,0,0,0,0,0,0,0,0,0,0,0,0,0,0,0,0,0
"LTU_053_MZB_LO_29","LTU_053_MZB_LO_29-07.10.2013","07.10.2013",2013,10,7,0,0,0,0,0,0,0,0,0,0,0,0,0,0,0,0,0,0,0,0,0,0,6,0,0,7,0,0,0,0,0,3,0,61,0,0,2,0,0,0,0,0,0,0,0,0,0,0,0,0,0,0,1,0,8,0,0,4,0,0,0,1,0,0,0,0,0,0,2,0,0,0,0,0,0,0,0,0,0,0,0,0,0,0,5,0,0,5,5,0,0,0,1,1,0,0,0,0,0,0,0,0,0,0,0,0,0,0,0,0,0,10,0,0,0,0,0,0,0,0,0,0,0,0,0,0,0,0,0,0,3,0,0,0,0,0,0,0,16,0,0,0,0,0,0,0,0,0,1,43,0,0,0,0,0,5,0,0,0,0,1,2,0,0
"LTU_053_MZB_LO_29","LTU_053_MZB_LO_29-06.10.2015","06.10.2015",2015,10,6,0,0,0,0,0,0,0,0,0,0,0,0,0,0,0,0,21,0,0,28,0,0,1,0,0,0,0,0,0,0,0,0,0,12,0,0,6,0,0,0,0,0,0,0,0,0,0,1,0,0,0,0,0,0,0,0,0,5,0,1,0,1,0,0,1,0,0,0,0,0,0,0,0,0,0,0,0,0,0,0,0,0,0,0,0,0,0,11,0,0,0,1,0,1,0,0,0,0,0,1,0,0,0,0,0,1,2,2,0,0,0,0,0,0,0,0,0,2,0,0,0,0,0,0,0,0,0,0,0,0,1,0,0,0,0,0,0,0,0,0,0,0,0,0,0,0,2,0,0,0,0,0,0,0,0,0,0,0,0,0,0,0,0,5
"LTU_053_MZB_LO_29","LTU_053_MZB_LO_29-03.10.2018","03.10.2018",2018,10,3,0,0,0,1,0,0,0,0,0,0,0,0,0,0,0,0,140,0,0,82,0,0,30,0,0,0,0,0,0,0,16,0,0,53,0,0,11,0,1,0,0,0,0,0,0,0,0,0,0,0,0,0,6,0,0,0,0,0,0,0,0,18,0,0,168,0,0,3,1,0,0,0,1,0,0,0,0,0,0,0,0,0,0,0,0,0,0,116,50,0,0,0,1,0,0,0,0,0,0,0,0,0,0,0,0,1,1,0,0,0,0,23,0,0,1,0,0,0,0,0,0,0,0,0,1,0,0,0,0,1,1,0,0,0,0,0,0,0,0,0,0,0,0,0,0,0,3,0,0,110,0,0,0,0,0,0,0,0,0,0,0,0,0,0
"LTU_053_MZB_LO_29","LTU_053_MZB_LO_29-07.10.2021","07.10.2021",2021,10,7,0,0,0,1,0,0,0,0,0,0,0,0,0,0,0,0,22,0,0,0,0,0,4,0,0,0,13,13,0,0,0,0,0,23,0,0,11,0,0,1,0,0,0,0,0,0,0,0,0,0,0,0,1,0,3,0,0,9,0,0,0,17,0,0,12,0,0,0,1,0,0,0,0,0,0,0,0,0,0,0,0,0,0,0,0,0,0,0,6,0,0,2,19,0,0,0,0,14,0,0,0,0,0,0,0,0,0,0,0,0,0,13,0,0,0,0,0,0,0,0,1,0,0,0,0,0,0,0,0,0,3,0,1,0,0,0,0,0,0,0,0,0,0,0,0,0,1,0,0,2,0,0,0,0,0,0,0,0,0,0,0,0,0,0
"LTU_053_MZB_LO_3","LTU_053_MZB_LO_3-30.09.2010","30.09.2010",2010,9,30,0,0,0,0,0,0,0,0,0,0,0,0,0,0,0,0,45,0,0,0,0,4,5,0,0,10,9,9,0,0,0,0,0,0,0,0,0,0,0,0,0,0,0,0,0,0,0,0,0,0,0,0,0,0,1,0,0,32,0,0,0,3,0,0,14,0,0,0,0,0,0,0,0,0,0,0,0,0,0,0,17,0,0,0,0,0,0,16,0,0,0,0,2,0,0,0,0,0,0,14,0,0,0,0,0,0,7,0,0,0,0,0,0,0,0,0,0,0,0,0,0,0,0,0,1,0,0,0,0,0,0,0,4,0,0,0,0,0,0,0,0,0,0,0,0,0,15,0,1,44,0,0,0,0,0,0,0,0,0,0,1,0,0,0
"LTU_053_MZB_LO_3","LTU_053_MZB_LO_3-26.09.2013","26.09.2013",2013,9,26,0,0,0,0,0,0,0,0,0,0,0,0,0,0,0,0,18,0,0,0,0,0,1,0,0,0,0,0,0,0,0,0,0,12,0,0,0,0,0,0,0,0,0,0,0,0,0,0,0,0,0,0,0,0,0,0,0,0,0,0,0,1,0,0,42,6,0,0,0,0,0,0,0,1,0,0,0,0,0,0,0,0,0,0,0,0,0,0,0,0,0,0,0,0,0,0,0,0,0,3,0,0,0,0,0,0,0,0,0,0,0,0,1,0,0,0,0,0,0,0,0,0,0,0,0,0,0,0,0,0,0,0,0,0,0,0,0,0,0,0,0,0,0,0,0,0,6,0,1,391,0,0,0,0,0,0,0,0,0,0,0,0,0,0
"LTU_053_MZB_LO_3","LTU_053_MZB_LO_3-01.10.2015","01.10.2015",2015,10,1,0,0,0,0,1,0,0,0,0,0,0,0,0,0,0,0,201,0,0,201,0,0,2,0,0,0,2,2,0,0,0,0,0,0,0,0,0,0,0,2,0,0,0,1,0,0,0,0,0,0,0,0,24,0,0,0,0,0,0,0,0,4,0,0,18,6,0,0,0,0,0,0,0,0,0,0,0,0,1,0,0,0,0,0,0,0,0,0,0,0,0,0,0,0,0,8,0,0,0,0,0,0,0,0,0,0,0,1,0,0,0,0,0,0,0,0,0,0,0,0,0,0,0,0,2,0,0,0,0,0,0,0,0,0,0,0,0,0,0,0,0,0,0,0,0,0,13,0,0,10,0,0,0,0,0,0,0,0,0,0,0,0,0,0
"LTU_053_MZB_LO_3","LTU_053_MZB_LO_3-03.10.2019","03.10.2019",2019,10,3,0,0,0,0,0,0,0,0,0,0,0,0,0,0,0,0,15,0,0,52,0,0,13,0,0,0,2,2,0,0,12,0,0,16,0,0,10,0,0,0,0,0,0,0,0,0,0,0,0,0,0,0,0,0,0,0,0,0,0,0,0,0,0,1,49,0,0,0,0,0,0,0,2,0,0,0,0,0,0,0,3,0,0,0,0,0,0,0,0,0,0,0,6,0,0,12,0,0,0,0,0,0,0,0,0,0,0,4,0,0,0,0,0,0,0,0,0,0,0,0,0,0,0,0,1,0,0,0,0,1,0,0,8,0,0,0,0,0,0,0,0,0,0,0,0,0,1,0,0,0,0,0,0,0,0,0,0,0,0,0,0,0,0,0
"LTU_053_MZB_LO_3","LTU_053_MZB_LO_3-03.10.2022","03.10.2022",2022,10,3,0,0,0,0,0,0,0,0,0,0,0,0,0,0,0,0,98,0,0,7,0,0,6,3,0,0,0,0,0,0,2,0,0,12,0,0,16,0,0,0,0,0,0,0,0,0,0,0,0,0,0,0,3,0,0,0,0,0,0,0,0,9,0,0,126,3,0,0,0,0,0,0,0,0,0,1,0,0,0,0,4,0,0,0,0,0,0,0,0,0,0,0,0,0,0,0,0,0,0,8,0,0,0,0,0,0,0,5,0,19,0,7,0,0,0,0,0,0,0,0,0,0,0,0,19,0,0,0,0,1,3,0,0,0,0,0,0,0,0,0,0,1,0,0,0,0,0,0,3,10,0,0,0,0,0,0,0,0,0,0,0,0,0,0
"LTU_053_MZB_LO_30","LTU_053_MZB_LO_30-07.10.2010","07.10.2010",2010,10,7,0,0,0,0,0,0,0,0,0,0,0,0,0,0,0,0,0,0,0,3,0,0,0,0,0,0,2,2,0,0,0,0,0,0,0,0,0,0,0,0,0,0,0,0,0,0,0,0,0,0,0,0,6,0,0,0,0,0,0,0,0,1,0,0,0,0,0,0,0,0,0,0,0,0,0,0,0,0,0,0,0,0,0,0,2,0,0,0,0,0,0,0,1,0,0,0,0,0,0,0,0,0,0,0,0,0,0,0,0,0,0,11,0,0,0,0,0,0,0,0,0,1,0,0,0,0,0,0,0,0,0,0,0,0,0,0,0,0,0,0,0,0,0,0,0,0,0,0,0,0,0,0,0,0,0,0,0,0,0,0,7,0,0,0
"LTU_053_MZB_LO_30","LTU_053_MZB_LO_30-18.09.2013","18.09.2013",2013,9,18,0,0,0,0,0,0,0,0,0,0,0,0,0,0,0,0,0,0,18,89,0,0,0,0,0,0,0,0,0,0,0,0,0,386,0,0,0,0,0,0,0,0,0,0,0,0,38,0,0,0,0,0,0,0,44,0,0,0,0,0,0,0,0,0,0,0,0,0,0,0,0,0,0,0,0,0,80,0,0,0,198,0,0,0,7,0,0,0,0,0,0,0,0,0,0,0,0,0,0,0,0,0,0,0,0,0,0,0,0,0,0,120,0,0,0,0,0,0,0,0,0,0,0,0,0,0,0,0,0,0,0,0,51,0,0,0,0,0,0,0,0,0,0,64,0,0,0,0,0,0,0,0,0,0,0,0,0,0,0,0,0,0,0,0
"LTU_053_MZB_LO_30","LTU_053_MZB_LO_30-06.10.2015","06.10.2015",2015,10,6,0,0,0,0,0,0,0,0,0,0,0,0,0,0,0,0,0,0,0,6,0,0,153,0,0,0,12,12,0,0,0,0,0,27,0,0,0,0,0,1,0,0,0,0,0,0,0,0,0,0,0,0,8,0,0,0,0,0,0,0,0,10,0,0,0,0,0,0,10,0,13,0,6,0,0,0,44,0,0,0,0,0,0,0,0,0,0,505,0,0,0,0,2,0,0,40,0,0,0,0,0,0,0,0,0,0,0,0,0,0,0,35,0,0,0,0,0,0,0,0,0,0,0,0,38,0,7,0,0,26,5,0,8,0,0,0,0,0,0,0,0,12,0,0,0,0,4,0,0,47,0,0,0,0,0,2,0,20,0,0,0,0,0,0
"LTU_053_MZB_LO_30","LTU_053_MZB_LO_30-08.10.2018","08.10.2018",2018,10,8,0,0,0,0,0,0,0,0,0,0,0,0,0,0,0,0,0,0,18,0,0,0,7,0,0,0,0,0,0,0,0,0,0,77,0,0,0,0,10,0,0,0,0,0,0,0,12,0,0,0,0,0,0,0,107,0,0,24,0,0,0,0,0,0,0,0,0,8,0,0,18,0,0,0,0,0,55,0,0,0,234,49,0,0,0,0,0,17,0,0,0,0,0,13,0,0,0,0,0,0,0,0,0,0,0,0,44,0,0,0,0,55,0,0,0,0,0,0,0,0,0,0,0,0,0,0,0,0,0,33,0,0,48,0,0,0,0,0,0,0,0,0,0,0,0,0,0,0,0,0,0,0,0,0,0,11,0,0,0,0,22,0,0,0
"LTU_053_MZB_LO_30","LTU_053_MZB_LO_30-27.09.2021","27.09.2021",2021,9,27,0,0,0,0,0,0,0,0,0,0,0,0,0,0,0,0,0,0,1,10,0,0,0,0,1,0,6,6,0,0,3,0,0,4,0,0,0,0,0,0,0,0,0,0,0,0,3,0,0,0,0,0,0,0,57,0,0,8,0,0,0,0,0,0,0,0,0,0,0,0,4,0,0,0,0,0,18,4,0,0,124,0,0,0,0,0,0,0,8,0,2,0,0,0,0,0,0,0,0,0,2,0,0,0,0,0,0,0,0,0,0,11,0,0,0,0,0,0,0,0,0,0,0,0,0,0,0,0,0,0,0,0,0,0,0,0,0,0,1,0,0,0,0,0,0,0,0,0,0,0,0,0,0,0,0,0,0,0,0,0,0,0,0,0
"LTU_053_MZB_LO_31","LTU_053_MZB_LO_31-29.09.2010","29.09.2010",2010,9,29,0,0,0,0,0,0,0,0,0,0,0,0,0,0,67,0,22,0,5,13,0,0,0,0,0,4,9,9,0,0,0,0,0,5,0,0,0,0,0,0,0,0,0,0,0,0,4,0,0,0,0,0,0,0,116,0,0,28,0,0,0,12,0,0,81,7,0,0,0,0,2,0,0,0,0,0,10,0,0,0,16,0,0,0,0,0,0,0,2,0,0,0,0,0,0,23,0,0,0,0,0,0,0,10,0,0,1,0,0,0,0,1,0,0,0,0,0,0,0,0,0,1,0,0,51,0,0,0,0,0,0,0,0,0,0,0,0,0,0,0,0,0,0,0,0,0,0,1,0,9,0,0,0,0,0,0,0,0,0,0,0,0,0,0
"LTU_053_MZB_LO_31","LTU_053_MZB_LO_31-01.10.2013","01.10.2013",2013,10,1,0,0,0,0,0,0,0,0,0,0,0,0,0,0,0,0,0,0,9,18,0,0,0,0,26,0,6,6,0,0,0,13,0,0,0,0,0,0,0,0,0,0,0,0,0,0,0,0,0,0,0,0,0,0,32,0,0,0,0,0,0,0,0,0,0,0,0,0,1,0,0,0,0,0,0,0,0,0,0,0,18,0,0,0,0,0,0,0,0,0,0,0,0,0,0,0,0,0,0,0,0,0,0,0,0,0,0,2,0,0,0,17,0,0,2,3,0,0,0,0,0,0,0,0,0,0,0,0,0,14,0,0,0,0,0,0,0,0,0,0,0,0,0,0,0,0,4,24,0,24,0,0,0,0,0,0,0,0,0,0,19,1,0,0
"LTU_053_MZB_LO_31","LTU_053_MZB_LO_31-26.09.2016","26.09.2016",2016,9,26,0,0,0,0,0,0,0,0,0,0,0,0,0,0,8,0,4,0,1,7,0,0,1,0,0,0,2,2,0,0,0,2,0,0,0,0,0,0,0,0,0,0,0,0,0,0,1,0,0,0,0,0,0,0,1,0,0,0,0,0,0,3,0,0,12,1,0,0,1,0,0,0,0,0,0,0,1,0,0,0,9,0,0,0,0,0,0,0,0,0,0,0,0,0,0,0,0,0,0,0,0,0,0,2,0,0,0,0,0,0,0,1,0,0,0,0,0,1,0,0,0,1,0,0,16,0,0,0,0,0,0,0,0,0,0,0,0,0,0,0,0,0,0,0,0,0,0,1,0,185,0,0,0,0,0,1,0,0,0,0,0,0,0,0
"LTU_053_MZB_LO_31","LTU_053_MZB_LO_31-25.09.2019","25.09.2019",2019,9,25,0,0,0,0,0,0,0,0,0,0,0,0,0,0,13,0,5,0,8,7,0,0,0,0,8,0,8,8,0,0,3,0,0,0,0,0,0,0,0,0,0,0,0,0,0,0,0,0,0,0,0,0,9,0,0,0,0,0,0,0,0,5,0,0,15,0,0,0,0,0,3,0,0,3,0,0,12,0,0,0,7,0,0,0,6,0,0,18,0,0,0,0,0,0,0,17,0,0,0,0,0,0,0,0,0,0,6,0,0,0,0,13,0,0,0,0,0,0,0,0,0,0,0,0,13,0,0,0,0,1,0,0,0,0,0,0,0,0,0,0,0,0,0,0,0,0,0,0,0,109,0,5,0,0,0,1,0,0,0,0,3,0,0,0
"LTU_053_MZB_LO_31","LTU_053_MZB_LO_31-21.09.2022","21.09.2022",2022,9,21,0,0,0,0,0,0,0,0,0,0,0,0,0,0,1,0,0,0,8,49,0,0,3,0,2,0,1,1,0,0,0,0,0,8,0,0,0,0,0,0,0,0,0,0,0,0,0,4,0,0,0,0,0,0,0,0,0,4,0,0,0,0,0,0,17,0,0,0,1,0,4,0,0,0,0,0,0,0,0,0,15,5,0,0,0,0,0,0,9,0,0,0,0,0,0,0,0,4,0,0,0,0,0,4,0,1,0,0,0,0,0,40,0,0,0,0,0,0,0,0,1,2,0,0,0,0,0,0,0,7,0,0,8,0,0,0,0,0,0,0,0,0,0,0,0,5,0,32,0,22,0,0,0,0,0,0,0,0,0,0,0,0,0,0
"LTU_053_MZB_LO_32","LTU_053_MZB_LO_32-04.10.2010","04.10.2010",2010,10,4,0,0,0,0,0,0,0,0,0,0,0,0,0,0,62,0,9,0,6,6,0,0,0,0,9,0,5,5,0,0,0,0,0,0,0,0,0,0,0,0,0,0,0,0,0,0,0,0,0,0,0,0,0,0,5,0,0,0,0,0,0,1,0,0,0,0,0,0,2,0,0,0,0,0,0,0,9,0,0,0,91,0,0,0,0,0,0,0,0,0,0,0,0,0,0,0,0,0,0,0,0,0,0,0,0,0,0,0,0,0,0,0,0,0,0,0,0,0,0,0,0,1,0,0,0,0,1,0,0,0,0,0,0,0,0,0,0,0,0,3,0,0,0,2,0,0,0,0,0,0,0,0,0,0,0,0,0,0,0,0,0,0,0,0
"LTU_053_MZB_LO_32","LTU_053_MZB_LO_32-03.10.2011","03.10.2011",2011,10,3,0,0,0,0,0,0,0,0,0,0,0,0,0,0,57,0,1,0,0,0,0,0,1,0,2,0,14,14,0,0,0,0,0,8,0,0,0,0,0,0,0,0,0,0,0,0,0,0,0,1,0,0,0,0,2,0,0,0,0,0,0,18,0,0,0,0,0,0,1,0,0,0,0,2,0,0,0,0,0,0,8,3,0,0,0,0,0,0,0,0,0,0,0,0,0,4,0,0,0,0,0,0,0,0,0,0,0,0,0,0,0,150,0,0,0,0,0,0,0,0,0,0,0,0,0,0,3,0,0,0,1,0,0,0,0,0,0,0,0,0,0,0,0,0,0,0,0,0,0,60,0,0,0,0,0,1,0,3,0,0,0,0,0,0
"LTU_053_MZB_LO_32","LTU_053_MZB_LO_32-07.10.2013","07.10.2013",2013,10,7,0,0,0,0,0,0,0,0,0,0,0,0,0,0,3,0,0,0,0,2,0,0,1,0,4,1,11,11,0,0,0,0,0,5,0,0,0,0,0,1,0,0,0,0,0,0,0,0,0,0,0,0,0,0,7,0,0,0,0,1,0,33,0,0,0,1,0,0,1,0,0,0,1,3,0,0,1,0,0,0,13,0,0,0,0,0,0,5,0,0,0,0,2,0,0,2,0,0,0,0,0,0,0,0,0,0,0,0,0,0,0,3,0,0,0,0,0,0,0,0,0,0,0,0,0,0,0,0,0,0,1,0,0,0,0,0,0,0,0,0,0,0,0,0,0,0,0,0,0,9,0,0,0,0,0,0,0,7,0,0,0,0,0,0
"LTU_053_MZB_LO_32","LTU_053_MZB_LO_32-06.10.2014","06.10.2014",2014,10,6,0,0,0,0,0,0,0,0,0,0,0,0,0,0,50,0,7,0,4,27,0,0,74,0,41,0,20,20,0,0,0,1,0,0,0,0,0,0,0,0,0,0,0,0,0,0,0,0,0,0,0,0,0,0,2,0,0,1,0,0,0,69,0,0,0,14,0,0,2,0,0,0,0,8,0,0,24,0,0,0,43,0,2,0,0,0,0,0,0,0,0,0,1,0,0,42,0,0,0,0,0,0,0,0,0,0,0,0,0,0,0,18,0,0,1,0,0,0,0,0,0,3,0,0,0,0,0,0,0,0,0,0,0,0,0,0,0,0,0,1,0,0,0,0,0,0,0,1,0,49,0,0,0,0,0,1,0,69,0,0,0,0,0,0
"LTU_053_MZB_LO_32","LTU_053_MZB_LO_32-05.10.2015","05.10.2015",2015,10,5,0,0,0,0,0,0,0,0,0,0,0,0,0,0,28,0,4,0,1,3,0,0,3,0,19,0,3,3,0,0,0,0,0,11,0,0,0,0,0,0,0,0,0,0,0,0,0,0,0,0,0,0,0,0,4,0,0,0,0,0,0,1,0,0,0,1,0,0,0,0,0,0,1,0,0,0,2,0,0,0,6,0,0,0,0,0,0,0,0,0,0,0,0,0,0,5,0,0,0,0,0,0,0,0,0,0,0,0,0,0,0,0,0,0,1,0,0,0,0,0,0,0,0,0,0,0,1,0,0,0,0,0,0,0,0,0,0,0,1,0,0,0,0,0,0,0,0,2,0,7,0,0,0,0,0,0,0,17,0,0,0,0,0,0
"LTU_053_MZB_LO_32","LTU_053_MZB_LO_32-03.10.2016","03.10.2016",2016,10,3,0,0,0,0,0,0,0,0,0,0,0,0,0,0,60,0,31,0,1,91,0,0,5,0,21,0,27,27,0,0,0,2,0,7,0,0,0,0,0,0,0,0,0,0,0,0,0,0,0,0,0,0,0,0,3,0,0,0,0,0,0,24,0,0,0,1,0,0,0,0,0,0,0,8,0,0,0,0,0,0,37,1,0,0,1,0,0,2,0,0,0,0,0,0,0,3,0,0,0,1,0,0,0,0,0,0,0,0,0,0,0,0,0,0,1,0,0,0,0,0,0,0,0,0,0,0,2,0,0,0,0,0,0,0,0,0,0,0,0,0,0,0,0,0,0,0,0,48,0,0,0,0,0,0,0,0,0,22,0,1,0,1,0,0
"LTU_053_MZB_LO_32","LTU_053_MZB_LO_32-07.10.2019","07.10.2019",2019,10,7,0,0,0,0,0,0,0,0,0,0,0,0,2,0,17,0,1,0,0,20,0,0,13,0,36,0,23,23,0,0,0,0,0,35,0,0,0,0,0,0,0,0,0,0,0,0,0,0,0,0,0,0,0,0,0,0,0,0,0,0,0,0,0,0,0,0,0,0,0,0,0,0,0,0,0,0,0,0,0,0,37,0,0,0,0,0,0,7,0,0,0,0,5,0,42,24,0,0,8,0,0,0,0,0,0,0,0,0,0,0,0,31,0,0,0,0,0,0,0,0,0,0,0,0,0,0,1,0,0,26,0,0,0,0,0,0,0,0,0,0,0,0,0,0,0,0,0,0,0,60,0,0,0,0,0,0,0,13,0,0,0,0,0,0
"LTU_053_MZB_LO_32","LTU_053_MZB_LO_32-03.10.2022","03.10.2022",2022,10,3,0,0,0,1,0,0,0,0,0,1,1,0,1,0,0,0,22,0,0,13,0,0,10,1,0,0,9,9,0,0,1,0,0,11,0,0,16,0,0,0,0,0,0,0,0,5,0,0,0,0,0,0,2,0,0,0,0,0,0,0,0,17,0,0,0,13,0,0,0,0,0,0,0,0,0,0,0,0,0,0,0,0,3,0,0,0,0,0,0,0,0,0,0,0,0,1,0,0,0,0,0,0,0,0,0,0,0,16,0,0,0,91,0,0,0,0,0,0,0,0,0,0,0,0,3,0,2,0,0,38,3,0,0,0,0,0,0,0,0,0,0,0,0,0,0,0,25,0,4,4,0,0,0,0,0,0,0,82,0,0,0,0,0,8
"LTU_053_MZB_LO_33","LTU_053_MZB_LO_33-19.10.2010","19.10.2010",2010,10,19,0,0,0,0,0,0,0,0,0,0,0,0,0,0,0,0,26,0,0,12,0,0,0,0,0,5,0,0,0,0,0,2,0,8,0,0,0,0,0,0,0,0,0,0,0,0,0,0,0,0,2,0,1,0,0,0,0,0,0,0,0,0,0,0,2,0,1,0,0,0,0,0,0,0,0,0,0,0,0,0,0,0,0,0,0,0,0,0,0,1,0,0,23,0,0,0,0,0,0,0,0,0,0,0,0,0,0,0,0,0,0,9,0,0,0,0,0,0,0,0,0,0,0,0,0,0,0,0,0,0,1,0,1,0,0,0,0,0,0,0,0,0,0,0,0,0,0,0,0,0,0,0,0,0,0,0,0,0,0,0,1,0,0,0
"LTU_053_MZB_LO_33","LTU_053_MZB_LO_33-27.09.2012","27.09.2012",2012,9,27,0,0,0,0,0,0,0,0,0,0,0,0,0,0,0,0,14,0,0,2,0,0,6,0,0,2,0,0,0,0,2,0,0,4,0,0,1,0,0,1,0,0,0,0,0,0,0,0,0,0,0,0,2,0,0,0,0,17,0,0,0,1,0,0,0,0,0,0,0,0,0,0,6,0,0,1,0,0,0,0,0,0,0,0,0,0,0,0,0,0,0,0,2,0,0,4,0,0,0,0,0,0,0,0,0,0,0,0,0,0,0,11,0,0,0,0,0,1,0,0,0,0,3,0,13,0,0,0,0,1,2,0,0,0,0,0,0,0,0,0,0,0,0,0,0,0,0,0,0,4,0,0,0,0,0,0,0,0,0,0,0,1,1,0
"LTU_053_MZB_LO_33","LTU_053_MZB_LO_33-10.09.2015","10.09.2015",2015,9,10,0,0,0,0,0,0,0,0,0,0,0,0,0,0,23,0,0,0,4,0,0,0,6,0,0,11,0,0,0,0,0,0,0,20,0,0,0,0,0,0,0,0,0,0,0,0,0,0,0,0,0,0,0,0,12,0,0,2,0,0,0,5,0,0,14,1,0,0,0,0,4,0,0,5,0,0,0,0,0,0,5,0,0,0,0,0,0,0,4,0,0,0,12,0,0,0,0,0,0,4,0,0,0,0,0,0,0,0,0,0,0,121,0,0,0,0,0,0,0,0,0,0,0,0,0,0,0,0,0,18,0,0,14,12,0,0,0,0,0,0,0,0,0,5,0,0,0,0,0,19,0,0,0,0,0,0,0,0,0,0,0,6,0,0
"LTU_053_MZB_LO_33","LTU_053_MZB_LO_33-24.09.2018","24.09.2018",2018,9,24,0,0,0,0,0,0,0,0,0,0,0,0,0,0,0,0,0,0,25,0,0,0,0,0,0,7,5,5,0,0,0,4,0,86,0,0,0,0,0,0,0,0,0,0,0,0,0,0,0,0,0,0,0,0,0,0,0,0,0,0,0,0,0,0,0,0,0,0,0,0,0,0,1,0,0,0,0,0,0,0,17,0,0,0,0,0,0,0,0,0,0,0,0,0,0,0,0,0,0,0,0,0,0,0,0,0,0,0,0,0,0,1,0,0,0,0,0,0,0,0,0,0,0,0,0,0,0,0,0,0,0,0,4,0,0,0,0,0,0,0,0,1,0,0,0,0,0,0,0,30,0,0,0,0,0,3,0,0,0,0,0,0,0,0
"LTU_053_MZB_LO_33","LTU_053_MZB_LO_33-21.09.2021","21.09.2021",2021,9,21,0,0,0,0,0,0,0,0,0,0,0,0,0,0,0,0,50,0,0,12,0,0,0,0,0,0,0,0,0,0,1,0,0,20,0,0,5,0,0,0,0,0,0,0,0,1,0,0,0,0,0,0,4,0,0,0,0,0,0,0,0,6,0,0,69,2,0,0,0,0,0,0,0,5,0,4,0,0,0,0,14,0,0,0,0,0,0,0,0,0,0,0,3,0,0,0,0,0,0,0,0,0,0,0,0,0,0,1,0,0,0,32,0,0,0,0,0,0,0,0,0,0,0,0,0,0,0,0,0,1,3,0,6,0,0,0,0,0,0,0,0,0,0,0,1,0,3,7,0,21,0,0,0,0,0,0,0,0,0,0,2,0,0,0
"LTU_053_MZB_LO_34","LTU_053_MZB_LO_34-06.10.2010","06.10.2010",2010,10,6,0,0,0,2,0,0,0,0,0,0,0,0,0,0,0,0,32,0,0,1,0,0,6,0,0,0,0,0,0,0,0,0,0,0,0,0,2,0,0,1,0,0,0,0,0,0,0,0,0,0,0,0,0,0,0,0,0,0,0,0,0,17,0,0,1,2,0,0,0,0,0,0,0,2,0,0,0,0,0,0,2,0,0,0,0,0,0,2,0,0,0,0,3,0,0,2,0,0,0,0,0,0,0,0,0,1,0,0,0,0,0,9,0,0,0,0,0,0,0,0,0,0,0,0,2,0,1,0,0,4,1,0,0,0,0,0,0,0,0,0,0,0,0,0,0,0,0,0,0,4,0,0,0,0,0,0,0,0,0,0,0,0,0,0
"LTU_053_MZB_LO_34","LTU_053_MZB_LO_34-24.09.2013","24.09.2013",2013,9,24,0,0,0,0,0,0,0,0,0,0,0,0,0,0,0,0,6,0,0,23,0,0,15,23,0,16,0,0,0,0,0,0,0,22,0,0,0,0,0,0,0,0,0,0,0,0,0,0,0,0,0,0,0,0,0,0,0,0,0,0,0,6,0,0,9,0,0,0,1,0,6,0,0,0,0,0,0,0,0,0,0,26,0,0,0,0,0,0,0,0,0,0,0,0,0,0,0,0,15,15,11,0,0,0,0,0,0,0,0,0,0,0,0,0,0,0,0,0,0,0,0,0,0,0,0,0,0,0,0,19,3,0,0,0,0,0,0,0,0,0,0,0,0,0,0,0,4,0,0,25,0,0,0,0,0,0,0,11,0,0,0,0,0,0
"LTU_053_MZB_LO_34","LTU_053_MZB_LO_34-03.10.2016","03.10.2016",2016,10,3,0,0,0,0,0,0,0,0,0,0,0,0,0,0,0,0,9,0,0,48,0,0,37,0,0,0,0,0,0,0,0,0,0,43,0,0,24,0,4,0,0,13,0,0,0,0,0,0,0,8,0,0,0,0,0,0,0,0,0,0,0,7,0,0,6,7,0,0,0,0,0,0,0,5,0,0,0,0,0,0,7,0,0,0,0,0,0,20,0,0,0,0,13,0,0,32,0,0,0,0,0,0,0,0,0,5,0,0,0,0,0,22,0,0,0,0,0,0,0,0,0,0,0,0,20,0,0,0,0,53,6,0,10,0,0,0,0,0,0,0,0,0,0,0,0,0,8,0,0,0,0,0,0,0,0,0,0,0,0,0,0,0,0,0
"LTU_053_MZB_LO_34","LTU_053_MZB_LO_34-01.10.2019","01.10.2019",2019,10,1,0,0,0,0,0,0,0,1,0,0,1,0,0,0,0,0,23,0,0,13,0,0,16,0,0,16,0,0,0,0,0,0,0,27,0,0,6,0,0,0,0,0,0,0,0,0,0,0,0,9,0,0,0,0,18,0,0,0,0,0,3,0,0,0,12,0,0,0,0,0,0,0,0,4,0,0,0,0,0,0,0,0,0,0,0,0,0,0,0,0,0,0,13,0,0,34,0,0,0,6,0,0,0,0,0,0,0,0,0,0,0,54,0,0,0,0,0,0,0,0,0,0,0,0,18,0,1,0,0,56,0,1,0,0,0,0,0,0,0,0,0,6,0,0,0,0,0,0,0,0,0,0,0,0,0,0,0,0,0,0,0,0,0,0
"LTU_053_MZB_LO_34","LTU_053_MZB_LO_34-21.09.2022","21.09.2022",2022,9,21,0,0,0,0,0,0,0,0,0,0,2,0,0,0,0,0,18,0,0,0,0,0,7,0,0,0,4,4,0,0,0,0,0,0,0,0,0,0,0,0,0,4,0,0,0,1,0,0,0,5,0,0,0,0,0,0,0,7,0,0,0,4,0,0,118,0,0,0,0,0,0,0,0,0,0,0,0,0,0,0,0,0,0,0,0,0,0,0,0,0,0,0,0,0,0,3,0,0,0,3,1,0,0,0,0,0,0,0,0,0,0,9,0,0,0,0,0,0,0,0,0,0,1,0,0,0,0,0,1,18,0,0,1,0,0,0,0,0,0,0,0,0,0,0,0,0,0,0,0,1,0,0,0,0,0,0,0,0,0,0,0,0,0,0
"LTU_053_MZB_LO_35","LTU_053_MZB_LO_35-01.10.2010","01.10.2010",2010,10,1,0,0,0,0,0,0,0,0,0,0,0,0,0,0,0,0,11,0,16,27,0,0,0,0,0,0,0,0,0,0,0,0,0,0,0,0,0,0,0,0,0,0,0,0,0,0,16,0,0,0,0,0,0,0,18,0,0,24,0,0,0,0,0,0,0,0,1,0,4,0,16,0,0,0,0,0,19,0,0,0,22,0,0,0,0,0,7,0,18,0,0,0,0,0,0,0,0,0,0,0,0,0,0,0,0,25,0,0,0,0,0,17,0,0,0,0,0,0,0,0,0,0,0,0,0,0,0,0,0,0,0,0,0,0,0,0,0,0,0,0,0,0,0,0,0,0,0,0,0,0,0,0,0,0,0,8,0,0,0,0,11,0,0,0
"LTU_053_MZB_LO_35","LTU_053_MZB_LO_35-11.10.2013","11.10.2013",2013,10,11,0,0,0,0,0,0,0,0,0,0,0,0,0,0,0,0,0,0,12,0,0,0,28,16,19,0,0,0,0,0,0,0,0,22,0,0,0,0,0,0,0,0,0,0,0,0,6,0,0,0,0,0,9,0,55,0,0,20,0,0,0,3,0,0,0,0,0,0,1,0,0,0,0,0,0,0,14,0,0,0,0,0,0,0,0,0,0,0,24,0,0,0,0,0,0,44,0,0,0,0,4,0,0,0,0,0,15,0,0,0,0,40,0,0,0,0,0,0,0,0,0,0,0,0,0,0,0,0,0,0,0,0,0,0,0,0,0,0,0,0,0,5,0,0,0,0,0,36,0,238,0,0,0,0,0,8,0,0,0,0,14,0,0,0
"LTU_053_MZB_LO_35","LTU_053_MZB_LO_35-28.09.2015","28.09.2015",2015,9,28,0,0,0,0,0,0,0,0,0,0,0,0,0,0,1,0,9,0,0,1,0,0,0,2,0,0,8,8,0,0,0,0,0,0,0,0,0,0,0,0,0,0,0,0,0,0,0,0,0,0,0,0,1,0,0,0,0,2,0,0,0,3,0,0,5,0,0,0,1,0,0,0,0,1,0,0,0,0,0,0,0,0,0,0,0,0,0,0,0,0,0,0,3,0,0,2,0,0,0,0,0,0,0,0,0,1,0,0,0,0,0,4,0,0,0,0,0,0,0,0,0,0,0,0,0,0,0,0,0,0,6,0,0,0,0,0,0,0,0,0,0,0,0,0,0,0,0,0,0,11,0,0,0,0,0,0,0,0,0,0,0,0,0,0
"LTU_053_MZB_LO_35","LTU_053_MZB_LO_35-09.10.2019","09.10.2019",2019,10,9,0,0,0,0,0,0,0,0,0,0,0,0,0,0,11,0,0,0,7,1,0,0,15,28,22,0,6,6,0,0,0,0,0,1,0,0,2,0,0,0,0,0,0,0,0,0,0,0,0,0,0,0,1,0,0,0,0,2,0,0,0,12,0,0,0,0,0,0,0,0,2,0,0,0,0,0,1,0,0,0,22,17,0,0,1,0,0,0,0,0,0,0,0,0,0,17,0,0,0,0,1,0,0,1,0,0,0,0,0,0,0,24,0,0,0,0,0,0,0,0,0,1,0,0,0,0,0,0,0,0,0,0,0,0,0,0,0,0,0,0,0,0,0,0,0,0,0,0,0,0,0,0,0,0,0,0,14,0,0,0,6,0,0,0
"LTU_053_MZB_LO_35","LTU_053_MZB_LO_35-03.10.2022","03.10.2022",2022,10,3,0,0,0,0,0,0,0,0,0,0,0,0,0,0,14,0,0,0,3,0,0,0,8,0,6,4,0,0,0,0,0,0,0,12,0,0,0,0,0,0,0,0,0,0,0,0,0,0,0,4,0,0,0,0,0,0,0,8,0,0,0,0,0,0,0,0,0,0,0,0,0,0,0,0,0,0,23,1,0,0,40,0,0,0,0,0,0,0,0,0,0,0,5,0,0,0,0,0,0,0,0,0,0,0,0,0,0,0,14,0,0,16,0,0,0,0,0,0,0,0,0,0,0,0,0,0,0,0,0,0,0,0,0,0,0,0,0,0,0,0,0,0,0,0,0,0,0,8,0,2,0,0,0,0,0,0,0,0,0,0,0,0,0,0
"LTU_053_MZB_LO_36","LTU_053_MZB_LO_36-13.10.2010","13.10.2010",2010,10,13,0,0,0,0,0,0,0,0,0,0,0,0,0,0,0,0,35,0,0,0,0,0,0,0,0,0,0,0,0,0,0,0,0,78,0,0,0,0,0,0,0,0,0,0,0,0,0,0,0,0,0,0,0,0,38,0,0,0,0,0,0,0,0,0,45,0,0,0,0,0,0,0,0,0,0,0,0,0,0,0,292,0,0,0,0,0,0,0,0,0,0,0,0,0,0,0,0,0,0,0,0,0,0,0,0,0,0,0,0,0,0,33,0,0,0,0,0,0,0,0,0,0,0,0,0,0,0,0,0,0,0,0,0,0,0,0,0,0,0,0,0,0,0,0,0,0,0,0,0,29,0,0,0,0,0,0,0,0,0,0,7,0,0,0
"LTU_053_MZB_LO_36","LTU_053_MZB_LO_36-24.09.2013","24.09.2013",2013,9,24,0,0,0,0,0,0,0,0,0,0,0,0,0,0,0,0,37,0,19,33,0,0,28,0,0,0,0,0,0,0,0,0,0,171,0,0,0,0,0,0,0,0,0,0,0,0,0,0,0,0,0,0,0,0,0,0,0,0,0,0,0,14,0,0,25,0,0,0,0,0,0,0,0,38,0,0,51,0,0,0,48,0,0,0,0,0,0,0,2,0,0,0,0,0,0,0,0,0,0,0,0,0,0,0,0,0,0,0,0,0,0,195,0,0,0,0,0,0,0,0,0,0,0,0,0,0,0,0,0,30,0,0,31,0,0,0,0,0,0,0,0,0,0,0,0,0,0,63,0,60,0,0,0,0,0,15,0,0,0,0,18,2,0,0
"LTU_053_MZB_LO_36","LTU_053_MZB_LO_36-01.10.2015","01.10.2015",2015,10,1,0,0,0,0,0,0,0,0,0,0,0,0,0,0,0,0,28,0,6,6,0,0,18,0,0,0,0,0,0,0,0,0,0,63,0,0,0,0,0,0,0,8,0,6,0,0,33,0,0,0,0,0,0,0,97,0,0,0,0,0,0,22,0,6,25,0,0,0,0,0,0,0,0,17,0,0,22,0,0,0,8,0,0,0,0,0,0,16,66,0,0,0,5,0,0,51,0,0,0,0,21,0,0,0,0,1,0,0,0,0,0,60,0,0,0,0,0,0,0,0,0,0,0,0,0,0,8,0,0,30,0,0,9,0,0,0,0,0,0,0,0,0,0,0,0,0,8,15,0,69,0,0,0,0,0,0,0,0,0,0,37,0,0,0
"LTU_053_MZB_LO_36","LTU_053_MZB_LO_36-10.10.2018","10.10.2018",2018,10,10,0,0,0,0,0,0,0,0,0,0,5,0,0,0,1,0,0,0,12,1,0,0,10,0,0,29,1,1,0,0,0,0,0,25,0,0,0,0,3,0,0,0,0,0,0,0,0,0,0,0,0,0,0,0,26,0,0,21,0,0,0,0,0,0,11,0,0,0,1,0,0,0,0,0,0,0,0,0,0,0,7,1,0,0,0,0,0,0,0,0,0,0,5,0,0,0,0,0,3,0,0,0,0,0,0,0,0,0,0,0,0,16,0,0,0,0,0,0,0,0,0,0,0,0,0,0,0,0,0,0,0,0,1,0,0,0,0,0,0,0,0,0,0,0,0,0,6,0,0,0,0,0,0,0,0,6,0,0,0,0,0,0,0,0
"LTU_053_MZB_LO_36","LTU_053_MZB_LO_36-21.09.2021","21.09.2021",2021,9,21,0,0,0,0,0,0,0,0,0,0,0,0,0,0,15,0,0,0,2,8,0,0,12,0,0,2,0,0,0,0,0,0,0,15,0,0,0,0,0,0,0,6,0,0,0,0,5,0,0,0,0,0,4,0,106,0,0,15,0,0,0,3,0,0,13,0,0,0,2,0,0,0,0,0,0,0,0,0,0,0,18,0,0,0,0,0,0,12,9,0,0,0,3,0,0,0,0,0,0,0,0,0,0,0,0,0,1,0,0,0,0,21,0,0,0,0,0,0,0,0,0,0,0,0,0,0,0,0,0,0,0,0,18,0,0,0,0,0,0,0,0,1,0,0,0,0,0,3,0,4,0,0,0,0,0,13,0,0,0,0,1,0,0,0
"LTU_053_MZB_LO_37","LTU_053_MZB_LO_37-06.10.2010","06.10.2010",2010,10,6,0,0,0,0,0,0,0,0,0,0,0,0,0,0,0,0,57,0,0,64,0,0,9,0,0,0,0,0,0,0,0,0,0,0,0,0,8,0,0,2,0,0,0,0,0,0,0,0,0,0,0,0,0,0,0,0,0,0,0,0,0,3,0,0,11,0,0,0,0,0,0,0,1,4,0,1,0,0,0,0,0,0,0,0,0,0,0,0,0,0,0,0,0,0,0,0,0,0,0,0,0,0,0,0,0,0,0,0,0,0,0,0,0,0,0,0,0,0,0,0,0,0,0,0,0,0,0,0,0,0,9,0,4,0,0,0,0,0,0,0,0,0,0,0,0,0,0,0,0,0,0,0,0,0,0,0,0,0,0,0,0,0,0,0
"LTU_053_MZB_LO_37","LTU_053_MZB_LO_37-24.09.2013","24.09.2013",2013,9,24,0,0,0,0,0,0,0,0,0,0,0,0,0,0,0,0,18,0,0,19,0,0,9,0,8,31,0,0,0,0,0,0,0,13,0,0,0,0,0,0,0,0,0,0,0,0,0,0,0,0,0,0,0,0,0,0,0,3,0,0,0,5,0,0,1,0,0,0,0,0,1,0,0,0,0,0,0,0,0,0,0,0,0,0,0,0,0,0,0,0,0,0,1,0,0,0,0,0,0,7,0,0,0,0,0,0,0,0,0,0,0,0,0,0,0,0,0,0,0,0,0,0,0,0,0,0,0,0,0,6,0,0,0,0,0,0,0,0,0,0,0,0,0,0,0,0,16,0,0,6,0,0,0,0,0,0,0,8,0,0,0,0,0,6
"LTU_053_MZB_LO_37","LTU_053_MZB_LO_37-03.10.2016","03.10.2016",2016,10,3,0,0,0,1,0,0,0,0,0,0,0,0,0,0,0,0,118,0,0,0,0,0,66,0,0,0,0,0,0,0,0,0,0,151,0,0,7,0,0,1,0,0,0,0,0,0,0,0,0,0,0,1,8,0,0,0,0,3,0,0,0,2,0,0,24,1,0,0,1,0,0,0,0,4,0,0,0,0,0,0,0,0,0,0,0,0,0,1,0,0,0,0,0,0,0,11,0,0,0,8,0,0,0,0,0,0,0,0,0,0,0,0,0,0,0,0,0,0,0,0,0,0,0,0,1,0,0,0,0,0,0,0,1,0,0,0,0,0,0,0,0,0,0,0,0,0,1,0,0,0,0,0,0,0,0,0,0,1,0,0,0,0,0,10
"LTU_053_MZB_LO_37","LTU_053_MZB_LO_37-03.10.2019","03.10.2019",2019,10,3,0,0,0,2,0,0,0,13,0,0,6,0,0,0,0,0,5,0,0,14,0,0,17,19,0,21,0,0,0,0,8,0,0,29,0,0,8,0,0,0,0,0,0,0,0,0,0,0,0,0,0,0,4,0,0,0,0,3,0,0,0,9,0,0,1,0,0,0,0,0,0,0,0,0,0,0,0,0,0,0,0,0,0,0,0,0,0,59,0,0,0,0,2,0,0,23,0,0,0,1,0,0,0,0,0,0,0,0,0,0,0,52,0,0,0,0,0,1,7,0,7,0,0,0,0,0,3,0,0,26,18,1,0,0,0,0,0,0,0,0,0,5,0,0,0,0,0,0,0,45,0,0,0,0,0,0,0,3,0,0,0,1,0,8
"LTU_053_MZB_LO_37","LTU_053_MZB_LO_37-03.10.2022","03.10.2022",2022,10,3,0,0,0,0,0,0,0,0,0,0,0,0,10,0,0,0,0,0,0,0,0,0,33,0,0,0,5,5,0,0,0,0,0,27,0,0,1,0,0,0,0,0,0,0,0,0,0,0,0,0,0,0,1,0,0,0,0,49,0,0,0,4,0,0,5,0,0,0,0,0,0,0,0,0,0,0,0,0,0,0,0,0,0,0,0,0,0,0,0,0,0,0,5,0,0,0,0,0,0,4,0,0,0,0,0,0,0,0,0,0,0,16,0,0,0,0,0,0,0,0,2,0,0,0,0,0,0,0,0,7,7,0,0,0,0,0,0,0,0,0,0,7,0,0,0,0,0,0,0,17,0,0,0,0,0,0,0,7,0,0,0,8,0,3
"LTU_053_MZB_LO_38","LTU_053_MZB_LO_38-06.10.2010","06.10.2010",2010,10,6,0,0,0,0,0,0,0,0,0,0,0,0,0,0,0,0,0,0,0,1,0,0,2,0,0,0,15,15,0,0,0,0,0,0,0,0,5,0,0,3,0,0,0,0,0,0,0,0,0,0,0,0,0,0,0,0,0,18,1,0,0,1,0,0,17,0,0,0,0,0,0,0,0,0,0,0,0,0,0,0,1,0,0,0,1,0,0,0,6,0,0,0,1,0,0,0,0,0,0,0,0,0,0,0,0,0,0,0,0,0,0,5,0,0,0,0,0,0,0,0,0,0,0,0,0,0,0,0,0,0,16,0,2,0,0,0,0,0,0,0,0,0,0,0,0,1,0,0,0,0,0,0,0,0,0,0,0,0,0,0,0,0,0,0
"LTU_053_MZB_LO_38","LTU_053_MZB_LO_38-24.09.2013","24.09.2013",2013,9,24,0,0,0,0,0,0,0,0,0,0,0,0,0,0,0,0,4,0,0,0,0,0,5,0,4,0,18,18,0,0,0,2,0,6,0,0,2,0,0,0,0,0,0,0,0,0,0,0,0,0,0,0,0,0,2,0,0,43,0,0,0,0,0,0,43,0,0,0,0,0,1,0,0,0,0,1,0,0,0,0,0,3,0,0,4,0,0,4,4,0,0,2,2,0,0,2,0,2,0,3,0,0,0,0,0,0,3,0,0,0,0,0,0,0,0,0,0,0,0,0,0,0,0,0,0,0,0,0,0,0,3,0,0,0,0,0,0,0,0,0,0,0,0,0,0,3,20,0,2,21,0,0,0,0,0,0,0,14,0,0,0,0,0,1
"LTU_053_MZB_LO_38","LTU_053_MZB_LO_38-01.10.2015","01.10.2015",2015,10,1,0,0,0,2,0,0,0,0,0,0,0,0,1,0,0,0,8,0,0,1,0,0,4,0,0,0,3,3,0,0,0,2,0,29,0,0,1,0,0,3,0,0,0,0,0,0,0,0,0,0,0,0,0,0,9,0,0,10,0,0,0,3,0,0,18,0,0,0,0,0,0,0,0,0,0,0,0,2,0,0,0,0,0,0,1,0,0,1,12,0,0,1,1,0,0,2,0,3,0,1,0,0,0,0,0,1,0,2,0,0,0,0,0,0,0,0,0,0,0,0,0,0,0,0,0,0,0,0,0,0,2,0,2,0,0,0,0,0,0,0,0,0,0,0,0,2,42,0,1,19,0,0,0,0,0,0,0,3,0,0,0,1,0,1
"LTU_053_MZB_LO_38","LTU_053_MZB_LO_38-01.10.2019","01.10.2019",2019,10,1,0,0,0,0,0,0,0,0,0,0,0,0,0,0,0,0,5,0,0,0,0,0,18,0,0,1,3,3,0,0,0,0,0,33,0,0,14,0,0,10,0,0,0,0,0,0,0,0,0,0,0,0,0,0,0,0,0,6,0,0,0,0,0,0,16,0,0,0,0,0,0,0,0,0,0,0,0,0,0,0,0,0,0,0,0,0,0,0,0,0,0,0,31,0,0,12,0,0,0,0,0,0,0,0,0,0,5,7,0,0,0,10,0,0,0,0,0,0,0,0,0,0,0,0,7,0,0,0,0,13,3,0,0,0,0,0,0,0,0,0,0,0,0,0,0,0,7,0,0,42,0,0,0,0,0,0,0,0,0,0,0,0,0,0
"LTU_053_MZB_LO_38","LTU_053_MZB_LO_38-21.09.2022","21.09.2022",2022,9,21,0,0,3,0,0,0,0,0,0,0,3,0,0,0,0,0,1,0,0,5,0,0,13,0,6,3,7,7,0,0,0,0,0,85,0,0,4,0,0,18,0,0,0,0,0,0,0,2,0,0,0,0,0,0,0,0,0,37,0,0,0,0,0,0,12,0,0,0,0,0,2,0,0,0,0,2,0,0,0,0,0,0,0,0,0,0,0,0,9,0,0,0,6,0,0,0,0,2,0,4,0,0,0,0,0,0,1,4,0,0,0,43,0,0,0,0,0,0,0,0,0,0,0,0,0,0,0,0,0,1,12,0,4,0,0,0,0,0,0,0,0,0,0,0,0,0,19,0,0,22,0,0,0,0,0,0,0,0,0,0,0,0,0,0
"LTU_053_MZB_LO_39","LTU_053_MZB_LO_39-05.10.2010","05.10.2010",2010,10,5,0,0,0,0,0,0,0,0,0,0,0,0,1,0,0,0,19,0,0,1,0,1,3,0,0,0,0,0,0,0,0,0,0,0,0,0,2,0,0,39,0,0,0,0,0,0,0,0,0,0,0,0,1,0,0,0,0,13,0,0,0,5,0,0,3,1,0,0,0,0,0,0,0,0,0,0,0,0,0,0,0,0,0,0,0,0,0,0,10,0,0,0,2,0,0,4,0,0,0,12,0,0,0,0,0,0,15,0,0,0,0,0,0,0,0,0,0,0,0,0,0,0,0,0,1,0,0,0,0,0,5,0,0,0,0,0,0,0,0,0,0,0,0,0,0,2,2,0,0,4,0,0,0,1,0,0,0,0,0,0,0,5,0,1
"LTU_053_MZB_LO_39","LTU_053_MZB_LO_39-07.10.2013","07.10.2013",2013,10,7,0,0,0,1,0,0,0,0,0,0,0,0,0,0,0,0,9,0,0,9,0,0,12,0,0,0,0,0,0,0,0,0,0,5,0,0,5,0,0,4,0,0,0,0,0,0,0,0,0,0,0,0,3,0,0,0,0,1,0,0,4,1,0,0,0,1,0,0,0,0,2,0,0,0,0,0,0,1,0,0,0,0,0,0,0,0,0,1,6,0,0,0,7,0,0,0,0,0,0,2,0,0,0,0,0,2,0,1,0,0,0,4,0,0,0,0,0,0,0,0,0,0,0,0,1,0,1,0,0,1,0,0,0,0,0,0,0,0,0,0,0,0,1,0,0,0,18,0,0,0,0,0,0,0,0,0,0,0,0,0,0,0,1,0
"LTU_053_MZB_LO_39","LTU_053_MZB_LO_39-06.10.2015","06.10.2015",2015,10,6,0,0,0,2,0,0,0,0,0,0,0,0,0,0,0,0,10,0,0,11,0,3,2,0,0,0,1,1,0,0,0,2,0,49,0,0,2,0,0,9,0,0,0,0,0,0,0,0,0,0,0,0,3,0,0,0,0,8,1,0,1,3,0,0,0,0,0,0,0,0,0,0,0,0,0,0,0,0,0,0,0,0,0,0,4,0,0,1,32,0,0,0,14,1,0,0,0,0,0,1,0,0,0,0,0,0,0,2,0,0,0,0,0,0,0,0,0,0,0,0,0,0,0,0,2,0,0,0,0,1,7,0,3,0,0,0,0,0,0,0,0,0,0,0,0,6,1,0,0,1,0,0,0,0,0,0,0,0,0,0,0,4,0,0
"LTU_053_MZB_LO_39","LTU_053_MZB_LO_39-03.10.2018","03.10.2018",2018,10,3,0,0,0,0,0,0,0,0,0,0,0,0,0,0,0,0,5,0,0,7,0,0,0,0,0,0,1,1,0,0,0,0,0,4,0,0,10,0,0,2,0,0,0,0,0,0,0,0,0,0,0,0,0,0,0,0,0,18,0,0,0,0,0,0,0,0,0,0,2,0,1,0,0,0,0,0,0,0,0,0,0,0,0,0,0,0,0,0,3,0,0,0,0,0,0,0,0,0,0,0,0,0,0,0,0,3,0,3,0,0,0,0,0,0,0,0,0,0,0,0,0,0,0,0,0,0,0,0,0,0,0,0,0,0,0,0,0,0,0,0,0,0,0,0,0,1,0,0,0,0,0,0,0,2,0,1,0,0,0,0,0,5,0,0
"LTU_053_MZB_LO_39","LTU_053_MZB_LO_39-06.10.2021","06.10.2021",2021,10,6,0,0,0,1,0,0,0,0,0,0,2,0,0,0,0,0,4,0,0,70,0,0,2,0,0,1,7,7,0,0,3,0,0,33,0,0,3,0,0,5,0,0,0,0,0,0,0,0,0,0,0,0,2,0,4,0,0,2,0,0,0,3,0,0,0,0,0,0,0,0,0,0,1,0,0,0,0,0,0,0,0,1,0,0,0,0,0,4,0,0,0,0,33,0,0,0,0,0,0,0,0,0,0,0,0,0,0,3,0,0,0,9,0,0,0,0,0,0,0,0,0,0,0,0,0,0,0,0,0,3,15,0,1,0,0,0,0,0,0,0,0,0,0,0,0,0,1,0,0,11,0,0,0,0,0,0,0,0,0,0,0,0,0,0
"LTU_053_MZB_LO_4","LTU_053_MZB_LO_4-27.09.2010","27.09.2010",2010,9,27,0,0,0,0,0,0,0,0,0,0,0,0,0,0,0,0,0,0,0,42,0,0,26,0,0,0,0,0,0,0,0,0,0,24,0,0,2,0,0,1,0,0,0,0,0,0,0,0,0,0,0,0,0,0,0,0,0,0,0,0,0,3,0,0,4,0,0,0,0,0,0,0,0,0,0,0,0,0,0,0,0,0,0,0,0,0,0,0,0,0,0,0,0,0,0,0,0,0,0,0,0,0,0,0,0,0,0,0,0,0,0,31,0,0,0,0,0,0,0,0,0,0,0,0,0,0,1,0,0,25,0,0,0,0,0,0,0,0,0,0,0,0,0,0,0,0,0,33,0,0,0,0,0,0,0,0,0,0,0,0,0,0,0,6
"LTU_053_MZB_LO_4","LTU_053_MZB_LO_4-27.09.2011","27.09.2011",2011,9,27,0,0,0,0,0,0,0,0,0,0,0,0,0,0,0,0,1,0,0,1201,0,0,18,0,0,0,0,0,0,0,0,1,0,14,0,0,64,0,0,160,0,0,0,2,0,0,0,0,0,0,0,0,60,0,0,0,0,0,0,0,0,19,0,0,2,1,0,0,0,0,0,0,0,0,0,0,0,0,0,0,0,0,1,0,0,0,0,0,0,0,0,1,7,0,0,5,0,0,0,0,0,0,0,0,0,0,0,1,0,0,0,0,0,0,0,0,0,0,0,0,0,0,0,0,40,0,4,0,0,0,0,0,1,0,0,0,0,0,0,0,0,0,0,0,0,0,0,0,0,0,0,0,0,0,0,0,0,0,0,0,0,0,0,0
"LTU_053_MZB_LO_4","LTU_053_MZB_LO_4-26.09.2012","26.09.2012",2012,9,26,0,0,0,0,0,0,0,0,0,0,0,0,0,0,0,0,82,0,0,304,0,0,1,0,0,13,14,14,0,0,0,0,0,17,0,0,7,0,0,224,0,0,0,1,0,0,0,0,0,0,0,0,1,0,2,0,0,0,0,0,0,14,0,0,2,1,0,0,0,0,0,0,4,0,0,0,0,0,0,0,20,4,0,0,4,0,0,4,31,0,0,0,0,0,0,3,0,0,0,0,0,0,0,0,0,0,0,0,0,0,0,1,0,0,0,0,0,0,0,0,0,0,0,0,24,0,0,0,0,0,2,0,19,0,0,0,0,0,0,0,0,0,0,0,0,0,2,0,0,0,0,0,0,0,0,0,0,0,0,0,1,1,0,0
"LTU_053_MZB_LO_4","LTU_053_MZB_LO_4-16.09.2013","16.09.2013",2013,9,16,0,0,0,0,0,0,0,0,0,0,0,0,0,0,26,0,27,0,27,216,0,0,52,0,0,72,17,17,0,0,0,0,0,75,0,0,16,0,0,37,0,0,0,0,0,0,0,0,0,0,0,0,5,0,0,0,0,0,0,0,0,37,0,0,0,0,0,0,0,0,0,0,0,0,0,0,0,0,0,0,145,0,0,0,0,0,0,202,0,0,0,0,0,0,0,44,0,0,0,0,0,0,0,0,0,17,0,0,0,0,0,103,0,0,0,0,0,0,0,0,0,0,0,0,0,0,0,0,0,0,19,0,44,0,0,0,0,0,0,0,0,6,0,0,0,0,0,0,0,180,0,0,0,0,0,41,0,0,0,0,35,0,0,28
"LTU_053_MZB_LO_4","LTU_053_MZB_LO_4-23.09.2014","23.09.2014",2014,9,23,0,0,0,0,0,0,0,0,0,0,0,0,0,0,16,0,10,0,0,79,0,0,0,0,0,0,13,13,0,0,38,0,0,0,0,0,0,0,0,111,0,0,0,0,0,0,0,18,0,0,0,0,4,0,0,0,0,0,0,0,0,10,0,0,0,0,0,0,0,0,3,0,0,0,0,0,0,0,0,0,19,0,3,0,0,0,0,64,0,0,10,0,0,0,0,26,0,0,0,0,0,0,0,0,0,4,0,3,0,0,0,24,0,0,0,0,0,0,0,0,0,7,0,0,14,0,0,0,0,37,5,0,0,0,0,0,0,0,0,0,0,1,1,0,0,0,0,0,0,28,0,0,0,0,0,0,5,0,0,0,0,0,0,0
"LTU_053_MZB_LO_4","LTU_053_MZB_LO_4-21.09.2015","21.09.2015",2015,9,21,0,0,0,0,0,0,0,0,0,0,0,0,0,0,4,0,0,0,0,129,0,0,25,13,0,12,9,9,0,0,16,0,0,20,0,0,3,0,0,11,0,0,0,0,0,0,0,0,0,0,0,0,3,0,31,0,0,0,0,0,0,19,0,1,0,0,0,0,0,0,11,0,0,0,0,0,0,0,0,0,0,0,2,0,0,0,0,4,11,0,0,0,2,0,0,10,0,0,0,8,0,0,0,0,0,0,0,0,0,0,0,19,0,0,0,0,0,0,0,0,0,0,3,0,15,0,0,0,0,25,0,0,19,0,0,0,0,0,0,0,0,0,0,0,0,0,0,0,0,25,0,0,6,0,0,0,0,0,0,0,0,1,0,1
"LTU_053_MZB_LO_4","LTU_053_MZB_LO_4-26.09.2016","26.09.2016",2016,9,26,0,0,0,2,0,0,0,0,0,0,0,0,0,0,0,0,13,0,0,62,0,0,27,0,0,60,25,25,0,0,3,0,0,0,0,0,8,0,0,16,0,0,0,0,0,0,0,0,0,0,0,0,0,0,31,0,0,15,0,0,0,15,0,0,0,0,0,0,0,0,0,0,0,12,0,0,0,0,0,0,25,0,12,0,0,0,0,54,0,0,12,0,0,0,0,25,0,0,0,0,0,0,0,10,0,1,0,0,0,0,0,30,0,0,0,0,0,0,1,0,0,8,0,0,37,0,1,0,0,29,8,8,18,0,0,0,0,0,0,0,0,6,0,0,0,0,0,0,0,0,0,0,0,0,0,0,0,0,0,0,0,0,0,0
"LTU_053_MZB_LO_4","LTU_053_MZB_LO_4-25.10.2017","25.10.2017",2017,10,25,0,0,0,0,0,0,0,0,0,0,0,0,0,0,59,0,56,0,0,105,0,0,0,0,28,0,3,3,0,0,0,0,0,7,0,0,0,0,0,13,0,0,0,0,0,0,0,0,0,0,24,0,4,0,0,0,0,12,0,0,0,4,0,0,0,0,0,0,0,0,8,0,0,12,0,0,0,0,0,0,58,24,0,0,0,0,0,0,0,0,0,0,71,0,0,0,0,0,0,0,0,0,0,0,0,1,0,0,0,0,0,22,0,0,0,0,0,0,0,0,0,0,0,0,25,0,0,0,2,0,0,0,0,0,0,0,0,0,0,0,0,0,0,0,0,0,0,133,0,36,0,0,0,0,0,0,0,0,0,0,0,0,13,1
"LTU_053_MZB_LO_4","LTU_053_MZB_LO_4-22.09.2020","22.09.2020",2020,9,22,0,0,0,0,0,0,0,0,0,0,0,0,0,0,0,0,0,0,0,14,0,0,0,0,0,0,5,5,0,0,0,0,0,22,0,0,1,0,0,9,0,0,0,0,0,0,0,0,0,0,0,0,1,0,3,0,0,6,0,0,0,7,0,0,1,1,0,0,0,0,0,0,1,0,0,0,0,0,0,0,0,0,0,0,0,0,0,0,0,0,0,0,0,0,0,0,0,0,0,0,0,0,0,0,0,0,0,0,0,0,0,6,0,0,0,0,0,0,0,0,0,0,0,0,1,0,0,0,0,0,1,0,149,0,0,0,0,0,0,0,0,6,0,0,0,0,1,15,0,0,0,0,0,0,0,0,0,0,0,0,0,5,0,0
"LTU_053_MZB_LO_40","LTU_053_MZB_LO_40-24.09.2010","24.09.2010",2010,9,24,0,0,0,0,1,0,0,0,0,0,0,0,0,0,0,0,2,0,0,1,0,0,0,0,0,26,0,0,0,0,0,1,0,45,0,0,2,0,0,3,0,0,0,0,0,0,0,0,0,0,0,0,2,0,2,0,0,7,1,0,0,1,0,0,1,0,0,0,0,0,0,0,0,0,0,0,4,0,0,0,0,0,0,0,0,0,0,0,5,0,0,0,6,0,0,0,0,0,0,0,0,0,0,0,0,1,0,0,0,0,0,0,0,0,0,0,0,0,0,0,0,0,0,0,0,0,0,0,0,0,3,0,2,0,0,0,0,0,0,0,0,0,0,0,0,0,4,0,1,0,0,0,0,0,0,0,0,0,0,0,0,0,0,0
"LTU_053_MZB_LO_40","LTU_053_MZB_LO_40-25.09.2013","25.09.2013",2013,9,25,0,0,0,0,3,0,1,0,0,0,0,0,0,0,0,0,8,0,0,245,0,0,12,0,0,27,0,0,0,0,0,0,0,1,0,0,22,0,0,30,0,0,0,1,0,0,0,0,0,0,0,0,1,0,0,0,0,10,0,0,0,4,0,0,4,0,0,0,4,0,0,0,29,5,0,0,0,1,0,0,0,1,0,0,0,0,0,1,0,0,0,3,2,0,0,1,0,0,0,0,0,0,0,0,0,0,0,1,0,0,0,0,0,0,0,0,0,0,0,0,0,0,0,0,0,0,0,0,0,0,2,0,4,0,0,0,0,0,0,0,0,0,0,0,0,0,2,0,0,0,0,0,0,0,0,4,0,0,0,0,6,0,0,0
"LTU_053_MZB_LO_40","LTU_053_MZB_LO_40-04.10.2016","04.10.2016",2016,10,4,0,0,0,0,2,0,1,0,0,0,0,0,0,0,0,0,7,0,0,268,0,0,2,0,0,4,2,2,0,0,0,0,0,216,0,0,4,0,1,2,0,0,0,0,0,0,0,0,0,0,0,0,2,0,0,0,0,0,0,0,0,2,0,0,1,0,0,0,1,0,0,0,2,1,0,0,0,0,0,0,0,29,0,0,0,0,0,0,1,0,0,0,2,0,0,0,0,0,0,1,0,0,0,0,0,0,0,1,0,0,0,61,0,0,0,0,0,0,0,0,0,0,0,0,0,0,2,0,0,0,1,0,11,0,0,0,0,0,0,0,0,4,0,0,0,0,1,0,0,7,0,0,0,0,0,0,0,0,0,0,0,4,0,0
"LTU_053_MZB_LO_40","LTU_053_MZB_LO_40-26.09.2019","26.09.2019",2019,9,26,0,0,0,0,0,0,0,0,0,0,0,0,0,0,0,0,0,0,0,160,0,0,18,0,0,0,0,0,0,0,3,0,0,71,0,0,33,0,0,0,0,0,0,0,0,0,0,0,0,0,0,0,0,0,0,0,0,0,0,0,0,0,0,0,0,0,0,0,0,0,0,0,0,0,0,0,0,0,0,0,0,0,0,0,0,0,0,0,0,0,0,0,0,0,0,1,0,0,0,0,0,0,0,0,0,0,0,5,0,0,0,9,0,0,0,0,0,0,0,0,0,0,0,0,14,0,0,0,0,45,0,0,8,0,0,0,0,0,0,0,0,3,0,0,0,0,0,0,0,0,0,0,0,0,0,0,0,0,0,0,4,0,0,0
"LTU_053_MZB_LO_40","LTU_053_MZB_LO_40-20.09.2022","20.09.2022",2022,9,20,0,0,0,1,0,0,0,0,0,0,0,0,0,0,0,0,0,0,0,15,0,0,1,0,0,0,5,5,0,0,1,0,0,27,0,0,6,0,0,9,0,0,0,0,0,0,0,3,0,0,0,0,2,0,0,0,0,0,0,0,0,10,0,0,13,0,0,0,0,0,0,0,0,0,0,0,0,0,0,0,0,0,0,0,0,0,0,0,0,0,0,0,0,0,0,0,0,0,0,0,0,0,0,0,0,0,0,3,0,0,0,20,0,0,0,0,0,0,0,0,0,0,0,0,0,0,0,0,0,2,2,0,0,0,0,0,0,0,0,0,0,0,0,0,0,0,0,0,0,2,0,0,0,0,0,0,0,0,0,0,0,0,0,0
"LTU_053_MZB_LO_41","LTU_053_MZB_LO_41-01.10.2010","01.10.2010",2010,10,1,0,0,0,0,0,0,0,0,0,0,0,0,0,0,19,0,11,0,0,0,0,0,0,0,0,0,17,17,0,0,0,0,0,0,0,0,0,0,0,0,0,0,0,0,0,0,0,0,0,0,0,0,0,0,0,0,0,32,0,0,0,9,0,0,5,7,0,0,0,0,0,0,0,0,0,0,0,0,0,0,22,0,0,0,0,0,0,0,15,0,0,0,0,0,0,0,0,0,0,0,0,0,0,0,0,0,0,0,0,0,0,45,0,0,0,0,0,0,0,0,0,0,0,0,0,0,0,0,0,0,0,0,41,0,0,0,0,0,0,0,0,0,0,0,0,0,0,0,0,26,0,0,0,0,0,0,0,8,0,0,0,0,0,0
"LTU_053_MZB_LO_41","LTU_053_MZB_LO_41-15.10.2013","15.10.2013",2013,10,15,0,0,0,0,0,0,0,0,0,0,0,0,0,0,0,0,94,0,11,10,0,0,46,18,37,0,5,5,0,0,0,0,0,25,0,0,0,0,0,13,0,0,0,0,0,0,0,0,0,0,0,0,0,0,41,0,0,24,0,0,0,11,0,0,14,0,0,0,5,0,0,0,0,10,0,0,19,0,0,0,20,30,0,0,0,0,0,0,19,0,0,0,0,0,0,28,0,0,0,0,0,0,0,0,0,0,0,0,0,0,0,47,0,0,3,0,0,0,0,0,0,14,0,0,0,0,6,0,0,39,0,0,0,0,0,0,0,0,0,0,9,0,0,0,0,0,6,34,0,82,0,0,0,0,0,0,0,0,0,0,0,0,0,0
"LTU_053_MZB_LO_41","LTU_053_MZB_LO_41-28.09.2015","28.09.2015",2015,9,28,0,0,0,0,0,0,0,0,0,0,0,0,0,0,6,0,2,0,3,9,0,0,20,5,21,26,4,4,0,0,2,0,0,8,0,0,0,0,0,1,0,0,0,0,0,0,0,0,0,6,0,0,5,0,20,0,0,0,0,0,0,4,0,0,3,0,0,2,1,0,5,0,0,0,0,0,0,0,0,0,5,0,2,0,0,0,0,14,7,0,0,0,0,0,0,10,0,0,0,6,0,0,0,0,0,0,0,1,0,0,0,48,0,0,0,0,0,0,0,0,0,0,0,0,0,0,0,0,0,24,0,0,0,0,3,0,0,0,0,0,0,6,0,0,0,0,0,12,0,47,0,0,0,0,0,0,0,14,0,0,0,0,0,0
"LTU_053_MZB_LO_41","LTU_053_MZB_LO_41-08.10.2018","08.10.2018",2018,10,8,0,0,4,0,0,0,0,0,0,0,4,0,0,0,3,0,0,0,0,0,0,0,11,0,0,6,10,10,0,0,0,0,0,65,0,0,0,0,0,1,0,0,0,0,0,0,0,0,0,0,0,0,0,0,0,0,0,48,0,0,0,4,0,0,9,0,0,0,0,0,0,0,0,13,0,0,0,0,0,0,8,0,0,0,0,0,0,0,0,0,6,0,0,0,0,41,0,0,0,0,0,0,0,0,0,4,1,1,0,0,0,13,0,0,0,0,0,0,0,0,6,0,0,0,1,0,2,0,0,9,1,0,0,0,0,0,0,0,0,0,0,0,1,0,0,0,14,0,0,51,0,0,0,0,0,0,0,5,0,0,0,0,0,0
"LTU_053_MZB_LO_41","LTU_053_MZB_LO_41-07.10.2021","07.10.2021",2021,10,7,0,0,0,0,0,0,0,0,0,0,0,0,0,0,8,0,1,0,0,50,0,0,6,0,2,2,8,8,0,0,0,0,0,7,0,0,0,0,0,0,0,0,0,0,0,0,0,0,0,0,0,0,0,0,0,0,0,4,0,0,0,4,0,0,0,0,0,0,4,0,12,0,1,0,0,0,1,0,0,0,7,0,0,0,0,0,0,0,8,0,0,0,0,0,0,0,0,0,0,0,0,0,0,9,0,0,0,0,0,0,0,49,0,0,0,0,0,0,0,0,0,0,0,0,0,0,0,0,0,2,1,0,1,0,0,0,0,0,0,0,0,0,0,0,0,0,0,2,0,14,0,0,0,0,0,0,0,0,0,0,0,0,0,0
"LTU_053_MZB_LO_42","LTU_053_MZB_LO_42-05.10.2010","05.10.2010",2010,10,5,0,0,0,0,0,0,0,0,0,0,0,0,0,0,0,0,63,0,0,97,0,0,0,0,0,0,0,0,0,0,0,0,0,0,0,0,0,0,0,28,0,0,0,0,0,0,0,0,0,0,0,0,16,0,0,0,0,0,0,0,0,18,0,0,195,0,0,12,0,0,0,0,0,16,0,0,0,0,0,0,83,0,0,0,0,0,0,28,0,0,0,0,165,0,0,0,0,0,0,10,0,0,0,0,0,2,0,0,0,0,0,28,0,0,0,0,0,0,8,0,0,0,18,0,0,0,0,0,0,0,0,0,0,0,0,0,0,0,0,0,0,0,0,0,0,0,32,0,0,28,0,0,0,0,0,0,0,0,0,0,0,0,0,0
"LTU_053_MZB_LO_42","LTU_053_MZB_LO_42-19.10.2011","19.10.2011",2011,10,19,0,0,0,0,0,0,0,0,0,0,0,0,0,0,5,0,45,0,0,61,0,0,4,0,0,11,13,13,0,0,0,35,0,20,0,0,0,0,0,2,0,0,0,0,0,0,18,0,0,0,0,0,4,0,187,0,0,52,0,0,0,4,0,0,91,1,0,21,0,0,15,0,0,0,0,0,0,0,0,0,104,0,0,0,0,0,0,36,18,0,0,0,7,1,0,1,0,0,0,0,0,0,0,1,0,0,3,0,0,0,0,38,0,0,0,0,0,0,0,0,0,0,0,0,1,0,0,0,0,0,0,0,12,0,0,0,0,0,0,0,0,0,0,0,0,0,0,267,0,0,0,0,0,0,0,7,0,0,0,0,0,0,0,0
"LTU_053_MZB_LO_42","LTU_053_MZB_LO_42-16.10.2013","16.10.2013",2013,10,16,0,0,0,0,0,0,0,0,0,0,0,0,0,0,0,0,11,0,0,0,18,0,27,0,0,39,0,0,0,0,6,0,0,0,0,0,0,0,0,0,0,0,0,0,0,0,6,0,0,0,0,0,0,0,0,0,0,99,0,0,0,29,0,0,0,0,0,8,2,0,0,0,0,13,0,0,0,0,0,0,0,31,0,0,0,0,0,0,0,0,0,0,33,0,0,16,0,0,0,0,0,0,0,0,0,0,16,0,0,0,0,25,0,0,0,0,0,0,0,0,0,0,0,0,0,0,0,0,0,0,0,0,0,0,0,0,0,0,0,0,0,0,0,0,0,0,0,0,0,50,0,0,0,0,0,4,0,0,0,0,16,0,0,0
"LTU_053_MZB_LO_42","LTU_053_MZB_LO_42-23.09.2014","23.09.2014",2014,9,23,0,0,0,0,0,2,0,0,0,0,0,0,0,0,0,0,23,0,0,27,0,0,28,0,37,37,0,0,0,0,0,0,0,37,0,0,0,0,0,0,0,10,0,0,0,0,0,0,0,0,0,0,0,0,0,0,0,49,0,0,0,7,0,0,19,0,0,23,0,0,0,0,0,0,0,0,0,0,0,0,8,0,0,0,0,0,0,22,0,0,0,0,69,0,0,0,0,0,0,14,0,0,0,0,0,0,0,0,0,0,0,41,0,0,0,0,0,0,0,0,0,0,2,0,0,0,0,0,0,18,0,0,0,0,0,0,0,0,0,0,0,0,0,0,0,0,10,0,0,55,0,0,0,0,0,0,0,0,0,0,0,0,0,0
"LTU_053_MZB_LO_42","LTU_053_MZB_LO_42-21.10.2015","21.10.2015",2015,10,21,0,0,0,0,0,0,0,0,0,0,0,0,0,0,0,0,53,0,0,34,0,2,1,0,0,90,1,1,0,0,0,31,0,398,0,0,0,0,0,187,0,0,0,0,0,0,0,0,0,0,0,1,1,0,12,0,0,66,0,0,0,8,0,0,33,2,0,0,0,0,0,0,0,1,0,3,0,0,0,0,0,0,0,0,1,0,0,10,22,0,0,0,4,0,0,0,0,2,0,2,0,0,0,0,0,0,0,0,0,0,0,0,0,0,0,0,0,0,0,0,0,0,0,0,0,0,2,0,0,0,5,0,25,0,0,0,0,0,0,0,0,0,0,0,0,0,5,0,0,30,0,0,0,0,0,1,0,0,1,0,0,0,0,0
"LTU_053_MZB_LO_42","LTU_053_MZB_LO_42-24.09.2019","24.09.2019",2019,9,24,0,0,0,0,0,0,0,0,0,0,0,0,0,0,0,0,6,0,0,2,0,0,0,0,0,0,0,0,0,0,0,0,0,5,0,0,3,0,0,0,0,0,0,0,0,0,0,0,0,0,0,0,0,0,0,0,0,2,0,0,0,4,0,0,7,1,0,0,0,0,0,0,0,0,0,0,0,0,0,0,0,0,0,0,0,0,0,0,0,0,0,2,0,0,0,1,0,0,1,0,0,0,0,0,0,0,0,1,0,0,0,14,0,0,0,0,0,0,0,0,0,0,0,0,1,0,0,0,0,0,2,0,0,0,0,0,0,0,0,0,0,0,0,0,0,0,0,0,0,1,0,0,0,1,0,1,0,0,0,0,0,0,5,0
