"Unique.ID","Samp.ID","Sampling.date","year","month","day","ACROLOXUS LACUSTRIS","AESHNA SP.","AGAPETUS SP.","AGRYPNIA SP.","AMELETUS SP.","ANISOPTERA GEN. SP.","APATANIA SP.","APHELOCHEIRUS AESTIVALIS","ARGYRONETA AQUATICA","ARTHROPLEA CONGENER","ASELLUS AQUATICUS","ASTACIDAE GEN. SP.","ATHERICIDAE GEN. SP.","BAETIDAE GEN. SP.","BERAEA PULLATA","BERAEODES MINUTUS","BITHYNIA SP.","BRACHYCENTRUS SUBNUBILUS","BRACHYPTERA SP.","CAENIS SP.","CALOPTERYX SP.","CALOPTERYX SPLENDENS","CAPNIA SP.","CAPNOPSIS SCHILLERI SSP.","CERATOPOGONIDAE GEN. SP.","CHAOBORUS SP.","CHIRONOMIDAE GEN. SP.","CHLOROPERLA SP.","CHRYSOPILUS SP.","COENAGRIONIDAE GEN. SP.","COLEOPTERA GEN. SP.","CORDULEGASTER BOLTONII","CORDULIA AENEA","CORIXIDAE GEN. SP.","CRUNOECIA IRRORATA SSP.","CULICIDAE GEN. SP.","CYPHON SP.","DENDROCOELUM LACTEUM","DIPTERA GEN. SP.","DIXIDAE GEN. SP.","DOLICHOPODIDAE GEN. SP.","DONACIA SP.","DUGESIA SP.","DYTISCIDAE GEN. SP.","ECNOMUS TENELLUS","ELMIS AENEA","ELODES SP.","EMPIDIDAE GEN. SP.","EPHEMERA SP.","EPHEMERELLA SP.","EPHYDRIDAE GEN. SP.","ERPOBDELLIDAE GEN. SP.","GAMMARUS SP.","GASTROPODA GEN. SP.","GERRIDAE GEN. SP.","GLOSSIPHONIIDAE GEN. SP.","GLOSSOSOMA SP.","GOERIDAE GEN. SP.","GOMPHIDAE GEN. SP.","GYRINIDAE GEN. SP.","HAEMOPIS SANGUISUGA","HALIPLUS SP.","HELOPHORUS SP.","HEPTAGENIIDAE GEN. SP.","HOLOSTOMIS ATRATA","HYDRACHNIDAE GEN. SP.","HYDRACHNIDIA GEN. SP.","HYDRAENIDAE GEN. SP.","HYDRIDAE GEN. SP.","HYDROBIIDAE GEN. SP.","HYDROPHILIDAE GEN. SP.","HYDROPSYCHIDAE GEN. SP.","HYDROPTILIDAE GEN. SP.","LEPIDOPTERA GEN. SP.","LEPIDOSTOMA HIRTUM","LEPTOCERIDAE GEN. SP.","LEPTOPHLEBIIDAE GEN. SP.","LEUCTRA SP.","LIBELLULIDAE GEN. SP.","LIMNEPHILIDAE GEN. SP.","LIMNIUS SP.","LIMONIIDAE GEN. SP.","LYMNAEIDAE GEN. SP.","MARGARITIFERA MARGARITIFERA","METRETOPUS SP.","MICRASEMA GELIDUM","MICRASEMA SETIFERUM SSP.","MOLANNA SP.","MOLANNODES TINCTUS","MUSCIDAE GEN. SP.","NEMATODA GEN. SP.","NEMATOMORPHA GEN. SP.","NEMOURIDAE GEN. SP.","NEPA CINEREA","NOTERUS SP.","NOTONECTA GLAUCA SSP.","NOTONECTA MACULATA","OLIGOCHAETA GEN. SP.","OULIMNIUS SP.","PEDICIIDAE GEN. SP.","PERLIDAE GEN. SP.","PERLODIDAE GEN. SP.","PHILOPOTAMIDAE GEN. SP.","PHRYGANEA BIPUNCTATA","PHYSA FONTINALIS","PISCICOLA GEOMETRA","PLANARIA TORVA","PLANORBIDAE GEN. SP.","PLATYCNEMIS PENNIPES","PLATYHELMINTHES GEN. SP.","PLECOPTERA GEN. SP.","POLYCELIS SP.","POLYCENTROPODIDAE GEN. SP.","PRORHYNCHUS STAGNALIS","PROSTOMA GRAECENSE","PSYCHODIDAE GEN. SP.","PSYCHOMYIIDAE GEN. SP.","PTYCHOPTERIDAE GEN. SP.","RHYACOPHILA SP.","RIOLUS CUPREUS","SCIOMYZIDAE GEN. SP.","SCIRTES SP.","SERICOSTOMATIDAE GEN. SP.","SERRATELLA IGNITA","SIALIS SP.","SIMULIIDAE GEN. SP.","SIPHLONURUS SP.","SIPHONOPERLA BURMEISTERI","SISYRA SP.","SOMATOCHLORA FLAVOMACULATA","SOMATOCHLORA METALLICA","SPHAERIIDAE GEN. SP.","STENELMIS SP.","STRATIOMYIDAE GEN. SP.","TABANIDAE GEN. SP.","TAENIOPTERYX NEBULOSA","THEODOXUS FLUVIATILIS SSP.","TIPULIDAE GEN. SP.","TRICHOPTERA GEN. SP.","TRICLADIDA GEN. SP.","TRIOGMA SP.","TURBELLARIA GEN. SP.","UNIONIDAE GEN. SP.","VALVATA CRISTATA","VALVATA PISCINALIS SSP.","VELIA SP.","VIVIPARUS VIVIPARUS","ZWICKNIA BIFRONS","ZYGOPTERA GEN. SP."
"SWE_039_MZB_LO_1","SWE_039_MZB_LO_1-20.10.2004","20.10.2004",2004,10,20,0,0,1,0,0,0,0,0,0,0,0,0,0,28,0,0,0,0,0,0,0,0,0,1,19,0,251,0,0,0,0,0,0,0,0,0,0,0,0,0,0,0,0,0,0,17,0,0,0,55,0,0,0,0,0,0,0,4,0,0,0,0,0,10,0,16,0,0,0,0,0,0,1,0,0,0,4,77,0,62,0,2,0,0,0,0,0,0,0,1,0,0,142,0,0,0,0,23,0,2,0,13,2,0,0,0,0,0,0,0,0,0,20,0,0,24,0,0,3,0,0,0,12,0,2,117,0,0,0,0,0,0,0,0,0,2,0,0,0,0,0,0,0,0,0,0,0,0,0
"SWE_039_MZB_LO_1","SWE_039_MZB_LO_1-03.09.2005","03.09.2005",2005,9,3,0,0,0,0,0,0,0,0,0,0,0,0,0,34,0,0,0,0,0,0,0,0,0,4,11,0,62,0,0,0,0,0,0,0,0,0,0,0,0,0,0,0,0,0,0,23,0,1,0,104,0,0,0,0,0,0,0,7,0,0,0,0,0,5,0,2,0,3,0,0,0,3,6,0,0,0,0,24,0,57,3,0,0,0,0,0,0,0,0,0,3,0,69,0,0,0,0,14,0,3,0,10,0,0,0,0,0,0,0,0,0,0,3,0,0,5,0,0,16,0,0,0,18,0,4,62,0,0,0,0,0,1,0,0,0,14,0,0,0,0,0,0,0,0,0,0,0,0,0
"SWE_039_MZB_LO_1","SWE_039_MZB_LO_1-16.09.2006","16.09.2006",2006,9,16,0,0,1,0,1,0,5,0,0,0,0,0,0,69,0,0,0,0,0,0,0,0,0,3,10,0,107,0,0,0,0,0,0,0,0,0,0,0,0,0,0,0,0,3,0,25,1,0,0,83,0,0,0,0,0,0,1,5,0,0,0,0,0,3,0,11,0,10,0,0,0,1,41,0,0,0,7,47,0,48,3,3,0,0,0,0,0,0,0,0,0,0,164,0,0,0,0,17,0,6,0,3,0,0,0,0,0,0,0,0,0,0,24,0,0,14,0,0,7,0,0,0,48,0,5,22,0,0,0,0,0,1,0,0,0,31,0,3,0,0,0,0,0,0,0,0,0,0,0
"SWE_039_MZB_LO_1","SWE_039_MZB_LO_1-25.09.2007","25.09.2007",2007,9,25,0,0,4,0,1,0,5,0,0,0,0,0,0,49,0,0,0,0,0,1,0,0,0,8,11,0,182,0,0,0,0,0,0,0,0,0,0,0,0,0,0,0,0,1,0,26,0,0,0,50,0,0,0,0,0,0,0,2,0,0,0,0,0,2,0,14,0,4,0,0,0,2,40,0,0,0,6,46,0,95,1,3,0,0,0,1,0,0,0,0,0,0,234,0,0,0,0,19,0,4,0,3,0,0,0,0,0,0,0,0,0,0,13,0,0,37,0,0,7,0,0,0,27,0,5,30,0,0,0,0,0,1,0,0,0,16,0,1,0,0,0,0,0,0,0,0,0,0,0
"SWE_039_MZB_LO_1","SWE_039_MZB_LO_1-16.09.2008","16.09.2008",2008,9,16,0,0,3,0,1,0,2,0,0,0,0,0,0,36,0,1,0,0,0,0,0,0,0,7,21,0,85,0,0,0,0,0,0,0,0,0,0,0,0,0,0,0,0,3,0,35,2,2,0,60,0,0,0,0,0,0,1,6,0,0,0,0,0,10,0,8,0,8,0,0,0,7,140,0,1,0,5,51,0,117,3,0,0,0,0,0,0,0,0,0,1,0,114,0,0,0,0,28,0,3,0,5,0,0,0,0,0,0,0,0,0,0,17,0,0,15,1,0,13,0,0,0,40,0,5,58,0,0,0,0,0,0,0,0,0,33,0,1,0,0,0,0,0,0,0,0,0,0,0
"SWE_039_MZB_LO_1","SWE_039_MZB_LO_1-19.09.2009","19.09.2009",2009,9,19,0,0,12,0,0,0,2,0,0,0,0,0,0,34,0,1,0,0,0,0,0,0,0,7,15,0,124,0,0,0,0,0,0,0,0,0,0,0,0,0,0,0,0,3,0,36,1,1,0,31,0,0,0,0,0,0,1,9,0,0,0,0,0,10,0,19,0,8,0,0,0,2,13,0,0,0,1,44,0,78,1,1,0,0,0,0,0,0,0,0,0,0,123,0,0,0,0,20,0,7,0,6,0,0,0,0,0,0,0,0,0,0,8,0,0,11,5,0,6,0,0,0,23,0,9,30,0,0,0,0,0,0,0,0,0,27,0,1,0,0,0,1,0,0,0,0,0,0,0
"SWE_039_MZB_LO_1","SWE_039_MZB_LO_1-04.09.2010","04.09.2010",2010,9,4,0,0,40,0,0,0,0,0,0,0,0,0,0,31,0,0,0,0,0,0,0,0,0,11,20,0,105,0,0,0,0,0,0,0,0,0,0,0,0,0,0,0,0,11,0,29,0,0,0,57,0,0,0,0,0,0,1,4,0,0,0,0,0,10,0,18,0,2,0,0,0,6,17,0,2,0,2,34,0,40,5,0,0,0,0,0,0,0,0,0,1,0,138,0,0,0,0,27,0,7,0,9,0,0,0,0,0,0,0,0,0,0,6,0,0,0,0,0,12,0,0,0,29,0,4,21,0,0,0,0,0,1,0,0,0,48,0,1,0,0,0,0,0,0,0,0,0,0,0
"SWE_039_MZB_LO_1","SWE_039_MZB_LO_1-04.10.2011","04.10.2011",2011,10,4,0,0,84,0,2,0,5,0,0,0,0,0,0,27,0,0,0,0,0,0,0,0,0,4,9,0,137,0,0,0,0,0,0,1,0,0,0,0,0,0,0,0,0,1,0,13,1,0,0,46,0,0,0,0,0,0,0,4,0,0,0,0,0,6,0,13,0,1,0,0,0,17,7,0,5,0,7,27,0,115,0,3,0,0,0,1,0,0,0,0,0,0,66,0,0,0,0,15,0,3,0,0,0,0,0,0,0,0,0,0,0,0,16,0,0,8,0,0,6,0,0,0,9,0,3,20,0,0,0,0,0,0,0,0,0,3,0,0,0,0,0,0,0,0,0,0,0,0,0
"SWE_039_MZB_LO_1","SWE_039_MZB_LO_1-13.09.2012","13.09.2012",2012,9,13,0,0,17,0,0,0,0,0,0,0,1,0,0,33,0,0,0,0,0,0,0,0,0,2,20,0,75,0,0,0,0,0,0,0,0,0,0,0,0,0,0,0,0,6,0,13,0,2,0,132,0,0,0,0,1,0,0,1,0,0,0,0,0,8,0,6,0,3,0,0,0,10,1,0,8,0,1,26,0,238,0,2,0,0,0,0,0,0,0,0,1,0,120,0,0,0,0,18,0,9,0,10,0,0,0,0,0,0,0,0,0,0,2,0,0,1,3,0,14,0,0,0,15,0,2,70,0,0,0,0,0,0,0,0,0,4,0,0,0,0,0,0,0,0,0,0,0,0,0
"SWE_039_MZB_LO_1","SWE_039_MZB_LO_1-15.09.2013","15.09.2013",2013,9,15,0,0,19,0,0,0,0,0,0,0,0,0,0,25,0,1,0,0,1,0,0,0,0,0,10,0,83,0,0,0,0,0,0,0,0,0,0,0,0,0,0,0,0,4,0,23,1,2,0,105,0,0,0,0,0,0,0,1,0,0,0,0,0,6,0,9,0,2,0,0,0,17,4,0,2,0,3,26,0,47,4,0,0,0,0,0,0,0,0,0,0,0,34,0,0,0,0,24,0,4,0,5,0,0,0,0,0,0,0,0,0,0,10,0,0,1,0,0,5,0,0,0,14,0,3,9,0,0,0,0,0,0,0,0,0,4,0,0,0,0,0,0,0,0,0,0,0,0,0
"SWE_039_MZB_LO_1","SWE_039_MZB_LO_1-15.09.2014","15.09.2014",2014,9,15,0,0,19,0,0,0,0,0,0,0,0,0,0,62,0,1,0,0,0,0,0,0,0,3,33,0,99,0,0,0,0,0,0,0,0,0,0,0,0,0,0,0,0,2,0,43,0,2,0,83,0,0,0,0,0,0,1,3,0,0,0,0,0,28,0,15,0,8,0,0,0,7,25,0,6,0,16,51,0,52,4,1,0,0,0,0,0,0,0,0,1,0,161,0,0,0,0,27,0,12,0,12,0,0,0,0,0,0,0,0,0,0,21,0,0,6,0,0,17,0,0,0,33,0,3,34,0,0,0,0,0,1,0,0,0,18,0,4,0,0,0,0,0,0,0,0,0,0,0
"SWE_039_MZB_LO_1","SWE_039_MZB_LO_1-13.09.2015","13.09.2015",2015,9,13,0,0,20,0,0,0,0,0,0,0,0,0,0,10,0,1,0,0,0,0,0,0,0,7,23,0,127,0,0,0,0,0,0,0,0,0,0,0,0,0,0,0,0,7,0,23,0,0,0,79,0,0,0,0,0,0,0,2,0,0,0,0,0,9,0,11,0,7,0,0,0,5,20,0,11,0,2,69,0,76,2,5,0,0,0,0,0,0,0,0,1,0,174,0,0,0,0,24,0,2,0,6,0,0,0,0,0,0,0,0,0,0,0,0,0,3,0,0,13,0,0,0,30,0,1,29,0,0,0,0,0,0,0,0,0,29,0,0,0,0,0,0,0,0,0,0,0,0,0
"SWE_039_MZB_LO_1","SWE_039_MZB_LO_1-09.09.2016","09.09.2016",2016,9,9,0,0,24,0,0,0,0,0,0,0,1,0,0,27,0,0,0,0,0,0,0,0,0,5,13,0,44,0,0,0,0,0,0,0,0,0,0,0,0,0,0,0,0,1,0,14,1,1,0,129,0,0,0,0,0,0,1,5,0,0,0,0,0,20,0,1,0,2,0,0,0,11,4,0,13,0,0,97,0,29,1,0,0,0,0,0,0,0,0,0,0,0,84,0,0,0,0,43,0,7,0,4,0,0,0,0,0,0,0,0,0,0,8,0,0,3,0,0,13,0,0,0,15,0,0,19,0,0,0,0,0,0,0,0,0,7,0,2,0,0,0,0,0,0,0,0,0,0,0
"SWE_039_MZB_LO_1","SWE_039_MZB_LO_1-17.09.2017","17.09.2017",2017,9,17,0,0,2,0,0,0,0,0,0,0,0,0,0,7,0,0,0,0,0,0,0,0,0,3,9,0,96,0,0,0,0,0,0,0,0,0,0,0,0,0,0,0,0,5,0,6,0,0,0,235,0,0,0,0,0,0,0,6,0,0,0,0,0,6,0,5,0,1,0,0,0,2,33,0,5,0,0,31,0,30,2,4,0,0,0,0,0,0,0,0,1,0,52,0,0,0,0,50,0,2,0,4,0,0,0,0,0,0,0,0,0,0,12,0,0,0,0,0,4,0,0,0,31,0,4,15,0,0,0,0,0,1,0,0,0,0,0,5,0,0,0,0,0,0,0,0,0,0,0
"SWE_039_MZB_LO_1","SWE_039_MZB_LO_1-11.09.2018","11.09.2018",2018,9,11,0,0,0,0,0,0,0,0,0,0,0,0,0,34,0,0,0,0,0,0,0,0,0,0,7,0,158,0,0,0,0,0,0,0,0,0,0,0,0,2,0,0,0,1,0,17,0,0,0,44,0,0,0,0,0,0,0,0,0,0,0,0,0,12,0,6,0,0,0,0,0,24,13,0,22,0,21,27,0,31,2,1,0,0,0,0,0,0,0,0,0,0,66,0,0,0,0,2,0,2,0,7,0,0,0,0,0,0,0,0,0,0,24,0,0,0,0,0,9,0,0,0,19,0,3,6,0,0,0,0,0,2,0,0,0,6,0,4,0,0,0,0,0,0,0,0,0,0,0
"SWE_039_MZB_LO_1","SWE_039_MZB_LO_1-20.09.2019","20.09.2019",2019,9,20,0,0,19,0,0,0,2,0,0,0,0,0,0,58,0,0,0,0,0,0,0,0,1,4,15,0,164,0,0,0,0,0,0,0,0,0,0,0,0,0,0,0,0,2,0,31,0,2,0,92,0,0,0,0,0,0,0,1,0,0,0,0,0,7,0,4,0,8,0,0,0,32,57,0,15,0,8,100,0,73,4,2,0,0,0,0,0,0,0,0,0,0,121,0,0,0,0,47,0,4,0,8,0,0,0,0,0,0,0,0,0,0,17,0,0,8,0,0,15,0,0,0,29,0,5,95,0,0,0,0,0,1,0,0,0,21,0,4,0,0,0,0,0,0,0,0,0,0,0
"SWE_039_MZB_LO_10","SWE_039_MZB_LO_10-03.11.2006","03.11.2006",2006,11,3,0,0,0,0,0,0,0,0,0,0,0,0,0,0.8,0,0,0,0,0,7.6,0,0,0,0,1.6,0,70.4,0,0,0.2,0,0,0,0.8,0,0,0,0,0,0,0,0,0,0,22.6,0,0,0,0,0,0,0.4,0,0,0,0.2,0,0,0,0,0,0,0,0,0,0,0.4,0,0,0,0,0,0,0,0,0.4,1.2,0,0,0,0,0,0.2,0,0,0,0,0.6,0,0,0,0,0,0,0,0,0,2.8,0,0,0,0,0,0,0,0,0,0,0,0,0,0,0.6,0,0,0,0,0,0,0,0,0,0,0,0,0,0,0,0,0,0,0,0,0,0,0,0,0,0,0,0,0,0,0,0,0,0,0,0
"SWE_039_MZB_LO_10","SWE_039_MZB_LO_10-15.11.2007","15.11.2007",2007,11,15,0,0,0,0,0,0,0,0,0,0,0,0,0,0,0,0,0,0,0,3.2,0,0,0,0,2.6,0,32.8,0,0,0,0,0,0,0,0,0,0,0,0,0,0,0,0,0,5,0,0,0,1.8,0,0,0,0,0,0,0,0,0,0,0,0,0,0,0,0,0,0,0,0,0,0,0,0,0,0,0.8,0,0,0,0,0,0,0,0,0,0,0,0,0,0,0,0,0,0,0,0,0,7,0,0,0,0,0,0,0,0,0,0,0,0,0,0,1,0,0,0,0,0,0,0,0,0,0,0,0,0,0,0,0,0,0,0.6,0,0,0,0,0,0,0,0,0,0,0,0,0,0,0,0,0
"SWE_039_MZB_LO_10","SWE_039_MZB_LO_10-17.10.2008","17.10.2008",2008,10,17,0,0,0,0,0,0,0,0,0,0,0,0,0,0,0,0,0,0,0,0,0,0,0,0,3,0,22.2,0,0,0,0,0,0,0,0,0,0,0,0,0,0,0,0,0,1,0,0,0,0.6,0,0,0,0,0,0,0,0,0,0,0,0,0,0,0,0,0,0.2,0,0.2,0,0,0,0,0,0,0.2,0,0,0,0,0,0,0,0,0,0,0,0,0,0,10,0,0,0,0,0,0,4.2,0,0,0,0,0,0,0,0,0,0,0,0,0,0,0.2,0,0,0,0,0,0,0,0,0,0,0,0,0,0,0,0,0,0,0.4,0,0,0,0,0,0,0,0,0,0,0.2,0,0,0,0,0,0
"SWE_039_MZB_LO_10","SWE_039_MZB_LO_10-28.10.2010","28.10.2010",2010,10,28,0,0,0,0,0,0,0,0,0,0,0,0,0,0,0,0,0,0,0,0.6,0,0,0,0,1,0,3.2,0,0,0,0,0,0,0,0,0,0,0,0,0,0,0,0,0,0,0,0,0,0,0,0,0,0,0,0,0,0,0,0,0,0,0,0,0.8,0,0,0,0,0,0,0,0,0,0,0,0.4,0,0,0,0,0,0,0,0,0,0,0,0,0,0,1.2,0,0,0,0,0,0,4,0,0,0,0,0,0,0,0,0,0,0,0,0,0,2.4,0,0,0,0,0,0,0,0,0,0,0,0,0,0,0,0,0,0,1.6,0,0,0,0,0,0,0,0,0,0,0.4,0,0,0,0,0,0
"SWE_039_MZB_LO_10","SWE_039_MZB_LO_10-27.10.2011","27.10.2011",2011,10,27,0,0,0,0,0,0,0,0,0,0,0,0,0,0,0,0,0,0,0,0.4,0,0,0,0,0,0,2.4,0,0,0,0,0,0,0,0,0,0,0,0,0,0,0,0,0,0,0,0,0,0,0,0,0,0,0,0,0,0,0,0,0,0,0,0,0,0,0,0,0,0,0,0,0,0,0,0,0.4,0,0,0,0,0,0,0,0,0,0,0,0,0,0,1.2,0,0,0,0,0,0,5.8,0,0,0,0,0,0,0,0,0,0,0,0,0,0,1.8,0,0,0,0,0,0,0,0,0,0,0,0,0,0,0,0,0,0,1.8,0,0,0,0,0,0,0,0,0,0,0.6,0,0,0,0,0,0
"SWE_039_MZB_LO_10","SWE_039_MZB_LO_10-25.10.2012","25.10.2012",2012,10,25,0,0,0,0,0,0,0,0,0,0,0,0,0,0,0,0,0,0,0,6.4,0,0,0,0,4.4,0,25,0,0,0,0,0,0,0,0,0,0,0,0,0,0,0,0,0,0.4,0,0,0,1.2,0,0,0,0,0,0,0.6,0,0,0,0,0,0,0,0,0,0,0,0,0,0,0,0,0,0,0,2.6,0,0,0,0,0,0,0,0,0,0,0,0.2,0,0,1.4,0,0,0,0,0,0,5.2,0,0,0,0,0,0,0,0,0,0,0,0,0,0,2.6,0,0,0,0,0,0,0,0,0,0,0,0,0,0,0,0,0,0,2,0,0,0,0,0,0,0,0,0,0,0.2,0,0,0,0,0,0
"SWE_039_MZB_LO_10","SWE_039_MZB_LO_10-16.10.2013","16.10.2013",2013,10,16,0,0,0,0,0,0,0,0,0,0,0,0,0,0,0,0,0,0,0,1.4,0,0,0,0,0.8,0,4.8,0,0,0,0,0,0,0,0,0,0,0,0,0,0,0,0,0,0.2,0,0,0,0.6,0,0,0,0,0,0,0,0,0,0,0,0,0,0,0,0,0,0,0,0,0,0,0,0,0,0,0,0,0,0,0,0,0,0,0,0,0,0,0,0,0,3.4,0,0,0,0,0,0,13,0,0,0,0,0,0,0,0,0,0,0,0,0,0,0,0,1.2,0,0,0,0,0,0,0,0,0,0,0,0,0,0,0,0,1.6,0,0,0,0,0,0,0,0,0,0,0,0,0,0,0,0,0
"SWE_039_MZB_LO_10","SWE_039_MZB_LO_10-17.10.2014","17.10.2014",2014,10,17,0,0,0,0,0,0,0,0,0,0,0,0,0,0,0,0,0,0,0,0.2,0,0,0,0,1.8,0.4,14,0,0,0,0,0,0,0,0,0,0,0,0,0,0,0,0,0,0.4,0,0,0,0.2,0,0,0,0,0,0,0,0,0,0,0,0,0,0,0,0,0,0,0,0,0,0,0,0,0,0,1.2,0.4,0,0,0,0,0,0,0,0,0,0,0,0,0,0,0,0,0,0,0,0,3,0,0,0,0,0,0,0,0,0,0,0,0,0,0,0,0,0,0,0,0,0,0,0,0,0,0,0,0,0,0,0,0,0,0.6,0,0,0,0,0,0,0,0,0,0,0,0,0,0,0,0,0
"SWE_039_MZB_LO_10","SWE_039_MZB_LO_10-06.11.2015","06.11.2015",2015,11,6,0,0,0,0,0,0,0,0,0,0,0,0,0,0,0,0,0,0,0,0,0,0,0,0,3.6,0.2,66.8,0,0,0,0,0,0,0,0,0,0,0,0,0,0,0,0,0,0,0,0,0,0.4,0,0,0,0,0,0,0,0,0,0,0,0,0,0,0,0,0,0,0,0,0,0,0,0,0,0,1.4,0,0,0,0,0,0,0,0,0,0,0,0.2,0,0,0.2,0,0,0,0,0,0,2,0,0,0,0,0,0,0,0,0,0,0,0,0,0,0.6,0,0,0,0,0,0,0,0,0,0,0,0,0,0,0,0,0,0,0.6,0,0,0,0,0,0,0,0,0,0,0,0,0,0,0,0,0
"SWE_039_MZB_LO_10","SWE_039_MZB_LO_10-02.11.2017","02.11.2017",2017,11,2,0,0,0,0,0,0,0,0,0,0,0,0,0,0,0,0,0,0,0,0.2,0,0,0,0,2,0,9.4,0,0,0,0,0,0,0,0,0,0,0,0,0,0,0,0,0,0,0,0,0,0.4,0,0,0,0,0,0,0,0,0,0,0,0,0,0,0,0,0.2,0,0,0,0,0,0,0,0,0,0.2,0,0,0,0,0,0,0,0,0,0,0,0,0,0,4.2,0,0,0,0,0,0,6.2,0,0,0,0,0,0,0,0.2,0,0.2,0,0,0,0,1.6,0,0,0,0,0,0,0,0,0,0,0,0,0,0,0,0,0,0,3,0,0,0,0,0,0,0,0,0,0,0,0,0,0,0,0,0
"SWE_039_MZB_LO_11","SWE_039_MZB_LO_11-17.05.2006","17.05.2006",2006,5,17,0,0,2.4,0,0,0,0,0,0,0,4.2,0,0,60.2,0,0,0,0,0,0,0,0,0,0,1.2,0,52.8,0,0,0,0,1,0,0,0,0,0,0.6,0,0,0,0,0,0,0,1.4,0,1.8,0,0,0,0.2,0,0,0,0,0,0,0,0,0,0,0,0,0,0,0.4,0,0,0,0,50.8,0,0,0,0.4,0,64.4,0,58.2,170.4,4,0,0,0,0,0,0,0,0,0,0,11.8,0.2,0,0,0,5.2,8.4,2,0,1,0,0,0,0,0,0.6,0,0,0,1.4,2.6,0,0,0,0,0,0.4,0,0,0,1.6,0,0,3,0,0,0,0,0,37.2,0,0,0,0,0,0,0,0,0,0,0,0,0,0,0,0,0
"SWE_039_MZB_LO_11","SWE_039_MZB_LO_11-10.04.2007","10.04.2007",2007,4,10,0,0,9.8,0,0,0,0,0,0,0,6.2,0,0,98.6,0,0,0,0,0,0.2,0,0,0,0,1.2,0,26.2,0,0,0,0,1,0,0,0,0,0,0.4,0,0,0,0,0,0,0,15.6,0.2,2,0,0,0,0,0,0,0,0,0,0,0,0,0,0,0,0,0,0,0.2,0.2,0,0,0,66.2,0,0,0,0,1.2,11.8,0,4.6,348,2.4,0,0,0,0,0,0,0,1.8,0,0,30.8,0,0,0,0,11.2,5.8,0.4,0,5.2,0,0,0,0,0,0,0,0,0,0.8,1.6,0,0,0.8,0,0,1,0,0,0,1.6,0,0,9.8,0,0,0,0,0,57,0,0,0,0,0,0,0,0,0,0,0,0,0,0,0,0,0
"SWE_039_MZB_LO_11","SWE_039_MZB_LO_11-21.05.2008","21.05.2008",2008,5,21,0,0,0,0,0,0,0,0,0,0,0.2,0,0,31.4,0,0,0,0,0,0,0,0,0,0,0.4,0,33.6,0,0,0,0,1.2,0,0,0,0,0,0,0,0,0,0,0,0,0,3.8,0,0,0,0,0,0,0,0,0,0,0,0,0,0,0,0,0,0,0,0,0.2,0.2,0,0,0,18.8,0.2,0,0,0,0,40.8,0,3.4,117,1.6,0,0,0,0,0,0,0,0,0,0,0,0,0,0,0,2.8,11.6,0.6,0,0,0,0,0,0,0,0,0,0,0,0,0,0,0,0.4,0,0,0.6,0,0,0,0.4,0,0,1.4,0,0,0,0,0,27.4,0,0,0,0,0,0,0,0,0,0,0,0,0,0,0,0,0
"SWE_039_MZB_LO_11","SWE_039_MZB_LO_11-28.04.2009","28.04.2009",2009,4,28,0,0,12.2,0,0,0,0,0,0,0,1,0,0,33.8,0,0,0,0,0,0,0,0,0,0,2.4,0,22.6,0,0,0,0,4,0,0,0,0,0,0,0,0,0,0,0,0,0,9.8,0,0.4,0,0,0,0,0,0,0,0.2,0,0,0,0,0,0,0,0,0,0,0,0.2,0,0,0,100.6,0,0,0,0.2,0,0.6,0,20.4,106.4,0.2,0,0,0,0,0,0,0,0.6,0,0,5.8,0,0,0,0,10.8,5.8,3.6,0,4.2,0,0,0,0,0,0,0,0,0,0.2,5.2,0,0,0,0,0,1.6,0,0,0,3.2,0,0,1.8,0,0,0,0,0,11.8,0,0,0,0,0,0,0,0,0,0,0,0,0,0,0,0,0
"SWE_039_MZB_LO_11","SWE_039_MZB_LO_11-06.05.2010","06.05.2010",2010,5,6,0,0,12.8,0,0,0,0,0,0,0,8,0,0,24.8,0,0,0,0,0,0,0,0,0,0,8.8,0,70,0,0,0,0,1.2,0,0,0,0,0,0.2,0,0,0,0,0,0,0,32.6,0.2,3,0,0,0,0,0,0,0,0,0,0,0,0,0,0,0,0,0,0,0,0.4,0.2,0,0,133.8,0,0,0,2.8,0,1,0,15.6,351.8,0,0,0,0,0,0,0,0,13.8,0,0,15,0,0,0,0,32.2,1.4,4.4,0,0.2,0,0,0,0,0,0,0,0,0,1.2,3.6,0,0,0,0,0,0.4,0,0,0,0.2,0,0,15.6,0,0,0,0,0,189.8,0,0,0,0,0,0,0,0,0,0.4,0,0,0,0,0,0,0.2
"SWE_039_MZB_LO_11","SWE_039_MZB_LO_11-27.04.2011","27.04.2011",2011,4,27,0,0,2,0,0,0,0,0,0,0,5.4,0,0,2.8,0,0,0,0,0,0.2,0,0,0,0,2.8,0,13.4,0,0,0,0,2.6,0,0,0,0,0,0,0,0,0,0,0,0,0,16.4,0,1.4,0,0,0,0,0,0,0,0,0,0.2,0,0,0,0,0,0,0,0,0,0,0,0,0,32.2,0,0,0,0.8,0.2,0,0,18.4,194.8,0.4,0,0,0,0,0,0,0,0.8,0,0,32,0,0,0,0,7.2,3,2.8,0,0,0,0,0,0,0,0,0,0,0,1,0.2,0,0,0.2,0,0,0,0,0,0,0.2,0,0,4,0,0,0,0,0,58,0,0,0,0,0,0,0,0,0,0.4,0,0,0,0,0,0,0
"SWE_039_MZB_LO_11","SWE_039_MZB_LO_11-19.04.2012","19.04.2012",2012,4,19,0,0,6,0,0,0,0,0,0,0,2,0,0,3.2,0,0,0,0,0,0,0,0,0,0,6,0,29.8,0,0,0,0,3.8,0,0,0,0,0,0,0,0,0,0,0,0,0,43.6,0,3.2,0,0,0,0,0,0,0,0,0,0.2,0,0,0,0,0,0,0,0,0.2,0,0,0,0,28,0,0,0,0.2,0,1.8,0,3.6,137.4,0.2,0,0,0,0,0,0,0,0.4,0,0,10.6,0,0,0,0,9.4,23.8,6.8,0,0,0,0,0,0,0,0,0,0,0,0.2,0.4,0,0,0.6,0,0,0,0,0,0,0,0,0,5.6,0,0,0,0,0,118,0,0,0,0,0,0,0,0,0,0.6,0,0,0,0,0,0,0
"SWE_039_MZB_LO_11","SWE_039_MZB_LO_11-13.05.2013","13.05.2013",2013,5,13,0,0,0.2,0,0,0,0,0,0,0,0.2,0,0,0,0,0,0,0,0,0,0,0,0,0,0,0,1.4,0,0,0,0,2.2,0,0,0,0,0,0,0,0,0,0,0,0,0,5.8,0,0,0,0,0,0,0,0,0,0,0,0,0,0,0,0,0,0,0,0,0.2,0,0,0,0,1,0,0,0,0,0,0.2,0,2.2,81.6,0,0,0,0,0,0,0,0,0,0,0,1.6,0,0,0,0,10.6,2.8,1.4,0,0.2,0,0,0,0,0,0,0,0,0,0.2,0,0,0,0,0,0,0,0,0,0,0,0,0,0,0,0,0,0,0,63.4,0,0,0,0,0,0,0,0,0,0,0,0,0,0,0,0,0
"SWE_039_MZB_LO_11","SWE_039_MZB_LO_11-15.04.2014","15.04.2014",2014,4,15,0,0,0,0,0,0,0,0,0,0,2.4,0,0,0.2,0,0,0,0,0,0,0,0,0,0,2.2,0,38.6,0,0,0,0,2,0,0,0,0,0,0,0,0,0,0,0,0,0,102.6,0,2,0,0,0,0,0,0,0,0,0,0.2,0.4,0,0,0,0,0,0,0,0,0,0,0,0,7.2,0,0,0,0,2.6,3.6,0,4,220,0,0,0,0,0,0,0,0,0.6,0,0,133.8,0,0,0,0,42,7.4,0.4,0,0.2,0,0,0,0,0,0,0,0,0,0,0.4,0,0,0,0,0,0,0,0,0,0.2,0,0,32.6,0,0,0,0,0,15.2,0,0,0,0,0,0,0,0,0,0.2,0,0,0,0,0,0,0
"SWE_039_MZB_LO_11","SWE_039_MZB_LO_11-14.04.2015","14.04.2015",2015,4,14,0,0,0,0,0,0,0,0,0,0,2.4,0,0,5,0,0,0,0,0.8,0.2,0,0,0,0,7.6,0,56.4,0,0,0,0,2,0,0,0,0,0,0,0,0,0,0,0,0,0,19.8,0,3,0,0,0,0,0,0,0,0,0,0.2,0,0,0,0,0,0,0,0.6,0,0,0,0,0,3.6,0,0,0,1,7.2,4.2,0,6.4,76,0,0,0,0,0,0,0,0,2.2,0.2,0,25,0,0,0,0,15.2,13,0.6,0,0.2,0,0,0,0,0,0,0,0,0,0,1,0,0,0.2,0,0,0,0,0,0,0,0,0,36.8,0,0,0,0,0,12.4,0,0,0,0,0,0,0,0,0,0,0,0,0,0,0,0,0
"SWE_039_MZB_LO_11","SWE_039_MZB_LO_11-26.04.2016","26.04.2016",2016,4,26,0,0,0,0,0,0,0,0,0,0,1,0,0,0.2,0,0,0,0,0,0,0,0,0,0,0,0,92.8,0,0,0,0,5.6,0,0,0,0,0,0,0,0,0,0,0,0,0,13,0,1.2,0,0,0,0,0,0,0,0,0,0,0,0,0,0,0,0.2,0,0,0,0,0,0,0,1,0,0,0,0.2,0.4,1.8,0,4.4,89.6,0,0,0,0,0,0,0,0,0,0,0,0.6,0,0,0,0,19.2,8,0.4,0,0,0,0,0,0,0,0,0,0,0,0,0.8,0,0,0,0,0,0,0,0,0,0,0,0,20.8,0,0,0,0,0,94.2,0,0,0,0,0,0,0,0,0,0.2,0,0,0,0,0,0,0
"SWE_039_MZB_LO_11","SWE_039_MZB_LO_11-24.04.2017","24.04.2017",2017,4,24,0,0,0,0,0,0,0,0,0,0,8.6,0,0,0,0,0,0,0,0.6,0,0,0,0,0,1.2,0,51,0,0,0,0,1,0,0,0,0,0,0,0,0,0,0,0,0,0,16,0,1.2,0,0,0,0,0,0,0,0,0,0,0,0,0,0,0,0,0,0,0,0,0,0,0,0.8,0,0,0,0.6,0,2.4,0,6.6,31.2,1.2,0,0,0,0,0,0,0,0.4,0,0,25.4,0,0,0,0,30.8,4,0,0,0,0,0,0,0,0,0,0,0,0,0,0.2,0,0,0,0,0,0,0,0,0,0,0,0.2,32.2,0,0,0,0,0,10.6,0,0,0.2,0,0,0,0,0,0,0,0,0,0,0,0,0,0
"SWE_039_MZB_LO_11","SWE_039_MZB_LO_11-18.04.2018","18.04.2018",2018,4,18,0,0,0,0,0,0,0,0,0,0,13.2,0,0,0,0,0,0,0,0,0,0,0,0,0,9.8,0,186.2,0,0,0,0,1.4,0,0,0,0,0,0,0,0,0,0,0,0,0,4.4,0,1.8,0,0,0,0,0,0,0,0,0,0,0,0,0,0,0,0.2,0,0,0,0,0,0,0,0,0,0,0,1.2,0.4,0,0,4.6,10.8,2.2,0,0,0,0,0,0,0,0.8,0.2,0,35.2,0,0,0,0,14.2,2.2,0,0,0,0,0,0,0,0,0,0,0,0,0,1,0,0,0,0.4,0,0,0,0,0,0,0,0.2,119.4,0,0,0,0,0,22.4,0,0,0.2,0,0,0.4,0,0,0,0,0,0,0,0,0,0,0
"SWE_039_MZB_LO_13","SWE_039_MZB_LO_13-10.09.2005","10.09.2005",2005,9,10,0,0,0,0,1,0,11,0,0,0,0,0,0,140,0,0,0,0,0,0,0,0,0,5,54,0,212,0,0,0,0,0,0,2,0,0,0,0,0,0,0,0,0,4,0,426,1,17,0,9,0,0,0,0,0,1,0,1,0,0,0,0,0,21,0,33,0,6,0,0,0,8,87,0,40,0,21,111,0,56,2,6,193,0,0,0,0,0,0,0,7,0,156,0,0,0,0,111,0,0,0,1,0,0,0,0,0,0,0,0,0,0,9,0,0,18,0,0,15,0,0,0,28,6,4,9,0,1,0,0,0,2,0,0,0,11,0,0,0,0,0,5,0,0,0,0,0,0,0
"SWE_039_MZB_LO_13","SWE_039_MZB_LO_13-21.09.2006","21.09.2006",2006,9,21,0,0,0,0,3,0,0,0,0,0,0,0,0,78,0,0,0,0,0,0,0,0,1,2,47,0,144,0,0,0,0,0,0,1,0,0,0,0,0,0,0,0,0,26,0,329,6,6,0,47,0,0,0,0,0,0,0,2,0,0,0,0,0,90,0,21,0,0,0,0,0,12,111,0,58,0,58,68,0,174,0,1,79,0,0,0,0,0,1,0,0,0,229,0,0,0,0,62,0,2,0,7,0,0,0,0,0,0,0,0,0,0,48,0,0,28,0,0,27,0,0,0,61,1,14,45,0,0,0,0,0,0,0,0,0,7,0,0,0,1,0,0,0,0,0,0,0,0,0
"SWE_039_MZB_LO_13","SWE_039_MZB_LO_13-28.09.2007","28.09.2007",2007,9,28,0,0,0,0,9,0,5,0,0,0,0,0,0,254,0,0,0,0,0,0,0,0,0,10,62,0,245,0,0,0,0,0,0,26,0,0,0,0,0,0,0,0,0,4,0,280,0,12,0,9,0,0,0,0,0,0,0,1,0,0,0,0,0,56,0,34,0,2,0,0,0,8,168,0,33,0,45,82,0,106,0,5,194,0,0,0,0,0,0,0,0,0,270,0,0,0,0,54,0,2,0,4,0,0,0,0,0,0,0,0,0,0,18,0,0,6,0,0,20,0,0,0,64,0,2,16,0,2,0,0,0,2,0,0,0,0,0,0,0,0,0,0,0,0,0,0,0,0,0
"SWE_039_MZB_LO_13","SWE_039_MZB_LO_13-18.09.2008","18.09.2008",2008,9,18,0,0,0,0,3,0,4,0,0,0,0,0,0,179,0,0,0,0,0,1,0,0,5,3,58,0,243,0,0,0,0,0,0,6,0,0,0,0,0,0,0,0,0,9,0,324,4,11,1,20,0,0,0,0,0,0,0,2,0,0,0,0,0,43,0,11,0,0,0,0,0,4,193,0,36,1,85,61,0,72,0,4,137,0,0,0,0,0,0,0,2,0,220,0,0,0,0,84,0,3,0,6,0,0,0,0,0,0,0,0,0,0,23,0,0,8,0,0,37,0,0,0,93,11,7,18,0,1,0,0,0,4,0,0,0,38,0,0,0,0,0,5,0,0,0,0,0,0,0
"SWE_039_MZB_LO_13","SWE_039_MZB_LO_13-21.09.2009","21.09.2009",2009,9,21,0,0,0,0,1,0,2,0,0,0,0,0,0,68,0,0,0,0,1,0,0,0,5,7,64,0,216,0,0,0,0,0,0,13,0,0,0,0,0,0,0,0,0,1,0,328,1,12,1,5,0,0,0,0,0,0,0,7,0,0,0,0,0,63,0,23,0,4,0,0,0,1,78,0,61,1,21,98,0,72,3,2,335,0,0,0,0,0,0,0,2,0,237,0,0,0,0,96,0,4,0,7,1,0,0,0,0,0,0,0,0,0,26,0,0,6,2,0,15,0,0,0,133,3,18,14,0,3,0,0,0,5,0,0,0,5,0,0,0,0,0,2,0,0,0,0,0,0,0
"SWE_039_MZB_LO_13","SWE_039_MZB_LO_13-18.09.2010","18.09.2010",2010,9,18,0,0,0,0,4,0,5,0,0,0,0,0,0,16,0,0,0,0,0,0,0,0,0,7,47,0,159,0,0,0,0,0,0,4,0,0,0,0,0,0,0,0,0,6,0,164,1,11,0,61,0,0,0,0,0,1,0,2,0,0,0,0,0,59,0,10,0,1,0,0,0,1,18,0,33,2,7,62,0,70,3,2,41,0,0,0,1,0,0,0,2,0,136,0,0,0,0,73,1,2,0,5,0,0,0,0,0,0,0,0,0,0,6,0,0,1,0,0,11,0,0,0,60,18,5,11,0,1,0,0,0,0,0,0,0,45,0,0,0,0,0,2,0,0,0,0,0,0,0
"SWE_039_MZB_LO_13","SWE_039_MZB_LO_13-01.10.2011","01.10.2011",2011,10,1,0,0,0,0,2,0,0,0,0,0,0,0,0,75,0,0,0,0,0,0,0,0,0,12,51,0,140,0,0,0,0,0,0,3,0,0,0,0,0,0,0,0,0,6,0,157,4,3,0,19,0,0,0,0,0,0,0,4,0,0,0,0,0,31,0,12,0,1,0,0,0,1,40,0,31,0,5,139,0,86,1,2,59,0,0,0,0,0,1,0,0,0,172,0,0,0,0,83,0,2,0,7,0,0,0,0,0,0,0,0,0,0,21,0,0,1,0,0,11,0,0,0,124,2,5,9,0,3,0,0,0,1,0,0,0,1,0,0,0,0,0,3,0,0,0,0,0,0,0
"SWE_039_MZB_LO_13","SWE_039_MZB_LO_13-23.09.2012","23.09.2012",2012,9,23,0,0,0,0,1,0,1,0,0,0,0,0,0,29,0,0,0,0,0,0,0,0,1,4,26,0,142,0,0,0,0,0,0,4,0,0,0,0,0,0,0,0,0,7,0,124,4,8,0,53,0,0,0,0,0,1,0,0,0,0,0,0,0,29,0,21,0,0,0,0,0,0,22,0,40,0,2,161,0,125,0,1,69,0,0,0,0,0,0,0,1,0,244,0,0,0,0,88,0,5,0,3,0,0,0,0,0,0,0,0,0,0,9,0,0,1,0,0,16,0,0,0,163,13,13,45,0,0,0,0,0,2,0,0,0,18,0,0,0,0,0,4,0,0,0,0,0,0,0
"SWE_039_MZB_LO_13","SWE_039_MZB_LO_13-23.09.2013","23.09.2013",2013,9,23,0,0,0,0,3,0,1,0,0,0,0,0,0,201,0,0,0,0,0,0,0,0,0,9,28,0,300,0,0,0,0,0,0,0,0,0,0,0,0,0,0,0,0,8,0,154,1,3,0,28,0,0,0,0,0,2,0,1,0,0,0,0,0,19,0,14,0,3,0,0,0,10,42,0,53,0,16,146,0,46,1,1,101,0,0,0,0,0,2,0,0,0,266,0,0,0,0,54,0,5,0,11,0,0,0,0,0,0,0,0,0,0,36,0,0,0,0,0,16,0,0,0,131,5,13,7,0,1,0,0,0,2,0,0,0,5,0,0,0,0,0,4,0,0,0,0,0,0,0
"SWE_039_MZB_LO_13","SWE_039_MZB_LO_13-21.09.2014","21.09.2014",2014,9,21,0,0,0,0,1,0,4,0,0,0,0,0,0,70,0,0,0,0,0,0,0,0,5,9,15,0,133,0,0,0,0,0,0,1,0,0,0,0,0,0,0,0,0,2,0,132,0,12,0,30,0,0,0,0,0,0,0,7,0,0,0,0,0,132,0,6,0,0,0,0,0,0,47,0,24,0,11,67,0,32,1,0,97,0,0,0,0,0,4,0,0,0,200,0,0,0,0,51,0,0,0,5,0,0,0,0,0,0,0,0,0,0,23,0,0,3,0,0,10,0,0,0,150,2,7,7,0,0,0,0,0,1,0,0,0,12,0,0,0,0,0,0,0,0,0,0,0,0,0
"SWE_039_MZB_LO_13","SWE_039_MZB_LO_13-04.09.2016","04.09.2016",2016,9,4,0,0,0,0,0,0,0,0,0,0,0,0,0,80,0,0,0,0,0,0,0,0,5,0,41,0,93,0,0,0,0,0,0,0,0,0,0,0,0,0,0,0,0,2,0,139,0,11,0,39,0,0,0,0,0,0,0,0,0,0,0,0,0,19,0,17,0,0,0,0,0,0,39,0,38,0,6,131,0,73,1,5,65,0,0,0,0,0,0,0,0,0,274,0,0,0,0,58,0,2,0,7,0,0,0,0,0,0,0,0,0,0,30,0,0,1,0,0,26,0,0,0,116,12,11,10,1,0,0,0,0,2,0,0,0,13,0,1,0,0,0,2,0,0,0,0,0,0,0
"SWE_039_MZB_LO_13","SWE_039_MZB_LO_13-07.09.2017","07.09.2017",2017,9,7,0,0,0,0,2,0,3,0,0,0,0,0,0,28,0,0,0,0,0,0,0,0,3,2,17,0,69,0,0,0,0,0,0,0,0,0,0,0,0,0,0,0,0,2,0,64,3,3,0,10,0,0,0,0,0,2,0,2,0,0,0,0,0,12,0,14,0,0,0,0,0,0,68,0,33,0,3,139,0,106,0,4,56,0,0,0,0,0,0,0,1,0,176,0,0,0,0,44,0,1,0,0,0,0,0,0,0,0,0,0,0,0,22,0,0,0,0,0,9,0,0,0,73,17,11,12,0,0,0,0,0,1,0,0,0,16,0,0,0,0,0,4,0,0,0,0,0,0,0
"SWE_039_MZB_LO_13","SWE_039_MZB_LO_13-06.09.2018","06.09.2018",2018,9,6,0,0,0,0,1,0,2,0,0,0,0,0,0,126,0,0,0,0,0,0,0,0,2,3,15,0,102,0,0,0,0,0,0,3,0,0,0,0,0,0,0,0,0,5,0,112,0,9,0,3,0,0,0,0,0,0,0,2,0,0,0,0,0,30,0,0,0,0,0,0,0,7,191,0,20,0,20,57,0,34,1,5,59,0,0,0,0,0,0,0,0,0,130,0,0,0,0,23,0,0,0,4,0,0,0,0,0,0,0,0,0,0,55,0,0,1,0,0,17,0,0,0,82,0,9,12,0,1,0,0,0,2,0,0,0,21,0,0,0,0,0,3,0,0,0,0,0,0,0
"SWE_039_MZB_LO_13","SWE_039_MZB_LO_13-30.09.2019","30.09.2019",2019,9,30,0,0,0,0,0,0,1,0,0,0,0,0,0,27,0,0,0,0,0,0,0,0,0,5,4,0,73,0,0,0,0,0,0,0,0,0,0,0,0,0,0,0,0,2,0,64,1,1,0,2,0,0,0,0,0,0,0,1,0,0,0,0,0,8,0,4,0,0,0,0,0,9,5,0,30,0,15,69,0,16,0,4,21,0,0,0,0,0,0,0,0,0,153,0,0,0,0,28,0,2,0,4,0,0,0,0,0,0,0,0,0,0,16,0,0,4,0,0,5,0,0,0,63,4,7,18,0,0,0,0,0,1,0,0,0,26,0,0,0,0,0,1,0,0,0,0,0,0,0
"SWE_039_MZB_LO_14","SWE_039_MZB_LO_14-07.09.2005","07.09.2005",2005,9,7,0,0,0,0,0,0,0,0,0,0,1,0,0,62,0,0,0,0,0,0,0,0,0,0,27,0,821,0,0,0,0,12,0,0,0,0,0,0,0,0,0,0,0,1,0,16,0,17,0,0,0,0,0,0,0,0,0,47,0,0,0,0,0,2,0,9,0,2,0,0,0,19,3,0,1,0,63,73,0,12,26,5,0,0,0,0,0,0,0,0,4,0,174,0,0,0,0,118,0,3,0,2,0,0,0,0,0,0,0,0,0,0,69,0,0,0,0,0,22,0,0,0,35,0,4,13,0,0,0,0,0,3,0,0,0,22,0,0,0,0,0,1,0,0,0,0,0,0,0
"SWE_039_MZB_LO_14","SWE_039_MZB_LO_14-25.09.2006","25.09.2006",2006,9,25,0,0,6,0,0,0,0,0,0,0,6,0,0,96,0,0,0,0,0,0,0,0,0,1,17,0,301,0,0,0,0,13,0,0,0,0,0,0,0,0,0,0,0,0,0,20,3,9,0,0,0,0,0,0,0,3,0,79,0,0,0,1,0,0,0,10,0,6,0,0,0,80,0,0,0,3,12,105,0,115,12,4,1,0,0,0,0,0,0,0,2,0,130,0,0,0,0,49,0,3,0,9,0,0,0,0,0,0,0,0,0,0,22,0,0,0,0,0,15,0,0,0,18,0,0,11,0,0,0,0,0,6,0,0,0,3,0,0,0,0,0,0,0,0,0,0,0,0,0
"SWE_039_MZB_LO_14","SWE_039_MZB_LO_14-03.10.2007","03.10.2007",2007,10,3,0,0,6,0,0,0,0,0,0,0,3,0,0,67,0,0,0,0,1,0,1,1,0,0,20,0,907,0,0,0,0,2,0,0,0,0,0,0,0,0,0,0,0,1,0,12,0,7,0,0,0,0,0,0,0,0,0,57,0,1,0,0,0,2,0,3,0,3,0,0,0,22,2,0,0,3,26,97,0,92,9,10,4,0,0,0,0,0,0,0,0,0,111,0,0,0,0,52,0,5,0,5,0,0,0,0,0,0,0,0,0,0,32,0,0,3,0,0,23,0,0,0,47,0,1,26,0,0,0,0,0,5,0,0,0,2,0,2,0,0,0,0,0,0,0,0,0,0,0
"SWE_039_MZB_LO_14","SWE_039_MZB_LO_14-25.09.2008","25.09.2008",2008,9,25,0,0,7,0,0,0,0,0,0,0,7,0,0,22,0,0,0,0,1,0,1,1,0,1,4,0,137,0,0,0,0,0,0,0,0,0,0,0,0,0,0,0,0,0,0,7,4,5,0,0,0,0,0,0,0,1,0,34,0,0,0,0,0,0,0,2,0,1,0,0,0,36,0,0,1,0,19,65,0,44,8,2,0,0,0,0,0,0,0,0,0,0,104,0,0,0,0,28,0,7,0,7,0,0,0,0,0,0,0,0,0,0,46,0,0,0,0,0,16,0,0,0,5,0,0,23,0,0,0,0,0,1,0,0,0,0,0,1,0,0,0,0,0,0,0,0,0,0,0
"SWE_039_MZB_LO_14","SWE_039_MZB_LO_14-28.09.2009","28.09.2009",2009,9,28,0,0,14,0,0,0,0,0,0,0,13,0,0,19,0,0,0,0,1,0,1,1,0,0,6,0,40,0,0,0,0,0,0,0,0,0,0,0,0,0,0,0,0,0,0,6,5,2,0,0,0,0,0,0,0,2,0,26,0,0,0,0,0,1,0,0,0,8,0,0,0,1,0,0,0,2,4,144,0,135,55,1,0,0,0,0,0,0,0,0,0,0,143,0,0,0,0,24,0,3,0,10,0,0,0,0,0,0,0,0,0,0,12,0,0,0,0,0,16,0,0,0,9,0,0,15,0,3,0,0,0,0,0,0,0,8,0,0,0,0,0,0,0,0,0,0,0,0,0
"SWE_039_MZB_LO_14","SWE_039_MZB_LO_14-23.09.2010","23.09.2010",2010,9,23,0,0,75,0,0,0,0,0,0,0,2,0,0,14,0,0,0,0,0,0,2,2,0,1,3,0,35,0,0,0,0,0,0,0,0,0,0,0,0,0,0,0,0,0,0,11,1,6,0,0,0,0,0,0,0,0,0,47,0,0,0,0,0,5,0,1,0,5,0,0,0,37,2,0,0,2,1,57,0,37,29,1,0,0,0,0,0,0,0,0,0,0,121,0,0,0,0,38,0,1,0,3,0,0,0,0,0,0,0,0,0,0,15,0,0,0,1,0,21,0,0,0,25,0,0,15,0,4,0,0,0,3,0,0,0,3,0,0,0,0,0,0,0,0,0,6,0,0,0
"SWE_039_MZB_LO_14","SWE_039_MZB_LO_14-28.09.2011","28.09.2011",2011,9,28,0,0,156,0,0,0,0,0,0,0,1,0,0,12,0,0,0,0,1,0,0,0,0,4,3,0,82,0,0,0,0,1,0,0,0,0,0,0,0,0,0,0,0,0,0,10,8,7,0,0,0,0,0,0,0,0,0,57,0,0,0,0,0,13,0,1,0,15,0,0,0,34,3,0,1,0,5,99,0,51,28,4,0,0,0,0,0,0,0,0,0,0,201,0,0,0,0,47,0,14,0,14,0,0,0,0,0,0,0,0,0,0,15,0,0,0,0,0,11,0,0,0,19,0,0,23,0,7,0,0,0,8,0,0,0,3,0,0,0,0,0,1,0,0,0,0,0,0,0
"SWE_039_MZB_LO_14","SWE_039_MZB_LO_14-26.09.2012","26.09.2012",2012,9,26,0,0,37,0,0,0,0,0,0,0,19,0,0,12,0,0,0,0,0,0,0,0,0,1,2,0,50,0,0,1,0,6,0,0,0,0,0,0,0,0,0,0,0,0,0,6,5,6,0,0,0,0,0,0,0,1,0,16,0,0,0,0,0,4,0,0,0,3,0,0,0,1,0,0,0,6,14,110,0,205,28,5,0,0,0,0,0,0,0,0,2,0,148,0,0,0,0,34,0,9,0,5,0,0,0,0,0,0,0,0,0,0,7,0,0,0,0,0,11,0,0,0,10,0,0,12,0,1,0,0,0,1,0,0,1,7,0,2,0,0,0,0,0,0,0,0,0,0,0
"SWE_039_MZB_LO_14","SWE_039_MZB_LO_14-27.09.2013","27.09.2013",2013,9,27,0,0,29,1,0,0,0,0,0,0,3,1,0,82,0,0,0,0,2,0,0,0,0,21,2,0,100,0,0,0,0,8,0,0,0,0,0,0,0,0,0,0,0,0,0,3,4,4,0,0,0,0,0,0,0,0,0,4,0,0,0,0,0,19,0,2,0,8,0,0,0,17,4,0,5,2,16,209,0,44,50,14,0,0,0,0,0,0,0,0,1,0,85,0,0,0,0,18,0,8,0,53,0,0,0,0,0,0,0,0,0,0,67,0,0,0,0,0,11,0,0,0,32,0,3,0,0,2,0,0,0,1,0,0,0,0,0,4,0,0,0,1,0,0,0,0,0,0,0
"SWE_039_MZB_LO_14","SWE_039_MZB_LO_14-26.09.2014","26.09.2014",2014,9,26,0,0,79,0,0,0,0,0,0,0,13,0,0,65,0,0,0,0,4,0,0,0,0,7,9,0,116,0,0,0,0,4,0,0,0,0,0,0,0,0,0,0,0,2,0,5,11,2,0,0,0,0,0,0,0,0,0,15,0,0,0,0,0,43,0,4,0,3,0,0,0,60,0,0,8,6,37,80,0,42,71,7,0,0,0,0,0,0,0,0,2,0,118,0,0,0,0,41,0,11,0,17,0,0,0,0,0,0,0,0,0,0,23,0,0,0,0,0,24,0,0,0,20,0,0,39,0,6,0,0,0,7,0,0,0,0,0,5,0,0,0,0,0,0,0,0,0,0,0
"SWE_039_MZB_LO_14","SWE_039_MZB_LO_14-08.10.2015","08.10.2015",2015,10,8,0,0,23,0,0,0,0,0,0,0,26,0,0,46,0,0,0,0,10,0,1,1,0,1,2,0,88,0,0,0,0,0,0,0,0,0,0,0,0,0,0,0,0,0,0,3,23,8,0,0,0,0,0,0,0,0,0,8,0,0,0,0,0,28,0,0,0,6,0,0,0,100,1,0,1,0,4,164,0,44,30,4,1,0,0,0,0,0,0,0,0,0,334,0,0,0,0,35,0,3,0,18,0,0,0,0,0,0,0,0,0,0,4,0,0,0,0,0,30,0,0,0,8,0,0,30,0,1,0,0,0,6,0,0,0,0,0,2,0,0,0,2,0,0,0,0,0,0,0
"SWE_039_MZB_LO_14","SWE_039_MZB_LO_14-18.09.2016","18.09.2016",2016,9,18,0,0,30,0,0,0,0,0,0,0,4,3,0,45,0,0,0,0,3,0,1,1,0,2,1,0,55,0,0,0,0,3,0,0,0,0,0,0,0,0,0,0,0,1,0,1,12,15,0,0,0,0,0,0,0,0,0,10,0,0,0,0,0,38,0,0,0,2,0,0,0,55,0,0,4,4,4,53,0,14,36,2,0,0,0,0,0,0,0,0,0,0,129,0,0,0,0,22,0,7,0,24,1,0,0,0,0,0,0,0,0,0,16,0,0,0,1,0,26,0,0,0,19,0,0,9,0,3,0,0,0,5,0,0,0,0,0,3,0,0,0,0,0,0,0,0,0,0,0
"SWE_039_MZB_LO_14","SWE_039_MZB_LO_14-23.09.2017","23.09.2017",2017,9,23,0,0,151,0,0,0,0,0,0,0,2,1,0,49,0,0,0,0,6,0,0,0,0,9,10,0,77,0,0,0,0,0,0,0,0,0,0,0,0,0,0,0,0,0,0,5,32,0,0,0,0,0,0,0,0,0,0,15,0,0,0,0,0,8,0,0,0,6,0,0,0,48,2,0,3,1,5,63,0,47,35,1,0,0,0,0,0,0,0,0,0,0,87,0,0,0,0,47,0,9,0,10,0,0,0,0,0,0,0,0,0,0,5,0,0,0,0,0,10,0,0,0,39,0,3,14,0,0,0,0,0,11,0,0,0,0,0,20,0,0,0,0,0,0,0,1,0,0,0
"SWE_039_MZB_LO_14","SWE_039_MZB_LO_14-21.09.2018","21.09.2018",2018,9,21,0,0,13,0,0,0,0,0,0,0,0,0,0,1,0,0,0,0,1,0,0,0,0,1,8,0,165,0,0,0,0,25,0,0,0,0,0,0,0,0,0,0,0,1,0,11,12,9,0,0,0,0,0,0,0,0,0,8,0,0,0,0,0,2,0,0,0,4,0,0,0,43,1,0,6,2,37,74,0,8,51,8,0,0,0,0,0,0,0,0,0,0,39,0,0,0,0,26,0,2,0,3,3,0,0,0,0,0,0,0,0,0,32,0,0,0,0,0,3,0,0,0,17,0,3,22,0,1,0,0,0,2,0,0,0,0,0,24,0,0,0,0,0,0,0,0,0,0,0
"SWE_039_MZB_LO_14","SWE_039_MZB_LO_14-25.09.2019","25.09.2019",2019,9,25,0,0,59,0,0,0,0,0,0,0,0,0,0,22,0,0,0,0,6,0,0,0,0,3,2,0,29,0,0,0,0,4,0,0,0,0,0,0,0,0,0,0,0,0,0,13,20,3,0,0,0,0,0,0,0,0,0,17,0,0,0,0,0,19,0,1,0,21,0,0,0,134,1,0,7,0,4,77,0,58,40,3,0,0,0,0,0,0,0,0,1,0,188,0,0,0,0,31,0,6,0,28,2,0,0,0,0,0,0,0,0,0,7,0,0,0,0,0,17,0,0,0,19,0,1,49,0,0,0,0,0,8,0,0,0,0,0,14,0,0,0,0,0,0,0,0,0,0,0
"SWE_039_MZB_LO_15","SWE_039_MZB_LO_15-10.10.2007","10.10.2007",2007,10,10,0,0,0,0,7.5,0,0,0,0,0,0,0,0,91,0,0,0,0,0,0,0,0,2.25,0,0,0,16.75,0,0,0,0,0,0,0,0,0,0,0,0,0,0,0,0,0,0,1.25,0,0.25,0,2.25,0,0,0,0,0,0,0,0,0,0,0,0,0,23.25,0,0,0,0,0,0,0,0,0.25,0,0,0,0,0.25,0,0,0,0,0,0,0,0,0,0,0,0,0,0,4,0,0,0,0,2,0,0.5,0,13.75,0,0,0,0,0,0,0,0,0,0,0.75,0,0,0,0,0,3.75,0,0,0,0,0,0,3.5,0,0,0,0,0,0,0,0,0,0,0,0,0,0,0,0,0,0,0,0,0,0,0
"SWE_039_MZB_LO_15","SWE_039_MZB_LO_15-17.09.2008","17.09.2008",2008,9,17,0,0,0,0,9.2,0,0,0,0,0,0,0,0,77.2,0,0,0,0,0,0,0,0,0,0,0,0,6,0,0,0,0,0,0,0,0,0,0,0,0,0,0,0,0,0,0,0.4,0,0.4,0,0.6,0,0,0,0,0,0,0,0,0,0,0,0,0,24,0,0,0.8,0,0,0,0,0,0,0,0.2,0,0,4.2,0,0.6,0,0,0,0,0,0,0,0,0,0,0,0,4.4,0,0,0,0,9.2,0,0.8,0,2.4,0.2,0,0,0,0,0,0,0,0,0,2.8,0,0,0,0,0,4.6,0,0,0,0,0,0,1.4,0,0,0,0,0,0,0,0,0,0,0,0,0,0,0,0,0,0,0,0,0,0,0
"SWE_039_MZB_LO_15","SWE_039_MZB_LO_15-14.09.2009","14.09.2009",2009,9,14,0,0,0,0,1.2,0,0,0,0,0,0,0,0,86.4,0,0,0,0,0,0,0,0,0,0.4,0.2,0,41.6,0,0,0,0,0,0,0,0,0,0,0,0,0,0,0,0,0,0,6.6,0,6,0,1.4,0,0,0,0,0,0,0,0,0,0,0,0,0,10.4,0,0,0.8,0,0,0,0,0,0,0,0,0,0,0.6,0,0.4,0,0,0,0,0,0,0,0,0,0,0,0,1.8,0,0,0,0,8.4,0,0.2,0,30,0,0,0,0,0,0,0,0,0,0,0.6,0,0,0,0,0,3.2,0,0,0,0,0,0,0.6,0,0,0,0,0,0.2,0,0,0,0.4,0,0,0,0,0,0,0,0,0,0,0,0,0
"SWE_039_MZB_LO_15","SWE_039_MZB_LO_15-03.09.2012","03.09.2012",2012,9,3,0,0,0,0,0,0,0,0,0,0,0,0,0,38,0,0,0,0,0,0,0,0,0,0,0,0,17.2,0,0,0,0,0,0,0,0,0,0,0,0,0,0,0,0,0,0,5,0,2.4,0,1.4,0,0,0,0,0,0,0,0,0,0,0,0,0,6.4,0,0,0.8,0,0,0,0,0,0,0,0,0,0,0.8,0,0,0,0,0,0,0,0,0,0,0,0,0,0,0,0,0,0,0,7.6,0,0,0,1.2,0,0,0,0,0,0,0,0,0,0,0,0,0,0,0,0,5.2,0,0,0,0,0,0,1.4,0,0,0,0,0,0,0,0,0,0.8,0,0,0,0,0,0.4,0,0,0,0,0,0,0
"SWE_039_MZB_LO_15","SWE_039_MZB_LO_15-02.09.2013","02.09.2013",2013,9,2,0,0,0,0,5.4,0,0,0,0,0,0,0,0,22.6,0,0,0,0,0,0,0,0,0,0,0.2,0,4.6,0,0,0,0,0,0,0,0,0,0,0,0.4,0,0,0,0,0,0,0,0,0,0,1.4,0,0,0,0,0,0,0,0,0,0,0,0,0,1.2,0,1.8,0,0,0,0,0.2,0,0,0,0,0,0,0.2,0,0.8,0,0.4,0,0,0,0,0,0,0,0,0,0,0.2,0,0,0,0,6,0,0.4,0,0.4,0,0,0,0,0,0,0,0,0,0,0,0,0,0,0,0,0.6,0,0,0,0,0,0,0.4,0,0,0,0,0,0.4,0,0.2,0,0.2,0,0,0,0,0,0,0,0,0,0,0,0,0
"SWE_039_MZB_LO_15","SWE_039_MZB_LO_15-11.10.2017","11.10.2017",2017,10,11,0,0,0,0,5.8,0,0,0,0,0,0,0,0,51.8,0,0,0,0,0,0,0,0,2.2,0,1.6,0,15.6,0,0,0,0,0,0,0,0,0,0,0,0,0,0,0,0,0,0,1.8,0,0.4,0,2.2,0,0,0,0,0,0,0,0,0,0,0,0,0,23.8,0,1,0,0,0,0,0,0,0,0,0.6,0,0,1.6,0,0,0,0,0,0,0,0,0,0,0,0,0,0,11.6,0,0,0,0,49.4,0,0.6,0,5.4,0,0,0,0,0,0,0,0,0,0,5.8,0,0,0,0,0,2.6,0,0,0,0,0,0,0.8,0,0.6,0,0,0,0.6,0,0,0,0.4,0,0,0,0,0,0,0,0,0,0,0,0,0
"SWE_039_MZB_LO_15","SWE_039_MZB_LO_15-24.10.2018","24.10.2018",2018,10,24,0,0,0,0,6.2,0,0,0,0,0,0,0,0,61.8,0,0,0,0,0,0,0,0,3.8,0.2,0.2,0,11.2,0,0,0,0,0,0,0,0,0,0,0,0,0,0,0,0,0,0,0.4,0,0.2,0,0.4,0,0,0,0,0,0,0,0,0,0,0,0,0,18.6,0,0.6,0,0,0,0,0,0,0.4,0,0.2,0,0.4,0.4,0,0,0,0,0,0,0,0,0,0,0,0,0,0,10,0,0,0,0,7,0,0.2,0,1.2,0,0,0,0,0,0,0,0,0,0,2.8,0,0,0,0,0,0.4,0,0,0,0,0,0,1,0,0.2,0,0,0,0,0,0,0,0,0,0,0,0,0,0,0,0,0,0,0,0,0
"SWE_039_MZB_LO_15","SWE_039_MZB_LO_15-03.10.2019","03.10.2019",2019,10,3,0,0,0,0,65.2,0,0,0,0,0,0,0,0,124.4,0,0,0,0,0,0,0,0,2.8,0.4,0.6,0,52.2,0,0,0,0,0,0,0.2,0,0,0,0,0,0,0,0,0,0,0,3,0,0,0,2,0,0,0,0,0,0,0,0,0,0,0,0,0,33.4,0,2,0,0,0,0,0,0,19.2,0,0.8,0,1.2,3.6,0,2,0,0,0,0,0,0,0,0,0,0,0,0,15.4,0,0,0,0,5.8,0,0,0,5.2,0,0,0,0,0,0,0,0,0,0,10.4,0,0,0,0,0,2.6,0,0,0,0,0,0,1,0,0,0,0,0,0.2,0,0,0,0.8,0,0,0,0,0,0,0,0,0,0,0,0,0
"SWE_039_MZB_LO_16","SWE_039_MZB_LO_16-16.06.1996","16.06.1996",1996,6,16,0,0,0,0,0.1,0,0.8,0,0,0,0,0,0,4.7,0,0,0,0,0,0,0,0,0,0,0.3,0,40.6,0,0,0,0,0,0,0,0,0,0,0,0,0,0,0,0,0,0,0.6,0,0.8,0,0.4,0,0,0,0,0,0,0,0,0,0,0,0,0,1.5,0,0,2.3,0,0,0,0,0.4,0.9,0,3.7,0,0,0.5,0,1.2,0,0,0,0,0,0,0,0,0,0,0,0,7.7,0,0,0,0,2.7,0,0.2,0,0,0,0,0,0,0,0,0,0,0,0,0.9,0,0,0,0,0,0.2,0,0,0,1.2,0,0,110.9,0,0.1,0,0,0,0,0,0,0,0,0,0,0,0,0,0,0,0,0,0,0,0,0
"SWE_039_MZB_LO_16","SWE_039_MZB_LO_16-17.06.1997","17.06.1997",1997,6,17,0,0,0,0,0.1,0,0.5,0,0,0,0,0,0,11.5,0,0,0,0,0.1,0,0,0,0,0,0,0,112.3,0,0,0,0,0,0,0,0,0,0,0,0,0,0,0,0,0,0,0,0,2.2,0,0.1,0,0,0,0,0,0,0,0,0,0,0,0,0,0,0,0,7.1,0,0,0,0,0,0,0,0,0,0,0,0,0,0,0,0,0,0,1,0,0,0,0,0,0,0.1,0,0,0,0,0.6,0,0.4,0,1.1,0,0,0,0,0,0,0,0,0,0,0,0,0,0,0,0,1.3,0,0,0,0,0,0,26.9,0,0,0,0,0,0,0,0,0,0,0,0,0,0,0,0,0,0,0,0,0,0,0
"SWE_039_MZB_LO_16","SWE_039_MZB_LO_16-26.05.1998","26.05.1998",1998,5,26,0,0,0,0,0,0,0,0,0,0,0,0,0,0.1,0,0,0,0,0,0,0,0,0,0,0,0,37.9,0,0,0,0,0,0,0,0,0,0,0,0,0,0,0,0,0,0,0,0,0,0,0,0,0,0,0,0,0,0,0,0,0,0,0,0,0,0,0,0,0.1,0,0,0,0,0,0,0,0,0,0,0,0,0,0,0,0,0,0,0,0,0,0,0,0,0,0,0,0,0,0,0,0,0,0,0,0,0,0,0,0,0,0,0,0,0,0,0,0,0,0,0,0,0,0,0,0,0,1.1,0,0,0,0,0,0,0,0,0,0,0,0,0,0,0,0,0,0,0,0,0,0,0
"SWE_039_MZB_LO_16","SWE_039_MZB_LO_16-03.06.1999","03.06.1999",1999,6,3,0,0,0,0,0,0,0.1,0,0,0,0,0,0,2.1,0,0,0,0,0,0,0,0,0,0,0,0,14.3,0,0,0,0,0,0,0,0,0,0,0,0,0,0,0,0,0,0,0,0,0,0,0,0,0,0,0,0,0,0,0,0,0,0,0,0,0,0,0,0,0,0,0,0,0,0,0,0,0,0,0,0,0,0,0,0,0,0,0,0,0,0,0,0,0,0.2,0,0,0,0,0.8,0,0.1,0,0.1,0,0,0,0,0,0,0,0,0,0,0,0,0,0,0,0,0.3,0,0,0,0,0,0,4.6,0,0,0,0,0,0,0,0,0,0,0,0,0,0,0,0,0,0,0,0,0,0,0
"SWE_039_MZB_LO_16","SWE_039_MZB_LO_16-11.06.2001","11.06.2001",2001,6,11,0,0,0,0,0,0,0.2,0,0,0,0,0,0,1.8,0,0,0,0,0,0,0,0,0,0,0,0,25.4,0,0,0,0,0,0,0,0,0,0,0,0,0,0,0,0,0,0,0,0,0.1,0,0,0,0,0,0,0,0,0,0,0,0,0,0,0,0,0,0,0.7,0,0,0,0,0,0,0,0,0,0,0,0,0.1,0,0,0,0,0,0,0,0,0,0,0,0,0,0,0,0,0,1,0,1.3,0,0.2,0,0,0,0,0,0,0,0,0,0,0,0,0,0,0,0,0.5,0,0,0,0,0,0,39.1,0,0,0,0,0,0,0,0,0,0,0,0,0,0,0,0,0,0,0,0,0,0,0
"SWE_039_MZB_LO_16","SWE_039_MZB_LO_16-22.05.2002","22.05.2002",2002,5,22,0,0,0,0,0.1,0,0.9,0,0,0,0,0,0,11.9,0,0,0,0,1.2,0,0,0,0,0,0,0,53.3,0,0,0,0,0,0,0,0,0,0,0,0,0,0,0,0,0,0,0,0,0.2,0,0,0,0,0,0,0,0,0,0,0,0,0,0,0,0,0,0,0.9,0,0,0,0,0,0,0,0,0,0,0.1,0,0,0,0,0,0,0,0,0,0,0,0,0,0,0.3,0,0,0,0,1.2,0,2,0,0.1,0,0,0,0,0,0,0,0,0,0,0,0,0,0,0,0,0.5,0,0,0,0,0,0,2.1,0,0,0,0,0,0,0,0,0,0,0,0,0,0,0,0,0,0,0,0,0,0,0
"SWE_039_MZB_LO_16","SWE_039_MZB_LO_16-03.06.2003","03.06.2003",2003,6,3,0,0,0,0,0.2,0,10.6,0,0,0,0,0,0,19.2,0,0,0,0,0,0,0,0,0,0,0,0,44.2,0,0,0,0,0,0,0,0,0,0,0,0,0,0,0,0,0,0,0,0,1.5,0,0,0,0,0,0,0,0,0,0,0,0,0,0,0,0.1,0,0,1.6,0,0,0,0,0,0,0,0,0,0,0.1,0,0.4,0,0.3,0,0,0,0,0,0,0,0,0,0,0.9,0,0,0,0,6.2,0,1.9,0,0.1,0,0,0,0,0,0,0,0,0,0,0,0,0,0,0,0,1.1,0,0,0,0,0,0,14.7,0,0,0,0,0,0,0,0,0,0,0,0,0,0,0,0,0,0,0,0,0,0,0
"SWE_039_MZB_LO_16","SWE_039_MZB_LO_16-01.06.2004","01.06.2004",2004,6,1,0,0,0,0,0.7,0,19.8,0,0,0,0,0,0,26.5,0,0,0,0,0.1,0,0,0,0,0,0.1,0,91.7,0,0,0,0,0,0,0,0,0,0,0,0,0,0,0,0,0,0,0,0,2,0,0.7,0,0,0,0,0,0,0,0,0,0,0,0,0,0,0,0,7.2,0,0,0,0,0,0,0,0,0,0,0,0,0.4,0.1,0,0,0,0,0,0,0,0,0,0.1,0,1.3,0,0,0,0,5.7,0,5.2,0,1.1,0,0,0,0,0,0,0,0,0,0,0,0,0,0.5,0,0,3.4,0,0,0,0,0,0,71.4,0,0,0,0,0,0,0,0,0.1,0,0,0,0,0,0,0.6,0,0,0,0,0,0,0
"SWE_039_MZB_LO_16","SWE_039_MZB_LO_16-08.06.2005","08.06.2005",2005,6,8,0,0,0,0,0.6,0,5.6,0,0,0,0,0,0,14.4,0,0,0,0,0,0,0,0,0,0,0,0,35.8,0,0,0,0,0,0,0,0,0,0,0,0,0,0,0,0,0,0,0.1,0,1,0,1.4,0,0,0,0,0,0,0,0.5,0,0,0,0,0,0,0,0,3.6,0,0,0,0,0,0,0,0,0,0,0.1,0,0.1,0,0,0,0,0,0,0,0,0,0,0,0,1.5,0,0,0,0,11.3,0,3.2,0,1.1,0,0,0,0,0,0,0,0,0,0,0,0,0,1.1,0,0,4.2,0,0,0,0.2,0,0,31.3,0,0.1,0,0,0,0,0,0,0,0,0,0,0,0,0,0.1,0,0,0,0,0,0,0
"SWE_039_MZB_LO_16","SWE_039_MZB_LO_16-06.06.2006","06.06.2006",2006,6,6,0,0,0,0,0.4,0,1,0,0,0,0,0,0,9.7,0,0,0,0,0,0,0,0,0,0,0.1,0,50,0,0,0,0,0,0,0,0,0,0,0,0,0,0,0,0,0,0,0,0,0,0,1.9,0,0,0,0,0,0,0,0.1,0,0,0,0,0,0,0,0,2.9,0,0,0,0,0,0,0,0,0,0,0,0,0.4,0,0,0,0,0,0,0,0,0,0,0,0,0.4,0,0,0,0,3.9,0,1,0,1,0,0,0,0,0,0,0,0,0,0,0,0,0,0.8,0,0,3.4,0,0,0,0,0,0,18.5,0,0,0,0,0,0,0,0,0,0,0,0,0,0,0,0,0,0,0,0,0,0,0
"SWE_039_MZB_LO_17","SWE_039_MZB_LO_17-10.09.2005","10.09.2005",2005,9,10,0,0,0,0,1,0,0,0,0,0,0,0,0,32,0,0,0,0,0,0,0,0,0,4,28,0,158,0,0,0,0,0,0,0,0,0,0,0,0,0,0,0,0,3,0,1,0,10,0,0,0,0,0,0,0,0,0,1,0,0,0,0,0,0,0,19,0,1,0,0,0,2,137,0,1,0,4,147,0,58,0,0,1,0,0,0,0,0,0,0,3,0,111,0,0,0,0,19,0,4,0,8,0,0,0,0,0,0,0,0,0,0,24,0,0,0,0,0,10,0,0,0,7,0,9,35,0,0,0,0,0,9,0,0,0,14,0,0,0,0,0,1,0,0,0,0,0,0,0
"SWE_039_MZB_LO_17","SWE_039_MZB_LO_17-21.09.2006","21.09.2006",2006,9,21,0,0,0,0,7,0,0,0,0,0,0,0,0,55,0,0,0,0,2,0,0,0,0,11,20,0,91,0,0,0,0,0,0,0,0,0,0,0,0,0,0,0,0,9,0,1,0,1,0,8,0,0,0,0,0,0,0,0,0,0,0,0,0,1,0,3,0,4,0,0,0,2,55,0,1,0,29,190,0,70,0,4,2,0,0,0,0,0,0,0,0,0,180,0,0,0,0,12,0,2,0,3,0,0,0,0,0,0,0,0,0,0,25,0,0,2,0,0,13,0,0,0,6,0,5,78,0,0,0,0,0,3,0,0,0,35,0,0,0,0,0,0,0,0,0,0,0,0,0
"SWE_039_MZB_LO_17","SWE_039_MZB_LO_17-28.09.2007","28.09.2007",2007,9,28,0,0,0,0,11,0,0,0,0,0,0,0,0,66,0,0,0,0,1,0,0,0,0,28,33,0,436,0,0,0,0,0,0,0,0,0,0,0,0,0,0,0,0,0,0,1,0,3,0,1,0,0,0,0,0,0,0,0,0,0,0,0,0,0,0,19,0,0,0,0,0,1,88,0,0,0,25,214,0,125,0,3,0,0,0,0,0,0,0,0,0,0,180,0,0,0,0,7,0,4,0,13,0,0,0,0,0,0,0,0,0,0,44,0,0,0,0,0,17,0,0,0,18,0,10,52,0,2,0,0,0,0,0,0,0,4,0,0,0,0,0,0,0,0,0,0,0,0,0
"SWE_039_MZB_LO_17","SWE_039_MZB_LO_17-18.09.2008","18.09.2008",2008,9,18,0,0,0,0,1,0,1,0,0,0,0,0,0,43,0,0,0,0,2,0,0,0,0,11,47,0,432,0,0,0,0,0,0,0,0,0,0,0,0,0,0,0,0,3,0,1,0,3,0,9,0,0,0,0,0,1,0,0,0,0,0,0,0,0,0,11,0,0,0,0,0,2,90,0,0,0,4,183,0,61,0,2,0,0,0,0,0,0,0,0,0,0,57,0,0,0,0,6,0,6,0,3,0,0,0,0,0,0,0,0,0,0,20,0,0,1,0,0,20,0,0,0,26,0,7,28,0,0,0,0,0,4,0,0,0,2,0,0,0,0,0,0,0,0,0,0,0,0,0
"SWE_039_MZB_LO_17","SWE_039_MZB_LO_17-21.09.2009","21.09.2009",2009,9,21,0,0,0,0,1,0,0,0,0,0,0,0,0,10,0,0,0,0,3,0,0,0,0,5,40,0,133,0,0,0,0,0,0,0,0,0,0,0,0,0,0,0,0,2,0,0,0,0,0,2,0,0,0,0,0,0,0,0,0,0,0,0,0,0,0,14,0,0,0,0,0,0,69,0,1,0,10,155,0,71,0,1,0,0,0,0,0,0,0,0,1,0,73,0,0,0,0,18,0,2,0,2,0,0,0,0,0,0,0,0,0,0,15,0,0,0,0,0,15,0,0,0,9,0,4,12,0,0,0,0,0,2,0,0,0,7,0,1,0,0,0,0,0,0,0,0,0,0,0
"SWE_039_MZB_LO_17","SWE_039_MZB_LO_17-18.09.2010","18.09.2010",2010,9,18,0,0,0,0,1,0,0,0,0,0,0,0,0,6,0,0,0,0,0,0,0,0,3,4,47,0,99,0,0,0,0,0,0,0,0,0,0,0,0,0,0,0,0,1,0,0,0,1,0,12,0,0,0,0,0,0,0,0,0,0,0,0,0,0,0,6,0,1,0,0,0,0,28,0,0,0,3,108,0,58,0,2,0,0,0,0,0,0,0,0,1,0,45,0,0,0,0,9,0,1,0,2,0,0,0,0,0,0,0,0,0,0,7,0,0,0,0,0,0,0,0,0,4,0,5,7,0,0,0,0,0,2,0,0,0,26,0,0,0,0,0,0,0,0,0,0,0,0,0
"SWE_039_MZB_LO_17","SWE_039_MZB_LO_17-01.10.2011","01.10.2011",2011,10,1,0,0,0,0,0,0,0,0,0,0,0,0,0,12,0,0,0,0,6,0,0,0,0,4,16,0,59,0,0,0,0,0,0,0,0,0,0,0,0,0,0,0,0,0,0,0,0,0,0,23,0,0,0,0,0,0,0,0,0,0,0,0,0,0,0,2,0,0,0,0,0,0,24,0,0,0,6,198,0,69,0,2,0,0,0,0,0,0,0,0,0,0,63,0,0,0,0,18,0,8,0,4,0,0,0,0,0,0,0,0,0,0,10,0,0,0,0,0,6,0,0,0,16,0,3,17,0,0,0,0,0,1,0,0,0,12,0,0,0,0,0,0,0,0,0,0,0,0,0
"SWE_039_MZB_LO_17","SWE_039_MZB_LO_17-23.09.2012","23.09.2012",2012,9,23,0,0,0,0,0,0,0,0,0,0,0,0,0,2,0,0,0,0,0,0,0,0,0,3,16,0,93,0,0,0,0,0,0,0,0,0,0,0,0,0,0,0,0,0,0,0,0,4,0,24,0,0,0,0,0,0,0,0,0,0,0,0,0,0,0,2,0,0,0,0,0,0,7,0,0,0,0,140,0,57,1,0,0,0,0,0,0,0,0,0,0,0,31,0,0,0,0,3,0,10,0,3,0,0,0,0,0,0,0,0,0,0,13,0,0,0,0,0,15,0,0,0,7,0,0,12,0,0,0,0,0,2,0,0,0,10,0,0,0,0,0,0,0,0,0,0,0,0,0
"SWE_039_MZB_LO_17","SWE_039_MZB_LO_17-23.09.2013","23.09.2013",2013,9,23,0,0,0,0,0,0,0,0,0,0,0,0,0,9,0,0,0,0,10,0,0,0,0,16,13,0,113,0,0,0,0,0,0,0,0,0,0,0,0,0,0,0,0,0,0,0,0,4,0,27,0,0,0,0,0,0,0,0,0,0,0,0,0,0,0,3,0,0,0,0,0,0,5,0,0,0,2,64,0,17,0,0,0,0,0,0,0,0,0,0,0,0,44,0,0,0,0,8,0,10,0,18,0,0,0,0,0,0,0,0,0,0,24,0,0,0,0,0,13,0,0,0,4,0,8,23,0,0,0,0,0,1,0,0,0,11,0,0,0,0,0,0,0,0,0,0,0,0,0
"SWE_039_MZB_LO_17","SWE_039_MZB_LO_17-21.09.2014","21.09.2014",2014,9,21,0,0,0,0,0,0,0,0,0,0,0,0,0,4,0,0,0,0,3,0,0,0,0,6,7,0,47,0,0,0,0,0,0,0,0,0,0,0,0,0,0,0,0,0,0,0,0,3,0,28,0,0,0,0,0,0,0,0,0,0,0,0,0,0,0,2,0,0,0,0,0,0,37,0,0,0,0,132,0,29,0,1,0,0,0,0,0,0,0,0,0,0,34,0,0,0,0,2,0,2,0,4,0,0,0,0,0,0,0,0,0,0,9,0,0,0,0,0,9,0,0,0,8,0,3,17,0,0,0,0,0,2,0,0,0,4,0,0,0,0,0,0,0,0,0,0,0,0,0
"SWE_039_MZB_LO_17","SWE_039_MZB_LO_17-15.09.2015","15.09.2015",2015,9,15,0,0,0,0,0,0,0,0,0,0,0,0,0,0,0,0,0,0,2,0,0,0,0,1,10,0,44,0,0,0,0,0,0,0,0,0,0,0,0,0,0,0,0,0,0,0,0,11,0,11,0,0,0,0,0,0,0,0,0,0,0,0,0,0,0,1,0,0,0,0,0,0,3,0,0,0,0,174,0,39,0,1,0,0,0,0,0,0,0,0,0,0,32,0,0,0,0,13,0,0,0,4,0,0,0,0,0,0,0,0,0,0,2,0,0,0,0,0,8,0,0,0,10,0,3,19,0,0,0,0,0,3,0,0,0,15,0,0,0,0,0,0,0,0,0,0,0,0,0
"SWE_039_MZB_LO_17","SWE_039_MZB_LO_17-04.09.2016","04.09.2016",2016,9,4,0,0,0,0,0,0,0,0,0,0,0,0,0,4,0,0,0,0,1,0,0,0,0,4,40,0,103,0,0,0,0,0,0,0,0,0,0,0,0,0,0,0,0,7,0,0,0,5,0,16,0,0,0,0,0,0,0,0,0,0,0,0,0,0,0,3,0,0,0,0,0,0,11,0,0,0,2,165,0,111,0,6,0,0,0,0,0,0,0,0,0,0,58,0,0,0,0,12,0,5,0,11,0,0,0,0,0,0,0,0,0,0,3,0,0,0,0,0,8,0,0,0,6,0,4,26,0,0,0,0,0,2,0,0,0,14,0,0,0,0,0,0,0,0,0,0,0,0,0
"SWE_039_MZB_LO_17","SWE_039_MZB_LO_17-07.09.2017","07.09.2017",2017,9,7,0,0,0,0,0,0,0,0,0,0,0,0,0,0,0,0,0,0,0,0,0,0,0,1,29,0,83,0,0,0,0,0,0,0,0,0,0,0,0,0,0,0,0,0,0,0,0,2,0,4,0,0,0,0,0,0,0,0,0,0,0,0,0,0,0,3,0,0,0,0,0,0,8,0,0,0,1,139,0,30,0,4,0,0,0,0,0,0,0,0,0,0,18,0,0,0,0,4,0,4,0,11,0,0,0,0,0,0,0,0,0,0,18,0,0,0,0,0,8,0,0,0,4,0,6,3,0,0,0,0,0,1,0,0,0,2,0,0,0,0,0,0,0,0,0,0,0,0,0
"SWE_039_MZB_LO_17","SWE_039_MZB_LO_17-06.09.2018","06.09.2018",2018,9,6,0,0,0,0,0,0,0,0,0,0,0,0,0,23,0,0,0,0,0,0,0,0,0,3,14,0,145,0,0,0,0,0,0,0,0,0,0,0,0,0,1,0,0,9,0,0,0,2,0,3,0,0,0,0,0,0,0,0,0,0,0,0,0,0,0,7,0,1,0,0,0,1,206,0,0,0,5,154,0,59,0,0,0,0,0,0,0,0,0,0,0,0,123,0,0,0,0,6,0,0,0,4,2,0,0,0,0,0,0,0,0,0,20,0,0,0,0,0,13,0,0,0,2,0,17,35,0,0,0,0,0,3,0,0,0,11,0,0,0,0,0,0,0,0,0,0,0,0,0
"SWE_039_MZB_LO_17","SWE_039_MZB_LO_17-30.09.2019","30.09.2019",2019,9,30,0,0,0,0,0,0,0,0,0,0,0,0,0,3,0,0,0,0,0,0,0,0,0,12,9,0,58,0,0,0,0,0,0,0,0,0,0,0,0,0,0,0,0,0,0,0,0,1,0,4,0,0,0,0,0,0,0,0,0,0,0,0,0,0,0,2,0,0,0,0,0,0,4,0,0,0,2,92,0,30,0,4,0,0,0,0,0,0,0,0,0,0,50,0,0,0,0,16,0,0,0,13,0,0,0,0,0,0,0,0,0,0,17,0,0,0,0,0,4,0,0,0,27,0,23,6,0,0,0,0,0,3,0,0,0,19,0,0,0,0,0,0,0,0,0,0,0,0,0
"SWE_039_MZB_LO_18","SWE_039_MZB_LO_18-22.10.2001","22.10.2001",2001,10,22,0,0,1.6,0,0,0,0,0,0,0,3.4,0,0,26.8,0,0,0,0,0,0,0,0,0,0,15.4,0,230,0,0,0,0,0,0,0,0,0,0,0,0,0,0,0,0,0.2,0,12.4,0,1.6,2,0,0,0,65.4,0,0,0.2,0,0,0,0,0,0,0,0,0,0,8.4,0.8,0,0,0,0.4,0,0,0,1.4,0.4,21.4,0,8.8,4,0,0,0,0,0,0,0,0,0,0,0,3.2,0,0,0,0,0.6,2.2,4,0,0.2,0,0,0,0,0,0,0,0,0,0,9.2,0,0,0,0.4,0.6,0.8,0,0,0,3.6,0,0,13.6,0,0,0,0,0,6.6,0,0,0,0,0,0,0,0,0,0,0,0,0,0,0,0,0
"SWE_039_MZB_LO_18","SWE_039_MZB_LO_18-10.11.2003","10.11.2003",2003,11,10,0,0,1.6,0,0,0,0,0,0,0,0.4,0,0,116.2,0,0,0,0,0.2,0,0,0,0,0,0.4,0,168.2,0,0,0,0,0,0,0,0,0,0,0,0,0,0,0,0,0,0,4,0,0.6,0,0,0,0,54.4,0,0,0,0,0,0,0,0,0,0,0,0,0,11.6,0.2,0,0,0,0,0,0,0,0.2,0,42,0,0.6,12.4,0.2,0,0,0,0,0,0,0,0,0,0,1.4,0,0,0,0,2,0,2.8,0,0.2,0,0,0,0,0,0,0,0,0,0,11.2,0,0,0,0.2,0,1,0,0,0,0.8,0,0,23.8,0,0,0,0,0,3.2,0,0,0,0,0,0,0,0,0,0,0,0,0,0,0,0,0
"SWE_039_MZB_LO_18","SWE_039_MZB_LO_18-11.10.2004","11.10.2004",2004,10,11,0,0,1.8,0,0,0,0,0,0,0,0.2,0,0,33.2,0,0,0,0,0,0,0,0,0,0,0.4,0,81.6,0,0,0,0,0,0,0,0,0,0,0,0,0,0,0,0,0,0,7.4,0,0.4,0.2,0,0,0,66.4,0,0,0.2,0,0,0,0,0,0,0,0,0,0,2.4,0.4,0,0,0,0,0,0,0,0,0,28.6,0.6,0,9.4,0.4,0,0,0,0,0,0,0,0,0,0,1.8,0,0,0,0,0.8,0.4,1.2,0,0,0,0,0,0,0,0,0,0,0,0,7,0,0,0,0.2,0.2,0.6,0,0,0,1.6,0,0,2.6,0,0,0,0,0,7.6,0,0,0,0,0,0,0,0,0,0.2,0,0,0,0,0,0,0
"SWE_039_MZB_LO_18","SWE_039_MZB_LO_18-28.10.2005","28.10.2005",2005,10,28,0,0,2,0,0,0,0,0,0,0,1.6,0,0,79.4,0,0,0,0,0,0,0,0,0,0.2,1,0,53,0,0,0,0,0,0,0,0,0,0,0,0,0,0,0,0,0,0,12,0,0.8,0.2,0,0,0,52.6,0,0,0.4,0,0,0,0,0,0,0,0.2,0,0,3,0.8,0,0,0,0,0,0,0,0.6,0,20.8,0,1.6,9.4,1.2,0,0,0,0,0,0,0,0,0,0,0.6,0,0,0,0,1.8,0.4,3.4,0,0.6,0,0,0,0,0,0,0,0,0,0,5.2,0,0,0,0.8,0,0.8,0,0,0,3.6,0,0,6,0,0,0,0,0,0.8,0,0,0.2,0,0,0,0,0,0,0,0,0,0,0,0,0,0
"SWE_039_MZB_LO_18","SWE_039_MZB_LO_18-28.10.2006","28.10.2006",2006,10,28,0,0,6.8,0,0,0,0,0,0,0,1.6,0,0,72.8,0,0,0,0,0,0,0,0,0,0,2.2,0,395,0,0,0,0,0,0,0,0,0,0,0,0,0,0,0,0,0,0,47.6,0,1.4,1,0,0,0,77,0,0,0.2,0,0,0,0,0,0,0,0.2,0,0,6,0.4,0,0,0,0,0,0,0,0.2,0,78,0,3.8,58,1,0,0,0,0,0,0,0,0,0,0,4,0,0,0,0,7.2,0.2,7.2,0,1.2,0,0,0,0,0,0,0,0,0,0,38.8,0,0,0,3.2,0,1,0,0,0,17.4,0,0,6.8,0,0,0,0,0,20.4,0,0,0,0,0,0.8,0,0,0,0,0,0,0,0,0,0,0
"SWE_039_MZB_LO_18","SWE_039_MZB_LO_18-05.11.2007","05.11.2007",2007,11,5,0,0,4.2,0,0,0,0,0,0,0,0.2,0,0,32.8,0,0,0,0,0,0,0,0,0,0,0.8,0,47.4,0,0,0,0,0,0,0,0,0,0,0,0.2,0,0,0,0,0,0,6.8,0,0,0,0,0,0,44.8,0,0,0,0,0,0,0,0,0,0,0.2,0,0,0.2,0,0,0,0,0,0,0,0,0,0,54.6,0,2,10.8,0.2,0,0,0,0,0,0,0,0,0,0,1.4,0,0,0,0,0,0,1,0,1.2,0,0,0,0,0,0,0,0,0,0,6.4,0,0,0,0.2,0,3.8,0,0,0,1.4,0,0,11.8,0,0,0,0,0,1.4,0,0,0,0,0,0,0,0,0,0,0,0,0,0,0,0,0
"SWE_039_MZB_LO_18","SWE_039_MZB_LO_18-23.10.2008","23.10.2008",2008,10,23,0,0,1.8,0,0,0,0,0,0,0,0,0,0,86,0,0,0,0,0,0,0,0,0,0,1.6,0,247.6,0,0,0,0,0,0,0,0,0,0,0,0.2,0,0,0,0,0,0,28.4,0,1,0,0,0,0,32.2,0,0,0,0,0,0,0,0,0,0,0,0,0,21.4,2,0,0,0,0,0,0,0,0.2,0,101.6,0,0.6,86,1.2,0,0,0,0,0,0,0,0,0,0,1.2,0,0,0,0,6.8,2,8.6,0,0.8,0,0,0,0,0,0,0,0,0,0,41.8,0,0,0,0.2,0,2.6,0,0,0,5.4,0,0,3.2,0,0,0,0,0,25.2,0,0,0,0,0,0,0,0,0,0,0,0,0,0,0,0,0
"SWE_039_MZB_LO_18","SWE_039_MZB_LO_18-09.10.2009","09.10.2009",2009,10,9,0,0,1.6,0,0,0,0,0,0,0,0,0.2,0,84.8,0,0,0,0,0,0,0,0,0,0,4.2,0,100,0,0,0,0,0,0,0,0,0,0,0,0,0.4,0,0,0,0,0,12.2,1,0.2,1.6,0,0.2,0,47.4,0,0,0,0,0,0,0,0,0,0,0.4,0,0,24,0.6,0,0,1.2,0,0,0,0,0.2,0.4,60,0,1.2,19,0.6,0,0,0,0,0,0,0,0,0,0,7.2,0,0,0,0,6.4,0,4.2,0,1.2,0,0,0,0,0,0,0,0,0,0,14.8,0,0,0,0.2,0,2.4,0,0,0,1.8,0,0,6.4,0,0,0,0,0,7.8,0,0,0,0,0,0,0,0,0,0,0,0,0,0,0,0,0
"SWE_039_MZB_LO_18","SWE_039_MZB_LO_18-22.10.2010","22.10.2010",2010,10,22,0,0,2.2,0,0,0,0,0,0,0,1.4,0,0,107.2,0,0,0,0,0,0,0,0,0,0,0,0,64.4,0,0,0,0,0,0,0,0,0,0,0,0,0,0,0,0,0,0,20.6,0.6,0.2,0.4,0,0,0,60.4,0,0,0,0,0.2,0,0,0,0,0,2.2,0,0,18.2,1.4,0,0,0,0.2,0,0,0,0,0,121.8,0,1,11.4,1,0,0,0,0,0,0,0,0,0,0,3.2,0,0,0,0,2.4,0,3.4,0,0,0,0,0,0,0,0,0,0,0,0,13.2,0,0,0,0.4,0,3.8,0,0,0,6.6,0,0,16,0,0,0,0,0,17.2,0,0,0,0,0,0,0,0,0,0,0,0,0,0,0,0,0.2
"SWE_039_MZB_LO_18","SWE_039_MZB_LO_18-13.10.2011","13.10.2011",2011,10,13,0,0,0.8,0,0,0,0,0,0,0,2.2,0,0,103.8,0,0,0,0,0,0,0,0,0,0,0.4,0,81.6,0,0,0,0,0,0,0,0,0,0,0,0,0,0,0,0,0,0,32.2,0,0.6,0.4,0,0,0,138.2,0,0,0,0,0,0,0,0,0,0,2.6,0,0,11.2,1.6,0,0,0,0,0,0,0,0,0,93.4,0,4.8,13.8,0,0,0,0,0,0,0,0,0,0,0,2.8,0,0,0,0,2.8,0.2,5,0,0.2,0,0,0,0,0,0,0,0,0,0,11,0,0,0,1.4,0,3,0,0,0,3.6,0,0,7.2,0,0,0,0,0,24.4,0,0,0,0,0,0,0,0,0,0,0,0,0,0,0,0,0
"SWE_039_MZB_LO_18","SWE_039_MZB_LO_18-01.10.2012","01.10.2012",2012,10,1,0.2,0,6.6,0,0,0,0,0,0,0,3.8,0,0,43.6,0,0,0,0,0,0,0,0,0,0,2.8,0,312,0,0,0,0,0,0,0,0,0,0,0,0,0,0,0,0,0.4,0,22,0.4,1.8,0.4,0,0,0,122,0,0,0,0,0.4,0,0,0,0,0,1,0,0,22.6,2.8,0,0,0,0,0,0,0,0.2,0,123.4,0,13.4,24,0.8,0,0,0,0,0,0,0,0,0,0,2.8,0,0,0,0,10,0.8,7,0,0.6,0,0,0,0,0,0,0,0,0,0,26.8,0,0,0.2,1,0,5.4,0,0,0,6.2,0,0,2.4,0,0,0,0,0,73.4,0,0,0,0,0,2.2,0,0,0,0,0,0,0,0,0,0,0.2
"SWE_039_MZB_LO_18","SWE_039_MZB_LO_18-01.10.2013","01.10.2013",2013,10,1,0.2,0,6.2,0,0,0,0,0,0,0,2.6,0,0,161.2,0,0.4,0,0,0,0,0,0,0,0,2,0,76.2,0,0,0,0,0,0,0,0,0,0,0,0,0.2,0,0,0,0,0,17.6,0,0.2,3.4,0,0,0,70,0,0,0,0,0.2,0,0,0,0,0,4.4,0,20.2,0,1.8,0,0,0,0,0,0,0,0,0,53.2,0,0.8,11.2,0.8,0,0,0,0,0,0,0,0,0,0,2.8,0,0,0,0,9.4,0.2,2.8,0,0.4,0,0,0,0,0,0,0,0,0,0,4.4,0,0,0,2.4,0,0.4,0,0,0,5.2,0,0,1.8,0,0,0,0,0,17,0,0,0,0,0,0,0,0,0,0,0,0,0,0,0,0,0
"SWE_039_MZB_LO_18","SWE_039_MZB_LO_18-02.10.2014","02.10.2014",2014,10,2,0.2,0,1.4,0,0,0,0,0,0,0,1.4,0,0,45.2,0,0,0,0,0,0,0,0,0,0,2,0,177.4,0,0,0,0,0,0,0,0,0,0,0,0,0.6,0,0,0,0,0,25,0,0.2,0.6,0,0,0,67,0,0,0.2,0,0.2,0,0,0,0,0,5.8,0,20.4,0,1.2,0,0,0,0,0,0,0,1.2,0,55.2,0,2.4,13,0.6,0,0,0,0,0,0,0,0,0,0,3.2,0,0,0,0,11,0.8,4,0,1.2,0,0,0,0,0,0,0,0,0,0,21.8,0,0,0,0.4,0,1.2,0,0,0,9,0,0,2,0,0,0,0,0,26.8,0,0,0,0,0,0,0,0,0,0,0,0,0,0,0,0,0
"SWE_039_MZB_LO_18","SWE_039_MZB_LO_18-06.10.2015","06.10.2015",2015,10,6,0,0,1.6,0,0,0,0,0,0,0,1.4,0,0,167.4,0,0,0,0,0,0,0,0,0,0,1,0,51,0,0,0,0,0,0,0,0,0,0,0,0,0.6,0,0,0,0,0,17.2,0,0.2,0.4,0,0,0,76,0,0,0,0,0.2,0,0,0,0,0,8.6,0,5,0,1,0,0,0,0.2,0,0,0,0,0,34.8,0,5.8,7,0.2,0,0,0,0,0,0,0,0,0,0,1.6,0,0,0,0,8.6,0.6,1.8,0,1.2,0,0,0,0,0,0,0,0,0,0,6.8,0,0,0,0.8,0,1.8,0,0,0,7.2,0,0,2.2,0,0,0,0,0,9.2,0,0,0,0,0,0,0,0,0,0,0,0,0,0,0,0,0
"SWE_039_MZB_LO_18","SWE_039_MZB_LO_18-04.10.2016","04.10.2016",2016,10,4,0,0,0.2,0,0,0,0,0,0,0,2.6,0,0,29.6,0,0,0,0,0,0,0,0,0,0,3.4,0,367,0,0,0,0,0,0,0,0,0,0,0,0.4,2.4,0,0,0,0.4,0,12.8,0.2,1.6,0.4,0,0,0,82.6,0,0,0.2,0,0,0,0,0,0,0,0.8,0,3.8,0,0.8,0,0,0,0,0,0,0,1.4,0,6.6,0,0.2,11,0.8,0,0,0,0,0,0,0,0,0,0,1,0,0,0,0,7.4,0,1.4,0,0.2,0,0,0,0,0,0,0,0,0,0,27.4,0,0,0,0,0,0.4,0,0,0,1.8,0,5,0.2,0,0,0,0,0,19.4,0,0,0,0,0,0,0,0.2,0,0,0,0,0,0,0,0,0
"SWE_039_MZB_LO_18","SWE_039_MZB_LO_18-11.10.2017","11.10.2017",2017,10,11,0.2,0,0,0,0,0,0,0,0,0,11.2,0,0,4.6,0,0,0,0,0,0,0,0,0,0,6,0,228.6,0,0,0,0,0,0,0,0,0,0,0,0,0,0,0,0,0.2,0,1.6,0,0,0.8,0,0,0,28.6,0,0,0,0,0,0,0,0,0,0,0,0,2.8,0,0,0,0,0,0,0,0,0,0,0,3.6,0,1.2,1.8,0,0,0,0,0,0,0,0,0,0,0,0.8,0,0,0,0,15.2,0.8,1.2,0,0,0,0,0,0,0,0,0,0,0,0,8.8,0,0,0.2,0.2,0.2,0,0,0,0,0.6,0,3,4.8,0,0,0,0,0,5.2,0,0,0,0,0,0,0,0,0,0,0,0,0,0,0,0,0
"SWE_039_MZB_LO_18","SWE_039_MZB_LO_18-30.10.2018","30.10.2018",2018,10,30,0,0,0,0,0,0,0,0,0.2,0,2.4,0,0,30.8,0,0,0,0,0,0,0,0,0,0,2.2,0,193.2,0,0,0,0,0,0,0,0,0,0,0,0,0,0,0,0,0,0,3,0,0.4,0,0,0,0,24.6,0,0,0,0,0,0,0,0,0,0,3.8,0,1.4,0,0.2,0,0,0,0,0,0,0,2,0,22.8,0,2.2,7.8,2,0,0,0,0,0,0,0,0,0,0,1,0,0,0,0,1.2,0.4,0.6,0,0,0,0,0,0,0,0,0,0,0,0,9.8,0,0,0,0.4,0,0.8,0,0,0,3.6,0,1,5,0,0,0,0,0,3,0,0.6,0.6,0,0,0,0,0,0,0,0,0,0,0,0,0,0
"SWE_039_MZB_LO_18","SWE_039_MZB_LO_18-19.10.2019","19.10.2019",2019,10,19,0,0,0.2,0,0,0,0,0,0,0,1.2,0.2,0,14.2,0,0,0,0,0,0,0,0,0,0,4.8,0,358,0,0,0,0,0,0,0,0,0,0,0,0,3.4,0,0,0,1.2,0,21.2,0.4,3,0,0,0,0,95.4,0,0,0,0,0,0,0,0,0,0,0.8,0,18.6,0,4.6,0,0,0,0,0,0,0,2,0.2,40.2,0,5.8,20.6,0.6,0,0,0,0,0,0,0,0,0,0,1.6,0,0,0,0,2.2,1,0.2,0,0,0,0,0,0,0,0.4,0,0,0,0,25.6,0,0,1.6,0.4,0,4.2,0,0,0,2.8,0,0,0.4,0,0,0,0,0,11.2,0,0,0,0,0,0,0,0,0,0,0,0,0,0,0,0,0
"SWE_039_MZB_LO_19","SWE_039_MZB_LO_19-23.10.2004","23.10.2004",2004,10,23,0,0,0,0,0,0,1,0,0,0,0,0,0,12,0,0,0,0,9,0,0,0,0,0,6,0,222,0,0,0,0,0,0,0,0,0,0,0,0,0,0,0,0,0,0,43,0,2,0,9,0,0,0,0,0,0,0,0,0,0,0,0,0,0,0,16,0,0,0,0,0,0,45,0,0,0,9,26,0,19,0,0,26,0,0,0,0,0,0,0,8,0,24,0,0,0,0,14,0,2,0,9,0,0,0,0,0,0,0,0,0,0,22,0,0,17,0,0,8,0,0,0,21,0,2,9,0,0,0,0,0,0,0,0,0,6,0,1,0,0,0,0,0,0,0,0,0,0,0
"SWE_039_MZB_LO_19","SWE_039_MZB_LO_19-02.09.2005","02.09.2005",2005,9,2,0,0,0,0,0,0,0,0,0,0,2,0,0,22,0,0,0,0,0,0,0,0,0,0,10,0,103,0,0,0,0,0,0,0,0,0,0,0,0,0,0,0,0,1,0,175,0,5,0,42,0,0,0,0,0,0,0,0,0,0,0,0,0,0,0,15,0,13,0,0,0,0,112,0,0,0,0,17,0,19,1,5,10,0,0,0,0,0,0,0,1,0,32,0,0,0,0,12,0,2,0,30,0,0,0,0,0,0,0,0,0,0,9,0,0,9,0,0,12,0,0,0,10,0,3,9,0,0,0,0,0,1,0,0,0,48,0,1,0,0,0,0,0,0,0,0,0,0,0
"SWE_039_MZB_LO_19","SWE_039_MZB_LO_19-19.09.2006","19.09.2006",2006,9,19,0,0,0,0,0,0,4,0,0,0,4,0,0,13,0,0,0,0,0,0,0,0,0,3,24,0,159,0,0,0,0,0,0,0,0,0,0,0,0,0,0,0,0,0,0,204,0,5,0,19,0,0,0,0,0,0,0,0,0,0,0,0,0,0,0,22,0,23,0,0,0,0,69,0,0,0,4,19,0,255,2,2,103,0,0,0,0,0,0,0,0,0,81,0,0,0,0,19,0,4,0,18,0,0,0,0,0,0,0,0,0,0,17,0,0,35,0,0,8,0,0,0,21,0,9,3,0,0,0,0,0,0,0,0,0,18,0,0,0,0,0,0,0,0,0,0,0,0,0
"SWE_039_MZB_LO_19","SWE_039_MZB_LO_19-21.09.2007","21.09.2007",2007,9,21,0,0,0,0,0,0,32,0,0,0,2,0,0,69,0,0,0,0,3,0,0,0,0,1,28,0,497,0,0,0,0,0,0,0,0,0,0,0,0,6,0,0,0,0,0,288,0,1,0,7,0,0,0,0,0,0,0,0,0,0,0,0,0,0,0,27,0,34,0,0,0,0,116,0,0,0,16,29,0,122,3,6,184,0,0,0,0,0,0,0,2,0,84,0,0,0,0,32,0,5,0,6,0,0,0,0,0,0,0,0,0,0,39,0,0,7,1,0,17,0,0,0,103,0,5,8,0,0,0,0,0,4,0,0,0,39,0,0,0,0,0,0,0,0,0,0,0,0,0
"SWE_039_MZB_LO_19","SWE_039_MZB_LO_19-21.09.2008","21.09.2008",2008,9,21,0,0,0,0,0,0,4,0,0,0,3,0,0,56,0,0,0,0,1,0,0,0,0,1,13,0,186,0,0,0,0,0,0,0,0,0,0,0,0,0,0,0,0,1,0,153,0,1,0,16,0,0,0,0,0,0,0,0,0,0,0,0,0,0,0,26,0,42,0,0,0,0,64,0,0,0,3,25,0,161,0,5,95,0,0,0,0,0,0,0,0,0,69,0,0,0,0,15,0,11,0,15,0,0,0,0,0,0,0,0,0,0,21,0,0,2,0,0,7,0,0,0,45,0,8,4,0,0,0,0,0,0,0,0,0,10,0,1,0,0,0,0,0,0,0,0,0,0,0
"SWE_039_MZB_LO_19","SWE_039_MZB_LO_19-23.09.2009","23.09.2009",2009,9,23,0,0,0,0,0,0,2,0,0,0,5,0,0,38,0,0,0,0,7,0,0,0,0,13,9,0,446,0,0,0,0,0,0,0,0,0,0,0,0,0,0,0,0,1,0,127,0,5,0,17,0,0,0,0,0,0,0,0,0,0,0,0,0,1,0,13,0,10,0,0,0,0,55,0,0,0,0,12,0,69,1,3,3,0,0,0,0,0,0,0,2,0,95,0,0,0,0,23,0,7,0,5,0,0,0,0,0,0,0,0,0,0,5,0,0,7,0,0,6,0,0,0,22,0,3,16,0,0,0,0,0,2,0,0,0,48,0,0,0,0,0,0,0,0,0,0,0,0,0
"SWE_039_MZB_LO_19","SWE_039_MZB_LO_19-07.09.2010","07.09.2010",2010,9,7,0,0,0,0,0,0,2,0,0,0,2,0,0,29,0,1,0,0,3,0,0,0,0,1,13,0,500,0,0,0,0,0,0,0,0,0,0,0,0,1,0,0,0,0,0,231,0,10,0,37,0,0,0,0,0,0,0,0,0,0,0,0,0,0,0,22,0,21,0,0,0,0,86,0,0,1,5,22,0,66,1,5,1,0,0,0,0,0,0,0,1,0,144,0,0,0,0,11,1,5,0,15,0,0,0,0,0,0,0,0,0,0,33,0,0,11,0,0,23,0,0,0,18,0,3,15,0,0,0,0,0,3,0,0,0,48,0,0,0,0,0,0,0,0,0,0,0,0,0
"SWE_039_MZB_LO_19","SWE_039_MZB_LO_19-09.09.2011","09.09.2011",2011,9,9,0,0,0,0,0,0,0,0,0,0,1,0,0,20,0,0,0,0,1,0,0,0,0,7,23,0,322,0,0,0,0,0,0,0,0,0,2,0,0,1,0,0,0,1,0,137,2,1,0,9,0,0,0,0,0,0,0,0,0,0,0,0,0,0,0,19,0,3,0,0,0,0,69,0,0,0,2,6,0,84,0,14,4,0,0,0,0,0,0,0,5,0,125,0,0,0,0,37,0,11,0,8,0,0,0,0,0,0,0,0,0,0,31,0,0,6,0,0,2,0,0,0,49,0,9,2,0,0,0,0,0,2,0,0,0,3,0,0,0,0,0,0,0,0,0,1,0,0,0
"SWE_039_MZB_LO_19","SWE_039_MZB_LO_19-18.09.2012","18.09.2012",2012,9,18,0,0,0,0,0,0,0,0,0,0,3,0,0,18,0,0,0,0,2,0,0,0,0,14,23,0,555,0,0,0,0,0,0,0,0,0,0,0,0,1,0,0,0,1,0,154,2,3,0,26,0,0,0,0,0,0,0,1,0,0,0,0,0,0,0,20,0,8,0,0,0,0,101,0,0,0,5,31,0,122,0,2,7,0,0,0,0,0,0,0,1,0,140,0,0,0,0,13,0,7,0,18,0,0,0,0,0,0,0,0,0,0,26,0,0,3,0,0,20,0,0,0,74,0,4,10,0,0,0,0,0,0,0,0,0,17,0,0,0,0,0,0,0,0,0,0,0,0,0
"SWE_039_MZB_LO_19","SWE_039_MZB_LO_19-17.09.2013","17.09.2013",2013,9,17,0,0,0,0,0,0,0,0,0,0,2,0,0,28,0,0,0,0,0,0,0,0,0,18,30,0,542,0,0,0,0,0,0,0,0,0,0,0,0,0,0,0,0,0,0,187,0,3,0,7,0,0,0,0,0,0,0,1,0,0,0,0,0,0,0,12,0,10,0,0,0,0,103,0,0,0,5,15,0,54,1,5,3,0,0,0,0,0,0,0,2,0,101,0,0,0,0,17,0,4,0,11,0,0,0,0,0,0,0,0,0,0,35,0,0,3,1,0,5,0,0,0,42,0,5,1,0,0,0,0,0,2,0,0,0,16,0,0,0,0,0,0,0,0,0,0,0,0,0
"SWE_039_MZB_LO_19","SWE_039_MZB_LO_19-17.09.2014","17.09.2014",2014,9,17,0,0,0,0,0,0,6,0,0,0,5,0,0,46,0,0,0,0,0,0,0,0,0,9,22,0,160,0,0,0,0,0,0,0,0,0,0,0,0,0,0,0,0,4,0,148,0,3,0,31,0,0,0,0,0,0,0,2,0,0,0,0,0,0,0,19,0,16,0,0,0,0,46,0,0,0,17,55,0,128,0,6,30,0,0,0,0,0,0,0,1,0,272,0,0,0,0,67,0,6,0,20,0,0,0,0,0,0,0,0,0,0,99,0,0,0,0,0,7,0,0,0,144,0,17,5,0,0,0,0,0,2,0,0,0,38,0,0,0,0,0,0,0,0,0,0,0,0,0
"SWE_039_MZB_LO_19","SWE_039_MZB_LO_19-14.09.2015","14.09.2015",2015,9,14,0,0,0,0,0,0,0,0,0,0,0,0,0,0,0,0,0,0,0,0,0,0,0,0,24,0,173,0,0,0,0,0,0,0,0,0,0,0,0,0,0,0,0,1,0,71,0,7,0,0,0,0,0,0,0,0,0,0,0,0,0,0,0,0,0,4,0,2,0,0,0,0,28,0,0,0,0,1,0,54,0,2,7,0,0,0,0,0,0,0,0,0,0,0,0,0,0,0,0,1,0,0,0,0,0,0,0,0,0,0,0,0,29,0,0,0,0,0,14,0,0,0,93,0,12,8,0,0,0,0,0,4,0,0,0,0,0,1,0,0,0,0,0,0,0,0,0,0,0
"SWE_039_MZB_LO_19","SWE_039_MZB_LO_19-12.09.2016","12.09.2016",2016,9,12,0,0,0,0,0,0,0,0,0,0,1,0,0,22,0,0,0,0,2,0,0,0,0,6,27,0,103,0,0,0,0,0,0,0,0,0,0,0,0,0,0,0,0,3,0,163,0,4,0,30,0,0,0,0,1,0,0,2,0,0,0,0,0,0,0,11,0,6,0,0,0,0,36,0,0,0,4,55,0,53,0,5,12,0,0,0,0,0,0,0,0,0,150,0,0,0,0,30,0,7,0,19,0,0,0,0,0,0,0,0,0,0,50,0,0,3,0,0,21,0,0,0,106,0,5,2,0,0,0,0,0,2,0,0,0,17,0,0,0,0,0,0,0,0,0,0,0,0,0
"SWE_039_MZB_LO_19","SWE_039_MZB_LO_19-13.09.2017","13.09.2017",2017,9,13,0,0,0,0,0,0,0,0,0,0,6,0,0,24,0,0,0,0,1,0,0,0,0,0,13,0,68,0,0,0,0,0,0,0,0,0,0,0,0,0,0,0,0,0,0,48,0,4,0,29,0,1,0,0,0,0,0,2,0,0,0,0,0,0,0,6,0,1,0,0,0,0,51,0,0,0,1,14,0,43,0,4,5,0,0,0,0,0,0,1,0,0,66,0,0,0,0,29,0,6,0,4,0,0,0,0,0,0,0,0,0,0,28,0,0,1,0,0,5,0,0,0,45,0,7,9,0,0,0,0,0,1,0,0,0,6,0,0,0,0,0,0,0,0,0,0,0,0,0
"SWE_039_MZB_LO_19","SWE_039_MZB_LO_19-14.09.2018","14.09.2018",2018,9,14,0,0,0,0,0,0,0,0,0,0,1,0,0,14,0,0,0,0,0,0,0,0,0,2,21,0,196,0,0,0,0,0,0,0,0,0,1,0,0,0,0,0,0,1,0,20,0,2,0,23,0,0,0,0,1,0,0,0,0,0,0,0,0,0,0,4,0,10,0,0,0,0,45,0,0,0,0,22,0,41,0,5,0,0,0,0,0,0,0,0,0,0,83,0,0,0,0,7,0,12,0,14,0,0,0,0,0,0,0,0,0,0,50,0,0,4,0,0,7,0,0,0,5,0,7,4,0,0,0,0,0,2,0,0,0,27,0,0,0,0,0,0,0,0,0,0,0,0,0
"SWE_039_MZB_LO_19","SWE_039_MZB_LO_19-13.09.2019","13.09.2019",2019,9,13,0,0,0,0,0,0,0,0,0,0,0,0,0,4,0,0,0,0,0,0,0,0,0,5,4,0,118,0,0,0,0,0,0,0,0,0,0,0,0,0,0,0,0,0,0,38,0,0,0,16,0,0,0,0,0,0,0,0,0,0,0,0,0,0,0,5,0,3,0,0,0,0,60,0,0,0,1,6,0,64,0,0,1,0,0,0,0,0,0,0,0,0,58,0,0,0,0,20,0,5,0,10,0,0,0,0,0,0,0,0,0,0,15,0,0,3,0,0,2,0,0,0,13,0,7,5,0,0,0,0,0,0,0,0,0,11,0,2,0,0,0,0,0,0,0,0,0,0,0
"SWE_039_MZB_LO_2","SWE_039_MZB_LO_2-18.11.2001","18.11.2001",2001,11,18,0,0,215.8,0,0,0,0,0,0,0,0,0,0,137.8,0,0,0,0,45.2,0,0,0,0,0,4,0,1125.6,0,0,0,0,0,0,0,0,0,0,0,0,0,0,0,0,0,0,25,0,20.2,0,0,0,8.8,0,0,0,0,0,0,0,0,0,0,0,0,0,0,28.4,57,0,0,0,14.4,0,0,0,1.4,0,0.4,0,0,94.8,0,0,0,0,0,0,0,0,0.8,0,0,152.6,0,0,0,0,3.6,0,14.8,0,2,0,0,0,0,0,5.6,0,0,0,0,10.8,0,0,10.8,0,0,7.4,0,0,0,5.2,0,0,159.2,0,0,0,0,0,3.4,0,0,0,0,0,0,0,0,0,0,0,0,0,0,0,16.2,0
"SWE_039_MZB_LO_2","SWE_039_MZB_LO_2-21.10.2004","21.10.2004",2004,10,21,0,0,53.8,0,0,0,0,0,0,0,0.8,0,0,21.6,0,0,0,0,8,0,0,0,24.4,0,0.4,0,9.6,0,0,0,0,0,0,0,0,0,0,0,0,0,0,0,0,0,0,7.8,0.2,0,0,0,0,4,0,0,0,0.4,0,0,0,0,0,0,0,0,0,0,3,0.8,0,0,0,4.2,5,0,0,1.2,1.2,0,0,0.6,29.8,0,0,0,0,0,0,0,0,0.6,0,0,3,0,0,0,0,5.2,0,0.2,0,0.2,0,0,0,0,0,3,0,0,0,0,0.6,0,0,2.2,0.2,0,1.6,0,0,0,0.4,0,0,10.2,0,0,0,0,0,1.4,0,0,0,0,0,0,0,0,0,0.2,0,0,0,0,0,0,0
"SWE_039_MZB_LO_2","SWE_039_MZB_LO_2-24.11.2005","24.11.2005",2005,11,24,0,0,60.2,0,0,0,0,0,0,0,1.6,0,0,48.8,0,0,0,0,19.6,0,0,0,0,2.8,1.4,0,90.2,0,0,0,0,0,0,0,0,0,0,0,0,0,0,0,0,0,0,9.6,0,1.2,0,0,0,8,0,0,0,0.2,0,0,0,0,0,0,0,0,0,0,1.6,4.4,0,0,0,9.6,0,0,0,2.4,0,1,0,1,39.6,0,0,0,0,0,0,0,0,0.2,0,0,33.2,0,0,0,0,7.2,0,14.2,0,1.4,0,0,0,0,0,4.8,0,0,0,0,4.4,0,0,10.2,0,0,2.4,0,0,0,5.4,0,0,18.2,0,0,0,0,0,5.8,0,0,0,0,0,0.4,0,0,0,0.2,0,0,0,0,0,26.8,0
"SWE_039_MZB_LO_2","SWE_039_MZB_LO_2-20.11.2007","20.11.2007",2007,11,20,0,0,77.8,0,0,0,0,0,0,0,1.6,0,0,54.6,0,0,0,0,2.4,0,0,0,0,0,0.2,0,54,0,0,0,0,0,0,0,0,0,0,0,0,0,0,0,0,0,0,2.8,0,0,0,0,0,4,0,0,0,0.2,0,0,0,0,0,0,0,0,0,0,2,1,0,0,0,7.8,0,0,0,0.2,0,0,0,0,8.4,0.2,0,0,0,0,0,0,0,0,0,0,3.8,0,0,0,0,2.2,0,4.8,0,0,0,0,0,0,0,0.6,0,0,0,0,2.4,0,0,2.4,0,0,1,0,0,0,1.2,0,0,7.8,0,0,0,0,0,1,0,0,0,0.2,0,0.2,0,0,0,0,0,0,0,0,0,16.8,0
"SWE_039_MZB_LO_2","SWE_039_MZB_LO_2-27.11.2008","27.11.2008",2008,11,27,0,0,46,0,0,0,0,0,0,0,0.8,0,0,42.2,0,0,0,0,6,0,0,0,0,0,2,0,84.8,0,0,0,0,0,0,0,0,0,0,0,0,0,0,0,0,0,0,11.4,0.4,0.2,0,0,0,8,0,0,0,0.6,0,0,0,0,0,0,0,0,0,0,1.6,0.8,0,0,0,3.4,0,0,0,0.2,0,3.8,0,0,26,0.4,0,0,0,0,0,0,0,0,0,0,4.8,0,0,0,0,8.6,0,9.8,0,0.2,0,0,0,0,0,4.4,0,0,0,0,3.6,0,0,0.6,0.4,0,1.6,0,0,0,2.6,0,0.2,22.4,0,0,0,0,0,9,0,0,0.2,0,0,0,0,0,0,0,0,0,0,0,0,3.8,0
"SWE_039_MZB_LO_2","SWE_039_MZB_LO_2-27.10.2009","27.10.2009",2009,10,27,0,0,69.4,0,0,0,0,0,0,0,1,0,0,110.8,0,0,0,0,0.8,0,0,0,33.2,0,2.6,0,84.8,0,0,0,0,0,0,0,0,0,0,0.2,0,0,0,0,0,0,0,14,0,0,0,0,0,8.4,0,0,0,0.2,0,0,0,0,0,0,0,0,0,0,2,7.4,0,0,0,17.2,0,0,0,0.2,0,3,0,2.2,106.4,0.2,0,0,0,0,0,0,0,0.2,0,0,30.6,0,0,0,0,26,0,3.2,0,1.8,0,0,0,0,0,3.2,0,0,0,0,0.8,0,0,11.8,0.4,0,2.8,0,0,0,5,0,0,3.8,0,0,0,0,0,4.4,0,0,0.2,1.6,0,0,0,0,0,0,0,0,0,0,0,0,0
"SWE_039_MZB_LO_2","SWE_039_MZB_LO_2-17.11.2010","17.11.2010",2010,11,17,0,0,63.4,0,0,0,0,0,0,0,1.2,0,0,58.6,0,0,0,0,1.4,0.2,0,0,0,0,0,0,39.8,0,0,0,0,0,0,0,0,0,0,0,0,0,0,0,0,0,0,6.4,0,0.8,0,0,0,5.4,0,0,0,0.8,0,0,0,0,0,0,0,0,0,0,1.8,5,0,0,0,9.8,0.4,0,0,0,0.8,0.6,0,0,29.8,0.8,0,0,0,0,0,0,0,0.2,0,0,24.6,0,0,0,0,13.4,0,6,0,0.6,0,0,0,0,0,1.8,0,0,0,0,2.2,0,0,9.6,0,0,1.2,0,0,0,2.2,0,0,7.6,0,0,0,0,0,7.8,0,0,0,0,0,0,0,0,0,0,0,0,0,0,0,21.8,0
"SWE_039_MZB_LO_2","SWE_039_MZB_LO_2-01.11.2011","01.11.2011",2011,11,1,0,0,40.8,0,0,0,0,0,0,0,1.6,0,0,125.8,0,0,0,0,0.4,0,0,0,0.2,0,3.6,0,45.4,0,0,0,0,0,0,0,0,0,0,0,0,0,0,0,0,0,0,12.2,0,0,0,0,0,7.4,0,0,0,1,0,0,0,0,0,0,0,0,0,0,2.4,4.6,0,0,0,4.2,1.2,0,0,1.2,0.4,0,0,3,123.8,0,0,0,0,0,0,0,0,0.2,0,0,14.6,0,0,0,0,39,0,4.6,0,0.4,0,0,0,0,0,0.4,0,0,0,0,7.2,0,0,1.2,0.2,0,0.2,0,0,0,6.4,0,0.6,3.6,0,0,0,0,0,5.4,0,0.2,0,0.6,0,0,0,0,0,0.4,0,0,0,0,0,26.8,0
"SWE_039_MZB_LO_2","SWE_039_MZB_LO_2-20.11.2012","20.11.2012",2012,11,20,0,0,70,0,0,0,0,0,0,0,0.4,0,0,67.4,0,0,0,0,1.2,0,0,0,0.8,0,2.6,0,32.8,0,0,0,0,0,0,0,0,0,0,0,0,0,0,0,0,0,0,20.4,0,2.6,0,0,0,1.6,0,0,0,1,0,0,0,0,0,0,0,0,0,0,3,4,0,0,0,3.2,7.6,0,0,3.6,0.6,0.2,0,0.2,24,0.4,0,0,0,0,0,0,0,0.2,0,0,7.6,0,0,0,0,17.2,0.2,1.4,0,0.2,0,0,0,0,0,0.6,0,0,0,0,7.6,0,0,1.2,0.2,0,1.4,0,0,0,1.4,0,0.2,15.4,0,0,0,0,0,1.4,0,0,0,0,0,0,0,0,0,0,0,0,0,0,0,12.8,0
"SWE_039_MZB_LO_2","SWE_039_MZB_LO_2-08.10.2013","08.10.2013",2013,10,8,0,0,75.6,0,0,0,0,0,0,0,0.8,0,0,105,0,0,0,0,0,0,0,0,14.4,0.6,0.8,0,66,0,0,0,0,0,0,0,0,0,0,0,0,0,0,0,0,0,0,13.6,0,0,0,0,0,1.8,0,0,0,0.4,0,0,0,0,0,0,0,0,0,7.6,0,50,0,0,0,13.2,19.6,0,0,3.4,0.6,5.4,0,0.8,111.4,0.2,0.2,0,0,0,0,0,0,0.2,0,0,14.2,0,0,0,0,9.8,0.2,4.8,0,2.6,0,0,0,0,0,0.4,0,0,0,0,8,0,0,1,0,0,1.8,0,0,0,8.6,0,0,0.4,0,0,0,0,0,3.2,0,0,0,2.8,0,0.2,0,0,0,0,0,0,0,0,0,7.2,0
"SWE_039_MZB_LO_2","SWE_039_MZB_LO_2-27.11.2014","27.11.2014",2014,11,27,0,0,3.8,0,0,0,0,0,0.2,0,0.8,0,0,55,0,0,0,0,18.8,0,0,0,1.2,0,3.4,0,12.2,0,0,0,0,0,0,0,0,0,0,0,0.2,0,0,0,0,0.2,0,0.8,0,0,1.4,0,0,0.8,0,0.2,0,0.8,0,0,0,0,0,0,0,0,0,0.4,0,4,0,0,0,0.8,0.6,0.2,0,1,2.2,0,0,3.8,28.8,1,0,0,0,0,0,0,0,0,0,0,2.8,0,0,0,0,24.4,0,2.2,0,0.4,0,0,0,0,0,0.8,0,0,0.2,0,0.6,0,0,0.4,0.6,0.8,0.4,0,0,0,0,0,0.2,16.8,0,0,0,0,0,1,0,0,0,0,0,0.2,0,0,0,0,0,0,0,0,0,3.2,0
"SWE_039_MZB_LO_2","SWE_039_MZB_LO_2-14.10.2015","14.10.2015",2015,10,14,0,0,4.52,0,0,0,0,0,0,0,0.48,0,0,12.8,0,0,0,0,1.96,0,0,0,6.04,0,0.2,0,5.4,0,0,0,0,0,0,0,0,0,0,0,0.08,0.04,0,0,0,0.04,0,0.32,0,0,0.08,0,0,0.04,0,0,0,0.04,0,0,0,0,0,0,0,0,0,0.2,0,2.36,0,0,0,1.08,0.2,0,0,0,0.12,0.12,0,0.4,8.92,0.16,0,0,0,0,0,0,0,0,0,0,3.6,0,0,0,0,1.6,0,0.76,0,0.24,0,0,0,0,0,0.44,0,0,0,0,0.24,0,0,0,0,0,0.4,0,0,0,0.88,0,0,3.8,0,0,0,0,0,0.2,0,0,0,0,0,0,0,0,0,0,0,0,0,0,0,0,0
"SWE_039_MZB_LO_2","SWE_039_MZB_LO_2-24.10.2016","24.10.2016",2016,10,24,0,0,2.04,0,0,0,0,0,0,0,0.32,0,0,9,0,0,0,0,0,0,0,0,5.36,0,1.36,0,60.32,0,0,0,0,0,0,0,0,0,0,0,0.08,0.04,0,0,0,0.36,0,0.72,0,0.12,0,0,0,0.32,0,0,0,0.04,0,0,0,0,0,0,0.04,0,0,1.72,0,0.8,0,0,0,0.76,1.24,0,0,0,0.52,0.08,0,1.64,13.44,0.04,0,0,0,0,0,0,0,0,0,0,6.36,0,0,0,0,6.2,0.04,0.44,0,0.16,0,0,0,0,0,0.68,0,0,0,0,3.24,0,0,1.24,0.08,0,0.04,0,0,0,0.04,0,0,1.72,0,0,0,0,0,0.24,0,0,0,0.08,0,0,0,0,0,0,0,0,0,0,0,0,0
"SWE_039_MZB_LO_2","SWE_039_MZB_LO_2-19.10.2017","19.10.2017",2017,10,19,0,0,42.8,0,0,0,0,0,0.6,0,1.2,0,0,20.2,0,0,0,0,1.8,0,0,0,92.4,0,1.8,0,52.8,0,0,0,0,0,0,0,0,0,0,0,0,0,0,0,0,0,0,17.6,0,2.6,0,0,0,5.6,0,0,0,0.4,0,0,0,0,0,0,0,0,0,1,0,12.8,0,0,0,9.2,2.2,0,0,2.8,0.4,0.2,0,0.8,105,0.2,0,0,0,0,0,0,0,0,0,0,39.8,0,0,0,0,38,0.2,2,0,2.4,0,0,0,0,0,8.6,0,0,0,0,0.8,0,0,7.2,0.8,0,2.4,0,0,0,5.4,0,0,8.6,0,0,0,0,0,13.4,0,0,0,0.4,0,1.4,0,0,0,0,0,0,0,0,0,0,0
"SWE_039_MZB_LO_2","SWE_039_MZB_LO_2-15.10.2018","15.10.2018",2018,10,15,0,0,2.6,0,0,0,0,0,0,0,6.8,0,0,4.8,0,0,0,0,0.4,0,0,0,90.8,0,2,0,15.8,0,0,0,0,0.6,0,0,0,0,0,0,0,0,0,0,0,0,0,23.4,0.2,0.4,0,0,0,4.8,0,0,0,0.4,0,0,0,0,0,0,0,0,0,0.6,0,31.4,0,0,0,13,1.2,0,0,10.6,0.8,1.6,0,0.2,93.4,0.4,0.2,0,0,0,0,0,0,0,0,0,2.6,0,0,0,0,128.6,0.2,2.4,0,1,0,0,0,0,0,9,0,0,0,0,0,0,0,4.2,2.2,0,0.2,0,0,0,5.2,0,0.2,18,0,0,0,0,0,17.8,0,0,0,0.6,0,0.6,0,0,0,0,0.2,0,0,0,0,0,0
"SWE_039_MZB_LO_2","SWE_039_MZB_LO_2-23.10.2019","23.10.2019",2019,10,23,0,0,17,0,0,0,0.2,0,0,0,9,0,0,14,0,0.6,0,0,1.4,0,0,0,57.2,0,8,0,51.8,0,0,0,0,0,0,0,0,0,0,0,0,0,0,0,0,0,0,46.6,0,1,0,0,0,5.8,0,0,0,1.2,0,0,0,0,0,0,0,0,0,3,0,12.8,0,0,0,68,2.8,0,0,13,0,1.2,0,1,181,0.2,0,0,0,0,0,0,0,2,0,0,60.4,0,0,0,0,87.8,0.4,1.4,0,3,0,0,0,0,0,2.2,0,0,0,0,0.2,0,0,10.8,2.4,0,2.6,0,0,0,11.8,0,0,4.4,0,0,0,0,0,19.2,0,0,0.4,0.8,0,1.2,0,0,0,0,0,0,0,0,0,0,0
"SWE_039_MZB_LO_20","SWE_039_MZB_LO_20-01.11.2004","01.11.2004",2004,11,1,0,0,17,0,0,0,0,0,0,0,19,1,0,21,0,0,0,0,0,1,0,0,0,8,0,0,53,0,0,0,0,0,0,0,0,0,0,0,0,0,0,0,0,0,0,9,3,0,1,0,0,0,0,0,0,0,0,0,0,0,0,0,0,10,0,0,0,0,0,0,0,1,0,0,0,0,1,99,0,43,18,1,0,0,0,0,0,0,0,0,0,0,22,0,0,0,0,6,2,7,0,35,0,0,0,0,0,0,0,0,0,0,13,0,0,0,0,0,10,0,0,0,9,0,0,16,0,0,0,0,0,46,0,0,0,0,0,2,0,0,0,0,0,0,0,0,0,0,0
"SWE_039_MZB_LO_20","SWE_039_MZB_LO_20-23.09.2005","23.09.2005",2005,9,23,0,0,2,0,0,0,0,0,0,0,1,4,0,57,0,0,0,0,1,11,4,4,0,5,5,0,127,0,0,0,0,0,0,0,0,0,0,0,0,0,0,0,0,0,0,9,0,1,4,0,0,0,0,0,0,1,0,0,0,0,0,0,0,18,0,1,0,2,0,0,0,2,0,0,0,2,28,113,0,5,39,5,0,0,0,0,0,0,0,0,1,0,140,0,0,0,0,46,6,4,0,14,0,0,0,0,0,0,0,0,0,0,36,0,0,0,0,0,3,0,0,0,2,1,1,5,0,0,0,0,0,89,0,0,0,0,0,0,0,0,0,0,0,0,0,0,0,0,0
"SWE_039_MZB_LO_20","SWE_039_MZB_LO_20-06.10.2006","06.10.2006",2006,10,6,0,0,2,0,0,0,0,0,0,0,46,5,0,126,0,1,0,0,1,69,7,7,0,3,7,0,442,0,0,0,0,2,0,0,0,0,15,0,0,2,0,0,0,0,0,19,8,0,15,0,0,0,0,0,0,1,0,0,0,0,0,0,0,16,0,0,0,0,0,0,0,5,52,0,0,2,150,136,0,10,16,8,0,0,0,0,0,0,0,0,2,0,187,0,0,0,0,51,16,4,0,16,0,0,0,0,0,0,0,0,0,0,76,0,0,3,6,0,3,0,0,0,13,0,6,13,0,0,0,0,0,71,0,0,0,1,0,0,0,0,0,0,0,0,0,0,0,0,0
"SWE_039_MZB_LO_20","SWE_039_MZB_LO_20-01.10.2007","01.10.2007",2007,10,1,0,0,5,0,0,0,0,0,0,0,119,1,0,20,0,0,0,0,0,22,4,4,0,5,23,0,75,0,0,1,0,1,0,2,0,1,2,0,0,0,0,0,0,0,0,7,4,0,7,0,4,0,0,0,0,0,0,0,0,0,0,0,0,41,0,0,0,1,0,0,0,16,10,0,0,0,100,430,0,17,8,18,0,0,0,0,0,0,0,0,5,0,138,0,0,0,0,82,4,2,0,17,0,0,0,0,0,0,0,0,0,0,24,0,0,2,4,0,4,0,0,0,1,1,0,2,0,0,0,0,0,58,0,0,0,1,0,1,0,0,0,0,0,0,0,0,0,0,0
"SWE_039_MZB_LO_20","SWE_039_MZB_LO_20-27.09.2008","27.09.2008",2008,9,27,0,0,18,0,0,0,0,0,0,0,19,1,0,100,0,0,0,0,0,62,10,10,0,13,14,0,123,0,0,0,0,0,0,0,0,0,12,0,0,0,0,0,0,0,0,9,1,1,89,0,0,0,0,0,0,0,0,2,0,0,0,0,0,78,0,0,0,1,0,0,0,26,8,0,0,3,71,383,0,6,14,11,0,0,0,0,0,0,0,0,2,0,274,0,0,0,0,65,14,10,0,33,0,0,0,0,0,0,0,0,0,0,60,0,0,8,11,0,14,0,0,0,1,0,4,13,0,0,0,0,0,116,0,0,0,0,0,1,0,0,0,0,0,0,0,0,0,0,0
"SWE_039_MZB_LO_20","SWE_039_MZB_LO_20-29.09.2009","29.09.2009",2009,9,29,0,0,3,0,0,0,0,0,0,0,16,1,0,275,0,0,0,0,0,966,4,4,0,25,45,0,252,0,0,0,0,0,0,0,0,0,0,0,0,1,0,0,0,0,0,8,5,4,11,0,0,0,0,0,1,0,0,1,0,0,0,0,0,61,0,4,0,3,0,0,0,119,134,0,0,0,34,902,0,2,33,11,0,0,0,0,0,0,0,0,9,0,400,0,0,0,0,72,26,11,0,46,0,0,0,0,0,0,0,0,0,0,107,0,0,35,3,0,13,0,0,0,1,0,2,8,0,0,0,0,0,67,0,0,0,1,0,0,0,0,0,0,0,0,0,0,0,0,0
"SWE_039_MZB_LO_20","SWE_039_MZB_LO_20-26.09.2010","26.09.2010",2010,9,26,0,0,2,0,0,0,0,0,0,0,3,1,0,104,0,0,0,0,0,103,5,5,0,0,6,0,79,0,0,0,0,0,0,1,0,0,1,0,0,1,0,0,0,0,0,13,1,1,4,0,0,0,0,0,0,0,0,1,0,0,0,0,0,45,0,2,0,2,0,0,1,90,32,0,0,0,61,315,0,8,32,1,2,0,0,0,0,0,0,0,1,0,310,0,0,0,0,44,5,7,0,18,0,0,0,0,0,0,0,0,0,0,28,0,0,12,0,0,18,0,0,0,0,0,0,13,0,0,0,0,0,40,0,0,0,3,0,1,0,0,0,0,0,0,0,0,0,0,0
"SWE_039_MZB_LO_20","SWE_039_MZB_LO_20-01.10.2011","01.10.2011",2011,10,1,0,0,3,0,0,0,0,0,0,0,7,1,0,93,0,0,0,0,0,164,12,12,0,9,9,0,75,0,0,0,0,1,0,0,0,0,5,0,0,0,0,0,0,0,0,8,3,1,40,0,0,0,0,0,0,0,0,2,0,0,0,0,0,41,0,1,0,3,0,0,0,22,15,0,0,2,86,268,0,30,35,9,1,0,0,0,0,0,0,0,5,0,210,0,0,0,0,90,11,4,0,38,0,0,0,0,0,0,0,0,0,0,75,0,0,5,3,0,6,0,0,0,0,0,1,11,0,0,0,0,0,90,0,0,1,9,0,0,0,0,0,0,0,0,0,0,0,0,0
"SWE_039_MZB_LO_20","SWE_039_MZB_LO_20-25.09.2012","25.09.2012",2012,9,25,0,0,6,0,0,0,0,0,0,0,8,4,0,74,0,0,0,0,0,27,10,10,0,11,7,0,77,0,0,0,0,0,0,0,0,0,11,0,0,3,0,0,0,1,0,11,2,0,4,0,0,0,0,0,0,0,0,2,0,0,0,0,0,11,0,0,0,1,0,0,0,4,11,0,0,1,65,165,0,49,18,2,3,0,0,0,0,0,0,0,3,0,151,0,0,0,0,98,10,17,0,22,0,0,0,0,0,0,0,0,0,0,34,0,0,6,1,0,21,0,0,0,0,1,0,2,0,0,0,0,0,60,0,0,0,5,0,1,0,0,0,0,0,0,0,0,0,0,0
"SWE_039_MZB_LO_20","SWE_039_MZB_LO_20-17.09.2013","17.09.2013",2013,9,17,0,0,6,0,0,0,0,0,0,0,7,2,0,193,0,0,0,0,0,452,6,6,0,18,24,0,379,0,0,0,0,1,0,0,0,0,3,0,0,2,0,0,0,0,0,18,5,5,103,0,0,0,0,0,0,1,0,1,0,0,0,0,0,20,0,1,0,3,0,0,0,32,30,0,0,1,68,389,0,11,12,18,1,0,0,0,0,0,0,0,2,0,220,0,0,0,0,180,70,25,0,104,1,0,0,0,0,0,0,0,0,0,162,0,0,0,1,0,13,0,0,0,0,1,6,2,0,0,0,0,0,92,0,0,0,2,0,0,0,0,0,0,0,0,0,0,0,0,0
"SWE_039_MZB_LO_20","SWE_039_MZB_LO_20-26.09.2014","26.09.2014",2014,9,26,0,0,10,0,0,0,0,0,0,0,4,0,0,54,0,0,0,0,0,0,1,1,0,0,10,0,40,0,0,0,0,0,0,3,0,0,12,0,0,0,1,0,0,0,0,10,2,0,1,0,0,0,0,0,0,0,0,4,0,0,0,0,0,9,0,0,0,5,0,0,0,14,11,0,0,0,25,117,0,15,2,1,1,0,0,0,0,0,0,0,2,0,88,0,0,0,0,118,5,4,0,14,0,0,0,0,0,0,0,0,0,0,12,0,0,0,0,0,4,0,0,0,1,0,0,4,0,0,0,0,0,29,0,0,0,0,0,1,0,0,0,0,0,0,0,0,0,0,0
"SWE_039_MZB_LO_20","SWE_039_MZB_LO_20-13.09.2015","13.09.2015",2015,9,13,0,0,29,0,0,0,0,0,0,0,22,2,0,89,0,0,0,0,0,48,2,2,0,5,47,0,163,0,0,0,0,0,0,0,0,0,0,0,0,2,0,0,0,1,0,31,8,2,24,0,0,0,0,0,0,4,0,2,0,0,0,0,0,25,0,1,0,0,0,0,1,52,52,0,0,1,28,450,0,13,22,6,0,0,0,0,0,0,0,0,3,0,336,0,0,0,0,219,17,17,0,47,0,0,0,0,0,0,0,0,0,0,82,0,0,2,3,0,31,0,0,0,9,16,7,6,0,0,0,0,0,95,0,0,0,2,0,0,0,0,0,1,0,0,0,0,0,0,0
"SWE_039_MZB_LO_20","SWE_039_MZB_LO_20-18.09.2016","18.09.2016",2016,9,18,0,0,3,0,0,0,0,0,0,0,8,1,0,132,0,0,0,0,0,333,1,1,0,9,33,0,303,0,0,0,0,0,0,0,0,0,2,0,0,6,0,0,0,0,0,30,8,1,112,0,0,0,0,0,0,6,0,4,0,0,0,0,0,34,0,6,0,0,0,0,1,41,18,0,0,52,42,403,0,23,21,7,0,0,0,0,0,0,0,0,4,0,148,0,0,0,0,165,48,11,0,84,0,0,0,0,0,1,0,0,0,0,175,0,0,0,2,0,12,0,0,0,14,0,10,7,0,0,0,0,0,56,0,0,0,0,0,0,0,0,0,1,0,0,0,0,0,0,0
"SWE_039_MZB_LO_20","SWE_039_MZB_LO_20-19.09.2017","19.09.2017",2017,9,19,0,0,33,0,0,0,0,0,0,0,29,0,2,32,0,0,0,0,0,26,0,0,0,2,18,0,81,0,0,0,0,0,0,0,0,0,7,0,0,0,0,0,0,0,0,36,7,0,8,0,0,0,0,0,0,0,0,0,0,0,0,0,0,24,0,1,0,0,0,0,0,42,25,0,0,20,39,122,0,99,12,7,0,0,0,0,0,0,0,0,3,0,86,0,0,0,0,163,13,9,0,9,1,0,1,0,0,0,0,0,0,0,47,0,0,2,1,0,8,0,0,0,2,1,3,1,0,0,0,0,0,23,0,0,0,0,0,2,0,0,0,3,0,0,0,0,0,0,0
"SWE_039_MZB_LO_20","SWE_039_MZB_LO_20-15.09.2018","15.09.2018",2018,9,15,0,0,25,0,0,0,0,0,0,0,55,0,0,47,0,0,0,0,0,642,15,15,0,0,6,0,405,0,0,0,0,10,0,1,0,0,18,0,0,16,0,0,0,0,0,38,6,1,209,0,0,0,0,0,0,1,0,2,0,0,0,0,0,26,0,4,0,1,0,0,0,18,33,0,0,277,125,227,0,58,74,12,0,0,0,0,0,0,1,0,2,0,257,0,0,0,0,156,50,2,0,31,0,0,0,0,0,0,0,0,0,0,82,0,0,3,1,0,5,0,0,0,17,1,3,4,0,0,0,0,0,50,0,0,1,2,0,1,0,0,0,0,0,0,0,0,0,0,0
"SWE_039_MZB_LO_20","SWE_039_MZB_LO_20-11.09.2019","11.09.2019",2019,9,11,0,0,12,0,0,0,0,0,0,0,77,0,0,97,0,0,0,0,0,227,10,10,0,4,18,0,137,0,0,0,0,17,0,0,0,0,0,0,0,1,0,0,0,0,0,46,20,0,34,0,0,0,0,0,0,2,0,0,0,0,0,0,0,22,0,0,0,2,0,0,0,170,11,0,0,96,63,324,0,217,95,0,0,0,0,0,0,0,0,0,2,0,190,0,0,0,0,199,25,2,0,51,0,0,0,0,0,1,0,0,0,0,40,0,0,2,0,0,12,0,0,0,11,2,9,3,0,0,0,0,0,43,0,0,0,2,0,0,0,0,0,0,0,0,0,0,0,0,0
"SWE_039_MZB_LO_21","SWE_039_MZB_LO_21-19.09.2006","19.09.2006",2006,9,19,0,0,0,0,0,0,0,0,0,0,0,0,0,0,0,0,0,0,0,0,0,0,0,0,1,0,241,0,0,0,0,0,0,0,0,0,0,0,0,0,0,0,0,12,0,0,0,3,0,0,0,0,0,0,0,0,0,0,0,0,0,0,0,0,0,12,0,0,0,0,0,0,27,0,0,0,0,347,0,26,0,0,0,0,0,0,0,0,0,0,0,0,1104,0,0,0,0,6,0,18,0,0,0,0,0,0,0,0,0,0,0,0,96,0,0,0,0,0,0,0,0,0,0,0,0,1713,0,0,0,0,0,69,0,0,0,0,0,0,0,0,0,0,0,0,0,0,0,0,0
"SWE_039_MZB_LO_21","SWE_039_MZB_LO_21-22.09.2007","22.09.2007",2007,9,22,0,0,0,0,0,0,0,0,0,0,0,0,0,0,0,0,0,0,0,0,0,0,0,0,2,0,652,0,0,0,0,0,0,0,0,1,0,0,0,0,0,0,0,6,0,0,0,3,0,0,0,0,0,0,0,0,0,0,0,0,0,0,1,0,0,7,0,0,0,0,0,0,2,0,0,0,0,119,0,14,0,2,0,0,0,0,0,0,0,0,0,0,235,0,0,0,0,4,0,9,0,0,0,0,0,0,0,0,0,0,0,0,112,0,0,0,0,0,0,0,0,0,0,0,0,72,0,0,0,0,0,58,0,0,0,0,0,1,0,0,0,0,0,0,0,0,0,0,0
"SWE_039_MZB_LO_21","SWE_039_MZB_LO_21-21.09.2008","21.09.2008",2008,9,21,0,0,0,0,0,0,0,0,0,0,0,0,0,0,0,0,0,0,0,0,0,0,0,0,2,0,427,0,0,0,0,0,0,0,0,0,0,0,0,0,0,0,0,17,0,0,0,0,0,0,0,0,0,0,0,0,0,0,0,0,0,0,0,0,0,8,0,0,0,0,0,0,13,0,0,0,0,55,0,34,0,3,0,0,0,0,0,0,0,0,0,0,2149,0,0,0,0,7,0,18,0,0,0,0,0,0,0,0,0,0,0,0,64,0,0,0,0,0,0,0,0,0,0,0,0,622,0,0,0,0,0,56,0,0,0,0,0,0,0,0,0,0,0,0,0,0,0,0,0
"SWE_039_MZB_LO_21","SWE_039_MZB_LO_21-24.09.2009","24.09.2009",2009,9,24,0,0,0,0,0,0,0,0,0,0,0,0,0,0,0,0,0,0,0,0,0,0,0,0,0,0,599,0,0,0,0,0,0,0,0,0,0,0,0,0,0,0,0,13,0,0,0,3,0,0,0,0,0,0,0,0,0,0,0,0,0,0,0,0,0,17,0,0,0,0,0,0,45,0,0,0,0,97,0,36,0,4,0,0,0,0,0,0,0,0,0,0,2559,0,0,0,0,3,0,29,0,0,0,0,0,0,0,0,0,0,0,0,112,0,0,0,0,0,2,0,0,0,0,0,0,1794,0,0,0,0,0,35,0,0,0,0,0,0,0,0,0,0,0,0,0,0,0,0,0
"SWE_039_MZB_LO_21","SWE_039_MZB_LO_21-07.09.2010","07.09.2010",2010,9,7,0,0,1,0,0,0,0,0,0,0,0,0,0,0,0,0,0,0,0,0,0,0,0,0,0,0,176,0,0,0,0,0,0,0,0,0,0,0,0,0,0,0,0,2,0,0,0,5,0,0,0,0,0,0,0,0,0,0,0,0,0,0,0,0,0,5,0,0,0,0,0,0,22,0,0,0,0,90,0,14,0,0,0,0,0,0,0,0,0,0,0,0,1143,0,0,0,0,9,0,8,0,0,0,0,0,0,0,0,0,0,0,0,99,0,0,0,0,0,3,0,0,0,0,0,0,106,0,0,0,0,0,15,0,0,0,1,0,0,0,0,0,0,0,0,0,0,0,0,0
"SWE_039_MZB_LO_21","SWE_039_MZB_LO_21-09.09.2011","09.09.2011",2011,9,9,0,0,0,0,0,0,0,0,0,0,0,0,0,0,0,0,0,0,0,0,0,0,0,0,0,0,153,0,0,0,0,0,0,0,0,0,0,0,0,0,0,0,0,7,0,1,0,0,0,0,0,0,0,0,3,0,0,0,0,0,0,0,0,0,0,2,0,0,0,0,0,0,61,0,0,0,0,20,0,6,0,0,0,0,0,0,0,0,0,0,0,0,642,0,0,0,0,11,0,2,0,0,0,0,0,0,0,0,0,0,0,0,50,0,0,0,0,0,0,0,0,0,0,0,0,251,0,0,0,0,0,23,0,0,0,0,0,0,0,0,0,0,0,0,0,0,0,0,0
"SWE_039_MZB_LO_21","SWE_039_MZB_LO_21-19.09.2012","19.09.2012",2012,9,19,0,0,0,0,0,0,0,0,0,0,2,0,0,0,0,0,0,0,0,0,0,0,0,0,2,0,321,0,0,0,0,0,0,0,0,0,0,0,0,0,0,0,0,14,0,0,0,1,0,0,0,0,0,0,0,0,0,0,0,0,0,0,0,0,0,7,0,0,0,0,0,0,48,0,0,0,1,77,0,45,0,0,0,0,0,0,0,0,0,0,0,0,1501,0,0,0,0,10,0,16,0,0,0,0,0,0,0,0,0,0,0,0,92,0,0,0,0,0,5,0,0,0,0,0,0,248,0,0,0,0,0,7,0,0,0,0,0,0,0,0,0,0,0,0,0,0,0,0,0
"SWE_039_MZB_LO_21","SWE_039_MZB_LO_21-18.09.2013","18.09.2013",2013,9,18,0,0,0,0,0,0,0,0,0,0,0,0,0,0,0,0,0,0,0,0,0,0,0,0,1,0,156,0,0,0,0,0,0,0,0,0,0,0,0,0,0,0,0,3,0,0,0,0,0,0,0,0,0,0,0,0,0,0,0,0,0,0,0,0,0,1,0,0,0,0,0,0,1,0,0,0,0,26,0,10,0,2,0,0,0,0,0,0,0,0,0,0,228,0,0,0,0,17,0,5,0,0,0,0,0,0,0,0,0,0,0,0,92,0,0,0,0,0,0,0,0,0,0,0,0,45,0,0,0,0,0,41,0,0,0,0,0,1,0,0,0,0,0,0,0,0,0,0,0
"SWE_039_MZB_LO_21","SWE_039_MZB_LO_21-18.09.2014","18.09.2014",2014,9,18,0,0,0,0,0,0,0,0,0,0,0,0,0,0,0,0,0,0,0,0,0,0,0,0,2,0,181,0,0,0,0,0,0,0,0,0,0,0,0,0,0,0,0,10,0,0,0,0,0,0,0,0,0,0,0,0,0,0,0,0,0,0,0,0,0,4,0,2,0,0,0,0,69,0,0,0,1,109,0,10,0,0,0,0,0,0,0,0,0,0,0,0,672,0,0,0,0,3,0,6,0,0,0,0,0,0,0,0,0,0,0,0,154,0,0,0,0,0,5,0,0,0,0,0,0,213,0,0,0,0,0,37,0,0,0,0,0,0,0,0,0,0,0,0,0,0,0,0,0
"SWE_039_MZB_LO_21","SWE_039_MZB_LO_21-19.09.2015","19.09.2015",2015,9,19,0,0,0,0,0,0,0,0,0,0,1,0,0,0,0,0,0,0,0,0,0,0,0,0,2,0,143,0,0,0,0,0,0,0,0,0,0,0,0,0,0,0,0,7,0,0,0,0,0,0,0,0,0,0,0,0,0,0,0,0,0,0,0,0,0,2,0,0,0,0,0,0,0,0,0,0,0,73,0,14,0,2,0,0,0,0,0,0,0,0,0,0,311,0,0,0,0,7,0,9,0,0,0,0,0,0,0,0,0,0,0,0,52,0,0,0,0,0,0,0,0,0,0,0,0,61,0,0,0,0,0,32,0,0,0,0,0,1,0,0,0,0,0,0,0,0,0,0,0
"SWE_039_MZB_LO_21","SWE_039_MZB_LO_21-10.09.2016","10.09.2016",2016,9,10,0,0,0,0,0,0,0,0,0,0,0,0,0,0,0,0,0,0,0,0,0,0,0,0,3,0,176,0,0,0,0,0,0,0,0,0,0,0,0,0,0,0,0,14,0,0,0,0,0,0,0,0,0,0,2,0,0,0,0,0,0,0,0,0,0,1,0,0,0,0,0,0,0,0,0,0,0,101,0,40,0,1,0,0,0,0,0,0,0,0,0,0,1104,0,0,0,0,5,0,28,0,0,0,0,0,0,0,0,0,0,0,0,118,0,0,0,0,0,6,0,0,0,0,0,0,58,0,0,0,0,0,34,0,0,0,0,0,1,0,0,0,0,0,0,0,0,0,0,0
"SWE_039_MZB_LO_21","SWE_039_MZB_LO_21-15.09.2017","15.09.2017",2017,9,15,0,0,0,0,0,0,0,0,0,0,0,0,0,0,0,0,0,0,0,0,0,0,0,0,1,0,68,0,0,0,0,0,0,0,0,0,0,0,0,0,0,0,0,3,0,0,0,0,0,0,0,0,0,0,0,0,0,0,0,0,0,0,0,0,0,0,0,0,0,0,0,0,0,0,0,0,0,8,0,8,0,0,0,0,0,0,0,0,0,0,0,0,127,0,0,0,0,4,0,3,0,0,0,0,0,0,0,0,0,0,0,0,14,0,0,0,0,0,1,0,0,0,0,0,0,56,0,0,0,0,0,2,0,0,0,0,0,2,0,0,0,0,0,0,0,0,0,0,0
"SWE_039_MZB_LO_21","SWE_039_MZB_LO_21-14.09.2018","14.09.2018",2018,9,14,0,0,0,0,0,0,0,0,0,0,0,0,0,0,0,0,0,0,0,0,0,0,0,0,0,0,292,0,0,0,0,0,0,0,0,0,0,0,0,0,0,0,0,1,0,0,0,0,0,0,0,0,0,0,0,0,0,0,0,0,0,0,0,0,0,0,0,0,0,0,0,0,0,0,0,0,0,55,0,3,0,1,0,0,0,0,0,0,0,0,0,0,51,0,0,0,0,3,0,10,0,0,0,0,0,0,0,0,0,0,0,0,121,0,0,0,0,0,1,0,0,0,1,0,0,1,0,0,0,0,0,14,0,0,0,0,0,0,0,0,0,0,0,0,0,0,0,0,0
"SWE_039_MZB_LO_21","SWE_039_MZB_LO_21-12.09.2019","12.09.2019",2019,9,12,0,0,0,0,0,0,0,0,0,0,0,0,0,0,0,0,0,0,0,0,0,0,0,0,0,0,126,0,0,0,0,0,0,0,0,0,0,0,0,0,0,0,0,32,0,0,0,11,0,0,0,0,0,0,0,0,0,0,0,0,0,0,0,0,0,1,0,0,0,0,0,0,2,0,0,0,0,74,0,18,0,4,0,0,0,0,0,0,0,0,0,0,418,0,0,0,0,21,0,7,0,0,0,0,0,0,0,0,0,0,0,0,38,0,0,0,0,0,0,0,0,0,0,0,0,178,0,0,0,0,0,6,0,0,0,0,0,0,0,0,0,0,0,0,0,0,0,0,0
"SWE_039_MZB_LO_22","SWE_039_MZB_LO_22-03.10.2007","03.10.2007",2007,10,3,0,0,0,0,0.6,0,9.2,0,0,0,0,0,0,145.6,0,0,0,0,0.4,0,0,0,0,0.8,5.2,0,173.8,0,0,0,0,0,0,0,0,0,0,0,0.2,0,0,0,0,0,0,91.2,0,0,0,0.6,0,0,0,0,0,0,0,0,0,0,0,0,0,0,0,0,13.6,2.4,0,0,0,0,5.2,0,9.8,0,10.4,11.6,0,7.2,0,0.4,0,0,0,0,0,0,0,0,0,0,37.4,0,0,0,0,4.4,2,0,0,3.2,0.2,0,0,0,0,0,0,0,0,0,10.2,0,0,0,0,0,2.6,0,0,0,14.8,0,2.2,27.6,0,1,0,0,0,0,0,0,0,3,0,0,0,0,0,0,0,0,0,0,0,0,0
"SWE_039_MZB_LO_22","SWE_039_MZB_LO_22-29.09.2008","29.09.2008",2008,9,29,0,0,0,0,0,0,0,0,0,0,0,0,0,56.8,0,0,0,0,0.2,0,0,0,0,0.2,1.6,0,156.8,0,0,0,0,0,0,0,0,0,0,0,0,0,0,0,0,0,0,17.6,0.6,0,0,0.4,0,0,0,0,0,0,0,0,0,0,0,0,0,0,0,0,6.6,0.6,0,0,0,0.4,4,0,0.8,0,2.6,7.4,0,2.8,0,0,0,0,0,0.2,0,0,0,0,0,0,23.6,0,0,0,0,1.2,0.2,0,0,2.6,0.6,0,0,0,0,0,0,0,0,0,1.6,0,0,0.4,0,0,2.8,0,0,0,0.6,0,0.2,52.6,0,0.6,0,0,0,0,0,0,0,2.8,0,0,0,0,0,0,0,0,0,0,0,0,0
"SWE_039_MZB_LO_22","SWE_039_MZB_LO_22-13.10.2011","13.10.2011",2011,10,13,0,0,0,0,0,0,2,0,0,0,0,0,0,32.75,0,0,0,0,0.75,0,0,0,0,0,6.25,0,112.5,0,0,0,0,0,0,0,0,0,0,0,0,0,0,0,0,0,0,39.75,3.5,0.25,0,1,0,0,0,0,0,0,0,0,0,0,0,0,0,0.5,0,0,7.25,2,0,0,0,4.5,0.75,0,6.25,0,0,11.75,0,0.75,0,0,0,0,0,0.25,0,0,0,0,0,0,95.75,0,0,0,0,6,0,0.5,0,1.25,0,0,0,0,0,0,0,0,0,0,0,0,0,2.5,0,0,1.5,0,0,0,0.25,0,0,54.25,0,0.5,0,0,0,0,0,0,0,0.25,0,0,0,0,0,0.25,0,0,0,0,0,0,0
"SWE_039_MZB_LO_22","SWE_039_MZB_LO_22-16.10.2012","16.10.2012",2012,10,16,0,0,0,0,0.4,0,0,0,0,0,0,0,0,108.6,0,0,0,0,5.6,0,0,0,0,0,9,0,205.4,0,0,0,0,0,0,0,0,0,0,0,0,0,0,0,0,0,0,43.2,8,8.2,0,1.4,0,0,0,0,0,0,0,0,0,0,0,0,0,0,0,0,11.4,0.8,0,0,0,4.6,1,0,8.4,0,0,20.8,0,8,0,0.2,0,0,0,0.6,0,0,0,0,0,0,199.8,0,0,0,0,13.6,0.4,4,0,1.8,0,0,0,0,0,0,0,0,0,0,1,0,0,1,0,0,3.8,0,0,0,4.4,0,0,83.4,0,0,0,0,0,0,0,0.4,0,2.6,0,0,0,0,0,0,0,0,0,0,0,0,0
"SWE_039_MZB_LO_22","SWE_039_MZB_LO_22-15.10.2013","15.10.2013",2013,10,15,0,0,0,0,0,0,3.2,0,0,0,0,0,0,97.2,0,0,0,0,0.2,0,0,0,0,0.2,37.4,0,197.4,0,0,0,0,0,0,0,0,0,0,0,0,0,0,0,0,0,0,161.6,0,2.6,0,0.6,0,0,0,0,0,0,0,0,0,0,0,0,0,0.6,0,31,0,7,0,0,0,12,6.2,0,12.8,0,0.6,19.6,0,0.2,0,0,0,0,0,0.4,0,0,0,0,0,0,119,0,0,0,0,35,2,2.4,0,1.4,0,0,0,0,0,0,0,0,0,0,1.2,0,0,4.4,0,0,3.8,0,0,0,3,0,0,56.6,0,1.4,0,0,0,0,0,0,0,1.4,0,0,0,0,0,0,0,0,0,0,0,0,0
"SWE_039_MZB_LO_22","SWE_039_MZB_LO_22-08.10.2014","08.10.2014",2014,10,8,0,0,0,0,0,0,3.6,0,0,0,0,0,0,139,0,0,0,0,0.8,0,0,0,0,0,18.2,0,950.8,0,0,0,0,0,0,0,0,0,0,0,0,0,0,0,0,0,0,59,1.2,1.6,0,0,0,0,0,0,0,0,0,0,0,0,0,0,0,0.4,0,46.2,0,3.2,0,0,0,7.6,5.4,0,8.4,0,2.2,27.4,0,9.8,0,0,0,0,0,0,0,0,0,0,0,0,81.2,0,0,0,0,16,1.2,0.2,0,0.4,0,0,0,0,0,0,0,0,0,0,1,0,0,2.4,0,0,2.8,0,0,0,2.8,0,0.4,39.2,0,1.2,0,0,0,0,0,0.2,0,3.6,0,0,0,0,0,0,0,0,0,0,0,0,0
"SWE_039_MZB_LO_22","SWE_039_MZB_LO_22-30.09.2015","30.09.2015",2015,9,30,0,0,0,0,3.6,0,14.87,0,0,0,0,0,0,168,0,0,0,0,0.8,0,0,0,0,1.27,19.53,0,298.14,0,0,0,0,0,0,0,0,0,0,0,0,0,0,0,0,0,0,81.4,0.4,2.67,0,0.47,0,0,0,0,0,0,0,0,0,0,0,0,0,0.4,0,18.73,0,7.07,0,0,0,4.4,2,0,8.4,0,2.2,44.06,0,4.13,0,0,0,0,0,1.73,0,0,0,0,0,0,103.2,0,0,0,0,13.4,4.27,2.87,0,1.6,0.27,0,0,0,0,0,0,0,0,0,3.4,0,0,2.73,0,0,3,0,0,0,5.47,0,0,40.6,0,3.27,0,0,0,0,0,0,0,5.4,0,0,0,0,0,0,0,0,0,0,0,0,0
"SWE_039_MZB_LO_22","SWE_039_MZB_LO_22-18.10.2016","18.10.2016",2016,10,18,0,0,0,0,3.13,0,5.33,0,0,0,0,0,0,215.8,0,0,0,0,3.93,0,0,0,0,1.47,18.6,0,334.93,0,0,0,0,0,0,0,0,0,0,0,0,0,0,0,0,0,0,174.07,1.67,5.73,0,4.07,0,0,0,0,0,0,0,0,0,0,0,0,0,0,0,42.07,0,7.53,0,0,0,38.73,32.34,0,12.33,0,0,79.2,0,4.8,0,0,0,0,0,2.07,0,0,0,0,0,0,117.67,0,0,0,0,8.26,1,2.8,0,5.47,1,0,0,0,0,0,0,0,0,0,2.4,0,0,6.47,0,0,5.87,0,0,0,4,0,0,292.8,0,1.53,0,0,0,0,0,0,0,0.47,0,0,0,0,0,0,0,0,0,0,0,0,0
"SWE_039_MZB_LO_22","SWE_039_MZB_LO_22-11.10.2017","11.10.2017",2017,10,11,0,0,0,0,0.4,0,2.2,0,0,0,0,0,0,48.6,0,0,0,0,0.6,0,0,0,0,0,9.6,0,144.8,0,0,0,0,0,0,0,0,0,0,0,0,0,0,0,0,0,0,27.2,0.4,0.4,0,0.2,0,0,0,0,0,0,0,0,0,0,0,0,0,0.4,0,9,0,0,0,0,0,2,8.6,0,1.6,0,0,32.2,0,0,0,0.4,0,0,0,0,0,0,0,0,0,0,57.6,0,0,0,0,16,0.6,1,0,2,0.6,0,0,0,0,0,0,0,0,0,0.6,0,0,0,0,0,0.8,0,0,0,2,0,0,19,0,0.6,0,0,0,0,0,0,0,1.4,0,0,0,0,0,0,0,0,0,0,0,0,0
"SWE_039_MZB_LO_22","SWE_039_MZB_LO_22-23.10.2018","23.10.2018",2018,10,23,0,0,0,0,3.07,0,0.4,0,0,0,0,0,0,35.8,0,0,0,0,0,0,0,0,0,0.4,2.33,0,429.67,0,0,0,0,0,0,0,0,0,0,0,0,0,0,0,0,0,0,42,0.93,0.67,0,1.13,0,0,0,0,0,0,0,0,0,0,0,0,0,0,0,10.73,0,0.27,0,0,0,0,38.46,0,4,0,5.8,12.07,0,9.07,0,0,0,0,0,0,0,0,0,0,0,0,62.8,0,0,0,0,3.2,0,2.47,0,0.27,0,0,0,0,0,0,0,0,0,0,1.07,0,0,6.13,0,0,3.07,0,0,0,3.27,0,0.27,107.73,0,0.27,0,0,0,0,0,0,0,2,0,0,0,0,0,0,0,0,0,0,0,0,0
"SWE_039_MZB_LO_22","SWE_039_MZB_LO_22-02.10.2019","02.10.2019",2019,10,2,0,0,0,0,1.6,0,9.8,0,0,0,0,0,0,140.2,0,0,0,0,0.2,0,0,0,0,0,18.2,0,213,0,0,0,0,0,0,0,0,0,0,0,0,0,0,0,0,0,0,85.2,3.6,4.4,0,1.4,0,0,0,0,0,0,0,0,0,0,0,0,0,0.2,0,39.8,0,6,0,0,0.6,0,17,0,10.6,0,0,39.8,0,9.6,0,0.6,0,0,0,0,0,0,0,0,0,0,152.4,0,0,0,0,23.4,1.2,6,0,4,0,0,0,0,0,0,0,0,0,0,0.6,0,0,8.8,0,0,2.6,0,0,0,7.2,0,0,39.6,0,1.6,0,0,0,0,0,0.4,0,8.6,0,0,0,0,0,0,0,0,0,0,0,0,0
"SWE_039_MZB_LO_23","SWE_039_MZB_LO_23-27.09.2007","27.09.2007",2007,9,27,0,0,17.2,0,4,0,0,0,0,0,0,0,0,78.2,0,0,0,0,0,0.2,0.6,0.6,0.4,0,4.4,0,21.8,0,0,0,0,0,0,0.4,0,0,0,0,0,0,0,0,0,0.2,0,3.2,0.4,0,6.4,24,0,0,0.6,0,0,0.2,0,0,0,0,0,0,0,16.8,0,0,3,0.2,0,0,0,11.2,24.4,0,5.6,18.4,24.8,2.8,0,1.2,9,2.2,16,0,0,0,0,0,0.2,0,0,0,37.6,0,0,0,0,10.4,7.8,3.6,0,5.2,0.2,0,0,0,0,3,0,0,0,0,0.2,0,0,0,0,0,2.2,0,0,0,3,0,0.8,1.6,0,0.4,0,0.2,0,1.6,0,0,0,2.4,0,1.6,0,0,0,0,0,0,0,0,0,0,0
"SWE_039_MZB_LO_23","SWE_039_MZB_LO_23-09.09.2008","09.09.2008",2008,9,9,0,0,6.6,0,2.2,0,0,0,0,0,0,0,0,25.6,0,0,0,0,0,0.2,0,0,0.4,0,7.8,0,18,0,0,0,0,0,0,0,0,0,0,0,0,0,0,0,0,0,0,1.4,0,0.2,8,0.6,0,0,0.4,0,0,0.2,0,0.4,0,0,0,0,0,10,0,0,1.8,0.2,0,0,0,2.2,6.2,0,1.6,4.4,6.2,0.6,0,0.2,10.6,0.8,2.6,0,0,0,0,0,0,0,0,0,1.2,0,0,0,0,27,1.8,1.8,0,6,0,0,0,0,0,2.6,0,0,0,0,0,0,0,0.2,0,0,1.4,0,0,0,3,0.2,0.4,0,0,0.6,0,0,0,1.6,0,0,0,0.6,0,0,0,0,0,0,0,0,0,0,0,0,0.2
"SWE_039_MZB_LO_23","SWE_039_MZB_LO_23-11.10.2009","11.10.2009",2009,10,11,0,0,5.8,0,0,0,0,0,0,0,0,0,0,44.4,0,0,0,0,0,0,0,0,0,1.2,5.8,0,43,0,0,0,0,0,0,0,0,0,0,0,0,0,0,0,0,0,0,1.6,0,0.8,3.8,2,0,0,0,0,0,0.4,0,0.4,0,0,0,0,0,12.2,0,0,2.8,0,0,0,0,2.4,8,0,1.6,2.4,0,1.4,0,1.8,4.8,2.2,4,0.2,0,0,0,0,0,0,0,0,5.2,0,0,0,0,23,3,0.2,0,4,0,0,0,0,0,1.2,0,0,0,0,0.2,0,0,0.2,0,0,1.4,0,0,0,2.6,0,2,0.4,0,0.8,0,0,0,3.2,0,0,0,1.8,0,0.2,0,0,0,0,0,0,0,0,0,0,1
"SWE_039_MZB_LO_23","SWE_039_MZB_LO_23-15.09.2011","15.09.2011",2011,9,15,0,0,7,0,1,0,0,0,0,0,0,0,0,39.6,0,0,0,0,0,0,0,0,0.2,0,2.8,0,28,0,0,0,0,0,0,1.8,0,0,0,0,0.4,0,0,0,0,0.2,0,1.8,0,0.4,1.4,4,0,0,0,0,0,0,0,0.2,0,0,0,0,0,6.6,0,0,1,0,0,0,0,2.2,2.2,0,2,3,16.8,0.8,0,8.4,3.6,4.8,4.4,0,0,0,0,0,0,0,0,0,2.6,0,0,0,0,37.6,1.4,0.8,0,1,0,0,0,0,0,0.2,0,0,0,0,0.2,0,0,0,0,0,0.8,0,0,0,1.6,0,0.2,3.4,0,0.4,0,0,0,15.4,0,0.4,0,1.4,0,0,0,0,0,0,0,0,0,0,0,0,0
"SWE_039_MZB_LO_23","SWE_039_MZB_LO_23-07.09.2012","07.09.2012",2012,9,7,0,0,10.6,0,0,0,0,0,0,0,0,0,0,99.8,0,0,0,0,0,0.2,0,0,0.6,0,6.4,0,120.2,0,0,0,0,0,0,0,0,0,0,0,0,0,0,0,0,0,0,2.6,0,0.4,4.8,18.6,0,0,0,0,0,0,0,0.4,0,0,0,0,0,17.8,0,0,12,2,0,0,0,13.4,27.8,0.2,8.4,9.8,0,4.2,0,2,27.2,2.2,2.6,0,0,0,0,0,0,0,0,0,23.6,0,0,0,0,35,3.6,3.4,0,3,0,0,0,0,0,0,0,0,0,0,0.2,0,0,0.2,0,0.4,3,0,0,0,5.2,0.4,0,7.4,0,0.2,0,0,0,4.8,0,0,0,5.8,0,0.2,0,0,0,0,0,0,0,0,0,0,2.6
"SWE_039_MZB_LO_23","SWE_039_MZB_LO_23-07.09.2013","07.09.2013",2013,9,7,0,0,12,0,0.4,0,0,0,0,0,0,0,0,115.6,0,0,0,0,0,0.2,0,0,0,0.6,2.4,0,14,0,0,0,0,0,0,0,0,0,0,0,0,0,0,0,0,0,0,2,0,0,3.4,2.6,0,0,0,0,0,0,0,0,0,0,0,0,0,6.4,0,1.2,0,0.2,0,0,0,4.2,8.2,0,3.6,6.2,0.2,0.8,0,0,11.4,0.4,5.6,0,0,0,0,0,0,0,0,0,2.6,0,0,0,0,15.8,3.8,2,0,3.8,0,0,0,0,0,0.2,0,0,0,0,0,0,0,0,0,0,0.6,0,0,0,3.8,0,0.2,0.8,0,2,0,0,0,0.8,0,0,0,1.2,0,0,0,0,0,0,0,0,0,0,0,0,0.2
"SWE_039_MZB_LO_23","SWE_039_MZB_LO_23-08.09.2014","08.09.2014",2014,9,8,0,0,32,0,0,0,0,0,0,0,0,0,0,105,0,0,0,0,0,0,0,0,0,0.6,7,0,67,0,0,0,0,0,0,0,0,0,0,0,0,0,0,0,0,0,0,3.4,0,1.8,0.4,3,0,0,0,0,0,0,0,2.2,0,0,0,0,0,40.6,0,9.6,0,2.6,0,0,0,18.6,4,0,3.6,11.8,0,6.6,0,0,31.6,6.8,8.8,0,0,0,0,0,0,0,0,0,36,0,0,0,0,20,1.6,4.4,0,4.8,0,0,0,0,0,0.2,0,0,0,0,0,0,0,0,0,0,9.2,0,0,0,1.8,0,0,11.4,0,2,0,0,0,0,0,0.2,0,1.4,0,0,0,0,0,0,0,0,0,0,0,0,0
"SWE_039_MZB_LO_23","SWE_039_MZB_LO_23-09.09.2015","09.09.2015",2015,9,9,0,0,0.56,0,0.04,0,0,0,0,0,0,0,0,9.28,0,0,0,0,0,0,0,0,0,0,0.28,0,1.56,0,0,0,0,0,0,0,0,0,0,0,0.04,0,0,0,0,0,0,0.52,0,0,0.32,0.68,0,0,0,0,0,0,0,0.16,0,0,0,0,0,2.72,0,0.12,0,0.16,0,0,0,0.36,0.16,0,0.88,1.36,0,0.4,0,0.04,3.16,0,0.4,0,0,0,0,0,0,0,0,0,1.32,0,0,0,0,5.2,0.08,1.2,0,0.24,0,0,0,0,0,0,0,0,0,0,0,0,0,0,0,0,0.24,0,0,0,0.36,0,0,0.68,0,0.24,0,0,0,0,0,0,0,0.2,0,0,0,0,0,0,0,0,0,0,0,0,0
"SWE_039_MZB_LO_23","SWE_039_MZB_LO_23-05.09.2016","05.09.2016",2016,9,5,0,0,9.28,0,0.08,0,0,0,0,0,0,0,0,8.88,0,0,0,0,0,0,0,0,0.16,0,1.04,0,8.12,0,0,0,0,0,0,0,0,0,0,0,0,0,0,0,0,0,0,0.24,0,0.24,0,0.12,0,0,0,0,0,0,0,0.28,0,0,0,0,0,1.92,0,0.8,0,0,0,0,0,1.12,0.08,0,0.2,1.36,0,0.04,0,0,5.44,0,0.16,0,0,0,0,0,0,0,0,0,2.28,0,0,0,0,5.4,0.04,0.4,0,0.68,0,0,0,0,0,0,0,0,0,0,0,0,0,0,0,0,0.4,0,0,0,0.56,0,0,0.4,0,0.24,0,0,0,0.04,0,0,0,0.16,0,0,0,0,0,0,0.12,0,0,0,0,0,0
"SWE_039_MZB_LO_23","SWE_039_MZB_LO_23-09.09.2017","09.09.2017",2017,9,9,0,0,7.4,0,1,0,0,0,0,0,0,0,0,85.6,0,0,0,0,0,0,0.6,0.6,0.4,0,4.4,0,81.4,0,0,0,0,0,0,0,0,0,0,0,0,0,0,0,0,0.2,0,6.2,0,0,4,8.4,0,0.2,0,0,0,0,0,0.6,0,0,0,0,0,11.4,0,9,0,1,0,0,0,3.4,15.8,0,2.8,10,0.4,2.6,0,2,16,2.4,4.8,0,0,0,0,0,0,0,0,0,31.8,0,0,0,0,44.8,2.2,2,0,3.8,0,0,0,0,0,0.4,0,0,0,0,0,0,0,0,0,0,0.8,0,0,0,4.2,1,0.4,7,0,0.4,0,0,0,0.6,0,0,0,2.4,0,0,0,0,0,0,0,0,0,0,0,0,0
"SWE_039_MZB_LO_23","SWE_039_MZB_LO_23-08.09.2018","08.09.2018",2018,9,8,0,0,8,0,0,0,0,0,0,0,0,0,0,86.4,0,0,0,0,0,1.2,0,0,0,0,3.6,0,83.2,0,0,0,0,0,0,0,0,0,0,0,0,0,0,0,0,1.2,0,8.6,0,0.6,19.6,3.4,0,0,0.6,0,0,0,0,0.6,0,0,0,0,0,26.8,0,17,0,1,0,0,0,1.2,17.4,0,11.2,36,15.6,2.8,0,0,25.2,0.6,8.2,0,0,0,0,0,0,0,0,0,9.8,0,0,0,0,23.4,6,2.2,0,6.6,0,0,0,0,0,2.2,0,0,0,0,0,0,0,0,0,0,1.4,0,0,0,8.6,0,0.2,5.6,0,1.6,0,0,0,0.4,0,0,0.4,2,0,0,0,0,0,0,0.4,0,0,0,0,0,0.4
"SWE_039_MZB_LO_23","SWE_039_MZB_LO_23-16.09.2019","16.09.2019",2019,9,16,0,0,22.2,0,4.8,0,0,0,0,0,0,0,0,176.4,0,0,0,0,0,0.8,0,0,3.6,0,6.6,0,65.2,0,0,0,0,0,0,0,0,0,0,0,0,0,0,0,0,0.2,0,7,0,0,3.4,10.8,0,0,0,0,0,0,0,0.6,0,0,0,0,0,47.8,0,8,0,1.4,0,0,0,1.8,3.8,0,4.6,28.6,1,5.6,0,1.2,22,0,1.8,0,0,0,0,0,0,0,0,0,26.2,0,0,0,0,12.2,3.8,3.8,0,7.4,0,0,0,0,0,1.2,0,0,0,0,0,0,0,1.6,0,0,1.8,0,0,0,5,0,0,3,0,2.2,0,0,0,0.2,0,0,0.2,1.8,0,0.2,0,0,0,0,0,0,0,0,0,0,0
"SWE_039_MZB_LO_24","SWE_039_MZB_LO_24-20.10.2004","20.10.2004",2004,10,20,0,0,663,0,0,0,0,0,0,0,0,0,0,28,0,0,0,0,0,0,0,0,0,8,9,0,643,0,0,0,0,0,0,0,0,0,0,0,0,0,0,0,0,1,0,2,0,0,0,5,0,0,0,0,0,0,1,0,0,0,0,0,0,11,0,2,0,1,0,0,0,28,10,0,0,3,1,83,0,170,21,3,0,0,0,0,0,0,0,0,0,0,234,0,0,0,0,11,0,4,0,9,0,0,0,0,0,0,0,0,0,0,0,0,0,97,0,0,9,0,0,0,36,0,0,67,0,0,0,0,0,0,0,0,0,8,0,1,0,0,0,0,0,0,0,0,0,0,0
"SWE_039_MZB_LO_24","SWE_039_MZB_LO_24-03.09.2005","03.09.2005",2005,9,3,0,0,80,0,0,0,0,0,0,0,0,0,0,6,0,0,0,0,0,0,0,0,0,0,19,0,35,0,0,0,0,0,0,0,0,0,0,0,0,6,0,0,0,2,0,3,0,1,0,1,0,0,0,0,0,0,0,0,0,0,0,0,0,8,0,1,0,2,0,0,0,3,3,0,1,4,0,2,0,40,27,0,0,0,0,0,0,0,0,0,0,0,11,0,0,0,0,12,0,1,0,6,0,0,0,0,0,0,0,0,0,0,0,0,0,4,0,0,5,0,0,0,17,0,2,15,0,0,0,0,0,0,0,0,0,1,0,0,0,0,0,0,0,0,0,0,0,0,0
"SWE_039_MZB_LO_24","SWE_039_MZB_LO_24-16.09.2006","16.09.2006",2006,9,16,0,0,154,0,0,0,0,0,0,0,0,0,0,28,0,0,0,0,0,0,0,0,0,4,30,0,142,0,0,0,0,0,0,0,0,0,0,0,0,2,0,0,0,0,0,7,0,0,0,6,0,0,0,0,0,0,1,0,0,0,0,0,0,10,0,11,0,3,0,0,0,7,10,0,2,2,1,5,0,195,13,4,0,0,0,0,0,0,0,0,0,1,55,0,0,0,0,13,0,1,0,4,0,0,0,0,0,0,0,0,0,0,0,0,0,41,2,0,8,0,0,0,30,0,4,6,0,0,0,0,0,1,0,0,0,0,0,1,0,0,0,0,0,0,0,0,0,0,0
"SWE_039_MZB_LO_24","SWE_039_MZB_LO_24-25.09.2007","25.09.2007",2007,9,25,0,0,114,0,0,0,0,0,0,0,0,0,0,84,0,0,0,0,0,0,0,0,0,7,66,0,571,0,0,0,0,0,0,0,0,0,0,0,0,9,0,0,0,4,0,17,0,0,0,55,0,0,0,0,0,1,6,0,0,0,0,0,0,41,0,10,0,4,0,0,0,32,68,0,5,12,3,78,0,127,45,1,0,0,0,0,0,0,0,0,2,0,435,0,0,0,0,11,1,0,0,15,1,0,0,0,0,0,0,0,0,0,5,0,0,29,0,0,8,0,0,0,46,0,6,9,0,1,0,0,0,2,0,0,0,1,0,5,0,0,0,0,0,0,0,0,0,0,0
"SWE_039_MZB_LO_24","SWE_039_MZB_LO_24-16.09.2008","16.09.2008",2008,9,16,0,0,37,0,0,0,0,0,0,0,0,0,0,55,0,0,0,0,0,0,0,0,0,1,31,0,222,0,0,0,0,0,0,0,0,0,0,0,0,2,0,0,0,2,0,12,0,3,0,13,0,0,0,0,0,0,4,1,0,0,0,0,0,17,0,6,0,7,0,0,0,24,254,0,27,6,0,39,0,184,54,5,0,0,0,0,0,0,0,0,0,0,251,0,0,0,0,8,0,6,0,14,1,0,0,0,0,0,0,0,0,0,2,0,0,77,0,0,17,0,0,0,147,1,4,12,0,0,0,0,0,2,0,0,0,2,0,0,0,0,0,0,0,0,0,0,0,0,0
"SWE_039_MZB_LO_24","SWE_039_MZB_LO_24-18.09.2009","18.09.2009",2009,9,18,0,0,49,0,0,0,1,0,0,0,0,0,0,34,0,0,0,0,1,0,1,1,0,13,14,0,260,0,0,0,0,0,0,0,0,0,0,0,0,1,0,0,0,1,0,5,0,1,0,23,0,0,0,0,0,0,0,1,0,0,0,0,0,15,0,6,0,3,0,0,0,29,27,0,7,1,9,5,0,369,43,1,0,0,0,0,0,0,0,0,0,0,57,0,0,0,0,9,0,7,0,15,0,0,0,0,0,0,0,0,0,0,3,0,0,38,0,0,14,0,0,0,57,0,3,17,0,1,0,0,0,7,0,0,0,2,0,0,0,0,0,0,0,0,0,0,0,0,0
"SWE_039_MZB_LO_24","SWE_039_MZB_LO_24-04.09.2010","04.09.2010",2010,9,4,0,0,152,0,0,0,0,0,0,0,0,0,0,30,0,0,0,0,0,0,1,1,0,0,16,0,60,0,0,0,0,0,0,0,0,0,0,0,0,5,0,0,0,2,0,5,2,1,0,11,0,0,0,0,0,0,0,2,0,0,0,0,0,35,0,7,0,2,0,0,0,25,23,0,5,1,2,7,0,47,39,2,0,0,0,0,0,0,0,0,2,0,34,0,0,0,0,12,0,1,0,17,0,0,0,0,0,0,0,0,0,0,0,0,0,12,0,0,5,0,0,0,83,0,3,7,0,0,0,0,0,1,0,0,0,6,0,0,0,0,0,0,0,0,0,0,0,0,0
"SWE_039_MZB_LO_24","SWE_039_MZB_LO_24-04.10.2011","04.10.2011",2011,10,4,0,0,21,0,0,0,1,0,0,0,0,0,0,34,0,0,0,0,0,0,0,0,0,0,3,0,68,0,0,0,0,2,0,0,0,0,0,0,0,1,0,0,0,0,0,1,2,0,0,8,0,0,0,0,0,0,0,0,0,0,0,0,0,6,0,4,0,2,0,0,0,16,13,0,2,0,0,2,0,116,8,1,0,0,0,0,0,0,0,0,2,0,21,0,0,0,0,7,0,0,0,11,0,0,0,0,0,0,0,0,0,0,1,0,0,8,0,0,5,0,0,0,30,0,0,4,0,0,0,0,0,2,0,0,0,3,0,0,0,0,0,0,0,0,0,0,0,0,0
"SWE_039_MZB_LO_24","SWE_039_MZB_LO_24-13.09.2012","13.09.2012",2012,9,13,0,0,42,0,0,0,0,0,0,0,0,0,0,36,0,0,0,0,0,0,1,1,0,0,19,0,121,0,0,0,0,1,0,0,0,0,0,0,0,2,0,0,0,3,0,2,0,5,0,40,0,0,0,0,0,0,0,1,0,0,0,0,0,24,0,6,0,3,0,0,0,13,55,0,0,2,0,11,0,355,15,5,0,0,0,0,0,0,0,0,0,0,112,0,0,0,0,8,0,0,0,14,2,0,0,0,0,0,0,0,0,0,0,0,0,8,0,0,21,0,0,0,26,0,1,25,0,1,0,0,0,3,0,0,0,12,0,1,0,0,0,0,0,0,0,0,0,0,0
"SWE_039_MZB_LO_24","SWE_039_MZB_LO_24-15.09.2013","15.09.2013",2013,9,15,0,0,12,0,0,0,0,0,0,0,0,0,0,30,0,0,0,0,0,0,2,2,0,2,25,0,212,0,0,0,0,0,0,0,0,0,0,0,0,0,0,0,0,0,0,9,0,0,1,10,0,0,0,0,0,0,0,0,0,0,0,0,0,11,0,3,0,2,0,0,0,14,48,0,3,9,2,15,0,49,18,3,0,0,0,0,0,0,0,0,0,0,100,0,0,0,0,10,0,3,0,12,2,0,0,0,0,0,0,0,0,0,4,0,0,11,0,0,14,0,0,0,63,0,9,2,0,6,0,0,0,1,0,0,0,6,0,0,0,0,0,0,0,0,0,0,0,0,0
"SWE_039_MZB_LO_24","SWE_039_MZB_LO_24-15.09.2014","15.09.2014",2014,9,15,0,0,12,0,0,0,0,0,0,0,0,0,0,83,0,0,0,0,0,0,0,0,0,5,45,0,236,0,0,0,0,1,0,0,0,0,0,0,0,1,0,0,0,1,0,5,0,4,0,38,0,0,0,0,0,0,0,1,0,0,0,0,0,11,0,11,0,0,0,0,0,9,150,0,2,9,3,64,0,18,25,4,0,0,0,0,0,0,0,0,1,0,126,0,0,0,0,9,0,3,0,29,1,0,0,0,0,0,0,0,0,0,5,0,0,3,1,0,17,0,0,0,17,0,7,2,0,3,0,0,0,2,0,0,0,10,0,4,0,0,0,0,0,0,0,0,0,0,0
"SWE_039_MZB_LO_24","SWE_039_MZB_LO_24-12.09.2015","12.09.2015",2015,9,12,0,0,7,0,0,0,0,0,0,0,0,0,0,50,0,0,0,0,0,0,0,0,0,0,42,0,130,0,0,0,0,1,0,0,0,0,0,0,0,1,0,0,0,2,0,11,0,10,0,13,0,0,0,0,0,0,0,1,0,0,0,0,0,7,0,5,0,1,0,0,0,18,148,0,1,38,0,36,0,13,22,4,0,0,0,0,0,0,0,0,0,0,135,0,0,0,0,14,0,5,0,16,0,0,0,0,0,0,0,0,0,0,2,0,0,11,1,0,22,0,0,0,37,3,6,9,0,2,0,0,0,1,0,0,0,20,0,0,0,0,0,0,0,0,0,0,0,0,0
"SWE_039_MZB_LO_24","SWE_039_MZB_LO_24-09.09.2016","09.09.2016",2016,9,9,0,0,60,0,0,0,0,0,0,0,0,0,0,20,0,0,0,0,0,0,0,0,0,2,19,0,69,0,0,0,0,2,0,0,0,0,0,0,0,3,0,0,0,2,0,8,0,6,1,0,0,0,0,0,2,0,0,0,0,0,0,0,0,11,0,2,0,0,0,0,0,11,141,0,2,10,3,24,0,38,26,4,0,0,0,0,0,0,0,0,2,0,49,0,0,0,0,3,0,2,0,13,4,0,0,0,0,0,0,0,0,0,1,0,0,4,0,0,12,0,0,0,13,0,5,3,0,2,0,0,0,0,0,0,0,7,0,0,0,0,0,0,0,0,0,0,0,0,0
"SWE_039_MZB_LO_24","SWE_039_MZB_LO_24-17.09.2017","17.09.2017",2017,9,17,0,0,23,0,1,0,0,0,0,0,0,0,0,21,0,0,0,0,0,0,0,0,0,6,18,0,125,0,0,0,0,1,0,0,0,0,0,0,0,3,0,0,0,6,0,8,0,4,2,7,0,0,0,0,0,0,1,2,0,0,0,0,0,18,0,1,0,0,0,0,0,14,109,0,2,8,2,25,0,70,15,2,0,0,0,0,0,0,0,0,0,0,69,0,0,0,0,19,0,4,0,29,0,0,0,0,0,0,0,0,0,0,3,0,0,11,0,0,7,0,0,0,117,2,12,3,0,0,0,0,0,4,0,0,0,8,0,1,0,0,0,0,0,0,0,0,0,0,0
"SWE_039_MZB_LO_24","SWE_039_MZB_LO_24-11.09.2018","11.09.2018",2018,9,11,0,0,45,0,0,0,0,0,0,0,0,0,0,28,0,0,0,0,0,0,0,0,0,4,23,0,96,0,0,0,0,8,0,0,0,0,0,0,0,2,0,0,0,7,0,15,0,5,1,5,0,0,1,0,0,0,0,1,0,0,0,0,0,16,0,3,0,2,0,0,0,15,14,0,4,2,7,11,0,130,18,10,0,0,0,0,0,0,1,0,6,0,72,0,0,0,0,8,2,6,0,17,0,0,0,0,0,0,0,0,0,0,4,0,0,12,0,0,11,0,0,0,48,0,20,5,0,1,0,0,0,2,0,0,0,1,0,5,0,0,0,0,0,0,0,0,0,0,0
"SWE_039_MZB_LO_24","SWE_039_MZB_LO_24-20.09.2019","20.09.2019",2019,9,20,0,0,25,0,0,0,0,0,0,0,0,0,0,44,0,0,0,0,0,0,0,0,0,2,26,0,104,0,0,0,0,3,0,0,0,0,0,0,0,3,0,0,0,9,0,9,0,5,3,4,0,0,0,0,0,0,0,0,0,0,0,0,0,31,0,3,0,1,0,0,0,23,107,0,7,5,0,7,0,282,11,8,0,0,0,0,0,0,0,0,1,0,62,0,0,0,0,21,1,3,0,35,0,0,0,0,0,0,0,0,0,0,2,0,0,22,1,0,11,0,0,0,25,0,13,7,0,0,0,0,0,2,0,0,0,3,0,1,0,0,0,0,0,0,0,0,0,0,0
"SWE_039_MZB_LO_25","SWE_039_MZB_LO_25-03.11.2004","03.11.2004",2004,11,3,0,0,10,0,0,0,0,0,0,0,2,0,10,0,0,0,0,0,0,0,5,5,0,0,3,0,90,0,0,0,0,0,0,0,0,0,0,0,0,0,0,0,0,0,0,0,0,1,37,0,0,1,0,0,0,0,0,0,0,0,0,0,0,16,0,16,0,0,0,0,0,11,0,0,6,10,3,8,0,150,20,1,0,0,0,0,0,0,0,1,0,0,56,0,0,0,0,19,0,0,0,2,2,0,0,0,0,10,0,0,0,0,1,0,0,0,0,0,1,0,0,0,0,0,0,1,0,0,0,0,0,38,0,0,0,0,0,1,0,0,0,1,0,0,0,0,0,0,0
"SWE_039_MZB_LO_25","SWE_039_MZB_LO_25-27.09.2005","27.09.2005",2005,9,27,0,0,112,0,0,0,0,0,0,0,0,0,26,16,0,0,0,0,0,0,29,29,0,3,13,0,223,0,0,0,0,4,0,0,0,0,0,0,0,0,0,0,0,1,0,7,0,27,19,0,0,10,0,0,2,1,0,1,0,6,0,0,0,66,0,1,0,3,0,0,0,72,4,0,13,66,26,4,0,163,84,3,0,0,0,0,0,0,0,0,1,0,196,0,0,0,0,60,7,0,0,7,14,0,0,0,0,26,0,0,0,0,5,0,0,0,8,0,6,0,0,0,4,0,0,14,0,0,0,0,0,200,0,0,0,0,0,0,0,0,0,0,0,0,0,0,0,0,0
"SWE_039_MZB_LO_25","SWE_039_MZB_LO_25-20.09.2006","20.09.2006",2006,9,20,0,0,123,0,0,0,0,0,0,0,4,0,56,5,0,0,0,0,0,0,20,20,0,2,11,0,109,0,0,0,0,9,0,0,0,0,0,0,0,0,0,0,0,0,0,5,0,16,67,0,0,9,0,0,0,1,0,1,0,11,0,0,0,21,0,1,0,3,0,0,0,51,7,0,41,48,27,1,0,29,70,2,0,0,0,0,0,0,0,0,2,0,70,0,0,0,0,120,8,1,0,2,44,0,0,0,0,60,0,0,0,0,19,0,0,0,4,0,3,0,0,0,1,0,6,8,0,0,0,0,0,249,0,0,0,1,0,1,0,0,0,1,0,0,0,0,0,0,0
"SWE_039_MZB_LO_25","SWE_039_MZB_LO_25-12.09.2007","12.09.2007",2007,9,12,0,0,7,0,0,0,0,0,0,0,0,0,46,4,0,0,0,0,0,0,5,5,0,0,2,0,63,0,0,0,0,7,0,0,0,0,0,0,0,0,0,0,0,0,0,5,0,8,37,0,0,8,0,0,4,0,0,0,1,5,0,0,0,22,0,0,0,1,0,0,0,96,3,0,7,1,4,2,0,10,54,4,1,0,0,0,0,0,0,0,2,0,54,0,0,0,0,80,6,0,0,3,53,0,0,0,0,11,0,0,0,0,2,0,0,0,11,0,2,0,0,0,3,0,1,36,0,0,0,0,0,115,0,0,0,0,0,1,0,0,0,0,0,0,0,0,0,0,0
"SWE_039_MZB_LO_25","SWE_039_MZB_LO_25-13.09.2008","13.09.2008",2008,9,13,0,0,34,0,0,0,0,0,0,0,0,0,26,0,0,0,0,0,0,2,6,6,0,0,7,0,62,0,0,0,0,3,0,0,0,0,0,0,0,0,0,0,0,1,0,3,0,10,40,0,0,7,0,0,5,1,0,0,0,7,0,0,0,35,0,0,0,1,0,0,0,65,2,0,5,20,2,4,0,5,48,2,0,0,0,0,0,0,0,0,4,0,74,0,0,0,0,61,7,1,0,5,40,0,0,0,0,11,0,0,0,0,3,0,0,0,7,0,6,0,0,0,2,0,0,13,0,0,0,0,0,307,0,0,1,0,0,1,0,0,0,0,0,0,0,0,0,0,0
"SWE_039_MZB_LO_25","SWE_039_MZB_LO_25-14.09.2009","14.09.2009",2009,9,14,0,0,85,0,0,0,0,0,0,0,1,0,104,16,0,0,0,0,0,5,9,9,0,0,21,0,195,0,0,0,0,7,0,0,0,0,0,0,0,0,0,0,0,0,0,9,0,17,75,0,0,5,0,0,4,0,0,3,1,10,0,0,0,14,0,0,0,13,0,0,0,176,21,0,13,64,2,1,0,44,92,4,0,0,0,0,0,0,0,0,2,0,160,0,0,0,0,171,14,2,0,0,36,0,0,0,0,49,0,0,0,0,8,0,0,1,5,0,11,0,0,0,2,0,2,11,0,0,0,0,0,144,0,0,0,0,0,0,0,0,0,0,0,0,0,0,0,0,0
"SWE_039_MZB_LO_25","SWE_039_MZB_LO_25-12.09.2010","12.09.2010",2010,9,12,0,0,60,0,0,0,0,1,0,0,2,0,68,10,0,0,0,0,0,0,19,19,0,0,17,0,45,0,0,0,0,9,0,0,0,0,1,0,0,0,0,0,0,1,0,7,0,13,88,0,0,10,0,0,2,2,0,6,0,2,0,0,0,7,0,2,0,3,0,0,0,80,6,0,7,17,2,5,0,39,149,6,0,0,0,0,0,0,0,0,5,0,119,0,0,0,0,146,11,4,0,2,26,0,0,0,0,68,0,0,0,0,5,0,0,0,9,0,8,0,0,0,1,0,0,22,0,0,0,0,0,284,1,0,1,0,0,0,0,0,0,0,0,0,0,0,0,0,0
"SWE_039_MZB_LO_25","SWE_039_MZB_LO_25-20.09.2011","20.09.2011",2011,9,20,0,0,28,0,0,0,0,0,0,0,0,0,61,3,0,0,0,0,0,1,2,2,0,0,3,0,14,0,0,0,0,3,0,0,0,0,0,0,0,0,1,0,0,0,0,4,0,10,14,0,0,4,0,0,9,0,0,0,0,1,0,0,0,5,0,0,0,2,0,0,0,84,5,0,3,3,1,0,0,12,95,1,0,0,0,0,0,0,0,0,0,0,78,0,0,0,0,164,3,1,0,3,48,0,0,0,0,10,0,0,0,0,2,0,0,0,3,0,6,0,0,0,0,0,0,37,0,0,0,0,0,146,0,0,0,0,0,1,0,0,0,0,0,0,0,0,0,0,0
"SWE_039_MZB_LO_25","SWE_039_MZB_LO_25-15.09.2012","15.09.2012",2012,9,15,0,0,25,0,0,0,0,1,0,0,0,0,26,17,0,0,0,0,0,0,5,5,0,0,5,0,26,0,0,0,0,0,0,0,0,0,0,0,0,0,0,0,0,1,0,1,0,9,13,0,0,8,0,0,0,0,0,2,1,2,0,0,0,25,0,0,0,3,0,0,0,62,7,0,4,7,0,6,0,29,94,6,0,0,0,0,0,0,0,0,2,0,80,0,0,0,0,96,7,5,0,3,49,0,0,0,0,29,0,0,0,0,0,0,0,0,9,0,8,0,0,0,2,0,0,0,0,0,0,0,0,131,0,0,0,0,0,7,0,0,0,0,0,0,0,0,0,0,0
"SWE_039_MZB_LO_25","SWE_039_MZB_LO_25-09.09.2013","09.09.2013",2013,9,9,0,0,18,0,0,0,0,5,0,0,0,0,121,22,0,0,0,0,0,16,18,18,0,0,15,0,119,0,0,0,0,5,0,0,0,0,0,0,0,1,0,0,0,0,0,4,0,18,329,0,0,8,0,0,1,4,0,1,0,6,0,0,0,8,0,0,0,7,0,0,0,65,11,0,4,50,2,15,0,38,170,10,1,0,0,0,0,0,0,0,2,0,36,1,0,0,0,178,35,3,0,0,49,0,0,0,0,49,0,0,0,0,8,0,0,0,8,0,2,0,0,0,7,0,7,1,0,0,0,0,0,290,0,0,0,0,0,5,0,0,0,0,0,0,0,0,0,0,0
"SWE_039_MZB_LO_25","SWE_039_MZB_LO_25-18.09.2014","18.09.2014",2014,9,18,0,0,6,0,0,0,0,2,0,0,1,0,60,10,0,0,0,0,0,8,14,14,0,0,2,0,37,0,0,0,0,8,0,0,0,0,2,0,0,0,0,0,0,0,0,1,0,2,156,0,0,6,0,0,4,2,0,0,1,2,0,0,0,4,0,2,0,2,0,0,0,87,15,0,4,22,3,2,0,22,81,4,0,0,0,0,0,0,0,0,2,0,54,0,0,0,0,95,4,0,0,2,63,0,0,0,0,20,0,0,0,0,7,0,0,0,3,0,1,0,0,0,1,0,1,3,0,0,0,0,0,135,0,0,1,0,0,2,0,0,0,0,0,0,0,0,0,0,0
"SWE_039_MZB_LO_25","SWE_039_MZB_LO_25-05.09.2015","05.09.2015",2015,9,5,0,0,12,0,0,0,0,5,0,0,3,0,90,3,0,0,0,0,0,0,7,7,0,0,4,0,87,0,0,0,0,8,0,0,0,0,0,0,0,0,0,0,0,0,0,0,0,0,32,0,0,12,0,0,6,1,0,3,0,0,0,0,0,0,0,0,0,0,0,0,0,65,0,0,0,5,0,7,1,13,58,6,0,0,0,0,0,0,0,0,0,0,42,0,0,0,0,99,5,2,0,0,41,0,0,0,0,18,0,0,0,0,3,0,0,0,7,0,4,0,0,0,2,1,2,3,0,0,0,0,0,29,0,0,0,0,0,7,0,0,0,0,0,0,0,0,0,0,0
"SWE_039_MZB_LO_25","SWE_039_MZB_LO_25-09.09.2016","09.09.2016",2016,9,9,0,0,16,0,0,0,0,8,0,0,0,0,178,6,0,0,0,0,0,1,26,26,0,0,3,0,128,0,0,0,0,12,0,0,0,0,0,0,0,0,0,0,0,0,0,0,0,9,206,0,0,2,0,0,2,0,0,2,1,7,0,0,0,1,0,0,0,1,0,0,0,99,3,0,0,13,1,1,0,24,65,5,0,0,0,0,0,0,1,0,2,0,67,0,0,0,0,107,14,1,0,2,36,0,0,0,0,20,0,0,0,0,12,0,0,0,5,0,5,0,0,0,2,0,4,13,0,0,0,0,0,56,2,0,1,0,0,6,0,0,0,0,0,0,0,0,0,0,0
"SWE_039_MZB_LO_25","SWE_039_MZB_LO_25-10.09.2017","10.09.2017",2017,9,10,0,0,13,0,0,0,0,12,0,0,0,0,31,4,0,0,0,0,0,0,7,7,0,0,2,0,49,0,0,0,0,2,0,0,0,0,0,0,0,0,1,0,0,0,0,0,0,3,106,0,0,1,0,0,8,0,0,1,0,7,0,0,0,4,0,0,0,1,0,0,0,67,3,0,1,5,1,1,0,51,79,3,0,0,0,0,0,0,0,0,0,0,31,0,0,0,0,100,6,4,0,3,26,0,0,0,0,17,0,0,0,0,7,0,0,0,1,0,5,0,0,0,3,0,4,2,0,0,0,0,0,61,3,0,0,0,0,3,0,0,0,0,0,0,0,0,0,0,0
"SWE_039_MZB_LO_25","SWE_039_MZB_LO_25-08.09.2018","08.09.2018",2018,9,8,0,0,14,0,0,0,0,15,0,0,0,0,85,11,0,0,0,0,0,13,24,24,0,0,2,0,73,0,0,0,0,5,0,0,0,0,0,0,0,0,0,0,0,1,0,4,1,6,238,0,0,1,0,0,6,0,0,0,5,1,0,0,0,9,0,0,0,0,0,0,0,24,0,0,1,14,1,7,0,15,94,12,0,0,0,0,0,0,0,0,0,0,28,0,0,0,0,69,18,1,0,7,21,0,0,0,0,3,0,0,0,0,12,0,0,0,8,1,0,0,0,0,3,0,3,2,0,0,0,0,0,46,4,0,1,1,0,3,0,0,0,0,0,0,0,0,0,0,0
"SWE_039_MZB_LO_25","SWE_039_MZB_LO_25-03.09.2019","03.09.2019",2019,9,3,0,0,3,0,0,0,0,10,0,0,0,0,44,4,0,0,0,0,0,20,14,14,0,0,5,0,48,0,0,0,0,11,0,0,0,0,0,0,0,0,0,0,0,0,0,1,0,0,111,0,0,0,0,0,4,0,0,1,1,5,0,0,0,2,0,0,0,0,0,0,0,44,0,0,0,48,1,4,0,14,32,10,0,0,0,0,0,0,0,0,0,0,64,0,0,0,0,45,7,6,0,3,9,0,0,0,0,2,0,0,0,0,11,0,0,0,8,0,1,0,0,0,1,0,1,4,0,0,0,0,0,24,6,0,0,0,0,0,0,0,0,0,0,0,0,0,0,0,0
"SWE_039_MZB_LO_26","SWE_039_MZB_LO_26-19.06.1995","19.06.1995",1995,6,19,0,0,0,0,0,0,0,0,0,0,0,0,0,0,0,0,0,0,0,0,0,0,0,0,0,0,9.5,0,0,0,0,0,0,0,0,0,0,0,0,0,0,0,0,0,0,0.1,0,0.1,0,0,0,0,0,0,0,0,0,0,0,0,0,0,0,0,0,0,1,0,0,0,0,0,0,0.1,0,0,0,0.5,0,0.1,0,0,0,0,0,0,0,0,0,0,0.3,0,0,0,0,0,0,5.2,0.3,0,0,0,0,0,0,0,0,0,0,0,0,0,0.3,0,0,0,0,0,0,0,0,0,0,0,0,0.5,0,0,0,0,0,0,0,0,0,0,0,0,0,0,0,0,0,0,0,0,0,0,0
"SWE_039_MZB_LO_26","SWE_039_MZB_LO_26-26.05.1996","26.05.1996",1996,5,26,0,0,0,0,0,0,0,0,0,0,0,0,0,0,0,0,0,0,0,0,0,0,0,0,0.3,0,7.9,0,0,0,0,0,0,0,0,0,0,0,0,0,0,0,0,0,0,0.3,0,0.1,0,0,0,0,0,0,0,0,0,0,0,0,0,0,0,0,0,0,0.7,0.1,0,0,0,0.2,0.1,0,0.8,0,0.1,0.1,0,0.2,0,0,0,0,0,0,0,0,0,0,0,0,3.9,0,0,0,0,1.7,0.1,0,0,1.5,0,0,0,0,0,0,0,0,0,0,0.2,0,0,0,0,0,0,0,0,0,0.1,0,0,0.8,0,0,0,0,0,0,0,0,0,0,0,0,0,0,0,0,0,0,0,0,0,0,0
