Site.ID,Sample.ID,Sampling.date,Taxon.name,Abundance,Provider.Number,Country,Dataset.ID,Unique.ID,sample_id,year,month,day
1,1_592012,5.9.2012,Aeshnidae,2,48,Greece,GRC_048_MZB_LO,GRC_048_MZB_LO_1,GRC_048_MZB_LO_1_05.09.2012,2012,9,5
1,1_592012,5.9.2012,Ancylidae,14,48,Greece,GRC_048_MZB_LO,GRC_048_MZB_LO_1,GRC_048_MZB_LO_1_05.09.2012,2012,9,5
1,1_592012,5.9.2012,Araneae,1,48,Greece,GRC_048_MZB_LO,GRC_048_MZB_LO_1,GRC_048_MZB_LO_1_05.09.2012,2012,9,5
1,1_592012,5.9.2012,Asellidae,5,48,Greece,GRC_048_MZB_LO,GRC_048_MZB_LO_1,GRC_048_MZB_LO_1_05.09.2012,2012,9,5
1,1_592012,5.9.2012,Baetidae,407,48,Greece,GRC_048_MZB_LO,GRC_048_MZB_LO_1,GRC_048_MZB_LO_1_05.09.2012,2012,9,5
1,1_592012,5.9.2012,Caenidae,953,48,Greece,GRC_048_MZB_LO,GRC_048_MZB_LO_1,GRC_048_MZB_LO_1_05.09.2012,2012,9,5
1,1_592012,5.9.2012,Chironomidae,113,48,Greece,GRC_048_MZB_LO,GRC_048_MZB_LO_1,GRC_048_MZB_LO_1_05.09.2012,2012,9,5
1,1_592012,5.9.2012,Coenagrionidae,1,48,Greece,GRC_048_MZB_LO,GRC_048_MZB_LO_1,GRC_048_MZB_LO_1_05.09.2012,2012,9,5
1,1_592012,5.9.2012,Dytiscidae,54,48,Greece,GRC_048_MZB_LO,GRC_048_MZB_LO_1,GRC_048_MZB_LO_1_05.09.2012,2012,9,5
1,1_592012,5.9.2012,Gammaridae,124,48,Greece,GRC_048_MZB_LO,GRC_048_MZB_LO_1,GRC_048_MZB_LO_1_05.09.2012,2012,9,5
1,1_592012,5.9.2012,Gerridae,1,48,Greece,GRC_048_MZB_LO,GRC_048_MZB_LO_1,GRC_048_MZB_LO_1_05.09.2012,2012,9,5
1,1_592012,5.9.2012,Glossiphoniidae,1,48,Greece,GRC_048_MZB_LO,GRC_048_MZB_LO_1,GRC_048_MZB_LO_1_05.09.2012,2012,9,5
1,1_592012,5.9.2012,Haliplidae,2,48,Greece,GRC_048_MZB_LO,GRC_048_MZB_LO_1,GRC_048_MZB_LO_1_05.09.2012,2012,9,5
1,1_592012,5.9.2012,Heptageniidae,39,48,Greece,GRC_048_MZB_LO,GRC_048_MZB_LO_1,GRC_048_MZB_LO_1_05.09.2012,2012,9,5
1,1_592012,5.9.2012,Hydraenidae,2,48,Greece,GRC_048_MZB_LO,GRC_048_MZB_LO_1,GRC_048_MZB_LO_1_05.09.2012,2012,9,5
1,1_592012,5.9.2012,Hydrophilidae,4,48,Greece,GRC_048_MZB_LO,GRC_048_MZB_LO_1,GRC_048_MZB_LO_1_05.09.2012,2012,9,5
1,1_592012,5.9.2012,Hydroptilidae,13,48,Greece,GRC_048_MZB_LO,GRC_048_MZB_LO_1,GRC_048_MZB_LO_1_05.09.2012,2012,9,5
1,1_592012,5.9.2012,Libellulidae,3,48,Greece,GRC_048_MZB_LO,GRC_048_MZB_LO_1,GRC_048_MZB_LO_1_05.09.2012,2012,9,5
1,1_592012,5.9.2012,Lymnaeidae,23,48,Greece,GRC_048_MZB_LO,GRC_048_MZB_LO_1,GRC_048_MZB_LO_1_05.09.2012,2012,9,5
1,1_592012,5.9.2012,Oligochaeta,8,48,Greece,GRC_048_MZB_LO,GRC_048_MZB_LO_1,GRC_048_MZB_LO_1_05.09.2012,2012,9,5
1,1_592012,5.9.2012,Physidae,12,48,Greece,GRC_048_MZB_LO,GRC_048_MZB_LO_1,GRC_048_MZB_LO_1_05.09.2012,2012,9,5
1,1_592012,5.9.2012,Planorbidae,1,48,Greece,GRC_048_MZB_LO,GRC_048_MZB_LO_1,GRC_048_MZB_LO_1_05.09.2012,2012,9,5
1,1_592012,5.9.2012,Platycnemididae,4,48,Greece,GRC_048_MZB_LO,GRC_048_MZB_LO_1,GRC_048_MZB_LO_1_05.09.2012,2012,9,5
1,1_592012,5.9.2012,Rhyacophilidae,7,48,Greece,GRC_048_MZB_LO,GRC_048_MZB_LO_1,GRC_048_MZB_LO_1_05.09.2012,2012,9,5
1,1_592012,5.9.2012,Sialidae,1,48,Greece,GRC_048_MZB_LO,GRC_048_MZB_LO_1,GRC_048_MZB_LO_1_05.09.2012,2012,9,5
1,1_592012,5.9.2012,Tabanidae,1,48,Greece,GRC_048_MZB_LO,GRC_048_MZB_LO_1,GRC_048_MZB_LO_1_05.09.2012,2012,9,5
1,1_592012,5.9.2012,Tipulidae,2,48,Greece,GRC_048_MZB_LO,GRC_048_MZB_LO_1,GRC_048_MZB_LO_1_05.09.2012,2012,9,5
1,1_1542013,15.4.2013,Aphididae,1,48,Greece,GRC_048_MZB_LO,GRC_048_MZB_LO_1,GRC_048_MZB_LO_1_15.04.2013,2013,4,15
1,1_1542013,15.4.2013,Asellidae,1,48,Greece,GRC_048_MZB_LO,GRC_048_MZB_LO_1,GRC_048_MZB_LO_1_15.04.2013,2013,4,15
1,1_1542013,15.4.2013,Baetidae,52,48,Greece,GRC_048_MZB_LO,GRC_048_MZB_LO_1,GRC_048_MZB_LO_1_15.04.2013,2013,4,15
1,1_1542013,15.4.2013,Caenidae,8,48,Greece,GRC_048_MZB_LO,GRC_048_MZB_LO_1,GRC_048_MZB_LO_1_15.04.2013,2013,4,15
1,1_1542013,15.4.2013,Cordulegasteridae,1,48,Greece,GRC_048_MZB_LO,GRC_048_MZB_LO_1,GRC_048_MZB_LO_1_15.04.2013,2013,4,15
1,1_1542013,15.4.2013,Elmidae,1,48,Greece,GRC_048_MZB_LO,GRC_048_MZB_LO_1,GRC_048_MZB_LO_1_15.04.2013,2013,4,15
1,1_1542013,15.4.2013,Ephemerellidae,3,48,Greece,GRC_048_MZB_LO,GRC_048_MZB_LO_1,GRC_048_MZB_LO_1_15.04.2013,2013,4,15
1,1_1542013,15.4.2013,Ephemeridae,2,48,Greece,GRC_048_MZB_LO,GRC_048_MZB_LO_1,GRC_048_MZB_LO_1_15.04.2013,2013,4,15
1,1_1542013,15.4.2013,Erpobdellidae,1,48,Greece,GRC_048_MZB_LO,GRC_048_MZB_LO_1,GRC_048_MZB_LO_1_15.04.2013,2013,4,15
1,1_1542013,15.4.2013,Gammaridae,185,48,Greece,GRC_048_MZB_LO,GRC_048_MZB_LO_1,GRC_048_MZB_LO_1_15.04.2013,2013,4,15
1,1_1542013,15.4.2013,Gomphidae,3,48,Greece,GRC_048_MZB_LO,GRC_048_MZB_LO_1,GRC_048_MZB_LO_1_15.04.2013,2013,4,15
1,1_1542013,15.4.2013,Heptageniidae,7,48,Greece,GRC_048_MZB_LO,GRC_048_MZB_LO_1,GRC_048_MZB_LO_1_15.04.2013,2013,4,15
1,1_1542013,15.4.2013,Limnephilidae,1,48,Greece,GRC_048_MZB_LO,GRC_048_MZB_LO_1,GRC_048_MZB_LO_1_15.04.2013,2013,4,15
1,1_1542013,15.4.2013,Limoniidae,1,48,Greece,GRC_048_MZB_LO,GRC_048_MZB_LO_1,GRC_048_MZB_LO_1_15.04.2013,2013,4,15
1,1_1542013,15.4.2013,Oligochaeta,2,48,Greece,GRC_048_MZB_LO,GRC_048_MZB_LO_1,GRC_048_MZB_LO_1_15.04.2013,2013,4,15
1,1_1542013,15.4.2013,Psychodidae,2,48,Greece,GRC_048_MZB_LO,GRC_048_MZB_LO_1,GRC_048_MZB_LO_1_15.04.2013,2013,4,15
1,1_1542013,15.4.2013,Psychomyidae,16,48,Greece,GRC_048_MZB_LO,GRC_048_MZB_LO_1,GRC_048_MZB_LO_1_15.04.2013,2013,4,15
1,1_1542013,15.4.2013,Rhyacophilidae,7,48,Greece,GRC_048_MZB_LO,GRC_048_MZB_LO_1,GRC_048_MZB_LO_1_15.04.2013,2013,4,15
1,1_1542013,15.4.2013,Simuliidae,3,48,Greece,GRC_048_MZB_LO,GRC_048_MZB_LO_1,GRC_048_MZB_LO_1_15.04.2013,2013,4,15
1,1_1542013,15.4.2013,Stratiomyidae,1,48,Greece,GRC_048_MZB_LO,GRC_048_MZB_LO_1,GRC_048_MZB_LO_1_15.04.2013,2013,4,15
1,1_372013,3.7.2013,Anthomyidae,1,48,Greece,GRC_048_MZB_LO,GRC_048_MZB_LO_1,GRC_048_MZB_LO_1_03.07.2013,2013,7,3
1,1_372013,3.7.2013,Asellidae,5,48,Greece,GRC_048_MZB_LO,GRC_048_MZB_LO_1,GRC_048_MZB_LO_1_03.07.2013,2013,7,3
1,1_372013,3.7.2013,Athericidae,4,48,Greece,GRC_048_MZB_LO,GRC_048_MZB_LO_1,GRC_048_MZB_LO_1_03.07.2013,2013,7,3
1,1_372013,3.7.2013,Baetidae,236,48,Greece,GRC_048_MZB_LO,GRC_048_MZB_LO_1,GRC_048_MZB_LO_1_03.07.2013,2013,7,3
1,1_372013,3.7.2013,Caenidae,2,48,Greece,GRC_048_MZB_LO,GRC_048_MZB_LO_1,GRC_048_MZB_LO_1_03.07.2013,2013,7,3
1,1_372013,3.7.2013,Chironomidae,4,48,Greece,GRC_048_MZB_LO,GRC_048_MZB_LO_1,GRC_048_MZB_LO_1_03.07.2013,2013,7,3
1,1_372013,3.7.2013,Dryopidae,1,48,Greece,GRC_048_MZB_LO,GRC_048_MZB_LO_1,GRC_048_MZB_LO_1_03.07.2013,2013,7,3
1,1_372013,3.7.2013,Elmidae,34,48,Greece,GRC_048_MZB_LO,GRC_048_MZB_LO_1,GRC_048_MZB_LO_1_03.07.2013,2013,7,3
1,1_372013,3.7.2013,Ephemerellidae,188,48,Greece,GRC_048_MZB_LO,GRC_048_MZB_LO_1,GRC_048_MZB_LO_1_03.07.2013,2013,7,3
1,1_372013,3.7.2013,Erpobdellidae,3,48,Greece,GRC_048_MZB_LO,GRC_048_MZB_LO_1,GRC_048_MZB_LO_1_03.07.2013,2013,7,3
1,1_372013,3.7.2013,Gammaridae,124,48,Greece,GRC_048_MZB_LO,GRC_048_MZB_LO_1,GRC_048_MZB_LO_1_03.07.2013,2013,7,3
1,1_372013,3.7.2013,Heptageniidae,14,48,Greece,GRC_048_MZB_LO,GRC_048_MZB_LO_1,GRC_048_MZB_LO_1_03.07.2013,2013,7,3
1,1_372013,3.7.2013,Hirudinidae,10,48,Greece,GRC_048_MZB_LO,GRC_048_MZB_LO_1,GRC_048_MZB_LO_1_03.07.2013,2013,7,3
1,1_372013,3.7.2013,Hydrophilidae,1,48,Greece,GRC_048_MZB_LO,GRC_048_MZB_LO_1,GRC_048_MZB_LO_1_03.07.2013,2013,7,3
1,1_372013,3.7.2013,Hydropsychidae,58,48,Greece,GRC_048_MZB_LO,GRC_048_MZB_LO_1,GRC_048_MZB_LO_1_03.07.2013,2013,7,3
1,1_372013,3.7.2013,Leuctridae,4,48,Greece,GRC_048_MZB_LO,GRC_048_MZB_LO_1,GRC_048_MZB_LO_1_03.07.2013,2013,7,3
1,1_372013,3.7.2013,Limoniidae,19,48,Greece,GRC_048_MZB_LO,GRC_048_MZB_LO_1,GRC_048_MZB_LO_1_03.07.2013,2013,7,3
1,1_372013,3.7.2013,Oligoneuriidae,1,48,Greece,GRC_048_MZB_LO,GRC_048_MZB_LO_1,GRC_048_MZB_LO_1_03.07.2013,2013,7,3
1,1_372013,3.7.2013,Psychodidae,2,48,Greece,GRC_048_MZB_LO,GRC_048_MZB_LO_1,GRC_048_MZB_LO_1_03.07.2013,2013,7,3
1,1_372013,3.7.2013,Psychomyidae,1,48,Greece,GRC_048_MZB_LO,GRC_048_MZB_LO_1,GRC_048_MZB_LO_1_03.07.2013,2013,7,3
1,1_372013,3.7.2013,Rhyacophilidae,4,48,Greece,GRC_048_MZB_LO,GRC_048_MZB_LO_1,GRC_048_MZB_LO_1_03.07.2013,2013,7,3
1,1_372013,3.7.2013,Simuliidae,7,48,Greece,GRC_048_MZB_LO,GRC_048_MZB_LO_1,GRC_048_MZB_LO_1_03.07.2013,2013,7,3
1,1_372013,3.7.2013,Tabanidae,6,48,Greece,GRC_048_MZB_LO,GRC_048_MZB_LO_1,GRC_048_MZB_LO_1_03.07.2013,2013,7,3
1,1_372013,3.7.2013,Tipulidae,2,48,Greece,GRC_048_MZB_LO,GRC_048_MZB_LO_1,GRC_048_MZB_LO_1_03.07.2013,2013,7,3
1,1_842014,8.4.2014,Anthomyidae,6,48,Greece,GRC_048_MZB_LO,GRC_048_MZB_LO_1,GRC_048_MZB_LO_1_08.04.2014,2014,4,8
1,1_842014,8.4.2014,Asellidae,1,48,Greece,GRC_048_MZB_LO,GRC_048_MZB_LO_1,GRC_048_MZB_LO_1_08.04.2014,2014,4,8
1,1_842014,8.4.2014,Baetidae,137,48,Greece,GRC_048_MZB_LO,GRC_048_MZB_LO_1,GRC_048_MZB_LO_1_08.04.2014,2014,4,8
1,1_842014,8.4.2014,Caenidae,29,48,Greece,GRC_048_MZB_LO,GRC_048_MZB_LO_1,GRC_048_MZB_LO_1_08.04.2014,2014,4,8
1,1_842014,8.4.2014,Ceratopogonidae,17,48,Greece,GRC_048_MZB_LO,GRC_048_MZB_LO_1,GRC_048_MZB_LO_1_08.04.2014,2014,4,8
1,1_842014,8.4.2014,Chironomidae,358,48,Greece,GRC_048_MZB_LO,GRC_048_MZB_LO_1,GRC_048_MZB_LO_1_08.04.2014,2014,4,8
1,1_842014,8.4.2014,Dryopidae,1,48,Greece,GRC_048_MZB_LO,GRC_048_MZB_LO_1,GRC_048_MZB_LO_1_08.04.2014,2014,4,8
1,1_842014,8.4.2014,Elmidae,14,48,Greece,GRC_048_MZB_LO,GRC_048_MZB_LO_1,GRC_048_MZB_LO_1_08.04.2014,2014,4,8
1,1_842014,8.4.2014,Empididae,3,48,Greece,GRC_048_MZB_LO,GRC_048_MZB_LO_1,GRC_048_MZB_LO_1_08.04.2014,2014,4,8
1,1_842014,8.4.2014,Ephemerellidae,394,48,Greece,GRC_048_MZB_LO,GRC_048_MZB_LO_1,GRC_048_MZB_LO_1_08.04.2014,2014,4,8
1,1_842014,8.4.2014,Gammaridae,80,48,Greece,GRC_048_MZB_LO,GRC_048_MZB_LO_1,GRC_048_MZB_LO_1_08.04.2014,2014,4,8
1,1_842014,8.4.2014,Gomphidae,33,48,Greece,GRC_048_MZB_LO,GRC_048_MZB_LO_1,GRC_048_MZB_LO_1_08.04.2014,2014,4,8
1,1_842014,8.4.2014,Heptageniidae,3,48,Greece,GRC_048_MZB_LO,GRC_048_MZB_LO_1,GRC_048_MZB_LO_1_08.04.2014,2014,4,8
1,1_842014,8.4.2014,Hydrachnidae,7,48,Greece,GRC_048_MZB_LO,GRC_048_MZB_LO_1,GRC_048_MZB_LO_1_08.04.2014,2014,4,8
1,1_842014,8.4.2014,Hydrophilidae,1,48,Greece,GRC_048_MZB_LO,GRC_048_MZB_LO_1,GRC_048_MZB_LO_1_08.04.2014,2014,4,8
1,1_842014,8.4.2014,Leptoceridae,1,48,Greece,GRC_048_MZB_LO,GRC_048_MZB_LO_1,GRC_048_MZB_LO_1_08.04.2014,2014,4,8
1,1_842014,8.4.2014,Lymnaeidae,25,48,Greece,GRC_048_MZB_LO,GRC_048_MZB_LO_1,GRC_048_MZB_LO_1_08.04.2014,2014,4,8
1,1_842014,8.4.2014,Oligochaeta,2,48,Greece,GRC_048_MZB_LO,GRC_048_MZB_LO_1,GRC_048_MZB_LO_1_08.04.2014,2014,4,8
1,1_842014,8.4.2014,Oligoneuriidae,4619,48,Greece,GRC_048_MZB_LO,GRC_048_MZB_LO_1,GRC_048_MZB_LO_1_08.04.2014,2014,4,8
1,1_842014,8.4.2014,Physidae,4,48,Greece,GRC_048_MZB_LO,GRC_048_MZB_LO_1,GRC_048_MZB_LO_1_08.04.2014,2014,4,8
1,1_842014,8.4.2014,Platycnemididae,3,48,Greece,GRC_048_MZB_LO,GRC_048_MZB_LO_1,GRC_048_MZB_LO_1_08.04.2014,2014,4,8
1,1_842014,8.4.2014,Psychodidae,3,48,Greece,GRC_048_MZB_LO,GRC_048_MZB_LO_1,GRC_048_MZB_LO_1_08.04.2014,2014,4,8
1,1_842014,8.4.2014,Simuliidae,27,48,Greece,GRC_048_MZB_LO,GRC_048_MZB_LO_1,GRC_048_MZB_LO_1_08.04.2014,2014,4,8
1,1_842014,8.4.2014,Tabanidae,7,48,Greece,GRC_048_MZB_LO,GRC_048_MZB_LO_1,GRC_048_MZB_LO_1_08.04.2014,2014,4,8
1,1_842014,8.4.2014,Viviparidae,12,48,Greece,GRC_048_MZB_LO,GRC_048_MZB_LO_1,GRC_048_MZB_LO_1_08.04.2014,2014,4,8
1,1_3072014,30.7.2014,Aeshnidae,1,48,Greece,GRC_048_MZB_LO,GRC_048_MZB_LO_1,GRC_048_MZB_LO_1_30.07.2014,2014,7,30
1,1_3072014,30.7.2014,Ancylidae,3,48,Greece,GRC_048_MZB_LO,GRC_048_MZB_LO_1,GRC_048_MZB_LO_1_30.07.2014,2014,7,30
1,1_3072014,30.7.2014,Asellidae,331,48,Greece,GRC_048_MZB_LO,GRC_048_MZB_LO_1,GRC_048_MZB_LO_1_30.07.2014,2014,7,30
1,1_3072014,30.7.2014,Athericidae,2,48,Greece,GRC_048_MZB_LO,GRC_048_MZB_LO_1,GRC_048_MZB_LO_1_30.07.2014,2014,7,30
1,1_3072014,30.7.2014,Baetidae,2,48,Greece,GRC_048_MZB_LO,GRC_048_MZB_LO_1,GRC_048_MZB_LO_1_30.07.2014,2014,7,30
1,1_3072014,30.7.2014,Caenidae,1764,48,Greece,GRC_048_MZB_LO,GRC_048_MZB_LO_1,GRC_048_MZB_LO_1_30.07.2014,2014,7,30
1,1_3072014,30.7.2014,Calopterygidae,1,48,Greece,GRC_048_MZB_LO,GRC_048_MZB_LO_1,GRC_048_MZB_LO_1_30.07.2014,2014,7,30
1,1_3072014,30.7.2014,Ceratopogonidae,6,48,Greece,GRC_048_MZB_LO,GRC_048_MZB_LO_1,GRC_048_MZB_LO_1_30.07.2014,2014,7,30
1,1_3072014,30.7.2014,Chironomidae,131,48,Greece,GRC_048_MZB_LO,GRC_048_MZB_LO_1,GRC_048_MZB_LO_1_30.07.2014,2014,7,30
1,1_3072014,30.7.2014,Cordulegasteridae,2,48,Greece,GRC_048_MZB_LO,GRC_048_MZB_LO_1,GRC_048_MZB_LO_1_30.07.2014,2014,7,30
1,1_3072014,30.7.2014,Corixidae,6,48,Greece,GRC_048_MZB_LO,GRC_048_MZB_LO_1,GRC_048_MZB_LO_1_30.07.2014,2014,7,30
1,1_3072014,30.7.2014,Elmidae,6,48,Greece,GRC_048_MZB_LO,GRC_048_MZB_LO_1,GRC_048_MZB_LO_1_30.07.2014,2014,7,30
1,1_3072014,30.7.2014,Empididae,4,48,Greece,GRC_048_MZB_LO,GRC_048_MZB_LO_1,GRC_048_MZB_LO_1_30.07.2014,2014,7,30
1,1_3072014,30.7.2014,Ephemeridae,5,48,Greece,GRC_048_MZB_LO,GRC_048_MZB_LO_1,GRC_048_MZB_LO_1_30.07.2014,2014,7,30
1,1_3072014,30.7.2014,Gammaridae,1715,48,Greece,GRC_048_MZB_LO,GRC_048_MZB_LO_1,GRC_048_MZB_LO_1_30.07.2014,2014,7,30
1,1_3072014,30.7.2014,Gerridae,2,48,Greece,GRC_048_MZB_LO,GRC_048_MZB_LO_1,GRC_048_MZB_LO_1_30.07.2014,2014,7,30
1,1_3072014,30.7.2014,Gomphidae,30,48,Greece,GRC_048_MZB_LO,GRC_048_MZB_LO_1,GRC_048_MZB_LO_1_30.07.2014,2014,7,30
1,1_3072014,30.7.2014,Heptageniidae,1,48,Greece,GRC_048_MZB_LO,GRC_048_MZB_LO_1,GRC_048_MZB_LO_1_30.07.2014,2014,7,30
1,1_3072014,30.7.2014,Hydrobiidae,1,48,Greece,GRC_048_MZB_LO,GRC_048_MZB_LO_1,GRC_048_MZB_LO_1_30.07.2014,2014,7,30
1,1_3072014,30.7.2014,Leuctridae,5,48,Greece,GRC_048_MZB_LO,GRC_048_MZB_LO_1,GRC_048_MZB_LO_1_30.07.2014,2014,7,30
1,1_3072014,30.7.2014,Lymnaeidae,3,48,Greece,GRC_048_MZB_LO,GRC_048_MZB_LO_1,GRC_048_MZB_LO_1_30.07.2014,2014,7,30
1,1_3072014,30.7.2014,Oligochaeta,53,48,Greece,GRC_048_MZB_LO,GRC_048_MZB_LO_1,GRC_048_MZB_LO_1_30.07.2014,2014,7,30
1,1_3072014,30.7.2014,Ostracoda,82,48,Greece,GRC_048_MZB_LO,GRC_048_MZB_LO_1,GRC_048_MZB_LO_1_30.07.2014,2014,7,30
1,1_3072014,30.7.2014,Physidae,9,48,Greece,GRC_048_MZB_LO,GRC_048_MZB_LO_1,GRC_048_MZB_LO_1_30.07.2014,2014,7,30
1,1_3072014,30.7.2014,Planorbidae,18,48,Greece,GRC_048_MZB_LO,GRC_048_MZB_LO_1,GRC_048_MZB_LO_1_30.07.2014,2014,7,30
1,1_3072014,30.7.2014,Sphaeriidae,2,48,Greece,GRC_048_MZB_LO,GRC_048_MZB_LO_1,GRC_048_MZB_LO_1_30.07.2014,2014,7,30
1,1_3072014,30.7.2014,Tabanidae,21,48,Greece,GRC_048_MZB_LO,GRC_048_MZB_LO_1,GRC_048_MZB_LO_1_30.07.2014,2014,7,30
1,1_3072014,30.7.2014,Tipulidae,1,48,Greece,GRC_048_MZB_LO,GRC_048_MZB_LO_1,GRC_048_MZB_LO_1_30.07.2014,2014,7,30
1,1_2342015,23.4.2015,Asellidae,4,48,Greece,GRC_048_MZB_LO,GRC_048_MZB_LO_1,GRC_048_MZB_LO_1_23.04.2015,2015,4,23
1,1_2342015,23.4.2015,Baetidae,99,48,Greece,GRC_048_MZB_LO,GRC_048_MZB_LO_1,GRC_048_MZB_LO_1_23.04.2015,2015,4,23
1,1_2342015,23.4.2015,Caenidae,1,48,Greece,GRC_048_MZB_LO,GRC_048_MZB_LO_1,GRC_048_MZB_LO_1_23.04.2015,2015,4,23
1,1_2342015,23.4.2015,Chironomidae,33,48,Greece,GRC_048_MZB_LO,GRC_048_MZB_LO_1,GRC_048_MZB_LO_1_23.04.2015,2015,4,23
1,1_2342015,23.4.2015,Cordulegasteridae,1,48,Greece,GRC_048_MZB_LO,GRC_048_MZB_LO_1,GRC_048_MZB_LO_1_23.04.2015,2015,4,23
1,1_2342015,23.4.2015,Dytiscidae,1,48,Greece,GRC_048_MZB_LO,GRC_048_MZB_LO_1,GRC_048_MZB_LO_1_23.04.2015,2015,4,23
1,1_2342015,23.4.2015,Elmidae,1,48,Greece,GRC_048_MZB_LO,GRC_048_MZB_LO_1,GRC_048_MZB_LO_1_23.04.2015,2015,4,23
1,1_2342015,23.4.2015,Empididae,4,48,Greece,GRC_048_MZB_LO,GRC_048_MZB_LO_1,GRC_048_MZB_LO_1_23.04.2015,2015,4,23
1,1_2342015,23.4.2015,Ephemeridae,3,48,Greece,GRC_048_MZB_LO,GRC_048_MZB_LO_1,GRC_048_MZB_LO_1_23.04.2015,2015,4,23
1,1_2342015,23.4.2015,Gammaridae,845,48,Greece,GRC_048_MZB_LO,GRC_048_MZB_LO_1,GRC_048_MZB_LO_1_23.04.2015,2015,4,23
1,1_2342015,23.4.2015,Heptageniidae,11,48,Greece,GRC_048_MZB_LO,GRC_048_MZB_LO_1,GRC_048_MZB_LO_1_23.04.2015,2015,4,23
1,1_2342015,23.4.2015,Hydrachnidae,1,48,Greece,GRC_048_MZB_LO,GRC_048_MZB_LO_1,GRC_048_MZB_LO_1_23.04.2015,2015,4,23
1,1_2342015,23.4.2015,Psychomyidae,4,48,Greece,GRC_048_MZB_LO,GRC_048_MZB_LO_1,GRC_048_MZB_LO_1_23.04.2015,2015,4,23
1,1_2342015,23.4.2015,Rhyacophilidae,19,48,Greece,GRC_048_MZB_LO,GRC_048_MZB_LO_1,GRC_048_MZB_LO_1_23.04.2015,2015,4,23
1,1_2582015,25.8.2015,Aeshnidae,1,48,Greece,GRC_048_MZB_LO,GRC_048_MZB_LO_1,GRC_048_MZB_LO_1_25.08.2015,2015,8,25
1,1_2582015,25.8.2015,Asellidae,5,48,Greece,GRC_048_MZB_LO,GRC_048_MZB_LO_1,GRC_048_MZB_LO_1_25.08.2015,2015,8,25
1,1_2582015,25.8.2015,Baetidae,449,48,Greece,GRC_048_MZB_LO,GRC_048_MZB_LO_1,GRC_048_MZB_LO_1_25.08.2015,2015,8,25
1,1_2582015,25.8.2015,Caenidae,16,48,Greece,GRC_048_MZB_LO,GRC_048_MZB_LO_1,GRC_048_MZB_LO_1_25.08.2015,2015,8,25
1,1_2582015,25.8.2015,Chironomidae,94,48,Greece,GRC_048_MZB_LO,GRC_048_MZB_LO_1,GRC_048_MZB_LO_1_25.08.2015,2015,8,25
1,1_2582015,25.8.2015,Elmidae,2,48,Greece,GRC_048_MZB_LO,GRC_048_MZB_LO_1,GRC_048_MZB_LO_1_25.08.2015,2015,8,25
1,1_2582015,25.8.2015,Empididae,24,48,Greece,GRC_048_MZB_LO,GRC_048_MZB_LO_1,GRC_048_MZB_LO_1_25.08.2015,2015,8,25
1,1_2582015,25.8.2015,Gammaridae,1932,48,Greece,GRC_048_MZB_LO,GRC_048_MZB_LO_1,GRC_048_MZB_LO_1_25.08.2015,2015,8,25
1,1_2582015,25.8.2015,Heptageniidae,5,48,Greece,GRC_048_MZB_LO,GRC_048_MZB_LO_1,GRC_048_MZB_LO_1_25.08.2015,2015,8,25
1,1_2582015,25.8.2015,Hirudinidae,1,48,Greece,GRC_048_MZB_LO,GRC_048_MZB_LO_1,GRC_048_MZB_LO_1_25.08.2015,2015,8,25
1,1_2582015,25.8.2015,Hydrachnidae,1,48,Greece,GRC_048_MZB_LO,GRC_048_MZB_LO_1,GRC_048_MZB_LO_1_25.08.2015,2015,8,25
1,1_2582015,25.8.2015,Hydroptilidae,4,48,Greece,GRC_048_MZB_LO,GRC_048_MZB_LO_1,GRC_048_MZB_LO_1_25.08.2015,2015,8,25
1,1_2582015,25.8.2015,Leuctridae,7,48,Greece,GRC_048_MZB_LO,GRC_048_MZB_LO_1,GRC_048_MZB_LO_1_25.08.2015,2015,8,25
1,1_2582015,25.8.2015,Limoniidae,1,48,Greece,GRC_048_MZB_LO,GRC_048_MZB_LO_1,GRC_048_MZB_LO_1_25.08.2015,2015,8,25
1,1_2582015,25.8.2015,Psychodidae,2,48,Greece,GRC_048_MZB_LO,GRC_048_MZB_LO_1,GRC_048_MZB_LO_1_25.08.2015,2015,8,25
1,1_2582015,25.8.2015,Rhyacophilidae,16,48,Greece,GRC_048_MZB_LO,GRC_048_MZB_LO_1,GRC_048_MZB_LO_1_25.08.2015,2015,8,25
1,1_2582015,25.8.2015,Scatophagidae,1,48,Greece,GRC_048_MZB_LO,GRC_048_MZB_LO_1,GRC_048_MZB_LO_1_25.08.2015,2015,8,25
1,1_2582015,25.8.2015,Simuliidae,7,48,Greece,GRC_048_MZB_LO,GRC_048_MZB_LO_1,GRC_048_MZB_LO_1_25.08.2015,2015,8,25
1,1_2582015,25.8.2015,Tabanidae,1,48,Greece,GRC_048_MZB_LO,GRC_048_MZB_LO_1,GRC_048_MZB_LO_1_25.08.2015,2015,8,25
1,1_2582015,25.8.2015,Tipulidae,5,48,Greece,GRC_048_MZB_LO,GRC_048_MZB_LO_1,GRC_048_MZB_LO_1_25.08.2015,2015,8,25
1,1_252018,2.5.2018,Ancylidae,1,48,Greece,GRC_048_MZB_LO,GRC_048_MZB_LO_1,GRC_048_MZB_LO_1_02.05.2018,2018,5,2
1,1_252018,2.5.2018,Asellidae,1,48,Greece,GRC_048_MZB_LO,GRC_048_MZB_LO_1,GRC_048_MZB_LO_1_02.05.2018,2018,5,2
1,1_252018,2.5.2018,Athericidae,2,48,Greece,GRC_048_MZB_LO,GRC_048_MZB_LO_1,GRC_048_MZB_LO_1_02.05.2018,2018,5,2
1,1_252018,2.5.2018,Baetidae,318,48,Greece,GRC_048_MZB_LO,GRC_048_MZB_LO_1,GRC_048_MZB_LO_1_02.05.2018,2018,5,2
1,1_252018,2.5.2018,Caenidae,4,48,Greece,GRC_048_MZB_LO,GRC_048_MZB_LO_1,GRC_048_MZB_LO_1_02.05.2018,2018,5,2
1,1_252018,2.5.2018,Chironomidae,2,48,Greece,GRC_048_MZB_LO,GRC_048_MZB_LO_1,GRC_048_MZB_LO_1_02.05.2018,2018,5,2
1,1_252018,2.5.2018,Elmidae,1,48,Greece,GRC_048_MZB_LO,GRC_048_MZB_LO_1,GRC_048_MZB_LO_1_02.05.2018,2018,5,2
1,1_252018,2.5.2018,Gammaridae,528,48,Greece,GRC_048_MZB_LO,GRC_048_MZB_LO_1,GRC_048_MZB_LO_1_02.05.2018,2018,5,2
1,1_252018,2.5.2018,Gerridae,1,48,Greece,GRC_048_MZB_LO,GRC_048_MZB_LO_1,GRC_048_MZB_LO_1_02.05.2018,2018,5,2
1,1_252018,2.5.2018,Gomphidae,3,48,Greece,GRC_048_MZB_LO,GRC_048_MZB_LO_1,GRC_048_MZB_LO_1_02.05.2018,2018,5,2
1,1_252018,2.5.2018,Heptageniidae,24,48,Greece,GRC_048_MZB_LO,GRC_048_MZB_LO_1,GRC_048_MZB_LO_1_02.05.2018,2018,5,2
1,1_252018,2.5.2018,Limoniidae,1,48,Greece,GRC_048_MZB_LO,GRC_048_MZB_LO_1,GRC_048_MZB_LO_1_02.05.2018,2018,5,2
1,1_252018,2.5.2018,Lymnaeidae,1,48,Greece,GRC_048_MZB_LO,GRC_048_MZB_LO_1,GRC_048_MZB_LO_1_02.05.2018,2018,5,2
1,1_252018,2.5.2018,Planorbidae,1,48,Greece,GRC_048_MZB_LO,GRC_048_MZB_LO_1,GRC_048_MZB_LO_1_02.05.2018,2018,5,2
1,1_252018,2.5.2018,Rhyacophilidae,44,48,Greece,GRC_048_MZB_LO,GRC_048_MZB_LO_1,GRC_048_MZB_LO_1_02.05.2018,2018,5,2
1,1_252018,2.5.2018,Simuliidae,3,48,Greece,GRC_048_MZB_LO,GRC_048_MZB_LO_1,GRC_048_MZB_LO_1_02.05.2018,2018,5,2
1,1_1792018,17.9.2018,Araneae,1,48,Greece,GRC_048_MZB_LO,GRC_048_MZB_LO_1,GRC_048_MZB_LO_145_17.09.2018,2018,9,17
1,1_1792018,17.9.2018,Asellidae,6,48,Greece,GRC_048_MZB_LO,GRC_048_MZB_LO_1,GRC_048_MZB_LO_145_17.09.2018,2018,9,17
1,1_1792018,17.9.2018,Athericidae,3,48,Greece,GRC_048_MZB_LO,GRC_048_MZB_LO_1,GRC_048_MZB_LO_145_17.09.2018,2018,9,17
1,1_1792018,17.9.2018,Baetidae,321,48,Greece,GRC_048_MZB_LO,GRC_048_MZB_LO_1,GRC_048_MZB_LO_145_17.09.2018,2018,9,17
1,1_1792018,17.9.2018,Caenidae,6,48,Greece,GRC_048_MZB_LO,GRC_048_MZB_LO_1,GRC_048_MZB_LO_145_17.09.2018,2018,9,17
1,1_1792018,17.9.2018,Chironomidae,64,48,Greece,GRC_048_MZB_LO,GRC_048_MZB_LO_1,GRC_048_MZB_LO_145_17.09.2018,2018,9,17
1,1_1792018,17.9.2018,Dryopidae,1,48,Greece,GRC_048_MZB_LO,GRC_048_MZB_LO_1,GRC_048_MZB_LO_145_17.09.2018,2018,9,17
1,1_1792018,17.9.2018,Dytiscidae,1,48,Greece,GRC_048_MZB_LO,GRC_048_MZB_LO_1,GRC_048_MZB_LO_145_17.09.2018,2018,9,17
1,1_1792018,17.9.2018,Elmidae,17,48,Greece,GRC_048_MZB_LO,GRC_048_MZB_LO_1,GRC_048_MZB_LO_145_17.09.2018,2018,9,17
1,1_1792018,17.9.2018,Empididae,4,48,Greece,GRC_048_MZB_LO,GRC_048_MZB_LO_1,GRC_048_MZB_LO_145_17.09.2018,2018,9,17
1,1_1792018,17.9.2018,Empty cases,1,48,Greece,GRC_048_MZB_LO,GRC_048_MZB_LO_1,GRC_048_MZB_LO_145_17.09.2018,2018,9,17
1,1_1792018,17.9.2018,Ephemeridae,3,48,Greece,GRC_048_MZB_LO,GRC_048_MZB_LO_1,GRC_048_MZB_LO_145_17.09.2018,2018,9,17
1,1_1792018,17.9.2018,Euphaeidae,1,48,Greece,GRC_048_MZB_LO,GRC_048_MZB_LO_1,GRC_048_MZB_LO_145_17.09.2018,2018,9,17
1,1_1792018,17.9.2018,Gammaridae,262,48,Greece,GRC_048_MZB_LO,GRC_048_MZB_LO_1,GRC_048_MZB_LO_145_17.09.2018,2018,9,17
1,1_1792018,17.9.2018,Gomphidae,24,48,Greece,GRC_048_MZB_LO,GRC_048_MZB_LO_1,GRC_048_MZB_LO_145_17.09.2018,2018,9,17
1,1_1792018,17.9.2018,Heptageniidae,4,48,Greece,GRC_048_MZB_LO,GRC_048_MZB_LO_1,GRC_048_MZB_LO_145_17.09.2018,2018,9,17
1,1_1792018,17.9.2018,Leuctridae,8,48,Greece,GRC_048_MZB_LO,GRC_048_MZB_LO_1,GRC_048_MZB_LO_145_17.09.2018,2018,9,17
1,1_1792018,17.9.2018,Oligochaeta,2,48,Greece,GRC_048_MZB_LO,GRC_048_MZB_LO_1,GRC_048_MZB_LO_145_17.09.2018,2018,9,17
1,1_1792018,17.9.2018,Rhyacophilidae,19,48,Greece,GRC_048_MZB_LO,GRC_048_MZB_LO_1,GRC_048_MZB_LO_145_17.09.2018,2018,9,17
1,1_1792018,17.9.2018,Simuliidae,7,48,Greece,GRC_048_MZB_LO,GRC_048_MZB_LO_1,GRC_048_MZB_LO_145_17.09.2018,2018,9,17
1,1_1252019,12.5.2019,Asellidae,2,48,Greece,GRC_048_MZB_LO,GRC_048_MZB_LO_1,GRC_048_MZB_LO_56_12.05.2019,2019,5,12
1,1_1252019,12.5.2019,Baetidae,149,48,Greece,GRC_048_MZB_LO,GRC_048_MZB_LO_1,GRC_048_MZB_LO_56_12.05.2019,2019,5,12
1,1_1252019,12.5.2019,Caenidae,3,48,Greece,GRC_048_MZB_LO,GRC_048_MZB_LO_1,GRC_048_MZB_LO_56_12.05.2019,2019,5,12
1,1_1252019,12.5.2019,Chironomidae,88,48,Greece,GRC_048_MZB_LO,GRC_048_MZB_LO_1,GRC_048_MZB_LO_56_12.05.2019,2019,5,12
1,1_1252019,12.5.2019,Elmidae,25,48,Greece,GRC_048_MZB_LO,GRC_048_MZB_LO_1,GRC_048_MZB_LO_56_12.05.2019,2019,5,12
1,1_1252019,12.5.2019,Empididae,18,48,Greece,GRC_048_MZB_LO,GRC_048_MZB_LO_1,GRC_048_MZB_LO_56_12.05.2019,2019,5,12
1,1_1252019,12.5.2019,Ephemerellidae,2,48,Greece,GRC_048_MZB_LO,GRC_048_MZB_LO_1,GRC_048_MZB_LO_56_12.05.2019,2019,5,12
1,1_1252019,12.5.2019,Gammaridae,468,48,Greece,GRC_048_MZB_LO,GRC_048_MZB_LO_1,GRC_048_MZB_LO_56_12.05.2019,2019,5,12
1,1_1252019,12.5.2019,Gomphidae,3,48,Greece,GRC_048_MZB_LO,GRC_048_MZB_LO_1,GRC_048_MZB_LO_56_12.05.2019,2019,5,12
1,1_1252019,12.5.2019,Heptageniidae,1,48,Greece,GRC_048_MZB_LO,GRC_048_MZB_LO_1,GRC_048_MZB_LO_56_12.05.2019,2019,5,12
1,1_1252019,12.5.2019,Hydroptilidae,1,48,Greece,GRC_048_MZB_LO,GRC_048_MZB_LO_1,GRC_048_MZB_LO_56_12.05.2019,2019,5,12
1,1_1252019,12.5.2019,Limnephilidae,4,48,Greece,GRC_048_MZB_LO,GRC_048_MZB_LO_1,GRC_048_MZB_LO_56_12.05.2019,2019,5,12
1,1_1252019,12.5.2019,Limoniidae,3,48,Greece,GRC_048_MZB_LO,GRC_048_MZB_LO_1,GRC_048_MZB_LO_56_12.05.2019,2019,5,12
1,1_1252019,12.5.2019,Ostracoda,1,48,Greece,GRC_048_MZB_LO,GRC_048_MZB_LO_1,GRC_048_MZB_LO_56_12.05.2019,2019,5,12
1,1_1252019,12.5.2019,Psychodidae,3,48,Greece,GRC_048_MZB_LO,GRC_048_MZB_LO_1,GRC_048_MZB_LO_56_12.05.2019,2019,5,12
1,1_1252019,12.5.2019,Psychomyidae,4,48,Greece,GRC_048_MZB_LO,GRC_048_MZB_LO_1,GRC_048_MZB_LO_56_12.05.2019,2019,5,12
1,1_1252019,12.5.2019,Rhyacophilidae,6,48,Greece,GRC_048_MZB_LO,GRC_048_MZB_LO_1,GRC_048_MZB_LO_56_12.05.2019,2019,5,12
1,1_292020,2.9.2020,Araneae,3,48,Greece,GRC_048_MZB_LO,GRC_048_MZB_LO_1,GRC_048_MZB_LO_1_02.09.2020,2020,9,2
1,1_292020,2.9.2020,Asellidae,2,48,Greece,GRC_048_MZB_LO,GRC_048_MZB_LO_1,GRC_048_MZB_LO_1_02.09.2020,2020,9,2
1,1_292020,2.9.2020,Athericidae,3,48,Greece,GRC_048_MZB_LO,GRC_048_MZB_LO_1,GRC_048_MZB_LO_1_02.09.2020,2020,9,2
1,1_292020,2.9.2020,Baetidae,197,48,Greece,GRC_048_MZB_LO,GRC_048_MZB_LO_1,GRC_048_MZB_LO_1_02.09.2020,2020,9,2
1,1_292020,2.9.2020,Caenidae,22,48,Greece,GRC_048_MZB_LO,GRC_048_MZB_LO_1,GRC_048_MZB_LO_1_02.09.2020,2020,9,2
1,1_292020,2.9.2020,Ceratopogonidae,1,48,Greece,GRC_048_MZB_LO,GRC_048_MZB_LO_1,GRC_048_MZB_LO_1_02.09.2020,2020,9,2
1,1_292020,2.9.2020,Chironomidae,636,48,Greece,GRC_048_MZB_LO,GRC_048_MZB_LO_1,GRC_048_MZB_LO_1_02.09.2020,2020,9,2
1,1_292020,2.9.2020,Dugesiidae,2,48,Greece,GRC_048_MZB_LO,GRC_048_MZB_LO_1,GRC_048_MZB_LO_1_02.09.2020,2020,9,2
1,1_292020,2.9.2020,Elmidae,305,48,Greece,GRC_048_MZB_LO,GRC_048_MZB_LO_1,GRC_048_MZB_LO_1_02.09.2020,2020,9,2
1,1_292020,2.9.2020,Empididae,54,48,Greece,GRC_048_MZB_LO,GRC_048_MZB_LO_1,GRC_048_MZB_LO_1_02.09.2020,2020,9,2
1,1_292020,2.9.2020,Ephemeridae,1,48,Greece,GRC_048_MZB_LO,GRC_048_MZB_LO_1,GRC_048_MZB_LO_1_02.09.2020,2020,9,2
1,1_292020,2.9.2020,Gammaridae,371,48,Greece,GRC_048_MZB_LO,GRC_048_MZB_LO_1,GRC_048_MZB_LO_1_02.09.2020,2020,9,2
1,1_292020,2.9.2020,Gomphidae,5,48,Greece,GRC_048_MZB_LO,GRC_048_MZB_LO_1,GRC_048_MZB_LO_1_02.09.2020,2020,9,2
1,1_292020,2.9.2020,Heptageniidae,10,48,Greece,GRC_048_MZB_LO,GRC_048_MZB_LO_1,GRC_048_MZB_LO_1_02.09.2020,2020,9,2
1,1_292020,2.9.2020,Hydrachnidae,91,48,Greece,GRC_048_MZB_LO,GRC_048_MZB_LO_1,GRC_048_MZB_LO_1_02.09.2020,2020,9,2
1,1_292020,2.9.2020,Hydraenidae,1,48,Greece,GRC_048_MZB_LO,GRC_048_MZB_LO_1,GRC_048_MZB_LO_1_02.09.2020,2020,9,2
1,1_292020,2.9.2020,Hydroptilidae,54,48,Greece,GRC_048_MZB_LO,GRC_048_MZB_LO_1,GRC_048_MZB_LO_1_02.09.2020,2020,9,2
1,1_292020,2.9.2020,Leuctridae,25,48,Greece,GRC_048_MZB_LO,GRC_048_MZB_LO_1,GRC_048_MZB_LO_1_02.09.2020,2020,9,2
1,1_292020,2.9.2020,Limoniidae,5,48,Greece,GRC_048_MZB_LO,GRC_048_MZB_LO_1,GRC_048_MZB_LO_1_02.09.2020,2020,9,2
1,1_292020,2.9.2020,Muscidae,1,48,Greece,GRC_048_MZB_LO,GRC_048_MZB_LO_1,GRC_048_MZB_LO_1_02.09.2020,2020,9,2
1,1_292020,2.9.2020,Oligochaeta,140,48,Greece,GRC_048_MZB_LO,GRC_048_MZB_LO_1,GRC_048_MZB_LO_1_02.09.2020,2020,9,2
1,1_292020,2.9.2020,Ostracoda,3,48,Greece,GRC_048_MZB_LO,GRC_048_MZB_LO_1,GRC_048_MZB_LO_1_02.09.2020,2020,9,2
1,1_292020,2.9.2020,Psychodidae,1,48,Greece,GRC_048_MZB_LO,GRC_048_MZB_LO_1,GRC_048_MZB_LO_1_02.09.2020,2020,9,2
1,1_292020,2.9.2020,Rhyacophilidae,32,48,Greece,GRC_048_MZB_LO,GRC_048_MZB_LO_1,GRC_048_MZB_LO_1_02.09.2020,2020,9,2
1,1_292020,2.9.2020,Simuliidae,28,48,Greece,GRC_048_MZB_LO,GRC_048_MZB_LO_1,GRC_048_MZB_LO_1_02.09.2020,2020,9,2
1,1_292020,2.9.2020,Tabanidae,3,48,Greece,GRC_048_MZB_LO,GRC_048_MZB_LO_1,GRC_048_MZB_LO_1_02.09.2020,2020,9,2
1,1_1552021,15.5.2021,Anthomyidae,27,48,Greece,GRC_048_MZB_LO,GRC_048_MZB_LO_1,GRC_048_MZB_LO_1_15.05.2021,2021,5,15
1,1_1552021,15.5.2021,Asellidae,1,48,Greece,GRC_048_MZB_LO,GRC_048_MZB_LO_1,GRC_048_MZB_LO_1_15.05.2021,2021,5,15
1,1_1552021,15.5.2021,Baetidae,185,48,Greece,GRC_048_MZB_LO,GRC_048_MZB_LO_1,GRC_048_MZB_LO_1_15.05.2021,2021,5,15
1,1_1552021,15.5.2021,Caenidae,6,48,Greece,GRC_048_MZB_LO,GRC_048_MZB_LO_1,GRC_048_MZB_LO_1_15.05.2021,2021,5,15
1,1_1552021,15.5.2021,Ceratopogonidae,22,48,Greece,GRC_048_MZB_LO,GRC_048_MZB_LO_1,GRC_048_MZB_LO_1_15.05.2021,2021,5,15
1,1_1552021,15.5.2021,Chironomidae,1469,48,Greece,GRC_048_MZB_LO,GRC_048_MZB_LO_1,GRC_048_MZB_LO_1_15.05.2021,2021,5,15
1,1_1552021,15.5.2021,Elmidae,43,48,Greece,GRC_048_MZB_LO,GRC_048_MZB_LO_1,GRC_048_MZB_LO_1_15.05.2021,2021,5,15
1,1_1552021,15.5.2021,Empididae,38,48,Greece,GRC_048_MZB_LO,GRC_048_MZB_LO_1,GRC_048_MZB_LO_1_15.05.2021,2021,5,15
1,1_1552021,15.5.2021,Gammaridae,384,48,Greece,GRC_048_MZB_LO,GRC_048_MZB_LO_1,GRC_048_MZB_LO_1_15.05.2021,2021,5,15
1,1_1552021,15.5.2021,Gomphidae,8,48,Greece,GRC_048_MZB_LO,GRC_048_MZB_LO_1,GRC_048_MZB_LO_1_15.05.2021,2021,5,15
1,1_1552021,15.5.2021,Heptageniidae,2,48,Greece,GRC_048_MZB_LO,GRC_048_MZB_LO_1,GRC_048_MZB_LO_1_15.05.2021,2021,5,15
1,1_1552021,15.5.2021,Hydrachnidae,15,48,Greece,GRC_048_MZB_LO,GRC_048_MZB_LO_1,GRC_048_MZB_LO_1_15.05.2021,2021,5,15
1,1_1552021,15.5.2021,Hydraenidae,1,48,Greece,GRC_048_MZB_LO,GRC_048_MZB_LO_1,GRC_048_MZB_LO_1_15.05.2021,2021,5,15
1,1_1552021,15.5.2021,Hydropsychidae,1,48,Greece,GRC_048_MZB_LO,GRC_048_MZB_LO_1,GRC_048_MZB_LO_1_15.05.2021,2021,5,15
1,1_1552021,15.5.2021,Hydroptilidae,8,48,Greece,GRC_048_MZB_LO,GRC_048_MZB_LO_1,GRC_048_MZB_LO_1_15.05.2021,2021,5,15
1,1_1552021,15.5.2021,Leuctridae,4,48,Greece,GRC_048_MZB_LO,GRC_048_MZB_LO_1,GRC_048_MZB_LO_1_15.05.2021,2021,5,15
1,1_1552021,15.5.2021,Limoniidae,8,48,Greece,GRC_048_MZB_LO,GRC_048_MZB_LO_1,GRC_048_MZB_LO_1_15.05.2021,2021,5,15
1,1_1552021,15.5.2021,Physidae,1,48,Greece,GRC_048_MZB_LO,GRC_048_MZB_LO_1,GRC_048_MZB_LO_1_15.05.2021,2021,5,15
1,1_1552021,15.5.2021,Psychodidae,2,48,Greece,GRC_048_MZB_LO,GRC_048_MZB_LO_1,GRC_048_MZB_LO_1_15.05.2021,2021,5,15
1,1_1552021,15.5.2021,Rhagionidae,0,48,Greece,GRC_048_MZB_LO,GRC_048_MZB_LO_1,GRC_048_MZB_LO_1_15.05.2021,2021,5,15
1,1_1552021,15.5.2021,Rhyacophilidae,5,48,Greece,GRC_048_MZB_LO,GRC_048_MZB_LO_1,GRC_048_MZB_LO_1_15.05.2021,2021,5,15
1,1_1552021,15.5.2021,Simuliidae,68,48,Greece,GRC_048_MZB_LO,GRC_048_MZB_LO_1,GRC_048_MZB_LO_1_15.05.2021,2021,5,15
1,1_1552021,15.5.2021,Sphaeriidae,1,48,Greece,GRC_048_MZB_LO,GRC_048_MZB_LO_1,GRC_048_MZB_LO_1_15.05.2021,2021,5,15
1,1_1552021,15.5.2021,Tabanidae,1,48,Greece,GRC_048_MZB_LO,GRC_048_MZB_LO_1,GRC_048_MZB_LO_1_15.05.2021,2021,5,15
1,1_1552021,15.5.2021,Tipulidae,2,48,Greece,GRC_048_MZB_LO,GRC_048_MZB_LO_1,GRC_048_MZB_LO_1_15.05.2021,2021,5,15
1,1_3082021,30.8.2021,Ancylidae,2,48,Greece,GRC_048_MZB_LO,GRC_048_MZB_LO_1,GRC_048_MZB_LO_1_30.08.2021,2021,8,30
1,1_3082021,30.8.2021,Araneae,1,48,Greece,GRC_048_MZB_LO,GRC_048_MZB_LO_1,GRC_048_MZB_LO_1_30.08.2021,2021,8,30
1,1_3082021,30.8.2021,Asellidae,65,48,Greece,GRC_048_MZB_LO,GRC_048_MZB_LO_1,GRC_048_MZB_LO_1_30.08.2021,2021,8,30
1,1_3082021,30.8.2021,Baetidae,12,48,Greece,GRC_048_MZB_LO,GRC_048_MZB_LO_1,GRC_048_MZB_LO_1_30.08.2021,2021,8,30
1,1_3082021,30.8.2021,Caenidae,2092,48,Greece,GRC_048_MZB_LO,GRC_048_MZB_LO_1,GRC_048_MZB_LO_1_30.08.2021,2021,8,30
1,1_3082021,30.8.2021,Ceratopogonidae,6,48,Greece,GRC_048_MZB_LO,GRC_048_MZB_LO_1,GRC_048_MZB_LO_1_30.08.2021,2021,8,30
1,1_3082021,30.8.2021,Chironomidae,1571,48,Greece,GRC_048_MZB_LO,GRC_048_MZB_LO_1,GRC_048_MZB_LO_1_30.08.2021,2021,8,30
1,1_3082021,30.8.2021,Corixidae,2,48,Greece,GRC_048_MZB_LO,GRC_048_MZB_LO_1,GRC_048_MZB_LO_1_30.08.2021,2021,8,30
1,1_3082021,30.8.2021,Elmidae,26,48,Greece,GRC_048_MZB_LO,GRC_048_MZB_LO_1,GRC_048_MZB_LO_1_30.08.2021,2021,8,30
1,1_3082021,30.8.2021,Empididae,2,48,Greece,GRC_048_MZB_LO,GRC_048_MZB_LO_1,GRC_048_MZB_LO_1_30.08.2021,2021,8,30
1,1_3082021,30.8.2021,Ephemerellidae,1,48,Greece,GRC_048_MZB_LO,GRC_048_MZB_LO_1,GRC_048_MZB_LO_1_30.08.2021,2021,8,30
1,1_3082021,30.8.2021,Ephydridae,1,48,Greece,GRC_048_MZB_LO,GRC_048_MZB_LO_1,GRC_048_MZB_LO_1_30.08.2021,2021,8,30
1,1_3082021,30.8.2021,Gammaridae,879,48,Greece,GRC_048_MZB_LO,GRC_048_MZB_LO_1,GRC_048_MZB_LO_1_30.08.2021,2021,8,30
1,1_3082021,30.8.2021,Gerridae,2,48,Greece,GRC_048_MZB_LO,GRC_048_MZB_LO_1,GRC_048_MZB_LO_1_30.08.2021,2021,8,30
1,1_3082021,30.8.2021,Gomphidae,11,48,Greece,GRC_048_MZB_LO,GRC_048_MZB_LO_1,GRC_048_MZB_LO_1_30.08.2021,2021,8,30
1,1_3082021,30.8.2021,Heptageniidae,11,48,Greece,GRC_048_MZB_LO,GRC_048_MZB_LO_1,GRC_048_MZB_LO_1_30.08.2021,2021,8,30
1,1_3082021,30.8.2021,Hydrachnidae,17,48,Greece,GRC_048_MZB_LO,GRC_048_MZB_LO_1,GRC_048_MZB_LO_1_30.08.2021,2021,8,30
1,1_3082021,30.8.2021,Hydrobiidae,1,48,Greece,GRC_048_MZB_LO,GRC_048_MZB_LO_1,GRC_048_MZB_LO_1_30.08.2021,2021,8,30
1,1_3082021,30.8.2021,Hydroptilidae,1,48,Greece,GRC_048_MZB_LO,GRC_048_MZB_LO_1,GRC_048_MZB_LO_1_30.08.2021,2021,8,30
1,1_3082021,30.8.2021,Leptoceridae,1,48,Greece,GRC_048_MZB_LO,GRC_048_MZB_LO_1,GRC_048_MZB_LO_1_30.08.2021,2021,8,30
1,1_3082021,30.8.2021,Leuctridae,1,48,Greece,GRC_048_MZB_LO,GRC_048_MZB_LO_1,GRC_048_MZB_LO_1_30.08.2021,2021,8,30
1,1_3082021,30.8.2021,Libellulidae,1,48,Greece,GRC_048_MZB_LO,GRC_048_MZB_LO_1,GRC_048_MZB_LO_1_30.08.2021,2021,8,30
1,1_3082021,30.8.2021,Limoniidae,1,48,Greece,GRC_048_MZB_LO,GRC_048_MZB_LO_1,GRC_048_MZB_LO_1_30.08.2021,2021,8,30
1,1_3082021,30.8.2021,Lymnaeidae,83,48,Greece,GRC_048_MZB_LO,GRC_048_MZB_LO_1,GRC_048_MZB_LO_1_30.08.2021,2021,8,30
1,1_3082021,30.8.2021,Oligochaeta,28,48,Greece,GRC_048_MZB_LO,GRC_048_MZB_LO_1,GRC_048_MZB_LO_1_30.08.2021,2021,8,30
1,1_3082021,30.8.2021,Ostracoda,26,48,Greece,GRC_048_MZB_LO,GRC_048_MZB_LO_1,GRC_048_MZB_LO_1_30.08.2021,2021,8,30
1,1_3082021,30.8.2021,Physidae,177,48,Greece,GRC_048_MZB_LO,GRC_048_MZB_LO_1,GRC_048_MZB_LO_1_30.08.2021,2021,8,30
1,1_3082021,30.8.2021,Simuliidae,1,48,Greece,GRC_048_MZB_LO,GRC_048_MZB_LO_1,GRC_048_MZB_LO_1_30.08.2021,2021,8,30
1,1_3082021,30.8.2021,Sphaeriidae,14,48,Greece,GRC_048_MZB_LO,GRC_048_MZB_LO_1,GRC_048_MZB_LO_1_30.08.2021,2021,8,30
1,1_3082021,30.8.2021,Tabanidae,6,48,Greece,GRC_048_MZB_LO,GRC_048_MZB_LO_1,GRC_048_MZB_LO_1_30.08.2021,2021,8,30
1,1_3082021,30.8.2021,Valvatidae,12,48,Greece,GRC_048_MZB_LO,GRC_048_MZB_LO_1,GRC_048_MZB_LO_1_30.08.2021,2021,8,30
1,1_1652022,16.5.2022,Baetidae,326,48,Greece,GRC_048_MZB_LO,GRC_048_MZB_LO_1,GRC_048_MZB_LO_38_16.05.2022,2022,5,16
1,1_1652022,16.5.2022,Chironomidae,109,48,Greece,GRC_048_MZB_LO,GRC_048_MZB_LO_1,GRC_048_MZB_LO_38_16.05.2022,2022,5,16
1,1_1652022,16.5.2022,Elmidae,3,48,Greece,GRC_048_MZB_LO,GRC_048_MZB_LO_1,GRC_048_MZB_LO_38_16.05.2022,2022,5,16
1,1_1652022,16.5.2022,Empididae,2,48,Greece,GRC_048_MZB_LO,GRC_048_MZB_LO_1,GRC_048_MZB_LO_38_16.05.2022,2022,5,16
1,1_1652022,16.5.2022,Gammaridae,6,48,Greece,GRC_048_MZB_LO,GRC_048_MZB_LO_1,GRC_048_MZB_LO_38_16.05.2022,2022,5,16
1,1_1652022,16.5.2022,Heptageniidae,1,48,Greece,GRC_048_MZB_LO,GRC_048_MZB_LO_1,GRC_048_MZB_LO_38_16.05.2022,2022,5,16
1,1_1652022,16.5.2022,Leuctridae,1,48,Greece,GRC_048_MZB_LO,GRC_048_MZB_LO_1,GRC_048_MZB_LO_38_16.05.2022,2022,5,16
1,1_1652022,16.5.2022,Limoniidae,4,48,Greece,GRC_048_MZB_LO,GRC_048_MZB_LO_1,GRC_048_MZB_LO_38_16.05.2022,2022,5,16
1,1_1652022,16.5.2022,Rhyacophilidae,8,48,Greece,GRC_048_MZB_LO,GRC_048_MZB_LO_1,GRC_048_MZB_LO_38_16.05.2022,2022,5,16
1,1_1652022,16.5.2022,Simuliidae,73,48,Greece,GRC_048_MZB_LO,GRC_048_MZB_LO_1,GRC_048_MZB_LO_38_16.05.2022,2022,5,16
1,1_2982022,29.8.2022,Asellidae,1,48,Greece,GRC_048_MZB_LO,GRC_048_MZB_LO_1,GRC_048_MZB_LO_132_29.08.2022,2022,8,29
1,1_2982022,29.8.2022,Baetidae,95,48,Greece,GRC_048_MZB_LO,GRC_048_MZB_LO_1,GRC_048_MZB_LO_132_29.08.2022,2022,8,29
1,1_2982022,29.8.2022,Caenidae,1,48,Greece,GRC_048_MZB_LO,GRC_048_MZB_LO_1,GRC_048_MZB_LO_132_29.08.2022,2022,8,29
1,1_2982022,29.8.2022,Chironomidae,16,48,Greece,GRC_048_MZB_LO,GRC_048_MZB_LO_1,GRC_048_MZB_LO_132_29.08.2022,2022,8,29
1,1_2982022,29.8.2022,Dolichopodidae,1,48,Greece,GRC_048_MZB_LO,GRC_048_MZB_LO_1,GRC_048_MZB_LO_132_29.08.2022,2022,8,29
1,1_2982022,29.8.2022,Elmidae,9,48,Greece,GRC_048_MZB_LO,GRC_048_MZB_LO_1,GRC_048_MZB_LO_132_29.08.2022,2022,8,29
1,1_2982022,29.8.2022,Empididae,1,48,Greece,GRC_048_MZB_LO,GRC_048_MZB_LO_1,GRC_048_MZB_LO_132_29.08.2022,2022,8,29
1,1_2982022,29.8.2022,Gammaridae,258,48,Greece,GRC_048_MZB_LO,GRC_048_MZB_LO_1,GRC_048_MZB_LO_132_29.08.2022,2022,8,29
1,1_2982022,29.8.2022,Glossiphoniidae,1,48,Greece,GRC_048_MZB_LO,GRC_048_MZB_LO_1,GRC_048_MZB_LO_132_29.08.2022,2022,8,29
1,1_2982022,29.8.2022,Heptageniidae,6,48,Greece,GRC_048_MZB_LO,GRC_048_MZB_LO_1,GRC_048_MZB_LO_132_29.08.2022,2022,8,29
1,1_2982022,29.8.2022,Hydrophilidae,1,48,Greece,GRC_048_MZB_LO,GRC_048_MZB_LO_1,GRC_048_MZB_LO_132_29.08.2022,2022,8,29
1,1_2982022,29.8.2022,Hydroptilidae,1,48,Greece,GRC_048_MZB_LO,GRC_048_MZB_LO_1,GRC_048_MZB_LO_132_29.08.2022,2022,8,29
1,1_2982022,29.8.2022,Physidae,1,48,Greece,GRC_048_MZB_LO,GRC_048_MZB_LO_1,GRC_048_MZB_LO_132_29.08.2022,2022,8,29
1,1_2982022,29.8.2022,Rhyacophilidae,12,48,Greece,GRC_048_MZB_LO,GRC_048_MZB_LO_1,GRC_048_MZB_LO_132_29.08.2022,2022,8,29
1,1_2982022,29.8.2022,Simuliidae,2,48,Greece,GRC_048_MZB_LO,GRC_048_MZB_LO_1,GRC_048_MZB_LO_132_29.08.2022,2022,8,29
1,1_2982022,29.8.2022,Tabanidae,1,48,Greece,GRC_048_MZB_LO,GRC_048_MZB_LO_1,GRC_048_MZB_LO_132_29.08.2022,2022,8,29
1,1_1352023,13.5.2023,Araneae,1,48,Greece,GRC_048_MZB_LO,GRC_048_MZB_LO_1,GRC_048_MZB_LO_1_13.05.2023,2023,5,13
1,1_1352023,13.5.2023,Asellidae,6,48,Greece,GRC_048_MZB_LO,GRC_048_MZB_LO_1,GRC_048_MZB_LO_1_13.05.2023,2023,5,13
1,1_1352023,13.5.2023,Baetidae,1214,48,Greece,GRC_048_MZB_LO,GRC_048_MZB_LO_1,GRC_048_MZB_LO_1_13.05.2023,2023,5,13
1,1_1352023,13.5.2023,Caenidae,6,48,Greece,GRC_048_MZB_LO,GRC_048_MZB_LO_1,GRC_048_MZB_LO_1_13.05.2023,2023,5,13
1,1_1352023,13.5.2023,Ceratopogonidae,1,48,Greece,GRC_048_MZB_LO,GRC_048_MZB_LO_1,GRC_048_MZB_LO_1_13.05.2023,2023,5,13
1,1_1352023,13.5.2023,Chironomidae,20,48,Greece,GRC_048_MZB_LO,GRC_048_MZB_LO_1,GRC_048_MZB_LO_1_13.05.2023,2023,5,13
1,1_1352023,13.5.2023,Elmidae,27,48,Greece,GRC_048_MZB_LO,GRC_048_MZB_LO_1,GRC_048_MZB_LO_1_13.05.2023,2023,5,13
1,1_1352023,13.5.2023,Empididae,13,48,Greece,GRC_048_MZB_LO,GRC_048_MZB_LO_1,GRC_048_MZB_LO_1_13.05.2023,2023,5,13
1,1_1352023,13.5.2023,Gammaridae,663,48,Greece,GRC_048_MZB_LO,GRC_048_MZB_LO_1,GRC_048_MZB_LO_1_13.05.2023,2023,5,13
1,1_1352023,13.5.2023,Hebridae,1,48,Greece,GRC_048_MZB_LO,GRC_048_MZB_LO_1,GRC_048_MZB_LO_1_13.05.2023,2023,5,13
1,1_1352023,13.5.2023,Heptageniidae,5,48,Greece,GRC_048_MZB_LO,GRC_048_MZB_LO_1,GRC_048_MZB_LO_1_13.05.2023,2023,5,13
1,1_1352023,13.5.2023,Hydropsychidae,1,48,Greece,GRC_048_MZB_LO,GRC_048_MZB_LO_1,GRC_048_MZB_LO_1_13.05.2023,2023,5,13
1,1_1352023,13.5.2023,Leuctridae,8,48,Greece,GRC_048_MZB_LO,GRC_048_MZB_LO_1,GRC_048_MZB_LO_1_13.05.2023,2023,5,13
1,1_1352023,13.5.2023,Limnephilidae,3,48,Greece,GRC_048_MZB_LO,GRC_048_MZB_LO_1,GRC_048_MZB_LO_1_13.05.2023,2023,5,13
1,1_1352023,13.5.2023,Limoniidae,11,48,Greece,GRC_048_MZB_LO,GRC_048_MZB_LO_1,GRC_048_MZB_LO_1_13.05.2023,2023,5,13
1,1_1352023,13.5.2023,Oligochaeta,1,48,Greece,GRC_048_MZB_LO,GRC_048_MZB_LO_1,GRC_048_MZB_LO_1_13.05.2023,2023,5,13
1,1_1352023,13.5.2023,Psychomyidae,3,48,Greece,GRC_048_MZB_LO,GRC_048_MZB_LO_1,GRC_048_MZB_LO_1_13.05.2023,2023,5,13
1,1_1352023,13.5.2023,Rhyacophilidae,13,48,Greece,GRC_048_MZB_LO,GRC_048_MZB_LO_1,GRC_048_MZB_LO_1_13.05.2023,2023,5,13
1,1_1352023,13.5.2023,Simuliidae,124,48,Greece,GRC_048_MZB_LO,GRC_048_MZB_LO_1,GRC_048_MZB_LO_1_13.05.2023,2023,5,13
1,1_1352023,13.5.2023,Sphaeriidae,1,48,Greece,GRC_048_MZB_LO,GRC_048_MZB_LO_1,GRC_048_MZB_LO_1_13.05.2023,2023,5,13
1,1_1352023,13.5.2023,Tabanidae,1,48,Greece,GRC_048_MZB_LO,GRC_048_MZB_LO_1,GRC_048_MZB_LO_1_13.05.2023,2023,5,13
1,1_1352023,13.5.2023,Tipulidae,1,48,Greece,GRC_048_MZB_LO,GRC_048_MZB_LO_1,GRC_048_MZB_LO_1_13.05.2023,2023,5,13
1,1_2492023,24.9.2023,Ancylidae,50,48,Greece,GRC_048_MZB_LO,GRC_048_MZB_LO_1,GRC_048_MZB_LO_1_24.09.2023,2023,9,24
1,1_2492023,24.9.2023,Araneae,1,48,Greece,GRC_048_MZB_LO,GRC_048_MZB_LO_1,GRC_048_MZB_LO_1_24.09.2023,2023,9,24
1,1_2492023,24.9.2023,Asellidae,7,48,Greece,GRC_048_MZB_LO,GRC_048_MZB_LO_1,GRC_048_MZB_LO_1_24.09.2023,2023,9,24
1,1_2492023,24.9.2023,Baetidae,84,48,Greece,GRC_048_MZB_LO,GRC_048_MZB_LO_1,GRC_048_MZB_LO_1_24.09.2023,2023,9,24
1,1_2492023,24.9.2023,Caenidae,2,48,Greece,GRC_048_MZB_LO,GRC_048_MZB_LO_1,GRC_048_MZB_LO_1_24.09.2023,2023,9,24
1,1_2492023,24.9.2023,Chironomidae,44,48,Greece,GRC_048_MZB_LO,GRC_048_MZB_LO_1,GRC_048_MZB_LO_1_24.09.2023,2023,9,24
1,1_2492023,24.9.2023,Elmidae,35,48,Greece,GRC_048_MZB_LO,GRC_048_MZB_LO_1,GRC_048_MZB_LO_1_24.09.2023,2023,9,24
1,1_2492023,24.9.2023,Empididae,2,48,Greece,GRC_048_MZB_LO,GRC_048_MZB_LO_1,GRC_048_MZB_LO_1_24.09.2023,2023,9,24
1,1_2492023,24.9.2023,Ephemeridae,1,48,Greece,GRC_048_MZB_LO,GRC_048_MZB_LO_1,GRC_048_MZB_LO_1_24.09.2023,2023,9,24
1,1_2492023,24.9.2023,Gammaridae,1138,48,Greece,GRC_048_MZB_LO,GRC_048_MZB_LO_1,GRC_048_MZB_LO_1_24.09.2023,2023,9,24
1,1_2492023,24.9.2023,Heptageniidae,9,48,Greece,GRC_048_MZB_LO,GRC_048_MZB_LO_1,GRC_048_MZB_LO_1_24.09.2023,2023,9,24
1,1_2492023,24.9.2023,Hydrachnidae,2,48,Greece,GRC_048_MZB_LO,GRC_048_MZB_LO_1,GRC_048_MZB_LO_1_24.09.2023,2023,9,24
1,1_2492023,24.9.2023,Hydrophilidae,1,48,Greece,GRC_048_MZB_LO,GRC_048_MZB_LO_1,GRC_048_MZB_LO_1_24.09.2023,2023,9,24
1,1_2492023,24.9.2023,Leuctridae,2,48,Greece,GRC_048_MZB_LO,GRC_048_MZB_LO_1,GRC_048_MZB_LO_1_24.09.2023,2023,9,24
1,1_2492023,24.9.2023,Limoniidae,4,48,Greece,GRC_048_MZB_LO,GRC_048_MZB_LO_1,GRC_048_MZB_LO_1_24.09.2023,2023,9,24
1,1_2492023,24.9.2023,Psychodidae,1,48,Greece,GRC_048_MZB_LO,GRC_048_MZB_LO_1,GRC_048_MZB_LO_1_24.09.2023,2023,9,24
1,1_2492023,24.9.2023,Rhyacophilidae,9,48,Greece,GRC_048_MZB_LO,GRC_048_MZB_LO_1,GRC_048_MZB_LO_1_24.09.2023,2023,9,24
1,1_2492023,24.9.2023,Sphaeriidae,2,48,Greece,GRC_048_MZB_LO,GRC_048_MZB_LO_1,GRC_048_MZB_LO_1_24.09.2023,2023,9,24
1,1_2492023,24.9.2023,Tabanidae,1,48,Greece,GRC_048_MZB_LO,GRC_048_MZB_LO_1,GRC_048_MZB_LO_1_24.09.2023,2023,9,24
25,25_342014,3.4.2014,Araneae,1,48,Greece,GRC_048_MZB_LO,GRC_048_MZB_LO_10,GRC_048_MZB_LO_28_03.04.2014,2014,4,3
25,25_342014,3.4.2014,Asellidae,753,48,Greece,GRC_048_MZB_LO,GRC_048_MZB_LO_10,GRC_048_MZB_LO_28_03.04.2014,2014,4,3
25,25_342014,3.4.2014,Baetidae,559,48,Greece,GRC_048_MZB_LO,GRC_048_MZB_LO_10,GRC_048_MZB_LO_28_03.04.2014,2014,4,3
25,25_342014,3.4.2014,Caenidae,100,48,Greece,GRC_048_MZB_LO,GRC_048_MZB_LO_10,GRC_048_MZB_LO_28_03.04.2014,2014,4,3
25,25_342014,3.4.2014,Ceratopogonidae,2,48,Greece,GRC_048_MZB_LO,GRC_048_MZB_LO_10,GRC_048_MZB_LO_28_03.04.2014,2014,4,3
25,25_342014,3.4.2014,Chironomidae,505,48,Greece,GRC_048_MZB_LO,GRC_048_MZB_LO_10,GRC_048_MZB_LO_28_03.04.2014,2014,4,3
25,25_342014,3.4.2014,Coenagrionidae,2,48,Greece,GRC_048_MZB_LO,GRC_048_MZB_LO_10,GRC_048_MZB_LO_28_03.04.2014,2014,4,3
25,25_342014,3.4.2014,Curculionidae,1,48,Greece,GRC_048_MZB_LO,GRC_048_MZB_LO_10,GRC_048_MZB_LO_28_03.04.2014,2014,4,3
25,25_342014,3.4.2014,Elmidae,4,48,Greece,GRC_048_MZB_LO,GRC_048_MZB_LO_10,GRC_048_MZB_LO_28_03.04.2014,2014,4,3
25,25_342014,3.4.2014,Empididae,1,48,Greece,GRC_048_MZB_LO,GRC_048_MZB_LO_10,GRC_048_MZB_LO_28_03.04.2014,2014,4,3
25,25_342014,3.4.2014,Ephemerellidae,23,48,Greece,GRC_048_MZB_LO,GRC_048_MZB_LO_10,GRC_048_MZB_LO_28_03.04.2014,2014,4,3
25,25_342014,3.4.2014,Erpobdellidae,2,48,Greece,GRC_048_MZB_LO,GRC_048_MZB_LO_10,GRC_048_MZB_LO_28_03.04.2014,2014,4,3
25,25_342014,3.4.2014,Gammaridae,8,48,Greece,GRC_048_MZB_LO,GRC_048_MZB_LO_10,GRC_048_MZB_LO_28_03.04.2014,2014,4,3
25,25_342014,3.4.2014,Glossiphoniidae,5,48,Greece,GRC_048_MZB_LO,GRC_048_MZB_LO_10,GRC_048_MZB_LO_28_03.04.2014,2014,4,3
25,25_342014,3.4.2014,Gomphidae,4,48,Greece,GRC_048_MZB_LO,GRC_048_MZB_LO_10,GRC_048_MZB_LO_28_03.04.2014,2014,4,3
25,25_342014,3.4.2014,Heptageniidae,24,48,Greece,GRC_048_MZB_LO,GRC_048_MZB_LO_10,GRC_048_MZB_LO_28_03.04.2014,2014,4,3
25,25_342014,3.4.2014,Hydraenidae,1,48,Greece,GRC_048_MZB_LO,GRC_048_MZB_LO_10,GRC_048_MZB_LO_28_03.04.2014,2014,4,3
25,25_342014,3.4.2014,Hydroptilidae,4,48,Greece,GRC_048_MZB_LO,GRC_048_MZB_LO_10,GRC_048_MZB_LO_28_03.04.2014,2014,4,3
25,25_342014,3.4.2014,Lepidoptera,2,48,Greece,GRC_048_MZB_LO,GRC_048_MZB_LO_10,GRC_048_MZB_LO_28_03.04.2014,2014,4,3
25,25_342014,3.4.2014,Leptoceridae,1,48,Greece,GRC_048_MZB_LO,GRC_048_MZB_LO_10,GRC_048_MZB_LO_28_03.04.2014,2014,4,3
25,25_342014,3.4.2014,Limoniidae,8,48,Greece,GRC_048_MZB_LO,GRC_048_MZB_LO_10,GRC_048_MZB_LO_28_03.04.2014,2014,4,3
25,25_342014,3.4.2014,Nepidae,1,48,Greece,GRC_048_MZB_LO,GRC_048_MZB_LO_10,GRC_048_MZB_LO_28_03.04.2014,2014,4,3
25,25_342014,3.4.2014,Oligochaeta,36,48,Greece,GRC_048_MZB_LO,GRC_048_MZB_LO_10,GRC_048_MZB_LO_28_03.04.2014,2014,4,3
25,25_342014,3.4.2014,Physidae,3,48,Greece,GRC_048_MZB_LO,GRC_048_MZB_LO_10,GRC_048_MZB_LO_28_03.04.2014,2014,4,3
25,25_342014,3.4.2014,Psychodidae,2,48,Greece,GRC_048_MZB_LO,GRC_048_MZB_LO_10,GRC_048_MZB_LO_28_03.04.2014,2014,4,3
25,25_342014,3.4.2014,Psychomyidae,5,48,Greece,GRC_048_MZB_LO,GRC_048_MZB_LO_10,GRC_048_MZB_LO_28_03.04.2014,2014,4,3
25,25_342014,3.4.2014,Rhyacophilidae,3,48,Greece,GRC_048_MZB_LO,GRC_048_MZB_LO_10,GRC_048_MZB_LO_28_03.04.2014,2014,4,3
25,25_342014,3.4.2014,Simuliidae,164,48,Greece,GRC_048_MZB_LO,GRC_048_MZB_LO_10,GRC_048_MZB_LO_28_03.04.2014,2014,4,3
25,25_342014,3.4.2014,Tipulidae,1,48,Greece,GRC_048_MZB_LO,GRC_048_MZB_LO_10,GRC_048_MZB_LO_28_03.04.2014,2014,4,3
25,25_352018,3.5.2018,Baetidae,207,48,Greece,GRC_048_MZB_LO,GRC_048_MZB_LO_10,GRC_048_MZB_LO_78_03.05.2018,2018,5,3
25,25_352018,3.5.2018,Caenidae,12,48,Greece,GRC_048_MZB_LO,GRC_048_MZB_LO_10,GRC_048_MZB_LO_78_03.05.2018,2018,5,3
25,25_352018,3.5.2018,Ceratopogonidae,2,48,Greece,GRC_048_MZB_LO,GRC_048_MZB_LO_10,GRC_048_MZB_LO_78_03.05.2018,2018,5,3
25,25_352018,3.5.2018,Chironomidae,985,48,Greece,GRC_048_MZB_LO,GRC_048_MZB_LO_10,GRC_048_MZB_LO_78_03.05.2018,2018,5,3
25,25_352018,3.5.2018,Culicidae,5,48,Greece,GRC_048_MZB_LO,GRC_048_MZB_LO_10,GRC_048_MZB_LO_78_03.05.2018,2018,5,3
25,25_352018,3.5.2018,Dixidae,8,48,Greece,GRC_048_MZB_LO,GRC_048_MZB_LO_10,GRC_048_MZB_LO_78_03.05.2018,2018,5,3
25,25_352018,3.5.2018,Dytiscidae,70,48,Greece,GRC_048_MZB_LO,GRC_048_MZB_LO_10,GRC_048_MZB_LO_78_03.05.2018,2018,5,3
25,25_352018,3.5.2018,Ephemerellidae,38,48,Greece,GRC_048_MZB_LO,GRC_048_MZB_LO_10,GRC_048_MZB_LO_78_03.05.2018,2018,5,3
25,25_352018,3.5.2018,Gammaridae,29,48,Greece,GRC_048_MZB_LO,GRC_048_MZB_LO_10,GRC_048_MZB_LO_78_03.05.2018,2018,5,3
25,25_352018,3.5.2018,Gerridae,5,48,Greece,GRC_048_MZB_LO,GRC_048_MZB_LO_10,GRC_048_MZB_LO_78_03.05.2018,2018,5,3
25,25_352018,3.5.2018,Gomphidae,4,48,Greece,GRC_048_MZB_LO,GRC_048_MZB_LO_10,GRC_048_MZB_LO_78_03.05.2018,2018,5,3
25,25_352018,3.5.2018,Helophoridae,50,48,Greece,GRC_048_MZB_LO,GRC_048_MZB_LO_10,GRC_048_MZB_LO_78_03.05.2018,2018,5,3
25,25_352018,3.5.2018,Hydrophilidae,52,48,Greece,GRC_048_MZB_LO,GRC_048_MZB_LO_10,GRC_048_MZB_LO_78_03.05.2018,2018,5,3
25,25_352018,3.5.2018,Lestidae,14,48,Greece,GRC_048_MZB_LO,GRC_048_MZB_LO_10,GRC_048_MZB_LO_78_03.05.2018,2018,5,3
25,25_352018,3.5.2018,Libellulidae,1,48,Greece,GRC_048_MZB_LO,GRC_048_MZB_LO_10,GRC_048_MZB_LO_78_03.05.2018,2018,5,3
25,25_352018,3.5.2018,Notonectidae,1,48,Greece,GRC_048_MZB_LO,GRC_048_MZB_LO_10,GRC_048_MZB_LO_78_03.05.2018,2018,5,3
25,25_352018,3.5.2018,Oligochaeta,550,48,Greece,GRC_048_MZB_LO,GRC_048_MZB_LO_10,GRC_048_MZB_LO_78_03.05.2018,2018,5,3
25,25_352018,3.5.2018,Platycnemididae,3,48,Greece,GRC_048_MZB_LO,GRC_048_MZB_LO_10,GRC_048_MZB_LO_78_03.05.2018,2018,5,3
25,25_352018,3.5.2018,Sciomyzidae,1,48,Greece,GRC_048_MZB_LO,GRC_048_MZB_LO_10,GRC_048_MZB_LO_78_03.05.2018,2018,5,3
25,25_352018,3.5.2018,Tabanidae,1,48,Greece,GRC_048_MZB_LO,GRC_048_MZB_LO_10,GRC_048_MZB_LO_78_03.05.2018,2018,5,3
25,25_352018,3.5.2018,Tipulidae,25,48,Greece,GRC_048_MZB_LO,GRC_048_MZB_LO_10,GRC_048_MZB_LO_78_03.05.2018,2018,5,3
25,25_352018,3.5.2018,Valvatidae,4,48,Greece,GRC_048_MZB_LO,GRC_048_MZB_LO_10,GRC_048_MZB_LO_78_03.05.2018,2018,5,3
25,25_1092018,10.9.2018,Baetidae,130,48,Greece,GRC_048_MZB_LO,GRC_048_MZB_LO_10,GRC_048_MZB_LO_10_10.09.2018,2018,9,10
25,25_1092018,10.9.2018,Caenidae,505,48,Greece,GRC_048_MZB_LO,GRC_048_MZB_LO_10,GRC_048_MZB_LO_10_10.09.2018,2018,9,10
25,25_1092018,10.9.2018,Ceratopogonidae,1,48,Greece,GRC_048_MZB_LO,GRC_048_MZB_LO_10,GRC_048_MZB_LO_10_10.09.2018,2018,9,10
25,25_1092018,10.9.2018,Chironomidae,164,48,Greece,GRC_048_MZB_LO,GRC_048_MZB_LO_10,GRC_048_MZB_LO_10_10.09.2018,2018,9,10
25,25_1092018,10.9.2018,Coenagrionidae,4,48,Greece,GRC_048_MZB_LO,GRC_048_MZB_LO_10,GRC_048_MZB_LO_10_10.09.2018,2018,9,10
25,25_1092018,10.9.2018,Dixidae,1,48,Greece,GRC_048_MZB_LO,GRC_048_MZB_LO_10,GRC_048_MZB_LO_10_10.09.2018,2018,9,10
25,25_1092018,10.9.2018,Dytiscidae,57,48,Greece,GRC_048_MZB_LO,GRC_048_MZB_LO_10,GRC_048_MZB_LO_10_10.09.2018,2018,9,10
25,25_1092018,10.9.2018,Ferrissidae,1,48,Greece,GRC_048_MZB_LO,GRC_048_MZB_LO_10,GRC_048_MZB_LO_10_10.09.2018,2018,9,10
25,25_1092018,10.9.2018,Gammaridae,2,48,Greece,GRC_048_MZB_LO,GRC_048_MZB_LO_10,GRC_048_MZB_LO_10_10.09.2018,2018,9,10
25,25_1092018,10.9.2018,Gerridae,10,48,Greece,GRC_048_MZB_LO,GRC_048_MZB_LO_10,GRC_048_MZB_LO_10_10.09.2018,2018,9,10
25,25_1092018,10.9.2018,Gomphidae,6,48,Greece,GRC_048_MZB_LO,GRC_048_MZB_LO_10,GRC_048_MZB_LO_10_10.09.2018,2018,9,10
25,25_1092018,10.9.2018,Hydrophilidae,16,48,Greece,GRC_048_MZB_LO,GRC_048_MZB_LO_10,GRC_048_MZB_LO_10_10.09.2018,2018,9,10
25,25_1092018,10.9.2018,Hydropsychidae,1,48,Greece,GRC_048_MZB_LO,GRC_048_MZB_LO_10,GRC_048_MZB_LO_10_10.09.2018,2018,9,10
25,25_1092018,10.9.2018,Hydroptilidae,3,48,Greece,GRC_048_MZB_LO,GRC_048_MZB_LO_10,GRC_048_MZB_LO_10_10.09.2018,2018,9,10
25,25_1092018,10.9.2018,Libellulidae,60,48,Greece,GRC_048_MZB_LO,GRC_048_MZB_LO_10,GRC_048_MZB_LO_10_10.09.2018,2018,9,10
25,25_1092018,10.9.2018,Lymnaeidae,14,48,Greece,GRC_048_MZB_LO,GRC_048_MZB_LO_10,GRC_048_MZB_LO_10_10.09.2018,2018,9,10
25,25_1092018,10.9.2018,Muscidae,1,48,Greece,GRC_048_MZB_LO,GRC_048_MZB_LO_10,GRC_048_MZB_LO_10_10.09.2018,2018,9,10
25,25_1092018,10.9.2018,Ostracoda,3,48,Greece,GRC_048_MZB_LO,GRC_048_MZB_LO_10,GRC_048_MZB_LO_10_10.09.2018,2018,9,10
25,25_1092018,10.9.2018,Planorbidae,109,48,Greece,GRC_048_MZB_LO,GRC_048_MZB_LO_10,GRC_048_MZB_LO_10_10.09.2018,2018,9,10
25,25_1092018,10.9.2018,Platycnemididae,1,48,Greece,GRC_048_MZB_LO,GRC_048_MZB_LO_10,GRC_048_MZB_LO_10_10.09.2018,2018,9,10
25,25_1092018,10.9.2018,Tabanidae,2,48,Greece,GRC_048_MZB_LO,GRC_048_MZB_LO_10,GRC_048_MZB_LO_10_10.09.2018,2018,9,10
25,25_1092018,10.9.2018,Tipulidae,1,48,Greece,GRC_048_MZB_LO,GRC_048_MZB_LO_10,GRC_048_MZB_LO_10_10.09.2018,2018,9,10
25,25_1092018,10.9.2018,Tubificidae,248,48,Greece,GRC_048_MZB_LO,GRC_048_MZB_LO_10,GRC_048_MZB_LO_10_10.09.2018,2018,9,10
25,25_3152019,31.5.2019,Anthomyidae,4,48,Greece,GRC_048_MZB_LO,GRC_048_MZB_LO_10,GRC_048_MZB_LO_10_31.05.2019,2019,5,31
25,25_3152019,31.5.2019,Aphididae,4,48,Greece,GRC_048_MZB_LO,GRC_048_MZB_LO_10,GRC_048_MZB_LO_10_31.05.2019,2019,5,31
25,25_3152019,31.5.2019,Araneae,1,48,Greece,GRC_048_MZB_LO,GRC_048_MZB_LO_10,GRC_048_MZB_LO_10_31.05.2019,2019,5,31
25,25_3152019,31.5.2019,Baetidae,586,48,Greece,GRC_048_MZB_LO,GRC_048_MZB_LO_10,GRC_048_MZB_LO_10_31.05.2019,2019,5,31
25,25_3152019,31.5.2019,Caenidae,6,48,Greece,GRC_048_MZB_LO,GRC_048_MZB_LO_10,GRC_048_MZB_LO_10_31.05.2019,2019,5,31
25,25_3152019,31.5.2019,Ceratopogonidae,2,48,Greece,GRC_048_MZB_LO,GRC_048_MZB_LO_10,GRC_048_MZB_LO_10_31.05.2019,2019,5,31
25,25_3152019,31.5.2019,Chironomidae,1410,48,Greece,GRC_048_MZB_LO,GRC_048_MZB_LO_10,GRC_048_MZB_LO_10_31.05.2019,2019,5,31
25,25_3152019,31.5.2019,Coenagrionidae,1,48,Greece,GRC_048_MZB_LO,GRC_048_MZB_LO_10,GRC_048_MZB_LO_10_31.05.2019,2019,5,31
25,25_3152019,31.5.2019,Dytiscidae,16,48,Greece,GRC_048_MZB_LO,GRC_048_MZB_LO_10,GRC_048_MZB_LO_10_31.05.2019,2019,5,31
25,25_3152019,31.5.2019,Ephemerellidae,67,48,Greece,GRC_048_MZB_LO,GRC_048_MZB_LO_10,GRC_048_MZB_LO_10_31.05.2019,2019,5,31
25,25_3152019,31.5.2019,Ephydridae,4,48,Greece,GRC_048_MZB_LO,GRC_048_MZB_LO_10,GRC_048_MZB_LO_10_31.05.2019,2019,5,31
25,25_3152019,31.5.2019,Gammaridae,69,48,Greece,GRC_048_MZB_LO,GRC_048_MZB_LO_10,GRC_048_MZB_LO_10_31.05.2019,2019,5,31
25,25_3152019,31.5.2019,Gomphidae,2,48,Greece,GRC_048_MZB_LO,GRC_048_MZB_LO_10,GRC_048_MZB_LO_10_31.05.2019,2019,5,31
25,25_3152019,31.5.2019,Gyrinidae,1,48,Greece,GRC_048_MZB_LO,GRC_048_MZB_LO_10,GRC_048_MZB_LO_10_31.05.2019,2019,5,31
25,25_3152019,31.5.2019,Helophoridae,3,48,Greece,GRC_048_MZB_LO,GRC_048_MZB_LO_10,GRC_048_MZB_LO_10_31.05.2019,2019,5,31
25,25_3152019,31.5.2019,Hydrometridae,11,48,Greece,GRC_048_MZB_LO,GRC_048_MZB_LO_10,GRC_048_MZB_LO_10_31.05.2019,2019,5,31
25,25_3152019,31.5.2019,Hydrophilidae,6,48,Greece,GRC_048_MZB_LO,GRC_048_MZB_LO_10,GRC_048_MZB_LO_10_31.05.2019,2019,5,31
25,25_3152019,31.5.2019,Hydropsychidae,7,48,Greece,GRC_048_MZB_LO,GRC_048_MZB_LO_10,GRC_048_MZB_LO_10_31.05.2019,2019,5,31
25,25_3152019,31.5.2019,Hydroptilidae,8,48,Greece,GRC_048_MZB_LO,GRC_048_MZB_LO_10,GRC_048_MZB_LO_10_31.05.2019,2019,5,31
25,25_3152019,31.5.2019,Muscidae,1,48,Greece,GRC_048_MZB_LO,GRC_048_MZB_LO_10,GRC_048_MZB_LO_10_31.05.2019,2019,5,31
25,25_3152019,31.5.2019,Nepidae,1,48,Greece,GRC_048_MZB_LO,GRC_048_MZB_LO_10,GRC_048_MZB_LO_10_31.05.2019,2019,5,31
25,25_3152019,31.5.2019,Notonectidae,1,48,Greece,GRC_048_MZB_LO,GRC_048_MZB_LO_10,GRC_048_MZB_LO_10_31.05.2019,2019,5,31
25,25_3152019,31.5.2019,Oligochaeta,176,48,Greece,GRC_048_MZB_LO,GRC_048_MZB_LO_10,GRC_048_MZB_LO_10_31.05.2019,2019,5,31
25,25_3152019,31.5.2019,Planorbidae,56,48,Greece,GRC_048_MZB_LO,GRC_048_MZB_LO_10,GRC_048_MZB_LO_10_31.05.2019,2019,5,31
25,25_3152019,31.5.2019,Platycnemididae,20,48,Greece,GRC_048_MZB_LO,GRC_048_MZB_LO_10,GRC_048_MZB_LO_10_31.05.2019,2019,5,31
25,25_3152019,31.5.2019,Psychodidae,1,48,Greece,GRC_048_MZB_LO,GRC_048_MZB_LO_10,GRC_048_MZB_LO_10_31.05.2019,2019,5,31
25,25_3152019,31.5.2019,Simuliidae,203,48,Greece,GRC_048_MZB_LO,GRC_048_MZB_LO_10,GRC_048_MZB_LO_10_31.05.2019,2019,5,31
25,25_3152019,31.5.2019,Tipulidae,1,48,Greece,GRC_048_MZB_LO,GRC_048_MZB_LO_10,GRC_048_MZB_LO_10_31.05.2019,2019,5,31
25,25_192019,1.9.2019,Aphididae,1,48,Greece,GRC_048_MZB_LO,GRC_048_MZB_LO_10,GRC_048_MZB_LO_126_01.09.2019,2019,9,1
25,25_192019,1.9.2019,Baetidae,4,48,Greece,GRC_048_MZB_LO,GRC_048_MZB_LO_10,GRC_048_MZB_LO_126_01.09.2019,2019,9,1
25,25_192019,1.9.2019,Caenidae,18,48,Greece,GRC_048_MZB_LO,GRC_048_MZB_LO_10,GRC_048_MZB_LO_126_01.09.2019,2019,9,1
25,25_192019,1.9.2019,Ceratopogonidae,1,48,Greece,GRC_048_MZB_LO,GRC_048_MZB_LO_10,GRC_048_MZB_LO_126_01.09.2019,2019,9,1
25,25_192019,1.9.2019,Chironomidae,2145,48,Greece,GRC_048_MZB_LO,GRC_048_MZB_LO_10,GRC_048_MZB_LO_126_01.09.2019,2019,9,1
25,25_192019,1.9.2019,Culicidae,1,48,Greece,GRC_048_MZB_LO,GRC_048_MZB_LO_10,GRC_048_MZB_LO_126_01.09.2019,2019,9,1
25,25_192019,1.9.2019,Dytiscidae,2,48,Greece,GRC_048_MZB_LO,GRC_048_MZB_LO_10,GRC_048_MZB_LO_126_01.09.2019,2019,9,1
25,25_192019,1.9.2019,Ephydridae,3,48,Greece,GRC_048_MZB_LO,GRC_048_MZB_LO_10,GRC_048_MZB_LO_126_01.09.2019,2019,9,1
25,25_192019,1.9.2019,Gomphidae,1,48,Greece,GRC_048_MZB_LO,GRC_048_MZB_LO_10,GRC_048_MZB_LO_126_01.09.2019,2019,9,1
25,25_192019,1.9.2019,Hydrophilidae,12,48,Greece,GRC_048_MZB_LO,GRC_048_MZB_LO_10,GRC_048_MZB_LO_126_01.09.2019,2019,9,1
25,25_192019,1.9.2019,Libellulidae,10,48,Greece,GRC_048_MZB_LO,GRC_048_MZB_LO_10,GRC_048_MZB_LO_126_01.09.2019,2019,9,1
25,25_192019,1.9.2019,Oligochaeta,6,48,Greece,GRC_048_MZB_LO,GRC_048_MZB_LO_10,GRC_048_MZB_LO_126_01.09.2019,2019,9,1
25,25_192019,1.9.2019,Planorbidae,23,48,Greece,GRC_048_MZB_LO,GRC_048_MZB_LO_10,GRC_048_MZB_LO_126_01.09.2019,2019,9,1
25,25_192019,1.9.2019,Psychomyidae,6,48,Greece,GRC_048_MZB_LO,GRC_048_MZB_LO_10,GRC_048_MZB_LO_126_01.09.2019,2019,9,1
25,25_2882020,28.8.2020,Araneae,3,48,Greece,GRC_048_MZB_LO,GRC_048_MZB_LO_10,GRC_048_MZB_LO_10_28.08.2020,2020,8,28
25,25_2882020,28.8.2020,Asellidae,2,48,Greece,GRC_048_MZB_LO,GRC_048_MZB_LO_10,GRC_048_MZB_LO_10_28.08.2020,2020,8,28
25,25_2882020,28.8.2020,Baetidae,72,48,Greece,GRC_048_MZB_LO,GRC_048_MZB_LO_10,GRC_048_MZB_LO_10_28.08.2020,2020,8,28
25,25_2882020,28.8.2020,Caenidae,2,48,Greece,GRC_048_MZB_LO,GRC_048_MZB_LO_10,GRC_048_MZB_LO_10_28.08.2020,2020,8,28
25,25_2882020,28.8.2020,Ceratopogonidae,1,48,Greece,GRC_048_MZB_LO,GRC_048_MZB_LO_10,GRC_048_MZB_LO_10_28.08.2020,2020,8,28
25,25_2882020,28.8.2020,Chironomidae (red),2937,48,Greece,GRC_048_MZB_LO,GRC_048_MZB_LO_10,GRC_048_MZB_LO_10_28.08.2020,2020,8,28
25,25_2882020,28.8.2020,Coenagrionidae,1,48,Greece,GRC_048_MZB_LO,GRC_048_MZB_LO_10,GRC_048_MZB_LO_10_28.08.2020,2020,8,28
25,25_2882020,28.8.2020,Culicidae,4,48,Greece,GRC_048_MZB_LO,GRC_048_MZB_LO_10,GRC_048_MZB_LO_10_28.08.2020,2020,8,28
25,25_2882020,28.8.2020,Dytiscidae,4,48,Greece,GRC_048_MZB_LO,GRC_048_MZB_LO_10,GRC_048_MZB_LO_10_28.08.2020,2020,8,28
25,25_2882020,28.8.2020,Ephydridae,1,48,Greece,GRC_048_MZB_LO,GRC_048_MZB_LO_10,GRC_048_MZB_LO_10_28.08.2020,2020,8,28
25,25_2882020,28.8.2020,Gammaridae,6,48,Greece,GRC_048_MZB_LO,GRC_048_MZB_LO_10,GRC_048_MZB_LO_10_28.08.2020,2020,8,28
25,25_2882020,28.8.2020,Gerridae,100,48,Greece,GRC_048_MZB_LO,GRC_048_MZB_LO_10,GRC_048_MZB_LO_10_28.08.2020,2020,8,28
25,25_2882020,28.8.2020,Hydrachnidae,1,48,Greece,GRC_048_MZB_LO,GRC_048_MZB_LO_10,GRC_048_MZB_LO_10_28.08.2020,2020,8,28
25,25_2882020,28.8.2020,Hydrophilidae,16,48,Greece,GRC_048_MZB_LO,GRC_048_MZB_LO_10,GRC_048_MZB_LO_10_28.08.2020,2020,8,28
25,25_2882020,28.8.2020,Libellulidae,2,48,Greece,GRC_048_MZB_LO,GRC_048_MZB_LO_10,GRC_048_MZB_LO_10_28.08.2020,2020,8,28
25,25_2882020,28.8.2020,Notonectidae,1,48,Greece,GRC_048_MZB_LO,GRC_048_MZB_LO_10,GRC_048_MZB_LO_10_28.08.2020,2020,8,28
25,25_2882020,28.8.2020,Oligochaeta,13,48,Greece,GRC_048_MZB_LO,GRC_048_MZB_LO_10,GRC_048_MZB_LO_10_28.08.2020,2020,8,28
25,25_2882020,28.8.2020,Planorbidae,16,48,Greece,GRC_048_MZB_LO,GRC_048_MZB_LO_10,GRC_048_MZB_LO_10_28.08.2020,2020,8,28
25,25_2882020,28.8.2020,Platycnemididae,5,48,Greece,GRC_048_MZB_LO,GRC_048_MZB_LO_10,GRC_048_MZB_LO_10_28.08.2020,2020,8,28
25,25_2882020,28.8.2020,Psychodidae,1,48,Greece,GRC_048_MZB_LO,GRC_048_MZB_LO_10,GRC_048_MZB_LO_10_28.08.2020,2020,8,28
25,25_2882020,28.8.2020,Simuliidae,1,48,Greece,GRC_048_MZB_LO,GRC_048_MZB_LO_10,GRC_048_MZB_LO_10_28.08.2020,2020,8,28
25,25_2882020,28.8.2020,Stratiomyidae,4,48,Greece,GRC_048_MZB_LO,GRC_048_MZB_LO_10,GRC_048_MZB_LO_10_28.08.2020,2020,8,28
25,25_2882020,28.8.2020,Syrphidae,3,48,Greece,GRC_048_MZB_LO,GRC_048_MZB_LO_10,GRC_048_MZB_LO_10_28.08.2020,2020,8,28
25,25_2882020,28.8.2020,Tabanidae,1,48,Greece,GRC_048_MZB_LO,GRC_048_MZB_LO_10,GRC_048_MZB_LO_10_28.08.2020,2020,8,28
25,25_3182021,31.8.2021,Chironomidae (red),4562,48,Greece,GRC_048_MZB_LO,GRC_048_MZB_LO_10,GRC_048_MZB_LO_10_31.08.2021,2021,8,31
25,25_3182021,31.8.2021,Corixidae,2,48,Greece,GRC_048_MZB_LO,GRC_048_MZB_LO_10,GRC_048_MZB_LO_10_31.08.2021,2021,8,31
25,25_3182021,31.8.2021,Hydrophilidae,14,48,Greece,GRC_048_MZB_LO,GRC_048_MZB_LO_10,GRC_048_MZB_LO_10_31.08.2021,2021,8,31
25,25_3182021,31.8.2021,Psychodidae,1,48,Greece,GRC_048_MZB_LO,GRC_048_MZB_LO_10,GRC_048_MZB_LO_10_31.08.2021,2021,8,31
25,25_3182021,31.8.2021,Tabanidae,1,48,Greece,GRC_048_MZB_LO,GRC_048_MZB_LO_10,GRC_048_MZB_LO_10_31.08.2021,2021,8,31
25,25_2452022,24.5.2022,Baetidae,32,48,Greece,GRC_048_MZB_LO,GRC_048_MZB_LO_10,GRC_048_MZB_LO_10_24.05.2022,2022,5,24
25,25_2452022,24.5.2022,Caenidae,2,48,Greece,GRC_048_MZB_LO,GRC_048_MZB_LO_10,GRC_048_MZB_LO_10_24.05.2022,2022,5,24
25,25_2452022,24.5.2022,Chironomidae,1552,48,Greece,GRC_048_MZB_LO,GRC_048_MZB_LO_10,GRC_048_MZB_LO_10_24.05.2022,2022,5,24
25,25_2452022,24.5.2022,Corixidae,1,48,Greece,GRC_048_MZB_LO,GRC_048_MZB_LO_10,GRC_048_MZB_LO_10_24.05.2022,2022,5,24
25,25_2452022,24.5.2022,Ephemerellidae,1,48,Greece,GRC_048_MZB_LO,GRC_048_MZB_LO_10,GRC_048_MZB_LO_10_24.05.2022,2022,5,24
25,25_2452022,24.5.2022,Ephydridae,1,48,Greece,GRC_048_MZB_LO,GRC_048_MZB_LO_10,GRC_048_MZB_LO_10_24.05.2022,2022,5,24
25,25_2452022,24.5.2022,Gammaridae,2,48,Greece,GRC_048_MZB_LO,GRC_048_MZB_LO_10,GRC_048_MZB_LO_10_24.05.2022,2022,5,24
25,25_2452022,24.5.2022,Helophoridae,2,48,Greece,GRC_048_MZB_LO,GRC_048_MZB_LO_10,GRC_048_MZB_LO_10_24.05.2022,2022,5,24
25,25_2452022,24.5.2022,Hydrophilidae,15,48,Greece,GRC_048_MZB_LO,GRC_048_MZB_LO_10,GRC_048_MZB_LO_10_24.05.2022,2022,5,24
25,25_2452022,24.5.2022,Hydropsychidae,2,48,Greece,GRC_048_MZB_LO,GRC_048_MZB_LO_10,GRC_048_MZB_LO_10_24.05.2022,2022,5,24
25,25_2452022,24.5.2022,Leuctridae,1,48,Greece,GRC_048_MZB_LO,GRC_048_MZB_LO_10,GRC_048_MZB_LO_10_24.05.2022,2022,5,24
25,25_2452022,24.5.2022,Oligochaeta,126,48,Greece,GRC_048_MZB_LO,GRC_048_MZB_LO_10,GRC_048_MZB_LO_10_24.05.2022,2022,5,24
25,25_2452022,24.5.2022,Ostracoda,1,48,Greece,GRC_048_MZB_LO,GRC_048_MZB_LO_10,GRC_048_MZB_LO_10_24.05.2022,2022,5,24
25,25_2452022,24.5.2022,Psychodidae,6,48,Greece,GRC_048_MZB_LO,GRC_048_MZB_LO_10,GRC_048_MZB_LO_10_24.05.2022,2022,5,24
25,25_2452022,24.5.2022,Simuliidae,13,48,Greece,GRC_048_MZB_LO,GRC_048_MZB_LO_10,GRC_048_MZB_LO_10_24.05.2022,2022,5,24
25,25_3082022,30.8.2022,Baetidae,8,48,Greece,GRC_048_MZB_LO,GRC_048_MZB_LO_10,GRC_048_MZB_LO_145_30.08.2022,2022,8,30
25,25_3082022,30.8.2022,Caenidae,18,48,Greece,GRC_048_MZB_LO,GRC_048_MZB_LO_10,GRC_048_MZB_LO_145_30.08.2022,2022,8,30
25,25_3082022,30.8.2022,Chironomidae,41,48,Greece,GRC_048_MZB_LO,GRC_048_MZB_LO_10,GRC_048_MZB_LO_145_30.08.2022,2022,8,30
25,25_3082022,30.8.2022,Coenagrionidae,8,48,Greece,GRC_048_MZB_LO,GRC_048_MZB_LO_10,GRC_048_MZB_LO_145_30.08.2022,2022,8,30
25,25_3082022,30.8.2022,Corduliidae,36,48,Greece,GRC_048_MZB_LO,GRC_048_MZB_LO_10,GRC_048_MZB_LO_145_30.08.2022,2022,8,30
25,25_3082022,30.8.2022,Dytiscidae,3,48,Greece,GRC_048_MZB_LO,GRC_048_MZB_LO_10,GRC_048_MZB_LO_145_30.08.2022,2022,8,30
25,25_3082022,30.8.2022,Elmidae,1,48,Greece,GRC_048_MZB_LO,GRC_048_MZB_LO_10,GRC_048_MZB_LO_145_30.08.2022,2022,8,30
25,25_3082022,30.8.2022,Ephydridae,2,48,Greece,GRC_048_MZB_LO,GRC_048_MZB_LO_10,GRC_048_MZB_LO_145_30.08.2022,2022,8,30
25,25_3082022,30.8.2022,Erpobdellidae,1,48,Greece,GRC_048_MZB_LO,GRC_048_MZB_LO_10,GRC_048_MZB_LO_145_30.08.2022,2022,8,30
25,25_3082022,30.8.2022,Hydrophilidae,252,48,Greece,GRC_048_MZB_LO,GRC_048_MZB_LO_10,GRC_048_MZB_LO_145_30.08.2022,2022,8,30
25,25_3082022,30.8.2022,Oligochaeta,45,48,Greece,GRC_048_MZB_LO,GRC_048_MZB_LO_10,GRC_048_MZB_LO_145_30.08.2022,2022,8,30
25,25_3082022,30.8.2022,Physidae,259,48,Greece,GRC_048_MZB_LO,GRC_048_MZB_LO_10,GRC_048_MZB_LO_145_30.08.2022,2022,8,30
25,25_3082022,30.8.2022,Stratiomyidae,1,48,Greece,GRC_048_MZB_LO,GRC_048_MZB_LO_10,GRC_048_MZB_LO_145_30.08.2022,2022,8,30
25,25_3082022,30.8.2022,Tabanidae,1,48,Greece,GRC_048_MZB_LO,GRC_048_MZB_LO_10,GRC_048_MZB_LO_145_30.08.2022,2022,8,30
259,259_2042013,20.4.2013,Aphelocheiridae,4,48,Greece,GRC_048_MZB_LO,GRC_048_MZB_LO_100,GRC_048_MZB_LO_22_20.04.2013,2013,4,20
259,259_2042013,20.4.2013,Asellidae,2,48,Greece,GRC_048_MZB_LO,GRC_048_MZB_LO_100,GRC_048_MZB_LO_22_20.04.2013,2013,4,20
259,259_2042013,20.4.2013,Atyidae,48,48,Greece,GRC_048_MZB_LO,GRC_048_MZB_LO_100,GRC_048_MZB_LO_22_20.04.2013,2013,4,20
259,259_2042013,20.4.2013,Baetidae,26,48,Greece,GRC_048_MZB_LO,GRC_048_MZB_LO_100,GRC_048_MZB_LO_22_20.04.2013,2013,4,20
259,259_2042013,20.4.2013,Caenidae,68,48,Greece,GRC_048_MZB_LO,GRC_048_MZB_LO_100,GRC_048_MZB_LO_22_20.04.2013,2013,4,20
259,259_2042013,20.4.2013,Calopterygidae,5,48,Greece,GRC_048_MZB_LO,GRC_048_MZB_LO_100,GRC_048_MZB_LO_22_20.04.2013,2013,4,20
259,259_2042013,20.4.2013,Chironomidae,1,48,Greece,GRC_048_MZB_LO,GRC_048_MZB_LO_100,GRC_048_MZB_LO_22_20.04.2013,2013,4,20
259,259_2042013,20.4.2013,Dryopidae,1,48,Greece,GRC_048_MZB_LO,GRC_048_MZB_LO_100,GRC_048_MZB_LO_22_20.04.2013,2013,4,20
259,259_2042013,20.4.2013,Elmidae,18,48,Greece,GRC_048_MZB_LO,GRC_048_MZB_LO_100,GRC_048_MZB_LO_22_20.04.2013,2013,4,20
259,259_2042013,20.4.2013,Ephemerellidae,18,48,Greece,GRC_048_MZB_LO,GRC_048_MZB_LO_100,GRC_048_MZB_LO_22_20.04.2013,2013,4,20
259,259_2042013,20.4.2013,Gammaridae,25,48,Greece,GRC_048_MZB_LO,GRC_048_MZB_LO_100,GRC_048_MZB_LO_22_20.04.2013,2013,4,20
259,259_2042013,20.4.2013,Gomphidae,3,48,Greece,GRC_048_MZB_LO,GRC_048_MZB_LO_100,GRC_048_MZB_LO_22_20.04.2013,2013,4,20
259,259_2042013,20.4.2013,Heptageniidae,2,48,Greece,GRC_048_MZB_LO,GRC_048_MZB_LO_100,GRC_048_MZB_LO_22_20.04.2013,2013,4,20
259,259_2042013,20.4.2013,Hydroptilidae,6,48,Greece,GRC_048_MZB_LO,GRC_048_MZB_LO_100,GRC_048_MZB_LO_22_20.04.2013,2013,4,20
259,259_2042013,20.4.2013,Lepidostomatidae,75,48,Greece,GRC_048_MZB_LO,GRC_048_MZB_LO_100,GRC_048_MZB_LO_22_20.04.2013,2013,4,20
259,259_2042013,20.4.2013,Leptoceridae,17,48,Greece,GRC_048_MZB_LO,GRC_048_MZB_LO_100,GRC_048_MZB_LO_22_20.04.2013,2013,4,20
259,259_2042013,20.4.2013,Leptophlebiidae,8,48,Greece,GRC_048_MZB_LO,GRC_048_MZB_LO_100,GRC_048_MZB_LO_22_20.04.2013,2013,4,20
259,259_2042013,20.4.2013,Platycnemididae,2,48,Greece,GRC_048_MZB_LO,GRC_048_MZB_LO_100,GRC_048_MZB_LO_22_20.04.2013,2013,4,20
259,259_2042013,20.4.2013,Sphaeriidae,1,48,Greece,GRC_048_MZB_LO,GRC_048_MZB_LO_100,GRC_048_MZB_LO_22_20.04.2013,2013,4,20
259,259_14102013,14.10.2013,Araneae,1,48,Greece,GRC_048_MZB_LO,GRC_048_MZB_LO_100,GRC_048_MZB_LO_65_14.10.2013,2013,10,14
259,259_14102013,14.10.2013,Baetidae,4,48,Greece,GRC_048_MZB_LO,GRC_048_MZB_LO_100,GRC_048_MZB_LO_65_14.10.2013,2013,10,14
259,259_14102013,14.10.2013,Chironomidae,7,48,Greece,GRC_048_MZB_LO,GRC_048_MZB_LO_100,GRC_048_MZB_LO_65_14.10.2013,2013,10,14
259,259_14102013,14.10.2013,Gammaridae,1,48,Greece,GRC_048_MZB_LO,GRC_048_MZB_LO_100,GRC_048_MZB_LO_65_14.10.2013,2013,10,14
259,259_14102013,14.10.2013,Gomphidae,4,48,Greece,GRC_048_MZB_LO,GRC_048_MZB_LO_100,GRC_048_MZB_LO_65_14.10.2013,2013,10,14
259,259_14102013,14.10.2013,Mysidae,675,48,Greece,GRC_048_MZB_LO,GRC_048_MZB_LO_100,GRC_048_MZB_LO_65_14.10.2013,2013,10,14
259,259_2742018,27.4.2018,Atyidae,11,48,Greece,GRC_048_MZB_LO,GRC_048_MZB_LO_100,GRC_048_MZB_LO_62_27.04.2018,2018,4,27
259,259_2742018,27.4.2018,Baetidae,96,48,Greece,GRC_048_MZB_LO,GRC_048_MZB_LO_100,GRC_048_MZB_LO_62_27.04.2018,2018,4,27
259,259_2742018,27.4.2018,Caenidae,19,48,Greece,GRC_048_MZB_LO,GRC_048_MZB_LO_100,GRC_048_MZB_LO_62_27.04.2018,2018,4,27
259,259_2742018,27.4.2018,Ceratopogonidae,3,48,Greece,GRC_048_MZB_LO,GRC_048_MZB_LO_100,GRC_048_MZB_LO_62_27.04.2018,2018,4,27
259,259_2742018,27.4.2018,Chironomidae,21,48,Greece,GRC_048_MZB_LO,GRC_048_MZB_LO_100,GRC_048_MZB_LO_62_27.04.2018,2018,4,27
259,259_2742018,27.4.2018,Elmidae,5,48,Greece,GRC_048_MZB_LO,GRC_048_MZB_LO_100,GRC_048_MZB_LO_62_27.04.2018,2018,4,27
259,259_2742018,27.4.2018,Ephemerellidae,67,48,Greece,GRC_048_MZB_LO,GRC_048_MZB_LO_100,GRC_048_MZB_LO_62_27.04.2018,2018,4,27
259,259_2742018,27.4.2018,Gammaridae,31,48,Greece,GRC_048_MZB_LO,GRC_048_MZB_LO_100,GRC_048_MZB_LO_62_27.04.2018,2018,4,27
259,259_2742018,27.4.2018,Heptageniidae,3,48,Greece,GRC_048_MZB_LO,GRC_048_MZB_LO_100,GRC_048_MZB_LO_62_27.04.2018,2018,4,27
259,259_2742018,27.4.2018,Hydrachnidae,2,48,Greece,GRC_048_MZB_LO,GRC_048_MZB_LO_100,GRC_048_MZB_LO_62_27.04.2018,2018,4,27
259,259_2742018,27.4.2018,Hydrobiidae,4,48,Greece,GRC_048_MZB_LO,GRC_048_MZB_LO_100,GRC_048_MZB_LO_62_27.04.2018,2018,4,27
259,259_2742018,27.4.2018,Hydropsychidae,6,48,Greece,GRC_048_MZB_LO,GRC_048_MZB_LO_100,GRC_048_MZB_LO_62_27.04.2018,2018,4,27
259,259_2742018,27.4.2018,Hydroptilidae,7,48,Greece,GRC_048_MZB_LO,GRC_048_MZB_LO_100,GRC_048_MZB_LO_62_27.04.2018,2018,4,27
259,259_2742018,27.4.2018,Perlodidae,2,48,Greece,GRC_048_MZB_LO,GRC_048_MZB_LO_100,GRC_048_MZB_LO_62_27.04.2018,2018,4,27
259,259_2742018,27.4.2018,Physidae,1,48,Greece,GRC_048_MZB_LO,GRC_048_MZB_LO_100,GRC_048_MZB_LO_62_27.04.2018,2018,4,27
259,259_2742018,27.4.2018,Simuliidae,3,48,Greece,GRC_048_MZB_LO,GRC_048_MZB_LO_100,GRC_048_MZB_LO_62_27.04.2018,2018,4,27
259,259_772018,7.7.2018,Atyidae,393,48,Greece,GRC_048_MZB_LO,GRC_048_MZB_LO_100,GRC_048_MZB_LO_100_07.07.2018,2018,7,7
259,259_772018,7.7.2018,Baetidae,28,48,Greece,GRC_048_MZB_LO,GRC_048_MZB_LO_100,GRC_048_MZB_LO_100_07.07.2018,2018,7,7
259,259_772018,7.7.2018,Calopterygidae,1,48,Greece,GRC_048_MZB_LO,GRC_048_MZB_LO_100,GRC_048_MZB_LO_100_07.07.2018,2018,7,7
259,259_772018,7.7.2018,Chironomidae,29,48,Greece,GRC_048_MZB_LO,GRC_048_MZB_LO_100,GRC_048_MZB_LO_100_07.07.2018,2018,7,7
259,259_772018,7.7.2018,Coenagrionidae,1,48,Greece,GRC_048_MZB_LO,GRC_048_MZB_LO_100,GRC_048_MZB_LO_100_07.07.2018,2018,7,7
259,259_772018,7.7.2018,Dytiscidae,2,48,Greece,GRC_048_MZB_LO,GRC_048_MZB_LO_100,GRC_048_MZB_LO_100_07.07.2018,2018,7,7
259,259_772018,7.7.2018,Elmidae,1,48,Greece,GRC_048_MZB_LO,GRC_048_MZB_LO_100,GRC_048_MZB_LO_100_07.07.2018,2018,7,7
259,259_772018,7.7.2018,Ephemerellidae,2,48,Greece,GRC_048_MZB_LO,GRC_048_MZB_LO_100,GRC_048_MZB_LO_100_07.07.2018,2018,7,7
259,259_772018,7.7.2018,Gammaridae,42,48,Greece,GRC_048_MZB_LO,GRC_048_MZB_LO_100,GRC_048_MZB_LO_100_07.07.2018,2018,7,7
259,259_772018,7.7.2018,Haliplidae,8,48,Greece,GRC_048_MZB_LO,GRC_048_MZB_LO_100,GRC_048_MZB_LO_100_07.07.2018,2018,7,7
259,259_772018,7.7.2018,Hydrobiidae,1,48,Greece,GRC_048_MZB_LO,GRC_048_MZB_LO_100,GRC_048_MZB_LO_100_07.07.2018,2018,7,7
259,259_772018,7.7.2018,Leptoceridae,1,48,Greece,GRC_048_MZB_LO,GRC_048_MZB_LO_100,GRC_048_MZB_LO_100_07.07.2018,2018,7,7
259,259_772018,7.7.2018,Platycnemididae,1,48,Greece,GRC_048_MZB_LO,GRC_048_MZB_LO_100,GRC_048_MZB_LO_100_07.07.2018,2018,7,7
259,259_772018,7.7.2018,Tabanidae,1,48,Greece,GRC_048_MZB_LO,GRC_048_MZB_LO_100,GRC_048_MZB_LO_100_07.07.2018,2018,7,7
259,259_842019,8.4.2019,Asellidae,1,48,Greece,GRC_048_MZB_LO,GRC_048_MZB_LO_100,GRC_048_MZB_LO_68_08.04.2019,2019,4,8
259,259_842019,8.4.2019,Atyidae,331,48,Greece,GRC_048_MZB_LO,GRC_048_MZB_LO_100,GRC_048_MZB_LO_68_08.04.2019,2019,4,8
259,259_842019,8.4.2019,Baetidae,97,48,Greece,GRC_048_MZB_LO,GRC_048_MZB_LO_100,GRC_048_MZB_LO_68_08.04.2019,2019,4,8
259,259_842019,8.4.2019,Chironomidae,7,48,Greece,GRC_048_MZB_LO,GRC_048_MZB_LO_100,GRC_048_MZB_LO_68_08.04.2019,2019,4,8
259,259_842019,8.4.2019,Elmidae,3,48,Greece,GRC_048_MZB_LO,GRC_048_MZB_LO_100,GRC_048_MZB_LO_68_08.04.2019,2019,4,8
259,259_842019,8.4.2019,Gammaridae,61,48,Greece,GRC_048_MZB_LO,GRC_048_MZB_LO_100,GRC_048_MZB_LO_68_08.04.2019,2019,4,8
259,259_842019,8.4.2019,Haliplidae,1,48,Greece,GRC_048_MZB_LO,GRC_048_MZB_LO_100,GRC_048_MZB_LO_68_08.04.2019,2019,4,8
259,259_842019,8.4.2019,Hydrobiidae,5,48,Greece,GRC_048_MZB_LO,GRC_048_MZB_LO_100,GRC_048_MZB_LO_68_08.04.2019,2019,4,8
259,259_842019,8.4.2019,Hydropsychidae,1,48,Greece,GRC_048_MZB_LO,GRC_048_MZB_LO_100,GRC_048_MZB_LO_68_08.04.2019,2019,4,8
259,259_842019,8.4.2019,Leptophlebiidae,1,48,Greece,GRC_048_MZB_LO,GRC_048_MZB_LO_100,GRC_048_MZB_LO_68_08.04.2019,2019,4,8
259,259_842019,8.4.2019,Lymnaeidae,1,48,Greece,GRC_048_MZB_LO,GRC_048_MZB_LO_100,GRC_048_MZB_LO_68_08.04.2019,2019,4,8
259,259_2882019,28.8.2019,Atyidae,158,48,Greece,GRC_048_MZB_LO,GRC_048_MZB_LO_100,GRC_048_MZB_LO_69_28.08.2019,2019,8,28
259,259_2882019,28.8.2019,Baetidae,6,48,Greece,GRC_048_MZB_LO,GRC_048_MZB_LO_100,GRC_048_MZB_LO_69_28.08.2019,2019,8,28
259,259_2882019,28.8.2019,Calopterygidae,2,48,Greece,GRC_048_MZB_LO,GRC_048_MZB_LO_100,GRC_048_MZB_LO_69_28.08.2019,2019,8,28
259,259_2882019,28.8.2019,Ceratopogonidae,8,48,Greece,GRC_048_MZB_LO,GRC_048_MZB_LO_100,GRC_048_MZB_LO_69_28.08.2019,2019,8,28
259,259_2882019,28.8.2019,Chironomidae,67,48,Greece,GRC_048_MZB_LO,GRC_048_MZB_LO_100,GRC_048_MZB_LO_69_28.08.2019,2019,8,28
259,259_2882019,28.8.2019,Coenagrionidae,1,48,Greece,GRC_048_MZB_LO,GRC_048_MZB_LO_100,GRC_048_MZB_LO_69_28.08.2019,2019,8,28
259,259_2882019,28.8.2019,Dixidae,1,48,Greece,GRC_048_MZB_LO,GRC_048_MZB_LO_100,GRC_048_MZB_LO_69_28.08.2019,2019,8,28
259,259_2882019,28.8.2019,Dryopidae,2,48,Greece,GRC_048_MZB_LO,GRC_048_MZB_LO_100,GRC_048_MZB_LO_69_28.08.2019,2019,8,28
259,259_2882019,28.8.2019,Elmidae,4,48,Greece,GRC_048_MZB_LO,GRC_048_MZB_LO_100,GRC_048_MZB_LO_69_28.08.2019,2019,8,28
259,259_2882019,28.8.2019,Gammaridae,32,48,Greece,GRC_048_MZB_LO,GRC_048_MZB_LO_100,GRC_048_MZB_LO_69_28.08.2019,2019,8,28
259,259_2882019,28.8.2019,Gerridae,2,48,Greece,GRC_048_MZB_LO,GRC_048_MZB_LO_100,GRC_048_MZB_LO_69_28.08.2019,2019,8,28
259,259_2882019,28.8.2019,Gomphidae,1,48,Greece,GRC_048_MZB_LO,GRC_048_MZB_LO_100,GRC_048_MZB_LO_69_28.08.2019,2019,8,28
259,259_2882019,28.8.2019,Gyrinidae,3,48,Greece,GRC_048_MZB_LO,GRC_048_MZB_LO_100,GRC_048_MZB_LO_69_28.08.2019,2019,8,28
259,259_2882019,28.8.2019,Hydrachnidae,9,48,Greece,GRC_048_MZB_LO,GRC_048_MZB_LO_100,GRC_048_MZB_LO_69_28.08.2019,2019,8,28
259,259_2882019,28.8.2019,Hydraenidae,1,48,Greece,GRC_048_MZB_LO,GRC_048_MZB_LO_100,GRC_048_MZB_LO_69_28.08.2019,2019,8,28
259,259_2882019,28.8.2019,Hydrobiidae,26,48,Greece,GRC_048_MZB_LO,GRC_048_MZB_LO_100,GRC_048_MZB_LO_69_28.08.2019,2019,8,28
259,259_2882019,28.8.2019,Hydroptilidae,13,48,Greece,GRC_048_MZB_LO,GRC_048_MZB_LO_100,GRC_048_MZB_LO_69_28.08.2019,2019,8,28
259,259_2882019,28.8.2019,Leptoceridae,5,48,Greece,GRC_048_MZB_LO,GRC_048_MZB_LO_100,GRC_048_MZB_LO_69_28.08.2019,2019,8,28
259,259_2882019,28.8.2019,Leuctridae,1,48,Greece,GRC_048_MZB_LO,GRC_048_MZB_LO_100,GRC_048_MZB_LO_69_28.08.2019,2019,8,28
259,259_2882019,28.8.2019,Neritidae,1,48,Greece,GRC_048_MZB_LO,GRC_048_MZB_LO_100,GRC_048_MZB_LO_69_28.08.2019,2019,8,28
259,259_2882019,28.8.2019,Ostracoda,7,48,Greece,GRC_048_MZB_LO,GRC_048_MZB_LO_100,GRC_048_MZB_LO_69_28.08.2019,2019,8,28
259,259_2882019,28.8.2019,Platycnemididae,2,48,Greece,GRC_048_MZB_LO,GRC_048_MZB_LO_100,GRC_048_MZB_LO_69_28.08.2019,2019,8,28
259,259_1572020,15.7.2020,Atyidae,1013,48,Greece,GRC_048_MZB_LO,GRC_048_MZB_LO_100,GRC_048_MZB_LO_100_15.07.2020,2020,7,15
259,259_1572020,15.7.2020,Baetidae,62,48,Greece,GRC_048_MZB_LO,GRC_048_MZB_LO_100,GRC_048_MZB_LO_100_15.07.2020,2020,7,15
259,259_1572020,15.7.2020,Chironomidae,4,48,Greece,GRC_048_MZB_LO,GRC_048_MZB_LO_100,GRC_048_MZB_LO_100_15.07.2020,2020,7,15
259,259_1572020,15.7.2020,Corixidae,1,48,Greece,GRC_048_MZB_LO,GRC_048_MZB_LO_100,GRC_048_MZB_LO_100_15.07.2020,2020,7,15
259,259_1572020,15.7.2020,Ephemerellidae,1,48,Greece,GRC_048_MZB_LO,GRC_048_MZB_LO_100,GRC_048_MZB_LO_100_15.07.2020,2020,7,15
259,259_1572020,15.7.2020,Gammaridae,277,48,Greece,GRC_048_MZB_LO,GRC_048_MZB_LO_100,GRC_048_MZB_LO_100_15.07.2020,2020,7,15
259,259_1572020,15.7.2020,Gerridae,2,48,Greece,GRC_048_MZB_LO,GRC_048_MZB_LO_100,GRC_048_MZB_LO_100_15.07.2020,2020,7,15
259,259_1572020,15.7.2020,Haliplidae,1,48,Greece,GRC_048_MZB_LO,GRC_048_MZB_LO_100,GRC_048_MZB_LO_100_15.07.2020,2020,7,15
259,259_1572020,15.7.2020,Muscidae,4,48,Greece,GRC_048_MZB_LO,GRC_048_MZB_LO_100,GRC_048_MZB_LO_100_15.07.2020,2020,7,15
259,259_2242021,22.4.2021,Aphididae,3,48,Greece,GRC_048_MZB_LO,GRC_048_MZB_LO_100,GRC_048_MZB_LO_58_22.04.2021,2021,4,22
259,259_2242021,22.4.2021,Asellidae,1,48,Greece,GRC_048_MZB_LO,GRC_048_MZB_LO_100,GRC_048_MZB_LO_58_22.04.2021,2021,4,22
259,259_2242021,22.4.2021,Atyidae,441,48,Greece,GRC_048_MZB_LO,GRC_048_MZB_LO_100,GRC_048_MZB_LO_58_22.04.2021,2021,4,22
259,259_2242021,22.4.2021,Baetidae,213,48,Greece,GRC_048_MZB_LO,GRC_048_MZB_LO_100,GRC_048_MZB_LO_58_22.04.2021,2021,4,22
259,259_2242021,22.4.2021,Brachycentridae,2,48,Greece,GRC_048_MZB_LO,GRC_048_MZB_LO_100,GRC_048_MZB_LO_58_22.04.2021,2021,4,22
259,259_2242021,22.4.2021,Calopterygidae,2,48,Greece,GRC_048_MZB_LO,GRC_048_MZB_LO_100,GRC_048_MZB_LO_58_22.04.2021,2021,4,22
259,259_2242021,22.4.2021,Ceratopogonidae,1,48,Greece,GRC_048_MZB_LO,GRC_048_MZB_LO_100,GRC_048_MZB_LO_58_22.04.2021,2021,4,22
259,259_2242021,22.4.2021,Chironomidae,30,48,Greece,GRC_048_MZB_LO,GRC_048_MZB_LO_100,GRC_048_MZB_LO_58_22.04.2021,2021,4,22
259,259_2242021,22.4.2021,Dytiscidae,1,48,Greece,GRC_048_MZB_LO,GRC_048_MZB_LO_100,GRC_048_MZB_LO_58_22.04.2021,2021,4,22
259,259_2242021,22.4.2021,Elmidae,4,48,Greece,GRC_048_MZB_LO,GRC_048_MZB_LO_100,GRC_048_MZB_LO_58_22.04.2021,2021,4,22
259,259_2242021,22.4.2021,Ephemerellidae,13,48,Greece,GRC_048_MZB_LO,GRC_048_MZB_LO_100,GRC_048_MZB_LO_58_22.04.2021,2021,4,22
259,259_2242021,22.4.2021,Gammaridae,129,48,Greece,GRC_048_MZB_LO,GRC_048_MZB_LO_100,GRC_048_MZB_LO_58_22.04.2021,2021,4,22
259,259_2242021,22.4.2021,Gyrinidae,1,48,Greece,GRC_048_MZB_LO,GRC_048_MZB_LO_100,GRC_048_MZB_LO_58_22.04.2021,2021,4,22
259,259_2242021,22.4.2021,Haliplidae,1,48,Greece,GRC_048_MZB_LO,GRC_048_MZB_LO_100,GRC_048_MZB_LO_58_22.04.2021,2021,4,22
259,259_2242021,22.4.2021,Helophoridae,8,48,Greece,GRC_048_MZB_LO,GRC_048_MZB_LO_100,GRC_048_MZB_LO_58_22.04.2021,2021,4,22
259,259_2242021,22.4.2021,Heptageniidae,1,48,Greece,GRC_048_MZB_LO,GRC_048_MZB_LO_100,GRC_048_MZB_LO_58_22.04.2021,2021,4,22
259,259_2242021,22.4.2021,Hydraenidae,9,48,Greece,GRC_048_MZB_LO,GRC_048_MZB_LO_100,GRC_048_MZB_LO_58_22.04.2021,2021,4,22
259,259_2242021,22.4.2021,Hydrobiidae,1,48,Greece,GRC_048_MZB_LO,GRC_048_MZB_LO_100,GRC_048_MZB_LO_58_22.04.2021,2021,4,22
259,259_2242021,22.4.2021,Leptoceridae,9,48,Greece,GRC_048_MZB_LO,GRC_048_MZB_LO_100,GRC_048_MZB_LO_58_22.04.2021,2021,4,22
259,259_2242021,22.4.2021,Phryganeidae,1,48,Greece,GRC_048_MZB_LO,GRC_048_MZB_LO_100,GRC_048_MZB_LO_58_22.04.2021,2021,4,22
259,259_2242021,22.4.2021,Planorbidae,1,48,Greece,GRC_048_MZB_LO,GRC_048_MZB_LO_100,GRC_048_MZB_LO_58_22.04.2021,2021,4,22
259,259_2242021,22.4.2021,Pleidae,1,48,Greece,GRC_048_MZB_LO,GRC_048_MZB_LO_100,GRC_048_MZB_LO_58_22.04.2021,2021,4,22
259,259_2242021,22.4.2021,Simuliidae,1,48,Greece,GRC_048_MZB_LO,GRC_048_MZB_LO_100,GRC_048_MZB_LO_58_22.04.2021,2021,4,22
259,259_2582021,25.8.2021,Athericidae,2,48,Greece,GRC_048_MZB_LO,GRC_048_MZB_LO_100,GRC_048_MZB_LO_69_25.08.2021,2021,8,25
259,259_2582021,25.8.2021,Atyidae,583,48,Greece,GRC_048_MZB_LO,GRC_048_MZB_LO_100,GRC_048_MZB_LO_69_25.08.2021,2021,8,25
259,259_2582021,25.8.2021,Baetidae,18,48,Greece,GRC_048_MZB_LO,GRC_048_MZB_LO_100,GRC_048_MZB_LO_69_25.08.2021,2021,8,25
259,259_2582021,25.8.2021,Caenidae,1,48,Greece,GRC_048_MZB_LO,GRC_048_MZB_LO_100,GRC_048_MZB_LO_69_25.08.2021,2021,8,25
259,259_2582021,25.8.2021,Calopterygidae,1,48,Greece,GRC_048_MZB_LO,GRC_048_MZB_LO_100,GRC_048_MZB_LO_69_25.08.2021,2021,8,25
259,259_2582021,25.8.2021,Chironomidae,48,48,Greece,GRC_048_MZB_LO,GRC_048_MZB_LO_100,GRC_048_MZB_LO_69_25.08.2021,2021,8,25
259,259_2582021,25.8.2021,Empididae,1,48,Greece,GRC_048_MZB_LO,GRC_048_MZB_LO_100,GRC_048_MZB_LO_69_25.08.2021,2021,8,25
259,259_2582021,25.8.2021,Gammaridae,7,48,Greece,GRC_048_MZB_LO,GRC_048_MZB_LO_100,GRC_048_MZB_LO_69_25.08.2021,2021,8,25
259,259_2582021,25.8.2021,Heptageniidae,1,48,Greece,GRC_048_MZB_LO,GRC_048_MZB_LO_100,GRC_048_MZB_LO_69_25.08.2021,2021,8,25
259,259_2582021,25.8.2021,Hydrachnidae,1,48,Greece,GRC_048_MZB_LO,GRC_048_MZB_LO_100,GRC_048_MZB_LO_69_25.08.2021,2021,8,25
259,259_2582021,25.8.2021,Hydroptilidae,14,48,Greece,GRC_048_MZB_LO,GRC_048_MZB_LO_100,GRC_048_MZB_LO_69_25.08.2021,2021,8,25
259,259_2582021,25.8.2021,Limoniidae,6,48,Greece,GRC_048_MZB_LO,GRC_048_MZB_LO_100,GRC_048_MZB_LO_69_25.08.2021,2021,8,25
259,259_2582021,25.8.2021,Psychomyidae,4,48,Greece,GRC_048_MZB_LO,GRC_048_MZB_LO_100,GRC_048_MZB_LO_69_25.08.2021,2021,8,25
259,259_842022,8.4.2022,Atyidae,111,48,Greece,GRC_048_MZB_LO,GRC_048_MZB_LO_100,GRC_048_MZB_LO_62_08.04.2022,2022,4,8
259,259_842022,8.4.2022,Baetidae,31,48,Greece,GRC_048_MZB_LO,GRC_048_MZB_LO_100,GRC_048_MZB_LO_62_08.04.2022,2022,4,8
259,259_842022,8.4.2022,Coenagrionidae,1,48,Greece,GRC_048_MZB_LO,GRC_048_MZB_LO_100,GRC_048_MZB_LO_62_08.04.2022,2022,4,8
259,259_842022,8.4.2022,Elmidae,2,48,Greece,GRC_048_MZB_LO,GRC_048_MZB_LO_100,GRC_048_MZB_LO_62_08.04.2022,2022,4,8
259,259_842022,8.4.2022,Gammaridae,6,48,Greece,GRC_048_MZB_LO,GRC_048_MZB_LO_100,GRC_048_MZB_LO_62_08.04.2022,2022,4,8
259,259_842022,8.4.2022,Oligochaeta,1,48,Greece,GRC_048_MZB_LO,GRC_048_MZB_LO_100,GRC_048_MZB_LO_62_08.04.2022,2022,4,8
259,259_842022,8.4.2022,Palaemonidae,6,48,Greece,GRC_048_MZB_LO,GRC_048_MZB_LO_100,GRC_048_MZB_LO_62_08.04.2022,2022,4,8
259,259_842022,8.4.2022,Polycentropodidae,1,48,Greece,GRC_048_MZB_LO,GRC_048_MZB_LO_100,GRC_048_MZB_LO_62_08.04.2022,2022,4,8
259,259_2762022,27.6.2022,Atyidae,20,48,Greece,GRC_048_MZB_LO,GRC_048_MZB_LO_100,GRC_048_MZB_LO_69_27.06.2022,2022,6,27
259,259_2762022,27.6.2022,Baetidae,76,48,Greece,GRC_048_MZB_LO,GRC_048_MZB_LO_100,GRC_048_MZB_LO_69_27.06.2022,2022,6,27
259,259_2762022,27.6.2022,Chironomidae,34,48,Greece,GRC_048_MZB_LO,GRC_048_MZB_LO_100,GRC_048_MZB_LO_69_27.06.2022,2022,6,27
259,259_2762022,27.6.2022,Corixidae,9,48,Greece,GRC_048_MZB_LO,GRC_048_MZB_LO_100,GRC_048_MZB_LO_69_27.06.2022,2022,6,27
259,259_2762022,27.6.2022,Dugesiidae,4,48,Greece,GRC_048_MZB_LO,GRC_048_MZB_LO_100,GRC_048_MZB_LO_69_27.06.2022,2022,6,27
259,259_2762022,27.6.2022,Elmidae,1,48,Greece,GRC_048_MZB_LO,GRC_048_MZB_LO_100,GRC_048_MZB_LO_69_27.06.2022,2022,6,27
259,259_2762022,27.6.2022,Gammaridae,11,48,Greece,GRC_048_MZB_LO,GRC_048_MZB_LO_100,GRC_048_MZB_LO_69_27.06.2022,2022,6,27
259,259_2762022,27.6.2022,Hydrachnidae,1,48,Greece,GRC_048_MZB_LO,GRC_048_MZB_LO_100,GRC_048_MZB_LO_69_27.06.2022,2022,6,27
259,259_2762022,27.6.2022,Hydraenidae,3,48,Greece,GRC_048_MZB_LO,GRC_048_MZB_LO_100,GRC_048_MZB_LO_69_27.06.2022,2022,6,27
259,259_2762022,27.6.2022,Hydrobiidae,3,48,Greece,GRC_048_MZB_LO,GRC_048_MZB_LO_100,GRC_048_MZB_LO_69_27.06.2022,2022,6,27
259,259_2762022,27.6.2022,Hydroptilidae,2,48,Greece,GRC_048_MZB_LO,GRC_048_MZB_LO_100,GRC_048_MZB_LO_69_27.06.2022,2022,6,27
259,259_2762022,27.6.2022,Oligochaeta,239,48,Greece,GRC_048_MZB_LO,GRC_048_MZB_LO_100,GRC_048_MZB_LO_69_27.06.2022,2022,6,27
259,259_2762022,27.6.2022,Sphaeriidae,2,48,Greece,GRC_048_MZB_LO,GRC_048_MZB_LO_100,GRC_048_MZB_LO_69_27.06.2022,2022,6,27
259,259_542023,5.4.2023,Asellidae,1,48,Greece,GRC_048_MZB_LO,GRC_048_MZB_LO_100,GRC_048_MZB_LO_68_05.04.2023,2023,4,5
259,259_542023,5.4.2023,Atyidae,99,48,Greece,GRC_048_MZB_LO,GRC_048_MZB_LO_100,GRC_048_MZB_LO_68_05.04.2023,2023,4,5
259,259_542023,5.4.2023,Baetidae,23,48,Greece,GRC_048_MZB_LO,GRC_048_MZB_LO_100,GRC_048_MZB_LO_68_05.04.2023,2023,4,5
259,259_542023,5.4.2023,Caenidae,2,48,Greece,GRC_048_MZB_LO,GRC_048_MZB_LO_100,GRC_048_MZB_LO_68_05.04.2023,2023,4,5
259,259_542023,5.4.2023,Chironomidae,6,48,Greece,GRC_048_MZB_LO,GRC_048_MZB_LO_100,GRC_048_MZB_LO_68_05.04.2023,2023,4,5
259,259_542023,5.4.2023,Curculionidae,1,48,Greece,GRC_048_MZB_LO,GRC_048_MZB_LO_100,GRC_048_MZB_LO_68_05.04.2023,2023,4,5
259,259_542023,5.4.2023,Dytiscidae,1,48,Greece,GRC_048_MZB_LO,GRC_048_MZB_LO_100,GRC_048_MZB_LO_68_05.04.2023,2023,4,5
259,259_542023,5.4.2023,Elmidae,2,48,Greece,GRC_048_MZB_LO,GRC_048_MZB_LO_100,GRC_048_MZB_LO_68_05.04.2023,2023,4,5
259,259_542023,5.4.2023,Ephemerellidae,1,48,Greece,GRC_048_MZB_LO,GRC_048_MZB_LO_100,GRC_048_MZB_LO_68_05.04.2023,2023,4,5
259,259_542023,5.4.2023,Gammaridae,68,48,Greece,GRC_048_MZB_LO,GRC_048_MZB_LO_100,GRC_048_MZB_LO_68_05.04.2023,2023,4,5
259,259_542023,5.4.2023,Haliplidae,1,48,Greece,GRC_048_MZB_LO,GRC_048_MZB_LO_100,GRC_048_MZB_LO_68_05.04.2023,2023,4,5
259,259_542023,5.4.2023,Helophoridae,3,48,Greece,GRC_048_MZB_LO,GRC_048_MZB_LO_100,GRC_048_MZB_LO_68_05.04.2023,2023,4,5
259,259_542023,5.4.2023,Hydraenidae,3,48,Greece,GRC_048_MZB_LO,GRC_048_MZB_LO_100,GRC_048_MZB_LO_68_05.04.2023,2023,4,5
259,259_542023,5.4.2023,Lepidoptera,1,48,Greece,GRC_048_MZB_LO,GRC_048_MZB_LO_100,GRC_048_MZB_LO_68_05.04.2023,2023,4,5
259,259_542023,5.4.2023,Leptoceridae,4,48,Greece,GRC_048_MZB_LO,GRC_048_MZB_LO_100,GRC_048_MZB_LO_68_05.04.2023,2023,4,5
259,259_542023,5.4.2023,Palaemonidae,6,48,Greece,GRC_048_MZB_LO,GRC_048_MZB_LO_100,GRC_048_MZB_LO_68_05.04.2023,2023,4,5
259,259_542023,5.4.2023,Psychomyidae,1,48,Greece,GRC_048_MZB_LO,GRC_048_MZB_LO_100,GRC_048_MZB_LO_68_05.04.2023,2023,4,5
259,259_542023,5.4.2023,Simuliidae,5,48,Greece,GRC_048_MZB_LO,GRC_048_MZB_LO_100,GRC_048_MZB_LO_68_05.04.2023,2023,4,5
259,259_482023,4.8.2023,Atyidae,807,48,Greece,GRC_048_MZB_LO,GRC_048_MZB_LO_100,GRC_048_MZB_LO_100_04.08.2023,2023,8,4
259,259_482023,4.8.2023,Baetidae,36,48,Greece,GRC_048_MZB_LO,GRC_048_MZB_LO_100,GRC_048_MZB_LO_100_04.08.2023,2023,8,4
259,259_482023,4.8.2023,Caenidae,1,48,Greece,GRC_048_MZB_LO,GRC_048_MZB_LO_100,GRC_048_MZB_LO_100_04.08.2023,2023,8,4
259,259_482023,4.8.2023,Calopterygidae,1,48,Greece,GRC_048_MZB_LO,GRC_048_MZB_LO_100,GRC_048_MZB_LO_100_04.08.2023,2023,8,4
259,259_482023,4.8.2023,Chironomidae,16,48,Greece,GRC_048_MZB_LO,GRC_048_MZB_LO_100,GRC_048_MZB_LO_100_04.08.2023,2023,8,4
259,259_482023,4.8.2023,Gammaridae,147,48,Greece,GRC_048_MZB_LO,GRC_048_MZB_LO_100,GRC_048_MZB_LO_100_04.08.2023,2023,8,4
259,259_482023,4.8.2023,Hydrochidae,1,48,Greece,GRC_048_MZB_LO,GRC_048_MZB_LO_100,GRC_048_MZB_LO_100_04.08.2023,2023,8,4
259,259_482023,4.8.2023,Hydroptilidae,1,48,Greece,GRC_048_MZB_LO,GRC_048_MZB_LO_100,GRC_048_MZB_LO_100_04.08.2023,2023,8,4
259,259_482023,4.8.2023,Physidae,2,48,Greece,GRC_048_MZB_LO,GRC_048_MZB_LO_100,GRC_048_MZB_LO_100_04.08.2023,2023,8,4
260,260_342013,3.4.2013,Ancylidae,410,48,Greece,GRC_048_MZB_LO,GRC_048_MZB_LO_101,GRC_048_MZB_LO_89_03.04.2013,2013,4,3
260,260_342013,3.4.2013,Baetidae,230,48,Greece,GRC_048_MZB_LO,GRC_048_MZB_LO_101,GRC_048_MZB_LO_89_03.04.2013,2013,4,3
260,260_342013,3.4.2013,Caenidae,4,48,Greece,GRC_048_MZB_LO,GRC_048_MZB_LO_101,GRC_048_MZB_LO_89_03.04.2013,2013,4,3
260,260_342013,3.4.2013,Ceratopogonidae,92,48,Greece,GRC_048_MZB_LO,GRC_048_MZB_LO_101,GRC_048_MZB_LO_89_03.04.2013,2013,4,3
260,260_342013,3.4.2013,Chironomidae,145,48,Greece,GRC_048_MZB_LO,GRC_048_MZB_LO_101,GRC_048_MZB_LO_89_03.04.2013,2013,4,3
260,260_342013,3.4.2013,Dixidae,90,48,Greece,GRC_048_MZB_LO,GRC_048_MZB_LO_101,GRC_048_MZB_LO_89_03.04.2013,2013,4,3
260,260_342013,3.4.2013,Dytiscidae,2,48,Greece,GRC_048_MZB_LO,GRC_048_MZB_LO_101,GRC_048_MZB_LO_89_03.04.2013,2013,4,3
260,260_342013,3.4.2013,Elmidae,3,48,Greece,GRC_048_MZB_LO,GRC_048_MZB_LO_101,GRC_048_MZB_LO_89_03.04.2013,2013,4,3
260,260_342013,3.4.2013,Empididae,4,48,Greece,GRC_048_MZB_LO,GRC_048_MZB_LO_101,GRC_048_MZB_LO_89_03.04.2013,2013,4,3
260,260_342013,3.4.2013,Hydropsychidae,1,48,Greece,GRC_048_MZB_LO,GRC_048_MZB_LO_101,GRC_048_MZB_LO_89_03.04.2013,2013,4,3
260,260_342013,3.4.2013,Hydroptilidae,1,48,Greece,GRC_048_MZB_LO,GRC_048_MZB_LO_101,GRC_048_MZB_LO_89_03.04.2013,2013,4,3
260,260_342013,3.4.2013,Leptoceridae,1,48,Greece,GRC_048_MZB_LO,GRC_048_MZB_LO_101,GRC_048_MZB_LO_89_03.04.2013,2013,4,3
260,260_342013,3.4.2013,Libellulidae,1,48,Greece,GRC_048_MZB_LO,GRC_048_MZB_LO_101,GRC_048_MZB_LO_89_03.04.2013,2013,4,3
260,260_342013,3.4.2013,Limnephilidae,15,48,Greece,GRC_048_MZB_LO,GRC_048_MZB_LO_101,GRC_048_MZB_LO_89_03.04.2013,2013,4,3
260,260_342013,3.4.2013,Lymnaeidae,60,48,Greece,GRC_048_MZB_LO,GRC_048_MZB_LO_101,GRC_048_MZB_LO_89_03.04.2013,2013,4,3
260,260_342013,3.4.2013,Oligochaeta,15,48,Greece,GRC_048_MZB_LO,GRC_048_MZB_LO_101,GRC_048_MZB_LO_89_03.04.2013,2013,4,3
260,260_342013,3.4.2013,Perlodidae,1,48,Greece,GRC_048_MZB_LO,GRC_048_MZB_LO_101,GRC_048_MZB_LO_89_03.04.2013,2013,4,3
260,260_342013,3.4.2013,Polycentropodidae,5,48,Greece,GRC_048_MZB_LO,GRC_048_MZB_LO_101,GRC_048_MZB_LO_89_03.04.2013,2013,4,3
260,260_342013,3.4.2013,Psychodidae,2,48,Greece,GRC_048_MZB_LO,GRC_048_MZB_LO_101,GRC_048_MZB_LO_89_03.04.2013,2013,4,3
260,260_342013,3.4.2013,Simuliidae,214,48,Greece,GRC_048_MZB_LO,GRC_048_MZB_LO_101,GRC_048_MZB_LO_89_03.04.2013,2013,4,3
260,260_342013,3.4.2013,Sphaeromatidae,2,48,Greece,GRC_048_MZB_LO,GRC_048_MZB_LO_101,GRC_048_MZB_LO_89_03.04.2013,2013,4,3
260,260_342013,3.4.2013,Stratiomyidae,2,48,Greece,GRC_048_MZB_LO,GRC_048_MZB_LO_101,GRC_048_MZB_LO_89_03.04.2013,2013,4,3
260,260_342013,3.4.2013,Tabanidae,1,48,Greece,GRC_048_MZB_LO,GRC_048_MZB_LO_101,GRC_048_MZB_LO_89_03.04.2013,2013,4,3
260,260_342013,3.4.2013,Taeniopterygidae,22,48,Greece,GRC_048_MZB_LO,GRC_048_MZB_LO_101,GRC_048_MZB_LO_89_03.04.2013,2013,4,3
260,260_342013,3.4.2013,Tipulidae,1,48,Greece,GRC_048_MZB_LO,GRC_048_MZB_LO_101,GRC_048_MZB_LO_89_03.04.2013,2013,4,3
260,260_1952018,19.5.2018,Athericidae,5,48,Greece,GRC_048_MZB_LO,GRC_048_MZB_LO_101,GRC_048_MZB_LO_77_19.05.2018,2018,5,19
260,260_1952018,19.5.2018,Baetidae,4,48,Greece,GRC_048_MZB_LO,GRC_048_MZB_LO_101,GRC_048_MZB_LO_77_19.05.2018,2018,5,19
260,260_1952018,19.5.2018,Ceratopogonidae,8,48,Greece,GRC_048_MZB_LO,GRC_048_MZB_LO_101,GRC_048_MZB_LO_77_19.05.2018,2018,5,19
260,260_1952018,19.5.2018,Chironomidae,28,48,Greece,GRC_048_MZB_LO,GRC_048_MZB_LO_101,GRC_048_MZB_LO_77_19.05.2018,2018,5,19
260,260_1952018,19.5.2018,Dytiscidae,6,48,Greece,GRC_048_MZB_LO,GRC_048_MZB_LO_101,GRC_048_MZB_LO_77_19.05.2018,2018,5,19
260,260_1952018,19.5.2018,Elmidae,22,48,Greece,GRC_048_MZB_LO,GRC_048_MZB_LO_101,GRC_048_MZB_LO_77_19.05.2018,2018,5,19
260,260_1952018,19.5.2018,Euphaeidae,5,48,Greece,GRC_048_MZB_LO,GRC_048_MZB_LO_101,GRC_048_MZB_LO_77_19.05.2018,2018,5,19
260,260_1952018,19.5.2018,Gerridae,5,48,Greece,GRC_048_MZB_LO,GRC_048_MZB_LO_101,GRC_048_MZB_LO_77_19.05.2018,2018,5,19
260,260_1952018,19.5.2018,Gomphidae,5,48,Greece,GRC_048_MZB_LO,GRC_048_MZB_LO_101,GRC_048_MZB_LO_77_19.05.2018,2018,5,19
260,260_1952018,19.5.2018,Hydrachnidae,1,48,Greece,GRC_048_MZB_LO,GRC_048_MZB_LO_101,GRC_048_MZB_LO_77_19.05.2018,2018,5,19
260,260_1952018,19.5.2018,Hydrophilidae,11,48,Greece,GRC_048_MZB_LO,GRC_048_MZB_LO_101,GRC_048_MZB_LO_77_19.05.2018,2018,5,19
260,260_1952018,19.5.2018,Hydropsychidae,51,48,Greece,GRC_048_MZB_LO,GRC_048_MZB_LO_101,GRC_048_MZB_LO_77_19.05.2018,2018,5,19
260,260_1952018,19.5.2018,Leptoceridae,19,48,Greece,GRC_048_MZB_LO,GRC_048_MZB_LO_101,GRC_048_MZB_LO_77_19.05.2018,2018,5,19
260,260_1952018,19.5.2018,Lestidae,122,48,Greece,GRC_048_MZB_LO,GRC_048_MZB_LO_101,GRC_048_MZB_LO_77_19.05.2018,2018,5,19
260,260_1952018,19.5.2018,Libellulidae,1,48,Greece,GRC_048_MZB_LO,GRC_048_MZB_LO_101,GRC_048_MZB_LO_77_19.05.2018,2018,5,19
260,260_1952018,19.5.2018,Limoniidae,3,48,Greece,GRC_048_MZB_LO,GRC_048_MZB_LO_101,GRC_048_MZB_LO_77_19.05.2018,2018,5,19
260,260_1952018,19.5.2018,Notonectidae,1,48,Greece,GRC_048_MZB_LO,GRC_048_MZB_LO_101,GRC_048_MZB_LO_77_19.05.2018,2018,5,19
260,260_1952018,19.5.2018,Psychodidae,1,48,Greece,GRC_048_MZB_LO,GRC_048_MZB_LO_101,GRC_048_MZB_LO_77_19.05.2018,2018,5,19
260,260_1952018,19.5.2018,Simuliidae,7,48,Greece,GRC_048_MZB_LO,GRC_048_MZB_LO_101,GRC_048_MZB_LO_77_19.05.2018,2018,5,19
260,260_1952018,19.5.2018,Tabanidae,2,48,Greece,GRC_048_MZB_LO,GRC_048_MZB_LO_101,GRC_048_MZB_LO_77_19.05.2018,2018,5,19
260,260_2852021,28.5.2021,Chironomidae,759,48,Greece,GRC_048_MZB_LO,GRC_048_MZB_LO_101,GRC_048_MZB_LO_20_28.05.2021,2021,5,28
260,260_2852021,28.5.2021,Dytiscidae,10,48,Greece,GRC_048_MZB_LO,GRC_048_MZB_LO_101,GRC_048_MZB_LO_20_28.05.2021,2021,5,28
260,260_2852021,28.5.2021,Elmidae,2,48,Greece,GRC_048_MZB_LO,GRC_048_MZB_LO_101,GRC_048_MZB_LO_20_28.05.2021,2021,5,28
260,260_2852021,28.5.2021,Gerridae,1,48,Greece,GRC_048_MZB_LO,GRC_048_MZB_LO_101,GRC_048_MZB_LO_20_28.05.2021,2021,5,28
260,260_2852021,28.5.2021,Gomphidae,1,48,Greece,GRC_048_MZB_LO,GRC_048_MZB_LO_101,GRC_048_MZB_LO_20_28.05.2021,2021,5,28
260,260_2852021,28.5.2021,Hydrophilidae,95,48,Greece,GRC_048_MZB_LO,GRC_048_MZB_LO_101,GRC_048_MZB_LO_20_28.05.2021,2021,5,28
260,260_2852021,28.5.2021,Hydropsychidae,7,48,Greece,GRC_048_MZB_LO,GRC_048_MZB_LO_101,GRC_048_MZB_LO_20_28.05.2021,2021,5,28
260,260_2852021,28.5.2021,Leptoceridae,1,48,Greece,GRC_048_MZB_LO,GRC_048_MZB_LO_101,GRC_048_MZB_LO_20_28.05.2021,2021,5,28
260,260_2852021,28.5.2021,Tabanidae,4,48,Greece,GRC_048_MZB_LO,GRC_048_MZB_LO_101,GRC_048_MZB_LO_20_28.05.2021,2021,5,28
260,260_2852021,28.5.2021,Tipulidae,3,48,Greece,GRC_048_MZB_LO,GRC_048_MZB_LO_101,GRC_048_MZB_LO_20_28.05.2021,2021,5,28
260,260_1342022,13.4.2022,Aphididae,1,48,Greece,GRC_048_MZB_LO,GRC_048_MZB_LO_101,GRC_048_MZB_LO_37_13.04.2022,2022,4,13
260,260_1342022,13.4.2022,Ceratopogonidae,3,48,Greece,GRC_048_MZB_LO,GRC_048_MZB_LO_101,GRC_048_MZB_LO_37_13.04.2022,2022,4,13
260,260_1342022,13.4.2022,Chironomidae,222,48,Greece,GRC_048_MZB_LO,GRC_048_MZB_LO_101,GRC_048_MZB_LO_37_13.04.2022,2022,4,13
260,260_1342022,13.4.2022,Dytiscidae,7,48,Greece,GRC_048_MZB_LO,GRC_048_MZB_LO_101,GRC_048_MZB_LO_37_13.04.2022,2022,4,13
260,260_1342022,13.4.2022,Hydrophilidae,1,48,Greece,GRC_048_MZB_LO,GRC_048_MZB_LO_101,GRC_048_MZB_LO_37_13.04.2022,2022,4,13
260,260_1342022,13.4.2022,Polycentropodidae,1,48,Greece,GRC_048_MZB_LO,GRC_048_MZB_LO_101,GRC_048_MZB_LO_37_13.04.2022,2022,4,13
260,260_2752023,27.5.2023,Baetidae,376,48,Greece,GRC_048_MZB_LO,GRC_048_MZB_LO_101,GRC_048_MZB_LO_20_27.05.2023,2023,5,27
260,260_2752023,27.5.2023,Caenidae,13,48,Greece,GRC_048_MZB_LO,GRC_048_MZB_LO_101,GRC_048_MZB_LO_20_27.05.2023,2023,5,27
260,260_2752023,27.5.2023,Ceratopogonidae,6,48,Greece,GRC_048_MZB_LO,GRC_048_MZB_LO_101,GRC_048_MZB_LO_20_27.05.2023,2023,5,27
260,260_2752023,27.5.2023,Chironomidae,66,48,Greece,GRC_048_MZB_LO,GRC_048_MZB_LO_101,GRC_048_MZB_LO_20_27.05.2023,2023,5,27
260,260_2752023,27.5.2023,Dryopidae,1,48,Greece,GRC_048_MZB_LO,GRC_048_MZB_LO_101,GRC_048_MZB_LO_20_27.05.2023,2023,5,27
260,260_2752023,27.5.2023,Dytiscidae,5,48,Greece,GRC_048_MZB_LO,GRC_048_MZB_LO_101,GRC_048_MZB_LO_20_27.05.2023,2023,5,27
260,260_2752023,27.5.2023,Elmidae,23,48,Greece,GRC_048_MZB_LO,GRC_048_MZB_LO_101,GRC_048_MZB_LO_20_27.05.2023,2023,5,27
260,260_2752023,27.5.2023,Empididae,3,48,Greece,GRC_048_MZB_LO,GRC_048_MZB_LO_101,GRC_048_MZB_LO_20_27.05.2023,2023,5,27
260,260_2752023,27.5.2023,Ephemerellidae,1,48,Greece,GRC_048_MZB_LO,GRC_048_MZB_LO_101,GRC_048_MZB_LO_20_27.05.2023,2023,5,27
260,260_2752023,27.5.2023,Gomphidae,1,48,Greece,GRC_048_MZB_LO,GRC_048_MZB_LO_101,GRC_048_MZB_LO_20_27.05.2023,2023,5,27
260,260_2752023,27.5.2023,Hydrachnidae,4,48,Greece,GRC_048_MZB_LO,GRC_048_MZB_LO_101,GRC_048_MZB_LO_20_27.05.2023,2023,5,27
260,260_2752023,27.5.2023,Hydrophilidae,22,48,Greece,GRC_048_MZB_LO,GRC_048_MZB_LO_101,GRC_048_MZB_LO_20_27.05.2023,2023,5,27
260,260_2752023,27.5.2023,Hydropsychidae,146,48,Greece,GRC_048_MZB_LO,GRC_048_MZB_LO_101,GRC_048_MZB_LO_20_27.05.2023,2023,5,27
260,260_2752023,27.5.2023,Leuctridae,160,48,Greece,GRC_048_MZB_LO,GRC_048_MZB_LO_101,GRC_048_MZB_LO_20_27.05.2023,2023,5,27
260,260_2752023,27.5.2023,Limoniidae,1,48,Greece,GRC_048_MZB_LO,GRC_048_MZB_LO_101,GRC_048_MZB_LO_20_27.05.2023,2023,5,27
260,260_2752023,27.5.2023,Oligochaeta,1,48,Greece,GRC_048_MZB_LO,GRC_048_MZB_LO_101,GRC_048_MZB_LO_20_27.05.2023,2023,5,27
260,260_2752023,27.5.2023,Rhyacophilidae,1,48,Greece,GRC_048_MZB_LO,GRC_048_MZB_LO_101,GRC_048_MZB_LO_20_27.05.2023,2023,5,27
260,260_2752023,27.5.2023,Simuliidae,7,48,Greece,GRC_048_MZB_LO,GRC_048_MZB_LO_101,GRC_048_MZB_LO_20_27.05.2023,2023,5,27
260,260_2752023,27.5.2023,Tipulidae,1,48,Greece,GRC_048_MZB_LO,GRC_048_MZB_LO_101,GRC_048_MZB_LO_20_27.05.2023,2023,5,27
261,261_672012,6.7.2012,Acroloxidae,1,48,Greece,GRC_048_MZB_LO,GRC_048_MZB_LO_102,GRC_048_MZB_LO_163_06.07.2012,2012,7,6
261,261_672012,6.7.2012,Baetidae,4,48,Greece,GRC_048_MZB_LO,GRC_048_MZB_LO_102,GRC_048_MZB_LO_163_06.07.2012,2012,7,6
261,261_672012,6.7.2012,Caenidae,43,48,Greece,GRC_048_MZB_LO,GRC_048_MZB_LO_102,GRC_048_MZB_LO_163_06.07.2012,2012,7,6
261,261_672012,6.7.2012,Ceratopogonidae,23,48,Greece,GRC_048_MZB_LO,GRC_048_MZB_LO_102,GRC_048_MZB_LO_163_06.07.2012,2012,7,6
261,261_672012,6.7.2012,Chironomidae,123,48,Greece,GRC_048_MZB_LO,GRC_048_MZB_LO_102,GRC_048_MZB_LO_163_06.07.2012,2012,7,6
261,261_672012,6.7.2012,Coenagrionidae,27,48,Greece,GRC_048_MZB_LO,GRC_048_MZB_LO_102,GRC_048_MZB_LO_163_06.07.2012,2012,7,6
261,261_672012,6.7.2012,Corduliidae,2,48,Greece,GRC_048_MZB_LO,GRC_048_MZB_LO_102,GRC_048_MZB_LO_163_06.07.2012,2012,7,6
261,261_672012,6.7.2012,Corixidae,3,48,Greece,GRC_048_MZB_LO,GRC_048_MZB_LO_102,GRC_048_MZB_LO_163_06.07.2012,2012,7,6
261,261_672012,6.7.2012,Dytiscidae,2,48,Greece,GRC_048_MZB_LO,GRC_048_MZB_LO_102,GRC_048_MZB_LO_163_06.07.2012,2012,7,6
261,261_672012,6.7.2012,Ephydridae,1,48,Greece,GRC_048_MZB_LO,GRC_048_MZB_LO_102,GRC_048_MZB_LO_163_06.07.2012,2012,7,6
261,261_672012,6.7.2012,Hydrophilidae,1,48,Greece,GRC_048_MZB_LO,GRC_048_MZB_LO_102,GRC_048_MZB_LO_163_06.07.2012,2012,7,6
261,261_672012,6.7.2012,Hydroptilidae,1,48,Greece,GRC_048_MZB_LO,GRC_048_MZB_LO_102,GRC_048_MZB_LO_163_06.07.2012,2012,7,6
261,261_672012,6.7.2012,Libellulidae,7,48,Greece,GRC_048_MZB_LO,GRC_048_MZB_LO_102,GRC_048_MZB_LO_163_06.07.2012,2012,7,6
261,261_672012,6.7.2012,Lymnaeidae,8,48,Greece,GRC_048_MZB_LO,GRC_048_MZB_LO_102,GRC_048_MZB_LO_163_06.07.2012,2012,7,6
261,261_672012,6.7.2012,Physidae,17,48,Greece,GRC_048_MZB_LO,GRC_048_MZB_LO_102,GRC_048_MZB_LO_163_06.07.2012,2012,7,6
261,261_672012,6.7.2012,Planorbidae,8,48,Greece,GRC_048_MZB_LO,GRC_048_MZB_LO_102,GRC_048_MZB_LO_163_06.07.2012,2012,7,6
261,261_672012,6.7.2012,Stratiomyidae,2,48,Greece,GRC_048_MZB_LO,GRC_048_MZB_LO_102,GRC_048_MZB_LO_163_06.07.2012,2012,7,6
261,261_672012,6.7.2012,Valvatidae,19,48,Greece,GRC_048_MZB_LO,GRC_048_MZB_LO_102,GRC_048_MZB_LO_163_06.07.2012,2012,7,6
261,261_3042013,30.4.2013,Aphididae,3,48,Greece,GRC_048_MZB_LO,GRC_048_MZB_LO_102,GRC_048_MZB_LO_36_30.04.2013,2013,4,30
261,261_3042013,30.4.2013,Araneae,1,48,Greece,GRC_048_MZB_LO,GRC_048_MZB_LO_102,GRC_048_MZB_LO_36_30.04.2013,2013,4,30
261,261_3042013,30.4.2013,Chironomidae,91,48,Greece,GRC_048_MZB_LO,GRC_048_MZB_LO_102,GRC_048_MZB_LO_36_30.04.2013,2013,4,30
261,261_3042013,30.4.2013,Coenagrionidae,2,48,Greece,GRC_048_MZB_LO,GRC_048_MZB_LO_102,GRC_048_MZB_LO_36_30.04.2013,2013,4,30
261,261_3042013,30.4.2013,Helophoridae,1,48,Greece,GRC_048_MZB_LO,GRC_048_MZB_LO_102,GRC_048_MZB_LO_36_30.04.2013,2013,4,30
261,261_3042013,30.4.2013,Lepidoptera,1,48,Greece,GRC_048_MZB_LO,GRC_048_MZB_LO_102,GRC_048_MZB_LO_36_30.04.2013,2013,4,30
261,261_3042013,30.4.2013,Oligochaeta,6,48,Greece,GRC_048_MZB_LO,GRC_048_MZB_LO_102,GRC_048_MZB_LO_36_30.04.2013,2013,4,30
261,261_3042013,30.4.2013,Physidae,1,48,Greece,GRC_048_MZB_LO,GRC_048_MZB_LO_102,GRC_048_MZB_LO_36_30.04.2013,2013,4,30
261,261_2772013,27.7.2013,Baetidae,11,48,Greece,GRC_048_MZB_LO,GRC_048_MZB_LO_102,GRC_048_MZB_LO_62_27.07.2013,2013,7,27
261,261_2772013,27.7.2013,Chironomidae,97,48,Greece,GRC_048_MZB_LO,GRC_048_MZB_LO_102,GRC_048_MZB_LO_62_27.07.2013,2013,7,27
261,261_2772013,27.7.2013,Dryopidae,1,48,Greece,GRC_048_MZB_LO,GRC_048_MZB_LO_102,GRC_048_MZB_LO_62_27.07.2013,2013,7,27
261,261_2772013,27.7.2013,Hydrobiidae,2,48,Greece,GRC_048_MZB_LO,GRC_048_MZB_LO_102,GRC_048_MZB_LO_62_27.07.2013,2013,7,27
261,261_2772013,27.7.2013,Oligochaeta,4,48,Greece,GRC_048_MZB_LO,GRC_048_MZB_LO_102,GRC_048_MZB_LO_62_27.07.2013,2013,7,27
261,261_2772013,27.7.2013,Physidae,7,48,Greece,GRC_048_MZB_LO,GRC_048_MZB_LO_102,GRC_048_MZB_LO_62_27.07.2013,2013,7,27
261,261_2772013,27.7.2013,Psychodidae,1,48,Greece,GRC_048_MZB_LO,GRC_048_MZB_LO_102,GRC_048_MZB_LO_62_27.07.2013,2013,7,27
261,261_2772013,27.7.2013,Simuliidae,1,48,Greece,GRC_048_MZB_LO,GRC_048_MZB_LO_102,GRC_048_MZB_LO_62_27.07.2013,2013,7,27
261,261_642014,6.4.2014,Chironomidae,416,48,Greece,GRC_048_MZB_LO,GRC_048_MZB_LO_102,GRC_048_MZB_LO_96_06.04.2014,2014,4,6
261,261_642014,6.4.2014,Erpobdellidae,1,48,Greece,GRC_048_MZB_LO,GRC_048_MZB_LO_102,GRC_048_MZB_LO_96_06.04.2014,2014,4,6
261,261_642014,6.4.2014,Oligochaeta,76,48,Greece,GRC_048_MZB_LO,GRC_048_MZB_LO_102,GRC_048_MZB_LO_96_06.04.2014,2014,4,6
261,261_2882014,28.8.2014,Aeshnidae,3,48,Greece,GRC_048_MZB_LO,GRC_048_MZB_LO_102,GRC_048_MZB_LO_102_28.08.2014,2014,8,28
261,261_2882014,28.8.2014,Baetidae,7,48,Greece,GRC_048_MZB_LO,GRC_048_MZB_LO_102,GRC_048_MZB_LO_102_28.08.2014,2014,8,28
