"Unique.ID","Samp.ID","Sampling.date","year","month","day","ACROLOXUS LACUSTRIS","AESHNA GRANDIS","AFGHANURUS JOERNENSIS","AGRAYLEA SP.","ALLOTRICHIA SP.","AMELETUS SP.","AMPHINEMURA SP.","ANCYLUS SP.","ANISOPTERA GEN. SP.","APATANIA SP.","APHELOCHEIRUS AESTIVALIS","ARANEAE GEN. SP.","ARCYNOPTERYX COMPACTA","ASELLUS AQUATICUS","ASTACUS SP.","ATHERICIDAE GEN. SP.","BAETIDAE GEN. SP.","BATHYOMPHALUS CONTORTUS","BERAEODES MINUTUS","BITHYNIIDAE GEN. SP.","BRACHYCENTRUS SUBNUBILUS","BRYCHIUS SP.","CAENIS SP.","CALOPTERYGIDAE GEN. SP.","CAPNIIDAE GEN. SP.","CERATOPOGONIDAE GEN. SP.","CHAOBORUS FLAVICANS","CHAOBORUS OBSCURIPES","CHIMARRA MARGINATA","CHIRONOMIDAE GEN. SP.","CHLOROPERLIDAE GEN. SP.","COENAGRIONIDAE GEN. SP.","COLEOPTERA GEN. SP.","CORDULEGASTER SP.","CORDULIIDAE GEN. SP.","CORIXIDAE GEN. SP.","CURCULIONIDAE GEN. SP.","DENDROCOELUM LACTEUM","DICRANOTA SP.","DINA LINEATA","DIPTERA GEN. SP.","DIURA SP.","DIXIDAE GEN. SP.","DONACIA SP.","DYTISCIDAE GEN. SP.","ECNOMUS TENELLUS","ELMIDAE GEN. SP.","ELOPHILA SP.","EMPIDIDAE GEN. SP.","EPHEMERA SP.","EPHEMERELLA SP.","EPHYDRIDAE GEN. SP.","ERPOBDELLA SP.","GAMMARIDAE GEN. SP.","GERRIDAE GEN. SP.","GLOSSIPHONIA SP.","GLOSSOSOMATIDAE GEN. SP.","GOERA PILOSA","GOMPHIDAE GEN. SP.","GYRAULUS SP.","GYRINIDAE GEN. SP.","HALIPLUS SP.","HELOBDELLA STAGNALIS","HELOPHORUS SP.","HEMICLEPSIS MARGINATA","HEPTAGENIA SP.","HETEROPTERA GEN. SP.","HYDRA SP.","HYDRACHNIDIA GEN. SP.","HYDRAENIDAE GEN. SP.","HYDROBIUS SP.","HYDROCHUS SP.","HYDROPHILUS SP.","HYDROPSYCHIDAE GEN. SP.","HYDROPTILA SP.","HYDROZOA GEN. SP.","ISOGENUS NUBECULA","ISOPERLA SP.","ITHYTRICHIA SP.","KAGERONIA FUSCOGRISEA","LEPIDOPTERA GEN. SP.","LEPIDOSTOMA HIRTUM","LEPTOCERIDAE GEN. SP.","LEPTOPHLEBIIDAE GEN. SP.","LEUCTRA SP.","LIMNEPHILIDAE GEN. SP.","LIMONIIDAE GEN. SP.","LYMNAEIDAE GEN. SP.","MEGALOPTERA GEN. SP.","MERMITHIDAE GEN. SP.","MESOVELIA SP.","METRETOPUS BOREALIS","MICRASEMA SP.","MOLANNA ALBICANS","MOLANNA ANGUSTATA","MOLANNODES TINCTUS","MUSCIDAE GEN. SP.","NEMATODA GEN. SP.","NEMATOMORPHA GEN. SP.","NEMOURA SP.","NEMURELLA PICTETII","NEPA CINEREA","NOTONECTA GLAUCA SSP.","NYMPHULA SP.","OLIGOCHAETA GEN. SP.","OXYETHIRA SP.","PHRYGANEIDAE GEN. SP.","PHYSA FONTINALIS","PLANARIIDAE GEN. SP.","PLANORBARIUS CORNEUS","PLATYCNEMIS PENNIPES","PLECOPTERA GEN. SP.","POLYCENTROPODIDAE GEN. SP.","POTAMANTHUS LUTEUS","PROTONEMURA SP.","PSYCHODIDAE GEN. SP.","PSYCHOMYIIDAE GEN. SP.","PTYCHOPTERIDAE GEN. SP.","RHABDIOPTERYX ACUMINATA","RHYACOPHILIDAE GEN. SP.","SCIRTIDAE GEN. SP.","SERICOSTOMATIDAE GEN. SP.","SERRATELLA IGNITA","SIALIDAE GEN. SP.","SILO PALLIPES","SIMULIIDAE GEN. SP.","SISYRA SP.","SPHAERIIDAE GEN. SP.","TABANIDAE GEN. SP.","TAENIOPTERYX NEBULOSA","THEROMYZON TESSULATUM","TIPULIDAE GEN. SP.","TRICHOPTERA GEN. SP.","TRICLADIDA GEN. SP.","TURBELLARIA GEN. SP.","UNIONIDAE GEN. SP.","VALVATA SP.","ZYGOPTERA GEN. SP."
"FIN_004_MZB_LO_1","FIN_004_MZB_LO_1-24.09.2009","24.09.2009",2009,9,24,0,0,0,0,0,0,20,0,0,0,0,0,0,46,0,0,6,0,0,0,0,0,0,0,0,4,0,0,0,267,0,0,0,0,0,0,0,0,2,0,0,0,0,0,0,0,42,0,0,0,0,0,1,0,0,0,3,0,0,0,0,0,0,0,0,32,0,0,6,0,0,0,0,51,0,0,0,39,15,19,0,2,1,54,0,34,0,0,0,0,0,0,0,0,0,0,6,3,0,62,0,0,0,0,37,47,0,0,0,0,0,0,89,0,0,0,0,0,0,9,0,0,0,0,0,197,0,0,0,11,0,2,0,0,0,0,0,0
"FIN_004_MZB_LO_1","FIN_004_MZB_LO_1-31.10.2010","31.10.2010",2010,10,31,0,0,0,0,0,0,7,0,0,0,0,0,0,22,0,0,3,0,0,0,0,0,0,0,0,8,0,0,0,60,0,0,0,0,0,1,0,0,0,0,0,0,0,0,0,0,1,0,0,0,0,0,5,0,0,0,0,0,0,0,0,0,0,0,0,13,0,0,3,0,0,0,0,34,0,0,0,102,28,0,0,6,0,27,0,5,0,0,0,0,0,0,0,0,0,0,0,0,0,30,0,0,0,0,4,0,0,0,0,0,0,0,84,0,0,0,0,0,0,16,0,0,0,0,0,5,0,3,0,62,0,0,0,0,0,0,0,0
"FIN_004_MZB_LO_1","FIN_004_MZB_LO_1-23.11.2011","23.11.2011",2011,11,23,0,0,0,0,0,0,0,0,0,0,0,0,0,76,0,0,0,0,0,0,0,0,0,0,0,0,0,0,0,2,0,0,0,0,0,0,0,0,0,0,0,0,0,0,0,0,0,0,0,0,0,0,1,0,0,0,0,0,0,0,0,0,0,0,0,15,0,0,0,0,0,0,0,88,0,0,0,27,0,0,0,0,0,1,0,1,0,0,0,0,0,0,0,0,0,0,0,0,0,0,0,0,0,0,0,0,0,0,0,0,0,0,2,0,0,0,0,0,0,6,0,0,0,0,0,3,0,0,0,21,0,0,0,0,3,0,0,0
"FIN_004_MZB_LO_1","FIN_004_MZB_LO_1-04.11.2012","04.11.2012",2012,11,4,0,1,0,0,0,0,20,0,0,0,0,0,0,149,0,0,0,0,0,0,0,0,0,0,0,0,0,0,0,98,0,0,0,0,0,1,0,0,2,0,0,2,0,0,0,0,7,0,0,0,0,0,8,0,0,0,1,0,0,0,0,0,0,0,0,16,0,0,0,0,0,0,0,25,0,0,0,7,1,7,0,0,0,52,0,15,0,0,0,0,0,0,0,0,0,0,0,0,0,66,0,0,0,0,3,0,1,0,0,0,0,0,40,0,1,0,0,0,0,18,0,0,0,0,0,58,0,0,0,163,0,0,0,0,3,0,0,0
"FIN_004_MZB_LO_1","FIN_004_MZB_LO_1-02.10.2013","02.10.2013",2013,10,2,0,0,0,0,0,0,1,0,0,0,0,0,0,134,0,0,7,0,0,0,0,0,0,0,0,0,0,0,0,58,0,0,0,0,1,1,0,0,2,0,0,1,0,0,0,0,8,0,0,0,0,0,2,0,0,0,0,0,0,0,0,0,0,0,0,208,0,0,0,0,0,0,0,42,0,0,0,17,0,9,0,39,4,41,0,1,0,0,0,0,0,0,0,0,0,0,1,0,0,6,0,0,0,0,4,0,0,0,0,0,0,0,12,0,0,0,0,0,0,22,0,0,0,2,0,4,0,0,0,32,0,3,0,0,0,0,0,0
"FIN_004_MZB_LO_1","FIN_004_MZB_LO_1-30.09.2014","30.09.2014",2014,9,30,0,0,0,0,0,0,0,0,0,0,0,0,0,124,0,0,15,0,0,0,0,0,0,1,0,2,0,0,0,96,0,0,0,0,0,0,0,0,1,0,0,2,0,0,0,0,5,0,0,0,2,0,4,0,0,0,0,0,0,0,0,0,0,0,0,58,0,0,16,0,0,0,0,40,1,0,0,69,0,17,0,51,7,91,0,1,0,0,0,0,0,0,0,0,0,1,7,0,0,0,0,0,0,0,4,0,0,0,0,0,0,0,2,0,0,0,2,0,0,14,0,0,0,0,0,9,0,0,0,187,0,6,0,0,1,0,0,0
"FIN_004_MZB_LO_1","FIN_004_MZB_LO_1-22.09.2016","22.09.2016",2016,9,22,0,0,0,0,0,0,1,0,0,0,0,0,0,157,0,0,20,0,0,0,0,0,0,0,0,0,0,0,0,11,0,0,0,0,0,0,0,0,0,0,0,1,0,0,0,0,9,0,0,0,0,0,4,0,0,0,10,0,0,0,0,0,0,0,0,60,0,0,0,0,0,0,0,86,0,0,0,33,0,4,0,13,1,7,0,1,0,0,0,0,0,0,0,0,0,0,0,0,0,1,0,0,0,0,0,0,0,0,0,0,0,0,11,0,0,0,0,0,0,43,0,0,0,0,0,85,0,0,0,156,0,0,0,0,0,0,0,0
"FIN_004_MZB_LO_1","FIN_004_MZB_LO_1-04.10.2018","04.10.2018",2018,10,4,0,0,0,0,0,0,0,0,0,0,0,0,0,76,0,0,8,0,0,0,0,0,0,0,0,0,0,0,0,214,0,0,0,0,0,0,0,0,0,0,0,0,0,0,0,0,5,0,0,0,0,0,0,0,0,0,0,0,0,0,0,0,0,0,0,23,0,0,0,0,0,0,0,4,0,0,0,71,0,2,0,9,6,15,0,0,0,0,0,0,0,0,0,0,0,0,3,0,0,1,0,0,0,0,0,32,0,0,0,0,0,0,26,0,0,0,0,0,0,19,0,0,0,0,0,55,0,2,0,3,0,0,0,0,0,0,0,0
"FIN_004_MZB_LO_1","FIN_004_MZB_LO_1-09.10.2019","09.10.2019",2019,10,9,0,0,0,0,0,0,2,0,0,0,0,0,0,83,0,0,17,0,0,0,0,0,0,0,0,0,0,0,0,94,0,0,0,0,0,0,0,0,0,0,0,0,0,0,0,0,7,0,0,0,0,0,4,0,0,0,0,0,0,1,0,0,0,0,0,47,0,0,0,0,0,0,0,25,0,0,0,55,0,3,0,8,4,70,0,3,0,0,0,0,0,0,0,0,0,0,2,0,0,1,0,0,0,0,14,7,0,0,0,0,0,0,23,0,0,0,0,0,0,21,0,0,0,0,0,596,0,8,0,8,0,0,0,0,2,0,0,0
"FIN_004_MZB_LO_1","FIN_004_MZB_LO_1-21.09.2020","21.09.2020",2020,9,21,0,0,0,0,0,0,0,0,0,0,0,0,0,125,0,0,0,0,0,0,0,0,0,0,0,0,0,0,0,19,0,0,0,0,0,0,0,0,0,0,0,2,0,0,0,0,18,0,0,0,0,0,4,0,0,0,1,0,0,0,0,0,0,0,0,4,0,0,0,0,0,0,0,8,0,0,0,1,0,0,0,1,0,19,0,17,0,0,0,0,0,0,0,0,0,0,3,0,0,5,0,0,0,0,3,1,0,0,0,0,0,0,55,0,0,0,0,0,0,3,0,0,0,1,0,19,0,1,0,0,0,0,0,0,2,0,0,0
"FIN_004_MZB_LO_1","FIN_004_MZB_LO_1-28.09.2021","28.09.2021",2021,9,28,0,0,0,0,0,0,0,0,0,0,0,0,0,32,0,0,13,0,0,0,0,0,0,0,0,1,0,0,0,76,0,0,0,0,0,0,0,0,0,0,0,1,0,0,0,0,7,0,0,0,0,0,1,0,0,0,2,0,0,0,0,0,0,0,0,19,0,0,0,0,0,0,0,28,0,0,0,26,4,16,0,0,3,222,0,5,0,0,0,0,0,0,0,0,0,0,5,0,0,1,0,0,0,0,1,2,0,0,0,0,0,0,173,0,0,0,0,0,0,2,0,0,0,0,0,7,0,2,0,32,0,0,0,0,0,0,0,0
"FIN_004_MZB_LO_10","FIN_004_MZB_LO_10-16.09.2008","16.09.2008",2008,9,16,0,0,0,0,0,2,78,0,0,0,0,0,0,15,1,0,861,0,0,0,0,0,0,0,0,57,0,0,0,118,0,0,0,0,0,0,0,0,16,0,0,0,0,0,0,0,60,0,0,0,33,0,0,0,0,0,2,0,15,0,0,0,0,0,0,170,0,0,3,0,0,0,0,141,0,0,0,31,55,41,0,1,2,169,150,2,0,0,0,0,0,0,0,0,0,0,0,0,0,100,0,0,0,0,66,0,0,0,0,0,0,0,63,0,0,0,1,0,0,10,0,0,0,2,0,50,0,193,2,26,0,0,0,0,0,0,0,0
"FIN_004_MZB_LO_10","FIN_004_MZB_LO_10-21.09.2009","21.09.2009",2009,9,21,0,0,0,0,0,0,6,0,0,0,0,0,0,1,0,0,477,0,0,0,0,0,0,0,0,10,0,0,0,106,0,0,0,0,0,0,0,0,3,0,0,0,0,0,0,0,58,0,0,0,30,0,0,0,0,0,1,0,0,1,0,0,0,0,0,76,0,0,0,0,0,0,0,45,0,0,0,70,62,23,0,26,0,11,72,0,0,0,0,0,0,0,0,0,0,0,0,0,0,1,0,0,0,0,0,0,0,0,0,0,0,0,27,0,0,0,0,0,0,2,0,0,0,0,0,0,0,43,0,21,0,1,0,0,0,0,0,0
"FIN_004_MZB_LO_10","FIN_004_MZB_LO_10-20.09.2010","20.09.2010",2010,9,20,0,0,0,0,0,0,30,0,0,0,0,0,0,9,0,0,262,0,0,0,0,0,0,0,0,0,0,0,0,56,0,0,0,0,0,0,0,0,7,0,0,0,0,0,0,0,68,0,0,0,22,0,0,0,0,0,0,0,11,0,0,0,0,0,0,68,0,0,0,0,0,0,0,78,0,0,0,35,1,17,0,22,0,38,44,1,0,0,0,0,0,0,0,0,0,0,1,0,0,12,0,0,0,0,47,0,0,0,0,0,0,0,15,0,0,0,2,0,0,6,0,0,0,0,0,1,0,9,0,12,0,0,0,0,0,0,0,0
"FIN_004_MZB_LO_10","FIN_004_MZB_LO_10-08.11.2011","08.11.2011",2011,11,8,0,0,0,0,0,0,37,0,0,0,0,0,0,0,0,0,722,0,0,0,0,0,0,2,0,11,0,0,0,495,0,0,0,0,0,0,0,0,2,0,0,0,0,0,0,0,6,0,0,0,45,0,0,0,0,0,0,0,0,0,0,0,0,0,0,50,0,0,0,0,0,0,0,41,0,0,0,65,8,2,0,4,3,9,19,3,0,0,0,0,0,0,0,0,0,0,0,0,0,4,0,0,0,0,7,1,0,0,0,0,0,0,9,0,0,0,2,0,0,10,0,0,0,2,0,317,0,63,0,8,0,0,0,0,0,0,0,0
"FIN_004_MZB_LO_10","FIN_004_MZB_LO_10-08.10.2012","08.10.2012",2012,10,8,0,0,0,0,0,0,33,0,0,0,0,0,0,1,1,0,0,0,0,0,0,0,17,0,0,3,0,0,0,136,0,0,0,1,0,0,0,0,0,0,0,23,0,0,0,0,27,0,0,0,0,0,0,0,0,0,0,0,9,0,0,0,0,0,0,129,0,0,0,0,0,0,0,145,0,0,0,0,0,0,0,21,3,481,46,0,6,0,0,0,0,0,0,0,0,0,1,0,0,25,0,0,0,0,31,0,0,0,0,0,0,0,7,0,1,0,1,0,0,37,0,0,0,0,0,60,0,179,0,22,0,0,0,0,0,0,0,0
"FIN_004_MZB_LO_10","FIN_004_MZB_LO_10-23.10.2013","23.10.2013",2013,10,23,0,0,0,0,0,0,18,0,0,0,0,0,0,10,0,0,1903,0,0,0,0,0,0,1,0,0,0,0,0,105,0,0,0,0,0,0,0,0,6,0,0,0,0,0,0,0,17,0,1,0,47,0,0,0,0,0,0,0,1,0,0,0,0,0,0,87,0,0,7,0,0,0,0,25,0,0,0,61,55,7,0,11,0,52,19,13,0,0,0,0,0,0,0,0,0,0,0,0,0,9,0,0,0,0,11,0,0,0,0,0,0,0,2,0,0,0,1,0,0,6,0,0,0,0,0,112,0,28,0,6,0,0,0,0,1,0,0,0
"FIN_004_MZB_LO_10","FIN_004_MZB_LO_10-03.10.2017","03.10.2017",2017,10,3,0,0,0,0,0,0,7,0,0,0,0,0,0,7,0,0,146,0,0,0,0,0,0,0,0,5,0,0,0,28,0,0,0,0,0,0,0,0,0,0,0,3,0,0,0,0,7,0,0,0,25,0,0,0,0,0,0,0,0,0,0,0,0,0,0,14,0,0,0,0,0,0,0,28,0,0,0,14,0,7,0,17,1,8,10,3,0,0,0,0,0,0,0,0,0,0,1,0,0,22,0,0,0,0,18,0,0,0,0,0,0,0,1,0,0,0,0,0,0,1,1,0,0,0,0,0,0,6,0,4,0,0,0,0,0,0,0,0
"FIN_004_MZB_LO_10","FIN_004_MZB_LO_10-08.10.2019","08.10.2019",2019,10,8,0,0,0,0,0,0,9,0,0,0,0,0,0,21,0,0,174,0,0,0,0,0,0,1,0,1,0,0,0,5,1,0,0,0,0,0,0,0,6,0,0,6,0,0,0,0,30,0,0,0,12,0,0,0,0,0,7,0,0,0,0,0,0,0,0,28,0,0,0,0,0,0,0,3,0,0,0,9,0,0,0,30,0,16,9,45,1,0,0,0,0,0,0,0,0,0,1,0,0,4,0,0,0,0,4,2,0,0,0,0,0,0,2,0,1,0,0,0,0,0,0,0,0,0,0,4,0,22,0,6,0,2,0,0,0,0,0,0
"FIN_004_MZB_LO_101","FIN_004_MZB_LO_101-21.09.1998","21.09.1998",1998,9,21,3,0,0,0,0,0,0,0,0,0,0,0,0,0,0,1,26,0,0,0,0,0,0,0,0,1,0,0,0,14,3,0,0,0,0,0,0,0,0,0,0,0,0,0,0,0,133,0,0,0,0,0,0,0,0,0,0,0,5,0,0,0,0,0,0,28,0,0,0,0,0,0,0,8,0,0,0,7,0,0,0,2,0,0,0,2,2,0,0,0,0,0,0,0,0,0,0,0,0,2,0,0,0,0,12,0,0,0,0,0,0,0,0,0,0,0,1,0,0,3,0,3,2,0,0,0,0,5,0,0,0,0,0,0,0,0,0,0
"FIN_004_MZB_LO_101","FIN_004_MZB_LO_101-20.10.2004","20.10.2004",2004,10,20,0,0,0,0,0,0,0,0,0,0,0,0,0,0,0,0,9,0,0,0,2,0,0,0,0,1,0,0,0,3,5,0,0,0,0,0,0,0,0,0,0,0,0,0,0,0,6,0,0,0,0,0,0,0,0,0,0,0,3,0,0,0,0,0,0,3,0,0,0,0,0,0,0,7,0,0,0,1,0,1,0,0,0,0,0,2,4,0,0,0,0,0,0,0,0,0,0,0,0,16,0,0,0,0,7,0,0,0,0,0,0,0,0,0,0,0,0,0,0,0,0,0,0,0,0,2,0,0,0,2,0,1,0,0,0,0,0,0
"FIN_004_MZB_LO_101","FIN_004_MZB_LO_101-01.10.2006","01.10.2006",2006,10,1,0,0,0,0,0,0,3,37,0,0,0,0,0,0,0,0,93,0,0,0,11,0,0,0,0,3,0,0,0,109,33,0,0,0,0,0,0,0,0,0,0,1,0,0,0,0,105,0,2,1,0,0,0,0,0,0,1,0,15,0,6,0,0,0,0,22,0,0,7,3,0,0,0,9,0,0,0,27,1,1,0,9,3,0,0,0,13,0,0,0,0,0,0,0,0,0,0,0,0,2,0,0,0,0,11,0,0,0,0,0,0,0,5,0,0,2,3,0,0,0,0,0,0,0,0,5,0,7,0,12,0,6,0,0,0,0,0,0
"FIN_004_MZB_LO_101","FIN_004_MZB_LO_101-23.09.2010","23.09.2010",2010,9,23,0,0,0,0,0,0,6,1,0,0,0,0,0,0,0,0,99,0,0,0,0,0,0,0,0,4,0,0,0,61,70,0,0,0,0,0,0,0,0,0,0,2,0,0,0,0,344,0,1,4,0,0,0,0,0,0,0,0,30,0,17,0,0,0,0,52,0,0,0,4,0,0,0,115,0,0,0,82,0,6,0,50,38,0,0,0,0,0,0,1,0,0,0,0,0,0,0,4,0,1,0,0,0,0,45,0,0,0,0,0,0,0,4,0,0,0,4,0,0,0,0,24,0,0,0,0,0,6,0,17,0,23,0,0,0,0,0,0
"FIN_004_MZB_LO_101","FIN_004_MZB_LO_101-20.10.2014","20.10.2014",2014,10,20,0,0,0,0,0,0,3,5,0,0,0,0,0,0,0,0,305,0,0,1,15,0,0,0,0,2,0,0,0,76,25,0,0,0,0,0,0,0,0,0,2,0,0,0,0,0,63,0,2,7,0,0,0,0,0,0,3,0,6,0,2,0,0,0,0,26,0,0,0,1,0,0,0,0,0,0,0,19,1,54,0,25,3,9,1,11,4,0,0,0,0,0,0,0,0,0,0,0,0,31,0,0,0,0,48,0,0,0,0,0,0,0,1,0,0,0,9,0,0,0,0,0,0,0,0,49,0,19,0,13,0,1,0,0,0,0,0,0
"FIN_004_MZB_LO_101","FIN_004_MZB_LO_101-19.10.2018","19.10.2018",2018,10,19,0,0,0,0,0,0,0,1,0,0,0,0,0,0,0,0,249,0,0,0,33,0,0,0,2,6,0,0,0,164,33,0,0,0,0,0,0,0,2,0,0,0,0,0,0,0,47,0,0,3,0,0,0,0,0,0,1,0,7,4,4,0,0,0,0,0,0,0,0,0,0,0,0,5,0,0,0,27,1,0,0,45,3,3,0,23,2,0,0,0,0,0,0,0,0,0,0,0,0,0,0,0,0,0,7,0,0,0,1,0,0,0,1,0,0,0,8,0,0,0,0,0,0,0,0,7,0,11,0,4,0,1,0,0,0,0,0,0
"FIN_004_MZB_LO_101","FIN_004_MZB_LO_101-05.10.2021","05.10.2021",2021,10,5,0,0,0,0,0,0,9,5,0,0,0,0,0,0,0,0,314,0,0,0,5,0,0,0,4,0,0,0,0,92,42,0,0,0,0,0,0,0,0,0,0,0,0,0,0,0,224,0,6,3,0,0,0,0,0,0,0,0,13,0,15,0,0,0,0,49,0,0,0,4,0,0,0,49,0,0,0,20,2,43,0,63,26,7,0,18,3,0,0,0,0,0,0,0,0,0,0,0,0,25,0,0,0,0,49,0,0,0,0,0,0,0,3,0,0,10,7,0,0,1,1,0,0,0,1,28,0,17,1,24,0,10,0,0,0,0,0,0
"FIN_004_MZB_LO_11","FIN_004_MZB_LO_11-17.09.2009","17.09.2009",2009,9,17,0,0,0,0,0,0,0,0,0,0,0,0,0,10,0,0,34,0,0,0,0,0,0,3,5,16,0,0,0,487,0,0,0,0,0,0,0,0,7,0,0,0,0,0,2,0,50,0,0,0,0,0,0,0,0,0,0,0,0,0,0,0,0,0,0,2,0,0,2,1,0,0,0,2,0,0,0,0,0,18,0,0,4,241,5,2,0,0,0,0,0,0,0,0,0,0,0,1,0,13,0,0,0,0,43,0,1,0,0,0,0,0,9,0,0,0,0,0,0,7,0,0,0,0,0,6,0,3,0,54,0,0,0,0,0,0,0,0
"FIN_004_MZB_LO_11","FIN_004_MZB_LO_11-20.09.2010","20.09.2010",2010,9,20,0,0,0,0,0,0,0,0,0,0,0,0,0,0,0,0,20,0,0,0,0,0,0,1,0,0,0,0,0,33,0,0,0,0,0,2,0,0,3,0,0,1,0,0,1,0,6,0,0,1,0,0,0,0,0,0,0,0,0,0,0,0,0,0,0,14,0,0,0,0,1,0,0,20,0,0,0,0,1,3,0,0,7,14,6,0,0,0,0,4,0,0,0,0,0,0,0,0,0,3,0,0,0,0,5,0,0,0,0,0,0,0,15,0,0,0,0,0,0,4,0,0,1,0,0,2,0,0,0,19,0,0,0,0,0,0,0,0
"FIN_004_MZB_LO_11","FIN_004_MZB_LO_11-19.09.2011","19.09.2011",2011,9,19,0,0,0,0,0,0,86,0,0,0,0,0,0,0,0,0,93,0,0,0,0,0,0,0,2,4,0,0,0,391,0,0,0,0,0,0,0,0,3,0,0,0,0,0,0,0,274,0,0,0,2,0,0,0,0,0,1,0,0,0,0,0,0,0,0,6,0,0,7,22,0,0,0,22,0,0,0,0,0,18,0,0,1,11,24,0,0,0,0,0,0,0,0,0,0,0,0,0,0,15,0,0,0,0,80,0,0,0,0,0,0,0,1,0,0,0,1,0,0,30,0,0,0,0,0,9,0,4,0,8,0,0,0,0,0,0,0,0
"FIN_004_MZB_LO_11","FIN_004_MZB_LO_11-25.09.2012","25.09.2012",2012,9,25,0,0,0,0,0,0,7,0,0,0,0,0,0,1,0,0,786,0,0,0,0,0,0,0,0,3,0,0,0,186,0,0,0,0,0,1,0,0,15,0,0,4,0,0,0,0,145,0,0,0,0,0,0,0,0,0,3,0,0,0,0,0,0,0,0,76,0,0,10,14,0,0,0,8,0,0,0,0,0,22,0,0,1,4,47,4,0,0,0,0,0,0,0,0,0,0,0,0,0,77,0,0,0,0,63,0,0,0,0,0,0,0,0,0,0,0,0,0,0,45,0,0,13,0,0,28,0,0,0,58,0,0,0,0,0,0,0,0
"FIN_004_MZB_LO_11","FIN_004_MZB_LO_11-25.09.2013","25.09.2013",2013,9,25,0,0,0,0,0,0,5,0,0,0,0,0,0,10,0,0,494,0,0,0,0,0,0,0,0,1,0,0,0,68,0,0,0,0,0,0,0,0,24,0,0,0,0,0,0,0,180,0,2,0,0,0,0,0,0,0,0,0,0,0,0,0,0,0,0,36,0,0,0,5,0,0,0,6,0,0,0,1,0,79,0,0,0,43,59,7,0,0,0,0,0,0,1,0,0,0,1,0,0,50,0,0,0,0,10,0,0,0,0,0,0,0,1,0,1,4,1,0,0,16,0,1,30,0,0,16,0,1,0,24,0,1,0,0,0,0,0,0
"FIN_004_MZB_LO_11","FIN_004_MZB_LO_11-23.09.2014","23.09.2014",2014,9,23,0,0,0,0,0,0,2,0,0,0,0,0,0,0,0,0,552,0,0,0,0,0,0,1,0,11,0,0,0,113,0,0,0,0,0,0,0,0,36,0,0,11,0,0,0,0,126,0,4,0,0,0,0,0,0,0,0,0,0,0,0,0,0,0,0,37,0,0,63,17,0,0,0,125,0,0,0,0,0,57,0,0,5,7,83,4,0,0,0,0,0,0,8,0,0,0,8,0,0,9,0,0,0,0,17,0,0,0,0,0,0,0,8,0,0,0,0,0,0,36,0,0,0,0,0,19,0,0,0,24,0,0,0,0,0,0,0,0
"FIN_004_MZB_LO_11","FIN_004_MZB_LO_11-28.09.2015","28.09.2015",2015,9,28,0,0,0,0,0,0,4,0,0,0,0,0,0,2,0,0,96,0,0,0,0,0,0,0,0,3,0,0,0,4,0,0,0,0,0,0,0,0,15,0,0,7,0,0,0,0,133,0,1,0,0,0,0,0,0,0,2,0,0,0,0,0,0,0,0,32,0,0,5,21,0,0,0,9,0,0,0,0,0,0,0,0,1,1,23,3,1,0,0,0,0,0,3,0,0,0,0,0,0,15,0,0,0,0,32,0,0,0,0,0,0,0,12,0,0,0,1,0,0,6,0,0,5,0,0,25,0,0,0,6,0,0,0,0,0,0,0,0
"FIN_004_MZB_LO_11","FIN_004_MZB_LO_11-26.09.2016","26.09.2016",2016,9,26,0,0,0,0,0,0,1,0,0,0,0,0,0,1,0,0,204,0,0,0,0,0,0,0,13,0,0,0,0,9,0,0,0,0,0,1,0,0,4,0,0,0,0,0,0,0,53,0,0,0,1,0,0,0,0,0,1,0,0,0,0,0,0,0,0,3,0,0,2,17,0,0,0,1,0,0,0,0,0,14,0,0,0,10,24,2,0,0,0,0,0,0,1,0,0,0,0,0,0,19,0,0,0,0,0,0,0,0,0,0,0,0,3,0,0,0,2,0,0,5,0,0,5,1,0,23,0,0,0,6,0,0,0,0,0,0,0,0
"FIN_004_MZB_LO_11","FIN_004_MZB_LO_11-19.09.2017","19.09.2017",2017,9,19,0,0,0,0,0,0,0,0,0,0,0,0,0,7,0,0,105,0,0,0,0,0,0,0,1,2,0,0,0,51,0,0,0,0,1,0,0,0,6,0,0,4,0,0,0,0,292,0,0,1,0,0,0,0,0,0,13,0,0,0,0,0,0,0,0,28,0,0,6,37,0,0,0,8,0,0,0,0,0,10,0,0,9,10,114,2,1,0,0,0,0,0,10,0,0,0,0,0,0,28,0,0,0,0,33,0,0,0,0,0,0,0,6,0,0,0,3,0,0,14,0,1,5,0,3,0,0,10,0,16,0,0,0,0,0,0,0,0
"FIN_004_MZB_LO_11","FIN_004_MZB_LO_11-11.10.2018","11.10.2018",2018,10,11,0,0,0,0,0,0,0,0,0,0,0,0,0,0,0,0,0,0,0,0,0,0,0,0,0,1,1,0,0,2,0,0,0,0,0,0,0,0,2,0,0,0,0,0,0,0,235,0,0,0,0,0,0,0,0,0,0,0,0,0,0,0,0,0,0,0,0,0,1,20,0,0,0,0,0,0,0,0,0,0,0,0,0,0,0,1,0,0,0,0,0,0,1,0,0,0,3,0,0,0,0,0,0,0,36,0,0,0,0,0,0,0,0,0,0,0,0,0,0,0,0,0,0,0,0,3,0,2,0,0,0,4,0,0,0,0,0,0
"FIN_004_MZB_LO_11","FIN_004_MZB_LO_11-07.10.2019","07.10.2019",2019,10,7,0,0,0,0,0,0,0,0,0,0,0,0,0,3,0,0,30,0,0,0,0,0,0,0,0,0,0,0,0,16,0,0,0,0,0,1,0,0,1,0,0,8,0,0,0,0,37,0,0,0,0,0,0,0,0,0,0,1,0,0,0,0,0,0,0,1,0,0,0,9,0,0,0,0,0,0,0,0,0,3,0,0,1,9,0,8,0,0,0,0,0,0,0,0,0,0,4,0,0,98,0,0,0,0,36,0,0,0,0,0,0,0,0,0,0,0,0,0,0,1,0,0,3,0,0,169,0,0,0,0,0,2,0,0,0,0,0,0
"FIN_004_MZB_LO_11","FIN_004_MZB_LO_11-07.09.2020","07.09.2020",2020,9,7,0,0,0,0,0,0,3,0,0,0,0,0,0,9,0,0,64,0,0,0,0,0,1,0,1,16,0,0,0,85,0,0,0,0,0,0,0,0,0,0,0,3,0,0,6,0,156,0,0,1,0,0,0,0,0,0,0,0,0,0,0,0,1,0,0,11,0,0,9,12,0,0,0,3,0,0,0,0,0,54,0,0,2,110,7,3,0,0,0,0,0,0,0,0,0,0,0,0,0,18,0,0,0,0,106,0,0,0,0,0,0,0,14,0,0,0,0,0,0,7,0,0,28,0,0,2,0,2,0,0,0,0,0,0,2,0,0,2
"FIN_004_MZB_LO_110","FIN_004_MZB_LO_110-25.09.2007","25.09.2007",2007,9,25,0,0,0,0,0,0,3,0,0,0,0,0,0,0,0,0,7,0,0,0,0,0,0,0,0,5,3,0,0,584,0,0,0,1,4,0,0,0,2,0,0,1,0,0,0,0,39,0,0,0,1,0,0,0,0,0,0,0,0,0,0,0,0,0,0,1,0,0,3,0,0,0,0,0,0,0,0,3,54,15,0,0,4,686,4,43,0,0,0,0,0,0,51,4,0,0,1,9,0,74,0,0,0,0,20,1,5,0,0,0,0,0,29,0,2,2,0,0,0,0,0,0,0,16,0,2,0,28,0,22,0,4,0,0,0,0,0,0
"FIN_004_MZB_LO_110","FIN_004_MZB_LO_110-29.09.2009","29.09.2009",2009,9,29,0,0,0,0,0,0,46,0,0,0,0,0,0,0,0,4,19,0,0,0,1,0,0,0,0,0,0,0,0,142,0,0,0,2,0,1,0,0,0,0,0,7,0,0,0,0,36,0,0,0,6,0,0,0,0,0,0,0,0,0,0,0,0,0,0,23,0,0,3,0,0,0,0,4,0,0,0,9,36,68,0,16,1,329,57,6,0,0,0,0,0,0,4,0,0,0,0,0,0,31,0,0,0,0,7,19,0,0,0,0,0,0,12,0,23,0,0,0,0,5,0,0,0,1,0,18,0,11,0,148,0,0,0,0,0,0,0,0
"FIN_004_MZB_LO_110","FIN_004_MZB_LO_110-01.09.2010","01.09.2010",2010,9,1,0,0,0,0,0,0,0,0,0,0,0,0,0,0,0,0,226,0,0,0,0,0,0,0,0,0,0,0,0,351,0,0,0,0,0,0,0,0,0,0,0,27,0,0,0,0,61,0,0,0,8,0,1,0,0,0,0,0,0,0,0,0,0,0,0,52,0,0,6,0,0,0,0,9,0,0,0,13,192,68,0,31,0,32,11,0,0,0,0,0,0,0,1,0,0,0,1,0,0,1,0,0,0,0,9,14,0,0,0,0,0,0,5,0,10,0,0,0,0,17,0,0,0,0,0,5,0,0,0,177,0,0,0,0,0,0,0,0
"FIN_004_MZB_LO_110","FIN_004_MZB_LO_110-28.09.2011","28.09.2011",2011,9,28,0,0,0,0,0,0,2,0,0,0,0,0,0,4,0,0,17,0,0,0,5,0,0,0,0,2,0,0,0,232,0,0,0,28,5,0,0,0,0,0,0,11,0,0,0,0,83,0,0,0,44,0,3,0,0,0,0,0,0,0,0,0,0,0,0,42,0,0,0,0,0,0,0,22,0,0,0,22,277,5,0,44,1,43,30,4,0,0,0,0,0,0,62,0,0,1,2,0,0,3,0,0,0,0,8,14,0,0,0,0,0,0,4,0,7,0,0,0,0,4,0,0,0,2,0,17,0,101,0,75,0,2,0,0,3,0,0,0
"FIN_004_MZB_LO_110","FIN_004_MZB_LO_110-26.09.2012","26.09.2012",2012,9,26,0,0,0,0,0,0,6,0,0,0,0,0,0,0,0,0,3,0,0,0,0,0,0,0,1,2,0,0,0,99,0,0,0,0,4,2,0,0,0,0,0,5,0,0,0,0,13,0,0,0,2,0,0,0,0,0,0,0,0,0,0,0,0,0,0,3,0,0,3,0,0,0,0,2,0,0,0,0,0,55,0,0,0,399,81,30,3,0,0,0,0,0,5,0,0,3,0,0,0,65,0,0,0,0,0,1,0,0,0,0,1,0,9,0,5,0,0,0,0,1,0,0,0,3,0,29,0,18,0,77,0,0,0,0,1,0,0,0
"FIN_004_MZB_LO_110","FIN_004_MZB_LO_110-01.10.2013","01.10.2013",2013,10,1,0,0,0,0,0,0,17,0,0,0,0,0,0,0,0,0,9,0,0,0,2,0,0,0,0,0,0,0,0,41,0,0,0,0,0,0,0,0,0,0,0,15,0,0,0,0,29,0,0,0,5,0,0,0,0,0,0,0,0,0,0,0,0,0,0,38,0,0,0,0,0,0,0,11,0,0,0,53,36,7,0,15,0,18,42,0,0,0,0,0,0,0,16,0,0,0,1,0,0,3,0,0,0,0,6,1,0,0,0,0,0,0,2,0,7,0,0,0,0,7,0,0,0,0,0,38,0,9,0,127,0,0,0,0,0,0,0,0
"FIN_004_MZB_LO_110","FIN_004_MZB_LO_110-06.10.2014","06.10.2014",2014,10,6,0,0,0,0,0,0,24,0,0,0,0,0,0,0,0,0,10,0,0,0,0,0,0,0,0,0,0,0,0,60,0,0,0,1,0,0,0,0,0,0,0,20,0,0,0,0,36,0,0,0,3,0,1,0,0,0,0,0,0,0,0,0,0,0,0,35,0,0,1,0,0,0,0,8,0,0,0,11,117,2,0,40,3,33,27,0,0,0,0,0,0,0,49,0,0,0,0,0,0,0,0,0,0,0,6,2,0,0,0,0,0,0,32,0,0,0,0,0,0,3,0,0,0,0,0,2,0,28,0,39,0,0,0,0,0,0,0,0
"FIN_004_MZB_LO_110","FIN_004_MZB_LO_110-04.10.2015","04.10.2015",2015,10,4,0,0,0,0,0,0,18,0,0,0,0,0,0,0,0,0,39,0,0,0,2,0,0,1,0,0,0,0,0,114,0,0,0,2,2,0,0,0,0,0,0,13,0,0,0,0,16,0,0,0,0,0,0,0,0,0,0,0,0,0,0,0,0,0,0,11,0,0,0,0,0,0,0,2,0,0,0,24,5,51,0,12,1,433,55,41,0,0,0,0,0,0,55,0,0,0,0,0,0,35,0,0,0,0,3,15,0,0,0,0,0,0,10,0,1,0,0,0,0,6,0,0,0,5,0,128,0,144,0,115,0,3,0,0,0,0,0,0
"FIN_004_MZB_LO_110","FIN_004_MZB_LO_110-03.10.2016","03.10.2016",2016,10,3,0,0,0,0,0,0,66,0,0,0,0,0,0,1,0,0,12,0,0,0,0,0,0,0,0,0,0,0,0,60,1,0,0,0,0,0,0,0,0,0,0,15,0,0,0,0,55,0,0,0,5,0,0,0,0,0,0,0,0,0,0,0,0,0,0,39,0,0,7,0,0,0,0,4,0,0,0,140,43,3,0,12,0,29,30,4,0,0,0,0,0,0,17,0,0,0,0,0,0,2,0,0,0,0,1,4,1,0,0,0,0,0,7,0,3,0,0,0,0,3,0,0,0,1,0,8,0,44,0,78,0,0,0,0,0,0,0,0
"FIN_004_MZB_LO_112","FIN_004_MZB_LO_112-10.10.2007","10.10.2007",2007,10,10,0,0,0,0,0,0,2,0,0,0,10,0,0,0,0,0,81,0,0,0,0,0,0,0,0,98,0,0,0,300,0,0,0,18,0,0,0,0,0,0,0,2,0,0,0,0,199,0,0,0,0,0,3,0,0,4,0,0,0,52,0,0,4,0,0,9,0,0,4,0,0,0,0,3,1,0,0,10,80,6,0,43,17,107,0,10,0,3,0,0,0,0,0,0,0,0,0,0,0,4,0,0,0,0,112,37,1,0,0,0,0,0,163,0,0,1,5,0,0,0,0,0,0,0,0,3,0,451,3,61,0,0,0,0,1,0,0,0
"FIN_004_MZB_LO_112","FIN_004_MZB_LO_112-14.10.2009","14.10.2009",2009,10,14,0,0,0,0,0,0,1,0,0,0,17,0,0,0,0,0,90,0,0,0,26,0,0,0,3,26,0,0,0,419,0,0,0,0,0,0,0,0,3,0,0,6,0,0,0,0,12,0,0,0,10,0,1,0,0,2,0,0,0,20,0,0,0,0,0,69,0,0,3,0,0,0,0,46,3,0,0,14,0,11,0,30,6,69,2,0,0,5,0,0,0,0,8,0,0,1,0,0,0,1,0,0,0,0,6,164,0,0,0,0,0,0,532,0,0,0,5,0,0,3,0,0,0,0,0,2,0,93,0,46,0,0,0,0,0,0,0,0
"FIN_004_MZB_LO_112","FIN_004_MZB_LO_112-03.10.2012","03.10.2012",2012,10,3,0,0,0,0,0,0,0,0,0,0,52,0,0,0,0,0,7,1,0,0,2,0,0,0,8,0,0,0,0,34,0,0,0,0,0,0,0,0,0,0,0,10,0,0,0,0,4,0,0,0,0,0,1,0,0,2,0,0,0,0,0,0,0,0,0,81,0,0,1,0,0,0,0,44,0,0,0,10,38,1,0,16,3,6,1,0,0,1,0,0,0,0,2,0,0,0,1,0,0,0,0,0,0,0,4,8,0,0,0,0,0,0,288,0,0,0,1,0,0,1,0,0,0,0,0,3,0,517,1,32,0,0,0,0,0,0,0,0
"FIN_004_MZB_LO_112","FIN_004_MZB_LO_112-29.10.2014","29.10.2014",2014,10,29,0,0,0,0,0,0,0,0,0,0,20,0,0,1,0,0,384,0,0,0,1,0,2,0,0,0,0,0,0,316,0,0,0,0,0,0,0,0,0,0,0,4,0,0,0,0,4,0,0,0,3,0,2,0,0,1,0,0,0,10,0,0,0,0,0,4,0,0,0,0,0,0,0,3,1,0,0,7,17,29,0,35,5,133,0,0,0,45,0,0,0,0,5,0,0,0,0,0,0,1,0,0,0,0,0,46,0,0,0,0,0,0,97,0,0,0,1,0,0,0,0,0,0,0,0,1,0,453,0,25,0,0,0,0,0,0,0,0
"FIN_004_MZB_LO_112","FIN_004_MZB_LO_112-08.10.2015","08.10.2015",2015,10,8,0,0,0,0,0,0,1,0,0,0,12,0,0,0,0,0,241,0,0,0,5,0,0,0,4,7,0,0,0,74,0,0,0,0,0,0,0,0,0,0,0,4,0,0,0,0,1,0,0,0,2,0,1,0,0,3,0,0,0,7,0,0,1,0,0,16,0,0,0,0,0,0,0,6,1,0,0,28,168,29,0,74,9,59,0,1,0,9,0,0,0,0,12,0,0,0,0,0,0,1,0,0,0,0,0,171,0,0,0,0,0,0,821,0,0,0,1,0,0,0,0,0,0,0,0,3,0,451,0,74,0,0,0,0,0,0,0,0
"FIN_004_MZB_LO_112","FIN_004_MZB_LO_112-25.09.2017","25.09.2017",2017,9,25,0,0,0,0,0,0,0,0,0,0,66,0,0,0,0,1,13,0,0,0,4,0,0,0,0,0,0,0,0,27,0,0,0,0,0,0,0,0,0,0,0,8,0,0,0,0,6,0,0,0,0,0,1,0,0,2,0,0,0,67,0,0,3,0,0,8,0,0,0,0,0,0,0,44,2,0,0,10,114,7,0,8,0,3,1,0,0,16,0,0,0,0,22,0,0,0,0,0,0,0,0,0,0,0,29,1,0,0,0,0,0,0,361,0,0,0,0,0,0,0,0,0,0,0,0,6,0,471,0,107,0,0,0,0,1,0,0,0
"FIN_004_MZB_LO_112","FIN_004_MZB_LO_112-25.09.2018","25.09.2018",2018,9,25,0,0,0,0,0,0,0,0,0,0,13,0,0,0,0,0,20,0,0,0,8,0,1,0,1,1,0,0,0,156,0,0,0,0,0,0,0,0,0,0,0,3,0,0,0,0,1,0,1,0,1,0,0,0,0,0,0,0,0,0,0,0,0,0,0,7,0,0,0,0,0,0,0,8,0,0,0,9,15,14,0,35,18,20,0,0,0,1,0,0,0,0,0,0,0,0,0,0,0,0,0,0,0,0,26,9,0,0,0,0,0,0,148,0,0,0,1,0,0,0,0,0,0,0,0,1,0,29,0,35,0,0,0,0,0,0,0,0
"FIN_004_MZB_LO_113","FIN_004_MZB_LO_113-28.09.2007","28.09.2007",2007,9,28,0,0,0,0,0,0,1,0,0,0,0,0,0,3,0,0,81,0,0,0,0,0,1,0,0,0,0,0,0,9,0,0,0,0,0,0,0,0,0,0,0,0,0,0,0,0,1,0,0,0,119,0,0,0,0,0,17,0,1,0,93,0,1,0,0,425,0,0,0,0,0,0,0,499,0,0,0,17,0,0,0,17,3,0,1,0,0,0,0,0,0,0,17,0,0,0,0,0,0,1,0,0,0,0,62,0,0,0,0,0,0,0,209,67,0,0,0,0,0,29,0,0,1,0,0,1,0,1601,0,10,0,0,0,0,0,0,0,0
"FIN_004_MZB_LO_113","FIN_004_MZB_LO_113-07.09.2009","07.09.2009",2009,9,7,0,0,0,0,0,0,3,0,0,0,0,0,0,0,0,0,112,0,0,0,0,0,0,0,0,4,0,0,0,122,0,0,0,0,0,0,0,0,3,0,0,0,0,0,0,0,2,0,21,0,16,0,0,0,0,0,40,0,0,0,198,0,0,0,0,242,0,0,0,0,0,0,0,4182,0,0,0,11,14,6,0,4,13,0,15,0,2,0,0,0,0,0,38,0,0,0,0,2,0,6,0,0,0,0,74,4,0,0,0,0,0,0,235,80,0,0,0,0,0,140,0,0,0,0,0,12,0,1019,0,1,0,0,0,0,0,0,0,0
"FIN_004_MZB_LO_113","FIN_004_MZB_LO_113-12.09.2010","12.09.2010",2010,9,12,0,0,0,0,0,0,5,0,0,0,0,0,0,0,0,0,216,0,0,0,0,0,0,0,0,9,0,0,0,134,0,0,0,0,0,0,0,0,0,0,0,0,0,0,0,0,1,0,7,0,5,0,0,0,0,0,40,0,0,0,109,0,0,0,0,406,0,0,5,0,0,0,0,9720,0,0,0,11,123,0,0,12,8,0,0,0,0,0,0,0,0,0,39,0,0,0,0,4,0,1,0,0,0,0,97,0,0,0,0,0,0,0,162,113,0,0,0,0,0,120,0,0,0,0,0,73,0,1720,0,2,0,0,0,0,1,0,0,0
"FIN_004_MZB_LO_113","FIN_004_MZB_LO_113-11.09.2011","11.09.2011",2011,9,11,0,0,0,0,0,0,0,0,0,0,0,0,0,1,0,0,49,0,0,0,0,0,0,1,0,2,0,0,0,59,0,0,0,0,0,0,0,0,0,0,0,0,0,0,0,0,7,0,0,0,3,0,1,0,0,2,20,0,0,0,111,0,0,0,0,43,0,0,0,0,0,0,0,356,0,0,0,1,10,10,0,14,7,1,0,0,2,0,0,0,0,0,35,0,0,0,0,0,0,1,0,0,0,0,103,13,0,0,0,0,0,0,45,76,0,0,2,0,0,15,0,0,0,0,0,83,0,1,0,9,0,0,0,0,0,0,0,0
"FIN_004_MZB_LO_113","FIN_004_MZB_LO_113-09.09.2012","09.09.2012",2012,9,9,0,0,0,0,0,0,2,0,0,0,0,0,0,0,0,0,196,0,0,0,0,0,0,0,0,0,0,0,0,8,0,0,0,0,0,0,0,0,0,0,0,0,0,0,0,0,5,0,1,0,4,0,0,0,0,1,28,0,0,0,141,0,0,0,0,270,0,0,0,1,0,0,0,979,0,0,0,17,6,0,0,11,16,0,0,0,0,0,0,0,0,0,19,0,0,0,0,0,0,1,0,0,0,0,0,0,0,0,0,0,0,0,94,1,0,0,0,0,0,50,0,0,0,0,0,17,0,6,0,2,0,0,0,0,1,0,0,0
"FIN_004_MZB_LO_113","FIN_004_MZB_LO_113-09.09.2013","09.09.2013",2013,9,9,0,0,0,0,0,0,2,0,0,0,0,0,0,0,0,0,39,0,0,0,0,0,0,0,0,0,0,0,0,4,0,0,0,0,0,0,0,0,0,0,0,0,0,0,0,0,2,0,0,0,0,0,1,0,0,0,14,0,1,0,119,0,0,0,0,33,0,0,0,0,0,0,0,243,0,0,0,4,1,1,0,4,27,0,2,0,0,0,0,0,0,0,2,0,0,0,0,0,0,3,0,0,0,0,30,1,0,0,0,0,0,0,67,14,0,0,2,0,0,11,0,0,1,0,0,20,0,478,0,2,0,0,0,0,0,0,0,0
"FIN_004_MZB_LO_113","FIN_004_MZB_LO_113-10.09.2014","10.09.2014",2014,9,10,0,0,0,0,0,0,1,0,0,0,0,0,0,0,0,0,82,0,0,0,0,0,0,2,0,0,0,0,0,57,0,0,0,0,0,0,0,0,1,0,0,0,0,0,0,0,2,0,0,0,2,0,0,0,0,0,33,0,1,0,22,0,0,0,0,47,0,0,0,1,0,0,0,581,0,0,0,7,13,16,0,33,5,1,0,0,0,0,0,0,0,0,33,0,0,0,0,0,0,0,0,0,0,0,37,8,0,0,0,0,0,0,263,90,0,0,5,0,0,9,0,0,1,0,0,15,0,311,0,3,0,0,0,0,0,0,0,0
"FIN_004_MZB_LO_113","FIN_004_MZB_LO_113-12.09.2017","12.09.2017",2017,9,12,0,0,0,0,0,0,2,0,0,0,0,0,0,10,0,0,26,0,0,0,0,0,0,0,0,16,0,0,0,86,0,0,0,0,0,0,0,0,0,0,0,0,0,0,0,0,4,0,0,0,0,0,2,0,0,0,2,0,0,0,26,0,0,0,0,0,0,0,0,0,0,0,0,26,0,0,0,0,20,20,0,0,74,22,2,0,0,0,0,0,0,0,10,0,0,0,0,4,0,14,0,0,0,0,46,0,0,0,0,0,0,0,312,36,0,0,0,0,0,2,0,0,2,0,0,0,0,50,0,4,0,2,0,0,0,0,0,0
"FIN_004_MZB_LO_12","FIN_004_MZB_LO_12-28.09.2009","28.09.2009",2009,9,28,0,0,0,0,0,0,2,0,0,0,0,0,0,52,0,0,201,0,0,0,0,0,0,0,0,4,0,0,0,474,0,0,0,0,0,1,0,0,0,0,0,1,0,0,0,0,0,0,0,0,10,0,8,0,0,0,0,0,0,0,0,0,0,0,0,4,0,0,2,0,0,0,0,68,0,0,0,0,0,7,0,16,10,8,0,2,0,0,0,0,0,0,0,0,0,0,4,0,0,6,0,0,0,0,11,0,0,0,0,0,0,0,190,0,0,0,3,0,0,44,0,0,0,0,0,81,0,179,0,52,0,0,0,0,0,0,0,0
"FIN_004_MZB_LO_12","FIN_004_MZB_LO_12-21.09.2010","21.09.2010",2010,9,21,0,0,0,0,0,0,0,0,0,0,0,0,0,64,0,0,123,0,0,0,0,0,0,0,0,0,0,0,0,116,0,0,0,0,0,0,0,0,0,0,0,1,0,0,0,0,1,0,1,0,5,0,7,0,0,0,0,0,0,0,0,0,1,0,0,67,0,0,0,0,0,0,0,333,0,0,0,0,0,2,0,14,9,19,0,2,0,0,0,10,0,0,0,0,0,0,0,0,0,0,0,0,0,0,2,0,0,0,0,0,0,0,17,0,0,0,0,0,0,31,0,0,0,0,0,9,0,14,0,17,0,0,0,0,0,0,0,0
"FIN_004_MZB_LO_12","FIN_004_MZB_LO_12-22.09.2011","22.09.2011",2011,9,22,0,0,0,0,0,0,0,0,0,0,0,0,0,43,0,0,28,0,0,0,0,0,0,0,0,6,0,0,0,209,0,0,0,0,0,0,0,0,0,0,0,0,0,0,0,0,4,0,0,1,3,0,1,0,0,0,0,0,0,0,0,0,1,0,0,26,0,0,0,0,0,0,0,309,0,0,0,3,0,7,0,0,0,22,0,0,0,0,0,0,0,0,0,0,0,0,0,0,0,0,0,0,0,0,18,0,0,0,0,0,0,0,146,0,0,0,3,0,0,64,0,0,0,1,0,19,0,103,0,6,0,0,0,0,0,0,0,0
"FIN_004_MZB_LO_12","FIN_004_MZB_LO_12-24.09.2012","24.09.2012",2012,9,24,0,0,0,0,0,0,0,0,0,0,0,0,0,75,0,0,29,0,0,0,0,0,1,0,0,4,0,0,0,391,0,0,0,0,0,0,0,0,0,0,0,0,0,0,0,0,4,0,0,0,34,0,9,0,0,7,0,0,0,0,0,0,1,0,0,101,0,0,0,0,0,0,0,269,0,0,1,8,0,42,0,3,1,22,0,0,0,0,0,0,0,0,0,0,0,0,0,0,0,5,0,0,0,0,77,0,0,0,0,0,0,0,92,0,0,0,1,0,0,55,0,0,0,0,0,33,0,210,0,11,0,0,2,0,0,0,0,0
"FIN_004_MZB_LO_12","FIN_004_MZB_LO_12-25.09.2013","25.09.2013",2013,9,25,0,0,0,0,0,0,0,0,0,0,0,0,0,11,0,0,10,0,0,0,0,0,0,0,0,0,0,0,0,169,0,0,0,0,0,0,0,0,0,0,0,0,0,0,0,0,0,0,0,0,16,0,1,0,0,0,0,0,0,0,0,0,0,0,0,63,0,0,0,0,0,0,0,74,0,0,0,10,0,1,0,1,0,4,0,2,0,0,0,0,0,0,0,0,0,0,0,0,0,0,0,0,0,0,3,0,0,0,0,0,0,0,164,0,0,0,0,0,0,31,0,0,0,0,0,4,0,25,0,0,0,0,0,0,1,0,0,0
"FIN_004_MZB_LO_12","FIN_004_MZB_LO_12-24.09.2014","24.09.2014",2014,9,24,0,0,0,0,0,0,0,0,0,0,0,0,0,13,0,0,15,0,0,0,0,0,0,0,0,0,0,0,0,60,0,0,0,0,0,0,0,0,0,0,0,0,0,0,0,0,0,0,0,0,0,0,10,0,0,0,0,0,0,0,0,0,0,0,0,27,0,0,1,0,0,0,0,54,0,0,0,0,0,8,0,1,0,16,0,0,0,0,0,0,0,0,0,0,0,0,0,0,0,0,0,0,0,0,2,0,0,0,0,0,0,0,88,0,0,0,2,0,0,4,0,0,0,0,0,7,0,3,0,0,0,0,0,0,4,0,0,0
"FIN_004_MZB_LO_12","FIN_004_MZB_LO_12-19.10.2015","19.10.2015",2015,10,19,0,0,0,0,0,0,0,0,0,0,0,0,0,31,0,0,69,0,0,0,0,0,0,0,1,4,0,0,0,52,0,0,0,0,0,0,0,0,0,0,0,0,0,0,0,0,2,0,0,0,4,0,2,0,0,0,0,0,0,0,0,0,0,0,0,53,0,0,1,0,0,0,0,210,0,0,0,5,0,2,0,1,0,0,0,0,0,0,0,0,0,0,0,0,0,0,0,0,0,0,0,0,0,0,11,0,0,0,0,0,0,0,208,0,0,0,2,0,0,62,0,0,0,0,0,238,0,19,0,1,0,0,0,0,2,0,0,0
"FIN_004_MZB_LO_12","FIN_004_MZB_LO_12-28.09.2016","28.09.2016",2016,9,28,0,0,0,0,0,0,0,0,0,0,0,0,0,40,0,0,8,0,0,0,0,0,0,0,0,0,0,0,0,73,0,0,0,0,0,0,0,0,0,0,0,0,0,0,0,0,0,0,0,0,17,0,1,0,0,0,0,0,0,0,0,0,0,0,0,166,0,0,0,0,0,0,0,163,0,0,0,11,0,81,0,0,1,8,0,0,0,0,0,0,0,0,0,0,0,0,0,0,0,0,0,0,0,0,0,0,0,0,0,0,0,0,99,0,0,0,2,0,0,52,0,0,3,0,0,13,0,6,0,11,0,0,0,0,0,0,0,0
"FIN_004_MZB_LO_12","FIN_004_MZB_LO_12-24.10.2017","24.10.2017",2017,10,24,0,0,0,0,0,0,0,0,0,0,0,0,0,22,0,0,35,0,0,0,0,0,0,0,0,1,0,0,0,112,0,0,0,0,0,0,0,0,0,0,0,0,0,0,0,0,0,0,1,0,22,0,11,0,0,0,0,0,0,0,0,0,2,0,0,43,0,0,0,1,0,0,0,26,0,0,0,19,0,12,0,4,0,11,0,1,0,0,0,0,0,0,0,0,0,0,0,0,0,2,0,0,0,0,7,0,0,0,0,0,0,0,18,0,0,0,3,0,0,118,0,0,0,0,0,45,0,7,0,1,0,0,0,0,6,0,0,0
"FIN_004_MZB_LO_12","FIN_004_MZB_LO_12-06.09.2018","06.09.2018",2018,9,6,0,0,0,0,0,0,0,0,0,0,0,0,0,72,0,0,10,0,0,0,0,0,0,0,0,0,0,0,0,181,0,0,0,0,0,0,0,0,0,0,0,0,0,0,0,0,1,0,0,0,0,0,12,0,0,0,0,0,0,0,0,0,0,0,0,5,0,0,0,0,0,0,0,14,0,0,0,0,0,12,0,3,5,15,0,0,0,0,0,0,0,0,0,0,0,0,2,0,0,0,0,0,0,0,28,0,0,0,0,0,0,0,18,0,0,0,21,0,0,0,0,0,0,0,0,0,1,0,0,1,0,9,0,0,1,0,0,0
"FIN_004_MZB_LO_12","FIN_004_MZB_LO_12-01.10.2019","01.10.2019",2019,10,1,0,0,0,0,0,0,0,0,0,0,0,0,0,9,0,0,1449,0,0,0,0,0,1,0,0,2,0,0,0,124,0,0,0,0,0,0,0,0,0,0,0,0,0,0,0,0,0,0,1,0,21,0,0,0,0,0,0,0,0,0,0,0,0,0,0,104,0,0,6,0,0,0,0,116,0,0,0,34,0,5,0,9,0,1,0,5,0,0,0,0,0,0,0,0,0,0,0,0,0,1,0,0,0,0,2,0,0,0,0,0,0,0,7,0,0,0,5,0,0,60,0,0,1,0,0,9,0,120,0,2,0,0,0,0,0,0,0,0
"FIN_004_MZB_LO_12","FIN_004_MZB_LO_12-07.09.2020","07.09.2020",2020,9,7,0,0,0,0,0,0,0,0,0,0,0,0,0,3,0,0,63,0,0,0,0,0,0,0,0,0,0,0,0,116,0,0,0,0,0,0,0,0,0,0,0,0,0,0,0,0,0,0,0,0,6,0,0,0,0,0,0,0,0,0,0,0,0,0,0,57,0,0,0,1,0,0,0,283,0,0,0,21,0,73,0,0,1,3,0,0,0,0,0,0,0,0,0,0,0,0,0,0,0,0,0,0,0,0,3,0,0,0,0,0,0,0,239,0,0,0,7,0,0,32,0,0,0,0,0,63,0,30,0,0,0,0,0,0,1,0,0,0
"FIN_004_MZB_LO_13","FIN_004_MZB_LO_13-28.09.2009","28.09.2009",2009,9,28,0,0,0,0,0,0,5,0,0,0,0,0,0,0,0,0,329,0,0,0,0,0,0,2,0,17,0,0,0,312,0,0,0,2,2,0,0,0,0,0,0,1,0,0,0,0,49,0,2,0,0,0,5,0,0,1,0,0,0,0,0,0,0,0,0,2,0,0,2,0,0,0,0,93,0,0,0,76,83,61,0,6,6,575,10,1,0,0,0,0,0,0,118,0,0,0,0,0,0,30,0,0,0,0,2,125,0,0,0,0,0,0,204,0,0,0,0,0,0,3,0,0,0,0,0,35,0,70,0,64,0,0,0,0,0,0,0,0
"FIN_004_MZB_LO_13","FIN_004_MZB_LO_13-10.09.2013","10.09.2013",2013,9,10,0,0,0,0,0,0,15,0,4,0,0,0,0,0,0,0,767,0,0,0,0,0,0,10,0,2,0,0,0,275,0,0,0,0,2,0,0,0,0,0,0,2,0,0,0,0,41,0,1,0,3,0,14,0,0,1,1,0,0,34,0,0,0,0,0,18,0,0,4,0,0,0,0,97,0,0,0,183,424,194,0,307,71,446,9,0,0,0,0,0,0,0,34,0,0,0,1,1,0,13,0,0,0,0,7,122,0,0,0,0,0,0,139,0,31,0,1,0,0,30,0,0,0,0,0,35,0,332,0,103,0,4,0,0,1,0,0,0
"FIN_004_MZB_LO_13","FIN_004_MZB_LO_13-29.09.2015","29.09.2015",2015,9,29,0,0,0,0,0,0,51,0,0,0,0,0,0,0,0,0,87,0,0,0,0,0,0,0,0,0,0,0,0,6,0,0,0,0,0,0,0,0,0,0,0,1,0,0,0,0,51,0,4,0,5,0,2,0,0,3,0,0,0,0,0,0,0,0,0,3,0,0,0,0,0,0,0,77,0,0,0,54,41,21,0,6,1,74,17,0,0,0,0,0,0,0,130,0,0,0,0,0,0,7,0,0,0,0,0,0,0,0,0,0,0,0,14,0,24,0,0,0,0,6,0,0,0,0,0,33,0,34,0,94,0,0,0,0,2,0,0,0
"FIN_004_MZB_LO_13","FIN_004_MZB_LO_13-26.10.2016","26.10.2016",2016,10,26,0,0,0,0,0,0,83,0,0,0,0,0,0,0,0,0,163,0,0,0,0,0,0,0,0,0,0,0,0,71,0,0,0,0,0,0,0,0,0,0,0,4,0,0,0,0,76,0,12,0,0,0,0,0,0,0,0,0,0,0,0,0,0,0,0,28,0,0,0,0,0,0,0,266,0,0,0,199,0,4,0,3,1,13,17,0,0,0,0,0,0,0,3,0,0,0,0,0,0,2,0,0,0,0,0,0,0,0,0,0,0,0,7,0,52,0,0,0,0,14,0,0,0,0,0,181,0,14,0,51,0,0,0,0,0,0,0,0
"FIN_004_MZB_LO_13","FIN_004_MZB_LO_13-19.09.2017","19.09.2017",2017,9,19,0,0,0,0,0,0,0,0,0,0,0,0,0,0,0,0,16,0,0,0,0,0,0,0,0,0,0,0,0,13,0,0,0,0,0,0,0,0,0,0,0,5,0,0,0,0,31,0,1,0,0,0,3,0,0,0,0,0,0,1,0,0,0,0,0,38,0,0,0,0,0,0,0,180,0,0,0,26,0,7,0,3,1,16,39,1,0,0,0,0,0,0,10,0,0,0,0,0,0,7,0,0,0,0,0,0,0,0,0,0,0,0,24,0,102,0,0,0,0,11,0,0,0,1,0,11,0,654,0,79,0,0,0,0,0,0,0,0
"FIN_004_MZB_LO_13","FIN_004_MZB_LO_13-19.09.2018","19.09.2018",2018,9,19,0,0,0,0,0,0,4,0,0,0,0,0,0,0,0,0,18,0,0,0,0,0,0,0,0,0,0,0,0,19,0,0,0,0,0,0,0,0,0,0,0,1,0,0,0,0,56,0,0,0,0,0,0,0,0,0,0,0,0,0,0,0,0,0,0,54,0,0,0,0,0,0,0,223,0,0,0,58,0,3,0,4,6,83,10,0,0,0,0,0,0,0,13,0,0,0,0,0,0,2,0,0,0,0,0,1,0,0,0,0,0,0,22,0,77,0,1,0,0,20,0,0,0,0,0,42,0,35,0,37,0,0,0,0,0,0,0,0
"FIN_004_MZB_LO_13","FIN_004_MZB_LO_13-23.10.2019","23.10.2019",2019,10,23,0,0,0,0,0,0,79,0,0,0,0,0,0,0,0,0,90,0,0,0,0,0,0,4,0,17,0,0,0,1489,0,0,0,0,13,0,0,0,1,0,0,5,0,0,0,0,65,0,2,0,0,0,1,0,0,0,0,0,0,0,0,0,0,0,0,12,0,0,4,0,0,0,0,17,0,0,0,35,1,36,0,11,3,524,13,45,0,0,0,0,0,0,47,0,0,0,1,0,0,21,0,0,0,0,21,6,1,0,0,0,0,0,24,0,0,0,0,0,0,1,0,0,0,0,0,6,0,94,0,18,0,5,0,0,1,0,0,1
"FIN_004_MZB_LO_13","FIN_004_MZB_LO_13-10.11.2020","10.11.2020",2020,11,10,0,0,0,0,0,0,113,0,0,0,0,0,0,0,0,0,93,0,0,0,0,0,1,0,0,0,0,0,0,119,0,0,0,0,0,0,0,0,0,0,0,6,0,0,0,0,138,0,7,0,0,0,0,0,0,0,0,0,0,7,0,0,0,0,0,51,0,0,1,0,0,0,0,222,0,0,0,135,1,1,0,2,3,19,10,11,0,0,0,0,0,0,18,0,0,0,4,0,0,8,0,0,0,0,3,1,0,0,0,0,0,0,8,0,6,0,0,0,0,11,0,0,0,0,0,83,0,145,0,10,0,0,0,0,0,0,0,0
"FIN_004_MZB_LO_131","FIN_004_MZB_LO_131-01.10.2008","01.10.2008",2008,10,1,0,0,0,0,0,0,10,0,0,0,0,0,0,0,0,0,0,0,0,0,0,0,0,0,0,0,0,0,0,3444,0,0,0,0,0,0,0,0,1,0,0,4,0,0,0,0,80,0,2,0,0,0,0,0,0,0,0,0,0,0,0,0,0,0,0,1,0,0,2,0,0,0,0,1,0,0,0,0,0,12,0,0,0,180,198,26,0,0,0,0,0,0,0,0,0,0,0,8,0,361,0,0,0,0,79,0,0,0,0,0,0,0,247,0,23,0,0,0,0,60,0,0,0,1,0,3260,0,0,0,62,0,0,0,0,0,0,0,0
"FIN_004_MZB_LO_131","FIN_004_MZB_LO_131-07.09.2010","07.09.2010",2010,9,7,0,0,0,0,0,0,0,0,0,0,0,0,0,0,0,0,0,0,0,0,0,0,0,0,0,0,0,0,0,186,0,0,0,0,4,0,0,0,0,0,0,0,0,0,0,0,7,0,0,0,0,0,0,0,0,0,0,0,0,0,0,0,0,0,0,0,0,0,0,0,0,0,0,0,0,0,0,0,0,0,0,1,1,1,1,0,0,0,0,0,0,0,0,0,0,0,0,0,0,6,0,0,0,0,67,0,0,0,0,0,0,0,50,0,0,0,0,0,0,0,0,0,0,5,0,56,0,0,0,1,0,0,0,0,0,0,0,0
"FIN_004_MZB_LO_131","FIN_004_MZB_LO_131-09.09.2012","09.09.2012",2012,9,9,0,0,0,0,0,0,3,0,0,0,0,0,0,0,0,0,0,0,0,0,0,0,0,0,0,0,0,0,0,12,0,0,0,0,0,0,0,0,0,0,0,3,0,0,0,0,1,0,0,0,0,0,0,0,0,0,0,0,0,0,0,0,0,0,0,0,0,0,0,0,0,0,0,1,0,0,0,0,0,1,0,0,0,1,54,2,0,0,0,0,0,0,0,0,0,0,0,1,0,22,0,0,0,0,12,0,0,0,0,0,0,0,37,0,1,0,0,0,0,4,0,0,0,1,0,1,0,0,0,44,0,0,0,0,0,0,0,0
"FIN_004_MZB_LO_131","FIN_004_MZB_LO_131-02.09.2013","02.09.2013",2013,9,2,0,0,0,0,0,0,0,0,0,0,0,0,0,0,0,0,0,0,0,0,0,0,0,0,0,0,0,0,0,52,0,0,0,0,0,0,0,0,0,0,0,4,0,0,0,0,5,0,0,0,0,0,0,0,0,0,0,0,0,0,0,0,0,0,0,0,0,0,0,0,0,0,0,15,0,0,0,0,0,1,0,3,1,0,2,3,0,0,0,0,0,0,0,0,0,0,0,0,0,8,0,0,0,0,18,0,0,0,0,0,0,0,9,0,10,0,1,0,0,6,0,0,0,2,0,110,0,4,0,6,0,0,0,0,0,0,0,0
"FIN_004_MZB_LO_131","FIN_004_MZB_LO_131-09.09.2015","09.09.2015",2015,9,9,0,0,0,0,0,0,1,0,0,0,0,0,0,1,0,0,0,0,0,0,0,0,0,0,0,0,0,0,0,12,0,0,0,0,0,1,0,0,0,0,0,5,0,0,0,0,24,0,0,0,0,4,0,0,0,0,0,0,0,0,0,0,0,0,0,0,0,0,0,0,0,0,0,82,0,0,0,3,11,1,0,0,0,1,19,1,0,0,0,0,0,0,0,0,0,0,0,0,0,101,0,0,0,0,12,0,0,0,0,0,0,0,56,0,41,0,0,0,0,8,0,0,0,0,0,2,0,12,0,160,0,0,0,0,0,0,0,0
"FIN_004_MZB_LO_131","FIN_004_MZB_LO_131-07.10.2018","07.10.2018",2018,10,7,0,0,0,0,0,0,7,0,0,0,0,0,0,5,0,0,7,0,0,0,0,0,0,0,0,0,0,0,0,34,0,0,0,0,1,0,0,0,1,0,0,7,0,0,0,0,16,0,0,0,0,0,0,0,0,0,0,0,0,0,0,0,0,0,0,4,0,0,0,0,0,0,0,21,0,0,0,15,8,4,0,6,0,115,59,3,0,0,0,0,0,0,0,0,0,0,0,0,0,10,0,0,0,0,2,1,0,0,0,0,0,0,49,0,7,0,1,0,0,10,0,0,0,5,0,27,0,5,0,53,0,0,0,0,0,0,0,0
"FIN_004_MZB_LO_131","FIN_004_MZB_LO_131-15.09.2021","15.09.2021",2021,9,15,0,0,0,0,0,0,4,0,0,0,0,0,0,4,0,0,8,0,0,0,0,0,0,0,0,32,0,0,0,232,0,0,0,0,0,0,0,0,0,0,0,30,0,0,0,0,44,0,0,0,0,0,0,0,0,0,0,0,0,0,0,0,0,0,0,0,0,0,0,0,0,0,0,119,0,0,0,4,0,0,0,4,4,152,448,8,0,0,0,0,0,0,0,0,0,0,4,0,0,50,0,0,0,0,22,0,4,0,0,0,0,0,220,0,0,0,0,0,0,16,0,0,0,8,0,18,0,98,0,28,0,2,0,0,0,0,0,0
"FIN_004_MZB_LO_132","FIN_004_MZB_LO_132-30.09.2008","30.09.2008",2008,9,30,0,0,0,0,0,0,0,0,0,0,0,0,0,0,0,0,0,0,0,0,0,0,0,0,0,0,0,0,0,459,0,0,0,0,0,0,0,0,0,0,0,0,0,0,0,0,4,0,0,0,0,0,0,0,0,0,0,0,0,0,0,0,0,0,0,0,0,0,2,0,0,0,0,0,0,0,0,0,0,0,0,0,0,13,0,4,0,0,0,0,0,0,0,0,0,0,0,0,0,346,0,0,0,0,1,0,0,0,0,0,0,0,20,0,25,0,0,0,0,30,0,0,0,0,0,124,0,0,0,41,0,0,0,0,0,0,0,0
"FIN_004_MZB_LO_132","FIN_004_MZB_LO_132-08.09.2010","08.09.2010",2010,9,8,0,0,0,0,0,0,0,0,0,0,0,0,0,4,0,0,0,0,0,0,0,0,0,0,0,0,0,0,0,45,0,0,0,0,0,0,0,0,0,0,0,10,0,0,0,0,6,0,0,0,0,0,0,0,0,0,0,0,0,0,0,0,0,0,0,0,0,0,0,0,0,0,0,1,0,0,0,0,0,0,0,0,0,0,0,2,0,0,0,0,0,0,0,0,0,0,3,0,0,3,0,0,0,0,0,0,0,0,0,0,0,0,63,0,0,0,0,0,0,2,0,0,0,0,0,3,0,0,0,452,0,18,0,0,0,0,0,0
"FIN_004_MZB_LO_132","FIN_004_MZB_LO_132-13.09.2012","13.09.2012",2012,9,13,0,0,0,0,0,0,0,0,0,0,0,0,0,12,0,0,0,0,0,0,0,0,0,0,0,0,0,0,0,10,0,0,0,0,0,0,0,0,1,0,0,2,0,0,0,0,1,0,0,0,0,0,0,0,0,0,0,0,0,0,0,0,0,0,0,0,0,0,0,0,0,0,0,8,0,0,0,0,0,0,0,0,0,0,0,2,0,0,0,0,0,0,0,0,0,0,0,0,0,1,0,0,0,0,2,0,0,0,0,0,0,0,35,0,1,0,0,0,0,5,0,0,0,0,0,2,0,6,0,153,0,0,0,0,0,0,0,0
"FIN_004_MZB_LO_132","FIN_004_MZB_LO_132-02.09.2013","02.09.2013",2013,9,2,0,0,0,0,0,0,0,0,0,0,0,0,0,282,0,0,1,0,0,0,0,0,0,2,0,1,0,0,0,69,0,0,0,0,0,0,0,0,3,0,0,3,0,0,0,0,56,0,1,0,0,0,0,0,0,0,0,0,0,0,0,0,0,0,0,0,0,0,0,0,0,0,0,56,0,0,0,0,2,0,0,1,0,3,3,1,0,0,0,0,0,0,0,0,0,0,1,0,0,5,0,0,0,0,29,0,0,0,0,0,0,0,81,0,1,0,0,0,0,3,0,0,0,10,0,38,0,716,0,95,0,15,0,0,0,0,0,0
"FIN_004_MZB_LO_132","FIN_004_MZB_LO_132-09.09.2015","09.09.2015",2015,9,9,0,0,0,0,0,0,0,0,0,0,0,0,0,60,0,0,14,0,0,0,0,0,0,0,5,0,0,0,0,27,0,0,0,0,0,0,0,0,1,0,0,5,0,0,0,0,5,0,0,0,0,0,0,0,0,0,0,0,0,0,0,0,0,0,0,0,0,0,0,0,0,0,0,15,0,0,0,1,0,1,0,0,0,2,12,2,0,0,0,0,0,0,0,0,0,0,0,0,0,78,0,0,0,0,11,0,0,0,0,0,0,0,89,0,0,0,0,0,0,41,0,0,0,0,0,23,0,1276,0,826,0,0,0,0,0,0,0,0
"FIN_004_MZB_LO_132","FIN_004_MZB_LO_132-08.10.2018","08.10.2018",2018,10,8,0,0,0,0,0,0,2,0,0,0,0,0,0,27,0,0,1,0,0,0,0,0,0,0,0,2,0,0,0,216,0,0,0,0,0,0,0,0,0,0,0,4,0,0,0,0,5,0,0,0,0,0,0,0,0,1,0,0,0,0,0,0,0,0,0,1,0,0,0,0,0,0,0,8,0,0,0,20,0,1,0,0,0,98,85,5,0,0,0,0,0,0,0,0,0,0,2,0,0,13,0,0,0,0,0,0,1,0,0,0,0,0,100,0,0,0,0,0,0,8,0,0,0,4,0,151,0,60,0,41,0,0,0,0,0,0,0,0
"FIN_004_MZB_LO_132","FIN_004_MZB_LO_132-20.09.2021","20.09.2021",2021,9,20,0,0,0,0,0,0,0,0,0,0,0,0,0,21,0,0,0,0,0,0,0,0,0,0,0,114,0,0,0,210,0,0,0,0,6,0,0,0,0,0,0,3,0,0,0,0,0,0,0,0,0,0,0,0,0,15,0,0,0,0,0,0,0,0,0,0,0,0,0,0,0,0,0,42,0,0,0,0,0,9,0,0,0,226,2,8,0,0,0,0,0,0,0,0,0,0,0,0,0,23,0,0,0,0,27,0,0,0,0,0,0,0,8,0,0,0,0,0,0,3,0,0,0,1,0,78,0,128,0,64,0,6,0,0,0,0,0,0
"FIN_004_MZB_LO_133","FIN_004_MZB_LO_133-30.09.2008","30.09.2008",2008,9,30,0,0,0,0,0,0,151,0,0,0,0,0,0,0,0,0,61,0,0,0,0,0,0,0,4,6,0,0,0,443,1,0,0,1,0,0,0,0,4,0,0,1,0,0,0,0,57,0,11,0,0,0,0,0,0,0,0,0,0,0,0,0,0,0,0,7,0,0,49,10,0,0,0,8,0,0,0,8,1,47,0,0,0,83,377,0,0,0,0,0,0,0,1,0,0,0,0,7,0,5,0,0,0,0,82,1,0,0,0,0,0,0,80,0,72,0,0,0,0,39,0,0,0,0,0,313,0,4,0,61,0,0,0,0,0,0,0,0
"FIN_004_MZB_LO_133","FIN_004_MZB_LO_133-07.09.2010","07.09.2010",2010,9,7,0,0,0,0,0,0,13,0,0,0,0,0,0,0,0,0,58,0,0,0,0,0,0,0,0,2,0,0,0,179,0,0,0,0,0,0,0,0,0,0,0,9,0,0,0,0,130,0,1,0,0,0,0,0,0,0,0,0,0,0,0,0,0,0,0,2,0,0,2,6,0,0,0,172,0,0,0,0,0,39,0,26,3,180,35,0,0,0,0,0,0,0,0,0,0,0,0,3,0,15,0,0,0,0,28,0,0,0,0,0,0,0,335,0,49,0,0,0,0,25,0,0,0,1,0,30,0,0,0,100,0,0,0,0,0,0,0,0
"FIN_004_MZB_LO_133","FIN_004_MZB_LO_133-11.09.2012","11.09.2012",2012,9,11,0,0,0,0,0,0,4,0,0,0,0,0,0,1,0,0,1,0,0,0,0,0,0,0,0,0,0,0,0,27,0,0,0,0,0,0,0,0,0,0,0,1,0,0,0,0,17,0,1,0,0,0,0,0,0,0,0,0,0,0,0,0,0,0,0,0,0,0,0,0,0,0,0,79,0,0,0,0,0,92,0,1,0,26,29,1,0,0,0,0,0,0,0,0,0,0,0,0,0,6,0,0,0,0,10,0,0,0,0,0,0,0,20,0,76,0,1,0,0,5,2,0,0,0,0,35,0,2,0,58,0,0,0,0,0,0,0,0
"FIN_004_MZB_LO_133","FIN_004_MZB_LO_133-02.09.2013","02.09.2013",2013,9,2,0,0,0,0,0,0,521,0,0,0,0,0,0,8,0,0,159,0,0,0,0,0,0,1,1,0,0,0,0,84,2,0,0,0,0,0,0,0,0,0,0,1,0,0,0,0,26,0,0,0,0,0,0,0,0,0,0,0,0,0,0,0,0,0,0,5,0,0,6,0,0,0,0,28,0,0,0,28,8,187,0,13,4,121,37,2,0,0,0,0,0,0,0,0,0,0,0,0,0,15,0,0,0,0,12,0,0,0,0,0,0,0,56,0,203,0,0,0,0,40,0,2,0,0,0,34,0,5,0,133,0,0,0,0,0,0,0,0
"FIN_004_MZB_LO_133","FIN_004_MZB_LO_133-09.09.2015","09.09.2015",2015,9,9,0,0,0,0,0,0,5,0,0,0,0,0,0,0,0,0,155,0,0,0,0,0,0,0,0,0,0,0,0,17,0,0,0,0,0,0,0,0,1,0,0,3,0,0,0,0,16,0,0,0,0,0,0,0,0,0,0,0,0,0,0,0,0,0,0,4,0,0,0,10,0,0,0,12,0,0,0,8,5,46,0,1,0,28,39,0,0,0,0,0,0,0,0,0,0,0,0,1,0,6,0,0,0,0,21,0,0,0,0,0,0,0,15,0,174,0,0,0,0,9,0,1,0,0,0,19,0,4,0,75,0,0,0,0,0,0,0,0
"FIN_004_MZB_LO_133","FIN_004_MZB_LO_133-07.10.2018","07.10.2018",2018,10,7,0,0,0,0,0,0,1,0,0,0,0,0,0,22,0,0,78,0,0,0,0,0,0,0,0,1,0,0,0,3,0,0,0,0,0,0,0,0,0,0,0,0,0,0,0,0,12,0,0,0,0,0,0,0,0,0,2,0,0,0,0,0,0,0,0,9,0,0,1,3,0,0,0,24,0,0,0,91,2,5,0,1,0,166,238,0,0,0,0,0,0,0,0,0,0,0,0,0,0,0,0,0,0,0,2,0,0,0,0,0,0,0,13,0,38,0,0,0,0,0,0,0,0,0,0,26,0,5,0,15,0,0,0,0,1,0,0,0
"FIN_004_MZB_LO_133","FIN_004_MZB_LO_133-13.09.2021","13.09.2021",2021,9,13,0,0,0,0,0,0,0,0,0,0,0,0,0,13,0,0,88,0,0,0,0,0,0,0,0,45,0,0,0,110,1,0,0,0,0,0,0,0,0,0,0,4,0,0,0,0,128,0,0,2,0,0,0,0,0,0,0,0,0,0,0,0,1,0,0,4,0,0,0,14,0,0,0,117,0,0,0,27,2,48,0,4,0,428,315,7,0,0,0,0,0,0,0,0,0,0,0,3,0,2,0,0,0,0,50,1,1,0,0,0,0,0,48,0,3,0,0,0,0,0,0,0,2,3,0,12,0,91,0,32,0,0,0,0,0,0,0,0
"FIN_004_MZB_LO_14","FIN_004_MZB_LO_14-03.10.2006","03.10.2006",2006,10,3,0,0,0,0,0,0,81,0,0,0,0,0,0,0,0,0,214,0,0,0,0,0,0,0,0,17,0,0,0,583,10,0,0,1,0,3,0,0,0,0,0,2,0,0,1,0,49,0,10,0,39,2,0,0,0,0,3,0,0,61,0,0,2,0,0,42,0,0,2,1,0,0,0,48,1,0,0,10,4,3,0,40,9,432,64,176,0,42,0,0,0,0,0,0,0,0,0,1,0,49,0,0,0,0,85,59,0,0,0,0,0,0,26,0,0,2,0,0,0,11,0,0,0,0,0,28,0,13,0,0,0,2,0,0,0,0,0,0
"FIN_004_MZB_LO_14","FIN_004_MZB_LO_14-06.09.2010","06.09.2010",2010,9,6,0,0,0,0,0,0,2,0,0,0,0,0,0,0,0,0,91,4,0,0,0,0,0,1,0,6,0,0,0,228,22,0,0,0,0,0,0,0,1,0,0,3,0,0,0,0,39,0,23,0,5,0,0,0,0,0,7,0,0,70,0,0,0,0,0,52,0,0,4,1,0,0,0,45,5,0,0,10,4,0,0,22,11,43,89,0,1,15,0,0,0,0,0,0,0,0,0,0,0,15,0,0,0,0,5,7,0,0,0,0,0,0,7,0,0,0,0,0,0,7,0,5,0,0,0,48,1,54,0,7,0,0,0,0,1,0,0,0
"FIN_004_MZB_LO_14","FIN_004_MZB_LO_14-07.09.2011","07.09.2011",2011,9,7,0,0,0,0,2,0,1,0,0,0,0,0,0,0,0,0,189,6,0,0,0,0,0,1,0,18,0,0,0,82,11,0,0,11,0,0,0,0,1,0,0,3,0,0,0,0,29,0,30,0,18,0,0,0,0,0,17,0,0,204,0,0,0,0,0,36,0,0,4,1,0,0,0,48,23,0,0,4,7,3,0,60,3,59,57,8,1,21,0,0,0,0,0,0,0,0,1,0,0,14,0,0,0,0,18,41,0,0,0,0,0,0,18,0,0,0,0,0,0,11,0,5,0,0,0,33,1,22,0,8,0,1,0,0,2,0,0,0
"FIN_004_MZB_LO_14","FIN_004_MZB_LO_14-20.09.2012","20.09.2012",2012,9,20,0,0,0,0,0,0,2,0,0,0,0,0,0,0,0,0,221,4,0,0,0,0,0,4,0,6,0,0,0,74,5,0,0,1,0,13,0,0,4,0,0,6,0,0,1,0,23,0,3,1,4,0,0,0,0,0,5,0,0,72,0,0,3,0,0,19,0,0,2,1,0,0,0,56,0,0,0,9,0,5,0,20,25,72,360,46,0,5,0,0,0,0,0,0,0,0,0,0,0,52,0,0,0,0,13,5,1,0,0,0,0,0,9,0,0,0,0,0,5,13,0,0,0,0,0,21,0,54,0,14,0,0,0,0,0,0,0,0
"FIN_004_MZB_LO_14","FIN_004_MZB_LO_14-06.09.2013","06.09.2013",2013,9,6,0,0,0,0,0,0,3,0,0,0,0,0,0,0,0,0,107,4,0,0,0,0,0,11,0,19,0,0,0,416,3,0,0,10,0,8,0,0,0,0,0,3,0,0,0,0,14,0,6,8,3,0,0,3,0,1,1,0,0,109,0,0,4,0,0,2,0,0,1,0,0,0,0,4,0,0,0,5,0,7,0,27,12,299,49,12,2,46,0,0,0,0,0,0,0,7,0,0,0,41,0,0,0,0,8,14,2,0,0,0,0,0,21,0,0,0,3,0,0,1,0,4,0,36,0,3,0,174,0,2,0,0,0,0,0,0,0,0
"FIN_004_MZB_LO_14","FIN_004_MZB_LO_14-10.10.2014","10.10.2014",2014,10,10,0,0,0,0,0,0,14,0,0,0,0,0,0,0,0,0,170,2,0,0,0,0,0,0,6,0,0,0,0,58,17,0,0,0,0,0,0,0,1,0,0,6,0,0,0,0,13,0,1,0,474,0,0,0,0,0,33,0,0,85,0,0,0,0,0,65,0,0,1,0,0,0,0,32,0,0,0,26,0,0,0,39,10,37,98,4,0,13,0,0,0,0,0,0,0,0,1,0,0,50,0,0,0,0,3,3,0,0,0,0,0,0,9,0,0,0,0,0,17,18,0,3,0,0,0,89,0,69,0,4,0,0,0,0,0,0,0,0
"FIN_004_MZB_LO_14","FIN_004_MZB_LO_14-01.10.2015","01.10.2015",2015,10,1,0,0,0,0,0,0,25,0,0,0,0,0,0,0,0,0,359,1,0,0,0,0,0,0,0,6,0,0,0,89,12,0,0,1,0,0,0,0,3,0,0,4,0,0,0,0,19,0,4,0,28,0,0,0,0,0,17,0,1,39,0,0,0,0,0,0,0,0,1,1,0,0,0,47,0,0,0,9,0,0,0,13,11,18,193,11,0,68,0,0,0,0,0,0,0,0,0,0,0,28,0,0,0,0,16,7,0,0,0,0,0,0,7,0,0,0,0,0,10,22,0,0,0,0,0,208,0,31,0,0,0,0,0,0,0,0,0,0
"FIN_004_MZB_LO_14","FIN_004_MZB_LO_14-19.10.2016","19.10.2016",2016,10,19,0,0,0,0,0,0,7,0,2,0,0,0,0,0,0,0,466,0,0,0,0,0,0,0,3,0,0,0,0,25,18,0,0,1,0,0,0,0,4,0,0,2,0,0,0,0,10,0,0,0,17,0,0,0,0,0,19,0,0,25,0,0,0,0,0,23,0,0,0,0,0,0,0,37,0,0,0,18,0,0,0,23,3,67,176,1,1,3,0,0,0,0,0,0,0,0,0,0,0,23,0,0,0,0,10,0,0,0,0,0,0,0,2,0,0,0,0,0,46,9,0,6,0,0,0,79,0,27,0,3,0,0,0,0,0,0,0,0
"FIN_004_MZB_LO_14","FIN_004_MZB_LO_14-18.09.2017","18.09.2017",2017,9,18,0,0,0,0,0,0,8,0,0,0,0,0,0,0,0,0,839,0,0,0,0,0,0,0,0,6,0,0,0,42,2,0,0,0,0,0,0,0,0,0,0,15,0,0,0,0,61,0,0,0,473,0,0,0,0,0,138,0,0,85,0,0,0,0,0,18,0,0,0,4,0,0,0,69,2,0,0,10,0,50,0,48,31,18,282,7,45,102,0,0,0,0,0,0,0,0,0,2,0,57,0,0,0,0,87,0,0,0,0,0,0,0,3,0,0,0,0,0,0,21,0,14,0,2,0,10,0,633,0,35,0,0,0,0,0,0,0,0
"FIN_004_MZB_LO_14","FIN_004_MZB_LO_14-19.09.2018","19.09.2018",2018,9,19,0,0,0,0,0,0,2,0,0,0,0,0,0,0,0,0,127,0,0,0,0,0,0,2,0,12,0,0,0,119,13,0,0,1,0,0,0,0,3,0,0,0,0,0,0,0,4,0,0,0,11,0,0,0,0,0,20,0,0,1,0,0,0,0,0,41,0,0,9,0,0,0,0,14,0,0,0,22,0,0,0,34,3,70,165,0,1,1,0,0,0,0,0,0,0,3,2,2,0,47,0,0,0,0,46,6,0,0,0,0,0,0,7,0,0,0,0,0,0,17,0,3,0,0,0,36,0,41,0,2,0,0,0,0,0,0,0,0
"FIN_004_MZB_LO_14","FIN_004_MZB_LO_14-20.11.2019","20.11.2019",2019,11,20,0,0,0,0,0,0,85,0,0,0,0,0,0,0,0,0,64,0,0,0,0,0,0,0,0,2,0,0,0,28,14,0,0,1,0,0,0,0,3,0,0,9,0,0,0,0,7,0,0,0,118,0,0,0,0,0,20,0,0,1,0,0,0,0,0,19,0,0,0,4,0,0,0,36,0,0,0,15,0,0,0,8,0,11,114,3,0,0,0,0,0,0,0,0,0,0,0,0,0,18,0,0,0,0,11,1,0,0,0,0,0,0,0,0,0,0,0,0,37,8,0,2,0,0,0,19,0,5,0,6,0,0,0,0,0,0,0,0
"FIN_004_MZB_LO_144","FIN_004_MZB_LO_144-01.10.2009","01.10.2009",2009,10,1,0,0,0,0,0,0,23,0,0,0,0,0,0,0,0,1,560,0,0,0,0,0,0,0,0,15,0,0,0,828,92,0,0,0,0,1,0,0,0,0,0,5,0,0,0,0,85,0,1,0,0,0,0,0,0,0,3,0,1,0,0,0,1,0,0,122,0,0,4,0,0,0,0,111,2,0,0,15,16,21,0,118,9,258,268,12,24,0,0,0,0,0,0,0,0,0,1,0,0,63,2,0,0,0,13,7,0,0,0,0,0,0,30,0,0,0,0,0,2,4,0,2,0,0,1,14,0,51,0,15,0,0,0,0,0,0,0,0
"FIN_004_MZB_LO_144","FIN_004_MZB_LO_144-15.09.2010","15.09.2010",2010,9,15,0,0,0,0,0,0,0,0,0,0,0,0,0,1,0,0,97,0,0,0,0,0,0,0,0,21,0,0,0,104,7,0,0,2,0,0,0,0,5,0,0,9,0,0,0,0,33,0,0,0,0,0,0,0,0,0,1,0,1,0,0,0,1,0,0,94,0,0,2,2,0,0,0,68,0,0,0,7,19,9,0,36,3,138,448,2,2,0,0,0,0,0,1,0,0,17,5,3,0,52,0,0,0,0,69,13,0,0,0,0,0,0,14,0,0,1,0,0,0,5,0,11,0,2,0,7,1,27,0,5,0,1,0,0,0,0,0,0
"FIN_004_MZB_LO_144","FIN_004_MZB_LO_144-29.09.2011","29.09.2011",2011,9,29,0,0,0,0,0,0,8,0,0,0,0,0,0,1,0,0,178,0,0,0,0,0,0,1,0,23,0,0,0,278,12,0,0,5,1,0,0,0,2,0,0,5,0,0,0,0,122,0,0,0,1,0,0,0,0,0,1,0,1,1,0,0,2,0,0,23,0,0,2,3,0,0,0,22,1,0,0,16,16,2,0,60,13,119,180,21,3,0,0,0,0,0,1,0,0,2,0,0,0,42,0,0,0,0,35,29,0,0,0,0,0,0,26,0,0,0,1,0,0,9,0,5,0,4,0,4,0,28,0,2,0,6,0,0,0,0,0,0
"FIN_004_MZB_LO_144","FIN_004_MZB_LO_144-10.09.2012","10.09.2012",2012,9,10,0,0,0,0,0,0,1,0,0,0,0,0,0,0,0,0,18,0,0,0,0,0,0,0,0,0,0,0,0,12,1,0,0,0,0,0,0,0,1,0,0,4,0,0,0,0,63,0,0,0,0,0,1,0,0,0,0,0,1,0,0,0,0,0,0,37,0,0,0,0,0,0,0,27,0,0,0,2,0,7,0,17,0,46,153,8,0,0,0,0,0,0,0,0,0,0,0,0,0,53,0,0,0,0,21,0,0,0,0,0,0,0,20,0,0,0,0,0,0,6,0,3,0,0,0,19,0,10,0,0,0,0,0,0,0,0,0,0
"FIN_004_MZB_LO_144","FIN_004_MZB_LO_144-09.09.2013","09.09.2013",2013,9,9,0,0,0,0,0,0,0,0,0,0,0,0,0,3,0,0,81,0,0,0,0,0,0,0,0,2,0,0,0,49,1,0,0,2,0,0,0,0,0,0,0,1,0,0,0,0,50,0,3,0,0,0,0,0,0,0,0,0,0,0,0,0,1,0,0,23,0,0,0,0,0,0,0,11,1,0,0,1,14,8,0,19,5,17,33,5,0,0,0,0,0,0,0,0,0,4,0,0,0,9,0,0,0,0,3,1,0,0,0,0,0,0,21,0,0,0,0,0,0,1,0,3,0,1,0,0,0,5,0,0,0,0,0,0,0,0,0,0
"FIN_004_MZB_LO_144","FIN_004_MZB_LO_144-01.10.2015","01.10.2015",2015,10,1,0,0,0,0,0,0,10,0,0,0,0,0,0,0,0,0,704,0,0,0,0,0,0,0,0,2,0,0,0,67,2,0,0,1,0,0,0,0,0,0,0,8,0,0,0,0,36,0,1,0,0,0,1,0,0,0,0,0,1,0,0,0,0,0,0,96,0,0,0,0,0,0,0,53,0,0,0,14,16,1,0,18,0,24,295,9,0,0,0,0,0,0,0,0,0,0,2,0,0,29,0,0,0,0,8,3,0,0,0,0,0,0,9,0,0,0,0,0,1,17,0,13,0,1,0,91,0,6,0,4,0,1,0,0,0,0,0,0
"FIN_004_MZB_LO_144","FIN_004_MZB_LO_144-05.09.2016","05.09.2016",2016,9,5,0,0,0,0,0,0,2,0,0,0,0,0,0,0,0,0,66,0,0,0,0,0,0,0,0,0,0,0,0,4,17,0,0,0,0,0,0,0,0,0,0,1,0,0,0,0,132,0,1,0,0,0,2,0,0,0,1,0,2,2,0,0,0,0,0,248,0,0,2,4,0,0,0,20,0,0,0,6,0,6,0,39,0,13,85,0,0,0,0,0,0,0,1,0,0,0,3,0,0,20,0,0,0,0,12,0,0,0,0,0,0,0,2,0,0,0,0,0,0,6,0,8,0,1,0,68,0,19,0,2,0,0,0,0,0,0,0,0
"FIN_004_MZB_LO_144","FIN_004_MZB_LO_144-26.09.2017","26.09.2017",2017,9,26,0,0,0,0,0,0,2,0,0,0,0,0,0,0,0,0,236,0,0,0,0,0,0,0,0,0,0,0,0,7,1,0,0,0,0,0,0,0,0,0,0,7,0,0,0,0,429,0,42,0,0,0,2,0,0,0,7,0,5,0,0,0,1,0,0,41,0,0,0,0,0,0,0,33,0,0,0,2,0,41,0,281,1,10,463,2,3,0,0,0,0,0,5,0,0,0,1,0,0,50,0,0,0,0,41,0,0,0,0,0,0,0,6,0,0,0,0,0,4,22,0,0,0,0,0,15,0,18,0,0,0,0,0,0,2,0,0,0
"FIN_004_MZB_LO_144","FIN_004_MZB_LO_144-19.09.2018","19.09.2018",2018,9,19,0,0,0,0,0,0,6,0,0,0,0,0,0,2,0,0,219,0,0,0,0,0,0,1,0,18,0,0,0,150,42,0,0,7,0,0,0,0,3,0,0,8,0,0,0,0,157,0,0,0,0,0,13,0,0,0,1,0,1,1,0,0,0,0,0,83,0,0,0,0,0,0,0,5,0,0,0,7,5,6,0,88,0,106,89,5,2,0,0,0,0,0,1,0,0,1,2,0,0,31,0,0,0,0,53,74,0,0,0,0,0,0,33,0,0,0,0,0,0,11,0,10,0,1,0,18,0,8,0,0,0,3,0,0,0,0,0,0
"FIN_004_MZB_LO_15","FIN_004_MZB_LO_15-09.09.2007","09.09.2007",2007,9,9,0,0,0,0,0,0,23,0,0,0,0,0,0,52,0,0,1,0,0,0,0,0,0,0,0,0,0,0,0,168,0,0,0,0,0,0,0,0,0,0,0,0,0,0,0,1,4,0,0,0,0,0,1,0,0,0,0,0,0,0,0,0,0,0,0,0,0,0,0,1,0,0,0,201,0,0,0,2,0,0,0,1,0,0,0,0,0,0,0,0,0,0,0,0,0,0,5,0,0,28,0,0,0,0,18,0,0,0,0,0,0,0,1,0,0,0,0,0,0,35,0,0,0,0,0,0,0,5,0,104,0,0,0,0,3,0,0,0
"FIN_004_MZB_LO_15","FIN_004_MZB_LO_15-14.09.2009","14.09.2009",2009,9,14,0,0,0,0,0,0,0,0,0,0,0,0,0,203,0,0,130,0,0,0,0,0,0,0,0,1,0,0,0,366,0,0,0,0,0,0,0,0,0,0,0,1,0,0,0,0,12,0,0,0,0,0,8,0,0,0,0,0,0,0,0,0,1,0,0,0,0,0,0,0,0,0,0,59,0,0,0,0,0,1,0,1,0,0,0,3,0,0,0,0,0,0,0,0,0,0,0,1,0,8,0,0,0,0,147,0,0,0,0,0,0,0,24,0,0,0,1,0,0,37,0,0,0,0,0,43,2,78,0,36,0,0,0,0,0,0,0,0
"FIN_004_MZB_LO_15","FIN_004_MZB_LO_15-29.09.2010","29.09.2010",2010,9,29,0,0,0,0,0,0,0,0,0,0,0,0,0,98,0,0,27,0,0,0,0,0,0,0,0,0,0,0,0,10,0,0,0,0,0,0,0,0,0,0,0,0,0,0,0,0,5,0,0,0,0,0,5,0,0,0,0,0,0,0,0,0,0,0,0,0,0,0,0,0,0,0,0,44,0,0,0,0,0,0,0,11,0,0,0,1,0,0,0,0,0,0,0,0,0,0,7,0,0,0,0,0,0,0,5,0,0,0,0,0,0,0,4,0,0,0,18,0,0,10,0,0,0,0,0,5,0,10,0,11,0,3,0,0,1,0,0,0
"FIN_004_MZB_LO_15","FIN_004_MZB_LO_15-08.09.2011","08.09.2011",2011,9,8,0,0,0,0,0,0,0,0,0,0,0,0,0,89,0,0,91,0,0,0,0,0,0,0,0,0,0,0,0,0,0,0,0,0,0,0,0,0,0,0,0,0,0,0,0,0,16,0,0,0,0,0,5,0,0,0,0,0,0,0,0,0,0,0,0,0,0,0,1,0,0,0,0,71,0,0,0,0,0,4,0,10,1,0,1,0,0,0,0,0,0,0,0,0,0,0,0,0,0,2,0,0,0,0,5,0,0,0,0,0,0,0,15,0,0,0,0,0,0,18,0,0,0,0,0,14,0,7,0,124,0,0,0,0,0,0,0,0
"FIN_004_MZB_LO_15","FIN_004_MZB_LO_15-16.09.2012","16.09.2012",2012,9,16,0,0,0,0,0,0,67,0,0,0,0,0,0,210,0,0,110,0,0,0,0,0,0,0,0,0,0,0,0,243,0,0,0,0,0,0,0,0,0,0,0,1,0,0,0,0,51,0,3,0,0,0,2,0,0,0,0,0,0,0,0,0,0,0,0,0,0,0,3,0,0,0,0,150,0,0,0,6,1,5,0,19,0,3,0,2,0,0,0,0,0,0,0,0,0,0,0,0,0,36,0,0,0,0,188,0,0,0,0,0,0,0,2,0,0,0,1,0,0,73,0,0,0,0,0,10,0,70,0,175,0,0,0,0,0,0,0,0
"FIN_004_MZB_LO_15","FIN_004_MZB_LO_15-23.09.2013","23.09.2013",2013,9,23,0,0,0,0,0,0,0,0,0,0,0,0,0,304,0,0,31,0,0,0,1,0,0,0,0,2,0,0,0,233,0,0,0,0,0,2,0,0,0,0,0,0,0,0,0,0,18,0,6,0,0,0,2,0,0,0,0,0,0,0,0,0,0,0,0,6,0,0,2,0,0,0,0,14,0,0,0,1,1,5,0,38,3,38,0,14,0,0,0,0,0,0,0,0,0,0,2,0,0,0,0,0,2,0,502,0,0,0,0,0,0,0,15,0,0,0,19,0,0,25,0,0,0,0,0,0,0,46,0,46,0,2,0,0,4,0,0,0
"FIN_004_MZB_LO_15","FIN_004_MZB_LO_15-07.09.2015","07.09.2015",2015,9,7,0,0,0,0,0,0,0,0,0,0,0,0,0,1171,0,0,19,0,0,0,0,0,0,0,0,0,0,0,0,75,0,0,0,0,2,0,0,0,0,0,0,1,0,0,3,0,68,0,1,0,0,0,14,0,0,0,0,0,0,0,0,0,0,0,0,0,0,0,5,0,0,0,0,16,0,0,0,0,0,1,0,6,1,1,1,12,0,0,0,0,0,0,0,0,0,0,0,0,0,3,0,0,0,0,19,0,0,0,0,0,0,0,12,0,0,0,3,0,0,6,0,0,0,0,0,6,0,25,0,92,0,0,0,0,1,0,0,0
"FIN_004_MZB_LO_15","FIN_004_MZB_LO_15-20.09.2016","20.09.2016",2016,9,20,0,0,0,0,0,0,1,0,0,0,0,0,0,187,0,0,12,0,0,0,0,0,0,0,0,1,0,0,0,19,0,1,0,0,1,0,0,0,0,0,0,0,0,0,0,0,21,0,2,0,0,0,0,0,0,0,0,0,0,0,0,0,0,0,0,6,0,0,2,0,0,0,0,2,0,0,0,0,0,1,0,4,0,0,0,3,0,0,0,0,0,0,0,0,0,0,2,0,0,16,0,0,0,0,30,0,0,0,0,0,0,0,0,0,0,0,3,0,0,11,0,0,0,0,0,5,0,7,0,322,0,0,0,0,0,0,0,0
"FIN_004_MZB_LO_15","FIN_004_MZB_LO_15-25.09.2017","25.09.2017",2017,9,25,0,0,0,0,0,0,0,0,0,0,0,0,0,36,0,0,5,0,0,0,0,0,0,0,0,1,0,0,0,177,0,0,0,0,0,0,0,0,1,0,1,0,0,0,0,0,41,0,3,0,0,0,23,0,0,0,0,0,0,0,0,0,0,0,0,1,0,0,2,1,0,0,0,1,0,0,0,0,1,0,0,12,0,0,0,10,0,0,0,0,0,0,0,0,0,0,1,0,0,4,0,0,0,0,160,0,0,0,0,0,0,0,1,0,0,0,3,0,0,16,0,0,0,0,0,0,0,11,0,26,0,6,0,0,6,0,0,0
"FIN_004_MZB_LO_15","FIN_004_MZB_LO_15-05.09.2018","05.09.2018",2018,9,5,0,0,0,0,0,0,0,0,0,0,0,0,0,15,0,0,26,0,0,0,0,0,0,0,0,1,0,0,0,1441,0,0,0,0,0,0,0,0,0,0,0,0,0,0,6,0,1,0,0,0,0,0,1,0,0,0,0,0,0,0,0,0,0,0,0,1,0,0,20,0,0,0,0,0,0,0,0,0,0,0,0,85,1,0,0,1,0,0,0,0,0,0,0,0,0,0,3,0,0,0,0,0,0,0,58,0,0,0,0,0,0,0,0,0,0,0,4,0,0,28,0,0,0,0,0,9,0,13,0,16,0,3,0,0,0,0,0,0
"FIN_004_MZB_LO_15","FIN_004_MZB_LO_15-18.09.2019","18.09.2019",2019,9,18,0,0,0,0,0,0,0,0,0,0,0,0,0,1697,0,0,14,0,0,0,0,0,0,0,0,48,0,0,0,11157,0,0,0,0,0,0,0,0,3,0,0,0,0,0,11,0,84,0,37,0,0,0,25,0,0,0,0,0,0,0,0,0,0,0,0,1,0,0,116,0,0,0,0,117,0,0,0,0,1,0,0,77,38,38,0,12,0,0,0,0,0,0,0,0,3,0,86,5,0,4,0,0,0,0,290,0,0,0,0,0,0,0,6,0,0,0,34,0,0,4,0,0,0,0,0,211,0,537,0,11,0,69,0,0,2,0,0,0
"FIN_004_MZB_LO_15","FIN_004_MZB_LO_15-10.09.2020","10.09.2020",2020,9,10,0,0,0,0,0,0,0,0,0,0,0,0,0,496,0,0,6,0,0,0,0,0,0,0,0,1,0,0,0,258,0,0,0,0,0,0,0,0,0,0,0,0,0,0,0,0,28,0,0,0,0,0,18,0,0,1,0,1,0,0,0,0,0,0,0,0,0,0,8,0,0,0,0,132,0,0,0,0,0,5,0,50,1,0,0,2,0,0,0,0,0,0,0,0,0,0,3,2,0,0,0,0,0,0,21,0,0,0,0,0,0,0,2,0,0,0,19,0,0,23,0,0,0,0,0,239,0,4,0,28,0,0,0,0,7,0,0,0
"FIN_004_MZB_LO_152","FIN_004_MZB_LO_152-12.10.2005","12.10.2005",2005,10,12,0,0,0,0,0,0,0,0,0,0,0,0,0,1,0,0,0,0,0,0,0,0,0,0,0,0,0,0,0,12,0,0,0,0,0,0,0,0,0,0,0,0,0,0,0,0,1,0,0,0,0,0,0,0,0,0,0,0,0,0,0,0,0,0,0,0,0,0,0,0,0,0,0,33,0,0,0,0,0,0,0,0,0,0,0,0,0,0,0,0,0,0,0,0,0,0,0,0,0,5,0,0,0,0,35,0,0,0,0,0,0,0,0,0,0,0,1,0,0,8,0,0,0,0,0,3,0,0,0,13,0,0,0,0,0,0,0,0
"FIN_004_MZB_LO_152","FIN_004_MZB_LO_152-06.10.2009","06.10.2009",2009,10,6,0,0,0,0,0,0,0,0,0,0,0,0,0,4,0,0,26,0,0,0,0,0,0,0,0,0,0,0,0,924,0,0,0,0,0,0,0,0,0,0,0,0,0,0,0,0,0,0,1,0,0,0,0,0,0,0,0,0,0,0,0,0,0,0,0,8,0,0,0,0,0,0,0,280,0,0,0,0,0,8,0,3,0,0,0,0,0,0,0,0,0,0,0,0,0,0,0,0,0,3,0,0,0,0,30,0,0,0,0,0,0,0,60,0,0,0,4,0,0,89,0,0,0,0,0,5,0,1,0,41,0,1,0,0,0,0,0,0
"FIN_004_MZB_LO_152","FIN_004_MZB_LO_152-13.10.2010","13.10.2010",2010,10,13,0,0,0,0,0,0,0,0,0,0,0,0,0,14,0,0,0,0,0,0,0,0,0,0,0,0,0,0,0,23,0,0,0,0,0,0,0,0,0,0,0,0,0,0,0,0,0,0,0,0,0,0,0,0,0,0,0,0,0,0,0,0,0,0,0,1,0,0,0,0,0,0,0,33,0,0,0,0,0,6,0,1,0,0,0,0,0,0,0,0,0,0,0,0,0,0,2,0,0,3,0,0,0,0,0,0,0,0,0,0,0,0,0,0,0,0,0,0,0,2,0,0,0,0,0,2,0,0,0,22,0,4,0,0,0,0,0,0
"FIN_004_MZB_LO_152","FIN_004_MZB_LO_152-13.11.2011","13.11.2011",2011,11,13,0,0,0,0,0,0,0,0,0,0,0,0,0,4,0,0,0,0,0,0,0,0,0,0,0,0,0,0,0,3,0,0,0,0,0,0,0,0,0,0,0,0,0,0,0,0,0,0,0,0,0,0,0,0,0,0,0,0,0,0,0,0,0,0,0,4,0,0,0,0,0,0,0,47,0,0,0,0,0,1,0,0,0,0,0,0,0,0,0,0,0,0,0,0,0,0,0,0,0,0,0,0,0,0,12,0,0,0,0,0,0,0,0,0,0,0,0,0,0,7,0,0,0,0,0,0,0,7,0,6,0,0,0,0,0,0,0,0
"FIN_004_MZB_LO_152","FIN_004_MZB_LO_152-22.09.2013","22.09.2013",2013,9,22,0,0,0,0,0,0,0,0,0,0,0,0,0,11,0,0,59,0,0,0,0,0,3,0,0,0,0,0,0,4220,0,0,0,0,0,0,0,0,0,0,0,0,0,0,0,0,79,0,19,0,0,0,0,0,0,0,0,0,0,0,0,0,0,0,0,116,0,0,1,0,0,0,0,736,8,0,0,0,0,56,0,41,9,1,0,0,0,0,0,0,0,0,0,0,0,0,26,43,0,0,0,0,0,0,113,0,0,0,0,0,0,0,223,0,0,0,0,0,0,219,0,0,0,0,0,20,0,29,1,156,0,0,0,0,0,0,0,0
"FIN_004_MZB_LO_152","FIN_004_MZB_LO_152-15.09.2014","15.09.2014",2014,9,15,0,0,0,0,0,0,0,0,0,0,0,0,0,8,0,0,23,0,0,0,0,0,1,0,0,0,0,0,0,449,0,0,0,0,0,0,0,0,0,0,0,0,0,0,0,0,8,0,4,0,0,0,0,0,0,0,0,0,0,0,0,0,0,0,0,1,0,0,0,0,0,0,0,1661,0,0,0,0,0,2,0,2,3,0,0,0,0,0,0,0,0,0,0,0,0,0,2,2,0,0,0,0,0,0,3,0,0,0,0,0,0,0,21,0,0,0,2,0,0,20,0,0,0,0,0,98,0,10,0,19,0,0,0,0,0,0,0,0
"FIN_004_MZB_LO_152","FIN_004_MZB_LO_152-01.10.2017","01.10.2017",2017,10,1,0,0,0,0,0,0,0,0,0,0,0,0,0,0,0,0,3,0,0,0,0,0,0,0,0,0,0,0,0,30,0,0,0,0,0,0,0,0,0,0,0,0,0,0,0,0,2,0,1,0,0,0,0,0,0,0,0,0,0,0,0,0,0,0,0,2,0,0,0,0,0,0,0,48,0,0,0,0,0,3,0,0,0,0,0,0,0,0,0,0,0,0,0,0,0,0,0,1,0,0,0,0,0,0,66,0,0,0,0,0,0,0,0,0,0,0,2,0,0,11,0,0,0,0,0,20,0,1,0,5,0,0,0,0,0,0,0,0
"FIN_004_MZB_LO_152","FIN_004_MZB_LO_152-09.09.2020","09.09.2020",2020,9,9,0,0,0,0,0,0,0,0,0,0,0,0,0,21,0,0,74,0,0,0,2,0,28,0,0,0,0,0,0,354,0,0,0,0,0,0,0,0,0,0,0,0,0,0,0,0,16,0,0,0,0,0,1,0,0,0,0,0,0,0,0,0,0,0,0,8,0,0,0,0,0,0,0,945,25,0,0,0,0,1,0,3,1,0,0,0,0,0,0,0,0,0,0,0,0,0,2,6,0,0,0,0,0,0,69,0,2,0,0,0,1,0,20,0,0,0,0,0,0,20,0,0,0,0,0,38,0,11,0,22,0,0,0,0,3,0,0,0
"FIN_004_MZB_LO_153","FIN_004_MZB_LO_153-01.09.2009","01.09.2009",2009,9,1,0,0,0,0,0,10,19,0,0,0,0,0,0,0,0,105,469,0,0,0,14,0,0,0,37,0,0,0,0,974,12,0,0,0,0,0,0,0,15,0,0,44,0,0,0,0,1216,0,46,0,601,0,0,0,0,0,2,0,0,91,0,0,0,0,0,90,0,0,36,35,0,0,0,2,0,0,0,92,6,0,0,22,2,20,406,0,0,65,0,0,0,0,67,0,0,0,0,0,0,56,0,0,0,0,32,574,0,0,2,0,0,0,20,0,380,10,0,0,0,82,0,20,0,4,0,16,0,0,0,247,0,4,0,0,0,0,0,0
"FIN_004_MZB_LO_153","FIN_004_MZB_LO_153-09.09.2011","09.09.2011",2011,9,9,0,0,0,0,0,330,176,0,0,0,0,0,0,0,0,45,3657,0,0,0,28,0,0,0,102,2,0,0,0,1381,50,0,0,0,0,0,0,0,148,0,0,44,0,0,0,0,1972,0,18,0,279,0,0,0,0,0,8,0,0,94,0,0,0,0,0,124,0,0,42,0,0,0,0,10,0,0,0,57,0,0,0,68,0,88,611,4,4,138,0,0,0,0,2725,0,0,0,0,0,0,31,0,0,0,0,31,15,0,0,0,0,0,0,43,0,535,6,0,0,0,86,0,45,0,0,1,32,0,0,0,274,0,6,0,0,0,0,3,0
"FIN_004_MZB_LO_153","FIN_004_MZB_LO_153-03.09.2014","03.09.2014",2014,9,3,0,0,0,0,0,0,5,0,0,0,0,0,0,0,0,91,29,0,0,0,10,0,0,0,0,0,0,0,0,12,0,0,0,0,0,0,0,0,1,0,0,22,0,0,0,0,888,0,6,0,17,0,0,0,0,0,2,0,0,69,0,0,0,0,0,33,0,0,1,0,0,0,0,5,1,0,0,43,0,0,0,2,0,2,119,0,0,63,0,0,0,0,5,0,0,0,0,0,0,3,0,0,0,0,0,11,0,0,0,0,0,0,7,0,102,0,0,0,0,2,0,8,0,0,0,0,0,0,0,129,0,0,0,0,0,0,2,0
"FIN_004_MZB_LO_153","FIN_004_MZB_LO_153-07.09.2016","07.09.2016",2016,9,7,0,0,0,0,0,14,8,0,0,0,0,0,0,0,0,19,52,0,0,0,1,0,0,0,9,0,0,0,0,46,0,0,0,0,0,1,0,0,3,0,0,13,0,0,0,0,519,0,0,1,13,0,0,0,0,1,5,0,0,14,0,0,0,0,0,23,0,0,1,15,0,0,0,0,0,0,0,10,1,0,0,5,0,19,95,1,0,1,0,0,0,0,6,0,0,0,0,0,0,41,0,0,0,0,11,8,0,0,0,0,0,0,11,0,40,0,0,0,0,6,0,8,0,0,4,1,0,0,0,39,0,0,0,0,0,0,0,0
"FIN_004_MZB_LO_153","FIN_004_MZB_LO_153-24.08.2017","24.08.2017",2017,8,24,0,0,1,0,0,0,0,0,0,0,0,0,0,2,0,31,8,0,0,0,0,0,0,0,0,0,0,0,0,1,0,0,0,0,0,0,0,0,2,0,0,19,0,0,0,0,516,0,0,1,14,0,0,0,0,0,3,0,0,20,0,0,0,0,0,12,0,0,0,6,0,0,0,3,0,0,0,0,0,0,0,6,0,2,144,0,0,6,0,0,0,0,0,0,0,0,0,0,0,2,0,0,0,0,0,0,0,0,0,0,0,0,36,0,2,0,0,0,0,13,0,9,16,0,1,0,0,3,0,23,0,0,0,0,0,0,0,0
"FIN_004_MZB_LO_153","FIN_004_MZB_LO_153-23.09.2020","23.09.2020",2020,9,23,0,0,0,0,0,84,52,0,0,0,0,0,0,0,0,0,936,0,0,0,0,0,0,0,112,0,0,0,0,872,8,0,0,0,0,0,0,0,28,0,0,24,0,0,0,0,466,0,0,0,196,0,0,0,0,0,12,0,0,0,0,0,0,0,0,64,0,0,0,20,0,0,0,12,0,0,0,32,4,0,0,24,0,24,488,16,0,12,0,0,0,0,0,0,0,0,0,0,0,32,0,0,0,0,0,0,0,0,0,0,0,0,4,0,368,0,0,0,0,204,0,16,4,0,0,12,0,0,0,28,0,0,0,0,0,0,0,0
"FIN_004_MZB_LO_153","FIN_004_MZB_LO_153-09.09.2021","09.09.2021",2021,9,9,0,0,0,0,0,39,9,0,0,0,0,0,0,0,0,10,67,0,0,0,0,0,0,0,19,0,0,0,0,32,3,0,0,0,0,0,0,0,16,0,0,4,0,0,0,0,430,0,0,0,2,0,0,0,0,0,5,0,0,4,0,0,0,0,0,31,0,0,0,9,0,0,0,0,0,0,0,12,1,0,0,6,0,32,43,0,0,24,0,0,0,0,5,0,0,0,0,0,0,10,0,0,0,0,16,13,0,0,0,0,0,0,25,0,6,0,0,0,0,8,0,4,0,0,1,4,0,0,0,27,0,2,0,0,0,0,0,0
"FIN_004_MZB_LO_154","FIN_004_MZB_LO_154-19.10.2008","19.10.2008",2008,10,19,0,0,0,0,0,0,0,0,0,0,0,0,0,0,0,0,2,0,0,0,0,0,0,0,0,5,0,0,0,28,0,0,0,0,0,0,0,0,0,0,0,3,0,0,0,0,0,0,1,0,8,0,0,0,0,0,0,0,0,0,0,0,0,0,0,0,0,0,0,0,0,0,0,0,0,0,0,3,0,0,0,0,0,22,5,0,0,1,0,0,0,0,0,0,0,0,0,0,0,35,0,0,0,0,3,0,0,0,0,0,0,0,4,0,0,0,0,0,0,2,0,0,0,0,0,152,0,0,0,0,0,0,0,0,0,0,0,0
"FIN_004_MZB_LO_154","FIN_004_MZB_LO_154-22.09.2009","22.09.2009",2009,9,22,0,0,0,0,0,0,0,0,0,0,0,0,0,1,0,0,0,0,0,0,0,0,0,0,1,17,0,0,0,19,0,0,0,0,0,0,0,0,0,0,0,4,0,0,0,0,0,0,5,0,0,0,0,0,0,0,0,0,0,0,0,0,0,0,0,0,0,0,0,0,0,0,0,0,0,0,0,0,0,0,0,0,0,0,0,0,0,0,0,0,0,0,0,0,0,0,0,0,0,0,0,0,0,0,22,0,0,0,0,0,0,0,1,0,0,0,0,0,0,0,0,0,0,2,0,10,0,0,0,0,0,0,0,0,0,0,0,0
"FIN_004_MZB_LO_154","FIN_004_MZB_LO_154-17.10.2012","17.10.2012",2012,10,17,0,0,0,0,0,0,0,0,0,0,0,0,0,0,0,0,6,0,0,0,0,0,0,0,0,0,0,0,0,30,0,0,0,0,0,0,0,0,1,0,0,0,0,0,0,0,0,0,0,0,0,0,0,0,0,0,0,0,0,0,0,0,0,0,0,0,0,0,0,0,0,0,0,0,1,0,0,0,0,0,0,0,0,11,0,1,0,0,0,0,0,0,0,0,0,0,0,0,0,1,0,0,0,0,3,0,1,0,0,0,0,0,25,0,0,0,0,0,0,0,0,0,0,0,0,41,0,1,0,0,0,0,0,0,0,0,0,0
"FIN_004_MZB_LO_154","FIN_004_MZB_LO_154-31.08.2015","31.08.2015",2015,8,31,0,0,0,0,0,0,0,0,0,0,0,0,0,0,0,0,34,0,0,0,0,0,0,0,0,2,0,0,0,60,0,0,0,0,0,0,0,0,0,0,0,3,0,0,0,0,0,0,1,0,0,0,0,0,0,0,0,0,0,0,0,0,0,0,0,0,0,0,0,0,0,0,0,0,0,0,0,4,0,0,0,0,0,16,7,0,0,0,0,0,0,0,0,0,0,0,0,0,0,3,0,0,0,0,1,1,0,0,0,0,0,0,19,0,0,0,0,0,0,14,0,0,0,0,0,72,0,1,0,1,0,0,0,0,0,0,0,0
"FIN_004_MZB_LO_154","FIN_004_MZB_LO_154-04.09.2017","04.09.2017",2017,9,4,0,0,0,0,0,0,0,0,0,0,0,0,0,0,0,0,23,0,0,0,0,0,0,0,0,1,0,0,0,57,0,0,0,0,0,0,0,0,1,0,0,9,0,0,0,0,0,0,0,0,0,0,0,0,0,0,0,0,0,0,0,0,0,0,0,0,0,0,0,0,0,0,0,0,0,0,0,5,0,0,0,0,0,17,10,2,0,0,0,0,0,0,0,0,0,0,0,0,0,2,0,0,0,0,6,1,0,0,0,0,0,0,28,0,0,0,0,0,0,9,0,0,0,0,0,30,0,0,0,0,0,0,0,0,0,0,0,0
"FIN_004_MZB_LO_154","FIN_004_MZB_LO_154-16.09.2018","16.09.2018",2018,9,16,0,0,0,0,0,0,0,0,0,0,0,0,0,0,0,0,3,0,0,0,0,0,0,0,0,0,0,0,0,26,0,0,0,0,0,0,0,0,0,0,0,8,0,0,0,0,1,0,1,0,0,0,0,0,0,0,0,0,0,0,0,0,0,0,0,0,0,0,0,0,0,0,0,0,0,0,0,2,0,0,0,0,0,2,0,1,0,0,0,0,0,0,0,0,0,7,0,0,0,10,0,0,0,0,5,0,0,0,0,0,0,0,24,0,0,0,0,0,0,0,0,0,0,15,0,213,0,3,0,0,0,0,0,0,0,0,0,0
"FIN_004_MZB_LO_154","FIN_004_MZB_LO_154-03.10.2021","03.10.2021",2021,10,3,0,0,0,0,0,0,0,0,0,0,0,0,0,0,0,0,14,0,0,0,0,0,0,0,0,0,0,0,0,1,0,0,0,0,0,0,0,0,0,0,0,4,0,0,0,0,0,0,0,0,0,0,0,0,0,0,0,0,0,0,0,0,0,0,0,0,0,0,0,0,0,0,0,0,0,0,0,0,0,0,0,0,0,0,0,0,0,0,0,0,0,0,0,0,0,0,0,0,0,4,0,0,0,0,2,0,0,0,0,0,0,0,1,0,0,0,0,0,0,0,0,0,0,4,0,6,0,0,0,0,0,0,0,0,0,0,0,0
"FIN_004_MZB_LO_156","FIN_004_MZB_LO_156-20.10.2008","20.10.2008",2008,10,20,0,0,0,0,0,0,0,0,0,0,0,0,0,0,0,0,8,0,0,0,0,0,0,0,1,2,0,0,0,13,0,0,0,0,0,0,0,0,4,0,0,2,0,0,0,0,7,0,0,0,38,0,0,0,0,0,0,0,0,0,0,0,0,0,0,2,0,0,1,1,0,0,0,0,0,0,0,1,0,0,0,1,0,7,95,4,2,3,0,0,0,0,0,0,0,0,0,0,0,8,0,0,0,0,3,0,0,0,0,0,0,0,0,0,0,0,0,0,0,5,0,4,0,1,0,43,0,0,0,3,0,0,0,0,0,0,0,0
"FIN_004_MZB_LO_156","FIN_004_MZB_LO_156-23.09.2009","23.09.2009",2009,9,23,0,0,0,0,0,12,0,0,0,0,0,0,0,0,0,3,19,0,0,0,0,0,0,0,12,2,0,0,0,34,0,0,0,0,0,0,0,0,5,0,0,7,0,0,0,0,23,0,0,0,63,0,0,0,0,0,0,0,0,1,0,0,0,0,0,6,0,0,0,7,0,0,0,0,0,0,0,6,0,0,0,2,0,23,127,3,0,0,0,0,0,0,0,0,0,0,0,0,0,17,0,0,0,0,2,1,0,0,0,0,0,0,1,0,1,0,0,0,0,8,0,2,0,5,0,31,0,0,0,9,0,0,0,0,0,0,0,0
"FIN_004_MZB_LO_156","FIN_004_MZB_LO_156-16.10.2012","16.10.2012",2012,10,16,0,0,0,0,0,11,0,0,0,0,0,0,0,0,0,0,7,0,0,0,0,0,0,0,5,1,0,0,0,96,0,0,0,0,0,2,0,0,2,0,0,0,0,0,5,0,89,0,0,0,0,0,0,0,0,0,0,0,0,0,0,0,0,0,0,2,0,0,2,0,0,0,0,0,2,0,0,0,0,0,0,3,0,125,13,8,3,1,0,0,0,0,0,0,0,0,0,0,0,18,0,0,0,0,1,1,0,0,0,0,0,0,1,0,0,0,0,0,0,0,0,4,0,38,0,4,0,1,0,0,0,0,0,0,0,0,0,0
"FIN_004_MZB_LO_156","FIN_004_MZB_LO_156-31.08.2015","31.08.2015",2015,8,31,0,0,0,0,0,0,0,0,0,0,0,0,1,0,0,18,10,0,0,0,0,0,0,0,0,1,0,0,0,28,0,0,0,0,0,0,0,0,10,0,0,14,0,0,1,0,25,0,0,0,3,0,0,0,0,0,0,0,0,3,0,0,0,0,0,2,0,0,0,9,0,0,0,0,0,0,0,3,0,0,0,0,0,27,102,2,5,8,0,0,0,0,0,0,0,0,0,0,0,15,0,0,0,0,1,1,0,0,0,0,0,0,8,0,10,0,0,0,0,3,0,6,0,8,0,11,0,0,0,6,0,0,0,0,0,0,0,0
"FIN_004_MZB_LO_156","FIN_004_MZB_LO_156-04.09.2017","04.09.2017",2017,9,4,0,0,0,0,0,3,0,0,0,0,0,0,0,0,0,18,26,0,0,0,0,0,0,0,1,12,0,0,0,50,0,0,0,0,0,2,0,0,12,0,0,12,0,0,1,0,175,0,0,0,46,0,0,0,0,0,0,0,0,1,0,0,0,0,0,3,0,0,3,67,0,0,0,2,0,0,0,21,0,0,0,9,0,43,122,1,7,1,0,0,0,0,3,0,0,0,0,0,0,59,0,0,0,0,14,3,0,0,0,0,0,0,3,0,4,0,1,0,0,7,0,4,0,5,0,30,0,0,0,37,0,0,0,0,0,0,0,0
"FIN_004_MZB_LO_156","FIN_004_MZB_LO_156-13.09.2018","13.09.2018",2018,9,13,0,0,0,0,0,60,16,0,0,0,0,0,0,0,0,34,250,0,0,0,0,0,0,0,48,2,0,0,0,120,0,0,0,0,0,0,0,0,23,0,0,10,0,0,6,0,130,0,0,0,20,0,0,0,0,0,0,0,0,0,0,0,0,0,0,2,0,0,0,16,0,0,0,0,2,0,0,28,0,0,0,18,0,12,1076,6,8,8,0,0,0,0,2,0,0,0,0,0,0,316,0,0,0,0,2,78,0,0,0,0,0,0,50,0,108,2,0,0,0,12,0,4,0,56,0,264,0,0,0,62,0,0,0,0,0,0,0,0
"FIN_004_MZB_LO_156","FIN_004_MZB_LO_156-03.10.2021","03.10.2021",2021,10,3,0,0,0,0,0,12,1,0,0,0,0,0,0,0,0,13,141,0,0,0,0,0,0,0,7,2,0,0,0,36,0,0,0,0,0,0,0,0,19,0,0,5,0,0,0,0,93,0,0,0,12,0,0,0,0,0,0,0,0,1,0,0,0,0,0,4,0,0,0,14,0,0,0,1,1,0,0,11,0,0,0,2,0,5,84,0,3,8,0,0,0,0,0,0,0,0,0,0,0,12,0,0,0,0,2,1,0,0,0,0,0,0,0,0,10,0,0,0,0,10,1,1,0,0,0,76,0,0,0,11,0,0,0,0,0,0,0,0
"FIN_004_MZB_LO_16","FIN_004_MZB_LO_16-07.09.2007","07.09.2007",2007,9,7,0,0,0,0,0,0,0,10,0,0,8,0,0,0,0,0,59,0,0,0,28,1,0,0,0,0,0,0,0,7,0,0,0,0,0,0,0,4,0,0,0,0,0,0,0,0,88,0,0,0,0,0,7,0,0,0,1,0,0,2,2,0,0,0,0,13,0,0,0,0,0,0,0,93,1,0,0,0,0,0,0,22,5,0,0,0,0,1,0,0,0,0,0,0,0,0,14,0,0,0,0,0,0,0,16,0,0,0,0,0,0,0,0,0,0,0,1,0,0,11,0,0,0,0,0,36,0,45,0,5,0,0,0,0,0,0,0,0
"FIN_004_MZB_LO_16","FIN_004_MZB_LO_16-28.09.2009","28.09.2009",2009,9,28,0,0,0,0,0,0,0,23,0,1,3,0,0,14,0,0,4067,0,0,0,2,1,0,4,0,18,0,0,0,1865,0,0,0,0,0,0,0,0,0,0,0,1,0,0,0,0,610,0,15,18,0,0,2,0,0,0,0,4,0,4,18,0,0,0,0,111,0,0,87,0,0,0,0,106,5,0,0,0,45,42,0,1079,48,34,0,44,0,20,0,0,0,0,0,0,0,0,28,0,0,31,0,0,0,0,1112,0,0,1,0,5,0,0,0,0,0,8,0,0,0,113,2,0,1,0,0,4049,0,52,0,139,0,2,0,0,0,0,0,0
"FIN_004_MZB_LO_16","FIN_004_MZB_LO_16-06.09.2012","06.09.2012",2012,9,6,0,0,0,0,0,0,0,1,0,0,4,0,0,4,0,0,114,0,0,0,2,2,0,0,0,0,0,0,0,34,0,0,0,0,0,0,0,0,0,0,0,0,0,0,0,0,25,0,0,1,0,0,0,0,0,0,0,0,0,0,3,0,0,0,0,2,0,0,4,0,0,0,0,55,0,0,0,0,0,0,0,151,6,2,0,3,0,26,0,0,0,0,0,0,0,0,13,0,0,2,0,0,0,0,15,0,0,0,0,0,0,0,0,0,0,0,0,0,0,8,0,0,0,0,0,6,1,47,0,6,0,4,0,0,0,0,0,0
"FIN_004_MZB_LO_16","FIN_004_MZB_LO_16-17.09.2014","17.09.2014",2014,9,17,0,0,0,0,0,0,0,6,0,0,0,0,0,2,0,0,237,0,0,0,15,3,0,0,0,3,0,0,0,32,0,0,0,0,0,0,0,0,0,0,0,0,0,0,0,0,364,0,0,0,0,0,0,0,0,0,0,0,0,0,6,0,0,0,0,1,0,0,41,0,0,0,0,37,0,0,0,0,230,15,0,296,14,0,0,2,0,23,0,0,0,0,0,0,0,0,21,0,0,3,0,0,0,0,6,0,0,0,0,0,0,0,0,0,0,6,0,0,0,3,0,0,0,0,0,61,0,46,0,8,0,2,0,0,0,0,0,0
"FIN_004_MZB_LO_16","FIN_004_MZB_LO_16-30.09.2015","30.09.2015",2015,9,30,0,0,0,0,0,0,0,0,0,0,2,0,0,0,0,0,650,0,0,0,0,0,0,0,0,6,0,0,0,286,0,0,0,0,0,0,0,0,0,0,0,0,0,0,0,0,58,0,17,0,0,0,2,0,0,0,0,0,0,0,6,0,0,0,0,4,0,0,7,0,0,0,0,95,0,0,0,0,139,0,0,44,2,0,0,0,0,0,0,0,0,0,0,0,0,0,15,0,0,0,0,0,0,0,0,0,0,0,0,0,0,0,0,0,0,0,0,0,0,60,0,0,0,0,0,713,0,11,0,6,0,0,0,0,0,0,0,0
"FIN_004_MZB_LO_16","FIN_004_MZB_LO_16-05.10.2016","05.10.2016",2016,10,5,0,0,0,0,0,0,0,2,0,0,42,0,0,2,0,0,157,0,0,0,6,0,0,4,0,0,0,0,0,11,0,0,0,0,0,0,0,0,0,0,0,0,0,0,0,0,229,0,0,0,0,0,2,0,0,0,0,0,0,1,10,0,0,0,0,94,0,0,0,0,0,0,0,81,0,0,0,0,3,1,0,230,4,0,0,2,0,9,0,0,0,0,0,0,0,0,10,0,0,0,0,0,0,0,22,0,0,2,0,0,0,0,2,0,0,0,1,0,0,5,0,2,0,0,0,134,0,4,0,6,0,0,0,0,3,0,0,0
"FIN_004_MZB_LO_16","FIN_004_MZB_LO_16-17.10.2018","17.10.2018",2018,10,17,0,0,0,0,0,0,0,0,0,0,1,0,0,0,0,0,17,0,0,0,115,0,0,1,0,0,0,0,0,4,0,0,0,0,0,0,0,0,0,1,0,0,0,0,0,0,12,0,0,22,0,0,0,0,0,0,0,0,0,0,7,0,0,0,0,24,0,0,0,0,0,0,0,57,0,0,0,0,0,2,0,106,2,1,0,5,0,25,0,0,0,0,0,0,0,0,6,0,0,0,0,0,0,0,37,0,0,0,0,0,0,0,6,0,0,0,0,0,0,4,0,0,0,0,0,32,0,4,0,0,0,1,0,0,0,0,0,0
"FIN_004_MZB_LO_16","FIN_004_MZB_LO_16-18.09.2019","18.09.2019",2019,9,18,0,0,0,0,0,0,0,0,0,0,68,0,0,26,0,0,958,0,0,0,96,12,4,0,0,62,0,0,0,1538,0,0,0,0,0,0,0,0,0,8,0,4,0,0,0,0,618,0,0,20,0,0,12,0,0,0,0,0,0,0,28,0,0,0,0,20,0,0,22,0,0,0,0,316,0,0,0,0,6,4,0,324,10,4,0,20,0,176,0,0,0,0,0,0,0,0,93,4,0,8,0,0,0,0,662,0,0,0,0,0,0,0,16,0,0,0,0,0,0,56,4,8,0,0,0,166,0,166,0,0,0,32,0,0,8,0,0,0
"FIN_004_MZB_LO_17","FIN_004_MZB_LO_17-23.09.2009","23.09.2009",2009,9,23,0,0,0,0,0,0,0,0,0,0,0,0,0,51,0,0,39,0,0,0,2,0,0,0,1,4,0,0,0,125,0,0,0,0,0,0,0,0,0,0,0,0,0,0,0,0,53,0,8,0,13,0,1,0,0,0,3,0,1,0,0,0,1,0,0,10,0,0,33,0,0,0,0,0,1,0,0,1,3,1,0,224,13,7,5,1,0,0,0,0,0,0,11,0,0,0,1,0,0,20,0,0,0,0,101,2,0,0,0,0,1,0,7,0,3,0,5,0,0,12,0,0,1,0,0,1,0,9,0,17,0,0,0,0,0,0,0,0
"FIN_004_MZB_LO_17","FIN_004_MZB_LO_17-10.10.2010","10.10.2010",2010,10,10,0,0,0,0,0,0,38,0,0,0,0,0,0,22,0,0,167,0,0,0,0,0,0,0,3,4,0,0,0,32,0,0,0,0,0,0,0,0,3,0,0,0,0,0,0,0,49,0,0,0,15,0,0,0,0,0,124,0,0,0,0,0,1,0,0,225,0,0,4,0,0,0,0,96,0,0,0,4,0,5,0,48,24,5,14,3,0,0,0,0,0,0,51,0,0,0,0,0,0,7,0,0,0,0,28,0,0,0,0,0,0,0,1,0,99,0,1,0,0,17,0,0,0,0,0,24,0,64,0,19,0,0,0,0,2,0,0,0
"FIN_004_MZB_LO_17","FIN_004_MZB_LO_17-19.09.2012","19.09.2012",2012,9,19,0,0,0,0,0,0,4,0,0,0,0,0,0,59,0,0,178,0,0,0,0,0,0,0,2,5,0,0,0,30,0,0,0,0,0,1,0,0,1,0,0,2,0,0,0,0,233,0,1,0,52,0,2,0,0,0,176,0,0,0,0,0,0,0,0,72,0,0,5,0,0,0,0,26,0,0,0,27,0,8,0,22,14,12,27,1,0,0,0,0,0,0,0,0,0,0,0,1,0,10,0,0,0,0,155,0,0,0,0,0,0,0,3,0,148,0,0,0,0,26,0,0,0,0,0,28,0,49,0,132,0,0,0,0,1,0,0,0
"FIN_004_MZB_LO_17","FIN_004_MZB_LO_17-09.09.2013","09.09.2013",2013,9,9,0,0,0,0,0,0,1,0,0,0,0,0,0,77,0,0,219,0,0,0,0,0,0,0,0,0,0,0,0,26,1,0,0,0,0,0,0,0,4,0,0,0,0,0,0,0,151,0,1,0,32,0,0,0,0,0,22,0,0,0,0,0,1,0,0,60,0,0,4,5,0,0,0,35,0,0,0,101,13,14,0,12,4,8,57,0,0,0,0,0,0,0,3,0,0,0,0,1,0,5,0,0,0,0,81,4,0,0,0,0,0,0,5,0,437,0,0,0,0,14,0,0,1,0,0,20,0,35,0,136,0,0,0,0,1,0,0,0
"FIN_004_MZB_LO_17","FIN_004_MZB_LO_17-16.09.2015","16.09.2015",2015,9,16,0,0,0,0,0,0,0,0,0,0,0,0,0,92,0,0,281,0,0,0,0,0,0,0,0,0,0,0,0,2,0,0,0,0,0,0,0,0,0,0,0,0,0,0,0,0,64,0,0,0,24,0,1,0,0,0,11,0,1,1,0,0,0,0,0,8,0,0,0,0,0,0,0,5,0,0,0,14,0,0,0,0,20,1,14,3,0,0,0,0,0,0,5,0,0,0,0,0,0,0,0,0,0,0,27,0,0,0,0,0,0,0,1,0,62,0,0,0,0,11,0,0,5,0,0,10,0,176,0,153,0,0,0,0,0,0,0,0
"FIN_004_MZB_LO_17","FIN_004_MZB_LO_17-06.09.2016","06.09.2016",2016,9,6,0,0,0,0,0,0,0,0,0,0,0,0,0,54,0,0,93,0,0,0,0,0,0,0,1,0,0,0,0,2,0,0,0,0,0,0,0,0,0,0,0,0,0,0,0,0,123,0,0,0,4,0,0,0,0,0,26,0,0,0,0,0,0,0,0,39,0,0,1,0,0,0,0,18,0,0,0,8,1,1,0,2,4,0,17,0,0,0,0,0,0,0,2,0,0,0,0,0,0,6,0,0,0,0,64,0,0,0,0,0,0,0,1,0,101,0,0,0,0,7,0,0,4,0,0,9,0,80,0,61,0,0,0,0,0,0,0,0
"FIN_004_MZB_LO_17","FIN_004_MZB_LO_17-04.09.2017","04.09.2017",2017,9,4,0,0,0,0,0,0,0,0,0,0,0,0,0,18,0,0,76,0,0,0,0,0,0,0,0,0,0,0,0,21,0,0,0,0,1,0,0,0,0,0,0,0,0,0,0,0,52,0,0,0,2,0,0,0,0,0,37,0,0,0,0,0,0,0,0,6,0,0,4,0,0,0,0,3,1,0,0,2,4,7,0,26,7,19,11,0,0,3,0,0,0,0,5,0,0,0,0,0,0,13,0,0,0,0,37,0,0,0,0,0,0,0,6,0,60,0,1,0,0,1,0,0,6,0,0,5,0,43,1,34,0,0,0,0,0,0,0,0
"FIN_004_MZB_LO_17","FIN_004_MZB_LO_17-05.09.2018","05.09.2018",2018,9,5,0,0,0,0,0,0,0,0,0,0,0,0,0,25,0,0,132,0,0,0,1,0,1,1,0,0,0,0,0,24,0,0,0,0,0,0,0,0,0,0,0,1,0,0,0,0,22,0,0,0,2,0,1,0,0,0,6,0,0,0,0,0,1,0,0,12,0,0,15,0,0,0,0,6,0,0,0,7,0,9,0,59,8,3,4,1,0,7,0,0,0,0,4,0,1,0,0,0,0,1,0,0,0,0,40,2,0,0,0,0,0,0,0,0,51,0,0,0,0,2,0,0,3,0,0,65,0,49,0,22,0,0,0,0,0,0,0,0
"FIN_004_MZB_LO_17","FIN_004_MZB_LO_17-23.09.2019","23.09.2019",2019,9,23,0,0,0,0,0,0,65,0,0,0,0,0,0,210,0,0,708,0,0,0,17,0,165,3,3,7,0,0,0,300,5,0,0,0,0,0,0,0,1,0,0,2,0,0,1,0,356,1,1,0,135,0,1,0,0,0,50,0,0,0,0,0,0,0,0,68,0,0,248,0,0,0,0,36,0,0,0,140,0,53,0,120,11,72,40,9,0,17,0,0,0,0,39,0,1,0,0,1,0,3,0,0,0,0,210,34,0,0,0,0,0,0,10,0,248,0,0,0,0,28,0,0,0,0,0,242,0,295,16,166,0,3,0,0,0,0,0,0
"FIN_004_MZB_LO_17","FIN_004_MZB_LO_17-28.09.2020","28.09.2020",2020,9,28,0,0,0,0,0,0,52,0,0,0,0,0,0,42,0,0,273,0,0,0,1,0,68,1,4,2,0,0,0,140,2,0,0,0,0,0,0,0,0,5,0,4,0,0,0,0,453,0,0,0,55,0,0,0,0,0,298,0,0,0,0,0,0,0,0,107,0,0,36,0,0,0,0,23,0,0,0,56,18,15,0,17,10,39,8,3,0,2,0,0,0,0,11,0,0,0,2,2,0,2,0,0,0,0,17,2,0,0,0,0,0,0,14,0,20,1,1,0,0,14,0,0,2,0,0,38,0,149,0,113,0,0,0,0,1,0,0,0
"FIN_004_MZB_LO_18","FIN_004_MZB_LO_18-25.09.2006","25.09.2006",2006,9,25,0,0,0,0,0,0,19,0,0,0,0,0,0,9,0,0,309,0,0,0,0,0,0,2,0,35,0,0,0,238,0,0,0,0,0,0,0,0,3,0,0,0,0,0,0,0,86,0,16,2,19,0,1,0,0,0,0,0,0,0,0,0,0,0,0,53,0,0,0,0,0,0,0,166,0,0,1,37,1,0,0,14,9,9,143,0,0,0,0,0,0,0,9,0,0,0,2,0,0,17,0,0,0,0,167,5,0,0,0,0,0,0,0,0,130,0,9,0,0,40,0,0,0,0,0,54,0,52,0,4,0,0,0,0,0,0,0,0
"FIN_004_MZB_LO_18","FIN_004_MZB_LO_18-21.09.2009","21.09.2009",2009,9,21,0,0,0,0,0,0,0,0,0,0,0,0,0,20,0,0,73,0,0,0,0,0,0,0,1,3,0,0,0,6,3,0,0,0,0,0,0,0,2,0,0,0,0,0,0,0,32,0,7,0,7,0,2,0,0,0,18,0,0,0,0,0,0,0,0,57,0,0,15,0,0,0,0,27,0,0,0,0,1,0,0,48,7,0,10,0,0,0,0,0,0,0,42,0,0,0,0,2,0,0,0,0,0,0,121,57,0,0,0,0,0,0,2,0,15,0,0,0,0,5,0,0,0,0,0,2,0,130,0,1,0,1,0,0,1,0,0,0
"FIN_004_MZB_LO_18","FIN_004_MZB_LO_18-10.10.2010","10.10.2010",2010,10,10,0,0,0,0,0,0,8,0,0,0,0,0,0,39,0,0,73,0,0,0,0,0,1,0,0,14,0,0,0,5,18,0,0,0,0,0,0,0,20,0,0,0,0,0,0,0,91,0,3,0,18,0,7,0,0,0,125,0,0,0,0,0,1,0,0,228,0,0,0,0,0,0,0,166,0,0,0,10,0,1,0,21,7,0,37,2,0,2,0,0,0,0,108,0,0,0,0,0,0,3,0,0,0,0,156,2,0,0,0,0,0,0,0,0,10,0,0,0,0,20,0,1,0,0,0,21,0,245,0,5,0,0,0,0,7,0,0,0
"FIN_004_MZB_LO_18","FIN_004_MZB_LO_18-13.09.2012","13.09.2012",2012,9,13,0,0,0,0,0,0,3,0,0,0,0,0,0,14,0,0,58,0,0,0,0,0,0,0,0,1,0,0,0,10,2,0,0,0,0,0,0,0,1,0,0,0,0,0,0,0,74,0,4,0,35,0,1,0,0,0,31,0,1,0,0,0,0,0,0,16,0,0,2,0,0,0,0,97,0,0,0,35,0,1,0,10,4,1,34,1,0,1,0,0,0,0,11,0,0,0,0,1,0,4,0,0,0,0,110,0,0,0,0,0,0,0,1,0,126,0,0,0,0,13,0,0,0,0,0,23,0,66,0,37,0,0,0,0,0,0,0,0
"FIN_004_MZB_LO_18","FIN_004_MZB_LO_18-09.09.2013","09.09.2013",2013,9,9,0,0,0,0,0,0,2,0,0,0,0,0,0,3,0,0,164,0,0,0,1,0,0,2,0,3,0,0,0,38,4,0,0,0,0,0,0,0,0,0,0,0,0,0,0,0,104,0,51,0,41,0,0,0,0,0,71,0,2,0,0,0,0,0,0,55,0,0,6,2,0,0,0,137,0,0,0,16,7,0,0,37,19,0,35,0,0,4,0,0,0,0,18,0,0,0,0,13,0,2,0,0,0,0,314,3,0,0,0,0,0,0,2,0,62,0,0,0,0,13,0,0,0,0,0,16,0,93,0,18,0,0,0,0,0,0,0,0
"FIN_004_MZB_LO_18","FIN_004_MZB_LO_18-06.09.2016","06.09.2016",2016,9,6,0,0,0,0,0,0,0,0,0,0,0,0,0,4,0,0,43,0,0,0,0,0,0,0,0,0,0,0,0,8,1,0,0,1,0,0,0,0,1,0,0,2,0,0,0,0,35,0,6,0,22,0,0,0,0,0,29,0,0,0,0,0,0,0,0,44,0,0,1,0,0,0,0,67,0,0,0,3,0,0,0,7,1,1,15,1,0,1,0,0,0,0,7,0,0,0,0,2,0,2,0,0,0,0,28,0,0,0,0,0,0,0,2,0,46,0,0,0,0,9,0,0,0,0,0,11,0,39,0,16,0,0,0,0,0,0,0,0
"FIN_004_MZB_LO_18","FIN_004_MZB_LO_18-04.09.2017","04.09.2017",2017,9,4,0,0,0,0,0,0,0,0,0,0,0,0,0,7,0,0,37,0,0,0,0,0,0,0,0,0,0,0,0,18,0,0,0,0,0,0,0,0,0,0,0,2,0,0,0,0,19,0,0,0,21,0,0,0,0,0,15,0,0,0,0,0,0,0,0,14,0,0,2,0,0,0,0,55,0,0,0,0,0,1,0,25,0,0,1,0,0,5,0,0,0,0,1,0,0,0,0,0,0,9,0,0,0,0,28,0,0,0,0,0,0,0,4,0,57,0,0,0,0,8,0,0,0,0,0,2,0,38,0,23,0,0,0,0,0,0,0,0
"FIN_004_MZB_LO_18","FIN_004_MZB_LO_18-05.09.2018","05.09.2018",2018,9,5,0,0,0,0,0,0,0,0,0,0,0,0,0,2,0,0,41,0,0,0,1,0,0,0,0,1,0,0,0,3,1,0,0,2,0,0,0,0,0,0,0,0,1,0,0,0,20,0,0,0,4,0,0,0,0,0,3,0,1,0,0,0,0,0,0,7,0,0,3,0,0,0,0,9,0,0,0,7,0,0,0,10,0,0,0,0,0,7,0,0,0,0,4,0,0,0,0,1,0,1,0,0,0,0,15,0,0,0,0,0,0,0,2,0,55,0,0,0,0,2,0,0,0,0,0,4,0,12,0,10,0,0,0,0,0,0,0,0
"FIN_004_MZB_LO_18","FIN_004_MZB_LO_18-23.09.2019","23.09.2019",2019,9,23,0,0,0,0,0,0,15,0,0,0,0,0,0,117,0,0,529,0,0,0,0,0,34,0,0,10,0,0,0,176,19,0,0,2,0,1,0,0,3,0,0,1,0,0,0,0,105,0,0,0,91,0,2,0,0,0,47,0,0,0,0,0,0,0,0,58,0,0,63,2,0,0,0,29,1,0,0,16,17,3,0,76,29,17,56,7,1,25,0,0,0,0,104,0,0,1,3,2,0,3,0,0,0,0,152,35,0,0,0,0,0,0,1,0,66,0,0,0,0,27,0,2,0,0,0,722,0,183,0,44,0,0,0,0,3,0,0,1
"FIN_004_MZB_LO_18","FIN_004_MZB_LO_18-28.09.2020","28.09.2020",2020,9,28,0,0,0,0,0,0,33,0,0,0,0,0,0,88,0,0,257,0,0,0,0,0,24,4,0,0,0,0,0,88,12,0,0,1,0,0,0,0,1,0,0,1,0,0,0,0,290,0,4,0,116,0,8,0,0,0,158,0,0,0,0,0,0,0,0,90,0,0,0,0,0,0,0,187,5,0,0,13,0,2,0,29,9,12,90,6,0,31,0,0,0,0,17,0,0,1,2,0,0,4,0,0,0,0,199,1,0,0,0,0,0,0,0,0,25,0,0,0,0,21,0,0,0,0,0,507,0,39,0,31,0,0,0,0,0,0,0,0
"FIN_004_MZB_LO_19","FIN_004_MZB_LO_19-11.09.2007","11.09.2007",2007,9,11,0,0,0,0,0,0,189,0,0,0,0,0,0,38,0,0,11,0,0,0,0,0,7,0,17,4,0,0,0,150,0,0,0,0,0,1,0,0,0,0,0,19,0,0,0,0,667,0,0,0,4,0,1,0,0,1,0,0,0,2,0,0,0,1,0,2,0,0,12,9,0,0,1,919,0,0,0,9,0,3,0,7,7,9,97,0,1,0,0,0,0,0,0,0,0,0,0,0,0,162,0,0,0,0,56,0,0,0,0,0,0,0,59,0,0,0,0,0,0,21,0,0,0,1,0,6,0,61,0,116,0,0,0,0,0,0,0,0
"FIN_004_MZB_LO_19","FIN_004_MZB_LO_19-02.09.2008","02.09.2008",2008,9,2,0,0,0,0,0,0,1,0,0,0,0,0,0,13,0,0,149,0,0,0,0,0,0,0,9,0,0,0,0,230,0,0,0,0,0,0,0,0,2,0,0,6,0,0,0,0,53,0,0,0,0,0,0,0,0,0,0,0,0,0,0,0,0,0,0,0,0,0,0,2,0,0,0,38,0,0,0,3,0,1,0,0,0,6,26,5,0,0,0,0,0,0,0,0,0,0,0,0,0,250,0,0,0,0,34,0,0,0,0,0,0,0,1,0,0,0,0,0,0,14,0,0,3,0,0,0,0,0,0,187,0,0,0,0,0,0,0,0
"FIN_004_MZB_LO_19","FIN_004_MZB_LO_19-06.10.2009","06.10.2009",2009,10,6,0,0,0,0,0,0,17,0,0,0,0,0,0,90,0,0,974,0,0,0,0,0,0,0,30,0,0,0,0,284,0,0,0,0,0,1,0,0,13,0,0,17,0,0,0,0,77,0,0,0,0,0,2,0,0,0,0,0,0,0,0,0,0,0,0,4,0,0,0,8,0,0,0,110,0,0,0,112,0,0,0,0,0,30,380,2,0,0,0,0,0,0,0,0,0,0,34,0,0,213,0,0,0,0,0,0,0,0,0,0,0,0,96,0,0,0,0,0,0,66,0,0,0,1,0,27,0,19,0,258,0,7,0,0,0,0,0,0
"FIN_004_MZB_LO_19","FIN_004_MZB_LO_19-25.10.2010","25.10.2010",2010,10,25,0,0,0,0,0,0,15,0,0,0,0,0,0,54,0,0,100,0,0,0,0,0,0,0,7,1,0,0,0,29,0,0,0,0,0,0,0,0,4,0,0,11,0,0,0,0,83,0,0,0,0,0,7,0,0,0,0,0,0,0,0,0,1,0,0,6,0,0,0,1,0,0,0,66,0,0,0,145,0,1,0,2,0,0,225,0,0,0,0,0,0,0,0,0,0,0,31,0,0,50,0,0,0,0,11,0,0,0,0,0,0,0,13,0,0,0,1,0,0,9,0,0,0,0,0,6,0,10,0,31,0,3,0,0,0,0,0,0
"FIN_004_MZB_LO_19","FIN_004_MZB_LO_19-12.10.2011","12.10.2011",2011,10,12,0,0,0,0,0,0,671,0,0,0,0,0,0,53,0,0,1220,0,0,0,0,0,3,2,12,1,0,0,0,105,0,0,0,0,0,0,0,0,1,0,0,3,0,0,0,0,104,0,0,0,5,0,2,0,0,0,0,0,0,0,0,0,0,0,0,16,0,0,31,4,0,0,0,122,0,0,0,207,0,2,0,25,0,7,446,10,0,0,0,0,0,0,0,0,0,0,24,0,0,504,0,0,0,0,60,0,1,0,0,0,0,0,9,0,0,0,2,0,0,52,0,0,0,0,0,9,0,25,0,15,0,0,0,0,1,0,0,0
"FIN_004_MZB_LO_19","FIN_004_MZB_LO_19-24.09.2012","24.09.2012",2012,9,24,0,0,0,0,0,0,4,0,0,0,0,0,0,13,0,0,606,0,0,0,1,0,0,0,20,0,0,0,0,42,0,0,0,0,0,0,0,0,9,0,0,3,0,0,0,0,83,0,0,0,0,0,0,0,0,0,0,0,0,0,0,0,0,0,0,1,0,0,1,4,0,0,0,7,0,0,0,25,0,40,0,6,1,14,210,11,0,0,0,0,0,0,0,0,0,0,0,0,0,198,0,0,0,0,58,0,0,0,0,0,0,0,3,0,0,0,0,0,0,20,0,0,3,0,0,30,0,6,0,204,0,0,0,0,0,0,0,0
"FIN_004_MZB_LO_19","FIN_004_MZB_LO_19-23.09.2013","23.09.2013",2013,9,23,0,0,0,0,0,0,6,0,0,0,0,0,0,30,0,0,1527,0,0,0,0,0,0,0,0,0,0,0,0,156,0,0,0,0,0,6,0,0,0,0,0,6,0,0,0,0,129,0,0,0,6,0,3,0,0,0,0,0,0,0,0,0,0,0,0,6,0,0,12,0,0,0,0,66,0,0,0,54,9,6,0,81,0,45,294,54,0,0,0,0,0,0,0,0,0,0,0,0,0,57,0,0,0,0,53,0,0,0,0,0,0,0,33,0,0,0,0,0,0,43,0,0,9,0,0,39,0,3,0,240,0,0,0,0,0,0,0,0
"FIN_004_MZB_LO_19","FIN_004_MZB_LO_19-29.10.2014","29.10.2014",2014,10,29,0,0,0,0,0,0,3,0,0,0,0,0,0,5,0,0,57,0,0,0,0,0,0,0,3,3,0,0,0,35,0,0,0,0,0,0,0,0,7,0,0,8,0,0,0,0,42,0,0,0,1,0,0,0,0,0,2,0,0,1,0,0,0,0,0,3,0,0,0,0,0,0,0,19,0,0,0,25,2,2,0,49,0,9,125,1,0,0,0,0,0,0,0,0,0,0,8,0,0,29,0,0,0,0,15,0,0,0,0,0,0,0,32,0,0,0,0,0,0,7,0,0,0,0,0,2,0,31,0,41,0,0,0,0,0,0,0,0
"FIN_004_MZB_LO_19","FIN_004_MZB_LO_19-06.10.2015","06.10.2015",2015,10,6,0,0,0,0,0,0,0,0,0,0,0,0,0,0,0,0,115,0,0,0,0,0,0,0,0,0,4,0,0,9,0,0,0,0,0,3,0,0,11,0,0,4,0,0,0,0,95,0,0,0,1,0,1,0,0,0,0,0,0,0,0,0,0,0,0,1,0,0,0,3,0,0,0,14,0,0,0,19,0,0,0,2,0,1,47,2,2,0,0,0,0,0,0,0,0,0,0,0,0,2,0,0,0,0,30,0,0,0,0,0,0,0,0,0,0,0,1,0,0,12,0,0,0,0,0,10,0,0,0,121,0,0,0,0,0,0,0,0
"FIN_004_MZB_LO_19","FIN_004_MZB_LO_19-29.09.2016","29.09.2016",2016,9,29,0,0,0,0,0,0,0,0,0,0,0,0,0,5,0,0,600,0,0,0,0,0,0,0,27,1,0,0,0,8,0,0,0,0,0,3,0,0,2,0,0,2,0,0,0,0,110,0,0,0,1,0,0,0,0,0,1,0,0,0,0,0,0,0,0,3,0,0,1,10,0,0,0,3,0,0,0,14,0,2,0,0,0,53,260,10,0,0,0,0,0,0,0,0,0,0,0,0,0,130,0,0,0,0,0,0,0,0,0,0,0,0,0,0,0,0,0,0,0,17,0,0,2,0,0,64,0,0,0,122,0,0,0,0,0,0,0,0
"FIN_004_MZB_LO_19","FIN_004_MZB_LO_19-01.10.2017","01.10.2017",2017,10,1,0,0,0,0,0,0,4,0,0,0,0,0,0,4,0,0,461,0,0,0,0,0,0,0,4,0,0,0,0,8,0,0,0,0,0,0,0,0,4,0,0,3,0,0,0,0,118,0,0,0,6,0,0,0,0,0,1,0,0,0,0,0,0,0,0,2,0,0,1,3,0,0,0,13,0,0,0,24,0,0,0,1,1,15,92,4,0,0,0,0,0,0,0,0,0,0,0,0,0,30,0,0,0,0,0,0,0,0,0,0,0,0,0,0,0,0,0,0,0,13,0,0,0,0,0,53,0,0,0,48,0,0,0,0,0,0,0,0
"FIN_004_MZB_LO_19","FIN_004_MZB_LO_19-27.09.2018","27.09.2018",2018,9,27,0,0,0,0,0,0,0,0,0,0,0,0,0,1,0,0,176,0,0,0,0,0,0,0,0,7,0,0,0,125,0,0,0,0,0,1,0,0,3,0,0,2,0,0,0,0,190,0,0,0,4,0,0,0,0,0,2,0,0,0,0,0,0,0,0,2,0,0,0,7,0,0,0,48,0,0,0,30,0,4,0,147,4,85,110,0,0,0,0,0,0,0,0,0,0,0,5,0,0,67,0,0,0,0,13,0,0,0,0,0,0,0,14,0,0,0,0,0,0,26,0,0,0,1,0,6,0,18,0,239,0,2,0,0,0,0,0,0
"FIN_004_MZB_LO_19","FIN_004_MZB_LO_19-16.10.2019","16.10.2019",2019,10,16,0,0,0,0,0,0,11,0,0,0,0,0,0,1,0,0,905,0,0,0,2,0,0,0,39,4,0,0,0,142,0,0,0,0,0,6,0,0,9,0,0,5,0,0,0,0,217,0,0,0,47,0,0,0,0,0,1,0,0,2,0,0,1,0,0,9,0,0,0,5,0,0,0,103,0,0,0,61,1,10,0,67,1,283,86,38,1,0,0,0,0,0,0,0,0,0,5,0,0,76,0,0,0,0,107,2,0,0,0,0,0,0,3,0,0,0,0,0,0,26,0,0,0,0,0,234,0,38,0,82,0,6,0,0,0,0,0,0
"FIN_004_MZB_LO_19","FIN_004_MZB_LO_19-01.09.2020","01.09.2020",2020,9,1,0,0,0,0,0,0,15,0,0,0,0,0,0,6,0,0,228,0,0,0,0,0,0,0,3,2,0,0,0,21,0,0,0,0,0,1,0,0,2,0,0,3,0,0,0,0,288,0,0,0,6,0,0,0,0,0,0,0,0,1,0,0,0,0,0,4,0,0,10,7,0,0,0,37,0,0,0,8,0,2,0,7,3,1,26,7,0,0,0,0,0,0,0,0,0,0,0,0,0,19,0,0,0,0,14,0,0,0,0,0,0,0,1,0,0,0,0,0,0,19,0,1,5,0,0,13,0,31,0,23,0,0,0,0,0,0,0,0
"FIN_004_MZB_LO_19","FIN_004_MZB_LO_19-21.09.2021","21.09.2021",2021,9,21,0,0,0,0,0,0,1,0,0,0,0,0,0,0,0,0,61,0,0,0,0,0,0,0,8,0,0,0,0,2,0,0,0,0,0,0,0,0,2,0,0,5,0,0,0,0,166,0,0,0,1,0,0,0,0,0,3,0,0,0,0,0,0,0,0,15,0,0,1,0,0,0,0,23,0,0,0,12,0,0,0,16,0,2,82,5,0,0,0,0,0,0,0,0,0,0,0,0,0,9,0,0,0,0,0,0,0,0,0,0,0,0,3,0,0,0,0,0,0,8,0,0,1,0,0,14,0,19,0,121,0,0,0,0,0,0,0,0
"FIN_004_MZB_LO_21","FIN_004_MZB_LO_21-09.09.2007","09.09.2007",2007,9,9,0,0,0,0,0,0,0,0,0,0,0,0,0,19,0,0,4,0,0,0,0,0,0,0,0,0,0,0,0,1,0,0,0,0,0,0,0,0,0,0,0,0,0,0,0,0,0,0,0,0,0,0,0,0,0,0,0,0,0,0,0,0,0,0,0,0,0,0,0,0,0,0,0,137,0,0,0,0,0,0,0,0,0,0,2,0,0,0,0,0,0,0,0,0,0,0,0,0,0,7,0,0,0,0,70,0,0,0,0,0,0,0,0,0,0,0,0,0,0,0,0,0,0,0,0,9,0,0,0,0,0,0,0,0,0,0,0,0
"FIN_004_MZB_LO_21","FIN_004_MZB_LO_21-18.10.2010","18.10.2010",2010,10,18,0,0,0,0,0,0,0,0,0,0,0,0,0,171,0,0,2,0,0,0,0,0,0,0,0,0,0,0,0,34,0,0,0,0,0,0,0,0,0,0,0,0,1,0,0,0,2,0,0,0,0,0,0,0,0,0,0,0,0,0,0,0,0,0,0,0,0,0,0,0,0,0,0,68,0,0,0,0,0,1,0,1,3,0,0,1,0,0,0,0,0,0,0,0,0,0,5,0,0,3,0,0,0,0,9,0,0,0,0,0,0,0,23,0,0,0,0,0,0,0,0,0,0,0,0,0,0,1,0,16,0,4,0,0,0,0,0,0
"FIN_004_MZB_LO_21","FIN_004_MZB_LO_21-07.09.2011","07.09.2011",2011,9,7,0,0,0,0,0,0,0,0,0,0,0,0,0,88,0,0,426,0,0,0,0,0,0,0,0,0,0,0,0,36,0,0,0,0,0,0,0,0,0,0,0,0,0,0,0,0,3,0,0,0,0,0,0,0,0,0,0,0,0,0,0,0,0,0,0,0,0,0,0,0,0,0,0,116,0,0,0,0,0,1,0,1,2,0,1,0,0,0,0,0,0,0,0,0,0,0,0,0,0,11,0,0,0,0,12,0,0,0,0,0,0,0,5,0,0,0,0,0,0,1,0,0,0,1,0,32,0,0,0,7,0,0,0,0,0,0,0,0
"FIN_004_MZB_LO_21","FIN_004_MZB_LO_21-16.09.2012","16.09.2012",2012,9,16,0,0,0,0,0,0,2,0,0,0,0,0,0,62,0,0,120,0,0,0,0,0,0,0,0,0,0,0,0,23,0,0,0,0,0,0,0,0,0,0,0,1,0,0,0,0,4,0,0,0,0,0,0,0,0,0,0,0,0,0,0,0,0,0,0,0,0,0,0,0,0,0,0,358,0,0,0,0,0,5,0,0,2,0,0,0,0,0,0,0,0,0,0,0,0,0,0,0,1,51,0,0,0,0,64,0,0,0,0,0,0,0,8,0,0,0,0,0,0,4,0,0,0,0,0,16,0,0,0,1,0,0,0,0,0,0,0,0
"FIN_004_MZB_LO_21","FIN_004_MZB_LO_21-22.09.2013","22.09.2013",2013,9,22,0,0,0,0,0,0,7,0,0,0,0,0,0,391,0,0,130,0,0,0,0,0,0,0,1,0,0,0,0,131,0,0,0,0,0,0,0,0,0,0,0,0,0,0,0,0,13,0,0,0,0,0,0,0,0,0,0,0,0,0,0,0,0,0,0,0,0,0,4,0,0,0,0,113,0,0,0,0,0,6,0,2,6,3,1,16,0,0,0,0,0,0,0,0,0,0,1,0,0,11,0,0,0,0,37,0,0,0,0,0,0,0,13,0,0,0,0,0,0,3,0,0,0,0,0,3,0,17,0,3,0,0,0,0,0,0,0,0
"FIN_004_MZB_LO_21","FIN_004_MZB_LO_21-14.09.2015","14.09.2015",2015,9,14,0,0,0,0,0,0,0,0,0,0,0,0,0,106,0,0,9,0,0,0,0,0,0,0,0,0,0,0,0,112,0,0,0,0,0,0,0,0,1,0,0,0,0,0,0,0,18,0,0,0,0,0,0,0,0,0,0,0,0,0,0,0,0,0,0,0,0,0,1,0,0,0,0,128,0,0,0,0,0,0,0,0,0,0,1,2,0,0,0,1,0,0,0,0,0,0,0,0,0,7,0,0,0,0,6,0,0,0,0,0,0,0,1,0,0,0,0,0,0,8,0,0,0,0,0,14,0,0,0,0,0,0,0,0,0,0,0,0
"FIN_004_MZB_LO_21","FIN_004_MZB_LO_21-20.09.2016","20.09.2016",2016,9,20,0,0,0,0,0,0,0,0,0,0,0,0,0,59,0,0,0,0,0,0,0,0,0,0,0,0,0,0,0,46,0,0,0,0,0,0,0,0,1,0,0,1,0,0,0,0,11,0,0,0,0,0,0,0,0,0,0,0,0,0,0,0,0,0,0,0,0,0,0,0,0,0,0,51,0,0,0,0,0,0,0,0,0,0,2,0,0,0,0,0,0,0,0,0,0,0,1,0,0,10,0,0,0,0,5,0,1,0,0,0,0,0,6,0,0,0,0,0,0,11,0,0,0,1,0,0,0,10,0,18,0,0,0,0,0,0,0,0
"FIN_004_MZB_LO_21","FIN_004_MZB_LO_21-25.09.2017","25.09.2017",2017,9,25,0,0,0,0,0,0,87,0,0,0,0,0,0,160,0,0,213,0,0,0,0,0,0,0,0,1,0,0,0,239,0,0,0,0,1,0,0,0,0,0,0,1,0,0,0,0,6,0,0,0,0,0,0,0,0,0,0,0,0,0,0,0,0,0,0,0,0,0,0,0,0,0,0,11,0,0,0,0,0,7,0,3,3,8,1,2,0,0,0,0,0,0,0,0,0,0,23,0,0,32,0,0,0,0,13,0,0,0,0,0,0,0,14,0,0,0,0,0,0,10,0,0,0,0,0,0,0,5,0,11,0,0,0,0,4,0,0,0
"FIN_004_MZB_LO_21","FIN_004_MZB_LO_21-17.09.2018","17.09.2018",2018,9,17,0,0,0,0,0,0,0,0,0,0,0,0,0,129,0,0,140,0,0,0,0,0,0,0,0,2,0,0,0,118,0,0,0,0,0,0,0,0,0,0,0,1,0,0,0,0,3,0,0,0,0,0,0,0,0,0,0,0,0,0,0,0,0,0,0,0,0,0,0,0,0,0,0,14,0,0,0,0,0,10,0,67,4,11,1,0,0,0,0,0,0,0,0,0,0,0,18,3,0,1,0,0,0,0,321,0,0,0,0,0,0,0,31,0,0,0,0,0,0,0,0,0,0,1,0,34,0,14,0,0,0,5,0,0,0,0,0,0
"FIN_004_MZB_LO_21","FIN_004_MZB_LO_21-20.09.2019","20.09.2019",2019,9,20,0,0,0,0,0,0,0,0,0,0,0,0,0,406,0,0,209,0,0,0,0,0,0,0,0,1,0,0,0,271,0,0,0,0,0,0,0,0,2,0,0,1,0,0,0,0,23,0,0,0,0,0,0,0,0,0,0,0,0,0,0,0,0,0,0,0,0,0,3,1,0,0,0,113,0,0,0,0,0,16,0,21,2,22,0,7,0,0,0,0,0,0,0,0,0,0,9,2,0,2,0,0,0,0,78,0,0,0,0,0,0,0,31,0,0,0,0,0,0,11,0,0,1,5,0,41,0,22,0,9,0,13,0,0,3,0,0,0
"FIN_004_MZB_LO_23","FIN_004_MZB_LO_23-01.10.2008","01.10.2008",2008,10,1,0,0,0,0,0,0,0,0,0,0,0,0,0,0,0,0,630,0,0,0,0,0,0,0,1,5,0,0,0,164,0,0,0,0,0,0,0,0,8,0,0,2,0,0,0,0,241,0,5,0,12,0,0,782,0,0,2,0,0,0,0,0,0,0,0,38,0,0,3,8,0,0,0,101,0,0,0,20,0,0,0,0,9,0,65,5,0,2,0,0,0,0,6,0,0,0,0,0,0,213,0,0,0,0,2,0,0,0,0,0,0,0,0,0,25,0,4,0,0,37,0,0,17,0,0,53,0,0,0,255,0,0,0,0,0,0,0,0
"FIN_004_MZB_LO_23","FIN_004_MZB_LO_23-07.10.2009","07.10.2009",2009,10,7,0,0,0,0,0,0,2,0,0,0,0,0,0,0,0,0,214,0,0,0,0,0,0,0,0,0,0,0,0,398,0,0,0,0,0,0,0,0,62,0,0,2,0,0,0,0,134,0,6,0,26,0,0,474,0,0,10,0,0,0,0,0,0,0,0,52,0,0,2,6,0,0,0,96,0,0,0,16,0,0,0,0,0,0,66,0,2,0,0,0,0,0,0,0,0,0,0,0,0,266,0,0,0,0,38,0,0,0,0,0,0,0,0,0,16,0,0,0,0,38,0,2,0,0,0,42,0,0,0,104,0,0,0,0,0,0,0,0
"FIN_004_MZB_LO_23","FIN_004_MZB_LO_23-27.09.2010","27.09.2010",2010,9,27,0,0,0,0,0,0,1,0,0,0,0,0,0,1,0,0,34,0,0,0,0,0,0,0,0,0,0,0,0,74,0,0,0,0,0,0,0,0,0,0,0,0,0,0,0,0,85,0,0,5,7,0,0,129,0,0,4,0,0,0,0,0,0,0,0,53,0,0,0,4,2,0,0,111,0,0,0,12,0,0,0,2,3,1,52,1,8,2,0,0,0,0,2,0,0,0,0,0,0,53,0,0,0,0,22,0,0,0,0,0,0,0,6,0,0,1,0,0,0,18,0,0,2,1,0,0,0,5,0,16,0,0,0,0,0,0,0,0
"FIN_004_MZB_LO_23","FIN_004_MZB_LO_23-21.09.2011","21.09.2011",2011,9,21,0,0,0,0,0,0,2,0,0,0,0,0,0,1,0,0,91,0,0,0,0,0,1,0,5,8,0,0,0,352,0,0,0,0,0,0,0,0,12,0,0,2,0,0,0,0,187,0,1,0,15,0,0,127,0,0,18,0,0,0,0,0,0,0,0,31,0,0,41,6,0,0,0,90,0,0,0,25,0,0,0,0,1,0,71,8,3,0,0,0,0,0,2,0,0,0,0,0,0,44,0,0,0,0,14,0,0,0,0,1,0,0,4,0,3,1,3,0,0,11,0,5,5,1,0,5,0,6,0,52,0,0,0,0,0,0,0,0
"FIN_004_MZB_LO_23","FIN_004_MZB_LO_23-25.09.2012","25.09.2012",2012,9,25,0,0,0,0,0,0,0,0,0,0,0,0,0,1,0,0,28,0,0,0,0,0,0,0,0,0,0,0,0,28,0,0,0,0,0,0,0,0,11,0,0,4,0,0,0,0,28,0,0,0,1,0,0,32,0,0,1,0,0,0,0,0,0,0,0,2,0,0,0,0,0,0,0,46,0,0,0,2,0,0,0,0,0,0,6,3,1,0,0,0,0,0,3,0,0,0,0,0,0,23,0,0,0,0,8,0,0,0,0,0,0,0,0,0,4,0,0,0,0,11,0,0,4,0,0,0,0,0,0,105,0,0,0,0,0,0,0,0
"FIN_004_MZB_LO_23","FIN_004_MZB_LO_23-25.09.2013","25.09.2013",2013,9,25,0,0,0,0,0,0,3,0,0,4,0,0,0,1,0,0,196,0,0,0,0,0,0,0,0,0,0,0,0,90,0,0,0,0,0,0,0,0,27,0,0,4,0,0,0,0,219,0,3,0,3,0,0,335,0,0,23,0,0,0,0,0,0,0,0,92,0,0,2,1,0,0,0,67,0,0,0,28,0,0,0,0,4,0,49,5,2,1,0,0,0,0,31,0,0,0,0,0,0,10,0,0,0,0,25,0,0,0,0,0,0,0,0,0,21,0,2,0,0,29,0,0,0,0,0,8,0,1,0,90,0,0,0,0,0,0,0,0
"FIN_004_MZB_LO_23","FIN_004_MZB_LO_23-01.09.2014","01.09.2014",2014,9,1,0,0,0,0,0,0,0,0,0,8,0,0,0,0,0,0,556,0,0,0,0,0,4,0,0,9,0,0,0,221,0,0,0,0,0,0,0,0,0,0,0,0,0,0,0,0,1014,0,8,0,0,0,0,888,0,0,0,0,0,0,0,0,0,0,0,82,0,0,159,26,0,0,0,69,0,0,0,76,0,12,0,0,37,40,52,0,0,28,0,0,0,0,95,0,0,0,0,0,0,80,0,0,0,0,34,0,0,0,0,0,0,0,12,0,67,0,0,0,0,74,0,0,55,0,0,25,0,8,0,310,0,0,0,0,0,0,0,0
"FIN_004_MZB_LO_23","FIN_004_MZB_LO_23-04.10.2016","04.10.2016",2016,10,4,0,0,0,0,0,0,0,0,0,1,0,0,0,0,0,0,344,0,0,0,0,0,1,0,4,0,0,0,0,219,0,0,0,0,0,0,0,0,11,0,0,3,0,0,0,0,79,0,2,0,24,0,0,98,0,0,34,0,0,0,0,0,0,0,0,8,0,0,0,8,0,0,0,15,0,0,0,1,0,0,0,0,0,0,56,3,0,0,0,0,0,0,9,0,0,0,0,0,0,98,0,0,0,0,1,0,0,0,0,0,0,0,0,0,28,0,0,0,0,41,0,0,8,0,0,54,0,1,0,16,0,0,0,0,0,0,0,0
"FIN_004_MZB_LO_23","FIN_004_MZB_LO_23-08.10.2019","08.10.2019",2019,10,8,0,0,0,0,0,0,17,0,0,0,0,0,0,0,0,0,82,0,0,0,0,0,3,0,5,15,0,0,0,267,0,0,0,0,0,0,0,0,31,0,0,0,0,0,0,0,398,0,6,0,56,0,0,50,0,0,21,0,0,0,0,0,0,0,0,49,0,0,32,5,0,0,0,35,0,0,0,11,0,0,0,1,7,0,91,0,0,9,0,0,0,0,174,0,0,0,0,0,0,5,0,0,0,0,15,0,0,0,0,0,0,0,0,0,17,0,1,0,0,17,0,2,1,0,0,16,0,0,0,7,0,0,0,0,0,0,0,0
"FIN_004_MZB_LO_24","FIN_004_MZB_LO_24-16.09.2007","16.09.2007",2007,9,16,0,0,0,0,0,0,50,0,0,0,0,0,0,0,0,0,159,0,0,0,0,0,0,0,0,18,0,0,0,80,0,0,0,0,0,0,0,0,0,0,0,2,0,0,0,0,139,0,0,1,0,0,0,0,0,0,0,0,0,0,0,0,0,0,0,1,0,0,0,2,0,0,0,20,0,0,0,15,0,0,0,2,6,4,23,2,0,0,0,0,0,0,0,0,0,0,2,0,0,116,0,0,0,0,64,1,0,0,0,0,0,0,135,0,0,0,3,0,0,40,0,0,1,0,0,25,0,392,0,105,0,0,0,0,0,0,0,0
"FIN_004_MZB_LO_24","FIN_004_MZB_LO_24-05.11.2008","05.11.2008",2008,11,5,0,0,0,0,0,0,0,0,0,0,0,0,0,7,0,0,2,0,0,0,0,0,0,0,0,1,0,0,0,49,0,0,0,0,0,1,0,0,0,0,0,1,0,0,0,0,0,0,0,1,0,0,0,0,0,0,0,0,0,0,0,0,0,0,0,0,0,0,0,0,0,0,0,2,0,0,0,0,0,1,0,0,0,0,1,3,11,0,0,0,0,0,0,0,0,0,0,0,0,2,0,0,0,0,16,0,0,0,0,0,0,0,9,0,0,0,0,0,0,4,0,0,0,0,0,4,0,101,0,1,0,0,0,0,0,0,0,0
"FIN_004_MZB_LO_24","FIN_004_MZB_LO_24-08.09.2009","08.09.2009",2009,9,8,0,0,0,0,0,0,1,0,0,0,0,0,0,2,0,0,12,0,0,0,0,0,0,0,0,6,0,0,0,707,0,0,0,0,0,0,0,0,9,0,0,3,0,0,0,0,10,0,0,0,0,0,0,0,0,0,0,0,0,0,0,0,0,0,0,1,0,0,2,0,0,0,0,12,0,0,0,2,0,0,0,6,7,0,7,2,2,1,0,0,0,0,0,0,0,1,17,2,0,5,0,0,0,0,68,0,0,0,0,0,0,0,183,0,0,0,0,0,0,46,0,0,0,0,0,22,0,240,0,32,0,2,0,0,0,0,0,0
"FIN_004_MZB_LO_24","FIN_004_MZB_LO_24-03.10.2011","03.10.2011",2011,10,3,0,0,0,0,0,0,1,0,0,0,0,0,0,0,1,0,10,0,0,0,0,0,0,0,0,0,0,0,0,34,0,0,0,0,0,0,0,0,1,0,0,0,0,0,0,0,1,0,0,0,0,0,0,0,0,0,0,0,0,0,0,0,0,0,0,3,0,0,0,0,0,0,0,14,0,0,0,1,0,2,0,0,0,4,7,2,2,0,0,0,0,0,0,0,0,0,1,0,0,6,0,0,0,0,11,0,0,0,0,0,0,0,5,0,0,0,1,0,0,27,0,0,0,0,0,38,0,5,0,1,0,0,0,0,0,0,0,0
"FIN_004_MZB_LO_24","FIN_004_MZB_LO_24-19.11.2013","19.11.2013",2013,11,19,0,0,0,0,0,0,18,0,0,0,0,0,0,0,0,0,35,0,0,0,0,0,0,0,0,0,0,0,0,29,0,0,0,0,0,0,0,0,0,0,0,0,0,0,0,0,0,0,0,0,0,0,0,0,0,0,0,0,0,0,0,0,0,0,0,7,0,0,0,0,0,0,0,8,0,0,0,2,0,3,0,0,0,0,18,0,0,0,0,0,0,0,0,0,0,0,0,0,0,0,0,0,0,0,6,0,0,0,0,0,0,0,35,0,0,0,0,0,0,18,0,0,0,0,0,41,0,4,0,0,0,0,0,0,0,0,0,0
"FIN_004_MZB_LO_24","FIN_004_MZB_LO_24-14.09.2017","14.09.2017",2017,9,14,0,0,0,0,0,0,0,0,0,0,0,0,0,9,0,0,63,0,0,0,0,0,0,0,0,0,0,0,0,33,0,0,0,0,0,0,0,0,2,0,0,0,0,0,0,0,9,0,0,0,0,0,0,0,0,0,0,0,0,0,0,0,0,0,0,1,0,0,5,3,0,0,0,8,0,0,0,3,0,0,0,4,2,3,22,1,0,0,0,0,0,0,0,0,0,0,0,0,0,12,0,0,0,0,35,0,0,0,0,0,0,0,111,0,0,0,0,0,0,6,0,0,1,0,0,0,0,212,0,19,0,0,0,0,0,0,0,0
"FIN_004_MZB_LO_24","FIN_004_MZB_LO_24-29.09.2020","29.09.2020",2020,9,29,0,0,0,0,0,0,0,0,0,0,0,0,0,1,0,0,25,0,0,0,0,0,0,0,0,0,0,0,0,343,0,0,0,0,0,0,0,0,0,0,0,0,0,0,0,0,4,0,0,0,0,0,0,0,0,0,0,0,0,0,0,0,0,0,0,0,0,0,23,2,0,0,0,0,0,0,0,0,0,0,0,0,1,9,0,7,3,0,0,0,0,0,0,0,0,0,2,0,0,6,0,0,0,0,2,1,0,0,0,0,0,0,68,0,0,0,0,0,0,3,0,0,0,0,0,32,0,41,0,0,0,0,0,0,0,0,0,0
"FIN_004_MZB_LO_27","FIN_004_MZB_LO_27-10.10.2007","10.10.2007",2007,10,10,0,0,0,0,0,0,0,10,0,0,0,0,0,14,0,0,29,0,0,0,0,0,25,1,0,13,0,0,0,89,0,0,0,0,0,4,0,0,0,0,0,0,0,0,1,0,85,0,12,1,0,0,2,0,0,0,0,0,0,0,4,0,0,0,0,22,0,0,14,12,0,0,0,0,3,0,0,0,4,0,0,10,21,10,0,4,0,0,0,0,0,0,0,0,0,0,0,2,0,4,0,0,0,0,123,0,0,0,0,0,0,0,71,0,0,0,46,0,0,5,0,0,0,0,0,1,0,14,0,0,0,0,0,0,2,1,1,0
"FIN_004_MZB_LO_27","FIN_004_MZB_LO_27-22.09.2008","22.09.2008",2008,9,22,0,0,0,0,0,0,0,8,0,0,0,3,0,0,0,0,40,0,0,1,0,0,8,1,0,2,0,0,0,80,0,0,0,0,0,158,0,0,0,0,0,0,1,1,2,0,29,0,0,1,0,0,0,0,1,0,0,0,0,0,0,0,0,0,0,2,0,0,3,0,0,0,0,0,1,0,0,0,0,1,0,1,10,16,0,4,0,1,0,0,0,0,0,0,0,0,0,0,0,1,0,0,0,0,16,0,0,1,0,0,2,0,53,0,0,2,10,0,0,0,0,0,0,0,0,1,0,3,0,0,0,0,0,0,0,0,0,0
"FIN_004_MZB_LO_27","FIN_004_MZB_LO_27-08.09.2009","08.09.2009",2009,9,8,0,0,0,0,0,0,0,26,0,0,0,0,0,0,0,0,31,0,0,0,0,0,1,4,0,5,0,0,0,66,0,0,0,0,0,10,0,0,0,0,0,0,1,0,0,0,21,0,1,0,0,0,1,0,0,0,0,0,0,0,1,0,0,0,0,4,0,0,0,0,0,0,0,16,2,0,0,0,0,0,0,1,12,2,0,3,0,0,0,0,0,0,0,0,0,0,0,0,0,0,0,0,0,0,31,0,0,0,0,0,0,0,46,0,0,0,2,0,0,2,0,0,0,1,0,0,0,20,0,0,0,0,0,0,0,0,0,0
"FIN_004_MZB_LO_27","FIN_004_MZB_LO_27-11.10.2010","11.10.2010",2010,10,11,0,0,0,0,0,0,0,1,0,0,0,0,0,0,0,0,16,0,0,0,0,0,1,2,0,3,0,0,0,79,0,0,0,0,0,0,0,0,0,0,0,0,0,0,0,0,19,0,2,0,0,0,1,0,0,0,0,0,0,2,7,0,0,0,0,9,0,0,0,0,0,0,0,6,3,0,0,0,1,0,0,3,9,12,0,0,0,0,0,0,0,0,0,0,0,0,0,0,0,0,0,0,0,0,2,0,0,0,0,0,0,0,18,0,0,0,8,0,0,0,0,0,0,0,0,9,0,16,0,0,0,0,0,0,0,0,0,0
"FIN_004_MZB_LO_27","FIN_004_MZB_LO_27-02.10.2013","02.10.2013",2013,10,2,0,0,0,0,0,0,0,3,0,0,0,0,0,3,0,0,101,0,0,3,0,0,0,0,0,0,0,0,0,40,0,0,0,0,0,0,0,0,0,0,0,0,0,0,0,0,32,0,9,0,0,0,5,0,0,0,4,0,0,0,0,0,0,0,0,15,0,0,0,0,0,0,0,459,2,0,0,0,0,0,0,33,0,3,0,0,0,0,0,0,0,0,0,0,0,0,0,0,0,0,0,0,0,0,0,0,0,0,0,0,0,0,0,0,0,0,35,0,0,0,0,0,0,0,0,77,0,14,0,10,0,0,0,0,3,0,0,0
"FIN_004_MZB_LO_27","FIN_004_MZB_LO_27-29.09.2014","29.09.2014",2014,9,29,0,1,0,0,0,0,0,17,0,0,0,0,0,8,0,0,102,0,0,0,0,0,0,1,0,0,0,0,0,8,0,0,0,0,0,0,0,0,0,0,0,0,0,0,0,0,11,0,0,0,0,0,0,0,0,0,9,0,0,0,0,0,0,0,0,16,0,0,2,0,0,0,0,283,0,0,0,0,8,0,0,47,3,0,0,2,0,0,0,0,0,0,0,0,0,0,0,0,0,0,0,0,0,0,11,0,0,0,0,0,0,0,7,0,0,0,5,0,0,6,0,0,0,0,0,3,0,10,0,0,0,1,0,0,0,0,0,0
"FIN_004_MZB_LO_27","FIN_004_MZB_LO_27-04.10.2016","04.10.2016",2016,10,4,0,0,0,0,0,0,0,2,0,0,0,0,0,0,0,0,70,0,0,0,0,0,0,0,0,0,0,0,0,30,0,0,0,0,0,0,0,0,0,0,0,0,0,0,0,0,8,0,4,0,0,0,0,0,0,0,0,0,0,0,0,0,0,0,0,20,0,0,0,0,0,0,0,104,0,0,0,0,0,0,0,10,2,2,0,0,0,0,0,0,0,0,0,0,0,0,0,0,0,0,0,0,0,0,4,0,0,0,0,0,0,0,0,0,0,0,0,0,0,0,0,0,0,0,0,2,0,10,0,4,0,0,0,0,0,0,0,0
"FIN_004_MZB_LO_27","FIN_004_MZB_LO_27-17.10.2018","17.10.2018",2018,10,17,0,0,0,0,0,0,0,0,0,0,0,0,0,21,0,0,0,0,0,0,0,0,0,0,0,0,0,0,0,4,0,0,0,0,0,0,0,0,0,0,0,0,0,0,0,0,75,0,0,0,0,0,6,0,0,0,0,0,0,0,0,0,0,0,0,19,0,0,0,0,0,0,0,216,1,0,0,0,0,0,0,17,0,0,0,3,0,3,0,0,0,0,0,0,0,0,0,0,0,0,0,0,0,0,1,0,0,0,0,0,0,0,0,0,0,0,0,0,0,0,0,0,0,0,0,2,0,169,0,0,0,0,0,0,18,0,0,0
"FIN_004_MZB_LO_28","FIN_004_MZB_LO_28-10.09.2007","10.09.2007",2007,9,10,0,0,0,0,0,0,0,0,0,0,0,0,0,2,0,0,201,0,0,0,0,0,0,0,2,5,0,0,0,106,0,0,0,0,0,0,0,0,4,0,0,4,0,0,0,0,8,0,1,0,9,0,0,0,0,0,0,0,0,1,0,0,0,0,0,0,0,0,2,2,0,0,0,0,0,0,0,12,0,0,0,0,0,0,47,4,1,0,0,0,0,0,0,0,0,0,0,1,0,4,0,0,0,0,0,0,0,0,0,0,0,0,12,0,0,0,0,0,0,11,0,0,0,0,0,17,0,0,0,17,0,0,0,0,0,0,0,0
"FIN_004_MZB_LO_28","FIN_004_MZB_LO_28-22.09.2009","22.09.2009",2009,9,22,0,0,0,0,0,0,1,0,0,0,0,0,0,10,0,0,523,0,0,0,0,0,0,0,61,16,0,0,0,155,0,0,0,0,0,0,0,0,27,0,0,17,0,0,0,0,34,0,8,0,13,0,0,0,0,0,0,0,0,0,0,0,0,0,0,0,0,0,23,106,0,0,0,0,0,0,0,17,0,0,0,0,0,0,107,5,0,0,0,0,0,0,0,0,0,0,0,0,0,56,0,0,0,0,7,0,0,0,0,0,0,0,9,0,2,1,0,0,0,21,0,2,0,0,2,22,0,0,0,83,0,0,0,0,0,0,0,0
"FIN_004_MZB_LO_28","FIN_004_MZB_LO_28-20.09.2010","20.09.2010",2010,9,20,0,0,0,0,0,0,0,0,0,0,0,0,0,9,0,0,396,0,0,0,0,0,0,0,12,0,0,0,0,17,0,0,0,0,0,0,0,0,12,0,0,8,0,0,1,0,4,0,1,0,0,0,0,0,0,0,0,0,0,0,0,0,0,0,0,0,0,0,2,22,0,0,0,0,0,0,0,0,0,0,0,0,0,3,26,19,4,0,0,0,0,0,0,0,0,0,0,0,0,50,0,0,0,0,5,0,0,0,0,0,0,0,12,0,0,0,0,0,0,9,0,0,0,6,1,3,0,0,0,8,0,0,0,0,0,0,0,0
"FIN_004_MZB_LO_28","FIN_004_MZB_LO_28-20.09.2011","20.09.2011",2011,9,20,0,0,0,0,0,0,0,0,0,0,0,0,0,9,0,0,396,0,0,0,0,0,0,0,12,0,0,0,0,17,0,0,0,0,0,0,0,0,12,0,0,35,0,0,1,0,4,0,1,0,0,0,0,0,0,0,0,0,0,0,0,0,0,0,0,0,0,0,2,22,0,0,0,0,0,0,0,0,0,0,0,0,0,3,26,19,4,0,0,0,0,0,0,0,0,0,0,0,0,50,0,0,0,0,5,0,0,0,0,0,0,0,12,0,0,0,0,0,0,9,0,0,0,6,1,3,0,0,0,8,0,0,0,0,0,0,0,0
"FIN_004_MZB_LO_28","FIN_004_MZB_LO_28-30.10.2012","30.10.2012",2012,10,30,0,0,0,0,0,0,0,0,0,0,0,0,0,3,0,0,69,0,0,0,0,0,0,0,0,8,0,0,0,8,0,0,0,0,0,0,0,0,8,0,0,12,0,0,0,0,10,0,0,0,0,0,0,0,0,0,0,0,0,0,0,0,0,0,0,0,0,0,9,25,0,0,0,0,0,0,0,2,0,0,0,0,0,0,12,2,0,0,0,0,0,0,0,0,0,0,0,0,0,24,0,0,0,0,7,0,0,0,0,0,0,0,2,0,1,0,0,0,0,18,0,0,0,1,6,18,0,0,0,13,0,0,0,0,0,0,0,0
"FIN_004_MZB_LO_28","FIN_004_MZB_LO_28-25.09.2013","25.09.2013",2013,9,25,0,0,0,0,0,0,0,0,0,0,0,0,0,3,0,0,1015,0,0,0,0,0,0,0,37,0,0,0,0,125,0,0,0,0,0,3,0,0,3,0,0,3,0,0,0,0,13,0,0,0,1,0,0,0,0,0,0,0,0,0,0,0,0,0,0,0,0,0,0,12,0,0,0,0,0,0,0,6,0,0,0,0,0,15,18,27,0,0,0,0,0,0,0,0,0,0,0,0,0,56,0,0,0,0,0,0,1,0,0,0,0,0,104,0,0,0,0,0,0,27,0,1,0,7,0,0,0,0,0,92,0,0,0,0,0,0,0,0
"FIN_004_MZB_LO_28","FIN_004_MZB_LO_28-29.09.2014","29.09.2014",2014,9,29,0,0,0,0,0,0,0,0,0,0,0,0,0,4,0,0,149,0,1,0,0,0,0,0,11,31,0,0,0,19,0,0,0,0,0,1,0,0,6,0,0,13,0,0,0,0,4,0,0,0,2,0,0,0,0,0,0,0,0,0,0,0,0,0,0,0,0,0,10,43,0,0,0,1,0,0,0,2,0,0,0,0,0,2,187,9,0,0,0,0,0,0,0,0,0,0,0,0,0,18,0,0,0,0,0,0,0,0,0,0,0,0,34,0,0,0,0,0,0,8,0,2,0,2,0,3,0,0,0,11,0,3,0,0,0,0,0,0
"FIN_004_MZB_LO_28","FIN_004_MZB_LO_28-22.09.2016","22.09.2016",2016,9,22,0,0,0,0,0,0,0,0,0,0,0,0,0,0,0,0,508,0,0,0,0,0,0,0,19,1,0,0,0,39,0,0,0,0,0,0,0,0,22,0,0,26,0,0,1,0,30,0,2,0,0,0,0,0,0,0,0,2,0,0,0,0,0,0,0,0,0,0,8,73,0,0,0,0,0,0,0,2,0,0,0,0,0,0,95,4,0,0,0,0,0,0,0,0,0,0,0,0,0,12,0,0,0,0,0,0,0,0,0,0,0,0,22,0,6,0,1,0,0,12,0,0,0,4,0,21,0,0,0,143,0,0,0,0,0,0,0,0
"FIN_004_MZB_LO_28","FIN_004_MZB_LO_28-17.10.2017","17.10.2017",2017,10,17,0,0,0,0,0,0,0,0,0,0,0,0,0,6,0,0,452,0,0,0,0,0,0,0,87,21,0,0,0,430,0,0,0,0,0,0,0,0,54,0,0,29,0,0,0,0,36,0,4,0,0,0,0,0,0,0,0,0,0,0,0,0,0,0,0,0,0,0,5,21,0,0,0,1,0,0,0,19,0,1,0,0,0,12,37,1,1,0,0,0,0,0,0,0,0,0,0,1,0,34,0,0,0,0,20,0,0,0,0,0,0,0,71,0,1,0,0,0,0,14,0,1,0,24,13,93,0,0,0,53,0,1,0,0,0,0,0,0
"FIN_004_MZB_LO_28","FIN_004_MZB_LO_28-19.09.2018","19.09.2018",2018,9,19,0,0,0,0,0,0,0,0,0,0,0,0,0,4,0,0,386,0,0,0,0,0,0,0,12,3,0,0,0,193,0,0,0,0,0,0,0,0,0,0,0,8,0,0,0,0,30,0,0,0,1,0,0,0,0,0,0,0,0,0,0,0,0,0,0,0,0,0,0,14,0,0,0,0,0,0,0,2,0,0,0,0,0,4,35,7,2,0,0,0,0,0,0,0,0,0,0,0,0,78,0,0,0,0,4,0,1,0,0,0,0,0,73,0,0,0,0,0,0,11,0,0,0,8,13,9,0,0,0,57,0,4,0,0,0,0,0,0
"FIN_004_MZB_LO_28","FIN_004_MZB_LO_28-17.09.2019","17.09.2019",2019,9,17,0,0,0,0,0,0,0,0,0,0,0,0,0,5,0,0,502,0,0,0,0,0,0,0,25,5,0,0,0,157,0,0,0,0,0,0,0,0,8,0,0,8,0,0,0,0,15,0,0,0,0,0,0,0,0,0,0,0,0,0,0,0,0,0,0,0,0,0,16,14,0,0,0,0,0,0,0,5,0,0,0,0,0,15,80,3,0,0,0,0,0,0,0,0,0,0,0,0,0,95,0,0,0,0,2,0,0,0,0,0,0,0,34,0,1,0,0,0,0,28,0,0,0,3,10,180,0,0,0,28,0,0,0,0,0,0,0,0
"FIN_004_MZB_LO_28","FIN_004_MZB_LO_28-14.09.2020","14.09.2020",2020,9,14,0,0,0,0,0,0,0,0,0,0,0,0,0,5,0,0,248,0,0,0,0,0,0,0,1,6,1,0,0,24,0,0,0,0,0,0,0,0,9,0,0,5,0,0,0,0,4,0,0,0,0,0,0,0,0,0,0,0,0,0,0,0,0,0,0,0,0,0,14,7,0,0,0,0,0,0,0,0,0,1,0,0,0,1,13,18,0,0,0,0,0,0,0,0,0,0,0,0,0,16,0,0,0,0,4,0,0,0,0,0,0,0,13,0,1,0,0,0,0,7,0,1,0,0,7,7,0,0,2,19,0,0,0,0,0,0,0,0
"FIN_004_MZB_LO_29","FIN_004_MZB_LO_29-29.09.2008","29.09.2008",2008,9,29,0,0,0,0,0,0,0,11,0,0,0,0,0,4,0,0,961,0,0,0,0,0,0,0,0,12,0,0,0,1080,0,0,0,0,0,0,0,0,0,0,0,0,0,0,0,0,186,0,61,0,0,0,0,0,0,0,0,0,0,0,0,0,0,0,0,22,0,0,8,0,0,0,0,3069,0,0,0,0,0,0,0,0,0,0,0,0,0,0,0,0,0,0,0,0,0,0,0,0,0,8,0,0,0,0,254,0,0,0,0,0,0,0,2,0,0,0,55,0,0,179,0,0,0,0,0,354,0,153,0,415,0,0,20,0,0,0,0,0
"FIN_004_MZB_LO_29","FIN_004_MZB_LO_29-24.09.2009","24.09.2009",2009,9,24,0,0,0,0,0,0,0,4,0,0,0,0,0,0,0,0,551,0,0,0,0,0,4,0,0,1,0,0,0,1114,0,0,0,0,0,0,0,0,0,0,0,0,0,0,0,0,40,0,19,0,0,0,0,0,0,0,0,0,1,0,0,0,0,0,0,15,0,0,10,0,0,0,0,868,0,0,0,0,0,2,0,2,7,2,0,1,0,0,0,0,0,0,0,0,0,0,0,0,0,3,0,0,0,0,7,0,0,0,0,0,0,0,49,0,0,0,15,0,0,65,0,0,3,0,0,69,0,67,0,305,0,0,0,0,0,0,0,0
"FIN_004_MZB_LO_29","FIN_004_MZB_LO_29-30.09.2010","30.09.2010",2010,9,30,0,0,0,0,0,0,0,1,0,0,0,0,0,0,0,0,130,0,0,0,0,0,1,0,0,6,0,0,0,223,0,0,0,0,0,0,0,0,0,0,0,0,0,0,0,0,61,0,5,0,0,0,0,0,0,0,0,0,0,0,0,0,0,0,0,0,0,0,2,0,0,0,0,1141,0,0,0,0,0,5,0,3,2,0,1,0,0,0,0,0,0,0,0,0,0,0,0,0,0,4,0,0,0,0,5,0,0,0,0,0,0,0,3,0,0,0,7,0,0,4,0,0,0,0,0,71,0,24,0,16,0,0,0,0,0,0,0,0
"FIN_004_MZB_LO_29","FIN_004_MZB_LO_29-11.09.2013","11.09.2013",2013,9,11,0,0,0,0,0,0,0,0,0,0,0,0,0,0,0,0,131,0,0,0,0,0,0,0,0,0,0,0,0,12,0,0,0,0,0,0,0,0,0,0,0,0,0,0,0,0,12,0,1,0,0,0,0,0,0,0,0,0,0,0,0,0,0,0,0,10,0,0,0,0,0,0,0,326,0,0,0,0,0,2,0,0,0,0,0,0,0,0,0,0,0,0,0,0,0,0,0,0,0,0,0,0,0,0,15,0,0,1,0,0,0,0,0,0,0,0,0,0,0,10,0,0,0,0,0,0,0,17,0,22,0,0,0,0,0,0,0,0
"FIN_004_MZB_LO_29","FIN_004_MZB_LO_29-16.09.2014","16.09.2014",2014,9,16,0,0,0,0,0,0,0,0,0,0,0,0,0,6,0,0,774,0,0,0,0,0,0,0,0,0,0,0,0,51,0,0,0,0,0,0,0,0,0,0,0,0,0,0,0,0,204,0,3,0,0,0,0,0,0,0,0,0,0,0,0,0,0,0,0,21,0,0,3,3,0,0,0,3204,0,0,0,0,0,0,0,0,3,0,0,0,0,0,0,0,0,0,0,0,0,0,0,0,0,0,0,0,0,0,9,0,0,0,0,0,0,0,6,0,0,0,3,0,0,72,0,0,0,0,0,15,0,123,0,117,0,0,0,0,0,0,0,0
"FIN_004_MZB_LO_29","FIN_004_MZB_LO_29-29.09.2015","29.09.2015",2015,9,29,0,0,0,0,0,0,0,18,0,0,0,0,0,15,0,0,714,0,0,0,0,0,0,1,0,0,0,0,0,24,0,0,0,0,0,0,0,0,0,0,0,0,0,0,0,0,61,0,0,1,0,0,0,0,0,0,0,0,0,0,0,0,0,0,0,21,0,0,2,1,0,0,0,215,0,0,0,0,0,1,0,1,1,1,0,1,0,0,0,0,0,0,0,0,0,0,3,0,0,1,0,0,0,0,4,0,0,0,0,0,0,0,4,0,0,0,4,0,0,22,0,0,0,0,0,57,0,14,0,75,0,0,0,0,0,0,0,0
"FIN_004_MZB_LO_29","FIN_004_MZB_LO_29-05.10.2016","05.10.2016",2016,10,5,0,0,0,0,0,0,0,5,0,0,0,0,0,0,0,0,633,0,0,0,0,0,4,1,0,2,0,0,0,35,0,0,0,0,0,0,0,0,0,0,0,0,0,0,0,0,101,0,0,0,0,0,1,0,0,0,0,0,0,0,0,0,0,0,0,12,0,0,0,0,0,0,0,53,0,0,0,0,0,10,0,15,1,39,0,0,0,0,0,0,0,0,0,0,0,0,0,0,0,4,0,0,0,0,2,0,0,0,0,0,0,0,1,0,0,0,1,0,0,9,0,0,0,0,0,222,0,12,0,71,0,0,0,0,0,0,0,0
"FIN_004_MZB_LO_29","FIN_004_MZB_LO_29-07.11.2017","07.11.2017",2017,11,7,0,0,0,0,0,0,0,0,0,0,0,0,0,251,0,0,173,0,0,0,0,0,37,0,0,23,0,0,0,135,0,0,0,0,1,0,0,0,3,4,0,0,0,0,0,0,19,0,18,1,0,0,3,0,0,0,4,0,0,0,0,0,8,0,0,7,0,0,0,13,0,0,0,33,0,0,0,0,0,10,0,0,3,61,0,11,1,0,0,0,0,0,0,0,0,0,5,0,0,114,0,0,0,0,164,0,0,0,0,0,0,0,7,0,0,27,0,0,0,14,0,0,0,0,0,286,0,5,0,45,1,1,0,0,18,0,0,0
"FIN_004_MZB_LO_29","FIN_004_MZB_LO_29-18.09.2018","18.09.2018",2018,9,18,0,0,0,0,0,0,0,0,0,0,0,0,0,26,0,0,10,0,0,0,0,0,2,1,0,0,0,0,0,5,0,0,0,0,0,0,0,0,0,0,0,0,0,0,0,0,40,0,0,1,0,0,0,0,0,0,0,0,0,0,0,0,0,0,0,2,0,0,0,0,0,0,0,27,0,0,0,0,0,0,0,1,5,0,0,2,0,0,0,0,0,0,0,0,0,0,8,0,0,1,0,0,0,0,7,0,0,0,0,0,0,0,2,0,0,0,2,0,0,0,1,0,0,0,0,0,0,3,0,1,0,2,0,0,0,0,0,0
"FIN_004_MZB_LO_29","FIN_004_MZB_LO_29-24.09.2019","24.09.2019",2019,9,24,0,0,0,0,0,0,0,8,0,0,0,0,0,7,0,0,95,1,0,0,0,0,8,0,0,1,0,0,0,178,0,0,0,0,0,0,0,0,0,0,0,0,0,0,0,0,45,0,0,0,0,0,0,0,0,0,0,0,0,0,0,0,0,0,0,5,0,0,1,5,0,0,0,75,0,0,0,0,0,13,0,2,12,24,0,5,0,0,0,0,0,0,0,0,0,0,3,1,0,1,0,0,0,0,29,0,0,0,0,0,0,0,12,0,0,8,1,0,0,12,0,0,0,0,0,10,0,12,0,101,0,2,0,0,0,0,0,0
"FIN_004_MZB_LO_29","FIN_004_MZB_LO_29-24.09.2020","24.09.2020",2020,9,24,0,0,0,0,0,0,0,0,0,0,0,0,0,15,0,0,214,0,0,0,0,0,6,2,0,1,0,0,0,267,0,0,0,0,0,0,0,0,0,0,0,0,0,0,0,0,82,0,1,1,0,0,7,0,0,0,2,1,0,0,0,0,0,0,0,7,0,0,3,0,0,0,0,515,0,0,0,0,0,1,0,16,8,1,0,3,0,0,0,0,0,0,0,0,0,0,1,0,0,0,0,0,0,0,57,1,0,0,0,0,0,0,11,0,0,2,9,0,0,17,0,0,0,0,0,33,0,21,0,49,0,2,0,0,0,0,0,0
