"Unique.ID","Samp.ID","Sampling.date","year","month","day","ABLABESMYIA MONILIS","ACENTRIA EPHEMERELLA","ACROLOXUS LACUSTRIS","AESHNA SP.","AGAPETUS SP.","AGRYPNIA OBSOLETA","AGRYPNIA PAGETANA","ALBOGLOSSIPHONIA HETEROCLITA","AMETROPUS SP.","AMPULLACEANA AMPLA","AMPULLACEANA BALTHICA","AMPULLACEANA LAGOTIS","ANAX IMPERATOR","ANAX PARTHENOPE","ANODONTA SP.","ANOPHELES SP.","APATANIA SP.","APHELOCHEIRUS AESTIVALIS","ASELLUS AQUATICUS","ASTACUS SP.","ATHERICIDAE GEN. SP.","BAETIDAE GEN. SP.","BERAEA PULLATA","BERAEODES MINUTUS","BITHYNIA LEACHII SSP.","BITHYNIA TENTACULATA","BITHYNIA TRANSSILVANICA","BORYSTHENIA NATICINA","BRACHYCENTRUS SP.","BRACHYTRON PRATENSE","CAENIDAE GEN. SP.","CALOPTERYX SP.","CALOPTERYX SPLENDENS","CAPNIA SP.","CAPNOPSIS SCHILLERI SSP.","CATACLYSTA LEMNATA","CERATOPOGONIDAE GEN. SP.","CHAOBORUS CRYSTALLINUS","CHIRONOMIDAE GEN. SP.","CHLOROPERLA SP.","CHRYSOPILUS SP.","COENAGRIONIDAE GEN. SP.","CORDULEGASTER BOLTONII","CORDULIA AENEA","CORIXIDAE GEN. SP.","COROPHIIDAE GEN. SP.","CRUNOECIA SP.","DENDROCOELUM LACTEUM","DICRANOTA BIMACULATA","DIXIDAE GEN. SP.","DOLICHOPODIDAE GEN. SP.","DREISSENA POLYMORPHA","DRYOPIDAE GEN. SP.","DUGESIIDAE GEN. SP.","DYTISCIDAE GEN. SP.","ECHINOGAMMARUS WARPACHOWSKYI","ELMIDAE GEN. SP.","ELOPHILA SP.","EMPIDIDAE GEN. SP.","EPHEMERA SP.","EPHEMERELLA SP.","EPHYDRIDAE GEN. SP.","EPITHECA BIMACULATA","ERPOBDELLA OCTOCULATA","GALBA TRUNCATULA","GAMMARUS SP.","GLOSSIPHONIA COMPLANATA","GLOSSIPHONIA CONCOLOR","GLOSSOSOMA BOLTONI","GOERIDAE GEN. SP.","GOMPHUS SP.","GYRINIDAE GEN. SP.","HAEMOPIS SANGUISUGA","HALIPLIDAE GEN. SP.","HELOBDELLA STAGNALIS","HEMICLEPSIS MARGINATA","HEPTAGENIA SP.","HYDRAENIDAE GEN. SP.","HYDROCHUS SP.","HYDROPHILIDAE GEN. SP.","HYDROPSYCHIDAE GEN. SP.","HYDROPTILIDAE GEN. SP.","ILYOCORIS CIMICOIDES SSP.","ISOGENUS NUBECULA","ISOPERLA SP.","ISOPTENA SERRICORNIS","KAGERONIA FUSCOGRISEA","LEPIDOSTOMA BASALE","LEPIDOSTOMA HIRTUM","LEPTOCERIDAE GEN. SP.","LEPTOPHLEBIIDAE GEN. SP.","LESTIDAE GEN. SP.","LEUCTRA SP.","LIBELLULA SP.","LIMNEPHILIDAE GEN. SP.","LIMONIIDAE GEN. SP.","LITHOGLYPHUS NATICOIDES","LYMNAEA SP.","LYPE REDUCTA","MICRASEMA SP.","MOLANNA SP.","MUSCIDAE GEN. SP.","MYSIDAE GEN. SP.","NEMOURA SP.","NEMURELLA PICTETII","NEPA CINEREA","NOTIDOBIA CILIARIS","NOTONECTA SP.","OBESOGAMMARUS CRASSUS","ODONTOMYIA SP.","OLIGOCHAETA GEN. SP.","OMPHISCOLA GLABRA","ONYCHOGOMPHUS FORCIPATUS","OPHIOGOMPHUS CECILIA","OPLODONTHA VIRIDULA","ORCONECTES LIMOSUS","ORTHETRUM CANCELLATUM","OXYCERA SP.","PARAPOYNX STRATIOTATA","PEDICIA SP.","PEREGRIANA PEREGRA","PERLODES SP.","PHRYGANEA BIPUNCTATA","PHRYGANEA GRANDIS SSP.","PHYSA SP.","PHYSELLA ACUTA","PISCICOLA GEOMETRA","PLACOBDELLA COSTATA","PLANARIA SP.","PLANORBIDAE GEN. SP.","PLATYCNEMIS SP.","PLEA MINUTISSIMA SSP.","POLYCENTROPODIDAE GEN. SP.","PONTOGAMMARUS SP.","POTAMANTHUS LUTEUS","PROTONEMURA SP.","PSEUDANODONTA SP.","PSYCHODIDAE GEN. SP.","PSYCHOMYIA PUSILLA","PTYCHOPTERA SP.","RADIX SP.","RANATRA LINEARIS","RHYACOPHILA SP.","SERICOSTOMA SP.","SERRATELLA IGNITA","SIALIS SP.","SIMULIIDAE GEN. SP.","SOMATOCHLORA FLAVOMACULATA","SOMATOCHLORA METALLICA","SPHAERIIDAE GEN. SP.","STAGNICOLA CORVUS","STAGNICOLA PALUSTRIS","STRATIOMYS SP.","SYNURELLA AMBULANS","SYRPHIDAE GEN. SP.","TABANIDAE GEN. SP.","TAENIOPTERYX NEBULOSA","THEODOXUS FLUVIATILIS SSP.","THEROMYZON TESSULATUM","TINODES WAENERI SSP.","TIPULIDAE GEN. SP.","UNIO SP.","VALVATA SP.","VIVIPARUS CONTECTUS","VIVIPARUS VIVIPARUS"
"LTU_053_MZB_LO_1","LTU_053_MZB_LO_1-04.10.2010","04.10.2010",2010,10,4,0,0,0,0,0,0,0,0,4,0,0,0,0,0,0,0,0,3,22,0,0,33,0,0,0,0,0,0,40,0,0,8,8,0,0,0,0,0,59,0,0,0,0,0,0,31,0,0,0,0,0,0,0,0,2,0,1,0,0,1,0,0,0,25,0,66,0,0,0,0,3,2,0,0,0,0,29,0,0,0,43,0,0,0,0,0,0,0,0,0,0,0,0,0,4,0,0,5,0,0,0,0,0,1,0,0,0,0,0,0,17,0,2,0,0,0,0,0,0,0,0,0,0,0,0,0,1,0,0,0,8,0,0,0,5,0,0,0,0,0,0,0,0,0,0,0,11,0,0,2,0,0,0,0,0,0,0,0,0,0,4,0,0,0,0
"LTU_053_MZB_LO_1","LTU_053_MZB_LO_1-01.10.2012","01.10.2012",2012,10,1,0,0,0,0,0,0,0,0,0,0,0,0,0,0,0,0,0,28,0,0,16,19,0,0,0,18,0,51,0,0,0,28,28,0,0,0,0,0,214,0,0,0,0,0,0,39,0,0,18,1,0,0,0,0,0,0,0,0,0,24,0,0,0,44,0,54,0,0,0,0,8,0,0,0,21,0,0,0,0,0,0,0,0,0,0,0,0,0,0,0,0,0,0,0,4,0,0,170,0,0,0,0,0,0,0,1,0,0,0,0,178,0,0,0,0,0,0,0,0,0,0,0,0,0,0,0,0,0,0,46,16,0,0,0,0,0,0,0,0,0,0,0,0,0,0,0,0,0,0,120,0,0,0,0,0,58,0,0,0,0,24,17,0,0,0
"LTU_053_MZB_LO_1","LTU_053_MZB_LO_1-07.10.2013","07.10.2013",2013,10,7,0,0,0,0,0,0,0,0,0,0,0,0,0,0,0,0,0,199,37,0,58,234,0,0,0,0,0,0,92,0,0,21,21,0,0,0,0,0,271,0,0,21,0,0,25,0,0,0,108,0,0,0,0,0,0,0,0,0,0,0,0,0,0,25,0,35,0,0,0,0,9,0,0,0,0,0,149,0,0,0,372,0,0,0,0,0,37,0,0,0,0,0,0,0,0,0,0,77,0,0,0,0,0,0,0,0,0,7,0,0,249,0,0,0,0,0,0,0,0,0,0,0,0,0,0,0,0,0,0,0,21,0,0,0,0,0,0,0,0,32,8,0,0,0,0,0,0,0,0,116,0,0,0,0,0,36,0,0,0,0,68,4,0,0,0
"LTU_053_MZB_LO_1","LTU_053_MZB_LO_1-06.10.2014","06.10.2014",2014,10,6,0,0,0,0,0,0,0,0,0,0,0,0,0,0,0,0,0,39,22,0,10,60,0,0,6,14,0,24,39,0,0,39,39,0,0,0,0,0,88,0,0,0,0,0,0,0,0,0,39,0,0,0,0,0,0,0,0,0,0,0,0,0,0,6,0,46,0,0,0,0,4,11,0,0,0,0,0,0,0,0,45,0,0,0,0,0,0,0,0,0,0,0,0,0,0,0,0,20,0,0,0,0,12,0,0,0,0,0,0,0,119,0,0,0,0,0,0,0,0,0,0,0,0,0,0,0,0,0,0,0,0,0,18,0,0,0,0,0,0,0,0,0,0,0,0,0,0,0,0,49,0,0,0,0,0,0,0,0,0,0,46,0,0,0,0
"LTU_053_MZB_LO_1","LTU_053_MZB_LO_1-05.10.2015","05.10.2015",2015,10,5,0,0,0,0,0,0,0,0,0,0,0,0,0,0,0,0,0,13,5,0,0,46,0,0,0,0,0,26,62,0,18,4,4,8,0,0,0,0,59,0,0,6,0,0,0,0,0,0,0,0,0,0,0,0,0,0,0,0,0,3,0,0,0,4,0,11,0,0,0,0,0,0,0,0,0,0,46,0,0,0,48,0,0,0,0,0,0,0,0,38,0,0,0,0,0,0,78,75,0,0,0,35,16,0,0,0,0,0,0,0,250,0,0,0,0,0,0,0,0,0,0,0,0,0,0,0,0,0,0,55,8,0,0,0,0,0,0,0,0,0,8,0,0,0,0,0,30,0,0,271,0,0,0,5,0,8,0,18,0,0,67,18,0,0,0
"LTU_053_MZB_LO_1","LTU_053_MZB_LO_1-03.10.2016","03.10.2016",2016,10,3,0,0,0,0,0,0,0,0,0,0,0,0,0,0,0,0,0,10,47,0,0,0,0,0,0,0,0,0,0,0,0,19,19,0,0,0,0,0,413,0,0,6,0,0,16,0,0,0,0,0,0,0,0,0,0,0,0,0,0,0,0,0,0,5,0,49,1,0,0,0,0,0,0,0,3,0,25,0,0,0,33,0,0,0,0,0,0,0,0,0,0,0,0,0,0,0,491,38,0,0,0,0,0,0,0,0,0,0,0,0,1200,0,1,0,0,0,0,0,0,0,0,0,0,0,0,0,1,0,0,0,4,0,23,0,0,0,0,0,0,0,0,0,0,0,0,0,680,0,0,34,0,0,0,1,0,6,0,0,0,0,1,0,0,0,22
"LTU_053_MZB_LO_1","LTU_053_MZB_LO_1-02.10.2017","02.10.2017",2017,10,2,0,0,0,0,0,0,0,0,0,0,0,0,0,0,0,0,0,0,28,0,0,119,0,0,0,12,0,0,0,0,28,22,22,0,0,0,0,0,58,0,0,0,0,0,23,0,0,0,0,11,0,0,0,0,1,0,0,0,0,6,0,0,0,8,0,144,0,0,0,0,0,0,0,0,0,0,0,0,0,0,29,0,1,0,0,0,0,0,0,0,0,0,0,0,0,0,87,43,0,0,0,0,0,0,0,3,0,0,0,0,124,0,0,0,0,0,0,0,0,0,0,0,0,0,47,0,1,0,0,53,0,0,0,0,0,0,0,0,0,0,8,1,0,0,0,0,48,0,0,37,0,0,0,38,0,6,0,0,0,0,0,0,0,4,0
"LTU_053_MZB_LO_1","LTU_053_MZB_LO_1-05.10.2020","05.10.2020",2020,10,5,0,0,0,0,0,0,0,0,0,0,14,0,0,0,0,0,0,0,7,0,0,62,0,0,0,18,0,26,0,0,0,24,24,0,0,0,0,0,56,0,0,9,0,6,11,0,0,0,19,0,0,0,0,0,0,0,0,0,0,0,0,0,7,15,0,39,0,0,0,0,12,0,0,0,0,0,0,0,0,0,11,0,0,0,0,0,0,0,0,0,0,11,0,0,0,0,36,29,0,0,0,0,0,0,0,0,0,0,0,0,76,0,0,4,0,0,0,0,0,0,4,0,0,0,0,0,0,0,0,6,7,1,8,0,0,0,0,0,0,0,9,0,0,0,0,0,0,0,0,51,0,0,0,0,0,8,0,0,0,0,18,1,0,0,0
"LTU_053_MZB_LO_11","LTU_053_MZB_LO_11-11.10.2010","11.10.2010",2010,10,11,0,0,0,0,0,0,0,0,0,0,0,0,0,0,0,0,0,0,0,0,0,0,0,0,0,4,0,0,0,0,14,0,0,0,0,0,0,0,87,0,0,0,0,0,0,0,0,0,0,0,0,4,0,0,0,0,0,0,0,0,0,0,0,0,0,1,0,0,0,0,1,0,0,0,0,0,0,0,0,0,0,0,0,0,0,0,0,0,0,0,0,0,0,0,0,0,0,1,0,0,0,0,0,0,0,0,0,0,0,0,43,0,0,0,0,0,0,0,0,0,0,0,0,0,0,0,0,0,0,0,0,0,0,0,0,0,0,0,0,0,12,0,0,0,0,0,0,0,0,39,0,0,0,0,0,0,0,0,0,0,0,8,28,0,0
"LTU_053_MZB_LO_11","LTU_053_MZB_LO_11-12.09.2011","12.09.2011",2011,9,12,0,0,0,0,0,0,0,0,0,0,0,0,0,0,0,0,0,0,0,0,0,0,0,0,6,7,0,0,0,0,2,1,1,0,0,0,4,0,53,0,0,0,0,0,0,16,0,0,0,0,0,4,0,0,0,0,0,0,0,0,0,0,0,0,0,14,1,0,0,0,0,0,0,0,0,0,0,0,0,0,0,0,0,0,0,0,0,0,0,0,0,0,0,0,0,0,19,0,0,0,0,0,8,0,0,0,0,0,0,0,35,0,0,0,0,0,0,0,1,0,0,0,0,0,0,0,0,0,0,0,0,0,0,0,0,0,0,0,0,0,22,0,0,0,0,0,0,0,0,25,0,0,0,0,0,0,0,0,0,0,0,0,12,0,0
"LTU_053_MZB_LO_11","LTU_053_MZB_LO_11-08.10.2012","08.10.2012",2012,10,8,0,0,0,0,0,0,0,0,0,0,0,0,0,0,0,0,0,0,0,0,0,0,0,0,0,2,0,0,0,0,0,0,0,0,0,0,0,0,0,0,0,0,0,0,0,0,0,0,0,0,0,0,0,0,0,0,0,0,0,0,0,0,0,0,0,23,0,0,0,0,0,0,0,0,0,0,0,0,0,0,0,0,0,0,0,0,0,0,0,0,0,0,0,0,0,0,2,1,0,0,0,0,0,0,0,0,0,0,0,0,0,0,0,0,0,0,0,0,0,0,0,0,0,0,0,0,0,0,1,0,0,0,0,0,0,0,0,0,0,0,3,0,0,0,0,0,0,0,0,0,0,0,0,0,0,0,0,0,0,0,0,0,0,0,2
"LTU_053_MZB_LO_11","LTU_053_MZB_LO_11-30.09.2013","30.09.2013",2013,9,30,0,0,0,0,0,0,0,0,0,0,0,3,0,0,0,0,0,0,0,0,0,0,0,0,0,0,0,0,0,0,0,0,0,0,0,0,0,0,57,0,0,1,0,0,0,0,0,0,0,0,0,2,0,0,0,0,0,0,0,0,0,0,0,0,0,1,0,0,0,0,0,0,0,0,0,0,0,0,0,0,0,0,0,0,0,0,0,0,0,0,0,0,0,0,0,0,9,0,0,0,0,0,41,0,0,1,0,0,0,0,18,0,0,0,0,0,0,0,0,0,0,0,0,0,0,0,0,0,0,0,0,0,0,37,0,0,0,0,0,0,3,0,0,0,0,0,0,0,0,3,0,0,0,0,0,2,0,0,0,0,0,0,0,0,0
"LTU_053_MZB_LO_11","LTU_053_MZB_LO_11-13.10.2014","13.10.2014",2014,10,13,0,0,0,0,0,0,0,0,0,0,0,0,0,0,0,0,0,0,0,0,0,0,0,0,0,3,0,0,0,0,0,0,0,0,0,0,0,0,67,0,0,1,0,0,0,28,0,0,0,0,0,43,0,0,0,0,0,0,0,0,0,0,0,8,0,0,0,0,0,0,0,0,0,0,0,0,0,0,0,0,0,0,0,0,0,0,0,0,0,0,0,0,0,0,0,0,36,0,0,0,0,0,4,0,0,0,0,0,9,0,62,0,0,0,0,0,0,0,0,0,0,0,0,0,0,1,0,0,1,0,0,0,0,0,0,0,0,0,0,0,7,0,0,0,0,0,0,0,0,8,0,0,0,0,0,0,0,0,0,0,0,0,0,0,20
"LTU_053_MZB_LO_11","LTU_053_MZB_LO_11-12.10.2015","12.10.2015",2015,10,12,0,0,0,0,0,0,0,0,0,0,0,0,0,0,0,0,0,0,4,0,0,14,0,0,0,0,0,0,0,0,0,0,0,0,0,0,0,0,45,0,0,0,0,0,8,240,0,0,0,0,0,0,0,0,0,100,0,0,0,0,0,0,0,0,0,0,0,0,0,0,0,0,0,0,0,0,0,0,0,0,0,0,0,0,0,0,0,0,0,0,0,0,0,0,0,0,0,0,0,0,0,0,401,0,0,0,0,0,300,0,24,0,0,0,0,0,0,0,0,0,0,0,0,0,0,0,6,0,0,0,0,0,0,151,0,0,0,0,0,0,0,0,0,0,0,0,0,0,0,5,0,0,0,0,0,0,0,0,0,0,0,0,0,0,0
"LTU_053_MZB_LO_11","LTU_053_MZB_LO_11-12.09.2016","12.09.2016",2016,9,12,0,0,0,0,0,0,0,0,0,9,25,0,0,0,0,0,0,0,0,0,0,0,0,0,4,6,0,0,0,0,1,8,8,0,0,0,0,0,552,0,0,2,0,0,0,0,0,0,0,0,0,22,0,0,0,36,0,0,0,0,0,0,0,6,0,0,0,0,0,0,1,0,0,2,6,0,0,0,0,0,0,0,0,0,0,0,0,0,0,0,0,0,0,0,2,0,30,18,0,0,0,0,92,0,0,0,0,0,99,0,50,0,0,0,0,0,0,0,0,0,0,0,0,0,0,0,2,0,0,0,0,0,0,68,0,0,0,0,0,0,0,0,0,0,0,0,0,0,0,4,0,0,0,0,0,1,0,0,0,0,0,0,0,0,8
"LTU_053_MZB_LO_11","LTU_053_MZB_LO_11-04.10.2017","04.10.2017",2017,10,4,0,0,0,0,0,0,0,0,0,0,0,0,0,0,0,0,0,0,0,0,0,0,0,0,0,9,0,0,0,0,0,4,4,0,0,0,0,0,12,0,0,0,0,0,8,7,0,0,0,0,0,9,0,0,0,0,0,0,0,0,0,0,0,7,0,0,0,0,0,0,0,0,0,0,0,0,0,0,0,0,4,0,0,0,0,0,0,0,0,2,0,0,0,0,0,0,26,13,0,0,0,0,441,0,0,0,0,0,0,0,24,0,0,0,0,0,0,0,0,0,0,0,0,0,0,0,0,0,0,2,0,0,0,265,0,0,0,0,0,0,6,0,0,0,0,0,0,0,0,9,0,0,0,0,0,0,0,0,1,0,0,1,0,0,8
"LTU_053_MZB_LO_11","LTU_053_MZB_LO_11-14.09.2020","14.09.2020",2020,9,14,0,0,0,0,0,0,0,0,0,0,1,0,0,0,0,0,0,0,218,0,0,8,0,0,0,81,41,0,0,0,4,25,25,0,0,5,0,0,2200,0,0,11,0,0,3,448,0,0,0,0,0,7,0,0,4,256,0,0,0,0,0,0,0,16,0,0,4,6,0,0,0,0,0,0,3,0,0,0,0,0,0,8,0,0,0,0,0,0,0,2,0,0,0,0,0,0,92,133,0,0,0,0,672,0,0,0,0,0,0,0,640,0,0,0,0,0,0,0,7,0,0,0,1,0,0,12,2,0,0,46,0,0,0,1866,0,0,0,0,0,0,36,0,0,0,0,0,0,0,0,583,0,0,0,0,0,10,0,0,0,0,0,0,142,0,46
"LTU_053_MZB_LO_12","LTU_053_MZB_LO_12-04.10.2010","04.10.2010",2010,10,4,0,0,0,0,0,0,0,0,0,0,0,0,0,0,0,0,0,0,4,0,19,47,0,1,0,0,0,0,1,0,0,5,5,0,0,0,1,0,40,0,0,0,0,0,2,0,0,0,0,1,0,0,0,0,19,0,14,0,0,6,0,0,0,2,0,0,0,0,0,0,0,0,0,0,1,0,0,0,0,0,0,0,0,0,2,0,0,555,25,0,24,0,0,0,8,5,0,0,1,0,0,0,0,36,0,0,0,0,0,0,17,0,0,0,0,0,0,0,0,0,0,0,0,0,0,0,3,0,0,0,0,0,4,0,0,0,0,0,0,2,0,0,0,0,0,1,0,0,0,0,0,0,1,0,0,0,0,0,0,0,1,0,0,0,0
"LTU_053_MZB_LO_12","LTU_053_MZB_LO_12-10.10.2012","10.10.2012",2012,10,10,0,0,0,0,0,0,0,0,0,0,0,0,0,0,0,0,0,0,0,0,96,73,0,64,0,0,0,0,0,0,0,0,0,0,0,0,0,0,109,41,0,0,0,0,0,0,36,0,60,0,0,0,0,0,81,0,0,0,0,33,0,0,0,0,0,0,0,0,0,0,0,0,0,0,21,0,0,0,0,0,0,0,0,0,0,0,0,0,0,156,0,0,0,0,676,0,0,0,0,0,0,0,0,0,0,0,76,0,0,0,125,0,0,0,0,0,0,0,0,0,0,0,0,0,0,0,0,0,0,0,0,0,70,0,0,0,0,0,0,16,0,0,0,96,0,0,0,0,0,72,0,0,0,0,0,0,0,0,0,0,0,0,0,0,0
"LTU_053_MZB_LO_12","LTU_053_MZB_LO_12-07.10.2013","07.10.2013",2013,10,7,0,0,0,0,0,0,0,0,0,0,0,0,0,0,0,0,0,0,0,0,0,67,0,0,0,16,0,0,0,0,0,0,0,0,0,0,0,0,178,0,0,0,0,0,39,0,0,0,0,25,0,0,0,0,70,0,0,0,0,55,0,0,0,0,0,0,0,0,0,0,16,25,0,0,0,0,157,0,0,0,61,0,0,0,0,0,17,0,0,0,88,0,96,0,210,0,0,0,0,0,0,0,0,0,0,0,75,0,0,0,101,0,0,0,0,0,0,0,0,0,0,0,0,0,0,0,0,0,0,0,0,0,29,0,0,0,0,0,37,12,0,0,0,45,0,35,57,0,0,89,0,0,0,0,0,0,0,0,0,0,15,0,0,0,0
"LTU_053_MZB_LO_12","LTU_053_MZB_LO_12-06.10.2014","06.10.2014",2014,10,6,0,0,0,0,0,0,0,0,0,0,0,0,0,0,0,0,0,39,0,0,0,38,0,0,0,0,0,8,0,0,0,0,0,0,0,0,0,0,41,0,0,0,0,0,1,0,0,0,32,0,0,0,0,0,0,0,0,0,0,13,0,0,0,5,0,0,0,0,0,0,0,0,0,0,0,0,0,0,0,0,22,0,0,0,6,0,0,0,0,0,0,0,0,0,70,0,0,0,0,0,0,0,0,32,0,0,46,0,0,0,42,0,0,0,0,0,0,0,0,0,0,0,0,0,0,0,0,0,0,10,0,0,0,0,0,0,0,0,0,26,0,0,28,0,0,0,27,0,0,9,0,0,0,0,0,0,0,0,0,0,36,0,0,0,0
"LTU_053_MZB_LO_12","LTU_053_MZB_LO_12-12.10.2015","12.10.2015",2015,10,12,0,0,0,0,0,0,0,0,0,0,0,0,0,0,0,0,0,0,0,0,29,103,0,33,2,12,0,0,11,0,0,0,0,47,0,0,0,0,27,0,0,0,0,0,0,0,0,0,57,0,0,0,0,0,4,0,54,0,0,12,0,0,0,13,0,0,0,0,0,12,0,0,0,0,0,0,0,0,0,0,14,0,0,0,9,0,0,0,0,0,10,0,0,0,18,0,0,0,0,28,0,6,0,30,0,0,33,0,0,0,13,0,0,0,0,0,0,0,0,0,0,0,0,0,0,0,9,0,0,0,0,0,0,0,0,40,0,5,0,0,0,0,12,0,0,0,6,0,0,134,0,0,0,0,0,0,0,0,0,0,12,0,0,0,0
"LTU_053_MZB_LO_12","LTU_053_MZB_LO_12-17.10.2016","17.10.2016",2016,10,17,0,0,0,0,0,0,0,0,0,0,0,0,0,0,0,0,0,0,0,0,9,221,0,0,0,0,0,0,0,0,0,1,1,0,0,0,0,0,72,0,0,0,0,0,20,0,0,0,44,0,0,0,0,0,32,0,0,0,0,9,0,0,0,20,0,0,0,0,0,0,0,20,0,0,0,0,0,0,0,0,85,0,0,0,0,0,0,0,0,0,0,0,220,0,0,20,0,12,0,0,0,0,0,0,0,0,37,0,0,0,72,0,0,0,0,0,0,0,0,0,0,248,0,0,0,0,0,0,0,0,0,0,20,0,0,0,0,0,0,0,0,0,0,32,0,0,44,0,0,14,0,0,0,0,0,0,0,0,0,0,0,0,0,0,0
"LTU_053_MZB_LO_12","LTU_053_MZB_LO_12-16.10.2017","16.10.2017",2017,10,16,0,0,0,0,0,0,0,0,0,0,0,0,0,0,0,0,0,12,0,0,1,68,0,0,0,13,0,0,0,0,0,0,0,0,0,3,0,0,34,0,0,0,0,0,12,0,0,0,15,11,0,0,0,0,20,0,0,0,0,15,0,0,0,2,0,0,0,0,0,0,0,8,0,0,0,0,0,0,0,0,27,0,0,0,42,0,0,0,0,85,22,0,0,0,91,0,0,0,0,0,0,0,0,0,0,0,73,0,0,0,39,0,0,0,0,0,0,0,0,0,2,0,8,0,0,0,3,0,0,0,0,0,23,0,0,0,0,0,0,14,0,0,0,0,38,7,27,0,0,38,0,0,0,0,0,8,0,0,0,0,13,0,0,0,0
"LTU_053_MZB_LO_12","LTU_053_MZB_LO_12-13.10.2020","13.10.2020",2020,10,13,0,0,0,0,0,0,0,0,0,0,0,0,0,0,0,0,0,0,0,0,11,0,0,0,0,0,0,0,0,0,0,22,22,0,0,0,0,0,18,0,0,0,0,0,5,0,0,0,0,0,0,0,0,0,0,0,0,0,0,9,0,0,0,0,0,0,0,0,0,0,0,0,0,0,0,0,0,0,0,0,8,0,0,0,0,0,0,0,0,0,0,0,0,0,15,0,0,12,0,0,0,0,0,0,0,0,12,5,0,0,35,0,0,0,0,0,0,0,0,0,0,0,0,0,0,0,0,0,0,0,1,0,1,0,0,0,0,0,0,0,0,0,0,3,0,5,0,0,0,15,0,0,0,0,0,0,0,0,0,0,3,0,0,0,0
"LTU_053_MZB_LO_14","LTU_053_MZB_LO_14-28.09.2010","28.09.2010",2010,9,28,0,0,0,0,0,0,0,0,0,0,0,0,0,0,0,0,0,1,0,0,0,39,0,0,0,27,0,0,0,0,0,11,11,0,0,0,0,0,0,0,0,0,0,0,18,0,0,0,0,1,0,0,0,0,0,0,0,0,0,0,0,0,0,0,0,0,0,0,0,0,1,0,0,0,0,0,0,0,0,0,25,0,0,0,0,0,0,0,0,0,0,0,0,0,0,0,0,19,0,0,0,0,0,0,0,0,0,0,0,0,0,0,0,0,0,0,0,0,0,0,0,0,0,0,0,0,0,0,0,39,0,0,0,0,0,0,0,0,0,0,0,0,0,0,0,0,0,0,0,30,0,0,0,0,0,0,29,0,0,0,0,0,0,0,0
"LTU_053_MZB_LO_14","LTU_053_MZB_LO_14-24.09.2012","24.09.2012",2012,9,24,0,0,0,0,0,0,0,1,0,0,0,0,0,0,0,0,0,35,0,0,8,13,0,0,0,0,0,0,9,0,0,18,18,0,0,0,0,0,0,0,0,0,0,0,0,0,0,0,0,0,0,0,0,0,0,0,4,0,0,10,0,0,0,2,0,0,0,0,0,0,7,0,0,0,0,0,9,0,0,0,9,0,0,0,0,0,0,0,0,1,3,0,0,0,0,2,0,2,0,0,0,0,0,4,0,0,0,0,0,0,0,0,5,0,0,0,0,0,0,0,0,0,0,0,0,0,2,0,0,0,0,0,0,0,6,0,0,0,3,0,0,0,0,0,0,0,0,0,0,1,0,0,0,0,0,1,0,0,1,0,3,0,0,0,0
"LTU_053_MZB_LO_14","LTU_053_MZB_LO_14-18.09.2013","18.09.2013",2013,9,18,0,0,0,0,0,0,0,0,0,0,0,0,0,0,0,0,0,73,0,0,77,116,0,0,12,76,0,0,88,0,0,14,14,0,0,0,0,0,47,0,0,0,0,0,44,0,0,0,26,0,0,0,0,0,0,0,0,0,0,37,0,0,0,0,0,0,0,0,0,0,33,0,0,0,0,0,82,0,0,0,123,0,0,0,26,0,72,0,0,0,0,0,59,0,0,0,0,73,0,0,0,0,0,1,0,0,0,0,0,0,36,0,0,0,0,0,0,0,27,0,0,0,0,0,0,0,0,0,0,133,0,0,0,0,0,0,0,0,0,0,5,0,0,0,0,0,137,0,0,0,0,0,0,0,0,0,0,36,0,0,16,0,0,0,0
"LTU_053_MZB_LO_14","LTU_053_MZB_LO_14-15.09.2014","15.09.2014",2014,9,15,0,0,0,0,0,0,0,0,0,0,0,0,0,0,0,0,0,37,0,0,33,55,0,0,16,27,0,0,0,0,0,8,8,0,0,22,0,0,69,0,0,0,0,0,1,0,0,0,0,0,0,0,0,0,0,0,44,0,0,59,0,0,0,0,0,0,0,0,0,0,8,0,0,0,0,0,0,0,0,0,36,32,0,0,0,0,0,13,17,0,0,0,0,0,22,0,0,72,0,0,0,0,0,0,0,0,0,0,0,0,74,0,7,0,0,0,0,0,0,0,0,0,0,0,36,0,0,0,0,77,0,0,0,0,36,0,0,0,0,0,0,0,0,0,0,0,36,0,0,104,0,0,0,0,0,0,0,21,0,0,0,4,0,0,0
"LTU_053_MZB_LO_14","LTU_053_MZB_LO_14-23.09.2015","23.09.2015",2015,9,23,0,0,14,0,0,0,0,0,0,0,0,0,0,0,0,0,0,20,0,0,14,87,0,0,0,36,0,0,87,0,0,6,6,0,0,0,0,0,23,0,0,0,0,0,0,0,0,0,0,0,0,0,0,0,0,0,34,0,0,39,0,0,0,5,0,0,0,0,0,0,12,16,0,0,0,0,27,0,0,0,71,0,0,0,0,0,0,0,7,8,65,0,0,0,0,0,0,15,0,0,0,0,0,0,0,0,0,0,0,0,29,0,0,3,0,0,0,0,0,0,0,0,0,0,0,0,0,0,0,89,1,0,50,0,13,0,0,0,0,0,0,0,0,0,0,0,0,0,0,76,0,0,0,0,0,3,0,31,0,0,6,0,0,0,0
"LTU_053_MZB_LO_14","LTU_053_MZB_LO_14-27.09.2016","27.09.2016",2016,9,27,0,0,0,0,0,0,0,0,0,0,0,0,0,0,0,0,0,6,0,0,7,57,0,0,10,50,0,15,38,0,0,30,30,0,0,0,0,0,24,0,0,0,0,0,7,0,0,0,0,0,0,0,0,0,9,0,23,0,0,15,0,0,0,0,0,0,0,0,0,19,2,0,0,6,0,0,0,0,0,0,9,33,0,0,0,0,0,0,0,9,30,0,0,0,0,0,0,24,0,0,0,0,0,0,0,0,0,0,0,0,0,0,2,0,0,0,0,0,0,0,0,0,0,0,19,0,1,0,0,45,0,0,14,0,10,0,0,0,0,0,4,0,0,0,0,0,7,0,0,0,0,0,0,0,0,0,0,17,0,0,9,0,0,0,0
"LTU_053_MZB_LO_14","LTU_053_MZB_LO_14-26.10.2017","26.10.2017",2017,10,26,0,0,0,0,0,0,0,0,0,0,0,0,0,0,0,0,8,0,0,0,1,97,0,0,0,0,0,0,9,0,0,18,18,0,0,0,5,0,19,0,0,0,0,0,35,0,0,0,0,0,0,0,9,0,4,0,0,0,0,0,0,0,0,0,0,0,0,0,0,0,0,13,0,0,0,0,1,0,0,0,1,15,0,0,0,0,0,0,0,0,835,0,0,0,78,0,0,8,0,0,0,0,0,0,0,0,0,13,0,0,0,0,0,0,0,0,0,0,0,0,0,0,0,0,7,0,1,0,0,0,1,0,0,0,0,0,0,0,0,0,3,0,0,0,0,0,9,0,0,0,0,0,0,0,0,0,0,0,0,0,0,0,0,0,0
"LTU_053_MZB_LO_14","LTU_053_MZB_LO_14-21.09.2020","21.09.2020",2020,9,21,0,0,0,0,0,0,0,0,0,0,0,0,0,0,0,0,0,36,0,0,11,7,0,0,0,0,0,0,0,0,0,7,7,0,0,0,0,0,1,0,0,0,0,0,1,0,0,0,0,0,0,0,0,0,0,0,13,0,0,22,0,0,0,0,0,0,0,0,0,0,4,2,0,0,0,0,1,0,0,0,11,0,0,0,0,0,0,0,0,0,0,0,0,0,0,0,0,1,0,0,0,0,0,1,0,0,0,0,0,0,2,0,10,0,0,0,0,0,0,0,0,0,0,0,0,0,0,0,0,0,0,0,0,0,0,0,0,0,0,0,12,0,0,0,0,0,2,0,0,4,0,0,0,0,0,2,0,4,0,0,0,0,0,0,0
"LTU_053_MZB_LO_17","LTU_053_MZB_LO_17-05.10.2010","05.10.2010",2010,10,5,0,0,0,0,0,0,0,0,0,0,0,0,0,0,0,0,0,0,0,0,0,0,0,0,0,41,0,0,0,0,0,9,9,0,0,0,0,0,1,0,0,0,0,0,0,0,0,0,0,0,0,0,0,0,8,0,0,0,0,0,0,0,0,0,0,0,0,0,0,0,12,0,0,0,0,0,0,0,0,0,18,0,0,0,0,0,13,0,0,45,28,0,0,0,0,0,0,34,0,0,0,0,0,0,0,0,21,0,0,0,75,0,0,0,0,0,0,0,0,0,0,0,0,0,0,0,0,0,0,0,0,0,0,0,0,0,0,0,0,0,0,0,0,0,0,0,0,0,0,0,0,0,0,0,0,0,0,0,0,0,0,0,0,0,0
"LTU_053_MZB_LO_17","LTU_053_MZB_LO_17-02.10.2012","02.10.2012",2012,10,2,0,0,0,0,0,0,0,0,0,0,0,0,0,0,0,0,0,41,0,0,0,0,0,0,0,164,0,0,90,0,0,0,0,0,0,0,0,0,0,0,0,0,0,0,0,0,0,0,0,0,0,0,0,0,0,0,0,0,0,0,0,0,0,0,0,0,0,0,0,0,24,0,0,0,20,0,0,0,0,0,132,0,0,0,0,0,0,0,0,112,0,0,0,0,0,0,0,0,0,49,0,0,0,0,0,0,0,0,0,0,64,0,0,0,0,0,0,0,0,0,0,0,0,0,0,0,4,0,0,0,0,0,24,0,0,0,0,0,0,0,0,0,0,0,0,0,0,0,0,240,0,0,0,0,0,0,0,252,0,0,0,0,0,0,0
"LTU_053_MZB_LO_17","LTU_053_MZB_LO_17-08.10.2013","08.10.2013",2013,10,8,0,0,0,0,0,0,0,0,0,0,0,0,0,0,0,0,0,0,0,0,0,45,0,0,8,28,0,0,0,0,0,0,0,0,0,0,0,0,39,0,0,8,0,2,0,0,0,0,23,0,0,0,0,0,0,0,0,0,0,24,0,0,0,10,0,0,4,0,0,0,7,0,0,0,7,0,0,0,0,0,0,0,0,0,0,0,0,0,0,63,0,0,0,0,0,0,0,37,0,0,0,0,0,0,0,0,0,0,0,0,49,0,0,2,0,0,0,0,0,0,0,0,0,0,0,0,5,0,0,0,10,0,0,0,1,0,0,0,0,0,8,0,0,0,0,0,0,0,0,0,0,0,0,0,0,18,0,0,0,0,12,0,0,0,0
"LTU_053_MZB_LO_17","LTU_053_MZB_LO_17-07.10.2014","07.10.2014",2014,10,7,0,0,0,0,0,0,0,0,0,0,0,0,0,0,0,0,0,0,0,0,0,31,0,0,6,43,0,39,31,0,0,37,37,0,0,0,0,0,31,0,0,0,0,0,15,0,38,0,0,0,0,0,0,0,4,0,24,0,0,11,0,0,0,24,0,0,0,0,0,0,4,9,0,0,0,0,0,0,0,0,20,0,0,0,0,0,0,0,25,33,79,0,0,0,19,0,0,70,0,0,0,0,0,0,0,0,12,0,0,0,40,0,0,0,0,0,0,0,0,0,0,0,0,0,58,0,19,0,0,56,24,0,0,0,0,0,0,0,0,0,12,0,0,0,0,0,0,0,0,170,0,0,0,0,0,9,0,73,0,0,0,0,0,0,0
"LTU_053_MZB_LO_17","LTU_053_MZB_LO_17-06.10.2015","06.10.2015",2015,10,6,0,0,0,0,0,0,0,0,0,0,0,0,0,0,0,0,0,0,0,0,22,98,0,56,0,0,0,0,34,0,40,0,0,12,0,0,0,0,46,0,0,3,0,0,0,0,87,0,13,0,0,0,0,0,12,0,183,0,0,5,0,0,0,4,0,0,0,0,0,14,0,24,0,8,6,0,52,0,0,0,31,238,0,0,0,0,0,0,54,226,33,0,0,0,38,0,0,38,0,0,0,0,0,11,0,0,18,0,0,0,22,0,0,0,0,0,0,0,0,0,0,0,0,0,0,0,3,0,0,50,0,0,17,0,0,0,0,0,0,0,6,0,0,12,0,0,0,0,0,0,0,0,0,0,0,0,0,0,0,0,29,0,0,0,0
"LTU_053_MZB_LO_17","LTU_053_MZB_LO_17-04.10.2016","04.10.2016",2016,10,4,0,0,0,0,0,0,0,0,0,0,0,0,0,0,0,0,0,1,0,0,0,0,0,0,0,0,0,0,0,0,0,0,0,0,0,0,0,0,0,0,0,0,0,0,0,0,0,0,0,0,0,0,0,0,0,0,18,0,0,5,0,0,0,3,0,0,0,0,0,0,4,6,0,0,0,0,0,0,0,0,0,0,0,0,0,0,0,0,0,0,0,0,0,0,0,0,0,5,0,0,0,0,0,0,0,0,0,0,0,0,0,0,0,0,0,0,0,0,0,0,0,0,0,0,0,0,6,0,0,0,0,0,0,0,0,0,0,0,0,0,0,0,0,0,0,0,0,0,0,24,0,0,0,0,0,0,0,0,0,0,0,0,0,0,0
"LTU_053_MZB_LO_17","LTU_053_MZB_LO_17-03.10.2017","03.10.2017",2017,10,3,0,0,0,0,0,0,0,0,0,0,0,0,0,0,0,0,0,14,0,0,0,0,0,0,0,18,0,0,17,0,0,1,1,0,0,0,0,0,0,0,0,0,0,0,0,0,0,0,0,0,0,0,0,0,0,0,0,0,0,0,0,0,0,6,0,0,0,0,0,0,1,0,0,0,0,0,0,0,0,0,18,0,0,0,11,0,0,0,0,0,0,0,0,0,0,0,9,0,0,0,0,0,0,0,0,0,0,0,0,0,0,0,0,0,0,0,0,0,0,0,0,0,0,0,0,0,0,0,0,16,0,0,0,0,0,0,0,0,0,0,0,0,0,0,0,0,0,0,0,23,0,0,0,0,0,0,0,0,0,0,0,0,0,0,0
"LTU_053_MZB_LO_17","LTU_053_MZB_LO_17-06.10.2020","06.10.2020",2020,10,6,0,0,0,0,0,0,0,0,0,0,6,0,0,0,0,0,0,8,0,0,0,0,0,0,0,8,0,0,0,0,0,4,4,0,0,0,0,0,14,0,0,0,0,0,7,0,0,0,0,0,0,0,0,0,4,0,0,0,0,5,0,0,0,3,0,0,0,0,0,0,0,2,0,0,0,0,0,0,0,0,6,0,0,0,0,0,0,0,0,0,0,0,0,0,0,0,0,8,0,0,0,0,0,0,0,0,0,0,0,0,0,0,0,0,0,0,0,0,0,0,4,0,0,0,0,0,0,0,0,0,6,0,0,0,0,0,0,0,0,0,0,0,0,0,0,0,16,0,0,0,0,0,0,0,0,0,0,0,0,0,0,0,0,0,0
"LTU_053_MZB_LO_18","LTU_053_MZB_LO_18-07.10.2010","07.10.2010",2010,10,7,0,0,0,0,0,0,0,0,0,0,0,0,0,0,0,0,0,42,0,0,0,30,0,0,0,0,0,0,2,0,0,0,0,0,0,0,0,0,1,0,0,0,0,0,0,0,0,0,3,0,0,0,0,0,2,0,2,0,0,28,0,0,0,0,0,0,0,0,0,0,2,0,0,0,0,0,0,0,0,0,8,0,0,0,5,0,1,0,0,0,19,0,0,0,0,0,0,0,0,0,0,0,0,25,0,0,0,0,0,0,8,0,4,0,0,0,0,0,0,0,0,0,0,0,1,0,0,0,0,0,0,0,1,0,66,0,0,0,0,0,0,0,0,0,0,0,0,0,0,0,0,0,0,0,0,0,0,0,0,0,0,0,0,0,0
"LTU_053_MZB_LO_18","LTU_053_MZB_LO_18-03.10.2012","03.10.2012",2012,10,3,0,0,0,0,0,0,0,0,0,0,0,0,0,0,0,0,0,49,0,0,12,45,0,0,16,72,0,0,273,0,0,0,0,0,0,0,0,0,48,0,0,0,0,0,0,0,0,0,0,0,0,0,0,0,0,0,272,0,0,117,0,0,0,0,0,0,0,0,0,0,5,0,0,0,0,0,86,0,0,0,52,180,0,0,0,0,0,0,0,176,0,0,0,0,0,0,0,0,0,169,0,0,0,0,0,0,32,0,0,0,340,0,0,0,0,0,0,0,0,0,0,0,0,0,0,0,0,0,0,288,0,0,0,0,289,0,0,0,0,0,0,0,0,48,0,0,0,0,0,337,0,0,0,0,0,12,0,64,0,0,0,0,0,0,0
"LTU_053_MZB_LO_18","LTU_053_MZB_LO_18-10.10.2013","10.10.2013",2013,10,10,0,0,0,0,0,0,0,0,0,0,0,0,0,0,0,0,0,29,4,0,0,20,0,0,0,0,0,0,43,0,0,9,9,0,0,0,0,0,30,23,0,0,0,11,14,0,37,0,0,0,0,0,0,0,9,0,0,0,0,42,0,0,6,4,0,0,0,0,0,0,11,0,0,0,0,0,0,0,0,0,0,69,0,0,18,0,0,0,0,35,0,0,0,4,0,0,0,0,0,0,0,0,0,0,0,0,0,0,0,0,33,0,0,0,0,0,0,0,0,0,0,0,0,0,0,0,4,0,0,0,0,0,0,0,0,0,0,0,0,0,2,0,0,0,0,0,28,0,0,35,0,0,0,0,0,0,36,0,0,0,0,0,0,0,0
"LTU_053_MZB_LO_18","LTU_053_MZB_LO_18-09.10.2014","09.10.2014",2014,10,9,0,0,0,0,0,0,0,0,0,0,0,0,0,0,0,0,0,21,0,0,3,5,0,0,0,1,0,0,3,0,0,1,1,0,0,0,0,0,0,0,0,0,0,0,0,0,0,0,0,0,0,0,0,0,1,0,71,0,0,18,0,0,0,0,0,0,0,0,0,0,20,0,0,0,0,0,2,0,0,0,2,0,0,0,0,0,1,0,0,3,5,0,0,0,0,0,0,1,0,2,0,0,0,7,0,0,0,0,0,0,0,0,4,0,0,0,0,0,0,0,0,0,0,0,0,0,0,0,0,0,0,0,1,0,0,0,0,0,1,0,0,0,0,0,0,0,0,0,0,1,0,0,0,0,0,0,0,1,0,0,2,0,0,0,0
"LTU_053_MZB_LO_18","LTU_053_MZB_LO_18-01.10.2015","01.10.2015",2015,10,1,0,0,0,0,0,0,0,0,0,0,0,0,0,0,0,0,0,18,0,0,6,6,0,0,0,0,0,0,0,0,4,2,2,0,0,0,1,0,23,0,0,0,0,0,0,0,0,0,0,0,0,0,0,0,3,0,71,0,0,2,0,0,0,0,0,0,0,0,0,0,2,0,0,0,0,0,0,0,0,0,5,82,0,0,0,0,0,0,0,25,14,0,1,1,0,0,0,1,0,4,0,0,0,15,0,0,0,0,0,0,0,0,3,0,0,0,0,0,0,0,0,0,0,0,0,0,0,0,0,0,1,0,2,0,2,0,0,0,0,0,0,0,0,0,0,0,0,0,0,5,0,0,0,0,0,2,0,0,0,0,2,0,0,0,0
"LTU_053_MZB_LO_18","LTU_053_MZB_LO_18-11.10.2016","11.10.2016",2016,10,11,0,0,0,0,0,0,0,0,0,0,0,0,0,0,0,0,0,17,0,0,0,29,0,0,0,14,0,0,18,0,16,0,0,0,0,0,0,0,25,0,0,0,0,0,0,0,0,0,0,0,0,0,0,0,0,0,32,0,0,0,0,0,0,4,0,0,0,0,0,0,1,0,0,0,0,0,0,0,0,0,0,17,0,0,0,0,0,0,0,0,25,0,0,0,0,0,0,13,0,0,0,0,0,0,0,0,0,0,0,0,38,0,0,3,0,0,0,0,0,0,0,0,0,0,0,0,1,0,0,23,0,0,0,0,0,0,0,0,0,0,2,0,0,0,0,0,0,0,0,48,0,0,0,0,0,0,0,10,0,0,0,0,0,0,0
"LTU_053_MZB_LO_18","LTU_053_MZB_LO_18-03.10.2017","03.10.2017",2017,10,3,0,0,0,0,0,0,0,0,0,0,0,0,0,0,0,0,0,20,0,0,9,32,0,0,0,0,0,0,48,0,0,1,1,0,0,0,0,0,17,0,0,0,0,0,0,0,0,0,1,0,0,0,0,0,0,0,33,0,0,1,0,0,0,3,0,0,0,0,0,0,6,0,0,0,0,0,0,0,0,0,0,0,0,0,5,0,0,0,0,0,0,0,0,0,0,0,0,0,0,0,0,0,0,6,0,0,0,0,0,0,34,0,0,0,0,0,0,0,0,0,0,0,0,0,8,0,0,0,0,0,0,0,0,0,0,0,0,0,0,0,0,0,0,0,0,0,0,0,0,61,0,0,0,0,0,0,0,0,0,0,1,0,0,0,0
"LTU_053_MZB_LO_18","LTU_053_MZB_LO_18-07.10.2020","07.10.2020",2020,10,7,0,0,0,0,0,0,0,0,0,0,8,0,0,0,0,0,0,35,0,0,0,38,0,0,0,28,0,0,13,0,0,22,22,0,0,0,0,0,44,0,0,0,0,1,26,0,0,0,0,0,0,0,0,0,0,0,20,0,0,10,0,0,0,3,0,0,0,0,0,0,1,0,0,0,0,0,0,0,0,0,0,0,0,0,0,0,0,0,0,0,0,0,0,0,0,0,0,71,0,0,0,0,0,0,0,0,8,0,0,0,35,0,0,0,0,0,0,0,0,0,2,0,0,0,0,0,0,0,0,0,13,0,10,0,0,0,0,0,0,0,4,0,0,0,0,0,0,0,0,79,0,0,0,0,0,0,21,9,0,0,0,0,0,0,0
"LTU_053_MZB_LO_20","LTU_053_MZB_LO_20-27.09.2010","27.09.2010",2010,9,27,0,0,0,0,0,0,0,0,0,0,0,0,0,0,0,0,0,0,0,0,0,0,0,0,0,0,0,0,0,0,18,9,9,0,0,0,0,0,25,0,0,1,0,0,12,0,0,0,0,0,0,0,0,0,6,0,0,0,0,8,0,0,0,0,0,3,0,0,0,0,2,0,0,0,0,0,0,0,0,0,0,35,0,0,0,0,0,0,0,0,10,0,0,0,8,0,0,0,0,0,0,0,0,0,0,0,0,0,0,0,28,0,0,0,0,0,0,0,0,0,0,0,0,0,0,0,0,0,0,0,0,0,0,0,0,0,0,0,0,0,0,0,0,0,0,0,0,0,0,18,0,0,0,0,0,0,0,0,0,0,0,0,0,0,5
"LTU_053_MZB_LO_20","LTU_053_MZB_LO_20-25.09.2012","25.09.2012",2012,9,25,0,0,0,0,0,0,0,0,0,0,0,0,0,0,0,0,0,0,0,0,0,41,0,0,0,0,0,0,0,0,0,8,8,0,0,0,0,0,61,0,0,0,0,0,0,0,0,0,0,0,0,0,0,0,14,0,51,0,0,0,0,0,0,9,0,0,0,0,0,41,0,0,0,0,0,0,0,0,0,0,89,0,0,0,0,0,19,0,0,0,0,0,0,0,68,0,0,19,0,0,0,0,0,0,0,0,0,16,0,0,23,0,0,0,0,0,0,0,0,0,0,0,0,0,0,0,0,0,0,0,0,0,0,0,0,0,0,0,0,0,0,0,0,0,0,0,0,0,0,0,0,0,0,0,0,0,0,0,0,0,0,0,0,0,0
"LTU_053_MZB_LO_20","LTU_053_MZB_LO_20-10.10.2013","10.10.2013",2013,10,10,0,0,0,0,0,0,0,0,0,0,0,0,0,0,0,0,0,19,35,0,21,0,0,0,0,28,0,20,40,0,0,9,9,0,0,0,0,0,21,19,0,0,0,0,0,0,0,0,0,0,0,0,0,0,10,0,73,0,0,18,0,0,0,9,0,0,0,0,0,0,2,8,0,0,0,0,37,0,0,0,57,38,0,0,0,0,0,0,0,31,57,0,0,0,0,0,0,25,0,0,0,0,0,0,0,0,0,0,0,0,35,0,0,0,0,0,0,0,12,0,0,0,0,0,0,0,0,0,0,59,10,0,0,0,0,0,0,0,0,0,0,0,0,0,0,16,47,0,0,167,0,0,0,0,0,0,34,0,0,0,8,0,0,0,0
"LTU_053_MZB_LO_20","LTU_053_MZB_LO_20-30.09.2014","30.09.2014",2014,9,30,0,0,0,0,0,0,0,0,0,0,0,0,0,0,0,0,0,0,0,0,0,12,0,0,0,6,0,15,0,0,5,1,1,0,0,0,0,0,10,0,0,9,0,0,0,0,0,0,0,0,0,0,0,0,0,0,0,0,0,0,0,0,0,0,0,11,0,0,0,1,3,0,0,0,0,0,0,0,0,0,6,8,0,0,0,0,0,0,0,7,0,0,0,0,0,0,0,0,0,0,3,0,0,0,0,0,0,0,0,0,10,0,0,0,0,0,0,0,1,0,0,0,0,0,0,0,0,0,0,11,4,0,0,0,0,0,0,0,0,0,0,0,0,0,0,0,0,0,0,9,0,0,0,0,0,0,0,2,0,0,0,0,0,4,0
"LTU_053_MZB_LO_20","LTU_053_MZB_LO_20-05.10.2015","05.10.2015",2015,10,5,0,0,0,0,0,0,0,0,0,0,0,0,0,0,0,0,0,0,0,0,0,0,0,0,38,17,0,25,8,0,13,6,6,0,0,0,0,0,17,0,0,1,0,0,0,0,7,0,0,0,0,0,0,0,2,0,25,0,0,3,0,0,0,0,0,0,0,0,0,0,3,0,0,0,0,0,0,0,0,0,0,54,0,0,0,0,0,0,0,0,0,0,0,0,2,0,0,17,0,6,1,0,0,0,0,0,0,0,0,0,0,0,0,6,0,0,0,0,0,0,0,0,0,0,0,0,1,0,0,37,10,0,1,0,0,0,0,0,0,0,3,1,0,0,0,0,0,0,0,67,0,0,0,0,0,0,0,26,0,0,0,0,0,6,10
"LTU_053_MZB_LO_20","LTU_053_MZB_LO_20-10.10.2016","10.10.2016",2016,10,10,0,0,0,0,0,0,0,0,0,0,0,0,0,0,0,0,0,13,1,0,5,222,0,0,0,4,0,0,4,0,1,5,5,0,0,0,0,0,0,0,0,1,0,0,0,0,0,0,3,0,0,0,0,0,2,0,62,0,0,1,0,0,0,22,0,0,0,0,0,0,0,0,0,1,1,0,1,6,0,0,7,0,0,0,0,0,0,0,5,18,10,0,25,0,0,0,0,2,0,0,0,0,0,0,0,0,0,0,0,0,0,0,0,0,0,0,0,0,0,0,0,0,0,0,0,0,0,0,0,4,0,0,12,0,0,0,0,0,0,0,0,0,0,0,3,0,5,0,0,4,0,0,0,0,0,0,0,0,0,0,0,0,0,0,0
"LTU_053_MZB_LO_20","LTU_053_MZB_LO_20-02.10.2017","02.10.2017",2017,10,2,0,0,0,0,0,0,0,0,0,0,0,0,0,0,0,0,0,7,5,0,0,17,0,0,0,0,0,0,0,0,0,1,1,0,0,0,0,0,15,0,0,0,0,0,0,0,0,0,2,0,0,0,0,0,0,0,1,0,0,0,0,0,0,0,0,0,0,0,0,0,11,0,0,0,0,0,0,0,0,0,6,0,0,0,9,0,0,0,0,5,0,0,0,0,0,0,0,8,0,0,0,0,0,0,0,0,0,0,0,0,23,0,0,0,0,0,0,0,0,0,0,0,0,0,0,0,0,0,0,9,0,0,0,0,0,0,0,0,0,0,0,0,0,0,12,0,0,0,0,15,0,0,0,0,0,2,0,0,0,0,0,0,4,0,0
"LTU_053_MZB_LO_20","LTU_053_MZB_LO_20-08.10.2020","08.10.2020",2020,10,8,0,0,0,0,0,0,0,0,0,0,0,0,0,0,0,0,0,0,0,0,0,63,0,0,0,0,0,0,0,0,25,14,14,0,0,0,0,0,108,0,0,5,0,0,0,0,0,0,0,0,0,4,0,0,5,0,0,0,0,4,0,0,0,0,0,6,1,0,0,6,0,0,0,0,1,0,0,0,0,0,0,0,0,0,0,0,0,0,0,45,0,0,0,0,0,0,0,8,0,0,0,0,0,0,0,0,0,0,0,0,43,0,0,0,0,0,0,0,0,0,0,0,0,0,0,0,0,0,0,8,9,0,0,0,0,0,0,0,0,0,2,1,0,0,0,0,0,0,0,20,0,0,0,1,0,0,0,0,0,0,0,0,0,0,0
"LTU_053_MZB_LO_21","LTU_053_MZB_LO_21-07.10.2010","07.10.2010",2010,10,7,0,0,0,0,0,0,0,0,0,0,0,0,0,0,0,0,0,0,0,0,0,2,0,0,0,0,0,0,0,0,1,4,4,0,0,0,0,0,3,0,0,0,0,0,3,0,0,0,0,0,0,0,0,0,1,0,4,0,0,1,0,0,0,1,0,34,0,0,0,0,0,1,0,0,0,0,1,0,0,0,5,0,0,0,3,0,0,51,0,0,1,0,9,0,0,0,0,0,0,0,0,0,0,27,0,0,0,0,0,0,0,0,0,0,0,0,0,0,0,0,0,0,0,0,0,0,4,0,0,1,0,0,4,0,0,0,0,0,0,0,0,0,0,2,0,1,0,0,0,0,0,0,0,0,0,0,0,0,0,0,2,0,0,0,0
"LTU_053_MZB_LO_21","LTU_053_MZB_LO_21-03.10.2012","03.10.2012",2012,10,3,0,0,0,0,0,0,0,0,0,0,0,0,0,0,0,0,0,73,0,0,0,0,0,0,4,52,0,0,152,0,0,0,0,0,0,0,0,0,0,33,0,0,0,0,81,0,0,0,0,0,0,0,0,0,0,0,180,0,0,137,0,0,0,56,0,29,0,0,0,96,4,57,0,0,0,0,172,0,0,0,128,0,0,0,41,0,72,0,0,496,0,0,0,0,144,0,0,0,0,0,0,0,0,0,0,0,112,0,0,0,148,0,0,0,0,0,0,0,0,0,0,0,0,0,0,0,0,0,0,80,0,0,0,0,0,0,0,0,0,0,0,0,0,76,0,0,0,0,0,172,0,0,0,0,0,0,0,0,0,0,0,0,0,0,0
"LTU_053_MZB_LO_21","LTU_053_MZB_LO_21-10.10.2013","10.10.2013",2013,10,10,0,0,0,0,0,0,0,0,0,0,0,0,0,0,0,0,0,0,0,0,0,26,0,0,0,0,0,0,0,0,0,8,8,0,0,0,0,0,33,26,0,0,0,0,0,0,0,0,0,0,0,0,0,0,0,0,59,0,0,10,0,0,0,0,0,17,0,0,0,8,0,11,0,0,0,0,0,0,0,0,76,0,0,0,19,0,0,0,0,18,0,0,0,0,0,0,0,0,0,0,0,0,0,0,0,0,20,0,0,0,29,0,0,0,0,0,0,0,0,0,0,0,0,0,0,0,0,0,0,0,0,0,18,0,0,0,0,0,0,12,0,0,0,47,0,0,18,0,0,0,0,0,0,0,0,8,0,0,0,0,10,0,0,0,0
"LTU_053_MZB_LO_21","LTU_053_MZB_LO_21-09.10.2014","09.10.2014",2014,10,9,0,0,0,0,0,0,0,0,0,0,0,0,0,0,0,0,0,0,1,0,1,93,0,0,0,0,0,0,0,0,0,1,1,0,0,0,0,0,0,0,0,0,1,0,2,0,0,0,1,3,0,0,0,0,0,0,20,0,0,6,0,0,0,0,0,8,0,0,0,1,0,3,0,0,0,0,5,6,0,0,8,0,0,0,12,1,0,65,0,0,0,0,73,0,0,3,0,0,2,0,0,0,0,34,0,0,0,0,0,0,0,0,0,0,0,0,0,0,0,0,0,2,0,0,0,0,2,0,0,6,0,0,5,0,0,0,0,0,0,0,0,0,1,4,0,0,0,0,0,0,0,0,0,0,0,0,0,0,0,0,0,0,0,0,0
"LTU_053_MZB_LO_21","LTU_053_MZB_LO_21-01.10.2015","01.10.2015",2015,10,1,0,0,0,0,8,0,0,0,0,0,0,0,0,0,0,0,0,0,0,2,1,167,0,0,0,0,0,0,36,0,0,1,1,0,0,0,0,0,0,0,0,0,1,0,0,0,0,0,2,1,0,0,0,0,0,0,23,0,0,3,0,1,0,0,0,16,0,0,0,16,0,1,0,0,0,0,15,15,10,0,13,28,0,0,37,0,1,93,0,0,20,0,50,0,1,0,0,0,0,1,0,0,0,43,0,0,0,0,0,0,0,0,0,0,0,0,0,0,0,0,0,0,0,0,0,0,1,0,0,11,0,0,2,0,0,0,0,1,0,0,0,0,3,8,1,0,28,0,0,0,0,0,0,0,0,0,0,0,0,0,0,0,0,0,0
"LTU_053_MZB_LO_21","LTU_053_MZB_LO_21-11.10.2016","11.10.2016",2016,10,11,0,0,0,0,0,0,0,0,0,0,0,0,0,0,0,0,0,0,0,0,0,64,0,0,0,5,0,0,0,0,12,0,0,0,0,0,0,0,24,68,0,0,1,0,0,0,0,0,16,0,0,0,0,0,0,0,85,0,0,7,0,0,0,0,0,14,0,0,0,9,1,5,0,0,0,0,15,0,0,0,62,0,0,0,45,0,0,0,0,17,0,0,100,0,5,0,0,3,0,0,0,0,0,0,0,0,44,0,0,0,62,0,0,0,0,0,0,0,0,0,0,0,0,0,0,0,0,0,0,0,0,0,17,0,0,0,0,0,0,0,0,0,15,47,0,0,36,0,0,0,0,0,0,0,0,0,0,0,0,0,0,0,0,0,0
"LTU_053_MZB_LO_21","LTU_053_MZB_LO_21-03.10.2017","03.10.2017",2017,10,3,0,0,0,0,0,0,0,0,0,0,0,0,0,0,0,0,0,0,0,0,3,17,0,0,0,0,0,0,1,0,0,0,0,0,0,0,0,0,0,0,0,0,0,0,0,0,0,0,0,0,0,0,0,0,5,0,0,0,0,24,0,0,0,0,0,38,0,0,0,0,0,6,0,0,0,0,0,0,0,0,1,0,0,0,0,0,0,0,0,1,19,0,18,0,19,0,0,0,0,0,0,0,0,0,0,0,19,0,0,0,9,0,0,0,0,0,0,0,0,0,0,0,0,0,0,0,0,0,0,0,0,0,0,0,0,0,0,0,0,0,0,0,0,0,0,0,0,0,0,0,0,0,0,1,0,0,1,0,0,0,0,0,0,0,0
"LTU_053_MZB_LO_21","LTU_053_MZB_LO_21-07.10.2020","07.10.2020",2020,10,7,0,0,0,0,0,0,0,0,0,0,0,0,0,0,0,0,0,0,0,3,44,39,0,0,0,0,0,0,111,0,31,12,12,0,0,0,12,0,19,0,0,0,0,1,0,0,0,0,0,0,0,0,0,0,0,0,39,0,0,17,0,0,0,11,0,12,0,0,0,16,0,0,0,0,0,0,0,0,0,0,17,82,0,0,8,0,0,0,11,102,25,0,0,0,14,0,0,0,0,0,0,0,0,0,0,0,21,0,0,0,45,0,0,0,0,0,0,0,0,0,0,0,0,0,0,0,1,0,0,0,6,0,0,0,0,0,0,0,0,0,0,0,1,8,0,0,9,0,0,0,0,0,0,0,0,13,12,0,0,0,8,0,0,0,0
"LTU_053_MZB_LO_24","LTU_053_MZB_LO_24-11.10.2010","11.10.2010",2010,10,11,0,0,0,0,0,0,0,0,0,0,0,1,0,0,0,0,0,0,6,0,0,0,0,0,0,0,0,0,0,0,35,3,3,0,0,0,0,0,4,0,0,0,0,0,0,0,0,0,0,0,0,0,0,0,0,0,2,0,0,70,0,0,0,0,0,0,1,0,0,0,0,0,0,4,0,0,0,0,0,0,0,0,5,0,0,0,0,0,0,4,5,0,0,0,0,0,0,1,0,0,0,0,0,0,0,0,0,0,0,0,12,0,0,0,0,0,0,0,0,0,0,1,0,0,9,0,0,0,4,0,1,0,0,0,0,0,0,0,0,0,0,0,0,0,0,1,0,0,0,13,0,0,0,0,0,0,0,0,0,0,0,0,17,0,0
"LTU_053_MZB_LO_24","LTU_053_MZB_LO_24-12.09.2011","12.09.2011",2011,9,12,0,0,0,0,0,0,0,0,0,0,0,0,0,0,0,0,0,0,0,0,0,0,0,0,2,5,0,0,0,0,0,1,1,0,0,0,0,0,16,0,0,0,0,0,0,0,0,0,0,0,0,0,0,0,0,0,0,0,0,0,0,0,0,0,0,0,0,0,0,0,1,0,0,2,0,0,0,0,0,0,0,0,0,0,0,0,0,0,0,0,0,0,0,0,0,0,0,1,0,0,0,0,0,0,0,0,0,0,0,0,27,0,0,0,0,0,0,0,0,0,0,0,0,0,0,0,0,0,0,0,0,0,0,0,0,0,0,0,0,0,0,0,0,0,0,3,0,0,0,0,0,0,0,0,0,0,0,0,0,0,0,0,0,0,8
"LTU_053_MZB_LO_24","LTU_053_MZB_LO_24-18.10.2012","18.10.2012",2012,10,18,0,0,0,0,0,0,0,0,0,0,0,1,0,0,0,0,0,0,0,0,0,0,0,0,0,13,0,0,0,0,3,0,0,0,0,0,0,0,7,0,0,0,0,0,0,0,0,0,0,0,0,0,6,0,2,0,2,0,0,1,0,0,0,0,0,0,0,0,0,0,0,0,0,0,0,0,0,0,0,1,0,0,0,0,0,0,0,0,0,3,0,0,0,0,0,0,0,1,0,0,0,0,0,0,0,0,0,0,0,0,6,0,0,0,0,0,0,0,0,0,0,0,0,0,0,0,0,0,0,2,0,0,0,0,0,0,0,0,0,0,0,0,0,0,0,0,0,0,0,19,0,0,0,0,0,0,0,0,0,0,0,0,2,0,0
"LTU_053_MZB_LO_24","LTU_053_MZB_LO_24-25.09.2013","25.09.2013",2013,9,25,0,1,0,0,0,0,0,0,0,0,0,1,0,0,0,0,0,0,0,0,0,0,0,0,0,11,1,0,0,0,16,7,7,0,0,0,2,0,5,0,0,0,0,0,1,0,0,0,0,0,2,0,9,0,0,0,1,0,0,4,0,0,0,0,0,0,0,0,0,0,0,0,0,0,0,0,0,0,0,0,0,14,0,2,0,0,0,0,0,3,6,0,0,0,8,0,0,0,0,0,0,0,0,0,0,2,0,0,0,0,12,0,0,0,0,0,0,0,0,0,0,0,0,0,4,0,1,0,0,0,0,0,3,0,0,0,0,0,0,0,0,0,0,0,0,4,0,0,0,6,0,0,0,0,0,1,0,0,0,0,1,0,0,0,0
"LTU_053_MZB_LO_24","LTU_053_MZB_LO_24-13.10.2014","13.10.2014",2014,10,13,10,0,7,0,0,0,0,0,0,0,0,0,0,0,0,0,0,7,0,0,0,31,0,2,0,10,0,0,4,0,1,25,25,0,0,0,0,0,48,0,0,0,0,0,24,0,0,0,0,0,0,0,0,0,0,0,16,0,0,9,0,0,0,0,0,0,0,0,0,6,3,0,0,0,0,0,0,0,0,0,7,27,0,0,0,0,0,0,0,0,0,0,0,0,5,0,0,0,0,3,0,0,0,2,0,0,0,0,0,0,12,0,0,0,0,0,0,0,0,0,0,0,0,0,17,0,0,0,0,42,0,0,14,0,0,0,0,0,0,0,0,0,0,6,0,0,0,0,0,42,0,4,0,0,0,0,0,0,0,0,0,0,9,0,0
"LTU_053_MZB_LO_24","LTU_053_MZB_LO_24-12.10.2015","12.10.2015",2015,10,12,0,0,0,0,0,0,0,0,0,0,29,0,0,0,0,0,0,0,0,0,6,17,0,0,6,0,0,0,21,0,0,0,0,0,0,0,0,0,32,0,0,0,0,0,0,0,0,0,0,4,0,0,0,0,0,0,67,0,0,4,0,0,0,4,0,0,1,0,0,0,0,0,0,0,0,0,5,0,0,0,34,8,0,0,0,0,0,0,0,0,8,0,0,0,0,7,0,0,0,0,0,3,0,2,0,0,260,0,0,0,22,0,0,0,0,0,0,0,0,0,0,0,0,0,0,0,0,0,0,43,0,0,12,0,0,0,0,8,0,0,12,0,0,0,0,0,10,0,0,31,0,0,0,0,0,0,0,0,0,0,9,0,0,0,0
"LTU_053_MZB_LO_24","LTU_053_MZB_LO_24-12.09.2016","12.09.2016",2016,9,12,0,0,0,0,0,0,0,0,0,0,0,0,0,0,0,0,0,0,0,0,0,4,0,0,4,0,0,0,7,0,0,0,0,0,0,0,5,0,9,0,0,0,0,0,0,0,0,0,0,0,0,0,29,0,0,0,22,0,0,0,0,0,0,0,0,0,0,0,0,4,1,0,0,4,0,0,0,0,0,0,19,16,0,0,0,0,0,0,0,0,0,0,0,0,12,0,0,0,0,0,0,0,0,0,0,0,0,0,0,0,3,0,0,0,0,0,0,0,0,0,0,0,0,0,0,0,0,0,0,6,0,0,0,0,0,0,0,0,0,0,0,0,0,5,0,3,0,0,0,9,0,0,0,0,0,0,0,0,0,0,0,0,0,0,0
"LTU_053_MZB_LO_24","LTU_053_MZB_LO_24-04.10.2017","04.10.2017",2017,10,4,0,0,7,0,0,0,0,0,0,0,8,0,0,0,0,0,0,2,0,0,0,15,0,0,4,5,0,0,0,0,0,7,7,0,0,9,0,0,18,0,0,0,0,0,9,0,0,0,0,0,0,0,6,0,2,0,0,0,0,23,0,0,0,15,0,64,4,0,0,7,1,0,0,0,3,0,0,0,0,0,0,0,0,0,0,0,0,0,0,0,0,2,0,0,1,0,0,1,0,0,2,0,0,0,0,0,0,0,0,0,16,0,0,0,0,0,0,0,0,0,0,0,0,0,29,0,0,0,0,4,0,0,4,0,0,0,0,0,0,0,0,0,0,0,0,0,0,0,0,39,0,0,0,0,0,0,0,0,0,0,0,0,4,0,0
"LTU_053_MZB_LO_24","LTU_053_MZB_LO_24-14.09.2020","14.09.2020",2020,9,14,0,0,8,1,0,0,0,0,0,0,0,0,0,0,0,0,0,36,71,0,2,40,0,0,0,0,3,0,0,0,56,8,8,0,0,6,0,0,97,0,0,0,0,0,0,0,0,0,0,0,0,0,112,0,4,0,0,0,0,34,0,0,0,23,0,0,0,1,0,0,0,0,0,4,0,0,0,0,0,0,0,74,0,0,0,0,0,0,0,23,0,0,0,0,18,0,0,4,0,0,3,0,0,0,0,0,0,0,0,0,27,0,0,0,0,1,0,0,0,0,8,0,0,0,114,0,0,0,0,5,0,0,9,0,0,0,0,0,0,0,6,0,0,0,0,0,0,0,0,24,0,0,0,0,0,0,0,0,0,19,0,0,0,0,0
"LTU_053_MZB_LO_4","LTU_053_MZB_LO_4-27.09.2010","27.09.2010",2010,9,27,0,0,0,0,0,0,0,0,0,0,0,0,0,0,0,0,0,0,0,0,0,42,0,0,0,26,0,0,0,0,0,0,0,0,0,0,0,0,24,0,0,2,0,0,1,0,0,0,0,0,0,0,0,0,0,0,0,0,0,0,0,0,0,3,0,4,0,0,0,0,0,0,0,0,0,0,0,0,0,0,0,0,0,0,0,0,0,0,0,0,0,0,0,0,0,0,0,0,0,0,0,0,0,0,0,0,0,0,0,0,31,0,0,0,0,0,0,0,0,0,0,0,0,0,0,0,1,0,0,25,0,0,0,0,0,0,0,0,0,0,0,0,0,0,0,0,33,0,0,0,0,0,0,0,0,0,0,0,0,0,0,0,0,0,6
"LTU_053_MZB_LO_4","LTU_053_MZB_LO_4-26.09.2012","26.09.2012",2012,9,26,0,0,0,0,0,0,0,0,0,0,0,0,0,0,0,1,0,0,82,0,0,304,0,0,0,1,0,0,0,0,13,14,14,0,0,0,0,0,17,0,0,7,0,0,224,0,0,0,0,0,0,0,0,0,1,0,2,0,0,0,0,0,0,14,0,2,1,0,0,0,0,0,0,4,0,0,0,0,0,0,20,4,0,0,0,0,4,0,0,4,31,0,0,0,0,0,0,3,0,0,0,0,0,0,0,0,0,0,0,0,1,0,0,0,0,0,0,0,0,0,0,0,0,0,24,0,0,0,0,0,2,0,19,0,0,0,0,0,0,0,0,0,0,0,0,2,0,0,0,0,0,0,0,0,0,0,0,0,0,0,1,1,0,0,0
"LTU_053_MZB_LO_4","LTU_053_MZB_LO_4-16.09.2013","16.09.2013",2013,9,16,0,0,0,0,0,0,0,0,0,0,0,0,0,0,0,0,0,26,27,0,27,216,0,0,16,36,0,0,0,0,72,17,17,0,0,0,0,0,75,0,0,16,0,0,37,0,0,0,0,0,0,0,0,0,5,0,0,0,0,0,0,0,0,37,0,0,0,0,0,0,0,0,0,0,0,0,0,0,0,0,145,0,0,0,0,0,0,0,0,202,0,0,0,0,0,0,0,44,0,0,0,0,0,0,0,17,0,0,0,0,103,0,0,0,0,0,0,0,0,0,0,0,0,0,0,0,0,0,0,0,19,0,44,0,0,0,0,0,0,0,6,0,0,0,0,0,0,0,0,180,0,0,0,0,0,41,0,0,0,0,35,0,0,12,16
"LTU_053_MZB_LO_4","LTU_053_MZB_LO_4-23.09.2014","23.09.2014",2014,9,23,0,0,0,0,0,0,0,0,0,0,0,0,0,0,0,0,0,16,10,0,0,79,0,0,0,0,0,0,0,0,0,13,13,0,0,38,0,0,0,0,0,0,0,0,111,0,0,0,0,18,0,0,0,0,4,0,0,0,0,0,0,0,0,10,0,0,0,0,0,0,0,3,0,0,0,0,0,0,0,0,19,0,3,0,7,0,0,0,0,64,0,0,10,0,0,0,0,26,0,0,0,0,0,0,0,4,0,3,0,0,24,0,0,0,0,0,0,0,0,0,0,0,0,0,14,0,0,0,0,37,5,0,0,0,0,0,0,0,0,0,1,1,0,0,0,0,0,0,0,28,0,0,0,0,0,0,5,0,0,0,0,0,0,0,0
"LTU_053_MZB_LO_4","LTU_053_MZB_LO_4-21.09.2015","21.09.2015",2015,9,21,0,0,0,0,0,0,0,0,0,0,0,0,0,0,0,0,0,4,0,0,0,129,0,0,6,19,0,13,0,0,12,9,9,0,0,16,0,0,20,0,0,3,0,0,11,0,0,0,0,0,0,0,0,0,3,0,31,0,0,0,0,0,0,19,1,0,0,0,0,0,0,11,0,0,0,0,0,0,0,0,0,0,2,0,0,0,0,0,0,4,11,0,0,0,2,0,0,10,0,0,8,0,0,0,0,0,0,0,0,0,19,0,0,0,0,0,0,0,0,0,0,0,3,0,15,0,0,0,0,25,0,0,19,0,0,0,0,0,0,0,0,0,0,0,0,0,0,0,0,25,0,0,6,0,0,0,0,0,0,0,0,1,0,0,1
"LTU_053_MZB_LO_4","LTU_053_MZB_LO_4-26.09.2016","26.09.2016",2016,9,26,0,0,0,2,0,0,0,0,0,0,0,0,0,0,0,0,0,0,13,0,0,62,0,0,8,19,0,0,0,0,60,25,25,0,0,3,0,0,0,0,0,8,0,0,16,0,0,0,0,0,0,0,0,0,0,0,31,0,0,15,0,0,0,15,0,0,0,0,0,0,0,0,0,0,12,0,0,0,0,0,25,0,12,0,8,0,0,0,0,54,0,0,12,0,0,0,0,25,0,0,0,0,0,10,0,1,0,0,0,0,30,0,0,0,0,0,0,0,1,0,0,0,0,0,37,0,1,0,0,29,8,8,18,0,0,0,0,0,0,0,6,0,0,0,0,0,0,0,0,0,0,0,0,0,0,0,0,0,0,0,0,0,0,0,0
"LTU_053_MZB_LO_4","LTU_053_MZB_LO_4-25.10.2017","25.10.2017",2017,10,25,0,0,0,0,0,0,0,0,0,0,0,0,0,0,0,0,0,59,56,0,0,105,0,0,0,0,0,0,28,0,0,3,3,0,0,0,0,0,7,0,0,0,0,0,13,0,0,0,0,0,0,0,24,0,4,0,0,0,0,12,0,0,0,4,0,0,0,0,0,0,0,8,0,0,12,0,0,0,0,0,58,24,0,0,0,0,0,0,0,0,0,0,0,0,71,0,0,0,0,0,0,0,0,0,0,1,0,0,0,0,22,0,0,0,0,0,0,0,0,0,0,0,0,0,25,0,0,0,2,0,0,0,0,0,0,0,0,0,0,0,0,0,0,0,0,0,133,0,0,36,0,0,0,0,0,0,0,0,0,0,0,0,13,0,1
"LTU_053_MZB_LO_4","LTU_053_MZB_LO_4-22.09.2020","22.09.2020",2020,9,22,0,0,0,0,0,0,0,0,0,0,0,0,0,0,0,0,0,0,0,0,0,14,0,0,0,0,0,0,0,0,0,5,5,0,0,0,0,0,22,0,0,1,0,0,9,0,0,0,0,0,0,0,0,0,1,0,3,0,0,6,0,0,0,7,0,1,1,0,0,0,0,0,0,1,0,0,0,0,0,0,0,0,0,0,0,0,0,0,0,0,0,0,0,0,0,0,0,0,0,0,0,0,0,0,0,0,0,0,0,0,6,0,0,0,0,0,0,0,0,0,0,0,0,0,1,0,0,0,0,0,1,0,149,0,0,0,0,0,0,0,6,0,0,0,0,1,15,0,0,0,0,0,0,0,0,0,0,0,0,0,0,5,0,0,0
"LTU_053_MZB_LO_43","LTU_053_MZB_LO_43-05.10.2010","05.10.2010",2010,10,5,0,0,0,0,0,0,0,0,0,0,0,0,0,0,0,0,0,0,28,0,1,51,0,0,0,13,0,0,8,0,0,151,151,0,0,0,0,0,5,0,0,0,0,0,21,0,0,0,0,4,0,0,0,0,10,0,43,0,0,0,0,0,0,18,0,0,3,0,0,0,0,8,0,0,10,0,5,0,0,0,7,0,0,0,0,0,74,66,0,2,43,0,0,0,5,0,0,17,1,44,0,0,0,2,0,0,8,0,0,0,36,0,0,0,0,0,0,0,0,0,0,0,0,0,104,0,1,0,0,0,0,0,2,0,0,0,0,0,0,0,0,0,0,0,0,13,0,0,0,25,0,0,0,0,0,0,0,0,0,0,0,1,0,0,0
"LTU_053_MZB_LO_43","LTU_053_MZB_LO_43-04.10.2012","04.10.2012",2012,10,4,0,0,0,0,0,0,0,0,0,0,0,0,0,0,0,0,0,57,0,0,25,0,0,0,0,0,0,0,0,0,0,70,70,0,0,0,0,0,0,56,0,0,0,0,0,0,32,0,0,0,0,0,0,0,30,0,0,0,0,0,0,0,0,25,0,0,0,0,0,0,13,0,0,0,0,0,57,0,0,0,74,0,0,0,0,0,0,24,0,84,64,0,0,0,24,0,0,96,0,0,0,0,0,0,0,13,57,0,0,0,416,0,0,0,0,0,0,0,0,0,0,0,0,0,36,0,21,0,0,0,0,0,65,0,0,0,0,0,0,0,0,0,0,41,0,32,0,0,0,160,0,0,0,0,0,33,0,0,0,0,21,0,0,0,0
"LTU_053_MZB_LO_43","LTU_053_MZB_LO_43-08.10.2013","08.10.2013",2013,10,8,0,0,0,0,0,0,0,0,0,0,0,0,0,0,0,0,0,21,0,0,0,108,0,0,0,0,0,0,0,0,0,23,23,0,0,0,0,0,34,0,0,0,3,0,53,0,0,0,18,0,10,0,0,0,0,0,300,0,8,9,0,0,0,0,0,0,0,0,0,0,11,0,0,0,0,0,0,0,0,0,90,0,0,0,0,0,0,0,0,0,151,0,0,0,70,0,0,86,0,0,0,0,0,0,0,4,135,0,0,0,247,0,0,2,0,0,0,0,0,0,0,0,0,0,75,0,0,0,0,57,0,0,0,0,0,0,0,0,0,6,6,0,0,90,0,43,41,0,0,356,0,0,0,0,0,15,0,0,0,0,24,0,0,0,0
"LTU_053_MZB_LO_43","LTU_053_MZB_LO_43-13.10.2014","13.10.2014",2014,10,13,0,0,0,0,0,0,0,0,0,0,0,0,0,0,0,0,0,20,0,0,6,0,0,0,0,31,0,18,38,0,0,49,49,0,0,24,0,0,42,0,0,0,0,0,20,0,0,0,0,0,0,0,0,0,0,0,55,3,0,13,0,0,0,18,0,0,0,0,0,0,4,0,0,0,0,0,15,0,0,0,85,65,0,0,0,0,0,0,0,0,0,0,0,0,47,0,0,50,0,0,0,0,0,0,0,0,41,2,0,0,78,0,0,0,0,0,0,0,0,0,0,0,0,0,0,0,0,0,0,33,0,0,0,0,0,0,0,0,0,0,0,0,0,28,0,15,0,0,0,38,0,0,0,0,0,0,0,0,0,0,17,0,0,0,0
"LTU_053_MZB_LO_43","LTU_053_MZB_LO_43-01.10.2015","01.10.2015",2015,10,1,0,0,0,0,0,0,0,0,0,0,0,0,0,0,0,0,0,32,0,0,9,73,0,0,0,0,0,28,180,0,29,5,5,0,0,0,0,0,176,0,0,0,0,0,24,0,4,0,0,0,0,0,0,0,10,0,0,0,0,6,0,0,0,0,0,0,0,0,0,0,0,0,0,0,0,0,62,0,0,17,78,0,0,0,5,0,0,8,36,92,24,0,0,0,3,0,0,88,0,0,0,0,0,0,0,0,0,0,0,0,242,0,0,0,0,0,0,0,0,0,0,0,0,0,18,0,0,0,0,99,0,0,0,0,0,0,0,0,0,0,0,0,0,0,0,4,0,0,0,171,0,0,0,0,0,0,0,0,0,0,17,0,0,0,0
"LTU_053_MZB_LO_43","LTU_053_MZB_LO_43-18.10.2016","18.10.2016",2016,10,18,0,0,0,0,0,0,0,0,0,0,0,0,0,0,0,0,0,0,9,0,5,108,0,0,0,35,0,0,0,0,0,40,40,0,0,0,0,0,22,0,0,0,0,0,13,0,0,0,27,0,0,0,0,0,0,0,0,0,0,6,0,0,0,6,0,0,0,0,0,0,0,0,0,0,0,0,0,0,0,0,0,0,0,0,0,0,0,0,0,0,17,0,0,0,6,0,0,22,0,0,0,0,0,0,0,0,147,4,0,0,30,0,0,0,0,0,0,0,0,0,0,0,0,0,53,0,11,0,0,0,16,0,0,0,0,0,0,0,0,0,6,0,0,0,0,12,0,0,0,217,0,0,0,0,0,3,0,0,0,0,7,0,0,0,0
"LTU_053_MZB_LO_43","LTU_053_MZB_LO_43-06.10.2017","06.10.2017",2017,10,6,0,0,0,0,0,0,0,0,0,0,0,0,0,0,0,0,0,0,0,0,0,108,0,0,0,11,0,54,15,0,27,21,21,0,0,0,0,0,92,0,0,0,0,0,0,0,0,0,0,0,0,0,0,0,5,0,68,0,0,6,0,0,0,7,0,0,0,0,0,0,0,4,0,0,0,0,29,0,0,0,26,29,0,0,24,0,0,8,19,89,41,0,0,0,150,0,0,43,0,0,0,0,0,0,0,0,43,0,0,0,148,0,0,0,0,0,0,0,0,0,0,0,0,0,58,0,0,0,0,0,5,0,8,0,0,0,0,0,0,0,2,0,0,0,0,0,0,0,0,234,0,0,0,0,0,0,21,0,0,0,16,0,0,0,0
"LTU_053_MZB_LO_43","LTU_053_MZB_LO_43-15.10.2020","15.10.2020",2020,10,15,0,0,0,0,0,0,0,0,0,0,1,0,0,0,0,0,0,1,12,0,0,0,0,0,0,3,0,0,0,0,0,30,30,0,0,0,0,0,50,0,0,14,2,0,9,0,0,0,0,0,0,0,0,0,6,0,0,0,0,0,0,0,0,9,0,0,0,0,0,0,1,12,0,0,0,0,0,0,0,0,8,45,0,0,0,0,0,0,0,0,78,0,0,0,6,0,0,0,0,0,0,0,0,0,0,0,96,0,0,0,170,0,0,0,0,0,0,0,0,0,0,0,0,0,9,0,0,0,0,0,8,0,0,0,0,0,0,0,0,0,0,0,0,51,0,5,0,0,0,62,0,0,0,0,0,0,0,0,0,0,7,0,0,0,0
"LTU_053_MZB_LO_46","LTU_053_MZB_LO_46-07.10.2010","07.10.2010",2010,10,7,0,0,0,0,0,0,0,0,0,0,0,0,0,0,0,0,0,0,0,0,15,36,0,0,0,0,0,0,0,0,0,3,3,0,0,0,0,0,5,0,0,0,2,0,1,0,2,0,4,0,0,0,0,0,0,0,50,0,0,32,0,0,0,2,0,0,0,0,0,0,0,4,0,0,0,0,30,0,0,0,15,0,0,0,8,0,0,58,0,0,15,0,13,0,2,0,0,0,0,0,0,0,0,0,0,0,0,0,0,0,1,0,0,0,0,0,0,0,0,0,0,2,0,0,0,0,2,0,0,1,0,0,2,0,0,0,0,0,0,0,0,0,1,0,0,3,0,0,0,0,0,0,0,0,0,0,0,0,0,0,3,0,0,0,0
"LTU_053_MZB_LO_46","LTU_053_MZB_LO_46-03.10.2012","03.10.2012",2012,10,3,0,0,0,0,0,0,0,0,0,0,0,0,0,0,0,0,0,0,0,0,48,80,0,0,20,48,0,0,101,0,0,0,0,0,0,0,0,0,0,69,0,0,0,0,0,0,0,0,68,0,0,0,0,0,41,0,96,0,0,101,0,0,0,0,0,0,0,0,0,136,4,0,0,0,0,0,0,0,0,0,82,244,0,0,0,0,0,0,0,250,0,0,0,0,0,0,0,0,0,0,0,0,0,0,0,0,81,0,0,0,377,0,0,0,0,0,0,0,0,0,0,0,0,0,0,0,0,0,0,192,0,0,0,0,0,0,0,0,0,0,0,0,0,113,0,57,0,0,0,208,0,0,0,0,0,0,0,0,0,0,24,0,0,0,0
"LTU_053_MZB_LO_46","LTU_053_MZB_LO_46-10.10.2013","10.10.2013",2013,10,10,0,0,0,0,0,0,0,0,0,0,0,0,0,0,0,0,0,0,0,0,36,134,0,133,0,0,0,0,0,0,0,13,13,0,0,0,0,0,102,0,0,0,0,0,2,0,0,0,0,0,0,0,0,0,0,0,108,0,0,31,0,0,0,24,0,0,0,0,0,0,18,19,0,0,0,0,0,0,0,0,244,103,0,0,67,0,0,1,276,0,0,0,0,0,0,0,0,72,0,0,0,0,0,0,0,0,0,0,0,0,96,0,0,0,0,0,0,0,0,0,0,0,0,0,0,0,12,0,0,66,0,0,186,0,0,0,0,0,0,30,0,0,0,0,0,6,48,0,0,264,0,0,0,0,0,0,0,0,0,0,0,0,0,0,0
"LTU_053_MZB_LO_46","LTU_053_MZB_LO_46-13.10.2014","13.10.2014",2014,10,13,0,0,0,0,12,0,0,0,0,0,0,0,0,0,0,0,0,0,0,0,3,215,0,0,0,0,0,0,96,0,0,2,2,0,0,0,3,0,0,0,0,0,0,0,0,0,0,0,0,0,0,0,0,0,0,0,46,0,0,1,0,0,0,1,0,0,0,0,0,5,0,5,0,0,0,0,17,76,0,0,49,14,0,0,3,0,0,100,102,4,0,0,17,0,0,0,0,12,0,32,0,0,0,3,0,0,0,0,0,0,0,0,0,0,0,0,0,0,0,0,0,2,0,0,0,0,1,0,0,2,0,0,2,0,0,0,0,0,0,0,0,0,1,5,0,0,3,0,0,0,0,0,0,0,0,1,0,0,0,0,0,0,0,0,0
"LTU_053_MZB_LO_46","LTU_053_MZB_LO_46-01.10.2015","01.10.2015",2015,10,1,0,0,0,0,35,0,0,0,0,0,0,0,0,0,0,0,0,0,0,0,7,29,0,0,0,0,0,0,1,0,0,2,2,0,0,0,3,0,0,0,0,0,1,0,1,0,0,0,6,3,0,0,0,0,0,0,120,0,0,5,0,0,0,5,0,0,0,0,0,8,0,5,0,0,0,0,12,1,2,6,26,35,0,0,2,0,0,29,0,7,0,0,21,0,0,6,0,0,1,304,0,0,0,0,0,0,0,0,0,0,0,0,1,0,0,0,0,0,0,0,0,0,0,0,0,0,2,0,0,3,0,0,1,0,0,0,0,0,0,0,0,0,2,0,0,0,3,0,0,0,0,0,0,0,0,0,0,0,0,0,0,0,0,0,0
"LTU_053_MZB_LO_46","LTU_053_MZB_LO_46-12.10.2016","12.10.2016",2016,10,12,0,0,0,0,0,0,0,0,0,0,0,0,0,0,0,0,0,0,3,0,8,23,0,0,0,0,0,0,55,0,0,0,0,0,0,0,0,0,42,0,0,0,0,0,0,0,0,0,9,0,0,0,0,0,0,0,80,0,0,14,0,0,0,6,0,0,0,0,0,0,0,0,0,0,6,0,24,0,0,0,18,0,0,0,0,0,0,0,0,0,0,0,68,0,0,0,0,25,0,0,0,0,0,0,0,0,128,0,0,0,39,0,0,0,0,0,0,0,0,0,0,0,0,0,0,0,0,0,0,36,0,0,0,0,0,0,0,0,0,0,0,0,0,0,0,0,0,0,0,29,0,0,0,0,0,6,0,0,0,0,7,0,0,0,0
"LTU_053_MZB_LO_46","LTU_053_MZB_LO_46-03.10.2017","03.10.2017",2017,10,3,0,0,0,0,0,0,0,0,0,0,0,0,0,0,0,0,0,0,0,0,28,20,0,0,0,0,0,0,0,0,0,0,0,0,0,0,0,0,36,0,0,0,0,0,0,0,0,0,48,0,0,0,0,0,0,0,19,0,0,18,0,0,0,2,0,0,0,0,0,0,0,0,0,0,0,0,31,0,0,0,20,0,0,0,0,0,0,0,0,0,0,0,41,0,0,0,0,0,0,0,0,0,0,8,0,0,68,0,0,0,59,0,0,0,0,0,0,0,0,0,0,0,0,0,0,0,2,0,0,0,0,0,0,0,0,0,0,0,0,0,0,0,0,0,0,0,0,0,0,24,0,0,0,0,0,1,0,0,0,0,0,0,0,0,0
"LTU_053_MZB_LO_46","LTU_053_MZB_LO_46-07.10.2020","07.10.2020",2020,10,7,0,0,0,0,0,0,0,0,0,0,0,0,0,0,0,0,0,0,0,0,11,20,0,0,0,0,0,0,1,0,0,1,1,0,0,0,15,0,0,0,0,0,0,0,1,0,0,0,15,6,0,0,0,0,0,0,0,0,0,13,0,0,0,9,0,14,0,0,0,29,0,0,0,0,0,0,0,0,0,0,59,24,0,0,42,0,24,0,0,0,0,0,16,0,0,0,0,0,0,0,0,0,0,0,0,0,0,0,0,0,14,0,0,0,0,0,0,0,0,0,0,0,0,0,0,0,0,0,0,0,0,0,27,0,0,0,0,0,0,0,0,0,32,0,0,0,9,0,0,0,0,0,0,9,0,0,18,0,0,0,13,0,0,0,0
"LTU_053_MZB_LO_47","LTU_053_MZB_LO_47-05.10.2010","05.10.2010",2010,10,5,0,0,0,0,9,0,0,0,0,0,0,0,0,0,0,0,0,12,0,0,1,51,0,0,0,7,0,0,0,0,0,7,7,0,0,0,0,0,0,0,0,0,0,0,0,0,0,0,21,0,0,0,0,0,0,0,52,0,0,11,0,0,0,0,0,0,1,0,0,8,3,27,0,0,0,0,79,0,0,0,145,0,0,0,13,0,0,0,1,0,39,0,0,0,1,0,0,0,0,0,0,0,0,7,0,0,0,0,0,0,0,0,0,0,0,0,0,0,0,0,0,2,0,0,0,0,0,0,0,0,0,0,3,0,0,0,0,0,2,0,0,0,1,3,0,0,0,0,0,7,0,0,0,0,0,0,0,0,0,0,9,0,0,0,0
"LTU_053_MZB_LO_47","LTU_053_MZB_LO_47-08.10.2012","08.10.2012",2012,10,8,0,0,0,0,0,0,0,0,0,0,0,0,0,0,0,0,0,97,0,0,0,112,0,112,0,112,0,72,0,0,0,48,48,0,0,0,0,0,112,64,0,0,0,0,0,0,72,0,88,0,0,0,0,0,0,0,332,0,0,152,0,0,0,0,0,0,0,0,0,124,0,0,0,0,0,0,377,0,0,0,196,0,0,0,0,0,0,0,0,140,232,0,0,0,32,0,0,0,0,0,0,0,0,0,0,0,152,0,0,0,148,0,0,0,0,0,0,0,0,0,0,0,0,0,0,0,0,0,0,184,24,0,68,0,0,0,0,0,0,0,0,0,0,0,0,0,0,0,0,204,0,0,0,0,0,48,0,0,0,0,32,0,0,0,0
"LTU_053_MZB_LO_47","LTU_053_MZB_LO_47-14.10.2013","14.10.2013",2013,10,14,0,0,0,0,0,0,0,0,0,0,0,0,0,0,0,0,0,73,48,0,37,343,0,0,0,64,0,0,0,0,0,60,60,0,0,0,0,0,132,0,0,0,0,0,86,0,0,0,84,0,0,0,0,0,4,0,260,0,0,60,0,64,0,0,0,0,0,0,0,68,44,0,0,0,0,0,0,0,0,0,193,349,0,0,69,0,0,0,0,0,152,0,117,0,145,45,0,212,0,0,0,0,0,0,0,0,124,4,0,0,68,0,32,12,0,0,0,0,0,0,0,0,0,0,0,0,0,0,0,0,0,0,0,0,0,0,0,0,0,0,20,0,0,148,0,0,108,0,0,252,0,0,0,0,0,0,0,0,0,0,72,0,0,0,0
"LTU_053_MZB_LO_47","LTU_053_MZB_LO_47-01.10.2014","01.10.2014",2014,10,1,0,0,0,0,0,0,0,0,0,0,0,0,0,0,0,0,0,37,0,0,1,177,0,0,0,0,0,0,1,0,0,17,17,0,0,0,1,0,0,0,0,0,0,0,1,0,0,0,20,0,0,0,0,0,0,0,46,0,0,4,0,0,0,0,0,0,0,0,0,21,0,9,0,0,0,0,0,5,0,0,188,1,6,0,10,0,51,0,414,1,31,0,4,0,0,0,0,16,0,0,0,0,0,18,0,0,0,0,0,0,0,0,0,0,0,0,0,0,0,0,0,0,0,0,2,0,3,0,0,1,0,0,6,0,0,0,0,0,0,0,0,0,1,2,1,0,0,0,0,0,0,0,0,0,0,0,0,0,0,0,24,0,0,0,0
"LTU_053_MZB_LO_47","LTU_053_MZB_LO_47-07.10.2015","07.10.2015",2015,10,7,0,0,0,0,1,0,0,0,0,0,0,0,0,0,0,0,0,3,0,0,1,92,0,0,0,3,0,0,6,0,0,3,3,0,1,0,3,0,12,0,0,0,0,0,3,0,0,0,7,1,0,0,0,0,8,0,20,0,0,7,0,0,0,0,0,0,1,0,0,5,2,1,0,2,0,0,3,0,3,0,16,0,0,0,1,0,0,0,36,3,16,0,0,0,2,5,0,30,0,4,0,0,0,34,0,0,0,0,0,0,0,0,1,0,0,0,0,0,0,0,0,0,0,0,1,0,1,0,0,1,0,0,6,0,0,0,0,1,0,0,0,0,0,0,0,3,2,0,0,9,0,0,0,0,0,1,0,0,0,0,14,0,0,0,0
"LTU_053_MZB_LO_47","LTU_053_MZB_LO_47-10.10.2016","10.10.2016",2016,10,10,0,0,0,0,0,0,0,0,0,0,0,0,0,0,0,0,0,0,8,0,0,47,0,0,0,16,0,0,7,0,0,0,0,0,0,0,0,0,52,6,0,0,0,0,21,0,0,0,29,0,0,0,0,0,10,0,51,0,4,38,0,0,0,4,0,0,0,0,0,0,0,0,0,8,0,0,0,0,0,0,27,0,0,0,25,0,0,0,0,0,97,0,10,0,13,0,0,38,0,0,0,0,0,0,0,0,18,4,0,0,45,0,0,0,0,0,0,0,0,0,0,0,0,0,0,0,3,0,0,18,0,0,33,0,0,0,0,1,0,0,3,0,5,0,0,15,0,0,0,103,0,0,0,0,0,7,0,0,0,0,23,0,0,0,0
"LTU_053_MZB_LO_47","LTU_053_MZB_LO_47-04.10.2017","04.10.2017",2017,10,4,0,0,0,0,0,0,0,0,0,0,0,0,0,0,0,0,0,0,0,0,2,0,0,0,0,8,0,14,0,0,0,0,0,0,0,1,0,0,15,0,0,0,0,0,0,0,0,0,1,0,0,0,0,0,4,0,46,0,0,1,0,0,0,0,0,0,0,0,0,0,0,7,0,0,0,0,0,0,0,0,53,0,0,0,0,0,0,0,3,0,0,0,0,0,13,0,0,18,0,0,0,4,0,6,0,0,4,0,0,0,42,0,0,0,0,0,0,0,0,0,0,0,0,0,0,0,1,0,0,26,0,0,20,0,0,0,0,0,0,0,0,0,0,6,0,0,0,0,0,63,0,0,0,0,0,3,0,0,0,0,9,0,0,0,0
"LTU_053_MZB_LO_47","LTU_053_MZB_LO_47-01.10.2020","01.10.2020",2020,10,1,0,0,0,0,0,0,0,0,0,0,9,0,0,0,0,0,0,10,9,0,0,0,0,0,0,0,0,0,0,0,0,8,8,0,0,5,0,0,0,0,0,0,0,0,12,0,0,0,0,0,0,0,0,0,0,0,0,0,0,35,0,0,0,11,0,0,0,0,0,0,0,17,0,0,0,0,0,0,0,0,0,0,0,0,0,0,0,0,0,0,0,0,0,0,13,0,0,38,0,0,0,0,0,0,0,7,0,12,0,0,71,0,0,0,0,0,0,0,0,0,0,0,0,0,0,0,1,0,0,0,0,0,32,0,0,0,0,0,0,0,6,0,0,0,0,10,0,0,0,16,0,0,0,0,0,8,0,0,0,0,9,0,0,0,0
"LTU_053_MZB_LO_48","LTU_053_MZB_LO_48-06.10.2010","06.10.2010",2010,10,6,0,0,0,0,0,0,0,0,0,0,0,0,0,0,0,0,0,0,0,0,0,6,0,0,0,0,0,0,0,0,0,5,5,0,0,0,0,0,0,0,0,0,0,0,0,0,0,0,0,0,0,0,0,0,0,0,0,0,0,0,0,0,0,0,0,0,0,0,0,0,3,0,0,0,0,0,0,0,0,0,0,0,0,0,0,0,0,0,0,0,0,0,0,0,0,0,0,0,0,0,0,0,0,0,0,0,0,0,0,0,12,0,0,0,0,0,0,0,0,0,0,0,0,0,0,0,0,0,0,0,2,0,0,0,0,0,0,0,0,0,0,0,0,0,0,0,0,0,0,0,0,0,0,0,0,0,4,0,0,0,0,0,0,0,0
"LTU_053_MZB_LO_48","LTU_053_MZB_LO_48-03.10.2012","03.10.2012",2012,10,3,0,0,0,0,0,0,0,0,0,0,0,0,0,0,0,0,0,25,0,0,25,0,0,0,0,0,0,0,0,0,0,0,0,0,0,0,0,0,12,0,0,0,0,0,0,0,0,0,0,0,0,0,0,0,0,0,33,0,0,5,0,0,0,0,0,0,0,0,0,0,3,0,0,0,0,0,0,0,0,0,24,0,0,0,0,0,0,0,0,0,0,0,0,0,0,0,0,34,0,0,0,0,0,0,25,0,0,0,0,0,18,0,0,0,0,0,0,0,0,0,0,0,0,0,0,0,0,0,0,24,0,0,0,0,0,0,0,0,0,0,0,0,0,0,0,0,0,0,0,56,0,0,0,0,0,0,0,0,0,0,12,0,0,0,0
"LTU_053_MZB_LO_48","LTU_053_MZB_LO_48-09.10.2013","09.10.2013",2013,10,9,0,0,0,0,0,0,0,0,0,0,0,0,0,0,0,0,0,34,0,0,27,0,0,0,2,9,0,0,0,0,0,0,0,0,0,0,0,0,80,0,0,0,0,0,0,0,0,0,31,0,0,0,0,0,0,0,83,0,0,0,0,0,0,0,0,0,0,0,0,0,0,13,0,0,0,0,71,0,0,0,0,0,0,0,0,0,19,0,0,0,29,0,18,0,23,0,0,19,0,8,0,0,0,0,0,0,0,0,0,0,68,0,0,0,0,0,0,0,0,0,0,0,0,0,0,0,0,0,0,30,0,0,24,0,0,0,0,0,0,0,0,0,0,0,0,0,0,0,0,83,0,0,0,0,0,0,0,0,0,0,0,0,0,0,0
"LTU_053_MZB_LO_48","LTU_053_MZB_LO_48-09.10.2014","09.10.2014",2014,10,9,0,0,0,0,0,0,0,0,0,0,0,0,0,0,0,0,0,34,0,0,8,0,0,6,0,0,0,24,7,0,0,0,0,0,0,0,0,0,79,0,0,0,0,0,10,0,0,0,71,0,0,0,0,0,0,0,36,0,0,66,0,0,0,0,0,0,0,0,0,0,2,25,0,0,0,0,0,0,0,0,24,0,0,0,0,0,0,0,0,12,46,0,14,0,11,0,0,40,0,0,0,0,0,0,0,0,0,0,0,0,28,0,0,0,0,0,0,0,0,0,0,0,0,0,0,0,6,0,0,34,0,0,0,0,0,0,0,0,0,0,0,0,0,0,0,0,0,0,0,86,0,0,0,0,0,0,0,0,0,0,5,0,0,0,0
"LTU_053_MZB_LO_48","LTU_053_MZB_LO_48-07.10.2015","07.10.2015",2015,10,7,0,0,0,0,0,0,0,0,0,0,0,0,0,0,0,0,0,0,0,0,0,19,0,0,0,0,0,0,0,0,0,0,0,0,0,0,0,0,40,0,0,0,0,0,73,0,0,0,0,3,0,0,0,0,0,0,58,0,0,0,0,0,0,0,0,0,0,0,0,0,0,0,0,0,2,0,0,0,0,0,0,0,0,0,0,0,0,0,0,0,0,0,0,0,0,0,0,2,0,0,0,0,0,0,0,0,0,1,0,0,23,0,0,0,0,0,0,0,0,0,0,0,0,0,0,0,0,0,0,6,0,0,0,0,0,0,0,0,0,0,0,0,0,0,0,0,0,0,0,0,0,0,0,0,0,0,0,0,0,0,0,0,0,0,0
"LTU_053_MZB_LO_48","LTU_053_MZB_LO_48-05.10.2016","05.10.2016",2016,10,5,0,0,0,0,0,0,0,0,0,0,0,0,0,0,0,0,0,14,0,0,17,39,0,0,0,7,0,17,0,0,0,0,0,0,0,0,0,0,18,0,0,0,0,0,0,0,0,0,25,0,0,0,0,0,0,0,55,0,0,7,0,0,0,0,0,0,0,0,0,0,0,0,0,0,0,0,23,0,0,0,26,0,0,0,0,0,0,0,0,8,0,0,0,0,0,0,0,41,0,0,0,0,0,0,0,0,0,0,0,0,56,0,0,0,0,0,0,0,0,0,0,0,0,0,0,0,0,0,0,19,0,0,0,0,0,0,0,0,0,0,1,0,0,0,0,0,0,0,0,52,0,0,0,0,0,7,0,0,0,0,0,0,0,0,0
"LTU_053_MZB_LO_48","LTU_053_MZB_LO_48-04.10.2017","04.10.2017",2017,10,4,0,0,0,0,0,0,0,0,0,0,0,0,0,0,0,0,0,18,10,0,0,31,0,0,11,19,0,37,0,0,16,0,0,0,0,0,0,0,26,0,0,0,0,0,0,0,0,0,14,0,0,0,0,0,0,0,8,0,0,0,0,0,0,6,0,0,0,0,0,15,0,0,0,0,0,0,0,0,0,0,35,0,0,0,0,0,0,0,0,0,0,0,0,0,5,0,0,18,0,0,0,0,0,0,0,0,0,0,0,0,22,0,0,0,0,0,0,0,0,0,0,0,0,0,0,0,0,0,0,36,0,0,14,0,0,0,0,0,0,0,0,0,0,0,0,0,0,0,0,38,0,0,0,0,0,0,0,0,0,0,0,0,0,0,0
"LTU_053_MZB_LO_48","LTU_053_MZB_LO_48-07.10.2020","07.10.2020",2020,10,7,0,0,0,0,0,0,0,0,0,0,0,0,0,0,0,0,0,0,8,0,0,0,0,0,0,0,0,0,0,0,8,12,12,0,0,0,0,0,17,0,0,0,0,0,0,0,0,0,0,0,0,0,0,0,0,0,0,0,0,1,0,0,0,4,0,0,0,0,0,0,0,0,0,0,0,0,0,0,0,0,14,20,0,0,0,0,0,0,0,0,23,0,0,0,8,0,12,0,0,0,0,0,0,0,0,0,7,0,0,0,0,0,0,0,0,0,0,0,0,0,0,0,0,0,13,0,1,0,0,0,0,0,0,0,0,0,0,0,0,0,1,0,0,0,0,0,12,0,0,46,0,0,0,0,0,3,0,0,0,0,1,0,0,0,0
"LTU_053_MZB_LO_50","LTU_053_MZB_LO_50-04.10.2010","04.10.2010",2010,10,4,0,0,0,0,0,0,0,0,0,0,0,0,0,0,0,0,0,0,0,0,0,0,0,0,0,34,0,0,0,0,0,43,43,0,0,0,0,0,64,0,0,0,0,0,18,0,0,0,0,0,0,0,0,0,17,0,0,0,0,0,0,0,0,0,0,243,0,0,0,0,0,0,0,0,0,0,0,0,0,0,0,0,0,0,0,0,0,0,0,0,0,0,0,0,62,0,0,1,0,0,17,14,0,0,0,0,0,0,0,0,287,0,0,0,0,0,0,0,0,0,0,0,0,0,69,0,0,0,0,0,35,0,0,0,0,0,0,0,0,0,0,0,0,0,0,0,0,0,0,48,0,0,0,0,0,0,0,0,0,0,0,0,0,0,0
"LTU_053_MZB_LO_50","LTU_053_MZB_LO_50-01.10.2012","01.10.2012",2012,10,1,0,0,0,0,0,0,0,0,0,0,0,0,0,0,0,0,0,0,10,0,0,50,0,0,0,128,0,0,0,0,0,11,11,0,0,0,0,0,129,0,0,0,0,1,0,0,0,0,0,0,0,24,0,0,36,0,0,0,0,12,0,0,0,24,0,57,2,0,0,0,0,0,0,0,14,0,0,0,0,0,0,0,0,0,0,0,0,0,0,0,0,0,0,0,4,0,0,50,0,0,0,0,0,0,0,0,0,0,0,0,240,0,0,0,0,0,0,0,0,0,0,0,3,0,0,0,0,0,0,46,7,0,0,0,0,0,0,0,0,0,0,0,0,0,0,12,0,0,0,254,0,0,0,0,0,0,0,0,0,0,0,0,0,0,0
"LTU_053_MZB_LO_50","LTU_053_MZB_LO_50-07.10.2013","07.10.2013",2013,10,7,0,0,0,0,0,0,0,0,0,0,0,0,0,0,0,0,0,0,0,0,0,0,0,0,0,0,0,0,28,0,0,0,0,0,0,0,0,0,41,0,0,0,0,0,0,0,0,0,0,0,0,0,0,0,0,0,0,0,0,0,0,0,0,0,0,46,0,0,0,0,0,0,0,0,0,0,47,0,0,0,62,0,0,0,0,0,0,0,0,18,0,0,0,0,17,0,0,0,0,0,24,0,0,0,0,0,0,0,0,0,3,0,0,0,0,0,0,0,0,0,0,0,0,0,0,0,0,0,0,0,0,0,28,0,0,0,0,0,0,0,0,0,0,0,0,0,0,0,0,0,0,0,0,0,0,0,0,0,0,0,0,3,0,0,0
"LTU_053_MZB_LO_50","LTU_053_MZB_LO_50-06.10.2014","06.10.2014",2014,10,6,0,0,0,0,16,0,0,0,0,0,0,0,0,0,0,0,0,0,0,0,0,21,24,0,0,0,0,0,24,0,0,9,9,0,0,9,0,0,43,0,0,5,0,0,0,0,0,0,12,0,0,0,0,0,11,0,0,0,0,0,0,0,0,8,0,36,0,0,14,10,5,8,0,0,0,0,0,0,0,0,13,27,0,0,0,0,0,0,0,42,13,0,0,0,30,0,0,5,0,0,0,0,0,0,0,4,26,0,0,0,10,0,5,6,0,0,0,0,0,0,0,0,0,0,0,0,0,0,0,27,0,0,0,0,0,0,0,0,0,0,0,0,0,0,0,0,0,0,0,35,0,0,0,0,0,0,0,0,0,0,9,0,0,0,0
"LTU_053_MZB_LO_50","LTU_053_MZB_LO_50-05.10.2015","05.10.2015",2015,10,5,0,0,0,1,0,0,0,0,0,0,0,0,0,0,0,0,0,0,3,0,0,237,0,0,0,9,0,12,0,0,16,6,6,0,0,155,0,0,26,0,0,0,0,0,0,0,0,0,0,8,0,0,0,0,0,0,21,0,0,0,0,0,0,0,0,18,0,0,0,0,0,7,0,0,0,0,0,0,0,0,0,0,0,0,0,0,0,0,0,0,28,0,0,0,5,0,0,18,0,0,0,0,0,0,0,0,0,4,0,0,51,0,0,0,0,0,0,0,0,0,0,0,0,0,0,0,7,0,0,0,13,0,41,0,0,0,0,0,0,0,0,0,0,0,0,1,8,0,0,12,0,0,0,8,0,0,0,0,0,0,0,0,0,0,0
"LTU_053_MZB_LO_50","LTU_053_MZB_LO_50-03.10.2016","03.10.2016",2016,10,3,0,0,0,0,0,0,0,0,0,0,0,0,0,0,0,0,0,0,0,0,0,38,0,0,0,0,0,0,0,0,0,9,9,0,0,0,0,0,48,0,0,0,0,0,0,0,0,0,19,0,0,0,0,0,0,0,0,0,0,0,0,0,0,16,0,3,0,0,0,10,0,0,0,0,0,0,0,0,0,0,4,0,0,0,0,0,0,0,0,0,0,0,0,0,0,0,0,18,0,0,0,0,0,0,0,3,0,0,0,0,77,0,0,0,0,0,0,0,0,0,0,0,0,0,0,0,0,0,0,35,0,0,0,0,0,0,0,0,0,0,3,0,0,0,0,0,18,0,0,60,0,0,0,0,0,0,0,0,0,0,0,0,0,0,0
"LTU_053_MZB_LO_50","LTU_053_MZB_LO_50-02.10.2017","02.10.2017",2017,10,2,0,0,0,0,0,0,0,0,0,0,0,0,0,0,0,0,0,0,0,0,0,0,0,0,25,16,0,0,0,0,0,0,0,0,0,0,0,0,19,0,0,0,0,0,0,0,0,0,0,0,0,0,0,0,0,0,0,0,0,0,0,0,0,6,0,0,0,0,0,15,0,0,0,0,0,0,0,0,0,0,30,0,0,0,0,0,0,0,0,0,0,0,0,0,38,0,0,0,0,0,0,0,0,0,0,0,0,0,0,0,0,0,0,0,0,0,0,0,0,0,0,0,0,0,0,0,0,0,0,36,0,0,0,0,0,0,0,0,0,0,0,0,0,0,0,0,0,0,0,20,0,0,0,0,0,4,0,0,0,0,0,0,0,0,0
"LTU_053_MZB_LO_50","LTU_053_MZB_LO_50-05.10.2020","05.10.2020",2020,10,5,0,0,0,2,0,0,0,0,0,0,0,0,0,0,0,0,0,0,5,0,0,0,0,0,0,0,0,0,0,0,0,5,5,0,0,0,0,0,0,0,0,0,0,0,8,0,0,0,0,0,0,0,0,0,3,0,0,0,0,0,0,0,0,4,0,0,0,0,0,0,0,0,0,2,0,0,0,0,0,0,0,0,5,0,0,0,0,0,0,0,0,0,0,0,3,0,0,0,0,0,0,0,0,0,0,0,0,5,0,0,0,0,0,0,0,0,0,0,0,0,0,0,0,0,0,0,0,0,0,0,7,0,14,0,0,0,0,0,0,0,4,0,0,0,0,0,0,0,0,7,0,0,0,0,0,0,0,0,0,0,3,0,0,0,0
"LTU_053_MZB_LO_51","LTU_053_MZB_LO_51-14.09.2010","14.09.2010",2010,9,14,0,0,0,0,0,0,0,0,0,0,0,0,0,0,0,0,0,24,1,0,41,46,0,0,0,0,0,0,0,0,0,1,1,0,0,0,0,0,0,0,0,0,0,0,0,0,0,0,21,0,0,0,0,0,0,0,43,0,0,0,0,0,0,7,0,1,0,0,8,0,0,0,0,0,1,0,11,0,0,0,101,0,0,0,0,0,0,0,0,0,0,0,0,0,0,0,0,0,0,0,0,0,0,1,0,0,12,0,0,0,25,0,0,0,0,0,0,0,0,0,0,0,0,0,0,0,0,0,0,0,0,0,0,0,0,0,0,0,0,6,0,0,5,0,0,0,60,0,0,0,0,0,0,0,0,14,0,0,0,0,0,0,0,0,0
"LTU_053_MZB_LO_51","LTU_053_MZB_LO_51-25.09.2012","25.09.2012",2012,9,25,0,0,0,0,0,0,0,0,0,0,0,0,0,0,0,0,0,0,0,0,25,29,0,0,0,0,0,0,0,0,0,19,19,0,0,0,0,0,14,0,0,0,0,0,22,0,0,0,0,0,0,0,0,0,0,0,0,0,0,16,0,0,0,0,0,0,0,0,0,0,0,0,0,0,0,0,0,0,0,0,56,0,0,0,0,0,0,0,0,0,43,0,0,0,0,0,0,0,0,0,0,0,0,0,0,0,0,0,0,0,12,0,0,0,0,0,0,0,0,0,0,0,0,0,0,0,0,0,0,0,13,0,0,0,0,0,0,0,0,0,0,0,0,0,0,0,43,0,0,0,0,0,0,0,0,0,0,0,0,0,0,0,0,0,0
"LTU_053_MZB_LO_51","LTU_053_MZB_LO_51-11.10.2013","11.10.2013",2013,10,11,0,0,0,0,0,0,0,0,0,0,0,0,0,0,0,0,0,6,15,0,16,0,0,0,0,0,0,0,0,0,0,0,0,0,0,0,0,0,45,16,0,0,0,0,14,0,0,0,0,0,0,0,0,0,34,0,81,0,0,18,0,0,0,0,0,0,0,0,0,0,8,33,0,0,0,0,28,0,0,0,23,68,0,0,0,0,0,0,48,0,60,0,4,0,59,0,0,39,0,0,0,0,0,0,0,7,30,0,0,0,53,0,2,0,0,0,0,0,0,0,0,0,0,0,48,0,0,0,0,73,0,0,14,0,0,0,0,0,0,0,0,0,0,0,0,0,0,0,0,181,0,0,0,0,0,34,0,0,0,0,29,0,0,0,0
"LTU_053_MZB_LO_51","LTU_053_MZB_LO_51-01.10.2014","01.10.2014",2014,10,1,0,0,9,0,0,0,0,0,0,0,0,0,0,0,0,0,0,0,0,0,4,27,0,0,0,0,0,0,0,0,8,2,2,0,0,0,0,0,8,0,0,0,0,0,0,0,0,0,0,0,0,0,0,0,0,0,0,0,0,0,0,0,0,0,0,0,0,0,0,0,0,15,0,0,0,0,20,0,0,0,22,0,0,0,0,0,0,0,0,0,27,0,0,0,0,0,0,0,0,0,0,0,0,6,0,0,12,0,0,0,19,0,0,0,0,0,0,0,0,0,0,0,0,0,0,0,0,0,0,32,0,0,15,0,0,0,0,0,0,0,0,0,0,0,0,7,12,0,0,42,0,0,0,0,0,0,0,0,0,0,0,0,0,0,0
"LTU_053_MZB_LO_51","LTU_053_MZB_LO_51-05.10.2015","05.10.2015",2015,10,5,0,0,0,0,0,0,0,0,0,0,0,0,0,0,0,0,0,13,6,0,8,73,0,0,31,25,0,34,33,0,27,0,0,0,0,0,0,0,64,0,0,0,0,0,0,0,0,0,18,0,0,0,0,0,0,0,60,0,0,0,0,12,0,8,0,0,0,0,0,0,0,17,0,0,0,0,17,0,0,0,25,95,0,0,0,0,0,0,0,36,46,0,0,0,0,0,0,45,0,0,0,0,0,0,0,0,18,0,0,0,24,0,0,0,0,0,0,0,0,0,0,0,0,0,0,0,0,0,0,48,0,0,25,0,0,0,0,0,0,0,6,0,0,0,0,0,0,0,0,82,0,0,0,0,0,0,25,0,0,0,14,1,0,0,0
"LTU_053_MZB_LO_51","LTU_053_MZB_LO_51-04.10.2016","04.10.2016",2016,10,4,0,0,0,0,0,0,0,0,0,0,0,0,0,0,0,0,0,29,0,0,13,104,0,0,18,32,0,24,29,0,38,0,0,18,0,0,0,0,16,0,0,0,0,0,8,0,0,0,47,0,0,0,0,0,0,0,144,0,0,49,0,0,0,16,0,0,0,0,0,27,0,0,0,0,0,0,79,0,0,0,103,0,3,0,39,0,0,0,0,1,0,0,43,0,24,0,0,0,0,0,0,0,0,47,0,0,37,0,0,0,32,0,0,3,0,0,0,0,0,0,0,0,0,0,0,0,0,0,0,100,0,0,56,0,0,0,0,0,0,0,0,0,0,0,0,6,29,0,0,72,0,0,0,0,0,18,0,0,0,0,13,3,0,0,0
"LTU_053_MZB_LO_51","LTU_053_MZB_LO_51-09.10.2017","09.10.2017",2017,10,9,0,0,0,0,0,0,0,0,0,0,0,0,0,0,0,0,0,0,11,0,0,19,0,0,0,9,0,28,0,0,0,7,7,0,0,0,0,0,20,0,0,0,0,0,0,0,0,0,0,0,0,0,0,0,0,0,57,0,0,0,0,0,0,8,0,2,0,0,0,2,0,0,0,0,0,0,0,0,0,0,3,30,0,0,21,0,0,0,0,0,0,0,0,0,16,0,0,0,0,0,0,0,0,0,0,1,11,0,0,0,23,0,0,0,0,0,0,0,0,0,0,0,0,0,0,0,0,0,0,34,0,0,1,0,0,0,0,0,0,0,0,0,0,0,18,0,22,0,0,55,0,0,0,6,0,0,0,0,0,0,0,0,0,0,0
"LTU_053_MZB_LO_51","LTU_053_MZB_LO_51-07.10.2020","07.10.2020",2020,10,7,0,0,0,0,0,0,0,0,0,0,0,0,0,0,0,0,0,35,0,0,0,121,0,0,0,16,9,0,0,0,4,5,5,25,0,0,0,0,214,0,0,0,0,0,0,0,0,0,0,0,0,0,136,0,0,0,209,0,0,18,0,0,0,11,0,0,0,0,0,0,1,16,0,0,0,0,5,0,0,0,29,194,0,0,0,0,0,0,0,0,26,0,0,0,0,0,0,0,0,0,0,0,0,0,0,0,0,0,0,0,199,0,4,0,0,0,0,0,0,0,0,0,0,0,0,0,0,0,0,0,0,0,1,0,0,0,0,0,0,0,0,0,24,0,0,0,147,0,0,38,0,0,0,0,0,0,45,0,0,0,3,0,0,0,0
"LTU_053_MZB_LO_52","LTU_053_MZB_LO_52-11.10.2010","11.10.2010",2010,10,11,0,0,0,0,0,0,0,0,0,0,0,0,0,0,0,0,0,0,1,0,0,0,0,0,0,1,0,0,0,0,0,1,1,0,0,0,0,0,0,0,0,0,0,0,1,0,0,0,0,0,0,0,0,0,1,0,0,0,0,1,0,0,0,0,0,7,0,0,0,0,0,9,0,0,0,0,0,0,0,0,0,0,0,0,0,0,0,0,0,4,0,0,0,0,2,0,0,0,0,0,1,0,0,0,0,0,0,1,0,0,0,0,0,0,0,0,0,0,0,0,0,0,0,0,12,0,0,0,0,0,0,0,0,0,0,0,0,0,0,0,0,0,0,0,0,4,0,0,0,3,0,0,0,0,0,0,0,0,0,0,0,1,0,0,0
"LTU_053_MZB_LO_52","LTU_053_MZB_LO_52-28.09.2011","28.09.2011",2011,9,28,0,0,0,0,0,0,0,0,0,0,0,0,0,0,0,0,0,0,0,0,0,0,0,0,0,2,0,0,0,0,0,16,16,0,0,0,0,0,0,0,0,0,0,0,0,0,0,0,0,0,0,0,0,0,3,0,1,0,0,6,0,0,0,1,0,32,0,0,0,0,0,0,0,0,0,0,0,0,0,0,3,0,0,0,0,0,0,0,0,4,0,0,0,0,0,0,0,0,0,0,0,0,0,0,0,0,0,0,0,0,4,0,0,0,0,0,0,0,0,0,0,0,0,0,4,0,0,0,0,0,0,0,0,0,0,0,0,0,0,0,0,0,0,0,0,0,0,0,0,5,0,0,0,0,0,0,0,0,0,0,0,0,3,0,0
"LTU_053_MZB_LO_52","LTU_053_MZB_LO_52-08.10.2012","08.10.2012",2012,10,8,0,0,0,0,0,0,0,0,0,0,0,0,0,0,0,0,0,0,6,0,0,0,0,0,0,0,0,0,0,0,2,8,8,0,0,0,0,0,0,0,0,0,0,0,1,0,0,0,0,0,0,0,8,0,0,0,0,0,0,0,0,0,0,0,0,0,0,0,0,0,1,0,0,0,0,0,0,0,0,0,2,0,0,0,0,0,0,0,0,0,1,0,0,0,0,0,0,2,0,0,0,0,0,0,0,0,0,0,0,0,16,0,0,0,0,0,0,0,0,0,0,0,0,0,0,0,0,0,0,16,0,0,0,0,0,0,0,0,0,0,0,0,0,0,0,0,0,0,0,9,0,0,0,0,0,0,0,0,0,0,0,0,0,0,0
"LTU_053_MZB_LO_52","LTU_053_MZB_LO_52-26.09.2013","26.09.2013",2013,9,26,0,0,0,0,0,0,0,0,0,0,0,0,0,0,0,0,0,0,3,0,0,1,0,0,0,0,0,0,0,0,0,1,1,0,0,0,0,0,0,0,0,1,0,0,0,0,0,0,0,0,0,0,0,0,0,0,0,0,0,0,0,0,0,0,0,32,0,0,0,0,0,4,0,1,0,0,0,0,0,0,0,0,0,0,0,0,0,0,0,0,0,0,0,0,0,0,0,0,0,0,0,0,0,0,0,2,0,0,0,0,0,0,0,0,0,0,0,0,0,0,0,0,0,0,0,0,0,0,0,0,0,0,0,0,0,0,0,0,0,0,0,0,0,0,0,0,0,0,0,0,0,0,0,0,0,0,0,0,0,0,0,0,0,0,0
"LTU_053_MZB_LO_52","LTU_053_MZB_LO_52-13.10.2014","13.10.2014",2014,10,13,0,0,0,0,0,0,0,0,0,0,0,0,0,0,1,0,0,0,0,0,0,6,0,0,0,3,0,0,0,0,37,0,0,0,0,0,0,0,563,0,0,0,0,0,162,0,0,0,0,0,0,0,0,0,3,0,6,0,0,106,0,0,0,0,0,9,2,0,0,0,0,0,0,0,0,0,0,0,0,0,3,0,0,0,0,0,0,0,0,0,0,0,0,0,0,0,0,0,0,0,2,0,0,0,0,0,0,0,0,0,274,0,0,0,0,0,0,0,0,0,0,0,0,0,0,0,0,0,0,0,0,0,3,0,0,0,0,0,0,0,1,0,0,0,0,9,0,0,0,23,0,0,0,0,0,36,0,0,0,0,0,0,2,0,0
"LTU_053_MZB_LO_52","LTU_053_MZB_LO_52-12.10.2015","12.10.2015",2015,10,12,0,0,0,0,0,0,0,0,0,0,0,0,0,0,0,0,0,8,0,0,0,40,0,0,0,0,0,0,0,0,0,0,0,0,0,0,0,0,9,0,0,0,0,0,0,0,0,0,0,0,0,0,0,0,0,0,38,0,0,0,0,0,0,0,0,25,0,0,0,0,0,8,0,14,0,0,8,0,0,0,10,0,0,0,0,0,0,0,0,0,0,0,0,0,0,0,0,0,0,0,0,0,0,0,0,0,0,0,0,0,15,0,0,0,0,0,0,0,0,0,0,0,0,0,0,0,0,0,0,0,0,0,0,0,0,0,0,0,0,0,0,0,0,0,0,0,0,0,0,0,0,0,0,0,0,0,0,0,0,0,17,0,0,0,0
"LTU_053_MZB_LO_52","LTU_053_MZB_LO_52-12.09.2016","12.09.2016",2016,9,12,0,0,0,0,0,0,0,0,0,0,0,0,0,0,0,0,0,0,37,0,0,24,0,0,0,0,0,0,0,0,0,19,19,0,0,0,0,0,83,0,0,0,0,0,0,0,0,1,0,0,0,0,19,0,0,0,24,0,0,6,0,0,0,7,0,69,2,0,0,0,0,0,0,0,0,0,0,0,0,0,8,4,0,0,0,0,0,0,0,0,0,0,0,0,0,0,0,0,0,0,1,0,0,0,0,0,0,0,0,0,129,0,0,0,0,0,0,0,0,0,0,0,0,0,9,0,0,0,0,0,0,0,0,0,0,0,0,0,0,0,0,0,0,0,0,0,21,0,0,16,0,0,0,0,0,0,0,0,0,0,0,0,0,0,0
"LTU_053_MZB_LO_52","LTU_053_MZB_LO_52-04.10.2017","04.10.2017",2017,10,4,0,0,0,0,0,0,0,0,0,0,0,0,0,0,0,0,0,0,82,0,0,20,0,0,0,6,0,0,0,0,0,19,19,0,0,0,0,0,18,0,0,0,0,0,9,0,0,0,0,0,0,0,0,0,0,0,0,0,0,16,0,0,0,7,0,234,0,0,0,0,0,0,0,0,4,0,0,0,0,0,0,0,0,0,0,0,0,0,0,0,0,0,0,0,0,8,0,0,0,0,0,9,0,0,0,0,0,0,0,0,272,0,0,0,0,0,0,0,0,0,0,0,1,0,9,0,0,0,0,0,0,0,0,0,0,0,0,0,0,0,0,0,0,0,0,4,16,0,0,26,0,0,0,0,0,0,0,0,0,0,0,0,0,0,0
"LTU_053_MZB_LO_52","LTU_053_MZB_LO_52-14.09.2020","14.09.2020",2020,9,14,0,1,6,0,0,0,0,0,0,1,0,0,0,0,0,0,0,0,67,0,0,26,0,0,0,4,8,0,0,0,26,24,24,0,0,4,0,0,506,0,0,0,0,0,42,0,0,1,0,0,0,0,0,0,1,0,33,0,0,13,0,0,0,19,0,363,5,0,0,13,0,42,0,0,0,2,4,0,0,0,202,33,0,0,0,0,0,0,0,6,0,0,0,0,0,6,0,13,0,0,1,0,0,0,0,0,15,0,0,0,9,0,0,0,0,0,0,0,0,0,0,0,0,0,11,0,0,0,0,2,0,0,0,0,0,0,0,0,0,0,1,0,0,0,0,0,125,0,0,10,0,0,0,0,0,0,0,0,0,0,0,1,15,0,0
"LTU_053_MZB_LO_53","LTU_053_MZB_LO_53-27.09.2010","27.09.2010",2010,9,27,0,0,0,0,0,0,0,0,0,0,0,0,0,0,0,0,0,79,0,0,0,281,0,0,20,26,0,0,95,0,0,20,20,0,0,0,0,0,0,0,0,0,0,0,0,0,0,0,0,0,0,1,0,0,0,0,66,0,0,35,0,0,0,30,0,0,0,0,0,12,0,0,0,0,0,0,17,0,0,0,79,0,0,0,0,0,0,0,0,0,0,0,0,0,0,0,0,3,0,0,0,0,0,0,0,0,44,0,0,0,85,0,0,0,0,0,0,0,0,0,0,0,0,0,0,0,0,0,0,0,0,0,0,0,0,0,0,0,0,0,0,0,0,0,0,0,56,0,0,251,0,0,0,0,0,0,0,0,0,0,0,3,0,0,1
"LTU_053_MZB_LO_53","LTU_053_MZB_LO_53-26.09.2012","26.09.2012",2012,9,26,0,0,0,0,0,0,0,0,0,0,0,0,0,0,0,0,0,50,3,0,7,52,0,0,0,3,0,0,41,0,0,5,5,0,0,0,0,0,0,0,0,0,0,0,0,0,0,0,0,0,0,3,0,0,0,0,5,0,0,1,0,0,0,8,0,0,8,0,0,0,1,1,0,0,0,0,2,0,0,0,51,0,0,0,4,0,0,0,1,3,2,0,0,0,0,0,0,0,0,0,0,0,0,8,0,0,0,0,0,0,0,0,0,0,0,0,0,0,0,0,0,0,0,0,0,0,0,0,0,0,0,0,2,0,0,0,0,0,0,0,0,0,0,0,0,0,3,0,0,8,0,0,0,0,0,0,0,0,0,0,0,0,0,0,0
"LTU_053_MZB_LO_53","LTU_053_MZB_LO_53-16.09.2013","16.09.2013",2013,9,16,0,0,0,0,0,0,0,0,0,0,0,0,0,0,0,0,0,92,32,0,57,187,0,0,0,0,0,0,0,0,0,25,25,0,0,0,0,0,136,0,0,0,0,4,0,0,0,0,0,0,0,29,0,0,0,0,412,0,0,0,0,0,0,19,0,0,6,0,0,0,20,0,2,0,0,0,0,0,0,0,60,0,0,0,0,0,0,0,0,0,782,0,0,0,146,0,0,30,0,0,0,0,0,0,0,0,0,0,0,0,349,0,0,6,0,0,0,0,0,0,0,0,0,0,0,0,16,0,0,0,0,0,24,0,0,0,0,0,0,0,12,0,0,0,0,0,0,0,0,76,0,0,0,0,0,0,0,0,0,0,0,4,0,0,16
"LTU_053_MZB_LO_53","LTU_053_MZB_LO_53-23.09.2014","23.09.2014",2014,9,23,0,0,0,0,0,0,0,0,0,0,0,0,0,0,0,0,0,46,0,0,10,16,0,0,0,1,0,0,4,0,0,16,16,0,0,0,0,0,9,0,0,0,0,0,1,0,0,0,0,5,0,5,0,0,0,0,66,2,0,13,0,0,0,19,0,0,4,0,0,0,6,2,0,2,0,0,2,0,0,0,23,11,13,0,5,0,0,0,10,21,1,0,0,1,0,0,0,12,0,0,0,0,0,0,0,1,0,2,0,0,0,0,0,0,0,0,0,0,0,0,0,0,0,0,11,0,1,0,0,0,0,0,4,0,0,0,0,0,0,0,0,0,0,0,0,0,0,0,0,6,0,0,0,0,0,0,0,0,0,0,0,0,0,0,0
"LTU_053_MZB_LO_53","LTU_053_MZB_LO_53-21.09.2015","21.09.2015",2015,9,21,0,0,0,0,0,0,0,0,0,0,0,0,0,0,0,0,0,36,5,0,8,73,0,0,7,8,0,0,0,0,0,6,6,0,0,6,0,0,66,0,0,0,0,0,0,0,0,0,17,13,0,6,0,0,0,0,66,0,0,13,0,0,0,19,0,11,6,0,0,0,4,12,0,0,5,0,0,0,0,0,46,0,0,0,0,0,0,0,0,0,16,0,0,0,0,0,0,0,0,0,0,0,0,0,0,0,21,0,0,0,24,0,0,0,0,0,0,0,0,0,0,0,0,0,0,0,9,0,0,0,0,0,14,0,0,0,0,0,0,0,0,0,0,0,0,0,0,0,0,57,0,0,0,0,0,0,0,0,0,0,6,2,0,0,0
"LTU_053_MZB_LO_53","LTU_053_MZB_LO_53-26.09.2016","26.09.2016",2016,9,26,0,0,0,3,0,0,0,0,0,0,0,0,0,0,0,0,0,28,0,0,0,35,0,0,0,27,0,16,11,0,15,9,9,0,0,0,0,0,18,0,0,0,0,0,5,0,0,0,0,0,0,15,0,0,4,0,64,0,0,0,0,0,0,11,0,0,0,0,0,0,0,0,0,0,0,0,0,0,0,0,20,54,0,0,0,0,0,0,0,0,0,0,0,0,0,0,0,34,0,0,0,0,0,0,0,7,0,14,0,0,21,0,0,0,0,0,0,0,0,0,0,0,0,0,18,0,0,0,0,0,0,0,14,0,0,0,0,0,0,0,0,0,0,0,0,7,31,0,3,108,0,0,0,0,0,5,0,0,0,0,0,1,0,0,0
"LTU_053_MZB_LO_53","LTU_053_MZB_LO_53-25.10.2017","25.10.2017",2017,10,25,0,0,0,0,0,0,0,0,0,0,0,0,0,0,0,0,0,3,33,0,0,7,0,0,0,16,0,0,14,0,0,4,4,0,0,0,0,0,0,0,0,0,0,0,23,0,0,0,0,0,0,0,50,0,0,0,0,0,0,11,0,0,0,4,0,0,0,0,0,0,1,4,0,0,0,0,0,0,0,0,109,0,0,0,0,0,0,0,0,0,0,0,0,0,7,0,0,1,0,0,0,0,0,0,0,6,0,0,0,0,0,0,0,0,0,0,0,0,0,0,0,0,0,0,18,0,0,0,0,0,0,0,0,0,0,0,1,0,0,0,4,0,0,0,0,0,818,0,0,140,0,0,0,0,0,0,0,0,0,0,0,0,0,0,0
"LTU_053_MZB_LO_53","LTU_053_MZB_LO_53-22.09.2020","22.09.2020",2020,9,22,0,0,0,0,0,0,0,0,0,0,0,0,0,0,0,0,0,179,4,0,2,73,0,0,0,0,0,0,0,0,1,13,13,0,0,0,0,0,10,0,0,0,0,0,0,0,0,0,0,0,0,10,0,0,5,0,3,0,0,6,0,0,0,12,0,0,4,0,0,0,5,1,0,0,0,0,2,0,0,0,22,0,0,0,0,0,0,0,0,0,0,0,0,0,0,0,0,0,0,0,0,0,0,1,0,0,8,0,0,0,9,0,0,0,0,0,0,0,0,0,0,0,0,0,0,0,0,0,0,1,0,0,0,0,0,0,0,0,0,0,4,0,0,0,0,0,0,0,0,8,0,0,0,0,0,0,0,0,0,0,0,7,0,0,2
"LTU_053_MZB_LO_54","LTU_053_MZB_LO_54-27.09.2010","27.09.2010",2010,9,27,0,0,0,0,0,0,0,0,0,0,10,0,0,0,0,0,0,22,0,0,0,25,0,0,0,0,0,0,0,0,0,27,27,0,0,0,0,0,0,0,0,0,0,0,18,0,0,0,0,1,0,0,0,0,0,0,0,0,0,14,0,0,0,0,0,0,0,0,0,0,4,0,0,0,1,0,0,0,0,0,20,0,0,0,0,0,0,0,0,0,1,0,0,0,0,0,0,2,0,0,0,0,0,0,0,0,0,0,0,0,0,0,0,0,0,0,0,0,0,0,0,0,0,0,0,0,0,0,0,24,0,0,0,0,0,0,0,0,0,0,0,0,0,0,0,0,0,0,0,0,0,0,0,0,0,0,0,0,0,0,0,0,0,0,0
"LTU_053_MZB_LO_54","LTU_053_MZB_LO_54-24.09.2012","24.09.2012",2012,9,24,0,0,0,0,0,0,0,0,0,0,0,0,0,0,0,0,0,20,0,0,5,38,0,0,0,17,0,0,6,0,2,16,16,0,0,0,0,0,0,0,0,0,0,0,6,0,0,0,0,1,0,0,0,0,4,0,11,0,0,0,0,0,0,4,0,0,1,0,0,0,2,3,0,5,0,0,0,0,0,0,3,6,0,0,0,0,61,0,0,30,1,0,0,0,117,4,0,4,0,0,0,0,0,4,0,1,0,2,0,0,0,0,1,0,0,0,0,0,0,0,0,0,0,0,14,0,0,0,0,0,16,0,0,0,0,0,0,0,0,0,0,2,0,0,0,0,0,0,0,0,0,0,0,0,0,1,0,0,0,0,2,0,0,0,0
"LTU_053_MZB_LO_54","LTU_053_MZB_LO_54-18.09.2013","18.09.2013",2013,9,18,0,0,0,0,0,0,0,0,0,0,0,0,0,0,0,0,0,89,0,0,36,159,0,159,0,76,0,0,0,0,0,44,44,0,0,0,0,0,56,144,0,0,0,0,0,0,0,0,52,0,0,0,0,0,42,0,0,0,0,57,0,0,0,0,0,0,0,0,0,0,36,26,0,16,0,0,0,0,0,0,0,183,0,0,0,0,0,0,0,0,0,0,0,0,0,0,0,135,0,0,0,0,0,0,0,0,0,0,0,0,178,0,0,0,0,0,0,0,27,0,0,0,0,0,0,0,0,0,0,102,0,0,0,0,0,0,0,0,0,0,0,0,0,0,0,0,96,0,0,0,0,0,0,0,0,0,0,0,0,0,22,0,0,0,0
"LTU_053_MZB_LO_54","LTU_053_MZB_LO_54-15.09.2014","15.09.2014",2014,9,15,0,0,0,0,0,1,0,0,0,0,0,0,0,0,0,1,0,1,0,0,2,994,0,0,0,231,0,0,1,0,0,21,21,0,0,0,0,0,24,0,0,7,0,0,46,0,0,0,0,28,0,0,0,0,5,0,0,0,0,0,0,0,0,8,0,0,0,0,0,0,1,1,0,81,1,0,3,0,0,0,0,0,1,0,0,0,66,0,0,703,0,0,0,0,21,0,0,100,0,0,0,0,0,0,0,0,0,1,0,0,0,0,0,0,0,0,0,0,0,0,0,0,0,0,414,0,2,0,0,14,8,0,0,0,0,0,0,0,0,0,0,0,0,0,0,0,0,0,0,0,0,0,0,0,0,0,0,0,0,0,1,0,0,0,0
"LTU_053_MZB_LO_54","LTU_053_MZB_LO_54-22.09.2015","22.09.2015",2015,9,22,0,0,0,0,0,0,0,0,0,0,0,0,0,0,0,0,0,0,0,0,0,131,0,0,42,77,0,28,16,0,0,6,6,0,0,1,0,0,36,0,0,0,0,0,6,0,0,0,0,14,0,0,0,0,20,0,0,0,0,6,0,0,0,10,10,0,0,0,0,0,0,0,0,28,0,0,0,0,0,0,13,0,0,0,0,0,0,0,0,45,13,0,0,0,79,0,0,57,0,4,0,0,0,0,0,0,0,5,0,0,12,0,0,0,0,0,0,0,0,0,0,0,0,0,24,0,0,0,0,163,7,0,0,0,18,0,0,0,0,0,16,0,0,0,0,0,0,0,0,0,0,0,0,0,0,0,0,0,0,0,0,0,0,0,0
"LTU_053_MZB_LO_54","LTU_053_MZB_LO_54-27.09.2016","27.09.2016",2016,9,27,0,0,0,0,0,0,0,0,0,0,0,0,0,0,0,0,0,25,0,0,24,34,0,0,22,27,0,0,79,0,0,23,23,0,0,0,0,0,0,0,0,0,0,0,0,0,0,0,0,0,0,0,0,0,0,0,69,0,0,14,0,0,0,11,0,0,0,0,0,0,2,0,0,0,0,0,0,0,0,0,25,0,0,0,0,0,0,0,0,46,52,0,0,0,0,0,0,62,0,0,0,0,0,0,0,0,0,0,0,0,38,0,0,2,0,0,0,0,0,0,0,0,0,0,0,0,8,0,0,80,0,0,15,0,10,0,0,0,0,0,0,0,0,0,0,0,0,0,0,0,0,0,0,0,0,4,0,22,0,0,19,0,0,0,0
"LTU_053_MZB_LO_54","LTU_053_MZB_LO_54-26.10.2017","26.10.2017",2017,10,26,0,0,0,0,0,0,0,0,0,0,0,0,0,0,0,0,0,0,0,0,0,57,0,0,0,0,0,0,1,0,0,0,0,0,0,0,0,0,8,0,0,0,0,0,0,0,0,0,0,0,0,0,0,0,0,0,0,0,0,0,0,0,0,0,0,0,0,0,0,0,1,1,0,0,0,0,1,0,0,0,0,32,0,0,0,0,0,0,0,0,273,0,1,0,36,0,0,4,0,0,0,0,0,0,0,0,0,0,0,0,0,0,0,0,0,0,0,0,0,0,0,0,0,0,0,0,0,0,0,0,0,0,0,0,0,0,0,0,0,0,9,0,0,0,0,0,0,0,0,0,0,0,0,0,0,0,0,0,0,0,0,0,0,0,0
"LTU_053_MZB_LO_54","LTU_053_MZB_LO_54-21.09.2020","21.09.2020",2020,9,21,0,0,0,0,0,0,0,0,0,0,0,0,0,0,0,0,0,2,0,0,0,6,0,0,0,0,0,0,0,0,2,13,13,0,0,0,0,0,2,0,0,0,0,0,1,0,0,0,0,2,0,0,0,0,1,0,4,0,0,1,0,0,0,1,0,0,0,0,0,0,2,1,0,12,0,0,0,0,0,0,0,1,0,0,0,0,0,0,0,0,1,0,0,0,0,3,0,4,0,3,0,0,0,0,0,2,0,1,0,0,0,0,0,0,0,0,0,0,0,0,0,0,0,0,0,0,1,0,0,3,12,0,0,0,0,0,0,0,0,0,44,0,0,0,0,0,1,0,0,0,1,0,0,0,0,0,0,2,0,0,0,0,0,0,0
"LTU_053_MZB_LO_55","LTU_053_MZB_LO_55-06.10.2010","06.10.2010",2010,10,6,0,0,0,0,0,0,0,0,0,0,0,0,0,0,0,0,0,0,0,0,0,0,0,0,0,0,0,0,0,0,0,6,6,0,0,0,0,0,0,0,0,0,0,0,0,0,0,0,0,0,0,0,0,0,0,0,0,0,0,0,0,0,0,0,0,0,0,0,0,0,7,0,0,0,0,0,0,0,0,0,0,0,0,0,0,0,0,0,0,0,0,0,0,0,0,0,0,6,0,0,0,0,0,0,0,0,0,0,0,0,34,0,0,0,0,0,0,0,0,0,0,0,0,0,0,0,0,0,0,0,0,0,0,0,0,0,0,0,0,0,0,0,0,0,0,11,0,0,0,28,0,0,0,0,0,0,0,0,0,0,0,1,0,0,0
"LTU_053_MZB_LO_55","LTU_053_MZB_LO_55-03.10.2012","03.10.2012",2012,10,3,0,0,0,0,0,0,0,0,0,0,0,0,0,0,0,0,0,0,0,0,0,0,0,0,0,7,0,0,0,0,0,7,7,0,0,0,0,0,28,0,0,0,0,0,0,0,0,0,0,0,0,0,0,0,0,0,46,0,0,0,0,0,0,0,0,0,0,0,0,0,0,0,0,0,0,0,0,0,0,0,0,0,0,0,0,0,0,0,0,447,97,0,0,0,0,0,0,11,0,0,0,0,0,0,10,2,0,0,0,0,0,0,0,0,0,0,0,0,0,0,0,0,0,0,0,0,0,0,0,18,0,0,0,0,0,0,0,0,0,0,0,0,0,0,0,0,34,0,0,12,0,0,0,0,0,0,27,0,0,0,0,0,0,0,0
"LTU_053_MZB_LO_55","LTU_053_MZB_LO_55-09.10.2013","09.10.2013",2013,10,9,0,0,0,0,0,0,0,0,0,0,0,0,0,0,0,0,0,23,0,0,1,0,0,0,0,0,0,0,0,0,0,0,0,0,0,0,0,0,0,0,0,0,0,0,0,0,0,0,0,0,0,0,0,0,0,0,0,0,0,29,0,0,0,0,0,0,0,0,0,0,9,0,0,0,0,0,32,0,0,0,45,0,0,0,0,0,0,6,8,22,0,0,0,0,0,0,0,0,0,0,0,0,0,0,0,0,0,0,0,0,33,0,8,0,0,0,0,0,0,0,0,0,0,0,0,0,0,0,0,0,0,0,0,0,18,0,0,0,0,0,0,0,0,0,0,0,0,0,0,0,0,0,0,0,0,0,0,0,0,0,0,0,0,0,0
"LTU_053_MZB_LO_55","LTU_053_MZB_LO_55-08.10.2014","08.10.2014",2014,10,8,0,0,0,0,0,0,0,0,0,0,0,0,0,0,0,0,0,13,0,0,0,0,0,0,0,0,0,0,0,0,0,9,9,0,0,0,0,0,45,0,0,0,0,0,7,0,0,0,0,0,0,0,0,0,0,0,29,0,0,8,0,0,0,7,0,0,0,0,0,0,8,14,0,0,1,0,19,0,0,0,19,0,0,0,0,0,0,0,19,0,49,0,0,0,0,0,0,17,0,0,0,0,0,12,0,0,0,2,0,0,66,0,7,0,0,0,0,0,0,0,0,0,0,0,16,0,2,0,0,35,0,0,0,0,0,0,0,0,0,0,0,0,0,18,0,0,0,0,0,86,0,0,0,0,0,0,0,30,0,0,7,0,0,0,0
"LTU_053_MZB_LO_55","LTU_053_MZB_LO_55-07.10.2015","07.10.2015",2015,10,7,0,0,0,1,0,0,0,0,0,0,0,0,0,0,0,0,0,9,0,0,0,0,0,0,0,4,0,0,51,0,22,3,3,5,0,0,0,0,25,0,0,0,0,0,0,0,0,0,0,0,0,0,0,0,5,0,0,0,0,6,0,0,0,7,0,0,0,0,0,0,3,0,0,0,0,0,0,0,0,0,8,38,0,0,0,0,0,0,0,18,0,0,4,0,0,0,0,0,0,0,0,0,0,0,0,0,0,0,0,0,11,0,5,0,0,0,0,0,0,0,0,0,0,0,13,0,0,0,0,1,0,0,0,0,0,0,0,0,0,0,1,0,0,0,0,0,0,0,0,20,0,0,0,0,0,0,19,0,0,0,7,0,0,0,0
"LTU_053_MZB_LO_55","LTU_053_MZB_LO_55-05.10.2016","05.10.2016",2016,10,5,0,0,0,0,0,0,0,0,0,0,0,0,0,0,0,0,0,17,0,0,0,50,0,0,25,24,0,0,52,0,48,9,9,0,0,0,0,0,25,0,0,0,0,0,12,0,0,0,0,0,0,0,0,0,3,0,41,0,0,0,0,0,0,9,0,0,0,0,0,0,9,6,0,9,0,0,34,0,0,0,15,0,0,0,0,0,0,0,14,0,0,0,0,0,0,0,0,15,0,0,0,0,0,0,0,0,0,0,0,0,50,0,6,0,0,0,0,0,0,0,0,0,0,0,0,0,1,0,0,28,4,0,0,0,0,0,0,0,0,0,0,0,0,0,0,0,48,0,0,90,0,0,0,0,0,0,38,52,0,0,0,0,0,0,0
"LTU_053_MZB_LO_55","LTU_053_MZB_LO_55-04.10.2017","04.10.2017",2017,10,4,0,0,0,0,0,0,2,0,0,0,0,0,0,0,0,0,0,4,2,0,10,67,0,0,0,6,0,26,7,0,34,0,0,0,0,0,0,0,9,0,0,0,0,0,6,0,0,0,0,0,0,0,0,0,0,0,55,0,0,8,0,0,0,2,0,0,0,0,0,41,0,0,0,0,0,0,16,0,0,0,59,0,0,0,4,0,0,0,0,25,0,0,1,0,61,0,0,27,0,0,3,0,0,0,0,0,13,0,0,0,11,0,0,0,0,0,0,0,0,0,0,0,0,0,0,0,0,0,0,49,0,0,9,0,0,0,0,0,0,0,0,0,0,0,0,0,0,0,0,0,0,0,0,0,0,0,0,0,0,0,0,0,0,0,0
"LTU_053_MZB_LO_55","LTU_053_MZB_LO_55-07.10.2020","07.10.2020",2020,10,7,0,0,0,0,0,0,0,0,0,0,0,0,0,0,0,0,0,1,0,0,0,7,0,0,0,6,0,0,17,0,0,3,3,0,0,0,0,0,11,0,0,0,0,1,0,0,0,0,0,3,0,0,0,0,1,0,0,0,0,0,0,0,0,5,0,7,0,0,0,0,0,0,0,0,0,0,0,0,0,0,0,19,0,0,0,0,0,0,0,16,0,0,0,0,0,0,0,4,0,0,0,0,0,0,0,0,3,0,0,0,0,0,3,1,0,0,0,0,0,0,0,0,0,0,0,0,0,0,0,7,1,0,0,0,0,0,0,0,0,0,1,0,0,0,0,0,6,0,0,15,0,0,0,0,0,0,0,23,0,0,0,1,0,0,0
"LTU_053_MZB_LO_6","LTU_053_MZB_LO_6-06.10.2010","06.10.2010",2010,10,6,0,0,0,0,0,0,0,0,0,0,0,0,0,0,0,0,0,0,0,0,0,0,0,0,0,0,0,6,0,0,0,0,0,0,0,0,0,0,0,0,0,0,0,0,0,0,0,0,0,0,0,5,0,0,0,0,0,0,0,0,0,0,0,0,0,11,0,0,0,0,0,0,0,0,0,0,0,0,0,0,1,0,0,0,0,0,0,0,0,0,0,0,0,0,0,0,14,3,0,0,0,0,0,0,0,0,0,0,0,0,0,0,0,0,0,0,0,0,0,0,0,0,0,0,0,0,0,0,0,0,0,0,0,0,0,0,0,0,0,0,0,0,0,0,0,0,0,0,0,0,0,0,0,0,0,0,0,0,0,0,0,0,0,0,0
"LTU_053_MZB_LO_6","LTU_053_MZB_LO_6-03.10.2012","03.10.2012",2012,10,3,0,0,0,0,0,0,0,0,0,0,0,0,0,0,0,0,0,0,0,0,0,8,0,0,12,38,0,0,0,0,0,0,0,0,0,0,0,0,79,0,0,0,0,0,0,0,0,0,0,0,0,68,0,0,0,0,0,0,0,0,0,0,0,6,0,19,0,0,0,0,1,0,0,0,9,0,0,0,0,0,0,0,0,0,0,0,0,0,0,0,0,0,0,0,0,0,13,40,0,0,0,0,45,0,0,0,0,0,0,0,21,0,0,0,0,0,0,0,0,0,0,0,0,0,0,0,0,0,0,0,0,0,0,0,0,0,0,0,0,0,0,0,0,0,0,0,0,0,0,0,0,0,0,0,0,0,0,0,0,0,0,0,0,0,0
"LTU_053_MZB_LO_6","LTU_053_MZB_LO_6-09.10.2013","09.10.2013",2013,10,9,0,0,0,0,0,0,0,0,0,0,0,0,0,0,0,0,0,0,18,0,0,0,0,0,0,12,0,0,0,0,0,2,2,0,0,0,0,0,98,0,0,0,0,0,0,0,0,0,0,0,0,12,0,0,0,0,0,0,0,0,0,0,0,10,0,13,0,0,0,0,0,0,0,0,0,0,0,0,0,0,24,0,0,0,0,0,0,0,0,0,0,0,0,0,33,0,178,0,0,0,0,0,0,0,0,0,0,0,0,0,127,0,0,0,0,0,0,0,0,0,0,0,0,0,0,0,5,0,0,0,0,0,0,0,0,0,0,0,0,0,0,0,0,0,0,0,0,0,0,25,0,0,0,0,0,6,0,0,0,0,4,0,0,0,0
"LTU_053_MZB_LO_6","LTU_053_MZB_LO_6-08.10.2014","08.10.2014",2014,10,8,0,0,0,0,0,0,0,0,0,0,0,0,0,0,0,0,0,0,1,0,0,1,0,0,0,6,0,0,0,2,0,1,1,0,0,0,0,0,4,0,0,3,0,0,1,3,0,0,0,0,0,2,0,0,0,0,0,0,0,0,0,0,0,7,0,6,1,0,0,0,0,0,0,2,0,0,0,0,0,0,2,0,0,0,0,0,1,0,0,0,0,0,0,0,2,0,0,35,0,0,0,0,59,0,0,0,0,0,0,0,6,0,0,0,0,0,0,0,0,0,0,0,0,0,1,0,2,0,0,1,0,0,0,0,0,0,0,0,0,0,0,1,0,0,0,0,0,0,0,4,0,0,0,0,0,0,0,0,1,0,0,0,0,0,1
"LTU_053_MZB_LO_6","LTU_053_MZB_LO_6-07.10.2015","07.10.2015",2015,10,7,0,0,0,0,0,0,0,0,0,0,0,0,0,0,0,0,0,0,0,0,0,0,0,0,0,23,0,0,0,0,0,0,0,0,0,0,0,0,32,0,0,1,0,0,29,0,0,0,0,0,0,78,0,0,6,0,0,0,0,0,0,0,0,34,0,25,0,0,0,0,0,0,0,4,6,0,0,0,0,0,0,0,0,0,0,0,0,0,0,0,0,0,0,0,1,0,360,111,0,0,0,0,0,0,0,0,0,0,0,0,95,0,0,0,0,0,0,0,0,0,0,0,0,0,0,0,7,0,0,47,0,0,0,0,0,0,0,0,0,0,27,0,0,0,0,0,0,0,0,169,0,0,0,0,0,0,0,0,0,0,4,0,0,12,18
"LTU_053_MZB_LO_6","LTU_053_MZB_LO_6-05.10.2016","05.10.2016",2016,10,5,0,0,0,0,0,0,0,0,0,0,0,0,0,0,0,0,0,0,0,0,0,72,0,0,0,64,0,0,0,0,0,0,0,0,0,0,0,0,72,0,0,0,0,0,1,0,0,0,0,0,0,68,0,0,0,0,0,0,0,0,0,0,0,33,0,41,5,0,0,0,0,0,0,0,17,0,0,0,0,0,160,0,0,0,0,0,0,0,0,0,0,0,0,0,0,0,124,80,0,0,0,12,44,0,0,0,0,0,0,0,148,0,0,0,0,0,0,0,0,0,0,0,0,0,144,0,0,0,0,0,0,0,0,0,0,0,0,0,0,0,24,0,0,0,0,0,0,0,0,92,0,0,0,0,0,0,0,0,0,0,0,0,0,0,0
"LTU_053_MZB_LO_6","LTU_053_MZB_LO_6-04.10.2017","04.10.2017",2017,10,4,0,0,0,0,0,0,0,0,0,0,0,0,0,0,0,0,0,4,8,0,4,0,0,0,0,13,0,0,11,0,0,0,0,0,0,0,0,0,25,0,0,0,0,0,0,0,0,0,13,0,0,0,0,0,5,0,0,0,0,0,0,0,0,0,0,7,0,0,0,0,0,0,0,0,0,0,0,0,0,0,18,0,0,0,0,0,0,0,0,0,0,0,0,0,4,0,32,42,0,0,0,0,0,0,0,0,8,0,0,0,51,0,0,0,0,0,0,0,0,0,0,0,0,0,0,0,0,0,0,0,0,0,7,0,0,0,0,0,0,0,6,0,0,0,0,0,0,0,0,42,0,0,0,0,0,0,0,0,0,0,0,0,0,0,0
"LTU_053_MZB_LO_6","LTU_053_MZB_LO_6-07.10.2020","07.10.2020",2020,10,7,0,0,0,0,0,0,0,0,0,0,1,0,1,0,0,0,0,0,0,0,0,5,0,0,0,11,0,0,0,0,0,1,1,0,0,0,0,0,27,0,0,10,0,0,0,0,0,0,0,0,0,21,0,0,0,0,0,0,0,0,0,0,0,17,0,17,0,0,0,0,0,0,0,0,9,0,0,0,0,0,1,0,0,0,0,0,0,0,0,0,0,0,0,0,0,0,54,0,0,0,0,0,0,0,0,0,0,0,0,0,11,0,0,0,0,0,0,0,0,0,1,0,0,0,0,0,0,0,0,0,0,0,0,0,0,0,0,0,0,0,0,0,0,0,0,0,0,0,0,0,0,0,0,6,0,0,0,0,0,0,0,0,0,0,0
"LTU_053_MZB_LO_63","LTU_053_MZB_LO_63-27.09.2010","27.09.2010",2010,9,27,0,0,0,0,0,0,0,0,0,0,0,0,0,0,0,0,0,0,0,0,0,1,0,0,0,1,0,0,0,0,11,2,2,0,0,0,0,0,35,0,0,1,0,0,1,0,0,0,0,0,0,0,0,0,0,0,4,0,0,3,0,0,0,0,0,0,0,0,0,0,0,0,0,5,0,0,0,0,0,0,0,0,0,0,0,0,0,0,0,17,1,0,0,0,1,0,0,2,0,0,2,0,0,0,0,0,0,0,0,0,0,0,0,0,0,0,0,0,0,0,0,0,0,0,0,0,0,0,0,0,1,0,0,0,0,0,0,0,0,0,0,0,0,0,0,1,0,0,0,0,0,0,0,0,0,0,0,0,0,0,2,0,0,0,0
"LTU_053_MZB_LO_63","LTU_053_MZB_LO_63-24.09.2012","24.09.2012",2012,9,24,0,0,0,0,0,0,0,0,0,0,0,0,0,0,0,0,0,0,3,0,0,1,0,0,0,6,0,0,0,0,22,0,0,0,0,0,0,0,13,0,0,0,0,0,0,0,0,0,0,1,0,0,0,0,0,0,2,0,0,0,0,0,1,0,0,1,3,0,0,0,0,0,0,0,2,0,0,0,0,0,1,0,0,0,0,0,1,0,0,2,13,0,0,0,0,0,0,1,0,0,2,0,0,0,0,0,0,0,0,0,0,0,0,0,0,0,0,0,0,0,0,0,0,0,0,0,1,0,0,0,3,0,6,0,0,0,0,0,0,0,0,0,0,0,0,4,0,0,0,2,0,0,0,0,0,0,0,0,0,0,0,0,0,0,0
"LTU_053_MZB_LO_63","LTU_053_MZB_LO_63-23.09.2013","23.09.2013",2013,9,23,0,0,0,0,0,0,0,0,0,0,0,0,0,0,8,0,0,0,12,0,0,18,0,0,35,26,0,0,0,0,0,0,0,0,0,0,0,0,31,0,0,6,0,0,0,0,0,0,11,9,0,6,0,0,0,0,0,0,0,9,0,0,0,7,0,17,0,0,0,0,0,0,0,0,1,0,0,0,0,0,0,0,0,0,0,0,0,0,0,30,0,0,0,0,17,0,0,1,0,0,12,0,0,0,0,0,0,0,0,0,10,0,0,0,0,0,0,0,0,0,0,0,0,0,11,0,0,0,0,21,0,0,21,0,0,0,0,0,0,0,5,0,0,0,0,13,0,0,0,46,0,0,0,0,0,0,0,0,0,0,7,5,0,0,2
"LTU_053_MZB_LO_63","LTU_053_MZB_LO_63-24.09.2014","24.09.2014",2014,9,24,0,0,0,0,0,1,0,0,0,0,0,0,0,0,1,0,0,0,103,0,0,1,0,0,0,1,0,0,0,0,6,0,0,0,0,0,0,1,32,0,0,0,0,0,0,0,0,0,0,0,0,0,0,0,0,0,0,0,0,3,0,0,0,1,0,0,1,1,0,0,0,0,0,0,1,0,0,0,0,0,0,0,0,0,0,0,4,0,0,2,11,0,0,0,0,0,0,1,0,0,3,0,0,0,0,0,0,0,0,0,0,0,0,0,0,0,0,0,0,0,0,0,0,0,0,0,0,0,0,0,0,0,10,0,0,0,0,0,0,0,0,0,0,0,0,1,0,0,0,11,0,0,0,0,0,0,0,0,0,0,0,2,0,0,0
"LTU_053_MZB_LO_63","LTU_053_MZB_LO_63-28.09.2015","28.09.2015",2015,9,28,0,0,0,0,0,0,0,0,0,0,0,0,0,0,0,0,0,0,23,0,0,2,0,0,0,5,0,0,0,0,0,0,0,0,0,0,0,0,18,0,0,2,0,0,1,0,0,0,0,0,0,0,0,0,1,0,0,0,0,4,0,0,0,2,0,1,2,0,0,0,0,1,0,0,0,0,0,0,0,0,0,0,0,0,0,0,0,0,0,2,4,0,0,0,0,0,0,2,0,0,1,0,0,0,0,1,0,1,0,0,0,0,0,0,0,0,0,0,0,0,0,0,0,0,1,0,0,0,0,0,0,0,10,0,0,0,0,0,0,0,0,0,0,0,0,17,0,0,0,6,0,0,0,0,0,0,0,0,0,0,0,0,0,1,0
"LTU_053_MZB_LO_63","LTU_053_MZB_LO_63-26.09.2016","26.09.2016",2016,9,26,0,0,0,0,0,2,0,0,0,0,0,0,0,0,0,0,0,0,15,0,0,2,0,0,0,5,0,0,0,0,0,0,0,0,0,0,0,0,17,0,0,4,0,0,1,0,0,0,0,0,0,0,0,0,3,0,0,0,0,2,0,0,0,0,0,3,0,0,0,0,0,0,0,0,0,0,0,0,0,0,0,0,0,0,0,0,0,0,0,1,0,0,0,0,1,0,0,0,0,0,0,0,0,0,0,1,0,3,0,0,0,0,0,0,0,0,0,0,0,0,0,0,0,0,1,0,0,0,0,0,0,0,14,0,0,0,0,0,0,0,0,0,0,0,0,3,0,0,0,1,0,0,0,0,0,0,0,0,0,0,1,0,0,0,0
"LTU_053_MZB_LO_63","LTU_053_MZB_LO_63-16.10.2017","16.10.2017",2017,10,16,0,0,0,0,0,0,0,0,0,0,0,0,0,0,0,0,0,0,23,0,0,6,0,0,0,0,0,0,0,0,0,0,0,0,0,0,0,0,0,0,0,0,0,0,3,0,0,0,0,0,0,0,0,0,1,0,0,0,0,0,0,0,0,0,0,0,0,0,0,0,0,0,0,0,0,0,0,0,0,0,0,0,0,0,0,0,0,0,0,0,11,0,0,0,0,0,0,0,0,0,0,0,0,0,0,2,0,1,0,0,0,0,0,0,0,0,0,0,0,0,0,0,0,0,0,0,0,0,0,0,0,0,0,0,0,0,0,0,0,0,0,0,0,0,0,0,0,0,0,0,0,0,0,0,0,0,0,0,0,0,0,0,1,0,0
"LTU_053_MZB_LO_63","LTU_053_MZB_LO_63-22.09.2020","22.09.2020",2020,9,22,0,0,0,0,0,0,0,0,0,0,27,0,0,0,0,0,0,0,81,0,0,133,0,0,0,19,26,0,0,0,36,0,0,0,0,0,10,0,116,0,0,10,0,0,0,0,0,0,0,0,0,0,0,0,3,0,0,0,1,6,0,0,0,0,0,0,0,0,0,0,0,0,0,5,0,0,0,0,0,0,0,0,0,0,0,0,0,0,0,0,0,0,0,0,10,0,0,0,0,0,3,0,0,0,0,0,0,3,0,0,28,0,0,0,0,0,0,0,0,0,0,0,1,0,0,0,0,0,0,56,2,0,2,0,0,0,0,0,0,0,0,0,0,0,0,4,0,0,0,111,0,0,0,0,0,0,0,0,0,0,0,0,13,0,0
"LTU_053_MZB_LO_65","LTU_053_MZB_LO_65-04.10.2010","04.10.2010",2010,10,4,0,0,0,0,0,0,0,0,0,0,0,0,0,0,0,0,0,0,0,0,0,0,0,0,0,0,0,0,0,0,0,0,0,0,0,0,0,0,0,0,0,0,0,0,0,0,0,0,0,0,0,0,0,0,0,0,0,0,0,0,0,0,0,3,0,1,1,0,0,0,0,0,0,0,2,0,0,0,0,0,0,0,0,0,0,0,0,0,0,0,0,0,0,0,0,0,6,1,0,0,0,0,0,0,0,0,0,0,0,0,0,0,0,0,0,0,0,0,0,0,0,0,0,0,0,0,1,0,0,0,0,0,0,0,0,0,0,0,0,0,0,0,0,0,0,0,0,0,0,0,0,0,0,0,0,0,0,0,0,0,0,0,0,0,0
"LTU_053_MZB_LO_65","LTU_053_MZB_LO_65-01.10.2012","01.10.2012",2012,10,1,0,0,0,0,0,0,0,0,0,0,0,0,0,0,0,0,0,0,0,0,0,188,0,0,0,68,0,32,0,0,0,5,5,0,0,0,0,0,112,0,0,12,0,0,29,0,0,0,0,0,0,0,0,0,36,0,0,0,0,0,0,0,0,0,0,49,0,0,0,0,0,0,0,0,0,0,0,0,0,0,32,0,0,0,0,0,0,0,0,0,0,0,0,0,0,0,152,44,0,0,0,0,309,0,0,0,0,0,0,0,24,0,0,0,0,0,0,0,4,0,0,0,1,0,0,0,0,0,0,56,9,0,36,0,0,0,0,0,0,0,8,0,0,0,0,0,0,0,0,24,0,0,0,0,0,0,0,0,0,0,0,0,0,0,0
"LTU_053_MZB_LO_65","LTU_053_MZB_LO_65-07.10.2013","07.10.2013",2013,10,7,0,0,0,0,0,0,0,0,0,0,0,0,0,0,0,0,0,20,0,0,22,88,0,0,0,18,0,0,0,0,0,0,0,0,0,0,0,0,138,0,0,0,0,0,1,0,0,0,16,0,0,0,0,0,0,0,147,0,0,0,0,0,0,21,0,17,6,0,0,0,14,0,0,0,28,0,0,0,0,0,49,0,0,0,0,0,0,0,0,0,0,0,0,0,0,0,0,0,0,0,0,0,0,0,0,0,0,0,0,0,57,0,0,3,0,0,0,0,0,0,0,0,0,0,0,0,0,0,0,0,0,0,0,0,0,0,0,0,0,0,0,0,0,0,0,19,0,0,0,97,0,0,0,0,0,0,65,0,0,0,14,0,0,0,0
"LTU_053_MZB_LO_65","LTU_053_MZB_LO_65-06.10.2014","06.10.2014",2014,10,6,0,0,18,0,0,0,0,0,0,0,0,0,0,0,1,0,0,0,0,0,0,34,0,0,0,16,0,36,0,0,0,0,0,0,0,0,0,0,32,0,0,0,0,0,0,0,0,0,0,0,0,6,0,0,11,0,0,0,0,0,0,0,0,7,0,15,0,0,0,0,2,0,0,0,0,0,0,0,0,0,0,0,0,0,0,0,0,0,0,0,0,0,0,0,0,0,28,9,0,0,15,0,0,0,0,6,0,0,0,0,25,0,0,0,0,0,0,0,0,0,0,0,0,0,0,0,0,0,0,15,7,0,0,0,0,0,0,0,0,0,1,0,0,0,0,9,0,0,0,86,0,0,0,8,0,8,0,0,0,0,0,0,0,0,8
"LTU_053_MZB_LO_65","LTU_053_MZB_LO_65-05.10.2015","05.10.2015",2015,10,5,0,0,19,0,0,0,0,0,0,0,0,0,0,0,0,0,0,0,0,0,0,26,0,0,0,22,0,42,0,0,0,0,0,0,0,4,0,0,42,0,0,0,0,0,6,0,0,0,0,0,0,27,0,0,4,0,0,0,0,0,0,0,0,14,7,35,0,0,0,0,0,0,0,7,10,0,0,0,0,0,8,0,1,0,0,0,0,0,0,0,0,0,0,0,6,0,64,32,0,0,0,0,27,0,0,0,0,0,0,0,45,0,0,0,0,0,0,0,0,0,0,0,0,0,0,0,0,0,0,38,0,0,17,0,0,0,0,0,0,0,1,0,0,0,0,13,0,0,0,44,0,0,0,11,0,0,0,0,0,0,0,0,0,3,0
"LTU_053_MZB_LO_65","LTU_053_MZB_LO_65-03.10.2016","03.10.2016",2016,10,3,0,0,0,0,0,0,0,0,0,0,0,0,0,0,0,0,0,0,0,0,0,41,0,24,0,12,0,0,0,0,12,0,0,0,0,12,0,0,0,0,0,6,0,0,0,0,0,0,0,11,0,0,0,0,0,0,0,0,0,0,0,0,0,6,0,13,0,0,0,0,0,0,0,0,0,0,0,0,0,0,0,0,0,0,0,0,0,0,0,0,0,0,0,0,20,0,0,26,0,0,0,0,0,0,0,4,0,8,0,0,0,0,0,0,0,0,0,0,0,0,0,0,0,0,0,0,5,0,0,0,0,0,0,0,0,0,0,0,0,0,0,0,0,0,0,8,0,0,0,0,0,0,0,0,0,0,0,0,0,0,8,0,0,0,0
"LTU_053_MZB_LO_65","LTU_053_MZB_LO_65-02.10.2017","02.10.2017",2017,10,2,0,0,0,0,0,0,0,0,0,0,0,0,0,0,0,0,0,0,2,0,0,9,0,0,0,0,0,0,0,0,0,0,0,0,0,0,0,0,13,0,0,4,0,0,9,0,0,0,0,0,0,0,0,0,0,0,0,0,0,0,0,0,0,1,0,6,0,0,0,0,0,1,0,0,0,0,0,0,0,0,0,0,0,0,0,0,0,0,0,7,0,0,0,0,6,0,12,5,0,0,0,0,12,0,0,0,0,1,0,0,14,0,0,0,0,0,0,0,0,0,0,0,0,0,0,0,0,0,0,0,0,0,9,0,0,0,0,0,0,0,4,0,0,0,0,5,0,0,0,0,0,0,0,1,0,0,0,0,0,0,0,0,0,0,0
"LTU_053_MZB_LO_65","LTU_053_MZB_LO_65-05.10.2020","05.10.2020",2020,10,5,0,0,0,0,0,0,0,0,0,0,0,0,0,0,0,0,0,0,0,0,0,72,0,0,0,0,0,0,0,0,0,0,0,0,0,6,0,0,36,0,0,15,0,0,0,0,0,0,0,0,0,0,0,0,0,0,0,0,0,0,0,0,0,7,0,26,0,0,0,0,0,0,0,0,0,0,0,0,0,0,0,0,0,0,0,0,0,0,0,0,0,0,0,0,0,0,23,0,0,0,0,0,47,0,0,0,0,0,0,0,0,0,0,0,0,0,0,0,0,0,0,0,0,0,0,0,5,0,0,0,11,0,0,0,0,0,0,0,0,0,0,0,0,0,0,0,0,0,0,82,0,0,0,7,0,0,0,0,0,0,0,0,0,0,0
"LTU_053_MZB_LO_66","LTU_053_MZB_LO_66-07.09.2010","07.09.2010",2010,9,7,0,0,0,0,0,0,0,0,0,0,0,0,0,0,0,0,0,0,0,0,0,24,0,0,0,0,0,0,0,0,0,2,2,0,0,0,0,0,1,0,0,0,0,0,0,0,0,0,17,0,0,0,0,0,0,0,7,0,0,0,0,0,0,0,0,8,0,0,15,0,0,0,0,0,0,0,0,0,0,0,20,0,0,0,0,0,0,0,0,0,0,0,0,0,16,0,0,24,0,0,0,0,0,0,0,0,0,0,0,0,28,0,0,0,0,0,0,0,0,0,0,0,0,0,0,0,0,0,0,0,0,0,0,0,0,0,0,0,0,0,0,0,0,0,0,0,0,0,0,75,0,0,0,0,0,0,0,0,0,0,12,0,0,0,0
"LTU_053_MZB_LO_66","LTU_053_MZB_LO_66-25.09.2012","25.09.2012",2012,9,25,0,0,0,0,0,0,0,0,0,0,0,0,0,0,0,0,0,0,0,0,29,37,0,0,0,22,0,19,0,0,0,0,0,0,0,0,0,0,0,0,0,0,0,0,0,0,0,0,50,0,0,0,0,0,0,0,78,0,0,22,0,0,0,0,0,26,0,0,0,38,0,0,0,0,0,0,0,0,0,0,0,0,0,0,0,0,23,0,0,0,0,0,0,0,0,0,0,38,0,0,0,0,0,0,0,0,36,0,0,0,38,0,0,0,0,0,0,0,0,0,0,0,0,0,0,0,0,0,0,0,0,0,0,0,0,0,0,0,0,0,0,0,0,0,0,0,0,0,0,28,0,0,0,0,0,18,0,0,0,0,29,0,0,0,0
"LTU_053_MZB_LO_66","LTU_053_MZB_LO_66-10.10.2013","10.10.2013",2013,10,10,0,0,0,0,0,0,0,0,0,0,0,0,0,0,0,0,0,0,17,0,0,0,0,0,0,14,0,0,0,0,0,0,0,0,0,0,0,0,41,0,0,0,0,0,0,0,0,0,0,0,0,0,0,0,6,0,0,0,0,0,0,0,0,22,0,59,0,0,0,0,0,0,0,0,14,0,0,0,0,0,31,0,0,0,0,0,0,0,0,0,0,0,0,0,18,0,0,0,0,0,0,0,0,0,0,0,0,0,0,0,18,0,0,0,0,0,0,0,0,0,0,0,0,0,0,0,0,0,0,0,6,0,8,0,0,0,0,0,0,0,0,0,0,0,0,0,16,0,0,103,0,0,0,0,0,2,0,0,0,0,2,0,0,0,0
"LTU_053_MZB_LO_66","LTU_053_MZB_LO_66-02.10.2014","02.10.2014",2014,10,2,0,0,0,0,0,0,0,0,0,0,0,0,0,0,0,0,0,0,13,0,0,43,0,0,0,28,0,0,0,0,0,0,0,0,0,0,0,0,37,0,0,13,0,0,0,0,0,0,0,0,0,0,0,0,0,0,0,0,0,15,0,0,0,7,0,49,0,0,0,0,0,0,0,0,14,0,0,0,0,0,0,0,0,0,0,0,0,0,0,50,0,0,0,0,0,0,0,23,0,0,0,0,0,0,0,2,8,0,0,0,38,0,0,0,0,0,0,0,0,0,0,0,0,0,0,0,0,0,0,0,22,0,5,0,0,0,0,0,0,0,0,0,0,0,0,0,22,0,0,116,0,0,0,5,0,0,0,0,0,0,0,0,0,0,0
"LTU_053_MZB_LO_66","LTU_053_MZB_LO_66-05.10.2015","05.10.2015",2015,10,5,0,0,0,0,0,0,0,0,0,0,0,0,0,0,0,0,3,0,49,0,0,106,0,0,18,35,0,0,0,0,24,9,9,0,0,0,0,0,32,0,0,5,0,0,6,0,0,0,0,0,0,5,0,0,18,0,0,0,0,0,0,0,0,12,0,76,0,0,0,0,0,3,0,0,0,0,0,0,0,0,0,0,0,0,0,0,0,0,0,44,0,7,0,0,0,0,0,12,0,0,0,0,0,0,0,0,0,0,0,0,13,0,0,0,0,0,0,0,0,0,0,0,0,0,0,0,0,0,0,0,10,0,18,0,0,0,0,0,0,0,0,0,0,0,0,5,16,0,0,47,0,0,0,0,0,0,0,0,0,0,0,0,0,0,0
"LTU_053_MZB_LO_66","LTU_053_MZB_LO_66-11.10.2016","11.10.2016",2016,10,11,0,0,0,0,0,0,0,0,0,0,0,0,0,0,0,0,0,3,0,0,4,18,0,0,10,19,0,0,27,0,0,0,0,0,0,0,0,0,25,0,0,0,0,0,0,0,0,0,0,0,0,0,0,0,0,0,49,0,0,0,0,0,0,1,0,0,0,0,0,0,0,0,0,0,3,0,34,0,0,0,13,37,0,0,18,0,0,0,0,12,14,0,22,0,1,0,0,0,0,0,0,0,0,16,0,0,6,0,0,0,13,0,0,0,0,0,0,0,0,0,0,0,0,0,0,0,0,0,0,25,0,0,18,0,0,0,0,0,0,0,0,0,0,0,0,0,69,0,0,13,0,0,0,0,0,0,0,0,0,0,0,0,0,0,0
"LTU_053_MZB_LO_66","LTU_053_MZB_LO_66-11.10.2017","11.10.2017",2017,10,11,0,0,0,0,0,0,0,0,0,0,0,0,0,0,0,0,0,0,5,0,0,14,0,0,0,21,0,17,18,0,0,0,0,0,0,0,0,0,22,0,0,0,0,0,0,0,0,0,0,0,0,0,0,0,4,0,24,0,0,0,0,0,0,4,0,0,0,0,0,0,0,4,0,0,7,0,0,0,0,0,19,22,0,0,0,0,0,0,0,6,0,0,0,0,38,0,0,16,0,0,0,0,0,0,0,0,0,0,0,0,15,0,0,0,0,0,0,0,0,0,0,0,0,0,0,0,3,0,0,0,0,0,13,0,0,0,0,0,0,0,4,0,0,0,0,0,0,0,0,26,0,0,0,0,0,0,0,0,0,0,5,0,0,0,0
"LTU_053_MZB_LO_66","LTU_053_MZB_LO_66-05.10.2020","05.10.2020",2020,10,5,0,0,0,0,0,0,0,0,0,0,0,0,1,0,0,0,0,0,32,0,0,0,0,0,0,2,2,0,0,0,4,0,0,0,0,2,0,0,28,0,0,0,0,0,0,0,0,0,0,0,0,0,0,0,0,0,0,0,0,7,0,0,0,0,0,5,3,0,0,1,0,0,0,0,0,0,0,0,0,0,4,0,0,0,0,0,0,0,0,0,0,0,0,0,4,0,0,0,0,0,0,0,0,0,0,0,0,0,0,0,348,0,0,0,0,0,0,0,0,0,0,0,0,0,0,0,0,0,0,1,0,0,0,0,0,0,0,0,0,0,0,0,0,0,0,1,0,0,0,39,0,0,0,0,0,0,0,0,0,0,0,0,0,0,0
"LTU_053_MZB_LO_67","LTU_053_MZB_LO_67-04.10.2010","04.10.2010",2010,10,4,0,0,0,0,0,0,0,0,0,0,0,0,0,0,0,0,0,1,0,0,19,41,0,0,0,0,0,0,67,0,0,0,0,0,0,0,0,0,188,0,0,0,0,0,0,0,0,0,16,0,0,0,0,0,0,0,43,0,0,0,0,0,0,38,0,0,0,0,0,0,6,0,0,0,0,0,25,0,0,0,0,0,0,0,29,0,0,0,0,0,0,0,0,0,8,0,0,0,0,0,0,0,0,0,0,0,0,0,0,0,0,0,0,0,0,0,0,0,0,0,0,17,0,0,0,0,0,0,0,0,0,0,14,0,0,0,0,0,0,0,0,0,0,0,0,0,0,0,0,0,0,0,0,0,0,0,0,0,0,0,24,0,0,0,0
"LTU_053_MZB_LO_67","LTU_053_MZB_LO_67-01.10.2012","01.10.2012",2012,10,1,0,0,0,0,0,0,0,0,0,0,0,0,0,0,0,0,0,49,19,0,168,175,0,0,0,144,0,108,198,0,163,1,1,0,0,0,0,0,240,0,0,0,0,0,0,0,42,0,144,0,0,96,0,0,0,0,338,0,0,0,0,0,0,157,0,43,0,0,0,0,14,0,0,0,0,0,0,0,0,0,788,0,0,0,0,0,0,72,48,390,0,0,0,0,0,0,0,192,0,0,0,0,0,0,127,0,0,0,0,0,228,0,0,0,0,0,0,0,0,0,0,0,0,0,0,0,0,0,0,0,0,0,0,0,0,0,0,0,0,0,0,0,0,0,0,37,0,0,0,150,0,0,0,0,0,0,144,0,0,0,0,0,0,0,0
"LTU_053_MZB_LO_67","LTU_053_MZB_LO_67-07.10.2013","07.10.2013",2013,10,7,0,0,0,0,0,0,0,0,0,0,0,0,0,0,0,0,0,0,0,0,10,45,0,0,6,27,0,0,0,0,0,0,0,0,0,0,0,0,146,0,0,0,0,0,0,0,3,0,0,0,0,0,0,0,0,0,80,0,0,0,0,0,0,10,0,0,1,0,0,0,4,0,0,0,1,0,0,0,0,0,98,0,0,0,0,0,0,42,29,0,0,0,0,0,0,0,0,18,0,0,0,0,0,0,0,0,0,0,0,0,73,0,0,0,0,0,0,0,0,0,0,15,0,0,0,0,0,0,0,0,0,0,0,0,0,0,0,0,0,0,0,0,0,0,0,0,0,0,0,35,0,0,0,0,0,0,0,0,0,0,12,0,0,0,0
"LTU_053_MZB_LO_67","LTU_053_MZB_LO_67-06.10.2014","06.10.2014",2014,10,6,0,0,0,0,0,0,0,0,0,0,0,0,0,0,0,0,0,43,0,0,13,417,0,0,20,76,0,55,135,0,225,8,8,0,0,0,0,0,113,0,0,0,0,0,17,0,36,0,0,0,0,0,0,0,0,0,269,0,0,29,0,0,0,19,0,0,0,0,0,0,0,0,0,0,0,0,54,0,0,0,186,368,0,0,0,0,5,0,0,85,162,0,0,0,30,0,0,160,0,447,0,0,0,45,0,0,0,7,0,0,145,0,25,17,0,0,0,0,0,0,0,0,0,0,0,0,16,0,0,85,0,0,83,0,0,0,0,0,0,0,0,6,0,0,0,0,0,0,0,150,0,0,0,0,0,0,86,0,0,0,0,0,0,0,0
"LTU_053_MZB_LO_67","LTU_053_MZB_LO_67-05.10.2015","05.10.2015",2015,10,5,0,0,0,0,0,0,0,0,0,0,0,0,0,0,0,0,0,13,0,0,8,19,0,0,0,25,0,21,126,0,16,0,0,6,0,0,0,0,27,0,0,0,0,0,0,0,3,0,17,0,0,0,0,0,0,0,62,0,0,9,0,0,0,7,0,0,1,0,0,0,0,15,0,0,0,0,3,0,0,0,60,80,0,0,0,0,0,6,22,0,2,0,5,0,0,0,0,15,0,0,0,0,0,3,0,0,0,0,0,0,40,0,1,0,0,0,0,0,0,0,0,0,0,0,0,0,3,0,0,52,0,0,8,0,0,0,0,0,0,0,0,0,0,0,0,7,12,0,0,38,0,0,0,0,0,0,0,0,0,0,4,0,0,0,0
"LTU_053_MZB_LO_67","LTU_053_MZB_LO_67-03.10.2016","03.10.2016",2016,10,3,0,0,0,0,0,0,0,0,0,0,0,0,0,0,0,0,0,57,0,0,0,180,0,0,0,24,0,84,112,0,73,0,0,0,0,0,0,0,0,0,0,0,0,0,0,0,56,0,64,0,0,0,0,0,0,0,261,0,0,0,0,0,0,24,0,0,0,0,0,0,48,0,4,0,0,0,0,0,0,0,473,0,0,0,0,0,0,0,76,60,0,0,0,0,0,0,0,32,0,0,0,0,0,0,0,0,0,0,0,0,73,0,4,1,0,0,0,0,0,0,0,0,0,0,56,0,0,0,0,312,0,0,0,0,0,0,0,0,0,0,0,0,0,0,0,0,0,0,0,364,0,0,0,0,0,0,56,0,0,0,33,0,0,0,0
"LTU_053_MZB_LO_67","LTU_053_MZB_LO_67-02.10.2017","02.10.2017",2017,10,2,0,0,0,0,0,0,0,0,0,0,0,0,0,0,0,0,0,0,0,0,0,0,0,0,0,0,0,0,0,0,9,0,0,0,0,0,0,0,18,0,0,0,0,1,0,0,0,0,0,0,0,0,0,0,0,0,0,0,0,0,0,0,0,7,0,0,0,0,0,0,0,0,0,0,0,0,0,0,0,0,36,0,0,0,0,0,0,0,0,0,0,0,0,0,0,0,0,0,0,0,0,0,0,0,0,0,0,0,0,0,17,0,0,0,0,0,0,0,0,0,0,0,0,0,0,0,0,0,0,0,0,0,0,0,0,0,0,0,0,0,0,0,0,0,0,0,0,0,0,0,0,0,0,0,0,0,0,0,0,0,0,0,0,0,0
"LTU_053_MZB_LO_67","LTU_053_MZB_LO_67-05.10.2020","05.10.2020",2020,10,5,0,0,0,0,0,0,0,0,0,0,16,0,0,0,0,0,0,12,0,0,0,1,0,0,0,13,0,27,37,0,41,0,0,0,0,0,0,0,38,0,0,0,0,0,0,0,0,0,0,0,0,0,0,0,0,0,56,0,0,8,0,0,0,7,0,0,0,0,0,0,0,0,0,0,0,0,0,0,0,0,62,0,0,0,0,0,0,0,0,0,0,0,0,0,0,0,0,0,0,0,0,0,0,0,0,0,0,0,0,0,0,0,3,3,0,0,0,0,0,0,8,0,0,0,0,0,0,0,0,15,0,0,0,0,0,0,0,0,0,0,0,0,0,0,0,0,0,0,0,0,0,0,0,0,0,0,0,0,0,0,0,0,0,0,0
"LTU_053_MZB_LO_69","LTU_053_MZB_LO_69-04.10.2010","04.10.2010",2010,10,4,0,0,0,0,0,0,0,0,0,0,0,0,0,0,0,0,0,78,5,0,15,10,0,0,0,47,0,0,23,0,0,8,8,0,0,0,0,0,5,0,0,0,0,0,0,0,0,0,0,0,0,0,0,0,1,0,6,0,0,9,0,0,0,17,0,0,0,0,0,0,0,1,0,0,0,0,43,0,0,0,38,0,0,0,1,0,4,0,0,2,0,0,0,0,0,0,0,0,0,0,0,0,0,5,0,1,0,0,0,0,14,0,1,0,0,0,0,0,0,0,0,0,0,0,0,0,1,0,0,0,2,0,0,0,6,0,0,0,1,0,0,0,0,0,0,0,0,0,0,28,0,0,0,0,0,0,0,64,0,0,0,0,0,0,2
"LTU_053_MZB_LO_69","LTU_053_MZB_LO_69-01.10.2012","01.10.2012",2012,10,1,0,0,0,0,0,0,0,0,0,0,0,0,0,0,0,0,0,23,0,0,0,0,0,0,18,134,0,0,0,0,0,0,0,0,0,0,0,0,62,0,0,0,0,0,0,0,0,0,6,0,0,0,0,0,0,0,0,0,0,0,0,0,0,39,0,0,0,0,0,0,12,0,0,0,0,0,0,0,0,0,101,0,0,0,0,0,0,0,0,0,0,0,0,0,0,0,0,184,0,0,0,0,0,0,0,0,0,0,0,0,120,0,3,0,0,0,0,0,0,0,0,0,0,0,0,0,0,0,0,0,0,0,28,0,0,0,0,0,0,0,0,0,0,0,0,0,0,0,0,405,0,0,0,0,0,11,0,63,0,0,8,0,0,0,0
"LTU_053_MZB_LO_69","LTU_053_MZB_LO_69-07.10.2013","07.10.2013",2013,10,7,0,0,0,0,0,0,0,0,0,0,0,0,0,0,0,0,0,37,0,0,0,0,0,0,17,24,0,0,53,0,0,18,18,0,0,0,0,0,75,0,0,0,0,0,0,0,0,0,0,0,0,14,0,0,0,0,79,0,0,0,0,0,0,18,0,0,0,0,0,0,12,0,0,0,9,0,0,0,0,0,56,0,0,0,0,0,0,0,0,171,0,0,0,0,42,0,0,85,0,0,0,0,0,0,0,0,0,0,0,0,23,0,6,4,0,0,0,0,0,0,0,0,0,0,0,0,10,0,0,67,0,0,0,0,0,0,0,0,0,0,12,0,0,0,0,0,0,0,0,78,0,0,0,0,0,0,0,31,0,0,0,0,0,0,0
"LTU_053_MZB_LO_69","LTU_053_MZB_LO_69-06.10.2014","06.10.2014",2014,10,6,0,0,0,0,0,0,0,0,0,0,0,0,0,0,0,0,0,12,30,0,0,17,0,0,0,75,0,0,2,0,0,5,5,0,0,0,0,0,0,0,0,5,0,0,0,0,0,0,0,0,0,18,0,0,3,0,16,0,0,0,0,0,0,44,0,0,4,0,0,0,1,0,1,12,6,0,4,0,0,0,0,0,0,0,0,0,0,0,0,6,0,0,0,0,0,0,0,5,0,0,0,0,0,0,0,0,0,1,0,0,20,0,0,0,0,0,0,0,0,0,0,0,0,0,25,0,0,0,1,0,6,0,0,0,0,0,0,0,0,0,0,0,0,0,0,0,0,0,0,39,0,0,0,0,0,0,0,20,1,0,0,1,0,0,0
"LTU_053_MZB_LO_69","LTU_053_MZB_LO_69-05.10.2015","05.10.2015",2015,10,5,0,0,0,0,0,0,0,0,0,0,0,0,0,0,0,0,0,0,10,0,0,11,0,0,0,28,0,0,13,0,0,9,9,0,0,0,1,0,34,0,0,1,0,0,6,0,0,0,0,0,0,0,0,0,2,0,9,0,0,0,0,0,0,19,0,0,2,0,0,0,0,0,0,3,1,0,0,0,0,0,1,0,0,0,0,0,1,0,0,8,0,0,0,0,0,0,0,6,0,0,1,0,0,0,0,0,0,0,0,0,0,0,0,0,0,0,0,0,0,0,0,0,0,0,5,0,1,0,0,0,13,0,0,0,1,0,0,0,0,0,0,0,0,0,0,0,0,0,0,3,0,0,0,0,0,0,0,7,0,0,1,0,0,0,0
"LTU_053_MZB_LO_69","LTU_053_MZB_LO_69-03.10.2016","03.10.2016",2016,10,3,0,0,0,0,0,0,0,0,0,0,0,0,0,0,0,0,0,9,18,0,2,173,0,0,0,8,0,0,34,0,0,3,3,0,0,0,1,0,1,0,0,0,0,0,1,0,0,0,0,1,0,5,0,0,4,0,0,0,0,0,0,0,0,11,0,0,1,0,0,0,3,0,0,0,0,0,0,0,0,0,2,1,0,0,0,0,1,0,0,3,0,0,0,0,0,0,0,0,0,0,0,0,0,0,0,0,0,0,0,0,0,0,1,0,0,0,0,0,0,0,0,0,0,0,0,0,1,0,0,0,0,0,3,0,5,0,0,0,0,0,0,0,0,0,0,0,7,0,0,4,0,0,0,0,0,0,0,22,0,0,0,1,0,0,0
"LTU_053_MZB_LO_69","LTU_053_MZB_LO_69-02.10.2017","02.10.2017",2017,10,2,0,0,0,0,0,0,0,0,0,0,0,0,0,0,0,0,0,0,29,0,0,1,0,0,0,0,0,0,75,0,0,3,3,0,0,0,0,0,44,0,0,0,0,0,1,0,0,0,0,0,0,0,0,0,0,0,0,0,0,8,0,0,0,0,0,0,0,0,0,0,0,0,0,0,0,0,0,0,0,0,17,0,0,0,1,0,0,0,0,0,17,0,0,0,22,0,0,8,0,0,0,0,0,1,0,0,0,0,0,0,104,0,0,0,0,0,0,0,0,0,0,0,0,0,0,0,1,0,0,13,0,0,0,0,0,0,0,0,0,0,0,0,0,0,0,5,84,0,0,10,0,0,0,0,0,0,0,1,0,0,0,0,0,0,0
"LTU_053_MZB_LO_69","LTU_053_MZB_LO_69-05.10.2020","05.10.2020",2020,10,5,0,0,0,0,0,0,0,0,0,0,5,0,0,0,0,0,0,0,8,0,0,24,0,0,0,53,0,0,0,0,0,8,8,0,0,0,0,0,0,0,0,3,0,0,6,0,0,0,0,0,0,20,0,0,13,0,0,0,0,0,0,0,0,16,0,0,0,0,0,0,3,0,0,0,11,0,0,0,0,0,0,0,0,0,0,0,0,0,0,0,0,0,0,0,0,0,0,93,0,0,0,0,0,0,0,0,0,0,0,0,73,0,0,0,0,0,0,0,0,0,0,0,0,0,0,0,0,0,0,0,0,0,0,0,0,0,0,0,0,0,6,0,0,0,0,0,0,0,0,0,0,0,0,0,0,0,0,17,0,0,0,0,0,0,3
"LTU_053_MZB_LO_71","LTU_053_MZB_LO_71-07.10.2010","07.10.2010",2010,10,7,0,0,0,0,0,0,0,0,0,0,0,0,0,0,0,0,0,0,36,0,0,0,0,0,0,0,0,0,0,0,0,0,0,0,0,0,0,0,122,0,0,0,0,0,0,0,0,0,0,0,0,0,0,0,0,0,99,0,0,133,0,0,0,10,0,116,0,0,0,33,0,0,0,0,0,0,0,0,0,0,172,0,0,0,0,0,0,0,0,0,0,0,0,0,155,0,0,0,0,0,18,0,0,0,0,0,0,0,0,0,36,0,0,0,0,0,0,0,0,0,0,0,0,0,0,0,0,0,0,53,0,0,81,0,0,0,0,0,0,0,3,0,0,0,0,0,0,0,0,0,0,0,0,0,0,0,53,0,0,0,0,0,0,0,0
"LTU_053_MZB_LO_71","LTU_053_MZB_LO_71-29.09.2012","29.09.2012",2012,9,29,0,0,0,0,0,0,0,0,0,0,0,0,0,0,0,0,0,0,27,0,0,0,0,0,0,2,0,0,0,0,0,0,0,0,0,0,0,0,51,0,0,1,0,0,0,0,0,0,0,2,0,0,0,0,3,0,0,0,0,0,0,0,0,5,0,1,1,0,0,0,0,0,0,0,0,0,0,0,0,0,0,0,0,0,0,0,0,0,0,1,0,0,0,0,0,0,0,0,0,0,4,0,0,0,0,0,0,0,0,0,14,0,0,0,0,0,0,0,0,0,0,0,0,0,0,0,0,0,0,0,0,0,0,0,0,0,0,0,0,0,0,0,0,0,0,6,0,0,0,1,0,0,0,0,0,0,0,0,0,0,0,0,0,0,0
"LTU_053_MZB_LO_71","LTU_053_MZB_LO_71-03.10.2013","03.10.2013",2013,10,3,0,0,0,0,0,0,0,0,0,0,0,0,0,0,0,0,0,0,48,0,0,7,0,0,0,2,0,0,0,0,2,1,1,0,0,0,0,0,14,0,0,0,0,0,0,0,0,0,0,0,0,0,0,0,4,0,0,0,0,8,0,0,0,3,0,8,0,0,0,0,0,2,0,0,0,0,0,1,0,0,0,0,0,0,0,0,0,0,0,0,0,0,0,0,5,0,0,0,0,0,0,0,0,0,0,0,0,0,0,0,75,0,0,0,0,0,0,0,0,0,0,0,0,0,0,0,0,0,0,0,0,0,0,0,0,0,0,0,0,0,0,0,0,0,0,0,0,0,0,1,0,0,0,0,0,0,0,0,0,0,0,0,0,0,0
"LTU_053_MZB_LO_71","LTU_053_MZB_LO_71-07.10.2014","07.10.2014",2014,10,7,0,0,0,0,0,0,0,0,0,0,0,0,1,0,0,0,0,0,14,0,4,22,0,0,0,8,0,0,0,0,0,0,0,0,0,0,0,0,0,0,0,0,0,0,8,0,0,0,0,0,0,0,0,0,9,0,0,0,0,13,0,0,0,8,0,5,0,0,0,0,0,0,0,0,0,0,0,0,0,0,0,0,0,0,0,0,0,0,0,0,0,0,0,0,2,0,0,0,0,0,0,0,0,0,0,0,0,0,0,0,6,0,0,0,0,0,0,0,0,0,0,0,0,0,0,0,0,0,0,0,0,0,0,0,0,0,0,0,0,0,0,0,0,0,0,8,0,0,0,12,0,0,0,15,0,0,0,0,0,0,0,0,0,0,0
"LTU_053_MZB_LO_71","LTU_053_MZB_LO_71-08.10.2015","08.10.2015",2015,10,8,0,0,0,0,0,0,0,0,0,0,0,0,0,0,0,0,0,0,42,0,0,21,0,0,0,0,0,0,0,0,0,0,0,0,0,0,0,0,0,0,0,1,0,0,1,0,0,0,0,0,0,0,0,2,0,0,0,0,0,0,0,0,0,12,0,5,10,0,0,0,0,0,0,2,4,1,0,0,0,0,0,0,0,0,0,0,0,0,0,0,0,0,0,0,0,0,0,0,0,0,0,0,0,0,0,1,0,0,0,0,10,0,0,0,0,0,0,0,0,0,0,0,0,0,0,0,0,0,0,0,0,0,0,0,0,0,0,0,0,0,0,0,0,0,0,1,0,0,0,0,0,0,0,0,0,0,0,0,0,0,0,0,0,0,0
"LTU_053_MZB_LO_71","LTU_053_MZB_LO_71-26.09.2016","26.09.2016",2016,9,26,0,0,0,0,0,0,0,0,0,0,0,0,0,0,0,0,0,0,347,0,0,164,0,0,0,27,0,0,0,0,0,1,1,0,0,0,0,0,39,0,0,3,0,0,6,0,0,0,0,0,0,0,0,0,0,0,0,0,0,0,0,0,0,30,0,4,0,0,0,30,0,0,0,0,16,0,0,0,0,0,0,0,0,0,0,0,0,0,0,0,0,0,0,0,90,0,2,13,0,0,0,0,0,0,0,0,0,0,0,0,0,0,0,0,0,0,0,0,0,0,0,0,0,0,0,0,0,0,0,3,0,0,0,0,0,0,0,0,0,0,2,0,0,0,0,0,0,0,0,190,0,0,0,0,0,0,0,0,0,0,0,0,0,3,0
"LTU_053_MZB_LO_71","LTU_053_MZB_LO_71-04.10.2017","04.10.2017",2017,10,4,0,0,0,0,0,0,0,0,0,0,0,0,0,0,0,0,0,0,25,0,0,9,0,0,0,5,0,0,0,0,4,0,0,0,0,0,0,0,33,0,0,0,0,0,2,0,0,0,0,0,0,0,7,0,2,0,0,0,0,5,0,0,0,3,0,7,0,0,0,0,0,0,0,0,0,0,0,0,0,0,0,0,0,0,0,0,0,0,0,0,0,0,0,0,0,0,0,0,0,0,5,0,0,0,0,0,0,0,0,0,15,0,0,0,0,0,0,0,0,0,0,0,0,0,0,0,0,0,0,3,0,0,0,0,0,0,0,0,0,0,0,0,0,0,0,6,0,0,0,25,0,0,0,0,0,0,0,0,0,0,0,0,0,0,0
"LTU_053_MZB_LO_71","LTU_053_MZB_LO_71-12.10.2020","12.10.2020",2020,10,12,0,0,0,0,0,0,0,0,0,0,0,0,0,0,0,0,0,0,23,0,0,0,0,0,0,22,0,0,0,0,0,7,7,0,0,0,0,0,0,0,0,0,0,2,8,0,0,0,0,0,0,0,0,0,0,0,0,0,0,0,0,0,0,14,0,24,0,0,0,0,0,0,0,0,4,0,0,0,0,0,0,0,0,0,0,0,0,0,0,0,0,0,0,0,0,0,0,2,0,0,0,0,0,0,0,1,0,0,0,0,163,0,0,0,0,0,0,0,0,0,0,0,0,0,25,0,0,0,0,17,0,0,4,0,0,0,0,0,0,0,0,0,0,0,0,0,0,0,0,97,0,0,0,0,0,0,0,0,0,0,0,0,0,2,0
"LTU_053_MZB_LO_72","LTU_053_MZB_LO_72-05.10.2010","05.10.2010",2010,10,5,0,0,0,0,0,0,0,0,0,0,0,0,0,0,0,0,0,0,0,0,0,0,0,0,0,18,0,0,0,0,0,3,3,0,0,0,0,0,0,0,0,0,0,0,0,0,0,0,0,0,0,0,0,0,0,0,0,0,0,2,0,0,0,0,0,0,0,0,0,0,0,0,0,0,0,0,0,0,0,0,0,0,0,0,0,0,0,0,0,0,0,0,0,0,0,0,0,0,0,0,0,0,0,0,0,0,0,0,0,0,6,0,0,0,0,0,0,0,0,0,0,0,0,0,0,0,0,0,0,0,1,0,0,0,0,0,0,0,0,0,0,0,0,0,0,0,0,0,0,0,0,0,0,0,0,0,0,0,0,0,0,0,0,0,6
"LTU_053_MZB_LO_72","LTU_053_MZB_LO_72-02.10.2012","02.10.2012",2012,10,2,0,0,0,0,0,0,0,0,0,0,0,0,0,0,0,0,0,0,0,0,0,0,0,0,72,108,0,80,345,0,0,9,9,0,0,0,0,0,68,0,0,1,0,0,0,0,0,0,0,0,0,0,0,0,0,0,0,0,0,0,0,0,0,0,0,0,0,0,0,0,0,0,0,0,0,0,0,0,0,0,120,0,0,0,0,0,0,0,0,73,25,0,0,0,0,0,0,104,0,21,0,0,144,0,0,0,0,0,0,0,48,0,0,0,0,0,0,0,0,0,0,0,0,0,0,0,12,0,0,52,1,0,33,0,0,0,0,0,0,0,0,0,0,0,0,0,0,0,0,252,0,0,0,0,0,0,0,172,0,0,0,0,0,0,0
"LTU_053_MZB_LO_72","LTU_053_MZB_LO_72-08.10.2013","08.10.2013",2013,10,8,0,0,0,0,0,0,0,0,0,0,0,0,0,0,0,0,0,0,0,0,0,0,0,0,0,18,0,16,0,0,0,0,0,0,0,0,0,0,65,0,0,12,0,0,28,0,0,0,0,0,0,0,0,0,0,0,0,0,0,0,0,0,0,7,0,0,0,0,0,0,0,0,0,0,0,0,0,0,0,0,0,0,0,0,0,0,0,0,0,0,0,0,0,0,0,0,49,0,0,0,8,0,0,0,0,0,0,0,0,0,38,0,0,0,0,0,0,0,0,0,0,0,0,0,0,0,0,0,0,0,29,0,0,0,0,0,0,0,0,0,0,0,0,0,0,16,0,0,0,45,0,0,0,0,0,0,0,0,0,0,0,0,0,0,0
"LTU_053_MZB_LO_72","LTU_053_MZB_LO_72-07.10.2014","07.10.2014",2014,10,7,0,0,0,0,0,2,0,0,0,0,0,0,0,0,0,0,0,6,4,0,0,25,0,0,0,0,0,23,0,0,0,22,22,0,0,0,0,0,56,0,0,0,0,0,3,0,0,0,0,0,0,0,0,0,0,0,0,0,0,6,0,0,0,3,0,69,0,0,0,0,0,9,0,0,0,0,0,0,0,0,9,0,0,0,0,0,0,0,0,0,0,0,0,0,0,0,0,65,0,0,0,0,0,0,0,0,0,0,0,0,45,0,0,0,0,0,0,0,0,0,0,0,0,2,0,0,8,0,0,0,0,0,0,0,0,0,0,0,0,0,21,0,0,3,0,0,0,0,0,110,0,0,0,0,0,0,0,0,0,0,0,0,0,0,0
"LTU_053_MZB_LO_72","LTU_053_MZB_LO_72-06.10.2015","06.10.2015",2015,10,6,0,0,0,0,0,0,0,0,0,0,0,0,0,0,0,0,0,0,8,0,0,0,0,22,0,14,0,0,27,0,0,15,15,0,0,5,0,0,39,0,0,12,0,0,42,0,0,0,0,0,0,0,0,0,2,0,23,0,0,0,0,0,0,6,0,7,0,0,0,0,0,3,0,0,4,0,0,0,0,0,0,72,0,0,0,0,0,0,0,0,0,0,0,0,0,0,0,25,0,0,16,0,0,0,0,0,0,0,0,0,38,0,0,0,0,0,0,0,0,0,0,0,0,0,85,0,2,0,0,32,7,0,0,0,0,0,0,0,0,0,0,0,0,0,0,0,0,0,0,55,0,0,0,3,0,0,0,0,0,0,0,0,0,0,0
"LTU_053_MZB_LO_72","LTU_053_MZB_LO_72-04.10.2016","04.10.2016",2016,10,4,0,0,0,0,0,0,0,0,0,0,0,0,0,0,0,0,0,0,0,0,0,36,0,0,0,0,0,0,0,0,0,0,0,0,0,4,0,0,48,0,0,2,0,0,7,0,0,0,0,0,0,0,0,0,6,0,0,0,0,0,0,0,0,8,0,9,4,0,0,0,0,0,0,0,0,0,0,0,0,0,0,0,0,0,0,0,0,0,0,0,0,0,0,0,0,0,90,110,0,0,0,0,0,0,0,0,0,1,0,0,16,0,0,0,0,0,0,0,0,0,0,0,0,0,104,0,17,0,0,130,9,0,0,0,0,0,0,0,0,0,20,0,0,0,0,17,0,0,0,170,0,0,0,0,1,0,0,0,0,0,0,0,0,0,0
"LTU_053_MZB_LO_72","LTU_053_MZB_LO_72-03.10.2017","03.10.2017",2017,10,3,0,0,0,0,0,0,0,0,0,0,0,0,1,0,0,0,0,4,11,0,0,33,0,0,8,24,0,0,0,0,0,2,2,0,0,0,0,0,19,0,0,0,0,0,18,0,0,0,0,0,0,0,0,0,11,0,11,0,0,7,0,0,0,5,0,13,0,0,0,0,0,0,0,0,0,0,0,0,0,0,23,0,0,0,0,0,0,0,0,0,0,0,0,0,37,0,0,35,0,0,0,0,0,0,0,2,0,0,0,0,24,0,0,0,0,0,0,0,0,0,0,0,0,0,0,0,0,0,0,54,2,0,10,0,0,0,0,0,0,0,6,0,0,0,0,0,0,0,0,46,0,0,0,0,0,0,0,0,0,0,0,0,0,0,0
"LTU_053_MZB_LO_72","LTU_053_MZB_LO_72-06.10.2020","06.10.2020",2020,10,6,0,0,0,0,0,0,0,0,0,0,7,0,0,0,0,0,0,0,0,0,0,0,0,0,0,9,0,13,0,0,0,5,5,0,0,9,0,0,64,0,0,2,0,0,10,0,0,0,0,0,0,0,0,0,0,0,0,0,0,0,0,0,0,6,0,27,0,0,0,0,0,0,0,0,0,0,0,0,0,0,8,0,0,0,0,0,0,0,0,0,0,0,0,0,0,0,0,13,0,0,0,0,0,0,0,1,0,0,0,0,12,0,0,0,0,0,0,0,0,0,2,0,0,0,0,0,1,0,0,1,6,0,4,0,0,0,0,0,0,0,2,0,0,0,0,1,0,0,0,0,3,0,0,3,0,0,0,7,0,0,0,0,0,0,0
"LTU_053_MZB_LO_76","LTU_053_MZB_LO_76-11.10.2010","11.10.2010",2010,10,11,0,0,0,0,0,0,0,0,0,0,0,0,0,0,0,0,0,0,0,0,0,0,0,0,0,0,0,0,0,0,0,0,0,0,0,0,0,0,8,0,0,0,0,0,0,0,0,0,0,0,0,0,0,0,0,0,0,0,0,0,0,0,0,0,0,3,0,0,0,0,1,0,0,0,0,0,0,0,0,0,0,0,0,0,0,0,0,0,0,0,0,0,0,0,0,0,28,0,0,0,0,0,0,0,0,0,0,0,0,0,2,0,0,0,0,0,0,0,0,0,0,0,0,0,0,0,0,0,0,0,0,0,0,0,0,0,0,0,0,0,1,0,0,0,0,1,0,0,0,0,0,0,0,0,0,0,0,0,0,0,0,0,0,0,0
"LTU_053_MZB_LO_76","LTU_053_MZB_LO_76-12.09.2011","12.09.2011",2011,9,12,0,0,0,0,0,0,0,0,0,0,0,0,0,0,0,0,0,0,0,0,0,0,0,0,0,0,0,0,0,0,0,1,1,0,0,0,0,0,56,0,0,0,0,0,0,112,0,0,0,0,0,28,0,0,0,0,0,0,0,1,0,0,0,0,0,18,0,0,0,0,1,0,0,1,0,0,0,0,0,0,0,0,0,0,0,0,0,0,0,0,0,0,0,0,0,0,1811,0,0,0,0,0,0,0,0,0,0,0,0,0,23,0,0,0,0,0,0,0,0,0,0,0,0,0,0,0,0,0,0,0,0,0,0,0,0,0,0,0,0,0,0,0,0,0,0,0,0,0,0,0,0,0,0,0,0,0,0,0,0,0,0,2,0,0,0
"LTU_053_MZB_LO_76","LTU_053_MZB_LO_76-08.10.2012","08.10.2012",2012,10,8,0,0,0,0,0,0,0,0,0,0,0,0,0,0,0,0,0,0,0,0,0,0,0,0,0,1,0,0,0,0,0,0,0,0,0,0,0,0,4,0,0,0,0,0,0,0,0,0,0,0,0,3,0,0,0,0,0,0,0,0,0,0,0,1,0,1,0,0,0,0,0,0,0,0,0,0,0,0,0,0,0,0,0,0,0,0,0,0,0,0,0,0,0,0,0,0,35,3,0,0,0,0,0,0,0,0,0,0,0,0,0,0,0,0,0,1,0,0,0,0,0,0,0,0,0,0,0,0,0,0,0,0,0,0,0,0,0,0,0,0,0,0,0,0,0,0,0,0,0,0,0,0,0,0,0,0,0,0,0,0,0,0,0,0,2
