Site ID,Sample ID,Sampling date,Taxon name,Taxon ID,Abundance,Definition of abundance class,Abundance class,Site_ID_Ellen,sampling method,year,month,day
BEVL_VMM_757000,254786,1.6.1989,Asellidae,,11,,,121000003,Handnet,1989,6,1
BEVL_VMM_757000,254786,1.6.1989,Chironomidae non thummi-plumosus,,1,,,121000003,Handnet,1989,6,1
BEVL_VMM_757000,254786,1.6.1989,Chironomidae thummi-plumosus,,11,,,121000003,Handnet,1989,6,1
BEVL_VMM_757000,254786,1.6.1989,Haliplidae,,2,,,121000003,Handnet,1989,6,1
BEVL_VMM_757000,254786,1.6.1989,Helobdella,,11,,,121000003,Handnet,1989,6,1
BEVL_VMM_757000,254786,1.6.1989,Naididae,,2,,,121000003,Handnet,1989,6,1
BEVL_VMM_757000,254786,1.6.1989,Psychodidae,,2,,,121000003,Handnet,1989,6,1
BEVL_VMM_757000,254786,1.6.1989,Ptychopteridae,,1,,,121000003,Handnet,1989,6,1
BEVL_VMM_757000,254786,1.6.1989,Sigara,,2,,,121000003,Handnet,1989,6,1
BEVL_VMM_757000,254786,1.6.1989,Tipulidae,,1,,,121000003,Handnet,1989,6,1
BEVL_VMM_757000,254786,1.6.1989,Tubificidae,,11,,,121000003,Handnet,1989,6,1
BEVL_VMM_757000,254788,7.6.1993,Asellidae,,11,,,121000003,Handnet,1993,6,7
BEVL_VMM_757000,254788,7.6.1993,Chironomidae non thummi-plumosus,,101,,,121000003,Handnet,1993,6,7
BEVL_VMM_757000,254788,7.6.1993,Chironomidae thummi-plumosus,,101,,,121000003,Handnet,1993,6,7
BEVL_VMM_757000,254788,7.6.1993,Dytiscidae,,1,,,121000003,Handnet,1993,6,7
BEVL_VMM_757000,254788,7.6.1993,Helobdella,,2,,,121000003,Handnet,1993,6,7
BEVL_VMM_757000,254788,7.6.1993,Hydraenidae,,2,,,121000003,Handnet,1993,6,7
BEVL_VMM_757000,254788,7.6.1993,Limoniidae,,2,,,121000003,Handnet,1993,6,7
BEVL_VMM_757000,254788,7.6.1993,Lymnaea,,1,,,121000003,Handnet,1993,6,7
BEVL_VMM_757000,254788,7.6.1993,Nematoda,,1,,,121000003,Handnet,1993,6,7
BEVL_VMM_757000,254788,7.6.1993,Ostracoda,,2,,,121000003,Handnet,1993,6,7
BEVL_VMM_757000,254788,7.6.1993,Sialis,,1,,,121000003,Handnet,1993,6,7
BEVL_VMM_757000,254788,7.6.1993,Sigara,,2,,,121000003,Handnet,1993,6,7
BEVL_VMM_757000,254788,7.6.1993,Tubificidae,,101,,,121000003,Handnet,1993,6,7
BEVL_VMM_757000,325906,23.09.1996,Anisus,,11,,,121000003,Handnet,1996,9,23
BEVL_VMM_757000,325906,23.09.1996,Asellidae,,11,,,121000003,Handnet,1996,9,23
BEVL_VMM_757000,325906,23.09.1996,Bathyomphalus,,2,,,121000003,Handnet,1996,9,23
BEVL_VMM_757000,325906,23.09.1996,Chironomidae non thummi-plumosus,,101,,,121000003,Handnet,1996,9,23
BEVL_VMM_757000,325906,23.09.1996,Chironomidae thummi-plumosus,,2,,,121000003,Handnet,1996,9,23
BEVL_VMM_757000,325906,23.09.1996,Dugesia,,1,,,121000003,Handnet,1996,9,23
BEVL_VMM_757000,325906,23.09.1996,Dytiscidae,,2,,,121000003,Handnet,1996,9,23
BEVL_VMM_757000,325906,23.09.1996,Gyraulus,,11,,,121000003,Handnet,1996,9,23
BEVL_VMM_757000,325906,23.09.1996,Haliplidae,,2,,,121000003,Handnet,1996,9,23
BEVL_VMM_757000,325906,23.09.1996,Helobdella,,11,,,121000003,Handnet,1996,9,23
BEVL_VMM_757000,325906,23.09.1996,Lymnaea,,11,,,121000003,Handnet,1996,9,23
BEVL_VMM_757000,325906,23.09.1996,Naididae,,1001,,,121000003,Handnet,1996,9,23
BEVL_VMM_757000,325906,23.09.1996,Nepa,,2,,,121000003,Handnet,1996,9,23
BEVL_VMM_757000,325906,23.09.1996,Ostracoda,,2,,,121000003,Handnet,1996,9,23
BEVL_VMM_757000,325906,23.09.1996,Psychodidae,,1,,,121000003,Handnet,1996,9,23
BEVL_VMM_757000,325906,23.09.1996,Sphaerium,,2,,,121000003,Handnet,1996,9,23
BEVL_VMM_757000,325906,23.09.1996,Tipulidae,,1,,,121000003,Handnet,1996,9,23
BEVL_VMM_757000,982908,30.09.1997,Anisus,,11,,,121000003,Handnet,1997,9,30
BEVL_VMM_757000,982908,30.09.1997,Asellidae,,51,,,121000003,Handnet,1997,9,30
BEVL_VMM_757000,982908,30.09.1997,Chironomidae non thummi-plumosus,,11,,,121000003,Handnet,1997,9,30
BEVL_VMM_757000,982908,30.09.1997,Chironomidae thummi-plumosus,,2,,,121000003,Handnet,1997,9,30
BEVL_VMM_757000,982908,30.09.1997,Corixa,,2,,,121000003,Handnet,1997,9,30
BEVL_VMM_757000,982908,30.09.1997,Dugesia,,11,,,121000003,Handnet,1997,9,30
BEVL_VMM_757000,982908,30.09.1997,Dytiscidae,,11,,,121000003,Handnet,1997,9,30
BEVL_VMM_757000,982908,30.09.1997,Glossiphonia,,11,,,121000003,Handnet,1997,9,30
BEVL_VMM_757000,982908,30.09.1997,Gyraulus,,2,,,121000003,Handnet,1997,9,30
BEVL_VMM_757000,982908,30.09.1997,Helobdella,,2,,,121000003,Handnet,1997,9,30
BEVL_VMM_757000,982908,30.09.1997,Ischnura,,11,,,121000003,Handnet,1997,9,30
BEVL_VMM_757000,982908,30.09.1997,Lymnaea,,11,,,121000003,Handnet,1997,9,30
BEVL_VMM_757000,982908,30.09.1997,Naididae,,101,,,121000003,Handnet,1997,9,30
BEVL_VMM_757000,982908,30.09.1997,Ostracoda,,2,,,121000003,Handnet,1997,9,30
BEVL_VMM_757000,982908,30.09.1997,Physa,,2,,,121000003,Handnet,1997,9,30
BEVL_VMM_757000,982908,30.09.1997,Sigara,,51,,,121000003,Handnet,1997,9,30
BEVL_VMM_757000,982908,30.09.1997,Sphaerium,,11,,,121000003,Handnet,1997,9,30
BEVL_VMM_757000,982908,30.09.1997,Theromyzon,,2,,,121000003,Handnet,1997,9,30
BEVL_VMM_757000,982908,30.09.1997,Valvata,,2,,,121000003,Handnet,1997,9,30
BEVL_VMM_757000,996637,3.6.1998,Asellidae,,11,,,121000003,Handnet,1998,6,3
BEVL_VMM_757000,996637,3.6.1998,Chironomidae non thummi-plumosus,,11,,,121000003,Handnet,1998,6,3
BEVL_VMM_757000,996637,3.6.1998,Chironomidae thummi-plumosus,,2,,,121000003,Handnet,1998,6,3
BEVL_VMM_757000,996637,3.6.1998,Copepoda,,2,,,121000003,Handnet,1998,6,3
BEVL_VMM_757000,996637,3.6.1998,Elminthidae,,2,,,121000003,Handnet,1998,6,3
BEVL_VMM_757000,996637,3.6.1998,Gammaridae,,1,,,121000003,Handnet,1998,6,3
BEVL_VMM_757000,996637,3.6.1998,Helobdella,,1,,,121000003,Handnet,1998,6,3
BEVL_VMM_757000,996637,3.6.1998,Hydrophilidae,,11,,,121000003,Handnet,1998,6,3
BEVL_VMM_757000,996637,3.6.1998,Ischnura,,1,,,121000003,Handnet,1998,6,3
BEVL_VMM_757000,996637,3.6.1998,Limoniidae,,1,,,121000003,Handnet,1998,6,3
BEVL_VMM_757000,996637,3.6.1998,Lymnaea,,11,,,121000003,Handnet,1998,6,3
BEVL_VMM_757000,996637,3.6.1998,Naididae,,101,,,121000003,Handnet,1998,6,3
BEVL_VMM_757000,996637,3.6.1998,Ostracoda,,1,,,121000003,Handnet,1998,6,3
BEVL_VMM_757000,996637,3.6.1998,Physa,,2,,,121000003,Handnet,1998,6,3
BEVL_VMM_757000,996637,3.6.1998,Pisidium,,11,,,121000003,Handnet,1998,6,3
BEVL_VMM_757000,996637,3.6.1998,Sigara,,2,,,121000003,Handnet,1998,6,3
BEVL_VMM_757000,996637,3.6.1998,Sphaerium,,2,,,121000003,Handnet,1998,6,3
BEVL_VMM_757000,11023881,9.4.1999,Anisus,,2,,,121000003,Handnet,1999,4,9
BEVL_VMM_757000,11023881,9.4.1999,Asellidae,,101,,,121000003,Handnet,1999,4,9
BEVL_VMM_757000,11023881,9.4.1999,Chironomidae non thummi-plumosus,,101,,,121000003,Handnet,1999,4,9
BEVL_VMM_757000,11023881,9.4.1999,Chironomidae thummi-plumosus,,2,,,121000003,Handnet,1999,4,9
BEVL_VMM_757000,11023881,9.4.1999,Coenagrion,,1,,,121000003,Handnet,1999,4,9
BEVL_VMM_757000,11023881,9.4.1999,Enchytraeidae,,2,,,121000003,Handnet,1999,4,9
BEVL_VMM_757000,11023881,9.4.1999,Glossiphonia,,2,,,121000003,Handnet,1999,4,9
BEVL_VMM_757000,11023881,9.4.1999,Lymnaea,,11,,,121000003,Handnet,1999,4,9
BEVL_VMM_757000,11023881,9.4.1999,Naididae,,101,,,121000003,Handnet,1999,4,9
BEVL_VMM_757000,11023881,9.4.1999,Physa,,11,,,121000003,Handnet,1999,4,9
BEVL_VMM_757000,11023881,9.4.1999,Pisidium,,101,,,121000003,Handnet,1999,4,9
BEVL_VMM_757000,11023881,9.4.1999,Polycelis,,2,,,121000003,Handnet,1999,4,9
BEVL_VMM_757000,11023881,9.4.1999,Sigara,,1,,,121000003,Handnet,1999,4,9
BEVL_VMM_757000,11023881,9.4.1999,Tubificidae,,11,,,121000003,Handnet,1999,4,9
BEVL_VMM_757000,11023881,9.4.1999,Valvata,,1,,,121000003,Handnet,1999,4,9
BEVL_VMM_757000,21026365,26.07.2000,Anisus,,2,,,121000003,Handnet,2000,7,26
BEVL_VMM_757000,21026365,26.07.2000,Bathyomphalus,,1,,,121000003,Handnet,2000,7,26
BEVL_VMM_757000,21026365,26.07.2000,Ceratopogonidae,,1,,,121000003,Handnet,2000,7,26
BEVL_VMM_757000,21026365,26.07.2000,Chironomidae non thummi-plumosus,,51,,,121000003,Handnet,2000,7,26
BEVL_VMM_757000,21026365,26.07.2000,Chironomidae thummi-plumosus,,2,,,121000003,Handnet,2000,7,26
BEVL_VMM_757000,21026365,26.07.2000,Cloeon,,2,,,121000003,Handnet,2000,7,26
BEVL_VMM_757000,21026365,26.07.2000,Dytiscidae,,2,,,121000003,Handnet,2000,7,26
BEVL_VMM_757000,21026365,26.07.2000,Erpobdella,,2,,,121000003,Handnet,2000,7,26
BEVL_VMM_757000,21026365,26.07.2000,Glossiphonia,,11,,,121000003,Handnet,2000,7,26
BEVL_VMM_757000,21026365,26.07.2000,Gyraulus,,11,,,121000003,Handnet,2000,7,26
BEVL_VMM_757000,21026365,26.07.2000,Helobdella,,2,,,121000003,Handnet,2000,7,26
BEVL_VMM_757000,21026365,26.07.2000,Hesperocorixa,,2,,,121000003,Handnet,2000,7,26
BEVL_VMM_757000,21026365,26.07.2000,Hydrophilidae,,2,,,121000003,Handnet,2000,7,26
BEVL_VMM_757000,21026365,26.07.2000,Limoniidae,,2,,,121000003,Handnet,2000,7,26
BEVL_VMM_757000,21026365,26.07.2000,Lymnaea,,2,,,121000003,Handnet,2000,7,26
BEVL_VMM_757000,21026365,26.07.2000,Naididae,,2,,,121000003,Handnet,2000,7,26
BEVL_VMM_757000,21026365,26.07.2000,Physa,,1,,,121000003,Handnet,2000,7,26
BEVL_VMM_757000,21026365,26.07.2000,Pisidium,,2,,,121000003,Handnet,2000,7,26
BEVL_VMM_757000,21026365,26.07.2000,Sigara,,2,,,121000003,Handnet,2000,7,26
BEVL_VMM_757000,21026365,26.07.2000,Sphaerium,,2,,,121000003,Handnet,2000,7,26
BEVL_VMM_757000,21026365,26.07.2000,Theromyzon,,2,,,121000003,Handnet,2000,7,26
BEVL_VMM_757000,21026365,26.07.2000,Tipulidae,,1,,,121000003,Handnet,2000,7,26
BEVL_VMM_757000,21026365,26.07.2000,Tubificidae,,11,,,121000003,Handnet,2000,7,26
BEVL_VMM_757000,21026365,26.07.2000,Valvata,,2,,,121000003,Handnet,2000,7,26
BEVL_VMM_757000,21065566,16.10.2001,Anisus,,11,,,121000003,Handnet,2001,10,16
BEVL_VMM_757000,21065566,16.10.2001,Asellidae,,101,,,121000003,Handnet,2001,10,16
BEVL_VMM_757000,21065566,16.10.2001,Bathyomphalus,,1,,,121000003,Handnet,2001,10,16
BEVL_VMM_757000,21065566,16.10.2001,Chironomidae non thummi-plumosus,,11,,,121000003,Handnet,2001,10,16
BEVL_VMM_757000,21065566,16.10.2001,Chironomidae thummi-plumosus,,101,,,121000003,Handnet,2001,10,16
BEVL_VMM_757000,21065566,16.10.2001,Cloeon,,11,,,121000003,Handnet,2001,10,16
BEVL_VMM_757000,21065566,16.10.2001,Coenagrion,,1,,,121000003,Handnet,2001,10,16
BEVL_VMM_757000,21065566,16.10.2001,Dendrocoelum,,2,,,121000003,Handnet,2001,10,16
BEVL_VMM_757000,21065566,16.10.2001,Dytiscidae,,2,,,121000003,Handnet,2001,10,16
BEVL_VMM_757000,21065566,16.10.2001,Erpobdella,,2,,,121000003,Handnet,2001,10,16
BEVL_VMM_757000,21065566,16.10.2001,Glossiphonia,,11,,,121000003,Handnet,2001,10,16
BEVL_VMM_757000,21065566,16.10.2001,Gyraulus,,11,,,121000003,Handnet,2001,10,16
BEVL_VMM_757000,21065566,16.10.2001,Haemopis,,2,,,121000003,Handnet,2001,10,16
BEVL_VMM_757000,21065566,16.10.2001,Haliplidae,,1,,,121000003,Handnet,2001,10,16
BEVL_VMM_757000,21065566,16.10.2001,Helobdella,,11,,,121000003,Handnet,2001,10,16
BEVL_VMM_757000,21065566,16.10.2001,Hydrophilidae,,2,,,121000003,Handnet,2001,10,16
BEVL_VMM_757000,21065566,16.10.2001,Ischnura,,11,,,121000003,Handnet,2001,10,16
BEVL_VMM_757000,21065566,16.10.2001,Lymnaea,,11,,,121000003,Handnet,2001,10,16
BEVL_VMM_757000,21065566,16.10.2001,Naididae,,2,,,121000003,Handnet,2001,10,16
BEVL_VMM_757000,21065566,16.10.2001,Pisidium,,51,,,121000003,Handnet,2001,10,16
BEVL_VMM_757000,21065566,16.10.2001,Planorbarius,,2,,,121000003,Handnet,2001,10,16
BEVL_VMM_757000,21065566,16.10.2001,Polycelis,,2,,,121000003,Handnet,2001,10,16
BEVL_VMM_757000,21065566,16.10.2001,Sigara,,1,,,121000003,Handnet,2001,10,16
BEVL_VMM_757000,21065566,16.10.2001,Sphaerium,,2,,,121000003,Handnet,2001,10,16
BEVL_VMM_757000,21065566,16.10.2001,Theromyzon,,2,,,121000003,Handnet,2001,10,16
BEVL_VMM_757000,21065566,16.10.2001,Tubificidae,,101,,,121000003,Handnet,2001,10,16
BEVL_VMM_757000,21086817,19.06.2002,Anisus,,11,,,121000003,Handnet,2002,6,19
BEVL_VMM_757000,21086817,19.06.2002,Asellidae,,11,,,121000003,Handnet,2002,6,19
BEVL_VMM_757000,21086817,19.06.2002,Bathyomphalus,,2,,,121000003,Handnet,2002,6,19
BEVL_VMM_757000,21086817,19.06.2002,Chironomidae non thummi-plumosus,,51,,,121000003,Handnet,2002,6,19
BEVL_VMM_757000,21086817,19.06.2002,Chironomidae thummi-plumosus,,11,,,121000003,Handnet,2002,6,19
BEVL_VMM_757000,21086817,19.06.2002,Dendrocoelum,,2,,,121000003,Handnet,2002,6,19
BEVL_VMM_757000,21086817,19.06.2002,Empididae,,2,,,121000003,Handnet,2002,6,19
BEVL_VMM_757000,21086817,19.06.2002,Erpobdella,,11,,,121000003,Handnet,2002,6,19
BEVL_VMM_757000,21086817,19.06.2002,Glossiphonia,,11,,,121000003,Handnet,2002,6,19
BEVL_VMM_757000,21086817,19.06.2002,Gyraulus,,2,,,121000003,Handnet,2002,6,19
BEVL_VMM_757000,21086817,19.06.2002,Helobdella,,11,,,121000003,Handnet,2002,6,19
BEVL_VMM_757000,21086817,19.06.2002,Ischnura,,2,,,121000003,Handnet,2002,6,19
BEVL_VMM_757000,21086817,19.06.2002,Lymnaea,,2,,,121000003,Handnet,2002,6,19
BEVL_VMM_757000,21086817,19.06.2002,Muscidae,,2,,,121000003,Handnet,2002,6,19
BEVL_VMM_757000,21086817,19.06.2002,Naididae,,11,,,121000003,Handnet,2002,6,19
BEVL_VMM_757000,21086817,19.06.2002,Pisidium,,51,,,121000003,Handnet,2002,6,19
BEVL_VMM_757000,21086817,19.06.2002,Planorbarius,,1,,,121000003,Handnet,2002,6,19
BEVL_VMM_757000,21086817,19.06.2002,Polycelis,,1,,,121000003,Handnet,2002,6,19
BEVL_VMM_757000,21086817,19.06.2002,Sialis,,2,,,121000003,Handnet,2002,6,19
BEVL_VMM_757000,21086817,19.06.2002,Simuliidae,,11,,,121000003,Handnet,2002,6,19
BEVL_VMM_757000,21086817,19.06.2002,Sphaerium,,51,,,121000003,Handnet,2002,6,19
BEVL_VMM_757000,21086817,19.06.2002,Theromyzon,,2,,,121000003,Handnet,2002,6,19
BEVL_VMM_757000,21086817,19.06.2002,Tipulidae,,1,,,121000003,Handnet,2002,6,19
BEVL_VMM_757000,21086817,19.06.2002,Tubificidae,,51,,,121000003,Handnet,2002,6,19
BEVL_VMM_757000,21126766,7.7.2003,Anisus,,1,,,121000003,Handnet,2003,7,7
BEVL_VMM_757000,21126766,7.7.2003,Asellidae,,11,,,121000003,Handnet,2003,7,7
BEVL_VMM_757000,21126766,7.7.2003,Chironomidae non thummi-plumosus,,11,,,121000003,Handnet,2003,7,7
BEVL_VMM_757000,21126766,7.7.2003,Chironomidae thummi-plumosus,,11,,,121000003,Handnet,2003,7,7
BEVL_VMM_757000,21126766,7.7.2003,Drie doornige stekelbaars,,2,,,121000003,Handnet,2003,7,7
BEVL_VMM_757000,21126766,7.7.2003,Dytiscidae,,2,,,121000003,Handnet,2003,7,7
BEVL_VMM_757000,21126766,7.7.2003,Erpobdella,,2,,,121000003,Handnet,2003,7,7
BEVL_VMM_757000,21126766,7.7.2003,Glossiphonia,,11,,,121000003,Handnet,2003,7,7
BEVL_VMM_757000,21126766,7.7.2003,Gyraulus,,11,,,121000003,Handnet,2003,7,7
BEVL_VMM_757000,21126766,7.7.2003,Haemopis,,1,,,121000003,Handnet,2003,7,7
BEVL_VMM_757000,21126766,7.7.2003,Helobdella,,11,,,121000003,Handnet,2003,7,7
BEVL_VMM_757000,21126766,7.7.2003,Hesperocorixa,,2,,,121000003,Handnet,2003,7,7
BEVL_VMM_757000,21126766,7.7.2003,Hydrophilidae,,11,,,121000003,Handnet,2003,7,7
BEVL_VMM_757000,21126766,7.7.2003,Ischnura,,1,,,121000003,Handnet,2003,7,7
BEVL_VMM_757000,21126766,7.7.2003,Lymnaea,,11,,,121000003,Handnet,2003,7,7
BEVL_VMM_757000,21126766,7.7.2003,Naididae,,101,,,121000003,Handnet,2003,7,7
BEVL_VMM_757000,21126766,7.7.2003,Nepa,,2,,,121000003,Handnet,2003,7,7
BEVL_VMM_757000,21126766,7.7.2003,Pisidium,,11,,,121000003,Handnet,2003,7,7
BEVL_VMM_757000,21126766,7.7.2003,Planorbarius,,2,,,121000003,Handnet,2003,7,7
BEVL_VMM_757000,21126766,7.7.2003,Polycelis,,1,,,121000003,Handnet,2003,7,7
BEVL_VMM_757000,21126766,7.7.2003,Sigara,,2,,,121000003,Handnet,2003,7,7
BEVL_VMM_757000,21126766,7.7.2003,Sphaerium,,2,,,121000003,Handnet,2003,7,7
BEVL_VMM_757000,21126766,7.7.2003,Theromyzon,,2,,,121000003,Handnet,2003,7,7
BEVL_VMM_757000,21126766,7.7.2003,tiendoornige stekelbaars,,2,,,121000003,Handnet,2003,7,7
BEVL_VMM_757000,21126766,7.7.2003,Tubificidae,,11,,,121000003,Handnet,2003,7,7
BEVL_VMM_757000,21126766,7.7.2003,Valvata,,1,,,121000003,Handnet,2003,7,7
BEVL_VMM_757000,21171885,15.07.2004,Asellidae,,11,,,121000003,Handnet,2004,7,15
BEVL_VMM_757000,21171885,15.07.2004,Chironomidae non thummi-plumosus,,51,,,121000003,Handnet,2004,7,15
BEVL_VMM_757000,21171885,15.07.2004,Chironomidae thummi-plumosus,,11,,,121000003,Handnet,2004,7,15
BEVL_VMM_757000,21171885,15.07.2004,Dendrocoelum,,1,,,121000003,Handnet,2004,7,15
BEVL_VMM_757000,21171885,15.07.2004,Drie doornige stekelbaars,,11,,,121000003,Handnet,2004,7,15
BEVL_VMM_757000,21171885,15.07.2004,Dytiscidae,,3,,,121000003,Handnet,2004,7,15
BEVL_VMM_757000,21171885,15.07.2004,Empididae,,1,,,121000003,Handnet,2004,7,15
BEVL_VMM_757000,21171885,15.07.2004,Erpobdella,,11,,,121000003,Handnet,2004,7,15
BEVL_VMM_757000,21171885,15.07.2004,Glossiphonia,,11,,,121000003,Handnet,2004,7,15
BEVL_VMM_757000,21171885,15.07.2004,Gyraulus,,3,,,121000003,Handnet,2004,7,15
BEVL_VMM_757000,21171885,15.07.2004,Helobdella,,11,,,121000003,Handnet,2004,7,15
BEVL_VMM_757000,21171885,15.07.2004,Hydrophilidae,,11,,,121000003,Handnet,2004,7,15
BEVL_VMM_757000,21171885,15.07.2004,Ischnura,,1,,,121000003,Handnet,2004,7,15
BEVL_VMM_757000,21171885,15.07.2004,Lymnaea,,9,,,121000003,Handnet,2004,7,15
BEVL_VMM_757000,21171885,15.07.2004,Muscidae,,2,,,121000003,Handnet,2004,7,15
BEVL_VMM_757000,21171885,15.07.2004,Naididae,,3,,,121000003,Handnet,2004,7,15
BEVL_VMM_757000,21171885,15.07.2004,Nepa,,2,,,121000003,Handnet,2004,7,15
BEVL_VMM_757000,21171885,15.07.2004,Pisidium,,11,,,121000003,Handnet,2004,7,15
BEVL_VMM_757000,21171885,15.07.2004,Planorbarius,,1,,,121000003,Handnet,2004,7,15
BEVL_VMM_757000,21171885,15.07.2004,Sigara,,11,,,121000003,Handnet,2004,7,15
BEVL_VMM_757000,21171885,15.07.2004,Sphaerium,,6,,,121000003,Handnet,2004,7,15
BEVL_VMM_757000,21171885,15.07.2004,Stratiomyidae,,1,,,121000003,Handnet,2004,7,15
BEVL_VMM_757000,21171885,15.07.2004,Tipulidae,,1,,,121000003,Handnet,2004,7,15
BEVL_VMM_757000,21171885,15.07.2004,Tubificidae,,51,,,121000003,Handnet,2004,7,15
BEVL_VMM_757000,21235543,17.10.2005,Anisus,,3,,,121000003,Handnet,2005,10,17
BEVL_VMM_757000,21235543,17.10.2005,Asellidae,,100,,,121000003,Handnet,2005,10,17
BEVL_VMM_757000,21235543,17.10.2005,Chironomidae non thummi-plumosus,,20,,,121000003,Handnet,2005,10,17
BEVL_VMM_757000,21235543,17.10.2005,Chironomidae thummi-plumosus,,2,,,121000003,Handnet,2005,10,17
BEVL_VMM_757000,21235543,17.10.2005,Dytiscidae,,20,,,121000003,Handnet,2005,10,17
BEVL_VMM_757000,21235543,17.10.2005,Erpobdella,,5,,,121000003,Handnet,2005,10,17
BEVL_VMM_757000,21235543,17.10.2005,Glossiphonia,,1,,,121000003,Handnet,2005,10,17
BEVL_VMM_757000,21235543,17.10.2005,Gyraulus,,15,,,121000003,Handnet,2005,10,17
BEVL_VMM_757000,21235543,17.10.2005,Helobdella,,15,,,121000003,Handnet,2005,10,17
BEVL_VMM_757000,21235543,17.10.2005,Hydrophilidae,,1,,,121000003,Handnet,2005,10,17
BEVL_VMM_757000,21235543,17.10.2005,Ischnura,,35,,,121000003,Handnet,2005,10,17
BEVL_VMM_757000,21235543,17.10.2005,Lymnaea,,45,,,121000003,Handnet,2005,10,17
BEVL_VMM_757000,21235543,17.10.2005,Nepa,,1,,,121000003,Handnet,2005,10,17
BEVL_VMM_757000,21235543,17.10.2005,Physella,,1,,,121000003,Handnet,2005,10,17
BEVL_VMM_757000,21235543,17.10.2005,Pisidium,,30,,,121000003,Handnet,2005,10,17
BEVL_VMM_757000,21235543,17.10.2005,Polycelis,,1,,,121000003,Handnet,2005,10,17
BEVL_VMM_757000,21235543,17.10.2005,Sphaerium,,11,,,121000003,Handnet,2005,10,17
BEVL_VMM_757000,21235543,17.10.2005,Theromyzon,,2,,,121000003,Handnet,2005,10,17
BEVL_VMM_757000,21235543,17.10.2005,tiendoornige stekelbaars,,101,,,121000003,Handnet,2005,10,17
BEVL_VMM_757000,21235543,17.10.2005,Tubificidae,,20,,,121000003,Handnet,2005,10,17
BEVL_VMM_757000,21285060,18.09.2006,Anisus,,2,,,121000003,Handnet,2006,9,18
BEVL_VMM_757000,21285060,18.09.2006,Asellidae,,500,,,121000003,Handnet,2006,9,18
BEVL_VMM_757000,21285060,18.09.2006,Chironomidae non thummi-plumosus,,11,,,121000003,Handnet,2006,9,18
BEVL_VMM_757000,21285060,18.09.2006,Chironomidae thummi-plumosus,,2,,,121000003,Handnet,2006,9,18
BEVL_VMM_757000,21285060,18.09.2006,Cloeon,,2,,,121000003,Handnet,2006,9,18
BEVL_VMM_757000,21285060,18.09.2006,Dendrocoelum,,1,,,121000003,Handnet,2006,9,18
BEVL_VMM_757000,21285060,18.09.2006,Dugesia,,15,,,121000003,Handnet,2006,9,18
BEVL_VMM_757000,21285060,18.09.2006,Dytiscidae,,7,,,121000003,Handnet,2006,9,18
BEVL_VMM_757000,21285060,18.09.2006,Erpobdella,,10,,,121000003,Handnet,2006,9,18
BEVL_VMM_757000,21285060,18.09.2006,Gerris,,11,,,121000003,Handnet,2006,9,18
BEVL_VMM_757000,21285060,18.09.2006,Glossiphonia,,13,,,121000003,Handnet,2006,9,18
BEVL_VMM_757000,21285060,18.09.2006,Gyraulus,,6,,,121000003,Handnet,2006,9,18
BEVL_VMM_757000,21285060,18.09.2006,Haemopis,,1,,,121000003,Handnet,2006,9,18
BEVL_VMM_757000,21285060,18.09.2006,Ischnura,,25,,,121000003,Handnet,2006,9,18
BEVL_VMM_757000,21285060,18.09.2006,Lymnaea,,300,,,121000003,Handnet,2006,9,18
BEVL_VMM_757000,21285060,18.09.2006,Physella,,200,,,121000003,Handnet,2006,9,18
BEVL_VMM_757000,21285060,18.09.2006,Pisidium,,40,,,121000003,Handnet,2006,9,18
BEVL_VMM_757000,21285060,18.09.2006,Polycelis,,4,,,121000003,Handnet,2006,9,18
BEVL_VMM_757000,21285060,18.09.2006,Potamopyrgus,,11,,,121000003,Handnet,2006,9,18
BEVL_VMM_757000,21285060,18.09.2006,Sciomyzidae,,1,,,121000003,Handnet,2006,9,18
BEVL_VMM_757000,21285060,18.09.2006,Sigara,,100,,,121000003,Handnet,2006,9,18
BEVL_VMM_757000,21285060,18.09.2006,Sphaerium,,20,,,121000003,Handnet,2006,9,18
BEVL_VMM_757000,21285060,18.09.2006,Theromyzon,,5,,,121000003,Handnet,2006,9,18
BEVL_VMM_757000,21285060,18.09.2006,Tubificidae,,75,,,121000003,Handnet,2006,9,18
BEVL_VMM_757000,21285060,18.09.2006,Valvata,,100,,,121000003,Handnet,2006,9,18
BEVL_VMM_757000,21393474,9.10.2008,Anisus,,15,,,121000003,Handnet,2008,10,9
BEVL_VMM_757000,21393474,9.10.2008,Asellidae,,20,,,121000003,Handnet,2008,10,9
BEVL_VMM_757000,21393474,9.10.2008,Bathyomphalus,,3,,,121000003,Handnet,2008,10,9
BEVL_VMM_757000,21393474,9.10.2008,Chironomidae non thummi-plumosus,,15,,,121000003,Handnet,2008,10,9
BEVL_VMM_757000,21393474,9.10.2008,Cloeon,,1,,,121000003,Handnet,2008,10,9
BEVL_VMM_757000,21393474,9.10.2008,Dendrocoelum,,2,,,121000003,Handnet,2008,10,9
BEVL_VMM_757000,21393474,9.10.2008,Dugesia,,4,,,121000003,Handnet,2008,10,9
BEVL_VMM_757000,21393474,9.10.2008,Dytiscidae,,20,,,121000003,Handnet,2008,10,9
BEVL_VMM_757000,21393474,9.10.2008,Ephydridae,,1,,,121000003,Handnet,2008,10,9
BEVL_VMM_757000,21393474,9.10.2008,Erpobdella,,11,,,121000003,Handnet,2008,10,9
BEVL_VMM_757000,21393474,9.10.2008,Glossiphonia,,20,,,121000003,Handnet,2008,10,9
BEVL_VMM_757000,21393474,9.10.2008,Gyraulus,,15,,,121000003,Handnet,2008,10,9
BEVL_VMM_757000,21393474,9.10.2008,Helobdella,,4,,,121000003,Handnet,2008,10,9
BEVL_VMM_757000,21393474,9.10.2008,Hydrophilidae,,2,,,121000003,Handnet,2008,10,9
BEVL_VMM_757000,21393474,9.10.2008,Ischnura,,7,,,121000003,Handnet,2008,10,9
BEVL_VMM_757000,21393474,9.10.2008,Lymnaea,,11,,,121000003,Handnet,2008,10,9
BEVL_VMM_757000,21393474,9.10.2008,Physella,,6,,,121000003,Handnet,2008,10,9
BEVL_VMM_757000,21393474,9.10.2008,Pisidium,,11,,,121000003,Handnet,2008,10,9
BEVL_VMM_757000,21393474,9.10.2008,Planorbarius,,2,,,121000003,Handnet,2008,10,9
BEVL_VMM_757000,21393474,9.10.2008,Polycelis,,1,,,121000003,Handnet,2008,10,9
BEVL_VMM_757000,21393474,9.10.2008,Potamopyrgus,,3000,,,121000003,Handnet,2008,10,9
BEVL_VMM_757000,21393474,9.10.2008,Simuliidae,,3,,,121000003,Handnet,2008,10,9
BEVL_VMM_757000,21393474,9.10.2008,Sphaerium,,15,,,121000003,Handnet,2008,10,9
BEVL_VMM_757000,21393474,9.10.2008,Theromyzon,,4,,,121000003,Handnet,2008,10,9
BEVL_VMM_757000,21393474,9.10.2008,Tubificidae,,40,,,121000003,Handnet,2008,10,9
BEVL_VMM_757000,21393474,9.10.2008,Valvata,,6,,,121000003,Handnet,2008,10,9
BEVL_VMM_757000,21528178,3.6.2011,Anisus,,1,,,121000003,Handnet,2011,6,3
BEVL_VMM_757000,21528178,3.6.2011,Asellidae,,30,,,121000003,Handnet,2011,6,3
BEVL_VMM_757000,21528178,3.6.2011,Ceratopogonidae,,1,,,121000003,Handnet,2011,6,3
BEVL_VMM_757000,21528178,3.6.2011,Chironomidae non thummi-plumosus,,150,,,121000003,Handnet,2011,6,3
BEVL_VMM_757000,21528178,3.6.2011,Chironomidae thummi-plumosus,,150,,,121000003,Handnet,2011,6,3
BEVL_VMM_757000,21528178,3.6.2011,Dendrocoelum,,1,,,121000003,Handnet,2011,6,3
BEVL_VMM_757000,21528178,3.6.2011,Dytiscidae,,6,,,121000003,Handnet,2011,6,3
BEVL_VMM_757000,21528178,3.6.2011,Erpobdella,,3,,,121000003,Handnet,2011,6,3
BEVL_VMM_757000,21528178,3.6.2011,Glossiphonia,,20,,,121000003,Handnet,2011,6,3
BEVL_VMM_757000,21528178,3.6.2011,Gyraulus,,7,,,121000003,Handnet,2011,6,3
BEVL_VMM_757000,21528178,3.6.2011,Helobdella,,25,,,121000003,Handnet,2011,6,3
BEVL_VMM_757000,21528178,3.6.2011,Hydrophilidae,,60,,,121000003,Handnet,2011,6,3
BEVL_VMM_757000,21528178,3.6.2011,Ischnura,,11,,,121000003,Handnet,2011,6,3
BEVL_VMM_757000,21528178,3.6.2011,Lymnaea,,8,,,121000003,Handnet,2011,6,3
BEVL_VMM_757000,21528178,3.6.2011,Naididae,,5,,,121000003,Handnet,2011,6,3
BEVL_VMM_757000,21528178,3.6.2011,Nepa,,1,,,121000003,Handnet,2011,6,3
BEVL_VMM_757000,21528178,3.6.2011,Pisidium,,25,,,121000003,Handnet,2011,6,3
BEVL_VMM_757000,21528178,3.6.2011,Planorbarius,,1,,,121000003,Handnet,2011,6,3
BEVL_VMM_757000,21528178,3.6.2011,Polycelis,,1,,,121000003,Handnet,2011,6,3
BEVL_VMM_757000,21528178,3.6.2011,Potamopyrgus,,10,,,121000003,Handnet,2011,6,3
BEVL_VMM_757000,21528178,3.6.2011,Sialis,,25,,,121000003,Handnet,2011,6,3
BEVL_VMM_757000,21528178,3.6.2011,Sigara,,15,,,121000003,Handnet,2011,6,3
BEVL_VMM_757000,21528178,3.6.2011,Sphaerium,,15,,,121000003,Handnet,2011,6,3
BEVL_VMM_757000,21528178,3.6.2011,Theromyzon,,1,,,121000003,Handnet,2011,6,3
BEVL_VMM_757000,21528178,3.6.2011,Tubificidae,,200,,,121000003,Handnet,2011,6,3
BEVL_VMM_757000,21528178,3.6.2011,Valvata,,50,,,121000003,Handnet,2011,6,3
BEVL_VMM_757000,21655510,24.07.2014,Anisus,,5,,,121000003,Handnet,2014,7,24
BEVL_VMM_757000,21655510,24.07.2014,Asellidae,,60,,,121000003,Handnet,2014,7,24
BEVL_VMM_757000,21655510,24.07.2014,Bathyomphalus,,3,,,121000003,Handnet,2014,7,24
BEVL_VMM_757000,21655510,24.07.2014,Chironomidae non thummi-plumosus,,25,,,121000003,Handnet,2014,7,24
BEVL_VMM_757000,21655510,24.07.2014,Chironomidae thummi-plumosus,,25,,,121000003,Handnet,2014,7,24
BEVL_VMM_757000,21655510,24.07.2014,Cloeon,,2,,,121000003,Handnet,2014,7,24
BEVL_VMM_757000,21655510,24.07.2014,Dugesia,,3,,,121000003,Handnet,2014,7,24
BEVL_VMM_757000,21655510,24.07.2014,Dytiscidae,,2,,,121000003,Handnet,2014,7,24
BEVL_VMM_757000,21655510,24.07.2014,Erpobdella,,6,,,121000003,Handnet,2014,7,24
BEVL_VMM_757000,21655510,24.07.2014,Gerris,,1,,,121000003,Handnet,2014,7,24
BEVL_VMM_757000,21655510,24.07.2014,Glossiphonia,,2,,,121000003,Handnet,2014,7,24
BEVL_VMM_757000,21655510,24.07.2014,Gyraulus,,7,,,121000003,Handnet,2014,7,24
BEVL_VMM_757000,21655510,24.07.2014,Haemopis,,1,,,121000003,Handnet,2014,7,24
BEVL_VMM_757000,21655510,24.07.2014,Helobdella,,4,,,121000003,Handnet,2014,7,24
BEVL_VMM_757000,21655510,24.07.2014,Hydrophilidae,,9,,,121000003,Handnet,2014,7,24
BEVL_VMM_757000,21655510,24.07.2014,Lymnaea,,6,,,121000003,Handnet,2014,7,24
BEVL_VMM_757000,21655510,24.07.2014,Naididae,,10,,,121000003,Handnet,2014,7,24
BEVL_VMM_757000,21655510,24.07.2014,Notonecta,,3,,,121000003,Handnet,2014,7,24
BEVL_VMM_757000,21655510,24.07.2014,Physella,,1,,,121000003,Handnet,2014,7,24
BEVL_VMM_757000,21655510,24.07.2014,Pisidium,,13,,,121000003,Handnet,2014,7,24
BEVL_VMM_757000,21655510,24.07.2014,Planorbarius,,1,,,121000003,Handnet,2014,7,24
BEVL_VMM_757000,21655510,24.07.2014,Potamopyrgus,,1,,,121000003,Handnet,2014,7,24
BEVL_VMM_757000,21655510,24.07.2014,Sigara,,9,,,121000003,Handnet,2014,7,24
BEVL_VMM_757000,21655510,24.07.2014,Theromyzon,,1,,,121000003,Handnet,2014,7,24
BEVL_VMM_757000,21655510,24.07.2014,Tubificidae,,1,,,121000003,Handnet,2014,7,24
BEVL_VMM_757000,21655510,24.07.2014,Valvata,,100,,,121000003,Handnet,2014,7,24
BEVL_VMM_757000,21814155,15.06.2018,Anisus,,40,,,121000003,Handnet,2018,6,15
BEVL_VMM_757000,21814155,15.06.2018,Asellidae,,120,,,121000003,Handnet,2018,6,15
BEVL_VMM_757000,21814155,15.06.2018,Bathyomphalus,,3,,,121000003,Handnet,2018,6,15
BEVL_VMM_757000,21814155,15.06.2018,Ceratopogonidae,,2,,,121000003,Handnet,2018,6,15
BEVL_VMM_757000,21814155,15.06.2018,Chironomidae non thummi-plumosus,,200,,,121000003,Handnet,2018,6,15
BEVL_VMM_757000,21814155,15.06.2018,Chironomidae thummi-plumosus,,11,,,121000003,Handnet,2018,6,15
BEVL_VMM_757000,21814155,15.06.2018,Corixa,,2,,,121000003,Handnet,2018,6,15
BEVL_VMM_757000,21814155,15.06.2018,Crangonyctidae,,3,,,121000003,Handnet,2018,6,15
BEVL_VMM_757000,21814155,15.06.2018,Dendrocoelum,,1,,,121000003,Handnet,2018,6,15
BEVL_VMM_757000,21814155,15.06.2018,Dugesia,,7,,,121000003,Handnet,2018,6,15
BEVL_VMM_757000,21814155,15.06.2018,Dytiscidae,,2,,,121000003,Handnet,2018,6,15
BEVL_VMM_757000,21814155,15.06.2018,Erpobdella,,3,,,121000003,Handnet,2018,6,15
BEVL_VMM_757000,21814155,15.06.2018,Glossiphonia,,30,,,121000003,Handnet,2018,6,15
BEVL_VMM_757000,21814155,15.06.2018,Gyraulus,,40,,,121000003,Handnet,2018,6,15
BEVL_VMM_757000,21814155,15.06.2018,Haliplidae,,40,,,121000003,Handnet,2018,6,15
BEVL_VMM_757000,21814155,15.06.2018,Helobdella,,20,,,121000003,Handnet,2018,6,15
BEVL_VMM_757000,21814155,15.06.2018,Hemiclepsis,,1,,,121000003,Handnet,2018,6,15
BEVL_VMM_757000,21814155,15.06.2018,Hydrophilidae,,60,,,121000003,Handnet,2018,6,15
BEVL_VMM_757000,21814155,15.06.2018,Ischnura,,9,,,121000003,Handnet,2018,6,15
BEVL_VMM_757000,21814155,15.06.2018,Limoniidae,,1,,,121000003,Handnet,2018,6,15
BEVL_VMM_757000,21814155,15.06.2018,Lymnaea,,40,,,121000003,Handnet,2018,6,15
BEVL_VMM_757000,21814155,15.06.2018,Naididae,,2,,,121000003,Handnet,2018,6,15
BEVL_VMM_757000,21814155,15.06.2018,Pisidium,,100,,,121000003,Handnet,2018,6,15
BEVL_VMM_757000,21814155,15.06.2018,Planorbarius,,11,,,121000003,Handnet,2018,6,15
BEVL_VMM_757000,21814155,15.06.2018,Potamopyrgus,,50,,,121000003,Handnet,2018,6,15
BEVL_VMM_757000,21814155,15.06.2018,Sigara,,25,,,121000003,Handnet,2018,6,15
BEVL_VMM_757000,21814155,15.06.2018,Simuliidae,,5,,,121000003,Handnet,2018,6,15
BEVL_VMM_757000,21814155,15.06.2018,Sphaerium,,2,,,121000003,Handnet,2018,6,15
BEVL_VMM_757000,21814155,15.06.2018,Theromyzon,,5,,,121000003,Handnet,2018,6,15
BEVL_VMM_757000,21814155,15.06.2018,Tubificidae,,15,,,121000003,Handnet,2018,6,15
BEVL_VMM_757000,21814155,15.06.2018,Valvata,,1250,,,121000003,Handnet,2018,6,15
BEVL_VMM_757000,21903719,12.6.2020,Anisus,,100,,,121000003,Handnet,2020,6,12
BEVL_VMM_757000,21903719,12.6.2020,Asellidae,,200,,,121000003,Handnet,2020,6,12
BEVL_VMM_757000,21903719,12.6.2020,Bathyomphalus,,3,,,121000003,Handnet,2020,6,12
BEVL_VMM_757000,21903719,12.6.2020,Chironomidae non thummi-plumosus,,50,,,121000003,Handnet,2020,6,12
BEVL_VMM_757000,21903719,12.6.2020,Corixa,,4,,,121000003,Handnet,2020,6,12
BEVL_VMM_757000,21903719,12.6.2020,Culicidae,,4,,,121000003,Handnet,2020,6,12
BEVL_VMM_757000,21903719,12.6.2020,Dugesia,,4,,,121000003,Handnet,2020,6,12
BEVL_VMM_757000,21903719,12.6.2020,Dytiscidae,,9,,,121000003,Handnet,2020,6,12
BEVL_VMM_757000,21903719,12.6.2020,Erpobdella,,2,,,121000003,Handnet,2020,6,12
BEVL_VMM_757000,21903719,12.6.2020,Glossiphonia,,20,,,121000003,Handnet,2020,6,12
BEVL_VMM_757000,21903719,12.6.2020,Gyraulus,,50,,,121000003,Handnet,2020,6,12
BEVL_VMM_757000,21903719,12.6.2020,Haliplidae,,25,,,121000003,Handnet,2020,6,12
BEVL_VMM_757000,21903719,12.6.2020,Hippeutis,,2,,,121000003,Handnet,2020,6,12
BEVL_VMM_757000,21903719,12.6.2020,Hydraenidae,,1,,,121000003,Handnet,2020,6,12
BEVL_VMM_757000,21903719,12.6.2020,Hydrophilidae,,200,,,121000003,Handnet,2020,6,12
BEVL_VMM_757000,21903719,12.6.2020,Ischnura,,20,,,121000003,Handnet,2020,6,12
BEVL_VMM_757000,21903719,12.6.2020,Lymnaea,,100,,,121000003,Handnet,2020,6,12
BEVL_VMM_757000,21903719,12.6.2020,Naididae,,3,,,121000003,Handnet,2020,6,12
BEVL_VMM_757000,21903719,12.6.2020,Noteridae,,1,,,121000003,Handnet,2020,6,12
BEVL_VMM_757000,21903719,12.6.2020,Notonecta,,11,,,121000003,Handnet,2020,6,12
BEVL_VMM_757000,21903719,12.6.2020,Planorbarius,,20,,,121000003,Handnet,2020,6,12
BEVL_VMM_757000,21903719,12.6.2020,Plea,,3,,,121000003,Handnet,2020,6,12
BEVL_VMM_757000,21903719,12.6.2020,Polycelis,,80,,,121000003,Handnet,2020,6,12
BEVL_VMM_757000,21903719,12.6.2020,Sigara,,100,,,121000003,Handnet,2020,6,12
BEVL_VMM_757000,21903719,12.6.2020,Sphaerium,,4,,,121000003,Handnet,2020,6,12
BEVL_VMM_757000,21903719,12.6.2020,Tubificidae,,3,,,121000003,Handnet,2020,6,12
BEVL_VMM_757000,21903719,12.6.2020,Valvata,,250,,,121000003,Handnet,2020,6,12
BEVL_VMM_757000,21903719,12.6.2020,Velia,,1,,,121000003,Handnet,2020,6,12
BEVL_VMM_757000,22014204,14.04.2023,Anisus,,5,,,121000003,Handnet,2023,4,14
BEVL_VMM_757000,22014204,14.04.2023,Armiger,,1,,,121000003,Handnet,2023,4,14
BEVL_VMM_757000,22014204,14.04.2023,Asellidae,,19,,,121000003,Handnet,2023,4,14
BEVL_VMM_757000,22014204,14.04.2023,Bathyomphalus,,3,,,121000003,Handnet,2023,4,14
BEVL_VMM_757000,22014204,14.04.2023,Chironomidae non thummi-plumosus,,300,,,121000003,Handnet,2023,4,14
BEVL_VMM_757000,22014204,14.04.2023,Cloeon,,10,,,121000003,Handnet,2023,4,14
BEVL_VMM_757000,22014204,14.04.2023,Crangonyctidae,,25,,,121000003,Handnet,2023,4,14
BEVL_VMM_757000,22014204,14.04.2023,Dugesia,,13,,,121000003,Handnet,2023,4,14
BEVL_VMM_757000,22014204,14.04.2023,Dytiscidae,,15,,,121000003,Handnet,2023,4,14
BEVL_VMM_757000,22014204,14.04.2023,Erpobdella,,1,,,121000003,Handnet,2023,4,14
BEVL_VMM_757000,22014204,14.04.2023,Glossiphonia,,5,,,121000003,Handnet,2023,4,14
BEVL_VMM_757000,22014204,14.04.2023,Gyraulus,,8,,,121000003,Handnet,2023,4,14
BEVL_VMM_757000,22014204,14.04.2023,Helobdella,,2,,,121000003,Handnet,2023,4,14
BEVL_VMM_757000,22014204,14.04.2023,Hydrophilidae,,1,,,121000003,Handnet,2023,4,14
BEVL_VMM_757000,22014204,14.04.2023,Ischnura,,3,,,121000003,Handnet,2023,4,14
BEVL_VMM_757000,22014204,14.04.2023,Lymnaea,,1,,,121000003,Handnet,2023,4,14
BEVL_VMM_757000,22014204,14.04.2023,Naididae,,500,,,121000003,Handnet,2023,4,14
BEVL_VMM_757000,22014204,14.04.2023,Notonecta,,1,,,121000003,Handnet,2023,4,14
BEVL_VMM_757000,22014204,14.04.2023,Pisidium,,15,,,121000003,Handnet,2023,4,14
BEVL_VMM_757000,22014204,14.04.2023,Psychodidae,,2,,,121000003,Handnet,2023,4,14
BEVL_VMM_757000,22014204,14.04.2023,Sigara,,4,,,121000003,Handnet,2023,4,14
BEVL_VMM_757000,22014204,14.04.2023,Tubificidae,,50,,,121000003,Handnet,2023,4,14
BEVL_VMM_757000,22014204,14.04.2023,Valvata,,26,,,121000003,Handnet,2023,4,14
BEVL_VMM_756000,254781,1.6.1989,Asellidae,,11,,,121000004,Handnet,1989,6,1
BEVL_VMM_756000,254781,1.6.1989,Chironomidae non thummi-plumosus,,11,,,121000004,Handnet,1989,6,1
BEVL_VMM_756000,254781,1.6.1989,Chironomidae thummi-plumosus,,11,,,121000004,Handnet,1989,6,1
BEVL_VMM_756000,254781,1.6.1989,Erpobdella,,2,,,121000004,Handnet,1989,6,1
BEVL_VMM_756000,254781,1.6.1989,Glossiphonia,,2,,,121000004,Handnet,1989,6,1
BEVL_VMM_756000,254781,1.6.1989,Haliplidae,,2,,,121000004,Handnet,1989,6,1
BEVL_VMM_756000,254781,1.6.1989,Helobdella,,2,,,121000004,Handnet,1989,6,1
BEVL_VMM_756000,254781,1.6.1989,Limoniidae,,2,,,121000004,Handnet,1989,6,1
BEVL_VMM_756000,254781,1.6.1989,Lymnaea,,1,,,121000004,Handnet,1989,6,1
BEVL_VMM_756000,254781,1.6.1989,Naididae,,2,,,121000004,Handnet,1989,6,1
BEVL_VMM_756000,254781,1.6.1989,Nepa,,2,,,121000004,Handnet,1989,6,1
BEVL_VMM_756000,254781,1.6.1989,Pisidium,,11,,,121000004,Handnet,1989,6,1
BEVL_VMM_756000,254781,1.6.1989,Psychodidae,,2,,,121000004,Handnet,1989,6,1
BEVL_VMM_756000,254781,1.6.1989,Sialis,,2,,,121000004,Handnet,1989,6,1
BEVL_VMM_756000,254781,1.6.1989,Sigara,,11,,,121000004,Handnet,1989,6,1
BEVL_VMM_756000,254781,1.6.1989,Simuliidae,,2,,,121000004,Handnet,1989,6,1
BEVL_VMM_756000,254781,1.6.1989,Tubificidae,,11,,,121000004,Handnet,1989,6,1
BEVL_VMM_756000,254781,1.6.1989,Velia,,2,,,121000004,Handnet,1989,6,1
BEVL_VMM_756000,254783,7.6.1993,Asellidae,,51,,,121000004,Handnet,1993,6,7
BEVL_VMM_756000,254783,7.6.1993,Ceratopogonidae,,1,,,121000004,Handnet,1993,6,7
BEVL_VMM_756000,254783,7.6.1993,Chironomidae non thummi-plumosus,,51,,,121000004,Handnet,1993,6,7
BEVL_VMM_756000,254783,7.6.1993,Chironomidae thummi-plumosus,,101,,,121000004,Handnet,1993,6,7
BEVL_VMM_756000,254783,7.6.1993,Dytiscidae,,1,,,121000004,Handnet,1993,6,7
BEVL_VMM_756000,254783,7.6.1993,Glossiphonia,,11,,,121000004,Handnet,1993,6,7
BEVL_VMM_756000,254783,7.6.1993,Haliplidae,,1,,,121000004,Handnet,1993,6,7
BEVL_VMM_756000,254783,7.6.1993,Helobdella,,11,,,121000004,Handnet,1993,6,7
BEVL_VMM_756000,254783,7.6.1993,Hydrophilidae,,1,,,121000004,Handnet,1993,6,7
BEVL_VMM_756000,254783,7.6.1993,Ischnura,,1,,,121000004,Handnet,1993,6,7
BEVL_VMM_756000,254783,7.6.1993,Lymnaea,,11,,,121000004,Handnet,1993,6,7
BEVL_VMM_756000,254783,7.6.1993,Naididae,,51,,,121000004,Handnet,1993,6,7
BEVL_VMM_756000,254783,7.6.1993,Physa,,2,,,121000004,Handnet,1993,6,7
BEVL_VMM_756000,254783,7.6.1993,Pisidium,,51,,,121000004,Handnet,1993,6,7
BEVL_VMM_756000,254783,7.6.1993,Sialis,,2,,,121000004,Handnet,1993,6,7
BEVL_VMM_756000,254783,7.6.1993,Sigara,,11,,,121000004,Handnet,1993,6,7
BEVL_VMM_756000,254783,7.6.1993,Sphaerium,,2,,,121000004,Handnet,1993,6,7
BEVL_VMM_756000,254783,7.6.1993,Tubificidae,,101,,,121000004,Handnet,1993,6,7
BEVL_VMM_756000,254784,11.10.1994,Anisus,,2,,,121000004,Handnet,1994,10,11
BEVL_VMM_756000,254784,11.10.1994,Asellidae,,101,,,121000004,Handnet,1994,10,11
BEVL_VMM_756000,254784,11.10.1994,Bathyomphalus,,2,,,121000004,Handnet,1994,10,11
BEVL_VMM_756000,254784,11.10.1994,Chironomidae non thummi-plumosus,,101,,,121000004,Handnet,1994,10,11
BEVL_VMM_756000,254784,11.10.1994,Chironomidae thummi-plumosus,,1,,,121000004,Handnet,1994,10,11
BEVL_VMM_756000,254784,11.10.1994,Dytiscidae,,1,,,121000004,Handnet,1994,10,11
BEVL_VMM_756000,254784,11.10.1994,Enchytraeidae,,101,,,121000004,Handnet,1994,10,11
BEVL_VMM_756000,254784,11.10.1994,Erpobdella,,2,,,121000004,Handnet,1994,10,11
BEVL_VMM_756000,254784,11.10.1994,Glossiphonia,,11,,,121000004,Handnet,1994,10,11
BEVL_VMM_756000,254784,11.10.1994,Helobdella,,2,,,121000004,Handnet,1994,10,11
BEVL_VMM_756000,254784,11.10.1994,Lymnaea,,51,,,121000004,Handnet,1994,10,11
BEVL_VMM_756000,254784,11.10.1994,Sialis,,2,,,121000004,Handnet,1994,10,11
BEVL_VMM_756000,254784,11.10.1994,Sphaerium,,11,,,121000004,Handnet,1994,10,11
BEVL_VMM_756000,254784,11.10.1994,Valvata,,11,,,121000004,Handnet,1994,10,11
BEVL_VMM_756000,254785,6.9.1995,Anisus,,101,,,121000004,Handnet,1995,9,6
BEVL_VMM_756000,254785,6.9.1995,Asellidae,,51,,,121000004,Handnet,1995,9,6
BEVL_VMM_756000,254785,6.9.1995,Centroptilum,,2,,,121000004,Handnet,1995,9,6
BEVL_VMM_756000,254785,6.9.1995,Chironomidae non thummi-plumosus,,11,,,121000004,Handnet,1995,9,6
BEVL_VMM_756000,254785,6.9.1995,Chironomidae thummi-plumosus,,11,,,121000004,Handnet,1995,9,6
BEVL_VMM_756000,254785,6.9.1995,Corixa,,1,,,121000004,Handnet,1995,9,6
BEVL_VMM_756000,254785,6.9.1995,Dytiscidae,,11,,,121000004,Handnet,1995,9,6
BEVL_VMM_756000,254785,6.9.1995,Erpobdella,,11,,,121000004,Handnet,1995,9,6
BEVL_VMM_756000,254785,6.9.1995,Glossiphonia,,11,,,121000004,Handnet,1995,9,6
BEVL_VMM_756000,254785,6.9.1995,Haliplidae,,1,,,121000004,Handnet,1995,9,6
BEVL_VMM_756000,254785,6.9.1995,Hesperocorixa,,11,,,121000004,Handnet,1995,9,6
BEVL_VMM_756000,254785,6.9.1995,Hydrometra,,2,,,121000004,Handnet,1995,9,6
BEVL_VMM_756000,254785,6.9.1995,Hydrophilidae,,1,,,121000004,Handnet,1995,9,6
BEVL_VMM_756000,254785,6.9.1995,Ischnura,,2,,,121000004,Handnet,1995,9,6
BEVL_VMM_756000,254785,6.9.1995,Lymnaea,,101,,,121000004,Handnet,1995,9,6
BEVL_VMM_756000,254785,6.9.1995,Physa,,2,,,121000004,Handnet,1995,9,6
BEVL_VMM_756000,254785,6.9.1995,Sialis,,2,,,121000004,Handnet,1995,9,6
BEVL_VMM_756000,254785,6.9.1995,Sigara,,11,,,121000004,Handnet,1995,9,6
BEVL_VMM_756000,254785,6.9.1995,Sphaerium,,101,,,121000004,Handnet,1995,9,6
BEVL_VMM_756000,254785,6.9.1995,Tubificidae,,2,,,121000004,Handnet,1995,9,6
BEVL_VMM_756000,254785,6.9.1995,Valvata,,101,,,121000004,Handnet,1995,9,6
BEVL_VMM_756000,982906,1.10.1997,Anisus,,11,,,121000004,Handnet,1997,10,1
BEVL_VMM_756000,982906,1.10.1997,Asellidae,,11,,,121000004,Handnet,1997,10,1
BEVL_VMM_756000,982906,1.10.1997,Chironomidae non thummi-plumosus,,11,,,121000004,Handnet,1997,10,1
BEVL_VMM_756000,982906,1.10.1997,Chironomidae thummi-plumosus,,2,,,121000004,Handnet,1997,10,1
BEVL_VMM_756000,982906,1.10.1997,Dugesia,,2,,,121000004,Handnet,1997,10,1
BEVL_VMM_756000,982906,1.10.1997,Dytiscidae,,2,,,121000004,Handnet,1997,10,1
BEVL_VMM_756000,982906,1.10.1997,Glossiphonia,,11,,,121000004,Handnet,1997,10,1
BEVL_VMM_756000,982906,1.10.1997,Helobdella,,2,,,121000004,Handnet,1997,10,1
BEVL_VMM_756000,982906,1.10.1997,Naididae,,101,,,121000004,Handnet,1997,10,1
BEVL_VMM_756000,982906,1.10.1997,Ostracoda,,2,,,121000004,Handnet,1997,10,1
BEVL_VMM_756000,982906,1.10.1997,Piscicola,,2,,,121000004,Handnet,1997,10,1
BEVL_VMM_756000,982906,1.10.1997,Sigara,,11,,,121000004,Handnet,1997,10,1
BEVL_VMM_756000,982906,1.10.1997,Simuliidae,,2,,,121000004,Handnet,1997,10,1
BEVL_VMM_756000,982906,1.10.1997,Sphaerium,,11,,,121000004,Handnet,1997,10,1
BEVL_VMM_756000,982906,1.10.1997,Theromyzon,,2,,,121000004,Handnet,1997,10,1
BEVL_VMM_756000,982906,1.10.1997,Tipulidae,,1,,,121000004,Handnet,1997,10,1
BEVL_VMM_756000,982906,1.10.1997,Tubificidae,,11,,,121000004,Handnet,1997,10,1
BEVL_VMM_756000,982906,1.10.1997,Valvata,,11,,,121000004,Handnet,1997,10,1
BEVL_VMM_756000,982906,1.10.1997,Vis,,11,,,121000004,Handnet,1997,10,1
BEVL_VMM_756000,996636,3.6.1998,Anisus,,11,,,121000004,Handnet,1998,6,3
BEVL_VMM_756000,996636,3.6.1998,Asellidae,,51,,,121000004,Handnet,1998,6,3
BEVL_VMM_756000,996636,3.6.1998,Bathyomphalus,,1,,,121000004,Handnet,1998,6,3
BEVL_VMM_756000,996636,3.6.1998,Chironomidae non thummi-plumosus,,11,,,121000004,Handnet,1998,6,3
BEVL_VMM_756000,996636,3.6.1998,Chironomidae thummi-plumosus,,11,,,121000004,Handnet,1998,6,3
BEVL_VMM_756000,996636,3.6.1998,Dugesia,,2,,,121000004,Handnet,1998,6,3
BEVL_VMM_756000,996636,3.6.1998,Dytiscidae,,2,,,121000004,Handnet,1998,6,3
BEVL_VMM_756000,996636,3.6.1998,Elminthidae,,1,,,121000004,Handnet,1998,6,3
BEVL_VMM_756000,996636,3.6.1998,Gerris,,2,,,121000004,Handnet,1998,6,3
BEVL_VMM_756000,996636,3.6.1998,Glossiphonia,,2,,,121000004,Handnet,1998,6,3
BEVL_VMM_756000,996636,3.6.1998,Hydrophilidae,,2,,,121000004,Handnet,1998,6,3
BEVL_VMM_756000,996636,3.6.1998,Ischnura,,11,,,121000004,Handnet,1998,6,3
BEVL_VMM_756000,996636,3.6.1998,Lymnaea,,11,,,121000004,Handnet,1998,6,3
BEVL_VMM_756000,996636,3.6.1998,Naididae,,101,,,121000004,Handnet,1998,6,3
BEVL_VMM_756000,996636,3.6.1998,Notonecta,,2,,,121000004,Handnet,1998,6,3
BEVL_VMM_756000,996636,3.6.1998,Pisidium,,2,,,121000004,Handnet,1998,6,3
BEVL_VMM_756000,996636,3.6.1998,Planorbis,,11,,,121000004,Handnet,1998,6,3
BEVL_VMM_756000,996636,3.6.1998,Psychodidae,,2,,,121000004,Handnet,1998,6,3
BEVL_VMM_756000,996636,3.6.1998,Rhagionidae,,1,,,121000004,Handnet,1998,6,3
BEVL_VMM_756000,996636,3.6.1998,Sialis,,1,,,121000004,Handnet,1998,6,3
BEVL_VMM_756000,996636,3.6.1998,Sigara,,2,,,121000004,Handnet,1998,6,3
BEVL_VMM_756000,996636,3.6.1998,Simuliidae,,11,,,121000004,Handnet,1998,6,3
BEVL_VMM_756000,996636,3.6.1998,Sphaerium,,101,,,121000004,Handnet,1998,6,3
BEVL_VMM_756000,996636,3.6.1998,Theromyzon,,11,,,121000004,Handnet,1998,6,3
BEVL_VMM_756000,996636,3.6.1998,Tipulidae,,2,,,121000004,Handnet,1998,6,3
BEVL_VMM_756000,996636,3.6.1998,Valvata,,101,,,121000004,Handnet,1998,6,3
BEVL_VMM_756000,11023880,9.4.1999,Anisus,,51,,,121000004,Handnet,1999,4,9
BEVL_VMM_756000,11023880,9.4.1999,Asellidae,,11,,,121000004,Handnet,1999,4,9
BEVL_VMM_756000,11023880,9.4.1999,Baetis,,1,,,121000004,Handnet,1999,4,9
BEVL_VMM_756000,11023880,9.4.1999,Bathyomphalus,,2,,,121000004,Handnet,1999,4,9
BEVL_VMM_756000,11023880,9.4.1999,Chironomidae non thummi-plumosus,,11,,,121000004,Handnet,1999,4,9
BEVL_VMM_756000,11023880,9.4.1999,Chironomidae thummi-plumosus,,2,,,121000004,Handnet,1999,4,9
BEVL_VMM_756000,11023880,9.4.1999,Enchytraeidae,,2,,,121000004,Handnet,1999,4,9
BEVL_VMM_756000,11023880,9.4.1999,Glossiphonia,,2,,,121000004,Handnet,1999,4,9
BEVL_VMM_756000,11023880,9.4.1999,Helobdella,,2,,,121000004,Handnet,1999,4,9
BEVL_VMM_756000,11023880,9.4.1999,Ischnura,,11,,,121000004,Handnet,1999,4,9
BEVL_VMM_756000,11023880,9.4.1999,Lumbricidae,,2,,,121000004,Handnet,1999,4,9
BEVL_VMM_756000,11023880,9.4.1999,Lymnaea,,2,,,121000004,Handnet,1999,4,9
BEVL_VMM_756000,11023880,9.4.1999,Naididae,,101,,,121000004,Handnet,1999,4,9
BEVL_VMM_756000,11023880,9.4.1999,Polycelis,,2,,,121000004,Handnet,1999,4,9
BEVL_VMM_756000,11023880,9.4.1999,Segmentina,,2,,,121000004,Handnet,1999,4,9
BEVL_VMM_756000,11023880,9.4.1999,Simuliidae,,2,,,121000004,Handnet,1999,4,9
BEVL_VMM_756000,11023880,9.4.1999,Sphaerium,,2,,,121000004,Handnet,1999,4,9
BEVL_VMM_756000,11023880,9.4.1999,Tubificidae,,2,,,121000004,Handnet,1999,4,9
BEVL_VMM_756000,11023880,9.4.1999,Valvata,,11,,,121000004,Handnet,1999,4,9
BEVL_VMM_756000,21026556,27.07.2000,Anisus,,11,,,121000004,Handnet,2000,7,27
BEVL_VMM_756000,21026556,27.07.2000,Asellidae,,11,,,121000004,Handnet,2000,7,27
BEVL_VMM_756000,21026556,27.07.2000,Bathyomphalus,,2,,,121000004,Handnet,2000,7,27
BEVL_VMM_756000,21026556,27.07.2000,Chironomidae non thummi-plumosus,,101,,,121000004,Handnet,2000,7,27
BEVL_VMM_756000,21026556,27.07.2000,Chironomidae thummi-plumosus,,2,,,121000004,Handnet,2000,7,27
BEVL_VMM_756000,21026556,27.07.2000,Cloeon,,1,,,121000004,Handnet,2000,7,27
BEVL_VMM_756000,21026556,27.07.2000,Corixa,,1,,,121000004,Handnet,2000,7,27
BEVL_VMM_756000,21026556,27.07.2000,Dytiscidae,,1,,,121000004,Handnet,2000,7,27
BEVL_VMM_756000,21026556,27.07.2000,Glossiphonia,,11,,,121000004,Handnet,2000,7,27
BEVL_VMM_756000,21026556,27.07.2000,Gyraulus,,1,,,121000004,Handnet,2000,7,27
BEVL_VMM_756000,21026556,27.07.2000,Haliplidae,,2,,,121000004,Handnet,2000,7,27
BEVL_VMM_756000,21026556,27.07.2000,Helobdella,,2,,,121000004,Handnet,2000,7,27
BEVL_VMM_756000,21026556,27.07.2000,Hydrophilidae,,1,,,121000004,Handnet,2000,7,27
BEVL_VMM_756000,21026556,27.07.2000,Lymnaea,,2,,,121000004,Handnet,2000,7,27
BEVL_VMM_756000,21026556,27.07.2000,Notonecta,,2,,,121000004,Handnet,2000,7,27
BEVL_VMM_756000,21026556,27.07.2000,Pisidium,,2,,,121000004,Handnet,2000,7,27
BEVL_VMM_756000,21026556,27.07.2000,Planorbarius,,2,,,121000004,Handnet,2000,7,27
BEVL_VMM_756000,21026556,27.07.2000,Planorbis,,2,,,121000004,Handnet,2000,7,27
BEVL_VMM_756000,21026556,27.07.2000,Sialis,,2,,,121000004,Handnet,2000,7,27
BEVL_VMM_756000,21026556,27.07.2000,Sigara,,11,,,121000004,Handnet,2000,7,27
BEVL_VMM_756000,21026556,27.07.2000,Sphaerium,,11,,,121000004,Handnet,2000,7,27
BEVL_VMM_756000,21026556,27.07.2000,Theromyzon,,2,,,121000004,Handnet,2000,7,27
BEVL_VMM_756000,21026556,27.07.2000,Tubificidae,,11,,,121000004,Handnet,2000,7,27
BEVL_VMM_756000,21026556,27.07.2000,Valvata,,51,,,121000004,Handnet,2000,7,27
BEVL_VMM_756000,21065567,16.10.2001,Asellidae,,101,,,121000004,Handnet,2001,10,16
BEVL_VMM_756000,21065567,16.10.2001,Bathyomphalus,,1,,,121000004,Handnet,2001,10,16
BEVL_VMM_756000,21065567,16.10.2001,Chironomidae non thummi-plumosus,,11,,,121000004,Handnet,2001,10,16
BEVL_VMM_756000,21065567,16.10.2001,Chironomidae thummi-plumosus,,2,,,121000004,Handnet,2001,10,16
BEVL_VMM_756000,21065567,16.10.2001,Cloeon,,2,,,121000004,Handnet,2001,10,16
BEVL_VMM_756000,21065567,16.10.2001,Dytiscidae,,2,,,121000004,Handnet,2001,10,16
BEVL_VMM_756000,21065567,16.10.2001,Erpobdella,,2,,,121000004,Handnet,2001,10,16
BEVL_VMM_756000,21065567,16.10.2001,Glossiphonia,,11,,,121000004,Handnet,2001,10,16
BEVL_VMM_756000,21065567,16.10.2001,Gyraulus,,2,,,121000004,Handnet,2001,10,16
BEVL_VMM_756000,21065567,16.10.2001,Haliplidae,,2,,,121000004,Handnet,2001,10,16
BEVL_VMM_756000,21065567,16.10.2001,Ischnura,,2,,,121000004,Handnet,2001,10,16
BEVL_VMM_756000,21065567,16.10.2001,Naididae,,2,,,121000004,Handnet,2001,10,16
BEVL_VMM_756000,21065567,16.10.2001,Pisidium,,1,,,121000004,Handnet,2001,10,16
BEVL_VMM_756000,21065567,16.10.2001,Planorbarius,,2,,,121000004,Handnet,2001,10,16
BEVL_VMM_756000,21065567,16.10.2001,Sialis,,1,,,121000004,Handnet,2001,10,16
BEVL_VMM_756000,21065567,16.10.2001,Sigara,,2,,,121000004,Handnet,2001,10,16
BEVL_VMM_756000,21065567,16.10.2001,Simuliidae,,1,,,121000004,Handnet,2001,10,16
BEVL_VMM_756000,21065567,16.10.2001,Sphaerium,,2,,,121000004,Handnet,2001,10,16
BEVL_VMM_756000,21065567,16.10.2001,Theromyzon,,2,,,121000004,Handnet,2001,10,16
BEVL_VMM_756000,21065567,16.10.2001,Tubificidae,,2,,,121000004,Handnet,2001,10,16
BEVL_VMM_756000,21065567,16.10.2001,Valvata,,11,,,121000004,Handnet,2001,10,16
BEVL_VMM_756000,21086814,19.06.2002,Anisus,,11,,,121000004,Handnet,2002,6,19
BEVL_VMM_756000,21086814,19.06.2002,Asellidae,,11,,,121000004,Handnet,2002,6,19
BEVL_VMM_756000,21086814,19.06.2002,Bathyomphalus,,2,,,121000004,Handnet,2002,6,19
BEVL_VMM_756000,21086814,19.06.2002,Chironomidae non thummi-plumosus,,11,,,121000004,Handnet,2002,6,19
BEVL_VMM_756000,21086814,19.06.2002,Chironomidae thummi-plumosus,,11,,,121000004,Handnet,2002,6,19
BEVL_VMM_756000,21086814,19.06.2002,Dugesia,,2,,,121000004,Handnet,2002,6,19
BEVL_VMM_756000,21086814,19.06.2002,Dytiscidae,,2,,,121000004,Handnet,2002,6,19
BEVL_VMM_756000,21086814,19.06.2002,Erpobdella,,2,,,121000004,Handnet,2002,6,19
BEVL_VMM_756000,21086814,19.06.2002,Glossiphonia,,11,,,121000004,Handnet,2002,6,19
BEVL_VMM_756000,21086814,19.06.2002,Gyraulus,,2,,,121000004,Handnet,2002,6,19
BEVL_VMM_756000,21086814,19.06.2002,Helobdella,,11,,,121000004,Handnet,2002,6,19
BEVL_VMM_756000,21086814,19.06.2002,Hesperocorixa,,1,,,121000004,Handnet,2002,6,19
BEVL_VMM_756000,21086814,19.06.2002,Hippeutis,,2,,,121000004,Handnet,2002,6,19
BEVL_VMM_756000,21086814,19.06.2002,Hydrophilidae,,11,,,121000004,Handnet,2002,6,19
BEVL_VMM_756000,21086814,19.06.2002,Ischnura,,2,,,121000004,Handnet,2002,6,19
BEVL_VMM_756000,21086814,19.06.2002,Lymnaea,,2,,,121000004,Handnet,2002,6,19
BEVL_VMM_756000,21086814,19.06.2002,Physa,,11,,,121000004,Handnet,2002,6,19
BEVL_VMM_756000,21086814,19.06.2002,Planorbis,,1,,,121000004,Handnet,2002,6,19
BEVL_VMM_756000,21086814,19.06.2002,Polycelis,,1,,,121000004,Handnet,2002,6,19
BEVL_VMM_756000,21086814,19.06.2002,Scathophagidae,,1,,,121000004,Handnet,2002,6,19
BEVL_VMM_756000,21086814,19.06.2002,Sigara,,2,,,121000004,Handnet,2002,6,19
BEVL_VMM_756000,21086814,19.06.2002,Simuliidae,,11,,,121000004,Handnet,2002,6,19
BEVL_VMM_756000,21086814,19.06.2002,Sphaerium,,11,,,121000004,Handnet,2002,6,19
BEVL_VMM_756000,21086814,19.06.2002,Theromyzon,,2,,,121000004,Handnet,2002,6,19
BEVL_VMM_756000,21086814,19.06.2002,Tipulidae,,2,,,121000004,Handnet,2002,6,19
BEVL_VMM_756000,21086814,19.06.2002,Tubificidae,,2,,,121000004,Handnet,2002,6,19
BEVL_VMM_756000,21086814,19.06.2002,Valvata,,11,,,121000004,Handnet,2002,6,19
BEVL_VMM_756000,21126765,7.7.2003,Anisus,,1,,,121000004,Handnet,2003,7,7
BEVL_VMM_756000,21126765,7.7.2003,Asellidae,,51,,,121000004,Handnet,2003,7,7
BEVL_VMM_756000,21126765,7.7.2003,Bathyomphalus,,11,,,121000004,Handnet,2003,7,7
BEVL_VMM_756000,21126765,7.7.2003,Chironomidae non thummi-plumosus,,11,,,121000004,Handnet,2003,7,7
BEVL_VMM_756000,21126765,7.7.2003,Chironomidae thummi-plumosus,,11,,,121000004,Handnet,2003,7,7
BEVL_VMM_756000,21126765,7.7.2003,Cloeon,,1,,,121000004,Handnet,2003,7,7
BEVL_VMM_756000,21126765,7.7.2003,Dolichopodidae,,1,,,121000004,Handnet,2003,7,7
BEVL_VMM_756000,21126765,7.7.2003,Dytiscidae,,2,,,121000004,Handnet,2003,7,7
BEVL_VMM_756000,21126765,7.7.2003,Erpobdella,,2,,,121000004,Handnet,2003,7,7
BEVL_VMM_756000,21126765,7.7.2003,Glossiphonia,,11,,,121000004,Handnet,2003,7,7
BEVL_VMM_756000,21126765,7.7.2003,Gyraulus,,2,,,121000004,Handnet,2003,7,7
BEVL_VMM_756000,21126765,7.7.2003,Haliplidae,,2,,,121000004,Handnet,2003,7,7
BEVL_VMM_756000,21126765,7.7.2003,Helobdella,,11,,,121000004,Handnet,2003,7,7
BEVL_VMM_756000,21126765,7.7.2003,Hesperocorixa,,11,,,121000004,Handnet,2003,7,7
BEVL_VMM_756000,21126765,7.7.2003,Hydracarina,,1,,,121000004,Handnet,2003,7,7
BEVL_VMM_756000,21126765,7.7.2003,Hydrophilidae,,2,,,121000004,Handnet,2003,7,7
BEVL_VMM_756000,21126765,7.7.2003,Ischnura,,1,,,121000004,Handnet,2003,7,7
BEVL_VMM_756000,21126765,7.7.2003,Lymnaea,,2,,,121000004,Handnet,2003,7,7
BEVL_VMM_756000,21126765,7.7.2003,Muscidae,,2,,,121000004,Handnet,2003,7,7
BEVL_VMM_756000,21126765,7.7.2003,Naididae,,11,,,121000004,Handnet,2003,7,7
BEVL_VMM_756000,21126765,7.7.2003,Nepa,,2,,,121000004,Handnet,2003,7,7
BEVL_VMM_756000,21126765,7.7.2003,Physa,,11,,,121000004,Handnet,2003,7,7
BEVL_VMM_756000,21126765,7.7.2003,Planorbarius,,11,,,121000004,Handnet,2003,7,7
BEVL_VMM_756000,21126765,7.7.2003,Polycelis,,1,,,121000004,Handnet,2003,7,7
BEVL_VMM_756000,21126765,7.7.2003,Psychodidae,,2,,,121000004,Handnet,2003,7,7
BEVL_VMM_756000,21126765,7.7.2003,Segmentina,,1,,,121000004,Handnet,2003,7,7
BEVL_VMM_756000,21126765,7.7.2003,Sigara,,11,,,121000004,Handnet,2003,7,7
BEVL_VMM_756000,21126765,7.7.2003,Simuliidae,,2,,,121000004,Handnet,2003,7,7
BEVL_VMM_756000,21126765,7.7.2003,Sphaerium,,11,,,121000004,Handnet,2003,7,7
BEVL_VMM_756000,21126765,7.7.2003,Stratiomyidae,,1,,,121000004,Handnet,2003,7,7
BEVL_VMM_756000,21126765,7.7.2003,Theromyzon,,2,,,121000004,Handnet,2003,7,7
BEVL_VMM_756000,21126765,7.7.2003,Tipulidae,,1,,,121000004,Handnet,2003,7,7
BEVL_VMM_756000,21126765,7.7.2003,Tubificidae,,11,,,121000004,Handnet,2003,7,7
BEVL_VMM_756000,21126765,7.7.2003,Valvata,,11,,,121000004,Handnet,2003,7,7
BEVL_VMM_756000,21171883,15.07.2004,Anisus,,2,,,121000004,Handnet,2004,7,15
BEVL_VMM_756000,21171883,15.07.2004,Asellidae,,2,,,121000004,Handnet,2004,7,15
BEVL_VMM_756000,21171883,15.07.2004,Ceratopogonidae,,2,,,121000004,Handnet,2004,7,15
BEVL_VMM_756000,21171883,15.07.2004,Chironomidae non thummi-plumosus,,51,,,121000004,Handnet,2004,7,15
BEVL_VMM_756000,21171883,15.07.2004,Chironomidae thummi-plumosus,,51,,,121000004,Handnet,2004,7,15
BEVL_VMM_756000,21171883,15.07.2004,Corixa,,1,,,121000004,Handnet,2004,7,15
BEVL_VMM_756000,21171883,15.07.2004,Dendrocoelum,,1,,,121000004,Handnet,2004,7,15
BEVL_VMM_756000,21171883,15.07.2004,Drie doornige stekelbaars,,11,,,121000004,Handnet,2004,7,15
BEVL_VMM_756000,21171883,15.07.2004,Dytiscidae,,2,,,121000004,Handnet,2004,7,15
BEVL_VMM_756000,21171883,15.07.2004,Erpobdella,,2,,,121000004,Handnet,2004,7,15
BEVL_VMM_756000,21171883,15.07.2004,Glossiphonia,,11,,,121000004,Handnet,2004,7,15
BEVL_VMM_756000,21171883,15.07.2004,Haliplidae,,1,,,121000004,Handnet,2004,7,15
BEVL_VMM_756000,21171883,15.07.2004,Helobdella,,11,,,121000004,Handnet,2004,7,15
BEVL_VMM_756000,21171883,15.07.2004,Hydracarina,,1,,,121000004,Handnet,2004,7,15
BEVL_VMM_756000,21171883,15.07.2004,Hydraenidae,,1,,,121000004,Handnet,2004,7,15
BEVL_VMM_756000,21171883,15.07.2004,Hydrophilidae,,2,,,121000004,Handnet,2004,7,15
BEVL_VMM_756000,21171883,15.07.2004,Ischnura,,11,,,121000004,Handnet,2004,7,15
BEVL_VMM_756000,21171883,15.07.2004,Lymnaea,,2,,,121000004,Handnet,2004,7,15
BEVL_VMM_756000,21171883,15.07.2004,Naididae,,2,,,121000004,Handnet,2004,7,15
BEVL_VMM_756000,21171883,15.07.2004,Planorbarius,,2,,,121000004,Handnet,2004,7,15
BEVL_VMM_756000,21171883,15.07.2004,Psychodidae,,1,,,121000004,Handnet,2004,7,15
BEVL_VMM_756000,21171883,15.07.2004,Segmentina,,2,,,121000004,Handnet,2004,7,15
BEVL_VMM_756000,21171883,15.07.2004,Sigara,,1,,,121000004,Handnet,2004,7,15
BEVL_VMM_756000,21171883,15.07.2004,Simuliidae,,11,,,121000004,Handnet,2004,7,15
BEVL_VMM_756000,21171883,15.07.2004,Sphaerium,,11,,,121000004,Handnet,2004,7,15
BEVL_VMM_756000,21171883,15.07.2004,Theromyzon,,2,,,121000004,Handnet,2004,7,15
BEVL_VMM_756000,21171883,15.07.2004,tiendoornige stekelbaars,,1,,,121000004,Handnet,2004,7,15
BEVL_VMM_756000,21171883,15.07.2004,Tubificidae,,11,,,121000004,Handnet,2004,7,15
BEVL_VMM_756000,21171883,15.07.2004,Valvata,,11,,,121000004,Handnet,2004,7,15
BEVL_VMM_756000,21235542,17.10.2005,Acroloxus,,1,,,121000004,Handnet,2005,10,17
BEVL_VMM_756000,21235542,17.10.2005,Anisus,,1,,,121000004,Handnet,2005,10,17
BEVL_VMM_756000,21235542,17.10.2005,Asellidae,,100,,,121000004,Handnet,2005,10,17
BEVL_VMM_756000,21235542,17.10.2005,Bathyomphalus,,3,,,121000004,Handnet,2005,10,17
BEVL_VMM_756000,21235542,17.10.2005,Chironomidae non thummi-plumosus,,15,,,121000004,Handnet,2005,10,17
BEVL_VMM_756000,21235542,17.10.2005,Chironomidae thummi-plumosus,,4,,,121000004,Handnet,2005,10,17
BEVL_VMM_756000,21235542,17.10.2005,Cloeon,,3,,,121000004,Handnet,2005,10,17
BEVL_VMM_756000,21235542,17.10.2005,Dytiscidae,,4,,,121000004,Handnet,2005,10,17
BEVL_VMM_756000,21235542,17.10.2005,Erpobdella,,2,,,121000004,Handnet,2005,10,17
BEVL_VMM_756000,21235542,17.10.2005,Glossiphonia,,20,,,121000004,Handnet,2005,10,17
BEVL_VMM_756000,21235542,17.10.2005,Gyraulus,,2,,,121000004,Handnet,2005,10,17
BEVL_VMM_756000,21235542,17.10.2005,Helobdella,,30,,,121000004,Handnet,2005,10,17
BEVL_VMM_756000,21235542,17.10.2005,Hippeutis,,1,,,121000004,Handnet,2005,10,17
BEVL_VMM_756000,21235542,17.10.2005,Ischnura,,2,,,121000004,Handnet,2005,10,17
BEVL_VMM_756000,21235542,17.10.2005,Lymnaea,,3,,,121000004,Handnet,2005,10,17
BEVL_VMM_756000,21235542,17.10.2005,Naididae,,20,,,121000004,Handnet,2005,10,17
BEVL_VMM_756000,21235542,17.10.2005,Pisidium,,8,,,121000004,Handnet,2005,10,17
BEVL_VMM_756000,21235542,17.10.2005,Psychodidae,,1,,,121000004,Handnet,2005,10,17
BEVL_VMM_756000,21235542,17.10.2005,Sphaerium,,1,,,121000004,Handnet,2005,10,17
BEVL_VMM_756000,21235542,17.10.2005,Tubificidae,,60,,,121000004,Handnet,2005,10,17
BEVL_VMM_756000,21235542,17.10.2005,Valvata,,11,,,121000004,Handnet,2005,10,17
BEVL_VMM_756000,21285059,18.09.2006,Anisus,,11,,,121000004,Handnet,2006,9,18
BEVL_VMM_756000,21285059,18.09.2006,Asellidae,,50,,,121000004,Handnet,2006,9,18
BEVL_VMM_756000,21285059,18.09.2006,Bathyomphalus,,4,,,121000004,Handnet,2006,9,18
BEVL_VMM_756000,21285059,18.09.2006,Chironomidae non thummi-plumosus,,30,,,121000004,Handnet,2006,9,18
BEVL_VMM_756000,21285059,18.09.2006,Chironomidae thummi-plumosus,,7,,,121000004,Handnet,2006,9,18
BEVL_VMM_756000,21285059,18.09.2006,Cloeon,,3,,,121000004,Handnet,2006,9,18
BEVL_VMM_756000,21285059,18.09.2006,Drie doornige stekelbaars,,1,,,121000004,Handnet,2006,9,18
BEVL_VMM_756000,21285059,18.09.2006,Dytiscidae,,2,,,121000004,Handnet,2006,9,18
BEVL_VMM_756000,21285059,18.09.2006,Gerris,,1,,,121000004,Handnet,2006,9,18
BEVL_VMM_756000,21285059,18.09.2006,Glossiphonia,,20,,,121000004,Handnet,2006,9,18
BEVL_VMM_756000,21285059,18.09.2006,Gyraulus,,16,,,121000004,Handnet,2006,9,18
BEVL_VMM_756000,21285059,18.09.2006,Helobdella,,20,,,121000004,Handnet,2006,9,18
BEVL_VMM_756000,21285059,18.09.2006,Hydrophilidae,,4,,,121000004,Handnet,2006,9,18
BEVL_VMM_756000,21285059,18.09.2006,Ischnura,,25,,,121000004,Handnet,2006,9,18
BEVL_VMM_756000,21285059,18.09.2006,Lymnaea,,20,,,121000004,Handnet,2006,9,18
BEVL_VMM_756000,21285059,18.09.2006,Naididae,,20,,,121000004,Handnet,2006,9,18
BEVL_VMM_756000,21285059,18.09.2006,Nepa,,1,,,121000004,Handnet,2006,9,18
BEVL_VMM_756000,21285059,18.09.2006,Pisidium,,11,,,121000004,Handnet,2006,9,18
BEVL_VMM_756000,21285059,18.09.2006,Planorbarius,,1,,,121000004,Handnet,2006,9,18
BEVL_VMM_756000,21285059,18.09.2006,Scathophagidae,,1,,,121000004,Handnet,2006,9,18
BEVL_VMM_756000,21285059,18.09.2006,Sigara,,2,,,121000004,Handnet,2006,9,18
BEVL_VMM_756000,21285059,18.09.2006,Simuliidae,,3,,,121000004,Handnet,2006,9,18
BEVL_VMM_756000,21285059,18.09.2006,Sphaerium,,6,,,121000004,Handnet,2006,9,18
BEVL_VMM_756000,21285059,18.09.2006,Stratiomyidae,,6,,,121000004,Handnet,2006,9,18
BEVL_VMM_756000,21285059,18.09.2006,Theromyzon,,4,,,121000004,Handnet,2006,9,18
BEVL_VMM_756000,21285059,18.09.2006,tiendoornige stekelbaars,,1,,,121000004,Handnet,2006,9,18
BEVL_VMM_756000,21285059,18.09.2006,Tipulidae,,5,,,121000004,Handnet,2006,9,18
BEVL_VMM_756000,21285059,18.09.2006,Tubificidae,,7,,,121000004,Handnet,2006,9,18
BEVL_VMM_756000,21285059,18.09.2006,Valvata,,50,,,121000004,Handnet,2006,9,18
BEVL_VMM_756000,21344281,22.10.2007,Acroloxus,,1,,,121000004,Handnet,2007,10,22
BEVL_VMM_756000,21344281,22.10.2007,Anisus,,1,,,121000004,Handnet,2007,10,22
BEVL_VMM_756000,21344281,22.10.2007,Asellidae,,130,,,121000004,Handnet,2007,10,22
BEVL_VMM_756000,21344281,22.10.2007,Bathyomphalus,,8,,,121000004,Handnet,2007,10,22
BEVL_VMM_756000,21344281,22.10.2007,Chironomidae non thummi-plumosus,,100,,,121000004,Handnet,2007,10,22
BEVL_VMM_756000,21344281,22.10.2007,Chironomidae thummi-plumosus,,100,,,121000004,Handnet,2007,10,22
BEVL_VMM_756000,21344281,22.10.2007,Cloeon,,1,,,121000004,Handnet,2007,10,22
BEVL_VMM_756000,21344281,22.10.2007,Dugesia,,1,,,121000004,Handnet,2007,10,22
BEVL_VMM_756000,21344281,22.10.2007,Dytiscidae,,2,,,121000004,Handnet,2007,10,22
BEVL_VMM_756000,21344281,22.10.2007,Erpobdella,,5,,,121000004,Handnet,2007,10,22
BEVL_VMM_756000,21344281,22.10.2007,Glossiphonia,,11,,,121000004,Handnet,2007,10,22
BEVL_VMM_756000,21344281,22.10.2007,Gyraulus,,1,,,121000004,Handnet,2007,10,22
BEVL_VMM_756000,21344281,22.10.2007,Haemopis,,1,,,121000004,Handnet,2007,10,22
BEVL_VMM_756000,21344281,22.10.2007,Helobdella,,35,,,121000004,Handnet,2007,10,22
BEVL_VMM_756000,21344281,22.10.2007,Ischnura,,2,,,121000004,Handnet,2007,10,22
BEVL_VMM_756000,21344281,22.10.2007,Lymnaea,,11,,,121000004,Handnet,2007,10,22
BEVL_VMM_756000,21344281,22.10.2007,Naididae,,30,,,121000004,Handnet,2007,10,22
BEVL_VMM_756000,21344281,22.10.2007,Pisidium,,3,,,121000004,Handnet,2007,10,22
BEVL_VMM_756000,21344281,22.10.2007,Planorbis,,1,,,121000004,Handnet,2007,10,22
BEVL_VMM_756000,21344281,22.10.2007,Segmentina,,1,,,121000004,Handnet,2007,10,22
BEVL_VMM_756000,21344281,22.10.2007,Simuliidae,,5,,,121000004,Handnet,2007,10,22
BEVL_VMM_756000,21344281,22.10.2007,Sphaerium,,6,,,121000004,Handnet,2007,10,22
BEVL_VMM_756000,21344281,22.10.2007,Theromyzon,,4,,,121000004,Handnet,2007,10,22
BEVL_VMM_756000,21344281,22.10.2007,Tubificidae,,12,,,121000004,Handnet,2007,10,22
BEVL_VMM_756000,21344281,22.10.2007,Valvata,,200,,,121000004,Handnet,2007,10,22
BEVL_VMM_756000,21528177,3.6.2011,Asellidae,,20,,,121000004,Handnet,2011,6,3
BEVL_VMM_756000,21528177,3.6.2011,Bithynia,,1,,,121000004,Handnet,2011,6,3
BEVL_VMM_756000,21528177,3.6.2011,Chironomidae non thummi-plumosus,,100,,,121000004,Handnet,2011,6,3
BEVL_VMM_756000,21528177,3.6.2011,Chironomidae thummi-plumosus,,100,,,121000004,Handnet,2011,6,3
BEVL_VMM_756000,21528177,3.6.2011,Dugesia,,1,,,121000004,Handnet,2011,6,3
BEVL_VMM_756000,21528177,3.6.2011,Dytiscidae,,1,,,121000004,Handnet,2011,6,3
BEVL_VMM_756000,21528177,3.6.2011,Glossiphonia,,15,,,121000004,Handnet,2011,6,3
BEVL_VMM_756000,21528177,3.6.2011,Helobdella,,20,,,121000004,Handnet,2011,6,3
BEVL_VMM_756000,21528177,3.6.2011,Hydraenidae,,1,,,121000004,Handnet,2011,6,3
BEVL_VMM_756000,21528177,3.6.2011,Hydrophilidae,,20,,,121000004,Handnet,2011,6,3
BEVL_VMM_756000,21528177,3.6.2011,Lymnaea,,8,,,121000004,Handnet,2011,6,3
BEVL_VMM_756000,21528177,3.6.2011,Naididae,,1,,,121000004,Handnet,2011,6,3
BEVL_VMM_756000,21528177,3.6.2011,Nepa,,3,,,121000004,Handnet,2011,6,3
BEVL_VMM_756000,21528177,3.6.2011,Noteridae,,1,,,121000004,Handnet,2011,6,3
BEVL_VMM_756000,21528177,3.6.2011,Notonecta,,2,,,121000004,Handnet,2011,6,3
BEVL_VMM_756000,21528177,3.6.2011,Sigara,,40,,,121000004,Handnet,2011,6,3
BEVL_VMM_756000,21528177,3.6.2011,Simuliidae,,40,,,121000004,Handnet,2011,6,3
BEVL_VMM_756000,21528177,3.6.2011,Sphaerium,,1,,,121000004,Handnet,2011,6,3
BEVL_VMM_756000,21528177,3.6.2011,Theromyzon,,1,,,121000004,Handnet,2011,6,3
BEVL_VMM_756000,21528177,3.6.2011,Tubificidae,,12,,,121000004,Handnet,2011,6,3
BEVL_VMM_756000,21528177,3.6.2011,Valvata,,2,,,121000004,Handnet,2011,6,3
BEVL_VMM_756000,21655509,24.07.2014,Anisus,,100,,,121000004,Handnet,2014,7,24
BEVL_VMM_756000,21655509,24.07.2014,Asellidae,,30,,,121000004,Handnet,2014,7,24
BEVL_VMM_756000,21655509,24.07.2014,Bathyomphalus,,60,,,121000004,Handnet,2014,7,24
BEVL_VMM_756000,21655509,24.07.2014,Bithynia,,200,,,121000004,Handnet,2014,7,24
BEVL_VMM_756000,21655509,24.07.2014,Ceratopogonidae,,1,,,121000004,Handnet,2014,7,24
BEVL_VMM_756000,21655509,24.07.2014,Chironomidae non thummi-plumosus,,30,,,121000004,Handnet,2014,7,24
BEVL_VMM_756000,21655509,24.07.2014,Chironomidae thummi-plumosus,,8,,,121000004,Handnet,2014,7,24
BEVL_VMM_756000,21655509,24.07.2014,Cloeon,,7,,,121000004,Handnet,2014,7,24
BEVL_VMM_756000,21655509,24.07.2014,Dugesia,,100,,,121000004,Handnet,2014,7,24
BEVL_VMM_756000,21655509,24.07.2014,Dytiscidae,,3,,,121000004,Handnet,2014,7,24
BEVL_VMM_756000,21655509,24.07.2014,Erpobdella,,50,,,121000004,Handnet,2014,7,24
BEVL_VMM_756000,21655509,24.07.2014,Glossiphonia,,50,,,121000004,Handnet,2014,7,24
BEVL_VMM_756000,21655509,24.07.2014,Gyraulus,,7,,,121000004,Handnet,2014,7,24
BEVL_VMM_756000,21655509,24.07.2014,Haliplidae,,6,,,121000004,Handnet,2014,7,24
BEVL_VMM_756000,21655509,24.07.2014,Helobdella,,50,,,121000004,Handnet,2014,7,24
BEVL_VMM_756000,21655509,24.07.2014,Hesperocorixa,,3,,,121000004,Handnet,2014,7,24
BEVL_VMM_756000,21655509,24.07.2014,Hippeutis,,4,,,121000004,Handnet,2014,7,24
BEVL_VMM_756000,21655509,24.07.2014,Hydrophilidae,,2,,,121000004,Handnet,2014,7,24
BEVL_VMM_756000,21655509,24.07.2014,Ischnura,,1,,,121000004,Handnet,2014,7,24
BEVL_VMM_756000,21655509,24.07.2014,Lymnaea,,4,,,121000004,Handnet,2014,7,24
BEVL_VMM_756000,21655509,24.07.2014,Naididae,,300,,,121000004,Handnet,2014,7,24
BEVL_VMM_756000,21655509,24.07.2014,Nepa,,4,,,121000004,Handnet,2014,7,24
BEVL_VMM_756000,21655509,24.07.2014,Noteridae,,2,,,121000004,Handnet,2014,7,24
BEVL_VMM_756000,21655509,24.07.2014,Notonecta,,2,,,121000004,Handnet,2014,7,24
BEVL_VMM_756000,21655509,24.07.2014,Physa,,1,,,121000004,Handnet,2014,7,24
BEVL_VMM_756000,21655509,24.07.2014,Pisidium,,35,,,121000004,Handnet,2014,7,24
BEVL_VMM_756000,21655509,24.07.2014,Planorbarius,,7,,,121000004,Handnet,2014,7,24
BEVL_VMM_756000,21655509,24.07.2014,Planorbis,,1,,,121000004,Handnet,2014,7,24
BEVL_VMM_756000,21655509,24.07.2014,Polycelis,,20,,,121000004,Handnet,2014,7,24
BEVL_VMM_756000,21655509,24.07.2014,Psychodidae,,2,,,121000004,Handnet,2014,7,24
BEVL_VMM_756000,21655509,24.07.2014,Sigara,,3,,,121000004,Handnet,2014,7,24
BEVL_VMM_756000,21655509,24.07.2014,Sphaerium,,200,,,121000004,Handnet,2014,7,24
BEVL_VMM_756000,21655509,24.07.2014,Theromyzon,,6,,,121000004,Handnet,2014,7,24
BEVL_VMM_756000,21655509,24.07.2014,Tubificidae,,30,,,121000004,Handnet,2014,7,24
BEVL_VMM_756000,21655509,24.07.2014,Valvata,,200,,,121000004,Handnet,2014,7,24
BEVL_VMM_756000,21814154,15.06.2018,Anisus,,100,,,121000004,Handnet,2018,6,15
BEVL_VMM_756000,21814154,15.06.2018,Asellidae,,500,,,121000004,Handnet,2018,6,15
BEVL_VMM_756000,21814154,15.06.2018,Bathyomphalus,,20,,,121000004,Handnet,2018,6,15
BEVL_VMM_756000,21814154,15.06.2018,Bithynia,,4,,,121000004,Handnet,2018,6,15
BEVL_VMM_756000,21814154,15.06.2018,Chironomidae non thummi-plumosus,,2,,,121000004,Handnet,2018,6,15
BEVL_VMM_756000,21814154,15.06.2018,Chironomidae thummi-plumosus,,300,,,121000004,Handnet,2018,6,15
BEVL_VMM_756000,21814154,15.06.2018,Corixa,,1,,,121000004,Handnet,2018,6,15
BEVL_VMM_756000,21814154,15.06.2018,Culicidae,,400,,,121000004,Handnet,2018,6,15
BEVL_VMM_756000,21814154,15.06.2018,Dendrocoelum,,3,,,121000004,Handnet,2018,6,15
BEVL_VMM_756000,21814154,15.06.2018,Dugesia,,1,,,121000004,Handnet,2018,6,15
BEVL_VMM_756000,21814154,15.06.2018,Dytiscidae,,2,,,121000004,Handnet,2018,6,15
BEVL_VMM_756000,21814154,15.06.2018,Erpobdella,,3,,,121000004,Handnet,2018,6,15
BEVL_VMM_756000,21814154,15.06.2018,Glossiphonia,,40,,,121000004,Handnet,2018,6,15
BEVL_VMM_756000,21814154,15.06.2018,Gyraulus,,1,,,121000004,Handnet,2018,6,15
BEVL_VMM_756000,21814154,15.06.2018,Haliplidae,,12,,,121000004,Handnet,2018,6,15
BEVL_VMM_756000,21814154,15.06.2018,Helobdella,,15,,,121000004,Handnet,2018,6,15
BEVL_VMM_756000,21814154,15.06.2018,Hesperocorixa,,1,,,121000004,Handnet,2018,6,15
BEVL_VMM_756000,21814154,15.06.2018,Hydraenidae,,1,,,121000004,Handnet,2018,6,15
BEVL_VMM_756000,21814154,15.06.2018,Hydrophilidae,,30,,,121000004,Handnet,2018,6,15
BEVL_VMM_756000,21814154,15.06.2018,Ischnura,,1,,,121000004,Handnet,2018,6,15
BEVL_VMM_756000,21814154,15.06.2018,Lymnaea,,1,,,121000004,Handnet,2018,6,15
BEVL_VMM_756000,21814154,15.06.2018,Noteridae,,2,,,121000004,Handnet,2018,6,15
BEVL_VMM_756000,21814154,15.06.2018,Notonecta,,2,,,121000004,Handnet,2018,6,15
BEVL_VMM_756000,21814154,15.06.2018,Pisidium,,100,,,121000004,Handnet,2018,6,15
BEVL_VMM_756000,21814154,15.06.2018,Planorbarius,,14,,,121000004,Handnet,2018,6,15
BEVL_VMM_756000,21814154,15.06.2018,Segmentina,,4,,,121000004,Handnet,2018,6,15
BEVL_VMM_756000,21814154,15.06.2018,Sigara,,70,,,121000004,Handnet,2018,6,15
BEVL_VMM_756000,21814154,15.06.2018,Sphaerium,,30,,,121000004,Handnet,2018,6,15
BEVL_VMM_756000,21814154,15.06.2018,Syrphidae-Eristalinae,,2,,,121000004,Handnet,2018,6,15
BEVL_VMM_756000,21814154,15.06.2018,Tubificidae,,150,,,121000004,Handnet,2018,6,15
BEVL_VMM_756000,21814154,15.06.2018,Valvata,,75,,,121000004,Handnet,2018,6,15
BEVL_VMM_756000,21814154,15.06.2018,Velia,,1,,,121000004,Handnet,2018,6,15
BEVL_VMM_756000,21903718,12.6.2020,Anisus,,200,,,121000004,Handnet,2020,6,12
BEVL_VMM_756000,21903718,12.6.2020,Asellidae,,75,,,121000004,Handnet,2020,6,12
BEVL_VMM_756000,21903718,12.6.2020,Bathyomphalus,,50,,,121000004,Handnet,2020,6,12
BEVL_VMM_756000,21903718,12.6.2020,Bithynia,,5,,,121000004,Handnet,2020,6,12
BEVL_VMM_756000,21903718,12.6.2020,Ceratopogonidae,,1,,,121000004,Handnet,2020,6,12
BEVL_VMM_756000,21903718,12.6.2020,Chironomidae non thummi-plumosus,,80,,,121000004,Handnet,2020,6,12
BEVL_VMM_756000,21903718,12.6.2020,Chironomidae thummi-plumosus,,11,,,121000004,Handnet,2020,6,12
BEVL_VMM_756000,21903718,12.6.2020,Crangonyctidae,,2,,,121000004,Handnet,2020,6,12
BEVL_VMM_756000,21903718,12.6.2020,Dugesia,,15,,,121000004,Handnet,2020,6,12
BEVL_VMM_756000,21903718,12.6.2020,Dytiscidae,,6,,,121000004,Handnet,2020,6,12
BEVL_VMM_756000,21903718,12.6.2020,Gerris,,11,,,121000004,Handnet,2020,6,12
BEVL_VMM_756000,21903718,12.6.2020,Glossiphonia,,15,,,121000004,Handnet,2020,6,12
BEVL_VMM_756000,21903718,12.6.2020,Haliplidae,,40,,,121000004,Handnet,2020,6,12
BEVL_VMM_756000,21903718,12.6.2020,Helobdella,,7,,,121000004,Handnet,2020,6,12
BEVL_VMM_756000,21903718,12.6.2020,Hydrophilidae,,50,,,121000004,Handnet,2020,6,12
BEVL_VMM_756000,21903718,12.6.2020,Ischnura,,15,,,121000004,Handnet,2020,6,12
BEVL_VMM_756000,21903718,12.6.2020,Lymnaea,,400,,,121000004,Handnet,2020,6,12
BEVL_VMM_756000,21903718,12.6.2020,Nepa,,3,,,121000004,Handnet,2020,6,12
BEVL_VMM_756000,21903718,12.6.2020,Noteridae,,2,,,121000004,Handnet,2020,6,12
BEVL_VMM_756000,21903718,12.6.2020,Notonecta,,5,,,121000004,Handnet,2020,6,12
BEVL_VMM_756000,21903718,12.6.2020,Physella,,1,,,121000004,Handnet,2020,6,12
BEVL_VMM_756000,21903718,12.6.2020,Pisidium,,100,,,121000004,Handnet,2020,6,12
BEVL_VMM_756000,21903718,12.6.2020,Planorbarius,,100,,,121000004,Handnet,2020,6,12
BEVL_VMM_756000,21903718,12.6.2020,Planorbis,,30,,,121000004,Handnet,2020,6,12
BEVL_VMM_756000,21903718,12.6.2020,Polycelis,,6,,,121000004,Handnet,2020,6,12
BEVL_VMM_756000,21903718,12.6.2020,Sciomyzidae,,2,,,121000004,Handnet,2020,6,12
BEVL_VMM_756000,21903718,12.6.2020,Segmentina,,9,,,121000004,Handnet,2020,6,12
BEVL_VMM_756000,21903718,12.6.2020,Sigara,,25,,,121000004,Handnet,2020,6,12
BEVL_VMM_756000,21903718,12.6.2020,Sphaerium,,75,,,121000004,Handnet,2020,6,12
BEVL_VMM_756000,21903718,12.6.2020,Stratiomyidae,,1,,,121000004,Handnet,2020,6,12
BEVL_VMM_756000,21903718,12.6.2020,Theromyzon,,1,,,121000004,Handnet,2020,6,12
BEVL_VMM_756000,21903718,12.6.2020,Tipulidae,,2,,,121000004,Handnet,2020,6,12
BEVL_VMM_756000,21903718,12.6.2020,Tubificidae,,20,,,121000004,Handnet,2020,6,12
BEVL_VMM_756000,21903718,12.6.2020,Valvata,,150,,,121000004,Handnet,2020,6,12
BEVL_VMM_756000,21903718,12.6.2020,Velia,,1,,,121000004,Handnet,2020,6,12
BEVL_VMM_756000,22020554,9.6.2023,Acroloxus,,18,,,121000004,Handnet,2023,6,9
BEVL_VMM_756000,22020554,9.6.2023,Anisus,,780,,,121000004,Handnet,2023,6,9
BEVL_VMM_756000,22020554,9.6.2023,Armiger,,5,,,121000004,Handnet,2023,6,9
BEVL_VMM_756000,22020554,9.6.2023,Asellidae,,300,,,121000004,Handnet,2023,6,9
BEVL_VMM_756000,22020554,9.6.2023,Bathyomphalus,,85,,,121000004,Handnet,2023,6,9
BEVL_VMM_756000,22020554,9.6.2023,Bithynia,,29,,,121000004,Handnet,2023,6,9
BEVL_VMM_756000,22020554,9.6.2023,Chironomidae non thummi-plumosus,,280,,,121000004,Handnet,2023,6,9
BEVL_VMM_756000,22020554,9.6.2023,Chironomidae thummi-plumosus,,11,,,121000004,Handnet,2023,6,9
BEVL_VMM_756000,22020554,9.6.2023,Cloeon,,2,,,121000004,Handnet,2023,6,9
BEVL_VMM_756000,22020554,9.6.2023,Crangonyctidae,,9,,,121000004,Handnet,2023,6,9
BEVL_VMM_756000,22020554,9.6.2023,Dugesia,,1,,,121000004,Handnet,2023,6,9
BEVL_VMM_756000,22020554,9.6.2023,Empididae,,14,,,121000004,Handnet,2023,6,9
BEVL_VMM_756000,22020554,9.6.2023,Erpobdella,,2,,,121000004,Handnet,2023,6,9
BEVL_VMM_756000,22020554,9.6.2023,Glossiphonia,,60,,,121000004,Handnet,2023,6,9
BEVL_VMM_756000,22020554,9.6.2023,Gyraulus,,150,,,121000004,Handnet,2023,6,9
BEVL_VMM_756000,22020554,9.6.2023,Haliplidae,,95,,,121000004,Handnet,2023,6,9
BEVL_VMM_756000,22020554,9.6.2023,Helobdella,,38,,,121000004,Handnet,2023,6,9
BEVL_VMM_756000,22020554,9.6.2023,Hippeutis,,9,,,121000004,Handnet,2023,6,9
BEVL_VMM_756000,22020554,9.6.2023,Hydrophilidae,,13,,,121000004,Handnet,2023,6,9
BEVL_VMM_756000,22020554,9.6.2023,Ischnura,,24,,,121000004,Handnet,2023,6,9
BEVL_VMM_756000,22020554,9.6.2023,Lege kokers,,1,,,121000004,Handnet,2023,6,9
BEVL_VMM_756000,22020554,9.6.2023,Lymnaea,,240,,,121000004,Handnet,2023,6,9
BEVL_VMM_756000,22020554,9.6.2023,Naididae,,40,,,121000004,Handnet,2023,6,9
BEVL_VMM_756000,22020554,9.6.2023,Noteridae,,7,,,121000004,Handnet,2023,6,9
BEVL_VMM_756000,22020554,9.6.2023,Notonecta,,4,,,121000004,Handnet,2023,6,9
BEVL_VMM_756000,22020554,9.6.2023,Physa,,4,,,121000004,Handnet,2023,6,9
BEVL_VMM_756000,22020554,9.6.2023,Pisidium,,160,,,121000004,Handnet,2023,6,9
BEVL_VMM_756000,22020554,9.6.2023,Planorbarius,,29,,,121000004,Handnet,2023,6,9
BEVL_VMM_756000,22020554,9.6.2023,Planorbis,,100,,,121000004,Handnet,2023,6,9
BEVL_VMM_756000,22020554,9.6.2023,Polycelis,,13,,,121000004,Handnet,2023,6,9
BEVL_VMM_756000,22020554,9.6.2023,Potamopyrgus,,1,,,121000004,Handnet,2023,6,9
BEVL_VMM_756000,22020554,9.6.2023,Sigara,,2,,,121000004,Handnet,2023,6,9
BEVL_VMM_756000,22020554,9.6.2023,Simuliidae,,32,,,121000004,Handnet,2023,6,9
BEVL_VMM_756000,22020554,9.6.2023,Sphaerium,,31,,,121000004,Handnet,2023,6,9
BEVL_VMM_756000,22020554,9.6.2023,Tubificidae,,6,,,121000004,Handnet,2023,6,9
BEVL_VMM_756000,22020554,9.6.2023,Valvata,,80,,,121000004,Handnet,2023,6,9
BEVL_VMM_531110,253562,24.05.1994,Asellidae,,11,,,121000005,Handnet,1994,5,24
BEVL_VMM_531110,253562,24.05.1994,Chironomidae non thummi-plumosus,,11,,,121000005,Handnet,1994,5,24
BEVL_VMM_531110,253562,24.05.1994,Chironomidae thummi-plumosus,,51,,,121000005,Handnet,1994,5,24
BEVL_VMM_531110,253562,24.05.1994,Enchytraeidae,,11,,,121000005,Handnet,1994,5,24
BEVL_VMM_531110,253562,24.05.1994,Erpobdella,,2,,,121000005,Handnet,1994,5,24
BEVL_VMM_531110,253562,24.05.1994,Gammaridae,,11,,,121000005,Handnet,1994,5,24
BEVL_VMM_531110,253562,24.05.1994,Helobdella,,51,,,121000005,Handnet,1994,5,24
BEVL_VMM_531110,253562,24.05.1994,Lymnaea,,11,,,121000005,Handnet,1994,5,24
BEVL_VMM_531110,253562,24.05.1994,Planorbarius,,11,,,121000005,Handnet,1994,5,24
BEVL_VMM_531110,253562,24.05.1994,Stratiomyidae,,2,,,121000005,Handnet,1994,5,24
BEVL_VMM_531110,253562,24.05.1994,Tipulidae,,11,,,121000005,Handnet,1994,5,24
BEVL_VMM_531110,253562,24.05.1994,Tubificidae,,51,,,121000005,Handnet,1994,5,24
BEVL_VMM_531110,253563,1.6.1995,Asellidae,,2,,,121000005,Handnet,1995,6,1
BEVL_VMM_531110,253563,1.6.1995,Chironomidae non thummi-plumosus,,11,,,121000005,Handnet,1995,6,1
BEVL_VMM_531110,253563,1.6.1995,Chironomidae thummi-plumosus,,51,,,121000005,Handnet,1995,6,1
BEVL_VMM_531110,253563,1.6.1995,Collembola,,2,,,121000005,Handnet,1995,6,1
BEVL_VMM_531110,253563,1.6.1995,Gammaridae,,2,,,121000005,Handnet,1995,6,1
BEVL_VMM_531110,253563,1.6.1995,Glossiphonia,,2,,,121000005,Handnet,1995,6,1
BEVL_VMM_531110,253563,1.6.1995,Helobdella,,11,,,121000005,Handnet,1995,6,1
BEVL_VMM_531110,253563,1.6.1995,Lymnaea,,2,,,121000005,Handnet,1995,6,1
BEVL_VMM_531110,253563,1.6.1995,Naididae,,101,,,121000005,Handnet,1995,6,1
BEVL_VMM_531110,253563,1.6.1995,Nematoda,,3,,,121000005,Handnet,1995,6,1
BEVL_VMM_531110,253563,1.6.1995,Physa,,2,,,121000005,Handnet,1995,6,1
BEVL_VMM_531110,253563,1.6.1995,Tubificidae,,101,,,121000005,Handnet,1995,6,1
BEVL_VMM_531110,982703,22.05.1997,Chironomidae non thummi-plumosus,,2,,,121000005,Handnet,1997,5,22
BEVL_VMM_531110,982703,22.05.1997,Chironomidae thummi-plumosus,,2,,,121000005,Handnet,1997,5,22
BEVL_VMM_531110,982703,22.05.1997,Gammaridae,,1,,,121000005,Handnet,1997,5,22
BEVL_VMM_531110,982703,22.05.1997,Naididae,,101,,,121000005,Handnet,1997,5,22
BEVL_VMM_531110,982703,22.05.1997,Tubificidae,,51,,,121000005,Handnet,1997,5,22
BEVL_VMM_531110,996436,13.08.1998,Aeshna,,2,,,121000005,Handnet,1998,8,13
BEVL_VMM_531110,996436,13.08.1998,Anisus,,2,,,121000005,Handnet,1998,8,13
BEVL_VMM_531110,996436,13.08.1998,Arctocorisa,,1,,,121000005,Handnet,1998,8,13
BEVL_VMM_531110,996436,13.08.1998,Chironomidae non thummi-plumosus,,2,,,121000005,Handnet,1998,8,13
BEVL_VMM_531110,996436,13.08.1998,Chironomidae thummi-plumosus,,2,,,121000005,Handnet,1998,8,13
BEVL_VMM_531110,996436,13.08.1998,Corixa,,1,,,121000005,Handnet,1998,8,13
BEVL_VMM_531110,996436,13.08.1998,Glossiphonia,,1,,,121000005,Handnet,1998,8,13
BEVL_VMM_531110,996436,13.08.1998,Helobdella,,2,,,121000005,Handnet,1998,8,13
BEVL_VMM_531110,996436,13.08.1998,Hesperocorixa,,1,,,121000005,Handnet,1998,8,13
BEVL_VMM_531110,996436,13.08.1998,Limoniidae,,1,,,121000005,Handnet,1998,8,13
BEVL_VMM_531110,996436,13.08.1998,Lumbriculidae,,2,,,121000005,Handnet,1998,8,13
BEVL_VMM_531110,996436,13.08.1998,Lymnaea,,2,,,121000005,Handnet,1998,8,13
BEVL_VMM_531110,996436,13.08.1998,Naididae,,2,,,121000005,Handnet,1998,8,13
BEVL_VMM_531110,996436,13.08.1998,Physa,,2,,,121000005,Handnet,1998,8,13
BEVL_VMM_531110,996436,13.08.1998,Tubificidae,,2,,,121000005,Handnet,1998,8,13
BEVL_VMM_531110,996436,13.08.1998,Vis,,1,,,121000005,Handnet,1998,8,13
BEVL_VMM_531110,11023755,5.8.1999,Anisus,,1,,,121000005,Handnet,1999,8,5
BEVL_VMM_531110,11023755,5.8.1999,Baetis,,2,,,121000005,Handnet,1999,8,5
BEVL_VMM_531110,11023755,5.8.1999,Chironomidae non thummi-plumosus,,51,,,121000005,Handnet,1999,8,5
BEVL_VMM_531110,11023755,5.8.1999,Chironomidae thummi-plumosus,,2,,,121000005,Handnet,1999,8,5
BEVL_VMM_531110,11023755,5.8.1999,Dytiscidae,,2,,,121000005,Handnet,1999,8,5
BEVL_VMM_531110,11023755,5.8.1999,Enchytraeidae,,2,,,121000005,Handnet,1999,8,5
BEVL_VMM_531110,11023755,5.8.1999,Erpobdella,,2,,,121000005,Handnet,1999,8,5
BEVL_VMM_531110,11023755,5.8.1999,Gammaridae,,2,,,121000005,Handnet,1999,8,5
BEVL_VMM_531110,11023755,5.8.1999,Gerris,,2,,,121000005,Handnet,1999,8,5
BEVL_VMM_531110,11023755,5.8.1999,Glossiphonia,,2,,,121000005,Handnet,1999,8,5
BEVL_VMM_531110,11023755,5.8.1999,Helobdella,,2,,,121000005,Handnet,1999,8,5
BEVL_VMM_531110,11023755,5.8.1999,Hesperocorixa,,2,,,121000005,Handnet,1999,8,5
BEVL_VMM_531110,11023755,5.8.1999,Hydrophilidae,,1,,,121000005,Handnet,1999,8,5
BEVL_VMM_531110,11023755,5.8.1999,Lestes,,1,,,121000005,Handnet,1999,8,5
BEVL_VMM_531110,11023755,5.8.1999,Lymnaea,,51,,,121000005,Handnet,1999,8,5
BEVL_VMM_531110,11023755,5.8.1999,Naididae,,1,,,121000005,Handnet,1999,8,5
BEVL_VMM_531110,11023755,5.8.1999,Nepa,,2,,,121000005,Handnet,1999,8,5
BEVL_VMM_531110,11023755,5.8.1999,Notonecta,,1,,,121000005,Handnet,1999,8,5
BEVL_VMM_531110,11023755,5.8.1999,Physa,,51,,,121000005,Handnet,1999,8,5
BEVL_VMM_531110,11023755,5.8.1999,Pisidium,,11,,,121000005,Handnet,1999,8,5
BEVL_VMM_531110,11023755,5.8.1999,Potamopyrgus,,1,,,121000005,Handnet,1999,8,5
BEVL_VMM_531110,11023755,5.8.1999,Psychodidae,,1,,,121000005,Handnet,1999,8,5
BEVL_VMM_531110,11023755,5.8.1999,Sigara,,1,,,121000005,Handnet,1999,8,5
BEVL_VMM_531110,11023755,5.8.1999,Tipulidae,,2,,,121000005,Handnet,1999,8,5
BEVL_VMM_531110,11023755,5.8.1999,Tubificidae,,2,,,121000005,Handnet,1999,8,5
BEVL_VMM_531110,1016060,27.04.2000,Anisus,,1,,,121000005,Handnet,2000,4,27
BEVL_VMM_531110,1016060,27.04.2000,Asellidae,,2,,,121000005,Handnet,2000,4,27
BEVL_VMM_531110,1016060,27.04.2000,Chironomidae non thummi-plumosus,,101,,,121000005,Handnet,2000,4,27
BEVL_VMM_531110,1016060,27.04.2000,Cloeon,,2,,,121000005,Handnet,2000,4,27
BEVL_VMM_531110,1016060,27.04.2000,Coenagrion,,11,,,121000005,Handnet,2000,4,27
BEVL_VMM_531110,1016060,27.04.2000,Erpobdella,,2,,,121000005,Handnet,2000,4,27
BEVL_VMM_531110,1016060,27.04.2000,Gammaridae,,11,,,121000005,Handnet,2000,4,27
BEVL_VMM_531110,1016060,27.04.2000,Glossiphonia,,11,,,121000005,Handnet,2000,4,27
BEVL_VMM_531110,1016060,27.04.2000,Helobdella,,1,,,121000005,Handnet,2000,4,27
BEVL_VMM_531110,1016060,27.04.2000,Hydracarina,,1,,,121000005,Handnet,2000,4,27
BEVL_VMM_531110,1016060,27.04.2000,Hydrophilidae,,1,,,121000005,Handnet,2000,4,27
BEVL_VMM_531110,1016060,27.04.2000,Ischnura,,11,,,121000005,Handnet,2000,4,27
BEVL_VMM_531110,1016060,27.04.2000,Limnephilidae,,11,,,121000005,Handnet,2000,4,27
BEVL_VMM_531110,1016060,27.04.2000,Lymnaea,,2,,,121000005,Handnet,2000,4,27
BEVL_VMM_531110,1016060,27.04.2000,Naididae,,11,,,121000005,Handnet,2000,4,27
BEVL_VMM_531110,1016060,27.04.2000,Pisidium,,2,,,121000005,Handnet,2000,4,27
BEVL_VMM_531110,1016060,27.04.2000,Psychodidae,,1,,,121000005,Handnet,2000,4,27
BEVL_VMM_531110,1016060,27.04.2000,Stratiomyidae,,2,,,121000005,Handnet,2000,4,27
BEVL_VMM_531110,1016060,27.04.2000,Tubificidae,,11,,,121000005,Handnet,2000,4,27
BEVL_VMM_531110,21060229,17.08.2001,Asellidae,,11,,,121000005,Handnet,2001,8,17
BEVL_VMM_531110,21060229,17.08.2001,Baetis,,101,,,121000005,Handnet,2001,8,17
BEVL_VMM_531110,21060229,17.08.2001,Chironomidae non thummi-plumosus,,51,,,121000005,Handnet,2001,8,17
BEVL_VMM_531110,21060229,17.08.2001,Chironomidae thummi-plumosus,,51,,,121000005,Handnet,2001,8,17
BEVL_VMM_531110,21060229,17.08.2001,Corixa,,1,,,121000005,Handnet,2001,8,17
BEVL_VMM_531110,21060229,17.08.2001,Culicidae,,1,,,121000005,Handnet,2001,8,17
BEVL_VMM_531110,21060229,17.08.2001,Dytiscidae,,2,,,121000005,Handnet,2001,8,17
BEVL_VMM_531110,21060229,17.08.2001,Ephydridae,,2,,,121000005,Handnet,2001,8,17
BEVL_VMM_531110,21060229,17.08.2001,Erpobdella,,2,,,121000005,Handnet,2001,8,17
BEVL_VMM_531110,21060229,17.08.2001,Gammaridae,,51,,,121000005,Handnet,2001,8,17
BEVL_VMM_531110,21060229,17.08.2001,Glossiphonia,,11,,,121000005,Handnet,2001,8,17
BEVL_VMM_531110,21060229,17.08.2001,Helobdella,,11,,,121000005,Handnet,2001,8,17
BEVL_VMM_531110,21060229,17.08.2001,Hesperocorixa,,2,,,121000005,Handnet,2001,8,17
BEVL_VMM_531110,21060229,17.08.2001,Ischnura,,1,,,121000005,Handnet,2001,8,17
BEVL_VMM_531110,21060229,17.08.2001,Lymnaea,,1,,,121000005,Handnet,2001,8,17
BEVL_VMM_531110,21060229,17.08.2001,Pisidium,,51,,,121000005,Handnet,2001,8,17
BEVL_VMM_531110,21060229,17.08.2001,Simuliidae,,2,,,121000005,Handnet,2001,8,17
BEVL_VMM_531110,21060229,17.08.2001,Theromyzon,,1,,,121000005,Handnet,2001,8,17
BEVL_VMM_531110,21060229,17.08.2001,Tubificidae,,101,,,121000005,Handnet,2001,8,17
BEVL_VMM_531110,21079779,9.4.2002,Anisus,,2,,,121000005,Handnet,2002,4,9
BEVL_VMM_531110,21079779,9.4.2002,Asellidae,,11,,,121000005,Handnet,2002,4,9
BEVL_VMM_531110,21079779,9.4.2002,Baetis,,11,,,121000005,Handnet,2002,4,9
BEVL_VMM_531110,21079779,9.4.2002,Chironomidae non thummi-plumosus,,51,,,121000005,Handnet,2002,4,9
BEVL_VMM_531110,21079779,9.4.2002,Coenagrion,,2,,,121000005,Handnet,2002,4,9
BEVL_VMM_531110,21079779,9.4.2002,Dytiscidae,,1,,,121000005,Handnet,2002,4,9
BEVL_VMM_531110,21079779,9.4.2002,Erpobdella,,11,,,121000005,Handnet,2002,4,9
BEVL_VMM_531110,21079779,9.4.2002,Gammaridae,,11,,,121000005,Handnet,2002,4,9
BEVL_VMM_531110,21079779,9.4.2002,Glossiphonia,,11,,,121000005,Handnet,2002,4,9
BEVL_VMM_531110,21079779,9.4.2002,Helobdella,,11,,,121000005,Handnet,2002,4,9
BEVL_VMM_531110,21079779,9.4.2002,Hydracarina,,1,,,121000005,Handnet,2002,4,9
BEVL_VMM_531110,21079779,9.4.2002,Hydropsychidae,,11,,,121000005,Handnet,2002,4,9
BEVL_VMM_531110,21079779,9.4.2002,Ischnura,,11,,,121000005,Handnet,2002,4,9
BEVL_VMM_531110,21079779,9.4.2002,Limnephilidae,,11,,,121000005,Handnet,2002,4,9
BEVL_VMM_531110,21079779,9.4.2002,Lymnaea,,2,,,121000005,Handnet,2002,4,9
BEVL_VMM_531110,21079779,9.4.2002,Naididae,,2,,,121000005,Handnet,2002,4,9
BEVL_VMM_531110,21079779,9.4.2002,Pisidium,,101,,,121000005,Handnet,2002,4,9
BEVL_VMM_531110,21079779,9.4.2002,Stratiomyidae,,2,,,121000005,Handnet,2002,4,9
BEVL_VMM_531110,21079779,9.4.2002,Tipulidae,,2,,,121000005,Handnet,2002,4,9
BEVL_VMM_531110,21079779,9.4.2002,Tubificidae,,51,,,121000005,Handnet,2002,4,9
BEVL_VMM_531110,21128849,18.07.2003,Anisus,,1,,,121000005,Handnet,2003,7,18
BEVL_VMM_531110,21128849,18.07.2003,Asellidae,,11,,,121000005,Handnet,2003,7,18
BEVL_VMM_531110,21128849,18.07.2003,Baetis,,2,,,121000005,Handnet,2003,7,18
BEVL_VMM_531110,21128849,18.07.2003,Bathyomphalus,,1,,,121000005,Handnet,2003,7,18
BEVL_VMM_531110,21128849,18.07.2003,Ceratopogonidae,,1,,,121000005,Handnet,2003,7,18
BEVL_VMM_531110,21128849,18.07.2003,Chironomidae non thummi-plumosus,,51,,,121000005,Handnet,2003,7,18
BEVL_VMM_531110,21128849,18.07.2003,Drie doornige stekelbaars,,2,,,121000005,Handnet,2003,7,18
BEVL_VMM_531110,21128849,18.07.2003,Dytiscidae,,11,,,121000005,Handnet,2003,7,18
BEVL_VMM_531110,21128849,18.07.2003,Erpobdella,,11,,,121000005,Handnet,2003,7,18
BEVL_VMM_531110,21128849,18.07.2003,Gammaridae,,101,,,121000005,Handnet,2003,7,18
BEVL_VMM_531110,21128849,18.07.2003,Glossiphonia,,11,,,121000005,Handnet,2003,7,18
BEVL_VMM_531110,21128849,18.07.2003,Haliplidae,,1,,,121000005,Handnet,2003,7,18
BEVL_VMM_531110,21128849,18.07.2003,Helobdella,,2,,,121000005,Handnet,2003,7,18
BEVL_VMM_531110,21128849,18.07.2003,Hesperocorixa,,2,,,121000005,Handnet,2003,7,18
BEVL_VMM_531110,21128849,18.07.2003,Hydraenidae,,1,,,121000005,Handnet,2003,7,18
BEVL_VMM_531110,21128849,18.07.2003,Hydrophilidae,,11,,,121000005,Handnet,2003,7,18
BEVL_VMM_531110,21128849,18.07.2003,Hydropsychidae,,11,,,121000005,Handnet,2003,7,18
BEVL_VMM_531110,21128849,18.07.2003,Hydroptilidae,,1,,,121000005,Handnet,2003,7,18
BEVL_VMM_531110,21128849,18.07.2003,Ischnura,,2,,,121000005,Handnet,2003,7,18
BEVL_VMM_531110,21128849,18.07.2003,Limnephilidae,,2,,,121000005,Handnet,2003,7,18
BEVL_VMM_531110,21128849,18.07.2003,Limoniidae,,1,,,121000005,Handnet,2003,7,18
BEVL_VMM_531110,21128849,18.07.2003,Lymnaea,,101,,,121000005,Handnet,2003,7,18
BEVL_VMM_531110,21128849,18.07.2003,Muscidae,,1,,,121000005,Handnet,2003,7,18
BEVL_VMM_531110,21128849,18.07.2003,Notonecta,,1,,,121000005,Handnet,2003,7,18
BEVL_VMM_531110,21128849,18.07.2003,Pisidium,,101,,,121000005,Handnet,2003,7,18
BEVL_VMM_531110,21128849,18.07.2003,Potamopyrgus,,11,,,121000005,Handnet,2003,7,18
BEVL_VMM_531110,21128849,18.07.2003,Psychodidae,,2,,,121000005,Handnet,2003,7,18
BEVL_VMM_531110,21128849,18.07.2003,tiendoornige stekelbaars,,2,,,121000005,Handnet,2003,7,18
BEVL_VMM_531110,21128849,18.07.2003,Tipulidae,,1,,,121000005,Handnet,2003,7,18
BEVL_VMM_531110,21128849,18.07.2003,Tubificidae,,11,,,121000005,Handnet,2003,7,18
BEVL_VMM_531110,21172047,19.07.2004,Asellidae,,11,,,121000005,Handnet,2004,7,19
BEVL_VMM_531110,21172047,19.07.2004,Baetis,,11,,,121000005,Handnet,2004,7,19
BEVL_VMM_531110,21172047,19.07.2004,Chironomidae non thummi-plumosus,,51,,,121000005,Handnet,2004,7,19
BEVL_VMM_531110,21172047,19.07.2004,Chironomidae thummi-plumosus,,2,,,121000005,Handnet,2004,7,19
BEVL_VMM_531110,21172047,19.07.2004,Dytiscidae,,2,,,121000005,Handnet,2004,7,19
BEVL_VMM_531110,21172047,19.07.2004,Erpobdella,,2,,,121000005,Handnet,2004,7,19
BEVL_VMM_531110,21172047,19.07.2004,Gammaridae,,11,,,121000005,Handnet,2004,7,19
BEVL_VMM_531110,21172047,19.07.2004,Glossiphonia,,11,,,121000005,Handnet,2004,7,19
BEVL_VMM_531110,21172047,19.07.2004,Haliplidae,,2,,,121000005,Handnet,2004,7,19
BEVL_VMM_531110,21172047,19.07.2004,Helobdella,,2,,,121000005,Handnet,2004,7,19
BEVL_VMM_531110,21172047,19.07.2004,Hesperocorixa,,2,,,121000005,Handnet,2004,7,19
BEVL_VMM_531110,21172047,19.07.2004,Hydraenidae,,2,,,121000005,Handnet,2004,7,19
BEVL_VMM_531110,21172047,19.07.2004,Hydrophilidae,,2,,,121000005,Handnet,2004,7,19
BEVL_VMM_531110,21172047,19.07.2004,Hydropsychidae,,11,,,121000005,Handnet,2004,7,19
BEVL_VMM_531110,21172047,19.07.2004,Ischnura,,11,,,121000005,Handnet,2004,7,19
BEVL_VMM_531110,21172047,19.07.2004,Lestes,,1,,,121000005,Handnet,2004,7,19
BEVL_VMM_531110,21172047,19.07.2004,Limnephilidae,,2,,,121000005,Handnet,2004,7,19
BEVL_VMM_531110,21172047,19.07.2004,Lymnaea,,101,,,121000005,Handnet,2004,7,19
BEVL_VMM_531110,21172047,19.07.2004,Pisidium,,51,,,121000005,Handnet,2004,7,19
BEVL_VMM_531110,21172047,19.07.2004,Psychodidae,,2,,,121000005,Handnet,2004,7,19
BEVL_VMM_531110,21172047,19.07.2004,Sialis,,1,,,121000005,Handnet,2004,7,19
BEVL_VMM_531110,21172047,19.07.2004,Simuliidae,,2,,,121000005,Handnet,2004,7,19
BEVL_VMM_531110,21172047,19.07.2004,Stratiomyidae,,1,,,121000005,Handnet,2004,7,19
BEVL_VMM_531110,21172047,19.07.2004,Theromyzon,,1,,,121000005,Handnet,2004,7,19
BEVL_VMM_531110,21172047,19.07.2004,Tubificidae,,101,,,121000005,Handnet,2004,7,19
BEVL_VMM_531110,21222646,14.07.2005,Aeshna,,1,,,121000005,Handnet,2005,7,14
BEVL_VMM_531110,21222646,14.07.2005,Asellidae,,30,,,121000005,Handnet,2005,7,14
BEVL_VMM_531110,21222646,14.07.2005,Baetis,,40,,,121000005,Handnet,2005,7,14
BEVL_VMM_531110,21222646,14.07.2005,Chironomidae non thummi-plumosus,,150,,,121000005,Handnet,2005,7,14
BEVL_VMM_531110,21222646,14.07.2005,Chironomidae thummi-plumosus,,3,,,121000005,Handnet,2005,7,14
BEVL_VMM_531110,21222646,14.07.2005,Dendrocoelum,,1,,,121000005,Handnet,2005,7,14
BEVL_VMM_531110,21222646,14.07.2005,Drie doornige stekelbaars,,70,,,121000005,Handnet,2005,7,14
BEVL_VMM_531110,21222646,14.07.2005,Dytiscidae,,2,,,121000005,Handnet,2005,7,14
BEVL_VMM_531110,21222646,14.07.2005,Erpobdella,,51,,,121000005,Handnet,2005,7,14
BEVL_VMM_531110,21222646,14.07.2005,Gammaridae,,15,,,121000005,Handnet,2005,7,14
BEVL_VMM_531110,21222646,14.07.2005,Glossiphonia,,24,,,121000005,Handnet,2005,7,14
BEVL_VMM_531110,21222646,14.07.2005,Haliplidae,,9,,,121000005,Handnet,2005,7,14
BEVL_VMM_531110,21222646,14.07.2005,Helobdella,,3,,,121000005,Handnet,2005,7,14
BEVL_VMM_531110,21222646,14.07.2005,Hemiclepsis,,1,,,121000005,Handnet,2005,7,14
BEVL_VMM_531110,21222646,14.07.2005,Hesperocorixa,,8,,,121000005,Handnet,2005,7,14
BEVL_VMM_531110,21222646,14.07.2005,Hydraenidae,,2,,,121000005,Handnet,2005,7,14
BEVL_VMM_531110,21222646,14.07.2005,Hydrophilidae,,1,,,121000005,Handnet,2005,7,14
BEVL_VMM_531110,21222646,14.07.2005,Hydropsychidae,,14,,,121000005,Handnet,2005,7,14
BEVL_VMM_531110,21222646,14.07.2005,Ischnura,,23,,,121000005,Handnet,2005,7,14
BEVL_VMM_531110,21222646,14.07.2005,Limnephilidae,,1,,,121000005,Handnet,2005,7,14
BEVL_VMM_531110,21222646,14.07.2005,Lymnaea,,19,,,121000005,Handnet,2005,7,14
BEVL_VMM_531110,21222646,14.07.2005,Pisidium,,35,,,121000005,Handnet,2005,7,14
BEVL_VMM_531110,21222646,14.07.2005,Sigara,,4,,,121000005,Handnet,2005,7,14
BEVL_VMM_531110,21222646,14.07.2005,Theromyzon,,51,,,121000005,Handnet,2005,7,14
BEVL_VMM_531110,21222646,14.07.2005,Tubificidae,,50,,,121000005,Handnet,2005,7,14
BEVL_VMM_531110,21336970,4.9.2007,Asellidae,,50,,,121000005,Handnet,2007,9,4
BEVL_VMM_531110,21336970,4.9.2007,Chironomidae non thummi-plumosus,,30,,,121000005,Handnet,2007,9,4
BEVL_VMM_531110,21336970,4.9.2007,Chironomidae thummi-plumosus,,4,,,121000005,Handnet,2007,9,4
BEVL_VMM_531110,21336970,4.9.2007,Drie doornige stekelbaars,,6,,,121000005,Handnet,2007,9,4
BEVL_VMM_531110,21336970,4.9.2007,Dytiscidae,,30,,,121000005,Handnet,2007,9,4
BEVL_VMM_531110,21336970,4.9.2007,Erpobdella,,40,,,121000005,Handnet,2007,9,4
BEVL_VMM_531110,21336970,4.9.2007,Gammaridae,,50,,,121000005,Handnet,2007,9,4
BEVL_VMM_531110,21336970,4.9.2007,Gerris,,1,,,121000005,Handnet,2007,9,4
BEVL_VMM_531110,21336970,4.9.2007,Glossiphonia,,15,,,121000005,Handnet,2007,9,4
BEVL_VMM_531110,21336970,4.9.2007,Haliplidae,,4,,,121000005,Handnet,2007,9,4
BEVL_VMM_531110,21336970,4.9.2007,Helobdella,,4,,,121000005,Handnet,2007,9,4
BEVL_VMM_531110,21336970,4.9.2007,Hesperocorixa,,7,,,121000005,Handnet,2007,9,4
BEVL_VMM_531110,21336970,4.9.2007,Hydrophilidae,,1,,,121000005,Handnet,2007,9,4
BEVL_VMM_531110,21336970,4.9.2007,Hydropsychidae,,13,,,121000005,Handnet,2007,9,4
BEVL_VMM_531110,21336970,4.9.2007,Ischnura,,11,,,121000005,Handnet,2007,9,4
BEVL_VMM_531110,21336970,4.9.2007,Lymnaea,,30,,,121000005,Handnet,2007,9,4
BEVL_VMM_531110,21336970,4.9.2007,Notonecta,,3,,,121000005,Handnet,2007,9,4
BEVL_VMM_531110,21336970,4.9.2007,Pisidium,,40,,,121000005,Handnet,2007,9,4
BEVL_VMM_531110,21336970,4.9.2007,Simuliidae,,2,,,121000005,Handnet,2007,9,4
BEVL_VMM_531110,21336970,4.9.2007,Theromyzon,,2,,,121000005,Handnet,2007,9,4
BEVL_VMM_531110,21336970,4.9.2007,Tubificidae,,25,,,121000005,Handnet,2007,9,4
BEVL_VMM_531110,21437515,20.08.2009,Asellidae,,1,,,121000005,Handnet,2009,8,20
BEVL_VMM_531110,21437515,20.08.2009,Chironomidae non thummi-plumosus,,40,,,121000005,Handnet,2009,8,20
BEVL_VMM_531110,21437515,20.08.2009,Chironomidae thummi-plumosus,,7,,,121000005,Handnet,2009,8,20
BEVL_VMM_531110,21437515,20.08.2009,Cloeon,,1,,,121000005,Handnet,2009,8,20
BEVL_VMM_531110,21437515,20.08.2009,Dytiscidae,,3,,,121000005,Handnet,2009,8,20
BEVL_VMM_531110,21437515,20.08.2009,Erpobdella,,7,,,121000005,Handnet,2009,8,20
BEVL_VMM_531110,21437515,20.08.2009,Gammaridae,,20,,,121000005,Handnet,2009,8,20
BEVL_VMM_531110,21437515,20.08.2009,Glossiphonia,,2,,,121000005,Handnet,2009,8,20
BEVL_VMM_531110,21437515,20.08.2009,Helobdella,,2,,,121000005,Handnet,2009,8,20
BEVL_VMM_531110,21437515,20.08.2009,Hesperocorixa,,2,,,121000005,Handnet,2009,8,20
BEVL_VMM_531110,21437515,20.08.2009,Hippeutis,,2,,,121000005,Handnet,2009,8,20
BEVL_VMM_531110,21437515,20.08.2009,Hydracarina,,3,,,121000005,Handnet,2009,8,20
BEVL_VMM_531110,21437515,20.08.2009,Lymnaea,,11,,,121000005,Handnet,2009,8,20
BEVL_VMM_531110,21437515,20.08.2009,Pisidium,,12,,,121000005,Handnet,2009,8,20
BEVL_VMM_531110,21437515,20.08.2009,Psychodidae,,1,,,121000005,Handnet,2009,8,20
BEVL_VMM_531110,21437515,20.08.2009,Sigara,,2,,,121000005,Handnet,2009,8,20
BEVL_VMM_531110,21437515,20.08.2009,Theromyzon,,7,,,121000005,Handnet,2009,8,20
BEVL_VMM_531110,21437515,20.08.2009,Tipulidae,,1,,,121000005,Handnet,2009,8,20
BEVL_VMM_531110,21437515,20.08.2009,Tubificidae,,50,,,121000005,Handnet,2009,8,20
BEVL_VMM_531110,21437515,20.08.2009,Valvata,,2,,,121000005,Handnet,2009,8,20
BEVL_VMM_531110,21437515,20.08.2009,Vis,,3,,,121000005,Handnet,2009,8,20
BEVL_VMM_531110,21483049,9.7.2010,Asellidae,,7,,,121000005,Handnet,2010,7,9
BEVL_VMM_531110,21483049,9.7.2010,Chironomidae non thummi-plumosus,,30,,,121000005,Handnet,2010,7,9
BEVL_VMM_531110,21483049,9.7.2010,Chironomidae thummi-plumosus,,5,,,121000005,Handnet,2010,7,9
BEVL_VMM_531110,21483049,9.7.2010,Dytiscidae,,4,,,121000005,Handnet,2010,7,9
BEVL_VMM_531110,21483049,9.7.2010,Erpobdella,,4,,,121000005,Handnet,2010,7,9
BEVL_VMM_531110,21483049,9.7.2010,Gammaridae,,100,,,121000005,Handnet,2010,7,9
BEVL_VMM_531110,21483049,9.7.2010,Gerris,,2,,,121000005,Handnet,2010,7,9
BEVL_VMM_531110,21483049,9.7.2010,Glossiphonia,,10,,,121000005,Handnet,2010,7,9
BEVL_VMM_531110,21483049,9.7.2010,Haliplidae,,1,,,121000005,Handnet,2010,7,9
BEVL_VMM_531110,21483049,9.7.2010,Helobdella,,3,,,121000005,Handnet,2010,7,9
BEVL_VMM_531110,21483049,9.7.2010,Hesperocorixa,,3,,,121000005,Handnet,2010,7,9
BEVL_VMM_531110,21483049,9.7.2010,Hydracarina,,15,,,121000005,Handnet,2010,7,9
BEVL_VMM_531110,21483049,9.7.2010,Hydrophilidae,,30,,,121000005,Handnet,2010,7,9
BEVL_VMM_531110,21483049,9.7.2010,Ischnura,,4,,,121000005,Handnet,2010,7,9
BEVL_VMM_531110,21483049,9.7.2010,Lestes,,3,,,121000005,Handnet,2010,7,9
BEVL_VMM_531110,21483049,9.7.2010,Limnephilidae,,2,,,121000005,Handnet,2010,7,9
BEVL_VMM_531110,21483049,9.7.2010,Lymnaea,,80,,,121000005,Handnet,2010,7,9
BEVL_VMM_531110,21483049,9.7.2010,Naididae,,2,,,121000005,Handnet,2010,7,9
BEVL_VMM_531110,21483049,9.7.2010,Notonecta,,2,,,121000005,Handnet,2010,7,9
BEVL_VMM_531110,21483049,9.7.2010,Pisidium,,8,,,121000005,Handnet,2010,7,9
BEVL_VMM_531110,21483049,9.7.2010,Polycelis,,1,,,121000005,Handnet,2010,7,9
BEVL_VMM_531110,21483049,9.7.2010,Psychodidae,,2,,,121000005,Handnet,2010,7,9
BEVL_VMM_531110,21483049,9.7.2010,Sigara,,2,,,121000005,Handnet,2010,7,9
BEVL_VMM_531110,21483049,9.7.2010,Tubificidae,,20,,,121000005,Handnet,2010,7,9
BEVL_VMM_531110,21483049,9.7.2010,Velia,,1,,,121000005,Handnet,2010,7,9
BEVL_VMM_531110,21607000,23.04.2013,Asellidae,,20,,,121000005,Handnet,2013,4,23
BEVL_VMM_531110,21607000,23.04.2013,Baetis,,4,,,121000005,Handnet,2013,4,23
BEVL_VMM_531110,21607000,23.04.2013,Ceratopogonidae,,2,,,121000005,Handnet,2013,4,23
BEVL_VMM_531110,21607000,23.04.2013,Chironomidae non thummi-plumosus,,150,,,121000005,Handnet,2013,4,23
BEVL_VMM_531110,21607000,23.04.2013,Dytiscidae,,2,,,121000005,Handnet,2013,4,23
BEVL_VMM_531110,21607000,23.04.2013,Erpobdella,,2,,,121000005,Handnet,2013,4,23
BEVL_VMM_531110,21607000,23.04.2013,Gammaridae,,20,,,121000005,Handnet,2013,4,23
BEVL_VMM_531110,21607000,23.04.2013,Glossiphonia,,15,,,121000005,Handnet,2013,4,23
BEVL_VMM_531110,21607000,23.04.2013,Helobdella,,5,,,121000005,Handnet,2013,4,23
BEVL_VMM_531110,21607000,23.04.2013,Hemiclepsis,,1,,,121000005,Handnet,2013,4,23
BEVL_VMM_531110,21607000,23.04.2013,Ilyocoris,,1,,,121000005,Handnet,2013,4,23
BEVL_VMM_531110,21607000,23.04.2013,Limnephilidae,,2,,,121000005,Handnet,2013,4,23
BEVL_VMM_531110,21607000,23.04.2013,Lymnaea,,15,,,121000005,Handnet,2013,4,23
BEVL_VMM_531110,21607000,23.04.2013,Naididae,,2,,,121000005,Handnet,2013,4,23
BEVL_VMM_531110,21607000,23.04.2013,Pisidium,,50,,,121000005,Handnet,2013,4,23
BEVL_VMM_531110,21607000,23.04.2013,Sigara,,1,,,121000005,Handnet,2013,4,23
BEVL_VMM_531110,21607000,23.04.2013,Simuliidae,,2,,,121000005,Handnet,2013,4,23
BEVL_VMM_531110,21607000,23.04.2013,Theromyzon,,2,,,121000005,Handnet,2013,4,23
BEVL_VMM_531110,21607000,23.04.2013,Tubificidae,,80,,,121000005,Handnet,2013,4,23
BEVL_VMM_531110,21607000,23.04.2013,Valvata,,6,,,121000005,Handnet,2013,4,23
BEVL_VMM_531110,21732150,31.08.2016,Asellidae,,50,,,121000005,Handnet,2016,8,31
BEVL_VMM_531110,21732150,31.08.2016,Baetis,,15,,,121000005,Handnet,2016,8,31
BEVL_VMM_531110,21732150,31.08.2016,Chironomidae non thummi-plumosus,,60,,,121000005,Handnet,2016,8,31
BEVL_VMM_531110,21732150,31.08.2016,Chironomidae thummi-plumosus,,20,,,121000005,Handnet,2016,8,31
BEVL_VMM_531110,21732150,31.08.2016,Cloeon,,3,,,121000005,Handnet,2016,8,31
BEVL_VMM_531110,21732150,31.08.2016,Dendrocoelum,,1,,,121000005,Handnet,2016,8,31
BEVL_VMM_531110,21732150,31.08.2016,Dytiscidae,,16,,,121000005,Handnet,2016,8,31
BEVL_VMM_531110,21732150,31.08.2016,Erpobdella,,20,,,121000005,Handnet,2016,8,31
