Site.ID,Sample.ID,Sampling.date,Taxon.name,Taxon.ID,Abundance,Definition.of.abundance.class,Abundance.class,Site_ID_Ellen,sampling.method,year,month,day
BEVL_VMM_757000,254786,1.6.1989,Asellidae,NA,11,NA,NA,121000003,Handnet,1989,6,1
BEVL_VMM_757000,254786,1.6.1989,Chironomidae non thummi-plumosus,NA,1,NA,NA,121000003,Handnet,1989,6,1
BEVL_VMM_757000,254786,1.6.1989,Chironomidae thummi-plumosus,NA,11,NA,NA,121000003,Handnet,1989,6,1
BEVL_VMM_757000,254786,1.6.1989,Haliplidae,NA,2,NA,NA,121000003,Handnet,1989,6,1
BEVL_VMM_757000,254786,1.6.1989,Helobdella,NA,11,NA,NA,121000003,Handnet,1989,6,1
BEVL_VMM_757000,254786,1.6.1989,Naididae,NA,2,NA,NA,121000003,Handnet,1989,6,1
BEVL_VMM_757000,254786,1.6.1989,Psychodidae,NA,2,NA,NA,121000003,Handnet,1989,6,1
BEVL_VMM_757000,254786,1.6.1989,Ptychopteridae,NA,1,NA,NA,121000003,Handnet,1989,6,1
BEVL_VMM_757000,254786,1.6.1989,Sigara,NA,2,NA,NA,121000003,Handnet,1989,6,1
BEVL_VMM_757000,254786,1.6.1989,Tipulidae,NA,1,NA,NA,121000003,Handnet,1989,6,1
BEVL_VMM_757000,254786,1.6.1989,Tubificidae,NA,11,NA,NA,121000003,Handnet,1989,6,1
BEVL_VMM_757000,254788,7.6.1993,Asellidae,NA,11,NA,NA,121000003,Handnet,1993,6,7
BEVL_VMM_757000,254788,7.6.1993,Chironomidae non thummi-plumosus,NA,101,NA,NA,121000003,Handnet,1993,6,7
BEVL_VMM_757000,254788,7.6.1993,Chironomidae thummi-plumosus,NA,101,NA,NA,121000003,Handnet,1993,6,7
BEVL_VMM_757000,254788,7.6.1993,Dytiscidae,NA,1,NA,NA,121000003,Handnet,1993,6,7
BEVL_VMM_757000,254788,7.6.1993,Helobdella,NA,2,NA,NA,121000003,Handnet,1993,6,7
BEVL_VMM_757000,254788,7.6.1993,Hydraenidae,NA,2,NA,NA,121000003,Handnet,1993,6,7
BEVL_VMM_757000,254788,7.6.1993,Limoniidae,NA,2,NA,NA,121000003,Handnet,1993,6,7
BEVL_VMM_757000,254788,7.6.1993,Lymnaea,NA,1,NA,NA,121000003,Handnet,1993,6,7
BEVL_VMM_757000,254788,7.6.1993,Nematoda,NA,1,NA,NA,121000003,Handnet,1993,6,7
BEVL_VMM_757000,254788,7.6.1993,Ostracoda,NA,2,NA,NA,121000003,Handnet,1993,6,7
BEVL_VMM_757000,254788,7.6.1993,Sialis,NA,1,NA,NA,121000003,Handnet,1993,6,7
BEVL_VMM_757000,254788,7.6.1993,Sigara,NA,2,NA,NA,121000003,Handnet,1993,6,7
BEVL_VMM_757000,254788,7.6.1993,Tubificidae,NA,101,NA,NA,121000003,Handnet,1993,6,7
BEVL_VMM_757000,996637,3.6.1998,Asellidae,NA,11,NA,NA,121000003,Handnet,1998,6,3
BEVL_VMM_757000,996637,3.6.1998,Chironomidae non thummi-plumosus,NA,11,NA,NA,121000003,Handnet,1998,6,3
BEVL_VMM_757000,996637,3.6.1998,Chironomidae thummi-plumosus,NA,2,NA,NA,121000003,Handnet,1998,6,3
BEVL_VMM_757000,996637,3.6.1998,Copepoda,NA,2,NA,NA,121000003,Handnet,1998,6,3
BEVL_VMM_757000,996637,3.6.1998,Elminthidae,NA,2,NA,NA,121000003,Handnet,1998,6,3
BEVL_VMM_757000,996637,3.6.1998,Gammaridae,NA,1,NA,NA,121000003,Handnet,1998,6,3
BEVL_VMM_757000,996637,3.6.1998,Helobdella,NA,1,NA,NA,121000003,Handnet,1998,6,3
BEVL_VMM_757000,996637,3.6.1998,Hydrophilidae,NA,11,NA,NA,121000003,Handnet,1998,6,3
BEVL_VMM_757000,996637,3.6.1998,Ischnura,NA,1,NA,NA,121000003,Handnet,1998,6,3
BEVL_VMM_757000,996637,3.6.1998,Limoniidae,NA,1,NA,NA,121000003,Handnet,1998,6,3
BEVL_VMM_757000,996637,3.6.1998,Lymnaea,NA,11,NA,NA,121000003,Handnet,1998,6,3
BEVL_VMM_757000,996637,3.6.1998,Naididae,NA,101,NA,NA,121000003,Handnet,1998,6,3
BEVL_VMM_757000,996637,3.6.1998,Ostracoda,NA,1,NA,NA,121000003,Handnet,1998,6,3
BEVL_VMM_757000,996637,3.6.1998,Physa,NA,2,NA,NA,121000003,Handnet,1998,6,3
BEVL_VMM_757000,996637,3.6.1998,Pisidium,NA,11,NA,NA,121000003,Handnet,1998,6,3
BEVL_VMM_757000,996637,3.6.1998,Sigara,NA,2,NA,NA,121000003,Handnet,1998,6,3
BEVL_VMM_757000,996637,3.6.1998,Sphaerium,NA,2,NA,NA,121000003,Handnet,1998,6,3
BEVL_VMM_757000,21026365,26.07.2000,Anisus,NA,2,NA,NA,121000003,Handnet,2000,7,26
BEVL_VMM_757000,21026365,26.07.2000,Bathyomphalus,NA,1,NA,NA,121000003,Handnet,2000,7,26
BEVL_VMM_757000,21026365,26.07.2000,Ceratopogonidae,NA,1,NA,NA,121000003,Handnet,2000,7,26
BEVL_VMM_757000,21026365,26.07.2000,Chironomidae non thummi-plumosus,NA,51,NA,NA,121000003,Handnet,2000,7,26
BEVL_VMM_757000,21026365,26.07.2000,Chironomidae thummi-plumosus,NA,2,NA,NA,121000003,Handnet,2000,7,26
BEVL_VMM_757000,21026365,26.07.2000,Cloeon,NA,2,NA,NA,121000003,Handnet,2000,7,26
BEVL_VMM_757000,21026365,26.07.2000,Dytiscidae,NA,2,NA,NA,121000003,Handnet,2000,7,26
BEVL_VMM_757000,21026365,26.07.2000,Erpobdella,NA,2,NA,NA,121000003,Handnet,2000,7,26
BEVL_VMM_757000,21026365,26.07.2000,Glossiphonia,NA,11,NA,NA,121000003,Handnet,2000,7,26
BEVL_VMM_757000,21026365,26.07.2000,Gyraulus,NA,11,NA,NA,121000003,Handnet,2000,7,26
BEVL_VMM_757000,21026365,26.07.2000,Helobdella,NA,2,NA,NA,121000003,Handnet,2000,7,26
BEVL_VMM_757000,21026365,26.07.2000,Hesperocorixa,NA,2,NA,NA,121000003,Handnet,2000,7,26
BEVL_VMM_757000,21026365,26.07.2000,Hydrophilidae,NA,2,NA,NA,121000003,Handnet,2000,7,26
BEVL_VMM_757000,21026365,26.07.2000,Limoniidae,NA,2,NA,NA,121000003,Handnet,2000,7,26
BEVL_VMM_757000,21026365,26.07.2000,Lymnaea,NA,2,NA,NA,121000003,Handnet,2000,7,26
BEVL_VMM_757000,21026365,26.07.2000,Naididae,NA,2,NA,NA,121000003,Handnet,2000,7,26
BEVL_VMM_757000,21026365,26.07.2000,Physa,NA,1,NA,NA,121000003,Handnet,2000,7,26
BEVL_VMM_757000,21026365,26.07.2000,Pisidium,NA,2,NA,NA,121000003,Handnet,2000,7,26
BEVL_VMM_757000,21026365,26.07.2000,Sigara,NA,2,NA,NA,121000003,Handnet,2000,7,26
BEVL_VMM_757000,21026365,26.07.2000,Sphaerium,NA,2,NA,NA,121000003,Handnet,2000,7,26
BEVL_VMM_757000,21026365,26.07.2000,Theromyzon,NA,2,NA,NA,121000003,Handnet,2000,7,26
BEVL_VMM_757000,21026365,26.07.2000,Tipulidae,NA,1,NA,NA,121000003,Handnet,2000,7,26
BEVL_VMM_757000,21026365,26.07.2000,Tubificidae,NA,11,NA,NA,121000003,Handnet,2000,7,26
BEVL_VMM_757000,21026365,26.07.2000,Valvata,NA,2,NA,NA,121000003,Handnet,2000,7,26
BEVL_VMM_757000,21086817,19.06.2002,Anisus,NA,11,NA,NA,121000003,Handnet,2002,6,19
BEVL_VMM_757000,21086817,19.06.2002,Asellidae,NA,11,NA,NA,121000003,Handnet,2002,6,19
BEVL_VMM_757000,21086817,19.06.2002,Bathyomphalus,NA,2,NA,NA,121000003,Handnet,2002,6,19
BEVL_VMM_757000,21086817,19.06.2002,Chironomidae non thummi-plumosus,NA,51,NA,NA,121000003,Handnet,2002,6,19
BEVL_VMM_757000,21086817,19.06.2002,Chironomidae thummi-plumosus,NA,11,NA,NA,121000003,Handnet,2002,6,19
BEVL_VMM_757000,21086817,19.06.2002,Dendrocoelum,NA,2,NA,NA,121000003,Handnet,2002,6,19
BEVL_VMM_757000,21086817,19.06.2002,Empididae,NA,2,NA,NA,121000003,Handnet,2002,6,19
BEVL_VMM_757000,21086817,19.06.2002,Erpobdella,NA,11,NA,NA,121000003,Handnet,2002,6,19
BEVL_VMM_757000,21086817,19.06.2002,Glossiphonia,NA,11,NA,NA,121000003,Handnet,2002,6,19
BEVL_VMM_757000,21086817,19.06.2002,Gyraulus,NA,2,NA,NA,121000003,Handnet,2002,6,19
BEVL_VMM_757000,21086817,19.06.2002,Helobdella,NA,11,NA,NA,121000003,Handnet,2002,6,19
BEVL_VMM_757000,21086817,19.06.2002,Ischnura,NA,2,NA,NA,121000003,Handnet,2002,6,19
BEVL_VMM_757000,21086817,19.06.2002,Lymnaea,NA,2,NA,NA,121000003,Handnet,2002,6,19
BEVL_VMM_757000,21086817,19.06.2002,Muscidae,NA,2,NA,NA,121000003,Handnet,2002,6,19
BEVL_VMM_757000,21086817,19.06.2002,Naididae,NA,11,NA,NA,121000003,Handnet,2002,6,19
BEVL_VMM_757000,21086817,19.06.2002,Pisidium,NA,51,NA,NA,121000003,Handnet,2002,6,19
BEVL_VMM_757000,21086817,19.06.2002,Planorbarius,NA,1,NA,NA,121000003,Handnet,2002,6,19
BEVL_VMM_757000,21086817,19.06.2002,Polycelis,NA,1,NA,NA,121000003,Handnet,2002,6,19
BEVL_VMM_757000,21086817,19.06.2002,Sialis,NA,2,NA,NA,121000003,Handnet,2002,6,19
BEVL_VMM_757000,21086817,19.06.2002,Simuliidae,NA,11,NA,NA,121000003,Handnet,2002,6,19
BEVL_VMM_757000,21086817,19.06.2002,Sphaerium,NA,51,NA,NA,121000003,Handnet,2002,6,19
BEVL_VMM_757000,21086817,19.06.2002,Theromyzon,NA,2,NA,NA,121000003,Handnet,2002,6,19
BEVL_VMM_757000,21086817,19.06.2002,Tipulidae,NA,1,NA,NA,121000003,Handnet,2002,6,19
BEVL_VMM_757000,21086817,19.06.2002,Tubificidae,NA,51,NA,NA,121000003,Handnet,2002,6,19
BEVL_VMM_757000,21126766,7.7.2003,Anisus,NA,1,NA,NA,121000003,Handnet,2003,7,7
BEVL_VMM_757000,21126766,7.7.2003,Asellidae,NA,11,NA,NA,121000003,Handnet,2003,7,7
BEVL_VMM_757000,21126766,7.7.2003,Chironomidae non thummi-plumosus,NA,11,NA,NA,121000003,Handnet,2003,7,7
BEVL_VMM_757000,21126766,7.7.2003,Chironomidae thummi-plumosus,NA,11,NA,NA,121000003,Handnet,2003,7,7
BEVL_VMM_757000,21126766,7.7.2003,Drie doornige stekelbaars,NA,2,NA,NA,121000003,Handnet,2003,7,7
BEVL_VMM_757000,21126766,7.7.2003,Dytiscidae,NA,2,NA,NA,121000003,Handnet,2003,7,7
BEVL_VMM_757000,21126766,7.7.2003,Erpobdella,NA,2,NA,NA,121000003,Handnet,2003,7,7
BEVL_VMM_757000,21126766,7.7.2003,Glossiphonia,NA,11,NA,NA,121000003,Handnet,2003,7,7
BEVL_VMM_757000,21126766,7.7.2003,Gyraulus,NA,11,NA,NA,121000003,Handnet,2003,7,7
BEVL_VMM_757000,21126766,7.7.2003,Haemopis,NA,1,NA,NA,121000003,Handnet,2003,7,7
BEVL_VMM_757000,21126766,7.7.2003,Helobdella,NA,11,NA,NA,121000003,Handnet,2003,7,7
BEVL_VMM_757000,21126766,7.7.2003,Hesperocorixa,NA,2,NA,NA,121000003,Handnet,2003,7,7
BEVL_VMM_757000,21126766,7.7.2003,Hydrophilidae,NA,11,NA,NA,121000003,Handnet,2003,7,7
BEVL_VMM_757000,21126766,7.7.2003,Ischnura,NA,1,NA,NA,121000003,Handnet,2003,7,7
BEVL_VMM_757000,21126766,7.7.2003,Lymnaea,NA,11,NA,NA,121000003,Handnet,2003,7,7
BEVL_VMM_757000,21126766,7.7.2003,Naididae,NA,101,NA,NA,121000003,Handnet,2003,7,7
BEVL_VMM_757000,21126766,7.7.2003,Nepa,NA,2,NA,NA,121000003,Handnet,2003,7,7
BEVL_VMM_757000,21126766,7.7.2003,Pisidium,NA,11,NA,NA,121000003,Handnet,2003,7,7
BEVL_VMM_757000,21126766,7.7.2003,Planorbarius,NA,2,NA,NA,121000003,Handnet,2003,7,7
BEVL_VMM_757000,21126766,7.7.2003,Polycelis,NA,1,NA,NA,121000003,Handnet,2003,7,7
BEVL_VMM_757000,21126766,7.7.2003,Sigara,NA,2,NA,NA,121000003,Handnet,2003,7,7
BEVL_VMM_757000,21126766,7.7.2003,Sphaerium,NA,2,NA,NA,121000003,Handnet,2003,7,7
BEVL_VMM_757000,21126766,7.7.2003,Theromyzon,NA,2,NA,NA,121000003,Handnet,2003,7,7
BEVL_VMM_757000,21126766,7.7.2003,tiendoornige stekelbaars,NA,2,NA,NA,121000003,Handnet,2003,7,7
BEVL_VMM_757000,21126766,7.7.2003,Tubificidae,NA,11,NA,NA,121000003,Handnet,2003,7,7
BEVL_VMM_757000,21126766,7.7.2003,Valvata,NA,1,NA,NA,121000003,Handnet,2003,7,7
BEVL_VMM_757000,21171885,15.07.2004,Asellidae,NA,11,NA,NA,121000003,Handnet,2004,7,15
BEVL_VMM_757000,21171885,15.07.2004,Chironomidae non thummi-plumosus,NA,51,NA,NA,121000003,Handnet,2004,7,15
BEVL_VMM_757000,21171885,15.07.2004,Chironomidae thummi-plumosus,NA,11,NA,NA,121000003,Handnet,2004,7,15
BEVL_VMM_757000,21171885,15.07.2004,Dendrocoelum,NA,1,NA,NA,121000003,Handnet,2004,7,15
BEVL_VMM_757000,21171885,15.07.2004,Drie doornige stekelbaars,NA,11,NA,NA,121000003,Handnet,2004,7,15
BEVL_VMM_757000,21171885,15.07.2004,Dytiscidae,NA,3,NA,NA,121000003,Handnet,2004,7,15
BEVL_VMM_757000,21171885,15.07.2004,Empididae,NA,1,NA,NA,121000003,Handnet,2004,7,15
BEVL_VMM_757000,21171885,15.07.2004,Erpobdella,NA,11,NA,NA,121000003,Handnet,2004,7,15
BEVL_VMM_757000,21171885,15.07.2004,Glossiphonia,NA,11,NA,NA,121000003,Handnet,2004,7,15
BEVL_VMM_757000,21171885,15.07.2004,Gyraulus,NA,3,NA,NA,121000003,Handnet,2004,7,15
BEVL_VMM_757000,21171885,15.07.2004,Helobdella,NA,11,NA,NA,121000003,Handnet,2004,7,15
BEVL_VMM_757000,21171885,15.07.2004,Hydrophilidae,NA,11,NA,NA,121000003,Handnet,2004,7,15
BEVL_VMM_757000,21171885,15.07.2004,Ischnura,NA,1,NA,NA,121000003,Handnet,2004,7,15
BEVL_VMM_757000,21171885,15.07.2004,Lymnaea,NA,9,NA,NA,121000003,Handnet,2004,7,15
BEVL_VMM_757000,21171885,15.07.2004,Muscidae,NA,2,NA,NA,121000003,Handnet,2004,7,15
BEVL_VMM_757000,21171885,15.07.2004,Naididae,NA,3,NA,NA,121000003,Handnet,2004,7,15
BEVL_VMM_757000,21171885,15.07.2004,Nepa,NA,2,NA,NA,121000003,Handnet,2004,7,15
BEVL_VMM_757000,21171885,15.07.2004,Pisidium,NA,11,NA,NA,121000003,Handnet,2004,7,15
BEVL_VMM_757000,21171885,15.07.2004,Planorbarius,NA,1,NA,NA,121000003,Handnet,2004,7,15
BEVL_VMM_757000,21171885,15.07.2004,Sigara,NA,11,NA,NA,121000003,Handnet,2004,7,15
BEVL_VMM_757000,21171885,15.07.2004,Sphaerium,NA,6,NA,NA,121000003,Handnet,2004,7,15
BEVL_VMM_757000,21171885,15.07.2004,Stratiomyidae,NA,1,NA,NA,121000003,Handnet,2004,7,15
BEVL_VMM_757000,21171885,15.07.2004,Tipulidae,NA,1,NA,NA,121000003,Handnet,2004,7,15
BEVL_VMM_757000,21171885,15.07.2004,Tubificidae,NA,51,NA,NA,121000003,Handnet,2004,7,15
BEVL_VMM_757000,21528178,3.6.2011,Anisus,NA,1,NA,NA,121000003,Handnet,2011,6,3
BEVL_VMM_757000,21528178,3.6.2011,Asellidae,NA,30,NA,NA,121000003,Handnet,2011,6,3
BEVL_VMM_757000,21528178,3.6.2011,Ceratopogonidae,NA,1,NA,NA,121000003,Handnet,2011,6,3
BEVL_VMM_757000,21528178,3.6.2011,Chironomidae non thummi-plumosus,NA,150,NA,NA,121000003,Handnet,2011,6,3
BEVL_VMM_757000,21528178,3.6.2011,Chironomidae thummi-plumosus,NA,150,NA,NA,121000003,Handnet,2011,6,3
BEVL_VMM_757000,21528178,3.6.2011,Dendrocoelum,NA,1,NA,NA,121000003,Handnet,2011,6,3
BEVL_VMM_757000,21528178,3.6.2011,Dytiscidae,NA,6,NA,NA,121000003,Handnet,2011,6,3
BEVL_VMM_757000,21528178,3.6.2011,Erpobdella,NA,3,NA,NA,121000003,Handnet,2011,6,3
BEVL_VMM_757000,21528178,3.6.2011,Glossiphonia,NA,20,NA,NA,121000003,Handnet,2011,6,3
BEVL_VMM_757000,21528178,3.6.2011,Gyraulus,NA,7,NA,NA,121000003,Handnet,2011,6,3
BEVL_VMM_757000,21528178,3.6.2011,Helobdella,NA,25,NA,NA,121000003,Handnet,2011,6,3
BEVL_VMM_757000,21528178,3.6.2011,Hydrophilidae,NA,60,NA,NA,121000003,Handnet,2011,6,3
BEVL_VMM_757000,21528178,3.6.2011,Ischnura,NA,11,NA,NA,121000003,Handnet,2011,6,3
BEVL_VMM_757000,21528178,3.6.2011,Lymnaea,NA,8,NA,NA,121000003,Handnet,2011,6,3
BEVL_VMM_757000,21528178,3.6.2011,Naididae,NA,5,NA,NA,121000003,Handnet,2011,6,3
BEVL_VMM_757000,21528178,3.6.2011,Nepa,NA,1,NA,NA,121000003,Handnet,2011,6,3
BEVL_VMM_757000,21528178,3.6.2011,Pisidium,NA,25,NA,NA,121000003,Handnet,2011,6,3
BEVL_VMM_757000,21528178,3.6.2011,Planorbarius,NA,1,NA,NA,121000003,Handnet,2011,6,3
BEVL_VMM_757000,21528178,3.6.2011,Polycelis,NA,1,NA,NA,121000003,Handnet,2011,6,3
BEVL_VMM_757000,21528178,3.6.2011,Potamopyrgus,NA,10,NA,NA,121000003,Handnet,2011,6,3
BEVL_VMM_757000,21528178,3.6.2011,Sialis,NA,25,NA,NA,121000003,Handnet,2011,6,3
BEVL_VMM_757000,21528178,3.6.2011,Sigara,NA,15,NA,NA,121000003,Handnet,2011,6,3
BEVL_VMM_757000,21528178,3.6.2011,Sphaerium,NA,15,NA,NA,121000003,Handnet,2011,6,3
BEVL_VMM_757000,21528178,3.6.2011,Theromyzon,NA,1,NA,NA,121000003,Handnet,2011,6,3
BEVL_VMM_757000,21528178,3.6.2011,Tubificidae,NA,200,NA,NA,121000003,Handnet,2011,6,3
BEVL_VMM_757000,21528178,3.6.2011,Valvata,NA,50,NA,NA,121000003,Handnet,2011,6,3
BEVL_VMM_757000,21655510,24.07.2014,Anisus,NA,5,NA,NA,121000003,Handnet,2014,7,24
BEVL_VMM_757000,21655510,24.07.2014,Asellidae,NA,60,NA,NA,121000003,Handnet,2014,7,24
BEVL_VMM_757000,21655510,24.07.2014,Bathyomphalus,NA,3,NA,NA,121000003,Handnet,2014,7,24
BEVL_VMM_757000,21655510,24.07.2014,Chironomidae non thummi-plumosus,NA,25,NA,NA,121000003,Handnet,2014,7,24
BEVL_VMM_757000,21655510,24.07.2014,Chironomidae thummi-plumosus,NA,25,NA,NA,121000003,Handnet,2014,7,24
BEVL_VMM_757000,21655510,24.07.2014,Cloeon,NA,2,NA,NA,121000003,Handnet,2014,7,24
BEVL_VMM_757000,21655510,24.07.2014,Dugesia,NA,3,NA,NA,121000003,Handnet,2014,7,24
BEVL_VMM_757000,21655510,24.07.2014,Dytiscidae,NA,2,NA,NA,121000003,Handnet,2014,7,24
BEVL_VMM_757000,21655510,24.07.2014,Erpobdella,NA,6,NA,NA,121000003,Handnet,2014,7,24
BEVL_VMM_757000,21655510,24.07.2014,Gerris,NA,1,NA,NA,121000003,Handnet,2014,7,24
BEVL_VMM_757000,21655510,24.07.2014,Glossiphonia,NA,2,NA,NA,121000003,Handnet,2014,7,24
BEVL_VMM_757000,21655510,24.07.2014,Gyraulus,NA,7,NA,NA,121000003,Handnet,2014,7,24
BEVL_VMM_757000,21655510,24.07.2014,Haemopis,NA,1,NA,NA,121000003,Handnet,2014,7,24
BEVL_VMM_757000,21655510,24.07.2014,Helobdella,NA,4,NA,NA,121000003,Handnet,2014,7,24
BEVL_VMM_757000,21655510,24.07.2014,Hydrophilidae,NA,9,NA,NA,121000003,Handnet,2014,7,24
BEVL_VMM_757000,21655510,24.07.2014,Lymnaea,NA,6,NA,NA,121000003,Handnet,2014,7,24
BEVL_VMM_757000,21655510,24.07.2014,Naididae,NA,10,NA,NA,121000003,Handnet,2014,7,24
BEVL_VMM_757000,21655510,24.07.2014,Notonecta,NA,3,NA,NA,121000003,Handnet,2014,7,24
BEVL_VMM_757000,21655510,24.07.2014,Physella,NA,1,NA,NA,121000003,Handnet,2014,7,24
BEVL_VMM_757000,21655510,24.07.2014,Pisidium,NA,13,NA,NA,121000003,Handnet,2014,7,24
BEVL_VMM_757000,21655510,24.07.2014,Planorbarius,NA,1,NA,NA,121000003,Handnet,2014,7,24
BEVL_VMM_757000,21655510,24.07.2014,Potamopyrgus,NA,1,NA,NA,121000003,Handnet,2014,7,24
BEVL_VMM_757000,21655510,24.07.2014,Sigara,NA,9,NA,NA,121000003,Handnet,2014,7,24
BEVL_VMM_757000,21655510,24.07.2014,Theromyzon,NA,1,NA,NA,121000003,Handnet,2014,7,24
BEVL_VMM_757000,21655510,24.07.2014,Tubificidae,NA,1,NA,NA,121000003,Handnet,2014,7,24
BEVL_VMM_757000,21655510,24.07.2014,Valvata,NA,100,NA,NA,121000003,Handnet,2014,7,24
BEVL_VMM_757000,21814155,15.06.2018,Anisus,NA,40,NA,NA,121000003,Handnet,2018,6,15
BEVL_VMM_757000,21814155,15.06.2018,Asellidae,NA,120,NA,NA,121000003,Handnet,2018,6,15
BEVL_VMM_757000,21814155,15.06.2018,Bathyomphalus,NA,3,NA,NA,121000003,Handnet,2018,6,15
BEVL_VMM_757000,21814155,15.06.2018,Ceratopogonidae,NA,2,NA,NA,121000003,Handnet,2018,6,15
BEVL_VMM_757000,21814155,15.06.2018,Chironomidae non thummi-plumosus,NA,200,NA,NA,121000003,Handnet,2018,6,15
BEVL_VMM_757000,21814155,15.06.2018,Chironomidae thummi-plumosus,NA,11,NA,NA,121000003,Handnet,2018,6,15
BEVL_VMM_757000,21814155,15.06.2018,Corixa,NA,2,NA,NA,121000003,Handnet,2018,6,15
BEVL_VMM_757000,21814155,15.06.2018,Crangonyctidae,NA,3,NA,NA,121000003,Handnet,2018,6,15
BEVL_VMM_757000,21814155,15.06.2018,Dendrocoelum,NA,1,NA,NA,121000003,Handnet,2018,6,15
BEVL_VMM_757000,21814155,15.06.2018,Dugesia,NA,7,NA,NA,121000003,Handnet,2018,6,15
BEVL_VMM_757000,21814155,15.06.2018,Dytiscidae,NA,2,NA,NA,121000003,Handnet,2018,6,15
BEVL_VMM_757000,21814155,15.06.2018,Erpobdella,NA,3,NA,NA,121000003,Handnet,2018,6,15
BEVL_VMM_757000,21814155,15.06.2018,Glossiphonia,NA,30,NA,NA,121000003,Handnet,2018,6,15
BEVL_VMM_757000,21814155,15.06.2018,Gyraulus,NA,40,NA,NA,121000003,Handnet,2018,6,15
BEVL_VMM_757000,21814155,15.06.2018,Haliplidae,NA,40,NA,NA,121000003,Handnet,2018,6,15
BEVL_VMM_757000,21814155,15.06.2018,Helobdella,NA,20,NA,NA,121000003,Handnet,2018,6,15
BEVL_VMM_757000,21814155,15.06.2018,Hemiclepsis,NA,1,NA,NA,121000003,Handnet,2018,6,15
BEVL_VMM_757000,21814155,15.06.2018,Hydrophilidae,NA,60,NA,NA,121000003,Handnet,2018,6,15
BEVL_VMM_757000,21814155,15.06.2018,Ischnura,NA,9,NA,NA,121000003,Handnet,2018,6,15
BEVL_VMM_757000,21814155,15.06.2018,Limoniidae,NA,1,NA,NA,121000003,Handnet,2018,6,15
BEVL_VMM_757000,21814155,15.06.2018,Lymnaea,NA,40,NA,NA,121000003,Handnet,2018,6,15
BEVL_VMM_757000,21814155,15.06.2018,Naididae,NA,2,NA,NA,121000003,Handnet,2018,6,15
BEVL_VMM_757000,21814155,15.06.2018,Pisidium,NA,100,NA,NA,121000003,Handnet,2018,6,15
BEVL_VMM_757000,21814155,15.06.2018,Planorbarius,NA,11,NA,NA,121000003,Handnet,2018,6,15
BEVL_VMM_757000,21814155,15.06.2018,Potamopyrgus,NA,50,NA,NA,121000003,Handnet,2018,6,15
BEVL_VMM_757000,21814155,15.06.2018,Sigara,NA,25,NA,NA,121000003,Handnet,2018,6,15
BEVL_VMM_757000,21814155,15.06.2018,Simuliidae,NA,5,NA,NA,121000003,Handnet,2018,6,15
BEVL_VMM_757000,21814155,15.06.2018,Sphaerium,NA,2,NA,NA,121000003,Handnet,2018,6,15
BEVL_VMM_757000,21814155,15.06.2018,Theromyzon,NA,5,NA,NA,121000003,Handnet,2018,6,15
BEVL_VMM_757000,21814155,15.06.2018,Tubificidae,NA,15,NA,NA,121000003,Handnet,2018,6,15
BEVL_VMM_757000,21814155,15.06.2018,Valvata,NA,1250,NA,NA,121000003,Handnet,2018,6,15
BEVL_VMM_756000,254781,1.6.1989,Asellidae,NA,11,NA,NA,121000004,Handnet,1989,6,1
BEVL_VMM_756000,254781,1.6.1989,Chironomidae non thummi-plumosus,NA,11,NA,NA,121000004,Handnet,1989,6,1
BEVL_VMM_756000,254781,1.6.1989,Chironomidae thummi-plumosus,NA,11,NA,NA,121000004,Handnet,1989,6,1
BEVL_VMM_756000,254781,1.6.1989,Erpobdella,NA,2,NA,NA,121000004,Handnet,1989,6,1
BEVL_VMM_756000,254781,1.6.1989,Glossiphonia,NA,2,NA,NA,121000004,Handnet,1989,6,1
BEVL_VMM_756000,254781,1.6.1989,Haliplidae,NA,2,NA,NA,121000004,Handnet,1989,6,1
BEVL_VMM_756000,254781,1.6.1989,Helobdella,NA,2,NA,NA,121000004,Handnet,1989,6,1
BEVL_VMM_756000,254781,1.6.1989,Limoniidae,NA,2,NA,NA,121000004,Handnet,1989,6,1
BEVL_VMM_756000,254781,1.6.1989,Lymnaea,NA,1,NA,NA,121000004,Handnet,1989,6,1
BEVL_VMM_756000,254781,1.6.1989,Naididae,NA,2,NA,NA,121000004,Handnet,1989,6,1
BEVL_VMM_756000,254781,1.6.1989,Nepa,NA,2,NA,NA,121000004,Handnet,1989,6,1
BEVL_VMM_756000,254781,1.6.1989,Pisidium,NA,11,NA,NA,121000004,Handnet,1989,6,1
BEVL_VMM_756000,254781,1.6.1989,Psychodidae,NA,2,NA,NA,121000004,Handnet,1989,6,1
BEVL_VMM_756000,254781,1.6.1989,Sialis,NA,2,NA,NA,121000004,Handnet,1989,6,1
BEVL_VMM_756000,254781,1.6.1989,Sigara,NA,11,NA,NA,121000004,Handnet,1989,6,1
BEVL_VMM_756000,254781,1.6.1989,Simuliidae,NA,2,NA,NA,121000004,Handnet,1989,6,1
BEVL_VMM_756000,254781,1.6.1989,Tubificidae,NA,11,NA,NA,121000004,Handnet,1989,6,1
BEVL_VMM_756000,254781,1.6.1989,Velia,NA,2,NA,NA,121000004,Handnet,1989,6,1
BEVL_VMM_756000,254783,7.6.1993,Asellidae,NA,51,NA,NA,121000004,Handnet,1993,6,7
BEVL_VMM_756000,254783,7.6.1993,Ceratopogonidae,NA,1,NA,NA,121000004,Handnet,1993,6,7
BEVL_VMM_756000,254783,7.6.1993,Chironomidae non thummi-plumosus,NA,51,NA,NA,121000004,Handnet,1993,6,7
BEVL_VMM_756000,254783,7.6.1993,Chironomidae thummi-plumosus,NA,101,NA,NA,121000004,Handnet,1993,6,7
BEVL_VMM_756000,254783,7.6.1993,Dytiscidae,NA,1,NA,NA,121000004,Handnet,1993,6,7
BEVL_VMM_756000,254783,7.6.1993,Glossiphonia,NA,11,NA,NA,121000004,Handnet,1993,6,7
BEVL_VMM_756000,254783,7.6.1993,Haliplidae,NA,1,NA,NA,121000004,Handnet,1993,6,7
BEVL_VMM_756000,254783,7.6.1993,Helobdella,NA,11,NA,NA,121000004,Handnet,1993,6,7
BEVL_VMM_756000,254783,7.6.1993,Hydrophilidae,NA,1,NA,NA,121000004,Handnet,1993,6,7
BEVL_VMM_756000,254783,7.6.1993,Ischnura,NA,1,NA,NA,121000004,Handnet,1993,6,7
BEVL_VMM_756000,254783,7.6.1993,Lymnaea,NA,11,NA,NA,121000004,Handnet,1993,6,7
BEVL_VMM_756000,254783,7.6.1993,Naididae,NA,51,NA,NA,121000004,Handnet,1993,6,7
BEVL_VMM_756000,254783,7.6.1993,Physa,NA,2,NA,NA,121000004,Handnet,1993,6,7
BEVL_VMM_756000,254783,7.6.1993,Pisidium,NA,51,NA,NA,121000004,Handnet,1993,6,7
BEVL_VMM_756000,254783,7.6.1993,Sialis,NA,2,NA,NA,121000004,Handnet,1993,6,7
BEVL_VMM_756000,254783,7.6.1993,Sigara,NA,11,NA,NA,121000004,Handnet,1993,6,7
BEVL_VMM_756000,254783,7.6.1993,Sphaerium,NA,2,NA,NA,121000004,Handnet,1993,6,7
BEVL_VMM_756000,254783,7.6.1993,Tubificidae,NA,101,NA,NA,121000004,Handnet,1993,6,7
BEVL_VMM_756000,996636,3.6.1998,Anisus,NA,11,NA,NA,121000004,Handnet,1998,6,3
BEVL_VMM_756000,996636,3.6.1998,Asellidae,NA,51,NA,NA,121000004,Handnet,1998,6,3
BEVL_VMM_756000,996636,3.6.1998,Bathyomphalus,NA,1,NA,NA,121000004,Handnet,1998,6,3
BEVL_VMM_756000,996636,3.6.1998,Chironomidae non thummi-plumosus,NA,11,NA,NA,121000004,Handnet,1998,6,3
BEVL_VMM_756000,996636,3.6.1998,Chironomidae thummi-plumosus,NA,11,NA,NA,121000004,Handnet,1998,6,3
BEVL_VMM_756000,996636,3.6.1998,Dugesia,NA,2,NA,NA,121000004,Handnet,1998,6,3
BEVL_VMM_756000,996636,3.6.1998,Dytiscidae,NA,2,NA,NA,121000004,Handnet,1998,6,3
BEVL_VMM_756000,996636,3.6.1998,Elminthidae,NA,1,NA,NA,121000004,Handnet,1998,6,3
BEVL_VMM_756000,996636,3.6.1998,Gerris,NA,2,NA,NA,121000004,Handnet,1998,6,3
BEVL_VMM_756000,996636,3.6.1998,Glossiphonia,NA,2,NA,NA,121000004,Handnet,1998,6,3
BEVL_VMM_756000,996636,3.6.1998,Hydrophilidae,NA,2,NA,NA,121000004,Handnet,1998,6,3
BEVL_VMM_756000,996636,3.6.1998,Ischnura,NA,11,NA,NA,121000004,Handnet,1998,6,3
BEVL_VMM_756000,996636,3.6.1998,Lymnaea,NA,11,NA,NA,121000004,Handnet,1998,6,3
BEVL_VMM_756000,996636,3.6.1998,Naididae,NA,101,NA,NA,121000004,Handnet,1998,6,3
BEVL_VMM_756000,996636,3.6.1998,Notonecta,NA,2,NA,NA,121000004,Handnet,1998,6,3
BEVL_VMM_756000,996636,3.6.1998,Pisidium,NA,2,NA,NA,121000004,Handnet,1998,6,3
BEVL_VMM_756000,996636,3.6.1998,Planorbis,NA,11,NA,NA,121000004,Handnet,1998,6,3
BEVL_VMM_756000,996636,3.6.1998,Psychodidae,NA,2,NA,NA,121000004,Handnet,1998,6,3
BEVL_VMM_756000,996636,3.6.1998,Rhagionidae,NA,1,NA,NA,121000004,Handnet,1998,6,3
BEVL_VMM_756000,996636,3.6.1998,Sialis,NA,1,NA,NA,121000004,Handnet,1998,6,3
BEVL_VMM_756000,996636,3.6.1998,Sigara,NA,2,NA,NA,121000004,Handnet,1998,6,3
BEVL_VMM_756000,996636,3.6.1998,Simuliidae,NA,11,NA,NA,121000004,Handnet,1998,6,3
BEVL_VMM_756000,996636,3.6.1998,Sphaerium,NA,101,NA,NA,121000004,Handnet,1998,6,3
BEVL_VMM_756000,996636,3.6.1998,Theromyzon,NA,11,NA,NA,121000004,Handnet,1998,6,3
BEVL_VMM_756000,996636,3.6.1998,Tipulidae,NA,2,NA,NA,121000004,Handnet,1998,6,3
BEVL_VMM_756000,996636,3.6.1998,Valvata,NA,101,NA,NA,121000004,Handnet,1998,6,3
BEVL_VMM_756000,21026556,27.07.2000,Anisus,NA,11,NA,NA,121000004,Handnet,2000,7,27
BEVL_VMM_756000,21026556,27.07.2000,Asellidae,NA,11,NA,NA,121000004,Handnet,2000,7,27
BEVL_VMM_756000,21026556,27.07.2000,Bathyomphalus,NA,2,NA,NA,121000004,Handnet,2000,7,27
BEVL_VMM_756000,21026556,27.07.2000,Chironomidae non thummi-plumosus,NA,101,NA,NA,121000004,Handnet,2000,7,27
BEVL_VMM_756000,21026556,27.07.2000,Chironomidae thummi-plumosus,NA,2,NA,NA,121000004,Handnet,2000,7,27
BEVL_VMM_756000,21026556,27.07.2000,Cloeon,NA,1,NA,NA,121000004,Handnet,2000,7,27
BEVL_VMM_756000,21026556,27.07.2000,Corixa,NA,1,NA,NA,121000004,Handnet,2000,7,27
BEVL_VMM_756000,21026556,27.07.2000,Dytiscidae,NA,1,NA,NA,121000004,Handnet,2000,7,27
BEVL_VMM_756000,21026556,27.07.2000,Glossiphonia,NA,11,NA,NA,121000004,Handnet,2000,7,27
BEVL_VMM_756000,21026556,27.07.2000,Gyraulus,NA,1,NA,NA,121000004,Handnet,2000,7,27
BEVL_VMM_756000,21026556,27.07.2000,Haliplidae,NA,2,NA,NA,121000004,Handnet,2000,7,27
BEVL_VMM_756000,21026556,27.07.2000,Helobdella,NA,2,NA,NA,121000004,Handnet,2000,7,27
BEVL_VMM_756000,21026556,27.07.2000,Hydrophilidae,NA,1,NA,NA,121000004,Handnet,2000,7,27
BEVL_VMM_756000,21026556,27.07.2000,Lymnaea,NA,2,NA,NA,121000004,Handnet,2000,7,27
BEVL_VMM_756000,21026556,27.07.2000,Notonecta,NA,2,NA,NA,121000004,Handnet,2000,7,27
BEVL_VMM_756000,21026556,27.07.2000,Pisidium,NA,2,NA,NA,121000004,Handnet,2000,7,27
BEVL_VMM_756000,21026556,27.07.2000,Planorbarius,NA,2,NA,NA,121000004,Handnet,2000,7,27
BEVL_VMM_756000,21026556,27.07.2000,Planorbis,NA,2,NA,NA,121000004,Handnet,2000,7,27
BEVL_VMM_756000,21026556,27.07.2000,Sialis,NA,2,NA,NA,121000004,Handnet,2000,7,27
BEVL_VMM_756000,21026556,27.07.2000,Sigara,NA,11,NA,NA,121000004,Handnet,2000,7,27
BEVL_VMM_756000,21026556,27.07.2000,Sphaerium,NA,11,NA,NA,121000004,Handnet,2000,7,27
BEVL_VMM_756000,21026556,27.07.2000,Theromyzon,NA,2,NA,NA,121000004,Handnet,2000,7,27
BEVL_VMM_756000,21026556,27.07.2000,Tubificidae,NA,11,NA,NA,121000004,Handnet,2000,7,27
BEVL_VMM_756000,21026556,27.07.2000,Valvata,NA,51,NA,NA,121000004,Handnet,2000,7,27
BEVL_VMM_756000,21086814,19.06.2002,Anisus,NA,11,NA,NA,121000004,Handnet,2002,6,19
BEVL_VMM_756000,21086814,19.06.2002,Asellidae,NA,11,NA,NA,121000004,Handnet,2002,6,19
BEVL_VMM_756000,21086814,19.06.2002,Bathyomphalus,NA,2,NA,NA,121000004,Handnet,2002,6,19
BEVL_VMM_756000,21086814,19.06.2002,Chironomidae non thummi-plumosus,NA,11,NA,NA,121000004,Handnet,2002,6,19
BEVL_VMM_756000,21086814,19.06.2002,Chironomidae thummi-plumosus,NA,11,NA,NA,121000004,Handnet,2002,6,19
BEVL_VMM_756000,21086814,19.06.2002,Dugesia,NA,2,NA,NA,121000004,Handnet,2002,6,19
BEVL_VMM_756000,21086814,19.06.2002,Dytiscidae,NA,2,NA,NA,121000004,Handnet,2002,6,19
BEVL_VMM_756000,21086814,19.06.2002,Erpobdella,NA,2,NA,NA,121000004,Handnet,2002,6,19
BEVL_VMM_756000,21086814,19.06.2002,Glossiphonia,NA,11,NA,NA,121000004,Handnet,2002,6,19
BEVL_VMM_756000,21086814,19.06.2002,Gyraulus,NA,2,NA,NA,121000004,Handnet,2002,6,19
BEVL_VMM_756000,21086814,19.06.2002,Helobdella,NA,11,NA,NA,121000004,Handnet,2002,6,19
BEVL_VMM_756000,21086814,19.06.2002,Hesperocorixa,NA,1,NA,NA,121000004,Handnet,2002,6,19
BEVL_VMM_756000,21086814,19.06.2002,Hippeutis,NA,2,NA,NA,121000004,Handnet,2002,6,19
BEVL_VMM_756000,21086814,19.06.2002,Hydrophilidae,NA,11,NA,NA,121000004,Handnet,2002,6,19
BEVL_VMM_756000,21086814,19.06.2002,Ischnura,NA,2,NA,NA,121000004,Handnet,2002,6,19
BEVL_VMM_756000,21086814,19.06.2002,Lymnaea,NA,2,NA,NA,121000004,Handnet,2002,6,19
BEVL_VMM_756000,21086814,19.06.2002,Physa,NA,11,NA,NA,121000004,Handnet,2002,6,19
BEVL_VMM_756000,21086814,19.06.2002,Planorbis,NA,1,NA,NA,121000004,Handnet,2002,6,19
BEVL_VMM_756000,21086814,19.06.2002,Polycelis,NA,1,NA,NA,121000004,Handnet,2002,6,19
BEVL_VMM_756000,21086814,19.06.2002,Scathophagidae,NA,1,NA,NA,121000004,Handnet,2002,6,19
BEVL_VMM_756000,21086814,19.06.2002,Sigara,NA,2,NA,NA,121000004,Handnet,2002,6,19
BEVL_VMM_756000,21086814,19.06.2002,Simuliidae,NA,11,NA,NA,121000004,Handnet,2002,6,19
BEVL_VMM_756000,21086814,19.06.2002,Sphaerium,NA,11,NA,NA,121000004,Handnet,2002,6,19
BEVL_VMM_756000,21086814,19.06.2002,Theromyzon,NA,2,NA,NA,121000004,Handnet,2002,6,19
BEVL_VMM_756000,21086814,19.06.2002,Tipulidae,NA,2,NA,NA,121000004,Handnet,2002,6,19
BEVL_VMM_756000,21086814,19.06.2002,Tubificidae,NA,2,NA,NA,121000004,Handnet,2002,6,19
BEVL_VMM_756000,21086814,19.06.2002,Valvata,NA,11,NA,NA,121000004,Handnet,2002,6,19
BEVL_VMM_756000,21126765,7.7.2003,Anisus,NA,1,NA,NA,121000004,Handnet,2003,7,7
BEVL_VMM_756000,21126765,7.7.2003,Asellidae,NA,51,NA,NA,121000004,Handnet,2003,7,7
BEVL_VMM_756000,21126765,7.7.2003,Bathyomphalus,NA,11,NA,NA,121000004,Handnet,2003,7,7
BEVL_VMM_756000,21126765,7.7.2003,Chironomidae non thummi-plumosus,NA,11,NA,NA,121000004,Handnet,2003,7,7
BEVL_VMM_756000,21126765,7.7.2003,Chironomidae thummi-plumosus,NA,11,NA,NA,121000004,Handnet,2003,7,7
BEVL_VMM_756000,21126765,7.7.2003,Cloeon,NA,1,NA,NA,121000004,Handnet,2003,7,7
BEVL_VMM_756000,21126765,7.7.2003,Dolichopodidae,NA,1,NA,NA,121000004,Handnet,2003,7,7
BEVL_VMM_756000,21126765,7.7.2003,Dytiscidae,NA,2,NA,NA,121000004,Handnet,2003,7,7
BEVL_VMM_756000,21126765,7.7.2003,Erpobdella,NA,2,NA,NA,121000004,Handnet,2003,7,7
BEVL_VMM_756000,21126765,7.7.2003,Glossiphonia,NA,11,NA,NA,121000004,Handnet,2003,7,7
BEVL_VMM_756000,21126765,7.7.2003,Gyraulus,NA,2,NA,NA,121000004,Handnet,2003,7,7
BEVL_VMM_756000,21126765,7.7.2003,Haliplidae,NA,2,NA,NA,121000004,Handnet,2003,7,7
BEVL_VMM_756000,21126765,7.7.2003,Helobdella,NA,11,NA,NA,121000004,Handnet,2003,7,7
BEVL_VMM_756000,21126765,7.7.2003,Hesperocorixa,NA,11,NA,NA,121000004,Handnet,2003,7,7
BEVL_VMM_756000,21126765,7.7.2003,Hydracarina,NA,1,NA,NA,121000004,Handnet,2003,7,7
BEVL_VMM_756000,21126765,7.7.2003,Hydrophilidae,NA,2,NA,NA,121000004,Handnet,2003,7,7
BEVL_VMM_756000,21126765,7.7.2003,Ischnura,NA,1,NA,NA,121000004,Handnet,2003,7,7
BEVL_VMM_756000,21126765,7.7.2003,Lymnaea,NA,2,NA,NA,121000004,Handnet,2003,7,7
BEVL_VMM_756000,21126765,7.7.2003,Muscidae,NA,2,NA,NA,121000004,Handnet,2003,7,7
BEVL_VMM_756000,21126765,7.7.2003,Naididae,NA,11,NA,NA,121000004,Handnet,2003,7,7
BEVL_VMM_756000,21126765,7.7.2003,Nepa,NA,2,NA,NA,121000004,Handnet,2003,7,7
BEVL_VMM_756000,21126765,7.7.2003,Physa,NA,11,NA,NA,121000004,Handnet,2003,7,7
BEVL_VMM_756000,21126765,7.7.2003,Planorbarius,NA,11,NA,NA,121000004,Handnet,2003,7,7
BEVL_VMM_756000,21126765,7.7.2003,Polycelis,NA,1,NA,NA,121000004,Handnet,2003,7,7
BEVL_VMM_756000,21126765,7.7.2003,Psychodidae,NA,2,NA,NA,121000004,Handnet,2003,7,7
BEVL_VMM_756000,21126765,7.7.2003,Segmentina,NA,1,NA,NA,121000004,Handnet,2003,7,7
BEVL_VMM_756000,21126765,7.7.2003,Sigara,NA,11,NA,NA,121000004,Handnet,2003,7,7
BEVL_VMM_756000,21126765,7.7.2003,Simuliidae,NA,2,NA,NA,121000004,Handnet,2003,7,7
BEVL_VMM_756000,21126765,7.7.2003,Sphaerium,NA,11,NA,NA,121000004,Handnet,2003,7,7
BEVL_VMM_756000,21126765,7.7.2003,Stratiomyidae,NA,1,NA,NA,121000004,Handnet,2003,7,7
BEVL_VMM_756000,21126765,7.7.2003,Theromyzon,NA,2,NA,NA,121000004,Handnet,2003,7,7
BEVL_VMM_756000,21126765,7.7.2003,Tipulidae,NA,1,NA,NA,121000004,Handnet,2003,7,7
BEVL_VMM_756000,21126765,7.7.2003,Tubificidae,NA,11,NA,NA,121000004,Handnet,2003,7,7
BEVL_VMM_756000,21126765,7.7.2003,Valvata,NA,11,NA,NA,121000004,Handnet,2003,7,7
BEVL_VMM_756000,21171883,15.07.2004,Anisus,NA,2,NA,NA,121000004,Handnet,2004,7,15
BEVL_VMM_756000,21171883,15.07.2004,Asellidae,NA,2,NA,NA,121000004,Handnet,2004,7,15
BEVL_VMM_756000,21171883,15.07.2004,Ceratopogonidae,NA,2,NA,NA,121000004,Handnet,2004,7,15
BEVL_VMM_756000,21171883,15.07.2004,Chironomidae non thummi-plumosus,NA,51,NA,NA,121000004,Handnet,2004,7,15
BEVL_VMM_756000,21171883,15.07.2004,Chironomidae thummi-plumosus,NA,51,NA,NA,121000004,Handnet,2004,7,15
BEVL_VMM_756000,21171883,15.07.2004,Corixa,NA,1,NA,NA,121000004,Handnet,2004,7,15
BEVL_VMM_756000,21171883,15.07.2004,Dendrocoelum,NA,1,NA,NA,121000004,Handnet,2004,7,15
BEVL_VMM_756000,21171883,15.07.2004,Drie doornige stekelbaars,NA,11,NA,NA,121000004,Handnet,2004,7,15
BEVL_VMM_756000,21171883,15.07.2004,Dytiscidae,NA,2,NA,NA,121000004,Handnet,2004,7,15
BEVL_VMM_756000,21171883,15.07.2004,Erpobdella,NA,2,NA,NA,121000004,Handnet,2004,7,15
BEVL_VMM_756000,21171883,15.07.2004,Glossiphonia,NA,11,NA,NA,121000004,Handnet,2004,7,15
BEVL_VMM_756000,21171883,15.07.2004,Haliplidae,NA,1,NA,NA,121000004,Handnet,2004,7,15
BEVL_VMM_756000,21171883,15.07.2004,Helobdella,NA,11,NA,NA,121000004,Handnet,2004,7,15
BEVL_VMM_756000,21171883,15.07.2004,Hydracarina,NA,1,NA,NA,121000004,Handnet,2004,7,15
BEVL_VMM_756000,21171883,15.07.2004,Hydraenidae,NA,1,NA,NA,121000004,Handnet,2004,7,15
BEVL_VMM_756000,21171883,15.07.2004,Hydrophilidae,NA,2,NA,NA,121000004,Handnet,2004,7,15
BEVL_VMM_756000,21171883,15.07.2004,Ischnura,NA,11,NA,NA,121000004,Handnet,2004,7,15
BEVL_VMM_756000,21171883,15.07.2004,Lymnaea,NA,2,NA,NA,121000004,Handnet,2004,7,15
BEVL_VMM_756000,21171883,15.07.2004,Naididae,NA,2,NA,NA,121000004,Handnet,2004,7,15
BEVL_VMM_756000,21171883,15.07.2004,Planorbarius,NA,2,NA,NA,121000004,Handnet,2004,7,15
BEVL_VMM_756000,21171883,15.07.2004,Psychodidae,NA,1,NA,NA,121000004,Handnet,2004,7,15
BEVL_VMM_756000,21171883,15.07.2004,Segmentina,NA,2,NA,NA,121000004,Handnet,2004,7,15
BEVL_VMM_756000,21171883,15.07.2004,Sigara,NA,1,NA,NA,121000004,Handnet,2004,7,15
BEVL_VMM_756000,21171883,15.07.2004,Simuliidae,NA,11,NA,NA,121000004,Handnet,2004,7,15
BEVL_VMM_756000,21171883,15.07.2004,Sphaerium,NA,11,NA,NA,121000004,Handnet,2004,7,15
BEVL_VMM_756000,21171883,15.07.2004,Theromyzon,NA,2,NA,NA,121000004,Handnet,2004,7,15
BEVL_VMM_756000,21171883,15.07.2004,tiendoornige stekelbaars,NA,1,NA,NA,121000004,Handnet,2004,7,15
BEVL_VMM_756000,21171883,15.07.2004,Tubificidae,NA,11,NA,NA,121000004,Handnet,2004,7,15
BEVL_VMM_756000,21171883,15.07.2004,Valvata,NA,11,NA,NA,121000004,Handnet,2004,7,15
BEVL_VMM_756000,21528177,3.6.2011,Asellidae,NA,20,NA,NA,121000004,Handnet,2011,6,3
BEVL_VMM_756000,21528177,3.6.2011,Bithynia,NA,1,NA,NA,121000004,Handnet,2011,6,3
BEVL_VMM_756000,21528177,3.6.2011,Chironomidae non thummi-plumosus,NA,100,NA,NA,121000004,Handnet,2011,6,3
BEVL_VMM_756000,21528177,3.6.2011,Chironomidae thummi-plumosus,NA,100,NA,NA,121000004,Handnet,2011,6,3
BEVL_VMM_756000,21528177,3.6.2011,Dugesia,NA,1,NA,NA,121000004,Handnet,2011,6,3
BEVL_VMM_756000,21528177,3.6.2011,Dytiscidae,NA,1,NA,NA,121000004,Handnet,2011,6,3
BEVL_VMM_756000,21528177,3.6.2011,Glossiphonia,NA,15,NA,NA,121000004,Handnet,2011,6,3
BEVL_VMM_756000,21528177,3.6.2011,Helobdella,NA,20,NA,NA,121000004,Handnet,2011,6,3
BEVL_VMM_756000,21528177,3.6.2011,Hydraenidae,NA,1,NA,NA,121000004,Handnet,2011,6,3
BEVL_VMM_756000,21528177,3.6.2011,Hydrophilidae,NA,20,NA,NA,121000004,Handnet,2011,6,3
BEVL_VMM_756000,21528177,3.6.2011,Lymnaea,NA,8,NA,NA,121000004,Handnet,2011,6,3
BEVL_VMM_756000,21528177,3.6.2011,Naididae,NA,1,NA,NA,121000004,Handnet,2011,6,3
BEVL_VMM_756000,21528177,3.6.2011,Nepa,NA,3,NA,NA,121000004,Handnet,2011,6,3
BEVL_VMM_756000,21528177,3.6.2011,Noteridae,NA,1,NA,NA,121000004,Handnet,2011,6,3
BEVL_VMM_756000,21528177,3.6.2011,Notonecta,NA,2,NA,NA,121000004,Handnet,2011,6,3
BEVL_VMM_756000,21528177,3.6.2011,Sigara,NA,40,NA,NA,121000004,Handnet,2011,6,3
BEVL_VMM_756000,21528177,3.6.2011,Simuliidae,NA,40,NA,NA,121000004,Handnet,2011,6,3
BEVL_VMM_756000,21528177,3.6.2011,Sphaerium,NA,1,NA,NA,121000004,Handnet,2011,6,3
BEVL_VMM_756000,21528177,3.6.2011,Theromyzon,NA,1,NA,NA,121000004,Handnet,2011,6,3
BEVL_VMM_756000,21528177,3.6.2011,Tubificidae,NA,12,NA,NA,121000004,Handnet,2011,6,3
BEVL_VMM_756000,21528177,3.6.2011,Valvata,NA,2,NA,NA,121000004,Handnet,2011,6,3
BEVL_VMM_756000,21655509,24.07.2014,Anisus,NA,100,NA,NA,121000004,Handnet,2014,7,24
BEVL_VMM_756000,21655509,24.07.2014,Asellidae,NA,30,NA,NA,121000004,Handnet,2014,7,24
BEVL_VMM_756000,21655509,24.07.2014,Bathyomphalus,NA,60,NA,NA,121000004,Handnet,2014,7,24
BEVL_VMM_756000,21655509,24.07.2014,Bithynia,NA,200,NA,NA,121000004,Handnet,2014,7,24
BEVL_VMM_756000,21655509,24.07.2014,Ceratopogonidae,NA,1,NA,NA,121000004,Handnet,2014,7,24
BEVL_VMM_756000,21655509,24.07.2014,Chironomidae non thummi-plumosus,NA,30,NA,NA,121000004,Handnet,2014,7,24
BEVL_VMM_756000,21655509,24.07.2014,Chironomidae thummi-plumosus,NA,8,NA,NA,121000004,Handnet,2014,7,24
BEVL_VMM_756000,21655509,24.07.2014,Cloeon,NA,7,NA,NA,121000004,Handnet,2014,7,24
BEVL_VMM_756000,21655509,24.07.2014,Dugesia,NA,100,NA,NA,121000004,Handnet,2014,7,24
BEVL_VMM_756000,21655509,24.07.2014,Dytiscidae,NA,3,NA,NA,121000004,Handnet,2014,7,24
BEVL_VMM_756000,21655509,24.07.2014,Erpobdella,NA,50,NA,NA,121000004,Handnet,2014,7,24
BEVL_VMM_756000,21655509,24.07.2014,Glossiphonia,NA,50,NA,NA,121000004,Handnet,2014,7,24
BEVL_VMM_756000,21655509,24.07.2014,Gyraulus,NA,7,NA,NA,121000004,Handnet,2014,7,24
BEVL_VMM_756000,21655509,24.07.2014,Haliplidae,NA,6,NA,NA,121000004,Handnet,2014,7,24
BEVL_VMM_756000,21655509,24.07.2014,Helobdella,NA,50,NA,NA,121000004,Handnet,2014,7,24
BEVL_VMM_756000,21655509,24.07.2014,Hesperocorixa,NA,3,NA,NA,121000004,Handnet,2014,7,24
BEVL_VMM_756000,21655509,24.07.2014,Hippeutis,NA,4,NA,NA,121000004,Handnet,2014,7,24
BEVL_VMM_756000,21655509,24.07.2014,Hydrophilidae,NA,2,NA,NA,121000004,Handnet,2014,7,24
BEVL_VMM_756000,21655509,24.07.2014,Ischnura,NA,1,NA,NA,121000004,Handnet,2014,7,24
BEVL_VMM_756000,21655509,24.07.2014,Lymnaea,NA,4,NA,NA,121000004,Handnet,2014,7,24
BEVL_VMM_756000,21655509,24.07.2014,Naididae,NA,300,NA,NA,121000004,Handnet,2014,7,24
BEVL_VMM_756000,21655509,24.07.2014,Nepa,NA,4,NA,NA,121000004,Handnet,2014,7,24
BEVL_VMM_756000,21655509,24.07.2014,Noteridae,NA,2,NA,NA,121000004,Handnet,2014,7,24
BEVL_VMM_756000,21655509,24.07.2014,Notonecta,NA,2,NA,NA,121000004,Handnet,2014,7,24
BEVL_VMM_756000,21655509,24.07.2014,Physa,NA,1,NA,NA,121000004,Handnet,2014,7,24
BEVL_VMM_756000,21655509,24.07.2014,Pisidium,NA,35,NA,NA,121000004,Handnet,2014,7,24
BEVL_VMM_756000,21655509,24.07.2014,Planorbarius,NA,7,NA,NA,121000004,Handnet,2014,7,24
BEVL_VMM_756000,21655509,24.07.2014,Planorbis,NA,1,NA,NA,121000004,Handnet,2014,7,24
BEVL_VMM_756000,21655509,24.07.2014,Polycelis,NA,20,NA,NA,121000004,Handnet,2014,7,24
BEVL_VMM_756000,21655509,24.07.2014,Psychodidae,NA,2,NA,NA,121000004,Handnet,2014,7,24
BEVL_VMM_756000,21655509,24.07.2014,Sigara,NA,3,NA,NA,121000004,Handnet,2014,7,24
BEVL_VMM_756000,21655509,24.07.2014,Sphaerium,NA,200,NA,NA,121000004,Handnet,2014,7,24
BEVL_VMM_756000,21655509,24.07.2014,Theromyzon,NA,6,NA,NA,121000004,Handnet,2014,7,24
BEVL_VMM_756000,21655509,24.07.2014,Tubificidae,NA,30,NA,NA,121000004,Handnet,2014,7,24
BEVL_VMM_756000,21655509,24.07.2014,Valvata,NA,200,NA,NA,121000004,Handnet,2014,7,24
BEVL_VMM_756000,21814154,15.06.2018,Anisus,NA,100,NA,NA,121000004,Handnet,2018,6,15
BEVL_VMM_756000,21814154,15.06.2018,Asellidae,NA,500,NA,NA,121000004,Handnet,2018,6,15
BEVL_VMM_756000,21814154,15.06.2018,Bathyomphalus,NA,20,NA,NA,121000004,Handnet,2018,6,15
BEVL_VMM_756000,21814154,15.06.2018,Bithynia,NA,4,NA,NA,121000004,Handnet,2018,6,15
BEVL_VMM_756000,21814154,15.06.2018,Chironomidae non thummi-plumosus,NA,2,NA,NA,121000004,Handnet,2018,6,15
BEVL_VMM_756000,21814154,15.06.2018,Chironomidae thummi-plumosus,NA,300,NA,NA,121000004,Handnet,2018,6,15
BEVL_VMM_756000,21814154,15.06.2018,Corixa,NA,1,NA,NA,121000004,Handnet,2018,6,15
BEVL_VMM_756000,21814154,15.06.2018,Culicidae,NA,400,NA,NA,121000004,Handnet,2018,6,15
BEVL_VMM_756000,21814154,15.06.2018,Dendrocoelum,NA,3,NA,NA,121000004,Handnet,2018,6,15
BEVL_VMM_756000,21814154,15.06.2018,Dugesia,NA,1,NA,NA,121000004,Handnet,2018,6,15
BEVL_VMM_756000,21814154,15.06.2018,Dytiscidae,NA,2,NA,NA,121000004,Handnet,2018,6,15
BEVL_VMM_756000,21814154,15.06.2018,Erpobdella,NA,3,NA,NA,121000004,Handnet,2018,6,15
BEVL_VMM_756000,21814154,15.06.2018,Glossiphonia,NA,40,NA,NA,121000004,Handnet,2018,6,15
BEVL_VMM_756000,21814154,15.06.2018,Gyraulus,NA,1,NA,NA,121000004,Handnet,2018,6,15
BEVL_VMM_756000,21814154,15.06.2018,Haliplidae,NA,12,NA,NA,121000004,Handnet,2018,6,15
BEVL_VMM_756000,21814154,15.06.2018,Helobdella,NA,15,NA,NA,121000004,Handnet,2018,6,15
BEVL_VMM_756000,21814154,15.06.2018,Hesperocorixa,NA,1,NA,NA,121000004,Handnet,2018,6,15
BEVL_VMM_756000,21814154,15.06.2018,Hydraenidae,NA,1,NA,NA,121000004,Handnet,2018,6,15
BEVL_VMM_756000,21814154,15.06.2018,Hydrophilidae,NA,30,NA,NA,121000004,Handnet,2018,6,15
BEVL_VMM_756000,21814154,15.06.2018,Ischnura,NA,1,NA,NA,121000004,Handnet,2018,6,15
BEVL_VMM_756000,21814154,15.06.2018,Lymnaea,NA,1,NA,NA,121000004,Handnet,2018,6,15
BEVL_VMM_756000,21814154,15.06.2018,Noteridae,NA,2,NA,NA,121000004,Handnet,2018,6,15
BEVL_VMM_756000,21814154,15.06.2018,Notonecta,NA,2,NA,NA,121000004,Handnet,2018,6,15
BEVL_VMM_756000,21814154,15.06.2018,Pisidium,NA,100,NA,NA,121000004,Handnet,2018,6,15
BEVL_VMM_756000,21814154,15.06.2018,Planorbarius,NA,14,NA,NA,121000004,Handnet,2018,6,15
BEVL_VMM_756000,21814154,15.06.2018,Segmentina,NA,4,NA,NA,121000004,Handnet,2018,6,15
BEVL_VMM_756000,21814154,15.06.2018,Sigara,NA,70,NA,NA,121000004,Handnet,2018,6,15
BEVL_VMM_756000,21814154,15.06.2018,Sphaerium,NA,30,NA,NA,121000004,Handnet,2018,6,15
BEVL_VMM_756000,21814154,15.06.2018,Syrphidae-Eristalinae,NA,2,NA,NA,121000004,Handnet,2018,6,15
BEVL_VMM_756000,21814154,15.06.2018,Tubificidae,NA,150,NA,NA,121000004,Handnet,2018,6,15
BEVL_VMM_756000,21814154,15.06.2018,Valvata,NA,75,NA,NA,121000004,Handnet,2018,6,15
BEVL_VMM_756000,21814154,15.06.2018,Velia,NA,1,NA,NA,121000004,Handnet,2018,6,15
BEVL_VMM_531110,996436,13.08.1998,Aeshna,NA,2,NA,NA,121000005,Handnet,1998,8,13
BEVL_VMM_531110,996436,13.08.1998,Anisus,NA,2,NA,NA,121000005,Handnet,1998,8,13
BEVL_VMM_531110,996436,13.08.1998,Arctocorisa,NA,1,NA,NA,121000005,Handnet,1998,8,13
BEVL_VMM_531110,996436,13.08.1998,Chironomidae non thummi-plumosus,NA,2,NA,NA,121000005,Handnet,1998,8,13
BEVL_VMM_531110,996436,13.08.1998,Chironomidae thummi-plumosus,NA,2,NA,NA,121000005,Handnet,1998,8,13
BEVL_VMM_531110,996436,13.08.1998,Corixa,NA,1,NA,NA,121000005,Handnet,1998,8,13
BEVL_VMM_531110,996436,13.08.1998,Glossiphonia,NA,1,NA,NA,121000005,Handnet,1998,8,13
BEVL_VMM_531110,996436,13.08.1998,Helobdella,NA,2,NA,NA,121000005,Handnet,1998,8,13
BEVL_VMM_531110,996436,13.08.1998,Hesperocorixa,NA,1,NA,NA,121000005,Handnet,1998,8,13
BEVL_VMM_531110,996436,13.08.1998,Limoniidae,NA,1,NA,NA,121000005,Handnet,1998,8,13
BEVL_VMM_531110,996436,13.08.1998,Lumbriculidae,NA,2,NA,NA,121000005,Handnet,1998,8,13
BEVL_VMM_531110,996436,13.08.1998,Lymnaea,NA,2,NA,NA,121000005,Handnet,1998,8,13
BEVL_VMM_531110,996436,13.08.1998,Naididae,NA,2,NA,NA,121000005,Handnet,1998,8,13
BEVL_VMM_531110,996436,13.08.1998,Physa,NA,2,NA,NA,121000005,Handnet,1998,8,13
BEVL_VMM_531110,996436,13.08.1998,Tubificidae,NA,2,NA,NA,121000005,Handnet,1998,8,13
BEVL_VMM_531110,996436,13.08.1998,Vis,NA,1,NA,NA,121000005,Handnet,1998,8,13
BEVL_VMM_531110,11023755,5.8.1999,Anisus,NA,1,NA,NA,121000005,Handnet,1999,8,5
BEVL_VMM_531110,11023755,5.8.1999,Baetis,NA,2,NA,NA,121000005,Handnet,1999,8,5
BEVL_VMM_531110,11023755,5.8.1999,Chironomidae non thummi-plumosus,NA,51,NA,NA,121000005,Handnet,1999,8,5
BEVL_VMM_531110,11023755,5.8.1999,Chironomidae thummi-plumosus,NA,2,NA,NA,121000005,Handnet,1999,8,5
BEVL_VMM_531110,11023755,5.8.1999,Dytiscidae,NA,2,NA,NA,121000005,Handnet,1999,8,5
BEVL_VMM_531110,11023755,5.8.1999,Enchytraeidae,NA,2,NA,NA,121000005,Handnet,1999,8,5
BEVL_VMM_531110,11023755,5.8.1999,Erpobdella,NA,2,NA,NA,121000005,Handnet,1999,8,5
BEVL_VMM_531110,11023755,5.8.1999,Gammaridae,NA,2,NA,NA,121000005,Handnet,1999,8,5
BEVL_VMM_531110,11023755,5.8.1999,Gerris,NA,2,NA,NA,121000005,Handnet,1999,8,5
BEVL_VMM_531110,11023755,5.8.1999,Glossiphonia,NA,2,NA,NA,121000005,Handnet,1999,8,5
BEVL_VMM_531110,11023755,5.8.1999,Helobdella,NA,2,NA,NA,121000005,Handnet,1999,8,5
BEVL_VMM_531110,11023755,5.8.1999,Hesperocorixa,NA,2,NA,NA,121000005,Handnet,1999,8,5
BEVL_VMM_531110,11023755,5.8.1999,Hydrophilidae,NA,1,NA,NA,121000005,Handnet,1999,8,5
BEVL_VMM_531110,11023755,5.8.1999,Lestes,NA,1,NA,NA,121000005,Handnet,1999,8,5
BEVL_VMM_531110,11023755,5.8.1999,Lymnaea,NA,51,NA,NA,121000005,Handnet,1999,8,5
BEVL_VMM_531110,11023755,5.8.1999,Naididae,NA,1,NA,NA,121000005,Handnet,1999,8,5
BEVL_VMM_531110,11023755,5.8.1999,Nepa,NA,2,NA,NA,121000005,Handnet,1999,8,5
BEVL_VMM_531110,11023755,5.8.1999,Notonecta,NA,1,NA,NA,121000005,Handnet,1999,8,5
BEVL_VMM_531110,11023755,5.8.1999,Physa,NA,51,NA,NA,121000005,Handnet,1999,8,5
BEVL_VMM_531110,11023755,5.8.1999,Pisidium,NA,11,NA,NA,121000005,Handnet,1999,8,5
BEVL_VMM_531110,11023755,5.8.1999,Potamopyrgus,NA,1,NA,NA,121000005,Handnet,1999,8,5
BEVL_VMM_531110,11023755,5.8.1999,Psychodidae,NA,1,NA,NA,121000005,Handnet,1999,8,5
BEVL_VMM_531110,11023755,5.8.1999,Sigara,NA,1,NA,NA,121000005,Handnet,1999,8,5
BEVL_VMM_531110,11023755,5.8.1999,Tipulidae,NA,2,NA,NA,121000005,Handnet,1999,8,5
BEVL_VMM_531110,11023755,5.8.1999,Tubificidae,NA,2,NA,NA,121000005,Handnet,1999,8,5
BEVL_VMM_531110,21060229,17.08.2001,Asellidae,NA,11,NA,NA,121000005,Handnet,2001,8,17
BEVL_VMM_531110,21060229,17.08.2001,Baetis,NA,101,NA,NA,121000005,Handnet,2001,8,17
BEVL_VMM_531110,21060229,17.08.2001,Chironomidae non thummi-plumosus,NA,51,NA,NA,121000005,Handnet,2001,8,17
BEVL_VMM_531110,21060229,17.08.2001,Chironomidae thummi-plumosus,NA,51,NA,NA,121000005,Handnet,2001,8,17
BEVL_VMM_531110,21060229,17.08.2001,Corixa,NA,1,NA,NA,121000005,Handnet,2001,8,17
BEVL_VMM_531110,21060229,17.08.2001,Culicidae,NA,1,NA,NA,121000005,Handnet,2001,8,17
BEVL_VMM_531110,21060229,17.08.2001,Dytiscidae,NA,2,NA,NA,121000005,Handnet,2001,8,17
BEVL_VMM_531110,21060229,17.08.2001,Ephydridae,NA,2,NA,NA,121000005,Handnet,2001,8,17
BEVL_VMM_531110,21060229,17.08.2001,Erpobdella,NA,2,NA,NA,121000005,Handnet,2001,8,17
BEVL_VMM_531110,21060229,17.08.2001,Gammaridae,NA,51,NA,NA,121000005,Handnet,2001,8,17
BEVL_VMM_531110,21060229,17.08.2001,Glossiphonia,NA,11,NA,NA,121000005,Handnet,2001,8,17
BEVL_VMM_531110,21060229,17.08.2001,Helobdella,NA,11,NA,NA,121000005,Handnet,2001,8,17
BEVL_VMM_531110,21060229,17.08.2001,Hesperocorixa,NA,2,NA,NA,121000005,Handnet,2001,8,17
BEVL_VMM_531110,21060229,17.08.2001,Ischnura,NA,1,NA,NA,121000005,Handnet,2001,8,17
BEVL_VMM_531110,21060229,17.08.2001,Lymnaea,NA,1,NA,NA,121000005,Handnet,2001,8,17
BEVL_VMM_531110,21060229,17.08.2001,Pisidium,NA,51,NA,NA,121000005,Handnet,2001,8,17
BEVL_VMM_531110,21060229,17.08.2001,Simuliidae,NA,2,NA,NA,121000005,Handnet,2001,8,17
BEVL_VMM_531110,21060229,17.08.2001,Theromyzon,NA,1,NA,NA,121000005,Handnet,2001,8,17
BEVL_VMM_531110,21060229,17.08.2001,Tubificidae,NA,101,NA,NA,121000005,Handnet,2001,8,17
BEVL_VMM_531110,21128849,18.07.2003,Anisus,NA,1,NA,NA,121000005,Handnet,2003,7,18
BEVL_VMM_531110,21128849,18.07.2003,Asellidae,NA,11,NA,NA,121000005,Handnet,2003,7,18
BEVL_VMM_531110,21128849,18.07.2003,Baetis,NA,2,NA,NA,121000005,Handnet,2003,7,18
BEVL_VMM_531110,21128849,18.07.2003,Bathyomphalus,NA,1,NA,NA,121000005,Handnet,2003,7,18
BEVL_VMM_531110,21128849,18.07.2003,Ceratopogonidae,NA,1,NA,NA,121000005,Handnet,2003,7,18
BEVL_VMM_531110,21128849,18.07.2003,Chironomidae non thummi-plumosus,NA,51,NA,NA,121000005,Handnet,2003,7,18
BEVL_VMM_531110,21128849,18.07.2003,Drie doornige stekelbaars,NA,2,NA,NA,121000005,Handnet,2003,7,18
BEVL_VMM_531110,21128849,18.07.2003,Dytiscidae,NA,11,NA,NA,121000005,Handnet,2003,7,18
BEVL_VMM_531110,21128849,18.07.2003,Erpobdella,NA,11,NA,NA,121000005,Handnet,2003,7,18
BEVL_VMM_531110,21128849,18.07.2003,Gammaridae,NA,101,NA,NA,121000005,Handnet,2003,7,18
BEVL_VMM_531110,21128849,18.07.2003,Glossiphonia,NA,11,NA,NA,121000005,Handnet,2003,7,18
BEVL_VMM_531110,21128849,18.07.2003,Haliplidae,NA,1,NA,NA,121000005,Handnet,2003,7,18
BEVL_VMM_531110,21128849,18.07.2003,Helobdella,NA,2,NA,NA,121000005,Handnet,2003,7,18
BEVL_VMM_531110,21128849,18.07.2003,Hesperocorixa,NA,2,NA,NA,121000005,Handnet,2003,7,18
BEVL_VMM_531110,21128849,18.07.2003,Hydraenidae,NA,1,NA,NA,121000005,Handnet,2003,7,18
BEVL_VMM_531110,21128849,18.07.2003,Hydrophilidae,NA,11,NA,NA,121000005,Handnet,2003,7,18
BEVL_VMM_531110,21128849,18.07.2003,Hydropsychidae,NA,11,NA,NA,121000005,Handnet,2003,7,18
BEVL_VMM_531110,21128849,18.07.2003,Hydroptilidae,NA,1,NA,NA,121000005,Handnet,2003,7,18
BEVL_VMM_531110,21128849,18.07.2003,Ischnura,NA,2,NA,NA,121000005,Handnet,2003,7,18
BEVL_VMM_531110,21128849,18.07.2003,Limnephilidae,NA,2,NA,NA,121000005,Handnet,2003,7,18
BEVL_VMM_531110,21128849,18.07.2003,Limoniidae,NA,1,NA,NA,121000005,Handnet,2003,7,18
BEVL_VMM_531110,21128849,18.07.2003,Lymnaea,NA,101,NA,NA,121000005,Handnet,2003,7,18
BEVL_VMM_531110,21128849,18.07.2003,Muscidae,NA,1,NA,NA,121000005,Handnet,2003,7,18
BEVL_VMM_531110,21128849,18.07.2003,Notonecta,NA,1,NA,NA,121000005,Handnet,2003,7,18
BEVL_VMM_531110,21128849,18.07.2003,Pisidium,NA,101,NA,NA,121000005,Handnet,2003,7,18
BEVL_VMM_531110,21128849,18.07.2003,Potamopyrgus,NA,11,NA,NA,121000005,Handnet,2003,7,18
BEVL_VMM_531110,21128849,18.07.2003,Psychodidae,NA,2,NA,NA,121000005,Handnet,2003,7,18
BEVL_VMM_531110,21128849,18.07.2003,tiendoornige stekelbaars,NA,2,NA,NA,121000005,Handnet,2003,7,18
BEVL_VMM_531110,21128849,18.07.2003,Tipulidae,NA,1,NA,NA,121000005,Handnet,2003,7,18
BEVL_VMM_531110,21128849,18.07.2003,Tubificidae,NA,11,NA,NA,121000005,Handnet,2003,7,18
BEVL_VMM_531110,21172047,19.07.2004,Asellidae,NA,11,NA,NA,121000005,Handnet,2004,7,19
BEVL_VMM_531110,21172047,19.07.2004,Baetis,NA,11,NA,NA,121000005,Handnet,2004,7,19
BEVL_VMM_531110,21172047,19.07.2004,Chironomidae non thummi-plumosus,NA,51,NA,NA,121000005,Handnet,2004,7,19
BEVL_VMM_531110,21172047,19.07.2004,Chironomidae thummi-plumosus,NA,2,NA,NA,121000005,Handnet,2004,7,19
BEVL_VMM_531110,21172047,19.07.2004,Dytiscidae,NA,2,NA,NA,121000005,Handnet,2004,7,19
BEVL_VMM_531110,21172047,19.07.2004,Erpobdella,NA,2,NA,NA,121000005,Handnet,2004,7,19
BEVL_VMM_531110,21172047,19.07.2004,Gammaridae,NA,11,NA,NA,121000005,Handnet,2004,7,19
BEVL_VMM_531110,21172047,19.07.2004,Glossiphonia,NA,11,NA,NA,121000005,Handnet,2004,7,19
BEVL_VMM_531110,21172047,19.07.2004,Haliplidae,NA,2,NA,NA,121000005,Handnet,2004,7,19
BEVL_VMM_531110,21172047,19.07.2004,Helobdella,NA,2,NA,NA,121000005,Handnet,2004,7,19
BEVL_VMM_531110,21172047,19.07.2004,Hesperocorixa,NA,2,NA,NA,121000005,Handnet,2004,7,19
BEVL_VMM_531110,21172047,19.07.2004,Hydraenidae,NA,2,NA,NA,121000005,Handnet,2004,7,19
BEVL_VMM_531110,21172047,19.07.2004,Hydrophilidae,NA,2,NA,NA,121000005,Handnet,2004,7,19
BEVL_VMM_531110,21172047,19.07.2004,Hydropsychidae,NA,11,NA,NA,121000005,Handnet,2004,7,19
BEVL_VMM_531110,21172047,19.07.2004,Ischnura,NA,11,NA,NA,121000005,Handnet,2004,7,19
BEVL_VMM_531110,21172047,19.07.2004,Lestes,NA,1,NA,NA,121000005,Handnet,2004,7,19
BEVL_VMM_531110,21172047,19.07.2004,Limnephilidae,NA,2,NA,NA,121000005,Handnet,2004,7,19
BEVL_VMM_531110,21172047,19.07.2004,Lymnaea,NA,101,NA,NA,121000005,Handnet,2004,7,19
BEVL_VMM_531110,21172047,19.07.2004,Pisidium,NA,51,NA,NA,121000005,Handnet,2004,7,19
BEVL_VMM_531110,21172047,19.07.2004,Psychodidae,NA,2,NA,NA,121000005,Handnet,2004,7,19
BEVL_VMM_531110,21172047,19.07.2004,Sialis,NA,1,NA,NA,121000005,Handnet,2004,7,19
BEVL_VMM_531110,21172047,19.07.2004,Simuliidae,NA,2,NA,NA,121000005,Handnet,2004,7,19
BEVL_VMM_531110,21172047,19.07.2004,Stratiomyidae,NA,1,NA,NA,121000005,Handnet,2004,7,19
BEVL_VMM_531110,21172047,19.07.2004,Theromyzon,NA,1,NA,NA,121000005,Handnet,2004,7,19
BEVL_VMM_531110,21172047,19.07.2004,Tubificidae,NA,101,NA,NA,121000005,Handnet,2004,7,19
BEVL_VMM_531110,21222646,14.07.2005,Aeshna,NA,1,NA,NA,121000005,Handnet,2005,7,14
BEVL_VMM_531110,21222646,14.07.2005,Asellidae,NA,30,NA,NA,121000005,Handnet,2005,7,14
BEVL_VMM_531110,21222646,14.07.2005,Baetis,NA,40,NA,NA,121000005,Handnet,2005,7,14
BEVL_VMM_531110,21222646,14.07.2005,Chironomidae non thummi-plumosus,NA,150,NA,NA,121000005,Handnet,2005,7,14
BEVL_VMM_531110,21222646,14.07.2005,Chironomidae thummi-plumosus,NA,3,NA,NA,121000005,Handnet,2005,7,14
BEVL_VMM_531110,21222646,14.07.2005,Dendrocoelum,NA,1,NA,NA,121000005,Handnet,2005,7,14
BEVL_VMM_531110,21222646,14.07.2005,Drie doornige stekelbaars,NA,70,NA,NA,121000005,Handnet,2005,7,14
BEVL_VMM_531110,21222646,14.07.2005,Dytiscidae,NA,2,NA,NA,121000005,Handnet,2005,7,14
BEVL_VMM_531110,21222646,14.07.2005,Erpobdella,NA,51,NA,NA,121000005,Handnet,2005,7,14
BEVL_VMM_531110,21222646,14.07.2005,Gammaridae,NA,15,NA,NA,121000005,Handnet,2005,7,14
BEVL_VMM_531110,21222646,14.07.2005,Glossiphonia,NA,24,NA,NA,121000005,Handnet,2005,7,14
BEVL_VMM_531110,21222646,14.07.2005,Haliplidae,NA,9,NA,NA,121000005,Handnet,2005,7,14
BEVL_VMM_531110,21222646,14.07.2005,Helobdella,NA,3,NA,NA,121000005,Handnet,2005,7,14
BEVL_VMM_531110,21222646,14.07.2005,Hemiclepsis,NA,1,NA,NA,121000005,Handnet,2005,7,14
BEVL_VMM_531110,21222646,14.07.2005,Hesperocorixa,NA,8,NA,NA,121000005,Handnet,2005,7,14
BEVL_VMM_531110,21222646,14.07.2005,Hydraenidae,NA,2,NA,NA,121000005,Handnet,2005,7,14
BEVL_VMM_531110,21222646,14.07.2005,Hydrophilidae,NA,1,NA,NA,121000005,Handnet,2005,7,14
BEVL_VMM_531110,21222646,14.07.2005,Hydropsychidae,NA,14,NA,NA,121000005,Handnet,2005,7,14
BEVL_VMM_531110,21222646,14.07.2005,Ischnura,NA,23,NA,NA,121000005,Handnet,2005,7,14
BEVL_VMM_531110,21222646,14.07.2005,Limnephilidae,NA,1,NA,NA,121000005,Handnet,2005,7,14
BEVL_VMM_531110,21222646,14.07.2005,Lymnaea,NA,19,NA,NA,121000005,Handnet,2005,7,14
BEVL_VMM_531110,21222646,14.07.2005,Pisidium,NA,35,NA,NA,121000005,Handnet,2005,7,14
BEVL_VMM_531110,21222646,14.07.2005,Sigara,NA,4,NA,NA,121000005,Handnet,2005,7,14
BEVL_VMM_531110,21222646,14.07.2005,Theromyzon,NA,51,NA,NA,121000005,Handnet,2005,7,14
BEVL_VMM_531110,21222646,14.07.2005,Tubificidae,NA,50,NA,NA,121000005,Handnet,2005,7,14
BEVL_VMM_531110,21336970,4.9.2007,Asellidae,NA,50,NA,NA,121000005,Handnet,2007,9,4
BEVL_VMM_531110,21336970,4.9.2007,Chironomidae non thummi-plumosus,NA,30,NA,NA,121000005,Handnet,2007,9,4
BEVL_VMM_531110,21336970,4.9.2007,Chironomidae thummi-plumosus,NA,4,NA,NA,121000005,Handnet,2007,9,4
BEVL_VMM_531110,21336970,4.9.2007,Drie doornige stekelbaars,NA,6,NA,NA,121000005,Handnet,2007,9,4
BEVL_VMM_531110,21336970,4.9.2007,Dytiscidae,NA,30,NA,NA,121000005,Handnet,2007,9,4
BEVL_VMM_531110,21336970,4.9.2007,Erpobdella,NA,40,NA,NA,121000005,Handnet,2007,9,4
BEVL_VMM_531110,21336970,4.9.2007,Gammaridae,NA,50,NA,NA,121000005,Handnet,2007,9,4
BEVL_VMM_531110,21336970,4.9.2007,Gerris,NA,1,NA,NA,121000005,Handnet,2007,9,4
BEVL_VMM_531110,21336970,4.9.2007,Glossiphonia,NA,15,NA,NA,121000005,Handnet,2007,9,4
BEVL_VMM_531110,21336970,4.9.2007,Haliplidae,NA,4,NA,NA,121000005,Handnet,2007,9,4
BEVL_VMM_531110,21336970,4.9.2007,Helobdella,NA,4,NA,NA,121000005,Handnet,2007,9,4
BEVL_VMM_531110,21336970,4.9.2007,Hesperocorixa,NA,7,NA,NA,121000005,Handnet,2007,9,4
BEVL_VMM_531110,21336970,4.9.2007,Hydrophilidae,NA,1,NA,NA,121000005,Handnet,2007,9,4
BEVL_VMM_531110,21336970,4.9.2007,Hydropsychidae,NA,13,NA,NA,121000005,Handnet,2007,9,4
BEVL_VMM_531110,21336970,4.9.2007,Ischnura,NA,11,NA,NA,121000005,Handnet,2007,9,4
BEVL_VMM_531110,21336970,4.9.2007,Lymnaea,NA,30,NA,NA,121000005,Handnet,2007,9,4
BEVL_VMM_531110,21336970,4.9.2007,Notonecta,NA,3,NA,NA,121000005,Handnet,2007,9,4
BEVL_VMM_531110,21336970,4.9.2007,Pisidium,NA,40,NA,NA,121000005,Handnet,2007,9,4
BEVL_VMM_531110,21336970,4.9.2007,Simuliidae,NA,2,NA,NA,121000005,Handnet,2007,9,4
BEVL_VMM_531110,21336970,4.9.2007,Theromyzon,NA,2,NA,NA,121000005,Handnet,2007,9,4
BEVL_VMM_531110,21336970,4.9.2007,Tubificidae,NA,25,NA,NA,121000005,Handnet,2007,9,4
BEVL_VMM_531110,21437515,20.08.2009,Asellidae,NA,1,NA,NA,121000005,Handnet,2009,8,20
BEVL_VMM_531110,21437515,20.08.2009,Chironomidae non thummi-plumosus,NA,40,NA,NA,121000005,Handnet,2009,8,20
BEVL_VMM_531110,21437515,20.08.2009,Chironomidae thummi-plumosus,NA,7,NA,NA,121000005,Handnet,2009,8,20
BEVL_VMM_531110,21437515,20.08.2009,Cloeon,NA,1,NA,NA,121000005,Handnet,2009,8,20
BEVL_VMM_531110,21437515,20.08.2009,Dytiscidae,NA,3,NA,NA,121000005,Handnet,2009,8,20
BEVL_VMM_531110,21437515,20.08.2009,Erpobdella,NA,7,NA,NA,121000005,Handnet,2009,8,20
BEVL_VMM_531110,21437515,20.08.2009,Gammaridae,NA,20,NA,NA,121000005,Handnet,2009,8,20
BEVL_VMM_531110,21437515,20.08.2009,Glossiphonia,NA,2,NA,NA,121000005,Handnet,2009,8,20
BEVL_VMM_531110,21437515,20.08.2009,Helobdella,NA,2,NA,NA,121000005,Handnet,2009,8,20
BEVL_VMM_531110,21437515,20.08.2009,Hesperocorixa,NA,2,NA,NA,121000005,Handnet,2009,8,20
BEVL_VMM_531110,21437515,20.08.2009,Hippeutis,NA,2,NA,NA,121000005,Handnet,2009,8,20
BEVL_VMM_531110,21437515,20.08.2009,Hydracarina,NA,3,NA,NA,121000005,Handnet,2009,8,20
BEVL_VMM_531110,21437515,20.08.2009,Lymnaea,NA,11,NA,NA,121000005,Handnet,2009,8,20
BEVL_VMM_531110,21437515,20.08.2009,Pisidium,NA,12,NA,NA,121000005,Handnet,2009,8,20
BEVL_VMM_531110,21437515,20.08.2009,Psychodidae,NA,1,NA,NA,121000005,Handnet,2009,8,20
BEVL_VMM_531110,21437515,20.08.2009,Sigara,NA,2,NA,NA,121000005,Handnet,2009,8,20
BEVL_VMM_531110,21437515,20.08.2009,Theromyzon,NA,7,NA,NA,121000005,Handnet,2009,8,20
BEVL_VMM_531110,21437515,20.08.2009,Tipulidae,NA,1,NA,NA,121000005,Handnet,2009,8,20
BEVL_VMM_531110,21437515,20.08.2009,Tubificidae,NA,50,NA,NA,121000005,Handnet,2009,8,20
BEVL_VMM_531110,21437515,20.08.2009,Valvata,NA,2,NA,NA,121000005,Handnet,2009,8,20
BEVL_VMM_531110,21437515,20.08.2009,Vis,NA,3,NA,NA,121000005,Handnet,2009,8,20
BEVL_VMM_531110,21483049,9.7.2010,Asellidae,NA,7,NA,NA,121000005,Handnet,2010,7,9
BEVL_VMM_531110,21483049,9.7.2010,Chironomidae non thummi-plumosus,NA,30,NA,NA,121000005,Handnet,2010,7,9
BEVL_VMM_531110,21483049,9.7.2010,Chironomidae thummi-plumosus,NA,5,NA,NA,121000005,Handnet,2010,7,9
BEVL_VMM_531110,21483049,9.7.2010,Dytiscidae,NA,4,NA,NA,121000005,Handnet,2010,7,9
BEVL_VMM_531110,21483049,9.7.2010,Erpobdella,NA,4,NA,NA,121000005,Handnet,2010,7,9
BEVL_VMM_531110,21483049,9.7.2010,Gammaridae,NA,100,NA,NA,121000005,Handnet,2010,7,9
BEVL_VMM_531110,21483049,9.7.2010,Gerris,NA,2,NA,NA,121000005,Handnet,2010,7,9
BEVL_VMM_531110,21483049,9.7.2010,Glossiphonia,NA,10,NA,NA,121000005,Handnet,2010,7,9
BEVL_VMM_531110,21483049,9.7.2010,Haliplidae,NA,1,NA,NA,121000005,Handnet,2010,7,9
BEVL_VMM_531110,21483049,9.7.2010,Helobdella,NA,3,NA,NA,121000005,Handnet,2010,7,9
BEVL_VMM_531110,21483049,9.7.2010,Hesperocorixa,NA,3,NA,NA,121000005,Handnet,2010,7,9
BEVL_VMM_531110,21483049,9.7.2010,Hydracarina,NA,15,NA,NA,121000005,Handnet,2010,7,9
BEVL_VMM_531110,21483049,9.7.2010,Hydrophilidae,NA,30,NA,NA,121000005,Handnet,2010,7,9
BEVL_VMM_531110,21483049,9.7.2010,Ischnura,NA,4,NA,NA,121000005,Handnet,2010,7,9
BEVL_VMM_531110,21483049,9.7.2010,Lestes,NA,3,NA,NA,121000005,Handnet,2010,7,9
BEVL_VMM_531110,21483049,9.7.2010,Limnephilidae,NA,2,NA,NA,121000005,Handnet,2010,7,9
BEVL_VMM_531110,21483049,9.7.2010,Lymnaea,NA,80,NA,NA,121000005,Handnet,2010,7,9
BEVL_VMM_531110,21483049,9.7.2010,Naididae,NA,2,NA,NA,121000005,Handnet,2010,7,9
BEVL_VMM_531110,21483049,9.7.2010,Notonecta,NA,2,NA,NA,121000005,Handnet,2010,7,9
BEVL_VMM_531110,21483049,9.7.2010,Pisidium,NA,8,NA,NA,121000005,Handnet,2010,7,9
BEVL_VMM_531110,21483049,9.7.2010,Polycelis,NA,1,NA,NA,121000005,Handnet,2010,7,9
BEVL_VMM_531110,21483049,9.7.2010,Psychodidae,NA,2,NA,NA,121000005,Handnet,2010,7,9
BEVL_VMM_531110,21483049,9.7.2010,Sigara,NA,2,NA,NA,121000005,Handnet,2010,7,9
BEVL_VMM_531110,21483049,9.7.2010,Tubificidae,NA,20,NA,NA,121000005,Handnet,2010,7,9
BEVL_VMM_531110,21483049,9.7.2010,Velia,NA,1,NA,NA,121000005,Handnet,2010,7,9
BEVL_VMM_531110,21732150,31.08.2016,Asellidae,NA,50,NA,NA,121000005,Handnet,2016,8,31
BEVL_VMM_531110,21732150,31.08.2016,Baetis,NA,15,NA,NA,121000005,Handnet,2016,8,31
BEVL_VMM_531110,21732150,31.08.2016,Chironomidae non thummi-plumosus,NA,60,NA,NA,121000005,Handnet,2016,8,31
BEVL_VMM_531110,21732150,31.08.2016,Chironomidae thummi-plumosus,NA,20,NA,NA,121000005,Handnet,2016,8,31
BEVL_VMM_531110,21732150,31.08.2016,Cloeon,NA,3,NA,NA,121000005,Handnet,2016,8,31
BEVL_VMM_531110,21732150,31.08.2016,Dendrocoelum,NA,1,NA,NA,121000005,Handnet,2016,8,31
BEVL_VMM_531110,21732150,31.08.2016,Dytiscidae,NA,16,NA,NA,121000005,Handnet,2016,8,31
BEVL_VMM_531110,21732150,31.08.2016,Erpobdella,NA,20,NA,NA,121000005,Handnet,2016,8,31
BEVL_VMM_531110,21732150,31.08.2016,Gammaridae,NA,200,NA,NA,121000005,Handnet,2016,8,31
BEVL_VMM_531110,21732150,31.08.2016,Glossiphonia,NA,35,NA,NA,121000005,Handnet,2016,8,31
BEVL_VMM_531110,21732150,31.08.2016,Gyrinidae,NA,2,NA,NA,121000005,Handnet,2016,8,31
BEVL_VMM_531110,21732150,31.08.2016,Haliplidae,NA,4,NA,NA,121000005,Handnet,2016,8,31
BEVL_VMM_531110,21732150,31.08.2016,Helobdella,NA,4,NA,NA,121000005,Handnet,2016,8,31
BEVL_VMM_531110,21732150,31.08.2016,Hesperocorixa,NA,4,NA,NA,121000005,Handnet,2016,8,31
BEVL_VMM_531110,21732150,31.08.2016,Hydracarina,NA,50,NA,NA,121000005,Handnet,2016,8,31
BEVL_VMM_531110,21732150,31.08.2016,Hydraenidae,NA,13,NA,NA,121000005,Handnet,2016,8,31
BEVL_VMM_531110,21732150,31.08.2016,Hydrophilidae,NA,2,NA,NA,121000005,Handnet,2016,8,31
BEVL_VMM_531110,21732150,31.08.2016,Hydropsychidae,NA,9,NA,NA,121000005,Handnet,2016,8,31
BEVL_VMM_531110,21732150,31.08.2016,Ischnura,NA,1,NA,NA,121000005,Handnet,2016,8,31
BEVL_VMM_531110,21732150,31.08.2016,Lege kokers,NA,2,NA,NA,121000005,Handnet,2016,8,31
BEVL_VMM_531110,21732150,31.08.2016,Limnephilidae,NA,1,NA,NA,121000005,Handnet,2016,8,31
BEVL_VMM_531110,21732150,31.08.2016,Lymnaea,NA,35,NA,NA,121000005,Handnet,2016,8,31
BEVL_VMM_531110,21732150,31.08.2016,Notonecta,NA,2,NA,NA,121000005,Handnet,2016,8,31
BEVL_VMM_531110,21732150,31.08.2016,Pisidium,NA,100,NA,NA,121000005,Handnet,2016,8,31
BEVL_VMM_531110,21732150,31.08.2016,Psychodidae,NA,1,NA,NA,121000005,Handnet,2016,8,31
BEVL_VMM_531110,21732150,31.08.2016,Segmentina,NA,1,NA,NA,121000005,Handnet,2016,8,31
BEVL_VMM_531110,21732150,31.08.2016,Sigara,NA,4,NA,NA,121000005,Handnet,2016,8,31
BEVL_VMM_531110,21732150,31.08.2016,Simuliidae,NA,1,NA,NA,121000005,Handnet,2016,8,31
BEVL_VMM_531110,21732150,31.08.2016,Theromyzon,NA,2,NA,NA,121000005,Handnet,2016,8,31
BEVL_VMM_531110,21732150,31.08.2016,Tubificidae,NA,100,NA,NA,121000005,Handnet,2016,8,31
BEVL_VMM_531110,21732150,31.08.2016,Valvata,NA,3,NA,NA,121000005,Handnet,2016,8,31
BEVL_VMM_531110,21863861,15.07.2019,Armiger,NA,1,NA,NA,121000005,Handnet,2019,7,15
BEVL_VMM_531110,21863861,15.07.2019,Asellidae,NA,260,NA,NA,121000005,Handnet,2019,7,15
BEVL_VMM_531110,21863861,15.07.2019,Baetis,NA,2,NA,NA,121000005,Handnet,2019,7,15
BEVL_VMM_531110,21863861,15.07.2019,Bathyomphalus,NA,35,NA,NA,121000005,Handnet,2019,7,15
BEVL_VMM_531110,21863861,15.07.2019,Chironomidae non thummi-plumosus,NA,350,NA,NA,121000005,Handnet,2019,7,15
BEVL_VMM_531110,21863861,15.07.2019,Chironomidae thummi-plumosus,NA,80,NA,NA,121000005,Handnet,2019,7,15
BEVL_VMM_531110,21863861,15.07.2019,Dendrocoelum,NA,11,NA,NA,121000005,Handnet,2019,7,15
BEVL_VMM_531110,21863861,15.07.2019,Dytiscidae,NA,2,NA,NA,121000005,Handnet,2019,7,15
BEVL_VMM_531110,21863861,15.07.2019,Erpobdella,NA,14,NA,NA,121000005,Handnet,2019,7,15
BEVL_VMM_531110,21863861,15.07.2019,Gammaridae,NA,22,NA,NA,121000005,Handnet,2019,7,15
BEVL_VMM_531110,21863861,15.07.2019,Glossiphonia,NA,75,NA,NA,121000005,Handnet,2019,7,15
BEVL_VMM_531110,21863861,15.07.2019,Gyraulus,NA,210,NA,NA,121000005,Handnet,2019,7,15
BEVL_VMM_531110,21863861,15.07.2019,Haliplidae,NA,6,NA,NA,121000005,Handnet,2019,7,15
BEVL_VMM_531110,21863861,15.07.2019,Helobdella,NA,26,NA,NA,121000005,Handnet,2019,7,15
BEVL_VMM_531110,21863861,15.07.2019,Hesperocorixa,NA,1,NA,NA,121000005,Handnet,2019,7,15
BEVL_VMM_531110,21863861,15.07.2019,Hydracarina,NA,12,NA,NA,121000005,Handnet,2019,7,15
BEVL_VMM_531110,21863861,15.07.2019,Hydraenidae,NA,6,NA,NA,121000005,Handnet,2019,7,15
BEVL_VMM_531110,21863861,15.07.2019,Hydrophilidae,NA,5,NA,NA,121000005,Handnet,2019,7,15
BEVL_VMM_531110,21863861,15.07.2019,Lestes,NA,7,NA,NA,121000005,Handnet,2019,7,15
BEVL_VMM_531110,21863861,15.07.2019,Limnephilidae,NA,1,NA,NA,121000005,Handnet,2019,7,15
BEVL_VMM_531110,21863861,15.07.2019,Lymnaea,NA,80,NA,NA,121000005,Handnet,2019,7,15
BEVL_VMM_531110,21863861,15.07.2019,Pisidium,NA,400,NA,NA,121000005,Handnet,2019,7,15
BEVL_VMM_531110,21863861,15.07.2019,Polycelis,NA,80,NA,NA,121000005,Handnet,2019,7,15
BEVL_VMM_531110,21863861,15.07.2019,Psychodidae,NA,14,NA,NA,121000005,Handnet,2019,7,15
BEVL_VMM_531110,21863861,15.07.2019,Sciomyzidae,NA,2,NA,NA,121000005,Handnet,2019,7,15
BEVL_VMM_531110,21863861,15.07.2019,Segmentina,NA,14,NA,NA,121000005,Handnet,2019,7,15
BEVL_VMM_531110,21863861,15.07.2019,Theromyzon,NA,3,NA,NA,121000005,Handnet,2019,7,15
BEVL_VMM_531110,21863861,15.07.2019,Tubificidae,NA,120,NA,NA,121000005,Handnet,2019,7,15
BEVL_VMM_531110,21863861,15.07.2019,Valvata,NA,8,NA,NA,121000005,Handnet,2019,7,15
BEVL_VMM_495300,253317,16.09.1994,Asellidae,NA,11,NA,NA,121000007,Handnet,1994,9,16
BEVL_VMM_495300,253317,16.09.1994,Chironomidae non thummi-plumosus,NA,2,NA,NA,121000007,Handnet,1994,9,16
BEVL_VMM_495300,253317,16.09.1994,Chironomidae thummi-plumosus,NA,11,NA,NA,121000007,Handnet,1994,9,16
BEVL_VMM_495300,253317,16.09.1994,Enchytraeidae,NA,101,NA,NA,121000007,Handnet,1994,9,16
BEVL_VMM_495300,253317,16.09.1994,Glossiphonia,NA,2,NA,NA,121000007,Handnet,1994,9,16
BEVL_VMM_495300,253317,16.09.1994,Gyraulus,NA,11,NA,NA,121000007,Handnet,1994,9,16
BEVL_VMM_495300,253317,16.09.1994,Helobdella,NA,11,NA,NA,121000007,Handnet,1994,9,16
BEVL_VMM_495300,253317,16.09.1994,Lymnaea,NA,101,NA,NA,121000007,Handnet,1994,9,16
BEVL_VMM_495300,253317,16.09.1994,Planorbis,NA,11,NA,NA,121000007,Handnet,1994,9,16
BEVL_VMM_495300,253317,16.09.1994,Sigara,NA,2,NA,NA,121000007,Handnet,1994,9,16
BEVL_VMM_495300,253317,16.09.1994,Sphaerium,NA,2,NA,NA,121000007,Handnet,1994,9,16
BEVL_VMM_495300,253317,16.09.1994,Theromyzon,NA,2,NA,NA,121000007,Handnet,1994,9,16
BEVL_VMM_495300,253317,16.09.1994,Valvata,NA,101,NA,NA,121000007,Handnet,1994,9,16
BEVL_VMM_495300,253318,14.09.1995,Anisus,NA,11,NA,NA,121000007,Handnet,1995,9,14
BEVL_VMM_495300,253318,14.09.1995,Asellidae,NA,11,NA,NA,121000007,Handnet,1995,9,14
BEVL_VMM_495300,253318,14.09.1995,Chironomidae non thummi-plumosus,NA,2,NA,NA,121000007,Handnet,1995,9,14
BEVL_VMM_495300,253318,14.09.1995,Chironomidae thummi-plumosus,NA,11,NA,NA,121000007,Handnet,1995,9,14
BEVL_VMM_495300,253318,14.09.1995,Erpobdella,NA,11,NA,NA,121000007,Handnet,1995,9,14
BEVL_VMM_495300,253318,14.09.1995,Glossiphonia,NA,2,NA,NA,121000007,Handnet,1995,9,14
BEVL_VMM_495300,253318,14.09.1995,Gyraulus,NA,101,NA,NA,121000007,Handnet,1995,9,14
BEVL_VMM_495300,253318,14.09.1995,Haliplidae,NA,1,NA,NA,121000007,Handnet,1995,9,14
BEVL_VMM_495300,253318,14.09.1995,Helobdella,NA,11,NA,NA,121000007,Handnet,1995,9,14
BEVL_VMM_495300,253318,14.09.1995,Hippeutis,NA,2,NA,NA,121000007,Handnet,1995,9,14
BEVL_VMM_495300,253318,14.09.1995,Ischnura,NA,1,NA,NA,121000007,Handnet,1995,9,14
BEVL_VMM_495300,253318,14.09.1995,Lymnaea,NA,101,NA,NA,121000007,Handnet,1995,9,14
BEVL_VMM_495300,253318,14.09.1995,Naididae,NA,101,NA,NA,121000007,Handnet,1995,9,14
BEVL_VMM_495300,253318,14.09.1995,Physa,NA,51,NA,NA,121000007,Handnet,1995,9,14
BEVL_VMM_495300,253318,14.09.1995,Planorbis,NA,11,NA,NA,121000007,Handnet,1995,9,14
BEVL_VMM_495300,253318,14.09.1995,Sphaerium,NA,11,NA,NA,121000007,Handnet,1995,9,14
BEVL_VMM_495300,253318,14.09.1995,Theromyzon,NA,2,NA,NA,121000007,Handnet,1995,9,14
BEVL_VMM_495300,253318,14.09.1995,Valvata,NA,101,NA,NA,121000007,Handnet,1995,9,14
BEVL_VMM_495300,982653,11.9.1997,Asellidae,NA,2,NA,NA,121000007,Handnet,1997,9,11
BEVL_VMM_495300,982653,11.9.1997,Ceratopogonidae,NA,2,NA,NA,121000007,Handnet,1997,9,11
BEVL_VMM_495300,982653,11.9.1997,Chironomidae thummi-plumosus,NA,2,NA,NA,121000007,Handnet,1997,9,11
BEVL_VMM_495300,982653,11.9.1997,Dytiscidae,NA,2,NA,NA,121000007,Handnet,1997,9,11
BEVL_VMM_495300,982653,11.9.1997,Erpobdella,NA,11,NA,NA,121000007,Handnet,1997,9,11
BEVL_VMM_495300,982653,11.9.1997,Glossiphonia,NA,11,NA,NA,121000007,Handnet,1997,9,11
BEVL_VMM_495300,982653,11.9.1997,Helobdella,NA,51,NA,NA,121000007,Handnet,1997,9,11
BEVL_VMM_495300,982653,11.9.1997,Ilyocoris,NA,1,NA,NA,121000007,Handnet,1997,9,11
BEVL_VMM_495300,982653,11.9.1997,Lymnaea,NA,2,NA,NA,121000007,Handnet,1997,9,11
BEVL_VMM_495300,982653,11.9.1997,Naididae,NA,101,NA,NA,121000007,Handnet,1997,9,11
BEVL_VMM_495300,982653,11.9.1997,Planorbarius,NA,2,NA,NA,121000007,Handnet,1997,9,11
BEVL_VMM_495300,982653,11.9.1997,Planorbis,NA,11,NA,NA,121000007,Handnet,1997,9,11
BEVL_VMM_495300,982653,11.9.1997,Sigara,NA,2,NA,NA,121000007,Handnet,1997,9,11
BEVL_VMM_495300,982653,11.9.1997,Sphaerium,NA,11,NA,NA,121000007,Handnet,1997,9,11
BEVL_VMM_495300,982653,11.9.1997,Theromyzon,NA,2,NA,NA,121000007,Handnet,1997,9,11
BEVL_VMM_495300,982653,11.9.1997,Valvata,NA,51,NA,NA,121000007,Handnet,1997,9,11
BEVL_VMM_495300,21094713,9.8.2002,Anisus,NA,3,NA,NA,121000007,Handnet,2002,8,9
BEVL_VMM_495300,21094713,9.8.2002,Bithynia,NA,11,NA,NA,121000007,Handnet,2002,8,9
BEVL_VMM_495300,21094713,9.8.2002,Chironomidae non thummi-plumosus,NA,11,NA,NA,121000007,Handnet,2002,8,9
BEVL_VMM_495300,21094713,9.8.2002,Chironomidae thummi-plumosus,NA,11,NA,NA,121000007,Handnet,2002,8,9
BEVL_VMM_495300,21094713,9.8.2002,Cloeon,NA,2,NA,NA,121000007,Handnet,2002,8,9
BEVL_VMM_495300,21094713,9.8.2002,Culicidae,NA,1,NA,NA,121000007,Handnet,2002,8,9
BEVL_VMM_495300,21094713,9.8.2002,Dytiscidae,NA,1,NA,NA,121000007,Handnet,2002,8,9
BEVL_VMM_495300,21094713,9.8.2002,Erpobdella,NA,11,NA,NA,121000007,Handnet,2002,8,9
BEVL_VMM_495300,21094713,9.8.2002,Glossiphonia,NA,11,NA,NA,121000007,Handnet,2002,8,9
BEVL_VMM_495300,21094713,9.8.2002,Gyraulus,NA,2,NA,NA,121000007,Handnet,2002,8,9
BEVL_VMM_495300,21094713,9.8.2002,Haliplidae,NA,3,NA,NA,121000007,Handnet,2002,8,9
BEVL_VMM_495300,21094713,9.8.2002,Helobdella,NA,11,NA,NA,121000007,Handnet,2002,8,9
BEVL_VMM_495300,21094713,9.8.2002,Lumbriculidae,NA,51,NA,NA,121000007,Handnet,2002,8,9
BEVL_VMM_495300,21094713,9.8.2002,Lymnaea,NA,51,NA,NA,121000007,Handnet,2002,8,9
BEVL_VMM_495300,21094713,9.8.2002,Ostracoda,NA,2,NA,NA,121000007,Handnet,2002,8,9
BEVL_VMM_495300,21094713,9.8.2002,Physa,NA,4,NA,NA,121000007,Handnet,2002,8,9
BEVL_VMM_495300,21094713,9.8.2002,Pisidium,NA,11,NA,NA,121000007,Handnet,2002,8,9
BEVL_VMM_495300,21094713,9.8.2002,Planorbarius,NA,11,NA,NA,121000007,Handnet,2002,8,9
BEVL_VMM_495300,21094713,9.8.2002,Segmentina,NA,2,NA,NA,121000007,Handnet,2002,8,9
BEVL_VMM_495300,21094713,9.8.2002,Sigara,NA,5,NA,NA,121000007,Handnet,2002,8,9
BEVL_VMM_495300,21094713,9.8.2002,Sphaerium,NA,101,NA,NA,121000007,Handnet,2002,8,9
BEVL_VMM_495300,21094713,9.8.2002,Theromyzon,NA,1,NA,NA,121000007,Handnet,2002,8,9
BEVL_VMM_495300,21094713,9.8.2002,Tubificidae,NA,101,NA,NA,121000007,Handnet,2002,8,9
BEVL_VMM_495300,21094713,9.8.2002,Valvata,NA,101,NA,NA,121000007,Handnet,2002,8,9
BEVL_VMM_495300,21441700,16.09.2009,Anisus,NA,10,NA,NA,121000007,Handnet,2009,9,16
BEVL_VMM_495300,21441700,16.09.2009,Armiger,NA,2,NA,NA,121000007,Handnet,2009,9,16
BEVL_VMM_495300,21441700,16.09.2009,Asellidae,NA,200,NA,NA,121000007,Handnet,2009,9,16
BEVL_VMM_495300,21441700,16.09.2009,Bithynia,NA,50,NA,NA,121000007,Handnet,2009,9,16
BEVL_VMM_495300,21441700,16.09.2009,Caenis,NA,1,NA,NA,121000007,Handnet,2009,9,16
BEVL_VMM_495300,21441700,16.09.2009,Chironomidae non thummi-plumosus,NA,20,NA,NA,121000007,Handnet,2009,9,16
BEVL_VMM_495300,21441700,16.09.2009,Chironomidae thummi-plumosus,NA,15,NA,NA,121000007,Handnet,2009,9,16
BEVL_VMM_495300,21441700,16.09.2009,Cloeon,NA,15,NA,NA,121000007,Handnet,2009,9,16
BEVL_VMM_495300,21441700,16.09.2009,Corixa,NA,4,NA,NA,121000007,Handnet,2009,9,16
BEVL_VMM_495300,21441700,16.09.2009,Crangonyctidae,NA,200,NA,NA,121000007,Handnet,2009,9,16
BEVL_VMM_495300,21441700,16.09.2009,Dytiscidae,NA,30,NA,NA,121000007,Handnet,2009,9,16
BEVL_VMM_495300,21441700,16.09.2009,Erpobdella,NA,40,NA,NA,121000007,Handnet,2009,9,16
BEVL_VMM_495300,21441700,16.09.2009,Glossiphonia,NA,10,NA,NA,121000007,Handnet,2009,9,16
BEVL_VMM_495300,21441700,16.09.2009,Gyraulus,NA,11,NA,NA,121000007,Handnet,2009,9,16
BEVL_VMM_495300,21441700,16.09.2009,Haliplidae,NA,50,NA,NA,121000007,Handnet,2009,9,16
BEVL_VMM_495300,21441700,16.09.2009,Helobdella,NA,9,NA,NA,121000007,Handnet,2009,9,16
BEVL_VMM_495300,21441700,16.09.2009,Hydracarina,NA,30,NA,NA,121000007,Handnet,2009,9,16
BEVL_VMM_495300,21441700,16.09.2009,Hygrobiidae,NA,12,NA,NA,121000007,Handnet,2009,9,16
BEVL_VMM_495300,21441700,16.09.2009,Ischnura,NA,15,NA,NA,121000007,Handnet,2009,9,16
BEVL_VMM_495300,21441700,16.09.2009,Leptoceridae,NA,1,NA,NA,121000007,Handnet,2009,9,16
BEVL_VMM_495300,21441700,16.09.2009,Lymnaea,NA,9,NA,NA,121000007,Handnet,2009,9,16
BEVL_VMM_495300,21441700,16.09.2009,Physa,NA,15,NA,NA,121000007,Handnet,2009,9,16
BEVL_VMM_495300,21441700,16.09.2009,Pisidium,NA,50,NA,NA,121000007,Handnet,2009,9,16
BEVL_VMM_495300,21441700,16.09.2009,Planorbarius,NA,25,NA,NA,121000007,Handnet,2009,9,16
BEVL_VMM_495300,21441700,16.09.2009,Planorbis,NA,2,NA,NA,121000007,Handnet,2009,9,16
BEVL_VMM_495300,21441700,16.09.2009,Plea,NA,1,NA,NA,121000007,Handnet,2009,9,16
BEVL_VMM_495300,21441700,16.09.2009,Sialis,NA,2,NA,NA,121000007,Handnet,2009,9,16
BEVL_VMM_495300,21441700,16.09.2009,Sigara,NA,35,NA,NA,121000007,Handnet,2009,9,16
BEVL_VMM_495300,21441700,16.09.2009,Sphaerium,NA,50,NA,NA,121000007,Handnet,2009,9,16
BEVL_VMM_495300,21441700,16.09.2009,Theromyzon,NA,4,NA,NA,121000007,Handnet,2009,9,16
BEVL_VMM_495300,21441700,16.09.2009,Tubificidae,NA,500,NA,NA,121000007,Handnet,2009,9,16
BEVL_VMM_495300,21441700,16.09.2009,Valvata,NA,1000,NA,NA,121000007,Handnet,2009,9,16
BEVL_VMM_495300,21485820,28.07.2010,Asellidae,NA,2,NA,NA,121000007,Handnet,2010,7,28
BEVL_VMM_495300,21485820,28.07.2010,Bithynia,NA,50,NA,NA,121000007,Handnet,2010,7,28
BEVL_VMM_495300,21485820,28.07.2010,Caenis,NA,1,NA,NA,121000007,Handnet,2010,7,28
BEVL_VMM_495300,21485820,28.07.2010,Chironomidae non thummi-plumosus,NA,1,NA,NA,121000007,Handnet,2010,7,28
BEVL_VMM_495300,21485820,28.07.2010,Chironomidae thummi-plumosus,NA,4,NA,NA,121000007,Handnet,2010,7,28
BEVL_VMM_495300,21485820,28.07.2010,Corixa,NA,1,NA,NA,121000007,Handnet,2010,7,28
BEVL_VMM_495300,21485820,28.07.2010,Dugesia,NA,1,NA,NA,121000007,Handnet,2010,7,28
BEVL_VMM_495300,21485820,28.07.2010,Dytiscidae,NA,2,NA,NA,121000007,Handnet,2010,7,28
BEVL_VMM_495300,21485820,28.07.2010,Erpobdella,NA,40,NA,NA,121000007,Handnet,2010,7,28
BEVL_VMM_495300,21485820,28.07.2010,Glossiphonia,NA,20,NA,NA,121000007,Handnet,2010,7,28
BEVL_VMM_495300,21485820,28.07.2010,Gyraulus,NA,11,NA,NA,121000007,Handnet,2010,7,28
BEVL_VMM_495300,21485820,28.07.2010,Haliplidae,NA,3,NA,NA,121000007,Handnet,2010,7,28
BEVL_VMM_495300,21485820,28.07.2010,Helobdella,NA,30,NA,NA,121000007,Handnet,2010,7,28
BEVL_VMM_495300,21485820,28.07.2010,Hydracarina,NA,3,NA,NA,121000007,Handnet,2010,7,28
BEVL_VMM_495300,21485820,28.07.2010,Lymnaea,NA,7,NA,NA,121000007,Handnet,2010,7,28
BEVL_VMM_495300,21485820,28.07.2010,Pisidium,NA,40,NA,NA,121000007,Handnet,2010,7,28
BEVL_VMM_495300,21485820,28.07.2010,Psychodidae,NA,4,NA,NA,121000007,Handnet,2010,7,28
BEVL_VMM_495300,21485820,28.07.2010,Scathophagidae,NA,1,NA,NA,121000007,Handnet,2010,7,28
BEVL_VMM_495300,21485820,28.07.2010,Sialis,NA,2,NA,NA,121000007,Handnet,2010,7,28
BEVL_VMM_495300,21485820,28.07.2010,Sigara,NA,1,NA,NA,121000007,Handnet,2010,7,28
BEVL_VMM_495300,21485820,28.07.2010,Sphaerium,NA,30,NA,NA,121000007,Handnet,2010,7,28
BEVL_VMM_495300,21485820,28.07.2010,Syrphidae-Eristalinae,NA,15,NA,NA,121000007,Handnet,2010,7,28
BEVL_VMM_495300,21485820,28.07.2010,Theromyzon,NA,2,NA,NA,121000007,Handnet,2010,7,28
BEVL_VMM_495300,21485820,28.07.2010,Trocheta,NA,50,NA,NA,121000007,Handnet,2010,7,28
BEVL_VMM_495300,21485820,28.07.2010,Tubificidae,NA,150,NA,NA,121000007,Handnet,2010,7,28
BEVL_VMM_495300,21485820,28.07.2010,Valvata,NA,1000,NA,NA,121000007,Handnet,2010,7,28
BEVL_VMM_495300,21733363,16.09.2016,Anax,NA,2,NA,NA,121000007,Handnet,2016,9,16
BEVL_VMM_495300,21733363,16.09.2016,Anisus,NA,150,NA,NA,121000007,Handnet,2016,9,16
BEVL_VMM_495300,21733363,16.09.2016,Asellidae,NA,400,NA,NA,121000007,Handnet,2016,9,16
BEVL_VMM_495300,21733363,16.09.2016,Bithynia,NA,400,NA,NA,121000007,Handnet,2016,9,16
BEVL_VMM_495300,21733363,16.09.2016,Chironomidae non thummi-plumosus,NA,5,NA,NA,121000007,Handnet,2016,9,16
BEVL_VMM_495300,21733363,16.09.2016,Chironomidae thummi-plumosus,NA,9,NA,NA,121000007,Handnet,2016,9,16
BEVL_VMM_495300,21733363,16.09.2016,Cloeon,NA,1000,NA,NA,121000007,Handnet,2016,9,16
BEVL_VMM_495300,21733363,16.09.2016,Corixa,NA,32,NA,NA,121000007,Handnet,2016,9,16
BEVL_VMM_495300,21733363,16.09.2016,Crangonyctidae,NA,500,NA,NA,121000007,Handnet,2016,9,16
BEVL_VMM_495300,21733363,16.09.2016,Dendrocoelum,NA,1,NA,NA,121000007,Handnet,2016,9,16
BEVL_VMM_495300,21733363,16.09.2016,Dryopidae,NA,2,NA,NA,121000007,Handnet,2016,9,16
BEVL_VMM_495300,21733363,16.09.2016,Dugesia,NA,3,NA,NA,121000007,Handnet,2016,9,16
BEVL_VMM_495300,21733363,16.09.2016,Dytiscidae,NA,15,NA,NA,121000007,Handnet,2016,9,16
BEVL_VMM_495300,21733363,16.09.2016,Erpobdella,NA,40,NA,NA,121000007,Handnet,2016,9,16
BEVL_VMM_495300,21733363,16.09.2016,Glossiphonia,NA,150,NA,NA,121000007,Handnet,2016,9,16
BEVL_VMM_495300,21733363,16.09.2016,Gyraulus,NA,40,NA,NA,121000007,Handnet,2016,9,16
BEVL_VMM_495300,21733363,16.09.2016,Haliplidae,NA,15,NA,NA,121000007,Handnet,2016,9,16
BEVL_VMM_495300,21733363,16.09.2016,Helobdella,NA,150,NA,NA,121000007,Handnet,2016,9,16
BEVL_VMM_495300,21733363,16.09.2016,Hesperocorixa,NA,10,NA,NA,121000007,Handnet,2016,9,16
BEVL_VMM_495300,21733363,16.09.2016,Hydracarina,NA,100,NA,NA,121000007,Handnet,2016,9,16
BEVL_VMM_495300,21733363,16.09.2016,Ilyocoris,NA,30,NA,NA,121000007,Handnet,2016,9,16
BEVL_VMM_495300,21733363,16.09.2016,Ischnura,NA,17,NA,NA,121000007,Handnet,2016,9,16
BEVL_VMM_495300,21733363,16.09.2016,Lymnaea,NA,1,NA,NA,121000007,Handnet,2016,9,16
BEVL_VMM_495300,21733363,16.09.2016,Notonecta,NA,12,NA,NA,121000007,Handnet,2016,9,16
BEVL_VMM_495300,21733363,16.09.2016,Physa,NA,6,NA,NA,121000007,Handnet,2016,9,16
BEVL_VMM_495300,21733363,16.09.2016,Pisidium,NA,4,NA,NA,121000007,Handnet,2016,9,16
BEVL_VMM_495300,21733363,16.09.2016,Planaria,NA,100,NA,NA,121000007,Handnet,2016,9,16
BEVL_VMM_495300,21733363,16.09.2016,Planorbarius,NA,8,NA,NA,121000007,Handnet,2016,9,16
BEVL_VMM_495300,21733363,16.09.2016,Planorbis,NA,1,NA,NA,121000007,Handnet,2016,9,16
BEVL_VMM_495300,21733363,16.09.2016,Plea,NA,25,NA,NA,121000007,Handnet,2016,9,16
BEVL_VMM_495300,21733363,16.09.2016,Psychodidae,NA,3,NA,NA,121000007,Handnet,2016,9,16
BEVL_VMM_495300,21733363,16.09.2016,Segmentina,NA,8,NA,NA,121000007,Handnet,2016,9,16
BEVL_VMM_495300,21733363,16.09.2016,Sigara,NA,1,NA,NA,121000007,Handnet,2016,9,16
BEVL_VMM_495300,21733363,16.09.2016,Sphaerium,NA,60,NA,NA,121000007,Handnet,2016,9,16
BEVL_VMM_495300,21733363,16.09.2016,Theromyzon,NA,20,NA,NA,121000007,Handnet,2016,9,16
BEVL_VMM_495300,21733363,16.09.2016,Tubificidae,NA,750,NA,NA,121000007,Handnet,2016,9,16
BEVL_VMM_495300,21733363,16.09.2016,Valvata,NA,800,NA,NA,121000007,Handnet,2016,9,16
BEVL_VMM_495300,21733363,16.09.2016,Viviparus,NA,10,NA,NA,121000007,Handnet,2016,9,16
BEVL_VMM_495300,21873619,25.09.2019,Anisus,NA,39,NA,NA,121000007,Handnet,2019,9,25
BEVL_VMM_495300,21873619,25.09.2019,Asellidae,NA,22,NA,NA,121000007,Handnet,2019,9,25
BEVL_VMM_495300,21873619,25.09.2019,Bathyomphalus,NA,1,NA,NA,121000007,Handnet,2019,9,25
BEVL_VMM_495300,21873619,25.09.2019,Bithynia,NA,170,NA,NA,121000007,Handnet,2019,9,25
BEVL_VMM_495300,21873619,25.09.2019,Caenis,NA,11,NA,NA,121000007,Handnet,2019,9,25
BEVL_VMM_495300,21873619,25.09.2019,Callicorixa,NA,3,NA,NA,121000007,Handnet,2019,9,25
BEVL_VMM_495300,21873619,25.09.2019,Chaoboridae,NA,3,NA,NA,121000007,Handnet,2019,9,25
BEVL_VMM_495300,21873619,25.09.2019,Chironomidae non thummi-plumosus,NA,2,NA,NA,121000007,Handnet,2019,9,25
BEVL_VMM_495300,21873619,25.09.2019,Cloeon,NA,1200,NA,NA,121000007,Handnet,2019,9,25
BEVL_VMM_495300,21873619,25.09.2019,Coenagrion,NA,2,NA,NA,121000007,Handnet,2019,9,25
BEVL_VMM_495300,21873619,25.09.2019,Corixa,NA,3,NA,NA,121000007,Handnet,2019,9,25
BEVL_VMM_495300,21873619,25.09.2019,Crangonyctidae,NA,120,NA,NA,121000007,Handnet,2019,9,25
BEVL_VMM_495300,21873619,25.09.2019,Cymatia,NA,2,NA,NA,121000007,Handnet,2019,9,25
BEVL_VMM_495300,21873619,25.09.2019,Dugesia,NA,50,NA,NA,121000007,Handnet,2019,9,25
BEVL_VMM_495300,21873619,25.09.2019,Erpobdella,NA,6,NA,NA,121000007,Handnet,2019,9,25
BEVL_VMM_495300,21873619,25.09.2019,Glossiphonia,NA,35,NA,NA,121000007,Handnet,2019,9,25
BEVL_VMM_495300,21873619,25.09.2019,Gyraulus,NA,330,NA,NA,121000007,Handnet,2019,9,25
BEVL_VMM_495300,21873619,25.09.2019,Haliplidae,NA,40,NA,NA,121000007,Handnet,2019,9,25
BEVL_VMM_495300,21873619,25.09.2019,Helobdella,NA,280,NA,NA,121000007,Handnet,2019,9,25
BEVL_VMM_495300,21873619,25.09.2019,Hesperocorixa,NA,2,NA,NA,121000007,Handnet,2019,9,25
BEVL_VMM_495300,21873619,25.09.2019,Hydracarina,NA,10,NA,NA,121000007,Handnet,2019,9,25
BEVL_VMM_495300,21873619,25.09.2019,Ilyocoris,NA,8,NA,NA,121000007,Handnet,2019,9,25
BEVL_VMM_495300,21873619,25.09.2019,Ischnura,NA,15,NA,NA,121000007,Handnet,2019,9,25
BEVL_VMM_495300,21873619,25.09.2019,Leptoceridae,NA,1,NA,NA,121000007,Handnet,2019,9,25
BEVL_VMM_495300,21873619,25.09.2019,Lymnaea,NA,34,NA,NA,121000007,Handnet,2019,9,25
BEVL_VMM_495300,21873619,25.09.2019,Naididae,NA,20,NA,NA,121000007,Handnet,2019,9,25
BEVL_VMM_495300,21873619,25.09.2019,Noteridae,NA,1,NA,NA,121000007,Handnet,2019,9,25
BEVL_VMM_495300,21873619,25.09.2019,Physa,NA,165,NA,NA,121000007,Handnet,2019,9,25
BEVL_VMM_495300,21873619,25.09.2019,Planorbarius,NA,11,NA,NA,121000007,Handnet,2019,9,25
BEVL_VMM_495300,21873619,25.09.2019,Planorbis,NA,2,NA,NA,121000007,Handnet,2019,9,25
BEVL_VMM_495300,21873619,25.09.2019,Plea,NA,10,NA,NA,121000007,Handnet,2019,9,25
BEVL_VMM_495300,21873619,25.09.2019,Psychodidae,NA,17,NA,NA,121000007,Handnet,2019,9,25
BEVL_VMM_495300,21873619,25.09.2019,Segmentina,NA,220,NA,NA,121000007,Handnet,2019,9,25
BEVL_VMM_495300,21873619,25.09.2019,Sigara,NA,370,NA,NA,121000007,Handnet,2019,9,25
BEVL_VMM_495300,21873619,25.09.2019,Sphaerium,NA,70,NA,NA,121000007,Handnet,2019,9,25
BEVL_VMM_495300,21873619,25.09.2019,Theromyzon,NA,4,NA,NA,121000007,Handnet,2019,9,25
BEVL_VMM_495300,21873619,25.09.2019,Tubificidae,NA,2,NA,NA,121000007,Handnet,2019,9,25
BEVL_VMM_495300,21873619,25.09.2019,Valvata,NA,7000,NA,NA,121000007,Handnet,2019,9,25
BEVL_VMM_84000,250691,22.07.1991,Ancylus,NA,11,NA,NA,121000010,Handnet,1991,7,22
BEVL_VMM_84000,250691,22.07.1991,Asellidae,NA,11,NA,NA,121000010,Handnet,1991,7,22
BEVL_VMM_84000,250691,22.07.1991,Baetis,NA,51,NA,NA,121000010,Handnet,1991,7,22
BEVL_VMM_84000,250691,22.07.1991,Chironomidae non thummi-plumosus,NA,101,NA,NA,121000010,Handnet,1991,7,22
BEVL_VMM_84000,250691,22.07.1991,Chironomidae thummi-plumosus,NA,11,NA,NA,121000010,Handnet,1991,7,22
BEVL_VMM_84000,250691,22.07.1991,Dytiscidae,NA,2,NA,NA,121000010,Handnet,1991,7,22
BEVL_VMM_84000,250691,22.07.1991,Erpobdella,NA,11,NA,NA,121000010,Handnet,1991,7,22
BEVL_VMM_84000,250691,22.07.1991,Gammaridae,NA,11,NA,NA,121000010,Handnet,1991,7,22
BEVL_VMM_84000,250691,22.07.1991,Haliplidae,NA,2,NA,NA,121000010,Handnet,1991,7,22
BEVL_VMM_84000,250691,22.07.1991,Helobdella,NA,2,NA,NA,121000010,Handnet,1991,7,22
BEVL_VMM_84000,250691,22.07.1991,Hydraenidae,NA,2,NA,NA,121000010,Handnet,1991,7,22
BEVL_VMM_84000,250691,22.07.1991,Hydropsychidae,NA,11,NA,NA,121000010,Handnet,1991,7,22
BEVL_VMM_84000,250691,22.07.1991,Limnephilidae,NA,2,NA,NA,121000010,Handnet,1991,7,22
BEVL_VMM_84000,250691,22.07.1991,Limoniidae,NA,1,NA,NA,121000010,Handnet,1991,7,22
BEVL_VMM_84000,250691,22.07.1991,Lymnaea,NA,11,NA,NA,121000010,Handnet,1991,7,22
BEVL_VMM_84000,250691,22.07.1991,Naididae,NA,101,NA,NA,121000010,Handnet,1991,7,22
BEVL_VMM_84000,250691,22.07.1991,Pisidium,NA,2,NA,NA,121000010,Handnet,1991,7,22
BEVL_VMM_84000,250691,22.07.1991,Sialis,NA,1,NA,NA,121000010,Handnet,1991,7,22
BEVL_VMM_84000,250691,22.07.1991,Simuliidae,NA,11,NA,NA,121000010,Handnet,1991,7,22
BEVL_VMM_84000,250691,22.07.1991,Sphaerium,NA,11,NA,NA,121000010,Handnet,1991,7,22
BEVL_VMM_84000,250691,22.07.1991,Tipulidae,NA,11,NA,NA,121000010,Handnet,1991,7,22
BEVL_VMM_84000,250691,22.07.1991,Tubificidae,NA,11,NA,NA,121000010,Handnet,1991,7,22
BEVL_VMM_84000,250693,13.07.1993,Ancylus,NA,2,NA,NA,121000010,Handnet,1993,7,13
BEVL_VMM_84000,250693,13.07.1993,Asellidae,NA,11,NA,NA,121000010,Handnet,1993,7,13
BEVL_VMM_84000,250693,13.07.1993,Baetis,NA,51,NA,NA,121000010,Handnet,1993,7,13
BEVL_VMM_84000,250693,13.07.1993,Chironomidae non thummi-plumosus,NA,51,NA,NA,121000010,Handnet,1993,7,13
BEVL_VMM_84000,250693,13.07.1993,Chironomidae thummi-plumosus,NA,2,NA,NA,121000010,Handnet,1993,7,13
BEVL_VMM_84000,250693,13.07.1993,Copepoda,NA,1,NA,NA,121000010,Handnet,1993,7,13
BEVL_VMM_84000,250693,13.07.1993,Erpobdella,NA,11,NA,NA,121000010,Handnet,1993,7,13
BEVL_VMM_84000,250693,13.07.1993,Gammaridae,NA,2,NA,NA,121000010,Handnet,1993,7,13
BEVL_VMM_84000,250693,13.07.1993,Glossiphonia,NA,1,NA,NA,121000010,Handnet,1993,7,13
BEVL_VMM_84000,250693,13.07.1993,Gyraulus,NA,2,NA,NA,121000010,Handnet,1993,7,13
BEVL_VMM_84000,250693,13.07.1993,Helobdella,NA,2,NA,NA,121000010,Handnet,1993,7,13
BEVL_VMM_84000,250693,13.07.1993,Hydraenidae,NA,1,NA,NA,121000010,Handnet,1993,7,13
BEVL_VMM_84000,250693,13.07.1993,Hydrophilidae,NA,2,NA,NA,121000010,Handnet,1993,7,13
BEVL_VMM_84000,250693,13.07.1993,Hydropsychidae,NA,11,NA,NA,121000010,Handnet,1993,7,13
BEVL_VMM_84000,250693,13.07.1993,Leptoceridae,NA,2,NA,NA,121000010,Handnet,1993,7,13
BEVL_VMM_84000,250693,13.07.1993,Limnephilidae,NA,2,NA,NA,121000010,Handnet,1993,7,13
BEVL_VMM_84000,250693,13.07.1993,Limoniidae,NA,2,NA,NA,121000010,Handnet,1993,7,13
BEVL_VMM_84000,250693,13.07.1993,Lymnaea,NA,2,NA,NA,121000010,Handnet,1993,7,13
BEVL_VMM_84000,250693,13.07.1993,Naididae,NA,51,NA,NA,121000010,Handnet,1993,7,13
BEVL_VMM_84000,250693,13.07.1993,Nepa,NA,2,NA,NA,121000010,Handnet,1993,7,13
BEVL_VMM_84000,250693,13.07.1993,Psychodidae,NA,2,NA,NA,121000010,Handnet,1993,7,13
BEVL_VMM_84000,250693,13.07.1993,Sigara,NA,2,NA,NA,121000010,Handnet,1993,7,13
BEVL_VMM_84000,250693,13.07.1993,Simuliidae,NA,2,NA,NA,121000010,Handnet,1993,7,13
BEVL_VMM_84000,250693,13.07.1993,Sphaerium,NA,11,NA,NA,121000010,Handnet,1993,7,13
BEVL_VMM_84000,250693,13.07.1993,Tubificidae,NA,2,NA,NA,121000010,Handnet,1993,7,13
BEVL_VMM_84000,324767,1.7.1996,Ancylus,NA,2,NA,NA,121000010,Handnet,1996,7,1
BEVL_VMM_84000,324767,1.7.1996,Asellidae,NA,11,NA,NA,121000010,Handnet,1996,7,1
BEVL_VMM_84000,324767,1.7.1996,Baetis,NA,2,NA,NA,121000010,Handnet,1996,7,1
BEVL_VMM_84000,324767,1.7.1996,Ceratopogonidae,NA,1,NA,NA,121000010,Handnet,1996,7,1
BEVL_VMM_84000,324767,1.7.1996,Chironomidae non thummi-plumosus,NA,51,NA,NA,121000010,Handnet,1996,7,1
BEVL_VMM_84000,324767,1.7.1996,Chironomidae thummi-plumosus,NA,11,NA,NA,121000010,Handnet,1996,7,1
BEVL_VMM_84000,324767,1.7.1996,Daphnia,NA,1,NA,NA,121000010,Handnet,1996,7,1
BEVL_VMM_84000,324767,1.7.1996,Dytiscidae,NA,2,NA,NA,121000010,Handnet,1996,7,1
BEVL_VMM_84000,324767,1.7.1996,Erpobdella,NA,11,NA,NA,121000010,Handnet,1996,7,1
BEVL_VMM_84000,324767,1.7.1996,Gammaridae,NA,11,NA,NA,121000010,Handnet,1996,7,1
BEVL_VMM_84000,324767,1.7.1996,Glossiphonia,NA,2,NA,NA,121000010,Handnet,1996,7,1
BEVL_VMM_84000,324767,1.7.1996,Gyraulus,NA,2,NA,NA,121000010,Handnet,1996,7,1
BEVL_VMM_84000,324767,1.7.1996,Lege kokers,NA,1,NA,NA,121000010,Handnet,1996,7,1
BEVL_VMM_84000,324767,1.7.1996,Lestes,NA,2,NA,NA,121000010,Handnet,1996,7,1
BEVL_VMM_84000,324767,1.7.1996,Limnephilidae,NA,2,NA,NA,121000010,Handnet,1996,7,1
BEVL_VMM_84000,324767,1.7.1996,Lymnaea,NA,2,NA,NA,121000010,Handnet,1996,7,1
BEVL_VMM_84000,324767,1.7.1996,Naididae,NA,101,NA,NA,121000010,Handnet,1996,7,1
BEVL_VMM_84000,324767,1.7.1996,Sialis,NA,2,NA,NA,121000010,Handnet,1996,7,1
BEVL_VMM_84000,324767,1.7.1996,Sphaerium,NA,11,NA,NA,121000010,Handnet,1996,7,1
BEVL_VMM_84000,324767,1.7.1996,Tubificidae,NA,101,NA,NA,121000010,Handnet,1996,7,1
BEVL_VMM_84000,11023092,22.09.1999,Anisus,NA,1,NA,NA,121000010,Handnet,1999,9,22
BEVL_VMM_84000,11023092,22.09.1999,Asellidae,NA,11,NA,NA,121000010,Handnet,1999,9,22
BEVL_VMM_84000,11023092,22.09.1999,Baetis,NA,11,NA,NA,121000010,Handnet,1999,9,22
BEVL_VMM_84000,11023092,22.09.1999,Beraeidae,NA,2,NA,NA,121000010,Handnet,1999,9,22
BEVL_VMM_84000,11023092,22.09.1999,Calopteryx,NA,11,NA,NA,121000010,Handnet,1999,9,22
BEVL_VMM_84000,11023092,22.09.1999,Chironomidae non thummi-plumosus,NA,1,NA,NA,121000010,Handnet,1999,9,22
BEVL_VMM_84000,11023092,22.09.1999,Collembola,NA,1,NA,NA,121000010,Handnet,1999,9,22
BEVL_VMM_84000,11023092,22.09.1999,Dendrocoelum,NA,2,NA,NA,121000010,Handnet,1999,9,22
BEVL_VMM_84000,11023092,22.09.1999,Dugesia,NA,2,NA,NA,121000010,Handnet,1999,9,22
BEVL_VMM_84000,11023092,22.09.1999,Dytiscidae,NA,2,NA,NA,121000010,Handnet,1999,9,22
BEVL_VMM_84000,11023092,22.09.1999,Erpobdella,NA,11,NA,NA,121000010,Handnet,1999,9,22
BEVL_VMM_84000,11023092,22.09.1999,Gammaridae,NA,101,NA,NA,121000010,Handnet,1999,9,22
BEVL_VMM_84000,11023092,22.09.1999,Gerris,NA,2,NA,NA,121000010,Handnet,1999,9,22
BEVL_VMM_84000,11023092,22.09.1999,Glossiphonia,NA,11,NA,NA,121000010,Handnet,1999,9,22
BEVL_VMM_84000,11023092,22.09.1999,Gyraulus,NA,11,NA,NA,121000010,Handnet,1999,9,22
BEVL_VMM_84000,11023092,22.09.1999,Gyrinidae,NA,2,NA,NA,121000010,Handnet,1999,9,22
BEVL_VMM_84000,11023092,22.09.1999,Helobdella,NA,2,NA,NA,121000010,Handnet,1999,9,22
BEVL_VMM_84000,11023092,22.09.1999,Hydropsychidae,NA,2,NA,NA,121000010,Handnet,1999,9,22
BEVL_VMM_84000,11023092,22.09.1999,Lymnaea,NA,2,NA,NA,121000010,Handnet,1999,9,22
BEVL_VMM_84000,11023092,22.09.1999,Naididae,NA,2,NA,NA,121000010,Handnet,1999,9,22
BEVL_VMM_84000,11023092,22.09.1999,Nepa,NA,2,NA,NA,121000010,Handnet,1999,9,22
BEVL_VMM_84000,11023092,22.09.1999,Notonecta,NA,2,NA,NA,121000010,Handnet,1999,9,22
BEVL_VMM_84000,11023092,22.09.1999,Sialis,NA,1,NA,NA,121000010,Handnet,1999,9,22
BEVL_VMM_84000,11023092,22.09.1999,Sigara,NA,2,NA,NA,121000010,Handnet,1999,9,22
BEVL_VMM_84000,11023092,22.09.1999,Tubificidae,NA,2,NA,NA,121000010,Handnet,1999,9,22
BEVL_VMM_84000,21094691,21.08.2002,Ancylus,NA,4,NA,NA,121000010,Handnet,2002,8,21
BEVL_VMM_84000,21094691,21.08.2002,Asellidae,NA,2,NA,NA,121000010,Handnet,2002,8,21
BEVL_VMM_84000,21094691,21.08.2002,Baetis,NA,11,NA,NA,121000010,Handnet,2002,8,21
BEVL_VMM_84000,21094691,21.08.2002,Ceratopogonidae,NA,1,NA,NA,121000010,Handnet,2002,8,21
BEVL_VMM_84000,21094691,21.08.2002,Chironomidae non thummi-plumosus,NA,11,NA,NA,121000010,Handnet,2002,8,21
BEVL_VMM_84000,21094691,21.08.2002,Dytiscidae,NA,4,NA,NA,121000010,Handnet,2002,8,21
BEVL_VMM_84000,21094691,21.08.2002,Erpobdella,NA,11,NA,NA,121000010,Handnet,2002,8,21
BEVL_VMM_84000,21094691,21.08.2002,Gammaridae,NA,11,NA,NA,121000010,Handnet,2002,8,21
BEVL_VMM_84000,21094691,21.08.2002,Gerris,NA,11,NA,NA,121000010,Handnet,2002,8,21
BEVL_VMM_84000,21094691,21.08.2002,Glossiphonia,NA,2,NA,NA,121000010,Handnet,2002,8,21
BEVL_VMM_84000,21094691,21.08.2002,Gyraulus,NA,11,NA,NA,121000010,Handnet,2002,8,21
BEVL_VMM_84000,21094691,21.08.2002,Helobdella,NA,1,NA,NA,121000010,Handnet,2002,8,21
BEVL_VMM_84000,21094691,21.08.2002,Hydracarina,NA,1,NA,NA,121000010,Handnet,2002,8,21
BEVL_VMM_84000,21094691,21.08.2002,Hydropsychidae,NA,11,NA,NA,121000010,Handnet,2002,8,21
BEVL_VMM_84000,21094691,21.08.2002,Limoniidae,NA,3,NA,NA,121000010,Handnet,2002,8,21
BEVL_VMM_84000,21094691,21.08.2002,Lymnaea,NA,6,NA,NA,121000010,Handnet,2002,8,21
BEVL_VMM_84000,21094691,21.08.2002,Naididae,NA,1,NA,NA,121000010,Handnet,2002,8,21
BEVL_VMM_84000,21094691,21.08.2002,Nepa,NA,1,NA,NA,121000010,Handnet,2002,8,21
BEVL_VMM_84000,21094691,21.08.2002,Notonecta,NA,2,NA,NA,121000010,Handnet,2002,8,21
BEVL_VMM_84000,21094691,21.08.2002,Phryganeidae,NA,3,NA,NA,121000010,Handnet,2002,8,21
BEVL_VMM_84000,21094691,21.08.2002,Pisidium,NA,4,NA,NA,121000010,Handnet,2002,8,21
BEVL_VMM_84000,21094691,21.08.2002,Planorbis,NA,1,NA,NA,121000010,Handnet,2002,8,21
BEVL_VMM_84000,21094691,21.08.2002,Psychomyiidae,NA,1,NA,NA,121000010,Handnet,2002,8,21
BEVL_VMM_84000,21094691,21.08.2002,Sialis,NA,2,NA,NA,121000010,Handnet,2002,8,21
BEVL_VMM_84000,21094691,21.08.2002,Simuliidae,NA,4,NA,NA,121000010,Handnet,2002,8,21
BEVL_VMM_84000,21094691,21.08.2002,Sphaerium,NA,2,NA,NA,121000010,Handnet,2002,8,21
BEVL_VMM_84000,21094691,21.08.2002,Tubificidae,NA,11,NA,NA,121000010,Handnet,2002,8,21
BEVL_VMM_84000,21135789,12.8.2003,Aeshna,NA,4,NA,NA,121000010,Handnet,2003,8,12
BEVL_VMM_84000,21135789,12.8.2003,Asellidae,NA,11,NA,NA,121000010,Handnet,2003,8,12
BEVL_VMM_84000,21135789,12.8.2003,Bermpje,NA,9,NA,NA,121000010,Handnet,2003,8,12
BEVL_VMM_84000,21135789,12.8.2003,Calopteryx,NA,7,NA,NA,121000010,Handnet,2003,8,12
BEVL_VMM_84000,21135789,12.8.2003,Chironomidae non thummi-plumosus,NA,11,NA,NA,121000010,Handnet,2003,8,12
BEVL_VMM_84000,21135789,12.8.2003,Collembola,NA,2,NA,NA,121000010,Handnet,2003,8,12
BEVL_VMM_84000,21135789,12.8.2003,Culicidae,NA,1,NA,NA,121000010,Handnet,2003,8,12
BEVL_VMM_84000,21135789,12.8.2003,Dytiscidae,NA,4,NA,NA,121000010,Handnet,2003,8,12
BEVL_VMM_84000,21135789,12.8.2003,Elminthidae,NA,1,NA,NA,121000010,Handnet,2003,8,12
BEVL_VMM_84000,21135789,12.8.2003,Erpobdella,NA,11,NA,NA,121000010,Handnet,2003,8,12
BEVL_VMM_84000,21135789,12.8.2003,Gammaridae,NA,1001,NA,NA,121000010,Handnet,2003,8,12
BEVL_VMM_84000,21135789,12.8.2003,Glossiphonia,NA,4,NA,NA,121000010,Handnet,2003,8,12
BEVL_VMM_84000,21135789,12.8.2003,Gyraulus,NA,51,NA,NA,121000010,Handnet,2003,8,12
BEVL_VMM_84000,21135789,12.8.2003,Helobdella,NA,11,NA,NA,121000010,Handnet,2003,8,12
BEVL_VMM_84000,21135789,12.8.2003,Hydropsychidae,NA,11,NA,NA,121000010,Handnet,2003,8,12
BEVL_VMM_84000,21135789,12.8.2003,Leptoceridae,NA,6,NA,NA,121000010,Handnet,2003,8,12
BEVL_VMM_84000,21135789,12.8.2003,Lymnaea,NA,8,NA,NA,121000010,Handnet,2003,8,12
BEVL_VMM_84000,21135789,12.8.2003,Naididae,NA,4,NA,NA,121000010,Handnet,2003,8,12
BEVL_VMM_84000,21135789,12.8.2003,Nepa,NA,7,NA,NA,121000010,Handnet,2003,8,12
BEVL_VMM_84000,21135789,12.8.2003,Notonecta,NA,3,NA,NA,121000010,Handnet,2003,8,12
BEVL_VMM_84000,21135789,12.8.2003,Phryganeidae,NA,1,NA,NA,121000010,Handnet,2003,8,12
BEVL_VMM_84000,21135789,12.8.2003,Physa,NA,4,NA,NA,121000010,Handnet,2003,8,12
BEVL_VMM_84000,21135789,12.8.2003,Pisidium,NA,3,NA,NA,121000010,Handnet,2003,8,12
BEVL_VMM_84000,21135789,12.8.2003,Planorbis,NA,5,NA,NA,121000010,Handnet,2003,8,12
BEVL_VMM_84000,21135789,12.8.2003,Sialis,NA,8,NA,NA,121000010,Handnet,2003,8,12
BEVL_VMM_84000,21135789,12.8.2003,Sphaerium,NA,11,NA,NA,121000010,Handnet,2003,8,12
BEVL_VMM_84000,21135789,12.8.2003,Theromyzon,NA,1,NA,NA,121000010,Handnet,2003,8,12
BEVL_VMM_84000,21135789,12.8.2003,Tubificidae,NA,11,NA,NA,121000010,Handnet,2003,8,12
BEVL_VMM_84000,21171945,2.7.2004,Asellidae,NA,6,NA,NA,121000010,Handnet,2004,7,2
BEVL_VMM_84000,21171945,2.7.2004,Baetis,NA,51,NA,NA,121000010,Handnet,2004,7,2
BEVL_VMM_84000,21171945,2.7.2004,Bermpje,NA,2,NA,NA,121000010,Handnet,2004,7,2
BEVL_VMM_84000,21171945,2.7.2004,Chironomidae non thummi-plumosus,NA,51,NA,NA,121000010,Handnet,2004,7,2
BEVL_VMM_84000,21171945,2.7.2004,Dytiscidae,NA,2,NA,NA,121000010,Handnet,2004,7,2
BEVL_VMM_84000,21171945,2.7.2004,Erpobdella,NA,11,NA,NA,121000010,Handnet,2004,7,2
BEVL_VMM_84000,21171945,2.7.2004,Gammaridae,NA,11,NA,NA,121000010,Handnet,2004,7,2
BEVL_VMM_84000,21171945,2.7.2004,Glossiphonia,NA,5,NA,NA,121000010,Handnet,2004,7,2
BEVL_VMM_84000,21171945,2.7.2004,Gyraulus,NA,3,NA,NA,121000010,Handnet,2004,7,2
BEVL_VMM_84000,21171945,2.7.2004,Helobdella,NA,7,NA,NA,121000010,Handnet,2004,7,2
BEVL_VMM_84000,21171945,2.7.2004,Hesperocorixa,NA,1,NA,NA,121000010,Handnet,2004,7,2
BEVL_VMM_84000,21171945,2.7.2004,Hydracarina,NA,3,NA,NA,121000010,Handnet,2004,7,2
BEVL_VMM_84000,21171945,2.7.2004,Hydrophilidae,NA,2,NA,NA,121000010,Handnet,2004,7,2
BEVL_VMM_84000,21171945,2.7.2004,Hydropsychidae,NA,1,NA,NA,121000010,Handnet,2004,7,2
BEVL_VMM_84000,21171945,2.7.2004,Leptoceridae,NA,3,NA,NA,121000010,Handnet,2004,7,2
BEVL_VMM_84000,21171945,2.7.2004,Limnephilidae,NA,2,NA,NA,121000010,Handnet,2004,7,2
BEVL_VMM_84000,21171945,2.7.2004,Lymnaea,NA,11,NA,NA,121000010,Handnet,2004,7,2
BEVL_VMM_84000,21171945,2.7.2004,Naididae,NA,3,NA,NA,121000010,Handnet,2004,7,2
BEVL_VMM_84000,21171945,2.7.2004,Physa,NA,11,NA,NA,121000010,Handnet,2004,7,2
BEVL_VMM_84000,21171945,2.7.2004,Pisidium,NA,2,NA,NA,121000010,Handnet,2004,7,2
BEVL_VMM_84000,21171945,2.7.2004,Psychodidae,NA,1,NA,NA,121000010,Handnet,2004,7,2
BEVL_VMM_84000,21171945,2.7.2004,Sialis,NA,3,NA,NA,121000010,Handnet,2004,7,2
BEVL_VMM_84000,21171945,2.7.2004,Sigara,NA,1,NA,NA,121000010,Handnet,2004,7,2
BEVL_VMM_84000,21171945,2.7.2004,Simuliidae,NA,51,NA,NA,121000010,Handnet,2004,7,2
BEVL_VMM_84000,21171945,2.7.2004,Sphaerium,NA,11,NA,NA,121000010,Handnet,2004,7,2
BEVL_VMM_84000,21171945,2.7.2004,tiendoornige stekelbaars,NA,2,NA,NA,121000010,Handnet,2004,7,2
BEVL_VMM_84000,21171945,2.7.2004,Tubificidae,NA,11,NA,NA,121000010,Handnet,2004,7,2
BEVL_VMM_84000,21230055,12.8.2005,Asellidae,NA,16,NA,NA,121000010,Handnet,2005,8,12
BEVL_VMM_84000,21230055,12.8.2005,Baetis,NA,118,NA,NA,121000010,Handnet,2005,8,12
BEVL_VMM_84000,21230055,12.8.2005,Bermpje,NA,3,NA,NA,121000010,Handnet,2005,8,12
BEVL_VMM_84000,21230055,12.8.2005,Chironomidae non thummi-plumosus,NA,29,NA,NA,121000010,Handnet,2005,8,12
BEVL_VMM_84000,21230055,12.8.2005,Erpobdella,NA,46,NA,NA,121000010,Handnet,2005,8,12
BEVL_VMM_84000,21230055,12.8.2005,Gammaridae,NA,320,NA,NA,121000010,Handnet,2005,8,12
BEVL_VMM_84000,21230055,12.8.2005,Glossiphonia,NA,14,NA,NA,121000010,Handnet,2005,8,12
BEVL_VMM_84000,21230055,12.8.2005,Gyraulus,NA,17,NA,NA,121000010,Handnet,2005,8,12
BEVL_VMM_84000,21230055,12.8.2005,Helobdella,NA,6,NA,NA,121000010,Handnet,2005,8,12
BEVL_VMM_84000,21230055,12.8.2005,Hydracarina,NA,4,NA,NA,121000010,Handnet,2005,8,12
BEVL_VMM_84000,21230055,12.8.2005,Hydropsychidae,NA,9,NA,NA,121000010,Handnet,2005,8,12
BEVL_VMM_84000,21230055,12.8.2005,Leptoceridae,NA,2,NA,NA,121000010,Handnet,2005,8,12
BEVL_VMM_84000,21230055,12.8.2005,Lestes,NA,1,NA,NA,121000010,Handnet,2005,8,12
BEVL_VMM_84000,21230055,12.8.2005,Limnephilidae,NA,2,NA,NA,121000010,Handnet,2005,8,12
BEVL_VMM_84000,21230055,12.8.2005,Lymnaea,NA,3,NA,NA,121000010,Handnet,2005,8,12
BEVL_VMM_84000,21230055,12.8.2005,Nepa,NA,1,NA,NA,121000010,Handnet,2005,8,12
