"Unique.ID","Samp.ID","Sampling.date","year","month","day","Taxon.name","Abundance"
"SWE_038_MZB_LO_1","SWE_038_MZB_LO_1-29.09.2000","29.09.2000",2000,9,29,"AMELETUS SP.",1.8
"SWE_038_MZB_LO_1","SWE_038_MZB_LO_1-29.09.2000","29.09.2000",2000,9,29,"BAETIDAE GEN. SP.",82.6
"SWE_038_MZB_LO_1","SWE_038_MZB_LO_1-29.09.2000","29.09.2000",2000,9,29,"CERATOPOGONIDAE GEN. SP.",2.4
"SWE_038_MZB_LO_1","SWE_038_MZB_LO_1-29.09.2000","29.09.2000",2000,9,29,"CHIRONOMIDAE GEN. SP.",93.4
"SWE_038_MZB_LO_1","SWE_038_MZB_LO_1-29.09.2000","29.09.2000",2000,9,29,"DICRANOTA SP.",1
"SWE_038_MZB_LO_1","SWE_038_MZB_LO_1-29.09.2000","29.09.2000",2000,9,29,"ELMIS AENEA",10.8
"SWE_038_MZB_LO_1","SWE_038_MZB_LO_1-29.09.2000","29.09.2000",2000,9,29,"EMPIDIDAE GEN. SP.",5.4
"SWE_038_MZB_LO_1","SWE_038_MZB_LO_1-29.09.2000","29.09.2000",2000,9,29,"EPHEMERELLA SP.",14.6
"SWE_038_MZB_LO_1","SWE_038_MZB_LO_1-29.09.2000","29.09.2000",2000,9,29,"HEPTAGENIIDAE GEN. SP.",0.6
"SWE_038_MZB_LO_1","SWE_038_MZB_LO_1-29.09.2000","29.09.2000",2000,9,29,"HYDRACHNIDIA GEN. SP.",2.6
"SWE_038_MZB_LO_1","SWE_038_MZB_LO_1-29.09.2000","29.09.2000",2000,9,29,"HYDROPTILIDAE GEN. SP.",3.6
"SWE_038_MZB_LO_1","SWE_038_MZB_LO_1-29.09.2000","29.09.2000",2000,9,29,"LEUCTRA SP.",15.8
"SWE_038_MZB_LO_1","SWE_038_MZB_LO_1-29.09.2000","29.09.2000",2000,9,29,"LIMNEPHILIDAE GEN. SP.",1.8
"SWE_038_MZB_LO_1","SWE_038_MZB_LO_1-29.09.2000","29.09.2000",2000,9,29,"MUSCIDAE GEN. SP.",0.2
"SWE_038_MZB_LO_1","SWE_038_MZB_LO_1-29.09.2000","29.09.2000",2000,9,29,"NEMOURIDAE GEN. SP.",36.8
"SWE_038_MZB_LO_1","SWE_038_MZB_LO_1-29.09.2000","29.09.2000",2000,9,29,"OLIGOCHAETA GEN. SP.",0.4
"SWE_038_MZB_LO_1","SWE_038_MZB_LO_1-29.09.2000","29.09.2000",2000,9,29,"OULIMNIUS SP.",2.8
"SWE_038_MZB_LO_1","SWE_038_MZB_LO_1-29.09.2000","29.09.2000",2000,9,29,"PERLODIDAE GEN. SP.",5.2
"SWE_038_MZB_LO_1","SWE_038_MZB_LO_1-29.09.2000","29.09.2000",2000,9,29,"POLYCENTROPODIDAE GEN. SP.",1.4
"SWE_038_MZB_LO_1","SWE_038_MZB_LO_1-29.09.2000","29.09.2000",2000,9,29,"PSYCHODIDAE GEN. SP.",0.4
"SWE_038_MZB_LO_1","SWE_038_MZB_LO_1-29.09.2000","29.09.2000",2000,9,29,"RHYACOPHILA SP.",5.2
"SWE_038_MZB_LO_1","SWE_038_MZB_LO_1-29.09.2000","29.09.2000",2000,9,29,"SIMULIIDAE GEN. SP.",6.2
"SWE_038_MZB_LO_1","SWE_038_MZB_LO_1-29.09.2000","29.09.2000",2000,9,29,"TAENIOPTERYX NEBULOSA",3.2
"SWE_038_MZB_LO_1","SWE_038_MZB_LO_1-18.09.2001","18.09.2001",2001,9,18,"BAETIDAE GEN. SP.",19.4
"SWE_038_MZB_LO_1","SWE_038_MZB_LO_1-18.09.2001","18.09.2001",2001,9,18,"CAPNOPSIS SCHILLERI SSP.",4.4
"SWE_038_MZB_LO_1","SWE_038_MZB_LO_1-18.09.2001","18.09.2001",2001,9,18,"CERATOPOGONIDAE GEN. SP.",2.8
"SWE_038_MZB_LO_1","SWE_038_MZB_LO_1-18.09.2001","18.09.2001",2001,9,18,"CHIRONOMIDAE GEN. SP.",53.2
"SWE_038_MZB_LO_1","SWE_038_MZB_LO_1-18.09.2001","18.09.2001",2001,9,18,"DICRANOTA SP.",0.2
"SWE_038_MZB_LO_1","SWE_038_MZB_LO_1-18.09.2001","18.09.2001",2001,9,18,"ELMIS AENEA",7.2
"SWE_038_MZB_LO_1","SWE_038_MZB_LO_1-18.09.2001","18.09.2001",2001,9,18,"EMPIDIDAE GEN. SP.",3
"SWE_038_MZB_LO_1","SWE_038_MZB_LO_1-18.09.2001","18.09.2001",2001,9,18,"EPHEMERELLA SP.",12.6
"SWE_038_MZB_LO_1","SWE_038_MZB_LO_1-18.09.2001","18.09.2001",2001,9,18,"HEPTAGENIIDAE GEN. SP.",7
"SWE_038_MZB_LO_1","SWE_038_MZB_LO_1-18.09.2001","18.09.2001",2001,9,18,"HYDRACHNIDIA GEN. SP.",2.4
"SWE_038_MZB_LO_1","SWE_038_MZB_LO_1-18.09.2001","18.09.2001",2001,9,18,"HYDRAENIDAE GEN. SP.",0.2
"SWE_038_MZB_LO_1","SWE_038_MZB_LO_1-18.09.2001","18.09.2001",2001,9,18,"HYDROPTILIDAE GEN. SP.",8
"SWE_038_MZB_LO_1","SWE_038_MZB_LO_1-18.09.2001","18.09.2001",2001,9,18,"LEPTOCERIDAE GEN. SP.",0.2
"SWE_038_MZB_LO_1","SWE_038_MZB_LO_1-18.09.2001","18.09.2001",2001,9,18,"LEPTOPHLEBIA SP.",2.6
"SWE_038_MZB_LO_1","SWE_038_MZB_LO_1-18.09.2001","18.09.2001",2001,9,18,"LEUCTRA SP.",14.4
"SWE_038_MZB_LO_1","SWE_038_MZB_LO_1-18.09.2001","18.09.2001",2001,9,18,"LIMNEPHILIDAE GEN. SP.",5.2
"SWE_038_MZB_LO_1","SWE_038_MZB_LO_1-18.09.2001","18.09.2001",2001,9,18,"LIMONIIDAE GEN. SP.",0.2
"SWE_038_MZB_LO_1","SWE_038_MZB_LO_1-18.09.2001","18.09.2001",2001,9,18,"LYMNAEIDAE GEN. SP.",0.4
"SWE_038_MZB_LO_1","SWE_038_MZB_LO_1-18.09.2001","18.09.2001",2001,9,18,"NEMOURIDAE GEN. SP.",10.2
"SWE_038_MZB_LO_1","SWE_038_MZB_LO_1-18.09.2001","18.09.2001",2001,9,18,"OLIGOCHAETA GEN. SP.",0.2
"SWE_038_MZB_LO_1","SWE_038_MZB_LO_1-18.09.2001","18.09.2001",2001,9,18,"OULIMNIUS SP.",0.8
"SWE_038_MZB_LO_1","SWE_038_MZB_LO_1-18.09.2001","18.09.2001",2001,9,18,"PERLODIDAE GEN. SP.",1.2
"SWE_038_MZB_LO_1","SWE_038_MZB_LO_1-18.09.2001","18.09.2001",2001,9,18,"PLANORBIDAE GEN. SP.",0.2
"SWE_038_MZB_LO_1","SWE_038_MZB_LO_1-18.09.2001","18.09.2001",2001,9,18,"POLYCENTROPODIDAE GEN. SP.",2.6
"SWE_038_MZB_LO_1","SWE_038_MZB_LO_1-18.09.2001","18.09.2001",2001,9,18,"RHYACOPHILA SP.",0.6
"SWE_038_MZB_LO_1","SWE_038_MZB_LO_1-18.09.2001","18.09.2001",2001,9,18,"SIMULIIDAE GEN. SP.",0.2
"SWE_038_MZB_LO_1","SWE_038_MZB_LO_1-18.09.2001","18.09.2001",2001,9,18,"SIPHONOPERLA BURMEISTERI",0.8
"SWE_038_MZB_LO_1","SWE_038_MZB_LO_1-18.09.2001","18.09.2001",2001,9,18,"SPHAERIIDAE GEN. SP.",0.2
"SWE_038_MZB_LO_1","SWE_038_MZB_LO_1-18.09.2001","18.09.2001",2001,9,18,"TAENIOPTERYX NEBULOSA",0.2
"SWE_038_MZB_LO_1","SWE_038_MZB_LO_1-27.09.2002","27.09.2002",2002,9,27,"AMELETUS SP.",6.2
"SWE_038_MZB_LO_1","SWE_038_MZB_LO_1-27.09.2002","27.09.2002",2002,9,27,"ARCTOPSYCHE LADOGENSIS",2.4
"SWE_038_MZB_LO_1","SWE_038_MZB_LO_1-27.09.2002","27.09.2002",2002,9,27,"ASELLUS AQUATICUS",13.8
"SWE_038_MZB_LO_1","SWE_038_MZB_LO_1-27.09.2002","27.09.2002",2002,9,27,"BAETIDAE GEN. SP.",191
"SWE_038_MZB_LO_1","SWE_038_MZB_LO_1-27.09.2002","27.09.2002",2002,9,27,"CAPNOPSIS SCHILLERI SSP.",1.2
"SWE_038_MZB_LO_1","SWE_038_MZB_LO_1-27.09.2002","27.09.2002",2002,9,27,"CERATOPOGONIDAE GEN. SP.",2.2
"SWE_038_MZB_LO_1","SWE_038_MZB_LO_1-27.09.2002","27.09.2002",2002,9,27,"CHIRONOMIDAE GEN. SP.",175
"SWE_038_MZB_LO_1","SWE_038_MZB_LO_1-27.09.2002","27.09.2002",2002,9,27,"DICRANOTA SP.",1.8
"SWE_038_MZB_LO_1","SWE_038_MZB_LO_1-27.09.2002","27.09.2002",2002,9,27,"ELMIS AENEA",1.8
"SWE_038_MZB_LO_1","SWE_038_MZB_LO_1-27.09.2002","27.09.2002",2002,9,27,"EMPIDIDAE GEN. SP.",1.6
"SWE_038_MZB_LO_1","SWE_038_MZB_LO_1-27.09.2002","27.09.2002",2002,9,27,"EPHEMERELLA SP.",31.4
"SWE_038_MZB_LO_1","SWE_038_MZB_LO_1-27.09.2002","27.09.2002",2002,9,27,"HEPTAGENIIDAE GEN. SP.",24
"SWE_038_MZB_LO_1","SWE_038_MZB_LO_1-27.09.2002","27.09.2002",2002,9,27,"HYDRACHNIDIA GEN. SP.",5.4
"SWE_038_MZB_LO_1","SWE_038_MZB_LO_1-27.09.2002","27.09.2002",2002,9,27,"HYDRAENIDAE GEN. SP.",1
"SWE_038_MZB_LO_1","SWE_038_MZB_LO_1-27.09.2002","27.09.2002",2002,9,27,"HYDROPTILIDAE GEN. SP.",4.8
"SWE_038_MZB_LO_1","SWE_038_MZB_LO_1-27.09.2002","27.09.2002",2002,9,27,"LEPIDOPTERA GEN. SP.",0.2
"SWE_038_MZB_LO_1","SWE_038_MZB_LO_1-27.09.2002","27.09.2002",2002,9,27,"LEPIDOSTOMA HIRTUM",0.8
"SWE_038_MZB_LO_1","SWE_038_MZB_LO_1-27.09.2002","27.09.2002",2002,9,27,"LEUCTRA SP.",26.8
"SWE_038_MZB_LO_1","SWE_038_MZB_LO_1-27.09.2002","27.09.2002",2002,9,27,"LIMNEPHILIDAE GEN. SP.",1.6
"SWE_038_MZB_LO_1","SWE_038_MZB_LO_1-27.09.2002","27.09.2002",2002,9,27,"NEMOURIDAE GEN. SP.",47
"SWE_038_MZB_LO_1","SWE_038_MZB_LO_1-27.09.2002","27.09.2002",2002,9,27,"OLIGOCHAETA GEN. SP.",0.6
"SWE_038_MZB_LO_1","SWE_038_MZB_LO_1-27.09.2002","27.09.2002",2002,9,27,"OULIMNIUS SP.",0.2
"SWE_038_MZB_LO_1","SWE_038_MZB_LO_1-27.09.2002","27.09.2002",2002,9,27,"PERLODIDAE GEN. SP.",5
"SWE_038_MZB_LO_1","SWE_038_MZB_LO_1-27.09.2002","27.09.2002",2002,9,27,"POLYCENTROPODIDAE GEN. SP.",6.6
"SWE_038_MZB_LO_1","SWE_038_MZB_LO_1-27.09.2002","27.09.2002",2002,9,27,"RHYACOPHILA SP.",9.6
"SWE_038_MZB_LO_1","SWE_038_MZB_LO_1-27.09.2002","27.09.2002",2002,9,27,"SIMULIIDAE GEN. SP.",28.8
"SWE_038_MZB_LO_1","SWE_038_MZB_LO_1-27.09.2002","27.09.2002",2002,9,27,"SIPHONOPERLA BURMEISTERI",1.6
"SWE_038_MZB_LO_1","SWE_038_MZB_LO_1-27.09.2002","27.09.2002",2002,9,27,"TAENIOPTERYX NEBULOSA",3
"SWE_038_MZB_LO_1","SWE_038_MZB_LO_1-22.09.2003","22.09.2003",2003,9,22,"AMELETUS SP.",1.6
"SWE_038_MZB_LO_1","SWE_038_MZB_LO_1-22.09.2003","22.09.2003",2003,9,22,"ARCTOPSYCHE LADOGENSIS",0.8
"SWE_038_MZB_LO_1","SWE_038_MZB_LO_1-22.09.2003","22.09.2003",2003,9,22,"BAETIDAE GEN. SP.",158.4
"SWE_038_MZB_LO_1","SWE_038_MZB_LO_1-22.09.2003","22.09.2003",2003,9,22,"BRACHYPTERA SP.",0.2
"SWE_038_MZB_LO_1","SWE_038_MZB_LO_1-22.09.2003","22.09.2003",2003,9,22,"CAPNOPSIS SCHILLERI SSP.",3.2
"SWE_038_MZB_LO_1","SWE_038_MZB_LO_1-22.09.2003","22.09.2003",2003,9,22,"CERATOPOGONIDAE GEN. SP.",2.2
"SWE_038_MZB_LO_1","SWE_038_MZB_LO_1-22.09.2003","22.09.2003",2003,9,22,"CHIRONOMIDAE GEN. SP.",38.4
"SWE_038_MZB_LO_1","SWE_038_MZB_LO_1-22.09.2003","22.09.2003",2003,9,22,"DICRANOTA SP.",0.2
"SWE_038_MZB_LO_1","SWE_038_MZB_LO_1-22.09.2003","22.09.2003",2003,9,22,"ELMIS AENEA",17.4
"SWE_038_MZB_LO_1","SWE_038_MZB_LO_1-22.09.2003","22.09.2003",2003,9,22,"EMPIDIDAE GEN. SP.",3
"SWE_038_MZB_LO_1","SWE_038_MZB_LO_1-22.09.2003","22.09.2003",2003,9,22,"EPHEMERELLA SP.",9
"SWE_038_MZB_LO_1","SWE_038_MZB_LO_1-22.09.2003","22.09.2003",2003,9,22,"HEPTAGENIIDAE GEN. SP.",8.2
"SWE_038_MZB_LO_1","SWE_038_MZB_LO_1-22.09.2003","22.09.2003",2003,9,22,"HYDRACHNIDIA GEN. SP.",4.4
"SWE_038_MZB_LO_1","SWE_038_MZB_LO_1-22.09.2003","22.09.2003",2003,9,22,"HYDRAENIDAE GEN. SP.",1.2
"SWE_038_MZB_LO_1","SWE_038_MZB_LO_1-22.09.2003","22.09.2003",2003,9,22,"HYDROPSYCHE SP.",0.8
"SWE_038_MZB_LO_1","SWE_038_MZB_LO_1-22.09.2003","22.09.2003",2003,9,22,"HYDROPTILIDAE GEN. SP.",2.8
"SWE_038_MZB_LO_1","SWE_038_MZB_LO_1-22.09.2003","22.09.2003",2003,9,22,"LEPIDOSTOMA HIRTUM",1
"SWE_038_MZB_LO_1","SWE_038_MZB_LO_1-22.09.2003","22.09.2003",2003,9,22,"LEPTOPHLEBIA SP.",0.4
"SWE_038_MZB_LO_1","SWE_038_MZB_LO_1-22.09.2003","22.09.2003",2003,9,22,"LEUCTRA SP.",36.8
"SWE_038_MZB_LO_1","SWE_038_MZB_LO_1-22.09.2003","22.09.2003",2003,9,22,"LIMNEPHILIDAE GEN. SP.",1.6
"SWE_038_MZB_LO_1","SWE_038_MZB_LO_1-22.09.2003","22.09.2003",2003,9,22,"LYMNAEIDAE GEN. SP.",0.4
"SWE_038_MZB_LO_1","SWE_038_MZB_LO_1-22.09.2003","22.09.2003",2003,9,22,"MICRASEMA SETIFERUM SSP.",0.2
"SWE_038_MZB_LO_1","SWE_038_MZB_LO_1-22.09.2003","22.09.2003",2003,9,22,"NEMOURIDAE GEN. SP.",11
"SWE_038_MZB_LO_1","SWE_038_MZB_LO_1-22.09.2003","22.09.2003",2003,9,22,"OLIGOCHAETA GEN. SP.",2
"SWE_038_MZB_LO_1","SWE_038_MZB_LO_1-22.09.2003","22.09.2003",2003,9,22,"PERLODIDAE GEN. SP.",5.6
"SWE_038_MZB_LO_1","SWE_038_MZB_LO_1-22.09.2003","22.09.2003",2003,9,22,"POLYCENTROPODIDAE GEN. SP.",1.6
"SWE_038_MZB_LO_1","SWE_038_MZB_LO_1-22.09.2003","22.09.2003",2003,9,22,"RHYACOPHILA SP.",9
"SWE_038_MZB_LO_1","SWE_038_MZB_LO_1-22.09.2003","22.09.2003",2003,9,22,"SIMULIIDAE GEN. SP.",17.4
"SWE_038_MZB_LO_1","SWE_038_MZB_LO_1-22.09.2003","22.09.2003",2003,9,22,"SIPHONOPERLA BURMEISTERI",1.8
"SWE_038_MZB_LO_1","SWE_038_MZB_LO_1-22.09.2003","22.09.2003",2003,9,22,"SPHAERIIDAE GEN. SP.",0.4
"SWE_038_MZB_LO_1","SWE_038_MZB_LO_1-22.09.2003","22.09.2003",2003,9,22,"TAENIOPTERYX NEBULOSA",1
"SWE_038_MZB_LO_1","SWE_038_MZB_LO_1-16.09.2004","16.09.2004",2004,9,16,"ARCTOPSYCHE LADOGENSIS",0.8
"SWE_038_MZB_LO_1","SWE_038_MZB_LO_1-16.09.2004","16.09.2004",2004,9,16,"BAETIDAE GEN. SP.",108.8
"SWE_038_MZB_LO_1","SWE_038_MZB_LO_1-16.09.2004","16.09.2004",2004,9,16,"CAPNOPSIS SCHILLERI SSP.",1
"SWE_038_MZB_LO_1","SWE_038_MZB_LO_1-16.09.2004","16.09.2004",2004,9,16,"CERATOPOGONIDAE GEN. SP.",2.6
"SWE_038_MZB_LO_1","SWE_038_MZB_LO_1-16.09.2004","16.09.2004",2004,9,16,"CHIRONOMIDAE GEN. SP.",49.6
"SWE_038_MZB_LO_1","SWE_038_MZB_LO_1-16.09.2004","16.09.2004",2004,9,16,"DICRANOTA SP.",0.6
"SWE_038_MZB_LO_1","SWE_038_MZB_LO_1-16.09.2004","16.09.2004",2004,9,16,"ELMIS AENEA",14.8
"SWE_038_MZB_LO_1","SWE_038_MZB_LO_1-16.09.2004","16.09.2004",2004,9,16,"EMPIDIDAE GEN. SP.",6.4
"SWE_038_MZB_LO_1","SWE_038_MZB_LO_1-16.09.2004","16.09.2004",2004,9,16,"EPHEMERELLA SP.",17.8
"SWE_038_MZB_LO_1","SWE_038_MZB_LO_1-16.09.2004","16.09.2004",2004,9,16,"HEPTAGENIIDAE GEN. SP.",7.2
"SWE_038_MZB_LO_1","SWE_038_MZB_LO_1-16.09.2004","16.09.2004",2004,9,16,"HYDRACHNIDIA GEN. SP.",1.4
"SWE_038_MZB_LO_1","SWE_038_MZB_LO_1-16.09.2004","16.09.2004",2004,9,16,"HYDRAENIDAE GEN. SP.",0.8
"SWE_038_MZB_LO_1","SWE_038_MZB_LO_1-16.09.2004","16.09.2004",2004,9,16,"HYDROPSYCHE SP.",0.4
"SWE_038_MZB_LO_1","SWE_038_MZB_LO_1-16.09.2004","16.09.2004",2004,9,16,"HYDROPTILIDAE GEN. SP.",1.8
"SWE_038_MZB_LO_1","SWE_038_MZB_LO_1-16.09.2004","16.09.2004",2004,9,16,"LEPTOCERIDAE GEN. SP.",0.2
"SWE_038_MZB_LO_1","SWE_038_MZB_LO_1-16.09.2004","16.09.2004",2004,9,16,"LEUCTRA SP.",32.4
"SWE_038_MZB_LO_1","SWE_038_MZB_LO_1-16.09.2004","16.09.2004",2004,9,16,"LIMNEPHILIDAE GEN. SP.",0.8
"SWE_038_MZB_LO_1","SWE_038_MZB_LO_1-16.09.2004","16.09.2004",2004,9,16,"NEMOURIDAE GEN. SP.",12.6
"SWE_038_MZB_LO_1","SWE_038_MZB_LO_1-16.09.2004","16.09.2004",2004,9,16,"OLIGOCHAETA GEN. SP.",1.6
"SWE_038_MZB_LO_1","SWE_038_MZB_LO_1-16.09.2004","16.09.2004",2004,9,16,"OULIMNIUS SP.",0.2
"SWE_038_MZB_LO_1","SWE_038_MZB_LO_1-16.09.2004","16.09.2004",2004,9,16,"PERLODIDAE GEN. SP.",5.6
"SWE_038_MZB_LO_1","SWE_038_MZB_LO_1-16.09.2004","16.09.2004",2004,9,16,"RHYACOPHILA SP.",10.6
"SWE_038_MZB_LO_1","SWE_038_MZB_LO_1-16.09.2004","16.09.2004",2004,9,16,"SIMULIIDAE GEN. SP.",20.2
"SWE_038_MZB_LO_1","SWE_038_MZB_LO_1-16.09.2004","16.09.2004",2004,9,16,"SIPHONOPERLA BURMEISTERI",1.2
"SWE_038_MZB_LO_1","SWE_038_MZB_LO_1-16.09.2004","16.09.2004",2004,9,16,"SPHAERIIDAE GEN. SP.",0.4
"SWE_038_MZB_LO_1","SWE_038_MZB_LO_1-16.09.2004","16.09.2004",2004,9,16,"TAENIOPTERYX NEBULOSA",1.4
"SWE_038_MZB_LO_1","SWE_038_MZB_LO_1-16.09.2005","16.09.2005",2005,9,16,"BAETIDAE GEN. SP.",83.6
"SWE_038_MZB_LO_1","SWE_038_MZB_LO_1-16.09.2005","16.09.2005",2005,9,16,"CAPNOPSIS SCHILLERI SSP.",0.2
"SWE_038_MZB_LO_1","SWE_038_MZB_LO_1-16.09.2005","16.09.2005",2005,9,16,"CERATOPOGONIDAE GEN. SP.",6.2
"SWE_038_MZB_LO_1","SWE_038_MZB_LO_1-16.09.2005","16.09.2005",2005,9,16,"CHIRONOMIDAE GEN. SP.",30.2
"SWE_038_MZB_LO_1","SWE_038_MZB_LO_1-16.09.2005","16.09.2005",2005,9,16,"DICRANOTA SP.",1.2
"SWE_038_MZB_LO_1","SWE_038_MZB_LO_1-16.09.2005","16.09.2005",2005,9,16,"ELMIS AENEA",19.2
"SWE_038_MZB_LO_1","SWE_038_MZB_LO_1-16.09.2005","16.09.2005",2005,9,16,"EMPIDIDAE GEN. SP.",3.6
"SWE_038_MZB_LO_1","SWE_038_MZB_LO_1-16.09.2005","16.09.2005",2005,9,16,"EPHEMERELLA SP.",12
"SWE_038_MZB_LO_1","SWE_038_MZB_LO_1-16.09.2005","16.09.2005",2005,9,16,"HEPTAGENIIDAE GEN. SP.",9
"SWE_038_MZB_LO_1","SWE_038_MZB_LO_1-16.09.2005","16.09.2005",2005,9,16,"HYDRACHNIDIA GEN. SP.",1.6
"SWE_038_MZB_LO_1","SWE_038_MZB_LO_1-16.09.2005","16.09.2005",2005,9,16,"HYDRAENIDAE GEN. SP.",0.4
"SWE_038_MZB_LO_1","SWE_038_MZB_LO_1-16.09.2005","16.09.2005",2005,9,16,"HYDROPTILIDAE GEN. SP.",0.6
"SWE_038_MZB_LO_1","SWE_038_MZB_LO_1-16.09.2005","16.09.2005",2005,9,16,"LEUCTRA SP.",42
"SWE_038_MZB_LO_1","SWE_038_MZB_LO_1-16.09.2005","16.09.2005",2005,9,16,"LIMNEPHILIDAE GEN. SP.",0.6
"SWE_038_MZB_LO_1","SWE_038_MZB_LO_1-16.09.2005","16.09.2005",2005,9,16,"LIMONIIDAE GEN. SP.",0.2
"SWE_038_MZB_LO_1","SWE_038_MZB_LO_1-16.09.2005","16.09.2005",2005,9,16,"NEMATODA GEN. SP.",0.2
"SWE_038_MZB_LO_1","SWE_038_MZB_LO_1-16.09.2005","16.09.2005",2005,9,16,"NEMOURIDAE GEN. SP.",22.6
"SWE_038_MZB_LO_1","SWE_038_MZB_LO_1-16.09.2005","16.09.2005",2005,9,16,"OLIGOCHAETA GEN. SP.",2
"SWE_038_MZB_LO_1","SWE_038_MZB_LO_1-16.09.2005","16.09.2005",2005,9,16,"OULIMNIUS SP.",2.2
"SWE_038_MZB_LO_1","SWE_038_MZB_LO_1-16.09.2005","16.09.2005",2005,9,16,"PERLODIDAE GEN. SP.",6.2
"SWE_038_MZB_LO_1","SWE_038_MZB_LO_1-16.09.2005","16.09.2005",2005,9,16,"RHYACOPHILA SP.",6.4
"SWE_038_MZB_LO_1","SWE_038_MZB_LO_1-16.09.2005","16.09.2005",2005,9,16,"SIMULIIDAE GEN. SP.",18.2
"SWE_038_MZB_LO_1","SWE_038_MZB_LO_1-16.09.2005","16.09.2005",2005,9,16,"SIPHONOPERLA BURMEISTERI",0.4
"SWE_038_MZB_LO_1","SWE_038_MZB_LO_1-16.09.2005","16.09.2005",2005,9,16,"TAENIOPTERYX NEBULOSA",1.2
"SWE_038_MZB_LO_1","SWE_038_MZB_LO_1-16.09.2005","16.09.2005",2005,9,16,"TURBELLARIA GEN. SP.",0.2
"SWE_038_MZB_LO_1","SWE_038_MZB_LO_1-13.09.2006","13.09.2006",2006,9,13,"BAETIDAE GEN. SP.",145.8
"SWE_038_MZB_LO_1","SWE_038_MZB_LO_1-13.09.2006","13.09.2006",2006,9,13,"CAPNOPSIS SCHILLERI SSP.",0.2
"SWE_038_MZB_LO_1","SWE_038_MZB_LO_1-13.09.2006","13.09.2006",2006,9,13,"CERATOPOGONIDAE GEN. SP.",5.4
"SWE_038_MZB_LO_1","SWE_038_MZB_LO_1-13.09.2006","13.09.2006",2006,9,13,"CHIRONOMIDAE GEN. SP.",43.6
"SWE_038_MZB_LO_1","SWE_038_MZB_LO_1-13.09.2006","13.09.2006",2006,9,13,"DICRANOTA SP.",1
"SWE_038_MZB_LO_1","SWE_038_MZB_LO_1-13.09.2006","13.09.2006",2006,9,13,"ELMIS AENEA",18.2
"SWE_038_MZB_LO_1","SWE_038_MZB_LO_1-13.09.2006","13.09.2006",2006,9,13,"EMPIDIDAE GEN. SP.",4.6
"SWE_038_MZB_LO_1","SWE_038_MZB_LO_1-13.09.2006","13.09.2006",2006,9,13,"EPHEMERELLA SP.",38.6
"SWE_038_MZB_LO_1","SWE_038_MZB_LO_1-13.09.2006","13.09.2006",2006,9,13,"HEPTAGENIIDAE GEN. SP.",6.8
"SWE_038_MZB_LO_1","SWE_038_MZB_LO_1-13.09.2006","13.09.2006",2006,9,13,"HYDRACHNIDIA GEN. SP.",2
"SWE_038_MZB_LO_1","SWE_038_MZB_LO_1-13.09.2006","13.09.2006",2006,9,13,"HYDRAENIDAE GEN. SP.",0.6
"SWE_038_MZB_LO_1","SWE_038_MZB_LO_1-13.09.2006","13.09.2006",2006,9,13,"HYDROPSYCHE SP.",0.2
"SWE_038_MZB_LO_1","SWE_038_MZB_LO_1-13.09.2006","13.09.2006",2006,9,13,"HYDROPTILIDAE GEN. SP.",11.2
"SWE_038_MZB_LO_1","SWE_038_MZB_LO_1-13.09.2006","13.09.2006",2006,9,13,"LEUCTRA SP.",64.2
"SWE_038_MZB_LO_1","SWE_038_MZB_LO_1-13.09.2006","13.09.2006",2006,9,13,"LIMNEPHILIDAE GEN. SP.",3.6
"SWE_038_MZB_LO_1","SWE_038_MZB_LO_1-13.09.2006","13.09.2006",2006,9,13,"LIMNIUS SP.",0.2
"SWE_038_MZB_LO_1","SWE_038_MZB_LO_1-13.09.2006","13.09.2006",2006,9,13,"NEMOURIDAE GEN. SP.",11.2
"SWE_038_MZB_LO_1","SWE_038_MZB_LO_1-13.09.2006","13.09.2006",2006,9,13,"OLIGOCHAETA GEN. SP.",2.6
"SWE_038_MZB_LO_1","SWE_038_MZB_LO_1-13.09.2006","13.09.2006",2006,9,13,"OULIMNIUS SP.",0.4
"SWE_038_MZB_LO_1","SWE_038_MZB_LO_1-13.09.2006","13.09.2006",2006,9,13,"PERLODIDAE GEN. SP.",3.8
"SWE_038_MZB_LO_1","SWE_038_MZB_LO_1-13.09.2006","13.09.2006",2006,9,13,"POLYCENTROPODIDAE GEN. SP.",2.2
"SWE_038_MZB_LO_1","SWE_038_MZB_LO_1-13.09.2006","13.09.2006",2006,9,13,"RHYACOPHILA SP.",10.6
"SWE_038_MZB_LO_1","SWE_038_MZB_LO_1-13.09.2006","13.09.2006",2006,9,13,"SIMULIIDAE GEN. SP.",1.6
"SWE_038_MZB_LO_1","SWE_038_MZB_LO_1-13.09.2006","13.09.2006",2006,9,13,"SIPHONOPERLA BURMEISTERI",0.2
"SWE_038_MZB_LO_1","SWE_038_MZB_LO_1-13.09.2006","13.09.2006",2006,9,13,"TAENIOPTERYX NEBULOSA",0.2
"SWE_038_MZB_LO_1","SWE_038_MZB_LO_1-25.09.2007","25.09.2007",2007,9,25,"ARCTOPSYCHE LADOGENSIS",0.4
"SWE_038_MZB_LO_1","SWE_038_MZB_LO_1-25.09.2007","25.09.2007",2007,9,25,"BAETIDAE GEN. SP.",19.2
"SWE_038_MZB_LO_1","SWE_038_MZB_LO_1-25.09.2007","25.09.2007",2007,9,25,"CERATOPOGONIDAE GEN. SP.",3.2
"SWE_038_MZB_LO_1","SWE_038_MZB_LO_1-25.09.2007","25.09.2007",2007,9,25,"CHIRONOMIDAE GEN. SP.",9.4
"SWE_038_MZB_LO_1","SWE_038_MZB_LO_1-25.09.2007","25.09.2007",2007,9,25,"CORIXIDAE GEN. SP.",0.2
"SWE_038_MZB_LO_1","SWE_038_MZB_LO_1-25.09.2007","25.09.2007",2007,9,25,"DICRANOTA SP.",0.4
"SWE_038_MZB_LO_1","SWE_038_MZB_LO_1-25.09.2007","25.09.2007",2007,9,25,"DIPTERA GEN. SP.",0.2
"SWE_038_MZB_LO_1","SWE_038_MZB_LO_1-25.09.2007","25.09.2007",2007,9,25,"ELMIS AENEA",4.4
"SWE_038_MZB_LO_1","SWE_038_MZB_LO_1-25.09.2007","25.09.2007",2007,9,25,"EMPIDIDAE GEN. SP.",1.8
"SWE_038_MZB_LO_1","SWE_038_MZB_LO_1-25.09.2007","25.09.2007",2007,9,25,"EPHEMERELLA SP.",4.8
"SWE_038_MZB_LO_1","SWE_038_MZB_LO_1-25.09.2007","25.09.2007",2007,9,25,"HEPTAGENIIDAE GEN. SP.",0.8
"SWE_038_MZB_LO_1","SWE_038_MZB_LO_1-25.09.2007","25.09.2007",2007,9,25,"HYDRAENIDAE GEN. SP.",0.4
"SWE_038_MZB_LO_1","SWE_038_MZB_LO_1-25.09.2007","25.09.2007",2007,9,25,"HYDROPTILIDAE GEN. SP.",1.4
"SWE_038_MZB_LO_1","SWE_038_MZB_LO_1-25.09.2007","25.09.2007",2007,9,25,"LEUCTRA SP.",13.4
"SWE_038_MZB_LO_1","SWE_038_MZB_LO_1-25.09.2007","25.09.2007",2007,9,25,"LIMNEPHILIDAE GEN. SP.",0.8
"SWE_038_MZB_LO_1","SWE_038_MZB_LO_1-25.09.2007","25.09.2007",2007,9,25,"NEMOURIDAE GEN. SP.",1.6
"SWE_038_MZB_LO_1","SWE_038_MZB_LO_1-25.09.2007","25.09.2007",2007,9,25,"OLIGOCHAETA GEN. SP.",1
"SWE_038_MZB_LO_1","SWE_038_MZB_LO_1-25.09.2007","25.09.2007",2007,9,25,"PERLODIDAE GEN. SP.",2
"SWE_038_MZB_LO_1","SWE_038_MZB_LO_1-25.09.2007","25.09.2007",2007,9,25,"RHYACOPHILA SP.",2.4
"SWE_038_MZB_LO_1","SWE_038_MZB_LO_1-25.09.2007","25.09.2007",2007,9,25,"SERICOSTOMATIDAE GEN. SP.",0.2
"SWE_038_MZB_LO_1","SWE_038_MZB_LO_1-25.09.2007","25.09.2007",2007,9,25,"SIMULIIDAE GEN. SP.",7.8
"SWE_038_MZB_LO_1","SWE_038_MZB_LO_1-25.09.2007","25.09.2007",2007,9,25,"SPHAERIIDAE GEN. SP.",0.2
"SWE_038_MZB_LO_1","SWE_038_MZB_LO_1-25.09.2007","25.09.2007",2007,9,25,"TAENIOPTERYX NEBULOSA",0.2
"SWE_038_MZB_LO_1","SWE_038_MZB_LO_1-23.09.2008","23.09.2008",2008,9,23,"AMELETUS SP.",0.4
"SWE_038_MZB_LO_1","SWE_038_MZB_LO_1-23.09.2008","23.09.2008",2008,9,23,"ARCTOPSYCHE LADOGENSIS",0.2
"SWE_038_MZB_LO_1","SWE_038_MZB_LO_1-23.09.2008","23.09.2008",2008,9,23,"BAETIDAE GEN. SP.",75
"SWE_038_MZB_LO_1","SWE_038_MZB_LO_1-23.09.2008","23.09.2008",2008,9,23,"CERATOPOGONIDAE GEN. SP.",16
"SWE_038_MZB_LO_1","SWE_038_MZB_LO_1-23.09.2008","23.09.2008",2008,9,23,"CHIRONOMIDAE GEN. SP.",94.6
"SWE_038_MZB_LO_1","SWE_038_MZB_LO_1-23.09.2008","23.09.2008",2008,9,23,"DICRANOTA SP.",0.6
"SWE_038_MZB_LO_1","SWE_038_MZB_LO_1-23.09.2008","23.09.2008",2008,9,23,"ELMIS AENEA",25.4
"SWE_038_MZB_LO_1","SWE_038_MZB_LO_1-23.09.2008","23.09.2008",2008,9,23,"EMPIDIDAE GEN. SP.",13
"SWE_038_MZB_LO_1","SWE_038_MZB_LO_1-23.09.2008","23.09.2008",2008,9,23,"EPHEMERELLA SP.",16.6
"SWE_038_MZB_LO_1","SWE_038_MZB_LO_1-23.09.2008","23.09.2008",2008,9,23,"HEPTAGENIIDAE GEN. SP.",2.4
"SWE_038_MZB_LO_1","SWE_038_MZB_LO_1-23.09.2008","23.09.2008",2008,9,23,"HYDRACHNIDIA GEN. SP.",8.8
"SWE_038_MZB_LO_1","SWE_038_MZB_LO_1-23.09.2008","23.09.2008",2008,9,23,"HYDRAENIDAE GEN. SP.",0.2
"SWE_038_MZB_LO_1","SWE_038_MZB_LO_1-23.09.2008","23.09.2008",2008,9,23,"HYDROPSYCHE SP.",0.2
"SWE_038_MZB_LO_1","SWE_038_MZB_LO_1-23.09.2008","23.09.2008",2008,9,23,"HYDROPTILIDAE GEN. SP.",9.4
"SWE_038_MZB_LO_1","SWE_038_MZB_LO_1-23.09.2008","23.09.2008",2008,9,23,"LEPIDOSTOMA HIRTUM",0.8
"SWE_038_MZB_LO_1","SWE_038_MZB_LO_1-23.09.2008","23.09.2008",2008,9,23,"LEUCTRA SP.",41.6
"SWE_038_MZB_LO_1","SWE_038_MZB_LO_1-23.09.2008","23.09.2008",2008,9,23,"LIMNEPHILIDAE GEN. SP.",2.8
"SWE_038_MZB_LO_1","SWE_038_MZB_LO_1-23.09.2008","23.09.2008",2008,9,23,"NEMOURIDAE GEN. SP.",3.4
"SWE_038_MZB_LO_1","SWE_038_MZB_LO_1-23.09.2008","23.09.2008",2008,9,23,"OLIGOCHAETA GEN. SP.",6.8
"SWE_038_MZB_LO_1","SWE_038_MZB_LO_1-23.09.2008","23.09.2008",2008,9,23,"OULIMNIUS SP.",9
"SWE_038_MZB_LO_1","SWE_038_MZB_LO_1-23.09.2008","23.09.2008",2008,9,23,"PERLODIDAE GEN. SP.",2.8
"SWE_038_MZB_LO_1","SWE_038_MZB_LO_1-23.09.2008","23.09.2008",2008,9,23,"POLYCENTROPODIDAE GEN. SP.",2.6
"SWE_038_MZB_LO_1","SWE_038_MZB_LO_1-23.09.2008","23.09.2008",2008,9,23,"RHYACOPHILA SP.",3.4
"SWE_038_MZB_LO_1","SWE_038_MZB_LO_1-23.09.2008","23.09.2008",2008,9,23,"SIMULIIDAE GEN. SP.",14
"SWE_038_MZB_LO_1","SWE_038_MZB_LO_1-23.09.2008","23.09.2008",2008,9,23,"SIPHONOPERLA BURMEISTERI",0.2
"SWE_038_MZB_LO_1","SWE_038_MZB_LO_1-23.09.2008","23.09.2008",2008,9,23,"TAENIOPTERYX NEBULOSA",0.4
"SWE_038_MZB_LO_1","SWE_038_MZB_LO_1-01.10.2009","01.10.2009",2009,10,1,"AMELETUS SP.",4.6
"SWE_038_MZB_LO_1","SWE_038_MZB_LO_1-01.10.2009","01.10.2009",2009,10,1,"BAETIDAE GEN. SP.",95.4
"SWE_038_MZB_LO_1","SWE_038_MZB_LO_1-01.10.2009","01.10.2009",2009,10,1,"CAPNOPSIS SCHILLERI SSP.",0.6
"SWE_038_MZB_LO_1","SWE_038_MZB_LO_1-01.10.2009","01.10.2009",2009,10,1,"CERATOPOGONIDAE GEN. SP.",11.4
"SWE_038_MZB_LO_1","SWE_038_MZB_LO_1-01.10.2009","01.10.2009",2009,10,1,"CHIRONOMIDAE GEN. SP.",108.8
"SWE_038_MZB_LO_1","SWE_038_MZB_LO_1-01.10.2009","01.10.2009",2009,10,1,"DICRANOTA SP.",1.2
"SWE_038_MZB_LO_1","SWE_038_MZB_LO_1-01.10.2009","01.10.2009",2009,10,1,"ELMIS AENEA",33.2
"SWE_038_MZB_LO_1","SWE_038_MZB_LO_1-01.10.2009","01.10.2009",2009,10,1,"EMPIDIDAE GEN. SP.",5.2
"SWE_038_MZB_LO_1","SWE_038_MZB_LO_1-01.10.2009","01.10.2009",2009,10,1,"EPHEMERELLA SP.",21.4
"SWE_038_MZB_LO_1","SWE_038_MZB_LO_1-01.10.2009","01.10.2009",2009,10,1,"HEPTAGENIIDAE GEN. SP.",9.4
"SWE_038_MZB_LO_1","SWE_038_MZB_LO_1-01.10.2009","01.10.2009",2009,10,1,"HYDRACHNIDIA GEN. SP.",4.2
"SWE_038_MZB_LO_1","SWE_038_MZB_LO_1-01.10.2009","01.10.2009",2009,10,1,"HYDRAENIDAE GEN. SP.",0.2
"SWE_038_MZB_LO_1","SWE_038_MZB_LO_1-01.10.2009","01.10.2009",2009,10,1,"HYDROPSYCHE SP.",1
"SWE_038_MZB_LO_1","SWE_038_MZB_LO_1-01.10.2009","01.10.2009",2009,10,1,"HYDROPTILIDAE GEN. SP.",14.8
"SWE_038_MZB_LO_1","SWE_038_MZB_LO_1-01.10.2009","01.10.2009",2009,10,1,"LEPIDOSTOMA HIRTUM",1
"SWE_038_MZB_LO_1","SWE_038_MZB_LO_1-01.10.2009","01.10.2009",2009,10,1,"LEUCTRA SP.",71.2
"SWE_038_MZB_LO_1","SWE_038_MZB_LO_1-01.10.2009","01.10.2009",2009,10,1,"LIMNEPHILIDAE GEN. SP.",1.6
"SWE_038_MZB_LO_1","SWE_038_MZB_LO_1-01.10.2009","01.10.2009",2009,10,1,"LYMNAEIDAE GEN. SP.",0.8
"SWE_038_MZB_LO_1","SWE_038_MZB_LO_1-01.10.2009","01.10.2009",2009,10,1,"NEMOURIDAE GEN. SP.",21.8
"SWE_038_MZB_LO_1","SWE_038_MZB_LO_1-01.10.2009","01.10.2009",2009,10,1,"OLIGOCHAETA GEN. SP.",4
"SWE_038_MZB_LO_1","SWE_038_MZB_LO_1-01.10.2009","01.10.2009",2009,10,1,"OULIMNIUS SP.",2
"SWE_038_MZB_LO_1","SWE_038_MZB_LO_1-01.10.2009","01.10.2009",2009,10,1,"PERLODIDAE GEN. SP.",7.8
"SWE_038_MZB_LO_1","SWE_038_MZB_LO_1-01.10.2009","01.10.2009",2009,10,1,"POLYCENTROPODIDAE GEN. SP.",4.2
"SWE_038_MZB_LO_1","SWE_038_MZB_LO_1-01.10.2009","01.10.2009",2009,10,1,"PSYCHODIDAE GEN. SP.",0.2
"SWE_038_MZB_LO_1","SWE_038_MZB_LO_1-01.10.2009","01.10.2009",2009,10,1,"RHYACOPHILA SP.",6
"SWE_038_MZB_LO_1","SWE_038_MZB_LO_1-01.10.2009","01.10.2009",2009,10,1,"SIMULIIDAE GEN. SP.",4.4
"SWE_038_MZB_LO_1","SWE_038_MZB_LO_1-01.10.2009","01.10.2009",2009,10,1,"SIPHONOPERLA BURMEISTERI",1.2
"SWE_038_MZB_LO_1","SWE_038_MZB_LO_1-01.10.2009","01.10.2009",2009,10,1,"TAENIOPTERYX NEBULOSA",3
"SWE_038_MZB_LO_1","SWE_038_MZB_LO_1-13.09.2010","13.09.2010",2010,9,13,"AMELETUS SP.",2.6
"SWE_038_MZB_LO_1","SWE_038_MZB_LO_1-13.09.2010","13.09.2010",2010,9,13,"ARCTOPSYCHE LADOGENSIS",0.4
"SWE_038_MZB_LO_1","SWE_038_MZB_LO_1-13.09.2010","13.09.2010",2010,9,13,"BAETIDAE GEN. SP.",55.8
"SWE_038_MZB_LO_1","SWE_038_MZB_LO_1-13.09.2010","13.09.2010",2010,9,13,"CAPNOPSIS SCHILLERI SSP.",0.2
"SWE_038_MZB_LO_1","SWE_038_MZB_LO_1-13.09.2010","13.09.2010",2010,9,13,"CERATOPOGONIDAE GEN. SP.",10.4
"SWE_038_MZB_LO_1","SWE_038_MZB_LO_1-13.09.2010","13.09.2010",2010,9,13,"CHIRONOMIDAE GEN. SP.",83.8
"SWE_038_MZB_LO_1","SWE_038_MZB_LO_1-13.09.2010","13.09.2010",2010,9,13,"DICRANOTA SP.",0.8
"SWE_038_MZB_LO_1","SWE_038_MZB_LO_1-13.09.2010","13.09.2010",2010,9,13,"ELMIS AENEA",26.4
"SWE_038_MZB_LO_1","SWE_038_MZB_LO_1-13.09.2010","13.09.2010",2010,9,13,"EMPIDIDAE GEN. SP.",3.8
"SWE_038_MZB_LO_1","SWE_038_MZB_LO_1-13.09.2010","13.09.2010",2010,9,13,"EPHEMERELLA SP.",22.6
"SWE_038_MZB_LO_1","SWE_038_MZB_LO_1-13.09.2010","13.09.2010",2010,9,13,"GLOSSIPHONIIDAE GEN. SP.",0.2
"SWE_038_MZB_LO_1","SWE_038_MZB_LO_1-13.09.2010","13.09.2010",2010,9,13,"HEPTAGENIIDAE GEN. SP.",3
"SWE_038_MZB_LO_1","SWE_038_MZB_LO_1-13.09.2010","13.09.2010",2010,9,13,"HYDRACHNIDIA GEN. SP.",7.2
"SWE_038_MZB_LO_1","SWE_038_MZB_LO_1-13.09.2010","13.09.2010",2010,9,13,"HYDRAENIDAE GEN. SP.",0.4
"SWE_038_MZB_LO_1","SWE_038_MZB_LO_1-13.09.2010","13.09.2010",2010,9,13,"HYDROPTILIDAE GEN. SP.",16.2
"SWE_038_MZB_LO_1","SWE_038_MZB_LO_1-13.09.2010","13.09.2010",2010,9,13,"LEPIDOSTOMA HIRTUM",0.6
"SWE_038_MZB_LO_1","SWE_038_MZB_LO_1-13.09.2010","13.09.2010",2010,9,13,"LEPTOCERIDAE GEN. SP.",0.2
"SWE_038_MZB_LO_1","SWE_038_MZB_LO_1-13.09.2010","13.09.2010",2010,9,13,"LEUCTRA SP.",80
"SWE_038_MZB_LO_1","SWE_038_MZB_LO_1-13.09.2010","13.09.2010",2010,9,13,"LIMONIIDAE GEN. SP.",0.6
"SWE_038_MZB_LO_1","SWE_038_MZB_LO_1-13.09.2010","13.09.2010",2010,9,13,"NEMOURIDAE GEN. SP.",2.2
"SWE_038_MZB_LO_1","SWE_038_MZB_LO_1-13.09.2010","13.09.2010",2010,9,13,"OLIGOCHAETA GEN. SP.",5.4
"SWE_038_MZB_LO_1","SWE_038_MZB_LO_1-13.09.2010","13.09.2010",2010,9,13,"OULIMNIUS SP.",1.4
"SWE_038_MZB_LO_1","SWE_038_MZB_LO_1-13.09.2010","13.09.2010",2010,9,13,"PERLODIDAE GEN. SP.",5.6
"SWE_038_MZB_LO_1","SWE_038_MZB_LO_1-13.09.2010","13.09.2010",2010,9,13,"POLYCENTROPODIDAE GEN. SP.",0.6
"SWE_038_MZB_LO_1","SWE_038_MZB_LO_1-13.09.2010","13.09.2010",2010,9,13,"RHYACOPHILA SP.",7.4
"SWE_038_MZB_LO_1","SWE_038_MZB_LO_1-13.09.2010","13.09.2010",2010,9,13,"SERICOSTOMATIDAE GEN. SP.",0.2
"SWE_038_MZB_LO_1","SWE_038_MZB_LO_1-13.09.2010","13.09.2010",2010,9,13,"SIMULIIDAE GEN. SP.",13.2
"SWE_038_MZB_LO_1","SWE_038_MZB_LO_1-13.09.2010","13.09.2010",2010,9,13,"SIPHONOPERLA BURMEISTERI",1.6
"SWE_038_MZB_LO_1","SWE_038_MZB_LO_1-13.09.2010","13.09.2010",2010,9,13,"TAENIOPTERYX NEBULOSA",1.2
"SWE_038_MZB_LO_1","SWE_038_MZB_LO_1-11.09.2011","11.09.2011",2011,9,11,"ARCTOPSYCHE LADOGENSIS",0.4
"SWE_038_MZB_LO_1","SWE_038_MZB_LO_1-11.09.2011","11.09.2011",2011,9,11,"BAETIDAE GEN. SP.",57.6
"SWE_038_MZB_LO_1","SWE_038_MZB_LO_1-11.09.2011","11.09.2011",2011,9,11,"CAENIS SP.",0.2
"SWE_038_MZB_LO_1","SWE_038_MZB_LO_1-11.09.2011","11.09.2011",2011,9,11,"CERATOPOGONIDAE GEN. SP.",11
"SWE_038_MZB_LO_1","SWE_038_MZB_LO_1-11.09.2011","11.09.2011",2011,9,11,"CHIRONOMIDAE GEN. SP.",19.6
"SWE_038_MZB_LO_1","SWE_038_MZB_LO_1-11.09.2011","11.09.2011",2011,9,11,"DICRANOTA SP.",2.8
"SWE_038_MZB_LO_1","SWE_038_MZB_LO_1-11.09.2011","11.09.2011",2011,9,11,"ELMIS AENEA",44.4
"SWE_038_MZB_LO_1","SWE_038_MZB_LO_1-11.09.2011","11.09.2011",2011,9,11,"EMPIDIDAE GEN. SP.",8.6
"SWE_038_MZB_LO_1","SWE_038_MZB_LO_1-11.09.2011","11.09.2011",2011,9,11,"EPHEMERELLA SP.",22
"SWE_038_MZB_LO_1","SWE_038_MZB_LO_1-11.09.2011","11.09.2011",2011,9,11,"HEPTAGENIIDAE GEN. SP.",9.6
"SWE_038_MZB_LO_1","SWE_038_MZB_LO_1-11.09.2011","11.09.2011",2011,9,11,"HYDRACHNIDIA GEN. SP.",4.8
"SWE_038_MZB_LO_1","SWE_038_MZB_LO_1-11.09.2011","11.09.2011",2011,9,11,"HYDRAENIDAE GEN. SP.",0.6
"SWE_038_MZB_LO_1","SWE_038_MZB_LO_1-11.09.2011","11.09.2011",2011,9,11,"HYDROPSYCHE SP.",0.4
"SWE_038_MZB_LO_1","SWE_038_MZB_LO_1-11.09.2011","11.09.2011",2011,9,11,"HYDROPTILIDAE GEN. SP.",7.8
"SWE_038_MZB_LO_1","SWE_038_MZB_LO_1-11.09.2011","11.09.2011",2011,9,11,"LEPIDOSTOMA HIRTUM",1
"SWE_038_MZB_LO_1","SWE_038_MZB_LO_1-11.09.2011","11.09.2011",2011,9,11,"LEUCTRA SP.",15
"SWE_038_MZB_LO_1","SWE_038_MZB_LO_1-11.09.2011","11.09.2011",2011,9,11,"LIMNEPHILIDAE GEN. SP.",0.2
"SWE_038_MZB_LO_1","SWE_038_MZB_LO_1-11.09.2011","11.09.2011",2011,9,11,"LIMNIUS SP.",0.2
"SWE_038_MZB_LO_1","SWE_038_MZB_LO_1-11.09.2011","11.09.2011",2011,9,11,"LIMONIIDAE GEN. SP.",0.2
"SWE_038_MZB_LO_1","SWE_038_MZB_LO_1-11.09.2011","11.09.2011",2011,9,11,"NEMOURIDAE GEN. SP.",20
"SWE_038_MZB_LO_1","SWE_038_MZB_LO_1-11.09.2011","11.09.2011",2011,9,11,"OLIGOCHAETA GEN. SP.",9.2
"SWE_038_MZB_LO_1","SWE_038_MZB_LO_1-11.09.2011","11.09.2011",2011,9,11,"OULIMNIUS SP.",6.2
"SWE_038_MZB_LO_1","SWE_038_MZB_LO_1-11.09.2011","11.09.2011",2011,9,11,"PERLODIDAE GEN. SP.",3.4
"SWE_038_MZB_LO_1","SWE_038_MZB_LO_1-11.09.2011","11.09.2011",2011,9,11,"PLANORBIDAE GEN. SP.",0.2
"SWE_038_MZB_LO_1","SWE_038_MZB_LO_1-11.09.2011","11.09.2011",2011,9,11,"POLYCENTROPODIDAE GEN. SP.",0.8
"SWE_038_MZB_LO_1","SWE_038_MZB_LO_1-11.09.2011","11.09.2011",2011,9,11,"RHYACOPHILA SP.",6.8
"SWE_038_MZB_LO_1","SWE_038_MZB_LO_1-11.09.2011","11.09.2011",2011,9,11,"SERICOSTOMATIDAE GEN. SP.",0.4
"SWE_038_MZB_LO_1","SWE_038_MZB_LO_1-11.09.2011","11.09.2011",2011,9,11,"SIMULIIDAE GEN. SP.",1.6
"SWE_038_MZB_LO_1","SWE_038_MZB_LO_1-11.09.2011","11.09.2011",2011,9,11,"SIPHONOPERLA BURMEISTERI",1.6
"SWE_038_MZB_LO_1","SWE_038_MZB_LO_1-11.09.2011","11.09.2011",2011,9,11,"SPHAERIIDAE GEN. SP.",0.2
"SWE_038_MZB_LO_1","SWE_038_MZB_LO_1-11.09.2011","11.09.2011",2011,9,11,"TAENIOPTERYX NEBULOSA",1.8
"SWE_038_MZB_LO_1","SWE_038_MZB_LO_1-11.09.2011","11.09.2011",2011,9,11,"TURBELLARIA GEN. SP.",0.2
"SWE_038_MZB_LO_1","SWE_038_MZB_LO_1-12.09.2012","12.09.2012",2012,9,12,"AMELETUS SP.",0.6
"SWE_038_MZB_LO_1","SWE_038_MZB_LO_1-12.09.2012","12.09.2012",2012,9,12,"ARCTOPSYCHE LADOGENSIS",0.4
"SWE_038_MZB_LO_1","SWE_038_MZB_LO_1-12.09.2012","12.09.2012",2012,9,12,"BAETIDAE GEN. SP.",72
"SWE_038_MZB_LO_1","SWE_038_MZB_LO_1-12.09.2012","12.09.2012",2012,9,12,"CAPNOPSIS SCHILLERI SSP.",0.6
"SWE_038_MZB_LO_1","SWE_038_MZB_LO_1-12.09.2012","12.09.2012",2012,9,12,"CERATOPOGONIDAE GEN. SP.",2
"SWE_038_MZB_LO_1","SWE_038_MZB_LO_1-12.09.2012","12.09.2012",2012,9,12,"CHIRONOMIDAE GEN. SP.",58.6
"SWE_038_MZB_LO_1","SWE_038_MZB_LO_1-12.09.2012","12.09.2012",2012,9,12,"DICRANOTA SP.",1.6
"SWE_038_MZB_LO_1","SWE_038_MZB_LO_1-12.09.2012","12.09.2012",2012,9,12,"ELMIS AENEA",27.4
"SWE_038_MZB_LO_1","SWE_038_MZB_LO_1-12.09.2012","12.09.2012",2012,9,12,"EMPIDIDAE GEN. SP.",5
"SWE_038_MZB_LO_1","SWE_038_MZB_LO_1-12.09.2012","12.09.2012",2012,9,12,"EPHEMERELLA SP.",17.6
"SWE_038_MZB_LO_1","SWE_038_MZB_LO_1-12.09.2012","12.09.2012",2012,9,12,"HEPTAGENIIDAE GEN. SP.",6.8
"SWE_038_MZB_LO_1","SWE_038_MZB_LO_1-12.09.2012","12.09.2012",2012,9,12,"HYDRACHNIDIA GEN. SP.",2.2
"SWE_038_MZB_LO_1","SWE_038_MZB_LO_1-12.09.2012","12.09.2012",2012,9,12,"HYDRAENIDAE GEN. SP.",0.8
"SWE_038_MZB_LO_1","SWE_038_MZB_LO_1-12.09.2012","12.09.2012",2012,9,12,"HYDROPTILIDAE GEN. SP.",7.4
"SWE_038_MZB_LO_1","SWE_038_MZB_LO_1-12.09.2012","12.09.2012",2012,9,12,"LEPIDOSTOMA HIRTUM",0.2
"SWE_038_MZB_LO_1","SWE_038_MZB_LO_1-12.09.2012","12.09.2012",2012,9,12,"LEUCTRA SP.",64.8
"SWE_038_MZB_LO_1","SWE_038_MZB_LO_1-12.09.2012","12.09.2012",2012,9,12,"LIMNEPHILIDAE GEN. SP.",1.8
"SWE_038_MZB_LO_1","SWE_038_MZB_LO_1-12.09.2012","12.09.2012",2012,9,12,"LYMNAEIDAE GEN. SP.",0.2
"SWE_038_MZB_LO_1","SWE_038_MZB_LO_1-12.09.2012","12.09.2012",2012,9,12,"NEMOURIDAE GEN. SP.",12.6
"SWE_038_MZB_LO_1","SWE_038_MZB_LO_1-12.09.2012","12.09.2012",2012,9,12,"OLIGOCHAETA GEN. SP.",2.8
"SWE_038_MZB_LO_1","SWE_038_MZB_LO_1-12.09.2012","12.09.2012",2012,9,12,"OULIMNIUS SP.",3
"SWE_038_MZB_LO_1","SWE_038_MZB_LO_1-12.09.2012","12.09.2012",2012,9,12,"PERLODIDAE GEN. SP.",4.6
"SWE_038_MZB_LO_1","SWE_038_MZB_LO_1-12.09.2012","12.09.2012",2012,9,12,"POLYCENTROPODIDAE GEN. SP.",0.2
"SWE_038_MZB_LO_1","SWE_038_MZB_LO_1-12.09.2012","12.09.2012",2012,9,12,"RHYACOPHILA SP.",3.2
"SWE_038_MZB_LO_1","SWE_038_MZB_LO_1-12.09.2012","12.09.2012",2012,9,12,"SERICOSTOMATIDAE GEN. SP.",0.2
"SWE_038_MZB_LO_1","SWE_038_MZB_LO_1-12.09.2012","12.09.2012",2012,9,12,"SIALIS SP.",0.2
"SWE_038_MZB_LO_1","SWE_038_MZB_LO_1-12.09.2012","12.09.2012",2012,9,12,"SIMULIIDAE GEN. SP.",28.4
"SWE_038_MZB_LO_1","SWE_038_MZB_LO_1-12.09.2012","12.09.2012",2012,9,12,"SPHAERIIDAE GEN. SP.",0.2
"SWE_038_MZB_LO_1","SWE_038_MZB_LO_1-12.09.2012","12.09.2012",2012,9,12,"TAENIOPTERYX NEBULOSA",0.4
"SWE_038_MZB_LO_1","SWE_038_MZB_LO_1-12.09.2012","12.09.2012",2012,9,12,"TURBELLARIA GEN. SP.",0.4
"SWE_038_MZB_LO_1","SWE_038_MZB_LO_1-19.09.2013","19.09.2013",2013,9,19,"AMELETUS SP.",1.4
"SWE_038_MZB_LO_1","SWE_038_MZB_LO_1-19.09.2013","19.09.2013",2013,9,19,"ARCTOPSYCHE LADOGENSIS",0.2
"SWE_038_MZB_LO_1","SWE_038_MZB_LO_1-19.09.2013","19.09.2013",2013,9,19,"ASELLUS AQUATICUS",0.2
"SWE_038_MZB_LO_1","SWE_038_MZB_LO_1-19.09.2013","19.09.2013",2013,9,19,"BAETIDAE GEN. SP.",165
"SWE_038_MZB_LO_1","SWE_038_MZB_LO_1-19.09.2013","19.09.2013",2013,9,19,"CAPNOPSIS SCHILLERI SSP.",1.2
"SWE_038_MZB_LO_1","SWE_038_MZB_LO_1-19.09.2013","19.09.2013",2013,9,19,"CERATOPOGONIDAE GEN. SP.",4.6
"SWE_038_MZB_LO_1","SWE_038_MZB_LO_1-19.09.2013","19.09.2013",2013,9,19,"CHIRONOMIDAE GEN. SP.",64.2
"SWE_038_MZB_LO_1","SWE_038_MZB_LO_1-19.09.2013","19.09.2013",2013,9,19,"DICRANOTA SP.",1.8
"SWE_038_MZB_LO_1","SWE_038_MZB_LO_1-19.09.2013","19.09.2013",2013,9,19,"DIPTERA GEN. SP.",0.2
"SWE_038_MZB_LO_1","SWE_038_MZB_LO_1-19.09.2013","19.09.2013",2013,9,19,"ELMIS AENEA",29
"SWE_038_MZB_LO_1","SWE_038_MZB_LO_1-19.09.2013","19.09.2013",2013,9,19,"EMPIDIDAE GEN. SP.",20
"SWE_038_MZB_LO_1","SWE_038_MZB_LO_1-19.09.2013","19.09.2013",2013,9,19,"EPHEMERELLA SP.",11.6
"SWE_038_MZB_LO_1","SWE_038_MZB_LO_1-19.09.2013","19.09.2013",2013,9,19,"HEPTAGENIIDAE GEN. SP.",6
"SWE_038_MZB_LO_1","SWE_038_MZB_LO_1-19.09.2013","19.09.2013",2013,9,19,"HYDRACHNIDAE GEN. SP.",12.2
"SWE_038_MZB_LO_1","SWE_038_MZB_LO_1-19.09.2013","19.09.2013",2013,9,19,"HYDRAENIDAE GEN. SP.",0.8
"SWE_038_MZB_LO_1","SWE_038_MZB_LO_1-19.09.2013","19.09.2013",2013,9,19,"HYDROPSYCHE SP.",0.2
"SWE_038_MZB_LO_1","SWE_038_MZB_LO_1-19.09.2013","19.09.2013",2013,9,19,"HYDROPTILIDAE GEN. SP.",10.4
"SWE_038_MZB_LO_1","SWE_038_MZB_LO_1-19.09.2013","19.09.2013",2013,9,19,"LEPIDOSTOMA HIRTUM",1.4
"SWE_038_MZB_LO_1","SWE_038_MZB_LO_1-19.09.2013","19.09.2013",2013,9,19,"LEPTOCERIDAE GEN. SP.",0.2
"SWE_038_MZB_LO_1","SWE_038_MZB_LO_1-19.09.2013","19.09.2013",2013,9,19,"LEPTOPHLEBIA SP.",0.2
"SWE_038_MZB_LO_1","SWE_038_MZB_LO_1-19.09.2013","19.09.2013",2013,9,19,"LEUCTRA SP.",50
"SWE_038_MZB_LO_1","SWE_038_MZB_LO_1-19.09.2013","19.09.2013",2013,9,19,"LIMNEPHILIDAE GEN. SP.",4.2
"SWE_038_MZB_LO_1","SWE_038_MZB_LO_1-19.09.2013","19.09.2013",2013,9,19,"LIMNIUS SP.",0.4
"SWE_038_MZB_LO_1","SWE_038_MZB_LO_1-19.09.2013","19.09.2013",2013,9,19,"LIMONIIDAE GEN. SP.",0.2
"SWE_038_MZB_LO_1","SWE_038_MZB_LO_1-19.09.2013","19.09.2013",2013,9,19,"NEMOURIDAE GEN. SP.",81.6
"SWE_038_MZB_LO_1","SWE_038_MZB_LO_1-19.09.2013","19.09.2013",2013,9,19,"OLIGOCHAETA GEN. SP.",2.6
"SWE_038_MZB_LO_1","SWE_038_MZB_LO_1-19.09.2013","19.09.2013",2013,9,19,"OULIMNIUS SP.",2.2
"SWE_038_MZB_LO_1","SWE_038_MZB_LO_1-19.09.2013","19.09.2013",2013,9,19,"PERLODIDAE GEN. SP.",4.8
"SWE_038_MZB_LO_1","SWE_038_MZB_LO_1-19.09.2013","19.09.2013",2013,9,19,"PLANORBIDAE GEN. SP.",0.4
"SWE_038_MZB_LO_1","SWE_038_MZB_LO_1-19.09.2013","19.09.2013",2013,9,19,"POLYCENTROPODIDAE GEN. SP.",1
"SWE_038_MZB_LO_1","SWE_038_MZB_LO_1-19.09.2013","19.09.2013",2013,9,19,"PSYCHODIDAE GEN. SP.",0.2
"SWE_038_MZB_LO_1","SWE_038_MZB_LO_1-19.09.2013","19.09.2013",2013,9,19,"RHYACOPHILA SP.",9.6
"SWE_038_MZB_LO_1","SWE_038_MZB_LO_1-19.09.2013","19.09.2013",2013,9,19,"SIMULIIDAE GEN. SP.",10.8
"SWE_038_MZB_LO_1","SWE_038_MZB_LO_1-19.09.2013","19.09.2013",2013,9,19,"SIPHONOPERLA BURMEISTERI",1.4
"SWE_038_MZB_LO_1","SWE_038_MZB_LO_1-17.09.2014","17.09.2014",2014,9,17,"AMELETUS SP.",0.2
"SWE_038_MZB_LO_1","SWE_038_MZB_LO_1-17.09.2014","17.09.2014",2014,9,17,"ATHERICIDAE GEN. SP.",0.2
"SWE_038_MZB_LO_1","SWE_038_MZB_LO_1-17.09.2014","17.09.2014",2014,9,17,"BAETIDAE GEN. SP.",102.6
"SWE_038_MZB_LO_1","SWE_038_MZB_LO_1-17.09.2014","17.09.2014",2014,9,17,"CAPNIA SP.",0.2
"SWE_038_MZB_LO_1","SWE_038_MZB_LO_1-17.09.2014","17.09.2014",2014,9,17,"CERATOPOGONIDAE GEN. SP.",4.6
"SWE_038_MZB_LO_1","SWE_038_MZB_LO_1-17.09.2014","17.09.2014",2014,9,17,"CHIRONOMIDAE GEN. SP.",189
"SWE_038_MZB_LO_1","SWE_038_MZB_LO_1-17.09.2014","17.09.2014",2014,9,17,"ELMIS AENEA",6.2
"SWE_038_MZB_LO_1","SWE_038_MZB_LO_1-17.09.2014","17.09.2014",2014,9,17,"EMPIDIDAE GEN. SP.",3.6
"SWE_038_MZB_LO_1","SWE_038_MZB_LO_1-17.09.2014","17.09.2014",2014,9,17,"EPHEMERELLA SP.",2.8
"SWE_038_MZB_LO_1","SWE_038_MZB_LO_1-17.09.2014","17.09.2014",2014,9,17,"HEPTAGENIIDAE GEN. SP.",3.8
"SWE_038_MZB_LO_1","SWE_038_MZB_LO_1-17.09.2014","17.09.2014",2014,9,17,"HYDRACHNIDAE GEN. SP.",3.2
"SWE_038_MZB_LO_1","SWE_038_MZB_LO_1-17.09.2014","17.09.2014",2014,9,17,"HYDROPTILIDAE GEN. SP.",4.8
"SWE_038_MZB_LO_1","SWE_038_MZB_LO_1-17.09.2014","17.09.2014",2014,9,17,"LEPIDOSTOMA HIRTUM",0.2
"SWE_038_MZB_LO_1","SWE_038_MZB_LO_1-17.09.2014","17.09.2014",2014,9,17,"LEPTOCERIDAE GEN. SP.",0.6
"SWE_038_MZB_LO_1","SWE_038_MZB_LO_1-17.09.2014","17.09.2014",2014,9,17,"LEUCTRA SP.",10.8
"SWE_038_MZB_LO_1","SWE_038_MZB_LO_1-17.09.2014","17.09.2014",2014,9,17,"LIMNEPHILIDAE GEN. SP.",0.6
"SWE_038_MZB_LO_1","SWE_038_MZB_LO_1-17.09.2014","17.09.2014",2014,9,17,"LYMNAEIDAE GEN. SP.",0.4
"SWE_038_MZB_LO_1","SWE_038_MZB_LO_1-17.09.2014","17.09.2014",2014,9,17,"NEMOURIDAE GEN. SP.",1.2
"SWE_038_MZB_LO_1","SWE_038_MZB_LO_1-17.09.2014","17.09.2014",2014,9,17,"OLIGOCHAETA GEN. SP.",0.4
"SWE_038_MZB_LO_1","SWE_038_MZB_LO_1-17.09.2014","17.09.2014",2014,9,17,"OULIMNIUS SP.",1.6
"SWE_038_MZB_LO_1","SWE_038_MZB_LO_1-17.09.2014","17.09.2014",2014,9,17,"PERLODIDAE GEN. SP.",1.8
"SWE_038_MZB_LO_1","SWE_038_MZB_LO_1-17.09.2014","17.09.2014",2014,9,17,"POLYCENTROPODIDAE GEN. SP.",0.4
"SWE_038_MZB_LO_1","SWE_038_MZB_LO_1-17.09.2014","17.09.2014",2014,9,17,"RHYACOPHILA SP.",1.2
"SWE_038_MZB_LO_1","SWE_038_MZB_LO_1-17.09.2014","17.09.2014",2014,9,17,"SIMULIIDAE GEN. SP.",1.4
"SWE_038_MZB_LO_1","SWE_038_MZB_LO_1-17.09.2014","17.09.2014",2014,9,17,"STRATIOMYIDAE GEN. SP.",0.2
"SWE_038_MZB_LO_1","SWE_038_MZB_LO_1-17.09.2014","17.09.2014",2014,9,17,"TAENIOPTERYX NEBULOSA",0.4
"SWE_038_MZB_LO_1","SWE_038_MZB_LO_1-17.09.2014","17.09.2014",2014,9,17,"TRICLADIDA GEN. SP.",0.2
"SWE_038_MZB_LO_1","SWE_038_MZB_LO_1-06.10.2016","06.10.2016",2016,10,6,"AMELETUS SP.",0.8
"SWE_038_MZB_LO_1","SWE_038_MZB_LO_1-06.10.2016","06.10.2016",2016,10,6,"ATHERICIDAE GEN. SP.",0.2
"SWE_038_MZB_LO_1","SWE_038_MZB_LO_1-06.10.2016","06.10.2016",2016,10,6,"BAETIDAE GEN. SP.",67.8
"SWE_038_MZB_LO_1","SWE_038_MZB_LO_1-06.10.2016","06.10.2016",2016,10,6,"CAPNOPSIS SCHILLERI SSP.",0.2
"SWE_038_MZB_LO_1","SWE_038_MZB_LO_1-06.10.2016","06.10.2016",2016,10,6,"CERATOPOGONIDAE GEN. SP.",4.2
"SWE_038_MZB_LO_1","SWE_038_MZB_LO_1-06.10.2016","06.10.2016",2016,10,6,"CHIRONOMIDAE GEN. SP.",50.6
"SWE_038_MZB_LO_1","SWE_038_MZB_LO_1-06.10.2016","06.10.2016",2016,10,6,"DICRANOTA SP.",1
"SWE_038_MZB_LO_1","SWE_038_MZB_LO_1-06.10.2016","06.10.2016",2016,10,6,"ELMIS AENEA",24
"SWE_038_MZB_LO_1","SWE_038_MZB_LO_1-06.10.2016","06.10.2016",2016,10,6,"EMPIDIDAE GEN. SP.",5.2
"SWE_038_MZB_LO_1","SWE_038_MZB_LO_1-06.10.2016","06.10.2016",2016,10,6,"EPHEMERELLA SP.",9.4
"SWE_038_MZB_LO_1","SWE_038_MZB_LO_1-06.10.2016","06.10.2016",2016,10,6,"HEPTAGENIIDAE GEN. SP.",5.8
"SWE_038_MZB_LO_1","SWE_038_MZB_LO_1-06.10.2016","06.10.2016",2016,10,6,"HYDRACHNIDAE GEN. SP.",6.2
"SWE_038_MZB_LO_1","SWE_038_MZB_LO_1-06.10.2016","06.10.2016",2016,10,6,"HYDRAENIDAE GEN. SP.",0.4
"SWE_038_MZB_LO_1","SWE_038_MZB_LO_1-06.10.2016","06.10.2016",2016,10,6,"HYDROPSYCHE SP.",0.4
"SWE_038_MZB_LO_1","SWE_038_MZB_LO_1-06.10.2016","06.10.2016",2016,10,6,"HYDROPTILIDAE GEN. SP.",2.2
"SWE_038_MZB_LO_1","SWE_038_MZB_LO_1-06.10.2016","06.10.2016",2016,10,6,"LEPIDOSTOMA HIRTUM",0.6
"SWE_038_MZB_LO_1","SWE_038_MZB_LO_1-06.10.2016","06.10.2016",2016,10,6,"LEPTOCERIDAE GEN. SP.",0.2
"SWE_038_MZB_LO_1","SWE_038_MZB_LO_1-06.10.2016","06.10.2016",2016,10,6,"LEUCTRA SP.",27.6
"SWE_038_MZB_LO_1","SWE_038_MZB_LO_1-06.10.2016","06.10.2016",2016,10,6,"LIMNEPHILIDAE GEN. SP.",0.4
"SWE_038_MZB_LO_1","SWE_038_MZB_LO_1-06.10.2016","06.10.2016",2016,10,6,"LYMNAEIDAE GEN. SP.",0.2
"SWE_038_MZB_LO_1","SWE_038_MZB_LO_1-06.10.2016","06.10.2016",2016,10,6,"NEMOURIDAE GEN. SP.",64
"SWE_038_MZB_LO_1","SWE_038_MZB_LO_1-06.10.2016","06.10.2016",2016,10,6,"OLIGOCHAETA GEN. SP.",4
"SWE_038_MZB_LO_1","SWE_038_MZB_LO_1-06.10.2016","06.10.2016",2016,10,6,"OULIMNIUS SP.",3.6
"SWE_038_MZB_LO_1","SWE_038_MZB_LO_1-06.10.2016","06.10.2016",2016,10,6,"PERLODIDAE GEN. SP.",3.6
"SWE_038_MZB_LO_1","SWE_038_MZB_LO_1-06.10.2016","06.10.2016",2016,10,6,"POLYCENTROPODIDAE GEN. SP.",0.4
"SWE_038_MZB_LO_1","SWE_038_MZB_LO_1-06.10.2016","06.10.2016",2016,10,6,"PSYCHODIDAE GEN. SP.",0.6
"SWE_038_MZB_LO_1","SWE_038_MZB_LO_1-06.10.2016","06.10.2016",2016,10,6,"RHYACOPHILA SP.",4.6
"SWE_038_MZB_LO_1","SWE_038_MZB_LO_1-06.10.2016","06.10.2016",2016,10,6,"SIMULIIDAE GEN. SP.",9
"SWE_038_MZB_LO_1","SWE_038_MZB_LO_1-06.10.2016","06.10.2016",2016,10,6,"SIPHONOPERLA BURMEISTERI",2.8
"SWE_038_MZB_LO_1","SWE_038_MZB_LO_1-06.10.2016","06.10.2016",2016,10,6,"TAENIOPTERYX NEBULOSA",1.2
"SWE_038_MZB_LO_1","SWE_038_MZB_LO_1-06.10.2016","06.10.2016",2016,10,6,"TRICLADIDA GEN. SP.",0.2
"SWE_038_MZB_LO_1","SWE_038_MZB_LO_1-05.10.2017","05.10.2017",2017,10,5,"AMELETUS SP.",0.6
"SWE_038_MZB_LO_1","SWE_038_MZB_LO_1-05.10.2017","05.10.2017",2017,10,5,"BAETIDAE GEN. SP.",30.2
"SWE_038_MZB_LO_1","SWE_038_MZB_LO_1-05.10.2017","05.10.2017",2017,10,5,"CAPNOPSIS SCHILLERI SSP.",0.6
"SWE_038_MZB_LO_1","SWE_038_MZB_LO_1-05.10.2017","05.10.2017",2017,10,5,"CERATOPOGONIDAE GEN. SP.",2
"SWE_038_MZB_LO_1","SWE_038_MZB_LO_1-05.10.2017","05.10.2017",2017,10,5,"CHIRONOMIDAE GEN. SP.",14.4
"SWE_038_MZB_LO_1","SWE_038_MZB_LO_1-05.10.2017","05.10.2017",2017,10,5,"ELMIS AENEA",6.6
"SWE_038_MZB_LO_1","SWE_038_MZB_LO_1-05.10.2017","05.10.2017",2017,10,5,"EMPIDIDAE GEN. SP.",2.8
"SWE_038_MZB_LO_1","SWE_038_MZB_LO_1-05.10.2017","05.10.2017",2017,10,5,"EPHEMERELLA SP.",10
"SWE_038_MZB_LO_1","SWE_038_MZB_LO_1-05.10.2017","05.10.2017",2017,10,5,"HEPTAGENIIDAE GEN. SP.",0.4
"SWE_038_MZB_LO_1","SWE_038_MZB_LO_1-05.10.2017","05.10.2017",2017,10,5,"HYDRACHNIDAE GEN. SP.",1.6
"SWE_038_MZB_LO_1","SWE_038_MZB_LO_1-05.10.2017","05.10.2017",2017,10,5,"HYDROPTILIDAE GEN. SP.",2.6
"SWE_038_MZB_LO_1","SWE_038_MZB_LO_1-05.10.2017","05.10.2017",2017,10,5,"LEUCTRA SP.",6.6
"SWE_038_MZB_LO_1","SWE_038_MZB_LO_1-05.10.2017","05.10.2017",2017,10,5,"LIMNEPHILIDAE GEN. SP.",1.6
"SWE_038_MZB_LO_1","SWE_038_MZB_LO_1-05.10.2017","05.10.2017",2017,10,5,"NEMOURIDAE GEN. SP.",5.2
"SWE_038_MZB_LO_1","SWE_038_MZB_LO_1-05.10.2017","05.10.2017",2017,10,5,"OLIGOCHAETA GEN. SP.",1.8
"SWE_038_MZB_LO_1","SWE_038_MZB_LO_1-05.10.2017","05.10.2017",2017,10,5,"OULIMNIUS SP.",3
"SWE_038_MZB_LO_1","SWE_038_MZB_LO_1-05.10.2017","05.10.2017",2017,10,5,"PERLODIDAE GEN. SP.",2.4
"SWE_038_MZB_LO_1","SWE_038_MZB_LO_1-05.10.2017","05.10.2017",2017,10,5,"RHYACOPHILA SP.",1.8
"SWE_038_MZB_LO_1","SWE_038_MZB_LO_1-05.10.2017","05.10.2017",2017,10,5,"SIALIS SP.",0.2
"SWE_038_MZB_LO_1","SWE_038_MZB_LO_1-05.10.2017","05.10.2017",2017,10,5,"SIMULIIDAE GEN. SP.",2.8
"SWE_038_MZB_LO_1","SWE_038_MZB_LO_1-05.10.2017","05.10.2017",2017,10,5,"SIPHONOPERLA BURMEISTERI",0.2
"SWE_038_MZB_LO_1","SWE_038_MZB_LO_1-22.09.2018","22.09.2018",2018,9,22,"AMELETUS SP.",7.6
"SWE_038_MZB_LO_1","SWE_038_MZB_LO_1-22.09.2018","22.09.2018",2018,9,22,"ATHERICIDAE GEN. SP.",0.8
"SWE_038_MZB_LO_1","SWE_038_MZB_LO_1-22.09.2018","22.09.2018",2018,9,22,"BAETIDAE GEN. SP.",122.4
"SWE_038_MZB_LO_1","SWE_038_MZB_LO_1-22.09.2018","22.09.2018",2018,9,22,"CERATOPOGONIDAE GEN. SP.",2.6
"SWE_038_MZB_LO_1","SWE_038_MZB_LO_1-22.09.2018","22.09.2018",2018,9,22,"CHIRONOMIDAE GEN. SP.",27.8
"SWE_038_MZB_LO_1","SWE_038_MZB_LO_1-22.09.2018","22.09.2018",2018,9,22,"DICRANOTA SP.",1.2
"SWE_038_MZB_LO_1","SWE_038_MZB_LO_1-22.09.2018","22.09.2018",2018,9,22,"ELMIS AENEA",17.6
"SWE_038_MZB_LO_1","SWE_038_MZB_LO_1-22.09.2018","22.09.2018",2018,9,22,"EMPIDIDAE GEN. SP.",1.6
"SWE_038_MZB_LO_1","SWE_038_MZB_LO_1-22.09.2018","22.09.2018",2018,9,22,"EPHEMERELLA SP.",36.4
"SWE_038_MZB_LO_1","SWE_038_MZB_LO_1-22.09.2018","22.09.2018",2018,9,22,"HEPTAGENIIDAE GEN. SP.",6.6
"SWE_038_MZB_LO_1","SWE_038_MZB_LO_1-22.09.2018","22.09.2018",2018,9,22,"HYDRACHNIDAE GEN. SP.",3.4
"SWE_038_MZB_LO_1","SWE_038_MZB_LO_1-22.09.2018","22.09.2018",2018,9,22,"HYDRAENIDAE GEN. SP.",0.6
"SWE_038_MZB_LO_1","SWE_038_MZB_LO_1-22.09.2018","22.09.2018",2018,9,22,"HYDROPSYCHE SP.",0.4
"SWE_038_MZB_LO_1","SWE_038_MZB_LO_1-22.09.2018","22.09.2018",2018,9,22,"HYDROPTILIDAE GEN. SP.",29.4
"SWE_038_MZB_LO_1","SWE_038_MZB_LO_1-22.09.2018","22.09.2018",2018,9,22,"LEPIDOSTOMA HIRTUM",5.8
"SWE_038_MZB_LO_1","SWE_038_MZB_LO_1-22.09.2018","22.09.2018",2018,9,22,"LEPTOCERIDAE GEN. SP.",0.2
"SWE_038_MZB_LO_1","SWE_038_MZB_LO_1-22.09.2018","22.09.2018",2018,9,22,"LEPTOPHLEBIA SP.",0.8
"SWE_038_MZB_LO_1","SWE_038_MZB_LO_1-22.09.2018","22.09.2018",2018,9,22,"LEUCTRA SP.",35.6
"SWE_038_MZB_LO_1","SWE_038_MZB_LO_1-22.09.2018","22.09.2018",2018,9,22,"LIMNEPHILIDAE GEN. SP.",4.4
"SWE_038_MZB_LO_1","SWE_038_MZB_LO_1-22.09.2018","22.09.2018",2018,9,22,"LYMNAEIDAE GEN. SP.",1
"SWE_038_MZB_LO_1","SWE_038_MZB_LO_1-22.09.2018","22.09.2018",2018,9,22,"NEMOURIDAE GEN. SP.",28.4
"SWE_038_MZB_LO_1","SWE_038_MZB_LO_1-22.09.2018","22.09.2018",2018,9,22,"OLIGOCHAETA GEN. SP.",9.2
"SWE_038_MZB_LO_1","SWE_038_MZB_LO_1-22.09.2018","22.09.2018",2018,9,22,"OULIMNIUS SP.",1.6
"SWE_038_MZB_LO_1","SWE_038_MZB_LO_1-22.09.2018","22.09.2018",2018,9,22,"PERLODIDAE GEN. SP.",4.6
"SWE_038_MZB_LO_1","SWE_038_MZB_LO_1-22.09.2018","22.09.2018",2018,9,22,"POLYCENTROPODIDAE GEN. SP.",4.8
"SWE_038_MZB_LO_1","SWE_038_MZB_LO_1-22.09.2018","22.09.2018",2018,9,22,"RHYACOPHILA SP.",5.8
"SWE_038_MZB_LO_1","SWE_038_MZB_LO_1-22.09.2018","22.09.2018",2018,9,22,"SERICOSTOMATIDAE GEN. SP.",0.2
"SWE_038_MZB_LO_1","SWE_038_MZB_LO_1-22.09.2018","22.09.2018",2018,9,22,"SIALIS SP.",0.2
"SWE_038_MZB_LO_1","SWE_038_MZB_LO_1-22.09.2018","22.09.2018",2018,9,22,"SIMULIIDAE GEN. SP.",4.2
"SWE_038_MZB_LO_1","SWE_038_MZB_LO_1-22.09.2018","22.09.2018",2018,9,22,"SIPHONOPERLA BURMEISTERI",0.6
"SWE_038_MZB_LO_1","SWE_038_MZB_LO_1-22.09.2018","22.09.2018",2018,9,22,"TAENIOPTERYX NEBULOSA",3.4
"SWE_038_MZB_LO_1","SWE_038_MZB_LO_1-22.09.2018","22.09.2018",2018,9,22,"TIPULIDAE GEN. SP.",0.2
"SWE_038_MZB_LO_1","SWE_038_MZB_LO_1-24.09.2019","24.09.2019",2019,9,24,"ARGYRONETA AQUATICA",0.2
"SWE_038_MZB_LO_1","SWE_038_MZB_LO_1-24.09.2019","24.09.2019",2019,9,24,"BAETIDAE GEN. SP.",119
"SWE_038_MZB_LO_1","SWE_038_MZB_LO_1-24.09.2019","24.09.2019",2019,9,24,"CAPNOPSIS SCHILLERI SSP.",0.2
"SWE_038_MZB_LO_1","SWE_038_MZB_LO_1-24.09.2019","24.09.2019",2019,9,24,"CERATOPOGONIDAE GEN. SP.",0.8
"SWE_038_MZB_LO_1","SWE_038_MZB_LO_1-24.09.2019","24.09.2019",2019,9,24,"CHIRONOMIDAE GEN. SP.",11.2
"SWE_038_MZB_LO_1","SWE_038_MZB_LO_1-24.09.2019","24.09.2019",2019,9,24,"DICRANOTA SP.",1.2
"SWE_038_MZB_LO_1","SWE_038_MZB_LO_1-24.09.2019","24.09.2019",2019,9,24,"ELMIS AENEA",4.4
"SWE_038_MZB_LO_1","SWE_038_MZB_LO_1-24.09.2019","24.09.2019",2019,9,24,"EMPIDIDAE GEN. SP.",2.2
"SWE_038_MZB_LO_1","SWE_038_MZB_LO_1-24.09.2019","24.09.2019",2019,9,24,"EPHEMERELLA SP.",6
"SWE_038_MZB_LO_1","SWE_038_MZB_LO_1-24.09.2019","24.09.2019",2019,9,24,"HEPTAGENIIDAE GEN. SP.",2
"SWE_038_MZB_LO_1","SWE_038_MZB_LO_1-24.09.2019","24.09.2019",2019,9,24,"HYDRACHNIDAE GEN. SP.",1.6
"SWE_038_MZB_LO_1","SWE_038_MZB_LO_1-24.09.2019","24.09.2019",2019,9,24,"HYDRAENIDAE GEN. SP.",0.2
"SWE_038_MZB_LO_1","SWE_038_MZB_LO_1-24.09.2019","24.09.2019",2019,9,24,"HYDROPSYCHE SP.",0.4
"SWE_038_MZB_LO_1","SWE_038_MZB_LO_1-24.09.2019","24.09.2019",2019,9,24,"HYDROPTILIDAE GEN. SP.",1
"SWE_038_MZB_LO_1","SWE_038_MZB_LO_1-24.09.2019","24.09.2019",2019,9,24,"LEPIDOSTOMA HIRTUM",0.4
"SWE_038_MZB_LO_1","SWE_038_MZB_LO_1-24.09.2019","24.09.2019",2019,9,24,"LEPTOCERIDAE GEN. SP.",0.6
"SWE_038_MZB_LO_1","SWE_038_MZB_LO_1-24.09.2019","24.09.2019",2019,9,24,"LEUCTRA SP.",14.4
"SWE_038_MZB_LO_1","SWE_038_MZB_LO_1-24.09.2019","24.09.2019",2019,9,24,"LIMNEPHILIDAE GEN. SP.",0.6
"SWE_038_MZB_LO_1","SWE_038_MZB_LO_1-24.09.2019","24.09.2019",2019,9,24,"LIMNIUS SP.",0.2
"SWE_038_MZB_LO_1","SWE_038_MZB_LO_1-24.09.2019","24.09.2019",2019,9,24,"NEMOURIDAE GEN. SP.",15
"SWE_038_MZB_LO_1","SWE_038_MZB_LO_1-24.09.2019","24.09.2019",2019,9,24,"OLIGOCHAETA GEN. SP.",3
"SWE_038_MZB_LO_1","SWE_038_MZB_LO_1-24.09.2019","24.09.2019",2019,9,24,"OULIMNIUS SP.",1
"SWE_038_MZB_LO_1","SWE_038_MZB_LO_1-24.09.2019","24.09.2019",2019,9,24,"PERLODIDAE GEN. SP.",4.6
"SWE_038_MZB_LO_1","SWE_038_MZB_LO_1-24.09.2019","24.09.2019",2019,9,24,"POLYCENTROPODIDAE GEN. SP.",0.4
"SWE_038_MZB_LO_1","SWE_038_MZB_LO_1-24.09.2019","24.09.2019",2019,9,24,"RHYACOPHILA SP.",2.8
"SWE_038_MZB_LO_1","SWE_038_MZB_LO_1-24.09.2019","24.09.2019",2019,9,24,"SERICOSTOMATIDAE GEN. SP.",0.2
"SWE_038_MZB_LO_1","SWE_038_MZB_LO_1-24.09.2019","24.09.2019",2019,9,24,"SIMULIIDAE GEN. SP.",20.6
"SWE_038_MZB_LO_1","SWE_038_MZB_LO_1-24.09.2019","24.09.2019",2019,9,24,"SIPHONOPERLA BURMEISTERI",1.6
"SWE_038_MZB_LO_1","SWE_038_MZB_LO_1-24.09.2019","24.09.2019",2019,9,24,"TAENIOPTERYX NEBULOSA",0.2
"SWE_038_MZB_LO_10","SWE_038_MZB_LO_10-10.10.2007","10.10.2007",2007,10,10,"AMELETUS SP.",7.5
"SWE_038_MZB_LO_10","SWE_038_MZB_LO_10-10.10.2007","10.10.2007",2007,10,10,"BAETIDAE GEN. SP.",91
"SWE_038_MZB_LO_10","SWE_038_MZB_LO_10-10.10.2007","10.10.2007",2007,10,10,"CAPNIA SP.",2.25
"SWE_038_MZB_LO_10","SWE_038_MZB_LO_10-10.10.2007","10.10.2007",2007,10,10,"CHIRONOMIDAE GEN. SP.",16.75
"SWE_038_MZB_LO_10","SWE_038_MZB_LO_10-10.10.2007","10.10.2007",2007,10,10,"DICRANOTA SP.",0.5
"SWE_038_MZB_LO_10","SWE_038_MZB_LO_10-10.10.2007","10.10.2007",2007,10,10,"ELMIS AENEA",1.25
"SWE_038_MZB_LO_10","SWE_038_MZB_LO_10-10.10.2007","10.10.2007",2007,10,10,"EMPIDIDAE GEN. SP.",0.25
"SWE_038_MZB_LO_10","SWE_038_MZB_LO_10-10.10.2007","10.10.2007",2007,10,10,"EPHEMERELLA SP.",2.25
"SWE_038_MZB_LO_10","SWE_038_MZB_LO_10-10.10.2007","10.10.2007",2007,10,10,"HEPTAGENIIDAE GEN. SP.",23.25
"SWE_038_MZB_LO_10","SWE_038_MZB_LO_10-10.10.2007","10.10.2007",2007,10,10,"HYDROPTILIDAE GEN. SP.",0.25
"SWE_038_MZB_LO_10","SWE_038_MZB_LO_10-10.10.2007","10.10.2007",2007,10,10,"LEUCTRA SP.",0.25
"SWE_038_MZB_LO_10","SWE_038_MZB_LO_10-10.10.2007","10.10.2007",2007,10,10,"NEMOURIDAE GEN. SP.",4
"SWE_038_MZB_LO_10","SWE_038_MZB_LO_10-10.10.2007","10.10.2007",2007,10,10,"OLIGOCHAETA GEN. SP.",2
"SWE_038_MZB_LO_10","SWE_038_MZB_LO_10-10.10.2007","10.10.2007",2007,10,10,"PERLODIDAE GEN. SP.",13.75
"SWE_038_MZB_LO_10","SWE_038_MZB_LO_10-10.10.2007","10.10.2007",2007,10,10,"POLYCENTROPODIDAE GEN. SP.",0.75
"SWE_038_MZB_LO_10","SWE_038_MZB_LO_10-10.10.2007","10.10.2007",2007,10,10,"RHYACOPHILA SP.",3.75
"SWE_038_MZB_LO_10","SWE_038_MZB_LO_10-10.10.2007","10.10.2007",2007,10,10,"SIMULIIDAE GEN. SP.",3.5
"SWE_038_MZB_LO_10","SWE_038_MZB_LO_10-17.09.2008","17.09.2008",2008,9,17,"AMELETUS SP.",9.2
"SWE_038_MZB_LO_10","SWE_038_MZB_LO_10-17.09.2008","17.09.2008",2008,9,17,"BAETIDAE GEN. SP.",77.2
"SWE_038_MZB_LO_10","SWE_038_MZB_LO_10-17.09.2008","17.09.2008",2008,9,17,"CHIRONOMIDAE GEN. SP.",6
"SWE_038_MZB_LO_10","SWE_038_MZB_LO_10-17.09.2008","17.09.2008",2008,9,17,"DICRANOTA SP.",0.8
"SWE_038_MZB_LO_10","SWE_038_MZB_LO_10-17.09.2008","17.09.2008",2008,9,17,"ELMIS AENEA",0.4
"SWE_038_MZB_LO_10","SWE_038_MZB_LO_10-17.09.2008","17.09.2008",2008,9,17,"EMPIDIDAE GEN. SP.",0.4
"SWE_038_MZB_LO_10","SWE_038_MZB_LO_10-17.09.2008","17.09.2008",2008,9,17,"EPHEMERELLA SP.",0.6
"SWE_038_MZB_LO_10","SWE_038_MZB_LO_10-17.09.2008","17.09.2008",2008,9,17,"HEPTAGENIIDAE GEN. SP.",24
"SWE_038_MZB_LO_10","SWE_038_MZB_LO_10-17.09.2008","17.09.2008",2008,9,17,"HYDRACHNIDIA GEN. SP.",0.8
"SWE_038_MZB_LO_10","SWE_038_MZB_LO_10-17.09.2008","17.09.2008",2008,9,17,"LEPIDOSTOMA HIRTUM",0.2
"SWE_038_MZB_LO_10","SWE_038_MZB_LO_10-17.09.2008","17.09.2008",2008,9,17,"LEUCTRA SP.",4.2
"SWE_038_MZB_LO_10","SWE_038_MZB_LO_10-17.09.2008","17.09.2008",2008,9,17,"LIMNEPHILIDAE GEN. SP.",0.6
"SWE_038_MZB_LO_10","SWE_038_MZB_LO_10-17.09.2008","17.09.2008",2008,9,17,"NEMOURIDAE GEN. SP.",4.4
"SWE_038_MZB_LO_10","SWE_038_MZB_LO_10-17.09.2008","17.09.2008",2008,9,17,"OLIGOCHAETA GEN. SP.",9.2
"SWE_038_MZB_LO_10","SWE_038_MZB_LO_10-17.09.2008","17.09.2008",2008,9,17,"PERLODIDAE GEN. SP.",2.4
"SWE_038_MZB_LO_10","SWE_038_MZB_LO_10-17.09.2008","17.09.2008",2008,9,17,"PHILOPOTAMIDAE GEN. SP.",0.2
"SWE_038_MZB_LO_10","SWE_038_MZB_LO_10-17.09.2008","17.09.2008",2008,9,17,"POLYCENTROPODIDAE GEN. SP.",2.8
"SWE_038_MZB_LO_10","SWE_038_MZB_LO_10-17.09.2008","17.09.2008",2008,9,17,"RHYACOPHILA SP.",4.6
"SWE_038_MZB_LO_10","SWE_038_MZB_LO_10-17.09.2008","17.09.2008",2008,9,17,"SIMULIIDAE GEN. SP.",1.4
"SWE_038_MZB_LO_10","SWE_038_MZB_LO_10-14.09.2009","14.09.2009",2009,9,14,"AMELETUS SP.",1.2
"SWE_038_MZB_LO_10","SWE_038_MZB_LO_10-14.09.2009","14.09.2009",2009,9,14,"BAETIDAE GEN. SP.",86.4
"SWE_038_MZB_LO_10","SWE_038_MZB_LO_10-14.09.2009","14.09.2009",2009,9,14,"CAPNOPSIS SCHILLERI SSP.",0.4
"SWE_038_MZB_LO_10","SWE_038_MZB_LO_10-14.09.2009","14.09.2009",2009,9,14,"CERATOPOGONIDAE GEN. SP.",0.2
"SWE_038_MZB_LO_10","SWE_038_MZB_LO_10-14.09.2009","14.09.2009",2009,9,14,"CHIRONOMIDAE GEN. SP.",41.6
"SWE_038_MZB_LO_10","SWE_038_MZB_LO_10-14.09.2009","14.09.2009",2009,9,14,"DICRANOTA SP.",0.2
"SWE_038_MZB_LO_10","SWE_038_MZB_LO_10-14.09.2009","14.09.2009",2009,9,14,"ELMIS AENEA",6.6
"SWE_038_MZB_LO_10","SWE_038_MZB_LO_10-14.09.2009","14.09.2009",2009,9,14,"EMPIDIDAE GEN. SP.",6
"SWE_038_MZB_LO_10","SWE_038_MZB_LO_10-14.09.2009","14.09.2009",2009,9,14,"EPHEMERELLA SP.",1.4
"SWE_038_MZB_LO_10","SWE_038_MZB_LO_10-14.09.2009","14.09.2009",2009,9,14,"HEPTAGENIIDAE GEN. SP.",10.4
"SWE_038_MZB_LO_10","SWE_038_MZB_LO_10-14.09.2009","14.09.2009",2009,9,14,"HYDRACHNIDIA GEN. SP.",0.8
"SWE_038_MZB_LO_10","SWE_038_MZB_LO_10-14.09.2009","14.09.2009",2009,9,14,"LEUCTRA SP.",0.6
"SWE_038_MZB_LO_10","SWE_038_MZB_LO_10-14.09.2009","14.09.2009",2009,9,14,"LIMNEPHILIDAE GEN. SP.",0.4
"SWE_038_MZB_LO_10","SWE_038_MZB_LO_10-14.09.2009","14.09.2009",2009,9,14,"NEMOURIDAE GEN. SP.",1.8
"SWE_038_MZB_LO_10","SWE_038_MZB_LO_10-14.09.2009","14.09.2009",2009,9,14,"OLIGOCHAETA GEN. SP.",8.4
"SWE_038_MZB_LO_10","SWE_038_MZB_LO_10-14.09.2009","14.09.2009",2009,9,14,"PERLODIDAE GEN. SP.",30
"SWE_038_MZB_LO_10","SWE_038_MZB_LO_10-14.09.2009","14.09.2009",2009,9,14,"POLYCENTROPODIDAE GEN. SP.",0.6
"SWE_038_MZB_LO_10","SWE_038_MZB_LO_10-14.09.2009","14.09.2009",2009,9,14,"RHYACOPHILA SP.",3.2
"SWE_038_MZB_LO_10","SWE_038_MZB_LO_10-14.09.2009","14.09.2009",2009,9,14,"SIMULIIDAE GEN. SP.",0.6
"SWE_038_MZB_LO_10","SWE_038_MZB_LO_10-14.09.2009","14.09.2009",2009,9,14,"SPHAERIIDAE GEN. SP.",0.2
"SWE_038_MZB_LO_10","SWE_038_MZB_LO_10-14.09.2009","14.09.2009",2009,9,14,"TAENIOPTERYX NEBULOSA",0.4
"SWE_038_MZB_LO_10","SWE_038_MZB_LO_10-03.09.2012","03.09.2012",2012,9,3,"BAETIDAE GEN. SP.",38
"SWE_038_MZB_LO_10","SWE_038_MZB_LO_10-03.09.2012","03.09.2012",2012,9,3,"CHIRONOMIDAE GEN. SP.",17.2
"SWE_038_MZB_LO_10","SWE_038_MZB_LO_10-03.09.2012","03.09.2012",2012,9,3,"ELMIS AENEA",5
"SWE_038_MZB_LO_10","SWE_038_MZB_LO_10-03.09.2012","03.09.2012",2012,9,3,"EMPIDIDAE GEN. SP.",2.4
"SWE_038_MZB_LO_10","SWE_038_MZB_LO_10-03.09.2012","03.09.2012",2012,9,3,"EPHEMERELLA SP.",1.4
"SWE_038_MZB_LO_10","SWE_038_MZB_LO_10-03.09.2012","03.09.2012",2012,9,3,"HEPTAGENIIDAE GEN. SP.",6.4
"SWE_038_MZB_LO_10","SWE_038_MZB_LO_10-03.09.2012","03.09.2012",2012,9,3,"HYDRACHNIDIA GEN. SP.",0.8
"SWE_038_MZB_LO_10","SWE_038_MZB_LO_10-03.09.2012","03.09.2012",2012,9,3,"LEUCTRA SP.",0.8
"SWE_038_MZB_LO_10","SWE_038_MZB_LO_10-03.09.2012","03.09.2012",2012,9,3,"OLIGOCHAETA GEN. SP.",7.6
"SWE_038_MZB_LO_10","SWE_038_MZB_LO_10-03.09.2012","03.09.2012",2012,9,3,"PERLODIDAE GEN. SP.",1.2
"SWE_038_MZB_LO_10","SWE_038_MZB_LO_10-03.09.2012","03.09.2012",2012,9,3,"RHYACOPHILA SP.",5.2
"SWE_038_MZB_LO_10","SWE_038_MZB_LO_10-03.09.2012","03.09.2012",2012,9,3,"SIMULIIDAE GEN. SP.",1.4
"SWE_038_MZB_LO_10","SWE_038_MZB_LO_10-03.09.2012","03.09.2012",2012,9,3,"TAENIOPTERYX NEBULOSA",0.8
"SWE_038_MZB_LO_10","SWE_038_MZB_LO_10-03.09.2012","03.09.2012",2012,9,3,"TURBELLARIA GEN. SP.",0.4
"SWE_038_MZB_LO_10","SWE_038_MZB_LO_10-02.09.2013","02.09.2013",2013,9,2,"AMELETUS SP.",5.4
"SWE_038_MZB_LO_10","SWE_038_MZB_LO_10-02.09.2013","02.09.2013",2013,9,2,"BAETIDAE GEN. SP.",22.6
"SWE_038_MZB_LO_10","SWE_038_MZB_LO_10-02.09.2013","02.09.2013",2013,9,2,"CERATOPOGONIDAE GEN. SP.",0.2
"SWE_038_MZB_LO_10","SWE_038_MZB_LO_10-02.09.2013","02.09.2013",2013,9,2,"CHIRONOMIDAE GEN. SP.",4.6
"SWE_038_MZB_LO_10","SWE_038_MZB_LO_10-02.09.2013","02.09.2013",2013,9,2,"DICRANOTA SP.",0.4
"SWE_038_MZB_LO_10","SWE_038_MZB_LO_10-02.09.2013","02.09.2013",2013,9,2,"DIPTERA GEN. SP.",0.4
"SWE_038_MZB_LO_10","SWE_038_MZB_LO_10-02.09.2013","02.09.2013",2013,9,2,"EPHEMERELLA SP.",1.4
"SWE_038_MZB_LO_10","SWE_038_MZB_LO_10-02.09.2013","02.09.2013",2013,9,2,"HEPTAGENIIDAE GEN. SP.",1.2
"SWE_038_MZB_LO_10","SWE_038_MZB_LO_10-02.09.2013","02.09.2013",2013,9,2,"HYDRACHNIDAE GEN. SP.",1.8
"SWE_038_MZB_LO_10","SWE_038_MZB_LO_10-02.09.2013","02.09.2013",2013,9,2,"HYDROPHILIDAE GEN. SP.",0.2
"SWE_038_MZB_LO_10","SWE_038_MZB_LO_10-02.09.2013","02.09.2013",2013,9,2,"LEUCTRA SP.",0.2
"SWE_038_MZB_LO_10","SWE_038_MZB_LO_10-02.09.2013","02.09.2013",2013,9,2,"LIMNEPHILIDAE GEN. SP.",0.8
"SWE_038_MZB_LO_10","SWE_038_MZB_LO_10-02.09.2013","02.09.2013",2013,9,2,"LIMONIIDAE GEN. SP.",0.4
"SWE_038_MZB_LO_10","SWE_038_MZB_LO_10-02.09.2013","02.09.2013",2013,9,2,"NEMOURIDAE GEN. SP.",0.2
"SWE_038_MZB_LO_10","SWE_038_MZB_LO_10-02.09.2013","02.09.2013",2013,9,2,"OLIGOCHAETA GEN. SP.",6
"SWE_038_MZB_LO_10","SWE_038_MZB_LO_10-02.09.2013","02.09.2013",2013,9,2,"PERLODIDAE GEN. SP.",0.4
"SWE_038_MZB_LO_10","SWE_038_MZB_LO_10-02.09.2013","02.09.2013",2013,9,2,"RHYACOPHILA SP.",0.6
"SWE_038_MZB_LO_10","SWE_038_MZB_LO_10-02.09.2013","02.09.2013",2013,9,2,"SIMULIIDAE GEN. SP.",0.4
"SWE_038_MZB_LO_10","SWE_038_MZB_LO_10-02.09.2013","02.09.2013",2013,9,2,"SPHAERIIDAE GEN. SP.",0.4
"SWE_038_MZB_LO_10","SWE_038_MZB_LO_10-02.09.2013","02.09.2013",2013,9,2,"STRATIOMYIDAE GEN. SP.",0.2
"SWE_038_MZB_LO_10","SWE_038_MZB_LO_10-02.09.2013","02.09.2013",2013,9,2,"TAENIOPTERYX NEBULOSA",0.2
"SWE_038_MZB_LO_10","SWE_038_MZB_LO_10-11.10.2017","11.10.2017",2017,10,11,"AMELETUS SP.",5.8
"SWE_038_MZB_LO_10","SWE_038_MZB_LO_10-11.10.2017","11.10.2017",2017,10,11,"BAETIDAE GEN. SP.",51.8
"SWE_038_MZB_LO_10","SWE_038_MZB_LO_10-11.10.2017","11.10.2017",2017,10,11,"CAPNIA SP.",2.2
"SWE_038_MZB_LO_10","SWE_038_MZB_LO_10-11.10.2017","11.10.2017",2017,10,11,"CERATOPOGONIDAE GEN. SP.",1.6
"SWE_038_MZB_LO_10","SWE_038_MZB_LO_10-11.10.2017","11.10.2017",2017,10,11,"CHIRONOMIDAE GEN. SP.",15.6
"SWE_038_MZB_LO_10","SWE_038_MZB_LO_10-11.10.2017","11.10.2017",2017,10,11,"DICRANOTA SP.",0.6
"SWE_038_MZB_LO_10","SWE_038_MZB_LO_10-11.10.2017","11.10.2017",2017,10,11,"ELMIS AENEA",1.8
"SWE_038_MZB_LO_10","SWE_038_MZB_LO_10-11.10.2017","11.10.2017",2017,10,11,"EMPIDIDAE GEN. SP.",0.4
"SWE_038_MZB_LO_10","SWE_038_MZB_LO_10-11.10.2017","11.10.2017",2017,10,11,"EPHEMERELLA SP.",2.2
"SWE_038_MZB_LO_10","SWE_038_MZB_LO_10-11.10.2017","11.10.2017",2017,10,11,"HEPTAGENIIDAE GEN. SP.",23.8
"SWE_038_MZB_LO_10","SWE_038_MZB_LO_10-11.10.2017","11.10.2017",2017,10,11,"HYDRACHNIDAE GEN. SP.",1
"SWE_038_MZB_LO_10","SWE_038_MZB_LO_10-11.10.2017","11.10.2017",2017,10,11,"LEPIDOSTOMA HIRTUM",0.6
"SWE_038_MZB_LO_10","SWE_038_MZB_LO_10-11.10.2017","11.10.2017",2017,10,11,"LEUCTRA SP.",1.6
"SWE_038_MZB_LO_10","SWE_038_MZB_LO_10-11.10.2017","11.10.2017",2017,10,11,"NEMOURIDAE GEN. SP.",11.6
"SWE_038_MZB_LO_10","SWE_038_MZB_LO_10-11.10.2017","11.10.2017",2017,10,11,"OLIGOCHAETA GEN. SP.",49.4
"SWE_038_MZB_LO_10","SWE_038_MZB_LO_10-11.10.2017","11.10.2017",2017,10,11,"PERLODIDAE GEN. SP.",5.4
"SWE_038_MZB_LO_10","SWE_038_MZB_LO_10-11.10.2017","11.10.2017",2017,10,11,"POLYCENTROPODIDAE GEN. SP.",5.8
"SWE_038_MZB_LO_10","SWE_038_MZB_LO_10-11.10.2017","11.10.2017",2017,10,11,"RHYACOPHILA SP.",2.6
"SWE_038_MZB_LO_10","SWE_038_MZB_LO_10-11.10.2017","11.10.2017",2017,10,11,"SIMULIIDAE GEN. SP.",0.8
"SWE_038_MZB_LO_10","SWE_038_MZB_LO_10-11.10.2017","11.10.2017",2017,10,11,"SIPHONOPERLA BURMEISTERI",0.6
"SWE_038_MZB_LO_10","SWE_038_MZB_LO_10-11.10.2017","11.10.2017",2017,10,11,"SPHAERIIDAE GEN. SP.",0.6
"SWE_038_MZB_LO_10","SWE_038_MZB_LO_10-11.10.2017","11.10.2017",2017,10,11,"TAENIOPTERYX NEBULOSA",0.4
"SWE_038_MZB_LO_10","SWE_038_MZB_LO_10-24.10.2018","24.10.2018",2018,10,24,"AMELETUS SP.",6.2
"SWE_038_MZB_LO_10","SWE_038_MZB_LO_10-24.10.2018","24.10.2018",2018,10,24,"BAETIDAE GEN. SP.",61.8
"SWE_038_MZB_LO_10","SWE_038_MZB_LO_10-24.10.2018","24.10.2018",2018,10,24,"CAPNIA SP.",3.8
"SWE_038_MZB_LO_10","SWE_038_MZB_LO_10-24.10.2018","24.10.2018",2018,10,24,"CAPNOPSIS SCHILLERI SSP.",0.2
"SWE_038_MZB_LO_10","SWE_038_MZB_LO_10-24.10.2018","24.10.2018",2018,10,24,"CERATOPOGONIDAE GEN. SP.",0.2
"SWE_038_MZB_LO_10","SWE_038_MZB_LO_10-24.10.2018","24.10.2018",2018,10,24,"CHIRONOMIDAE GEN. SP.",11.2
"SWE_038_MZB_LO_10","SWE_038_MZB_LO_10-24.10.2018","24.10.2018",2018,10,24,"DICRANOTA SP.",0.2
"SWE_038_MZB_LO_10","SWE_038_MZB_LO_10-24.10.2018","24.10.2018",2018,10,24,"ELMIS AENEA",0.4
"SWE_038_MZB_LO_10","SWE_038_MZB_LO_10-24.10.2018","24.10.2018",2018,10,24,"EMPIDIDAE GEN. SP.",0.2
"SWE_038_MZB_LO_10","SWE_038_MZB_LO_10-24.10.2018","24.10.2018",2018,10,24,"EPHEMERELLA SP.",0.4
"SWE_038_MZB_LO_10","SWE_038_MZB_LO_10-24.10.2018","24.10.2018",2018,10,24,"HEPTAGENIIDAE GEN. SP.",18.6
"SWE_038_MZB_LO_10","SWE_038_MZB_LO_10-24.10.2018","24.10.2018",2018,10,24,"HYDRACHNIDAE GEN. SP.",0.6
"SWE_038_MZB_LO_10","SWE_038_MZB_LO_10-24.10.2018","24.10.2018",2018,10,24,"HYDROPTILIDAE GEN. SP.",0.4
"SWE_038_MZB_LO_10","SWE_038_MZB_LO_10-24.10.2018","24.10.2018",2018,10,24,"LEPIDOSTOMA HIRTUM",0.2
"SWE_038_MZB_LO_10","SWE_038_MZB_LO_10-24.10.2018","24.10.2018",2018,10,24,"LEPTOPHLEBIA SP.",0.4
"SWE_038_MZB_LO_10","SWE_038_MZB_LO_10-24.10.2018","24.10.2018",2018,10,24,"LEUCTRA SP.",0.4
"SWE_038_MZB_LO_10","SWE_038_MZB_LO_10-24.10.2018","24.10.2018",2018,10,24,"NEMOURIDAE GEN. SP.",10
"SWE_038_MZB_LO_10","SWE_038_MZB_LO_10-24.10.2018","24.10.2018",2018,10,24,"OLIGOCHAETA GEN. SP.",7
"SWE_038_MZB_LO_10","SWE_038_MZB_LO_10-24.10.2018","24.10.2018",2018,10,24,"PERLODIDAE GEN. SP.",1.2
"SWE_038_MZB_LO_10","SWE_038_MZB_LO_10-24.10.2018","24.10.2018",2018,10,24,"POLYCENTROPODIDAE GEN. SP.",2.8
"SWE_038_MZB_LO_10","SWE_038_MZB_LO_10-24.10.2018","24.10.2018",2018,10,24,"RHYACOPHILA SP.",0.4
"SWE_038_MZB_LO_10","SWE_038_MZB_LO_10-24.10.2018","24.10.2018",2018,10,24,"SIMULIIDAE GEN. SP.",1
"SWE_038_MZB_LO_10","SWE_038_MZB_LO_10-24.10.2018","24.10.2018",2018,10,24,"SIPHONOPERLA BURMEISTERI",0.2
"SWE_038_MZB_LO_11","SWE_038_MZB_LO_11-10.11.2003","10.11.2003",2003,11,10,"AGAPETUS SP.",1.6
"SWE_038_MZB_LO_11","SWE_038_MZB_LO_11-10.11.2003","10.11.2003",2003,11,10,"ASELLUS AQUATICUS",0.4
"SWE_038_MZB_LO_11","SWE_038_MZB_LO_11-10.11.2003","10.11.2003",2003,11,10,"BAETIDAE GEN. SP.",116.2
"SWE_038_MZB_LO_11","SWE_038_MZB_LO_11-10.11.2003","10.11.2003",2003,11,10,"BRACHYPTERA SP.",0.2
"SWE_038_MZB_LO_11","SWE_038_MZB_LO_11-10.11.2003","10.11.2003",2003,11,10,"CERATOPOGONIDAE GEN. SP.",0.4
"SWE_038_MZB_LO_11","SWE_038_MZB_LO_11-10.11.2003","10.11.2003",2003,11,10,"CHIRONOMIDAE GEN. SP.",168.2
"SWE_038_MZB_LO_11","SWE_038_MZB_LO_11-10.11.2003","10.11.2003",2003,11,10,"DICRANOTA SP.",2.8
"SWE_038_MZB_LO_11","SWE_038_MZB_LO_11-10.11.2003","10.11.2003",2003,11,10,"ELMIS AENEA",4
"SWE_038_MZB_LO_11","SWE_038_MZB_LO_11-10.11.2003","10.11.2003",2003,11,10,"EMPIDIDAE GEN. SP.",0.6
"SWE_038_MZB_LO_11","SWE_038_MZB_LO_11-10.11.2003","10.11.2003",2003,11,10,"GAMMARUS SP.",54.4
"SWE_038_MZB_LO_11","SWE_038_MZB_LO_11-10.11.2003","10.11.2003",2003,11,10,"HYDRACHNIDIA GEN. SP.",11.6
"SWE_038_MZB_LO_11","SWE_038_MZB_LO_11-10.11.2003","10.11.2003",2003,11,10,"HYDRAENIDAE GEN. SP.",0.2
"SWE_038_MZB_LO_11","SWE_038_MZB_LO_11-10.11.2003","10.11.2003",2003,11,10,"LEPTOCERIDAE GEN. SP.",0.2
"SWE_038_MZB_LO_11","SWE_038_MZB_LO_11-10.11.2003","10.11.2003",2003,11,10,"LEUCTRA SP.",42
"SWE_038_MZB_LO_11","SWE_038_MZB_LO_11-10.11.2003","10.11.2003",2003,11,10,"LIMNEPHILIDAE GEN. SP.",0.6
"SWE_038_MZB_LO_11","SWE_038_MZB_LO_11-10.11.2003","10.11.2003",2003,11,10,"LIMNIUS SP.",12.4
"SWE_038_MZB_LO_11","SWE_038_MZB_LO_11-10.11.2003","10.11.2003",2003,11,10,"LIMONIIDAE GEN. SP.",0.2
"SWE_038_MZB_LO_11","SWE_038_MZB_LO_11-10.11.2003","10.11.2003",2003,11,10,"NEMOURIDAE GEN. SP.",1.4
"SWE_038_MZB_LO_11","SWE_038_MZB_LO_11-10.11.2003","10.11.2003",2003,11,10,"OLIGOCHAETA GEN. SP.",2
"SWE_038_MZB_LO_11","SWE_038_MZB_LO_11-10.11.2003","10.11.2003",2003,11,10,"PERLODIDAE GEN. SP.",0.2
"SWE_038_MZB_LO_11","SWE_038_MZB_LO_11-10.11.2003","10.11.2003",2003,11,10,"POLYCENTROPODIDAE GEN. SP.",11.2
"SWE_038_MZB_LO_11","SWE_038_MZB_LO_11-10.11.2003","10.11.2003",2003,11,10,"PSYCHOMYIIDAE GEN. SP.",0.2
"SWE_038_MZB_LO_11","SWE_038_MZB_LO_11-10.11.2003","10.11.2003",2003,11,10,"RHYACOPHILA SP.",1
"SWE_038_MZB_LO_11","SWE_038_MZB_LO_11-10.11.2003","10.11.2003",2003,11,10,"SERICOSTOMATIDAE GEN. SP.",0.8
"SWE_038_MZB_LO_11","SWE_038_MZB_LO_11-10.11.2003","10.11.2003",2003,11,10,"SIMULIIDAE GEN. SP.",23.8
"SWE_038_MZB_LO_11","SWE_038_MZB_LO_11-10.11.2003","10.11.2003",2003,11,10,"SPHAERIIDAE GEN. SP.",3.2
"SWE_038_MZB_LO_11","SWE_038_MZB_LO_11-11.10.2004","11.10.2004",2004,10,11,"AGAPETUS SP.",1.8
"SWE_038_MZB_LO_11","SWE_038_MZB_LO_11-11.10.2004","11.10.2004",2004,10,11,"ASELLUS AQUATICUS",0.2
"SWE_038_MZB_LO_11","SWE_038_MZB_LO_11-11.10.2004","11.10.2004",2004,10,11,"BAETIDAE GEN. SP.",33.2
"SWE_038_MZB_LO_11","SWE_038_MZB_LO_11-11.10.2004","11.10.2004",2004,10,11,"CERATOPOGONIDAE GEN. SP.",0.4
"SWE_038_MZB_LO_11","SWE_038_MZB_LO_11-11.10.2004","11.10.2004",2004,10,11,"CHIRONOMIDAE GEN. SP.",81.6
"SWE_038_MZB_LO_11","SWE_038_MZB_LO_11-11.10.2004","11.10.2004",2004,10,11,"DICRANOTA SP.",1.2
"SWE_038_MZB_LO_11","SWE_038_MZB_LO_11-11.10.2004","11.10.2004",2004,10,11,"ELMIS AENEA",7.4
"SWE_038_MZB_LO_11","SWE_038_MZB_LO_11-11.10.2004","11.10.2004",2004,10,11,"EMPIDIDAE GEN. SP.",0.4
"SWE_038_MZB_LO_11","SWE_038_MZB_LO_11-11.10.2004","11.10.2004",2004,10,11,"EPHEMERA SP.",0.2
"SWE_038_MZB_LO_11","SWE_038_MZB_LO_11-11.10.2004","11.10.2004",2004,10,11,"GAMMARUS SP.",66.4
"SWE_038_MZB_LO_11","SWE_038_MZB_LO_11-11.10.2004","11.10.2004",2004,10,11,"GLOSSIPHONIIDAE GEN. SP.",0.2
"SWE_038_MZB_LO_11","SWE_038_MZB_LO_11-11.10.2004","11.10.2004",2004,10,11,"HYDRACHNIDIA GEN. SP.",2.4
"SWE_038_MZB_LO_11","SWE_038_MZB_LO_11-11.10.2004","11.10.2004",2004,10,11,"HYDRAENIDAE GEN. SP.",0.4
"SWE_038_MZB_LO_11","SWE_038_MZB_LO_11-11.10.2004","11.10.2004",2004,10,11,"LEUCTRA SP.",28.6
"SWE_038_MZB_LO_11","SWE_038_MZB_LO_11-11.10.2004","11.10.2004",2004,10,11,"LIBELLULIDAE GEN. SP.",0.6
"SWE_038_MZB_LO_11","SWE_038_MZB_LO_11-11.10.2004","11.10.2004",2004,10,11,"LIMNIUS SP.",9.4
"SWE_038_MZB_LO_11","SWE_038_MZB_LO_11-11.10.2004","11.10.2004",2004,10,11,"LIMONIIDAE GEN. SP.",0.4
"SWE_038_MZB_LO_11","SWE_038_MZB_LO_11-11.10.2004","11.10.2004",2004,10,11,"NEMOURIDAE GEN. SP.",1.8
"SWE_038_MZB_LO_11","SWE_038_MZB_LO_11-11.10.2004","11.10.2004",2004,10,11,"OLIGOCHAETA GEN. SP.",0.8
"SWE_038_MZB_LO_11","SWE_038_MZB_LO_11-11.10.2004","11.10.2004",2004,10,11,"OULIMNIUS SP.",0.4
"SWE_038_MZB_LO_11","SWE_038_MZB_LO_11-11.10.2004","11.10.2004",2004,10,11,"POLYCENTROPODIDAE GEN. SP.",7
"SWE_038_MZB_LO_11","SWE_038_MZB_LO_11-11.10.2004","11.10.2004",2004,10,11,"PSYCHOMYIIDAE GEN. SP.",0.2
"SWE_038_MZB_LO_11","SWE_038_MZB_LO_11-11.10.2004","11.10.2004",2004,10,11,"PTYCHOPTERA SP.",0.2
"SWE_038_MZB_LO_11","SWE_038_MZB_LO_11-11.10.2004","11.10.2004",2004,10,11,"RHYACOPHILA SP.",0.6
"SWE_038_MZB_LO_11","SWE_038_MZB_LO_11-11.10.2004","11.10.2004",2004,10,11,"SERICOSTOMATIDAE GEN. SP.",1.6
"SWE_038_MZB_LO_11","SWE_038_MZB_LO_11-11.10.2004","11.10.2004",2004,10,11,"SIMULIIDAE GEN. SP.",2.6
"SWE_038_MZB_LO_11","SWE_038_MZB_LO_11-11.10.2004","11.10.2004",2004,10,11,"SPHAERIIDAE GEN. SP.",7.6
"SWE_038_MZB_LO_11","SWE_038_MZB_LO_11-11.10.2004","11.10.2004",2004,10,11,"TURBELLARIA GEN. SP.",0.2
"SWE_038_MZB_LO_11","SWE_038_MZB_LO_11-28.10.2005","28.10.2005",2005,10,28,"AGAPETUS SP.",2
"SWE_038_MZB_LO_11","SWE_038_MZB_LO_11-28.10.2005","28.10.2005",2005,10,28,"ASELLUS AQUATICUS",1.6
"SWE_038_MZB_LO_11","SWE_038_MZB_LO_11-28.10.2005","28.10.2005",2005,10,28,"BAETIDAE GEN. SP.",79.4
"SWE_038_MZB_LO_11","SWE_038_MZB_LO_11-28.10.2005","28.10.2005",2005,10,28,"CAPNOPSIS SCHILLERI SSP.",0.2
"SWE_038_MZB_LO_11","SWE_038_MZB_LO_11-28.10.2005","28.10.2005",2005,10,28,"CERATOPOGONIDAE GEN. SP.",1
"SWE_038_MZB_LO_11","SWE_038_MZB_LO_11-28.10.2005","28.10.2005",2005,10,28,"CHIRONOMIDAE GEN. SP.",53
"SWE_038_MZB_LO_11","SWE_038_MZB_LO_11-28.10.2005","28.10.2005",2005,10,28,"DICRANOTA SP.",3.4
"SWE_038_MZB_LO_11","SWE_038_MZB_LO_11-28.10.2005","28.10.2005",2005,10,28,"ELMIS AENEA",12
"SWE_038_MZB_LO_11","SWE_038_MZB_LO_11-28.10.2005","28.10.2005",2005,10,28,"EMPIDIDAE GEN. SP.",0.8
"SWE_038_MZB_LO_11","SWE_038_MZB_LO_11-28.10.2005","28.10.2005",2005,10,28,"EPHEMERA SP.",0.2
"SWE_038_MZB_LO_11","SWE_038_MZB_LO_11-28.10.2005","28.10.2005",2005,10,28,"GAMMARUS SP.",52.6
"SWE_038_MZB_LO_11","SWE_038_MZB_LO_11-28.10.2005","28.10.2005",2005,10,28,"GLOSSIPHONIIDAE GEN. SP.",0.4
"SWE_038_MZB_LO_11","SWE_038_MZB_LO_11-28.10.2005","28.10.2005",2005,10,28,"HEPTAGENIIDAE GEN. SP.",0.2
"SWE_038_MZB_LO_11","SWE_038_MZB_LO_11-28.10.2005","28.10.2005",2005,10,28,"HYDRACHNIDIA GEN. SP.",3
"SWE_038_MZB_LO_11","SWE_038_MZB_LO_11-28.10.2005","28.10.2005",2005,10,28,"HYDRAENIDAE GEN. SP.",0.8
"SWE_038_MZB_LO_11","SWE_038_MZB_LO_11-28.10.2005","28.10.2005",2005,10,28,"LEPTOCERIDAE GEN. SP.",0.6
"SWE_038_MZB_LO_11","SWE_038_MZB_LO_11-28.10.2005","28.10.2005",2005,10,28,"LEUCTRA SP.",20.8
"SWE_038_MZB_LO_11","SWE_038_MZB_LO_11-28.10.2005","28.10.2005",2005,10,28,"LIMNEPHILIDAE GEN. SP.",1.6
"SWE_038_MZB_LO_11","SWE_038_MZB_LO_11-28.10.2005","28.10.2005",2005,10,28,"LIMNIUS SP.",9.4
"SWE_038_MZB_LO_11","SWE_038_MZB_LO_11-28.10.2005","28.10.2005",2005,10,28,"LIMONIIDAE GEN. SP.",1.2
"SWE_038_MZB_LO_11","SWE_038_MZB_LO_11-28.10.2005","28.10.2005",2005,10,28,"NEMOURIDAE GEN. SP.",0.6
"SWE_038_MZB_LO_11","SWE_038_MZB_LO_11-28.10.2005","28.10.2005",2005,10,28,"OLIGOCHAETA GEN. SP.",1.8
"SWE_038_MZB_LO_11","SWE_038_MZB_LO_11-28.10.2005","28.10.2005",2005,10,28,"OULIMNIUS SP.",0.4
"SWE_038_MZB_LO_11","SWE_038_MZB_LO_11-28.10.2005","28.10.2005",2005,10,28,"PERLODIDAE GEN. SP.",0.6
"SWE_038_MZB_LO_11","SWE_038_MZB_LO_11-28.10.2005","28.10.2005",2005,10,28,"POLYCENTROPODIDAE GEN. SP.",5.2
"SWE_038_MZB_LO_11","SWE_038_MZB_LO_11-28.10.2005","28.10.2005",2005,10,28,"PSYCHOMYIIDAE GEN. SP.",0.8
"SWE_038_MZB_LO_11","SWE_038_MZB_LO_11-28.10.2005","28.10.2005",2005,10,28,"RHYACOPHILA SP.",0.8
"SWE_038_MZB_LO_11","SWE_038_MZB_LO_11-28.10.2005","28.10.2005",2005,10,28,"SERICOSTOMATIDAE GEN. SP.",3.6
"SWE_038_MZB_LO_11","SWE_038_MZB_LO_11-28.10.2005","28.10.2005",2005,10,28,"SIMULIIDAE GEN. SP.",6
"SWE_038_MZB_LO_11","SWE_038_MZB_LO_11-28.10.2005","28.10.2005",2005,10,28,"SPHAERIIDAE GEN. SP.",0.8
"SWE_038_MZB_LO_11","SWE_038_MZB_LO_11-28.10.2005","28.10.2005",2005,10,28,"TABANIDAE GEN. SP.",0.2
"SWE_038_MZB_LO_11","SWE_038_MZB_LO_11-28.10.2006","28.10.2006",2006,10,28,"AGAPETUS SP.",6.8
"SWE_038_MZB_LO_11","SWE_038_MZB_LO_11-28.10.2006","28.10.2006",2006,10,28,"ASELLUS AQUATICUS",1.6
"SWE_038_MZB_LO_11","SWE_038_MZB_LO_11-28.10.2006","28.10.2006",2006,10,28,"BAETIDAE GEN. SP.",72.8
"SWE_038_MZB_LO_11","SWE_038_MZB_LO_11-28.10.2006","28.10.2006",2006,10,28,"CERATOPOGONIDAE GEN. SP.",2.2
"SWE_038_MZB_LO_11","SWE_038_MZB_LO_11-28.10.2006","28.10.2006",2006,10,28,"CHIRONOMIDAE GEN. SP.",395
"SWE_038_MZB_LO_11","SWE_038_MZB_LO_11-28.10.2006","28.10.2006",2006,10,28,"DICRANOTA SP.",7.2
"SWE_038_MZB_LO_11","SWE_038_MZB_LO_11-28.10.2006","28.10.2006",2006,10,28,"ELMIS AENEA",47.6
"SWE_038_MZB_LO_11","SWE_038_MZB_LO_11-28.10.2006","28.10.2006",2006,10,28,"EMPIDIDAE GEN. SP.",1.4
"SWE_038_MZB_LO_11","SWE_038_MZB_LO_11-28.10.2006","28.10.2006",2006,10,28,"EPHEMERA SP.",1
"SWE_038_MZB_LO_11","SWE_038_MZB_LO_11-28.10.2006","28.10.2006",2006,10,28,"GAMMARUS SP.",77
"SWE_038_MZB_LO_11","SWE_038_MZB_LO_11-28.10.2006","28.10.2006",2006,10,28,"GLOSSIPHONIIDAE GEN. SP.",0.2
"SWE_038_MZB_LO_11","SWE_038_MZB_LO_11-28.10.2006","28.10.2006",2006,10,28,"HEPTAGENIIDAE GEN. SP.",0.2
"SWE_038_MZB_LO_11","SWE_038_MZB_LO_11-28.10.2006","28.10.2006",2006,10,28,"HYDRACHNIDIA GEN. SP.",6
"SWE_038_MZB_LO_11","SWE_038_MZB_LO_11-28.10.2006","28.10.2006",2006,10,28,"HYDRAENIDAE GEN. SP.",0.4
"SWE_038_MZB_LO_11","SWE_038_MZB_LO_11-28.10.2006","28.10.2006",2006,10,28,"LEPTOCERIDAE GEN. SP.",0.2
"SWE_038_MZB_LO_11","SWE_038_MZB_LO_11-28.10.2006","28.10.2006",2006,10,28,"LEUCTRA SP.",78
"SWE_038_MZB_LO_11","SWE_038_MZB_LO_11-28.10.2006","28.10.2006",2006,10,28,"LIMNEPHILIDAE GEN. SP.",3.8
"SWE_038_MZB_LO_11","SWE_038_MZB_LO_11-28.10.2006","28.10.2006",2006,10,28,"LIMNIUS SP.",58
"SWE_038_MZB_LO_11","SWE_038_MZB_LO_11-28.10.2006","28.10.2006",2006,10,28,"LIMONIIDAE GEN. SP.",1
"SWE_038_MZB_LO_11","SWE_038_MZB_LO_11-28.10.2006","28.10.2006",2006,10,28,"NEMOURIDAE GEN. SP.",4
"SWE_038_MZB_LO_11","SWE_038_MZB_LO_11-28.10.2006","28.10.2006",2006,10,28,"OLIGOCHAETA GEN. SP.",7.2
"SWE_038_MZB_LO_11","SWE_038_MZB_LO_11-28.10.2006","28.10.2006",2006,10,28,"OULIMNIUS SP.",0.2
"SWE_038_MZB_LO_11","SWE_038_MZB_LO_11-28.10.2006","28.10.2006",2006,10,28,"PERLODIDAE GEN. SP.",1.2
"SWE_038_MZB_LO_11","SWE_038_MZB_LO_11-28.10.2006","28.10.2006",2006,10,28,"POLYCENTROPODIDAE GEN. SP.",38.8
"SWE_038_MZB_LO_11","SWE_038_MZB_LO_11-28.10.2006","28.10.2006",2006,10,28,"PSYCHOMYIIDAE GEN. SP.",3.2
"SWE_038_MZB_LO_11","SWE_038_MZB_LO_11-28.10.2006","28.10.2006",2006,10,28,"RHYACOPHILA SP.",1
"SWE_038_MZB_LO_11","SWE_038_MZB_LO_11-28.10.2006","28.10.2006",2006,10,28,"SERICOSTOMATIDAE GEN. SP.",17.4
"SWE_038_MZB_LO_11","SWE_038_MZB_LO_11-28.10.2006","28.10.2006",2006,10,28,"SIMULIIDAE GEN. SP.",6.8
"SWE_038_MZB_LO_11","SWE_038_MZB_LO_11-28.10.2006","28.10.2006",2006,10,28,"SPHAERIIDAE GEN. SP.",20.4
"SWE_038_MZB_LO_11","SWE_038_MZB_LO_11-28.10.2006","28.10.2006",2006,10,28,"TIPULIDAE GEN. SP.",0.8
"SWE_038_MZB_LO_11","SWE_038_MZB_LO_11-05.11.2007","05.11.2007",2007,11,5,"AGAPETUS SP.",4.2
"SWE_038_MZB_LO_11","SWE_038_MZB_LO_11-05.11.2007","05.11.2007",2007,11,5,"ASELLUS AQUATICUS",0.2
"SWE_038_MZB_LO_11","SWE_038_MZB_LO_11-05.11.2007","05.11.2007",2007,11,5,"BAETIDAE GEN. SP.",32.8
"SWE_038_MZB_LO_11","SWE_038_MZB_LO_11-05.11.2007","05.11.2007",2007,11,5,"CERATOPOGONIDAE GEN. SP.",0.8
"SWE_038_MZB_LO_11","SWE_038_MZB_LO_11-05.11.2007","05.11.2007",2007,11,5,"CHIRONOMIDAE GEN. SP.",47.4
"SWE_038_MZB_LO_11","SWE_038_MZB_LO_11-05.11.2007","05.11.2007",2007,11,5,"DICRANOTA SP.",1
"SWE_038_MZB_LO_11","SWE_038_MZB_LO_11-05.11.2007","05.11.2007",2007,11,5,"DIPTERA GEN. SP.",0.2
"SWE_038_MZB_LO_11","SWE_038_MZB_LO_11-05.11.2007","05.11.2007",2007,11,5,"ELMIS AENEA",6.8
"SWE_038_MZB_LO_11","SWE_038_MZB_LO_11-05.11.2007","05.11.2007",2007,11,5,"GAMMARUS SP.",44.8
"SWE_038_MZB_LO_11","SWE_038_MZB_LO_11-05.11.2007","05.11.2007",2007,11,5,"HEPTAGENIIDAE GEN. SP.",0.2
"SWE_038_MZB_LO_11","SWE_038_MZB_LO_11-05.11.2007","05.11.2007",2007,11,5,"HYDRACHNIDIA GEN. SP.",0.2
"SWE_038_MZB_LO_11","SWE_038_MZB_LO_11-05.11.2007","05.11.2007",2007,11,5,"LEUCTRA SP.",54.6
"SWE_038_MZB_LO_11","SWE_038_MZB_LO_11-05.11.2007","05.11.2007",2007,11,5,"LIMNEPHILIDAE GEN. SP.",2
"SWE_038_MZB_LO_11","SWE_038_MZB_LO_11-05.11.2007","05.11.2007",2007,11,5,"LIMNIUS SP.",10.8
"SWE_038_MZB_LO_11","SWE_038_MZB_LO_11-05.11.2007","05.11.2007",2007,11,5,"LIMONIIDAE GEN. SP.",0.2
"SWE_038_MZB_LO_11","SWE_038_MZB_LO_11-05.11.2007","05.11.2007",2007,11,5,"NEMOURIDAE GEN. SP.",1.4
"SWE_038_MZB_LO_11","SWE_038_MZB_LO_11-05.11.2007","05.11.2007",2007,11,5,"PERLODIDAE GEN. SP.",1.2
"SWE_038_MZB_LO_11","SWE_038_MZB_LO_11-05.11.2007","05.11.2007",2007,11,5,"POLYCENTROPODIDAE GEN. SP.",6.4
"SWE_038_MZB_LO_11","SWE_038_MZB_LO_11-05.11.2007","05.11.2007",2007,11,5,"PSYCHOMYIIDAE GEN. SP.",0.2
"SWE_038_MZB_LO_11","SWE_038_MZB_LO_11-05.11.2007","05.11.2007",2007,11,5,"RHYACOPHILA SP.",3.8
"SWE_038_MZB_LO_11","SWE_038_MZB_LO_11-05.11.2007","05.11.2007",2007,11,5,"SERICOSTOMATIDAE GEN. SP.",1.4
"SWE_038_MZB_LO_11","SWE_038_MZB_LO_11-05.11.2007","05.11.2007",2007,11,5,"SIMULIIDAE GEN. SP.",11.8
"SWE_038_MZB_LO_11","SWE_038_MZB_LO_11-05.11.2007","05.11.2007",2007,11,5,"SPHAERIIDAE GEN. SP.",1.4
"SWE_038_MZB_LO_11","SWE_038_MZB_LO_11-23.10.2008","23.10.2008",2008,10,23,"AGAPETUS SP.",1.8
"SWE_038_MZB_LO_11","SWE_038_MZB_LO_11-23.10.2008","23.10.2008",2008,10,23,"BAETIDAE GEN. SP.",86
"SWE_038_MZB_LO_11","SWE_038_MZB_LO_11-23.10.2008","23.10.2008",2008,10,23,"CERATOPOGONIDAE GEN. SP.",1.6
"SWE_038_MZB_LO_11","SWE_038_MZB_LO_11-23.10.2008","23.10.2008",2008,10,23,"CHIRONOMIDAE GEN. SP.",247.6
"SWE_038_MZB_LO_11","SWE_038_MZB_LO_11-23.10.2008","23.10.2008",2008,10,23,"DICRANOTA SP.",8.6
"SWE_038_MZB_LO_11","SWE_038_MZB_LO_11-23.10.2008","23.10.2008",2008,10,23,"DIPTERA GEN. SP.",0.2
"SWE_038_MZB_LO_11","SWE_038_MZB_LO_11-23.10.2008","23.10.2008",2008,10,23,"ELMIS AENEA",28.4
"SWE_038_MZB_LO_11","SWE_038_MZB_LO_11-23.10.2008","23.10.2008",2008,10,23,"EMPIDIDAE GEN. SP.",1
"SWE_038_MZB_LO_11","SWE_038_MZB_LO_11-23.10.2008","23.10.2008",2008,10,23,"GAMMARUS SP.",32.2
"SWE_038_MZB_LO_11","SWE_038_MZB_LO_11-23.10.2008","23.10.2008",2008,10,23,"HYDRACHNIDIA GEN. SP.",21.4
"SWE_038_MZB_LO_11","SWE_038_MZB_LO_11-23.10.2008","23.10.2008",2008,10,23,"HYDRAENIDAE GEN. SP.",2
"SWE_038_MZB_LO_11","SWE_038_MZB_LO_11-23.10.2008","23.10.2008",2008,10,23,"LEPTOCERIDAE GEN. SP.",0.2
"SWE_038_MZB_LO_11","SWE_038_MZB_LO_11-23.10.2008","23.10.2008",2008,10,23,"LEUCTRA SP.",101.6
"SWE_038_MZB_LO_11","SWE_038_MZB_LO_11-23.10.2008","23.10.2008",2008,10,23,"LIMNEPHILIDAE GEN. SP.",0.6
"SWE_038_MZB_LO_11","SWE_038_MZB_LO_11-23.10.2008","23.10.2008",2008,10,23,"LIMNIUS SP.",86
"SWE_038_MZB_LO_11","SWE_038_MZB_LO_11-23.10.2008","23.10.2008",2008,10,23,"LIMONIIDAE GEN. SP.",1.2
"SWE_038_MZB_LO_11","SWE_038_MZB_LO_11-23.10.2008","23.10.2008",2008,10,23,"NEMOURIDAE GEN. SP.",1.2
"SWE_038_MZB_LO_11","SWE_038_MZB_LO_11-23.10.2008","23.10.2008",2008,10,23,"OLIGOCHAETA GEN. SP.",6.8
"SWE_038_MZB_LO_11","SWE_038_MZB_LO_11-23.10.2008","23.10.2008",2008,10,23,"OULIMNIUS SP.",2
"SWE_038_MZB_LO_11","SWE_038_MZB_LO_11-23.10.2008","23.10.2008",2008,10,23,"PERLODIDAE GEN. SP.",0.8
"SWE_038_MZB_LO_11","SWE_038_MZB_LO_11-23.10.2008","23.10.2008",2008,10,23,"POLYCENTROPODIDAE GEN. SP.",41.8
"SWE_038_MZB_LO_11","SWE_038_MZB_LO_11-23.10.2008","23.10.2008",2008,10,23,"PSYCHOMYIIDAE GEN. SP.",0.2
"SWE_038_MZB_LO_11","SWE_038_MZB_LO_11-23.10.2008","23.10.2008",2008,10,23,"RHYACOPHILA SP.",2.6
"SWE_038_MZB_LO_11","SWE_038_MZB_LO_11-23.10.2008","23.10.2008",2008,10,23,"SERICOSTOMATIDAE GEN. SP.",5.4
"SWE_038_MZB_LO_11","SWE_038_MZB_LO_11-23.10.2008","23.10.2008",2008,10,23,"SIMULIIDAE GEN. SP.",3.2
"SWE_038_MZB_LO_11","SWE_038_MZB_LO_11-23.10.2008","23.10.2008",2008,10,23,"SPHAERIIDAE GEN. SP.",25.2
"SWE_038_MZB_LO_11","SWE_038_MZB_LO_11-09.10.2009","09.10.2009",2009,10,9,"AGAPETUS SP.",1.6
"SWE_038_MZB_LO_11","SWE_038_MZB_LO_11-09.10.2009","09.10.2009",2009,10,9,"ASTACIDAE GEN. SP.",0.2
"SWE_038_MZB_LO_11","SWE_038_MZB_LO_11-09.10.2009","09.10.2009",2009,10,9,"BAETIDAE GEN. SP.",84.8
"SWE_038_MZB_LO_11","SWE_038_MZB_LO_11-09.10.2009","09.10.2009",2009,10,9,"CERATOPOGONIDAE GEN. SP.",4.2
"SWE_038_MZB_LO_11","SWE_038_MZB_LO_11-09.10.2009","09.10.2009",2009,10,9,"CHIRONOMIDAE GEN. SP.",100
"SWE_038_MZB_LO_11","SWE_038_MZB_LO_11-09.10.2009","09.10.2009",2009,10,9,"DICRANOTA SP.",4.2
"SWE_038_MZB_LO_11","SWE_038_MZB_LO_11-09.10.2009","09.10.2009",2009,10,9,"DIXA SP.",0.4
"SWE_038_MZB_LO_11","SWE_038_MZB_LO_11-09.10.2009","09.10.2009",2009,10,9,"ELMIS AENEA",12.2
"SWE_038_MZB_LO_11","SWE_038_MZB_LO_11-09.10.2009","09.10.2009",2009,10,9,"EMPIDIDAE GEN. SP.",0.2
"SWE_038_MZB_LO_11","SWE_038_MZB_LO_11-09.10.2009","09.10.2009",2009,10,9,"EPHEMERA SP.",1.6
"SWE_038_MZB_LO_11","SWE_038_MZB_LO_11-09.10.2009","09.10.2009",2009,10,9,"EPHYDRIDAE GEN. SP.",0.2
"SWE_038_MZB_LO_11","SWE_038_MZB_LO_11-09.10.2009","09.10.2009",2009,10,9,"GAMMARUS SP.",47.4
"SWE_038_MZB_LO_11","SWE_038_MZB_LO_11-09.10.2009","09.10.2009",2009,10,9,"HEPTAGENIIDAE GEN. SP.",0.4
"SWE_038_MZB_LO_11","SWE_038_MZB_LO_11-09.10.2009","09.10.2009",2009,10,9,"HYDRACHNIDIA GEN. SP.",24
"SWE_038_MZB_LO_11","SWE_038_MZB_LO_11-09.10.2009","09.10.2009",2009,10,9,"HYDRAENIDAE GEN. SP.",0.6
"SWE_038_MZB_LO_11","SWE_038_MZB_LO_11-09.10.2009","09.10.2009",2009,10,9,"HYDROPHILIDAE GEN. SP.",1.2
"SWE_038_MZB_LO_11","SWE_038_MZB_LO_11-09.10.2009","09.10.2009",2009,10,9,"LEPTOCERIDAE GEN. SP.",0.2
"SWE_038_MZB_LO_11","SWE_038_MZB_LO_11-09.10.2009","09.10.2009",2009,10,9,"LEPTOPHLEBIA SP.",0.4
"SWE_038_MZB_LO_11","SWE_038_MZB_LO_11-09.10.2009","09.10.2009",2009,10,9,"LEUCTRA SP.",60
"SWE_038_MZB_LO_11","SWE_038_MZB_LO_11-09.10.2009","09.10.2009",2009,10,9,"LIMNEPHILIDAE GEN. SP.",1.2
"SWE_038_MZB_LO_11","SWE_038_MZB_LO_11-09.10.2009","09.10.2009",2009,10,9,"LIMNIUS SP.",19
"SWE_038_MZB_LO_11","SWE_038_MZB_LO_11-09.10.2009","09.10.2009",2009,10,9,"LIMONIIDAE GEN. SP.",0.6
"SWE_038_MZB_LO_11","SWE_038_MZB_LO_11-09.10.2009","09.10.2009",2009,10,9,"NEMOURIDAE GEN. SP.",7.2
"SWE_038_MZB_LO_11","SWE_038_MZB_LO_11-09.10.2009","09.10.2009",2009,10,9,"OLIGOCHAETA GEN. SP.",6.4
"SWE_038_MZB_LO_11","SWE_038_MZB_LO_11-09.10.2009","09.10.2009",2009,10,9,"PERLODIDAE GEN. SP.",1.2
"SWE_038_MZB_LO_11","SWE_038_MZB_LO_11-09.10.2009","09.10.2009",2009,10,9,"POLYCENTROPODIDAE GEN. SP.",14.8
"SWE_038_MZB_LO_11","SWE_038_MZB_LO_11-09.10.2009","09.10.2009",2009,10,9,"PSYCHOMYIIDAE GEN. SP.",0.2
"SWE_038_MZB_LO_11","SWE_038_MZB_LO_11-09.10.2009","09.10.2009",2009,10,9,"RHYACOPHILA SP.",2.4
"SWE_038_MZB_LO_11","SWE_038_MZB_LO_11-09.10.2009","09.10.2009",2009,10,9,"SCIRTIDAE GEN. SP.",1
"SWE_038_MZB_LO_11","SWE_038_MZB_LO_11-09.10.2009","09.10.2009",2009,10,9,"SERICOSTOMATIDAE GEN. SP.",1.8
"SWE_038_MZB_LO_11","SWE_038_MZB_LO_11-09.10.2009","09.10.2009",2009,10,9,"SIMULIIDAE GEN. SP.",6.4
"SWE_038_MZB_LO_11","SWE_038_MZB_LO_11-09.10.2009","09.10.2009",2009,10,9,"SPHAERIIDAE GEN. SP.",7.8
"SWE_038_MZB_LO_11","SWE_038_MZB_LO_11-22.10.2010","22.10.2010",2010,10,22,"AGAPETUS SP.",2.2
"SWE_038_MZB_LO_11","SWE_038_MZB_LO_11-22.10.2010","22.10.2010",2010,10,22,"ASELLUS AQUATICUS",1.4
"SWE_038_MZB_LO_11","SWE_038_MZB_LO_11-22.10.2010","22.10.2010",2010,10,22,"BAETIDAE GEN. SP.",107.2
"SWE_038_MZB_LO_11","SWE_038_MZB_LO_11-22.10.2010","22.10.2010",2010,10,22,"CHIRONOMIDAE GEN. SP.",64.4
"SWE_038_MZB_LO_11","SWE_038_MZB_LO_11-22.10.2010","22.10.2010",2010,10,22,"DICRANOTA SP.",3.4
"SWE_038_MZB_LO_11","SWE_038_MZB_LO_11-22.10.2010","22.10.2010",2010,10,22,"ELMIS AENEA",20.6
"SWE_038_MZB_LO_11","SWE_038_MZB_LO_11-22.10.2010","22.10.2010",2010,10,22,"EMPIDIDAE GEN. SP.",0.2
"SWE_038_MZB_LO_11","SWE_038_MZB_LO_11-22.10.2010","22.10.2010",2010,10,22,"EPHEMERA SP.",0.4
"SWE_038_MZB_LO_11","SWE_038_MZB_LO_11-22.10.2010","22.10.2010",2010,10,22,"GAMMARUS SP.",60.4
"SWE_038_MZB_LO_11","SWE_038_MZB_LO_11-22.10.2010","22.10.2010",2010,10,22,"GOERIDAE GEN. SP.",0.2
"SWE_038_MZB_LO_11","SWE_038_MZB_LO_11-22.10.2010","22.10.2010",2010,10,22,"HEPTAGENIIDAE GEN. SP.",2.2
"SWE_038_MZB_LO_11","SWE_038_MZB_LO_11-22.10.2010","22.10.2010",2010,10,22,"HYDRACHNIDIA GEN. SP.",18.2
"SWE_038_MZB_LO_11","SWE_038_MZB_LO_11-22.10.2010","22.10.2010",2010,10,22,"HYDRAENIDAE GEN. SP.",1.4
"SWE_038_MZB_LO_11","SWE_038_MZB_LO_11-22.10.2010","22.10.2010",2010,10,22,"HYDROPSYCHE SP.",0.2
"SWE_038_MZB_LO_11","SWE_038_MZB_LO_11-22.10.2010","22.10.2010",2010,10,22,"LEUCTRA SP.",121.8
"SWE_038_MZB_LO_11","SWE_038_MZB_LO_11-22.10.2010","22.10.2010",2010,10,22,"LIMNEPHILIDAE GEN. SP.",1
"SWE_038_MZB_LO_11","SWE_038_MZB_LO_11-22.10.2010","22.10.2010",2010,10,22,"LIMNIUS SP.",11.4
"SWE_038_MZB_LO_11","SWE_038_MZB_LO_11-22.10.2010","22.10.2010",2010,10,22,"LIMONIIDAE GEN. SP.",1
"SWE_038_MZB_LO_11","SWE_038_MZB_LO_11-22.10.2010","22.10.2010",2010,10,22,"NEMOURIDAE GEN. SP.",3.2
"SWE_038_MZB_LO_11","SWE_038_MZB_LO_11-22.10.2010","22.10.2010",2010,10,22,"OLIGOCHAETA GEN. SP.",2.4
"SWE_038_MZB_LO_11","SWE_038_MZB_LO_11-22.10.2010","22.10.2010",2010,10,22,"POLYCENTROPODIDAE GEN. SP.",13.2
"SWE_038_MZB_LO_11","SWE_038_MZB_LO_11-22.10.2010","22.10.2010",2010,10,22,"PSYCHOMYIIDAE GEN. SP.",0.4
"SWE_038_MZB_LO_11","SWE_038_MZB_LO_11-22.10.2010","22.10.2010",2010,10,22,"RHYACOPHILA SP.",3.8
"SWE_038_MZB_LO_11","SWE_038_MZB_LO_11-22.10.2010","22.10.2010",2010,10,22,"SCIRTIDAE GEN. SP.",0.6
"SWE_038_MZB_LO_11","SWE_038_MZB_LO_11-22.10.2010","22.10.2010",2010,10,22,"SERICOSTOMATIDAE GEN. SP.",6.6
"SWE_038_MZB_LO_11","SWE_038_MZB_LO_11-22.10.2010","22.10.2010",2010,10,22,"SIMULIIDAE GEN. SP.",16
"SWE_038_MZB_LO_11","SWE_038_MZB_LO_11-22.10.2010","22.10.2010",2010,10,22,"SPHAERIIDAE GEN. SP.",17.2
"SWE_038_MZB_LO_11","SWE_038_MZB_LO_11-22.10.2010","22.10.2010",2010,10,22,"ZYGOPTERA GEN. SP.",0.2
"SWE_038_MZB_LO_11","SWE_038_MZB_LO_11-13.10.2011","13.10.2011",2011,10,13,"AGAPETUS SP.",0.8
"SWE_038_MZB_LO_11","SWE_038_MZB_LO_11-13.10.2011","13.10.2011",2011,10,13,"ASELLUS AQUATICUS",2.2
"SWE_038_MZB_LO_11","SWE_038_MZB_LO_11-13.10.2011","13.10.2011",2011,10,13,"BAETIDAE GEN. SP.",103.8
"SWE_038_MZB_LO_11","SWE_038_MZB_LO_11-13.10.2011","13.10.2011",2011,10,13,"CERATOPOGONIDAE GEN. SP.",0.4
"SWE_038_MZB_LO_11","SWE_038_MZB_LO_11-13.10.2011","13.10.2011",2011,10,13,"CHIRONOMIDAE GEN. SP.",81.6
"SWE_038_MZB_LO_11","SWE_038_MZB_LO_11-13.10.2011","13.10.2011",2011,10,13,"DICRANOTA SP.",5
"SWE_038_MZB_LO_11","SWE_038_MZB_LO_11-13.10.2011","13.10.2011",2011,10,13,"ELMIS AENEA",32.2
"SWE_038_MZB_LO_11","SWE_038_MZB_LO_11-13.10.2011","13.10.2011",2011,10,13,"EMPIDIDAE GEN. SP.",0.6
"SWE_038_MZB_LO_11","SWE_038_MZB_LO_11-13.10.2011","13.10.2011",2011,10,13,"EPHEMERA SP.",0.4
"SWE_038_MZB_LO_11","SWE_038_MZB_LO_11-13.10.2011","13.10.2011",2011,10,13,"GAMMARUS SP.",138.2
"SWE_038_MZB_LO_11","SWE_038_MZB_LO_11-13.10.2011","13.10.2011",2011,10,13,"HEPTAGENIIDAE GEN. SP.",2.6
"SWE_038_MZB_LO_11","SWE_038_MZB_LO_11-13.10.2011","13.10.2011",2011,10,13,"HYDRACHNIDIA GEN. SP.",11.2
"SWE_038_MZB_LO_11","SWE_038_MZB_LO_11-13.10.2011","13.10.2011",2011,10,13,"HYDRAENIDAE GEN. SP.",1.6
"SWE_038_MZB_LO_11","SWE_038_MZB_LO_11-13.10.2011","13.10.2011",2011,10,13,"LEUCTRA SP.",93.4
"SWE_038_MZB_LO_11","SWE_038_MZB_LO_11-13.10.2011","13.10.2011",2011,10,13,"LIMNEPHILIDAE GEN. SP.",4.8
"SWE_038_MZB_LO_11","SWE_038_MZB_LO_11-13.10.2011","13.10.2011",2011,10,13,"LIMNIUS SP.",13.8
"SWE_038_MZB_LO_11","SWE_038_MZB_LO_11-13.10.2011","13.10.2011",2011,10,13,"NEMOURIDAE GEN. SP.",2.8
"SWE_038_MZB_LO_11","SWE_038_MZB_LO_11-13.10.2011","13.10.2011",2011,10,13,"OLIGOCHAETA GEN. SP.",2.8
"SWE_038_MZB_LO_11","SWE_038_MZB_LO_11-13.10.2011","13.10.2011",2011,10,13,"OULIMNIUS SP.",0.2
"SWE_038_MZB_LO_11","SWE_038_MZB_LO_11-13.10.2011","13.10.2011",2011,10,13,"PERLODIDAE GEN. SP.",0.2
"SWE_038_MZB_LO_11","SWE_038_MZB_LO_11-13.10.2011","13.10.2011",2011,10,13,"POLYCENTROPODIDAE GEN. SP.",11
"SWE_038_MZB_LO_11","SWE_038_MZB_LO_11-13.10.2011","13.10.2011",2011,10,13,"PSYCHOMYIIDAE GEN. SP.",1.4
"SWE_038_MZB_LO_11","SWE_038_MZB_LO_11-13.10.2011","13.10.2011",2011,10,13,"RHYACOPHILA SP.",3
"SWE_038_MZB_LO_11","SWE_038_MZB_LO_11-13.10.2011","13.10.2011",2011,10,13,"SERICOSTOMATIDAE GEN. SP.",3.6
"SWE_038_MZB_LO_11","SWE_038_MZB_LO_11-13.10.2011","13.10.2011",2011,10,13,"SIMULIIDAE GEN. SP.",7.2
"SWE_038_MZB_LO_11","SWE_038_MZB_LO_11-13.10.2011","13.10.2011",2011,10,13,"SPHAERIIDAE GEN. SP.",24.4
"SWE_038_MZB_LO_11","SWE_038_MZB_LO_11-01.10.2012","01.10.2012",2012,10,1,"ACROLOXUS LACUSTRIS",0.2
"SWE_038_MZB_LO_11","SWE_038_MZB_LO_11-01.10.2012","01.10.2012",2012,10,1,"AGAPETUS SP.",6.6
"SWE_038_MZB_LO_11","SWE_038_MZB_LO_11-01.10.2012","01.10.2012",2012,10,1,"ASELLUS AQUATICUS",3.8
"SWE_038_MZB_LO_11","SWE_038_MZB_LO_11-01.10.2012","01.10.2012",2012,10,1,"BAETIDAE GEN. SP.",43.6
"SWE_038_MZB_LO_11","SWE_038_MZB_LO_11-01.10.2012","01.10.2012",2012,10,1,"CERATOPOGONIDAE GEN. SP.",2.8
"SWE_038_MZB_LO_11","SWE_038_MZB_LO_11-01.10.2012","01.10.2012",2012,10,1,"CHIRONOMIDAE GEN. SP.",312
"SWE_038_MZB_LO_11","SWE_038_MZB_LO_11-01.10.2012","01.10.2012",2012,10,1,"DICRANOTA SP.",7
"SWE_038_MZB_LO_11","SWE_038_MZB_LO_11-01.10.2012","01.10.2012",2012,10,1,"DYTISCIDAE GEN. SP.",0.4
"SWE_038_MZB_LO_11","SWE_038_MZB_LO_11-01.10.2012","01.10.2012",2012,10,1,"ELMIS AENEA",22
"SWE_038_MZB_LO_11","SWE_038_MZB_LO_11-01.10.2012","01.10.2012",2012,10,1,"EMPIDIDAE GEN. SP.",1.8
"SWE_038_MZB_LO_11","SWE_038_MZB_LO_11-01.10.2012","01.10.2012",2012,10,1,"EPHEMERA SP.",0.4
"SWE_038_MZB_LO_11","SWE_038_MZB_LO_11-01.10.2012","01.10.2012",2012,10,1,"GAMMARUS SP.",122
"SWE_038_MZB_LO_11","SWE_038_MZB_LO_11-01.10.2012","01.10.2012",2012,10,1,"GOERIDAE GEN. SP.",0.4
"SWE_038_MZB_LO_11","SWE_038_MZB_LO_11-01.10.2012","01.10.2012",2012,10,1,"HEPTAGENIIDAE GEN. SP.",1
"SWE_038_MZB_LO_11","SWE_038_MZB_LO_11-01.10.2012","01.10.2012",2012,10,1,"HYDRACHNIDIA GEN. SP.",22.6
"SWE_038_MZB_LO_11","SWE_038_MZB_LO_11-01.10.2012","01.10.2012",2012,10,1,"HYDRAENIDAE GEN. SP.",2.8
"SWE_038_MZB_LO_11","SWE_038_MZB_LO_11-01.10.2012","01.10.2012",2012,10,1,"LEPTOCERIDAE GEN. SP.",0.2
"SWE_038_MZB_LO_11","SWE_038_MZB_LO_11-01.10.2012","01.10.2012",2012,10,1,"LEUCTRA SP.",123.4
"SWE_038_MZB_LO_11","SWE_038_MZB_LO_11-01.10.2012","01.10.2012",2012,10,1,"LIMNEPHILIDAE GEN. SP.",13.4
"SWE_038_MZB_LO_11","SWE_038_MZB_LO_11-01.10.2012","01.10.2012",2012,10,1,"LIMNIUS SP.",24
"SWE_038_MZB_LO_11","SWE_038_MZB_LO_11-01.10.2012","01.10.2012",2012,10,1,"LIMONIIDAE GEN. SP.",0.8
"SWE_038_MZB_LO_11","SWE_038_MZB_LO_11-01.10.2012","01.10.2012",2012,10,1,"NEMOURIDAE GEN. SP.",2.8
"SWE_038_MZB_LO_11","SWE_038_MZB_LO_11-01.10.2012","01.10.2012",2012,10,1,"OLIGOCHAETA GEN. SP.",10
"SWE_038_MZB_LO_11","SWE_038_MZB_LO_11-01.10.2012","01.10.2012",2012,10,1,"OULIMNIUS SP.",0.8
"SWE_038_MZB_LO_11","SWE_038_MZB_LO_11-01.10.2012","01.10.2012",2012,10,1,"PERLODIDAE GEN. SP.",0.6
"SWE_038_MZB_LO_11","SWE_038_MZB_LO_11-01.10.2012","01.10.2012",2012,10,1,"POLYCENTROPODIDAE GEN. SP.",26.8
"SWE_038_MZB_LO_11","SWE_038_MZB_LO_11-01.10.2012","01.10.2012",2012,10,1,"PSYCHODIDAE GEN. SP.",0.2
"SWE_038_MZB_LO_11","SWE_038_MZB_LO_11-01.10.2012","01.10.2012",2012,10,1,"PSYCHOMYIIDAE GEN. SP.",1
"SWE_038_MZB_LO_11","SWE_038_MZB_LO_11-01.10.2012","01.10.2012",2012,10,1,"RHYACOPHILA SP.",5.4
"SWE_038_MZB_LO_11","SWE_038_MZB_LO_11-01.10.2012","01.10.2012",2012,10,1,"SCIRTIDAE GEN. SP.",0.4
"SWE_038_MZB_LO_11","SWE_038_MZB_LO_11-01.10.2012","01.10.2012",2012,10,1,"SERICOSTOMATIDAE GEN. SP.",6.2
"SWE_038_MZB_LO_11","SWE_038_MZB_LO_11-01.10.2012","01.10.2012",2012,10,1,"SIMULIIDAE GEN. SP.",2.4
"SWE_038_MZB_LO_11","SWE_038_MZB_LO_11-01.10.2012","01.10.2012",2012,10,1,"SPHAERIIDAE GEN. SP.",73.4
"SWE_038_MZB_LO_11","SWE_038_MZB_LO_11-01.10.2012","01.10.2012",2012,10,1,"TIPULIDAE GEN. SP.",2.2
"SWE_038_MZB_LO_11","SWE_038_MZB_LO_11-01.10.2012","01.10.2012",2012,10,1,"ZYGOPTERA GEN. SP.",0.2
"SWE_038_MZB_LO_11","SWE_038_MZB_LO_11-01.10.2013","01.10.2013",2013,10,1,"ACROLOXUS LACUSTRIS",0.2
"SWE_038_MZB_LO_11","SWE_038_MZB_LO_11-01.10.2013","01.10.2013",2013,10,1,"AGAPETUS SP.",6.2
"SWE_038_MZB_LO_11","SWE_038_MZB_LO_11-01.10.2013","01.10.2013",2013,10,1,"ASELLUS AQUATICUS",2.6
"SWE_038_MZB_LO_11","SWE_038_MZB_LO_11-01.10.2013","01.10.2013",2013,10,1,"BAETIDAE GEN. SP.",161.2
"SWE_038_MZB_LO_11","SWE_038_MZB_LO_11-01.10.2013","01.10.2013",2013,10,1,"BERAEODES MINUTUS",0.4
"SWE_038_MZB_LO_11","SWE_038_MZB_LO_11-01.10.2013","01.10.2013",2013,10,1,"CERATOPOGONIDAE GEN. SP.",2
"SWE_038_MZB_LO_11","SWE_038_MZB_LO_11-01.10.2013","01.10.2013",2013,10,1,"CHIRONOMIDAE GEN. SP.",76.2
"SWE_038_MZB_LO_11","SWE_038_MZB_LO_11-01.10.2013","01.10.2013",2013,10,1,"DICRANOTA SP.",2.8
"SWE_038_MZB_LO_11","SWE_038_MZB_LO_11-01.10.2013","01.10.2013",2013,10,1,"DIXA SP.",0.2
"SWE_038_MZB_LO_11","SWE_038_MZB_LO_11-01.10.2013","01.10.2013",2013,10,1,"ELMIS AENEA",17.6
"SWE_038_MZB_LO_11","SWE_038_MZB_LO_11-01.10.2013","01.10.2013",2013,10,1,"EMPIDIDAE GEN. SP.",0.2
"SWE_038_MZB_LO_11","SWE_038_MZB_LO_11-01.10.2013","01.10.2013",2013,10,1,"EPHEMERA SP.",3.4
"SWE_038_MZB_LO_11","SWE_038_MZB_LO_11-01.10.2013","01.10.2013",2013,10,1,"GAMMARUS SP.",70
"SWE_038_MZB_LO_11","SWE_038_MZB_LO_11-01.10.2013","01.10.2013",2013,10,1,"GOERIDAE GEN. SP.",0.2
"SWE_038_MZB_LO_11","SWE_038_MZB_LO_11-01.10.2013","01.10.2013",2013,10,1,"HEPTAGENIIDAE GEN. SP.",4.4
"SWE_038_MZB_LO_11","SWE_038_MZB_LO_11-01.10.2013","01.10.2013",2013,10,1,"HYDRACHNIDAE GEN. SP.",20.2
"SWE_038_MZB_LO_11","SWE_038_MZB_LO_11-01.10.2013","01.10.2013",2013,10,1,"HYDRAENIDAE GEN. SP.",1.8
"SWE_038_MZB_LO_11","SWE_038_MZB_LO_11-01.10.2013","01.10.2013",2013,10,1,"LEUCTRA SP.",53.2
"SWE_038_MZB_LO_11","SWE_038_MZB_LO_11-01.10.2013","01.10.2013",2013,10,1,"LIMNEPHILIDAE GEN. SP.",0.8
"SWE_038_MZB_LO_11","SWE_038_MZB_LO_11-01.10.2013","01.10.2013",2013,10,1,"LIMNIUS SP.",11.2
"SWE_038_MZB_LO_11","SWE_038_MZB_LO_11-01.10.2013","01.10.2013",2013,10,1,"LIMONIIDAE GEN. SP.",0.8
"SWE_038_MZB_LO_11","SWE_038_MZB_LO_11-01.10.2013","01.10.2013",2013,10,1,"NEMOURIDAE GEN. SP.",2.8
"SWE_038_MZB_LO_11","SWE_038_MZB_LO_11-01.10.2013","01.10.2013",2013,10,1,"OLIGOCHAETA GEN. SP.",9.4
"SWE_038_MZB_LO_11","SWE_038_MZB_LO_11-01.10.2013","01.10.2013",2013,10,1,"OULIMNIUS SP.",0.2
"SWE_038_MZB_LO_11","SWE_038_MZB_LO_11-01.10.2013","01.10.2013",2013,10,1,"PERLODIDAE GEN. SP.",0.4
"SWE_038_MZB_LO_11","SWE_038_MZB_LO_11-01.10.2013","01.10.2013",2013,10,1,"POLYCENTROPODIDAE GEN. SP.",4.4
"SWE_038_MZB_LO_11","SWE_038_MZB_LO_11-01.10.2013","01.10.2013",2013,10,1,"PSYCHOMYIIDAE GEN. SP.",2.4
"SWE_038_MZB_LO_11","SWE_038_MZB_LO_11-01.10.2013","01.10.2013",2013,10,1,"RHYACOPHILA SP.",0.4
"SWE_038_MZB_LO_11","SWE_038_MZB_LO_11-01.10.2013","01.10.2013",2013,10,1,"SERICOSTOMATIDAE GEN. SP.",5.2
"SWE_038_MZB_LO_11","SWE_038_MZB_LO_11-01.10.2013","01.10.2013",2013,10,1,"SIMULIIDAE GEN. SP.",1.8
"SWE_038_MZB_LO_11","SWE_038_MZB_LO_11-01.10.2013","01.10.2013",2013,10,1,"SPHAERIIDAE GEN. SP.",17
"SWE_038_MZB_LO_11","SWE_038_MZB_LO_11-02.10.2014","02.10.2014",2014,10,2,"ACROLOXUS LACUSTRIS",0.2
"SWE_038_MZB_LO_11","SWE_038_MZB_LO_11-02.10.2014","02.10.2014",2014,10,2,"AGAPETUS SP.",1.4
"SWE_038_MZB_LO_11","SWE_038_MZB_LO_11-02.10.2014","02.10.2014",2014,10,2,"ASELLUS AQUATICUS",1.4
"SWE_038_MZB_LO_11","SWE_038_MZB_LO_11-02.10.2014","02.10.2014",2014,10,2,"BAETIDAE GEN. SP.",45.2
"SWE_038_MZB_LO_11","SWE_038_MZB_LO_11-02.10.2014","02.10.2014",2014,10,2,"CERATOPOGONIDAE GEN. SP.",2
"SWE_038_MZB_LO_11","SWE_038_MZB_LO_11-02.10.2014","02.10.2014",2014,10,2,"CHIRONOMIDAE GEN. SP.",177.4
"SWE_038_MZB_LO_11","SWE_038_MZB_LO_11-02.10.2014","02.10.2014",2014,10,2,"DICRANOTA SP.",4
"SWE_038_MZB_LO_11","SWE_038_MZB_LO_11-02.10.2014","02.10.2014",2014,10,2,"DIXA SP.",0.6
"SWE_038_MZB_LO_11","SWE_038_MZB_LO_11-02.10.2014","02.10.2014",2014,10,2,"ELMIS AENEA",25
"SWE_038_MZB_LO_11","SWE_038_MZB_LO_11-02.10.2014","02.10.2014",2014,10,2,"EMPIDIDAE GEN. SP.",0.2
"SWE_038_MZB_LO_11","SWE_038_MZB_LO_11-02.10.2014","02.10.2014",2014,10,2,"EPHEMERA SP.",0.6
"SWE_038_MZB_LO_11","SWE_038_MZB_LO_11-02.10.2014","02.10.2014",2014,10,2,"GAMMARUS SP.",67
"SWE_038_MZB_LO_11","SWE_038_MZB_LO_11-02.10.2014","02.10.2014",2014,10,2,"GLOSSIPHONIIDAE GEN. SP.",0.2
"SWE_038_MZB_LO_11","SWE_038_MZB_LO_11-02.10.2014","02.10.2014",2014,10,2,"GOERIDAE GEN. SP.",0.2
"SWE_038_MZB_LO_11","SWE_038_MZB_LO_11-02.10.2014","02.10.2014",2014,10,2,"HEPTAGENIIDAE GEN. SP.",5.8
"SWE_038_MZB_LO_11","SWE_038_MZB_LO_11-02.10.2014","02.10.2014",2014,10,2,"HYDRACHNIDAE GEN. SP.",20.4
"SWE_038_MZB_LO_11","SWE_038_MZB_LO_11-02.10.2014","02.10.2014",2014,10,2,"HYDRAENIDAE GEN. SP.",1.2
"SWE_038_MZB_LO_11","SWE_038_MZB_LO_11-02.10.2014","02.10.2014",2014,10,2,"LEPTOCERIDAE GEN. SP.",1.2
"SWE_038_MZB_LO_11","SWE_038_MZB_LO_11-02.10.2014","02.10.2014",2014,10,2,"LEUCTRA SP.",55.2
"SWE_038_MZB_LO_11","SWE_038_MZB_LO_11-02.10.2014","02.10.2014",2014,10,2,"LIMNEPHILIDAE GEN. SP.",2.4
"SWE_038_MZB_LO_11","SWE_038_MZB_LO_11-02.10.2014","02.10.2014",2014,10,2,"LIMNIUS SP.",13
"SWE_038_MZB_LO_11","SWE_038_MZB_LO_11-02.10.2014","02.10.2014",2014,10,2,"LIMONIIDAE GEN. SP.",0.6
