"Unique.ID","Samp.ID","Sampling.date","year","month","day","eqr","eqc"
"ENG_062_MZB_LO_1869","ENG_062_MZB_LO_1869-13.11.2003","13.11.2003",2003,11,13,0.888261523,2
"ENG_062_MZB_LO_1869","ENG_062_MZB_LO_1869-01.10.2004","01.10.2004",2004,10,1,0.973421633,1
"ENG_062_MZB_LO_1869","ENG_062_MZB_LO_1869-05.09.2006","05.09.2006",2006,9,5,0.955047565,2
"ENG_062_MZB_LO_1869","ENG_062_MZB_LO_1869-07.11.2008","07.11.2008",2008,11,7,0.928518133,2
"ENG_062_MZB_LO_1869","ENG_062_MZB_LO_1869-01.10.2009","01.10.2009",2009,10,1,0.967648973,1
"ENG_062_MZB_LO_1869","ENG_062_MZB_LO_1869-27.10.2010","27.10.2010",2010,10,27,0.931254794,2
"ENG_062_MZB_LO_1869","ENG_062_MZB_LO_1869-25.10.2011","25.10.2011",2011,10,25,0.940043707,2
"ENG_062_MZB_LO_1869","ENG_062_MZB_LO_1869-06.09.2012","06.09.2012",2012,9,6,0.883646937,3
"ENG_062_MZB_LO_1869","ENG_062_MZB_LO_1869-12.09.2013","12.09.2013",2013,9,12,0.887792037,2
"ENG_062_MZB_LO_1869","ENG_062_MZB_LO_1869-10.09.2014","10.09.2014",2014,9,10,0.949545254,2
"ENG_062_MZB_LO_1869","ENG_062_MZB_LO_1869-22.09.2015","22.09.2015",2015,9,22,0.907289845,2
"ENG_062_MZB_LO_1869","ENG_062_MZB_LO_1869-29.11.2016","29.11.2016",2016,11,29,0.934783293,2
"ENG_062_MZB_LO_1869","ENG_062_MZB_LO_1869-08.11.2017","08.11.2017",2017,11,8,0.988592709,1
"ENG_062_MZB_LO_1869","ENG_062_MZB_LO_1869-03.09.2018","03.09.2018",2018,9,3,0.889966353,3
"ENG_062_MZB_LO_1869","ENG_062_MZB_LO_1869-17.09.2020","17.09.2020",2020,9,17,0.834115238,5
"ENG_062_MZB_LO_1869","ENG_062_MZB_LO_1869-18.10.2021","18.10.2021",2021,10,18,0.97470495,1
"ENG_062_MZB_LO_1869","ENG_062_MZB_LO_1869-16.09.2022","16.09.2022",2022,9,16,0.948861047,2
"ENG_062_MZB_LO_1869","ENG_062_MZB_LO_1869-09.10.2023","09.10.2023",2023,10,9,1.012151734,1
"ENG_062_MZB_LO_1870","ENG_062_MZB_LO_1870-30.10.2003","30.10.2003",2003,10,30,0.846309947,3
"ENG_062_MZB_LO_1870","ENG_062_MZB_LO_1870-19.10.2006","19.10.2006",2006,10,19,0.890514599,2
"ENG_062_MZB_LO_1870","ENG_062_MZB_LO_1870-06.11.2013","06.11.2013",2013,11,6,1.061379912,1
"ENG_062_MZB_LO_1870","ENG_062_MZB_LO_1870-24.09.2014","24.09.2014",2014,9,24,0.999316915,1
"ENG_062_MZB_LO_1870","ENG_062_MZB_LO_1870-09.11.2021","09.11.2021",2021,11,9,1.007086069,1
"ENG_062_MZB_LO_1870","ENG_062_MZB_LO_1870-27.10.2022","27.10.2022",2022,10,27,1.021038297,1
"ENG_062_MZB_LO_1870","ENG_062_MZB_LO_1870-29.09.2023","29.09.2023",2023,9,29,1.076060939,1
"ENG_062_MZB_LO_1872","ENG_062_MZB_LO_1872-26.11.2002","26.11.2002",2002,11,26,0.872087849,3
"ENG_062_MZB_LO_1872","ENG_062_MZB_LO_1872-07.10.2004","07.10.2004",2004,10,7,0.840116379,3
"ENG_062_MZB_LO_1872","ENG_062_MZB_LO_1872-25.11.2005","25.11.2005",2005,11,25,1.038723848,1
"ENG_062_MZB_LO_1872","ENG_062_MZB_LO_1872-24.09.2008","24.09.2008",2008,9,24,0.910089961,3
"ENG_062_MZB_LO_1872","ENG_062_MZB_LO_1872-11.11.2011","11.11.2011",2011,11,11,0.848491986,4
"ENG_062_MZB_LO_1872","ENG_062_MZB_LO_1872-21.10.2013","21.10.2013",2013,10,21,0.936187368,3
"ENG_062_MZB_LO_1872","ENG_062_MZB_LO_1872-03.09.2015","03.09.2015",2015,9,3,0.946494195,2
"ENG_062_MZB_LO_1874","ENG_062_MZB_LO_1874-23.09.2002","23.09.2002",2002,9,23,1.089569294,1
"ENG_062_MZB_LO_1874","ENG_062_MZB_LO_1874-18.11.2004","18.11.2004",2004,11,18,0.996422301,1
"ENG_062_MZB_LO_1874","ENG_062_MZB_LO_1874-18.10.2007","18.10.2007",2007,10,18,1.020271405,1
"ENG_062_MZB_LO_1874","ENG_062_MZB_LO_1874-11.10.2011","11.10.2011",2011,10,11,1.02613958,2
"ENG_062_MZB_LO_1874","ENG_062_MZB_LO_1874-16.10.2014","16.10.2014",2014,10,16,1.008155082,2
"ENG_062_MZB_LO_1874","ENG_062_MZB_LO_1874-10.11.2022","10.11.2022",2022,11,10,0.916968607,2
"ENG_062_MZB_LO_1874","ENG_062_MZB_LO_1874-13.11.2023","13.11.2023",2023,11,13,1.031122471,2
"ENG_062_MZB_LO_1875","ENG_062_MZB_LO_1875-28.11.2002","28.11.2002",2002,11,28,0.905043262,2
"ENG_062_MZB_LO_1875","ENG_062_MZB_LO_1875-01.10.2003","01.10.2003",2003,10,1,0.976422749,1
"ENG_062_MZB_LO_1875","ENG_062_MZB_LO_1875-22.09.2004","22.09.2004",2004,9,22,0.930839382,2
"ENG_062_MZB_LO_1875","ENG_062_MZB_LO_1875-11.10.2005","11.10.2005",2005,10,11,0.929840205,2
"ENG_062_MZB_LO_1875","ENG_062_MZB_LO_1875-18.10.2006","18.10.2006",2006,10,18,0.972442942,1
"ENG_062_MZB_LO_1875","ENG_062_MZB_LO_1875-08.10.2007","08.10.2007",2007,10,8,0.985267804,1
"ENG_062_MZB_LO_1875","ENG_062_MZB_LO_1875-13.10.2008","13.10.2008",2008,10,13,0.980202049,1
"ENG_062_MZB_LO_1875","ENG_062_MZB_LO_1875-30.09.2009","30.09.2009",2009,9,30,1.010450985,1
"ENG_062_MZB_LO_1875","ENG_062_MZB_LO_1875-16.09.2013","16.09.2013",2013,9,16,1.115771476,1
"ENG_062_MZB_LO_1875","ENG_062_MZB_LO_1875-11.09.2015","11.09.2015",2015,9,11,1.134819104,1
"ENG_062_MZB_LO_1876","ENG_062_MZB_LO_1876-29.11.2013","29.11.2013",2013,11,29,0.865916821,2
"ENG_062_MZB_LO_1876","ENG_062_MZB_LO_1876-04.09.2014","04.09.2014",2014,9,4,0.7993366,3
"ENG_062_MZB_LO_1876","ENG_062_MZB_LO_1876-17.09.2015","17.09.2015",2015,9,17,0.843245348,3
"ENG_062_MZB_LO_1876","ENG_062_MZB_LO_1876-20.10.2016","20.10.2016",2016,10,20,0.867198645,2
"ENG_062_MZB_LO_1876","ENG_062_MZB_LO_1876-11.10.2017","11.10.2017",2017,10,11,0.893781934,2
"ENG_062_MZB_LO_1876","ENG_062_MZB_LO_1876-30.10.2018","30.10.2018",2018,10,30,0.878634977,2
"ENG_062_MZB_LO_1876","ENG_062_MZB_LO_1876-22.11.2019","22.11.2019",2019,11,22,0.831859239,3
"ENG_062_MZB_LO_1876","ENG_062_MZB_LO_1876-16.09.2020","16.09.2020",2020,9,16,0.848883174,3
"ENG_062_MZB_LO_1876","ENG_062_MZB_LO_1876-28.10.2021","28.10.2021",2021,10,28,0.787753392,3
"ENG_062_MZB_LO_1876","ENG_062_MZB_LO_1876-13.09.2023","13.09.2023",2023,9,13,0.828417279,3
"ENG_062_MZB_LO_1878","ENG_062_MZB_LO_1878-24.04.2002","24.04.2002",2002,4,24,0.981462478,2
"ENG_062_MZB_LO_1878","ENG_062_MZB_LO_1878-09.04.2003","09.04.2003",2003,4,9,0.941257365,2
"ENG_062_MZB_LO_1878","ENG_062_MZB_LO_1878-27.05.2004","27.05.2004",2004,5,27,0.86298304,3
"ENG_062_MZB_LO_1878","ENG_062_MZB_LO_1878-19.03.2008","19.03.2008",2008,3,19,0.978632861,2
"ENG_062_MZB_LO_1878","ENG_062_MZB_LO_1878-13.04.2010","13.04.2010",2010,4,13,1.04308142,1
"ENG_062_MZB_LO_1878","ENG_062_MZB_LO_1878-17.05.2012","17.05.2012",2012,5,17,0.879443062,2
"ENG_062_MZB_LO_1878","ENG_062_MZB_LO_1878-16.05.2014","16.05.2014",2014,5,16,0.923131018,4
"ENG_062_MZB_LO_1879","ENG_062_MZB_LO_1879-07.10.2004","07.10.2004",2004,10,7,0.918294349,2
"ENG_062_MZB_LO_1879","ENG_062_MZB_LO_1879-06.11.2007","06.11.2007",2007,11,6,0.908773472,2
"ENG_062_MZB_LO_1879","ENG_062_MZB_LO_1879-25.09.2008","25.09.2008",2008,9,25,0.925208542,2
"ENG_062_MZB_LO_1879","ENG_062_MZB_LO_1879-28.10.2009","28.10.2009",2009,10,28,0.947378125,2
"ENG_062_MZB_LO_1879","ENG_062_MZB_LO_1879-20.09.2010","20.09.2010",2010,9,20,0.97149956,1
"ENG_062_MZB_LO_1879","ENG_062_MZB_LO_1879-21.09.2011","21.09.2011",2011,9,21,0.852613609,3
"ENG_062_MZB_LO_1879","ENG_062_MZB_LO_1879-20.09.2012","20.09.2012",2012,9,20,0.942432467,2
"ENG_062_MZB_LO_1879","ENG_062_MZB_LO_1879-18.10.2013","18.10.2013",2013,10,18,0.910315471,2
"ENG_062_MZB_LO_1879","ENG_062_MZB_LO_1879-29.09.2014","29.09.2014",2014,9,29,0.959491023,2
"ENG_062_MZB_LO_1879","ENG_062_MZB_LO_1879-13.10.2015","13.10.2015",2015,10,13,0.993203839,1
"ENG_062_MZB_LO_1879","ENG_062_MZB_LO_1879-11.11.2016","11.11.2016",2016,11,11,0.991012453,1
"ENG_062_MZB_LO_1879","ENG_062_MZB_LO_1879-16.10.2017","16.10.2017",2017,10,16,0.93950609,2
"ENG_062_MZB_LO_1879","ENG_062_MZB_LO_1879-16.10.2018","16.10.2018",2018,10,16,1.040090929,1
"ENG_062_MZB_LO_1879","ENG_062_MZB_LO_1879-23.10.2020","23.10.2020",2020,10,23,1.045261092,1
"ENG_062_MZB_LO_1879","ENG_062_MZB_LO_1879-02.11.2021","02.11.2021",2021,11,2,1.012985903,1
"ENG_062_MZB_LO_1879","ENG_062_MZB_LO_1879-19.10.2022","19.10.2022",2022,10,19,1.067689017,1
"ENG_062_MZB_LO_1879","ENG_062_MZB_LO_1879-09.10.2023","09.10.2023",2023,10,9,1.011093112,1
"ENG_062_MZB_LO_1880","ENG_062_MZB_LO_1880-28.11.2002","28.11.2002",2002,11,28,1.178488633,1
"ENG_062_MZB_LO_1880","ENG_062_MZB_LO_1880-16.11.2005","16.11.2005",2005,11,16,1.117472796,1
"ENG_062_MZB_LO_1880","ENG_062_MZB_LO_1880-04.10.2006","04.10.2006",2006,10,4,1.138512119,1
"ENG_062_MZB_LO_1880","ENG_062_MZB_LO_1880-20.09.2007","20.09.2007",2007,9,20,1.176443095,1
"ENG_062_MZB_LO_1880","ENG_062_MZB_LO_1880-24.11.2008","24.11.2008",2008,11,24,1.087516093,1
"ENG_062_MZB_LO_1880","ENG_062_MZB_LO_1880-09.11.2009","09.11.2009",2009,11,9,1.225277379,1
"ENG_062_MZB_LO_1880","ENG_062_MZB_LO_1880-19.11.2013","19.11.2013",2013,11,19,1.155363333,1
"ENG_062_MZB_LO_1886","ENG_062_MZB_LO_1886-19.09.2003","19.09.2003",2003,9,19,0.902767065,2
"ENG_062_MZB_LO_1886","ENG_062_MZB_LO_1886-13.10.2004","13.10.2004",2004,10,13,0.901611847,2
"ENG_062_MZB_LO_1886","ENG_062_MZB_LO_1886-13.10.2006","13.10.2006",2006,10,13,0.942004595,2
"ENG_062_MZB_LO_1886","ENG_062_MZB_LO_1886-27.09.2007","27.09.2007",2007,9,27,0.947843534,2
"ENG_062_MZB_LO_1886","ENG_062_MZB_LO_1886-19.09.2008","19.09.2008",2008,9,19,0.978089254,1
"ENG_062_MZB_LO_1886","ENG_062_MZB_LO_1886-08.10.2009","08.10.2009",2009,10,8,0.95743435,2
"ENG_062_MZB_LO_1886","ENG_062_MZB_LO_1886-13.10.2010","13.10.2010",2010,10,13,0.925822133,2
"ENG_062_MZB_LO_1886","ENG_062_MZB_LO_1886-09.11.2011","09.11.2011",2011,11,9,0.872003867,2
"ENG_062_MZB_LO_1886","ENG_062_MZB_LO_1886-16.11.2012","16.11.2012",2012,11,16,0.909963111,2
"ENG_062_MZB_LO_1886","ENG_062_MZB_LO_1886-04.11.2013","04.11.2013",2013,11,4,0.999198051,1
"ENG_062_MZB_LO_1886","ENG_062_MZB_LO_1886-04.09.2014","04.09.2014",2014,9,4,0.911726192,2
"ENG_062_MZB_LO_1886","ENG_062_MZB_LO_1886-17.09.2015","17.09.2015",2015,9,17,0.867406773,2
"ENG_062_MZB_LO_1886","ENG_062_MZB_LO_1886-14.09.2016","14.09.2016",2016,9,14,0.860009018,3
"ENG_062_MZB_LO_1886","ENG_062_MZB_LO_1886-11.10.2017","11.10.2017",2017,10,11,0.940563857,2
"ENG_062_MZB_LO_1886","ENG_062_MZB_LO_1886-08.10.2018","08.10.2018",2018,10,8,0.818893173,3
"ENG_062_MZB_LO_1886","ENG_062_MZB_LO_1886-09.09.2019","09.09.2019",2019,9,9,0.996660889,1
"ENG_062_MZB_LO_1886","ENG_062_MZB_LO_1886-02.09.2020","02.09.2020",2020,9,2,0.945758495,2
"ENG_062_MZB_LO_1886","ENG_062_MZB_LO_1886-10.09.2021","10.09.2021",2021,9,10,0.913366057,2
"ENG_062_MZB_LO_1886","ENG_062_MZB_LO_1886-13.09.2023","13.09.2023",2023,9,13,0.965306525,2
"ENG_062_MZB_LO_1887","ENG_062_MZB_LO_1887-20.09.2006","20.09.2006",2006,9,20,0.668829954,4
"ENG_062_MZB_LO_1887","ENG_062_MZB_LO_1887-12.10.2007","12.10.2007",2007,10,12,0.673761455,4
"ENG_062_MZB_LO_1887","ENG_062_MZB_LO_1887-06.11.2008","06.11.2008",2008,11,6,0.818495793,5
"ENG_062_MZB_LO_1887","ENG_062_MZB_LO_1887-21.10.2009","21.10.2009",2009,10,21,0.759600366,3
"ENG_062_MZB_LO_1887","ENG_062_MZB_LO_1887-27.09.2010","27.09.2010",2010,9,27,0.710345413,4
"ENG_062_MZB_LO_1887","ENG_062_MZB_LO_1887-22.09.2011","22.09.2011",2011,9,22,0.717451855,4
"ENG_062_MZB_LO_1887","ENG_062_MZB_LO_1887-19.09.2012","19.09.2012",2012,9,19,0.724830255,4
"ENG_062_MZB_LO_1887","ENG_062_MZB_LO_1887-01.10.2013","01.10.2013",2013,10,1,0.71705388,4
"ENG_062_MZB_LO_1887","ENG_062_MZB_LO_1887-01.09.2014","01.09.2014",2014,9,1,0.768335447,3
"ENG_062_MZB_LO_1887","ENG_062_MZB_LO_1887-16.09.2015","16.09.2015",2015,9,16,0.778943783,3
"ENG_062_MZB_LO_1887","ENG_062_MZB_LO_1887-03.10.2016","03.10.2016",2016,10,3,0.679349083,4
"ENG_062_MZB_LO_1887","ENG_062_MZB_LO_1887-05.10.2017","05.10.2017",2017,10,5,0.707606038,4
"ENG_062_MZB_LO_1887","ENG_062_MZB_LO_1887-31.10.2018","31.10.2018",2018,10,31,0.746332532,3
"ENG_062_MZB_LO_1887","ENG_062_MZB_LO_1887-06.11.2019","06.11.2019",2019,11,6,0.724666041,3
"ENG_062_MZB_LO_1887","ENG_062_MZB_LO_1887-14.09.2020","14.09.2020",2020,9,14,0.655723302,4
"ENG_062_MZB_LO_1887","ENG_062_MZB_LO_1887-09.09.2021","09.09.2021",2021,9,9,0.683269181,4
"ENG_062_MZB_LO_1893","ENG_062_MZB_LO_1893-25.09.2002","25.09.2002",2002,9,25,0.858278938,3
"ENG_062_MZB_LO_1893","ENG_062_MZB_LO_1893-13.11.2003","13.11.2003",2003,11,13,0.871909894,2
"ENG_062_MZB_LO_1893","ENG_062_MZB_LO_1893-01.10.2004","01.10.2004",2004,10,1,0.820637245,3
"ENG_062_MZB_LO_1893","ENG_062_MZB_LO_1893-05.09.2006","05.09.2006",2006,9,5,0.789375625,3
"ENG_062_MZB_LO_1893","ENG_062_MZB_LO_1893-28.09.2007","28.09.2007",2007,9,28,0.907928816,2
"ENG_062_MZB_LO_1893","ENG_062_MZB_LO_1893-21.11.2008","21.11.2008",2008,11,21,0.941928806,2
"ENG_062_MZB_LO_1893","ENG_062_MZB_LO_1893-21.09.2009","21.09.2009",2009,9,21,0.919617782,2
"ENG_062_MZB_LO_1893","ENG_062_MZB_LO_1893-11.10.2010","11.10.2010",2010,10,11,0.857587507,3
"ENG_062_MZB_LO_1893","ENG_062_MZB_LO_1893-26.11.2013","26.11.2013",2013,11,26,0.893042331,2
"ENG_062_MZB_LO_1894","ENG_062_MZB_LO_1894-17.09.2003","17.09.2003",2003,9,17,0.876378964,3
"ENG_062_MZB_LO_1894","ENG_062_MZB_LO_1894-11.11.2004","11.11.2004",2004,11,11,0.764773257,4
"ENG_062_MZB_LO_1894","ENG_062_MZB_LO_1894-06.11.2006","06.11.2006",2006,11,6,0.823470467,3
"ENG_062_MZB_LO_1894","ENG_062_MZB_LO_1894-31.10.2007","31.10.2007",2007,10,31,0.85529769,4
"ENG_062_MZB_LO_1894","ENG_062_MZB_LO_1894-01.10.2008","01.10.2008",2008,10,1,0.914345069,3
"ENG_062_MZB_LO_1894","ENG_062_MZB_LO_1894-21.10.2009","21.10.2009",2009,10,21,0.934841393,2
"ENG_062_MZB_LO_1894","ENG_062_MZB_LO_1894-15.09.2010","15.09.2010",2010,9,15,0.854049416,3
"ENG_062_MZB_LO_1894","ENG_062_MZB_LO_1894-20.11.2012","20.11.2012",2012,11,20,0.897491665,2
"ENG_062_MZB_LO_1894","ENG_062_MZB_LO_1894-18.11.2013","18.11.2013",2013,11,18,0.925598003,2
"ENG_062_MZB_LO_1894","ENG_062_MZB_LO_1894-30.10.2014","30.10.2014",2014,10,30,0.852890305,3
"ENG_062_MZB_LO_1894","ENG_062_MZB_LO_1894-16.09.2015","16.09.2015",2015,9,16,0.937212483,5
"ENG_062_MZB_LO_1897","ENG_062_MZB_LO_1897-15.10.2002","15.10.2002",2002,10,15,0.857880506,3
"ENG_062_MZB_LO_1897","ENG_062_MZB_LO_1897-21.10.2003","21.10.2003",2003,10,21,0.856605193,3
"ENG_062_MZB_LO_1897","ENG_062_MZB_LO_1897-05.10.2004","05.10.2004",2004,10,5,0.8909403,2
"ENG_062_MZB_LO_1897","ENG_062_MZB_LO_1897-12.10.2005","12.10.2005",2005,10,12,0.866163833,5
"ENG_062_MZB_LO_1897","ENG_062_MZB_LO_1897-04.10.2006","04.10.2006",2006,10,4,0.721994943,4
"ENG_062_MZB_LO_1897","ENG_062_MZB_LO_1897-27.09.2007","27.09.2007",2007,9,27,0.938518312,3
"ENG_062_MZB_LO_1897","ENG_062_MZB_LO_1897-17.09.2008","17.09.2008",2008,9,17,0.816569774,5
"ENG_062_MZB_LO_1897","ENG_062_MZB_LO_1897-08.10.2009","08.10.2009",2009,10,8,0.892476209,2
"ENG_062_MZB_LO_1897","ENG_062_MZB_LO_1897-08.10.2010","08.10.2010",2010,10,8,0.862756623,3
"ENG_062_MZB_LO_1897","ENG_062_MZB_LO_1897-20.09.2011","20.09.2011",2011,9,20,0.966823119,2
"ENG_062_MZB_LO_1897","ENG_062_MZB_LO_1897-03.09.2012","03.09.2012",2012,9,3,0.912233154,2
"ENG_062_MZB_LO_1897","ENG_062_MZB_LO_1897-03.09.2013","03.09.2013",2013,9,3,0.85343684,5
"ENG_062_MZB_LO_1897","ENG_062_MZB_LO_1897-01.09.2014","01.09.2014",2014,9,1,1.0138634,3
"ENG_062_MZB_LO_1897","ENG_062_MZB_LO_1897-17.09.2015","17.09.2015",2015,9,17,0.901197848,2
"ENG_062_MZB_LO_1897","ENG_062_MZB_LO_1897-01.09.2016","01.09.2016",2016,9,1,0.89382966,3
"ENG_062_MZB_LO_1897","ENG_062_MZB_LO_1897-16.11.2017","16.11.2017",2017,11,16,0.828400191,3
"ENG_062_MZB_LO_1897","ENG_062_MZB_LO_1897-26.09.2018","26.09.2018",2018,9,26,0.911671502,5
"ENG_062_MZB_LO_1897","ENG_062_MZB_LO_1897-30.10.2020","30.10.2020",2020,10,30,0.726947106,5
"ENG_062_MZB_LO_1898","ENG_062_MZB_LO_1898-01.04.2003","01.04.2003",2003,4,1,1.102048589,1
"ENG_062_MZB_LO_1898","ENG_062_MZB_LO_1898-25.04.2006","25.04.2006",2006,4,25,1.050172904,1
"ENG_062_MZB_LO_1898","ENG_062_MZB_LO_1898-03.05.2007","03.05.2007",2007,5,3,1.093656301,1
"ENG_062_MZB_LO_1898","ENG_062_MZB_LO_1898-21.05.2010","21.05.2010",2010,5,21,1.088760729,1
"ENG_062_MZB_LO_1898","ENG_062_MZB_LO_1898-01.05.2013","01.05.2013",2013,5,1,1.046757235,1
"ENG_062_MZB_LO_1898","ENG_062_MZB_LO_1898-05.04.2016","05.04.2016",2016,4,5,1.093537782,1
"ENG_062_MZB_LO_1898","ENG_062_MZB_LO_1898-23.04.2019","23.04.2019",2019,4,23,1.135032062,1
"ENG_062_MZB_LO_1902","ENG_062_MZB_LO_1902-13.03.2003","13.03.2003",2003,3,13,0.765412159,3
"ENG_062_MZB_LO_1902","ENG_062_MZB_LO_1902-21.03.2006","21.03.2006",2006,3,21,0.723390303,3
"ENG_062_MZB_LO_1902","ENG_062_MZB_LO_1902-29.04.2009","29.04.2009",2009,4,29,0.694456174,4
"ENG_062_MZB_LO_1902","ENG_062_MZB_LO_1902-24.03.2010","24.03.2010",2010,3,24,0.817532659,3
"ENG_062_MZB_LO_1902","ENG_062_MZB_LO_1902-11.04.2012","11.04.2012",2012,4,11,0.761810812,3
"ENG_062_MZB_LO_1902","ENG_062_MZB_LO_1902-05.03.2015","05.03.2015",2015,3,5,0.836375999,3
"ENG_062_MZB_LO_1902","ENG_062_MZB_LO_1902-16.05.2018","16.05.2018",2018,5,16,0.675297248,5
"ENG_062_MZB_LO_1903","ENG_062_MZB_LO_1903-30.11.2002","30.11.2002",2002,11,30,0.851569828,3
"ENG_062_MZB_LO_1903","ENG_062_MZB_LO_1903-30.11.2003","30.11.2003",2003,11,30,0.887983447,3
"ENG_062_MZB_LO_1903","ENG_062_MZB_LO_1903-01.10.2004","01.10.2004",2004,10,1,0.918875154,2
"ENG_062_MZB_LO_1903","ENG_062_MZB_LO_1903-13.10.2005","13.10.2005",2005,10,13,0.935928983,2
"ENG_062_MZB_LO_1903","ENG_062_MZB_LO_1903-21.11.2006","21.11.2006",2006,11,21,0.910155451,2
"ENG_062_MZB_LO_1903","ENG_062_MZB_LO_1903-18.10.2007","18.10.2007",2007,10,18,0.918334983,2
"ENG_062_MZB_LO_1903","ENG_062_MZB_LO_1903-17.09.2008","17.09.2008",2008,9,17,0.918878102,2
"ENG_062_MZB_LO_1903","ENG_062_MZB_LO_1903-07.10.2010","07.10.2010",2010,10,7,0.96842205,1
"ENG_062_MZB_LO_1903","ENG_062_MZB_LO_1903-22.09.2011","22.09.2011",2011,9,22,0.927484938,2
"ENG_062_MZB_LO_1903","ENG_062_MZB_LO_1903-05.09.2012","05.09.2012",2012,9,5,1.030774016,1
"ENG_062_MZB_LO_1903","ENG_062_MZB_LO_1903-04.11.2013","04.11.2013",2013,11,4,1.007001502,1
"ENG_062_MZB_LO_1903","ENG_062_MZB_LO_1903-31.10.2014","31.10.2014",2014,10,31,0.998511761,1
"ENG_062_MZB_LO_1903","ENG_062_MZB_LO_1903-22.10.2015","22.10.2015",2015,10,22,0.954122309,2
"ENG_062_MZB_LO_1903","ENG_062_MZB_LO_1903-03.11.2016","03.11.2016",2016,11,3,0.91446181,2
"ENG_062_MZB_LO_1903","ENG_062_MZB_LO_1903-23.10.2017","23.10.2017",2017,10,23,0.863737698,3
"ENG_062_MZB_LO_1903","ENG_062_MZB_LO_1903-30.10.2018","30.10.2018",2018,10,30,0.9354213,2
"ENG_062_MZB_LO_1903","ENG_062_MZB_LO_1903-16.11.2020","16.11.2020",2020,11,16,0.979976424,1
"ENG_062_MZB_LO_1903","ENG_062_MZB_LO_1903-28.10.2021","28.10.2021",2021,10,28,1.099079492,1
"ENG_062_MZB_LO_1903","ENG_062_MZB_LO_1903-21.09.2022","21.09.2022",2022,9,21,1.016637439,1
"ENG_062_MZB_LO_1903","ENG_062_MZB_LO_1903-06.10.2023","06.10.2023",2023,10,6,0.925461268,3
"ENG_062_MZB_LO_1903","ENG_062_MZB_LO_1903-30.10.2024","30.10.2024",2024,10,30,1.10297853,1
"ENG_062_MZB_LO_1905","ENG_062_MZB_LO_1905-17.09.2003","17.09.2003",2003,9,17,1.150321845,1
"ENG_062_MZB_LO_1905","ENG_062_MZB_LO_1905-05.10.2006","05.10.2006",2006,10,5,1.138585809,2
"ENG_062_MZB_LO_1905","ENG_062_MZB_LO_1905-10.11.2009","10.11.2009",2009,11,10,1.259775041,1
"ENG_062_MZB_LO_1905","ENG_062_MZB_LO_1905-13.09.2012","13.09.2012",2012,9,13,1.226961391,1
"ENG_062_MZB_LO_1905","ENG_062_MZB_LO_1905-18.10.2017","18.10.2017",2017,10,18,1.214767004,1
"ENG_062_MZB_LO_1905","ENG_062_MZB_LO_1905-06.11.2018","06.11.2018",2018,11,6,1.182016481,1
"ENG_062_MZB_LO_1905","ENG_062_MZB_LO_1905-11.10.2019","11.10.2019",2019,10,11,1.085663261,3
"ENG_062_MZB_LO_1906","ENG_062_MZB_LO_1906-07.09.2002","07.09.2002",2002,9,7,0.845821383,3
"ENG_062_MZB_LO_1906","ENG_062_MZB_LO_1906-07.11.2003","07.11.2003",2003,11,7,0.835671596,3
"ENG_062_MZB_LO_1906","ENG_062_MZB_LO_1906-02.11.2004","02.11.2004",2004,11,2,0.8645297,3
"ENG_062_MZB_LO_1906","ENG_062_MZB_LO_1906-18.11.2005","18.11.2005",2005,11,18,0.893053823,2
"ENG_062_MZB_LO_1906","ENG_062_MZB_LO_1906-04.10.2006","04.10.2006",2006,10,4,0.892650068,2
"ENG_062_MZB_LO_1906","ENG_062_MZB_LO_1906-15.10.2009","15.10.2009",2009,10,15,0.961055207,2
"ENG_062_MZB_LO_1906","ENG_062_MZB_LO_1906-08.10.2013","08.10.2013",2013,10,8,0.986707734,2
"ENG_062_MZB_LO_1906","ENG_062_MZB_LO_1906-11.09.2014","11.09.2014",2014,9,11,0.954790961,3
"ENG_062_MZB_LO_1910","ENG_062_MZB_LO_1910-29.09.2003","29.09.2003",2003,9,29,1.084285137,5
"ENG_062_MZB_LO_1910","ENG_062_MZB_LO_1910-09.11.2004","09.11.2004",2004,11,9,0.881597658,5
"ENG_062_MZB_LO_1910","ENG_062_MZB_LO_1910-10.10.2005","10.10.2005",2005,10,10,0.973440108,5
"ENG_062_MZB_LO_1910","ENG_062_MZB_LO_1910-18.10.2007","18.10.2007",2007,10,18,0.969838203,5
"ENG_062_MZB_LO_1910","ENG_062_MZB_LO_1910-24.09.2008","24.09.2008",2008,9,24,0.973781206,5
"ENG_062_MZB_LO_1910","ENG_062_MZB_LO_1910-27.10.2010","27.10.2010",2010,10,27,0.981113395,5
"ENG_062_MZB_LO_1910","ENG_062_MZB_LO_1910-10.10.2013","10.10.2013",2013,10,10,0.945853132,5
"ENG_062_MZB_LO_1910","ENG_062_MZB_LO_1910-31.10.2014","31.10.2014",2014,10,31,0.906930674,5
"ENG_062_MZB_LO_1911","ENG_062_MZB_LO_1911-30.11.2002","30.11.2002",2002,11,30,0.726803392,4
"ENG_062_MZB_LO_1911","ENG_062_MZB_LO_1911-02.11.2004","02.11.2004",2004,11,2,0.753725959,4
"ENG_062_MZB_LO_1911","ENG_062_MZB_LO_1911-11.11.2005","11.11.2005",2005,11,11,0.766111768,4
"ENG_062_MZB_LO_1911","ENG_062_MZB_LO_1911-16.09.2008","16.09.2008",2008,9,16,0.642030238,5
"ENG_062_MZB_LO_1911","ENG_062_MZB_LO_1911-20.10.2011","20.10.2011",2011,10,20,0.566904515,5
"ENG_062_MZB_LO_1911","ENG_062_MZB_LO_1911-17.10.2012","17.10.2012",2012,10,17,0.676744001,4
"ENG_062_MZB_LO_1911","ENG_062_MZB_LO_1911-13.10.2015","13.10.2015",2015,10,13,0.626280417,4
"ENG_062_MZB_LO_1911","ENG_062_MZB_LO_1911-22.09.2022","22.09.2022",2022,9,22,0.605268638,5
"ENG_062_MZB_LO_1911","ENG_062_MZB_LO_1911-12.09.2023","12.09.2023",2023,9,12,0.624136781,5
"ENG_062_MZB_LO_1913","ENG_062_MZB_LO_1913-20.09.2002","20.09.2002",2002,9,20,0.974154413,1
"ENG_062_MZB_LO_1913","ENG_062_MZB_LO_1913-11.10.2005","11.10.2005",2005,10,11,0.883369891,2
"ENG_062_MZB_LO_1913","ENG_062_MZB_LO_1913-30.09.2010","30.09.2010",2010,9,30,0.887501723,2
"ENG_062_MZB_LO_1913","ENG_062_MZB_LO_1913-11.10.2011","11.10.2011",2011,10,11,0.847845944,3
"ENG_062_MZB_LO_1913","ENG_062_MZB_LO_1913-23.10.2012","23.10.2012",2012,10,23,0.852332014,3
"ENG_062_MZB_LO_1913","ENG_062_MZB_LO_1913-26.09.2013","26.09.2013",2013,9,26,0.921612181,2
"ENG_062_MZB_LO_1913","ENG_062_MZB_LO_1913-10.09.2014","10.09.2014",2014,9,10,0.908093168,2
"ENG_062_MZB_LO_1913","ENG_062_MZB_LO_1913-09.09.2015","09.09.2015",2015,9,9,0.96026328,2
"ENG_062_MZB_LO_1913","ENG_062_MZB_LO_1913-06.09.2016","06.09.2016",2016,9,6,0.902513752,2
"ENG_062_MZB_LO_1913","ENG_062_MZB_LO_1913-18.10.2017","18.10.2017",2017,10,18,0.84310649,3
"ENG_062_MZB_LO_1913","ENG_062_MZB_LO_1913-19.09.2018","19.09.2018",2018,9,19,0.819220903,3
"ENG_062_MZB_LO_1913","ENG_062_MZB_LO_1913-11.10.2019","11.10.2019",2019,10,11,0.788112585,3
"ENG_062_MZB_LO_1913","ENG_062_MZB_LO_1913-18.09.2020","18.09.2020",2020,9,18,0.788240878,3
"ENG_062_MZB_LO_1913","ENG_062_MZB_LO_1913-16.09.2021","16.09.2021",2021,9,16,0.800389539,3
"ENG_062_MZB_LO_1916","ENG_062_MZB_LO_1916-08.10.2002","08.10.2002",2002,10,8,0.840760689,3
"ENG_062_MZB_LO_1916","ENG_062_MZB_LO_1916-17.09.2003","17.09.2003",2003,9,17,0.830252627,3
"ENG_062_MZB_LO_1916","ENG_062_MZB_LO_1916-18.10.2005","18.10.2005",2005,10,18,0.76449837,3
"ENG_062_MZB_LO_1916","ENG_062_MZB_LO_1916-20.10.2006","20.10.2006",2006,10,20,0.8547134,3
"ENG_062_MZB_LO_1916","ENG_062_MZB_LO_1916-30.10.2007","30.10.2007",2007,10,30,0.835732216,3
"ENG_062_MZB_LO_1916","ENG_062_MZB_LO_1916-01.10.2008","01.10.2008",2008,10,1,0.779228976,3
"ENG_062_MZB_LO_1916","ENG_062_MZB_LO_1916-06.10.2009","06.10.2009",2009,10,6,0.859047923,3
"ENG_062_MZB_LO_1916","ENG_062_MZB_LO_1916-15.09.2010","15.09.2010",2010,9,15,0.870024587,3
"ENG_062_MZB_LO_1916","ENG_062_MZB_LO_1916-20.09.2011","20.09.2011",2011,9,20,0.790849736,3
"ENG_062_MZB_LO_1916","ENG_062_MZB_LO_1916-19.09.2012","19.09.2012",2012,9,19,0.814290199,3
"ENG_062_MZB_LO_1916","ENG_062_MZB_LO_1916-11.09.2013","11.09.2013",2013,9,11,0.797947792,3
"ENG_062_MZB_LO_1916","ENG_062_MZB_LO_1916-03.09.2014","03.09.2014",2014,9,3,0.815213934,3
"ENG_062_MZB_LO_1916","ENG_062_MZB_LO_1916-12.10.2015","12.10.2015",2015,10,12,0.843339512,3
"ENG_062_MZB_LO_1916","ENG_062_MZB_LO_1916-05.10.2016","05.10.2016",2016,10,5,0.877494402,2
"ENG_062_MZB_LO_1916","ENG_062_MZB_LO_1916-05.10.2017","05.10.2017",2017,10,5,0.915458518,3
"ENG_062_MZB_LO_1916","ENG_062_MZB_LO_1916-16.10.2018","16.10.2018",2018,10,16,0.767606861,5
"ENG_062_MZB_LO_1916","ENG_062_MZB_LO_1916-16.10.2019","16.10.2019",2019,10,16,0.815512976,3
"ENG_062_MZB_LO_1916","ENG_062_MZB_LO_1916-17.09.2020","17.09.2020",2020,9,17,0.844157248,3
"ENG_062_MZB_LO_1916","ENG_062_MZB_LO_1916-08.09.2021","08.09.2021",2021,9,8,0.870120491,3
"ENG_062_MZB_LO_1917","ENG_062_MZB_LO_1917-13.10.2004","13.10.2004",2004,10,13,1.127172128,3
"ENG_062_MZB_LO_1917","ENG_062_MZB_LO_1917-02.10.2007","02.10.2007",2007,10,2,1.145248637,2
"ENG_062_MZB_LO_1917","ENG_062_MZB_LO_1917-10.11.2009","10.11.2009",2009,11,10,1.01138542,2
"ENG_062_MZB_LO_1917","ENG_062_MZB_LO_1917-02.11.2010","02.11.2010",2010,11,2,1.129675695,2
"ENG_062_MZB_LO_1917","ENG_062_MZB_LO_1917-03.11.2011","03.11.2011",2011,11,3,1.036577547,3
"ENG_062_MZB_LO_1917","ENG_062_MZB_LO_1917-13.09.2012","13.09.2012",2012,9,13,1.124841542,2
"ENG_062_MZB_LO_1917","ENG_062_MZB_LO_1917-16.10.2013","16.10.2013",2013,10,16,1.128673381,1
"ENG_062_MZB_LO_1917","ENG_062_MZB_LO_1917-14.10.2014","14.10.2014",2014,10,14,1.070406809,1
"ENG_062_MZB_LO_1917","ENG_062_MZB_LO_1917-07.10.2015","07.10.2015",2015,10,7,1.008211054,3
"ENG_062_MZB_LO_1917","ENG_062_MZB_LO_1917-13.09.2016","13.09.2016",2016,9,13,1.0619194,1
"ENG_062_MZB_LO_1917","ENG_062_MZB_LO_1917-10.10.2017","10.10.2017",2017,10,10,1.056599369,2
"ENG_062_MZB_LO_1917","ENG_062_MZB_LO_1917-31.10.2018","31.10.2018",2018,10,31,1.111998324,1
"ENG_062_MZB_LO_1917","ENG_062_MZB_LO_1917-22.11.2019","22.11.2019",2019,11,22,1.063944373,1
"ENG_062_MZB_LO_1917","ENG_062_MZB_LO_1917-20.10.2021","20.10.2021",2021,10,20,1.129744563,1
"ENG_062_MZB_LO_1917","ENG_062_MZB_LO_1917-17.10.2022","17.10.2022",2022,10,17,1.041451389,2
"ENG_062_MZB_LO_1917","ENG_062_MZB_LO_1917-12.10.2023","12.10.2023",2023,10,12,1.118681761,1
"ENG_062_MZB_LO_1918","ENG_062_MZB_LO_1918-17.09.2003","17.09.2003",2003,9,17,1.10703946,1
"ENG_062_MZB_LO_1918","ENG_062_MZB_LO_1918-05.10.2006","05.10.2006",2006,10,5,1.089140915,2
"ENG_062_MZB_LO_1918","ENG_062_MZB_LO_1918-07.10.2008","07.10.2008",2008,10,7,1.12942651,2
"ENG_062_MZB_LO_1918","ENG_062_MZB_LO_1918-20.10.2009","20.10.2009",2009,10,20,1.10235002,1
"ENG_062_MZB_LO_1918","ENG_062_MZB_LO_1918-08.10.2010","08.10.2010",2010,10,8,1.024441954,3
"ENG_062_MZB_LO_1918","ENG_062_MZB_LO_1918-30.09.2011","30.09.2011",2011,9,30,1.080018698,2
"ENG_062_MZB_LO_1918","ENG_062_MZB_LO_1918-11.10.2012","11.10.2012",2012,10,11,1.051156921,3
"ENG_062_MZB_LO_1918","ENG_062_MZB_LO_1918-24.10.2013","24.10.2013",2013,10,24,1.125831049,1
"ENG_062_MZB_LO_1918","ENG_062_MZB_LO_1918-07.10.2014","07.10.2014",2014,10,7,1.179349692,1
"ENG_062_MZB_LO_1918","ENG_062_MZB_LO_1918-07.10.2015","07.10.2015",2015,10,7,1.00708755,3
"ENG_062_MZB_LO_1918","ENG_062_MZB_LO_1918-05.09.2016","05.09.2016",2016,9,5,1.098440716,1
"ENG_062_MZB_LO_1918","ENG_062_MZB_LO_1918-12.10.2017","12.10.2017",2017,10,12,1.071989639,1
"ENG_062_MZB_LO_1918","ENG_062_MZB_LO_1918-06.11.2018","06.11.2018",2018,11,6,0.950460247,2
"ENG_062_MZB_LO_1918","ENG_062_MZB_LO_1918-22.11.2019","22.11.2019",2019,11,22,1.065598971,1
"ENG_062_MZB_LO_1919","ENG_062_MZB_LO_1919-08.10.2002","08.10.2002",2002,10,8,0.792126232,3
"ENG_062_MZB_LO_1919","ENG_062_MZB_LO_1919-18.10.2005","18.10.2005",2005,10,18,0.76156603,3
"ENG_062_MZB_LO_1919","ENG_062_MZB_LO_1919-20.10.2006","20.10.2006",2006,10,20,0.750351262,3
"ENG_062_MZB_LO_1919","ENG_062_MZB_LO_1919-12.10.2007","12.10.2007",2007,10,12,0.833118094,3
"ENG_062_MZB_LO_1919","ENG_062_MZB_LO_1919-01.10.2008","01.10.2008",2008,10,1,0.800028011,3
"ENG_062_MZB_LO_1919","ENG_062_MZB_LO_1919-02.09.2009","02.09.2009",2009,9,2,0.838604611,3
"ENG_062_MZB_LO_1919","ENG_062_MZB_LO_1919-15.09.2010","15.09.2010",2010,9,15,0.780987858,3
"ENG_062_MZB_LO_1919","ENG_062_MZB_LO_1919-20.09.2011","20.09.2011",2011,9,20,0.791138383,3
"ENG_062_MZB_LO_1919","ENG_062_MZB_LO_1919-01.09.2014","01.09.2014",2014,9,1,0.775248259,3
"ENG_062_MZB_LO_1920","ENG_062_MZB_LO_1920-18.09.2002","18.09.2002",2002,9,18,0.820535359,3
"ENG_062_MZB_LO_1920","ENG_062_MZB_LO_1920-21.09.2005","21.09.2005",2005,9,21,0.702889162,4
"ENG_062_MZB_LO_1920","ENG_062_MZB_LO_1920-10.11.2011","10.11.2011",2011,11,10,0.813263505,3
"ENG_062_MZB_LO_1920","ENG_062_MZB_LO_1920-30.10.2012","30.10.2012",2012,10,30,0.895584814,2
"ENG_062_MZB_LO_1920","ENG_062_MZB_LO_1920-11.09.2014","11.09.2014",2014,9,11,1.127199245,2
"ENG_062_MZB_LO_1920","ENG_062_MZB_LO_1920-10.09.2021","10.09.2021",2021,9,10,0.837837863,3
"ENG_062_MZB_LO_1920","ENG_062_MZB_LO_1920-28.09.2022","28.09.2022",2022,9,28,0.83391178,3
"ENG_062_MZB_LO_1927","ENG_062_MZB_LO_1927-13.09.2002","13.09.2002",2002,9,13,1.126530012,2
"ENG_062_MZB_LO_1927","ENG_062_MZB_LO_1927-16.09.2003","16.09.2003",2003,9,16,1.125900752,1
"ENG_062_MZB_LO_1927","ENG_062_MZB_LO_1927-20.09.2006","20.09.2006",2006,9,20,1.105233873,1
"ENG_062_MZB_LO_1927","ENG_062_MZB_LO_1927-26.09.2007","26.09.2007",2007,9,26,1.072948894,1
"ENG_062_MZB_LO_1927","ENG_062_MZB_LO_1927-14.10.2008","14.10.2008",2008,10,14,1.08252939,1
"ENG_062_MZB_LO_1927","ENG_062_MZB_LO_1927-12.10.2009","12.10.2009",2009,10,12,1.14993107,1
"ENG_062_MZB_LO_1927","ENG_062_MZB_LO_1927-09.09.2010","09.09.2010",2010,9,9,1.05725796,1
"ENG_062_MZB_LO_1927","ENG_062_MZB_LO_1927-23.09.2011","23.09.2011",2011,9,23,0.985444609,2
"ENG_062_MZB_LO_1927","ENG_062_MZB_LO_1927-14.11.2012","14.11.2012",2012,11,14,1.11476266,1
"ENG_062_MZB_LO_1927","ENG_062_MZB_LO_1927-19.09.2013","19.09.2013",2013,9,19,1.068628246,1
"ENG_062_MZB_LO_1927","ENG_062_MZB_LO_1927-04.09.2014","04.09.2014",2014,9,4,1.109267275,1
"ENG_062_MZB_LO_1927","ENG_062_MZB_LO_1927-03.11.2015","03.11.2015",2015,11,3,1.057319741,1
"ENG_062_MZB_LO_1927","ENG_062_MZB_LO_1927-23.09.2016","23.09.2016",2016,9,23,1.000622435,2
"ENG_062_MZB_LO_1927","ENG_062_MZB_LO_1927-08.09.2017","08.09.2017",2017,9,8,1.018151154,1
"ENG_062_MZB_LO_1927","ENG_062_MZB_LO_1927-11.10.2018","11.10.2018",2018,10,11,1.080053744,1
"ENG_062_MZB_LO_1927","ENG_062_MZB_LO_1927-31.10.2019","31.10.2019",2019,10,31,0.969386304,2
"ENG_062_MZB_LO_1927","ENG_062_MZB_LO_1927-16.09.2020","16.09.2020",2020,9,16,0.956992302,2
"ENG_062_MZB_LO_1927","ENG_062_MZB_LO_1927-12.10.2021","12.10.2021",2021,10,12,1.07134623,1
"ENG_062_MZB_LO_1927","ENG_062_MZB_LO_1927-09.09.2022","09.09.2022",2022,9,9,1.057548504,1
"ENG_062_MZB_LO_1927","ENG_062_MZB_LO_1927-15.09.2023","15.09.2023",2023,9,15,1.079529192,1
"ENG_062_MZB_LO_1929","ENG_062_MZB_LO_1929-16.11.2012","16.11.2012",2012,11,16,1.019151238,1
"ENG_062_MZB_LO_1929","ENG_062_MZB_LO_1929-01.10.2013","01.10.2013",2013,10,1,0.913933593,2
"ENG_062_MZB_LO_1929","ENG_062_MZB_LO_1929-24.09.2014","24.09.2014",2014,9,24,0.889140152,2
"ENG_062_MZB_LO_1929","ENG_062_MZB_LO_1929-23.11.2015","23.11.2015",2015,11,23,0.72991625,3
"ENG_062_MZB_LO_1929","ENG_062_MZB_LO_1929-20.10.2016","20.10.2016",2016,10,20,0.987308993,1
"ENG_062_MZB_LO_1929","ENG_062_MZB_LO_1929-11.10.2017","11.10.2017",2017,10,11,0.98720133,1
"ENG_062_MZB_LO_1929","ENG_062_MZB_LO_1929-30.10.2018","30.10.2018",2018,10,30,1.008060469,1
"ENG_062_MZB_LO_1929","ENG_062_MZB_LO_1929-22.11.2019","22.11.2019",2019,11,22,1.031691009,1
"ENG_062_MZB_LO_1929","ENG_062_MZB_LO_1929-16.09.2020","16.09.2020",2020,9,16,1.036922198,1
"ENG_062_MZB_LO_1929","ENG_062_MZB_LO_1929-09.09.2021","09.09.2021",2021,9,9,0.926962256,2
"ENG_062_MZB_LO_1929","ENG_062_MZB_LO_1929-09.10.2023","09.10.2023",2023,10,9,0.988710431,1
"ENG_062_MZB_LO_1933","ENG_062_MZB_LO_1933-02.10.2002","02.10.2002",2002,10,2,0.941268999,2
"ENG_062_MZB_LO_1933","ENG_062_MZB_LO_1933-19.10.2004","19.10.2004",2004,10,19,0.807250656,3
"ENG_062_MZB_LO_1933","ENG_062_MZB_LO_1933-25.10.2007","25.10.2007",2007,10,25,0.943478551,2
"ENG_062_MZB_LO_1933","ENG_062_MZB_LO_1933-05.10.2010","05.10.2010",2010,10,5,0.92821683,2
"ENG_062_MZB_LO_1933","ENG_062_MZB_LO_1933-02.10.2013","02.10.2013",2013,10,2,0.836048795,3
"ENG_062_MZB_LO_1933","ENG_062_MZB_LO_1933-13.10.2015","13.10.2015",2015,10,13,0.866250221,2
"ENG_062_MZB_LO_1933","ENG_062_MZB_LO_1933-24.10.2016","24.10.2016",2016,10,24,0.908717274,2
"ENG_062_MZB_LO_1933","ENG_062_MZB_LO_1933-24.09.2018","24.09.2018",2018,9,24,0.842428583,3
"ENG_062_MZB_LO_1933","ENG_062_MZB_LO_1933-15.10.2019","15.10.2019",2019,10,15,0.920134111,2
"ENG_062_MZB_LO_1937","ENG_062_MZB_LO_1937-21.10.2002","21.10.2002",2002,10,21,0.706489009,5
"ENG_062_MZB_LO_1937","ENG_062_MZB_LO_1937-02.11.2004","02.11.2004",2004,11,2,0.678726394,4
"ENG_062_MZB_LO_1937","ENG_062_MZB_LO_1937-18.10.2005","18.10.2005",2005,10,18,0.681345365,4
"ENG_062_MZB_LO_1937","ENG_062_MZB_LO_1937-23.10.2007","23.10.2007",2007,10,23,0.662089406,4
"ENG_062_MZB_LO_1937","ENG_062_MZB_LO_1937-21.11.2008","21.11.2008",2008,11,21,0.77553177,3
"ENG_062_MZB_LO_1937","ENG_062_MZB_LO_1937-15.10.2013","15.10.2013",2013,10,15,0.676857615,5
"ENG_062_MZB_LO_1937","ENG_062_MZB_LO_1937-10.10.2016","10.10.2016",2016,10,10,0.67147625,4
"ENG_062_MZB_LO_1937","ENG_062_MZB_LO_1937-08.10.2024","08.10.2024",2024,10,8,0.678443252,4
"ENG_062_MZB_LO_1938","ENG_062_MZB_LO_1938-19.09.2003","19.09.2003",2003,9,19,1.169537946,1
"ENG_062_MZB_LO_1938","ENG_062_MZB_LO_1938-07.09.2006","07.09.2006",2006,9,7,1.052942278,1
"ENG_062_MZB_LO_1938","ENG_062_MZB_LO_1938-26.09.2007","26.09.2007",2007,9,26,1.110322128,1
"ENG_062_MZB_LO_1938","ENG_062_MZB_LO_1938-05.11.2008","05.11.2008",2008,11,5,1.160981545,1
"ENG_062_MZB_LO_1938","ENG_062_MZB_LO_1938-22.09.2009","22.09.2009",2009,9,22,1.142507521,1
"ENG_062_MZB_LO_1938","ENG_062_MZB_LO_1938-23.11.2010","23.11.2010",2010,11,23,1.131749704,1
"ENG_062_MZB_LO_1938","ENG_062_MZB_LO_1938-20.09.2011","20.09.2011",2011,9,20,0.996520928,2
"ENG_062_MZB_LO_1938","ENG_062_MZB_LO_1938-31.10.2012","31.10.2012",2012,10,31,1.044357359,1
"ENG_062_MZB_LO_1938","ENG_062_MZB_LO_1938-20.11.2013","20.11.2013",2013,11,20,1.136763175,1
"ENG_062_MZB_LO_1938","ENG_062_MZB_LO_1938-13.11.2014","13.11.2014",2014,11,13,0.843340103,3
"ENG_062_MZB_LO_1938","ENG_062_MZB_LO_1938-29.10.2015","29.10.2015",2015,10,29,1.172722689,1
"ENG_062_MZB_LO_1938","ENG_062_MZB_LO_1938-22.09.2016","22.09.2016",2016,9,22,1.116326924,1
"ENG_062_MZB_LO_1938","ENG_062_MZB_LO_1938-08.11.2017","08.11.2017",2017,11,8,1.075832097,1
"ENG_062_MZB_LO_1938","ENG_062_MZB_LO_1938-25.10.2018","25.10.2018",2018,10,25,1.109812045,1
"ENG_062_MZB_LO_1939","ENG_062_MZB_LO_1939-10.11.2004","10.11.2004",2004,11,10,0.917784224,2
"ENG_062_MZB_LO_1939","ENG_062_MZB_LO_1939-13.09.2006","13.09.2006",2006,9,13,0.861004173,3
"ENG_062_MZB_LO_1939","ENG_062_MZB_LO_1939-30.10.2007","30.10.2007",2007,10,30,0.936011985,2
"ENG_062_MZB_LO_1939","ENG_062_MZB_LO_1939-18.09.2008","18.09.2008",2008,9,18,0.753482113,3
"ENG_062_MZB_LO_1939","ENG_062_MZB_LO_1939-21.09.2009","21.09.2009",2009,9,21,0.952059327,2
"ENG_062_MZB_LO_1939","ENG_062_MZB_LO_1939-28.09.2010","28.09.2010",2010,9,28,0.941187944,2
"ENG_062_MZB_LO_1939","ENG_062_MZB_LO_1939-12.10.2011","12.10.2011",2011,10,12,0.916011925,2
"ENG_062_MZB_LO_1939","ENG_062_MZB_LO_1939-10.09.2012","10.09.2012",2012,9,10,0.983209672,1
"ENG_062_MZB_LO_1939","ENG_062_MZB_LO_1939-05.09.2013","05.09.2013",2013,9,5,0.789184383,5
"ENG_062_MZB_LO_1939","ENG_062_MZB_LO_1939-03.09.2014","03.09.2014",2014,9,3,0.950142323,2
"ENG_062_MZB_LO_1939","ENG_062_MZB_LO_1939-08.09.2015","08.09.2015",2015,9,8,0.927632372,2
"ENG_062_MZB_LO_1939","ENG_062_MZB_LO_1939-02.09.2016","02.09.2016",2016,9,2,0.984314639,2
"ENG_062_MZB_LO_1939","ENG_062_MZB_LO_1939-09.10.2017","09.10.2017",2017,10,9,1.01444345,1
"ENG_062_MZB_LO_1939","ENG_062_MZB_LO_1939-01.10.2018","01.10.2018",2018,10,1,0.909877377,2
"ENG_062_MZB_LO_1939","ENG_062_MZB_LO_1939-08.10.2019","08.10.2019",2019,10,8,0.98817194,1
"ENG_062_MZB_LO_1939","ENG_062_MZB_LO_1939-24.09.2020","24.09.2020",2020,9,24,0.995785491,1
"ENG_062_MZB_LO_1939","ENG_062_MZB_LO_1939-01.09.2021","01.09.2021",2021,9,1,0.868906559,3
"ENG_062_MZB_LO_1941","ENG_062_MZB_LO_1941-21.10.2002","21.10.2002",2002,10,21,0.832829169,3
"ENG_062_MZB_LO_1941","ENG_062_MZB_LO_1941-02.11.2004","02.11.2004",2004,11,2,0.860911757,3
"ENG_062_MZB_LO_1941","ENG_062_MZB_LO_1941-05.11.2005","05.11.2005",2005,11,5,0.894962998,3
"ENG_062_MZB_LO_1941","ENG_062_MZB_LO_1941-21.11.2008","21.11.2008",2008,11,21,0.831235079,3
"ENG_062_MZB_LO_1941","ENG_062_MZB_LO_1941-10.10.2013","10.10.2013",2013,10,10,0.887336941,3
"ENG_062_MZB_LO_1941","ENG_062_MZB_LO_1941-02.11.2015","02.11.2015",2015,11,2,0.996379831,1
"ENG_062_MZB_LO_1941","ENG_062_MZB_LO_1941-30.10.2018","30.10.2018",2018,10,30,0.942447362,2
"ENG_062_MZB_LO_1946","ENG_062_MZB_LO_1946-17.09.2002","17.09.2002",2002,9,17,0.505441405,5
"ENG_062_MZB_LO_1946","ENG_062_MZB_LO_1946-30.10.2003","30.10.2003",2003,10,30,0.638717006,4
"ENG_062_MZB_LO_1946","ENG_062_MZB_LO_1946-27.10.2004","27.10.2004",2004,10,27,0.593266333,4
"ENG_062_MZB_LO_1946","ENG_062_MZB_LO_1946-19.10.2006","19.10.2006",2006,10,19,0.587370452,5
"ENG_062_MZB_LO_1946","ENG_062_MZB_LO_1946-22.10.2009","22.10.2009",2009,10,22,0.525479501,5
"ENG_062_MZB_LO_1946","ENG_062_MZB_LO_1946-24.10.2013","24.10.2013",2013,10,24,0.583938435,5
"ENG_062_MZB_LO_1946","ENG_062_MZB_LO_1946-12.11.2014","12.11.2014",2014,11,12,0.568946792,5
"ENG_062_MZB_LO_1948","ENG_062_MZB_LO_1948-01.10.2002","01.10.2002",2002,10,1,1.059607901,1
"ENG_062_MZB_LO_1948","ENG_062_MZB_LO_1948-19.09.2005","19.09.2005",2005,9,19,1.052061465,1
"ENG_062_MZB_LO_1948","ENG_062_MZB_LO_1948-29.09.2006","29.09.2006",2006,9,29,1.010887697,1
"ENG_062_MZB_LO_1948","ENG_062_MZB_LO_1948-22.10.2009","22.10.2009",2009,10,22,0.986274189,1
"ENG_062_MZB_LO_1948","ENG_062_MZB_LO_1948-24.10.2011","24.10.2011",2011,10,24,0.928806573,2
"ENG_062_MZB_LO_1948","ENG_062_MZB_LO_1948-29.11.2013","29.11.2013",2013,11,29,1.008987805,1
"ENG_062_MZB_LO_1948","ENG_062_MZB_LO_1948-03.09.2014","03.09.2014",2014,9,3,1.020396127,1
"ENG_062_MZB_LO_1948","ENG_062_MZB_LO_1948-08.09.2015","08.09.2015",2015,9,8,1.068005063,1
"ENG_062_MZB_LO_1948","ENG_062_MZB_LO_1948-22.09.2016","22.09.2016",2016,9,22,1.060746671,1
"ENG_062_MZB_LO_1948","ENG_062_MZB_LO_1948-05.09.2017","05.09.2017",2017,9,5,1.04865218,1
"ENG_062_MZB_LO_1948","ENG_062_MZB_LO_1948-04.09.2018","04.09.2018",2018,9,4,1.074854858,1
"ENG_062_MZB_LO_1948","ENG_062_MZB_LO_1948-10.09.2019","10.09.2019",2019,9,10,1.039760136,2
"ENG_062_MZB_LO_1948","ENG_062_MZB_LO_1948-16.09.2020","16.09.2020",2020,9,16,0.973367281,2
"ENG_062_MZB_LO_1948","ENG_062_MZB_LO_1948-03.09.2021","03.09.2021",2021,9,3,1.1244308,1
"ENG_062_MZB_LO_1948","ENG_062_MZB_LO_1948-02.09.2022","02.09.2022",2022,9,2,1.038853662,1
"ENG_062_MZB_LO_1951","ENG_062_MZB_LO_1951-13.11.2012","13.11.2012",2012,11,13,1.019918617,1
"ENG_062_MZB_LO_1951","ENG_062_MZB_LO_1951-17.10.2013","17.10.2013",2013,10,17,1.019622842,1
"ENG_062_MZB_LO_1951","ENG_062_MZB_LO_1951-18.09.2014","18.09.2014",2014,9,18,0.954836301,2
"ENG_062_MZB_LO_1951","ENG_062_MZB_LO_1951-02.09.2015","02.09.2015",2015,9,2,0.963627305,2
"ENG_062_MZB_LO_1951","ENG_062_MZB_LO_1951-27.09.2016","27.09.2016",2016,9,27,0.937500514,2
"ENG_062_MZB_LO_1951","ENG_062_MZB_LO_1951-06.11.2017","06.11.2017",2017,11,6,0.932307185,2
"ENG_062_MZB_LO_1951","ENG_062_MZB_LO_1951-11.09.2018","11.09.2018",2018,9,11,0.9555636,2
"ENG_062_MZB_LO_1951","ENG_062_MZB_LO_1951-05.11.2019","05.11.2019",2019,11,5,0.926436283,2
"ENG_062_MZB_LO_1951","ENG_062_MZB_LO_1951-19.10.2020","19.10.2020",2020,10,19,1.066533128,1
"ENG_062_MZB_LO_1951","ENG_062_MZB_LO_1951-08.09.2021","08.09.2021",2021,9,8,0.945443309,2
"ENG_062_MZB_LO_1951","ENG_062_MZB_LO_1951-29.11.2022","29.11.2022",2022,11,29,1.089567081,1
"ENG_062_MZB_LO_1951","ENG_062_MZB_LO_1951-25.10.2023","25.10.2023",2023,10,25,1.015291083,1
"ENG_062_MZB_LO_1951","ENG_062_MZB_LO_1951-30.10.2024","30.10.2024",2024,10,30,1.102399052,1
"ENG_062_MZB_LO_1953","ENG_062_MZB_LO_1953-26.09.2007","26.09.2007",2007,9,26,0.950251615,2
"ENG_062_MZB_LO_1953","ENG_062_MZB_LO_1953-21.11.2008","21.11.2008",2008,11,21,0.99428344,1
"ENG_062_MZB_LO_1953","ENG_062_MZB_LO_1953-03.11.2009","03.11.2009",2009,11,3,0.910352449,2
"ENG_062_MZB_LO_1953","ENG_062_MZB_LO_1953-12.10.2010","12.10.2010",2010,10,12,1.006640605,2
"ENG_062_MZB_LO_1953","ENG_062_MZB_LO_1953-09.09.2011","09.09.2011",2011,9,9,0.924287863,2
"ENG_062_MZB_LO_1953","ENG_062_MZB_LO_1953-15.11.2012","15.11.2012",2012,11,15,0.972069949,2
"ENG_062_MZB_LO_1953","ENG_062_MZB_LO_1953-29.10.2013","29.10.2013",2013,10,29,0.907782602,5
"ENG_062_MZB_LO_1953","ENG_062_MZB_LO_1953-10.09.2014","10.09.2014",2014,9,10,0.960380658,2
"ENG_062_MZB_LO_1953","ENG_062_MZB_LO_1953-03.11.2015","03.11.2015",2015,11,3,1.001320848,2
"ENG_062_MZB_LO_1953","ENG_062_MZB_LO_1953-03.10.2016","03.10.2016",2016,10,3,0.972356507,1
"ENG_062_MZB_LO_1953","ENG_062_MZB_LO_1953-26.10.2017","26.10.2017",2017,10,26,0.973712474,2
"ENG_062_MZB_LO_1953","ENG_062_MZB_LO_1953-25.10.2018","25.10.2018",2018,10,25,1.006067637,1
"ENG_062_MZB_LO_1953","ENG_062_MZB_LO_1953-31.10.2019","31.10.2019",2019,10,31,1.025580185,1
"ENG_062_MZB_LO_1953","ENG_062_MZB_LO_1953-23.09.2020","23.09.2020",2020,9,23,1.001022788,1
"ENG_062_MZB_LO_1953","ENG_062_MZB_LO_1953-15.10.2021","15.10.2021",2021,10,15,0.965021957,2
"ENG_062_MZB_LO_1954","ENG_062_MZB_LO_1954-30.11.2002","30.11.2002",2002,11,30,0.847424005,3
"ENG_062_MZB_LO_1954","ENG_062_MZB_LO_1954-25.11.2003","25.11.2003",2003,11,25,0.859786577,3
"ENG_062_MZB_LO_1954","ENG_062_MZB_LO_1954-01.10.2004","01.10.2004",2004,10,1,0.72480836,3
"ENG_062_MZB_LO_1954","ENG_062_MZB_LO_1954-13.10.2005","13.10.2005",2005,10,13,0.863778257,2
"ENG_062_MZB_LO_1954","ENG_062_MZB_LO_1954-21.11.2006","21.11.2006",2006,11,21,0.786948645,3
"ENG_062_MZB_LO_1954","ENG_062_MZB_LO_1954-18.10.2007","18.10.2007",2007,10,18,0.789805626,3
"ENG_062_MZB_LO_1954","ENG_062_MZB_LO_1954-17.09.2008","17.09.2008",2008,9,17,0.842131242,3
"ENG_062_MZB_LO_1954","ENG_062_MZB_LO_1954-13.10.2009","13.10.2009",2009,10,13,0.731705678,3
"ENG_062_MZB_LO_1954","ENG_062_MZB_LO_1954-07.10.2010","07.10.2010",2010,10,7,0.700078929,4
"ENG_062_MZB_LO_1954","ENG_062_MZB_LO_1954-18.09.2015","18.09.2015",2015,9,18,0.695052014,4
"ENG_062_MZB_LO_1954","ENG_062_MZB_LO_1954-30.10.2018","30.10.2018",2018,10,30,0.753403465,3
"ENG_062_MZB_LO_1954","ENG_062_MZB_LO_1954-28.10.2019","28.10.2019",2019,10,28,0.78670633,3
"ENG_062_MZB_LO_1954","ENG_062_MZB_LO_1954-30.10.2020","30.10.2020",2020,10,30,0.84596098,3
"ENG_062_MZB_LO_1954","ENG_062_MZB_LO_1954-28.10.2021","28.10.2021",2021,10,28,0.8336522,3
"ENG_062_MZB_LO_1954","ENG_062_MZB_LO_1954-27.09.2022","27.09.2022",2022,9,27,0.804666145,3
"ENG_062_MZB_LO_1955","ENG_062_MZB_LO_1955-31.10.2002","31.10.2002",2002,10,31,0.986222083,3
"ENG_062_MZB_LO_1955","ENG_062_MZB_LO_1955-03.11.2005","03.11.2005",2005,11,3,0.971407409,3
"ENG_062_MZB_LO_1955","ENG_062_MZB_LO_1955-13.11.2008","13.11.2008",2008,11,13,0.925940354,3
"ENG_062_MZB_LO_1955","ENG_062_MZB_LO_1955-15.09.2011","15.09.2011",2011,9,15,0.867136887,3
"ENG_062_MZB_LO_1955","ENG_062_MZB_LO_1955-06.09.2012","06.09.2012",2012,9,6,0.94883821,3
"ENG_062_MZB_LO_1955","ENG_062_MZB_LO_1955-09.09.2013","09.09.2013",2013,9,9,0.93519422,2
"ENG_062_MZB_LO_1955","ENG_062_MZB_LO_1955-13.11.2014","13.11.2014",2014,11,13,0.984594541,3
"ENG_062_MZB_LO_1955","ENG_062_MZB_LO_1955-20.10.2015","20.10.2015",2015,10,20,0.861656655,4
"ENG_062_MZB_LO_1955","ENG_062_MZB_LO_1955-08.11.2016","08.11.2016",2016,11,8,0.931745866,3
"ENG_062_MZB_LO_1955","ENG_062_MZB_LO_1955-07.11.2017","07.11.2017",2017,11,7,0.920151005,5
"ENG_062_MZB_LO_1955","ENG_062_MZB_LO_1955-15.11.2018","15.11.2018",2018,11,15,0.906671314,3
"ENG_062_MZB_LO_1955","ENG_062_MZB_LO_1955-29.10.2020","29.10.2020",2020,10,29,0.97700209,3
"ENG_062_MZB_LO_1956","ENG_062_MZB_LO_1956-18.09.2002","18.09.2002",2002,9,18,0.884273631,2
"ENG_062_MZB_LO_1956","ENG_062_MZB_LO_1956-07.10.2003","07.10.2003",2003,10,7,0.855309275,3
"ENG_062_MZB_LO_1956","ENG_062_MZB_LO_1956-23.09.2004","23.09.2004",2004,9,23,0.873451672,2
"ENG_062_MZB_LO_1956","ENG_062_MZB_LO_1956-14.09.2005","14.09.2005",2005,9,14,0.87328806,2
"ENG_062_MZB_LO_1956","ENG_062_MZB_LO_1956-05.10.2007","05.10.2007",2007,10,5,0.90009275,2
"ENG_062_MZB_LO_1956","ENG_062_MZB_LO_1956-03.09.2008","03.09.2008",2008,9,3,0.994944623,1
"ENG_062_MZB_LO_1956","ENG_062_MZB_LO_1956-05.10.2009","05.10.2009",2009,10,5,0.987572542,1
"ENG_062_MZB_LO_1956","ENG_062_MZB_LO_1956-17.09.2010","17.09.2010",2010,9,17,0.957074511,2
"ENG_062_MZB_LO_1956","ENG_062_MZB_LO_1956-11.11.2011","11.11.2011",2011,11,11,0.938089854,2
"ENG_062_MZB_LO_1956","ENG_062_MZB_LO_1956-15.11.2012","15.11.2012",2012,11,15,1.005575548,1
"ENG_062_MZB_LO_1956","ENG_062_MZB_LO_1956-19.11.2013","19.11.2013",2013,11,19,1.005166562,1
"ENG_062_MZB_LO_1956","ENG_062_MZB_LO_1956-29.09.2014","29.09.2014",2014,9,29,0.994502951,1
"ENG_062_MZB_LO_1956","ENG_062_MZB_LO_1956-14.10.2021","14.10.2021",2021,10,14,0.958028258,2
"ENG_062_MZB_LO_1956","ENG_062_MZB_LO_1956-15.09.2022","15.09.2022",2022,9,15,0.947698624,2
"ENG_062_MZB_LO_1957","ENG_062_MZB_LO_1957-04.11.2004","04.11.2004",2004,11,4,0.882397121,2
"ENG_062_MZB_LO_1957","ENG_062_MZB_LO_1957-02.11.2007","02.11.2007",2007,11,2,0.963596734,1
"ENG_062_MZB_LO_1957","ENG_062_MZB_LO_1957-04.09.2008","04.09.2008",2008,9,4,0.928193626,2
"ENG_062_MZB_LO_1957","ENG_062_MZB_LO_1957-22.10.2009","22.10.2009",2009,10,22,0.976442856,1
"ENG_062_MZB_LO_1957","ENG_062_MZB_LO_1957-05.10.2010","05.10.2010",2010,10,5,0.939869106,2
"ENG_062_MZB_LO_1957","ENG_062_MZB_LO_1957-16.10.2012","16.10.2012",2012,10,16,0.985737875,1
"ENG_062_MZB_LO_1957","ENG_062_MZB_LO_1957-10.10.2013","10.10.2013",2013,10,10,0.890079347,2
"ENG_062_MZB_LO_1957","ENG_062_MZB_LO_1957-15.09.2014","15.09.2014",2014,9,15,1.077380436,1
"ENG_062_MZB_LO_1957","ENG_062_MZB_LO_1957-02.11.2015","02.11.2015",2015,11,2,0.887788006,2
"ENG_062_MZB_LO_1957","ENG_062_MZB_LO_1957-14.10.2016","14.10.2016",2016,10,14,0.899508364,2
"ENG_062_MZB_LO_1957","ENG_062_MZB_LO_1957-16.10.2017","16.10.2017",2017,10,16,0.963709109,1
"ENG_062_MZB_LO_1957","ENG_062_MZB_LO_1957-30.10.2018","30.10.2018",2018,10,30,0.869202878,2
"ENG_062_MZB_LO_1957","ENG_062_MZB_LO_1957-22.10.2019","22.10.2019",2019,10,22,0.86321287,3
"ENG_062_MZB_LO_1957","ENG_062_MZB_LO_1957-19.10.2020","19.10.2020",2020,10,19,0.916608852,2
"ENG_062_MZB_LO_1957","ENG_062_MZB_LO_1957-27.10.2021","27.10.2021",2021,10,27,0.885878176,3
"ENG_062_MZB_LO_1957","ENG_062_MZB_LO_1957-26.09.2022","26.09.2022",2022,9,26,0.94089529,2
"ENG_062_MZB_LO_1957","ENG_062_MZB_LO_1957-29.09.2023","29.09.2023",2023,9,29,0.972868427,1
"ENG_062_MZB_LO_1959","ENG_062_MZB_LO_1959-30.11.2003","30.11.2003",2003,11,30,0.909271529,2
"ENG_062_MZB_LO_1959","ENG_062_MZB_LO_1959-01.10.2004","01.10.2004",2004,10,1,0.958579551,2
"ENG_062_MZB_LO_1959","ENG_062_MZB_LO_1959-13.10.2005","13.10.2005",2005,10,13,0.93696517,2
"ENG_062_MZB_LO_1959","ENG_062_MZB_LO_1959-21.11.2006","21.11.2006",2006,11,21,0.924459792,2
"ENG_062_MZB_LO_1959","ENG_062_MZB_LO_1959-18.10.2007","18.10.2007",2007,10,18,0.819614057,3
"ENG_062_MZB_LO_1959","ENG_062_MZB_LO_1959-17.09.2008","17.09.2008",2008,9,17,0.924204075,2
"ENG_062_MZB_LO_1959","ENG_062_MZB_LO_1959-13.10.2009","13.10.2009",2009,10,13,0.950278169,2
"ENG_062_MZB_LO_1959","ENG_062_MZB_LO_1959-07.10.2010","07.10.2010",2010,10,7,0.835582215,3
"ENG_062_MZB_LO_1959","ENG_062_MZB_LO_1959-19.09.2011","19.09.2011",2011,9,19,1.000419463,1
"ENG_062_MZB_LO_1959","ENG_062_MZB_LO_1959-03.09.2012","03.09.2012",2012,9,3,0.944190955,2
"ENG_062_MZB_LO_1959","ENG_062_MZB_LO_1959-23.10.2013","23.10.2013",2013,10,23,1.031946526,1
"ENG_062_MZB_LO_1959","ENG_062_MZB_LO_1959-26.09.2014","26.09.2014",2014,9,26,1.083273806,3
"ENG_062_MZB_LO_1959","ENG_062_MZB_LO_1959-22.10.2015","22.10.2015",2015,10,22,1.041030916,1
"ENG_062_MZB_LO_1959","ENG_062_MZB_LO_1959-18.10.2016","18.10.2016",2016,10,18,1.097874984,1
"ENG_062_MZB_LO_1959","ENG_062_MZB_LO_1959-23.10.2017","23.10.2017",2017,10,23,1.055218788,1
"ENG_062_MZB_LO_1959","ENG_062_MZB_LO_1959-19.09.2018","19.09.2018",2018,9,19,1.235467138,1
"ENG_062_MZB_LO_1959","ENG_062_MZB_LO_1959-28.10.2019","28.10.2019",2019,10,28,1.134123608,1
"ENG_062_MZB_LO_1959","ENG_062_MZB_LO_1959-08.09.2020","08.09.2020",2020,9,8,1.094094902,1
"ENG_062_MZB_LO_1959","ENG_062_MZB_LO_1959-28.10.2021","28.10.2021",2021,10,28,1.20542477,1
"ENG_062_MZB_LO_1959","ENG_062_MZB_LO_1959-21.09.2022","21.09.2022",2022,9,21,1.228360325,1
"ENG_062_MZB_LO_1959","ENG_062_MZB_LO_1959-05.10.2023","05.10.2023",2023,10,5,1.146120293,1
"ENG_062_MZB_LO_1959","ENG_062_MZB_LO_1959-25.09.2024","25.09.2024",2024,9,25,1.192928105,1
"ENG_062_MZB_LO_1960","ENG_062_MZB_LO_1960-04.09.2002","04.09.2002",2002,9,4,0.894386428,2
"ENG_062_MZB_LO_1960","ENG_062_MZB_LO_1960-29.10.2003","29.10.2003",2003,10,29,0.905978339,2
"ENG_062_MZB_LO_1960","ENG_062_MZB_LO_1960-20.10.2006","20.10.2006",2006,10,20,0.896346472,2
"ENG_062_MZB_LO_1960","ENG_062_MZB_LO_1960-21.11.2008","21.11.2008",2008,11,21,0.911051393,2
"ENG_062_MZB_LO_1960","ENG_062_MZB_LO_1960-03.11.2009","03.11.2009",2009,11,3,0.917485765,2
"ENG_062_MZB_LO_1960","ENG_062_MZB_LO_1960-12.10.2010","12.10.2010",2010,10,12,0.919104954,2
"ENG_062_MZB_LO_1960","ENG_062_MZB_LO_1960-28.09.2011","28.09.2011",2011,9,28,0.906489204,2
"ENG_062_MZB_LO_1960","ENG_062_MZB_LO_1960-15.11.2012","15.11.2012",2012,11,15,0.881297523,2
"ENG_062_MZB_LO_1960","ENG_062_MZB_LO_1960-20.11.2013","20.11.2013",2013,11,20,0.993942057,1
"ENG_062_MZB_LO_1960","ENG_062_MZB_LO_1960-30.09.2014","30.09.2014",2014,9,30,0.915909952,2
"ENG_062_MZB_LO_1960","ENG_062_MZB_LO_1960-15.09.2015","15.09.2015",2015,9,15,0.915165637,2
"ENG_062_MZB_LO_1960","ENG_062_MZB_LO_1960-03.10.2016","03.10.2016",2016,10,3,0.843446877,3
"ENG_062_MZB_LO_1960","ENG_062_MZB_LO_1960-08.11.2017","08.11.2017",2017,11,8,0.932034372,2
"ENG_062_MZB_LO_1960","ENG_062_MZB_LO_1960-09.11.2018","09.11.2018",2018,11,9,0.885685516,2
"ENG_062_MZB_LO_1960","ENG_062_MZB_LO_1960-13.11.2019","13.11.2019",2019,11,13,0.954802055,2
"ENG_062_MZB_LO_1960","ENG_062_MZB_LO_1960-30.09.2020","30.09.2020",2020,9,30,0.999643908,1
"ENG_062_MZB_LO_1960","ENG_062_MZB_LO_1960-18.10.2021","18.10.2021",2021,10,18,0.983880646,1
"ENG_062_MZB_LO_1961","ENG_062_MZB_LO_1961-31.10.2002","31.10.2002",2002,10,31,0.460562532,5
"ENG_062_MZB_LO_1961","ENG_062_MZB_LO_1961-13.11.2003","13.11.2003",2003,11,13,0.381614869,5
"ENG_062_MZB_LO_1961","ENG_062_MZB_LO_1961-17.11.2004","17.11.2004",2004,11,17,0.480892806,5
"ENG_062_MZB_LO_1961","ENG_062_MZB_LO_1961-20.10.2006","20.10.2006",2006,10,20,0.562016081,5
"ENG_062_MZB_LO_1961","ENG_062_MZB_LO_1961-20.10.2009","20.10.2009",2009,10,20,0.733157387,5
"ENG_062_MZB_LO_1961","ENG_062_MZB_LO_1961-12.09.2011","12.09.2011",2011,9,12,0.70220132,4
"ENG_062_MZB_LO_1961","ENG_062_MZB_LO_1961-06.10.2014","06.10.2014",2014,10,6,0.635716736,4
"ENG_062_MZB_LO_1961","ENG_062_MZB_LO_1961-05.09.2023","05.09.2023",2023,9,5,0.53261438,5
"ENG_062_MZB_LO_1962","ENG_062_MZB_LO_1962-14.10.2003","14.10.2003",2003,10,14,0.948251398,2
"ENG_062_MZB_LO_1962","ENG_062_MZB_LO_1962-29.09.2006","29.09.2006",2006,9,29,0.914596758,2
"ENG_062_MZB_LO_1962","ENG_062_MZB_LO_1962-06.10.2009","06.10.2009",2009,10,6,0.990331714,1
"ENG_062_MZB_LO_1962","ENG_062_MZB_LO_1962-05.09.2011","05.09.2011",2011,9,5,0.991968377,1
"ENG_062_MZB_LO_1962","ENG_062_MZB_LO_1962-10.09.2012","10.09.2012",2012,9,10,1.006562754,1
"ENG_062_MZB_LO_1962","ENG_062_MZB_LO_1962-14.10.2013","14.10.2013",2013,10,14,1.020162565,1
"ENG_062_MZB_LO_1962","ENG_062_MZB_LO_1962-03.09.2014","03.09.2014",2014,9,3,0.966949335,2
"ENG_062_MZB_LO_1962","ENG_062_MZB_LO_1962-08.09.2015","08.09.2015",2015,9,8,0.992721431,1
"ENG_062_MZB_LO_1962","ENG_062_MZB_LO_1962-22.09.2016","22.09.2016",2016,9,22,1.013629103,1
"ENG_062_MZB_LO_1962","ENG_062_MZB_LO_1962-05.09.2017","05.09.2017",2017,9,5,0.988949453,1
"ENG_062_MZB_LO_1962","ENG_062_MZB_LO_1962-04.09.2018","04.09.2018",2018,9,4,1.036261997,1
"ENG_062_MZB_LO_1962","ENG_062_MZB_LO_1962-10.09.2019","10.09.2019",2019,9,10,1.051739401,1
"ENG_062_MZB_LO_1962","ENG_062_MZB_LO_1962-16.09.2020","16.09.2020",2020,9,16,0.924785282,2
"ENG_062_MZB_LO_1962","ENG_062_MZB_LO_1962-03.09.2021","03.09.2021",2021,9,3,0.990879676,1
"ENG_062_MZB_LO_1962","ENG_062_MZB_LO_1962-02.09.2022","02.09.2022",2022,9,2,0.974007576,1
"ENG_062_MZB_LO_1963","ENG_062_MZB_LO_1963-03.05.2002","03.05.2002",2002,5,3,0.715685388,4
"ENG_062_MZB_LO_1963","ENG_062_MZB_LO_1963-12.05.2005","12.05.2005",2005,5,12,0.634044923,4
"ENG_062_MZB_LO_1963","ENG_062_MZB_LO_1963-23.03.2006","23.03.2006",2006,3,23,0.739212427,3
"ENG_062_MZB_LO_1963","ENG_062_MZB_LO_1963-18.04.2008","18.04.2008",2008,4,18,0.695290178,4
"ENG_062_MZB_LO_1963","ENG_062_MZB_LO_1963-10.04.2012","10.04.2012",2012,4,10,0.660259901,4
"ENG_062_MZB_LO_1963","ENG_062_MZB_LO_1963-09.05.2013","09.05.2013",2013,5,9,0.668858101,4
"ENG_062_MZB_LO_1963","ENG_062_MZB_LO_1963-15.03.2016","15.03.2016",2016,3,15,0.797848167,3
"ENG_062_MZB_LO_1965","ENG_062_MZB_LO_1965-20.11.2002","20.11.2002",2002,11,20,0.885014832,2
"ENG_062_MZB_LO_1965","ENG_062_MZB_LO_1965-18.09.2003","18.09.2003",2003,9,18,1.007155037,1
"ENG_062_MZB_LO_1965","ENG_062_MZB_LO_1965-19.09.2005","19.09.2005",2005,9,19,1.014475583,3
"ENG_062_MZB_LO_1965","ENG_062_MZB_LO_1965-08.11.2006","08.11.2006",2006,11,8,0.948885244,2
"ENG_062_MZB_LO_1965","ENG_062_MZB_LO_1965-11.10.2007","11.10.2007",2007,10,11,1.052264442,1
"ENG_062_MZB_LO_1965","ENG_062_MZB_LO_1965-27.11.2008","27.11.2008",2008,11,27,1.055348427,2
"ENG_062_MZB_LO_1965","ENG_062_MZB_LO_1965-06.10.2009","06.10.2009",2009,10,6,1.006935484,2
"ENG_062_MZB_LO_1965","ENG_062_MZB_LO_1965-07.09.2010","07.09.2010",2010,9,7,0.994469005,1
"ENG_062_MZB_LO_1965","ENG_062_MZB_LO_1965-15.09.2011","15.09.2011",2011,9,15,0.967400456,2
"ENG_062_MZB_LO_1965","ENG_062_MZB_LO_1965-08.11.2012","08.11.2012",2012,11,8,0.971732222,3
"ENG_062_MZB_LO_1965","ENG_062_MZB_LO_1965-11.11.2013","11.11.2013",2013,11,11,1.048303924,1
"ENG_062_MZB_LO_1965","ENG_062_MZB_LO_1965-10.09.2014","10.09.2014",2014,9,10,1.088553638,1
"ENG_062_MZB_LO_1965","ENG_062_MZB_LO_1965-09.09.2015","09.09.2015",2015,9,9,1.026964321,1
"ENG_062_MZB_LO_1965","ENG_062_MZB_LO_1965-06.09.2016","06.09.2016",2016,9,6,1.042103185,2
"ENG_062_MZB_LO_1965","ENG_062_MZB_LO_1965-10.10.2017","10.10.2017",2017,10,10,1.036496383,1
"ENG_062_MZB_LO_1965","ENG_062_MZB_LO_1965-19.09.2018","19.09.2018",2018,9,19,0.958918608,2
"ENG_062_MZB_LO_1965","ENG_062_MZB_LO_1965-10.09.2020","10.09.2020",2020,9,10,0.956741219,2
"ENG_062_MZB_LO_1965","ENG_062_MZB_LO_1965-21.09.2021","21.09.2021",2021,9,21,0.916314304,2
"ENG_062_MZB_LO_1965","ENG_062_MZB_LO_1965-14.10.2022","14.10.2022",2022,10,14,0.967880078,2
"ENG_062_MZB_LO_1965","ENG_062_MZB_LO_1965-04.10.2023","04.10.2023",2023,10,4,0.916876143,2
"ENG_062_MZB_LO_1966","ENG_062_MZB_LO_1966-02.09.2003","02.09.2003",2003,9,2,0.952620143,2
"ENG_062_MZB_LO_1966","ENG_062_MZB_LO_1966-02.11.2004","02.11.2004",2004,11,2,0.990106647,1
"ENG_062_MZB_LO_1966","ENG_062_MZB_LO_1966-11.10.2005","11.10.2005",2005,10,11,0.942679502,2
"ENG_062_MZB_LO_1966","ENG_062_MZB_LO_1966-24.10.2006","24.10.2006",2006,10,24,0.929283285,2
"ENG_062_MZB_LO_1966","ENG_062_MZB_LO_1966-25.10.2007","25.10.2007",2007,10,25,1.009026297,1
"ENG_062_MZB_LO_1966","ENG_062_MZB_LO_1966-30.09.2010","30.09.2010",2010,9,30,0.881982251,2
"ENG_062_MZB_LO_1966","ENG_062_MZB_LO_1966-23.10.2012","23.10.2012",2012,10,23,0.924260355,2
"ENG_062_MZB_LO_1966","ENG_062_MZB_LO_1966-26.09.2013","26.09.2013",2013,9,26,0.990874015,2
"ENG_062_MZB_LO_1966","ENG_062_MZB_LO_1966-10.09.2014","10.09.2014",2014,9,10,0.924863558,2
"ENG_062_MZB_LO_1966","ENG_062_MZB_LO_1966-09.09.2015","09.09.2015",2015,9,9,0.801901276,3
"ENG_062_MZB_LO_1966","ENG_062_MZB_LO_1966-06.09.2016","06.09.2016",2016,9,6,0.908739663,2
"ENG_062_MZB_LO_1966","ENG_062_MZB_LO_1966-18.10.2017","18.10.2017",2017,10,18,0.893845255,2
"ENG_062_MZB_LO_1966","ENG_062_MZB_LO_1966-19.09.2018","19.09.2018",2018,9,19,1.0034755,1
"ENG_062_MZB_LO_1966","ENG_062_MZB_LO_1966-11.10.2019","11.10.2019",2019,10,11,0.83968576,3
"ENG_062_MZB_LO_1966","ENG_062_MZB_LO_1966-28.10.2020","28.10.2020",2020,10,28,0.999434273,1
"ENG_062_MZB_LO_1967","ENG_062_MZB_LO_1967-21.10.2002","21.10.2002",2002,10,21,0.834750628,4
"ENG_062_MZB_LO_1967","ENG_062_MZB_LO_1967-18.09.2003","18.09.2003",2003,9,18,0.869284313,2
"ENG_062_MZB_LO_1967","ENG_062_MZB_LO_1967-02.11.2004","02.11.2004",2004,11,2,0.980090755,1
"ENG_062_MZB_LO_1967","ENG_062_MZB_LO_1967-29.09.2006","29.09.2006",2006,9,29,0.886353739,2
"ENG_062_MZB_LO_1967","ENG_062_MZB_LO_1967-24.11.2008","24.11.2008",2008,11,24,0.983729709,1
"ENG_062_MZB_LO_1967","ENG_062_MZB_LO_1967-19.10.2009","19.10.2009",2009,10,19,1.023155619,1
"ENG_062_MZB_LO_1967","ENG_062_MZB_LO_1967-14.09.2010","14.09.2010",2010,9,14,0.89147299,2
"ENG_062_MZB_LO_1967","ENG_062_MZB_LO_1967-18.10.2012","18.10.2012",2012,10,18,0.945793602,2
"ENG_062_MZB_LO_1967","ENG_062_MZB_LO_1967-25.10.2013","25.10.2013",2013,10,25,0.972342371,1
"ENG_062_MZB_LO_1967","ENG_062_MZB_LO_1967-23.09.2014","23.09.2014",2014,9,23,1.003435443,1
"ENG_062_MZB_LO_1967","ENG_062_MZB_LO_1967-23.09.2015","23.09.2015",2015,9,23,0.982832576,1
"ENG_062_MZB_LO_1967","ENG_062_MZB_LO_1967-14.10.2016","14.10.2016",2016,10,14,0.97884864,1
"ENG_062_MZB_LO_1967","ENG_062_MZB_LO_1967-05.10.2017","05.10.2017",2017,10,5,1.011358016,1
"ENG_062_MZB_LO_1967","ENG_062_MZB_LO_1967-15.11.2018","15.11.2018",2018,11,15,0.983758641,1
"ENG_062_MZB_LO_1967","ENG_062_MZB_LO_1967-22.11.2019","22.11.2019",2019,11,22,0.855490739,3
"ENG_062_MZB_LO_1967","ENG_062_MZB_LO_1967-23.10.2020","23.10.2020",2020,10,23,0.954923451,2
"ENG_062_MZB_LO_1967","ENG_062_MZB_LO_1967-16.11.2022","16.11.2022",2022,11,16,0.993406543,1
"ENG_062_MZB_LO_1967","ENG_062_MZB_LO_1967-14.10.2023","14.10.2023",2023,10,14,1.0059074,1
"ENG_062_MZB_LO_1968","ENG_062_MZB_LO_1968-06.10.2003","06.10.2003",2003,10,6,1.044024145,1
"ENG_062_MZB_LO_1968","ENG_062_MZB_LO_1968-30.11.2006","30.11.2006",2006,11,30,0.995659458,1
"ENG_062_MZB_LO_1968","ENG_062_MZB_LO_1968-24.09.2007","24.09.2007",2007,9,24,1.002682306,2
"ENG_062_MZB_LO_1968","ENG_062_MZB_LO_1968-25.09.2008","25.09.2008",2008,9,25,0.999867662,1
"ENG_062_MZB_LO_1968","ENG_062_MZB_LO_1968-22.10.2009","22.10.2009",2009,10,22,1.08557964,1
"ENG_062_MZB_LO_1968","ENG_062_MZB_LO_1968-20.09.2010","20.09.2010",2010,9,20,1.014272785,1
"ENG_062_MZB_LO_1968","ENG_062_MZB_LO_1968-13.10.2015","13.10.2015",2015,10,13,1.042846193,1
"ENG_062_MZB_LO_1968","ENG_062_MZB_LO_1968-12.10.2016","12.10.2016",2016,10,12,0.97820978,1
"ENG_062_MZB_LO_1972","ENG_062_MZB_LO_1972-04.09.2002","04.09.2002",2002,9,4,0.778700908,3
"ENG_062_MZB_LO_1972","ENG_062_MZB_LO_1972-26.10.2007","26.10.2007",2007,10,26,0.893489787,2
"ENG_062_MZB_LO_1972","ENG_062_MZB_LO_1972-21.11.2008","21.11.2008",2008,11,21,0.822361833,3
"ENG_062_MZB_LO_1972","ENG_062_MZB_LO_1972-23.10.2009","23.10.2009",2009,10,23,0.862408529,2
"ENG_062_MZB_LO_1972","ENG_062_MZB_LO_1972-12.10.2010","12.10.2010",2010,10,12,0.870669266,2
"ENG_062_MZB_LO_1972","ENG_062_MZB_LO_1972-28.09.2011","28.09.2011",2011,9,28,0.884483271,2
"ENG_062_MZB_LO_1972","ENG_062_MZB_LO_1972-27.10.2017","27.10.2017",2017,10,27,0.954724831,2
"ENG_062_MZB_LO_1972","ENG_062_MZB_LO_1972-25.10.2018","25.10.2018",2018,10,25,0.854868564,3
"ENG_062_MZB_LO_1972","ENG_062_MZB_LO_1972-13.11.2019","13.11.2019",2019,11,13,0.930461361,2
"ENG_062_MZB_LO_1973","ENG_062_MZB_LO_1973-24.10.2002","24.10.2002",2002,10,24,1.037198657,1
"ENG_062_MZB_LO_1973","ENG_062_MZB_LO_1973-06.10.2003","06.10.2003",2003,10,6,1.04136209,1
"ENG_062_MZB_LO_1973","ENG_062_MZB_LO_1973-29.09.2004","29.09.2004",2004,9,29,1.034110706,1
"ENG_062_MZB_LO_1973","ENG_062_MZB_LO_1973-01.11.2005","01.11.2005",2005,11,1,0.989963446,1
"ENG_062_MZB_LO_1973","ENG_062_MZB_LO_1973-15.10.2008","15.10.2008",2008,10,15,1.067174445,1
"ENG_062_MZB_LO_1973","ENG_062_MZB_LO_1973-09.09.2013","09.09.2013",2013,9,9,1.026852615,1
"ENG_062_MZB_LO_1973","ENG_062_MZB_LO_1973-12.11.2015","12.11.2015",2015,11,12,1.012279844,1
"ENG_062_MZB_LO_1973","ENG_062_MZB_LO_1973-10.10.2019","10.10.2019",2019,10,10,0.993349324,1
"ENG_062_MZB_LO_1973","ENG_062_MZB_LO_1973-11.11.2021","11.11.2021",2021,11,11,1.011436979,1
"ENG_062_MZB_LO_1973","ENG_062_MZB_LO_1973-26.09.2023","26.09.2023",2023,9,26,1.020984753,1
"ENG_062_MZB_LO_1975","ENG_062_MZB_LO_1975-28.10.2003","28.10.2003",2003,10,28,0.971720485,2
"ENG_062_MZB_LO_1975","ENG_062_MZB_LO_1975-03.11.2004","03.11.2004",2004,11,3,0.889504123,2
"ENG_062_MZB_LO_1975","ENG_062_MZB_LO_1975-23.11.2007","23.11.2007",2007,11,23,0.96558451,2
"ENG_062_MZB_LO_1975","ENG_062_MZB_LO_1975-22.10.2010","22.10.2010",2010,10,22,1.007507598,1
"ENG_062_MZB_LO_1975","ENG_062_MZB_LO_1975-31.10.2012","31.10.2012",2012,10,31,1.011892347,1
"ENG_062_MZB_LO_1975","ENG_062_MZB_LO_1975-16.09.2013","16.09.2013",2013,9,16,0.871170984,3
"ENG_062_MZB_LO_1975","ENG_062_MZB_LO_1975-28.10.2014","28.10.2014",2014,10,28,0.949855858,2
"ENG_062_MZB_LO_1975","ENG_062_MZB_LO_1975-19.10.2017","19.10.2017",2017,10,19,0.989922022,1
"ENG_062_MZB_LO_1976","ENG_062_MZB_LO_1976-28.10.2003","28.10.2003",2003,10,28,1.001971182,1
"ENG_062_MZB_LO_1976","ENG_062_MZB_LO_1976-23.11.2004","23.11.2004",2004,11,23,1.020612671,1
"ENG_062_MZB_LO_1976","ENG_062_MZB_LO_1976-22.11.2005","22.11.2005",2005,11,22,0.955392172,2
"ENG_062_MZB_LO_1976","ENG_062_MZB_LO_1976-06.11.2006","06.11.2006",2006,11,6,0.943243418,2
"ENG_062_MZB_LO_1976","ENG_062_MZB_LO_1976-15.10.2007","15.10.2007",2007,10,15,1.092068284,2
"ENG_062_MZB_LO_1976","ENG_062_MZB_LO_1976-18.11.2008","18.11.2008",2008,11,18,0.984480514,2
"ENG_062_MZB_LO_1976","ENG_062_MZB_LO_1976-04.10.2011","04.10.2011",2011,10,4,1.07834424,1
"ENG_062_MZB_LO_1976","ENG_062_MZB_LO_1976-06.11.2013","06.11.2013",2013,11,6,0.989053524,1
"ENG_062_MZB_LO_1976","ENG_062_MZB_LO_1976-22.10.2015","22.10.2015",2015,10,22,1.010600926,1
"ENG_062_MZB_LO_1976","ENG_062_MZB_LO_1976-04.10.2016","04.10.2016",2016,10,4,1.073251288,1
"ENG_062_MZB_LO_1976","ENG_062_MZB_LO_1976-27.10.2017","27.10.2017",2017,10,27,0.984802703,1
"ENG_062_MZB_LO_1976","ENG_062_MZB_LO_1976-16.10.2018","16.10.2018",2018,10,16,0.953944382,2
"ENG_062_MZB_LO_1976","ENG_062_MZB_LO_1976-26.10.2022","26.10.2022",2022,10,26,1.053003336,1
"ENG_062_MZB_LO_1978","ENG_062_MZB_LO_1978-18.11.2003","18.11.2003",2003,11,18,0.700496909,4
"ENG_062_MZB_LO_1978","ENG_062_MZB_LO_1978-09.11.2006","09.11.2006",2006,11,9,0.665001023,4
"ENG_062_MZB_LO_1978","ENG_062_MZB_LO_1978-13.10.2009","13.10.2009",2009,10,13,0.726928943,3
"ENG_062_MZB_LO_1978","ENG_062_MZB_LO_1978-06.09.2012","06.09.2012",2012,9,6,0.612955124,4
"ENG_062_MZB_LO_1978","ENG_062_MZB_LO_1978-24.09.2014","24.09.2014",2014,9,24,0.728982145,3
"ENG_062_MZB_LO_1978","ENG_062_MZB_LO_1978-28.10.2021","28.10.2021",2021,10,28,0.663787075,4
"ENG_062_MZB_LO_1978","ENG_062_MZB_LO_1978-15.10.2024","15.10.2024",2024,10,15,0.716213898,4
"ENG_062_MZB_LO_1981","ENG_062_MZB_LO_1981-20.09.2002","20.09.2002",2002,9,20,0.567416118,5
"ENG_062_MZB_LO_1981","ENG_062_MZB_LO_1981-12.11.2003","12.11.2003",2003,11,12,0.598809785,5
"ENG_062_MZB_LO_1981","ENG_062_MZB_LO_1981-02.11.2006","02.11.2006",2006,11,2,0.665527857,4
"ENG_062_MZB_LO_1981","ENG_062_MZB_LO_1981-04.11.2009","04.11.2009",2009,11,4,0.604948343,5
"ENG_062_MZB_LO_1981","ENG_062_MZB_LO_1981-09.11.2011","09.11.2011",2011,11,9,0.605532641,4
"ENG_062_MZB_LO_1981","ENG_062_MZB_LO_1981-05.10.2015","05.10.2015",2015,10,5,0.581420528,5
"ENG_062_MZB_LO_1981","ENG_062_MZB_LO_1981-20.11.2019","20.11.2019",2019,11,20,0.613527161,4
"ENG_062_MZB_LO_1981","ENG_062_MZB_LO_1981-22.09.2020","22.09.2020",2020,9,22,0.656034531,4
"ENG_062_MZB_LO_1981","ENG_062_MZB_LO_1981-10.09.2021","10.09.2021",2021,9,10,0.65582373,4
"ENG_062_MZB_LO_1981","ENG_062_MZB_LO_1981-08.11.2023","08.11.2023",2023,11,8,0.639952554,5
"ENG_062_MZB_LO_1987","ENG_062_MZB_LO_1987-23.11.2005","23.11.2005",2005,11,23,1.02505597,1
"ENG_062_MZB_LO_1987","ENG_062_MZB_LO_1987-30.10.2008","30.10.2008",2008,10,30,0.97965856,1
"ENG_062_MZB_LO_1987","ENG_062_MZB_LO_1987-18.11.2015","18.11.2015",2015,11,18,0.993239511,1
"ENG_062_MZB_LO_1987","ENG_062_MZB_LO_1987-18.10.2016","18.10.2016",2016,10,18,1.006987287,1
"ENG_062_MZB_LO_1987","ENG_062_MZB_LO_1987-17.10.2017","17.10.2017",2017,10,17,1.040928573,1
"ENG_062_MZB_LO_1987","ENG_062_MZB_LO_1987-16.11.2018","16.11.2018",2018,11,16,1.009370668,1
"ENG_062_MZB_LO_1987","ENG_062_MZB_LO_1987-08.09.2020","08.09.2020",2020,9,8,1.04168285,1
"ENG_062_MZB_LO_1987","ENG_062_MZB_LO_1987-28.10.2021","28.10.2021",2021,10,28,0.921971879,2
"ENG_062_MZB_LO_1987","ENG_062_MZB_LO_1987-27.09.2022","27.09.2022",2022,9,27,1.000021626,1
"ENG_062_MZB_LO_1987","ENG_062_MZB_LO_1987-24.11.2023","24.11.2023",2023,11,24,0.973842419,1
"ENG_062_MZB_LO_1987","ENG_062_MZB_LO_1987-29.10.2024","29.10.2024",2024,10,29,1.052898597,2
"ENG_062_MZB_LO_1989","ENG_062_MZB_LO_1989-29.11.2002","29.11.2002",2002,11,29,0.547163245,5
"ENG_062_MZB_LO_1989","ENG_062_MZB_LO_1989-04.11.2004","04.11.2004",2004,11,4,0.595381364,4
"ENG_062_MZB_LO_1989","ENG_062_MZB_LO_1989-25.10.2005","25.10.2005",2005,10,25,0.589638276,5
"ENG_062_MZB_LO_1989","ENG_062_MZB_LO_1989-12.09.2008","12.09.2008",2008,9,12,0.624950969,4
"ENG_062_MZB_LO_1989","ENG_062_MZB_LO_1989-18.10.2013","18.10.2013",2013,10,18,0.535720979,5
"ENG_062_MZB_LO_1989","ENG_062_MZB_LO_1989-22.10.2015","22.10.2015",2015,10,22,0.616043845,4
"ENG_062_MZB_LO_1989","ENG_062_MZB_LO_1989-04.09.2018","04.09.2018",2018,9,4,0.653306524,4
"ENG_062_MZB_LO_1995","ENG_062_MZB_LO_1995-05.04.2002","05.04.2002",2002,4,5,0.833047987,3
"ENG_062_MZB_LO_1995","ENG_062_MZB_LO_1995-19.05.2005","19.05.2005",2005,5,19,0.848202663,3
"ENG_062_MZB_LO_1995","ENG_062_MZB_LO_1995-22.04.2008","22.04.2008",2008,4,22,0.860827325,3
"ENG_062_MZB_LO_1995","ENG_062_MZB_LO_1995-07.04.2011","07.04.2011",2011,4,7,0.860188486,3
"ENG_062_MZB_LO_1995","ENG_062_MZB_LO_1995-29.04.2014","29.04.2014",2014,4,29,0.794815872,3
"ENG_062_MZB_LO_1995","ENG_062_MZB_LO_1995-16.05.2016","16.05.2016",2016,5,16,0.854658625,3
"ENG_062_MZB_LO_1995","ENG_062_MZB_LO_1995-03.04.2017","03.04.2017",2017,4,3,0.877478924,2
"ENG_062_MZB_LO_1996","ENG_062_MZB_LO_1996-19.09.2002","19.09.2002",2002,9,19,1.001086036,1
"ENG_062_MZB_LO_1996","ENG_062_MZB_LO_1996-16.11.2005","16.11.2005",2005,11,16,0.973881123,1
"ENG_062_MZB_LO_1996","ENG_062_MZB_LO_1996-14.10.2008","14.10.2008",2008,10,14,0.95513127,2
"ENG_062_MZB_LO_1996","ENG_062_MZB_LO_1996-27.09.2013","27.09.2013",2013,9,27,0.982087433,2
"ENG_062_MZB_LO_1996","ENG_062_MZB_LO_1996-10.11.2017","10.11.2017",2017,11,10,0.967357589,2
"ENG_062_MZB_LO_1996","ENG_062_MZB_LO_1996-06.09.2021","06.09.2021",2021,9,6,0.980754517,1
"ENG_062_MZB_LO_1996","ENG_062_MZB_LO_1996-05.09.2022","05.09.2022",2022,9,5,0.908898019,2
"ENG_062_MZB_LO_1996","ENG_062_MZB_LO_1996-27.10.2023","27.10.2023",2023,10,27,1.015676417,1
"ENG_062_MZB_LO_1996","ENG_062_MZB_LO_1996-22.10.2024","22.10.2024",2024,10,22,0.976111448,3
"ENG_062_MZB_LO_1997","ENG_062_MZB_LO_1997-23.09.2002","23.09.2002",2002,9,23,0.776256163,3
"ENG_062_MZB_LO_1997","ENG_062_MZB_LO_1997-08.10.2003","08.10.2003",2003,10,8,0.795777605,3
"ENG_062_MZB_LO_1997","ENG_062_MZB_LO_1997-14.09.2005","14.09.2005",2005,9,14,0.855441385,3
"ENG_062_MZB_LO_1997","ENG_062_MZB_LO_1997-06.09.2006","06.09.2006",2006,9,6,0.757459872,3
"ENG_062_MZB_LO_1997","ENG_062_MZB_LO_1997-30.10.2007","30.10.2007",2007,10,30,0.874807484,2
"ENG_062_MZB_LO_1997","ENG_062_MZB_LO_1997-06.11.2008","06.11.2008",2008,11,6,0.710632737,4
"ENG_062_MZB_LO_1997","ENG_062_MZB_LO_1997-21.09.2011","21.09.2011",2011,9,21,0.751983443,4
"ENG_062_MZB_LO_1997","ENG_062_MZB_LO_1997-20.09.2012","20.09.2012",2012,9,20,0.854363348,5
"ENG_062_MZB_LO_1997","ENG_062_MZB_LO_1997-05.11.2015","05.11.2015",2015,11,5,0.91664174,4
"ENG_062_MZB_LO_1997","ENG_062_MZB_LO_1997-01.10.2018","01.10.2018",2018,10,1,0.934132676,2
"ENG_062_MZB_LO_1998","ENG_062_MZB_LO_1998-19.11.2002","19.11.2002",2002,11,19,0.841859056,3
"ENG_062_MZB_LO_1998","ENG_062_MZB_LO_1998-22.11.2005","22.11.2005",2005,11,22,0.824155517,3
"ENG_062_MZB_LO_1998","ENG_062_MZB_LO_1998-23.10.2007","23.10.2007",2007,10,23,0.987977746,1
"ENG_062_MZB_LO_1998","ENG_062_MZB_LO_1998-30.10.2008","30.10.2008",2008,10,30,0.829564864,3
"ENG_062_MZB_LO_1998","ENG_062_MZB_LO_1998-10.09.2013","10.09.2013",2013,9,10,0.798864937,3
"ENG_062_MZB_LO_1998","ENG_062_MZB_LO_1998-04.10.2016","04.10.2016",2016,10,4,0.876359319,2
"ENG_062_MZB_LO_1998","ENG_062_MZB_LO_1998-27.10.2017","27.10.2017",2017,10,27,0.83139038,3
"ENG_062_MZB_LO_1998","ENG_062_MZB_LO_1998-30.10.2023","30.10.2023",2023,10,30,0.879454896,2
"ENG_062_MZB_LO_1999","ENG_062_MZB_LO_1999-15.09.2004","15.09.2004",2004,9,15,0.831017544,3
"ENG_062_MZB_LO_1999","ENG_062_MZB_LO_1999-05.10.2005","05.10.2005",2005,10,5,0.716473419,4
"ENG_062_MZB_LO_1999","ENG_062_MZB_LO_1999-21.09.2006","21.09.2006",2006,9,21,0.737903295,3
"ENG_062_MZB_LO_1999","ENG_062_MZB_LO_1999-23.10.2007","23.10.2007",2007,10,23,0.783326399,3
"ENG_062_MZB_LO_1999","ENG_062_MZB_LO_1999-17.11.2008","17.11.2008",2008,11,17,0.810220228,3
"ENG_062_MZB_LO_1999","ENG_062_MZB_LO_1999-10.11.2009","10.11.2009",2009,11,10,0.789966235,3
"ENG_062_MZB_LO_1999","ENG_062_MZB_LO_1999-02.11.2010","02.11.2010",2010,11,2,0.82294598,3
"ENG_062_MZB_LO_1999","ENG_062_MZB_LO_1999-31.10.2012","31.10.2012",2012,10,31,0.817122199,3
"ENG_062_MZB_LO_1999","ENG_062_MZB_LO_1999-10.10.2014","10.10.2014",2014,10,10,0.799858223,3
"ENG_062_MZB_LO_2000","ENG_062_MZB_LO_2000-17.11.2004","17.11.2004",2004,11,17,0.906177873,2
"ENG_062_MZB_LO_2000","ENG_062_MZB_LO_2000-29.09.2006","29.09.2006",2006,9,29,0.931413746,2
"ENG_062_MZB_LO_2000","ENG_062_MZB_LO_2000-29.09.2008","29.09.2008",2008,9,29,0.960900218,2
"ENG_062_MZB_LO_2000","ENG_062_MZB_LO_2000-15.09.2011","15.09.2011",2011,9,15,0.946543009,2
"ENG_062_MZB_LO_2000","ENG_062_MZB_LO_2000-10.09.2012","10.09.2012",2012,9,10,0.98253449,1
"ENG_062_MZB_LO_2000","ENG_062_MZB_LO_2000-14.10.2013","14.10.2013",2013,10,14,0.976230117,1
"ENG_062_MZB_LO_2000","ENG_062_MZB_LO_2000-03.09.2014","03.09.2014",2014,9,3,0.992927101,1
"ENG_062_MZB_LO_2000","ENG_062_MZB_LO_2000-08.09.2015","08.09.2015",2015,9,8,0.942061831,2
"ENG_062_MZB_LO_2000","ENG_062_MZB_LO_2000-22.09.2016","22.09.2016",2016,9,22,0.899479514,2
"ENG_062_MZB_LO_2000","ENG_062_MZB_LO_2000-05.09.2017","05.09.2017",2017,9,5,0.995084035,1
"ENG_062_MZB_LO_2000","ENG_062_MZB_LO_2000-04.09.2018","04.09.2018",2018,9,4,1.029501628,1
"ENG_062_MZB_LO_2000","ENG_062_MZB_LO_2000-10.09.2019","10.09.2019",2019,9,10,0.986893074,1
"ENG_062_MZB_LO_2000","ENG_062_MZB_LO_2000-16.09.2020","16.09.2020",2020,9,16,1.02827305,1
"ENG_062_MZB_LO_2000","ENG_062_MZB_LO_2000-03.09.2021","03.09.2021",2021,9,3,0.987456905,1
"ENG_062_MZB_LO_2000","ENG_062_MZB_LO_2000-02.09.2022","02.09.2022",2022,9,2,1.017246105,1
"ENG_062_MZB_LO_2002","ENG_062_MZB_LO_2002-03.04.2002","03.04.2002",2002,4,3,0.870768949,2
"ENG_062_MZB_LO_2002","ENG_062_MZB_LO_2002-19.03.2003","19.03.2003",2003,3,19,0.788930508,3
"ENG_062_MZB_LO_2002","ENG_062_MZB_LO_2002-04.05.2005","04.05.2005",2005,5,4,0.847875539,3
"ENG_062_MZB_LO_2002","ENG_062_MZB_LO_2002-09.05.2008","09.05.2008",2008,5,9,0.90966698,2
"ENG_062_MZB_LO_2002","ENG_062_MZB_LO_2002-09.05.2013","09.05.2013",2013,5,9,0.89427414,2
"ENG_062_MZB_LO_2002","ENG_062_MZB_LO_2002-14.05.2014","14.05.2014",2014,5,14,0.954826837,2
"ENG_062_MZB_LO_2002","ENG_062_MZB_LO_2002-30.05.2018","30.05.2018",2018,5,30,0.927330832,2
"ENG_062_MZB_LO_2003","ENG_062_MZB_LO_2003-18.09.2002","18.09.2002",2002,9,18,0.863139695,3
"ENG_062_MZB_LO_2003","ENG_062_MZB_LO_2003-03.11.2004","03.11.2004",2004,11,3,0.89821182,2
"ENG_062_MZB_LO_2003","ENG_062_MZB_LO_2003-05.10.2007","05.10.2007",2007,10,5,0.884729454,2
"ENG_062_MZB_LO_2003","ENG_062_MZB_LO_2003-22.10.2008","22.10.2008",2008,10,22,1.011948037,1
"ENG_062_MZB_LO_2003","ENG_062_MZB_LO_2003-27.10.2009","27.10.2009",2009,10,27,0.969328235,1
"ENG_062_MZB_LO_2003","ENG_062_MZB_LO_2003-12.10.2010","12.10.2010",2010,10,12,0.992310004,1
"ENG_062_MZB_LO_2003","ENG_062_MZB_LO_2003-11.11.2011","11.11.2011",2011,11,11,0.93768648,2
"ENG_062_MZB_LO_2003","ENG_062_MZB_LO_2003-15.11.2012","15.11.2012",2012,11,15,1.019205451,2
"ENG_062_MZB_LO_2003","ENG_062_MZB_LO_2003-15.11.2013","15.11.2013",2013,11,15,1.072280344,1
"ENG_062_MZB_LO_2003","ENG_062_MZB_LO_2003-27.11.2014","27.11.2014",2014,11,27,1.025963486,1
"ENG_062_MZB_LO_2003","ENG_062_MZB_LO_2003-30.11.2015","30.11.2015",2015,11,30,0.952097536,2
"ENG_062_MZB_LO_2003","ENG_062_MZB_LO_2003-06.09.2016","06.09.2016",2016,9,6,0.992496401,1
"ENG_062_MZB_LO_2003","ENG_062_MZB_LO_2003-13.10.2017","13.10.2017",2017,10,13,1.112276755,1
"ENG_062_MZB_LO_2003","ENG_062_MZB_LO_2003-12.10.2018","12.10.2018",2018,10,12,1.03316225,1
"ENG_062_MZB_LO_2003","ENG_062_MZB_LO_2003-18.09.2020","18.09.2020",2020,9,18,1.039791932,1
"ENG_062_MZB_LO_2003","ENG_062_MZB_LO_2003-10.09.2021","10.09.2021",2021,9,10,0.994914804,2
"ENG_062_MZB_LO_2003","ENG_062_MZB_LO_2003-12.10.2022","12.10.2022",2022,10,12,0.989734078,1
"ENG_062_MZB_LO_2003","ENG_062_MZB_LO_2003-28.09.2023","28.09.2023",2023,9,28,0.952631974,2
"ENG_062_MZB_LO_2004","ENG_062_MZB_LO_2004-19.10.2004","19.10.2004",2004,10,19,0.957209777,2
"ENG_062_MZB_LO_2004","ENG_062_MZB_LO_2004-27.09.2007","27.09.2007",2007,9,27,1.029912659,1
"ENG_062_MZB_LO_2004","ENG_062_MZB_LO_2004-04.11.2008","04.11.2008",2008,11,4,1.050026627,1
"ENG_062_MZB_LO_2004","ENG_062_MZB_LO_2004-14.09.2009","14.09.2009",2009,9,14,0.959639292,2
"ENG_062_MZB_LO_2004","ENG_062_MZB_LO_2004-09.09.2010","09.09.2010",2010,9,9,0.995619795,1
"ENG_062_MZB_LO_2004","ENG_062_MZB_LO_2004-28.10.2011","28.10.2011",2011,10,28,1.009107792,1
"ENG_062_MZB_LO_2004","ENG_062_MZB_LO_2004-15.11.2012","15.11.2012",2012,11,15,0.996217544,2
"ENG_062_MZB_LO_2004","ENG_062_MZB_LO_2004-07.10.2013","07.10.2013",2013,10,7,0.943392786,2
"ENG_062_MZB_LO_2004","ENG_062_MZB_LO_2004-08.10.2014","08.10.2014",2014,10,8,1.057661241,1
"ENG_062_MZB_LO_2004","ENG_062_MZB_LO_2004-24.09.2015","24.09.2015",2015,9,24,0.996148432,3
"ENG_062_MZB_LO_2004","ENG_062_MZB_LO_2004-23.09.2016","23.09.2016",2016,9,23,0.927823151,2
"ENG_062_MZB_LO_2004","ENG_062_MZB_LO_2004-08.09.2017","08.09.2017",2017,9,8,1.014201441,1
"ENG_062_MZB_LO_2004","ENG_062_MZB_LO_2004-26.10.2018","26.10.2018",2018,10,26,1.06695307,1
"ENG_062_MZB_LO_2004","ENG_062_MZB_LO_2004-23.09.2019","23.09.2019",2019,9,23,1.060115393,1
"ENG_062_MZB_LO_2004","ENG_062_MZB_LO_2004-29.09.2020","29.09.2020",2020,9,29,1.054950422,1
"ENG_062_MZB_LO_2004","ENG_062_MZB_LO_2004-12.10.2021","12.10.2021",2021,10,12,0.982188691,1
"ENG_062_MZB_LO_2006","ENG_062_MZB_LO_2006-13.09.2002","13.09.2002",2002,9,13,1.032461805,1
"ENG_062_MZB_LO_2006","ENG_062_MZB_LO_2006-30.09.2003","30.09.2003",2003,9,30,1.151641405,1
"ENG_062_MZB_LO_2006","ENG_062_MZB_LO_2006-14.09.2005","14.09.2005",2005,9,14,0.937663674,2
"ENG_062_MZB_LO_2006","ENG_062_MZB_LO_2006-22.10.2007","22.10.2007",2007,10,22,1.042627596,1
"ENG_062_MZB_LO_2006","ENG_062_MZB_LO_2006-26.09.2008","26.09.2008",2008,9,26,1.060021851,1
"ENG_062_MZB_LO_2006","ENG_062_MZB_LO_2006-14.09.2009","14.09.2009",2009,9,14,1.092771925,1
"ENG_062_MZB_LO_2006","ENG_062_MZB_LO_2006-23.11.2010","23.11.2010",2010,11,23,1.06295163,1
"ENG_062_MZB_LO_2006","ENG_062_MZB_LO_2006-16.09.2011","16.09.2011",2011,9,16,1.055368626,1
"ENG_062_MZB_LO_2006","ENG_062_MZB_LO_2006-12.11.2012","12.11.2012",2012,11,12,1.0990336,1
"ENG_062_MZB_LO_2006","ENG_062_MZB_LO_2006-03.09.2013","03.09.2013",2013,9,3,1.019592614,1
"ENG_062_MZB_LO_2006","ENG_062_MZB_LO_2006-23.09.2014","23.09.2014",2014,9,23,1.053204179,1
"ENG_062_MZB_LO_2006","ENG_062_MZB_LO_2006-09.09.2015","09.09.2015",2015,9,9,1.006538634,1
"ENG_062_MZB_LO_2006","ENG_062_MZB_LO_2006-22.09.2016","22.09.2016",2016,9,22,1.024294019,1
"ENG_062_MZB_LO_2006","ENG_062_MZB_LO_2006-13.10.2017","13.10.2017",2017,10,13,1.064386018,1
"ENG_062_MZB_LO_2006","ENG_062_MZB_LO_2006-14.11.2018","14.11.2018",2018,11,14,1.042251478,1
"ENG_062_MZB_LO_2006","ENG_062_MZB_LO_2006-16.09.2020","16.09.2020",2020,9,16,1.001885867,1
"ENG_062_MZB_LO_2009","ENG_062_MZB_LO_2009-24.04.2002","24.04.2002",2002,4,24,0.860875077,3
"ENG_062_MZB_LO_2009","ENG_062_MZB_LO_2009-19.05.2004","19.05.2004",2004,5,19,0.796527803,3
"ENG_062_MZB_LO_2009","ENG_062_MZB_LO_2009-19.05.2006","19.05.2006",2006,5,19,0.8326344,3
"ENG_062_MZB_LO_2009","ENG_062_MZB_LO_2009-04.04.2007","04.04.2007",2007,4,4,0.763929877,3
"ENG_062_MZB_LO_2009","ENG_062_MZB_LO_2009-12.03.2008","12.03.2008",2008,3,12,0.798653361,3
"ENG_062_MZB_LO_2009","ENG_062_MZB_LO_2009-22.05.2009","22.05.2009",2009,5,22,0.809992677,4
"ENG_062_MZB_LO_2009","ENG_062_MZB_LO_2009-30.04.2013","30.04.2013",2013,4,30,0.732700437,4
"ENG_062_MZB_LO_2016","ENG_062_MZB_LO_2016-08.10.2003","08.10.2003",2003,10,8,0.728715563,3
"ENG_062_MZB_LO_2016","ENG_062_MZB_LO_2016-10.11.2004","10.11.2004",2004,11,10,0.769325102,3
"ENG_062_MZB_LO_2016","ENG_062_MZB_LO_2016-20.10.2006","20.10.2006",2006,10,20,0.794882125,3
"ENG_062_MZB_LO_2016","ENG_062_MZB_LO_2016-22.10.2007","22.10.2007",2007,10,22,0.733943711,3
"ENG_062_MZB_LO_2016","ENG_062_MZB_LO_2016-06.11.2008","06.11.2008",2008,11,6,0.754514861,3
"ENG_062_MZB_LO_2016","ENG_062_MZB_LO_2016-22.09.2009","22.09.2009",2009,9,22,0.720931854,3
"ENG_062_MZB_LO_2016","ENG_062_MZB_LO_2016-28.09.2010","28.09.2010",2010,9,28,0.749519169,3
"ENG_062_MZB_LO_2016","ENG_062_MZB_LO_2016-16.09.2011","16.09.2011",2011,9,16,0.790285969,3
"ENG_062_MZB_LO_2016","ENG_062_MZB_LO_2016-19.09.2012","19.09.2012",2012,9,19,0.774524623,3
"ENG_062_MZB_LO_2016","ENG_062_MZB_LO_2016-03.09.2013","03.09.2013",2013,9,3,0.898487018,2
"ENG_062_MZB_LO_2016","ENG_062_MZB_LO_2016-15.09.2015","15.09.2015",2015,9,15,0.864253383,3
"ENG_062_MZB_LO_2016","ENG_062_MZB_LO_2016-31.10.2018","31.10.2018",2018,10,31,0.890122494,2
"ENG_062_MZB_LO_2018","ENG_062_MZB_LO_2018-18.09.2003","18.09.2003",2003,9,18,0.846907309,3
"ENG_062_MZB_LO_2018","ENG_062_MZB_LO_2018-13.10.2004","13.10.2004",2004,10,13,0.878934232,2
"ENG_062_MZB_LO_2018","ENG_062_MZB_LO_2018-14.10.2005","14.10.2005",2005,10,14,0.880415057,2
"ENG_062_MZB_LO_2018","ENG_062_MZB_LO_2018-20.10.2006","20.10.2006",2006,10,20,0.963070626,2
"ENG_062_MZB_LO_2018","ENG_062_MZB_LO_2018-18.10.2007","18.10.2007",2007,10,18,0.942234095,2
"ENG_062_MZB_LO_2018","ENG_062_MZB_LO_2018-19.09.2008","19.09.2008",2008,9,19,0.867354399,2
"ENG_062_MZB_LO_2018","ENG_062_MZB_LO_2018-19.11.2009","19.11.2009",2009,11,19,0.760103622,3
"ENG_062_MZB_LO_2018","ENG_062_MZB_LO_2018-13.10.2010","13.10.2010",2010,10,13,0.946348471,2
"ENG_062_MZB_LO_2018","ENG_062_MZB_LO_2018-09.11.2011","09.11.2011",2011,11,9,0.830653658,5
"ENG_062_MZB_LO_2018","ENG_062_MZB_LO_2018-16.11.2012","16.11.2012",2012,11,16,0.898416884,2
"ENG_062_MZB_LO_2018","ENG_062_MZB_LO_2018-08.10.2013","08.10.2013",2013,10,8,0.721492203,5
"ENG_062_MZB_LO_2018","ENG_062_MZB_LO_2018-25.09.2014","25.09.2014",2014,9,25,0.850836577,4
"ENG_062_MZB_LO_2018","ENG_062_MZB_LO_2018-13.11.2015","13.11.2015",2015,11,13,0.887788495,2
"ENG_062_MZB_LO_2018","ENG_062_MZB_LO_2018-20.10.2016","20.10.2016",2016,10,20,0.905655764,2
"ENG_062_MZB_LO_2018","ENG_062_MZB_LO_2018-01.09.2017","01.09.2017",2017,9,1,0.907983971,2
"ENG_062_MZB_LO_2018","ENG_062_MZB_LO_2018-25.10.2018","25.10.2018",2018,10,25,0.781390036,5
"ENG_062_MZB_LO_2018","ENG_062_MZB_LO_2018-22.11.2019","22.11.2019",2019,11,22,0.769646581,5
"ENG_062_MZB_LO_2018","ENG_062_MZB_LO_2018-16.09.2020","16.09.2020",2020,9,16,0.985820097,1
"ENG_062_MZB_LO_2018","ENG_062_MZB_LO_2018-10.09.2021","10.09.2021",2021,9,10,0.994145761,1
"ENG_062_MZB_LO_2021","ENG_062_MZB_LO_2021-28.11.2002","28.11.2002",2002,11,28,0.935807309,2
"ENG_062_MZB_LO_2021","ENG_062_MZB_LO_2021-01.10.2003","01.10.2003",2003,10,1,1.097841095,1
"ENG_062_MZB_LO_2021","ENG_062_MZB_LO_2021-22.09.2004","22.09.2004",2004,9,22,1.005729208,1
"ENG_062_MZB_LO_2021","ENG_062_MZB_LO_2021-18.10.2006","18.10.2006",2006,10,18,0.973709996,1
"ENG_062_MZB_LO_2021","ENG_062_MZB_LO_2021-08.10.2007","08.10.2007",2007,10,8,0.994248044,1
"ENG_062_MZB_LO_2021","ENG_062_MZB_LO_2021-13.10.2008","13.10.2008",2008,10,13,0.991308247,1
"ENG_062_MZB_LO_2021","ENG_062_MZB_LO_2021-30.09.2009","30.09.2009",2009,9,30,0.976424396,1
"ENG_062_MZB_LO_2021","ENG_062_MZB_LO_2021-16.09.2013","16.09.2013",2013,9,16,1.14166406,1
"ENG_062_MZB_LO_2022","ENG_062_MZB_LO_2022-15.10.2002","15.10.2002",2002,10,15,1.06042643,1
"ENG_062_MZB_LO_2022","ENG_062_MZB_LO_2022-21.10.2003","21.10.2003",2003,10,21,1.097979332,1
"ENG_062_MZB_LO_2022","ENG_062_MZB_LO_2022-05.10.2004","05.10.2004",2004,10,5,1.099738076,2
"ENG_062_MZB_LO_2022","ENG_062_MZB_LO_2022-12.10.2005","12.10.2005",2005,10,12,1.136977211,1
"ENG_062_MZB_LO_2022","ENG_062_MZB_LO_2022-04.10.2006","04.10.2006",2006,10,4,0.951882478,2
"ENG_062_MZB_LO_2022","ENG_062_MZB_LO_2022-27.09.2007","27.09.2007",2007,9,27,0.96995438,2
"ENG_062_MZB_LO_2022","ENG_062_MZB_LO_2022-17.09.2008","17.09.2008",2008,9,17,1.023782548,1
"ENG_062_MZB_LO_2022","ENG_062_MZB_LO_2022-08.10.2009","08.10.2009",2009,10,8,1.026768157,1
"ENG_062_MZB_LO_2022","ENG_062_MZB_LO_2022-08.10.2010","08.10.2010",2010,10,8,1.050755719,2
"ENG_062_MZB_LO_2022","ENG_062_MZB_LO_2022-20.09.2011","20.09.2011",2011,9,20,1.111591862,1
"ENG_062_MZB_LO_2022","ENG_062_MZB_LO_2022-03.09.2012","03.09.2012",2012,9,3,1.044788539,1
"ENG_062_MZB_LO_2022","ENG_062_MZB_LO_2022-03.09.2013","03.09.2013",2013,9,3,0.993732919,2
"ENG_062_MZB_LO_2022","ENG_062_MZB_LO_2022-02.09.2014","02.09.2014",2014,9,2,1.080003446,1
"ENG_062_MZB_LO_2022","ENG_062_MZB_LO_2022-17.09.2015","17.09.2015",2015,9,17,1.059717635,1
"ENG_062_MZB_LO_2022","ENG_062_MZB_LO_2022-16.11.2017","16.11.2017",2017,11,16,1.109710384,1
"ENG_062_MZB_LO_2022","ENG_062_MZB_LO_2022-26.09.2018","26.09.2018",2018,9,26,0.968673764,2
"ENG_062_MZB_LO_2022","ENG_062_MZB_LO_2022-04.11.2019","04.11.2019",2019,11,4,1.046407718,1
"ENG_062_MZB_LO_2022","ENG_062_MZB_LO_2022-30.10.2020","30.10.2020",2020,10,30,1.044896163,2
"ENG_062_MZB_LO_2022","ENG_062_MZB_LO_2022-24.09.2021","24.09.2021",2021,9,24,1.197262977,2
"ENG_062_MZB_LO_2022","ENG_062_MZB_LO_2022-26.09.2022","26.09.2022",2022,9,26,1.057596256,1
"ENG_062_MZB_LO_2022","ENG_062_MZB_LO_2022-06.10.2023","06.10.2023",2023,10,6,1.040848588,2
"ENG_062_MZB_LO_2024","ENG_062_MZB_LO_2024-30.11.2002","30.11.2002",2002,11,30,0.740403697,3
"ENG_062_MZB_LO_2024","ENG_062_MZB_LO_2024-01.10.2004","01.10.2004",2004,10,1,0.742825771,3
"ENG_062_MZB_LO_2024","ENG_062_MZB_LO_2024-13.10.2005","13.10.2005",2005,10,13,0.731504292,3
"ENG_062_MZB_LO_2024","ENG_062_MZB_LO_2024-21.11.2006","21.11.2006",2006,11,21,0.772558359,3
"ENG_062_MZB_LO_2024","ENG_062_MZB_LO_2024-18.10.2007","18.10.2007",2007,10,18,0.780272208,3
"ENG_062_MZB_LO_2024","ENG_062_MZB_LO_2024-17.09.2008","17.09.2008",2008,9,17,0.787314658,3
"ENG_062_MZB_LO_2024","ENG_062_MZB_LO_2024-13.10.2009","13.10.2009",2009,10,13,0.675908376,4
"ENG_062_MZB_LO_2024","ENG_062_MZB_LO_2024-07.10.2010","07.10.2010",2010,10,7,0.728106005,3
"ENG_062_MZB_LO_2024","ENG_062_MZB_LO_2024-18.09.2015","18.09.2015",2015,9,18,0.685080745,4
"ENG_062_MZB_LO_2025","ENG_062_MZB_LO_2025-19.09.2002","19.09.2002",2002,9,19,0.807209439,3
"ENG_062_MZB_LO_2025","ENG_062_MZB_LO_2025-16.10.2003","16.10.2003",2003,10,16,0.816339631,3
"ENG_062_MZB_LO_2025","ENG_062_MZB_LO_2025-27.10.2004","27.10.2004",2004,10,27,0.648588564,5
"ENG_062_MZB_LO_2025","ENG_062_MZB_LO_2025-08.09.2006","08.09.2006",2006,9,8,0.721023251,3
"ENG_062_MZB_LO_2025","ENG_062_MZB_LO_2025-19.10.2007","19.10.2007",2007,10,19,0.83328474,3
"ENG_062_MZB_LO_2025","ENG_062_MZB_LO_2025-14.10.2008","14.10.2008",2008,10,14,0.794255182,3
"ENG_062_MZB_LO_2025","ENG_062_MZB_LO_2025-27.10.2009","27.10.2009",2009,10,27,0.780639492,3
"ENG_062_MZB_LO_2025","ENG_062_MZB_LO_2025-02.11.2011","02.11.2011",2011,11,2,0.732800353,4
"ENG_062_MZB_LO_2025","ENG_062_MZB_LO_2025-23.09.2014","23.09.2014",2014,9,23,0.761259369,4
"ENG_062_MZB_LO_2028","ENG_062_MZB_LO_2028-07.10.2005","07.10.2005",2005,10,7,1.024001021,1
"ENG_062_MZB_LO_2028","ENG_062_MZB_LO_2028-24.10.2006","24.10.2006",2006,10,24,0.947863107,2
"ENG_062_MZB_LO_2028","ENG_062_MZB_LO_2028-22.10.2007","22.10.2007",2007,10,22,1.076726161,2
"ENG_062_MZB_LO_2028","ENG_062_MZB_LO_2028-14.10.2008","14.10.2008",2008,10,14,0.946596203,2
"ENG_062_MZB_LO_2028","ENG_062_MZB_LO_2028-19.10.2009","19.10.2009",2009,10,19,1.144386791,1
"ENG_062_MZB_LO_2028","ENG_062_MZB_LO_2028-21.09.2010","21.09.2010",2010,9,21,0.973037271,2
"ENG_062_MZB_LO_2028","ENG_062_MZB_LO_2028-18.10.2011","18.10.2011",2011,10,18,1.005742778,1
"ENG_062_MZB_LO_2028","ENG_062_MZB_LO_2028-13.09.2012","13.09.2012",2012,9,13,1.065632412,1
"ENG_062_MZB_LO_2028","ENG_062_MZB_LO_2028-07.10.2013","07.10.2013",2013,10,7,0.981722239,2
"ENG_062_MZB_LO_2028","ENG_062_MZB_LO_2028-08.10.2014","08.10.2014",2014,10,8,0.939231524,3
"ENG_062_MZB_LO_2028","ENG_062_MZB_LO_2028-06.11.2015","06.11.2015",2015,11,6,0.729997372,4
"ENG_062_MZB_LO_2028","ENG_062_MZB_LO_2028-21.09.2016","21.09.2016",2016,9,21,0.832841868,3
"ENG_062_MZB_LO_2028","ENG_062_MZB_LO_2028-29.09.2017","29.09.2017",2017,9,29,0.850897419,3
"ENG_062_MZB_LO_2028","ENG_062_MZB_LO_2028-16.10.2018","16.10.2018",2018,10,16,0.97237163,1
"ENG_062_MZB_LO_2028","ENG_062_MZB_LO_2028-11.10.2019","11.10.2019",2019,10,11,1.06301582,1
"ENG_062_MZB_LO_2028","ENG_062_MZB_LO_2028-29.09.2020","29.09.2020",2020,9,29,1.058987979,1
"ENG_062_MZB_LO_2028","ENG_062_MZB_LO_2028-02.09.2021","02.09.2021",2021,9,2,1.117395274,1
"ENG_062_MZB_LO_2031","ENG_062_MZB_LO_2031-08.10.2003","08.10.2003",2003,10,8,0.726425497,3
"ENG_062_MZB_LO_2031","ENG_062_MZB_LO_2031-03.11.2004","03.11.2004",2004,11,3,0.756100584,3
"ENG_062_MZB_LO_2031","ENG_062_MZB_LO_2031-13.09.2006","13.09.2006",2006,9,13,0.84020046,3
"ENG_062_MZB_LO_2031","ENG_062_MZB_LO_2031-22.10.2007","22.10.2007",2007,10,22,0.821934679,3
"ENG_062_MZB_LO_2031","ENG_062_MZB_LO_2031-06.11.2008","06.11.2008",2008,11,6,0.740374162,3
"ENG_062_MZB_LO_2031","ENG_062_MZB_LO_2031-05.10.2009","05.10.2009",2009,10,5,0.735141339,3
"ENG_062_MZB_LO_2031","ENG_062_MZB_LO_2031-17.09.2010","17.09.2010",2010,9,17,0.810455777,3
"ENG_062_MZB_LO_2031","ENG_062_MZB_LO_2031-29.09.2014","29.09.2014",2014,9,29,0.840362992,3
"ENG_062_MZB_LO_2032","ENG_062_MZB_LO_2032-30.04.2002","30.04.2002",2002,4,30,0.789505737,3
"ENG_062_MZB_LO_2032","ENG_062_MZB_LO_2032-04.04.2003","04.04.2003",2003,4,4,0.768028696,3
"ENG_062_MZB_LO_2032","ENG_062_MZB_LO_2032-27.05.2005","27.05.2005",2005,5,27,0.814851317,3
"ENG_062_MZB_LO_2032","ENG_062_MZB_LO_2032-15.05.2006","15.05.2006",2006,5,15,0.796905963,3
"ENG_062_MZB_LO_2032","ENG_062_MZB_LO_2032-08.05.2007","08.05.2007",2007,5,8,0.74415952,3
"ENG_062_MZB_LO_2032","ENG_062_MZB_LO_2032-03.05.2013","03.05.2013",2013,5,3,0.905076735,2
"ENG_062_MZB_LO_2032","ENG_062_MZB_LO_2032-05.03.2015","05.03.2015",2015,3,5,0.858312162,3
"ENG_062_MZB_LO_2034","ENG_062_MZB_LO_2034-12.10.2004","12.10.2004",2004,10,12,0.974943178,1
"ENG_062_MZB_LO_2034","ENG_062_MZB_LO_2034-01.11.2006","01.11.2006",2006,11,1,0.993832546,1
"ENG_062_MZB_LO_2034","ENG_062_MZB_LO_2034-28.09.2007","28.09.2007",2007,9,28,0.951066846,2
"ENG_062_MZB_LO_2034","ENG_062_MZB_LO_2034-07.11.2008","07.11.2008",2008,11,7,1.038165157,1
"ENG_062_MZB_LO_2034","ENG_062_MZB_LO_2034-14.10.2009","14.10.2009",2009,10,14,1.049352409,1
"ENG_062_MZB_LO_2034","ENG_062_MZB_LO_2034-02.11.2010","02.11.2010",2010,11,2,0.972966386,2
"ENG_062_MZB_LO_2034","ENG_062_MZB_LO_2034-21.09.2011","21.09.2011",2011,9,21,0.982725471,1
"ENG_062_MZB_LO_2034","ENG_062_MZB_LO_2034-10.09.2012","10.09.2012",2012,9,10,1.038512274,1
"ENG_062_MZB_LO_2034","ENG_062_MZB_LO_2034-26.09.2013","26.09.2013",2013,9,26,1.036774017,1
"ENG_062_MZB_LO_2034","ENG_062_MZB_LO_2034-23.09.2014","23.09.2014",2014,9,23,0.961028881,3
"ENG_062_MZB_LO_2034","ENG_062_MZB_LO_2034-10.09.2015","10.09.2015",2015,9,10,0.980740363,1
"ENG_062_MZB_LO_2034","ENG_062_MZB_LO_2034-18.10.2016","18.10.2016",2016,10,18,0.913630208,2
"ENG_062_MZB_LO_2034","ENG_062_MZB_LO_2034-11.10.2017","11.10.2017",2017,10,11,1.033026419,1
"ENG_062_MZB_LO_2034","ENG_062_MZB_LO_2034-26.09.2018","26.09.2018",2018,9,26,0.931757985,2
"ENG_062_MZB_LO_2034","ENG_062_MZB_LO_2034-23.10.2019","23.10.2019",2019,10,23,0.903412158,3
"ENG_062_MZB_LO_2034","ENG_062_MZB_LO_2034-01.09.2020","01.09.2020",2020,9,1,0.92274565,2
"ENG_062_MZB_LO_2034","ENG_062_MZB_LO_2034-13.10.2021","13.10.2021",2021,10,13,0.964104284,3
"ENG_062_MZB_LO_2034","ENG_062_MZB_LO_2034-19.10.2022","19.10.2022",2022,10,19,0.911791556,3
"ENG_062_MZB_LO_2034","ENG_062_MZB_LO_2034-19.09.2023","19.09.2023",2023,9,19,0.774517887,5
"ENG_062_MZB_LO_2034","ENG_062_MZB_LO_2034-11.10.2024","11.10.2024",2024,10,11,0.970336475,4
"ENG_062_MZB_LO_2036","ENG_062_MZB_LO_2036-08.10.2003","08.10.2003",2003,10,8,0.732333797,3
"ENG_062_MZB_LO_2036","ENG_062_MZB_LO_2036-18.10.2006","18.10.2006",2006,10,18,0.848783186,3
"ENG_062_MZB_LO_2036","ENG_062_MZB_LO_2036-22.09.2008","22.09.2008",2008,9,22,0.875023157,5
"ENG_062_MZB_LO_2036","ENG_062_MZB_LO_2036-22.10.2009","22.10.2009",2009,10,22,0.869920356,2
"ENG_062_MZB_LO_2036","ENG_062_MZB_LO_2036-06.10.2010","06.10.2010",2010,10,6,0.933756768,2
"ENG_062_MZB_LO_2036","ENG_062_MZB_LO_2036-10.10.2011","10.10.2011",2011,10,10,0.904728479,2
"ENG_062_MZB_LO_2036","ENG_062_MZB_LO_2036-19.09.2012","19.09.2012",2012,9,19,0.808197928,3
"ENG_062_MZB_LO_2036","ENG_062_MZB_LO_2036-10.10.2013","10.10.2013",2013,10,10,0.859643807,3
"ENG_062_MZB_LO_2036","ENG_062_MZB_LO_2036-13.10.2015","13.10.2015",2015,10,13,0.760914733,3
"ENG_062_MZB_LO_2036","ENG_062_MZB_LO_2036-24.10.2016","24.10.2016",2016,10,24,0.928563604,2
"ENG_062_MZB_LO_2036","ENG_062_MZB_LO_2036-17.10.2017","17.10.2017",2017,10,17,0.931007341,2
"ENG_062_MZB_LO_2036","ENG_062_MZB_LO_2036-16.11.2018","16.11.2018",2018,11,16,0.918722521,2
"ENG_062_MZB_LO_2036","ENG_062_MZB_LO_2036-06.11.2020","06.11.2020",2020,11,6,0.899817899,2
"ENG_062_MZB_LO_2036","ENG_062_MZB_LO_2036-10.11.2021","10.11.2021",2021,11,10,0.895634684,3
"ENG_062_MZB_LO_2036","ENG_062_MZB_LO_2036-27.09.2022","27.09.2022",2022,9,27,0.885599117,2
"ENG_062_MZB_LO_2036","ENG_062_MZB_LO_2036-23.11.2023","23.11.2023",2023,11,23,0.906150944,3
"ENG_062_MZB_LO_2036","ENG_062_MZB_LO_2036-29.10.2024","29.10.2024",2024,10,29,0.920093825,3
"ENG_062_MZB_LO_2037","ENG_062_MZB_LO_2037-31.10.2002","31.10.2002",2002,10,31,0.511631668,5
"ENG_062_MZB_LO_2037","ENG_062_MZB_LO_2037-13.11.2003","13.11.2003",2003,11,13,0.564788317,5
"ENG_062_MZB_LO_2037","ENG_062_MZB_LO_2037-17.11.2004","17.11.2004",2004,11,17,0.656088189,4
"ENG_062_MZB_LO_2037","ENG_062_MZB_LO_2037-06.09.2005","06.09.2005",2005,9,6,0.677101089,5
"ENG_062_MZB_LO_2037","ENG_062_MZB_LO_2037-19.09.2008","19.09.2008",2008,9,19,0.697223447,4
"ENG_062_MZB_LO_2037","ENG_062_MZB_LO_2037-09.10.2012","09.10.2012",2012,10,9,0.653930217,5
"ENG_062_MZB_LO_2037","ENG_062_MZB_LO_2037-06.09.2016","06.09.2016",2016,9,6,0.567219791,5
"ENG_062_MZB_LO_2037","ENG_062_MZB_LO_2037-01.09.2023","01.09.2023",2023,9,1,0.569732835,5
"ENG_062_MZB_LO_2038","ENG_062_MZB_LO_2038-19.03.2002","19.03.2002",2002,3,19,0.860442579,3
"ENG_062_MZB_LO_2038","ENG_062_MZB_LO_2038-25.04.2003","25.04.2003",2003,4,25,0.77178372,3
"ENG_062_MZB_LO_2038","ENG_062_MZB_LO_2038-28.04.2006","28.04.2006",2006,4,28,0.776438205,3
"ENG_062_MZB_LO_2038","ENG_062_MZB_LO_2038-24.03.2011","24.03.2011",2011,3,24,0.956250083,2
"ENG_062_MZB_LO_2038","ENG_062_MZB_LO_2038-03.03.2015","03.03.2015",2015,3,3,0.952794178,2
"ENG_062_MZB_LO_2038","ENG_062_MZB_LO_2038-07.04.2016","07.04.2016",2016,4,7,0.892222537,2
"ENG_062_MZB_LO_2038","ENG_062_MZB_LO_2038-23.05.2023","23.05.2023",2023,5,23,0.962600411,2
"ENG_062_MZB_LO_2039","ENG_062_MZB_LO_2039-02.10.2002","02.10.2002",2002,10,2,0.918294877,2
"ENG_062_MZB_LO_2039","ENG_062_MZB_LO_2039-03.10.2005","03.10.2005",2005,10,3,0.847289375,3
"ENG_062_MZB_LO_2039","ENG_062_MZB_LO_2039-22.09.2008","22.09.2008",2008,9,22,0.901686137,3
"ENG_062_MZB_LO_2039","ENG_062_MZB_LO_2039-30.10.2013","30.10.2013",2013,10,30,0.872050937,3
"ENG_062_MZB_LO_2039","ENG_062_MZB_LO_2039-17.09.2015","17.09.2015",2015,9,17,0.949483238,2
"ENG_062_MZB_LO_2039","ENG_062_MZB_LO_2039-15.09.2021","15.09.2021",2021,9,15,0.855044652,4
"ENG_062_MZB_LO_2039","ENG_062_MZB_LO_2039-15.09.2022","15.09.2022",2022,9,15,0.958215906,2
"ENG_062_MZB_LO_2039","ENG_062_MZB_LO_2039-23.11.2023","23.11.2023",2023,11,23,0.891271033,3
"ENG_062_MZB_LO_2039","ENG_062_MZB_LO_2039-29.10.2024","29.10.2024",2024,10,29,1.004501947,5
"ENG_062_MZB_LO_2040","ENG_062_MZB_LO_2040-12.04.2002","12.04.2002",2002,4,12,0.707425842,4
"ENG_062_MZB_LO_2040","ENG_062_MZB_LO_2040-28.03.2003","28.03.2003",2003,3,28,0.734257526,4
"ENG_062_MZB_LO_2040","ENG_062_MZB_LO_2040-19.04.2004","19.04.2004",2004,4,19,0.595168016,5
"ENG_062_MZB_LO_2040","ENG_062_MZB_LO_2040-22.04.2005","22.04.2005",2005,4,22,0.75598788,3
"ENG_062_MZB_LO_2040","ENG_062_MZB_LO_2040-04.04.2007","04.04.2007",2007,4,4,0.823789408,4
"ENG_062_MZB_LO_2040","ENG_062_MZB_LO_2040-28.03.2013","28.03.2013",2013,3,28,0.782564471,5
"ENG_062_MZB_LO_2040","ENG_062_MZB_LO_2040-14.03.2016","14.03.2016",2016,3,14,0.831832356,3
"ENG_062_MZB_LO_2041","ENG_062_MZB_LO_2041-15.11.2011","15.11.2011",2011,11,15,0.833461146,3
"ENG_062_MZB_LO_2041","ENG_062_MZB_LO_2041-06.11.2012","06.11.2012",2012,11,6,0.958793948,2
"ENG_062_MZB_LO_2041","ENG_062_MZB_LO_2041-22.11.2013","22.11.2013",2013,11,22,0.97446835,1
"ENG_062_MZB_LO_2041","ENG_062_MZB_LO_2041-09.09.2015","09.09.2015",2015,9,9,0.987859118,1
"ENG_062_MZB_LO_2041","ENG_062_MZB_LO_2041-16.10.2018","16.10.2018",2018,10,16,0.937564491,2
"ENG_062_MZB_LO_2041","ENG_062_MZB_LO_2041-12.10.2021","12.10.2021",2021,10,12,0.929434042,2
"ENG_062_MZB_LO_2041","ENG_062_MZB_LO_2041-26.10.2022","26.10.2022",2022,10,26,0.631669131,5
"ENG_062_MZB_LO_2041","ENG_062_MZB_LO_2041-09.10.2023","09.10.2023",2023,10,9,0.897645798,2
"ENG_062_MZB_LO_2043","ENG_062_MZB_LO_2043-28.11.2002","28.11.2002",2002,11,28,0.888283451,2
"ENG_062_MZB_LO_2043","ENG_062_MZB_LO_2043-30.09.2005","30.09.2005",2005,9,30,0.834006889,3
"ENG_062_MZB_LO_2043","ENG_062_MZB_LO_2043-22.10.2008","22.10.2008",2008,10,22,0.7817197,3
"ENG_062_MZB_LO_2043","ENG_062_MZB_LO_2043-08.09.2011","08.09.2011",2011,9,8,0.723123393,3
"ENG_062_MZB_LO_2043","ENG_062_MZB_LO_2043-14.11.2012","14.11.2012",2012,11,14,0.784405215,3
"ENG_062_MZB_LO_2043","ENG_062_MZB_LO_2043-18.11.2015","18.11.2015",2015,11,18,0.887559002,2
"ENG_062_MZB_LO_2043","ENG_062_MZB_LO_2043-24.10.2018","24.10.2018",2018,10,24,1.036278116,1
"ENG_062_MZB_LO_2044","ENG_062_MZB_LO_2044-15.10.2002","15.10.2002",2002,10,15,0.65771692,4
"ENG_062_MZB_LO_2044","ENG_062_MZB_LO_2044-21.10.2003","21.10.2003",2003,10,21,0.709022533,4
"ENG_062_MZB_LO_2044","ENG_062_MZB_LO_2044-12.10.2005","12.10.2005",2005,10,12,0.67180875,5
"ENG_062_MZB_LO_2044","ENG_062_MZB_LO_2044-04.10.2006","04.10.2006",2006,10,4,0.738677273,4
"ENG_062_MZB_LO_2044","ENG_062_MZB_LO_2044-08.10.2009","08.10.2009",2009,10,8,0.896535375,3
"ENG_062_MZB_LO_2044","ENG_062_MZB_LO_2044-03.09.2013","03.09.2013",2013,9,3,0.729635422,3
"ENG_062_MZB_LO_2044","ENG_062_MZB_LO_2044-01.09.2016","01.09.2016",2016,9,1,0.836885537,3
"ENG_062_MZB_LO_2045","ENG_062_MZB_LO_2045-08.11.2002","08.11.2002",2002,11,8,0.895089516,3
"ENG_062_MZB_LO_2045","ENG_062_MZB_LO_2045-10.10.2003","10.10.2003",2003,10,10,0.811127802,3
"ENG_062_MZB_LO_2045","ENG_062_MZB_LO_2045-19.09.2005","19.09.2005",2005,9,19,0.921863835,3
"ENG_062_MZB_LO_2045","ENG_062_MZB_LO_2045-08.11.2006","08.11.2006",2006,11,8,0.822098677,3
"ENG_062_MZB_LO_2045","ENG_062_MZB_LO_2045-06.10.2009","06.10.2009",2009,10,6,0.966598827,2
"ENG_062_MZB_LO_2045","ENG_062_MZB_LO_2045-12.10.2011","12.10.2011",2011,10,12,0.922824376,2
"ENG_062_MZB_LO_2045","ENG_062_MZB_LO_2045-09.09.2013","09.09.2013",2013,9,9,0.983892533,4
"ENG_062_MZB_LO_2045","ENG_062_MZB_LO_2045-05.10.2016","05.10.2016",2016,10,5,1.003277617,3
"ENG_062_MZB_LO_2047","ENG_062_MZB_LO_2047-30.09.2003","30.09.2003",2003,9,30,0.993783845,1
"ENG_062_MZB_LO_2047","ENG_062_MZB_LO_2047-07.09.2006","07.09.2006",2006,9,7,1.009123414,1
"ENG_062_MZB_LO_2047","ENG_062_MZB_LO_2047-22.10.2009","22.10.2009",2009,10,22,0.960163804,2
"ENG_062_MZB_LO_2047","ENG_062_MZB_LO_2047-27.09.2010","27.09.2010",2010,9,27,0.900599718,2
"ENG_062_MZB_LO_2047","ENG_062_MZB_LO_2047-20.10.2011","20.10.2011",2011,10,20,0.911158842,2
"ENG_062_MZB_LO_2047","ENG_062_MZB_LO_2047-30.10.2012","30.10.2012",2012,10,30,0.857463259,3
"ENG_062_MZB_LO_2047","ENG_062_MZB_LO_2047-23.09.2015","23.09.2015",2015,9,23,1.125776671,1
"ENG_062_MZB_LO_2048","ENG_062_MZB_LO_2048-28.10.2003","28.10.2003",2003,10,28,0.858942172,3
"ENG_062_MZB_LO_2048","ENG_062_MZB_LO_2048-10.11.2004","10.11.2004",2004,11,10,0.810228267,3
"ENG_062_MZB_LO_2048","ENG_062_MZB_LO_2048-03.11.2006","03.11.2006",2006,11,3,0.865373935,2
"ENG_062_MZB_LO_2048","ENG_062_MZB_LO_2048-23.10.2007","23.10.2007",2007,10,23,0.867453889,2
"ENG_062_MZB_LO_2048","ENG_062_MZB_LO_2048-05.11.2010","05.11.2010",2010,11,5,0.904122246,2
"ENG_062_MZB_LO_2048","ENG_062_MZB_LO_2048-04.10.2016","04.10.2016",2016,10,4,0.906520598,2
"ENG_062_MZB_LO_2048","ENG_062_MZB_LO_2048-27.10.2017","27.10.2017",2017,10,27,0.918879393,2
"ENG_062_MZB_LO_2052","ENG_062_MZB_LO_2052-30.10.2003","30.10.2003",2003,10,30,0.658197254,4
"ENG_062_MZB_LO_2052","ENG_062_MZB_LO_2052-08.11.2004","08.11.2004",2004,11,8,0.677378999,4
"ENG_062_MZB_LO_2052","ENG_062_MZB_LO_2052-15.09.2005","15.09.2005",2005,9,15,0.659890787,5
"ENG_062_MZB_LO_2052","ENG_062_MZB_LO_2052-08.10.2007","08.10.2007",2007,10,8,0.670570797,4
"ENG_062_MZB_LO_2052","ENG_062_MZB_LO_2052-23.10.2008","23.10.2008",2008,10,23,0.805107084,3
"ENG_062_MZB_LO_2052","ENG_062_MZB_LO_2052-21.11.2009","21.11.2009",2009,11,21,0.648855621,4
"ENG_062_MZB_LO_2052","ENG_062_MZB_LO_2052-19.10.2010","19.10.2010",2010,10,19,0.664244852,5
"ENG_062_MZB_LO_2052","ENG_062_MZB_LO_2052-11.10.2011","11.10.2011",2011,10,11,0.665002649,4
"ENG_062_MZB_LO_2052","ENG_062_MZB_LO_2052-20.11.2012","20.11.2012",2012,11,20,0.646953915,4
"ENG_062_MZB_LO_2052","ENG_062_MZB_LO_2052-14.10.2013","14.10.2013",2013,10,14,0.660906388,4
"ENG_062_MZB_LO_2052","ENG_062_MZB_LO_2052-20.10.2014","20.10.2014",2014,10,20,0.797923856,5
"ENG_062_MZB_LO_2052","ENG_062_MZB_LO_2052-10.09.2015","10.09.2015",2015,9,10,0.67359457,4
"ENG_062_MZB_LO_2052","ENG_062_MZB_LO_2052-15.09.2017","15.09.2017",2017,9,15,0.679956291,4
"ENG_062_MZB_LO_2052","ENG_062_MZB_LO_2052-15.10.2018","15.10.2018",2018,10,15,0.773636338,3
"ENG_062_MZB_LO_2052","ENG_062_MZB_LO_2052-25.09.2019","25.09.2019",2019,9,25,0.771740696,3
"ENG_062_MZB_LO_2052","ENG_062_MZB_LO_2052-30.09.2020","30.09.2020",2020,9,30,0.726747517,4
"ENG_062_MZB_LO_2052","ENG_062_MZB_LO_2052-22.10.2021","22.10.2021",2021,10,22,0.75347101,3
"ENG_062_MZB_LO_2053","ENG_062_MZB_LO_2053-30.09.2003","30.09.2003",2003,9,30,0.86984334,2
"ENG_062_MZB_LO_2053","ENG_062_MZB_LO_2053-01.11.2006","01.11.2006",2006,11,1,0.863310072,3
"ENG_062_MZB_LO_2053","ENG_062_MZB_LO_2053-27.11.2008","27.11.2008",2008,11,27,0.833651905,3
"ENG_062_MZB_LO_2053","ENG_062_MZB_LO_2053-14.10.2009","14.10.2009",2009,10,14,0.953741588,2
"ENG_062_MZB_LO_2053","ENG_062_MZB_LO_2053-15.10.2013","15.10.2013",2013,10,15,1.003140905,1
"ENG_062_MZB_LO_2053","ENG_062_MZB_LO_2053-07.10.2014","07.10.2014",2014,10,7,0.946051795,2
"ENG_062_MZB_LO_2053","ENG_062_MZB_LO_2053-22.10.2018","22.10.2018",2018,10,22,0.987982274,1
"ENG_062_MZB_LO_2054","ENG_062_MZB_LO_2054-07.10.2005","07.10.2005",2005,10,7,1.078726364,1
"ENG_062_MZB_LO_2054","ENG_062_MZB_LO_2054-15.10.2008","15.10.2008",2008,10,15,1.036812449,2
"ENG_062_MZB_LO_2054","ENG_062_MZB_LO_2054-20.10.2009","20.10.2009",2009,10,20,1.140366784,1
"ENG_062_MZB_LO_2054","ENG_062_MZB_LO_2054-20.09.2010","20.09.2010",2010,9,20,1.054311622,1
"ENG_062_MZB_LO_2054","ENG_062_MZB_LO_2054-01.11.2011","01.11.2011",2011,11,1,0.985635116,1
"ENG_062_MZB_LO_2054","ENG_062_MZB_LO_2054-09.10.2012","09.10.2012",2012,10,9,1.004826198,1
"ENG_062_MZB_LO_2054","ENG_062_MZB_LO_2054-20.11.2013","20.11.2013",2013,11,20,0.938594535,2
"ENG_062_MZB_LO_2054","ENG_062_MZB_LO_2054-03.10.2014","03.10.2014",2014,10,3,1.026610525,1
"ENG_062_MZB_LO_2054","ENG_062_MZB_LO_2054-06.10.2015","06.10.2015",2015,10,6,0.904112833,2
"ENG_062_MZB_LO_2054","ENG_062_MZB_LO_2054-21.09.2016","21.09.2016",2016,9,21,1.041062044,1
"ENG_062_MZB_LO_2054","ENG_062_MZB_LO_2054-09.10.2017","09.10.2017",2017,10,9,0.888410537,2
"ENG_062_MZB_LO_2054","ENG_062_MZB_LO_2054-16.10.2018","16.10.2018",2018,10,16,0.942166994,2
"ENG_062_MZB_LO_2054","ENG_062_MZB_LO_2054-22.11.2019","22.11.2019",2019,11,22,0.94709572,2
"ENG_062_MZB_LO_2055","ENG_062_MZB_LO_2055-17.09.2003","17.09.2003",2003,9,17,0.752945687,4
"ENG_062_MZB_LO_2055","ENG_062_MZB_LO_2055-20.10.2006","20.10.2006",2006,10,20,0.692358459,4
"ENG_062_MZB_LO_2055","ENG_062_MZB_LO_2055-15.10.2007","15.10.2007",2007,10,15,0.712590667,4
"ENG_062_MZB_LO_2055","ENG_062_MZB_LO_2055-01.10.2008","01.10.2008",2008,10,1,0.706697994,4
"ENG_062_MZB_LO_2055","ENG_062_MZB_LO_2055-06.10.2009","06.10.2009",2009,10,6,0.695426795,4
"ENG_062_MZB_LO_2055","ENG_062_MZB_LO_2055-15.09.2010","15.09.2010",2010,9,15,0.667483833,4
"ENG_062_MZB_LO_2055","ENG_062_MZB_LO_2055-20.09.2011","20.09.2011",2011,9,20,0.662397993,4
"ENG_062_MZB_LO_2055","ENG_062_MZB_LO_2055-19.09.2012","19.09.2012",2012,9,19,0.630244659,4
"ENG_062_MZB_LO_2055","ENG_062_MZB_LO_2055-09.10.2013","09.10.2013",2013,10,9,0.645810647,4
"ENG_062_MZB_LO_2055","ENG_062_MZB_LO_2055-01.09.2014","01.09.2014",2014,9,1,0.641407823,4
"ENG_062_MZB_LO_2055","ENG_062_MZB_LO_2055-12.10.2015","12.10.2015",2015,10,12,0.704932275,4
"ENG_062_MZB_LO_2055","ENG_062_MZB_LO_2055-05.10.2016","05.10.2016",2016,10,5,0.622527768,4
"ENG_062_MZB_LO_2055","ENG_062_MZB_LO_2055-05.10.2017","05.10.2017",2017,10,5,0.608491331,4
"ENG_062_MZB_LO_2055","ENG_062_MZB_LO_2055-23.10.2018","23.10.2018",2018,10,23,0.600929285,4
"ENG_062_MZB_LO_2055","ENG_062_MZB_LO_2055-14.10.2019","14.10.2019",2019,10,14,0.580916862,5
"ENG_062_MZB_LO_2055","ENG_062_MZB_LO_2055-17.09.2020","17.09.2020",2020,9,17,0.654648247,4
"ENG_062_MZB_LO_2055","ENG_062_MZB_LO_2055-08.09.2021","08.09.2021",2021,9,8,0.691573566,4
"ENG_062_MZB_LO_2056","ENG_062_MZB_LO_2056-14.10.2008","14.10.2008",2008,10,14,0.860815251,3
"ENG_062_MZB_LO_2056","ENG_062_MZB_LO_2056-15.10.2009","15.10.2009",2009,10,15,0.894764133,2
"ENG_062_MZB_LO_2056","ENG_062_MZB_LO_2056-06.10.2010","06.10.2010",2010,10,6,0.937530976,2
"ENG_062_MZB_LO_2056","ENG_062_MZB_LO_2056-14.10.2011","14.10.2011",2011,10,14,0.870004492,2
"ENG_062_MZB_LO_2056","ENG_062_MZB_LO_2056-08.11.2012","08.11.2012",2012,11,8,0.628911169,5
"ENG_062_MZB_LO_2056","ENG_062_MZB_LO_2056-06.11.2013","06.11.2013",2013,11,6,0.826184758,3
"ENG_062_MZB_LO_2056","ENG_062_MZB_LO_2056-15.09.2014","15.09.2014",2014,9,15,0.869261928,2
"ENG_062_MZB_LO_2056","ENG_062_MZB_LO_2056-05.10.2015","05.10.2015",2015,10,5,0.712704882,5
"ENG_062_MZB_LO_2056","ENG_062_MZB_LO_2056-07.09.2016","07.09.2016",2016,9,7,0.670294794,4
"ENG_062_MZB_LO_2056","ENG_062_MZB_LO_2056-18.09.2017","18.09.2017",2017,9,18,0.767621669,3
"ENG_062_MZB_LO_2056","ENG_062_MZB_LO_2056-25.10.2018","25.10.2018",2018,10,25,0.873365562,2
"ENG_062_MZB_LO_2056","ENG_062_MZB_LO_2056-05.11.2019","05.11.2019",2019,11,5,0.760049406,3
"ENG_062_MZB_LO_2056","ENG_062_MZB_LO_2056-14.09.2020","14.09.2020",2020,9,14,0.829458532,4
"ENG_062_MZB_LO_2056","ENG_062_MZB_LO_2056-09.09.2021","09.09.2021",2021,9,9,0.925693954,2
"ENG_062_MZB_LO_2060","ENG_062_MZB_LO_2060-12.11.2003","12.11.2003",2003,11,12,0.874268799,2
"ENG_062_MZB_LO_2060","ENG_062_MZB_LO_2060-14.11.2006","14.11.2006",2006,11,14,0.869208512,3
"ENG_062_MZB_LO_2060","ENG_062_MZB_LO_2060-20.09.2007","20.09.2007",2007,9,20,0.85785913,3
"ENG_062_MZB_LO_2060","ENG_062_MZB_LO_2060-21.10.2009","21.10.2009",2009,10,21,1.002925378,1
"ENG_062_MZB_LO_2060","ENG_062_MZB_LO_2060-22.10.2010","22.10.2010",2010,10,22,0.973230613,1
"ENG_062_MZB_LO_2060","ENG_062_MZB_LO_2060-19.10.2011","19.10.2011",2011,10,19,0.817320174,3
"ENG_062_MZB_LO_2060","ENG_062_MZB_LO_2060-07.09.2012","07.09.2012",2012,9,7,1.063291323,1
"ENG_062_MZB_LO_2060","ENG_062_MZB_LO_2060-13.11.2013","13.11.2013",2013,11,13,0.921208916,2
"ENG_062_MZB_LO_2060","ENG_062_MZB_LO_2060-21.09.2016","21.09.2016",2016,9,21,1.010127808,1
"ENG_062_MZB_LO_2064","ENG_062_MZB_LO_2064-28.11.2002","28.11.2002",2002,11,28,0.96519561,2
"ENG_062_MZB_LO_2064","ENG_062_MZB_LO_2064-01.10.2003","01.10.2003",2003,10,1,1.087724942,1
"ENG_062_MZB_LO_2064","ENG_062_MZB_LO_2064-22.09.2004","22.09.2004",2004,9,22,1.050917339,1
"ENG_062_MZB_LO_2064","ENG_062_MZB_LO_2064-11.10.2005","11.10.2005",2005,10,11,1.059573986,1
"ENG_062_MZB_LO_2064","ENG_062_MZB_LO_2064-18.10.2006","18.10.2006",2006,10,18,0.94486603,2
"ENG_062_MZB_LO_2064","ENG_062_MZB_LO_2064-08.10.2007","08.10.2007",2007,10,8,1.125758317,1
"ENG_062_MZB_LO_2064","ENG_062_MZB_LO_2064-13.10.2008","13.10.2008",2008,10,13,0.986586322,2
"ENG_062_MZB_LO_2064","ENG_062_MZB_LO_2064-30.09.2009","30.09.2009",2009,9,30,0.907405069,2
"ENG_062_MZB_LO_2064","ENG_062_MZB_LO_2064-16.09.2013","16.09.2013",2013,9,16,0.987381003,1
"ENG_062_MZB_LO_2064","ENG_062_MZB_LO_2064-11.09.2015","11.09.2015",2015,9,11,1.036401645,1
"ENG_062_MZB_LO_2065","ENG_062_MZB_LO_2065-21.10.2003","21.10.2003",2003,10,21,0.837518537,3
"ENG_062_MZB_LO_2065","ENG_062_MZB_LO_2065-03.11.2004","03.11.2004",2004,11,3,0.68962585,5
"ENG_062_MZB_LO_2065","ENG_062_MZB_LO_2065-02.09.2005","02.09.2005",2005,9,2,0.876788841,2
"ENG_062_MZB_LO_2065","ENG_062_MZB_LO_2065-21.09.2006","21.09.2006",2006,9,21,0.818082074,3
"ENG_062_MZB_LO_2065","ENG_062_MZB_LO_2065-23.11.2007","23.11.2007",2007,11,23,0.97311898,1
"ENG_062_MZB_LO_2065","ENG_062_MZB_LO_2065-17.11.2008","17.11.2008",2008,11,17,0.935441084,2
"ENG_062_MZB_LO_2065","ENG_062_MZB_LO_2065-10.11.2009","10.11.2009",2009,11,10,0.957472165,2
"ENG_062_MZB_LO_2065","ENG_062_MZB_LO_2065-02.11.2010","02.11.2010",2010,11,2,0.901090016,2
"ENG_062_MZB_LO_2065","ENG_062_MZB_LO_2065-09.11.2011","09.11.2011",2011,11,9,0.973281244,3
"ENG_062_MZB_LO_2065","ENG_062_MZB_LO_2065-16.11.2012","16.11.2012",2012,11,16,0.883544256,3
"ENG_062_MZB_LO_2065","ENG_062_MZB_LO_2065-28.10.2014","28.10.2014",2014,10,28,0.937984612,2
"ENG_062_MZB_LO_2066","ENG_062_MZB_LO_2066-17.11.2004","17.11.2004",2004,11,17,0.890879489,3
"ENG_062_MZB_LO_2066","ENG_062_MZB_LO_2066-24.10.2007","24.10.2007",2007,10,24,0.949119497,2
"ENG_062_MZB_LO_2066","ENG_062_MZB_LO_2066-19.09.2008","19.09.2008",2008,9,19,0.981261065,1
"ENG_062_MZB_LO_2066","ENG_062_MZB_LO_2066-20.10.2009","20.10.2009",2009,10,20,0.961454301,2
"ENG_062_MZB_LO_2066","ENG_062_MZB_LO_2066-25.10.2010","25.10.2010",2010,10,25,1.019620628,1
"ENG_062_MZB_LO_2066","ENG_062_MZB_LO_2066-14.09.2011","14.09.2011",2011,9,14,0.919927247,2
"ENG_062_MZB_LO_2066","ENG_062_MZB_LO_2066-09.10.2012","09.10.2012",2012,10,9,1.019792285,1
"ENG_062_MZB_LO_2066","ENG_062_MZB_LO_2066-09.09.2013","09.09.2013",2013,9,9,1.064736082,1
"ENG_062_MZB_LO_2066","ENG_062_MZB_LO_2066-08.10.2014","08.10.2014",2014,10,8,1.049009101,1
"ENG_062_MZB_LO_2066","ENG_062_MZB_LO_2066-14.10.2015","14.10.2015",2015,10,14,1.027225866,1
"ENG_062_MZB_LO_2066","ENG_062_MZB_LO_2066-06.09.2016","06.09.2016",2016,9,6,0.975936502,1
"ENG_062_MZB_LO_2066","ENG_062_MZB_LO_2066-07.11.2017","07.11.2017",2017,11,7,1.018054046,1
"ENG_062_MZB_LO_2066","ENG_062_MZB_LO_2066-08.11.2018","08.11.2018",2018,11,8,1.055364423,1
"ENG_062_MZB_LO_2066","ENG_062_MZB_LO_2066-29.10.2020","29.10.2020",2020,10,29,1.090335049,1
"ENG_062_MZB_LO_2066","ENG_062_MZB_LO_2066-17.11.2021","17.11.2021",2021,11,17,1.089811566,1
"ENG_062_MZB_LO_2066","ENG_062_MZB_LO_2066-21.09.2022","21.09.2022",2022,9,21,0.917474638,2
"ENG_062_MZB_LO_2066","ENG_062_MZB_LO_2066-01.09.2023","01.09.2023",2023,9,1,1.000153525,1
"ENG_062_MZB_LO_2066","ENG_062_MZB_LO_2066-08.11.2024","08.11.2024",2024,11,8,0.82789132,3
"ENG_062_MZB_LO_2067","ENG_062_MZB_LO_2067-26.09.2002","26.09.2002",2002,9,26,0.90096832,2
"ENG_062_MZB_LO_2067","ENG_062_MZB_LO_2067-19.11.2003","19.11.2003",2003,11,19,0.883394681,2
"ENG_062_MZB_LO_2067","ENG_062_MZB_LO_2067-13.10.2006","13.10.2006",2006,10,13,0.848199355,3
"ENG_062_MZB_LO_2067","ENG_062_MZB_LO_2067-06.11.2007","06.11.2007",2007,11,6,0.938107548,2
"ENG_062_MZB_LO_2067","ENG_062_MZB_LO_2067-16.09.2008","16.09.2008",2008,9,16,0.927970961,2
"ENG_062_MZB_LO_2067","ENG_062_MZB_LO_2067-28.10.2009","28.10.2009",2009,10,28,0.974424742,1
"ENG_062_MZB_LO_2067","ENG_062_MZB_LO_2067-22.10.2010","22.10.2010",2010,10,22,0.932085753,2
"ENG_062_MZB_LO_2067","ENG_062_MZB_LO_2067-19.09.2011","19.09.2011",2011,9,19,0.860677531,3
"ENG_062_MZB_LO_2067","ENG_062_MZB_LO_2067-03.09.2012","03.09.2012",2012,9,3,0.867657413,3
"ENG_062_MZB_LO_2067","ENG_062_MZB_LO_2067-10.09.2013","10.09.2013",2013,9,10,0.979257949,2
"ENG_062_MZB_LO_2067","ENG_062_MZB_LO_2067-03.09.2014","03.09.2014",2014,9,3,0.915274329,2
"ENG_062_MZB_LO_2067","ENG_062_MZB_LO_2067-09.09.2015","09.09.2015",2015,9,9,0.969527376,2
"ENG_062_MZB_LO_2067","ENG_062_MZB_LO_2067-19.09.2016","19.09.2016",2016,9,19,0.902929686,2
"ENG_062_MZB_LO_2067","ENG_062_MZB_LO_2067-16.11.2017","16.11.2017",2017,11,16,1.045774433,1
"ENG_062_MZB_LO_2067","ENG_062_MZB_LO_2067-24.09.2018","24.09.2018",2018,9,24,0.949110996,2
"ENG_062_MZB_LO_2067","ENG_062_MZB_LO_2067-22.09.2020","22.09.2020",2020,9,22,1.092897377,1
"ENG_062_MZB_LO_2067","ENG_062_MZB_LO_2067-02.11.2021","02.11.2021",2021,11,2,1.050778148,1
"ENG_062_MZB_LO_2067","ENG_062_MZB_LO_2067-06.09.2022","06.09.2022",2022,9,6,1.118796553,1
"ENG_062_MZB_LO_2067","ENG_062_MZB_LO_2067-06.10.2023","06.10.2023",2023,10,6,1.017497674,1
"ENG_062_MZB_LO_2067","ENG_062_MZB_LO_2067-23.10.2024","23.10.2024",2024,10,23,1.015138223,1
"ENG_062_MZB_LO_2070","ENG_062_MZB_LO_2070-28.11.2002","28.11.2002",2002,11,28,0.987352296,1
"ENG_062_MZB_LO_2070","ENG_062_MZB_LO_2070-30.09.2005","30.09.2005",2005,9,30,1.026765625,1
"ENG_062_MZB_LO_2070","ENG_062_MZB_LO_2070-07.09.2010","07.09.2010",2010,9,7,0.969528986,1
"ENG_062_MZB_LO_2070","ENG_062_MZB_LO_2070-18.10.2011","18.10.2011",2011,10,18,0.987816496,1
"ENG_062_MZB_LO_2070","ENG_062_MZB_LO_2070-18.09.2012","18.09.2012",2012,9,18,1.012339458,1
"ENG_062_MZB_LO_2070","ENG_062_MZB_LO_2070-15.10.2013","15.10.2013",2013,10,15,1.00044027,1
"ENG_062_MZB_LO_2070","ENG_062_MZB_LO_2070-16.09.2014","16.09.2014",2014,9,16,1.126455126,1
"ENG_062_MZB_LO_2070","ENG_062_MZB_LO_2070-06.10.2015","06.10.2015",2015,10,6,1.090506774,1
"ENG_062_MZB_LO_2070","ENG_062_MZB_LO_2070-18.10.2016","18.10.2016",2016,10,18,1.183125845,1
"ENG_062_MZB_LO_2070","ENG_062_MZB_LO_2070-02.10.2017","02.10.2017",2017,10,2,1.077333126,1
"ENG_062_MZB_LO_2070","ENG_062_MZB_LO_2070-23.10.2018","23.10.2018",2018,10,23,1.041153174,1
"ENG_062_MZB_LO_2070","ENG_062_MZB_LO_2070-16.09.2019","16.09.2019",2019,9,16,1.057748764,1
"ENG_062_MZB_LO_2070","ENG_062_MZB_LO_2070-29.09.2020","29.09.2020",2020,9,29,1.080780028,1
"ENG_062_MZB_LO_2070","ENG_062_MZB_LO_2070-20.10.2021","20.10.2021",2021,10,20,1.068280304,1
"ENG_062_MZB_LO_2076","ENG_062_MZB_LO_2076-23.04.2002","23.04.2002",2002,4,23,0.584269135,5
"ENG_062_MZB_LO_2076","ENG_062_MZB_LO_2076-15.05.2003","15.05.2003",2003,5,15,0.579457353,5
"ENG_062_MZB_LO_2076","ENG_062_MZB_LO_2076-02.05.2006","02.05.2006",2006,5,2,0.569068015,5
"ENG_062_MZB_LO_2076","ENG_062_MZB_LO_2076-13.05.2009","13.05.2009",2009,5,13,0.593678639,5
"ENG_062_MZB_LO_2076","ENG_062_MZB_LO_2076-29.04.2010","29.04.2010",2010,4,29,0.508622117,5
"ENG_062_MZB_LO_2076","ENG_062_MZB_LO_2076-31.05.2012","31.05.2012",2012,5,31,0.532879102,5
"ENG_062_MZB_LO_2076","ENG_062_MZB_LO_2076-10.03.2014","10.03.2014",2014,3,10,0.642409893,4
"ENG_062_MZB_LO_2077","ENG_062_MZB_LO_2077-26.11.2002","26.11.2002",2002,11,26,1.032904658,1
"ENG_062_MZB_LO_2077","ENG_062_MZB_LO_2077-21.11.2003","21.11.2003",2003,11,21,1.051053633,1
"ENG_062_MZB_LO_2077","ENG_062_MZB_LO_2077-10.11.2004","10.11.2004",2004,11,10,1.125126373,1
"ENG_062_MZB_LO_2077","ENG_062_MZB_LO_2077-22.11.2005","22.11.2005",2005,11,22,1.136019357,1
"ENG_062_MZB_LO_2077","ENG_062_MZB_LO_2077-23.10.2007","23.10.2007",2007,10,23,1.12362334,1
"ENG_062_MZB_LO_2077","ENG_062_MZB_LO_2077-18.11.2008","18.11.2008",2008,11,18,1.062937919,1
"ENG_062_MZB_LO_2077","ENG_062_MZB_LO_2077-04.10.2011","04.10.2011",2011,10,4,1.099498795,1
"ENG_062_MZB_LO_2077","ENG_062_MZB_LO_2077-06.11.2012","06.11.2012",2012,11,6,1.049151198,1
"ENG_062_MZB_LO_2077","ENG_062_MZB_LO_2077-10.09.2013","10.09.2013",2013,9,10,1.058132076,1
"ENG_062_MZB_LO_2079","ENG_062_MZB_LO_2079-01.10.2003","01.10.2003",2003,10,1,0.888773149,2
"ENG_062_MZB_LO_2079","ENG_062_MZB_LO_2079-22.09.2004","22.09.2004",2004,9,22,0.894449791,2
"ENG_062_MZB_LO_2079","ENG_062_MZB_LO_2079-11.10.2005","11.10.2005",2005,10,11,0.953391509,2
"ENG_062_MZB_LO_2079","ENG_062_MZB_LO_2079-18.10.2006","18.10.2006",2006,10,18,1.003856863,1
"ENG_062_MZB_LO_2079","ENG_062_MZB_LO_2079-08.10.2007","08.10.2007",2007,10,8,0.882518142,2
"ENG_062_MZB_LO_2079","ENG_062_MZB_LO_2079-13.10.2008","13.10.2008",2008,10,13,0.983580817,1
"ENG_062_MZB_LO_2079","ENG_062_MZB_LO_2079-30.09.2009","30.09.2009",2009,9,30,0.93091156,2
"ENG_062_MZB_LO_2079","ENG_062_MZB_LO_2079-25.10.2010","25.10.2010",2010,10,25,0.91028703,2
"ENG_062_MZB_LO_2079","ENG_062_MZB_LO_2079-08.09.2011","08.09.2011",2011,9,8,0.937827275,2
"ENG_062_MZB_LO_2079","ENG_062_MZB_LO_2079-20.09.2012","20.09.2012",2012,9,20,0.99682382,1
"ENG_062_MZB_LO_2079","ENG_062_MZB_LO_2079-16.10.2013","16.10.2013",2013,10,16,0.901232034,2
"ENG_062_MZB_LO_2079","ENG_062_MZB_LO_2079-13.11.2014","13.11.2014",2014,11,13,0.915949322,2
"ENG_062_MZB_LO_2079","ENG_062_MZB_LO_2079-11.09.2015","11.09.2015",2015,9,11,0.852261766,3
"ENG_062_MZB_LO_2079","ENG_062_MZB_LO_2079-01.11.2016","01.11.2016",2016,11,1,0.946251832,2
"ENG_062_MZB_LO_2079","ENG_062_MZB_LO_2079-07.11.2017","07.11.2017",2017,11,7,0.966601502,1
"ENG_062_MZB_LO_2079","ENG_062_MZB_LO_2079-18.10.2022","18.10.2022",2022,10,18,0.979801324,1
"ENG_062_MZB_LO_2079","ENG_062_MZB_LO_2079-05.10.2023","05.10.2023",2023,10,5,0.865611565,3
"ENG_062_MZB_LO_2079","ENG_062_MZB_LO_2079-08.11.2024","08.11.2024",2024,11,8,1.07856591,1
"ENG_062_MZB_LO_2082","ENG_062_MZB_LO_2082-19.09.2002","19.09.2002",2002,9,19,0.990116901,2
"ENG_062_MZB_LO_2082","ENG_062_MZB_LO_2082-05.11.2004","05.11.2004",2004,11,5,1.026202112,1
"ENG_062_MZB_LO_2082","ENG_062_MZB_LO_2082-28.09.2010","28.09.2010",2010,9,28,1.081154407,1
"ENG_062_MZB_LO_2082","ENG_062_MZB_LO_2082-06.10.2011","06.10.2011",2011,10,6,1.097223684,1
"ENG_062_MZB_LO_2082","ENG_062_MZB_LO_2082-13.11.2012","13.11.2012",2012,11,13,1.099648236,1
"ENG_062_MZB_LO_2082","ENG_062_MZB_LO_2082-07.10.2013","07.10.2013",2013,10,7,1.079500327,1
"ENG_062_MZB_LO_2082","ENG_062_MZB_LO_2082-08.10.2014","08.10.2014",2014,10,8,1.135744408,1
"ENG_062_MZB_LO_2082","ENG_062_MZB_LO_2082-16.10.2015","16.10.2015",2015,10,16,1.034549341,1
"ENG_062_MZB_LO_2082","ENG_062_MZB_LO_2082-26.10.2016","26.10.2016",2016,10,26,1.119055596,1
"ENG_062_MZB_LO_2082","ENG_062_MZB_LO_2082-30.10.2017","30.10.2017",2017,10,30,1.103651009,1
"ENG_062_MZB_LO_2082","ENG_062_MZB_LO_2082-13.11.2018","13.11.2018",2018,11,13,1.032556154,1
"ENG_062_MZB_LO_2082","ENG_062_MZB_LO_2082-12.09.2019","12.09.2019",2019,9,12,1.101938394,1
"ENG_062_MZB_LO_2082","ENG_062_MZB_LO_2082-14.10.2020","14.10.2020",2020,10,14,0.900201948,4
"ENG_062_MZB_LO_2082","ENG_062_MZB_LO_2082-11.11.2021","11.11.2021",2021,11,11,1.057739145,1
"ENG_062_MZB_LO_2082","ENG_062_MZB_LO_2082-10.10.2022","10.10.2022",2022,10,10,0.963223175,3
"ENG_062_MZB_LO_2082","ENG_062_MZB_LO_2082-15.09.2023","15.09.2023",2023,9,15,1.000278771,2
"ENG_062_MZB_LO_2082","ENG_062_MZB_LO_2082-06.11.2024","06.11.2024",2024,11,6,1.031463768,1
"ENG_062_MZB_LO_2083","ENG_062_MZB_LO_2083-16.09.2004","16.09.2004",2004,9,16,0.953994942,2
"ENG_062_MZB_LO_2083","ENG_062_MZB_LO_2083-13.11.2006","13.11.2006",2006,11,13,0.933801961,2
"ENG_062_MZB_LO_2083","ENG_062_MZB_LO_2083-09.10.2007","09.10.2007",2007,10,9,0.934219888,2
"ENG_062_MZB_LO_2083","ENG_062_MZB_LO_2083-22.10.2008","22.10.2008",2008,10,22,0.881672522,2
"ENG_062_MZB_LO_2083","ENG_062_MZB_LO_2083-22.09.2009","22.09.2009",2009,9,22,0.956860855,2
"ENG_062_MZB_LO_2083","ENG_062_MZB_LO_2083-08.09.2010","08.09.2010",2010,9,8,1.005425093,1
"ENG_062_MZB_LO_2083","ENG_062_MZB_LO_2083-10.09.2014","10.09.2014",2014,9,10,0.989721361,1
"ENG_062_MZB_LO_2086","ENG_062_MZB_LO_2086-20.11.2002","20.11.2002",2002,11,20,1.048470011,1
"ENG_062_MZB_LO_2086","ENG_062_MZB_LO_2086-18.09.2003","18.09.2003",2003,9,18,0.999606118,1
"ENG_062_MZB_LO_2086","ENG_062_MZB_LO_2086-04.10.2005","04.10.2005",2005,10,4,1.068016135,1
"ENG_062_MZB_LO_2086","ENG_062_MZB_LO_2086-31.10.2006","31.10.2006",2006,10,31,0.984870987,1
"ENG_062_MZB_LO_2086","ENG_062_MZB_LO_2086-11.10.2007","11.10.2007",2007,10,11,1.016695305,1
"ENG_062_MZB_LO_2086","ENG_062_MZB_LO_2086-27.11.2008","27.11.2008",2008,11,27,1.011377727,1
"ENG_062_MZB_LO_2086","ENG_062_MZB_LO_2086-06.10.2009","06.10.2009",2009,10,6,1.109452032,1
"ENG_062_MZB_LO_2086","ENG_062_MZB_LO_2086-07.09.2010","07.09.2010",2010,9,7,1.113869707,1
"ENG_062_MZB_LO_2086","ENG_062_MZB_LO_2086-21.09.2011","21.09.2011",2011,9,21,1.066003555,1
"ENG_062_MZB_LO_2086","ENG_062_MZB_LO_2086-12.11.2012","12.11.2012",2012,11,12,1.118378142,1
"ENG_062_MZB_LO_2086","ENG_062_MZB_LO_2086-04.09.2013","04.09.2013",2013,9,4,1.135485026,1
"ENG_062_MZB_LO_2086","ENG_062_MZB_LO_2086-11.11.2014","11.11.2014",2014,11,11,1.046005719,1
"ENG_062_MZB_LO_2086","ENG_062_MZB_LO_2086-10.09.2015","10.09.2015",2015,9,10,1.129486425,1
"ENG_062_MZB_LO_2086","ENG_062_MZB_LO_2086-18.10.2016","18.10.2016",2016,10,18,1.105639415,1
"ENG_062_MZB_LO_2086","ENG_062_MZB_LO_2086-03.10.2017","03.10.2017",2017,10,3,1.107087261,1
"ENG_062_MZB_LO_2086","ENG_062_MZB_LO_2086-26.09.2018","26.09.2018",2018,9,26,1.058000693,1
"ENG_062_MZB_LO_2086","ENG_062_MZB_LO_2086-15.09.2020","15.09.2020",2020,9,15,1.148661649,1
"ENG_062_MZB_LO_2086","ENG_062_MZB_LO_2086-14.10.2021","14.10.2021",2021,10,14,1.083598421,1
"ENG_062_MZB_LO_2086","ENG_062_MZB_LO_2086-25.10.2022","25.10.2022",2022,10,25,1.041743645,1
"ENG_062_MZB_LO_2089","ENG_062_MZB_LO_2089-28.11.2002","28.11.2002",2002,11,28,0.969062005,2
"ENG_062_MZB_LO_2089","ENG_062_MZB_LO_2089-11.10.2005","11.10.2005",2005,10,11,0.972774038,1
"ENG_062_MZB_LO_2089","ENG_062_MZB_LO_2089-30.09.2009","30.09.2009",2009,9,30,0.956406201,2
"ENG_062_MZB_LO_2089","ENG_062_MZB_LO_2089-21.10.2010","21.10.2010",2010,10,21,0.875208505,3
"ENG_062_MZB_LO_2089","ENG_062_MZB_LO_2089-08.09.2011","08.09.2011",2011,9,8,0.864125153,3
"ENG_062_MZB_LO_2089","ENG_062_MZB_LO_2089-03.09.2012","03.09.2012",2012,9,3,0.963072227,1
"ENG_062_MZB_LO_2089","ENG_062_MZB_LO_2089-16.09.2013","16.09.2013",2013,9,16,0.992795047,1
"ENG_062_MZB_LO_2089","ENG_062_MZB_LO_2089-12.11.2014","12.11.2014",2014,11,12,1.082940785,1
"ENG_062_MZB_LO_2089","ENG_062_MZB_LO_2089-22.09.2015","22.09.2015",2015,9,22,0.964452104,2
"ENG_062_MZB_LO_2089","ENG_062_MZB_LO_2089-15.11.2016","15.11.2016",2016,11,15,0.950075559,2
"ENG_062_MZB_LO_2089","ENG_062_MZB_LO_2089-07.11.2017","07.11.2017",2017,11,7,0.975363029,1
"ENG_062_MZB_LO_2089","ENG_062_MZB_LO_2089-08.11.2018","08.11.2018",2018,11,8,1.016625254,1
"ENG_062_MZB_LO_2089","ENG_062_MZB_LO_2089-29.10.2020","29.10.2020",2020,10,29,0.837237587,3
"ENG_062_MZB_LO_2089","ENG_062_MZB_LO_2089-17.11.2021","17.11.2021",2021,11,17,0.880410567,3
"ENG_062_MZB_LO_2089","ENG_062_MZB_LO_2089-09.11.2022","09.11.2022",2022,11,9,0.905804962,2
"ENG_062_MZB_LO_2089","ENG_062_MZB_LO_2089-05.10.2023","05.10.2023",2023,10,5,0.938974755,2
"ENG_062_MZB_LO_2089","ENG_062_MZB_LO_2089-08.11.2024","08.11.2024",2024,11,8,1.002038606,1
"ENG_062_MZB_LO_2090","ENG_062_MZB_LO_2090-31.10.2006","31.10.2006",2006,10,31,0.781905689,3
"ENG_062_MZB_LO_2090","ENG_062_MZB_LO_2090-25.10.2007","25.10.2007",2007,10,25,0.787829556,3
"ENG_062_MZB_LO_2090","ENG_062_MZB_LO_2090-07.11.2008","07.11.2008",2008,11,7,0.896426855,2
"ENG_062_MZB_LO_2090","ENG_062_MZB_LO_2090-27.10.2009","27.10.2009",2009,10,27,0.8674507,2
"ENG_062_MZB_LO_2090","ENG_062_MZB_LO_2090-06.09.2010","06.09.2010",2010,9,6,0.799136693,3
"ENG_062_MZB_LO_2090","ENG_062_MZB_LO_2090-26.09.2011","26.09.2011",2011,9,26,0.79189833,3
"ENG_062_MZB_LO_2090","ENG_062_MZB_LO_2090-12.11.2012","12.11.2012",2012,11,12,0.823182283,3
"ENG_062_MZB_LO_2090","ENG_062_MZB_LO_2090-02.09.2014","02.09.2014",2014,9,2,0.830178996,3
"ENG_062_MZB_LO_2090","ENG_062_MZB_LO_2090-02.10.2015","02.10.2015",2015,10,2,0.710513958,4
"ENG_062_MZB_LO_2090","ENG_062_MZB_LO_2090-04.10.2016","04.10.2016",2016,10,4,0.805773126,3
"ENG_062_MZB_LO_2090","ENG_062_MZB_LO_2090-11.10.2017","11.10.2017",2017,10,11,0.800540315,3
"ENG_062_MZB_LO_2090","ENG_062_MZB_LO_2090-17.10.2018","17.10.2018",2018,10,17,0.848554843,3
"ENG_062_MZB_LO_2097","ENG_062_MZB_LO_2097-27.10.2004","27.10.2004",2004,10,27,0.816741422,3
"ENG_062_MZB_LO_2097","ENG_062_MZB_LO_2097-02.11.2007","02.11.2007",2007,11,2,0.843461225,3
"ENG_062_MZB_LO_2097","ENG_062_MZB_LO_2097-04.09.2008","04.09.2008",2008,9,4,0.85280206,3
"ENG_062_MZB_LO_2097","ENG_062_MZB_LO_2097-28.10.2009","28.10.2009",2009,10,28,0.960346913,2
"ENG_062_MZB_LO_2097","ENG_062_MZB_LO_2097-13.09.2010","13.09.2010",2010,9,13,0.984321359,1
"ENG_062_MZB_LO_2097","ENG_062_MZB_LO_2097-15.09.2011","15.09.2011",2011,9,15,0.988830925,1
"ENG_062_MZB_LO_2097","ENG_062_MZB_LO_2097-08.10.2012","08.10.2012",2012,10,8,0.833259941,3
"ENG_062_MZB_LO_2097","ENG_062_MZB_LO_2097-18.10.2013","18.10.2013",2013,10,18,0.87798617,2
"ENG_062_MZB_LO_2097","ENG_062_MZB_LO_2097-24.09.2014","24.09.2014",2014,9,24,0.841843189,3
"ENG_062_MZB_LO_2097","ENG_062_MZB_LO_2097-22.10.2015","22.10.2015",2015,10,22,0.831827899,3
"ENG_062_MZB_LO_2097","ENG_062_MZB_LO_2097-11.11.2016","11.11.2016",2016,11,11,0.872640705,3
"ENG_062_MZB_LO_2097","ENG_062_MZB_LO_2097-16.10.2017","16.10.2017",2017,10,16,0.820755863,3
"ENG_062_MZB_LO_2097","ENG_062_MZB_LO_2097-18.10.2018","18.10.2018",2018,10,18,0.893800471,2
"ENG_062_MZB_LO_2097","ENG_062_MZB_LO_2097-22.10.2019","22.10.2019",2019,10,22,0.838056574,3
"ENG_062_MZB_LO_2097","ENG_062_MZB_LO_2097-19.10.2020","19.10.2020",2020,10,19,0.929222463,2
"ENG_062_MZB_LO_2098","ENG_062_MZB_LO_2098-01.10.2003","01.10.2003",2003,10,1,1.013548124,1
"ENG_062_MZB_LO_2098","ENG_062_MZB_LO_2098-07.10.2004","07.10.2004",2004,10,7,0.994107525,1
"ENG_062_MZB_LO_2098","ENG_062_MZB_LO_2098-24.11.2005","24.11.2005",2005,11,24,0.997882291,1
"ENG_062_MZB_LO_2098","ENG_062_MZB_LO_2098-09.11.2006","09.11.2006",2006,11,9,1.009185769,1
"ENG_062_MZB_LO_2098","ENG_062_MZB_LO_2098-24.09.2008","24.09.2008",2008,9,24,1.094367612,1
"ENG_062_MZB_LO_2098","ENG_062_MZB_LO_2098-21.10.2009","21.10.2009",2009,10,21,0.972939379,1
"ENG_062_MZB_LO_2098","ENG_062_MZB_LO_2098-25.10.2010","25.10.2010",2010,10,25,1.067356204,1
"ENG_062_MZB_LO_2098","ENG_062_MZB_LO_2098-12.09.2011","12.09.2011",2011,9,12,0.896321971,2
"ENG_062_MZB_LO_2098","ENG_062_MZB_LO_2098-20.09.2012","20.09.2012",2012,9,20,0.928716879,2
"ENG_062_MZB_LO_2098","ENG_062_MZB_LO_2098-21.11.2013","21.11.2013",2013,11,21,1.012771493,1
"ENG_062_MZB_LO_2098","ENG_062_MZB_LO_2098-13.11.2014","13.11.2014",2014,11,13,1.013809005,1
"ENG_062_MZB_LO_2098","ENG_062_MZB_LO_2098-16.11.2015","16.11.2015",2015,11,16,1.070344527,1
"ENG_062_MZB_LO_2098","ENG_062_MZB_LO_2098-08.11.2016","08.11.2016",2016,11,8,1.039016273,1
"ENG_062_MZB_LO_2098","ENG_062_MZB_LO_2098-07.11.2017","07.11.2017",2017,11,7,1.020937976,1
"ENG_062_MZB_LO_2098","ENG_062_MZB_LO_2098-17.10.2018","17.10.2018",2018,10,17,0.954637608,2
"ENG_062_MZB_LO_2098","ENG_062_MZB_LO_2098-16.11.2020","16.11.2020",2020,11,16,1.050554014,1
"ENG_062_MZB_LO_2098","ENG_062_MZB_LO_2098-17.11.2021","17.11.2021",2021,11,17,1.016306667,1
"ENG_062_MZB_LO_2098","ENG_062_MZB_LO_2098-26.09.2022","26.09.2022",2022,9,26,1.002760675,1
"ENG_062_MZB_LO_2098","ENG_062_MZB_LO_2098-19.09.2023","19.09.2023",2023,9,19,1.002414417,1
"ENG_062_MZB_LO_2098","ENG_062_MZB_LO_2098-19.09.2024","19.09.2024",2024,9,19,1.032123677,1
"ENG_062_MZB_LO_2100","ENG_062_MZB_LO_2100-24.09.2003","24.09.2003",2003,9,24,0.83605743,3
"ENG_062_MZB_LO_2100","ENG_062_MZB_LO_2100-16.09.2005","16.09.2005",2005,9,16,0.818336903,3
"ENG_062_MZB_LO_2100","ENG_062_MZB_LO_2100-18.09.2006","18.09.2006",2006,9,18,0.814017211,3
"ENG_062_MZB_LO_2100","ENG_062_MZB_LO_2100-26.09.2007","26.09.2007",2007,9,26,0.811814038,3
"ENG_062_MZB_LO_2100","ENG_062_MZB_LO_2100-22.10.2008","22.10.2008",2008,10,22,0.821426725,3
"ENG_062_MZB_LO_2100","ENG_062_MZB_LO_2100-26.10.2009","26.10.2009",2009,10,26,0.806132738,3
"ENG_062_MZB_LO_2100","ENG_062_MZB_LO_2100-10.09.2010","10.09.2010",2010,9,10,0.879528358,2
"ENG_062_MZB_LO_2100","ENG_062_MZB_LO_2100-14.09.2011","14.09.2011",2011,9,14,0.880891311,2
"ENG_062_MZB_LO_2100","ENG_062_MZB_LO_2100-28.11.2014","28.11.2014",2014,11,28,0.883248057,2
"ENG_062_MZB_LO_2106","ENG_062_MZB_LO_2106-10.10.2002","10.10.2002",2002,10,10,0.70697749,4
"ENG_062_MZB_LO_2106","ENG_062_MZB_LO_2106-29.09.2004","29.09.2004",2004,9,29,0.789264138,3
"ENG_062_MZB_LO_2106","ENG_062_MZB_LO_2106-01.11.2005","01.11.2005",2005,11,1,0.77714425,3
"ENG_062_MZB_LO_2106","ENG_062_MZB_LO_2106-03.10.2008","03.10.2008",2008,10,3,0.857450389,3
"ENG_062_MZB_LO_2106","ENG_062_MZB_LO_2106-08.10.2009","08.10.2009",2009,10,8,0.927685169,2
"ENG_062_MZB_LO_2106","ENG_062_MZB_LO_2106-07.11.2013","07.11.2013",2013,11,7,0.920885335,2
"ENG_062_MZB_LO_2106","ENG_062_MZB_LO_2106-12.11.2015","12.11.2015",2015,11,12,0.906210383,2
"ENG_062_MZB_LO_2106","ENG_062_MZB_LO_2106-15.09.2023","15.09.2023",2023,9,15,0.942086217,2
"ENG_062_MZB_LO_2106","ENG_062_MZB_LO_2106-13.11.2024","13.11.2024",2024,11,13,0.966262856,2
"ENG_062_MZB_LO_2107","ENG_062_MZB_LO_2107-18.09.2002","18.09.2002",2002,9,18,0.671758833,5
"ENG_062_MZB_LO_2107","ENG_062_MZB_LO_2107-03.10.2003","03.10.2003",2003,10,3,0.664968056,4
"ENG_062_MZB_LO_2107","ENG_062_MZB_LO_2107-21.09.2005","21.09.2005",2005,9,21,0.604615085,5
"ENG_062_MZB_LO_2107","ENG_062_MZB_LO_2107-30.10.2012","30.10.2012",2012,10,30,0.67226625,4
"ENG_062_MZB_LO_2107","ENG_062_MZB_LO_2107-30.09.2014","30.09.2014",2014,9,30,0.734958678,3
"ENG_062_MZB_LO_2107","ENG_062_MZB_LO_2107-03.10.2018","03.10.2018",2018,10,3,0.594343325,5
"ENG_062_MZB_LO_2107","ENG_062_MZB_LO_2107-09.09.2021","09.09.2021",2021,9,9,0.734792263,4
"ENG_062_MZB_LO_2107","ENG_062_MZB_LO_2107-12.09.2022","12.09.2022",2022,9,12,0.755286561,4
"ENG_062_MZB_LO_2109","ENG_062_MZB_LO_2109-17.10.2003","17.10.2003",2003,10,17,1.040478657,1
"ENG_062_MZB_LO_2109","ENG_062_MZB_LO_2109-08.11.2006","08.11.2006",2006,11,8,1.030366465,1
"ENG_062_MZB_LO_2109","ENG_062_MZB_LO_2109-03.10.2008","03.10.2008",2008,10,3,1.032613508,1
"ENG_062_MZB_LO_2109","ENG_062_MZB_LO_2109-08.10.2009","08.10.2009",2009,10,8,1.020585738,1
"ENG_062_MZB_LO_2109","ENG_062_MZB_LO_2109-07.10.2010","07.10.2010",2010,10,7,1.072016732,1
"ENG_062_MZB_LO_2109","ENG_062_MZB_LO_2109-04.10.2011","04.10.2011",2011,10,4,1.080046818,1
"ENG_062_MZB_LO_2109","ENG_062_MZB_LO_2109-17.10.2012","17.10.2012",2012,10,17,1.067667422,1
"ENG_062_MZB_LO_2109","ENG_062_MZB_LO_2109-07.11.2013","07.11.2013",2013,11,7,1.048307867,1
"ENG_062_MZB_LO_2109","ENG_062_MZB_LO_2109-22.10.2014","22.10.2014",2014,10,22,1.002895768,1
"ENG_062_MZB_LO_2109","ENG_062_MZB_LO_2109-21.10.2015","21.10.2015",2015,10,21,1.029731318,1
"ENG_062_MZB_LO_2109","ENG_062_MZB_LO_2109-18.10.2016","18.10.2016",2016,10,18,1.085154062,1
"ENG_062_MZB_LO_2109","ENG_062_MZB_LO_2109-21.09.2017","21.09.2017",2017,9,21,1.029078388,1
"ENG_062_MZB_LO_2109","ENG_062_MZB_LO_2109-15.11.2018","15.11.2018",2018,11,15,1.01835741,1
"ENG_062_MZB_LO_2109","ENG_062_MZB_LO_2109-10.10.2019","10.10.2019",2019,10,10,1.010100172,2
"ENG_062_MZB_LO_2109","ENG_062_MZB_LO_2109-08.09.2020","08.09.2020",2020,9,8,1.032081099,1
"ENG_062_MZB_LO_2109","ENG_062_MZB_LO_2109-28.10.2021","28.10.2021",2021,10,28,1.071703347,1
"ENG_062_MZB_LO_2109","ENG_062_MZB_LO_2109-19.10.2022","19.10.2022",2022,10,19,1.107424242,1
"ENG_062_MZB_LO_2109","ENG_062_MZB_LO_2109-26.09.2023","26.09.2023",2023,9,26,1.092271765,1
"ENG_062_MZB_LO_2109","ENG_062_MZB_LO_2109-13.11.2024","13.11.2024",2024,11,13,1.07686672,1
"ENG_062_MZB_LO_2110","ENG_062_MZB_LO_2110-25.09.2002","25.09.2002",2002,9,25,1.023549805,1
"ENG_062_MZB_LO_2110","ENG_062_MZB_LO_2110-24.11.2004","24.11.2004",2004,11,24,1.001062279,1
"ENG_062_MZB_LO_2110","ENG_062_MZB_LO_2110-19.10.2005","19.10.2005",2005,10,19,0.955996366,2
"ENG_062_MZB_LO_2110","ENG_062_MZB_LO_2110-15.10.2007","15.10.2007",2007,10,15,0.990592001,2
"ENG_062_MZB_LO_2110","ENG_062_MZB_LO_2110-18.11.2008","18.11.2008",2008,11,18,0.982919418,2
"ENG_062_MZB_LO_2110","ENG_062_MZB_LO_2110-09.11.2017","09.11.2017",2017,11,9,1.016207473,1
"ENG_062_MZB_LO_2110","ENG_062_MZB_LO_2110-13.09.2018","13.09.2018",2018,9,13,1.019166511,1
"ENG_062_MZB_LO_2110","ENG_062_MZB_LO_2110-20.09.2019","20.09.2019",2019,9,20,1.016723261,1
"ENG_062_MZB_LO_2110","ENG_062_MZB_LO_2110-15.09.2020","15.09.2020",2020,9,15,1.004672331,1
"ENG_062_MZB_LO_2110","ENG_062_MZB_LO_2110-12.10.2021","12.10.2021",2021,10,12,0.992971738,1
"ENG_062_MZB_LO_2110","ENG_062_MZB_LO_2110-17.10.2022","17.10.2022",2022,10,17,0.979946853,1
"ENG_062_MZB_LO_2110","ENG_062_MZB_LO_2110-09.10.2023","09.10.2023",2023,10,9,0.969405476,1
"ENG_062_MZB_LO_2111","ENG_062_MZB_LO_2111-23.09.2013","23.09.2013",2013,9,23,1.039710468,2
"ENG_062_MZB_LO_2111","ENG_062_MZB_LO_2111-24.09.2015","24.09.2015",2015,9,24,1.184221187,2
"ENG_062_MZB_LO_2111","ENG_062_MZB_LO_2111-19.09.2017","19.09.2017",2017,9,19,1.136203205,1
"ENG_062_MZB_LO_2111","ENG_062_MZB_LO_2111-03.10.2018","03.10.2018",2018,10,3,1.006661285,4
"ENG_062_MZB_LO_2111","ENG_062_MZB_LO_2111-25.09.2019","25.09.2019",2019,9,25,1.067285366,2
"ENG_062_MZB_LO_2111","ENG_062_MZB_LO_2111-09.09.2021","09.09.2021",2021,9,9,1.132205555,3
"ENG_062_MZB_LO_2111","ENG_062_MZB_LO_2111-25.10.2022","25.10.2022",2022,10,25,1.065566997,3
"ENG_062_MZB_LO_2114","ENG_062_MZB_LO_2114-03.11.2004","03.11.2004",2004,11,3,0.950770062,2
"ENG_062_MZB_LO_2114","ENG_062_MZB_LO_2114-02.11.2007","02.11.2007",2007,11,2,1.023736809,1
"ENG_062_MZB_LO_2114","ENG_062_MZB_LO_2114-21.11.2008","21.11.2008",2008,11,21,0.970505787,1
"ENG_062_MZB_LO_2114","ENG_062_MZB_LO_2114-28.10.2009","28.10.2009",2009,10,28,1.006859801,1
"ENG_062_MZB_LO_2114","ENG_062_MZB_LO_2114-13.09.2010","13.09.2010",2010,9,13,1.038666332,2
"ENG_062_MZB_LO_2114","ENG_062_MZB_LO_2114-15.09.2011","15.09.2011",2011,9,15,0.99949457,1
"ENG_062_MZB_LO_2114","ENG_062_MZB_LO_2114-19.09.2012","19.09.2012",2012,9,19,1.003704541,1
"ENG_062_MZB_LO_2114","ENG_062_MZB_LO_2114-18.11.2013","18.11.2013",2013,11,18,1.048731492,1
"ENG_062_MZB_LO_2114","ENG_062_MZB_LO_2114-02.09.2014","02.09.2014",2014,9,2,1.00363599,1
"ENG_062_MZB_LO_2114","ENG_062_MZB_LO_2114-23.09.2015","23.09.2015",2015,9,23,1.023352185,1
"ENG_062_MZB_LO_2114","ENG_062_MZB_LO_2114-11.11.2016","11.11.2016",2016,11,11,1.061010087,1
"ENG_062_MZB_LO_2114","ENG_062_MZB_LO_2114-06.11.2017","06.11.2017",2017,11,6,1.0653316,1
"ENG_062_MZB_LO_2114","ENG_062_MZB_LO_2114-11.09.2018","11.09.2018",2018,9,11,0.962328503,2
"ENG_062_MZB_LO_2114","ENG_062_MZB_LO_2114-22.10.2019","22.10.2019",2019,10,22,1.040462861,1
"ENG_062_MZB_LO_2114","ENG_062_MZB_LO_2114-23.10.2020","23.10.2020",2020,10,23,1.042078851,1
"ENG_062_MZB_LO_2114","ENG_062_MZB_LO_2114-27.10.2021","27.10.2021",2021,10,27,1.058209678,1
"ENG_062_MZB_LO_2114","ENG_062_MZB_LO_2114-26.09.2022","26.09.2022",2022,9,26,1.041279861,1
"ENG_062_MZB_LO_2114","ENG_062_MZB_LO_2114-17.11.2023","17.11.2023",2023,11,17,1.055661901,1
"ENG_062_MZB_LO_2114","ENG_062_MZB_LO_2114-01.11.2024","01.11.2024",2024,11,1,1.089430348,1
"ENG_062_MZB_LO_2116","ENG_062_MZB_LO_2116-19.10.2004","19.10.2004",2004,10,19,0.832387047,3
"ENG_062_MZB_LO_2116","ENG_062_MZB_LO_2116-25.10.2007","25.10.2007",2007,10,25,0.977422798,1
"ENG_062_MZB_LO_2116","ENG_062_MZB_LO_2116-22.09.2008","22.09.2008",2008,9,22,0.825253991,3
"ENG_062_MZB_LO_2116","ENG_062_MZB_LO_2116-22.10.2009","22.10.2009",2009,10,22,0.882322866,2
"ENG_062_MZB_LO_2116","ENG_062_MZB_LO_2116-06.10.2010","06.10.2010",2010,10,6,0.894532772,2
"ENG_062_MZB_LO_2116","ENG_062_MZB_LO_2116-06.10.2011","06.10.2011",2011,10,6,0.907821284,2
"ENG_062_MZB_LO_2116","ENG_062_MZB_LO_2116-19.09.2012","19.09.2012",2012,9,19,0.92954112,2
"ENG_062_MZB_LO_2116","ENG_062_MZB_LO_2116-12.09.2013","12.09.2013",2013,9,12,0.953679128,2
"ENG_062_MZB_LO_2116","ENG_062_MZB_LO_2116-19.10.2014","19.10.2014",2014,10,19,0.920905809,2
"ENG_062_MZB_LO_2116","ENG_062_MZB_LO_2116-13.10.2015","13.10.2015",2015,10,13,0.925759657,2
"ENG_062_MZB_LO_2116","ENG_062_MZB_LO_2116-27.10.2016","27.10.2016",2016,10,27,0.923997725,2
"ENG_062_MZB_LO_2116","ENG_062_MZB_LO_2116-08.11.2017","08.11.2017",2017,11,8,0.935780498,2
"ENG_062_MZB_LO_2116","ENG_062_MZB_LO_2116-15.11.2018","15.11.2018",2018,11,15,0.958775544,2
"ENG_062_MZB_LO_2116","ENG_062_MZB_LO_2116-12.09.2019","12.09.2019",2019,9,12,0.986075662,1
"ENG_062_MZB_LO_2116","ENG_062_MZB_LO_2116-28.10.2020","28.10.2020",2020,10,28,0.936438641,2
"ENG_062_MZB_LO_2116","ENG_062_MZB_LO_2116-10.11.2021","10.11.2021",2021,11,10,0.93779097,2
"ENG_062_MZB_LO_2116","ENG_062_MZB_LO_2116-27.09.2022","27.09.2022",2022,9,27,1.001733286,1
"ENG_062_MZB_LO_2116","ENG_062_MZB_LO_2116-23.11.2023","23.11.2023",2023,11,23,0.879934808,2
"ENG_062_MZB_LO_2116","ENG_062_MZB_LO_2116-12.11.2024","12.11.2024",2024,11,12,0.920782143,2
"ENG_062_MZB_LO_2117","ENG_062_MZB_LO_2117-02.10.2002","02.10.2002",2002,10,2,0.752843954,3
"ENG_062_MZB_LO_2117","ENG_062_MZB_LO_2117-08.10.2003","08.10.2003",2003,10,8,0.833577258,3
"ENG_062_MZB_LO_2117","ENG_062_MZB_LO_2117-17.10.2006","17.10.2006",2006,10,17,0.801682165,4
"ENG_062_MZB_LO_2117","ENG_062_MZB_LO_2117-22.10.2009","22.10.2009",2009,10,22,0.866751042,3
"ENG_062_MZB_LO_2117","ENG_062_MZB_LO_2117-10.10.2011","10.10.2011",2011,10,10,0.802456379,3
"ENG_062_MZB_LO_2117","ENG_062_MZB_LO_2117-19.09.2012","19.09.2012",2012,9,19,0.836867838,3
"ENG_062_MZB_LO_2117","ENG_062_MZB_LO_2117-07.10.2013","07.10.2013",2013,10,7,0.919251327,3
"ENG_062_MZB_LO_2117","ENG_062_MZB_LO_2117-19.10.2014","19.10.2014",2014,10,19,0.946297369,2
"ENG_062_MZB_LO_2117","ENG_062_MZB_LO_2117-13.10.2015","13.10.2015",2015,10,13,0.949128522,2
"ENG_062_MZB_LO_2117","ENG_062_MZB_LO_2117-27.10.2016","27.10.2016",2016,10,27,0.93211409,2
"ENG_062_MZB_LO_2117","ENG_062_MZB_LO_2117-17.10.2017","17.10.2017",2017,10,17,0.989328108,2
"ENG_062_MZB_LO_2117","ENG_062_MZB_LO_2117-05.11.2018","05.11.2018",2018,11,5,0.977041481,1
"ENG_062_MZB_LO_2117","ENG_062_MZB_LO_2117-06.11.2020","06.11.2020",2020,11,6,0.920334241,2
"ENG_062_MZB_LO_2117","ENG_062_MZB_LO_2117-10.11.2021","10.11.2021",2021,11,10,0.92184781,2
"ENG_062_MZB_LO_2117","ENG_062_MZB_LO_2117-14.11.2022","14.11.2022",2022,11,14,0.932243821,2
"ENG_062_MZB_LO_2117","ENG_062_MZB_LO_2117-16.11.2023","16.11.2023",2023,11,16,0.889347321,2
"ENG_062_MZB_LO_2119","ENG_062_MZB_LO_2119-24.10.2002","24.10.2002",2002,10,24,0.927200277,2
"ENG_062_MZB_LO_2119","ENG_062_MZB_LO_2119-01.11.2005","01.11.2005",2005,11,1,0.919785778,2
"ENG_062_MZB_LO_2119","ENG_062_MZB_LO_2119-16.09.2013","16.09.2013",2013,9,16,0.843122274,3
"ENG_062_MZB_LO_2119","ENG_062_MZB_LO_2119-04.09.2014","04.09.2014",2014,9,4,0.895651638,2
"ENG_062_MZB_LO_2119","ENG_062_MZB_LO_2119-21.09.2017","21.09.2017",2017,9,21,0.89694519,2
"ENG_062_MZB_LO_2119","ENG_062_MZB_LO_2119-10.10.2019","10.10.2019",2019,10,10,0.916856451,2
"ENG_062_MZB_LO_2119","ENG_062_MZB_LO_2119-14.10.2020","14.10.2020",2020,10,14,1.003877954,1
"ENG_062_MZB_LO_2119","ENG_062_MZB_LO_2119-03.09.2021","03.09.2021",2021,9,3,1.056427496,1
"ENG_062_MZB_LO_2119","ENG_062_MZB_LO_2119-17.10.2022","17.10.2022",2022,10,17,0.914139528,2
"ENG_062_MZB_LO_2119","ENG_062_MZB_LO_2119-14.11.2023","14.11.2023",2023,11,14,0.993645915,1
"ENG_062_MZB_LO_2120","ENG_062_MZB_LO_2120-24.10.2002","24.10.2002",2002,10,24,0.911018061,2
"ENG_062_MZB_LO_2120","ENG_062_MZB_LO_2120-06.10.2003","06.10.2003",2003,10,6,0.930198498,2
"ENG_062_MZB_LO_2120","ENG_062_MZB_LO_2120-29.09.2004","29.09.2004",2004,9,29,0.955168768,2
"ENG_062_MZB_LO_2120","ENG_062_MZB_LO_2120-08.11.2006","08.11.2006",2006,11,8,0.915883522,2
"ENG_062_MZB_LO_2120","ENG_062_MZB_LO_2120-13.11.2007","13.11.2007",2007,11,13,0.967539148,1
"ENG_062_MZB_LO_2120","ENG_062_MZB_LO_2120-15.10.2008","15.10.2008",2008,10,15,0.961554177,2
"ENG_062_MZB_LO_2120","ENG_062_MZB_LO_2120-08.10.2009","08.10.2009",2009,10,8,0.946434867,2
"ENG_062_MZB_LO_2120","ENG_062_MZB_LO_2120-06.10.2010","06.10.2010",2010,10,6,0.940504229,2
"ENG_062_MZB_LO_2120","ENG_062_MZB_LO_2120-25.10.2011","25.10.2011",2011,10,25,0.946034767,2
"ENG_062_MZB_LO_2120","ENG_062_MZB_LO_2120-02.10.2012","02.10.2012",2012,10,2,0.872670092,2
"ENG_062_MZB_LO_2120","ENG_062_MZB_LO_2120-17.09.2013","17.09.2013",2013,9,17,0.92784648,2
"ENG_062_MZB_LO_2120","ENG_062_MZB_LO_2120-04.09.2014","04.09.2014",2014,9,4,0.891328822,2
"ENG_062_MZB_LO_2120","ENG_062_MZB_LO_2120-12.11.2015","12.11.2015",2015,11,12,0.876795563,2
"ENG_062_MZB_LO_2120","ENG_062_MZB_LO_2120-18.10.2016","18.10.2016",2016,10,18,0.922148763,2
"ENG_062_MZB_LO_2120","ENG_062_MZB_LO_2120-30.10.2017","30.10.2017",2017,10,30,0.891693723,2
"ENG_062_MZB_LO_2120","ENG_062_MZB_LO_2120-15.11.2018","15.11.2018",2018,11,15,0.907772484,2
"ENG_062_MZB_LO_2120","ENG_062_MZB_LO_2120-10.10.2019","10.10.2019",2019,10,10,0.933611568,2
"ENG_062_MZB_LO_2120","ENG_062_MZB_LO_2120-08.09.2020","08.09.2020",2020,9,8,0.954458752,2
"ENG_062_MZB_LO_2120","ENG_062_MZB_LO_2120-03.09.2021","03.09.2021",2021,9,3,1.039307827,1
"ENG_062_MZB_LO_2120","ENG_062_MZB_LO_2120-19.10.2022","19.10.2022",2022,10,19,0.812704577,3
"ENG_062_MZB_LO_2120","ENG_062_MZB_LO_2120-06.10.2023","06.10.2023",2023,10,6,0.92724868,2
"ENG_062_MZB_LO_2120","ENG_062_MZB_LO_2120-11.10.2024","11.10.2024",2024,10,11,0.881708772,2
"ENG_062_MZB_LO_2124","ENG_062_MZB_LO_2124-19.09.2002","19.09.2002",2002,9,19,1.097505776,1
"ENG_062_MZB_LO_2124","ENG_062_MZB_LO_2124-05.11.2003","05.11.2003",2003,11,5,1.057481515,1
"ENG_062_MZB_LO_2124","ENG_062_MZB_LO_2124-14.11.2006","14.11.2006",2006,11,14,0.944937387,2
"ENG_062_MZB_LO_2124","ENG_062_MZB_LO_2124-18.09.2008","18.09.2008",2008,9,18,1.081114866,1
"ENG_062_MZB_LO_2124","ENG_062_MZB_LO_2124-21.10.2009","21.10.2009",2009,10,21,1.039461927,1
"ENG_062_MZB_LO_2124","ENG_062_MZB_LO_2124-23.09.2010","23.09.2010",2010,9,23,1.045107222,1
"ENG_062_MZB_LO_2124","ENG_062_MZB_LO_2124-03.10.2011","03.10.2011",2011,10,3,1.098010593,1
"ENG_062_MZB_LO_2124","ENG_062_MZB_LO_2124-07.09.2012","07.09.2012",2012,9,7,1.024866308,1
"ENG_062_MZB_LO_2124","ENG_062_MZB_LO_2124-26.11.2013","26.11.2013",2013,11,26,1.073417225,1
"ENG_062_MZB_LO_2124","ENG_062_MZB_LO_2124-19.09.2014","19.09.2014",2014,9,19,1.051751819,1
"ENG_062_MZB_LO_2124","ENG_062_MZB_LO_2124-17.09.2015","17.09.2015",2015,9,17,1.071372291,1
"ENG_062_MZB_LO_2124","ENG_062_MZB_LO_2124-25.11.2016","25.11.2016",2016,11,25,0.882139317,2
"ENG_062_MZB_LO_2124","ENG_062_MZB_LO_2124-17.10.2017","17.10.2017",2017,10,17,1.081560032,1
"ENG_062_MZB_LO_2124","ENG_062_MZB_LO_2124-05.11.2018","05.11.2018",2018,11,5,1.035595657,1
"ENG_062_MZB_LO_2124","ENG_062_MZB_LO_2124-17.11.2020","17.11.2020",2020,11,17,1.024285456,2
"ENG_062_MZB_LO_2124","ENG_062_MZB_LO_2124-16.11.2021","16.11.2021",2021,11,16,1.106280824,1
"ENG_062_MZB_LO_2124","ENG_062_MZB_LO_2124-27.09.2022","27.09.2022",2022,9,27,0.987830927,2
"ENG_062_MZB_LO_2124","ENG_062_MZB_LO_2124-30.11.2023","30.11.2023",2023,11,30,1.076404783,1
"ENG_062_MZB_LO_2124","ENG_062_MZB_LO_2124-29.10.2024","29.10.2024",2024,10,29,1.088415874,1
"ENG_062_MZB_LO_2125","ENG_062_MZB_LO_2125-16.09.2003","16.09.2003",2003,9,16,0.992972981,1
"ENG_062_MZB_LO_2125","ENG_062_MZB_LO_2125-02.11.2006","02.11.2006",2006,11,2,1.018457506,1
"ENG_062_MZB_LO_2125","ENG_062_MZB_LO_2125-24.11.2008","24.11.2008",2008,11,24,1.140152215,1
"ENG_062_MZB_LO_2125","ENG_062_MZB_LO_2125-04.11.2009","04.11.2009",2009,11,4,1.121072037,1
"ENG_062_MZB_LO_2125","ENG_062_MZB_LO_2125-18.10.2010","18.10.2010",2010,10,18,1.065620169,1
"ENG_062_MZB_LO_2125","ENG_062_MZB_LO_2125-17.10.2011","17.10.2011",2011,10,17,0.998853336,1
"ENG_062_MZB_LO_2125","ENG_062_MZB_LO_2125-09.09.2014","09.09.2014",2014,9,9,1.132247823,1
"ENG_062_MZB_LO_2125","ENG_062_MZB_LO_2125-25.10.2018","25.10.2018",2018,10,25,1.091979805,2
"ENG_062_MZB_LO_2127","ENG_062_MZB_LO_2127-18.09.2002","18.09.2002",2002,9,18,0.836973147,3
"ENG_062_MZB_LO_2127","ENG_062_MZB_LO_2127-21.09.2005","21.09.2005",2005,9,21,0.935369005,2
"ENG_062_MZB_LO_2127","ENG_062_MZB_LO_2127-26.09.2007","26.09.2007",2007,9,26,0.801633629,3
"ENG_062_MZB_LO_2127","ENG_062_MZB_LO_2127-22.10.2008","22.10.2008",2008,10,22,0.846734231,3
"ENG_062_MZB_LO_2127","ENG_062_MZB_LO_2127-04.11.2009","04.11.2009",2009,11,4,0.840118816,3
"ENG_062_MZB_LO_2127","ENG_062_MZB_LO_2127-12.10.2010","12.10.2010",2010,10,12,0.881274649,2
"ENG_062_MZB_LO_2127","ENG_062_MZB_LO_2127-30.10.2012","30.10.2012",2012,10,30,0.962151592,2
"ENG_062_MZB_LO_2127","ENG_062_MZB_LO_2127-30.09.2014","30.09.2014",2014,9,30,0.906127453,2
"ENG_062_MZB_LO_2130","ENG_062_MZB_LO_2130-15.03.2002","15.03.2002",2002,3,15,0.585996093,5
"ENG_062_MZB_LO_2130","ENG_062_MZB_LO_2130-16.04.2003","16.04.2003",2003,4,16,0.646528087,4
"ENG_062_MZB_LO_2130","ENG_062_MZB_LO_2130-02.04.2004","02.04.2004",2004,4,2,0.535697778,5
"ENG_062_MZB_LO_2130","ENG_062_MZB_LO_2130-04.05.2006","04.05.2006",2006,5,4,0.642049297,4
"ENG_062_MZB_LO_2130","ENG_062_MZB_LO_2130-08.05.2008","08.05.2008",2008,5,8,0.693138131,4
"ENG_062_MZB_LO_2130","ENG_062_MZB_LO_2130-14.05.2013","14.05.2013",2013,5,14,0.706723983,4
"ENG_062_MZB_LO_2130","ENG_062_MZB_LO_2130-15.05.2015","15.05.2015",2015,5,15,0.613210346,5
"ENG_062_MZB_LO_2132","ENG_062_MZB_LO_2132-11.09.2002","11.09.2002",2002,9,11,0.92395924,2
"ENG_062_MZB_LO_2132","ENG_062_MZB_LO_2132-19.09.2003","19.09.2003",2003,9,19,0.982529847,1
"ENG_062_MZB_LO_2132","ENG_062_MZB_LO_2132-13.10.2004","13.10.2004",2004,10,13,0.912372391,2
"ENG_062_MZB_LO_2132","ENG_062_MZB_LO_2132-19.10.2005","19.10.2005",2005,10,19,0.94029292,2
"ENG_062_MZB_LO_2132","ENG_062_MZB_LO_2132-13.10.2006","13.10.2006",2006,10,13,0.912394782,2
"ENG_062_MZB_LO_2132","ENG_062_MZB_LO_2132-27.09.2007","27.09.2007",2007,9,27,0.945410112,2
"ENG_062_MZB_LO_2132","ENG_062_MZB_LO_2132-19.09.2008","19.09.2008",2008,9,19,0.854218079,3
"ENG_062_MZB_LO_2132","ENG_062_MZB_LO_2132-08.10.2009","08.10.2009",2009,10,8,0.918499813,2
"ENG_062_MZB_LO_2132","ENG_062_MZB_LO_2132-13.10.2010","13.10.2010",2010,10,13,0.905183995,2
"ENG_062_MZB_LO_2132","ENG_062_MZB_LO_2132-09.11.2011","09.11.2011",2011,11,9,0.767162887,3
"ENG_062_MZB_LO_2132","ENG_062_MZB_LO_2132-12.11.2012","12.11.2012",2012,11,12,0.941508007,2
"ENG_062_MZB_LO_2132","ENG_062_MZB_LO_2132-06.09.2013","06.09.2013",2013,9,6,1.019401828,1
"ENG_062_MZB_LO_2132","ENG_062_MZB_LO_2132-12.11.2014","12.11.2014",2014,11,12,0.905469806,2
"ENG_062_MZB_LO_2132","ENG_062_MZB_LO_2132-23.09.2015","23.09.2015",2015,9,23,0.918922473,2
"ENG_062_MZB_LO_2132","ENG_062_MZB_LO_2132-14.09.2016","14.09.2016",2016,9,14,0.962949604,2
"ENG_062_MZB_LO_2132","ENG_062_MZB_LO_2132-11.10.2017","11.10.2017",2017,10,11,0.94705485,2
"ENG_062_MZB_LO_2132","ENG_062_MZB_LO_2132-05.10.2018","05.10.2018",2018,10,5,0.938920319,2
"ENG_062_MZB_LO_2132","ENG_062_MZB_LO_2132-09.09.2019","09.09.2019",2019,9,9,0.879836955,2
"ENG_062_MZB_LO_2132","ENG_062_MZB_LO_2132-02.09.2020","02.09.2020",2020,9,2,0.917039926,2
"ENG_062_MZB_LO_2132","ENG_062_MZB_LO_2132-10.09.2021","10.09.2021",2021,9,10,0.914221464,2
"ENG_062_MZB_LO_2132","ENG_062_MZB_LO_2132-09.10.2023","09.10.2023",2023,10,9,0.906272114,2
"ENG_062_MZB_LO_2134","ENG_062_MZB_LO_2134-30.09.2003","30.09.2003",2003,9,30,0.965550741,3
"ENG_062_MZB_LO_2134","ENG_062_MZB_LO_2134-01.11.2006","01.11.2006",2006,11,1,1.008654889,1
"ENG_062_MZB_LO_2134","ENG_062_MZB_LO_2134-24.10.2013","24.10.2013",2013,10,24,1.141026547,1
"ENG_062_MZB_LO_2134","ENG_062_MZB_LO_2134-13.11.2014","13.11.2014",2014,11,13,1.014771088,1
"ENG_062_MZB_LO_2134","ENG_062_MZB_LO_2134-03.11.2015","03.11.2015",2015,11,3,0.971697916,1
"ENG_062_MZB_LO_2134","ENG_062_MZB_LO_2134-18.10.2016","18.10.2016",2016,10,18,1.144183517,1
"ENG_062_MZB_LO_2134","ENG_062_MZB_LO_2134-06.09.2017","06.09.2017",2017,9,6,1.010033882,1
"ENG_062_MZB_LO_2134","ENG_062_MZB_LO_2134-22.10.2018","22.10.2018",2018,10,22,1.117014192,1
"ENG_062_MZB_LO_2134","ENG_062_MZB_LO_2134-09.09.2020","09.09.2020",2020,9,9,1.049965355,1
"ENG_062_MZB_LO_2134","ENG_062_MZB_LO_2134-22.09.2021","22.09.2021",2021,9,22,1.096683397,1
"ENG_062_MZB_LO_2135","ENG_062_MZB_LO_2135-21.11.2002","21.11.2002",2002,11,21,0.976516144,2
"ENG_062_MZB_LO_2135","ENG_062_MZB_LO_2135-11.10.2005","11.10.2005",2005,10,11,1.030884524,1
"ENG_062_MZB_LO_2135","ENG_062_MZB_LO_2135-19.09.2017","19.09.2017",2017,9,19,1.078072682,1
"ENG_062_MZB_LO_2135","ENG_062_MZB_LO_2135-23.10.2018","23.10.2018",2018,10,23,0.945628291,2
"ENG_062_MZB_LO_2135","ENG_062_MZB_LO_2135-19.11.2019","19.11.2019",2019,11,19,1.118955732,2
"ENG_062_MZB_LO_2135","ENG_062_MZB_LO_2135-01.09.2021","01.09.2021",2021,9,1,1.078165024,1
"ENG_062_MZB_LO_2135","ENG_062_MZB_LO_2135-29.09.2022","29.09.2022",2022,9,29,1.067300101,2
"ENG_062_MZB_LO_2138","ENG_062_MZB_LO_2138-28.10.2003","28.10.2003",2003,10,28,0.972919991,2
"ENG_062_MZB_LO_2138","ENG_062_MZB_LO_2138-10.11.2004","10.11.2004",2004,11,10,0.940653371,3
"ENG_062_MZB_LO_2138","ENG_062_MZB_LO_2138-22.11.2005","22.11.2005",2005,11,22,0.986022113,1
"ENG_062_MZB_LO_2138","ENG_062_MZB_LO_2138-23.10.2007","23.10.2007",2007,10,23,1.067875507,1
"ENG_062_MZB_LO_2138","ENG_062_MZB_LO_2138-30.10.2008","30.10.2008",2008,10,30,1.090391209,1
"ENG_062_MZB_LO_2138","ENG_062_MZB_LO_2138-06.10.2011","06.10.2011",2011,10,6,0.991370061,1
"ENG_062_MZB_LO_2138","ENG_062_MZB_LO_2138-06.11.2012","06.11.2012",2012,11,6,1.075421085,1
"ENG_062_MZB_LO_2138","ENG_062_MZB_LO_2138-23.09.2013","23.09.2013",2013,9,23,0.997889376,1
"ENG_062_MZB_LO_2138","ENG_062_MZB_LO_2138-22.10.2015","22.10.2015",2015,10,22,1.016421794,1
"ENG_062_MZB_LO_2138","ENG_062_MZB_LO_2138-26.10.2022","26.10.2022",2022,10,26,1.016778025,1
"ENG_062_MZB_LO_2140","ENG_062_MZB_LO_2140-09.10.2003","09.10.2003",2003,10,9,0.742976364,3
"ENG_062_MZB_LO_2140","ENG_062_MZB_LO_2140-14.11.2006","14.11.2006",2006,11,14,0.817735052,3
"ENG_062_MZB_LO_2140","ENG_062_MZB_LO_2140-19.10.2009","19.10.2009",2009,10,19,0.927404696,2
"ENG_062_MZB_LO_2140","ENG_062_MZB_LO_2140-08.09.2011","08.09.2011",2011,9,8,0.875528839,3
"ENG_062_MZB_LO_2140","ENG_062_MZB_LO_2140-19.11.2012","19.11.2012",2012,11,19,0.833407502,3
"ENG_062_MZB_LO_2140","ENG_062_MZB_LO_2140-19.10.2015","19.10.2015",2015,10,19,0.915193261,2
"ENG_062_MZB_LO_2140","ENG_062_MZB_LO_2140-23.10.2018","23.10.2018",2018,10,23,0.931941202,2
"ENG_062_MZB_LO_2144","ENG_062_MZB_LO_2144-20.09.2002","20.09.2002",2002,9,20,1.035358882,5
"ENG_062_MZB_LO_2144","ENG_062_MZB_LO_2144-11.10.2005","11.10.2005",2005,10,11,1.108860636,1
"ENG_062_MZB_LO_2144","ENG_062_MZB_LO_2144-07.10.2006","07.10.2006",2006,10,7,1.000288088,3
"ENG_062_MZB_LO_2144","ENG_062_MZB_LO_2144-25.10.2007","25.10.2007",2007,10,25,1.034990287,5
"ENG_062_MZB_LO_2144","ENG_062_MZB_LO_2144-12.11.2009","12.11.2009",2009,11,12,1.191157731,1
"ENG_062_MZB_LO_2144","ENG_062_MZB_LO_2144-30.09.2010","30.09.2010",2010,9,30,1.149800528,3
"ENG_062_MZB_LO_2144","ENG_062_MZB_LO_2144-15.09.2011","15.09.2011",2011,9,15,1.094937687,3
"ENG_062_MZB_LO_2144","ENG_062_MZB_LO_2144-07.11.2012","07.11.2012",2012,11,7,1.096454492,3
"ENG_062_MZB_LO_2144","ENG_062_MZB_LO_2144-26.09.2013","26.09.2013",2013,9,26,1.0307897,2
"ENG_062_MZB_LO_2144","ENG_062_MZB_LO_2144-10.09.2014","10.09.2014",2014,9,10,1.079399839,1
"ENG_062_MZB_LO_2144","ENG_062_MZB_LO_2144-24.09.2015","24.09.2015",2015,9,24,1.141078186,3
"ENG_062_MZB_LO_2144","ENG_062_MZB_LO_2144-06.09.2016","06.09.2016",2016,9,6,1.111578875,1
"ENG_062_MZB_LO_2144","ENG_062_MZB_LO_2144-11.10.2017","11.10.2017",2017,10,11,1.089172181,1
"ENG_062_MZB_LO_2144","ENG_062_MZB_LO_2144-19.09.2018","19.09.2018",2018,9,19,1.01729918,2
"ENG_062_MZB_LO_2144","ENG_062_MZB_LO_2144-11.10.2019","11.10.2019",2019,10,11,1.193928169,3
"ENG_062_MZB_LO_2144","ENG_062_MZB_LO_2144-18.09.2020","18.09.2020",2020,9,18,1.105552881,3
"ENG_062_MZB_LO_2144","ENG_062_MZB_LO_2144-09.09.2021","09.09.2021",2021,9,9,1.06366707,3
"ENG_062_MZB_LO_2144","ENG_062_MZB_LO_2144-13.10.2022","13.10.2022",2022,10,13,1.089907487,3
"ENG_062_MZB_LO_2144","ENG_062_MZB_LO_2144-04.10.2023","04.10.2023",2023,10,4,1.094743974,3
"ENG_062_MZB_LO_2147","ENG_062_MZB_LO_2147-09.10.2002","09.10.2002",2002,10,9,1.161577245,1
"ENG_062_MZB_LO_2147","ENG_062_MZB_LO_2147-30.10.2003","30.10.2003",2003,10,30,1.169618498,1
"ENG_062_MZB_LO_2147","ENG_062_MZB_LO_2147-10.10.2006","10.10.2006",2006,10,10,1.196577819,1
"ENG_062_MZB_LO_2147","ENG_062_MZB_LO_2147-03.10.2007","03.10.2007",2007,10,3,1.129798721,1
"ENG_062_MZB_LO_2147","ENG_062_MZB_LO_2147-15.10.2008","15.10.2008",2008,10,15,1.075617629,1
"ENG_062_MZB_LO_2147","ENG_062_MZB_LO_2147-19.10.2009","19.10.2009",2009,10,19,1.231910547,1
"ENG_062_MZB_LO_2147","ENG_062_MZB_LO_2147-16.09.2010","16.09.2010",2010,9,16,1.193962569,1
"ENG_062_MZB_LO_2147","ENG_062_MZB_LO_2147-07.09.2011","07.09.2011",2011,9,7,1.181585981,1
"ENG_062_MZB_LO_2147","ENG_062_MZB_LO_2147-15.11.2012","15.11.2012",2012,11,15,1.125389505,1
"ENG_062_MZB_LO_2147","ENG_062_MZB_LO_2147-09.09.2013","09.09.2013",2013,9,9,1.169502678,1
"ENG_062_MZB_LO_2147","ENG_062_MZB_LO_2147-15.09.2014","15.09.2014",2014,9,15,1.188438845,1
"ENG_062_MZB_LO_2147","ENG_062_MZB_LO_2147-18.09.2015","18.09.2015",2015,9,18,1.159380275,1
"ENG_062_MZB_LO_2147","ENG_062_MZB_LO_2147-30.09.2016","30.09.2016",2016,9,30,1.152083394,1
"ENG_062_MZB_LO_2147","ENG_062_MZB_LO_2147-03.10.2017","03.10.2017",2017,10,3,1.174932777,1
"ENG_062_MZB_LO_2147","ENG_062_MZB_LO_2147-04.10.2018","04.10.2018",2018,10,4,1.146060654,1
"ENG_062_MZB_LO_2147","ENG_062_MZB_LO_2147-07.09.2020","07.09.2020",2020,9,7,1.208591282,1
"ENG_062_MZB_LO_2147","ENG_062_MZB_LO_2147-06.09.2021","06.09.2021",2021,9,6,1.171614904,1
"ENG_062_MZB_LO_2147","ENG_062_MZB_LO_2147-22.09.2022","22.09.2022",2022,9,22,0.982354299,2
"ENG_062_MZB_LO_2147","ENG_062_MZB_LO_2147-03.10.2023","03.10.2023",2023,10,3,1.1139144,1
"ENG_062_MZB_LO_2149","ENG_062_MZB_LO_2149-26.11.2002","26.11.2002",2002,11,26,1.040703671,1
"ENG_062_MZB_LO_2149","ENG_062_MZB_LO_2149-16.09.2003","16.09.2003",2003,9,16,1.054864702,1
"ENG_062_MZB_LO_2149","ENG_062_MZB_LO_2149-29.09.2005","29.09.2005",2005,9,29,1.011302882,1
"ENG_062_MZB_LO_2149","ENG_062_MZB_LO_2149-02.11.2006","02.11.2006",2006,11,2,1.050301388,1
"ENG_062_MZB_LO_2149","ENG_062_MZB_LO_2149-26.09.2007","26.09.2007",2007,9,26,1.063052466,1
"ENG_062_MZB_LO_2149","ENG_062_MZB_LO_2149-24.11.2008","24.11.2008",2008,11,24,1.102026858,1
"ENG_062_MZB_LO_2149","ENG_062_MZB_LO_2149-05.11.2009","05.11.2009",2009,11,5,1.12660156,1
"ENG_062_MZB_LO_2149","ENG_062_MZB_LO_2149-04.09.2013","04.09.2013",2013,9,4,1.11737807,1
"ENG_062_MZB_LO_2149","ENG_062_MZB_LO_2149-04.10.2016","04.10.2016",2016,10,4,1.061019735,1
"ENG_062_MZB_LO_2151","ENG_062_MZB_LO_2151-18.09.2002","18.09.2002",2002,9,18,0.9731141,2
"ENG_062_MZB_LO_2151","ENG_062_MZB_LO_2151-15.09.2003","15.09.2003",2003,9,15,0.94996188,2
"ENG_062_MZB_LO_2151","ENG_062_MZB_LO_2151-19.10.2004","19.10.2004",2004,10,19,1.004143097,2
"ENG_062_MZB_LO_2151","ENG_062_MZB_LO_2151-14.10.2005","14.10.2005",2005,10,14,0.864632811,3
"ENG_062_MZB_LO_2151","ENG_062_MZB_LO_2151-13.10.2006","13.10.2006",2006,10,13,0.877997639,2
"ENG_062_MZB_LO_2151","ENG_062_MZB_LO_2151-22.10.2013","22.10.2013",2013,10,22,0.959395698,2
"ENG_062_MZB_LO_2151","ENG_062_MZB_LO_2151-18.10.2021","18.10.2021",2021,10,18,0.97087814,2
"ENG_062_MZB_LO_2152","ENG_062_MZB_LO_2152-27.03.2002","27.03.2002",2002,3,27,1.030273807,1
"ENG_062_MZB_LO_2152","ENG_062_MZB_LO_2152-31.03.2003","31.03.2003",2003,3,31,1.040601988,1
"ENG_062_MZB_LO_2152","ENG_062_MZB_LO_2152-03.04.2006","03.04.2006",2006,4,3,0.940525425,2
"ENG_062_MZB_LO_2152","ENG_062_MZB_LO_2152-05.05.2009","05.05.2009",2009,5,5,1.010449656,1
"ENG_062_MZB_LO_2152","ENG_062_MZB_LO_2152-04.03.2013","04.03.2013",2013,3,4,1.079674732,1
"ENG_062_MZB_LO_2152","ENG_062_MZB_LO_2152-24.03.2021","24.03.2021",2021,3,24,0.928134613,2
"ENG_062_MZB_LO_2152","ENG_062_MZB_LO_2152-22.03.2022","22.03.2022",2022,3,22,1.067776853,2
"ENG_062_MZB_LO_2153","ENG_062_MZB_LO_2153-24.09.2002","24.09.2002",2002,9,24,1.158159065,1
"ENG_062_MZB_LO_2153","ENG_062_MZB_LO_2153-23.09.2005","23.09.2005",2005,9,23,1.017522142,1
"ENG_062_MZB_LO_2153","ENG_062_MZB_LO_2153-16.10.2008","16.10.2008",2008,10,16,1.216038138,3
"ENG_062_MZB_LO_2153","ENG_062_MZB_LO_2153-14.10.2009","14.10.2009",2009,10,14,1.0143654,1
"ENG_062_MZB_LO_2153","ENG_062_MZB_LO_2153-27.09.2010","27.09.2010",2010,9,27,1.056216856,1
"ENG_062_MZB_LO_2153","ENG_062_MZB_LO_2153-24.10.2011","24.10.2011",2011,10,24,1.101417959,1
"ENG_062_MZB_LO_2153","ENG_062_MZB_LO_2153-10.10.2012","10.10.2012",2012,10,10,1.081698549,1
"ENG_062_MZB_LO_2153","ENG_062_MZB_LO_2153-09.10.2013","09.10.2013",2013,10,9,1.031642779,2
"ENG_062_MZB_LO_2153","ENG_062_MZB_LO_2153-02.10.2014","02.10.2014",2014,10,2,1.162591085,1
"ENG_062_MZB_LO_2153","ENG_062_MZB_LO_2153-16.09.2015","16.09.2015",2015,9,16,1.082662111,1
"ENG_062_MZB_LO_2153","ENG_062_MZB_LO_2153-07.09.2016","07.09.2016",2016,9,7,1.143462577,1
"ENG_062_MZB_LO_2153","ENG_062_MZB_LO_2153-28.09.2017","28.09.2017",2017,9,28,1.110522459,1
"ENG_062_MZB_LO_2153","ENG_062_MZB_LO_2153-20.09.2018","20.09.2018",2018,9,20,1.092642336,1
"ENG_062_MZB_LO_2153","ENG_062_MZB_LO_2153-18.10.2021","18.10.2021",2021,10,18,1.15237165,1
"ENG_062_MZB_LO_2154","ENG_062_MZB_LO_2154-06.11.2002","06.11.2002",2002,11,6,0.927657421,2
"ENG_062_MZB_LO_2154","ENG_062_MZB_LO_2154-22.09.2003","22.09.2003",2003,9,22,0.982603959,1
"ENG_062_MZB_LO_2154","ENG_062_MZB_LO_2154-13.09.2005","13.09.2005",2005,9,13,0.93033065,2
"ENG_062_MZB_LO_2154","ENG_062_MZB_LO_2154-06.11.2006","06.11.2006",2006,11,6,1.00603098,2
"ENG_062_MZB_LO_2154","ENG_062_MZB_LO_2154-13.10.2008","13.10.2008",2008,10,13,0.96086749,2
"ENG_062_MZB_LO_2154","ENG_062_MZB_LO_2154-09.11.2009","09.11.2009",2009,11,9,0.90376907,2
"ENG_062_MZB_LO_2154","ENG_062_MZB_LO_2154-25.10.2010","25.10.2010",2010,10,25,1.130260094,1
"ENG_062_MZB_LO_2154","ENG_062_MZB_LO_2154-02.09.2011","02.09.2011",2011,9,2,0.938648601,2
"ENG_062_MZB_LO_2154","ENG_062_MZB_LO_2154-26.09.2012","26.09.2012",2012,9,26,0.939127252,3
"ENG_062_MZB_LO_2154","ENG_062_MZB_LO_2154-04.09.2013","04.09.2013",2013,9,4,1.026041365,2
"ENG_062_MZB_LO_2154","ENG_062_MZB_LO_2154-02.09.2014","02.09.2014",2014,9,2,1.004912985,2
"ENG_062_MZB_LO_2154","ENG_062_MZB_LO_2154-07.09.2015","07.09.2015",2015,9,7,1.019455172,3
"ENG_062_MZB_LO_2154","ENG_062_MZB_LO_2154-05.10.2016","05.10.2016",2016,10,5,0.969163029,2
"ENG_062_MZB_LO_2154","ENG_062_MZB_LO_2154-04.10.2017","04.10.2017",2017,10,4,1.05806807,1
"ENG_062_MZB_LO_2154","ENG_062_MZB_LO_2154-15.10.2021","15.10.2021",2021,10,15,1.053102019,1
"ENG_062_MZB_LO_2155","ENG_062_MZB_LO_2155-06.11.2002","06.11.2002",2002,11,6,0.999319008,1
"ENG_062_MZB_LO_2155","ENG_062_MZB_LO_2155-22.09.2003","22.09.2003",2003,9,22,0.894813539,2
"ENG_062_MZB_LO_2155","ENG_062_MZB_LO_2155-13.09.2005","13.09.2005",2005,9,13,0.994020803,2
"ENG_062_MZB_LO_2155","ENG_062_MZB_LO_2155-06.11.2006","06.11.2006",2006,11,6,0.966646148,1
"ENG_062_MZB_LO_2155","ENG_062_MZB_LO_2155-13.10.2008","13.10.2008",2008,10,13,0.959741535,2
"ENG_062_MZB_LO_2155","ENG_062_MZB_LO_2155-09.11.2009","09.11.2009",2009,11,9,0.959104474,2
"ENG_062_MZB_LO_2155","ENG_062_MZB_LO_2155-02.09.2011","02.09.2011",2011,9,2,0.96211941,2
"ENG_062_MZB_LO_2155","ENG_062_MZB_LO_2155-08.10.2015","08.10.2015",2015,10,8,0.972461043,2
"ENG_062_MZB_LO_2155","ENG_062_MZB_LO_2155-05.09.2016","05.09.2016",2016,9,5,0.968884852,1
"ENG_062_MZB_LO_2156","ENG_062_MZB_LO_2156-09.09.2003","09.09.2003",2003,9,9,0.940076076,2
"ENG_062_MZB_LO_2156","ENG_062_MZB_LO_2156-27.10.2004","27.10.2004",2004,10,27,0.863949835,2
"ENG_062_MZB_LO_2156","ENG_062_MZB_LO_2156-02.11.2006","02.11.2006",2006,11,2,0.854440367,3
"ENG_062_MZB_LO_2156","ENG_062_MZB_LO_2156-20.10.2010","20.10.2010",2010,10,20,0.950772562,2
"ENG_062_MZB_LO_2156","ENG_062_MZB_LO_2156-20.09.2011","20.09.2011",2011,9,20,0.957536703,2
"ENG_062_MZB_LO_2156","ENG_062_MZB_LO_2156-14.11.2012","14.11.2012",2012,11,14,0.880135376,2
"ENG_062_MZB_LO_2156","ENG_062_MZB_LO_2156-12.11.2013","12.11.2013",2013,11,12,0.968017816,1
"ENG_062_MZB_LO_2156","ENG_062_MZB_LO_2156-19.09.2014","19.09.2014",2014,9,19,0.963121617,2
"ENG_062_MZB_LO_2156","ENG_062_MZB_LO_2156-16.09.2015","16.09.2015",2015,9,16,0.913975366,2
"ENG_062_MZB_LO_2156","ENG_062_MZB_LO_2156-12.10.2016","12.10.2016",2016,10,12,0.977807392,1
"ENG_062_MZB_LO_2156","ENG_062_MZB_LO_2156-31.10.2017","31.10.2017",2017,10,31,0.99269045,1
"ENG_062_MZB_LO_2156","ENG_062_MZB_LO_2156-15.10.2021","15.10.2021",2021,10,15,0.995974431,1
"ENG_062_MZB_LO_2157","ENG_062_MZB_LO_2157-15.10.2002","15.10.2002",2002,10,15,1.060204224,1
"ENG_062_MZB_LO_2157","ENG_062_MZB_LO_2157-09.09.2003","09.09.2003",2003,9,9,1.033045829,2
"ENG_062_MZB_LO_2157","ENG_062_MZB_LO_2157-27.10.2004","27.10.2004",2004,10,27,1.066226317,2
"ENG_062_MZB_LO_2157","ENG_062_MZB_LO_2157-08.11.2005","08.11.2005",2005,11,8,1.116510945,1
"ENG_062_MZB_LO_2157","ENG_062_MZB_LO_2157-02.11.2006","02.11.2006",2006,11,2,1.09118436,1
"ENG_062_MZB_LO_2157","ENG_062_MZB_LO_2157-20.10.2010","20.10.2010",2010,10,20,0.963745297,2
"ENG_062_MZB_LO_2157","ENG_062_MZB_LO_2157-20.09.2011","20.09.2011",2011,9,20,1.062817257,1
"ENG_062_MZB_LO_2157","ENG_062_MZB_LO_2157-14.11.2012","14.11.2012",2012,11,14,1.059794693,1
"ENG_062_MZB_LO_2157","ENG_062_MZB_LO_2157-12.11.2013","12.11.2013",2013,11,12,1.146991604,1
"ENG_062_MZB_LO_2157","ENG_062_MZB_LO_2157-19.09.2014","19.09.2014",2014,9,19,1.033478898,1
"ENG_062_MZB_LO_2157","ENG_062_MZB_LO_2157-29.09.2015","29.09.2015",2015,9,29,1.090386048,1
"ENG_062_MZB_LO_2157","ENG_062_MZB_LO_2157-11.11.2016","11.11.2016",2016,11,11,1.008169681,1
"ENG_062_MZB_LO_2157","ENG_062_MZB_LO_2157-16.11.2017","16.11.2017",2017,11,16,1.046535943,1
"ENG_062_MZB_LO_2158","ENG_062_MZB_LO_2158-15.10.2002","15.10.2002",2002,10,15,0.731600035,5
"ENG_062_MZB_LO_2158","ENG_062_MZB_LO_2158-09.09.2003","09.09.2003",2003,9,9,0.736277705,4
"ENG_062_MZB_LO_2158","ENG_062_MZB_LO_2158-27.10.2004","27.10.2004",2004,10,27,0.784372754,4
"ENG_062_MZB_LO_2158","ENG_062_MZB_LO_2158-02.10.2007","02.10.2007",2007,10,2,0.719459462,4
"ENG_062_MZB_LO_2158","ENG_062_MZB_LO_2158-31.10.2012","31.10.2012",2012,10,31,0.799766409,3
"ENG_062_MZB_LO_2158","ENG_062_MZB_LO_2158-04.09.2013","04.09.2013",2013,9,4,0.733833113,4
"ENG_062_MZB_LO_2158","ENG_062_MZB_LO_2158-12.10.2015","12.10.2015",2015,10,12,0.681000735,5
"ENG_062_MZB_LO_2158","ENG_062_MZB_LO_2158-19.10.2016","19.10.2016",2016,10,19,0.831131041,5
"ENG_062_MZB_LO_2158","ENG_062_MZB_LO_2158-23.09.2021","23.09.2021",2021,9,23,0.763490004,5
"ENG_062_MZB_LO_2158","ENG_062_MZB_LO_2158-06.10.2023","06.10.2023",2023,10,6,0.809667867,3
"ENG_062_MZB_LO_2159","ENG_062_MZB_LO_2159-21.10.2002","21.10.2002",2002,10,21,1.08869025,1
"ENG_062_MZB_LO_2159","ENG_062_MZB_LO_2159-19.09.2003","19.09.2003",2003,9,19,1.023186037,1
"ENG_062_MZB_LO_2159","ENG_062_MZB_LO_2159-14.09.2004","14.09.2004",2004,9,14,1.005960947,1
"ENG_062_MZB_LO_2159","ENG_062_MZB_LO_2159-16.09.2005","16.09.2005",2005,9,16,0.996765228,1
"ENG_062_MZB_LO_2159","ENG_062_MZB_LO_2159-02.10.2006","02.10.2006",2006,10,2,0.994129196,1
"ENG_062_MZB_LO_2159","ENG_062_MZB_LO_2159-15.10.2009","15.10.2009",2009,10,15,1.005399175,2
"ENG_062_MZB_LO_2159","ENG_062_MZB_LO_2159-14.09.2010","14.09.2010",2010,9,14,1.042567388,1
"ENG_062_MZB_LO_2159","ENG_062_MZB_LO_2159-01.11.2011","01.11.2011",2011,11,1,1.152583629,1
"ENG_062_MZB_LO_2159","ENG_062_MZB_LO_2159-11.09.2012","11.09.2012",2012,9,11,1.23572766,1
"ENG_062_MZB_LO_2159","ENG_062_MZB_LO_2159-30.10.2013","30.10.2013",2013,10,30,1.110772439,1
"ENG_062_MZB_LO_2159","ENG_062_MZB_LO_2159-16.09.2014","16.09.2014",2014,9,16,1.067482975,2
"ENG_062_MZB_LO_2159","ENG_062_MZB_LO_2159-19.11.2015","19.11.2015",2015,11,19,0.970742868,2
"ENG_062_MZB_LO_2159","ENG_062_MZB_LO_2159-04.09.2017","04.09.2017",2017,9,4,0.94207487,2
"ENG_062_MZB_LO_2159","ENG_062_MZB_LO_2159-27.09.2018","27.09.2018",2018,9,27,1.030640672,2
"ENG_062_MZB_LO_2159","ENG_062_MZB_LO_2159-13.10.2020","13.10.2020",2020,10,13,1.031343704,3
"ENG_062_MZB_LO_2160","ENG_062_MZB_LO_2160-11.09.2012","11.09.2012",2012,9,11,0.986995831,2
"ENG_062_MZB_LO_2160","ENG_062_MZB_LO_2160-04.09.2013","04.09.2013",2013,9,4,0.891234171,3
"ENG_062_MZB_LO_2160","ENG_062_MZB_LO_2160-07.10.2014","07.10.2014",2014,10,7,1.001609977,2
"ENG_062_MZB_LO_2160","ENG_062_MZB_LO_2160-19.11.2015","19.11.2015",2015,11,19,0.934458908,2
"ENG_062_MZB_LO_2160","ENG_062_MZB_LO_2160-11.10.2016","11.10.2016",2016,10,11,0.93404233,3
"ENG_062_MZB_LO_2160","ENG_062_MZB_LO_2160-20.11.2017","20.11.2017",2017,11,20,0.971572674,1
"ENG_062_MZB_LO_2160","ENG_062_MZB_LO_2160-27.09.2018","27.09.2018",2018,9,27,0.969620197,3
"ENG_062_MZB_LO_2160","ENG_062_MZB_LO_2160-04.11.2019","04.11.2019",2019,11,4,1.057984889,3
"ENG_062_MZB_LO_2160","ENG_062_MZB_LO_2160-13.10.2020","13.10.2020",2020,10,13,0.945720312,3
"ENG_062_MZB_LO_2160","ENG_062_MZB_LO_2160-19.10.2021","19.10.2021",2021,10,19,0.996922511,2
"ENG_062_MZB_LO_2160","ENG_062_MZB_LO_2160-17.10.2023","17.10.2023",2023,10,17,1.066949372,1
"ENG_062_MZB_LO_2161","ENG_062_MZB_LO_2161-04.11.2002","04.11.2002",2002,11,4,0.978239212,2
"ENG_062_MZB_LO_2161","ENG_062_MZB_LO_2161-08.11.2005","08.11.2005",2005,11,8,0.938870079,3
"ENG_062_MZB_LO_2161","ENG_062_MZB_LO_2161-13.10.2008","13.10.2008",2008,10,13,0.987728072,2
"ENG_062_MZB_LO_2161","ENG_062_MZB_LO_2161-12.11.2009","12.11.2009",2009,11,12,1.08008792,1
"ENG_062_MZB_LO_2161","ENG_062_MZB_LO_2161-25.10.2010","25.10.2010",2010,10,25,1.128284658,1
"ENG_062_MZB_LO_2161","ENG_062_MZB_LO_2161-02.09.2011","02.09.2011",2011,9,2,1.105335369,2
"ENG_062_MZB_LO_2161","ENG_062_MZB_LO_2161-17.10.2012","17.10.2012",2012,10,17,1.01802965,1
"ENG_062_MZB_LO_2161","ENG_062_MZB_LO_2161-05.09.2013","05.09.2013",2013,9,5,1.126255263,1
"ENG_062_MZB_LO_2161","ENG_062_MZB_LO_2161-10.09.2014","10.09.2014",2014,9,10,1.053512976,1
"ENG_062_MZB_LO_2161","ENG_062_MZB_LO_2161-11.09.2018","11.09.2018",2018,9,11,1.014984153,3
"ENG_062_MZB_LO_2163","ENG_062_MZB_LO_2163-18.09.2002","18.09.2002",2002,9,18,1.026599795,1
"ENG_062_MZB_LO_2163","ENG_062_MZB_LO_2163-15.09.2003","15.09.2003",2003,9,15,1.090651331,1
"ENG_062_MZB_LO_2163","ENG_062_MZB_LO_2163-23.09.2004","23.09.2004",2004,9,23,1.133553035,1
"ENG_062_MZB_LO_2163","ENG_062_MZB_LO_2163-26.09.2005","26.09.2005",2005,9,26,1.051830755,1
"ENG_062_MZB_LO_2163","ENG_062_MZB_LO_2163-19.09.2006","19.09.2006",2006,9,19,1.064210736,1
"ENG_062_MZB_LO_2163","ENG_062_MZB_LO_2163-16.10.2008","16.10.2008",2008,10,16,1.116117735,1
"ENG_062_MZB_LO_2163","ENG_062_MZB_LO_2163-08.10.2009","08.10.2009",2009,10,8,1.119430386,1
"ENG_062_MZB_LO_2163","ENG_062_MZB_LO_2163-23.09.2010","23.09.2010",2010,9,23,1.06836585,1
"ENG_062_MZB_LO_2163","ENG_062_MZB_LO_2163-02.11.2011","02.11.2011",2011,11,2,1.076950807,1
"ENG_062_MZB_LO_2163","ENG_062_MZB_LO_2163-20.09.2012","20.09.2012",2012,9,20,1.117610592,1
"ENG_062_MZB_LO_2163","ENG_062_MZB_LO_2163-08.10.2013","08.10.2013",2013,10,8,1.125726146,1
"ENG_062_MZB_LO_2163","ENG_062_MZB_LO_2163-02.10.2014","02.10.2014",2014,10,2,1.075448427,1
"ENG_062_MZB_LO_2163","ENG_062_MZB_LO_2163-25.09.2015","25.09.2015",2015,9,25,1.068119266,1
"ENG_062_MZB_LO_2163","ENG_062_MZB_LO_2163-15.10.2018","15.10.2018",2018,10,15,1.157404665,2
"ENG_062_MZB_LO_2163","ENG_062_MZB_LO_2163-30.09.2020","30.09.2020",2020,9,30,1.075012257,1
"ENG_062_MZB_LO_2163","ENG_062_MZB_LO_2163-05.11.2021","05.11.2021",2021,11,5,1.148246061,1
"ENG_062_MZB_LO_2163","ENG_062_MZB_LO_2163-12.10.2022","12.10.2022",2022,10,12,1.112580704,1
"ENG_062_MZB_LO_2163","ENG_062_MZB_LO_2163-04.10.2023","04.10.2023",2023,10,4,1.081744,1
"ENG_062_MZB_LO_2164","ENG_062_MZB_LO_2164-18.09.2002","18.09.2002",2002,9,18,1.138630286,1
"ENG_062_MZB_LO_2164","ENG_062_MZB_LO_2164-15.09.2003","15.09.2003",2003,9,15,1.046504278,1
"ENG_062_MZB_LO_2164","ENG_062_MZB_LO_2164-23.09.2004","23.09.2004",2004,9,23,1.145947698,1
"ENG_062_MZB_LO_2164","ENG_062_MZB_LO_2164-26.09.2005","26.09.2005",2005,9,26,1.18484719,1
"ENG_062_MZB_LO_2164","ENG_062_MZB_LO_2164-19.09.2006","19.09.2006",2006,9,19,1.093822645,1
"ENG_062_MZB_LO_2164","ENG_062_MZB_LO_2164-16.10.2008","16.10.2008",2008,10,16,1.098639604,1
"ENG_062_MZB_LO_2164","ENG_062_MZB_LO_2164-08.10.2009","08.10.2009",2009,10,8,1.113969368,1
"ENG_062_MZB_LO_2164","ENG_062_MZB_LO_2164-23.09.2010","23.09.2010",2010,9,23,1.180198644,1
"ENG_062_MZB_LO_2164","ENG_062_MZB_LO_2164-02.11.2011","02.11.2011",2011,11,2,1.076214546,1
"ENG_062_MZB_LO_2164","ENG_062_MZB_LO_2164-20.09.2012","20.09.2012",2012,9,20,1.116004245,1
"ENG_062_MZB_LO_2164","ENG_062_MZB_LO_2164-08.10.2013","08.10.2013",2013,10,8,1.123239287,1
"ENG_062_MZB_LO_2164","ENG_062_MZB_LO_2164-02.10.2014","02.10.2014",2014,10,2,1.128514926,1
"ENG_062_MZB_LO_2164","ENG_062_MZB_LO_2164-18.10.2021","18.10.2021",2021,10,18,1.048449208,1
"ENG_062_MZB_LO_2164","ENG_062_MZB_LO_2164-27.09.2022","27.09.2022",2022,9,27,1.061580687,1
"ENG_062_MZB_LO_2165","ENG_062_MZB_LO_2165-24.09.2002","24.09.2002",2002,9,24,0.915507797,2
"ENG_062_MZB_LO_2165","ENG_062_MZB_LO_2165-21.09.2005","21.09.2005",2005,9,21,0.979393275,2
"ENG_062_MZB_LO_2165","ENG_062_MZB_LO_2165-16.10.2008","16.10.2008",2008,10,16,0.986587155,2
"ENG_062_MZB_LO_2165","ENG_062_MZB_LO_2165-08.10.2013","08.10.2013",2013,10,8,1.002740797,1
"ENG_062_MZB_LO_2165","ENG_062_MZB_LO_2165-09.10.2014","09.10.2014",2014,10,9,0.968063223,2
"ENG_062_MZB_LO_2165","ENG_062_MZB_LO_2165-28.10.2015","28.10.2015",2015,10,28,0.94468868,2
"ENG_062_MZB_LO_2165","ENG_062_MZB_LO_2165-21.09.2016","21.09.2016",2016,9,21,1.082429245,1
"ENG_062_MZB_LO_2165","ENG_062_MZB_LO_2165-10.10.2017","10.10.2017",2017,10,10,1.006660666,1
"ENG_062_MZB_LO_2165","ENG_062_MZB_LO_2165-25.09.2018","25.09.2018",2018,9,25,1.113365411,1
"ENG_062_MZB_LO_2165","ENG_062_MZB_LO_2165-06.11.2019","06.11.2019",2019,11,6,1.034204965,1
"ENG_062_MZB_LO_2165","ENG_062_MZB_LO_2165-13.10.2020","13.10.2020",2020,10,13,1.037289249,1
"ENG_062_MZB_LO_2165","ENG_062_MZB_LO_2165-18.10.2021","18.10.2021",2021,10,18,1.059686408,2
"ENG_062_MZB_LO_2165","ENG_062_MZB_LO_2165-17.10.2023","17.10.2023",2023,10,17,1.033705129,1
"ENG_062_MZB_LO_2166","ENG_062_MZB_LO_2166-28.11.2002","28.11.2002",2002,11,28,0.955458524,2
"ENG_062_MZB_LO_2166","ENG_062_MZB_LO_2166-29.09.2003","29.09.2003",2003,9,29,1.011458572,2
"ENG_062_MZB_LO_2166","ENG_062_MZB_LO_2166-27.09.2004","27.09.2004",2004,9,27,1.027741786,3
"ENG_062_MZB_LO_2166","ENG_062_MZB_LO_2166-05.10.2005","05.10.2005",2005,10,5,1.04799116,2
"ENG_062_MZB_LO_2166","ENG_062_MZB_LO_2166-21.09.2006","21.09.2006",2006,9,21,0.975560487,2
"ENG_062_MZB_LO_2166","ENG_062_MZB_LO_2166-05.09.2007","05.09.2007",2007,9,5,0.999986243,2
"ENG_062_MZB_LO_2166","ENG_062_MZB_LO_2166-29.09.2008","29.09.2008",2008,9,29,0.997390579,2
"ENG_062_MZB_LO_2166","ENG_062_MZB_LO_2166-12.11.2009","12.11.2009",2009,11,12,0.978334533,1
"ENG_062_MZB_LO_2166","ENG_062_MZB_LO_2166-02.11.2010","02.11.2010",2010,11,2,0.985197672,1
"ENG_062_MZB_LO_2166","ENG_062_MZB_LO_2166-07.10.2011","07.10.2011",2011,10,7,0.985264145,1
"ENG_062_MZB_LO_2166","ENG_062_MZB_LO_2166-12.11.2012","12.11.2012",2012,11,12,0.948497519,2
"ENG_062_MZB_LO_2166","ENG_062_MZB_LO_2166-20.09.2013","20.09.2013",2013,9,20,1.012011102,1
"ENG_062_MZB_LO_2166","ENG_062_MZB_LO_2166-10.09.2014","10.09.2014",2014,9,10,0.94729958,2
"ENG_062_MZB_LO_2166","ENG_062_MZB_LO_2166-16.09.2015","16.09.2015",2015,9,16,1.041628359,1
"ENG_062_MZB_LO_2166","ENG_062_MZB_LO_2166-04.10.2016","04.10.2016",2016,10,4,0.975469408,2
"ENG_062_MZB_LO_2166","ENG_062_MZB_LO_2166-15.11.2017","15.11.2017",2017,11,15,1.066794679,1
"ENG_062_MZB_LO_2166","ENG_062_MZB_LO_2166-04.11.2021","04.11.2021",2021,11,4,1.01079403,2
"ENG_062_MZB_LO_2166","ENG_062_MZB_LO_2166-27.09.2022","27.09.2022",2022,9,27,1.010391929,1
"ENG_062_MZB_LO_2166","ENG_062_MZB_LO_2166-04.10.2023","04.10.2023",2023,10,4,1.114522637,1
"ENG_062_MZB_LO_2167","ENG_062_MZB_LO_2167-21.10.2002","21.10.2002",2002,10,21,1.072965365,1
"ENG_062_MZB_LO_2167","ENG_062_MZB_LO_2167-02.10.2003","02.10.2003",2003,10,2,1.105345852,1
"ENG_062_MZB_LO_2167","ENG_062_MZB_LO_2167-13.09.2004","13.09.2004",2004,9,13,1.114432359,1
"ENG_062_MZB_LO_2167","ENG_062_MZB_LO_2167-22.09.2005","22.09.2005",2005,9,22,1.086134567,1
"ENG_062_MZB_LO_2167","ENG_062_MZB_LO_2167-18.10.2006","18.10.2006",2006,10,18,1.185106786,2
"ENG_062_MZB_LO_2167","ENG_062_MZB_LO_2167-10.09.2007","10.09.2007",2007,9,10,1.097610364,1
"ENG_062_MZB_LO_2167","ENG_062_MZB_LO_2167-10.09.2008","10.09.2008",2008,9,10,1.030457589,1
"ENG_062_MZB_LO_2167","ENG_062_MZB_LO_2167-13.10.2009","13.10.2009",2009,10,13,1.090955637,1
"ENG_062_MZB_LO_2167","ENG_062_MZB_LO_2167-09.09.2010","09.09.2010",2010,9,9,1.046375592,1
"ENG_062_MZB_LO_2167","ENG_062_MZB_LO_2167-05.10.2011","05.10.2011",2011,10,5,1.024903485,1
"ENG_062_MZB_LO_2167","ENG_062_MZB_LO_2167-16.10.2012","16.10.2012",2012,10,16,1.045573209,3
"ENG_062_MZB_LO_2167","ENG_062_MZB_LO_2167-11.09.2013","11.09.2013",2013,9,11,1.103144869,2
"ENG_062_MZB_LO_2167","ENG_062_MZB_LO_2167-05.11.2014","05.11.2014",2014,11,5,0.982224614,1
"ENG_062_MZB_LO_2169","ENG_062_MZB_LO_2169-14.10.2002","14.10.2002",2002,10,14,1.092983876,1
"ENG_062_MZB_LO_2169","ENG_062_MZB_LO_2169-09.10.2003","09.10.2003",2003,10,9,1.081728887,1
"ENG_062_MZB_LO_2169","ENG_062_MZB_LO_2169-27.09.2004","27.09.2004",2004,9,27,0.930658692,3
"ENG_062_MZB_LO_2169","ENG_062_MZB_LO_2169-05.10.2005","05.10.2005",2005,10,5,1.040352692,1
"ENG_062_MZB_LO_2169","ENG_062_MZB_LO_2169-21.09.2006","21.09.2006",2006,9,21,0.967486779,2
"ENG_062_MZB_LO_2169","ENG_062_MZB_LO_2169-29.09.2008","29.09.2008",2008,9,29,1.060336993,1
"ENG_062_MZB_LO_2169","ENG_062_MZB_LO_2169-04.11.2010","04.11.2010",2010,11,4,1.079515558,1
"ENG_062_MZB_LO_2169","ENG_062_MZB_LO_2169-02.09.2011","02.09.2011",2011,9,2,0.968738502,2
"ENG_062_MZB_LO_2169","ENG_062_MZB_LO_2169-16.09.2014","16.09.2014",2014,9,16,1.071457233,1
"ENG_062_MZB_LO_2169","ENG_062_MZB_LO_2169-01.09.2017","01.09.2017",2017,9,1,1.007646371,2
"ENG_062_MZB_LO_2169","ENG_062_MZB_LO_2169-18.09.2018","18.09.2018",2018,9,18,1.087042659,2
"ENG_062_MZB_LO_2169","ENG_062_MZB_LO_2169-14.11.2019","14.11.2019",2019,11,14,1.119671959,1
"ENG_062_MZB_LO_2169","ENG_062_MZB_LO_2169-12.11.2020","12.11.2020",2020,11,12,1.039720421,2
"ENG_062_MZB_LO_2169","ENG_062_MZB_LO_2169-13.09.2021","13.09.2021",2021,9,13,1.2425873,1
"ENG_062_MZB_LO_2170","ENG_062_MZB_LO_2170-14.10.2002","14.10.2002",2002,10,14,0.91087667,2
"ENG_062_MZB_LO_2170","ENG_062_MZB_LO_2170-16.10.2003","16.10.2003",2003,10,16,0.832798052,3
"ENG_062_MZB_LO_2170","ENG_062_MZB_LO_2170-27.09.2004","27.09.2004",2004,9,27,0.80053329,3
"ENG_062_MZB_LO_2170","ENG_062_MZB_LO_2170-05.10.2005","05.10.2005",2005,10,5,0.852192516,3
"ENG_062_MZB_LO_2170","ENG_062_MZB_LO_2170-21.09.2006","21.09.2006",2006,9,21,0.768410549,3
"ENG_062_MZB_LO_2170","ENG_062_MZB_LO_2170-12.11.2009","12.11.2009",2009,11,12,0.932159165,3
"ENG_062_MZB_LO_2170","ENG_062_MZB_LO_2170-05.09.2014","05.09.2014",2014,9,5,0.881984741,3
"ENG_062_MZB_LO_2171","ENG_062_MZB_LO_2171-04.11.2002","04.11.2002",2002,11,4,1.010079846,1
"ENG_062_MZB_LO_2171","ENG_062_MZB_LO_2171-09.09.2003","09.09.2003",2003,9,9,1.004341497,1
"ENG_062_MZB_LO_2171","ENG_062_MZB_LO_2171-27.10.2004","27.10.2004",2004,10,27,1.009989139,2
"ENG_062_MZB_LO_2171","ENG_062_MZB_LO_2171-08.11.2005","08.11.2005",2005,11,8,0.954072152,2
"ENG_062_MZB_LO_2171","ENG_062_MZB_LO_2171-30.10.2006","30.10.2006",2006,10,30,1.042284662,3
"ENG_062_MZB_LO_2171","ENG_062_MZB_LO_2171-29.09.2008","29.09.2008",2008,9,29,1.035364549,2
"ENG_062_MZB_LO_2171","ENG_062_MZB_LO_2171-15.10.2009","15.10.2009",2009,10,15,1.053012727,1
"ENG_062_MZB_LO_2171","ENG_062_MZB_LO_2171-03.11.2010","03.11.2010",2010,11,3,1.054515371,1
"ENG_062_MZB_LO_2171","ENG_062_MZB_LO_2171-02.11.2011","02.11.2011",2011,11,2,1.046779548,1
"ENG_062_MZB_LO_2171","ENG_062_MZB_LO_2171-15.11.2012","15.11.2012",2012,11,15,1.028234479,1
"ENG_062_MZB_LO_2171","ENG_062_MZB_LO_2171-21.10.2013","21.10.2013",2013,10,21,1.007373565,2
"ENG_062_MZB_LO_2171","ENG_062_MZB_LO_2171-07.09.2015","07.09.2015",2015,9,7,1.011563973,2
"ENG_062_MZB_LO_2171","ENG_062_MZB_LO_2171-07.10.2016","07.10.2016",2016,10,7,1.097675857,1
"ENG_062_MZB_LO_2171","ENG_062_MZB_LO_2171-15.11.2017","15.11.2017",2017,11,15,1.01496522,1
"ENG_062_MZB_LO_2171","ENG_062_MZB_LO_2171-31.10.2021","31.10.2021",2021,10,31,1.062679915,1
"ENG_062_MZB_LO_2172","ENG_062_MZB_LO_2172-04.11.2002","04.11.2002",2002,11,4,0.933663364,2
"ENG_062_MZB_LO_2172","ENG_062_MZB_LO_2172-08.11.2005","08.11.2005",2005,11,8,0.965733125,2
"ENG_062_MZB_LO_2172","ENG_062_MZB_LO_2172-29.09.2008","29.09.2008",2008,9,29,1.041542832,1
"ENG_062_MZB_LO_2172","ENG_062_MZB_LO_2172-15.10.2009","15.10.2009",2009,10,15,1.025396352,1
"ENG_062_MZB_LO_2172","ENG_062_MZB_LO_2172-06.09.2010","06.09.2010",2010,9,6,1.064449654,1
"ENG_062_MZB_LO_2172","ENG_062_MZB_LO_2172-02.11.2011","02.11.2011",2011,11,2,1.044202754,1
"ENG_062_MZB_LO_2172","ENG_062_MZB_LO_2172-06.11.2014","06.11.2014",2014,11,6,1.038540101,1
"ENG_062_MZB_LO_2173","ENG_062_MZB_LO_2173-04.11.2002","04.11.2002",2002,11,4,0.915682361,2
"ENG_062_MZB_LO_2173","ENG_062_MZB_LO_2173-09.09.2003","09.09.2003",2003,9,9,0.930672349,2
"ENG_062_MZB_LO_2173","ENG_062_MZB_LO_2173-27.10.2004","27.10.2004",2004,10,27,0.900123716,2
"ENG_062_MZB_LO_2173","ENG_062_MZB_LO_2173-08.11.2005","08.11.2005",2005,11,8,0.94007282,2
"ENG_062_MZB_LO_2173","ENG_062_MZB_LO_2173-30.10.2006","30.10.2006",2006,10,30,0.885980244,2
"ENG_062_MZB_LO_2173","ENG_062_MZB_LO_2173-29.09.2008","29.09.2008",2008,9,29,0.93700073,2
"ENG_062_MZB_LO_2173","ENG_062_MZB_LO_2173-15.10.2009","15.10.2009",2009,10,15,0.993913855,1
"ENG_062_MZB_LO_2173","ENG_062_MZB_LO_2173-06.09.2010","06.09.2010",2010,9,6,0.854316271,3
"ENG_062_MZB_LO_2173","ENG_062_MZB_LO_2173-23.09.2014","23.09.2014",2014,9,23,0.926157188,2
"ENG_062_MZB_LO_2175","ENG_062_MZB_LO_2175-10.10.2002","10.10.2002",2002,10,10,0.901371376,2
"ENG_062_MZB_LO_2175","ENG_062_MZB_LO_2175-10.09.2003","10.09.2003",2003,9,10,1.008076282,1
"ENG_062_MZB_LO_2175","ENG_062_MZB_LO_2175-28.10.2004","28.10.2004",2004,10,28,0.90714849,2
"ENG_062_MZB_LO_2175","ENG_062_MZB_LO_2175-04.10.2005","04.10.2005",2005,10,4,0.931848083,2
"ENG_062_MZB_LO_2175","ENG_062_MZB_LO_2175-02.10.2006","02.10.2006",2006,10,2,0.920092594,3
"ENG_062_MZB_LO_2175","ENG_062_MZB_LO_2175-12.09.2007","12.09.2007",2007,9,12,0.946696879,3
"ENG_062_MZB_LO_2175","ENG_062_MZB_LO_2175-13.09.2008","13.09.2008",2008,9,13,0.981098999,1
"ENG_062_MZB_LO_2175","ENG_062_MZB_LO_2175-29.09.2009","29.09.2009",2009,9,29,0.910661241,2
"ENG_062_MZB_LO_2175","ENG_062_MZB_LO_2175-20.10.2010","20.10.2010",2010,10,20,0.977624627,1
"ENG_062_MZB_LO_2175","ENG_062_MZB_LO_2175-01.11.2011","01.11.2011",2011,11,1,0.920219226,2
"ENG_062_MZB_LO_2175","ENG_062_MZB_LO_2175-21.11.2012","21.11.2012",2012,11,21,0.942061599,2
"ENG_062_MZB_LO_2175","ENG_062_MZB_LO_2175-25.09.2013","25.09.2013",2013,9,25,0.985584527,3
"ENG_062_MZB_LO_2175","ENG_062_MZB_LO_2175-23.09.2014","23.09.2014",2014,9,23,0.930678482,2
"ENG_062_MZB_LO_2175","ENG_062_MZB_LO_2175-16.09.2015","16.09.2015",2015,9,16,0.903239356,2
"ENG_062_MZB_LO_2175","ENG_062_MZB_LO_2175-14.09.2016","14.09.2016",2016,9,14,0.926121493,2
"ENG_062_MZB_LO_2175","ENG_062_MZB_LO_2175-06.09.2017","06.09.2017",2017,9,6,0.939917198,3
"ENG_062_MZB_LO_2175","ENG_062_MZB_LO_2175-24.09.2018","24.09.2018",2018,9,24,0.997556369,1
"ENG_062_MZB_LO_2175","ENG_062_MZB_LO_2175-21.10.2019","21.10.2019",2019,10,21,0.935444365,3
"ENG_062_MZB_LO_2175","ENG_062_MZB_LO_2175-11.11.2020","11.11.2020",2020,11,11,0.93409606,3
"ENG_062_MZB_LO_2175","ENG_062_MZB_LO_2175-20.09.2021","20.09.2021",2021,9,20,0.946969246,2
"ENG_062_MZB_LO_2175","ENG_062_MZB_LO_2175-27.09.2022","27.09.2022",2022,9,27,0.999357825,2
"ENG_062_MZB_LO_2175","ENG_062_MZB_LO_2175-04.10.2023","04.10.2023",2023,10,4,1.008474451,1
"ENG_062_MZB_LO_2176","ENG_062_MZB_LO_2176-10.10.2002","10.10.2002",2002,10,10,0.8187101,3
"ENG_062_MZB_LO_2176","ENG_062_MZB_LO_2176-10.09.2003","10.09.2003",2003,9,10,0.96964429,2
"ENG_062_MZB_LO_2176","ENG_062_MZB_LO_2176-28.10.2004","28.10.2004",2004,10,28,0.84146538,3
"ENG_062_MZB_LO_2176","ENG_062_MZB_LO_2176-19.10.2005","19.10.2005",2005,10,19,0.828668064,3
"ENG_062_MZB_LO_2176","ENG_062_MZB_LO_2176-04.10.2006","04.10.2006",2006,10,4,0.914276663,2
"ENG_062_MZB_LO_2176","ENG_062_MZB_LO_2176-28.10.2008","28.10.2008",2008,10,28,0.971629314,2
"ENG_062_MZB_LO_2176","ENG_062_MZB_LO_2176-29.09.2009","29.09.2009",2009,9,29,0.93865171,2
"ENG_062_MZB_LO_2176","ENG_062_MZB_LO_2176-13.10.2010","13.10.2010",2010,10,13,0.869689106,2
"ENG_062_MZB_LO_2176","ENG_062_MZB_LO_2176-09.09.2014","09.09.2014",2014,9,9,0.976321551,2
"ENG_062_MZB_LO_2176","ENG_062_MZB_LO_2176-04.09.2017","04.09.2017",2017,9,4,1.021115094,3
"ENG_062_MZB_LO_2177","ENG_062_MZB_LO_2177-28.10.2004","28.10.2004",2004,10,28,0.90796,3
"ENG_062_MZB_LO_2177","ENG_062_MZB_LO_2177-24.09.2007","24.09.2007",2007,9,24,0.961795241,1
"ENG_062_MZB_LO_2177","ENG_062_MZB_LO_2177-28.10.2008","28.10.2008",2008,10,28,0.963451508,1
"ENG_062_MZB_LO_2177","ENG_062_MZB_LO_2177-29.09.2009","29.09.2009",2009,9,29,0.894952894,2
"ENG_062_MZB_LO_2177","ENG_062_MZB_LO_2177-13.10.2010","13.10.2010",2010,10,13,0.917209552,2
"ENG_062_MZB_LO_2177","ENG_062_MZB_LO_2177-19.10.2011","19.10.2011",2011,10,19,0.966440865,1
"ENG_062_MZB_LO_2177","ENG_062_MZB_LO_2177-15.11.2012","15.11.2012",2012,11,15,0.923951102,2
"ENG_062_MZB_LO_2177","ENG_062_MZB_LO_2177-09.10.2013","09.10.2013",2013,10,9,1.010300579,1
"ENG_062_MZB_LO_2177","ENG_062_MZB_LO_2177-09.09.2014","09.09.2014",2014,9,9,1.048871585,1
"ENG_062_MZB_LO_2177","ENG_062_MZB_LO_2177-07.10.2015","07.10.2015",2015,10,7,0.976515556,1
"ENG_062_MZB_LO_2177","ENG_062_MZB_LO_2177-10.10.2017","10.10.2017",2017,10,10,0.96041372,2
"ENG_062_MZB_LO_2177","ENG_062_MZB_LO_2177-24.09.2018","24.09.2018",2018,9,24,0.989982229,1
"ENG_062_MZB_LO_2177","ENG_062_MZB_LO_2177-23.10.2019","23.10.2019",2019,10,23,0.917945447,2
"ENG_062_MZB_LO_2179","ENG_062_MZB_LO_2179-10.10.2002","10.10.2002",2002,10,10,0.861014587,3
"ENG_062_MZB_LO_2179","ENG_062_MZB_LO_2179-10.09.2003","10.09.2003",2003,9,10,0.78276835,3
"ENG_062_MZB_LO_2179","ENG_062_MZB_LO_2179-28.10.2004","28.10.2004",2004,10,28,0.835319135,3
"ENG_062_MZB_LO_2179","ENG_062_MZB_LO_2179-12.10.2005","12.10.2005",2005,10,12,0.904830918,2
"ENG_062_MZB_LO_2179","ENG_062_MZB_LO_2179-04.10.2006","04.10.2006",2006,10,4,0.893389267,2
"ENG_062_MZB_LO_2179","ENG_062_MZB_LO_2179-28.10.2008","28.10.2008",2008,10,28,0.928326321,2
"ENG_062_MZB_LO_2179","ENG_062_MZB_LO_2179-19.10.2011","19.10.2011",2011,10,19,0.907163602,2
"ENG_062_MZB_LO_2179","ENG_062_MZB_LO_2179-14.11.2012","14.11.2012",2012,11,14,0.81136892,3
"ENG_062_MZB_LO_2179","ENG_062_MZB_LO_2179-09.10.2013","09.10.2013",2013,10,9,0.861507199,3
"ENG_062_MZB_LO_2179","ENG_062_MZB_LO_2179-21.11.2014","21.11.2014",2014,11,21,0.778824678,3
"ENG_062_MZB_LO_2179","ENG_062_MZB_LO_2179-13.11.2015","13.11.2015",2015,11,13,0.825670963,3
"ENG_062_MZB_LO_2179","ENG_062_MZB_LO_2179-10.10.2017","10.10.2017",2017,10,10,0.916730527,3
"ENG_062_MZB_LO_2179","ENG_062_MZB_LO_2179-24.09.2018","24.09.2018",2018,9,24,0.988359916,2
"ENG_062_MZB_LO_2179","ENG_062_MZB_LO_2179-23.10.2019","23.10.2019",2019,10,23,0.88118222,2
"ENG_062_MZB_LO_2179","ENG_062_MZB_LO_2179-14.09.2021","14.09.2021",2021,9,14,0.962478605,2
"ENG_062_MZB_LO_2179","ENG_062_MZB_LO_2179-10.10.2023","10.10.2023",2023,10,10,0.925443249,2
"ENG_062_MZB_LO_2180","ENG_062_MZB_LO_2180-10.10.2002","10.10.2002",2002,10,10,0.90619421,3
"ENG_062_MZB_LO_2180","ENG_062_MZB_LO_2180-10.09.2003","10.09.2003",2003,9,10,0.822301461,3
"ENG_062_MZB_LO_2180","ENG_062_MZB_LO_2180-28.10.2004","28.10.2004",2004,10,28,0.916393548,3
"ENG_062_MZB_LO_2180","ENG_062_MZB_LO_2180-19.10.2005","19.10.2005",2005,10,19,0.937836828,2
"ENG_062_MZB_LO_2180","ENG_062_MZB_LO_2180-04.10.2006","04.10.2006",2006,10,4,0.961594567,2
"ENG_062_MZB_LO_2180","ENG_062_MZB_LO_2180-14.11.2012","14.11.2012",2012,11,14,0.843079228,3
"ENG_062_MZB_LO_2180","ENG_062_MZB_LO_2180-09.10.2013","09.10.2013",2013,10,9,0.824939674,3
"ENG_062_MZB_LO_2180","ENG_062_MZB_LO_2180-10.09.2014","10.09.2014",2014,9,10,0.956114644,3
"ENG_062_MZB_LO_2180","ENG_062_MZB_LO_2180-29.09.2015","29.09.2015",2015,9,29,0.788153284,5
"ENG_062_MZB_LO_2180","ENG_062_MZB_LO_2180-28.09.2016","28.09.2016",2016,9,28,0.914647472,2
"ENG_062_MZB_LO_2180","ENG_062_MZB_LO_2180-31.10.2017","31.10.2017",2017,10,31,1.12453726,5
"ENG_062_MZB_LO_2180","ENG_062_MZB_LO_2180-23.10.2019","23.10.2019",2019,10,23,0.904105075,5
"ENG_062_MZB_LO_2180","ENG_062_MZB_LO_2180-11.11.2020","11.11.2020",2020,11,11,0.861749384,3
"ENG_062_MZB_LO_2180","ENG_062_MZB_LO_2180-24.10.2021","24.10.2021",2021,10,24,0.911146051,3
"ENG_062_MZB_LO_2180","ENG_062_MZB_LO_2180-10.10.2023","10.10.2023",2023,10,10,0.899582433,3
"ENG_062_MZB_LO_2181","ENG_062_MZB_LO_2181-28.10.2004","28.10.2004",2004,10,28,0.794154726,3
"ENG_062_MZB_LO_2181","ENG_062_MZB_LO_2181-02.10.2007","02.10.2007",2007,10,2,0.859351097,3
"ENG_062_MZB_LO_2181","ENG_062_MZB_LO_2181-28.09.2011","28.09.2011",2011,9,28,0.876839345,3
"ENG_062_MZB_LO_2181","ENG_062_MZB_LO_2181-14.11.2012","14.11.2012",2012,11,14,0.926370109,2
"ENG_062_MZB_LO_2181","ENG_062_MZB_LO_2181-09.10.2013","09.10.2013",2013,10,9,0.822492647,3
"ENG_062_MZB_LO_2181","ENG_062_MZB_LO_2181-07.10.2014","07.10.2014",2014,10,7,0.956564309,5
"ENG_062_MZB_LO_2181","ENG_062_MZB_LO_2181-29.09.2015","29.09.2015",2015,9,29,0.908187797,3
"ENG_062_MZB_LO_2181","ENG_062_MZB_LO_2181-28.09.2016","28.09.2016",2016,9,28,0.955904716,2
"ENG_062_MZB_LO_2181","ENG_062_MZB_LO_2181-20.11.2017","20.11.2017",2017,11,20,0.919197079,2
"ENG_062_MZB_LO_2181","ENG_062_MZB_LO_2181-24.09.2018","24.09.2018",2018,9,24,0.879715568,3
"ENG_062_MZB_LO_2181","ENG_062_MZB_LO_2181-23.10.2019","23.10.2019",2019,10,23,0.867228974,3
"ENG_062_MZB_LO_2181","ENG_062_MZB_LO_2181-11.11.2020","11.11.2020",2020,11,11,0.900126806,3
"ENG_062_MZB_LO_2181","ENG_062_MZB_LO_2181-24.09.2021","24.09.2021",2021,9,24,0.880118302,2
"ENG_062_MZB_LO_2181","ENG_062_MZB_LO_2181-10.10.2023","10.10.2023",2023,10,10,0.902245068,2
"ENG_062_MZB_LO_2183","ENG_062_MZB_LO_2183-04.11.2003","04.11.2003",2003,11,4,0.748047202,3
"ENG_062_MZB_LO_2183","ENG_062_MZB_LO_2183-12.09.2006","12.09.2006",2006,9,12,0.677829117,4
"ENG_062_MZB_LO_2183","ENG_062_MZB_LO_2183-15.09.2008","15.09.2008",2008,9,15,0.717235872,4
"ENG_062_MZB_LO_2183","ENG_062_MZB_LO_2183-30.09.2009","30.09.2009",2009,9,30,0.678968185,4
"ENG_062_MZB_LO_2183","ENG_062_MZB_LO_2183-04.11.2010","04.11.2010",2010,11,4,0.62566303,4
"ENG_062_MZB_LO_2183","ENG_062_MZB_LO_2183-09.11.2011","09.11.2011",2011,11,9,0.732867948,3
"ENG_062_MZB_LO_2183","ENG_062_MZB_LO_2183-15.11.2012","15.11.2012",2012,11,15,0.755986957,4
"ENG_062_MZB_LO_2183","ENG_062_MZB_LO_2183-16.09.2013","16.09.2013",2013,9,16,0.749369195,3
"ENG_062_MZB_LO_2183","ENG_062_MZB_LO_2183-03.11.2015","03.11.2015",2015,11,3,0.70194792,4
"ENG_062_MZB_LO_2183","ENG_062_MZB_LO_2183-17.10.2016","17.10.2016",2016,10,17,0.746909226,3
"ENG_062_MZB_LO_2185","ENG_062_MZB_LO_2185-21.10.2002","21.10.2002",2002,10,21,1.09717083,1
"ENG_062_MZB_LO_2185","ENG_062_MZB_LO_2185-14.10.2005","14.10.2005",2005,10,14,1.095197856,1
"ENG_062_MZB_LO_2185","ENG_062_MZB_LO_2185-10.09.2008","10.09.2008",2008,9,10,1.110639714,1
"ENG_062_MZB_LO_2185","ENG_062_MZB_LO_2185-21.09.2009","21.09.2009",2009,9,21,1.040959247,3
"ENG_062_MZB_LO_2185","ENG_062_MZB_LO_2185-16.11.2010","16.11.2010",2010,11,16,1.130444881,1
"ENG_062_MZB_LO_2185","ENG_062_MZB_LO_2185-19.10.2011","19.10.2011",2011,10,19,1.047427466,2
"ENG_062_MZB_LO_2185","ENG_062_MZB_LO_2185-18.10.2012","18.10.2012",2012,10,18,1.019814785,3
"ENG_062_MZB_LO_2185","ENG_062_MZB_LO_2185-22.10.2013","22.10.2013",2013,10,22,1.043345275,2
"ENG_062_MZB_LO_2186","ENG_062_MZB_LO_2186-23.10.2002","23.10.2002",2002,10,23,0.779161019,3
"ENG_062_MZB_LO_2186","ENG_062_MZB_LO_2186-24.09.2003","24.09.2003",2003,9,24,0.680266362,4
"ENG_062_MZB_LO_2186","ENG_062_MZB_LO_2186-08.11.2004","08.11.2004",2004,11,8,0.704853903,4
"ENG_062_MZB_LO_2186","ENG_062_MZB_LO_2186-26.10.2005","26.10.2005",2005,10,26,0.8544627,5
"ENG_062_MZB_LO_2186","ENG_062_MZB_LO_2186-15.09.2006","15.09.2006",2006,9,15,0.743344683,3
"ENG_062_MZB_LO_2186","ENG_062_MZB_LO_2186-02.09.2008","02.09.2008",2008,9,2,0.789204379,3
"ENG_062_MZB_LO_2186","ENG_062_MZB_LO_2186-08.09.2009","08.09.2009",2009,9,8,0.778317263,4
"ENG_062_MZB_LO_2186","ENG_062_MZB_LO_2186-09.09.2010","09.09.2010",2010,9,9,0.807812013,4
"ENG_062_MZB_LO_2186","ENG_062_MZB_LO_2186-07.10.2011","07.10.2011",2011,10,7,0.713441832,4
"ENG_062_MZB_LO_2186","ENG_062_MZB_LO_2186-21.11.2012","21.11.2012",2012,11,21,0.769475019,3
"ENG_062_MZB_LO_2186","ENG_062_MZB_LO_2186-08.11.2013","08.11.2013",2013,11,8,0.777453803,4
"ENG_062_MZB_LO_2186","ENG_062_MZB_LO_2186-05.09.2014","05.09.2014",2014,9,5,0.721843869,5
"ENG_062_MZB_LO_2186","ENG_062_MZB_LO_2186-02.11.2015","02.11.2015",2015,11,2,0.814177285,4
"ENG_062_MZB_LO_2186","ENG_062_MZB_LO_2186-26.09.2016","26.09.2016",2016,9,26,0.806183421,4
"ENG_062_MZB_LO_2186","ENG_062_MZB_LO_2186-23.11.2017","23.11.2017",2017,11,23,0.681483416,5
"ENG_062_MZB_LO_2188","ENG_062_MZB_LO_2188-18.11.2002","18.11.2002",2002,11,18,0.824154841,3
"ENG_062_MZB_LO_2188","ENG_062_MZB_LO_2188-04.11.2003","04.11.2003",2003,11,4,0.892873607,3
"ENG_062_MZB_LO_2188","ENG_062_MZB_LO_2188-06.09.2004","06.09.2004",2004,9,6,0.822379986,3
"ENG_062_MZB_LO_2188","ENG_062_MZB_LO_2188-19.09.2005","19.09.2005",2005,9,19,0.920996231,2
"ENG_062_MZB_LO_2188","ENG_062_MZB_LO_2188-12.09.2006","12.09.2006",2006,9,12,0.906584918,2
"ENG_062_MZB_LO_2188","ENG_062_MZB_LO_2188-05.09.2007","05.09.2007",2007,9,5,0.924678284,2
"ENG_062_MZB_LO_2188","ENG_062_MZB_LO_2188-15.09.2008","15.09.2008",2008,9,15,0.853234176,3
"ENG_062_MZB_LO_2188","ENG_062_MZB_LO_2188-04.11.2010","04.11.2010",2010,11,4,0.969720457,1
"ENG_062_MZB_LO_2188","ENG_062_MZB_LO_2188-24.11.2015","24.11.2015",2015,11,24,0.963106026,1
"ENG_062_MZB_LO_2188","ENG_062_MZB_LO_2188-13.09.2018","13.09.2018",2018,9,13,0.871573888,2
"ENG_062_MZB_LO_2190","ENG_062_MZB_LO_2190-06.09.2004","06.09.2004",2004,9,6,0.952681503,3
"ENG_062_MZB_LO_2190","ENG_062_MZB_LO_2190-05.09.2007","05.09.2007",2007,9,5,0.877955649,5
"ENG_062_MZB_LO_2190","ENG_062_MZB_LO_2190-30.09.2009","30.09.2009",2009,9,30,1.071161763,1
"ENG_062_MZB_LO_2190","ENG_062_MZB_LO_2190-04.11.2010","04.11.2010",2010,11,4,1.083185747,1
"ENG_062_MZB_LO_2190","ENG_062_MZB_LO_2190-09.11.2011","09.11.2011",2011,11,9,0.889046027,3
"ENG_062_MZB_LO_2190","ENG_062_MZB_LO_2190-19.09.2012","19.09.2012",2012,9,19,0.993225855,1
"ENG_062_MZB_LO_2190","ENG_062_MZB_LO_2190-07.10.2013","07.10.2013",2013,10,7,0.871827671,3
"ENG_062_MZB_LO_2190","ENG_062_MZB_LO_2190-17.11.2015","17.11.2015",2015,11,17,1.049160572,1
"ENG_062_MZB_LO_2190","ENG_062_MZB_LO_2190-13.09.2018","13.09.2018",2018,9,13,1.016691216,5
"ENG_062_MZB_LO_2193","ENG_062_MZB_LO_2193-04.11.2003","04.11.2003",2003,11,4,0.718204239,4
"ENG_062_MZB_LO_2193","ENG_062_MZB_LO_2193-12.09.2006","12.09.2006",2006,9,12,0.717433779,4
"ENG_062_MZB_LO_2193","ENG_062_MZB_LO_2193-15.09.2008","15.09.2008",2008,9,15,0.762758853,3
"ENG_062_MZB_LO_2193","ENG_062_MZB_LO_2193-30.09.2009","30.09.2009",2009,9,30,0.751615919,5
"ENG_062_MZB_LO_2193","ENG_062_MZB_LO_2193-04.11.2010","04.11.2010",2010,11,4,0.819857241,3
"ENG_062_MZB_LO_2193","ENG_062_MZB_LO_2193-09.11.2011","09.11.2011",2011,11,9,0.772849646,3
"ENG_062_MZB_LO_2193","ENG_062_MZB_LO_2193-19.09.2012","19.09.2012",2012,9,19,0.784156985,3
"ENG_062_MZB_LO_2193","ENG_062_MZB_LO_2193-18.11.2013","18.11.2013",2013,11,18,0.784789413,5
"ENG_062_MZB_LO_2193","ENG_062_MZB_LO_2193-17.11.2015","17.11.2015",2015,11,17,0.741954528,4
"ENG_062_MZB_LO_2194","ENG_062_MZB_LO_2194-25.11.2002","25.11.2002",2002,11,25,0.848297994,3
"ENG_062_MZB_LO_2194","ENG_062_MZB_LO_2194-17.09.2003","17.09.2003",2003,9,17,0.83997965,3
"ENG_062_MZB_LO_2194","ENG_062_MZB_LO_2194-29.09.2004","29.09.2004",2004,9,29,0.835885142,3
"ENG_062_MZB_LO_2194","ENG_062_MZB_LO_2194-04.10.2005","04.10.2005",2005,10,4,0.957999892,2
"ENG_062_MZB_LO_2194","ENG_062_MZB_LO_2194-02.10.2006","02.10.2006",2006,10,2,0.987824146,2
"ENG_062_MZB_LO_2194","ENG_062_MZB_LO_2194-08.09.2009","08.09.2009",2009,9,8,1.049789512,1
"ENG_062_MZB_LO_2194","ENG_062_MZB_LO_2194-11.09.2013","11.09.2013",2013,9,11,1.033953046,2
"ENG_062_MZB_LO_2195","ENG_062_MZB_LO_2195-20.11.2002","20.11.2002",2002,11,20,0.930589209,3
"ENG_062_MZB_LO_2195","ENG_062_MZB_LO_2195-17.09.2003","17.09.2003",2003,9,17,1.038842592,3
"ENG_062_MZB_LO_2195","ENG_062_MZB_LO_2195-04.10.2005","04.10.2005",2005,10,4,0.959518229,2
"ENG_062_MZB_LO_2195","ENG_062_MZB_LO_2195-12.09.2008","12.09.2008",2008,9,12,0.953236145,3
"ENG_062_MZB_LO_2195","ENG_062_MZB_LO_2195-08.09.2009","08.09.2009",2009,9,8,0.98299419,2
"ENG_062_MZB_LO_2195","ENG_062_MZB_LO_2195-04.10.2010","04.10.2010",2010,10,4,0.997704318,2
"ENG_062_MZB_LO_2195","ENG_062_MZB_LO_2195-01.11.2011","01.11.2011",2011,11,1,1.007150336,5
"ENG_062_MZB_LO_2195","ENG_062_MZB_LO_2195-10.10.2012","10.10.2012",2012,10,10,1.127598859,2
"ENG_062_MZB_LO_2195","ENG_062_MZB_LO_2195-09.10.2013","09.10.2013",2013,10,9,1.090577109,5
"ENG_062_MZB_LO_2195","ENG_062_MZB_LO_2195-02.09.2014","02.09.2014",2014,9,2,1.006487669,3
"ENG_062_MZB_LO_2195","ENG_062_MZB_LO_2195-02.09.2015","02.09.2015",2015,9,2,1.151860995,5
"ENG_062_MZB_LO_2195","ENG_062_MZB_LO_2195-05.09.2016","05.09.2016",2016,9,5,1.051592524,3
"ENG_062_MZB_LO_2195","ENG_062_MZB_LO_2195-14.09.2017","14.09.2017",2017,9,14,1.148516546,5
"ENG_062_MZB_LO_2195","ENG_062_MZB_LO_2195-25.09.2018","25.09.2018",2018,9,25,1.072638807,3
"ENG_062_MZB_LO_2195","ENG_062_MZB_LO_2195-11.09.2019","11.09.2019",2019,9,11,1.002835229,3
"ENG_062_MZB_LO_2198","ENG_062_MZB_LO_2198-28.11.2002","28.11.2002",2002,11,28,0.887830472,2
"ENG_062_MZB_LO_2198","ENG_062_MZB_LO_2198-16.10.2003","16.10.2003",2003,10,16,0.915694188,2
"ENG_062_MZB_LO_2198","ENG_062_MZB_LO_2198-27.09.2004","27.09.2004",2004,9,27,0.874811819,2
"ENG_062_MZB_LO_2198","ENG_062_MZB_LO_2198-06.10.2005","06.10.2005",2005,10,6,0.871456838,3
"ENG_062_MZB_LO_2198","ENG_062_MZB_LO_2198-21.09.2006","21.09.2006",2006,9,21,0.875083892,3
"ENG_062_MZB_LO_2198","ENG_062_MZB_LO_2198-29.09.2008","29.09.2008",2008,9,29,0.917204579,2
"ENG_062_MZB_LO_2198","ENG_062_MZB_LO_2198-13.11.2013","13.11.2013",2013,11,13,0.886430723,3
"ENG_062_MZB_LO_2198","ENG_062_MZB_LO_2198-21.09.2015","21.09.2015",2015,9,21,0.906434904,3
"ENG_062_MZB_LO_2199","ENG_062_MZB_LO_2199-20.11.2002","20.11.2002",2002,11,20,0.91586511,2
"ENG_062_MZB_LO_2199","ENG_062_MZB_LO_2199-16.10.2003","16.10.2003",2003,10,16,0.906396598,2
"ENG_062_MZB_LO_2199","ENG_062_MZB_LO_2199-27.09.2004","27.09.2004",2004,9,27,0.889725728,3
"ENG_062_MZB_LO_2199","ENG_062_MZB_LO_2199-05.10.2005","05.10.2005",2005,10,5,0.942654931,2
"ENG_062_MZB_LO_2199","ENG_062_MZB_LO_2199-21.09.2006","21.09.2006",2006,9,21,0.878198153,3
"ENG_062_MZB_LO_2199","ENG_062_MZB_LO_2199-29.09.2008","29.09.2008",2008,9,29,0.945233458,2
"ENG_062_MZB_LO_2199","ENG_062_MZB_LO_2199-02.11.2011","02.11.2011",2011,11,2,0.93852552,2
"ENG_062_MZB_LO_2199","ENG_062_MZB_LO_2199-17.10.2012","17.10.2012",2012,10,17,0.919192386,2
"ENG_062_MZB_LO_2199","ENG_062_MZB_LO_2199-05.09.2013","05.09.2013",2013,9,5,0.929783319,2
"ENG_062_MZB_LO_2199","ENG_062_MZB_LO_2199-16.09.2014","16.09.2014",2014,9,16,0.978938394,1
"ENG_062_MZB_LO_2199","ENG_062_MZB_LO_2199-21.09.2015","21.09.2015",2015,9,21,0.929962089,2
"ENG_062_MZB_LO_2199","ENG_062_MZB_LO_2199-13.09.2016","13.09.2016",2016,9,13,0.905892044,2
"ENG_062_MZB_LO_2199","ENG_062_MZB_LO_2199-15.11.2017","15.11.2017",2017,11,15,0.965635307,2
"ENG_062_MZB_LO_2199","ENG_062_MZB_LO_2199-18.09.2018","18.09.2018",2018,9,18,0.945679283,2
"ENG_062_MZB_LO_2199","ENG_062_MZB_LO_2199-04.11.2019","04.11.2019",2019,11,4,1.010323355,2
"ENG_062_MZB_LO_2199","ENG_062_MZB_LO_2199-12.11.2020","12.11.2020",2020,11,12,0.962986316,2
"ENG_062_MZB_LO_2199","ENG_062_MZB_LO_2199-13.09.2021","13.09.2021",2021,9,13,0.957246825,2
"ENG_062_MZB_LO_2199","ENG_062_MZB_LO_2199-18.10.2023","18.10.2023",2023,10,18,0.958943404,2
"ENG_062_MZB_LO_2200","ENG_062_MZB_LO_2200-10.10.2003","10.10.2003",2003,10,10,1.200603688,1
"ENG_062_MZB_LO_2200","ENG_062_MZB_LO_2200-15.09.2006","15.09.2006",2006,9,15,0.947034885,3
"ENG_062_MZB_LO_2200","ENG_062_MZB_LO_2200-04.09.2008","04.09.2008",2008,9,4,1.10172396,1
"ENG_062_MZB_LO_2200","ENG_062_MZB_LO_2200-21.10.2009","21.10.2009",2009,10,21,0.995126767,3
"ENG_062_MZB_LO_2200","ENG_062_MZB_LO_2200-27.09.2010","27.09.2010",2010,9,27,1.084480292,1
"ENG_062_MZB_LO_2200","ENG_062_MZB_LO_2200-12.11.2012","12.11.2012",2012,11,12,1.011658094,1
"ENG_062_MZB_LO_2200","ENG_062_MZB_LO_2200-14.09.2015","14.09.2015",2015,9,14,0.986910478,2
"ENG_062_MZB_LO_2200","ENG_062_MZB_LO_2200-01.10.2018","01.10.2018",2018,10,1,1.083611669,1
"ENG_062_MZB_LO_2201","ENG_062_MZB_LO_2201-24.09.2002","24.09.2002",2002,9,24,1.031814642,1
"ENG_062_MZB_LO_2201","ENG_062_MZB_LO_2201-02.10.2003","02.10.2003",2003,10,2,0.972777191,1
"ENG_062_MZB_LO_2201","ENG_062_MZB_LO_2201-23.09.2004","23.09.2004",2004,9,23,0.967055977,1
"ENG_062_MZB_LO_2201","ENG_062_MZB_LO_2201-26.09.2005","26.09.2005",2005,9,26,0.952975236,2
"ENG_062_MZB_LO_2201","ENG_062_MZB_LO_2201-04.10.2006","04.10.2006",2006,10,4,1.031130721,2
"ENG_062_MZB_LO_2201","ENG_062_MZB_LO_2201-21.10.2009","21.10.2009",2009,10,21,0.997798929,1
"ENG_062_MZB_LO_2201","ENG_062_MZB_LO_2201-20.09.2010","20.09.2010",2010,9,20,0.943008367,2
"ENG_062_MZB_LO_2201","ENG_062_MZB_LO_2201-05.10.2011","05.10.2011",2011,10,5,0.983231478,1
"ENG_062_MZB_LO_2201","ENG_062_MZB_LO_2201-13.09.2012","13.09.2012",2012,9,13,1.005429703,1
"ENG_062_MZB_LO_2201","ENG_062_MZB_LO_2201-08.10.2013","08.10.2013",2013,10,8,0.966108766,1
"ENG_062_MZB_LO_2201","ENG_062_MZB_LO_2201-02.10.2014","02.10.2014",2014,10,2,0.887523356,2
"ENG_062_MZB_LO_2201","ENG_062_MZB_LO_2201-02.09.2015","02.09.2015",2015,9,2,0.852061196,3
"ENG_062_MZB_LO_2201","ENG_062_MZB_LO_2201-07.09.2016","07.09.2016",2016,9,7,0.962172914,2
"ENG_062_MZB_LO_2201","ENG_062_MZB_LO_2201-20.09.2018","20.09.2018",2018,9,20,0.942346688,2
"ENG_062_MZB_LO_2201","ENG_062_MZB_LO_2201-04.11.2021","04.11.2021",2021,11,4,0.998529347,1
"ENG_062_MZB_LO_2202","ENG_062_MZB_LO_2202-28.11.2002","28.11.2002",2002,11,28,1.107537089,1
"ENG_062_MZB_LO_2202","ENG_062_MZB_LO_2202-15.09.2003","15.09.2003",2003,9,15,1.153613387,1
"ENG_062_MZB_LO_2202","ENG_062_MZB_LO_2202-13.09.2004","13.09.2004",2004,9,13,1.132744246,1
"ENG_062_MZB_LO_2202","ENG_062_MZB_LO_2202-22.09.2005","22.09.2005",2005,9,22,1.194711991,2
"ENG_062_MZB_LO_2202","ENG_062_MZB_LO_2202-15.09.2006","15.09.2006",2006,9,15,1.075950249,1
"ENG_062_MZB_LO_2202","ENG_062_MZB_LO_2202-17.09.2007","17.09.2007",2007,9,17,1.179599528,1
"ENG_062_MZB_LO_2202","ENG_062_MZB_LO_2202-16.10.2008","16.10.2008",2008,10,16,1.089256186,1
"ENG_062_MZB_LO_2202","ENG_062_MZB_LO_2202-19.10.2009","19.10.2009",2009,10,19,1.084469079,1
"ENG_062_MZB_LO_2202","ENG_062_MZB_LO_2202-23.11.2010","23.11.2010",2010,11,23,1.13536418,1
"ENG_062_MZB_LO_2202","ENG_062_MZB_LO_2202-11.10.2011","11.10.2011",2011,10,11,1.129162977,1
"ENG_062_MZB_LO_2202","ENG_062_MZB_LO_2202-02.10.2012","02.10.2012",2012,10,2,1.141204813,1
"ENG_062_MZB_LO_2202","ENG_062_MZB_LO_2202-12.11.2013","12.11.2013",2013,11,12,1.130643774,1
"ENG_062_MZB_LO_2202","ENG_062_MZB_LO_2202-30.09.2014","30.09.2014",2014,9,30,1.17608235,1
"ENG_062_MZB_LO_2202","ENG_062_MZB_LO_2202-23.09.2015","23.09.2015",2015,9,23,1.085790597,1
"ENG_062_MZB_LO_2202","ENG_062_MZB_LO_2202-07.09.2016","07.09.2016",2016,9,7,1.062029065,1
"ENG_062_MZB_LO_2202","ENG_062_MZB_LO_2202-14.09.2017","14.09.2017",2017,9,14,1.129020272,2
"ENG_062_MZB_LO_2202","ENG_062_MZB_LO_2202-20.09.2018","20.09.2018",2018,9,20,1.207453995,3
"ENG_062_MZB_LO_2202","ENG_062_MZB_LO_2202-06.11.2019","06.11.2019",2019,11,6,1.114661388,2
"ENG_062_MZB_LO_2203","ENG_062_MZB_LO_2203-21.10.2002","21.10.2002",2002,10,21,1.121370329,1
"ENG_062_MZB_LO_2203","ENG_062_MZB_LO_2203-19.09.2003","19.09.2003",2003,9,19,1.074090187,1
"ENG_062_MZB_LO_2203","ENG_062_MZB_LO_2203-14.09.2004","14.09.2004",2004,9,14,1.030335174,1
"ENG_062_MZB_LO_2203","ENG_062_MZB_LO_2203-16.09.2005","16.09.2005",2005,9,16,1.11873099,1
"ENG_062_MZB_LO_2203","ENG_062_MZB_LO_2203-02.10.2006","02.10.2006",2006,10,2,1.161528723,1
"ENG_062_MZB_LO_2203","ENG_062_MZB_LO_2203-30.09.2008","30.09.2008",2008,9,30,1.141888942,1
"ENG_062_MZB_LO_2203","ENG_062_MZB_LO_2203-15.10.2009","15.10.2009",2009,10,15,1.072788813,1
"ENG_062_MZB_LO_2203","ENG_062_MZB_LO_2203-14.09.2010","14.09.2010",2010,9,14,1.225909268,1
"ENG_062_MZB_LO_2203","ENG_062_MZB_LO_2203-08.09.2011","08.09.2011",2011,9,8,1.112791433,1
"ENG_062_MZB_LO_2203","ENG_062_MZB_LO_2203-16.10.2012","16.10.2012",2012,10,16,1.146130731,1
"ENG_062_MZB_LO_2203","ENG_062_MZB_LO_2203-09.09.2013","09.09.2013",2013,9,9,1.111981518,3
"ENG_062_MZB_LO_2203","ENG_062_MZB_LO_2203-16.09.2014","16.09.2014",2014,9,16,1.08899213,3
"ENG_062_MZB_LO_2203","ENG_062_MZB_LO_2203-06.09.2021","06.09.2021",2021,9,6,1.185681496,2
"ENG_062_MZB_LO_2204","ENG_062_MZB_LO_2204-21.10.2002","21.10.2002",2002,10,21,1.023517243,2
"ENG_062_MZB_LO_2204","ENG_062_MZB_LO_2204-10.10.2003","10.10.2003",2003,10,10,1.064090411,1
"ENG_062_MZB_LO_2204","ENG_062_MZB_LO_2204-20.10.2004","20.10.2004",2004,10,20,1.033739244,1
"ENG_062_MZB_LO_2204","ENG_062_MZB_LO_2204-10.10.2005","10.10.2005",2005,10,10,1.026617447,1
"ENG_062_MZB_LO_2204","ENG_062_MZB_LO_2204-02.10.2006","02.10.2006",2006,10,2,1.002931609,1
"ENG_062_MZB_LO_2204","ENG_062_MZB_LO_2204-25.09.2008","25.09.2008",2008,9,25,1.062063363,1
"ENG_062_MZB_LO_2204","ENG_062_MZB_LO_2204-21.09.2009","21.09.2009",2009,9,21,1.071218787,1
"ENG_062_MZB_LO_2204","ENG_062_MZB_LO_2204-20.09.2010","20.09.2010",2010,9,20,1.030037226,1
"ENG_062_MZB_LO_2204","ENG_062_MZB_LO_2204-14.11.2011","14.11.2011",2011,11,14,1.026875548,1
"ENG_062_MZB_LO_2204","ENG_062_MZB_LO_2204-20.11.2012","20.11.2012",2012,11,20,1.031581203,1
"ENG_062_MZB_LO_2204","ENG_062_MZB_LO_2204-19.11.2013","19.11.2013",2013,11,19,1.09984719,1
"ENG_062_MZB_LO_2204","ENG_062_MZB_LO_2204-05.11.2014","05.11.2014",2014,11,5,1.087359022,1
"ENG_062_MZB_LO_2206","ENG_062_MZB_LO_2206-15.10.2002","15.10.2002",2002,10,15,0.891143469,2
"ENG_062_MZB_LO_2206","ENG_062_MZB_LO_2206-06.10.2003","06.10.2003",2003,10,6,0.848386051,3
"ENG_062_MZB_LO_2206","ENG_062_MZB_LO_2206-20.09.2004","20.09.2004",2004,9,20,0.837467306,3
"ENG_062_MZB_LO_2206","ENG_062_MZB_LO_2206-12.10.2005","12.10.2005",2005,10,12,0.851364726,3
"ENG_062_MZB_LO_2206","ENG_062_MZB_LO_2206-04.10.2006","04.10.2006",2006,10,4,0.786448176,3
"ENG_062_MZB_LO_2206","ENG_062_MZB_LO_2206-03.09.2008","03.09.2008",2008,9,3,0.882310252,2
"ENG_062_MZB_LO_2206","ENG_062_MZB_LO_2206-28.09.2011","28.09.2011",2011,9,28,0.94184222,3
"ENG_062_MZB_LO_2206","ENG_062_MZB_LO_2206-16.10.2012","16.10.2012",2012,10,16,0.912969019,3
"ENG_062_MZB_LO_2206","ENG_062_MZB_LO_2206-05.09.2013","05.09.2013",2013,9,5,0.949850578,2
"ENG_062_MZB_LO_2206","ENG_062_MZB_LO_2206-10.11.2015","10.11.2015",2015,11,10,0.801224928,3
"ENG_062_MZB_LO_2207","ENG_062_MZB_LO_2207-15.10.2002","15.10.2002",2002,10,15,0.76574374,3
"ENG_062_MZB_LO_2207","ENG_062_MZB_LO_2207-06.10.2003","06.10.2003",2003,10,6,0.80494146,3
"ENG_062_MZB_LO_2207","ENG_062_MZB_LO_2207-20.09.2004","20.09.2004",2004,9,20,0.857403655,3
"ENG_062_MZB_LO_2207","ENG_062_MZB_LO_2207-12.10.2005","12.10.2005",2005,10,12,0.806384184,5
"ENG_062_MZB_LO_2207","ENG_062_MZB_LO_2207-04.10.2006","04.10.2006",2006,10,4,0.888441752,2
"ENG_062_MZB_LO_2207","ENG_062_MZB_LO_2207-28.09.2009","28.09.2009",2009,9,28,0.863182793,3
"ENG_062_MZB_LO_2207","ENG_062_MZB_LO_2207-02.09.2013","02.09.2013",2013,9,2,0.865114656,3
"ENG_062_MZB_LO_2207","ENG_062_MZB_LO_2207-18.09.2015","18.09.2015",2015,9,18,0.886184013,3
"ENG_062_MZB_LO_2207","ENG_062_MZB_LO_2207-24.10.2021","24.10.2021",2021,10,24,0.922786801,5
"ENG_062_MZB_LO_2208","ENG_062_MZB_LO_2208-15.10.2002","15.10.2002",2002,10,15,0.897233054,3
"ENG_062_MZB_LO_2208","ENG_062_MZB_LO_2208-20.09.2004","20.09.2004",2004,9,20,0.837968552,3
"ENG_062_MZB_LO_2208","ENG_062_MZB_LO_2208-12.10.2005","12.10.2005",2005,10,12,0.949366257,5
"ENG_062_MZB_LO_2208","ENG_062_MZB_LO_2208-04.10.2006","04.10.2006",2006,10,4,0.976134926,3
"ENG_062_MZB_LO_2208","ENG_062_MZB_LO_2208-03.09.2008","03.09.2008",2008,9,3,0.868398436,3
"ENG_062_MZB_LO_2208","ENG_062_MZB_LO_2208-28.09.2009","28.09.2009",2009,9,28,0.976954449,3
"ENG_062_MZB_LO_2208","ENG_062_MZB_LO_2208-27.10.2010","27.10.2010",2010,10,27,1.018124031,3
"ENG_062_MZB_LO_2208","ENG_062_MZB_LO_2208-19.10.2011","19.10.2011",2011,10,19,0.957622095,3
"ENG_062_MZB_LO_2208","ENG_062_MZB_LO_2208-16.10.2012","16.10.2012",2012,10,16,1.043727397,2
"ENG_062_MZB_LO_2208","ENG_062_MZB_LO_2208-03.09.2013","03.09.2013",2013,9,3,1.000736591,3
"ENG_062_MZB_LO_2208","ENG_062_MZB_LO_2208-19.09.2014","19.09.2014",2014,9,19,0.907538674,3
"ENG_062_MZB_LO_2208","ENG_062_MZB_LO_2208-10.11.2015","10.11.2015",2015,11,10,0.85439789,3
"ENG_062_MZB_LO_2208","ENG_062_MZB_LO_2208-06.11.2018","06.11.2018",2018,11,6,0.927003293,2
"ENG_062_MZB_LO_2208","ENG_062_MZB_LO_2208-04.11.2019","04.11.2019",2019,11,4,1.051365388,1
"ENG_062_MZB_LO_2209","ENG_062_MZB_LO_2209-15.10.2002","15.10.2002",2002,10,15,0.954362049,2
"ENG_062_MZB_LO_2209","ENG_062_MZB_LO_2209-06.10.2003","06.10.2003",2003,10,6,0.918050451,2
"ENG_062_MZB_LO_2209","ENG_062_MZB_LO_2209-20.09.2004","20.09.2004",2004,9,20,0.977438932,3
"ENG_062_MZB_LO_2209","ENG_062_MZB_LO_2209-12.10.2005","12.10.2005",2005,10,12,1.007722848,3
"ENG_062_MZB_LO_2209","ENG_062_MZB_LO_2209-04.10.2006","04.10.2006",2006,10,4,0.986977841,3
"ENG_062_MZB_LO_2209","ENG_062_MZB_LO_2209-18.09.2013","18.09.2013",2013,9,18,0.863550056,5
"ENG_062_MZB_LO_2209","ENG_062_MZB_LO_2209-19.10.2016","19.10.2016",2016,10,19,0.943390933,4
"ENG_062_MZB_LO_2209","ENG_062_MZB_LO_2209-24.10.2021","24.10.2021",2021,10,24,1.056456151,3
"ENG_062_MZB_LO_2210","ENG_062_MZB_LO_2210-20.11.2002","20.11.2002",2002,11,20,1.111284507,1
"ENG_062_MZB_LO_2210","ENG_062_MZB_LO_2210-29.09.2003","29.09.2003",2003,9,29,1.036002363,1
"ENG_062_MZB_LO_2210","ENG_062_MZB_LO_2210-29.09.2004","29.09.2004",2004,9,29,1.017545078,1
"ENG_062_MZB_LO_2210","ENG_062_MZB_LO_2210-05.10.2005","05.10.2005",2005,10,5,1.014943683,1
"ENG_062_MZB_LO_2210","ENG_062_MZB_LO_2210-09.10.2006","09.10.2006",2006,10,9,0.918958495,2
"ENG_062_MZB_LO_2210","ENG_062_MZB_LO_2210-29.09.2008","29.09.2008",2008,9,29,1.063689311,1
"ENG_062_MZB_LO_2210","ENG_062_MZB_LO_2210-12.11.2009","12.11.2009",2009,11,12,1.032932337,1
"ENG_062_MZB_LO_2210","ENG_062_MZB_LO_2210-10.11.2010","10.11.2010",2010,11,10,1.071596026,1
"ENG_062_MZB_LO_2210","ENG_062_MZB_LO_2210-02.09.2011","02.09.2011",2011,9,2,1.048320006,1
"ENG_062_MZB_LO_2210","ENG_062_MZB_LO_2210-17.10.2012","17.10.2012",2012,10,17,1.046005538,1
"ENG_062_MZB_LO_2210","ENG_062_MZB_LO_2210-04.09.2013","04.09.2013",2013,9,4,0.907826717,3
"ENG_062_MZB_LO_2210","ENG_062_MZB_LO_2210-02.09.2014","02.09.2014",2014,9,2,1.00467877,2
"ENG_062_MZB_LO_2210","ENG_062_MZB_LO_2210-03.09.2015","03.09.2015",2015,9,3,1.029282937,2
"ENG_062_MZB_LO_2210","ENG_062_MZB_LO_2210-06.09.2016","06.09.2016",2016,9,6,1.026883778,2
"ENG_062_MZB_LO_2210","ENG_062_MZB_LO_2210-21.11.2017","21.11.2017",2017,11,21,1.03624082,1
"ENG_062_MZB_LO_2214","ENG_062_MZB_LO_2214-28.05.2002","28.05.2002",2002,5,28,0.819630357,3
"ENG_062_MZB_LO_2214","ENG_062_MZB_LO_2214-26.04.2005","26.04.2005",2005,4,26,0.805228018,3
"ENG_062_MZB_LO_2214","ENG_062_MZB_LO_2214-12.05.2008","12.05.2008",2008,5,12,0.907613748,2
"ENG_062_MZB_LO_2214","ENG_062_MZB_LO_2214-30.04.2013","30.04.2013",2013,4,30,0.811270118,3
"ENG_062_MZB_LO_2214","ENG_062_MZB_LO_2214-13.03.2014","13.03.2014",2014,3,13,0.878876715,3
"ENG_062_MZB_LO_2214","ENG_062_MZB_LO_2214-16.03.2015","16.03.2015",2015,3,16,0.856535271,3
"ENG_062_MZB_LO_2214","ENG_062_MZB_LO_2214-23.04.2018","23.04.2018",2018,4,23,0.96039045,2
"ENG_062_MZB_LO_2217","ENG_062_MZB_LO_2217-19.05.2003","19.05.2003",2003,5,19,0.917617694,2
"ENG_062_MZB_LO_2217","ENG_062_MZB_LO_2217-30.05.2006","30.05.2006",2006,5,30,0.948685293,2
"ENG_062_MZB_LO_2217","ENG_062_MZB_LO_2217-22.04.2009","22.04.2009",2009,4,22,1.059320435,2
"ENG_062_MZB_LO_2217","ENG_062_MZB_LO_2217-11.04.2012","11.04.2012",2012,4,11,1.04214402,1
"ENG_062_MZB_LO_2217","ENG_062_MZB_LO_2217-16.03.2015","16.03.2015",2015,3,16,1.021421366,1
"ENG_062_MZB_LO_2217","ENG_062_MZB_LO_2217-20.04.2016","20.04.2016",2016,4,20,1.02235399,2
"ENG_062_MZB_LO_2217","ENG_062_MZB_LO_2217-03.04.2017","03.04.2017",2017,4,3,1.020994315,1
"ENG_062_MZB_LO_2218","ENG_062_MZB_LO_2218-26.11.2002","26.11.2002",2002,11,26,1.162284586,1
"ENG_062_MZB_LO_2218","ENG_062_MZB_LO_2218-26.11.2003","26.11.2003",2003,11,26,1.240029553,1
"ENG_062_MZB_LO_2218","ENG_062_MZB_LO_2218-10.11.2004","10.11.2004",2004,11,10,1.203569187,1
"ENG_062_MZB_LO_2218","ENG_062_MZB_LO_2218-17.10.2005","17.10.2005",2005,10,17,1.287089759,3
"ENG_062_MZB_LO_2218","ENG_062_MZB_LO_2218-17.10.2006","17.10.2006",2006,10,17,1.364021744,3
"ENG_062_MZB_LO_2218","ENG_062_MZB_LO_2218-11.09.2007","11.09.2007",2007,9,11,1.26871121,2
"ENG_062_MZB_LO_2218","ENG_062_MZB_LO_2218-23.10.2008","23.10.2008",2008,10,23,1.213975082,1
"ENG_062_MZB_LO_2218","ENG_062_MZB_LO_2218-24.09.2009","24.09.2009",2009,9,24,1.228458045,1
"ENG_062_MZB_LO_2218","ENG_062_MZB_LO_2218-16.09.2013","16.09.2013",2013,9,16,1.303414158,1
"ENG_062_MZB_LO_2219","ENG_062_MZB_LO_2219-26.11.2003","26.11.2003",2003,11,26,1.199754175,1
"ENG_062_MZB_LO_2219","ENG_062_MZB_LO_2219-17.10.2006","17.10.2006",2006,10,17,1.282040124,2
"ENG_062_MZB_LO_2219","ENG_062_MZB_LO_2219-23.10.2008","23.10.2008",2008,10,23,1.25909735,1
"ENG_062_MZB_LO_2219","ENG_062_MZB_LO_2219-24.09.2009","24.09.2009",2009,9,24,1.225344469,1
"ENG_062_MZB_LO_2219","ENG_062_MZB_LO_2219-05.10.2010","05.10.2010",2010,10,5,1.316624206,1
"ENG_062_MZB_LO_2219","ENG_062_MZB_LO_2219-14.09.2011","14.09.2011",2011,9,14,1.298380659,1
"ENG_062_MZB_LO_2219","ENG_062_MZB_LO_2219-11.09.2012","11.09.2012",2012,9,11,1.281811617,1
"ENG_062_MZB_LO_2219","ENG_062_MZB_LO_2219-17.09.2013","17.09.2013",2013,9,17,1.276738146,1
"ENG_062_MZB_LO_2219","ENG_062_MZB_LO_2219-11.09.2014","11.09.2014",2014,9,11,1.256729962,1
"ENG_062_MZB_LO_2219","ENG_062_MZB_LO_2219-17.11.2015","17.11.2015",2015,11,17,1.203042994,1
"ENG_062_MZB_LO_2219","ENG_062_MZB_LO_2219-01.10.2016","01.10.2016",2016,10,1,1.36396303,1
"ENG_062_MZB_LO_2219","ENG_062_MZB_LO_2219-14.11.2017","14.11.2017",2017,11,14,1.370829558,1
"ENG_062_MZB_LO_2219","ENG_062_MZB_LO_2219-08.10.2018","08.10.2018",2018,10,8,1.315688771,1
"ENG_062_MZB_LO_2219","ENG_062_MZB_LO_2219-09.09.2019","09.09.2019",2019,9,9,1.32582542,1
"ENG_062_MZB_LO_2219","ENG_062_MZB_LO_2219-15.09.2020","15.09.2020",2020,9,15,1.227302953,1
"ENG_062_MZB_LO_2219","ENG_062_MZB_LO_2219-08.10.2021","08.10.2021",2021,10,8,1.24957333,1
"ENG_062_MZB_LO_2219","ENG_062_MZB_LO_2219-28.09.2022","28.09.2022",2022,9,28,1.134443295,1
"ENG_062_MZB_LO_2219","ENG_062_MZB_LO_2219-02.10.2023","02.10.2023",2023,10,2,1.207757852,1
"ENG_062_MZB_LO_2221","ENG_062_MZB_LO_2221-26.10.2004","26.10.2004",2004,10,26,1.004469894,1
"ENG_062_MZB_LO_2221","ENG_062_MZB_LO_2221-22.11.2005","22.11.2005",2005,11,22,1.103106859,1
"ENG_062_MZB_LO_2221","ENG_062_MZB_LO_2221-12.09.2006","12.09.2006",2006,9,12,1.092445303,1
"ENG_062_MZB_LO_2221","ENG_062_MZB_LO_2221-17.09.2008","17.09.2008",2008,9,17,1.035023578,1
"ENG_062_MZB_LO_2221","ENG_062_MZB_LO_2221-10.11.2009","10.11.2009",2009,11,10,1.175061131,1
"ENG_062_MZB_LO_2221","ENG_062_MZB_LO_2221-29.09.2010","29.09.2010",2010,9,29,1.123131042,1
"ENG_062_MZB_LO_2221","ENG_062_MZB_LO_2221-02.11.2011","02.11.2011",2011,11,2,1.020657648,1
"ENG_062_MZB_LO_2221","ENG_062_MZB_LO_2221-15.11.2012","15.11.2012",2012,11,15,1.075344032,1
"ENG_062_MZB_LO_2221","ENG_062_MZB_LO_2221-01.11.2013","01.11.2013",2013,11,1,1.156247996,1
"ENG_062_MZB_LO_2221","ENG_062_MZB_LO_2221-22.09.2014","22.09.2014",2014,9,22,1.042812175,1
"ENG_062_MZB_LO_2221","ENG_062_MZB_LO_2221-09.09.2015","09.09.2015",2015,9,9,1.088051483,1
"ENG_062_MZB_LO_2221","ENG_062_MZB_LO_2221-05.10.2017","05.10.2017",2017,10,5,1.138798466,1
"ENG_062_MZB_LO_2221","ENG_062_MZB_LO_2221-09.10.2018","09.10.2018",2018,10,9,1.011253414,1
"ENG_062_MZB_LO_2221","ENG_062_MZB_LO_2221-02.10.2019","02.10.2019",2019,10,2,1.035671694,1
"ENG_062_MZB_LO_2223","ENG_062_MZB_LO_2223-24.10.2002","24.10.2002",2002,10,24,1.357583051,1
"ENG_062_MZB_LO_2223","ENG_062_MZB_LO_2223-17.10.2005","17.10.2005",2005,10,17,1.240408436,3
"ENG_062_MZB_LO_2223","ENG_062_MZB_LO_2223-18.09.2008","18.09.2008",2008,9,18,1.209136044,2
"ENG_062_MZB_LO_2223","ENG_062_MZB_LO_2223-23.09.2013","23.09.2013",2013,9,23,1.25508594,1
"ENG_062_MZB_LO_2223","ENG_062_MZB_LO_2223-28.10.2016","28.10.2016",2016,10,28,1.289669214,1
"ENG_062_MZB_LO_2223","ENG_062_MZB_LO_2223-02.11.2017","02.11.2017",2017,11,2,1.279045538,1
"ENG_062_MZB_LO_2223","ENG_062_MZB_LO_2223-21.10.2020","21.10.2020",2020,10,21,1.264506519,1
"ENG_062_MZB_LO_2223","ENG_062_MZB_LO_2223-08.10.2021","08.10.2021",2021,10,8,1.299036251,1
"ENG_062_MZB_LO_2224","ENG_062_MZB_LO_2224-24.09.2003","24.09.2003",2003,9,24,1.1085656,1
"ENG_062_MZB_LO_2224","ENG_062_MZB_LO_2224-27.09.2006","27.09.2006",2006,9,27,1.173482673,2
"ENG_062_MZB_LO_2224","ENG_062_MZB_LO_2224-09.10.2008","09.10.2008",2008,10,9,1.141785523,1
"ENG_062_MZB_LO_2224","ENG_062_MZB_LO_2224-27.10.2009","27.10.2009",2009,10,27,1.015136274,2
"ENG_062_MZB_LO_2224","ENG_062_MZB_LO_2224-15.11.2010","15.11.2010",2010,11,15,1.116757976,1
"ENG_062_MZB_LO_2224","ENG_062_MZB_LO_2224-10.10.2011","10.10.2011",2011,10,10,1.013595912,1
"ENG_062_MZB_LO_2224","ENG_062_MZB_LO_2224-12.09.2012","12.09.2012",2012,9,12,0.989281488,1
"ENG_062_MZB_LO_2224","ENG_062_MZB_LO_2224-02.10.2013","02.10.2013",2013,10,2,0.994427286,1
"ENG_062_MZB_LO_2224","ENG_062_MZB_LO_2224-26.09.2014","26.09.2014",2014,9,26,1.133129274,1
"ENG_062_MZB_LO_2224","ENG_062_MZB_LO_2224-21.09.2015","21.09.2015",2015,9,21,1.089484182,1
"ENG_062_MZB_LO_2224","ENG_062_MZB_LO_2224-08.10.2018","08.10.2018",2018,10,8,1.024172329,2
"ENG_062_MZB_LO_2226","ENG_062_MZB_LO_2226-12.11.2002","12.11.2002",2002,11,12,0.94959927,2
"ENG_062_MZB_LO_2226","ENG_062_MZB_LO_2226-21.10.2003","21.10.2003",2003,10,21,1.042342829,1
"ENG_062_MZB_LO_2226","ENG_062_MZB_LO_2226-12.10.2004","12.10.2004",2004,10,12,1.020265458,1
"ENG_062_MZB_LO_2226","ENG_062_MZB_LO_2226-17.10.2005","17.10.2005",2005,10,17,0.991706582,2
"ENG_062_MZB_LO_2226","ENG_062_MZB_LO_2226-17.10.2006","17.10.2006",2006,10,17,1.031824337,2
"ENG_062_MZB_LO_2226","ENG_062_MZB_LO_2226-11.09.2007","11.09.2007",2007,9,11,1.050832576,1
"ENG_062_MZB_LO_2226","ENG_062_MZB_LO_2226-22.09.2008","22.09.2008",2008,9,22,1.067786062,1
"ENG_062_MZB_LO_2226","ENG_062_MZB_LO_2226-19.11.2009","19.11.2009",2009,11,19,1.031830962,1
"ENG_062_MZB_LO_2226","ENG_062_MZB_LO_2226-18.10.2010","18.10.2010",2010,10,18,1.019550683,1
"ENG_062_MZB_LO_2226","ENG_062_MZB_LO_2226-08.09.2011","08.09.2011",2011,9,8,0.98343365,1
"ENG_062_MZB_LO_2226","ENG_062_MZB_LO_2226-04.09.2012","04.09.2012",2012,9,4,0.998900268,1
"ENG_062_MZB_LO_2226","ENG_062_MZB_LO_2226-11.09.2013","11.09.2013",2013,9,11,1.047285516,1
"ENG_062_MZB_LO_2226","ENG_062_MZB_LO_2226-15.09.2014","15.09.2014",2014,9,15,1.005315042,1
"ENG_062_MZB_LO_2226","ENG_062_MZB_LO_2226-07.09.2015","07.09.2015",2015,9,7,0.899365987,2
"ENG_062_MZB_LO_2226","ENG_062_MZB_LO_2226-06.10.2016","06.10.2016",2016,10,6,0.932558387,3
"ENG_062_MZB_LO_2226","ENG_062_MZB_LO_2226-05.09.2017","05.09.2017",2017,9,5,0.943352068,2
"ENG_062_MZB_LO_2226","ENG_062_MZB_LO_2226-20.09.2018","20.09.2018",2018,9,20,1.019054673,1
"ENG_062_MZB_LO_2226","ENG_062_MZB_LO_2226-06.11.2019","06.11.2019",2019,11,6,0.910680447,2
"ENG_062_MZB_LO_2226","ENG_062_MZB_LO_2226-10.11.2021","10.11.2021",2021,11,10,0.882031973,3
"ENG_062_MZB_LO_2226","ENG_062_MZB_LO_2226-28.09.2022","28.09.2022",2022,9,28,0.871884849,3
"ENG_062_MZB_LO_2226","ENG_062_MZB_LO_2226-02.10.2023","02.10.2023",2023,10,2,0.854766882,3
"ENG_062_MZB_LO_2227","ENG_062_MZB_LO_2227-12.10.2004","12.10.2004",2004,10,12,1.029051762,3
"ENG_062_MZB_LO_2227","ENG_062_MZB_LO_2227-11.09.2007","11.09.2007",2007,9,11,1.052816768,2
"ENG_062_MZB_LO_2227","ENG_062_MZB_LO_2227-08.09.2011","08.09.2011",2011,9,8,1.039812798,2
"ENG_062_MZB_LO_2227","ENG_062_MZB_LO_2227-18.09.2012","18.09.2012",2012,9,18,1.02321963,2
"ENG_062_MZB_LO_2227","ENG_062_MZB_LO_2227-17.09.2013","17.09.2013",2013,9,17,0.956756707,3
"ENG_062_MZB_LO_2227","ENG_062_MZB_LO_2227-11.09.2014","11.09.2014",2014,9,11,0.893027477,3
"ENG_062_MZB_LO_2227","ENG_062_MZB_LO_2227-10.09.2015","10.09.2015",2015,9,10,0.853850121,3
"ENG_062_MZB_LO_2228","ENG_062_MZB_LO_2228-23.10.2002","23.10.2002",2002,10,23,0.777044653,3
"ENG_062_MZB_LO_2228","ENG_062_MZB_LO_2228-01.09.2003","01.09.2003",2003,9,1,0.83824156,3
"ENG_062_MZB_LO_2228","ENG_062_MZB_LO_2228-21.09.2004","21.09.2004",2004,9,21,0.88983172,2
"ENG_062_MZB_LO_2228","ENG_062_MZB_LO_2228-01.11.2005","01.11.2005",2005,11,1,0.897637917,2
"ENG_062_MZB_LO_2228","ENG_062_MZB_LO_2228-16.10.2006","16.10.2006",2006,10,16,0.862543158,3
"ENG_062_MZB_LO_2228","ENG_062_MZB_LO_2228-05.11.2007","05.11.2007",2007,11,5,0.903318221,2
"ENG_062_MZB_LO_2228","ENG_062_MZB_LO_2228-13.10.2008","13.10.2008",2008,10,13,0.923622005,2
"ENG_062_MZB_LO_2228","ENG_062_MZB_LO_2228-10.11.2009","10.11.2009",2009,11,10,0.90475262,2
"ENG_062_MZB_LO_2228","ENG_062_MZB_LO_2228-25.10.2010","25.10.2010",2010,10,25,0.862793419,3
"ENG_062_MZB_LO_2228","ENG_062_MZB_LO_2228-22.09.2011","22.09.2011",2011,9,22,0.961451272,1
"ENG_062_MZB_LO_2228","ENG_062_MZB_LO_2228-11.10.2012","11.10.2012",2012,10,11,0.948349382,2
"ENG_062_MZB_LO_2228","ENG_062_MZB_LO_2228-22.11.2013","22.11.2013",2013,11,22,0.857882543,3
"ENG_062_MZB_LO_2228","ENG_062_MZB_LO_2228-30.09.2014","30.09.2014",2014,9,30,0.981304777,1
"ENG_062_MZB_LO_2228","ENG_062_MZB_LO_2228-12.10.2015","12.10.2015",2015,10,12,0.939612989,2
"ENG_062_MZB_LO_2228","ENG_062_MZB_LO_2228-11.11.2016","11.11.2016",2016,11,11,0.878835996,2
"ENG_062_MZB_LO_2228","ENG_062_MZB_LO_2228-16.11.2017","16.11.2017",2017,11,16,0.938257541,2
"ENG_062_MZB_LO_2228","ENG_062_MZB_LO_2228-15.10.2018","15.10.2018",2018,10,15,0.966247354,2
"ENG_062_MZB_LO_2228","ENG_062_MZB_LO_2228-15.10.2019","15.10.2019",2019,10,15,0.912263788,2
"ENG_062_MZB_LO_2228","ENG_062_MZB_LO_2228-29.11.2021","29.11.2021",2021,11,29,1.002017589,1
"ENG_062_MZB_LO_2228","ENG_062_MZB_LO_2228-05.10.2022","05.10.2022",2022,10,5,0.997395427,1
"ENG_062_MZB_LO_2228","ENG_062_MZB_LO_2228-13.10.2023","13.10.2023",2023,10,13,0.904604178,2
"ENG_062_MZB_LO_2231","ENG_062_MZB_LO_2231-26.11.2002","26.11.2002",2002,11,26,1.275556995,1
"ENG_062_MZB_LO_2231","ENG_062_MZB_LO_2231-01.09.2003","01.09.2003",2003,9,1,1.258780536,1
"ENG_062_MZB_LO_2231","ENG_062_MZB_LO_2231-09.11.2004","09.11.2004",2004,11,9,1.272640595,1
"ENG_062_MZB_LO_2231","ENG_062_MZB_LO_2231-06.09.2005","06.09.2005",2005,9,6,1.279358161,1
"ENG_062_MZB_LO_2231","ENG_062_MZB_LO_2231-12.09.2006","12.09.2006",2006,9,12,1.230165087,1
"ENG_062_MZB_LO_2231","ENG_062_MZB_LO_2231-13.11.2007","13.11.2007",2007,11,13,1.327076776,1
"ENG_062_MZB_LO_2231","ENG_062_MZB_LO_2231-25.09.2008","25.09.2008",2008,9,25,1.399556621,1
"ENG_062_MZB_LO_2231","ENG_062_MZB_LO_2231-10.11.2009","10.11.2009",2009,11,10,1.355577881,1
"ENG_062_MZB_LO_2231","ENG_062_MZB_LO_2231-06.10.2010","06.10.2010",2010,10,6,1.35280316,1
"ENG_062_MZB_LO_2231","ENG_062_MZB_LO_2231-02.11.2011","02.11.2011",2011,11,2,1.176462257,1
"ENG_062_MZB_LO_2231","ENG_062_MZB_LO_2231-11.10.2012","11.10.2012",2012,10,11,1.278561457,1
"ENG_062_MZB_LO_2231","ENG_062_MZB_LO_2231-18.09.2013","18.09.2013",2013,9,18,1.230383853,1
"ENG_062_MZB_LO_2231","ENG_062_MZB_LO_2231-25.09.2014","25.09.2014",2014,9,25,1.364794909,1
"ENG_062_MZB_LO_2231","ENG_062_MZB_LO_2231-18.11.2015","18.11.2015",2015,11,18,1.41667871,1
"ENG_062_MZB_LO_2231","ENG_062_MZB_LO_2231-26.09.2016","26.09.2016",2016,9,26,1.314745776,2
"ENG_062_MZB_LO_2231","ENG_062_MZB_LO_2231-11.10.2017","11.10.2017",2017,10,11,1.291136919,2
"ENG_062_MZB_LO_2231","ENG_062_MZB_LO_2231-05.10.2018","05.10.2018",2018,10,5,1.41519719,3
"ENG_062_MZB_LO_2231","ENG_062_MZB_LO_2231-05.11.2019","05.11.2019",2019,11,5,1.337574771,2
"ENG_062_MZB_LO_2231","ENG_062_MZB_LO_2231-01.09.2020","01.09.2020",2020,9,1,1.330550952,3
"ENG_062_MZB_LO_2231","ENG_062_MZB_LO_2231-08.09.2021","08.09.2021",2021,9,8,1.356988746,3
"ENG_062_MZB_LO_2231","ENG_062_MZB_LO_2231-03.10.2022","03.10.2022",2022,10,3,1.34876131,1
"ENG_062_MZB_LO_2231","ENG_062_MZB_LO_2231-13.10.2023","13.10.2023",2023,10,13,1.354348816,2
"ENG_062_MZB_LO_2233","ENG_062_MZB_LO_2233-26.11.2002","26.11.2002",2002,11,26,1.268005384,1
"ENG_062_MZB_LO_2233","ENG_062_MZB_LO_2233-01.10.2003","01.10.2003",2003,10,1,1.162422596,1
"ENG_062_MZB_LO_2233","ENG_062_MZB_LO_2233-09.11.2004","09.11.2004",2004,11,9,1.16060808,1
"ENG_062_MZB_LO_2233","ENG_062_MZB_LO_2233-06.09.2005","06.09.2005",2005,9,6,1.179501966,1
"ENG_062_MZB_LO_2233","ENG_062_MZB_LO_2233-12.09.2006","12.09.2006",2006,9,12,1.222752669,1
"ENG_062_MZB_LO_2233","ENG_062_MZB_LO_2233-25.09.2008","25.09.2008",2008,9,25,1.259708414,1
"ENG_062_MZB_LO_2233","ENG_062_MZB_LO_2233-10.11.2009","10.11.2009",2009,11,10,1.202223452,1
"ENG_062_MZB_LO_2233","ENG_062_MZB_LO_2233-06.10.2010","06.10.2010",2010,10,6,1.119429739,1
"ENG_062_MZB_LO_2233","ENG_062_MZB_LO_2233-14.09.2011","14.09.2011",2011,9,14,1.213051754,1
"ENG_062_MZB_LO_2233","ENG_062_MZB_LO_2233-12.10.2012","12.10.2012",2012,10,12,1.197870537,1
"ENG_062_MZB_LO_2233","ENG_062_MZB_LO_2233-06.11.2013","06.11.2013",2013,11,6,1.166585821,1
"ENG_062_MZB_LO_2233","ENG_062_MZB_LO_2233-11.09.2014","11.09.2014",2014,9,11,1.168973076,1
"ENG_062_MZB_LO_2233","ENG_062_MZB_LO_2233-09.09.2015","09.09.2015",2015,9,9,1.152750654,1
"ENG_062_MZB_LO_2233","ENG_062_MZB_LO_2233-05.10.2016","05.10.2016",2016,10,5,1.212401702,1
"ENG_062_MZB_LO_2233","ENG_062_MZB_LO_2233-23.11.2017","23.11.2017",2017,11,23,1.195003116,1
"ENG_062_MZB_LO_2233","ENG_062_MZB_LO_2233-05.10.2018","05.10.2018",2018,10,5,1.119277868,1
"ENG_062_MZB_LO_2233","ENG_062_MZB_LO_2233-05.11.2019","05.11.2019",2019,11,5,1.148608788,1
"ENG_062_MZB_LO_2233","ENG_062_MZB_LO_2233-06.09.2023","06.09.2023",2023,9,6,1.09156576,1
"ENG_062_MZB_LO_2234","ENG_062_MZB_LO_2234-23.05.2011","23.05.2011",2011,5,23,1.19092379,1
"ENG_062_MZB_LO_2234","ENG_062_MZB_LO_2234-09.05.2013","09.05.2013",2013,5,9,1.100603636,1
"ENG_062_MZB_LO_2234","ENG_062_MZB_LO_2234-28.04.2014","28.04.2014",2014,4,28,1.240734016,1
"ENG_062_MZB_LO_2234","ENG_062_MZB_LO_2234-01.05.2015","01.05.2015",2015,5,1,1.198607839,1
"ENG_062_MZB_LO_2234","ENG_062_MZB_LO_2234-25.04.2016","25.04.2016",2016,4,25,1.069911896,1
"ENG_062_MZB_LO_2234","ENG_062_MZB_LO_2234-10.05.2018","10.05.2018",2018,5,10,1.107286982,1
"ENG_062_MZB_LO_2234","ENG_062_MZB_LO_2234-12.03.2019","12.03.2019",2019,3,12,1.183732025,1
"ENG_062_MZB_LO_2234","ENG_062_MZB_LO_2234-15.03.2023","15.03.2023",2023,3,15,1.013967517,5
"ENG_062_MZB_LO_2236","ENG_062_MZB_LO_2236-18.11.2002","18.11.2002",2002,11,18,1.025525456,1
"ENG_062_MZB_LO_2236","ENG_062_MZB_LO_2236-16.09.2004","16.09.2004",2004,9,16,1.045933609,1
"ENG_062_MZB_LO_2236","ENG_062_MZB_LO_2236-28.11.2005","28.11.2005",2005,11,28,0.930668096,2
"ENG_062_MZB_LO_2236","ENG_062_MZB_LO_2236-07.11.2006","07.11.2006",2006,11,7,0.987111087,1
"ENG_062_MZB_LO_2236","ENG_062_MZB_LO_2236-06.11.2008","06.11.2008",2008,11,6,1.078984132,1
"ENG_062_MZB_LO_2236","ENG_062_MZB_LO_2236-30.11.2009","30.11.2009",2009,11,30,1.157982929,1
"ENG_062_MZB_LO_2236","ENG_062_MZB_LO_2236-20.09.2010","20.09.2010",2010,9,20,1.094649224,1
"ENG_062_MZB_LO_2236","ENG_062_MZB_LO_2236-28.11.2011","28.11.2011",2011,11,28,1.163612284,1
"ENG_062_MZB_LO_2236","ENG_062_MZB_LO_2236-05.09.2012","05.09.2012",2012,9,5,1.043475294,1
"ENG_062_MZB_LO_2236","ENG_062_MZB_LO_2236-03.10.2013","03.10.2013",2013,10,3,1.168184175,1
"ENG_062_MZB_LO_2236","ENG_062_MZB_LO_2236-25.09.2014","25.09.2014",2014,9,25,1.117055014,1
"ENG_062_MZB_LO_2236","ENG_062_MZB_LO_2236-21.09.2016","21.09.2016",2016,9,21,1.173302987,1
"ENG_062_MZB_LO_2237","ENG_062_MZB_LO_2237-26.11.2002","26.11.2002",2002,11,26,0.896445266,2
"ENG_062_MZB_LO_2237","ENG_062_MZB_LO_2237-06.10.2003","06.10.2003",2003,10,6,0.786607035,3
"ENG_062_MZB_LO_2237","ENG_062_MZB_LO_2237-10.11.2004","10.11.2004",2004,11,10,0.978614447,1
"ENG_062_MZB_LO_2237","ENG_062_MZB_LO_2237-23.10.2007","23.10.2007",2007,10,23,0.883862761,2
"ENG_062_MZB_LO_2237","ENG_062_MZB_LO_2237-10.10.2013","10.10.2013",2013,10,10,0.934600093,2
"ENG_062_MZB_LO_2237","ENG_062_MZB_LO_2237-06.09.2016","06.09.2016",2016,9,6,0.888742991,2
"ENG_062_MZB_LO_2237","ENG_062_MZB_LO_2237-03.10.2017","03.10.2017",2017,10,3,0.897409755,2
"ENG_062_MZB_LO_2238","ENG_062_MZB_LO_2238-26.11.2002","26.11.2002",2002,11,26,0.871707242,3
"ENG_062_MZB_LO_2238","ENG_062_MZB_LO_2238-06.10.2003","06.10.2003",2003,10,6,0.87534403,2
"ENG_062_MZB_LO_2238","ENG_062_MZB_LO_2238-17.11.2004","17.11.2004",2004,11,17,1.002202359,3
"ENG_062_MZB_LO_2238","ENG_062_MZB_LO_2238-23.10.2007","23.10.2007",2007,10,23,0.92611538,2
"ENG_062_MZB_LO_2238","ENG_062_MZB_LO_2238-22.10.2008","22.10.2008",2008,10,22,0.961927604,1
"ENG_062_MZB_LO_2238","ENG_062_MZB_LO_2238-24.09.2009","24.09.2009",2009,9,24,0.95967269,2
"ENG_062_MZB_LO_2238","ENG_062_MZB_LO_2238-03.11.2010","03.11.2010",2010,11,3,0.956247434,1
"ENG_062_MZB_LO_2238","ENG_062_MZB_LO_2238-29.09.2011","29.09.2011",2011,9,29,0.832309049,3
"ENG_062_MZB_LO_2238","ENG_062_MZB_LO_2238-20.09.2012","20.09.2012",2012,9,20,0.963647804,1
"ENG_062_MZB_LO_2238","ENG_062_MZB_LO_2238-16.10.2013","16.10.2013",2013,10,16,0.969496347,2
"ENG_062_MZB_LO_2238","ENG_062_MZB_LO_2238-10.10.2014","10.10.2014",2014,10,10,0.971068099,1
"ENG_062_MZB_LO_2238","ENG_062_MZB_LO_2238-28.09.2015","28.09.2015",2015,9,28,0.908341814,2
"ENG_062_MZB_LO_2238","ENG_062_MZB_LO_2238-06.09.2016","06.09.2016",2016,9,6,1.005868492,1
"ENG_062_MZB_LO_2238","ENG_062_MZB_LO_2238-24.10.2017","24.10.2017",2017,10,24,1.03096572,1
"ENG_062_MZB_LO_2238","ENG_062_MZB_LO_2238-10.10.2018","10.10.2018",2018,10,10,1.031187678,1
"ENG_062_MZB_LO_2239","ENG_062_MZB_LO_2239-06.10.2003","06.10.2003",2003,10,6,1.084106656,1
"ENG_062_MZB_LO_2239","ENG_062_MZB_LO_2239-13.10.2006","13.10.2006",2006,10,13,1.149303008,1
"ENG_062_MZB_LO_2239","ENG_062_MZB_LO_2239-16.10.2013","16.10.2013",2013,10,16,1.060753722,1
"ENG_062_MZB_LO_2239","ENG_062_MZB_LO_2239-16.09.2014","16.09.2014",2014,9,16,1.072845436,1
"ENG_062_MZB_LO_2239","ENG_062_MZB_LO_2239-17.11.2015","17.11.2015",2015,11,17,1.067730485,1
"ENG_062_MZB_LO_2239","ENG_062_MZB_LO_2239-14.09.2016","14.09.2016",2016,9,14,0.975992695,2
"ENG_062_MZB_LO_2239","ENG_062_MZB_LO_2239-24.10.2017","24.10.2017",2017,10,24,0.9645371,1
"ENG_062_MZB_LO_2239","ENG_062_MZB_LO_2239-05.10.2018","05.10.2018",2018,10,5,0.915909778,2
"ENG_062_MZB_LO_2239","ENG_062_MZB_LO_2239-21.10.2019","21.10.2019",2019,10,21,0.820636691,3
"ENG_062_MZB_LO_2239","ENG_062_MZB_LO_2239-15.09.2020","15.09.2020",2020,9,15,1.132584555,1
"ENG_062_MZB_LO_2239","ENG_062_MZB_LO_2239-11.10.2021","11.10.2021",2021,10,11,1.131337495,1
"ENG_062_MZB_LO_2239","ENG_062_MZB_LO_2239-28.09.2022","28.09.2022",2022,9,28,1.073674518,1
"ENG_062_MZB_LO_2239","ENG_062_MZB_LO_2239-02.10.2023","02.10.2023",2023,10,2,1.013881266,1
"ENG_062_MZB_LO_2240","ENG_062_MZB_LO_2240-26.11.2002","26.11.2002",2002,11,26,1.145008117,1
"ENG_062_MZB_LO_2240","ENG_062_MZB_LO_2240-06.10.2003","06.10.2003",2003,10,6,1.075534608,1
"ENG_062_MZB_LO_2240","ENG_062_MZB_LO_2240-10.11.2004","10.11.2004",2004,11,10,1.066035466,1
"ENG_062_MZB_LO_2240","ENG_062_MZB_LO_2240-17.10.2005","17.10.2005",2005,10,17,0.958056511,2
"ENG_062_MZB_LO_2240","ENG_062_MZB_LO_2240-13.10.2006","13.10.2006",2006,10,13,1.040080085,1
"ENG_062_MZB_LO_2240","ENG_062_MZB_LO_2240-03.10.2007","03.10.2007",2007,10,3,1.011873938,3
"ENG_062_MZB_LO_2240","ENG_062_MZB_LO_2240-22.09.2008","22.09.2008",2008,9,22,1.088235775,1
"ENG_062_MZB_LO_2240","ENG_062_MZB_LO_2240-24.09.2009","24.09.2009",2009,9,24,1.070284887,1
"ENG_062_MZB_LO_2240","ENG_062_MZB_LO_2240-20.09.2010","20.09.2010",2010,9,20,1.051800067,1
"ENG_062_MZB_LO_2240","ENG_062_MZB_LO_2240-14.09.2011","14.09.2011",2011,9,14,1.112953888,3
"ENG_062_MZB_LO_2240","ENG_062_MZB_LO_2240-18.09.2012","18.09.2012",2012,9,18,1.090795731,1
"ENG_062_MZB_LO_2240","ENG_062_MZB_LO_2240-14.10.2013","14.10.2013",2013,10,14,1.074874232,1
"ENG_062_MZB_LO_2240","ENG_062_MZB_LO_2240-30.09.2014","30.09.2014",2014,9,30,1.106425574,1
"ENG_062_MZB_LO_2241","ENG_062_MZB_LO_2241-24.10.2002","24.10.2002",2002,10,24,1.166308287,3
"ENG_062_MZB_LO_2241","ENG_062_MZB_LO_2241-06.10.2003","06.10.2003",2003,10,6,1.160468985,2
"ENG_062_MZB_LO_2241","ENG_062_MZB_LO_2241-26.10.2004","26.10.2004",2004,10,26,1.165104266,3
"ENG_062_MZB_LO_2241","ENG_062_MZB_LO_2241-17.10.2005","17.10.2005",2005,10,17,1.180451254,2
"ENG_062_MZB_LO_2241","ENG_062_MZB_LO_2241-27.09.2006","27.09.2006",2006,9,27,1.244690685,3
"ENG_062_MZB_LO_2241","ENG_062_MZB_LO_2241-21.09.2009","21.09.2009",2009,9,21,1.211307983,2
"ENG_062_MZB_LO_2241","ENG_062_MZB_LO_2241-23.09.2013","23.09.2013",2013,9,23,1.199328458,2
"ENG_062_MZB_LO_2241","ENG_062_MZB_LO_2241-12.10.2015","12.10.2015",2015,10,12,1.249252527,1
"ENG_062_MZB_LO_2241","ENG_062_MZB_LO_2241-17.10.2018","17.10.2018",2018,10,17,1.30803436,2
"ENG_062_MZB_LO_2241","ENG_062_MZB_LO_2241-05.11.2019","05.11.2019",2019,11,5,1.346900361,1
"ENG_062_MZB_LO_2241","ENG_062_MZB_LO_2241-21.10.2020","21.10.2020",2020,10,21,1.350507741,1
"ENG_062_MZB_LO_2241","ENG_062_MZB_LO_2241-08.10.2021","08.10.2021",2021,10,8,1.270566976,1
"ENG_062_MZB_LO_2243","ENG_062_MZB_LO_2243-29.10.2002","29.10.2002",2002,10,29,1.038331565,1
"ENG_062_MZB_LO_2243","ENG_062_MZB_LO_2243-06.09.2004","06.09.2004",2004,9,6,1.020790367,1
"ENG_062_MZB_LO_2243","ENG_062_MZB_LO_2243-30.09.2005","30.09.2005",2005,9,30,0.977880987,1
"ENG_062_MZB_LO_2243","ENG_062_MZB_LO_2243-03.10.2006","03.10.2006",2006,10,3,1.14445012,1
"ENG_062_MZB_LO_2243","ENG_062_MZB_LO_2243-27.11.2008","27.11.2008",2008,11,27,1.080011562,1
"ENG_062_MZB_LO_2243","ENG_062_MZB_LO_2243-27.10.2009","27.10.2009",2009,10,27,1.075293853,1
"ENG_062_MZB_LO_2243","ENG_062_MZB_LO_2243-03.11.2010","03.11.2010",2010,11,3,1.097797526,1
"ENG_062_MZB_LO_2243","ENG_062_MZB_LO_2243-20.09.2011","20.09.2011",2011,9,20,1.055707055,1
"ENG_062_MZB_LO_2243","ENG_062_MZB_LO_2243-12.09.2013","12.09.2013",2013,9,12,1.101008075,1
"ENG_062_MZB_LO_2243","ENG_062_MZB_LO_2243-11.10.2021","11.10.2021",2021,10,11,1.030391246,1
"ENG_062_MZB_LO_2243","ENG_062_MZB_LO_2243-29.09.2022","29.09.2022",2022,9,29,1.00839652,2
"ENG_062_MZB_LO_2243","ENG_062_MZB_LO_2243-05.10.2023","05.10.2023",2023,10,5,1.106238563,1
"ENG_062_MZB_LO_2246","ENG_062_MZB_LO_2246-21.11.2003","21.11.2003",2003,11,21,1.030564904,5
"ENG_062_MZB_LO_2246","ENG_062_MZB_LO_2246-10.11.2004","10.11.2004",2004,11,10,0.962046982,3
"ENG_062_MZB_LO_2246","ENG_062_MZB_LO_2246-17.10.2005","17.10.2005",2005,10,17,1.042306464,3
"ENG_062_MZB_LO_2246","ENG_062_MZB_LO_2246-17.10.2006","17.10.2006",2006,10,17,0.937904834,3
"ENG_062_MZB_LO_2246","ENG_062_MZB_LO_2246-23.10.2008","23.10.2008",2008,10,23,1.0404397,5
"ENG_062_MZB_LO_2246","ENG_062_MZB_LO_2246-17.09.2013","17.09.2013",2013,9,17,0.88054905,5
"ENG_062_MZB_LO_2246","ENG_062_MZB_LO_2246-05.09.2014","05.09.2014",2014,9,5,0.93844184,2
"ENG_062_MZB_LO_2247","ENG_062_MZB_LO_2247-10.11.2004","10.11.2004",2004,11,10,1.042267376,2
"ENG_062_MZB_LO_2247","ENG_062_MZB_LO_2247-11.09.2007","11.09.2007",2007,9,11,1.184752904,1
"ENG_062_MZB_LO_2247","ENG_062_MZB_LO_2247-23.10.2008","23.10.2008",2008,10,23,1.288514449,3
"ENG_062_MZB_LO_2247","ENG_062_MZB_LO_2247-24.09.2009","24.09.2009",2009,9,24,1.179147737,3
"ENG_062_MZB_LO_2247","ENG_062_MZB_LO_2247-05.10.2010","05.10.2010",2010,10,5,1.085398291,1
"ENG_062_MZB_LO_2247","ENG_062_MZB_LO_2247-14.09.2011","14.09.2011",2011,9,14,1.155345529,1
"ENG_062_MZB_LO_2247","ENG_062_MZB_LO_2247-13.09.2012","13.09.2012",2012,9,13,1.241818488,1
"ENG_062_MZB_LO_2247","ENG_062_MZB_LO_2247-14.10.2013","14.10.2013",2013,10,14,1.175715458,1
"ENG_062_MZB_LO_2247","ENG_062_MZB_LO_2247-24.09.2015","24.09.2015",2015,9,24,1.200999224,1
"ENG_062_MZB_LO_2247","ENG_062_MZB_LO_2247-08.10.2018","08.10.2018",2018,10,8,1.184610123,1
"ENG_062_MZB_LO_2249","ENG_062_MZB_LO_2249-26.10.2004","26.10.2004",2004,10,26,1.142717839,1
"ENG_062_MZB_LO_2249","ENG_062_MZB_LO_2249-19.09.2007","19.09.2007",2007,9,19,1.080492842,1
"ENG_062_MZB_LO_2249","ENG_062_MZB_LO_2249-03.10.2008","03.10.2008",2008,10,3,1.227246314,1
"ENG_062_MZB_LO_2249","ENG_062_MZB_LO_2249-06.10.2009","06.10.2009",2009,10,6,1.115651029,1
"ENG_062_MZB_LO_2249","ENG_062_MZB_LO_2249-13.09.2010","13.09.2010",2010,9,13,1.086894979,1
"ENG_062_MZB_LO_2249","ENG_062_MZB_LO_2249-14.11.2011","14.11.2011",2011,11,14,1.07873603,1
"ENG_062_MZB_LO_2249","ENG_062_MZB_LO_2249-11.09.2012","11.09.2012",2012,9,11,1.103424345,1
"ENG_062_MZB_LO_2249","ENG_062_MZB_LO_2249-13.09.2013","13.09.2013",2013,9,13,1.153929169,1
"ENG_062_MZB_LO_2249","ENG_062_MZB_LO_2249-23.09.2014","23.09.2014",2014,9,23,1.201026568,1
"ENG_062_MZB_LO_2249","ENG_062_MZB_LO_2249-21.09.2015","21.09.2015",2015,9,21,1.210117733,2
"ENG_062_MZB_LO_2249","ENG_062_MZB_LO_2249-10.11.2017","10.11.2017",2017,11,10,1.21152031,1
"ENG_062_MZB_LO_2249","ENG_062_MZB_LO_2249-08.10.2018","08.10.2018",2018,10,8,1.097329359,1
"ENG_062_MZB_LO_2249","ENG_062_MZB_LO_2249-25.11.2019","25.11.2019",2019,11,25,1.096971916,1
"ENG_062_MZB_LO_2249","ENG_062_MZB_LO_2249-01.09.2022","01.09.2022",2022,9,1,1.119188123,1
"ENG_062_MZB_LO_2254","ENG_062_MZB_LO_2254-09.10.2002","09.10.2002",2002,10,9,0.972097644,1
"ENG_062_MZB_LO_2254","ENG_062_MZB_LO_2254-24.09.2003","24.09.2003",2003,9,24,0.945198345,2
"ENG_062_MZB_LO_2254","ENG_062_MZB_LO_2254-26.10.2004","26.10.2004",2004,10,26,0.943662477,3
"ENG_062_MZB_LO_2254","ENG_062_MZB_LO_2254-07.09.2005","07.09.2005",2005,9,7,1.039421392,1
"ENG_062_MZB_LO_2254","ENG_062_MZB_LO_2254-20.09.2006","20.09.2006",2006,9,20,1.006606401,1
"ENG_062_MZB_LO_2254","ENG_062_MZB_LO_2254-23.10.2007","23.10.2007",2007,10,23,1.065449278,1
"ENG_062_MZB_LO_2254","ENG_062_MZB_LO_2254-20.10.2008","20.10.2008",2008,10,20,1.089818642,1
"ENG_062_MZB_LO_2254","ENG_062_MZB_LO_2254-29.09.2009","29.09.2009",2009,9,29,1.020434898,1
"ENG_062_MZB_LO_2254","ENG_062_MZB_LO_2254-16.09.2010","16.09.2010",2010,9,16,1.049301103,1
"ENG_062_MZB_LO_2254","ENG_062_MZB_LO_2254-27.09.2011","27.09.2011",2011,9,27,0.940941711,2
"ENG_062_MZB_LO_2254","ENG_062_MZB_LO_2254-12.09.2012","12.09.2012",2012,9,12,0.989796312,1
"ENG_062_MZB_LO_2254","ENG_062_MZB_LO_2254-13.09.2013","13.09.2013",2013,9,13,0.93893998,2
"ENG_062_MZB_LO_2254","ENG_062_MZB_LO_2254-29.09.2014","29.09.2014",2014,9,29,0.970654341,2
"ENG_062_MZB_LO_2254","ENG_062_MZB_LO_2254-21.10.2015","21.10.2015",2015,10,21,0.944295755,2
"ENG_062_MZB_LO_2254","ENG_062_MZB_LO_2254-28.09.2016","28.09.2016",2016,9,28,1.025207638,1
"ENG_062_MZB_LO_2254","ENG_062_MZB_LO_2254-26.10.2021","26.10.2021",2021,10,26,0.91103911,2
"ENG_062_MZB_LO_2255","ENG_062_MZB_LO_2255-24.09.2003","24.09.2003",2003,9,24,1.05225532,1
"ENG_062_MZB_LO_2255","ENG_062_MZB_LO_2255-20.09.2006","20.09.2006",2006,9,20,1.10477938,1
"ENG_062_MZB_LO_2255","ENG_062_MZB_LO_2255-22.10.2008","22.10.2008",2008,10,22,1.078386459,1
"ENG_062_MZB_LO_2255","ENG_062_MZB_LO_2255-29.09.2009","29.09.2009",2009,9,29,1.061403542,1
"ENG_062_MZB_LO_2255","ENG_062_MZB_LO_2255-16.09.2010","16.09.2010",2010,9,16,1.014342756,1
"ENG_062_MZB_LO_2255","ENG_062_MZB_LO_2255-10.10.2011","10.10.2011",2011,10,10,1.085376083,1
"ENG_062_MZB_LO_2255","ENG_062_MZB_LO_2255-12.09.2012","12.09.2012",2012,9,12,1.106060817,1
"ENG_062_MZB_LO_2255","ENG_062_MZB_LO_2255-03.09.2013","03.09.2013",2013,9,3,1.08429696,1
"ENG_062_MZB_LO_2255","ENG_062_MZB_LO_2255-04.09.2015","04.09.2015",2015,9,4,1.143166223,1
"ENG_062_MZB_LO_2255","ENG_062_MZB_LO_2255-31.10.2016","31.10.2016",2016,10,31,1.204000144,1
"ENG_062_MZB_LO_2255","ENG_062_MZB_LO_2255-09.10.2017","09.10.2017",2017,10,9,1.102847312,2
"ENG_062_MZB_LO_2255","ENG_062_MZB_LO_2255-01.10.2018","01.10.2018",2018,10,1,1.153844802,1
"ENG_062_MZB_LO_2256","ENG_062_MZB_LO_2256-09.10.2002","09.10.2002",2002,10,9,1.08445857,1
"ENG_062_MZB_LO_2256","ENG_062_MZB_LO_2256-24.09.2003","24.09.2003",2003,9,24,0.971433927,2
"ENG_062_MZB_LO_2256","ENG_062_MZB_LO_2256-26.10.2004","26.10.2004",2004,10,26,1.066376516,1
"ENG_062_MZB_LO_2256","ENG_062_MZB_LO_2256-07.09.2005","07.09.2005",2005,9,7,1.089932935,1
"ENG_062_MZB_LO_2256","ENG_062_MZB_LO_2256-20.09.2006","20.09.2006",2006,9,20,1.007787014,1
"ENG_062_MZB_LO_2256","ENG_062_MZB_LO_2256-22.10.2008","22.10.2008",2008,10,22,1.073714819,1
"ENG_062_MZB_LO_2256","ENG_062_MZB_LO_2256-16.09.2010","16.09.2010",2010,9,16,1.017753909,1
"ENG_062_MZB_LO_2256","ENG_062_MZB_LO_2256-10.10.2011","10.10.2011",2011,10,10,0.954416468,2
"ENG_062_MZB_LO_2256","ENG_062_MZB_LO_2256-26.09.2014","26.09.2014",2014,9,26,0.992176954,1
"ENG_062_MZB_LO_2256","ENG_062_MZB_LO_2256-18.10.2017","18.10.2017",2017,10,18,0.9213621,2
"ENG_062_MZB_LO_2257","ENG_062_MZB_LO_2257-01.09.2003","01.09.2003",2003,9,1,1.186429869,1
"ENG_062_MZB_LO_2257","ENG_062_MZB_LO_2257-21.09.2004","21.09.2004",2004,9,21,1.138081573,1
"ENG_062_MZB_LO_2257","ENG_062_MZB_LO_2257-22.11.2005","22.11.2005",2005,11,22,1.2117814,1
"ENG_062_MZB_LO_2257","ENG_062_MZB_LO_2257-16.10.2006","16.10.2006",2006,10,16,1.173493934,1
"ENG_062_MZB_LO_2257","ENG_062_MZB_LO_2257-05.11.2007","05.11.2007",2007,11,5,1.201789498,1
"ENG_062_MZB_LO_2257","ENG_062_MZB_LO_2257-13.10.2008","13.10.2008",2008,10,13,1.183327723,1
"ENG_062_MZB_LO_2257","ENG_062_MZB_LO_2257-05.10.2010","05.10.2010",2010,10,5,1.207926937,1
"ENG_062_MZB_LO_2257","ENG_062_MZB_LO_2257-29.09.2011","29.09.2011",2011,9,29,1.245803648,1
"ENG_062_MZB_LO_2257","ENG_062_MZB_LO_2257-24.09.2012","24.09.2012",2012,9,24,1.190178911,1
"ENG_062_MZB_LO_2257","ENG_062_MZB_LO_2257-20.09.2013","20.09.2013",2013,9,20,1.209183192,1
"ENG_062_MZB_LO_2257","ENG_062_MZB_LO_2257-16.09.2014","16.09.2014",2014,9,16,1.188046906,1
"ENG_062_MZB_LO_2257","ENG_062_MZB_LO_2257-21.10.2015","21.10.2015",2015,10,21,1.196805003,1
"ENG_062_MZB_LO_2257","ENG_062_MZB_LO_2257-04.11.2020","04.11.2020",2020,11,4,1.151711031,1
"ENG_062_MZB_LO_2257","ENG_062_MZB_LO_2257-13.10.2021","13.10.2021",2021,10,13,1.210946093,1
"ENG_062_MZB_LO_2259","ENG_062_MZB_LO_2259-13.03.2002","13.03.2002",2002,3,13,1.138182025,1
"ENG_062_MZB_LO_2259","ENG_062_MZB_LO_2259-13.04.2005","13.04.2005",2005,4,13,1.019421274,1
"ENG_062_MZB_LO_2259","ENG_062_MZB_LO_2259-23.05.2008","23.05.2008",2008,5,23,1.026961191,1
"ENG_062_MZB_LO_2259","ENG_062_MZB_LO_2259-06.03.2013","06.03.2013",2013,3,6,1.133866286,1
"ENG_062_MZB_LO_2259","ENG_062_MZB_LO_2259-10.03.2015","10.03.2015",2015,3,10,1.075892011,1
"ENG_062_MZB_LO_2259","ENG_062_MZB_LO_2259-30.05.2018","30.05.2018",2018,5,30,1.175640023,1
"ENG_062_MZB_LO_2259","ENG_062_MZB_LO_2259-06.04.2021","06.04.2021",2021,4,6,1.136210171,1
"ENG_062_MZB_LO_2259","ENG_062_MZB_LO_2259-14.03.2022","14.03.2022",2022,3,14,1.154806304,1
"ENG_062_MZB_LO_2261","ENG_062_MZB_LO_2261-24.10.2002","24.10.2002",2002,10,24,1.019762537,2
"ENG_062_MZB_LO_2261","ENG_062_MZB_LO_2261-21.11.2003","21.11.2003",2003,11,21,1.037975994,1
"ENG_062_MZB_LO_2261","ENG_062_MZB_LO_2261-26.10.2004","26.10.2004",2004,10,26,1.040221899,1
"ENG_062_MZB_LO_2261","ENG_062_MZB_LO_2261-19.09.2007","19.09.2007",2007,9,19,1.153122046,1
"ENG_062_MZB_LO_2261","ENG_062_MZB_LO_2261-18.09.2008","18.09.2008",2008,9,18,1.107517445,1
"ENG_062_MZB_LO_2261","ENG_062_MZB_LO_2261-21.09.2009","21.09.2009",2009,9,21,1.253415906,1
"ENG_062_MZB_LO_2261","ENG_062_MZB_LO_2261-13.09.2010","13.09.2010",2010,9,13,1.223002749,1
"ENG_062_MZB_LO_2261","ENG_062_MZB_LO_2261-16.11.2011","16.11.2011",2011,11,16,1.155168542,1
"ENG_062_MZB_LO_2261","ENG_062_MZB_LO_2261-11.09.2012","11.09.2012",2012,9,11,1.109594269,1
"ENG_062_MZB_LO_2261","ENG_062_MZB_LO_2261-13.09.2013","13.09.2013",2013,9,13,1.172299296,1
"ENG_062_MZB_LO_2261","ENG_062_MZB_LO_2261-23.09.2014","23.09.2014",2014,9,23,1.201856189,1
"ENG_062_MZB_LO_2261","ENG_062_MZB_LO_2261-12.10.2015","12.10.2015",2015,10,12,1.144623078,1
"ENG_062_MZB_LO_2261","ENG_062_MZB_LO_2261-06.09.2017","06.09.2017",2017,9,6,1.166465095,1
"ENG_062_MZB_LO_2261","ENG_062_MZB_LO_2261-11.10.2018","11.10.2018",2018,10,11,1.10224654,1
"ENG_062_MZB_LO_2261","ENG_062_MZB_LO_2261-22.09.2020","22.09.2020",2020,9,22,1.142905817,1
"ENG_062_MZB_LO_2262","ENG_062_MZB_LO_2262-24.10.2002","24.10.2002",2002,10,24,1.137690776,1
"ENG_062_MZB_LO_2262","ENG_062_MZB_LO_2262-21.11.2003","21.11.2003",2003,11,21,1.083452335,1
"ENG_062_MZB_LO_2262","ENG_062_MZB_LO_2262-07.09.2006","07.09.2006",2006,9,7,1.114819679,1
"ENG_062_MZB_LO_2262","ENG_062_MZB_LO_2262-21.09.2009","21.09.2009",2009,9,21,1.339744055,1
"ENG_062_MZB_LO_2262","ENG_062_MZB_LO_2262-16.11.2011","16.11.2011",2011,11,16,1.074909273,2
"ENG_062_MZB_LO_2262","ENG_062_MZB_LO_2262-18.09.2012","18.09.2012",2012,9,18,1.156244848,1
"ENG_062_MZB_LO_2262","ENG_062_MZB_LO_2262-18.11.2013","18.11.2013",2013,11,18,1.116428818,1
"ENG_062_MZB_LO_2262","ENG_062_MZB_LO_2262-23.09.2014","23.09.2014",2014,9,23,1.146576642,1
"ENG_062_MZB_LO_2262","ENG_062_MZB_LO_2262-30.10.2015","30.10.2015",2015,10,30,1.075608071,1
"ENG_062_MZB_LO_2262","ENG_062_MZB_LO_2262-27.11.2017","27.11.2017",2017,11,27,1.193940604,4
"ENG_062_MZB_LO_2262","ENG_062_MZB_LO_2262-11.10.2018","11.10.2018",2018,10,11,1.230831627,1
"ENG_062_MZB_LO_2262","ENG_062_MZB_LO_2262-22.09.2020","22.09.2020",2020,9,22,1.196317315,1
"ENG_062_MZB_LO_2264","ENG_062_MZB_LO_2264-15.09.2003","15.09.2003",2003,9,15,0.983128624,2
"ENG_062_MZB_LO_2264","ENG_062_MZB_LO_2264-26.10.2004","26.10.2004",2004,10,26,1.043315017,2
"ENG_062_MZB_LO_2264","ENG_062_MZB_LO_2264-06.09.2005","06.09.2005",2005,9,6,0.948122834,3
"ENG_062_MZB_LO_2264","ENG_062_MZB_LO_2264-01.09.2006","01.09.2006",2006,9,1,0.960444189,2
"ENG_062_MZB_LO_2264","ENG_062_MZB_LO_2264-17.09.2008","17.09.2008",2008,9,17,0.973198297,2
"ENG_062_MZB_LO_2264","ENG_062_MZB_LO_2264-10.11.2009","10.11.2009",2009,11,10,1.05381803,2
"ENG_062_MZB_LO_2264","ENG_062_MZB_LO_2264-29.09.2010","29.09.2010",2010,9,29,1.056484701,1
"ENG_062_MZB_LO_2264","ENG_062_MZB_LO_2264-23.11.2011","23.11.2011",2011,11,23,1.026720205,2
"ENG_062_MZB_LO_2264","ENG_062_MZB_LO_2264-24.09.2012","24.09.2012",2012,9,24,1.013563305,3
"ENG_062_MZB_LO_2264","ENG_062_MZB_LO_2264-20.09.2013","20.09.2013",2013,9,20,0.885352558,3
"ENG_062_MZB_LO_2264","ENG_062_MZB_LO_2264-16.09.2014","16.09.2014",2014,9,16,1.113712043,3
"ENG_062_MZB_LO_2264","ENG_062_MZB_LO_2264-28.09.2015","28.09.2015",2015,9,28,1.094130303,4
"ENG_062_MZB_LO_2264","ENG_062_MZB_LO_2264-12.09.2016","12.09.2016",2016,9,12,1.149685382,3
"ENG_062_MZB_LO_2264","ENG_062_MZB_LO_2264-30.11.2017","30.11.2017",2017,11,30,1.086768921,3
"ENG_062_MZB_LO_2264","ENG_062_MZB_LO_2264-08.10.2018","08.10.2018",2018,10,8,0.904668887,5
"ENG_062_MZB_LO_2265","ENG_062_MZB_LO_2265-21.11.2003","21.11.2003",2003,11,21,1.099928833,1
"ENG_062_MZB_LO_2265","ENG_062_MZB_LO_2265-13.10.2006","13.10.2006",2006,10,13,1.058925647,1
"ENG_062_MZB_LO_2265","ENG_062_MZB_LO_2265-27.09.2007","27.09.2007",2007,9,27,1.058226622,1
"ENG_062_MZB_LO_2265","ENG_062_MZB_LO_2265-11.11.2010","11.11.2010",2010,11,11,0.933538762,2
"ENG_062_MZB_LO_2265","ENG_062_MZB_LO_2265-14.10.2013","14.10.2013",2013,10,14,1.066366509,1
"ENG_062_MZB_LO_2265","ENG_062_MZB_LO_2265-22.10.2015","22.10.2015",2015,10,22,1.003368517,2
"ENG_062_MZB_LO_2265","ENG_062_MZB_LO_2265-12.11.2018","12.11.2018",2018,11,12,0.969160992,2
"ENG_062_MZB_LO_2265","ENG_062_MZB_LO_2265-18.11.2020","18.11.2020",2020,11,18,1.036067356,3
"ENG_062_MZB_LO_2265","ENG_062_MZB_LO_2265-19.10.2021","19.10.2021",2021,10,19,1.027747059,1
"ENG_062_MZB_LO_2266","ENG_062_MZB_LO_2266-21.11.2003","21.11.2003",2003,11,21,1.222482872,2
"ENG_062_MZB_LO_2266","ENG_062_MZB_LO_2266-10.11.2004","10.11.2004",2004,11,10,1.121025657,1
"ENG_062_MZB_LO_2266","ENG_062_MZB_LO_2266-17.10.2005","17.10.2005",2005,10,17,1.072648859,1
"ENG_062_MZB_LO_2266","ENG_062_MZB_LO_2266-17.10.2006","17.10.2006",2006,10,17,0.998054225,3
"ENG_062_MZB_LO_2266","ENG_062_MZB_LO_2266-23.10.2008","23.10.2008",2008,10,23,1.111186971,1
"ENG_062_MZB_LO_2266","ENG_062_MZB_LO_2266-24.09.2009","24.09.2009",2009,9,24,1.125047444,1
"ENG_062_MZB_LO_2266","ENG_062_MZB_LO_2266-05.10.2010","05.10.2010",2010,10,5,1.151590349,1
"ENG_062_MZB_LO_2266","ENG_062_MZB_LO_2266-14.09.2011","14.09.2011",2011,9,14,1.18004683,1
"ENG_062_MZB_LO_2266","ENG_062_MZB_LO_2266-11.09.2012","11.09.2012",2012,9,11,1.236580046,1
"ENG_062_MZB_LO_2266","ENG_062_MZB_LO_2266-16.09.2013","16.09.2013",2013,9,16,1.098389447,1
"ENG_062_MZB_LO_2266","ENG_062_MZB_LO_2266-24.09.2015","24.09.2015",2015,9,24,1.178811528,1
"ENG_062_MZB_LO_2266","ENG_062_MZB_LO_2266-01.11.2016","01.11.2016",2016,11,1,1.197947799,1
"ENG_062_MZB_LO_2266","ENG_062_MZB_LO_2266-02.11.2017","02.11.2017",2017,11,2,1.119977598,1
"ENG_062_MZB_LO_2266","ENG_062_MZB_LO_2266-08.10.2018","08.10.2018",2018,10,8,1.218120786,2
"ENG_062_MZB_LO_2266","ENG_062_MZB_LO_2266-15.09.2020","15.09.2020",2020,9,15,1.151706522,1
"ENG_062_MZB_LO_2266","ENG_062_MZB_LO_2266-12.10.2021","12.10.2021",2021,10,12,1.227613101,1
"ENG_062_MZB_LO_2268","ENG_062_MZB_LO_2268-18.11.2002","18.11.2002",2002,11,18,1.03155871,1
"ENG_062_MZB_LO_2268","ENG_062_MZB_LO_2268-01.09.2003","01.09.2003",2003,9,1,1.030363688,1
"ENG_062_MZB_LO_2268","ENG_062_MZB_LO_2268-21.09.2004","21.09.2004",2004,9,21,0.969373379,1
"ENG_062_MZB_LO_2268","ENG_062_MZB_LO_2268-01.11.2005","01.11.2005",2005,11,1,1.01078875,1
"ENG_062_MZB_LO_2268","ENG_062_MZB_LO_2268-16.10.2006","16.10.2006",2006,10,16,1.081848374,1
"ENG_062_MZB_LO_2268","ENG_062_MZB_LO_2268-05.11.2007","05.11.2007",2007,11,5,1.059324038,1
"ENG_062_MZB_LO_2268","ENG_062_MZB_LO_2268-13.10.2008","13.10.2008",2008,10,13,1.059259834,1
"ENG_062_MZB_LO_2268","ENG_062_MZB_LO_2268-10.11.2009","10.11.2009",2009,11,10,1.094193297,1
"ENG_062_MZB_LO_2268","ENG_062_MZB_LO_2268-21.09.2010","21.09.2010",2010,9,21,1.098724767,1
"ENG_062_MZB_LO_2268","ENG_062_MZB_LO_2268-29.09.2011","29.09.2011",2011,9,29,1.104402292,1
"ENG_062_MZB_LO_2268","ENG_062_MZB_LO_2268-11.10.2012","11.10.2012",2012,10,11,1.13795877,1
"ENG_062_MZB_LO_2268","ENG_062_MZB_LO_2268-30.09.2013","30.09.2013",2013,9,30,1.157902871,1
"ENG_062_MZB_LO_2268","ENG_062_MZB_LO_2268-12.11.2014","12.11.2014",2014,11,12,1.172681011,1
"ENG_062_MZB_LO_2268","ENG_062_MZB_LO_2268-16.10.2015","16.10.2015",2015,10,16,1.073667386,1
"ENG_062_MZB_LO_2268","ENG_062_MZB_LO_2268-01.11.2016","01.11.2016",2016,11,1,1.146519217,1
"ENG_062_MZB_LO_2268","ENG_062_MZB_LO_2268-05.11.2018","05.11.2018",2018,11,5,1.18329228,1
"ENG_062_MZB_LO_2268","ENG_062_MZB_LO_2268-13.09.2019","13.09.2019",2019,9,13,1.053321662,1
"ENG_062_MZB_LO_2268","ENG_062_MZB_LO_2268-16.09.2020","16.09.2020",2020,9,16,1.112060204,1
"ENG_062_MZB_LO_2268","ENG_062_MZB_LO_2268-13.10.2021","13.10.2021",2021,10,13,1.081074849,1
"ENG_062_MZB_LO_2268","ENG_062_MZB_LO_2268-05.10.2022","05.10.2022",2022,10,5,1.159619316,1
"ENG_062_MZB_LO_2268","ENG_062_MZB_LO_2268-13.10.2023","13.10.2023",2023,10,13,1.132143647,1
"ENG_062_MZB_LO_2270","ENG_062_MZB_LO_2270-18.11.2002","18.11.2002",2002,11,18,1.147119206,1
"ENG_062_MZB_LO_2270","ENG_062_MZB_LO_2270-17.11.2003","17.11.2003",2003,11,17,1.139606723,1
"ENG_062_MZB_LO_2270","ENG_062_MZB_LO_2270-29.10.2004","29.10.2004",2004,10,29,1.112284235,1
"ENG_062_MZB_LO_2270","ENG_062_MZB_LO_2270-07.10.2005","07.10.2005",2005,10,7,1.169187264,1
"ENG_062_MZB_LO_2270","ENG_062_MZB_LO_2270-07.11.2006","07.11.2006",2006,11,7,1.187736476,1
"ENG_062_MZB_LO_2270","ENG_062_MZB_LO_2270-10.11.2008","10.11.2008",2008,11,10,1.250018914,1
"ENG_062_MZB_LO_2270","ENG_062_MZB_LO_2270-19.11.2009","19.11.2009",2009,11,19,1.23451166,1
"ENG_062_MZB_LO_2270","ENG_062_MZB_LO_2270-20.10.2010","20.10.2010",2010,10,20,1.250466602,1
"ENG_062_MZB_LO_2270","ENG_062_MZB_LO_2270-07.11.2011","07.11.2011",2011,11,7,1.277567176,1
"ENG_062_MZB_LO_2270","ENG_062_MZB_LO_2270-15.10.2012","15.10.2012",2012,10,15,1.241699229,1
"ENG_062_MZB_LO_2270","ENG_062_MZB_LO_2270-11.09.2013","11.09.2013",2013,9,11,1.271263705,1
"ENG_062_MZB_LO_2270","ENG_062_MZB_LO_2270-22.09.2014","22.09.2014",2014,9,22,1.213692328,1
"ENG_062_MZB_LO_2270","ENG_062_MZB_LO_2270-13.10.2015","13.10.2015",2015,10,13,1.212212029,1
"ENG_062_MZB_LO_2270","ENG_062_MZB_LO_2270-02.11.2017","02.11.2017",2017,11,2,1.360034966,1
"ENG_062_MZB_LO_2270","ENG_062_MZB_LO_2270-24.10.2018","24.10.2018",2018,10,24,1.319368861,1
"ENG_062_MZB_LO_2270","ENG_062_MZB_LO_2270-03.09.2019","03.09.2019",2019,9,3,1.2077138,1
"ENG_062_MZB_LO_2271","ENG_062_MZB_LO_2271-19.11.2002","19.11.2002",2002,11,19,1.060962765,2
"ENG_062_MZB_LO_2271","ENG_062_MZB_LO_2271-17.11.2003","17.11.2003",2003,11,17,0.896186109,2
"ENG_062_MZB_LO_2271","ENG_062_MZB_LO_2271-29.10.2004","29.10.2004",2004,10,29,0.961987101,2
"ENG_062_MZB_LO_2271","ENG_062_MZB_LO_2271-03.11.2011","03.11.2011",2011,11,3,0.891699515,3
"ENG_062_MZB_LO_2271","ENG_062_MZB_LO_2271-18.09.2012","18.09.2012",2012,9,18,0.948093184,2
"ENG_062_MZB_LO_2271","ENG_062_MZB_LO_2271-05.11.2013","05.11.2013",2013,11,5,1.010602224,1
"ENG_062_MZB_LO_2271","ENG_062_MZB_LO_2271-07.10.2014","07.10.2014",2014,10,7,1.011061281,1
"ENG_062_MZB_LO_2271","ENG_062_MZB_LO_2271-21.09.2015","21.09.2015",2015,9,21,0.990191335,1
"ENG_062_MZB_LO_2271","ENG_062_MZB_LO_2271-15.09.2016","15.09.2016",2016,9,15,0.97961888,2
"ENG_062_MZB_LO_2271","ENG_062_MZB_LO_2271-06.10.2017","06.10.2017",2017,10,6,1.049565479,1
"ENG_062_MZB_LO_2271","ENG_062_MZB_LO_2271-05.09.2018","05.09.2018",2018,9,5,1.083347648,1
"ENG_062_MZB_LO_2271","ENG_062_MZB_LO_2271-04.11.2019","04.11.2019",2019,11,4,1.069832377,1
"ENG_062_MZB_LO_2271","ENG_062_MZB_LO_2271-22.09.2020","22.09.2020",2020,9,22,1.038218977,1
"ENG_062_MZB_LO_2271","ENG_062_MZB_LO_2271-02.11.2021","02.11.2021",2021,11,2,1.003507588,1
"ENG_062_MZB_LO_2271","ENG_062_MZB_LO_2271-27.11.2023","27.11.2023",2023,11,27,0.999345932,1
"ENG_062_MZB_LO_2273","ENG_062_MZB_LO_2273-04.11.2002","04.11.2002",2002,11,4,1.081411452,1
"ENG_062_MZB_LO_2273","ENG_062_MZB_LO_2273-22.09.2003","22.09.2003",2003,9,22,1.116810247,1
"ENG_062_MZB_LO_2273","ENG_062_MZB_LO_2273-15.10.2004","15.10.2004",2004,10,15,1.312536188,1
"ENG_062_MZB_LO_2273","ENG_062_MZB_LO_2273-21.09.2006","21.09.2006",2006,9,21,0.833522126,3
"ENG_062_MZB_LO_2273","ENG_062_MZB_LO_2273-25.10.2007","25.10.2007",2007,10,25,1.120708385,1
"ENG_062_MZB_LO_2273","ENG_062_MZB_LO_2273-28.11.2008","28.11.2008",2008,11,28,1.203772215,1
"ENG_062_MZB_LO_2273","ENG_062_MZB_LO_2273-06.10.2009","06.10.2009",2009,10,6,1.245342914,1
"ENG_062_MZB_LO_2273","ENG_062_MZB_LO_2273-05.10.2010","05.10.2010",2010,10,5,1.238562343,1
"ENG_062_MZB_LO_2273","ENG_062_MZB_LO_2273-15.09.2011","15.09.2011",2011,9,15,1.233570721,1
"ENG_062_MZB_LO_2273","ENG_062_MZB_LO_2273-10.10.2012","10.10.2012",2012,10,10,1.302086213,1
"ENG_062_MZB_LO_2273","ENG_062_MZB_LO_2273-11.09.2013","11.09.2013",2013,9,11,1.219657288,1
"ENG_062_MZB_LO_2273","ENG_062_MZB_LO_2273-26.09.2014","26.09.2014",2014,9,26,1.264481189,1
"ENG_062_MZB_LO_2273","ENG_062_MZB_LO_2273-08.10.2015","08.10.2015",2015,10,8,1.207451068,1
"ENG_062_MZB_LO_2273","ENG_062_MZB_LO_2273-26.10.2016","26.10.2016",2016,10,26,1.206375869,1
"ENG_062_MZB_LO_2273","ENG_062_MZB_LO_2273-16.10.2017","16.10.2017",2017,10,16,1.255167836,1
"ENG_062_MZB_LO_2273","ENG_062_MZB_LO_2273-25.10.2018","25.10.2018",2018,10,25,1.256155607,1
"ENG_062_MZB_LO_2273","ENG_062_MZB_LO_2273-05.11.2019","05.11.2019",2019,11,5,1.19568995,1
"ENG_062_MZB_LO_2274","ENG_062_MZB_LO_2274-24.09.2002","24.09.2002",2002,9,24,0.844872024,3
"ENG_062_MZB_LO_2274","ENG_062_MZB_LO_2274-04.11.2003","04.11.2003",2003,11,4,0.744384734,3
"ENG_062_MZB_LO_2274","ENG_062_MZB_LO_2274-12.11.2004","12.11.2004",2004,11,12,0.792463159,3
"ENG_062_MZB_LO_2274","ENG_062_MZB_LO_2274-05.11.2007","05.11.2007",2007,11,5,0.758927233,3
"ENG_062_MZB_LO_2274","ENG_062_MZB_LO_2274-19.09.2011","19.09.2011",2011,9,19,0.802213689,3
"ENG_062_MZB_LO_2274","ENG_062_MZB_LO_2274-01.10.2012","01.10.2012",2012,10,1,0.803429207,3
"ENG_062_MZB_LO_2274","ENG_062_MZB_LO_2274-19.10.2015","19.10.2015",2015,10,19,0.78725556,3
"ENG_062_MZB_LO_2275","ENG_062_MZB_LO_2275-17.11.2004","17.11.2004",2004,11,17,0.80496029,3
"ENG_062_MZB_LO_2275","ENG_062_MZB_LO_2275-05.11.2007","05.11.2007",2007,11,5,0.944388602,3
"ENG_062_MZB_LO_2275","ENG_062_MZB_LO_2275-07.10.2013","07.10.2013",2013,10,7,0.760744416,3
"ENG_062_MZB_LO_2275","ENG_062_MZB_LO_2275-21.11.2014","21.11.2014",2014,11,21,0.746773304,3
"ENG_062_MZB_LO_2275","ENG_062_MZB_LO_2275-08.09.2016","08.09.2016",2016,9,8,0.837701079,3
"ENG_062_MZB_LO_2275","ENG_062_MZB_LO_2275-03.11.2017","03.11.2017",2017,11,3,0.784151626,3
"ENG_062_MZB_LO_2275","ENG_062_MZB_LO_2275-31.10.2018","31.10.2018",2018,10,31,0.792425666,5
"ENG_062_MZB_LO_2276","ENG_062_MZB_LO_2276-24.09.2002","24.09.2002",2002,9,24,0.912127109,2
"ENG_062_MZB_LO_2276","ENG_062_MZB_LO_2276-04.11.2003","04.11.2003",2003,11,4,1.033838904,1
"ENG_062_MZB_LO_2276","ENG_062_MZB_LO_2276-17.11.2004","17.11.2004",2004,11,17,0.870760732,3
"ENG_062_MZB_LO_2276","ENG_062_MZB_LO_2276-15.09.2005","15.09.2005",2005,9,15,0.951403696,2
"ENG_062_MZB_LO_2276","ENG_062_MZB_LO_2276-03.10.2006","03.10.2006",2006,10,3,0.898911564,2
"ENG_062_MZB_LO_2276","ENG_062_MZB_LO_2276-27.11.2008","27.11.2008",2008,11,27,0.917123139,2
"ENG_062_MZB_LO_2276","ENG_062_MZB_LO_2276-27.10.2009","27.10.2009",2009,10,27,0.948092094,2
"ENG_062_MZB_LO_2276","ENG_062_MZB_LO_2276-03.11.2010","03.11.2010",2010,11,3,0.920371691,2
"ENG_062_MZB_LO_2276","ENG_062_MZB_LO_2276-19.09.2011","19.09.2011",2011,9,19,0.881389494,2
"ENG_062_MZB_LO_2276","ENG_062_MZB_LO_2276-20.09.2012","20.09.2012",2012,9,20,0.900193927,2
"ENG_062_MZB_LO_2276","ENG_062_MZB_LO_2276-09.09.2013","09.09.2013",2013,9,9,0.910198339,2
"ENG_062_MZB_LO_2276","ENG_062_MZB_LO_2276-22.11.2014","22.11.2014",2014,11,22,0.882728543,2
"ENG_062_MZB_LO_2276","ENG_062_MZB_LO_2276-23.09.2015","23.09.2015",2015,9,23,0.820194493,3
"ENG_062_MZB_LO_2276","ENG_062_MZB_LO_2276-21.10.2016","21.10.2016",2016,10,21,0.929779987,2
"ENG_062_MZB_LO_2276","ENG_062_MZB_LO_2276-29.11.2017","29.11.2017",2017,11,29,0.81644492,3
"ENG_062_MZB_LO_2276","ENG_062_MZB_LO_2276-04.10.2018","04.10.2018",2018,10,4,0.792207996,3
"ENG_062_MZB_LO_2276","ENG_062_MZB_LO_2276-04.11.2020","04.11.2020",2020,11,4,0.837305695,3
"ENG_062_MZB_LO_2276","ENG_062_MZB_LO_2276-10.10.2021","10.10.2021",2021,10,10,0.842280031,3
"ENG_062_MZB_LO_2277","ENG_062_MZB_LO_2277-24.09.2002","24.09.2002",2002,9,24,1.086255102,1
"ENG_062_MZB_LO_2277","ENG_062_MZB_LO_2277-26.11.2003","26.11.2003",2003,11,26,1.11470558,1
"ENG_062_MZB_LO_2277","ENG_062_MZB_LO_2277-05.11.2007","05.11.2007",2007,11,5,1.055624241,1
"ENG_062_MZB_LO_2277","ENG_062_MZB_LO_2277-19.09.2011","19.09.2011",2011,9,19,1.031363213,1
"ENG_062_MZB_LO_2277","ENG_062_MZB_LO_2277-16.11.2012","16.11.2012",2012,11,16,1.177262719,1
"ENG_062_MZB_LO_2277","ENG_062_MZB_LO_2277-06.09.2013","06.09.2013",2013,9,6,1.11009288,1
"ENG_062_MZB_LO_2277","ENG_062_MZB_LO_2277-06.10.2017","06.10.2017",2017,10,6,1.07936764,1
"ENG_062_MZB_LO_2277","ENG_062_MZB_LO_2277-11.09.2018","11.09.2018",2018,9,11,1.063302153,1
"ENG_062_MZB_LO_2277","ENG_062_MZB_LO_2277-04.11.2020","04.11.2020",2020,11,4,0.946015104,2
"ENG_062_MZB_LO_2279","ENG_062_MZB_LO_2279-26.11.2003","26.11.2003",2003,11,26,0.918810424,2
"ENG_062_MZB_LO_2279","ENG_062_MZB_LO_2279-19.11.2009","19.11.2009",2009,11,19,0.953657195,2
"ENG_062_MZB_LO_2279","ENG_062_MZB_LO_2279-02.09.2013","02.09.2013",2013,9,2,1.006628834,2
"ENG_062_MZB_LO_2279","ENG_062_MZB_LO_2279-16.09.2015","16.09.2015",2015,9,16,0.890494362,2
"ENG_062_MZB_LO_2279","ENG_062_MZB_LO_2279-10.09.2021","10.09.2021",2021,9,10,0.849932138,3
"ENG_062_MZB_LO_2279","ENG_062_MZB_LO_2279-29.09.2022","29.09.2022",2022,9,29,0.855704639,3
"ENG_062_MZB_LO_2279","ENG_062_MZB_LO_2279-05.10.2023","05.10.2023",2023,10,5,0.900778558,2
"ENG_062_MZB_LO_2280","ENG_062_MZB_LO_2280-24.09.2002","24.09.2002",2002,9,24,1.182954648,1
"ENG_062_MZB_LO_2280","ENG_062_MZB_LO_2280-26.11.2003","26.11.2003",2003,11,26,1.17125997,1
"ENG_062_MZB_LO_2280","ENG_062_MZB_LO_2280-16.11.2004","16.11.2004",2004,11,16,1.18125824,1
"ENG_062_MZB_LO_2280","ENG_062_MZB_LO_2280-15.09.2005","15.09.2005",2005,9,15,1.222335374,1
"ENG_062_MZB_LO_2280","ENG_062_MZB_LO_2280-30.10.2006","30.10.2006",2006,10,30,1.252451647,1
"ENG_062_MZB_LO_2280","ENG_062_MZB_LO_2280-27.11.2008","27.11.2008",2008,11,27,1.15186606,1
"ENG_062_MZB_LO_2280","ENG_062_MZB_LO_2280-02.11.2009","02.11.2009",2009,11,2,1.211109244,1
"ENG_062_MZB_LO_2280","ENG_062_MZB_LO_2280-04.10.2012","04.10.2012",2012,10,4,1.115207136,1
"ENG_062_MZB_LO_2280","ENG_062_MZB_LO_2280-21.09.2016","21.09.2016",2016,9,21,1.260955399,1
"ENG_062_MZB_LO_2280","ENG_062_MZB_LO_2280-20.09.2018","20.09.2018",2018,9,20,1.19396691,1
"ENG_062_MZB_LO_2281","ENG_062_MZB_LO_2281-29.10.2002","29.10.2002",2002,10,29,0.908276123,2
"ENG_062_MZB_LO_2281","ENG_062_MZB_LO_2281-15.09.2005","15.09.2005",2005,9,15,1.01976677,1
"ENG_062_MZB_LO_2281","ENG_062_MZB_LO_2281-27.11.2008","27.11.2008",2008,11,27,0.958483135,2
"ENG_062_MZB_LO_2281","ENG_062_MZB_LO_2281-26.10.2010","26.10.2010",2010,10,26,0.985485881,1
"ENG_062_MZB_LO_2281","ENG_062_MZB_LO_2281-21.11.2014","21.11.2014",2014,11,21,1.003250106,1
"ENG_062_MZB_LO_2281","ENG_062_MZB_LO_2281-10.10.2021","10.10.2021",2021,10,10,0.936892618,2
"ENG_062_MZB_LO_2281","ENG_062_MZB_LO_2281-12.09.2022","12.09.2022",2022,9,12,0.828646119,4
"ENG_062_MZB_LO_2282","ENG_062_MZB_LO_2282-02.09.2002","02.09.2002",2002,9,2,1.127989086,1
"ENG_062_MZB_LO_2282","ENG_062_MZB_LO_2282-01.10.2003","01.10.2003",2003,10,1,1.09706209,1
"ENG_062_MZB_LO_2282","ENG_062_MZB_LO_2282-26.10.2006","26.10.2006",2006,10,26,1.118610689,1
"ENG_062_MZB_LO_2282","ENG_062_MZB_LO_2282-19.10.2010","19.10.2010",2010,10,19,1.237207237,1
"ENG_062_MZB_LO_2282","ENG_062_MZB_LO_2282-12.10.2012","12.10.2012",2012,10,12,1.176344636,1
"ENG_062_MZB_LO_2282","ENG_062_MZB_LO_2282-15.11.2013","15.11.2013",2013,11,15,1.150974159,1
"ENG_062_MZB_LO_2282","ENG_062_MZB_LO_2282-26.10.2015","26.10.2015",2015,10,26,1.211449514,1
"ENG_062_MZB_LO_2282","ENG_062_MZB_LO_2282-17.10.2023","17.10.2023",2023,10,17,1.159565255,2
"ENG_062_MZB_LO_2283","ENG_062_MZB_LO_2283-02.09.2002","02.09.2002",2002,9,2,0.973545549,2
"ENG_062_MZB_LO_2283","ENG_062_MZB_LO_2283-01.10.2003","01.10.2003",2003,10,1,0.951210763,2
"ENG_062_MZB_LO_2283","ENG_062_MZB_LO_2283-07.10.2004","07.10.2004",2004,10,7,1.11351785,1
"ENG_062_MZB_LO_2283","ENG_062_MZB_LO_2283-01.11.2005","01.11.2005",2005,11,1,1.112927709,1
"ENG_062_MZB_LO_2283","ENG_062_MZB_LO_2283-26.10.2006","26.10.2006",2006,10,26,1.118991061,1
"ENG_062_MZB_LO_2283","ENG_062_MZB_LO_2283-13.10.2008","13.10.2008",2008,10,13,1.055309913,1
"ENG_062_MZB_LO_2283","ENG_062_MZB_LO_2283-06.10.2009","06.10.2009",2009,10,6,1.128038229,1
"ENG_062_MZB_LO_2283","ENG_062_MZB_LO_2283-19.10.2010","19.10.2010",2010,10,19,1.171479693,1
"ENG_062_MZB_LO_2283","ENG_062_MZB_LO_2283-22.09.2011","22.09.2011",2011,9,22,1.149290648,1
"ENG_062_MZB_LO_2283","ENG_062_MZB_LO_2283-17.10.2012","17.10.2012",2012,10,17,1.127834358,1
"ENG_062_MZB_LO_2283","ENG_062_MZB_LO_2283-30.10.2013","30.10.2013",2013,10,30,1.138970843,1
"ENG_062_MZB_LO_2283","ENG_062_MZB_LO_2283-19.09.2014","19.09.2014",2014,9,19,1.170961367,1
"ENG_062_MZB_LO_2283","ENG_062_MZB_LO_2283-11.11.2016","11.11.2016",2016,11,11,1.238358148,1
"ENG_062_MZB_LO_2283","ENG_062_MZB_LO_2283-27.09.2018","27.09.2018",2018,9,27,1.191659256,1
"ENG_062_MZB_LO_2283","ENG_062_MZB_LO_2283-16.09.2020","16.09.2020",2020,9,16,1.232985401,1
"ENG_062_MZB_LO_2283","ENG_062_MZB_LO_2283-13.10.2021","13.10.2021",2021,10,13,1.207948337,1
"ENG_062_MZB_LO_2285","ENG_062_MZB_LO_2285-12.09.2002","12.09.2002",2002,9,12,1.175113544,1
"ENG_062_MZB_LO_2285","ENG_062_MZB_LO_2285-29.09.2003","29.09.2003",2003,9,29,1.231958495,1
"ENG_062_MZB_LO_2285","ENG_062_MZB_LO_2285-07.10.2004","07.10.2004",2004,10,7,1.206516029,1
"ENG_062_MZB_LO_2285","ENG_062_MZB_LO_2285-25.10.2007","25.10.2007",2007,10,25,1.050554254,2
"ENG_062_MZB_LO_2285","ENG_062_MZB_LO_2285-15.10.2012","15.10.2012",2012,10,15,1.129529033,1
"ENG_062_MZB_LO_2285","ENG_062_MZB_LO_2285-11.10.2013","11.10.2013",2013,10,11,1.177837403,1
"ENG_062_MZB_LO_2285","ENG_062_MZB_LO_2285-30.09.2014","30.09.2014",2014,9,30,1.123462646,1
"ENG_062_MZB_LO_2285","ENG_062_MZB_LO_2285-12.10.2015","12.10.2015",2015,10,12,1.096825236,1
"ENG_062_MZB_LO_2285","ENG_062_MZB_LO_2285-26.10.2016","26.10.2016",2016,10,26,1.220510919,1
"ENG_062_MZB_LO_2286","ENG_062_MZB_LO_2286-08.10.2003","08.10.2003",2003,10,8,1.02408523,1
"ENG_062_MZB_LO_2286","ENG_062_MZB_LO_2286-15.10.2004","15.10.2004",2004,10,15,1.060473556,1
"ENG_062_MZB_LO_2286","ENG_062_MZB_LO_2286-08.11.2005","08.11.2005",2005,11,8,1.130046714,1
"ENG_062_MZB_LO_2286","ENG_062_MZB_LO_2286-21.09.2006","21.09.2006",2006,9,21,1.05140006,1
"ENG_062_MZB_LO_2286","ENG_062_MZB_LO_2286-28.11.2008","28.11.2008",2008,11,28,1.123207304,1
"ENG_062_MZB_LO_2286","ENG_062_MZB_LO_2286-13.10.2009","13.10.2009",2009,10,13,1.089774011,1
"ENG_062_MZB_LO_2286","ENG_062_MZB_LO_2286-27.09.2010","27.09.2010",2010,9,27,1.098968917,1
"ENG_062_MZB_LO_2286","ENG_062_MZB_LO_2286-07.11.2011","07.11.2011",2011,11,7,1.147184317,1
"ENG_062_MZB_LO_2286","ENG_062_MZB_LO_2286-20.09.2012","20.09.2012",2012,9,20,1.169553911,1
"ENG_062_MZB_LO_2286","ENG_062_MZB_LO_2286-23.09.2013","23.09.2013",2013,9,23,1.133069903,1
"ENG_062_MZB_LO_2286","ENG_062_MZB_LO_2286-12.11.2014","12.11.2014",2014,11,12,1.167172175,1
"ENG_062_MZB_LO_2286","ENG_062_MZB_LO_2286-14.09.2015","14.09.2015",2015,9,14,1.172829981,1
"ENG_062_MZB_LO_2286","ENG_062_MZB_LO_2286-17.10.2023","17.10.2023",2023,10,17,1.164935973,1
"ENG_062_MZB_LO_2287","ENG_062_MZB_LO_2287-04.03.2002","04.03.2002",2002,3,4,0.995145397,1
"ENG_062_MZB_LO_2287","ENG_062_MZB_LO_2287-14.05.2003","14.05.2003",2003,5,14,1.141864879,1
"ENG_062_MZB_LO_2287","ENG_062_MZB_LO_2287-31.03.2004","31.03.2004",2004,3,31,1.110424554,1
"ENG_062_MZB_LO_2287","ENG_062_MZB_LO_2287-06.05.2005","06.05.2005",2005,5,6,1.03997215,1
"ENG_062_MZB_LO_2287","ENG_062_MZB_LO_2287-15.03.2006","15.03.2006",2006,3,15,1.087173033,1
"ENG_062_MZB_LO_2287","ENG_062_MZB_LO_2287-12.03.2007","12.03.2007",2007,3,12,1.089700226,1
"ENG_062_MZB_LO_2287","ENG_062_MZB_LO_2287-27.05.2009","27.05.2009",2009,5,27,1.150224023,1
"ENG_062_MZB_LO_2287","ENG_062_MZB_LO_2287-22.04.2010","22.04.2010",2010,4,22,1.209152685,2
"ENG_062_MZB_LO_2287","ENG_062_MZB_LO_2287-28.05.2015","28.05.2015",2015,5,28,1.149505938,1
"ENG_062_MZB_LO_2288","ENG_062_MZB_LO_2288-12.09.2002","12.09.2002",2002,9,12,1.186702993,1
"ENG_062_MZB_LO_2288","ENG_062_MZB_LO_2288-22.09.2003","22.09.2003",2003,9,22,1.156172286,1
"ENG_062_MZB_LO_2288","ENG_062_MZB_LO_2288-07.10.2004","07.10.2004",2004,10,7,1.182776454,1
"ENG_062_MZB_LO_2288","ENG_062_MZB_LO_2288-08.11.2005","08.11.2005",2005,11,8,1.227217762,1
"ENG_062_MZB_LO_2288","ENG_062_MZB_LO_2288-14.11.2006","14.11.2006",2006,11,14,1.276675508,1
"ENG_062_MZB_LO_2288","ENG_062_MZB_LO_2288-25.10.2007","25.10.2007",2007,10,25,1.257272582,1
"ENG_062_MZB_LO_2288","ENG_062_MZB_LO_2288-28.11.2008","28.11.2008",2008,11,28,1.31439901,1
"ENG_062_MZB_LO_2288","ENG_062_MZB_LO_2288-13.10.2009","13.10.2009",2009,10,13,1.288254354,1
"ENG_062_MZB_LO_2288","ENG_062_MZB_LO_2288-22.09.2010","22.09.2010",2010,9,22,1.280886971,1
"ENG_062_MZB_LO_2288","ENG_062_MZB_LO_2288-21.09.2011","21.09.2011",2011,9,21,1.260172135,1
"ENG_062_MZB_LO_2288","ENG_062_MZB_LO_2288-04.10.2012","04.10.2012",2012,10,4,1.21298265,1
"ENG_062_MZB_LO_2288","ENG_062_MZB_LO_2288-23.09.2013","23.09.2013",2013,9,23,1.283687129,1
"ENG_062_MZB_LO_2288","ENG_062_MZB_LO_2288-30.09.2014","30.09.2014",2014,9,30,1.264229162,1
"ENG_062_MZB_LO_2288","ENG_062_MZB_LO_2288-03.09.2015","03.09.2015",2015,9,3,1.254342611,1
"ENG_062_MZB_LO_2288","ENG_062_MZB_LO_2288-26.09.2016","26.09.2016",2016,9,26,1.237199552,1
"ENG_062_MZB_LO_2288","ENG_062_MZB_LO_2288-04.10.2017","04.10.2017",2017,10,4,1.300266223,1
"ENG_062_MZB_LO_2288","ENG_062_MZB_LO_2288-27.09.2018","27.09.2018",2018,9,27,1.291489126,1
"ENG_062_MZB_LO_2288","ENG_062_MZB_LO_2288-05.11.2019","05.11.2019",2019,11,5,1.227598107,1
"ENG_062_MZB_LO_2288","ENG_062_MZB_LO_2288-01.09.2020","01.09.2020",2020,9,1,1.24293583,1
"ENG_062_MZB_LO_2288","ENG_062_MZB_LO_2288-25.11.2021","25.11.2021",2021,11,25,1.252181328,1
"ENG_062_MZB_LO_2288","ENG_062_MZB_LO_2288-03.10.2022","03.10.2022",2022,10,3,1.343059428,1
"ENG_062_MZB_LO_2288","ENG_062_MZB_LO_2288-13.10.2023","13.10.2023",2023,10,13,1.290527821,1
"ENG_062_MZB_LO_2288","ENG_062_MZB_LO_2288-02.09.2024","02.09.2024",2024,9,2,1.265057317,1
"ENG_062_MZB_LO_2289","ENG_062_MZB_LO_2289-23.04.2002","23.04.2002",2002,4,23,1.111212863,1
"ENG_062_MZB_LO_2289","ENG_062_MZB_LO_2289-06.05.2005","06.05.2005",2005,5,6,1.117603055,1
"ENG_062_MZB_LO_2289","ENG_062_MZB_LO_2289-21.04.2008","21.04.2008",2008,4,21,0.981124642,3
"ENG_062_MZB_LO_2289","ENG_062_MZB_LO_2289-18.04.2013","18.04.2013",2013,4,18,0.959750913,5
"ENG_062_MZB_LO_2289","ENG_062_MZB_LO_2289-18.05.2015","18.05.2015",2015,5,18,1.131684787,1
"ENG_062_MZB_LO_2289","ENG_062_MZB_LO_2289-01.03.2016","01.03.2016",2016,3,1,1.028812973,2
"ENG_062_MZB_LO_2289","ENG_062_MZB_LO_2289-04.04.2017","04.04.2017",2017,4,4,1.053469434,1
"ENG_062_MZB_LO_2290","ENG_062_MZB_LO_2290-12.09.2002","12.09.2002",2002,9,12,1.059062481,1
"ENG_062_MZB_LO_2290","ENG_062_MZB_LO_2290-22.09.2003","22.09.2003",2003,9,22,1.158081997,1
"ENG_062_MZB_LO_2290","ENG_062_MZB_LO_2290-08.11.2005","08.11.2005",2005,11,8,1.167211499,1
"ENG_062_MZB_LO_2290","ENG_062_MZB_LO_2290-11.09.2008","11.09.2008",2008,9,11,1.055628475,1
"ENG_062_MZB_LO_2290","ENG_062_MZB_LO_2290-13.10.2009","13.10.2009",2009,10,13,1.162664878,1
"ENG_062_MZB_LO_2290","ENG_062_MZB_LO_2290-21.09.2011","21.09.2011",2011,9,21,1.147550092,1
"ENG_062_MZB_LO_2290","ENG_062_MZB_LO_2290-10.09.2014","10.09.2014",2014,9,10,1.052524291,1
"ENG_062_MZB_LO_2290","ENG_062_MZB_LO_2290-04.10.2017","04.10.2017",2017,10,4,1.092345487,1
"ENG_062_MZB_LO_2290","ENG_062_MZB_LO_2290-05.11.2018","05.11.2018",2018,11,5,1.141224312,1
"ENG_062_MZB_LO_2290","ENG_062_MZB_LO_2290-16.09.2020","16.09.2020",2020,9,16,1.050464775,1
"ENG_062_MZB_LO_2290","ENG_062_MZB_LO_2290-08.09.2021","08.09.2021",2021,9,8,1.059881073,1
"ENG_062_MZB_LO_2291","ENG_062_MZB_LO_2291-12.09.2002","12.09.2002",2002,9,12,1.035564404,1
"ENG_062_MZB_LO_2291","ENG_062_MZB_LO_2291-28.10.2003","28.10.2003",2003,10,28,1.058113832,1
"ENG_062_MZB_LO_2291","ENG_062_MZB_LO_2291-21.09.2005","21.09.2005",2005,9,21,1.053593373,1
"ENG_062_MZB_LO_2291","ENG_062_MZB_LO_2291-25.10.2007","25.10.2007",2007,10,25,0.915648804,2
"ENG_062_MZB_LO_2291","ENG_062_MZB_LO_2291-15.09.2011","15.09.2011",2011,9,15,0.99429936,1
"ENG_062_MZB_LO_2291","ENG_062_MZB_LO_2291-04.11.2014","04.11.2014",2014,11,4,1.130866516,1
"ENG_062_MZB_LO_2291","ENG_062_MZB_LO_2291-05.09.2018","05.09.2018",2018,9,5,1.073058451,1
"ENG_062_MZB_LO_2291","ENG_062_MZB_LO_2291-07.09.2023","07.09.2023",2023,9,7,1.08082696,1
"ENG_062_MZB_LO_2292","ENG_062_MZB_LO_2292-12.10.2004","12.10.2004",2004,10,12,0.980115683,3
"ENG_062_MZB_LO_2292","ENG_062_MZB_LO_2292-11.09.2007","11.09.2007",2007,9,11,1.012052611,1
"ENG_062_MZB_LO_2292","ENG_062_MZB_LO_2292-22.09.2008","22.09.2008",2008,9,22,0.920201394,2
"ENG_062_MZB_LO_2292","ENG_062_MZB_LO_2292-06.10.2009","06.10.2009",2009,10,6,1.053969297,1
"ENG_062_MZB_LO_2292","ENG_062_MZB_LO_2292-05.10.2010","05.10.2010",2010,10,5,1.042581532,3
"ENG_062_MZB_LO_2292","ENG_062_MZB_LO_2292-08.09.2011","08.09.2011",2011,9,8,0.916077319,2
"ENG_062_MZB_LO_2292","ENG_062_MZB_LO_2292-18.09.2012","18.09.2012",2012,9,18,1.074480307,1
"ENG_062_MZB_LO_2292","ENG_062_MZB_LO_2292-04.09.2013","04.09.2013",2013,9,4,1.170275148,2
"ENG_062_MZB_LO_2292","ENG_062_MZB_LO_2292-05.09.2014","05.09.2014",2014,9,5,1.026201401,2
"ENG_062_MZB_LO_2292","ENG_062_MZB_LO_2292-20.09.2018","20.09.2018",2018,9,20,1.102690212,2
"ENG_062_MZB_LO_2292","ENG_062_MZB_LO_2292-12.11.2020","12.11.2020",2020,11,12,1.034603118,3
"ENG_062_MZB_LO_2292","ENG_062_MZB_LO_2292-16.11.2021","16.11.2021",2021,11,16,1.067067631,2
"ENG_062_MZB_LO_2294","ENG_062_MZB_LO_2294-19.11.2002","19.11.2002",2002,11,19,1.00006925,1
"ENG_062_MZB_LO_2294","ENG_062_MZB_LO_2294-17.10.2005","17.10.2005",2005,10,17,1.057776123,1
"ENG_062_MZB_LO_2294","ENG_062_MZB_LO_2294-17.11.2008","17.11.2008",2008,11,17,1.051648243,1
"ENG_062_MZB_LO_2294","ENG_062_MZB_LO_2294-18.09.2012","18.09.2012",2012,9,18,1.011462173,1
"ENG_062_MZB_LO_2294","ENG_062_MZB_LO_2294-03.10.2013","03.10.2013",2013,10,3,1.043146131,1
"ENG_062_MZB_LO_2294","ENG_062_MZB_LO_2294-03.10.2014","03.10.2014",2014,10,3,0.957914389,2
"ENG_062_MZB_LO_2294","ENG_062_MZB_LO_2294-28.09.2015","28.09.2015",2015,9,28,1.0740735,1
"ENG_062_MZB_LO_2294","ENG_062_MZB_LO_2294-16.10.2017","16.10.2017",2017,10,16,1.095138596,1
"ENG_062_MZB_LO_2294","ENG_062_MZB_LO_2294-27.11.2018","27.11.2018",2018,11,27,1.075013828,1
"ENG_062_MZB_LO_2294","ENG_062_MZB_LO_2294-06.11.2019","06.11.2019",2019,11,6,1.026479962,1
"ENG_062_MZB_LO_2295","ENG_062_MZB_LO_2295-04.11.2002","04.11.2002",2002,11,4,1.156974063,1
"ENG_062_MZB_LO_2295","ENG_062_MZB_LO_2295-25.09.2003","25.09.2003",2003,9,25,1.125787153,1
"ENG_062_MZB_LO_2295","ENG_062_MZB_LO_2295-01.10.2004","01.10.2004",2004,10,1,1.134226046,1
"ENG_062_MZB_LO_2295","ENG_062_MZB_LO_2295-21.09.2005","21.09.2005",2005,9,21,1.111283951,1
"ENG_062_MZB_LO_2295","ENG_062_MZB_LO_2295-28.11.2006","28.11.2006",2006,11,28,1.139549193,1
"ENG_062_MZB_LO_2295","ENG_062_MZB_LO_2295-22.10.2008","22.10.2008",2008,10,22,1.142908618,1
"ENG_062_MZB_LO_2295","ENG_062_MZB_LO_2295-13.10.2009","13.10.2009",2009,10,13,1.128840158,1
"ENG_062_MZB_LO_2295","ENG_062_MZB_LO_2295-11.10.2010","11.10.2010",2010,10,11,1.162096158,1
"ENG_062_MZB_LO_2295","ENG_062_MZB_LO_2295-22.09.2011","22.09.2011",2011,9,22,1.111139677,1
"ENG_062_MZB_LO_2295","ENG_062_MZB_LO_2295-05.09.2012","05.09.2012",2012,9,5,1.279786898,1
"ENG_062_MZB_LO_2295","ENG_062_MZB_LO_2295-03.10.2013","03.10.2013",2013,10,3,1.273811845,1
"ENG_062_MZB_LO_2295","ENG_062_MZB_LO_2295-11.09.2014","11.09.2014",2014,9,11,1.270644968,1
"ENG_062_MZB_LO_2295","ENG_062_MZB_LO_2295-24.09.2015","24.09.2015",2015,9,24,1.241144725,1
"ENG_062_MZB_LO_2295","ENG_062_MZB_LO_2295-08.09.2016","08.09.2016",2016,9,8,1.176031047,1
"ENG_062_MZB_LO_2295","ENG_062_MZB_LO_2295-20.11.2017","20.11.2017",2017,11,20,1.289781227,1
"ENG_062_MZB_LO_2299","ENG_062_MZB_LO_2299-14.11.2007","14.11.2007",2007,11,14,0.803389682,3
"ENG_062_MZB_LO_2299","ENG_062_MZB_LO_2299-17.11.2009","17.11.2009",2009,11,17,0.841656691,3
"ENG_062_MZB_LO_2299","ENG_062_MZB_LO_2299-19.10.2010","19.10.2010",2010,10,19,0.851516234,3
"ENG_062_MZB_LO_2299","ENG_062_MZB_LO_2299-31.10.2012","31.10.2012",2012,10,31,0.869069866,3
"ENG_062_MZB_LO_2299","ENG_062_MZB_LO_2299-24.10.2014","24.10.2014",2014,10,24,0.845708475,3
"ENG_062_MZB_LO_2299","ENG_062_MZB_LO_2299-03.09.2015","03.09.2015",2015,9,3,0.945983799,3
"ENG_062_MZB_LO_2299","ENG_062_MZB_LO_2299-10.10.2016","10.10.2016",2016,10,10,0.809887419,5
"ENG_062_MZB_LO_2299","ENG_062_MZB_LO_2299-28.09.2017","28.09.2017",2017,9,28,0.825338945,5
"ENG_062_MZB_LO_2299","ENG_062_MZB_LO_2299-21.10.2019","21.10.2019",2019,10,21,0.858822996,3
"ENG_062_MZB_LO_2299","ENG_062_MZB_LO_2299-21.09.2021","21.09.2021",2021,9,21,0.865921981,3
"ENG_062_MZB_LO_2299","ENG_062_MZB_LO_2299-20.09.2022","20.09.2022",2022,9,20,0.871371507,3
"ENG_062_MZB_LO_2300","ENG_062_MZB_LO_2300-21.11.2006","21.11.2006",2006,11,21,0.838354863,3
"ENG_062_MZB_LO_2300","ENG_062_MZB_LO_2300-24.09.2007","24.09.2007",2007,9,24,0.92956797,2
"ENG_062_MZB_LO_2300","ENG_062_MZB_LO_2300-04.11.2008","04.11.2008",2008,11,4,0.930866605,2
"ENG_062_MZB_LO_2300","ENG_062_MZB_LO_2300-05.10.2009","05.10.2009",2009,10,5,0.889889485,2
"ENG_062_MZB_LO_2300","ENG_062_MZB_LO_2300-10.11.2010","10.11.2010",2010,11,10,0.819054524,3
"ENG_062_MZB_LO_2300","ENG_062_MZB_LO_2300-03.11.2011","03.11.2011",2011,11,3,0.874262016,2
"ENG_062_MZB_LO_2300","ENG_062_MZB_LO_2300-16.10.2012","16.10.2012",2012,10,16,0.931228488,2
"ENG_062_MZB_LO_2300","ENG_062_MZB_LO_2300-14.11.2013","14.11.2013",2013,11,14,0.907069917,2
"ENG_062_MZB_LO_2300","ENG_062_MZB_LO_2300-13.11.2014","13.11.2014",2014,11,13,0.924664818,2
"ENG_062_MZB_LO_2300","ENG_062_MZB_LO_2300-07.09.2015","07.09.2015",2015,9,7,0.869023338,2
"ENG_062_MZB_LO_2300","ENG_062_MZB_LO_2300-27.10.2016","27.10.2016",2016,10,27,0.880357685,3
"ENG_062_MZB_LO_2300","ENG_062_MZB_LO_2300-20.10.2017","20.10.2017",2017,10,20,0.943229701,2
"ENG_062_MZB_LO_2301","ENG_062_MZB_LO_2301-04.09.2002","04.09.2002",2002,9,4,0.80619692,3
"ENG_062_MZB_LO_2301","ENG_062_MZB_LO_2301-29.09.2003","29.09.2003",2003,9,29,0.869814977,2
"ENG_062_MZB_LO_2301","ENG_062_MZB_LO_2301-29.11.2005","29.11.2005",2005,11,29,0.7962566,3
"ENG_062_MZB_LO_2301","ENG_062_MZB_LO_2301-21.11.2006","21.11.2006",2006,11,21,0.820730302,3
"ENG_062_MZB_LO_2301","ENG_062_MZB_LO_2301-24.09.2007","24.09.2007",2007,9,24,0.867558063,3
"ENG_062_MZB_LO_2301","ENG_062_MZB_LO_2301-04.11.2008","04.11.2008",2008,11,4,0.82406994,3
"ENG_062_MZB_LO_2301","ENG_062_MZB_LO_2301-21.09.2009","21.09.2009",2009,9,21,0.830667524,3
"ENG_062_MZB_LO_2301","ENG_062_MZB_LO_2301-10.11.2010","10.11.2010",2010,11,10,0.835419576,3
"ENG_062_MZB_LO_2301","ENG_062_MZB_LO_2301-03.11.2011","03.11.2011",2011,11,3,0.796346609,3
"ENG_062_MZB_LO_2301","ENG_062_MZB_LO_2301-20.11.2012","20.11.2012",2012,11,20,0.778960557,3
"ENG_062_MZB_LO_2301","ENG_062_MZB_LO_2301-18.09.2013","18.09.2013",2013,9,18,0.819760057,3
"ENG_062_MZB_LO_2301","ENG_062_MZB_LO_2301-15.09.2014","15.09.2014",2014,9,15,0.868030457,3
"ENG_062_MZB_LO_2301","ENG_062_MZB_LO_2301-24.09.2015","24.09.2015",2015,9,24,0.910590137,2
"ENG_062_MZB_LO_2301","ENG_062_MZB_LO_2301-20.09.2016","20.09.2016",2016,9,20,0.877771075,2
"ENG_062_MZB_LO_2301","ENG_062_MZB_LO_2301-20.10.2017","20.10.2017",2017,10,20,0.85116522,3
"ENG_062_MZB_LO_2301","ENG_062_MZB_LO_2301-23.10.2019","23.10.2019",2019,10,23,0.809248986,3
"ENG_062_MZB_LO_2301","ENG_062_MZB_LO_2301-15.11.2021","15.11.2021",2021,11,15,0.790060656,3
"ENG_062_MZB_LO_2301","ENG_062_MZB_LO_2301-12.09.2022","12.09.2022",2022,9,12,0.94786867,2
"ENG_062_MZB_LO_2302","ENG_062_MZB_LO_2302-04.09.2002","04.09.2002",2002,9,4,0.828016918,3
"ENG_062_MZB_LO_2302","ENG_062_MZB_LO_2302-29.09.2003","29.09.2003",2003,9,29,0.920760671,2
"ENG_062_MZB_LO_2302","ENG_062_MZB_LO_2302-29.11.2005","29.11.2005",2005,11,29,0.987122557,1
"ENG_062_MZB_LO_2302","ENG_062_MZB_LO_2302-21.11.2006","21.11.2006",2006,11,21,0.846440513,3
"ENG_062_MZB_LO_2302","ENG_062_MZB_LO_2302-24.09.2007","24.09.2007",2007,9,24,0.876855409,2
"ENG_062_MZB_LO_2302","ENG_062_MZB_LO_2302-14.09.2009","14.09.2009",2009,9,14,0.889042815,2
"ENG_062_MZB_LO_2302","ENG_062_MZB_LO_2302-18.09.2013","18.09.2013",2013,9,18,0.85471244,3
"ENG_062_MZB_LO_2302","ENG_062_MZB_LO_2302-08.10.2014","08.10.2014",2014,10,8,0.892959915,2
"ENG_062_MZB_LO_2302","ENG_062_MZB_LO_2302-16.09.2015","16.09.2015",2015,9,16,0.829126478,3
"ENG_062_MZB_LO_2302","ENG_062_MZB_LO_2302-30.09.2016","30.09.2016",2016,9,30,0.837692607,3
"ENG_062_MZB_LO_2302","ENG_062_MZB_LO_2302-20.10.2017","20.10.2017",2017,10,20,0.856340075,3
"ENG_062_MZB_LO_2302","ENG_062_MZB_LO_2302-28.09.2018","28.09.2018",2018,9,28,0.847904842,3
"ENG_062_MZB_LO_2302","ENG_062_MZB_LO_2302-24.11.2020","24.11.2020",2020,11,24,0.852718336,3
"ENG_062_MZB_LO_2302","ENG_062_MZB_LO_2302-15.11.2021","15.11.2021",2021,11,15,0.865042769,3
"ENG_062_MZB_LO_2302","ENG_062_MZB_LO_2302-12.09.2022","12.09.2022",2022,9,12,0.835323925,3
"ENG_062_MZB_LO_2303","ENG_062_MZB_LO_2303-17.10.2002","17.10.2002",2002,10,17,0.970913804,1
"ENG_062_MZB_LO_2303","ENG_062_MZB_LO_2303-10.11.2003","10.11.2003",2003,11,10,0.95583844,2
"ENG_062_MZB_LO_2303","ENG_062_MZB_LO_2303-11.10.2004","11.10.2004",2004,10,11,0.960494039,1
"ENG_062_MZB_LO_2303","ENG_062_MZB_LO_2303-29.11.2005","29.11.2005",2005,11,29,0.935689587,2
"ENG_062_MZB_LO_2303","ENG_062_MZB_LO_2303-25.10.2006","25.10.2006",2006,10,25,0.940959817,2
"ENG_062_MZB_LO_2303","ENG_062_MZB_LO_2303-11.10.2007","11.10.2007",2007,10,11,0.867654473,3
"ENG_062_MZB_LO_2303","ENG_062_MZB_LO_2303-05.11.2008","05.11.2008",2008,11,5,0.940394198,2
"ENG_062_MZB_LO_2303","ENG_062_MZB_LO_2303-05.10.2009","05.10.2009",2009,10,5,1.003030143,1
"ENG_062_MZB_LO_2303","ENG_062_MZB_LO_2303-26.10.2010","26.10.2010",2010,10,26,0.838415643,3
"ENG_062_MZB_LO_2303","ENG_062_MZB_LO_2303-24.11.2011","24.11.2011",2011,11,24,0.996901301,2
"ENG_062_MZB_LO_2303","ENG_062_MZB_LO_2303-15.10.2012","15.10.2012",2012,10,15,0.841699814,3
"ENG_062_MZB_LO_2303","ENG_062_MZB_LO_2303-16.10.2013","16.10.2013",2013,10,16,0.866304822,3
"ENG_062_MZB_LO_2303","ENG_062_MZB_LO_2303-19.10.2015","19.10.2015",2015,10,19,0.852611798,3
"ENG_062_MZB_LO_2303","ENG_062_MZB_LO_2303-10.10.2016","10.10.2016",2016,10,10,0.921857889,2
"ENG_062_MZB_LO_2303","ENG_062_MZB_LO_2303-27.10.2017","27.10.2017",2017,10,27,0.900860941,2
"ENG_062_MZB_LO_2303","ENG_062_MZB_LO_2303-24.09.2019","24.09.2019",2019,9,24,0.866069949,3
"ENG_062_MZB_LO_2303","ENG_062_MZB_LO_2303-24.11.2020","24.11.2020",2020,11,24,0.829764543,3
"ENG_062_MZB_LO_2303","ENG_062_MZB_LO_2303-12.09.2022","12.09.2022",2022,9,12,0.841328398,3
"ENG_062_MZB_LO_2303","ENG_062_MZB_LO_2303-13.11.2023","13.11.2023",2023,11,13,0.901883423,2
"ENG_062_MZB_LO_2303","ENG_062_MZB_LO_2303-30.10.2024","30.10.2024",2024,10,30,0.882111851,2
"ENG_062_MZB_LO_2304","ENG_062_MZB_LO_2304-17.10.2002","17.10.2002",2002,10,17,1.063299968,1
"ENG_062_MZB_LO_2304","ENG_062_MZB_LO_2304-10.11.2003","10.11.2003",2003,11,10,1.055022978,1
"ENG_062_MZB_LO_2304","ENG_062_MZB_LO_2304-11.10.2004","11.10.2004",2004,10,11,1.088865007,1
"ENG_062_MZB_LO_2304","ENG_062_MZB_LO_2304-29.11.2005","29.11.2005",2005,11,29,1.03703293,1
"ENG_062_MZB_LO_2304","ENG_062_MZB_LO_2304-25.10.2006","25.10.2006",2006,10,25,1.016750037,1
"ENG_062_MZB_LO_2304","ENG_062_MZB_LO_2304-11.10.2007","11.10.2007",2007,10,11,1.079126032,1
"ENG_062_MZB_LO_2304","ENG_062_MZB_LO_2304-05.10.2009","05.10.2009",2009,10,5,0.999801705,2
"ENG_062_MZB_LO_2304","ENG_062_MZB_LO_2304-26.10.2010","26.10.2010",2010,10,26,0.978313752,2
"ENG_062_MZB_LO_2304","ENG_062_MZB_LO_2304-24.11.2011","24.11.2011",2011,11,24,0.983608273,2
"ENG_062_MZB_LO_2304","ENG_062_MZB_LO_2304-15.10.2012","15.10.2012",2012,10,15,0.992195195,1
"ENG_062_MZB_LO_2304","ENG_062_MZB_LO_2304-03.11.2014","03.11.2014",2014,11,3,1.045693736,1
"ENG_062_MZB_LO_2304","ENG_062_MZB_LO_2304-29.09.2015","29.09.2015",2015,9,29,0.978000316,1
"ENG_062_MZB_LO_2304","ENG_062_MZB_LO_2304-29.09.2016","29.09.2016",2016,9,29,0.988970307,1
"ENG_062_MZB_LO_2304","ENG_062_MZB_LO_2304-25.09.2017","25.09.2017",2017,9,25,1.065003655,1
"ENG_062_MZB_LO_2304","ENG_062_MZB_LO_2304-27.09.2018","27.09.2018",2018,9,27,1.022765217,1
"ENG_062_MZB_LO_2304","ENG_062_MZB_LO_2304-24.11.2020","24.11.2020",2020,11,24,0.968871826,2
"ENG_062_MZB_LO_2304","ENG_062_MZB_LO_2304-20.10.2021","20.10.2021",2021,10,20,0.998764764,1
"ENG_062_MZB_LO_2304","ENG_062_MZB_LO_2304-12.09.2022","12.09.2022",2022,9,12,0.98854929,1
"ENG_062_MZB_LO_2305","ENG_062_MZB_LO_2305-17.10.2002","17.10.2002",2002,10,17,0.839711561,3
"ENG_062_MZB_LO_2305","ENG_062_MZB_LO_2305-10.11.2003","10.11.2003",2003,11,10,0.840690903,3
"ENG_062_MZB_LO_2305","ENG_062_MZB_LO_2305-11.10.2004","11.10.2004",2004,10,11,0.864705873,3
"ENG_062_MZB_LO_2305","ENG_062_MZB_LO_2305-29.11.2005","29.11.2005",2005,11,29,0.859271016,3
"ENG_062_MZB_LO_2305","ENG_062_MZB_LO_2305-25.10.2006","25.10.2006",2006,10,25,0.913421149,2
"ENG_062_MZB_LO_2305","ENG_062_MZB_LO_2305-11.10.2007","11.10.2007",2007,10,11,0.887406872,2
"ENG_062_MZB_LO_2305","ENG_062_MZB_LO_2305-05.11.2008","05.11.2008",2008,11,5,0.874154972,2
"ENG_062_MZB_LO_2305","ENG_062_MZB_LO_2305-05.10.2009","05.10.2009",2009,10,5,0.852213332,3
"ENG_062_MZB_LO_2305","ENG_062_MZB_LO_2305-26.10.2010","26.10.2010",2010,10,26,0.865549927,3
"ENG_062_MZB_LO_2305","ENG_062_MZB_LO_2305-26.10.2011","26.10.2011",2011,10,26,0.832829613,3
"ENG_062_MZB_LO_2305","ENG_062_MZB_LO_2305-15.10.2012","15.10.2012",2012,10,15,0.808565307,3
"ENG_062_MZB_LO_2305","ENG_062_MZB_LO_2305-01.10.2013","01.10.2013",2013,10,1,0.881517103,2
"ENG_062_MZB_LO_2305","ENG_062_MZB_LO_2305-30.09.2014","30.09.2014",2014,9,30,0.819225212,3
"ENG_062_MZB_LO_2305","ENG_062_MZB_LO_2305-12.11.2015","12.11.2015",2015,11,12,0.878187923,3
"ENG_062_MZB_LO_2305","ENG_062_MZB_LO_2305-08.11.2016","08.11.2016",2016,11,8,0.84668287,3
"ENG_062_MZB_LO_2305","ENG_062_MZB_LO_2305-15.11.2017","15.11.2017",2017,11,15,0.844996843,3
"ENG_062_MZB_LO_2305","ENG_062_MZB_LO_2305-27.09.2018","27.09.2018",2018,9,27,0.884429789,2
"ENG_062_MZB_LO_2305","ENG_062_MZB_LO_2305-03.10.2023","03.10.2023",2023,10,3,0.856796667,3
"ENG_062_MZB_LO_2305","ENG_062_MZB_LO_2305-05.10.2024","05.10.2024",2024,10,5,0.861264445,3
"ENG_062_MZB_LO_2306","ENG_062_MZB_LO_2306-17.10.2002","17.10.2002",2002,10,17,0.863017518,4
"ENG_062_MZB_LO_2306","ENG_062_MZB_LO_2306-10.11.2003","10.11.2003",2003,11,10,0.931023796,5
"ENG_062_MZB_LO_2306","ENG_062_MZB_LO_2306-11.10.2004","11.10.2004",2004,10,11,0.724968749,5
"ENG_062_MZB_LO_2306","ENG_062_MZB_LO_2306-29.11.2005","29.11.2005",2005,11,29,0.846772845,5
"ENG_062_MZB_LO_2306","ENG_062_MZB_LO_2306-25.10.2006","25.10.2006",2006,10,25,0.854265388,4
"ENG_062_MZB_LO_2306","ENG_062_MZB_LO_2306-11.10.2007","11.10.2007",2007,10,11,0.707233857,5
"ENG_062_MZB_LO_2306","ENG_062_MZB_LO_2306-05.10.2009","05.10.2009",2009,10,5,0.902815381,4
"ENG_062_MZB_LO_2306","ENG_062_MZB_LO_2306-26.10.2010","26.10.2010",2010,10,26,0.846663971,3
"ENG_062_MZB_LO_2306","ENG_062_MZB_LO_2306-15.10.2012","15.10.2012",2012,10,15,0.834500231,4
"ENG_062_MZB_LO_2306","ENG_062_MZB_LO_2306-30.09.2014","30.09.2014",2014,9,30,0.86224072,3
"ENG_062_MZB_LO_2306","ENG_062_MZB_LO_2306-19.10.2015","19.10.2015",2015,10,19,0.923208425,3
"ENG_062_MZB_LO_2306","ENG_062_MZB_LO_2306-08.11.2016","08.11.2016",2016,11,8,0.936488221,3
"ENG_062_MZB_LO_2306","ENG_062_MZB_LO_2306-03.10.2017","03.10.2017",2017,10,3,0.872695286,3
"ENG_062_MZB_LO_2306","ENG_062_MZB_LO_2306-11.09.2019","11.09.2019",2019,9,11,0.844712062,3
"ENG_062_MZB_LO_2306","ENG_062_MZB_LO_2306-19.11.2020","19.11.2020",2020,11,19,0.859107534,3
"ENG_062_MZB_LO_2307","ENG_062_MZB_LO_2307-16.09.2002","16.09.2002",2002,9,16,0.8055277,3
"ENG_062_MZB_LO_2307","ENG_062_MZB_LO_2307-10.11.2003","10.11.2003",2003,11,10,0.924982145,3
"ENG_062_MZB_LO_2307","ENG_062_MZB_LO_2307-01.11.2004","01.11.2004",2004,11,1,0.946858699,5
"ENG_062_MZB_LO_2307","ENG_062_MZB_LO_2307-29.11.2005","29.11.2005",2005,11,29,0.961048611,1
"ENG_062_MZB_LO_2307","ENG_062_MZB_LO_2307-31.10.2006","31.10.2006",2006,10,31,0.88683575,3
"ENG_062_MZB_LO_2307","ENG_062_MZB_LO_2307-17.11.2009","17.11.2009",2009,11,17,0.961032989,5
"ENG_062_MZB_LO_2307","ENG_062_MZB_LO_2307-22.11.2018","22.11.2018",2018,11,22,0.951310163,3
"ENG_062_MZB_LO_2308","ENG_062_MZB_LO_2308-18.09.2002","18.09.2002",2002,9,18,1.286472042,1
"ENG_062_MZB_LO_2308","ENG_062_MZB_LO_2308-15.09.2003","15.09.2003",2003,9,15,1.094067291,2
"ENG_062_MZB_LO_2308","ENG_062_MZB_LO_2308-30.11.2004","30.11.2004",2004,11,30,1.211785336,1
"ENG_062_MZB_LO_2308","ENG_062_MZB_LO_2308-24.10.2005","24.10.2005",2005,10,24,1.151322621,1
"ENG_062_MZB_LO_2308","ENG_062_MZB_LO_2308-27.11.2006","27.11.2006",2006,11,27,1.165625644,1
"ENG_062_MZB_LO_2308","ENG_062_MZB_LO_2308-11.09.2007","11.09.2007",2007,9,11,1.135049771,5
"ENG_062_MZB_LO_2308","ENG_062_MZB_LO_2308-17.11.2008","17.11.2008",2008,11,17,1.08308117,4
"ENG_062_MZB_LO_2308","ENG_062_MZB_LO_2308-28.09.2009","28.09.2009",2009,9,28,1.166116333,1
"ENG_062_MZB_LO_2308","ENG_062_MZB_LO_2308-21.10.2010","21.10.2010",2010,10,21,1.126993218,1
"ENG_062_MZB_LO_2308","ENG_062_MZB_LO_2308-04.10.2011","04.10.2011",2011,10,4,1.141970556,1
"ENG_062_MZB_LO_2308","ENG_062_MZB_LO_2308-07.11.2012","07.11.2012",2012,11,7,1.18459819,3
"ENG_062_MZB_LO_2308","ENG_062_MZB_LO_2308-29.10.2013","29.10.2013",2013,10,29,1.106274863,2
"ENG_062_MZB_LO_2308","ENG_062_MZB_LO_2308-24.10.2014","24.10.2014",2014,10,24,1.054308661,3
"ENG_062_MZB_LO_2308","ENG_062_MZB_LO_2308-01.10.2015","01.10.2015",2015,10,1,1.035780168,3
"ENG_062_MZB_LO_2308","ENG_062_MZB_LO_2308-28.09.2016","28.09.2016",2016,9,28,1.174452728,1
"ENG_062_MZB_LO_2308","ENG_062_MZB_LO_2308-20.10.2017","20.10.2017",2017,10,20,1.141151543,3
"ENG_062_MZB_LO_2308","ENG_062_MZB_LO_2308-25.09.2018","25.09.2018",2018,9,25,1.152409838,3
"ENG_062_MZB_LO_2308","ENG_062_MZB_LO_2308-09.09.2019","09.09.2019",2019,9,9,1.045322183,4
"ENG_062_MZB_LO_2308","ENG_062_MZB_LO_2308-22.10.2020","22.10.2020",2020,10,22,1.115253052,3
"ENG_062_MZB_LO_2308","ENG_062_MZB_LO_2308-20.10.2021","20.10.2021",2021,10,20,1.200138577,1
"ENG_062_MZB_LO_2308","ENG_062_MZB_LO_2308-27.09.2022","27.09.2022",2022,9,27,1.074158309,1
"ENG_062_MZB_LO_2308","ENG_062_MZB_LO_2308-11.10.2023","11.10.2023",2023,10,11,1.043312133,1
"ENG_062_MZB_LO_2309","ENG_062_MZB_LO_2309-04.11.2002","04.11.2002",2002,11,4,0.885829199,2
"ENG_062_MZB_LO_2309","ENG_062_MZB_LO_2309-03.11.2003","03.11.2003",2003,11,3,0.842148409,3
"ENG_062_MZB_LO_2309","ENG_062_MZB_LO_2309-28.09.2004","28.09.2004",2004,9,28,0.99836374,1
"ENG_062_MZB_LO_2309","ENG_062_MZB_LO_2309-08.09.2005","08.09.2005",2005,9,8,1.032948658,1
"ENG_062_MZB_LO_2309","ENG_062_MZB_LO_2309-18.09.2006","18.09.2006",2006,9,18,0.972882805,2
"ENG_062_MZB_LO_2309","ENG_062_MZB_LO_2309-22.10.2007","22.10.2007",2007,10,22,1.081449955,2
"ENG_062_MZB_LO_2309","ENG_062_MZB_LO_2309-17.11.2008","17.11.2008",2008,11,17,1.139499475,1
"ENG_062_MZB_LO_2309","ENG_062_MZB_LO_2309-05.10.2009","05.10.2009",2009,10,5,1.172185685,1
"ENG_062_MZB_LO_2309","ENG_062_MZB_LO_2309-25.10.2011","25.10.2011",2011,10,25,1.170564256,1
"ENG_062_MZB_LO_2309","ENG_062_MZB_LO_2309-12.09.2013","12.09.2013",2013,9,12,1.056218968,4
"ENG_062_MZB_LO_2309","ENG_062_MZB_LO_2309-29.09.2014","29.09.2014",2014,9,29,1.046399778,3
"ENG_062_MZB_LO_2309","ENG_062_MZB_LO_2309-07.10.2015","07.10.2015",2015,10,7,1.109156814,1
"ENG_062_MZB_LO_2309","ENG_062_MZB_LO_2309-19.09.2016","19.09.2016",2016,9,19,1.03728679,2
"ENG_062_MZB_LO_2309","ENG_062_MZB_LO_2309-18.09.2017","18.09.2017",2017,9,18,1.090887218,1
"ENG_062_MZB_LO_2309","ENG_062_MZB_LO_2309-18.09.2018","18.09.2018",2018,9,18,1.064395243,1
"ENG_062_MZB_LO_2309","ENG_062_MZB_LO_2309-22.09.2020","22.09.2020",2020,9,22,1.159706521,2
"ENG_062_MZB_LO_2309","ENG_062_MZB_LO_2309-26.10.2021","26.10.2021",2021,10,26,1.106661229,1
"ENG_062_MZB_LO_2309","ENG_062_MZB_LO_2309-26.10.2022","26.10.2022",2022,10,26,1.070647249,1
"ENG_062_MZB_LO_2309","ENG_062_MZB_LO_2309-13.09.2023","13.09.2023",2023,9,13,0.987399119,1
"ENG_062_MZB_LO_2310","ENG_062_MZB_LO_2310-04.11.2002","04.11.2002",2002,11,4,0.850935241,3
"ENG_062_MZB_LO_2310","ENG_062_MZB_LO_2310-03.11.2003","03.11.2003",2003,11,3,0.786985065,3
"ENG_062_MZB_LO_2310","ENG_062_MZB_LO_2310-24.11.2004","24.11.2004",2004,11,24,0.738651512,3
"ENG_062_MZB_LO_2310","ENG_062_MZB_LO_2310-08.09.2005","08.09.2005",2005,9,8,0.695632411,4
"ENG_062_MZB_LO_2310","ENG_062_MZB_LO_2310-18.09.2006","18.09.2006",2006,9,18,0.625208761,4
"ENG_062_MZB_LO_2310","ENG_062_MZB_LO_2310-22.10.2007","22.10.2007",2007,10,22,0.832472947,3
"ENG_062_MZB_LO_2310","ENG_062_MZB_LO_2310-05.10.2009","05.10.2009",2009,10,5,0.729507801,3
"ENG_062_MZB_LO_2310","ENG_062_MZB_LO_2310-25.10.2011","25.10.2011",2011,10,25,0.640686247,4
"ENG_062_MZB_LO_2310","ENG_062_MZB_LO_2310-29.10.2012","29.10.2012",2012,10,29,0.789225977,3
"ENG_062_MZB_LO_2310","ENG_062_MZB_LO_2310-07.10.2013","07.10.2013",2013,10,7,0.720572427,3
"ENG_062_MZB_LO_2310","ENG_062_MZB_LO_2310-09.09.2014","09.09.2014",2014,9,9,0.694918683,4
"ENG_062_MZB_LO_2310","ENG_062_MZB_LO_2310-09.09.2015","09.09.2015",2015,9,9,0.700676791,4
"ENG_062_MZB_LO_2310","ENG_062_MZB_LO_2310-19.09.2016","19.09.2016",2016,9,19,0.86941459,2
"ENG_062_MZB_LO_2310","ENG_062_MZB_LO_2310-18.09.2017","18.09.2017",2017,9,18,0.943121236,2
"ENG_062_MZB_LO_2310","ENG_062_MZB_LO_2310-17.09.2018","17.09.2018",2018,9,17,0.958460429,2
"ENG_062_MZB_LO_2310","ENG_062_MZB_LO_2310-19.09.2019","19.09.2019",2019,9,19,0.942094272,2
"ENG_062_MZB_LO_2310","ENG_062_MZB_LO_2310-18.09.2020","18.09.2020",2020,9,18,0.942812723,2
"ENG_062_MZB_LO_2311","ENG_062_MZB_LO_2311-04.11.2002","04.11.2002",2002,11,4,0.774105574,3
"ENG_062_MZB_LO_2311","ENG_062_MZB_LO_2311-03.11.2003","03.11.2003",2003,11,3,0.800345489,3
"ENG_062_MZB_LO_2311","ENG_062_MZB_LO_2311-24.11.2004","24.11.2004",2004,11,24,0.806959465,3
"ENG_062_MZB_LO_2311","ENG_062_MZB_LO_2311-08.09.2005","08.09.2005",2005,9,8,0.841986936,3
"ENG_062_MZB_LO_2311","ENG_062_MZB_LO_2311-18.09.2006","18.09.2006",2006,9,18,0.788056409,3
"ENG_062_MZB_LO_2311","ENG_062_MZB_LO_2311-05.10.2009","05.10.2009",2009,10,5,0.80452704,3
"ENG_062_MZB_LO_2311","ENG_062_MZB_LO_2311-08.11.2011","08.11.2011",2011,11,8,0.775655902,3
"ENG_062_MZB_LO_2311","ENG_062_MZB_LO_2311-29.10.2012","29.10.2012",2012,10,29,0.827395381,3
"ENG_062_MZB_LO_2311","ENG_062_MZB_LO_2311-07.10.2013","07.10.2013",2013,10,7,0.809110961,3
"ENG_062_MZB_LO_2311","ENG_062_MZB_LO_2311-29.09.2014","29.09.2014",2014,9,29,0.830285398,3
"ENG_062_MZB_LO_2311","ENG_062_MZB_LO_2311-09.09.2015","09.09.2015",2015,9,9,0.769405109,3
"ENG_062_MZB_LO_2311","ENG_062_MZB_LO_2311-19.09.2016","19.09.2016",2016,9,19,0.876253988,2
"ENG_062_MZB_LO_2311","ENG_062_MZB_LO_2311-18.09.2017","18.09.2017",2017,9,18,0.932675006,2
"ENG_062_MZB_LO_2311","ENG_062_MZB_LO_2311-17.09.2018","17.09.2018",2018,9,17,0.903569771,2
"ENG_062_MZB_LO_2311","ENG_062_MZB_LO_2311-25.10.2019","25.10.2019",2019,10,25,0.953386069,3
"ENG_062_MZB_LO_2311","ENG_062_MZB_LO_2311-18.09.2020","18.09.2020",2020,9,18,0.808376937,3
"ENG_062_MZB_LO_2312","ENG_062_MZB_LO_2312-04.11.2002","04.11.2002",2002,11,4,0.802439244,3
"ENG_062_MZB_LO_2312","ENG_062_MZB_LO_2312-10.11.2003","10.11.2003",2003,11,10,0.716973419,4
"ENG_062_MZB_LO_2312","ENG_062_MZB_LO_2312-28.09.2004","28.09.2004",2004,9,28,0.785861616,3
"ENG_062_MZB_LO_2312","ENG_062_MZB_LO_2312-21.09.2005","21.09.2005",2005,9,21,0.784525457,3
"ENG_062_MZB_LO_2312","ENG_062_MZB_LO_2312-19.09.2006","19.09.2006",2006,9,19,0.815908214,3
"ENG_062_MZB_LO_2312","ENG_062_MZB_LO_2312-20.11.2009","20.11.2009",2009,11,20,0.802727301,3
"ENG_062_MZB_LO_2312","ENG_062_MZB_LO_2312-08.11.2011","08.11.2011",2011,11,8,0.792796712,3
"ENG_062_MZB_LO_2312","ENG_062_MZB_LO_2312-29.10.2012","29.10.2012",2012,10,29,0.816003467,3
"ENG_062_MZB_LO_2312","ENG_062_MZB_LO_2312-24.09.2013","24.09.2013",2013,9,24,0.828159254,3
"ENG_062_MZB_LO_2312","ENG_062_MZB_LO_2312-09.09.2015","09.09.2015",2015,9,9,0.810517333,3
"ENG_062_MZB_LO_2312","ENG_062_MZB_LO_2312-29.11.2016","29.11.2016",2016,11,29,0.796208966,3
"ENG_062_MZB_LO_2312","ENG_062_MZB_LO_2312-03.10.2017","03.10.2017",2017,10,3,0.788301286,3
"ENG_062_MZB_LO_2312","ENG_062_MZB_LO_2312-19.09.2019","19.09.2019",2019,9,19,0.845695404,3
"ENG_062_MZB_LO_2312","ENG_062_MZB_LO_2312-18.09.2020","18.09.2020",2020,9,18,0.7597366,3
"ENG_062_MZB_LO_2313","ENG_062_MZB_LO_2313-17.10.2002","17.10.2002",2002,10,17,0.905974024,3
"ENG_062_MZB_LO_2313","ENG_062_MZB_LO_2313-27.11.2003","27.11.2003",2003,11,27,1.019568469,1
"ENG_062_MZB_LO_2313","ENG_062_MZB_LO_2313-22.11.2004","22.11.2004",2004,11,22,0.948475551,2
"ENG_062_MZB_LO_2313","ENG_062_MZB_LO_2313-30.11.2005","30.11.2005",2005,11,30,1.004183111,1
"ENG_062_MZB_LO_2313","ENG_062_MZB_LO_2313-15.11.2006","15.11.2006",2006,11,15,1.001806181,1
"ENG_062_MZB_LO_2313","ENG_062_MZB_LO_2313-12.11.2007","12.11.2007",2007,11,12,0.988083888,1
"ENG_062_MZB_LO_2313","ENG_062_MZB_LO_2313-04.11.2009","04.11.2009",2009,11,4,0.959127948,1
"ENG_062_MZB_LO_2313","ENG_062_MZB_LO_2313-10.11.2010","10.11.2010",2010,11,10,1.045471613,1
"ENG_062_MZB_LO_2313","ENG_062_MZB_LO_2313-25.10.2011","25.10.2011",2011,10,25,1.030395728,1
"ENG_062_MZB_LO_2313","ENG_062_MZB_LO_2313-16.10.2012","16.10.2012",2012,10,16,0.983912865,1
"ENG_062_MZB_LO_2313","ENG_062_MZB_LO_2313-26.09.2013","26.09.2013",2013,9,26,1.063475025,1
"ENG_062_MZB_LO_2313","ENG_062_MZB_LO_2313-15.09.2014","15.09.2014",2014,9,15,0.96223414,2
"ENG_062_MZB_LO_2313","ENG_062_MZB_LO_2313-07.09.2015","07.09.2015",2015,9,7,0.973352917,1
"ENG_062_MZB_LO_2313","ENG_062_MZB_LO_2313-05.09.2016","05.09.2016",2016,9,5,1.041914375,1
"ENG_062_MZB_LO_2313","ENG_062_MZB_LO_2313-20.10.2017","20.10.2017",2017,10,20,1.00236397,2
"ENG_062_MZB_LO_2313","ENG_062_MZB_LO_2313-18.09.2018","18.09.2018",2018,9,18,0.915347536,2
"ENG_062_MZB_LO_2313","ENG_062_MZB_LO_2313-16.09.2019","16.09.2019",2019,9,16,0.97100411,1
"ENG_062_MZB_LO_2313","ENG_062_MZB_LO_2313-22.10.2020","22.10.2020",2020,10,22,0.997717777,1
"ENG_062_MZB_LO_2314","ENG_062_MZB_LO_2314-27.11.2002","27.11.2002",2002,11,27,0.892862534,3
"ENG_062_MZB_LO_2314","ENG_062_MZB_LO_2314-17.11.2003","17.11.2003",2003,11,17,0.792364534,3
"ENG_062_MZB_LO_2314","ENG_062_MZB_LO_2314-22.11.2004","22.11.2004",2004,11,22,0.859263604,3
"ENG_062_MZB_LO_2314","ENG_062_MZB_LO_2314-30.11.2005","30.11.2005",2005,11,30,0.860203193,3
"ENG_062_MZB_LO_2314","ENG_062_MZB_LO_2314-31.10.2006","31.10.2006",2006,10,31,0.775760844,3
"ENG_062_MZB_LO_2314","ENG_062_MZB_LO_2314-12.11.2007","12.11.2007",2007,11,12,0.910744094,2
"ENG_062_MZB_LO_2314","ENG_062_MZB_LO_2314-13.10.2008","13.10.2008",2008,10,13,0.927882459,2
"ENG_062_MZB_LO_2314","ENG_062_MZB_LO_2314-14.09.2009","14.09.2009",2009,9,14,0.895216348,2
"ENG_062_MZB_LO_2314","ENG_062_MZB_LO_2314-10.11.2010","10.11.2010",2010,11,10,0.86798033,2
"ENG_062_MZB_LO_2314","ENG_062_MZB_LO_2314-25.10.2011","25.10.2011",2011,10,25,0.783296731,3
"ENG_062_MZB_LO_2314","ENG_062_MZB_LO_2314-17.10.2012","17.10.2012",2012,10,17,0.821366116,3
"ENG_062_MZB_LO_2314","ENG_062_MZB_LO_2314-10.09.2013","10.09.2013",2013,9,10,0.779406335,3
"ENG_062_MZB_LO_2314","ENG_062_MZB_LO_2314-15.09.2014","15.09.2014",2014,9,15,0.838116481,3
"ENG_062_MZB_LO_2314","ENG_062_MZB_LO_2314-02.09.2015","02.09.2015",2015,9,2,0.865599787,3
"ENG_062_MZB_LO_2314","ENG_062_MZB_LO_2314-02.09.2016","02.09.2016",2016,9,2,0.865982214,2
"ENG_062_MZB_LO_2314","ENG_062_MZB_LO_2314-19.09.2017","19.09.2017",2017,9,19,0.9083734,2
"ENG_062_MZB_LO_2314","ENG_062_MZB_LO_2314-13.09.2018","13.09.2018",2018,9,13,0.886446705,2
"ENG_062_MZB_LO_2314","ENG_062_MZB_LO_2314-22.10.2020","22.10.2020",2020,10,22,0.871540863,2
"ENG_062_MZB_LO_2314","ENG_062_MZB_LO_2314-20.10.2021","20.10.2021",2021,10,20,0.876245235,2
"ENG_062_MZB_LO_2314","ENG_062_MZB_LO_2314-27.09.2022","27.09.2022",2022,9,27,0.752154484,3
"ENG_062_MZB_LO_2314","ENG_062_MZB_LO_2314-13.09.2023","13.09.2023",2023,9,13,0.879364668,2
"ENG_062_MZB_LO_2315","ENG_062_MZB_LO_2315-21.11.2006","21.11.2006",2006,11,21,0.720685303,3
"ENG_062_MZB_LO_2315","ENG_062_MZB_LO_2315-03.10.2007","03.10.2007",2007,10,3,0.731642782,3
"ENG_062_MZB_LO_2315","ENG_062_MZB_LO_2315-04.11.2008","04.11.2008",2008,11,4,0.624753136,4
"ENG_062_MZB_LO_2315","ENG_062_MZB_LO_2315-04.11.2009","04.11.2009",2009,11,4,0.713233423,4
"ENG_062_MZB_LO_2315","ENG_062_MZB_LO_2315-11.10.2010","11.10.2010",2010,10,11,0.663154621,4
"ENG_062_MZB_LO_2315","ENG_062_MZB_LO_2315-22.11.2011","22.11.2011",2011,11,22,0.680341213,4
"ENG_062_MZB_LO_2315","ENG_062_MZB_LO_2315-24.10.2012","24.10.2012",2012,10,24,0.720772444,3
"ENG_062_MZB_LO_2315","ENG_062_MZB_LO_2315-30.09.2013","30.09.2013",2013,9,30,0.654932585,4
"ENG_062_MZB_LO_2315","ENG_062_MZB_LO_2315-23.10.2014","23.10.2014",2014,10,23,0.693787952,4
"ENG_062_MZB_LO_2315","ENG_062_MZB_LO_2315-16.09.2015","16.09.2015",2015,9,16,0.662088978,4
"ENG_062_MZB_LO_2315","ENG_062_MZB_LO_2315-30.09.2016","30.09.2016",2016,9,30,0.690736932,4
"ENG_062_MZB_LO_2315","ENG_062_MZB_LO_2315-24.10.2017","24.10.2017",2017,10,24,0.691586561,4
"ENG_062_MZB_LO_2316","ENG_062_MZB_LO_2316-18.11.2002","18.11.2002",2002,11,18,1.051284492,1
"ENG_062_MZB_LO_2316","ENG_062_MZB_LO_2316-26.11.2003","26.11.2003",2003,11,26,0.903686929,2
"ENG_062_MZB_LO_2316","ENG_062_MZB_LO_2316-20.09.2004","20.09.2004",2004,9,20,0.975012675,2
"ENG_062_MZB_LO_2316","ENG_062_MZB_LO_2316-28.10.2005","28.10.2005",2005,10,28,0.865921321,3
"ENG_062_MZB_LO_2316","ENG_062_MZB_LO_2316-14.11.2006","14.11.2006",2006,11,14,0.974644197,1
"ENG_062_MZB_LO_2316","ENG_062_MZB_LO_2316-26.11.2007","26.11.2007",2007,11,26,1.003685589,1
"ENG_062_MZB_LO_2316","ENG_062_MZB_LO_2316-13.10.2008","13.10.2008",2008,10,13,0.991634166,1
"ENG_062_MZB_LO_2316","ENG_062_MZB_LO_2316-19.10.2009","19.10.2009",2009,10,19,0.985811403,2
"ENG_062_MZB_LO_2316","ENG_062_MZB_LO_2316-06.09.2010","06.09.2010",2010,9,6,0.932986867,2
"ENG_062_MZB_LO_2316","ENG_062_MZB_LO_2316-10.10.2011","10.10.2011",2011,10,10,0.901845378,2
"ENG_062_MZB_LO_2316","ENG_062_MZB_LO_2316-01.10.2013","01.10.2013",2013,10,1,1.00315184,1
"ENG_062_MZB_LO_2316","ENG_062_MZB_LO_2316-24.10.2014","24.10.2014",2014,10,24,1.018441941,1
"ENG_062_MZB_LO_2316","ENG_062_MZB_LO_2316-22.10.2015","22.10.2015",2015,10,22,0.936546288,2
"ENG_062_MZB_LO_2316","ENG_062_MZB_LO_2316-04.10.2016","04.10.2016",2016,10,4,0.998472023,2
"ENG_062_MZB_LO_2316","ENG_062_MZB_LO_2316-17.10.2017","17.10.2017",2017,10,17,1.013259735,1
"ENG_062_MZB_LO_2316","ENG_062_MZB_LO_2316-30.10.2019","30.10.2019",2019,10,30,0.957512064,2
"ENG_062_MZB_LO_2316","ENG_062_MZB_LO_2316-23.09.2020","23.09.2020",2020,9,23,1.008549172,1
"ENG_062_MZB_LO_2317","ENG_062_MZB_LO_2317-18.11.2002","18.11.2002",2002,11,18,0.979781214,2
"ENG_062_MZB_LO_2317","ENG_062_MZB_LO_2317-26.11.2003","26.11.2003",2003,11,26,1.014147683,1
"ENG_062_MZB_LO_2317","ENG_062_MZB_LO_2317-20.09.2004","20.09.2004",2004,9,20,0.936331194,2
"ENG_062_MZB_LO_2317","ENG_062_MZB_LO_2317-28.10.2005","28.10.2005",2005,10,28,0.914567058,2
"ENG_062_MZB_LO_2317","ENG_062_MZB_LO_2317-14.11.2006","14.11.2006",2006,11,14,0.911413577,2
"ENG_062_MZB_LO_2317","ENG_062_MZB_LO_2317-26.11.2007","26.11.2007",2007,11,26,0.973707412,1
"ENG_062_MZB_LO_2317","ENG_062_MZB_LO_2317-13.10.2008","13.10.2008",2008,10,13,1.001034276,1
"ENG_062_MZB_LO_2317","ENG_062_MZB_LO_2317-19.10.2009","19.10.2009",2009,10,19,0.924455424,2
"ENG_062_MZB_LO_2317","ENG_062_MZB_LO_2317-06.09.2010","06.09.2010",2010,9,6,0.8334955,3
"ENG_062_MZB_LO_2317","ENG_062_MZB_LO_2317-10.10.2011","10.10.2011",2011,10,10,0.830943436,3
"ENG_062_MZB_LO_2317","ENG_062_MZB_LO_2317-31.10.2012","31.10.2012",2012,10,31,1.005655435,1
"ENG_062_MZB_LO_2317","ENG_062_MZB_LO_2317-13.09.2013","13.09.2013",2013,9,13,0.952826475,2
"ENG_062_MZB_LO_2317","ENG_062_MZB_LO_2317-18.09.2014","18.09.2014",2014,9,18,0.932462513,2
"ENG_062_MZB_LO_2317","ENG_062_MZB_LO_2317-02.09.2015","02.09.2015",2015,9,2,0.941456301,2
"ENG_062_MZB_LO_2317","ENG_062_MZB_LO_2317-02.09.2016","02.09.2016",2016,9,2,0.905803743,2
"ENG_062_MZB_LO_2317","ENG_062_MZB_LO_2317-17.10.2017","17.10.2017",2017,10,17,0.837038655,3
"ENG_062_MZB_LO_2317","ENG_062_MZB_LO_2317-18.09.2019","18.09.2019",2019,9,18,0.958397309,1
"ENG_062_MZB_LO_2317","ENG_062_MZB_LO_2317-28.09.2020","28.09.2020",2020,9,28,0.945119271,2
"ENG_062_MZB_LO_2318","ENG_062_MZB_LO_2318-16.09.2002","16.09.2002",2002,9,16,0.980568399,1
"ENG_062_MZB_LO_2318","ENG_062_MZB_LO_2318-10.11.2003","10.11.2003",2003,11,10,1.009575718,1
"ENG_062_MZB_LO_2318","ENG_062_MZB_LO_2318-29.11.2004","29.11.2004",2004,11,29,1.002600674,1
"ENG_062_MZB_LO_2318","ENG_062_MZB_LO_2318-29.11.2005","29.11.2005",2005,11,29,0.945747292,2
"ENG_062_MZB_LO_2318","ENG_062_MZB_LO_2318-31.10.2006","31.10.2006",2006,10,31,1.004806368,1
"ENG_062_MZB_LO_2318","ENG_062_MZB_LO_2318-14.11.2007","14.11.2007",2007,11,14,1.086608799,1
"ENG_062_MZB_LO_2318","ENG_062_MZB_LO_2318-17.11.2009","17.11.2009",2009,11,17,0.967840136,2
"ENG_062_MZB_LO_2318","ENG_062_MZB_LO_2318-13.09.2013","13.09.2013",2013,9,13,0.971547425,2
"ENG_062_MZB_LO_2318","ENG_062_MZB_LO_2318-02.09.2015","02.09.2015",2015,9,2,0.885951122,2
"ENG_062_MZB_LO_2319","ENG_062_MZB_LO_2319-28.10.2002","28.10.2002",2002,10,28,0.741581908,3
"ENG_062_MZB_LO_2319","ENG_062_MZB_LO_2319-22.09.2003","22.09.2003",2003,9,22,0.781677809,3
"ENG_062_MZB_LO_2319","ENG_062_MZB_LO_2319-23.09.2004","23.09.2004",2004,9,23,0.725692421,3
"ENG_062_MZB_LO_2319","ENG_062_MZB_LO_2319-17.10.2005","17.10.2005",2005,10,17,0.844442915,3
"ENG_062_MZB_LO_2319","ENG_062_MZB_LO_2319-30.11.2006","30.11.2006",2006,11,30,0.824017425,4
"ENG_062_MZB_LO_2319","ENG_062_MZB_LO_2319-26.09.2007","26.09.2007",2007,9,26,0.778707263,4
"ENG_062_MZB_LO_2319","ENG_062_MZB_LO_2319-13.10.2009","13.10.2009",2009,10,13,0.770812713,5
"ENG_062_MZB_LO_2319","ENG_062_MZB_LO_2319-29.10.2013","29.10.2013",2013,10,29,0.815010951,4
"ENG_062_MZB_LO_2319","ENG_062_MZB_LO_2319-17.11.2016","17.11.2016",2016,11,17,0.84507795,5
"ENG_062_MZB_LO_2320","ENG_062_MZB_LO_2320-08.10.2002","08.10.2002",2002,10,8,0.892279719,3
"ENG_062_MZB_LO_2320","ENG_062_MZB_LO_2320-21.11.2003","21.11.2003",2003,11,21,0.835457655,3
"ENG_062_MZB_LO_2320","ENG_062_MZB_LO_2320-02.11.2004","02.11.2004",2004,11,2,0.861810279,3
"ENG_062_MZB_LO_2320","ENG_062_MZB_LO_2320-22.11.2005","22.11.2005",2005,11,22,0.861123867,3
"ENG_062_MZB_LO_2320","ENG_062_MZB_LO_2320-15.11.2006","15.11.2006",2006,11,15,0.911087669,2
"ENG_062_MZB_LO_2320","ENG_062_MZB_LO_2320-01.10.2007","01.10.2007",2007,10,1,0.980090395,3
"ENG_062_MZB_LO_2320","ENG_062_MZB_LO_2320-28.10.2008","28.10.2008",2008,10,28,0.999759574,2
"ENG_062_MZB_LO_2320","ENG_062_MZB_LO_2320-18.11.2009","18.11.2009",2009,11,18,0.92123945,4
"ENG_062_MZB_LO_2320","ENG_062_MZB_LO_2320-01.11.2010","01.11.2010",2010,11,1,0.98408193,2
"ENG_062_MZB_LO_2320","ENG_062_MZB_LO_2320-03.11.2011","03.11.2011",2011,11,3,1.088369807,3
"ENG_062_MZB_LO_2320","ENG_062_MZB_LO_2320-17.09.2013","17.09.2013",2013,9,17,1.143197372,2
"ENG_062_MZB_LO_2320","ENG_062_MZB_LO_2320-09.09.2014","09.09.2014",2014,9,9,1.026476049,3
"ENG_062_MZB_LO_2320","ENG_062_MZB_LO_2320-27.10.2015","27.10.2015",2015,10,27,1.106946582,2
"ENG_062_MZB_LO_2320","ENG_062_MZB_LO_2320-30.09.2016","30.09.2016",2016,9,30,1.133865606,3
"ENG_062_MZB_LO_2320","ENG_062_MZB_LO_2320-06.10.2017","06.10.2017",2017,10,6,1.081400139,1
"ENG_062_MZB_LO_2320","ENG_062_MZB_LO_2320-04.09.2019","04.09.2019",2019,9,4,0.943195851,3
"ENG_062_MZB_LO_2320","ENG_062_MZB_LO_2320-28.09.2020","28.09.2020",2020,9,28,1.032449475,2
"ENG_062_MZB_LO_2320","ENG_062_MZB_LO_2320-29.10.2021","29.10.2021",2021,10,29,1.074358269,2
"ENG_062_MZB_LO_2320","ENG_062_MZB_LO_2320-26.10.2022","26.10.2022",2022,10,26,1.050023415,3
"ENG_062_MZB_LO_2320","ENG_062_MZB_LO_2320-25.09.2023","25.09.2023",2023,9,25,1.053032282,5
"ENG_062_MZB_LO_2321","ENG_062_MZB_LO_2321-04.09.2002","04.09.2002",2002,9,4,0.872620235,2
"ENG_062_MZB_LO_2321","ENG_062_MZB_LO_2321-29.09.2003","29.09.2003",2003,9,29,0.988985342,2
"ENG_062_MZB_LO_2321","ENG_062_MZB_LO_2321-29.11.2005","29.11.2005",2005,11,29,1.046984108,1
"ENG_062_MZB_LO_2321","ENG_062_MZB_LO_2321-21.11.2006","21.11.2006",2006,11,21,0.914750414,2
"ENG_062_MZB_LO_2321","ENG_062_MZB_LO_2321-24.09.2007","24.09.2007",2007,9,24,0.774664506,3
"ENG_062_MZB_LO_2321","ENG_062_MZB_LO_2321-24.11.2008","24.11.2008",2008,11,24,0.893611664,2
"ENG_062_MZB_LO_2321","ENG_062_MZB_LO_2321-11.11.2009","11.11.2009",2009,11,11,0.978235348,1
"ENG_062_MZB_LO_2321","ENG_062_MZB_LO_2321-10.11.2010","10.11.2010",2010,11,10,0.895923747,2
"ENG_062_MZB_LO_2321","ENG_062_MZB_LO_2321-03.11.2011","03.11.2011",2011,11,3,0.817475407,3
"ENG_062_MZB_LO_2321","ENG_062_MZB_LO_2321-06.11.2014","06.11.2014",2014,11,6,0.961876849,2
"ENG_062_MZB_LO_2321","ENG_062_MZB_LO_2321-19.10.2015","19.10.2015",2015,10,19,0.90207182,2
"ENG_062_MZB_LO_2321","ENG_062_MZB_LO_2321-08.11.2016","08.11.2016",2016,11,8,0.913113006,2
"ENG_062_MZB_LO_2321","ENG_062_MZB_LO_2321-21.09.2017","21.09.2017",2017,9,21,0.889201402,3
"ENG_062_MZB_LO_2321","ENG_062_MZB_LO_2321-19.09.2018","19.09.2018",2018,9,19,0.807660309,3
"ENG_062_MZB_LO_2321","ENG_062_MZB_LO_2321-23.10.2019","23.10.2019",2019,10,23,0.845085914,3
"ENG_062_MZB_LO_2321","ENG_062_MZB_LO_2321-24.11.2020","24.11.2020",2020,11,24,0.959344065,2
"ENG_062_MZB_LO_2322","ENG_062_MZB_LO_2322-15.10.2013","15.10.2013",2013,10,15,0.693739559,4
"ENG_062_MZB_LO_2322","ENG_062_MZB_LO_2322-26.10.2015","26.10.2015",2015,10,26,0.755134574,3
"ENG_062_MZB_LO_2322","ENG_062_MZB_LO_2322-31.10.2016","31.10.2016",2016,10,31,0.712301936,4
"ENG_062_MZB_LO_2322","ENG_062_MZB_LO_2322-25.10.2017","25.10.2017",2017,10,25,0.680114516,4
"ENG_062_MZB_LO_2322","ENG_062_MZB_LO_2322-05.09.2018","05.09.2018",2018,9,5,0.744458737,3
"ENG_062_MZB_LO_2322","ENG_062_MZB_LO_2322-16.09.2019","16.09.2019",2019,9,16,0.728011125,3
"ENG_062_MZB_LO_2322","ENG_062_MZB_LO_2322-24.11.2020","24.11.2020",2020,11,24,0.79880781,3
"ENG_062_MZB_LO_2322","ENG_062_MZB_LO_2322-21.09.2022","21.09.2022",2022,9,21,0.765830589,3
"ENG_062_MZB_LO_2322","ENG_062_MZB_LO_2322-13.09.2024","13.09.2024",2024,9,13,0.785919634,4
"ENG_062_MZB_LO_2323","ENG_062_MZB_LO_2323-30.11.2003","30.11.2003",2003,11,30,1.054246415,1
"ENG_062_MZB_LO_2323","ENG_062_MZB_LO_2323-09.11.2004","09.11.2004",2004,11,9,1.057460177,1
"ENG_062_MZB_LO_2323","ENG_062_MZB_LO_2323-11.11.2005","11.11.2005",2005,11,11,1.009276449,1
"ENG_062_MZB_LO_2323","ENG_062_MZB_LO_2323-11.09.2006","11.09.2006",2006,9,11,1.048925467,1
"ENG_062_MZB_LO_2323","ENG_062_MZB_LO_2323-09.11.2007","09.11.2007",2007,11,9,0.969208352,1
"ENG_062_MZB_LO_2323","ENG_062_MZB_LO_2323-27.11.2008","27.11.2008",2008,11,27,1.003219764,1
"ENG_062_MZB_LO_2323","ENG_062_MZB_LO_2323-23.11.2009","23.11.2009",2009,11,23,1.049754718,1
"ENG_062_MZB_LO_2323","ENG_062_MZB_LO_2323-09.11.2010","09.11.2010",2010,11,9,1.002205321,1
"ENG_062_MZB_LO_2323","ENG_062_MZB_LO_2323-18.10.2011","18.10.2011",2011,10,18,0.944641989,2
"ENG_062_MZB_LO_2323","ENG_062_MZB_LO_2323-31.10.2012","31.10.2012",2012,10,31,1.096362912,1
"ENG_062_MZB_LO_2323","ENG_062_MZB_LO_2323-28.10.2013","28.10.2013",2013,10,28,0.982508754,1
"ENG_062_MZB_LO_2323","ENG_062_MZB_LO_2323-06.11.2014","06.11.2014",2014,11,6,1.096912867,1
"ENG_062_MZB_LO_2323","ENG_062_MZB_LO_2323-24.09.2015","24.09.2015",2015,9,24,1.078092532,1
"ENG_062_MZB_LO_2323","ENG_062_MZB_LO_2323-10.11.2016","10.11.2016",2016,11,10,1.100415138,1
"ENG_062_MZB_LO_2323","ENG_062_MZB_LO_2323-25.10.2017","25.10.2017",2017,10,25,1.077988595,1
"ENG_062_MZB_LO_2323","ENG_062_MZB_LO_2323-19.09.2018","19.09.2018",2018,9,19,1.096080541,1
"ENG_062_MZB_LO_2323","ENG_062_MZB_LO_2323-22.10.2019","22.10.2019",2019,10,22,0.917835812,2
"ENG_062_MZB_LO_2323","ENG_062_MZB_LO_2323-23.09.2020","23.09.2020",2020,9,23,1.108444432,1
"ENG_062_MZB_LO_2323","ENG_062_MZB_LO_2323-11.10.2021","11.10.2021",2021,10,11,0.932733518,2
"ENG_062_MZB_LO_2323","ENG_062_MZB_LO_2323-21.09.2022","21.09.2022",2022,9,21,1.094012266,1
"ENG_062_MZB_LO_2323","ENG_062_MZB_LO_2323-21.09.2023","21.09.2023",2023,9,21,1.120461062,3
"ENG_062_MZB_LO_2324","ENG_062_MZB_LO_2324-28.10.2002","28.10.2002",2002,10,28,0.856779336,3
"ENG_062_MZB_LO_2324","ENG_062_MZB_LO_2324-07.10.2003","07.10.2003",2003,10,7,0.855169523,3
"ENG_062_MZB_LO_2324","ENG_062_MZB_LO_2324-26.10.2004","26.10.2004",2004,10,26,0.851062135,3
"ENG_062_MZB_LO_2324","ENG_062_MZB_LO_2324-07.11.2005","07.11.2005",2005,11,7,0.927362277,2
"ENG_062_MZB_LO_2324","ENG_062_MZB_LO_2324-09.10.2006","09.10.2006",2006,10,9,0.877626682,2
"ENG_062_MZB_LO_2324","ENG_062_MZB_LO_2324-28.11.2007","28.11.2007",2007,11,28,0.874443484,3
"ENG_062_MZB_LO_2324","ENG_062_MZB_LO_2324-24.11.2008","24.11.2008",2008,11,24,0.893337737,3
"ENG_062_MZB_LO_2324","ENG_062_MZB_LO_2324-29.09.2009","29.09.2009",2009,9,29,0.850628274,5
"ENG_062_MZB_LO_2324","ENG_062_MZB_LO_2324-18.11.2010","18.11.2010",2010,11,18,0.762566446,3
"ENG_062_MZB_LO_2324","ENG_062_MZB_LO_2324-24.11.2011","24.11.2011",2011,11,24,0.796215949,3
"ENG_062_MZB_LO_2324","ENG_062_MZB_LO_2324-16.10.2012","16.10.2012",2012,10,16,0.792223336,5
"ENG_062_MZB_LO_2324","ENG_062_MZB_LO_2324-23.10.2013","23.10.2013",2013,10,23,0.897849811,3
"ENG_062_MZB_LO_2324","ENG_062_MZB_LO_2324-24.10.2014","24.10.2014",2014,10,24,0.793863582,3
"ENG_062_MZB_LO_2324","ENG_062_MZB_LO_2324-20.10.2015","20.10.2015",2015,10,20,0.879692747,3
"ENG_062_MZB_LO_2324","ENG_062_MZB_LO_2324-08.11.2016","08.11.2016",2016,11,8,0.841085469,3
"ENG_062_MZB_LO_2324","ENG_062_MZB_LO_2324-25.09.2017","25.09.2017",2017,9,25,0.738102045,4
"ENG_062_MZB_LO_2324","ENG_062_MZB_LO_2324-11.09.2018","11.09.2018",2018,9,11,0.773170072,3
"ENG_062_MZB_LO_2324","ENG_062_MZB_LO_2324-11.09.2019","11.09.2019",2019,9,11,0.809853433,3
"ENG_062_MZB_LO_2324","ENG_062_MZB_LO_2324-24.11.2020","24.11.2020",2020,11,24,0.87210305,3
"ENG_062_MZB_LO_2324","ENG_062_MZB_LO_2324-27.09.2021","27.09.2021",2021,9,27,0.771537279,3
"ENG_062_MZB_LO_2324","ENG_062_MZB_LO_2324-14.11.2022","14.11.2022",2022,11,14,0.880974465,2
"ENG_062_MZB_LO_2325","ENG_062_MZB_LO_2325-29.11.2002","29.11.2002",2002,11,29,0.995130604,1
"ENG_062_MZB_LO_2325","ENG_062_MZB_LO_2325-10.11.2003","10.11.2003",2003,11,10,0.984401352,1
"ENG_062_MZB_LO_2325","ENG_062_MZB_LO_2325-09.11.2004","09.11.2004",2004,11,9,0.956067469,2
"ENG_062_MZB_LO_2325","ENG_062_MZB_LO_2325-04.11.2005","04.11.2005",2005,11,4,0.839361374,3
"ENG_062_MZB_LO_2325","ENG_062_MZB_LO_2325-10.11.2006","10.11.2006",2006,11,10,0.880679463,2
"ENG_062_MZB_LO_2325","ENG_062_MZB_LO_2325-09.11.2007","09.11.2007",2007,11,9,1.0042995,1
"ENG_062_MZB_LO_2325","ENG_062_MZB_LO_2325-27.11.2008","27.11.2008",2008,11,27,0.964913428,2
"ENG_062_MZB_LO_2325","ENG_062_MZB_LO_2325-14.09.2009","14.09.2009",2009,9,14,0.933708143,2
"ENG_062_MZB_LO_2325","ENG_062_MZB_LO_2325-10.10.2011","10.10.2011",2011,10,10,0.831868639,3
"ENG_062_MZB_LO_2325","ENG_062_MZB_LO_2325-23.10.2012","23.10.2012",2012,10,23,0.941216642,2
"ENG_062_MZB_LO_2325","ENG_062_MZB_LO_2325-06.11.2013","06.11.2013",2013,11,6,0.949735894,2
"ENG_062_MZB_LO_2325","ENG_062_MZB_LO_2325-06.11.2014","06.11.2014",2014,11,6,0.989237419,1
"ENG_062_MZB_LO_2325","ENG_062_MZB_LO_2325-29.09.2015","29.09.2015",2015,9,29,0.919918403,2
"ENG_062_MZB_LO_2325","ENG_062_MZB_LO_2325-07.09.2016","07.09.2016",2016,9,7,0.888256161,2
"ENG_062_MZB_LO_2325","ENG_062_MZB_LO_2325-18.10.2017","18.10.2017",2017,10,18,0.899624537,2
"ENG_062_MZB_LO_2325","ENG_062_MZB_LO_2325-16.09.2019","16.09.2019",2019,9,16,0.85418808,3
"ENG_062_MZB_LO_2325","ENG_062_MZB_LO_2325-30.09.2020","30.09.2020",2020,9,30,0.870121661,2
"ENG_062_MZB_LO_2326","ENG_062_MZB_LO_2326-28.10.2002","28.10.2002",2002,10,28,0.740067905,3
"ENG_062_MZB_LO_2326","ENG_062_MZB_LO_2326-22.09.2003","22.09.2003",2003,9,22,0.732645416,3
"ENG_062_MZB_LO_2326","ENG_062_MZB_LO_2326-26.10.2004","26.10.2004",2004,10,26,0.754097926,3
"ENG_062_MZB_LO_2326","ENG_062_MZB_LO_2326-31.10.2005","31.10.2005",2005,10,31,0.818449424,3
"ENG_062_MZB_LO_2326","ENG_062_MZB_LO_2326-09.10.2006","09.10.2006",2006,10,9,0.806245922,3
"ENG_062_MZB_LO_2326","ENG_062_MZB_LO_2326-28.11.2007","28.11.2007",2007,11,28,0.76015083,3
"ENG_062_MZB_LO_2326","ENG_062_MZB_LO_2326-24.11.2008","24.11.2008",2008,11,24,0.723634323,4
"ENG_062_MZB_LO_2326","ENG_062_MZB_LO_2326-29.09.2009","29.09.2009",2009,9,29,0.680534159,4
"ENG_062_MZB_LO_2326","ENG_062_MZB_LO_2326-18.11.2010","18.11.2010",2010,11,18,0.713606391,4
"ENG_062_MZB_LO_2326","ENG_062_MZB_LO_2326-18.10.2011","18.10.2011",2011,10,18,0.791855182,3
"ENG_062_MZB_LO_2326","ENG_062_MZB_LO_2326-16.10.2012","16.10.2012",2012,10,16,0.723454203,4
"ENG_062_MZB_LO_2326","ENG_062_MZB_LO_2326-16.09.2013","16.09.2013",2013,9,16,0.688192738,4
"ENG_062_MZB_LO_2326","ENG_062_MZB_LO_2326-02.10.2014","02.10.2014",2014,10,2,0.668154907,4
"ENG_062_MZB_LO_2326","ENG_062_MZB_LO_2326-19.10.2015","19.10.2015",2015,10,19,0.738928268,3
"ENG_062_MZB_LO_2326","ENG_062_MZB_LO_2326-29.09.2016","29.09.2016",2016,9,29,0.70733764,4
"ENG_062_MZB_LO_2326","ENG_062_MZB_LO_2326-10.10.2017","10.10.2017",2017,10,10,0.755181859,3
"ENG_062_MZB_LO_2326","ENG_062_MZB_LO_2326-14.11.2022","14.11.2022",2022,11,14,0.695193945,5
"ENG_062_MZB_LO_2327","ENG_062_MZB_LO_2327-05.09.2002","05.09.2002",2002,9,5,1.131181216,1
"ENG_062_MZB_LO_2327","ENG_062_MZB_LO_2327-22.10.2003","22.10.2003",2003,10,22,1.23534754,1
"ENG_062_MZB_LO_2327","ENG_062_MZB_LO_2327-02.11.2004","02.11.2004",2004,11,2,1.186267166,1
"ENG_062_MZB_LO_2327","ENG_062_MZB_LO_2327-22.11.2005","22.11.2005",2005,11,22,1.218247821,1
"ENG_062_MZB_LO_2327","ENG_062_MZB_LO_2327-15.11.2006","15.11.2006",2006,11,15,1.239606651,1
"ENG_062_MZB_LO_2327","ENG_062_MZB_LO_2327-01.10.2007","01.10.2007",2007,10,1,1.157283335,1
"ENG_062_MZB_LO_2327","ENG_062_MZB_LO_2327-28.10.2008","28.10.2008",2008,10,28,1.28837693,1
"ENG_062_MZB_LO_2327","ENG_062_MZB_LO_2327-28.09.2009","28.09.2009",2009,9,28,1.263968763,1
"ENG_062_MZB_LO_2327","ENG_062_MZB_LO_2327-01.11.2010","01.11.2010",2010,11,1,1.053252413,1
"ENG_062_MZB_LO_2327","ENG_062_MZB_LO_2327-03.11.2011","03.11.2011",2011,11,3,0.989654625,1
"ENG_062_MZB_LO_2327","ENG_062_MZB_LO_2327-22.10.2012","22.10.2012",2012,10,22,1.033072057,1
"ENG_062_MZB_LO_2327","ENG_062_MZB_LO_2327-26.09.2013","26.09.2013",2013,9,26,1.014686194,1
"ENG_062_MZB_LO_2327","ENG_062_MZB_LO_2327-02.09.2014","02.09.2014",2014,9,2,0.912029687,2
"ENG_062_MZB_LO_2327","ENG_062_MZB_LO_2327-29.09.2015","29.09.2015",2015,9,29,1.122141692,1
"ENG_062_MZB_LO_2327","ENG_062_MZB_LO_2327-22.09.2016","22.09.2016",2016,9,22,1.065609999,1
"ENG_062_MZB_LO_2327","ENG_062_MZB_LO_2327-04.10.2017","04.10.2017",2017,10,4,1.061553803,1
"ENG_062_MZB_LO_2327","ENG_062_MZB_LO_2327-20.09.2018","20.09.2018",2018,9,20,1.120784452,1
"ENG_062_MZB_LO_2327","ENG_062_MZB_LO_2327-04.09.2019","04.09.2019",2019,9,4,1.104437088,1
"ENG_062_MZB_LO_2327","ENG_062_MZB_LO_2327-28.09.2020","28.09.2020",2020,9,28,1.031308355,2
"ENG_062_MZB_LO_2327","ENG_062_MZB_LO_2327-29.10.2021","29.10.2021",2021,10,29,1.193100247,1
"ENG_062_MZB_LO_2327","ENG_062_MZB_LO_2327-02.09.2022","02.09.2022",2022,9,2,1.157020852,1
"ENG_062_MZB_LO_2327","ENG_062_MZB_LO_2327-25.09.2023","25.09.2023",2023,9,25,1.016625727,2
"ENG_062_MZB_LO_2327","ENG_062_MZB_LO_2327-23.10.2024","23.10.2024",2024,10,23,1.189708359,1
"ENG_062_MZB_LO_2328","ENG_062_MZB_LO_2328-17.09.2013","17.09.2013",2013,9,17,0.858334162,3
"ENG_062_MZB_LO_2328","ENG_062_MZB_LO_2328-18.10.2017","18.10.2017",2017,10,18,0.898971432,2
"ENG_062_MZB_LO_2328","ENG_062_MZB_LO_2328-06.09.2018","06.09.2018",2018,9,6,0.903724089,2
"ENG_062_MZB_LO_2328","ENG_062_MZB_LO_2328-02.09.2019","02.09.2019",2019,9,2,0.924315069,2
"ENG_062_MZB_LO_2328","ENG_062_MZB_LO_2328-02.11.2020","02.11.2020",2020,11,2,0.880563813,2
"ENG_062_MZB_LO_2328","ENG_062_MZB_LO_2328-25.10.2022","25.10.2022",2022,10,25,0.88366883,2
"ENG_062_MZB_LO_2328","ENG_062_MZB_LO_2328-23.09.2024","23.09.2024",2024,9,23,0.937492782,2
"ENG_062_MZB_LO_2329","ENG_062_MZB_LO_2329-18.09.2002","18.09.2002",2002,9,18,0.85461104,3
"ENG_062_MZB_LO_2329","ENG_062_MZB_LO_2329-30.09.2003","30.09.2003",2003,9,30,0.80655847,3
"ENG_062_MZB_LO_2329","ENG_062_MZB_LO_2329-08.11.2004","08.11.2004",2004,11,8,0.873171441,2
"ENG_062_MZB_LO_2329","ENG_062_MZB_LO_2329-24.10.2005","24.10.2005",2005,10,24,0.781731092,3
"ENG_062_MZB_LO_2329","ENG_062_MZB_LO_2329-27.11.2006","27.11.2006",2006,11,27,0.872710349,2
"ENG_062_MZB_LO_2329","ENG_062_MZB_LO_2329-11.09.2007","11.09.2007",2007,9,11,0.847759216,3
"ENG_062_MZB_LO_2329","ENG_062_MZB_LO_2329-17.11.2008","17.11.2008",2008,11,17,0.825864251,3
"ENG_062_MZB_LO_2329","ENG_062_MZB_LO_2329-28.09.2009","28.09.2009",2009,9,28,0.856370454,3
"ENG_062_MZB_LO_2329","ENG_062_MZB_LO_2329-21.10.2010","21.10.2010",2010,10,21,0.83276794,3
"ENG_062_MZB_LO_2329","ENG_062_MZB_LO_2329-04.10.2011","04.10.2011",2011,10,4,0.850221257,3
"ENG_062_MZB_LO_2329","ENG_062_MZB_LO_2329-24.10.2012","24.10.2012",2012,10,24,0.768651107,3
"ENG_062_MZB_LO_2329","ENG_062_MZB_LO_2329-12.09.2013","12.09.2013",2013,9,12,0.792523079,3
"ENG_062_MZB_LO_2329","ENG_062_MZB_LO_2329-08.09.2014","08.09.2014",2014,9,8,0.800711038,3
"ENG_062_MZB_LO_2329","ENG_062_MZB_LO_2329-09.09.2015","09.09.2015",2015,9,9,0.748235127,3
"ENG_062_MZB_LO_2329","ENG_062_MZB_LO_2329-05.10.2016","05.10.2016",2016,10,5,0.915431809,2
"ENG_062_MZB_LO_2329","ENG_062_MZB_LO_2329-18.09.2017","18.09.2017",2017,9,18,0.862546582,3
"ENG_062_MZB_LO_2329","ENG_062_MZB_LO_2329-19.09.2018","19.09.2018",2018,9,19,0.879297878,2
"ENG_062_MZB_LO_2329","ENG_062_MZB_LO_2329-16.09.2019","16.09.2019",2019,9,16,0.870075846,2
"ENG_062_MZB_LO_2329","ENG_062_MZB_LO_2329-25.10.2021","25.10.2021",2021,10,25,0.893141563,2
"ENG_062_MZB_LO_2330","ENG_062_MZB_LO_2330-14.10.2002","14.10.2002",2002,10,14,1.102184646,1
"ENG_062_MZB_LO_2330","ENG_062_MZB_LO_2330-04.11.2003","04.11.2003",2003,11,4,1.152524481,1
"ENG_062_MZB_LO_2330","ENG_062_MZB_LO_2330-01.09.2004","01.09.2004",2004,9,1,1.080338835,1
"ENG_062_MZB_LO_2330","ENG_062_MZB_LO_2330-07.11.2005","07.11.2005",2005,11,7,1.044548151,1
"ENG_062_MZB_LO_2330","ENG_062_MZB_LO_2330-19.09.2006","19.09.2006",2006,9,19,0.995148969,5
"ENG_062_MZB_LO_2330","ENG_062_MZB_LO_2330-23.11.2007","23.11.2007",2007,11,23,0.944891296,3
"ENG_062_MZB_LO_2330","ENG_062_MZB_LO_2330-12.11.2008","12.11.2008",2008,11,12,0.87930691,5
"ENG_062_MZB_LO_2330","ENG_062_MZB_LO_2330-09.09.2009","09.09.2009",2009,9,9,0.997871906,1
"ENG_062_MZB_LO_2330","ENG_062_MZB_LO_2330-23.10.2012","23.10.2012",2012,10,23,1.040264604,1
"ENG_062_MZB_LO_2330","ENG_062_MZB_LO_2330-02.10.2013","02.10.2013",2013,10,2,1.086703228,1
"ENG_062_MZB_LO_2331","ENG_062_MZB_LO_2331-28.10.2002","28.10.2002",2002,10,28,0.9155297,5
"ENG_062_MZB_LO_2331","ENG_062_MZB_LO_2331-17.11.2003","17.11.2003",2003,11,17,1.097836694,3
"ENG_062_MZB_LO_2331","ENG_062_MZB_LO_2331-01.09.2004","01.09.2004",2004,9,1,0.91158009,5
"ENG_062_MZB_LO_2331","ENG_062_MZB_LO_2331-07.11.2005","07.11.2005",2005,11,7,0.907090562,5
"ENG_062_MZB_LO_2331","ENG_062_MZB_LO_2331-19.09.2006","19.09.2006",2006,9,19,0.999182988,5
"ENG_062_MZB_LO_2331","ENG_062_MZB_LO_2331-23.11.2007","23.11.2007",2007,11,23,0.945631455,5
"ENG_062_MZB_LO_2331","ENG_062_MZB_LO_2331-12.11.2008","12.11.2008",2008,11,12,0.86951226,5
"ENG_062_MZB_LO_2331","ENG_062_MZB_LO_2331-09.09.2009","09.09.2009",2009,9,9,0.915878171,5
"ENG_062_MZB_LO_2331","ENG_062_MZB_LO_2331-20.09.2010","20.09.2010",2010,9,20,0.957646156,4
"ENG_062_MZB_LO_2331","ENG_062_MZB_LO_2331-15.11.2011","15.11.2011",2011,11,15,1.049734258,5
"ENG_062_MZB_LO_2332","ENG_062_MZB_LO_2332-15.11.2002","15.11.2002",2002,11,15,0.946570219,2
"ENG_062_MZB_LO_2332","ENG_062_MZB_LO_2332-10.11.2003","10.11.2003",2003,11,10,0.98096283,1
"ENG_062_MZB_LO_2332","ENG_062_MZB_LO_2332-30.11.2004","30.11.2004",2004,11,30,0.957083791,2
"ENG_062_MZB_LO_2332","ENG_062_MZB_LO_2332-10.10.2005","10.10.2005",2005,10,10,0.931739624,2
"ENG_062_MZB_LO_2332","ENG_062_MZB_LO_2332-30.11.2006","30.11.2006",2006,11,30,0.931217227,2
"ENG_062_MZB_LO_2332","ENG_062_MZB_LO_2332-09.11.2007","09.11.2007",2007,11,9,0.949365448,2
"ENG_062_MZB_LO_2332","ENG_062_MZB_LO_2332-23.11.2009","23.11.2009",2009,11,23,1.053116152,1
"ENG_062_MZB_LO_2332","ENG_062_MZB_LO_2332-09.11.2010","09.11.2010",2010,11,9,0.853893594,3
"ENG_062_MZB_LO_2332","ENG_062_MZB_LO_2332-17.10.2011","17.10.2011",2011,10,17,0.989834079,1
"ENG_062_MZB_LO_2332","ENG_062_MZB_LO_2332-01.10.2013","01.10.2013",2013,10,1,0.841862583,3
"ENG_062_MZB_LO_2332","ENG_062_MZB_LO_2332-09.09.2015","09.09.2015",2015,9,9,1.036689524,1
"ENG_062_MZB_LO_2332","ENG_062_MZB_LO_2332-19.09.2016","19.09.2016",2016,9,19,0.824377794,3
"ENG_062_MZB_LO_2332","ENG_062_MZB_LO_2332-28.09.2017","28.09.2017",2017,9,28,0.909904207,2
"ENG_062_MZB_LO_2332","ENG_062_MZB_LO_2332-25.11.2019","25.11.2019",2019,11,25,0.953628009,2
"ENG_062_MZB_LO_2332","ENG_062_MZB_LO_2332-30.09.2020","30.09.2020",2020,9,30,1.04012716,1
"ENG_062_MZB_LO_2334","ENG_062_MZB_LO_2334-05.09.2002","05.09.2002",2002,9,5,1.127093191,1
"ENG_062_MZB_LO_2334","ENG_062_MZB_LO_2334-04.11.2003","04.11.2003",2003,11,4,1.189747316,1
"ENG_062_MZB_LO_2334","ENG_062_MZB_LO_2334-02.11.2004","02.11.2004",2004,11,2,1.191751475,1
"ENG_062_MZB_LO_2334","ENG_062_MZB_LO_2334-22.11.2005","22.11.2005",2005,11,22,1.123640696,1
"ENG_062_MZB_LO_2334","ENG_062_MZB_LO_2334-15.11.2006","15.11.2006",2006,11,15,1.184380473,1
"ENG_062_MZB_LO_2334","ENG_062_MZB_LO_2334-01.10.2007","01.10.2007",2007,10,1,1.077668235,1
"ENG_062_MZB_LO_2334","ENG_062_MZB_LO_2334-28.10.2008","28.10.2008",2008,10,28,1.102348665,1
"ENG_062_MZB_LO_2334","ENG_062_MZB_LO_2334-18.11.2009","18.11.2009",2009,11,18,1.141892604,1
"ENG_062_MZB_LO_2334","ENG_062_MZB_LO_2334-01.11.2010","01.11.2010",2010,11,1,1.157464475,1
"ENG_062_MZB_LO_2334","ENG_062_MZB_LO_2334-03.11.2011","03.11.2011",2011,11,3,1.120599703,1
"ENG_062_MZB_LO_2334","ENG_062_MZB_LO_2334-07.11.2012","07.11.2012",2012,11,7,1.065319739,1
"ENG_062_MZB_LO_2334","ENG_062_MZB_LO_2334-26.09.2013","26.09.2013",2013,9,26,1.036720342,1
"ENG_062_MZB_LO_2334","ENG_062_MZB_LO_2334-02.09.2014","02.09.2014",2014,9,2,1.123581608,1
"ENG_062_MZB_LO_2334","ENG_062_MZB_LO_2334-29.09.2015","29.09.2015",2015,9,29,1.051311871,1
"ENG_062_MZB_LO_2334","ENG_062_MZB_LO_2334-19.09.2016","19.09.2016",2016,9,19,1.147890865,1
"ENG_062_MZB_LO_2334","ENG_062_MZB_LO_2334-04.10.2017","04.10.2017",2017,10,4,1.106888601,1
"ENG_062_MZB_LO_2334","ENG_062_MZB_LO_2334-12.09.2018","12.09.2018",2018,9,12,1.072284928,1
"ENG_062_MZB_LO_2334","ENG_062_MZB_LO_2334-22.11.2019","22.11.2019",2019,11,22,1.112851352,2
"ENG_062_MZB_LO_2334","ENG_062_MZB_LO_2334-28.10.2021","28.10.2021",2021,10,28,1.130184483,1
"ENG_062_MZB_LO_2334","ENG_062_MZB_LO_2334-26.10.2022","26.10.2022",2022,10,26,1.078234407,1
"ENG_062_MZB_LO_2334","ENG_062_MZB_LO_2334-25.09.2023","25.09.2023",2023,9,25,1.008634811,2
"ENG_062_MZB_LO_2335","ENG_062_MZB_LO_2335-16.09.2002","16.09.2002",2002,9,16,0.836698826,3
"ENG_062_MZB_LO_2335","ENG_062_MZB_LO_2335-10.11.2003","10.11.2003",2003,11,10,0.795616235,3
"ENG_062_MZB_LO_2335","ENG_062_MZB_LO_2335-13.09.2004","13.09.2004",2004,9,13,0.789269628,3
"ENG_062_MZB_LO_2335","ENG_062_MZB_LO_2335-29.11.2005","29.11.2005",2005,11,29,0.821058799,3
"ENG_062_MZB_LO_2335","ENG_062_MZB_LO_2335-31.10.2006","31.10.2006",2006,10,31,0.867808689,2
"ENG_062_MZB_LO_2335","ENG_062_MZB_LO_2335-14.11.2007","14.11.2007",2007,11,14,0.843054508,3
"ENG_062_MZB_LO_2335","ENG_062_MZB_LO_2335-20.10.2008","20.10.2008",2008,10,20,0.811945575,3
"ENG_062_MZB_LO_2335","ENG_062_MZB_LO_2335-17.11.2009","17.11.2009",2009,11,17,0.747917189,3
"ENG_062_MZB_LO_2335","ENG_062_MZB_LO_2335-04.11.2013","04.11.2013",2013,11,4,0.762098086,3
"ENG_062_MZB_LO_2336","ENG_062_MZB_LO_2336-28.10.2002","28.10.2002",2002,10,28,0.942703429,2
"ENG_062_MZB_LO_2336","ENG_062_MZB_LO_2336-07.10.2003","07.10.2003",2003,10,7,0.962793849,2
"ENG_062_MZB_LO_2336","ENG_062_MZB_LO_2336-26.10.2004","26.10.2004",2004,10,26,0.974410244,1
"ENG_062_MZB_LO_2336","ENG_062_MZB_LO_2336-07.11.2005","07.11.2005",2005,11,7,0.930167298,2
"ENG_062_MZB_LO_2336","ENG_062_MZB_LO_2336-09.10.2006","09.10.2006",2006,10,9,0.953996513,3
"ENG_062_MZB_LO_2336","ENG_062_MZB_LO_2336-28.11.2007","28.11.2007",2007,11,28,0.900445279,3
"ENG_062_MZB_LO_2336","ENG_062_MZB_LO_2336-10.11.2008","10.11.2008",2008,11,10,0.906780353,2
"ENG_062_MZB_LO_2336","ENG_062_MZB_LO_2336-29.09.2009","29.09.2009",2009,9,29,0.830039778,3
"ENG_062_MZB_LO_2336","ENG_062_MZB_LO_2336-18.11.2010","18.11.2010",2010,11,18,0.964071878,2
"ENG_062_MZB_LO_2336","ENG_062_MZB_LO_2336-18.10.2011","18.10.2011",2011,10,18,0.878284743,3
"ENG_062_MZB_LO_2336","ENG_062_MZB_LO_2336-22.11.2012","22.11.2012",2012,11,22,1.024417534,1
"ENG_062_MZB_LO_2336","ENG_062_MZB_LO_2336-28.10.2013","28.10.2013",2013,10,28,0.903741424,2
"ENG_062_MZB_LO_2336","ENG_062_MZB_LO_2336-23.10.2014","23.10.2014",2014,10,23,0.961825523,2
"ENG_062_MZB_LO_2336","ENG_062_MZB_LO_2336-22.09.2015","22.09.2015",2015,9,22,0.887120475,3
"ENG_062_MZB_LO_2336","ENG_062_MZB_LO_2336-29.09.2016","29.09.2016",2016,9,29,0.926087487,2
"ENG_062_MZB_LO_2336","ENG_062_MZB_LO_2336-19.10.2017","19.10.2017",2017,10,19,0.932645429,3
"ENG_062_MZB_LO_2336","ENG_062_MZB_LO_2336-19.09.2018","19.09.2018",2018,9,19,0.833331795,3
"ENG_062_MZB_LO_2336","ENG_062_MZB_LO_2336-30.10.2019","30.10.2019",2019,10,30,0.929541808,2
"ENG_062_MZB_LO_2336","ENG_062_MZB_LO_2336-19.10.2020","19.10.2020",2020,10,19,0.907002048,2
"ENG_062_MZB_LO_2336","ENG_062_MZB_LO_2336-17.11.2021","17.11.2021",2021,11,17,0.98032783,1
"ENG_062_MZB_LO_2336","ENG_062_MZB_LO_2336-10.10.2022","10.10.2022",2022,10,10,0.822392191,3
"ENG_062_MZB_LO_2337","ENG_062_MZB_LO_2337-28.10.2002","28.10.2002",2002,10,28,0.855679525,3
"ENG_062_MZB_LO_2337","ENG_062_MZB_LO_2337-22.09.2003","22.09.2003",2003,9,22,0.826421422,3
"ENG_062_MZB_LO_2337","ENG_062_MZB_LO_2337-08.11.2004","08.11.2004",2004,11,8,0.842271189,3
"ENG_062_MZB_LO_2337","ENG_062_MZB_LO_2337-31.10.2005","31.10.2005",2005,10,31,0.803958455,3
"ENG_062_MZB_LO_2337","ENG_062_MZB_LO_2337-09.10.2006","09.10.2006",2006,10,9,0.78112512,3
"ENG_062_MZB_LO_2337","ENG_062_MZB_LO_2337-28.11.2007","28.11.2007",2007,11,28,0.920905375,2
"ENG_062_MZB_LO_2337","ENG_062_MZB_LO_2337-24.11.2008","24.11.2008",2008,11,24,0.867305839,3
"ENG_062_MZB_LO_2337","ENG_062_MZB_LO_2337-29.09.2009","29.09.2009",2009,9,29,0.743401366,3
"ENG_062_MZB_LO_2337","ENG_062_MZB_LO_2337-18.11.2010","18.11.2010",2010,11,18,1.007019784,2
"ENG_062_MZB_LO_2337","ENG_062_MZB_LO_2337-18.10.2011","18.10.2011",2011,10,18,0.849174259,3
"ENG_062_MZB_LO_2337","ENG_062_MZB_LO_2337-16.10.2012","16.10.2012",2012,10,16,0.880089832,3
"ENG_062_MZB_LO_2337","ENG_062_MZB_LO_2337-16.10.2013","16.10.2013",2013,10,16,0.925996393,2
"ENG_062_MZB_LO_2337","ENG_062_MZB_LO_2337-10.10.2014","10.10.2014",2014,10,10,0.872061311,3
"ENG_062_MZB_LO_2337","ENG_062_MZB_LO_2337-22.09.2015","22.09.2015",2015,9,22,0.711817288,4
"ENG_062_MZB_LO_2337","ENG_062_MZB_LO_2337-12.10.2016","12.10.2016",2016,10,12,0.855911819,3
"ENG_062_MZB_LO_2337","ENG_062_MZB_LO_2337-25.09.2017","25.09.2017",2017,9,25,0.746149957,4
"ENG_062_MZB_LO_2337","ENG_062_MZB_LO_2337-25.09.2018","25.09.2018",2018,9,25,0.898498114,2
"ENG_062_MZB_LO_2337","ENG_062_MZB_LO_2337-31.10.2019","31.10.2019",2019,10,31,1.053608644,1
"ENG_062_MZB_LO_2337","ENG_062_MZB_LO_2337-17.09.2020","17.09.2020",2020,9,17,0.928149929,2
"ENG_062_MZB_LO_2337","ENG_062_MZB_LO_2337-27.10.2021","27.10.2021",2021,10,27,0.952525767,2
"ENG_062_MZB_LO_2337","ENG_062_MZB_LO_2337-18.10.2022","18.10.2022",2022,10,18,1.029451878,1
"ENG_062_MZB_LO_2338","ENG_062_MZB_LO_2338-28.10.2002","28.10.2002",2002,10,28,0.869516567,3
"ENG_062_MZB_LO_2338","ENG_062_MZB_LO_2338-07.10.2003","07.10.2003",2003,10,7,0.860186348,3
"ENG_062_MZB_LO_2338","ENG_062_MZB_LO_2338-08.11.2004","08.11.2004",2004,11,8,0.898438157,2
"ENG_062_MZB_LO_2338","ENG_062_MZB_LO_2338-31.10.2005","31.10.2005",2005,10,31,0.928247241,2
"ENG_062_MZB_LO_2338","ENG_062_MZB_LO_2338-09.10.2006","09.10.2006",2006,10,9,0.865659894,3
"ENG_062_MZB_LO_2338","ENG_062_MZB_LO_2338-28.11.2007","28.11.2007",2007,11,28,0.917715084,3
"ENG_062_MZB_LO_2338","ENG_062_MZB_LO_2338-24.11.2008","24.11.2008",2008,11,24,0.915554926,2
"ENG_062_MZB_LO_2338","ENG_062_MZB_LO_2338-29.09.2009","29.09.2009",2009,9,29,0.782308693,4
"ENG_062_MZB_LO_2338","ENG_062_MZB_LO_2338-18.11.2010","18.11.2010",2010,11,18,0.94616855,2
"ENG_062_MZB_LO_2338","ENG_062_MZB_LO_2338-18.10.2011","18.10.2011",2011,10,18,0.886006256,3
"ENG_062_MZB_LO_2338","ENG_062_MZB_LO_2338-16.10.2012","16.10.2012",2012,10,16,0.803854656,4
"ENG_062_MZB_LO_2338","ENG_062_MZB_LO_2338-28.10.2013","28.10.2013",2013,10,28,0.798548884,4
"ENG_062_MZB_LO_2338","ENG_062_MZB_LO_2338-10.10.2014","10.10.2014",2014,10,10,0.875830836,3
"ENG_062_MZB_LO_2338","ENG_062_MZB_LO_2338-15.09.2015","15.09.2015",2015,9,15,0.887559422,3
"ENG_062_MZB_LO_2338","ENG_062_MZB_LO_2338-28.10.2016","28.10.2016",2016,10,28,0.999241932,5
"ENG_062_MZB_LO_2338","ENG_062_MZB_LO_2338-09.11.2017","09.11.2017",2017,11,9,0.925464491,2
"ENG_062_MZB_LO_2338","ENG_062_MZB_LO_2338-26.09.2018","26.09.2018",2018,9,26,0.995915851,3
"ENG_062_MZB_LO_2338","ENG_062_MZB_LO_2338-16.09.2019","16.09.2019",2019,9,16,0.90778815,2
"ENG_062_MZB_LO_2338","ENG_062_MZB_LO_2338-17.09.2020","17.09.2020",2020,9,17,0.908769197,3
"ENG_062_MZB_LO_2338","ENG_062_MZB_LO_2338-17.11.2021","17.11.2021",2021,11,17,1.02227495,1
"ENG_062_MZB_LO_2338","ENG_062_MZB_LO_2338-14.11.2022","14.11.2022",2022,11,14,0.943795965,3
"ENG_062_MZB_LO_2339","ENG_062_MZB_LO_2339-28.10.2002","28.10.2002",2002,10,28,0.762651368,3
"ENG_062_MZB_LO_2339","ENG_062_MZB_LO_2339-07.10.2003","07.10.2003",2003,10,7,0.739043969,4
"ENG_062_MZB_LO_2339","ENG_062_MZB_LO_2339-08.11.2004","08.11.2004",2004,11,8,0.688096665,4
"ENG_062_MZB_LO_2339","ENG_062_MZB_LO_2339-31.10.2005","31.10.2005",2005,10,31,0.73128356,3
"ENG_062_MZB_LO_2339","ENG_062_MZB_LO_2339-09.10.2006","09.10.2006",2006,10,9,0.670386826,4
"ENG_062_MZB_LO_2339","ENG_062_MZB_LO_2339-28.11.2007","28.11.2007",2007,11,28,0.703929089,4
"ENG_062_MZB_LO_2339","ENG_062_MZB_LO_2339-24.11.2008","24.11.2008",2008,11,24,0.760202841,3
"ENG_062_MZB_LO_2339","ENG_062_MZB_LO_2339-29.09.2009","29.09.2009",2009,9,29,0.763116613,3
"ENG_062_MZB_LO_2339","ENG_062_MZB_LO_2339-18.11.2010","18.11.2010",2010,11,18,0.68397387,4
"ENG_062_MZB_LO_2339","ENG_062_MZB_LO_2339-18.10.2011","18.10.2011",2011,10,18,0.712398588,4
"ENG_062_MZB_LO_2339","ENG_062_MZB_LO_2339-23.09.2013","23.09.2013",2013,9,23,0.661831574,4
"ENG_062_MZB_LO_2339","ENG_062_MZB_LO_2339-02.10.2014","02.10.2014",2014,10,2,0.661291456,5
"ENG_062_MZB_LO_2339","ENG_062_MZB_LO_2339-02.11.2015","02.11.2015",2015,11,2,0.670351277,4
"ENG_062_MZB_LO_2339","ENG_062_MZB_LO_2339-29.09.2016","29.09.2016",2016,9,29,0.688181989,4
"ENG_062_MZB_LO_2339","ENG_062_MZB_LO_2339-24.10.2019","24.10.2019",2019,10,24,0.731438778,3
"ENG_062_MZB_LO_2341","ENG_062_MZB_LO_2341-23.09.2002","23.09.2002",2002,9,23,0.891145593,2
"ENG_062_MZB_LO_2341","ENG_062_MZB_LO_2341-30.09.2003","30.09.2003",2003,9,30,1.050114769,1
"ENG_062_MZB_LO_2341","ENG_062_MZB_LO_2341-30.11.2004","30.11.2004",2004,11,30,1.035158177,1
"ENG_062_MZB_LO_2341","ENG_062_MZB_LO_2341-24.10.2005","24.10.2005",2005,10,24,0.918784965,2
"ENG_062_MZB_LO_2341","ENG_062_MZB_LO_2341-27.11.2006","27.11.2006",2006,11,27,1.084286318,1
"ENG_062_MZB_LO_2341","ENG_062_MZB_LO_2341-11.09.2007","11.09.2007",2007,9,11,1.069337666,1
"ENG_062_MZB_LO_2341","ENG_062_MZB_LO_2341-17.11.2008","17.11.2008",2008,11,17,1.053062979,3
"ENG_062_MZB_LO_2341","ENG_062_MZB_LO_2341-28.09.2009","28.09.2009",2009,9,28,1.0037473,2
"ENG_062_MZB_LO_2341","ENG_062_MZB_LO_2341-21.10.2010","21.10.2010",2010,10,21,1.013283093,1
"ENG_062_MZB_LO_2341","ENG_062_MZB_LO_2341-04.10.2011","04.10.2011",2011,10,4,1.011672876,1
"ENG_062_MZB_LO_2341","ENG_062_MZB_LO_2341-03.09.2013","03.09.2013",2013,9,3,1.05911146,1
"ENG_062_MZB_LO_2341","ENG_062_MZB_LO_2341-02.09.2014","02.09.2014",2014,9,2,0.950469119,2
"ENG_062_MZB_LO_2341","ENG_062_MZB_LO_2341-02.10.2015","02.10.2015",2015,10,2,1.070663059,1
"ENG_062_MZB_LO_2341","ENG_062_MZB_LO_2341-06.10.2016","06.10.2016",2016,10,6,1.033968336,1
"ENG_062_MZB_LO_2341","ENG_062_MZB_LO_2341-18.10.2017","18.10.2017",2017,10,18,1.021102635,1
"ENG_062_MZB_LO_2341","ENG_062_MZB_LO_2341-16.11.2018","16.11.2018",2018,11,16,1.000222324,1
"ENG_062_MZB_LO_2341","ENG_062_MZB_LO_2341-04.09.2019","04.09.2019",2019,9,4,1.099330486,1
"ENG_062_MZB_LO_2341","ENG_062_MZB_LO_2341-02.11.2020","02.11.2020",2020,11,2,1.011486958,2
"ENG_062_MZB_LO_2341","ENG_062_MZB_LO_2341-23.09.2024","23.09.2024",2024,9,23,1.192947191,1
"ENG_062_MZB_LO_2342","ENG_062_MZB_LO_2342-18.09.2002","18.09.2002",2002,9,18,0.810185217,3
"ENG_062_MZB_LO_2342","ENG_062_MZB_LO_2342-30.09.2003","30.09.2003",2003,9,30,0.815857457,3
"ENG_062_MZB_LO_2342","ENG_062_MZB_LO_2342-30.11.2004","30.11.2004",2004,11,30,0.913832145,2
"ENG_062_MZB_LO_2342","ENG_062_MZB_LO_2342-24.10.2005","24.10.2005",2005,10,24,0.86437473,3
"ENG_062_MZB_LO_2342","ENG_062_MZB_LO_2342-27.11.2006","27.11.2006",2006,11,27,0.814040878,3
"ENG_062_MZB_LO_2342","ENG_062_MZB_LO_2342-11.09.2007","11.09.2007",2007,9,11,0.702035849,4
"ENG_062_MZB_LO_2342","ENG_062_MZB_LO_2342-28.09.2009","28.09.2009",2009,9,28,0.768645667,3
"ENG_062_MZB_LO_2342","ENG_062_MZB_LO_2342-21.10.2010","21.10.2010",2010,10,21,0.802335119,3
"ENG_062_MZB_LO_2342","ENG_062_MZB_LO_2342-24.10.2012","24.10.2012",2012,10,24,0.788140253,3
"ENG_062_MZB_LO_2342","ENG_062_MZB_LO_2342-03.09.2013","03.09.2013",2013,9,3,0.743944573,3
"ENG_062_MZB_LO_2342","ENG_062_MZB_LO_2342-05.10.2016","05.10.2016",2016,10,5,0.755698104,3
"ENG_062_MZB_LO_2342","ENG_062_MZB_LO_2342-18.09.2017","18.09.2017",2017,9,18,0.738679586,3
"ENG_062_MZB_LO_2344","ENG_062_MZB_LO_2344-18.09.2002","18.09.2002",2002,9,18,0.805716062,3
"ENG_062_MZB_LO_2344","ENG_062_MZB_LO_2344-23.09.2003","23.09.2003",2003,9,23,0.821676256,3
"ENG_062_MZB_LO_2344","ENG_062_MZB_LO_2344-06.09.2004","06.09.2004",2004,9,6,0.852756126,3
"ENG_062_MZB_LO_2344","ENG_062_MZB_LO_2344-15.11.2005","15.11.2005",2005,11,15,0.810867281,3
"ENG_062_MZB_LO_2344","ENG_062_MZB_LO_2344-17.10.2006","17.10.2006",2006,10,17,0.883420652,2
"ENG_062_MZB_LO_2344","ENG_062_MZB_LO_2344-25.09.2007","25.09.2007",2007,9,25,0.940481325,2
"ENG_062_MZB_LO_2344","ENG_062_MZB_LO_2344-17.11.2008","17.11.2008",2008,11,17,0.924065475,2
"ENG_062_MZB_LO_2344","ENG_062_MZB_LO_2344-21.11.2011","21.11.2011",2011,11,21,0.943579601,2
"ENG_062_MZB_LO_2344","ENG_062_MZB_LO_2344-07.11.2012","07.11.2012",2012,11,7,0.935080987,2
"ENG_062_MZB_LO_2344","ENG_062_MZB_LO_2344-10.09.2013","10.09.2013",2013,9,10,0.882059724,2
"ENG_062_MZB_LO_2344","ENG_062_MZB_LO_2344-03.09.2014","03.09.2014",2014,9,3,0.836112954,3
"ENG_062_MZB_LO_2344","ENG_062_MZB_LO_2344-08.09.2015","08.09.2015",2015,9,8,0.951829357,2
"ENG_062_MZB_LO_2344","ENG_062_MZB_LO_2344-06.09.2016","06.09.2016",2016,9,6,0.858676537,3
"ENG_062_MZB_LO_2344","ENG_062_MZB_LO_2344-25.09.2017","25.09.2017",2017,9,25,0.838409661,3
"ENG_062_MZB_LO_2344","ENG_062_MZB_LO_2344-13.09.2018","13.09.2018",2018,9,13,0.899511446,2
"ENG_062_MZB_LO_2344","ENG_062_MZB_LO_2344-30.09.2019","30.09.2019",2019,9,30,1.0097854,1
"ENG_062_MZB_LO_2344","ENG_062_MZB_LO_2344-02.11.2020","02.11.2020",2020,11,2,0.910754779,2
"ENG_062_MZB_LO_2344","ENG_062_MZB_LO_2344-08.11.2021","08.11.2021",2021,11,8,1.015981241,1
"ENG_062_MZB_LO_2344","ENG_062_MZB_LO_2344-10.10.2022","10.10.2022",2022,10,10,1.036470832,1
"ENG_062_MZB_LO_2345","ENG_062_MZB_LO_2345-18.09.2002","18.09.2002",2002,9,18,0.7163444,4
"ENG_062_MZB_LO_2345","ENG_062_MZB_LO_2345-23.09.2003","23.09.2003",2003,9,23,0.633501794,4
"ENG_062_MZB_LO_2345","ENG_062_MZB_LO_2345-06.09.2004","06.09.2004",2004,9,6,0.657622785,4
"ENG_062_MZB_LO_2345","ENG_062_MZB_LO_2345-24.11.2005","24.11.2005",2005,11,24,0.702146218,4
"ENG_062_MZB_LO_2345","ENG_062_MZB_LO_2345-17.10.2006","17.10.2006",2006,10,17,0.725126272,3
"ENG_062_MZB_LO_2345","ENG_062_MZB_LO_2345-01.11.2007","01.11.2007",2007,11,1,0.789370956,3
"ENG_062_MZB_LO_2345","ENG_062_MZB_LO_2345-01.09.2009","01.09.2009",2009,9,1,0.657663571,4
"ENG_062_MZB_LO_2345","ENG_062_MZB_LO_2345-21.11.2011","21.11.2011",2011,11,21,0.56423642,5
"ENG_062_MZB_LO_2345","ENG_062_MZB_LO_2345-03.09.2012","03.09.2012",2012,9,3,0.760042512,3
"ENG_062_MZB_LO_2345","ENG_062_MZB_LO_2345-10.09.2013","10.09.2013",2013,9,10,0.687135644,4
"ENG_062_MZB_LO_2345","ENG_062_MZB_LO_2345-03.09.2014","03.09.2014",2014,9,3,0.633897798,4
"ENG_062_MZB_LO_2345","ENG_062_MZB_LO_2345-10.09.2015","10.09.2015",2015,9,10,0.648365843,4
"ENG_062_MZB_LO_2345","ENG_062_MZB_LO_2345-22.09.2016","22.09.2016",2016,9,22,0.675054974,4
"ENG_062_MZB_LO_2345","ENG_062_MZB_LO_2345-05.10.2017","05.10.2017",2017,10,5,0.690940471,4
"ENG_062_MZB_LO_2346","ENG_062_MZB_LO_2346-28.10.2002","28.10.2002",2002,10,28,0.684934412,4
"ENG_062_MZB_LO_2346","ENG_062_MZB_LO_2346-06.09.2004","06.09.2004",2004,9,6,0.761721384,3
"ENG_062_MZB_LO_2346","ENG_062_MZB_LO_2346-15.11.2005","15.11.2005",2005,11,15,0.743122596,3
"ENG_062_MZB_LO_2346","ENG_062_MZB_LO_2346-17.10.2006","17.10.2006",2006,10,17,0.753673667,3
"ENG_062_MZB_LO_2346","ENG_062_MZB_LO_2346-01.11.2007","01.11.2007",2007,11,1,0.741617429,3
"ENG_062_MZB_LO_2346","ENG_062_MZB_LO_2346-17.11.2008","17.11.2008",2008,11,17,0.750415036,3
"ENG_062_MZB_LO_2346","ENG_062_MZB_LO_2346-21.11.2011","21.11.2011",2011,11,21,0.803029224,3
"ENG_062_MZB_LO_2346","ENG_062_MZB_LO_2346-10.09.2013","10.09.2013",2013,9,10,0.824320518,3
"ENG_062_MZB_LO_2346","ENG_062_MZB_LO_2346-24.09.2015","24.09.2015",2015,9,24,0.81374376,3
"ENG_062_MZB_LO_2346","ENG_062_MZB_LO_2346-19.10.2016","19.10.2016",2016,10,19,0.649457809,4
"ENG_062_MZB_LO_2346","ENG_062_MZB_LO_2346-10.09.2018","10.09.2018",2018,9,10,0.725001354,3
"ENG_062_MZB_LO_2346","ENG_062_MZB_LO_2346-24.10.2019","24.10.2019",2019,10,24,0.755743843,3
"ENG_062_MZB_LO_2346","ENG_062_MZB_LO_2346-19.10.2020","19.10.2020",2020,10,19,0.742973602,4
"ENG_062_MZB_LO_2346","ENG_062_MZB_LO_2346-08.11.2021","08.11.2021",2021,11,8,0.795058637,3
"ENG_062_MZB_LO_2346","ENG_062_MZB_LO_2346-25.10.2022","25.10.2022",2022,10,25,0.702674491,4
"ENG_062_MZB_LO_2347","ENG_062_MZB_LO_2347-28.10.2002","28.10.2002",2002,10,28,0.753848347,4
"ENG_062_MZB_LO_2347","ENG_062_MZB_LO_2347-22.09.2003","22.09.2003",2003,9,22,0.777807718,4
"ENG_062_MZB_LO_2347","ENG_062_MZB_LO_2347-06.09.2004","06.09.2004",2004,9,6,0.752738054,3
"ENG_062_MZB_LO_2347","ENG_062_MZB_LO_2347-24.11.2005","24.11.2005",2005,11,24,0.807957964,3
"ENG_062_MZB_LO_2347","ENG_062_MZB_LO_2347-17.10.2006","17.10.2006",2006,10,17,0.85089114,3
"ENG_062_MZB_LO_2347","ENG_062_MZB_LO_2347-01.11.2007","01.11.2007",2007,11,1,0.747102957,3
"ENG_062_MZB_LO_2347","ENG_062_MZB_LO_2347-17.11.2008","17.11.2008",2008,11,17,0.779776151,3
"ENG_062_MZB_LO_2347","ENG_062_MZB_LO_2347-01.09.2009","01.09.2009",2009,9,1,0.694541642,4
"ENG_062_MZB_LO_2347","ENG_062_MZB_LO_2347-10.11.2010","10.11.2010",2010,11,10,0.771682419,3
"ENG_062_MZB_LO_2347","ENG_062_MZB_LO_2347-21.11.2011","21.11.2011",2011,11,21,0.839638867,3
"ENG_062_MZB_LO_2347","ENG_062_MZB_LO_2347-05.11.2012","05.11.2012",2012,11,5,0.816733577,3
"ENG_062_MZB_LO_2347","ENG_062_MZB_LO_2347-23.09.2013","23.09.2013",2013,9,23,0.824718393,3
"ENG_062_MZB_LO_2347","ENG_062_MZB_LO_2347-22.09.2015","22.09.2015",2015,9,22,0.793369748,3
"ENG_062_MZB_LO_2347","ENG_062_MZB_LO_2347-23.09.2016","23.09.2016",2016,9,23,0.858366646,3
"ENG_062_MZB_LO_2347","ENG_062_MZB_LO_2347-16.10.2017","16.10.2017",2017,10,16,0.789447702,3
"ENG_062_MZB_LO_2347","ENG_062_MZB_LO_2347-29.10.2021","29.10.2021",2021,10,29,0.794935441,3
"ENG_062_MZB_LO_2348","ENG_062_MZB_LO_2348-14.10.2002","14.10.2002",2002,10,14,1.056667629,3
"ENG_062_MZB_LO_2348","ENG_062_MZB_LO_2348-22.10.2003","22.10.2003",2003,10,22,1.148645139,1
"ENG_062_MZB_LO_2348","ENG_062_MZB_LO_2348-23.09.2004","23.09.2004",2004,9,23,1.035295245,4
"ENG_062_MZB_LO_2348","ENG_062_MZB_LO_2348-22.11.2005","22.11.2005",2005,11,22,1.085932212,2
"ENG_062_MZB_LO_2348","ENG_062_MZB_LO_2348-15.11.2006","15.11.2006",2006,11,15,1.055826341,1
"ENG_062_MZB_LO_2348","ENG_062_MZB_LO_2348-23.11.2007","23.11.2007",2007,11,23,1.084290411,3
"ENG_062_MZB_LO_2348","ENG_062_MZB_LO_2348-09.09.2009","09.09.2009",2009,9,9,0.927901321,5
"ENG_062_MZB_LO_2348","ENG_062_MZB_LO_2348-20.09.2010","20.09.2010",2010,9,20,1.158263197,3
"ENG_062_MZB_LO_2348","ENG_062_MZB_LO_2348-15.11.2011","15.11.2011",2011,11,15,1.07414813,3
"ENG_062_MZB_LO_2348","ENG_062_MZB_LO_2348-17.09.2013","17.09.2013",2013,9,17,0.94604708,3
"ENG_062_MZB_LO_2348","ENG_062_MZB_LO_2348-29.09.2014","29.09.2014",2014,9,29,0.980472751,5
"ENG_062_MZB_LO_2348","ENG_062_MZB_LO_2348-29.09.2015","29.09.2015",2015,9,29,0.945803261,5
"ENG_062_MZB_LO_2348","ENG_062_MZB_LO_2348-19.09.2016","19.09.2016",2016,9,19,0.964533737,5
"ENG_062_MZB_LO_2348","ENG_062_MZB_LO_2348-06.09.2017","06.09.2017",2017,9,6,0.890549658,5
"ENG_062_MZB_LO_2348","ENG_062_MZB_LO_2348-28.11.2018","28.11.2018",2018,11,28,0.982137183,3
"ENG_062_MZB_LO_2348","ENG_062_MZB_LO_2348-30.09.2019","30.09.2019",2019,9,30,0.903973429,5
"ENG_062_MZB_LO_2348","ENG_062_MZB_LO_2348-29.09.2020","29.09.2020",2020,9,29,0.97191827,3
"ENG_062_MZB_LO_2348","ENG_062_MZB_LO_2348-27.10.2021","27.10.2021",2021,10,27,0.946817314,5
"ENG_062_MZB_LO_2348","ENG_062_MZB_LO_2348-26.10.2022","26.10.2022",2022,10,26,0.856698604,5
"ENG_062_MZB_LO_2348","ENG_062_MZB_LO_2348-25.09.2023","25.09.2023",2023,9,25,0.929899265,5
"ENG_062_MZB_LO_2348","ENG_062_MZB_LO_2348-23.09.2024","23.09.2024",2024,9,23,1.134466308,5
"ENG_062_MZB_LO_2349","ENG_062_MZB_LO_2349-14.10.2002","14.10.2002",2002,10,14,1.140111152,1
"ENG_062_MZB_LO_2349","ENG_062_MZB_LO_2349-22.10.2003","22.10.2003",2003,10,22,1.057688609,1
"ENG_062_MZB_LO_2349","ENG_062_MZB_LO_2349-23.09.2004","23.09.2004",2004,9,23,1.168079642,1
"ENG_062_MZB_LO_2349","ENG_062_MZB_LO_2349-22.11.2005","22.11.2005",2005,11,22,1.101392653,1
"ENG_062_MZB_LO_2349","ENG_062_MZB_LO_2349-15.11.2006","15.11.2006",2006,11,15,1.080980939,1
"ENG_062_MZB_LO_2349","ENG_062_MZB_LO_2349-01.11.2007","01.11.2007",2007,11,1,1.129010236,1
"ENG_062_MZB_LO_2349","ENG_062_MZB_LO_2349-17.11.2008","17.11.2008",2008,11,17,1.085096389,1
"ENG_062_MZB_LO_2349","ENG_062_MZB_LO_2349-15.11.2011","15.11.2011",2011,11,15,1.132835237,1
"ENG_062_MZB_LO_2349","ENG_062_MZB_LO_2349-03.09.2012","03.09.2012",2012,9,3,1.147306346,1
"ENG_062_MZB_LO_2349","ENG_062_MZB_LO_2349-17.09.2013","17.09.2013",2013,9,17,1.137675747,1
"ENG_062_MZB_LO_2349","ENG_062_MZB_LO_2349-29.09.2014","29.09.2014",2014,9,29,1.073039446,2
"ENG_062_MZB_LO_2349","ENG_062_MZB_LO_2349-19.10.2015","19.10.2015",2015,10,19,1.195285063,2
"ENG_062_MZB_LO_2349","ENG_062_MZB_LO_2349-19.09.2016","19.09.2016",2016,9,19,1.141781766,2
"ENG_062_MZB_LO_2349","ENG_062_MZB_LO_2349-02.10.2017","02.10.2017",2017,10,2,1.201691003,2
"ENG_062_MZB_LO_2349","ENG_062_MZB_LO_2349-12.09.2018","12.09.2018",2018,9,12,1.155455118,2
"ENG_062_MZB_LO_2349","ENG_062_MZB_LO_2349-18.09.2020","18.09.2020",2020,9,18,1.098989251,1
"ENG_062_MZB_LO_2350","ENG_062_MZB_LO_2350-28.11.2002","28.11.2002",2002,11,28,1.200070568,1
"ENG_062_MZB_LO_2350","ENG_062_MZB_LO_2350-22.10.2003","22.10.2003",2003,10,22,1.172841337,1
"ENG_062_MZB_LO_2350","ENG_062_MZB_LO_2350-13.10.2004","13.10.2004",2004,10,13,1.188117475,1
"ENG_062_MZB_LO_2350","ENG_062_MZB_LO_2350-22.11.2005","22.11.2005",2005,11,22,1.188598764,1
"ENG_062_MZB_LO_2350","ENG_062_MZB_LO_2350-15.11.2006","15.11.2006",2006,11,15,1.170611555,1
"ENG_062_MZB_LO_2350","ENG_062_MZB_LO_2350-01.11.2007","01.11.2007",2007,11,1,1.231436246,1
"ENG_062_MZB_LO_2350","ENG_062_MZB_LO_2350-17.11.2008","17.11.2008",2008,11,17,1.210612573,1
"ENG_062_MZB_LO_2350","ENG_062_MZB_LO_2350-09.09.2009","09.09.2009",2009,9,9,1.018904313,1
"ENG_062_MZB_LO_2350","ENG_062_MZB_LO_2350-20.09.2010","20.09.2010",2010,9,20,1.251044308,1
"ENG_062_MZB_LO_2350","ENG_062_MZB_LO_2350-15.11.2011","15.11.2011",2011,11,15,1.158926021,1
"ENG_062_MZB_LO_2350","ENG_062_MZB_LO_2350-15.10.2012","15.10.2012",2012,10,15,1.099037301,1
"ENG_062_MZB_LO_2350","ENG_062_MZB_LO_2350-17.09.2013","17.09.2013",2013,9,17,1.2000317,1
"ENG_062_MZB_LO_2350","ENG_062_MZB_LO_2350-29.09.2014","29.09.2014",2014,9,29,1.237498494,1
"ENG_062_MZB_LO_2350","ENG_062_MZB_LO_2350-15.10.2015","15.10.2015",2015,10,15,1.175871349,1
"ENG_062_MZB_LO_2350","ENG_062_MZB_LO_2350-20.09.2016","20.09.2016",2016,9,20,1.246741856,3
"ENG_062_MZB_LO_2350","ENG_062_MZB_LO_2350-27.09.2017","27.09.2017",2017,9,27,1.366169027,1
"ENG_062_MZB_LO_2350","ENG_062_MZB_LO_2350-20.09.2018","20.09.2018",2018,9,20,1.275537555,3
"ENG_062_MZB_LO_2350","ENG_062_MZB_LO_2350-29.09.2020","29.09.2020",2020,9,29,1.11721322,3
"ENG_062_MZB_LO_2350","ENG_062_MZB_LO_2350-28.10.2021","28.10.2021",2021,10,28,1.235283691,1
"ENG_062_MZB_LO_2350","ENG_062_MZB_LO_2350-26.10.2022","26.10.2022",2022,10,26,1.235620711,2
"ENG_062_MZB_LO_2350","ENG_062_MZB_LO_2350-11.10.2023","11.10.2023",2023,10,11,1.262399395,3
"ENG_062_MZB_LO_2350","ENG_062_MZB_LO_2350-28.10.2024","28.10.2024",2024,10,28,1.229692543,5
"ENG_062_MZB_LO_2351","ENG_062_MZB_LO_2351-28.10.2002","28.10.2002",2002,10,28,0.983352607,1
"ENG_062_MZB_LO_2351","ENG_062_MZB_LO_2351-17.11.2003","17.11.2003",2003,11,17,0.937375315,2
"ENG_062_MZB_LO_2351","ENG_062_MZB_LO_2351-01.09.2004","01.09.2004",2004,9,1,0.941623073,2
"ENG_062_MZB_LO_2351","ENG_062_MZB_LO_2351-07.11.2005","07.11.2005",2005,11,7,1.000690265,1
"ENG_062_MZB_LO_2351","ENG_062_MZB_LO_2351-15.11.2006","15.11.2006",2006,11,15,0.942888692,2
"ENG_062_MZB_LO_2351","ENG_062_MZB_LO_2351-23.11.2007","23.11.2007",2007,11,23,0.97785655,1
"ENG_062_MZB_LO_2351","ENG_062_MZB_LO_2351-12.11.2008","12.11.2008",2008,11,12,0.930589584,2
"ENG_062_MZB_LO_2351","ENG_062_MZB_LO_2351-09.09.2009","09.09.2009",2009,9,9,0.914605173,3
"ENG_062_MZB_LO_2351","ENG_062_MZB_LO_2351-20.09.2010","20.09.2010",2010,9,20,1.044149845,1
"ENG_062_MZB_LO_2351","ENG_062_MZB_LO_2351-15.11.2011","15.11.2011",2011,11,15,0.956437602,3
"ENG_062_MZB_LO_2351","ENG_062_MZB_LO_2351-23.10.2012","23.10.2012",2012,10,23,0.974455657,1
"ENG_062_MZB_LO_2351","ENG_062_MZB_LO_2351-27.11.2014","27.11.2014",2014,11,27,0.95583754,2
"ENG_062_MZB_LO_2351","ENG_062_MZB_LO_2351-18.10.2016","18.10.2016",2016,10,18,0.989109448,1
"ENG_062_MZB_LO_2351","ENG_062_MZB_LO_2351-27.09.2017","27.09.2017",2017,9,27,0.958013878,2
"ENG_062_MZB_LO_2351","ENG_062_MZB_LO_2351-22.09.2020","22.09.2020",2020,9,22,1.032509864,1
"ENG_062_MZB_LO_2351","ENG_062_MZB_LO_2351-15.10.2021","15.10.2021",2021,10,15,1.053597368,1
"ENG_062_MZB_LO_2354","ENG_062_MZB_LO_2354-29.10.2002","29.10.2002",2002,10,29,0.83168507,3
"ENG_062_MZB_LO_2354","ENG_062_MZB_LO_2354-17.11.2003","17.11.2003",2003,11,17,0.812799219,3
"ENG_062_MZB_LO_2354","ENG_062_MZB_LO_2354-13.09.2004","13.09.2004",2004,9,13,0.89945555,3
"ENG_062_MZB_LO_2354","ENG_062_MZB_LO_2354-30.11.2005","30.11.2005",2005,11,30,0.878673057,2
"ENG_062_MZB_LO_2354","ENG_062_MZB_LO_2354-31.10.2006","31.10.2006",2006,10,31,0.761274057,3
"ENG_062_MZB_LO_2354","ENG_062_MZB_LO_2354-12.11.2007","12.11.2007",2007,11,12,0.852620943,3
"ENG_062_MZB_LO_2354","ENG_062_MZB_LO_2354-04.11.2009","04.11.2009",2009,11,4,0.948582219,2
"ENG_062_MZB_LO_2354","ENG_062_MZB_LO_2354-26.09.2013","26.09.2013",2013,9,26,0.818150393,3
"ENG_062_MZB_LO_2354","ENG_062_MZB_LO_2354-02.09.2016","02.09.2016",2016,9,2,0.789501825,4
"ENG_062_MZB_LO_2354","ENG_062_MZB_LO_2354-18.10.2017","18.10.2017",2017,10,18,0.928674575,2
"ENG_062_MZB_LO_2354","ENG_062_MZB_LO_2354-11.09.2018","11.09.2018",2018,9,11,0.900373499,2
"ENG_062_MZB_LO_2354","ENG_062_MZB_LO_2354-29.09.2020","29.09.2020",2020,9,29,0.799292134,3
"ENG_062_MZB_LO_2355","ENG_062_MZB_LO_2355-29.10.2002","29.10.2002",2002,10,29,0.821674419,4
"ENG_062_MZB_LO_2355","ENG_062_MZB_LO_2355-17.11.2003","17.11.2003",2003,11,17,0.783476641,3
"ENG_062_MZB_LO_2355","ENG_062_MZB_LO_2355-22.11.2004","22.11.2004",2004,11,22,0.809224437,3
"ENG_062_MZB_LO_2355","ENG_062_MZB_LO_2355-30.11.2005","30.11.2005",2005,11,30,0.828722936,3
"ENG_062_MZB_LO_2355","ENG_062_MZB_LO_2355-31.10.2006","31.10.2006",2006,10,31,0.808722862,3
"ENG_062_MZB_LO_2355","ENG_062_MZB_LO_2355-12.11.2007","12.11.2007",2007,11,12,0.750956908,3
"ENG_062_MZB_LO_2355","ENG_062_MZB_LO_2355-04.11.2009","04.11.2009",2009,11,4,0.827663198,3
"ENG_062_MZB_LO_2355","ENG_062_MZB_LO_2355-10.11.2010","10.11.2010",2010,11,10,0.768834324,3
"ENG_062_MZB_LO_2355","ENG_062_MZB_LO_2355-25.10.2011","25.10.2011",2011,10,25,0.791947041,3
"ENG_062_MZB_LO_2355","ENG_062_MZB_LO_2355-17.10.2012","17.10.2012",2012,10,17,0.81850724,3
"ENG_062_MZB_LO_2355","ENG_062_MZB_LO_2355-01.10.2013","01.10.2013",2013,10,1,0.834766946,3
"ENG_062_MZB_LO_2355","ENG_062_MZB_LO_2355-15.09.2014","15.09.2014",2014,9,15,0.841739424,3
"ENG_062_MZB_LO_2355","ENG_062_MZB_LO_2355-01.09.2015","01.09.2015",2015,9,1,0.791308731,3
"ENG_062_MZB_LO_2355","ENG_062_MZB_LO_2355-02.09.2016","02.09.2016",2016,9,2,0.944411411,5
"ENG_062_MZB_LO_2355","ENG_062_MZB_LO_2355-19.09.2017","19.09.2017",2017,9,19,0.872079303,3
"ENG_062_MZB_LO_2355","ENG_062_MZB_LO_2355-13.09.2018","13.09.2018",2018,9,13,0.912767847,2
"ENG_062_MZB_LO_2355","ENG_062_MZB_LO_2355-05.09.2019","05.09.2019",2019,9,5,0.962411146,2
"ENG_062_MZB_LO_2355","ENG_062_MZB_LO_2355-22.10.2020","22.10.2020",2020,10,22,0.894206457,2
"ENG_062_MZB_LO_2356","ENG_062_MZB_LO_2356-17.10.2002","17.10.2002",2002,10,17,1.328716918,1
"ENG_062_MZB_LO_2356","ENG_062_MZB_LO_2356-28.11.2003","28.11.2003",2003,11,28,1.332585772,1
"ENG_062_MZB_LO_2356","ENG_062_MZB_LO_2356-11.10.2004","11.10.2004",2004,10,11,1.325300606,1
"ENG_062_MZB_LO_2356","ENG_062_MZB_LO_2356-29.11.2005","29.11.2005",2005,11,29,1.384584876,2
"ENG_062_MZB_LO_2356","ENG_062_MZB_LO_2356-25.10.2006","25.10.2006",2006,10,25,1.353426249,2
"ENG_062_MZB_LO_2356","ENG_062_MZB_LO_2356-11.10.2007","11.10.2007",2007,10,11,1.284414544,2
"ENG_062_MZB_LO_2356","ENG_062_MZB_LO_2356-05.11.2008","05.11.2008",2008,11,5,1.401163628,3
"ENG_062_MZB_LO_2356","ENG_062_MZB_LO_2356-11.11.2009","11.11.2009",2009,11,11,1.420309629,3
"ENG_062_MZB_LO_2356","ENG_062_MZB_LO_2356-26.10.2010","26.10.2010",2010,10,26,1.323491779,1
"ENG_062_MZB_LO_2356","ENG_062_MZB_LO_2356-24.11.2011","24.11.2011",2011,11,24,1.239314821,1
"ENG_062_MZB_LO_2356","ENG_062_MZB_LO_2356-15.10.2012","15.10.2012",2012,10,15,1.436565291,3
"ENG_062_MZB_LO_2356","ENG_062_MZB_LO_2356-24.09.2013","24.09.2013",2013,9,24,1.296310326,2
"ENG_062_MZB_LO_2356","ENG_062_MZB_LO_2356-16.09.2015","16.09.2015",2015,9,16,1.23171032,1
"ENG_062_MZB_LO_2356","ENG_062_MZB_LO_2356-22.09.2016","22.09.2016",2016,9,22,1.429645973,2
"ENG_062_MZB_LO_2356","ENG_062_MZB_LO_2356-21.09.2017","21.09.2017",2017,9,21,1.44361401,2
"ENG_062_MZB_LO_2356","ENG_062_MZB_LO_2356-30.10.2019","30.10.2019",2019,10,30,1.260959232,3
"ENG_062_MZB_LO_2356","ENG_062_MZB_LO_2356-21.10.2020","21.10.2020",2020,10,21,1.282818242,1
"ENG_062_MZB_LO_2356","ENG_062_MZB_LO_2356-27.10.2021","27.10.2021",2021,10,27,1.45345113,1
"ENG_062_MZB_LO_2356","ENG_062_MZB_LO_2356-17.10.2022","17.10.2022",2022,10,17,1.363500634,1
"ENG_062_MZB_LO_2356","ENG_062_MZB_LO_2356-19.09.2023","19.09.2023",2023,9,19,1.160755229,3
"ENG_062_MZB_LO_2357","ENG_062_MZB_LO_2357-17.10.2002","17.10.2002",2002,10,17,1.051918348,1
"ENG_062_MZB_LO_2357","ENG_062_MZB_LO_2357-10.11.2003","10.11.2003",2003,11,10,1.054942565,1
"ENG_062_MZB_LO_2357","ENG_062_MZB_LO_2357-11.10.2004","11.10.2004",2004,10,11,1.077580837,1
"ENG_062_MZB_LO_2357","ENG_062_MZB_LO_2357-30.11.2005","30.11.2005",2005,11,30,0.971872706,3
"ENG_062_MZB_LO_2357","ENG_062_MZB_LO_2357-25.10.2006","25.10.2006",2006,10,25,0.969592637,1
"ENG_062_MZB_LO_2357","ENG_062_MZB_LO_2357-18.10.2007","18.10.2007",2007,10,18,0.960659356,2
"ENG_062_MZB_LO_2357","ENG_062_MZB_LO_2357-11.11.2009","11.11.2009",2009,11,11,0.944978011,2
"ENG_062_MZB_LO_2357","ENG_062_MZB_LO_2357-30.10.2013","30.10.2013",2013,10,30,0.948792922,2
"ENG_062_MZB_LO_2357","ENG_062_MZB_LO_2357-15.10.2015","15.10.2015",2015,10,15,0.945834645,3
"ENG_062_MZB_LO_2358","ENG_062_MZB_LO_2358-04.09.2002","04.09.2002",2002,9,4,1.102997239,2
"ENG_062_MZB_LO_2358","ENG_062_MZB_LO_2358-29.09.2003","29.09.2003",2003,9,29,1.024204962,2
"ENG_062_MZB_LO_2358","ENG_062_MZB_LO_2358-26.10.2004","26.10.2004",2004,10,26,1.030895215,2
"ENG_062_MZB_LO_2358","ENG_062_MZB_LO_2358-29.11.2005","29.11.2005",2005,11,29,1.110614339,1
"ENG_062_MZB_LO_2358","ENG_062_MZB_LO_2358-21.11.2006","21.11.2006",2006,11,21,1.107782238,1
"ENG_062_MZB_LO_2358","ENG_062_MZB_LO_2358-24.09.2007","24.09.2007",2007,9,24,1.146026046,1
"ENG_062_MZB_LO_2358","ENG_062_MZB_LO_2358-04.11.2008","04.11.2008",2008,11,4,1.138119279,1
"ENG_062_MZB_LO_2358","ENG_062_MZB_LO_2358-21.09.2009","21.09.2009",2009,9,21,0.929750152,2
"ENG_062_MZB_LO_2358","ENG_062_MZB_LO_2358-10.11.2010","10.11.2010",2010,11,10,1.036999105,1
"ENG_062_MZB_LO_2358","ENG_062_MZB_LO_2358-03.11.2011","03.11.2011",2011,11,3,0.929419569,2
"ENG_062_MZB_LO_2358","ENG_062_MZB_LO_2358-24.09.2013","24.09.2013",2013,9,24,0.938115551,2
"ENG_062_MZB_LO_2358","ENG_062_MZB_LO_2358-27.11.2014","27.11.2014",2014,11,27,0.966350718,2
"ENG_062_MZB_LO_2358","ENG_062_MZB_LO_2358-22.09.2015","22.09.2015",2015,9,22,0.897725966,3
"ENG_062_MZB_LO_2358","ENG_062_MZB_LO_2358-22.09.2016","22.09.2016",2016,9,22,0.963937479,3
"ENG_062_MZB_LO_2358","ENG_062_MZB_LO_2358-21.09.2017","21.09.2017",2017,9,21,1.054227438,1
"ENG_062_MZB_LO_2358","ENG_062_MZB_LO_2358-19.09.2018","19.09.2018",2018,9,19,0.96881863,2
"ENG_062_MZB_LO_2358","ENG_062_MZB_LO_2358-31.10.2019","31.10.2019",2019,10,31,0.996441223,2
"ENG_062_MZB_LO_2358","ENG_062_MZB_LO_2358-21.10.2020","21.10.2020",2020,10,21,0.869217005,3
"ENG_062_MZB_LO_2359","ENG_062_MZB_LO_2359-22.11.2002","22.11.2002",2002,11,22,0.837523173,3
"ENG_062_MZB_LO_2359","ENG_062_MZB_LO_2359-24.11.2003","24.11.2003",2003,11,24,0.846078443,3
"ENG_062_MZB_LO_2359","ENG_062_MZB_LO_2359-30.11.2004","30.11.2004",2004,11,30,0.850856266,3
"ENG_062_MZB_LO_2359","ENG_062_MZB_LO_2359-14.09.2005","14.09.2005",2005,9,14,0.864614001,3
"ENG_062_MZB_LO_2359","ENG_062_MZB_LO_2359-19.09.2006","19.09.2006",2006,9,19,0.810077457,3
"ENG_062_MZB_LO_2359","ENG_062_MZB_LO_2359-22.10.2013","22.10.2013",2013,10,22,0.780071893,3
"ENG_062_MZB_LO_2359","ENG_062_MZB_LO_2359-29.11.2016","29.11.2016",2016,11,29,0.914815874,3
"ENG_062_MZB_LO_2360","ENG_062_MZB_LO_2360-16.09.2002","16.09.2002",2002,9,16,0.562031754,5
"ENG_062_MZB_LO_2360","ENG_062_MZB_LO_2360-10.11.2003","10.11.2003",2003,11,10,0.554742652,5
"ENG_062_MZB_LO_2360","ENG_062_MZB_LO_2360-01.11.2004","01.11.2004",2004,11,1,0.663628963,4
"ENG_062_MZB_LO_2360","ENG_062_MZB_LO_2360-29.11.2005","29.11.2005",2005,11,29,0.648118792,4
"ENG_062_MZB_LO_2360","ENG_062_MZB_LO_2360-31.10.2006","31.10.2006",2006,10,31,0.708110409,4
"ENG_062_MZB_LO_2360","ENG_062_MZB_LO_2360-14.11.2007","14.11.2007",2007,11,14,0.709160153,4
"ENG_062_MZB_LO_2360","ENG_062_MZB_LO_2360-17.11.2009","17.11.2009",2009,11,17,0.690000837,4
"ENG_062_MZB_LO_2360","ENG_062_MZB_LO_2360-19.10.2010","19.10.2010",2010,10,19,0.613148099,4
"ENG_062_MZB_LO_2360","ENG_062_MZB_LO_2360-02.11.2011","02.11.2011",2011,11,2,0.648443439,5
"ENG_062_MZB_LO_2360","ENG_062_MZB_LO_2360-20.11.2012","20.11.2012",2012,11,20,0.630660989,5
"ENG_062_MZB_LO_2360","ENG_062_MZB_LO_2360-19.09.2013","19.09.2013",2013,9,19,0.650167772,4
"ENG_062_MZB_LO_2360","ENG_062_MZB_LO_2360-22.10.2014","22.10.2014",2014,10,22,0.672090365,4
"ENG_062_MZB_LO_2360","ENG_062_MZB_LO_2360-14.09.2015","14.09.2015",2015,9,14,0.628933219,4
"ENG_062_MZB_LO_2360","ENG_062_MZB_LO_2360-27.09.2016","27.09.2016",2016,9,27,0.687676492,5
"ENG_062_MZB_LO_2360","ENG_062_MZB_LO_2360-17.10.2017","17.10.2017",2017,10,17,0.595249685,5
"ENG_062_MZB_LO_2360","ENG_062_MZB_LO_2360-22.10.2019","22.10.2019",2019,10,22,0.720619663,4
"ENG_062_MZB_LO_2360","ENG_062_MZB_LO_2360-25.09.2020","25.09.2020",2020,9,25,0.593086894,5
"ENG_062_MZB_LO_2360","ENG_062_MZB_LO_2360-21.09.2021","21.09.2021",2021,9,21,0.622270071,4
"ENG_062_MZB_LO_2360","ENG_062_MZB_LO_2360-16.11.2022","16.11.2022",2022,11,16,0.535096272,5
"ENG_062_MZB_LO_2360","ENG_062_MZB_LO_2360-11.10.2023","11.10.2023",2023,10,11,0.640489795,4
"ENG_062_MZB_LO_2361","ENG_062_MZB_LO_2361-22.05.2002","22.05.2002",2002,5,22,1.040490814,2
"ENG_062_MZB_LO_2361","ENG_062_MZB_LO_2361-29.05.2003","29.05.2003",2003,5,29,1.021051895,2
"ENG_062_MZB_LO_2361","ENG_062_MZB_LO_2361-19.04.2004","19.04.2004",2004,4,19,0.853087462,5
"ENG_062_MZB_LO_2361","ENG_062_MZB_LO_2361-26.04.2005","26.04.2005",2005,4,26,1.010969153,3
"ENG_062_MZB_LO_2361","ENG_062_MZB_LO_2361-19.04.2006","19.04.2006",2006,4,19,1.039385816,1
"ENG_062_MZB_LO_2361","ENG_062_MZB_LO_2361-21.05.2007","21.05.2007",2007,5,21,0.995220315,1
"ENG_062_MZB_LO_2361","ENG_062_MZB_LO_2361-07.03.2019","07.03.2019",2019,3,7,1.014969491,5
"ENG_062_MZB_LO_2361","ENG_062_MZB_LO_2361-26.05.2021","26.05.2021",2021,5,26,0.913762034,5
"ENG_062_MZB_LO_2362","ENG_062_MZB_LO_2362-28.10.2002","28.10.2002",2002,10,28,1.221070659,2
"ENG_062_MZB_LO_2362","ENG_062_MZB_LO_2362-02.09.2003","02.09.2003",2003,9,2,1.172442907,1
"ENG_062_MZB_LO_2362","ENG_062_MZB_LO_2362-23.09.2004","23.09.2004",2004,9,23,1.146953124,1
"ENG_062_MZB_LO_2362","ENG_062_MZB_LO_2362-17.10.2005","17.10.2005",2005,10,17,1.220008075,1
"ENG_062_MZB_LO_2362","ENG_062_MZB_LO_2362-30.11.2006","30.11.2006",2006,11,30,1.285167823,1
"ENG_062_MZB_LO_2362","ENG_062_MZB_LO_2362-26.09.2007","26.09.2007",2007,9,26,1.15414044,3
"ENG_062_MZB_LO_2362","ENG_062_MZB_LO_2362-13.10.2009","13.10.2009",2009,10,13,1.159521254,1
"ENG_062_MZB_LO_2362","ENG_062_MZB_LO_2362-11.10.2010","11.10.2010",2010,10,11,1.183888963,1
"ENG_062_MZB_LO_2362","ENG_062_MZB_LO_2362-03.10.2011","03.10.2011",2011,10,3,1.138295123,2
"ENG_062_MZB_LO_2362","ENG_062_MZB_LO_2362-21.11.2012","21.11.2012",2012,11,21,1.192138739,1
"ENG_062_MZB_LO_2362","ENG_062_MZB_LO_2362-17.10.2013","17.10.2013",2013,10,17,1.110620602,1
"ENG_062_MZB_LO_2362","ENG_062_MZB_LO_2362-02.10.2014","02.10.2014",2014,10,2,1.135406563,2
"ENG_062_MZB_LO_2362","ENG_062_MZB_LO_2362-22.09.2015","22.09.2015",2015,9,22,1.092618593,2
"ENG_062_MZB_LO_2362","ENG_062_MZB_LO_2362-28.09.2016","28.09.2016",2016,9,28,1.182849463,1
"ENG_062_MZB_LO_2362","ENG_062_MZB_LO_2362-09.10.2017","09.10.2017",2017,10,9,1.14280409,1
"ENG_062_MZB_LO_2362","ENG_062_MZB_LO_2362-21.09.2018","21.09.2018",2018,9,21,1.190548444,1
"ENG_062_MZB_LO_2362","ENG_062_MZB_LO_2362-07.10.2019","07.10.2019",2019,10,7,1.190495289,1
"ENG_062_MZB_LO_2362","ENG_062_MZB_LO_2362-23.09.2020","23.09.2020",2020,9,23,1.185120808,2
"ENG_062_MZB_LO_2362","ENG_062_MZB_LO_2362-20.10.2021","20.10.2021",2021,10,20,1.230351814,1
"ENG_062_MZB_LO_2362","ENG_062_MZB_LO_2362-27.09.2022","27.09.2022",2022,9,27,1.151553267,1
"ENG_062_MZB_LO_2362","ENG_062_MZB_LO_2362-19.09.2023","19.09.2023",2023,9,19,1.312606324,1
"ENG_062_MZB_LO_2363","ENG_062_MZB_LO_2363-04.09.2002","04.09.2002",2002,9,4,1.094888244,1
"ENG_062_MZB_LO_2363","ENG_062_MZB_LO_2363-29.09.2003","29.09.2003",2003,9,29,0.994357987,1
"ENG_062_MZB_LO_2363","ENG_062_MZB_LO_2363-26.10.2004","26.10.2004",2004,10,26,1.000768745,1
"ENG_062_MZB_LO_2363","ENG_062_MZB_LO_2363-21.11.2006","21.11.2006",2006,11,21,1.064713546,1
"ENG_062_MZB_LO_2363","ENG_062_MZB_LO_2363-24.09.2007","24.09.2007",2007,9,24,1.028929563,1
"ENG_062_MZB_LO_2363","ENG_062_MZB_LO_2363-04.11.2008","04.11.2008",2008,11,4,1.090046806,1
"ENG_062_MZB_LO_2363","ENG_062_MZB_LO_2363-21.09.2009","21.09.2009",2009,9,21,1.069814379,1
"ENG_062_MZB_LO_2363","ENG_062_MZB_LO_2363-10.11.2010","10.11.2010",2010,11,10,1.01349447,1
"ENG_062_MZB_LO_2363","ENG_062_MZB_LO_2363-03.11.2011","03.11.2011",2011,11,3,0.990589719,1
"ENG_062_MZB_LO_2363","ENG_062_MZB_LO_2363-29.10.2013","29.10.2013",2013,10,29,0.948888435,2
"ENG_062_MZB_LO_2363","ENG_062_MZB_LO_2363-30.09.2014","30.09.2014",2014,9,30,1.035344041,1
"ENG_062_MZB_LO_2363","ENG_062_MZB_LO_2363-07.10.2015","07.10.2015",2015,10,7,1.065411332,1
"ENG_062_MZB_LO_2363","ENG_062_MZB_LO_2363-28.09.2016","28.09.2016",2016,9,28,1.092972709,1
"ENG_062_MZB_LO_2363","ENG_062_MZB_LO_2363-09.10.2017","09.10.2017",2017,10,9,0.898083611,2
"ENG_062_MZB_LO_2363","ENG_062_MZB_LO_2363-12.09.2018","12.09.2018",2018,9,12,1.071502476,1
"ENG_062_MZB_LO_2363","ENG_062_MZB_LO_2363-07.10.2019","07.10.2019",2019,10,7,0.975453665,1
"ENG_062_MZB_LO_2363","ENG_062_MZB_LO_2363-23.09.2020","23.09.2020",2020,9,23,1.004815509,1
"ENG_062_MZB_LO_2363","ENG_062_MZB_LO_2363-25.10.2021","25.10.2021",2021,10,25,1.051665743,1
"ENG_062_MZB_LO_2363","ENG_062_MZB_LO_2363-27.09.2022","27.09.2022",2022,9,27,0.969885858,1
"ENG_062_MZB_LO_2363","ENG_062_MZB_LO_2363-25.09.2023","25.09.2023",2023,9,25,1.01801766,1
"ENG_062_MZB_LO_2364","ENG_062_MZB_LO_2364-04.09.2002","04.09.2002",2002,9,4,0.964632912,2
"ENG_062_MZB_LO_2364","ENG_062_MZB_LO_2364-29.09.2003","29.09.2003",2003,9,29,0.935845482,2
"ENG_062_MZB_LO_2364","ENG_062_MZB_LO_2364-26.10.2004","26.10.2004",2004,10,26,0.899397005,3
"ENG_062_MZB_LO_2364","ENG_062_MZB_LO_2364-21.11.2006","21.11.2006",2006,11,21,0.917190488,2
"ENG_062_MZB_LO_2364","ENG_062_MZB_LO_2364-24.09.2007","24.09.2007",2007,9,24,0.987740001,2
"ENG_062_MZB_LO_2364","ENG_062_MZB_LO_2364-17.11.2008","17.11.2008",2008,11,17,0.917882031,3
"ENG_062_MZB_LO_2364","ENG_062_MZB_LO_2364-21.09.2009","21.09.2009",2009,9,21,0.964329219,3
"ENG_062_MZB_LO_2364","ENG_062_MZB_LO_2364-10.11.2010","10.11.2010",2010,11,10,0.873575686,3
"ENG_062_MZB_LO_2364","ENG_062_MZB_LO_2364-03.11.2011","03.11.2011",2011,11,3,0.960289054,2
"ENG_062_MZB_LO_2364","ENG_062_MZB_LO_2364-26.09.2013","26.09.2013",2013,9,26,0.983522511,1
"ENG_062_MZB_LO_2364","ENG_062_MZB_LO_2364-15.09.2014","15.09.2014",2014,9,15,0.844521247,3
"ENG_062_MZB_LO_2364","ENG_062_MZB_LO_2364-07.09.2015","07.09.2015",2015,9,7,0.917449854,2
"ENG_062_MZB_LO_2364","ENG_062_MZB_LO_2364-17.10.2016","17.10.2016",2016,10,17,0.935131889,2
"ENG_062_MZB_LO_2364","ENG_062_MZB_LO_2364-19.09.2017","19.09.2017",2017,9,19,0.827850377,3
"ENG_062_MZB_LO_2364","ENG_062_MZB_LO_2364-18.09.2018","18.09.2018",2018,9,18,0.973394126,2
"ENG_062_MZB_LO_2364","ENG_062_MZB_LO_2364-23.10.2019","23.10.2019",2019,10,23,1.007535568,1
"ENG_062_MZB_LO_2364","ENG_062_MZB_LO_2364-23.09.2020","23.09.2020",2020,9,23,1.009543571,2
"ENG_062_MZB_LO_2365","ENG_062_MZB_LO_2365-04.09.2002","04.09.2002",2002,9,4,0.777597034,3
"ENG_062_MZB_LO_2365","ENG_062_MZB_LO_2365-29.09.2003","29.09.2003",2003,9,29,0.790968361,3
"ENG_062_MZB_LO_2365","ENG_062_MZB_LO_2365-29.11.2005","29.11.2005",2005,11,29,0.779450219,3
"ENG_062_MZB_LO_2365","ENG_062_MZB_LO_2365-21.11.2006","21.11.2006",2006,11,21,0.867464298,3
"ENG_062_MZB_LO_2365","ENG_062_MZB_LO_2365-24.09.2007","24.09.2007",2007,9,24,0.83976629,3
"ENG_062_MZB_LO_2365","ENG_062_MZB_LO_2365-24.11.2008","24.11.2008",2008,11,24,0.968776466,3
"ENG_062_MZB_LO_2365","ENG_062_MZB_LO_2365-20.11.2012","20.11.2012",2012,11,20,0.897028062,2
"ENG_062_MZB_LO_2365","ENG_062_MZB_LO_2365-18.09.2013","18.09.2013",2013,9,18,0.796066471,3
"ENG_062_MZB_LO_2365","ENG_062_MZB_LO_2365-15.09.2014","15.09.2014",2014,9,15,0.867337367,3
"ENG_062_MZB_LO_2365","ENG_062_MZB_LO_2365-24.09.2015","24.09.2015",2015,9,24,0.816489784,3
"ENG_062_MZB_LO_2365","ENG_062_MZB_LO_2365-15.09.2016","15.09.2016",2016,9,15,0.887479776,2
"ENG_062_MZB_LO_2365","ENG_062_MZB_LO_2365-20.10.2017","20.10.2017",2017,10,20,0.879731174,3
"ENG_062_MZB_LO_2365","ENG_062_MZB_LO_2365-23.10.2019","23.10.2019",2019,10,23,0.752896946,4
"ENG_062_MZB_LO_2365","ENG_062_MZB_LO_2365-23.09.2020","23.09.2020",2020,9,23,0.909748951,2
"ENG_062_MZB_LO_2365","ENG_062_MZB_LO_2365-15.11.2021","15.11.2021",2021,11,15,0.867592423,3
"ENG_062_MZB_LO_2365","ENG_062_MZB_LO_2365-13.09.2022","13.09.2022",2022,9,13,0.837033319,4
"ENG_062_MZB_LO_2366","ENG_062_MZB_LO_2366-04.09.2002","04.09.2002",2002,9,4,0.961586896,2
"ENG_062_MZB_LO_2366","ENG_062_MZB_LO_2366-29.09.2003","29.09.2003",2003,9,29,1.020953496,1
"ENG_062_MZB_LO_2366","ENG_062_MZB_LO_2366-26.10.2004","26.10.2004",2004,10,26,0.938711171,2
"ENG_062_MZB_LO_2366","ENG_062_MZB_LO_2366-21.11.2006","21.11.2006",2006,11,21,0.956437382,2
"ENG_062_MZB_LO_2366","ENG_062_MZB_LO_2366-24.09.2007","24.09.2007",2007,9,24,0.912612087,2
"ENG_062_MZB_LO_2366","ENG_062_MZB_LO_2366-01.10.2013","01.10.2013",2013,10,1,0.910341267,2
"ENG_062_MZB_LO_2366","ENG_062_MZB_LO_2366-08.10.2014","08.10.2014",2014,10,8,1.009025161,3
"ENG_062_MZB_LO_2366","ENG_062_MZB_LO_2366-24.10.2016","24.10.2016",2016,10,24,0.973811297,4
"ENG_062_MZB_LO_2366","ENG_062_MZB_LO_2366-25.09.2017","25.09.2017",2017,9,25,0.937734773,2
"ENG_062_MZB_LO_2366","ENG_062_MZB_LO_2366-11.09.2019","11.09.2019",2019,9,11,1.061263042,2
"ENG_062_MZB_LO_2366","ENG_062_MZB_LO_2366-22.09.2020","22.09.2020",2020,9,22,0.93318393,2
"ENG_062_MZB_LO_2366","ENG_062_MZB_LO_2366-18.10.2022","18.10.2022",2022,10,18,1.05923723,2
"ENG_062_MZB_LO_2366","ENG_062_MZB_LO_2366-30.10.2024","30.10.2024",2024,10,30,0.957482558,2
"ENG_062_MZB_LO_2367","ENG_062_MZB_LO_2367-03.09.2002","03.09.2002",2002,9,3,0.916098293,2
"ENG_062_MZB_LO_2367","ENG_062_MZB_LO_2367-15.09.2003","15.09.2003",2003,9,15,0.981998159,1
"ENG_062_MZB_LO_2367","ENG_062_MZB_LO_2367-06.09.2004","06.09.2004",2004,9,6,0.987088382,1
"ENG_062_MZB_LO_2367","ENG_062_MZB_LO_2367-15.11.2005","15.11.2005",2005,11,15,0.989024951,2
"ENG_062_MZB_LO_2367","ENG_062_MZB_LO_2367-17.10.2006","17.10.2006",2006,10,17,1.103562303,1
"ENG_062_MZB_LO_2367","ENG_062_MZB_LO_2367-25.09.2007","25.09.2007",2007,9,25,0.965686497,2
"ENG_062_MZB_LO_2367","ENG_062_MZB_LO_2367-17.11.2008","17.11.2008",2008,11,17,1.080406038,1
"ENG_062_MZB_LO_2367","ENG_062_MZB_LO_2367-01.09.2009","01.09.2009",2009,9,1,1.107007118,1
"ENG_062_MZB_LO_2367","ENG_062_MZB_LO_2367-10.11.2010","10.11.2010",2010,11,10,1.040245462,3
"ENG_062_MZB_LO_2367","ENG_062_MZB_LO_2367-26.10.2011","26.10.2011",2011,10,26,1.086929571,2
"ENG_062_MZB_LO_2367","ENG_062_MZB_LO_2367-10.10.2013","10.10.2013",2013,10,10,1.142219855,1
"ENG_062_MZB_LO_2367","ENG_062_MZB_LO_2367-03.09.2014","03.09.2014",2014,9,3,1.061680381,2
"ENG_062_MZB_LO_2367","ENG_062_MZB_LO_2367-08.09.2015","08.09.2015",2015,9,8,1.076024823,1
"ENG_062_MZB_LO_2367","ENG_062_MZB_LO_2367-23.09.2016","23.09.2016",2016,9,23,0.978296048,2
"ENG_062_MZB_LO_2367","ENG_062_MZB_LO_2367-18.09.2017","18.09.2017",2017,9,18,1.110483743,1
"ENG_062_MZB_LO_2367","ENG_062_MZB_LO_2367-10.09.2018","10.09.2018",2018,9,10,1.092850885,1
"ENG_062_MZB_LO_2367","ENG_062_MZB_LO_2367-09.11.2020","09.11.2020",2020,11,9,1.083203742,1
"ENG_062_MZB_LO_2367","ENG_062_MZB_LO_2367-26.10.2022","26.10.2022",2022,10,26,1.130634311,3
"ENG_062_MZB_LO_2367","ENG_062_MZB_LO_2367-25.09.2023","25.09.2023",2023,9,25,1.057733571,4
"ENG_062_MZB_LO_2367","ENG_062_MZB_LO_2367-23.10.2024","23.10.2024",2024,10,23,1.074816486,3
"ENG_062_MZB_LO_2368","ENG_062_MZB_LO_2368-16.09.2002","16.09.2002",2002,9,16,0.943636355,2
"ENG_062_MZB_LO_2368","ENG_062_MZB_LO_2368-10.11.2003","10.11.2003",2003,11,10,0.990490508,2
"ENG_062_MZB_LO_2368","ENG_062_MZB_LO_2368-29.11.2004","29.11.2004",2004,11,29,0.945023541,2
"ENG_062_MZB_LO_2368","ENG_062_MZB_LO_2368-29.11.2005","29.11.2005",2005,11,29,0.979313475,1
"ENG_062_MZB_LO_2368","ENG_062_MZB_LO_2368-31.10.2006","31.10.2006",2006,10,31,0.931315336,2
"ENG_062_MZB_LO_2368","ENG_062_MZB_LO_2368-14.11.2007","14.11.2007",2007,11,14,0.946982181,2
"ENG_062_MZB_LO_2368","ENG_062_MZB_LO_2368-17.11.2009","17.11.2009",2009,11,17,0.941199879,2
"ENG_062_MZB_LO_2368","ENG_062_MZB_LO_2368-19.10.2010","19.10.2010",2010,10,19,0.90165946,2
"ENG_062_MZB_LO_2368","ENG_062_MZB_LO_2368-02.11.2011","02.11.2011",2011,11,2,0.92916527,2
"ENG_062_MZB_LO_2368","ENG_062_MZB_LO_2368-22.10.2012","22.10.2012",2012,10,22,0.977044907,2
"ENG_062_MZB_LO_2368","ENG_062_MZB_LO_2368-24.09.2013","24.09.2013",2013,9,24,0.959809635,2
"ENG_062_MZB_LO_2368","ENG_062_MZB_LO_2368-08.10.2014","08.10.2014",2014,10,8,0.952040813,2
"ENG_062_MZB_LO_2368","ENG_062_MZB_LO_2368-09.09.2015","09.09.2015",2015,9,9,1.034442466,1
"ENG_062_MZB_LO_2368","ENG_062_MZB_LO_2368-27.09.2016","27.09.2016",2016,9,27,0.989225486,1
"ENG_062_MZB_LO_2368","ENG_062_MZB_LO_2368-18.09.2017","18.09.2017",2017,9,18,0.993321981,1
"ENG_062_MZB_LO_2368","ENG_062_MZB_LO_2368-04.09.2018","04.09.2018",2018,9,4,0.934669197,2
"ENG_062_MZB_LO_2368","ENG_062_MZB_LO_2368-04.09.2019","04.09.2019",2019,9,4,0.9071878,2
"ENG_062_MZB_LO_2368","ENG_062_MZB_LO_2368-06.10.2020","06.10.2020",2020,10,6,0.984836727,3
"ENG_062_MZB_LO_2368","ENG_062_MZB_LO_2368-17.09.2021","17.09.2021",2021,9,17,0.949605786,2
"ENG_062_MZB_LO_2369","ENG_062_MZB_LO_2369-18.11.2002","18.11.2002",2002,11,18,0.892646633,3
"ENG_062_MZB_LO_2369","ENG_062_MZB_LO_2369-26.11.2003","26.11.2003",2003,11,26,0.92522671,2
"ENG_062_MZB_LO_2369","ENG_062_MZB_LO_2369-20.09.2004","20.09.2004",2004,9,20,0.951287476,2
"ENG_062_MZB_LO_2369","ENG_062_MZB_LO_2369-28.10.2005","28.10.2005",2005,10,28,0.998630199,1
"ENG_062_MZB_LO_2369","ENG_062_MZB_LO_2369-14.11.2006","14.11.2006",2006,11,14,0.977987386,1
"ENG_062_MZB_LO_2369","ENG_062_MZB_LO_2369-26.11.2007","26.11.2007",2007,11,26,0.947057434,2
"ENG_062_MZB_LO_2369","ENG_062_MZB_LO_2369-13.10.2008","13.10.2008",2008,10,13,0.936648852,2
"ENG_062_MZB_LO_2369","ENG_062_MZB_LO_2369-19.10.2009","19.10.2009",2009,10,19,0.956964407,2
"ENG_062_MZB_LO_2369","ENG_062_MZB_LO_2369-06.09.2010","06.09.2010",2010,9,6,0.909694697,2
"ENG_062_MZB_LO_2369","ENG_062_MZB_LO_2369-10.10.2011","10.10.2011",2011,10,10,0.92988817,2
"ENG_062_MZB_LO_2369","ENG_062_MZB_LO_2369-23.10.2012","23.10.2012",2012,10,23,1.09859646,3
"ENG_062_MZB_LO_2369","ENG_062_MZB_LO_2369-28.10.2013","28.10.2013",2013,10,28,0.9972035,2
"ENG_062_MZB_LO_2369","ENG_062_MZB_LO_2369-18.09.2014","18.09.2014",2014,9,18,0.957295926,2
"ENG_062_MZB_LO_2369","ENG_062_MZB_LO_2369-03.09.2015","03.09.2015",2015,9,3,0.955462565,2
"ENG_062_MZB_LO_2369","ENG_062_MZB_LO_2369-29.09.2016","29.09.2016",2016,9,29,0.924851372,2
"ENG_062_MZB_LO_2369","ENG_062_MZB_LO_2369-28.09.2017","28.09.2017",2017,9,28,0.945907448,2
"ENG_062_MZB_LO_2369","ENG_062_MZB_LO_2369-13.09.2018","13.09.2018",2018,9,13,0.985292342,2
"ENG_062_MZB_LO_2369","ENG_062_MZB_LO_2369-10.10.2019","10.10.2019",2019,10,10,0.999426788,1
"ENG_062_MZB_LO_2369","ENG_062_MZB_LO_2369-29.09.2020","29.09.2020",2020,9,29,0.981935395,1
"ENG_062_MZB_LO_2369","ENG_062_MZB_LO_2369-27.10.2021","27.10.2021",2021,10,27,0.910293418,2
"ENG_062_MZB_LO_2369","ENG_062_MZB_LO_2369-27.09.2022","27.09.2022",2022,9,27,0.849642182,3
"ENG_062_MZB_LO_2369","ENG_062_MZB_LO_2369-13.09.2023","13.09.2023",2023,9,13,0.931281057,2
"ENG_062_MZB_LO_2370","ENG_062_MZB_LO_2370-16.09.2002","16.09.2002",2002,9,16,0.873743656,2
"ENG_062_MZB_LO_2370","ENG_062_MZB_LO_2370-10.11.2003","10.11.2003",2003,11,10,0.821056991,3
"ENG_062_MZB_LO_2370","ENG_062_MZB_LO_2370-01.11.2004","01.11.2004",2004,11,1,0.940003264,2
"ENG_062_MZB_LO_2370","ENG_062_MZB_LO_2370-29.11.2005","29.11.2005",2005,11,29,0.942372293,2
"ENG_062_MZB_LO_2370","ENG_062_MZB_LO_2370-31.10.2006","31.10.2006",2006,10,31,0.84044148,3
"ENG_062_MZB_LO_2370","ENG_062_MZB_LO_2370-14.11.2007","14.11.2007",2007,11,14,0.869875218,2
"ENG_062_MZB_LO_2370","ENG_062_MZB_LO_2370-10.11.2008","10.11.2008",2008,11,10,0.948448075,2
"ENG_062_MZB_LO_2370","ENG_062_MZB_LO_2370-17.11.2009","17.11.2009",2009,11,17,0.861176325,3
"ENG_062_MZB_LO_2370","ENG_062_MZB_LO_2370-19.10.2010","19.10.2010",2010,10,19,0.9211216,2
"ENG_062_MZB_LO_2370","ENG_062_MZB_LO_2370-02.11.2011","02.11.2011",2011,11,2,0.823957815,3
"ENG_062_MZB_LO_2370","ENG_062_MZB_LO_2370-30.10.2012","30.10.2012",2012,10,30,0.822698349,3
"ENG_062_MZB_LO_2370","ENG_062_MZB_LO_2370-24.09.2013","24.09.2013",2013,9,24,0.906975853,2
"ENG_062_MZB_LO_2370","ENG_062_MZB_LO_2370-25.11.2014","25.11.2014",2014,11,25,0.840409124,3
"ENG_062_MZB_LO_2370","ENG_062_MZB_LO_2370-17.09.2015","17.09.2015",2015,9,17,0.848654355,3
"ENG_062_MZB_LO_2370","ENG_062_MZB_LO_2370-19.09.2016","19.09.2016",2016,9,19,0.927740038,2
"ENG_062_MZB_LO_2370","ENG_062_MZB_LO_2370-03.10.2017","03.10.2017",2017,10,3,0.781986709,3
"ENG_062_MZB_LO_2370","ENG_062_MZB_LO_2370-13.09.2018","13.09.2018",2018,9,13,0.913452071,2
"ENG_062_MZB_LO_2370","ENG_062_MZB_LO_2370-04.09.2019","04.09.2019",2019,9,4,0.730580266,3
"ENG_062_MZB_LO_2370","ENG_062_MZB_LO_2370-06.10.2020","06.10.2020",2020,10,6,0.774071527,3
"ENG_062_MZB_LO_2370","ENG_062_MZB_LO_2370-17.09.2021","17.09.2021",2021,9,17,0.989892229,2
"ENG_062_MZB_LO_2371","ENG_062_MZB_LO_2371-22.11.2002","22.11.2002",2002,11,22,1.006798101,1
"ENG_062_MZB_LO_2371","ENG_062_MZB_LO_2371-24.11.2003","24.11.2003",2003,11,24,0.927973386,2
"ENG_062_MZB_LO_2371","ENG_062_MZB_LO_2371-28.09.2004","28.09.2004",2004,9,28,0.993750088,1
"ENG_062_MZB_LO_2371","ENG_062_MZB_LO_2371-14.09.2005","14.09.2005",2005,9,14,0.989153303,1
"ENG_062_MZB_LO_2371","ENG_062_MZB_LO_2371-19.09.2006","19.09.2006",2006,9,19,0.988023455,1
"ENG_062_MZB_LO_2371","ENG_062_MZB_LO_2371-07.11.2007","07.11.2007",2007,11,7,1.009925126,1
"ENG_062_MZB_LO_2371","ENG_062_MZB_LO_2371-20.10.2008","20.10.2008",2008,10,20,1.055078932,1
"ENG_062_MZB_LO_2371","ENG_062_MZB_LO_2371-25.11.2009","25.11.2009",2009,11,25,0.939287472,2
"ENG_062_MZB_LO_2371","ENG_062_MZB_LO_2371-08.10.2011","08.10.2011",2011,10,8,1.069491008,1
"ENG_062_MZB_LO_2371","ENG_062_MZB_LO_2371-22.10.2012","22.10.2012",2012,10,22,0.982098734,1
"ENG_062_MZB_LO_2371","ENG_062_MZB_LO_2371-16.09.2013","16.09.2013",2013,9,16,0.98003779,1
"ENG_062_MZB_LO_2371","ENG_062_MZB_LO_2371-16.09.2015","16.09.2015",2015,9,16,0.970966712,1
"ENG_062_MZB_LO_2371","ENG_062_MZB_LO_2371-05.10.2016","05.10.2016",2016,10,5,0.972597802,1
"ENG_062_MZB_LO_2371","ENG_062_MZB_LO_2371-19.10.2017","19.10.2017",2017,10,19,1.057744705,1
"ENG_062_MZB_LO_2371","ENG_062_MZB_LO_2371-22.09.2021","22.09.2021",2021,9,22,1.010482639,1
"ENG_062_MZB_LO_2372","ENG_062_MZB_LO_2372-22.11.2002","22.11.2002",2002,11,22,0.9232326,2
"ENG_062_MZB_LO_2372","ENG_062_MZB_LO_2372-24.11.2003","24.11.2003",2003,11,24,0.924688324,3
"ENG_062_MZB_LO_2372","ENG_062_MZB_LO_2372-28.09.2004","28.09.2004",2004,9,28,0.987490399,1
"ENG_062_MZB_LO_2372","ENG_062_MZB_LO_2372-14.09.2005","14.09.2005",2005,9,14,0.975949127,1
"ENG_062_MZB_LO_2372","ENG_062_MZB_LO_2372-19.09.2006","19.09.2006",2006,9,19,0.931295296,5
"ENG_062_MZB_LO_2372","ENG_062_MZB_LO_2372-07.11.2007","07.11.2007",2007,11,7,1.007211791,1
"ENG_062_MZB_LO_2372","ENG_062_MZB_LO_2372-20.10.2008","20.10.2008",2008,10,20,0.957135388,1
"ENG_062_MZB_LO_2372","ENG_062_MZB_LO_2372-25.11.2009","25.11.2009",2009,11,25,0.91924771,2
"ENG_062_MZB_LO_2372","ENG_062_MZB_LO_2372-09.10.2011","09.10.2011",2011,10,9,0.954001844,5
"ENG_062_MZB_LO_2372","ENG_062_MZB_LO_2372-08.10.2012","08.10.2012",2012,10,8,1.113960417,1
"ENG_062_MZB_LO_2372","ENG_062_MZB_LO_2372-07.10.2013","07.10.2013",2013,10,7,1.03667799,1
"ENG_062_MZB_LO_2372","ENG_062_MZB_LO_2372-03.09.2019","03.09.2019",2019,9,3,0.981194083,1
"ENG_062_MZB_LO_2372","ENG_062_MZB_LO_2372-22.09.2021","22.09.2021",2021,9,22,1.028322911,2
"ENG_062_MZB_LO_2377","ENG_062_MZB_LO_2377-28.10.2002","28.10.2002",2002,10,28,0.825622605,5
"ENG_062_MZB_LO_2377","ENG_062_MZB_LO_2377-22.09.2003","22.09.2003",2003,9,22,0.739273507,4
"ENG_062_MZB_LO_2377","ENG_062_MZB_LO_2377-26.10.2004","26.10.2004",2004,10,26,0.809939828,3
"ENG_062_MZB_LO_2377","ENG_062_MZB_LO_2377-07.11.2005","07.11.2005",2005,11,7,0.796250702,3
"ENG_062_MZB_LO_2377","ENG_062_MZB_LO_2377-09.10.2006","09.10.2006",2006,10,9,0.794320987,4
"ENG_062_MZB_LO_2377","ENG_062_MZB_LO_2377-28.11.2007","28.11.2007",2007,11,28,0.805747663,3
"ENG_062_MZB_LO_2377","ENG_062_MZB_LO_2377-10.11.2008","10.11.2008",2008,11,10,0.864020325,3
"ENG_062_MZB_LO_2377","ENG_062_MZB_LO_2377-29.09.2009","29.09.2009",2009,9,29,0.812106526,3
"ENG_062_MZB_LO_2377","ENG_062_MZB_LO_2377-18.11.2010","18.11.2010",2010,11,18,0.841544768,3
"ENG_062_MZB_LO_2377","ENG_062_MZB_LO_2377-18.10.2011","18.10.2011",2011,10,18,0.771706211,3
"ENG_062_MZB_LO_2377","ENG_062_MZB_LO_2377-16.10.2012","16.10.2012",2012,10,16,0.752017317,3
"ENG_062_MZB_LO_2377","ENG_062_MZB_LO_2377-16.09.2013","16.09.2013",2013,9,16,0.706284616,4
"ENG_062_MZB_LO_2377","ENG_062_MZB_LO_2377-27.11.2014","27.11.2014",2014,11,27,0.760521956,3
"ENG_062_MZB_LO_2377","ENG_062_MZB_LO_2377-14.09.2015","14.09.2015",2015,9,14,0.697377612,4
"ENG_062_MZB_LO_2377","ENG_062_MZB_LO_2377-24.10.2016","24.10.2016",2016,10,24,0.724350027,4
"ENG_062_MZB_LO_2377","ENG_062_MZB_LO_2377-19.10.2017","19.10.2017",2017,10,19,0.798453303,3
"ENG_062_MZB_LO_2377","ENG_062_MZB_LO_2377-26.09.2018","26.09.2018",2018,9,26,0.813960818,3
"ENG_062_MZB_LO_2377","ENG_062_MZB_LO_2377-04.09.2019","04.09.2019",2019,9,4,0.789966559,5
"ENG_062_MZB_LO_2377","ENG_062_MZB_LO_2377-09.11.2020","09.11.2020",2020,11,9,0.744420194,3
"ENG_062_MZB_LO_2377","ENG_062_MZB_LO_2377-27.10.2021","27.10.2021",2021,10,27,0.839463029,3
"ENG_062_MZB_LO_2377","ENG_062_MZB_LO_2377-18.10.2022","18.10.2022",2022,10,18,0.758365689,4
"ENG_062_MZB_LO_2378","ENG_062_MZB_LO_2378-16.09.2002","16.09.2002",2002,9,16,0.738880749,3
"ENG_062_MZB_LO_2378","ENG_062_MZB_LO_2378-05.11.2003","05.11.2003",2003,11,5,0.793901489,3
"ENG_062_MZB_LO_2378","ENG_062_MZB_LO_2378-01.11.2004","01.11.2004",2004,11,1,0.7496754,3
"ENG_062_MZB_LO_2378","ENG_062_MZB_LO_2378-29.11.2005","29.11.2005",2005,11,29,0.758857829,3
"ENG_062_MZB_LO_2378","ENG_062_MZB_LO_2378-31.10.2006","31.10.2006",2006,10,31,0.772514684,3
"ENG_062_MZB_LO_2378","ENG_062_MZB_LO_2378-14.11.2007","14.11.2007",2007,11,14,0.746504949,3
"ENG_062_MZB_LO_2378","ENG_062_MZB_LO_2378-20.10.2008","20.10.2008",2008,10,20,0.827649013,3
"ENG_062_MZB_LO_2378","ENG_062_MZB_LO_2378-17.11.2009","17.11.2009",2009,11,17,0.79440735,3
"ENG_062_MZB_LO_2378","ENG_062_MZB_LO_2378-19.10.2010","19.10.2010",2010,10,19,0.793649483,3
"ENG_062_MZB_LO_2378","ENG_062_MZB_LO_2378-02.11.2011","02.11.2011",2011,11,2,0.841373627,3
"ENG_062_MZB_LO_2378","ENG_062_MZB_LO_2378-12.09.2013","12.09.2013",2013,9,12,0.869502855,3
"ENG_062_MZB_LO_2378","ENG_062_MZB_LO_2378-22.10.2014","22.10.2014",2014,10,22,0.886653963,3
"ENG_062_MZB_LO_2378","ENG_062_MZB_LO_2378-14.09.2015","14.09.2015",2015,9,14,0.887125198,2
"ENG_062_MZB_LO_2378","ENG_062_MZB_LO_2378-22.09.2016","22.09.2016",2016,9,22,0.788078783,3
"ENG_062_MZB_LO_2378","ENG_062_MZB_LO_2378-18.09.2017","18.09.2017",2017,9,18,0.882742627,2
"ENG_062_MZB_LO_2378","ENG_062_MZB_LO_2378-14.09.2018","14.09.2018",2018,9,14,0.802747435,3
"ENG_062_MZB_LO_2378","ENG_062_MZB_LO_2378-25.09.2020","25.09.2020",2020,9,25,0.835969015,3
"ENG_062_MZB_LO_2378","ENG_062_MZB_LO_2378-15.10.2021","15.10.2021",2021,10,15,0.873545861,2
"ENG_062_MZB_LO_2378","ENG_062_MZB_LO_2378-20.09.2022","20.09.2022",2022,9,20,0.852131153,3
"ENG_062_MZB_LO_2379","ENG_062_MZB_LO_2379-16.09.2002","16.09.2002",2002,9,16,0.747111344,3
"ENG_062_MZB_LO_2379","ENG_062_MZB_LO_2379-05.11.2003","05.11.2003",2003,11,5,0.75021797,3
"ENG_062_MZB_LO_2379","ENG_062_MZB_LO_2379-01.11.2004","01.11.2004",2004,11,1,0.812768249,3
"ENG_062_MZB_LO_2379","ENG_062_MZB_LO_2379-29.11.2005","29.11.2005",2005,11,29,0.748647168,3
"ENG_062_MZB_LO_2379","ENG_062_MZB_LO_2379-31.10.2006","31.10.2006",2006,10,31,0.767099543,3
"ENG_062_MZB_LO_2379","ENG_062_MZB_LO_2379-24.09.2013","24.09.2013",2013,9,24,0.828787234,3
"ENG_062_MZB_LO_2379","ENG_062_MZB_LO_2379-09.09.2015","09.09.2015",2015,9,9,0.80330804,3
"ENG_062_MZB_LO_2379","ENG_062_MZB_LO_2379-17.09.2018","17.09.2018",2018,9,17,0.911569377,2
"ENG_062_MZB_LO_2379","ENG_062_MZB_LO_2379-17.09.2019","17.09.2019",2019,9,17,0.733395483,3
"ENG_062_MZB_LO_2379","ENG_062_MZB_LO_2379-18.09.2020","18.09.2020",2020,9,18,0.82106609,3
"ENG_062_MZB_LO_2379","ENG_062_MZB_LO_2379-21.09.2021","21.09.2021",2021,9,21,0.893510923,2
"ENG_062_MZB_LO_2379","ENG_062_MZB_LO_2379-16.11.2022","16.11.2022",2022,11,16,0.768403915,3
"ENG_062_MZB_LO_2379","ENG_062_MZB_LO_2379-10.10.2023","10.10.2023",2023,10,10,0.801429094,3
"ENG_062_MZB_LO_2380","ENG_062_MZB_LO_2380-14.10.2002","14.10.2002",2002,10,14,0.902294812,2
"ENG_062_MZB_LO_2380","ENG_062_MZB_LO_2380-17.11.2003","17.11.2003",2003,11,17,0.916946972,2
"ENG_062_MZB_LO_2380","ENG_062_MZB_LO_2380-13.10.2004","13.10.2004",2004,10,13,0.916024656,2
"ENG_062_MZB_LO_2380","ENG_062_MZB_LO_2380-07.11.2005","07.11.2005",2005,11,7,0.899666312,2
"ENG_062_MZB_LO_2380","ENG_062_MZB_LO_2380-15.11.2006","15.11.2006",2006,11,15,0.772734134,3
"ENG_062_MZB_LO_2380","ENG_062_MZB_LO_2380-01.11.2007","01.11.2007",2007,11,1,0.888826273,2
"ENG_062_MZB_LO_2380","ENG_062_MZB_LO_2380-12.11.2008","12.11.2008",2008,11,12,0.831456248,3
"ENG_062_MZB_LO_2380","ENG_062_MZB_LO_2380-09.09.2009","09.09.2009",2009,9,9,0.918966401,2
"ENG_062_MZB_LO_2380","ENG_062_MZB_LO_2380-20.09.2010","20.09.2010",2010,9,20,0.912197653,2
"ENG_062_MZB_LO_2380","ENG_062_MZB_LO_2380-15.11.2011","15.11.2011",2011,11,15,0.793046981,3
"ENG_062_MZB_LO_2380","ENG_062_MZB_LO_2380-24.10.2012","24.10.2012",2012,10,24,0.948806635,2
"ENG_062_MZB_LO_2380","ENG_062_MZB_LO_2380-26.09.2013","26.09.2013",2013,9,26,0.877967629,2
"ENG_062_MZB_LO_2381","ENG_062_MZB_LO_2381-27.11.2002","27.11.2002",2002,11,27,1.063411755,1
"ENG_062_MZB_LO_2381","ENG_062_MZB_LO_2381-14.10.2003","14.10.2003",2003,10,14,1.044196943,1
"ENG_062_MZB_LO_2381","ENG_062_MZB_LO_2381-05.10.2004","05.10.2004",2004,10,5,1.018608488,1
"ENG_062_MZB_LO_2381","ENG_062_MZB_LO_2381-18.10.2005","18.10.2005",2005,10,18,1.050755797,1
"ENG_062_MZB_LO_2381","ENG_062_MZB_LO_2381-21.11.2006","21.11.2006",2006,11,21,1.009989726,1
"ENG_062_MZB_LO_2381","ENG_062_MZB_LO_2381-03.10.2007","03.10.2007",2007,10,3,1.023350993,1
"ENG_062_MZB_LO_2381","ENG_062_MZB_LO_2381-14.09.2009","14.09.2009",2009,9,14,1.03432092,1
"ENG_062_MZB_LO_2381","ENG_062_MZB_LO_2381-16.09.2013","16.09.2013",2013,9,16,1.027086559,1
"ENG_062_MZB_LO_2382","ENG_062_MZB_LO_2382-27.11.2002","27.11.2002",2002,11,27,0.919621535,3
"ENG_062_MZB_LO_2382","ENG_062_MZB_LO_2382-14.10.2003","14.10.2003",2003,10,14,0.957154408,1
"ENG_062_MZB_LO_2382","ENG_062_MZB_LO_2382-05.10.2004","05.10.2004",2004,10,5,0.999304995,1
"ENG_062_MZB_LO_2382","ENG_062_MZB_LO_2382-18.10.2005","18.10.2005",2005,10,18,1.075065066,1
"ENG_062_MZB_LO_2382","ENG_062_MZB_LO_2382-21.11.2006","21.11.2006",2006,11,21,1.04999453,1
"ENG_062_MZB_LO_2382","ENG_062_MZB_LO_2382-03.10.2007","03.10.2007",2007,10,3,1.009922108,1
"ENG_062_MZB_LO_2382","ENG_062_MZB_LO_2382-04.11.2008","04.11.2008",2008,11,4,1.021158469,1
"ENG_062_MZB_LO_2382","ENG_062_MZB_LO_2382-14.09.2009","14.09.2009",2009,9,14,0.997656456,2
"ENG_062_MZB_LO_2382","ENG_062_MZB_LO_2382-11.10.2010","11.10.2010",2010,10,11,0.988837378,1
"ENG_062_MZB_LO_2382","ENG_062_MZB_LO_2382-22.11.2011","22.11.2011",2011,11,22,0.894663386,3
"ENG_062_MZB_LO_2382","ENG_062_MZB_LO_2382-24.09.2012","24.09.2012",2012,9,24,1.024665053,2
"ENG_062_MZB_LO_2382","ENG_062_MZB_LO_2382-11.09.2014","11.09.2014",2014,9,11,1.016103317,1
"ENG_062_MZB_LO_2382","ENG_062_MZB_LO_2382-21.10.2016","21.10.2016",2016,10,21,0.971541271,2
"ENG_062_MZB_LO_2382","ENG_062_MZB_LO_2382-28.09.2017","28.09.2017",2017,9,28,0.945076131,2
"ENG_062_MZB_LO_2382","ENG_062_MZB_LO_2382-11.09.2018","11.09.2018",2018,9,11,0.947033125,2
"ENG_062_MZB_LO_2382","ENG_062_MZB_LO_2382-22.10.2019","22.10.2019",2019,10,22,1.007632597,1
"ENG_062_MZB_LO_2382","ENG_062_MZB_LO_2382-28.09.2020","28.09.2020",2020,9,28,0.990818626,1
"ENG_062_MZB_LO_2384","ENG_062_MZB_LO_2384-22.11.2002","22.11.2002",2002,11,22,0.822320608,3
"ENG_062_MZB_LO_2384","ENG_062_MZB_LO_2384-24.11.2003","24.11.2003",2003,11,24,0.960506895,4
"ENG_062_MZB_LO_2384","ENG_062_MZB_LO_2384-30.11.2004","30.11.2004",2004,11,30,0.896411655,2
"ENG_062_MZB_LO_2384","ENG_062_MZB_LO_2384-14.09.2005","14.09.2005",2005,9,14,0.870377257,3
"ENG_062_MZB_LO_2384","ENG_062_MZB_LO_2384-26.09.2006","26.09.2006",2006,9,26,0.910446167,3
"ENG_062_MZB_LO_2384","ENG_062_MZB_LO_2384-07.11.2007","07.11.2007",2007,11,7,0.926032706,3
"ENG_062_MZB_LO_2384","ENG_062_MZB_LO_2384-25.11.2009","25.11.2009",2009,11,25,0.776903082,4
"ENG_062_MZB_LO_2384","ENG_062_MZB_LO_2384-25.10.2010","25.10.2010",2010,10,25,0.772534206,3
"ENG_062_MZB_LO_2384","ENG_062_MZB_LO_2384-08.11.2011","08.11.2011",2011,11,8,0.78866657,4
"ENG_062_MZB_LO_2384","ENG_062_MZB_LO_2384-28.10.2015","28.10.2015",2015,10,28,0.806518845,4
"ENG_062_MZB_LO_2384","ENG_062_MZB_LO_2384-11.10.2016","11.10.2016",2016,10,11,0.856495953,3
"ENG_062_MZB_LO_2384","ENG_062_MZB_LO_2384-27.09.2017","27.09.2017",2017,9,27,0.737176044,4
"ENG_062_MZB_LO_2386","ENG_062_MZB_LO_2386-28.10.2002","28.10.2002",2002,10,28,0.982021378,2
"ENG_062_MZB_LO_2386","ENG_062_MZB_LO_2386-02.09.2003","02.09.2003",2003,9,2,1.032828594,2
"ENG_062_MZB_LO_2386","ENG_062_MZB_LO_2386-23.09.2004","23.09.2004",2004,9,23,0.942693434,2
"ENG_062_MZB_LO_2386","ENG_062_MZB_LO_2386-17.10.2005","17.10.2005",2005,10,17,0.944272981,2
"ENG_062_MZB_LO_2386","ENG_062_MZB_LO_2386-30.11.2006","30.11.2006",2006,11,30,1.038351758,2
"ENG_062_MZB_LO_2386","ENG_062_MZB_LO_2386-26.09.2007","26.09.2007",2007,9,26,1.05266165,2
"ENG_062_MZB_LO_2386","ENG_062_MZB_LO_2386-13.10.2009","13.10.2009",2009,10,13,1.056335683,1
"ENG_062_MZB_LO_2386","ENG_062_MZB_LO_2386-11.10.2010","11.10.2010",2010,10,11,1.025784907,2
"ENG_062_MZB_LO_2386","ENG_062_MZB_LO_2386-03.10.2011","03.10.2011",2011,10,3,1.074526932,1
"ENG_062_MZB_LO_2386","ENG_062_MZB_LO_2386-29.10.2013","29.10.2013",2013,10,29,0.818098933,3
"ENG_062_MZB_LO_2386","ENG_062_MZB_LO_2386-14.09.2015","14.09.2015",2015,9,14,0.946080486,2
"ENG_062_MZB_LO_2386","ENG_062_MZB_LO_2386-28.09.2016","28.09.2016",2016,9,28,0.797461274,3
"ENG_062_MZB_LO_2386","ENG_062_MZB_LO_2386-09.10.2017","09.10.2017",2017,10,9,0.917681587,2
"ENG_062_MZB_LO_2386","ENG_062_MZB_LO_2386-25.09.2018","25.09.2018",2018,9,25,0.95003426,2
"ENG_062_MZB_LO_2386","ENG_062_MZB_LO_2386-07.10.2019","07.10.2019",2019,10,7,0.889782594,3
"ENG_062_MZB_LO_2386","ENG_062_MZB_LO_2386-29.09.2020","29.09.2020",2020,9,29,0.884346662,3
"ENG_062_MZB_LO_2386","ENG_062_MZB_LO_2386-20.10.2021","20.10.2021",2021,10,20,0.938424927,2
"ENG_062_MZB_LO_2386","ENG_062_MZB_LO_2386-10.10.2022","10.10.2022",2022,10,10,0.951846411,2
"ENG_062_MZB_LO_2386","ENG_062_MZB_LO_2386-13.09.2023","13.09.2023",2023,9,13,1.032550159,1
"ENG_062_MZB_LO_2386","ENG_062_MZB_LO_2386-28.10.2024","28.10.2024",2024,10,28,0.807461987,3
"ENG_062_MZB_LO_2387","ENG_062_MZB_LO_2387-28.10.2002","28.10.2002",2002,10,28,1.098520114,1
"ENG_062_MZB_LO_2387","ENG_062_MZB_LO_2387-02.09.2003","02.09.2003",2003,9,2,1.040586265,1
"ENG_062_MZB_LO_2387","ENG_062_MZB_LO_2387-23.09.2004","23.09.2004",2004,9,23,0.889900893,2
"ENG_062_MZB_LO_2387","ENG_062_MZB_LO_2387-17.10.2005","17.10.2005",2005,10,17,0.911041166,2
"ENG_062_MZB_LO_2387","ENG_062_MZB_LO_2387-30.11.2006","30.11.2006",2006,11,30,1.106771172,1
"ENG_062_MZB_LO_2387","ENG_062_MZB_LO_2387-26.09.2007","26.09.2007",2007,9,26,1.089195423,2
"ENG_062_MZB_LO_2387","ENG_062_MZB_LO_2387-13.10.2009","13.10.2009",2009,10,13,0.989342194,1
"ENG_062_MZB_LO_2387","ENG_062_MZB_LO_2387-11.10.2010","11.10.2010",2010,10,11,1.135671313,1
"ENG_062_MZB_LO_2387","ENG_062_MZB_LO_2387-03.10.2011","03.10.2011",2011,10,3,0.971618406,2
"ENG_062_MZB_LO_2387","ENG_062_MZB_LO_2387-21.11.2012","21.11.2012",2012,11,21,0.949264259,2
"ENG_062_MZB_LO_2387","ENG_062_MZB_LO_2387-17.10.2013","17.10.2013",2013,10,17,0.953695989,2
"ENG_062_MZB_LO_2387","ENG_062_MZB_LO_2387-22.09.2015","22.09.2015",2015,9,22,0.991825279,1
"ENG_062_MZB_LO_2387","ENG_062_MZB_LO_2387-27.09.2016","27.09.2016",2016,9,27,0.838475579,3
"ENG_062_MZB_LO_2387","ENG_062_MZB_LO_2387-21.09.2017","21.09.2017",2017,9,21,0.91960539,2
"ENG_062_MZB_LO_2387","ENG_062_MZB_LO_2387-25.09.2018","25.09.2018",2018,9,25,0.996611494,2
"ENG_062_MZB_LO_2387","ENG_062_MZB_LO_2387-29.09.2020","29.09.2020",2020,9,29,0.99963819,2
"ENG_062_MZB_LO_2387","ENG_062_MZB_LO_2387-20.10.2021","20.10.2021",2021,10,20,1.025500906,1
"ENG_062_MZB_LO_2387","ENG_062_MZB_LO_2387-10.10.2022","10.10.2022",2022,10,10,1.122236104,1
"ENG_062_MZB_LO_2387","ENG_062_MZB_LO_2387-13.09.2023","13.09.2023",2023,9,13,1.047346723,3
"ENG_062_MZB_LO_2387","ENG_062_MZB_LO_2387-28.10.2024","28.10.2024",2024,10,28,1.058432406,1
"ENG_062_MZB_LO_2388","ENG_062_MZB_LO_2388-28.10.2002","28.10.2002",2002,10,28,1.170175141,1
"ENG_062_MZB_LO_2388","ENG_062_MZB_LO_2388-02.09.2003","02.09.2003",2003,9,2,1.133003468,1
"ENG_062_MZB_LO_2388","ENG_062_MZB_LO_2388-23.09.2004","23.09.2004",2004,9,23,1.099245782,1
"ENG_062_MZB_LO_2388","ENG_062_MZB_LO_2388-17.10.2005","17.10.2005",2005,10,17,1.015168527,1
"ENG_062_MZB_LO_2388","ENG_062_MZB_LO_2388-04.09.2006","04.09.2006",2006,9,4,1.05973937,1
"ENG_062_MZB_LO_2388","ENG_062_MZB_LO_2388-26.09.2007","26.09.2007",2007,9,26,1.089732134,1
"ENG_062_MZB_LO_2388","ENG_062_MZB_LO_2388-10.11.2008","10.11.2008",2008,11,10,1.109440761,1
"ENG_062_MZB_LO_2388","ENG_062_MZB_LO_2388-13.10.2009","13.10.2009",2009,10,13,1.111572404,1
"ENG_062_MZB_LO_2388","ENG_062_MZB_LO_2388-11.10.2010","11.10.2010",2010,10,11,1.143082474,1
"ENG_062_MZB_LO_2388","ENG_062_MZB_LO_2388-03.10.2011","03.10.2011",2011,10,3,1.014457848,1
"ENG_062_MZB_LO_2388","ENG_062_MZB_LO_2388-17.10.2012","17.10.2012",2012,10,17,1.04862096,1
"ENG_062_MZB_LO_2388","ENG_062_MZB_LO_2388-16.09.2013","16.09.2013",2013,9,16,1.049124325,2
"ENG_062_MZB_LO_2388","ENG_062_MZB_LO_2388-16.09.2014","16.09.2014",2014,9,16,1.063846962,3
"ENG_062_MZB_LO_2388","ENG_062_MZB_LO_2388-04.09.2015","04.09.2015",2015,9,4,1.031215919,1
"ENG_062_MZB_LO_2388","ENG_062_MZB_LO_2388-29.09.2016","29.09.2016",2016,9,29,0.958942407,3
"ENG_062_MZB_LO_2388","ENG_062_MZB_LO_2388-09.10.2017","09.10.2017",2017,10,9,1.086265326,1
"ENG_062_MZB_LO_2388","ENG_062_MZB_LO_2388-07.09.2018","07.09.2018",2018,9,7,1.033266316,3
"ENG_062_MZB_LO_2388","ENG_062_MZB_LO_2388-09.11.2020","09.11.2020",2020,11,9,1.076832071,2
"ENG_062_MZB_LO_2388","ENG_062_MZB_LO_2388-20.10.2021","20.10.2021",2021,10,20,1.113032355,2
"ENG_062_MZB_LO_2388","ENG_062_MZB_LO_2388-25.10.2022","25.10.2022",2022,10,25,1.045287628,2
"ENG_062_MZB_LO_2388","ENG_062_MZB_LO_2388-13.09.2023","13.09.2023",2023,9,13,1.095799029,1
"ENG_062_MZB_LO_2388","ENG_062_MZB_LO_2388-28.10.2024","28.10.2024",2024,10,28,1.166318057,2
"ENG_062_MZB_LO_2389","ENG_062_MZB_LO_2389-28.10.2002","28.10.2002",2002,10,28,0.771768418,3
"ENG_062_MZB_LO_2389","ENG_062_MZB_LO_2389-22.09.2003","22.09.2003",2003,9,22,0.746080874,3
"ENG_062_MZB_LO_2389","ENG_062_MZB_LO_2389-23.09.2004","23.09.2004",2004,9,23,0.754753372,3
"ENG_062_MZB_LO_2389","ENG_062_MZB_LO_2389-17.10.2005","17.10.2005",2005,10,17,0.742521452,3
"ENG_062_MZB_LO_2389","ENG_062_MZB_LO_2389-30.11.2006","30.11.2006",2006,11,30,0.810417845,3
"ENG_062_MZB_LO_2389","ENG_062_MZB_LO_2389-26.09.2007","26.09.2007",2007,9,26,0.78569842,3
"ENG_062_MZB_LO_2389","ENG_062_MZB_LO_2389-13.10.2009","13.10.2009",2009,10,13,0.738340697,4
"ENG_062_MZB_LO_2389","ENG_062_MZB_LO_2389-11.10.2010","11.10.2010",2010,10,11,0.757293541,3
"ENG_062_MZB_LO_2389","ENG_062_MZB_LO_2389-23.09.2013","23.09.2013",2013,9,23,0.773813167,5
"ENG_062_MZB_LO_2389","ENG_062_MZB_LO_2389-20.10.2014","20.10.2014",2014,10,20,0.77823868,3
"ENG_062_MZB_LO_2389","ENG_062_MZB_LO_2389-22.09.2015","22.09.2015",2015,9,22,0.732993256,4
"ENG_062_MZB_LO_2389","ENG_062_MZB_LO_2389-23.09.2016","23.09.2016",2016,9,23,0.756610561,3
"ENG_062_MZB_LO_2389","ENG_062_MZB_LO_2389-16.10.2017","16.10.2017",2017,10,16,0.708324605,4
"ENG_062_MZB_LO_2389","ENG_062_MZB_LO_2389-10.09.2018","10.09.2018",2018,9,10,0.759142158,3
"ENG_062_MZB_LO_2390","ENG_062_MZB_LO_2390-04.11.2002","04.11.2002",2002,11,4,1.099983602,1
"ENG_062_MZB_LO_2390","ENG_062_MZB_LO_2390-03.11.2003","03.11.2003",2003,11,3,1.081289769,1
"ENG_062_MZB_LO_2390","ENG_062_MZB_LO_2390-28.09.2004","28.09.2004",2004,9,28,1.103959856,1
"ENG_062_MZB_LO_2390","ENG_062_MZB_LO_2390-08.09.2005","08.09.2005",2005,9,8,1.046934397,1
"ENG_062_MZB_LO_2390","ENG_062_MZB_LO_2390-18.09.2006","18.09.2006",2006,9,18,1.014217139,1
"ENG_062_MZB_LO_2390","ENG_062_MZB_LO_2390-05.10.2009","05.10.2009",2009,10,5,1.095344695,1
"ENG_062_MZB_LO_2390","ENG_062_MZB_LO_2390-25.10.2011","25.10.2011",2011,10,25,0.960079373,2
"ENG_062_MZB_LO_2390","ENG_062_MZB_LO_2390-29.10.2012","29.10.2012",2012,10,29,0.962698631,2
"ENG_062_MZB_LO_2390","ENG_062_MZB_LO_2390-07.10.2013","07.10.2013",2013,10,7,1.0344691,1
"ENG_062_MZB_LO_2390","ENG_062_MZB_LO_2390-02.09.2015","02.09.2015",2015,9,2,1.039085633,1
"ENG_062_MZB_LO_2390","ENG_062_MZB_LO_2390-19.09.2016","19.09.2016",2016,9,19,1.003629361,1
"ENG_062_MZB_LO_2390","ENG_062_MZB_LO_2390-18.09.2017","18.09.2017",2017,9,18,1.131438204,1
"ENG_062_MZB_LO_2390","ENG_062_MZB_LO_2390-18.09.2018","18.09.2018",2018,9,18,1.066337811,1
"ENG_062_MZB_LO_2390","ENG_062_MZB_LO_2390-19.09.2019","19.09.2019",2019,9,19,0.977596663,2
"ENG_062_MZB_LO_2390","ENG_062_MZB_LO_2390-18.09.2020","18.09.2020",2020,9,18,0.968525094,2
"ENG_062_MZB_LO_2390","ENG_062_MZB_LO_2390-27.10.2021","27.10.2021",2021,10,27,1.020469312,2
"ENG_062_MZB_LO_2390","ENG_062_MZB_LO_2390-26.10.2022","26.10.2022",2022,10,26,0.954225864,2
"ENG_062_MZB_LO_2390","ENG_062_MZB_LO_2390-13.09.2023","13.09.2023",2023,9,13,1.14786868,1
"ENG_062_MZB_LO_2390","ENG_062_MZB_LO_2390-12.11.2024","12.11.2024",2024,11,12,1.124542392,1
"ENG_062_MZB_LO_2391","ENG_062_MZB_LO_2391-17.10.2002","17.10.2002",2002,10,17,1.003238704,2
"ENG_062_MZB_LO_2391","ENG_062_MZB_LO_2391-28.11.2003","28.11.2003",2003,11,28,0.927902233,5
"ENG_062_MZB_LO_2391","ENG_062_MZB_LO_2391-22.11.2004","22.11.2004",2004,11,22,0.943172341,2
"ENG_062_MZB_LO_2391","ENG_062_MZB_LO_2391-30.11.2005","30.11.2005",2005,11,30,0.985830718,2
"ENG_062_MZB_LO_2391","ENG_062_MZB_LO_2391-15.11.2006","15.11.2006",2006,11,15,0.96513115,3
"ENG_062_MZB_LO_2391","ENG_062_MZB_LO_2391-12.11.2007","12.11.2007",2007,11,12,1.04567013,1
"ENG_062_MZB_LO_2391","ENG_062_MZB_LO_2391-13.10.2008","13.10.2008",2008,10,13,0.977761583,2
"ENG_062_MZB_LO_2391","ENG_062_MZB_LO_2391-04.11.2009","04.11.2009",2009,11,4,1.111656546,2
"ENG_062_MZB_LO_2391","ENG_062_MZB_LO_2391-10.11.2010","10.11.2010",2010,11,10,1.069297628,2
"ENG_062_MZB_LO_2391","ENG_062_MZB_LO_2391-25.10.2011","25.10.2011",2011,10,25,0.8956482,3
"ENG_062_MZB_LO_2391","ENG_062_MZB_LO_2391-17.10.2012","17.10.2012",2012,10,17,1.029428283,2
"ENG_062_MZB_LO_2391","ENG_062_MZB_LO_2391-10.09.2013","10.09.2013",2013,9,10,0.959004287,5
"ENG_062_MZB_LO_2391","ENG_062_MZB_LO_2391-28.10.2014","28.10.2014",2014,10,28,1.045050793,1
"ENG_062_MZB_LO_2391","ENG_062_MZB_LO_2391-15.10.2015","15.10.2015",2015,10,15,1.0838277,3
"ENG_062_MZB_LO_2391","ENG_062_MZB_LO_2391-06.10.2016","06.10.2016",2016,10,6,1.010251934,5
"ENG_062_MZB_LO_2391","ENG_062_MZB_LO_2391-09.11.2017","09.11.2017",2017,11,9,1.043525956,1
"ENG_062_MZB_LO_2391","ENG_062_MZB_LO_2391-10.09.2018","10.09.2018",2018,9,10,1.147493832,5
"ENG_062_MZB_LO_2391","ENG_062_MZB_LO_2391-21.10.2019","21.10.2019",2019,10,21,1.044666897,2
"ENG_062_MZB_LO_2391","ENG_062_MZB_LO_2391-29.09.2020","29.09.2020",2020,9,29,0.925151104,5
"ENG_062_MZB_LO_2392","ENG_062_MZB_LO_2392-01.09.2009","01.09.2009",2009,9,1,1.009590332,2
"ENG_062_MZB_LO_2392","ENG_062_MZB_LO_2392-21.11.2011","21.11.2011",2011,11,21,1.021487062,1
"ENG_062_MZB_LO_2392","ENG_062_MZB_LO_2392-10.09.2014","10.09.2014",2014,9,10,1.035112685,3
"ENG_062_MZB_LO_2392","ENG_062_MZB_LO_2392-01.10.2015","01.10.2015",2015,10,1,0.990629271,2
"ENG_062_MZB_LO_2392","ENG_062_MZB_LO_2392-28.09.2016","28.09.2016",2016,9,28,1.108808485,2
"ENG_062_MZB_LO_2392","ENG_062_MZB_LO_2392-21.09.2017","21.09.2017",2017,9,21,1.068004685,1
"ENG_062_MZB_LO_2392","ENG_062_MZB_LO_2392-07.09.2018","07.09.2018",2018,9,7,1.050485789,5
"ENG_062_MZB_LO_2392","ENG_062_MZB_LO_2392-07.10.2019","07.10.2019",2019,10,7,1.07676405,2
"ENG_062_MZB_LO_2392","ENG_062_MZB_LO_2392-03.11.2020","03.11.2020",2020,11,3,1.116483636,1
"ENG_062_MZB_LO_2392","ENG_062_MZB_LO_2392-20.10.2021","20.10.2021",2021,10,20,1.166404329,1
"ENG_062_MZB_LO_2392","ENG_062_MZB_LO_2392-27.09.2022","27.09.2022",2022,9,27,1.139480934,1
"ENG_062_MZB_LO_2392","ENG_062_MZB_LO_2392-13.09.2023","13.09.2023",2023,9,13,1.239115512,3
"ENG_062_MZB_LO_2393","ENG_062_MZB_LO_2393-08.10.2002","08.10.2002",2002,10,8,0.865182344,3
"ENG_062_MZB_LO_2393","ENG_062_MZB_LO_2393-21.11.2003","21.11.2003",2003,11,21,0.817497541,3
"ENG_062_MZB_LO_2393","ENG_062_MZB_LO_2393-02.11.2004","02.11.2004",2004,11,2,0.80530614,3
"ENG_062_MZB_LO_2393","ENG_062_MZB_LO_2393-22.11.2005","22.11.2005",2005,11,22,0.851448363,3
"ENG_062_MZB_LO_2393","ENG_062_MZB_LO_2393-15.11.2006","15.11.2006",2006,11,15,0.858123835,3
"ENG_062_MZB_LO_2393","ENG_062_MZB_LO_2393-01.10.2007","01.10.2007",2007,10,1,0.877048663,2
"ENG_062_MZB_LO_2393","ENG_062_MZB_LO_2393-28.10.2008","28.10.2008",2008,10,28,0.806074201,3
"ENG_062_MZB_LO_2393","ENG_062_MZB_LO_2393-18.11.2009","18.11.2009",2009,11,18,0.868459402,3
"ENG_062_MZB_LO_2393","ENG_062_MZB_LO_2393-01.11.2010","01.11.2010",2010,11,1,0.885920544,2
"ENG_062_MZB_LO_2393","ENG_062_MZB_LO_2393-03.11.2011","03.11.2011",2011,11,3,0.884941803,3
"ENG_062_MZB_LO_2393","ENG_062_MZB_LO_2393-24.10.2012","24.10.2012",2012,10,24,0.842596628,3
"ENG_062_MZB_LO_2393","ENG_062_MZB_LO_2393-20.09.2013","20.09.2013",2013,9,20,0.89557856,2
"ENG_062_MZB_LO_2393","ENG_062_MZB_LO_2393-06.10.2014","06.10.2014",2014,10,6,0.87220318,2
"ENG_062_MZB_LO_2393","ENG_062_MZB_LO_2393-15.10.2015","15.10.2015",2015,10,15,0.867999572,3
"ENG_062_MZB_LO_2393","ENG_062_MZB_LO_2393-17.10.2016","17.10.2016",2016,10,17,0.902540628,2
"ENG_062_MZB_LO_2394","ENG_062_MZB_LO_2394-17.10.2002","17.10.2002",2002,10,17,0.937900434,2
"ENG_062_MZB_LO_2394","ENG_062_MZB_LO_2394-10.11.2003","10.11.2003",2003,11,10,0.915597035,2
"ENG_062_MZB_LO_2394","ENG_062_MZB_LO_2394-11.10.2004","11.10.2004",2004,10,11,1.052112429,1
"ENG_062_MZB_LO_2394","ENG_062_MZB_LO_2394-30.11.2005","30.11.2005",2005,11,30,0.90112252,2
"ENG_062_MZB_LO_2394","ENG_062_MZB_LO_2394-25.10.2006","25.10.2006",2006,10,25,0.855558514,3
"ENG_062_MZB_LO_2394","ENG_062_MZB_LO_2394-11.10.2007","11.10.2007",2007,10,11,1.020380055,1
"ENG_062_MZB_LO_2394","ENG_062_MZB_LO_2394-05.11.2008","05.11.2008",2008,11,5,0.996115616,2
"ENG_062_MZB_LO_2394","ENG_062_MZB_LO_2394-05.10.2009","05.10.2009",2009,10,5,0.974877564,1
"ENG_062_MZB_LO_2394","ENG_062_MZB_LO_2394-26.10.2010","26.10.2010",2010,10,26,0.97734825,2
"ENG_062_MZB_LO_2394","ENG_062_MZB_LO_2394-24.11.2011","24.11.2011",2011,11,24,1.011968074,1
"ENG_062_MZB_LO_2394","ENG_062_MZB_LO_2394-15.10.2012","15.10.2012",2012,10,15,0.948801115,2
"ENG_062_MZB_LO_2394","ENG_062_MZB_LO_2394-30.10.2013","30.10.2013",2013,10,30,1.099410628,1
"ENG_062_MZB_LO_2394","ENG_062_MZB_LO_2394-20.10.2014","20.10.2014",2014,10,20,0.844692393,3
"ENG_062_MZB_LO_2394","ENG_062_MZB_LO_2394-19.10.2015","19.10.2015",2015,10,19,1.017339444,1
"ENG_062_MZB_LO_2394","ENG_062_MZB_LO_2394-31.10.2016","31.10.2016",2016,10,31,1.013926204,1
"ENG_062_MZB_LO_2394","ENG_062_MZB_LO_2394-31.10.2017","31.10.2017",2017,10,31,0.934407294,3
"ENG_062_MZB_LO_2394","ENG_062_MZB_LO_2394-27.09.2018","27.09.2018",2018,9,27,1.044913044,1
"ENG_062_MZB_LO_2394","ENG_062_MZB_LO_2394-31.10.2019","31.10.2019",2019,10,31,1.015256435,1
"ENG_062_MZB_LO_2394","ENG_062_MZB_LO_2394-24.11.2020","24.11.2020",2020,11,24,1.010840107,1
"ENG_062_MZB_LO_2395","ENG_062_MZB_LO_2395-15.11.2002","15.11.2002",2002,11,15,0.775289248,3
"ENG_062_MZB_LO_2395","ENG_062_MZB_LO_2395-30.11.2003","30.11.2003",2003,11,30,0.863517123,3
"ENG_062_MZB_LO_2395","ENG_062_MZB_LO_2395-30.11.2004","30.11.2004",2004,11,30,0.885609351,2
"ENG_062_MZB_LO_2395","ENG_062_MZB_LO_2395-11.11.2005","11.11.2005",2005,11,11,0.896559519,2
"ENG_062_MZB_LO_2395","ENG_062_MZB_LO_2395-16.11.2006","16.11.2006",2006,11,16,0.839621687,3
"ENG_062_MZB_LO_2395","ENG_062_MZB_LO_2395-09.11.2007","09.11.2007",2007,11,9,0.889531754,3
"ENG_062_MZB_LO_2395","ENG_062_MZB_LO_2395-23.11.2009","23.11.2009",2009,11,23,0.834900208,3
"ENG_062_MZB_LO_2395","ENG_062_MZB_LO_2395-09.11.2010","09.11.2010",2010,11,9,0.808547114,3
"ENG_062_MZB_LO_2395","ENG_062_MZB_LO_2395-18.10.2011","18.10.2011",2011,10,18,0.877569945,3
"ENG_062_MZB_LO_2395","ENG_062_MZB_LO_2395-31.10.2012","31.10.2012",2012,10,31,0.789065269,3
"ENG_062_MZB_LO_2395","ENG_062_MZB_LO_2395-20.09.2013","20.09.2013",2013,9,20,0.714583014,4
"ENG_062_MZB_LO_2395","ENG_062_MZB_LO_2395-26.10.2016","26.10.2016",2016,10,26,0.794311659,3
"ENG_062_MZB_LO_2395","ENG_062_MZB_LO_2395-25.10.2017","25.10.2017",2017,10,25,0.841125641,4
"ENG_062_MZB_LO_2395","ENG_062_MZB_LO_2395-26.09.2018","26.09.2018",2018,9,26,0.796695944,3
"ENG_062_MZB_LO_2395","ENG_062_MZB_LO_2395-30.10.2019","30.10.2019",2019,10,30,0.774699793,3
"ENG_062_MZB_LO_2395","ENG_062_MZB_LO_2395-23.09.2020","23.09.2020",2020,9,23,0.825870029,3
"ENG_062_MZB_LO_2396","ENG_062_MZB_LO_2396-15.11.2002","15.11.2002",2002,11,15,1.022233016,1
"ENG_062_MZB_LO_2396","ENG_062_MZB_LO_2396-30.11.2003","30.11.2003",2003,11,30,1.081262846,1
"ENG_062_MZB_LO_2396","ENG_062_MZB_LO_2396-09.11.2004","09.11.2004",2004,11,9,1.026252575,1
"ENG_062_MZB_LO_2396","ENG_062_MZB_LO_2396-11.11.2005","11.11.2005",2005,11,11,1.012544815,1
"ENG_062_MZB_LO_2396","ENG_062_MZB_LO_2396-16.11.2006","16.11.2006",2006,11,16,1.070776123,1
"ENG_062_MZB_LO_2396","ENG_062_MZB_LO_2396-09.11.2007","09.11.2007",2007,11,9,1.0642247,1
"ENG_062_MZB_LO_2396","ENG_062_MZB_LO_2396-27.11.2008","27.11.2008",2008,11,27,1.076414818,1
"ENG_062_MZB_LO_2396","ENG_062_MZB_LO_2396-23.11.2009","23.11.2009",2009,11,23,1.124788711,1
"ENG_062_MZB_LO_2396","ENG_062_MZB_LO_2396-09.11.2010","09.11.2010",2010,11,9,1.106482776,1
"ENG_062_MZB_LO_2396","ENG_062_MZB_LO_2396-18.10.2011","18.10.2011",2011,10,18,1.036617093,1
"ENG_062_MZB_LO_2396","ENG_062_MZB_LO_2396-31.10.2012","31.10.2012",2012,10,31,1.043629991,1
"ENG_062_MZB_LO_2396","ENG_062_MZB_LO_2396-22.10.2013","22.10.2013",2013,10,22,1.067774891,2
"ENG_062_MZB_LO_2396","ENG_062_MZB_LO_2396-22.10.2014","22.10.2014",2014,10,22,1.104925576,1
"ENG_062_MZB_LO_2396","ENG_062_MZB_LO_2396-01.10.2015","01.10.2015",2015,10,1,1.061191061,1
"ENG_062_MZB_LO_2396","ENG_062_MZB_LO_2396-27.09.2016","27.09.2016",2016,9,27,1.082031289,1
"ENG_062_MZB_LO_2396","ENG_062_MZB_LO_2396-11.10.2017","11.10.2017",2017,10,11,1.068513297,1
"ENG_062_MZB_LO_2396","ENG_062_MZB_LO_2396-19.09.2018","19.09.2018",2018,9,19,1.05718762,1
"ENG_062_MZB_LO_2396","ENG_062_MZB_LO_2396-06.11.2019","06.11.2019",2019,11,6,0.966594957,2
"ENG_062_MZB_LO_2396","ENG_062_MZB_LO_2396-23.09.2020","23.09.2020",2020,9,23,1.016119507,1
"ENG_062_MZB_LO_2396","ENG_062_MZB_LO_2396-15.10.2021","15.10.2021",2021,10,15,1.103737715,1
"ENG_062_MZB_LO_2396","ENG_062_MZB_LO_2396-21.10.2022","21.10.2022",2022,10,21,1.117095906,1
"ENG_062_MZB_LO_2396","ENG_062_MZB_LO_2396-13.09.2023","13.09.2023",2023,9,13,1.064287281,1
"ENG_062_MZB_LO_2396","ENG_062_MZB_LO_2396-13.09.2024","13.09.2024",2024,9,13,1.108179397,1
"ENG_062_MZB_LO_2397","ENG_062_MZB_LO_2397-15.11.2002","15.11.2002",2002,11,15,1.091752557,1
"ENG_062_MZB_LO_2397","ENG_062_MZB_LO_2397-30.11.2003","30.11.2003",2003,11,30,1.03585175,1
"ENG_062_MZB_LO_2397","ENG_062_MZB_LO_2397-30.11.2004","30.11.2004",2004,11,30,1.040000988,1
"ENG_062_MZB_LO_2397","ENG_062_MZB_LO_2397-04.11.2005","04.11.2005",2005,11,4,1.026408456,1
"ENG_062_MZB_LO_2397","ENG_062_MZB_LO_2397-30.11.2006","30.11.2006",2006,11,30,1.044049347,1
"ENG_062_MZB_LO_2397","ENG_062_MZB_LO_2397-09.11.2007","09.11.2007",2007,11,9,1.116682188,1
"ENG_062_MZB_LO_2397","ENG_062_MZB_LO_2397-27.11.2008","27.11.2008",2008,11,27,1.099512469,1
"ENG_062_MZB_LO_2397","ENG_062_MZB_LO_2397-23.11.2009","23.11.2009",2009,11,23,1.003361988,1
"ENG_062_MZB_LO_2397","ENG_062_MZB_LO_2397-17.10.2011","17.10.2011",2011,10,17,1.029359184,1
"ENG_062_MZB_LO_2397","ENG_062_MZB_LO_2397-31.10.2012","31.10.2012",2012,10,31,1.01834215,1
"ENG_062_MZB_LO_2397","ENG_062_MZB_LO_2397-07.10.2013","07.10.2013",2013,10,7,1.066875888,1
"ENG_062_MZB_LO_2397","ENG_062_MZB_LO_2397-10.11.2014","10.11.2014",2014,11,10,1.088076953,1
"ENG_062_MZB_LO_2397","ENG_062_MZB_LO_2397-20.10.2015","20.10.2015",2015,10,20,1.121093081,2
"ENG_062_MZB_LO_2397","ENG_062_MZB_LO_2397-27.09.2016","27.09.2016",2016,9,27,1.067421431,1
"ENG_062_MZB_LO_2397","ENG_062_MZB_LO_2397-11.10.2017","11.10.2017",2017,10,11,1.067140223,1
"ENG_062_MZB_LO_2397","ENG_062_MZB_LO_2397-26.09.2018","26.09.2018",2018,9,26,1.061790332,2
"ENG_062_MZB_LO_2397","ENG_062_MZB_LO_2397-30.09.2020","30.09.2020",2020,9,30,1.183350345,1
"ENG_062_MZB_LO_2397","ENG_062_MZB_LO_2397-15.10.2021","15.10.2021",2021,10,15,1.058796273,1
"ENG_062_MZB_LO_2397","ENG_062_MZB_LO_2397-21.09.2022","21.09.2022",2022,9,21,1.060658329,1
"ENG_062_MZB_LO_2397","ENG_062_MZB_LO_2397-14.09.2023","14.09.2023",2023,9,14,1.157375178,1
"ENG_062_MZB_LO_2398","ENG_062_MZB_LO_2398-15.11.2002","15.11.2002",2002,11,15,1.135183202,1
"ENG_062_MZB_LO_2398","ENG_062_MZB_LO_2398-10.11.2003","10.11.2003",2003,11,10,1.034919489,1
"ENG_062_MZB_LO_2398","ENG_062_MZB_LO_2398-09.11.2004","09.11.2004",2004,11,9,0.990768726,1
"ENG_062_MZB_LO_2398","ENG_062_MZB_LO_2398-10.10.2005","10.10.2005",2005,10,10,1.05952032,1
"ENG_062_MZB_LO_2398","ENG_062_MZB_LO_2398-30.11.2006","30.11.2006",2006,11,30,0.973359255,2
"ENG_062_MZB_LO_2398","ENG_062_MZB_LO_2398-09.11.2007","09.11.2007",2007,11,9,1.077308034,1
"ENG_062_MZB_LO_2398","ENG_062_MZB_LO_2398-27.11.2008","27.11.2008",2008,11,27,1.047747959,1
"ENG_062_MZB_LO_2398","ENG_062_MZB_LO_2398-23.11.2009","23.11.2009",2009,11,23,1.110412236,1
"ENG_062_MZB_LO_2398","ENG_062_MZB_LO_2398-26.11.2010","26.11.2010",2010,11,26,1.069341484,1
"ENG_062_MZB_LO_2398","ENG_062_MZB_LO_2398-17.10.2011","17.10.2011",2011,10,17,1.027613697,1
"ENG_062_MZB_LO_2398","ENG_062_MZB_LO_2398-01.10.2013","01.10.2013",2013,10,1,0.965671851,2
"ENG_062_MZB_LO_2398","ENG_062_MZB_LO_2398-09.09.2015","09.09.2015",2015,9,9,1.057190132,1
"ENG_062_MZB_LO_2398","ENG_062_MZB_LO_2398-19.09.2016","19.09.2016",2016,9,19,0.869185584,3
"ENG_062_MZB_LO_2398","ENG_062_MZB_LO_2398-11.10.2017","11.10.2017",2017,10,11,1.017814804,1
"ENG_062_MZB_LO_2398","ENG_062_MZB_LO_2398-14.09.2018","14.09.2018",2018,9,14,0.981972434,2
"ENG_062_MZB_LO_2398","ENG_062_MZB_LO_2398-30.09.2020","30.09.2020",2020,9,30,0.952183749,3
"ENG_062_MZB_LO_2399","ENG_062_MZB_LO_2399-15.11.2002","15.11.2002",2002,11,15,1.064715524,1
"ENG_062_MZB_LO_2399","ENG_062_MZB_LO_2399-10.11.2003","10.11.2003",2003,11,10,0.991692817,1
"ENG_062_MZB_LO_2399","ENG_062_MZB_LO_2399-09.11.2004","09.11.2004",2004,11,9,1.069365374,1
"ENG_062_MZB_LO_2399","ENG_062_MZB_LO_2399-10.10.2005","10.10.2005",2005,10,10,1.05119244,1
"ENG_062_MZB_LO_2399","ENG_062_MZB_LO_2399-30.11.2006","30.11.2006",2006,11,30,1.028226845,1
"ENG_062_MZB_LO_2399","ENG_062_MZB_LO_2399-09.11.2007","09.11.2007",2007,11,9,1.060973048,1
"ENG_062_MZB_LO_2399","ENG_062_MZB_LO_2399-27.11.2008","27.11.2008",2008,11,27,1.134079112,1
"ENG_062_MZB_LO_2399","ENG_062_MZB_LO_2399-23.11.2009","23.11.2009",2009,11,23,1.106666046,1
"ENG_062_MZB_LO_2399","ENG_062_MZB_LO_2399-17.10.2011","17.10.2011",2011,10,17,1.017500036,1
"ENG_062_MZB_LO_2399","ENG_062_MZB_LO_2399-23.10.2012","23.10.2012",2012,10,23,0.935156444,2
"ENG_062_MZB_LO_2399","ENG_062_MZB_LO_2399-12.10.2021","12.10.2021",2021,10,12,1.054619524,1
"ENG_062_MZB_LO_2399","ENG_062_MZB_LO_2399-21.09.2022","21.09.2022",2022,9,21,0.951391463,2
"ENG_062_MZB_LO_2399","ENG_062_MZB_LO_2399-14.09.2023","14.09.2023",2023,9,14,1.073929943,1
"ENG_062_MZB_LO_2400","ENG_062_MZB_LO_2400-29.11.2002","29.11.2002",2002,11,29,0.97757824,1
"ENG_062_MZB_LO_2400","ENG_062_MZB_LO_2400-10.11.2003","10.11.2003",2003,11,10,1.009736701,1
"ENG_062_MZB_LO_2400","ENG_062_MZB_LO_2400-09.11.2004","09.11.2004",2004,11,9,1.006130691,1
"ENG_062_MZB_LO_2400","ENG_062_MZB_LO_2400-10.10.2005","10.10.2005",2005,10,10,1.071038334,1
"ENG_062_MZB_LO_2400","ENG_062_MZB_LO_2400-30.11.2006","30.11.2006",2006,11,30,1.041443088,1
"ENG_062_MZB_LO_2400","ENG_062_MZB_LO_2400-09.11.2007","09.11.2007",2007,11,9,1.084719573,1
"ENG_062_MZB_LO_2400","ENG_062_MZB_LO_2400-27.11.2008","27.11.2008",2008,11,27,1.093922047,1
"ENG_062_MZB_LO_2400","ENG_062_MZB_LO_2400-23.11.2009","23.11.2009",2009,11,23,1.079207109,1
"ENG_062_MZB_LO_2400","ENG_062_MZB_LO_2400-26.11.2010","26.11.2010",2010,11,26,1.093762784,1
"ENG_062_MZB_LO_2400","ENG_062_MZB_LO_2400-17.10.2011","17.10.2011",2011,10,17,1.0987148,1
"ENG_062_MZB_LO_2400","ENG_062_MZB_LO_2400-23.10.2012","23.10.2012",2012,10,23,1.023049146,1
"ENG_062_MZB_LO_2400","ENG_062_MZB_LO_2400-17.09.2013","17.09.2013",2013,9,17,1.133815323,1
"ENG_062_MZB_LO_2400","ENG_062_MZB_LO_2400-28.09.2015","28.09.2015",2015,9,28,1.139128173,1
"ENG_062_MZB_LO_2400","ENG_062_MZB_LO_2400-27.09.2016","27.09.2016",2016,9,27,1.1138729,1
"ENG_062_MZB_LO_2400","ENG_062_MZB_LO_2400-11.10.2017","11.10.2017",2017,10,11,1.082934853,1
"ENG_062_MZB_LO_2400","ENG_062_MZB_LO_2400-19.09.2018","19.09.2018",2018,9,19,1.151185175,1
"ENG_062_MZB_LO_2400","ENG_062_MZB_LO_2400-23.09.2020","23.09.2020",2020,9,23,1.092847776,1
"ENG_062_MZB_LO_2400","ENG_062_MZB_LO_2400-12.10.2021","12.10.2021",2021,10,12,1.081786779,1
"ENG_062_MZB_LO_2400","ENG_062_MZB_LO_2400-21.09.2022","21.09.2022",2022,9,21,1.147806836,1
"ENG_062_MZB_LO_2400","ENG_062_MZB_LO_2400-14.09.2023","14.09.2023",2023,9,14,1.087425886,1
"ENG_062_MZB_LO_2401","ENG_062_MZB_LO_2401-18.11.2002","18.11.2002",2002,11,18,0.936703047,2
"ENG_062_MZB_LO_2401","ENG_062_MZB_LO_2401-26.11.2003","26.11.2003",2003,11,26,1.006978042,1
"ENG_062_MZB_LO_2401","ENG_062_MZB_LO_2401-20.09.2004","20.09.2004",2004,9,20,0.975056549,1
"ENG_062_MZB_LO_2401","ENG_062_MZB_LO_2401-17.10.2005","17.10.2005",2005,10,17,0.986108169,1
"ENG_062_MZB_LO_2401","ENG_062_MZB_LO_2401-14.11.2006","14.11.2006",2006,11,14,1.034701859,1
"ENG_062_MZB_LO_2401","ENG_062_MZB_LO_2401-26.11.2007","26.11.2007",2007,11,26,1.031065917,1
"ENG_062_MZB_LO_2401","ENG_062_MZB_LO_2401-13.10.2008","13.10.2008",2008,10,13,1.124172149,1
"ENG_062_MZB_LO_2401","ENG_062_MZB_LO_2401-14.09.2009","14.09.2009",2009,9,14,1.038847221,1
"ENG_062_MZB_LO_2401","ENG_062_MZB_LO_2401-06.09.2010","06.09.2010",2010,9,6,1.054165238,1
"ENG_062_MZB_LO_2401","ENG_062_MZB_LO_2401-10.10.2011","10.10.2011",2011,10,10,0.958632485,2
"ENG_062_MZB_LO_2401","ENG_062_MZB_LO_2401-03.09.2012","03.09.2012",2012,9,3,0.996868465,1
"ENG_062_MZB_LO_2401","ENG_062_MZB_LO_2401-20.09.2013","20.09.2013",2013,9,20,1.030837313,1
"ENG_062_MZB_LO_2401","ENG_062_MZB_LO_2401-18.09.2014","18.09.2014",2014,9,18,1.062033862,1
"ENG_062_MZB_LO_2401","ENG_062_MZB_LO_2401-08.10.2015","08.10.2015",2015,10,8,0.968787315,1
"ENG_062_MZB_LO_2401","ENG_062_MZB_LO_2401-15.09.2016","15.09.2016",2016,9,15,1.006560116,1
"ENG_062_MZB_LO_2401","ENG_062_MZB_LO_2401-11.10.2017","11.10.2017",2017,10,11,1.046793301,1
"ENG_062_MZB_LO_2401","ENG_062_MZB_LO_2401-09.09.2019","09.09.2019",2019,9,9,1.057962492,1
"ENG_062_MZB_LO_2401","ENG_062_MZB_LO_2401-28.09.2020","28.09.2020",2020,9,28,1.03632282,1
"ENG_062_MZB_LO_2401","ENG_062_MZB_LO_2401-12.10.2021","12.10.2021",2021,10,12,1.087059542,1
"ENG_062_MZB_LO_2401","ENG_062_MZB_LO_2401-27.09.2022","27.09.2022",2022,9,27,1.062666616,1
"ENG_062_MZB_LO_2401","ENG_062_MZB_LO_2401-13.09.2023","13.09.2023",2023,9,13,1.079636793,1
"ENG_062_MZB_LO_2402","ENG_062_MZB_LO_2402-18.11.2002","18.11.2002",2002,11,18,1.102157761,1
"ENG_062_MZB_LO_2402","ENG_062_MZB_LO_2402-26.11.2003","26.11.2003",2003,11,26,1.119279181,1
"ENG_062_MZB_LO_2402","ENG_062_MZB_LO_2402-20.09.2004","20.09.2004",2004,9,20,1.067315337,1
"ENG_062_MZB_LO_2402","ENG_062_MZB_LO_2402-17.10.2005","17.10.2005",2005,10,17,1.085362489,1
"ENG_062_MZB_LO_2402","ENG_062_MZB_LO_2402-14.11.2006","14.11.2006",2006,11,14,1.139131533,1
"ENG_062_MZB_LO_2402","ENG_062_MZB_LO_2402-26.11.2007","26.11.2007",2007,11,26,1.142997855,1
"ENG_062_MZB_LO_2402","ENG_062_MZB_LO_2402-19.10.2009","19.10.2009",2009,10,19,1.019894591,1
"ENG_062_MZB_LO_2402","ENG_062_MZB_LO_2402-05.09.2013","05.09.2013",2013,9,5,1.037733615,1
"ENG_062_MZB_LO_2402","ENG_062_MZB_LO_2402-02.09.2015","02.09.2015",2015,9,2,0.938512318,2
"ENG_062_MZB_LO_2402","ENG_062_MZB_LO_2402-15.09.2016","15.09.2016",2016,9,15,1.110351543,1
"ENG_062_MZB_LO_2402","ENG_062_MZB_LO_2402-17.10.2017","17.10.2017",2017,10,17,0.993458085,1
"ENG_062_MZB_LO_2402","ENG_062_MZB_LO_2402-02.09.2019","02.09.2019",2019,9,2,1.051865795,1
"ENG_062_MZB_LO_2402","ENG_062_MZB_LO_2402-28.09.2020","28.09.2020",2020,9,28,1.073966489,1
"ENG_062_MZB_LO_2403","ENG_062_MZB_LO_2403-18.11.2002","18.11.2002",2002,11,18,0.941017182,2
"ENG_062_MZB_LO_2403","ENG_062_MZB_LO_2403-26.11.2003","26.11.2003",2003,11,26,0.98842939,1
"ENG_062_MZB_LO_2403","ENG_062_MZB_LO_2403-20.09.2004","20.09.2004",2004,9,20,0.962052738,1
"ENG_062_MZB_LO_2403","ENG_062_MZB_LO_2403-17.10.2005","17.10.2005",2005,10,17,0.962111483,1
"ENG_062_MZB_LO_2403","ENG_062_MZB_LO_2403-14.11.2006","14.11.2006",2006,11,14,0.947268998,2
"ENG_062_MZB_LO_2403","ENG_062_MZB_LO_2403-26.11.2007","26.11.2007",2007,11,26,1.051132838,1
"ENG_062_MZB_LO_2403","ENG_062_MZB_LO_2403-13.10.2008","13.10.2008",2008,10,13,0.910905533,2
"ENG_062_MZB_LO_2403","ENG_062_MZB_LO_2403-19.10.2009","19.10.2009",2009,10,19,0.962872127,1
"ENG_062_MZB_LO_2403","ENG_062_MZB_LO_2403-06.09.2010","06.09.2010",2010,9,6,0.923875277,2
"ENG_062_MZB_LO_2403","ENG_062_MZB_LO_2403-10.10.2011","10.10.2011",2011,10,10,0.854805325,3
"ENG_062_MZB_LO_2403","ENG_062_MZB_LO_2403-03.09.2012","03.09.2012",2012,9,3,0.962683967,2
"ENG_062_MZB_LO_2403","ENG_062_MZB_LO_2403-08.10.2013","08.10.2013",2013,10,8,0.975249771,2
"ENG_062_MZB_LO_2403","ENG_062_MZB_LO_2403-15.10.2014","15.10.2014",2014,10,15,0.949020859,2
"ENG_062_MZB_LO_2403","ENG_062_MZB_LO_2403-03.09.2015","03.09.2015",2015,9,3,0.931560188,2
"ENG_062_MZB_LO_2403","ENG_062_MZB_LO_2403-02.09.2016","02.09.2016",2016,9,2,0.940158509,2
"ENG_062_MZB_LO_2403","ENG_062_MZB_LO_2403-17.09.2019","17.09.2019",2019,9,17,0.962004402,1
"ENG_062_MZB_LO_2403","ENG_062_MZB_LO_2403-28.09.2020","28.09.2020",2020,9,28,0.977503723,1
"ENG_062_MZB_LO_2404","ENG_062_MZB_LO_2404-29.10.2002","29.10.2002",2002,10,29,0.894001217,2
"ENG_062_MZB_LO_2404","ENG_062_MZB_LO_2404-17.11.2003","17.11.2003",2003,11,17,0.927949547,2
"ENG_062_MZB_LO_2404","ENG_062_MZB_LO_2404-22.11.2004","22.11.2004",2004,11,22,0.845041644,3
"ENG_062_MZB_LO_2404","ENG_062_MZB_LO_2404-30.11.2005","30.11.2005",2005,11,30,0.908636649,2
"ENG_062_MZB_LO_2404","ENG_062_MZB_LO_2404-31.10.2006","31.10.2006",2006,10,31,0.934425003,2
"ENG_062_MZB_LO_2404","ENG_062_MZB_LO_2404-12.11.2007","12.11.2007",2007,11,12,0.906033624,2
"ENG_062_MZB_LO_2404","ENG_062_MZB_LO_2404-13.10.2008","13.10.2008",2008,10,13,0.885492683,2
"ENG_062_MZB_LO_2404","ENG_062_MZB_LO_2404-04.11.2009","04.11.2009",2009,11,4,0.898055284,2
"ENG_062_MZB_LO_2404","ENG_062_MZB_LO_2404-10.11.2010","10.11.2010",2010,11,10,0.826532304,3
"ENG_062_MZB_LO_2404","ENG_062_MZB_LO_2404-25.10.2011","25.10.2011",2011,10,25,0.883004007,2
"ENG_062_MZB_LO_2404","ENG_062_MZB_LO_2404-22.10.2012","22.10.2012",2012,10,22,0.82875241,3
"ENG_062_MZB_LO_2404","ENG_062_MZB_LO_2404-02.09.2013","02.09.2013",2013,9,2,0.816818025,3
"ENG_062_MZB_LO_2404","ENG_062_MZB_LO_2404-08.10.2014","08.10.2014",2014,10,8,0.899752759,2
"ENG_062_MZB_LO_2404","ENG_062_MZB_LO_2404-14.09.2015","14.09.2015",2015,9,14,0.822342536,3
"ENG_062_MZB_LO_2404","ENG_062_MZB_LO_2404-10.10.2016","10.10.2016",2016,10,10,0.893306104,2
"ENG_062_MZB_LO_2404","ENG_062_MZB_LO_2404-25.09.2017","25.09.2017",2017,9,25,0.824420246,3
"ENG_062_MZB_LO_2404","ENG_062_MZB_LO_2404-28.09.2018","28.09.2018",2018,9,28,0.896403458,2
"ENG_062_MZB_LO_2405","ENG_062_MZB_LO_2405-04.11.2002","04.11.2002",2002,11,4,0.954840817,2
"ENG_062_MZB_LO_2405","ENG_062_MZB_LO_2405-10.11.2003","10.11.2003",2003,11,10,0.865560036,3
"ENG_062_MZB_LO_2405","ENG_062_MZB_LO_2405-22.11.2004","22.11.2004",2004,11,22,0.953249217,2
"ENG_062_MZB_LO_2405","ENG_062_MZB_LO_2405-21.09.2005","21.09.2005",2005,9,21,0.94283044,2
"ENG_062_MZB_LO_2405","ENG_062_MZB_LO_2405-19.09.2006","19.09.2006",2006,9,19,1.00962987,1
"ENG_062_MZB_LO_2405","ENG_062_MZB_LO_2405-20.10.2008","20.10.2008",2008,10,20,1.012208938,1
"ENG_062_MZB_LO_2405","ENG_062_MZB_LO_2405-02.11.2011","02.11.2011",2011,11,2,0.951562458,2
"ENG_062_MZB_LO_2405","ENG_062_MZB_LO_2405-05.11.2012","05.11.2012",2012,11,5,0.876160957,2
"ENG_062_MZB_LO_2405","ENG_062_MZB_LO_2405-24.09.2013","24.09.2013",2013,9,24,0.884383116,2
"ENG_062_MZB_LO_2405","ENG_062_MZB_LO_2405-19.09.2019","19.09.2019",2019,9,19,1.010640234,1
"ENG_062_MZB_LO_2405","ENG_062_MZB_LO_2405-18.09.2020","18.09.2020",2020,9,18,0.900585838,2
"ENG_062_MZB_LO_2406","ENG_062_MZB_LO_2406-04.11.2002","04.11.2002",2002,11,4,0.902162281,2
"ENG_062_MZB_LO_2406","ENG_062_MZB_LO_2406-10.11.2003","10.11.2003",2003,11,10,0.899655984,2
"ENG_062_MZB_LO_2406","ENG_062_MZB_LO_2406-22.11.2004","22.11.2004",2004,11,22,0.888731995,2
"ENG_062_MZB_LO_2406","ENG_062_MZB_LO_2406-21.09.2005","21.09.2005",2005,9,21,0.91803677,2
"ENG_062_MZB_LO_2406","ENG_062_MZB_LO_2406-19.09.2006","19.09.2006",2006,9,19,0.908552156,2
"ENG_062_MZB_LO_2406","ENG_062_MZB_LO_2406-22.10.2007","22.10.2007",2007,10,22,0.957152503,1
"ENG_062_MZB_LO_2406","ENG_062_MZB_LO_2406-20.10.2008","20.10.2008",2008,10,20,0.918907599,2
"ENG_062_MZB_LO_2406","ENG_062_MZB_LO_2406-20.11.2009","20.11.2009",2009,11,20,0.962422876,2
"ENG_062_MZB_LO_2406","ENG_062_MZB_LO_2406-08.11.2011","08.11.2011",2011,11,8,0.879384065,3
"ENG_062_MZB_LO_2406","ENG_062_MZB_LO_2406-22.10.2012","22.10.2012",2012,10,22,0.914049107,2
"ENG_062_MZB_LO_2406","ENG_062_MZB_LO_2406-07.10.2013","07.10.2013",2013,10,7,0.818317419,3
"ENG_062_MZB_LO_2406","ENG_062_MZB_LO_2406-19.09.2019","19.09.2019",2019,9,19,0.895753394,2
"ENG_062_MZB_LO_2406","ENG_062_MZB_LO_2406-18.09.2020","18.09.2020",2020,9,18,0.959124333,2
"ENG_062_MZB_LO_2406","ENG_062_MZB_LO_2406-22.10.2021","22.10.2021",2021,10,22,0.964906554,2
"ENG_062_MZB_LO_2406","ENG_062_MZB_LO_2406-18.11.2022","18.11.2022",2022,11,18,0.895653735,2
"ENG_062_MZB_LO_2407","ENG_062_MZB_LO_2407-08.10.2002","08.10.2002",2002,10,8,0.984291585,2
"ENG_062_MZB_LO_2407","ENG_062_MZB_LO_2407-21.11.2003","21.11.2003",2003,11,21,0.943300069,3
"ENG_062_MZB_LO_2407","ENG_062_MZB_LO_2407-22.11.2005","22.11.2005",2005,11,22,0.934592915,2
"ENG_062_MZB_LO_2407","ENG_062_MZB_LO_2407-15.11.2006","15.11.2006",2006,11,15,0.997542841,1
"ENG_062_MZB_LO_2407","ENG_062_MZB_LO_2407-01.10.2007","01.10.2007",2007,10,1,0.894165974,2
"ENG_062_MZB_LO_2407","ENG_062_MZB_LO_2407-28.10.2008","28.10.2008",2008,10,28,0.908446631,4
"ENG_062_MZB_LO_2407","ENG_062_MZB_LO_2407-18.11.2009","18.11.2009",2009,11,18,0.852417021,5
"ENG_062_MZB_LO_2407","ENG_062_MZB_LO_2407-01.11.2010","01.11.2010",2010,11,1,0.991948223,2
"ENG_062_MZB_LO_2407","ENG_062_MZB_LO_2407-03.11.2011","03.11.2011",2011,11,3,0.921949702,2
"ENG_062_MZB_LO_2407","ENG_062_MZB_LO_2407-08.10.2012","08.10.2012",2012,10,8,0.916686289,2
"ENG_062_MZB_LO_2407","ENG_062_MZB_LO_2407-03.09.2013","03.09.2013",2013,9,3,0.870443829,3
"ENG_062_MZB_LO_2407","ENG_062_MZB_LO_2407-09.09.2014","09.09.2014",2014,9,9,0.755434059,3
"ENG_062_MZB_LO_2407","ENG_062_MZB_LO_2407-09.09.2015","09.09.2015",2015,9,9,0.818156423,4
"ENG_062_MZB_LO_2407","ENG_062_MZB_LO_2407-29.09.2016","29.09.2016",2016,9,29,0.89666464,2
"ENG_062_MZB_LO_2407","ENG_062_MZB_LO_2407-06.10.2017","06.10.2017",2017,10,6,0.967907087,2
"ENG_062_MZB_LO_2407","ENG_062_MZB_LO_2407-06.09.2018","06.09.2018",2018,9,6,0.880679654,3
"ENG_062_MZB_LO_2407","ENG_062_MZB_LO_2407-24.11.2020","24.11.2020",2020,11,24,0.830299331,3
"ENG_062_MZB_LO_2408","ENG_062_MZB_LO_2408-08.10.2002","08.10.2002",2002,10,8,0.802837662,3
"ENG_062_MZB_LO_2408","ENG_062_MZB_LO_2408-21.11.2003","21.11.2003",2003,11,21,0.915371839,2
"ENG_062_MZB_LO_2408","ENG_062_MZB_LO_2408-22.11.2005","22.11.2005",2005,11,22,0.853597725,3
"ENG_062_MZB_LO_2408","ENG_062_MZB_LO_2408-15.11.2006","15.11.2006",2006,11,15,0.890386625,3
"ENG_062_MZB_LO_2408","ENG_062_MZB_LO_2408-01.10.2007","01.10.2007",2007,10,1,0.863178742,3
"ENG_062_MZB_LO_2408","ENG_062_MZB_LO_2408-18.11.2009","18.11.2009",2009,11,18,0.909008269,3
"ENG_062_MZB_LO_2408","ENG_062_MZB_LO_2408-01.11.2010","01.11.2010",2010,11,1,0.892572352,3
"ENG_062_MZB_LO_2408","ENG_062_MZB_LO_2408-03.11.2011","03.11.2011",2011,11,3,0.93101617,2
"ENG_062_MZB_LO_2408","ENG_062_MZB_LO_2408-04.09.2013","04.09.2013",2013,9,4,0.87053149,3
"ENG_062_MZB_LO_2408","ENG_062_MZB_LO_2408-06.10.2014","06.10.2014",2014,10,6,0.898869429,2
"ENG_062_MZB_LO_2408","ENG_062_MZB_LO_2408-03.11.2015","03.11.2015",2015,11,3,0.876352285,3
"ENG_062_MZB_LO_2408","ENG_062_MZB_LO_2408-06.10.2016","06.10.2016",2016,10,6,0.846700894,3
"ENG_062_MZB_LO_2408","ENG_062_MZB_LO_2408-18.09.2017","18.09.2017",2017,9,18,0.903751966,2
"ENG_062_MZB_LO_2408","ENG_062_MZB_LO_2408-05.09.2019","05.09.2019",2019,9,5,0.864682776,3
"ENG_062_MZB_LO_2408","ENG_062_MZB_LO_2408-27.10.2021","27.10.2021",2021,10,27,0.898002881,2
"ENG_062_MZB_LO_2408","ENG_062_MZB_LO_2408-29.09.2023","29.09.2023",2023,9,29,0.90217083,3
"ENG_062_MZB_LO_2408","ENG_062_MZB_LO_2408-24.09.2024","24.09.2024",2024,9,24,0.911025882,3
"ENG_062_MZB_LO_2409","ENG_062_MZB_LO_2409-30.04.2002","30.04.2002",2002,4,30,0.862204219,3
"ENG_062_MZB_LO_2409","ENG_062_MZB_LO_2409-29.05.2003","29.05.2003",2003,5,29,0.842501494,3
"ENG_062_MZB_LO_2409","ENG_062_MZB_LO_2409-19.04.2004","19.04.2004",2004,4,19,0.898942408,3
"ENG_062_MZB_LO_2409","ENG_062_MZB_LO_2409-26.04.2005","26.04.2005",2005,4,26,0.878129271,3
"ENG_062_MZB_LO_2409","ENG_062_MZB_LO_2409-09.03.2006","09.03.2006",2006,3,9,0.946945488,3
"ENG_062_MZB_LO_2409","ENG_062_MZB_LO_2409-21.05.2007","21.05.2007",2007,5,21,0.853216222,3
"ENG_062_MZB_LO_2409","ENG_062_MZB_LO_2409-14.04.2015","14.04.2015",2015,4,14,0.878258358,3
"ENG_062_MZB_LO_2409","ENG_062_MZB_LO_2409-07.03.2019","07.03.2019",2019,3,7,0.849643139,3
"ENG_062_MZB_LO_2409","ENG_062_MZB_LO_2409-27.04.2021","27.04.2021",2021,4,27,0.922956137,3
"ENG_062_MZB_LO_2410","ENG_062_MZB_LO_2410-29.11.2002","29.11.2002",2002,11,29,0.890673033,3
"ENG_062_MZB_LO_2410","ENG_062_MZB_LO_2410-26.11.2003","26.11.2003",2003,11,26,0.916063153,2
"ENG_062_MZB_LO_2410","ENG_062_MZB_LO_2410-10.10.2006","10.10.2006",2006,10,10,1.006061638,1
"ENG_062_MZB_LO_2410","ENG_062_MZB_LO_2410-30.11.2007","30.11.2007",2007,11,30,1.014194261,1
"ENG_062_MZB_LO_2410","ENG_062_MZB_LO_2410-06.10.2009","06.10.2009",2009,10,6,0.993931868,1
"ENG_062_MZB_LO_2410","ENG_062_MZB_LO_2410-26.10.2010","26.10.2010",2010,10,26,1.016972119,1
"ENG_062_MZB_LO_2410","ENG_062_MZB_LO_2410-14.11.2013","14.11.2013",2013,11,14,0.91342436,2
"ENG_062_MZB_LO_2410","ENG_062_MZB_LO_2410-10.09.2019","10.09.2019",2019,9,10,0.945221217,2
"ENG_062_MZB_LO_2410","ENG_062_MZB_LO_2410-31.10.2021","31.10.2021",2021,10,31,1.138119575,2
"ENG_062_MZB_LO_2411","ENG_062_MZB_LO_2411-09.10.2002","09.10.2002",2002,10,9,0.921398588,5
"ENG_062_MZB_LO_2411","ENG_062_MZB_LO_2411-27.11.2003","27.11.2003",2003,11,27,0.782194578,5
"ENG_062_MZB_LO_2411","ENG_062_MZB_LO_2411-30.09.2004","30.09.2004",2004,9,30,0.914982242,3
"ENG_062_MZB_LO_2411","ENG_062_MZB_LO_2411-08.11.2005","08.11.2005",2005,11,8,0.96301833,5
"ENG_062_MZB_LO_2411","ENG_062_MZB_LO_2411-06.11.2006","06.11.2006",2006,11,6,0.947573387,3
"ENG_062_MZB_LO_2411","ENG_062_MZB_LO_2411-30.11.2007","30.11.2007",2007,11,30,0.86699536,3
"ENG_062_MZB_LO_2411","ENG_062_MZB_LO_2411-19.11.2009","19.11.2009",2009,11,19,0.861260524,5
"ENG_062_MZB_LO_2411","ENG_062_MZB_LO_2411-31.10.2012","31.10.2012",2012,10,31,0.838460895,3
"ENG_062_MZB_LO_2411","ENG_062_MZB_LO_2411-17.09.2014","17.09.2014",2014,9,17,0.894096608,5
"ENG_062_MZB_LO_2411","ENG_062_MZB_LO_2411-24.10.2016","24.10.2016",2016,10,24,0.794085265,5
"ENG_062_MZB_LO_2411","ENG_062_MZB_LO_2411-24.10.2017","24.10.2017",2017,10,24,0.880768785,5
"ENG_062_MZB_LO_2411","ENG_062_MZB_LO_2411-19.09.2019","19.09.2019",2019,9,19,0.665162749,5
"ENG_062_MZB_LO_2411","ENG_062_MZB_LO_2411-16.11.2020","16.11.2020",2020,11,16,0.835075885,5
"ENG_062_MZB_LO_2413","ENG_062_MZB_LO_2413-12.11.2002","12.11.2002",2002,11,12,0.913521081,2
"ENG_062_MZB_LO_2413","ENG_062_MZB_LO_2413-27.10.2003","27.10.2003",2003,10,27,0.904092246,2
"ENG_062_MZB_LO_2413","ENG_062_MZB_LO_2413-14.11.2005","14.11.2005",2005,11,14,0.955409923,2
"ENG_062_MZB_LO_2413","ENG_062_MZB_LO_2413-28.09.2006","28.09.2006",2006,9,28,0.981637256,2
"ENG_062_MZB_LO_2413","ENG_062_MZB_LO_2413-26.11.2007","26.11.2007",2007,11,26,0.983151902,1
"ENG_062_MZB_LO_2413","ENG_062_MZB_LO_2413-03.11.2008","03.11.2008",2008,11,3,0.990426491,3
"ENG_062_MZB_LO_2413","ENG_062_MZB_LO_2413-22.09.2009","22.09.2009",2009,9,22,0.945229974,3
"ENG_062_MZB_LO_2413","ENG_062_MZB_LO_2413-06.11.2012","06.11.2012",2012,11,6,0.872064903,3
"ENG_062_MZB_LO_2413","ENG_062_MZB_LO_2413-09.09.2019","09.09.2019",2019,9,9,0.844561655,4
"ENG_062_MZB_LO_2413","ENG_062_MZB_LO_2413-11.10.2021","11.10.2021",2021,10,11,0.975298599,2
"ENG_062_MZB_LO_2413","ENG_062_MZB_LO_2413-21.10.2022","21.10.2022",2022,10,21,0.826883032,5
"ENG_062_MZB_LO_2413","ENG_062_MZB_LO_2413-12.09.2023","12.09.2023",2023,9,12,0.706373137,5
"ENG_062_MZB_LO_2414","ENG_062_MZB_LO_2414-12.11.2002","12.11.2002",2002,11,12,0.9084789,5
"ENG_062_MZB_LO_2414","ENG_062_MZB_LO_2414-27.10.2003","27.10.2003",2003,10,27,1.037547157,2
"ENG_062_MZB_LO_2414","ENG_062_MZB_LO_2414-14.11.2005","14.11.2005",2005,11,14,1.049464504,1
"ENG_062_MZB_LO_2414","ENG_062_MZB_LO_2414-28.09.2006","28.09.2006",2006,9,28,1.06641579,1
"ENG_062_MZB_LO_2414","ENG_062_MZB_LO_2414-26.11.2007","26.11.2007",2007,11,26,1.125932921,3
"ENG_062_MZB_LO_2414","ENG_062_MZB_LO_2414-03.11.2008","03.11.2008",2008,11,3,1.106489729,5
"ENG_062_MZB_LO_2414","ENG_062_MZB_LO_2414-22.09.2009","22.09.2009",2009,9,22,1.070588826,4
"ENG_062_MZB_LO_2414","ENG_062_MZB_LO_2414-28.09.2010","28.09.2010",2010,9,28,1.004202952,3
"ENG_062_MZB_LO_2414","ENG_062_MZB_LO_2414-26.09.2011","26.09.2011",2011,9,26,1.018812325,3
"ENG_062_MZB_LO_2414","ENG_062_MZB_LO_2414-16.09.2013","16.09.2013",2013,9,16,1.138390005,3
"ENG_062_MZB_LO_2414","ENG_062_MZB_LO_2414-20.10.2015","20.10.2015",2015,10,20,0.849284161,5
"ENG_062_MZB_LO_2414","ENG_062_MZB_LO_2414-23.09.2016","23.09.2016",2016,9,23,0.976669905,4
"ENG_062_MZB_LO_2414","ENG_062_MZB_LO_2414-11.10.2017","11.10.2017",2017,10,11,0.798401308,5
"ENG_062_MZB_LO_2414","ENG_062_MZB_LO_2414-29.10.2018","29.10.2018",2018,10,29,1.03985093,3
"ENG_062_MZB_LO_2414","ENG_062_MZB_LO_2414-21.09.2021","21.09.2021",2021,9,21,1.1903927,3
"ENG_062_MZB_LO_2414","ENG_062_MZB_LO_2414-15.09.2022","15.09.2022",2022,9,15,0.720298386,5
"ENG_062_MZB_LO_2414","ENG_062_MZB_LO_2414-20.09.2023","20.09.2023",2023,9,20,0.893827388,5
"ENG_062_MZB_LO_2415","ENG_062_MZB_LO_2415-27.10.2003","27.10.2003",2003,10,27,0.96324764,2
"ENG_062_MZB_LO_2415","ENG_062_MZB_LO_2415-14.11.2005","14.11.2005",2005,11,14,1.058730206,1
"ENG_062_MZB_LO_2415","ENG_062_MZB_LO_2415-24.11.2006","24.11.2006",2006,11,24,1.018641341,2
"ENG_062_MZB_LO_2415","ENG_062_MZB_LO_2415-26.11.2007","26.11.2007",2007,11,26,1.089251035,2
"ENG_062_MZB_LO_2415","ENG_062_MZB_LO_2415-03.11.2008","03.11.2008",2008,11,3,1.016841126,4
"ENG_062_MZB_LO_2415","ENG_062_MZB_LO_2415-22.09.2009","22.09.2009",2009,9,22,1.093447955,2
"ENG_062_MZB_LO_2415","ENG_062_MZB_LO_2415-28.09.2010","28.09.2010",2010,9,28,1.078071482,1
"ENG_062_MZB_LO_2415","ENG_062_MZB_LO_2415-25.10.2011","25.10.2011",2011,10,25,0.991844793,2
"ENG_062_MZB_LO_2415","ENG_062_MZB_LO_2415-16.09.2013","16.09.2013",2013,9,16,1.045050003,2
"ENG_062_MZB_LO_2415","ENG_062_MZB_LO_2415-10.09.2014","10.09.2014",2014,9,10,1.094962365,1
"ENG_062_MZB_LO_2415","ENG_062_MZB_LO_2415-21.10.2015","21.10.2015",2015,10,21,1.162804537,2
"ENG_062_MZB_LO_2415","ENG_062_MZB_LO_2415-21.09.2016","21.09.2016",2016,9,21,0.906129162,3
"ENG_062_MZB_LO_2415","ENG_062_MZB_LO_2415-17.10.2017","17.10.2017",2017,10,17,0.845696555,3
"ENG_062_MZB_LO_2415","ENG_062_MZB_LO_2415-05.09.2019","05.09.2019",2019,9,5,1.081775541,1
"ENG_062_MZB_LO_2415","ENG_062_MZB_LO_2415-14.10.2020","14.10.2020",2020,10,14,0.992441549,1
"ENG_062_MZB_LO_2415","ENG_062_MZB_LO_2415-16.09.2021","16.09.2021",2021,9,16,1.018649951,3
"ENG_062_MZB_LO_2416","ENG_062_MZB_LO_2416-18.11.2002","18.11.2002",2002,11,18,1.018691224,2
"ENG_062_MZB_LO_2416","ENG_062_MZB_LO_2416-27.10.2003","27.10.2003",2003,10,27,0.973902881,1
"ENG_062_MZB_LO_2416","ENG_062_MZB_LO_2416-14.11.2005","14.11.2005",2005,11,14,1.027412051,1
"ENG_062_MZB_LO_2416","ENG_062_MZB_LO_2416-24.11.2006","24.11.2006",2006,11,24,0.928616818,3
"ENG_062_MZB_LO_2416","ENG_062_MZB_LO_2416-26.11.2007","26.11.2007",2007,11,26,0.977626907,2
"ENG_062_MZB_LO_2416","ENG_062_MZB_LO_2416-22.09.2009","22.09.2009",2009,9,22,0.926319906,3
"ENG_062_MZB_LO_2416","ENG_062_MZB_LO_2416-28.09.2010","28.09.2010",2010,9,28,1.013405678,3
"ENG_062_MZB_LO_2416","ENG_062_MZB_LO_2416-25.10.2011","25.10.2011",2011,10,25,0.998656546,3
"ENG_062_MZB_LO_2416","ENG_062_MZB_LO_2416-08.10.2012","08.10.2012",2012,10,8,1.074164853,2
"ENG_062_MZB_LO_2416","ENG_062_MZB_LO_2416-19.09.2016","19.09.2016",2016,9,19,0.93885595,2
"ENG_062_MZB_LO_2416","ENG_062_MZB_LO_2416-18.10.2017","18.10.2017",2017,10,18,0.945655753,3
"ENG_062_MZB_LO_2416","ENG_062_MZB_LO_2416-06.11.2018","06.11.2018",2018,11,6,1.056695918,1
"ENG_062_MZB_LO_2416","ENG_062_MZB_LO_2416-09.09.2019","09.09.2019",2019,9,9,1.043978351,2
"ENG_062_MZB_LO_2417","ENG_062_MZB_LO_2417-18.11.2002","18.11.2002",2002,11,18,0.89111619,2
"ENG_062_MZB_LO_2417","ENG_062_MZB_LO_2417-27.10.2003","27.10.2003",2003,10,27,0.91149041,2
"ENG_062_MZB_LO_2417","ENG_062_MZB_LO_2417-14.11.2005","14.11.2005",2005,11,14,0.949652722,2
"ENG_062_MZB_LO_2417","ENG_062_MZB_LO_2417-24.11.2006","24.11.2006",2006,11,24,0.974085648,2
"ENG_062_MZB_LO_2417","ENG_062_MZB_LO_2417-26.11.2007","26.11.2007",2007,11,26,0.978647489,1
"ENG_062_MZB_LO_2417","ENG_062_MZB_LO_2417-22.09.2009","22.09.2009",2009,9,22,1.069039408,2
"ENG_062_MZB_LO_2417","ENG_062_MZB_LO_2417-28.09.2010","28.09.2010",2010,9,28,1.007286889,1
"ENG_062_MZB_LO_2417","ENG_062_MZB_LO_2417-26.09.2011","26.09.2011",2011,9,26,1.044054736,1
"ENG_062_MZB_LO_2417","ENG_062_MZB_LO_2417-09.09.2014","09.09.2014",2014,9,9,1.094591641,1
"ENG_062_MZB_LO_2417","ENG_062_MZB_LO_2417-26.10.2015","26.10.2015",2015,10,26,0.972294823,2
"ENG_062_MZB_LO_2417","ENG_062_MZB_LO_2417-13.10.2017","13.10.2017",2017,10,13,0.905920066,2
"ENG_062_MZB_LO_2417","ENG_062_MZB_LO_2417-06.11.2018","06.11.2018",2018,11,6,0.99093357,2
"ENG_062_MZB_LO_2417","ENG_062_MZB_LO_2417-31.10.2021","31.10.2021",2021,10,31,0.92566101,3
"ENG_062_MZB_LO_2418","ENG_062_MZB_LO_2418-09.10.2002","09.10.2002",2002,10,9,0.92922324,3
"ENG_062_MZB_LO_2418","ENG_062_MZB_LO_2418-24.11.2003","24.11.2003",2003,11,24,0.90008759,4
"ENG_062_MZB_LO_2418","ENG_062_MZB_LO_2418-30.09.2004","30.09.2004",2004,9,30,0.839949129,3
"ENG_062_MZB_LO_2418","ENG_062_MZB_LO_2418-08.11.2005","08.11.2005",2005,11,8,0.843287111,5
"ENG_062_MZB_LO_2418","ENG_062_MZB_LO_2418-06.11.2006","06.11.2006",2006,11,6,0.846232743,3
"ENG_062_MZB_LO_2418","ENG_062_MZB_LO_2418-19.11.2007","19.11.2007",2007,11,19,0.847290634,3
"ENG_062_MZB_LO_2418","ENG_062_MZB_LO_2418-17.11.2009","17.11.2009",2009,11,17,0.81888657,3
"ENG_062_MZB_LO_2418","ENG_062_MZB_LO_2418-18.11.2010","18.11.2010",2010,11,18,0.746612969,5
"ENG_062_MZB_LO_2418","ENG_062_MZB_LO_2418-11.10.2011","11.10.2011",2011,10,11,0.708896801,4
"ENG_062_MZB_LO_2418","ENG_062_MZB_LO_2418-21.11.2012","21.11.2012",2012,11,21,0.871404209,3
"ENG_062_MZB_LO_2418","ENG_062_MZB_LO_2418-27.11.2015","27.11.2015",2015,11,27,0.832590912,3
"ENG_062_MZB_LO_2418","ENG_062_MZB_LO_2418-30.11.2016","30.11.2016",2016,11,30,0.816913148,3
"ENG_062_MZB_LO_2418","ENG_062_MZB_LO_2418-30.10.2017","30.10.2017",2017,10,30,0.875957904,3
"ENG_062_MZB_LO_2418","ENG_062_MZB_LO_2418-24.10.2019","24.10.2019",2019,10,24,0.678603731,4
"ENG_062_MZB_LO_2420","ENG_062_MZB_LO_2420-12.11.2002","12.11.2002",2002,11,12,0.988847574,1
"ENG_062_MZB_LO_2420","ENG_062_MZB_LO_2420-02.09.2003","02.09.2003",2003,9,2,1.053375819,1
"ENG_062_MZB_LO_2420","ENG_062_MZB_LO_2420-07.11.2005","07.11.2005",2005,11,7,1.005247448,1
"ENG_062_MZB_LO_2420","ENG_062_MZB_LO_2420-06.09.2006","06.09.2006",2006,9,6,1.062862927,1
"ENG_062_MZB_LO_2420","ENG_062_MZB_LO_2420-19.11.2007","19.11.2007",2007,11,19,1.131902872,1
"ENG_062_MZB_LO_2420","ENG_062_MZB_LO_2420-28.11.2008","28.11.2008",2008,11,28,1.124769982,1
"ENG_062_MZB_LO_2420","ENG_062_MZB_LO_2420-07.10.2009","07.10.2009",2009,10,7,1.024465243,1
"ENG_062_MZB_LO_2420","ENG_062_MZB_LO_2420-05.10.2010","05.10.2010",2010,10,5,1.142273077,1
"ENG_062_MZB_LO_2420","ENG_062_MZB_LO_2420-19.09.2011","19.09.2011",2011,9,19,1.038550356,1
"ENG_062_MZB_LO_2420","ENG_062_MZB_LO_2420-08.10.2012","08.10.2012",2012,10,8,1.146493284,1
"ENG_062_MZB_LO_2420","ENG_062_MZB_LO_2420-14.11.2013","14.11.2013",2013,11,14,1.091696822,1
"ENG_062_MZB_LO_2420","ENG_062_MZB_LO_2420-28.10.2014","28.10.2014",2014,10,28,1.042151764,1
"ENG_062_MZB_LO_2420","ENG_062_MZB_LO_2420-24.09.2015","24.09.2015",2015,9,24,1.059381185,1
"ENG_062_MZB_LO_2420","ENG_062_MZB_LO_2420-08.09.2016","08.09.2016",2016,9,8,1.106925432,1
"ENG_062_MZB_LO_2420","ENG_062_MZB_LO_2420-16.10.2017","16.10.2017",2017,10,16,1.105299538,1
"ENG_062_MZB_LO_2420","ENG_062_MZB_LO_2420-19.10.2018","19.10.2018",2018,10,19,1.100393954,1
"ENG_062_MZB_LO_2420","ENG_062_MZB_LO_2420-24.09.2020","24.09.2020",2020,9,24,1.08100727,1
"ENG_062_MZB_LO_2420","ENG_062_MZB_LO_2420-24.09.2021","24.09.2021",2021,9,24,1.198427712,1
"ENG_062_MZB_LO_2420","ENG_062_MZB_LO_2420-21.10.2022","21.10.2022",2022,10,21,1.18019293,1
"ENG_062_MZB_LO_2420","ENG_062_MZB_LO_2420-07.10.2024","07.10.2024",2024,10,7,1.183376981,1
"ENG_062_MZB_LO_2421","ENG_062_MZB_LO_2421-18.11.2002","18.11.2002",2002,11,18,1.101125923,1
"ENG_062_MZB_LO_2421","ENG_062_MZB_LO_2421-02.09.2003","02.09.2003",2003,9,2,1.120444781,1
"ENG_062_MZB_LO_2421","ENG_062_MZB_LO_2421-16.09.2004","16.09.2004",2004,9,16,1.142006187,1
"ENG_062_MZB_LO_2421","ENG_062_MZB_LO_2421-07.11.2005","07.11.2005",2005,11,7,1.123446713,1
"ENG_062_MZB_LO_2421","ENG_062_MZB_LO_2421-02.10.2006","02.10.2006",2006,10,2,1.153237411,1
"ENG_062_MZB_LO_2421","ENG_062_MZB_LO_2421-19.11.2007","19.11.2007",2007,11,19,1.130318823,1
"ENG_062_MZB_LO_2421","ENG_062_MZB_LO_2421-28.11.2008","28.11.2008",2008,11,28,1.174837419,1
"ENG_062_MZB_LO_2421","ENG_062_MZB_LO_2421-07.10.2009","07.10.2009",2009,10,7,1.139225159,1
"ENG_062_MZB_LO_2421","ENG_062_MZB_LO_2421-27.09.2011","27.09.2011",2011,9,27,1.04971392,1
"ENG_062_MZB_LO_2421","ENG_062_MZB_LO_2421-30.10.2012","30.10.2012",2012,10,30,1.157750597,1
"ENG_062_MZB_LO_2421","ENG_062_MZB_LO_2421-05.11.2013","05.11.2013",2013,11,5,1.100103351,1
"ENG_062_MZB_LO_2421","ENG_062_MZB_LO_2421-20.09.2021","20.09.2021",2021,9,20,1.263765539,1
"ENG_062_MZB_LO_2421","ENG_062_MZB_LO_2421-06.11.2022","06.11.2022",2022,11,6,1.058405573,1
"ENG_062_MZB_LO_2421","ENG_062_MZB_LO_2421-21.09.2023","21.09.2023",2023,9,21,1.042879955,2
"ENG_062_MZB_LO_2421","ENG_062_MZB_LO_2421-22.10.2024","22.10.2024",2024,10,22,1.186557752,3
"ENG_062_MZB_LO_2422","ENG_062_MZB_LO_2422-27.05.2002","27.05.2002",2002,5,27,0.920376906,3
"ENG_062_MZB_LO_2422","ENG_062_MZB_LO_2422-20.05.2003","20.05.2003",2003,5,20,0.866407408,3
"ENG_062_MZB_LO_2422","ENG_062_MZB_LO_2422-24.05.2004","24.05.2004",2004,5,24,0.929765042,3
"ENG_062_MZB_LO_2422","ENG_062_MZB_LO_2422-09.05.2005","09.05.2005",2005,5,9,0.903072791,2
"ENG_062_MZB_LO_2422","ENG_062_MZB_LO_2422-08.05.2006","08.05.2006",2006,5,8,0.945787631,2
"ENG_062_MZB_LO_2422","ENG_062_MZB_LO_2422-23.04.2007","23.04.2007",2007,4,23,0.928897603,2
"ENG_062_MZB_LO_2422","ENG_062_MZB_LO_2422-06.03.2008","06.03.2008",2008,3,6,0.97584449,2
"ENG_062_MZB_LO_2422","ENG_062_MZB_LO_2422-18.05.2009","18.05.2009",2009,5,18,0.92511304,3
"ENG_062_MZB_LO_2422","ENG_062_MZB_LO_2422-20.05.2011","20.05.2011",2011,5,20,1.016209063,1
"ENG_062_MZB_LO_2422","ENG_062_MZB_LO_2422-28.05.2012","28.05.2012",2012,5,28,0.951967905,3
"ENG_062_MZB_LO_2422","ENG_062_MZB_LO_2422-20.05.2013","20.05.2013",2013,5,20,0.839599774,4
"ENG_062_MZB_LO_2423","ENG_062_MZB_LO_2423-16.09.2002","16.09.2002",2002,9,16,1.083253671,1
"ENG_062_MZB_LO_2423","ENG_062_MZB_LO_2423-27.10.2003","27.10.2003",2003,10,27,1.01953167,1
"ENG_062_MZB_LO_2423","ENG_062_MZB_LO_2423-22.11.2004","22.11.2004",2004,11,22,1.052209184,1
"ENG_062_MZB_LO_2423","ENG_062_MZB_LO_2423-07.10.2005","07.10.2005",2005,10,7,1.072048256,1
"ENG_062_MZB_LO_2423","ENG_062_MZB_LO_2423-19.10.2006","19.10.2006",2006,10,19,1.028581922,1
"ENG_062_MZB_LO_2423","ENG_062_MZB_LO_2423-21.11.2007","21.11.2007",2007,11,21,1.033857305,1
"ENG_062_MZB_LO_2423","ENG_062_MZB_LO_2423-23.09.2009","23.09.2009",2009,9,23,1.123144509,1
"ENG_062_MZB_LO_2423","ENG_062_MZB_LO_2423-20.10.2011","20.10.2011",2011,10,20,1.069516162,1
"ENG_062_MZB_LO_2423","ENG_062_MZB_LO_2423-30.10.2012","30.10.2012",2012,10,30,1.136228873,1
"ENG_062_MZB_LO_2423","ENG_062_MZB_LO_2423-24.09.2015","24.09.2015",2015,9,24,0.961308508,2
"ENG_062_MZB_LO_2423","ENG_062_MZB_LO_2423-27.10.2016","27.10.2016",2016,10,27,1.006745223,1
"ENG_062_MZB_LO_2423","ENG_062_MZB_LO_2423-26.10.2017","26.10.2017",2017,10,26,1.045168754,1
"ENG_062_MZB_LO_2423","ENG_062_MZB_LO_2423-27.09.2018","27.09.2018",2018,9,27,1.076542088,1
"ENG_062_MZB_LO_2423","ENG_062_MZB_LO_2423-06.11.2019","06.11.2019",2019,11,6,0.993291924,1
"ENG_062_MZB_LO_2423","ENG_062_MZB_LO_2423-22.09.2020","22.09.2020",2020,9,22,1.046052979,1
"ENG_062_MZB_LO_2423","ENG_062_MZB_LO_2423-04.10.2023","04.10.2023",2023,10,4,1.027396049,1
"ENG_062_MZB_LO_2424","ENG_062_MZB_LO_2424-12.11.2002","12.11.2002",2002,11,12,0.677913039,5
"ENG_062_MZB_LO_2424","ENG_062_MZB_LO_2424-27.10.2003","27.10.2003",2003,10,27,0.736162867,4
"ENG_062_MZB_LO_2424","ENG_062_MZB_LO_2424-15.11.2004","15.11.2004",2004,11,15,0.725177201,4
"ENG_062_MZB_LO_2424","ENG_062_MZB_LO_2424-14.11.2005","14.11.2005",2005,11,14,0.783801962,3
"ENG_062_MZB_LO_2424","ENG_062_MZB_LO_2424-24.11.2006","24.11.2006",2006,11,24,0.776880098,3
"ENG_062_MZB_LO_2424","ENG_062_MZB_LO_2424-26.11.2007","26.11.2007",2007,11,26,0.715256158,4
"ENG_062_MZB_LO_2424","ENG_062_MZB_LO_2424-22.09.2009","22.09.2009",2009,9,22,0.584818883,5
"ENG_062_MZB_LO_2424","ENG_062_MZB_LO_2424-25.10.2011","25.10.2011",2011,10,25,0.699331677,4
"ENG_062_MZB_LO_2424","ENG_062_MZB_LO_2424-08.10.2012","08.10.2012",2012,10,8,0.73043902,4
"ENG_062_MZB_LO_2424","ENG_062_MZB_LO_2424-30.09.2014","30.09.2014",2014,9,30,0.870603218,3
"ENG_062_MZB_LO_2424","ENG_062_MZB_LO_2424-23.09.2015","23.09.2015",2015,9,23,0.719043118,4
"ENG_062_MZB_LO_2424","ENG_062_MZB_LO_2424-10.10.2016","10.10.2016",2016,10,10,0.620462762,5
"ENG_062_MZB_LO_2424","ENG_062_MZB_LO_2424-17.10.2017","17.10.2017",2017,10,17,0.693415363,5
"ENG_062_MZB_LO_2424","ENG_062_MZB_LO_2424-05.11.2018","05.11.2018",2018,11,5,0.717489489,5
"ENG_062_MZB_LO_2424","ENG_062_MZB_LO_2424-22.10.2019","22.10.2019",2019,10,22,0.676781308,5
"ENG_062_MZB_LO_2424","ENG_062_MZB_LO_2424-27.11.2020","27.11.2020",2020,11,27,0.705533466,5
"ENG_062_MZB_LO_2425","ENG_062_MZB_LO_2425-18.11.2002","18.11.2002",2002,11,18,1.052532549,1
"ENG_062_MZB_LO_2425","ENG_062_MZB_LO_2425-27.10.2003","27.10.2003",2003,10,27,1.080577645,1
"ENG_062_MZB_LO_2425","ENG_062_MZB_LO_2425-15.11.2004","15.11.2004",2004,11,15,1.075830849,1
"ENG_062_MZB_LO_2425","ENG_062_MZB_LO_2425-14.11.2005","14.11.2005",2005,11,14,1.072317451,1
"ENG_062_MZB_LO_2425","ENG_062_MZB_LO_2425-07.11.2006","07.11.2006",2006,11,7,1.112161729,1
"ENG_062_MZB_LO_2425","ENG_062_MZB_LO_2425-02.11.2007","02.11.2007",2007,11,2,1.104257946,1
"ENG_062_MZB_LO_2425","ENG_062_MZB_LO_2425-26.10.2009","26.10.2009",2009,10,26,1.165455843,1
"ENG_062_MZB_LO_2425","ENG_062_MZB_LO_2425-01.11.2011","01.11.2011",2011,11,1,1.098430626,1
"ENG_062_MZB_LO_2425","ENG_062_MZB_LO_2425-11.09.2013","11.09.2013",2013,9,11,1.120027073,1
"ENG_062_MZB_LO_2425","ENG_062_MZB_LO_2425-17.09.2014","17.09.2014",2014,9,17,1.083045704,1
"ENG_062_MZB_LO_2425","ENG_062_MZB_LO_2425-26.10.2015","26.10.2015",2015,10,26,1.096072191,1
"ENG_062_MZB_LO_2425","ENG_062_MZB_LO_2425-14.09.2016","14.09.2016",2016,9,14,0.954733163,3
"ENG_062_MZB_LO_2425","ENG_062_MZB_LO_2425-10.10.2017","10.10.2017",2017,10,10,1.025678023,1
"ENG_062_MZB_LO_2426","ENG_062_MZB_LO_2426-18.11.2002","18.11.2002",2002,11,18,1.006120692,1
"ENG_062_MZB_LO_2426","ENG_062_MZB_LO_2426-24.09.2003","24.09.2003",2003,9,24,1.065386481,1
"ENG_062_MZB_LO_2426","ENG_062_MZB_LO_2426-19.11.2004","19.11.2004",2004,11,19,1.083554759,1
"ENG_062_MZB_LO_2426","ENG_062_MZB_LO_2426-07.11.2005","07.11.2005",2005,11,7,1.036898693,1
"ENG_062_MZB_LO_2426","ENG_062_MZB_LO_2426-25.09.2006","25.09.2006",2006,9,25,1.054399347,1
"ENG_062_MZB_LO_2426","ENG_062_MZB_LO_2426-29.11.2007","29.11.2007",2007,11,29,1.141233503,1
"ENG_062_MZB_LO_2426","ENG_062_MZB_LO_2426-25.11.2008","25.11.2008",2008,11,25,1.064274897,1
"ENG_062_MZB_LO_2426","ENG_062_MZB_LO_2426-07.10.2009","07.10.2009",2009,10,7,1.029790924,1
"ENG_062_MZB_LO_2426","ENG_062_MZB_LO_2426-05.10.2010","05.10.2010",2010,10,5,1.18015475,1
"ENG_062_MZB_LO_2426","ENG_062_MZB_LO_2426-19.09.2011","19.09.2011",2011,9,19,0.985327878,1
"ENG_062_MZB_LO_2426","ENG_062_MZB_LO_2426-08.10.2013","08.10.2013",2013,10,8,1.101211039,1
"ENG_062_MZB_LO_2426","ENG_062_MZB_LO_2426-15.09.2014","15.09.2014",2014,9,15,1.121281714,1
"ENG_062_MZB_LO_2426","ENG_062_MZB_LO_2426-24.09.2015","24.09.2015",2015,9,24,1.068220728,1
"ENG_062_MZB_LO_2426","ENG_062_MZB_LO_2426-28.11.2016","28.11.2016",2016,11,28,0.965067681,1
"ENG_062_MZB_LO_2426","ENG_062_MZB_LO_2426-25.10.2017","25.10.2017",2017,10,25,0.892292235,2
"ENG_062_MZB_LO_2426","ENG_062_MZB_LO_2426-07.11.2018","07.11.2018",2018,11,7,0.923263003,2
"ENG_062_MZB_LO_2426","ENG_062_MZB_LO_2426-15.10.2021","15.10.2021",2021,10,15,1.01214987,1
"ENG_062_MZB_LO_2427","ENG_062_MZB_LO_2427-18.11.2002","18.11.2002",2002,11,18,0.875782006,2
"ENG_062_MZB_LO_2427","ENG_062_MZB_LO_2427-24.09.2003","24.09.2003",2003,9,24,0.828820896,3
"ENG_062_MZB_LO_2427","ENG_062_MZB_LO_2427-16.09.2004","16.09.2004",2004,9,16,0.805170139,3
"ENG_062_MZB_LO_2427","ENG_062_MZB_LO_2427-07.11.2005","07.11.2005",2005,11,7,0.87749791,2
"ENG_062_MZB_LO_2427","ENG_062_MZB_LO_2427-25.09.2006","25.09.2006",2006,9,25,0.758070703,3
"ENG_062_MZB_LO_2427","ENG_062_MZB_LO_2427-19.11.2007","19.11.2007",2007,11,19,0.78241396,3
"ENG_062_MZB_LO_2427","ENG_062_MZB_LO_2427-25.11.2008","25.11.2008",2008,11,25,0.849760843,3
"ENG_062_MZB_LO_2427","ENG_062_MZB_LO_2427-07.10.2009","07.10.2009",2009,10,7,0.799243722,3
"ENG_062_MZB_LO_2427","ENG_062_MZB_LO_2427-05.10.2010","05.10.2010",2010,10,5,0.87892985,2
"ENG_062_MZB_LO_2427","ENG_062_MZB_LO_2427-19.09.2011","19.09.2011",2011,9,19,0.853764057,3
"ENG_062_MZB_LO_2427","ENG_062_MZB_LO_2427-20.11.2012","20.11.2012",2012,11,20,0.8672752,2
"ENG_062_MZB_LO_2427","ENG_062_MZB_LO_2427-30.09.2013","30.09.2013",2013,9,30,0.837094865,3
"ENG_062_MZB_LO_2427","ENG_062_MZB_LO_2427-29.09.2014","29.09.2014",2014,9,29,0.908082059,2
"ENG_062_MZB_LO_2427","ENG_062_MZB_LO_2427-24.09.2015","24.09.2015",2015,9,24,0.908006301,2
"ENG_062_MZB_LO_2427","ENG_062_MZB_LO_2427-29.11.2016","29.11.2016",2016,11,29,0.885937825,2
"ENG_062_MZB_LO_2427","ENG_062_MZB_LO_2427-25.10.2017","25.10.2017",2017,10,25,0.944910951,2
"ENG_062_MZB_LO_2427","ENG_062_MZB_LO_2427-23.11.2018","23.11.2018",2018,11,23,0.850240109,3
"ENG_062_MZB_LO_2427","ENG_062_MZB_LO_2427-30.11.2020","30.11.2020",2020,11,30,0.828103447,3
"ENG_062_MZB_LO_2428","ENG_062_MZB_LO_2428-04.10.2002","04.10.2002",2002,10,4,1.089671808,4
"ENG_062_MZB_LO_2428","ENG_062_MZB_LO_2428-30.09.2003","30.09.2003",2003,9,30,1.099060785,2
"ENG_062_MZB_LO_2428","ENG_062_MZB_LO_2428-04.10.2004","04.10.2004",2004,10,4,1.054938981,2
"ENG_062_MZB_LO_2428","ENG_062_MZB_LO_2428-26.09.2005","26.09.2005",2005,9,26,1.047885759,2
"ENG_062_MZB_LO_2428","ENG_062_MZB_LO_2428-30.11.2006","30.11.2006",2006,11,30,1.058146369,2
"ENG_062_MZB_LO_2428","ENG_062_MZB_LO_2428-30.10.2007","30.10.2007",2007,10,30,1.116356497,1
"ENG_062_MZB_LO_2428","ENG_062_MZB_LO_2428-31.10.2012","31.10.2012",2012,10,31,1.179417414,2
"ENG_062_MZB_LO_2428","ENG_062_MZB_LO_2428-22.10.2014","22.10.2014",2014,10,22,1.028891991,3
"ENG_062_MZB_LO_2428","ENG_062_MZB_LO_2428-16.09.2015","16.09.2015",2015,9,16,0.947345276,3
"ENG_062_MZB_LO_2428","ENG_062_MZB_LO_2428-22.09.2016","22.09.2016",2016,9,22,1.212887219,3
"ENG_062_MZB_LO_2428","ENG_062_MZB_LO_2428-25.09.2017","25.09.2017",2017,9,25,1.291968843,4
"ENG_062_MZB_LO_2428","ENG_062_MZB_LO_2428-19.10.2018","19.10.2018",2018,10,19,1.084541462,1
"ENG_062_MZB_LO_2428","ENG_062_MZB_LO_2428-28.10.2021","28.10.2021",2021,10,28,1.144744417,5
"ENG_062_MZB_LO_2430","ENG_062_MZB_LO_2430-30.09.2002","30.09.2002",2002,9,30,0.788490868,3
"ENG_062_MZB_LO_2430","ENG_062_MZB_LO_2430-06.10.2003","06.10.2003",2003,10,6,0.954663596,2
"ENG_062_MZB_LO_2430","ENG_062_MZB_LO_2430-02.09.2004","02.09.2004",2004,9,2,0.987387734,1
"ENG_062_MZB_LO_2430","ENG_062_MZB_LO_2430-01.11.2006","01.11.2006",2006,11,1,0.930339139,2
"ENG_062_MZB_LO_2430","ENG_062_MZB_LO_2430-22.10.2007","22.10.2007",2007,10,22,0.971548575,2
"ENG_062_MZB_LO_2430","ENG_062_MZB_LO_2430-22.09.2008","22.09.2008",2008,9,22,0.887126823,2
"ENG_062_MZB_LO_2430","ENG_062_MZB_LO_2430-15.09.2009","15.09.2009",2009,9,15,0.924535834,2
"ENG_062_MZB_LO_2430","ENG_062_MZB_LO_2430-02.11.2010","02.11.2010",2010,11,2,0.818762979,3
"ENG_062_MZB_LO_2430","ENG_062_MZB_LO_2430-20.11.2012","20.11.2012",2012,11,20,0.782152974,3
"ENG_062_MZB_LO_2430","ENG_062_MZB_LO_2430-22.10.2013","22.10.2013",2013,10,22,0.853027699,3
"ENG_062_MZB_LO_2430","ENG_062_MZB_LO_2430-06.11.2014","06.11.2014",2014,11,6,0.850283801,3
"ENG_062_MZB_LO_2430","ENG_062_MZB_LO_2430-25.11.2015","25.11.2015",2015,11,25,0.878778681,3
"ENG_062_MZB_LO_2430","ENG_062_MZB_LO_2430-27.09.2016","27.09.2016",2016,9,27,0.752329323,3
"ENG_062_MZB_LO_2430","ENG_062_MZB_LO_2430-11.10.2017","11.10.2017",2017,10,11,0.790798838,3
"ENG_062_MZB_LO_2430","ENG_062_MZB_LO_2430-16.11.2018","16.11.2018",2018,11,16,0.835168978,3
"ENG_062_MZB_LO_2430","ENG_062_MZB_LO_2430-04.09.2019","04.09.2019",2019,9,4,0.799653774,3
"ENG_062_MZB_LO_2430","ENG_062_MZB_LO_2430-25.09.2020","25.09.2020",2020,9,25,0.882211809,2
"ENG_062_MZB_LO_2430","ENG_062_MZB_LO_2430-22.09.2021","22.09.2021",2021,9,22,0.886777526,2
"ENG_062_MZB_LO_2431","ENG_062_MZB_LO_2431-06.10.2003","06.10.2003",2003,10,6,0.714305555,4
"ENG_062_MZB_LO_2431","ENG_062_MZB_LO_2431-02.09.2004","02.09.2004",2004,9,2,0.754291907,3
"ENG_062_MZB_LO_2431","ENG_062_MZB_LO_2431-01.11.2006","01.11.2006",2006,11,1,0.740189172,3
"ENG_062_MZB_LO_2431","ENG_062_MZB_LO_2431-22.10.2007","22.10.2007",2007,10,22,0.877051032,3
"ENG_062_MZB_LO_2431","ENG_062_MZB_LO_2431-22.09.2008","22.09.2008",2008,9,22,0.836284896,3
"ENG_062_MZB_LO_2431","ENG_062_MZB_LO_2431-15.09.2009","15.09.2009",2009,9,15,0.750743885,4
"ENG_062_MZB_LO_2431","ENG_062_MZB_LO_2431-14.11.2011","14.11.2011",2011,11,14,0.801758906,3
"ENG_062_MZB_LO_2431","ENG_062_MZB_LO_2431-05.11.2014","05.11.2014",2014,11,5,0.8508545,3
"ENG_062_MZB_LO_2431","ENG_062_MZB_LO_2431-29.09.2015","29.09.2015",2015,9,29,0.707431437,4
"ENG_062_MZB_LO_2431","ENG_062_MZB_LO_2431-11.10.2016","11.10.2016",2016,10,11,0.782342712,3
"ENG_062_MZB_LO_2431","ENG_062_MZB_LO_2431-25.10.2017","25.10.2017",2017,10,25,0.794617115,3
"ENG_062_MZB_LO_2431","ENG_062_MZB_LO_2431-05.09.2018","05.09.2018",2018,9,5,0.756985851,4
"ENG_062_MZB_LO_2431","ENG_062_MZB_LO_2431-04.09.2019","04.09.2019",2019,9,4,0.677697358,5
"ENG_062_MZB_LO_2431","ENG_062_MZB_LO_2431-25.09.2020","25.09.2020",2020,9,25,0.747386409,5
"ENG_062_MZB_LO_2431","ENG_062_MZB_LO_2431-27.10.2021","27.10.2021",2021,10,27,0.75694975,3
"ENG_062_MZB_LO_2432","ENG_062_MZB_LO_2432-30.09.2002","30.09.2002",2002,9,30,0.913252663,2
"ENG_062_MZB_LO_2432","ENG_062_MZB_LO_2432-06.10.2003","06.10.2003",2003,10,6,0.935915842,2
"ENG_062_MZB_LO_2432","ENG_062_MZB_LO_2432-09.09.2004","09.09.2004",2004,9,9,0.85689362,3
"ENG_062_MZB_LO_2432","ENG_062_MZB_LO_2432-01.11.2006","01.11.2006",2006,11,1,0.897994623,2
"ENG_062_MZB_LO_2432","ENG_062_MZB_LO_2432-17.09.2007","17.09.2007",2007,9,17,0.921670129,2
"ENG_062_MZB_LO_2432","ENG_062_MZB_LO_2432-22.09.2008","22.09.2008",2008,9,22,0.929345614,2
"ENG_062_MZB_LO_2432","ENG_062_MZB_LO_2432-15.09.2009","15.09.2009",2009,9,15,0.881481624,2
"ENG_062_MZB_LO_2432","ENG_062_MZB_LO_2432-02.11.2010","02.11.2010",2010,11,2,0.906812704,2
"ENG_062_MZB_LO_2432","ENG_062_MZB_LO_2432-04.10.2011","04.10.2011",2011,10,4,0.942023741,2
"ENG_062_MZB_LO_2432","ENG_062_MZB_LO_2432-29.10.2013","29.10.2013",2013,10,29,0.93555219,2
"ENG_062_MZB_LO_2432","ENG_062_MZB_LO_2432-24.09.2014","24.09.2014",2014,9,24,0.994915373,1
"ENG_062_MZB_LO_2432","ENG_062_MZB_LO_2432-21.10.2015","21.10.2015",2015,10,21,1.007785257,2
"ENG_062_MZB_LO_2432","ENG_062_MZB_LO_2432-07.09.2016","07.09.2016",2016,9,7,0.913483633,2
"ENG_062_MZB_LO_2432","ENG_062_MZB_LO_2432-18.10.2017","18.10.2017",2017,10,18,0.977231292,1
"ENG_062_MZB_LO_2432","ENG_062_MZB_LO_2432-24.09.2018","24.09.2018",2018,9,24,0.996574941,1
"ENG_062_MZB_LO_2432","ENG_062_MZB_LO_2432-06.11.2019","06.11.2019",2019,11,6,0.927111497,2
"ENG_062_MZB_LO_2432","ENG_062_MZB_LO_2432-30.09.2020","30.09.2020",2020,9,30,1.026225868,1
"ENG_062_MZB_LO_2432","ENG_062_MZB_LO_2432-27.10.2021","27.10.2021",2021,10,27,0.970685554,1
"ENG_062_MZB_LO_2432","ENG_062_MZB_LO_2432-20.10.2022","20.10.2022",2022,10,20,0.889590952,2
"ENG_062_MZB_LO_2432","ENG_062_MZB_LO_2432-25.09.2023","25.09.2023",2023,9,25,0.959453458,2
"ENG_062_MZB_LO_2433","ENG_062_MZB_LO_2433-30.09.2002","30.09.2002",2002,9,30,0.905423642,2
"ENG_062_MZB_LO_2433","ENG_062_MZB_LO_2433-06.10.2003","06.10.2003",2003,10,6,1.061561211,1
"ENG_062_MZB_LO_2433","ENG_062_MZB_LO_2433-09.09.2004","09.09.2004",2004,9,9,0.962326738,2
"ENG_062_MZB_LO_2433","ENG_062_MZB_LO_2433-02.11.2005","02.11.2005",2005,11,2,0.976807695,1
"ENG_062_MZB_LO_2433","ENG_062_MZB_LO_2433-01.11.2006","01.11.2006",2006,11,1,0.961406307,2
"ENG_062_MZB_LO_2433","ENG_062_MZB_LO_2433-22.10.2007","22.10.2007",2007,10,22,0.919551061,2
"ENG_062_MZB_LO_2433","ENG_062_MZB_LO_2433-22.09.2008","22.09.2008",2008,9,22,1.036155296,1
"ENG_062_MZB_LO_2433","ENG_062_MZB_LO_2433-15.09.2009","15.09.2009",2009,9,15,0.971353679,1
"ENG_062_MZB_LO_2433","ENG_062_MZB_LO_2433-04.11.2010","04.11.2010",2010,11,4,1.018105357,1
"ENG_062_MZB_LO_2433","ENG_062_MZB_LO_2433-04.10.2011","04.10.2011",2011,10,4,1.086252023,1
"ENG_062_MZB_LO_2433","ENG_062_MZB_LO_2433-29.10.2012","29.10.2012",2012,10,29,0.94994091,2
"ENG_062_MZB_LO_2433","ENG_062_MZB_LO_2433-17.10.2013","17.10.2013",2013,10,17,1.034210188,1
"ENG_062_MZB_LO_2433","ENG_062_MZB_LO_2433-22.09.2014","22.09.2014",2014,9,22,1.100192997,1
"ENG_062_MZB_LO_2433","ENG_062_MZB_LO_2433-24.09.2015","24.09.2015",2015,9,24,0.989892757,1
"ENG_062_MZB_LO_2433","ENG_062_MZB_LO_2433-26.10.2016","26.10.2016",2016,10,26,1.015795238,1
"ENG_062_MZB_LO_2433","ENG_062_MZB_LO_2433-28.09.2017","28.09.2017",2017,9,28,0.984123745,1
"ENG_062_MZB_LO_2433","ENG_062_MZB_LO_2433-26.09.2018","26.09.2018",2018,9,26,1.046259246,1
"ENG_062_MZB_LO_2433","ENG_062_MZB_LO_2433-24.09.2019","24.09.2019",2019,9,24,1.009559229,1
"ENG_062_MZB_LO_2433","ENG_062_MZB_LO_2433-11.11.2020","11.11.2020",2020,11,11,1.050936588,1
"ENG_062_MZB_LO_2433","ENG_062_MZB_LO_2433-25.11.2021","25.11.2021",2021,11,25,1.08179728,1
"ENG_062_MZB_LO_2433","ENG_062_MZB_LO_2433-06.10.2022","06.10.2022",2022,10,6,1.093056618,1
"ENG_062_MZB_LO_2433","ENG_062_MZB_LO_2433-13.09.2024","13.09.2024",2024,9,13,1.097695547,1
"ENG_062_MZB_LO_2434","ENG_062_MZB_LO_2434-28.10.2002","28.10.2002",2002,10,28,0.837670203,3
"ENG_062_MZB_LO_2434","ENG_062_MZB_LO_2434-13.10.2003","13.10.2003",2003,10,13,0.846944568,3
"ENG_062_MZB_LO_2434","ENG_062_MZB_LO_2434-22.11.2004","22.11.2004",2004,11,22,0.875180096,2
"ENG_062_MZB_LO_2434","ENG_062_MZB_LO_2434-28.11.2006","28.11.2006",2006,11,28,0.908962968,2
"ENG_062_MZB_LO_2434","ENG_062_MZB_LO_2434-05.11.2007","05.11.2007",2007,11,5,0.908546773,2
"ENG_062_MZB_LO_2434","ENG_062_MZB_LO_2434-01.10.2008","01.10.2008",2008,10,1,0.906910441,3
"ENG_062_MZB_LO_2434","ENG_062_MZB_LO_2434-23.09.2009","23.09.2009",2009,9,23,0.836934335,3
"ENG_062_MZB_LO_2434","ENG_062_MZB_LO_2434-21.09.2010","21.09.2010",2010,9,21,0.85778386,3
"ENG_062_MZB_LO_2434","ENG_062_MZB_LO_2434-22.10.2013","22.10.2013",2013,10,22,0.755662609,3
"ENG_062_MZB_LO_2434","ENG_062_MZB_LO_2434-06.11.2014","06.11.2014",2014,11,6,0.82780086,3
"ENG_062_MZB_LO_2434","ENG_062_MZB_LO_2434-27.10.2016","27.10.2016",2016,10,27,0.901087871,2
"ENG_062_MZB_LO_2434","ENG_062_MZB_LO_2434-25.10.2017","25.10.2017",2017,10,25,0.867712627,2
"ENG_062_MZB_LO_2434","ENG_062_MZB_LO_2434-21.09.2018","21.09.2018",2018,9,21,0.862253577,3
"ENG_062_MZB_LO_2434","ENG_062_MZB_LO_2434-21.10.2019","21.10.2019",2019,10,21,0.863232038,3
"ENG_062_MZB_LO_2434","ENG_062_MZB_LO_2434-30.09.2020","30.09.2020",2020,9,30,0.942963123,2
"ENG_062_MZB_LO_2434","ENG_062_MZB_LO_2434-27.10.2021","27.10.2021",2021,10,27,0.919088217,2
"ENG_062_MZB_LO_2434","ENG_062_MZB_LO_2434-13.09.2023","13.09.2023",2023,9,13,0.826378206,3
"ENG_062_MZB_LO_2435","ENG_062_MZB_LO_2435-28.10.2002","28.10.2002",2002,10,28,0.81295262,3
"ENG_062_MZB_LO_2435","ENG_062_MZB_LO_2435-22.11.2004","22.11.2004",2004,11,22,0.810554395,3
"ENG_062_MZB_LO_2435","ENG_062_MZB_LO_2435-28.11.2006","28.11.2006",2006,11,28,0.79724679,4
"ENG_062_MZB_LO_2435","ENG_062_MZB_LO_2435-05.11.2007","05.11.2007",2007,11,5,0.883850128,2
"ENG_062_MZB_LO_2435","ENG_062_MZB_LO_2435-01.10.2008","01.10.2008",2008,10,1,0.822104792,3
"ENG_062_MZB_LO_2435","ENG_062_MZB_LO_2435-10.11.2016","10.11.2016",2016,11,10,0.81426003,3
"ENG_062_MZB_LO_2435","ENG_062_MZB_LO_2435-31.10.2019","31.10.2019",2019,10,31,0.79089483,3
"ENG_062_MZB_LO_2436","ENG_062_MZB_LO_2436-28.10.2002","28.10.2002",2002,10,28,0.940891693,2
"ENG_062_MZB_LO_2436","ENG_062_MZB_LO_2436-13.10.2003","13.10.2003",2003,10,13,1.0136142,1
"ENG_062_MZB_LO_2436","ENG_062_MZB_LO_2436-02.11.2004","02.11.2004",2004,11,2,0.922279067,2
"ENG_062_MZB_LO_2436","ENG_062_MZB_LO_2436-28.11.2006","28.11.2006",2006,11,28,0.734526978,3
"ENG_062_MZB_LO_2436","ENG_062_MZB_LO_2436-05.11.2007","05.11.2007",2007,11,5,0.867411142,3
"ENG_062_MZB_LO_2436","ENG_062_MZB_LO_2436-23.09.2009","23.09.2009",2009,9,23,0.937270802,2
"ENG_062_MZB_LO_2436","ENG_062_MZB_LO_2436-21.09.2010","21.09.2010",2010,9,21,0.978902561,1
"ENG_062_MZB_LO_2436","ENG_062_MZB_LO_2436-22.11.2011","22.11.2011",2011,11,22,0.850777951,3
"ENG_062_MZB_LO_2436","ENG_062_MZB_LO_2436-15.09.2015","15.09.2015",2015,9,15,0.970740901,2
"ENG_062_MZB_LO_2436","ENG_062_MZB_LO_2436-07.11.2016","07.11.2016",2016,11,7,0.970509241,1
"ENG_062_MZB_LO_2436","ENG_062_MZB_LO_2436-26.10.2017","26.10.2017",2017,10,26,0.961953284,2
"ENG_062_MZB_LO_2436","ENG_062_MZB_LO_2436-16.10.2018","16.10.2018",2018,10,16,1.003959807,1
"ENG_062_MZB_LO_2436","ENG_062_MZB_LO_2436-28.10.2021","28.10.2021",2021,10,28,0.925339009,3
"ENG_062_MZB_LO_2436","ENG_062_MZB_LO_2436-06.11.2022","06.11.2022",2022,11,6,0.962245027,3
"ENG_062_MZB_LO_2437","ENG_062_MZB_LO_2437-28.10.2002","28.10.2002",2002,10,28,1.029081491,1
"ENG_062_MZB_LO_2437","ENG_062_MZB_LO_2437-13.10.2003","13.10.2003",2003,10,13,1.03711893,1
"ENG_062_MZB_LO_2437","ENG_062_MZB_LO_2437-04.10.2005","04.10.2005",2005,10,4,0.980120787,1
"ENG_062_MZB_LO_2437","ENG_062_MZB_LO_2437-13.11.2006","13.11.2006",2006,11,13,0.979708145,1
"ENG_062_MZB_LO_2437","ENG_062_MZB_LO_2437-05.11.2007","05.11.2007",2007,11,5,0.955237482,2
"ENG_062_MZB_LO_2437","ENG_062_MZB_LO_2437-01.10.2008","01.10.2008",2008,10,1,0.985526701,1
"ENG_062_MZB_LO_2437","ENG_062_MZB_LO_2437-23.09.2009","23.09.2009",2009,9,23,0.931057377,2
"ENG_062_MZB_LO_2437","ENG_062_MZB_LO_2437-21.09.2010","21.09.2010",2010,9,21,0.979670503,1
"ENG_062_MZB_LO_2437","ENG_062_MZB_LO_2437-28.10.2011","28.10.2011",2011,10,28,0.954509317,2
"ENG_062_MZB_LO_2437","ENG_062_MZB_LO_2437-29.10.2012","29.10.2012",2012,10,29,0.97603925,1
"ENG_062_MZB_LO_2437","ENG_062_MZB_LO_2437-06.11.2013","06.11.2013",2013,11,6,1.015710575,1
"ENG_062_MZB_LO_2437","ENG_062_MZB_LO_2437-06.11.2014","06.11.2014",2014,11,6,0.978426622,1
"ENG_062_MZB_LO_2437","ENG_062_MZB_LO_2437-15.09.2015","15.09.2015",2015,9,15,0.981770126,1
"ENG_062_MZB_LO_2437","ENG_062_MZB_LO_2437-26.10.2016","26.10.2016",2016,10,26,0.946800009,2
"ENG_062_MZB_LO_2437","ENG_062_MZB_LO_2437-26.10.2017","26.10.2017",2017,10,26,0.910412015,2
"ENG_062_MZB_LO_2437","ENG_062_MZB_LO_2437-27.09.2018","27.09.2018",2018,9,27,0.937735498,2
"ENG_062_MZB_LO_2437","ENG_062_MZB_LO_2437-28.10.2021","28.10.2021",2021,10,28,0.994358148,1
"ENG_062_MZB_LO_2437","ENG_062_MZB_LO_2437-11.11.2022","11.11.2022",2022,11,11,1.035262038,1
"ENG_062_MZB_LO_2437","ENG_062_MZB_LO_2437-25.09.2023","25.09.2023",2023,9,25,0.984680589,1
"ENG_062_MZB_LO_2437","ENG_062_MZB_LO_2437-18.10.2024","18.10.2024",2024,10,18,1.079619746,1
"ENG_062_MZB_LO_2438","ENG_062_MZB_LO_2438-28.10.2002","28.10.2002",2002,10,28,0.789058583,3
"ENG_062_MZB_LO_2438","ENG_062_MZB_LO_2438-13.10.2003","13.10.2003",2003,10,13,0.874098337,2
"ENG_062_MZB_LO_2438","ENG_062_MZB_LO_2438-22.11.2004","22.11.2004",2004,11,22,0.788725977,3
"ENG_062_MZB_LO_2438","ENG_062_MZB_LO_2438-04.10.2005","04.10.2005",2005,10,4,0.80424956,3
"ENG_062_MZB_LO_2438","ENG_062_MZB_LO_2438-28.11.2006","28.11.2006",2006,11,28,0.890523926,2
"ENG_062_MZB_LO_2438","ENG_062_MZB_LO_2438-14.11.2007","14.11.2007",2007,11,14,0.791889139,3
"ENG_062_MZB_LO_2438","ENG_062_MZB_LO_2438-13.10.2008","13.10.2008",2008,10,13,0.809431075,3
"ENG_062_MZB_LO_2438","ENG_062_MZB_LO_2438-08.09.2009","08.09.2009",2009,9,8,0.786970655,3
"ENG_062_MZB_LO_2438","ENG_062_MZB_LO_2438-01.09.2010","01.09.2010",2010,9,1,0.831644471,3
"ENG_062_MZB_LO_2438","ENG_062_MZB_LO_2438-10.10.2011","10.10.2011",2011,10,10,0.834789979,3
"ENG_062_MZB_LO_2438","ENG_062_MZB_LO_2438-18.11.2014","18.11.2014",2014,11,18,0.837338702,3
"ENG_062_MZB_LO_2438","ENG_062_MZB_LO_2438-27.10.2015","27.10.2015",2015,10,27,0.82196521,3
"ENG_062_MZB_LO_2438","ENG_062_MZB_LO_2438-10.11.2016","10.11.2016",2016,11,10,0.853231605,3
"ENG_062_MZB_LO_2438","ENG_062_MZB_LO_2438-21.09.2018","21.09.2018",2018,9,21,0.81660323,3
"ENG_062_MZB_LO_2439","ENG_062_MZB_LO_2439-28.10.2002","28.10.2002",2002,10,28,0.80153436,3
"ENG_062_MZB_LO_2439","ENG_062_MZB_LO_2439-16.10.2003","16.10.2003",2003,10,16,0.872563905,3
"ENG_062_MZB_LO_2439","ENG_062_MZB_LO_2439-02.11.2004","02.11.2004",2004,11,2,0.853937738,3
"ENG_062_MZB_LO_2439","ENG_062_MZB_LO_2439-04.10.2005","04.10.2005",2005,10,4,0.898124391,2
"ENG_062_MZB_LO_2439","ENG_062_MZB_LO_2439-28.11.2006","28.11.2006",2006,11,28,0.872457184,3
"ENG_062_MZB_LO_2439","ENG_062_MZB_LO_2439-14.11.2007","14.11.2007",2007,11,14,0.841032237,3
"ENG_062_MZB_LO_2439","ENG_062_MZB_LO_2439-06.09.2010","06.09.2010",2010,9,6,0.879633264,2
"ENG_062_MZB_LO_2439","ENG_062_MZB_LO_2439-10.10.2011","10.10.2011",2011,10,10,0.931022636,2
"ENG_062_MZB_LO_2439","ENG_062_MZB_LO_2439-19.11.2012","19.11.2012",2012,11,19,0.918533637,2
"ENG_062_MZB_LO_2439","ENG_062_MZB_LO_2439-10.11.2014","10.11.2014",2014,11,10,0.885250271,3
"ENG_062_MZB_LO_2439","ENG_062_MZB_LO_2439-24.11.2015","24.11.2015",2015,11,24,0.882189737,2
"ENG_062_MZB_LO_2439","ENG_062_MZB_LO_2439-18.10.2016","18.10.2016",2016,10,18,0.761401954,3
"ENG_062_MZB_LO_2440","ENG_062_MZB_LO_2440-02.10.2002","02.10.2002",2002,10,2,0.926589281,2
"ENG_062_MZB_LO_2440","ENG_062_MZB_LO_2440-27.11.2003","27.11.2003",2003,11,27,0.906792208,2
"ENG_062_MZB_LO_2440","ENG_062_MZB_LO_2440-14.11.2005","14.11.2005",2005,11,14,0.88551125,2
"ENG_062_MZB_LO_2440","ENG_062_MZB_LO_2440-28.09.2006","28.09.2006",2006,9,28,0.987718843,1
"ENG_062_MZB_LO_2440","ENG_062_MZB_LO_2440-18.11.2013","18.11.2013",2013,11,18,0.836544898,3
"ENG_062_MZB_LO_2440","ENG_062_MZB_LO_2440-06.10.2014","06.10.2014",2014,10,6,0.924959054,2
"ENG_062_MZB_LO_2440","ENG_062_MZB_LO_2440-08.10.2015","08.10.2015",2015,10,8,0.918702457,2
"ENG_062_MZB_LO_2440","ENG_062_MZB_LO_2440-10.10.2016","10.10.2016",2016,10,10,0.854576573,3
"ENG_062_MZB_LO_2440","ENG_062_MZB_LO_2440-23.10.2017","23.10.2017",2017,10,23,0.920541978,2
"ENG_062_MZB_LO_2441","ENG_062_MZB_LO_2441-18.11.2002","18.11.2002",2002,11,18,0.835284487,3
"ENG_062_MZB_LO_2441","ENG_062_MZB_LO_2441-27.10.2003","27.10.2003",2003,10,27,0.938207839,2
"ENG_062_MZB_LO_2441","ENG_062_MZB_LO_2441-15.11.2004","15.11.2004",2004,11,15,0.917523879,2
"ENG_062_MZB_LO_2441","ENG_062_MZB_LO_2441-14.11.2005","14.11.2005",2005,11,14,0.98099047,2
"ENG_062_MZB_LO_2441","ENG_062_MZB_LO_2441-07.11.2006","07.11.2006",2006,11,7,0.869708412,2
"ENG_062_MZB_LO_2441","ENG_062_MZB_LO_2441-02.11.2007","02.11.2007",2007,11,2,0.949267572,2
"ENG_062_MZB_LO_2441","ENG_062_MZB_LO_2441-22.09.2008","22.09.2008",2008,9,22,0.78880741,3
"ENG_062_MZB_LO_2441","ENG_062_MZB_LO_2441-01.11.2011","01.11.2011",2011,11,1,0.90411783,2
"ENG_062_MZB_LO_2441","ENG_062_MZB_LO_2441-07.11.2012","07.11.2012",2012,11,7,0.96698592,2
"ENG_062_MZB_LO_2441","ENG_062_MZB_LO_2441-08.10.2013","08.10.2013",2013,10,8,0.936824805,2
"ENG_062_MZB_LO_2441","ENG_062_MZB_LO_2441-06.10.2015","06.10.2015",2015,10,6,0.948915827,2
"ENG_062_MZB_LO_2441","ENG_062_MZB_LO_2441-17.10.2016","17.10.2016",2016,10,17,0.80509664,4
"ENG_062_MZB_LO_2441","ENG_062_MZB_LO_2441-30.10.2017","30.10.2017",2017,10,30,0.795957417,5
"ENG_062_MZB_LO_2442","ENG_062_MZB_LO_2442-05.11.2002","05.11.2002",2002,11,5,0.794309858,3
"ENG_062_MZB_LO_2442","ENG_062_MZB_LO_2442-15.09.2003","15.09.2003",2003,9,15,0.79021865,3
"ENG_062_MZB_LO_2442","ENG_062_MZB_LO_2442-30.11.2004","30.11.2004",2004,11,30,0.814670734,3
"ENG_062_MZB_LO_2442","ENG_062_MZB_LO_2442-26.09.2005","26.09.2005",2005,9,26,0.843895843,3
"ENG_062_MZB_LO_2442","ENG_062_MZB_LO_2442-31.10.2006","31.10.2006",2006,10,31,0.789157771,3
"ENG_062_MZB_LO_2442","ENG_062_MZB_LO_2442-18.09.2007","18.09.2007",2007,9,18,0.865166518,3
"ENG_062_MZB_LO_2442","ENG_062_MZB_LO_2442-12.11.2008","12.11.2008",2008,11,12,0.82785293,3
"ENG_062_MZB_LO_2442","ENG_062_MZB_LO_2442-06.10.2009","06.10.2009",2009,10,6,0.736707674,3
"ENG_062_MZB_LO_2442","ENG_062_MZB_LO_2442-14.11.2011","14.11.2011",2011,11,14,0.728989364,4
"ENG_062_MZB_LO_2442","ENG_062_MZB_LO_2442-25.11.2014","25.11.2014",2014,11,25,0.84538896,3
"ENG_062_MZB_LO_2442","ENG_062_MZB_LO_2442-03.11.2016","03.11.2016",2016,11,3,0.757090046,5
"ENG_062_MZB_LO_2442","ENG_062_MZB_LO_2442-27.11.2020","27.11.2020",2020,11,27,0.793143518,3
"ENG_062_MZB_LO_2443","ENG_062_MZB_LO_2443-12.11.2002","12.11.2002",2002,11,12,1.094241788,3
"ENG_062_MZB_LO_2443","ENG_062_MZB_LO_2443-02.09.2003","02.09.2003",2003,9,2,1.175074841,1
"ENG_062_MZB_LO_2443","ENG_062_MZB_LO_2443-08.11.2004","08.11.2004",2004,11,8,1.201014973,1
"ENG_062_MZB_LO_2443","ENG_062_MZB_LO_2443-07.11.2005","07.11.2005",2005,11,7,1.150327787,1
"ENG_062_MZB_LO_2443","ENG_062_MZB_LO_2443-02.10.2006","02.10.2006",2006,10,2,1.190575326,1
"ENG_062_MZB_LO_2443","ENG_062_MZB_LO_2443-29.11.2007","29.11.2007",2007,11,29,1.060811142,1
"ENG_062_MZB_LO_2443","ENG_062_MZB_LO_2443-07.10.2009","07.10.2009",2009,10,7,1.151356932,1
"ENG_062_MZB_LO_2443","ENG_062_MZB_LO_2443-05.10.2010","05.10.2010",2010,10,5,1.210636028,1
"ENG_062_MZB_LO_2443","ENG_062_MZB_LO_2443-19.09.2011","19.09.2011",2011,9,19,1.044534885,1
"ENG_062_MZB_LO_2443","ENG_062_MZB_LO_2443-25.11.2014","25.11.2014",2014,11,25,1.163669239,1
"ENG_062_MZB_LO_2443","ENG_062_MZB_LO_2443-12.10.2015","12.10.2015",2015,10,12,1.09374702,1
"ENG_062_MZB_LO_2443","ENG_062_MZB_LO_2443-30.11.2016","30.11.2016",2016,11,30,0.957140063,3
"ENG_062_MZB_LO_2443","ENG_062_MZB_LO_2443-31.10.2017","31.10.2017",2017,10,31,1.082791693,1
"ENG_062_MZB_LO_2443","ENG_062_MZB_LO_2443-17.10.2018","17.10.2018",2018,10,17,1.027555883,3
"ENG_062_MZB_LO_2443","ENG_062_MZB_LO_2443-27.11.2020","27.11.2020",2020,11,27,1.059237708,1
"ENG_062_MZB_LO_2444","ENG_062_MZB_LO_2444-05.11.2002","05.11.2002",2002,11,5,0.793027137,3
"ENG_062_MZB_LO_2444","ENG_062_MZB_LO_2444-15.09.2003","15.09.2003",2003,9,15,0.902925658,2
"ENG_062_MZB_LO_2444","ENG_062_MZB_LO_2444-30.11.2004","30.11.2004",2004,11,30,0.937093154,2
"ENG_062_MZB_LO_2444","ENG_062_MZB_LO_2444-26.09.2005","26.09.2005",2005,9,26,0.92373387,2
"ENG_062_MZB_LO_2444","ENG_062_MZB_LO_2444-31.10.2006","31.10.2006",2006,10,31,0.988948925,1
"ENG_062_MZB_LO_2444","ENG_062_MZB_LO_2444-18.09.2007","18.09.2007",2007,9,18,0.963312968,1
"ENG_062_MZB_LO_2444","ENG_062_MZB_LO_2444-28.11.2008","28.11.2008",2008,11,28,0.931703169,3
"ENG_062_MZB_LO_2444","ENG_062_MZB_LO_2444-08.09.2009","08.09.2009",2009,9,8,0.854181961,3
"ENG_062_MZB_LO_2444","ENG_062_MZB_LO_2444-19.10.2011","19.10.2011",2011,10,19,0.928874154,2
"ENG_062_MZB_LO_2444","ENG_062_MZB_LO_2444-08.10.2012","08.10.2012",2012,10,8,0.970607303,1
"ENG_062_MZB_LO_2444","ENG_062_MZB_LO_2444-15.11.2013","15.11.2013",2013,11,15,0.937743321,2
"ENG_062_MZB_LO_2444","ENG_062_MZB_LO_2444-28.09.2015","28.09.2015",2015,9,28,0.915556262,2
"ENG_062_MZB_LO_2444","ENG_062_MZB_LO_2444-27.09.2016","27.09.2016",2016,9,27,0.908960528,2
"ENG_062_MZB_LO_2444","ENG_062_MZB_LO_2444-31.10.2017","31.10.2017",2017,10,31,0.961319798,1
"ENG_062_MZB_LO_2444","ENG_062_MZB_LO_2444-24.09.2018","24.09.2018",2018,9,24,0.997652011,1
"ENG_062_MZB_LO_2444","ENG_062_MZB_LO_2444-19.11.2019","19.11.2019",2019,11,19,0.95230309,2
"ENG_062_MZB_LO_2444","ENG_062_MZB_LO_2444-27.11.2020","27.11.2020",2020,11,27,0.90650458,2
"ENG_062_MZB_LO_2444","ENG_062_MZB_LO_2444-24.09.2021","24.09.2021",2021,9,24,0.892781534,3
"ENG_062_MZB_LO_2444","ENG_062_MZB_LO_2444-14.11.2022","14.11.2022",2022,11,14,0.873979374,2
"ENG_062_MZB_LO_2444","ENG_062_MZB_LO_2444-07.10.2024","07.10.2024",2024,10,7,0.91274288,2
"ENG_062_MZB_LO_2445","ENG_062_MZB_LO_2445-05.11.2002","05.11.2002",2002,11,5,1.088447461,1
"ENG_062_MZB_LO_2445","ENG_062_MZB_LO_2445-15.09.2003","15.09.2003",2003,9,15,1.039810188,1
"ENG_062_MZB_LO_2445","ENG_062_MZB_LO_2445-30.11.2004","30.11.2004",2004,11,30,1.112794897,1
"ENG_062_MZB_LO_2445","ENG_062_MZB_LO_2445-26.09.2005","26.09.2005",2005,9,26,1.021433914,1
"ENG_062_MZB_LO_2445","ENG_062_MZB_LO_2445-31.10.2006","31.10.2006",2006,10,31,1.117543546,1
"ENG_062_MZB_LO_2445","ENG_062_MZB_LO_2445-18.09.2007","18.09.2007",2007,9,18,1.043234701,1
"ENG_062_MZB_LO_2445","ENG_062_MZB_LO_2445-10.11.2008","10.11.2008",2008,11,10,0.948187657,2
"ENG_062_MZB_LO_2445","ENG_062_MZB_LO_2445-08.09.2009","08.09.2009",2009,9,8,1.004413036,1
"ENG_062_MZB_LO_2445","ENG_062_MZB_LO_2445-01.09.2010","01.09.2010",2010,9,1,0.923571519,2
"ENG_062_MZB_LO_2445","ENG_062_MZB_LO_2445-12.10.2011","12.10.2011",2011,10,12,0.902567821,2
"ENG_062_MZB_LO_2445","ENG_062_MZB_LO_2445-15.11.2013","15.11.2013",2013,11,15,1.051589625,1
"ENG_062_MZB_LO_2445","ENG_062_MZB_LO_2445-29.10.2014","29.10.2014",2014,10,29,0.969568315,1
"ENG_062_MZB_LO_2445","ENG_062_MZB_LO_2445-27.10.2015","27.10.2015",2015,10,27,1.017317098,1
"ENG_062_MZB_LO_2445","ENG_062_MZB_LO_2445-28.11.2016","28.11.2016",2016,11,28,1.112879864,1
"ENG_062_MZB_LO_2445","ENG_062_MZB_LO_2445-27.10.2017","27.10.2017",2017,10,27,1.025356753,1
"ENG_062_MZB_LO_2445","ENG_062_MZB_LO_2445-16.10.2018","16.10.2018",2018,10,16,1.081681542,1
"ENG_062_MZB_LO_2445","ENG_062_MZB_LO_2445-27.11.2020","27.11.2020",2020,11,27,1.069371438,1
"ENG_062_MZB_LO_2445","ENG_062_MZB_LO_2445-11.11.2022","11.11.2022",2022,11,11,1.024086698,1
"ENG_062_MZB_LO_2445","ENG_062_MZB_LO_2445-22.10.2024","22.10.2024",2024,10,22,1.1385793,1
"ENG_062_MZB_LO_2446","ENG_062_MZB_LO_2446-05.11.2002","05.11.2002",2002,11,5,1.10119533,1
"ENG_062_MZB_LO_2446","ENG_062_MZB_LO_2446-15.09.2003","15.09.2003",2003,9,15,1.062594513,1
"ENG_062_MZB_LO_2446","ENG_062_MZB_LO_2446-30.11.2004","30.11.2004",2004,11,30,1.069647894,1
"ENG_062_MZB_LO_2446","ENG_062_MZB_LO_2446-26.09.2005","26.09.2005",2005,9,26,0.986967347,1
"ENG_062_MZB_LO_2446","ENG_062_MZB_LO_2446-31.10.2006","31.10.2006",2006,10,31,1.05597827,1
"ENG_062_MZB_LO_2446","ENG_062_MZB_LO_2446-18.09.2007","18.09.2007",2007,9,18,0.977183592,1
"ENG_062_MZB_LO_2446","ENG_062_MZB_LO_2446-14.10.2008","14.10.2008",2008,10,14,1.024408254,1
"ENG_062_MZB_LO_2446","ENG_062_MZB_LO_2446-15.09.2009","15.09.2009",2009,9,15,0.981377966,1
"ENG_062_MZB_LO_2446","ENG_062_MZB_LO_2446-01.09.2010","01.09.2010",2010,9,1,1.003531701,1
"ENG_062_MZB_LO_2446","ENG_062_MZB_LO_2446-12.10.2011","12.10.2011",2011,10,12,0.87817358,2
"ENG_062_MZB_LO_2446","ENG_062_MZB_LO_2446-15.11.2013","15.11.2013",2013,11,15,0.972289601,1
"ENG_062_MZB_LO_2446","ENG_062_MZB_LO_2446-27.10.2014","27.10.2014",2014,10,27,0.989789015,1
"ENG_062_MZB_LO_2446","ENG_062_MZB_LO_2446-21.10.2015","21.10.2015",2015,10,21,0.939598175,2
"ENG_062_MZB_LO_2446","ENG_062_MZB_LO_2446-23.11.2016","23.11.2016",2016,11,23,0.950086836,2
"ENG_062_MZB_LO_2446","ENG_062_MZB_LO_2446-26.10.2017","26.10.2017",2017,10,26,1.015779697,1
"ENG_062_MZB_LO_2446","ENG_062_MZB_LO_2446-26.09.2018","26.09.2018",2018,9,26,1.025882833,1
"ENG_062_MZB_LO_2446","ENG_062_MZB_LO_2446-27.11.2020","27.11.2020",2020,11,27,1.036203547,1
"ENG_062_MZB_LO_2446","ENG_062_MZB_LO_2446-19.10.2021","19.10.2021",2021,10,19,0.983169854,2
"ENG_062_MZB_LO_2446","ENG_062_MZB_LO_2446-04.10.2022","04.10.2022",2022,10,4,1.023081079,1
"ENG_062_MZB_LO_2446","ENG_062_MZB_LO_2446-27.11.2023","27.11.2023",2023,11,27,1.078064302,1
"ENG_062_MZB_LO_2446","ENG_062_MZB_LO_2446-01.10.2024","01.10.2024",2024,10,1,1.160967208,3
"ENG_062_MZB_LO_2447","ENG_062_MZB_LO_2447-18.11.2002","18.11.2002",2002,11,18,0.890356261,2
"ENG_062_MZB_LO_2447","ENG_062_MZB_LO_2447-27.11.2003","27.11.2003",2003,11,27,0.887991318,3
"ENG_062_MZB_LO_2447","ENG_062_MZB_LO_2447-15.11.2004","15.11.2004",2004,11,15,0.934218992,2
"ENG_062_MZB_LO_2447","ENG_062_MZB_LO_2447-10.10.2005","10.10.2005",2005,10,10,1.039393673,1
"ENG_062_MZB_LO_2447","ENG_062_MZB_LO_2447-21.11.2006","21.11.2006",2006,11,21,1.05554385,1
"ENG_062_MZB_LO_2447","ENG_062_MZB_LO_2447-30.11.2007","30.11.2007",2007,11,30,1.066182988,1
"ENG_062_MZB_LO_2447","ENG_062_MZB_LO_2447-03.10.2008","03.10.2008",2008,10,3,1.061507848,1
"ENG_062_MZB_LO_2447","ENG_062_MZB_LO_2447-27.11.2009","27.11.2009",2009,11,27,1.107870516,1
"ENG_062_MZB_LO_2447","ENG_062_MZB_LO_2447-22.11.2010","22.11.2010",2010,11,22,0.941832291,2
"ENG_062_MZB_LO_2447","ENG_062_MZB_LO_2447-24.10.2011","24.10.2011",2011,10,24,0.997932741,1
"ENG_062_MZB_LO_2448","ENG_062_MZB_LO_2448-18.11.2002","18.11.2002",2002,11,18,0.938690706,2
"ENG_062_MZB_LO_2448","ENG_062_MZB_LO_2448-27.11.2003","27.11.2003",2003,11,27,0.987852087,1
"ENG_062_MZB_LO_2448","ENG_062_MZB_LO_2448-15.11.2004","15.11.2004",2004,11,15,1.021721763,1
"ENG_062_MZB_LO_2448","ENG_062_MZB_LO_2448-10.10.2005","10.10.2005",2005,10,10,0.964846551,2
"ENG_062_MZB_LO_2448","ENG_062_MZB_LO_2448-21.11.2006","21.11.2006",2006,11,21,1.035657538,1
"ENG_062_MZB_LO_2448","ENG_062_MZB_LO_2448-30.11.2007","30.11.2007",2007,11,30,1.04488811,1
"ENG_062_MZB_LO_2448","ENG_062_MZB_LO_2448-03.10.2008","03.10.2008",2008,10,3,0.946015838,2
"ENG_062_MZB_LO_2448","ENG_062_MZB_LO_2448-27.11.2009","27.11.2009",2009,11,27,1.022280738,1
"ENG_062_MZB_LO_2448","ENG_062_MZB_LO_2448-22.11.2010","22.11.2010",2010,11,22,1.071434829,1
"ENG_062_MZB_LO_2448","ENG_062_MZB_LO_2448-24.10.2011","24.10.2011",2011,10,24,0.933248159,2
"ENG_062_MZB_LO_2448","ENG_062_MZB_LO_2448-20.11.2012","20.11.2012",2012,11,20,1.07168959,1
"ENG_062_MZB_LO_2448","ENG_062_MZB_LO_2448-28.11.2013","28.11.2013",2013,11,28,1.016022204,1
"ENG_062_MZB_LO_2448","ENG_062_MZB_LO_2448-09.09.2019","09.09.2019",2019,9,9,1.041496382,1
"ENG_062_MZB_LO_2449","ENG_062_MZB_LO_2449-27.09.2002","27.09.2002",2002,9,27,0.754904882,4
"ENG_062_MZB_LO_2449","ENG_062_MZB_LO_2449-27.10.2003","27.10.2003",2003,10,27,0.724726797,4
"ENG_062_MZB_LO_2449","ENG_062_MZB_LO_2449-15.11.2004","15.11.2004",2004,11,15,0.732372142,4
"ENG_062_MZB_LO_2449","ENG_062_MZB_LO_2449-21.11.2005","21.11.2005",2005,11,21,0.640881952,5
"ENG_062_MZB_LO_2449","ENG_062_MZB_LO_2449-02.10.2006","02.10.2006",2006,10,2,0.700380676,5
"ENG_062_MZB_LO_2449","ENG_062_MZB_LO_2449-30.11.2007","30.11.2007",2007,11,30,0.718067254,5
"ENG_062_MZB_LO_2449","ENG_062_MZB_LO_2449-28.11.2008","28.11.2008",2008,11,28,0.745911004,5
"ENG_062_MZB_LO_2449","ENG_062_MZB_LO_2449-27.10.2009","27.10.2009",2009,10,27,0.623600257,5
"ENG_062_MZB_LO_2449","ENG_062_MZB_LO_2449-26.10.2010","26.10.2010",2010,10,26,0.697060638,5
"ENG_062_MZB_LO_2449","ENG_062_MZB_LO_2449-25.11.2011","25.11.2011",2011,11,25,0.669137894,4
"ENG_062_MZB_LO_2449","ENG_062_MZB_LO_2449-01.10.2013","01.10.2013",2013,10,1,0.683369389,4
"ENG_062_MZB_LO_2449","ENG_062_MZB_LO_2449-16.11.2016","16.11.2016",2016,11,16,0.660437254,5
"ENG_062_MZB_LO_2450","ENG_062_MZB_LO_2450-27.05.2002","27.05.2002",2002,5,27,0.713245451,4
"ENG_062_MZB_LO_2450","ENG_062_MZB_LO_2450-20.05.2003","20.05.2003",2003,5,20,0.773714523,4
"ENG_062_MZB_LO_2450","ENG_062_MZB_LO_2450-24.05.2004","24.05.2004",2004,5,24,0.86072916,3
"ENG_062_MZB_LO_2450","ENG_062_MZB_LO_2450-09.05.2005","09.05.2005",2005,5,9,0.772103149,3
"ENG_062_MZB_LO_2450","ENG_062_MZB_LO_2450-08.05.2006","08.05.2006",2006,5,8,0.748696124,4
"ENG_062_MZB_LO_2450","ENG_062_MZB_LO_2450-06.03.2008","06.03.2008",2008,3,6,0.77187134,3
"ENG_062_MZB_LO_2450","ENG_062_MZB_LO_2450-18.05.2009","18.05.2009",2009,5,18,0.751733218,4
"ENG_062_MZB_LO_2450","ENG_062_MZB_LO_2450-04.03.2013","04.03.2013",2013,3,4,0.83852391,3
"ENG_062_MZB_LO_2450","ENG_062_MZB_LO_2450-02.03.2016","02.03.2016",2016,3,2,0.776942484,3
"ENG_062_MZB_LO_2451","ENG_062_MZB_LO_2451-27.05.2002","27.05.2002",2002,5,27,0.585354952,5
"ENG_062_MZB_LO_2451","ENG_062_MZB_LO_2451-20.05.2003","20.05.2003",2003,5,20,0.577543021,5
"ENG_062_MZB_LO_2451","ENG_062_MZB_LO_2451-24.05.2004","24.05.2004",2004,5,24,0.551609001,5
"ENG_062_MZB_LO_2451","ENG_062_MZB_LO_2451-16.05.2005","16.05.2005",2005,5,16,0.594902194,4
"ENG_062_MZB_LO_2451","ENG_062_MZB_LO_2451-08.05.2006","08.05.2006",2006,5,8,0.584989562,5
"ENG_062_MZB_LO_2451","ENG_062_MZB_LO_2451-23.04.2007","23.04.2007",2007,4,23,0.591879278,4
"ENG_062_MZB_LO_2451","ENG_062_MZB_LO_2451-06.03.2008","06.03.2008",2008,3,6,0.554002123,5
"ENG_062_MZB_LO_2451","ENG_062_MZB_LO_2451-24.05.2013","24.05.2013",2013,5,24,0.609386017,4
"ENG_062_MZB_LO_2452","ENG_062_MZB_LO_2452-01.10.2002","01.10.2002",2002,10,1,0.784283719,4
"ENG_062_MZB_LO_2452","ENG_062_MZB_LO_2452-29.09.2003","29.09.2003",2003,9,29,0.720779774,4
"ENG_062_MZB_LO_2452","ENG_062_MZB_LO_2452-27.09.2004","27.09.2004",2004,9,27,0.765848513,4
"ENG_062_MZB_LO_2452","ENG_062_MZB_LO_2452-28.11.2007","28.11.2007",2007,11,28,0.776308114,3
"ENG_062_MZB_LO_2452","ENG_062_MZB_LO_2452-14.10.2008","14.10.2008",2008,10,14,0.700809767,4
"ENG_062_MZB_LO_2452","ENG_062_MZB_LO_2452-14.10.2009","14.10.2009",2009,10,14,0.634947638,5
"ENG_062_MZB_LO_2452","ENG_062_MZB_LO_2452-16.09.2013","16.09.2013",2013,9,16,0.791722587,3
"ENG_062_MZB_LO_2452","ENG_062_MZB_LO_2452-01.09.2014","01.09.2014",2014,9,1,0.757593501,3
"ENG_062_MZB_LO_2452","ENG_062_MZB_LO_2452-15.10.2015","15.10.2015",2015,10,15,0.721834448,4
"ENG_062_MZB_LO_2452","ENG_062_MZB_LO_2452-27.10.2016","27.10.2016",2016,10,27,0.75396962,3
"ENG_062_MZB_LO_2452","ENG_062_MZB_LO_2452-31.10.2017","31.10.2017",2017,10,31,0.776355086,3
"ENG_062_MZB_LO_2452","ENG_062_MZB_LO_2452-21.10.2022","21.10.2022",2022,10,21,0.705316766,4
"ENG_062_MZB_LO_2452","ENG_062_MZB_LO_2452-12.09.2023","12.09.2023",2023,9,12,0.733128922,5
"ENG_062_MZB_LO_2452","ENG_062_MZB_LO_2452-31.10.2024","31.10.2024",2024,10,31,0.83920777,5
"ENG_062_MZB_LO_2453","ENG_062_MZB_LO_2453-01.10.2002","01.10.2002",2002,10,1,0.869612964,3
"ENG_062_MZB_LO_2453","ENG_062_MZB_LO_2453-29.09.2003","29.09.2003",2003,9,29,0.869710402,2
"ENG_062_MZB_LO_2453","ENG_062_MZB_LO_2453-27.09.2004","27.09.2004",2004,9,27,0.963668478,1
"ENG_062_MZB_LO_2453","ENG_062_MZB_LO_2453-13.09.2005","13.09.2005",2005,9,13,0.908538285,2
"ENG_062_MZB_LO_2453","ENG_062_MZB_LO_2453-28.11.2007","28.11.2007",2007,11,28,0.88264891,2
"ENG_062_MZB_LO_2453","ENG_062_MZB_LO_2453-02.09.2013","02.09.2013",2013,9,2,0.974676673,1
"ENG_062_MZB_LO_2453","ENG_062_MZB_LO_2453-01.09.2014","01.09.2014",2014,9,1,0.904192723,2
"ENG_062_MZB_LO_2453","ENG_062_MZB_LO_2453-13.11.2015","13.11.2015",2015,11,13,0.89670566,2
"ENG_062_MZB_LO_2453","ENG_062_MZB_LO_2453-19.09.2016","19.09.2016",2016,9,19,0.944230009,2
"ENG_062_MZB_LO_2453","ENG_062_MZB_LO_2453-07.11.2017","07.11.2017",2017,11,7,1.015390014,1
"ENG_062_MZB_LO_2453","ENG_062_MZB_LO_2453-07.09.2018","07.09.2018",2018,9,7,0.934641959,2
"ENG_062_MZB_LO_2453","ENG_062_MZB_LO_2453-06.09.2019","06.09.2019",2019,9,6,0.895087325,2
"ENG_062_MZB_LO_2453","ENG_062_MZB_LO_2453-27.10.2020","27.10.2020",2020,10,27,0.952305749,2
"ENG_062_MZB_LO_2453","ENG_062_MZB_LO_2453-21.10.2022","21.10.2022",2022,10,21,0.940257802,3
"ENG_062_MZB_LO_2453","ENG_062_MZB_LO_2453-15.09.2023","15.09.2023",2023,9,15,0.801817177,3
"ENG_062_MZB_LO_2453","ENG_062_MZB_LO_2453-24.10.2024","24.10.2024",2024,10,24,0.811611469,5
"ENG_062_MZB_LO_2455","ENG_062_MZB_LO_2455-18.11.2002","18.11.2002",2002,11,18,1.029358979,1
"ENG_062_MZB_LO_2455","ENG_062_MZB_LO_2455-02.09.2003","02.09.2003",2003,9,2,0.874302904,3
"ENG_062_MZB_LO_2455","ENG_062_MZB_LO_2455-08.11.2004","08.11.2004",2004,11,8,0.984233881,1
"ENG_062_MZB_LO_2455","ENG_062_MZB_LO_2455-07.11.2005","07.11.2005",2005,11,7,1.02886432,1
"ENG_062_MZB_LO_2455","ENG_062_MZB_LO_2455-02.10.2006","02.10.2006",2006,10,2,0.996453977,1
"ENG_062_MZB_LO_2455","ENG_062_MZB_LO_2455-19.11.2007","19.11.2007",2007,11,19,1.043917177,1
"ENG_062_MZB_LO_2455","ENG_062_MZB_LO_2455-07.10.2009","07.10.2009",2009,10,7,0.988530706,1
"ENG_062_MZB_LO_2455","ENG_062_MZB_LO_2455-05.10.2010","05.10.2010",2010,10,5,1.067379334,1
"ENG_062_MZB_LO_2455","ENG_062_MZB_LO_2455-27.09.2011","27.09.2011",2011,9,27,1.005434304,1
"ENG_062_MZB_LO_2455","ENG_062_MZB_LO_2455-08.10.2012","08.10.2012",2012,10,8,1.051155197,1
"ENG_062_MZB_LO_2455","ENG_062_MZB_LO_2455-14.11.2013","14.11.2013",2013,11,14,1.111868682,1
"ENG_062_MZB_LO_2455","ENG_062_MZB_LO_2455-29.10.2014","29.10.2014",2014,10,29,1.065225839,1
"ENG_062_MZB_LO_2455","ENG_062_MZB_LO_2455-09.09.2015","09.09.2015",2015,9,9,1.070789844,1
"ENG_062_MZB_LO_2455","ENG_062_MZB_LO_2455-31.10.2016","31.10.2016",2016,10,31,1.047089812,1
"ENG_062_MZB_LO_2455","ENG_062_MZB_LO_2455-17.11.2017","17.11.2017",2017,11,17,1.096980361,1
"ENG_062_MZB_LO_2456","ENG_062_MZB_LO_2456-18.11.2002","18.11.2002",2002,11,18,1.082876274,1
"ENG_062_MZB_LO_2456","ENG_062_MZB_LO_2456-27.10.2003","27.10.2003",2003,10,27,1.04614032,1
"ENG_062_MZB_LO_2456","ENG_062_MZB_LO_2456-15.11.2004","15.11.2004",2004,11,15,1.037007804,1
"ENG_062_MZB_LO_2456","ENG_062_MZB_LO_2456-14.11.2005","14.11.2005",2005,11,14,1.094937716,1
"ENG_062_MZB_LO_2456","ENG_062_MZB_LO_2456-07.11.2006","07.11.2006",2006,11,7,1.064290738,1
"ENG_062_MZB_LO_2456","ENG_062_MZB_LO_2456-02.11.2007","02.11.2007",2007,11,2,1.133604003,1
"ENG_062_MZB_LO_2456","ENG_062_MZB_LO_2456-03.09.2008","03.09.2008",2008,9,3,1.051676094,1
"ENG_062_MZB_LO_2456","ENG_062_MZB_LO_2456-26.10.2009","26.10.2009",2009,10,26,0.986932248,2
"ENG_062_MZB_LO_2456","ENG_062_MZB_LO_2456-01.11.2011","01.11.2011",2011,11,1,1.095087414,1
"ENG_062_MZB_LO_2456","ENG_062_MZB_LO_2456-27.09.2013","27.09.2013",2013,9,27,1.108179486,1
"ENG_062_MZB_LO_2456","ENG_062_MZB_LO_2456-17.09.2014","17.09.2014",2014,9,17,1.126984977,1
"ENG_062_MZB_LO_2456","ENG_062_MZB_LO_2456-26.10.2015","26.10.2015",2015,10,26,1.11592993,3
"ENG_062_MZB_LO_2456","ENG_062_MZB_LO_2456-14.09.2016","14.09.2016",2016,9,14,0.990978705,2
"ENG_062_MZB_LO_2456","ENG_062_MZB_LO_2456-10.10.2017","10.10.2017",2017,10,10,1.033783639,3
"ENG_062_MZB_LO_2456","ENG_062_MZB_LO_2456-11.10.2018","11.10.2018",2018,10,11,0.987297396,3
"ENG_062_MZB_LO_2456","ENG_062_MZB_LO_2456-14.10.2020","14.10.2020",2020,10,14,1.133578186,5
"ENG_062_MZB_LO_2456","ENG_062_MZB_LO_2456-16.09.2021","16.09.2021",2021,9,16,1.177824664,2
"ENG_062_MZB_LO_2457","ENG_062_MZB_LO_2457-27.10.2003","27.10.2003",2003,10,27,0.89184543,2
"ENG_062_MZB_LO_2457","ENG_062_MZB_LO_2457-14.11.2005","14.11.2005",2005,11,14,0.937638224,2
"ENG_062_MZB_LO_2457","ENG_062_MZB_LO_2457-07.11.2006","07.11.2006",2006,11,7,0.898961989,2
"ENG_062_MZB_LO_2457","ENG_062_MZB_LO_2457-02.11.2007","02.11.2007",2007,11,2,0.939953476,2
"ENG_062_MZB_LO_2457","ENG_062_MZB_LO_2457-25.11.2008","25.11.2008",2008,11,25,0.939158814,2
"ENG_062_MZB_LO_2457","ENG_062_MZB_LO_2457-26.10.2009","26.10.2009",2009,10,26,0.995135624,1
"ENG_062_MZB_LO_2457","ENG_062_MZB_LO_2457-01.11.2011","01.11.2011",2011,11,1,1.063798761,1
"ENG_062_MZB_LO_2457","ENG_062_MZB_LO_2457-27.09.2013","27.09.2013",2013,9,27,1.050178418,1
"ENG_062_MZB_LO_2457","ENG_062_MZB_LO_2457-10.09.2014","10.09.2014",2014,9,10,1.097889125,1
"ENG_062_MZB_LO_2457","ENG_062_MZB_LO_2457-23.10.2015","23.10.2015",2015,10,23,0.832783015,3
"ENG_062_MZB_LO_2457","ENG_062_MZB_LO_2457-26.10.2016","26.10.2016",2016,10,26,1.019082636,1
"ENG_062_MZB_LO_2457","ENG_062_MZB_LO_2457-26.10.2017","26.10.2017",2017,10,26,1.016209956,1
"ENG_062_MZB_LO_2458","ENG_062_MZB_LO_2458-27.10.2003","27.10.2003",2003,10,27,0.894259318,2
"ENG_062_MZB_LO_2458","ENG_062_MZB_LO_2458-14.11.2005","14.11.2005",2005,11,14,0.888660312,2
"ENG_062_MZB_LO_2458","ENG_062_MZB_LO_2458-07.11.2006","07.11.2006",2006,11,7,0.849798047,3
"ENG_062_MZB_LO_2458","ENG_062_MZB_LO_2458-02.11.2007","02.11.2007",2007,11,2,0.840306769,3
"ENG_062_MZB_LO_2458","ENG_062_MZB_LO_2458-25.11.2008","25.11.2008",2008,11,25,0.906641766,2
"ENG_062_MZB_LO_2458","ENG_062_MZB_LO_2458-26.10.2009","26.10.2009",2009,10,26,0.879041272,2
"ENG_062_MZB_LO_2458","ENG_062_MZB_LO_2458-11.09.2013","11.09.2013",2013,9,11,0.896332621,2
"ENG_062_MZB_LO_2459","ENG_062_MZB_LO_2459-18.11.2002","18.11.2002",2002,11,18,0.879617669,2
"ENG_062_MZB_LO_2459","ENG_062_MZB_LO_2459-20.10.2003","20.10.2003",2003,10,20,0.842315723,3
"ENG_062_MZB_LO_2459","ENG_062_MZB_LO_2459-14.11.2005","14.11.2005",2005,11,14,0.863035718,3
"ENG_062_MZB_LO_2459","ENG_062_MZB_LO_2459-06.09.2006","06.09.2006",2006,9,6,0.888932386,2
"ENG_062_MZB_LO_2459","ENG_062_MZB_LO_2459-22.09.2009","22.09.2009",2009,9,22,0.807354027,3
"ENG_062_MZB_LO_2459","ENG_062_MZB_LO_2459-28.09.2010","28.09.2010",2010,9,28,0.92238213,2
"ENG_062_MZB_LO_2459","ENG_062_MZB_LO_2459-26.09.2011","26.09.2011",2011,9,26,0.772406882,3
"ENG_062_MZB_LO_2459","ENG_062_MZB_LO_2459-04.11.2013","04.11.2013",2013,11,4,0.864241231,3
"ENG_062_MZB_LO_2459","ENG_062_MZB_LO_2459-03.09.2014","03.09.2014",2014,9,3,0.812684215,3
"ENG_062_MZB_LO_2459","ENG_062_MZB_LO_2459-23.09.2015","23.09.2015",2015,9,23,0.92759726,3
"ENG_062_MZB_LO_2459","ENG_062_MZB_LO_2459-16.09.2016","16.09.2016",2016,9,16,0.791775048,4
"ENG_062_MZB_LO_2459","ENG_062_MZB_LO_2459-04.10.2018","04.10.2018",2018,10,4,0.796289535,3
"ENG_062_MZB_LO_2459","ENG_062_MZB_LO_2459-23.09.2020","23.09.2020",2020,9,23,0.850965833,3
"ENG_062_MZB_LO_2459","ENG_062_MZB_LO_2459-24.11.2021","24.11.2021",2021,11,24,0.873059812,3
"ENG_062_MZB_LO_2459","ENG_062_MZB_LO_2459-20.10.2022","20.10.2022",2022,10,20,0.830650374,4
"ENG_062_MZB_LO_2459","ENG_062_MZB_LO_2459-22.09.2023","22.09.2023",2023,9,22,0.824200488,5
"ENG_062_MZB_LO_2459","ENG_062_MZB_LO_2459-10.10.2024","10.10.2024",2024,10,10,0.872520807,5
"ENG_062_MZB_LO_2460","ENG_062_MZB_LO_2460-26.11.2002","26.11.2002",2002,11,26,0.872443652,2
"ENG_062_MZB_LO_2460","ENG_062_MZB_LO_2460-02.09.2003","02.09.2003",2003,9,2,0.808233892,3
"ENG_062_MZB_LO_2460","ENG_062_MZB_LO_2460-11.10.2004","11.10.2004",2004,10,11,0.832209912,3
"ENG_062_MZB_LO_2460","ENG_062_MZB_LO_2460-21.11.2005","21.11.2005",2005,11,21,0.877250689,2
"ENG_062_MZB_LO_2460","ENG_062_MZB_LO_2460-02.10.2006","02.10.2006",2006,10,2,0.833953325,3
"ENG_062_MZB_LO_2460","ENG_062_MZB_LO_2460-30.11.2007","30.11.2007",2007,11,30,0.824837271,3
"ENG_062_MZB_LO_2460","ENG_062_MZB_LO_2460-28.11.2008","28.11.2008",2008,11,28,0.838377818,3
"ENG_062_MZB_LO_2460","ENG_062_MZB_LO_2460-27.10.2009","27.10.2009",2009,10,27,0.761751041,3
"ENG_062_MZB_LO_2460","ENG_062_MZB_LO_2460-25.10.2010","25.10.2010",2010,10,25,0.828175721,3
"ENG_062_MZB_LO_2460","ENG_062_MZB_LO_2460-24.10.2011","24.10.2011",2011,10,24,0.749157722,3
"ENG_062_MZB_LO_2460","ENG_062_MZB_LO_2460-27.11.2013","27.11.2013",2013,11,27,0.85907151,3
"ENG_062_MZB_LO_2460","ENG_062_MZB_LO_2460-23.10.2017","23.10.2017",2017,10,23,0.857115911,3
"ENG_062_MZB_LO_2460","ENG_062_MZB_LO_2460-14.11.2018","14.11.2018",2018,11,14,0.929163722,2
"ENG_062_MZB_LO_2460","ENG_062_MZB_LO_2460-05.09.2019","05.09.2019",2019,9,5,0.880011753,2
"ENG_062_MZB_LO_2460","ENG_062_MZB_LO_2460-20.10.2022","20.10.2022",2022,10,20,0.845374158,3
"ENG_062_MZB_LO_2461","ENG_062_MZB_LO_2461-26.11.2002","26.11.2002",2002,11,26,0.79247462,3
"ENG_062_MZB_LO_2461","ENG_062_MZB_LO_2461-27.10.2003","27.10.2003",2003,10,27,0.791704391,3
"ENG_062_MZB_LO_2461","ENG_062_MZB_LO_2461-15.11.2004","15.11.2004",2004,11,15,0.852455979,3
"ENG_062_MZB_LO_2461","ENG_062_MZB_LO_2461-21.11.2005","21.11.2005",2005,11,21,0.85632884,3
"ENG_062_MZB_LO_2461","ENG_062_MZB_LO_2461-02.10.2006","02.10.2006",2006,10,2,0.811906712,3
"ENG_062_MZB_LO_2461","ENG_062_MZB_LO_2461-30.11.2007","30.11.2007",2007,11,30,0.817490428,3
"ENG_062_MZB_LO_2461","ENG_062_MZB_LO_2461-28.11.2008","28.11.2008",2008,11,28,0.80479101,3
"ENG_062_MZB_LO_2461","ENG_062_MZB_LO_2461-27.10.2009","27.10.2009",2009,10,27,0.769569005,3
"ENG_062_MZB_LO_2461","ENG_062_MZB_LO_2461-25.10.2010","25.10.2010",2010,10,25,0.751210587,3
"ENG_062_MZB_LO_2461","ENG_062_MZB_LO_2461-24.10.2011","24.10.2011",2011,10,24,0.753559611,3
"ENG_062_MZB_LO_2461","ENG_062_MZB_LO_2461-14.11.2018","14.11.2018",2018,11,14,0.766687544,3
"ENG_062_MZB_LO_2462","ENG_062_MZB_LO_2462-27.10.2003","27.10.2003",2003,10,27,0.820448487,3
"ENG_062_MZB_LO_2462","ENG_062_MZB_LO_2462-15.11.2004","15.11.2004",2004,11,15,0.8664342,2
"ENG_062_MZB_LO_2462","ENG_062_MZB_LO_2462-21.11.2005","21.11.2005",2005,11,21,0.862142747,3
"ENG_062_MZB_LO_2462","ENG_062_MZB_LO_2462-02.10.2006","02.10.2006",2006,10,2,0.87371747,3
"ENG_062_MZB_LO_2462","ENG_062_MZB_LO_2462-30.11.2007","30.11.2007",2007,11,30,0.865641423,3
"ENG_062_MZB_LO_2462","ENG_062_MZB_LO_2462-28.11.2008","28.11.2008",2008,11,28,0.837939013,3
"ENG_062_MZB_LO_2462","ENG_062_MZB_LO_2462-27.10.2009","27.10.2009",2009,10,27,0.828286113,3
"ENG_062_MZB_LO_2462","ENG_062_MZB_LO_2462-25.10.2010","25.10.2010",2010,10,25,0.912341564,2
"ENG_062_MZB_LO_2462","ENG_062_MZB_LO_2462-24.10.2011","24.10.2011",2011,10,24,0.846021146,3
"ENG_062_MZB_LO_2462","ENG_062_MZB_LO_2462-04.11.2013","04.11.2013",2013,11,4,0.900122446,2
"ENG_062_MZB_LO_2462","ENG_062_MZB_LO_2462-12.09.2016","12.09.2016",2016,9,12,0.866358497,3
"ENG_062_MZB_LO_2462","ENG_062_MZB_LO_2462-23.10.2017","23.10.2017",2017,10,23,0.811140757,3
"ENG_062_MZB_LO_2462","ENG_062_MZB_LO_2462-09.11.2018","09.11.2018",2018,11,9,0.83394768,3
"ENG_062_MZB_LO_2462","ENG_062_MZB_LO_2462-05.09.2019","05.09.2019",2019,9,5,0.859211953,3
"ENG_062_MZB_LO_2462","ENG_062_MZB_LO_2462-17.11.2020","17.11.2020",2020,11,17,0.903923347,2
"ENG_062_MZB_LO_2464","ENG_062_MZB_LO_2464-02.10.2002","02.10.2002",2002,10,2,0.837383784,3
"ENG_062_MZB_LO_2464","ENG_062_MZB_LO_2464-27.11.2003","27.11.2003",2003,11,27,0.77555471,3
"ENG_062_MZB_LO_2464","ENG_062_MZB_LO_2464-14.11.2005","14.11.2005",2005,11,14,0.866774655,3
"ENG_062_MZB_LO_2464","ENG_062_MZB_LO_2464-28.09.2006","28.09.2006",2006,9,28,0.782587779,3
"ENG_062_MZB_LO_2464","ENG_062_MZB_LO_2464-24.10.2011","24.10.2011",2011,10,24,0.889511353,2
"ENG_062_MZB_LO_2464","ENG_062_MZB_LO_2464-25.09.2013","25.09.2013",2013,9,25,0.876955942,2
"ENG_062_MZB_LO_2464","ENG_062_MZB_LO_2464-13.10.2015","13.10.2015",2015,10,13,0.888108744,2
"ENG_062_MZB_LO_2464","ENG_062_MZB_LO_2464-25.11.2016","25.11.2016",2016,11,25,0.724176765,5
"ENG_062_MZB_LO_2464","ENG_062_MZB_LO_2464-31.10.2017","31.10.2017",2017,10,31,0.846161814,3
"ENG_062_MZB_LO_2464","ENG_062_MZB_LO_2464-06.11.2018","06.11.2018",2018,11,6,0.798920357,3
"ENG_062_MZB_LO_2464","ENG_062_MZB_LO_2464-17.11.2020","17.11.2020",2020,11,17,0.884220141,2
"ENG_062_MZB_LO_2465","ENG_062_MZB_LO_2465-27.11.2003","27.11.2003",2003,11,27,0.87531156,3
"ENG_062_MZB_LO_2465","ENG_062_MZB_LO_2465-15.11.2004","15.11.2004",2004,11,15,0.90962833,2
"ENG_062_MZB_LO_2465","ENG_062_MZB_LO_2465-10.10.2005","10.10.2005",2005,10,10,0.960636506,2
"ENG_062_MZB_LO_2465","ENG_062_MZB_LO_2465-21.11.2006","21.11.2006",2006,11,21,0.886588276,3
"ENG_062_MZB_LO_2465","ENG_062_MZB_LO_2465-21.11.2007","21.11.2007",2007,11,21,0.986597713,3
"ENG_062_MZB_LO_2465","ENG_062_MZB_LO_2465-13.11.2013","13.11.2013",2013,11,13,0.861996019,3
"ENG_062_MZB_LO_2465","ENG_062_MZB_LO_2465-27.10.2015","27.10.2015",2015,10,27,0.850137193,3
"ENG_062_MZB_LO_2466","ENG_062_MZB_LO_2466-25.11.2002","25.11.2002",2002,11,25,0.921751053,2
"ENG_062_MZB_LO_2466","ENG_062_MZB_LO_2466-02.09.2003","02.09.2003",2003,9,2,0.914869987,2
"ENG_062_MZB_LO_2466","ENG_062_MZB_LO_2466-11.10.2004","11.10.2004",2004,10,11,0.93396655,2
"ENG_062_MZB_LO_2466","ENG_062_MZB_LO_2466-10.10.2005","10.10.2005",2005,10,10,0.980693955,1
"ENG_062_MZB_LO_2466","ENG_062_MZB_LO_2466-21.11.2006","21.11.2006",2006,11,21,0.800187007,3
"ENG_062_MZB_LO_2466","ENG_062_MZB_LO_2466-21.11.2007","21.11.2007",2007,11,21,0.861976985,3
"ENG_062_MZB_LO_2466","ENG_062_MZB_LO_2466-24.10.2016","24.10.2016",2016,10,24,0.888382485,3
"ENG_062_MZB_LO_2467","ENG_062_MZB_LO_2467-09.10.2002","09.10.2002",2002,10,9,0.902491573,2
"ENG_062_MZB_LO_2467","ENG_062_MZB_LO_2467-24.11.2003","24.11.2003",2003,11,24,0.908076847,2
"ENG_062_MZB_LO_2467","ENG_062_MZB_LO_2467-15.09.2004","15.09.2004",2004,9,15,0.932710062,2
"ENG_062_MZB_LO_2467","ENG_062_MZB_LO_2467-08.11.2005","08.11.2005",2005,11,8,0.890676202,2
"ENG_062_MZB_LO_2467","ENG_062_MZB_LO_2467-06.11.2006","06.11.2006",2006,11,6,0.940538981,2
"ENG_062_MZB_LO_2467","ENG_062_MZB_LO_2467-19.11.2009","19.11.2009",2009,11,19,0.879496129,2
"ENG_062_MZB_LO_2467","ENG_062_MZB_LO_2467-11.10.2011","11.10.2011",2011,10,11,0.927533597,3
"ENG_062_MZB_LO_2468","ENG_062_MZB_LO_2468-09.10.2002","09.10.2002",2002,10,9,0.937631204,2
"ENG_062_MZB_LO_2468","ENG_062_MZB_LO_2468-02.09.2003","02.09.2003",2003,9,2,0.897829446,3
"ENG_062_MZB_LO_2468","ENG_062_MZB_LO_2468-11.10.2004","11.10.2004",2004,10,11,0.957140237,2
"ENG_062_MZB_LO_2468","ENG_062_MZB_LO_2468-08.11.2005","08.11.2005",2005,11,8,0.964161371,1
"ENG_062_MZB_LO_2468","ENG_062_MZB_LO_2468-06.11.2006","06.11.2006",2006,11,6,1.016825656,1
"ENG_062_MZB_LO_2468","ENG_062_MZB_LO_2468-21.11.2007","21.11.2007",2007,11,21,0.943485976,2
"ENG_062_MZB_LO_2468","ENG_062_MZB_LO_2468-09.11.2009","09.11.2009",2009,11,9,0.882018724,2
"ENG_062_MZB_LO_2468","ENG_062_MZB_LO_2468-19.11.2010","19.11.2010",2010,11,19,0.962697978,1
"ENG_062_MZB_LO_2468","ENG_062_MZB_LO_2468-11.10.2011","11.10.2011",2011,10,11,0.934632217,2
"ENG_062_MZB_LO_2468","ENG_062_MZB_LO_2468-03.10.2012","03.10.2012",2012,10,3,1.007961082,1
"ENG_062_MZB_LO_2468","ENG_062_MZB_LO_2468-15.11.2013","15.11.2013",2013,11,15,0.902717118,2
"ENG_062_MZB_LO_2468","ENG_062_MZB_LO_2468-03.09.2014","03.09.2014",2014,9,3,0.971402971,2
"ENG_062_MZB_LO_2468","ENG_062_MZB_LO_2468-18.09.2015","18.09.2015",2015,9,18,0.961070653,4
"ENG_062_MZB_LO_2468","ENG_062_MZB_LO_2468-10.11.2016","10.11.2016",2016,11,10,0.968449957,1
"ENG_062_MZB_LO_2468","ENG_062_MZB_LO_2468-31.10.2017","31.10.2017",2017,10,31,0.94578055,2
"ENG_062_MZB_LO_2468","ENG_062_MZB_LO_2468-22.11.2018","22.11.2018",2018,11,22,0.949381017,2
"ENG_062_MZB_LO_2468","ENG_062_MZB_LO_2468-27.09.2019","27.09.2019",2019,9,27,0.912718034,2
"ENG_062_MZB_LO_2468","ENG_062_MZB_LO_2468-16.11.2020","16.11.2020",2020,11,16,0.866037497,4
"ENG_062_MZB_LO_2468","ENG_062_MZB_LO_2468-17.09.2021","17.09.2021",2021,9,17,0.975541541,3
"ENG_062_MZB_LO_2468","ENG_062_MZB_LO_2468-20.09.2022","20.09.2022",2022,9,20,0.87847852,5
"ENG_062_MZB_LO_2468","ENG_062_MZB_LO_2468-17.10.2024","17.10.2024",2024,10,17,0.996934809,2
"ENG_062_MZB_LO_2469","ENG_062_MZB_LO_2469-25.11.2002","25.11.2002",2002,11,25,0.868225969,3
"ENG_062_MZB_LO_2469","ENG_062_MZB_LO_2469-24.11.2003","24.11.2003",2003,11,24,0.86746233,3
"ENG_062_MZB_LO_2469","ENG_062_MZB_LO_2469-30.09.2004","30.09.2004",2004,9,30,0.917920343,2
"ENG_062_MZB_LO_2469","ENG_062_MZB_LO_2469-08.11.2005","08.11.2005",2005,11,8,0.962717723,1
"ENG_062_MZB_LO_2469","ENG_062_MZB_LO_2469-06.11.2006","06.11.2006",2006,11,6,0.86215348,3
"ENG_062_MZB_LO_2469","ENG_062_MZB_LO_2469-21.11.2007","21.11.2007",2007,11,21,0.894474119,2
"ENG_062_MZB_LO_2469","ENG_062_MZB_LO_2469-09.11.2009","09.11.2009",2009,11,9,0.917005429,2
"ENG_062_MZB_LO_2469","ENG_062_MZB_LO_2469-03.10.2012","03.10.2012",2012,10,3,0.728098927,4
"ENG_062_MZB_LO_2469","ENG_062_MZB_LO_2469-22.10.2014","22.10.2014",2014,10,22,0.860193006,3
"ENG_062_MZB_LO_2469","ENG_062_MZB_LO_2469-27.09.2016","27.09.2016",2016,9,27,0.782128883,3
"ENG_062_MZB_LO_2469","ENG_062_MZB_LO_2469-08.11.2017","08.11.2017",2017,11,8,0.817404082,3
"ENG_062_MZB_LO_2469","ENG_062_MZB_LO_2469-15.11.2018","15.11.2018",2018,11,15,0.888257934,2
"ENG_062_MZB_LO_2469","ENG_062_MZB_LO_2469-16.11.2020","16.11.2020",2020,11,16,0.899578058,2
"ENG_062_MZB_LO_2470","ENG_062_MZB_LO_2470-05.11.2002","05.11.2002",2002,11,5,0.871839505,2
"ENG_062_MZB_LO_2470","ENG_062_MZB_LO_2470-15.09.2003","15.09.2003",2003,9,15,0.841072714,3
"ENG_062_MZB_LO_2470","ENG_062_MZB_LO_2470-30.11.2004","30.11.2004",2004,11,30,1.035931971,1
"ENG_062_MZB_LO_2470","ENG_062_MZB_LO_2470-26.09.2005","26.09.2005",2005,9,26,0.971137158,1
"ENG_062_MZB_LO_2470","ENG_062_MZB_LO_2470-31.10.2006","31.10.2006",2006,10,31,0.843466788,3
"ENG_062_MZB_LO_2470","ENG_062_MZB_LO_2470-18.09.2007","18.09.2007",2007,9,18,0.860243088,3
"ENG_062_MZB_LO_2470","ENG_062_MZB_LO_2470-28.10.2015","28.10.2015",2015,10,28,0.847249417,3
"ENG_062_MZB_LO_2470","ENG_062_MZB_LO_2470-04.11.2016","04.11.2016",2016,11,4,0.818400547,3
"ENG_062_MZB_LO_2470","ENG_062_MZB_LO_2470-27.10.2017","27.10.2017",2017,10,27,0.907671254,3
"ENG_062_MZB_LO_2471","ENG_062_MZB_LO_2471-05.11.2002","05.11.2002",2002,11,5,1.045904864,1
"ENG_062_MZB_LO_2471","ENG_062_MZB_LO_2471-15.09.2003","15.09.2003",2003,9,15,1.071965499,1
"ENG_062_MZB_LO_2471","ENG_062_MZB_LO_2471-30.11.2004","30.11.2004",2004,11,30,1.085503715,1
"ENG_062_MZB_LO_2471","ENG_062_MZB_LO_2471-26.09.2005","26.09.2005",2005,9,26,1.005988081,1
"ENG_062_MZB_LO_2471","ENG_062_MZB_LO_2471-31.10.2006","31.10.2006",2006,10,31,1.081800333,1
"ENG_062_MZB_LO_2471","ENG_062_MZB_LO_2471-18.09.2007","18.09.2007",2007,9,18,0.991070964,1
"ENG_062_MZB_LO_2471","ENG_062_MZB_LO_2471-10.11.2008","10.11.2008",2008,11,10,1.083398438,2
"ENG_062_MZB_LO_2471","ENG_062_MZB_LO_2471-06.10.2009","06.10.2009",2009,10,6,1.114918987,1
"ENG_062_MZB_LO_2471","ENG_062_MZB_LO_2471-01.09.2010","01.09.2010",2010,9,1,1.075437013,1
"ENG_062_MZB_LO_2471","ENG_062_MZB_LO_2471-12.10.2011","12.10.2011",2011,10,12,1.033562726,1
"ENG_062_MZB_LO_2471","ENG_062_MZB_LO_2471-16.09.2013","16.09.2013",2013,9,16,1.072645296,1
"ENG_062_MZB_LO_2471","ENG_062_MZB_LO_2471-29.10.2014","29.10.2014",2014,10,29,1.04238106,1
"ENG_062_MZB_LO_2471","ENG_062_MZB_LO_2471-28.09.2015","28.09.2015",2015,9,28,1.035563138,1
"ENG_062_MZB_LO_2471","ENG_062_MZB_LO_2471-05.09.2016","05.09.2016",2016,9,5,0.984665184,1
"ENG_062_MZB_LO_2471","ENG_062_MZB_LO_2471-16.10.2017","16.10.2017",2017,10,16,1.044345064,1
"ENG_062_MZB_LO_2471","ENG_062_MZB_LO_2471-12.10.2018","12.10.2018",2018,10,12,1.019448797,2
"ENG_062_MZB_LO_2471","ENG_062_MZB_LO_2471-21.09.2020","21.09.2020",2020,9,21,1.051111225,1
"ENG_062_MZB_LO_2471","ENG_062_MZB_LO_2471-15.09.2021","15.09.2021",2021,9,15,1.022135316,1
"ENG_062_MZB_LO_2471","ENG_062_MZB_LO_2471-06.11.2022","06.11.2022",2022,11,6,0.966614033,3
"ENG_062_MZB_LO_2472","ENG_062_MZB_LO_2472-29.11.2002","29.11.2002",2002,11,29,0.98467704,2
"ENG_062_MZB_LO_2472","ENG_062_MZB_LO_2472-26.11.2003","26.11.2003",2003,11,26,0.955805161,2
"ENG_062_MZB_LO_2472","ENG_062_MZB_LO_2472-16.09.2004","16.09.2004",2004,9,16,0.960074529,2
"ENG_062_MZB_LO_2472","ENG_062_MZB_LO_2472-18.10.2005","18.10.2005",2005,10,18,1.012374419,1
"ENG_062_MZB_LO_2472","ENG_062_MZB_LO_2472-03.10.2006","03.10.2006",2006,10,3,1.09233663,1
"ENG_062_MZB_LO_2472","ENG_062_MZB_LO_2472-30.11.2007","30.11.2007",2007,11,30,1.013214093,1
"ENG_062_MZB_LO_2472","ENG_062_MZB_LO_2472-17.11.2008","17.11.2008",2008,11,17,1.042911289,2
"ENG_062_MZB_LO_2472","ENG_062_MZB_LO_2472-23.09.2009","23.09.2009",2009,9,23,1.045763852,1
"ENG_062_MZB_LO_2472","ENG_062_MZB_LO_2472-26.10.2010","26.10.2010",2010,10,26,1.051082652,2
"ENG_062_MZB_LO_2472","ENG_062_MZB_LO_2472-05.09.2011","05.09.2011",2011,9,5,0.933840867,2
"ENG_062_MZB_LO_2472","ENG_062_MZB_LO_2472-01.10.2012","01.10.2012",2012,10,1,0.998335693,1
"ENG_062_MZB_LO_2472","ENG_062_MZB_LO_2472-30.09.2013","30.09.2013",2013,9,30,1.062617594,1
"ENG_062_MZB_LO_2472","ENG_062_MZB_LO_2472-28.10.2014","28.10.2014",2014,10,28,1.098151038,1
"ENG_062_MZB_LO_2472","ENG_062_MZB_LO_2472-06.10.2015","06.10.2015",2015,10,6,1.083906751,1
"ENG_062_MZB_LO_2472","ENG_062_MZB_LO_2472-19.09.2016","19.09.2016",2016,9,19,1.061273709,1
"ENG_062_MZB_LO_2472","ENG_062_MZB_LO_2472-28.09.2017","28.09.2017",2017,9,28,1.050893408,1
"ENG_062_MZB_LO_2472","ENG_062_MZB_LO_2472-11.10.2018","11.10.2018",2018,10,11,1.109676539,1
"ENG_062_MZB_LO_2472","ENG_062_MZB_LO_2472-20.10.2020","20.10.2020",2020,10,20,1.053810368,1
"ENG_062_MZB_LO_2472","ENG_062_MZB_LO_2472-20.09.2021","20.09.2021",2021,9,20,1.04677135,1
"ENG_062_MZB_LO_2472","ENG_062_MZB_LO_2472-13.10.2023","13.10.2023",2023,10,13,1.075260326,1
"ENG_062_MZB_LO_2473","ENG_062_MZB_LO_2473-29.11.2002","29.11.2002",2002,11,29,1.030590345,1
"ENG_062_MZB_LO_2473","ENG_062_MZB_LO_2473-26.11.2003","26.11.2003",2003,11,26,1.038078674,1
"ENG_062_MZB_LO_2473","ENG_062_MZB_LO_2473-18.10.2005","18.10.2005",2005,10,18,0.971410483,1
"ENG_062_MZB_LO_2473","ENG_062_MZB_LO_2473-10.10.2006","10.10.2006",2006,10,10,0.975920531,1
"ENG_062_MZB_LO_2473","ENG_062_MZB_LO_2473-30.11.2007","30.11.2007",2007,11,30,1.013500729,1
"ENG_062_MZB_LO_2473","ENG_062_MZB_LO_2473-06.10.2009","06.10.2009",2009,10,6,0.958805638,2
"ENG_062_MZB_LO_2473","ENG_062_MZB_LO_2473-26.10.2010","26.10.2010",2010,10,26,0.926155798,2
"ENG_062_MZB_LO_2473","ENG_062_MZB_LO_2473-05.09.2011","05.09.2011",2011,9,5,0.998554336,1
"ENG_062_MZB_LO_2473","ENG_062_MZB_LO_2473-01.10.2012","01.10.2012",2012,10,1,0.953632732,2
"ENG_062_MZB_LO_2473","ENG_062_MZB_LO_2473-30.09.2013","30.09.2013",2013,9,30,0.980455896,1
"ENG_062_MZB_LO_2474","ENG_062_MZB_LO_2474-29.11.2002","29.11.2002",2002,11,29,0.962072227,1
"ENG_062_MZB_LO_2474","ENG_062_MZB_LO_2474-26.11.2003","26.11.2003",2003,11,26,0.901154994,2
"ENG_062_MZB_LO_2474","ENG_062_MZB_LO_2474-16.09.2004","16.09.2004",2004,9,16,0.985999365,1
"ENG_062_MZB_LO_2474","ENG_062_MZB_LO_2474-10.10.2006","10.10.2006",2006,10,10,0.936491797,2
"ENG_062_MZB_LO_2474","ENG_062_MZB_LO_2474-30.11.2007","30.11.2007",2007,11,30,1.020997633,1
"ENG_062_MZB_LO_2474","ENG_062_MZB_LO_2474-06.10.2009","06.10.2009",2009,10,6,0.975104831,1
"ENG_062_MZB_LO_2474","ENG_062_MZB_LO_2474-26.10.2010","26.10.2010",2010,10,26,0.96950367,2
"ENG_062_MZB_LO_2474","ENG_062_MZB_LO_2474-05.09.2011","05.09.2011",2011,9,5,0.913454785,2
"ENG_062_MZB_LO_2474","ENG_062_MZB_LO_2474-07.10.2013","07.10.2013",2013,10,7,1.041251253,1
