"Unique.ID","Samp.ID","Sampling.date","year","month","day","eqr","eqc"
"ENG_062_MZB_LO_1","ENG_062_MZB_LO_1-10.10.2002","10.10.2002",2002,10,10,0.849789701,3
"ENG_062_MZB_LO_1","ENG_062_MZB_LO_1-02.10.2003","02.10.2003",2003,10,2,0.861562251,3
"ENG_062_MZB_LO_1","ENG_062_MZB_LO_1-02.11.2004","02.11.2004",2004,11,2,0.850282924,3
"ENG_062_MZB_LO_1","ENG_062_MZB_LO_1-20.09.2007","20.09.2007",2007,9,20,0.919665862,2
"ENG_062_MZB_LO_1","ENG_062_MZB_LO_1-03.10.2008","03.10.2008",2008,10,3,0.918221339,2
"ENG_062_MZB_LO_1","ENG_062_MZB_LO_1-16.09.2009","16.09.2009",2009,9,16,0.95488225,2
"ENG_062_MZB_LO_1","ENG_062_MZB_LO_1-07.10.2010","07.10.2010",2010,10,7,0.938586947,2
"ENG_062_MZB_LO_1","ENG_062_MZB_LO_1-05.10.2011","05.10.2011",2011,10,5,1.014603252,1
"ENG_062_MZB_LO_1","ENG_062_MZB_LO_1-19.09.2012","19.09.2012",2012,9,19,0.998923556,1
"ENG_062_MZB_LO_1","ENG_062_MZB_LO_1-04.09.2013","04.09.2013",2013,9,4,0.968421347,1
"ENG_062_MZB_LO_1","ENG_062_MZB_LO_1-19.09.2014","19.09.2014",2014,9,19,0.983456739,1
"ENG_062_MZB_LO_1","ENG_062_MZB_LO_1-08.09.2015","08.09.2015",2015,9,8,0.96854082,1
"ENG_062_MZB_LO_1","ENG_062_MZB_LO_1-06.10.2016","06.10.2016",2016,10,6,1.014100063,1
"ENG_062_MZB_LO_1","ENG_062_MZB_LO_1-26.09.2017","26.09.2017",2017,9,26,0.988850503,1
"ENG_062_MZB_LO_1","ENG_062_MZB_LO_1-10.10.2018","10.10.2018",2018,10,10,0.990392747,1
"ENG_062_MZB_LO_10","ENG_062_MZB_LO_10-23.10.2012","23.10.2012",2012,10,23,1.035527147,1
"ENG_062_MZB_LO_10","ENG_062_MZB_LO_10-14.11.2013","14.11.2013",2013,11,14,1.101530051,1
"ENG_062_MZB_LO_10","ENG_062_MZB_LO_10-21.09.2016","21.09.2016",2016,9,21,1.024089789,1
"ENG_062_MZB_LO_10","ENG_062_MZB_LO_10-29.10.2019","29.10.2019",2019,10,29,1.083145882,3
"ENG_062_MZB_LO_10","ENG_062_MZB_LO_10-21.09.2021","21.09.2021",2021,9,21,1.088961364,1
"ENG_062_MZB_LO_10","ENG_062_MZB_LO_10-10.10.2022","10.10.2022",2022,10,10,1.020108515,1
"ENG_062_MZB_LO_10","ENG_062_MZB_LO_10-24.09.2023","24.09.2023",2023,9,24,0.99686777,1
"ENG_062_MZB_LO_1005","ENG_062_MZB_LO_1005-25.03.2002","25.03.2002",2002,3,25,0.925682349,2
"ENG_062_MZB_LO_1005","ENG_062_MZB_LO_1005-07.03.2003","07.03.2003",2003,3,7,0.947301621,2
"ENG_062_MZB_LO_1005","ENG_062_MZB_LO_1005-07.04.2004","07.04.2004",2004,4,7,0.972545555,1
"ENG_062_MZB_LO_1005","ENG_062_MZB_LO_1005-09.05.2005","09.05.2005",2005,5,9,1.005221209,1
"ENG_062_MZB_LO_1005","ENG_062_MZB_LO_1005-22.04.2008","22.04.2008",2008,4,22,1.030845981,1
"ENG_062_MZB_LO_1005","ENG_062_MZB_LO_1005-08.05.2013","08.05.2013",2013,5,8,0.967226879,1
"ENG_062_MZB_LO_1005","ENG_062_MZB_LO_1005-18.03.2015","18.03.2015",2015,3,18,1.062886997,1
"ENG_062_MZB_LO_1007","ENG_062_MZB_LO_1007-12.11.2007","12.11.2007",2007,11,12,0.955637495,2
"ENG_062_MZB_LO_1007","ENG_062_MZB_LO_1007-08.10.2008","08.10.2008",2008,10,8,0.886266828,2
"ENG_062_MZB_LO_1007","ENG_062_MZB_LO_1007-19.10.2009","19.10.2009",2009,10,19,0.921567612,2
"ENG_062_MZB_LO_1007","ENG_062_MZB_LO_1007-27.09.2010","27.09.2010",2010,9,27,0.942291612,2
"ENG_062_MZB_LO_1007","ENG_062_MZB_LO_1007-08.11.2011","08.11.2011",2011,11,8,0.945943403,2
"ENG_062_MZB_LO_1007","ENG_062_MZB_LO_1007-01.11.2012","01.11.2012",2012,11,1,0.909434603,2
"ENG_062_MZB_LO_1007","ENG_062_MZB_LO_1007-30.09.2013","30.09.2013",2013,9,30,0.698548817,4
"ENG_062_MZB_LO_1007","ENG_062_MZB_LO_1007-25.09.2014","25.09.2014",2014,9,25,0.820033286,3
"ENG_062_MZB_LO_1007","ENG_062_MZB_LO_1007-02.10.2015","02.10.2015",2015,10,2,0.749220185,3
"ENG_062_MZB_LO_1007","ENG_062_MZB_LO_1007-14.09.2016","14.09.2016",2016,9,14,0.705809792,4
"ENG_062_MZB_LO_1007","ENG_062_MZB_LO_1007-13.10.2017","13.10.2017",2017,10,13,0.944562418,2
"ENG_062_MZB_LO_1007","ENG_062_MZB_LO_1007-27.09.2018","27.09.2018",2018,9,27,0.80211338,3
"ENG_062_MZB_LO_1007","ENG_062_MZB_LO_1007-18.09.2019","18.09.2019",2019,9,18,0.887675831,3
"ENG_062_MZB_LO_1007","ENG_062_MZB_LO_1007-16.10.2020","16.10.2020",2020,10,16,0.74185201,4
"ENG_062_MZB_LO_1009","ENG_062_MZB_LO_1009-04.11.2003","04.11.2003",2003,11,4,0.663167087,4
"ENG_062_MZB_LO_1009","ENG_062_MZB_LO_1009-31.10.2006","31.10.2006",2006,10,31,0.773377399,3
"ENG_062_MZB_LO_1009","ENG_062_MZB_LO_1009-29.11.2011","29.11.2011",2011,11,29,0.637269533,4
"ENG_062_MZB_LO_1009","ENG_062_MZB_LO_1009-09.09.2013","09.09.2013",2013,9,9,0.606684969,5
"ENG_062_MZB_LO_1009","ENG_062_MZB_LO_1009-11.10.2016","11.10.2016",2016,10,11,0.612925606,4
"ENG_062_MZB_LO_1009","ENG_062_MZB_LO_1009-28.10.2021","28.10.2021",2021,10,28,0.647449118,4
"ENG_062_MZB_LO_1009","ENG_062_MZB_LO_1009-09.11.2022","09.11.2022",2022,11,9,0.680304528,4
"ENG_062_MZB_LO_101","ENG_062_MZB_LO_101-26.11.2002","26.11.2002",2002,11,26,0.791169583,3
"ENG_062_MZB_LO_101","ENG_062_MZB_LO_101-25.11.2003","25.11.2003",2003,11,25,0.768961307,3
"ENG_062_MZB_LO_101","ENG_062_MZB_LO_101-14.10.2004","14.10.2004",2004,10,14,0.727999792,3
"ENG_062_MZB_LO_101","ENG_062_MZB_LO_101-28.09.2006","28.09.2006",2006,9,28,0.893811291,2
"ENG_062_MZB_LO_101","ENG_062_MZB_LO_101-01.11.2007","01.11.2007",2007,11,1,0.869843518,2
"ENG_062_MZB_LO_101","ENG_062_MZB_LO_101-13.10.2008","13.10.2008",2008,10,13,0.831681888,3
"ENG_062_MZB_LO_101","ENG_062_MZB_LO_101-30.09.2009","30.09.2009",2009,9,30,1.030206394,1
"ENG_062_MZB_LO_101","ENG_062_MZB_LO_101-05.09.2013","05.09.2013",2013,9,5,1.041443711,1
"ENG_062_MZB_LO_101","ENG_062_MZB_LO_101-04.09.2014","04.09.2014",2014,9,4,0.985864312,1
"ENG_062_MZB_LO_1011","ENG_062_MZB_LO_1011-30.09.2003","30.09.2003",2003,9,30,0.730096357,3
"ENG_062_MZB_LO_1011","ENG_062_MZB_LO_1011-15.11.2004","15.11.2004",2004,11,15,0.747061132,3
"ENG_062_MZB_LO_1011","ENG_062_MZB_LO_1011-18.10.2005","18.10.2005",2005,10,18,0.79316073,3
"ENG_062_MZB_LO_1011","ENG_062_MZB_LO_1011-19.10.2006","19.10.2006",2006,10,19,0.79538621,3
"ENG_062_MZB_LO_1011","ENG_062_MZB_LO_1011-11.10.2007","11.10.2007",2007,10,11,0.77996718,3
"ENG_062_MZB_LO_1011","ENG_062_MZB_LO_1011-30.10.2008","30.10.2008",2008,10,30,0.763261814,3
"ENG_062_MZB_LO_1011","ENG_062_MZB_LO_1011-09.09.2009","09.09.2009",2009,9,9,0.716282683,4
"ENG_062_MZB_LO_1011","ENG_062_MZB_LO_1011-12.11.2010","12.11.2010",2010,11,12,0.763567688,3
"ENG_062_MZB_LO_1011","ENG_062_MZB_LO_1011-05.11.2011","05.11.2011",2011,11,5,0.776415658,3
"ENG_062_MZB_LO_1011","ENG_062_MZB_LO_1011-15.11.2012","15.11.2012",2012,11,15,0.856030696,3
"ENG_062_MZB_LO_1011","ENG_062_MZB_LO_1011-25.09.2013","25.09.2013",2013,9,25,0.830253147,3
"ENG_062_MZB_LO_1011","ENG_062_MZB_LO_1011-20.10.2014","20.10.2014",2014,10,20,0.854496399,3
"ENG_062_MZB_LO_1011","ENG_062_MZB_LO_1011-05.11.2019","05.11.2019",2019,11,5,0.775094004,3
"ENG_062_MZB_LO_1011","ENG_062_MZB_LO_1011-15.10.2021","15.10.2021",2021,10,15,0.823248866,3
"ENG_062_MZB_LO_1011","ENG_062_MZB_LO_1011-04.11.2022","04.11.2022",2022,11,4,0.785790209,4
"ENG_062_MZB_LO_1011","ENG_062_MZB_LO_1011-27.10.2023","27.10.2023",2023,10,27,0.713756585,4
"ENG_062_MZB_LO_1018","ENG_062_MZB_LO_1018-16.09.2003","16.09.2003",2003,9,16,0.901787686,2
"ENG_062_MZB_LO_1018","ENG_062_MZB_LO_1018-12.10.2006","12.10.2006",2006,10,12,1.06168449,1
"ENG_062_MZB_LO_1018","ENG_062_MZB_LO_1018-15.11.2013","15.11.2013",2013,11,15,1.073382648,1
"ENG_062_MZB_LO_1018","ENG_062_MZB_LO_1018-28.10.2015","28.10.2015",2015,10,28,0.90797618,2
"ENG_062_MZB_LO_1018","ENG_062_MZB_LO_1018-16.11.2018","16.11.2018",2018,11,16,1.105425257,1
"ENG_062_MZB_LO_1018","ENG_062_MZB_LO_1018-16.11.2022","16.11.2022",2022,11,16,1.066947086,1
"ENG_062_MZB_LO_1018","ENG_062_MZB_LO_1018-11.10.2023","11.10.2023",2023,10,11,1.051366579,2
"ENG_062_MZB_LO_1019","ENG_062_MZB_LO_1019-30.10.2003","30.10.2003",2003,10,30,0.892675657,2
"ENG_062_MZB_LO_1019","ENG_062_MZB_LO_1019-17.09.2004","17.09.2004",2004,9,17,0.933593832,2
"ENG_062_MZB_LO_1019","ENG_062_MZB_LO_1019-23.09.2005","23.09.2005",2005,9,23,0.733193361,4
"ENG_062_MZB_LO_1019","ENG_062_MZB_LO_1019-15.11.2007","15.11.2007",2007,11,15,0.92858503,2
"ENG_062_MZB_LO_1019","ENG_062_MZB_LO_1019-29.09.2008","29.09.2008",2008,9,29,0.837064063,3
"ENG_062_MZB_LO_1019","ENG_062_MZB_LO_1019-14.10.2009","14.10.2009",2009,10,14,1.010971244,1
"ENG_062_MZB_LO_1019","ENG_062_MZB_LO_1019-27.10.2010","27.10.2010",2010,10,27,0.871285376,2
"ENG_062_MZB_LO_1019","ENG_062_MZB_LO_1019-26.10.2011","26.10.2011",2011,10,26,0.864604801,3
"ENG_062_MZB_LO_1019","ENG_062_MZB_LO_1019-14.11.2012","14.11.2012",2012,11,14,0.951909753,2
"ENG_062_MZB_LO_1019","ENG_062_MZB_LO_1019-21.10.2013","21.10.2013",2013,10,21,0.99456856,1
"ENG_062_MZB_LO_1019","ENG_062_MZB_LO_1019-30.09.2014","30.09.2014",2014,9,30,0.978715555,1
"ENG_062_MZB_LO_1019","ENG_062_MZB_LO_1019-22.10.2015","22.10.2015",2015,10,22,0.961889736,1
"ENG_062_MZB_LO_102","ENG_062_MZB_LO_102-26.11.2002","26.11.2002",2002,11,26,0.7969779,3
"ENG_062_MZB_LO_102","ENG_062_MZB_LO_102-11.11.2003","11.11.2003",2003,11,11,0.795578965,3
"ENG_062_MZB_LO_102","ENG_062_MZB_LO_102-14.10.2004","14.10.2004",2004,10,14,0.868855611,2
"ENG_062_MZB_LO_102","ENG_062_MZB_LO_102-28.09.2006","28.09.2006",2006,9,28,0.895571376,2
"ENG_062_MZB_LO_102","ENG_062_MZB_LO_102-01.11.2007","01.11.2007",2007,11,1,0.976730422,1
"ENG_062_MZB_LO_102","ENG_062_MZB_LO_102-13.10.2008","13.10.2008",2008,10,13,0.902555198,2
"ENG_062_MZB_LO_102","ENG_062_MZB_LO_102-30.09.2009","30.09.2009",2009,9,30,0.914773398,2
"ENG_062_MZB_LO_102","ENG_062_MZB_LO_102-05.09.2013","05.09.2013",2013,9,5,0.916694925,2
"ENG_062_MZB_LO_102","ENG_062_MZB_LO_102-30.09.2014","30.09.2014",2014,9,30,0.984317747,1
"ENG_062_MZB_LO_1020","ENG_062_MZB_LO_1020-04.09.2002","04.09.2002",2002,9,4,0.974008447,2
"ENG_062_MZB_LO_1020","ENG_062_MZB_LO_1020-09.11.2005","09.11.2005",2005,11,9,1.057157209,1
"ENG_062_MZB_LO_1020","ENG_062_MZB_LO_1020-12.11.2007","12.11.2007",2007,11,12,1.101659201,2
"ENG_062_MZB_LO_1020","ENG_062_MZB_LO_1020-08.10.2008","08.10.2008",2008,10,8,1.080591787,1
"ENG_062_MZB_LO_1020","ENG_062_MZB_LO_1020-02.11.2009","02.11.2009",2009,11,2,1.123832842,1
"ENG_062_MZB_LO_1020","ENG_062_MZB_LO_1020-04.10.2010","04.10.2010",2010,10,4,0.980827428,2
"ENG_062_MZB_LO_1020","ENG_062_MZB_LO_1020-09.11.2011","09.11.2011",2011,11,9,1.09832393,1
"ENG_062_MZB_LO_1020","ENG_062_MZB_LO_1020-09.10.2012","09.10.2012",2012,10,9,1.032348133,2
"ENG_062_MZB_LO_1020","ENG_062_MZB_LO_1020-16.09.2014","16.09.2014",2014,9,16,1.099611012,1
"ENG_062_MZB_LO_1022","ENG_062_MZB_LO_1022-19.09.2013","19.09.2013",2013,9,19,0.996900977,1
"ENG_062_MZB_LO_1022","ENG_062_MZB_LO_1022-22.09.2014","22.09.2014",2014,9,22,1.130428053,1
"ENG_062_MZB_LO_1022","ENG_062_MZB_LO_1022-05.10.2015","05.10.2015",2015,10,5,1.110780077,1
"ENG_062_MZB_LO_1022","ENG_062_MZB_LO_1022-27.10.2016","27.10.2016",2016,10,27,1.127219707,1
"ENG_062_MZB_LO_1022","ENG_062_MZB_LO_1022-11.10.2017","11.10.2017",2017,10,11,1.174970965,1
"ENG_062_MZB_LO_1022","ENG_062_MZB_LO_1022-28.09.2018","28.09.2018",2018,9,28,1.103664014,1
"ENG_062_MZB_LO_1022","ENG_062_MZB_LO_1022-16.09.2019","16.09.2019",2019,9,16,1.208418237,1
"ENG_062_MZB_LO_1022","ENG_062_MZB_LO_1022-14.10.2020","14.10.2020",2020,10,14,1.062765624,1
"ENG_062_MZB_LO_1022","ENG_062_MZB_LO_1022-25.10.2021","25.10.2021",2021,10,25,1.159052246,1
"ENG_062_MZB_LO_1022","ENG_062_MZB_LO_1022-25.11.2022","25.11.2022",2022,11,25,1.239359459,1
"ENG_062_MZB_LO_1022","ENG_062_MZB_LO_1022-25.10.2023","25.10.2023",2023,10,25,1.148099012,1
"ENG_062_MZB_LO_1023","ENG_062_MZB_LO_1023-06.10.2003","06.10.2003",2003,10,6,1.046066485,1
"ENG_062_MZB_LO_1023","ENG_062_MZB_LO_1023-05.10.2004","05.10.2004",2004,10,5,1.015973013,1
"ENG_062_MZB_LO_1023","ENG_062_MZB_LO_1023-10.10.2006","10.10.2006",2006,10,10,0.99622139,1
"ENG_062_MZB_LO_1023","ENG_062_MZB_LO_1023-19.11.2009","19.11.2009",2009,11,19,1.098588213,1
"ENG_062_MZB_LO_1023","ENG_062_MZB_LO_1023-22.09.2010","22.09.2010",2010,9,22,1.043566067,1
"ENG_062_MZB_LO_1023","ENG_062_MZB_LO_1023-18.10.2011","18.10.2011",2011,10,18,1.093948698,1
"ENG_062_MZB_LO_1023","ENG_062_MZB_LO_1023-09.10.2012","09.10.2012",2012,10,9,1.09664574,1
"ENG_062_MZB_LO_1023","ENG_062_MZB_LO_1023-27.09.2013","27.09.2013",2013,9,27,1.109462554,2
"ENG_062_MZB_LO_1023","ENG_062_MZB_LO_1023-11.09.2014","11.09.2014",2014,9,11,1.020179953,3
"ENG_062_MZB_LO_1023","ENG_062_MZB_LO_1023-04.09.2015","04.09.2015",2015,9,4,1.064652383,1
"ENG_062_MZB_LO_1023","ENG_062_MZB_LO_1023-27.09.2016","27.09.2016",2016,9,27,1.078139153,1
"ENG_062_MZB_LO_1023","ENG_062_MZB_LO_1023-09.10.2017","09.10.2017",2017,10,9,1.093603747,3
"ENG_062_MZB_LO_1023","ENG_062_MZB_LO_1023-05.10.2018","05.10.2018",2018,10,5,1.086801212,1
"ENG_062_MZB_LO_1023","ENG_062_MZB_LO_1023-18.09.2019","18.09.2019",2019,9,18,1.152367885,1
"ENG_062_MZB_LO_1023","ENG_062_MZB_LO_1023-22.10.2020","22.10.2020",2020,10,22,1.044086336,1
"ENG_062_MZB_LO_1023","ENG_062_MZB_LO_1023-10.09.2021","10.09.2021",2021,9,10,1.155658227,1
"ENG_062_MZB_LO_1023","ENG_062_MZB_LO_1023-07.09.2022","07.09.2022",2022,9,7,1.14118221,2
"ENG_062_MZB_LO_1023","ENG_062_MZB_LO_1023-15.09.2023","15.09.2023",2023,9,15,1.108390097,1
"ENG_062_MZB_LO_1025","ENG_062_MZB_LO_1025-30.09.2003","30.09.2003",2003,9,30,1.102626911,1
"ENG_062_MZB_LO_1025","ENG_062_MZB_LO_1025-15.11.2004","15.11.2004",2004,11,15,1.223616626,1
"ENG_062_MZB_LO_1025","ENG_062_MZB_LO_1025-19.10.2006","19.10.2006",2006,10,19,1.125403102,1
"ENG_062_MZB_LO_1025","ENG_062_MZB_LO_1025-11.10.2007","11.10.2007",2007,10,11,1.162207355,1
"ENG_062_MZB_LO_1025","ENG_062_MZB_LO_1025-30.10.2008","30.10.2008",2008,10,30,1.24611406,2
"ENG_062_MZB_LO_1025","ENG_062_MZB_LO_1025-09.09.2009","09.09.2009",2009,9,9,1.198672159,1
"ENG_062_MZB_LO_1025","ENG_062_MZB_LO_1025-12.11.2010","12.11.2010",2010,11,12,1.082668732,1
"ENG_062_MZB_LO_1025","ENG_062_MZB_LO_1025-05.11.2011","05.11.2011",2011,11,5,1.174920745,1
"ENG_062_MZB_LO_1025","ENG_062_MZB_LO_1025-15.11.2012","15.11.2012",2012,11,15,1.098270634,1
"ENG_062_MZB_LO_1025","ENG_062_MZB_LO_1025-10.10.2013","10.10.2013",2013,10,10,1.197759034,1
"ENG_062_MZB_LO_1025","ENG_062_MZB_LO_1025-15.09.2014","15.09.2014",2014,9,15,1.234064067,1
"ENG_062_MZB_LO_1025","ENG_062_MZB_LO_1025-17.11.2015","17.11.2015",2015,11,17,1.117128916,1
"ENG_062_MZB_LO_1025","ENG_062_MZB_LO_1025-23.09.2016","23.09.2016",2016,9,23,1.143077475,1
"ENG_062_MZB_LO_1025","ENG_062_MZB_LO_1025-11.10.2017","11.10.2017",2017,10,11,1.18823209,1
"ENG_062_MZB_LO_1025","ENG_062_MZB_LO_1025-22.10.2018","22.10.2018",2018,10,22,1.169994535,1
"ENG_062_MZB_LO_1025","ENG_062_MZB_LO_1025-17.10.2019","17.10.2019",2019,10,17,1.140660254,1
"ENG_062_MZB_LO_1025","ENG_062_MZB_LO_1025-13.10.2020","13.10.2020",2020,10,13,1.139342686,1
"ENG_062_MZB_LO_1025","ENG_062_MZB_LO_1025-24.09.2021","24.09.2021",2021,9,24,1.151022185,1
"ENG_062_MZB_LO_1025","ENG_062_MZB_LO_1025-06.09.2022","06.09.2022",2022,9,6,1.24812687,2
"ENG_062_MZB_LO_1025","ENG_062_MZB_LO_1025-27.10.2023","27.10.2023",2023,10,27,1.113695384,1
"ENG_062_MZB_LO_103","ENG_062_MZB_LO_103-26.11.2002","26.11.2002",2002,11,26,0.833748065,3
"ENG_062_MZB_LO_103","ENG_062_MZB_LO_103-25.11.2003","25.11.2003",2003,11,25,0.7976472,3
"ENG_062_MZB_LO_103","ENG_062_MZB_LO_103-14.10.2004","14.10.2004",2004,10,14,0.712393557,4
"ENG_062_MZB_LO_103","ENG_062_MZB_LO_103-14.09.2005","14.09.2005",2005,9,14,0.780516545,3
"ENG_062_MZB_LO_103","ENG_062_MZB_LO_103-28.09.2006","28.09.2006",2006,9,28,0.961057832,2
"ENG_062_MZB_LO_103","ENG_062_MZB_LO_103-01.11.2007","01.11.2007",2007,11,1,0.892577838,2
"ENG_062_MZB_LO_103","ENG_062_MZB_LO_103-13.10.2008","13.10.2008",2008,10,13,0.921535345,2
"ENG_062_MZB_LO_103","ENG_062_MZB_LO_103-30.09.2009","30.09.2009",2009,9,30,0.930613934,2
"ENG_062_MZB_LO_103","ENG_062_MZB_LO_103-11.09.2012","11.09.2012",2012,9,11,1.013163272,1
"ENG_062_MZB_LO_103","ENG_062_MZB_LO_103-30.09.2014","30.09.2014",2014,9,30,1.002042299,1
"ENG_062_MZB_LO_1032","ENG_062_MZB_LO_1032-30.04.2002","30.04.2002",2002,4,30,0.978110947,1
"ENG_062_MZB_LO_1032","ENG_062_MZB_LO_1032-09.03.2005","09.03.2005",2005,3,9,0.978920105,1
"ENG_062_MZB_LO_1032","ENG_062_MZB_LO_1032-22.05.2009","22.05.2009",2009,5,22,1.083884641,1
"ENG_062_MZB_LO_1032","ENG_062_MZB_LO_1032-25.05.2010","25.05.2010",2010,5,25,1.135917214,1
"ENG_062_MZB_LO_1032","ENG_062_MZB_LO_1032-26.05.2011","26.05.2011",2011,5,26,1.120456328,1
"ENG_062_MZB_LO_1032","ENG_062_MZB_LO_1032-29.04.2014","29.04.2014",2014,4,29,1.145056914,1
"ENG_062_MZB_LO_1032","ENG_062_MZB_LO_1032-25.05.2023","25.05.2023",2023,5,25,1.155307197,1
"ENG_062_MZB_LO_1032","ENG_062_MZB_LO_1032-25.04.2024","25.04.2024",2024,4,25,1.092870567,1
"ENG_062_MZB_LO_1033","ENG_062_MZB_LO_1033-03.09.2002","03.09.2002",2002,9,3,1.036207861,1
"ENG_062_MZB_LO_1033","ENG_062_MZB_LO_1033-03.09.2003","03.09.2003",2003,9,3,1.009928116,2
"ENG_062_MZB_LO_1033","ENG_062_MZB_LO_1033-05.09.2004","05.09.2004",2004,9,5,1.067516486,1
"ENG_062_MZB_LO_1033","ENG_062_MZB_LO_1033-17.10.2005","17.10.2005",2005,10,17,1.023807963,1
"ENG_062_MZB_LO_1033","ENG_062_MZB_LO_1033-18.09.2008","18.09.2008",2008,9,18,1.056066187,1
"ENG_062_MZB_LO_1033","ENG_062_MZB_LO_1033-20.11.2009","20.11.2009",2009,11,20,1.073245628,1
"ENG_062_MZB_LO_1033","ENG_062_MZB_LO_1033-30.09.2014","30.09.2014",2014,9,30,1.098302031,1
"ENG_062_MZB_LO_1033","ENG_062_MZB_LO_1033-06.11.2017","06.11.2017",2017,11,6,1.088379038,1
"ENG_062_MZB_LO_1033","ENG_062_MZB_LO_1033-23.09.2020","23.09.2020",2020,9,23,1.101925793,1
"ENG_062_MZB_LO_1037","ENG_062_MZB_LO_1037-15.04.2002","15.04.2002",2002,4,15,1.150378476,1
"ENG_062_MZB_LO_1037","ENG_062_MZB_LO_1037-11.03.2003","11.03.2003",2003,3,11,1.16404284,2
"ENG_062_MZB_LO_1037","ENG_062_MZB_LO_1037-04.05.2005","04.05.2005",2005,5,4,1.128344632,1
"ENG_062_MZB_LO_1037","ENG_062_MZB_LO_1037-18.05.2006","18.05.2006",2006,5,18,0.894826238,2
"ENG_062_MZB_LO_1037","ENG_062_MZB_LO_1037-03.04.2007","03.04.2007",2007,4,3,1.12407016,2
"ENG_062_MZB_LO_1037","ENG_062_MZB_LO_1037-23.05.2013","23.05.2013",2013,5,23,1.215352166,1
"ENG_062_MZB_LO_1037","ENG_062_MZB_LO_1037-11.03.2015","11.03.2015",2015,3,11,1.067170818,2
"ENG_062_MZB_LO_1038","ENG_062_MZB_LO_1038-11.09.2003","11.09.2003",2003,9,11,0.875760816,2
"ENG_062_MZB_LO_1038","ENG_062_MZB_LO_1038-07.09.2004","07.09.2004",2004,9,7,0.983150206,1
"ENG_062_MZB_LO_1038","ENG_062_MZB_LO_1038-27.10.2005","27.10.2005",2005,10,27,0.935182678,2
"ENG_062_MZB_LO_1038","ENG_062_MZB_LO_1038-10.10.2006","10.10.2006",2006,10,10,1.05248665,1
"ENG_062_MZB_LO_1038","ENG_062_MZB_LO_1038-19.10.2007","19.10.2007",2007,10,19,1.042337986,1
"ENG_062_MZB_LO_1038","ENG_062_MZB_LO_1038-23.10.2008","23.10.2008",2008,10,23,1.02955052,1
"ENG_062_MZB_LO_1038","ENG_062_MZB_LO_1038-04.11.2013","04.11.2013",2013,11,4,0.992100712,2
"ENG_062_MZB_LO_1039","ENG_062_MZB_LO_1039-24.09.2002","24.09.2002",2002,9,24,1.044479094,1
"ENG_062_MZB_LO_1039","ENG_062_MZB_LO_1039-28.10.2003","28.10.2003",2003,10,28,0.910775435,2
"ENG_062_MZB_LO_1039","ENG_062_MZB_LO_1039-27.10.2005","27.10.2005",2005,10,27,0.97400469,2
"ENG_062_MZB_LO_1039","ENG_062_MZB_LO_1039-13.10.2006","13.10.2006",2006,10,13,1.083845475,1
"ENG_062_MZB_LO_1039","ENG_062_MZB_LO_1039-29.10.2007","29.10.2007",2007,10,29,1.035023797,2
"ENG_062_MZB_LO_1039","ENG_062_MZB_LO_1039-23.10.2008","23.10.2008",2008,10,23,1.053704548,2
"ENG_062_MZB_LO_1039","ENG_062_MZB_LO_1039-17.09.2009","17.09.2009",2009,9,17,1.059396397,3
"ENG_062_MZB_LO_1039","ENG_062_MZB_LO_1039-05.10.2010","05.10.2010",2010,10,5,1.048927988,2
"ENG_062_MZB_LO_1039","ENG_062_MZB_LO_1039-03.10.2011","03.10.2011",2011,10,3,1.071859859,1
"ENG_062_MZB_LO_1039","ENG_062_MZB_LO_1039-22.09.2014","22.09.2014",2014,9,22,1.047771495,1
"ENG_062_MZB_LO_1039","ENG_062_MZB_LO_1039-14.09.2015","14.09.2015",2015,9,14,1.078451502,1
"ENG_062_MZB_LO_1039","ENG_062_MZB_LO_1039-23.09.2016","23.09.2016",2016,9,23,1.166049812,1
"ENG_062_MZB_LO_1039","ENG_062_MZB_LO_1039-04.10.2017","04.10.2017",2017,10,4,1.135839126,1
"ENG_062_MZB_LO_1039","ENG_062_MZB_LO_1039-22.10.2018","22.10.2018",2018,10,22,1.113388154,1
"ENG_062_MZB_LO_1039","ENG_062_MZB_LO_1039-17.10.2019","17.10.2019",2019,10,17,1.114231439,1
"ENG_062_MZB_LO_1039","ENG_062_MZB_LO_1039-13.10.2020","13.10.2020",2020,10,13,1.168923429,1
"ENG_062_MZB_LO_1039","ENG_062_MZB_LO_1039-24.09.2021","24.09.2021",2021,9,24,1.114386843,1
"ENG_062_MZB_LO_1039","ENG_062_MZB_LO_1039-07.10.2022","07.10.2022",2022,10,7,1.097983711,1
"ENG_062_MZB_LO_1039","ENG_062_MZB_LO_1039-23.10.2023","23.10.2023",2023,10,23,1.082628536,1
"ENG_062_MZB_LO_1040","ENG_062_MZB_LO_1040-03.09.2002","03.09.2002",2002,9,3,1.117486782,1
"ENG_062_MZB_LO_1040","ENG_062_MZB_LO_1040-07.11.2005","07.11.2005",2005,11,7,1.027225647,2
"ENG_062_MZB_LO_1040","ENG_062_MZB_LO_1040-18.09.2008","18.09.2008",2008,9,18,1.045961034,2
"ENG_062_MZB_LO_1040","ENG_062_MZB_LO_1040-12.11.2013","12.11.2013",2013,11,12,0.842174062,5
"ENG_062_MZB_LO_1040","ENG_062_MZB_LO_1040-08.10.2021","08.10.2021",2021,10,8,1.197357901,1
"ENG_062_MZB_LO_1040","ENG_062_MZB_LO_1040-20.10.2023","20.10.2023",2023,10,20,1.170223905,1
"ENG_062_MZB_LO_1040","ENG_062_MZB_LO_1040-04.10.2024","04.10.2024",2024,10,4,1.141807794,1
"ENG_062_MZB_LO_1041","ENG_062_MZB_LO_1041-10.10.2002","10.10.2002",2002,10,10,1.172850269,1
"ENG_062_MZB_LO_1041","ENG_062_MZB_LO_1041-17.10.2005","17.10.2005",2005,10,17,1.140640145,1
"ENG_062_MZB_LO_1041","ENG_062_MZB_LO_1041-12.10.2006","12.10.2006",2006,10,12,1.180592129,1
"ENG_062_MZB_LO_1041","ENG_062_MZB_LO_1041-29.10.2007","29.10.2007",2007,10,29,1.279046358,3
"ENG_062_MZB_LO_1041","ENG_062_MZB_LO_1041-18.09.2008","18.09.2008",2008,9,18,1.118731633,1
"ENG_062_MZB_LO_1041","ENG_062_MZB_LO_1041-20.11.2009","20.11.2009",2009,11,20,1.122076667,1
"ENG_062_MZB_LO_1041","ENG_062_MZB_LO_1041-05.11.2013","05.11.2013",2013,11,5,1.142271405,2
"ENG_062_MZB_LO_1041","ENG_062_MZB_LO_1041-20.10.2014","20.10.2014",2014,10,20,1.18170776,1
"ENG_062_MZB_LO_1041","ENG_062_MZB_LO_1041-07.11.2017","07.11.2017",2017,11,7,1.189144344,1
"ENG_062_MZB_LO_1041","ENG_062_MZB_LO_1041-23.09.2020","23.09.2020",2020,9,23,1.123374515,1
"ENG_062_MZB_LO_1041","ENG_062_MZB_LO_1041-23.10.2023","23.10.2023",2023,10,23,1.131236163,1
"ENG_062_MZB_LO_1042","ENG_062_MZB_LO_1042-25.11.2003","25.11.2003",2003,11,25,0.881276331,5
"ENG_062_MZB_LO_1042","ENG_062_MZB_LO_1042-03.10.2006","03.10.2006",2006,10,3,1.103241508,1
"ENG_062_MZB_LO_1042","ENG_062_MZB_LO_1042-21.10.2007","21.10.2007",2007,10,21,1.184188824,2
"ENG_062_MZB_LO_1042","ENG_062_MZB_LO_1042-28.10.2008","28.10.2008",2008,10,28,1.116641437,2
"ENG_062_MZB_LO_1042","ENG_062_MZB_LO_1042-28.10.2009","28.10.2009",2009,10,28,1.168093502,1
"ENG_062_MZB_LO_1042","ENG_062_MZB_LO_1042-02.11.2010","02.11.2010",2010,11,2,1.16786744,1
"ENG_062_MZB_LO_1042","ENG_062_MZB_LO_1042-23.09.2011","23.09.2011",2011,9,23,1.180746754,3
"ENG_062_MZB_LO_1042","ENG_062_MZB_LO_1042-12.09.2012","12.09.2012",2012,9,12,1.060231966,3
"ENG_062_MZB_LO_1044","ENG_062_MZB_LO_1044-08.05.2002","08.05.2002",2002,5,8,0.822704247,3
"ENG_062_MZB_LO_1044","ENG_062_MZB_LO_1044-01.04.2003","01.04.2003",2003,4,1,0.850743586,3
"ENG_062_MZB_LO_1044","ENG_062_MZB_LO_1044-23.04.2004","23.04.2004",2004,4,23,0.826620726,5
"ENG_062_MZB_LO_1044","ENG_062_MZB_LO_1044-25.05.2007","25.05.2007",2007,5,25,0.808444305,4
"ENG_062_MZB_LO_1044","ENG_062_MZB_LO_1044-07.05.2008","07.05.2008",2008,5,7,0.87055384,3
"ENG_062_MZB_LO_1044","ENG_062_MZB_LO_1044-07.05.2009","07.05.2009",2009,5,7,0.948281029,3
"ENG_062_MZB_LO_1044","ENG_062_MZB_LO_1044-24.05.2010","24.05.2010",2010,5,24,0.885379921,3
"ENG_062_MZB_LO_1044","ENG_062_MZB_LO_1044-16.05.2013","16.05.2013",2013,5,16,0.711049759,5
"ENG_062_MZB_LO_1044","ENG_062_MZB_LO_1044-24.03.2014","24.03.2014",2014,3,24,0.976836865,2
"ENG_062_MZB_LO_1044","ENG_062_MZB_LO_1044-16.04.2021","16.04.2021",2021,4,16,0.885056597,3
"ENG_062_MZB_LO_1047","ENG_062_MZB_LO_1047-28.03.2002","28.03.2002",2002,3,28,0.789188059,3
"ENG_062_MZB_LO_1047","ENG_062_MZB_LO_1047-14.03.2003","14.03.2003",2003,3,14,0.85360825,3
"ENG_062_MZB_LO_1047","ENG_062_MZB_LO_1047-11.05.2004","11.05.2004",2004,5,11,0.799811504,3
"ENG_062_MZB_LO_1047","ENG_062_MZB_LO_1047-22.03.2005","22.03.2005",2005,3,22,0.757867207,3
"ENG_062_MZB_LO_1047","ENG_062_MZB_LO_1047-29.03.2006","29.03.2006",2006,3,29,0.845594045,3
"ENG_062_MZB_LO_1047","ENG_062_MZB_LO_1047-25.04.2007","25.04.2007",2007,4,25,0.808079795,3
"ENG_062_MZB_LO_1047","ENG_062_MZB_LO_1047-09.04.2008","09.04.2008",2008,4,9,0.864251729,3
"ENG_062_MZB_LO_1047","ENG_062_MZB_LO_1047-24.03.2009","24.03.2009",2009,3,24,0.86475485,2
"ENG_062_MZB_LO_1047","ENG_062_MZB_LO_1047-10.05.2024","10.05.2024",2024,5,10,0.977742161,1
"ENG_062_MZB_LO_1049","ENG_062_MZB_LO_1049-16.09.2002","16.09.2002",2002,9,16,1.138536333,1
"ENG_062_MZB_LO_1049","ENG_062_MZB_LO_1049-03.10.2003","03.10.2003",2003,10,3,1.148563485,1
"ENG_062_MZB_LO_1049","ENG_062_MZB_LO_1049-13.10.2004","13.10.2004",2004,10,13,1.092114141,1
"ENG_062_MZB_LO_1049","ENG_062_MZB_LO_1049-08.11.2005","08.11.2005",2005,11,8,1.042008071,1
"ENG_062_MZB_LO_1049","ENG_062_MZB_LO_1049-19.09.2006","19.09.2006",2006,9,19,1.056963097,1
"ENG_062_MZB_LO_1049","ENG_062_MZB_LO_1049-06.11.2007","06.11.2007",2007,11,6,1.208814476,1
"ENG_062_MZB_LO_1049","ENG_062_MZB_LO_1049-08.10.2008","08.10.2008",2008,10,8,1.231962855,1
"ENG_062_MZB_LO_1049","ENG_062_MZB_LO_1049-21.10.2009","21.10.2009",2009,10,21,1.120395996,1
"ENG_062_MZB_LO_1049","ENG_062_MZB_LO_1049-28.09.2010","28.09.2010",2010,9,28,1.073440544,2
"ENG_062_MZB_LO_1049","ENG_062_MZB_LO_1049-08.11.2011","08.11.2011",2011,11,8,1.061361658,1
"ENG_062_MZB_LO_1049","ENG_062_MZB_LO_1049-05.10.2012","05.10.2012",2012,10,5,1.195363457,3
"ENG_062_MZB_LO_1049","ENG_062_MZB_LO_1049-24.09.2013","24.09.2013",2013,9,24,1.210934965,2
"ENG_062_MZB_LO_1049","ENG_062_MZB_LO_1049-19.09.2014","19.09.2014",2014,9,19,1.231594036,1
"ENG_062_MZB_LO_105","ENG_062_MZB_LO_105-24.04.2013","24.04.2013",2013,4,24,0.983996329,2
"ENG_062_MZB_LO_105","ENG_062_MZB_LO_105-15.04.2014","15.04.2014",2014,4,15,1.064011971,1
"ENG_062_MZB_LO_105","ENG_062_MZB_LO_105-26.04.2018","26.04.2018",2018,4,26,1.024764077,1
"ENG_062_MZB_LO_105","ENG_062_MZB_LO_105-11.04.2019","11.04.2019",2019,4,11,0.88049624,2
"ENG_062_MZB_LO_105","ENG_062_MZB_LO_105-08.04.2021","08.04.2021",2021,4,8,1.049036185,1
"ENG_062_MZB_LO_105","ENG_062_MZB_LO_105-11.04.2022","11.04.2022",2022,4,11,0.877912792,2
"ENG_062_MZB_LO_105","ENG_062_MZB_LO_105-16.05.2024","16.05.2024",2024,5,16,0.952357457,2
"ENG_062_MZB_LO_1050","ENG_062_MZB_LO_1050-08.10.2003","08.10.2003",2003,10,8,1.160643884,2
"ENG_062_MZB_LO_1050","ENG_062_MZB_LO_1050-28.09.2004","28.09.2004",2004,9,28,1.045878504,1
"ENG_062_MZB_LO_1050","ENG_062_MZB_LO_1050-19.09.2005","19.09.2005",2005,9,19,1.132588326,1
"ENG_062_MZB_LO_1050","ENG_062_MZB_LO_1050-30.10.2006","30.10.2006",2006,10,30,1.003892837,1
"ENG_062_MZB_LO_1050","ENG_062_MZB_LO_1050-22.10.2009","22.10.2009",2009,10,22,1.051059535,2
"ENG_062_MZB_LO_1050","ENG_062_MZB_LO_1050-12.10.2010","12.10.2010",2010,10,12,1.03031931,3
"ENG_062_MZB_LO_1050","ENG_062_MZB_LO_1050-09.11.2011","09.11.2011",2011,11,9,0.99938484,2
"ENG_062_MZB_LO_1050","ENG_062_MZB_LO_1050-19.09.2012","19.09.2012",2012,9,19,0.96889068,3
"ENG_062_MZB_LO_1050","ENG_062_MZB_LO_1050-12.09.2013","12.09.2013",2013,9,12,1.084429138,3
"ENG_062_MZB_LO_1050","ENG_062_MZB_LO_1050-15.09.2014","15.09.2014",2014,9,15,1.018499871,2
"ENG_062_MZB_LO_1050","ENG_062_MZB_LO_1050-23.10.2015","23.10.2015",2015,10,23,1.038804006,2
"ENG_062_MZB_LO_1050","ENG_062_MZB_LO_1050-13.10.2016","13.10.2016",2016,10,13,1.065236099,3
"ENG_062_MZB_LO_1050","ENG_062_MZB_LO_1050-09.10.2017","09.10.2017",2017,10,9,1.021959853,3
"ENG_062_MZB_LO_1050","ENG_062_MZB_LO_1050-05.10.2018","05.10.2018",2018,10,5,1.019729764,1
"ENG_062_MZB_LO_1050","ENG_062_MZB_LO_1050-05.09.2019","05.09.2019",2019,9,5,1.069230276,1
"ENG_062_MZB_LO_1052","ENG_062_MZB_LO_1052-04.09.2002","04.09.2002",2002,9,4,0.972520629,1
"ENG_062_MZB_LO_1052","ENG_062_MZB_LO_1052-15.09.2003","15.09.2003",2003,9,15,1.031500258,1
"ENG_062_MZB_LO_1052","ENG_062_MZB_LO_1052-21.09.2004","21.09.2004",2004,9,21,1.034129643,1
"ENG_062_MZB_LO_1052","ENG_062_MZB_LO_1052-09.11.2005","09.11.2005",2005,11,9,1.066978473,1
"ENG_062_MZB_LO_1052","ENG_062_MZB_LO_1052-01.11.2006","01.11.2006",2006,11,1,1.054425843,1
"ENG_062_MZB_LO_1052","ENG_062_MZB_LO_1052-12.11.2007","12.11.2007",2007,11,12,1.072105403,1
"ENG_062_MZB_LO_1052","ENG_062_MZB_LO_1052-08.10.2008","08.10.2008",2008,10,8,1.049144936,1
"ENG_062_MZB_LO_1052","ENG_062_MZB_LO_1052-02.11.2009","02.11.2009",2009,11,2,1.056463391,1
"ENG_062_MZB_LO_1052","ENG_062_MZB_LO_1052-27.09.2010","27.09.2010",2010,9,27,1.111945251,1
"ENG_062_MZB_LO_1052","ENG_062_MZB_LO_1052-08.11.2011","08.11.2011",2011,11,8,1.131814946,1
"ENG_062_MZB_LO_1052","ENG_062_MZB_LO_1052-01.11.2012","01.11.2012",2012,11,1,1.117070569,1
"ENG_062_MZB_LO_1052","ENG_062_MZB_LO_1052-26.09.2013","26.09.2013",2013,9,26,1.100583852,1
"ENG_062_MZB_LO_1052","ENG_062_MZB_LO_1052-02.10.2015","02.10.2015",2015,10,2,1.139292883,1
"ENG_062_MZB_LO_1052","ENG_062_MZB_LO_1052-14.09.2016","14.09.2016",2016,9,14,1.160058671,1
"ENG_062_MZB_LO_1052","ENG_062_MZB_LO_1052-13.10.2017","13.10.2017",2017,10,13,1.125216082,1
"ENG_062_MZB_LO_1052","ENG_062_MZB_LO_1052-27.09.2018","27.09.2018",2018,9,27,1.110166563,1
"ENG_062_MZB_LO_1052","ENG_062_MZB_LO_1052-18.09.2019","18.09.2019",2019,9,18,1.15223644,1
"ENG_062_MZB_LO_1052","ENG_062_MZB_LO_1052-16.10.2020","16.10.2020",2020,10,16,1.152507413,1
"ENG_062_MZB_LO_1052","ENG_062_MZB_LO_1052-01.10.2021","01.10.2021",2021,10,1,1.105895384,1
"ENG_062_MZB_LO_1052","ENG_062_MZB_LO_1052-06.09.2022","06.09.2022",2022,9,6,1.150697868,1
"ENG_062_MZB_LO_1052","ENG_062_MZB_LO_1052-27.10.2023","27.10.2023",2023,10,27,1.155386425,1
"ENG_062_MZB_LO_1054","ENG_062_MZB_LO_1054-10.10.2002","10.10.2002",2002,10,10,1.009999746,1
"ENG_062_MZB_LO_1054","ENG_062_MZB_LO_1054-18.10.2005","18.10.2005",2005,10,18,1.023741808,1
"ENG_062_MZB_LO_1054","ENG_062_MZB_LO_1054-15.11.2013","15.11.2013",2013,11,15,1.009463655,1
"ENG_062_MZB_LO_1054","ENG_062_MZB_LO_1054-07.09.2015","07.09.2015",2015,9,7,1.054238762,1
"ENG_062_MZB_LO_1054","ENG_062_MZB_LO_1054-06.10.2016","06.10.2016",2016,10,6,1.053429982,1
"ENG_062_MZB_LO_1054","ENG_062_MZB_LO_1054-06.10.2017","06.10.2017",2017,10,6,1.060173334,1
"ENG_062_MZB_LO_1054","ENG_062_MZB_LO_1054-08.10.2018","08.10.2018",2018,10,8,0.965358429,2
"ENG_062_MZB_LO_1054","ENG_062_MZB_LO_1054-17.10.2019","17.10.2019",2019,10,17,1.158149626,1
"ENG_062_MZB_LO_1054","ENG_062_MZB_LO_1054-13.10.2020","13.10.2020",2020,10,13,1.072467774,1
"ENG_062_MZB_LO_1054","ENG_062_MZB_LO_1054-24.09.2021","24.09.2021",2021,9,24,1.035804539,1
"ENG_062_MZB_LO_1054","ENG_062_MZB_LO_1054-07.10.2022","07.10.2022",2022,10,7,1.037799371,1
"ENG_062_MZB_LO_1055","ENG_062_MZB_LO_1055-07.11.2002","07.11.2002",2002,11,7,0.897150092,2
"ENG_062_MZB_LO_1055","ENG_062_MZB_LO_1055-23.09.2005","23.09.2005",2005,9,23,0.826925599,3
"ENG_062_MZB_LO_1055","ENG_062_MZB_LO_1055-29.09.2008","29.09.2008",2008,9,29,0.949919539,2
"ENG_062_MZB_LO_1055","ENG_062_MZB_LO_1055-14.10.2009","14.10.2009",2009,10,14,0.988622337,2
"ENG_062_MZB_LO_1055","ENG_062_MZB_LO_1055-27.10.2010","27.10.2010",2010,10,27,0.958613105,2
"ENG_062_MZB_LO_1055","ENG_062_MZB_LO_1055-26.10.2011","26.10.2011",2011,10,26,0.942060486,2
"ENG_062_MZB_LO_1055","ENG_062_MZB_LO_1055-14.11.2012","14.11.2012",2012,11,14,0.973152364,3
"ENG_062_MZB_LO_1055","ENG_062_MZB_LO_1055-21.10.2013","21.10.2013",2013,10,21,0.967386349,2
"ENG_062_MZB_LO_1055","ENG_062_MZB_LO_1055-27.10.2014","27.10.2014",2014,10,27,1.01684964,2
"ENG_062_MZB_LO_1055","ENG_062_MZB_LO_1055-22.10.2015","22.10.2015",2015,10,22,0.94325863,3
"ENG_062_MZB_LO_1055","ENG_062_MZB_LO_1055-08.11.2016","08.11.2016",2016,11,8,0.970607787,2
"ENG_062_MZB_LO_1055","ENG_062_MZB_LO_1055-02.10.2017","02.10.2017",2017,10,2,1.031860835,1
"ENG_062_MZB_LO_1055","ENG_062_MZB_LO_1055-19.09.2018","19.09.2018",2018,9,19,1.01593921,1
"ENG_062_MZB_LO_1055","ENG_062_MZB_LO_1055-01.11.2019","01.11.2019",2019,11,1,0.937969315,2
"ENG_062_MZB_LO_1056","ENG_062_MZB_LO_1056-12.09.2003","12.09.2003",2003,9,12,0.988933824,2
"ENG_062_MZB_LO_1056","ENG_062_MZB_LO_1056-17.09.2004","17.09.2004",2004,9,17,0.990096732,1
"ENG_062_MZB_LO_1056","ENG_062_MZB_LO_1056-17.10.2006","17.10.2006",2006,10,17,1.019238756,2
"ENG_062_MZB_LO_1056","ENG_062_MZB_LO_1056-14.10.2009","14.10.2009",2009,10,14,1.092475232,1
"ENG_062_MZB_LO_1056","ENG_062_MZB_LO_1056-27.10.2010","27.10.2010",2010,10,27,1.100412808,1
"ENG_062_MZB_LO_1056","ENG_062_MZB_LO_1056-26.10.2011","26.10.2011",2011,10,26,1.047724576,3
"ENG_062_MZB_LO_1056","ENG_062_MZB_LO_1056-14.11.2012","14.11.2012",2012,11,14,1.074766897,3
"ENG_062_MZB_LO_1056","ENG_062_MZB_LO_1056-03.10.2013","03.10.2013",2013,10,3,1.055191254,2
"ENG_062_MZB_LO_1056","ENG_062_MZB_LO_1056-22.10.2015","22.10.2015",2015,10,22,1.126318885,2
"ENG_062_MZB_LO_1056","ENG_062_MZB_LO_1056-14.09.2016","14.09.2016",2016,9,14,1.123651805,3
"ENG_062_MZB_LO_1056","ENG_062_MZB_LO_1056-02.10.2017","02.10.2017",2017,10,2,1.133303069,3
"ENG_062_MZB_LO_1056","ENG_062_MZB_LO_1056-19.09.2018","19.09.2018",2018,9,19,1.084746062,3
"ENG_062_MZB_LO_1056","ENG_062_MZB_LO_1056-06.09.2019","06.09.2019",2019,9,6,1.10448942,3
"ENG_062_MZB_LO_1056","ENG_062_MZB_LO_1056-12.11.2024","12.11.2024",2024,11,12,1.106096065,4
"ENG_062_MZB_LO_1057","ENG_062_MZB_LO_1057-16.09.2002","16.09.2002",2002,9,16,0.558698185,5
"ENG_062_MZB_LO_1057","ENG_062_MZB_LO_1057-08.11.2005","08.11.2005",2005,11,8,0.582930396,5
"ENG_062_MZB_LO_1057","ENG_062_MZB_LO_1057-21.11.2008","21.11.2008",2008,11,21,0.582731748,5
"ENG_062_MZB_LO_1057","ENG_062_MZB_LO_1057-17.09.2009","17.09.2009",2009,9,17,0.594265964,4
"ENG_062_MZB_LO_1057","ENG_062_MZB_LO_1057-07.10.2010","07.10.2010",2010,10,7,0.547449528,5
"ENG_062_MZB_LO_1057","ENG_062_MZB_LO_1057-22.11.2011","22.11.2011",2011,11,22,0.559104808,5
"ENG_062_MZB_LO_1057","ENG_062_MZB_LO_1057-05.10.2012","05.10.2012",2012,10,5,0.502819311,5
"ENG_062_MZB_LO_1057","ENG_062_MZB_LO_1057-24.09.2013","24.09.2013",2013,9,24,0.51441722,5
"ENG_062_MZB_LO_1057","ENG_062_MZB_LO_1057-19.09.2014","19.09.2014",2014,9,19,0.610422945,4
"ENG_062_MZB_LO_1057","ENG_062_MZB_LO_1057-17.11.2015","17.11.2015",2015,11,17,0.63875401,4
"ENG_062_MZB_LO_1057","ENG_062_MZB_LO_1057-14.09.2016","14.09.2016",2016,9,14,0.611988509,4
"ENG_062_MZB_LO_1057","ENG_062_MZB_LO_1057-02.10.2017","02.10.2017",2017,10,2,0.605991981,4
"ENG_062_MZB_LO_1057","ENG_062_MZB_LO_1057-21.09.2018","21.09.2018",2018,9,21,0.5806379,5
"ENG_062_MZB_LO_1057","ENG_062_MZB_LO_1057-15.10.2019","15.10.2019",2019,10,15,0.596582743,5
"ENG_062_MZB_LO_1058","ENG_062_MZB_LO_1058-23.09.2004","23.09.2004",2004,9,23,0.979833381,1
"ENG_062_MZB_LO_1058","ENG_062_MZB_LO_1058-14.09.2005","14.09.2005",2005,9,14,0.929999906,2
"ENG_062_MZB_LO_1058","ENG_062_MZB_LO_1058-26.10.2006","26.10.2006",2006,10,26,0.945318058,2
"ENG_062_MZB_LO_1058","ENG_062_MZB_LO_1058-05.10.2007","05.10.2007",2007,10,5,1.060416003,1
"ENG_062_MZB_LO_1058","ENG_062_MZB_LO_1058-10.10.2008","10.10.2008",2008,10,10,1.057799271,1
"ENG_062_MZB_LO_1058","ENG_062_MZB_LO_1058-11.11.2009","11.11.2009",2009,11,11,1.012945848,1
"ENG_062_MZB_LO_1058","ENG_062_MZB_LO_1058-03.09.2010","03.09.2010",2010,9,3,1.043535617,1
"ENG_062_MZB_LO_1058","ENG_062_MZB_LO_1058-08.11.2011","08.11.2011",2011,11,8,1.012909884,1
"ENG_062_MZB_LO_1058","ENG_062_MZB_LO_1058-06.11.2012","06.11.2012",2012,11,6,0.998506462,1
"ENG_062_MZB_LO_1058","ENG_062_MZB_LO_1058-16.09.2014","16.09.2014",2014,9,16,1.066433829,1
"ENG_062_MZB_LO_1058","ENG_062_MZB_LO_1058-01.10.2015","01.10.2015",2015,10,1,1.042543694,1
"ENG_062_MZB_LO_1058","ENG_062_MZB_LO_1058-21.10.2016","21.10.2016",2016,10,21,1.040257368,1
"ENG_062_MZB_LO_1058","ENG_062_MZB_LO_1058-11.10.2017","11.10.2017",2017,10,11,0.935147058,2
"ENG_062_MZB_LO_1058","ENG_062_MZB_LO_1058-08.10.2018","08.10.2018",2018,10,8,1.189134855,1
"ENG_062_MZB_LO_1058","ENG_062_MZB_LO_1058-03.09.2019","03.09.2019",2019,9,3,0.968617645,1
"ENG_062_MZB_LO_1058","ENG_062_MZB_LO_1058-22.10.2020","22.10.2020",2020,10,22,1.02922578,1
"ENG_062_MZB_LO_1058","ENG_062_MZB_LO_1058-13.09.2021","13.09.2021",2021,9,13,0.9804045,2
"ENG_062_MZB_LO_1058","ENG_062_MZB_LO_1058-06.09.2022","06.09.2022",2022,9,6,1.035986827,2
"ENG_062_MZB_LO_1058","ENG_062_MZB_LO_1058-15.09.2023","15.09.2023",2023,9,15,1.030340834,1
"ENG_062_MZB_LO_1058","ENG_062_MZB_LO_1058-16.10.2024","16.10.2024",2024,10,16,1.032378568,1
"ENG_062_MZB_LO_1059","ENG_062_MZB_LO_1059-09.10.2002","09.10.2002",2002,10,9,1.148297359,1
"ENG_062_MZB_LO_1059","ENG_062_MZB_LO_1059-06.10.2003","06.10.2003",2003,10,6,1.166451675,1
"ENG_062_MZB_LO_1059","ENG_062_MZB_LO_1059-14.09.2005","14.09.2005",2005,9,14,1.099957534,1
"ENG_062_MZB_LO_1059","ENG_062_MZB_LO_1059-03.11.2006","03.11.2006",2006,11,3,1.228120305,1
"ENG_062_MZB_LO_1059","ENG_062_MZB_LO_1059-05.11.2007","05.11.2007",2007,11,5,1.127476013,1
"ENG_062_MZB_LO_1059","ENG_062_MZB_LO_1059-23.10.2008","23.10.2008",2008,10,23,1.271399018,1
"ENG_062_MZB_LO_1059","ENG_062_MZB_LO_1059-15.10.2009","15.10.2009",2009,10,15,1.18537799,1
"ENG_062_MZB_LO_1059","ENG_062_MZB_LO_1059-02.11.2010","02.11.2010",2010,11,2,1.247093332,1
"ENG_062_MZB_LO_1059","ENG_062_MZB_LO_1059-15.11.2011","15.11.2011",2011,11,15,1.158675956,1
"ENG_062_MZB_LO_1059","ENG_062_MZB_LO_1059-09.10.2012","09.10.2012",2012,10,9,1.24133641,1
"ENG_062_MZB_LO_1059","ENG_062_MZB_LO_1059-23.09.2013","23.09.2013",2013,9,23,1.207163431,1
"ENG_062_MZB_LO_1059","ENG_062_MZB_LO_1059-16.09.2014","16.09.2014",2014,9,16,1.254853151,2
"ENG_062_MZB_LO_1059","ENG_062_MZB_LO_1059-30.09.2015","30.09.2015",2015,9,30,1.190324964,1
"ENG_062_MZB_LO_1059","ENG_062_MZB_LO_1059-04.10.2016","04.10.2016",2016,10,4,1.141966677,1
"ENG_062_MZB_LO_1059","ENG_062_MZB_LO_1059-09.10.2017","09.10.2017",2017,10,9,1.235423199,1
"ENG_062_MZB_LO_1059","ENG_062_MZB_LO_1059-04.10.2018","04.10.2018",2018,10,4,1.237418983,1
"ENG_062_MZB_LO_1059","ENG_062_MZB_LO_1059-10.09.2019","10.09.2019",2019,9,10,1.267749931,1
"ENG_062_MZB_LO_1059","ENG_062_MZB_LO_1059-15.10.2020","15.10.2020",2020,10,15,1.233625045,1
"ENG_062_MZB_LO_1059","ENG_062_MZB_LO_1059-08.09.2021","08.09.2021",2021,9,8,1.221493366,1
"ENG_062_MZB_LO_1059","ENG_062_MZB_LO_1059-02.09.2022","02.09.2022",2022,9,2,1.302999948,1
"ENG_062_MZB_LO_1059","ENG_062_MZB_LO_1059-27.10.2023","27.10.2023",2023,10,27,1.356704019,1
"ENG_062_MZB_LO_1060","ENG_062_MZB_LO_1060-16.09.2011","16.09.2011",2011,9,16,1.036431499,1
"ENG_062_MZB_LO_1060","ENG_062_MZB_LO_1060-15.11.2013","15.11.2013",2013,11,15,1.080129801,1
"ENG_062_MZB_LO_1060","ENG_062_MZB_LO_1060-30.09.2014","30.09.2014",2014,9,30,1.201931156,1
"ENG_062_MZB_LO_1060","ENG_062_MZB_LO_1060-22.09.2017","22.09.2017",2017,9,22,1.115874603,1
"ENG_062_MZB_LO_1060","ENG_062_MZB_LO_1060-10.11.2021","10.11.2021",2021,11,10,1.102414188,1
"ENG_062_MZB_LO_1060","ENG_062_MZB_LO_1060-16.11.2022","16.11.2022",2022,11,16,1.239970281,3
"ENG_062_MZB_LO_1060","ENG_062_MZB_LO_1060-11.10.2023","11.10.2023",2023,10,11,1.206137808,1
"ENG_062_MZB_LO_1061","ENG_062_MZB_LO_1061-17.09.2002","17.09.2002",2002,9,17,1.118088454,1
"ENG_062_MZB_LO_1061","ENG_062_MZB_LO_1061-20.11.2003","20.11.2003",2003,11,20,1.160984061,1
"ENG_062_MZB_LO_1061","ENG_062_MZB_LO_1061-09.09.2004","09.09.2004",2004,9,9,1.139269245,1
"ENG_062_MZB_LO_1061","ENG_062_MZB_LO_1061-04.10.2005","04.10.2005",2005,10,4,1.150310866,1
"ENG_062_MZB_LO_1061","ENG_062_MZB_LO_1061-30.10.2007","30.10.2007",2007,10,30,1.14969124,1
"ENG_062_MZB_LO_1061","ENG_062_MZB_LO_1061-22.10.2008","22.10.2008",2008,10,22,1.152362906,3
"ENG_062_MZB_LO_1061","ENG_062_MZB_LO_1061-17.11.2009","17.11.2009",2009,11,17,1.113809333,1
"ENG_062_MZB_LO_1061","ENG_062_MZB_LO_1061-11.10.2013","11.10.2013",2013,10,11,1.244205751,2
"ENG_062_MZB_LO_1061","ENG_062_MZB_LO_1061-25.09.2014","25.09.2014",2014,9,25,1.236813102,2
"ENG_062_MZB_LO_1061","ENG_062_MZB_LO_1061-22.09.2017","22.09.2017",2017,9,22,1.196160606,1
"ENG_062_MZB_LO_1061","ENG_062_MZB_LO_1061-04.11.2021","04.11.2021",2021,11,4,1.072285619,1
"ENG_062_MZB_LO_1062","ENG_062_MZB_LO_1062-03.09.2003","03.09.2003",2003,9,3,1.134495099,1
"ENG_062_MZB_LO_1062","ENG_062_MZB_LO_1062-06.09.2004","06.09.2004",2004,9,6,1.185260625,1
"ENG_062_MZB_LO_1062","ENG_062_MZB_LO_1062-07.11.2005","07.11.2005",2005,11,7,1.130217813,1
"ENG_062_MZB_LO_1062","ENG_062_MZB_LO_1062-12.10.2006","12.10.2006",2006,10,12,1.171035387,1
"ENG_062_MZB_LO_1062","ENG_062_MZB_LO_1062-29.10.2007","29.10.2007",2007,10,29,1.129091366,1
"ENG_062_MZB_LO_1062","ENG_062_MZB_LO_1062-18.09.2008","18.09.2008",2008,9,18,1.073328307,1
"ENG_062_MZB_LO_1062","ENG_062_MZB_LO_1062-20.11.2009","20.11.2009",2009,11,20,1.137200704,1
"ENG_062_MZB_LO_1062","ENG_062_MZB_LO_1062-19.11.2010","19.11.2010",2010,11,19,1.159478874,1
"ENG_062_MZB_LO_1062","ENG_062_MZB_LO_1062-16.09.2011","16.09.2011",2011,9,16,1.086587686,1
"ENG_062_MZB_LO_1062","ENG_062_MZB_LO_1062-30.11.2012","30.11.2012",2012,11,30,1.13466572,1
"ENG_062_MZB_LO_1062","ENG_062_MZB_LO_1062-21.11.2013","21.11.2013",2013,11,21,1.189141594,1
"ENG_062_MZB_LO_1062","ENG_062_MZB_LO_1062-20.10.2014","20.10.2014",2014,10,20,1.149691649,2
"ENG_062_MZB_LO_1062","ENG_062_MZB_LO_1062-24.11.2015","24.11.2015",2015,11,24,1.186056099,1
"ENG_062_MZB_LO_1062","ENG_062_MZB_LO_1062-10.10.2016","10.10.2016",2016,10,10,1.161036766,1
"ENG_062_MZB_LO_1062","ENG_062_MZB_LO_1062-13.10.2017","13.10.2017",2017,10,13,1.127478322,1
"ENG_062_MZB_LO_1062","ENG_062_MZB_LO_1062-25.10.2018","25.10.2018",2018,10,25,1.152112949,1
"ENG_062_MZB_LO_1062","ENG_062_MZB_LO_1062-07.10.2019","07.10.2019",2019,10,7,1.120513288,1
"ENG_062_MZB_LO_1062","ENG_062_MZB_LO_1062-23.09.2020","23.09.2020",2020,9,23,1.078589423,1
"ENG_062_MZB_LO_1062","ENG_062_MZB_LO_1062-08.10.2021","08.10.2021",2021,10,8,1.087067063,1
"ENG_062_MZB_LO_1062","ENG_062_MZB_LO_1062-29.09.2022","29.09.2022",2022,9,29,1.141622668,1
"ENG_062_MZB_LO_1062","ENG_062_MZB_LO_1062-20.10.2023","20.10.2023",2023,10,20,1.132828638,1
"ENG_062_MZB_LO_1064","ENG_062_MZB_LO_1064-12.11.2003","12.11.2003",2003,11,12,1.164831464,1
"ENG_062_MZB_LO_1064","ENG_062_MZB_LO_1064-10.11.2004","10.11.2004",2004,11,10,1.179263522,1
"ENG_062_MZB_LO_1064","ENG_062_MZB_LO_1064-24.10.2008","24.10.2008",2008,10,24,1.190285016,1
"ENG_062_MZB_LO_1064","ENG_062_MZB_LO_1064-05.11.2009","05.11.2009",2009,11,5,1.2526668,1
"ENG_062_MZB_LO_1064","ENG_062_MZB_LO_1064-18.10.2010","18.10.2010",2010,10,18,1.216820881,1
"ENG_062_MZB_LO_1064","ENG_062_MZB_LO_1064-18.10.2011","18.10.2011",2011,10,18,1.213524608,1
"ENG_062_MZB_LO_1064","ENG_062_MZB_LO_1064-30.11.2012","30.11.2012",2012,11,30,1.180987375,1
"ENG_062_MZB_LO_1064","ENG_062_MZB_LO_1064-26.09.2013","26.09.2013",2013,9,26,1.247638245,1
"ENG_062_MZB_LO_1064","ENG_062_MZB_LO_1064-18.09.2014","18.09.2014",2014,9,18,1.331038283,1
"ENG_062_MZB_LO_1065","ENG_062_MZB_LO_1065-13.09.2002","13.09.2002",2002,9,13,0.830136489,3
"ENG_062_MZB_LO_1065","ENG_062_MZB_LO_1065-13.11.2003","13.11.2003",2003,11,13,0.954449412,2
"ENG_062_MZB_LO_1065","ENG_062_MZB_LO_1065-11.10.2004","11.10.2004",2004,10,11,1.025703175,1
"ENG_062_MZB_LO_1065","ENG_062_MZB_LO_1065-26.09.2005","26.09.2005",2005,9,26,0.970413766,1
"ENG_062_MZB_LO_1065","ENG_062_MZB_LO_1065-18.10.2006","18.10.2006",2006,10,18,0.935175768,2
"ENG_062_MZB_LO_1065","ENG_062_MZB_LO_1065-11.09.2013","11.09.2013",2013,9,11,1.039742979,1
"ENG_062_MZB_LO_1065","ENG_062_MZB_LO_1065-02.10.2018","02.10.2018",2018,10,2,1.002874504,1
"ENG_062_MZB_LO_1065","ENG_062_MZB_LO_1065-12.09.2019","12.09.2019",2019,9,12,0.961305298,2
"ENG_062_MZB_LO_1065","ENG_062_MZB_LO_1065-27.10.2020","27.10.2020",2020,10,27,0.861973767,3
"ENG_062_MZB_LO_1065","ENG_062_MZB_LO_1065-14.09.2021","14.09.2021",2021,9,14,0.973959747,2
"ENG_062_MZB_LO_1065","ENG_062_MZB_LO_1065-08.11.2022","08.11.2022",2022,11,8,1.041256414,1
"ENG_062_MZB_LO_1065","ENG_062_MZB_LO_1065-20.09.2023","20.09.2023",2023,9,20,0.958990118,2
"ENG_062_MZB_LO_1069","ENG_062_MZB_LO_1069-28.09.2004","28.09.2004",2004,9,28,0.948324385,2
"ENG_062_MZB_LO_1069","ENG_062_MZB_LO_1069-30.10.2006","30.10.2006",2006,10,30,0.993788411,1
"ENG_062_MZB_LO_1069","ENG_062_MZB_LO_1069-19.10.2007","19.10.2007",2007,10,19,1.050395773,1
"ENG_062_MZB_LO_1069","ENG_062_MZB_LO_1069-24.10.2008","24.10.2008",2008,10,24,0.970303121,1
"ENG_062_MZB_LO_1069","ENG_062_MZB_LO_1069-12.11.2009","12.11.2009",2009,11,12,0.918146143,2
"ENG_062_MZB_LO_1069","ENG_062_MZB_LO_1069-12.10.2010","12.10.2010",2010,10,12,0.881790984,2
"ENG_062_MZB_LO_1069","ENG_062_MZB_LO_1069-15.11.2011","15.11.2011",2011,11,15,0.989938162,1
"ENG_062_MZB_LO_1069","ENG_062_MZB_LO_1069-19.09.2012","19.09.2012",2012,9,19,0.963312192,2
"ENG_062_MZB_LO_1069","ENG_062_MZB_LO_1069-29.10.2013","29.10.2013",2013,10,29,1.005388929,1
"ENG_062_MZB_LO_1069","ENG_062_MZB_LO_1069-17.09.2014","17.09.2014",2014,9,17,0.980683776,1
"ENG_062_MZB_LO_1069","ENG_062_MZB_LO_1069-23.10.2015","23.10.2015",2015,10,23,1.034777151,1
"ENG_062_MZB_LO_1069","ENG_062_MZB_LO_1069-28.09.2016","28.09.2016",2016,9,28,0.977309634,1
"ENG_062_MZB_LO_1069","ENG_062_MZB_LO_1069-09.10.2017","09.10.2017",2017,10,9,0.957357704,2
"ENG_062_MZB_LO_1069","ENG_062_MZB_LO_1069-05.10.2018","05.10.2018",2018,10,5,0.966058286,2
"ENG_062_MZB_LO_1069","ENG_062_MZB_LO_1069-04.09.2019","04.09.2019",2019,9,4,0.976812568,1
"ENG_062_MZB_LO_1069","ENG_062_MZB_LO_1069-15.10.2020","15.10.2020",2020,10,15,0.957608249,2
"ENG_062_MZB_LO_1069","ENG_062_MZB_LO_1069-20.10.2021","20.10.2021",2021,10,20,0.975433357,1
"ENG_062_MZB_LO_1073","ENG_062_MZB_LO_1073-28.11.2002","28.11.2002",2002,11,28,0.962319967,3
"ENG_062_MZB_LO_1073","ENG_062_MZB_LO_1073-25.11.2003","25.11.2003",2003,11,25,0.706807239,5
"ENG_062_MZB_LO_1073","ENG_062_MZB_LO_1073-08.11.2004","08.11.2004",2004,11,8,0.91214692,2
"ENG_062_MZB_LO_1073","ENG_062_MZB_LO_1073-12.10.2005","12.10.2005",2005,10,12,0.926930575,2
"ENG_062_MZB_LO_1073","ENG_062_MZB_LO_1073-03.10.2006","03.10.2006",2006,10,3,0.844048054,3
"ENG_062_MZB_LO_1073","ENG_062_MZB_LO_1073-31.10.2007","31.10.2007",2007,10,31,0.997674599,1
"ENG_062_MZB_LO_1073","ENG_062_MZB_LO_1073-28.10.2008","28.10.2008",2008,10,28,1.042040551,2
"ENG_062_MZB_LO_1073","ENG_062_MZB_LO_1073-28.10.2009","28.10.2009",2009,10,28,0.885936472,3
"ENG_062_MZB_LO_1073","ENG_062_MZB_LO_1073-02.11.2010","02.11.2010",2010,11,2,0.924901546,2
"ENG_062_MZB_LO_1073","ENG_062_MZB_LO_1073-23.09.2011","23.09.2011",2011,9,23,0.924445866,3
"ENG_062_MZB_LO_1073","ENG_062_MZB_LO_1073-11.09.2013","11.09.2013",2013,9,11,0.903884139,3
"ENG_062_MZB_LO_1073","ENG_062_MZB_LO_1073-16.09.2014","16.09.2014",2014,9,16,1.030049191,1
"ENG_062_MZB_LO_1073","ENG_062_MZB_LO_1073-07.10.2015","07.10.2015",2015,10,7,0.850356541,5
"ENG_062_MZB_LO_1073","ENG_062_MZB_LO_1073-07.10.2016","07.10.2016",2016,10,7,0.944365094,2
"ENG_062_MZB_LO_1073","ENG_062_MZB_LO_1073-09.10.2017","09.10.2017",2017,10,9,0.926898496,4
"ENG_062_MZB_LO_1073","ENG_062_MZB_LO_1073-03.09.2018","03.09.2018",2018,9,3,0.936090919,2
"ENG_062_MZB_LO_1073","ENG_062_MZB_LO_1073-10.10.2019","10.10.2019",2019,10,10,1.001792225,3
"ENG_062_MZB_LO_1073","ENG_062_MZB_LO_1073-20.10.2020","20.10.2020",2020,10,20,1.031959262,1
"ENG_062_MZB_LO_1073","ENG_062_MZB_LO_1073-07.10.2021","07.10.2021",2021,10,7,1.013305652,2
"ENG_062_MZB_LO_1073","ENG_062_MZB_LO_1073-21.09.2022","21.09.2022",2022,9,21,0.882364351,5
"ENG_062_MZB_LO_1073","ENG_062_MZB_LO_1073-23.10.2023","23.10.2023",2023,10,23,0.935675489,2
"ENG_062_MZB_LO_1075","ENG_062_MZB_LO_1075-05.09.2002","05.09.2002",2002,9,5,1.00673375,2
"ENG_062_MZB_LO_1075","ENG_062_MZB_LO_1075-30.09.2005","30.09.2005",2005,9,30,1.052409588,1
"ENG_062_MZB_LO_1075","ENG_062_MZB_LO_1075-25.11.2009","25.11.2009",2009,11,25,1.029699071,1
"ENG_062_MZB_LO_1075","ENG_062_MZB_LO_1075-28.09.2010","28.09.2010",2010,9,28,1.086437961,2
"ENG_062_MZB_LO_1075","ENG_062_MZB_LO_1075-08.11.2011","08.11.2011",2011,11,8,1.054758293,2
"ENG_062_MZB_LO_1075","ENG_062_MZB_LO_1075-05.10.2012","05.10.2012",2012,10,5,1.029208151,2
"ENG_062_MZB_LO_1075","ENG_062_MZB_LO_1075-26.09.2013","26.09.2013",2013,9,26,1.007795418,3
"ENG_062_MZB_LO_1075","ENG_062_MZB_LO_1075-25.09.2014","25.09.2014",2014,9,25,1.004317865,3
"ENG_062_MZB_LO_1075","ENG_062_MZB_LO_1075-07.10.2015","07.10.2015",2015,10,7,1.028623147,2
"ENG_062_MZB_LO_1076","ENG_062_MZB_LO_1076-13.10.2004","13.10.2004",2004,10,13,1.019003548,1
"ENG_062_MZB_LO_1076","ENG_062_MZB_LO_1076-08.11.2005","08.11.2005",2005,11,8,1.036207571,1
"ENG_062_MZB_LO_1076","ENG_062_MZB_LO_1076-19.09.2006","19.09.2006",2006,9,19,0.966344944,1
"ENG_062_MZB_LO_1076","ENG_062_MZB_LO_1076-06.11.2007","06.11.2007",2007,11,6,1.093738831,1
"ENG_062_MZB_LO_1076","ENG_062_MZB_LO_1076-08.10.2008","08.10.2008",2008,10,8,1.170654295,1
"ENG_062_MZB_LO_1076","ENG_062_MZB_LO_1076-23.10.2009","23.10.2009",2009,10,23,1.007115,1
"ENG_062_MZB_LO_1076","ENG_062_MZB_LO_1076-08.11.2013","08.11.2013",2013,11,8,1.051375039,5
"ENG_062_MZB_LO_1076","ENG_062_MZB_LO_1076-19.09.2014","19.09.2014",2014,9,19,1.135485301,1
"ENG_062_MZB_LO_1077","ENG_062_MZB_LO_1077-05.09.2002","05.09.2002",2002,9,5,1.081122573,1
"ENG_062_MZB_LO_1077","ENG_062_MZB_LO_1077-27.10.2003","27.10.2003",2003,10,27,1.052926772,1
"ENG_062_MZB_LO_1077","ENG_062_MZB_LO_1077-07.11.2006","07.11.2006",2006,11,7,1.080830495,1
"ENG_062_MZB_LO_1077","ENG_062_MZB_LO_1077-13.11.2007","13.11.2007",2007,11,13,1.05005048,1
"ENG_062_MZB_LO_1077","ENG_062_MZB_LO_1077-28.09.2010","28.09.2010",2010,9,28,1.011103134,1
"ENG_062_MZB_LO_1077","ENG_062_MZB_LO_1077-18.10.2013","18.10.2013",2013,10,18,1.046199881,3
"ENG_062_MZB_LO_1077","ENG_062_MZB_LO_1077-30.09.2014","30.09.2014",2014,9,30,1.087005033,3
"ENG_062_MZB_LO_1079","ENG_062_MZB_LO_1079-16.09.2002","16.09.2002",2002,9,16,1.021889342,1
"ENG_062_MZB_LO_1079","ENG_062_MZB_LO_1079-03.10.2003","03.10.2003",2003,10,3,1.041066556,1
"ENG_062_MZB_LO_1079","ENG_062_MZB_LO_1079-13.10.2004","13.10.2004",2004,10,13,0.97013467,1
"ENG_062_MZB_LO_1079","ENG_062_MZB_LO_1079-09.09.2005","09.09.2005",2005,9,9,1.099036165,1
"ENG_062_MZB_LO_1079","ENG_062_MZB_LO_1079-02.11.2006","02.11.2006",2006,11,2,1.114147384,1
"ENG_062_MZB_LO_1079","ENG_062_MZB_LO_1079-26.09.2007","26.09.2007",2007,9,26,1.149194204,1
"ENG_062_MZB_LO_1079","ENG_062_MZB_LO_1079-26.09.2008","26.09.2008",2008,9,26,1.140207846,1
"ENG_062_MZB_LO_1079","ENG_062_MZB_LO_1079-17.09.2009","17.09.2009",2009,9,17,1.161766277,1
"ENG_062_MZB_LO_1079","ENG_062_MZB_LO_1079-28.09.2010","28.09.2010",2010,9,28,1.185113499,2
"ENG_062_MZB_LO_1079","ENG_062_MZB_LO_1079-08.11.2011","08.11.2011",2011,11,8,1.136657897,2
"ENG_062_MZB_LO_1079","ENG_062_MZB_LO_1079-05.10.2012","05.10.2012",2012,10,5,1.259205911,1
"ENG_062_MZB_LO_1079","ENG_062_MZB_LO_1079-24.09.2014","24.09.2014",2014,9,24,1.157558227,3
"ENG_062_MZB_LO_108","ENG_062_MZB_LO_108-01.10.2002","01.10.2002",2002,10,1,0.976355425,3
"ENG_062_MZB_LO_108","ENG_062_MZB_LO_108-25.11.2003","25.11.2003",2003,11,25,1.074726858,1
"ENG_062_MZB_LO_108","ENG_062_MZB_LO_108-14.10.2004","14.10.2004",2004,10,14,0.962702364,4
"ENG_062_MZB_LO_108","ENG_062_MZB_LO_108-28.09.2006","28.09.2006",2006,9,28,1.140681297,1
"ENG_062_MZB_LO_108","ENG_062_MZB_LO_108-28.09.2009","28.09.2009",2009,9,28,1.228294444,1
"ENG_062_MZB_LO_108","ENG_062_MZB_LO_108-28.09.2010","28.09.2010",2010,9,28,1.186734719,1
"ENG_062_MZB_LO_108","ENG_062_MZB_LO_108-07.10.2011","07.10.2011",2011,10,7,1.129618327,1
"ENG_062_MZB_LO_108","ENG_062_MZB_LO_108-11.09.2012","11.09.2012",2012,9,11,1.116452114,1
"ENG_062_MZB_LO_108","ENG_062_MZB_LO_108-11.09.2013","11.09.2013",2013,9,11,1.16038589,2
"ENG_062_MZB_LO_108","ENG_062_MZB_LO_108-17.09.2014","17.09.2014",2014,9,17,1.203701772,1
"ENG_062_MZB_LO_108","ENG_062_MZB_LO_108-17.09.2015","17.09.2015",2015,9,17,1.238351046,3
"ENG_062_MZB_LO_108","ENG_062_MZB_LO_108-07.09.2016","07.09.2016",2016,9,7,1.165456453,1
"ENG_062_MZB_LO_108","ENG_062_MZB_LO_108-16.10.2017","16.10.2017",2017,10,16,0.979138229,3
"ENG_062_MZB_LO_108","ENG_062_MZB_LO_108-25.09.2018","25.09.2018",2018,9,25,1.176631323,3
"ENG_062_MZB_LO_108","ENG_062_MZB_LO_108-24.10.2019","24.10.2019",2019,10,24,1.144500988,3
"ENG_062_MZB_LO_1080","ENG_062_MZB_LO_1080-10.09.2003","10.09.2003",2003,9,10,0.84438039,3
"ENG_062_MZB_LO_1080","ENG_062_MZB_LO_1080-28.09.2004","28.09.2004",2004,9,28,0.837075016,3
"ENG_062_MZB_LO_1080","ENG_062_MZB_LO_1080-16.10.2006","16.10.2006",2006,10,16,0.79899904,3
"ENG_062_MZB_LO_1080","ENG_062_MZB_LO_1080-26.09.2007","26.09.2007",2007,9,26,0.870554806,2
"ENG_062_MZB_LO_1080","ENG_062_MZB_LO_1080-25.09.2008","25.09.2008",2008,9,25,0.914836809,2
"ENG_062_MZB_LO_1080","ENG_062_MZB_LO_1080-11.11.2009","11.11.2009",2009,11,11,0.981785162,1
"ENG_062_MZB_LO_1080","ENG_062_MZB_LO_1080-13.11.2010","13.11.2010",2010,11,13,0.989273058,1
"ENG_062_MZB_LO_1080","ENG_062_MZB_LO_1080-09.11.2011","09.11.2011",2011,11,9,0.951991247,2
"ENG_062_MZB_LO_1080","ENG_062_MZB_LO_1080-23.10.2013","23.10.2013",2013,10,23,0.970541978,2
"ENG_062_MZB_LO_1080","ENG_062_MZB_LO_1080-29.09.2014","29.09.2014",2014,9,29,0.937580631,2
"ENG_062_MZB_LO_1080","ENG_062_MZB_LO_1080-19.10.2015","19.10.2015",2015,10,19,1.005885047,1
"ENG_062_MZB_LO_1080","ENG_062_MZB_LO_1080-28.09.2016","28.09.2016",2016,9,28,0.900180792,2
"ENG_062_MZB_LO_1080","ENG_062_MZB_LO_1080-29.09.2017","29.09.2017",2017,9,29,0.922442845,2
"ENG_062_MZB_LO_1080","ENG_062_MZB_LO_1080-10.10.2018","10.10.2018",2018,10,10,0.837775774,3
"ENG_062_MZB_LO_1080","ENG_062_MZB_LO_1080-19.09.2019","19.09.2019",2019,9,19,0.794663167,3
"ENG_062_MZB_LO_1080","ENG_062_MZB_LO_1080-30.11.2020","30.11.2020",2020,11,30,0.808146693,3
"ENG_062_MZB_LO_1080","ENG_062_MZB_LO_1080-22.09.2021","22.09.2021",2021,9,22,0.71868129,4
"ENG_062_MZB_LO_1080","ENG_062_MZB_LO_1080-07.10.2022","07.10.2022",2022,10,7,0.85899473,3
"ENG_062_MZB_LO_1086","ENG_062_MZB_LO_1086-25.10.2002","25.10.2002",2002,10,25,1.044610776,1
"ENG_062_MZB_LO_1086","ENG_062_MZB_LO_1086-04.09.2003","04.09.2003",2003,9,4,1.056138851,1
"ENG_062_MZB_LO_1086","ENG_062_MZB_LO_1086-30.11.2006","30.11.2006",2006,11,30,0.985913701,1
"ENG_062_MZB_LO_1086","ENG_062_MZB_LO_1086-18.11.2009","18.11.2009",2009,11,18,1.060517361,1
"ENG_062_MZB_LO_1086","ENG_062_MZB_LO_1086-06.10.2010","06.10.2010",2010,10,6,1.153113828,1
"ENG_062_MZB_LO_1086","ENG_062_MZB_LO_1086-28.10.2011","28.10.2011",2011,10,28,1.118332383,1
"ENG_062_MZB_LO_1086","ENG_062_MZB_LO_1086-12.09.2012","12.09.2012",2012,9,12,1.084381201,1
"ENG_062_MZB_LO_1086","ENG_062_MZB_LO_1086-23.10.2013","23.10.2013",2013,10,23,1.160183875,1
"ENG_062_MZB_LO_1086","ENG_062_MZB_LO_1086-15.09.2014","15.09.2014",2014,9,15,1.128870052,1
"ENG_062_MZB_LO_1086","ENG_062_MZB_LO_1086-27.10.2015","27.10.2015",2015,10,27,1.145783285,1
"ENG_062_MZB_LO_1086","ENG_062_MZB_LO_1086-17.10.2016","17.10.2016",2016,10,17,1.127537771,1
"ENG_062_MZB_LO_1086","ENG_062_MZB_LO_1086-01.09.2017","01.09.2017",2017,9,1,1.199263711,1
"ENG_062_MZB_LO_1086","ENG_062_MZB_LO_1086-26.11.2018","26.11.2018",2018,11,26,1.124221514,1
"ENG_062_MZB_LO_1086","ENG_062_MZB_LO_1086-10.10.2019","10.10.2019",2019,10,10,1.161130715,1
"ENG_062_MZB_LO_1086","ENG_062_MZB_LO_1086-09.10.2020","09.10.2020",2020,10,9,1.087712891,1
"ENG_062_MZB_LO_1088","ENG_062_MZB_LO_1088-03.09.2002","03.09.2002",2002,9,3,0.973446305,5
"ENG_062_MZB_LO_1088","ENG_062_MZB_LO_1088-09.09.2003","09.09.2003",2003,9,9,1.069501075,2
"ENG_062_MZB_LO_1088","ENG_062_MZB_LO_1088-18.11.2005","18.11.2005",2005,11,18,0.975351882,4
"ENG_062_MZB_LO_1088","ENG_062_MZB_LO_1088-03.09.2007","03.09.2007",2007,9,3,0.871901813,5
"ENG_062_MZB_LO_1088","ENG_062_MZB_LO_1088-17.11.2008","17.11.2008",2008,11,17,0.880385,3
"ENG_062_MZB_LO_1088","ENG_062_MZB_LO_1088-21.10.2009","21.10.2009",2009,10,21,1.054589652,4
"ENG_062_MZB_LO_1088","ENG_062_MZB_LO_1088-13.09.2013","13.09.2013",2013,9,13,0.923498289,5
"ENG_062_MZB_LO_1088","ENG_062_MZB_LO_1088-20.10.2015","20.10.2015",2015,10,20,1.107442261,3
"ENG_062_MZB_LO_1088","ENG_062_MZB_LO_1088-03.09.2024","03.09.2024",2024,9,3,1.03767447,5
"ENG_062_MZB_LO_1090","ENG_062_MZB_LO_1090-30.04.2002","30.04.2002",2002,4,30,0.754920883,3
"ENG_062_MZB_LO_1090","ENG_062_MZB_LO_1090-28.05.2003","28.05.2003",2003,5,28,0.776800474,3
"ENG_062_MZB_LO_1090","ENG_062_MZB_LO_1090-25.05.2004","25.05.2004",2004,5,25,0.691399684,4
"ENG_062_MZB_LO_1090","ENG_062_MZB_LO_1090-04.04.2006","04.04.2006",2006,4,4,0.787625927,3
"ENG_062_MZB_LO_1090","ENG_062_MZB_LO_1090-16.05.2007","16.05.2007",2007,5,16,0.782400784,3
"ENG_062_MZB_LO_1090","ENG_062_MZB_LO_1090-15.04.2009","15.04.2009",2009,4,15,0.788850514,3
"ENG_062_MZB_LO_1090","ENG_062_MZB_LO_1090-16.05.2013","16.05.2013",2013,5,16,0.818796071,3
"ENG_062_MZB_LO_1090","ENG_062_MZB_LO_1090-12.05.2014","12.05.2014",2014,5,12,0.805853269,3
"ENG_062_MZB_LO_1091","ENG_062_MZB_LO_1091-21.05.2002","21.05.2002",2002,5,21,0.849007484,3
"ENG_062_MZB_LO_1091","ENG_062_MZB_LO_1091-16.04.2005","16.04.2005",2005,4,16,0.738438485,5
"ENG_062_MZB_LO_1091","ENG_062_MZB_LO_1091-14.05.2008","14.05.2008",2008,5,14,0.840953429,3
"ENG_062_MZB_LO_1091","ENG_062_MZB_LO_1091-16.05.2013","16.05.2013",2013,5,16,0.851476675,3
"ENG_062_MZB_LO_1091","ENG_062_MZB_LO_1091-08.05.2015","08.05.2015",2015,5,8,0.882992497,2
"ENG_062_MZB_LO_1091","ENG_062_MZB_LO_1091-04.04.2019","04.04.2019",2019,4,4,0.980304732,1
"ENG_062_MZB_LO_1091","ENG_062_MZB_LO_1091-02.05.2024","02.05.2024",2024,5,2,0.938839809,3
"ENG_062_MZB_LO_1092","ENG_062_MZB_LO_1092-28.10.2003","28.10.2003",2003,10,28,0.954354673,2
"ENG_062_MZB_LO_1092","ENG_062_MZB_LO_1092-07.09.2004","07.09.2004",2004,9,7,1.02590662,1
"ENG_062_MZB_LO_1092","ENG_062_MZB_LO_1092-29.10.2007","29.10.2007",2007,10,29,0.958230213,2
"ENG_062_MZB_LO_1092","ENG_062_MZB_LO_1092-17.09.2009","17.09.2009",2009,9,17,0.993935183,1
"ENG_062_MZB_LO_1092","ENG_062_MZB_LO_1092-05.10.2010","05.10.2010",2010,10,5,0.967224389,1
"ENG_062_MZB_LO_1092","ENG_062_MZB_LO_1092-03.10.2011","03.10.2011",2011,10,3,0.970126601,2
"ENG_062_MZB_LO_1092","ENG_062_MZB_LO_1092-20.09.2012","20.09.2012",2012,9,20,0.995133287,1
"ENG_062_MZB_LO_1092","ENG_062_MZB_LO_1092-17.09.2013","17.09.2013",2013,9,17,0.980355996,1
"ENG_062_MZB_LO_1092","ENG_062_MZB_LO_1092-22.09.2014","22.09.2014",2014,9,22,1.053542661,1
"ENG_062_MZB_LO_1092","ENG_062_MZB_LO_1092-14.09.2015","14.09.2015",2015,9,14,1.067813597,1
"ENG_062_MZB_LO_1092","ENG_062_MZB_LO_1092-18.10.2016","18.10.2016",2016,10,18,1.06586571,1
"ENG_062_MZB_LO_1092","ENG_062_MZB_LO_1092-04.10.2017","04.10.2017",2017,10,4,0.99663749,1
"ENG_062_MZB_LO_1092","ENG_062_MZB_LO_1092-14.11.2018","14.11.2018",2018,11,14,0.975446742,1
"ENG_062_MZB_LO_1092","ENG_062_MZB_LO_1092-17.10.2019","17.10.2019",2019,10,17,1.038516009,1
"ENG_062_MZB_LO_1092","ENG_062_MZB_LO_1092-20.09.2024","20.09.2024",2024,9,20,1.073298661,1
"ENG_062_MZB_LO_1093","ENG_062_MZB_LO_1093-28.10.2002","28.10.2002",2002,10,28,1.039844075,1
"ENG_062_MZB_LO_1093","ENG_062_MZB_LO_1093-22.10.2003","22.10.2003",2003,10,22,1.005571089,1
"ENG_062_MZB_LO_1093","ENG_062_MZB_LO_1093-09.11.2005","09.11.2005",2005,11,9,0.988390253,1
"ENG_062_MZB_LO_1093","ENG_062_MZB_LO_1093-16.11.2007","16.11.2007",2007,11,16,1.010573537,1
"ENG_062_MZB_LO_1093","ENG_062_MZB_LO_1093-02.11.2009","02.11.2009",2009,11,2,0.994493026,1
"ENG_062_MZB_LO_1093","ENG_062_MZB_LO_1093-02.11.2010","02.11.2010",2010,11,2,1.001819234,1
"ENG_062_MZB_LO_1093","ENG_062_MZB_LO_1093-09.11.2011","09.11.2011",2011,11,9,0.949050552,2
"ENG_062_MZB_LO_1093","ENG_062_MZB_LO_1093-30.11.2012","30.11.2012",2012,11,30,1.025852344,1
"ENG_062_MZB_LO_1093","ENG_062_MZB_LO_1093-27.09.2013","27.09.2013",2013,9,27,0.99223645,1
"ENG_062_MZB_LO_1093","ENG_062_MZB_LO_1093-17.09.2014","17.09.2014",2014,9,17,1.053089505,1
"ENG_062_MZB_LO_1094","ENG_062_MZB_LO_1094-28.11.2002","28.11.2002",2002,11,28,0.944629749,2
"ENG_062_MZB_LO_1094","ENG_062_MZB_LO_1094-30.09.2003","30.09.2003",2003,9,30,1.108470554,1
"ENG_062_MZB_LO_1094","ENG_062_MZB_LO_1094-22.11.2004","22.11.2004",2004,11,22,1.108213241,1
"ENG_062_MZB_LO_1094","ENG_062_MZB_LO_1094-30.11.2005","30.11.2005",2005,11,30,1.015073559,1
"ENG_062_MZB_LO_1094","ENG_062_MZB_LO_1094-02.09.2006","02.09.2006",2006,9,2,1.018692296,1
"ENG_062_MZB_LO_1094","ENG_062_MZB_LO_1094-11.10.2007","11.10.2007",2007,10,11,1.06427039,1
"ENG_062_MZB_LO_1094","ENG_062_MZB_LO_1094-30.10.2008","30.10.2008",2008,10,30,1.128204882,1
"ENG_062_MZB_LO_1094","ENG_062_MZB_LO_1094-27.11.2009","27.11.2009",2009,11,27,1.133517319,1
"ENG_062_MZB_LO_1094","ENG_062_MZB_LO_1094-24.11.2010","24.11.2010",2010,11,24,1.206377343,1
"ENG_062_MZB_LO_1094","ENG_062_MZB_LO_1094-30.11.2011","30.11.2011",2011,11,30,1.170364657,1
"ENG_062_MZB_LO_1100","ENG_062_MZB_LO_1100-20.10.2003","20.10.2003",2003,10,20,0.8475032,4
"ENG_062_MZB_LO_1100","ENG_062_MZB_LO_1100-09.09.2004","09.09.2004",2004,9,9,0.849541516,4
"ENG_062_MZB_LO_1100","ENG_062_MZB_LO_1100-18.11.2005","18.11.2005",2005,11,18,0.791706715,5
"ENG_062_MZB_LO_1100","ENG_062_MZB_LO_1100-31.10.2006","31.10.2006",2006,10,31,0.81940142,4
"ENG_062_MZB_LO_1100","ENG_062_MZB_LO_1100-17.11.2008","17.11.2008",2008,11,17,0.790958815,3
"ENG_062_MZB_LO_1100","ENG_062_MZB_LO_1100-21.10.2009","21.10.2009",2009,10,21,0.854418757,3
"ENG_062_MZB_LO_1100","ENG_062_MZB_LO_1100-13.11.2013","13.11.2013",2013,11,13,0.840069593,4
"ENG_062_MZB_LO_1100","ENG_062_MZB_LO_1100-16.10.2015","16.10.2015",2015,10,16,0.797066084,5
"ENG_062_MZB_LO_1100","ENG_062_MZB_LO_1100-27.10.2017","27.10.2017",2017,10,27,0.798775033,3
"ENG_062_MZB_LO_1100","ENG_062_MZB_LO_1100-01.10.2018","01.10.2018",2018,10,1,0.675449006,5
"ENG_062_MZB_LO_1100","ENG_062_MZB_LO_1100-22.09.2023","22.09.2023",2023,9,22,0.753628863,5
"ENG_062_MZB_LO_1101","ENG_062_MZB_LO_1101-03.09.2002","03.09.2002",2002,9,3,1.029558816,1
"ENG_062_MZB_LO_1101","ENG_062_MZB_LO_1101-09.09.2003","09.09.2003",2003,9,9,0.931912364,2
"ENG_062_MZB_LO_1101","ENG_062_MZB_LO_1101-18.11.2005","18.11.2005",2005,11,18,1.00765113,2
"ENG_062_MZB_LO_1101","ENG_062_MZB_LO_1101-19.10.2007","19.10.2007",2007,10,19,0.994421251,1
"ENG_062_MZB_LO_1101","ENG_062_MZB_LO_1101-24.10.2008","24.10.2008",2008,10,24,1.036609552,1
"ENG_062_MZB_LO_1101","ENG_062_MZB_LO_1101-18.10.2010","18.10.2010",2010,10,18,1.093657732,2
"ENG_062_MZB_LO_1101","ENG_062_MZB_LO_1101-08.11.2011","08.11.2011",2011,11,8,1.004551317,1
"ENG_062_MZB_LO_1101","ENG_062_MZB_LO_1101-13.11.2013","13.11.2013",2013,11,13,0.931670035,3
"ENG_062_MZB_LO_1101","ENG_062_MZB_LO_1101-06.10.2016","06.10.2016",2016,10,6,0.99904806,3
"ENG_062_MZB_LO_1103","ENG_062_MZB_LO_1103-05.09.2002","05.09.2002",2002,9,5,0.984446908,1
"ENG_062_MZB_LO_1103","ENG_062_MZB_LO_1103-27.10.2003","27.10.2003",2003,10,27,0.98977767,1
"ENG_062_MZB_LO_1103","ENG_062_MZB_LO_1103-19.11.2004","19.11.2004",2004,11,19,0.957959242,2
"ENG_062_MZB_LO_1103","ENG_062_MZB_LO_1103-13.11.2007","13.11.2007",2007,11,13,1.018663214,1
"ENG_062_MZB_LO_1103","ENG_062_MZB_LO_1103-24.10.2008","24.10.2008",2008,10,24,1.012180779,1
"ENG_062_MZB_LO_1103","ENG_062_MZB_LO_1103-05.11.2009","05.11.2009",2009,11,5,0.960340339,2
"ENG_062_MZB_LO_1103","ENG_062_MZB_LO_1103-18.10.2010","18.10.2010",2010,10,18,0.963025989,1
"ENG_062_MZB_LO_1103","ENG_062_MZB_LO_1103-14.10.2013","14.10.2013",2013,10,14,0.923932052,2
"ENG_062_MZB_LO_1103","ENG_062_MZB_LO_1103-29.10.2014","29.10.2014",2014,10,29,0.979996387,2
"ENG_062_MZB_LO_1103","ENG_062_MZB_LO_1103-16.10.2015","16.10.2015",2015,10,16,0.96425275,2
"ENG_062_MZB_LO_1103","ENG_062_MZB_LO_1103-06.10.2016","06.10.2016",2016,10,6,0.969734623,1
"ENG_062_MZB_LO_1103","ENG_062_MZB_LO_1103-27.10.2017","27.10.2017",2017,10,27,0.971138212,1
"ENG_062_MZB_LO_1103","ENG_062_MZB_LO_1103-18.10.2018","18.10.2018",2018,10,18,0.995727434,1
"ENG_062_MZB_LO_1103","ENG_062_MZB_LO_1103-09.10.2019","09.10.2019",2019,10,9,0.948550823,2
"ENG_062_MZB_LO_1105","ENG_062_MZB_LO_1105-03.09.2002","03.09.2002",2002,9,3,0.99671514,1
"ENG_062_MZB_LO_1105","ENG_062_MZB_LO_1105-09.09.2003","09.09.2003",2003,9,9,1.046425017,1
"ENG_062_MZB_LO_1105","ENG_062_MZB_LO_1105-09.09.2004","09.09.2004",2004,9,9,1.024041431,2
"ENG_062_MZB_LO_1105","ENG_062_MZB_LO_1105-18.11.2005","18.11.2005",2005,11,18,1.025103372,1
"ENG_062_MZB_LO_1105","ENG_062_MZB_LO_1105-30.10.2006","30.10.2006",2006,10,30,1.014044505,2
"ENG_062_MZB_LO_1105","ENG_062_MZB_LO_1105-19.10.2007","19.10.2007",2007,10,19,1.146670906,3
"ENG_062_MZB_LO_1105","ENG_062_MZB_LO_1105-20.10.2009","20.10.2009",2009,10,20,1.050718676,1
"ENG_062_MZB_LO_1105","ENG_062_MZB_LO_1105-12.10.2010","12.10.2010",2010,10,12,0.953272815,3
"ENG_062_MZB_LO_1105","ENG_062_MZB_LO_1105-08.11.2011","08.11.2011",2011,11,8,1.024458936,1
"ENG_062_MZB_LO_1105","ENG_062_MZB_LO_1105-30.10.2012","30.10.2012",2012,10,30,1.047485222,2
"ENG_062_MZB_LO_1105","ENG_062_MZB_LO_1105-03.09.2013","03.09.2013",2013,9,3,1.119332941,3
"ENG_062_MZB_LO_1105","ENG_062_MZB_LO_1105-22.10.2014","22.10.2014",2014,10,22,1.094994906,4
"ENG_062_MZB_LO_1105","ENG_062_MZB_LO_1105-17.11.2015","17.11.2015",2015,11,17,1.064300798,3
"ENG_062_MZB_LO_1105","ENG_062_MZB_LO_1105-06.10.2016","06.10.2016",2016,10,6,1.032053383,1
"ENG_062_MZB_LO_1105","ENG_062_MZB_LO_1105-10.10.2017","10.10.2017",2017,10,10,0.998500949,2
"ENG_062_MZB_LO_1105","ENG_062_MZB_LO_1105-18.10.2018","18.10.2018",2018,10,18,1.042393795,2
"ENG_062_MZB_LO_1105","ENG_062_MZB_LO_1105-08.10.2019","08.10.2019",2019,10,8,1.143326469,1
"ENG_062_MZB_LO_1105","ENG_062_MZB_LO_1105-06.10.2020","06.10.2020",2020,10,6,1.04086704,2
"ENG_062_MZB_LO_1106","ENG_062_MZB_LO_1106-04.09.2002","04.09.2002",2002,9,4,0.801500508,3
"ENG_062_MZB_LO_1106","ENG_062_MZB_LO_1106-04.11.2003","04.11.2003",2003,11,4,0.874218245,3
"ENG_062_MZB_LO_1106","ENG_062_MZB_LO_1106-22.11.2004","22.11.2004",2004,11,22,0.720863473,5
"ENG_062_MZB_LO_1106","ENG_062_MZB_LO_1106-03.09.2007","03.09.2007",2007,9,3,0.828698449,5
"ENG_062_MZB_LO_1106","ENG_062_MZB_LO_1106-17.11.2008","17.11.2008",2008,11,17,0.784727166,3
"ENG_062_MZB_LO_1106","ENG_062_MZB_LO_1106-21.10.2009","21.10.2009",2009,10,21,0.796058329,3
"ENG_062_MZB_LO_1106","ENG_062_MZB_LO_1106-10.10.2012","10.10.2012",2012,10,10,0.771643847,5
"ENG_062_MZB_LO_1106","ENG_062_MZB_LO_1106-13.11.2013","13.11.2013",2013,11,13,0.84341705,5
"ENG_062_MZB_LO_1106","ENG_062_MZB_LO_1106-08.09.2014","08.09.2014",2014,9,8,0.7729494,5
"ENG_062_MZB_LO_1109","ENG_062_MZB_LO_1109-04.09.2002","04.09.2002",2002,9,4,1.080060288,1
"ENG_062_MZB_LO_1109","ENG_062_MZB_LO_1109-19.09.2003","19.09.2003",2003,9,19,1.028530789,1
"ENG_062_MZB_LO_1109","ENG_062_MZB_LO_1109-11.11.2006","11.11.2006",2006,11,11,1.085454118,1
"ENG_062_MZB_LO_1109","ENG_062_MZB_LO_1109-30.11.2007","30.11.2007",2007,11,30,1.12667263,1
"ENG_062_MZB_LO_1109","ENG_062_MZB_LO_1109-02.11.2009","02.11.2009",2009,11,2,1.12404467,1
"ENG_062_MZB_LO_1109","ENG_062_MZB_LO_1109-03.09.2010","03.09.2010",2010,9,3,1.142337402,1
"ENG_062_MZB_LO_1109","ENG_062_MZB_LO_1109-08.11.2011","08.11.2011",2011,11,8,1.175135368,1
"ENG_062_MZB_LO_1109","ENG_062_MZB_LO_1109-02.11.2012","02.11.2012",2012,11,2,1.072874076,1
"ENG_062_MZB_LO_1109","ENG_062_MZB_LO_1109-16.09.2014","16.09.2014",2014,9,16,1.158276243,2
"ENG_062_MZB_LO_1109","ENG_062_MZB_LO_1109-21.10.2016","21.10.2016",2016,10,21,1.202399921,1
"ENG_062_MZB_LO_1109","ENG_062_MZB_LO_1109-11.10.2017","11.10.2017",2017,10,11,1.20249214,1
"ENG_062_MZB_LO_1109","ENG_062_MZB_LO_1109-31.10.2018","31.10.2018",2018,10,31,1.183585266,1
"ENG_062_MZB_LO_1109","ENG_062_MZB_LO_1109-13.11.2019","13.11.2019",2019,11,13,1.138934968,1
"ENG_062_MZB_LO_1109","ENG_062_MZB_LO_1109-25.10.2021","25.10.2021",2021,10,25,1.136805079,1
"ENG_062_MZB_LO_1109","ENG_062_MZB_LO_1109-25.10.2023","25.10.2023",2023,10,25,1.168586879,1
"ENG_062_MZB_LO_111","ENG_062_MZB_LO_111-26.09.2002","26.09.2002",2002,9,26,0.793855431,3
"ENG_062_MZB_LO_111","ENG_062_MZB_LO_111-15.09.2003","15.09.2003",2003,9,15,0.874527471,3
"ENG_062_MZB_LO_111","ENG_062_MZB_LO_111-27.09.2004","27.09.2004",2004,9,27,0.916986947,2
"ENG_062_MZB_LO_111","ENG_062_MZB_LO_111-29.09.2005","29.09.2005",2005,9,29,0.953479966,2
"ENG_062_MZB_LO_111","ENG_062_MZB_LO_111-04.10.2006","04.10.2006",2006,10,4,1.12064725,3
"ENG_062_MZB_LO_111","ENG_062_MZB_LO_111-03.10.2007","03.10.2007",2007,10,3,0.937688146,2
"ENG_062_MZB_LO_111","ENG_062_MZB_LO_111-05.11.2008","05.11.2008",2008,11,5,1.074019419,3
"ENG_062_MZB_LO_111","ENG_062_MZB_LO_111-10.09.2009","10.09.2009",2009,9,10,1.000592265,2
"ENG_062_MZB_LO_111","ENG_062_MZB_LO_111-30.09.2010","30.09.2010",2010,9,30,0.920523252,2
"ENG_062_MZB_LO_111","ENG_062_MZB_LO_111-17.10.2011","17.10.2011",2011,10,17,0.895408269,2
"ENG_062_MZB_LO_111","ENG_062_MZB_LO_111-12.09.2013","12.09.2013",2013,9,12,0.923633077,2
"ENG_062_MZB_LO_111","ENG_062_MZB_LO_111-25.09.2014","25.09.2014",2014,9,25,1.006257188,1
"ENG_062_MZB_LO_111","ENG_062_MZB_LO_111-25.09.2015","25.09.2015",2015,9,25,0.957855865,2
"ENG_062_MZB_LO_111","ENG_062_MZB_LO_111-19.09.2016","19.09.2016",2016,9,19,0.854383528,3
"ENG_062_MZB_LO_111","ENG_062_MZB_LO_111-03.10.2017","03.10.2017",2017,10,3,0.952980183,2
"ENG_062_MZB_LO_111","ENG_062_MZB_LO_111-11.09.2018","11.09.2018",2018,9,11,1.016290521,1
"ENG_062_MZB_LO_111","ENG_062_MZB_LO_111-22.10.2019","22.10.2019",2019,10,22,1.05792079,1
"ENG_062_MZB_LO_111","ENG_062_MZB_LO_111-20.10.2020","20.10.2020",2020,10,20,1.042160963,1
"ENG_062_MZB_LO_111","ENG_062_MZB_LO_111-10.10.2021","10.10.2021",2021,10,10,1.01202952,1
"ENG_062_MZB_LO_111","ENG_062_MZB_LO_111-26.09.2023","26.09.2023",2023,9,26,0.935388963,2
"ENG_062_MZB_LO_1110","ENG_062_MZB_LO_1110-04.09.2002","04.09.2002",2002,9,4,1.190858755,1
"ENG_062_MZB_LO_1110","ENG_062_MZB_LO_1110-06.10.2003","06.10.2003",2003,10,6,1.24430391,1
"ENG_062_MZB_LO_1110","ENG_062_MZB_LO_1110-09.11.2005","09.11.2005",2005,11,9,1.254005626,1
"ENG_062_MZB_LO_1110","ENG_062_MZB_LO_1110-16.11.2007","16.11.2007",2007,11,16,1.250771474,1
"ENG_062_MZB_LO_1110","ENG_062_MZB_LO_1110-02.11.2009","02.11.2009",2009,11,2,1.240639389,1
"ENG_062_MZB_LO_1110","ENG_062_MZB_LO_1110-02.11.2010","02.11.2010",2010,11,2,1.223037845,1
"ENG_062_MZB_LO_1110","ENG_062_MZB_LO_1110-15.11.2011","15.11.2011",2011,11,15,1.274365709,3
"ENG_062_MZB_LO_1110","ENG_062_MZB_LO_1110-09.10.2012","09.10.2012",2012,10,9,1.111561867,1
"ENG_062_MZB_LO_1110","ENG_062_MZB_LO_1110-30.09.2013","30.09.2013",2013,9,30,1.249173196,1
"ENG_062_MZB_LO_1110","ENG_062_MZB_LO_1110-17.09.2014","17.09.2014",2014,9,17,1.213949212,1
"ENG_062_MZB_LO_1110","ENG_062_MZB_LO_1110-09.10.2015","09.10.2015",2015,10,9,1.278998199,1
"ENG_062_MZB_LO_1110","ENG_062_MZB_LO_1110-06.10.2016","06.10.2016",2016,10,6,1.271859634,1
"ENG_062_MZB_LO_1110","ENG_062_MZB_LO_1110-22.11.2017","22.11.2017",2017,11,22,1.251148639,1
"ENG_062_MZB_LO_1110","ENG_062_MZB_LO_1110-04.10.2018","04.10.2018",2018,10,4,1.216231597,1
"ENG_062_MZB_LO_1110","ENG_062_MZB_LO_1110-26.09.2019","26.09.2019",2019,9,26,1.175476546,2
"ENG_062_MZB_LO_1111","ENG_062_MZB_LO_1111-04.09.2002","04.09.2002",2002,9,4,1.009620628,1
"ENG_062_MZB_LO_1111","ENG_062_MZB_LO_1111-15.09.2003","15.09.2003",2003,9,15,1.011287383,1
"ENG_062_MZB_LO_1111","ENG_062_MZB_LO_1111-21.09.2004","21.09.2004",2004,9,21,1.122997491,1
"ENG_062_MZB_LO_1111","ENG_062_MZB_LO_1111-09.11.2005","09.11.2005",2005,11,9,1.081141537,1
"ENG_062_MZB_LO_1111","ENG_062_MZB_LO_1111-01.11.2006","01.11.2006",2006,11,1,0.961880239,2
"ENG_062_MZB_LO_1111","ENG_062_MZB_LO_1111-12.11.2007","12.11.2007",2007,11,12,1.118417767,1
"ENG_062_MZB_LO_1111","ENG_062_MZB_LO_1111-08.10.2008","08.10.2008",2008,10,8,1.013502326,1
"ENG_062_MZB_LO_1111","ENG_062_MZB_LO_1111-19.10.2009","19.10.2009",2009,10,19,1.032999797,3
"ENG_062_MZB_LO_1111","ENG_062_MZB_LO_1111-27.09.2010","27.09.2010",2010,9,27,1.027686681,2
"ENG_062_MZB_LO_1111","ENG_062_MZB_LO_1111-08.11.2011","08.11.2011",2011,11,8,1.034815424,1
"ENG_062_MZB_LO_1111","ENG_062_MZB_LO_1111-12.11.2012","12.11.2012",2012,11,12,1.078254051,1
"ENG_062_MZB_LO_1111","ENG_062_MZB_LO_1111-30.09.2013","30.09.2013",2013,9,30,1.030479631,2
"ENG_062_MZB_LO_1111","ENG_062_MZB_LO_1111-25.09.2014","25.09.2014",2014,9,25,1.097267117,1
"ENG_062_MZB_LO_1111","ENG_062_MZB_LO_1111-02.10.2015","02.10.2015",2015,10,2,1.117748727,1
"ENG_062_MZB_LO_1111","ENG_062_MZB_LO_1111-04.10.2016","04.10.2016",2016,10,4,1.103566291,1
"ENG_062_MZB_LO_1111","ENG_062_MZB_LO_1111-13.10.2017","13.10.2017",2017,10,13,1.046203005,1
"ENG_062_MZB_LO_1111","ENG_062_MZB_LO_1111-27.09.2018","27.09.2018",2018,9,27,1.083215372,1
"ENG_062_MZB_LO_1111","ENG_062_MZB_LO_1111-18.09.2019","18.09.2019",2019,9,18,1.100666147,2
"ENG_062_MZB_LO_1111","ENG_062_MZB_LO_1111-14.10.2020","14.10.2020",2020,10,14,1.067073141,1
"ENG_062_MZB_LO_1111","ENG_062_MZB_LO_1111-01.10.2021","01.10.2021",2021,10,1,1.071394117,1
"ENG_062_MZB_LO_1111","ENG_062_MZB_LO_1111-06.09.2022","06.09.2022",2022,9,6,1.09643401,3
"ENG_062_MZB_LO_1111","ENG_062_MZB_LO_1111-27.10.2023","27.10.2023",2023,10,27,1.050522928,1
"ENG_062_MZB_LO_1117","ENG_062_MZB_LO_1117-23.09.2003","23.09.2003",2003,9,23,1.140065294,1
"ENG_062_MZB_LO_1117","ENG_062_MZB_LO_1117-22.11.2004","22.11.2004",2004,11,22,1.131314289,1
"ENG_062_MZB_LO_1117","ENG_062_MZB_LO_1117-18.10.2005","18.10.2005",2005,10,18,1.11811535,1
"ENG_062_MZB_LO_1117","ENG_062_MZB_LO_1117-10.10.2006","10.10.2006",2006,10,10,1.058999751,1
"ENG_062_MZB_LO_1117","ENG_062_MZB_LO_1117-29.10.2007","29.10.2007",2007,10,29,1.143163848,3
"ENG_062_MZB_LO_1117","ENG_062_MZB_LO_1117-12.11.2008","12.11.2008",2008,11,12,1.120598756,2
"ENG_062_MZB_LO_1117","ENG_062_MZB_LO_1117-19.10.2009","19.10.2009",2009,10,19,1.114103753,2
"ENG_062_MZB_LO_1117","ENG_062_MZB_LO_1117-04.11.2010","04.11.2010",2010,11,4,1.164321733,1
"ENG_062_MZB_LO_1117","ENG_062_MZB_LO_1117-11.10.2011","11.10.2011",2011,10,11,1.065659049,3
"ENG_062_MZB_LO_1117","ENG_062_MZB_LO_1117-15.11.2012","15.11.2012",2012,11,15,1.070445366,1
"ENG_062_MZB_LO_1117","ENG_062_MZB_LO_1117-04.11.2013","04.11.2013",2013,11,4,1.08101072,2
"ENG_062_MZB_LO_1117","ENG_062_MZB_LO_1117-08.10.2014","08.10.2014",2014,10,8,1.12185663,2
"ENG_062_MZB_LO_1117","ENG_062_MZB_LO_1117-07.09.2015","07.09.2015",2015,9,7,1.144999135,1
"ENG_062_MZB_LO_1117","ENG_062_MZB_LO_1117-06.10.2016","06.10.2016",2016,10,6,1.109020019,1
"ENG_062_MZB_LO_1117","ENG_062_MZB_LO_1117-06.10.2017","06.10.2017",2017,10,6,1.081419885,1
"ENG_062_MZB_LO_1117","ENG_062_MZB_LO_1117-14.11.2018","14.11.2018",2018,11,14,1.114029546,1
"ENG_062_MZB_LO_1117","ENG_062_MZB_LO_1117-17.10.2019","17.10.2019",2019,10,17,1.043004192,3
"ENG_062_MZB_LO_1117","ENG_062_MZB_LO_1117-15.10.2020","15.10.2020",2020,10,15,1.165731126,1
"ENG_062_MZB_LO_1117","ENG_062_MZB_LO_1117-15.10.2021","15.10.2021",2021,10,15,1.133571133,1
"ENG_062_MZB_LO_1117","ENG_062_MZB_LO_1117-17.11.2022","17.11.2022",2022,11,17,1.110421472,2
"ENG_062_MZB_LO_1117","ENG_062_MZB_LO_1117-06.10.2023","06.10.2023",2023,10,6,1.10152385,1
"ENG_062_MZB_LO_1118","ENG_062_MZB_LO_1118-24.09.2002","24.09.2002",2002,9,24,0.941313613,2
"ENG_062_MZB_LO_1118","ENG_062_MZB_LO_1118-21.09.2004","21.09.2004",2004,9,21,0.945275561,2
"ENG_062_MZB_LO_1118","ENG_062_MZB_LO_1118-27.10.2005","27.10.2005",2005,10,27,0.994054467,1
"ENG_062_MZB_LO_1118","ENG_062_MZB_LO_1118-01.09.2006","01.09.2006",2006,9,1,0.958309627,2
"ENG_062_MZB_LO_1118","ENG_062_MZB_LO_1118-29.10.2007","29.10.2007",2007,10,29,1.013146295,1
"ENG_062_MZB_LO_1118","ENG_062_MZB_LO_1118-23.10.2008","23.10.2008",2008,10,23,1.006664409,1
"ENG_062_MZB_LO_1118","ENG_062_MZB_LO_1118-20.10.2009","20.10.2009",2009,10,20,1.080898743,1
"ENG_062_MZB_LO_1118","ENG_062_MZB_LO_1118-04.11.2010","04.11.2010",2010,11,4,1.06441955,1
"ENG_062_MZB_LO_1118","ENG_062_MZB_LO_1118-17.11.2011","17.11.2011",2011,11,17,1.003855614,1
"ENG_062_MZB_LO_1118","ENG_062_MZB_LO_1118-15.11.2012","15.11.2012",2012,11,15,0.953647881,2
"ENG_062_MZB_LO_1118","ENG_062_MZB_LO_1118-30.09.2013","30.09.2013",2013,9,30,0.975625301,2
"ENG_062_MZB_LO_1118","ENG_062_MZB_LO_1118-22.09.2014","22.09.2014",2014,9,22,0.928755031,2
"ENG_062_MZB_LO_1118","ENG_062_MZB_LO_1118-06.10.2017","06.10.2017",2017,10,6,0.963237009,2
"ENG_062_MZB_LO_1118","ENG_062_MZB_LO_1118-15.10.2020","15.10.2020",2020,10,15,0.973120764,1
"ENG_062_MZB_LO_112","ENG_062_MZB_LO_112-01.10.2002","01.10.2002",2002,10,1,0.83122107,3
"ENG_062_MZB_LO_112","ENG_062_MZB_LO_112-19.09.2005","19.09.2005",2005,9,19,0.77903474,3
"ENG_062_MZB_LO_112","ENG_062_MZB_LO_112-13.10.2008","13.10.2008",2008,10,13,0.867141662,3
"ENG_062_MZB_LO_112","ENG_062_MZB_LO_112-10.09.2013","10.09.2013",2013,9,10,0.971101008,2
"ENG_062_MZB_LO_112","ENG_062_MZB_LO_112-13.10.2016","13.10.2016",2016,10,13,0.946199857,2
"ENG_062_MZB_LO_112","ENG_062_MZB_LO_112-23.10.2019","23.10.2019",2019,10,23,0.87425343,3
"ENG_062_MZB_LO_112","ENG_062_MZB_LO_112-12.10.2021","12.10.2021",2021,10,12,0.98220005,1
"ENG_062_MZB_LO_1120","ENG_062_MZB_LO_1120-24.09.2002","24.09.2002",2002,9,24,1.061346152,1
"ENG_062_MZB_LO_1120","ENG_062_MZB_LO_1120-28.10.2003","28.10.2003",2003,10,28,0.930786921,2
"ENG_062_MZB_LO_1120","ENG_062_MZB_LO_1120-07.09.2004","07.09.2004",2004,9,7,1.031461658,2
"ENG_062_MZB_LO_1120","ENG_062_MZB_LO_1120-29.10.2007","29.10.2007",2007,10,29,0.991518345,1
"ENG_062_MZB_LO_1120","ENG_062_MZB_LO_1120-03.11.2008","03.11.2008",2008,11,3,1.032360375,1
"ENG_062_MZB_LO_1120","ENG_062_MZB_LO_1120-17.09.2009","17.09.2009",2009,9,17,0.980235692,1
"ENG_062_MZB_LO_1120","ENG_062_MZB_LO_1120-05.10.2010","05.10.2010",2010,10,5,0.920769477,2
"ENG_062_MZB_LO_1120","ENG_062_MZB_LO_1120-03.10.2011","03.10.2011",2011,10,3,0.984293306,1
"ENG_062_MZB_LO_1120","ENG_062_MZB_LO_1120-13.09.2012","13.09.2012",2012,9,13,0.944187267,2
"ENG_062_MZB_LO_1120","ENG_062_MZB_LO_1120-21.11.2013","21.11.2013",2013,11,21,0.940865821,2
"ENG_062_MZB_LO_1120","ENG_062_MZB_LO_1120-22.09.2014","22.09.2014",2014,9,22,1.000989208,1
"ENG_062_MZB_LO_1120","ENG_062_MZB_LO_1120-18.11.2015","18.11.2015",2015,11,18,1.016048591,1
"ENG_062_MZB_LO_1120","ENG_062_MZB_LO_1120-18.10.2016","18.10.2016",2016,10,18,0.934776905,2
"ENG_062_MZB_LO_1120","ENG_062_MZB_LO_1120-04.10.2017","04.10.2017",2017,10,4,1.059325474,1
"ENG_062_MZB_LO_1120","ENG_062_MZB_LO_1120-14.11.2018","14.11.2018",2018,11,14,1.034955793,1
"ENG_062_MZB_LO_1120","ENG_062_MZB_LO_1120-07.11.2019","07.11.2019",2019,11,7,0.984269474,2
"ENG_062_MZB_LO_1122","ENG_062_MZB_LO_1122-10.10.2002","10.10.2002",2002,10,10,1.164303709,1
"ENG_062_MZB_LO_1122","ENG_062_MZB_LO_1122-23.09.2003","23.09.2003",2003,9,23,1.168408964,1
"ENG_062_MZB_LO_1122","ENG_062_MZB_LO_1122-21.09.2004","21.09.2004",2004,9,21,1.132935544,2
"ENG_062_MZB_LO_1122","ENG_062_MZB_LO_1122-22.11.2005","22.11.2005",2005,11,22,1.117881244,1
"ENG_062_MZB_LO_1122","ENG_062_MZB_LO_1122-13.10.2006","13.10.2006",2006,10,13,1.15796591,1
"ENG_062_MZB_LO_1122","ENG_062_MZB_LO_1122-29.10.2007","29.10.2007",2007,10,29,1.162800437,3
"ENG_062_MZB_LO_1122","ENG_062_MZB_LO_1122-24.09.2008","24.09.2008",2008,9,24,1.195021374,1
"ENG_062_MZB_LO_1122","ENG_062_MZB_LO_1122-13.09.2013","13.09.2013",2013,9,13,1.1977702,2
"ENG_062_MZB_LO_1125","ENG_062_MZB_LO_1125-27.05.2002","27.05.2002",2002,5,27,0.82686773,3
"ENG_062_MZB_LO_1125","ENG_062_MZB_LO_1125-16.04.2003","16.04.2003",2003,4,16,0.809748445,3
"ENG_062_MZB_LO_1125","ENG_062_MZB_LO_1125-18.04.2005","18.04.2005",2005,4,18,0.858478138,3
"ENG_062_MZB_LO_1125","ENG_062_MZB_LO_1125-26.05.2006","26.05.2006",2006,5,26,0.807349123,3
"ENG_062_MZB_LO_1125","ENG_062_MZB_LO_1125-14.03.2007","14.03.2007",2007,3,14,0.797528898,3
"ENG_062_MZB_LO_1125","ENG_062_MZB_LO_1125-20.05.2009","20.05.2009",2009,5,20,0.937951749,2
"ENG_062_MZB_LO_1125","ENG_062_MZB_LO_1125-25.04.2013","25.04.2013",2013,4,25,0.951041392,2
"ENG_062_MZB_LO_1125","ENG_062_MZB_LO_1125-30.03.2015","30.03.2015",2015,3,30,0.949409777,2
"ENG_062_MZB_LO_1126","ENG_062_MZB_LO_1126-11.09.2002","11.09.2002",2002,9,11,0.698184149,4
"ENG_062_MZB_LO_1126","ENG_062_MZB_LO_1126-15.10.2003","15.10.2003",2003,10,15,0.71617267,4
"ENG_062_MZB_LO_1126","ENG_062_MZB_LO_1126-25.10.2006","25.10.2006",2006,10,25,0.615321521,4
"ENG_062_MZB_LO_1126","ENG_062_MZB_LO_1126-05.11.2008","05.11.2008",2008,11,5,0.665542693,4
"ENG_062_MZB_LO_1126","ENG_062_MZB_LO_1126-10.10.2013","10.10.2013",2013,10,10,0.723539859,4
"ENG_062_MZB_LO_1126","ENG_062_MZB_LO_1126-16.10.2015","16.10.2015",2015,10,16,0.661511236,4
"ENG_062_MZB_LO_1126","ENG_062_MZB_LO_1126-13.09.2018","13.09.2018",2018,9,13,0.653746039,4
"ENG_062_MZB_LO_1126","ENG_062_MZB_LO_1126-01.10.2020","01.10.2020",2020,10,1,0.761977359,3
"ENG_062_MZB_LO_1126","ENG_062_MZB_LO_1126-27.10.2021","27.10.2021",2021,10,27,0.702236252,4
"ENG_062_MZB_LO_1126","ENG_062_MZB_LO_1126-19.10.2022","19.10.2022",2022,10,19,0.730885827,3
"ENG_062_MZB_LO_1128","ENG_062_MZB_LO_1128-09.10.2002","09.10.2002",2002,10,9,0.961371166,2
"ENG_062_MZB_LO_1128","ENG_062_MZB_LO_1128-06.10.2003","06.10.2003",2003,10,6,0.925660724,2
"ENG_062_MZB_LO_1128","ENG_062_MZB_LO_1128-31.10.2006","31.10.2006",2006,10,31,0.964154412,2
"ENG_062_MZB_LO_1128","ENG_062_MZB_LO_1128-16.11.2007","16.11.2007",2007,11,16,0.991144419,1
"ENG_062_MZB_LO_1128","ENG_062_MZB_LO_1128-15.10.2009","15.10.2009",2009,10,15,1.033473318,1
"ENG_062_MZB_LO_1128","ENG_062_MZB_LO_1128-03.09.2010","03.09.2010",2010,9,3,1.11376795,1
"ENG_062_MZB_LO_1128","ENG_062_MZB_LO_1128-15.11.2011","15.11.2011",2011,11,15,0.962776942,2
"ENG_062_MZB_LO_1128","ENG_062_MZB_LO_1128-11.09.2012","11.09.2012",2012,9,11,0.945894481,2
"ENG_062_MZB_LO_1128","ENG_062_MZB_LO_1128-16.09.2014","16.09.2014",2014,9,16,0.946935514,3
"ENG_062_MZB_LO_1129","ENG_062_MZB_LO_1129-04.09.2002","04.09.2002",2002,9,4,0.697951343,5
"ENG_062_MZB_LO_1129","ENG_062_MZB_LO_1129-20.10.2003","20.10.2003",2003,10,20,0.755389177,4
"ENG_062_MZB_LO_1129","ENG_062_MZB_LO_1129-22.11.2004","22.11.2004",2004,11,22,0.849885086,5
"ENG_062_MZB_LO_1129","ENG_062_MZB_LO_1129-27.10.2005","27.10.2005",2005,10,27,0.707856041,4
"ENG_062_MZB_LO_1129","ENG_062_MZB_LO_1129-31.10.2006","31.10.2006",2006,10,31,0.752269311,4
"ENG_062_MZB_LO_1129","ENG_062_MZB_LO_1129-03.09.2007","03.09.2007",2007,9,3,0.707887617,4
"ENG_062_MZB_LO_1129","ENG_062_MZB_LO_1129-21.10.2009","21.10.2009",2009,10,21,0.756750637,4
"ENG_062_MZB_LO_1129","ENG_062_MZB_LO_1129-07.11.2013","07.11.2013",2013,11,7,0.692139622,5
"ENG_062_MZB_LO_1129","ENG_062_MZB_LO_1129-25.10.2016","25.10.2016",2016,10,25,0.867444637,5
"ENG_062_MZB_LO_1130","ENG_062_MZB_LO_1130-04.09.2002","04.09.2002",2002,9,4,0.721453989,4
"ENG_062_MZB_LO_1130","ENG_062_MZB_LO_1130-04.11.2003","04.11.2003",2003,11,4,0.707795874,4
"ENG_062_MZB_LO_1130","ENG_062_MZB_LO_1130-22.11.2004","22.11.2004",2004,11,22,0.729532025,3
"ENG_062_MZB_LO_1130","ENG_062_MZB_LO_1130-27.10.2005","27.10.2005",2005,10,27,0.72810247,5
"ENG_062_MZB_LO_1130","ENG_062_MZB_LO_1130-31.10.2006","31.10.2006",2006,10,31,0.71227847,4
"ENG_062_MZB_LO_1130","ENG_062_MZB_LO_1130-17.11.2008","17.11.2008",2008,11,17,0.613096336,4
"ENG_062_MZB_LO_1130","ENG_062_MZB_LO_1130-21.10.2009","21.10.2009",2009,10,21,0.712359138,4
"ENG_062_MZB_LO_1130","ENG_062_MZB_LO_1130-13.11.2013","13.11.2013",2013,11,13,0.720271238,5
"ENG_062_MZB_LO_1130","ENG_062_MZB_LO_1130-11.10.2016","11.10.2016",2016,10,11,0.606609028,5
"ENG_062_MZB_LO_1132","ENG_062_MZB_LO_1132-27.05.2003","27.05.2003",2003,5,27,1.004760704,2
"ENG_062_MZB_LO_1132","ENG_062_MZB_LO_1132-26.04.2004","26.04.2004",2004,4,26,0.955671311,2
"ENG_062_MZB_LO_1132","ENG_062_MZB_LO_1132-27.03.2007","27.03.2007",2007,3,27,1.025167487,1
"ENG_062_MZB_LO_1132","ENG_062_MZB_LO_1132-17.03.2009","17.03.2009",2009,3,17,1.054451216,2
"ENG_062_MZB_LO_1132","ENG_062_MZB_LO_1132-20.05.2013","20.05.2013",2013,5,20,1.117599215,1
"ENG_062_MZB_LO_1132","ENG_062_MZB_LO_1132-11.03.2015","11.03.2015",2015,3,11,1.097148725,1
"ENG_062_MZB_LO_1132","ENG_062_MZB_LO_1132-20.05.2024","20.05.2024",2024,5,20,0.995737013,1
"ENG_062_MZB_LO_1135","ENG_062_MZB_LO_1135-12.10.2006","12.10.2006",2006,10,12,1.100328229,1
"ENG_062_MZB_LO_1135","ENG_062_MZB_LO_1135-29.10.2007","29.10.2007",2007,10,29,1.0416265,1
"ENG_062_MZB_LO_1135","ENG_062_MZB_LO_1135-25.09.2008","25.09.2008",2008,9,25,1.091205874,1
"ENG_062_MZB_LO_1135","ENG_062_MZB_LO_1135-20.11.2009","20.11.2009",2009,11,20,1.092486749,1
"ENG_062_MZB_LO_1135","ENG_062_MZB_LO_1135-19.11.2010","19.11.2010",2010,11,19,1.115456875,1
"ENG_062_MZB_LO_1135","ENG_062_MZB_LO_1135-16.09.2011","16.09.2011",2011,9,16,1.097790948,1
"ENG_062_MZB_LO_1135","ENG_062_MZB_LO_1135-30.11.2012","30.11.2012",2012,11,30,1.073125765,1
"ENG_062_MZB_LO_1135","ENG_062_MZB_LO_1135-21.11.2013","21.11.2013",2013,11,21,1.123961059,1
"ENG_062_MZB_LO_1135","ENG_062_MZB_LO_1135-02.10.2014","02.10.2014",2014,10,2,1.053462205,1
"ENG_062_MZB_LO_1135","ENG_062_MZB_LO_1135-28.10.2015","28.10.2015",2015,10,28,1.091258216,1
"ENG_062_MZB_LO_1135","ENG_062_MZB_LO_1135-10.10.2016","10.10.2016",2016,10,10,1.068745207,1
"ENG_062_MZB_LO_1135","ENG_062_MZB_LO_1135-11.10.2017","11.10.2017",2017,10,11,1.113909138,1
"ENG_062_MZB_LO_1135","ENG_062_MZB_LO_1135-25.10.2018","25.10.2018",2018,10,25,1.149730935,1
"ENG_062_MZB_LO_1135","ENG_062_MZB_LO_1135-11.10.2019","11.10.2019",2019,10,11,1.146316303,1
"ENG_062_MZB_LO_1135","ENG_062_MZB_LO_1135-23.09.2020","23.09.2020",2020,9,23,1.15748889,1
"ENG_062_MZB_LO_1135","ENG_062_MZB_LO_1135-08.10.2021","08.10.2021",2021,10,8,1.1906649,1
"ENG_062_MZB_LO_1135","ENG_062_MZB_LO_1135-29.09.2022","29.09.2022",2022,9,29,1.155359514,1
"ENG_062_MZB_LO_1136","ENG_062_MZB_LO_1136-12.09.2002","12.09.2002",2002,9,12,1.104779451,3
"ENG_062_MZB_LO_1136","ENG_062_MZB_LO_1136-06.10.2005","06.10.2005",2005,10,6,1.123001446,1
"ENG_062_MZB_LO_1136","ENG_062_MZB_LO_1136-19.09.2008","19.09.2008",2008,9,19,1.136518037,3
"ENG_062_MZB_LO_1136","ENG_062_MZB_LO_1136-11.11.2009","11.11.2009",2009,11,11,1.09417516,2
"ENG_062_MZB_LO_1136","ENG_062_MZB_LO_1136-24.11.2010","24.11.2010",2010,11,24,1.064960004,2
"ENG_062_MZB_LO_1136","ENG_062_MZB_LO_1136-29.10.2011","29.10.2011",2011,10,29,1.063820547,2
"ENG_062_MZB_LO_1136","ENG_062_MZB_LO_1136-02.11.2015","02.11.2015",2015,11,2,1.091837878,3
"ENG_062_MZB_LO_1136","ENG_062_MZB_LO_1136-15.11.2018","15.11.2018",2018,11,15,1.159799877,1
"ENG_062_MZB_LO_114","ENG_062_MZB_LO_114-01.10.2002","01.10.2002",2002,10,1,0.812620141,3
"ENG_062_MZB_LO_114","ENG_062_MZB_LO_114-14.09.2005","14.09.2005",2005,9,14,0.745772437,3
"ENG_062_MZB_LO_114","ENG_062_MZB_LO_114-14.09.2007","14.09.2007",2007,9,14,0.87083051,3
"ENG_062_MZB_LO_114","ENG_062_MZB_LO_114-11.10.2010","11.10.2010",2010,10,11,0.896368759,2
"ENG_062_MZB_LO_114","ENG_062_MZB_LO_114-05.09.2013","05.09.2013",2013,9,5,0.889430997,2
"ENG_062_MZB_LO_114","ENG_062_MZB_LO_114-11.09.2014","11.09.2014",2014,9,11,0.854487534,3
"ENG_062_MZB_LO_114","ENG_062_MZB_LO_114-24.09.2017","24.09.2017",2017,9,24,0.930448523,2
"ENG_062_MZB_LO_1141","ENG_062_MZB_LO_1141-03.09.2002","03.09.2002",2002,9,3,0.891491763,2
"ENG_062_MZB_LO_1141","ENG_062_MZB_LO_1141-03.09.2003","03.09.2003",2003,9,3,0.867218369,2
"ENG_062_MZB_LO_1141","ENG_062_MZB_LO_1141-05.09.2004","05.09.2004",2004,9,5,0.846913825,3
"ENG_062_MZB_LO_1141","ENG_062_MZB_LO_1141-07.11.2005","07.11.2005",2005,11,7,0.850578888,3
"ENG_062_MZB_LO_1141","ENG_062_MZB_LO_1141-12.10.2006","12.10.2006",2006,10,12,0.840054745,3
"ENG_062_MZB_LO_1141","ENG_062_MZB_LO_1141-29.10.2007","29.10.2007",2007,10,29,0.837619809,3
"ENG_062_MZB_LO_1141","ENG_062_MZB_LO_1141-18.09.2008","18.09.2008",2008,9,18,0.862330159,3
"ENG_062_MZB_LO_1141","ENG_062_MZB_LO_1141-19.11.2010","19.11.2010",2010,11,19,0.858845153,3
"ENG_062_MZB_LO_1141","ENG_062_MZB_LO_1141-16.09.2011","16.09.2011",2011,9,16,0.850083568,3
"ENG_062_MZB_LO_1141","ENG_062_MZB_LO_1141-30.11.2012","30.11.2012",2012,11,30,0.900549498,2
"ENG_062_MZB_LO_1142","ENG_062_MZB_LO_1142-10.10.2002","10.10.2002",2002,10,10,1.153750731,1
"ENG_062_MZB_LO_1142","ENG_062_MZB_LO_1142-03.09.2003","03.09.2003",2003,9,3,1.159076978,1
"ENG_062_MZB_LO_1142","ENG_062_MZB_LO_1142-06.09.2004","06.09.2004",2004,9,6,1.124003181,1
"ENG_062_MZB_LO_1142","ENG_062_MZB_LO_1142-29.10.2007","29.10.2007",2007,10,29,1.193314515,1
"ENG_062_MZB_LO_1142","ENG_062_MZB_LO_1142-19.11.2010","19.11.2010",2010,11,19,1.169139709,1
"ENG_062_MZB_LO_1142","ENG_062_MZB_LO_1142-13.09.2013","13.09.2013",2013,9,13,1.124949597,1
"ENG_062_MZB_LO_1142","ENG_062_MZB_LO_1142-09.10.2014","09.10.2014",2014,10,9,1.183676391,1
"ENG_062_MZB_LO_1142","ENG_062_MZB_LO_1142-06.11.2017","06.11.2017",2017,11,6,1.145360837,1
"ENG_062_MZB_LO_1142","ENG_062_MZB_LO_1142-23.09.2020","23.09.2020",2020,9,23,1.151793335,1
"ENG_062_MZB_LO_1148","ENG_062_MZB_LO_1148-14.10.2002","14.10.2002",2002,10,14,0.87165459,2
"ENG_062_MZB_LO_1148","ENG_062_MZB_LO_1148-17.10.2003","17.10.2003",2003,10,17,0.748037792,4
"ENG_062_MZB_LO_1148","ENG_062_MZB_LO_1148-15.10.2004","15.10.2004",2004,10,15,0.856453476,3
"ENG_062_MZB_LO_1148","ENG_062_MZB_LO_1148-17.10.2005","17.10.2005",2005,10,17,0.865187056,3
"ENG_062_MZB_LO_1148","ENG_062_MZB_LO_1148-18.10.2006","18.10.2006",2006,10,18,0.875507909,3
"ENG_062_MZB_LO_1148","ENG_062_MZB_LO_1148-18.10.2007","18.10.2007",2007,10,18,0.972602454,2
"ENG_062_MZB_LO_1148","ENG_062_MZB_LO_1148-29.10.2008","29.10.2008",2008,10,29,0.938864736,3
"ENG_062_MZB_LO_1148","ENG_062_MZB_LO_1148-22.10.2009","22.10.2009",2009,10,22,0.963002916,2
"ENG_062_MZB_LO_1148","ENG_062_MZB_LO_1148-20.10.2010","20.10.2010",2010,10,20,0.967172092,4
"ENG_062_MZB_LO_1148","ENG_062_MZB_LO_1148-22.11.2011","22.11.2011",2011,11,22,0.804226867,3
"ENG_062_MZB_LO_1148","ENG_062_MZB_LO_1148-19.09.2012","19.09.2012",2012,9,19,0.886866329,3
"ENG_062_MZB_LO_1148","ENG_062_MZB_LO_1148-27.09.2013","27.09.2013",2013,9,27,0.912048051,5
"ENG_062_MZB_LO_1148","ENG_062_MZB_LO_1148-18.09.2014","18.09.2014",2014,9,18,0.944602584,3
"ENG_062_MZB_LO_1148","ENG_062_MZB_LO_1148-12.10.2015","12.10.2015",2015,10,12,0.93710635,2
"ENG_062_MZB_LO_1148","ENG_062_MZB_LO_1148-05.10.2016","05.10.2016",2016,10,5,0.890685488,2
"ENG_062_MZB_LO_1148","ENG_062_MZB_LO_1148-01.11.2017","01.11.2017",2017,11,1,0.906720903,2
"ENG_062_MZB_LO_1148","ENG_062_MZB_LO_1148-20.11.2018","20.11.2018",2018,11,20,0.825195004,3
"ENG_062_MZB_LO_1148","ENG_062_MZB_LO_1148-14.10.2019","14.10.2019",2019,10,14,0.905041059,3
"ENG_062_MZB_LO_1148","ENG_062_MZB_LO_1148-23.10.2020","23.10.2020",2020,10,23,0.82558072,3
"ENG_062_MZB_LO_1148","ENG_062_MZB_LO_1148-16.09.2021","16.09.2021",2021,9,16,0.994061096,3
"ENG_062_MZB_LO_1148","ENG_062_MZB_LO_1148-21.09.2022","21.09.2022",2022,9,21,0.870474787,4
"ENG_062_MZB_LO_1148","ENG_062_MZB_LO_1148-18.10.2023","18.10.2023",2023,10,18,0.975003049,2
"ENG_062_MZB_LO_1149","ENG_062_MZB_LO_1149-30.09.2003","30.09.2003",2003,9,30,1.029948299,1
"ENG_062_MZB_LO_1149","ENG_062_MZB_LO_1149-08.11.2004","08.11.2004",2004,11,8,1.051249434,1
"ENG_062_MZB_LO_1149","ENG_062_MZB_LO_1149-09.11.2005","09.11.2005",2005,11,9,1.149901342,2
"ENG_062_MZB_LO_1149","ENG_062_MZB_LO_1149-23.11.2006","23.11.2006",2006,11,23,1.1155333,1
"ENG_062_MZB_LO_1149","ENG_062_MZB_LO_1149-31.10.2007","31.10.2007",2007,10,31,1.176791795,4
"ENG_062_MZB_LO_1149","ENG_062_MZB_LO_1149-25.11.2008","25.11.2008",2008,11,25,1.067549842,3
"ENG_062_MZB_LO_1149","ENG_062_MZB_LO_1149-17.11.2009","17.11.2009",2009,11,17,1.170761369,2
"ENG_062_MZB_LO_1149","ENG_062_MZB_LO_1149-12.11.2010","12.11.2010",2010,11,12,1.17271514,1
"ENG_062_MZB_LO_1149","ENG_062_MZB_LO_1149-16.11.2011","16.11.2011",2011,11,16,1.15700306,1
"ENG_062_MZB_LO_1149","ENG_062_MZB_LO_1149-20.11.2013","20.11.2013",2013,11,20,1.096473901,2
"ENG_062_MZB_LO_1149","ENG_062_MZB_LO_1149-22.10.2014","22.10.2014",2014,10,22,1.046847066,3
"ENG_062_MZB_LO_1149","ENG_062_MZB_LO_1149-29.10.2015","29.10.2015",2015,10,29,1.134687092,1
"ENG_062_MZB_LO_1149","ENG_062_MZB_LO_1149-07.10.2016","07.10.2016",2016,10,7,1.086522813,1
"ENG_062_MZB_LO_1149","ENG_062_MZB_LO_1149-17.11.2017","17.11.2017",2017,11,17,1.107199622,1
"ENG_062_MZB_LO_1149","ENG_062_MZB_LO_1149-21.11.2018","21.11.2018",2018,11,21,1.178606297,1
"ENG_062_MZB_LO_1149","ENG_062_MZB_LO_1149-08.10.2019","08.10.2019",2019,10,8,1.043183745,2
"ENG_062_MZB_LO_1149","ENG_062_MZB_LO_1149-15.10.2020","15.10.2020",2020,10,15,1.152736179,1
"ENG_062_MZB_LO_1149","ENG_062_MZB_LO_1149-20.10.2021","20.10.2021",2021,10,20,1.189781914,1
"ENG_062_MZB_LO_1149","ENG_062_MZB_LO_1149-18.11.2022","18.11.2022",2022,11,18,1.009132317,3
"ENG_062_MZB_LO_1149","ENG_062_MZB_LO_1149-09.10.2023","09.10.2023",2023,10,9,1.162209657,1
"ENG_062_MZB_LO_115","ENG_062_MZB_LO_115-20.09.2002","20.09.2002",2002,9,20,0.898198258,2
"ENG_062_MZB_LO_115","ENG_062_MZB_LO_115-02.10.2003","02.10.2003",2003,10,2,0.923132764,2
"ENG_062_MZB_LO_115","ENG_062_MZB_LO_115-27.10.2004","27.10.2004",2004,10,27,0.810923048,3
"ENG_062_MZB_LO_115","ENG_062_MZB_LO_115-03.10.2005","03.10.2005",2005,10,3,0.917463891,2
"ENG_062_MZB_LO_115","ENG_062_MZB_LO_115-15.09.2006","15.09.2006",2006,9,15,0.881115826,2
"ENG_062_MZB_LO_115","ENG_062_MZB_LO_115-16.10.2007","16.10.2007",2007,10,16,1.006560672,1
"ENG_062_MZB_LO_115","ENG_062_MZB_LO_115-29.10.2008","29.10.2008",2008,10,29,0.972744884,2
"ENG_062_MZB_LO_115","ENG_062_MZB_LO_115-02.09.2009","02.09.2009",2009,9,2,0.9001288,2
"ENG_062_MZB_LO_115","ENG_062_MZB_LO_115-16.09.2010","16.09.2010",2010,9,16,0.872776112,2
"ENG_062_MZB_LO_115","ENG_062_MZB_LO_115-10.10.2018","10.10.2018",2018,10,10,0.878553588,2
"ENG_062_MZB_LO_115","ENG_062_MZB_LO_115-29.09.2020","29.09.2020",2020,9,29,0.928515573,2
"ENG_062_MZB_LO_1150","ENG_062_MZB_LO_1150-28.11.2003","28.11.2003",2003,11,28,0.924473978,2
"ENG_062_MZB_LO_1150","ENG_062_MZB_LO_1150-15.11.2006","15.11.2006",2006,11,15,1.101954637,1
"ENG_062_MZB_LO_1150","ENG_062_MZB_LO_1150-23.11.2009","23.11.2009",2009,11,23,1.188435684,1
"ENG_062_MZB_LO_1150","ENG_062_MZB_LO_1150-22.09.2010","22.09.2010",2010,9,22,1.157656704,1
"ENG_062_MZB_LO_1150","ENG_062_MZB_LO_1150-23.09.2011","23.09.2011",2011,9,23,1.106574604,1
"ENG_062_MZB_LO_1150","ENG_062_MZB_LO_1150-28.09.2012","28.09.2012",2012,9,28,1.136345086,1
"ENG_062_MZB_LO_1150","ENG_062_MZB_LO_1150-31.10.2013","31.10.2013",2013,10,31,1.089953587,1
"ENG_062_MZB_LO_1150","ENG_062_MZB_LO_1150-26.09.2014","26.09.2014",2014,9,26,1.11134863,1
"ENG_062_MZB_LO_1150","ENG_062_MZB_LO_1150-10.09.2015","10.09.2015",2015,9,10,1.011712438,3
"ENG_062_MZB_LO_1150","ENG_062_MZB_LO_1150-10.10.2016","10.10.2016",2016,10,10,1.207922419,1
"ENG_062_MZB_LO_1150","ENG_062_MZB_LO_1150-11.10.2017","11.10.2017",2017,10,11,1.036475307,1
"ENG_062_MZB_LO_1150","ENG_062_MZB_LO_1150-25.10.2018","25.10.2018",2018,10,25,1.065349856,1
"ENG_062_MZB_LO_1150","ENG_062_MZB_LO_1150-08.10.2019","08.10.2019",2019,10,8,1.154097183,1
"ENG_062_MZB_LO_1150","ENG_062_MZB_LO_1150-14.10.2020","14.10.2020",2020,10,14,1.123379288,1
"ENG_062_MZB_LO_1150","ENG_062_MZB_LO_1150-07.10.2021","07.10.2021",2021,10,7,1.127373414,1
"ENG_062_MZB_LO_1150","ENG_062_MZB_LO_1150-29.09.2022","29.09.2022",2022,9,29,1.06533487,2
"ENG_062_MZB_LO_1150","ENG_062_MZB_LO_1150-20.10.2023","20.10.2023",2023,10,20,1.156677754,1
"ENG_062_MZB_LO_1150","ENG_062_MZB_LO_1150-04.10.2024","04.10.2024",2024,10,4,1.097538669,1
"ENG_062_MZB_LO_1151","ENG_062_MZB_LO_1151-08.10.2002","08.10.2002",2002,10,8,0.961507705,2
"ENG_062_MZB_LO_1151","ENG_062_MZB_LO_1151-28.11.2003","28.11.2003",2003,11,28,0.976109653,1
"ENG_062_MZB_LO_1151","ENG_062_MZB_LO_1151-08.11.2004","08.11.2004",2004,11,8,1.011326067,1
"ENG_062_MZB_LO_1151","ENG_062_MZB_LO_1151-13.10.2005","13.10.2005",2005,10,13,0.966178913,1
"ENG_062_MZB_LO_1151","ENG_062_MZB_LO_1151-22.10.2008","22.10.2008",2008,10,22,1.010308899,1
"ENG_062_MZB_LO_1151","ENG_062_MZB_LO_1151-09.10.2013","09.10.2013",2013,10,9,1.004393648,2
"ENG_062_MZB_LO_1151","ENG_062_MZB_LO_1151-07.10.2014","07.10.2014",2014,10,7,1.1216117,1
"ENG_062_MZB_LO_1151","ENG_062_MZB_LO_1151-24.11.2017","24.11.2017",2017,11,24,1.060844753,1
"ENG_062_MZB_LO_1151","ENG_062_MZB_LO_1151-14.10.2020","14.10.2020",2020,10,14,1.110531336,1
"ENG_062_MZB_LO_1152","ENG_062_MZB_LO_1152-28.03.2002","28.03.2002",2002,3,28,1.03528147,1
"ENG_062_MZB_LO_1152","ENG_062_MZB_LO_1152-13.03.2003","13.03.2003",2003,3,13,1.061076423,1
"ENG_062_MZB_LO_1152","ENG_062_MZB_LO_1152-25.05.2004","25.05.2004",2004,5,25,1.043569174,1
"ENG_062_MZB_LO_1152","ENG_062_MZB_LO_1152-01.05.2007","01.05.2007",2007,5,1,0.946350539,2
"ENG_062_MZB_LO_1152","ENG_062_MZB_LO_1152-20.05.2013","20.05.2013",2013,5,20,1.001860914,1
"ENG_062_MZB_LO_1152","ENG_062_MZB_LO_1152-06.05.2016","06.05.2016",2016,5,6,1.024986284,1
"ENG_062_MZB_LO_1152","ENG_062_MZB_LO_1152-27.04.2022","27.04.2022",2022,4,27,1.010857203,1
"ENG_062_MZB_LO_1154","ENG_062_MZB_LO_1154-28.11.2003","28.11.2003",2003,11,28,1.010297066,1
"ENG_062_MZB_LO_1154","ENG_062_MZB_LO_1154-04.10.2004","04.10.2004",2004,10,4,1.169314422,1
"ENG_062_MZB_LO_1154","ENG_062_MZB_LO_1154-13.09.2005","13.09.2005",2005,9,13,1.141151304,1
"ENG_062_MZB_LO_1154","ENG_062_MZB_LO_1154-29.10.2007","29.10.2007",2007,10,29,1.135440247,1
"ENG_062_MZB_LO_1154","ENG_062_MZB_LO_1154-25.11.2009","25.11.2009",2009,11,25,1.099339173,1
"ENG_062_MZB_LO_1154","ENG_062_MZB_LO_1154-20.10.2010","20.10.2010",2010,10,20,1.216267643,1
"ENG_062_MZB_LO_1154","ENG_062_MZB_LO_1154-26.09.2011","26.09.2011",2011,9,26,1.203051724,1
"ENG_062_MZB_LO_1154","ENG_062_MZB_LO_1154-28.09.2012","28.09.2012",2012,9,28,1.157330434,1
"ENG_062_MZB_LO_1154","ENG_062_MZB_LO_1154-17.09.2013","17.09.2013",2013,9,17,1.138897627,2
"ENG_062_MZB_LO_1154","ENG_062_MZB_LO_1154-02.09.2015","02.09.2015",2015,9,2,1.178201592,1
"ENG_062_MZB_LO_1154","ENG_062_MZB_LO_1154-07.10.2016","07.10.2016",2016,10,7,1.256503222,1
"ENG_062_MZB_LO_1154","ENG_062_MZB_LO_1154-18.10.2017","18.10.2017",2017,10,18,1.220206055,1
"ENG_062_MZB_LO_1154","ENG_062_MZB_LO_1154-16.11.2018","16.11.2018",2018,11,16,1.144866386,1
"ENG_062_MZB_LO_1154","ENG_062_MZB_LO_1154-28.11.2019","28.11.2019",2019,11,28,1.108985247,4
"ENG_062_MZB_LO_1154","ENG_062_MZB_LO_1154-20.10.2020","20.10.2020",2020,10,20,1.233217012,1
"ENG_062_MZB_LO_1156","ENG_062_MZB_LO_1156-04.09.2003","04.09.2003",2003,9,4,0.632443443,4
"ENG_062_MZB_LO_1156","ENG_062_MZB_LO_1156-19.10.2004","19.10.2004",2004,10,19,0.613883891,4
"ENG_062_MZB_LO_1156","ENG_062_MZB_LO_1156-29.09.2005","29.09.2005",2005,9,29,0.606833765,4
"ENG_062_MZB_LO_1156","ENG_062_MZB_LO_1156-07.11.2007","07.11.2007",2007,11,7,0.780556698,3
"ENG_062_MZB_LO_1156","ENG_062_MZB_LO_1156-06.11.2008","06.11.2008",2008,11,6,0.920041635,3
"ENG_062_MZB_LO_1156","ENG_062_MZB_LO_1156-18.11.2009","18.11.2009",2009,11,18,0.829338861,3
"ENG_062_MZB_LO_1156","ENG_062_MZB_LO_1156-20.11.2010","20.11.2010",2010,11,20,0.783573271,3
"ENG_062_MZB_LO_1156","ENG_062_MZB_LO_1156-28.10.2011","28.10.2011",2011,10,28,0.771565302,3
"ENG_062_MZB_LO_1156","ENG_062_MZB_LO_1156-26.11.2013","26.11.2013",2013,11,26,0.694728445,4
"ENG_062_MZB_LO_1156","ENG_062_MZB_LO_1156-11.11.2014","11.11.2014",2014,11,11,0.759235276,3
"ENG_062_MZB_LO_1156","ENG_062_MZB_LO_1156-19.10.2015","19.10.2015",2015,10,19,0.737992278,3
"ENG_062_MZB_LO_1156","ENG_062_MZB_LO_1156-17.10.2016","17.10.2016",2016,10,17,0.873095632,3
"ENG_062_MZB_LO_1156","ENG_062_MZB_LO_1156-01.09.2017","01.09.2017",2017,9,1,0.824955849,3
"ENG_062_MZB_LO_1156","ENG_062_MZB_LO_1156-09.11.2018","09.11.2018",2018,11,9,0.641714437,4
"ENG_062_MZB_LO_1156","ENG_062_MZB_LO_1156-05.09.2019","05.09.2019",2019,9,5,0.686786721,4
"ENG_062_MZB_LO_1156","ENG_062_MZB_LO_1156-09.10.2020","09.10.2020",2020,10,9,0.762059177,3
"ENG_062_MZB_LO_116","ENG_062_MZB_LO_116-16.10.2002","16.10.2002",2002,10,16,0.790814853,3
"ENG_062_MZB_LO_116","ENG_062_MZB_LO_116-15.09.2003","15.09.2003",2003,9,15,0.800405401,3
"ENG_062_MZB_LO_116","ENG_062_MZB_LO_116-20.09.2004","20.09.2004",2004,9,20,0.824014068,3
"ENG_062_MZB_LO_116","ENG_062_MZB_LO_116-25.09.2007","25.09.2007",2007,9,25,1.005869565,3
"ENG_062_MZB_LO_116","ENG_062_MZB_LO_116-06.11.2008","06.11.2008",2008,11,6,0.848368201,3
"ENG_062_MZB_LO_116","ENG_062_MZB_LO_116-08.10.2009","08.10.2009",2009,10,8,0.852467531,3
"ENG_062_MZB_LO_116","ENG_062_MZB_LO_116-15.10.2010","15.10.2010",2010,10,15,0.89397829,2
"ENG_062_MZB_LO_116","ENG_062_MZB_LO_116-26.09.2014","26.09.2014",2014,9,26,0.884167288,2
"ENG_062_MZB_LO_116","ENG_062_MZB_LO_116-24.10.2017","24.10.2017",2017,10,24,0.937685396,2
"ENG_062_MZB_LO_1160","ENG_062_MZB_LO_1160-25.11.2003","25.11.2003",2003,11,25,0.764801962,3
"ENG_062_MZB_LO_1160","ENG_062_MZB_LO_1160-27.09.2004","27.09.2004",2004,9,27,0.761694321,3
"ENG_062_MZB_LO_1160","ENG_062_MZB_LO_1160-27.09.2005","27.09.2005",2005,9,27,0.662880394,4
"ENG_062_MZB_LO_1160","ENG_062_MZB_LO_1160-07.11.2007","07.11.2007",2007,11,7,0.798605366,3
"ENG_062_MZB_LO_1160","ENG_062_MZB_LO_1160-06.11.2008","06.11.2008",2008,11,6,0.867934646,2
"ENG_062_MZB_LO_1160","ENG_062_MZB_LO_1160-18.11.2009","18.11.2009",2009,11,18,0.821698705,3
"ENG_062_MZB_LO_1160","ENG_062_MZB_LO_1160-23.09.2010","23.09.2010",2010,9,23,0.714565522,4
"ENG_062_MZB_LO_1160","ENG_062_MZB_LO_1160-11.10.2011","11.10.2011",2011,10,11,0.703698022,4
"ENG_062_MZB_LO_1160","ENG_062_MZB_LO_1160-12.09.2012","12.09.2012",2012,9,12,0.810068294,3
"ENG_062_MZB_LO_1160","ENG_062_MZB_LO_1160-06.09.2013","06.09.2013",2013,9,6,0.640020753,5
"ENG_062_MZB_LO_1160","ENG_062_MZB_LO_1160-12.09.2014","12.09.2014",2014,9,12,0.877518685,2
"ENG_062_MZB_LO_1160","ENG_062_MZB_LO_1160-11.09.2015","11.09.2015",2015,9,11,0.724953008,4
"ENG_062_MZB_LO_1160","ENG_062_MZB_LO_1160-17.10.2016","17.10.2016",2016,10,17,0.85251461,3
"ENG_062_MZB_LO_1160","ENG_062_MZB_LO_1160-01.09.2017","01.09.2017",2017,9,1,0.777521992,3
"ENG_062_MZB_LO_1160","ENG_062_MZB_LO_1160-15.11.2018","15.11.2018",2018,11,15,0.828743885,3
"ENG_062_MZB_LO_1160","ENG_062_MZB_LO_1160-05.09.2019","05.09.2019",2019,9,5,0.732857947,3
"ENG_062_MZB_LO_1168","ENG_062_MZB_LO_1168-27.09.2002","27.09.2002",2002,9,27,0.764097165,3
"ENG_062_MZB_LO_1168","ENG_062_MZB_LO_1168-02.10.2003","02.10.2003",2003,10,2,0.837063832,3
"ENG_062_MZB_LO_1168","ENG_062_MZB_LO_1168-18.10.2005","18.10.2005",2005,10,18,0.8454038,3
"ENG_062_MZB_LO_1168","ENG_062_MZB_LO_1168-03.11.2006","03.11.2006",2006,11,3,0.954270913,2
"ENG_062_MZB_LO_1168","ENG_062_MZB_LO_1168-23.10.2008","23.10.2008",2008,10,23,0.993409858,3
"ENG_062_MZB_LO_1168","ENG_062_MZB_LO_1168-23.09.2013","23.09.2013",2013,9,23,0.932379133,2
"ENG_062_MZB_LO_1168","ENG_062_MZB_LO_1168-19.09.2014","19.09.2014",2014,9,19,0.877372753,3
"ENG_062_MZB_LO_117","ENG_062_MZB_LO_117-02.10.2002","02.10.2002",2002,10,2,0.913117789,2
"ENG_062_MZB_LO_117","ENG_062_MZB_LO_117-08.09.2003","08.09.2003",2003,9,8,0.890231715,2
"ENG_062_MZB_LO_117","ENG_062_MZB_LO_117-30.09.2004","30.09.2004",2004,9,30,0.824866741,3
"ENG_062_MZB_LO_117","ENG_062_MZB_LO_117-04.10.2005","04.10.2005",2005,10,4,0.853955376,3
"ENG_062_MZB_LO_117","ENG_062_MZB_LO_117-02.10.2006","02.10.2006",2006,10,2,0.719431884,4
"ENG_062_MZB_LO_117","ENG_062_MZB_LO_117-17.10.2007","17.10.2007",2007,10,17,0.898240562,2
"ENG_062_MZB_LO_117","ENG_062_MZB_LO_117-24.10.2008","24.10.2008",2008,10,24,0.897729886,2
"ENG_062_MZB_LO_117","ENG_062_MZB_LO_117-16.09.2009","16.09.2009",2009,9,16,0.997365484,1
"ENG_062_MZB_LO_117","ENG_062_MZB_LO_117-06.10.2010","06.10.2010",2010,10,6,0.950143634,2
"ENG_062_MZB_LO_117","ENG_062_MZB_LO_117-11.09.2015","11.09.2015",2015,9,11,0.916897048,2
"ENG_062_MZB_LO_1171","ENG_062_MZB_LO_1171-02.09.2002","02.09.2002",2002,9,2,1.151373075,1
"ENG_062_MZB_LO_1171","ENG_062_MZB_LO_1171-26.09.2003","26.09.2003",2003,9,26,1.130808979,1
"ENG_062_MZB_LO_1171","ENG_062_MZB_LO_1171-01.11.2004","01.11.2004",2004,11,1,1.06493902,1
"ENG_062_MZB_LO_1171","ENG_062_MZB_LO_1171-05.10.2006","05.10.2006",2006,10,5,1.083585759,1
"ENG_062_MZB_LO_1171","ENG_062_MZB_LO_1171-01.11.2007","01.11.2007",2007,11,1,1.093613879,1
"ENG_062_MZB_LO_1171","ENG_062_MZB_LO_1171-26.09.2008","26.09.2008",2008,9,26,1.093403155,1
"ENG_062_MZB_LO_1171","ENG_062_MZB_LO_1171-21.09.2009","21.09.2009",2009,9,21,1.062355249,1
"ENG_062_MZB_LO_1171","ENG_062_MZB_LO_1171-12.10.2010","12.10.2010",2010,10,12,1.092318721,1
"ENG_062_MZB_LO_1171","ENG_062_MZB_LO_1171-04.10.2013","04.10.2013",2013,10,4,1.043264243,1
"ENG_062_MZB_LO_1172","ENG_062_MZB_LO_1172-13.10.2004","13.10.2004",2004,10,13,0.930820729,2
"ENG_062_MZB_LO_1172","ENG_062_MZB_LO_1172-02.10.2008","02.10.2008",2008,10,2,0.862759313,3
"ENG_062_MZB_LO_1172","ENG_062_MZB_LO_1172-28.10.2009","28.10.2009",2009,10,28,0.860620151,3
"ENG_062_MZB_LO_1172","ENG_062_MZB_LO_1172-13.10.2010","13.10.2010",2010,10,13,0.949278987,2
"ENG_062_MZB_LO_1172","ENG_062_MZB_LO_1172-18.10.2011","18.10.2011",2011,10,18,0.899748349,2
"ENG_062_MZB_LO_1172","ENG_062_MZB_LO_1172-15.11.2012","15.11.2012",2012,11,15,0.871972253,3
"ENG_062_MZB_LO_1172","ENG_062_MZB_LO_1172-20.11.2013","20.11.2013",2013,11,20,0.921519725,2
"ENG_062_MZB_LO_1172","ENG_062_MZB_LO_1172-07.11.2014","07.11.2014",2014,11,7,0.965841366,2
"ENG_062_MZB_LO_1172","ENG_062_MZB_LO_1172-21.10.2015","21.10.2015",2015,10,21,0.926922498,2
"ENG_062_MZB_LO_1172","ENG_062_MZB_LO_1172-07.11.2016","07.11.2016",2016,11,7,0.86765146,2
"ENG_062_MZB_LO_1172","ENG_062_MZB_LO_1172-18.10.2017","18.10.2017",2017,10,18,0.911287994,2
"ENG_062_MZB_LO_1172","ENG_062_MZB_LO_1172-08.10.2018","08.10.2018",2018,10,8,0.869450065,2
"ENG_062_MZB_LO_1173","ENG_062_MZB_LO_1173-22.10.2002","22.10.2002",2002,10,22,0.691441351,4
"ENG_062_MZB_LO_1173","ENG_062_MZB_LO_1173-30.10.2003","30.10.2003",2003,10,30,0.747423481,4
"ENG_062_MZB_LO_1173","ENG_062_MZB_LO_1173-22.09.2004","22.09.2004",2004,9,22,0.815149151,3
"ENG_062_MZB_LO_1173","ENG_062_MZB_LO_1173-25.10.2005","25.10.2005",2005,10,25,0.74355248,3
"ENG_062_MZB_LO_1173","ENG_062_MZB_LO_1173-28.09.2006","28.09.2006",2006,9,28,0.882675539,2
"ENG_062_MZB_LO_1173","ENG_062_MZB_LO_1173-24.10.2007","24.10.2007",2007,10,24,0.754593457,4
"ENG_062_MZB_LO_1173","ENG_062_MZB_LO_1173-09.09.2008","09.09.2008",2008,9,9,0.811830204,3
"ENG_062_MZB_LO_1173","ENG_062_MZB_LO_1173-08.09.2009","08.09.2009",2009,9,8,0.825979846,3
"ENG_062_MZB_LO_1173","ENG_062_MZB_LO_1173-18.11.2013","18.11.2013",2013,11,18,0.782941486,3
"ENG_062_MZB_LO_1174","ENG_062_MZB_LO_1174-31.10.2006","31.10.2006",2006,10,31,1.162646159,1
"ENG_062_MZB_LO_1174","ENG_062_MZB_LO_1174-17.09.2009","17.09.2009",2009,9,17,0.98237603,2
"ENG_062_MZB_LO_1174","ENG_062_MZB_LO_1174-02.10.2017","02.10.2017",2017,10,2,1.157409774,1
"ENG_062_MZB_LO_1174","ENG_062_MZB_LO_1174-12.10.2018","12.10.2018",2018,10,12,1.157588336,1
"ENG_062_MZB_LO_1174","ENG_062_MZB_LO_1174-03.10.2019","03.10.2019",2019,10,3,1.128641351,1
"ENG_062_MZB_LO_1174","ENG_062_MZB_LO_1174-24.09.2020","24.09.2020",2020,9,24,1.186255199,1
"ENG_062_MZB_LO_1174","ENG_062_MZB_LO_1174-03.11.2021","03.11.2021",2021,11,3,1.152756545,1
"ENG_062_MZB_LO_1174","ENG_062_MZB_LO_1174-02.11.2022","02.11.2022",2022,11,2,1.169132304,1
"ENG_062_MZB_LO_1175","ENG_062_MZB_LO_1175-30.10.2003","30.10.2003",2003,10,30,1.001910935,1
"ENG_062_MZB_LO_1175","ENG_062_MZB_LO_1175-10.11.2005","10.11.2005",2005,11,10,0.960799392,2
"ENG_062_MZB_LO_1175","ENG_062_MZB_LO_1175-10.10.2006","10.10.2006",2006,10,10,1.015289441,1
"ENG_062_MZB_LO_1175","ENG_062_MZB_LO_1175-06.09.2013","06.09.2013",2013,9,6,0.950525936,2
"ENG_062_MZB_LO_1175","ENG_062_MZB_LO_1175-11.09.2014","11.09.2014",2014,9,11,0.96393287,2
"ENG_062_MZB_LO_1175","ENG_062_MZB_LO_1175-15.10.2020","15.10.2020",2020,10,15,0.822424223,3
"ENG_062_MZB_LO_1175","ENG_062_MZB_LO_1175-26.10.2021","26.10.2021",2021,10,26,0.887062836,2
"ENG_062_MZB_LO_1176","ENG_062_MZB_LO_1176-07.11.2002","07.11.2002",2002,11,7,1.017472057,5
"ENG_062_MZB_LO_1176","ENG_062_MZB_LO_1176-16.10.2003","16.10.2003",2003,10,16,1.130154493,5
"ENG_062_MZB_LO_1176","ENG_062_MZB_LO_1176-27.10.2006","27.10.2006",2006,10,27,0.919754595,3
"ENG_062_MZB_LO_1176","ENG_062_MZB_LO_1176-19.10.2007","19.10.2007",2007,10,19,0.940758455,3
"ENG_062_MZB_LO_1176","ENG_062_MZB_LO_1176-12.11.2008","12.11.2008",2008,11,12,0.86596767,4
"ENG_062_MZB_LO_1176","ENG_062_MZB_LO_1176-09.11.2009","09.11.2009",2009,11,9,1.049884483,5
"ENG_062_MZB_LO_1176","ENG_062_MZB_LO_1176-15.11.2010","15.11.2010",2010,11,15,0.944259757,2
"ENG_062_MZB_LO_1176","ENG_062_MZB_LO_1176-13.09.2011","13.09.2011",2011,9,13,1.045966217,3
"ENG_062_MZB_LO_1176","ENG_062_MZB_LO_1176-04.10.2012","04.10.2012",2012,10,4,0.952493285,2
"ENG_062_MZB_LO_1176","ENG_062_MZB_LO_1176-08.10.2013","08.10.2013",2013,10,8,1.034462797,2
"ENG_062_MZB_LO_1176","ENG_062_MZB_LO_1176-03.09.2014","03.09.2014",2014,9,3,1.035144339,2
"ENG_062_MZB_LO_1179","ENG_062_MZB_LO_1179-03.04.2002","03.04.2002",2002,4,3,0.956126963,2
"ENG_062_MZB_LO_1179","ENG_062_MZB_LO_1179-09.05.2005","09.05.2005",2005,5,9,0.938710193,2
"ENG_062_MZB_LO_1179","ENG_062_MZB_LO_1179-05.05.2006","05.05.2006",2006,5,5,0.990566782,1
"ENG_062_MZB_LO_1179","ENG_062_MZB_LO_1179-21.05.2008","21.05.2008",2008,5,21,0.942065363,2
"ENG_062_MZB_LO_1179","ENG_062_MZB_LO_1179-03.04.2017","03.04.2017",2017,4,3,0.997511203,2
"ENG_062_MZB_LO_1179","ENG_062_MZB_LO_1179-05.04.2018","05.04.2018",2018,4,5,1.019745755,1
"ENG_062_MZB_LO_1179","ENG_062_MZB_LO_1179-29.04.2019","29.04.2019",2019,4,29,0.973998756,1
"ENG_062_MZB_LO_118","ENG_062_MZB_LO_118-18.09.2002","18.09.2002",2002,9,18,0.914968025,2
"ENG_062_MZB_LO_118","ENG_062_MZB_LO_118-24.10.2003","24.10.2003",2003,10,24,1.032823482,1
"ENG_062_MZB_LO_118","ENG_062_MZB_LO_118-07.10.2004","07.10.2004",2004,10,7,1.025599173,1
"ENG_062_MZB_LO_118","ENG_062_MZB_LO_118-02.11.2006","02.11.2006",2006,11,2,0.968693644,1
"ENG_062_MZB_LO_118","ENG_062_MZB_LO_118-17.09.2007","17.09.2007",2007,9,17,1.039837712,1
"ENG_062_MZB_LO_118","ENG_062_MZB_LO_118-26.11.2008","26.11.2008",2008,11,26,1.001869177,1
"ENG_062_MZB_LO_118","ENG_062_MZB_LO_118-05.10.2009","05.10.2009",2009,10,5,0.98510126,1
"ENG_062_MZB_LO_118","ENG_062_MZB_LO_118-05.10.2010","05.10.2010",2010,10,5,1.058283161,1
"ENG_062_MZB_LO_118","ENG_062_MZB_LO_118-11.10.2012","11.10.2012",2012,10,11,0.97403784,1
"ENG_062_MZB_LO_118","ENG_062_MZB_LO_118-10.09.2013","10.09.2013",2013,9,10,0.934629612,2
"ENG_062_MZB_LO_118","ENG_062_MZB_LO_118-05.09.2014","05.09.2014",2014,9,5,0.946175926,2
"ENG_062_MZB_LO_118","ENG_062_MZB_LO_118-17.09.2015","17.09.2015",2015,9,17,0.941804217,2
"ENG_062_MZB_LO_118","ENG_062_MZB_LO_118-22.09.2016","22.09.2016",2016,9,22,1.016030598,1
"ENG_062_MZB_LO_118","ENG_062_MZB_LO_118-19.10.2017","19.10.2017",2017,10,19,0.967856947,2
"ENG_062_MZB_LO_118","ENG_062_MZB_LO_118-11.09.2018","11.09.2018",2018,9,11,0.973822894,1
"ENG_062_MZB_LO_118","ENG_062_MZB_LO_118-24.10.2019","24.10.2019",2019,10,24,0.948386004,2
"ENG_062_MZB_LO_118","ENG_062_MZB_LO_118-21.10.2020","21.10.2020",2020,10,21,0.896954302,2
"ENG_062_MZB_LO_118","ENG_062_MZB_LO_118-11.10.2021","11.10.2021",2021,10,11,0.920084336,2
"ENG_062_MZB_LO_1182","ENG_062_MZB_LO_1182-18.10.2002","18.10.2002",2002,10,18,1.072404711,1
"ENG_062_MZB_LO_1182","ENG_062_MZB_LO_1182-10.09.2003","10.09.2003",2003,9,10,1.074342995,1
"ENG_062_MZB_LO_1182","ENG_062_MZB_LO_1182-07.10.2004","07.10.2004",2004,10,7,1.076056965,1
"ENG_062_MZB_LO_1182","ENG_062_MZB_LO_1182-01.11.2007","01.11.2007",2007,11,1,1.028589782,1
"ENG_062_MZB_LO_1182","ENG_062_MZB_LO_1182-03.10.2008","03.10.2008",2008,10,3,1.089099637,1
"ENG_062_MZB_LO_1182","ENG_062_MZB_LO_1182-28.09.2010","28.09.2010",2010,9,28,1.076658715,1
"ENG_062_MZB_LO_1182","ENG_062_MZB_LO_1182-14.09.2012","14.09.2012",2012,9,14,1.108129227,1
"ENG_062_MZB_LO_1182","ENG_062_MZB_LO_1182-02.10.2013","02.10.2013",2013,10,2,1.106304158,1
"ENG_062_MZB_LO_1182","ENG_062_MZB_LO_1182-18.09.2014","18.09.2014",2014,9,18,1.117294123,1
"ENG_062_MZB_LO_1182","ENG_062_MZB_LO_1182-01.10.2015","01.10.2015",2015,10,1,1.10595563,1
"ENG_062_MZB_LO_1182","ENG_062_MZB_LO_1182-14.09.2016","14.09.2016",2016,9,14,1.175225764,1
"ENG_062_MZB_LO_1182","ENG_062_MZB_LO_1182-18.09.2017","18.09.2017",2017,9,18,1.168958622,1
"ENG_062_MZB_LO_1182","ENG_062_MZB_LO_1182-17.10.2018","17.10.2018",2018,10,17,1.205056575,1
"ENG_062_MZB_LO_1182","ENG_062_MZB_LO_1182-15.10.2019","15.10.2019",2019,10,15,1.182007052,1
"ENG_062_MZB_LO_1182","ENG_062_MZB_LO_1182-13.10.2020","13.10.2020",2020,10,13,1.15141774,1
"ENG_062_MZB_LO_1182","ENG_062_MZB_LO_1182-12.10.2021","12.10.2021",2021,10,12,1.113216686,1
"ENG_062_MZB_LO_1182","ENG_062_MZB_LO_1182-07.10.2022","07.10.2022",2022,10,7,1.161846523,1
"ENG_062_MZB_LO_1182","ENG_062_MZB_LO_1182-27.09.2023","27.09.2023",2023,9,27,1.094453988,1
"ENG_062_MZB_LO_1183","ENG_062_MZB_LO_1183-17.09.2002","17.09.2002",2002,9,17,0.926820255,2
"ENG_062_MZB_LO_1183","ENG_062_MZB_LO_1183-23.10.2003","23.10.2003",2003,10,23,0.769955521,3
"ENG_062_MZB_LO_1183","ENG_062_MZB_LO_1183-10.11.2005","10.11.2005",2005,11,10,0.927655465,2
"ENG_062_MZB_LO_1183","ENG_062_MZB_LO_1183-02.10.2008","02.10.2008",2008,10,2,0.970173684,2
"ENG_062_MZB_LO_1183","ENG_062_MZB_LO_1183-28.10.2009","28.10.2009",2009,10,28,0.969778053,1
"ENG_062_MZB_LO_1183","ENG_062_MZB_LO_1183-13.10.2010","13.10.2010",2010,10,13,0.950962965,2
"ENG_062_MZB_LO_1183","ENG_062_MZB_LO_1183-18.10.2011","18.10.2011",2011,10,18,0.932148288,2
"ENG_062_MZB_LO_1183","ENG_062_MZB_LO_1183-13.11.2012","13.11.2012",2012,11,13,0.999215015,1
"ENG_062_MZB_LO_1183","ENG_062_MZB_LO_1183-02.10.2013","02.10.2013",2013,10,2,1.039084512,1
"ENG_062_MZB_LO_1183","ENG_062_MZB_LO_1183-06.10.2014","06.10.2014",2014,10,6,1.011332787,1
"ENG_062_MZB_LO_1183","ENG_062_MZB_LO_1183-08.10.2015","08.10.2015",2015,10,8,1.062933801,1
"ENG_062_MZB_LO_1183","ENG_062_MZB_LO_1183-31.10.2016","31.10.2016",2016,10,31,1.03973487,1
"ENG_062_MZB_LO_1183","ENG_062_MZB_LO_1183-18.10.2017","18.10.2017",2017,10,18,1.045292889,1
"ENG_062_MZB_LO_1183","ENG_062_MZB_LO_1183-03.10.2018","03.10.2018",2018,10,3,1.043157116,1
"ENG_062_MZB_LO_1183","ENG_062_MZB_LO_1183-08.10.2019","08.10.2019",2019,10,8,1.076464889,1
"ENG_062_MZB_LO_1183","ENG_062_MZB_LO_1183-10.09.2020","10.09.2020",2020,9,10,1.035220038,1
"ENG_062_MZB_LO_1183","ENG_062_MZB_LO_1183-25.10.2021","25.10.2021",2021,10,25,1.038365249,1
"ENG_062_MZB_LO_1183","ENG_062_MZB_LO_1183-22.09.2022","22.09.2022",2022,9,22,0.918949731,2
"ENG_062_MZB_LO_1183","ENG_062_MZB_LO_1183-30.10.2023","30.10.2023",2023,10,30,1.020270384,1
"ENG_062_MZB_LO_1184","ENG_062_MZB_LO_1184-02.10.2002","02.10.2002",2002,10,2,1.136609421,1
"ENG_062_MZB_LO_1184","ENG_062_MZB_LO_1184-01.10.2003","01.10.2003",2003,10,1,1.026823125,1
"ENG_062_MZB_LO_1184","ENG_062_MZB_LO_1184-13.10.2004","13.10.2004",2004,10,13,1.002703602,1
"ENG_062_MZB_LO_1184","ENG_062_MZB_LO_1184-11.10.2006","11.10.2006",2006,10,11,1.050268241,1
"ENG_062_MZB_LO_1184","ENG_062_MZB_LO_1184-22.10.2007","22.10.2007",2007,10,22,1.033802323,1
"ENG_062_MZB_LO_1184","ENG_062_MZB_LO_1184-10.10.2013","10.10.2013",2013,10,10,1.065022732,1
"ENG_062_MZB_LO_1184","ENG_062_MZB_LO_1184-04.11.2015","04.11.2015",2015,11,4,1.10187767,3
"ENG_062_MZB_LO_1186","ENG_062_MZB_LO_1186-11.09.2002","11.09.2002",2002,9,11,0.869574099,2
"ENG_062_MZB_LO_1186","ENG_062_MZB_LO_1186-09.09.2003","09.09.2003",2003,9,9,0.727641881,3
"ENG_062_MZB_LO_1186","ENG_062_MZB_LO_1186-18.11.2004","18.11.2004",2004,11,18,0.750102362,3
"ENG_062_MZB_LO_1186","ENG_062_MZB_LO_1186-16.11.2005","16.11.2005",2005,11,16,0.756743285,3
"ENG_062_MZB_LO_1186","ENG_062_MZB_LO_1186-30.11.2006","30.11.2006",2006,11,30,0.730210433,3
"ENG_062_MZB_LO_1186","ENG_062_MZB_LO_1186-27.09.2007","27.09.2007",2007,9,27,0.757750322,3
"ENG_062_MZB_LO_1186","ENG_062_MZB_LO_1186-14.10.2009","14.10.2009",2009,10,14,0.791679773,3
"ENG_062_MZB_LO_1186","ENG_062_MZB_LO_1186-18.11.2013","18.11.2013",2013,11,18,0.810470233,3
"ENG_062_MZB_LO_1186","ENG_062_MZB_LO_1186-24.09.2015","24.09.2015",2015,9,24,0.762691078,5
"ENG_062_MZB_LO_1186","ENG_062_MZB_LO_1186-02.10.2018","02.10.2018",2018,10,2,0.786245353,3
"ENG_062_MZB_LO_1191","ENG_062_MZB_LO_1191-27.09.2002","27.09.2002",2002,9,27,1.148834768,2
"ENG_062_MZB_LO_1191","ENG_062_MZB_LO_1191-13.11.2003","13.11.2003",2003,11,13,1.054430998,1
"ENG_062_MZB_LO_1191","ENG_062_MZB_LO_1191-06.10.2004","06.10.2004",2004,10,6,1.096070501,1
"ENG_062_MZB_LO_1191","ENG_062_MZB_LO_1191-07.09.2005","07.09.2005",2005,9,7,0.917378413,2
"ENG_062_MZB_LO_1191","ENG_062_MZB_LO_1191-08.09.2006","08.09.2006",2006,9,8,1.10142552,2
"ENG_062_MZB_LO_1191","ENG_062_MZB_LO_1191-25.09.2008","25.09.2008",2008,9,25,0.942245615,3
"ENG_062_MZB_LO_1191","ENG_062_MZB_LO_1191-13.11.2013","13.11.2013",2013,11,13,1.046274658,5
"ENG_062_MZB_LO_1191","ENG_062_MZB_LO_1191-09.10.2014","09.10.2014",2014,10,9,1.156340713,1
"ENG_062_MZB_LO_1191","ENG_062_MZB_LO_1191-05.11.2021","05.11.2021",2021,11,5,1.121650882,1
"ENG_062_MZB_LO_1191","ENG_062_MZB_LO_1191-14.11.2022","14.11.2022",2022,11,14,1.133497707,1
"ENG_062_MZB_LO_1191","ENG_062_MZB_LO_1191-15.09.2023","15.09.2023",2023,9,15,1.161896385,1
"ENG_062_MZB_LO_1192","ENG_062_MZB_LO_1192-28.09.2004","28.09.2004",2004,9,28,1.009266771,1
"ENG_062_MZB_LO_1192","ENG_062_MZB_LO_1192-10.10.2007","10.10.2007",2007,10,10,0.934071766,2
"ENG_062_MZB_LO_1192","ENG_062_MZB_LO_1192-10.09.2009","10.09.2009",2009,9,10,0.97686843,1
"ENG_062_MZB_LO_1192","ENG_062_MZB_LO_1192-04.10.2010","04.10.2010",2010,10,4,0.889241448,2
"ENG_062_MZB_LO_1192","ENG_062_MZB_LO_1192-10.11.2016","10.11.2016",2016,11,10,1.051158262,1
"ENG_062_MZB_LO_1192","ENG_062_MZB_LO_1192-12.10.2017","12.10.2017",2017,10,12,0.950594277,2
"ENG_062_MZB_LO_1192","ENG_062_MZB_LO_1192-20.11.2018","20.11.2018",2018,11,20,1.04695554,1
"ENG_062_MZB_LO_1192","ENG_062_MZB_LO_1192-24.09.2019","24.09.2019",2019,9,24,1.072188726,1
"ENG_062_MZB_LO_1192","ENG_062_MZB_LO_1192-03.11.2021","03.11.2021",2021,11,3,0.976829549,2
"ENG_062_MZB_LO_1192","ENG_062_MZB_LO_1192-05.10.2022","05.10.2022",2022,10,5,0.90925299,2
"ENG_062_MZB_LO_1194","ENG_062_MZB_LO_1194-25.09.2002","25.09.2002",2002,9,25,1.174915804,1
"ENG_062_MZB_LO_1194","ENG_062_MZB_LO_1194-01.10.2003","01.10.2003",2003,10,1,1.133644087,1
"ENG_062_MZB_LO_1194","ENG_062_MZB_LO_1194-22.10.2004","22.10.2004",2004,10,22,1.134242829,1
"ENG_062_MZB_LO_1194","ENG_062_MZB_LO_1194-28.10.2005","28.10.2005",2005,10,28,1.114155369,1
"ENG_062_MZB_LO_1194","ENG_062_MZB_LO_1194-09.11.2006","09.11.2006",2006,11,9,1.083658624,1
"ENG_062_MZB_LO_1194","ENG_062_MZB_LO_1194-11.11.2009","11.11.2009",2009,11,11,1.096901524,1
"ENG_062_MZB_LO_1194","ENG_062_MZB_LO_1194-16.11.2010","16.11.2010",2010,11,16,1.140769247,1
"ENG_062_MZB_LO_1194","ENG_062_MZB_LO_1194-22.09.2011","22.09.2011",2011,9,22,1.163343503,1
"ENG_062_MZB_LO_1194","ENG_062_MZB_LO_1194-03.10.2013","03.10.2013",2013,10,3,1.137844197,1
"ENG_062_MZB_LO_1194","ENG_062_MZB_LO_1194-18.09.2014","18.09.2014",2014,9,18,1.157014226,1
"ENG_062_MZB_LO_1194","ENG_062_MZB_LO_1194-15.10.2015","15.10.2015",2015,10,15,1.162125845,1
"ENG_062_MZB_LO_1194","ENG_062_MZB_LO_1194-14.09.2016","14.09.2016",2016,9,14,1.143454593,1
"ENG_062_MZB_LO_1194","ENG_062_MZB_LO_1194-20.09.2017","20.09.2017",2017,9,20,1.247251699,1
"ENG_062_MZB_LO_1194","ENG_062_MZB_LO_1194-05.11.2018","05.11.2018",2018,11,5,1.186454626,1
"ENG_062_MZB_LO_1194","ENG_062_MZB_LO_1194-01.11.2019","01.11.2019",2019,11,1,1.048298999,1
"ENG_062_MZB_LO_1195","ENG_062_MZB_LO_1195-04.10.2002","04.10.2002",2002,10,4,1.123462962,1
"ENG_062_MZB_LO_1195","ENG_062_MZB_LO_1195-10.09.2003","10.09.2003",2003,9,10,1.013933926,1
"ENG_062_MZB_LO_1195","ENG_062_MZB_LO_1195-08.10.2004","08.10.2004",2004,10,8,1.035552335,1
"ENG_062_MZB_LO_1195","ENG_062_MZB_LO_1195-05.10.2005","05.10.2005",2005,10,5,0.938907997,2
"ENG_062_MZB_LO_1195","ENG_062_MZB_LO_1195-12.09.2007","12.09.2007",2007,9,12,1.077385303,1
"ENG_062_MZB_LO_1195","ENG_062_MZB_LO_1195-03.10.2008","03.10.2008",2008,10,3,1.083498659,1
"ENG_062_MZB_LO_1195","ENG_062_MZB_LO_1195-13.10.2009","13.10.2009",2009,10,13,1.052175739,1
"ENG_062_MZB_LO_1195","ENG_062_MZB_LO_1195-16.11.2010","16.11.2010",2010,11,16,1.129108647,1
"ENG_062_MZB_LO_1195","ENG_062_MZB_LO_1195-22.09.2011","22.09.2011",2011,9,22,1.007857217,1
"ENG_062_MZB_LO_1195","ENG_062_MZB_LO_1195-18.09.2012","18.09.2012",2012,9,18,1.054477362,1
"ENG_062_MZB_LO_1195","ENG_062_MZB_LO_1195-25.10.2013","25.10.2013",2013,10,25,1.045896247,1
"ENG_062_MZB_LO_1195","ENG_062_MZB_LO_1195-01.10.2015","01.10.2015",2015,10,1,1.217232185,1
"ENG_062_MZB_LO_1195","ENG_062_MZB_LO_1195-18.09.2017","18.09.2017",2017,9,18,1.047787944,1
"ENG_062_MZB_LO_1195","ENG_062_MZB_LO_1195-08.11.2018","08.11.2018",2018,11,8,1.053786967,1
"ENG_062_MZB_LO_1195","ENG_062_MZB_LO_1195-15.10.2019","15.10.2019",2019,10,15,1.0487029,1
"ENG_062_MZB_LO_1195","ENG_062_MZB_LO_1195-12.10.2021","12.10.2021",2021,10,12,1.054519577,1
"ENG_062_MZB_LO_1195","ENG_062_MZB_LO_1195-07.10.2022","07.10.2022",2022,10,7,1.048724228,1
"ENG_062_MZB_LO_1195","ENG_062_MZB_LO_1195-27.09.2023","27.09.2023",2023,9,27,1.040724862,1
"ENG_062_MZB_LO_1198","ENG_062_MZB_LO_1198-04.10.2002","04.10.2002",2002,10,4,0.931586408,2
"ENG_062_MZB_LO_1198","ENG_062_MZB_LO_1198-10.10.2005","10.10.2005",2005,10,10,0.866502881,2
"ENG_062_MZB_LO_1198","ENG_062_MZB_LO_1198-25.09.2008","25.09.2008",2008,9,25,0.870134507,2
"ENG_062_MZB_LO_1198","ENG_062_MZB_LO_1198-26.09.2013","26.09.2013",2013,9,26,0.780995269,5
"ENG_062_MZB_LO_1198","ENG_062_MZB_LO_1198-16.09.2015","16.09.2015",2015,9,16,0.788807899,3
"ENG_062_MZB_LO_1198","ENG_062_MZB_LO_1198-01.10.2018","01.10.2018",2018,10,1,0.760560096,5
"ENG_062_MZB_LO_1198","ENG_062_MZB_LO_1198-05.10.2022","05.10.2022",2022,10,5,0.697765308,5
"ENG_062_MZB_LO_1199","ENG_062_MZB_LO_1199-02.09.2002","02.09.2002",2002,9,2,1.014344041,1
"ENG_062_MZB_LO_1199","ENG_062_MZB_LO_1199-10.09.2003","10.09.2003",2003,9,10,1.037509531,1
"ENG_062_MZB_LO_1199","ENG_062_MZB_LO_1199-07.10.2004","07.10.2004",2004,10,7,1.046470801,1
"ENG_062_MZB_LO_1199","ENG_062_MZB_LO_1199-05.10.2005","05.10.2005",2005,10,5,1.027704424,1
"ENG_062_MZB_LO_1199","ENG_062_MZB_LO_1199-01.11.2007","01.11.2007",2007,11,1,1.029531754,1
"ENG_062_MZB_LO_1199","ENG_062_MZB_LO_1199-30.10.2008","30.10.2008",2008,10,30,1.122241158,1
"ENG_062_MZB_LO_1199","ENG_062_MZB_LO_1199-17.10.2018","17.10.2018",2018,10,17,1.090927985,1
"ENG_062_MZB_LO_1199","ENG_062_MZB_LO_1199-18.10.2019","18.10.2019",2019,10,18,1.136721372,1
"ENG_062_MZB_LO_1199","ENG_062_MZB_LO_1199-13.10.2020","13.10.2020",2020,10,13,1.177801156,1
"ENG_062_MZB_LO_1199","ENG_062_MZB_LO_1199-12.10.2021","12.10.2021",2021,10,12,1.071827923,1
"ENG_062_MZB_LO_1199","ENG_062_MZB_LO_1199-07.10.2022","07.10.2022",2022,10,7,1.085388024,1
"ENG_062_MZB_LO_1199","ENG_062_MZB_LO_1199-27.09.2023","27.09.2023",2023,9,27,1.100238027,1
"ENG_062_MZB_LO_1200","ENG_062_MZB_LO_1200-07.10.2003","07.10.2003",2003,10,7,1.001134219,1
"ENG_062_MZB_LO_1200","ENG_062_MZB_LO_1200-07.10.2004","07.10.2004",2004,10,7,0.94650547,2
"ENG_062_MZB_LO_1200","ENG_062_MZB_LO_1200-14.10.2005","14.10.2005",2005,10,14,1.038765697,1
"ENG_062_MZB_LO_1200","ENG_062_MZB_LO_1200-16.10.2008","16.10.2008",2008,10,16,0.990458124,3
"ENG_062_MZB_LO_1200","ENG_062_MZB_LO_1200-21.10.2013","21.10.2013",2013,10,21,1.050157327,2
"ENG_062_MZB_LO_1200","ENG_062_MZB_LO_1200-26.09.2014","26.09.2014",2014,9,26,1.055524687,1
"ENG_062_MZB_LO_1200","ENG_062_MZB_LO_1200-06.10.2017","06.10.2017",2017,10,6,1.034815343,1
"ENG_062_MZB_LO_1200","ENG_062_MZB_LO_1200-13.11.2018","13.11.2018",2018,11,13,1.085188405,1
"ENG_062_MZB_LO_1200","ENG_062_MZB_LO_1200-09.09.2019","09.09.2019",2019,9,9,0.983347247,1
"ENG_062_MZB_LO_1200","ENG_062_MZB_LO_1200-18.10.2021","18.10.2021",2021,10,18,1.172200654,5
"ENG_062_MZB_LO_1200","ENG_062_MZB_LO_1200-07.09.2022","07.09.2022",2022,9,7,0.951495189,3
"ENG_062_MZB_LO_1200","ENG_062_MZB_LO_1200-12.09.2023","12.09.2023",2023,9,12,1.015725636,1
"ENG_062_MZB_LO_1201","ENG_062_MZB_LO_1201-15.10.2002","15.10.2002",2002,10,15,0.897423371,2
"ENG_062_MZB_LO_1201","ENG_062_MZB_LO_1201-12.10.2005","12.10.2005",2005,10,12,0.791731488,3
"ENG_062_MZB_LO_1201","ENG_062_MZB_LO_1201-30.10.2007","30.10.2007",2007,10,30,0.928655863,2
"ENG_062_MZB_LO_1201","ENG_062_MZB_LO_1201-25.09.2008","25.09.2008",2008,9,25,0.929531069,2
"ENG_062_MZB_LO_1201","ENG_062_MZB_LO_1201-12.10.2009","12.10.2009",2009,10,12,0.959771122,2
"ENG_062_MZB_LO_1201","ENG_062_MZB_LO_1201-07.09.2012","07.09.2012",2012,9,7,0.870927124,3
"ENG_062_MZB_LO_1201","ENG_062_MZB_LO_1201-10.11.2015","10.11.2015",2015,11,10,0.9623704,2
"ENG_062_MZB_LO_1201","ENG_062_MZB_LO_1201-06.11.2018","06.11.2018",2018,11,6,0.8618914,3
"ENG_062_MZB_LO_1201","ENG_062_MZB_LO_1201-05.10.2022","05.10.2022",2022,10,5,0.793324958,4
"ENG_062_MZB_LO_1206","ENG_062_MZB_LO_1206-05.09.2003","05.09.2003",2003,9,5,0.685158063,4
"ENG_062_MZB_LO_1206","ENG_062_MZB_LO_1206-15.09.2006","15.09.2006",2006,9,15,0.754073482,4
"ENG_062_MZB_LO_1206","ENG_062_MZB_LO_1206-29.09.2008","29.09.2008",2008,9,29,0.676841474,4
"ENG_062_MZB_LO_1206","ENG_062_MZB_LO_1206-22.09.2009","22.09.2009",2009,9,22,0.772969119,3
"ENG_062_MZB_LO_1206","ENG_062_MZB_LO_1206-22.09.2010","22.09.2010",2010,9,22,0.657476159,5
"ENG_062_MZB_LO_1206","ENG_062_MZB_LO_1206-14.09.2011","14.09.2011",2011,9,14,0.710491473,4
"ENG_062_MZB_LO_1206","ENG_062_MZB_LO_1206-24.10.2012","24.10.2012",2012,10,24,0.697294058,5
"ENG_062_MZB_LO_1206","ENG_062_MZB_LO_1206-25.09.2014","25.09.2014",2014,9,25,0.700135129,5
"ENG_062_MZB_LO_1207","ENG_062_MZB_LO_1207-05.09.2003","05.09.2003",2003,9,5,1.101507249,1
"ENG_062_MZB_LO_1207","ENG_062_MZB_LO_1207-19.10.2004","19.10.2004",2004,10,19,1.066180868,1
"ENG_062_MZB_LO_1207","ENG_062_MZB_LO_1207-11.09.2007","11.09.2007",2007,9,11,1.04647673,1
"ENG_062_MZB_LO_1207","ENG_062_MZB_LO_1207-29.09.2008","29.09.2008",2008,9,29,1.112876372,1
"ENG_062_MZB_LO_1207","ENG_062_MZB_LO_1207-22.09.2009","22.09.2009",2009,9,22,1.077786507,1
"ENG_062_MZB_LO_1207","ENG_062_MZB_LO_1207-22.09.2010","22.09.2010",2010,9,22,0.982809472,1
"ENG_062_MZB_LO_1207","ENG_062_MZB_LO_1207-11.10.2011","11.10.2011",2011,10,11,0.941519079,2
"ENG_062_MZB_LO_1207","ENG_062_MZB_LO_1207-24.10.2012","24.10.2012",2012,10,24,1.010289438,2
"ENG_062_MZB_LO_1207","ENG_062_MZB_LO_1207-05.09.2013","05.09.2013",2013,9,5,0.989527147,1
"ENG_062_MZB_LO_1207","ENG_062_MZB_LO_1207-05.09.2014","05.09.2014",2014,9,5,0.946348983,2
"ENG_062_MZB_LO_1208","ENG_062_MZB_LO_1208-13.09.2002","13.09.2002",2002,9,13,0.984482369,1
"ENG_062_MZB_LO_1208","ENG_062_MZB_LO_1208-06.11.2003","06.11.2003",2003,11,6,0.907553991,2
"ENG_062_MZB_LO_1208","ENG_062_MZB_LO_1208-05.11.2004","05.11.2004",2004,11,5,0.94625495,2
"ENG_062_MZB_LO_1208","ENG_062_MZB_LO_1208-27.11.2006","27.11.2006",2006,11,27,1.01426561,1
"ENG_062_MZB_LO_1208","ENG_062_MZB_LO_1208-18.10.2007","18.10.2007",2007,10,18,1.019564218,1
"ENG_062_MZB_LO_1208","ENG_062_MZB_LO_1208-24.10.2008","24.10.2008",2008,10,24,0.988075635,1
"ENG_062_MZB_LO_1208","ENG_062_MZB_LO_1208-10.09.2009","10.09.2009",2009,9,10,0.997384884,1
"ENG_062_MZB_LO_1208","ENG_062_MZB_LO_1208-18.09.2013","18.09.2013",2013,9,18,1.000358716,1
"ENG_062_MZB_LO_1208","ENG_062_MZB_LO_1208-04.09.2014","04.09.2014",2014,9,4,1.04063885,1
"ENG_062_MZB_LO_1210","ENG_062_MZB_LO_1210-07.11.2002","07.11.2002",2002,11,7,0.970389779,2
"ENG_062_MZB_LO_1210","ENG_062_MZB_LO_1210-27.10.2006","27.10.2006",2006,10,27,0.952711721,2
"ENG_062_MZB_LO_1210","ENG_062_MZB_LO_1210-19.10.2007","19.10.2007",2007,10,19,1.051172844,1
"ENG_062_MZB_LO_1210","ENG_062_MZB_LO_1210-12.11.2008","12.11.2008",2008,11,12,1.070667449,1
"ENG_062_MZB_LO_1210","ENG_062_MZB_LO_1210-09.11.2009","09.11.2009",2009,11,9,1.076139327,1
"ENG_062_MZB_LO_1210","ENG_062_MZB_LO_1210-15.11.2010","15.11.2010",2010,11,15,1.025117099,1
"ENG_062_MZB_LO_1210","ENG_062_MZB_LO_1210-13.09.2011","13.09.2011",2011,9,13,1.003322783,1
"ENG_062_MZB_LO_1210","ENG_062_MZB_LO_1210-04.10.2012","04.10.2012",2012,10,4,1.107869171,1
"ENG_062_MZB_LO_1210","ENG_062_MZB_LO_1210-04.09.2013","04.09.2013",2013,9,4,0.992078269,1
"ENG_062_MZB_LO_1210","ENG_062_MZB_LO_1210-03.09.2014","03.09.2014",2014,9,3,1.086279737,1
"ENG_062_MZB_LO_1210","ENG_062_MZB_LO_1210-30.09.2015","30.09.2015",2015,9,30,1.025744808,2
"ENG_062_MZB_LO_1210","ENG_062_MZB_LO_1210-28.10.2016","28.10.2016",2016,10,28,1.037051927,1
"ENG_062_MZB_LO_1210","ENG_062_MZB_LO_1210-21.09.2017","21.09.2017",2017,9,21,1.016834366,1
"ENG_062_MZB_LO_1210","ENG_062_MZB_LO_1210-05.10.2018","05.10.2018",2018,10,5,1.05257285,1
"ENG_062_MZB_LO_1210","ENG_062_MZB_LO_1210-24.10.2019","24.10.2019",2019,10,24,1.051133751,1
"ENG_062_MZB_LO_1210","ENG_062_MZB_LO_1210-07.10.2020","07.10.2020",2020,10,7,1.058990085,1
"ENG_062_MZB_LO_1210","ENG_062_MZB_LO_1210-18.10.2021","18.10.2021",2021,10,18,1.145097139,2
"ENG_062_MZB_LO_1213","ENG_062_MZB_LO_1213-07.10.2002","07.10.2002",2002,10,7,1.230341175,1
"ENG_062_MZB_LO_1213","ENG_062_MZB_LO_1213-04.10.2005","04.10.2005",2005,10,4,0.973762616,1
"ENG_062_MZB_LO_1213","ENG_062_MZB_LO_1213-08.10.2008","08.10.2008",2008,10,8,1.113036591,3
"ENG_062_MZB_LO_1213","ENG_062_MZB_LO_1213-17.09.2009","17.09.2009",2009,9,17,1.154160197,1
"ENG_062_MZB_LO_1213","ENG_062_MZB_LO_1213-03.11.2010","03.11.2010",2010,11,3,1.187187563,1
"ENG_062_MZB_LO_1213","ENG_062_MZB_LO_1213-29.09.2011","29.09.2011",2011,9,29,1.098519268,1
"ENG_062_MZB_LO_1213","ENG_062_MZB_LO_1213-11.10.2012","11.10.2012",2012,10,11,1.070049306,1
"ENG_062_MZB_LO_1213","ENG_062_MZB_LO_1213-01.10.2013","01.10.2013",2013,10,1,1.027570452,1
"ENG_062_MZB_LO_1213","ENG_062_MZB_LO_1213-19.11.2014","19.11.2014",2014,11,19,1.139200966,1
"ENG_062_MZB_LO_1213","ENG_062_MZB_LO_1213-29.09.2015","29.09.2015",2015,9,29,1.124436697,1
"ENG_062_MZB_LO_1213","ENG_062_MZB_LO_1213-05.10.2016","05.10.2016",2016,10,5,1.161604446,1
"ENG_062_MZB_LO_1213","ENG_062_MZB_LO_1213-02.10.2017","02.10.2017",2017,10,2,1.076883118,1
"ENG_062_MZB_LO_1213","ENG_062_MZB_LO_1213-12.10.2018","12.10.2018",2018,10,12,1.099815084,1
"ENG_062_MZB_LO_1213","ENG_062_MZB_LO_1213-03.10.2019","03.10.2019",2019,10,3,1.158111138,1
"ENG_062_MZB_LO_1213","ENG_062_MZB_LO_1213-15.10.2020","15.10.2020",2020,10,15,1.137514639,1
"ENG_062_MZB_LO_1213","ENG_062_MZB_LO_1213-19.11.2021","19.11.2021",2021,11,19,1.223195281,1
"ENG_062_MZB_LO_1213","ENG_062_MZB_LO_1213-25.11.2022","25.11.2022",2022,11,25,1.113379396,1
"ENG_062_MZB_LO_1214","ENG_062_MZB_LO_1214-06.09.2002","06.09.2002",2002,9,6,0.946555248,2
"ENG_062_MZB_LO_1214","ENG_062_MZB_LO_1214-27.10.2003","27.10.2003",2003,10,27,0.963965804,2
"ENG_062_MZB_LO_1214","ENG_062_MZB_LO_1214-20.09.2004","20.09.2004",2004,9,20,0.930632196,2
"ENG_062_MZB_LO_1214","ENG_062_MZB_LO_1214-16.11.2005","16.11.2005",2005,11,16,1.008855256,1
"ENG_062_MZB_LO_1214","ENG_062_MZB_LO_1214-28.09.2006","28.09.2006",2006,9,28,0.990651922,1
"ENG_062_MZB_LO_1214","ENG_062_MZB_LO_1214-23.10.2007","23.10.2007",2007,10,23,1.018848075,1
"ENG_062_MZB_LO_1214","ENG_062_MZB_LO_1214-16.10.2008","16.10.2008",2008,10,16,0.994635743,1
"ENG_062_MZB_LO_1214","ENG_062_MZB_LO_1214-16.09.2009","16.09.2009",2009,9,16,0.974562578,2
"ENG_062_MZB_LO_1214","ENG_062_MZB_LO_1214-12.11.2013","12.11.2013",2013,11,12,1.038357095,1
"ENG_062_MZB_LO_1214","ENG_062_MZB_LO_1214-17.09.2014","17.09.2014",2014,9,17,0.932780529,2
"ENG_062_MZB_LO_1215","ENG_062_MZB_LO_1215-11.09.2002","11.09.2002",2002,9,11,1.128282186,1
"ENG_062_MZB_LO_1215","ENG_062_MZB_LO_1215-07.10.2003","07.10.2003",2003,10,7,1.235034954,1
"ENG_062_MZB_LO_1215","ENG_062_MZB_LO_1215-25.11.2004","25.11.2004",2004,11,25,1.120900003,1
"ENG_062_MZB_LO_1215","ENG_062_MZB_LO_1215-09.09.2005","09.09.2005",2005,9,9,1.102793931,1
"ENG_062_MZB_LO_1215","ENG_062_MZB_LO_1215-31.10.2006","31.10.2006",2006,10,31,1.190018273,1
"ENG_062_MZB_LO_1215","ENG_062_MZB_LO_1215-05.11.2007","05.11.2007",2007,11,5,1.185333472,1
"ENG_062_MZB_LO_1215","ENG_062_MZB_LO_1215-05.11.2008","05.11.2008",2008,11,5,1.155013325,1
"ENG_062_MZB_LO_1215","ENG_062_MZB_LO_1215-13.10.2009","13.10.2009",2009,10,13,1.167823808,1
"ENG_062_MZB_LO_1215","ENG_062_MZB_LO_1215-07.10.2010","07.10.2010",2010,10,7,1.112218991,1
"ENG_062_MZB_LO_1215","ENG_062_MZB_LO_1215-17.10.2012","17.10.2012",2012,10,17,1.162721642,1
"ENG_062_MZB_LO_1215","ENG_062_MZB_LO_1215-04.09.2013","04.09.2013",2013,9,4,1.160303851,1
"ENG_062_MZB_LO_1215","ENG_062_MZB_LO_1215-05.09.2014","05.09.2014",2014,9,5,1.244211624,1
"ENG_062_MZB_LO_1215","ENG_062_MZB_LO_1215-06.10.2015","06.10.2015",2015,10,6,1.221291161,1
"ENG_062_MZB_LO_1215","ENG_062_MZB_LO_1215-05.10.2016","05.10.2016",2016,10,5,1.208634602,1
"ENG_062_MZB_LO_1215","ENG_062_MZB_LO_1215-03.10.2017","03.10.2017",2017,10,3,1.215119105,1
"ENG_062_MZB_LO_1215","ENG_062_MZB_LO_1215-09.10.2018","09.10.2018",2018,10,9,1.224223847,1
"ENG_062_MZB_LO_1215","ENG_062_MZB_LO_1215-23.09.2019","23.09.2019",2019,9,23,1.182768565,1
"ENG_062_MZB_LO_1215","ENG_062_MZB_LO_1215-06.10.2020","06.10.2020",2020,10,6,1.23004816,1
"ENG_062_MZB_LO_1215","ENG_062_MZB_LO_1215-06.10.2021","06.10.2021",2021,10,6,1.232444056,1
"ENG_062_MZB_LO_1216","ENG_062_MZB_LO_1216-13.09.2002","13.09.2002",2002,9,13,0.968480302,1
"ENG_062_MZB_LO_1216","ENG_062_MZB_LO_1216-06.11.2003","06.11.2003",2003,11,6,0.910920661,2
"ENG_062_MZB_LO_1216","ENG_062_MZB_LO_1216-25.11.2005","25.11.2005",2005,11,25,0.927084028,2
"ENG_062_MZB_LO_1216","ENG_062_MZB_LO_1216-27.11.2006","27.11.2006",2006,11,27,0.993286114,1
"ENG_062_MZB_LO_1216","ENG_062_MZB_LO_1216-21.09.2007","21.09.2007",2007,9,21,0.895356881,2
"ENG_062_MZB_LO_1216","ENG_062_MZB_LO_1216-24.10.2008","24.10.2008",2008,10,24,1.037199433,1
"ENG_062_MZB_LO_1216","ENG_062_MZB_LO_1216-05.11.2009","05.11.2009",2009,11,5,0.972266833,1
"ENG_062_MZB_LO_1216","ENG_062_MZB_LO_1216-08.09.2011","08.09.2011",2011,9,8,0.936016328,2
"ENG_062_MZB_LO_1216","ENG_062_MZB_LO_1216-08.11.2012","08.11.2012",2012,11,8,0.940366749,2
"ENG_062_MZB_LO_1216","ENG_062_MZB_LO_1216-15.10.2013","15.10.2013",2013,10,15,1.042134573,1
"ENG_062_MZB_LO_1216","ENG_062_MZB_LO_1216-10.09.2014","10.09.2014",2014,9,10,1.00890148,1
"ENG_062_MZB_LO_1217","ENG_062_MZB_LO_1217-13.09.2002","13.09.2002",2002,9,13,0.822454159,3
"ENG_062_MZB_LO_1217","ENG_062_MZB_LO_1217-04.11.2003","04.11.2003",2003,11,4,0.698166385,4
"ENG_062_MZB_LO_1217","ENG_062_MZB_LO_1217-01.11.2004","01.11.2004",2004,11,1,0.763821829,3
"ENG_062_MZB_LO_1217","ENG_062_MZB_LO_1217-28.09.2011","28.09.2011",2011,9,28,0.8128314,3
"ENG_062_MZB_LO_1217","ENG_062_MZB_LO_1217-04.10.2012","04.10.2012",2012,10,4,0.840305507,3
"ENG_062_MZB_LO_1217","ENG_062_MZB_LO_1217-06.11.2013","06.11.2013",2013,11,6,0.78100524,3
"ENG_062_MZB_LO_1217","ENG_062_MZB_LO_1217-03.09.2014","03.09.2014",2014,9,3,0.81893696,3
"ENG_062_MZB_LO_1218","ENG_062_MZB_LO_1218-11.09.2002","11.09.2002",2002,9,11,0.950489238,2
"ENG_062_MZB_LO_1218","ENG_062_MZB_LO_1218-06.11.2003","06.11.2003",2003,11,6,1.104128758,1
"ENG_062_MZB_LO_1218","ENG_062_MZB_LO_1218-05.11.2004","05.11.2004",2004,11,5,1.056208128,1
"ENG_062_MZB_LO_1218","ENG_062_MZB_LO_1218-25.11.2005","25.11.2005",2005,11,25,1.074986457,1
"ENG_062_MZB_LO_1218","ENG_062_MZB_LO_1218-20.10.2006","20.10.2006",2006,10,20,1.012577605,1
"ENG_062_MZB_LO_1218","ENG_062_MZB_LO_1218-24.10.2008","24.10.2008",2008,10,24,1.063228413,1
"ENG_062_MZB_LO_1218","ENG_062_MZB_LO_1218-10.09.2009","10.09.2009",2009,9,10,1.000437432,1
"ENG_062_MZB_LO_1218","ENG_062_MZB_LO_1218-17.09.2013","17.09.2013",2013,9,17,1.030792918,1
"ENG_062_MZB_LO_1220","ENG_062_MZB_LO_1220-06.10.2003","06.10.2003",2003,10,6,0.954401957,2
"ENG_062_MZB_LO_1220","ENG_062_MZB_LO_1220-15.09.2004","15.09.2004",2004,9,15,0.963605138,2
"ENG_062_MZB_LO_1220","ENG_062_MZB_LO_1220-01.11.2007","01.11.2007",2007,11,1,0.937254918,2
"ENG_062_MZB_LO_1220","ENG_062_MZB_LO_1220-14.10.2008","14.10.2008",2008,10,14,1.095767244,1
"ENG_062_MZB_LO_1220","ENG_062_MZB_LO_1220-24.09.2009","24.09.2009",2009,9,24,1.033075972,1
"ENG_062_MZB_LO_1220","ENG_062_MZB_LO_1220-19.10.2010","19.10.2010",2010,10,19,1.01960372,1
"ENG_062_MZB_LO_1220","ENG_062_MZB_LO_1220-11.10.2011","11.10.2011",2011,10,11,1.012168811,1
"ENG_062_MZB_LO_1220","ENG_062_MZB_LO_1220-24.10.2012","24.10.2012",2012,10,24,1.110626392,1
"ENG_062_MZB_LO_1220","ENG_062_MZB_LO_1220-03.09.2013","03.09.2013",2013,9,3,1.105064301,1
"ENG_062_MZB_LO_1220","ENG_062_MZB_LO_1220-22.09.2016","22.09.2016",2016,9,22,1.05348924,2
"ENG_062_MZB_LO_1221","ENG_062_MZB_LO_1221-27.09.2002","27.09.2002",2002,9,27,0.980517068,2
"ENG_062_MZB_LO_1221","ENG_062_MZB_LO_1221-22.10.2003","22.10.2003",2003,10,22,1.076615856,3
"ENG_062_MZB_LO_1221","ENG_062_MZB_LO_1221-18.10.2004","18.10.2004",2004,10,18,0.991755511,1
"ENG_062_MZB_LO_1221","ENG_062_MZB_LO_1221-04.10.2005","04.10.2005",2005,10,4,0.946113103,2
"ENG_062_MZB_LO_1221","ENG_062_MZB_LO_1221-31.10.2006","31.10.2006",2006,10,31,0.986616358,2
"ENG_062_MZB_LO_1221","ENG_062_MZB_LO_1221-16.10.2007","16.10.2007",2007,10,16,1.040631756,2
"ENG_062_MZB_LO_1221","ENG_062_MZB_LO_1221-08.10.2008","08.10.2008",2008,10,8,1.088874991,3
"ENG_062_MZB_LO_1221","ENG_062_MZB_LO_1221-17.09.2009","17.09.2009",2009,9,17,1.03832827,1
"ENG_062_MZB_LO_1221","ENG_062_MZB_LO_1221-26.09.2013","26.09.2013",2013,9,26,1.015452683,3
"ENG_062_MZB_LO_1221","ENG_062_MZB_LO_1221-30.09.2015","30.09.2015",2015,9,30,0.940547875,2
"ENG_062_MZB_LO_1222","ENG_062_MZB_LO_1222-18.10.2002","18.10.2002",2002,10,18,0.88158023,2
"ENG_062_MZB_LO_1222","ENG_062_MZB_LO_1222-29.10.2003","29.10.2003",2003,10,29,0.892821537,2
"ENG_062_MZB_LO_1222","ENG_062_MZB_LO_1222-10.11.2004","10.11.2004",2004,11,10,0.875048525,3
"ENG_062_MZB_LO_1222","ENG_062_MZB_LO_1222-06.10.2005","06.10.2005",2005,10,6,0.936522231,3
"ENG_062_MZB_LO_1222","ENG_062_MZB_LO_1222-18.10.2006","18.10.2006",2006,10,18,0.869559842,3
"ENG_062_MZB_LO_1222","ENG_062_MZB_LO_1222-11.09.2007","11.09.2007",2007,9,11,0.954884438,2
"ENG_062_MZB_LO_1222","ENG_062_MZB_LO_1222-22.10.2008","22.10.2008",2008,10,22,0.99122605,2
"ENG_062_MZB_LO_1222","ENG_062_MZB_LO_1222-29.09.2009","29.09.2009",2009,9,29,0.887739073,3
"ENG_062_MZB_LO_1222","ENG_062_MZB_LO_1222-15.11.2013","15.11.2013",2013,11,15,0.962945826,3
"ENG_062_MZB_LO_1223","ENG_062_MZB_LO_1223-07.10.2002","07.10.2002",2002,10,7,1.149092332,1
"ENG_062_MZB_LO_1223","ENG_062_MZB_LO_1223-22.10.2003","22.10.2003",2003,10,22,0.975278282,2
"ENG_062_MZB_LO_1223","ENG_062_MZB_LO_1223-15.10.2004","15.10.2004",2004,10,15,1.069493884,1
"ENG_062_MZB_LO_1223","ENG_062_MZB_LO_1223-16.11.2005","16.11.2005",2005,11,16,1.063446662,1
"ENG_062_MZB_LO_1223","ENG_062_MZB_LO_1223-23.10.2007","23.10.2007",2007,10,23,1.074497548,1
"ENG_062_MZB_LO_1223","ENG_062_MZB_LO_1223-13.10.2008","13.10.2008",2008,10,13,1.128887025,1
"ENG_062_MZB_LO_1223","ENG_062_MZB_LO_1223-06.10.2014","06.10.2014",2014,10,6,1.023251584,1
"ENG_062_MZB_LO_1223","ENG_062_MZB_LO_1223-02.10.2017","02.10.2017",2017,10,2,1.045445105,1
"ENG_062_MZB_LO_1224","ENG_062_MZB_LO_1224-28.10.2003","28.10.2003",2003,10,28,0.798756443,3
"ENG_062_MZB_LO_1224","ENG_062_MZB_LO_1224-06.11.2006","06.11.2006",2006,11,6,0.786784036,3
"ENG_062_MZB_LO_1224","ENG_062_MZB_LO_1224-13.09.2007","13.09.2007",2007,9,13,0.780963923,3
"ENG_062_MZB_LO_1224","ENG_062_MZB_LO_1224-11.10.2010","11.10.2010",2010,10,11,0.8354545,3
"ENG_062_MZB_LO_1224","ENG_062_MZB_LO_1224-26.10.2011","26.10.2011",2011,10,26,0.702522081,4
"ENG_062_MZB_LO_1224","ENG_062_MZB_LO_1224-26.09.2012","26.09.2012",2012,9,26,0.705384321,4
"ENG_062_MZB_LO_1224","ENG_062_MZB_LO_1224-04.09.2013","04.09.2013",2013,9,4,0.722455357,4
"ENG_062_MZB_LO_1224","ENG_062_MZB_LO_1224-03.09.2014","03.09.2014",2014,9,3,0.763338358,4
"ENG_062_MZB_LO_1224","ENG_062_MZB_LO_1224-30.09.2015","30.09.2015",2015,9,30,0.832548802,4
"ENG_062_MZB_LO_1224","ENG_062_MZB_LO_1224-07.09.2016","07.09.2016",2016,9,7,0.764669306,3
"ENG_062_MZB_LO_1224","ENG_062_MZB_LO_1224-27.09.2017","27.09.2017",2017,9,27,0.758759985,3
"ENG_062_MZB_LO_1224","ENG_062_MZB_LO_1224-01.10.2018","01.10.2018",2018,10,1,0.714881172,5
"ENG_062_MZB_LO_1225","ENG_062_MZB_LO_1225-24.10.2002","24.10.2002",2002,10,24,1.037481484,1
"ENG_062_MZB_LO_1225","ENG_062_MZB_LO_1225-16.09.2004","16.09.2004",2004,9,16,1.1218728,3
"ENG_062_MZB_LO_1225","ENG_062_MZB_LO_1225-08.09.2005","08.09.2005",2005,9,8,1.056271007,1
"ENG_062_MZB_LO_1225","ENG_062_MZB_LO_1225-21.09.2006","21.09.2006",2006,9,21,1.078209176,2
"ENG_062_MZB_LO_1225","ENG_062_MZB_LO_1225-10.09.2007","10.09.2007",2007,9,10,1.030260565,3
"ENG_062_MZB_LO_1225","ENG_062_MZB_LO_1225-03.11.2008","03.11.2008",2008,11,3,1.120174077,1
"ENG_062_MZB_LO_1225","ENG_062_MZB_LO_1225-13.10.2009","13.10.2009",2009,10,13,1.130614586,1
"ENG_062_MZB_LO_1225","ENG_062_MZB_LO_1225-20.09.2013","20.09.2013",2013,9,20,1.124297462,1
"ENG_062_MZB_LO_1225","ENG_062_MZB_LO_1225-17.10.2016","17.10.2016",2016,10,17,1.139378005,2
"ENG_062_MZB_LO_1226","ENG_062_MZB_LO_1226-20.09.2002","20.09.2002",2002,9,20,1.017298169,2
"ENG_062_MZB_LO_1226","ENG_062_MZB_LO_1226-03.09.2003","03.09.2003",2003,9,3,0.967356227,1
"ENG_062_MZB_LO_1226","ENG_062_MZB_LO_1226-16.09.2004","16.09.2004",2004,9,16,0.984293829,1
"ENG_062_MZB_LO_1226","ENG_062_MZB_LO_1226-16.09.2005","16.09.2005",2005,9,16,0.958921219,2
"ENG_062_MZB_LO_1226","ENG_062_MZB_LO_1226-15.09.2006","15.09.2006",2006,9,15,1.021593574,1
"ENG_062_MZB_LO_1226","ENG_062_MZB_LO_1226-06.09.2010","06.09.2010",2010,9,6,1.099126815,1
"ENG_062_MZB_LO_1226","ENG_062_MZB_LO_1226-14.09.2011","14.09.2011",2011,9,14,0.976043133,2
"ENG_062_MZB_LO_1226","ENG_062_MZB_LO_1226-10.09.2012","10.09.2012",2012,9,10,1.061389078,1
"ENG_062_MZB_LO_1226","ENG_062_MZB_LO_1226-04.09.2013","04.09.2013",2013,9,4,1.145224773,1
"ENG_062_MZB_LO_1226","ENG_062_MZB_LO_1226-11.09.2014","11.09.2014",2014,9,11,1.023441707,2
"ENG_062_MZB_LO_1226","ENG_062_MZB_LO_1226-28.09.2015","28.09.2015",2015,9,28,1.066992145,3
"ENG_062_MZB_LO_1226","ENG_062_MZB_LO_1226-15.09.2016","15.09.2016",2016,9,15,1.104849048,1
"ENG_062_MZB_LO_1226","ENG_062_MZB_LO_1226-14.09.2017","14.09.2017",2017,9,14,1.111585301,1
"ENG_062_MZB_LO_1226","ENG_062_MZB_LO_1226-20.09.2018","20.09.2018",2018,9,20,1.050158207,1
"ENG_062_MZB_LO_1226","ENG_062_MZB_LO_1226-20.09.2019","20.09.2019",2019,9,20,1.062684558,1
"ENG_062_MZB_LO_1226","ENG_062_MZB_LO_1226-02.09.2021","02.09.2021",2021,9,2,1.099380822,1
"ENG_062_MZB_LO_1227","ENG_062_MZB_LO_1227-04.09.2002","04.09.2002",2002,9,4,0.964865166,2
"ENG_062_MZB_LO_1227","ENG_062_MZB_LO_1227-10.09.2003","10.09.2003",2003,9,10,0.986716408,1
"ENG_062_MZB_LO_1227","ENG_062_MZB_LO_1227-08.10.2004","08.10.2004",2004,10,8,0.993145659,1
"ENG_062_MZB_LO_1227","ENG_062_MZB_LO_1227-04.10.2006","04.10.2006",2006,10,4,0.966368597,1
"ENG_062_MZB_LO_1227","ENG_062_MZB_LO_1227-12.09.2007","12.09.2007",2007,9,12,0.958141734,2
"ENG_062_MZB_LO_1227","ENG_062_MZB_LO_1227-03.10.2008","03.10.2008",2008,10,3,1.061508964,1
"ENG_062_MZB_LO_1227","ENG_062_MZB_LO_1227-13.10.2009","13.10.2009",2009,10,13,1.092727707,1
"ENG_062_MZB_LO_1227","ENG_062_MZB_LO_1227-16.11.2010","16.11.2010",2010,11,16,1.01488672,1
"ENG_062_MZB_LO_1227","ENG_062_MZB_LO_1227-22.09.2011","22.09.2011",2011,9,22,1.021427501,1
"ENG_062_MZB_LO_1227","ENG_062_MZB_LO_1227-10.09.2012","10.09.2012",2012,9,10,0.986280697,1
"ENG_062_MZB_LO_1227","ENG_062_MZB_LO_1227-25.10.2013","25.10.2013",2013,10,25,1.09463268,1
"ENG_062_MZB_LO_1227","ENG_062_MZB_LO_1227-18.09.2014","18.09.2014",2014,9,18,1.094597506,1
"ENG_062_MZB_LO_1227","ENG_062_MZB_LO_1227-01.10.2015","01.10.2015",2015,10,1,1.158191781,1
"ENG_062_MZB_LO_1227","ENG_062_MZB_LO_1227-01.09.2016","01.09.2016",2016,9,1,1.08748046,1
"ENG_062_MZB_LO_1227","ENG_062_MZB_LO_1227-18.09.2017","18.09.2017",2017,9,18,1.000702937,1
"ENG_062_MZB_LO_1227","ENG_062_MZB_LO_1227-08.11.2018","08.11.2018",2018,11,8,0.939232981,2
"ENG_062_MZB_LO_1227","ENG_062_MZB_LO_1227-15.10.2019","15.10.2019",2019,10,15,1.025920462,1
"ENG_062_MZB_LO_1227","ENG_062_MZB_LO_1227-13.10.2020","13.10.2020",2020,10,13,1.113371129,1
"ENG_062_MZB_LO_1227","ENG_062_MZB_LO_1227-12.10.2021","12.10.2021",2021,10,12,1.021432534,1
"ENG_062_MZB_LO_1227","ENG_062_MZB_LO_1227-07.10.2022","07.10.2022",2022,10,7,1.079368236,1
"ENG_062_MZB_LO_1227","ENG_062_MZB_LO_1227-27.09.2023","27.09.2023",2023,9,27,1.099101618,1
"ENG_062_MZB_LO_1228","ENG_062_MZB_LO_1228-13.11.2003","13.11.2003",2003,11,13,0.941974528,2
"ENG_062_MZB_LO_1228","ENG_062_MZB_LO_1228-20.10.2006","20.10.2006",2006,10,20,0.889016568,3
"ENG_062_MZB_LO_1228","ENG_062_MZB_LO_1228-09.09.2009","09.09.2009",2009,9,9,0.900210144,2
"ENG_062_MZB_LO_1228","ENG_062_MZB_LO_1228-24.10.2013","24.10.2013",2013,10,24,0.907522869,5
"ENG_062_MZB_LO_1228","ENG_062_MZB_LO_1228-08.10.2015","08.10.2015",2015,10,8,0.86436216,3
"ENG_062_MZB_LO_1228","ENG_062_MZB_LO_1228-23.10.2019","23.10.2019",2019,10,23,0.894383645,2
"ENG_062_MZB_LO_1228","ENG_062_MZB_LO_1228-15.10.2020","15.10.2020",2020,10,15,0.847961567,3
"ENG_062_MZB_LO_1228","ENG_062_MZB_LO_1228-09.11.2021","09.11.2021",2021,11,9,0.920345488,3
"ENG_062_MZB_LO_1228","ENG_062_MZB_LO_1228-30.11.2023","30.11.2023",2023,11,30,0.887174003,3
"ENG_062_MZB_LO_1229","ENG_062_MZB_LO_1229-22.09.2003","22.09.2003",2003,9,22,0.949488781,2
"ENG_062_MZB_LO_1229","ENG_062_MZB_LO_1229-28.09.2006","28.09.2006",2006,9,28,1.004990484,1
"ENG_062_MZB_LO_1229","ENG_062_MZB_LO_1229-10.09.2009","10.09.2009",2009,9,10,1.069043058,1
"ENG_062_MZB_LO_1229","ENG_062_MZB_LO_1229-04.10.2010","04.10.2010",2010,10,4,1.04467328,1
"ENG_062_MZB_LO_1229","ENG_062_MZB_LO_1229-10.10.2012","10.10.2012",2012,10,10,0.929388718,3
"ENG_062_MZB_LO_1229","ENG_062_MZB_LO_1229-10.10.2013","10.10.2013",2013,10,10,0.981628913,2
"ENG_062_MZB_LO_1229","ENG_062_MZB_LO_1229-12.10.2016","12.10.2016",2016,10,12,1.065876555,1
"ENG_062_MZB_LO_123","ENG_062_MZB_LO_123-02.10.2003","02.10.2003",2003,10,2,0.794620409,3
"ENG_062_MZB_LO_123","ENG_062_MZB_LO_123-14.09.2006","14.09.2006",2006,9,14,0.834340157,3
"ENG_062_MZB_LO_123","ENG_062_MZB_LO_123-11.09.2009","11.09.2009",2009,9,11,0.96107807,2
"ENG_062_MZB_LO_123","ENG_062_MZB_LO_123-04.09.2013","04.09.2013",2013,9,4,0.962814419,2
"ENG_062_MZB_LO_123","ENG_062_MZB_LO_123-03.10.2014","03.10.2014",2014,10,3,0.964262488,2
"ENG_062_MZB_LO_123","ENG_062_MZB_LO_123-02.09.2015","02.09.2015",2015,9,2,0.950681488,2
"ENG_062_MZB_LO_123","ENG_062_MZB_LO_123-11.10.2024","11.10.2024",2024,10,11,1.005759854,1
"ENG_062_MZB_LO_1231","ENG_062_MZB_LO_1231-09.09.2002","09.09.2002",2002,9,9,0.996908692,1
"ENG_062_MZB_LO_1231","ENG_062_MZB_LO_1231-10.09.2003","10.09.2003",2003,9,10,0.993133093,1
"ENG_062_MZB_LO_1231","ENG_062_MZB_LO_1231-07.10.2004","07.10.2004",2004,10,7,0.960131623,2
"ENG_062_MZB_LO_1231","ENG_062_MZB_LO_1231-05.10.2005","05.10.2005",2005,10,5,0.898380345,2
"ENG_062_MZB_LO_1231","ENG_062_MZB_LO_1231-01.11.2007","01.11.2007",2007,11,1,1.004593195,1
"ENG_062_MZB_LO_1231","ENG_062_MZB_LO_1231-30.10.2008","30.10.2008",2008,10,30,1.099895734,1
"ENG_062_MZB_LO_1231","ENG_062_MZB_LO_1231-02.10.2013","02.10.2013",2013,10,2,1.030444632,1
"ENG_062_MZB_LO_1231","ENG_062_MZB_LO_1231-14.09.2016","14.09.2016",2016,9,14,1.08706856,1
"ENG_062_MZB_LO_1231","ENG_062_MZB_LO_1231-18.09.2017","18.09.2017",2017,9,18,1.041434016,1
"ENG_062_MZB_LO_1231","ENG_062_MZB_LO_1231-09.10.2018","09.10.2018",2018,10,9,1.174275687,1
"ENG_062_MZB_LO_1231","ENG_062_MZB_LO_1231-15.10.2019","15.10.2019",2019,10,15,1.213606078,1
"ENG_062_MZB_LO_1231","ENG_062_MZB_LO_1231-13.10.2020","13.10.2020",2020,10,13,1.03681242,1
"ENG_062_MZB_LO_1231","ENG_062_MZB_LO_1231-12.10.2021","12.10.2021",2021,10,12,1.065699222,1
"ENG_062_MZB_LO_1231","ENG_062_MZB_LO_1231-07.10.2022","07.10.2022",2022,10,7,1.04918998,1
"ENG_062_MZB_LO_1231","ENG_062_MZB_LO_1231-27.09.2023","27.09.2023",2023,9,27,1.09264211,1
"ENG_062_MZB_LO_1232","ENG_062_MZB_LO_1232-11.09.2002","11.09.2002",2002,9,11,1.175935339,1
"ENG_062_MZB_LO_1232","ENG_062_MZB_LO_1232-10.11.2003","10.11.2003",2003,11,10,1.173835144,1
"ENG_062_MZB_LO_1232","ENG_062_MZB_LO_1232-29.09.2004","29.09.2004",2004,9,29,1.106690304,1
"ENG_062_MZB_LO_1232","ENG_062_MZB_LO_1232-04.10.2005","04.10.2005",2005,10,4,1.102638376,1
"ENG_062_MZB_LO_1232","ENG_062_MZB_LO_1232-20.10.2006","20.10.2006",2006,10,20,1.065135199,1
"ENG_062_MZB_LO_1232","ENG_062_MZB_LO_1232-21.09.2007","21.09.2007",2007,9,21,1.130028437,1
"ENG_062_MZB_LO_1232","ENG_062_MZB_LO_1232-26.09.2008","26.09.2008",2008,9,26,1.139159678,1
"ENG_062_MZB_LO_1232","ENG_062_MZB_LO_1232-10.09.2009","10.09.2009",2009,9,10,1.081814149,1
"ENG_062_MZB_LO_1232","ENG_062_MZB_LO_1232-15.09.2010","15.09.2010",2010,9,15,1.0912002,1
"ENG_062_MZB_LO_1232","ENG_062_MZB_LO_1232-13.09.2011","13.09.2011",2011,9,13,1.161693204,1
"ENG_062_MZB_LO_1232","ENG_062_MZB_LO_1232-08.11.2012","08.11.2012",2012,11,8,1.176426604,1
"ENG_062_MZB_LO_1232","ENG_062_MZB_LO_1232-17.10.2013","17.10.2013",2013,10,17,1.172109999,1
"ENG_062_MZB_LO_1232","ENG_062_MZB_LO_1232-07.09.2015","07.09.2015",2015,9,7,1.177808547,1
"ENG_062_MZB_LO_1232","ENG_062_MZB_LO_1232-25.09.2018","25.09.2018",2018,9,25,1.16582819,1
"ENG_062_MZB_LO_1233","ENG_062_MZB_LO_1233-16.09.2002","16.09.2002",2002,9,16,0.709379552,4
"ENG_062_MZB_LO_1233","ENG_062_MZB_LO_1233-09.09.2003","09.09.2003",2003,9,9,0.683223627,4
"ENG_062_MZB_LO_1233","ENG_062_MZB_LO_1233-01.11.2006","01.11.2006",2006,11,1,0.709021718,4
"ENG_062_MZB_LO_1233","ENG_062_MZB_LO_1233-03.09.2008","03.09.2008",2008,9,3,0.663073965,4
"ENG_062_MZB_LO_1233","ENG_062_MZB_LO_1233-20.10.2009","20.10.2009",2009,10,20,0.625182038,4
"ENG_062_MZB_LO_1233","ENG_062_MZB_LO_1233-24.09.2013","24.09.2013",2013,9,24,0.79640802,3
"ENG_062_MZB_LO_1233","ENG_062_MZB_LO_1233-01.09.2014","01.09.2014",2014,9,1,0.820158066,3
"ENG_062_MZB_LO_1234","ENG_062_MZB_LO_1234-11.10.2002","11.10.2002",2002,10,11,0.965763035,3
"ENG_062_MZB_LO_1234","ENG_062_MZB_LO_1234-29.10.2003","29.10.2003",2003,10,29,1.118262172,2
"ENG_062_MZB_LO_1234","ENG_062_MZB_LO_1234-25.10.2004","25.10.2004",2004,10,25,1.077553406,1
"ENG_062_MZB_LO_1234","ENG_062_MZB_LO_1234-03.10.2005","03.10.2005",2005,10,3,1.077468415,1
"ENG_062_MZB_LO_1234","ENG_062_MZB_LO_1234-18.10.2006","18.10.2006",2006,10,18,1.050605561,1
"ENG_062_MZB_LO_1234","ENG_062_MZB_LO_1234-13.11.2008","13.11.2008",2008,11,13,1.046577592,1
"ENG_062_MZB_LO_1234","ENG_062_MZB_LO_1234-15.11.2013","15.11.2013",2013,11,15,1.061031011,2
"ENG_062_MZB_LO_1234","ENG_062_MZB_LO_1234-14.10.2015","14.10.2015",2015,10,14,1.013542225,3
"ENG_062_MZB_LO_1238","ENG_062_MZB_LO_1238-27.10.2003","27.10.2003",2003,10,27,0.931089664,2
"ENG_062_MZB_LO_1238","ENG_062_MZB_LO_1238-15.10.2004","15.10.2004",2004,10,15,1.049988489,1
"ENG_062_MZB_LO_1238","ENG_062_MZB_LO_1238-30.09.2005","30.09.2005",2005,9,30,0.926786412,2
"ENG_062_MZB_LO_1238","ENG_062_MZB_LO_1238-18.10.2006","18.10.2006",2006,10,18,0.953304943,2
"ENG_062_MZB_LO_1238","ENG_062_MZB_LO_1238-24.10.2007","24.10.2007",2007,10,24,1.05222509,1
"ENG_062_MZB_LO_1238","ENG_062_MZB_LO_1238-17.11.2008","17.11.2008",2008,11,17,0.904542359,2
"ENG_062_MZB_LO_1238","ENG_062_MZB_LO_1238-07.09.2009","07.09.2009",2009,9,7,0.936882914,2
"ENG_062_MZB_LO_1238","ENG_062_MZB_LO_1238-15.11.2013","15.11.2013",2013,11,15,0.85867001,3
"ENG_062_MZB_LO_1240","ENG_062_MZB_LO_1240-04.10.2002","04.10.2002",2002,10,4,0.885761013,3
"ENG_062_MZB_LO_1240","ENG_062_MZB_LO_1240-22.10.2003","22.10.2003",2003,10,22,1.041860093,2
"ENG_062_MZB_LO_1240","ENG_062_MZB_LO_1240-30.09.2005","30.09.2005",2005,9,30,1.017559681,2
"ENG_062_MZB_LO_1240","ENG_062_MZB_LO_1240-13.10.2008","13.10.2008",2008,10,13,1.148779693,2
"ENG_062_MZB_LO_1240","ENG_062_MZB_LO_1240-01.11.2011","01.11.2011",2011,11,1,1.064340719,1
"ENG_062_MZB_LO_1240","ENG_062_MZB_LO_1240-11.10.2012","11.10.2012",2012,10,11,0.974833954,3
"ENG_062_MZB_LO_1240","ENG_062_MZB_LO_1240-06.10.2014","06.10.2014",2014,10,6,1.060133775,2
"ENG_062_MZB_LO_1241","ENG_062_MZB_LO_1241-01.10.2002","01.10.2002",2002,10,1,1.014199765,1
"ENG_062_MZB_LO_1241","ENG_062_MZB_LO_1241-16.10.2003","16.10.2003",2003,10,16,1.030195925,1
"ENG_062_MZB_LO_1241","ENG_062_MZB_LO_1241-15.10.2004","15.10.2004",2004,10,15,1.086097778,1
"ENG_062_MZB_LO_1241","ENG_062_MZB_LO_1241-30.09.2005","30.09.2005",2005,9,30,0.992736717,2
"ENG_062_MZB_LO_1241","ENG_062_MZB_LO_1241-13.10.2006","13.10.2006",2006,10,13,1.038724842,1
"ENG_062_MZB_LO_1241","ENG_062_MZB_LO_1241-23.10.2007","23.10.2007",2007,10,23,1.073384309,1
"ENG_062_MZB_LO_1241","ENG_062_MZB_LO_1241-17.11.2008","17.11.2008",2008,11,17,1.08049218,1
"ENG_062_MZB_LO_1241","ENG_062_MZB_LO_1241-07.09.2009","07.09.2009",2009,9,7,0.919100115,2
"ENG_062_MZB_LO_1241","ENG_062_MZB_LO_1241-07.10.2013","07.10.2013",2013,10,7,1.029322156,1
"ENG_062_MZB_LO_1242","ENG_062_MZB_LO_1242-04.10.2002","04.10.2002",2002,10,4,0.924348153,2
"ENG_062_MZB_LO_1242","ENG_062_MZB_LO_1242-15.10.2004","15.10.2004",2004,10,15,0.806625336,3
"ENG_062_MZB_LO_1242","ENG_062_MZB_LO_1242-30.09.2005","30.09.2005",2005,9,30,0.859346571,3
"ENG_062_MZB_LO_1242","ENG_062_MZB_LO_1242-18.10.2006","18.10.2006",2006,10,18,0.854876261,3
"ENG_062_MZB_LO_1242","ENG_062_MZB_LO_1242-24.10.2007","24.10.2007",2007,10,24,0.889652226,2
"ENG_062_MZB_LO_1242","ENG_062_MZB_LO_1242-17.11.2008","17.11.2008",2008,11,17,0.896971068,2
"ENG_062_MZB_LO_1242","ENG_062_MZB_LO_1242-07.09.2009","07.09.2009",2009,9,7,0.876065117,3
"ENG_062_MZB_LO_1242","ENG_062_MZB_LO_1242-30.10.2014","30.10.2014",2014,10,30,0.934825704,2
"ENG_062_MZB_LO_1244","ENG_062_MZB_LO_1244-12.09.2002","12.09.2002",2002,9,12,0.692085658,4
"ENG_062_MZB_LO_1244","ENG_062_MZB_LO_1244-03.09.2003","03.09.2003",2003,9,3,0.680085547,4
"ENG_062_MZB_LO_1244","ENG_062_MZB_LO_1244-23.09.2004","23.09.2004",2004,9,23,0.75369926,3
"ENG_062_MZB_LO_1244","ENG_062_MZB_LO_1244-16.09.2005","16.09.2005",2005,9,16,0.763684821,3
"ENG_062_MZB_LO_1244","ENG_062_MZB_LO_1244-01.11.2006","01.11.2006",2006,11,1,0.815812126,3
"ENG_062_MZB_LO_1244","ENG_062_MZB_LO_1244-10.09.2007","10.09.2007",2007,9,10,0.742053495,3
"ENG_062_MZB_LO_1244","ENG_062_MZB_LO_1244-03.11.2008","03.11.2008",2008,11,3,0.848791049,3
"ENG_062_MZB_LO_1244","ENG_062_MZB_LO_1244-20.10.2009","20.10.2009",2009,10,20,0.902447201,4
"ENG_062_MZB_LO_1244","ENG_062_MZB_LO_1244-14.09.2011","14.09.2011",2011,9,14,0.820082998,3
"ENG_062_MZB_LO_1245","ENG_062_MZB_LO_1245-11.10.2002","11.10.2002",2002,10,11,0.597596832,5
"ENG_062_MZB_LO_1245","ENG_062_MZB_LO_1245-29.10.2003","29.10.2003",2003,10,29,0.504117441,5
"ENG_062_MZB_LO_1245","ENG_062_MZB_LO_1245-25.10.2004","25.10.2004",2004,10,25,0.519259341,5
"ENG_062_MZB_LO_1245","ENG_062_MZB_LO_1245-06.10.2005","06.10.2005",2005,10,6,0.465189361,5
"ENG_062_MZB_LO_1245","ENG_062_MZB_LO_1245-22.10.2008","22.10.2008",2008,10,22,0.584574648,5
"ENG_062_MZB_LO_1245","ENG_062_MZB_LO_1245-22.10.2013","22.10.2013",2013,10,22,0.581543021,5
"ENG_062_MZB_LO_1245","ENG_062_MZB_LO_1245-14.10.2015","14.10.2015",2015,10,14,0.583941623,5
"ENG_062_MZB_LO_125","ENG_062_MZB_LO_125-27.09.2002","27.09.2002",2002,9,27,0.879892353,3
"ENG_062_MZB_LO_125","ENG_062_MZB_LO_125-28.09.2005","28.09.2005",2005,9,28,0.836564765,3
"ENG_062_MZB_LO_125","ENG_062_MZB_LO_125-08.09.2009","08.09.2009",2009,9,8,0.875494454,3
"ENG_062_MZB_LO_125","ENG_062_MZB_LO_125-20.09.2010","20.09.2010",2010,9,20,0.977811408,3
"ENG_062_MZB_LO_125","ENG_062_MZB_LO_125-12.09.2013","12.09.2013",2013,9,12,1.076771188,1
"ENG_062_MZB_LO_125","ENG_062_MZB_LO_125-31.10.2016","31.10.2016",2016,10,31,1.118130521,1
"ENG_062_MZB_LO_125","ENG_062_MZB_LO_125-24.10.2019","24.10.2019",2019,10,24,1.140839029,1
"ENG_062_MZB_LO_1250","ENG_062_MZB_LO_1250-11.10.2002","11.10.2002",2002,10,11,0.976635273,2
"ENG_062_MZB_LO_1250","ENG_062_MZB_LO_1250-30.10.2003","30.10.2003",2003,10,30,1.000866835,1
"ENG_062_MZB_LO_1250","ENG_062_MZB_LO_1250-22.10.2004","22.10.2004",2004,10,22,0.96939961,2
"ENG_062_MZB_LO_1250","ENG_062_MZB_LO_1250-08.11.2005","08.11.2005",2005,11,8,0.967213287,2
"ENG_062_MZB_LO_1250","ENG_062_MZB_LO_1250-10.10.2006","10.10.2006",2006,10,10,0.911737609,2
"ENG_062_MZB_LO_1250","ENG_062_MZB_LO_1250-16.10.2007","16.10.2007",2007,10,16,0.886867501,2
"ENG_062_MZB_LO_1250","ENG_062_MZB_LO_1250-22.10.2008","22.10.2008",2008,10,22,0.928919418,2
"ENG_062_MZB_LO_1250","ENG_062_MZB_LO_1250-29.09.2009","29.09.2009",2009,9,29,0.9226759,2
"ENG_062_MZB_LO_1250","ENG_062_MZB_LO_1250-01.10.2013","01.10.2013",2013,10,1,0.939326057,2
"ENG_062_MZB_LO_1250","ENG_062_MZB_LO_1250-24.10.2019","24.10.2019",2019,10,24,0.963457426,2
"ENG_062_MZB_LO_1250","ENG_062_MZB_LO_1250-15.10.2020","15.10.2020",2020,10,15,0.991037161,1
"ENG_062_MZB_LO_1250","ENG_062_MZB_LO_1250-02.11.2021","02.11.2021",2021,11,2,1.044380483,1
"ENG_062_MZB_LO_1251","ENG_062_MZB_LO_1251-12.09.2002","12.09.2002",2002,9,12,1.000465442,1
"ENG_062_MZB_LO_1251","ENG_062_MZB_LO_1251-03.09.2003","03.09.2003",2003,9,3,0.933641572,2
"ENG_062_MZB_LO_1251","ENG_062_MZB_LO_1251-08.11.2005","08.11.2005",2005,11,8,0.986735879,1
"ENG_062_MZB_LO_1251","ENG_062_MZB_LO_1251-01.11.2006","01.11.2006",2006,11,1,0.972366269,1
"ENG_062_MZB_LO_1251","ENG_062_MZB_LO_1251-05.09.2007","05.09.2007",2007,9,5,0.962998595,2
"ENG_062_MZB_LO_1251","ENG_062_MZB_LO_1251-22.09.2008","22.09.2008",2008,9,22,1.01313386,1
"ENG_062_MZB_LO_1251","ENG_062_MZB_LO_1251-13.10.2009","13.10.2009",2009,10,13,1.021966671,1
"ENG_062_MZB_LO_1251","ENG_062_MZB_LO_1251-11.10.2010","11.10.2010",2010,10,11,1.005244476,1
"ENG_062_MZB_LO_1251","ENG_062_MZB_LO_1251-14.09.2011","14.09.2011",2011,9,14,0.972599984,1
"ENG_062_MZB_LO_1251","ENG_062_MZB_LO_1251-10.10.2012","10.10.2012",2012,10,10,0.956314559,2
"ENG_062_MZB_LO_1252","ENG_062_MZB_LO_1252-22.10.2002","22.10.2002",2002,10,22,0.843127665,3
"ENG_062_MZB_LO_1252","ENG_062_MZB_LO_1252-29.10.2003","29.10.2003",2003,10,29,0.812792004,3
"ENG_062_MZB_LO_1252","ENG_062_MZB_LO_1252-12.11.2004","12.11.2004",2004,11,12,0.810819657,3
"ENG_062_MZB_LO_1252","ENG_062_MZB_LO_1252-05.10.2005","05.10.2005",2005,10,5,0.812539495,3
"ENG_062_MZB_LO_1252","ENG_062_MZB_LO_1252-01.11.2006","01.11.2006",2006,11,1,0.83468332,3
"ENG_062_MZB_LO_1252","ENG_062_MZB_LO_1252-15.10.2007","15.10.2007",2007,10,15,0.839121218,3
"ENG_062_MZB_LO_1252","ENG_062_MZB_LO_1252-20.11.2008","20.11.2008",2008,11,20,0.764697743,3
"ENG_062_MZB_LO_1252","ENG_062_MZB_LO_1252-12.11.2009","12.11.2009",2009,11,12,0.796704453,3
"ENG_062_MZB_LO_1252","ENG_062_MZB_LO_1252-11.10.2010","11.10.2010",2010,10,11,0.772754645,3
"ENG_062_MZB_LO_1252","ENG_062_MZB_LO_1252-01.11.2011","01.11.2011",2011,11,1,0.748778588,4
"ENG_062_MZB_LO_1252","ENG_062_MZB_LO_1252-05.09.2012","05.09.2012",2012,9,5,0.76304688,3
"ENG_062_MZB_LO_1252","ENG_062_MZB_LO_1252-04.09.2013","04.09.2013",2013,9,4,0.837401021,3
"ENG_062_MZB_LO_1252","ENG_062_MZB_LO_1252-03.09.2014","03.09.2014",2014,9,3,1.00445219,2
"ENG_062_MZB_LO_1253","ENG_062_MZB_LO_1253-30.09.2002","30.09.2002",2002,9,30,1.162410409,1
"ENG_062_MZB_LO_1253","ENG_062_MZB_LO_1253-30.09.2003","30.09.2003",2003,9,30,1.10841266,1
"ENG_062_MZB_LO_1253","ENG_062_MZB_LO_1253-02.11.2004","02.11.2004",2004,11,2,1.130833135,1
"ENG_062_MZB_LO_1253","ENG_062_MZB_LO_1253-25.10.2005","25.10.2005",2005,10,25,1.063311451,1
"ENG_062_MZB_LO_1253","ENG_062_MZB_LO_1253-09.11.2006","09.11.2006",2006,11,9,1.065859436,1
"ENG_062_MZB_LO_1253","ENG_062_MZB_LO_1253-19.10.2009","19.10.2009",2009,10,19,1.092701751,1
"ENG_062_MZB_LO_1253","ENG_062_MZB_LO_1253-25.09.2013","25.09.2013",2013,9,25,1.102762331,1
"ENG_062_MZB_LO_1254","ENG_062_MZB_LO_1254-07.10.2002","07.10.2002",2002,10,7,1.066445709,1
"ENG_062_MZB_LO_1254","ENG_062_MZB_LO_1254-04.10.2005","04.10.2005",2005,10,4,1.157539618,1
"ENG_062_MZB_LO_1254","ENG_062_MZB_LO_1254-08.10.2008","08.10.2008",2008,10,8,1.158193969,3
"ENG_062_MZB_LO_1254","ENG_062_MZB_LO_1254-17.09.2009","17.09.2009",2009,9,17,1.206184767,1
"ENG_062_MZB_LO_1254","ENG_062_MZB_LO_1254-29.09.2015","29.09.2015",2015,9,29,1.047420036,1
"ENG_062_MZB_LO_1254","ENG_062_MZB_LO_1254-05.10.2016","05.10.2016",2016,10,5,1.193175616,1
"ENG_062_MZB_LO_1254","ENG_062_MZB_LO_1254-02.10.2017","02.10.2017",2017,10,2,1.041498548,1
"ENG_062_MZB_LO_1254","ENG_062_MZB_LO_1254-12.10.2018","12.10.2018",2018,10,12,1.054389514,1
"ENG_062_MZB_LO_1254","ENG_062_MZB_LO_1254-11.10.2019","11.10.2019",2019,10,11,1.027593879,1
"ENG_062_MZB_LO_1254","ENG_062_MZB_LO_1254-15.10.2020","15.10.2020",2020,10,15,1.058224714,1
"ENG_062_MZB_LO_1254","ENG_062_MZB_LO_1254-03.11.2021","03.11.2021",2021,11,3,1.041076336,2
"ENG_062_MZB_LO_1256","ENG_062_MZB_LO_1256-25.09.2002","25.09.2002",2002,9,25,1.252200309,1
"ENG_062_MZB_LO_1256","ENG_062_MZB_LO_1256-25.10.2005","25.10.2005",2005,10,25,1.1410714,1
"ENG_062_MZB_LO_1256","ENG_062_MZB_LO_1256-09.11.2006","09.11.2006",2006,11,9,1.161347531,1
"ENG_062_MZB_LO_1256","ENG_062_MZB_LO_1256-19.10.2009","19.10.2009",2009,10,19,1.195535967,1
"ENG_062_MZB_LO_1256","ENG_062_MZB_LO_1256-25.09.2013","25.09.2013",2013,9,25,1.21487065,1
"ENG_062_MZB_LO_1256","ENG_062_MZB_LO_1256-18.09.2014","18.09.2014",2014,9,18,1.163625709,1
"ENG_062_MZB_LO_1256","ENG_062_MZB_LO_1256-15.10.2015","15.10.2015",2015,10,15,1.147587288,1
"ENG_062_MZB_LO_1256","ENG_062_MZB_LO_1256-05.11.2018","05.11.2018",2018,11,5,1.192915381,1
"ENG_062_MZB_LO_1257","ENG_062_MZB_LO_1257-10.09.2003","10.09.2003",2003,9,10,1.087175582,1
"ENG_062_MZB_LO_1257","ENG_062_MZB_LO_1257-16.09.2004","16.09.2004",2004,9,16,1.033709715,1
"ENG_062_MZB_LO_1257","ENG_062_MZB_LO_1257-08.09.2005","08.09.2005",2005,9,8,0.931400601,2
"ENG_062_MZB_LO_1257","ENG_062_MZB_LO_1257-21.09.2006","21.09.2006",2006,9,21,1.037990374,1
"ENG_062_MZB_LO_1257","ENG_062_MZB_LO_1257-06.09.2007","06.09.2007",2007,9,6,1.068486009,1
"ENG_062_MZB_LO_1257","ENG_062_MZB_LO_1257-11.09.2008","11.09.2008",2008,9,11,0.92151175,2
"ENG_062_MZB_LO_1257","ENG_062_MZB_LO_1257-15.09.2009","15.09.2009",2009,9,15,1.105559119,1
"ENG_062_MZB_LO_1257","ENG_062_MZB_LO_1257-26.11.2013","26.11.2013",2013,11,26,1.126642583,1
"ENG_062_MZB_LO_1257","ENG_062_MZB_LO_1257-20.11.2014","20.11.2014",2014,11,20,1.034380593,2
"ENG_062_MZB_LO_1257","ENG_062_MZB_LO_1257-29.09.2015","29.09.2015",2015,9,29,1.10229047,3
"ENG_062_MZB_LO_1257","ENG_062_MZB_LO_1257-17.10.2016","17.10.2016",2016,10,17,1.077577977,1
"ENG_062_MZB_LO_1257","ENG_062_MZB_LO_1257-14.09.2017","14.09.2017",2017,9,14,1.058464099,1
"ENG_062_MZB_LO_1257","ENG_062_MZB_LO_1257-12.10.2018","12.10.2018",2018,10,12,1.080818789,1
"ENG_062_MZB_LO_1257","ENG_062_MZB_LO_1257-09.10.2019","09.10.2019",2019,10,9,1.04022635,1
"ENG_062_MZB_LO_1257","ENG_062_MZB_LO_1257-08.10.2020","08.10.2020",2020,10,8,1.081007076,1
"ENG_062_MZB_LO_1257","ENG_062_MZB_LO_1257-19.11.2021","19.11.2021",2021,11,19,1.063793084,1
"ENG_062_MZB_LO_1258","ENG_062_MZB_LO_1258-30.10.2002","30.10.2002",2002,10,30,0.95631033,3
"ENG_062_MZB_LO_1258","ENG_062_MZB_LO_1258-31.10.2003","31.10.2003",2003,10,31,0.856191877,3
"ENG_062_MZB_LO_1258","ENG_062_MZB_LO_1258-28.09.2004","28.09.2004",2004,9,28,0.905045892,2
"ENG_062_MZB_LO_1258","ENG_062_MZB_LO_1258-10.11.2005","10.11.2005",2005,11,10,0.836431892,3
"ENG_062_MZB_LO_1258","ENG_062_MZB_LO_1258-20.09.2006","20.09.2006",2006,9,20,0.873166666,2
"ENG_062_MZB_LO_1258","ENG_062_MZB_LO_1258-15.09.2008","15.09.2008",2008,9,15,1.11462054,2
"ENG_062_MZB_LO_1258","ENG_062_MZB_LO_1258-10.09.2009","10.09.2009",2009,9,10,1.045127551,1
"ENG_062_MZB_LO_1258","ENG_062_MZB_LO_1258-04.10.2010","04.10.2010",2010,10,4,0.940334391,3
"ENG_062_MZB_LO_1258","ENG_062_MZB_LO_1258-08.11.2011","08.11.2011",2011,11,8,0.918159046,3
"ENG_062_MZB_LO_1258","ENG_062_MZB_LO_1258-19.09.2013","19.09.2013",2013,9,19,1.072617093,1
"ENG_062_MZB_LO_1258","ENG_062_MZB_LO_1258-12.10.2016","12.10.2016",2016,10,12,1.107621268,1
"ENG_062_MZB_LO_1264","ENG_062_MZB_LO_1264-31.10.2003","31.10.2003",2003,10,31,1.009520671,1
"ENG_062_MZB_LO_1264","ENG_062_MZB_LO_1264-28.09.2004","28.09.2004",2004,9,28,0.93598846,2
"ENG_062_MZB_LO_1264","ENG_062_MZB_LO_1264-28.09.2006","28.09.2006",2006,9,28,1.004690082,1
"ENG_062_MZB_LO_1264","ENG_062_MZB_LO_1264-10.10.2007","10.10.2007",2007,10,10,0.939446858,2
"ENG_062_MZB_LO_1264","ENG_062_MZB_LO_1264-04.10.2008","04.10.2008",2008,10,4,0.965085575,2
"ENG_062_MZB_LO_1264","ENG_062_MZB_LO_1264-04.10.2010","04.10.2010",2010,10,4,1.002222033,2
"ENG_062_MZB_LO_1264","ENG_062_MZB_LO_1264-19.11.2021","19.11.2021",2021,11,19,1.070987058,1
"ENG_062_MZB_LO_1264","ENG_062_MZB_LO_1264-14.11.2022","14.11.2022",2022,11,14,1.005938634,1
"ENG_062_MZB_LO_1264","ENG_062_MZB_LO_1264-06.10.2023","06.10.2023",2023,10,6,0.885213418,3
"ENG_062_MZB_LO_1265","ENG_062_MZB_LO_1265-11.09.2002","11.09.2002",2002,9,11,1.192870561,1
"ENG_062_MZB_LO_1265","ENG_062_MZB_LO_1265-07.10.2003","07.10.2003",2003,10,7,1.119706985,1
"ENG_062_MZB_LO_1265","ENG_062_MZB_LO_1265-25.11.2004","25.11.2004",2004,11,25,1.157559179,1
"ENG_062_MZB_LO_1265","ENG_062_MZB_LO_1265-09.09.2005","09.09.2005",2005,9,9,1.154983397,1
"ENG_062_MZB_LO_1265","ENG_062_MZB_LO_1265-31.10.2006","31.10.2006",2006,10,31,1.176881223,1
"ENG_062_MZB_LO_1265","ENG_062_MZB_LO_1265-05.10.2007","05.10.2007",2007,10,5,1.15027343,1
"ENG_062_MZB_LO_1265","ENG_062_MZB_LO_1265-08.10.2008","08.10.2008",2008,10,8,1.22560318,1
"ENG_062_MZB_LO_1265","ENG_062_MZB_LO_1265-13.10.2009","13.10.2009",2009,10,13,1.161690491,1
"ENG_062_MZB_LO_1265","ENG_062_MZB_LO_1265-07.10.2010","07.10.2010",2010,10,7,1.192290963,1
"ENG_062_MZB_LO_1265","ENG_062_MZB_LO_1265-10.10.2012","10.10.2012",2012,10,10,1.167655126,1
"ENG_062_MZB_LO_1265","ENG_062_MZB_LO_1265-18.09.2013","18.09.2013",2013,9,18,1.17996629,1
"ENG_062_MZB_LO_1265","ENG_062_MZB_LO_1265-11.09.2014","11.09.2014",2014,9,11,1.176403714,1
"ENG_062_MZB_LO_1265","ENG_062_MZB_LO_1265-21.10.2015","21.10.2015",2015,10,21,1.211505907,1
"ENG_062_MZB_LO_1265","ENG_062_MZB_LO_1265-27.09.2016","27.09.2016",2016,9,27,1.19348974,1
"ENG_062_MZB_LO_1265","ENG_062_MZB_LO_1265-03.10.2017","03.10.2017",2017,10,3,1.144920285,1
"ENG_062_MZB_LO_1265","ENG_062_MZB_LO_1265-04.10.2018","04.10.2018",2018,10,4,1.179107916,1
"ENG_062_MZB_LO_1265","ENG_062_MZB_LO_1265-23.09.2019","23.09.2019",2019,9,23,1.175819615,1
"ENG_062_MZB_LO_1265","ENG_062_MZB_LO_1265-06.10.2020","06.10.2020",2020,10,6,1.251301047,1
"ENG_062_MZB_LO_1265","ENG_062_MZB_LO_1265-07.10.2021","07.10.2021",2021,10,7,1.248817618,1
"ENG_062_MZB_LO_1267","ENG_062_MZB_LO_1267-02.10.2002","02.10.2002",2002,10,2,0.999501561,2
"ENG_062_MZB_LO_1267","ENG_062_MZB_LO_1267-01.10.2003","01.10.2003",2003,10,1,0.911561848,2
"ENG_062_MZB_LO_1267","ENG_062_MZB_LO_1267-06.10.2004","06.10.2004",2004,10,6,1.007429679,2
"ENG_062_MZB_LO_1267","ENG_062_MZB_LO_1267-25.10.2006","25.10.2006",2006,10,25,0.909046426,3
"ENG_062_MZB_LO_1267","ENG_062_MZB_LO_1267-09.09.2009","09.09.2009",2009,9,9,0.972531077,2
"ENG_062_MZB_LO_1267","ENG_062_MZB_LO_1267-14.11.2013","14.11.2013",2013,11,14,1.00780025,1
"ENG_062_MZB_LO_1267","ENG_062_MZB_LO_1267-08.10.2015","08.10.2015",2015,10,8,1.073170183,1
"ENG_062_MZB_LO_127","ENG_062_MZB_LO_127-13.11.2002","13.11.2002",2002,11,13,0.805061004,5
"ENG_062_MZB_LO_127","ENG_062_MZB_LO_127-15.09.2003","15.09.2003",2003,9,15,0.928019533,2
"ENG_062_MZB_LO_127","ENG_062_MZB_LO_127-27.09.2004","27.09.2004",2004,9,27,0.870068806,3
"ENG_062_MZB_LO_127","ENG_062_MZB_LO_127-29.09.2005","29.09.2005",2005,9,29,0.903725502,3
"ENG_062_MZB_LO_127","ENG_062_MZB_LO_127-03.10.2006","03.10.2006",2006,10,3,0.993693921,1
"ENG_062_MZB_LO_127","ENG_062_MZB_LO_127-16.10.2007","16.10.2007",2007,10,16,1.023112552,3
"ENG_062_MZB_LO_127","ENG_062_MZB_LO_127-05.11.2008","05.11.2008",2008,11,5,0.942301056,3
"ENG_062_MZB_LO_127","ENG_062_MZB_LO_127-20.10.2009","20.10.2009",2009,10,20,1.074657505,3
"ENG_062_MZB_LO_127","ENG_062_MZB_LO_127-02.09.2013","02.09.2013",2013,9,2,0.961143071,2
"ENG_062_MZB_LO_127","ENG_062_MZB_LO_127-25.09.2015","25.09.2015",2015,9,25,1.002078052,1
"ENG_062_MZB_LO_127","ENG_062_MZB_LO_127-14.09.2016","14.09.2016",2016,9,14,0.975786445,2
"ENG_062_MZB_LO_127","ENG_062_MZB_LO_127-04.10.2017","04.10.2017",2017,10,4,0.897300397,2
"ENG_062_MZB_LO_127","ENG_062_MZB_LO_127-12.09.2018","12.09.2018",2018,9,12,1.02229851,1
"ENG_062_MZB_LO_127","ENG_062_MZB_LO_127-22.10.2019","22.10.2019",2019,10,22,1.019448057,1
"ENG_062_MZB_LO_127","ENG_062_MZB_LO_127-12.10.2020","12.10.2020",2020,10,12,0.981073726,1
"ENG_062_MZB_LO_127","ENG_062_MZB_LO_127-06.11.2021","06.11.2021",2021,11,6,0.998310758,1
"ENG_062_MZB_LO_127","ENG_062_MZB_LO_127-16.11.2023","16.11.2023",2023,11,16,0.94294917,2
"ENG_062_MZB_LO_1271","ENG_062_MZB_LO_1271-11.09.2002","11.09.2002",2002,9,11,1.0028971,1
"ENG_062_MZB_LO_1271","ENG_062_MZB_LO_1271-04.10.2005","04.10.2005",2005,10,4,0.911169615,2
"ENG_062_MZB_LO_1271","ENG_062_MZB_LO_1271-20.11.2008","20.11.2008",2008,11,20,0.991862882,1
"ENG_062_MZB_LO_1271","ENG_062_MZB_LO_1271-21.10.2013","21.10.2013",2013,10,21,1.146622688,1
"ENG_062_MZB_LO_1271","ENG_062_MZB_LO_1271-13.10.2021","13.10.2021",2021,10,13,1.011693338,1
"ENG_062_MZB_LO_1271","ENG_062_MZB_LO_1271-29.09.2022","29.09.2022",2022,9,29,0.977073146,1
"ENG_062_MZB_LO_1271","ENG_062_MZB_LO_1271-23.11.2023","23.11.2023",2023,11,23,1.016691639,3
"ENG_062_MZB_LO_1280","ENG_062_MZB_LO_1280-09.09.2004","09.09.2004",2004,9,9,1.131910099,1
"ENG_062_MZB_LO_1280","ENG_062_MZB_LO_1280-14.09.2005","14.09.2005",2005,9,14,1.044348528,1
"ENG_062_MZB_LO_1280","ENG_062_MZB_LO_1280-16.10.2007","16.10.2007",2007,10,16,1.126328528,1
"ENG_062_MZB_LO_1280","ENG_062_MZB_LO_1280-17.09.2012","17.09.2012",2012,9,17,1.201198057,1
"ENG_062_MZB_LO_1280","ENG_062_MZB_LO_1280-28.10.2015","28.10.2015",2015,10,28,1.132755337,1
"ENG_062_MZB_LO_1280","ENG_062_MZB_LO_1280-13.10.2021","13.10.2021",2021,10,13,1.099748066,1
"ENG_062_MZB_LO_1280","ENG_062_MZB_LO_1280-30.09.2022","30.09.2022",2022,9,30,0.895756471,2
"ENG_062_MZB_LO_1280","ENG_062_MZB_LO_1280-02.10.2023","02.10.2023",2023,10,2,1.244042744,1
"ENG_062_MZB_LO_1284","ENG_062_MZB_LO_1284-01.10.2002","01.10.2002",2002,10,1,1.064804916,1
"ENG_062_MZB_LO_1284","ENG_062_MZB_LO_1284-29.09.2003","29.09.2003",2003,9,29,1.079807471,1
"ENG_062_MZB_LO_1284","ENG_062_MZB_LO_1284-19.10.2004","19.10.2004",2004,10,19,0.996073732,1
"ENG_062_MZB_LO_1284","ENG_062_MZB_LO_1284-30.11.2005","30.11.2005",2005,11,30,0.995531818,1
"ENG_062_MZB_LO_1284","ENG_062_MZB_LO_1284-21.09.2006","21.09.2006",2006,9,21,1.098654685,1
"ENG_062_MZB_LO_1284","ENG_062_MZB_LO_1284-14.10.2009","14.10.2009",2009,10,14,1.120517064,1
"ENG_062_MZB_LO_1284","ENG_062_MZB_LO_1284-22.09.2010","22.09.2010",2010,9,22,1.124306343,1
"ENG_062_MZB_LO_1284","ENG_062_MZB_LO_1284-23.11.2011","23.11.2011",2011,11,23,1.092506737,1
"ENG_062_MZB_LO_1284","ENG_062_MZB_LO_1284-24.10.2012","24.10.2012",2012,10,24,0.982823843,1
"ENG_062_MZB_LO_1284","ENG_062_MZB_LO_1284-09.09.2013","09.09.2013",2013,9,9,1.113585834,1
"ENG_062_MZB_LO_1284","ENG_062_MZB_LO_1284-09.09.2015","09.09.2015",2015,9,9,1.1575098,1
"ENG_062_MZB_LO_1284","ENG_062_MZB_LO_1284-12.10.2016","12.10.2016",2016,10,12,1.206247699,1
"ENG_062_MZB_LO_1284","ENG_062_MZB_LO_1284-09.10.2017","09.10.2017",2017,10,9,1.000880888,1
"ENG_062_MZB_LO_1284","ENG_062_MZB_LO_1284-19.09.2019","19.09.2019",2019,9,19,1.156121065,1
"ENG_062_MZB_LO_1285","ENG_062_MZB_LO_1285-25.09.2003","25.09.2003",2003,9,25,0.99670621,2
"ENG_062_MZB_LO_1285","ENG_062_MZB_LO_1285-14.09.2005","14.09.2005",2005,9,14,0.988161011,1
"ENG_062_MZB_LO_1285","ENG_062_MZB_LO_1285-26.09.2006","26.09.2006",2006,9,26,0.957985827,2
"ENG_062_MZB_LO_1285","ENG_062_MZB_LO_1285-16.10.2007","16.10.2007",2007,10,16,1.049405129,2
"ENG_062_MZB_LO_1285","ENG_062_MZB_LO_1285-20.11.2013","20.11.2013",2013,11,20,0.900005231,5
"ENG_062_MZB_LO_1285","ENG_062_MZB_LO_1285-28.10.2015","28.10.2015",2015,10,28,1.021701806,3
"ENG_062_MZB_LO_1285","ENG_062_MZB_LO_1285-18.10.2018","18.10.2018",2018,10,18,1.102876063,2
"ENG_062_MZB_LO_1286","ENG_062_MZB_LO_1286-22.09.2004","22.09.2004",2004,9,22,1.132684064,2
"ENG_062_MZB_LO_1286","ENG_062_MZB_LO_1286-11.09.2007","11.09.2007",2007,9,11,1.12291697,1
"ENG_062_MZB_LO_1286","ENG_062_MZB_LO_1286-04.09.2008","04.09.2008",2008,9,4,1.217412353,1
"ENG_062_MZB_LO_1286","ENG_062_MZB_LO_1286-22.09.2010","22.09.2010",2010,9,22,1.11192897,2
"ENG_062_MZB_LO_1286","ENG_062_MZB_LO_1286-23.11.2011","23.11.2011",2011,11,23,1.139520008,1
"ENG_062_MZB_LO_1286","ENG_062_MZB_LO_1286-10.10.2012","10.10.2012",2012,10,10,1.2233867,2
"ENG_062_MZB_LO_1286","ENG_062_MZB_LO_1286-11.11.2013","11.11.2013",2013,11,11,1.174673413,1
"ENG_062_MZB_LO_1286","ENG_062_MZB_LO_1286-27.10.2014","27.10.2014",2014,10,27,1.217169732,1
"ENG_062_MZB_LO_1286","ENG_062_MZB_LO_1286-24.09.2015","24.09.2015",2015,9,24,1.087792238,1
"ENG_062_MZB_LO_1286","ENG_062_MZB_LO_1286-12.10.2016","12.10.2016",2016,10,12,1.219382046,1
"ENG_062_MZB_LO_1286","ENG_062_MZB_LO_1286-09.10.2017","09.10.2017",2017,10,9,1.170480506,1
"ENG_062_MZB_LO_1286","ENG_062_MZB_LO_1286-02.10.2018","02.10.2018",2018,10,2,1.196375886,1
"ENG_062_MZB_LO_1286","ENG_062_MZB_LO_1286-19.09.2019","19.09.2019",2019,9,19,1.23606575,1
"ENG_062_MZB_LO_1286","ENG_062_MZB_LO_1286-21.09.2020","21.09.2020",2020,9,21,1.223692689,1
"ENG_062_MZB_LO_1286","ENG_062_MZB_LO_1286-11.10.2021","11.10.2021",2021,10,11,1.20140336,1
"ENG_062_MZB_LO_1286","ENG_062_MZB_LO_1286-06.09.2022","06.09.2022",2022,9,6,1.217932905,1
"ENG_062_MZB_LO_1286","ENG_062_MZB_LO_1286-19.09.2023","19.09.2023",2023,9,19,1.170508837,3
"ENG_062_MZB_LO_1286","ENG_062_MZB_LO_1286-16.09.2024","16.09.2024",2024,9,16,1.192569327,1
"ENG_062_MZB_LO_1287","ENG_062_MZB_LO_1287-04.10.2002","04.10.2002",2002,10,4,0.991665857,2
"ENG_062_MZB_LO_1287","ENG_062_MZB_LO_1287-22.09.2004","22.09.2004",2004,9,22,0.972123092,2
"ENG_062_MZB_LO_1287","ENG_062_MZB_LO_1287-01.09.2005","01.09.2005",2005,9,1,0.964468968,2
"ENG_062_MZB_LO_1287","ENG_062_MZB_LO_1287-20.09.2007","20.09.2007",2007,9,20,0.896871039,4
"ENG_062_MZB_LO_1287","ENG_062_MZB_LO_1287-29.10.2008","29.10.2008",2008,10,29,1.037006002,1
"ENG_062_MZB_LO_1287","ENG_062_MZB_LO_1287-08.10.2009","08.10.2009",2009,10,8,0.933085248,2
"ENG_062_MZB_LO_1287","ENG_062_MZB_LO_1287-23.09.2010","23.09.2010",2010,9,23,0.917113665,2
"ENG_062_MZB_LO_1287","ENG_062_MZB_LO_1287-23.11.2011","23.11.2011",2011,11,23,0.972706788,3
"ENG_062_MZB_LO_1287","ENG_062_MZB_LO_1287-10.10.2012","10.10.2012",2012,10,10,0.957029069,2
"ENG_062_MZB_LO_1287","ENG_062_MZB_LO_1287-20.09.2013","20.09.2013",2013,9,20,0.992906189,1
"ENG_062_MZB_LO_1287","ENG_062_MZB_LO_1287-29.09.2014","29.09.2014",2014,9,29,1.020685306,1
"ENG_062_MZB_LO_1287","ENG_062_MZB_LO_1287-21.10.2015","21.10.2015",2015,10,21,0.989100217,1
"ENG_062_MZB_LO_1287","ENG_062_MZB_LO_1287-12.10.2016","12.10.2016",2016,10,12,1.050366825,1
"ENG_062_MZB_LO_1287","ENG_062_MZB_LO_1287-09.10.2017","09.10.2017",2017,10,9,1.027163334,1
"ENG_062_MZB_LO_1287","ENG_062_MZB_LO_1287-02.10.2018","02.10.2018",2018,10,2,1.019155095,1
"ENG_062_MZB_LO_1287","ENG_062_MZB_LO_1287-31.10.2019","31.10.2019",2019,10,31,0.903435999,3
"ENG_062_MZB_LO_1287","ENG_062_MZB_LO_1287-05.11.2021","05.11.2021",2021,11,5,1.032543059,2
"ENG_062_MZB_LO_1287","ENG_062_MZB_LO_1287-11.11.2022","11.11.2022",2022,11,11,0.963519168,2
"ENG_062_MZB_LO_1287","ENG_062_MZB_LO_1287-19.09.2023","19.09.2023",2023,9,19,1.002128054,2
"ENG_062_MZB_LO_1288","ENG_062_MZB_LO_1288-22.09.2004","22.09.2004",2004,9,22,1.079509137,1
"ENG_062_MZB_LO_1288","ENG_062_MZB_LO_1288-11.09.2007","11.09.2007",2007,9,11,1.172088128,1
"ENG_062_MZB_LO_1288","ENG_062_MZB_LO_1288-08.10.2009","08.10.2009",2009,10,8,1.004503144,1
"ENG_062_MZB_LO_1288","ENG_062_MZB_LO_1288-23.09.2010","23.09.2010",2010,9,23,1.023266259,2
"ENG_062_MZB_LO_1288","ENG_062_MZB_LO_1288-23.11.2011","23.11.2011",2011,11,23,1.077592818,1
"ENG_062_MZB_LO_1288","ENG_062_MZB_LO_1288-10.10.2012","10.10.2012",2012,10,10,1.025362726,1
"ENG_062_MZB_LO_1288","ENG_062_MZB_LO_1288-30.09.2013","30.09.2013",2013,9,30,1.142730995,1
"ENG_062_MZB_LO_1288","ENG_062_MZB_LO_1288-25.09.2014","25.09.2014",2014,9,25,1.095943926,1
"ENG_062_MZB_LO_1288","ENG_062_MZB_LO_1288-21.10.2015","21.10.2015",2015,10,21,1.146461412,1
"ENG_062_MZB_LO_1288","ENG_062_MZB_LO_1288-12.10.2016","12.10.2016",2016,10,12,1.110284517,1
"ENG_062_MZB_LO_1288","ENG_062_MZB_LO_1288-09.10.2017","09.10.2017",2017,10,9,1.108680211,1
"ENG_062_MZB_LO_1288","ENG_062_MZB_LO_1288-18.10.2018","18.10.2018",2018,10,18,1.078457228,1
"ENG_062_MZB_LO_1288","ENG_062_MZB_LO_1288-30.09.2019","30.09.2019",2019,9,30,1.052008316,1
"ENG_062_MZB_LO_1288","ENG_062_MZB_LO_1288-13.10.2021","13.10.2021",2021,10,13,1.128165241,1
"ENG_062_MZB_LO_1288","ENG_062_MZB_LO_1288-06.09.2022","06.09.2022",2022,9,6,0.980424347,2
"ENG_062_MZB_LO_1288","ENG_062_MZB_LO_1288-02.10.2023","02.10.2023",2023,10,2,1.159930423,1
"ENG_062_MZB_LO_1291","ENG_062_MZB_LO_1291-13.11.2003","13.11.2003",2003,11,13,0.836388906,3
"ENG_062_MZB_LO_1291","ENG_062_MZB_LO_1291-20.10.2004","20.10.2004",2004,10,20,0.956323898,2
"ENG_062_MZB_LO_1291","ENG_062_MZB_LO_1291-22.10.2007","22.10.2007",2007,10,22,0.960246934,2
"ENG_062_MZB_LO_1291","ENG_062_MZB_LO_1291-10.10.2013","10.10.2013",2013,10,10,1.000800425,1
"ENG_062_MZB_LO_1291","ENG_062_MZB_LO_1291-08.09.2014","08.09.2014",2014,9,8,1.064183025,1
"ENG_062_MZB_LO_1291","ENG_062_MZB_LO_1291-21.09.2015","21.09.2015",2015,9,21,0.911362498,2
"ENG_062_MZB_LO_1291","ENG_062_MZB_LO_1291-10.11.2016","10.11.2016",2016,11,10,0.997598917,1
"ENG_062_MZB_LO_1291","ENG_062_MZB_LO_1291-10.10.2017","10.10.2017",2017,10,10,1.040402747,1
"ENG_062_MZB_LO_1291","ENG_062_MZB_LO_1291-09.10.2018","09.10.2018",2018,10,9,1.053518624,1
"ENG_062_MZB_LO_1291","ENG_062_MZB_LO_1291-23.10.2019","23.10.2019",2019,10,23,0.922510818,2
"ENG_062_MZB_LO_1291","ENG_062_MZB_LO_1291-05.11.2021","05.11.2021",2021,11,5,1.049524752,1
"ENG_062_MZB_LO_1291","ENG_062_MZB_LO_1291-14.11.2022","14.11.2022",2022,11,14,0.929073921,2
"ENG_062_MZB_LO_1291","ENG_062_MZB_LO_1291-10.10.2023","10.10.2023",2023,10,10,0.933460403,2
"ENG_062_MZB_LO_1291","ENG_062_MZB_LO_1291-24.09.2024","24.09.2024",2024,9,24,1.09469217,1
"ENG_062_MZB_LO_1292","ENG_062_MZB_LO_1292-20.09.2002","20.09.2002",2002,9,20,0.720503552,4
"ENG_062_MZB_LO_1292","ENG_062_MZB_LO_1292-04.10.2005","04.10.2005",2005,10,4,0.702207324,4
"ENG_062_MZB_LO_1292","ENG_062_MZB_LO_1292-05.10.2006","05.10.2006",2006,10,5,0.766269325,3
"ENG_062_MZB_LO_1292","ENG_062_MZB_LO_1292-19.10.2007","19.10.2007",2007,10,19,0.611389312,4
"ENG_062_MZB_LO_1292","ENG_062_MZB_LO_1292-27.10.2008","27.10.2008",2008,10,27,0.689044472,4
"ENG_062_MZB_LO_1292","ENG_062_MZB_LO_1292-20.10.2010","20.10.2010",2010,10,20,0.712180388,4
"ENG_062_MZB_LO_1292","ENG_062_MZB_LO_1292-20.11.2013","20.11.2013",2013,11,20,0.68954485,4
"ENG_062_MZB_LO_1292","ENG_062_MZB_LO_1292-24.10.2017","24.10.2017",2017,10,24,0.723282627,4
"ENG_062_MZB_LO_1293","ENG_062_MZB_LO_1293-20.09.2002","20.09.2002",2002,9,20,1.189913464,1
"ENG_062_MZB_LO_1293","ENG_062_MZB_LO_1293-04.10.2005","04.10.2005",2005,10,4,1.125859262,1
"ENG_062_MZB_LO_1293","ENG_062_MZB_LO_1293-28.10.2008","28.10.2008",2008,10,28,1.06729734,1
"ENG_062_MZB_LO_1293","ENG_062_MZB_LO_1293-28.10.2014","28.10.2014",2014,10,28,1.140049545,1
"ENG_062_MZB_LO_1293","ENG_062_MZB_LO_1293-23.11.2021","23.11.2021",2021,11,23,1.089729595,1
"ENG_062_MZB_LO_1293","ENG_062_MZB_LO_1293-26.10.2022","26.10.2022",2022,10,26,1.177321094,1
"ENG_062_MZB_LO_1293","ENG_062_MZB_LO_1293-11.10.2023","11.10.2023",2023,10,11,1.135746332,1
"ENG_062_MZB_LO_1294","ENG_062_MZB_LO_1294-25.09.2003","25.09.2003",2003,9,25,0.89605218,2
"ENG_062_MZB_LO_1294","ENG_062_MZB_LO_1294-21.09.2006","21.09.2006",2006,9,21,0.899125983,2
"ENG_062_MZB_LO_1294","ENG_062_MZB_LO_1294-30.09.2009","30.09.2009",2009,9,30,0.979936696,1
"ENG_062_MZB_LO_1294","ENG_062_MZB_LO_1294-24.10.2012","24.10.2012",2012,10,24,0.967917087,2
"ENG_062_MZB_LO_1294","ENG_062_MZB_LO_1294-18.11.2013","18.11.2013",2013,11,18,0.967869182,2
"ENG_062_MZB_LO_1294","ENG_062_MZB_LO_1294-21.10.2015","21.10.2015",2015,10,21,1.076793411,1
"ENG_062_MZB_LO_1294","ENG_062_MZB_LO_1294-18.10.2018","18.10.2018",2018,10,18,0.994338321,2
"ENG_062_MZB_LO_1295","ENG_062_MZB_LO_1295-09.09.2004","09.09.2004",2004,9,9,0.642513851,4
"ENG_062_MZB_LO_1295","ENG_062_MZB_LO_1295-17.10.2006","17.10.2006",2006,10,17,0.627060221,4
"ENG_062_MZB_LO_1295","ENG_062_MZB_LO_1295-28.09.2007","28.09.2007",2007,9,28,0.624930842,4
"ENG_062_MZB_LO_1295","ENG_062_MZB_LO_1295-09.09.2008","09.09.2008",2008,9,9,0.656654579,4
"ENG_062_MZB_LO_1295","ENG_062_MZB_LO_1295-26.09.2011","26.09.2011",2011,9,26,0.622926301,4
"ENG_062_MZB_LO_1295","ENG_062_MZB_LO_1295-24.10.2014","24.10.2014",2014,10,24,0.808529044,3
"ENG_062_MZB_LO_1295","ENG_062_MZB_LO_1295-04.10.2017","04.10.2017",2017,10,4,0.792540885,3
"ENG_062_MZB_LO_1296","ENG_062_MZB_LO_1296-15.10.2004","15.10.2004",2004,10,15,0.9384068,2
"ENG_062_MZB_LO_1296","ENG_062_MZB_LO_1296-19.10.2007","19.10.2007",2007,10,19,0.856268602,3
"ENG_062_MZB_LO_1296","ENG_062_MZB_LO_1296-30.09.2009","30.09.2009",2009,9,30,0.901629878,3
"ENG_062_MZB_LO_1296","ENG_062_MZB_LO_1296-15.10.2012","15.10.2012",2012,10,15,1.028159958,1
"ENG_062_MZB_LO_1296","ENG_062_MZB_LO_1296-13.10.2015","13.10.2015",2015,10,13,0.792979699,3
"ENG_062_MZB_LO_1296","ENG_062_MZB_LO_1296-01.11.2018","01.11.2018",2018,11,1,0.71868513,4
"ENG_062_MZB_LO_1296","ENG_062_MZB_LO_1296-15.11.2022","15.11.2022",2022,11,15,1.068582545,1
"ENG_062_MZB_LO_1297","ENG_062_MZB_LO_1297-29.09.2003","29.09.2003",2003,9,29,0.886372305,2
"ENG_062_MZB_LO_1297","ENG_062_MZB_LO_1297-21.09.2006","21.09.2006",2006,9,21,0.975509442,3
"ENG_062_MZB_LO_1297","ENG_062_MZB_LO_1297-09.10.2007","09.10.2007",2007,10,9,0.910867414,3
"ENG_062_MZB_LO_1297","ENG_062_MZB_LO_1297-14.10.2009","14.10.2009",2009,10,14,0.883314928,2
"ENG_062_MZB_LO_1297","ENG_062_MZB_LO_1297-20.09.2010","20.09.2010",2010,9,20,0.875709255,2
"ENG_062_MZB_LO_1297","ENG_062_MZB_LO_1297-26.09.2011","26.09.2011",2011,9,26,0.900130398,2
"ENG_062_MZB_LO_1297","ENG_062_MZB_LO_1297-15.10.2012","15.10.2012",2012,10,15,0.873901513,2
"ENG_062_MZB_LO_1297","ENG_062_MZB_LO_1297-18.09.2013","18.09.2013",2013,9,18,1.049560019,1
"ENG_062_MZB_LO_1297","ENG_062_MZB_LO_1297-24.10.2014","24.10.2014",2014,10,24,0.912625315,2
"ENG_062_MZB_LO_1297","ENG_062_MZB_LO_1297-28.10.2015","28.10.2015",2015,10,28,0.950854332,2
"ENG_062_MZB_LO_1297","ENG_062_MZB_LO_1297-02.11.2016","02.11.2016",2016,11,2,0.977753255,2
"ENG_062_MZB_LO_1297","ENG_062_MZB_LO_1297-04.10.2017","04.10.2017",2017,10,4,1.019147303,2
"ENG_062_MZB_LO_1297","ENG_062_MZB_LO_1297-01.11.2018","01.11.2018",2018,11,1,0.860705539,3
"ENG_062_MZB_LO_13","ENG_062_MZB_LO_13-12.09.2002","12.09.2002",2002,9,12,0.896412361,2
"ENG_062_MZB_LO_13","ENG_062_MZB_LO_13-16.09.2003","16.09.2003",2003,9,16,0.94785601,2
"ENG_062_MZB_LO_13","ENG_062_MZB_LO_13-02.09.2004","02.09.2004",2004,9,2,0.835839022,3
"ENG_062_MZB_LO_13","ENG_062_MZB_LO_13-09.09.2005","09.09.2005",2005,9,9,0.947644617,2
"ENG_062_MZB_LO_13","ENG_062_MZB_LO_13-06.09.2006","06.09.2006",2006,9,6,0.89616646,2
"ENG_062_MZB_LO_13","ENG_062_MZB_LO_13-24.09.2007","24.09.2007",2007,9,24,0.965050694,2
"ENG_062_MZB_LO_13","ENG_062_MZB_LO_13-29.09.2008","29.09.2008",2008,9,29,0.981003416,1
"ENG_062_MZB_LO_13","ENG_062_MZB_LO_13-11.09.2009","11.09.2009",2009,9,11,0.902283928,2
"ENG_062_MZB_LO_13","ENG_062_MZB_LO_13-12.10.2010","12.10.2010",2010,10,12,0.929198164,2
"ENG_062_MZB_LO_13","ENG_062_MZB_LO_13-21.10.2011","21.10.2011",2011,10,21,0.969120317,1
"ENG_062_MZB_LO_13","ENG_062_MZB_LO_13-25.09.2015","25.09.2015",2015,9,25,0.874324435,2
"ENG_062_MZB_LO_130","ENG_062_MZB_LO_130-01.10.2002","01.10.2002",2002,10,1,0.83490639,3
"ENG_062_MZB_LO_130","ENG_062_MZB_LO_130-10.09.2003","10.09.2003",2003,9,10,0.870080304,3
"ENG_062_MZB_LO_130","ENG_062_MZB_LO_130-28.09.2004","28.09.2004",2004,9,28,0.919954369,5
"ENG_062_MZB_LO_130","ENG_062_MZB_LO_130-06.09.2006","06.09.2006",2006,9,6,0.977888099,2
"ENG_062_MZB_LO_130","ENG_062_MZB_LO_130-14.09.2007","14.09.2007",2007,9,14,0.900342649,3
"ENG_062_MZB_LO_130","ENG_062_MZB_LO_130-30.09.2008","30.09.2008",2008,9,30,1.023589611,3
"ENG_062_MZB_LO_130","ENG_062_MZB_LO_130-14.10.2009","14.10.2009",2009,10,14,0.893263526,2
"ENG_062_MZB_LO_130","ENG_062_MZB_LO_130-11.10.2010","11.10.2010",2010,10,11,0.977325028,2
"ENG_062_MZB_LO_130","ENG_062_MZB_LO_130-10.10.2012","10.10.2012",2012,10,10,0.994070833,3
"ENG_062_MZB_LO_130","ENG_062_MZB_LO_130-16.09.2013","16.09.2013",2013,9,16,0.975941572,3
"ENG_062_MZB_LO_130","ENG_062_MZB_LO_130-17.09.2014","17.09.2014",2014,9,17,0.993061965,2
"ENG_062_MZB_LO_130","ENG_062_MZB_LO_130-08.09.2016","08.09.2016",2016,9,8,0.965150316,2
"ENG_062_MZB_LO_1300","ENG_062_MZB_LO_1300-20.09.2002","20.09.2002",2002,9,20,0.908977587,3
"ENG_062_MZB_LO_1300","ENG_062_MZB_LO_1300-04.10.2005","04.10.2005",2005,10,4,0.845301215,3
"ENG_062_MZB_LO_1300","ENG_062_MZB_LO_1300-19.10.2007","19.10.2007",2007,10,19,0.947328708,2
"ENG_062_MZB_LO_1300","ENG_062_MZB_LO_1300-14.10.2009","14.10.2009",2009,10,14,0.988738243,1
"ENG_062_MZB_LO_1300","ENG_062_MZB_LO_1300-09.10.2013","09.10.2013",2013,10,9,0.939031064,2
"ENG_062_MZB_LO_1300","ENG_062_MZB_LO_1300-13.10.2015","13.10.2015",2015,10,13,0.960830116,2
"ENG_062_MZB_LO_1300","ENG_062_MZB_LO_1300-03.10.2018","03.10.2018",2018,10,3,0.968174538,1
"ENG_062_MZB_LO_1303","ENG_062_MZB_LO_1303-22.10.2002","22.10.2002",2002,10,22,0.991845337,1
"ENG_062_MZB_LO_1303","ENG_062_MZB_LO_1303-07.10.2005","07.10.2005",2005,10,7,0.972706422,1
"ENG_062_MZB_LO_1303","ENG_062_MZB_LO_1303-15.10.2007","15.10.2007",2007,10,15,1.014924415,1
"ENG_062_MZB_LO_1303","ENG_062_MZB_LO_1303-12.11.2009","12.11.2009",2009,11,12,0.965719161,1
"ENG_062_MZB_LO_1303","ENG_062_MZB_LO_1303-07.10.2010","07.10.2010",2010,10,7,0.918117022,2
"ENG_062_MZB_LO_1303","ENG_062_MZB_LO_1303-01.11.2011","01.11.2011",2011,11,1,0.928406595,2
"ENG_062_MZB_LO_1303","ENG_062_MZB_LO_1303-12.09.2012","12.09.2012",2012,9,12,1.041369907,1
"ENG_062_MZB_LO_1303","ENG_062_MZB_LO_1303-23.09.2013","23.09.2013",2013,9,23,1.049179813,1
"ENG_062_MZB_LO_1303","ENG_062_MZB_LO_1303-26.09.2014","26.09.2014",2014,9,26,0.949390204,2
"ENG_062_MZB_LO_1303","ENG_062_MZB_LO_1303-09.09.2015","09.09.2015",2015,9,9,0.898344189,2
"ENG_062_MZB_LO_1303","ENG_062_MZB_LO_1303-09.09.2016","09.09.2016",2016,9,9,0.972957286,1
"ENG_062_MZB_LO_1303","ENG_062_MZB_LO_1303-08.09.2017","08.09.2017",2017,9,8,0.905779258,2
"ENG_062_MZB_LO_1303","ENG_062_MZB_LO_1303-01.10.2018","01.10.2018",2018,10,1,0.908871166,2
"ENG_062_MZB_LO_1303","ENG_062_MZB_LO_1303-11.09.2019","11.09.2019",2019,9,11,0.956818866,2
"ENG_062_MZB_LO_1304","ENG_062_MZB_LO_1304-22.09.2003","22.09.2003",2003,9,22,0.9447884,2
"ENG_062_MZB_LO_1304","ENG_062_MZB_LO_1304-20.09.2006","20.09.2006",2006,9,20,0.980755069,2
"ENG_062_MZB_LO_1304","ENG_062_MZB_LO_1304-08.09.2009","08.09.2009",2009,9,8,1.026362435,1
"ENG_062_MZB_LO_1304","ENG_062_MZB_LO_1304-29.09.2010","29.09.2010",2010,9,29,1.044753555,1
"ENG_062_MZB_LO_1304","ENG_062_MZB_LO_1304-08.11.2011","08.11.2011",2011,11,8,0.98348832,3
"ENG_062_MZB_LO_1304","ENG_062_MZB_LO_1304-10.10.2012","10.10.2012",2012,10,10,0.937235678,2
"ENG_062_MZB_LO_1304","ENG_062_MZB_LO_1304-23.10.2013","23.10.2013",2013,10,23,0.998032384,1
"ENG_062_MZB_LO_1304","ENG_062_MZB_LO_1304-02.10.2014","02.10.2014",2014,10,2,1.048349841,1
"ENG_062_MZB_LO_1304","ENG_062_MZB_LO_1304-12.10.2015","12.10.2015",2015,10,12,0.92420949,3
"ENG_062_MZB_LO_1304","ENG_062_MZB_LO_1304-29.11.2016","29.11.2016",2016,11,29,0.976917349,2
"ENG_062_MZB_LO_1304","ENG_062_MZB_LO_1304-07.11.2017","07.11.2017",2017,11,7,0.993994457,3
"ENG_062_MZB_LO_1304","ENG_062_MZB_LO_1304-06.11.2018","06.11.2018",2018,11,6,0.912655592,3
"ENG_062_MZB_LO_1304","ENG_062_MZB_LO_1304-24.09.2019","24.09.2019",2019,9,24,1.031776294,2
"ENG_062_MZB_LO_1306","ENG_062_MZB_LO_1306-31.10.2003","31.10.2003",2003,10,31,1.044687883,1
"ENG_062_MZB_LO_1306","ENG_062_MZB_LO_1306-06.11.2006","06.11.2006",2006,11,6,1.084740469,1
"ENG_062_MZB_LO_1306","ENG_062_MZB_LO_1306-15.10.2007","15.10.2007",2007,10,15,1.023762163,1
"ENG_062_MZB_LO_1306","ENG_062_MZB_LO_1306-13.11.2009","13.11.2009",2009,11,13,1.053293943,1
"ENG_062_MZB_LO_1306","ENG_062_MZB_LO_1306-13.10.2010","13.10.2010",2010,10,13,1.06962358,1
"ENG_062_MZB_LO_1306","ENG_062_MZB_LO_1306-26.10.2011","26.10.2011",2011,10,26,1.069587858,1
"ENG_062_MZB_LO_1306","ENG_062_MZB_LO_1306-12.09.2012","12.09.2012",2012,9,12,0.990432985,1
"ENG_062_MZB_LO_1306","ENG_062_MZB_LO_1306-05.10.2015","05.10.2015",2015,10,5,1.091825634,1
"ENG_062_MZB_LO_1309","ENG_062_MZB_LO_1309-16.09.2002","16.09.2002",2002,9,16,1.243860808,1
"ENG_062_MZB_LO_1309","ENG_062_MZB_LO_1309-28.10.2003","28.10.2003",2003,10,28,1.161069451,1
"ENG_062_MZB_LO_1309","ENG_062_MZB_LO_1309-19.11.2004","19.11.2004",2004,11,19,1.179768271,1
"ENG_062_MZB_LO_1309","ENG_062_MZB_LO_1309-02.11.2006","02.11.2006",2006,11,2,1.157901804,1
"ENG_062_MZB_LO_1309","ENG_062_MZB_LO_1309-22.10.2007","22.10.2007",2007,10,22,1.230011248,1
"ENG_062_MZB_LO_1309","ENG_062_MZB_LO_1309-13.10.2009","13.10.2009",2009,10,13,1.240322303,1
"ENG_062_MZB_LO_1309","ENG_062_MZB_LO_1309-02.09.2013","02.09.2013",2013,9,2,1.122008829,1
"ENG_062_MZB_LO_1309","ENG_062_MZB_LO_1309-07.09.2016","07.09.2016",2016,9,7,1.115340527,2
"ENG_062_MZB_LO_1309","ENG_062_MZB_LO_1309-15.10.2021","15.10.2021",2021,10,15,1.290963868,3
"ENG_062_MZB_LO_1309","ENG_062_MZB_LO_1309-22.09.2022","22.09.2022",2022,9,22,1.173636862,1
"ENG_062_MZB_LO_1309","ENG_062_MZB_LO_1309-13.09.2023","13.09.2023",2023,9,13,1.270206495,1
"ENG_062_MZB_LO_1310","ENG_062_MZB_LO_1310-28.04.2004","28.04.2004",2004,4,28,0.936524655,2
"ENG_062_MZB_LO_1310","ENG_062_MZB_LO_1310-13.05.2005","13.05.2005",2005,5,13,0.934133095,2
"ENG_062_MZB_LO_1310","ENG_062_MZB_LO_1310-27.04.2006","27.04.2006",2006,4,27,0.853978005,3
"ENG_062_MZB_LO_1310","ENG_062_MZB_LO_1310-20.04.2007","20.04.2007",2007,4,20,0.949315553,2
"ENG_062_MZB_LO_1310","ENG_062_MZB_LO_1310-18.03.2009","18.03.2009",2009,3,18,1.030842606,1
"ENG_062_MZB_LO_1310","ENG_062_MZB_LO_1310-03.05.2013","03.05.2013",2013,5,3,0.87809756,2
"ENG_062_MZB_LO_1310","ENG_062_MZB_LO_1310-18.05.2015","18.05.2015",2015,5,18,0.853666985,3
"ENG_062_MZB_LO_1312","ENG_062_MZB_LO_1312-01.10.2003","01.10.2003",2003,10,1,1.11417068,1
"ENG_062_MZB_LO_1312","ENG_062_MZB_LO_1312-06.10.2004","06.10.2004",2004,10,6,1.071331614,1
"ENG_062_MZB_LO_1312","ENG_062_MZB_LO_1312-28.09.2005","28.09.2005",2005,9,28,1.043124491,1
"ENG_062_MZB_LO_1312","ENG_062_MZB_LO_1312-31.10.2006","31.10.2006",2006,10,31,1.098224032,4
"ENG_062_MZB_LO_1312","ENG_062_MZB_LO_1312-16.09.2008","16.09.2008",2008,9,16,0.954986381,5
"ENG_062_MZB_LO_1312","ENG_062_MZB_LO_1312-23.10.2019","23.10.2019",2019,10,23,1.071393098,1
"ENG_062_MZB_LO_1312","ENG_062_MZB_LO_1312-08.10.2020","08.10.2020",2020,10,8,1.056397412,1
"ENG_062_MZB_LO_1312","ENG_062_MZB_LO_1312-09.11.2021","09.11.2021",2021,11,9,1.106344117,1
"ENG_062_MZB_LO_1313","ENG_062_MZB_LO_1313-16.10.2003","16.10.2003",2003,10,16,1.065794162,1
"ENG_062_MZB_LO_1313","ENG_062_MZB_LO_1313-13.10.2004","13.10.2004",2004,10,13,1.085265466,1
"ENG_062_MZB_LO_1313","ENG_062_MZB_LO_1313-20.10.2006","20.10.2006",2006,10,20,1.009946699,1
"ENG_062_MZB_LO_1313","ENG_062_MZB_LO_1313-09.09.2009","09.09.2009",2009,9,9,1.136977909,1
"ENG_062_MZB_LO_1313","ENG_062_MZB_LO_1313-14.10.2013","14.10.2013",2013,10,14,1.132288828,1
"ENG_062_MZB_LO_1313","ENG_062_MZB_LO_1313-23.10.2019","23.10.2019",2019,10,23,1.039513752,1
"ENG_062_MZB_LO_1313","ENG_062_MZB_LO_1313-15.10.2020","15.10.2020",2020,10,15,1.145031405,1
"ENG_062_MZB_LO_1313","ENG_062_MZB_LO_1313-09.11.2021","09.11.2021",2021,11,9,1.09103923,1
"ENG_062_MZB_LO_1315","ENG_062_MZB_LO_1315-16.05.2002","16.05.2002",2002,5,16,0.973087834,2
"ENG_062_MZB_LO_1315","ENG_062_MZB_LO_1315-21.04.2005","21.04.2005",2005,4,21,0.871352721,3
"ENG_062_MZB_LO_1315","ENG_062_MZB_LO_1315-24.04.2008","24.04.2008",2008,4,24,0.95766448,5
"ENG_062_MZB_LO_1315","ENG_062_MZB_LO_1315-01.03.2013","01.03.2013",2013,3,1,0.909289851,2
"ENG_062_MZB_LO_1315","ENG_062_MZB_LO_1315-07.05.2015","07.05.2015",2015,5,7,0.978335672,2
"ENG_062_MZB_LO_1315","ENG_062_MZB_LO_1315-18.04.2018","18.04.2018",2018,4,18,0.962700031,2
"ENG_062_MZB_LO_1315","ENG_062_MZB_LO_1315-26.05.2022","26.05.2022",2022,5,26,1.004397428,3
"ENG_062_MZB_LO_1316","ENG_062_MZB_LO_1316-23.09.2002","23.09.2002",2002,9,23,1.146837962,1
"ENG_062_MZB_LO_1316","ENG_062_MZB_LO_1316-17.10.2005","17.10.2005",2005,10,17,1.121004206,1
"ENG_062_MZB_LO_1316","ENG_062_MZB_LO_1316-02.09.2008","02.09.2008",2008,9,2,1.069143346,1
"ENG_062_MZB_LO_1316","ENG_062_MZB_LO_1316-01.10.2013","01.10.2013",2013,10,1,1.178877022,1
"ENG_062_MZB_LO_1316","ENG_062_MZB_LO_1316-12.10.2017","12.10.2017",2017,10,12,1.130668966,1
"ENG_062_MZB_LO_1316","ENG_062_MZB_LO_1316-20.11.2018","20.11.2018",2018,11,20,1.137541972,1
"ENG_062_MZB_LO_1316","ENG_062_MZB_LO_1316-10.10.2019","10.10.2019",2019,10,10,1.176916782,2
"ENG_062_MZB_LO_1316","ENG_062_MZB_LO_1316-22.09.2021","22.09.2021",2021,9,22,1.129363489,2
"ENG_062_MZB_LO_1316","ENG_062_MZB_LO_1316-14.11.2022","14.11.2022",2022,11,14,1.072835378,1
"ENG_062_MZB_LO_1316","ENG_062_MZB_LO_1316-15.09.2023","15.09.2023",2023,9,15,1.137328671,1
"ENG_062_MZB_LO_1317","ENG_062_MZB_LO_1317-27.09.2002","27.09.2002",2002,9,27,0.954172494,2
"ENG_062_MZB_LO_1317","ENG_062_MZB_LO_1317-13.11.2003","13.11.2003",2003,11,13,0.758242211,3
"ENG_062_MZB_LO_1317","ENG_062_MZB_LO_1317-06.10.2004","06.10.2004",2004,10,6,0.882656832,2
"ENG_062_MZB_LO_1317","ENG_062_MZB_LO_1317-07.09.2005","07.09.2005",2005,9,7,0.719853669,4
"ENG_062_MZB_LO_1317","ENG_062_MZB_LO_1317-25.09.2008","25.09.2008",2008,9,25,0.925026279,3
"ENG_062_MZB_LO_1317","ENG_062_MZB_LO_1317-28.11.2013","28.11.2013",2013,11,28,0.841312462,3
"ENG_062_MZB_LO_1317","ENG_062_MZB_LO_1317-25.11.2014","25.11.2014",2014,11,25,0.836898373,3
"ENG_062_MZB_LO_1318","ENG_062_MZB_LO_1318-18.03.2003","18.03.2003",2003,3,18,0.875504648,3
"ENG_062_MZB_LO_1318","ENG_062_MZB_LO_1318-10.05.2006","10.05.2006",2006,5,10,0.899832441,3
"ENG_062_MZB_LO_1318","ENG_062_MZB_LO_1318-17.04.2007","17.04.2007",2007,4,17,0.849790326,3
"ENG_062_MZB_LO_1318","ENG_062_MZB_LO_1318-26.04.2010","26.04.2010",2010,4,26,0.754064286,5
"ENG_062_MZB_LO_1318","ENG_062_MZB_LO_1318-22.05.2013","22.05.2013",2013,5,22,0.827802783,3
"ENG_062_MZB_LO_1318","ENG_062_MZB_LO_1318-14.04.2016","14.04.2016",2016,4,14,0.840322391,5
"ENG_062_MZB_LO_1318","ENG_062_MZB_LO_1318-06.05.2022","06.05.2022",2022,5,6,0.811122568,5
"ENG_062_MZB_LO_1319","ENG_062_MZB_LO_1319-23.09.2002","23.09.2002",2002,9,23,1.038170472,1
"ENG_062_MZB_LO_1319","ENG_062_MZB_LO_1319-28.10.2005","28.10.2005",2005,10,28,0.935791481,3
"ENG_062_MZB_LO_1319","ENG_062_MZB_LO_1319-02.09.2008","02.09.2008",2008,9,2,0.932971421,2
"ENG_062_MZB_LO_1319","ENG_062_MZB_LO_1319-07.11.2013","07.11.2013",2013,11,7,0.904465128,2
"ENG_062_MZB_LO_1319","ENG_062_MZB_LO_1319-23.10.2019","23.10.2019",2019,10,23,1.043576753,1
"ENG_062_MZB_LO_1319","ENG_062_MZB_LO_1319-15.10.2020","15.10.2020",2020,10,15,1.050917206,1
"ENG_062_MZB_LO_1319","ENG_062_MZB_LO_1319-09.11.2021","09.11.2021",2021,11,9,1.045322876,1
"ENG_062_MZB_LO_1319","ENG_062_MZB_LO_1319-30.11.2023","30.11.2023",2023,11,30,1.021258413,1
"ENG_062_MZB_LO_1324","ENG_062_MZB_LO_1324-23.10.2002","23.10.2002",2002,10,23,1.053751839,1
"ENG_062_MZB_LO_1324","ENG_062_MZB_LO_1324-10.09.2003","10.09.2003",2003,9,10,0.969613356,1
"ENG_062_MZB_LO_1324","ENG_062_MZB_LO_1324-08.10.2004","08.10.2004",2004,10,8,1.019588184,1
"ENG_062_MZB_LO_1324","ENG_062_MZB_LO_1324-19.09.2006","19.09.2006",2006,9,19,0.988629165,1
"ENG_062_MZB_LO_1324","ENG_062_MZB_LO_1324-08.11.2007","08.11.2007",2007,11,8,1.017091245,1
"ENG_062_MZB_LO_1324","ENG_062_MZB_LO_1324-03.10.2008","03.10.2008",2008,10,3,1.142798916,1
"ENG_062_MZB_LO_1324","ENG_062_MZB_LO_1324-28.09.2010","28.09.2010",2010,9,28,1.040649757,1
"ENG_062_MZB_LO_1324","ENG_062_MZB_LO_1324-17.10.2013","17.10.2013",2013,10,17,1.096420141,1
"ENG_062_MZB_LO_1324","ENG_062_MZB_LO_1324-14.09.2016","14.09.2016",2016,9,14,1.0667148,1
"ENG_062_MZB_LO_1324","ENG_062_MZB_LO_1324-08.11.2018","08.11.2018",2018,11,8,1.168044418,1
"ENG_062_MZB_LO_1324","ENG_062_MZB_LO_1324-15.10.2019","15.10.2019",2019,10,15,1.079851348,1
"ENG_062_MZB_LO_1324","ENG_062_MZB_LO_1324-12.10.2021","12.10.2021",2021,10,12,1.029882612,1
"ENG_062_MZB_LO_1324","ENG_062_MZB_LO_1324-07.10.2022","07.10.2022",2022,10,7,1.076026313,1
"ENG_062_MZB_LO_1324","ENG_062_MZB_LO_1324-27.09.2023","27.09.2023",2023,9,27,1.060555948,1
"ENG_062_MZB_LO_1326","ENG_062_MZB_LO_1326-17.09.2002","17.09.2002",2002,9,17,0.960979197,2
"ENG_062_MZB_LO_1326","ENG_062_MZB_LO_1326-10.09.2003","10.09.2003",2003,9,10,0.909922384,2
"ENG_062_MZB_LO_1326","ENG_062_MZB_LO_1326-07.10.2004","07.10.2004",2004,10,7,0.927542321,2
"ENG_062_MZB_LO_1326","ENG_062_MZB_LO_1326-05.10.2005","05.10.2005",2005,10,5,0.90504987,2
"ENG_062_MZB_LO_1326","ENG_062_MZB_LO_1326-04.10.2007","04.10.2007",2007,10,4,0.956529168,2
"ENG_062_MZB_LO_1326","ENG_062_MZB_LO_1326-03.10.2008","03.10.2008",2008,10,3,0.972539832,2
"ENG_062_MZB_LO_1326","ENG_062_MZB_LO_1326-16.11.2010","16.11.2010",2010,11,16,1.101831635,1
"ENG_062_MZB_LO_1326","ENG_062_MZB_LO_1326-01.09.2016","01.09.2016",2016,9,1,1.213004704,2
"ENG_062_MZB_LO_1326","ENG_062_MZB_LO_1326-08.11.2018","08.11.2018",2018,11,8,1.177428241,1
"ENG_062_MZB_LO_1326","ENG_062_MZB_LO_1326-15.10.2019","15.10.2019",2019,10,15,1.137497073,1
"ENG_062_MZB_LO_1326","ENG_062_MZB_LO_1326-12.10.2021","12.10.2021",2021,10,12,1.096995662,1
"ENG_062_MZB_LO_1326","ENG_062_MZB_LO_1326-07.10.2022","07.10.2022",2022,10,7,1.104116389,1
"ENG_062_MZB_LO_1326","ENG_062_MZB_LO_1326-27.09.2023","27.09.2023",2023,9,27,1.115712507,2
"ENG_062_MZB_LO_1327","ENG_062_MZB_LO_1327-09.09.2002","09.09.2002",2002,9,9,1.051064086,1
"ENG_062_MZB_LO_1327","ENG_062_MZB_LO_1327-10.09.2003","10.09.2003",2003,9,10,1.065652288,1
"ENG_062_MZB_LO_1327","ENG_062_MZB_LO_1327-07.10.2004","07.10.2004",2004,10,7,1.043233025,1
"ENG_062_MZB_LO_1327","ENG_062_MZB_LO_1327-05.10.2005","05.10.2005",2005,10,5,1.061227441,1
"ENG_062_MZB_LO_1327","ENG_062_MZB_LO_1327-21.09.2006","21.09.2006",2006,9,21,0.98996801,1
"ENG_062_MZB_LO_1327","ENG_062_MZB_LO_1327-01.11.2007","01.11.2007",2007,11,1,1.152840671,1
"ENG_062_MZB_LO_1327","ENG_062_MZB_LO_1327-30.10.2008","30.10.2008",2008,10,30,1.110940409,1
"ENG_062_MZB_LO_1327","ENG_062_MZB_LO_1327-28.09.2010","28.09.2010",2010,9,28,1.084292915,1
"ENG_062_MZB_LO_1327","ENG_062_MZB_LO_1327-22.09.2011","22.09.2011",2011,9,22,1.139867467,1
"ENG_062_MZB_LO_1327","ENG_062_MZB_LO_1327-10.10.2012","10.10.2012",2012,10,10,1.128244445,1
"ENG_062_MZB_LO_1327","ENG_062_MZB_LO_1327-02.10.2013","02.10.2013",2013,10,2,1.133045567,1
"ENG_062_MZB_LO_1327","ENG_062_MZB_LO_1327-18.09.2014","18.09.2014",2014,9,18,1.142711737,1
"ENG_062_MZB_LO_1327","ENG_062_MZB_LO_1327-01.10.2015","01.10.2015",2015,10,1,1.136499529,1
"ENG_062_MZB_LO_1327","ENG_062_MZB_LO_1327-14.09.2016","14.09.2016",2016,9,14,1.139325219,1
"ENG_062_MZB_LO_1327","ENG_062_MZB_LO_1327-18.09.2017","18.09.2017",2017,9,18,1.147037885,1
"ENG_062_MZB_LO_1327","ENG_062_MZB_LO_1327-17.10.2018","17.10.2018",2018,10,17,1.111326518,1
"ENG_062_MZB_LO_1327","ENG_062_MZB_LO_1327-15.10.2019","15.10.2019",2019,10,15,1.176466032,1
"ENG_062_MZB_LO_1327","ENG_062_MZB_LO_1327-13.10.2020","13.10.2020",2020,10,13,1.193744,1
"ENG_062_MZB_LO_1327","ENG_062_MZB_LO_1327-12.10.2021","12.10.2021",2021,10,12,1.101622341,1
"ENG_062_MZB_LO_1327","ENG_062_MZB_LO_1327-07.10.2022","07.10.2022",2022,10,7,1.107985621,1
"ENG_062_MZB_LO_1327","ENG_062_MZB_LO_1327-27.09.2023","27.09.2023",2023,9,27,1.170391342,1
"ENG_062_MZB_LO_1328","ENG_062_MZB_LO_1328-29.05.2002","29.05.2002",2002,5,29,1.049441416,1
"ENG_062_MZB_LO_1328","ENG_062_MZB_LO_1328-28.05.2003","28.05.2003",2003,5,28,1.063296616,1
"ENG_062_MZB_LO_1328","ENG_062_MZB_LO_1328-28.05.2004","28.05.2004",2004,5,28,1.034329018,1
"ENG_062_MZB_LO_1328","ENG_062_MZB_LO_1328-28.04.2005","28.04.2005",2005,4,28,1.049841104,1
"ENG_062_MZB_LO_1328","ENG_062_MZB_LO_1328-11.05.2006","11.05.2006",2006,5,11,1.061431813,1
"ENG_062_MZB_LO_1328","ENG_062_MZB_LO_1328-28.05.2008","28.05.2008",2008,5,28,1.099023405,1
"ENG_062_MZB_LO_1328","ENG_062_MZB_LO_1328-30.04.2009","30.04.2009",2009,4,30,1.074871616,1
"ENG_062_MZB_LO_1328","ENG_062_MZB_LO_1328-15.05.2024","15.05.2024",2024,5,15,1.076665011,1
"ENG_062_MZB_LO_133","ENG_062_MZB_LO_133-15.10.2002","15.10.2002",2002,10,15,0.939661665,2
"ENG_062_MZB_LO_133","ENG_062_MZB_LO_133-15.11.2005","15.11.2005",2005,11,15,0.854204867,3
"ENG_062_MZB_LO_133","ENG_062_MZB_LO_133-20.09.2007","20.09.2007",2007,9,20,0.976335914,2
"ENG_062_MZB_LO_133","ENG_062_MZB_LO_133-07.10.2010","07.10.2010",2010,10,7,0.90329749,3
"ENG_062_MZB_LO_133","ENG_062_MZB_LO_133-24.09.2013","24.09.2013",2013,9,24,0.875669735,2
"ENG_062_MZB_LO_133","ENG_062_MZB_LO_133-08.09.2015","08.09.2015",2015,9,8,0.906184272,2
"ENG_062_MZB_LO_133","ENG_062_MZB_LO_133-16.10.2018","16.10.2018",2018,10,16,0.871310259,2
"ENG_062_MZB_LO_1330","ENG_062_MZB_LO_1330-28.10.2003","28.10.2003",2003,10,28,1.151977057,1
"ENG_062_MZB_LO_1330","ENG_062_MZB_LO_1330-02.11.2006","02.11.2006",2006,11,2,1.164012099,1
"ENG_062_MZB_LO_1330","ENG_062_MZB_LO_1330-22.10.2007","22.10.2007",2007,10,22,1.195359886,1
"ENG_062_MZB_LO_1330","ENG_062_MZB_LO_1330-13.10.2009","13.10.2009",2009,10,13,1.267998413,1
"ENG_062_MZB_LO_1330","ENG_062_MZB_LO_1330-26.10.2011","26.10.2011",2011,10,26,1.202903909,1
"ENG_062_MZB_LO_1330","ENG_062_MZB_LO_1330-05.09.2012","05.09.2012",2012,9,5,1.258293369,1
"ENG_062_MZB_LO_1330","ENG_062_MZB_LO_1330-02.09.2013","02.09.2013",2013,9,2,1.318075541,1
"ENG_062_MZB_LO_1330","ENG_062_MZB_LO_1330-01.09.2014","01.09.2014",2014,9,1,1.233062344,1
"ENG_062_MZB_LO_1330","ENG_062_MZB_LO_1330-09.09.2015","09.09.2015",2015,9,9,1.167442248,1
"ENG_062_MZB_LO_1330","ENG_062_MZB_LO_1330-13.09.2016","13.09.2016",2016,9,13,1.333719861,1
"ENG_062_MZB_LO_1330","ENG_062_MZB_LO_1330-19.09.2017","19.09.2017",2017,9,19,1.268241855,1
"ENG_062_MZB_LO_1330","ENG_062_MZB_LO_1330-16.10.2018","16.10.2018",2018,10,16,1.307202587,1
"ENG_062_MZB_LO_1330","ENG_062_MZB_LO_1330-19.09.2019","19.09.2019",2019,9,19,1.264227519,1
"ENG_062_MZB_LO_1331","ENG_062_MZB_LO_1331-12.03.2003","12.03.2003",2003,3,12,0.883033298,2
"ENG_062_MZB_LO_1331","ENG_062_MZB_LO_1331-28.05.2004","28.05.2004",2004,5,28,0.951330894,2
"ENG_062_MZB_LO_1331","ENG_062_MZB_LO_1331-24.05.2007","24.05.2007",2007,5,24,0.813864445,3
"ENG_062_MZB_LO_1331","ENG_062_MZB_LO_1331-09.04.2009","09.04.2009",2009,4,9,0.90451884,2
"ENG_062_MZB_LO_1331","ENG_062_MZB_LO_1331-07.04.2010","07.04.2010",2010,4,7,0.84877437,3
"ENG_062_MZB_LO_1331","ENG_062_MZB_LO_1331-03.05.2013","03.05.2013",2013,5,3,0.830464191,3
"ENG_062_MZB_LO_1331","ENG_062_MZB_LO_1331-15.04.2021","15.04.2021",2021,4,15,0.850561202,3
"ENG_062_MZB_LO_1331","ENG_062_MZB_LO_1331-20.05.2022","20.05.2022",2022,5,20,0.930140274,2
"ENG_062_MZB_LO_1332","ENG_062_MZB_LO_1332-13.09.2002","13.09.2002",2002,9,13,0.668235249,4
"ENG_062_MZB_LO_1332","ENG_062_MZB_LO_1332-04.11.2003","04.11.2003",2003,11,4,0.695943394,4
"ENG_062_MZB_LO_1332","ENG_062_MZB_LO_1332-11.11.2005","11.11.2005",2005,11,11,0.663914482,4
"ENG_062_MZB_LO_1332","ENG_062_MZB_LO_1332-03.10.2006","03.10.2006",2006,10,3,0.619233555,5
"ENG_062_MZB_LO_1332","ENG_062_MZB_LO_1332-21.09.2007","21.09.2007",2007,9,21,0.647057443,4
"ENG_062_MZB_LO_1332","ENG_062_MZB_LO_1332-29.09.2008","29.09.2008",2008,9,29,0.72767606,3
"ENG_062_MZB_LO_1332","ENG_062_MZB_LO_1332-06.10.2009","06.10.2009",2009,10,6,0.719685852,3
"ENG_062_MZB_LO_1332","ENG_062_MZB_LO_1332-09.09.2013","09.09.2013",2013,9,9,0.725796924,3
"ENG_062_MZB_LO_1332","ENG_062_MZB_LO_1332-16.10.2015","16.10.2015",2015,10,16,0.914836187,2
"ENG_062_MZB_LO_1333","ENG_062_MZB_LO_1333-02.09.2002","02.09.2002",2002,9,2,1.15078122,1
"ENG_062_MZB_LO_1333","ENG_062_MZB_LO_1333-22.09.2003","22.09.2003",2003,9,22,1.128625879,1
"ENG_062_MZB_LO_1333","ENG_062_MZB_LO_1333-05.10.2005","05.10.2005",2005,10,5,1.068330388,1
"ENG_062_MZB_LO_1333","ENG_062_MZB_LO_1333-27.11.2006","27.11.2006",2006,11,27,1.094221694,1
"ENG_062_MZB_LO_1333","ENG_062_MZB_LO_1333-18.10.2007","18.10.2007",2007,10,18,1.108305841,1
"ENG_062_MZB_LO_1333","ENG_062_MZB_LO_1333-24.10.2008","24.10.2008",2008,10,24,1.118670996,1
"ENG_062_MZB_LO_1333","ENG_062_MZB_LO_1333-21.09.2009","21.09.2009",2009,9,21,1.038021404,1
"ENG_062_MZB_LO_1333","ENG_062_MZB_LO_1333-17.09.2013","17.09.2013",2013,9,17,1.01049934,1
"ENG_062_MZB_LO_1333","ENG_062_MZB_LO_1333-21.10.2015","21.10.2015",2015,10,21,1.078514363,1
"ENG_062_MZB_LO_1333","ENG_062_MZB_LO_1333-21.09.2017","21.09.2017",2017,9,21,1.049974657,1
"ENG_062_MZB_LO_1333","ENG_062_MZB_LO_1333-25.09.2018","25.09.2018",2018,9,25,1.078212124,1
"ENG_062_MZB_LO_1333","ENG_062_MZB_LO_1333-15.10.2019","15.10.2019",2019,10,15,1.077219347,1
"ENG_062_MZB_LO_1333","ENG_062_MZB_LO_1333-30.09.2020","30.09.2020",2020,9,30,1.088208314,1
"ENG_062_MZB_LO_1333","ENG_062_MZB_LO_1333-14.10.2021","14.10.2021",2021,10,14,1.120580258,1
"ENG_062_MZB_LO_1333","ENG_062_MZB_LO_1333-26.10.2022","26.10.2022",2022,10,26,1.022156145,1
"ENG_062_MZB_LO_1337","ENG_062_MZB_LO_1337-04.10.2002","04.10.2002",2002,10,4,0.993258713,1
"ENG_062_MZB_LO_1337","ENG_062_MZB_LO_1337-10.10.2005","10.10.2005",2005,10,10,0.903086954,2
"ENG_062_MZB_LO_1337","ENG_062_MZB_LO_1337-30.10.2007","30.10.2007",2007,10,30,0.93836823,2
"ENG_062_MZB_LO_1337","ENG_062_MZB_LO_1337-15.09.2008","15.09.2008",2008,9,15,1.001843147,1
"ENG_062_MZB_LO_1337","ENG_062_MZB_LO_1337-26.11.2010","26.11.2010",2010,11,26,0.886605891,2
"ENG_062_MZB_LO_1337","ENG_062_MZB_LO_1337-24.09.2013","24.09.2013",2013,9,24,0.938099434,2
"ENG_062_MZB_LO_1337","ENG_062_MZB_LO_1337-12.09.2016","12.09.2016",2016,9,12,0.971108624,2
"ENG_062_MZB_LO_1337","ENG_062_MZB_LO_1337-14.09.2017","14.09.2017",2017,9,14,1.022399216,1
"ENG_062_MZB_LO_1337","ENG_062_MZB_LO_1337-01.10.2018","01.10.2018",2018,10,1,0.883857033,2
"ENG_062_MZB_LO_1337","ENG_062_MZB_LO_1337-27.09.2019","27.09.2019",2019,9,27,0.969726447,1
"ENG_062_MZB_LO_1337","ENG_062_MZB_LO_1337-09.10.2023","09.10.2023",2023,10,9,0.993586274,1
"ENG_062_MZB_LO_1339","ENG_062_MZB_LO_1339-07.10.2003","07.10.2003",2003,10,7,0.901634934,2
"ENG_062_MZB_LO_1339","ENG_062_MZB_LO_1339-13.10.2006","13.10.2006",2006,10,13,0.928524252,2
"ENG_062_MZB_LO_1339","ENG_062_MZB_LO_1339-16.10.2008","16.10.2008",2008,10,16,0.926805334,2
"ENG_062_MZB_LO_1339","ENG_062_MZB_LO_1339-19.09.2017","19.09.2017",2017,9,19,0.925882164,3
"ENG_062_MZB_LO_1339","ENG_062_MZB_LO_1339-16.10.2018","16.10.2018",2018,10,16,0.87300517,2
"ENG_062_MZB_LO_1339","ENG_062_MZB_LO_1339-10.09.2019","10.09.2019",2019,9,10,0.856180208,3
"ENG_062_MZB_LO_1339","ENG_062_MZB_LO_1339-04.09.2023","04.09.2023",2023,9,4,0.943266884,2
"ENG_062_MZB_LO_134","ENG_062_MZB_LO_134-04.04.2002","04.04.2002",2002,4,4,0.881105029,2
"ENG_062_MZB_LO_134","ENG_062_MZB_LO_134-17.05.2005","17.05.2005",2005,5,17,0.869310967,2
"ENG_062_MZB_LO_134","ENG_062_MZB_LO_134-14.05.2008","14.05.2008",2008,5,14,0.873640059,2
"ENG_062_MZB_LO_134","ENG_062_MZB_LO_134-08.03.2013","08.03.2013",2013,3,8,0.925823936,2
"ENG_062_MZB_LO_134","ENG_062_MZB_LO_134-19.05.2014","19.05.2014",2014,5,19,0.908935416,2
"ENG_062_MZB_LO_134","ENG_062_MZB_LO_134-26.04.2018","26.04.2018",2018,4,26,0.974238459,1
"ENG_062_MZB_LO_134","ENG_062_MZB_LO_134-02.04.2024","02.04.2024",2024,4,2,0.865708885,3
"ENG_062_MZB_LO_1340","ENG_062_MZB_LO_1340-04.10.2002","04.10.2002",2002,10,4,1.010456383,1
"ENG_062_MZB_LO_1340","ENG_062_MZB_LO_1340-12.10.2005","12.10.2005",2005,10,12,0.926454844,2
"ENG_062_MZB_LO_1340","ENG_062_MZB_LO_1340-16.10.2008","16.10.2008",2008,10,16,1.040938677,1
"ENG_062_MZB_LO_1340","ENG_062_MZB_LO_1340-24.09.2013","24.09.2013",2013,9,24,1.05073621,3
"ENG_062_MZB_LO_1340","ENG_062_MZB_LO_1340-08.09.2017","08.09.2017",2017,9,8,1.051823513,1
"ENG_062_MZB_LO_1340","ENG_062_MZB_LO_1340-09.10.2018","09.10.2018",2018,10,9,1.031647336,1
"ENG_062_MZB_LO_1340","ENG_062_MZB_LO_1340-11.09.2019","11.09.2019",2019,9,11,0.972145948,3
"ENG_062_MZB_LO_1340","ENG_062_MZB_LO_1340-19.10.2021","19.10.2021",2021,10,19,1.135317767,3
"ENG_062_MZB_LO_1340","ENG_062_MZB_LO_1340-07.09.2022","07.09.2022",2022,9,7,1.084701025,5
"ENG_062_MZB_LO_1340","ENG_062_MZB_LO_1340-13.09.2023","13.09.2023",2023,9,13,1.108606179,5
"ENG_062_MZB_LO_1341","ENG_062_MZB_LO_1341-07.10.2004","07.10.2004",2004,10,7,1.014139391,1
"ENG_062_MZB_LO_1341","ENG_062_MZB_LO_1341-29.10.2008","29.10.2008",2008,10,29,1.037144069,3
"ENG_062_MZB_LO_1341","ENG_062_MZB_LO_1341-09.09.2013","09.09.2013",2013,9,9,1.090845523,1
"ENG_062_MZB_LO_1341","ENG_062_MZB_LO_1341-14.09.2017","14.09.2017",2017,9,14,1.075051316,1
"ENG_062_MZB_LO_1341","ENG_062_MZB_LO_1341-13.11.2018","13.11.2018",2018,11,13,1.030757712,1
"ENG_062_MZB_LO_1341","ENG_062_MZB_LO_1341-20.09.2019","20.09.2019",2019,9,20,1.110134112,2
"ENG_062_MZB_LO_1341","ENG_062_MZB_LO_1341-27.09.2021","27.09.2021",2021,9,27,1.125154485,2
"ENG_062_MZB_LO_1341","ENG_062_MZB_LO_1341-23.09.2022","23.09.2022",2022,9,23,1.033400631,2
"ENG_062_MZB_LO_1342","ENG_062_MZB_LO_1342-06.10.2004","06.10.2004",2004,10,6,0.915394086,2
"ENG_062_MZB_LO_1342","ENG_062_MZB_LO_1342-30.10.2008","30.10.2008",2008,10,30,0.983178454,1
"ENG_062_MZB_LO_1342","ENG_062_MZB_LO_1342-12.10.2009","12.10.2009",2009,10,12,0.924734885,2
"ENG_062_MZB_LO_1342","ENG_062_MZB_LO_1342-26.11.2010","26.11.2010",2010,11,26,0.965080039,2
"ENG_062_MZB_LO_1342","ENG_062_MZB_LO_1342-04.10.2011","04.10.2011",2011,10,4,0.868426789,2
"ENG_062_MZB_LO_1342","ENG_062_MZB_LO_1342-30.10.2012","30.10.2012",2012,10,30,0.975366802,2
"ENG_062_MZB_LO_1342","ENG_062_MZB_LO_1342-27.09.2013","27.09.2013",2013,9,27,1.019959615,1
"ENG_062_MZB_LO_1342","ENG_062_MZB_LO_1342-21.11.2014","21.11.2014",2014,11,21,0.990108506,2
"ENG_062_MZB_LO_1342","ENG_062_MZB_LO_1342-03.11.2015","03.11.2015",2015,11,3,0.953503009,2
"ENG_062_MZB_LO_1342","ENG_062_MZB_LO_1342-05.09.2016","05.09.2016",2016,9,5,0.979439036,2
"ENG_062_MZB_LO_1342","ENG_062_MZB_LO_1342-19.09.2017","19.09.2017",2017,9,19,1.000131861,2
"ENG_062_MZB_LO_1342","ENG_062_MZB_LO_1342-19.10.2018","19.10.2018",2018,10,19,0.958382487,2
"ENG_062_MZB_LO_1342","ENG_062_MZB_LO_1342-23.09.2019","23.09.2019",2019,9,23,1.010671286,2
"ENG_062_MZB_LO_1343","ENG_062_MZB_LO_1343-15.10.2002","15.10.2002",2002,10,15,0.94261958,2
"ENG_062_MZB_LO_1343","ENG_062_MZB_LO_1343-14.10.2005","14.10.2005",2005,10,14,0.959141403,2
"ENG_062_MZB_LO_1343","ENG_062_MZB_LO_1343-25.09.2008","25.09.2008",2008,9,25,1.039583449,2
"ENG_062_MZB_LO_1343","ENG_062_MZB_LO_1343-22.10.2013","22.10.2013",2013,10,22,1.015470653,2
"ENG_062_MZB_LO_1343","ENG_062_MZB_LO_1343-10.11.2015","10.11.2015",2015,11,10,0.949459218,3
"ENG_062_MZB_LO_1343","ENG_062_MZB_LO_1343-01.10.2018","01.10.2018",2018,10,1,1.036732178,1
"ENG_062_MZB_LO_1343","ENG_062_MZB_LO_1343-29.09.2022","29.09.2022",2022,9,29,1.001165943,1
"ENG_062_MZB_LO_1344","ENG_062_MZB_LO_1344-15.10.2002","15.10.2002",2002,10,15,1.068064402,1
"ENG_062_MZB_LO_1344","ENG_062_MZB_LO_1344-12.10.2005","12.10.2005",2005,10,12,1.05414125,2
"ENG_062_MZB_LO_1344","ENG_062_MZB_LO_1344-30.10.2007","30.10.2007",2007,10,30,1.088440162,4
"ENG_062_MZB_LO_1344","ENG_062_MZB_LO_1344-15.10.2008","15.10.2008",2008,10,15,1.111477581,3
"ENG_062_MZB_LO_1344","ENG_062_MZB_LO_1344-04.10.2011","04.10.2011",2011,10,4,0.912421075,3
"ENG_062_MZB_LO_1344","ENG_062_MZB_LO_1344-22.10.2013","22.10.2013",2013,10,22,0.907663514,3
"ENG_062_MZB_LO_1344","ENG_062_MZB_LO_1344-05.09.2014","05.09.2014",2014,9,5,0.884102278,5
"ENG_062_MZB_LO_1344","ENG_062_MZB_LO_1344-25.09.2017","25.09.2017",2017,9,25,1.009446969,3
"ENG_062_MZB_LO_1344","ENG_062_MZB_LO_1344-19.10.2018","19.10.2018",2018,10,19,1.066960884,3
"ENG_062_MZB_LO_1344","ENG_062_MZB_LO_1344-11.11.2019","11.11.2019",2019,11,11,0.923145011,5
"ENG_062_MZB_LO_1345","ENG_062_MZB_LO_1345-04.10.2002","04.10.2002",2002,10,4,0.978630558,1
"ENG_062_MZB_LO_1345","ENG_062_MZB_LO_1345-12.10.2005","12.10.2005",2005,10,12,0.848511983,3
"ENG_062_MZB_LO_1345","ENG_062_MZB_LO_1345-25.09.2008","25.09.2008",2008,9,25,0.923549479,2
"ENG_062_MZB_LO_1345","ENG_062_MZB_LO_1345-21.10.2013","21.10.2013",2013,10,21,0.8942691,4
"ENG_062_MZB_LO_1345","ENG_062_MZB_LO_1345-10.11.2015","10.11.2015",2015,11,10,0.806994211,3
"ENG_062_MZB_LO_1345","ENG_062_MZB_LO_1345-06.11.2018","06.11.2018",2018,11,6,0.856398131,3
"ENG_062_MZB_LO_1345","ENG_062_MZB_LO_1345-29.09.2022","29.09.2022",2022,9,29,0.654345154,4
"ENG_062_MZB_LO_1346","ENG_062_MZB_LO_1346-04.10.2002","04.10.2002",2002,10,4,0.906444235,2
"ENG_062_MZB_LO_1346","ENG_062_MZB_LO_1346-14.10.2005","14.10.2005",2005,10,14,0.784119782,3
"ENG_062_MZB_LO_1346","ENG_062_MZB_LO_1346-15.09.2008","15.09.2008",2008,9,15,0.832784311,3
"ENG_062_MZB_LO_1346","ENG_062_MZB_LO_1346-14.10.2013","14.10.2013",2013,10,14,0.613612676,5
"ENG_062_MZB_LO_1346","ENG_062_MZB_LO_1346-03.09.2014","03.09.2014",2014,9,3,0.566956012,5
"ENG_062_MZB_LO_1346","ENG_062_MZB_LO_1346-04.09.2017","04.09.2017",2017,9,4,0.879787924,2
"ENG_062_MZB_LO_1346","ENG_062_MZB_LO_1346-16.10.2018","16.10.2018",2018,10,16,0.768108424,3
"ENG_062_MZB_LO_1346","ENG_062_MZB_LO_1346-27.09.2019","27.09.2019",2019,9,27,0.755992619,3
"ENG_062_MZB_LO_1346","ENG_062_MZB_LO_1346-13.09.2023","13.09.2023",2023,9,13,0.820258371,3
"ENG_062_MZB_LO_1347","ENG_062_MZB_LO_1347-16.05.2002","16.05.2002",2002,5,16,0.906329112,2
"ENG_062_MZB_LO_1347","ENG_062_MZB_LO_1347-11.05.2005","11.05.2005",2005,5,11,0.865846568,3
"ENG_062_MZB_LO_1347","ENG_062_MZB_LO_1347-25.04.2008","25.04.2008",2008,4,25,0.856784006,3
"ENG_062_MZB_LO_1347","ENG_062_MZB_LO_1347-09.04.2009","09.04.2009",2009,4,9,0.851198744,3
"ENG_062_MZB_LO_1347","ENG_062_MZB_LO_1347-16.05.2013","16.05.2013",2013,5,16,0.980106939,2
"ENG_062_MZB_LO_1347","ENG_062_MZB_LO_1347-14.04.2016","14.04.2016",2016,4,14,0.935569225,3
"ENG_062_MZB_LO_1347","ENG_062_MZB_LO_1347-30.05.2023","30.05.2023",2023,5,30,0.975100894,2
"ENG_062_MZB_LO_1348","ENG_062_MZB_LO_1348-10.10.2002","10.10.2002",2002,10,10,0.765386306,3
"ENG_062_MZB_LO_1348","ENG_062_MZB_LO_1348-22.10.2003","22.10.2003",2003,10,22,0.771480372,3
"ENG_062_MZB_LO_1348","ENG_062_MZB_LO_1348-18.10.2006","18.10.2006",2006,10,18,0.827507955,3
"ENG_062_MZB_LO_1348","ENG_062_MZB_LO_1348-12.09.2008","12.09.2008",2008,9,12,0.727390682,3
"ENG_062_MZB_LO_1348","ENG_062_MZB_LO_1348-28.10.2009","28.10.2009",2009,10,28,0.761916885,3
"ENG_062_MZB_LO_1348","ENG_062_MZB_LO_1348-13.10.2010","13.10.2010",2010,10,13,0.782502431,3
"ENG_062_MZB_LO_1348","ENG_062_MZB_LO_1348-18.10.2011","18.10.2011",2011,10,18,0.76274004,3
"ENG_062_MZB_LO_1348","ENG_062_MZB_LO_1348-13.11.2012","13.11.2012",2012,11,13,0.775820775,3
"ENG_062_MZB_LO_1348","ENG_062_MZB_LO_1348-12.11.2013","12.11.2013",2013,11,12,0.727119384,4
"ENG_062_MZB_LO_1348","ENG_062_MZB_LO_1348-28.10.2014","28.10.2014",2014,10,28,0.76379297,3
"ENG_062_MZB_LO_1348","ENG_062_MZB_LO_1348-08.10.2015","08.10.2015",2015,10,8,0.757635503,3
"ENG_062_MZB_LO_1348","ENG_062_MZB_LO_1348-09.11.2016","09.11.2016",2016,11,9,0.696313079,4
"ENG_062_MZB_LO_1348","ENG_062_MZB_LO_1348-18.10.2017","18.10.2017",2017,10,18,0.761013773,3
"ENG_062_MZB_LO_1348","ENG_062_MZB_LO_1348-03.10.2018","03.10.2018",2018,10,3,0.742136714,3
"ENG_062_MZB_LO_1348","ENG_062_MZB_LO_1348-08.10.2019","08.10.2019",2019,10,8,0.731912606,4
"ENG_062_MZB_LO_1348","ENG_062_MZB_LO_1348-30.10.2023","30.10.2023",2023,10,30,0.837802651,3
"ENG_062_MZB_LO_1349","ENG_062_MZB_LO_1349-08.09.2008","08.09.2008",2008,9,8,1.079600511,1
"ENG_062_MZB_LO_1349","ENG_062_MZB_LO_1349-02.09.2013","02.09.2013",2013,9,2,0.702208465,4
"ENG_062_MZB_LO_1349","ENG_062_MZB_LO_1349-01.09.2014","01.09.2014",2014,9,1,0.870510704,3
"ENG_062_MZB_LO_1349","ENG_062_MZB_LO_1349-15.10.2018","15.10.2018",2018,10,15,0.949674593,3
"ENG_062_MZB_LO_1349","ENG_062_MZB_LO_1349-09.10.2019","09.10.2019",2019,10,9,0.855714083,3
"ENG_062_MZB_LO_1349","ENG_062_MZB_LO_1349-15.10.2021","15.10.2021",2021,10,15,1.04980446,1
"ENG_062_MZB_LO_1349","ENG_062_MZB_LO_1349-22.09.2022","22.09.2022",2022,9,22,0.789892824,4
"ENG_062_MZB_LO_1349","ENG_062_MZB_LO_1349-15.09.2023","15.09.2023",2023,9,15,1.005059177,1
"ENG_062_MZB_LO_135","ENG_062_MZB_LO_135-18.09.2002","18.09.2002",2002,9,18,0.8368483,3
"ENG_062_MZB_LO_135","ENG_062_MZB_LO_135-24.10.2003","24.10.2003",2003,10,24,0.957535262,2
"ENG_062_MZB_LO_135","ENG_062_MZB_LO_135-07.10.2004","07.10.2004",2004,10,7,1.010827049,1
"ENG_062_MZB_LO_135","ENG_062_MZB_LO_135-20.10.2005","20.10.2005",2005,10,20,1.073217886,1
"ENG_062_MZB_LO_135","ENG_062_MZB_LO_135-02.11.2006","02.11.2006",2006,11,2,1.109604344,1
"ENG_062_MZB_LO_135","ENG_062_MZB_LO_135-17.09.2007","17.09.2007",2007,9,17,1.083654249,1
"ENG_062_MZB_LO_135","ENG_062_MZB_LO_135-26.11.2008","26.11.2008",2008,11,26,1.005440857,1
"ENG_062_MZB_LO_135","ENG_062_MZB_LO_135-05.10.2009","05.10.2009",2009,10,5,1.085916564,1
"ENG_062_MZB_LO_135","ENG_062_MZB_LO_135-30.09.2010","30.09.2010",2010,9,30,0.974653713,1
"ENG_062_MZB_LO_135","ENG_062_MZB_LO_135-03.09.2013","03.09.2013",2013,9,3,0.999460438,1
"ENG_062_MZB_LO_135","ENG_062_MZB_LO_135-21.10.2016","21.10.2016",2016,10,21,0.994768973,1
"ENG_062_MZB_LO_135","ENG_062_MZB_LO_135-12.10.2017","12.10.2017",2017,10,12,0.994836734,1
"ENG_062_MZB_LO_1352","ENG_062_MZB_LO_1352-06.10.2002","06.10.2002",2002,10,6,1.060617557,1
"ENG_062_MZB_LO_1352","ENG_062_MZB_LO_1352-10.09.2003","10.09.2003",2003,9,10,1.043263518,1
"ENG_062_MZB_LO_1352","ENG_062_MZB_LO_1352-07.10.2004","07.10.2004",2004,10,7,0.961759262,2
"ENG_062_MZB_LO_1352","ENG_062_MZB_LO_1352-07.10.2005","07.10.2005",2005,10,7,1.05896948,1
"ENG_062_MZB_LO_1352","ENG_062_MZB_LO_1352-21.09.2006","21.09.2006",2006,9,21,0.952092648,2
"ENG_062_MZB_LO_1352","ENG_062_MZB_LO_1352-01.10.2007","01.10.2007",2007,10,1,1.052137912,1
"ENG_062_MZB_LO_1352","ENG_062_MZB_LO_1352-30.10.2008","30.10.2008",2008,10,30,1.092704641,1
"ENG_062_MZB_LO_1352","ENG_062_MZB_LO_1352-21.11.2018","21.11.2018",2018,11,21,1.129364452,1
"ENG_062_MZB_LO_1352","ENG_062_MZB_LO_1352-15.10.2019","15.10.2019",2019,10,15,1.04708337,1
"ENG_062_MZB_LO_1352","ENG_062_MZB_LO_1352-13.10.2020","13.10.2020",2020,10,13,1.097572376,1
"ENG_062_MZB_LO_1352","ENG_062_MZB_LO_1352-12.10.2021","12.10.2021",2021,10,12,1.121356889,1
"ENG_062_MZB_LO_1352","ENG_062_MZB_LO_1352-07.10.2022","07.10.2022",2022,10,7,1.12965641,1
"ENG_062_MZB_LO_1352","ENG_062_MZB_LO_1352-27.09.2023","27.09.2023",2023,9,27,1.12851724,1
"ENG_062_MZB_LO_1354","ENG_062_MZB_LO_1354-17.09.2002","17.09.2002",2002,9,17,0.928822826,2
"ENG_062_MZB_LO_1354","ENG_062_MZB_LO_1354-10.09.2003","10.09.2003",2003,9,10,0.951022623,2
"ENG_062_MZB_LO_1354","ENG_062_MZB_LO_1354-07.10.2004","07.10.2004",2004,10,7,0.871545699,2
"ENG_062_MZB_LO_1354","ENG_062_MZB_LO_1354-05.10.2005","05.10.2005",2005,10,5,0.805466107,3
"ENG_062_MZB_LO_1354","ENG_062_MZB_LO_1354-04.10.2006","04.10.2006",2006,10,4,0.877087418,2
"ENG_062_MZB_LO_1354","ENG_062_MZB_LO_1354-04.10.2007","04.10.2007",2007,10,4,0.84089719,3
"ENG_062_MZB_LO_1354","ENG_062_MZB_LO_1354-03.10.2008","03.10.2008",2008,10,3,0.871678251,3
"ENG_062_MZB_LO_1354","ENG_062_MZB_LO_1354-08.11.2018","08.11.2018",2018,11,8,1.125180702,1
"ENG_062_MZB_LO_1354","ENG_062_MZB_LO_1354-15.10.2019","15.10.2019",2019,10,15,1.148031826,1
"ENG_062_MZB_LO_1354","ENG_062_MZB_LO_1354-13.10.2020","13.10.2020",2020,10,13,1.059796295,1
"ENG_062_MZB_LO_1354","ENG_062_MZB_LO_1354-12.10.2021","12.10.2021",2021,10,12,1.14104011,1
"ENG_062_MZB_LO_1354","ENG_062_MZB_LO_1354-07.10.2022","07.10.2022",2022,10,7,1.061784203,1
"ENG_062_MZB_LO_1354","ENG_062_MZB_LO_1354-27.09.2023","27.09.2023",2023,9,27,1.114531689,2
"ENG_062_MZB_LO_1355","ENG_062_MZB_LO_1355-18.11.2002","18.11.2002",2002,11,18,0.94389281,5
"ENG_062_MZB_LO_1355","ENG_062_MZB_LO_1355-30.10.2003","30.10.2003",2003,10,30,0.982766978,2
"ENG_062_MZB_LO_1355","ENG_062_MZB_LO_1355-22.10.2004","22.10.2004",2004,10,22,0.847115983,3
"ENG_062_MZB_LO_1355","ENG_062_MZB_LO_1355-08.11.2005","08.11.2005",2005,11,8,0.83681561,3
"ENG_062_MZB_LO_1355","ENG_062_MZB_LO_1355-10.10.2006","10.10.2006",2006,10,10,0.86842827,3
"ENG_062_MZB_LO_1355","ENG_062_MZB_LO_1355-16.10.2007","16.10.2007",2007,10,16,0.872091889,3
"ENG_062_MZB_LO_1355","ENG_062_MZB_LO_1355-22.10.2008","22.10.2008",2008,10,22,0.862487043,3
"ENG_062_MZB_LO_1355","ENG_062_MZB_LO_1355-29.09.2009","29.09.2009",2009,9,29,0.885844015,2
"ENG_062_MZB_LO_1355","ENG_062_MZB_LO_1355-16.09.2013","16.09.2013",2013,9,16,0.93350883,2
"ENG_062_MZB_LO_1357","ENG_062_MZB_LO_1357-18.10.2002","18.10.2002",2002,10,18,1.038646083,1
"ENG_062_MZB_LO_1357","ENG_062_MZB_LO_1357-10.09.2003","10.09.2003",2003,9,10,1.003532941,1
"ENG_062_MZB_LO_1357","ENG_062_MZB_LO_1357-07.10.2004","07.10.2004",2004,10,7,0.982065287,1
"ENG_062_MZB_LO_1357","ENG_062_MZB_LO_1357-05.10.2005","05.10.2005",2005,10,5,1.041483211,1
"ENG_062_MZB_LO_1357","ENG_062_MZB_LO_1357-21.09.2006","21.09.2006",2006,9,21,1.057520485,1
"ENG_062_MZB_LO_1357","ENG_062_MZB_LO_1357-03.10.2008","03.10.2008",2008,10,3,1.09568739,1
"ENG_062_MZB_LO_1357","ENG_062_MZB_LO_1357-13.10.2009","13.10.2009",2009,10,13,1.032593348,1
"ENG_062_MZB_LO_1357","ENG_062_MZB_LO_1357-28.09.2010","28.09.2010",2010,9,28,1.088310118,1
"ENG_062_MZB_LO_1357","ENG_062_MZB_LO_1357-20.10.2011","20.10.2011",2011,10,20,1.182614519,1
"ENG_062_MZB_LO_1357","ENG_062_MZB_LO_1357-02.10.2013","02.10.2013",2013,10,2,1.037510347,1
"ENG_062_MZB_LO_1357","ENG_062_MZB_LO_1357-30.09.2014","30.09.2014",2014,9,30,1.205836419,1
"ENG_062_MZB_LO_1357","ENG_062_MZB_LO_1357-01.10.2015","01.10.2015",2015,10,1,1.195331949,1
"ENG_062_MZB_LO_1357","ENG_062_MZB_LO_1357-31.10.2016","31.10.2016",2016,10,31,1.111721494,1
"ENG_062_MZB_LO_1357","ENG_062_MZB_LO_1357-30.11.2017","30.11.2017",2017,11,30,1.149372084,1
"ENG_062_MZB_LO_1357","ENG_062_MZB_LO_1357-28.11.2018","28.11.2018",2018,11,28,1.191535028,1
"ENG_062_MZB_LO_1357","ENG_062_MZB_LO_1357-18.09.2019","18.09.2019",2019,9,18,1.167606099,1
"ENG_062_MZB_LO_1357","ENG_062_MZB_LO_1357-21.09.2020","21.09.2020",2020,9,21,1.146349868,1
"ENG_062_MZB_LO_1357","ENG_062_MZB_LO_1357-15.09.2021","15.09.2021",2021,9,15,1.036933153,1
"ENG_062_MZB_LO_1357","ENG_062_MZB_LO_1357-09.09.2022","09.09.2022",2022,9,9,1.108331921,1
"ENG_062_MZB_LO_1357","ENG_062_MZB_LO_1357-13.09.2023","13.09.2023",2023,9,13,1.078033247,1
"ENG_062_MZB_LO_1359","ENG_062_MZB_LO_1359-11.09.2002","11.09.2002",2002,9,11,1.028003339,1
"ENG_062_MZB_LO_1359","ENG_062_MZB_LO_1359-22.09.2003","22.09.2003",2003,9,22,1.154326058,3
"ENG_062_MZB_LO_1359","ENG_062_MZB_LO_1359-29.09.2004","29.09.2004",2004,9,29,1.06901167,1
"ENG_062_MZB_LO_1359","ENG_062_MZB_LO_1359-05.10.2005","05.10.2005",2005,10,5,1.02660378,1
"ENG_062_MZB_LO_1359","ENG_062_MZB_LO_1359-20.10.2006","20.10.2006",2006,10,20,0.985817375,1
"ENG_062_MZB_LO_1359","ENG_062_MZB_LO_1359-21.09.2007","21.09.2007",2007,9,21,0.970270904,1
"ENG_062_MZB_LO_1359","ENG_062_MZB_LO_1359-26.09.2008","26.09.2008",2008,9,26,1.070333921,1
"ENG_062_MZB_LO_1359","ENG_062_MZB_LO_1359-10.09.2009","10.09.2009",2009,9,10,1.030885501,1
"ENG_062_MZB_LO_1359","ENG_062_MZB_LO_1359-08.10.2012","08.10.2012",2012,10,8,1.017256498,1
"ENG_062_MZB_LO_136","ENG_062_MZB_LO_136-27.11.2002","27.11.2002",2002,11,27,0.976132767,1
"ENG_062_MZB_LO_136","ENG_062_MZB_LO_136-24.10.2003","24.10.2003",2003,10,24,1.005743794,1
"ENG_062_MZB_LO_136","ENG_062_MZB_LO_136-12.11.2004","12.11.2004",2004,11,12,1.001418857,1
"ENG_062_MZB_LO_136","ENG_062_MZB_LO_136-20.10.2005","20.10.2005",2005,10,20,0.941145624,2
"ENG_062_MZB_LO_136","ENG_062_MZB_LO_136-02.11.2006","02.11.2006",2006,11,2,0.998421547,1
"ENG_062_MZB_LO_136","ENG_062_MZB_LO_136-23.10.2007","23.10.2007",2007,10,23,1.028989099,1
"ENG_062_MZB_LO_136","ENG_062_MZB_LO_136-26.11.2008","26.11.2008",2008,11,26,1.014570193,1
"ENG_062_MZB_LO_136","ENG_062_MZB_LO_136-01.10.2009","01.10.2009",2009,10,1,1.027101047,1
"ENG_062_MZB_LO_136","ENG_062_MZB_LO_136-24.10.2019","24.10.2019",2019,10,24,1.052915272,1
"ENG_062_MZB_LO_1360","ENG_062_MZB_LO_1360-07.11.2002","07.11.2002",2002,11,7,1.091293174,1
"ENG_062_MZB_LO_1360","ENG_062_MZB_LO_1360-27.11.2006","27.11.2006",2006,11,27,0.969273966,1
"ENG_062_MZB_LO_1360","ENG_062_MZB_LO_1360-19.10.2007","19.10.2007",2007,10,19,1.070323354,1
"ENG_062_MZB_LO_1360","ENG_062_MZB_LO_1360-12.11.2008","12.11.2008",2008,11,12,0.969061177,1
"ENG_062_MZB_LO_1360","ENG_062_MZB_LO_1360-09.11.2009","09.11.2009",2009,11,9,1.048801838,1
"ENG_062_MZB_LO_1360","ENG_062_MZB_LO_1360-15.11.2010","15.11.2010",2010,11,15,1.00600789,1
"ENG_062_MZB_LO_1360","ENG_062_MZB_LO_1360-13.09.2011","13.09.2011",2011,9,13,1.105757381,1
"ENG_062_MZB_LO_1360","ENG_062_MZB_LO_1360-04.10.2012","04.10.2012",2012,10,4,1.006869748,1
"ENG_062_MZB_LO_1360","ENG_062_MZB_LO_1360-08.10.2013","08.10.2013",2013,10,8,1.071909547,1
"ENG_062_MZB_LO_1360","ENG_062_MZB_LO_1360-29.10.2014","29.10.2014",2014,10,29,1.061545455,1
"ENG_062_MZB_LO_1362","ENG_062_MZB_LO_1362-11.09.2002","11.09.2002",2002,9,11,1.172695603,1
"ENG_062_MZB_LO_1362","ENG_062_MZB_LO_1362-06.11.2003","06.11.2003",2003,11,6,1.161672908,1
"ENG_062_MZB_LO_1362","ENG_062_MZB_LO_1362-29.09.2004","29.09.2004",2004,9,29,1.144366038,1
"ENG_062_MZB_LO_1362","ENG_062_MZB_LO_1362-05.10.2005","05.10.2005",2005,10,5,1.100921344,1
"ENG_062_MZB_LO_1362","ENG_062_MZB_LO_1362-20.10.2006","20.10.2006",2006,10,20,1.129808441,1
"ENG_062_MZB_LO_1362","ENG_062_MZB_LO_1362-21.09.2007","21.09.2007",2007,9,21,1.129279849,1
"ENG_062_MZB_LO_1362","ENG_062_MZB_LO_1362-26.09.2008","26.09.2008",2008,9,26,1.128990094,1
"ENG_062_MZB_LO_1362","ENG_062_MZB_LO_1362-10.09.2009","10.09.2009",2009,9,10,1.028942326,1
"ENG_062_MZB_LO_1362","ENG_062_MZB_LO_1362-08.11.2012","08.11.2012",2012,11,8,1.120566076,1
"ENG_062_MZB_LO_1363","ENG_062_MZB_LO_1363-11.09.2002","11.09.2002",2002,9,11,1.090716391,1
"ENG_062_MZB_LO_1363","ENG_062_MZB_LO_1363-07.10.2003","07.10.2003",2003,10,7,1.136508894,1
"ENG_062_MZB_LO_1363","ENG_062_MZB_LO_1363-25.11.2004","25.11.2004",2004,11,25,1.1065169,1
"ENG_062_MZB_LO_1363","ENG_062_MZB_LO_1363-09.09.2005","09.09.2005",2005,9,9,1.090096069,1
"ENG_062_MZB_LO_1363","ENG_062_MZB_LO_1363-31.10.2006","31.10.2006",2006,10,31,1.1646443,1
"ENG_062_MZB_LO_1363","ENG_062_MZB_LO_1363-05.10.2007","05.10.2007",2007,10,5,1.138973544,2
"ENG_062_MZB_LO_1363","ENG_062_MZB_LO_1363-05.11.2008","05.11.2008",2008,11,5,1.158620803,1
"ENG_062_MZB_LO_1363","ENG_062_MZB_LO_1363-08.09.2009","08.09.2009",2009,9,8,1.218855231,2
"ENG_062_MZB_LO_1363","ENG_062_MZB_LO_1363-07.10.2010","07.10.2010",2010,10,7,1.17600592,3
"ENG_062_MZB_LO_1363","ENG_062_MZB_LO_1363-11.10.2011","11.10.2011",2011,10,11,1.144651265,3
"ENG_062_MZB_LO_1363","ENG_062_MZB_LO_1363-10.10.2012","10.10.2012",2012,10,10,1.095184782,2
"ENG_062_MZB_LO_1363","ENG_062_MZB_LO_1363-18.09.2013","18.09.2013",2013,9,18,1.127434074,3
"ENG_062_MZB_LO_1363","ENG_062_MZB_LO_1363-02.09.2014","02.09.2014",2014,9,2,1.182142877,1
"ENG_062_MZB_LO_1365","ENG_062_MZB_LO_1365-11.09.2002","11.09.2002",2002,9,11,1.164987698,1
"ENG_062_MZB_LO_1365","ENG_062_MZB_LO_1365-07.10.2003","07.10.2003",2003,10,7,1.223996902,1
"ENG_062_MZB_LO_1365","ENG_062_MZB_LO_1365-25.11.2004","25.11.2004",2004,11,25,1.240312673,1
"ENG_062_MZB_LO_1365","ENG_062_MZB_LO_1365-09.09.2005","09.09.2005",2005,9,9,1.205771869,1
"ENG_062_MZB_LO_1365","ENG_062_MZB_LO_1365-05.10.2007","05.10.2007",2007,10,5,1.179348883,1
"ENG_062_MZB_LO_1365","ENG_062_MZB_LO_1365-05.11.2008","05.11.2008",2008,11,5,1.143898175,1
"ENG_062_MZB_LO_1365","ENG_062_MZB_LO_1365-13.10.2009","13.10.2009",2009,10,13,1.142040274,1
"ENG_062_MZB_LO_1365","ENG_062_MZB_LO_1365-07.10.2010","07.10.2010",2010,10,7,1.199265341,1
"ENG_062_MZB_LO_1365","ENG_062_MZB_LO_1365-10.10.2012","10.10.2012",2012,10,10,1.216035922,1
"ENG_062_MZB_LO_1365","ENG_062_MZB_LO_1365-11.10.2013","11.10.2013",2013,10,11,1.194098699,1
"ENG_062_MZB_LO_1365","ENG_062_MZB_LO_1365-11.09.2014","11.09.2014",2014,9,11,1.139639394,1
"ENG_062_MZB_LO_1366","ENG_062_MZB_LO_1366-11.09.2002","11.09.2002",2002,9,11,1.118472582,1
"ENG_062_MZB_LO_1366","ENG_062_MZB_LO_1366-07.10.2003","07.10.2003",2003,10,7,1.172881497,1
"ENG_062_MZB_LO_1366","ENG_062_MZB_LO_1366-25.11.2004","25.11.2004",2004,11,25,1.210858675,1
"ENG_062_MZB_LO_1366","ENG_062_MZB_LO_1366-09.09.2005","09.09.2005",2005,9,9,1.206582252,2
"ENG_062_MZB_LO_1366","ENG_062_MZB_LO_1366-31.10.2006","31.10.2006",2006,10,31,1.184494904,1
"ENG_062_MZB_LO_1366","ENG_062_MZB_LO_1366-05.10.2007","05.10.2007",2007,10,5,1.180431387,1
"ENG_062_MZB_LO_1366","ENG_062_MZB_LO_1366-05.11.2008","05.11.2008",2008,11,5,1.168960856,1
"ENG_062_MZB_LO_1366","ENG_062_MZB_LO_1366-13.10.2009","13.10.2009",2009,10,13,1.159688021,1
"ENG_062_MZB_LO_1366","ENG_062_MZB_LO_1366-07.10.2010","07.10.2010",2010,10,7,1.173199097,1
"ENG_062_MZB_LO_1366","ENG_062_MZB_LO_1366-10.10.2012","10.10.2012",2012,10,10,1.069108403,1
"ENG_062_MZB_LO_1366","ENG_062_MZB_LO_1366-04.09.2013","04.09.2013",2013,9,4,1.174973657,1
"ENG_062_MZB_LO_1366","ENG_062_MZB_LO_1366-09.09.2014","09.09.2014",2014,9,9,1.147737061,2
"ENG_062_MZB_LO_1367","ENG_062_MZB_LO_1367-11.09.2002","11.09.2002",2002,9,11,1.075077596,3
"ENG_062_MZB_LO_1367","ENG_062_MZB_LO_1367-07.10.2003","07.10.2003",2003,10,7,1.218904365,1
"ENG_062_MZB_LO_1367","ENG_062_MZB_LO_1367-25.11.2004","25.11.2004",2004,11,25,1.152600005,1
"ENG_062_MZB_LO_1367","ENG_062_MZB_LO_1367-09.09.2005","09.09.2005",2005,9,9,1.135566836,1
"ENG_062_MZB_LO_1367","ENG_062_MZB_LO_1367-31.10.2006","31.10.2006",2006,10,31,1.089351332,1
"ENG_062_MZB_LO_1367","ENG_062_MZB_LO_1367-05.10.2007","05.10.2007",2007,10,5,1.162752515,1
"ENG_062_MZB_LO_1367","ENG_062_MZB_LO_1367-05.11.2008","05.11.2008",2008,11,5,1.165609417,1
"ENG_062_MZB_LO_1367","ENG_062_MZB_LO_1367-08.09.2009","08.09.2009",2009,9,8,1.126959574,1
"ENG_062_MZB_LO_1367","ENG_062_MZB_LO_1367-07.10.2010","07.10.2010",2010,10,7,1.145193307,1
"ENG_062_MZB_LO_1367","ENG_062_MZB_LO_1367-11.10.2011","11.10.2011",2011,10,11,1.1407875,1
"ENG_062_MZB_LO_1367","ENG_062_MZB_LO_1367-10.10.2012","10.10.2012",2012,10,10,1.148157816,1
"ENG_062_MZB_LO_1367","ENG_062_MZB_LO_1367-04.09.2013","04.09.2013",2013,9,4,1.058346467,2
"ENG_062_MZB_LO_1367","ENG_062_MZB_LO_1367-09.09.2014","09.09.2014",2014,9,9,1.087597452,2
"ENG_062_MZB_LO_1367","ENG_062_MZB_LO_1367-29.10.2015","29.10.2015",2015,10,29,1.125015141,3
"ENG_062_MZB_LO_1367","ENG_062_MZB_LO_1367-27.09.2016","27.09.2016",2016,9,27,1.093554742,2
"ENG_062_MZB_LO_1367","ENG_062_MZB_LO_1367-03.10.2017","03.10.2017",2017,10,3,1.281819093,1
"ENG_062_MZB_LO_1367","ENG_062_MZB_LO_1367-04.10.2018","04.10.2018",2018,10,4,1.220096483,1
"ENG_062_MZB_LO_1367","ENG_062_MZB_LO_1367-23.09.2019","23.09.2019",2019,9,23,1.143314427,5
"ENG_062_MZB_LO_1367","ENG_062_MZB_LO_1367-02.10.2020","02.10.2020",2020,10,2,1.149769291,1
"ENG_062_MZB_LO_1367","ENG_062_MZB_LO_1367-06.10.2021","06.10.2021",2021,10,6,1.216010828,1
"ENG_062_MZB_LO_1368","ENG_062_MZB_LO_1368-11.09.2002","11.09.2002",2002,9,11,1.128704829,2
"ENG_062_MZB_LO_1368","ENG_062_MZB_LO_1368-07.10.2003","07.10.2003",2003,10,7,1.245109395,1
"ENG_062_MZB_LO_1368","ENG_062_MZB_LO_1368-25.11.2004","25.11.2004",2004,11,25,1.217153368,1
"ENG_062_MZB_LO_1368","ENG_062_MZB_LO_1368-15.09.2005","15.09.2005",2005,9,15,1.082124289,1
"ENG_062_MZB_LO_1368","ENG_062_MZB_LO_1368-31.10.2006","31.10.2006",2006,10,31,1.118648941,1
"ENG_062_MZB_LO_1368","ENG_062_MZB_LO_1368-05.10.2007","05.10.2007",2007,10,5,1.210087475,1
"ENG_062_MZB_LO_1368","ENG_062_MZB_LO_1368-05.11.2008","05.11.2008",2008,11,5,1.14201248,1
"ENG_062_MZB_LO_1368","ENG_062_MZB_LO_1368-08.10.2009","08.10.2009",2009,10,8,1.187899457,1
"ENG_062_MZB_LO_1368","ENG_062_MZB_LO_1368-07.10.2010","07.10.2010",2010,10,7,1.156363029,1
"ENG_062_MZB_LO_1368","ENG_062_MZB_LO_1368-10.10.2012","10.10.2012",2012,10,10,1.12989798,1
"ENG_062_MZB_LO_1368","ENG_062_MZB_LO_1368-04.09.2013","04.09.2013",2013,9,4,1.146862133,1
"ENG_062_MZB_LO_1368","ENG_062_MZB_LO_1368-09.09.2014","09.09.2014",2014,9,9,1.188349233,1
"ENG_062_MZB_LO_1369","ENG_062_MZB_LO_1369-10.09.2003","10.09.2003",2003,9,10,0.884605846,2
"ENG_062_MZB_LO_1369","ENG_062_MZB_LO_1369-21.09.2004","21.09.2004",2004,9,21,0.950965148,2
"ENG_062_MZB_LO_1369","ENG_062_MZB_LO_1369-16.09.2005","16.09.2005",2005,9,16,0.910721281,2
"ENG_062_MZB_LO_1369","ENG_062_MZB_LO_1369-11.10.2006","11.10.2006",2006,10,11,0.849083102,3
"ENG_062_MZB_LO_1369","ENG_062_MZB_LO_1369-06.09.2007","06.09.2007",2007,9,6,0.809152164,3
"ENG_062_MZB_LO_1369","ENG_062_MZB_LO_1369-21.09.2010","21.09.2010",2010,9,21,0.826235739,3
"ENG_062_MZB_LO_1369","ENG_062_MZB_LO_1369-08.10.2012","08.10.2012",2012,10,8,0.929813015,2
"ENG_062_MZB_LO_1369","ENG_062_MZB_LO_1369-29.09.2015","29.09.2015",2015,9,29,0.804581821,3
"ENG_062_MZB_LO_1369","ENG_062_MZB_LO_1369-01.10.2018","01.10.2018",2018,10,1,0.850788774,3
"ENG_062_MZB_LO_137","ENG_062_MZB_LO_137-17.09.2002","17.09.2002",2002,9,17,1.277187048,1
"ENG_062_MZB_LO_137","ENG_062_MZB_LO_137-24.09.2003","24.09.2003",2003,9,24,1.230375488,1
"ENG_062_MZB_LO_137","ENG_062_MZB_LO_137-15.09.2004","15.09.2004",2004,9,15,1.164375738,1
"ENG_062_MZB_LO_137","ENG_062_MZB_LO_137-07.09.2006","07.09.2006",2006,9,7,1.161159083,1
"ENG_062_MZB_LO_137","ENG_062_MZB_LO_137-13.09.2007","13.09.2007",2007,9,13,1.189828255,1
"ENG_062_MZB_LO_137","ENG_062_MZB_LO_137-24.09.2008","24.09.2008",2008,9,24,1.214126881,1
"ENG_062_MZB_LO_137","ENG_062_MZB_LO_137-24.09.2009","24.09.2009",2009,9,24,1.210635659,1
"ENG_062_MZB_LO_137","ENG_062_MZB_LO_137-11.09.2013","11.09.2013",2013,9,11,1.201362599,1
"ENG_062_MZB_LO_137","ENG_062_MZB_LO_137-12.09.2014","12.09.2014",2014,9,12,1.249586741,1
"ENG_062_MZB_LO_1374","ENG_062_MZB_LO_1374-18.09.2002","18.09.2002",2002,9,18,0.848111138,3
"ENG_062_MZB_LO_1374","ENG_062_MZB_LO_1374-08.09.2005","08.09.2005",2005,9,8,0.815157643,3
"ENG_062_MZB_LO_1374","ENG_062_MZB_LO_1374-01.11.2007","01.11.2007",2007,11,1,0.950350351,2
"ENG_062_MZB_LO_1374","ENG_062_MZB_LO_1374-14.10.2008","14.10.2008",2008,10,14,0.949011623,2
"ENG_062_MZB_LO_1374","ENG_062_MZB_LO_1374-10.11.2010","10.11.2010",2010,11,10,0.920977021,2
"ENG_062_MZB_LO_1374","ENG_062_MZB_LO_1374-11.10.2011","11.10.2011",2011,10,11,0.855270785,3
"ENG_062_MZB_LO_1374","ENG_062_MZB_LO_1374-24.10.2012","24.10.2012",2012,10,24,0.933889333,2
"ENG_062_MZB_LO_1376","ENG_062_MZB_LO_1376-18.10.2002","18.10.2002",2002,10,18,0.787897318,3
"ENG_062_MZB_LO_1376","ENG_062_MZB_LO_1376-22.09.2003","22.09.2003",2003,9,22,0.818090762,3
"ENG_062_MZB_LO_1376","ENG_062_MZB_LO_1376-05.11.2004","05.11.2004",2004,11,5,0.864532609,3
"ENG_062_MZB_LO_1376","ENG_062_MZB_LO_1376-05.10.2005","05.10.2005",2005,10,5,0.669828356,4
"ENG_062_MZB_LO_1376","ENG_062_MZB_LO_1376-27.11.2006","27.11.2006",2006,11,27,0.856365519,3
"ENG_062_MZB_LO_1376","ENG_062_MZB_LO_1376-18.10.2007","18.10.2007",2007,10,18,0.837386399,5
"ENG_062_MZB_LO_1376","ENG_062_MZB_LO_1376-24.10.2008","24.10.2008",2008,10,24,0.894140581,3
"ENG_062_MZB_LO_1376","ENG_062_MZB_LO_1376-09.09.2009","09.09.2009",2009,9,9,0.883968929,2
"ENG_062_MZB_LO_1376","ENG_062_MZB_LO_1376-19.10.2011","19.10.2011",2011,10,19,0.924211101,3
"ENG_062_MZB_LO_1377","ENG_062_MZB_LO_1377-24.10.2002","24.10.2002",2002,10,24,0.999575704,1
"ENG_062_MZB_LO_1377","ENG_062_MZB_LO_1377-21.09.2004","21.09.2004",2004,9,21,0.997570684,1
"ENG_062_MZB_LO_1377","ENG_062_MZB_LO_1377-08.09.2005","08.09.2005",2005,9,8,0.948414747,2
"ENG_062_MZB_LO_1377","ENG_062_MZB_LO_1377-02.11.2006","02.11.2006",2006,11,2,0.998775831,1
"ENG_062_MZB_LO_1377","ENG_062_MZB_LO_1377-06.09.2007","06.09.2007",2007,9,6,0.907441271,2
"ENG_062_MZB_LO_1377","ENG_062_MZB_LO_1377-09.09.2008","09.09.2008",2008,9,9,0.992215544,1
"ENG_062_MZB_LO_1377","ENG_062_MZB_LO_1377-13.10.2009","13.10.2009",2009,10,13,0.982119796,1
"ENG_062_MZB_LO_1377","ENG_062_MZB_LO_1377-25.09.2013","25.09.2013",2013,9,25,1.022686777,1
"ENG_062_MZB_LO_138","ENG_062_MZB_LO_138-01.10.2002","01.10.2002",2002,10,1,1.003649568,1
"ENG_062_MZB_LO_138","ENG_062_MZB_LO_138-14.09.2005","14.09.2005",2005,9,14,1.028745357,1
"ENG_062_MZB_LO_138","ENG_062_MZB_LO_138-13.10.2008","13.10.2008",2008,10,13,1.072109942,1
"ENG_062_MZB_LO_138","ENG_062_MZB_LO_138-30.09.2009","30.09.2009",2009,9,30,1.052724074,1
"ENG_062_MZB_LO_138","ENG_062_MZB_LO_138-28.09.2010","28.09.2010",2010,9,28,1.059335274,1
"ENG_062_MZB_LO_138","ENG_062_MZB_LO_138-07.10.2011","07.10.2011",2011,10,7,1.079514814,1
"ENG_062_MZB_LO_138","ENG_062_MZB_LO_138-11.09.2012","11.09.2012",2012,9,11,1.046951046,1
"ENG_062_MZB_LO_138","ENG_062_MZB_LO_138-05.09.2013","05.09.2013",2013,9,5,1.067468427,1
"ENG_062_MZB_LO_138","ENG_062_MZB_LO_138-09.09.2014","09.09.2014",2014,9,9,1.087543701,1
"ENG_062_MZB_LO_138","ENG_062_MZB_LO_138-09.09.2015","09.09.2015",2015,9,9,1.007818884,1
"ENG_062_MZB_LO_138","ENG_062_MZB_LO_138-02.11.2016","02.11.2016",2016,11,2,1.156202647,1
"ENG_062_MZB_LO_138","ENG_062_MZB_LO_138-26.09.2017","26.09.2017",2017,9,26,1.074347701,1
"ENG_062_MZB_LO_138","ENG_062_MZB_LO_138-15.10.2018","15.10.2018",2018,10,15,1.061973578,1
"ENG_062_MZB_LO_138","ENG_062_MZB_LO_138-22.11.2019","22.11.2019",2019,11,22,1.067840242,1
"ENG_062_MZB_LO_1380","ENG_062_MZB_LO_1380-22.10.2002","22.10.2002",2002,10,22,0.618380157,5
"ENG_062_MZB_LO_1380","ENG_062_MZB_LO_1380-30.10.2003","30.10.2003",2003,10,30,0.70636824,5
"ENG_062_MZB_LO_1380","ENG_062_MZB_LO_1380-22.09.2004","22.09.2004",2004,9,22,0.762145986,5
"ENG_062_MZB_LO_1380","ENG_062_MZB_LO_1380-25.10.2005","25.10.2005",2005,10,25,0.674297406,4
"ENG_062_MZB_LO_1380","ENG_062_MZB_LO_1380-09.09.2008","09.09.2008",2008,9,9,0.949026439,2
"ENG_062_MZB_LO_1380","ENG_062_MZB_LO_1380-08.09.2009","08.09.2009",2009,9,8,1.060550722,2
"ENG_062_MZB_LO_1380","ENG_062_MZB_LO_1380-08.11.2011","08.11.2011",2011,11,8,1.086439154,1
"ENG_062_MZB_LO_1380","ENG_062_MZB_LO_1380-10.10.2012","10.10.2012",2012,10,10,1.013447101,1
"ENG_062_MZB_LO_1380","ENG_062_MZB_LO_1380-23.10.2013","23.10.2013",2013,10,23,1.108033881,1
"ENG_062_MZB_LO_1381","ENG_062_MZB_LO_1381-20.09.2002","20.09.2002",2002,9,20,0.57498538,5
"ENG_062_MZB_LO_1381","ENG_062_MZB_LO_1381-16.09.2005","16.09.2005",2005,9,16,0.684636186,5
"ENG_062_MZB_LO_1381","ENG_062_MZB_LO_1381-19.09.2008","19.09.2008",2008,9,19,0.621434634,5
"ENG_062_MZB_LO_1381","ENG_062_MZB_LO_1381-22.09.2010","22.09.2010",2010,9,22,0.658574058,5
"ENG_062_MZB_LO_1381","ENG_062_MZB_LO_1381-06.10.2011","06.10.2011",2011,10,6,0.644548367,4
"ENG_062_MZB_LO_1381","ENG_062_MZB_LO_1381-08.10.2012","08.10.2012",2012,10,8,0.70487819,5
"ENG_062_MZB_LO_1381","ENG_062_MZB_LO_1381-25.09.2014","25.09.2014",2014,9,25,0.616209667,5
"ENG_062_MZB_LO_1381","ENG_062_MZB_LO_1381-09.10.2019","09.10.2019",2019,10,9,0.66515431,5
"ENG_062_MZB_LO_1384","ENG_062_MZB_LO_1384-07.11.2002","07.11.2002",2002,11,7,0.926643898,2
"ENG_062_MZB_LO_1384","ENG_062_MZB_LO_1384-28.11.2003","28.11.2003",2003,11,28,0.923890244,2
"ENG_062_MZB_LO_1384","ENG_062_MZB_LO_1384-27.10.2006","27.10.2006",2006,10,27,0.859014738,3
"ENG_062_MZB_LO_1384","ENG_062_MZB_LO_1384-19.10.2007","19.10.2007",2007,10,19,0.849922839,3
"ENG_062_MZB_LO_1384","ENG_062_MZB_LO_1384-12.11.2008","12.11.2008",2008,11,12,0.96994953,1
"ENG_062_MZB_LO_1384","ENG_062_MZB_LO_1384-09.11.2009","09.11.2009",2009,11,9,0.945608947,2
"ENG_062_MZB_LO_1384","ENG_062_MZB_LO_1384-15.11.2010","15.11.2010",2010,11,15,0.906848024,2
"ENG_062_MZB_LO_1384","ENG_062_MZB_LO_1384-13.09.2011","13.09.2011",2011,9,13,0.993782662,1
"ENG_062_MZB_LO_1384","ENG_062_MZB_LO_1384-04.10.2012","04.10.2012",2012,10,4,0.996378107,1
"ENG_062_MZB_LO_1384","ENG_062_MZB_LO_1384-07.10.2013","07.10.2013",2013,10,7,0.9692126,1
"ENG_062_MZB_LO_1384","ENG_062_MZB_LO_1384-07.10.2014","07.10.2014",2014,10,7,1.017854026,1
"ENG_062_MZB_LO_1386","ENG_062_MZB_LO_1386-13.09.2002","13.09.2002",2002,9,13,0.803148087,3
"ENG_062_MZB_LO_1386","ENG_062_MZB_LO_1386-19.11.2003","19.11.2003",2003,11,19,0.824159491,3
"ENG_062_MZB_LO_1386","ENG_062_MZB_LO_1386-19.11.2004","19.11.2004",2004,11,19,0.787457,3
"ENG_062_MZB_LO_1386","ENG_062_MZB_LO_1386-03.10.2006","03.10.2006",2006,10,3,0.698301699,4
"ENG_062_MZB_LO_1386","ENG_062_MZB_LO_1386-24.10.2008","24.10.2008",2008,10,24,0.808639289,3
"ENG_062_MZB_LO_1386","ENG_062_MZB_LO_1386-05.11.2009","05.11.2009",2009,11,5,0.75424185,3
"ENG_062_MZB_LO_1386","ENG_062_MZB_LO_1386-04.10.2011","04.10.2011",2011,10,4,0.788793586,3
"ENG_062_MZB_LO_1386","ENG_062_MZB_LO_1386-04.10.2012","04.10.2012",2012,10,4,0.736037612,4
"ENG_062_MZB_LO_1386","ENG_062_MZB_LO_1386-02.09.2013","02.09.2013",2013,9,2,0.760106443,3
"ENG_062_MZB_LO_1387","ENG_062_MZB_LO_1387-11.09.2002","11.09.2002",2002,9,11,1.090683554,1
"ENG_062_MZB_LO_1387","ENG_062_MZB_LO_1387-22.09.2003","22.09.2003",2003,9,22,1.108354973,1
"ENG_062_MZB_LO_1387","ENG_062_MZB_LO_1387-05.11.2004","05.11.2004",2004,11,5,1.153316509,1
"ENG_062_MZB_LO_1387","ENG_062_MZB_LO_1387-05.10.2005","05.10.2005",2005,10,5,1.131668468,1
"ENG_062_MZB_LO_1387","ENG_062_MZB_LO_1387-27.11.2006","27.11.2006",2006,11,27,1.161998132,1
"ENG_062_MZB_LO_1387","ENG_062_MZB_LO_1387-18.10.2007","18.10.2007",2007,10,18,1.113146621,2
"ENG_062_MZB_LO_1387","ENG_062_MZB_LO_1387-24.10.2008","24.10.2008",2008,10,24,1.141163678,1
"ENG_062_MZB_LO_1387","ENG_062_MZB_LO_1387-10.09.2009","10.09.2009",2009,9,10,1.118490452,1
"ENG_062_MZB_LO_1387","ENG_062_MZB_LO_1387-15.09.2010","15.09.2010",2010,9,15,1.208123633,1
"ENG_062_MZB_LO_1387","ENG_062_MZB_LO_1387-08.09.2011","08.09.2011",2011,9,8,1.18731821,1
"ENG_062_MZB_LO_1387","ENG_062_MZB_LO_1387-23.10.2012","23.10.2012",2012,10,23,1.1711995,1
"ENG_062_MZB_LO_1387","ENG_062_MZB_LO_1387-06.09.2013","06.09.2013",2013,9,6,1.076026618,1
"ENG_062_MZB_LO_1387","ENG_062_MZB_LO_1387-28.10.2016","28.10.2016",2016,10,28,1.115636696,1
"ENG_062_MZB_LO_139","ENG_062_MZB_LO_139-25.09.2002","25.09.2002",2002,9,25,0.91540819,2
"ENG_062_MZB_LO_139","ENG_062_MZB_LO_139-03.09.2003","03.09.2003",2003,9,3,0.928335297,2
"ENG_062_MZB_LO_139","ENG_062_MZB_LO_139-07.09.2004","07.09.2004",2004,9,7,1.006786134,1
"ENG_062_MZB_LO_139","ENG_062_MZB_LO_139-26.09.2007","26.09.2007",2007,9,26,0.97391331,1
"ENG_062_MZB_LO_139","ENG_062_MZB_LO_139-12.09.2013","12.09.2013",2013,9,12,0.949325624,2
"ENG_062_MZB_LO_139","ENG_062_MZB_LO_139-05.09.2014","05.09.2014",2014,9,5,0.967669616,2
"ENG_062_MZB_LO_139","ENG_062_MZB_LO_139-25.09.2018","25.09.2018",2018,9,25,0.937928726,2
"ENG_062_MZB_LO_1392","ENG_062_MZB_LO_1392-04.10.2002","04.10.2002",2002,10,4,1.025329329,1
"ENG_062_MZB_LO_1392","ENG_062_MZB_LO_1392-16.10.2003","16.10.2003",2003,10,16,0.970660972,1
"ENG_062_MZB_LO_1392","ENG_062_MZB_LO_1392-15.10.2004","15.10.2004",2004,10,15,0.944306413,2
"ENG_062_MZB_LO_1392","ENG_062_MZB_LO_1392-30.09.2005","30.09.2005",2005,9,30,0.883517974,2
"ENG_062_MZB_LO_1392","ENG_062_MZB_LO_1392-18.10.2006","18.10.2006",2006,10,18,0.943715414,2
"ENG_062_MZB_LO_1392","ENG_062_MZB_LO_1392-24.10.2007","24.10.2007",2007,10,24,0.962871105,2
"ENG_062_MZB_LO_1392","ENG_062_MZB_LO_1392-17.11.2008","17.11.2008",2008,11,17,0.985838763,1
"ENG_062_MZB_LO_1392","ENG_062_MZB_LO_1392-07.09.2009","07.09.2009",2009,9,7,1.047638727,1
"ENG_062_MZB_LO_1392","ENG_062_MZB_LO_1392-23.10.2013","23.10.2013",2013,10,23,0.94972578,2
"ENG_062_MZB_LO_1392","ENG_062_MZB_LO_1392-13.11.2014","13.11.2014",2014,11,13,0.977098474,1
"ENG_062_MZB_LO_1394","ENG_062_MZB_LO_1394-11.09.2002","11.09.2002",2002,9,11,1.19596917,1
"ENG_062_MZB_LO_1394","ENG_062_MZB_LO_1394-26.09.2003","26.09.2003",2003,9,26,1.167455431,1
"ENG_062_MZB_LO_1394","ENG_062_MZB_LO_1394-29.09.2004","29.09.2004",2004,9,29,1.123548608,1
"ENG_062_MZB_LO_1394","ENG_062_MZB_LO_1394-05.10.2005","05.10.2005",2005,10,5,1.132885248,1
"ENG_062_MZB_LO_1394","ENG_062_MZB_LO_1394-20.10.2006","20.10.2006",2006,10,20,1.114109432,1
"ENG_062_MZB_LO_1394","ENG_062_MZB_LO_1394-21.09.2007","21.09.2007",2007,9,21,1.119250354,1
"ENG_062_MZB_LO_1394","ENG_062_MZB_LO_1394-26.09.2008","26.09.2008",2008,9,26,1.107036918,1
"ENG_062_MZB_LO_1394","ENG_062_MZB_LO_1394-10.09.2009","10.09.2009",2009,9,10,1.063565846,1
"ENG_062_MZB_LO_1394","ENG_062_MZB_LO_1394-15.09.2010","15.09.2010",2010,9,15,1.286790776,5
"ENG_062_MZB_LO_1394","ENG_062_MZB_LO_1394-13.09.2011","13.09.2011",2011,9,13,1.071283776,1
"ENG_062_MZB_LO_1394","ENG_062_MZB_LO_1394-30.10.2012","30.10.2012",2012,10,30,1.19080303,1
"ENG_062_MZB_LO_1394","ENG_062_MZB_LO_1394-04.10.2013","04.10.2013",2013,10,4,1.188020324,1
"ENG_062_MZB_LO_1394","ENG_062_MZB_LO_1394-14.10.2015","14.10.2015",2015,10,14,1.242306709,1
"ENG_062_MZB_LO_1394","ENG_062_MZB_LO_1394-19.10.2018","19.10.2018",2018,10,19,1.209612892,1
"ENG_062_MZB_LO_1397","ENG_062_MZB_LO_1397-03.09.2003","03.09.2003",2003,9,3,1.016246991,2
"ENG_062_MZB_LO_1397","ENG_062_MZB_LO_1397-08.09.2004","08.09.2004",2004,9,8,0.958192283,3
"ENG_062_MZB_LO_1397","ENG_062_MZB_LO_1397-27.10.2005","27.10.2005",2005,10,27,1.031946915,3
"ENG_062_MZB_LO_1397","ENG_062_MZB_LO_1397-01.11.2006","01.11.2006",2006,11,1,1.048221253,2
"ENG_062_MZB_LO_1397","ENG_062_MZB_LO_1397-05.09.2007","05.09.2007",2007,9,5,1.000371344,2
"ENG_062_MZB_LO_1397","ENG_062_MZB_LO_1397-03.09.2008","03.09.2008",2008,9,3,1.024597113,5
"ENG_062_MZB_LO_1397","ENG_062_MZB_LO_1397-20.10.2009","20.10.2009",2009,10,20,0.977705833,3
"ENG_062_MZB_LO_1397","ENG_062_MZB_LO_1397-09.10.2013","09.10.2013",2013,10,9,1.042564884,1
"ENG_062_MZB_LO_1397","ENG_062_MZB_LO_1397-07.10.2014","07.10.2014",2014,10,7,0.984823291,2
"ENG_062_MZB_LO_1398","ENG_062_MZB_LO_1398-06.09.2002","06.09.2002",2002,9,6,1.052398552,1
"ENG_062_MZB_LO_1398","ENG_062_MZB_LO_1398-27.10.2003","27.10.2003",2003,10,27,1.031622003,2
"ENG_062_MZB_LO_1398","ENG_062_MZB_LO_1398-20.10.2004","20.10.2004",2004,10,20,1.005898162,3
"ENG_062_MZB_LO_1398","ENG_062_MZB_LO_1398-16.11.2005","16.11.2005",2005,11,16,1.052890921,1
"ENG_062_MZB_LO_1398","ENG_062_MZB_LO_1398-28.09.2006","28.09.2006",2006,9,28,1.028158584,1
"ENG_062_MZB_LO_1398","ENG_062_MZB_LO_1398-23.10.2007","23.10.2007",2007,10,23,1.116559572,1
"ENG_062_MZB_LO_1398","ENG_062_MZB_LO_1398-16.10.2008","16.10.2008",2008,10,16,1.121779866,1
"ENG_062_MZB_LO_1398","ENG_062_MZB_LO_1398-16.09.2009","16.09.2009",2009,9,16,0.946846034,5
"ENG_062_MZB_LO_1398","ENG_062_MZB_LO_1398-20.10.2010","20.10.2010",2010,10,20,1.057173286,2
"ENG_062_MZB_LO_1398","ENG_062_MZB_LO_1398-01.11.2011","01.11.2011",2011,11,1,1.0785162,1
"ENG_062_MZB_LO_1398","ENG_062_MZB_LO_1398-08.11.2012","08.11.2012",2012,11,8,1.093686931,1
"ENG_062_MZB_LO_1398","ENG_062_MZB_LO_1398-07.10.2013","07.10.2013",2013,10,7,1.007911374,2
"ENG_062_MZB_LO_1398","ENG_062_MZB_LO_1398-17.09.2014","17.09.2014",2014,9,17,1.040938406,2
"ENG_062_MZB_LO_1398","ENG_062_MZB_LO_1398-15.09.2015","15.09.2015",2015,9,15,1.017348953,1
"ENG_062_MZB_LO_1398","ENG_062_MZB_LO_1398-14.11.2016","14.11.2016",2016,11,14,1.014895294,2
"ENG_062_MZB_LO_1398","ENG_062_MZB_LO_1398-18.10.2017","18.10.2017",2017,10,18,1.072013533,1
"ENG_062_MZB_LO_1398","ENG_062_MZB_LO_1398-09.10.2018","09.10.2018",2018,10,9,0.951357854,2
"ENG_062_MZB_LO_1398","ENG_062_MZB_LO_1398-25.09.2019","25.09.2019",2019,9,25,0.945301045,2
"ENG_062_MZB_LO_1398","ENG_062_MZB_LO_1398-23.10.2020","23.10.2020",2020,10,23,1.022437094,1
"ENG_062_MZB_LO_1398","ENG_062_MZB_LO_1398-29.10.2021","29.10.2021",2021,10,29,1.126602778,1
"ENG_062_MZB_LO_1399","ENG_062_MZB_LO_1399-02.09.2002","02.09.2002",2002,9,2,1.190995049,1
"ENG_062_MZB_LO_1399","ENG_062_MZB_LO_1399-06.11.2003","06.11.2003",2003,11,6,1.121031715,1
"ENG_062_MZB_LO_1399","ENG_062_MZB_LO_1399-05.11.2004","05.11.2004",2004,11,5,1.091688044,1
"ENG_062_MZB_LO_1399","ENG_062_MZB_LO_1399-05.10.2005","05.10.2005",2005,10,5,1.036244935,1
"ENG_062_MZB_LO_1399","ENG_062_MZB_LO_1399-27.11.2006","27.11.2006",2006,11,27,1.115126481,1
"ENG_062_MZB_LO_1399","ENG_062_MZB_LO_1399-18.10.2007","18.10.2007",2007,10,18,1.191220471,1
"ENG_062_MZB_LO_1399","ENG_062_MZB_LO_1399-26.09.2008","26.09.2008",2008,9,26,1.194564383,1
"ENG_062_MZB_LO_1399","ENG_062_MZB_LO_1399-10.09.2009","10.09.2009",2009,9,10,1.178208891,1
"ENG_062_MZB_LO_1399","ENG_062_MZB_LO_1399-15.09.2010","15.09.2010",2010,9,15,1.141347825,1
"ENG_062_MZB_LO_1399","ENG_062_MZB_LO_1399-08.09.2011","08.09.2011",2011,9,8,1.082034959,1
"ENG_062_MZB_LO_1399","ENG_062_MZB_LO_1399-23.10.2012","23.10.2012",2012,10,23,1.132183646,1
"ENG_062_MZB_LO_1399","ENG_062_MZB_LO_1399-06.09.2013","06.09.2013",2013,9,6,1.088787964,1
"ENG_062_MZB_LO_1399","ENG_062_MZB_LO_1399-11.09.2014","11.09.2014",2014,9,11,1.126590388,1
"ENG_062_MZB_LO_1399","ENG_062_MZB_LO_1399-30.09.2015","30.09.2015",2015,9,30,1.140862712,1
"ENG_062_MZB_LO_1399","ENG_062_MZB_LO_1399-28.10.2016","28.10.2016",2016,10,28,1.187215271,1
"ENG_062_MZB_LO_1399","ENG_062_MZB_LO_1399-21.09.2017","21.09.2017",2017,9,21,1.186835141,1
"ENG_062_MZB_LO_1399","ENG_062_MZB_LO_1399-25.09.2018","25.09.2018",2018,9,25,1.212204499,1
"ENG_062_MZB_LO_1399","ENG_062_MZB_LO_1399-08.10.2019","08.10.2019",2019,10,8,1.145298865,1
"ENG_062_MZB_LO_1400","ENG_062_MZB_LO_1400-11.09.2002","11.09.2002",2002,9,11,0.876201868,2
"ENG_062_MZB_LO_1400","ENG_062_MZB_LO_1400-22.09.2003","22.09.2003",2003,9,22,0.827257051,3
"ENG_062_MZB_LO_1400","ENG_062_MZB_LO_1400-29.09.2004","29.09.2004",2004,9,29,0.915165239,2
"ENG_062_MZB_LO_1400","ENG_062_MZB_LO_1400-05.10.2005","05.10.2005",2005,10,5,0.834907181,3
"ENG_062_MZB_LO_1400","ENG_062_MZB_LO_1400-20.10.2006","20.10.2006",2006,10,20,0.888616109,2
"ENG_062_MZB_LO_1400","ENG_062_MZB_LO_1400-18.10.2007","18.10.2007",2007,10,18,0.877239513,2
"ENG_062_MZB_LO_1400","ENG_062_MZB_LO_1400-24.10.2008","24.10.2008",2008,10,24,1.016766388,1
"ENG_062_MZB_LO_1400","ENG_062_MZB_LO_1400-11.09.2009","11.09.2009",2009,9,11,0.985501975,1
"ENG_062_MZB_LO_1400","ENG_062_MZB_LO_1400-15.09.2010","15.09.2010",2010,9,15,0.984064105,1
"ENG_062_MZB_LO_1400","ENG_062_MZB_LO_1400-08.09.2011","08.09.2011",2011,9,8,1.028059638,1
"ENG_062_MZB_LO_1400","ENG_062_MZB_LO_1400-20.10.2014","20.10.2014",2014,10,20,1.070619665,1
"ENG_062_MZB_LO_1403","ENG_062_MZB_LO_1403-18.09.2002","18.09.2002",2002,9,18,1.063714767,1
"ENG_062_MZB_LO_1403","ENG_062_MZB_LO_1403-15.09.2004","15.09.2004",2004,9,15,1.074267641,1
"ENG_062_MZB_LO_1403","ENG_062_MZB_LO_1403-19.10.2005","19.10.2005",2005,10,19,1.016899625,1
"ENG_062_MZB_LO_1403","ENG_062_MZB_LO_1403-20.09.2006","20.09.2006",2006,9,20,1.072180612,1
"ENG_062_MZB_LO_1403","ENG_062_MZB_LO_1403-01.11.2007","01.11.2007",2007,11,1,1.069442642,1
"ENG_062_MZB_LO_1403","ENG_062_MZB_LO_1403-14.10.2008","14.10.2008",2008,10,14,1.053888864,1
"ENG_062_MZB_LO_1403","ENG_062_MZB_LO_1403-24.09.2009","24.09.2009",2009,9,24,1.122181069,1
"ENG_062_MZB_LO_1403","ENG_062_MZB_LO_1403-02.09.2013","02.09.2013",2013,9,2,0.994721065,3
"ENG_062_MZB_LO_1403","ENG_062_MZB_LO_1403-28.10.2020","28.10.2020",2020,10,28,1.009014019,1
"ENG_062_MZB_LO_1403","ENG_062_MZB_LO_1403-18.11.2021","18.11.2021",2021,11,18,1.044233465,1
"ENG_062_MZB_LO_1404","ENG_062_MZB_LO_1404-17.10.2005","17.10.2005",2005,10,17,0.818288367,4
"ENG_062_MZB_LO_1404","ENG_062_MZB_LO_1404-21.10.2008","21.10.2008",2008,10,21,1.028371915,1
"ENG_062_MZB_LO_1404","ENG_062_MZB_LO_1404-20.11.2013","20.11.2013",2013,11,20,1.017263626,3
"ENG_062_MZB_LO_1404","ENG_062_MZB_LO_1404-09.09.2014","09.09.2014",2014,9,9,1.084281565,5
"ENG_062_MZB_LO_1404","ENG_062_MZB_LO_1404-05.10.2015","05.10.2015",2015,10,5,1.133454864,4
"ENG_062_MZB_LO_1404","ENG_062_MZB_LO_1404-27.09.2016","27.09.2016",2016,9,27,1.019370202,3
"ENG_062_MZB_LO_1404","ENG_062_MZB_LO_1404-18.10.2017","18.10.2017",2017,10,18,0.954783845,3
"ENG_062_MZB_LO_1404","ENG_062_MZB_LO_1404-16.10.2018","16.10.2018",2018,10,16,1.026937846,1
"ENG_062_MZB_LO_1404","ENG_062_MZB_LO_1404-23.09.2019","23.09.2019",2019,9,23,1.032009186,2
"ENG_062_MZB_LO_1404","ENG_062_MZB_LO_1404-06.10.2020","06.10.2020",2020,10,6,1.120681339,1
"ENG_062_MZB_LO_1404","ENG_062_MZB_LO_1404-24.09.2021","24.09.2021",2021,9,24,1.203109616,2
"ENG_062_MZB_LO_1405","ENG_062_MZB_LO_1405-10.10.2002","10.10.2002",2002,10,10,1.147019956,2
"ENG_062_MZB_LO_1405","ENG_062_MZB_LO_1405-10.10.2003","10.10.2003",2003,10,10,1.071545137,1
"ENG_062_MZB_LO_1405","ENG_062_MZB_LO_1405-22.10.2004","22.10.2004",2004,10,22,1.088200332,1
"ENG_062_MZB_LO_1405","ENG_062_MZB_LO_1405-07.10.2005","07.10.2005",2005,10,7,1.067815791,1
"ENG_062_MZB_LO_1405","ENG_062_MZB_LO_1405-10.10.2006","10.10.2006",2006,10,10,1.039370547,1
"ENG_062_MZB_LO_1405","ENG_062_MZB_LO_1405-16.10.2007","16.10.2007",2007,10,16,1.093943302,1
"ENG_062_MZB_LO_1405","ENG_062_MZB_LO_1405-22.10.2008","22.10.2008",2008,10,22,1.129023737,1
"ENG_062_MZB_LO_1405","ENG_062_MZB_LO_1405-29.09.2009","29.09.2009",2009,9,29,1.093306299,1
"ENG_062_MZB_LO_1405","ENG_062_MZB_LO_1405-01.10.2013","01.10.2013",2013,10,1,1.089785553,1
"ENG_062_MZB_LO_1405","ENG_062_MZB_LO_1405-30.10.2014","30.10.2014",2014,10,30,1.06623595,1
"ENG_062_MZB_LO_1405","ENG_062_MZB_LO_1405-14.10.2015","14.10.2015",2015,10,14,1.133533162,1
"ENG_062_MZB_LO_1405","ENG_062_MZB_LO_1405-05.10.2016","05.10.2016",2016,10,5,1.116622749,1
"ENG_062_MZB_LO_1405","ENG_062_MZB_LO_1405-18.10.2017","18.10.2017",2017,10,18,1.138389593,1
"ENG_062_MZB_LO_1406","ENG_062_MZB_LO_1406-18.11.2003","18.11.2003",2003,11,18,0.744624782,5
"ENG_062_MZB_LO_1406","ENG_062_MZB_LO_1406-24.09.2009","24.09.2009",2009,9,24,0.698845915,4
"ENG_062_MZB_LO_1406","ENG_062_MZB_LO_1406-19.10.2010","19.10.2010",2010,10,19,0.720133759,4
"ENG_062_MZB_LO_1406","ENG_062_MZB_LO_1406-08.09.2011","08.09.2011",2011,9,8,0.696658155,4
"ENG_062_MZB_LO_1406","ENG_062_MZB_LO_1406-08.11.2012","08.11.2012",2012,11,8,0.784604124,3
"ENG_062_MZB_LO_1406","ENG_062_MZB_LO_1406-18.09.2013","18.09.2013",2013,9,18,0.732923464,3
"ENG_062_MZB_LO_1406","ENG_062_MZB_LO_1406-05.09.2014","05.09.2014",2014,9,5,0.822867961,3
"ENG_062_MZB_LO_1406","ENG_062_MZB_LO_1406-02.10.2015","02.10.2015",2015,10,2,0.742305707,3
"ENG_062_MZB_LO_1406","ENG_062_MZB_LO_1406-05.10.2016","05.10.2016",2016,10,5,0.7782573,3
"ENG_062_MZB_LO_1406","ENG_062_MZB_LO_1406-29.09.2017","29.09.2017",2017,9,29,0.7124116,4
"ENG_062_MZB_LO_1406","ENG_062_MZB_LO_1406-01.10.2018","01.10.2018",2018,10,1,0.769248015,3
"ENG_062_MZB_LO_1406","ENG_062_MZB_LO_1406-08.10.2019","08.10.2019",2019,10,8,0.79512594,3
"ENG_062_MZB_LO_1406","ENG_062_MZB_LO_1406-23.10.2020","23.10.2020",2020,10,23,0.904750771,2
"ENG_062_MZB_LO_1409","ENG_062_MZB_LO_1409-25.09.2002","25.09.2002",2002,9,25,1.567105479,1
"ENG_062_MZB_LO_1409","ENG_062_MZB_LO_1409-06.11.2003","06.11.2003",2003,11,6,1.657204189,1
"ENG_062_MZB_LO_1409","ENG_062_MZB_LO_1409-22.10.2004","22.10.2004",2004,10,22,1.382279097,1
"ENG_062_MZB_LO_1409","ENG_062_MZB_LO_1409-05.10.2005","05.10.2005",2005,10,5,1.462596061,1
"ENG_062_MZB_LO_1409","ENG_062_MZB_LO_1409-19.09.2006","19.09.2006",2006,9,19,1.453591513,1
"ENG_062_MZB_LO_1409","ENG_062_MZB_LO_1409-26.11.2009","26.11.2009",2009,11,26,1.497435759,1
"ENG_062_MZB_LO_1409","ENG_062_MZB_LO_1409-30.09.2013","30.09.2013",2013,9,30,1.566192381,1
"ENG_062_MZB_LO_1409","ENG_062_MZB_LO_1409-09.10.2014","09.10.2014",2014,10,9,1.599659148,1
"ENG_062_MZB_LO_141","ENG_062_MZB_LO_141-16.09.2003","16.09.2003",2003,9,16,1.205162162,1
"ENG_062_MZB_LO_141","ENG_062_MZB_LO_141-08.09.2004","08.09.2004",2004,9,8,1.14654878,1
"ENG_062_MZB_LO_141","ENG_062_MZB_LO_141-28.09.2005","28.09.2005",2005,9,28,1.218812641,1
"ENG_062_MZB_LO_141","ENG_062_MZB_LO_141-01.09.2006","01.09.2006",2006,9,1,1.202324522,1
"ENG_062_MZB_LO_141","ENG_062_MZB_LO_141-08.09.2009","08.09.2009",2009,9,8,1.156195878,2
"ENG_062_MZB_LO_141","ENG_062_MZB_LO_141-12.09.2013","12.09.2013",2013,9,12,1.196613417,1
"ENG_062_MZB_LO_141","ENG_062_MZB_LO_141-24.10.2014","24.10.2014",2014,10,24,1.196483018,2
"ENG_062_MZB_LO_141","ENG_062_MZB_LO_141-31.10.2016","31.10.2016",2016,10,31,1.206545874,1
"ENG_062_MZB_LO_141","ENG_062_MZB_LO_141-24.10.2019","24.10.2019",2019,10,24,1.158661751,1
"ENG_062_MZB_LO_1411","ENG_062_MZB_LO_1411-02.09.2002","02.09.2002",2002,9,2,1.120177073,1
"ENG_062_MZB_LO_1411","ENG_062_MZB_LO_1411-26.09.2003","26.09.2003",2003,9,26,1.109253936,1
"ENG_062_MZB_LO_1411","ENG_062_MZB_LO_1411-29.09.2004","29.09.2004",2004,9,29,1.065315357,1
"ENG_062_MZB_LO_1411","ENG_062_MZB_LO_1411-11.11.2005","11.11.2005",2005,11,11,1.056932336,1
"ENG_062_MZB_LO_1411","ENG_062_MZB_LO_1411-03.10.2006","03.10.2006",2006,10,3,1.072714312,1
"ENG_062_MZB_LO_1411","ENG_062_MZB_LO_1411-13.09.2007","13.09.2007",2007,9,13,1.021280861,1
"ENG_062_MZB_LO_1411","ENG_062_MZB_LO_1411-29.09.2008","29.09.2008",2008,9,29,0.990986389,1
"ENG_062_MZB_LO_1411","ENG_062_MZB_LO_1411-05.11.2009","05.11.2009",2009,11,5,1.067772781,1
"ENG_062_MZB_LO_1411","ENG_062_MZB_LO_1411-15.11.2013","15.11.2013",2013,11,15,1.061249383,1
"ENG_062_MZB_LO_1412","ENG_062_MZB_LO_1412-02.09.2002","02.09.2002",2002,9,2,0.864920312,3
"ENG_062_MZB_LO_1412","ENG_062_MZB_LO_1412-22.09.2003","22.09.2003",2003,9,22,0.907661619,2
"ENG_062_MZB_LO_1412","ENG_062_MZB_LO_1412-25.11.2005","25.11.2005",2005,11,25,0.937275181,2
"ENG_062_MZB_LO_1412","ENG_062_MZB_LO_1412-27.11.2006","27.11.2006",2006,11,27,0.871183852,2
"ENG_062_MZB_LO_1412","ENG_062_MZB_LO_1412-18.10.2007","18.10.2007",2007,10,18,0.857302013,3
"ENG_062_MZB_LO_1412","ENG_062_MZB_LO_1412-24.10.2008","24.10.2008",2008,10,24,0.91545693,2
"ENG_062_MZB_LO_1412","ENG_062_MZB_LO_1412-21.09.2009","21.09.2009",2009,9,21,0.928570968,2
"ENG_062_MZB_LO_1412","ENG_062_MZB_LO_1412-08.09.2011","08.09.2011",2011,9,8,0.907963964,2
"ENG_062_MZB_LO_1412","ENG_062_MZB_LO_1412-05.09.2014","05.09.2014",2014,9,5,0.921774424,2
"ENG_062_MZB_LO_1412","ENG_062_MZB_LO_1412-21.09.2017","21.09.2017",2017,9,21,0.997731016,1
"ENG_062_MZB_LO_1414","ENG_062_MZB_LO_1414-07.10.2002","07.10.2002",2002,10,7,1.012393776,1
"ENG_062_MZB_LO_1414","ENG_062_MZB_LO_1414-22.10.2003","22.10.2003",2003,10,22,0.992767587,1
"ENG_062_MZB_LO_1414","ENG_062_MZB_LO_1414-18.10.2004","18.10.2004",2004,10,18,0.946698832,4
"ENG_062_MZB_LO_1414","ENG_062_MZB_LO_1414-07.10.2005","07.10.2005",2005,10,7,1.081580007,2
"ENG_062_MZB_LO_1414","ENG_062_MZB_LO_1414-31.10.2006","31.10.2006",2006,10,31,1.030210702,3
"ENG_062_MZB_LO_1414","ENG_062_MZB_LO_1414-17.09.2009","17.09.2009",2009,9,17,1.185681679,1
"ENG_062_MZB_LO_1414","ENG_062_MZB_LO_1414-03.11.2010","03.11.2010",2010,11,3,1.160041986,1
"ENG_062_MZB_LO_1414","ENG_062_MZB_LO_1414-29.09.2011","29.09.2011",2011,9,29,1.107083269,1
"ENG_062_MZB_LO_1414","ENG_062_MZB_LO_1414-11.10.2012","11.10.2012",2012,10,11,1.183244829,1
"ENG_062_MZB_LO_1414","ENG_062_MZB_LO_1414-02.10.2013","02.10.2013",2013,10,2,1.174554785,1
"ENG_062_MZB_LO_1414","ENG_062_MZB_LO_1414-30.09.2015","30.09.2015",2015,9,30,1.149122349,1
"ENG_062_MZB_LO_1414","ENG_062_MZB_LO_1414-05.10.2016","05.10.2016",2016,10,5,1.137941178,1
"ENG_062_MZB_LO_1414","ENG_062_MZB_LO_1414-02.10.2017","02.10.2017",2017,10,2,1.191384952,1
"ENG_062_MZB_LO_1415","ENG_062_MZB_LO_1415-22.10.2002","22.10.2002",2002,10,22,0.885597222,3
"ENG_062_MZB_LO_1415","ENG_062_MZB_LO_1415-22.09.2003","22.09.2003",2003,9,22,0.77815241,3
"ENG_062_MZB_LO_1415","ENG_062_MZB_LO_1415-25.10.2005","25.10.2005",2005,10,25,0.922312886,2
"ENG_062_MZB_LO_1415","ENG_062_MZB_LO_1415-09.09.2008","09.09.2008",2008,9,9,0.904012813,2
"ENG_062_MZB_LO_1415","ENG_062_MZB_LO_1415-08.11.2011","08.11.2011",2011,11,8,0.86880748,3
"ENG_062_MZB_LO_1415","ENG_062_MZB_LO_1415-02.10.2014","02.10.2014",2014,10,2,0.953091971,2
"ENG_062_MZB_LO_1415","ENG_062_MZB_LO_1415-12.10.2017","12.10.2017",2017,10,12,0.990663471,2
"ENG_062_MZB_LO_1416","ENG_062_MZB_LO_1416-02.10.2002","02.10.2002",2002,10,2,1.036786432,1
"ENG_062_MZB_LO_1416","ENG_062_MZB_LO_1416-29.10.2003","29.10.2003",2003,10,29,0.956305995,2
"ENG_062_MZB_LO_1416","ENG_062_MZB_LO_1416-13.10.2004","13.10.2004",2004,10,13,0.919793882,2
"ENG_062_MZB_LO_1416","ENG_062_MZB_LO_1416-17.10.2005","17.10.2005",2005,10,17,0.904876784,3
"ENG_062_MZB_LO_1416","ENG_062_MZB_LO_1416-10.10.2006","10.10.2006",2006,10,10,0.827223808,3
"ENG_062_MZB_LO_1416","ENG_062_MZB_LO_1416-25.09.2007","25.09.2007",2007,9,25,0.931096993,2
"ENG_062_MZB_LO_1416","ENG_062_MZB_LO_1416-21.10.2008","21.10.2008",2008,10,21,1.010518908,1
"ENG_062_MZB_LO_1416","ENG_062_MZB_LO_1416-08.10.2009","08.10.2009",2009,10,8,0.966425531,1
"ENG_062_MZB_LO_1416","ENG_062_MZB_LO_1416-21.10.2010","21.10.2010",2010,10,21,0.931073342,2
"ENG_062_MZB_LO_1416","ENG_062_MZB_LO_1416-11.10.2011","11.10.2011",2011,10,11,0.980653163,2
"ENG_062_MZB_LO_1416","ENG_062_MZB_LO_1416-04.10.2012","04.10.2012",2012,10,4,0.933984042,4
"ENG_062_MZB_LO_1416","ENG_062_MZB_LO_1416-13.09.2013","13.09.2013",2013,9,13,1.020697658,3
"ENG_062_MZB_LO_1416","ENG_062_MZB_LO_1416-05.09.2014","05.09.2014",2014,9,5,1.09388418,1
"ENG_062_MZB_LO_1416","ENG_062_MZB_LO_1416-06.10.2015","06.10.2015",2015,10,6,1.022079691,1
"ENG_062_MZB_LO_1418","ENG_062_MZB_LO_1418-30.09.2003","30.09.2003",2003,9,30,1.013385238,1
"ENG_062_MZB_LO_1418","ENG_062_MZB_LO_1418-20.10.2004","20.10.2004",2004,10,20,0.990885616,1
"ENG_062_MZB_LO_1418","ENG_062_MZB_LO_1418-16.09.2005","16.09.2005",2005,9,16,0.984309849,1
"ENG_062_MZB_LO_1418","ENG_062_MZB_LO_1418-16.11.2006","16.11.2006",2006,11,16,0.918085704,2
"ENG_062_MZB_LO_1418","ENG_062_MZB_LO_1418-02.11.2007","02.11.2007",2007,11,2,1.024587025,1
"ENG_062_MZB_LO_1418","ENG_062_MZB_LO_1418-29.11.2008","29.11.2008",2008,11,29,1.087390745,1
"ENG_062_MZB_LO_1418","ENG_062_MZB_LO_1418-19.10.2009","19.10.2009",2009,10,19,1.143496522,1
"ENG_062_MZB_LO_1418","ENG_062_MZB_LO_1418-23.09.2010","23.09.2010",2010,9,23,1.105474993,1
"ENG_062_MZB_LO_1418","ENG_062_MZB_LO_1418-22.09.2011","22.09.2011",2011,9,22,1.131784217,1
"ENG_062_MZB_LO_1418","ENG_062_MZB_LO_1418-10.09.2012","10.09.2012",2012,9,10,0.97084791,1
"ENG_062_MZB_LO_1418","ENG_062_MZB_LO_1418-24.10.2013","24.10.2013",2013,10,24,1.126111877,1
"ENG_062_MZB_LO_1418","ENG_062_MZB_LO_1418-18.09.2014","18.09.2014",2014,9,18,1.044559797,1
"ENG_062_MZB_LO_1418","ENG_062_MZB_LO_1418-15.10.2015","15.10.2015",2015,10,15,1.078154045,1
"ENG_062_MZB_LO_1418","ENG_062_MZB_LO_1418-14.09.2016","14.09.2016",2016,9,14,1.106073845,1
"ENG_062_MZB_LO_1418","ENG_062_MZB_LO_1418-20.09.2017","20.09.2017",2017,9,20,1.1167982,1
"ENG_062_MZB_LO_1418","ENG_062_MZB_LO_1418-05.11.2018","05.11.2018",2018,11,5,1.160197944,1
"ENG_062_MZB_LO_1418","ENG_062_MZB_LO_1418-18.10.2019","18.10.2019",2019,10,18,1.140583647,1
"ENG_062_MZB_LO_1418","ENG_062_MZB_LO_1418-08.10.2020","08.10.2020",2020,10,8,1.080531266,1
"ENG_062_MZB_LO_1418","ENG_062_MZB_LO_1418-12.10.2021","12.10.2021",2021,10,12,1.171904496,1
"ENG_062_MZB_LO_1418","ENG_062_MZB_LO_1418-24.10.2022","24.10.2022",2022,10,24,1.082397669,1
"ENG_062_MZB_LO_1418","ENG_062_MZB_LO_1418-29.09.2023","29.09.2023",2023,9,29,1.090381938,1
"ENG_062_MZB_LO_1419","ENG_062_MZB_LO_1419-19.09.2002","19.09.2002",2002,9,19,0.832459042,3
"ENG_062_MZB_LO_1419","ENG_062_MZB_LO_1419-01.11.2006","01.11.2006",2006,11,1,0.955766294,2
"ENG_062_MZB_LO_1419","ENG_062_MZB_LO_1419-13.10.2009","13.10.2009",2009,10,13,0.933537843,2
"ENG_062_MZB_LO_1419","ENG_062_MZB_LO_1419-09.09.2013","09.09.2013",2013,9,9,0.953737362,2
"ENG_062_MZB_LO_1419","ENG_062_MZB_LO_1419-04.09.2014","04.09.2014",2014,9,4,0.950118646,2
"ENG_062_MZB_LO_1419","ENG_062_MZB_LO_1419-12.10.2015","12.10.2015",2015,10,12,0.97120426,1
"ENG_062_MZB_LO_1419","ENG_062_MZB_LO_1419-04.10.2016","04.10.2016",2016,10,4,0.988540735,1
"ENG_062_MZB_LO_1419","ENG_062_MZB_LO_1419-03.10.2017","03.10.2017",2017,10,3,0.975688043,1
"ENG_062_MZB_LO_1419","ENG_062_MZB_LO_1419-04.10.2018","04.10.2018",2018,10,4,0.978829918,1
"ENG_062_MZB_LO_1419","ENG_062_MZB_LO_1419-11.10.2019","11.10.2019",2019,10,11,0.984547137,1
"ENG_062_MZB_LO_1419","ENG_062_MZB_LO_1419-14.10.2020","14.10.2020",2020,10,14,0.948304524,2
"ENG_062_MZB_LO_1419","ENG_062_MZB_LO_1419-06.09.2021","06.09.2021",2021,9,6,0.995517173,1
"ENG_062_MZB_LO_1419","ENG_062_MZB_LO_1419-24.10.2022","24.10.2022",2022,10,24,1.007674225,1
"ENG_062_MZB_LO_1421","ENG_062_MZB_LO_1421-02.10.2002","02.10.2002",2002,10,2,0.846158434,4
"ENG_062_MZB_LO_1421","ENG_062_MZB_LO_1421-29.10.2003","29.10.2003",2003,10,29,0.711217544,5
"ENG_062_MZB_LO_1421","ENG_062_MZB_LO_1421-13.10.2004","13.10.2004",2004,10,13,0.874291697,4
"ENG_062_MZB_LO_1421","ENG_062_MZB_LO_1421-17.10.2005","17.10.2005",2005,10,17,0.787918808,4
"ENG_062_MZB_LO_1421","ENG_062_MZB_LO_1421-10.10.2006","10.10.2006",2006,10,10,0.759137339,3
"ENG_062_MZB_LO_1421","ENG_062_MZB_LO_1421-25.09.2007","25.09.2007",2007,9,25,0.775629447,4
"ENG_062_MZB_LO_1421","ENG_062_MZB_LO_1421-21.10.2008","21.10.2008",2008,10,21,0.742398301,5
"ENG_062_MZB_LO_1421","ENG_062_MZB_LO_1421-08.10.2009","08.10.2009",2009,10,8,0.782671437,3
"ENG_062_MZB_LO_1421","ENG_062_MZB_LO_1421-21.10.2010","21.10.2010",2010,10,21,0.831764073,3
"ENG_062_MZB_LO_1421","ENG_062_MZB_LO_1421-11.10.2011","11.10.2011",2011,10,11,0.844719381,3
"ENG_062_MZB_LO_1421","ENG_062_MZB_LO_1421-10.10.2013","10.10.2013",2013,10,10,0.889207956,3
"ENG_062_MZB_LO_1421","ENG_062_MZB_LO_1421-05.09.2014","05.09.2014",2014,9,5,0.898303953,3
"ENG_062_MZB_LO_1421","ENG_062_MZB_LO_1421-04.10.2024","04.10.2024",2024,10,4,0.92118332,2
"ENG_062_MZB_LO_1424","ENG_062_MZB_LO_1424-01.10.2002","01.10.2002",2002,10,1,0.58799109,5
"ENG_062_MZB_LO_1424","ENG_062_MZB_LO_1424-27.10.2003","27.10.2003",2003,10,27,0.632118803,4
"ENG_062_MZB_LO_1424","ENG_062_MZB_LO_1424-28.09.2006","28.09.2006",2006,9,28,0.58506434,5
"ENG_062_MZB_LO_1424","ENG_062_MZB_LO_1424-16.10.2008","16.10.2008",2008,10,16,0.63356303,5
"ENG_062_MZB_LO_1424","ENG_062_MZB_LO_1424-14.11.2013","14.11.2013",2013,11,14,0.646454816,4
"ENG_062_MZB_LO_1424","ENG_062_MZB_LO_1424-28.10.2014","28.10.2014",2014,10,28,0.618373046,4
"ENG_062_MZB_LO_1424","ENG_062_MZB_LO_1424-18.10.2017","18.10.2017",2017,10,18,0.709006892,4
"ENG_062_MZB_LO_1425","ENG_062_MZB_LO_1425-22.09.2003","22.09.2003",2003,9,22,1.038010207,1
"ENG_062_MZB_LO_1425","ENG_062_MZB_LO_1425-05.11.2004","05.11.2004",2004,11,5,0.981569417,1
"ENG_062_MZB_LO_1425","ENG_062_MZB_LO_1425-05.10.2005","05.10.2005",2005,10,5,1.06859795,1
"ENG_062_MZB_LO_1425","ENG_062_MZB_LO_1425-27.11.2006","27.11.2006",2006,11,27,1.020511924,1
"ENG_062_MZB_LO_1425","ENG_062_MZB_LO_1425-18.10.2007","18.10.2007",2007,10,18,1.033584962,2
"ENG_062_MZB_LO_1425","ENG_062_MZB_LO_1425-24.10.2008","24.10.2008",2008,10,24,1.080662099,1
"ENG_062_MZB_LO_1425","ENG_062_MZB_LO_1425-10.09.2009","10.09.2009",2009,9,10,1.124603266,1
"ENG_062_MZB_LO_1425","ENG_062_MZB_LO_1425-15.09.2010","15.09.2010",2010,9,15,1.097624605,1
"ENG_062_MZB_LO_1425","ENG_062_MZB_LO_1425-29.10.2014","29.10.2014",2014,10,29,1.10932102,1
"ENG_062_MZB_LO_1427","ENG_062_MZB_LO_1427-19.09.2002","19.09.2002",2002,9,19,0.76045932,4
"ENG_062_MZB_LO_1427","ENG_062_MZB_LO_1427-29.10.2003","29.10.2003",2003,10,29,0.749033029,4
"ENG_062_MZB_LO_1427","ENG_062_MZB_LO_1427-12.11.2004","12.11.2004",2004,11,12,0.835774962,3
"ENG_062_MZB_LO_1427","ENG_062_MZB_LO_1427-07.10.2005","07.10.2005",2005,10,7,0.800598605,3
"ENG_062_MZB_LO_1427","ENG_062_MZB_LO_1427-06.11.2006","06.11.2006",2006,11,6,0.800569448,3
"ENG_062_MZB_LO_1427","ENG_062_MZB_LO_1427-15.10.2007","15.10.2007",2007,10,15,0.780899287,5
"ENG_062_MZB_LO_1427","ENG_062_MZB_LO_1427-20.11.2008","20.11.2008",2008,11,20,0.782459058,3
"ENG_062_MZB_LO_1427","ENG_062_MZB_LO_1427-27.11.2009","27.11.2009",2009,11,27,0.877934845,3
"ENG_062_MZB_LO_1427","ENG_062_MZB_LO_1427-11.10.2010","11.10.2010",2010,10,11,0.840134576,3
"ENG_062_MZB_LO_1427","ENG_062_MZB_LO_1427-01.11.2011","01.11.2011",2011,11,1,0.84474588,3
"ENG_062_MZB_LO_1427","ENG_062_MZB_LO_1427-05.09.2012","05.09.2012",2012,9,5,0.875964057,3
"ENG_062_MZB_LO_1427","ENG_062_MZB_LO_1427-04.09.2013","04.09.2013",2013,9,4,0.869800886,3
"ENG_062_MZB_LO_1427","ENG_062_MZB_LO_1427-01.09.2014","01.09.2014",2014,9,1,0.821192657,3
"ENG_062_MZB_LO_1429","ENG_062_MZB_LO_1429-29.10.2003","29.10.2003",2003,10,29,1.044153375,2
"ENG_062_MZB_LO_1429","ENG_062_MZB_LO_1429-22.10.2004","22.10.2004",2004,10,22,1.088817948,2
"ENG_062_MZB_LO_1429","ENG_062_MZB_LO_1429-08.11.2005","08.11.2005",2005,11,8,1.020002657,1
"ENG_062_MZB_LO_1429","ENG_062_MZB_LO_1429-10.10.2006","10.10.2006",2006,10,10,1.044751047,1
"ENG_062_MZB_LO_1429","ENG_062_MZB_LO_1429-16.10.2007","16.10.2007",2007,10,16,1.041252963,1
"ENG_062_MZB_LO_1429","ENG_062_MZB_LO_1429-22.09.2008","22.09.2008",2008,9,22,1.140851503,1
"ENG_062_MZB_LO_1429","ENG_062_MZB_LO_1429-29.09.2009","29.09.2009",2009,9,29,1.179467659,1
"ENG_062_MZB_LO_1429","ENG_062_MZB_LO_1429-08.10.2013","08.10.2013",2013,10,8,1.155125959,3
"ENG_062_MZB_LO_1429","ENG_062_MZB_LO_1429-24.10.2019","24.10.2019",2019,10,24,1.09685584,1
"ENG_062_MZB_LO_1429","ENG_062_MZB_LO_1429-19.10.2021","19.10.2021",2021,10,19,1.124793462,1
"ENG_062_MZB_LO_1430","ENG_062_MZB_LO_1430-11.10.2002","11.10.2002",2002,10,11,0.982328463,2
"ENG_062_MZB_LO_1430","ENG_062_MZB_LO_1430-29.10.2003","29.10.2003",2003,10,29,0.849774928,3
"ENG_062_MZB_LO_1430","ENG_062_MZB_LO_1430-25.10.2004","25.10.2004",2004,10,25,0.890632801,2
"ENG_062_MZB_LO_1430","ENG_062_MZB_LO_1430-08.11.2005","08.11.2005",2005,11,8,0.94721097,2
"ENG_062_MZB_LO_1430","ENG_062_MZB_LO_1430-10.10.2006","10.10.2006",2006,10,10,0.881296523,2
"ENG_062_MZB_LO_1430","ENG_062_MZB_LO_1430-16.10.2007","16.10.2007",2007,10,16,0.888572968,2
"ENG_062_MZB_LO_1430","ENG_062_MZB_LO_1430-22.10.2008","22.10.2008",2008,10,22,0.919266422,2
"ENG_062_MZB_LO_1430","ENG_062_MZB_LO_1430-29.09.2009","29.09.2009",2009,9,29,0.907490015,2
"ENG_062_MZB_LO_1430","ENG_062_MZB_LO_1430-17.09.2013","17.09.2013",2013,9,17,0.947094437,2
"ENG_062_MZB_LO_1430","ENG_062_MZB_LO_1430-08.10.2015","08.10.2015",2015,10,8,0.987845719,2
"ENG_062_MZB_LO_1434","ENG_062_MZB_LO_1434-12.09.2002","12.09.2002",2002,9,12,0.969628833,1
"ENG_062_MZB_LO_1434","ENG_062_MZB_LO_1434-27.10.2005","27.10.2005",2005,10,27,0.910083936,2
"ENG_062_MZB_LO_1434","ENG_062_MZB_LO_1434-03.11.2008","03.11.2008",2008,11,3,0.860696153,3
"ENG_062_MZB_LO_1434","ENG_062_MZB_LO_1434-20.10.2009","20.10.2009",2009,10,20,0.992580247,2
"ENG_062_MZB_LO_1434","ENG_062_MZB_LO_1434-14.09.2011","14.09.2011",2011,9,14,0.956720799,2
"ENG_062_MZB_LO_1434","ENG_062_MZB_LO_1434-20.11.2014","20.11.2014",2014,11,20,0.962977309,3
"ENG_062_MZB_LO_1434","ENG_062_MZB_LO_1434-14.09.2017","14.09.2017",2017,9,14,1.083735367,2
"ENG_062_MZB_LO_1435","ENG_062_MZB_LO_1435-08.09.2004","08.09.2004",2004,9,8,0.820143991,3
"ENG_062_MZB_LO_1435","ENG_062_MZB_LO_1435-08.09.2005","08.09.2005",2005,9,8,0.90911748,2
"ENG_062_MZB_LO_1435","ENG_062_MZB_LO_1435-02.11.2006","02.11.2006",2006,11,2,0.921739223,2
"ENG_062_MZB_LO_1435","ENG_062_MZB_LO_1435-06.09.2007","06.09.2007",2007,9,6,0.978820734,4
"ENG_062_MZB_LO_1435","ENG_062_MZB_LO_1435-13.11.2014","13.11.2014",2014,11,13,0.933718792,4
"ENG_062_MZB_LO_1435","ENG_062_MZB_LO_1435-29.09.2015","29.09.2015",2015,9,29,1.060807228,3
"ENG_062_MZB_LO_1435","ENG_062_MZB_LO_1435-17.10.2016","17.10.2016",2016,10,17,1.077147171,1
"ENG_062_MZB_LO_1435","ENG_062_MZB_LO_1435-14.09.2017","14.09.2017",2017,9,14,1.073225618,1
"ENG_062_MZB_LO_1435","ENG_062_MZB_LO_1435-12.10.2018","12.10.2018",2018,10,12,1.06477412,2
"ENG_062_MZB_LO_1435","ENG_062_MZB_LO_1435-09.10.2019","09.10.2019",2019,10,9,1.036683331,3
"ENG_062_MZB_LO_1435","ENG_062_MZB_LO_1435-08.10.2020","08.10.2020",2020,10,8,1.03715435,2
"ENG_062_MZB_LO_1435","ENG_062_MZB_LO_1435-09.09.2021","09.09.2021",2021,9,9,1.032042019,2
"ENG_062_MZB_LO_1437","ENG_062_MZB_LO_1437-19.09.2002","19.09.2002",2002,9,19,1.049525859,1
"ENG_062_MZB_LO_1437","ENG_062_MZB_LO_1437-01.11.2006","01.11.2006",2006,11,1,0.969417385,1
"ENG_062_MZB_LO_1437","ENG_062_MZB_LO_1437-13.10.2009","13.10.2009",2009,10,13,0.985552943,1
"ENG_062_MZB_LO_1437","ENG_062_MZB_LO_1437-10.09.2013","10.09.2013",2013,9,10,1.081209991,1
"ENG_062_MZB_LO_1437","ENG_062_MZB_LO_1437-11.09.2014","11.09.2014",2014,9,11,1.120366594,3
"ENG_062_MZB_LO_1437","ENG_062_MZB_LO_1437-12.10.2015","12.10.2015",2015,10,12,1.112974196,2
"ENG_062_MZB_LO_1437","ENG_062_MZB_LO_1437-07.10.2016","07.10.2016",2016,10,7,1.006833707,3
"ENG_062_MZB_LO_1437","ENG_062_MZB_LO_1437-03.10.2017","03.10.2017",2017,10,3,1.090788083,2
"ENG_062_MZB_LO_1437","ENG_062_MZB_LO_1437-04.10.2018","04.10.2018",2018,10,4,1.023642281,3
"ENG_062_MZB_LO_1437","ENG_062_MZB_LO_1437-11.10.2019","11.10.2019",2019,10,11,1.090827954,3
"ENG_062_MZB_LO_1437","ENG_062_MZB_LO_1437-14.10.2020","14.10.2020",2020,10,14,1.126661314,3
"ENG_062_MZB_LO_1437","ENG_062_MZB_LO_1437-06.09.2021","06.09.2021",2021,9,6,1.039346537,3
"ENG_062_MZB_LO_1437","ENG_062_MZB_LO_1437-24.10.2022","24.10.2022",2022,10,24,1.03203794,2
"ENG_062_MZB_LO_1438","ENG_062_MZB_LO_1438-19.09.2002","19.09.2002",2002,9,19,1.006865284,1
"ENG_062_MZB_LO_1438","ENG_062_MZB_LO_1438-01.11.2006","01.11.2006",2006,11,1,1.003563807,1
"ENG_062_MZB_LO_1438","ENG_062_MZB_LO_1438-13.10.2009","13.10.2009",2009,10,13,0.974349829,1
"ENG_062_MZB_LO_1438","ENG_062_MZB_LO_1438-03.10.2017","03.10.2017",2017,10,3,1.080511463,1
"ENG_062_MZB_LO_1438","ENG_062_MZB_LO_1438-04.10.2018","04.10.2018",2018,10,4,1.030274398,1
"ENG_062_MZB_LO_1438","ENG_062_MZB_LO_1438-11.10.2019","11.10.2019",2019,10,11,1.007861501,1
"ENG_062_MZB_LO_1438","ENG_062_MZB_LO_1438-06.09.2021","06.09.2021",2021,9,6,1.159622339,1
"ENG_062_MZB_LO_1438","ENG_062_MZB_LO_1438-07.11.2022","07.11.2022",2022,11,7,1.191575949,3
"ENG_062_MZB_LO_144","ENG_062_MZB_LO_144-14.05.2002","14.05.2002",2002,5,14,0.767599697,3
"ENG_062_MZB_LO_144","ENG_062_MZB_LO_144-14.05.2003","14.05.2003",2003,5,14,0.768608363,3
"ENG_062_MZB_LO_144","ENG_062_MZB_LO_144-06.05.2004","06.05.2004",2004,5,6,0.742193762,3
"ENG_062_MZB_LO_144","ENG_062_MZB_LO_144-11.04.2005","11.04.2005",2005,4,11,0.802258571,4
"ENG_062_MZB_LO_144","ENG_062_MZB_LO_144-25.05.2007","25.05.2007",2007,5,25,0.769808154,3
"ENG_062_MZB_LO_144","ENG_062_MZB_LO_144-23.04.2012","23.04.2012",2012,4,23,0.680705255,4
"ENG_062_MZB_LO_144","ENG_062_MZB_LO_144-15.03.2016","15.03.2016",2016,3,15,0.850087573,3
"ENG_062_MZB_LO_1441","ENG_062_MZB_LO_1441-12.09.2003","12.09.2003",2003,9,12,0.919873218,2
"ENG_062_MZB_LO_1441","ENG_062_MZB_LO_1441-06.09.2006","06.09.2006",2006,9,6,0.863015209,3
"ENG_062_MZB_LO_1441","ENG_062_MZB_LO_1441-10.09.2009","10.09.2009",2009,9,10,1.046747796,1
"ENG_062_MZB_LO_1441","ENG_062_MZB_LO_1441-20.10.2010","20.10.2010",2010,10,20,0.978910083,1
"ENG_062_MZB_LO_1441","ENG_062_MZB_LO_1441-05.10.2011","05.10.2011",2011,10,5,0.963534609,2
"ENG_062_MZB_LO_1441","ENG_062_MZB_LO_1441-16.11.2012","16.11.2012",2012,11,16,1.031542174,1
"ENG_062_MZB_LO_1441","ENG_062_MZB_LO_1441-27.11.2013","27.11.2013",2013,11,27,0.948971126,2
"ENG_062_MZB_LO_1441","ENG_062_MZB_LO_1441-31.10.2014","31.10.2014",2014,10,31,0.853637961,3
"ENG_062_MZB_LO_1441","ENG_062_MZB_LO_1441-18.09.2015","18.09.2015",2015,9,18,0.955511802,2
"ENG_062_MZB_LO_1441","ENG_062_MZB_LO_1441-11.10.2016","11.10.2016",2016,10,11,0.99413788,1
"ENG_062_MZB_LO_1441","ENG_062_MZB_LO_1441-03.11.2017","03.11.2017",2017,11,3,0.985213214,1
"ENG_062_MZB_LO_1441","ENG_062_MZB_LO_1441-31.10.2018","31.10.2018",2018,10,31,0.936514506,2
"ENG_062_MZB_LO_1441","ENG_062_MZB_LO_1441-20.09.2019","20.09.2019",2019,9,20,1.068457649,1
"ENG_062_MZB_LO_1441","ENG_062_MZB_LO_1441-15.11.2022","15.11.2022",2022,11,15,0.746609384,4
"ENG_062_MZB_LO_1441","ENG_062_MZB_LO_1441-04.09.2024","04.09.2024",2024,9,4,0.966156838,2
"ENG_062_MZB_LO_1442","ENG_062_MZB_LO_1442-05.09.2002","05.09.2002",2002,9,5,1.051524662,1
"ENG_062_MZB_LO_1442","ENG_062_MZB_LO_1442-06.09.2005","06.09.2005",2005,9,6,1.029999,1
"ENG_062_MZB_LO_1442","ENG_062_MZB_LO_1442-16.09.2008","16.09.2008",2008,9,16,0.984788064,2
"ENG_062_MZB_LO_1442","ENG_062_MZB_LO_1442-07.10.2013","07.10.2013",2013,10,7,0.967879461,2
"ENG_062_MZB_LO_1442","ENG_062_MZB_LO_1442-12.10.2016","12.10.2016",2016,10,12,0.960137046,2
"ENG_062_MZB_LO_1442","ENG_062_MZB_LO_1442-15.11.2022","15.11.2022",2022,11,15,0.887082077,2
"ENG_062_MZB_LO_1442","ENG_062_MZB_LO_1442-20.09.2024","20.09.2024",2024,9,20,0.966327855,2
"ENG_062_MZB_LO_1445","ENG_062_MZB_LO_1445-24.09.2004","24.09.2004",2004,9,24,1.11407709,2
"ENG_062_MZB_LO_1445","ENG_062_MZB_LO_1445-05.09.2007","05.09.2007",2007,9,5,1.186832853,1
"ENG_062_MZB_LO_1445","ENG_062_MZB_LO_1445-10.09.2009","10.09.2009",2009,9,10,1.200159587,1
"ENG_062_MZB_LO_1445","ENG_062_MZB_LO_1445-26.10.2010","26.10.2010",2010,10,26,1.175602001,1
"ENG_062_MZB_LO_1445","ENG_062_MZB_LO_1445-05.10.2011","05.10.2011",2011,10,5,1.151050622,1
"ENG_062_MZB_LO_1445","ENG_062_MZB_LO_1445-16.11.2012","16.11.2012",2012,11,16,1.030155523,1
"ENG_062_MZB_LO_1445","ENG_062_MZB_LO_1445-11.11.2013","11.11.2013",2013,11,11,1.056946821,1
"ENG_062_MZB_LO_1445","ENG_062_MZB_LO_1445-31.10.2014","31.10.2014",2014,10,31,1.12168537,1
"ENG_062_MZB_LO_1445","ENG_062_MZB_LO_1445-01.10.2015","01.10.2015",2015,10,1,1.11899655,1
"ENG_062_MZB_LO_1445","ENG_062_MZB_LO_1445-06.10.2016","06.10.2016",2016,10,6,1.137796998,1
"ENG_062_MZB_LO_1445","ENG_062_MZB_LO_1445-09.10.2017","09.10.2017",2017,10,9,1.057163897,1
"ENG_062_MZB_LO_1445","ENG_062_MZB_LO_1445-12.10.2018","12.10.2018",2018,10,12,1.131704211,1
"ENG_062_MZB_LO_1445","ENG_062_MZB_LO_1445-08.10.2019","08.10.2019",2019,10,8,1.128746609,1
"ENG_062_MZB_LO_1445","ENG_062_MZB_LO_1445-25.09.2020","25.09.2020",2020,9,25,1.147137822,1
"ENG_062_MZB_LO_1445","ENG_062_MZB_LO_1445-07.09.2021","07.09.2021",2021,9,7,1.130775938,1
"ENG_062_MZB_LO_1445","ENG_062_MZB_LO_1445-07.09.2022","07.09.2022",2022,9,7,1.188804169,1
"ENG_062_MZB_LO_1445","ENG_062_MZB_LO_1445-26.09.2023","26.09.2023",2023,9,26,1.173278144,1
"ENG_062_MZB_LO_1446","ENG_062_MZB_LO_1446-09.09.2004","09.09.2004",2004,9,9,0.928139555,2
"ENG_062_MZB_LO_1446","ENG_062_MZB_LO_1446-06.09.2007","06.09.2007",2007,9,6,1.011815266,2
"ENG_062_MZB_LO_1446","ENG_062_MZB_LO_1446-10.09.2009","10.09.2009",2009,9,10,0.951913729,2
"ENG_062_MZB_LO_1446","ENG_062_MZB_LO_1446-20.10.2010","20.10.2010",2010,10,20,1.023465498,1
"ENG_062_MZB_LO_1446","ENG_062_MZB_LO_1446-18.11.2011","18.11.2011",2011,11,18,0.827913034,5
"ENG_062_MZB_LO_1446","ENG_062_MZB_LO_1446-16.11.2012","16.11.2012",2012,11,16,1.027604535,1
"ENG_062_MZB_LO_1446","ENG_062_MZB_LO_1446-17.10.2013","17.10.2013",2013,10,17,0.977473888,1
"ENG_062_MZB_LO_1446","ENG_062_MZB_LO_1446-31.10.2014","31.10.2014",2014,10,31,0.943964069,2
"ENG_062_MZB_LO_1446","ENG_062_MZB_LO_1446-01.10.2015","01.10.2015",2015,10,1,0.947741808,2
"ENG_062_MZB_LO_1446","ENG_062_MZB_LO_1446-12.10.2016","12.10.2016",2016,10,12,0.915063574,2
"ENG_062_MZB_LO_1446","ENG_062_MZB_LO_1446-09.10.2017","09.10.2017",2017,10,9,0.997141203,1
"ENG_062_MZB_LO_1446","ENG_062_MZB_LO_1446-19.10.2018","19.10.2018",2018,10,19,0.962329971,2
"ENG_062_MZB_LO_1446","ENG_062_MZB_LO_1446-18.10.2019","18.10.2019",2019,10,18,1.005462378,1
"ENG_062_MZB_LO_1446","ENG_062_MZB_LO_1446-25.09.2020","25.09.2020",2020,9,25,0.997916931,2
"ENG_062_MZB_LO_1446","ENG_062_MZB_LO_1446-03.09.2021","03.09.2021",2021,9,3,0.947529615,2
"ENG_062_MZB_LO_1446","ENG_062_MZB_LO_1446-02.09.2022","02.09.2022",2022,9,2,0.913538529,5
"ENG_062_MZB_LO_1446","ENG_062_MZB_LO_1446-29.09.2023","29.09.2023",2023,9,29,0.936213424,2
"ENG_062_MZB_LO_1449","ENG_062_MZB_LO_1449-24.09.2004","24.09.2004",2004,9,24,0.994764117,1
"ENG_062_MZB_LO_1449","ENG_062_MZB_LO_1449-05.09.2007","05.09.2007",2007,9,5,0.970466205,1
"ENG_062_MZB_LO_1449","ENG_062_MZB_LO_1449-13.11.2013","13.11.2013",2013,11,13,0.970429739,1
"ENG_062_MZB_LO_1449","ENG_062_MZB_LO_1449-01.10.2015","01.10.2015",2015,10,1,1.008312683,1
"ENG_062_MZB_LO_1449","ENG_062_MZB_LO_1449-01.11.2018","01.11.2018",2018,11,1,0.943442791,2
"ENG_062_MZB_LO_1449","ENG_062_MZB_LO_1449-07.09.2021","07.09.2021",2021,9,7,1.034552834,1
"ENG_062_MZB_LO_1449","ENG_062_MZB_LO_1449-15.09.2022","15.09.2022",2022,9,15,0.963606755,2
"ENG_062_MZB_LO_1449","ENG_062_MZB_LO_1449-26.09.2023","26.09.2023",2023,9,26,1.003347288,1
"ENG_062_MZB_LO_145","ENG_062_MZB_LO_145-10.10.2002","10.10.2002",2002,10,10,0.712590087,4
"ENG_062_MZB_LO_145","ENG_062_MZB_LO_145-15.11.2005","15.11.2005",2005,11,15,0.719905036,4
"ENG_062_MZB_LO_145","ENG_062_MZB_LO_145-20.09.2006","20.09.2006",2006,9,20,0.665788497,4
"ENG_062_MZB_LO_145","ENG_062_MZB_LO_145-10.09.2007","10.09.2007",2007,9,10,0.613562001,5
"ENG_062_MZB_LO_145","ENG_062_MZB_LO_145-06.11.2008","06.11.2008",2008,11,6,0.711659968,5
"ENG_062_MZB_LO_145","ENG_062_MZB_LO_145-15.10.2009","15.10.2009",2009,10,15,0.741524578,3
"ENG_062_MZB_LO_145","ENG_062_MZB_LO_145-16.09.2010","16.09.2010",2010,9,16,0.743096739,3
"ENG_062_MZB_LO_145","ENG_062_MZB_LO_145-18.09.2013","18.09.2013",2013,9,18,0.691033628,4
"ENG_062_MZB_LO_145","ENG_062_MZB_LO_145-22.09.2016","22.09.2016",2016,9,22,0.750617162,3
"ENG_062_MZB_LO_1450","ENG_062_MZB_LO_1450-09.09.2002","09.09.2002",2002,9,9,1.25693976,1
"ENG_062_MZB_LO_1450","ENG_062_MZB_LO_1450-01.09.2005","01.09.2005",2005,9,1,1.153820601,1
"ENG_062_MZB_LO_1450","ENG_062_MZB_LO_1450-01.09.2008","01.09.2008",2008,9,1,1.124393679,1
"ENG_062_MZB_LO_1450","ENG_062_MZB_LO_1450-21.09.2009","21.09.2009",2009,9,21,1.19541086,2
"ENG_062_MZB_LO_1450","ENG_062_MZB_LO_1450-26.10.2010","26.10.2010",2010,10,26,1.308001108,1
"ENG_062_MZB_LO_1450","ENG_062_MZB_LO_1450-05.10.2011","05.10.2011",2011,10,5,1.295217799,1
"ENG_062_MZB_LO_1450","ENG_062_MZB_LO_1450-12.09.2012","12.09.2012",2012,9,12,1.123732402,1
"ENG_062_MZB_LO_1450","ENG_062_MZB_LO_1450-12.09.2013","12.09.2013",2013,9,12,1.235924435,1
"ENG_062_MZB_LO_1450","ENG_062_MZB_LO_1450-04.09.2014","04.09.2014",2014,9,4,1.217100081,1
"ENG_062_MZB_LO_1450","ENG_062_MZB_LO_1450-23.10.2015","23.10.2015",2015,10,23,1.18868033,1
"ENG_062_MZB_LO_1450","ENG_062_MZB_LO_1450-13.09.2016","13.09.2016",2016,9,13,1.232481735,1
"ENG_062_MZB_LO_1450","ENG_062_MZB_LO_1450-03.11.2017","03.11.2017",2017,11,3,1.234541658,1
"ENG_062_MZB_LO_1450","ENG_062_MZB_LO_1450-01.11.2018","01.11.2018",2018,11,1,1.243707167,1
"ENG_062_MZB_LO_1450","ENG_062_MZB_LO_1450-25.09.2020","25.09.2020",2020,9,25,1.267369506,1
"ENG_062_MZB_LO_1450","ENG_062_MZB_LO_1450-22.09.2021","22.09.2021",2021,9,22,1.173945681,1
"ENG_062_MZB_LO_1450","ENG_062_MZB_LO_1450-23.09.2022","23.09.2022",2022,9,23,1.289934371,1
"ENG_062_MZB_LO_1450","ENG_062_MZB_LO_1450-06.10.2023","06.10.2023",2023,10,6,1.241884861,3
"ENG_062_MZB_LO_1452","ENG_062_MZB_LO_1452-21.05.2004","21.05.2004",2004,5,21,1.086398125,1
"ENG_062_MZB_LO_1452","ENG_062_MZB_LO_1452-11.04.2007","11.04.2007",2007,4,11,1.030141926,1
"ENG_062_MZB_LO_1452","ENG_062_MZB_LO_1452-24.05.2013","24.05.2013",2013,5,24,1.067535474,1
"ENG_062_MZB_LO_1452","ENG_062_MZB_LO_1452-08.05.2019","08.05.2019",2019,5,8,1.018684436,1
"ENG_062_MZB_LO_1452","ENG_062_MZB_LO_1452-05.05.2022","05.05.2022",2022,5,5,1.102053587,1
"ENG_062_MZB_LO_1452","ENG_062_MZB_LO_1452-23.05.2023","23.05.2023",2023,5,23,1.095100686,1
"ENG_062_MZB_LO_1452","ENG_062_MZB_LO_1452-22.05.2024","22.05.2024",2024,5,22,1.047477842,1
"ENG_062_MZB_LO_1454","ENG_062_MZB_LO_1454-13.09.2004","13.09.2004",2004,9,13,1.133315894,1
"ENG_062_MZB_LO_1454","ENG_062_MZB_LO_1454-04.09.2007","04.09.2007",2007,9,4,1.011632635,2
"ENG_062_MZB_LO_1454","ENG_062_MZB_LO_1454-15.11.2013","15.11.2013",2013,11,15,1.078301679,1
"ENG_062_MZB_LO_1454","ENG_062_MZB_LO_1454-31.10.2014","31.10.2014",2014,10,31,1.179832806,1
"ENG_062_MZB_LO_1454","ENG_062_MZB_LO_1454-14.10.2021","14.10.2021",2021,10,14,1.087042041,1
"ENG_062_MZB_LO_1454","ENG_062_MZB_LO_1454-13.09.2022","13.09.2022",2022,9,13,1.057801609,1
"ENG_062_MZB_LO_1454","ENG_062_MZB_LO_1454-03.10.2023","03.10.2023",2023,10,3,1.126769075,1
"ENG_062_MZB_LO_146","ENG_062_MZB_LO_146-13.05.2004","13.05.2004",2004,5,13,0.503825301,5
"ENG_062_MZB_LO_146","ENG_062_MZB_LO_146-19.05.2008","19.05.2008",2008,5,19,0.577366021,5
"ENG_062_MZB_LO_146","ENG_062_MZB_LO_146-18.03.2010","18.03.2010",2010,3,18,0.653754689,4
"ENG_062_MZB_LO_146","ENG_062_MZB_LO_146-24.04.2013","24.04.2013",2013,4,24,0.693811011,4
"ENG_062_MZB_LO_146","ENG_062_MZB_LO_146-21.05.2014","21.05.2014",2014,5,21,0.691993339,4
"ENG_062_MZB_LO_146","ENG_062_MZB_LO_146-23.05.2017","23.05.2017",2017,5,23,0.692301057,4
"ENG_062_MZB_LO_146","ENG_062_MZB_LO_146-16.05.2023","16.05.2023",2023,5,16,0.608755391,4
"ENG_062_MZB_LO_1468","ENG_062_MZB_LO_1468-13.09.2004","13.09.2004",2004,9,13,0.598329576,4
"ENG_062_MZB_LO_1468","ENG_062_MZB_LO_1468-04.09.2007","04.09.2007",2007,9,4,0.620312016,5
"ENG_062_MZB_LO_1468","ENG_062_MZB_LO_1468-24.09.2010","24.09.2010",2010,9,24,0.844358547,3
"ENG_062_MZB_LO_1468","ENG_062_MZB_LO_1468-27.11.2013","27.11.2013",2013,11,27,0.850735738,3
"ENG_062_MZB_LO_1468","ENG_062_MZB_LO_1468-20.11.2014","20.11.2014",2014,11,20,0.908915776,2
"ENG_062_MZB_LO_1468","ENG_062_MZB_LO_1468-23.10.2015","23.10.2015",2015,10,23,0.873013664,2
"ENG_062_MZB_LO_1468","ENG_062_MZB_LO_1468-15.09.2016","15.09.2016",2016,9,15,0.728397397,5
"ENG_062_MZB_LO_1468","ENG_062_MZB_LO_1468-03.11.2017","03.11.2017",2017,11,3,0.809482116,3
"ENG_062_MZB_LO_1468","ENG_062_MZB_LO_1468-11.10.2018","11.10.2018",2018,10,11,0.806620279,3
"ENG_062_MZB_LO_1468","ENG_062_MZB_LO_1468-20.09.2019","20.09.2019",2019,9,20,0.804621201,3
"ENG_062_MZB_LO_1468","ENG_062_MZB_LO_1468-30.11.2020","30.11.2020",2020,11,30,0.835086289,3
"ENG_062_MZB_LO_1468","ENG_062_MZB_LO_1468-08.09.2021","08.09.2021",2021,9,8,0.898519439,2
"ENG_062_MZB_LO_1468","ENG_062_MZB_LO_1468-20.09.2022","20.09.2022",2022,9,20,0.723409678,5
"ENG_062_MZB_LO_1469","ENG_062_MZB_LO_1469-12.09.2003","12.09.2003",2003,9,12,0.783587835,3
"ENG_062_MZB_LO_1469","ENG_062_MZB_LO_1469-06.09.2006","06.09.2006",2006,9,6,0.708010288,4
"ENG_062_MZB_LO_1469","ENG_062_MZB_LO_1469-10.09.2009","10.09.2009",2009,9,10,0.893781982,2
"ENG_062_MZB_LO_1469","ENG_062_MZB_LO_1469-06.10.2011","06.10.2011",2011,10,6,0.912929629,3
"ENG_062_MZB_LO_1469","ENG_062_MZB_LO_1469-17.09.2014","17.09.2014",2014,9,17,0.897701552,2
"ENG_062_MZB_LO_1469","ENG_062_MZB_LO_1469-17.10.2018","17.10.2018",2018,10,17,0.891920924,2
"ENG_062_MZB_LO_1469","ENG_062_MZB_LO_1469-24.09.2020","24.09.2020",2020,9,24,0.983670154,1
"ENG_062_MZB_LO_1469","ENG_062_MZB_LO_1469-06.09.2021","06.09.2021",2021,9,6,0.923243658,2
"ENG_062_MZB_LO_1469","ENG_062_MZB_LO_1469-05.09.2022","05.09.2022",2022,9,5,0.858513144,3
"ENG_062_MZB_LO_1470","ENG_062_MZB_LO_1470-17.09.2002","17.09.2002",2002,9,17,0.950711085,3
"ENG_062_MZB_LO_1470","ENG_062_MZB_LO_1470-06.09.2005","06.09.2005",2005,9,6,0.749934313,3
"ENG_062_MZB_LO_1470","ENG_062_MZB_LO_1470-16.09.2008","16.09.2008",2008,9,16,0.787747899,3
"ENG_062_MZB_LO_1470","ENG_062_MZB_LO_1470-07.10.2013","07.10.2013",2013,10,7,0.778506833,3
"ENG_062_MZB_LO_1470","ENG_062_MZB_LO_1470-30.09.2015","30.09.2015",2015,9,30,0.857110634,3
"ENG_062_MZB_LO_1470","ENG_062_MZB_LO_1470-31.10.2018","31.10.2018",2018,10,31,0.628367075,5
"ENG_062_MZB_LO_1470","ENG_062_MZB_LO_1470-04.09.2024","04.09.2024",2024,9,4,0.671788813,4
"ENG_062_MZB_LO_1472","ENG_062_MZB_LO_1472-09.09.2002","09.09.2002",2002,9,9,1.036108254,1
"ENG_062_MZB_LO_1472","ENG_062_MZB_LO_1472-01.09.2005","01.09.2005",2005,9,1,0.976460479,1
"ENG_062_MZB_LO_1472","ENG_062_MZB_LO_1472-17.09.2008","17.09.2008",2008,9,17,1.06150886,1
"ENG_062_MZB_LO_1472","ENG_062_MZB_LO_1472-27.11.2013","27.11.2013",2013,11,27,0.894619609,2
"ENG_062_MZB_LO_1472","ENG_062_MZB_LO_1472-30.09.2020","30.09.2020",2020,9,30,0.973565577,2
"ENG_062_MZB_LO_1472","ENG_062_MZB_LO_1472-18.10.2021","18.10.2021",2021,10,18,0.933153914,2
"ENG_062_MZB_LO_1472","ENG_062_MZB_LO_1472-08.09.2022","08.09.2022",2022,9,8,0.934678624,2
"ENG_062_MZB_LO_1472","ENG_062_MZB_LO_1472-04.09.2024","04.09.2024",2024,9,4,1.031895585,1
"ENG_062_MZB_LO_1477","ENG_062_MZB_LO_1477-08.09.2004","08.09.2004",2004,9,8,0.784444511,3
"ENG_062_MZB_LO_1477","ENG_062_MZB_LO_1477-05.09.2007","05.09.2007",2007,9,5,0.758866031,3
"ENG_062_MZB_LO_1477","ENG_062_MZB_LO_1477-24.09.2010","24.09.2010",2010,9,24,0.934151822,2
"ENG_062_MZB_LO_1477","ENG_062_MZB_LO_1477-23.09.2013","23.09.2013",2013,9,23,0.978378991,1
"ENG_062_MZB_LO_1477","ENG_062_MZB_LO_1477-22.10.2014","22.10.2014",2014,10,22,0.961452525,2
"ENG_062_MZB_LO_1477","ENG_062_MZB_LO_1477-10.10.2017","10.10.2017",2017,10,10,0.887493683,2
"ENG_062_MZB_LO_1477","ENG_062_MZB_LO_1477-24.10.2018","24.10.2018",2018,10,24,1.016184013,1
"ENG_062_MZB_LO_1477","ENG_062_MZB_LO_1477-19.10.2021","19.10.2021",2021,10,19,1.008845808,1
"ENG_062_MZB_LO_1477","ENG_062_MZB_LO_1477-27.10.2022","27.10.2022",2022,10,27,0.865979585,2
"ENG_062_MZB_LO_1479","ENG_062_MZB_LO_1479-02.09.2002","02.09.2002",2002,9,2,0.742863186,3
"ENG_062_MZB_LO_1479","ENG_062_MZB_LO_1479-11.10.2005","11.10.2005",2005,10,11,0.911841426,2
"ENG_062_MZB_LO_1479","ENG_062_MZB_LO_1479-06.11.2008","06.11.2008",2008,11,6,0.871782865,2
"ENG_062_MZB_LO_1479","ENG_062_MZB_LO_1479-17.09.2009","17.09.2009",2009,9,17,0.824297492,3
"ENG_062_MZB_LO_1479","ENG_062_MZB_LO_1479-30.09.2010","30.09.2010",2010,9,30,0.861644498,3
"ENG_062_MZB_LO_1479","ENG_062_MZB_LO_1479-30.09.2011","30.09.2011",2011,9,30,0.902008949,2
"ENG_062_MZB_LO_1479","ENG_062_MZB_LO_1479-14.11.2012","14.11.2012",2012,11,14,0.805931659,3
"ENG_062_MZB_LO_1479","ENG_062_MZB_LO_1479-20.11.2013","20.11.2013",2013,11,20,0.849706927,3
"ENG_062_MZB_LO_1479","ENG_062_MZB_LO_1479-05.10.2018","05.10.2018",2018,10,5,0.814051852,3
"ENG_062_MZB_LO_1479","ENG_062_MZB_LO_1479-27.11.2019","27.11.2019",2019,11,27,0.663787682,4
"ENG_062_MZB_LO_1479","ENG_062_MZB_LO_1479-11.10.2021","11.10.2021",2021,10,11,0.770343912,3
"ENG_062_MZB_LO_1479","ENG_062_MZB_LO_1479-10.10.2022","10.10.2022",2022,10,10,0.791958056,3
"ENG_062_MZB_LO_1479","ENG_062_MZB_LO_1479-12.09.2023","12.09.2023",2023,9,12,0.719254324,3
"ENG_062_MZB_LO_148","ENG_062_MZB_LO_148-16.09.2013","16.09.2013",2013,9,16,0.78136076,3
"ENG_062_MZB_LO_148","ENG_062_MZB_LO_148-07.09.2015","07.09.2015",2015,9,7,0.877147866,2
"ENG_062_MZB_LO_148","ENG_062_MZB_LO_148-08.09.2016","08.09.2016",2016,9,8,0.816783821,3
"ENG_062_MZB_LO_148","ENG_062_MZB_LO_148-17.10.2017","17.10.2017",2017,10,17,0.934365347,2
"ENG_062_MZB_LO_148","ENG_062_MZB_LO_148-10.10.2018","10.10.2018",2018,10,10,0.885790016,2
"ENG_062_MZB_LO_148","ENG_062_MZB_LO_148-30.10.2019","30.10.2019",2019,10,30,1.00158079,1
"ENG_062_MZB_LO_148","ENG_062_MZB_LO_148-11.11.2020","11.11.2020",2020,11,11,0.979492585,1
"ENG_062_MZB_LO_148","ENG_062_MZB_LO_148-07.10.2021","07.10.2021",2021,10,7,0.907094734,2
"ENG_062_MZB_LO_148","ENG_062_MZB_LO_148-09.10.2023","09.10.2023",2023,10,9,0.923635817,2
"ENG_062_MZB_LO_1481","ENG_062_MZB_LO_1481-30.09.2002","30.09.2002",2002,9,30,0.841835583,3
"ENG_062_MZB_LO_1481","ENG_062_MZB_LO_1481-12.09.2003","12.09.2003",2003,9,12,0.818743958,3
"ENG_062_MZB_LO_1481","ENG_062_MZB_LO_1481-07.09.2004","07.09.2004",2004,9,7,0.801154747,3
"ENG_062_MZB_LO_1481","ENG_062_MZB_LO_1481-30.11.2005","30.11.2005",2005,11,30,0.882505321,3
"ENG_062_MZB_LO_1481","ENG_062_MZB_LO_1481-18.09.2006","18.09.2006",2006,9,18,0.926143152,2
"ENG_062_MZB_LO_1481","ENG_062_MZB_LO_1481-01.10.2007","01.10.2007",2007,10,1,0.790182212,3
"ENG_062_MZB_LO_1481","ENG_062_MZB_LO_1481-20.11.2013","20.11.2013",2013,11,20,0.897374387,3
"ENG_062_MZB_LO_1481","ENG_062_MZB_LO_1481-09.11.2015","09.11.2015",2015,11,9,0.889083189,3
"ENG_062_MZB_LO_1481","ENG_062_MZB_LO_1481-28.09.2022","28.09.2022",2022,9,28,0.942142071,3
"ENG_062_MZB_LO_1483","ENG_062_MZB_LO_1483-14.09.2010","14.09.2010",2010,9,14,0.956643775,2
"ENG_062_MZB_LO_1483","ENG_062_MZB_LO_1483-19.10.2011","19.10.2011",2011,10,19,0.974846784,1
"ENG_062_MZB_LO_1483","ENG_062_MZB_LO_1483-19.09.2012","19.09.2012",2012,9,19,1.035188793,2
"ENG_062_MZB_LO_1483","ENG_062_MZB_LO_1483-11.09.2013","11.09.2013",2013,9,11,1.067434635,4
"ENG_062_MZB_LO_1483","ENG_062_MZB_LO_1483-03.09.2014","03.09.2014",2014,9,3,1.085740599,3
"ENG_062_MZB_LO_1483","ENG_062_MZB_LO_1483-17.09.2015","17.09.2015",2015,9,17,0.987263796,3
"ENG_062_MZB_LO_1483","ENG_062_MZB_LO_1483-09.09.2016","09.09.2016",2016,9,9,1.0446147,2
"ENG_062_MZB_LO_1483","ENG_062_MZB_LO_1483-13.10.2017","13.10.2017",2017,10,13,0.972403904,2
"ENG_062_MZB_LO_1483","ENG_062_MZB_LO_1483-18.09.2018","18.09.2018",2018,9,18,0.989181454,3
"ENG_062_MZB_LO_1483","ENG_062_MZB_LO_1483-14.10.2020","14.10.2020",2020,10,14,0.915948497,5
"ENG_062_MZB_LO_1483","ENG_062_MZB_LO_1483-16.11.2021","16.11.2021",2021,11,16,1.044853766,4
"ENG_062_MZB_LO_1483","ENG_062_MZB_LO_1483-19.10.2022","19.10.2022",2022,10,19,0.952595587,4
"ENG_062_MZB_LO_1483","ENG_062_MZB_LO_1483-17.11.2023","17.11.2023",2023,11,17,0.959653577,3
"ENG_062_MZB_LO_1484","ENG_062_MZB_LO_1484-19.09.2002","19.09.2002",2002,9,19,0.968316718,2
"ENG_062_MZB_LO_1484","ENG_062_MZB_LO_1484-05.11.2003","05.11.2003",2003,11,5,1.034532602,1
"ENG_062_MZB_LO_1484","ENG_062_MZB_LO_1484-05.11.2004","05.11.2004",2004,11,5,0.863826269,2
"ENG_062_MZB_LO_1484","ENG_062_MZB_LO_1484-31.10.2007","31.10.2007",2007,10,31,1.006047874,1
"ENG_062_MZB_LO_1484","ENG_062_MZB_LO_1484-24.10.2008","24.10.2008",2008,10,24,0.93319844,2
"ENG_062_MZB_LO_1484","ENG_062_MZB_LO_1484-15.10.2009","15.10.2009",2009,10,15,0.929697495,2
"ENG_062_MZB_LO_1484","ENG_062_MZB_LO_1484-28.09.2010","28.09.2010",2010,9,28,0.870745125,2
"ENG_062_MZB_LO_1484","ENG_062_MZB_LO_1484-06.10.2011","06.10.2011",2011,10,6,0.918739371,2
"ENG_062_MZB_LO_1484","ENG_062_MZB_LO_1484-12.09.2012","12.09.2012",2012,9,12,0.923390043,2
"ENG_062_MZB_LO_1484","ENG_062_MZB_LO_1484-07.10.2013","07.10.2013",2013,10,7,0.823082646,3
"ENG_062_MZB_LO_1484","ENG_062_MZB_LO_1484-08.10.2014","08.10.2014",2014,10,8,0.825500564,3
"ENG_062_MZB_LO_1484","ENG_062_MZB_LO_1484-18.11.2015","18.11.2015",2015,11,18,0.95991331,2
"ENG_062_MZB_LO_1484","ENG_062_MZB_LO_1484-07.11.2016","07.11.2016",2016,11,7,0.862918551,2
"ENG_062_MZB_LO_1484","ENG_062_MZB_LO_1484-30.10.2017","30.10.2017",2017,10,30,0.945688156,2
"ENG_062_MZB_LO_1484","ENG_062_MZB_LO_1484-10.10.2018","10.10.2018",2018,10,10,0.815997821,3
"ENG_062_MZB_LO_1484","ENG_062_MZB_LO_1484-12.09.2019","12.09.2019",2019,9,12,0.926337838,2
"ENG_062_MZB_LO_1484","ENG_062_MZB_LO_1484-01.10.2020","01.10.2020",2020,10,1,0.898595924,2
"ENG_062_MZB_LO_1484","ENG_062_MZB_LO_1484-05.11.2021","05.11.2021",2021,11,5,0.898919526,2
"ENG_062_MZB_LO_1484","ENG_062_MZB_LO_1484-10.10.2022","10.10.2022",2022,10,10,0.971184954,2
"ENG_062_MZB_LO_1484","ENG_062_MZB_LO_1484-29.09.2023","29.09.2023",2023,9,29,0.913759212,2
"ENG_062_MZB_LO_1484","ENG_062_MZB_LO_1484-06.10.2024","06.10.2024",2024,10,6,0.897094439,2
"ENG_062_MZB_LO_1485","ENG_062_MZB_LO_1485-26.09.2003","26.09.2003",2003,9,26,0.91437906,2
"ENG_062_MZB_LO_1485","ENG_062_MZB_LO_1485-03.11.2004","03.11.2004",2004,11,3,0.894608992,2
"ENG_062_MZB_LO_1485","ENG_062_MZB_LO_1485-13.09.2006","13.09.2006",2006,9,13,0.865489078,2
"ENG_062_MZB_LO_1485","ENG_062_MZB_LO_1485-28.09.2007","28.09.2007",2007,9,28,0.8587621,3
"ENG_062_MZB_LO_1485","ENG_062_MZB_LO_1485-06.11.2008","06.11.2008",2008,11,6,0.811718796,3
"ENG_062_MZB_LO_1485","ENG_062_MZB_LO_1485-14.09.2009","14.09.2009",2009,9,14,0.798563168,3
"ENG_062_MZB_LO_1485","ENG_062_MZB_LO_1485-01.09.2010","01.09.2010",2010,9,1,0.834584965,3
"ENG_062_MZB_LO_1485","ENG_062_MZB_LO_1485-03.09.2013","03.09.2013",2013,9,3,0.917996995,2
"ENG_062_MZB_LO_1485","ENG_062_MZB_LO_1485-14.09.2015","14.09.2015",2015,9,14,0.780898922,3
"ENG_062_MZB_LO_1485","ENG_062_MZB_LO_1485-01.09.2016","01.09.2016",2016,9,1,0.817197796,3
"ENG_062_MZB_LO_1485","ENG_062_MZB_LO_1485-02.11.2017","02.11.2017",2017,11,2,0.921900925,2
"ENG_062_MZB_LO_1485","ENG_062_MZB_LO_1485-01.10.2018","01.10.2018",2018,10,1,0.937496494,2
"ENG_062_MZB_LO_1485","ENG_062_MZB_LO_1485-16.09.2020","16.09.2020",2020,9,16,0.9059333,2
"ENG_062_MZB_LO_1486","ENG_062_MZB_LO_1486-22.09.2004","22.09.2004",2004,9,22,1.002988184,1
"ENG_062_MZB_LO_1486","ENG_062_MZB_LO_1486-22.10.2007","22.10.2007",2007,10,22,1.011936678,1
"ENG_062_MZB_LO_1486","ENG_062_MZB_LO_1486-18.09.2008","18.09.2008",2008,9,18,0.8863413,2
"ENG_062_MZB_LO_1486","ENG_062_MZB_LO_1486-02.09.2009","02.09.2009",2009,9,2,1.099960362,1
"ENG_062_MZB_LO_1486","ENG_062_MZB_LO_1486-01.09.2010","01.09.2010",2010,9,1,0.973101167,3
"ENG_062_MZB_LO_1486","ENG_062_MZB_LO_1486-13.10.2011","13.10.2011",2011,10,13,1.121882796,1
"ENG_062_MZB_LO_1486","ENG_062_MZB_LO_1486-04.10.2012","04.10.2012",2012,10,4,0.952005792,2
"ENG_062_MZB_LO_1486","ENG_062_MZB_LO_1486-03.09.2013","03.09.2013",2013,9,3,0.91680695,2
"ENG_062_MZB_LO_1486","ENG_062_MZB_LO_1486-23.09.2014","23.09.2014",2014,9,23,1.034484142,1
"ENG_062_MZB_LO_1486","ENG_062_MZB_LO_1486-15.09.2015","15.09.2015",2015,9,15,0.975300394,1
"ENG_062_MZB_LO_1486","ENG_062_MZB_LO_1486-01.09.2016","01.09.2016",2016,9,1,0.973855064,2
"ENG_062_MZB_LO_1486","ENG_062_MZB_LO_1486-09.10.2017","09.10.2017",2017,10,9,0.946024873,2
"ENG_062_MZB_LO_1486","ENG_062_MZB_LO_1486-26.09.2018","26.09.2018",2018,9,26,0.981286388,1
"ENG_062_MZB_LO_1486","ENG_062_MZB_LO_1486-04.09.2019","04.09.2019",2019,9,4,1.043876953,1
"ENG_062_MZB_LO_1488","ENG_062_MZB_LO_1488-10.10.2002","10.10.2002",2002,10,10,0.801831291,3
"ENG_062_MZB_LO_1488","ENG_062_MZB_LO_1488-17.10.2003","17.10.2003",2003,10,17,0.766707198,3
"ENG_062_MZB_LO_1488","ENG_062_MZB_LO_1488-08.11.2006","08.11.2006",2006,11,8,0.853803992,3
"ENG_062_MZB_LO_1488","ENG_062_MZB_LO_1488-08.10.2009","08.10.2009",2009,10,8,0.933632117,2
"ENG_062_MZB_LO_1488","ENG_062_MZB_LO_1488-07.11.2013","07.11.2013",2013,11,7,0.925331468,2
"ENG_062_MZB_LO_1488","ENG_062_MZB_LO_1488-12.11.2015","12.11.2015",2015,11,12,0.994042329,1
"ENG_062_MZB_LO_1488","ENG_062_MZB_LO_1488-14.11.2022","14.11.2022",2022,11,14,0.980066864,1
"ENG_062_MZB_LO_1488","ENG_062_MZB_LO_1488-15.09.2023","15.09.2023",2023,9,15,1.007512607,1
"ENG_062_MZB_LO_1489","ENG_062_MZB_LO_1489-12.09.2003","12.09.2003",2003,9,12,0.952377421,2
"ENG_062_MZB_LO_1489","ENG_062_MZB_LO_1489-01.11.2006","01.11.2006",2006,11,1,1.002017271,1
"ENG_062_MZB_LO_1489","ENG_062_MZB_LO_1489-02.11.2010","02.11.2010",2010,11,2,1.025838759,1
"ENG_062_MZB_LO_1489","ENG_062_MZB_LO_1489-21.09.2011","21.09.2011",2011,9,21,0.975420268,1
"ENG_062_MZB_LO_1489","ENG_062_MZB_LO_1489-08.11.2012","08.11.2012",2012,11,8,0.912029483,2
"ENG_062_MZB_LO_1489","ENG_062_MZB_LO_1489-06.09.2013","06.09.2013",2013,9,6,0.926014906,2
"ENG_062_MZB_LO_1489","ENG_062_MZB_LO_1489-15.09.2014","15.09.2014",2014,9,15,0.994160272,1
"ENG_062_MZB_LO_1489","ENG_062_MZB_LO_1489-04.09.2015","04.09.2015",2015,9,4,0.853963618,3
"ENG_062_MZB_LO_1489","ENG_062_MZB_LO_1489-01.09.2016","01.09.2016",2016,9,1,0.921921932,2
"ENG_062_MZB_LO_1489","ENG_062_MZB_LO_1489-03.10.2017","03.10.2017",2017,10,3,0.905053332,2
"ENG_062_MZB_LO_1489","ENG_062_MZB_LO_1489-11.09.2018","11.09.2018",2018,9,11,0.962330498,2
"ENG_062_MZB_LO_1489","ENG_062_MZB_LO_1489-02.09.2020","02.09.2020",2020,9,2,0.891773514,2
"ENG_062_MZB_LO_149","ENG_062_MZB_LO_149-01.10.2002","01.10.2002",2002,10,1,1.030688359,1
"ENG_062_MZB_LO_149","ENG_062_MZB_LO_149-26.09.2005","26.09.2005",2005,9,26,1.052116386,1
"ENG_062_MZB_LO_149","ENG_062_MZB_LO_149-04.09.2013","04.09.2013",2013,9,4,0.996769578,2
"ENG_062_MZB_LO_149","ENG_062_MZB_LO_149-24.09.2017","24.09.2017",2017,9,24,1.026445399,1
"ENG_062_MZB_LO_149","ENG_062_MZB_LO_149-22.10.2018","22.10.2018",2018,10,22,1.063677763,1
"ENG_062_MZB_LO_149","ENG_062_MZB_LO_149-25.11.2019","25.11.2019",2019,11,25,1.151009351,1
"ENG_062_MZB_LO_149","ENG_062_MZB_LO_149-27.10.2021","27.10.2021",2021,10,27,1.06212606,1
"ENG_062_MZB_LO_149","ENG_062_MZB_LO_149-16.09.2022","16.09.2022",2022,9,16,1.099622985,4
"ENG_062_MZB_LO_1493","ENG_062_MZB_LO_1493-19.09.2003","19.09.2003",2003,9,19,0.92351236,2
"ENG_062_MZB_LO_1493","ENG_062_MZB_LO_1493-20.09.2006","20.09.2006",2006,9,20,0.949361598,2
"ENG_062_MZB_LO_1493","ENG_062_MZB_LO_1493-18.11.2009","18.11.2009",2009,11,18,0.814597821,3
"ENG_062_MZB_LO_1493","ENG_062_MZB_LO_1493-02.11.2010","02.11.2010",2010,11,2,0.91503226,2
"ENG_062_MZB_LO_1493","ENG_062_MZB_LO_1493-23.09.2011","23.09.2011",2011,9,23,0.889487659,2
"ENG_062_MZB_LO_1493","ENG_062_MZB_LO_1493-14.11.2012","14.11.2012",2012,11,14,0.969806284,2
"ENG_062_MZB_LO_1493","ENG_062_MZB_LO_1493-27.11.2013","27.11.2013",2013,11,27,0.770593352,3
"ENG_062_MZB_LO_1493","ENG_062_MZB_LO_1493-25.09.2014","25.09.2014",2014,9,25,0.901279187,2
"ENG_062_MZB_LO_1493","ENG_062_MZB_LO_1493-23.09.2015","23.09.2015",2015,9,23,0.922772873,2
"ENG_062_MZB_LO_1493","ENG_062_MZB_LO_1493-14.09.2016","14.09.2016",2016,9,14,0.981047265,2
"ENG_062_MZB_LO_1493","ENG_062_MZB_LO_1493-01.09.2017","01.09.2017",2017,9,1,0.95001012,2
"ENG_062_MZB_LO_1493","ENG_062_MZB_LO_1493-08.10.2018","08.10.2018",2018,10,8,0.909538731,3
"ENG_062_MZB_LO_1493","ENG_062_MZB_LO_1493-31.10.2019","31.10.2019",2019,10,31,0.941944856,2
"ENG_062_MZB_LO_1493","ENG_062_MZB_LO_1493-16.09.2020","16.09.2020",2020,9,16,0.980012416,2
"ENG_062_MZB_LO_1493","ENG_062_MZB_LO_1493-18.10.2021","18.10.2021",2021,10,18,0.908885921,3
"ENG_062_MZB_LO_1493","ENG_062_MZB_LO_1493-13.09.2022","13.09.2022",2022,9,13,0.933143606,2
"ENG_062_MZB_LO_1493","ENG_062_MZB_LO_1493-09.10.2023","09.10.2023",2023,10,9,0.838125372,3
"ENG_062_MZB_LO_1494","ENG_062_MZB_LO_1494-26.09.2003","26.09.2003",2003,9,26,0.980232169,1
"ENG_062_MZB_LO_1494","ENG_062_MZB_LO_1494-13.10.2004","13.10.2004",2004,10,13,1.056425001,1
"ENG_062_MZB_LO_1494","ENG_062_MZB_LO_1494-14.10.2005","14.10.2005",2005,10,14,1.04258188,1
"ENG_062_MZB_LO_1494","ENG_062_MZB_LO_1494-13.10.2006","13.10.2006",2006,10,13,0.998673169,1
"ENG_062_MZB_LO_1494","ENG_062_MZB_LO_1494-26.09.2007","26.09.2007",2007,9,26,0.964823859,2
"ENG_062_MZB_LO_1494","ENG_062_MZB_LO_1494-14.10.2008","14.10.2008",2008,10,14,0.914153909,2
"ENG_062_MZB_LO_1494","ENG_062_MZB_LO_1494-03.11.2009","03.11.2009",2009,11,3,1.024437894,1
"ENG_062_MZB_LO_1494","ENG_062_MZB_LO_1494-25.10.2010","25.10.2010",2010,10,25,1.031865196,1
"ENG_062_MZB_LO_1494","ENG_062_MZB_LO_1494-09.09.2011","09.09.2011",2011,9,9,0.944055025,3
"ENG_062_MZB_LO_1494","ENG_062_MZB_LO_1494-13.11.2012","13.11.2012",2012,11,13,0.99113375,2
"ENG_062_MZB_LO_1494","ENG_062_MZB_LO_1494-20.11.2013","20.11.2013",2013,11,20,1.037822119,1
"ENG_062_MZB_LO_1494","ENG_062_MZB_LO_1494-10.09.2014","10.09.2014",2014,9,10,0.907494614,2
"ENG_062_MZB_LO_1494","ENG_062_MZB_LO_1494-03.11.2015","03.11.2015",2015,11,3,0.972842319,1
"ENG_062_MZB_LO_1494","ENG_062_MZB_LO_1494-25.10.2016","25.10.2016",2016,10,25,1.034913775,1
"ENG_062_MZB_LO_1494","ENG_062_MZB_LO_1494-26.10.2017","26.10.2017",2017,10,26,0.750522255,3
"ENG_062_MZB_LO_1494","ENG_062_MZB_LO_1494-25.10.2018","25.10.2018",2018,10,25,1.09244658,1
"ENG_062_MZB_LO_1494","ENG_062_MZB_LO_1494-31.10.2019","31.10.2019",2019,10,31,1.015399269,1
"ENG_062_MZB_LO_1494","ENG_062_MZB_LO_1494-13.10.2020","13.10.2020",2020,10,13,0.964416102,2
"ENG_062_MZB_LO_1494","ENG_062_MZB_LO_1494-15.10.2021","15.10.2021",2021,10,15,1.049007735,1
"ENG_062_MZB_LO_1495","ENG_062_MZB_LO_1495-09.10.2002","09.10.2002",2002,10,9,0.855862441,3
"ENG_062_MZB_LO_1495","ENG_062_MZB_LO_1495-29.09.2003","29.09.2003",2003,9,29,0.913343782,2
"ENG_062_MZB_LO_1495","ENG_062_MZB_LO_1495-10.10.2005","10.10.2005",2005,10,10,0.815608149,3
"ENG_062_MZB_LO_1495","ENG_062_MZB_LO_1495-31.10.2006","31.10.2006",2006,10,31,0.812842687,3
"ENG_062_MZB_LO_1495","ENG_062_MZB_LO_1495-19.09.2008","19.09.2008",2008,9,19,0.872990428,2
"ENG_062_MZB_LO_1495","ENG_062_MZB_LO_1495-27.10.2009","27.10.2009",2009,10,27,0.840025274,3
"ENG_062_MZB_LO_1495","ENG_062_MZB_LO_1495-21.10.2010","21.10.2010",2010,10,21,0.847680281,3
"ENG_062_MZB_LO_1495","ENG_062_MZB_LO_1495-11.10.2011","11.10.2011",2011,10,11,0.801317338,3
"ENG_062_MZB_LO_1495","ENG_062_MZB_LO_1495-13.09.2012","13.09.2012",2012,9,13,0.761587039,3
"ENG_062_MZB_LO_1495","ENG_062_MZB_LO_1495-07.10.2013","07.10.2013",2013,10,7,0.822476985,3
"ENG_062_MZB_LO_1495","ENG_062_MZB_LO_1495-31.10.2014","31.10.2014",2014,10,31,0.85730811,3
"ENG_062_MZB_LO_1495","ENG_062_MZB_LO_1495-26.10.2015","26.10.2015",2015,10,26,0.904099098,3
"ENG_062_MZB_LO_1495","ENG_062_MZB_LO_1495-03.11.2016","03.11.2016",2016,11,3,0.848665137,3
"ENG_062_MZB_LO_1497","ENG_062_MZB_LO_1497-12.11.2003","12.11.2003",2003,11,12,0.850573568,3
"ENG_062_MZB_LO_1497","ENG_062_MZB_LO_1497-14.11.2006","14.11.2006",2006,11,14,0.848606878,3
"ENG_062_MZB_LO_1497","ENG_062_MZB_LO_1497-18.09.2008","18.09.2008",2008,9,18,0.851590616,3
"ENG_062_MZB_LO_1497","ENG_062_MZB_LO_1497-21.10.2009","21.10.2009",2009,10,21,1.00200779,1
"ENG_062_MZB_LO_1497","ENG_062_MZB_LO_1497-22.10.2010","22.10.2010",2010,10,22,0.888720146,2
"ENG_062_MZB_LO_1497","ENG_062_MZB_LO_1497-17.10.2011","17.10.2011",2011,10,17,0.877257098,2
"ENG_062_MZB_LO_1497","ENG_062_MZB_LO_1497-09.11.2012","09.11.2012",2012,11,9,1.019840235,1
"ENG_062_MZB_LO_1497","ENG_062_MZB_LO_1497-18.11.2013","18.11.2013",2013,11,18,0.907117765,2
"ENG_062_MZB_LO_1497","ENG_062_MZB_LO_1497-26.11.2014","26.11.2014",2014,11,26,0.899314756,5
"ENG_062_MZB_LO_1497","ENG_062_MZB_LO_1497-19.10.2015","19.10.2015",2015,10,19,1.018102293,1
"ENG_062_MZB_LO_1497","ENG_062_MZB_LO_1497-21.09.2016","21.09.2016",2016,9,21,0.969435246,2
"ENG_062_MZB_LO_1497","ENG_062_MZB_LO_1497-17.10.2017","17.10.2017",2017,10,17,0.929763004,2
"ENG_062_MZB_LO_1497","ENG_062_MZB_LO_1497-18.09.2018","18.09.2018",2018,9,18,0.926033455,2
"ENG_062_MZB_LO_1497","ENG_062_MZB_LO_1497-14.10.2020","14.10.2020",2020,10,14,0.93823583,2
"ENG_062_MZB_LO_1497","ENG_062_MZB_LO_1497-16.11.2021","16.11.2021",2021,11,16,0.902581525,2
"ENG_062_MZB_LO_1497","ENG_062_MZB_LO_1497-10.10.2022","10.10.2022",2022,10,10,0.847266964,3
"ENG_062_MZB_LO_1497","ENG_062_MZB_LO_1497-17.11.2023","17.11.2023",2023,11,17,0.96988119,1
"ENG_062_MZB_LO_1497","ENG_062_MZB_LO_1497-19.09.2024","19.09.2024",2024,9,19,0.893889611,2
"ENG_062_MZB_LO_1499","ENG_062_MZB_LO_1499-28.11.2002","28.11.2002",2002,11,28,0.793647944,3
"ENG_062_MZB_LO_1499","ENG_062_MZB_LO_1499-30.09.2005","30.09.2005",2005,9,30,0.775141723,3
"ENG_062_MZB_LO_1499","ENG_062_MZB_LO_1499-22.10.2008","22.10.2008",2008,10,22,0.846641383,3
"ENG_062_MZB_LO_1499","ENG_062_MZB_LO_1499-06.09.2013","06.09.2013",2013,9,6,0.780152811,3
"ENG_062_MZB_LO_1499","ENG_062_MZB_LO_1499-24.11.2016","24.11.2016",2016,11,24,0.771133694,3
"ENG_062_MZB_LO_1499","ENG_062_MZB_LO_1499-06.11.2019","06.11.2019",2019,11,6,0.761358424,3
"ENG_062_MZB_LO_1499","ENG_062_MZB_LO_1499-16.10.2020","16.10.2020",2020,10,16,0.81599074,3
"ENG_062_MZB_LO_1499","ENG_062_MZB_LO_1499-20.10.2021","20.10.2021",2021,10,20,0.790845195,3
"ENG_062_MZB_LO_1499","ENG_062_MZB_LO_1499-10.10.2023","10.10.2023",2023,10,10,0.822092293,3
"ENG_062_MZB_LO_1500","ENG_062_MZB_LO_1500-09.10.2002","09.10.2002",2002,10,9,0.810444649,3
"ENG_062_MZB_LO_1500","ENG_062_MZB_LO_1500-29.09.2003","29.09.2003",2003,9,29,0.829786145,3
"ENG_062_MZB_LO_1500","ENG_062_MZB_LO_1500-09.11.2004","09.11.2004",2004,11,9,0.729771423,3
"ENG_062_MZB_LO_1500","ENG_062_MZB_LO_1500-10.10.2005","10.10.2005",2005,10,10,0.835462512,3
"ENG_062_MZB_LO_1500","ENG_062_MZB_LO_1500-31.10.2006","31.10.2006",2006,10,31,0.739348627,3
"ENG_062_MZB_LO_1500","ENG_062_MZB_LO_1500-27.11.2007","27.11.2007",2007,11,27,0.818209393,3
"ENG_062_MZB_LO_1500","ENG_062_MZB_LO_1500-18.09.2008","18.09.2008",2008,9,18,0.776011687,3
"ENG_062_MZB_LO_1500","ENG_062_MZB_LO_1500-08.10.2009","08.10.2009",2009,10,8,0.884077825,2
"ENG_062_MZB_LO_1500","ENG_062_MZB_LO_1500-22.10.2010","22.10.2010",2010,10,22,0.89292631,2
"ENG_062_MZB_LO_1500","ENG_062_MZB_LO_1500-19.10.2011","19.10.2011",2011,10,19,0.876485444,2
"ENG_062_MZB_LO_1500","ENG_062_MZB_LO_1500-07.09.2012","07.09.2012",2012,9,7,0.832396054,3
"ENG_062_MZB_LO_1500","ENG_062_MZB_LO_1500-10.10.2013","10.10.2013",2013,10,10,0.987309362,2
"ENG_062_MZB_LO_1500","ENG_062_MZB_LO_1500-19.10.2015","19.10.2015",2015,10,19,0.861258435,3
"ENG_062_MZB_LO_1500","ENG_062_MZB_LO_1500-24.10.2016","24.10.2016",2016,10,24,0.971858666,2
"ENG_062_MZB_LO_1500","ENG_062_MZB_LO_1500-13.10.2017","13.10.2017",2017,10,13,0.850527682,3
"ENG_062_MZB_LO_1500","ENG_062_MZB_LO_1500-05.11.2018","05.11.2018",2018,11,5,0.811998819,3
"ENG_062_MZB_LO_1500","ENG_062_MZB_LO_1500-22.10.2020","22.10.2020",2020,10,22,0.811061337,3
"ENG_062_MZB_LO_1500","ENG_062_MZB_LO_1500-16.11.2021","16.11.2021",2021,11,16,0.808149696,3
"ENG_062_MZB_LO_1500","ENG_062_MZB_LO_1500-26.09.2022","26.09.2022",2022,9,26,0.780522028,3
"ENG_062_MZB_LO_1500","ENG_062_MZB_LO_1500-09.10.2023","09.10.2023",2023,10,9,0.856500483,3
"ENG_062_MZB_LO_1500","ENG_062_MZB_LO_1500-19.09.2024","19.09.2024",2024,9,19,0.814360776,3
"ENG_062_MZB_LO_1501","ENG_062_MZB_LO_1501-24.04.2002","24.04.2002",2002,4,24,0.822230996,3
"ENG_062_MZB_LO_1501","ENG_062_MZB_LO_1501-16.04.2003","16.04.2003",2003,4,16,0.786198389,4
"ENG_062_MZB_LO_1501","ENG_062_MZB_LO_1501-12.04.2005","12.04.2005",2005,4,12,0.768597443,3
"ENG_062_MZB_LO_1501","ENG_062_MZB_LO_1501-07.05.2008","07.05.2008",2008,5,7,0.846700139,3
"ENG_062_MZB_LO_1501","ENG_062_MZB_LO_1501-22.05.2012","22.05.2012",2012,5,22,0.783742664,3
"ENG_062_MZB_LO_1501","ENG_062_MZB_LO_1501-16.05.2013","16.05.2013",2013,5,16,0.913703828,2
"ENG_062_MZB_LO_1501","ENG_062_MZB_LO_1501-20.05.2014","20.05.2014",2014,5,20,0.894194743,3
"ENG_062_MZB_LO_1503","ENG_062_MZB_LO_1503-10.10.2003","10.10.2003",2003,10,10,1.04445323,1
"ENG_062_MZB_LO_1503","ENG_062_MZB_LO_1503-28.09.2004","28.09.2004",2004,9,28,0.967450525,2
"ENG_062_MZB_LO_1503","ENG_062_MZB_LO_1503-17.10.2006","17.10.2006",2006,10,17,1.089975132,1
"ENG_062_MZB_LO_1503","ENG_062_MZB_LO_1503-25.10.2007","25.10.2007",2007,10,25,1.060949156,1
"ENG_062_MZB_LO_1503","ENG_062_MZB_LO_1503-07.11.2008","07.11.2008",2008,11,7,1.014495331,1
"ENG_062_MZB_LO_1503","ENG_062_MZB_LO_1503-27.10.2009","27.10.2009",2009,10,27,1.073434812,1
"ENG_062_MZB_LO_1503","ENG_062_MZB_LO_1503-06.09.2010","06.09.2010",2010,9,6,1.036386639,1
"ENG_062_MZB_LO_1503","ENG_062_MZB_LO_1503-22.09.2011","22.09.2011",2011,9,22,1.053800119,1
"ENG_062_MZB_LO_1503","ENG_062_MZB_LO_1503-12.11.2012","12.11.2012",2012,11,12,1.081447755,1
"ENG_062_MZB_LO_1503","ENG_062_MZB_LO_1503-09.09.2013","09.09.2013",2013,9,9,1.033247586,1
"ENG_062_MZB_LO_1503","ENG_062_MZB_LO_1503-11.11.2014","11.11.2014",2014,11,11,1.086675158,1
"ENG_062_MZB_LO_1503","ENG_062_MZB_LO_1503-08.09.2015","08.09.2015",2015,9,8,1.059711338,1
"ENG_062_MZB_LO_1503","ENG_062_MZB_LO_1503-28.09.2016","28.09.2016",2016,9,28,1.036674006,1
"ENG_062_MZB_LO_1503","ENG_062_MZB_LO_1503-11.10.2017","11.10.2017",2017,10,11,1.073500525,1
"ENG_062_MZB_LO_1503","ENG_062_MZB_LO_1503-17.10.2018","17.10.2018",2018,10,17,1.101028042,1
"ENG_062_MZB_LO_1503","ENG_062_MZB_LO_1503-10.10.2019","10.10.2019",2019,10,10,0.971386758,2
"ENG_062_MZB_LO_1503","ENG_062_MZB_LO_1503-10.09.2020","10.09.2020",2020,9,10,1.015810796,1
"ENG_062_MZB_LO_1504","ENG_062_MZB_LO_1504-02.11.2004","02.11.2004",2004,11,2,1.05111272,5
"ENG_062_MZB_LO_1504","ENG_062_MZB_LO_1504-04.10.2007","04.10.2007",2007,10,4,0.959781511,2
"ENG_062_MZB_LO_1504","ENG_062_MZB_LO_1504-16.09.2008","16.09.2008",2008,9,16,0.977796349,2
"ENG_062_MZB_LO_1504","ENG_062_MZB_LO_1504-02.11.2010","02.11.2010",2010,11,2,0.871350143,3
"ENG_062_MZB_LO_1504","ENG_062_MZB_LO_1504-08.10.2013","08.10.2013",2013,10,8,0.8502278,3
"ENG_062_MZB_LO_1504","ENG_062_MZB_LO_1504-22.09.2015","22.09.2015",2015,9,22,0.869153292,3
"ENG_062_MZB_LO_1504","ENG_062_MZB_LO_1504-03.11.2016","03.11.2016",2016,11,3,0.89295225,3
"ENG_062_MZB_LO_1504","ENG_062_MZB_LO_1504-23.10.2017","23.10.2017",2017,10,23,0.844355486,3
"ENG_062_MZB_LO_1504","ENG_062_MZB_LO_1504-30.10.2018","30.10.2018",2018,10,30,0.900022889,2
"ENG_062_MZB_LO_1504","ENG_062_MZB_LO_1504-19.09.2019","19.09.2019",2019,9,19,0.974966238,1
"ENG_062_MZB_LO_1504","ENG_062_MZB_LO_1504-30.10.2020","30.10.2020",2020,10,30,0.994735743,2
"ENG_062_MZB_LO_1504","ENG_062_MZB_LO_1504-24.09.2021","24.09.2021",2021,9,24,1.023548107,1
"ENG_062_MZB_LO_1504","ENG_062_MZB_LO_1504-15.09.2022","15.09.2022",2022,9,15,1.007083389,1
"ENG_062_MZB_LO_1504","ENG_062_MZB_LO_1504-06.10.2023","06.10.2023",2023,10,6,0.965443962,2
"ENG_062_MZB_LO_1504","ENG_062_MZB_LO_1504-22.10.2024","22.10.2024",2024,10,22,0.939220973,2
"ENG_062_MZB_LO_1507","ENG_062_MZB_LO_1507-29.11.2002","29.11.2002",2002,11,29,0.718616414,4
"ENG_062_MZB_LO_1507","ENG_062_MZB_LO_1507-07.11.2003","07.11.2003",2003,11,7,0.605805367,5
"ENG_062_MZB_LO_1507","ENG_062_MZB_LO_1507-02.11.2004","02.11.2004",2004,11,2,0.757049131,3
"ENG_062_MZB_LO_1507","ENG_062_MZB_LO_1507-18.11.2005","18.11.2005",2005,11,18,0.744966939,3
"ENG_062_MZB_LO_1507","ENG_062_MZB_LO_1507-16.09.2008","16.09.2008",2008,9,16,0.824703446,3
"ENG_062_MZB_LO_1507","ENG_062_MZB_LO_1507-18.10.2011","18.10.2011",2011,10,18,0.790528951,3
"ENG_062_MZB_LO_1507","ENG_062_MZB_LO_1507-28.11.2014","28.11.2014",2014,11,28,0.79733274,3
"ENG_062_MZB_LO_1508","ENG_062_MZB_LO_1508-19.09.2002","19.09.2002",2002,9,19,1.034897951,1
"ENG_062_MZB_LO_1508","ENG_062_MZB_LO_1508-05.11.2003","05.11.2003",2003,11,5,1.023793028,1
"ENG_062_MZB_LO_1508","ENG_062_MZB_LO_1508-05.11.2004","05.11.2004",2004,11,5,0.988344586,1
"ENG_062_MZB_LO_1508","ENG_062_MZB_LO_1508-04.10.2005","04.10.2005",2005,10,4,1.046383132,1
"ENG_062_MZB_LO_1508","ENG_062_MZB_LO_1508-24.11.2006","24.11.2006",2006,11,24,1.020708403,1
"ENG_062_MZB_LO_1508","ENG_062_MZB_LO_1508-20.09.2007","20.09.2007",2007,9,20,1.176800289,1
"ENG_062_MZB_LO_1508","ENG_062_MZB_LO_1508-25.09.2008","25.09.2008",2008,9,25,1.062521202,2
"ENG_062_MZB_LO_1508","ENG_062_MZB_LO_1508-15.10.2009","15.10.2009",2009,10,15,1.105471736,1
"ENG_062_MZB_LO_1508","ENG_062_MZB_LO_1508-23.09.2010","23.09.2010",2010,9,23,1.054275101,1
"ENG_062_MZB_LO_1508","ENG_062_MZB_LO_1508-03.10.2011","03.10.2011",2011,10,3,1.089750926,1
"ENG_062_MZB_LO_1508","ENG_062_MZB_LO_1508-19.09.2012","19.09.2012",2012,9,19,1.128093501,1
"ENG_062_MZB_LO_1508","ENG_062_MZB_LO_1508-07.10.2013","07.10.2013",2013,10,7,1.064762328,1
"ENG_062_MZB_LO_1508","ENG_062_MZB_LO_1508-08.10.2014","08.10.2014",2014,10,8,1.091394839,1
"ENG_062_MZB_LO_1508","ENG_062_MZB_LO_1508-16.10.2015","16.10.2015",2015,10,16,1.096755661,1
"ENG_062_MZB_LO_1508","ENG_062_MZB_LO_1508-27.10.2016","27.10.2016",2016,10,27,1.147192525,1
"ENG_062_MZB_LO_1508","ENG_062_MZB_LO_1508-08.11.2017","08.11.2017",2017,11,8,1.099052754,1
"ENG_062_MZB_LO_1508","ENG_062_MZB_LO_1508-16.11.2018","16.11.2018",2018,11,16,1.068346244,1
"ENG_062_MZB_LO_1508","ENG_062_MZB_LO_1508-14.10.2020","14.10.2020",2020,10,14,1.107669781,1
"ENG_062_MZB_LO_1508","ENG_062_MZB_LO_1508-10.11.2021","10.11.2021",2021,11,10,1.111714127,1
"ENG_062_MZB_LO_1508","ENG_062_MZB_LO_1508-27.09.2022","27.09.2022",2022,9,27,1.119041447,1
"ENG_062_MZB_LO_1508","ENG_062_MZB_LO_1508-09.10.2023","09.10.2023",2023,10,9,1.105643474,1
"ENG_062_MZB_LO_1508","ENG_062_MZB_LO_1508-29.10.2024","29.10.2024",2024,10,29,1.157401185,1
"ENG_062_MZB_LO_151","ENG_062_MZB_LO_151-02.05.2002","02.05.2002",2002,5,2,0.888473792,2
"ENG_062_MZB_LO_151","ENG_062_MZB_LO_151-04.04.2013","04.04.2013",2013,4,4,1.002814924,1
"ENG_062_MZB_LO_151","ENG_062_MZB_LO_151-25.04.2017","25.04.2017",2017,4,25,1.013361484,1
"ENG_062_MZB_LO_151","ENG_062_MZB_LO_151-01.05.2018","01.05.2018",2018,5,1,1.007875908,1
"ENG_062_MZB_LO_151","ENG_062_MZB_LO_151-04.04.2019","04.04.2019",2019,4,4,0.98745178,1
"ENG_062_MZB_LO_151","ENG_062_MZB_LO_151-27.04.2021","27.04.2021",2021,4,27,1.063558865,1
"ENG_062_MZB_LO_151","ENG_062_MZB_LO_151-11.04.2022","11.04.2022",2022,4,11,1.008913698,1
"ENG_062_MZB_LO_1511","ENG_062_MZB_LO_1511-10.10.2003","10.10.2003",2003,10,10,0.765583081,3
"ENG_062_MZB_LO_1511","ENG_062_MZB_LO_1511-23.09.2004","23.09.2004",2004,9,23,0.669213249,4
"ENG_062_MZB_LO_1511","ENG_062_MZB_LO_1511-02.11.2007","02.11.2007",2007,11,2,0.835954067,3
"ENG_062_MZB_LO_1511","ENG_062_MZB_LO_1511-05.10.2010","05.10.2010",2010,10,5,0.684508453,4
"ENG_062_MZB_LO_1511","ENG_062_MZB_LO_1511-04.10.2013","04.10.2013",2013,10,4,0.835350595,3
"ENG_062_MZB_LO_1511","ENG_062_MZB_LO_1511-22.10.2015","22.10.2015",2015,10,22,0.786178541,3
"ENG_062_MZB_LO_1511","ENG_062_MZB_LO_1511-30.10.2018","30.10.2018",2018,10,30,0.895988002,2
"ENG_062_MZB_LO_1515","ENG_062_MZB_LO_1515-25.09.2004","25.09.2004",2004,9,25,0.72994374,3
"ENG_062_MZB_LO_1515","ENG_062_MZB_LO_1515-26.10.2007","26.10.2007",2007,10,26,0.844464377,3
"ENG_062_MZB_LO_1515","ENG_062_MZB_LO_1515-09.11.2011","09.11.2011",2011,11,9,0.867249613,2
"ENG_062_MZB_LO_1515","ENG_062_MZB_LO_1515-13.10.2015","13.10.2015",2015,10,13,0.844710141,3
"ENG_062_MZB_LO_1515","ENG_062_MZB_LO_1515-20.11.2019","20.11.2019",2019,11,20,0.938804795,2
"ENG_062_MZB_LO_1515","ENG_062_MZB_LO_1515-22.09.2020","22.09.2020",2020,9,22,0.844606941,3
"ENG_062_MZB_LO_1515","ENG_062_MZB_LO_1515-16.09.2021","16.09.2021",2021,9,16,0.766461468,3
"ENG_062_MZB_LO_1515","ENG_062_MZB_LO_1515-08.11.2023","08.11.2023",2023,11,8,0.809802612,3
"ENG_062_MZB_LO_1515","ENG_062_MZB_LO_1515-30.10.2024","30.10.2024",2024,10,30,0.913237156,2
"ENG_062_MZB_LO_1516","ENG_062_MZB_LO_1516-13.09.2002","13.09.2002",2002,9,13,1.031141762,1
"ENG_062_MZB_LO_1516","ENG_062_MZB_LO_1516-24.09.2003","24.09.2003",2003,9,24,1.055418135,1
"ENG_062_MZB_LO_1516","ENG_062_MZB_LO_1516-03.09.2004","03.09.2004",2004,9,3,0.945258501,2
"ENG_062_MZB_LO_1516","ENG_062_MZB_LO_1516-04.10.2005","04.10.2005",2005,10,4,1.048569039,3
"ENG_062_MZB_LO_1516","ENG_062_MZB_LO_1516-20.09.2006","20.09.2006",2006,9,20,1.048303115,1
"ENG_062_MZB_LO_1516","ENG_062_MZB_LO_1516-14.10.2008","14.10.2008",2008,10,14,1.018195592,1
"ENG_062_MZB_LO_1516","ENG_062_MZB_LO_1516-20.09.2012","20.09.2012",2012,9,20,1.045952192,2
"ENG_062_MZB_LO_152","ENG_062_MZB_LO_152-18.10.2002","18.10.2002",2002,10,18,1.072713451,1
"ENG_062_MZB_LO_152","ENG_062_MZB_LO_152-15.10.2003","15.10.2003",2003,10,15,1.057939443,1
"ENG_062_MZB_LO_152","ENG_062_MZB_LO_152-01.11.2004","01.11.2004",2004,11,1,0.934061402,3
"ENG_062_MZB_LO_152","ENG_062_MZB_LO_152-26.09.2005","26.09.2005",2005,9,26,1.014774345,1
"ENG_062_MZB_LO_152","ENG_062_MZB_LO_152-03.11.2006","03.11.2006",2006,11,3,0.959532885,2
"ENG_062_MZB_LO_152","ENG_062_MZB_LO_152-24.10.2007","24.10.2007",2007,10,24,1.106271428,1
"ENG_062_MZB_LO_152","ENG_062_MZB_LO_152-29.09.2008","29.09.2008",2008,9,29,1.033136339,1
"ENG_062_MZB_LO_152","ENG_062_MZB_LO_152-14.10.2009","14.10.2009",2009,10,14,1.110844606,1
"ENG_062_MZB_LO_152","ENG_062_MZB_LO_152-13.10.2010","13.10.2010",2010,10,13,1.050066117,1
"ENG_062_MZB_LO_152","ENG_062_MZB_LO_152-17.10.2011","17.10.2011",2011,10,17,1.103507958,2
"ENG_062_MZB_LO_152","ENG_062_MZB_LO_152-26.10.2012","26.10.2012",2012,10,26,1.069822966,1
"ENG_062_MZB_LO_152","ENG_062_MZB_LO_152-25.09.2013","25.09.2013",2013,9,25,1.094240865,1
"ENG_062_MZB_LO_152","ENG_062_MZB_LO_152-09.09.2014","09.09.2014",2014,9,9,1.096947307,1
"ENG_062_MZB_LO_152","ENG_062_MZB_LO_152-08.09.2015","08.09.2015",2015,9,8,0.99038752,2
"ENG_062_MZB_LO_152","ENG_062_MZB_LO_152-08.09.2016","08.09.2016",2016,9,8,1.120175744,1
"ENG_062_MZB_LO_152","ENG_062_MZB_LO_152-24.09.2017","24.09.2017",2017,9,24,1.034939999,1
"ENG_062_MZB_LO_152","ENG_062_MZB_LO_152-25.09.2018","25.09.2018",2018,9,25,1.08919287,1
"ENG_062_MZB_LO_152","ENG_062_MZB_LO_152-22.10.2019","22.10.2019",2019,10,22,0.978336961,1
"ENG_062_MZB_LO_152","ENG_062_MZB_LO_152-11.10.2021","11.10.2021",2021,10,11,1.081782496,1
"ENG_062_MZB_LO_152","ENG_062_MZB_LO_152-18.10.2023","18.10.2023",2023,10,18,1.102932928,1
"ENG_062_MZB_LO_1523","ENG_062_MZB_LO_1523-16.10.2003","16.10.2003",2003,10,16,0.982280721,1
"ENG_062_MZB_LO_1523","ENG_062_MZB_LO_1523-08.09.2006","08.09.2006",2006,9,8,1.067734742,1
"ENG_062_MZB_LO_1523","ENG_062_MZB_LO_1523-14.10.2008","14.10.2008",2008,10,14,1.079883836,1
"ENG_062_MZB_LO_1523","ENG_062_MZB_LO_1523-27.10.2009","27.10.2009",2009,10,27,1.129668534,1
"ENG_062_MZB_LO_1523","ENG_062_MZB_LO_1523-21.10.2010","21.10.2010",2010,10,21,1.006828271,1
"ENG_062_MZB_LO_1523","ENG_062_MZB_LO_1523-02.11.2011","02.11.2011",2011,11,2,0.989608824,1
"ENG_062_MZB_LO_1523","ENG_062_MZB_LO_1523-13.09.2012","13.09.2012",2012,9,13,1.117455397,1
"ENG_062_MZB_LO_1523","ENG_062_MZB_LO_1523-16.10.2013","16.10.2013",2013,10,16,1.10068751,1
"ENG_062_MZB_LO_1523","ENG_062_MZB_LO_1523-24.09.2014","24.09.2014",2014,9,24,1.190531979,1
"ENG_062_MZB_LO_1523","ENG_062_MZB_LO_1523-26.10.2015","26.10.2015",2015,10,26,1.271740427,1
"ENG_062_MZB_LO_1523","ENG_062_MZB_LO_1523-04.10.2016","04.10.2016",2016,10,4,1.233151477,1
"ENG_062_MZB_LO_1523","ENG_062_MZB_LO_1523-10.11.2017","10.11.2017",2017,11,10,1.288245451,1
"ENG_062_MZB_LO_1523","ENG_062_MZB_LO_1523-08.11.2018","08.11.2018",2018,11,8,1.187416484,1
"ENG_062_MZB_LO_1523","ENG_062_MZB_LO_1523-30.10.2020","30.10.2020",2020,10,30,1.124258446,3
"ENG_062_MZB_LO_1523","ENG_062_MZB_LO_1523-17.11.2021","17.11.2021",2021,11,17,1.243493101,1
"ENG_062_MZB_LO_1523","ENG_062_MZB_LO_1523-05.09.2022","05.09.2022",2022,9,5,1.234418184,1
"ENG_062_MZB_LO_1523","ENG_062_MZB_LO_1523-06.10.2023","06.10.2023",2023,10,6,1.139438602,1
"ENG_062_MZB_LO_1523","ENG_062_MZB_LO_1523-06.11.2024","06.11.2024",2024,11,6,1.223835802,1
"ENG_062_MZB_LO_1525","ENG_062_MZB_LO_1525-08.10.2002","08.10.2002",2002,10,8,1.034378909,1
"ENG_062_MZB_LO_1525","ENG_062_MZB_LO_1525-06.10.2005","06.10.2005",2005,10,6,0.948409987,2
"ENG_062_MZB_LO_1525","ENG_062_MZB_LO_1525-18.09.2006","18.09.2006",2006,9,18,0.961683104,2
"ENG_062_MZB_LO_1525","ENG_062_MZB_LO_1525-14.10.2009","14.10.2009",2009,10,14,0.991855545,1
"ENG_062_MZB_LO_1525","ENG_062_MZB_LO_1525-14.09.2010","14.09.2010",2010,9,14,0.975342031,2
"ENG_062_MZB_LO_1525","ENG_062_MZB_LO_1525-17.09.2013","17.09.2013",2013,9,17,1.013381851,1
"ENG_062_MZB_LO_1525","ENG_062_MZB_LO_1525-18.09.2014","18.09.2014",2014,9,18,1.017115691,1
"ENG_062_MZB_LO_1525","ENG_062_MZB_LO_1525-18.10.2017","18.10.2017",2017,10,18,1.046994764,1
"ENG_062_MZB_LO_1526","ENG_062_MZB_LO_1526-19.11.2002","19.11.2002",2002,11,19,0.612154348,5
"ENG_062_MZB_LO_1526","ENG_062_MZB_LO_1526-21.09.2005","21.09.2005",2005,9,21,0.657526524,4
"ENG_062_MZB_LO_1526","ENG_062_MZB_LO_1526-27.09.2006","27.09.2006",2006,9,27,0.66471838,4
"ENG_062_MZB_LO_1526","ENG_062_MZB_LO_1526-27.09.2007","27.09.2007",2007,9,27,0.724615714,3
"ENG_062_MZB_LO_1526","ENG_062_MZB_LO_1526-06.11.2008","06.11.2008",2008,11,6,0.743654986,3
"ENG_062_MZB_LO_1526","ENG_062_MZB_LO_1526-07.09.2012","07.09.2012",2012,9,7,0.70413634,4
"ENG_062_MZB_LO_1526","ENG_062_MZB_LO_1526-08.09.2015","08.09.2015",2015,9,8,0.935093473,2
"ENG_062_MZB_LO_1527","ENG_062_MZB_LO_1527-08.10.2002","08.10.2002",2002,10,8,0.621487638,5
"ENG_062_MZB_LO_1527","ENG_062_MZB_LO_1527-10.10.2003","10.10.2003",2003,10,10,0.699562182,4
"ENG_062_MZB_LO_1527","ENG_062_MZB_LO_1527-27.09.2005","27.09.2005",2005,9,27,0.693628771,4
"ENG_062_MZB_LO_1527","ENG_062_MZB_LO_1527-21.09.2006","21.09.2006",2006,9,21,0.539146386,5
"ENG_062_MZB_LO_1527","ENG_062_MZB_LO_1527-23.11.2007","23.11.2007",2007,11,23,0.627125095,4
"ENG_062_MZB_LO_1527","ENG_062_MZB_LO_1527-17.11.2008","17.11.2008",2008,11,17,0.605529694,5
"ENG_062_MZB_LO_1527","ENG_062_MZB_LO_1527-21.10.2009","21.10.2009",2009,10,21,0.669971122,4
"ENG_062_MZB_LO_1527","ENG_062_MZB_LO_1527-21.09.2010","21.09.2010",2010,9,21,0.776916379,4
"ENG_062_MZB_LO_1527","ENG_062_MZB_LO_1527-08.09.2011","08.09.2011",2011,9,8,0.721019632,4
"ENG_062_MZB_LO_1527","ENG_062_MZB_LO_1527-30.10.2012","30.10.2012",2012,10,30,0.733116013,4
"ENG_062_MZB_LO_1527","ENG_062_MZB_LO_1527-09.09.2015","09.09.2015",2015,9,9,0.63520395,4
"ENG_062_MZB_LO_1527","ENG_062_MZB_LO_1527-08.10.2018","08.10.2018",2018,10,8,0.762045749,3
"ENG_062_MZB_LO_1528","ENG_062_MZB_LO_1528-13.09.2002","13.09.2002",2002,9,13,0.912096715,2
"ENG_062_MZB_LO_1528","ENG_062_MZB_LO_1528-19.09.2003","19.09.2003",2003,9,19,0.962018396,2
"ENG_062_MZB_LO_1528","ENG_062_MZB_LO_1528-03.09.2004","03.09.2004",2004,9,3,0.89642484,3
"ENG_062_MZB_LO_1528","ENG_062_MZB_LO_1528-04.10.2005","04.10.2005",2005,10,4,0.912276043,2
"ENG_062_MZB_LO_1528","ENG_062_MZB_LO_1528-20.09.2006","20.09.2006",2006,9,20,0.984127402,1
"ENG_062_MZB_LO_1528","ENG_062_MZB_LO_1528-26.09.2007","26.09.2007",2007,9,26,0.993884696,1
"ENG_062_MZB_LO_1528","ENG_062_MZB_LO_1528-14.10.2008","14.10.2008",2008,10,14,0.918323544,2
"ENG_062_MZB_LO_1528","ENG_062_MZB_LO_1528-02.11.2010","02.11.2010",2010,11,2,0.878263835,3
"ENG_062_MZB_LO_1528","ENG_062_MZB_LO_1528-23.09.2011","23.09.2011",2011,9,23,0.749858079,4
"ENG_062_MZB_LO_1528","ENG_062_MZB_LO_1528-31.10.2012","31.10.2012",2012,10,31,0.961732672,3
"ENG_062_MZB_LO_1528","ENG_062_MZB_LO_1528-17.09.2015","17.09.2015",2015,9,17,0.917099502,2
"ENG_062_MZB_LO_1529","ENG_062_MZB_LO_1529-03.11.2004","03.11.2004",2004,11,3,0.977974027,2
"ENG_062_MZB_LO_1529","ENG_062_MZB_LO_1529-04.10.2007","04.10.2007",2007,10,4,0.948353471,2
"ENG_062_MZB_LO_1529","ENG_062_MZB_LO_1529-23.10.2013","23.10.2013",2013,10,23,0.950235015,2
"ENG_062_MZB_LO_1529","ENG_062_MZB_LO_1529-10.09.2014","10.09.2014",2014,9,10,0.980715188,1
"ENG_062_MZB_LO_1529","ENG_062_MZB_LO_1529-30.10.2020","30.10.2020",2020,10,30,1.021597116,1
"ENG_062_MZB_LO_1529","ENG_062_MZB_LO_1529-22.11.2021","22.11.2021",2021,11,22,1.001952509,3
"ENG_062_MZB_LO_1529","ENG_062_MZB_LO_1529-09.09.2022","09.09.2022",2022,9,9,0.986262223,1
"ENG_062_MZB_LO_1529","ENG_062_MZB_LO_1529-30.10.2023","30.10.2023",2023,10,30,0.925466713,2
"ENG_062_MZB_LO_153","ENG_062_MZB_LO_153-17.10.2002","17.10.2002",2002,10,17,0.985084567,1
"ENG_062_MZB_LO_153","ENG_062_MZB_LO_153-17.10.2003","17.10.2003",2003,10,17,0.990766942,1
"ENG_062_MZB_LO_153","ENG_062_MZB_LO_153-03.11.2004","03.11.2004",2004,11,3,0.911676072,2
"ENG_062_MZB_LO_153","ENG_062_MZB_LO_153-27.09.2005","27.09.2005",2005,9,27,0.961723043,2
"ENG_062_MZB_LO_153","ENG_062_MZB_LO_153-06.11.2006","06.11.2006",2006,11,6,0.979511695,1
"ENG_062_MZB_LO_153","ENG_062_MZB_LO_153-22.10.2007","22.10.2007",2007,10,22,1.023080301,1
"ENG_062_MZB_LO_153","ENG_062_MZB_LO_153-30.09.2008","30.09.2008",2008,9,30,0.998841162,1
"ENG_062_MZB_LO_153","ENG_062_MZB_LO_153-14.10.2009","14.10.2009",2009,10,14,1.037294659,1
"ENG_062_MZB_LO_153","ENG_062_MZB_LO_153-13.10.2010","13.10.2010",2010,10,13,0.997541895,1
"ENG_062_MZB_LO_153","ENG_062_MZB_LO_153-25.09.2013","25.09.2013",2013,9,25,1.032938508,1
"ENG_062_MZB_LO_153","ENG_062_MZB_LO_153-22.10.2019","22.10.2019",2019,10,22,0.936690618,2
"ENG_062_MZB_LO_153","ENG_062_MZB_LO_153-12.10.2021","12.10.2021",2021,10,12,1.025630713,1
"ENG_062_MZB_LO_1532","ENG_062_MZB_LO_1532-20.09.2002","20.09.2002",2002,9,20,0.766874458,3
"ENG_062_MZB_LO_1532","ENG_062_MZB_LO_1532-08.10.2003","08.10.2003",2003,10,8,0.836867995,3
"ENG_062_MZB_LO_1532","ENG_062_MZB_LO_1532-14.09.2005","14.09.2005",2005,9,14,0.84888634,3
"ENG_062_MZB_LO_1532","ENG_062_MZB_LO_1532-13.09.2006","13.09.2006",2006,9,13,0.830729442,3
"ENG_062_MZB_LO_1532","ENG_062_MZB_LO_1532-22.10.2007","22.10.2007",2007,10,22,0.891353114,2
"ENG_062_MZB_LO_1532","ENG_062_MZB_LO_1532-06.11.2008","06.11.2008",2008,11,6,0.827837239,3
"ENG_062_MZB_LO_1532","ENG_062_MZB_LO_1532-24.09.2013","24.09.2013",2013,9,24,0.902036571,3
"ENG_062_MZB_LO_1532","ENG_062_MZB_LO_1532-23.09.2014","23.09.2014",2014,9,23,0.872034326,3
"ENG_062_MZB_LO_1533","ENG_062_MZB_LO_1533-11.09.2002","11.09.2002",2002,9,11,0.834774751,3
"ENG_062_MZB_LO_1533","ENG_062_MZB_LO_1533-19.09.2003","19.09.2003",2003,9,19,0.844684163,3
"ENG_062_MZB_LO_1533","ENG_062_MZB_LO_1533-13.10.2004","13.10.2004",2004,10,13,0.901871452,2
"ENG_062_MZB_LO_1533","ENG_062_MZB_LO_1533-14.10.2005","14.10.2005",2005,10,14,0.863936796,2
"ENG_062_MZB_LO_1533","ENG_062_MZB_LO_1533-13.10.2006","13.10.2006",2006,10,13,0.869544127,2
"ENG_062_MZB_LO_1533","ENG_062_MZB_LO_1533-27.09.2007","27.09.2007",2007,9,27,0.887569879,2
"ENG_062_MZB_LO_1533","ENG_062_MZB_LO_1533-19.09.2008","19.09.2008",2008,9,19,0.872940924,2
"ENG_062_MZB_LO_1533","ENG_062_MZB_LO_1533-08.10.2009","08.10.2009",2009,10,8,0.950395616,2
"ENG_062_MZB_LO_1533","ENG_062_MZB_LO_1533-02.09.2010","02.09.2010",2010,9,2,0.857614167,3
"ENG_062_MZB_LO_1533","ENG_062_MZB_LO_1533-09.11.2011","09.11.2011",2011,11,9,0.782054362,3
"ENG_062_MZB_LO_1533","ENG_062_MZB_LO_1533-06.09.2013","06.09.2013",2013,9,6,0.884282238,2
"ENG_062_MZB_LO_1533","ENG_062_MZB_LO_1533-24.09.2014","24.09.2014",2014,9,24,0.870424522,2
"ENG_062_MZB_LO_1533","ENG_062_MZB_LO_1533-23.09.2015","23.09.2015",2015,9,23,0.888131743,2
"ENG_062_MZB_LO_1533","ENG_062_MZB_LO_1533-20.10.2016","20.10.2016",2016,10,20,0.909936765,2
"ENG_062_MZB_LO_1533","ENG_062_MZB_LO_1533-01.09.2017","01.09.2017",2017,9,1,0.901768681,2
"ENG_062_MZB_LO_1533","ENG_062_MZB_LO_1533-05.10.2018","05.10.2018",2018,10,5,0.936413993,2
"ENG_062_MZB_LO_1533","ENG_062_MZB_LO_1533-22.11.2019","22.11.2019",2019,11,22,0.781961773,3
"ENG_062_MZB_LO_1533","ENG_062_MZB_LO_1533-02.09.2020","02.09.2020",2020,9,2,0.877547701,2
"ENG_062_MZB_LO_1533","ENG_062_MZB_LO_1533-09.09.2021","09.09.2021",2021,9,9,0.980087114,1
"ENG_062_MZB_LO_1535","ENG_062_MZB_LO_1535-04.11.2003","04.11.2003",2003,11,4,1.202827475,1
"ENG_062_MZB_LO_1535","ENG_062_MZB_LO_1535-09.10.2006","09.10.2006",2006,10,9,1.129797444,1
"ENG_062_MZB_LO_1535","ENG_062_MZB_LO_1535-14.10.2008","14.10.2008",2008,10,14,1.122611442,1
"ENG_062_MZB_LO_1535","ENG_062_MZB_LO_1535-08.09.2009","08.09.2009",2009,9,8,1.220971634,1
"ENG_062_MZB_LO_1535","ENG_062_MZB_LO_1535-03.11.2010","03.11.2010",2010,11,3,1.126852155,1
"ENG_062_MZB_LO_1535","ENG_062_MZB_LO_1535-01.11.2011","01.11.2011",2011,11,1,1.177583753,1
"ENG_062_MZB_LO_1535","ENG_062_MZB_LO_1535-08.11.2012","08.11.2012",2012,11,8,1.171610598,1
"ENG_062_MZB_LO_1535","ENG_062_MZB_LO_1535-09.10.2013","09.10.2013",2013,10,9,1.129364766,1
"ENG_062_MZB_LO_1535","ENG_062_MZB_LO_1535-27.10.2014","27.10.2014",2014,10,27,1.130503597,1
"ENG_062_MZB_LO_1535","ENG_062_MZB_LO_1535-17.09.2015","17.09.2015",2015,9,17,1.152241102,1
"ENG_062_MZB_LO_1535","ENG_062_MZB_LO_1535-06.10.2016","06.10.2016",2016,10,6,1.162466417,1
"ENG_062_MZB_LO_1535","ENG_062_MZB_LO_1535-16.10.2017","16.10.2017",2017,10,16,1.211504022,1
"ENG_062_MZB_LO_1535","ENG_062_MZB_LO_1535-01.11.2018","01.11.2018",2018,11,1,1.258884723,1
"ENG_062_MZB_LO_1535","ENG_062_MZB_LO_1535-06.11.2019","06.11.2019",2019,11,6,1.211061684,1
"ENG_062_MZB_LO_1536","ENG_062_MZB_LO_1536-30.09.2003","30.09.2003",2003,9,30,0.812657759,3
"ENG_062_MZB_LO_1536","ENG_062_MZB_LO_1536-20.09.2005","20.09.2005",2005,9,20,0.851248938,3
"ENG_062_MZB_LO_1536","ENG_062_MZB_LO_1536-01.11.2006","01.11.2006",2006,11,1,0.88452104,2
"ENG_062_MZB_LO_1536","ENG_062_MZB_LO_1536-12.09.2007","12.09.2007",2007,9,12,0.868148168,3
"ENG_062_MZB_LO_1536","ENG_062_MZB_LO_1536-16.10.2008","16.10.2008",2008,10,16,0.879496908,2
"ENG_062_MZB_LO_1536","ENG_062_MZB_LO_1536-14.10.2009","14.10.2009",2009,10,14,0.87101827,2
"ENG_062_MZB_LO_1536","ENG_062_MZB_LO_1536-25.11.2013","25.11.2013",2013,11,25,0.864097868,3
"ENG_062_MZB_LO_1536","ENG_062_MZB_LO_1536-13.11.2014","13.11.2014",2014,11,13,0.911524407,2
"ENG_062_MZB_LO_1536","ENG_062_MZB_LO_1536-22.10.2018","22.10.2018",2018,10,22,0.936181096,2
"ENG_062_MZB_LO_1537","ENG_062_MZB_LO_1537-03.05.2002","03.05.2002",2002,5,3,1.031576227,1
"ENG_062_MZB_LO_1537","ENG_062_MZB_LO_1537-03.04.2003","03.04.2003",2003,4,3,1.074767073,3
"ENG_062_MZB_LO_1537","ENG_062_MZB_LO_1537-08.04.2004","08.04.2004",2004,4,8,1.101541923,1
"ENG_062_MZB_LO_1537","ENG_062_MZB_LO_1537-20.03.2006","20.03.2006",2006,3,20,1.133069507,1
"ENG_062_MZB_LO_1537","ENG_062_MZB_LO_1537-01.04.2008","01.04.2008",2008,4,1,1.071831832,3
"ENG_062_MZB_LO_1537","ENG_062_MZB_LO_1537-25.04.2017","25.04.2017",2017,4,25,0.928250065,2
"ENG_062_MZB_LO_1537","ENG_062_MZB_LO_1537-21.05.2018","21.05.2018",2018,5,21,1.048561418,1
"ENG_062_MZB_LO_1537","ENG_062_MZB_LO_1537-08.05.2019","08.05.2019",2019,5,8,0.944106118,2
"ENG_062_MZB_LO_1538","ENG_062_MZB_LO_1538-29.11.2002","29.11.2002",2002,11,29,0.900805167,2
"ENG_062_MZB_LO_1538","ENG_062_MZB_LO_1538-15.10.2003","15.10.2003",2003,10,15,0.968113769,2
"ENG_062_MZB_LO_1538","ENG_062_MZB_LO_1538-04.10.2005","04.10.2005",2005,10,4,1.013993035,2
"ENG_062_MZB_LO_1538","ENG_062_MZB_LO_1538-09.11.2006","09.11.2006",2006,11,9,0.961462495,2
"ENG_062_MZB_LO_1538","ENG_062_MZB_LO_1538-11.10.2007","11.10.2007",2007,10,11,0.954362319,2
"ENG_062_MZB_LO_1538","ENG_062_MZB_LO_1538-29.10.2010","29.10.2010",2010,10,29,1.112657833,1
"ENG_062_MZB_LO_1538","ENG_062_MZB_LO_1538-05.10.2015","05.10.2015",2015,10,5,1.051389084,1
"ENG_062_MZB_LO_1540","ENG_062_MZB_LO_1540-09.10.2003","09.10.2003",2003,10,9,0.977173437,1
"ENG_062_MZB_LO_1540","ENG_062_MZB_LO_1540-14.11.2006","14.11.2006",2006,11,14,0.885062323,2
"ENG_062_MZB_LO_1540","ENG_062_MZB_LO_1540-22.09.2009","22.09.2009",2009,9,22,0.922542708,2
"ENG_062_MZB_LO_1540","ENG_062_MZB_LO_1540-01.09.2010","01.09.2010",2010,9,1,0.903346716,2
"ENG_062_MZB_LO_1540","ENG_062_MZB_LO_1540-06.09.2012","06.09.2012",2012,9,6,0.885924613,2
"ENG_062_MZB_LO_1540","ENG_062_MZB_LO_1540-18.11.2015","18.11.2015",2015,11,18,0.999133961,1
"ENG_062_MZB_LO_1540","ENG_062_MZB_LO_1540-24.10.2018","24.10.2018",2018,10,24,1.015182921,1
"ENG_062_MZB_LO_1541","ENG_062_MZB_LO_1541-17.09.2003","17.09.2003",2003,9,17,1.045225645,1
"ENG_062_MZB_LO_1541","ENG_062_MZB_LO_1541-05.10.2006","05.10.2006",2006,10,5,0.962029866,3
"ENG_062_MZB_LO_1541","ENG_062_MZB_LO_1541-24.09.2013","24.09.2013",2013,9,24,0.905137324,2
"ENG_062_MZB_LO_1541","ENG_062_MZB_LO_1541-07.10.2015","07.10.2015",2015,10,7,1.042228008,3
"ENG_062_MZB_LO_1541","ENG_062_MZB_LO_1541-26.09.2017","26.09.2017",2017,9,26,1.097513857,2
"ENG_062_MZB_LO_1541","ENG_062_MZB_LO_1541-31.10.2018","31.10.2018",2018,10,31,1.114046726,4
"ENG_062_MZB_LO_1541","ENG_062_MZB_LO_1541-12.11.2019","12.11.2019",2019,11,12,1.074490293,1
"ENG_062_MZB_LO_1544","ENG_062_MZB_LO_1544-12.11.2002","12.11.2002",2002,11,12,0.996448213,5
"ENG_062_MZB_LO_1544","ENG_062_MZB_LO_1544-30.09.2005","30.09.2005",2005,9,30,1.049898922,1
"ENG_062_MZB_LO_1544","ENG_062_MZB_LO_1544-09.10.2007","09.10.2007",2007,10,9,1.017579605,1
"ENG_062_MZB_LO_1544","ENG_062_MZB_LO_1544-29.10.2008","29.10.2008",2008,10,29,1.127100756,1
"ENG_062_MZB_LO_1544","ENG_062_MZB_LO_1544-12.10.2009","12.10.2009",2009,10,12,0.983566395,1
"ENG_062_MZB_LO_1544","ENG_062_MZB_LO_1544-18.10.2011","18.10.2011",2011,10,18,1.115157312,1
"ENG_062_MZB_LO_1544","ENG_062_MZB_LO_1544-19.10.2012","19.10.2012",2012,10,19,1.121735343,1
"ENG_062_MZB_LO_1544","ENG_062_MZB_LO_1544-04.09.2013","04.09.2013",2013,9,4,1.106816849,1
"ENG_062_MZB_LO_1544","ENG_062_MZB_LO_1544-10.09.2014","10.09.2014",2014,9,10,1.042975977,1
"ENG_062_MZB_LO_1544","ENG_062_MZB_LO_1544-11.11.2015","11.11.2015",2015,11,11,1.178562181,1
"ENG_062_MZB_LO_1544","ENG_062_MZB_LO_1544-03.10.2016","03.10.2016",2016,10,3,1.154016899,1
"ENG_062_MZB_LO_1544","ENG_062_MZB_LO_1544-02.10.2017","02.10.2017",2017,10,2,1.017073936,1
"ENG_062_MZB_LO_1544","ENG_062_MZB_LO_1544-23.10.2018","23.10.2018",2018,10,23,1.119517874,1
"ENG_062_MZB_LO_1544","ENG_062_MZB_LO_1544-20.11.2019","20.11.2019",2019,11,20,1.126403212,1
"ENG_062_MZB_LO_1549","ENG_062_MZB_LO_1549-08.10.2002","08.10.2002",2002,10,8,0.885666149,2
"ENG_062_MZB_LO_1549","ENG_062_MZB_LO_1549-17.09.2003","17.09.2003",2003,9,17,0.943953483,2
"ENG_062_MZB_LO_1549","ENG_062_MZB_LO_1549-18.10.2005","18.10.2005",2005,10,18,0.914000745,2
"ENG_062_MZB_LO_1549","ENG_062_MZB_LO_1549-20.10.2006","20.10.2006",2006,10,20,0.873828245,3
"ENG_062_MZB_LO_1549","ENG_062_MZB_LO_1549-30.10.2007","30.10.2007",2007,10,30,0.851799067,3
"ENG_062_MZB_LO_1549","ENG_062_MZB_LO_1549-01.10.2008","01.10.2008",2008,10,1,0.83324705,3
"ENG_062_MZB_LO_1549","ENG_062_MZB_LO_1549-06.10.2009","06.10.2009",2009,10,6,1.00178384,2
"ENG_062_MZB_LO_1549","ENG_062_MZB_LO_1549-15.09.2010","15.09.2010",2010,9,15,0.942061156,2
"ENG_062_MZB_LO_1549","ENG_062_MZB_LO_1549-12.10.2011","12.10.2011",2011,10,12,0.917597246,3
"ENG_062_MZB_LO_1549","ENG_062_MZB_LO_1549-19.09.2012","19.09.2012",2012,9,19,0.830745557,3
"ENG_062_MZB_LO_1549","ENG_062_MZB_LO_1549-11.09.2013","11.09.2013",2013,9,11,0.796408253,4
"ENG_062_MZB_LO_1549","ENG_062_MZB_LO_1549-04.09.2014","04.09.2014",2014,9,4,0.904902458,3
"ENG_062_MZB_LO_1549","ENG_062_MZB_LO_1549-12.10.2015","12.10.2015",2015,10,12,0.962788087,2
"ENG_062_MZB_LO_1549","ENG_062_MZB_LO_1549-05.10.2016","05.10.2016",2016,10,5,0.862115521,3
"ENG_062_MZB_LO_1549","ENG_062_MZB_LO_1549-30.10.2017","30.10.2017",2017,10,30,0.865845086,3
"ENG_062_MZB_LO_1549","ENG_062_MZB_LO_1549-01.10.2018","01.10.2018",2018,10,1,0.838577065,3
"ENG_062_MZB_LO_1549","ENG_062_MZB_LO_1549-05.11.2019","05.11.2019",2019,11,5,0.851638004,3
"ENG_062_MZB_LO_1549","ENG_062_MZB_LO_1549-17.09.2020","17.09.2020",2020,9,17,0.884395689,3
"ENG_062_MZB_LO_1549","ENG_062_MZB_LO_1549-08.09.2021","08.09.2021",2021,9,8,0.938226163,3
"ENG_062_MZB_LO_1552","ENG_062_MZB_LO_1552-13.11.2002","13.11.2002",2002,11,13,0.715010962,4
"ENG_062_MZB_LO_1552","ENG_062_MZB_LO_1552-18.10.2005","18.10.2005",2005,10,18,0.885917809,3
"ENG_062_MZB_LO_1552","ENG_062_MZB_LO_1552-31.10.2007","31.10.2007",2007,10,31,0.942333235,2
"ENG_062_MZB_LO_1552","ENG_062_MZB_LO_1552-04.10.2010","04.10.2010",2010,10,4,0.890119144,2
"ENG_062_MZB_LO_1552","ENG_062_MZB_LO_1552-01.11.2011","01.11.2011",2011,11,1,0.663876877,4
"ENG_062_MZB_LO_1552","ENG_062_MZB_LO_1552-11.10.2012","11.10.2012",2012,10,11,0.724396267,3
"ENG_062_MZB_LO_1552","ENG_062_MZB_LO_1552-11.10.2013","11.10.2013",2013,10,11,0.768255565,4
"ENG_062_MZB_LO_1552","ENG_062_MZB_LO_1552-29.10.2014","29.10.2014",2014,10,29,0.858824416,3
"ENG_062_MZB_LO_1552","ENG_062_MZB_LO_1552-17.09.2015","17.09.2015",2015,9,17,0.915935282,2
"ENG_062_MZB_LO_1552","ENG_062_MZB_LO_1552-04.10.2016","04.10.2016",2016,10,4,0.920488593,2
"ENG_062_MZB_LO_1552","ENG_062_MZB_LO_1552-12.10.2017","12.10.2017",2017,10,12,0.781425137,3
"ENG_062_MZB_LO_1552","ENG_062_MZB_LO_1552-16.10.2018","16.10.2018",2018,10,16,0.774785499,3
"ENG_062_MZB_LO_1552","ENG_062_MZB_LO_1552-06.11.2019","06.11.2019",2019,11,6,0.922009466,2
"ENG_062_MZB_LO_1552","ENG_062_MZB_LO_1552-30.09.2020","30.09.2020",2020,9,30,0.893014003,2
"ENG_062_MZB_LO_1554","ENG_062_MZB_LO_1554-24.04.2002","24.04.2002",2002,4,24,0.732171039,3
"ENG_062_MZB_LO_1554","ENG_062_MZB_LO_1554-01.04.2003","01.04.2003",2003,4,1,0.831652527,3
"ENG_062_MZB_LO_1554","ENG_062_MZB_LO_1554-22.05.2006","22.05.2006",2006,5,22,0.732364944,3
"ENG_062_MZB_LO_1554","ENG_062_MZB_LO_1554-22.05.2009","22.05.2009",2009,5,22,0.804624459,3
"ENG_062_MZB_LO_1554","ENG_062_MZB_LO_1554-12.04.2011","12.04.2011",2011,4,12,0.739805166,3
"ENG_062_MZB_LO_1554","ENG_062_MZB_LO_1554-18.05.2012","18.05.2012",2012,5,18,0.746096842,3
"ENG_062_MZB_LO_1554","ENG_062_MZB_LO_1554-21.05.2015","21.05.2015",2015,5,21,0.818289431,3
"ENG_062_MZB_LO_1556","ENG_062_MZB_LO_1556-15.09.2003","15.09.2003",2003,9,15,0.960021277,2
"ENG_062_MZB_LO_1556","ENG_062_MZB_LO_1556-24.11.2004","24.11.2004",2004,11,24,0.936471632,5
"ENG_062_MZB_LO_1556","ENG_062_MZB_LO_1556-04.10.2005","04.10.2005",2005,10,4,0.973937036,2
"ENG_062_MZB_LO_1556","ENG_062_MZB_LO_1556-24.11.2006","24.11.2006",2006,11,24,0.982481536,2
"ENG_062_MZB_LO_1556","ENG_062_MZB_LO_1556-31.10.2007","31.10.2007",2007,10,31,0.997828467,1
"ENG_062_MZB_LO_1556","ENG_062_MZB_LO_1556-24.10.2008","24.10.2008",2008,10,24,1.012573904,2
"ENG_062_MZB_LO_1556","ENG_062_MZB_LO_1556-15.10.2009","15.10.2009",2009,10,15,1.002197058,1
"ENG_062_MZB_LO_1556","ENG_062_MZB_LO_1556-22.09.2010","22.09.2010",2010,9,22,0.933166421,2
"ENG_062_MZB_LO_1556","ENG_062_MZB_LO_1556-04.10.2011","04.10.2011",2011,10,4,1.071568978,1
"ENG_062_MZB_LO_1556","ENG_062_MZB_LO_1556-12.09.2012","12.09.2012",2012,9,12,1.045237567,1
"ENG_062_MZB_LO_1556","ENG_062_MZB_LO_1556-21.10.2013","21.10.2013",2013,10,21,1.072195199,1
"ENG_062_MZB_LO_1556","ENG_062_MZB_LO_1556-19.11.2014","19.11.2014",2014,11,19,0.987867315,2
"ENG_062_MZB_LO_1556","ENG_062_MZB_LO_1556-02.09.2015","02.09.2015",2015,9,2,1.069348952,1
"ENG_062_MZB_LO_1556","ENG_062_MZB_LO_1556-07.11.2016","07.11.2016",2016,11,7,1.017984464,1
"ENG_062_MZB_LO_1556","ENG_062_MZB_LO_1556-31.10.2017","31.10.2017",2017,10,31,0.988432467,1
"ENG_062_MZB_LO_1556","ENG_062_MZB_LO_1556-12.09.2018","12.09.2018",2018,9,12,0.959874501,2
"ENG_062_MZB_LO_1556","ENG_062_MZB_LO_1556-19.09.2019","19.09.2019",2019,9,19,0.883492482,3
"ENG_062_MZB_LO_1556","ENG_062_MZB_LO_1556-01.10.2020","01.10.2020",2020,10,1,1.115768646,1
"ENG_062_MZB_LO_1556","ENG_062_MZB_LO_1556-05.11.2021","05.11.2021",2021,11,5,1.054937933,1
"ENG_062_MZB_LO_1556","ENG_062_MZB_LO_1556-14.11.2022","14.11.2022",2022,11,14,1.004806391,1
"ENG_062_MZB_LO_1556","ENG_062_MZB_LO_1556-29.09.2023","29.09.2023",2023,9,29,0.944003454,2
"ENG_062_MZB_LO_1558","ENG_062_MZB_LO_1558-28.04.2004","28.04.2004",2004,4,28,0.871752678,2
"ENG_062_MZB_LO_1558","ENG_062_MZB_LO_1558-11.05.2007","11.05.2007",2007,5,11,0.901672179,2
"ENG_062_MZB_LO_1558","ENG_062_MZB_LO_1558-25.04.2008","25.04.2008",2008,4,25,0.85106908,3
"ENG_062_MZB_LO_1558","ENG_062_MZB_LO_1558-01.05.2009","01.05.2009",2009,5,1,0.934364184,2
"ENG_062_MZB_LO_1558","ENG_062_MZB_LO_1558-10.03.2010","10.03.2010",2010,3,10,0.757216497,3
"ENG_062_MZB_LO_1558","ENG_062_MZB_LO_1558-23.05.2012","23.05.2012",2012,5,23,0.921650544,2
"ENG_062_MZB_LO_1558","ENG_062_MZB_LO_1558-10.04.2015","10.04.2015",2015,4,10,0.857160951,3
"ENG_062_MZB_LO_1559","ENG_062_MZB_LO_1559-20.05.2002","20.05.2002",2002,5,20,0.627589612,4
"ENG_062_MZB_LO_1559","ENG_062_MZB_LO_1559-31.03.2003","31.03.2003",2003,3,31,0.662333942,4
"ENG_062_MZB_LO_1559","ENG_062_MZB_LO_1559-10.03.2005","10.03.2005",2005,3,10,0.794089815,3
"ENG_062_MZB_LO_1559","ENG_062_MZB_LO_1559-30.03.2006","30.03.2006",2006,3,30,0.721729565,4
"ENG_062_MZB_LO_1559","ENG_062_MZB_LO_1559-25.04.2008","25.04.2008",2008,4,25,0.771136183,5
"ENG_062_MZB_LO_1559","ENG_062_MZB_LO_1559-14.05.2012","14.05.2012",2012,5,14,0.794541729,3
"ENG_062_MZB_LO_1559","ENG_062_MZB_LO_1559-27.05.2014","27.05.2014",2014,5,27,0.843537826,3
"ENG_062_MZB_LO_1561","ENG_062_MZB_LO_1561-01.10.2002","01.10.2002",2002,10,1,0.971059118,1
"ENG_062_MZB_LO_1561","ENG_062_MZB_LO_1561-04.10.2005","04.10.2005",2005,10,4,0.905107867,2
"ENG_062_MZB_LO_1561","ENG_062_MZB_LO_1561-24.09.2007","24.09.2007",2007,9,24,0.983188324,1
"ENG_062_MZB_LO_1561","ENG_062_MZB_LO_1561-25.09.2008","25.09.2008",2008,9,25,1.02428376,1
"ENG_062_MZB_LO_1561","ENG_062_MZB_LO_1561-30.09.2009","30.09.2009",2009,9,30,1.025754742,1
"ENG_062_MZB_LO_1561","ENG_062_MZB_LO_1561-21.09.2010","21.09.2010",2010,9,21,1.016179437,1
"ENG_062_MZB_LO_1561","ENG_062_MZB_LO_1561-21.09.2011","21.09.2011",2011,9,21,0.960139652,2
"ENG_062_MZB_LO_1561","ENG_062_MZB_LO_1561-03.10.2012","03.10.2012",2012,10,3,1.072678724,2
"ENG_062_MZB_LO_1568","ENG_062_MZB_LO_1568-19.11.2002","19.11.2002",2002,11,19,0.97113927,2
"ENG_062_MZB_LO_1568","ENG_062_MZB_LO_1568-28.10.2003","28.10.2003",2003,10,28,1.06671538,1
"ENG_062_MZB_LO_1568","ENG_062_MZB_LO_1568-03.11.2004","03.11.2004",2004,11,3,1.007665179,1
"ENG_062_MZB_LO_1568","ENG_062_MZB_LO_1568-15.09.2005","15.09.2005",2005,9,15,0.885416895,2
"ENG_062_MZB_LO_1568","ENG_062_MZB_LO_1568-21.09.2006","21.09.2006",2006,9,21,0.980760411,2
"ENG_062_MZB_LO_1568","ENG_062_MZB_LO_1568-17.11.2008","17.11.2008",2008,11,17,0.99204525,2
"ENG_062_MZB_LO_1568","ENG_062_MZB_LO_1568-22.10.2010","22.10.2010",2010,10,22,0.872381026,2
"ENG_062_MZB_LO_1568","ENG_062_MZB_LO_1568-28.10.2014","28.10.2014",2014,10,28,0.864412657,3
"ENG_062_MZB_LO_1568","ENG_062_MZB_LO_1568-07.11.2017","07.11.2017",2017,11,7,0.878474397,2
"ENG_062_MZB_LO_1570","ENG_062_MZB_LO_1570-14.10.2003","14.10.2003",2003,10,14,0.770642779,3
"ENG_062_MZB_LO_1570","ENG_062_MZB_LO_1570-31.10.2006","31.10.2006",2006,10,31,0.668338225,4
"ENG_062_MZB_LO_1570","ENG_062_MZB_LO_1570-16.11.2012","16.11.2012",2012,11,16,0.711367246,4
"ENG_062_MZB_LO_1570","ENG_062_MZB_LO_1570-25.10.2013","25.10.2013",2013,10,25,0.808298707,3
"ENG_062_MZB_LO_1570","ENG_062_MZB_LO_1570-23.09.2014","23.09.2014",2014,9,23,0.748793083,3
"ENG_062_MZB_LO_1570","ENG_062_MZB_LO_1570-02.11.2015","02.11.2015",2015,11,2,0.826940088,3
"ENG_062_MZB_LO_1570","ENG_062_MZB_LO_1570-09.09.2016","09.09.2016",2016,9,9,0.766919314,3
"ENG_062_MZB_LO_1570","ENG_062_MZB_LO_1570-13.10.2017","13.10.2017",2017,10,13,0.768554342,3
"ENG_062_MZB_LO_1570","ENG_062_MZB_LO_1570-18.09.2018","18.09.2018",2018,9,18,0.819701449,3
"ENG_062_MZB_LO_1570","ENG_062_MZB_LO_1570-22.10.2020","22.10.2020",2020,10,22,0.847993786,3
"ENG_062_MZB_LO_1570","ENG_062_MZB_LO_1570-16.11.2021","16.11.2021",2021,11,16,0.765926282,3
"ENG_062_MZB_LO_1570","ENG_062_MZB_LO_1570-14.11.2023","14.11.2023",2023,11,14,0.84621087,3
"ENG_062_MZB_LO_1570","ENG_062_MZB_LO_1570-15.11.2024","15.11.2024",2024,11,15,0.800841592,3
"ENG_062_MZB_LO_1575","ENG_062_MZB_LO_1575-01.10.2002","01.10.2002",2002,10,1,0.972635944,1
"ENG_062_MZB_LO_1575","ENG_062_MZB_LO_1575-04.10.2005","04.10.2005",2005,10,4,0.953007058,2
"ENG_062_MZB_LO_1575","ENG_062_MZB_LO_1575-24.09.2007","24.09.2007",2007,9,24,0.99680452,1
"ENG_062_MZB_LO_1575","ENG_062_MZB_LO_1575-25.09.2008","25.09.2008",2008,9,25,0.971880943,2
"ENG_062_MZB_LO_1575","ENG_062_MZB_LO_1575-21.09.2010","21.09.2010",2010,9,21,0.888562103,2
"ENG_062_MZB_LO_1575","ENG_062_MZB_LO_1575-21.09.2011","21.09.2011",2011,9,21,0.899484042,2
"ENG_062_MZB_LO_1575","ENG_062_MZB_LO_1575-11.10.2012","11.10.2012",2012,10,11,0.986575546,1
"ENG_062_MZB_LO_1575","ENG_062_MZB_LO_1575-23.10.2013","23.10.2013",2013,10,23,1.003908414,5
"ENG_062_MZB_LO_1575","ENG_062_MZB_LO_1575-13.10.2015","13.10.2015",2015,10,13,0.917081789,2
"ENG_062_MZB_LO_1575","ENG_062_MZB_LO_1575-06.11.2018","06.11.2018",2018,11,6,0.931829339,2
"ENG_062_MZB_LO_1577","ENG_062_MZB_LO_1577-17.10.2002","17.10.2002",2002,10,17,0.603826503,4
"ENG_062_MZB_LO_1577","ENG_062_MZB_LO_1577-14.10.2003","14.10.2003",2003,10,14,0.592466447,5
"ENG_062_MZB_LO_1577","ENG_062_MZB_LO_1577-13.09.2006","13.09.2006",2006,9,13,0.65966396,4
"ENG_062_MZB_LO_1577","ENG_062_MZB_LO_1577-13.10.2009","13.10.2009",2009,10,13,0.656679602,4
"ENG_062_MZB_LO_1577","ENG_062_MZB_LO_1577-09.10.2012","09.10.2012",2012,10,9,0.558886124,5
"ENG_062_MZB_LO_1577","ENG_062_MZB_LO_1577-17.10.2013","17.10.2013",2013,10,17,0.564456252,5
"ENG_062_MZB_LO_1577","ENG_062_MZB_LO_1577-24.10.2016","24.10.2016",2016,10,24,0.555734909,5
"ENG_062_MZB_LO_158","ENG_062_MZB_LO_158-15.10.2002","15.10.2002",2002,10,15,0.603480673,4
"ENG_062_MZB_LO_158","ENG_062_MZB_LO_158-23.09.2003","23.09.2003",2003,9,23,0.657274081,4
"ENG_062_MZB_LO_158","ENG_062_MZB_LO_158-12.10.2004","12.10.2004",2004,10,12,0.583524233,5
"ENG_062_MZB_LO_158","ENG_062_MZB_LO_158-02.10.2006","02.10.2006",2006,10,2,0.581013265,5
"ENG_062_MZB_LO_158","ENG_062_MZB_LO_158-13.10.2009","13.10.2009",2009,10,13,0.666176174,4
"ENG_062_MZB_LO_158","ENG_062_MZB_LO_158-18.09.2013","18.09.2013",2013,9,18,0.502772274,5
"ENG_062_MZB_LO_158","ENG_062_MZB_LO_158-02.09.2016","02.09.2016",2016,9,2,0.573272689,5
"ENG_062_MZB_LO_1582","ENG_062_MZB_LO_1582-18.09.2002","18.09.2002",2002,9,18,0.857420606,3
"ENG_062_MZB_LO_1582","ENG_062_MZB_LO_1582-03.10.2003","03.10.2003",2003,10,3,0.628259672,4
"ENG_062_MZB_LO_1582","ENG_062_MZB_LO_1582-21.09.2005","21.09.2005",2005,9,21,0.689575784,4
"ENG_062_MZB_LO_1582","ENG_062_MZB_LO_1582-14.11.2012","14.11.2012",2012,11,14,0.701608792,4
"ENG_062_MZB_LO_1582","ENG_062_MZB_LO_1582-30.09.2014","30.09.2014",2014,9,30,0.783339048,3
"ENG_062_MZB_LO_1582","ENG_062_MZB_LO_1582-22.10.2018","22.10.2018",2018,10,22,0.736804645,4
"ENG_062_MZB_LO_1582","ENG_062_MZB_LO_1582-14.10.2021","14.10.2021",2021,10,14,0.779549572,3
"ENG_062_MZB_LO_1582","ENG_062_MZB_LO_1582-12.09.2022","12.09.2022",2022,9,12,0.720838052,4
"ENG_062_MZB_LO_1582","ENG_062_MZB_LO_1582-21.09.2023","21.09.2023",2023,9,21,0.717916422,4
"ENG_062_MZB_LO_1585","ENG_062_MZB_LO_1585-29.10.2003","29.10.2003",2003,10,29,0.733108611,3
"ENG_062_MZB_LO_1585","ENG_062_MZB_LO_1585-24.09.2004","24.09.2004",2004,9,24,0.74174457,3
"ENG_062_MZB_LO_1585","ENG_062_MZB_LO_1585-20.09.2005","20.09.2005",2005,9,20,0.785067556,3
"ENG_062_MZB_LO_1585","ENG_062_MZB_LO_1585-30.10.2006","30.10.2006",2006,10,30,0.73111323,5
"ENG_062_MZB_LO_1585","ENG_062_MZB_LO_1585-26.10.2007","26.10.2007",2007,10,26,0.778142653,3
"ENG_062_MZB_LO_1585","ENG_062_MZB_LO_1585-04.11.2009","04.11.2009",2009,11,4,0.809162582,3
"ENG_062_MZB_LO_1585","ENG_062_MZB_LO_1585-07.10.2013","07.10.2013",2013,10,7,0.757436091,3
"ENG_062_MZB_LO_1585","ENG_062_MZB_LO_1585-05.10.2015","05.10.2015",2015,10,5,0.760987828,3
"ENG_062_MZB_LO_1586","ENG_062_MZB_LO_1586-01.03.2002","01.03.2002",2002,3,1,0.689772487,4
"ENG_062_MZB_LO_1586","ENG_062_MZB_LO_1586-05.03.2003","05.03.2003",2003,3,5,0.624416578,4
"ENG_062_MZB_LO_1586","ENG_062_MZB_LO_1586-28.05.2004","28.05.2004",2004,5,28,0.668059784,4
"ENG_062_MZB_LO_1586","ENG_062_MZB_LO_1586-04.05.2006","04.05.2006",2006,5,4,0.648352112,4
"ENG_062_MZB_LO_1586","ENG_062_MZB_LO_1586-10.05.2012","10.05.2012",2012,5,10,0.800001384,3
"ENG_062_MZB_LO_1586","ENG_062_MZB_LO_1586-21.03.2014","21.03.2014",2014,3,21,0.639270507,4
"ENG_062_MZB_LO_1586","ENG_062_MZB_LO_1586-30.05.2018","30.05.2018",2018,5,30,0.678710231,4
"ENG_062_MZB_LO_1589","ENG_062_MZB_LO_1589-10.10.2003","10.10.2003",2003,10,10,0.724919821,3
"ENG_062_MZB_LO_1589","ENG_062_MZB_LO_1589-28.10.2004","28.10.2004",2004,10,28,0.867636881,3
"ENG_062_MZB_LO_1589","ENG_062_MZB_LO_1589-14.09.2005","14.09.2005",2005,9,14,0.791747835,3
"ENG_062_MZB_LO_1589","ENG_062_MZB_LO_1589-08.09.2006","08.09.2006",2006,9,8,0.793880974,3
"ENG_062_MZB_LO_1589","ENG_062_MZB_LO_1589-26.10.2007","26.10.2007",2007,10,26,0.768916422,3
"ENG_062_MZB_LO_1589","ENG_062_MZB_LO_1589-10.10.2008","10.10.2008",2008,10,10,0.842044426,3
"ENG_062_MZB_LO_1589","ENG_062_MZB_LO_1589-15.10.2010","15.10.2010",2010,10,15,0.761327436,3
"ENG_062_MZB_LO_1589","ENG_062_MZB_LO_1589-13.10.2011","13.10.2011",2011,10,13,0.792027585,3
"ENG_062_MZB_LO_1589","ENG_062_MZB_LO_1589-12.11.2012","12.11.2012",2012,11,12,0.8405494,3
"ENG_062_MZB_LO_1589","ENG_062_MZB_LO_1589-17.09.2015","17.09.2015",2015,9,17,0.838238678,3
"ENG_062_MZB_LO_1590","ENG_062_MZB_LO_1590-09.04.2002","09.04.2002",2002,4,9,0.746062072,3
"ENG_062_MZB_LO_1590","ENG_062_MZB_LO_1590-28.03.2003","28.03.2003",2003,3,28,0.768028918,3
"ENG_062_MZB_LO_1590","ENG_062_MZB_LO_1590-19.04.2005","19.04.2005",2005,4,19,0.740094054,3
"ENG_062_MZB_LO_1590","ENG_062_MZB_LO_1590-03.04.2008","03.04.2008",2008,4,3,0.692083322,4
"ENG_062_MZB_LO_1590","ENG_062_MZB_LO_1590-16.03.2010","16.03.2010",2010,3,16,0.706059286,4
"ENG_062_MZB_LO_1590","ENG_062_MZB_LO_1590-17.05.2012","17.05.2012",2012,5,17,0.766947443,3
"ENG_062_MZB_LO_1590","ENG_062_MZB_LO_1590-06.05.2015","06.05.2015",2015,5,6,0.663868993,4
"ENG_062_MZB_LO_1595","ENG_062_MZB_LO_1595-29.10.2003","29.10.2003",2003,10,29,0.853613646,3
"ENG_062_MZB_LO_1595","ENG_062_MZB_LO_1595-18.11.2004","18.11.2004",2004,11,18,0.82643476,3
"ENG_062_MZB_LO_1595","ENG_062_MZB_LO_1595-20.09.2005","20.09.2005",2005,9,20,0.923850945,2
"ENG_062_MZB_LO_1595","ENG_062_MZB_LO_1595-30.10.2006","30.10.2006",2006,10,30,0.941594603,2
"ENG_062_MZB_LO_1595","ENG_062_MZB_LO_1595-11.11.2009","11.11.2009",2009,11,11,0.931811419,2
"ENG_062_MZB_LO_1595","ENG_062_MZB_LO_1595-20.10.2010","20.10.2010",2010,10,20,0.976124263,2
"ENG_062_MZB_LO_1595","ENG_062_MZB_LO_1595-04.09.2013","04.09.2013",2013,9,4,0.900269924,2
"ENG_062_MZB_LO_1595","ENG_062_MZB_LO_1595-05.10.2015","05.10.2015",2015,10,5,0.911938771,2
"ENG_062_MZB_LO_1596","ENG_062_MZB_LO_1596-23.09.2002","23.09.2002",2002,9,23,0.692666984,4
"ENG_062_MZB_LO_1596","ENG_062_MZB_LO_1596-10.10.2003","10.10.2003",2003,10,10,0.680372219,4
"ENG_062_MZB_LO_1596","ENG_062_MZB_LO_1596-14.09.2005","14.09.2005",2005,9,14,0.733794807,3
"ENG_062_MZB_LO_1596","ENG_062_MZB_LO_1596-19.09.2006","19.09.2006",2006,9,19,0.668688716,4
"ENG_062_MZB_LO_1596","ENG_062_MZB_LO_1596-26.10.2007","26.10.2007",2007,10,26,0.640334684,5
"ENG_062_MZB_LO_1596","ENG_062_MZB_LO_1596-10.10.2008","10.10.2008",2008,10,10,0.629173128,4
"ENG_062_MZB_LO_1596","ENG_062_MZB_LO_1596-15.11.2010","15.11.2010",2010,11,15,0.617876549,5
"ENG_062_MZB_LO_1596","ENG_062_MZB_LO_1596-22.10.2015","22.10.2015",2015,10,22,0.606901574,5
"ENG_062_MZB_LO_1597","ENG_062_MZB_LO_1597-30.11.2002","30.11.2002",2002,11,30,0.792384564,3
"ENG_062_MZB_LO_1597","ENG_062_MZB_LO_1597-01.10.2003","01.10.2003",2003,10,1,0.857123031,3
"ENG_062_MZB_LO_1597","ENG_062_MZB_LO_1597-15.10.2004","15.10.2004",2004,10,15,0.726719058,5
"ENG_062_MZB_LO_1597","ENG_062_MZB_LO_1597-03.11.2005","03.11.2005",2005,11,3,0.792606042,3
"ENG_062_MZB_LO_1597","ENG_062_MZB_LO_1597-25.10.2007","25.10.2007",2007,10,25,0.693248518,4
"ENG_062_MZB_LO_1597","ENG_062_MZB_LO_1597-22.09.2008","22.09.2008",2008,9,22,0.791541059,3
"ENG_062_MZB_LO_1597","ENG_062_MZB_LO_1597-06.10.2010","06.10.2010",2010,10,6,0.778137621,3
"ENG_062_MZB_LO_1597","ENG_062_MZB_LO_1597-19.10.2014","19.10.2014",2014,10,19,0.803803414,3
"ENG_062_MZB_LO_1597","ENG_062_MZB_LO_1597-13.10.2015","13.10.2015",2015,10,13,0.766438471,4
"ENG_062_MZB_LO_1598","ENG_062_MZB_LO_1598-02.09.2003","02.09.2003",2003,9,2,0.832788397,3
"ENG_062_MZB_LO_1598","ENG_062_MZB_LO_1598-02.11.2004","02.11.2004",2004,11,2,0.819558645,3
"ENG_062_MZB_LO_1598","ENG_062_MZB_LO_1598-24.10.2006","24.10.2006",2006,10,24,0.784537545,3
"ENG_062_MZB_LO_1598","ENG_062_MZB_LO_1598-25.09.2007","25.09.2007",2007,9,25,0.798685089,3
"ENG_062_MZB_LO_1598","ENG_062_MZB_LO_1598-14.10.2008","14.10.2008",2008,10,14,0.883581027,3
"ENG_062_MZB_LO_1598","ENG_062_MZB_LO_1598-27.10.2009","27.10.2009",2009,10,27,0.965725734,2
"ENG_062_MZB_LO_1598","ENG_062_MZB_LO_1598-06.09.2010","06.09.2010",2010,9,6,0.968354228,1
"ENG_062_MZB_LO_1598","ENG_062_MZB_LO_1598-04.10.2011","04.10.2011",2011,10,4,0.926300818,2
"ENG_062_MZB_LO_1598","ENG_062_MZB_LO_1598-16.10.2012","16.10.2012",2012,10,16,0.973886935,2
"ENG_062_MZB_LO_1598","ENG_062_MZB_LO_1598-25.09.2013","25.09.2013",2013,9,25,0.979074064,1
"ENG_062_MZB_LO_1598","ENG_062_MZB_LO_1598-14.10.2014","14.10.2014",2014,10,14,0.98472176,1
"ENG_062_MZB_LO_1598","ENG_062_MZB_LO_1598-09.09.2015","09.09.2015",2015,9,9,1.04512549,1
"ENG_062_MZB_LO_1598","ENG_062_MZB_LO_1598-04.10.2016","04.10.2016",2016,10,4,0.94206123,2
"ENG_062_MZB_LO_1598","ENG_062_MZB_LO_1598-17.10.2017","17.10.2017",2017,10,17,0.989325718,2
"ENG_062_MZB_LO_1598","ENG_062_MZB_LO_1598-23.10.2018","23.10.2018",2018,10,23,1.034159776,1
"ENG_062_MZB_LO_1598","ENG_062_MZB_LO_1598-21.11.2019","21.11.2019",2019,11,21,0.986827273,2
"ENG_062_MZB_LO_1598","ENG_062_MZB_LO_1598-17.09.2020","17.09.2020",2020,9,17,1.008365852,1
"ENG_062_MZB_LO_1598","ENG_062_MZB_LO_1598-11.10.2021","11.10.2021",2021,10,11,1.007367521,1
"ENG_062_MZB_LO_1599","ENG_062_MZB_LO_1599-03.10.2002","03.10.2002",2002,10,3,0.86364772,3
"ENG_062_MZB_LO_1599","ENG_062_MZB_LO_1599-25.10.2003","25.10.2003",2003,10,25,0.742665651,3
"ENG_062_MZB_LO_1599","ENG_062_MZB_LO_1599-15.09.2005","15.09.2005",2005,9,15,0.651086166,4
"ENG_062_MZB_LO_1599","ENG_062_MZB_LO_1599-23.11.2007","23.11.2007",2007,11,23,0.750892908,4
"ENG_062_MZB_LO_1599","ENG_062_MZB_LO_1599-17.11.2008","17.11.2008",2008,11,17,0.725313243,4
"ENG_062_MZB_LO_1599","ENG_062_MZB_LO_1599-27.11.2009","27.11.2009",2009,11,27,0.742169653,3
"ENG_062_MZB_LO_1599","ENG_062_MZB_LO_1599-22.09.2010","22.09.2010",2010,9,22,0.681998763,5
"ENG_062_MZB_LO_1599","ENG_062_MZB_LO_1599-12.09.2011","12.09.2011",2011,9,12,0.609194551,5
"ENG_062_MZB_LO_1599","ENG_062_MZB_LO_1599-31.10.2012","31.10.2012",2012,10,31,0.670788114,4
"ENG_062_MZB_LO_1599","ENG_062_MZB_LO_1599-16.09.2013","16.09.2013",2013,9,16,0.697411896,4
"ENG_062_MZB_LO_16","ENG_062_MZB_LO_16-03.10.2002","03.10.2002",2002,10,3,0.555097607,5
"ENG_062_MZB_LO_16","ENG_062_MZB_LO_16-10.09.2003","10.09.2003",2003,9,10,0.493299746,5
"ENG_062_MZB_LO_16","ENG_062_MZB_LO_16-20.09.2004","20.09.2004",2004,9,20,0.619110008,5
"ENG_062_MZB_LO_16","ENG_062_MZB_LO_16-29.09.2006","29.09.2006",2006,9,29,0.646631675,4
"ENG_062_MZB_LO_16","ENG_062_MZB_LO_16-01.09.2009","01.09.2009",2009,9,1,0.766839885,3
"ENG_062_MZB_LO_16","ENG_062_MZB_LO_16-25.09.2013","25.09.2013",2013,9,25,0.588453737,5
"ENG_062_MZB_LO_16","ENG_062_MZB_LO_16-28.09.2015","28.09.2015",2015,9,28,0.670325067,4
"ENG_062_MZB_LO_16","ENG_062_MZB_LO_16-13.09.2023","13.09.2023",2023,9,13,0.683356494,4
"ENG_062_MZB_LO_1603","ENG_062_MZB_LO_1603-21.11.2002","21.11.2002",2002,11,21,1.138184078,1
"ENG_062_MZB_LO_1603","ENG_062_MZB_LO_1603-19.09.2005","19.09.2005",2005,9,19,1.184000256,1
"ENG_062_MZB_LO_1603","ENG_062_MZB_LO_1603-02.10.2007","02.10.2007",2007,10,2,1.170167608,1
"ENG_062_MZB_LO_1603","ENG_062_MZB_LO_1603-02.11.2010","02.11.2010",2010,11,2,1.190785116,1
"ENG_062_MZB_LO_1603","ENG_062_MZB_LO_1603-23.10.2013","23.10.2013",2013,10,23,1.192612276,1
"ENG_062_MZB_LO_1603","ENG_062_MZB_LO_1603-07.10.2016","07.10.2016",2016,10,7,1.177099059,1
"ENG_062_MZB_LO_1603","ENG_062_MZB_LO_1603-03.10.2023","03.10.2023",2023,10,3,1.173727818,1
"ENG_062_MZB_LO_1605","ENG_062_MZB_LO_1605-10.09.2003","10.09.2003",2003,9,10,0.953558861,2
"ENG_062_MZB_LO_1605","ENG_062_MZB_LO_1605-21.09.2006","21.09.2006",2006,9,21,0.944172244,2
"ENG_062_MZB_LO_1605","ENG_062_MZB_LO_1605-28.09.2007","28.09.2007",2007,9,28,1.054605126,1
"ENG_062_MZB_LO_1605","ENG_062_MZB_LO_1605-27.11.2008","27.11.2008",2008,11,27,0.962076587,2
"ENG_062_MZB_LO_1605","ENG_062_MZB_LO_1605-14.10.2009","14.10.2009",2009,10,14,1.068613632,1
"ENG_062_MZB_LO_1605","ENG_062_MZB_LO_1605-02.11.2010","02.11.2010",2010,11,2,1.054784246,1
"ENG_062_MZB_LO_1605","ENG_062_MZB_LO_1605-16.09.2011","16.09.2011",2011,9,16,0.981625548,1
"ENG_062_MZB_LO_1605","ENG_062_MZB_LO_1605-08.11.2012","08.11.2012",2012,11,8,0.989222468,1
"ENG_062_MZB_LO_1605","ENG_062_MZB_LO_1605-26.09.2013","26.09.2013",2013,9,26,1.02533641,1
"ENG_062_MZB_LO_1605","ENG_062_MZB_LO_1605-21.10.2014","21.10.2014",2014,10,21,0.892781778,2
"ENG_062_MZB_LO_1605","ENG_062_MZB_LO_1605-02.09.2015","02.09.2015",2015,9,2,0.971306059,1
"ENG_062_MZB_LO_1605","ENG_062_MZB_LO_1605-18.10.2016","18.10.2016",2016,10,18,0.884695782,2
"ENG_062_MZB_LO_1605","ENG_062_MZB_LO_1605-03.10.2017","03.10.2017",2017,10,3,0.906139683,2
"ENG_062_MZB_LO_1605","ENG_062_MZB_LO_1605-26.09.2018","26.09.2018",2018,9,26,0.894983299,2
"ENG_062_MZB_LO_1605","ENG_062_MZB_LO_1605-02.09.2020","02.09.2020",2020,9,2,0.813731173,4
"ENG_062_MZB_LO_1609","ENG_062_MZB_LO_1609-25.09.2002","25.09.2002",2002,9,25,1.203423059,1
"ENG_062_MZB_LO_1609","ENG_062_MZB_LO_1609-11.09.2003","11.09.2003",2003,9,11,1.043145783,1
"ENG_062_MZB_LO_1609","ENG_062_MZB_LO_1609-20.10.2006","20.10.2006",2006,10,20,1.012335067,1
"ENG_062_MZB_LO_1609","ENG_062_MZB_LO_1609-15.10.2007","15.10.2007",2007,10,15,1.074053085,1
"ENG_062_MZB_LO_1609","ENG_062_MZB_LO_1609-18.11.2008","18.11.2008",2008,11,18,0.988252121,2
"ENG_062_MZB_LO_1609","ENG_062_MZB_LO_1609-28.10.2009","28.10.2009",2009,10,28,1.100944655,1
"ENG_062_MZB_LO_1609","ENG_062_MZB_LO_1609-29.09.2010","29.09.2010",2010,9,29,1.035092826,1
"ENG_062_MZB_LO_1609","ENG_062_MZB_LO_1609-06.10.2011","06.10.2011",2011,10,6,1.08532329,1
"ENG_062_MZB_LO_1609","ENG_062_MZB_LO_1609-14.09.2012","14.09.2012",2012,9,14,1.075400298,1
"ENG_062_MZB_LO_1609","ENG_062_MZB_LO_1609-16.10.2013","16.10.2013",2013,10,16,1.162363997,1
"ENG_062_MZB_LO_1609","ENG_062_MZB_LO_1609-28.11.2014","28.11.2014",2014,11,28,0.971299751,1
"ENG_062_MZB_LO_1609","ENG_062_MZB_LO_1609-22.10.2015","22.10.2015",2015,10,22,1.069682033,1
"ENG_062_MZB_LO_1609","ENG_062_MZB_LO_1609-15.09.2016","15.09.2016",2016,9,15,1.129461378,1
"ENG_062_MZB_LO_1609","ENG_062_MZB_LO_1609-02.11.2017","02.11.2017",2017,11,2,1.064862865,1
"ENG_062_MZB_LO_1609","ENG_062_MZB_LO_1609-11.10.2018","11.10.2018",2018,10,11,1.065668884,1
"ENG_062_MZB_LO_1609","ENG_062_MZB_LO_1609-20.09.2019","20.09.2019",2019,9,20,1.125324039,1
"ENG_062_MZB_LO_1609","ENG_062_MZB_LO_1609-15.09.2020","15.09.2020",2020,9,15,1.080993777,1
"ENG_062_MZB_LO_1609","ENG_062_MZB_LO_1609-18.10.2021","18.10.2021",2021,10,18,1.050850653,1
"ENG_062_MZB_LO_1609","ENG_062_MZB_LO_1609-17.10.2022","17.10.2022",2022,10,17,1.099256107,1
"ENG_062_MZB_LO_1609","ENG_062_MZB_LO_1609-09.10.2023","09.10.2023",2023,10,9,1.039286155,1
"ENG_062_MZB_LO_161","ENG_062_MZB_LO_161-17.10.2002","17.10.2002",2002,10,17,0.988448868,1
"ENG_062_MZB_LO_161","ENG_062_MZB_LO_161-17.10.2003","17.10.2003",2003,10,17,0.972367057,1
"ENG_062_MZB_LO_161","ENG_062_MZB_LO_161-01.11.2004","01.11.2004",2004,11,1,0.911681828,2
"ENG_062_MZB_LO_161","ENG_062_MZB_LO_161-27.09.2005","27.09.2005",2005,9,27,0.941391808,2
"ENG_062_MZB_LO_161","ENG_062_MZB_LO_161-06.11.2006","06.11.2006",2006,11,6,0.990931719,1
"ENG_062_MZB_LO_161","ENG_062_MZB_LO_161-22.10.2007","22.10.2007",2007,10,22,1.031203993,1
"ENG_062_MZB_LO_161","ENG_062_MZB_LO_161-30.09.2008","30.09.2008",2008,9,30,0.916468981,3
"ENG_062_MZB_LO_161","ENG_062_MZB_LO_161-14.10.2009","14.10.2009",2009,10,14,1.081543571,1
"ENG_062_MZB_LO_161","ENG_062_MZB_LO_161-08.09.2014","08.09.2014",2014,9,8,1.007835873,1
"ENG_062_MZB_LO_161","ENG_062_MZB_LO_161-24.10.2019","24.10.2019",2019,10,24,1.015928156,1
"ENG_062_MZB_LO_161","ENG_062_MZB_LO_161-11.10.2021","11.10.2021",2021,10,11,1.032756616,1
"ENG_062_MZB_LO_1610","ENG_062_MZB_LO_1610-12.03.2003","12.03.2003",2003,3,12,0.931535118,2
"ENG_062_MZB_LO_1610","ENG_062_MZB_LO_1610-16.03.2006","16.03.2006",2006,3,16,0.853579019,3
"ENG_062_MZB_LO_1610","ENG_062_MZB_LO_1610-27.05.2009","27.05.2009",2009,5,27,0.994629525,2
"ENG_062_MZB_LO_1610","ENG_062_MZB_LO_1610-20.04.2010","20.04.2010",2010,4,20,1.005258549,1
"ENG_062_MZB_LO_1610","ENG_062_MZB_LO_1610-05.05.2011","05.05.2011",2011,5,5,1.066703795,1
"ENG_062_MZB_LO_1610","ENG_062_MZB_LO_1610-24.05.2012","24.05.2012",2012,5,24,0.969780251,1
"ENG_062_MZB_LO_1610","ENG_062_MZB_LO_1610-03.04.2014","03.04.2014",2014,4,3,1.12212009,1
"ENG_062_MZB_LO_1613","ENG_062_MZB_LO_1613-25.09.2002","25.09.2002",2002,9,25,0.836685573,3
"ENG_062_MZB_LO_1613","ENG_062_MZB_LO_1613-04.10.2005","04.10.2005",2005,10,4,0.768823564,3
"ENG_062_MZB_LO_1613","ENG_062_MZB_LO_1613-25.09.2008","25.09.2008",2008,9,25,0.782769084,3
"ENG_062_MZB_LO_1613","ENG_062_MZB_LO_1613-13.09.2010","13.09.2010",2010,9,13,0.749403393,3
"ENG_062_MZB_LO_1613","ENG_062_MZB_LO_1613-20.09.2012","20.09.2012",2012,9,20,0.856221889,3
"ENG_062_MZB_LO_1613","ENG_062_MZB_LO_1613-24.10.2016","24.10.2016",2016,10,24,0.887878913,2
"ENG_062_MZB_LO_1613","ENG_062_MZB_LO_1613-29.11.2023","29.11.2023",2023,11,29,0.875198093,2
"ENG_062_MZB_LO_1614","ENG_062_MZB_LO_1614-17.09.2003","17.09.2003",2003,9,17,0.805979655,3
"ENG_062_MZB_LO_1614","ENG_062_MZB_LO_1614-17.11.2004","17.11.2004",2004,11,17,0.710571688,4
"ENG_062_MZB_LO_1614","ENG_062_MZB_LO_1614-18.10.2005","18.10.2005",2005,10,18,0.719184755,3
"ENG_062_MZB_LO_1614","ENG_062_MZB_LO_1614-20.10.2006","20.10.2006",2006,10,20,0.739476477,3
"ENG_062_MZB_LO_1614","ENG_062_MZB_LO_1614-30.10.2007","30.10.2007",2007,10,30,0.761096678,3
"ENG_062_MZB_LO_1614","ENG_062_MZB_LO_1614-01.10.2008","01.10.2008",2008,10,1,0.763793336,3
"ENG_062_MZB_LO_1614","ENG_062_MZB_LO_1614-28.09.2009","28.09.2009",2009,9,28,0.747636162,3
"ENG_062_MZB_LO_1614","ENG_062_MZB_LO_1614-15.09.2010","15.09.2010",2010,9,15,0.710658592,4
"ENG_062_MZB_LO_1614","ENG_062_MZB_LO_1614-20.09.2011","20.09.2011",2011,9,20,0.696970585,4
"ENG_062_MZB_LO_1614","ENG_062_MZB_LO_1614-19.09.2012","19.09.2012",2012,9,19,0.666025714,4
"ENG_062_MZB_LO_1614","ENG_062_MZB_LO_1614-04.09.2013","04.09.2013",2013,9,4,0.690809871,4
"ENG_062_MZB_LO_1614","ENG_062_MZB_LO_1614-03.09.2014","03.09.2014",2014,9,3,0.72821507,3
"ENG_062_MZB_LO_1614","ENG_062_MZB_LO_1614-12.10.2015","12.10.2015",2015,10,12,0.841500963,3
"ENG_062_MZB_LO_1614","ENG_062_MZB_LO_1614-05.10.2016","05.10.2016",2016,10,5,0.82630021,3
"ENG_062_MZB_LO_1614","ENG_062_MZB_LO_1614-28.09.2017","28.09.2017",2017,9,28,0.798723423,3
"ENG_062_MZB_LO_1614","ENG_062_MZB_LO_1614-01.10.2018","01.10.2018",2018,10,1,0.815626479,3
"ENG_062_MZB_LO_1614","ENG_062_MZB_LO_1614-14.10.2019","14.10.2019",2019,10,14,0.846870294,3
"ENG_062_MZB_LO_1614","ENG_062_MZB_LO_1614-17.09.2020","17.09.2020",2020,9,17,0.840516709,4
"ENG_062_MZB_LO_1614","ENG_062_MZB_LO_1614-08.09.2021","08.09.2021",2021,9,8,0.802137717,3
"ENG_062_MZB_LO_1615","ENG_062_MZB_LO_1615-02.10.2002","02.10.2002",2002,10,2,0.786253,3
"ENG_062_MZB_LO_1615","ENG_062_MZB_LO_1615-03.10.2005","03.10.2005",2005,10,3,0.614547773,4
"ENG_062_MZB_LO_1615","ENG_062_MZB_LO_1615-22.09.2008","22.09.2008",2008,9,22,0.680523846,4
"ENG_062_MZB_LO_1615","ENG_062_MZB_LO_1615-22.10.2009","22.10.2009",2009,10,22,0.645014832,4
"ENG_062_MZB_LO_1615","ENG_062_MZB_LO_1615-05.10.2011","05.10.2011",2011,10,5,0.659324948,4
"ENG_062_MZB_LO_1615","ENG_062_MZB_LO_1615-17.09.2015","17.09.2015",2015,9,17,0.630736079,4
"ENG_062_MZB_LO_1615","ENG_062_MZB_LO_1615-12.11.2021","12.11.2021",2021,11,12,0.546846858,5
"ENG_062_MZB_LO_1616","ENG_062_MZB_LO_1616-18.09.2002","18.09.2002",2002,9,18,0.911202995,2
"ENG_062_MZB_LO_1616","ENG_062_MZB_LO_1616-09.09.2003","09.09.2003",2003,9,9,0.848779128,3
"ENG_062_MZB_LO_1616","ENG_062_MZB_LO_1616-15.09.2006","15.09.2006",2006,9,15,0.757142549,3
"ENG_062_MZB_LO_1616","ENG_062_MZB_LO_1616-26.09.2007","26.09.2007",2007,9,26,0.865429984,3
"ENG_062_MZB_LO_1616","ENG_062_MZB_LO_1616-22.10.2008","22.10.2008",2008,10,22,0.911567837,2
"ENG_062_MZB_LO_1616","ENG_062_MZB_LO_1616-04.11.2009","04.11.2009",2009,11,4,0.940505233,2
"ENG_062_MZB_LO_1616","ENG_062_MZB_LO_1616-12.10.2010","12.10.2010",2010,10,12,0.987094866,1
"ENG_062_MZB_LO_1616","ENG_062_MZB_LO_1616-10.11.2011","10.11.2011",2011,11,10,0.954901023,2
"ENG_062_MZB_LO_1616","ENG_062_MZB_LO_1616-15.11.2012","15.11.2012",2012,11,15,0.829297269,3
"ENG_062_MZB_LO_1616","ENG_062_MZB_LO_1616-28.11.2013","28.11.2013",2013,11,28,0.846212358,3
"ENG_062_MZB_LO_1616","ENG_062_MZB_LO_1616-06.11.2014","06.11.2014",2014,11,6,0.78620164,3
"ENG_062_MZB_LO_1616","ENG_062_MZB_LO_1616-31.10.2018","31.10.2018",2018,10,31,0.957340642,2
"ENG_062_MZB_LO_1616","ENG_062_MZB_LO_1616-14.10.2021","14.10.2021",2021,10,14,0.953978457,2
"ENG_062_MZB_LO_1616","ENG_062_MZB_LO_1616-12.09.2022","12.09.2022",2022,9,12,0.938323601,2
"ENG_062_MZB_LO_1616","ENG_062_MZB_LO_1616-11.09.2023","11.09.2023",2023,9,11,0.898159208,2
"ENG_062_MZB_LO_1624","ENG_062_MZB_LO_1624-28.03.2003","28.03.2003",2003,3,28,0.661201432,5
"ENG_062_MZB_LO_1624","ENG_062_MZB_LO_1624-19.04.2004","19.04.2004",2004,4,19,0.64366638,4
"ENG_062_MZB_LO_1624","ENG_062_MZB_LO_1624-17.05.2006","17.05.2006",2006,5,17,0.706438024,4
"ENG_062_MZB_LO_1624","ENG_062_MZB_LO_1624-12.04.2007","12.04.2007",2007,4,12,0.654991782,4
"ENG_062_MZB_LO_1624","ENG_062_MZB_LO_1624-03.04.2008","03.04.2008",2008,4,3,0.657054435,4
"ENG_062_MZB_LO_1624","ENG_062_MZB_LO_1624-21.03.2013","21.03.2013",2013,3,21,0.705073373,4
"ENG_062_MZB_LO_1624","ENG_062_MZB_LO_1624-10.04.2015","10.04.2015",2015,4,10,0.789170208,3
"ENG_062_MZB_LO_1625","ENG_062_MZB_LO_1625-23.09.2002","23.09.2002",2002,9,23,0.994123508,2
"ENG_062_MZB_LO_1625","ENG_062_MZB_LO_1625-10.10.2003","10.10.2003",2003,10,10,1.011954465,1
"ENG_062_MZB_LO_1625","ENG_062_MZB_LO_1625-10.11.2004","10.11.2004",2004,11,10,1.033830432,1
"ENG_062_MZB_LO_1625","ENG_062_MZB_LO_1625-14.09.2005","14.09.2005",2005,9,14,0.880727089,2
"ENG_062_MZB_LO_1625","ENG_062_MZB_LO_1625-19.09.2006","19.09.2006",2006,9,19,0.848326816,3
"ENG_062_MZB_LO_1625","ENG_062_MZB_LO_1625-26.10.2007","26.10.2007",2007,10,26,0.989794264,2
"ENG_062_MZB_LO_1625","ENG_062_MZB_LO_1625-10.10.2008","10.10.2008",2008,10,10,1.025247304,1
"ENG_062_MZB_LO_1625","ENG_062_MZB_LO_1625-13.11.2009","13.11.2009",2009,11,13,1.042021354,1
"ENG_062_MZB_LO_1625","ENG_062_MZB_LO_1625-15.10.2010","15.10.2010",2010,10,15,0.952949213,2
"ENG_062_MZB_LO_1625","ENG_062_MZB_LO_1625-13.10.2011","13.10.2011",2011,10,13,0.954907207,2
"ENG_062_MZB_LO_1625","ENG_062_MZB_LO_1625-16.11.2012","16.11.2012",2012,11,16,0.946244047,4
"ENG_062_MZB_LO_1625","ENG_062_MZB_LO_1625-06.09.2013","06.09.2013",2013,9,6,0.994328304,2
"ENG_062_MZB_LO_1625","ENG_062_MZB_LO_1625-30.10.2014","30.10.2014",2014,10,30,0.768722291,4
"ENG_062_MZB_LO_1625","ENG_062_MZB_LO_1625-17.09.2015","17.09.2015",2015,9,17,0.891332464,5
"ENG_062_MZB_LO_1625","ENG_062_MZB_LO_1625-02.09.2016","02.09.2016",2016,9,2,1.042990338,1
"ENG_062_MZB_LO_1625","ENG_062_MZB_LO_1625-20.10.2017","20.10.2017",2017,10,20,1.057442432,1
"ENG_062_MZB_LO_1625","ENG_062_MZB_LO_1625-04.10.2018","04.10.2018",2018,10,4,0.863321497,3
"ENG_062_MZB_LO_1625","ENG_062_MZB_LO_1625-10.10.2019","10.10.2019",2019,10,10,0.945134913,2
"ENG_062_MZB_LO_163","ENG_062_MZB_LO_163-14.10.2002","14.10.2002",2002,10,14,0.681507211,4
"ENG_062_MZB_LO_163","ENG_062_MZB_LO_163-24.09.2003","24.09.2003",2003,9,24,0.716778695,4
"ENG_062_MZB_LO_163","ENG_062_MZB_LO_163-19.10.2004","19.10.2004",2004,10,19,0.613754175,4
"ENG_062_MZB_LO_163","ENG_062_MZB_LO_163-18.09.2006","18.09.2006",2006,9,18,0.701880527,4
"ENG_062_MZB_LO_163","ENG_062_MZB_LO_163-29.09.2009","29.09.2009",2009,9,29,0.730076125,3
"ENG_062_MZB_LO_163","ENG_062_MZB_LO_163-31.10.2013","31.10.2013",2013,10,31,0.754233946,3
"ENG_062_MZB_LO_163","ENG_062_MZB_LO_163-17.09.2014","17.09.2014",2014,9,17,0.782411904,3
"ENG_062_MZB_LO_163","ENG_062_MZB_LO_163-06.11.2017","06.11.2017",2017,11,6,0.7566526,3
"ENG_062_MZB_LO_1630","ENG_062_MZB_LO_1630-06.10.2003","06.10.2003",2003,10,6,0.919742277,2
"ENG_062_MZB_LO_1630","ENG_062_MZB_LO_1630-07.10.2004","07.10.2004",2004,10,7,1.027354581,1
"ENG_062_MZB_LO_1630","ENG_062_MZB_LO_1630-30.11.2006","30.11.2006",2006,11,30,0.944006438,2
"ENG_062_MZB_LO_1630","ENG_062_MZB_LO_1630-24.09.2007","24.09.2007",2007,9,24,1.050022931,1
"ENG_062_MZB_LO_1630","ENG_062_MZB_LO_1630-25.09.2008","25.09.2008",2008,9,25,1.008515817,1
"ENG_062_MZB_LO_1630","ENG_062_MZB_LO_1630-30.09.2009","30.09.2009",2009,9,30,1.087855016,1
"ENG_062_MZB_LO_1630","ENG_062_MZB_LO_1630-21.09.2010","21.09.2010",2010,9,21,1.052595055,1
"ENG_062_MZB_LO_1630","ENG_062_MZB_LO_1630-21.09.2011","21.09.2011",2011,9,21,1.103497068,1
"ENG_062_MZB_LO_1630","ENG_062_MZB_LO_1630-11.10.2012","11.10.2012",2012,10,11,1.098181741,1
"ENG_062_MZB_LO_1630","ENG_062_MZB_LO_1630-13.11.2013","13.11.2013",2013,11,13,1.166480988,1
"ENG_062_MZB_LO_1630","ENG_062_MZB_LO_1630-18.09.2014","18.09.2014",2014,9,18,1.199767166,1
"ENG_062_MZB_LO_1630","ENG_062_MZB_LO_1630-13.10.2015","13.10.2015",2015,10,13,1.183499087,1
"ENG_062_MZB_LO_1630","ENG_062_MZB_LO_1630-12.10.2016","12.10.2016",2016,10,12,1.205633125,1
"ENG_062_MZB_LO_1630","ENG_062_MZB_LO_1630-16.10.2017","16.10.2017",2017,10,16,1.192710464,1
"ENG_062_MZB_LO_1630","ENG_062_MZB_LO_1630-06.11.2018","06.11.2018",2018,11,6,1.146759989,1
"ENG_062_MZB_LO_1630","ENG_062_MZB_LO_1630-23.10.2020","23.10.2020",2020,10,23,1.201616575,1
"ENG_062_MZB_LO_1630","ENG_062_MZB_LO_1630-02.11.2021","02.11.2021",2021,11,2,1.158555018,1
"ENG_062_MZB_LO_1630","ENG_062_MZB_LO_1630-17.10.2022","17.10.2022",2022,10,17,1.280064362,1
"ENG_062_MZB_LO_1630","ENG_062_MZB_LO_1630-17.11.2023","17.11.2023",2023,11,17,1.159458619,1
"ENG_062_MZB_LO_1630","ENG_062_MZB_LO_1630-31.10.2024","31.10.2024",2024,10,31,1.204772186,1
"ENG_062_MZB_LO_1631","ENG_062_MZB_LO_1631-01.10.2002","01.10.2002",2002,10,1,1.075966443,1
"ENG_062_MZB_LO_1631","ENG_062_MZB_LO_1631-06.10.2003","06.10.2003",2003,10,6,1.001482097,1
"ENG_062_MZB_LO_1631","ENG_062_MZB_LO_1631-30.11.2006","30.11.2006",2006,11,30,1.04107316,1
"ENG_062_MZB_LO_1631","ENG_062_MZB_LO_1631-30.09.2009","30.09.2009",2009,9,30,0.983414661,2
"ENG_062_MZB_LO_1631","ENG_062_MZB_LO_1631-21.09.2010","21.09.2010",2010,9,21,0.883724695,2
"ENG_062_MZB_LO_1631","ENG_062_MZB_LO_1631-24.10.2013","24.10.2013",2013,10,24,1.052279221,1
"ENG_062_MZB_LO_1631","ENG_062_MZB_LO_1631-12.10.2016","12.10.2016",2016,10,12,0.999010109,5
"ENG_062_MZB_LO_1632","ENG_062_MZB_LO_1632-16.09.2004","16.09.2004",2004,9,16,1.108395285,1
"ENG_062_MZB_LO_1632","ENG_062_MZB_LO_1632-01.11.2006","01.11.2006",2006,11,1,1.073286391,1
"ENG_062_MZB_LO_1632","ENG_062_MZB_LO_1632-09.10.2007","09.10.2007",2007,10,9,1.094506124,2
"ENG_062_MZB_LO_1632","ENG_062_MZB_LO_1632-27.11.2008","27.11.2008",2008,11,27,1.084042344,1
"ENG_062_MZB_LO_1632","ENG_062_MZB_LO_1632-14.10.2009","14.10.2009",2009,10,14,1.05836401,1
"ENG_062_MZB_LO_1632","ENG_062_MZB_LO_1632-13.09.2010","13.09.2010",2010,9,13,1.102121011,1
"ENG_062_MZB_LO_1632","ENG_062_MZB_LO_1632-15.09.2014","15.09.2014",2014,9,15,1.181831085,1
"ENG_062_MZB_LO_1632","ENG_062_MZB_LO_1632-02.10.2017","02.10.2017",2017,10,2,1.128802744,2
"ENG_062_MZB_LO_1632","ENG_062_MZB_LO_1632-08.10.2018","08.10.2018",2018,10,8,1.094065203,1
"ENG_062_MZB_LO_1632","ENG_062_MZB_LO_1632-22.10.2020","22.10.2020",2020,10,22,1.138171045,1
"ENG_062_MZB_LO_1632","ENG_062_MZB_LO_1632-17.10.2021","17.10.2021",2021,10,17,1.116408489,1
"ENG_062_MZB_LO_1632","ENG_062_MZB_LO_1632-12.10.2022","12.10.2022",2022,10,12,1.058926839,1
"ENG_062_MZB_LO_1632","ENG_062_MZB_LO_1632-20.09.2023","20.09.2023",2023,9,20,1.099045979,1
"ENG_062_MZB_LO_1633","ENG_062_MZB_LO_1633-30.11.2002","30.11.2002",2002,11,30,0.698113604,4
"ENG_062_MZB_LO_1633","ENG_062_MZB_LO_1633-12.11.2003","12.11.2003",2003,11,12,0.838268277,3
"ENG_062_MZB_LO_1633","ENG_062_MZB_LO_1633-06.10.2004","06.10.2004",2004,10,6,0.709902071,4
"ENG_062_MZB_LO_1633","ENG_062_MZB_LO_1633-27.10.2010","27.10.2010",2010,10,27,0.984106933,1
"ENG_062_MZB_LO_1633","ENG_062_MZB_LO_1633-19.09.2014","19.09.2014",2014,9,19,0.980696827,1
"ENG_062_MZB_LO_1633","ENG_062_MZB_LO_1633-14.09.2021","14.09.2021",2021,9,14,0.972534638,2
"ENG_062_MZB_LO_1633","ENG_062_MZB_LO_1633-15.09.2022","15.09.2022",2022,9,15,0.987009501,2
"ENG_062_MZB_LO_1633","ENG_062_MZB_LO_1633-05.10.2023","05.10.2023",2023,10,5,0.861420098,3
"ENG_062_MZB_LO_1634","ENG_062_MZB_LO_1634-29.10.2003","29.10.2003",2003,10,29,0.88527989,2
"ENG_062_MZB_LO_1634","ENG_062_MZB_LO_1634-25.09.2004","25.09.2004",2004,9,25,0.894351026,2
"ENG_062_MZB_LO_1634","ENG_062_MZB_LO_1634-20.09.2005","20.09.2005",2005,9,20,0.977848723,2
"ENG_062_MZB_LO_1634","ENG_062_MZB_LO_1634-30.10.2006","30.10.2006",2006,10,30,0.903704048,2
"ENG_062_MZB_LO_1634","ENG_062_MZB_LO_1634-24.09.2008","24.09.2008",2008,9,24,0.920657503,2
"ENG_062_MZB_LO_1634","ENG_062_MZB_LO_1634-11.11.2009","11.11.2009",2009,11,11,0.998291501,1
"ENG_062_MZB_LO_1634","ENG_062_MZB_LO_1634-20.10.2010","20.10.2010",2010,10,20,0.90530116,2
"ENG_062_MZB_LO_1634","ENG_062_MZB_LO_1634-20.10.2011","20.10.2011",2011,10,20,0.930674055,2
"ENG_062_MZB_LO_1634","ENG_062_MZB_LO_1634-16.10.2012","16.10.2012",2012,10,16,0.914022872,2
"ENG_062_MZB_LO_1634","ENG_062_MZB_LO_1634-08.10.2013","08.10.2013",2013,10,8,0.954948795,2
"ENG_062_MZB_LO_1634","ENG_062_MZB_LO_1634-19.09.2014","19.09.2014",2014,9,19,0.920737883,2
"ENG_062_MZB_LO_1634","ENG_062_MZB_LO_1634-05.10.2015","05.10.2015",2015,10,5,0.946897003,2
"ENG_062_MZB_LO_1634","ENG_062_MZB_LO_1634-21.09.2016","21.09.2016",2016,9,21,0.986511484,1
"ENG_062_MZB_LO_1634","ENG_062_MZB_LO_1634-16.11.2017","16.11.2017",2017,11,16,0.886410612,2
"ENG_062_MZB_LO_1634","ENG_062_MZB_LO_1634-02.10.2018","02.10.2018",2018,10,2,0.924032839,3
"ENG_062_MZB_LO_1634","ENG_062_MZB_LO_1634-22.10.2020","22.10.2020",2020,10,22,1.002127551,3
"ENG_062_MZB_LO_1634","ENG_062_MZB_LO_1634-16.11.2021","16.11.2021",2021,11,16,0.97580525,3
"ENG_062_MZB_LO_1634","ENG_062_MZB_LO_1634-27.09.2022","27.09.2022",2022,9,27,0.924292594,2
"ENG_062_MZB_LO_1634","ENG_062_MZB_LO_1634-09.10.2023","09.10.2023",2023,10,9,0.885058004,2
"ENG_062_MZB_LO_1635","ENG_062_MZB_LO_1635-05.10.2004","05.10.2004",2004,10,5,0.691304175,4
"ENG_062_MZB_LO_1635","ENG_062_MZB_LO_1635-04.10.2006","04.10.2006",2006,10,4,0.841031242,4
"ENG_062_MZB_LO_1635","ENG_062_MZB_LO_1635-27.09.2007","27.09.2007",2007,9,27,0.784648639,3
"ENG_062_MZB_LO_1635","ENG_062_MZB_LO_1635-04.11.2009","04.11.2009",2009,11,4,0.677714881,4
"ENG_062_MZB_LO_1635","ENG_062_MZB_LO_1635-06.09.2010","06.09.2010",2010,9,6,0.791640438,5
"ENG_062_MZB_LO_1635","ENG_062_MZB_LO_1635-27.09.2011","27.09.2011",2011,9,27,0.782267721,3
"ENG_062_MZB_LO_1635","ENG_062_MZB_LO_1635-07.09.2012","07.09.2012",2012,9,7,0.745379582,4
"ENG_062_MZB_LO_1635","ENG_062_MZB_LO_1635-09.09.2015","09.09.2015",2015,9,9,0.965572941,3
"ENG_062_MZB_LO_1636","ENG_062_MZB_LO_1636-25.09.2002","25.09.2002",2002,9,25,0.882668699,2
"ENG_062_MZB_LO_1636","ENG_062_MZB_LO_1636-04.11.2004","04.11.2004",2004,11,4,0.896578994,2
"ENG_062_MZB_LO_1636","ENG_062_MZB_LO_1636-28.09.2005","28.09.2005",2005,9,28,0.862457222,3
"ENG_062_MZB_LO_1636","ENG_062_MZB_LO_1636-04.09.2008","04.09.2008",2008,9,4,0.942067801,2
"ENG_062_MZB_LO_1636","ENG_062_MZB_LO_1636-28.10.2009","28.10.2009",2009,10,28,0.903674074,2
"ENG_062_MZB_LO_1636","ENG_062_MZB_LO_1636-07.10.2010","07.10.2010",2010,10,7,0.898110389,2
"ENG_062_MZB_LO_1636","ENG_062_MZB_LO_1636-15.09.2011","15.09.2011",2011,9,15,0.904657314,2
"ENG_062_MZB_LO_1636","ENG_062_MZB_LO_1636-27.09.2012","27.09.2012",2012,9,27,0.894536853,2
"ENG_062_MZB_LO_1636","ENG_062_MZB_LO_1636-04.09.2013","04.09.2013",2013,9,4,1.017039124,1
"ENG_062_MZB_LO_1636","ENG_062_MZB_LO_1636-23.09.2015","23.09.2015",2015,9,23,0.916135327,5
"ENG_062_MZB_LO_1636","ENG_062_MZB_LO_1636-10.10.2016","10.10.2016",2016,10,10,0.988460543,1
"ENG_062_MZB_LO_1638","ENG_062_MZB_LO_1638-13.11.2003","13.11.2003",2003,11,13,0.884035555,2
"ENG_062_MZB_LO_1638","ENG_062_MZB_LO_1638-01.10.2004","01.10.2004",2004,10,1,0.832740101,3
"ENG_062_MZB_LO_1638","ENG_062_MZB_LO_1638-07.09.2006","07.09.2006",2006,9,7,0.880632845,2
"ENG_062_MZB_LO_1638","ENG_062_MZB_LO_1638-28.09.2007","28.09.2007",2007,9,28,0.857161312,3
"ENG_062_MZB_LO_1638","ENG_062_MZB_LO_1638-07.11.2008","07.11.2008",2008,11,7,0.937526378,2
"ENG_062_MZB_LO_1638","ENG_062_MZB_LO_1638-03.10.2013","03.10.2013",2013,10,3,0.80814738,3
"ENG_062_MZB_LO_1638","ENG_062_MZB_LO_1638-25.09.2015","25.09.2015",2015,9,25,0.774868245,4
"ENG_062_MZB_LO_1640","ENG_062_MZB_LO_1640-25.09.2002","25.09.2002",2002,9,25,0.848134598,3
"ENG_062_MZB_LO_1640","ENG_062_MZB_LO_1640-21.11.2003","21.11.2003",2003,11,21,0.865914495,2
"ENG_062_MZB_LO_1640","ENG_062_MZB_LO_1640-05.09.2006","05.09.2006",2006,9,5,0.786653863,3
"ENG_062_MZB_LO_1640","ENG_062_MZB_LO_1640-28.09.2007","28.09.2007",2007,9,28,0.788033985,3
"ENG_062_MZB_LO_1640","ENG_062_MZB_LO_1640-07.11.2008","07.11.2008",2008,11,7,0.871276541,2
"ENG_062_MZB_LO_1640","ENG_062_MZB_LO_1640-21.09.2009","21.09.2009",2009,9,21,0.89290299,2
"ENG_062_MZB_LO_1640","ENG_062_MZB_LO_1640-11.10.2010","11.10.2010",2010,10,11,0.876620589,5
"ENG_062_MZB_LO_1640","ENG_062_MZB_LO_1640-30.10.2014","30.10.2014",2014,10,30,0.813349345,3
"ENG_062_MZB_LO_1643","ENG_062_MZB_LO_1643-30.04.2002","30.04.2002",2002,4,30,1.130306448,1
"ENG_062_MZB_LO_1643","ENG_062_MZB_LO_1643-01.04.2004","01.04.2004",2004,4,1,0.986364755,1
"ENG_062_MZB_LO_1643","ENG_062_MZB_LO_1643-17.03.2005","17.03.2005",2005,3,17,1.010887098,1
"ENG_062_MZB_LO_1643","ENG_062_MZB_LO_1643-24.04.2006","24.04.2006",2006,4,24,0.999639995,1
"ENG_062_MZB_LO_1643","ENG_062_MZB_LO_1643-23.04.2007","23.04.2007",2007,4,23,0.941519678,2
"ENG_062_MZB_LO_1643","ENG_062_MZB_LO_1643-22.04.2013","22.04.2013",2013,4,22,1.05827852,1
"ENG_062_MZB_LO_1643","ENG_062_MZB_LO_1643-14.04.2014","14.04.2014",2014,4,14,1.037850205,1
"ENG_062_MZB_LO_1646","ENG_062_MZB_LO_1646-24.04.2002","24.04.2002",2002,4,24,0.843461936,3
"ENG_062_MZB_LO_1646","ENG_062_MZB_LO_1646-19.05.2004","19.05.2004",2004,5,19,0.872876609,2
"ENG_062_MZB_LO_1646","ENG_062_MZB_LO_1646-29.03.2007","29.03.2007",2007,3,29,0.785826028,4
"ENG_062_MZB_LO_1646","ENG_062_MZB_LO_1646-15.05.2008","15.05.2008",2008,5,15,0.8391751,3
"ENG_062_MZB_LO_1646","ENG_062_MZB_LO_1646-17.05.2012","17.05.2012",2012,5,17,0.770162891,3
"ENG_062_MZB_LO_1646","ENG_062_MZB_LO_1646-23.03.2015","23.03.2015",2015,3,23,0.782938215,5
"ENG_062_MZB_LO_1646","ENG_062_MZB_LO_1646-15.05.2018","15.05.2018",2018,5,15,0.824703254,3
"ENG_062_MZB_LO_1647","ENG_062_MZB_LO_1647-23.09.2002","23.09.2002",2002,9,23,1.104892355,1
"ENG_062_MZB_LO_1647","ENG_062_MZB_LO_1647-12.09.2005","12.09.2005",2005,9,12,0.970075849,3
"ENG_062_MZB_LO_1647","ENG_062_MZB_LO_1647-19.09.2008","19.09.2008",2008,9,19,1.117554749,3
"ENG_062_MZB_LO_1647","ENG_062_MZB_LO_1647-08.10.2009","08.10.2009",2009,10,8,1.081416754,3
"ENG_062_MZB_LO_1647","ENG_062_MZB_LO_1647-31.10.2011","31.10.2011",2011,10,31,1.023696472,2
"ENG_062_MZB_LO_1647","ENG_062_MZB_LO_1647-29.10.2019","29.10.2019",2019,10,29,1.08374919,1
"ENG_062_MZB_LO_1647","ENG_062_MZB_LO_1647-13.10.2021","13.10.2021",2021,10,13,1.179613693,1
"ENG_062_MZB_LO_1647","ENG_062_MZB_LO_1647-27.10.2022","27.10.2022",2022,10,27,1.132222908,1
"ENG_062_MZB_LO_1647","ENG_062_MZB_LO_1647-13.11.2023","13.11.2023",2023,11,13,1.064671313,1
"ENG_062_MZB_LO_1647","ENG_062_MZB_LO_1647-25.10.2024","25.10.2024",2024,10,25,1.22202712,1
"ENG_062_MZB_LO_1648","ENG_062_MZB_LO_1648-03.04.2002","03.04.2002",2002,4,3,0.884320569,3
"ENG_062_MZB_LO_1648","ENG_062_MZB_LO_1648-09.04.2003","09.04.2003",2003,4,9,0.956072834,2
"ENG_062_MZB_LO_1648","ENG_062_MZB_LO_1648-29.03.2004","29.03.2004",2004,3,29,0.867378136,3
"ENG_062_MZB_LO_1648","ENG_062_MZB_LO_1648-24.04.2007","24.04.2007",2007,4,24,0.857113314,3
"ENG_062_MZB_LO_1648","ENG_062_MZB_LO_1648-31.05.2012","31.05.2012",2012,5,31,0.801363627,3
"ENG_062_MZB_LO_1648","ENG_062_MZB_LO_1648-31.03.2015","31.03.2015",2015,3,31,0.916488263,2
"ENG_062_MZB_LO_1648","ENG_062_MZB_LO_1648-08.05.2018","08.05.2018",2018,5,8,0.956520561,2
"ENG_062_MZB_LO_1648","ENG_062_MZB_LO_1648-27.03.2019","27.03.2019",2019,3,27,0.900307309,2
"ENG_062_MZB_LO_1648","ENG_062_MZB_LO_1648-30.05.2022","30.05.2022",2022,5,30,0.882060064,2
"ENG_062_MZB_LO_1649","ENG_062_MZB_LO_1649-29.11.2002","29.11.2002",2002,11,29,0.857503352,3
"ENG_062_MZB_LO_1649","ENG_062_MZB_LO_1649-25.10.2005","25.10.2005",2005,10,25,0.940206321,2
"ENG_062_MZB_LO_1649","ENG_062_MZB_LO_1649-12.09.2008","12.09.2008",2008,9,12,0.966866164,2
"ENG_062_MZB_LO_1649","ENG_062_MZB_LO_1649-15.09.2011","15.09.2011",2011,9,15,0.827587643,3
"ENG_062_MZB_LO_1649","ENG_062_MZB_LO_1649-12.11.2014","12.11.2014",2014,11,12,0.913540956,2
"ENG_062_MZB_LO_1649","ENG_062_MZB_LO_1649-16.10.2018","16.10.2018",2018,10,16,0.924064012,3
"ENG_062_MZB_LO_1649","ENG_062_MZB_LO_1649-22.10.2019","22.10.2019",2019,10,22,0.979534834,3
"ENG_062_MZB_LO_1649","ENG_062_MZB_LO_1649-19.10.2020","19.10.2020",2020,10,19,1.015778726,2
"ENG_062_MZB_LO_1650","ENG_062_MZB_LO_1650-24.04.2002","24.04.2002",2002,4,24,0.811398886,3
"ENG_062_MZB_LO_1650","ENG_062_MZB_LO_1650-16.04.2003","16.04.2003",2003,4,16,0.772348538,3
"ENG_062_MZB_LO_1650","ENG_062_MZB_LO_1650-20.05.2004","20.05.2004",2004,5,20,0.829867468,3
"ENG_062_MZB_LO_1650","ENG_062_MZB_LO_1650-21.03.2006","21.03.2006",2006,3,21,0.746608104,3
"ENG_062_MZB_LO_1650","ENG_062_MZB_LO_1650-22.05.2009","22.05.2009",2009,5,22,0.79241829,3
"ENG_062_MZB_LO_1650","ENG_062_MZB_LO_1650-12.05.2010","12.05.2010",2010,5,12,0.673891588,4
"ENG_062_MZB_LO_1650","ENG_062_MZB_LO_1650-22.05.2012","22.05.2012",2012,5,22,0.744057003,3
"ENG_062_MZB_LO_1650","ENG_062_MZB_LO_1650-19.05.2014","19.05.2014",2014,5,19,0.867532827,2
"ENG_062_MZB_LO_1652","ENG_062_MZB_LO_1652-06.10.2003","06.10.2003",2003,10,6,0.843539575,3
"ENG_062_MZB_LO_1652","ENG_062_MZB_LO_1652-28.09.2004","28.09.2004",2004,9,28,0.776375365,5
"ENG_062_MZB_LO_1652","ENG_062_MZB_LO_1652-16.11.2006","16.11.2006",2006,11,16,0.835973466,4
"ENG_062_MZB_LO_1652","ENG_062_MZB_LO_1652-15.10.2008","15.10.2008",2008,10,15,0.814414115,5
"ENG_062_MZB_LO_1652","ENG_062_MZB_LO_1652-14.10.2009","14.10.2009",2009,10,14,0.904081314,3
"ENG_062_MZB_LO_1652","ENG_062_MZB_LO_1652-15.09.2011","15.09.2011",2011,9,15,0.948286835,3
"ENG_062_MZB_LO_1652","ENG_062_MZB_LO_1652-10.10.2012","10.10.2012",2012,10,10,0.827241523,4
"ENG_062_MZB_LO_1652","ENG_062_MZB_LO_1652-20.10.2015","20.10.2015",2015,10,20,0.830027112,3
"ENG_062_MZB_LO_1658","ENG_062_MZB_LO_1658-25.11.2004","25.11.2004",2004,11,25,0.914543262,2
"ENG_062_MZB_LO_1658","ENG_062_MZB_LO_1658-24.10.2007","24.10.2007",2007,10,24,0.909654238,2
"ENG_062_MZB_LO_1658","ENG_062_MZB_LO_1658-19.09.2008","19.09.2008",2008,9,19,0.863125501,3
"ENG_062_MZB_LO_1658","ENG_062_MZB_LO_1658-20.10.2009","20.10.2009",2009,10,20,0.871507893,2
"ENG_062_MZB_LO_1658","ENG_062_MZB_LO_1658-25.10.2010","25.10.2010",2010,10,25,0.954322659,2
"ENG_062_MZB_LO_1658","ENG_062_MZB_LO_1658-12.09.2011","12.09.2011",2011,9,12,0.965317077,2
"ENG_062_MZB_LO_1658","ENG_062_MZB_LO_1658-18.10.2012","18.10.2012",2012,10,18,0.946108136,2
"ENG_062_MZB_LO_1658","ENG_062_MZB_LO_1658-09.10.2013","09.10.2013",2013,10,9,1.018073104,1
"ENG_062_MZB_LO_1658","ENG_062_MZB_LO_1658-26.09.2014","26.09.2014",2014,9,26,0.960355832,2
"ENG_062_MZB_LO_1658","ENG_062_MZB_LO_1658-14.10.2015","14.10.2015",2015,10,14,0.975042571,1
"ENG_062_MZB_LO_1658","ENG_062_MZB_LO_1658-15.11.2016","15.11.2016",2016,11,15,0.986431795,2
"ENG_062_MZB_LO_1658","ENG_062_MZB_LO_1658-07.11.2017","07.11.2017",2017,11,7,0.941678501,2
"ENG_062_MZB_LO_1658","ENG_062_MZB_LO_1658-07.11.2018","07.11.2018",2018,11,7,0.909955798,2
"ENG_062_MZB_LO_1658","ENG_062_MZB_LO_1658-29.10.2020","29.10.2020",2020,10,29,0.961712334,2
"ENG_062_MZB_LO_1658","ENG_062_MZB_LO_1658-14.10.2021","14.10.2021",2021,10,14,0.93366933,2
"ENG_062_MZB_LO_1658","ENG_062_MZB_LO_1658-21.09.2022","21.09.2022",2022,9,21,0.87478893,2
"ENG_062_MZB_LO_1658","ENG_062_MZB_LO_1658-01.09.2023","01.09.2023",2023,9,1,0.950887111,2
"ENG_062_MZB_LO_1660","ENG_062_MZB_LO_1660-04.11.2003","04.11.2003",2003,11,4,0.665104,4
"ENG_062_MZB_LO_1660","ENG_062_MZB_LO_1660-20.09.2004","20.09.2004",2004,9,20,0.609684585,4
"ENG_062_MZB_LO_1660","ENG_062_MZB_LO_1660-05.10.2005","05.10.2005",2005,10,5,0.620482248,5
"ENG_062_MZB_LO_1660","ENG_062_MZB_LO_1660-26.10.2007","26.10.2007",2007,10,26,0.659092221,4
"ENG_062_MZB_LO_1660","ENG_062_MZB_LO_1660-23.10.2008","23.10.2008",2008,10,23,0.645779916,4
"ENG_062_MZB_LO_1660","ENG_062_MZB_LO_1660-20.11.2009","20.11.2009",2009,11,20,0.51494834,5
"ENG_062_MZB_LO_1660","ENG_062_MZB_LO_1660-30.09.2010","30.09.2010",2010,9,30,0.721602312,4
"ENG_062_MZB_LO_1660","ENG_062_MZB_LO_1660-08.09.2011","08.09.2011",2011,9,8,0.675287827,4
"ENG_062_MZB_LO_1660","ENG_062_MZB_LO_1660-03.10.2012","03.10.2012",2012,10,3,0.62750465,4
"ENG_062_MZB_LO_1660","ENG_062_MZB_LO_1660-12.09.2013","12.09.2013",2013,9,12,0.766627292,3
"ENG_062_MZB_LO_1660","ENG_062_MZB_LO_1660-05.09.2014","05.09.2014",2014,9,5,0.657241011,5
"ENG_062_MZB_LO_1660","ENG_062_MZB_LO_1660-03.09.2015","03.09.2015",2015,9,3,0.710066715,5
"ENG_062_MZB_LO_1660","ENG_062_MZB_LO_1660-01.09.2016","01.09.2016",2016,9,1,0.988327242,1
"ENG_062_MZB_LO_1660","ENG_062_MZB_LO_1660-13.10.2017","13.10.2017",2017,10,13,0.656105967,4
"ENG_062_MZB_LO_1660","ENG_062_MZB_LO_1660-19.10.2018","19.10.2018",2018,10,19,0.627580833,4
"ENG_062_MZB_LO_1660","ENG_062_MZB_LO_1660-27.11.2019","27.11.2019",2019,11,27,0.633551025,4
"ENG_062_MZB_LO_1660","ENG_062_MZB_LO_1660-22.09.2020","22.09.2020",2020,9,22,0.774789508,3
"ENG_062_MZB_LO_1660","ENG_062_MZB_LO_1660-01.09.2021","01.09.2021",2021,9,1,0.710405219,5
"ENG_062_MZB_LO_1664","ENG_062_MZB_LO_1664-29.10.2003","29.10.2003",2003,10,29,0.774169764,3
"ENG_062_MZB_LO_1664","ENG_062_MZB_LO_1664-24.09.2004","24.09.2004",2004,9,24,0.766139183,3
"ENG_062_MZB_LO_1664","ENG_062_MZB_LO_1664-21.11.2006","21.11.2006",2006,11,21,0.797844061,3
"ENG_062_MZB_LO_1664","ENG_062_MZB_LO_1664-11.11.2009","11.11.2009",2009,11,11,0.70415936,4
"ENG_062_MZB_LO_1664","ENG_062_MZB_LO_1664-20.10.2011","20.10.2011",2011,10,20,0.818092392,3
"ENG_062_MZB_LO_1664","ENG_062_MZB_LO_1664-05.10.2015","05.10.2015",2015,10,5,0.884094553,2
"ENG_062_MZB_LO_1664","ENG_062_MZB_LO_1664-02.09.2019","02.09.2019",2019,9,2,0.778355152,3
"ENG_062_MZB_LO_1664","ENG_062_MZB_LO_1664-22.09.2020","22.09.2020",2020,9,22,0.753943406,3
"ENG_062_MZB_LO_1664","ENG_062_MZB_LO_1664-03.09.2021","03.09.2021",2021,9,3,0.734717795,3
"ENG_062_MZB_LO_1664","ENG_062_MZB_LO_1664-06.09.2022","06.09.2022",2022,9,6,0.740400179,3
"ENG_062_MZB_LO_1664","ENG_062_MZB_LO_1664-05.10.2023","05.10.2023",2023,10,5,0.785983092,3
"ENG_062_MZB_LO_1666","ENG_062_MZB_LO_1666-15.10.2002","15.10.2002",2002,10,15,0.63854029,4
"ENG_062_MZB_LO_1666","ENG_062_MZB_LO_1666-21.10.2003","21.10.2003",2003,10,21,0.607283833,5
"ENG_062_MZB_LO_1666","ENG_062_MZB_LO_1666-05.10.2004","05.10.2004",2004,10,5,0.632687051,4
"ENG_062_MZB_LO_1666","ENG_062_MZB_LO_1666-12.10.2005","12.10.2005",2005,10,12,0.655896512,4
"ENG_062_MZB_LO_1666","ENG_062_MZB_LO_1666-17.09.2008","17.09.2008",2008,9,17,0.684477462,4
"ENG_062_MZB_LO_1666","ENG_062_MZB_LO_1666-03.09.2013","03.09.2013",2013,9,3,0.595844177,4
"ENG_062_MZB_LO_1666","ENG_062_MZB_LO_1666-01.09.2016","01.09.2016",2016,9,1,0.664425903,4
"ENG_062_MZB_LO_1667","ENG_062_MZB_LO_1667-16.04.2004","16.04.2004",2004,4,16,0.8836051,2
"ENG_062_MZB_LO_1667","ENG_062_MZB_LO_1667-09.05.2007","09.05.2007",2007,5,9,1.052045135,1
"ENG_062_MZB_LO_1667","ENG_062_MZB_LO_1667-17.05.2013","17.05.2013",2013,5,17,0.964646345,2
"ENG_062_MZB_LO_1667","ENG_062_MZB_LO_1667-20.05.2014","20.05.2014",2014,5,20,1.013649594,1
"ENG_062_MZB_LO_1667","ENG_062_MZB_LO_1667-30.04.2021","30.04.2021",2021,4,30,1.005875318,1
"ENG_062_MZB_LO_1667","ENG_062_MZB_LO_1667-11.04.2022","11.04.2022",2022,4,11,0.92103795,2
"ENG_062_MZB_LO_1667","ENG_062_MZB_LO_1667-29.03.2023","29.03.2023",2023,3,29,1.035048477,1
"ENG_062_MZB_LO_1667","ENG_062_MZB_LO_1667-12.04.2024","12.04.2024",2024,4,12,1.048679918,1
"ENG_062_MZB_LO_167","ENG_062_MZB_LO_167-10.10.2002","10.10.2002",2002,10,10,1.04573294,1
"ENG_062_MZB_LO_167","ENG_062_MZB_LO_167-02.10.2003","02.10.2003",2003,10,2,0.985306265,1
"ENG_062_MZB_LO_167","ENG_062_MZB_LO_167-02.11.2004","02.11.2004",2004,11,2,0.990703309,2
"ENG_062_MZB_LO_167","ENG_062_MZB_LO_167-01.11.2005","01.11.2005",2005,11,1,0.96758133,2
"ENG_062_MZB_LO_167","ENG_062_MZB_LO_167-12.09.2006","12.09.2006",2006,9,12,0.970786016,2
"ENG_062_MZB_LO_167","ENG_062_MZB_LO_167-18.09.2007","18.09.2007",2007,9,18,1.018690535,2
"ENG_062_MZB_LO_167","ENG_062_MZB_LO_167-03.10.2008","03.10.2008",2008,10,3,1.057217714,1
"ENG_062_MZB_LO_167","ENG_062_MZB_LO_167-11.09.2009","11.09.2009",2009,9,11,1.005678365,1
"ENG_062_MZB_LO_167","ENG_062_MZB_LO_167-06.10.2010","06.10.2010",2010,10,6,0.949143599,2
"ENG_062_MZB_LO_167","ENG_062_MZB_LO_167-20.09.2012","20.09.2012",2012,9,20,0.95738612,2
"ENG_062_MZB_LO_167","ENG_062_MZB_LO_167-22.09.2013","22.09.2013",2013,9,22,0.907352828,2
"ENG_062_MZB_LO_167","ENG_062_MZB_LO_167-15.09.2014","15.09.2014",2014,9,15,1.024732123,1
"ENG_062_MZB_LO_167","ENG_062_MZB_LO_167-17.09.2015","17.09.2015",2015,9,17,0.95676138,2
"ENG_062_MZB_LO_167","ENG_062_MZB_LO_167-06.10.2016","06.10.2016",2016,10,6,0.985370078,1
"ENG_062_MZB_LO_167","ENG_062_MZB_LO_167-26.09.2017","26.09.2017",2017,9,26,0.992530916,1
"ENG_062_MZB_LO_167","ENG_062_MZB_LO_167-13.09.2018","13.09.2018",2018,9,13,1.061681097,1
"ENG_062_MZB_LO_167","ENG_062_MZB_LO_167-18.10.2019","18.10.2019",2019,10,18,0.992635432,2
"ENG_062_MZB_LO_167","ENG_062_MZB_LO_167-15.09.2020","15.09.2020",2020,9,15,0.959640816,2
"ENG_062_MZB_LO_167","ENG_062_MZB_LO_167-26.10.2021","26.10.2021",2021,10,26,0.9988522,1
"ENG_062_MZB_LO_167","ENG_062_MZB_LO_167-04.10.2023","04.10.2023",2023,10,4,0.990307892,1
"ENG_062_MZB_LO_1674","ENG_062_MZB_LO_1674-24.09.2002","24.09.2002",2002,9,24,1.044833223,1
"ENG_062_MZB_LO_1674","ENG_062_MZB_LO_1674-06.10.2003","06.10.2003",2003,10,6,0.986986914,2
"ENG_062_MZB_LO_1674","ENG_062_MZB_LO_1674-21.09.2006","21.09.2006",2006,9,21,1.017655288,2
"ENG_062_MZB_LO_1674","ENG_062_MZB_LO_1674-15.10.2008","15.10.2008",2008,10,15,1.043596748,2
"ENG_062_MZB_LO_1674","ENG_062_MZB_LO_1674-14.10.2009","14.10.2009",2009,10,14,1.037464615,2
"ENG_062_MZB_LO_1674","ENG_062_MZB_LO_1674-02.11.2010","02.11.2010",2010,11,2,0.971699572,2
"ENG_062_MZB_LO_1674","ENG_062_MZB_LO_1674-05.09.2011","05.09.2011",2011,9,5,0.977064074,2
"ENG_062_MZB_LO_1674","ENG_062_MZB_LO_1674-20.09.2012","20.09.2012",2012,9,20,1.111958797,1
"ENG_062_MZB_LO_1674","ENG_062_MZB_LO_1674-14.10.2013","14.10.2013",2013,10,14,1.047862488,1
"ENG_062_MZB_LO_1674","ENG_062_MZB_LO_1674-08.09.2014","08.09.2014",2014,9,8,0.999051961,1
"ENG_062_MZB_LO_1674","ENG_062_MZB_LO_1674-20.10.2015","20.10.2015",2015,10,20,0.933826008,2
"ENG_062_MZB_LO_1674","ENG_062_MZB_LO_1674-08.11.2016","08.11.2016",2016,11,8,1.005122238,2
"ENG_062_MZB_LO_1674","ENG_062_MZB_LO_1674-20.09.2017","20.09.2017",2017,9,20,1.073324493,1
"ENG_062_MZB_LO_1674","ENG_062_MZB_LO_1674-07.11.2018","07.11.2018",2018,11,7,0.986500193,1
"ENG_062_MZB_LO_1674","ENG_062_MZB_LO_1674-29.10.2020","29.10.2020",2020,10,29,0.956218551,2
"ENG_062_MZB_LO_1674","ENG_062_MZB_LO_1674-17.11.2021","17.11.2021",2021,11,17,1.015307393,1
"ENG_062_MZB_LO_1674","ENG_062_MZB_LO_1674-26.09.2022","26.09.2022",2022,9,26,1.000901913,1
"ENG_062_MZB_LO_1674","ENG_062_MZB_LO_1674-28.09.2023","28.09.2023",2023,9,28,0.918504536,5
"ENG_062_MZB_LO_1674","ENG_062_MZB_LO_1674-05.11.2024","05.11.2024",2024,11,5,1.080587732,1
"ENG_062_MZB_LO_1675","ENG_062_MZB_LO_1675-09.10.2002","09.10.2002",2002,10,9,0.964903787,2
"ENG_062_MZB_LO_1675","ENG_062_MZB_LO_1675-29.09.2003","29.09.2003",2003,9,29,0.926223379,2
"ENG_062_MZB_LO_1675","ENG_062_MZB_LO_1675-09.11.2004","09.11.2004",2004,11,9,0.896605797,2
"ENG_062_MZB_LO_1675","ENG_062_MZB_LO_1675-10.10.2005","10.10.2005",2005,10,10,0.859545517,3
"ENG_062_MZB_LO_1675","ENG_062_MZB_LO_1675-31.10.2006","31.10.2006",2006,10,31,0.87461827,2
"ENG_062_MZB_LO_1675","ENG_062_MZB_LO_1675-06.11.2007","06.11.2007",2007,11,6,0.866723058,3
"ENG_062_MZB_LO_1675","ENG_062_MZB_LO_1675-24.09.2008","24.09.2008",2008,9,24,0.942359244,2
"ENG_062_MZB_LO_1675","ENG_062_MZB_LO_1675-08.10.2009","08.10.2009",2009,10,8,0.728247901,3
"ENG_062_MZB_LO_1675","ENG_062_MZB_LO_1675-30.09.2010","30.09.2010",2010,9,30,0.788263583,3
"ENG_062_MZB_LO_1675","ENG_062_MZB_LO_1675-12.10.2011","12.10.2011",2011,10,12,0.774699239,3
"ENG_062_MZB_LO_1675","ENG_062_MZB_LO_1675-12.11.2012","12.11.2012",2012,11,12,0.989982513,1
"ENG_062_MZB_LO_1675","ENG_062_MZB_LO_1675-22.11.2013","22.11.2013",2013,11,22,0.928469118,2
"ENG_062_MZB_LO_1675","ENG_062_MZB_LO_1675-26.11.2014","26.11.2014",2014,11,26,0.98707469,2
"ENG_062_MZB_LO_1675","ENG_062_MZB_LO_1675-19.10.2015","19.10.2015",2015,10,19,0.995144052,1
"ENG_062_MZB_LO_1675","ENG_062_MZB_LO_1675-21.09.2016","21.09.2016",2016,9,21,0.959697764,2
"ENG_062_MZB_LO_1675","ENG_062_MZB_LO_1675-13.10.2017","13.10.2017",2017,10,13,0.972896376,1
"ENG_062_MZB_LO_1675","ENG_062_MZB_LO_1675-18.09.2018","18.09.2018",2018,9,18,0.947193906,2
"ENG_062_MZB_LO_1675","ENG_062_MZB_LO_1675-06.11.2020","06.11.2020",2020,11,6,0.970538921,3
"ENG_062_MZB_LO_1675","ENG_062_MZB_LO_1675-16.11.2021","16.11.2021",2021,11,16,0.979159508,3
"ENG_062_MZB_LO_1675","ENG_062_MZB_LO_1675-26.09.2022","26.09.2022",2022,9,26,0.911413888,2
"ENG_062_MZB_LO_1675","ENG_062_MZB_LO_1675-09.10.2023","09.10.2023",2023,10,9,0.828918719,3
"ENG_062_MZB_LO_1675","ENG_062_MZB_LO_1675-19.09.2024","19.09.2024",2024,9,19,0.93095465,2
"ENG_062_MZB_LO_1678","ENG_062_MZB_LO_1678-08.10.2002","08.10.2002",2002,10,8,0.731110725,3
"ENG_062_MZB_LO_1678","ENG_062_MZB_LO_1678-04.11.2004","04.11.2004",2004,11,4,0.734333308,3
"ENG_062_MZB_LO_1678","ENG_062_MZB_LO_1678-27.09.2005","27.09.2005",2005,9,27,0.783663814,3
"ENG_062_MZB_LO_1678","ENG_062_MZB_LO_1678-20.09.2006","20.09.2006",2006,9,20,0.748701641,5
"ENG_062_MZB_LO_1678","ENG_062_MZB_LO_1678-12.10.2007","12.10.2007",2007,10,12,0.821812864,3
"ENG_062_MZB_LO_1678","ENG_062_MZB_LO_1678-06.11.2008","06.11.2008",2008,11,6,0.8075788,3
"ENG_062_MZB_LO_1678","ENG_062_MZB_LO_1678-21.10.2009","21.10.2009",2009,10,21,0.800780905,3
"ENG_062_MZB_LO_1678","ENG_062_MZB_LO_1678-27.09.2010","27.09.2010",2010,9,27,0.797531107,3
"ENG_062_MZB_LO_1678","ENG_062_MZB_LO_1678-22.09.2011","22.09.2011",2011,9,22,0.808979145,3
"ENG_062_MZB_LO_1678","ENG_062_MZB_LO_1678-19.09.2012","19.09.2012",2012,9,19,0.744133426,3
"ENG_062_MZB_LO_1678","ENG_062_MZB_LO_1678-01.10.2013","01.10.2013",2013,10,1,0.814053993,3
"ENG_062_MZB_LO_1678","ENG_062_MZB_LO_1678-01.09.2014","01.09.2014",2014,9,1,0.869199558,2
"ENG_062_MZB_LO_1678","ENG_062_MZB_LO_1678-16.09.2015","16.09.2015",2015,9,16,0.871403458,2
"ENG_062_MZB_LO_1678","ENG_062_MZB_LO_1678-03.10.2016","03.10.2016",2016,10,3,0.730247089,3
"ENG_062_MZB_LO_1678","ENG_062_MZB_LO_1678-18.09.2017","18.09.2017",2017,9,18,0.758206552,3
"ENG_062_MZB_LO_1678","ENG_062_MZB_LO_1678-31.10.2018","31.10.2018",2018,10,31,0.784944963,3
"ENG_062_MZB_LO_1678","ENG_062_MZB_LO_1678-05.11.2019","05.11.2019",2019,11,5,0.745116812,3
"ENG_062_MZB_LO_1678","ENG_062_MZB_LO_1678-14.09.2020","14.09.2020",2020,9,14,0.792283145,3
"ENG_062_MZB_LO_1678","ENG_062_MZB_LO_1678-09.09.2021","09.09.2021",2021,9,9,0.8425143,3
"ENG_062_MZB_LO_168","ENG_062_MZB_LO_168-10.10.2002","10.10.2002",2002,10,10,1.01797578,1
"ENG_062_MZB_LO_168","ENG_062_MZB_LO_168-02.10.2003","02.10.2003",2003,10,2,0.939456007,2
"ENG_062_MZB_LO_168","ENG_062_MZB_LO_168-02.11.2004","02.11.2004",2004,11,2,0.965194574,2
"ENG_062_MZB_LO_168","ENG_062_MZB_LO_168-01.11.2005","01.11.2005",2005,11,1,0.893442173,2
"ENG_062_MZB_LO_168","ENG_062_MZB_LO_168-12.09.2006","12.09.2006",2006,9,12,1.000312303,1
"ENG_062_MZB_LO_168","ENG_062_MZB_LO_168-20.09.2007","20.09.2007",2007,9,20,1.009965457,1
"ENG_062_MZB_LO_168","ENG_062_MZB_LO_168-03.10.2008","03.10.2008",2008,10,3,1.024476819,3
"ENG_062_MZB_LO_168","ENG_062_MZB_LO_168-16.09.2009","16.09.2009",2009,9,16,0.91783162,2
"ENG_062_MZB_LO_168","ENG_062_MZB_LO_168-11.10.2010","11.10.2010",2010,10,11,0.994281408,1
"ENG_062_MZB_LO_168","ENG_062_MZB_LO_168-06.10.2011","06.10.2011",2011,10,6,0.996817975,1
"ENG_062_MZB_LO_168","ENG_062_MZB_LO_168-16.09.2014","16.09.2014",2014,9,16,1.04345676,1
"ENG_062_MZB_LO_168","ENG_062_MZB_LO_168-02.10.2015","02.10.2015",2015,10,2,0.985727789,1
"ENG_062_MZB_LO_168","ENG_062_MZB_LO_168-06.10.2016","06.10.2016",2016,10,6,0.979094299,1
"ENG_062_MZB_LO_1683","ENG_062_MZB_LO_1683-23.09.2002","23.09.2002",2002,9,23,0.780964704,3
"ENG_062_MZB_LO_1683","ENG_062_MZB_LO_1683-29.09.2003","29.09.2003",2003,9,29,0.532555002,5
"ENG_062_MZB_LO_1683","ENG_062_MZB_LO_1683-27.10.2004","27.10.2004",2004,10,27,0.864650783,3
"ENG_062_MZB_LO_1683","ENG_062_MZB_LO_1683-12.09.2005","12.09.2005",2005,9,12,0.630039192,5
"ENG_062_MZB_LO_1683","ENG_062_MZB_LO_1683-04.10.2006","04.10.2006",2006,10,4,0.756824653,3
"ENG_062_MZB_LO_1683","ENG_062_MZB_LO_1683-19.09.2008","19.09.2008",2008,9,19,0.743371877,5
"ENG_062_MZB_LO_1683","ENG_062_MZB_LO_1683-31.10.2011","31.10.2011",2011,10,31,0.855497225,5
"ENG_062_MZB_LO_1686","ENG_062_MZB_LO_1686-30.10.2003","30.10.2003",2003,10,30,1.0047141,1
"ENG_062_MZB_LO_1686","ENG_062_MZB_LO_1686-03.11.2006","03.11.2006",2006,11,3,1.035294958,1
"ENG_062_MZB_LO_1686","ENG_062_MZB_LO_1686-28.10.2009","28.10.2009",2009,10,28,1.084116575,1
"ENG_062_MZB_LO_1686","ENG_062_MZB_LO_1686-17.10.2013","17.10.2013",2013,10,17,0.935840232,5
"ENG_062_MZB_LO_1686","ENG_062_MZB_LO_1686-08.09.2021","08.09.2021",2021,9,8,1.080286204,1
"ENG_062_MZB_LO_1686","ENG_062_MZB_LO_1686-12.09.2022","12.09.2022",2022,9,12,1.002836738,2
"ENG_062_MZB_LO_1686","ENG_062_MZB_LO_1686-29.09.2023","29.09.2023",2023,9,29,1.047006379,2
"ENG_062_MZB_LO_1686","ENG_062_MZB_LO_1686-04.09.2024","04.09.2024",2024,9,4,1.073413256,2
"ENG_062_MZB_LO_1687","ENG_062_MZB_LO_1687-10.09.2003","10.09.2003",2003,9,10,0.984314092,2
"ENG_062_MZB_LO_1687","ENG_062_MZB_LO_1687-21.09.2006","21.09.2006",2006,9,21,1.094992858,1
"ENG_062_MZB_LO_1687","ENG_062_MZB_LO_1687-28.09.2007","28.09.2007",2007,9,28,1.084841953,1
"ENG_062_MZB_LO_1687","ENG_062_MZB_LO_1687-27.11.2008","27.11.2008",2008,11,27,1.078370941,1
"ENG_062_MZB_LO_1687","ENG_062_MZB_LO_1687-14.10.2009","14.10.2009",2009,10,14,1.098899992,1
"ENG_062_MZB_LO_1687","ENG_062_MZB_LO_1687-02.11.2010","02.11.2010",2010,11,2,1.11687393,1
"ENG_062_MZB_LO_1687","ENG_062_MZB_LO_1687-16.09.2011","16.09.2011",2011,9,16,1.08678211,1
"ENG_062_MZB_LO_1687","ENG_062_MZB_LO_1687-26.09.2013","26.09.2013",2013,9,26,1.153047364,1
"ENG_062_MZB_LO_1687","ENG_062_MZB_LO_1687-23.09.2014","23.09.2014",2014,9,23,1.08806304,1
"ENG_062_MZB_LO_1687","ENG_062_MZB_LO_1687-02.09.2015","02.09.2015",2015,9,2,1.083060108,1
"ENG_062_MZB_LO_1687","ENG_062_MZB_LO_1687-18.10.2016","18.10.2016",2016,10,18,1.098741078,1
"ENG_062_MZB_LO_1687","ENG_062_MZB_LO_1687-11.10.2017","11.10.2017",2017,10,11,1.101266181,1
"ENG_062_MZB_LO_1687","ENG_062_MZB_LO_1687-19.09.2018","19.09.2018",2018,9,19,1.089825315,1
"ENG_062_MZB_LO_1687","ENG_062_MZB_LO_1687-01.09.2020","01.09.2020",2020,9,1,1.151859036,1
"ENG_062_MZB_LO_1687","ENG_062_MZB_LO_1687-16.09.2021","16.09.2021",2021,9,16,1.164106529,1
"ENG_062_MZB_LO_1688","ENG_062_MZB_LO_1688-07.10.2002","07.10.2002",2002,10,7,0.601672148,4
"ENG_062_MZB_LO_1688","ENG_062_MZB_LO_1688-07.11.2003","07.11.2003",2003,11,7,0.648184039,4
"ENG_062_MZB_LO_1688","ENG_062_MZB_LO_1688-02.11.2004","02.11.2004",2004,11,2,0.675856636,4
"ENG_062_MZB_LO_1688","ENG_062_MZB_LO_1688-18.11.2005","18.11.2005",2005,11,18,0.587476351,5
"ENG_062_MZB_LO_1688","ENG_062_MZB_LO_1688-04.10.2006","04.10.2006",2006,10,4,0.604312324,5
"ENG_062_MZB_LO_1688","ENG_062_MZB_LO_1688-04.10.2007","04.10.2007",2007,10,4,0.686378393,4
"ENG_062_MZB_LO_1688","ENG_062_MZB_LO_1688-17.09.2008","17.09.2008",2008,9,17,0.696691311,5
"ENG_062_MZB_LO_1688","ENG_062_MZB_LO_1688-15.10.2009","15.10.2009",2009,10,15,0.727706428,4
"ENG_062_MZB_LO_1688","ENG_062_MZB_LO_1688-22.09.2010","22.09.2010",2010,9,22,0.681213626,4
"ENG_062_MZB_LO_1688","ENG_062_MZB_LO_1688-18.10.2011","18.10.2011",2011,10,18,0.695729357,4
"ENG_062_MZB_LO_1688","ENG_062_MZB_LO_1688-02.10.2012","02.10.2012",2012,10,2,0.713873778,4
"ENG_062_MZB_LO_1688","ENG_062_MZB_LO_1688-17.10.2013","17.10.2013",2013,10,17,0.685337233,4
"ENG_062_MZB_LO_1688","ENG_062_MZB_LO_1688-22.09.2014","22.09.2014",2014,9,22,0.708215968,4
"ENG_062_MZB_LO_1688","ENG_062_MZB_LO_1688-17.09.2015","17.09.2015",2015,9,17,0.716854927,4
"ENG_062_MZB_LO_1688","ENG_062_MZB_LO_1688-06.09.2016","06.09.2016",2016,9,6,0.723394163,4
"ENG_062_MZB_LO_1688","ENG_062_MZB_LO_1688-23.10.2017","23.10.2017",2017,10,23,0.695773613,4
"ENG_062_MZB_LO_1688","ENG_062_MZB_LO_1688-30.10.2018","30.10.2018",2018,10,30,0.724620967,4
"ENG_062_MZB_LO_1688","ENG_062_MZB_LO_1688-04.11.2019","04.11.2019",2019,11,4,0.705394583,4
"ENG_062_MZB_LO_1688","ENG_062_MZB_LO_1688-30.10.2020","30.10.2020",2020,10,30,0.749309019,4
"ENG_062_MZB_LO_1688","ENG_062_MZB_LO_1688-24.09.2021","24.09.2021",2021,9,24,0.717790308,4
"ENG_062_MZB_LO_1688","ENG_062_MZB_LO_1688-10.11.2022","10.11.2022",2022,11,10,0.631473232,4
"ENG_062_MZB_LO_1688","ENG_062_MZB_LO_1688-26.10.2023","26.10.2023",2023,10,26,0.744444987,4
"ENG_062_MZB_LO_1689","ENG_062_MZB_LO_1689-19.09.2003","19.09.2003",2003,9,19,1.087514999,1
"ENG_062_MZB_LO_1689","ENG_062_MZB_LO_1689-07.09.2006","07.09.2006",2006,9,7,1.009587648,1
"ENG_062_MZB_LO_1689","ENG_062_MZB_LO_1689-26.09.2007","26.09.2007",2007,9,26,1.042339135,1
"ENG_062_MZB_LO_1689","ENG_062_MZB_LO_1689-05.11.2008","05.11.2008",2008,11,5,0.99187878,3
"ENG_062_MZB_LO_1689","ENG_062_MZB_LO_1689-19.10.2009","19.10.2009",2009,10,19,0.96828926,1
"ENG_062_MZB_LO_1689","ENG_062_MZB_LO_1689-12.10.2010","12.10.2010",2010,10,12,0.991504942,2
"ENG_062_MZB_LO_1689","ENG_062_MZB_LO_1689-20.09.2011","20.09.2011",2011,9,20,0.981620721,2
"ENG_062_MZB_LO_1689","ENG_062_MZB_LO_1689-19.11.2012","19.11.2012",2012,11,19,1.024532585,3
"ENG_062_MZB_LO_1689","ENG_062_MZB_LO_1689-19.09.2013","19.09.2013",2013,9,19,1.04436998,2
"ENG_062_MZB_LO_1689","ENG_062_MZB_LO_1689-06.11.2014","06.11.2014",2014,11,6,1.021268985,2
"ENG_062_MZB_LO_1689","ENG_062_MZB_LO_1689-23.09.2015","23.09.2015",2015,9,23,1.031107845,1
"ENG_062_MZB_LO_1689","ENG_062_MZB_LO_1689-25.10.2016","25.10.2016",2016,10,25,1.060759512,1
"ENG_062_MZB_LO_1689","ENG_062_MZB_LO_1689-08.11.2017","08.11.2017",2017,11,8,1.054845163,1
"ENG_062_MZB_LO_1689","ENG_062_MZB_LO_1689-05.10.2018","05.10.2018",2018,10,5,1.104874489,1
"ENG_062_MZB_LO_1689","ENG_062_MZB_LO_1689-21.11.2019","21.11.2019",2019,11,21,1.019809774,1
"ENG_062_MZB_LO_1689","ENG_062_MZB_LO_1689-30.09.2020","30.09.2020",2020,9,30,1.119001627,1
"ENG_062_MZB_LO_169","ENG_062_MZB_LO_169-28.09.2004","28.09.2004",2004,9,28,0.788152619,3
"ENG_062_MZB_LO_169","ENG_062_MZB_LO_169-20.09.2007","20.09.2007",2007,9,20,0.859994542,3
"ENG_062_MZB_LO_169","ENG_062_MZB_LO_169-17.09.2008","17.09.2008",2008,9,17,0.877103486,2
"ENG_062_MZB_LO_169","ENG_062_MZB_LO_169-11.09.2009","11.09.2009",2009,9,11,0.905829373,2
"ENG_062_MZB_LO_169","ENG_062_MZB_LO_169-04.09.2013","04.09.2013",2013,9,4,0.906329675,2
"ENG_062_MZB_LO_169","ENG_062_MZB_LO_169-16.09.2014","16.09.2014",2014,9,16,0.920976292,2
"ENG_062_MZB_LO_169","ENG_062_MZB_LO_169-18.10.2019","18.10.2019",2019,10,18,0.843370804,3
"ENG_062_MZB_LO_1690","ENG_062_MZB_LO_1690-07.11.2002","07.11.2002",2002,11,7,1.020903787,1
"ENG_062_MZB_LO_1690","ENG_062_MZB_LO_1690-07.10.2005","07.10.2005",2005,10,7,1.049263645,1
"ENG_062_MZB_LO_1690","ENG_062_MZB_LO_1690-07.10.2008","07.10.2008",2008,10,7,1.119184344,1
"ENG_062_MZB_LO_1690","ENG_062_MZB_LO_1690-04.11.2013","04.11.2013",2013,11,4,1.080712939,1
"ENG_062_MZB_LO_1690","ENG_062_MZB_LO_1690-04.11.2015","04.11.2015",2015,11,4,1.060801969,1
"ENG_062_MZB_LO_1690","ENG_062_MZB_LO_1690-12.10.2017","12.10.2017",2017,10,12,1.121773431,1
"ENG_062_MZB_LO_1690","ENG_062_MZB_LO_1690-06.11.2018","06.11.2018",2018,11,6,1.169146664,1
"ENG_062_MZB_LO_1690","ENG_062_MZB_LO_1690-12.11.2019","12.11.2019",2019,11,12,1.037956427,1
"ENG_062_MZB_LO_1696","ENG_062_MZB_LO_1696-05.03.2003","05.03.2003",2003,3,5,0.951907407,2
"ENG_062_MZB_LO_1696","ENG_062_MZB_LO_1696-31.03.2004","31.03.2004",2004,3,31,0.972848137,1
"ENG_062_MZB_LO_1696","ENG_062_MZB_LO_1696-15.03.2005","15.03.2005",2005,3,15,0.926147314,2
"ENG_062_MZB_LO_1696","ENG_062_MZB_LO_1696-30.03.2006","30.03.2006",2006,3,30,0.934496331,2
"ENG_062_MZB_LO_1696","ENG_062_MZB_LO_1696-14.03.2007","14.03.2007",2007,3,14,0.927087268,2
"ENG_062_MZB_LO_1696","ENG_062_MZB_LO_1696-14.05.2012","14.05.2012",2012,5,14,0.951511558,2
"ENG_062_MZB_LO_1696","ENG_062_MZB_LO_1696-29.04.2015","29.04.2015",2015,4,29,0.972064194,2
"ENG_062_MZB_LO_1697","ENG_062_MZB_LO_1697-19.09.2002","19.09.2002",2002,9,19,0.834421447,3
"ENG_062_MZB_LO_1697","ENG_062_MZB_LO_1697-12.11.2003","12.11.2003",2003,11,12,0.671373073,4
"ENG_062_MZB_LO_1697","ENG_062_MZB_LO_1697-05.11.2004","05.11.2004",2004,11,5,0.711885409,4
"ENG_062_MZB_LO_1697","ENG_062_MZB_LO_1697-23.11.2005","23.11.2005",2005,11,23,0.856068435,3
"ENG_062_MZB_LO_1697","ENG_062_MZB_LO_1697-14.11.2006","14.11.2006",2006,11,14,0.680408629,4
"ENG_062_MZB_LO_1697","ENG_062_MZB_LO_1697-20.09.2007","20.09.2007",2007,9,20,0.942215461,2
"ENG_062_MZB_LO_1697","ENG_062_MZB_LO_1697-18.09.2008","18.09.2008",2008,9,18,0.851132539,3
"ENG_062_MZB_LO_1697","ENG_062_MZB_LO_1697-21.10.2009","21.10.2009",2009,10,21,0.898985645,2
"ENG_062_MZB_LO_1697","ENG_062_MZB_LO_1697-23.09.2010","23.09.2010",2010,9,23,0.807394564,3
"ENG_062_MZB_LO_1697","ENG_062_MZB_LO_1697-17.10.2011","17.10.2011",2011,10,17,0.810875363,3
"ENG_062_MZB_LO_1697","ENG_062_MZB_LO_1697-07.09.2012","07.09.2012",2012,9,7,0.855034105,3
"ENG_062_MZB_LO_1697","ENG_062_MZB_LO_1697-15.11.2013","15.11.2013",2013,11,15,0.73840091,3
"ENG_062_MZB_LO_1697","ENG_062_MZB_LO_1697-21.11.2014","21.11.2014",2014,11,21,0.786245215,3
"ENG_062_MZB_LO_1697","ENG_062_MZB_LO_1697-16.10.2015","16.10.2015",2015,10,16,0.724410893,3
"ENG_062_MZB_LO_1697","ENG_062_MZB_LO_1697-21.09.2016","21.09.2016",2016,9,21,0.680134814,4
"ENG_062_MZB_LO_1697","ENG_062_MZB_LO_1697-17.10.2017","17.10.2017",2017,10,17,0.748822171,3
"ENG_062_MZB_LO_1697","ENG_062_MZB_LO_1697-27.11.2018","27.11.2018",2018,11,27,0.822656026,3
"ENG_062_MZB_LO_1697","ENG_062_MZB_LO_1697-10.10.2022","10.10.2022",2022,10,10,0.784024179,5
"ENG_062_MZB_LO_1698","ENG_062_MZB_LO_1698-07.10.2002","07.10.2002",2002,10,7,0.689009337,4
"ENG_062_MZB_LO_1698","ENG_062_MZB_LO_1698-07.11.2003","07.11.2003",2003,11,7,0.714572488,4
"ENG_062_MZB_LO_1698","ENG_062_MZB_LO_1698-02.11.2004","02.11.2004",2004,11,2,0.600278257,4
"ENG_062_MZB_LO_1698","ENG_062_MZB_LO_1698-18.11.2005","18.11.2005",2005,11,18,0.699995059,4
"ENG_062_MZB_LO_1698","ENG_062_MZB_LO_1698-04.10.2006","04.10.2006",2006,10,4,0.67921803,4
"ENG_062_MZB_LO_1698","ENG_062_MZB_LO_1698-04.10.2007","04.10.2007",2007,10,4,0.700431143,4
"ENG_062_MZB_LO_1698","ENG_062_MZB_LO_1698-17.09.2008","17.09.2008",2008,9,17,0.697300314,4
"ENG_062_MZB_LO_1698","ENG_062_MZB_LO_1698-15.10.2009","15.10.2009",2009,10,15,0.638749451,4
"ENG_062_MZB_LO_1698","ENG_062_MZB_LO_1698-07.10.2010","07.10.2010",2010,10,7,0.629591161,4
"ENG_062_MZB_LO_1698","ENG_062_MZB_LO_1698-18.10.2011","18.10.2011",2011,10,18,0.727992194,3
"ENG_062_MZB_LO_1698","ENG_062_MZB_LO_1698-04.10.2012","04.10.2012",2012,10,4,0.6762962,4
"ENG_062_MZB_LO_1698","ENG_062_MZB_LO_1698-16.10.2013","16.10.2013",2013,10,16,0.660780904,4
"ENG_062_MZB_LO_1698","ENG_062_MZB_LO_1698-22.09.2014","22.09.2014",2014,9,22,0.694624382,4
"ENG_062_MZB_LO_1698","ENG_062_MZB_LO_1698-17.09.2015","17.09.2015",2015,9,17,0.737468924,3
"ENG_062_MZB_LO_1698","ENG_062_MZB_LO_1698-19.09.2016","19.09.2016",2016,9,19,0.663524102,4
"ENG_062_MZB_LO_1698","ENG_062_MZB_LO_1698-23.10.2017","23.10.2017",2017,10,23,0.699046087,4
"ENG_062_MZB_LO_1698","ENG_062_MZB_LO_1698-30.10.2018","30.10.2018",2018,10,30,0.666196429,4
"ENG_062_MZB_LO_1698","ENG_062_MZB_LO_1698-29.10.2019","29.10.2019",2019,10,29,0.736478387,3
"ENG_062_MZB_LO_1698","ENG_062_MZB_LO_1698-30.10.2020","30.10.2020",2020,10,30,0.650991838,4
"ENG_062_MZB_LO_1698","ENG_062_MZB_LO_1698-02.11.2021","02.11.2021",2021,11,2,0.727716724,3
"ENG_062_MZB_LO_1698","ENG_062_MZB_LO_1698-10.11.2022","10.11.2022",2022,11,10,0.657505813,4
"ENG_062_MZB_LO_1698","ENG_062_MZB_LO_1698-12.09.2023","12.09.2023",2023,9,12,0.719343952,4
"ENG_062_MZB_LO_1698","ENG_062_MZB_LO_1698-30.10.2024","30.10.2024",2024,10,30,0.687978223,4
"ENG_062_MZB_LO_1699","ENG_062_MZB_LO_1699-29.05.2002","29.05.2002",2002,5,29,0.953221261,2
"ENG_062_MZB_LO_1699","ENG_062_MZB_LO_1699-16.04.2003","16.04.2003",2003,4,16,0.827386014,3
"ENG_062_MZB_LO_1699","ENG_062_MZB_LO_1699-13.05.2004","13.05.2004",2004,5,13,0.850305551,3
"ENG_062_MZB_LO_1699","ENG_062_MZB_LO_1699-10.05.2005","10.05.2005",2005,5,10,0.983927214,2
"ENG_062_MZB_LO_1699","ENG_062_MZB_LO_1699-15.05.2007","15.05.2007",2007,5,15,1.080426028,1
"ENG_062_MZB_LO_1699","ENG_062_MZB_LO_1699-15.04.2013","15.04.2013",2013,4,15,0.965352009,2
"ENG_062_MZB_LO_1699","ENG_062_MZB_LO_1699-22.04.2014","22.04.2014",2014,4,22,0.956015985,2
"ENG_062_MZB_LO_1699","ENG_062_MZB_LO_1699-22.03.2017","22.03.2017",2017,3,22,0.957011786,2
"ENG_062_MZB_LO_1699","ENG_062_MZB_LO_1699-10.05.2023","10.05.2023",2023,5,10,0.938627482,2
"ENG_062_MZB_LO_1700","ENG_062_MZB_LO_1700-13.05.2002","13.05.2002",2002,5,13,0.886858141,3
"ENG_062_MZB_LO_1700","ENG_062_MZB_LO_1700-29.03.2005","29.03.2005",2005,3,29,0.817655272,3
"ENG_062_MZB_LO_1700","ENG_062_MZB_LO_1700-07.05.2008","07.05.2008",2008,5,7,0.848503842,3
"ENG_062_MZB_LO_1700","ENG_062_MZB_LO_1700-14.05.2012","14.05.2012",2012,5,14,0.833807241,3
"ENG_062_MZB_LO_1700","ENG_062_MZB_LO_1700-11.04.2013","11.04.2013",2013,4,11,0.846635849,3
"ENG_062_MZB_LO_1700","ENG_062_MZB_LO_1700-04.03.2015","04.03.2015",2015,3,4,0.853984905,3
"ENG_062_MZB_LO_1700","ENG_062_MZB_LO_1700-08.03.2024","08.03.2024",2024,3,8,0.999851657,1
"ENG_062_MZB_LO_1701","ENG_062_MZB_LO_1701-19.10.2004","19.10.2004",2004,10,19,0.82584248,3
"ENG_062_MZB_LO_1701","ENG_062_MZB_LO_1701-19.10.2005","19.10.2005",2005,10,19,0.841947386,3
"ENG_062_MZB_LO_1701","ENG_062_MZB_LO_1701-05.09.2006","05.09.2006",2006,9,5,0.827020982,3
"ENG_062_MZB_LO_1701","ENG_062_MZB_LO_1701-28.09.2007","28.09.2007",2007,9,28,0.840266557,3
"ENG_062_MZB_LO_1701","ENG_062_MZB_LO_1701-07.10.2008","07.10.2008",2008,10,7,0.819228952,3
"ENG_062_MZB_LO_1701","ENG_062_MZB_LO_1701-13.10.2009","13.10.2009",2009,10,13,0.901354807,2
"ENG_062_MZB_LO_1701","ENG_062_MZB_LO_1701-07.10.2010","07.10.2010",2010,10,7,0.845165993,3
"ENG_062_MZB_LO_1701","ENG_062_MZB_LO_1701-25.10.2011","25.10.2011",2011,10,25,0.834848588,3
"ENG_062_MZB_LO_1701","ENG_062_MZB_LO_1701-17.10.2013","17.10.2013",2013,10,17,0.842442622,3
"ENG_062_MZB_LO_1701","ENG_062_MZB_LO_1701-10.10.2016","10.10.2016",2016,10,10,0.885991686,2
"ENG_062_MZB_LO_1702","ENG_062_MZB_LO_1702-04.04.2002","04.04.2002",2002,4,4,1.004024619,1
"ENG_062_MZB_LO_1702","ENG_062_MZB_LO_1702-04.03.2003","04.03.2003",2003,3,4,1.042429186,1
"ENG_062_MZB_LO_1702","ENG_062_MZB_LO_1702-12.04.2006","12.04.2006",2006,4,12,1.028041484,1
"ENG_062_MZB_LO_1702","ENG_062_MZB_LO_1702-20.04.2007","20.04.2007",2007,4,20,1.055041057,1
"ENG_062_MZB_LO_1702","ENG_062_MZB_LO_1702-16.05.2008","16.05.2008",2008,5,16,1.016319142,1
"ENG_062_MZB_LO_1702","ENG_062_MZB_LO_1702-01.05.2009","01.05.2009",2009,5,1,1.003689007,1
"ENG_062_MZB_LO_1702","ENG_062_MZB_LO_1702-26.04.2010","26.04.2010",2010,4,26,0.961231504,2
"ENG_062_MZB_LO_1702","ENG_062_MZB_LO_1702-25.05.2011","25.05.2011",2011,5,25,0.960002814,2
"ENG_062_MZB_LO_1702","ENG_062_MZB_LO_1702-21.03.2012","21.03.2012",2012,3,21,0.938174977,2
"ENG_062_MZB_LO_1703","ENG_062_MZB_LO_1703-28.10.2004","28.10.2004",2004,10,28,0.766974426,3
"ENG_062_MZB_LO_1703","ENG_062_MZB_LO_1703-19.09.2006","19.09.2006",2006,9,19,0.723506701,5
"ENG_062_MZB_LO_1703","ENG_062_MZB_LO_1703-26.10.2007","26.10.2007",2007,10,26,0.783932281,3
"ENG_062_MZB_LO_1703","ENG_062_MZB_LO_1703-10.10.2008","10.10.2008",2008,10,10,0.769278198,3
"ENG_062_MZB_LO_1703","ENG_062_MZB_LO_1703-27.10.2009","27.10.2009",2009,10,27,0.796056089,3
"ENG_062_MZB_LO_1703","ENG_062_MZB_LO_1703-15.10.2010","15.10.2010",2010,10,15,0.737043117,4
"ENG_062_MZB_LO_1703","ENG_062_MZB_LO_1703-29.10.2012","29.10.2012",2012,10,29,0.829170799,5
"ENG_062_MZB_LO_1703","ENG_062_MZB_LO_1703-05.11.2015","05.11.2015",2015,11,5,0.828548912,3
"ENG_062_MZB_LO_1703","ENG_062_MZB_LO_1703-03.09.2018","03.09.2018",2018,9,3,0.871696597,2
"ENG_062_MZB_LO_1704","ENG_062_MZB_LO_1704-26.11.2002","26.11.2002",2002,11,26,0.649339548,4
"ENG_062_MZB_LO_1704","ENG_062_MZB_LO_1704-23.11.2007","23.11.2007",2007,11,23,0.671506379,4
"ENG_062_MZB_LO_1704","ENG_062_MZB_LO_1704-17.11.2008","17.11.2008",2008,11,17,0.654083368,4
"ENG_062_MZB_LO_1704","ENG_062_MZB_LO_1704-23.11.2009","23.11.2009",2009,11,23,0.707234322,4
"ENG_062_MZB_LO_1704","ENG_062_MZB_LO_1704-02.11.2010","02.11.2010",2010,11,2,0.699454202,4
"ENG_062_MZB_LO_1704","ENG_062_MZB_LO_1704-07.11.2012","07.11.2012",2012,11,7,0.69547975,4
"ENG_062_MZB_LO_1704","ENG_062_MZB_LO_1704-15.09.2014","15.09.2014",2014,9,15,0.692384434,4
"ENG_062_MZB_LO_1706","ENG_062_MZB_LO_1706-30.04.2002","30.04.2002",2002,4,30,0.843199809,3
"ENG_062_MZB_LO_1706","ENG_062_MZB_LO_1706-25.05.2004","25.05.2004",2004,5,25,0.854687629,3
"ENG_062_MZB_LO_1706","ENG_062_MZB_LO_1706-23.04.2007","23.04.2007",2007,4,23,0.918472075,2
"ENG_062_MZB_LO_1706","ENG_062_MZB_LO_1706-08.05.2008","08.05.2008",2008,5,8,0.961688073,2
"ENG_062_MZB_LO_1706","ENG_062_MZB_LO_1706-25.04.2013","25.04.2013",2013,4,25,0.815112053,3
"ENG_062_MZB_LO_1706","ENG_062_MZB_LO_1706-25.03.2014","25.03.2014",2014,3,25,0.893980528,2
"ENG_062_MZB_LO_1706","ENG_062_MZB_LO_1706-21.03.2017","21.03.2017",2017,3,21,0.841274729,3
"ENG_062_MZB_LO_1708","ENG_062_MZB_LO_1708-29.10.2003","29.10.2003",2003,10,29,0.776624108,3
"ENG_062_MZB_LO_1708","ENG_062_MZB_LO_1708-25.09.2004","25.09.2004",2004,9,25,0.764201758,3
"ENG_062_MZB_LO_1708","ENG_062_MZB_LO_1708-30.10.2006","30.10.2006",2006,10,30,0.694523176,5
"ENG_062_MZB_LO_1708","ENG_062_MZB_LO_1708-11.11.2009","11.11.2009",2009,11,11,0.767032155,3
"ENG_062_MZB_LO_1708","ENG_062_MZB_LO_1708-20.10.2010","20.10.2010",2010,10,20,0.795129414,3
"ENG_062_MZB_LO_1708","ENG_062_MZB_LO_1708-05.10.2015","05.10.2015",2015,10,5,0.802354674,3
"ENG_062_MZB_LO_1708","ENG_062_MZB_LO_1708-12.09.2019","12.09.2019",2019,9,12,0.820661534,3
"ENG_062_MZB_LO_1708","ENG_062_MZB_LO_1708-22.09.2020","22.09.2020",2020,9,22,0.795515269,4
"ENG_062_MZB_LO_1708","ENG_062_MZB_LO_1708-10.11.2021","10.11.2021",2021,11,10,0.832573081,3
"ENG_062_MZB_LO_1708","ENG_062_MZB_LO_1708-14.11.2023","14.11.2023",2023,11,14,0.807506269,3
"ENG_062_MZB_LO_1708","ENG_062_MZB_LO_1708-28.10.2024","28.10.2024",2024,10,28,0.766764268,3
"ENG_062_MZB_LO_1710","ENG_062_MZB_LO_1710-22.11.2005","22.11.2005",2005,11,22,0.849988368,3
"ENG_062_MZB_LO_1710","ENG_062_MZB_LO_1710-03.11.2006","03.11.2006",2006,11,3,0.789470275,3
"ENG_062_MZB_LO_1710","ENG_062_MZB_LO_1710-23.10.2007","23.10.2007",2007,10,23,0.907291469,2
"ENG_062_MZB_LO_1710","ENG_062_MZB_LO_1710-30.10.2008","30.10.2008",2008,10,30,0.926789079,2
"ENG_062_MZB_LO_1710","ENG_062_MZB_LO_1710-06.10.2011","06.10.2011",2011,10,6,0.931615847,2
"ENG_062_MZB_LO_1710","ENG_062_MZB_LO_1710-09.10.2013","09.10.2013",2013,10,9,0.844524129,3
"ENG_062_MZB_LO_1710","ENG_062_MZB_LO_1710-04.10.2016","04.10.2016",2016,10,4,0.85365915,3
"ENG_062_MZB_LO_1710","ENG_062_MZB_LO_1710-27.10.2017","27.10.2017",2017,10,27,0.73301083,4
"ENG_062_MZB_LO_1711","ENG_062_MZB_LO_1711-17.10.2002","17.10.2002",2002,10,17,0.944344784,2
"ENG_062_MZB_LO_1711","ENG_062_MZB_LO_1711-14.10.2003","14.10.2003",2003,10,14,0.973975112,1
"ENG_062_MZB_LO_1711","ENG_062_MZB_LO_1711-13.09.2006","13.09.2006",2006,9,13,1.043710315,1
"ENG_062_MZB_LO_1711","ENG_062_MZB_LO_1711-30.10.2008","30.10.2008",2008,10,30,0.997740647,1
"ENG_062_MZB_LO_1711","ENG_062_MZB_LO_1711-13.10.2009","13.10.2009",2009,10,13,0.983875338,1
"ENG_062_MZB_LO_1711","ENG_062_MZB_LO_1711-27.09.2010","27.09.2010",2010,9,27,0.941817645,2
"ENG_062_MZB_LO_1711","ENG_062_MZB_LO_1711-03.10.2011","03.10.2011",2011,10,3,0.963314761,2
"ENG_062_MZB_LO_1711","ENG_062_MZB_LO_1711-07.09.2012","07.09.2012",2012,9,7,0.994822525,1
"ENG_062_MZB_LO_1711","ENG_062_MZB_LO_1711-17.09.2013","17.09.2013",2013,9,17,1.011403582,1
"ENG_062_MZB_LO_1711","ENG_062_MZB_LO_1711-19.10.2014","19.10.2014",2014,10,19,0.984472272,2
"ENG_062_MZB_LO_1711","ENG_062_MZB_LO_1711-19.10.2015","19.10.2015",2015,10,19,0.99252332,1
"ENG_062_MZB_LO_1711","ENG_062_MZB_LO_1711-18.10.2016","18.10.2016",2016,10,18,1.030863452,1
"ENG_062_MZB_LO_1711","ENG_062_MZB_LO_1711-14.09.2017","14.09.2017",2017,9,14,0.997811466,1
"ENG_062_MZB_LO_1711","ENG_062_MZB_LO_1711-13.11.2018","13.11.2018",2018,11,13,0.949792888,2
"ENG_062_MZB_LO_1711","ENG_062_MZB_LO_1711-05.11.2019","05.11.2019",2019,11,5,1.005228801,2
"ENG_062_MZB_LO_1711","ENG_062_MZB_LO_1711-25.09.2020","25.09.2020",2020,9,25,0.948212777,2
"ENG_062_MZB_LO_1711","ENG_062_MZB_LO_1711-21.09.2021","21.09.2021",2021,9,21,0.970582541,2
"ENG_062_MZB_LO_1711","ENG_062_MZB_LO_1711-15.09.2022","15.09.2022",2022,9,15,0.887373526,2
"ENG_062_MZB_LO_1711","ENG_062_MZB_LO_1711-05.10.2023","05.10.2023",2023,10,5,0.923930027,2
"ENG_062_MZB_LO_1713","ENG_062_MZB_LO_1713-03.04.2002","03.04.2002",2002,4,3,0.934896915,2
"ENG_062_MZB_LO_1713","ENG_062_MZB_LO_1713-03.04.2003","03.04.2003",2003,4,3,1.006346067,1
"ENG_062_MZB_LO_1713","ENG_062_MZB_LO_1713-12.05.2005","12.05.2005",2005,5,12,1.043694173,1
"ENG_062_MZB_LO_1713","ENG_062_MZB_LO_1713-08.05.2006","08.05.2006",2006,5,8,0.998335773,1
"ENG_062_MZB_LO_1713","ENG_062_MZB_LO_1713-25.05.2007","25.05.2007",2007,5,25,0.966713097,3
"ENG_062_MZB_LO_1713","ENG_062_MZB_LO_1713-25.04.2013","25.04.2013",2013,4,25,0.918151166,2
"ENG_062_MZB_LO_1713","ENG_062_MZB_LO_1713-07.05.2019","07.05.2019",2019,5,7,1.037038095,1
"ENG_062_MZB_LO_1713","ENG_062_MZB_LO_1713-14.04.2022","14.04.2022",2022,4,14,1.013343139,1
"ENG_062_MZB_LO_1715","ENG_062_MZB_LO_1715-06.10.2005","06.10.2005",2005,10,6,0.952300169,2
"ENG_062_MZB_LO_1715","ENG_062_MZB_LO_1715-01.11.2006","01.11.2006",2006,11,1,0.889981248,2
"ENG_062_MZB_LO_1715","ENG_062_MZB_LO_1715-28.09.2007","28.09.2007",2007,9,28,0.803776466,3
"ENG_062_MZB_LO_1715","ENG_062_MZB_LO_1715-20.10.2008","20.10.2008",2008,10,20,0.74116226,3
"ENG_062_MZB_LO_1715","ENG_062_MZB_LO_1715-08.10.2021","08.10.2021",2021,10,8,0.841885244,3
"ENG_062_MZB_LO_1715","ENG_062_MZB_LO_1715-20.10.2022","20.10.2022",2022,10,20,0.816048627,3
"ENG_062_MZB_LO_1715","ENG_062_MZB_LO_1715-25.09.2023","25.09.2023",2023,9,25,0.930408217,2
"ENG_062_MZB_LO_1716","ENG_062_MZB_LO_1716-29.10.2003","29.10.2003",2003,10,29,0.635239056,5
"ENG_062_MZB_LO_1716","ENG_062_MZB_LO_1716-25.09.2004","25.09.2004",2004,9,25,0.703376299,4
"ENG_062_MZB_LO_1716","ENG_062_MZB_LO_1716-26.10.2007","26.10.2007",2007,10,26,0.760896881,4
"ENG_062_MZB_LO_1716","ENG_062_MZB_LO_1716-11.11.2009","11.11.2009",2009,11,11,0.76869623,3
"ENG_062_MZB_LO_1716","ENG_062_MZB_LO_1716-20.10.2010","20.10.2010",2010,10,20,0.695771684,4
"ENG_062_MZB_LO_1716","ENG_062_MZB_LO_1716-05.10.2015","05.10.2015",2015,10,5,0.744618277,3
"ENG_062_MZB_LO_1716","ENG_062_MZB_LO_1716-16.10.2019","16.10.2019",2019,10,16,0.670977742,4
"ENG_062_MZB_LO_1716","ENG_062_MZB_LO_1716-22.09.2020","22.09.2020",2020,9,22,0.791426754,3
"ENG_062_MZB_LO_1716","ENG_062_MZB_LO_1716-10.09.2021","10.09.2021",2021,9,10,0.730322608,3
"ENG_062_MZB_LO_1716","ENG_062_MZB_LO_1716-14.11.2023","14.11.2023",2023,11,14,0.753191106,3
"ENG_062_MZB_LO_1721","ENG_062_MZB_LO_1721-09.10.2013","09.10.2013",2013,10,9,0.720397023,4
"ENG_062_MZB_LO_1721","ENG_062_MZB_LO_1721-09.10.2017","09.10.2017",2017,10,9,0.889163673,2
"ENG_062_MZB_LO_1721","ENG_062_MZB_LO_1721-01.10.2018","01.10.2018",2018,10,1,0.847953167,3
"ENG_062_MZB_LO_1721","ENG_062_MZB_LO_1721-10.10.2019","10.10.2019",2019,10,10,0.874155705,3
"ENG_062_MZB_LO_1721","ENG_062_MZB_LO_1721-17.09.2020","17.09.2020",2020,9,17,0.872126944,2
"ENG_062_MZB_LO_1721","ENG_062_MZB_LO_1721-07.09.2021","07.09.2021",2021,9,7,0.834444753,5
"ENG_062_MZB_LO_1721","ENG_062_MZB_LO_1721-16.09.2022","16.09.2022",2022,9,16,0.823463206,3
"ENG_062_MZB_LO_1721","ENG_062_MZB_LO_1721-04.09.2023","04.09.2023",2023,9,4,0.765978962,3
"ENG_062_MZB_LO_1722","ENG_062_MZB_LO_1722-01.10.2003","01.10.2003",2003,10,1,0.863603037,3
"ENG_062_MZB_LO_1722","ENG_062_MZB_LO_1722-15.10.2004","15.10.2004",2004,10,15,0.755232558,3
"ENG_062_MZB_LO_1722","ENG_062_MZB_LO_1722-12.09.2006","12.09.2006",2006,9,12,0.806201151,3
"ENG_062_MZB_LO_1722","ENG_062_MZB_LO_1722-22.09.2008","22.09.2008",2008,9,22,0.900578993,5
"ENG_062_MZB_LO_1722","ENG_062_MZB_LO_1722-19.10.2009","19.10.2009",2009,10,19,0.795688933,3
"ENG_062_MZB_LO_1722","ENG_062_MZB_LO_1722-07.10.2013","07.10.2013",2013,10,7,0.837558253,5
"ENG_062_MZB_LO_1722","ENG_062_MZB_LO_1722-19.10.2014","19.10.2014",2014,10,19,0.776703274,3
"ENG_062_MZB_LO_1722","ENG_062_MZB_LO_1722-13.10.2015","13.10.2015",2015,10,13,0.816661166,3
"ENG_062_MZB_LO_1722","ENG_062_MZB_LO_1722-05.11.2018","05.11.2018",2018,11,5,0.806670816,4
"ENG_062_MZB_LO_1722","ENG_062_MZB_LO_1722-20.11.2019","20.11.2019",2019,11,20,0.749289713,5
"ENG_062_MZB_LO_1722","ENG_062_MZB_LO_1722-28.10.2020","28.10.2020",2020,10,28,0.785008146,3
"ENG_062_MZB_LO_1724","ENG_062_MZB_LO_1724-15.10.2002","15.10.2002",2002,10,15,0.790092573,3
"ENG_062_MZB_LO_1724","ENG_062_MZB_LO_1724-30.11.2003","30.11.2003",2003,11,30,0.629931961,5
"ENG_062_MZB_LO_1724","ENG_062_MZB_LO_1724-05.10.2004","05.10.2004",2004,10,5,0.557289344,5
"ENG_062_MZB_LO_1724","ENG_062_MZB_LO_1724-12.10.2005","12.10.2005",2005,10,12,0.692619639,4
"ENG_062_MZB_LO_1724","ENG_062_MZB_LO_1724-27.09.2007","27.09.2007",2007,9,27,0.713513288,4
"ENG_062_MZB_LO_1724","ENG_062_MZB_LO_1724-06.09.2013","06.09.2013",2013,9,6,0.747294641,3
"ENG_062_MZB_LO_1724","ENG_062_MZB_LO_1724-01.09.2016","01.09.2016",2016,9,1,0.786488738,3
"ENG_062_MZB_LO_1726","ENG_062_MZB_LO_1726-31.10.2002","31.10.2002",2002,10,31,0.93813878,2
"ENG_062_MZB_LO_1726","ENG_062_MZB_LO_1726-06.11.2003","06.11.2003",2003,11,6,0.890757655,2
"ENG_062_MZB_LO_1726","ENG_062_MZB_LO_1726-30.09.2004","30.09.2004",2004,9,30,0.909184214,3
"ENG_062_MZB_LO_1726","ENG_062_MZB_LO_1726-26.10.2005","26.10.2005",2005,10,26,0.924200715,3
"ENG_062_MZB_LO_1726","ENG_062_MZB_LO_1726-21.09.2006","21.09.2006",2006,9,21,0.891028101,3
"ENG_062_MZB_LO_1726","ENG_062_MZB_LO_1726-09.11.2009","09.11.2009",2009,11,9,0.915519244,3
"ENG_062_MZB_LO_1726","ENG_062_MZB_LO_1726-03.10.2012","03.10.2012",2012,10,3,0.865757642,3
"ENG_062_MZB_LO_1726","ENG_062_MZB_LO_1726-11.09.2015","11.09.2015",2015,9,11,0.874434202,3
"ENG_062_MZB_LO_1729","ENG_062_MZB_LO_1729-03.05.2002","03.05.2002",2002,5,3,0.822819559,3
"ENG_062_MZB_LO_1729","ENG_062_MZB_LO_1729-03.04.2003","03.04.2003",2003,4,3,0.823509191,3
"ENG_062_MZB_LO_1729","ENG_062_MZB_LO_1729-15.04.2004","15.04.2004",2004,4,15,0.851554664,3
"ENG_062_MZB_LO_1729","ENG_062_MZB_LO_1729-31.05.2006","31.05.2006",2006,5,31,0.828522666,3
"ENG_062_MZB_LO_1729","ENG_062_MZB_LO_1729-29.04.2008","29.04.2008",2008,4,29,0.925975387,3
"ENG_062_MZB_LO_1729","ENG_062_MZB_LO_1729-11.03.2013","11.03.2013",2013,3,11,0.9739021,2
"ENG_062_MZB_LO_1729","ENG_062_MZB_LO_1729-09.04.2015","09.04.2015",2015,4,9,0.870114001,2
"ENG_062_MZB_LO_1729","ENG_062_MZB_LO_1729-20.05.2019","20.05.2019",2019,5,20,0.598522435,5
"ENG_062_MZB_LO_1733","ENG_062_MZB_LO_1733-21.10.2002","21.10.2002",2002,10,21,0.998573065,1
"ENG_062_MZB_LO_1733","ENG_062_MZB_LO_1733-22.09.2003","22.09.2003",2003,9,22,0.991914023,1
"ENG_062_MZB_LO_1733","ENG_062_MZB_LO_1733-02.11.2004","02.11.2004",2004,11,2,0.922393578,2
"ENG_062_MZB_LO_1733","ENG_062_MZB_LO_1733-25.10.2005","25.10.2005",2005,10,25,0.873752278,2
"ENG_062_MZB_LO_1733","ENG_062_MZB_LO_1733-29.09.2006","29.09.2006",2006,9,29,0.990927928,1
"ENG_062_MZB_LO_1733","ENG_062_MZB_LO_1733-23.10.2007","23.10.2007",2007,10,23,0.933622829,2
"ENG_062_MZB_LO_1733","ENG_062_MZB_LO_1733-13.11.2008","13.11.2008",2008,11,13,0.994015676,1
"ENG_062_MZB_LO_1733","ENG_062_MZB_LO_1733-19.10.2009","19.10.2009",2009,10,19,0.949469878,2
"ENG_062_MZB_LO_1733","ENG_062_MZB_LO_1733-07.10.2010","07.10.2010",2010,10,7,0.972116778,1
"ENG_062_MZB_LO_1733","ENG_062_MZB_LO_1733-15.09.2011","15.09.2011",2011,9,15,0.955162512,2
"ENG_062_MZB_LO_1733","ENG_062_MZB_LO_1733-17.09.2012","17.09.2012",2012,9,17,0.971452253,1
"ENG_062_MZB_LO_1733","ENG_062_MZB_LO_1733-02.10.2013","02.10.2013",2013,10,2,0.94262698,2
"ENG_062_MZB_LO_1733","ENG_062_MZB_LO_1733-24.10.2014","24.10.2014",2014,10,24,1.02318969,1
"ENG_062_MZB_LO_1733","ENG_062_MZB_LO_1733-02.09.2015","02.09.2015",2015,9,2,0.957666941,2
"ENG_062_MZB_LO_1733","ENG_062_MZB_LO_1733-10.10.2016","10.10.2016",2016,10,10,1.008359427,1
"ENG_062_MZB_LO_1733","ENG_062_MZB_LO_1733-06.11.2017","06.11.2017",2017,11,6,0.986740544,1
"ENG_062_MZB_LO_1733","ENG_062_MZB_LO_1733-11.09.2018","11.09.2018",2018,9,11,0.887121333,2
"ENG_062_MZB_LO_1733","ENG_062_MZB_LO_1733-22.10.2019","22.10.2019",2019,10,22,1.052570628,1
"ENG_062_MZB_LO_1733","ENG_062_MZB_LO_1733-23.10.2020","23.10.2020",2020,10,23,0.963784407,2
"ENG_062_MZB_LO_1733","ENG_062_MZB_LO_1733-27.10.2021","27.10.2021",2021,10,27,1.000389036,1
"ENG_062_MZB_LO_1733","ENG_062_MZB_LO_1733-26.09.2022","26.09.2022",2022,9,26,0.961359494,2
"ENG_062_MZB_LO_1733","ENG_062_MZB_LO_1733-09.10.2023","09.10.2023",2023,10,9,0.866732087,2
"ENG_062_MZB_LO_1733","ENG_062_MZB_LO_1733-24.10.2024","24.10.2024",2024,10,24,0.930536855,2
"ENG_062_MZB_LO_1734","ENG_062_MZB_LO_1734-30.11.2003","30.11.2003",2003,11,30,0.792009353,3
"ENG_062_MZB_LO_1734","ENG_062_MZB_LO_1734-01.10.2004","01.10.2004",2004,10,1,0.706670354,4
"ENG_062_MZB_LO_1734","ENG_062_MZB_LO_1734-13.10.2005","13.10.2005",2005,10,13,0.813242807,3
"ENG_062_MZB_LO_1734","ENG_062_MZB_LO_1734-21.11.2006","21.11.2006",2006,11,21,0.734177202,3
"ENG_062_MZB_LO_1734","ENG_062_MZB_LO_1734-18.10.2007","18.10.2007",2007,10,18,0.752704806,3
"ENG_062_MZB_LO_1734","ENG_062_MZB_LO_1734-17.09.2008","17.09.2008",2008,9,17,0.733527888,3
"ENG_062_MZB_LO_1734","ENG_062_MZB_LO_1734-13.10.2009","13.10.2009",2009,10,13,0.815268753,3
"ENG_062_MZB_LO_1734","ENG_062_MZB_LO_1734-07.10.2010","07.10.2010",2010,10,7,0.815983222,3
"ENG_062_MZB_LO_1734","ENG_062_MZB_LO_1734-22.10.2015","22.10.2015",2015,10,22,0.773078801,3
"ENG_062_MZB_LO_1735","ENG_062_MZB_LO_1735-04.09.2002","04.09.2002",2002,9,4,1.003993148,1
"ENG_062_MZB_LO_1735","ENG_062_MZB_LO_1735-29.10.2003","29.10.2003",2003,10,29,1.003588017,1
"ENG_062_MZB_LO_1735","ENG_062_MZB_LO_1735-21.09.2005","21.09.2005",2005,9,21,0.917821769,3
"ENG_062_MZB_LO_1735","ENG_062_MZB_LO_1735-30.10.2007","30.10.2007",2007,10,30,1.009146742,1
"ENG_062_MZB_LO_1735","ENG_062_MZB_LO_1735-18.09.2008","18.09.2008",2008,9,18,0.936915547,2
"ENG_062_MZB_LO_1735","ENG_062_MZB_LO_1735-05.10.2009","05.10.2009",2009,10,5,1.002764758,1
"ENG_062_MZB_LO_1735","ENG_062_MZB_LO_1735-28.09.2010","28.09.2010",2010,9,28,1.043269015,1
"ENG_062_MZB_LO_1735","ENG_062_MZB_LO_1735-13.10.2011","13.10.2011",2011,10,13,1.020716514,1
"ENG_062_MZB_LO_1735","ENG_062_MZB_LO_1735-31.10.2012","31.10.2012",2012,10,31,0.961325639,2
"ENG_062_MZB_LO_1735","ENG_062_MZB_LO_1735-03.09.2013","03.09.2013",2013,9,3,1.004005733,1
"ENG_062_MZB_LO_1735","ENG_062_MZB_LO_1735-23.09.2014","23.09.2014",2014,9,23,1.022498392,1
"ENG_062_MZB_LO_1735","ENG_062_MZB_LO_1735-23.09.2015","23.09.2015",2015,9,23,0.80266313,3
"ENG_062_MZB_LO_1735","ENG_062_MZB_LO_1735-01.09.2016","01.09.2016",2016,9,1,0.979293461,1
"ENG_062_MZB_LO_1735","ENG_062_MZB_LO_1735-01.11.2017","01.11.2017",2017,11,1,1.003670756,1
"ENG_062_MZB_LO_1735","ENG_062_MZB_LO_1735-09.10.2018","09.10.2018",2018,10,9,0.949979076,2
"ENG_062_MZB_LO_1735","ENG_062_MZB_LO_1735-20.11.2019","20.11.2019",2019,11,20,0.961704338,2
"ENG_062_MZB_LO_1735","ENG_062_MZB_LO_1735-17.09.2020","17.09.2020",2020,9,17,0.96134169,2
"ENG_062_MZB_LO_1735","ENG_062_MZB_LO_1735-03.09.2021","03.09.2021",2021,9,3,0.965313417,2
"ENG_062_MZB_LO_1735","ENG_062_MZB_LO_1735-18.09.2023","18.09.2023",2023,9,18,0.990259351,1
"ENG_062_MZB_LO_1736","ENG_062_MZB_LO_1736-08.10.2002","08.10.2002",2002,10,8,0.647528055,4
"ENG_062_MZB_LO_1736","ENG_062_MZB_LO_1736-30.11.2003","30.11.2003",2003,11,30,0.519972854,5
"ENG_062_MZB_LO_1736","ENG_062_MZB_LO_1736-05.11.2004","05.11.2004",2004,11,5,0.645131984,5
"ENG_062_MZB_LO_1736","ENG_062_MZB_LO_1736-23.11.2007","23.11.2007",2007,11,23,0.601823978,5
"ENG_062_MZB_LO_1736","ENG_062_MZB_LO_1736-21.09.2010","21.09.2010",2010,9,21,0.702769961,4
"ENG_062_MZB_LO_1736","ENG_062_MZB_LO_1736-19.11.2013","19.11.2013",2013,11,19,0.722453918,4
"ENG_062_MZB_LO_1736","ENG_062_MZB_LO_1736-21.10.2016","21.10.2016",2016,10,21,0.717186658,5
"ENG_062_MZB_LO_1737","ENG_062_MZB_LO_1737-26.09.2002","26.09.2002",2002,9,26,0.806164814,3
"ENG_062_MZB_LO_1737","ENG_062_MZB_LO_1737-03.10.2005","03.10.2005",2005,10,3,0.723565072,3
"ENG_062_MZB_LO_1737","ENG_062_MZB_LO_1737-16.09.2008","16.09.2008",2008,9,16,0.813246547,3
"ENG_062_MZB_LO_1737","ENG_062_MZB_LO_1737-28.10.2009","28.10.2009",2009,10,28,0.802950838,3
"ENG_062_MZB_LO_1737","ENG_062_MZB_LO_1737-22.10.2010","22.10.2010",2010,10,22,0.804272878,3
"ENG_062_MZB_LO_1737","ENG_062_MZB_LO_1737-19.09.2011","19.09.2011",2011,9,19,0.783645644,3
"ENG_062_MZB_LO_1737","ENG_062_MZB_LO_1737-06.09.2012","06.09.2012",2012,9,6,0.860265568,3
"ENG_062_MZB_LO_1737","ENG_062_MZB_LO_1737-30.10.2013","30.10.2013",2013,10,30,0.798516708,3
"ENG_062_MZB_LO_1737","ENG_062_MZB_LO_1737-23.10.2014","23.10.2014",2014,10,23,0.843674341,3
"ENG_062_MZB_LO_1737","ENG_062_MZB_LO_1737-17.09.2015","17.09.2015",2015,9,17,0.720597297,3
"ENG_062_MZB_LO_1737","ENG_062_MZB_LO_1737-19.09.2016","19.09.2016",2016,9,19,0.83490001,3
"ENG_062_MZB_LO_1737","ENG_062_MZB_LO_1737-19.09.2017","19.09.2017",2017,9,19,0.854909039,3
"ENG_062_MZB_LO_1737","ENG_062_MZB_LO_1737-04.09.2018","04.09.2018",2018,9,4,0.865763803,2
"ENG_062_MZB_LO_1737","ENG_062_MZB_LO_1737-03.10.2019","03.10.2019",2019,10,3,0.756360788,3
"ENG_062_MZB_LO_1737","ENG_062_MZB_LO_1737-25.09.2020","25.09.2020",2020,9,25,0.738125442,3
"ENG_062_MZB_LO_1737","ENG_062_MZB_LO_1737-18.11.2021","18.11.2021",2021,11,18,0.985588578,1
"ENG_062_MZB_LO_1737","ENG_062_MZB_LO_1737-09.09.2022","09.09.2022",2022,9,9,0.683627451,4
"ENG_062_MZB_LO_1737","ENG_062_MZB_LO_1737-17.10.2023","17.10.2023",2023,10,17,0.731078933,3
"ENG_062_MZB_LO_1737","ENG_062_MZB_LO_1737-03.09.2024","03.09.2024",2024,9,3,0.682535458,4
"ENG_062_MZB_LO_1740","ENG_062_MZB_LO_1740-19.09.2002","19.09.2002",2002,9,19,0.81089421,3
"ENG_062_MZB_LO_1740","ENG_062_MZB_LO_1740-18.11.2003","18.11.2003",2003,11,18,0.816710578,3
"ENG_062_MZB_LO_1740","ENG_062_MZB_LO_1740-04.11.2004","04.11.2004",2004,11,4,0.757827713,3
"ENG_062_MZB_LO_1740","ENG_062_MZB_LO_1740-02.10.2006","02.10.2006",2006,10,2,0.740011492,3
"ENG_062_MZB_LO_1740","ENG_062_MZB_LO_1740-28.10.2009","28.10.2009",2009,10,28,0.880542353,3
"ENG_062_MZB_LO_1740","ENG_062_MZB_LO_1740-21.10.2010","21.10.2010",2010,10,21,0.76491306,3
"ENG_062_MZB_LO_1740","ENG_062_MZB_LO_1740-16.11.2011","16.11.2011",2011,11,16,0.857670425,3
"ENG_062_MZB_LO_1740","ENG_062_MZB_LO_1740-09.09.2015","09.09.2015",2015,9,9,0.777838236,3
"ENG_062_MZB_LO_1741","ENG_062_MZB_LO_1741-30.11.2002","30.11.2002",2002,11,30,0.871275394,2
"ENG_062_MZB_LO_1741","ENG_062_MZB_LO_1741-25.11.2003","25.11.2003",2003,11,25,0.904714793,2
"ENG_062_MZB_LO_1741","ENG_062_MZB_LO_1741-01.10.2004","01.10.2004",2004,10,1,0.849273414,3
"ENG_062_MZB_LO_1741","ENG_062_MZB_LO_1741-13.10.2005","13.10.2005",2005,10,13,0.922294566,2
"ENG_062_MZB_LO_1741","ENG_062_MZB_LO_1741-21.11.2006","21.11.2006",2006,11,21,0.859891512,3
"ENG_062_MZB_LO_1741","ENG_062_MZB_LO_1741-18.10.2007","18.10.2007",2007,10,18,0.94527502,2
"ENG_062_MZB_LO_1741","ENG_062_MZB_LO_1741-17.09.2008","17.09.2008",2008,9,17,0.923799636,2
"ENG_062_MZB_LO_1741","ENG_062_MZB_LO_1741-13.10.2009","13.10.2009",2009,10,13,0.912245536,2
"ENG_062_MZB_LO_1741","ENG_062_MZB_LO_1741-07.10.2010","07.10.2010",2010,10,7,0.85051029,3
"ENG_062_MZB_LO_1741","ENG_062_MZB_LO_1741-19.09.2011","19.09.2011",2011,9,19,0.89184483,2
"ENG_062_MZB_LO_1741","ENG_062_MZB_LO_1741-09.10.2012","09.10.2012",2012,10,9,0.891138238,2
"ENG_062_MZB_LO_1741","ENG_062_MZB_LO_1741-04.11.2013","04.11.2013",2013,11,4,0.895714534,2
"ENG_062_MZB_LO_1741","ENG_062_MZB_LO_1741-09.09.2014","09.09.2014",2014,9,9,0.901670614,2
"ENG_062_MZB_LO_1741","ENG_062_MZB_LO_1741-16.09.2015","16.09.2015",2015,9,16,0.863988752,2
"ENG_062_MZB_LO_1741","ENG_062_MZB_LO_1741-15.11.2016","15.11.2016",2016,11,15,0.890024265,2
"ENG_062_MZB_LO_1741","ENG_062_MZB_LO_1741-23.10.2017","23.10.2017",2017,10,23,0.86764527,2
"ENG_062_MZB_LO_1741","ENG_062_MZB_LO_1741-25.09.2018","25.09.2018",2018,9,25,0.928248928,2
"ENG_062_MZB_LO_1741","ENG_062_MZB_LO_1741-28.10.2019","28.10.2019",2019,10,28,0.875873661,2
"ENG_062_MZB_LO_1741","ENG_062_MZB_LO_1741-30.10.2020","30.10.2020",2020,10,30,0.882152029,2
"ENG_062_MZB_LO_1741","ENG_062_MZB_LO_1741-28.10.2021","28.10.2021",2021,10,28,0.863895494,2
"ENG_062_MZB_LO_1741","ENG_062_MZB_LO_1741-26.09.2022","26.09.2022",2022,9,26,0.917312926,2
"ENG_062_MZB_LO_1741","ENG_062_MZB_LO_1741-05.10.2023","05.10.2023",2023,10,5,0.835419713,3
"ENG_062_MZB_LO_1741","ENG_062_MZB_LO_1741-15.10.2024","15.10.2024",2024,10,15,0.871987542,2
"ENG_062_MZB_LO_1742","ENG_062_MZB_LO_1742-25.09.2002","25.09.2002",2002,9,25,0.904651757,2
"ENG_062_MZB_LO_1742","ENG_062_MZB_LO_1742-28.09.2005","28.09.2005",2005,9,28,0.892465899,2
"ENG_062_MZB_LO_1742","ENG_062_MZB_LO_1742-04.09.2008","04.09.2008",2008,9,4,0.93263288,2
"ENG_062_MZB_LO_1742","ENG_062_MZB_LO_1742-30.10.2013","30.10.2013",2013,10,30,0.955667289,2
"ENG_062_MZB_LO_1742","ENG_062_MZB_LO_1742-15.09.2014","15.09.2014",2014,9,15,1.06286874,1
"ENG_062_MZB_LO_1742","ENG_062_MZB_LO_1742-08.09.2021","08.09.2021",2021,9,8,1.022684225,2
"ENG_062_MZB_LO_1742","ENG_062_MZB_LO_1742-27.10.2022","27.10.2022",2022,10,27,1.018678246,2
"ENG_062_MZB_LO_1742","ENG_062_MZB_LO_1742-29.09.2023","29.09.2023",2023,9,29,0.947547313,2
"ENG_062_MZB_LO_1743","ENG_062_MZB_LO_1743-12.09.2003","12.09.2003",2003,9,12,1.160592469,1
"ENG_062_MZB_LO_1743","ENG_062_MZB_LO_1743-21.09.2006","21.09.2006",2006,9,21,1.131570428,1
"ENG_062_MZB_LO_1743","ENG_062_MZB_LO_1743-15.10.2007","15.10.2007",2007,10,15,1.093238739,1
"ENG_062_MZB_LO_1743","ENG_062_MZB_LO_1743-23.10.2008","23.10.2008",2008,10,23,1.13730531,1
"ENG_062_MZB_LO_1743","ENG_062_MZB_LO_1743-07.10.2009","07.10.2009",2009,10,7,1.162769622,1
"ENG_062_MZB_LO_1743","ENG_062_MZB_LO_1743-02.11.2010","02.11.2010",2010,11,2,1.110618194,1
"ENG_062_MZB_LO_1743","ENG_062_MZB_LO_1743-21.09.2011","21.09.2011",2011,9,21,1.073546144,1
"ENG_062_MZB_LO_1743","ENG_062_MZB_LO_1743-11.10.2012","11.10.2012",2012,10,11,1.029261851,1
"ENG_062_MZB_LO_1743","ENG_062_MZB_LO_1743-18.09.2013","18.09.2013",2013,9,18,1.104438846,1
"ENG_062_MZB_LO_1743","ENG_062_MZB_LO_1743-29.10.2014","29.10.2014",2014,10,29,1.13937766,1
"ENG_062_MZB_LO_1743","ENG_062_MZB_LO_1743-02.09.2015","02.09.2015",2015,9,2,1.20294745,1
"ENG_062_MZB_LO_1743","ENG_062_MZB_LO_1743-01.09.2016","01.09.2016",2016,9,1,1.105461301,1
"ENG_062_MZB_LO_1743","ENG_062_MZB_LO_1743-03.10.2017","03.10.2017",2017,10,3,1.107783456,1
"ENG_062_MZB_LO_1743","ENG_062_MZB_LO_1743-11.09.2018","11.09.2018",2018,9,11,1.179811075,1
"ENG_062_MZB_LO_1743","ENG_062_MZB_LO_1743-02.09.2020","02.09.2020",2020,9,2,0.932870938,2
"ENG_062_MZB_LO_1743","ENG_062_MZB_LO_1743-22.09.2021","22.09.2021",2021,9,22,1.103912467,3
"ENG_062_MZB_LO_1743","ENG_062_MZB_LO_1743-20.10.2022","20.10.2022",2022,10,20,1.054115076,1
"ENG_062_MZB_LO_1744","ENG_062_MZB_LO_1744-09.10.2003","09.10.2003",2003,10,9,0.785310531,3
"ENG_062_MZB_LO_1744","ENG_062_MZB_LO_1744-14.11.2006","14.11.2006",2006,11,14,0.755538579,3
"ENG_062_MZB_LO_1744","ENG_062_MZB_LO_1744-13.10.2009","13.10.2009",2009,10,13,0.825744006,3
"ENG_062_MZB_LO_1744","ENG_062_MZB_LO_1744-08.09.2011","08.09.2011",2011,9,8,0.758246091,3
"ENG_062_MZB_LO_1744","ENG_062_MZB_LO_1744-14.11.2012","14.11.2012",2012,11,14,0.867167283,3
"ENG_062_MZB_LO_1744","ENG_062_MZB_LO_1744-18.11.2015","18.11.2015",2015,11,18,0.87524161,2
"ENG_062_MZB_LO_1744","ENG_062_MZB_LO_1744-24.10.2018","24.10.2018",2018,10,24,0.8072581,3
"ENG_062_MZB_LO_1746","ENG_062_MZB_LO_1746-04.04.2002","04.04.2002",2002,4,4,0.857697466,3
"ENG_062_MZB_LO_1746","ENG_062_MZB_LO_1746-04.03.2004","04.03.2004",2004,3,4,0.969512219,2
"ENG_062_MZB_LO_1746","ENG_062_MZB_LO_1746-02.05.2006","02.05.2006",2006,5,2,0.897596344,3
"ENG_062_MZB_LO_1746","ENG_062_MZB_LO_1746-04.04.2007","04.04.2007",2007,4,4,0.920262626,2
"ENG_062_MZB_LO_1746","ENG_062_MZB_LO_1746-15.05.2008","15.05.2008",2008,5,15,0.944482081,2
"ENG_062_MZB_LO_1746","ENG_062_MZB_LO_1746-19.03.2009","19.03.2009",2009,3,19,0.899065798,3
"ENG_062_MZB_LO_1746","ENG_062_MZB_LO_1746-10.03.2010","10.03.2010",2010,3,10,0.944983793,2
"ENG_062_MZB_LO_1746","ENG_062_MZB_LO_1746-05.05.2011","05.05.2011",2011,5,5,0.967324344,2
"ENG_062_MZB_LO_1748","ENG_062_MZB_LO_1748-22.09.2004","22.09.2004",2004,9,22,0.995985814,1
"ENG_062_MZB_LO_1748","ENG_062_MZB_LO_1748-11.10.2005","11.10.2005",2005,10,11,0.936952374,2
"ENG_062_MZB_LO_1748","ENG_062_MZB_LO_1748-18.10.2006","18.10.2006",2006,10,18,0.890733658,2
"ENG_062_MZB_LO_1748","ENG_062_MZB_LO_1748-08.10.2007","08.10.2007",2007,10,8,0.871812382,3
"ENG_062_MZB_LO_1748","ENG_062_MZB_LO_1748-13.10.2008","13.10.2008",2008,10,13,1.002046378,1
"ENG_062_MZB_LO_1748","ENG_062_MZB_LO_1748-30.09.2009","30.09.2009",2009,9,30,0.973371406,2
"ENG_062_MZB_LO_1748","ENG_062_MZB_LO_1748-25.10.2010","25.10.2010",2010,10,25,0.865966806,3
"ENG_062_MZB_LO_1748","ENG_062_MZB_LO_1748-09.09.2011","09.09.2011",2011,9,9,1.017221406,1
"ENG_062_MZB_LO_1748","ENG_062_MZB_LO_1748-20.09.2012","20.09.2012",2012,9,20,0.823944455,3
"ENG_062_MZB_LO_1748","ENG_062_MZB_LO_1748-21.11.2013","21.11.2013",2013,11,21,0.848079801,3
"ENG_062_MZB_LO_1748","ENG_062_MZB_LO_1748-13.11.2014","13.11.2014",2014,11,13,0.999290349,1
"ENG_062_MZB_LO_1748","ENG_062_MZB_LO_1748-11.09.2015","11.09.2015",2015,9,11,0.954480671,2
"ENG_062_MZB_LO_1748","ENG_062_MZB_LO_1748-15.11.2016","15.11.2016",2016,11,15,1.009663154,1
"ENG_062_MZB_LO_1748","ENG_062_MZB_LO_1748-25.11.2019","25.11.2019",2019,11,25,0.945832805,2
"ENG_062_MZB_LO_1748","ENG_062_MZB_LO_1748-29.10.2020","29.10.2020",2020,10,29,0.946248504,3
"ENG_062_MZB_LO_1748","ENG_062_MZB_LO_1748-17.11.2021","17.11.2021",2021,11,17,0.919424744,2
"ENG_062_MZB_LO_1748","ENG_062_MZB_LO_1748-26.09.2022","26.09.2022",2022,9,26,0.862746343,3
"ENG_062_MZB_LO_1748","ENG_062_MZB_LO_1748-28.09.2023","28.09.2023",2023,9,28,0.954606501,5
"ENG_062_MZB_LO_1748","ENG_062_MZB_LO_1748-08.11.2024","08.11.2024",2024,11,8,0.986861741,2
"ENG_062_MZB_LO_1749","ENG_062_MZB_LO_1749-14.10.2003","14.10.2003",2003,10,14,0.873286884,3
"ENG_062_MZB_LO_1749","ENG_062_MZB_LO_1749-15.11.2006","15.11.2006",2006,11,15,0.999873854,2
"ENG_062_MZB_LO_1749","ENG_062_MZB_LO_1749-22.10.2009","22.10.2009",2009,10,22,1.03761045,1
"ENG_062_MZB_LO_1749","ENG_062_MZB_LO_1749-09.09.2013","09.09.2013",2013,9,9,0.918732579,3
"ENG_062_MZB_LO_1749","ENG_062_MZB_LO_1749-29.09.2015","29.09.2015",2015,9,29,0.89740389,3
"ENG_062_MZB_LO_1749","ENG_062_MZB_LO_1749-18.09.2017","18.09.2017",2017,9,18,0.995605582,1
"ENG_062_MZB_LO_1749","ENG_062_MZB_LO_1749-10.10.2018","10.10.2018",2018,10,10,0.992908716,2
"ENG_062_MZB_LO_1749","ENG_062_MZB_LO_1749-19.09.2019","19.09.2019",2019,9,19,0.91873836,3
"ENG_062_MZB_LO_1749","ENG_062_MZB_LO_1749-11.10.2022","11.10.2022",2022,10,11,0.98596258,2
"ENG_062_MZB_LO_1749","ENG_062_MZB_LO_1749-14.09.2023","14.09.2023",2023,9,14,0.928852252,4
"ENG_062_MZB_LO_1750","ENG_062_MZB_LO_1750-31.10.2002","31.10.2002",2002,10,31,0.791426946,3
"ENG_062_MZB_LO_1750","ENG_062_MZB_LO_1750-12.11.2003","12.11.2003",2003,11,12,0.664767354,5
"ENG_062_MZB_LO_1750","ENG_062_MZB_LO_1750-25.09.2004","25.09.2004",2004,9,25,0.742329855,3
"ENG_062_MZB_LO_1750","ENG_062_MZB_LO_1750-26.10.2007","26.10.2007",2007,10,26,0.898545724,3
"ENG_062_MZB_LO_1750","ENG_062_MZB_LO_1750-20.10.2011","20.10.2011",2011,10,20,0.903411189,2
"ENG_062_MZB_LO_1750","ENG_062_MZB_LO_1750-16.10.2012","16.10.2012",2012,10,16,0.869627404,2
"ENG_062_MZB_LO_1750","ENG_062_MZB_LO_1750-12.10.2015","12.10.2015",2015,10,12,0.885119675,3
"ENG_062_MZB_LO_1750","ENG_062_MZB_LO_1750-02.11.2018","02.11.2018",2018,11,2,0.905856018,3
"ENG_062_MZB_LO_1750","ENG_062_MZB_LO_1750-20.11.2019","20.11.2019",2019,11,20,0.837232923,3
"ENG_062_MZB_LO_1750","ENG_062_MZB_LO_1750-25.09.2020","25.09.2020",2020,9,25,0.838449772,3
"ENG_062_MZB_LO_1750","ENG_062_MZB_LO_1750-07.09.2021","07.09.2021",2021,9,7,0.653527537,5
"ENG_062_MZB_LO_1750","ENG_062_MZB_LO_1750-06.09.2022","06.09.2022",2022,9,6,0.739751192,5
"ENG_062_MZB_LO_1750","ENG_062_MZB_LO_1750-14.11.2023","14.11.2023",2023,11,14,0.792902973,3
"ENG_062_MZB_LO_1750","ENG_062_MZB_LO_1750-30.10.2024","30.10.2024",2024,10,30,0.789993261,5
"ENG_062_MZB_LO_1751","ENG_062_MZB_LO_1751-12.04.2002","12.04.2002",2002,4,12,0.604127753,4
"ENG_062_MZB_LO_1751","ENG_062_MZB_LO_1751-03.04.2003","03.04.2003",2003,4,3,0.673634511,4
"ENG_062_MZB_LO_1751","ENG_062_MZB_LO_1751-30.03.2006","30.03.2006",2006,3,30,0.671585658,4
"ENG_062_MZB_LO_1751","ENG_062_MZB_LO_1751-20.05.2011","20.05.2011",2011,5,20,0.56467535,5
"ENG_062_MZB_LO_1751","ENG_062_MZB_LO_1751-17.05.2012","17.05.2012",2012,5,17,0.671601764,4
"ENG_062_MZB_LO_1751","ENG_062_MZB_LO_1751-15.05.2015","15.05.2015",2015,5,15,0.58792248,5
"ENG_062_MZB_LO_1751","ENG_062_MZB_LO_1751-29.05.2018","29.05.2018",2018,5,29,0.631869076,4
"ENG_062_MZB_LO_1753","ENG_062_MZB_LO_1753-25.04.2003","25.04.2003",2003,4,25,0.785679831,4
"ENG_062_MZB_LO_1753","ENG_062_MZB_LO_1753-23.04.2004","23.04.2004",2004,4,23,0.845706131,3
"ENG_062_MZB_LO_1753","ENG_062_MZB_LO_1753-07.05.2009","07.05.2009",2009,5,7,0.825945662,4
"ENG_062_MZB_LO_1753","ENG_062_MZB_LO_1753-25.04.2013","25.04.2013",2013,4,25,0.897078607,3
"ENG_062_MZB_LO_1753","ENG_062_MZB_LO_1753-14.04.2015","14.04.2015",2015,4,14,0.969041415,3
"ENG_062_MZB_LO_1753","ENG_062_MZB_LO_1753-26.05.2017","26.05.2017",2017,5,26,0.879488082,2
"ENG_062_MZB_LO_1753","ENG_062_MZB_LO_1753-09.05.2018","09.05.2018",2018,5,9,0.904784201,3
"ENG_062_MZB_LO_1754","ENG_062_MZB_LO_1754-29.09.2004","29.09.2004",2004,9,29,0.884305251,3
"ENG_062_MZB_LO_1754","ENG_062_MZB_LO_1754-01.11.2005","01.11.2005",2005,11,1,0.855283325,3
"ENG_062_MZB_LO_1754","ENG_062_MZB_LO_1754-13.11.2007","13.11.2007",2007,11,13,0.984256858,1
"ENG_062_MZB_LO_1754","ENG_062_MZB_LO_1754-15.10.2008","15.10.2008",2008,10,15,0.984551266,2
"ENG_062_MZB_LO_1754","ENG_062_MZB_LO_1754-08.10.2009","08.10.2009",2009,10,8,1.033716735,1
"ENG_062_MZB_LO_1754","ENG_062_MZB_LO_1754-07.10.2010","07.10.2010",2010,10,7,1.001201634,1
"ENG_062_MZB_LO_1754","ENG_062_MZB_LO_1754-17.10.2011","17.10.2011",2011,10,17,1.069254109,1
"ENG_062_MZB_LO_1754","ENG_062_MZB_LO_1754-12.09.2012","12.09.2012",2012,9,12,1.040330408,1
"ENG_062_MZB_LO_1754","ENG_062_MZB_LO_1754-12.11.2015","12.11.2015",2015,11,12,1.062929574,1
"ENG_062_MZB_LO_1754","ENG_062_MZB_LO_1754-15.09.2023","15.09.2023",2023,9,15,1.01170878,1
"ENG_062_MZB_LO_1754","ENG_062_MZB_LO_1754-06.11.2024","06.11.2024",2024,11,6,1.066267475,1
"ENG_062_MZB_LO_1756","ENG_062_MZB_LO_1756-01.10.2004","01.10.2004",2004,10,1,0.731305763,3
"ENG_062_MZB_LO_1756","ENG_062_MZB_LO_1756-05.09.2006","05.09.2006",2006,9,5,0.728104844,3
"ENG_062_MZB_LO_1756","ENG_062_MZB_LO_1756-28.09.2007","28.09.2007",2007,9,28,0.743573399,3
"ENG_062_MZB_LO_1756","ENG_062_MZB_LO_1756-07.11.2008","07.11.2008",2008,11,7,0.76613613,3
"ENG_062_MZB_LO_1756","ENG_062_MZB_LO_1756-21.09.2009","21.09.2009",2009,9,21,0.633493755,5
"ENG_062_MZB_LO_1756","ENG_062_MZB_LO_1756-20.09.2012","20.09.2012",2012,9,20,0.755630637,3
"ENG_062_MZB_LO_1756","ENG_062_MZB_LO_1756-15.09.2015","15.09.2015",2015,9,15,0.78522392,3
"ENG_062_MZB_LO_1757","ENG_062_MZB_LO_1757-19.09.2003","19.09.2003",2003,9,19,1.036282445,3
"ENG_062_MZB_LO_1757","ENG_062_MZB_LO_1757-13.10.2004","13.10.2004",2004,10,13,0.830696134,3
"ENG_062_MZB_LO_1757","ENG_062_MZB_LO_1757-14.10.2005","14.10.2005",2005,10,14,0.984879263,1
"ENG_062_MZB_LO_1757","ENG_062_MZB_LO_1757-20.09.2006","20.09.2006",2006,9,20,0.936729789,2
"ENG_062_MZB_LO_1757","ENG_062_MZB_LO_1757-27.09.2007","27.09.2007",2007,9,27,0.931972261,2
"ENG_062_MZB_LO_1757","ENG_062_MZB_LO_1757-19.09.2008","19.09.2008",2008,9,19,0.905496956,3
"ENG_062_MZB_LO_1757","ENG_062_MZB_LO_1757-08.10.2009","08.10.2009",2009,10,8,0.944469151,2
"ENG_062_MZB_LO_1757","ENG_062_MZB_LO_1757-02.09.2010","02.09.2010",2010,9,2,0.83722592,3
"ENG_062_MZB_LO_1757","ENG_062_MZB_LO_1757-09.11.2011","09.11.2011",2011,11,9,0.992493088,1
"ENG_062_MZB_LO_1757","ENG_062_MZB_LO_1757-16.11.2012","16.11.2012",2012,11,16,0.937613534,3
"ENG_062_MZB_LO_1757","ENG_062_MZB_LO_1757-15.10.2013","15.10.2013",2013,10,15,0.946730637,3
"ENG_062_MZB_LO_1757","ENG_062_MZB_LO_1757-04.09.2014","04.09.2014",2014,9,4,0.951304067,2
"ENG_062_MZB_LO_1757","ENG_062_MZB_LO_1757-17.09.2015","17.09.2015",2015,9,17,0.923763719,2
"ENG_062_MZB_LO_1757","ENG_062_MZB_LO_1757-14.09.2016","14.09.2016",2016,9,14,0.911325017,2
"ENG_062_MZB_LO_1757","ENG_062_MZB_LO_1757-11.10.2017","11.10.2017",2017,10,11,0.975204304,2
"ENG_062_MZB_LO_1757","ENG_062_MZB_LO_1757-30.10.2018","30.10.2018",2018,10,30,0.98409195,1
"ENG_062_MZB_LO_1757","ENG_062_MZB_LO_1757-09.09.2019","09.09.2019",2019,9,9,0.994356901,1
"ENG_062_MZB_LO_1757","ENG_062_MZB_LO_1757-02.09.2020","02.09.2020",2020,9,2,0.967591544,2
"ENG_062_MZB_LO_1757","ENG_062_MZB_LO_1757-10.09.2021","10.09.2021",2021,9,10,0.997506644,1
"ENG_062_MZB_LO_1757","ENG_062_MZB_LO_1757-13.09.2023","13.09.2023",2023,9,13,0.960210631,2
"ENG_062_MZB_LO_1760","ENG_062_MZB_LO_1760-09.09.2003","09.09.2003",2003,9,9,0.851257538,3
"ENG_062_MZB_LO_1760","ENG_062_MZB_LO_1760-15.09.2006","15.09.2006",2006,9,15,0.940825271,2
"ENG_062_MZB_LO_1760","ENG_062_MZB_LO_1760-27.10.2009","27.10.2009",2009,10,27,0.996689803,1
"ENG_062_MZB_LO_1760","ENG_062_MZB_LO_1760-14.10.2010","14.10.2010",2010,10,14,1.027886405,1
"ENG_062_MZB_LO_1760","ENG_062_MZB_LO_1760-19.09.2011","19.09.2011",2011,9,19,1.074300965,1
"ENG_062_MZB_LO_1760","ENG_062_MZB_LO_1760-15.11.2012","15.11.2012",2012,11,15,1.034686075,1
"ENG_062_MZB_LO_1760","ENG_062_MZB_LO_1760-11.09.2014","11.09.2014",2014,9,11,1.022214986,1
"ENG_062_MZB_LO_1760","ENG_062_MZB_LO_1760-31.10.2018","31.10.2018",2018,10,31,1.113120333,1
"ENG_062_MZB_LO_1760","ENG_062_MZB_LO_1760-14.10.2021","14.10.2021",2021,10,14,1.033351815,1
"ENG_062_MZB_LO_1760","ENG_062_MZB_LO_1760-28.09.2022","28.09.2022",2022,9,28,1.060130232,2
"ENG_062_MZB_LO_1760","ENG_062_MZB_LO_1760-01.09.2023","01.09.2023",2023,9,1,1.017222403,2
"ENG_062_MZB_LO_1761","ENG_062_MZB_LO_1761-13.09.2002","13.09.2002",2002,9,13,1.114213257,1
"ENG_062_MZB_LO_1761","ENG_062_MZB_LO_1761-16.09.2003","16.09.2003",2003,9,16,1.052825969,1
"ENG_062_MZB_LO_1761","ENG_062_MZB_LO_1761-21.10.2005","21.10.2005",2005,10,21,0.994576807,1
"ENG_062_MZB_LO_1761","ENG_062_MZB_LO_1761-27.09.2007","27.09.2007",2007,9,27,1.088131947,1
"ENG_062_MZB_LO_1761","ENG_062_MZB_LO_1761-04.11.2008","04.11.2008",2008,11,4,1.081804067,1
"ENG_062_MZB_LO_1761","ENG_062_MZB_LO_1761-14.09.2009","14.09.2009",2009,9,14,1.061459016,1
"ENG_062_MZB_LO_1761","ENG_062_MZB_LO_1761-09.09.2010","09.09.2010",2010,9,9,0.876533235,3
"ENG_062_MZB_LO_1761","ENG_062_MZB_LO_1761-31.10.2012","31.10.2012",2012,10,31,1.068141183,1
"ENG_062_MZB_LO_1761","ENG_062_MZB_LO_1761-07.10.2013","07.10.2013",2013,10,7,1.072012376,1
"ENG_062_MZB_LO_1761","ENG_062_MZB_LO_1761-25.09.2014","25.09.2014",2014,9,25,0.95379881,2
"ENG_062_MZB_LO_1761","ENG_062_MZB_LO_1761-08.09.2017","08.09.2017",2017,9,8,1.031118607,1
"ENG_062_MZB_LO_1763","ENG_062_MZB_LO_1763-18.09.2002","18.09.2002",2002,9,18,0.841971068,3
"ENG_062_MZB_LO_1763","ENG_062_MZB_LO_1763-07.10.2003","07.10.2003",2003,10,7,0.816491465,3
"ENG_062_MZB_LO_1763","ENG_062_MZB_LO_1763-21.09.2005","21.09.2005",2005,9,21,0.896092978,2
"ENG_062_MZB_LO_1763","ENG_062_MZB_LO_1763-12.10.2010","12.10.2010",2010,10,12,0.987768726,1
"ENG_062_MZB_LO_1763","ENG_062_MZB_LO_1763-30.10.2012","30.10.2012",2012,10,30,0.96878151,1
"ENG_062_MZB_LO_1763","ENG_062_MZB_LO_1763-21.11.2014","21.11.2014",2014,11,21,1.023173366,1
"ENG_062_MZB_LO_1763","ENG_062_MZB_LO_1763-31.10.2018","31.10.2018",2018,10,31,0.926152665,2
"ENG_062_MZB_LO_1763","ENG_062_MZB_LO_1763-10.09.2021","10.09.2021",2021,9,10,0.870471759,4
"ENG_062_MZB_LO_1763","ENG_062_MZB_LO_1763-28.09.2022","28.09.2022",2022,9,28,1.052540184,1
"ENG_062_MZB_LO_1763","ENG_062_MZB_LO_1763-28.09.2023","28.09.2023",2023,9,28,1.063234202,1
"ENG_062_MZB_LO_1764","ENG_062_MZB_LO_1764-16.05.2002","16.05.2002",2002,5,16,1.0230305,1
"ENG_062_MZB_LO_1764","ENG_062_MZB_LO_1764-16.04.2003","16.04.2003",2003,4,16,1.027043475,1
"ENG_062_MZB_LO_1764","ENG_062_MZB_LO_1764-14.04.2005","14.04.2005",2005,4,14,1.032385103,1
"ENG_062_MZB_LO_1764","ENG_062_MZB_LO_1764-19.05.2006","19.05.2006",2006,5,19,1.024950571,1
"ENG_062_MZB_LO_1764","ENG_062_MZB_LO_1764-29.04.2008","29.04.2008",2008,4,29,1.107203203,1
"ENG_062_MZB_LO_1764","ENG_062_MZB_LO_1764-25.04.2013","25.04.2013",2013,4,25,1.113052905,1
"ENG_062_MZB_LO_1764","ENG_062_MZB_LO_1764-09.05.2016","09.05.2016",2016,5,9,0.970181557,1
"ENG_062_MZB_LO_1765","ENG_062_MZB_LO_1765-19.09.2002","19.09.2002",2002,9,19,1.026421982,1
"ENG_062_MZB_LO_1765","ENG_062_MZB_LO_1765-05.11.2003","05.11.2003",2003,11,5,1.079539778,1
"ENG_062_MZB_LO_1765","ENG_062_MZB_LO_1765-05.11.2004","05.11.2004",2004,11,5,0.952192333,2
"ENG_062_MZB_LO_1765","ENG_062_MZB_LO_1765-04.10.2005","04.10.2005",2005,10,4,1.061844987,1
"ENG_062_MZB_LO_1765","ENG_062_MZB_LO_1765-25.11.2006","25.11.2006",2006,11,25,0.98930555,1
"ENG_062_MZB_LO_1765","ENG_062_MZB_LO_1765-20.09.2007","20.09.2007",2007,9,20,1.088856596,1
"ENG_062_MZB_LO_1765","ENG_062_MZB_LO_1765-21.09.2010","21.09.2010",2010,9,21,1.052514557,1
"ENG_062_MZB_LO_1765","ENG_062_MZB_LO_1765-03.10.2011","03.10.2011",2011,10,3,1.145740072,1
"ENG_062_MZB_LO_1765","ENG_062_MZB_LO_1765-19.09.2012","19.09.2012",2012,9,19,1.146692772,1
"ENG_062_MZB_LO_1765","ENG_062_MZB_LO_1765-07.10.2013","07.10.2013",2013,10,7,1.10402384,1
"ENG_062_MZB_LO_1765","ENG_062_MZB_LO_1765-08.10.2014","08.10.2014",2014,10,8,1.091851316,1
"ENG_062_MZB_LO_1765","ENG_062_MZB_LO_1765-16.10.2015","16.10.2015",2015,10,16,1.117942689,1
"ENG_062_MZB_LO_1765","ENG_062_MZB_LO_1765-18.10.2016","18.10.2016",2016,10,18,1.149482857,1
"ENG_062_MZB_LO_1765","ENG_062_MZB_LO_1765-21.09.2017","21.09.2017",2017,9,21,1.045117229,1
"ENG_062_MZB_LO_1765","ENG_062_MZB_LO_1765-15.11.2018","15.11.2018",2018,11,15,1.033270151,1
"ENG_062_MZB_LO_1765","ENG_062_MZB_LO_1765-10.11.2021","10.11.2021",2021,11,10,1.116376318,1
"ENG_062_MZB_LO_1765","ENG_062_MZB_LO_1765-27.09.2022","27.09.2022",2022,9,27,1.167190967,1
"ENG_062_MZB_LO_1765","ENG_062_MZB_LO_1765-30.11.2023","30.11.2023",2023,11,30,1.023668891,1
"ENG_062_MZB_LO_1765","ENG_062_MZB_LO_1765-29.10.2024","29.10.2024",2024,10,29,1.071703452,1
"ENG_062_MZB_LO_1766","ENG_062_MZB_LO_1766-28.11.2002","28.11.2002",2002,11,28,0.928915915,2
"ENG_062_MZB_LO_1766","ENG_062_MZB_LO_1766-01.10.2003","01.10.2003",2003,10,1,1.01611074,1
"ENG_062_MZB_LO_1766","ENG_062_MZB_LO_1766-22.09.2004","22.09.2004",2004,9,22,0.997639744,1
"ENG_062_MZB_LO_1766","ENG_062_MZB_LO_1766-11.10.2005","11.10.2005",2005,10,11,0.873812312,2
"ENG_062_MZB_LO_1766","ENG_062_MZB_LO_1766-18.10.2006","18.10.2006",2006,10,18,0.871136043,3
"ENG_062_MZB_LO_1766","ENG_062_MZB_LO_1766-08.10.2007","08.10.2007",2007,10,8,0.959501421,1
"ENG_062_MZB_LO_1766","ENG_062_MZB_LO_1766-13.10.2008","13.10.2008",2008,10,13,1.001195073,1
"ENG_062_MZB_LO_1766","ENG_062_MZB_LO_1766-30.09.2009","30.09.2009",2009,9,30,0.95119497,2
"ENG_062_MZB_LO_1766","ENG_062_MZB_LO_1766-16.10.2013","16.10.2013",2013,10,16,0.993027444,1
"ENG_062_MZB_LO_1767","ENG_062_MZB_LO_1767-09.10.2003","09.10.2003",2003,10,9,1.027838635,1
"ENG_062_MZB_LO_1767","ENG_062_MZB_LO_1767-14.11.2006","14.11.2006",2006,11,14,1.041156477,2
"ENG_062_MZB_LO_1767","ENG_062_MZB_LO_1767-14.10.2009","14.10.2009",2009,10,14,1.004125135,1
"ENG_062_MZB_LO_1767","ENG_062_MZB_LO_1767-01.09.2010","01.09.2010",2010,9,1,1.028444175,1
"ENG_062_MZB_LO_1767","ENG_062_MZB_LO_1767-18.09.2012","18.09.2012",2012,9,18,1.090669294,1
"ENG_062_MZB_LO_1767","ENG_062_MZB_LO_1767-10.11.2015","10.11.2015",2015,11,10,0.835255133,3
"ENG_062_MZB_LO_1767","ENG_062_MZB_LO_1767-24.10.2018","24.10.2018",2018,10,24,0.829041624,3
"ENG_062_MZB_LO_1769","ENG_062_MZB_LO_1769-24.10.2002","24.10.2002",2002,10,24,1.06221897,1
"ENG_062_MZB_LO_1769","ENG_062_MZB_LO_1769-15.11.2005","15.11.2005",2005,11,15,0.969558323,2
"ENG_062_MZB_LO_1769","ENG_062_MZB_LO_1769-28.10.2009","28.10.2009",2009,10,28,1.025066995,1
"ENG_062_MZB_LO_1769","ENG_062_MZB_LO_1769-29.09.2011","29.09.2011",2011,9,29,1.066716794,1
"ENG_062_MZB_LO_1769","ENG_062_MZB_LO_1769-09.10.2012","09.10.2012",2012,10,9,1.077655472,1
"ENG_062_MZB_LO_1769","ENG_062_MZB_LO_1769-09.10.2014","09.10.2014",2014,10,9,1.025718166,3
"ENG_062_MZB_LO_1769","ENG_062_MZB_LO_1769-06.09.2021","06.09.2021",2021,9,6,0.837812285,5
"ENG_062_MZB_LO_1769","ENG_062_MZB_LO_1769-13.09.2022","13.09.2022",2022,9,13,1.072036259,5
"ENG_062_MZB_LO_1769","ENG_062_MZB_LO_1769-05.10.2023","05.10.2023",2023,10,5,1.059558512,5
"ENG_062_MZB_LO_177","ENG_062_MZB_LO_177-02.10.2002","02.10.2002",2002,10,2,0.984219863,1
"ENG_062_MZB_LO_177","ENG_062_MZB_LO_177-08.09.2003","08.09.2003",2003,9,8,0.935838212,2
"ENG_062_MZB_LO_177","ENG_062_MZB_LO_177-30.09.2004","30.09.2004",2004,9,30,0.90981181,2
"ENG_062_MZB_LO_177","ENG_062_MZB_LO_177-04.10.2005","04.10.2005",2005,10,4,0.914335422,2
"ENG_062_MZB_LO_177","ENG_062_MZB_LO_177-02.10.2006","02.10.2006",2006,10,2,0.956376154,2
"ENG_062_MZB_LO_177","ENG_062_MZB_LO_177-17.10.2007","17.10.2007",2007,10,17,0.952672348,2
"ENG_062_MZB_LO_177","ENG_062_MZB_LO_177-24.10.2008","24.10.2008",2008,10,24,0.980538812,1
"ENG_062_MZB_LO_177","ENG_062_MZB_LO_177-14.09.2009","14.09.2009",2009,9,14,0.90662851,2
"ENG_062_MZB_LO_177","ENG_062_MZB_LO_177-23.09.2013","23.09.2013",2013,9,23,0.945276452,2
"ENG_062_MZB_LO_1770","ENG_062_MZB_LO_1770-08.10.2003","08.10.2003",2003,10,8,1.002151708,1
"ENG_062_MZB_LO_1770","ENG_062_MZB_LO_1770-30.11.2006","30.11.2006",2006,11,30,0.983052297,2
"ENG_062_MZB_LO_1770","ENG_062_MZB_LO_1770-29.09.2011","29.09.2011",2011,9,29,0.933285347,3
"ENG_062_MZB_LO_1770","ENG_062_MZB_LO_1770-19.11.2014","19.11.2014",2014,11,19,1.02089832,1
"ENG_062_MZB_LO_1770","ENG_062_MZB_LO_1770-20.10.2016","20.10.2016",2016,10,20,1.04002703,1
"ENG_062_MZB_LO_1770","ENG_062_MZB_LO_1770-06.09.2021","06.09.2021",2021,9,6,1.017351704,1
"ENG_062_MZB_LO_1770","ENG_062_MZB_LO_1770-13.09.2022","13.09.2022",2022,9,13,0.9925832,2
"ENG_062_MZB_LO_1770","ENG_062_MZB_LO_1770-05.10.2023","05.10.2023",2023,10,5,0.938772535,5
"ENG_062_MZB_LO_1773","ENG_062_MZB_LO_1773-13.11.2003","13.11.2003",2003,11,13,0.689390321,4
"ENG_062_MZB_LO_1773","ENG_062_MZB_LO_1773-17.11.2004","17.11.2004",2004,11,17,0.671297048,4
"ENG_062_MZB_LO_1773","ENG_062_MZB_LO_1773-20.10.2006","20.10.2006",2006,10,20,0.641971247,5
"ENG_062_MZB_LO_1773","ENG_062_MZB_LO_1773-20.10.2009","20.10.2009",2009,10,20,0.701953399,5
"ENG_062_MZB_LO_1773","ENG_062_MZB_LO_1773-21.10.2013","21.10.2013",2013,10,21,0.859247443,5
"ENG_062_MZB_LO_1773","ENG_062_MZB_LO_1773-06.09.2016","06.09.2016",2016,9,6,0.840794812,5
"ENG_062_MZB_LO_1773","ENG_062_MZB_LO_1773-01.09.2023","01.09.2023",2023,9,1,0.940592084,5
"ENG_062_MZB_LO_1777","ENG_062_MZB_LO_1777-13.11.2002","13.11.2002",2002,11,13,0.800744298,3
"ENG_062_MZB_LO_1777","ENG_062_MZB_LO_1777-18.10.2005","18.10.2005",2005,10,18,0.951925426,2
"ENG_062_MZB_LO_1777","ENG_062_MZB_LO_1777-31.10.2007","31.10.2007",2007,10,31,0.966590384,2
"ENG_062_MZB_LO_1777","ENG_062_MZB_LO_1777-08.09.2009","08.09.2009",2009,9,8,0.970045412,1
"ENG_062_MZB_LO_1777","ENG_062_MZB_LO_1777-04.10.2010","04.10.2010",2010,10,4,1.002903829,1
"ENG_062_MZB_LO_1777","ENG_062_MZB_LO_1777-01.11.2011","01.11.2011",2011,11,1,0.722283378,4
"ENG_062_MZB_LO_1777","ENG_062_MZB_LO_1777-18.10.2012","18.10.2012",2012,10,18,0.831726371,3
"ENG_062_MZB_LO_1777","ENG_062_MZB_LO_1777-01.11.2013","01.11.2013",2013,11,1,0.89024042,3
"ENG_062_MZB_LO_1777","ENG_062_MZB_LO_1777-08.10.2014","08.10.2014",2014,10,8,0.95654818,2
"ENG_062_MZB_LO_1777","ENG_062_MZB_LO_1777-17.09.2015","17.09.2015",2015,9,17,0.940594493,2
"ENG_062_MZB_LO_1777","ENG_062_MZB_LO_1777-04.10.2016","04.10.2016",2016,10,4,0.964068946,2
"ENG_062_MZB_LO_1777","ENG_062_MZB_LO_1777-12.10.2017","12.10.2017",2017,10,12,0.925245981,2
"ENG_062_MZB_LO_1777","ENG_062_MZB_LO_1777-05.10.2018","05.10.2018",2018,10,5,0.931177413,2
"ENG_062_MZB_LO_1777","ENG_062_MZB_LO_1777-06.11.2019","06.11.2019",2019,11,6,0.946206159,2
"ENG_062_MZB_LO_1777","ENG_062_MZB_LO_1777-23.09.2020","23.09.2020",2020,9,23,0.98196151,2
"ENG_062_MZB_LO_1780","ENG_062_MZB_LO_1780-21.11.2003","21.11.2003",2003,11,21,0.874503677,3
"ENG_062_MZB_LO_1780","ENG_062_MZB_LO_1780-06.09.2006","06.09.2006",2006,9,6,0.871289762,3
"ENG_062_MZB_LO_1780","ENG_062_MZB_LO_1780-27.09.2007","27.09.2007",2007,9,27,0.798005872,3
"ENG_062_MZB_LO_1780","ENG_062_MZB_LO_1780-24.10.2008","24.10.2008",2008,10,24,0.823891503,3
"ENG_062_MZB_LO_1780","ENG_062_MZB_LO_1780-14.10.2009","14.10.2009",2009,10,14,0.908307115,2
"ENG_062_MZB_LO_1780","ENG_062_MZB_LO_1780-06.09.2010","06.09.2010",2010,9,6,0.931231656,2
"ENG_062_MZB_LO_1780","ENG_062_MZB_LO_1780-27.09.2011","27.09.2011",2011,9,27,0.992034649,3
"ENG_062_MZB_LO_1780","ENG_062_MZB_LO_1780-29.10.2012","29.10.2012",2012,10,29,0.670352018,5
"ENG_062_MZB_LO_1780","ENG_062_MZB_LO_1780-09.09.2015","09.09.2015",2015,9,9,0.930543736,3
"ENG_062_MZB_LO_1780","ENG_062_MZB_LO_1780-12.11.2018","12.11.2018",2018,11,12,0.969939828,1
"ENG_062_MZB_LO_1781","ENG_062_MZB_LO_1781-02.11.2004","02.11.2004",2004,11,2,0.845229956,3
"ENG_062_MZB_LO_1781","ENG_062_MZB_LO_1781-22.09.2015","22.09.2015",2015,9,22,0.780449871,3
"ENG_062_MZB_LO_1781","ENG_062_MZB_LO_1781-14.11.2016","14.11.2016",2016,11,14,0.896524712,2
"ENG_062_MZB_LO_1781","ENG_062_MZB_LO_1781-23.10.2017","23.10.2017",2017,10,23,0.812579201,3
"ENG_062_MZB_LO_1781","ENG_062_MZB_LO_1781-19.09.2018","19.09.2018",2018,9,19,0.948847223,2
"ENG_062_MZB_LO_1781","ENG_062_MZB_LO_1781-28.10.2019","28.10.2019",2019,10,28,0.888611248,2
"ENG_062_MZB_LO_1781","ENG_062_MZB_LO_1781-16.11.2020","16.11.2020",2020,11,16,0.800858837,3
"ENG_062_MZB_LO_1781","ENG_062_MZB_LO_1781-28.10.2021","28.10.2021",2021,10,28,0.817541611,3
"ENG_062_MZB_LO_1781","ENG_062_MZB_LO_1781-21.09.2022","21.09.2022",2022,9,21,0.833961126,3
"ENG_062_MZB_LO_1781","ENG_062_MZB_LO_1781-30.10.2023","30.10.2023",2023,10,30,0.877555289,3
"ENG_062_MZB_LO_1781","ENG_062_MZB_LO_1781-22.10.2024","22.10.2024",2024,10,22,0.936738754,2
"ENG_062_MZB_LO_1783","ENG_062_MZB_LO_1783-08.10.2002","08.10.2002",2002,10,8,0.922528155,2
"ENG_062_MZB_LO_1783","ENG_062_MZB_LO_1783-12.10.2004","12.10.2004",2004,10,12,0.999316496,2
"ENG_062_MZB_LO_1783","ENG_062_MZB_LO_1783-01.11.2006","01.11.2006",2006,11,1,0.909056612,3
"ENG_062_MZB_LO_1783","ENG_062_MZB_LO_1783-28.09.2007","28.09.2007",2007,9,28,0.910071043,2
"ENG_062_MZB_LO_1783","ENG_062_MZB_LO_1783-27.11.2008","27.11.2008",2008,11,27,0.995611755,1
"ENG_062_MZB_LO_1783","ENG_062_MZB_LO_1783-14.10.2009","14.10.2009",2009,10,14,0.94014714,2
"ENG_062_MZB_LO_1783","ENG_062_MZB_LO_1783-19.10.2010","19.10.2010",2010,10,19,0.899404754,3
"ENG_062_MZB_LO_1783","ENG_062_MZB_LO_1783-16.09.2011","16.09.2011",2011,9,16,0.911329336,2
"ENG_062_MZB_LO_1783","ENG_062_MZB_LO_1783-10.09.2012","10.09.2012",2012,9,10,0.877584488,2
"ENG_062_MZB_LO_1783","ENG_062_MZB_LO_1783-26.09.2013","26.09.2013",2013,9,26,0.907162755,2
"ENG_062_MZB_LO_1783","ENG_062_MZB_LO_1783-03.09.2014","03.09.2014",2014,9,3,0.927270356,2
"ENG_062_MZB_LO_1783","ENG_062_MZB_LO_1783-08.09.2015","08.09.2015",2015,9,8,0.90929388,3
"ENG_062_MZB_LO_1783","ENG_062_MZB_LO_1783-19.10.2016","19.10.2016",2016,10,19,0.925220031,2
"ENG_062_MZB_LO_1783","ENG_062_MZB_LO_1783-11.10.2017","11.10.2017",2017,10,11,0.946511012,2
"ENG_062_MZB_LO_1783","ENG_062_MZB_LO_1783-17.10.2018","17.10.2018",2018,10,17,0.939708941,2
"ENG_062_MZB_LO_1783","ENG_062_MZB_LO_1783-23.10.2019","23.10.2019",2019,10,23,0.991213191,2
"ENG_062_MZB_LO_1783","ENG_062_MZB_LO_1783-01.09.2020","01.09.2020",2020,9,1,0.920702515,2
"ENG_062_MZB_LO_1783","ENG_062_MZB_LO_1783-16.09.2021","16.09.2021",2021,9,16,0.988969518,2
"ENG_062_MZB_LO_1783","ENG_062_MZB_LO_1783-20.10.2022","20.10.2022",2022,10,20,1.075614343,3
"ENG_062_MZB_LO_1783","ENG_062_MZB_LO_1783-09.10.2023","09.10.2023",2023,10,9,0.974567479,1
"ENG_062_MZB_LO_1785","ENG_062_MZB_LO_1785-30.11.2002","30.11.2002",2002,11,30,0.919667846,2
"ENG_062_MZB_LO_1785","ENG_062_MZB_LO_1785-11.11.2005","11.11.2005",2005,11,11,0.846736104,3
"ENG_062_MZB_LO_1785","ENG_062_MZB_LO_1785-16.09.2008","16.09.2008",2008,9,16,0.902303368,3
"ENG_062_MZB_LO_1785","ENG_062_MZB_LO_1785-15.10.2009","15.10.2009",2009,10,15,0.942548518,3
"ENG_062_MZB_LO_1785","ENG_062_MZB_LO_1785-07.10.2010","07.10.2010",2010,10,7,0.890727387,2
"ENG_062_MZB_LO_1785","ENG_062_MZB_LO_1785-20.10.2011","20.10.2011",2011,10,20,0.854155207,3
"ENG_062_MZB_LO_1785","ENG_062_MZB_LO_1785-05.11.2012","05.11.2012",2012,11,5,0.89207311,2
"ENG_062_MZB_LO_1785","ENG_062_MZB_LO_1785-04.11.2013","04.11.2013",2013,11,4,0.94360669,2
"ENG_062_MZB_LO_1785","ENG_062_MZB_LO_1785-24.09.2014","24.09.2014",2014,9,24,0.951985993,2
"ENG_062_MZB_LO_1785","ENG_062_MZB_LO_1785-16.09.2015","16.09.2015",2015,9,16,0.900189255,2
"ENG_062_MZB_LO_1785","ENG_062_MZB_LO_1785-06.09.2016","06.09.2016",2016,9,6,0.92112318,2
"ENG_062_MZB_LO_1785","ENG_062_MZB_LO_1785-23.10.2017","23.10.2017",2017,10,23,0.962708186,2
"ENG_062_MZB_LO_1785","ENG_062_MZB_LO_1785-25.09.2018","25.09.2018",2018,9,25,0.855248313,3
"ENG_062_MZB_LO_1785","ENG_062_MZB_LO_1785-08.09.2020","08.09.2020",2020,9,8,0.925011836,2
"ENG_062_MZB_LO_1785","ENG_062_MZB_LO_1785-28.10.2021","28.10.2021",2021,10,28,0.874871008,2
"ENG_062_MZB_LO_1785","ENG_062_MZB_LO_1785-27.09.2022","27.09.2022",2022,9,27,0.859011325,3
"ENG_062_MZB_LO_1785","ENG_062_MZB_LO_1785-22.09.2023","22.09.2023",2023,9,22,0.896181047,2
"ENG_062_MZB_LO_1785","ENG_062_MZB_LO_1785-30.10.2024","30.10.2024",2024,10,30,0.936073612,2
"ENG_062_MZB_LO_1786","ENG_062_MZB_LO_1786-04.09.2002","04.09.2002",2002,9,4,0.964197116,2
"ENG_062_MZB_LO_1786","ENG_062_MZB_LO_1786-26.09.2003","26.09.2003",2003,9,26,1.006069248,2
"ENG_062_MZB_LO_1786","ENG_062_MZB_LO_1786-04.11.2004","04.11.2004",2004,11,4,1.013723923,2
"ENG_062_MZB_LO_1786","ENG_062_MZB_LO_1786-06.11.2006","06.11.2006",2006,11,6,0.952275804,2
"ENG_062_MZB_LO_1786","ENG_062_MZB_LO_1786-12.10.2007","12.10.2007",2007,10,12,1.020035331,1
"ENG_062_MZB_LO_1786","ENG_062_MZB_LO_1786-20.11.2008","20.11.2008",2008,11,20,1.001014723,3
"ENG_062_MZB_LO_1786","ENG_062_MZB_LO_1786-13.10.2009","13.10.2009",2009,10,13,1.072756816,1
"ENG_062_MZB_LO_1786","ENG_062_MZB_LO_1786-29.09.2010","29.09.2010",2010,9,29,1.055642854,1
"ENG_062_MZB_LO_1786","ENG_062_MZB_LO_1786-22.09.2011","22.09.2011",2011,9,22,1.143173675,1
"ENG_062_MZB_LO_1786","ENG_062_MZB_LO_1786-08.11.2012","08.11.2012",2012,11,8,1.053945546,1
"ENG_062_MZB_LO_1786","ENG_062_MZB_LO_1786-18.11.2013","18.11.2013",2013,11,18,1.008275617,1
"ENG_062_MZB_LO_1786","ENG_062_MZB_LO_1786-10.09.2014","10.09.2014",2014,9,10,1.048377774,1
"ENG_062_MZB_LO_1786","ENG_062_MZB_LO_1786-02.09.2015","02.09.2015",2015,9,2,1.148543086,1
"ENG_062_MZB_LO_1786","ENG_062_MZB_LO_1786-07.09.2016","07.09.2016",2016,9,7,1.041610032,1
"ENG_062_MZB_LO_1786","ENG_062_MZB_LO_1786-04.10.2017","04.10.2017",2017,10,4,1.026719085,1
"ENG_062_MZB_LO_1786","ENG_062_MZB_LO_1786-25.09.2018","25.09.2018",2018,9,25,1.033276245,1
"ENG_062_MZB_LO_1786","ENG_062_MZB_LO_1786-15.09.2020","15.09.2020",2020,9,15,1.066604474,1
"ENG_062_MZB_LO_1786","ENG_062_MZB_LO_1786-16.09.2021","16.09.2021",2021,9,16,1.076817524,1
"ENG_062_MZB_LO_1786","ENG_062_MZB_LO_1786-10.10.2022","10.10.2022",2022,10,10,0.971055662,2
"ENG_062_MZB_LO_1786","ENG_062_MZB_LO_1786-29.09.2023","29.09.2023",2023,9,29,0.971141735,2
"ENG_062_MZB_LO_1786","ENG_062_MZB_LO_1786-06.11.2024","06.11.2024",2024,11,6,0.97045079,2
"ENG_062_MZB_LO_1790","ENG_062_MZB_LO_1790-26.11.2002","26.11.2002",2002,11,26,0.781991808,5
"ENG_062_MZB_LO_1790","ENG_062_MZB_LO_1790-23.11.2004","23.11.2004",2004,11,23,0.943957748,3
"ENG_062_MZB_LO_1790","ENG_062_MZB_LO_1790-06.11.2006","06.11.2006",2006,11,6,0.933622473,2
"ENG_062_MZB_LO_1790","ENG_062_MZB_LO_1790-15.10.2007","15.10.2007",2007,10,15,1.015429284,2
"ENG_062_MZB_LO_1790","ENG_062_MZB_LO_1790-07.11.2008","07.11.2008",2008,11,7,0.882048267,5
"ENG_062_MZB_LO_1790","ENG_062_MZB_LO_1790-28.10.2009","28.10.2009",2009,10,28,1.007149363,1
"ENG_062_MZB_LO_1790","ENG_062_MZB_LO_1790-29.09.2010","29.09.2010",2010,9,29,0.916629053,2
"ENG_062_MZB_LO_1790","ENG_062_MZB_LO_1790-15.11.2011","15.11.2011",2011,11,15,0.938677519,2
"ENG_062_MZB_LO_1790","ENG_062_MZB_LO_1790-14.09.2012","14.09.2012",2012,9,14,0.975353867,1
"ENG_062_MZB_LO_1790","ENG_062_MZB_LO_1790-23.09.2013","23.09.2013",2013,9,23,1.054440459,2
"ENG_062_MZB_LO_1790","ENG_062_MZB_LO_1790-27.11.2014","27.11.2014",2014,11,27,0.9658856,2
"ENG_062_MZB_LO_1790","ENG_062_MZB_LO_1790-22.10.2015","22.10.2015",2015,10,22,1.078273043,1
"ENG_062_MZB_LO_1790","ENG_062_MZB_LO_1790-14.09.2016","14.09.2016",2016,9,14,1.058755781,1
"ENG_062_MZB_LO_1790","ENG_062_MZB_LO_1790-10.10.2017","10.10.2017",2017,10,10,0.994881438,1
"ENG_062_MZB_LO_1790","ENG_062_MZB_LO_1790-11.10.2018","11.10.2018",2018,10,11,0.93880183,2
"ENG_062_MZB_LO_1790","ENG_062_MZB_LO_1790-24.09.2019","24.09.2019",2019,9,24,1.118314659,1
"ENG_062_MZB_LO_1790","ENG_062_MZB_LO_1790-11.09.2020","11.09.2020",2020,9,11,0.935613546,3
"ENG_062_MZB_LO_1790","ENG_062_MZB_LO_1790-12.10.2021","12.10.2021",2021,10,12,0.952727554,2
"ENG_062_MZB_LO_1790","ENG_062_MZB_LO_1790-26.10.2022","26.10.2022",2022,10,26,0.85920899,3
"ENG_062_MZB_LO_1790","ENG_062_MZB_LO_1790-09.10.2023","09.10.2023",2023,10,9,0.92721353,2
"ENG_062_MZB_LO_1790","ENG_062_MZB_LO_1790-06.09.2024","06.09.2024",2024,9,6,1.134687999,1
"ENG_062_MZB_LO_1791","ENG_062_MZB_LO_1791-16.10.2003","16.10.2003",2003,10,16,1.204902332,1
"ENG_062_MZB_LO_1791","ENG_062_MZB_LO_1791-01.11.2006","01.11.2006",2006,11,1,1.220799777,1
"ENG_062_MZB_LO_1791","ENG_062_MZB_LO_1791-08.10.2009","08.10.2009",2009,10,8,1.324648494,1
"ENG_062_MZB_LO_1791","ENG_062_MZB_LO_1791-10.11.2010","10.11.2010",2010,11,10,1.233859914,1
"ENG_062_MZB_LO_1791","ENG_062_MZB_LO_1791-24.10.2011","24.10.2011",2011,10,24,1.19132766,1
"ENG_062_MZB_LO_1791","ENG_062_MZB_LO_1791-17.09.2012","17.09.2012",2012,9,17,1.177689458,1
"ENG_062_MZB_LO_1791","ENG_062_MZB_LO_1791-10.10.2013","10.10.2013",2013,10,10,1.324922661,1
"ENG_062_MZB_LO_1791","ENG_062_MZB_LO_1791-04.09.2014","04.09.2014",2014,9,4,1.274111034,1
"ENG_062_MZB_LO_1791","ENG_062_MZB_LO_1791-06.10.2015","06.10.2015",2015,10,6,1.217168281,1
"ENG_062_MZB_LO_1791","ENG_062_MZB_LO_1791-08.09.2016","08.09.2016",2016,9,8,1.216385795,1
"ENG_062_MZB_LO_1791","ENG_062_MZB_LO_1791-03.10.2017","03.10.2017",2017,10,3,1.243774216,1
"ENG_062_MZB_LO_1791","ENG_062_MZB_LO_1791-31.10.2018","31.10.2018",2018,10,31,1.265349255,1
"ENG_062_MZB_LO_1791","ENG_062_MZB_LO_1791-05.09.2019","05.09.2019",2019,9,5,1.224464478,1
"ENG_062_MZB_LO_1792","ENG_062_MZB_LO_1792-31.10.2002","31.10.2002",2002,10,31,0.846254558,3
"ENG_062_MZB_LO_1792","ENG_062_MZB_LO_1792-07.11.2005","07.11.2005",2005,11,7,0.866916859,3
"ENG_062_MZB_LO_1792","ENG_062_MZB_LO_1792-16.11.2006","16.11.2006",2006,11,16,0.950834343,3
"ENG_062_MZB_LO_1792","ENG_062_MZB_LO_1792-13.11.2008","13.11.2008",2008,11,13,0.895984872,3
"ENG_062_MZB_LO_1792","ENG_062_MZB_LO_1792-15.09.2011","15.09.2011",2011,9,15,0.877543758,3
"ENG_062_MZB_LO_1792","ENG_062_MZB_LO_1792-21.10.2013","21.10.2013",2013,10,21,0.830369415,3
"ENG_062_MZB_LO_1792","ENG_062_MZB_LO_1792-22.10.2014","22.10.2014",2014,10,22,0.887232047,2
"ENG_062_MZB_LO_1792","ENG_062_MZB_LO_1792-09.11.2022","09.11.2022",2022,11,9,0.874786872,3
"ENG_062_MZB_LO_1798","ENG_062_MZB_LO_1798-09.10.2002","09.10.2002",2002,10,9,0.87617631,2
"ENG_062_MZB_LO_1798","ENG_062_MZB_LO_1798-29.09.2003","29.09.2003",2003,9,29,0.823486807,3
"ENG_062_MZB_LO_1798","ENG_062_MZB_LO_1798-10.11.2004","10.11.2004",2004,11,10,0.822298145,3
"ENG_062_MZB_LO_1798","ENG_062_MZB_LO_1798-11.10.2005","11.10.2005",2005,10,11,0.827700659,3
"ENG_062_MZB_LO_1798","ENG_062_MZB_LO_1798-31.10.2006","31.10.2006",2006,10,31,0.768582307,3
"ENG_062_MZB_LO_1798","ENG_062_MZB_LO_1798-02.10.2007","02.10.2007",2007,10,2,0.817793473,3
"ENG_062_MZB_LO_1798","ENG_062_MZB_LO_1798-24.09.2008","24.09.2008",2008,9,24,0.867904469,3
"ENG_062_MZB_LO_1798","ENG_062_MZB_LO_1798-08.10.2009","08.10.2009",2009,10,8,0.868924653,2
"ENG_062_MZB_LO_1798","ENG_062_MZB_LO_1798-21.10.2010","21.10.2010",2010,10,21,0.831975283,3
"ENG_062_MZB_LO_1798","ENG_062_MZB_LO_1798-01.09.2011","01.09.2011",2011,9,1,0.852964312,3
"ENG_062_MZB_LO_1798","ENG_062_MZB_LO_1798-13.09.2012","13.09.2012",2012,9,13,0.795490351,3
"ENG_062_MZB_LO_1798","ENG_062_MZB_LO_1798-10.09.2013","10.09.2013",2013,9,10,0.903586782,3
"ENG_062_MZB_LO_1798","ENG_062_MZB_LO_1798-31.10.2014","31.10.2014",2014,10,31,0.787050441,4
"ENG_062_MZB_LO_1798","ENG_062_MZB_LO_1798-19.10.2015","19.10.2015",2015,10,19,0.795262333,5
"ENG_062_MZB_LO_1798","ENG_062_MZB_LO_1798-01.09.2016","01.09.2016",2016,9,1,0.815849913,3
"ENG_062_MZB_LO_1798","ENG_062_MZB_LO_1798-30.11.2023","30.11.2023",2023,11,30,0.944522829,2
"ENG_062_MZB_LO_1799","ENG_062_MZB_LO_1799-28.11.2002","28.11.2002",2002,11,28,0.724098954,4
"ENG_062_MZB_LO_1799","ENG_062_MZB_LO_1799-08.10.2003","08.10.2003",2003,10,8,0.742653394,4
"ENG_062_MZB_LO_1799","ENG_062_MZB_LO_1799-23.09.2004","23.09.2004",2004,9,23,0.7487636,3
"ENG_062_MZB_LO_1799","ENG_062_MZB_LO_1799-25.10.2005","25.10.2005",2005,10,25,0.699704774,4
"ENG_062_MZB_LO_1799","ENG_062_MZB_LO_1799-01.11.2006","01.11.2006",2006,11,1,0.757197647,3
"ENG_062_MZB_LO_1799","ENG_062_MZB_LO_1799-12.09.2008","12.09.2008",2008,9,12,0.713565715,4
"ENG_062_MZB_LO_1799","ENG_062_MZB_LO_1799-18.10.2013","18.10.2013",2013,10,18,0.819841967,3
"ENG_062_MZB_LO_1799","ENG_062_MZB_LO_1799-13.10.2015","13.10.2015",2015,10,13,0.730560947,3
"ENG_062_MZB_LO_18","ENG_062_MZB_LO_18-20.09.2002","20.09.2002",2002,9,20,0.90765397,2
"ENG_062_MZB_LO_18","ENG_062_MZB_LO_18-27.10.2004","27.10.2004",2004,10,27,0.752802655,3
"ENG_062_MZB_LO_18","ENG_062_MZB_LO_18-03.10.2005","03.10.2005",2005,10,3,0.718219919,4
"ENG_062_MZB_LO_18","ENG_062_MZB_LO_18-16.10.2007","16.10.2007",2007,10,16,0.956357864,2
"ENG_062_MZB_LO_18","ENG_062_MZB_LO_18-20.10.2008","20.10.2008",2008,10,20,0.886062325,2
"ENG_062_MZB_LO_18","ENG_062_MZB_LO_18-16.09.2010","16.09.2010",2010,9,16,0.854704014,3
"ENG_062_MZB_LO_18","ENG_062_MZB_LO_18-19.09.2013","19.09.2013",2013,9,19,0.903426378,2
"ENG_062_MZB_LO_18","ENG_062_MZB_LO_18-12.09.2014","12.09.2014",2014,9,12,0.889157415,2
"ENG_062_MZB_LO_18","ENG_062_MZB_LO_18-28.09.2020","28.09.2020",2020,9,28,0.952264993,2
"ENG_062_MZB_LO_1800","ENG_062_MZB_LO_1800-02.10.2002","02.10.2002",2002,10,2,1.039310481,1
"ENG_062_MZB_LO_1800","ENG_062_MZB_LO_1800-10.10.2003","10.10.2003",2003,10,10,1.000126141,1
"ENG_062_MZB_LO_1800","ENG_062_MZB_LO_1800-01.11.2006","01.11.2006",2006,11,1,1.044394731,1
"ENG_062_MZB_LO_1800","ENG_062_MZB_LO_1800-19.09.2007","19.09.2007",2007,9,19,1.069615652,1
"ENG_062_MZB_LO_1800","ENG_062_MZB_LO_1800-20.11.2008","20.11.2008",2008,11,20,0.954856228,4
"ENG_062_MZB_LO_1800","ENG_062_MZB_LO_1800-12.11.2009","12.11.2009",2009,11,12,1.077791442,1
"ENG_062_MZB_LO_1800","ENG_062_MZB_LO_1800-14.10.2010","14.10.2010",2010,10,14,1.101919718,1
"ENG_062_MZB_LO_1800","ENG_062_MZB_LO_1800-06.10.2011","06.10.2011",2011,10,6,0.917655849,2
"ENG_062_MZB_LO_1800","ENG_062_MZB_LO_1800-08.11.2012","08.11.2012",2012,11,8,1.025652952,1
"ENG_062_MZB_LO_1800","ENG_062_MZB_LO_1800-10.09.2013","10.09.2013",2013,9,10,1.05075022,1
"ENG_062_MZB_LO_1800","ENG_062_MZB_LO_1800-30.10.2014","30.10.2014",2014,10,30,1.080252723,1
"ENG_062_MZB_LO_1800","ENG_062_MZB_LO_1800-27.09.2016","27.09.2016",2016,9,27,1.015080418,1
"ENG_062_MZB_LO_1800","ENG_062_MZB_LO_1800-03.10.2017","03.10.2017",2017,10,3,0.951010045,2
"ENG_062_MZB_LO_1800","ENG_062_MZB_LO_1800-11.10.2018","11.10.2018",2018,10,11,1.059491083,1
"ENG_062_MZB_LO_1800","ENG_062_MZB_LO_1800-07.09.2020","07.09.2020",2020,9,7,1.008947569,1
"ENG_062_MZB_LO_1800","ENG_062_MZB_LO_1800-14.09.2021","14.09.2021",2021,9,14,1.026079891,1
"ENG_062_MZB_LO_1800","ENG_062_MZB_LO_1800-21.09.2022","21.09.2022",2022,9,21,0.948783281,2
"ENG_062_MZB_LO_1800","ENG_062_MZB_LO_1800-11.10.2023","11.10.2023",2023,10,11,0.989409924,2
"ENG_062_MZB_LO_1803","ENG_062_MZB_LO_1803-08.10.2003","08.10.2003",2003,10,8,0.611340308,4
"ENG_062_MZB_LO_1803","ENG_062_MZB_LO_1803-15.10.2004","15.10.2004",2004,10,15,0.590019809,5
"ENG_062_MZB_LO_1803","ENG_062_MZB_LO_1803-15.11.2005","15.11.2005",2005,11,15,0.635598908,4
"ENG_062_MZB_LO_1803","ENG_062_MZB_LO_1803-30.11.2006","30.11.2006",2006,11,30,0.656578105,4
"ENG_062_MZB_LO_1803","ENG_062_MZB_LO_1803-20.11.2007","20.11.2007",2007,11,20,0.674156242,4
"ENG_062_MZB_LO_1803","ENG_062_MZB_LO_1803-18.09.2008","18.09.2008",2008,9,18,0.709027259,4
"ENG_062_MZB_LO_1803","ENG_062_MZB_LO_1803-29.10.2010","29.10.2010",2010,10,29,0.679106445,4
"ENG_062_MZB_LO_1803","ENG_062_MZB_LO_1803-14.10.2013","14.10.2013",2013,10,14,0.7447665,3
"ENG_062_MZB_LO_1803","ENG_062_MZB_LO_1803-19.11.2014","19.11.2014",2014,11,19,0.618273815,4
"ENG_062_MZB_LO_1803","ENG_062_MZB_LO_1803-29.11.2017","29.11.2017",2017,11,29,0.618799999,4
"ENG_062_MZB_LO_1803","ENG_062_MZB_LO_1803-13.09.2022","13.09.2022",2022,9,13,0.613568816,4
"ENG_062_MZB_LO_1803","ENG_062_MZB_LO_1803-05.10.2023","05.10.2023",2023,10,5,0.730115699,3
"ENG_062_MZB_LO_1804","ENG_062_MZB_LO_1804-23.09.2002","23.09.2002",2002,9,23,0.8961415,2
"ENG_062_MZB_LO_1804","ENG_062_MZB_LO_1804-29.09.2003","29.09.2003",2003,9,29,0.929557446,2
"ENG_062_MZB_LO_1804","ENG_062_MZB_LO_1804-04.10.2006","04.10.2006",2006,10,4,0.871497035,2
"ENG_062_MZB_LO_1804","ENG_062_MZB_LO_1804-19.09.2008","19.09.2008",2008,9,19,0.87222281,3
"ENG_062_MZB_LO_1804","ENG_062_MZB_LO_1804-08.10.2009","08.10.2009",2009,10,8,0.873808996,2
"ENG_062_MZB_LO_1804","ENG_062_MZB_LO_1804-03.11.2010","03.11.2010",2010,11,3,0.923361179,2
"ENG_062_MZB_LO_1804","ENG_062_MZB_LO_1804-31.10.2011","31.10.2011",2011,10,31,0.812869593,3
"ENG_062_MZB_LO_1804","ENG_062_MZB_LO_1804-13.09.2012","13.09.2012",2012,9,13,0.841590871,5
"ENG_062_MZB_LO_1804","ENG_062_MZB_LO_1804-03.09.2013","03.09.2013",2013,9,3,0.847879446,3
"ENG_062_MZB_LO_1804","ENG_062_MZB_LO_1804-26.09.2014","26.09.2014",2014,9,26,0.90643218,2
"ENG_062_MZB_LO_1804","ENG_062_MZB_LO_1804-26.10.2015","26.10.2015",2015,10,26,0.929875676,2
"ENG_062_MZB_LO_1804","ENG_062_MZB_LO_1804-19.09.2016","19.09.2016",2016,9,19,0.811364025,3
"ENG_062_MZB_LO_1804","ENG_062_MZB_LO_1804-16.11.2017","16.11.2017",2017,11,16,0.936207001,2
"ENG_062_MZB_LO_1804","ENG_062_MZB_LO_1804-26.09.2018","26.09.2018",2018,9,26,0.795337564,3
"ENG_062_MZB_LO_1804","ENG_062_MZB_LO_1804-29.10.2019","29.10.2019",2019,10,29,0.847027783,3
"ENG_062_MZB_LO_1804","ENG_062_MZB_LO_1804-30.10.2020","30.10.2020",2020,10,30,0.849830956,3
"ENG_062_MZB_LO_1804","ENG_062_MZB_LO_1804-24.09.2021","24.09.2021",2021,9,24,0.8430039,3
"ENG_062_MZB_LO_1804","ENG_062_MZB_LO_1804-26.09.2022","26.09.2022",2022,9,26,0.860234301,3
"ENG_062_MZB_LO_1804","ENG_062_MZB_LO_1804-22.09.2023","22.09.2023",2023,9,22,0.86733546,2
"ENG_062_MZB_LO_1804","ENG_062_MZB_LO_1804-03.09.2024","03.09.2024",2024,9,3,0.819202843,3
"ENG_062_MZB_LO_1805","ENG_062_MZB_LO_1805-10.10.2003","10.10.2003",2003,10,10,0.719775804,3
"ENG_062_MZB_LO_1805","ENG_062_MZB_LO_1805-10.11.2004","10.11.2004",2004,11,10,0.721898035,3
"ENG_062_MZB_LO_1805","ENG_062_MZB_LO_1805-21.09.2006","21.09.2006",2006,9,21,0.726175173,4
"ENG_062_MZB_LO_1805","ENG_062_MZB_LO_1805-21.10.2009","21.10.2009",2009,10,21,0.65862188,4
"ENG_062_MZB_LO_1805","ENG_062_MZB_LO_1805-21.09.2010","21.09.2010",2010,9,21,0.6246205,4
"ENG_062_MZB_LO_1805","ENG_062_MZB_LO_1805-31.10.2012","31.10.2012",2012,10,31,0.672235853,4
"ENG_062_MZB_LO_1805","ENG_062_MZB_LO_1805-17.09.2014","17.09.2014",2014,9,17,0.74487777,3
"ENG_062_MZB_LO_1806","ENG_062_MZB_LO_1806-03.09.2003","03.09.2003",2003,9,3,0.651316308,5
"ENG_062_MZB_LO_1806","ENG_062_MZB_LO_1806-23.09.2005","23.09.2005",2005,9,23,0.745866293,3
"ENG_062_MZB_LO_1806","ENG_062_MZB_LO_1806-07.11.2006","07.11.2006",2006,11,7,0.767770142,5
"ENG_062_MZB_LO_1806","ENG_062_MZB_LO_1806-09.10.2007","09.10.2007",2007,10,9,0.732462967,5
"ENG_062_MZB_LO_1806","ENG_062_MZB_LO_1806-29.10.2008","29.10.2008",2008,10,29,0.744694675,4
"ENG_062_MZB_LO_1806","ENG_062_MZB_LO_1806-12.10.2009","12.10.2009",2009,10,12,0.808811523,3
"ENG_062_MZB_LO_1806","ENG_062_MZB_LO_1806-13.09.2010","13.09.2010",2010,9,13,0.859807093,3
"ENG_062_MZB_LO_1806","ENG_062_MZB_LO_1806-09.09.2011","09.09.2011",2011,9,9,0.842117515,3
"ENG_062_MZB_LO_1806","ENG_062_MZB_LO_1806-24.10.2012","24.10.2012",2012,10,24,0.857598738,3
"ENG_062_MZB_LO_1806","ENG_062_MZB_LO_1806-03.10.2013","03.10.2013",2013,10,3,0.8627436,3
"ENG_062_MZB_LO_1806","ENG_062_MZB_LO_1806-12.09.2014","12.09.2014",2014,9,12,0.894585128,3
"ENG_062_MZB_LO_1806","ENG_062_MZB_LO_1806-15.09.2015","15.09.2015",2015,9,15,0.818879373,3
"ENG_062_MZB_LO_1806","ENG_062_MZB_LO_1806-03.10.2016","03.10.2016",2016,10,3,0.808025986,3
"ENG_062_MZB_LO_1806","ENG_062_MZB_LO_1806-25.10.2017","25.10.2017",2017,10,25,0.893455872,2
"ENG_062_MZB_LO_1806","ENG_062_MZB_LO_1806-29.10.2018","29.10.2018",2018,10,29,0.83229627,3
"ENG_062_MZB_LO_1806","ENG_062_MZB_LO_1806-26.11.2019","26.11.2019",2019,11,26,0.763085991,3
"ENG_062_MZB_LO_1806","ENG_062_MZB_LO_1806-29.09.2020","29.09.2020",2020,9,29,0.855172102,3
"ENG_062_MZB_LO_1806","ENG_062_MZB_LO_1806-06.09.2021","06.09.2021",2021,9,6,0.847976877,3
"ENG_062_MZB_LO_1809","ENG_062_MZB_LO_1809-30.10.2003","30.10.2003",2003,10,30,0.878105274,2
"ENG_062_MZB_LO_1809","ENG_062_MZB_LO_1809-27.10.2004","27.10.2004",2004,10,27,0.941270241,2
"ENG_062_MZB_LO_1809","ENG_062_MZB_LO_1809-19.10.2006","19.10.2006",2006,10,19,0.977724554,1
"ENG_062_MZB_LO_1809","ENG_062_MZB_LO_1809-21.11.2008","21.11.2008",2008,11,21,0.894381856,2
"ENG_062_MZB_LO_1809","ENG_062_MZB_LO_1809-22.10.2009","22.10.2009",2009,10,22,1.084330695,3
"ENG_062_MZB_LO_1809","ENG_062_MZB_LO_1809-05.10.2010","05.10.2010",2010,10,5,0.867700721,3
"ENG_062_MZB_LO_1809","ENG_062_MZB_LO_1809-15.09.2011","15.09.2011",2011,9,15,0.907898809,2
"ENG_062_MZB_LO_1809","ENG_062_MZB_LO_1809-19.11.2013","19.11.2013",2013,11,19,0.909102784,3
"ENG_062_MZB_LO_1809","ENG_062_MZB_LO_1809-12.11.2014","12.11.2014",2014,11,12,0.967316918,3
"ENG_062_MZB_LO_1809","ENG_062_MZB_LO_1809-22.10.2015","22.10.2015",2015,10,22,0.886618507,3
"ENG_062_MZB_LO_1809","ENG_062_MZB_LO_1809-24.10.2016","24.10.2016",2016,10,24,0.892212664,3
"ENG_062_MZB_LO_1809","ENG_062_MZB_LO_1809-16.10.2017","16.10.2017",2017,10,16,0.934955695,2
"ENG_062_MZB_LO_1809","ENG_062_MZB_LO_1809-18.10.2018","18.10.2018",2018,10,18,0.92657951,2
"ENG_062_MZB_LO_1809","ENG_062_MZB_LO_1809-17.10.2019","17.10.2019",2019,10,17,0.991982745,1
"ENG_062_MZB_LO_1809","ENG_062_MZB_LO_1809-19.10.2020","19.10.2020",2020,10,19,1.011385384,1
"ENG_062_MZB_LO_1809","ENG_062_MZB_LO_1809-27.10.2021","27.10.2021",2021,10,27,1.017389226,2
"ENG_062_MZB_LO_1809","ENG_062_MZB_LO_1809-26.09.2022","26.09.2022",2022,9,26,0.937877744,2
"ENG_062_MZB_LO_1809","ENG_062_MZB_LO_1809-17.11.2023","17.11.2023",2023,11,17,0.961800366,2
"ENG_062_MZB_LO_181","ENG_062_MZB_LO_181-24.09.2002","24.09.2002",2002,9,24,0.988037439,2
"ENG_062_MZB_LO_181","ENG_062_MZB_LO_181-15.10.2003","15.10.2003",2003,10,15,0.79093161,3
"ENG_062_MZB_LO_181","ENG_062_MZB_LO_181-11.10.2004","11.10.2004",2004,10,11,0.956721935,2
"ENG_062_MZB_LO_181","ENG_062_MZB_LO_181-20.09.2005","20.09.2005",2005,9,20,0.92779166,2
"ENG_062_MZB_LO_181","ENG_062_MZB_LO_181-28.09.2017","28.09.2017",2017,9,28,0.973771849,2
"ENG_062_MZB_LO_181","ENG_062_MZB_LO_181-22.10.2018","22.10.2018",2018,10,22,0.995057829,1
"ENG_062_MZB_LO_181","ENG_062_MZB_LO_181-13.09.2019","13.09.2019",2019,9,13,1.031118474,1
"ENG_062_MZB_LO_181","ENG_062_MZB_LO_181-14.09.2023","14.09.2023",2023,9,14,0.978699132,2
"ENG_062_MZB_LO_1811","ENG_062_MZB_LO_1811-30.09.2003","30.09.2003",2003,9,30,1.011710422,1
"ENG_062_MZB_LO_1811","ENG_062_MZB_LO_1811-01.11.2006","01.11.2006",2006,11,1,1.037501206,1
"ENG_062_MZB_LO_1811","ENG_062_MZB_LO_1811-20.10.2009","20.10.2009",2009,10,20,1.008711068,1
"ENG_062_MZB_LO_1811","ENG_062_MZB_LO_1811-20.09.2010","20.09.2010",2010,9,20,1.004017372,1
"ENG_062_MZB_LO_1811","ENG_062_MZB_LO_1811-05.10.2011","05.10.2011",2011,10,5,0.987211822,1
"ENG_062_MZB_LO_1811","ENG_062_MZB_LO_1811-07.11.2012","07.11.2012",2012,11,7,1.067776318,1
"ENG_062_MZB_LO_1811","ENG_062_MZB_LO_1811-17.09.2013","17.09.2013",2013,9,17,1.074419433,1
"ENG_062_MZB_LO_1811","ENG_062_MZB_LO_1811-21.11.2014","21.11.2014",2014,11,21,1.046847946,1
"ENG_062_MZB_LO_1811","ENG_062_MZB_LO_1811-05.10.2015","05.10.2015",2015,10,5,1.083333156,1
"ENG_062_MZB_LO_1811","ENG_062_MZB_LO_1811-29.09.2017","29.09.2017",2017,9,29,1.074992803,1
"ENG_062_MZB_LO_1811","ENG_062_MZB_LO_1811-16.10.2018","16.10.2018",2018,10,16,1.080685885,1
"ENG_062_MZB_LO_1811","ENG_062_MZB_LO_1811-11.10.2019","11.10.2019",2019,10,11,1.107993519,1
"ENG_062_MZB_LO_1811","ENG_062_MZB_LO_1811-29.09.2020","29.09.2020",2020,9,29,1.099152857,1
"ENG_062_MZB_LO_1811","ENG_062_MZB_LO_1811-13.09.2021","13.09.2021",2021,9,13,1.176546754,1
"ENG_062_MZB_LO_1811","ENG_062_MZB_LO_1811-05.09.2022","05.09.2022",2022,9,5,1.132591897,1
"ENG_062_MZB_LO_1811","ENG_062_MZB_LO_1811-12.10.2023","12.10.2023",2023,10,12,1.138574818,1
"ENG_062_MZB_LO_1811","ENG_062_MZB_LO_1811-16.09.2024","16.09.2024",2024,9,16,1.113110055,1
"ENG_062_MZB_LO_1813","ENG_062_MZB_LO_1813-24.10.2002","24.10.2002",2002,10,24,1.019258243,1
"ENG_062_MZB_LO_1813","ENG_062_MZB_LO_1813-15.11.2005","15.11.2005",2005,11,15,0.884740409,2
"ENG_062_MZB_LO_1813","ENG_062_MZB_LO_1813-18.09.2008","18.09.2008",2008,9,18,0.889593148,2
"ENG_062_MZB_LO_1813","ENG_062_MZB_LO_1813-28.10.2009","28.10.2009",2009,10,28,0.817603055,3
"ENG_062_MZB_LO_1813","ENG_062_MZB_LO_1813-29.10.2010","29.10.2010",2010,10,29,0.867618326,2
"ENG_062_MZB_LO_1813","ENG_062_MZB_LO_1813-29.09.2011","29.09.2011",2011,9,29,0.840781261,3
"ENG_062_MZB_LO_1813","ENG_062_MZB_LO_1813-07.09.2012","07.09.2012",2012,9,7,0.858970564,3
"ENG_062_MZB_LO_1813","ENG_062_MZB_LO_1813-30.10.2013","30.10.2013",2013,10,30,0.962964259,2
"ENG_062_MZB_LO_1813","ENG_062_MZB_LO_1813-19.09.2014","19.09.2014",2014,9,19,0.874522227,2
"ENG_062_MZB_LO_1813","ENG_062_MZB_LO_1813-19.10.2015","19.10.2015",2015,10,19,0.939230928,2
"ENG_062_MZB_LO_1813","ENG_062_MZB_LO_1813-20.10.2016","20.10.2016",2016,10,20,0.941983247,2
"ENG_062_MZB_LO_1813","ENG_062_MZB_LO_1813-18.09.2017","18.09.2017",2017,9,18,0.850973479,3
"ENG_062_MZB_LO_1813","ENG_062_MZB_LO_1813-17.09.2018","17.09.2018",2018,9,17,0.825955474,3
"ENG_062_MZB_LO_1813","ENG_062_MZB_LO_1813-05.11.2019","05.11.2019",2019,11,5,0.97620188,1
"ENG_062_MZB_LO_1813","ENG_062_MZB_LO_1813-25.09.2020","25.09.2020",2020,9,25,1.055256446,1
"ENG_062_MZB_LO_1813","ENG_062_MZB_LO_1813-21.09.2021","21.09.2021",2021,9,21,0.962934969,2
"ENG_062_MZB_LO_1813","ENG_062_MZB_LO_1813-16.09.2022","16.09.2022",2022,9,16,0.88649452,2
"ENG_062_MZB_LO_1813","ENG_062_MZB_LO_1813-09.11.2023","09.11.2023",2023,11,9,0.957541069,2
"ENG_062_MZB_LO_1813","ENG_062_MZB_LO_1813-28.10.2024","28.10.2024",2024,10,28,0.970783597,2
"ENG_062_MZB_LO_1815","ENG_062_MZB_LO_1815-29.11.2002","29.11.2002",2002,11,29,0.677305614,4
"ENG_062_MZB_LO_1815","ENG_062_MZB_LO_1815-29.10.2003","29.10.2003",2003,10,29,0.756000126,3
"ENG_062_MZB_LO_1815","ENG_062_MZB_LO_1815-30.09.2005","30.09.2005",2005,9,30,0.689931041,4
"ENG_062_MZB_LO_1815","ENG_062_MZB_LO_1815-24.09.2008","24.09.2008",2008,9,24,0.813576099,3
"ENG_062_MZB_LO_1815","ENG_062_MZB_LO_1815-17.10.2012","17.10.2012",2012,10,17,0.820136461,3
"ENG_062_MZB_LO_1815","ENG_062_MZB_LO_1815-16.10.2015","16.10.2015",2015,10,16,0.789578411,3
"ENG_062_MZB_LO_1815","ENG_062_MZB_LO_1815-12.09.2019","12.09.2019",2019,9,12,0.74114492,3
"ENG_062_MZB_LO_1815","ENG_062_MZB_LO_1815-28.10.2020","28.10.2020",2020,10,28,0.749817161,3
"ENG_062_MZB_LO_1815","ENG_062_MZB_LO_1815-10.11.2021","10.11.2021",2021,11,10,0.735135621,3
"ENG_062_MZB_LO_1815","ENG_062_MZB_LO_1815-14.11.2023","14.11.2023",2023,11,14,0.736563648,3
"ENG_062_MZB_LO_1816","ENG_062_MZB_LO_1816-19.11.2002","19.11.2002",2002,11,19,0.850269164,3
"ENG_062_MZB_LO_1816","ENG_062_MZB_LO_1816-22.11.2005","22.11.2005",2005,11,22,0.831072985,3
"ENG_062_MZB_LO_1816","ENG_062_MZB_LO_1816-23.10.2007","23.10.2007",2007,10,23,0.94898382,2
"ENG_062_MZB_LO_1816","ENG_062_MZB_LO_1816-25.09.2009","25.09.2009",2009,9,25,1.046640069,1
"ENG_062_MZB_LO_1816","ENG_062_MZB_LO_1816-05.11.2010","05.11.2010",2010,11,5,0.977908371,1
"ENG_062_MZB_LO_1816","ENG_062_MZB_LO_1816-04.10.2011","04.10.2011",2011,10,4,0.946004775,2
"ENG_062_MZB_LO_1816","ENG_062_MZB_LO_1816-06.11.2012","06.11.2012",2012,11,6,1.051335302,1
"ENG_062_MZB_LO_1816","ENG_062_MZB_LO_1816-23.09.2013","23.09.2013",2013,9,23,1.047061612,1
"ENG_062_MZB_LO_1816","ENG_062_MZB_LO_1816-07.10.2014","07.10.2014",2014,10,7,1.064785359,1
"ENG_062_MZB_LO_1816","ENG_062_MZB_LO_1816-22.10.2015","22.10.2015",2015,10,22,1.008323077,1
"ENG_062_MZB_LO_1816","ENG_062_MZB_LO_1816-07.10.2016","07.10.2016",2016,10,7,0.994247762,1
"ENG_062_MZB_LO_1816","ENG_062_MZB_LO_1816-10.10.2017","10.10.2017",2017,10,10,1.069384853,1
"ENG_062_MZB_LO_1816","ENG_062_MZB_LO_1816-16.10.2018","16.10.2018",2018,10,16,0.96231601,2
"ENG_062_MZB_LO_1816","ENG_062_MZB_LO_1816-24.09.2019","24.09.2019",2019,9,24,1.061213818,1
"ENG_062_MZB_LO_1817","ENG_062_MZB_LO_1817-14.11.2012","14.11.2012",2012,11,14,0.97669048,1
"ENG_062_MZB_LO_1817","ENG_062_MZB_LO_1817-24.10.2013","24.10.2013",2013,10,24,0.988052402,1
"ENG_062_MZB_LO_1817","ENG_062_MZB_LO_1817-13.11.2014","13.11.2014",2014,11,13,0.691997321,4
"ENG_062_MZB_LO_1817","ENG_062_MZB_LO_1817-03.11.2015","03.11.2015",2015,11,3,0.734059218,3
"ENG_062_MZB_LO_1817","ENG_062_MZB_LO_1817-18.10.2016","18.10.2016",2016,10,18,0.841013574,3
"ENG_062_MZB_LO_1817","ENG_062_MZB_LO_1817-06.09.2017","06.09.2017",2017,9,6,0.808381007,3
"ENG_062_MZB_LO_1817","ENG_062_MZB_LO_1817-08.10.2018","08.10.2018",2018,10,8,0.885306877,2
"ENG_062_MZB_LO_1817","ENG_062_MZB_LO_1817-06.11.2019","06.11.2019",2019,11,6,0.816364506,3
"ENG_062_MZB_LO_1817","ENG_062_MZB_LO_1817-09.09.2020","09.09.2020",2020,9,9,0.997973173,1
"ENG_062_MZB_LO_1817","ENG_062_MZB_LO_1817-22.09.2021","22.09.2021",2021,9,22,0.772451757,3
"ENG_062_MZB_LO_1818","ENG_062_MZB_LO_1818-27.10.2004","27.10.2004",2004,10,27,0.755153255,3
"ENG_062_MZB_LO_1818","ENG_062_MZB_LO_1818-31.10.2006","31.10.2006",2006,10,31,0.704075557,4
"ENG_062_MZB_LO_1818","ENG_062_MZB_LO_1818-20.11.2007","20.11.2007",2007,11,20,0.749066616,3
"ENG_062_MZB_LO_1818","ENG_062_MZB_LO_1818-25.10.2013","25.10.2013",2013,10,25,0.776628572,3
"ENG_062_MZB_LO_1818","ENG_062_MZB_LO_1818-09.09.2016","09.09.2016",2016,9,9,0.667389262,4
"ENG_062_MZB_LO_1818","ENG_062_MZB_LO_1818-13.10.2017","13.10.2017",2017,10,13,0.677443368,4
"ENG_062_MZB_LO_1818","ENG_062_MZB_LO_1818-18.09.2018","18.09.2018",2018,9,18,0.651477234,4
"ENG_062_MZB_LO_1818","ENG_062_MZB_LO_1818-30.11.2020","30.11.2020",2020,11,30,0.942969801,2
"ENG_062_MZB_LO_1818","ENG_062_MZB_LO_1818-14.10.2022","14.10.2022",2022,10,14,0.650949209,4
"ENG_062_MZB_LO_1819","ENG_062_MZB_LO_1819-30.11.2002","30.11.2002",2002,11,30,0.828201163,3
"ENG_062_MZB_LO_1819","ENG_062_MZB_LO_1819-14.10.2003","14.10.2003",2003,10,14,0.765983455,3
"ENG_062_MZB_LO_1819","ENG_062_MZB_LO_1819-31.10.2006","31.10.2006",2006,10,31,0.84302764,3
"ENG_062_MZB_LO_1819","ENG_062_MZB_LO_1819-16.11.2012","16.11.2012",2012,11,16,0.843014137,3
"ENG_062_MZB_LO_1819","ENG_062_MZB_LO_1819-11.10.2013","11.10.2013",2013,10,11,0.772971768,3
"ENG_062_MZB_LO_1819","ENG_062_MZB_LO_1819-12.11.2014","12.11.2014",2014,11,12,0.8180953,3
"ENG_062_MZB_LO_1819","ENG_062_MZB_LO_1819-02.09.2015","02.09.2015",2015,9,2,0.817779276,3
"ENG_062_MZB_LO_1819","ENG_062_MZB_LO_1819-09.09.2016","09.09.2016",2016,9,9,0.797001741,3
"ENG_062_MZB_LO_1819","ENG_062_MZB_LO_1819-13.10.2017","13.10.2017",2017,10,13,0.832753307,3
"ENG_062_MZB_LO_1819","ENG_062_MZB_LO_1819-18.09.2018","18.09.2018",2018,9,18,0.831338993,3
"ENG_062_MZB_LO_1819","ENG_062_MZB_LO_1819-22.10.2020","22.10.2020",2020,10,22,0.884166067,2
"ENG_062_MZB_LO_1819","ENG_062_MZB_LO_1819-16.11.2021","16.11.2021",2021,11,16,0.872105776,3
"ENG_062_MZB_LO_1819","ENG_062_MZB_LO_1819-29.11.2022","29.11.2022",2022,11,29,0.801274622,3
"ENG_062_MZB_LO_1819","ENG_062_MZB_LO_1819-31.10.2023","31.10.2023",2023,10,31,0.826389082,3
"ENG_062_MZB_LO_1819","ENG_062_MZB_LO_1819-15.11.2024","15.11.2024",2024,11,15,0.866401653,2
"ENG_062_MZB_LO_1820","ENG_062_MZB_LO_1820-21.10.2002","21.10.2002",2002,10,21,0.985561656,1
"ENG_062_MZB_LO_1820","ENG_062_MZB_LO_1820-18.10.2005","18.10.2005",2005,10,18,1.053443259,1
"ENG_062_MZB_LO_1820","ENG_062_MZB_LO_1820-13.11.2012","13.11.2012",2012,11,13,1.093941632,1
"ENG_062_MZB_LO_1820","ENG_062_MZB_LO_1820-11.10.2013","11.10.2013",2013,10,11,1.128432456,1
"ENG_062_MZB_LO_1820","ENG_062_MZB_LO_1820-20.10.2014","20.10.2014",2014,10,20,1.067466653,1
"ENG_062_MZB_LO_1820","ENG_062_MZB_LO_1820-02.09.2015","02.09.2015",2015,9,2,0.956574407,2
"ENG_062_MZB_LO_1820","ENG_062_MZB_LO_1820-27.09.2016","27.09.2016",2016,9,27,1.027703703,1
"ENG_062_MZB_LO_1820","ENG_062_MZB_LO_1820-06.11.2017","06.11.2017",2017,11,6,0.992743049,1
"ENG_062_MZB_LO_1820","ENG_062_MZB_LO_1820-11.09.2018","11.09.2018",2018,9,11,0.97799193,2
"ENG_062_MZB_LO_1820","ENG_062_MZB_LO_1820-22.11.2019","22.11.2019",2019,11,22,1.081864078,1
"ENG_062_MZB_LO_1820","ENG_062_MZB_LO_1820-19.10.2020","19.10.2020",2020,10,19,1.040019507,1
"ENG_062_MZB_LO_1820","ENG_062_MZB_LO_1820-08.09.2021","08.09.2021",2021,9,8,0.963242338,2
"ENG_062_MZB_LO_1820","ENG_062_MZB_LO_1820-29.11.2022","29.11.2022",2022,11,29,0.985333281,1
"ENG_062_MZB_LO_1820","ENG_062_MZB_LO_1820-10.11.2023","10.11.2023",2023,11,10,0.951945175,2
"ENG_062_MZB_LO_1821","ENG_062_MZB_LO_1821-22.09.2010","22.09.2010",2010,9,22,0.701350171,4
"ENG_062_MZB_LO_1821","ENG_062_MZB_LO_1821-18.10.2011","18.10.2011",2011,10,18,0.669883843,4
"ENG_062_MZB_LO_1821","ENG_062_MZB_LO_1821-04.10.2012","04.10.2012",2012,10,4,0.655768119,4
"ENG_062_MZB_LO_1821","ENG_062_MZB_LO_1821-30.10.2013","30.10.2013",2013,10,30,0.67640441,4
"ENG_062_MZB_LO_1821","ENG_062_MZB_LO_1821-09.09.2014","09.09.2014",2014,9,9,0.575015084,5
"ENG_062_MZB_LO_1821","ENG_062_MZB_LO_1821-22.09.2015","22.09.2015",2015,9,22,0.683399887,4
"ENG_062_MZB_LO_1821","ENG_062_MZB_LO_1821-06.09.2016","06.09.2016",2016,9,6,0.513973243,5
"ENG_062_MZB_LO_1821","ENG_062_MZB_LO_1821-07.09.2017","07.09.2017",2017,9,7,0.67354777,4
"ENG_062_MZB_LO_1821","ENG_062_MZB_LO_1821-04.09.2018","04.09.2018",2018,9,4,0.627226226,4
"ENG_062_MZB_LO_1821","ENG_062_MZB_LO_1821-02.09.2019","02.09.2019",2019,9,2,0.637543339,4
"ENG_062_MZB_LO_1821","ENG_062_MZB_LO_1821-25.09.2020","25.09.2020",2020,9,25,0.578702722,5
"ENG_062_MZB_LO_1821","ENG_062_MZB_LO_1821-07.09.2021","07.09.2021",2021,9,7,0.567524829,5
"ENG_062_MZB_LO_1821","ENG_062_MZB_LO_1821-09.11.2022","09.11.2022",2022,11,9,0.586834352,5
"ENG_062_MZB_LO_1821","ENG_062_MZB_LO_1821-26.10.2023","26.10.2023",2023,10,26,0.659843593,4
"ENG_062_MZB_LO_1821","ENG_062_MZB_LO_1821-03.09.2024","03.09.2024",2024,9,3,0.608355917,4
"ENG_062_MZB_LO_1823","ENG_062_MZB_LO_1823-13.09.2002","13.09.2002",2002,9,13,1.013576897,2
"ENG_062_MZB_LO_1823","ENG_062_MZB_LO_1823-16.09.2003","16.09.2003",2003,9,16,1.053232891,3
"ENG_062_MZB_LO_1823","ENG_062_MZB_LO_1823-21.10.2005","21.10.2005",2005,10,21,1.00043416,1
"ENG_062_MZB_LO_1823","ENG_062_MZB_LO_1823-20.09.2006","20.09.2006",2006,9,20,1.033422202,1
"ENG_062_MZB_LO_1823","ENG_062_MZB_LO_1823-26.09.2007","26.09.2007",2007,9,26,1.08060427,1
"ENG_062_MZB_LO_1823","ENG_062_MZB_LO_1823-14.10.2008","14.10.2008",2008,10,14,1.040697114,1
"ENG_062_MZB_LO_1823","ENG_062_MZB_LO_1823-18.11.2009","18.11.2009",2009,11,18,1.001621587,1
"ENG_062_MZB_LO_1823","ENG_062_MZB_LO_1823-02.11.2010","02.11.2010",2010,11,2,0.918733649,2
"ENG_062_MZB_LO_1823","ENG_062_MZB_LO_1823-23.09.2011","23.09.2011",2011,9,23,0.938553007,2
"ENG_062_MZB_LO_1823","ENG_062_MZB_LO_1823-14.11.2012","14.11.2012",2012,11,14,0.946601839,2
"ENG_062_MZB_LO_1823","ENG_062_MZB_LO_1823-24.10.2013","24.10.2013",2013,10,24,0.932112947,2
"ENG_062_MZB_LO_1823","ENG_062_MZB_LO_1823-04.09.2014","04.09.2014",2014,9,4,0.967137879,2
"ENG_062_MZB_LO_1823","ENG_062_MZB_LO_1823-03.11.2015","03.11.2015",2015,11,3,1.064853649,1
"ENG_062_MZB_LO_1823","ENG_062_MZB_LO_1823-23.09.2016","23.09.2016",2016,9,23,0.980094284,3
"ENG_062_MZB_LO_1823","ENG_062_MZB_LO_1823-08.09.2017","08.09.2017",2017,9,8,1.000916727,2
"ENG_062_MZB_LO_1823","ENG_062_MZB_LO_1823-11.10.2018","11.10.2018",2018,10,11,0.976735649,2
"ENG_062_MZB_LO_1823","ENG_062_MZB_LO_1823-31.10.2019","31.10.2019",2019,10,31,1.08568975,1
"ENG_062_MZB_LO_1823","ENG_062_MZB_LO_1823-16.09.2020","16.09.2020",2020,9,16,1.007811432,1
"ENG_062_MZB_LO_1823","ENG_062_MZB_LO_1823-12.10.2021","12.10.2021",2021,10,12,0.988935681,1
"ENG_062_MZB_LO_1823","ENG_062_MZB_LO_1823-09.09.2022","09.09.2022",2022,9,9,1.000658348,1
"ENG_062_MZB_LO_1823","ENG_062_MZB_LO_1823-15.09.2023","15.09.2023",2023,9,15,0.987567705,1
"ENG_062_MZB_LO_1824","ENG_062_MZB_LO_1824-29.10.2003","29.10.2003",2003,10,29,0.74259384,3
"ENG_062_MZB_LO_1824","ENG_062_MZB_LO_1824-25.11.2004","25.11.2004",2004,11,25,0.779159237,3
"ENG_062_MZB_LO_1824","ENG_062_MZB_LO_1824-30.09.2005","30.09.2005",2005,9,30,0.835177206,3
"ENG_062_MZB_LO_1824","ENG_062_MZB_LO_1824-30.10.2006","30.10.2006",2006,10,30,0.750686041,3
"ENG_062_MZB_LO_1824","ENG_062_MZB_LO_1824-04.11.2009","04.11.2009",2009,11,4,0.762656315,3
"ENG_062_MZB_LO_1824","ENG_062_MZB_LO_1824-10.09.2013","10.09.2013",2013,9,10,0.799831481,3
"ENG_062_MZB_LO_1824","ENG_062_MZB_LO_1824-05.10.2015","05.10.2015",2015,10,5,0.824537418,3
