"Unique.ID","Samp.ID","Sampling.date","year","month","day","eqr","eqc"
"ESP_034_MZB_LO_1","ESP_034_MZB_LO_1-16.09.1987","16.09.1987",1987,9,16,0.51,3
"ESP_034_MZB_LO_1","ESP_034_MZB_LO_1-28.10.1989","28.10.1989",1989,10,28,0.33,4
"ESP_034_MZB_LO_1","ESP_034_MZB_LO_1-11.10.1990","11.10.1990",1990,10,11,0.04,5
"ESP_034_MZB_LO_1","ESP_034_MZB_LO_1-06.09.1996","06.09.1996",1996,9,6,0.89,2
"ESP_034_MZB_LO_1","ESP_034_MZB_LO_1-26.08.1997","26.08.1997",1997,8,26,0.95,1
"ESP_034_MZB_LO_1","ESP_034_MZB_LO_1-04.09.1998","04.09.1998",1998,9,4,0.92,1
"ESP_034_MZB_LO_1","ESP_034_MZB_LO_1-05.10.1999","05.10.1999",1999,10,5,0.57,3
"ESP_034_MZB_LO_1","ESP_034_MZB_LO_1-24.08.2000","24.08.2000",2000,8,24,0.62,3
"ESP_034_MZB_LO_1","ESP_034_MZB_LO_1-03.10.2001","03.10.2001",2001,10,3,0.72,2
"ESP_034_MZB_LO_1","ESP_034_MZB_LO_1-20.09.2002","20.09.2002",2002,9,20,0.48,3
"ESP_034_MZB_LO_1","ESP_034_MZB_LO_1-28.08.2003","28.08.2003",2003,8,28,0.59,3
"ESP_034_MZB_LO_1","ESP_034_MZB_LO_1-02.09.2004","02.09.2004",2004,9,2,0.93,1
"ESP_034_MZB_LO_1","ESP_034_MZB_LO_1-02.09.2005","02.09.2005",2005,9,2,0.7,2
"ESP_034_MZB_LO_1","ESP_034_MZB_LO_1-22.08.2006","22.08.2006",2006,8,22,0.96,1
"ESP_034_MZB_LO_1","ESP_034_MZB_LO_1-29.08.2007","29.08.2007",2007,8,29,0.74,2
"ESP_034_MZB_LO_1","ESP_034_MZB_LO_1-21.08.2008","21.08.2008",2008,8,21,0.73,2
"ESP_034_MZB_LO_1","ESP_034_MZB_LO_1-01.09.2009","01.09.2009",2009,9,1,0.9,1
"ESP_034_MZB_LO_1","ESP_034_MZB_LO_1-30.08.2010","30.08.2010",2010,8,30,0.75,2
"ESP_034_MZB_LO_1","ESP_034_MZB_LO_1-08.09.2011","08.09.2011",2011,9,8,0.8,2
"ESP_034_MZB_LO_1","ESP_034_MZB_LO_1-27.08.2012","27.08.2012",2012,8,27,0.82,2
"ESP_034_MZB_LO_1","ESP_034_MZB_LO_1-02.09.2013","02.09.2013",2013,9,2,0.91,1
"ESP_034_MZB_LO_1","ESP_034_MZB_LO_1-27.08.2014","27.08.2014",2014,8,27,0.87,2
"ESP_034_MZB_LO_1","ESP_034_MZB_LO_1-04.09.2015","04.09.2015",2015,9,4,0.8,2
"ESP_034_MZB_LO_1","ESP_034_MZB_LO_1-08.08.2016","08.08.2016",2016,8,8,0.98,1
"ESP_034_MZB_LO_1","ESP_034_MZB_LO_1-21.08.2017","21.08.2017",2017,8,21,0.86,2
"ESP_034_MZB_LO_1","ESP_034_MZB_LO_1-14.09.2020","14.09.2020",2020,9,14,0.76,2
"ESP_034_MZB_LO_1","ESP_034_MZB_LO_1-25.08.2021","25.08.2021",2021,8,25,0.88,2
"ESP_034_MZB_LO_10","ESP_034_MZB_LO_10-17.09.1987","17.09.1987",1987,9,17,0.02,5
"ESP_034_MZB_LO_10","ESP_034_MZB_LO_10-19.08.1996","19.08.1996",1996,8,19,0.03,5
"ESP_034_MZB_LO_10","ESP_034_MZB_LO_10-21.08.1997","21.08.1997",1997,8,21,0.03,5
"ESP_034_MZB_LO_10","ESP_034_MZB_LO_10-02.09.1998","02.09.1998",1998,9,2,0.02,5
"ESP_034_MZB_LO_10","ESP_034_MZB_LO_10-29.09.1999","29.09.1999",1999,9,29,0.02,5
"ESP_034_MZB_LO_10","ESP_034_MZB_LO_10-01.09.2000","01.09.2000",2000,9,1,0.01,5
"ESP_034_MZB_LO_10","ESP_034_MZB_LO_10-09.10.2001","09.10.2001",2001,10,9,0.01,5
"ESP_034_MZB_LO_10","ESP_034_MZB_LO_10-20.09.2002","20.09.2002",2002,9,20,0.01,5
"ESP_034_MZB_LO_10","ESP_034_MZB_LO_10-27.08.2003","27.08.2003",2003,8,27,0.26,4
"ESP_034_MZB_LO_10","ESP_034_MZB_LO_10-10.09.2004","10.09.2004",2004,9,10,0.35,4
"ESP_034_MZB_LO_10","ESP_034_MZB_LO_10-02.09.2005","02.09.2005",2005,9,2,0.09,5
"ESP_034_MZB_LO_10","ESP_034_MZB_LO_10-31.08.2006","31.08.2006",2006,8,31,0.15,5
"ESP_034_MZB_LO_10","ESP_034_MZB_LO_10-27.08.2007","27.08.2007",2007,8,27,0.19,5
"ESP_034_MZB_LO_10","ESP_034_MZB_LO_10-01.09.2008","01.09.2008",2008,9,1,0.26,4
"ESP_034_MZB_LO_10","ESP_034_MZB_LO_10-24.09.2009","24.09.2009",2009,9,24,0.18,5
"ESP_034_MZB_LO_10","ESP_034_MZB_LO_10-24.08.2010","24.08.2010",2010,8,24,0.23,4
"ESP_034_MZB_LO_10","ESP_034_MZB_LO_10-25.08.2011","25.08.2011",2011,8,25,0.46,3
"ESP_034_MZB_LO_10","ESP_034_MZB_LO_10-21.08.2012","21.08.2012",2012,8,21,0.54,3
"ESP_034_MZB_LO_10","ESP_034_MZB_LO_10-05.09.2013","05.09.2013",2013,9,5,0.61,3
"ESP_034_MZB_LO_10","ESP_034_MZB_LO_10-04.09.2014","04.09.2014",2014,9,4,0.59,3
"ESP_034_MZB_LO_10","ESP_034_MZB_LO_10-11.09.2015","11.09.2015",2015,9,11,0.54,3
"ESP_034_MZB_LO_10","ESP_034_MZB_LO_10-12.08.2016","12.08.2016",2016,8,12,0.57,3
"ESP_034_MZB_LO_10","ESP_034_MZB_LO_10-08.09.2017","08.09.2017",2017,9,8,0.58,3
"ESP_034_MZB_LO_10","ESP_034_MZB_LO_10-21.09.2020","21.09.2020",2020,9,21,0.49,3
"ESP_034_MZB_LO_10","ESP_034_MZB_LO_10-01.09.2021","01.09.2021",2021,9,1,0.55,3
"ESP_034_MZB_LO_12","ESP_034_MZB_LO_12-19.08.1996","19.08.1996",1996,8,19,0.54,3
"ESP_034_MZB_LO_12","ESP_034_MZB_LO_12-21.08.1997","21.08.1997",1997,8,21,0.59,3
"ESP_034_MZB_LO_12","ESP_034_MZB_LO_12-02.09.1998","02.09.1998",1998,9,2,0.84,2
"ESP_034_MZB_LO_12","ESP_034_MZB_LO_12-30.09.1999","30.09.1999",1999,9,30,1.02,1
"ESP_034_MZB_LO_12","ESP_034_MZB_LO_12-23.08.2000","23.08.2000",2000,8,23,1.08,1
"ESP_034_MZB_LO_12","ESP_034_MZB_LO_12-11.10.2001","11.10.2001",2001,10,11,0.83,2
"ESP_034_MZB_LO_12","ESP_034_MZB_LO_12-20.09.2002","20.09.2002",2002,9,20,0.96,1
"ESP_034_MZB_LO_12","ESP_034_MZB_LO_12-29.08.2003","29.08.2003",2003,8,29,0.78,2
"ESP_034_MZB_LO_12","ESP_034_MZB_LO_12-26.08.2004","26.08.2004",2004,8,26,0.85,2
"ESP_034_MZB_LO_12","ESP_034_MZB_LO_12-30.08.2005","30.08.2005",2005,8,30,0.94,1
"ESP_034_MZB_LO_12","ESP_034_MZB_LO_12-31.08.2006","31.08.2006",2006,8,31,0.88,2
"ESP_034_MZB_LO_12","ESP_034_MZB_LO_12-27.08.2007","27.08.2007",2007,8,27,0.92,1
"ESP_034_MZB_LO_12","ESP_034_MZB_LO_12-29.08.2008","29.08.2008",2008,8,29,0.65,3
"ESP_034_MZB_LO_12","ESP_034_MZB_LO_12-26.08.2009","26.08.2009",2009,8,26,1,1
"ESP_034_MZB_LO_12","ESP_034_MZB_LO_12-24.08.2010","24.08.2010",2010,8,24,0.62,3
"ESP_034_MZB_LO_12","ESP_034_MZB_LO_12-25.08.2011","25.08.2011",2011,8,25,0.63,3
"ESP_034_MZB_LO_12","ESP_034_MZB_LO_12-22.08.2012","22.08.2012",2012,8,22,0.73,2
"ESP_034_MZB_LO_12","ESP_034_MZB_LO_12-05.09.2013","05.09.2013",2013,9,5,0.52,3
"ESP_034_MZB_LO_12","ESP_034_MZB_LO_12-03.09.2014","03.09.2014",2014,9,3,1.01,1
"ESP_034_MZB_LO_12","ESP_034_MZB_LO_12-28.08.2015","28.08.2015",2015,8,28,0.74,2
"ESP_034_MZB_LO_12","ESP_034_MZB_LO_12-11.08.2016","11.08.2016",2016,8,11,1.08,1
"ESP_034_MZB_LO_12","ESP_034_MZB_LO_12-01.09.2017","01.09.2017",2017,9,1,0.96,1
"ESP_034_MZB_LO_12","ESP_034_MZB_LO_12-22.09.2020","22.09.2020",2020,9,22,0.83,2
"ESP_034_MZB_LO_12","ESP_034_MZB_LO_12-06.09.2021","06.09.2021",2021,9,6,0.86,2
"ESP_034_MZB_LO_13","ESP_034_MZB_LO_13-30.08.2006","30.08.2006",2006,8,30,0.1,5
"ESP_034_MZB_LO_13","ESP_034_MZB_LO_13-20.08.2007","20.08.2007",2007,8,20,0.1,5
"ESP_034_MZB_LO_13","ESP_034_MZB_LO_13-01.09.2008","01.09.2008",2008,9,1,0.13,5
"ESP_034_MZB_LO_13","ESP_034_MZB_LO_13-26.08.2009","26.08.2009",2009,8,26,0.11,5
"ESP_034_MZB_LO_13","ESP_034_MZB_LO_13-01.09.2010","01.09.2010",2010,9,1,0.51,3
"ESP_034_MZB_LO_13","ESP_034_MZB_LO_13-23.08.2011","23.08.2011",2011,8,23,0.3,4
"ESP_034_MZB_LO_13","ESP_034_MZB_LO_13-22.08.2012","22.08.2012",2012,8,22,0.48,3
"ESP_034_MZB_LO_13","ESP_034_MZB_LO_13-05.09.2013","05.09.2013",2013,9,5,0.75,2
"ESP_034_MZB_LO_13","ESP_034_MZB_LO_13-03.09.2014","03.09.2014",2014,9,3,0.76,2
"ESP_034_MZB_LO_13","ESP_034_MZB_LO_13-28.08.2015","28.08.2015",2015,8,28,0.76,2
"ESP_034_MZB_LO_13","ESP_034_MZB_LO_13-12.08.2016","12.08.2016",2016,8,12,0.73,2
"ESP_034_MZB_LO_14","ESP_034_MZB_LO_14-17.09.1987","17.09.1987",1987,9,17,0.05,5
"ESP_034_MZB_LO_14","ESP_034_MZB_LO_14-30.10.1990","30.10.1990",1990,10,30,0.02,5
"ESP_034_MZB_LO_14","ESP_034_MZB_LO_14-07.10.1991","07.10.1991",1991,10,7,0.03,5
"ESP_034_MZB_LO_14","ESP_034_MZB_LO_14-01.10.1992","01.10.1992",1992,10,1,0.04,5
"ESP_034_MZB_LO_14","ESP_034_MZB_LO_14-08.10.1993","08.10.1993",1993,10,8,0.05,5
"ESP_034_MZB_LO_14","ESP_034_MZB_LO_14-27.08.1994","27.08.1994",1994,8,27,0.05,5
"ESP_034_MZB_LO_14","ESP_034_MZB_LO_14-09.09.1995","09.09.1995",1995,9,9,0.05,5
"ESP_034_MZB_LO_14","ESP_034_MZB_LO_14-19.08.1996","19.08.1996",1996,8,19,0.05,5
"ESP_034_MZB_LO_14","ESP_034_MZB_LO_14-21.08.1997","21.08.1997",1997,8,21,0.08,5
"ESP_034_MZB_LO_14","ESP_034_MZB_LO_14-02.09.1998","02.09.1998",1998,9,2,0.07,5
"ESP_034_MZB_LO_14","ESP_034_MZB_LO_14-30.09.1999","30.09.1999",1999,9,30,0.07,5
"ESP_034_MZB_LO_14","ESP_034_MZB_LO_14-23.08.2000","23.08.2000",2000,8,23,0.06,5
"ESP_034_MZB_LO_14","ESP_034_MZB_LO_14-11.10.2001","11.10.2001",2001,10,11,0.06,5
"ESP_034_MZB_LO_14","ESP_034_MZB_LO_14-20.09.2002","20.09.2002",2002,9,20,0.09,5
"ESP_034_MZB_LO_14","ESP_034_MZB_LO_14-27.08.2003","27.08.2003",2003,8,27,0.09,5
"ESP_034_MZB_LO_14","ESP_034_MZB_LO_14-26.08.2004","26.08.2004",2004,8,26,0.09,5
"ESP_034_MZB_LO_14","ESP_034_MZB_LO_14-30.08.2005","30.08.2005",2005,8,30,0.09,5
"ESP_034_MZB_LO_14","ESP_034_MZB_LO_14-30.08.2006","30.08.2006",2006,8,30,0.08,5
"ESP_034_MZB_LO_14","ESP_034_MZB_LO_14-20.08.2007","20.08.2007",2007,8,20,0.12,5
"ESP_034_MZB_LO_14","ESP_034_MZB_LO_14-01.09.2008","01.09.2008",2008,9,1,0.29,4
"ESP_034_MZB_LO_14","ESP_034_MZB_LO_14-26.08.2009","26.08.2009",2009,8,26,0.19,5
"ESP_034_MZB_LO_14","ESP_034_MZB_LO_14-24.08.2010","24.08.2010",2010,8,24,0.31,4
"ESP_034_MZB_LO_14","ESP_034_MZB_LO_14-23.08.2011","23.08.2011",2011,8,23,0.44,4
"ESP_034_MZB_LO_14","ESP_034_MZB_LO_14-22.08.2012","22.08.2012",2012,8,22,0.47,3
"ESP_034_MZB_LO_14","ESP_034_MZB_LO_14-05.09.2013","05.09.2013",2013,9,5,0.75,2
"ESP_034_MZB_LO_14","ESP_034_MZB_LO_14-03.08.2014","03.08.2014",2014,8,3,0.71,2
"ESP_034_MZB_LO_14","ESP_034_MZB_LO_14-28.08.2015","28.08.2015",2015,8,28,0.8,2
"ESP_034_MZB_LO_14","ESP_034_MZB_LO_14-12.08.2016","12.08.2016",2016,8,12,0.8,2
"ESP_034_MZB_LO_14","ESP_034_MZB_LO_14-08.09.2017","08.09.2017",2017,9,8,0.72,2
"ESP_034_MZB_LO_14","ESP_034_MZB_LO_14-21.09.2020","21.09.2020",2020,9,21,0.67,3
"ESP_034_MZB_LO_14","ESP_034_MZB_LO_14-06.09.2021","06.09.2021",2021,9,6,0.77,2
"ESP_034_MZB_LO_15","ESP_034_MZB_LO_15-08.10.1993","08.10.1993",1993,10,8,0.31,4
"ESP_034_MZB_LO_15","ESP_034_MZB_LO_15-27.08.1994","27.08.1994",1994,8,27,0.09,5
"ESP_034_MZB_LO_15","ESP_034_MZB_LO_15-09.09.1995","09.09.1995",1995,9,9,0.09,5
"ESP_034_MZB_LO_15","ESP_034_MZB_LO_15-19.08.1996","19.08.1996",1996,8,19,0.08,5
"ESP_034_MZB_LO_15","ESP_034_MZB_LO_15-21.08.1997","21.08.1997",1997,8,21,0.09,5
"ESP_034_MZB_LO_15","ESP_034_MZB_LO_15-02.09.1998","02.09.1998",1998,9,2,0.09,5
"ESP_034_MZB_LO_15","ESP_034_MZB_LO_15-30.09.1999","30.09.1999",1999,9,30,0.14,5
"ESP_034_MZB_LO_15","ESP_034_MZB_LO_15-23.08.2000","23.08.2000",2000,8,23,0.18,5
"ESP_034_MZB_LO_15","ESP_034_MZB_LO_15-11.10.2001","11.10.2001",2001,10,11,0.11,5
"ESP_034_MZB_LO_15","ESP_034_MZB_LO_15-20.09.2002","20.09.2002",2002,9,20,0.29,4
"ESP_034_MZB_LO_15","ESP_034_MZB_LO_15-27.08.2003","27.08.2003",2003,8,27,0.1,5
"ESP_034_MZB_LO_15","ESP_034_MZB_LO_15-26.08.2004","26.08.2004",2004,8,26,0.2,5
"ESP_034_MZB_LO_15","ESP_034_MZB_LO_15-30.08.2005","30.08.2005",2005,8,30,0.2,5
"ESP_034_MZB_LO_15","ESP_034_MZB_LO_15-30.08.2006","30.08.2006",2006,8,30,0.1,5
"ESP_034_MZB_LO_15","ESP_034_MZB_LO_15-20.08.2007","20.08.2007",2007,8,20,0.31,4
"ESP_034_MZB_LO_15","ESP_034_MZB_LO_15-01.09.2008","01.09.2008",2008,9,1,0.12,5
"ESP_034_MZB_LO_15","ESP_034_MZB_LO_15-26.08.2009","26.08.2009",2009,8,26,0.52,3
"ESP_034_MZB_LO_15","ESP_034_MZB_LO_15-24.08.2010","24.08.2010",2010,8,24,0.37,4
"ESP_034_MZB_LO_15","ESP_034_MZB_LO_15-23.08.2011","23.08.2011",2011,8,23,0.57,3
"ESP_034_MZB_LO_15","ESP_034_MZB_LO_15-22.08.2012","22.08.2012",2012,8,22,0.47,3
"ESP_034_MZB_LO_15","ESP_034_MZB_LO_15-05.09.2013","05.09.2013",2013,9,5,0.5,3
"ESP_034_MZB_LO_15","ESP_034_MZB_LO_15-03.09.2014","03.09.2014",2014,9,3,0.63,3
"ESP_034_MZB_LO_15","ESP_034_MZB_LO_15-28.08.2015","28.08.2015",2015,8,28,0.36,4
"ESP_034_MZB_LO_15","ESP_034_MZB_LO_15-11.08.2016","11.08.2016",2016,8,11,0.61,3
"ESP_034_MZB_LO_15","ESP_034_MZB_LO_15-08.09.2017","08.09.2017",2017,9,8,0.61,3
"ESP_034_MZB_LO_15","ESP_034_MZB_LO_15-22.09.2020","22.09.2020",2020,9,22,0.98,1
"ESP_034_MZB_LO_15","ESP_034_MZB_LO_15-06.09.2021","06.09.2021",2021,9,6,0.92,1
"ESP_034_MZB_LO_16","ESP_034_MZB_LO_16-19.08.1996","19.08.1996",1996,8,19,0.06,5
"ESP_034_MZB_LO_16","ESP_034_MZB_LO_16-21.08.1997","21.08.1997",1997,8,21,0.06,5
"ESP_034_MZB_LO_16","ESP_034_MZB_LO_16-02.09.1998","02.09.1998",1998,9,2,0.09,5
"ESP_034_MZB_LO_16","ESP_034_MZB_LO_16-30.09.1999","30.09.1999",1999,9,30,0.03,5
"ESP_034_MZB_LO_16","ESP_034_MZB_LO_16-23.08.2000","23.08.2000",2000,8,23,0.06,5
"ESP_034_MZB_LO_16","ESP_034_MZB_LO_16-11.10.2001","11.10.2001",2001,10,11,0.06,5
"ESP_034_MZB_LO_16","ESP_034_MZB_LO_16-20.09.2002","20.09.2002",2002,9,20,0.05,5
"ESP_034_MZB_LO_16","ESP_034_MZB_LO_16-27.08.2003","27.08.2003",2003,8,27,0.03,5
"ESP_034_MZB_LO_16","ESP_034_MZB_LO_16-26.08.2004","26.08.2004",2004,8,26,0.1,5
"ESP_034_MZB_LO_16","ESP_034_MZB_LO_16-30.08.2005","30.08.2005",2005,8,30,0.1,5
"ESP_034_MZB_LO_16","ESP_034_MZB_LO_16-30.08.2006","30.08.2006",2006,8,30,0.13,5
"ESP_034_MZB_LO_16","ESP_034_MZB_LO_16-20.08.2007","20.08.2007",2007,8,20,0.31,4
"ESP_034_MZB_LO_16","ESP_034_MZB_LO_16-29.08.2008","29.08.2008",2008,8,29,0.26,4
"ESP_034_MZB_LO_16","ESP_034_MZB_LO_16-26.08.2009","26.08.2009",2009,8,26,0.13,5
"ESP_034_MZB_LO_16","ESP_034_MZB_LO_16-24.08.2010","24.08.2010",2010,8,24,0.49,3
"ESP_034_MZB_LO_16","ESP_034_MZB_LO_16-23.08.2011","23.08.2011",2011,8,23,0.55,3
"ESP_034_MZB_LO_16","ESP_034_MZB_LO_16-22.08.2012","22.08.2012",2012,8,22,0.49,3
"ESP_034_MZB_LO_16","ESP_034_MZB_LO_16-05.09.2013","05.09.2013",2013,9,5,0.26,4
"ESP_034_MZB_LO_16","ESP_034_MZB_LO_16-03.09.2014","03.09.2014",2014,9,3,0.67,3
"ESP_034_MZB_LO_16","ESP_034_MZB_LO_16-28.08.2015","28.08.2015",2015,8,28,0.83,2
"ESP_034_MZB_LO_16","ESP_034_MZB_LO_16-11.08.2016","11.08.2016",2016,8,11,0.98,1
"ESP_034_MZB_LO_16","ESP_034_MZB_LO_16-08.09.2017","08.09.2017",2017,9,8,0.59,3
"ESP_034_MZB_LO_17","ESP_034_MZB_LO_17-19.08.1996","19.08.1996",1996,8,19,0.06,5
"ESP_034_MZB_LO_17","ESP_034_MZB_LO_17-21.08.1997","21.08.1997",1997,8,21,0.09,5
"ESP_034_MZB_LO_17","ESP_034_MZB_LO_17-02.09.1998","02.09.1998",1998,9,2,0.06,5
"ESP_034_MZB_LO_17","ESP_034_MZB_LO_17-30.09.1999","30.09.1999",1999,9,30,0.06,5
"ESP_034_MZB_LO_17","ESP_034_MZB_LO_17-23.08.2000","23.08.2000",2000,8,23,0.08,5
"ESP_034_MZB_LO_17","ESP_034_MZB_LO_17-11.10.2001","11.10.2001",2001,10,11,0.05,5
"ESP_034_MZB_LO_17","ESP_034_MZB_LO_17-20.09.2002","20.09.2002",2002,9,20,0.27,4
"ESP_034_MZB_LO_17","ESP_034_MZB_LO_17-29.08.2003","29.08.2003",2003,8,29,0.35,4
"ESP_034_MZB_LO_17","ESP_034_MZB_LO_17-26.08.2004","26.08.2004",2004,8,26,0.09,5
"ESP_034_MZB_LO_17","ESP_034_MZB_LO_17-30.08.2005","30.08.2005",2005,8,30,0.36,4
"ESP_034_MZB_LO_17","ESP_034_MZB_LO_17-30.08.2006","30.08.2006",2006,8,30,0.09,5
"ESP_034_MZB_LO_17","ESP_034_MZB_LO_17-20.08.2007","20.08.2007",2007,8,20,0.34,4
"ESP_034_MZB_LO_17","ESP_034_MZB_LO_17-29.08.2008","29.08.2008",2008,8,29,0.47,3
"ESP_034_MZB_LO_17","ESP_034_MZB_LO_17-26.08.2009","26.08.2009",2009,8,26,0.48,3
"ESP_034_MZB_LO_17","ESP_034_MZB_LO_17-24.08.2010","24.08.2010",2010,8,24,0.6,3
"ESP_034_MZB_LO_17","ESP_034_MZB_LO_17-23.08.2011","23.08.2011",2011,8,23,0.52,3
"ESP_034_MZB_LO_17","ESP_034_MZB_LO_17-23.08.2012","23.08.2012",2012,8,23,0.68,2
"ESP_034_MZB_LO_17","ESP_034_MZB_LO_17-05.09.2013","05.09.2013",2013,9,5,0.56,3
"ESP_034_MZB_LO_17","ESP_034_MZB_LO_17-03.09.2014","03.09.2014",2014,9,3,0.57,3
"ESP_034_MZB_LO_17","ESP_034_MZB_LO_17-28.08.2015","28.08.2015",2015,8,28,0.84,2
"ESP_034_MZB_LO_17","ESP_034_MZB_LO_17-11.08.2016","11.08.2016",2016,8,11,0.99,1
"ESP_034_MZB_LO_17","ESP_034_MZB_LO_17-08.09.2017","08.09.2017",2017,9,8,0.52,3
"ESP_034_MZB_LO_17","ESP_034_MZB_LO_17-22.09.2020","22.09.2020",2020,9,22,0.63,3
"ESP_034_MZB_LO_17","ESP_034_MZB_LO_17-06.09.2021","06.09.2021",2021,9,6,0.93,1
"ESP_034_MZB_LO_18","ESP_034_MZB_LO_18-05.10.1989","05.10.1989",1989,10,5,0.05,5
"ESP_034_MZB_LO_18","ESP_034_MZB_LO_18-30.10.1990","30.10.1990",1990,10,30,0.05,5
"ESP_034_MZB_LO_18","ESP_034_MZB_LO_18-10.10.1991","10.10.1991",1991,10,10,0.03,5
"ESP_034_MZB_LO_18","ESP_034_MZB_LO_18-01.10.1992","01.10.1992",1992,10,1,0.09,5
"ESP_034_MZB_LO_18","ESP_034_MZB_LO_18-10.10.1993","10.10.1993",1993,10,10,0.25,4
"ESP_034_MZB_LO_18","ESP_034_MZB_LO_18-25.08.1994","25.08.1994",1994,8,25,0.09,5
"ESP_034_MZB_LO_18","ESP_034_MZB_LO_18-09.09.1995","09.09.1995",1995,9,9,0.04,5
"ESP_034_MZB_LO_18","ESP_034_MZB_LO_18-19.08.1996","19.08.1996",1996,8,19,0.24,4
"ESP_034_MZB_LO_18","ESP_034_MZB_LO_18-21.08.1997","21.08.1997",1997,8,21,0.22,5
"ESP_034_MZB_LO_18","ESP_034_MZB_LO_18-02.09.1998","02.09.1998",1998,9,2,0.21,5
"ESP_034_MZB_LO_18","ESP_034_MZB_LO_18-30.09.1999","30.09.1999",1999,9,30,0.1,5
"ESP_034_MZB_LO_18","ESP_034_MZB_LO_18-23.08.2000","23.08.2000",2000,8,23,0.21,5
"ESP_034_MZB_LO_18","ESP_034_MZB_LO_18-11.10.2001","11.10.2001",2001,10,11,0.14,5
"ESP_034_MZB_LO_18","ESP_034_MZB_LO_18-20.09.2002","20.09.2002",2002,9,20,0.23,4
"ESP_034_MZB_LO_18","ESP_034_MZB_LO_18-29.08.2003","29.08.2003",2003,8,29,0.11,5
"ESP_034_MZB_LO_18","ESP_034_MZB_LO_18-26.08.2004","26.08.2004",2004,8,26,0.2,5
"ESP_034_MZB_LO_18","ESP_034_MZB_LO_18-30.08.2005","30.08.2005",2005,8,30,0.25,4
"ESP_034_MZB_LO_18","ESP_034_MZB_LO_18-30.08.2006","30.08.2006",2006,8,30,0.15,5
"ESP_034_MZB_LO_18","ESP_034_MZB_LO_18-20.08.2007","20.08.2007",2007,8,20,0.14,5
"ESP_034_MZB_LO_18","ESP_034_MZB_LO_18-29.08.2008","29.08.2008",2008,8,29,0.31,4
"ESP_034_MZB_LO_18","ESP_034_MZB_LO_18-26.08.2009","26.08.2009",2009,8,26,0.29,4
"ESP_034_MZB_LO_18","ESP_034_MZB_LO_18-24.08.2010","24.08.2010",2010,8,24,0.41,4
"ESP_034_MZB_LO_18","ESP_034_MZB_LO_18-23.08.2011","23.08.2011",2011,8,23,0.52,3
"ESP_034_MZB_LO_18","ESP_034_MZB_LO_18-22.08.2012","22.08.2012",2012,8,22,0.5,3
"ESP_034_MZB_LO_18","ESP_034_MZB_LO_18-05.09.2013","05.09.2013",2013,9,5,0.48,3
"ESP_034_MZB_LO_18","ESP_034_MZB_LO_18-03.09.2014","03.09.2014",2014,9,3,0.4,4
"ESP_034_MZB_LO_18","ESP_034_MZB_LO_18-28.08.2015","28.08.2015",2015,8,28,0.69,2
"ESP_034_MZB_LO_18","ESP_034_MZB_LO_18-11.08.2016","11.08.2016",2016,8,11,0.7,2
"ESP_034_MZB_LO_18","ESP_034_MZB_LO_18-08.09.2017","08.09.2017",2017,9,8,0.61,3
"ESP_034_MZB_LO_18","ESP_034_MZB_LO_18-22.09.2020","22.09.2020",2020,9,22,0.61,3
"ESP_034_MZB_LO_18","ESP_034_MZB_LO_18-06.09.2021","06.09.2021",2021,9,6,0.88,2
"ESP_034_MZB_LO_2","ESP_034_MZB_LO_2-28.08.1996","28.08.1996",1996,8,28,0.31,4
"ESP_034_MZB_LO_2","ESP_034_MZB_LO_2-26.08.1997","26.08.1997",1997,8,26,0.5,3
"ESP_034_MZB_LO_2","ESP_034_MZB_LO_2-03.09.1998","03.09.1998",1998,9,3,0.8,2
"ESP_034_MZB_LO_2","ESP_034_MZB_LO_2-05.10.1999","05.10.1999",1999,10,5,0.77,2
"ESP_034_MZB_LO_2","ESP_034_MZB_LO_2-24.08.2000","24.08.2000",2000,8,24,0.97,1
"ESP_034_MZB_LO_2","ESP_034_MZB_LO_2-03.10.2001","03.10.2001",2001,10,3,0.99,1
"ESP_034_MZB_LO_2","ESP_034_MZB_LO_2-23.09.2002","23.09.2002",2002,9,23,0.72,2
"ESP_034_MZB_LO_2","ESP_034_MZB_LO_2-28.08.2003","28.08.2003",2003,8,28,0.62,3
"ESP_034_MZB_LO_2","ESP_034_MZB_LO_2-02.09.2004","02.09.2004",2004,9,2,0.56,3
"ESP_034_MZB_LO_2","ESP_034_MZB_LO_2-02.09.2005","02.09.2005",2005,9,2,0.82,2
"ESP_034_MZB_LO_2","ESP_034_MZB_LO_2-22.08.2006","22.08.2006",2006,8,22,0.82,2
"ESP_034_MZB_LO_2","ESP_034_MZB_LO_2-29.08.2007","29.08.2007",2007,8,29,0.9,1
"ESP_034_MZB_LO_2","ESP_034_MZB_LO_2-21.08.2008","21.08.2008",2008,8,21,0.63,3
"ESP_034_MZB_LO_2","ESP_034_MZB_LO_2-01.09.2009","01.09.2009",2009,9,1,0.78,2
"ESP_034_MZB_LO_2","ESP_034_MZB_LO_2-31.08.2010","31.08.2010",2010,8,31,0.95,1
"ESP_034_MZB_LO_2","ESP_034_MZB_LO_2-25.08.2011","25.08.2011",2011,8,25,1.03,1
"ESP_034_MZB_LO_2","ESP_034_MZB_LO_2-27.08.2012","27.08.2012",2012,8,27,0.69,2
"ESP_034_MZB_LO_2","ESP_034_MZB_LO_2-03.09.2013","03.09.2013",2013,9,3,0.88,1
"ESP_034_MZB_LO_2","ESP_034_MZB_LO_2-27.08.2014","27.08.2014",2014,8,27,0.82,2
"ESP_034_MZB_LO_2","ESP_034_MZB_LO_2-04.09.2015","04.09.2015",2015,9,4,0.95,1
"ESP_034_MZB_LO_2","ESP_034_MZB_LO_2-09.08.2016","09.08.2016",2016,8,9,0.81,2
"ESP_034_MZB_LO_2","ESP_034_MZB_LO_2-21.08.2017","21.08.2017",2017,8,21,0.81,2
"ESP_034_MZB_LO_20","ESP_034_MZB_LO_20-19.08.1996","19.08.1996",1996,8,19,0.02,5
"ESP_034_MZB_LO_20","ESP_034_MZB_LO_20-21.08.1997","21.08.1997",1997,8,21,0.18,5
"ESP_034_MZB_LO_20","ESP_034_MZB_LO_20-02.09.1998","02.09.1998",1998,9,2,0.02,5
"ESP_034_MZB_LO_20","ESP_034_MZB_LO_20-30.09.1999","30.09.1999",1999,9,30,0.02,5
"ESP_034_MZB_LO_20","ESP_034_MZB_LO_20-23.08.2000","23.08.2000",2000,8,23,0.03,5
"ESP_034_MZB_LO_20","ESP_034_MZB_LO_20-11.10.2001","11.10.2001",2001,10,11,0.02,5
"ESP_034_MZB_LO_20","ESP_034_MZB_LO_20-29.08.2003","29.08.2003",2003,8,29,0.01,5
"ESP_034_MZB_LO_20","ESP_034_MZB_LO_20-26.08.2004","26.08.2004",2004,8,26,0.03,5
"ESP_034_MZB_LO_20","ESP_034_MZB_LO_20-30.08.2005","30.08.2005",2005,8,30,0.01,5
"ESP_034_MZB_LO_20","ESP_034_MZB_LO_20-20.08.2007","20.08.2007",2007,8,20,0.04,5
"ESP_034_MZB_LO_20","ESP_034_MZB_LO_20-29.08.2008","29.08.2008",2008,8,29,0.05,5
"ESP_034_MZB_LO_20","ESP_034_MZB_LO_20-26.08.2009","26.08.2009",2009,8,26,0.05,5
"ESP_034_MZB_LO_20","ESP_034_MZB_LO_20-24.08.2010","24.08.2010",2010,8,24,0.09,5
"ESP_034_MZB_LO_20","ESP_034_MZB_LO_20-23.08.2011","23.08.2011",2011,8,23,0.11,5
"ESP_034_MZB_LO_20","ESP_034_MZB_LO_20-22.08.2012","22.08.2012",2012,8,22,0.09,5
"ESP_034_MZB_LO_20","ESP_034_MZB_LO_20-05.09.2013","05.09.2013",2013,9,5,0.13,5
"ESP_034_MZB_LO_20","ESP_034_MZB_LO_20-03.09.2014","03.09.2014",2014,9,3,0.09,5
"ESP_034_MZB_LO_20","ESP_034_MZB_LO_20-28.08.2015","28.08.2015",2015,8,28,0.35,4
"ESP_034_MZB_LO_20","ESP_034_MZB_LO_20-11.08.2016","11.08.2016",2016,8,11,0.29,4
"ESP_034_MZB_LO_20","ESP_034_MZB_LO_20-08.09.2017","08.09.2017",2017,9,8,0.48,3
"ESP_034_MZB_LO_20","ESP_034_MZB_LO_20-22.09.2020","22.09.2020",2020,9,22,0.47,3
"ESP_034_MZB_LO_20","ESP_034_MZB_LO_20-06.09.2021","06.09.2021",2021,9,6,0.46,3
"ESP_034_MZB_LO_21","ESP_034_MZB_LO_21-30.09.1996","30.09.1996",1996,9,30,0.95,1
"ESP_034_MZB_LO_21","ESP_034_MZB_LO_21-16.09.1997","16.09.1997",1997,9,16,0.61,3
"ESP_034_MZB_LO_21","ESP_034_MZB_LO_21-11.09.1998","11.09.1998",1998,9,11,1.02,1
"ESP_034_MZB_LO_21","ESP_034_MZB_LO_21-27.09.1999","27.09.1999",1999,9,27,1.13,1
"ESP_034_MZB_LO_21","ESP_034_MZB_LO_21-15.09.2000","15.09.2000",2000,9,15,0.95,1
"ESP_034_MZB_LO_21","ESP_034_MZB_LO_21-21.09.2001","21.09.2001",2001,9,21,0.94,1
"ESP_034_MZB_LO_21","ESP_034_MZB_LO_21-20.09.2002","20.09.2002",2002,9,20,0.88,2
"ESP_034_MZB_LO_21","ESP_034_MZB_LO_21-21.08.2003","21.08.2003",2003,8,21,1.31,1
"ESP_034_MZB_LO_21","ESP_034_MZB_LO_21-24.08.2004","24.08.2004",2004,8,24,1.23,1
"ESP_034_MZB_LO_21","ESP_034_MZB_LO_21-31.08.2005","31.08.2005",2005,8,31,1.16,1
"ESP_034_MZB_LO_21","ESP_034_MZB_LO_21-28.08.2006","28.08.2006",2006,8,28,1.1,1
"ESP_034_MZB_LO_21","ESP_034_MZB_LO_21-05.09.2007","05.09.2007",2007,9,5,0.65,3
"ESP_034_MZB_LO_21","ESP_034_MZB_LO_21-04.09.2008","04.09.2008",2008,9,4,1,1
"ESP_034_MZB_LO_21","ESP_034_MZB_LO_21-21.08.2009","21.08.2009",2009,8,21,1.21,1
"ESP_034_MZB_LO_21","ESP_034_MZB_LO_21-01.09.2010","01.09.2010",2010,9,1,1.1,1
"ESP_034_MZB_LO_21","ESP_034_MZB_LO_21-23.08.2011","23.08.2011",2011,8,23,0.76,2
"ESP_034_MZB_LO_21","ESP_034_MZB_LO_21-17.08.2012","17.08.2012",2012,8,17,1.06,1
"ESP_034_MZB_LO_21","ESP_034_MZB_LO_21-30.08.2013","30.08.2013",2013,8,30,0.85,2
"ESP_034_MZB_LO_21","ESP_034_MZB_LO_21-02.09.2014","02.09.2014",2014,9,2,1.07,1
"ESP_034_MZB_LO_21","ESP_034_MZB_LO_21-24.08.2015","24.08.2015",2015,8,24,1.21,1
"ESP_034_MZB_LO_21","ESP_034_MZB_LO_21-01.08.2016","01.08.2016",2016,8,1,1.12,1
"ESP_034_MZB_LO_21","ESP_034_MZB_LO_21-07.09.2017","07.09.2017",2017,9,7,0.7,2
"ESP_034_MZB_LO_21","ESP_034_MZB_LO_21-07.09.2020","07.09.2020",2020,9,7,0.97,1
"ESP_034_MZB_LO_21","ESP_034_MZB_LO_21-23.08.2021","23.08.2021",2021,8,23,1,1
"ESP_034_MZB_LO_22","ESP_034_MZB_LO_22-03.09.1998","03.09.1998",1998,9,3,0.73,2
"ESP_034_MZB_LO_22","ESP_034_MZB_LO_22-05.10.1999","05.10.1999",1999,10,5,0.53,3
"ESP_034_MZB_LO_22","ESP_034_MZB_LO_22-24.08.2000","24.08.2000",2000,8,24,0.33,4
"ESP_034_MZB_LO_22","ESP_034_MZB_LO_22-03.10.2001","03.10.2001",2001,10,3,0.48,3
"ESP_034_MZB_LO_22","ESP_034_MZB_LO_22-23.09.2002","23.09.2002",2002,9,23,0.41,4
"ESP_034_MZB_LO_22","ESP_034_MZB_LO_22-28.08.2003","28.08.2003",2003,8,28,0.62,3
"ESP_034_MZB_LO_22","ESP_034_MZB_LO_22-02.09.2004","02.09.2004",2004,9,2,0.66,2
"ESP_034_MZB_LO_22","ESP_034_MZB_LO_22-02.09.2005","02.09.2005",2005,9,2,0.81,2
"ESP_034_MZB_LO_22","ESP_034_MZB_LO_22-22.08.2006","22.08.2006",2006,8,22,0.6,3
"ESP_034_MZB_LO_22","ESP_034_MZB_LO_22-29.08.2007","29.08.2007",2007,8,29,0.73,2
"ESP_034_MZB_LO_22","ESP_034_MZB_LO_22-20.08.2008","20.08.2008",2008,8,20,0.88,1
"ESP_034_MZB_LO_22","ESP_034_MZB_LO_22-01.09.2009","01.09.2009",2009,9,1,0.87,1
"ESP_034_MZB_LO_22","ESP_034_MZB_LO_22-31.08.2010","31.08.2010",2010,8,31,0.76,2
"ESP_034_MZB_LO_22","ESP_034_MZB_LO_22-25.08.2011","25.08.2011",2011,8,25,0.8,2
"ESP_034_MZB_LO_24","ESP_034_MZB_LO_24-04.09.1998","04.09.1998",1998,9,4,0.68,2
"ESP_034_MZB_LO_24","ESP_034_MZB_LO_24-05.10.1999","05.10.1999",1999,10,5,0.27,4
"ESP_034_MZB_LO_24","ESP_034_MZB_LO_24-24.08.2000","24.08.2000",2000,8,24,0.22,4
"ESP_034_MZB_LO_24","ESP_034_MZB_LO_24-03.10.2001","03.10.2001",2001,10,3,0.34,4
"ESP_034_MZB_LO_24","ESP_034_MZB_LO_24-23.09.2002","23.09.2002",2002,9,23,0.37,4
"ESP_034_MZB_LO_24","ESP_034_MZB_LO_24-28.08.2003","28.08.2003",2003,8,28,0.45,3
"ESP_034_MZB_LO_24","ESP_034_MZB_LO_24-02.09.2004","02.09.2004",2004,9,2,0.49,3
"ESP_034_MZB_LO_24","ESP_034_MZB_LO_24-02.09.2005","02.09.2005",2005,9,2,0.6,3
"ESP_034_MZB_LO_24","ESP_034_MZB_LO_24-22.08.2006","22.08.2006",2006,8,22,0.28,4
"ESP_034_MZB_LO_24","ESP_034_MZB_LO_24-29.08.2007","29.08.2007",2007,8,29,0.45,3
"ESP_034_MZB_LO_24","ESP_034_MZB_LO_24-20.08.2008","20.08.2008",2008,8,20,0.55,3
"ESP_034_MZB_LO_24","ESP_034_MZB_LO_24-01.09.2009","01.09.2009",2009,9,1,0.73,2
"ESP_034_MZB_LO_24","ESP_034_MZB_LO_24-31.08.2010","31.08.2010",2010,8,31,0.73,2
"ESP_034_MZB_LO_24","ESP_034_MZB_LO_24-25.08.2011","25.08.2011",2011,8,25,0.65,2
"ESP_034_MZB_LO_24","ESP_034_MZB_LO_24-27.08.2012","27.08.2012",2012,8,27,0.57,3
"ESP_034_MZB_LO_24","ESP_034_MZB_LO_24-03.09.2013","03.09.2013",2013,9,3,0.52,3
"ESP_034_MZB_LO_24","ESP_034_MZB_LO_24-27.08.2014","27.08.2014",2014,8,27,0.62,3
"ESP_034_MZB_LO_24","ESP_034_MZB_LO_24-04.09.2015","04.09.2015",2015,9,4,0.87,1
"ESP_034_MZB_LO_24","ESP_034_MZB_LO_24-09.08.2016","09.08.2016",2016,8,9,0.78,2
"ESP_034_MZB_LO_24","ESP_034_MZB_LO_24-21.08.2017","21.08.2017",2017,8,21,0.59,3
"ESP_034_MZB_LO_25","ESP_034_MZB_LO_25-28.08.1996","28.08.1996",1996,8,28,0.08,5
"ESP_034_MZB_LO_25","ESP_034_MZB_LO_25-26.08.1997","26.08.1997",1997,8,26,0.08,5
"ESP_034_MZB_LO_25","ESP_034_MZB_LO_25-03.09.1998","03.09.1998",1998,9,3,0.05,5
"ESP_034_MZB_LO_25","ESP_034_MZB_LO_25-05.10.1999","05.10.1999",1999,10,5,0.08,5
"ESP_034_MZB_LO_25","ESP_034_MZB_LO_25-24.08.2000","24.08.2000",2000,8,24,0.18,5
"ESP_034_MZB_LO_25","ESP_034_MZB_LO_25-03.10.2001","03.10.2001",2001,10,3,0.25,4
"ESP_034_MZB_LO_25","ESP_034_MZB_LO_25-23.09.2002","23.09.2002",2002,9,23,0.15,5
"ESP_034_MZB_LO_25","ESP_034_MZB_LO_25-28.08.2003","28.08.2003",2003,8,28,0.07,5
"ESP_034_MZB_LO_25","ESP_034_MZB_LO_25-01.09.2004","01.09.2004",2004,9,1,0.05,5
"ESP_034_MZB_LO_25","ESP_034_MZB_LO_25-02.09.2005","02.09.2005",2005,9,2,0.16,5
"ESP_034_MZB_LO_25","ESP_034_MZB_LO_25-21.08.2006","21.08.2006",2006,8,21,0.14,5
"ESP_034_MZB_LO_25","ESP_034_MZB_LO_25-29.08.2007","29.08.2007",2007,8,29,0.48,3
"ESP_034_MZB_LO_25","ESP_034_MZB_LO_25-20.08.2008","20.08.2008",2008,8,20,0.43,3
"ESP_034_MZB_LO_25","ESP_034_MZB_LO_25-01.09.2009","01.09.2009",2009,9,1,0.45,3
"ESP_034_MZB_LO_25","ESP_034_MZB_LO_25-31.08.2010","31.08.2010",2010,8,31,0.55,3
"ESP_034_MZB_LO_25","ESP_034_MZB_LO_25-25.08.2011","25.08.2011",2011,8,25,0.72,2
"ESP_034_MZB_LO_25","ESP_034_MZB_LO_25-27.08.2012","27.08.2012",2012,8,27,0.44,3
"ESP_034_MZB_LO_25","ESP_034_MZB_LO_25-03.09.2013","03.09.2013",2013,9,3,0.48,3
"ESP_034_MZB_LO_25","ESP_034_MZB_LO_25-27.08.2014","27.08.2014",2014,8,27,0.55,3
"ESP_034_MZB_LO_25","ESP_034_MZB_LO_25-04.09.2015","04.09.2015",2015,9,4,0.92,1
"ESP_034_MZB_LO_25","ESP_034_MZB_LO_25-09.08.2016","09.08.2016",2016,8,9,0.54,3
"ESP_034_MZB_LO_25","ESP_034_MZB_LO_25-21.08.2017","21.08.2017",2017,8,21,0.57,3
"ESP_034_MZB_LO_25","ESP_034_MZB_LO_25-14.09.2020","14.09.2020",2020,9,14,0.84,2
"ESP_034_MZB_LO_25","ESP_034_MZB_LO_25-25.08.2021","25.08.2021",2021,8,25,0.62,3
"ESP_034_MZB_LO_26","ESP_034_MZB_LO_26-28.09.1999","28.09.1999",1999,9,28,0.03,5
"ESP_034_MZB_LO_26","ESP_034_MZB_LO_26-25.08.2000","25.08.2000",2000,8,25,0.08,5
"ESP_034_MZB_LO_26","ESP_034_MZB_LO_26-28.09.2001","28.09.2001",2001,9,28,0.03,5
"ESP_034_MZB_LO_26","ESP_034_MZB_LO_26-26.09.2002","26.09.2002",2002,9,26,0.08,5
"ESP_034_MZB_LO_26","ESP_034_MZB_LO_26-29.08.2003","29.08.2003",2003,8,29,0.04,5
"ESP_034_MZB_LO_26","ESP_034_MZB_LO_26-24.08.2004","24.08.2004",2004,8,24,0.1,5
"ESP_034_MZB_LO_26","ESP_034_MZB_LO_26-01.09.2005","01.09.2005",2005,9,1,0.13,5
"ESP_034_MZB_LO_26","ESP_034_MZB_LO_26-28.08.2006","28.08.2006",2006,8,28,0.07,5
"ESP_034_MZB_LO_26","ESP_034_MZB_LO_26-31.08.2007","31.08.2007",2007,8,31,0.09,5
"ESP_034_MZB_LO_26","ESP_034_MZB_LO_26-04.09.2008","04.09.2008",2008,9,4,0.17,5
"ESP_034_MZB_LO_26","ESP_034_MZB_LO_26-02.10.2009","02.10.2009",2009,10,2,0.08,5
"ESP_034_MZB_LO_26","ESP_034_MZB_LO_26-01.10.2010","01.10.2010",2010,10,1,0.19,5
"ESP_034_MZB_LO_26","ESP_034_MZB_LO_26-23.08.2011","23.08.2011",2011,8,23,0.27,4
"ESP_034_MZB_LO_26","ESP_034_MZB_LO_26-17.08.2012","17.08.2012",2012,8,17,0.13,5
"ESP_034_MZB_LO_26","ESP_034_MZB_LO_26-30.08.2013","30.08.2013",2013,8,30,0.33,4
"ESP_034_MZB_LO_26","ESP_034_MZB_LO_26-02.09.2014","02.09.2014",2014,9,2,0.18,5
"ESP_034_MZB_LO_26","ESP_034_MZB_LO_26-24.08.2015","24.08.2015",2015,8,24,0.09,5
"ESP_034_MZB_LO_26","ESP_034_MZB_LO_26-24.08.2021","24.08.2021",2021,8,24,0.09,5
"ESP_034_MZB_LO_27","ESP_034_MZB_LO_27-05.09.1996","05.09.1996",1996,9,5,0.7,2
"ESP_034_MZB_LO_27","ESP_034_MZB_LO_27-27.08.1997","27.08.1997",1997,8,27,0.87,1
"ESP_034_MZB_LO_27","ESP_034_MZB_LO_27-01.09.1998","01.09.1998",1998,9,1,0.96,1
"ESP_034_MZB_LO_27","ESP_034_MZB_LO_27-22.08.2000","22.08.2000",2000,8,22,1.09,1
"ESP_034_MZB_LO_27","ESP_034_MZB_LO_27-05.10.2001","05.10.2001",2001,10,5,0.87,1
"ESP_034_MZB_LO_27","ESP_034_MZB_LO_27-24.09.2002","24.09.2002",2002,9,24,0.83,2
"ESP_034_MZB_LO_27","ESP_034_MZB_LO_27-25.08.2003","25.08.2003",2003,8,25,0.91,1
"ESP_034_MZB_LO_27","ESP_034_MZB_LO_27-27.08.2004","27.08.2004",2004,8,27,0.85,2
"ESP_034_MZB_LO_27","ESP_034_MZB_LO_27-30.08.2005","30.08.2005",2005,8,30,0.86,1
"ESP_034_MZB_LO_27","ESP_034_MZB_LO_27-29.08.2006","29.08.2006",2006,8,29,0.86,1
"ESP_034_MZB_LO_27","ESP_034_MZB_LO_27-28.08.2007","28.08.2007",2007,8,28,0.9,1
"ESP_034_MZB_LO_27","ESP_034_MZB_LO_27-27.08.2008","27.08.2008",2008,8,27,1.06,1
"ESP_034_MZB_LO_27","ESP_034_MZB_LO_27-21.08.2009","21.08.2009",2009,8,21,0.87,1
"ESP_034_MZB_LO_27","ESP_034_MZB_LO_27-26.08.2010","26.08.2010",2010,8,26,0.82,2
"ESP_034_MZB_LO_27","ESP_034_MZB_LO_27-22.08.2011","22.08.2011",2011,8,22,0.83,2
"ESP_034_MZB_LO_27","ESP_034_MZB_LO_27-20.08.2012","20.08.2012",2012,8,20,0.77,2
"ESP_034_MZB_LO_27","ESP_034_MZB_LO_27-04.09.2013","04.09.2013",2013,9,4,0.7,2
"ESP_034_MZB_LO_27","ESP_034_MZB_LO_27-28.08.2014","28.08.2014",2014,8,28,1.04,1
"ESP_034_MZB_LO_27","ESP_034_MZB_LO_27-03.09.2015","03.09.2015",2015,9,3,0.77,2
"ESP_034_MZB_LO_27","ESP_034_MZB_LO_27-10.08.2016","10.08.2016",2016,8,10,0.96,1
"ESP_034_MZB_LO_27","ESP_034_MZB_LO_27-07.09.2017","07.09.2017",2017,9,7,0.93,1
"ESP_034_MZB_LO_27","ESP_034_MZB_LO_27-15.09.2020","15.09.2020",2020,9,15,0.97,1
"ESP_034_MZB_LO_27","ESP_034_MZB_LO_27-31.08.2021","31.08.2021",2021,8,31,0.97,1
"ESP_034_MZB_LO_271","ESP_034_MZB_LO_271-10.10.2000","10.10.2000",2000,10,10,0.16,5
"ESP_034_MZB_LO_271","ESP_034_MZB_LO_271-07.09.2001","07.09.2001",2001,9,7,0.53,3
"ESP_034_MZB_LO_271","ESP_034_MZB_LO_271-02.09.2002","02.09.2002",2002,9,2,0.59,3
"ESP_034_MZB_LO_271","ESP_034_MZB_LO_271-22.09.2003","22.09.2003",2003,9,22,0.56,3
"ESP_034_MZB_LO_271","ESP_034_MZB_LO_271-01.09.2004","01.09.2004",2004,9,1,0.78,2
"ESP_034_MZB_LO_271","ESP_034_MZB_LO_271-27.09.2005","27.09.2005",2005,9,27,0.63,3
"ESP_034_MZB_LO_271","ESP_034_MZB_LO_271-03.10.2006","03.10.2006",2006,10,3,0.67,3
"ESP_034_MZB_LO_271","ESP_034_MZB_LO_271-26.09.2007","26.09.2007",2007,9,26,0.26,4
"ESP_034_MZB_LO_271","ESP_034_MZB_LO_271-08.10.2008","08.10.2008",2008,10,8,0.34,4
"ESP_034_MZB_LO_271","ESP_034_MZB_LO_271-22.09.2009","22.09.2009",2009,9,22,0.17,5
"ESP_034_MZB_LO_271","ESP_034_MZB_LO_271-06.10.2010","06.10.2010",2010,10,6,0.24,4
"ESP_034_MZB_LO_271","ESP_034_MZB_LO_271-28.09.2011","28.09.2011",2011,9,28,0.27,4
"ESP_034_MZB_LO_271","ESP_034_MZB_LO_271-26.09.2012","26.09.2012",2012,9,26,0.4,4
"ESP_034_MZB_LO_271","ESP_034_MZB_LO_271-08.10.2013","08.10.2013",2013,10,8,0.36,4
"ESP_034_MZB_LO_271","ESP_034_MZB_LO_271-30.09.2014","30.09.2014",2014,9,30,0.7,2
"ESP_034_MZB_LO_271","ESP_034_MZB_LO_271-01.10.2015","01.10.2015",2015,10,1,0.68,2
"ESP_034_MZB_LO_271","ESP_034_MZB_LO_271-22.09.2016","22.09.2016",2016,9,22,0.54,3
"ESP_034_MZB_LO_271","ESP_034_MZB_LO_271-11.09.2017","11.09.2017",2017,9,11,0.62,3
"ESP_034_MZB_LO_271","ESP_034_MZB_LO_271-03.09.2018","03.09.2018",2018,9,3,0.54,3
"ESP_034_MZB_LO_271","ESP_034_MZB_LO_271-16.09.2019","16.09.2019",2019,9,16,0.64,3
"ESP_034_MZB_LO_271","ESP_034_MZB_LO_271-01.09.2020","01.09.2020",2020,9,1,0.51,3
"ESP_034_MZB_LO_271","ESP_034_MZB_LO_271-06.09.2021","06.09.2021",2021,9,6,0.62,3
"ESP_034_MZB_LO_272","ESP_034_MZB_LO_272-20.09.1994","20.09.1994",1994,9,20,0.47,3
"ESP_034_MZB_LO_272","ESP_034_MZB_LO_272-21.09.1995","21.09.1995",1995,9,21,0.41,4
"ESP_034_MZB_LO_272","ESP_034_MZB_LO_272-25.09.1996","25.09.1996",1996,9,25,0.18,5
"ESP_034_MZB_LO_272","ESP_034_MZB_LO_272-12.09.1997","12.09.1997",1997,9,12,0.61,3
"ESP_034_MZB_LO_272","ESP_034_MZB_LO_272-04.09.1998","04.09.1998",1998,9,4,0.58,3
"ESP_034_MZB_LO_272","ESP_034_MZB_LO_272-17.09.1999","17.09.1999",1999,9,17,0.43,4
"ESP_034_MZB_LO_272","ESP_034_MZB_LO_272-04.10.2000","04.10.2000",2000,10,4,0.51,3
"ESP_034_MZB_LO_272","ESP_034_MZB_LO_272-17.09.2001","17.09.2001",2001,9,17,0.67,3
"ESP_034_MZB_LO_272","ESP_034_MZB_LO_272-13.09.2002","13.09.2002",2002,9,13,0.84,2
"ESP_034_MZB_LO_272","ESP_034_MZB_LO_272-18.09.2003","18.09.2003",2003,9,18,0.6,3
"ESP_034_MZB_LO_272","ESP_034_MZB_LO_272-21.09.2004","21.09.2004",2004,9,21,0.08,5
"ESP_034_MZB_LO_272","ESP_034_MZB_LO_272-19.09.2005","19.09.2005",2005,9,19,0.26,4
"ESP_034_MZB_LO_272","ESP_034_MZB_LO_272-18.09.2006","18.09.2006",2006,9,18,0.39,4
"ESP_034_MZB_LO_272","ESP_034_MZB_LO_272-13.09.2007","13.09.2007",2007,9,13,0.42,4
"ESP_034_MZB_LO_272","ESP_034_MZB_LO_272-11.09.2008","11.09.2008",2008,9,11,0.67,3
"ESP_034_MZB_LO_272","ESP_034_MZB_LO_272-15.09.2009","15.09.2009",2009,9,15,0.02,5
"ESP_034_MZB_LO_272","ESP_034_MZB_LO_272-06.09.2010","06.09.2010",2010,9,6,0.33,4
"ESP_034_MZB_LO_272","ESP_034_MZB_LO_272-01.09.2011","01.09.2011",2011,9,1,0.49,3
"ESP_034_MZB_LO_272","ESP_034_MZB_LO_272-05.09.2012","05.09.2012",2012,9,5,0.76,2
"ESP_034_MZB_LO_272","ESP_034_MZB_LO_272-03.09.2013","03.09.2013",2013,9,3,0.82,2
"ESP_034_MZB_LO_272","ESP_034_MZB_LO_272-09.09.2014","09.09.2014",2014,9,9,0.63,3
"ESP_034_MZB_LO_272","ESP_034_MZB_LO_272-10.09.2015","10.09.2015",2015,9,10,0.62,3
"ESP_034_MZB_LO_272","ESP_034_MZB_LO_272-13.09.2016","13.09.2016",2016,9,13,0.68,2
"ESP_034_MZB_LO_272","ESP_034_MZB_LO_272-07.09.2017","07.09.2017",2017,9,7,0.5,3
"ESP_034_MZB_LO_272","ESP_034_MZB_LO_272-19.09.2018","19.09.2018",2018,9,19,0.32,4
"ESP_034_MZB_LO_272","ESP_034_MZB_LO_272-02.09.2019","02.09.2019",2019,9,2,0.64,3
"ESP_034_MZB_LO_272","ESP_034_MZB_LO_272-16.09.2020","16.09.2020",2020,9,16,0.94,1
"ESP_034_MZB_LO_272","ESP_034_MZB_LO_272-21.09.2021","21.09.2021",2021,9,21,0.52,3
"ESP_034_MZB_LO_273","ESP_034_MZB_LO_273-26.09.2007","26.09.2007",2007,9,26,0.5,3
"ESP_034_MZB_LO_273","ESP_034_MZB_LO_273-08.10.2008","08.10.2008",2008,10,8,0.48,3
"ESP_034_MZB_LO_273","ESP_034_MZB_LO_273-22.09.2009","22.09.2009",2009,9,22,0.32,4
"ESP_034_MZB_LO_273","ESP_034_MZB_LO_273-06.10.2010","06.10.2010",2010,10,6,0.48,3
"ESP_034_MZB_LO_273","ESP_034_MZB_LO_273-28.09.2011","28.09.2011",2011,9,28,0.21,5
"ESP_034_MZB_LO_273","ESP_034_MZB_LO_273-26.09.2012","26.09.2012",2012,9,26,0.34,4
"ESP_034_MZB_LO_273","ESP_034_MZB_LO_273-08.10.2013","08.10.2013",2013,10,8,0.38,4
"ESP_034_MZB_LO_273","ESP_034_MZB_LO_273-30.09.2014","30.09.2014",2014,9,30,0.11,5
"ESP_034_MZB_LO_273","ESP_034_MZB_LO_273-01.10.2015","01.10.2015",2015,10,1,0.52,3
"ESP_034_MZB_LO_273","ESP_034_MZB_LO_273-22.09.2016","22.09.2016",2016,9,22,0.29,4
"ESP_034_MZB_LO_273","ESP_034_MZB_LO_273-14.09.2017","14.09.2017",2017,9,14,0.32,4
"ESP_034_MZB_LO_273","ESP_034_MZB_LO_273-03.09.2018","03.09.2018",2018,9,3,0.71,2
"ESP_034_MZB_LO_273","ESP_034_MZB_LO_273-11.09.2019","11.09.2019",2019,9,11,0.46,3
"ESP_034_MZB_LO_273","ESP_034_MZB_LO_273-01.09.2020","01.09.2020",2020,9,1,0.43,4
"ESP_034_MZB_LO_273","ESP_034_MZB_LO_273-06.09.2021","06.09.2021",2021,9,6,0.59,3
"ESP_034_MZB_LO_274","ESP_034_MZB_LO_274-02.10.2007","02.10.2007",2007,10,2,0.52,3
"ESP_034_MZB_LO_274","ESP_034_MZB_LO_274-23.09.2008","23.09.2008",2008,9,23,0.26,4
"ESP_034_MZB_LO_274","ESP_034_MZB_LO_274-08.10.2009","08.10.2009",2009,10,8,0.93,1
"ESP_034_MZB_LO_274","ESP_034_MZB_LO_274-20.09.2010","20.09.2010",2010,9,20,0.56,3
"ESP_034_MZB_LO_274","ESP_034_MZB_LO_274-13.09.2011","13.09.2011",2011,9,13,0.93,1
"ESP_034_MZB_LO_274","ESP_034_MZB_LO_274-14.09.2012","14.09.2012",2012,9,14,0.81,2
"ESP_034_MZB_LO_274","ESP_034_MZB_LO_274-19.09.2013","19.09.2013",2013,9,19,0.92,1
"ESP_034_MZB_LO_274","ESP_034_MZB_LO_274-23.09.2014","23.09.2014",2014,9,23,0.9,1
"ESP_034_MZB_LO_274","ESP_034_MZB_LO_274-16.09.2015","16.09.2015",2015,9,16,1,1
"ESP_034_MZB_LO_274","ESP_034_MZB_LO_274-28.09.2016","28.09.2016",2016,9,28,0.83,2
"ESP_034_MZB_LO_274","ESP_034_MZB_LO_274-18.09.2017","18.09.2017",2017,9,18,0.68,2
"ESP_034_MZB_LO_274","ESP_034_MZB_LO_274-06.09.2018","06.09.2018",2018,9,6,1.13,1
"ESP_034_MZB_LO_274","ESP_034_MZB_LO_274-17.09.2019","17.09.2019",2019,9,17,0.87,1
"ESP_034_MZB_LO_274","ESP_034_MZB_LO_274-09.09.2020","09.09.2020",2020,9,9,0.77,2
"ESP_034_MZB_LO_274","ESP_034_MZB_LO_274-13.09.2021","13.09.2021",2021,9,13,0.62,3
"ESP_034_MZB_LO_275","ESP_034_MZB_LO_275-23.08.2001","23.08.2001",2001,8,23,0.41,4
"ESP_034_MZB_LO_275","ESP_034_MZB_LO_275-16.10.2007","16.10.2007",2007,10,16,0.09,5
"ESP_034_MZB_LO_275","ESP_034_MZB_LO_275-09.10.2008","09.10.2008",2008,10,9,0.35,4
"ESP_034_MZB_LO_275","ESP_034_MZB_LO_275-24.09.2009","24.09.2009",2009,9,24,0.06,5
"ESP_034_MZB_LO_275","ESP_034_MZB_LO_275-13.10.2010","13.10.2010",2010,10,13,0.04,5
"ESP_034_MZB_LO_275","ESP_034_MZB_LO_275-27.09.2011","27.09.2011",2011,9,27,0.01,5
"ESP_034_MZB_LO_275","ESP_034_MZB_LO_275-27.09.2012","27.09.2012",2012,9,27,0.45,3
"ESP_034_MZB_LO_275","ESP_034_MZB_LO_275-07.10.2013","07.10.2013",2013,10,7,0.1,5
"ESP_034_MZB_LO_275","ESP_034_MZB_LO_275-29.09.2014","29.09.2014",2014,9,29,0.24,4
"ESP_034_MZB_LO_275","ESP_034_MZB_LO_275-06.10.2015","06.10.2015",2015,10,6,0.06,5
"ESP_034_MZB_LO_275","ESP_034_MZB_LO_275-21.09.2016","21.09.2016",2016,9,21,0.04,5
"ESP_034_MZB_LO_275","ESP_034_MZB_LO_275-15.09.2017","15.09.2017",2017,9,15,0.07,5
"ESP_034_MZB_LO_275","ESP_034_MZB_LO_275-03.09.2018","03.09.2018",2018,9,3,0.3,4
"ESP_034_MZB_LO_275","ESP_034_MZB_LO_275-18.09.2019","18.09.2019",2019,9,18,0.07,5
"ESP_034_MZB_LO_275","ESP_034_MZB_LO_275-31.08.2020","31.08.2020",2020,8,31,0.46,3
"ESP_034_MZB_LO_275","ESP_034_MZB_LO_275-07.09.2021","07.09.2021",2021,9,7,0.12,5
"ESP_034_MZB_LO_276","ESP_034_MZB_LO_276-03.10.2007","03.10.2007",2007,10,3,0.1,5
"ESP_034_MZB_LO_276","ESP_034_MZB_LO_276-24.09.2008","24.09.2008",2008,9,24,0.3,4
"ESP_034_MZB_LO_276","ESP_034_MZB_LO_276-07.10.2009","07.10.2009",2009,10,7,0.15,5
"ESP_034_MZB_LO_276","ESP_034_MZB_LO_276-16.09.2010","16.09.2010",2010,9,16,0.47,3
"ESP_034_MZB_LO_276","ESP_034_MZB_LO_276-12.09.2011","12.09.2011",2011,9,12,0.44,4
"ESP_034_MZB_LO_276","ESP_034_MZB_LO_276-13.09.2012","13.09.2012",2012,9,13,0.72,2
"ESP_034_MZB_LO_276","ESP_034_MZB_LO_276-23.09.2013","23.09.2013",2013,9,23,0.63,3
"ESP_034_MZB_LO_276","ESP_034_MZB_LO_276-22.09.2014","22.09.2014",2014,9,22,0.08,5
"ESP_034_MZB_LO_276","ESP_034_MZB_LO_276-15.09.2015","15.09.2015",2015,9,15,0.54,3
"ESP_034_MZB_LO_276","ESP_034_MZB_LO_276-29.09.2016","29.09.2016",2016,9,29,0.43,4
"ESP_034_MZB_LO_276","ESP_034_MZB_LO_276-18.09.2017","18.09.2017",2017,9,18,0.64,3
"ESP_034_MZB_LO_276","ESP_034_MZB_LO_276-06.09.2018","06.09.2018",2018,9,6,0.83,2
"ESP_034_MZB_LO_276","ESP_034_MZB_LO_276-17.09.2019","17.09.2019",2019,9,17,0.64,3
"ESP_034_MZB_LO_276","ESP_034_MZB_LO_276-07.09.2020","07.09.2020",2020,9,7,0.62,3
"ESP_034_MZB_LO_276","ESP_034_MZB_LO_276-15.09.2021","15.09.2021",2021,9,15,0.75,2
"ESP_034_MZB_LO_277","ESP_034_MZB_LO_277-13.10.2010","13.10.2010",2010,10,13,0.4,4
"ESP_034_MZB_LO_277","ESP_034_MZB_LO_277-26.09.2012","26.09.2012",2012,9,26,0.45,3
"ESP_034_MZB_LO_277","ESP_034_MZB_LO_277-09.10.2013","09.10.2013",2013,10,9,0.6,3
"ESP_034_MZB_LO_277","ESP_034_MZB_LO_277-30.09.2014","30.09.2014",2014,9,30,0.63,3
"ESP_034_MZB_LO_277","ESP_034_MZB_LO_277-01.10.2015","01.10.2015",2015,10,1,0.39,4
"ESP_034_MZB_LO_277","ESP_034_MZB_LO_277-21.09.2016","21.09.2016",2016,9,21,0.62,3
"ESP_034_MZB_LO_277","ESP_034_MZB_LO_277-14.09.2017","14.09.2017",2017,9,14,0.67,3
"ESP_034_MZB_LO_277","ESP_034_MZB_LO_277-04.09.2018","04.09.2018",2018,9,4,0.49,3
"ESP_034_MZB_LO_277","ESP_034_MZB_LO_277-16.09.2019","16.09.2019",2019,9,16,0.54,3
"ESP_034_MZB_LO_277","ESP_034_MZB_LO_277-01.09.2020","01.09.2020",2020,9,1,0.7,2
"ESP_034_MZB_LO_277","ESP_034_MZB_LO_277-07.09.2021","07.09.2021",2021,9,7,0.72,2
"ESP_034_MZB_LO_278","ESP_034_MZB_LO_278-04.09.1997","04.09.1997",1997,9,4,0.89,2
"ESP_034_MZB_LO_278","ESP_034_MZB_LO_278-08.09.1998","08.09.1998",1998,9,8,0.74,2
"ESP_034_MZB_LO_278","ESP_034_MZB_LO_278-20.09.1999","20.09.1999",1999,9,20,1.06,1
"ESP_034_MZB_LO_278","ESP_034_MZB_LO_278-02.10.2000","02.10.2000",2000,10,2,0.53,3
"ESP_034_MZB_LO_278","ESP_034_MZB_LO_278-13.09.2001","13.09.2001",2001,9,13,1.11,1
"ESP_034_MZB_LO_278","ESP_034_MZB_LO_278-02.09.2002","02.09.2002",2002,9,2,0.85,2
"ESP_034_MZB_LO_278","ESP_034_MZB_LO_278-30.09.2003","30.09.2003",2003,9,30,0.91,1
"ESP_034_MZB_LO_278","ESP_034_MZB_LO_278-23.09.2004","23.09.2004",2004,9,23,0.99,1
"ESP_034_MZB_LO_278","ESP_034_MZB_LO_278-21.09.2005","21.09.2005",2005,9,21,0.55,3
"ESP_034_MZB_LO_278","ESP_034_MZB_LO_278-13.09.2006","13.09.2006",2006,9,13,0.17,5
"ESP_034_MZB_LO_278","ESP_034_MZB_LO_278-17.09.2007","17.09.2007",2007,9,17,0.5,3
"ESP_034_MZB_LO_278","ESP_034_MZB_LO_278-15.09.2008","15.09.2008",2008,9,15,0.29,4
"ESP_034_MZB_LO_278","ESP_034_MZB_LO_278-09.09.2009","09.09.2009",2009,9,9,0.16,5
"ESP_034_MZB_LO_278","ESP_034_MZB_LO_278-08.09.2010","08.09.2010",2010,9,8,0.42,4
"ESP_034_MZB_LO_278","ESP_034_MZB_LO_278-06.09.2011","06.09.2011",2011,9,6,0.79,2
"ESP_034_MZB_LO_278","ESP_034_MZB_LO_278-03.09.2012","03.09.2012",2012,9,3,1.03,1
"ESP_034_MZB_LO_278","ESP_034_MZB_LO_278-09.09.2013","09.09.2013",2013,9,9,1.02,1
"ESP_034_MZB_LO_278","ESP_034_MZB_LO_278-02.09.2014","02.09.2014",2014,9,2,0.8,2
"ESP_034_MZB_LO_278","ESP_034_MZB_LO_278-01.09.2015","01.09.2015",2015,9,1,1.02,1
"ESP_034_MZB_LO_278","ESP_034_MZB_LO_278-14.09.2016","14.09.2016",2016,9,14,1.06,1
"ESP_034_MZB_LO_278","ESP_034_MZB_LO_278-26.09.2017","26.09.2017",2017,9,26,0.82,2
"ESP_034_MZB_LO_278","ESP_034_MZB_LO_278-17.09.2018","17.09.2018",2018,9,17,1.03,1
"ESP_034_MZB_LO_278","ESP_034_MZB_LO_278-23.09.2019","23.09.2019",2019,9,23,0.75,2
"ESP_034_MZB_LO_278","ESP_034_MZB_LO_278-21.09.2020","21.09.2020",2020,9,21,0.93,1
"ESP_034_MZB_LO_278","ESP_034_MZB_LO_278-23.09.2021","23.09.2021",2021,9,23,0.79,2
"ESP_034_MZB_LO_279","ESP_034_MZB_LO_279-11.09.2007","11.09.2007",2007,9,11,0.06,5
"ESP_034_MZB_LO_279","ESP_034_MZB_LO_279-13.10.2008","13.10.2008",2008,10,13,0.15,5
"ESP_034_MZB_LO_279","ESP_034_MZB_LO_279-17.09.2009","17.09.2009",2009,9,17,0.39,4
"ESP_034_MZB_LO_279","ESP_034_MZB_LO_279-13.09.2010","13.09.2010",2010,9,13,0.59,3
"ESP_034_MZB_LO_279","ESP_034_MZB_LO_279-05.09.2011","05.09.2011",2011,9,5,0.5,3
"ESP_034_MZB_LO_279","ESP_034_MZB_LO_279-12.09.2012","12.09.2012",2012,9,12,0.3,4
"ESP_034_MZB_LO_279","ESP_034_MZB_LO_279-11.09.2013","11.09.2013",2013,9,11,0.74,2
"ESP_034_MZB_LO_279","ESP_034_MZB_LO_279-08.09.2014","08.09.2014",2014,9,8,0.16,5
"ESP_034_MZB_LO_279","ESP_034_MZB_LO_279-14.09.2015","14.09.2015",2015,9,14,0.31,4
"ESP_034_MZB_LO_279","ESP_034_MZB_LO_279-15.09.2016","15.09.2016",2016,9,15,0.25,4
"ESP_034_MZB_LO_279","ESP_034_MZB_LO_279-07.09.2017","07.09.2017",2017,9,7,0.13,5
"ESP_034_MZB_LO_279","ESP_034_MZB_LO_279-20.09.2018","20.09.2018",2018,9,20,0.86,2
"ESP_034_MZB_LO_279","ESP_034_MZB_LO_279-12.09.2019","12.09.2019",2019,9,12,0.17,5
"ESP_034_MZB_LO_279","ESP_034_MZB_LO_279-17.09.2020","17.09.2020",2020,9,17,0.38,4
"ESP_034_MZB_LO_279","ESP_034_MZB_LO_279-27.09.2021","27.09.2021",2021,9,27,0.45,3
"ESP_034_MZB_LO_28","ESP_034_MZB_LO_28-15.09.1993","15.09.1993",1993,9,15,0.85,2
"ESP_034_MZB_LO_28","ESP_034_MZB_LO_28-25.08.1994","25.08.1994",1994,8,25,0.69,2
"ESP_034_MZB_LO_28","ESP_034_MZB_LO_28-16.09.1995","16.09.1995",1995,9,16,0.21,5
"ESP_034_MZB_LO_28","ESP_034_MZB_LO_28-05.09.1996","05.09.1996",1996,9,5,0.68,2
"ESP_034_MZB_LO_28","ESP_034_MZB_LO_28-27.08.1997","27.08.1997",1997,8,27,0.66,2
"ESP_034_MZB_LO_28","ESP_034_MZB_LO_28-01.09.1998","01.09.1998",1998,9,1,0.61,3
"ESP_034_MZB_LO_28","ESP_034_MZB_LO_28-22.08.2000","22.08.2000",2000,8,22,0.71,2
"ESP_034_MZB_LO_28","ESP_034_MZB_LO_28-05.10.2001","05.10.2001",2001,10,5,0.84,2
"ESP_034_MZB_LO_28","ESP_034_MZB_LO_28-24.09.2002","24.09.2002",2002,9,24,0.6,3
"ESP_034_MZB_LO_28","ESP_034_MZB_LO_28-25.08.2003","25.08.2003",2003,8,25,0.55,3
"ESP_034_MZB_LO_28","ESP_034_MZB_LO_28-27.08.2004","27.08.2004",2004,8,27,0.63,3
"ESP_034_MZB_LO_28","ESP_034_MZB_LO_28-30.08.2005","30.08.2005",2005,8,30,0.69,2
"ESP_034_MZB_LO_28","ESP_034_MZB_LO_28-29.08.2006","29.08.2006",2006,8,29,0.73,2
"ESP_034_MZB_LO_28","ESP_034_MZB_LO_28-28.08.2007","28.08.2007",2007,8,28,0.84,2
"ESP_034_MZB_LO_28","ESP_034_MZB_LO_28-27.08.2008","27.08.2008",2008,8,27,0.83,2
"ESP_034_MZB_LO_28","ESP_034_MZB_LO_28-21.08.2009","21.08.2009",2009,8,21,0.68,2
"ESP_034_MZB_LO_28","ESP_034_MZB_LO_28-26.08.2010","26.08.2010",2010,8,26,0.63,3
"ESP_034_MZB_LO_28","ESP_034_MZB_LO_28-22.08.2011","22.08.2011",2011,8,22,0.84,2
"ESP_034_MZB_LO_28","ESP_034_MZB_LO_28-20.08.2012","20.08.2012",2012,8,20,0.5,3
"ESP_034_MZB_LO_28","ESP_034_MZB_LO_28-04.09.2013","04.09.2013",2013,9,4,0.56,3
"ESP_034_MZB_LO_28","ESP_034_MZB_LO_28-28.08.2014","28.08.2014",2014,8,28,0.71,2
"ESP_034_MZB_LO_28","ESP_034_MZB_LO_28-03.09.2015","03.09.2015",2015,9,3,0.78,2
"ESP_034_MZB_LO_28","ESP_034_MZB_LO_28-10.08.2016","10.08.2016",2016,8,10,0.78,2
"ESP_034_MZB_LO_28","ESP_034_MZB_LO_28-22.08.2017","22.08.2017",2017,8,22,0.45,3
"ESP_034_MZB_LO_28","ESP_034_MZB_LO_28-15.09.2020","15.09.2020",2020,9,15,0.76,2
"ESP_034_MZB_LO_28","ESP_034_MZB_LO_28-31.08.2021","31.08.2021",2021,8,31,0.82,2
"ESP_034_MZB_LO_280","ESP_034_MZB_LO_280-30.09.1999","30.09.1999",1999,9,30,0.22,4
"ESP_034_MZB_LO_280","ESP_034_MZB_LO_280-06.09.2002","06.09.2002",2002,9,6,0.42,4
"ESP_034_MZB_LO_280","ESP_034_MZB_LO_280-10.09.2003","10.09.2003",2003,9,10,0.96,1
"ESP_034_MZB_LO_280","ESP_034_MZB_LO_280-20.09.2004","20.09.2004",2004,9,20,0.56,3
"ESP_034_MZB_LO_280","ESP_034_MZB_LO_280-10.10.2005","10.10.2005",2005,10,10,0.46,3
"ESP_034_MZB_LO_280","ESP_034_MZB_LO_280-20.09.2006","20.09.2006",2006,9,20,0.88,2
"ESP_034_MZB_LO_280","ESP_034_MZB_LO_280-11.09.2012","11.09.2012",2012,9,11,0.79,2
"ESP_034_MZB_LO_280","ESP_034_MZB_LO_280-16.09.2013","16.09.2013",2013,9,16,0.86,2
"ESP_034_MZB_LO_280","ESP_034_MZB_LO_280-11.09.2014","11.09.2014",2014,9,11,0.74,2
"ESP_034_MZB_LO_280","ESP_034_MZB_LO_280-09.09.2015","09.09.2015",2015,9,9,0.78,2
"ESP_034_MZB_LO_281","ESP_034_MZB_LO_281-10.09.2012","10.09.2012",2012,9,10,0.82,2
"ESP_034_MZB_LO_281","ESP_034_MZB_LO_281-05.09.2013","05.09.2013",2013,9,5,0.99,1
"ESP_034_MZB_LO_281","ESP_034_MZB_LO_281-16.09.2014","16.09.2014",2014,9,16,0.84,2
"ESP_034_MZB_LO_281","ESP_034_MZB_LO_281-02.09.2015","02.09.2015",2015,9,2,0.83,2
"ESP_034_MZB_LO_281","ESP_034_MZB_LO_281-12.09.2016","12.09.2016",2016,9,12,0.71,2
"ESP_034_MZB_LO_281","ESP_034_MZB_LO_281-04.09.2017","04.09.2017",2017,9,4,0.82,2
"ESP_034_MZB_LO_281","ESP_034_MZB_LO_281-18.09.2018","18.09.2018",2018,9,18,0.64,3
"ESP_034_MZB_LO_281","ESP_034_MZB_LO_281-09.09.2019","09.09.2019",2019,9,9,0.88,2
"ESP_034_MZB_LO_281","ESP_034_MZB_LO_281-15.09.2020","15.09.2020",2020,9,15,0.78,2
"ESP_034_MZB_LO_281","ESP_034_MZB_LO_281-28.09.2021","28.09.2021",2021,9,28,0.83,2
"ESP_034_MZB_LO_282","ESP_034_MZB_LO_282-25.09.2007","25.09.2007",2007,9,25,0.18,5
"ESP_034_MZB_LO_282","ESP_034_MZB_LO_282-07.10.2008","07.10.2008",2008,10,7,0.58,3
"ESP_034_MZB_LO_282","ESP_034_MZB_LO_282-23.09.2009","23.09.2009",2009,9,23,0.45,3
"ESP_034_MZB_LO_282","ESP_034_MZB_LO_282-05.10.2010","05.10.2010",2010,10,5,0.45,3
"ESP_034_MZB_LO_282","ESP_034_MZB_LO_282-29.09.2011","29.09.2011",2011,9,29,0.21,5
"ESP_034_MZB_LO_282","ESP_034_MZB_LO_282-28.09.2012","28.09.2012",2012,9,28,0.55,3
"ESP_034_MZB_LO_282","ESP_034_MZB_LO_282-09.10.2013","09.10.2013",2013,10,9,0.57,3
"ESP_034_MZB_LO_282","ESP_034_MZB_LO_282-01.10.2014","01.10.2014",2014,10,1,0.52,3
"ESP_034_MZB_LO_282","ESP_034_MZB_LO_282-05.10.2015","05.10.2015",2015,10,5,0.52,3
"ESP_034_MZB_LO_282","ESP_034_MZB_LO_282-20.09.2016","20.09.2016",2016,9,20,0.41,4
"ESP_034_MZB_LO_282","ESP_034_MZB_LO_282-12.09.2017","12.09.2017",2017,9,12,0.52,3
"ESP_034_MZB_LO_282","ESP_034_MZB_LO_282-04.09.2018","04.09.2018",2018,9,4,0.52,3
"ESP_034_MZB_LO_282","ESP_034_MZB_LO_282-12.09.2019","12.09.2019",2019,9,12,0.58,3
"ESP_034_MZB_LO_282","ESP_034_MZB_LO_282-01.09.2020","01.09.2020",2020,9,1,0.57,3
"ESP_034_MZB_LO_282","ESP_034_MZB_LO_282-06.09.2021","06.09.2021",2021,9,6,0.55,3
"ESP_034_MZB_LO_284","ESP_034_MZB_LO_284-08.10.2007","08.10.2007",2007,10,8,0.51,3
"ESP_034_MZB_LO_284","ESP_034_MZB_LO_284-18.09.2008","18.09.2008",2008,9,18,0.46,3
"ESP_034_MZB_LO_284","ESP_034_MZB_LO_284-05.10.2009","05.10.2009",2009,10,5,0.41,4
"ESP_034_MZB_LO_284","ESP_034_MZB_LO_284-21.09.2010","21.09.2010",2010,9,21,0.13,5
"ESP_034_MZB_LO_284","ESP_034_MZB_LO_284-14.09.2011","14.09.2011",2011,9,14,0.07,5
"ESP_034_MZB_LO_284","ESP_034_MZB_LO_284-18.09.2012","18.09.2012",2012,9,18,0.27,4
"ESP_034_MZB_LO_284","ESP_034_MZB_LO_284-18.09.2013","18.09.2013",2013,9,18,1.06,1
"ESP_034_MZB_LO_284","ESP_034_MZB_LO_284-24.09.2014","24.09.2014",2014,9,24,0.5,3
"ESP_034_MZB_LO_284","ESP_034_MZB_LO_284-22.09.2015","22.09.2015",2015,9,22,0.65,3
"ESP_034_MZB_LO_284","ESP_034_MZB_LO_284-03.10.2016","03.10.2016",2016,10,3,0.79,2
"ESP_034_MZB_LO_284","ESP_034_MZB_LO_284-19.09.2017","19.09.2017",2017,9,19,0.58,3
"ESP_034_MZB_LO_284","ESP_034_MZB_LO_284-11.09.2018","11.09.2018",2018,9,11,0.82,2
"ESP_034_MZB_LO_284","ESP_034_MZB_LO_284-25.09.2019","25.09.2019",2019,9,25,0.9,1
"ESP_034_MZB_LO_284","ESP_034_MZB_LO_284-21.09.2020","21.09.2020",2020,9,21,0.7,2
"ESP_034_MZB_LO_284","ESP_034_MZB_LO_284-15.09.2021","15.09.2021",2021,9,15,0.74,2
"ESP_034_MZB_LO_285","ESP_034_MZB_LO_285-15.09.1997","15.09.1997",1997,9,15,0.71,2
"ESP_034_MZB_LO_285","ESP_034_MZB_LO_285-10.09.1998","10.09.1998",1998,9,10,0.53,3
"ESP_034_MZB_LO_285","ESP_034_MZB_LO_285-21.09.1999","21.09.1999",1999,9,21,0.55,3
"ESP_034_MZB_LO_285","ESP_034_MZB_LO_285-10.10.2000","10.10.2000",2000,10,10,0.55,3
"ESP_034_MZB_LO_285","ESP_034_MZB_LO_285-07.09.2001","07.09.2001",2001,9,7,1.01,1
"ESP_034_MZB_LO_285","ESP_034_MZB_LO_285-17.09.2002","17.09.2002",2002,9,17,0.6,3
"ESP_034_MZB_LO_285","ESP_034_MZB_LO_285-29.09.2003","29.09.2003",2003,9,29,0.82,2
"ESP_034_MZB_LO_285","ESP_034_MZB_LO_285-08.09.2004","08.09.2004",2004,9,8,0.85,2
"ESP_034_MZB_LO_285","ESP_034_MZB_LO_285-27.09.2005","27.09.2005",2005,9,27,0.82,2
"ESP_034_MZB_LO_285","ESP_034_MZB_LO_285-03.10.2006","03.10.2006",2006,10,3,0.8,2
"ESP_034_MZB_LO_285","ESP_034_MZB_LO_285-26.09.2007","26.09.2007",2007,9,26,0.9,1
"ESP_034_MZB_LO_285","ESP_034_MZB_LO_285-08.10.2008","08.10.2008",2008,10,8,1.03,1
"ESP_034_MZB_LO_285","ESP_034_MZB_LO_285-22.09.2009","22.09.2009",2009,9,22,0.95,1
"ESP_034_MZB_LO_285","ESP_034_MZB_LO_285-07.10.2010","07.10.2010",2010,10,7,0.91,1
"ESP_034_MZB_LO_285","ESP_034_MZB_LO_285-22.09.2011","22.09.2011",2011,9,22,0.94,1
"ESP_034_MZB_LO_285","ESP_034_MZB_LO_285-03.10.2013","03.10.2013",2013,10,3,1.14,1
"ESP_034_MZB_LO_286","ESP_034_MZB_LO_286-20.09.2007","20.09.2007",2007,9,20,0.8,2
"ESP_034_MZB_LO_286","ESP_034_MZB_LO_286-17.09.2008","17.09.2008",2008,9,17,1,1
"ESP_034_MZB_LO_286","ESP_034_MZB_LO_286-10.09.2009","10.09.2009",2009,9,10,0.9,1
"ESP_034_MZB_LO_286","ESP_034_MZB_LO_286-07.09.2010","07.09.2010",2010,9,7,1.15,1
"ESP_034_MZB_LO_286","ESP_034_MZB_LO_286-05.09.2011","05.09.2011",2011,9,5,0.99,1
"ESP_034_MZB_LO_286","ESP_034_MZB_LO_286-03.09.2012","03.09.2012",2012,9,3,0.96,1
"ESP_034_MZB_LO_286","ESP_034_MZB_LO_286-11.10.2013","11.10.2013",2013,10,11,1.12,1
"ESP_034_MZB_LO_286","ESP_034_MZB_LO_286-05.09.2014","05.09.2014",2014,9,5,0.87,2
"ESP_034_MZB_LO_286","ESP_034_MZB_LO_286-03.09.2015","03.09.2015",2015,9,3,0.8,2
"ESP_034_MZB_LO_286","ESP_034_MZB_LO_286-14.09.2016","14.09.2016",2016,9,14,1.04,1
"ESP_034_MZB_LO_286","ESP_034_MZB_LO_286-22.09.2017","22.09.2017",2017,9,22,0.75,2
"ESP_034_MZB_LO_286","ESP_034_MZB_LO_286-17.09.2018","17.09.2018",2018,9,17,0.99,1
"ESP_034_MZB_LO_286","ESP_034_MZB_LO_286-05.09.2019","05.09.2019",2019,9,5,1.03,1
"ESP_034_MZB_LO_286","ESP_034_MZB_LO_286-16.09.2020","16.09.2020",2020,9,16,1.09,1
"ESP_034_MZB_LO_286","ESP_034_MZB_LO_286-30.09.2021","30.09.2021",2021,9,30,1.05,1
"ESP_034_MZB_LO_287","ESP_034_MZB_LO_287-04.09.2002","04.09.2002",2002,9,4,1.24,1
"ESP_034_MZB_LO_287","ESP_034_MZB_LO_287-15.09.2003","15.09.2003",2003,9,15,1.31,1
"ESP_034_MZB_LO_287","ESP_034_MZB_LO_287-14.09.2004","14.09.2004",2004,9,14,1.22,1
"ESP_034_MZB_LO_287","ESP_034_MZB_LO_287-06.09.2005","06.09.2005",2005,9,6,0.99,1
"ESP_034_MZB_LO_287","ESP_034_MZB_LO_287-26.09.2006","26.09.2006",2006,9,26,1.11,1
"ESP_034_MZB_LO_287","ESP_034_MZB_LO_287-04.10.2007","04.10.2007",2007,10,4,0.88,1
"ESP_034_MZB_LO_287","ESP_034_MZB_LO_287-18.09.2008","18.09.2008",2008,9,18,1.17,1
"ESP_034_MZB_LO_287","ESP_034_MZB_LO_287-05.10.2009","05.10.2009",2009,10,5,1.12,1
"ESP_034_MZB_LO_287","ESP_034_MZB_LO_287-21.09.2010","21.09.2010",2010,9,21,1.03,1
"ESP_034_MZB_LO_287","ESP_034_MZB_LO_287-14.09.2011","14.09.2011",2011,9,14,1.07,1
"ESP_034_MZB_LO_287","ESP_034_MZB_LO_287-18.09.2012","18.09.2012",2012,9,18,1.09,1
"ESP_034_MZB_LO_287","ESP_034_MZB_LO_287-18.09.2013","18.09.2013",2013,9,18,0.96,1
"ESP_034_MZB_LO_287","ESP_034_MZB_LO_287-24.09.2014","24.09.2014",2014,9,24,0.94,1
"ESP_034_MZB_LO_287","ESP_034_MZB_LO_287-22.09.2015","22.09.2015",2015,9,22,1.03,1
"ESP_034_MZB_LO_287","ESP_034_MZB_LO_287-03.10.2016","03.10.2016",2016,10,3,1.26,1
"ESP_034_MZB_LO_287","ESP_034_MZB_LO_287-11.09.2018","11.09.2018",2018,9,11,1.14,1
"ESP_034_MZB_LO_287","ESP_034_MZB_LO_287-25.09.2019","25.09.2019",2019,9,25,1.11,1
"ESP_034_MZB_LO_287","ESP_034_MZB_LO_287-21.09.2020","21.09.2020",2020,9,21,0.96,1
"ESP_034_MZB_LO_287","ESP_034_MZB_LO_287-15.09.2021","15.09.2021",2021,9,15,1.1,1
"ESP_034_MZB_LO_288","ESP_034_MZB_LO_288-24.09.2007","24.09.2007",2007,9,24,0.7,2
"ESP_034_MZB_LO_288","ESP_034_MZB_LO_288-02.10.2008","02.10.2008",2008,10,2,0.89,2
"ESP_034_MZB_LO_288","ESP_034_MZB_LO_288-21.09.2009","21.09.2009",2009,9,21,0.73,2
"ESP_034_MZB_LO_288","ESP_034_MZB_LO_288-30.09.2010","30.09.2010",2010,9,30,0.59,3
"ESP_034_MZB_LO_288","ESP_034_MZB_LO_288-22.09.2011","22.09.2011",2011,9,22,0.67,3
"ESP_034_MZB_LO_288","ESP_034_MZB_LO_288-25.09.2012","25.09.2012",2012,9,25,0.75,2
"ESP_034_MZB_LO_288","ESP_034_MZB_LO_288-03.10.2013","03.10.2013",2013,10,3,0.6,3
"ESP_034_MZB_LO_288","ESP_034_MZB_LO_288-02.10.2014","02.10.2014",2014,10,2,0.65,3
"ESP_034_MZB_LO_288","ESP_034_MZB_LO_288-30.09.2015","30.09.2015",2015,9,30,0.67,3
"ESP_034_MZB_LO_288","ESP_034_MZB_LO_288-19.09.2016","19.09.2016",2016,9,19,0.76,2
"ESP_034_MZB_LO_288","ESP_034_MZB_LO_288-12.09.2017","12.09.2017",2017,9,12,0.77,2
"ESP_034_MZB_LO_288","ESP_034_MZB_LO_288-05.09.2018","05.09.2018",2018,9,5,0.75,2
"ESP_034_MZB_LO_288","ESP_034_MZB_LO_288-24.09.2019","24.09.2019",2019,9,24,0.74,2
"ESP_034_MZB_LO_288","ESP_034_MZB_LO_288-31.08.2020","31.08.2020",2020,8,31,0.7,2
"ESP_034_MZB_LO_288","ESP_034_MZB_LO_288-07.09.2021","07.09.2021",2021,9,7,0.79,2
"ESP_034_MZB_LO_289","ESP_034_MZB_LO_289-20.09.1993","20.09.1993",1993,9,20,0.66,3
"ESP_034_MZB_LO_289","ESP_034_MZB_LO_289-20.09.1994","20.09.1994",1994,9,20,0.7,2
"ESP_034_MZB_LO_289","ESP_034_MZB_LO_289-20.09.1995","20.09.1995",1995,9,20,0.86,2
"ESP_034_MZB_LO_289","ESP_034_MZB_LO_289-24.09.1996","24.09.1996",1996,9,24,0.83,2
"ESP_034_MZB_LO_289","ESP_034_MZB_LO_289-09.09.1997","09.09.1997",1997,9,9,0.81,2
"ESP_034_MZB_LO_289","ESP_034_MZB_LO_289-03.09.1998","03.09.1998",1998,9,3,0.64,3
"ESP_034_MZB_LO_289","ESP_034_MZB_LO_289-28.09.1999","28.09.1999",1999,9,28,0.59,3
"ESP_034_MZB_LO_289","ESP_034_MZB_LO_289-03.10.2000","03.10.2000",2000,10,3,0.52,3
"ESP_034_MZB_LO_289","ESP_034_MZB_LO_289-20.09.2001","20.09.2001",2001,9,20,0.79,2
"ESP_034_MZB_LO_289","ESP_034_MZB_LO_289-06.09.2002","06.09.2002",2002,9,6,1.16,1
"ESP_034_MZB_LO_289","ESP_034_MZB_LO_289-04.09.2003","04.09.2003",2003,9,4,1.08,1
"ESP_034_MZB_LO_289","ESP_034_MZB_LO_289-22.09.2004","22.09.2004",2004,9,22,0.98,1
"ESP_034_MZB_LO_289","ESP_034_MZB_LO_289-10.10.2005","10.10.2005",2005,10,10,1.09,1
"ESP_034_MZB_LO_289","ESP_034_MZB_LO_289-20.09.2006","20.09.2006",2006,9,20,1.02,1
"ESP_034_MZB_LO_289","ESP_034_MZB_LO_289-19.09.2007","19.09.2007",2007,9,19,0.74,2
"ESP_034_MZB_LO_289","ESP_034_MZB_LO_289-16.09.2008","16.09.2008",2008,9,16,0.71,2
"ESP_034_MZB_LO_289","ESP_034_MZB_LO_289-30.09.2009","30.09.2009",2009,9,30,0.69,2
"ESP_034_MZB_LO_289","ESP_034_MZB_LO_289-15.09.2010","15.09.2010",2010,9,15,1.12,1
"ESP_034_MZB_LO_289","ESP_034_MZB_LO_289-08.09.2011","08.09.2011",2011,9,8,0.8,2
"ESP_034_MZB_LO_289","ESP_034_MZB_LO_289-11.09.2012","11.09.2012",2012,9,11,0.62,3
"ESP_034_MZB_LO_289","ESP_034_MZB_LO_289-16.09.2013","16.09.2013",2013,9,16,0.85,2
"ESP_034_MZB_LO_289","ESP_034_MZB_LO_289-11.09.2014","11.09.2014",2014,9,11,0.66,3
"ESP_034_MZB_LO_289","ESP_034_MZB_LO_289-09.09.2015","09.09.2015",2015,9,9,0.72,2
"ESP_034_MZB_LO_289","ESP_034_MZB_LO_289-13.09.2016","13.09.2016",2016,9,13,0.61,3
"ESP_034_MZB_LO_289","ESP_034_MZB_LO_289-05.09.2017","05.09.2017",2017,9,5,0.63,3
"ESP_034_MZB_LO_289","ESP_034_MZB_LO_289-18.09.2018","18.09.2018",2018,9,18,0.66,3
"ESP_034_MZB_LO_289","ESP_034_MZB_LO_289-03.09.2019","03.09.2019",2019,9,3,0.64,3
"ESP_034_MZB_LO_289","ESP_034_MZB_LO_289-14.09.2020","14.09.2020",2020,9,14,0.8,2
"ESP_034_MZB_LO_289","ESP_034_MZB_LO_289-30.09.2021","30.09.2021",2021,9,30,0.54,3
"ESP_034_MZB_LO_290","ESP_034_MZB_LO_290-10.09.2003","10.09.2003",2003,9,10,1.42,1
"ESP_034_MZB_LO_290","ESP_034_MZB_LO_290-02.10.2007","02.10.2007",2007,10,2,0.85,2
"ESP_034_MZB_LO_290","ESP_034_MZB_LO_290-23.09.2008","23.09.2008",2008,9,23,1.16,1
"ESP_034_MZB_LO_290","ESP_034_MZB_LO_290-08.10.2009","08.10.2009",2009,10,8,0.89,1
"ESP_034_MZB_LO_290","ESP_034_MZB_LO_290-20.09.2010","20.09.2010",2010,9,20,0.74,2
"ESP_034_MZB_LO_290","ESP_034_MZB_LO_290-13.09.2011","13.09.2011",2011,9,13,0.87,1
"ESP_034_MZB_LO_290","ESP_034_MZB_LO_290-14.09.2012","14.09.2012",2012,9,14,0.98,1
"ESP_034_MZB_LO_290","ESP_034_MZB_LO_290-20.09.2013","20.09.2013",2013,9,20,1.08,1
"ESP_034_MZB_LO_290","ESP_034_MZB_LO_290-23.09.2014","23.09.2014",2014,9,23,0.63,3
"ESP_034_MZB_LO_290","ESP_034_MZB_LO_290-16.09.2015","16.09.2015",2015,9,16,0.98,1
"ESP_034_MZB_LO_290","ESP_034_MZB_LO_290-28.09.2016","28.09.2016",2016,9,28,1.08,1
"ESP_034_MZB_LO_290","ESP_034_MZB_LO_290-18.09.2017","18.09.2017",2017,9,18,1.01,1
"ESP_034_MZB_LO_290","ESP_034_MZB_LO_290-06.09.2018","06.09.2018",2018,9,6,1.16,1
"ESP_034_MZB_LO_290","ESP_034_MZB_LO_290-17.09.2019","17.09.2019",2019,9,17,0.95,1
"ESP_034_MZB_LO_290","ESP_034_MZB_LO_290-10.09.2020","10.09.2020",2020,9,10,0.81,2
"ESP_034_MZB_LO_290","ESP_034_MZB_LO_290-13.09.2021","13.09.2021",2021,9,13,0.98,1
"ESP_034_MZB_LO_291","ESP_034_MZB_LO_291-09.10.2007","09.10.2007",2007,10,9,0.14,5
"ESP_034_MZB_LO_291","ESP_034_MZB_LO_291-29.09.2008","29.09.2008",2008,9,29,0.07,5
"ESP_034_MZB_LO_291","ESP_034_MZB_LO_291-14.10.2009","14.10.2009",2009,10,14,0.05,5
"ESP_034_MZB_LO_291","ESP_034_MZB_LO_291-28.09.2010","28.09.2010",2010,9,28,0.45,3
"ESP_034_MZB_LO_291","ESP_034_MZB_LO_291-20.09.2011","20.09.2011",2011,9,20,0.54,3
"ESP_034_MZB_LO_291","ESP_034_MZB_LO_291-20.09.2012","20.09.2012",2012,9,20,0.68,2
"ESP_034_MZB_LO_291","ESP_034_MZB_LO_291-24.09.2013","24.09.2013",2013,9,24,0.81,2
"ESP_034_MZB_LO_291","ESP_034_MZB_LO_291-18.09.2014","18.09.2014",2014,9,18,0.66,3
"ESP_034_MZB_LO_291","ESP_034_MZB_LO_291-25.09.2015","25.09.2015",2015,9,25,0.76,2
"ESP_034_MZB_LO_291","ESP_034_MZB_LO_291-04.10.2016","04.10.2016",2016,10,4,0.86,2
"ESP_034_MZB_LO_291","ESP_034_MZB_LO_291-20.09.2017","20.09.2017",2017,9,20,0.63,3
"ESP_034_MZB_LO_291","ESP_034_MZB_LO_291-10.09.2018","10.09.2018",2018,9,10,0.9,1
"ESP_034_MZB_LO_291","ESP_034_MZB_LO_291-18.09.2019","18.09.2019",2019,9,18,0.73,2
"ESP_034_MZB_LO_291","ESP_034_MZB_LO_291-08.09.2020","08.09.2020",2020,9,8,0.49,3
"ESP_034_MZB_LO_291","ESP_034_MZB_LO_291-22.09.2021","22.09.2021",2021,9,22,0.86,2
"ESP_034_MZB_LO_292","ESP_034_MZB_LO_292-23.08.2001","23.08.2001",2001,8,23,0.4,4
"ESP_034_MZB_LO_292","ESP_034_MZB_LO_292-21.09.2016","21.09.2016",2016,9,21,0.78,2
"ESP_034_MZB_LO_292","ESP_034_MZB_LO_292-13.09.2017","13.09.2017",2017,9,13,0.77,2
"ESP_034_MZB_LO_292","ESP_034_MZB_LO_292-03.09.2018","03.09.2018",2018,9,3,0.92,1
"ESP_034_MZB_LO_292","ESP_034_MZB_LO_292-18.09.2019","18.09.2019",2019,9,18,0.71,2
"ESP_034_MZB_LO_292","ESP_034_MZB_LO_292-31.08.2020","31.08.2020",2020,8,31,0.67,3
"ESP_034_MZB_LO_292","ESP_034_MZB_LO_292-07.09.2021","07.09.2021",2021,9,7,0.7,2
"ESP_034_MZB_LO_293","ESP_034_MZB_LO_293-30.09.2003","30.09.2003",2003,9,30,1.16,1
"ESP_034_MZB_LO_293","ESP_034_MZB_LO_293-23.09.2004","23.09.2004",2004,9,23,0.83,2
"ESP_034_MZB_LO_293","ESP_034_MZB_LO_293-21.09.2005","21.09.2005",2005,9,21,0.97,1
"ESP_034_MZB_LO_293","ESP_034_MZB_LO_293-13.09.2006","13.09.2006",2006,9,13,0.78,2
"ESP_034_MZB_LO_293","ESP_034_MZB_LO_293-17.09.2007","17.09.2007",2007,9,17,0.88,2
"ESP_034_MZB_LO_293","ESP_034_MZB_LO_293-15.09.2008","15.09.2008",2008,9,15,1.06,1
"ESP_034_MZB_LO_293","ESP_034_MZB_LO_293-09.09.2009","09.09.2009",2009,9,9,0.91,1
"ESP_034_MZB_LO_293","ESP_034_MZB_LO_293-08.09.2010","08.09.2010",2010,9,8,1.01,1
"ESP_034_MZB_LO_293","ESP_034_MZB_LO_293-06.09.2011","06.09.2011",2011,9,6,0.86,2
"ESP_034_MZB_LO_293","ESP_034_MZB_LO_293-04.09.2012","04.09.2012",2012,9,4,1.04,1
"ESP_034_MZB_LO_293","ESP_034_MZB_LO_293-09.09.2013","09.09.2013",2013,9,9,0.89,2
"ESP_034_MZB_LO_293","ESP_034_MZB_LO_293-02.09.2014","02.09.2014",2014,9,2,0.84,2
"ESP_034_MZB_LO_293","ESP_034_MZB_LO_293-01.09.2015","01.09.2015",2015,9,1,0.85,2
"ESP_034_MZB_LO_293","ESP_034_MZB_LO_293-14.09.2016","14.09.2016",2016,9,14,0.88,2
"ESP_034_MZB_LO_293","ESP_034_MZB_LO_293-26.09.2017","26.09.2017",2017,9,26,0.93,1
"ESP_034_MZB_LO_293","ESP_034_MZB_LO_293-17.09.2018","17.09.2018",2018,9,17,1.05,1
"ESP_034_MZB_LO_293","ESP_034_MZB_LO_293-26.09.2019","26.09.2019",2019,9,26,1.06,1
"ESP_034_MZB_LO_293","ESP_034_MZB_LO_293-21.09.2020","21.09.2020",2020,9,21,1.16,1
"ESP_034_MZB_LO_293","ESP_034_MZB_LO_293-23.09.2021","23.09.2021",2021,9,23,1.09,1
"ESP_034_MZB_LO_294","ESP_034_MZB_LO_294-05.09.1997","05.09.1997",1997,9,5,1.26,1
"ESP_034_MZB_LO_294","ESP_034_MZB_LO_294-08.09.1998","08.09.1998",1998,9,8,0.93,1
"ESP_034_MZB_LO_294","ESP_034_MZB_LO_294-20.09.1999","20.09.1999",1999,9,20,1.01,1
"ESP_034_MZB_LO_294","ESP_034_MZB_LO_294-02.10.2000","02.10.2000",2000,10,2,1.17,1
"ESP_034_MZB_LO_294","ESP_034_MZB_LO_294-13.09.2001","13.09.2001",2001,9,13,1.45,1
"ESP_034_MZB_LO_294","ESP_034_MZB_LO_294-16.09.2002","16.09.2002",2002,9,16,1.42,1
"ESP_034_MZB_LO_294","ESP_034_MZB_LO_294-30.09.2003","30.09.2003",2003,9,30,1.42,1
"ESP_034_MZB_LO_294","ESP_034_MZB_LO_294-28.09.2004","28.09.2004",2004,9,28,1.13,1
"ESP_034_MZB_LO_294","ESP_034_MZB_LO_294-20.09.2005","20.09.2005",2005,9,20,1.16,1
"ESP_034_MZB_LO_294","ESP_034_MZB_LO_294-11.09.2006","11.09.2006",2006,9,11,1.27,1
"ESP_034_MZB_LO_294","ESP_034_MZB_LO_294-09.09.2013","09.09.2013",2013,9,9,1.34,1
"ESP_034_MZB_LO_294","ESP_034_MZB_LO_294-08.09.2017","08.09.2017",2017,9,8,1.25,1
"ESP_034_MZB_LO_294","ESP_034_MZB_LO_294-16.09.2020","16.09.2020",2020,9,16,0.97,1
"ESP_034_MZB_LO_294","ESP_034_MZB_LO_294-30.09.2021","30.09.2021",2021,9,30,1.36,1
"ESP_034_MZB_LO_295","ESP_034_MZB_LO_295-07.09.1993","07.09.1993",1993,9,7,0.85,2
"ESP_034_MZB_LO_295","ESP_034_MZB_LO_295-07.09.1994","07.09.1994",1994,9,7,0.05,5
"ESP_034_MZB_LO_295","ESP_034_MZB_LO_295-07.09.1995","07.09.1995",1995,9,7,0.18,5
"ESP_034_MZB_LO_295","ESP_034_MZB_LO_295-04.09.1996","04.09.1996",1996,9,4,0.07,5
"ESP_034_MZB_LO_295","ESP_034_MZB_LO_295-16.09.1997","16.09.1997",1997,9,16,0.51,3
"ESP_034_MZB_LO_295","ESP_034_MZB_LO_295-11.09.1998","11.09.1998",1998,9,11,0.03,5
"ESP_034_MZB_LO_295","ESP_034_MZB_LO_295-22.09.1999","22.09.1999",1999,9,22,0.03,5
"ESP_034_MZB_LO_295","ESP_034_MZB_LO_295-09.10.2000","09.10.2000",2000,10,9,0.07,5
"ESP_034_MZB_LO_295","ESP_034_MZB_LO_295-06.09.2001","06.09.2001",2001,9,6,0.06,5
"ESP_034_MZB_LO_295","ESP_034_MZB_LO_295-16.09.2002","16.09.2002",2002,9,16,0.04,5
"ESP_034_MZB_LO_295","ESP_034_MZB_LO_295-25.09.2003","25.09.2003",2003,9,25,0.03,5
"ESP_034_MZB_LO_295","ESP_034_MZB_LO_295-02.09.2004","02.09.2004",2004,9,2,0.03,5
"ESP_034_MZB_LO_295","ESP_034_MZB_LO_295-29.09.2005","29.09.2005",2005,9,29,0.07,5
"ESP_034_MZB_LO_295","ESP_034_MZB_LO_295-05.10.2006","05.10.2006",2006,10,5,0.03,5
"ESP_034_MZB_LO_295","ESP_034_MZB_LO_295-14.10.2013","14.10.2013",2013,10,14,0.51,3
"ESP_034_MZB_LO_295","ESP_034_MZB_LO_295-29.09.2014","29.09.2014",2014,9,29,0.43,4
"ESP_034_MZB_LO_295","ESP_034_MZB_LO_295-06.10.2015","06.10.2015",2015,10,6,0.45,3
"ESP_034_MZB_LO_295","ESP_034_MZB_LO_295-06.10.2016","06.10.2016",2016,10,6,0.24,4
"ESP_034_MZB_LO_295","ESP_034_MZB_LO_295-14.09.2017","14.09.2017",2017,9,14,0.24,4
"ESP_034_MZB_LO_295","ESP_034_MZB_LO_295-04.09.2018","04.09.2018",2018,9,4,0.66,3
"ESP_034_MZB_LO_295","ESP_034_MZB_LO_295-24.09.2019","24.09.2019",2019,9,24,0.32,4
"ESP_034_MZB_LO_295","ESP_034_MZB_LO_295-02.09.2020","02.09.2020",2020,9,2,0.57,3
"ESP_034_MZB_LO_295","ESP_034_MZB_LO_295-08.09.2021","08.09.2021",2021,9,8,0.13,5
"ESP_034_MZB_LO_296","ESP_034_MZB_LO_296-11.09.2012","11.09.2012",2012,9,11,0.84,2
"ESP_034_MZB_LO_296","ESP_034_MZB_LO_296-16.09.2013","16.09.2013",2013,9,16,1.13,1
"ESP_034_MZB_LO_296","ESP_034_MZB_LO_296-11.09.2014","11.09.2014",2014,9,11,0.85,2
"ESP_034_MZB_LO_296","ESP_034_MZB_LO_296-09.09.2015","09.09.2015",2015,9,9,0.8,2
"ESP_034_MZB_LO_296","ESP_034_MZB_LO_296-13.09.2016","13.09.2016",2016,9,13,0.69,2
"ESP_034_MZB_LO_296","ESP_034_MZB_LO_296-05.09.2017","05.09.2017",2017,9,5,0.81,2
"ESP_034_MZB_LO_296","ESP_034_MZB_LO_296-18.09.2018","18.09.2018",2018,9,18,0.57,3
"ESP_034_MZB_LO_296","ESP_034_MZB_LO_296-03.09.2019","03.09.2019",2019,9,3,0.68,2
"ESP_034_MZB_LO_296","ESP_034_MZB_LO_296-14.09.2020","14.09.2020",2020,9,14,0.93,1
"ESP_034_MZB_LO_296","ESP_034_MZB_LO_296-30.09.2021","30.09.2021",2021,9,30,0.64,3
"ESP_034_MZB_LO_297","ESP_034_MZB_LO_297-10.10.2000","10.10.2000",2000,10,10,0.77,2
"ESP_034_MZB_LO_297","ESP_034_MZB_LO_297-07.09.2001","07.09.2001",2001,9,7,0.67,3
"ESP_034_MZB_LO_297","ESP_034_MZB_LO_297-18.09.2002","18.09.2002",2002,9,18,0.79,2
"ESP_034_MZB_LO_297","ESP_034_MZB_LO_297-23.09.2003","23.09.2003",2003,9,23,0.49,3
"ESP_034_MZB_LO_297","ESP_034_MZB_LO_297-01.09.2004","01.09.2004",2004,9,1,0.83,2
"ESP_034_MZB_LO_297","ESP_034_MZB_LO_297-28.09.2005","28.09.2005",2005,9,28,0.54,3
"ESP_034_MZB_LO_297","ESP_034_MZB_LO_297-04.10.2006","04.10.2006",2006,10,4,0.74,2
"ESP_034_MZB_LO_297","ESP_034_MZB_LO_297-07.10.2013","07.10.2013",2013,10,7,0.86,2
"ESP_034_MZB_LO_298","ESP_034_MZB_LO_298-09.09.2000","09.09.2000",2000,9,9,0.73,2
"ESP_034_MZB_LO_298","ESP_034_MZB_LO_298-06.09.2001","06.09.2001",2001,9,6,1.05,1
"ESP_034_MZB_LO_298","ESP_034_MZB_LO_298-18.09.2002","18.09.2002",2002,9,18,1.18,1
"ESP_034_MZB_LO_298","ESP_034_MZB_LO_298-24.09.2003","24.09.2003",2003,9,24,1.15,1
"ESP_034_MZB_LO_298","ESP_034_MZB_LO_298-05.10.2004","05.10.2004",2004,10,5,1.17,1
"ESP_034_MZB_LO_298","ESP_034_MZB_LO_298-03.10.2005","03.10.2005",2005,10,3,1.04,1
"ESP_034_MZB_LO_298","ESP_034_MZB_LO_298-09.10.2006","09.10.2006",2006,10,9,1.06,1
"ESP_034_MZB_LO_298","ESP_034_MZB_LO_298-24.09.2012","24.09.2012",2012,9,24,1.01,1
"ESP_034_MZB_LO_298","ESP_034_MZB_LO_298-10.10.2013","10.10.2013",2013,10,10,0.82,2
"ESP_034_MZB_LO_298","ESP_034_MZB_LO_298-06.10.2014","06.10.2014",2014,10,6,0.99,1
"ESP_034_MZB_LO_298","ESP_034_MZB_LO_298-07.10.2015","07.10.2015",2015,10,7,0.8,2
"ESP_034_MZB_LO_298","ESP_034_MZB_LO_298-20.09.2016","20.09.2016",2016,9,20,0.89,2
"ESP_034_MZB_LO_298","ESP_034_MZB_LO_298-05.09.2018","05.09.2018",2018,9,5,0.99,1
"ESP_034_MZB_LO_298","ESP_034_MZB_LO_298-02.09.2020","02.09.2020",2020,9,2,0.7,2
"ESP_034_MZB_LO_299","ESP_034_MZB_LO_299-18.09.2007","18.09.2007",2007,9,18,0.29,4
"ESP_034_MZB_LO_299","ESP_034_MZB_LO_299-01.10.2008","01.10.2008",2008,10,1,0.34,4
"ESP_034_MZB_LO_299","ESP_034_MZB_LO_299-29.09.2009","29.09.2009",2009,9,29,0.29,4
"ESP_034_MZB_LO_299","ESP_034_MZB_LO_299-29.09.2010","29.09.2010",2010,9,29,0.33,4
"ESP_034_MZB_LO_299","ESP_034_MZB_LO_299-26.09.2011","26.09.2011",2011,9,26,0.16,5
"ESP_034_MZB_LO_299","ESP_034_MZB_LO_299-24.09.2012","24.09.2012",2012,9,24,0.37,4
"ESP_034_MZB_LO_299","ESP_034_MZB_LO_299-10.10.2013","10.10.2013",2013,10,10,0.43,4
"ESP_034_MZB_LO_299","ESP_034_MZB_LO_299-06.10.2014","06.10.2014",2014,10,6,0.33,4
"ESP_034_MZB_LO_299","ESP_034_MZB_LO_299-07.10.2015","07.10.2015",2015,10,7,0.3,4
"ESP_034_MZB_LO_299","ESP_034_MZB_LO_299-20.09.2016","20.09.2016",2016,9,20,0.04,5
"ESP_034_MZB_LO_299","ESP_034_MZB_LO_299-11.09.2017","11.09.2017",2017,9,11,0.16,5
"ESP_034_MZB_LO_299","ESP_034_MZB_LO_299-05.09.2018","05.09.2018",2018,9,5,0.19,5
"ESP_034_MZB_LO_299","ESP_034_MZB_LO_299-10.09.2019","10.09.2019",2019,9,10,0.08,5
"ESP_034_MZB_LO_299","ESP_034_MZB_LO_299-02.09.2020","02.09.2020",2020,9,2,0.25,4
"ESP_034_MZB_LO_299","ESP_034_MZB_LO_299-09.09.2021","09.09.2021",2021,9,9,0.15,5
"ESP_034_MZB_LO_3","ESP_034_MZB_LO_3-04.09.1998","04.09.1998",1998,9,4,0.98,1
"ESP_034_MZB_LO_3","ESP_034_MZB_LO_3-04.10.1999","04.10.1999",1999,10,4,0.13,5
"ESP_034_MZB_LO_3","ESP_034_MZB_LO_3-21.08.2000","21.08.2000",2000,8,21,0.21,5
"ESP_034_MZB_LO_3","ESP_034_MZB_LO_3-03.10.2001","03.10.2001",2001,10,3,0.22,5
"ESP_034_MZB_LO_3","ESP_034_MZB_LO_3-20.09.2002","20.09.2002",2002,9,20,0.39,4
"ESP_034_MZB_LO_3","ESP_034_MZB_LO_3-21.08.2003","21.08.2003",2003,8,21,0.4,4
"ESP_034_MZB_LO_3","ESP_034_MZB_LO_3-30.08.2004","30.08.2004",2004,8,30,0.43,4
"ESP_034_MZB_LO_3","ESP_034_MZB_LO_3-31.08.2005","31.08.2005",2005,8,31,0.14,5
"ESP_034_MZB_LO_3","ESP_034_MZB_LO_3-21.08.2006","21.08.2006",2006,8,21,0.28,4
"ESP_034_MZB_LO_3","ESP_034_MZB_LO_3-29.08.2007","29.08.2007",2007,8,29,0.46,3
"ESP_034_MZB_LO_3","ESP_034_MZB_LO_3-28.08.2008","28.08.2008",2008,8,28,0.36,4
"ESP_034_MZB_LO_3","ESP_034_MZB_LO_3-20.08.2009","20.08.2009",2009,8,20,0.82,2
"ESP_034_MZB_LO_3","ESP_034_MZB_LO_3-30.08.2010","30.08.2010",2010,8,30,0.63,3
"ESP_034_MZB_LO_3","ESP_034_MZB_LO_3-24.08.2011","24.08.2011",2011,8,24,0.91,1
"ESP_034_MZB_LO_3","ESP_034_MZB_LO_3-24.08.2012","24.08.2012",2012,8,24,0.62,3
"ESP_034_MZB_LO_3","ESP_034_MZB_LO_3-30.08.2013","30.08.2013",2013,8,30,0.82,2
"ESP_034_MZB_LO_3","ESP_034_MZB_LO_3-26.08.2014","26.08.2014",2014,8,26,0.45,3
"ESP_034_MZB_LO_3","ESP_034_MZB_LO_3-04.09.2015","04.09.2015",2015,9,4,0.93,1
"ESP_034_MZB_LO_3","ESP_034_MZB_LO_3-02.08.2016","02.08.2016",2016,8,2,0.87,2
"ESP_034_MZB_LO_3","ESP_034_MZB_LO_3-16.08.2017","16.08.2017",2017,8,16,0.57,3
"ESP_034_MZB_LO_3","ESP_034_MZB_LO_3-10.09.2020","10.09.2020",2020,9,10,0.98,1
"ESP_034_MZB_LO_3","ESP_034_MZB_LO_3-26.08.2021","26.08.2021",2021,8,26,0.87,2
"ESP_034_MZB_LO_30","ESP_034_MZB_LO_30-26.08.1996","26.08.1996",1996,8,26,0.32,4
"ESP_034_MZB_LO_30","ESP_034_MZB_LO_30-28.08.1997","28.08.1997",1997,8,28,0.79,2
"ESP_034_MZB_LO_30","ESP_034_MZB_LO_30-04.09.1998","04.09.1998",1998,9,4,0.09,5
"ESP_034_MZB_LO_30","ESP_034_MZB_LO_30-04.10.1999","04.10.1999",1999,10,4,0.03,5
"ESP_034_MZB_LO_30","ESP_034_MZB_LO_30-21.08.2000","21.08.2000",2000,8,21,0.51,3
"ESP_034_MZB_LO_30","ESP_034_MZB_LO_30-03.10.2001","03.10.2001",2001,10,3,0.06,5
"ESP_034_MZB_LO_30","ESP_034_MZB_LO_30-20.09.2002","20.09.2002",2002,9,20,0.27,4
"ESP_034_MZB_LO_30","ESP_034_MZB_LO_30-20.08.2003","20.08.2003",2003,8,20,0.36,4
"ESP_034_MZB_LO_30","ESP_034_MZB_LO_30-30.08.2004","30.08.2004",2004,8,30,0.56,3
"ESP_034_MZB_LO_30","ESP_034_MZB_LO_30-31.08.2005","31.08.2005",2005,8,31,0.77,2
"ESP_034_MZB_LO_30","ESP_034_MZB_LO_30-21.08.2006","21.08.2006",2006,8,21,0.53,3
"ESP_034_MZB_LO_30","ESP_034_MZB_LO_30-29.08.2007","29.08.2007",2007,8,29,0.52,3
"ESP_034_MZB_LO_30","ESP_034_MZB_LO_30-11.09.2008","11.09.2008",2008,9,11,0.89,2
"ESP_034_MZB_LO_30","ESP_034_MZB_LO_30-27.08.2009","27.08.2009",2009,8,27,1.04,1
"ESP_034_MZB_LO_30","ESP_034_MZB_LO_30-30.08.2010","30.08.2010",2010,8,30,0.96,1
"ESP_034_MZB_LO_30","ESP_034_MZB_LO_30-24.08.2011","24.08.2011",2011,8,24,0.9,1
"ESP_034_MZB_LO_30","ESP_034_MZB_LO_30-24.08.2012","24.08.2012",2012,8,24,0.8,2
"ESP_034_MZB_LO_30","ESP_034_MZB_LO_30-30.08.2013","30.08.2013",2013,8,30,0.85,2
"ESP_034_MZB_LO_30","ESP_034_MZB_LO_30-01.09.2014","01.09.2014",2014,9,1,1.03,1
"ESP_034_MZB_LO_30","ESP_034_MZB_LO_30-25.08.2015","25.08.2015",2015,8,25,0.91,1
"ESP_034_MZB_LO_30","ESP_034_MZB_LO_30-08.08.2016","08.08.2016",2016,8,8,0.87,2
"ESP_034_MZB_LO_30","ESP_034_MZB_LO_30-16.08.2017","16.08.2017",2017,8,16,0.98,1
"ESP_034_MZB_LO_300","ESP_034_MZB_LO_300-06.09.1993","06.09.1993",1993,9,6,0.07,5
"ESP_034_MZB_LO_300","ESP_034_MZB_LO_300-06.09.1994","06.09.1994",1994,9,6,0.32,4
"ESP_034_MZB_LO_300","ESP_034_MZB_LO_300-06.09.1995","06.09.1995",1995,9,6,0.06,5
"ESP_034_MZB_LO_300","ESP_034_MZB_LO_300-03.09.1996","03.09.1996",1996,9,3,0.01,5
"ESP_034_MZB_LO_300","ESP_034_MZB_LO_300-15.09.1997","15.09.1997",1997,9,15,0.05,5
"ESP_034_MZB_LO_300","ESP_034_MZB_LO_300-10.09.1998","10.09.1998",1998,9,10,0.02,5
"ESP_034_MZB_LO_300","ESP_034_MZB_LO_300-21.09.1999","21.09.1999",1999,9,21,0.05,5
"ESP_034_MZB_LO_300","ESP_034_MZB_LO_300-19.09.2002","19.09.2002",2002,9,19,0.06,5
"ESP_034_MZB_LO_300","ESP_034_MZB_LO_300-22.09.2003","22.09.2003",2003,9,22,0.05,5
"ESP_034_MZB_LO_300","ESP_034_MZB_LO_300-04.10.2004","04.10.2004",2004,10,4,0.05,5
"ESP_034_MZB_LO_300","ESP_034_MZB_LO_300-27.09.2005","27.09.2005",2005,9,27,0.02,5
"ESP_034_MZB_LO_300","ESP_034_MZB_LO_300-03.10.2006","03.10.2006",2006,10,3,0.03,5
"ESP_034_MZB_LO_300","ESP_034_MZB_LO_300-26.09.2007","26.09.2007",2007,9,26,0.03,5
"ESP_034_MZB_LO_300","ESP_034_MZB_LO_300-08.10.2008","08.10.2008",2008,10,8,0.02,5
"ESP_034_MZB_LO_300","ESP_034_MZB_LO_300-22.09.2009","22.09.2009",2009,9,22,0.01,5
"ESP_034_MZB_LO_300","ESP_034_MZB_LO_300-06.10.2010","06.10.2010",2010,10,6,0.01,5
"ESP_034_MZB_LO_300","ESP_034_MZB_LO_300-28.09.2011","28.09.2011",2011,9,28,0.01,5
"ESP_034_MZB_LO_300","ESP_034_MZB_LO_300-26.09.2012","26.09.2012",2012,9,26,0.01,5
"ESP_034_MZB_LO_300","ESP_034_MZB_LO_300-08.10.2013","08.10.2013",2013,10,8,0.01,5
"ESP_034_MZB_LO_300","ESP_034_MZB_LO_300-30.09.2014","30.09.2014",2014,9,30,0.04,5
"ESP_034_MZB_LO_300","ESP_034_MZB_LO_300-22.09.2016","22.09.2016",2016,9,22,0.03,5
"ESP_034_MZB_LO_300","ESP_034_MZB_LO_300-14.09.2017","14.09.2017",2017,9,14,0.03,5
"ESP_034_MZB_LO_300","ESP_034_MZB_LO_300-03.09.2018","03.09.2018",2018,9,3,0.06,5
"ESP_034_MZB_LO_300","ESP_034_MZB_LO_300-11.09.2019","11.09.2019",2019,9,11,0.06,5
"ESP_034_MZB_LO_300","ESP_034_MZB_LO_300-01.09.2020","01.09.2020",2020,9,1,0.1,5
"ESP_034_MZB_LO_300","ESP_034_MZB_LO_300-06.09.2021","06.09.2021",2021,9,6,0.07,5
"ESP_034_MZB_LO_301","ESP_034_MZB_LO_301-13.09.2007","13.09.2007",2007,9,13,0.64,3
"ESP_034_MZB_LO_301","ESP_034_MZB_LO_301-11.09.2008","11.09.2008",2008,9,11,0.67,2
"ESP_034_MZB_LO_301","ESP_034_MZB_LO_301-15.09.2009","15.09.2009",2009,9,15,0.36,4
"ESP_034_MZB_LO_301","ESP_034_MZB_LO_301-06.09.2010","06.09.2010",2010,9,6,0.56,3
"ESP_034_MZB_LO_301","ESP_034_MZB_LO_301-01.09.2011","01.09.2011",2011,9,1,0.44,4
"ESP_034_MZB_LO_301","ESP_034_MZB_LO_301-05.09.2012","05.09.2012",2012,9,5,0.5,3
"ESP_034_MZB_LO_301","ESP_034_MZB_LO_301-03.09.2013","03.09.2013",2013,9,3,0.7,2
"ESP_034_MZB_LO_301","ESP_034_MZB_LO_301-09.09.2014","09.09.2014",2014,9,9,0.44,4
"ESP_034_MZB_LO_301","ESP_034_MZB_LO_301-10.09.2015","10.09.2015",2015,9,10,0.34,4
"ESP_034_MZB_LO_301","ESP_034_MZB_LO_301-13.09.2016","13.09.2016",2016,9,13,0.45,3
"ESP_034_MZB_LO_301","ESP_034_MZB_LO_301-07.09.2017","07.09.2017",2017,9,7,0.32,4
"ESP_034_MZB_LO_301","ESP_034_MZB_LO_301-19.09.2018","19.09.2018",2018,9,19,0.53,3
"ESP_034_MZB_LO_301","ESP_034_MZB_LO_301-02.09.2019","02.09.2019",2019,9,2,0.53,3
"ESP_034_MZB_LO_301","ESP_034_MZB_LO_301-16.09.2020","16.09.2020",2020,9,16,0.58,3
"ESP_034_MZB_LO_301","ESP_034_MZB_LO_301-21.09.2021","21.09.2021",2021,9,21,0.5,3
"ESP_034_MZB_LO_302","ESP_034_MZB_LO_302-20.09.1993","20.09.1993",1993,9,20,1.04,1
"ESP_034_MZB_LO_302","ESP_034_MZB_LO_302-20.09.1994","20.09.1994",1994,9,20,0.9,1
"ESP_034_MZB_LO_302","ESP_034_MZB_LO_302-20.09.1995","20.09.1995",1995,9,20,0.8,2
"ESP_034_MZB_LO_302","ESP_034_MZB_LO_302-24.09.1996","24.09.1996",1996,9,24,0.89,2
"ESP_034_MZB_LO_302","ESP_034_MZB_LO_302-09.09.1997","09.09.1997",1997,9,9,0.97,1
"ESP_034_MZB_LO_302","ESP_034_MZB_LO_302-03.09.1998","03.09.1998",1998,9,3,0.64,3
"ESP_034_MZB_LO_302","ESP_034_MZB_LO_302-28.09.1999","28.09.1999",1999,9,28,0.7,2
"ESP_034_MZB_LO_302","ESP_034_MZB_LO_302-06.09.2002","06.09.2002",2002,9,6,1.03,1
"ESP_034_MZB_LO_302","ESP_034_MZB_LO_302-04.09.2003","04.09.2003",2003,9,4,0.91,1
"ESP_034_MZB_LO_302","ESP_034_MZB_LO_302-22.09.2004","22.09.2004",2004,9,22,0.99,1
"ESP_034_MZB_LO_302","ESP_034_MZB_LO_302-10.10.2005","10.10.2005",2005,10,10,0.92,1
"ESP_034_MZB_LO_302","ESP_034_MZB_LO_302-20.09.2006","20.09.2006",2006,9,20,0.89,2
"ESP_034_MZB_LO_302","ESP_034_MZB_LO_302-16.09.2013","16.09.2013",2013,9,16,0.92,1
"ESP_034_MZB_LO_302","ESP_034_MZB_LO_302-05.09.2017","05.09.2017",2017,9,5,0.82,2
"ESP_034_MZB_LO_302","ESP_034_MZB_LO_302-18.09.2018","18.09.2018",2018,9,18,1.01,1
"ESP_034_MZB_LO_302","ESP_034_MZB_LO_302-14.09.2020","14.09.2020",2020,9,14,0.71,2
"ESP_034_MZB_LO_302","ESP_034_MZB_LO_302-30.09.2021","30.09.2021",2021,9,30,0.83,2
"ESP_034_MZB_LO_303","ESP_034_MZB_LO_303-17.09.2007","17.09.2007",2007,9,17,0.78,2
"ESP_034_MZB_LO_303","ESP_034_MZB_LO_303-15.09.2008","15.09.2008",2008,9,15,1.08,1
"ESP_034_MZB_LO_303","ESP_034_MZB_LO_303-09.09.2009","09.09.2009",2009,9,9,0.89,2
"ESP_034_MZB_LO_303","ESP_034_MZB_LO_303-09.09.2010","09.09.2010",2010,9,9,0.97,1
"ESP_034_MZB_LO_303","ESP_034_MZB_LO_303-06.09.2011","06.09.2011",2011,9,6,1.12,1
"ESP_034_MZB_LO_303","ESP_034_MZB_LO_303-04.09.2012","04.09.2012",2012,9,4,1.06,1
"ESP_034_MZB_LO_303","ESP_034_MZB_LO_303-10.09.2013","10.09.2013",2013,9,10,1.18,1
"ESP_034_MZB_LO_303","ESP_034_MZB_LO_303-04.09.2014","04.09.2014",2014,9,4,1.23,1
"ESP_034_MZB_LO_303","ESP_034_MZB_LO_303-01.09.2015","01.09.2015",2015,9,1,1.08,1
"ESP_034_MZB_LO_303","ESP_034_MZB_LO_303-14.09.2016","14.09.2016",2016,9,14,0.96,1
"ESP_034_MZB_LO_303","ESP_034_MZB_LO_303-05.09.2017","05.09.2017",2017,9,5,1.06,1
"ESP_034_MZB_LO_303","ESP_034_MZB_LO_303-17.09.2018","17.09.2018",2018,9,17,1.07,1
"ESP_034_MZB_LO_303","ESP_034_MZB_LO_303-23.09.2019","23.09.2019",2019,9,23,1.17,1
"ESP_034_MZB_LO_303","ESP_034_MZB_LO_303-21.09.2020","21.09.2020",2020,9,21,1.29,1
"ESP_034_MZB_LO_303","ESP_034_MZB_LO_303-23.09.2021","23.09.2021",2021,9,23,1.18,1
"ESP_034_MZB_LO_304","ESP_034_MZB_LO_304-27.09.1999","27.09.1999",1999,9,27,0.39,4
"ESP_034_MZB_LO_304","ESP_034_MZB_LO_304-11.09.2002","11.09.2002",2002,9,11,0.87,2
"ESP_034_MZB_LO_304","ESP_034_MZB_LO_304-02.10.2003","02.10.2003",2003,10,2,0.91,1
"ESP_034_MZB_LO_304","ESP_034_MZB_LO_304-27.09.2004","27.09.2004",2004,9,27,0.9,1
"ESP_034_MZB_LO_304","ESP_034_MZB_LO_304-14.09.2005","14.09.2005",2005,9,14,1.09,1
"ESP_034_MZB_LO_304","ESP_034_MZB_LO_304-19.09.2006","19.09.2006",2006,9,19,0.9,1
"ESP_034_MZB_LO_304","ESP_034_MZB_LO_304-21.09.2007","21.09.2007",2007,9,21,0.99,1
"ESP_034_MZB_LO_304","ESP_034_MZB_LO_304-16.09.2008","16.09.2008",2008,9,16,0.91,1
"ESP_034_MZB_LO_304","ESP_034_MZB_LO_304-30.09.2009","30.09.2009",2009,9,30,0.93,1
"ESP_034_MZB_LO_304","ESP_034_MZB_LO_304-14.09.2010","14.09.2010",2010,9,14,1.19,1
"ESP_034_MZB_LO_304","ESP_034_MZB_LO_304-08.09.2011","08.09.2011",2011,9,8,0.93,1
"ESP_034_MZB_LO_304","ESP_034_MZB_LO_304-10.09.2012","10.09.2012",2012,9,10,0.8,2
"ESP_034_MZB_LO_304","ESP_034_MZB_LO_304-05.09.2013","05.09.2013",2013,9,5,1.15,1
"ESP_034_MZB_LO_304","ESP_034_MZB_LO_304-16.09.2014","16.09.2014",2014,9,16,0.97,1
"ESP_034_MZB_LO_304","ESP_034_MZB_LO_304-02.09.2015","02.09.2015",2015,9,2,0.94,1
"ESP_034_MZB_LO_304","ESP_034_MZB_LO_304-12.09.2016","12.09.2016",2016,9,12,0.62,3
"ESP_034_MZB_LO_304","ESP_034_MZB_LO_304-04.09.2017","04.09.2017",2017,9,4,1.08,1
"ESP_034_MZB_LO_304","ESP_034_MZB_LO_304-18.09.2018","18.09.2018",2018,9,18,1,1
"ESP_034_MZB_LO_304","ESP_034_MZB_LO_304-09.09.2019","09.09.2019",2019,9,9,0.9,1
"ESP_034_MZB_LO_304","ESP_034_MZB_LO_304-15.09.2020","15.09.2020",2020,9,15,1.21,1
"ESP_034_MZB_LO_304","ESP_034_MZB_LO_304-28.09.2021","28.09.2021",2021,9,28,0.96,1
"ESP_034_MZB_LO_306","ESP_034_MZB_LO_306-21.09.1993","21.09.1993",1993,9,21,0.1,5
"ESP_034_MZB_LO_306","ESP_034_MZB_LO_306-26.09.1994","26.09.1994",1994,9,26,0.3,4
"ESP_034_MZB_LO_306","ESP_034_MZB_LO_306-20.09.1995","20.09.1995",1995,9,20,0.37,4
"ESP_034_MZB_LO_306","ESP_034_MZB_LO_306-24.09.1996","24.09.1996",1996,9,24,0.19,5
"ESP_034_MZB_LO_306","ESP_034_MZB_LO_306-12.09.1997","12.09.1997",1997,9,12,0.24,4
"ESP_034_MZB_LO_306","ESP_034_MZB_LO_306-07.09.1998","07.09.1998",1998,9,7,0.19,5
"ESP_034_MZB_LO_306","ESP_034_MZB_LO_306-30.09.1999","30.09.1999",1999,9,30,0.33,4
"ESP_034_MZB_LO_306","ESP_034_MZB_LO_306-05.10.2000","05.10.2000",2000,10,5,0.04,5
"ESP_034_MZB_LO_306","ESP_034_MZB_LO_306-14.09.2001","14.09.2001",2001,9,14,0.3,4
"ESP_034_MZB_LO_306","ESP_034_MZB_LO_306-12.09.2002","12.09.2002",2002,9,12,0.1,5
"ESP_034_MZB_LO_306","ESP_034_MZB_LO_306-16.09.2003","16.09.2003",2003,9,16,0.19,5
"ESP_034_MZB_LO_306","ESP_034_MZB_LO_306-16.09.2004","16.09.2004",2004,9,16,0.2,5
"ESP_034_MZB_LO_306","ESP_034_MZB_LO_306-15.09.2005","15.09.2005",2005,9,15,0.49,3
"ESP_034_MZB_LO_306","ESP_034_MZB_LO_306-14.09.2006","14.09.2006",2006,9,14,0.31,4
"ESP_034_MZB_LO_306","ESP_034_MZB_LO_306-10.09.2007","10.09.2007",2007,9,10,0.05,5
"ESP_034_MZB_LO_306","ESP_034_MZB_LO_306-08.09.2008","08.09.2008",2008,9,8,0.14,5
"ESP_034_MZB_LO_306","ESP_034_MZB_LO_306-08.09.2009","08.09.2009",2009,9,8,0.16,5
"ESP_034_MZB_LO_306","ESP_034_MZB_LO_306-01.09.2010","01.09.2010",2010,9,1,0.06,5
"ESP_034_MZB_LO_306","ESP_034_MZB_LO_306-07.09.2011","07.09.2011",2011,9,7,0.18,5
"ESP_034_MZB_LO_306","ESP_034_MZB_LO_306-04.09.2012","04.09.2012",2012,9,4,0.12,5
"ESP_034_MZB_LO_306","ESP_034_MZB_LO_306-02.09.2013","02.09.2013",2013,9,2,0.34,4
"ESP_034_MZB_LO_306","ESP_034_MZB_LO_306-04.09.2014","04.09.2014",2014,9,4,0.35,4
"ESP_034_MZB_LO_306","ESP_034_MZB_LO_306-08.09.2015","08.09.2015",2015,9,8,0.2,5
"ESP_034_MZB_LO_306","ESP_034_MZB_LO_306-13.09.2016","13.09.2016",2016,9,13,0.35,4
"ESP_034_MZB_LO_306","ESP_034_MZB_LO_306-08.09.2017","08.09.2017",2017,9,8,0.22,4
"ESP_034_MZB_LO_306","ESP_034_MZB_LO_306-20.09.2018","20.09.2018",2018,9,20,0.34,4
"ESP_034_MZB_LO_306","ESP_034_MZB_LO_306-06.09.2019","06.09.2019",2019,9,6,0.24,4
"ESP_034_MZB_LO_306","ESP_034_MZB_LO_306-15.09.2020","15.09.2020",2020,9,15,0.43,4
"ESP_034_MZB_LO_306","ESP_034_MZB_LO_306-22.09.2021","22.09.2021",2021,9,22,0.38,4
"ESP_034_MZB_LO_307","ESP_034_MZB_LO_307-29.09.2003","29.09.2003",2003,9,29,1.06,1
"ESP_034_MZB_LO_307","ESP_034_MZB_LO_307-06.10.2004","06.10.2004",2004,10,6,0.74,2
"ESP_034_MZB_LO_307","ESP_034_MZB_LO_307-06.10.2005","06.10.2005",2005,10,6,0.78,2
"ESP_034_MZB_LO_307","ESP_034_MZB_LO_307-10.10.2006","10.10.2006",2006,10,10,0.72,2
"ESP_034_MZB_LO_307","ESP_034_MZB_LO_307-24.09.2007","24.09.2007",2007,9,24,0.81,2
"ESP_034_MZB_LO_307","ESP_034_MZB_LO_307-02.10.2008","02.10.2008",2008,10,2,0.81,2
"ESP_034_MZB_LO_307","ESP_034_MZB_LO_307-21.09.2009","21.09.2009",2009,9,21,0.69,2
"ESP_034_MZB_LO_307","ESP_034_MZB_LO_307-30.09.2010","30.09.2010",2010,9,30,0.72,2
"ESP_034_MZB_LO_307","ESP_034_MZB_LO_307-22.09.2011","22.09.2011",2011,9,22,0.67,3
"ESP_034_MZB_LO_307","ESP_034_MZB_LO_307-25.09.2012","25.09.2012",2012,9,25,0.69,2
"ESP_034_MZB_LO_307","ESP_034_MZB_LO_307-03.10.2013","03.10.2013",2013,10,3,0.85,2
"ESP_034_MZB_LO_307","ESP_034_MZB_LO_307-02.10.2014","02.10.2014",2014,10,2,0.85,2
"ESP_034_MZB_LO_307","ESP_034_MZB_LO_307-30.09.2015","30.09.2015",2015,9,30,0.83,2
"ESP_034_MZB_LO_307","ESP_034_MZB_LO_307-19.09.2016","19.09.2016",2016,9,19,0.98,1
"ESP_034_MZB_LO_307","ESP_034_MZB_LO_307-12.09.2017","12.09.2017",2017,9,12,0.72,2
"ESP_034_MZB_LO_307","ESP_034_MZB_LO_307-05.09.2018","05.09.2018",2018,9,5,0.74,2
"ESP_034_MZB_LO_307","ESP_034_MZB_LO_307-24.09.2019","24.09.2019",2019,9,24,0.73,2
"ESP_034_MZB_LO_307","ESP_034_MZB_LO_307-31.08.2020","31.08.2020",2020,8,31,0.72,2
"ESP_034_MZB_LO_307","ESP_034_MZB_LO_307-07.09.2021","07.09.2021",2021,9,7,0.87,2
"ESP_034_MZB_LO_308","ESP_034_MZB_LO_308-11.10.2000","11.10.2000",2000,10,11,0.19,5
"ESP_034_MZB_LO_308","ESP_034_MZB_LO_308-12.09.2001","12.09.2001",2001,9,12,0.43,4
"ESP_034_MZB_LO_308","ESP_034_MZB_LO_308-17.09.2002","17.09.2002",2002,9,17,0.69,2
"ESP_034_MZB_LO_308","ESP_034_MZB_LO_308-29.09.2003","29.09.2003",2003,9,29,0.55,3
"ESP_034_MZB_LO_308","ESP_034_MZB_LO_308-06.10.2004","06.10.2004",2004,10,6,0.62,3
"ESP_034_MZB_LO_308","ESP_034_MZB_LO_308-06.10.2005","06.10.2005",2005,10,6,0.75,2
"ESP_034_MZB_LO_308","ESP_034_MZB_LO_308-10.10.2006","10.10.2006",2006,10,10,0.78,2
"ESP_034_MZB_LO_308","ESP_034_MZB_LO_308-24.09.2007","24.09.2007",2007,9,24,0.62,3
"ESP_034_MZB_LO_308","ESP_034_MZB_LO_308-02.10.2008","02.10.2008",2008,10,2,0.76,2
"ESP_034_MZB_LO_308","ESP_034_MZB_LO_308-21.09.2009","21.09.2009",2009,9,21,0.51,3
"ESP_034_MZB_LO_308","ESP_034_MZB_LO_308-30.09.2010","30.09.2010",2010,9,30,0.84,2
"ESP_034_MZB_LO_308","ESP_034_MZB_LO_308-22.09.2011","22.09.2011",2011,9,22,0.5,3
"ESP_034_MZB_LO_308","ESP_034_MZB_LO_308-25.09.2012","25.09.2012",2012,9,25,0.65,3
"ESP_034_MZB_LO_308","ESP_034_MZB_LO_308-03.10.2013","03.10.2013",2013,10,3,0.79,2
"ESP_034_MZB_LO_308","ESP_034_MZB_LO_308-02.10.2014","02.10.2014",2014,10,2,0.79,2
"ESP_034_MZB_LO_308","ESP_034_MZB_LO_308-30.09.2015","30.09.2015",2015,9,30,0.59,3
"ESP_034_MZB_LO_308","ESP_034_MZB_LO_308-19.09.2016","19.09.2016",2016,9,19,0.64,3
"ESP_034_MZB_LO_308","ESP_034_MZB_LO_308-13.09.2017","13.09.2017",2017,9,13,0.68,2
"ESP_034_MZB_LO_308","ESP_034_MZB_LO_308-05.09.2018","05.09.2018",2018,9,5,0.58,3
"ESP_034_MZB_LO_308","ESP_034_MZB_LO_308-24.09.2019","24.09.2019",2019,9,24,0.71,2
"ESP_034_MZB_LO_308","ESP_034_MZB_LO_308-31.08.2020","31.08.2020",2020,8,31,0.7,2
"ESP_034_MZB_LO_308","ESP_034_MZB_LO_308-07.09.2021","07.09.2021",2021,9,7,0.7,2
"ESP_034_MZB_LO_309","ESP_034_MZB_LO_309-21.09.1993","21.09.1993",1993,9,21,0.52,3
"ESP_034_MZB_LO_309","ESP_034_MZB_LO_309-26.09.1994","26.09.1994",1994,9,26,0.68,2
"ESP_034_MZB_LO_309","ESP_034_MZB_LO_309-21.09.1995","21.09.1995",1995,9,21,0.82,2
"ESP_034_MZB_LO_309","ESP_034_MZB_LO_309-25.09.1996","25.09.1996",1996,9,25,0.68,2
"ESP_034_MZB_LO_309","ESP_034_MZB_LO_309-04.09.1997","04.09.1997",1997,9,4,0.75,2
"ESP_034_MZB_LO_309","ESP_034_MZB_LO_309-08.09.1998","08.09.1998",1998,9,8,0.73,2
"ESP_034_MZB_LO_309","ESP_034_MZB_LO_309-20.09.1999","20.09.1999",1999,9,20,0.52,3
"ESP_034_MZB_LO_309","ESP_034_MZB_LO_309-02.10.2000","02.10.2000",2000,10,2,0.42,4
"ESP_034_MZB_LO_309","ESP_034_MZB_LO_309-13.09.2001","13.09.2001",2001,9,13,0.57,3
"ESP_034_MZB_LO_309","ESP_034_MZB_LO_309-09.09.2002","09.09.2002",2002,9,9,1.06,1
"ESP_034_MZB_LO_309","ESP_034_MZB_LO_309-06.10.2003","06.10.2003",2003,10,6,1.03,1
"ESP_034_MZB_LO_309","ESP_034_MZB_LO_309-23.09.2004","23.09.2004",2004,9,23,0.87,2
"ESP_034_MZB_LO_309","ESP_034_MZB_LO_309-21.09.2005","21.09.2005",2005,9,21,1,1
"ESP_034_MZB_LO_309","ESP_034_MZB_LO_309-13.09.2006","13.09.2006",2006,9,13,0.95,1
"ESP_034_MZB_LO_309","ESP_034_MZB_LO_309-17.09.2007","17.09.2007",2007,9,17,0.75,2
"ESP_034_MZB_LO_309","ESP_034_MZB_LO_309-15.09.2008","15.09.2008",2008,9,15,0.95,1
"ESP_034_MZB_LO_309","ESP_034_MZB_LO_309-09.09.2009","09.09.2009",2009,9,9,0.7,2
"ESP_034_MZB_LO_309","ESP_034_MZB_LO_309-09.09.2010","09.09.2010",2010,9,9,1.03,1
"ESP_034_MZB_LO_309","ESP_034_MZB_LO_309-06.09.2011","06.09.2011",2011,9,6,0.9,1
"ESP_034_MZB_LO_309","ESP_034_MZB_LO_309-04.09.2012","04.09.2012",2012,9,4,0.94,1
"ESP_034_MZB_LO_309","ESP_034_MZB_LO_309-10.09.2013","10.09.2013",2013,9,10,0.84,2
"ESP_034_MZB_LO_309","ESP_034_MZB_LO_309-04.09.2014","04.09.2014",2014,9,4,0.82,2
"ESP_034_MZB_LO_309","ESP_034_MZB_LO_309-01.09.2015","01.09.2015",2015,9,1,0.87,2
"ESP_034_MZB_LO_309","ESP_034_MZB_LO_309-14.09.2016","14.09.2016",2016,9,14,1.02,1
"ESP_034_MZB_LO_309","ESP_034_MZB_LO_309-05.09.2017","05.09.2017",2017,9,5,1,1
"ESP_034_MZB_LO_309","ESP_034_MZB_LO_309-17.09.2018","17.09.2018",2018,9,17,0.81,2
"ESP_034_MZB_LO_309","ESP_034_MZB_LO_309-23.09.2019","23.09.2019",2019,9,23,0.97,1
"ESP_034_MZB_LO_309","ESP_034_MZB_LO_309-21.09.2020","21.09.2020",2020,9,21,0.98,1
"ESP_034_MZB_LO_309","ESP_034_MZB_LO_309-23.09.2021","23.09.2021",2021,9,23,0.89,2
"ESP_034_MZB_LO_31","ESP_034_MZB_LO_31-25.10.1996","25.10.1996",1996,10,25,0.81,2
"ESP_034_MZB_LO_31","ESP_034_MZB_LO_31-16.09.1997","16.09.1997",1997,9,16,0.52,3
"ESP_034_MZB_LO_31","ESP_034_MZB_LO_31-31.08.1998","31.08.1998",1998,8,31,0.76,2
"ESP_034_MZB_LO_31","ESP_034_MZB_LO_31-28.09.1999","28.09.1999",1999,9,28,0.52,3
"ESP_034_MZB_LO_31","ESP_034_MZB_LO_31-28.08.2000","28.08.2000",2000,8,28,0.75,2
"ESP_034_MZB_LO_31","ESP_034_MZB_LO_31-28.09.2001","28.09.2001",2001,9,28,0.72,2
"ESP_034_MZB_LO_31","ESP_034_MZB_LO_31-24.09.2002","24.09.2002",2002,9,24,0.64,3
"ESP_034_MZB_LO_31","ESP_034_MZB_LO_31-20.08.2003","20.08.2003",2003,8,20,0.56,3
"ESP_034_MZB_LO_31","ESP_034_MZB_LO_31-24.08.2004","24.08.2004",2004,8,24,0.88,1
"ESP_034_MZB_LO_31","ESP_034_MZB_LO_31-01.09.2005","01.09.2005",2005,9,1,1.04,1
"ESP_034_MZB_LO_31","ESP_034_MZB_LO_31-28.08.2006","28.08.2006",2006,8,28,1.06,1
"ESP_034_MZB_LO_31","ESP_034_MZB_LO_31-31.08.2007","31.08.2007",2007,8,31,0.46,3
"ESP_034_MZB_LO_31","ESP_034_MZB_LO_31-04.09.2008","04.09.2008",2008,9,4,0.86,1
"ESP_034_MZB_LO_31","ESP_034_MZB_LO_31-24.08.2009","24.08.2009",2009,8,24,0.92,1
"ESP_034_MZB_LO_31","ESP_034_MZB_LO_31-01.09.2010","01.09.2010",2010,9,1,0.9,1
"ESP_034_MZB_LO_31","ESP_034_MZB_LO_31-23.08.2011","23.08.2011",2011,8,23,0.88,1
"ESP_034_MZB_LO_31","ESP_034_MZB_LO_31-17.08.2012","17.08.2012",2012,8,17,0.95,1
"ESP_034_MZB_LO_31","ESP_034_MZB_LO_31-30.08.2013","30.08.2013",2013,8,30,1.03,1
"ESP_034_MZB_LO_31","ESP_034_MZB_LO_31-02.09.2014","02.09.2014",2014,9,2,1.07,1
"ESP_034_MZB_LO_31","ESP_034_MZB_LO_31-24.08.2015","24.08.2015",2015,8,24,0.99,1
"ESP_034_MZB_LO_31","ESP_034_MZB_LO_31-01.08.2016","01.08.2016",2016,8,1,0.88,1
"ESP_034_MZB_LO_31","ESP_034_MZB_LO_31-27.09.2017","27.09.2017",2017,9,27,0.79,2
"ESP_034_MZB_LO_31","ESP_034_MZB_LO_31-07.09.2020","07.09.2020",2020,9,7,0.7,2
"ESP_034_MZB_LO_31","ESP_034_MZB_LO_31-24.08.2021","24.08.2021",2021,8,24,1.09,1
"ESP_034_MZB_LO_310","ESP_034_MZB_LO_310-12.09.2012","12.09.2012",2012,9,12,0.82,2
"ESP_034_MZB_LO_310","ESP_034_MZB_LO_310-11.09.2013","11.09.2013",2013,9,11,1.06,1
"ESP_034_MZB_LO_310","ESP_034_MZB_LO_310-08.09.2014","08.09.2014",2014,9,8,0.75,2
"ESP_034_MZB_LO_310","ESP_034_MZB_LO_310-11.09.2015","11.09.2015",2015,9,11,0.87,2
"ESP_034_MZB_LO_310","ESP_034_MZB_LO_310-15.09.2016","15.09.2016",2016,9,15,0.91,1
"ESP_034_MZB_LO_310","ESP_034_MZB_LO_310-07.09.2017","07.09.2017",2017,9,7,0.52,3
"ESP_034_MZB_LO_310","ESP_034_MZB_LO_310-20.09.2018","20.09.2018",2018,9,20,0.89,2
"ESP_034_MZB_LO_310","ESP_034_MZB_LO_310-12.09.2019","12.09.2019",2019,9,12,0.66,3
"ESP_034_MZB_LO_310","ESP_034_MZB_LO_310-17.09.2020","17.09.2020",2020,9,17,0.47,3
"ESP_034_MZB_LO_310","ESP_034_MZB_LO_310-27.09.2021","27.09.2021",2021,9,27,1,1
"ESP_034_MZB_LO_311","ESP_034_MZB_LO_311-15.09.2004","15.09.2004",2004,9,15,0.65,2
"ESP_034_MZB_LO_311","ESP_034_MZB_LO_311-07.09.2005","07.09.2005",2005,9,7,0.86,1
"ESP_034_MZB_LO_311","ESP_034_MZB_LO_311-27.09.2006","27.09.2006",2006,9,27,0.79,2
"ESP_034_MZB_LO_311","ESP_034_MZB_LO_311-09.10.2007","09.10.2007",2007,10,9,0.52,3
"ESP_034_MZB_LO_311","ESP_034_MZB_LO_311-24.09.2008","24.09.2008",2008,9,24,0.8,2
"ESP_034_MZB_LO_311","ESP_034_MZB_LO_311-14.10.2009","14.10.2009",2009,10,14,0.66,2
"ESP_034_MZB_LO_311","ESP_034_MZB_LO_311-28.09.2010","28.09.2010",2010,9,28,0.58,3
"ESP_034_MZB_LO_311","ESP_034_MZB_LO_311-20.09.2011","20.09.2011",2011,9,20,0.71,2
"ESP_034_MZB_LO_311","ESP_034_MZB_LO_311-20.09.2012","20.09.2012",2012,9,20,0.84,2
"ESP_034_MZB_LO_311","ESP_034_MZB_LO_311-25.09.2013","25.09.2013",2013,9,25,0.74,2
"ESP_034_MZB_LO_311","ESP_034_MZB_LO_311-18.09.2014","18.09.2014",2014,9,18,0.78,2
"ESP_034_MZB_LO_311","ESP_034_MZB_LO_311-25.09.2015","25.09.2015",2015,9,25,0.87,1
"ESP_034_MZB_LO_311","ESP_034_MZB_LO_311-05.10.2016","05.10.2016",2016,10,5,0.77,2
"ESP_034_MZB_LO_311","ESP_034_MZB_LO_311-10.09.2017","10.09.2017",2017,9,10,0.51,3
"ESP_034_MZB_LO_311","ESP_034_MZB_LO_311-10.09.2018","10.09.2018",2018,9,10,0.76,2
"ESP_034_MZB_LO_311","ESP_034_MZB_LO_311-18.09.2019","18.09.2019",2019,9,18,0.93,1
"ESP_034_MZB_LO_311","ESP_034_MZB_LO_311-08.09.2020","08.09.2020",2020,9,8,0.66,2
"ESP_034_MZB_LO_311","ESP_034_MZB_LO_311-27.09.2021","27.09.2021",2021,9,27,0.75,2
"ESP_034_MZB_LO_312","ESP_034_MZB_LO_312-13.09.1993","13.09.1993",1993,9,13,0.33,4
"ESP_034_MZB_LO_312","ESP_034_MZB_LO_312-13.09.1994","13.09.1994",1994,9,13,0.28,4
"ESP_034_MZB_LO_312","ESP_034_MZB_LO_312-14.09.1995","14.09.1995",1995,9,14,0.13,5
"ESP_034_MZB_LO_312","ESP_034_MZB_LO_312-16.09.1996","16.09.1996",1996,9,16,0.61,3
"ESP_034_MZB_LO_312","ESP_034_MZB_LO_312-11.09.1997","11.09.1997",1997,9,11,0.24,4
"ESP_034_MZB_LO_312","ESP_034_MZB_LO_312-02.09.1998","02.09.1998",1998,9,2,0.11,5
"ESP_034_MZB_LO_312","ESP_034_MZB_LO_312-04.10.1999","04.10.1999",1999,10,4,0.24,4
"ESP_034_MZB_LO_312","ESP_034_MZB_LO_312-06.10.2000","06.10.2000",2000,10,6,0.14,5
"ESP_034_MZB_LO_312","ESP_034_MZB_LO_312-18.09.2001","18.09.2001",2001,9,18,0.23,4
"ESP_034_MZB_LO_312","ESP_034_MZB_LO_312-02.09.2002","02.09.2002",2002,9,2,0.48,3
"ESP_034_MZB_LO_312","ESP_034_MZB_LO_312-03.09.2003","03.09.2003",2003,9,3,0.15,5
"ESP_034_MZB_LO_312","ESP_034_MZB_LO_312-15.09.2004","15.09.2004",2004,9,15,0.22,5
"ESP_034_MZB_LO_312","ESP_034_MZB_LO_312-08.09.2005","08.09.2005",2005,9,8,0.05,5
"ESP_034_MZB_LO_312","ESP_034_MZB_LO_312-28.09.2006","28.09.2006",2006,9,28,0.09,5
"ESP_034_MZB_LO_312","ESP_034_MZB_LO_312-10.10.2007","10.10.2007",2007,10,10,0.1,5
"ESP_034_MZB_LO_312","ESP_034_MZB_LO_312-30.09.2008","30.09.2008",2008,9,30,0.16,5
"ESP_034_MZB_LO_312","ESP_034_MZB_LO_312-13.10.2009","13.10.2009",2009,10,13,0.23,4
"ESP_034_MZB_LO_312","ESP_034_MZB_LO_312-16.09.2010","16.09.2010",2010,9,16,0.18,5
"ESP_034_MZB_LO_312","ESP_034_MZB_LO_312-19.09.2011","19.09.2011",2011,9,19,0.32,4
"ESP_034_MZB_LO_312","ESP_034_MZB_LO_312-21.09.2012","21.09.2012",2012,9,21,0.43,4
"ESP_034_MZB_LO_312","ESP_034_MZB_LO_312-30.09.2013","30.09.2013",2013,9,30,0.68,2
"ESP_034_MZB_LO_312","ESP_034_MZB_LO_312-03.10.2014","03.10.2014",2014,10,3,0.59,3
"ESP_034_MZB_LO_312","ESP_034_MZB_LO_312-28.09.2015","28.09.2015",2015,9,28,0.76,2
"ESP_034_MZB_LO_312","ESP_034_MZB_LO_312-04.10.2016","04.10.2016",2016,10,4,0.77,2
"ESP_034_MZB_LO_312","ESP_034_MZB_LO_312-21.09.2017","21.09.2017",2017,9,21,0.5,3
"ESP_034_MZB_LO_312","ESP_034_MZB_LO_312-11.09.2018","11.09.2018",2018,9,11,0.73,2
"ESP_034_MZB_LO_312","ESP_034_MZB_LO_312-19.09.2019","19.09.2019",2019,9,19,0.66,3
"ESP_034_MZB_LO_312","ESP_034_MZB_LO_312-07.09.2020","07.09.2020",2020,9,7,0.27,4
"ESP_034_MZB_LO_312","ESP_034_MZB_LO_312-27.09.2021","27.09.2021",2021,9,27,0.32,4
"ESP_034_MZB_LO_314","ESP_034_MZB_LO_314-08.10.2009","08.10.2009",2009,10,8,0.94,1
"ESP_034_MZB_LO_314","ESP_034_MZB_LO_314-14.09.2012","14.09.2012",2012,9,14,0.81,2
"ESP_034_MZB_LO_314","ESP_034_MZB_LO_314-19.09.2013","19.09.2013",2013,9,19,0.78,2
"ESP_034_MZB_LO_314","ESP_034_MZB_LO_314-23.09.2014","23.09.2014",2014,9,23,0.84,2
"ESP_034_MZB_LO_314","ESP_034_MZB_LO_314-16.09.2015","16.09.2015",2015,9,16,0.9,1
"ESP_034_MZB_LO_314","ESP_034_MZB_LO_314-28.09.2016","28.09.2016",2016,9,28,0.87,1
"ESP_034_MZB_LO_314","ESP_034_MZB_LO_314-06.09.2018","06.09.2018",2018,9,6,0.83,2
"ESP_034_MZB_LO_314","ESP_034_MZB_LO_314-17.09.2019","17.09.2019",2019,9,17,0.7,2
"ESP_034_MZB_LO_314","ESP_034_MZB_LO_314-07.09.2020","07.09.2020",2020,9,7,0.76,2
"ESP_034_MZB_LO_314","ESP_034_MZB_LO_314-13.09.2021","13.09.2021",2021,9,13,0.63,3
"ESP_034_MZB_LO_316","ESP_034_MZB_LO_316-26.09.1996","26.09.1996",1996,9,26,0.66,3
"ESP_034_MZB_LO_316","ESP_034_MZB_LO_316-05.09.1997","05.09.1997",1997,9,5,0.74,2
"ESP_034_MZB_LO_316","ESP_034_MZB_LO_316-09.09.1998","09.09.1998",1998,9,9,0.29,4
"ESP_034_MZB_LO_316","ESP_034_MZB_LO_316-23.09.1999","23.09.1999",1999,9,23,0.49,3
"ESP_034_MZB_LO_316","ESP_034_MZB_LO_316-05.10.2000","05.10.2000",2000,10,5,0.38,4
"ESP_034_MZB_LO_316","ESP_034_MZB_LO_316-14.09.2001","14.09.2001",2001,9,14,0.7,2
"ESP_034_MZB_LO_316","ESP_034_MZB_LO_316-09.09.2002","09.09.2002",2002,9,9,0.84,2
"ESP_034_MZB_LO_316","ESP_034_MZB_LO_316-16.09.2003","16.09.2003",2003,9,16,0.7,2
"ESP_034_MZB_LO_316","ESP_034_MZB_LO_316-29.09.2004","29.09.2004",2004,9,29,0.5,3
"ESP_034_MZB_LO_316","ESP_034_MZB_LO_316-26.09.2005","26.09.2005",2005,9,26,0.83,2
"ESP_034_MZB_LO_316","ESP_034_MZB_LO_316-12.09.2006","12.09.2006",2006,9,12,0.81,2
"ESP_034_MZB_LO_316","ESP_034_MZB_LO_316-11.09.2007","11.09.2007",2007,9,11,0.7,2
"ESP_034_MZB_LO_316","ESP_034_MZB_LO_316-13.10.2008","13.10.2008",2008,10,13,0.66,3
"ESP_034_MZB_LO_316","ESP_034_MZB_LO_316-17.09.2009","17.09.2009",2009,9,17,0.83,2
"ESP_034_MZB_LO_316","ESP_034_MZB_LO_316-13.09.2010","13.09.2010",2010,9,13,0.75,2
"ESP_034_MZB_LO_316","ESP_034_MZB_LO_316-05.09.2011","05.09.2011",2011,9,5,0.91,1
"ESP_034_MZB_LO_316","ESP_034_MZB_LO_316-12.09.2012","12.09.2012",2012,9,12,0.93,1
