"Unique.ID","Samp.ID","Sampling.date","year","month","day","eqr","eqc"
"FIN_004_MZB_LO_1","FIN_004_MZB_LO_1-24.09.2009","24.09.2009",2009,9,24,0.993890459,1
"FIN_004_MZB_LO_1","FIN_004_MZB_LO_1-31.10.2010","31.10.2010",2010,10,31,0.847490453,1
"FIN_004_MZB_LO_1","FIN_004_MZB_LO_1-23.11.2011","23.11.2011",2011,11,23,0.568529059,3
"FIN_004_MZB_LO_1","FIN_004_MZB_LO_1-04.11.2012","04.11.2012",2012,11,4,0.850554695,1
"FIN_004_MZB_LO_1","FIN_004_MZB_LO_1-02.10.2013","02.10.2013",2013,10,2,0.823764959,1
"FIN_004_MZB_LO_1","FIN_004_MZB_LO_1-30.09.2014","30.09.2014",2014,9,30,0.874251822,1
"FIN_004_MZB_LO_1","FIN_004_MZB_LO_1-22.09.2016","22.09.2016",2016,9,22,0.92612946,1
"FIN_004_MZB_LO_1","FIN_004_MZB_LO_1-04.10.2018","04.10.2018",2018,10,4,0.825072001,1
"FIN_004_MZB_LO_1","FIN_004_MZB_LO_1-09.10.2019","09.10.2019",2019,10,9,0.883803024,1
"FIN_004_MZB_LO_1","FIN_004_MZB_LO_1-21.09.2020","21.09.2020",2020,9,21,0.73716377,2
"FIN_004_MZB_LO_1","FIN_004_MZB_LO_1-28.09.2021","28.09.2021",2021,9,28,0.873270407,1
"FIN_004_MZB_LO_10","FIN_004_MZB_LO_10-16.09.2008","16.09.2008",2008,9,16,0.943211719,1
"FIN_004_MZB_LO_10","FIN_004_MZB_LO_10-21.09.2009","21.09.2009",2009,9,21,0.875966096,1
"FIN_004_MZB_LO_10","FIN_004_MZB_LO_10-20.09.2010","20.09.2010",2010,9,20,0.838024805,1
"FIN_004_MZB_LO_10","FIN_004_MZB_LO_10-08.11.2011","08.11.2011",2011,11,8,0.882394584,1
"FIN_004_MZB_LO_10","FIN_004_MZB_LO_10-08.10.2012","08.10.2012",2012,10,8,0.738523877,2
"FIN_004_MZB_LO_10","FIN_004_MZB_LO_10-23.10.2013","23.10.2013",2013,10,23,0.846940569,1
"FIN_004_MZB_LO_10","FIN_004_MZB_LO_10-03.10.2017","03.10.2017",2017,10,3,0.820077447,1
"FIN_004_MZB_LO_10","FIN_004_MZB_LO_10-08.10.2019","08.10.2019",2019,10,8,0.81338944,1
"FIN_004_MZB_LO_101","FIN_004_MZB_LO_101-21.09.1998","21.09.1998",1998,9,21,0.597892357,3
"FIN_004_MZB_LO_101","FIN_004_MZB_LO_101-20.10.2004","20.10.2004",2004,10,20,0.593898134,3
"FIN_004_MZB_LO_101","FIN_004_MZB_LO_101-01.10.2006","01.10.2006",2006,10,1,0.865905991,1
"FIN_004_MZB_LO_101","FIN_004_MZB_LO_101-23.09.2010","23.09.2010",2010,9,23,0.687870857,2
"FIN_004_MZB_LO_101","FIN_004_MZB_LO_101-20.10.2014","20.10.2014",2014,10,20,0.872883764,1
"FIN_004_MZB_LO_101","FIN_004_MZB_LO_101-19.10.2018","19.10.2018",2018,10,19,0.716957341,2
"FIN_004_MZB_LO_101","FIN_004_MZB_LO_101-05.10.2021","05.10.2021",2021,10,5,0.978806289,1
"FIN_004_MZB_LO_11","FIN_004_MZB_LO_11-17.09.2009","17.09.2009",2009,9,17,0.764058949,2
"FIN_004_MZB_LO_11","FIN_004_MZB_LO_11-20.09.2010","20.09.2010",2010,9,20,0.853690093,1
"FIN_004_MZB_LO_11","FIN_004_MZB_LO_11-19.09.2011","19.09.2011",2011,9,19,0.805376889,1
"FIN_004_MZB_LO_11","FIN_004_MZB_LO_11-25.09.2012","25.09.2012",2012,9,25,0.832235592,1
"FIN_004_MZB_LO_11","FIN_004_MZB_LO_11-25.09.2013","25.09.2013",2013,9,25,0.931043886,1
"FIN_004_MZB_LO_11","FIN_004_MZB_LO_11-23.09.2014","23.09.2014",2014,9,23,0.889163901,1
"FIN_004_MZB_LO_11","FIN_004_MZB_LO_11-28.09.2015","28.09.2015",2015,9,28,0.95980393,1
"FIN_004_MZB_LO_11","FIN_004_MZB_LO_11-26.09.2016","26.09.2016",2016,9,26,0.885041299,1
"FIN_004_MZB_LO_11","FIN_004_MZB_LO_11-19.09.2017","19.09.2017",2017,9,19,0.88933742,1
"FIN_004_MZB_LO_11","FIN_004_MZB_LO_11-11.10.2018","11.10.2018",2018,10,11,0.266368473,4
"FIN_004_MZB_LO_11","FIN_004_MZB_LO_11-07.10.2019","07.10.2019",2019,10,7,0.611143435,2
"FIN_004_MZB_LO_11","FIN_004_MZB_LO_11-07.09.2020","07.09.2020",2020,9,7,0.773021769,2
"FIN_004_MZB_LO_110","FIN_004_MZB_LO_110-25.09.2007","25.09.2007",2007,9,25,0.790399538,2
"FIN_004_MZB_LO_110","FIN_004_MZB_LO_110-29.09.2009","29.09.2009",2009,9,29,0.93682581,1
"FIN_004_MZB_LO_110","FIN_004_MZB_LO_110-01.09.2010","01.09.2010",2010,9,1,0.908489432,1
"FIN_004_MZB_LO_110","FIN_004_MZB_LO_110-28.09.2011","28.09.2011",2011,9,28,1.00001,1
"FIN_004_MZB_LO_110","FIN_004_MZB_LO_110-26.09.2012","26.09.2012",2012,9,26,0.859685992,1
"FIN_004_MZB_LO_110","FIN_004_MZB_LO_110-01.10.2013","01.10.2013",2013,10,1,0.993890459,1
"FIN_004_MZB_LO_110","FIN_004_MZB_LO_110-06.10.2014","06.10.2014",2014,10,6,0.953523486,1
"FIN_004_MZB_LO_110","FIN_004_MZB_LO_110-04.10.2015","04.10.2015",2015,10,4,0.993890459,1
"FIN_004_MZB_LO_110","FIN_004_MZB_LO_110-03.10.2016","03.10.2016",2016,10,3,1.00001,1
"FIN_004_MZB_LO_112","FIN_004_MZB_LO_112-10.10.2007","10.10.2007",2007,10,10,0.760824005,2
"FIN_004_MZB_LO_112","FIN_004_MZB_LO_112-14.10.2009","14.10.2009",2009,10,14,0.93534714,1
"FIN_004_MZB_LO_112","FIN_004_MZB_LO_112-03.10.2012","03.10.2012",2012,10,3,0.817368174,1
"FIN_004_MZB_LO_112","FIN_004_MZB_LO_112-29.10.2014","29.10.2014",2014,10,29,0.76655267,2
"FIN_004_MZB_LO_112","FIN_004_MZB_LO_112-08.10.2015","08.10.2015",2015,10,8,0.863887831,1
"FIN_004_MZB_LO_112","FIN_004_MZB_LO_112-25.09.2017","25.09.2017",2017,9,25,0.675151618,2
"FIN_004_MZB_LO_112","FIN_004_MZB_LO_112-25.09.2018","25.09.2018",2018,9,25,0.828574762,1
"FIN_004_MZB_LO_113","FIN_004_MZB_LO_113-28.09.2007","28.09.2007",2007,9,28,0.872035632,1
"FIN_004_MZB_LO_113","FIN_004_MZB_LO_113-07.09.2009","07.09.2009",2009,9,7,0.932970817,1
"FIN_004_MZB_LO_113","FIN_004_MZB_LO_113-12.09.2010","12.09.2010",2010,9,12,0.859247023,1
"FIN_004_MZB_LO_113","FIN_004_MZB_LO_113-11.09.2011","11.09.2011",2011,9,11,0.90755756,1
"FIN_004_MZB_LO_113","FIN_004_MZB_LO_113-09.09.2012","09.09.2012",2012,9,9,0.93334,1
"FIN_004_MZB_LO_113","FIN_004_MZB_LO_113-09.09.2013","09.09.2013",2013,9,9,0.830407595,1
"FIN_004_MZB_LO_113","FIN_004_MZB_LO_113-10.09.2014","10.09.2014",2014,9,10,0.895244762,1
"FIN_004_MZB_LO_113","FIN_004_MZB_LO_113-12.09.2017","12.09.2017",2017,9,12,0.775179209,2
"FIN_004_MZB_LO_12","FIN_004_MZB_LO_12-28.09.2009","28.09.2009",2009,9,28,1.00001,1
"FIN_004_MZB_LO_12","FIN_004_MZB_LO_12-21.09.2010","21.09.2010",2010,9,21,0.9572998,1
"FIN_004_MZB_LO_12","FIN_004_MZB_LO_12-22.09.2011","22.09.2011",2011,9,22,0.818185152,1
"FIN_004_MZB_LO_12","FIN_004_MZB_LO_12-24.09.2012","24.09.2012",2012,9,24,0.976350753,1
"FIN_004_MZB_LO_12","FIN_004_MZB_LO_12-25.09.2013","25.09.2013",2013,9,25,0.716593408,2
"FIN_004_MZB_LO_12","FIN_004_MZB_LO_12-24.09.2014","24.09.2014",2014,9,24,0.540324899,3
"FIN_004_MZB_LO_12","FIN_004_MZB_LO_12-19.10.2015","19.10.2015",2015,10,19,0.804150064,1
"FIN_004_MZB_LO_12","FIN_004_MZB_LO_12-28.09.2016","28.09.2016",2016,9,28,0.78423396,2
"FIN_004_MZB_LO_12","FIN_004_MZB_LO_12-24.10.2017","24.10.2017",2017,10,24,0.952289979,1
"FIN_004_MZB_LO_12","FIN_004_MZB_LO_12-06.09.2018","06.09.2018",2018,9,6,0.481560475,3
"FIN_004_MZB_LO_12","FIN_004_MZB_LO_12-01.10.2019","01.10.2019",2019,10,1,0.858692202,1
"FIN_004_MZB_LO_12","FIN_004_MZB_LO_12-07.09.2020","07.09.2020",2020,9,7,0.776079888,2
"FIN_004_MZB_LO_13","FIN_004_MZB_LO_13-28.09.2009","28.09.2009",2009,9,28,0.94640771,1
"FIN_004_MZB_LO_13","FIN_004_MZB_LO_13-10.09.2013","10.09.2013",2013,9,10,0.926079502,1
"FIN_004_MZB_LO_13","FIN_004_MZB_LO_13-29.09.2015","29.09.2015",2015,9,29,1.00001,1
"FIN_004_MZB_LO_13","FIN_004_MZB_LO_13-26.10.2016","26.10.2016",2016,10,26,1.00001,1
"FIN_004_MZB_LO_13","FIN_004_MZB_LO_13-19.09.2017","19.09.2017",2017,9,19,0.937484365,1
"FIN_004_MZB_LO_13","FIN_004_MZB_LO_13-19.09.2018","19.09.2018",2018,9,19,1.00001,1
"FIN_004_MZB_LO_13","FIN_004_MZB_LO_13-23.10.2019","23.10.2019",2019,10,23,0.893378227,1
"FIN_004_MZB_LO_13","FIN_004_MZB_LO_13-10.11.2020","10.11.2020",2020,11,10,0.983367545,1
"FIN_004_MZB_LO_131","FIN_004_MZB_LO_131-01.10.2008","01.10.2008",2008,10,1,0.858920342,1
"FIN_004_MZB_LO_131","FIN_004_MZB_LO_131-07.09.2010","07.09.2010",2010,9,7,0.607714466,2
"FIN_004_MZB_LO_131","FIN_004_MZB_LO_131-09.09.2012","09.09.2012",2012,9,9,0.82786791,1
"FIN_004_MZB_LO_131","FIN_004_MZB_LO_131-02.09.2013","02.09.2013",2013,9,2,0.959083586,1
"FIN_004_MZB_LO_131","FIN_004_MZB_LO_131-09.09.2015","09.09.2015",2015,9,9,0.983452028,1
"FIN_004_MZB_LO_131","FIN_004_MZB_LO_131-07.10.2018","07.10.2018",2018,10,7,1.00001,1
"FIN_004_MZB_LO_131","FIN_004_MZB_LO_131-15.09.2021","15.09.2021",2021,9,15,0.932774836,1
"FIN_004_MZB_LO_132","FIN_004_MZB_LO_132-30.09.2008","30.09.2008",2008,9,30,0.69114936,2
"FIN_004_MZB_LO_132","FIN_004_MZB_LO_132-08.09.2010","08.09.2010",2010,9,8,0.62202545,2
"FIN_004_MZB_LO_132","FIN_004_MZB_LO_132-13.09.2012","13.09.2012",2012,9,13,0.723348795,2
"FIN_004_MZB_LO_132","FIN_004_MZB_LO_132-02.09.2013","02.09.2013",2013,9,2,0.837305976,1
"FIN_004_MZB_LO_132","FIN_004_MZB_LO_132-09.09.2015","09.09.2015",2015,9,9,0.850641275,1
"FIN_004_MZB_LO_132","FIN_004_MZB_LO_132-08.10.2018","08.10.2018",2018,10,8,1.00001,1
"FIN_004_MZB_LO_132","FIN_004_MZB_LO_132-20.09.2021","20.09.2021",2021,9,20,0.826117521,1
"FIN_004_MZB_LO_133","FIN_004_MZB_LO_133-30.09.2008","30.09.2008",2008,9,30,0.93334,1
"FIN_004_MZB_LO_133","FIN_004_MZB_LO_133-07.09.2010","07.09.2010",2010,9,7,0.927220459,1
"FIN_004_MZB_LO_133","FIN_004_MZB_LO_133-11.09.2012","11.09.2012",2012,9,11,0.907036973,1
"FIN_004_MZB_LO_133","FIN_004_MZB_LO_133-02.09.2013","02.09.2013",2013,9,2,0.886057512,1
"FIN_004_MZB_LO_133","FIN_004_MZB_LO_133-09.09.2015","09.09.2015",2015,9,9,0.904726206,1
"FIN_004_MZB_LO_133","FIN_004_MZB_LO_133-07.10.2018","07.10.2018",2018,10,7,0.875158248,1
"FIN_004_MZB_LO_133","FIN_004_MZB_LO_133-13.09.2021","13.09.2021",2021,9,13,0.99279946,1
"FIN_004_MZB_LO_14","FIN_004_MZB_LO_14-03.10.2006","03.10.2006",2006,10,3,0.868165893,1
"FIN_004_MZB_LO_14","FIN_004_MZB_LO_14-06.09.2010","06.09.2010",2010,9,6,0.931426481,1
"FIN_004_MZB_LO_14","FIN_004_MZB_LO_14-07.09.2011","07.09.2011",2011,9,7,0.889057563,1
"FIN_004_MZB_LO_14","FIN_004_MZB_LO_14-20.09.2012","20.09.2012",2012,9,20,0.950460272,1
"FIN_004_MZB_LO_14","FIN_004_MZB_LO_14-06.09.2013","06.09.2013",2013,9,6,0.815641261,1
"FIN_004_MZB_LO_14","FIN_004_MZB_LO_14-10.10.2014","10.10.2014",2014,10,10,0.910154159,1
"FIN_004_MZB_LO_14","FIN_004_MZB_LO_14-01.10.2015","01.10.2015",2015,10,1,0.974516471,1
"FIN_004_MZB_LO_14","FIN_004_MZB_LO_14-19.10.2016","19.10.2016",2016,10,19,1.00001,1
"FIN_004_MZB_LO_14","FIN_004_MZB_LO_14-18.09.2017","18.09.2017",2017,9,18,0.906044064,1
"FIN_004_MZB_LO_14","FIN_004_MZB_LO_14-19.09.2018","19.09.2018",2018,9,19,0.954699914,1
"FIN_004_MZB_LO_14","FIN_004_MZB_LO_14-20.11.2019","20.11.2019",2019,11,20,0.847105564,1
"FIN_004_MZB_LO_144","FIN_004_MZB_LO_144-01.10.2009","01.10.2009",2009,10,1,1.00001,1
"FIN_004_MZB_LO_144","FIN_004_MZB_LO_144-15.09.2010","15.09.2010",2010,9,15,0.956701226,1
"FIN_004_MZB_LO_144","FIN_004_MZB_LO_144-29.09.2011","29.09.2011",2011,9,29,1.00001,1
"FIN_004_MZB_LO_144","FIN_004_MZB_LO_144-10.09.2012","10.09.2012",2012,9,10,1.00001,1
"FIN_004_MZB_LO_144","FIN_004_MZB_LO_144-09.09.2013","09.09.2013",2013,9,9,1.00001,1
"FIN_004_MZB_LO_144","FIN_004_MZB_LO_144-01.10.2015","01.10.2015",2015,10,1,0.971223184,1
"FIN_004_MZB_LO_144","FIN_004_MZB_LO_144-05.09.2016","05.09.2016",2016,9,5,1.00001,1
"FIN_004_MZB_LO_144","FIN_004_MZB_LO_144-26.09.2017","26.09.2017",2017,9,26,0.933802299,1
"FIN_004_MZB_LO_144","FIN_004_MZB_LO_144-19.09.2018","19.09.2018",2018,9,19,1.00001,1
"FIN_004_MZB_LO_15","FIN_004_MZB_LO_15-09.09.2007","09.09.2007",2007,9,9,0.457607283,3
"FIN_004_MZB_LO_15","FIN_004_MZB_LO_15-14.09.2009","14.09.2009",2009,9,14,0.792595926,2
"FIN_004_MZB_LO_15","FIN_004_MZB_LO_15-29.09.2010","29.09.2010",2010,9,29,0.570275237,3
"FIN_004_MZB_LO_15","FIN_004_MZB_LO_15-08.09.2011","08.09.2011",2011,9,8,0.667444554,2
"FIN_004_MZB_LO_15","FIN_004_MZB_LO_15-16.09.2012","16.09.2012",2012,9,16,0.844052209,1
"FIN_004_MZB_LO_15","FIN_004_MZB_LO_15-23.09.2013","23.09.2013",2013,9,23,0.866664751,1
"FIN_004_MZB_LO_15","FIN_004_MZB_LO_15-07.09.2015","07.09.2015",2015,9,7,0.697046074,2
"FIN_004_MZB_LO_15","FIN_004_MZB_LO_15-20.09.2016","20.09.2016",2016,9,20,0.58544178,3
"FIN_004_MZB_LO_15","FIN_004_MZB_LO_15-25.09.2017","25.09.2017",2017,9,25,0.686979348,2
"FIN_004_MZB_LO_15","FIN_004_MZB_LO_15-05.09.2018","05.09.2018",2018,9,5,0.51653313,3
"FIN_004_MZB_LO_15","FIN_004_MZB_LO_15-18.09.2019","18.09.2019",2019,9,18,0.717901582,2
"FIN_004_MZB_LO_15","FIN_004_MZB_LO_15-10.09.2020","10.09.2020",2020,9,10,0.567084164,3
"FIN_004_MZB_LO_152","FIN_004_MZB_LO_152-12.10.2005","12.10.2005",2005,10,12,0.351906754,4
"FIN_004_MZB_LO_152","FIN_004_MZB_LO_152-06.10.2009","06.10.2009",2009,10,6,0.657488772,2
"FIN_004_MZB_LO_152","FIN_004_MZB_LO_152-13.10.2010","13.10.2010",2010,10,13,0.44655568,3
"FIN_004_MZB_LO_152","FIN_004_MZB_LO_152-13.11.2011","13.11.2011",2011,11,13,0.342064465,4
"FIN_004_MZB_LO_152","FIN_004_MZB_LO_152-22.09.2013","22.09.2013",2013,9,22,0.756151947,2
"FIN_004_MZB_LO_152","FIN_004_MZB_LO_152-15.09.2014","15.09.2014",2014,9,15,0.493120078,3
"FIN_004_MZB_LO_152","FIN_004_MZB_LO_152-01.10.2017","01.10.2017",2017,10,1,0.433873944,3
"FIN_004_MZB_LO_152","FIN_004_MZB_LO_152-09.09.2020","09.09.2020",2020,9,9,0.57438937,3
"FIN_004_MZB_LO_153","FIN_004_MZB_LO_153-01.09.2009","01.09.2009",2009,9,1,0.96987953,1
"FIN_004_MZB_LO_153","FIN_004_MZB_LO_153-09.09.2011","09.09.2011",2011,9,9,1.00001,1
"FIN_004_MZB_LO_153","FIN_004_MZB_LO_153-03.09.2014","03.09.2014",2014,9,3,0.853375149,1
"FIN_004_MZB_LO_153","FIN_004_MZB_LO_153-07.09.2016","07.09.2016",2016,9,7,0.910424814,1
"FIN_004_MZB_LO_153","FIN_004_MZB_LO_153-24.08.2017","24.08.2017",2017,8,24,0.742746573,2
"FIN_004_MZB_LO_153","FIN_004_MZB_LO_153-23.09.2020","23.09.2020",2020,9,23,0.988997492,1
"FIN_004_MZB_LO_153","FIN_004_MZB_LO_153-09.09.2021","09.09.2021",2021,9,9,0.902329542,1
"FIN_004_MZB_LO_154","FIN_004_MZB_LO_154-19.10.2008","19.10.2008",2008,10,19,0.826778937,1
"FIN_004_MZB_LO_154","FIN_004_MZB_LO_154-22.09.2009","22.09.2009",2009,9,22,0.372951793,4
"FIN_004_MZB_LO_154","FIN_004_MZB_LO_154-17.10.2012","17.10.2012",2012,10,17,0.627340199,2
"FIN_004_MZB_LO_154","FIN_004_MZB_LO_154-31.08.2015","31.08.2015",2015,8,31,0.89355172,1
"FIN_004_MZB_LO_154","FIN_004_MZB_LO_154-04.09.2017","04.09.2017",2017,9,4,0.83109828,1
"FIN_004_MZB_LO_154","FIN_004_MZB_LO_154-16.09.2018","16.09.2018",2018,9,16,0.661943341,2
"FIN_004_MZB_LO_154","FIN_004_MZB_LO_154-03.10.2021","03.10.2021",2021,10,3,0.441048792,3
"FIN_004_MZB_LO_156","FIN_004_MZB_LO_156-20.10.2008","20.10.2008",2008,10,20,0.99286381,1
"FIN_004_MZB_LO_156","FIN_004_MZB_LO_156-23.09.2009","23.09.2009",2009,9,23,1.00001,1
"FIN_004_MZB_LO_156","FIN_004_MZB_LO_156-16.10.2012","16.10.2012",2012,10,16,0.675768987,2
"FIN_004_MZB_LO_156","FIN_004_MZB_LO_156-31.08.2015","31.08.2015",2015,8,31,0.963529068,1
"FIN_004_MZB_LO_156","FIN_004_MZB_LO_156-04.09.2017","04.09.2017",2017,9,4,1.00001,1
"FIN_004_MZB_LO_156","FIN_004_MZB_LO_156-13.09.2018","13.09.2018",2018,9,13,1.00001,1
"FIN_004_MZB_LO_156","FIN_004_MZB_LO_156-03.10.2021","03.10.2021",2021,10,3,1.00001,1
"FIN_004_MZB_LO_16","FIN_004_MZB_LO_16-07.09.2007","07.09.2007",2007,9,7,0.772252137,2
"FIN_004_MZB_LO_16","FIN_004_MZB_LO_16-28.09.2009","28.09.2009",2009,9,28,0.879837231,1
"FIN_004_MZB_LO_16","FIN_004_MZB_LO_16-06.09.2012","06.09.2012",2012,9,6,0.780975179,2
"FIN_004_MZB_LO_16","FIN_004_MZB_LO_16-17.09.2014","17.09.2014",2014,9,17,0.806777239,1
"FIN_004_MZB_LO_16","FIN_004_MZB_LO_16-30.09.2015","30.09.2015",2015,9,30,0.657280804,2
"FIN_004_MZB_LO_16","FIN_004_MZB_LO_16-05.10.2016","05.10.2016",2016,10,5,0.834736472,1
"FIN_004_MZB_LO_16","FIN_004_MZB_LO_16-17.10.2018","17.10.2018",2018,10,17,0.667455602,2
"FIN_004_MZB_LO_16","FIN_004_MZB_LO_16-18.09.2019","18.09.2019",2019,9,18,0.980959048,1
"FIN_004_MZB_LO_17","FIN_004_MZB_LO_17-23.09.2009","23.09.2009",2009,9,23,0.978012041,1
"FIN_004_MZB_LO_17","FIN_004_MZB_LO_17-10.10.2010","10.10.2010",2010,10,10,1.00001,1
"FIN_004_MZB_LO_17","FIN_004_MZB_LO_17-19.09.2012","19.09.2012",2012,9,19,1.00001,1
"FIN_004_MZB_LO_17","FIN_004_MZB_LO_17-09.09.2013","09.09.2013",2013,9,9,1.00001,1
"FIN_004_MZB_LO_17","FIN_004_MZB_LO_17-16.09.2015","16.09.2015",2015,9,16,0.973706973,1
"FIN_004_MZB_LO_17","FIN_004_MZB_LO_17-06.09.2016","06.09.2016",2016,9,6,1.00001,1
"FIN_004_MZB_LO_17","FIN_004_MZB_LO_17-04.09.2017","04.09.2017",2017,9,4,1.00001,1
"FIN_004_MZB_LO_17","FIN_004_MZB_LO_17-05.09.2018","05.09.2018",2018,9,5,1.00001,1
"FIN_004_MZB_LO_17","FIN_004_MZB_LO_17-23.09.2019","23.09.2019",2019,9,23,1.00001,1
"FIN_004_MZB_LO_17","FIN_004_MZB_LO_17-28.09.2020","28.09.2020",2020,9,28,1.00001,1
"FIN_004_MZB_LO_18","FIN_004_MZB_LO_18-25.09.2006","25.09.2006",2006,9,25,1.00001,1
"FIN_004_MZB_LO_18","FIN_004_MZB_LO_18-21.09.2009","21.09.2009",2009,9,21,1.00001,1
"FIN_004_MZB_LO_18","FIN_004_MZB_LO_18-10.10.2010","10.10.2010",2010,10,10,1.00001,1
"FIN_004_MZB_LO_18","FIN_004_MZB_LO_18-13.09.2012","13.09.2012",2012,9,13,1.00001,1
"FIN_004_MZB_LO_18","FIN_004_MZB_LO_18-09.09.2013","09.09.2013",2013,9,9,1.00001,1
"FIN_004_MZB_LO_18","FIN_004_MZB_LO_18-06.09.2016","06.09.2016",2016,9,6,1.00001,1
"FIN_004_MZB_LO_18","FIN_004_MZB_LO_18-04.09.2017","04.09.2017",2017,9,4,0.966496432,1
"FIN_004_MZB_LO_18","FIN_004_MZB_LO_18-05.09.2018","05.09.2018",2018,9,5,0.886853486,1
"FIN_004_MZB_LO_18","FIN_004_MZB_LO_18-23.09.2019","23.09.2019",2019,9,23,1.00001,1
"FIN_004_MZB_LO_18","FIN_004_MZB_LO_18-28.09.2020","28.09.2020",2020,9,28,1.00001,1
"FIN_004_MZB_LO_19","FIN_004_MZB_LO_19-11.09.2007","11.09.2007",2007,9,11,0.919664868,1
"FIN_004_MZB_LO_19","FIN_004_MZB_LO_19-02.09.2008","02.09.2008",2008,9,2,0.747209783,2
"FIN_004_MZB_LO_19","FIN_004_MZB_LO_19-06.10.2009","06.10.2009",2009,10,6,0.88481475,1
"FIN_004_MZB_LO_19","FIN_004_MZB_LO_19-25.10.2010","25.10.2010",2010,10,25,0.888895556,1
"FIN_004_MZB_LO_19","FIN_004_MZB_LO_19-12.10.2011","12.10.2011",2011,10,12,0.880664217,1
"FIN_004_MZB_LO_19","FIN_004_MZB_LO_19-24.09.2012","24.09.2012",2012,9,24,0.901362595,1
"FIN_004_MZB_LO_19","FIN_004_MZB_LO_19-23.09.2013","23.09.2013",2013,9,23,0.974087248,1
"FIN_004_MZB_LO_19","FIN_004_MZB_LO_19-29.10.2014","29.10.2014",2014,10,29,1.00001,1
"FIN_004_MZB_LO_19","FIN_004_MZB_LO_19-06.10.2015","06.10.2015",2015,10,6,0.879721025,1
"FIN_004_MZB_LO_19","FIN_004_MZB_LO_19-29.09.2016","29.09.2016",2016,9,29,0.845730427,1
"FIN_004_MZB_LO_19","FIN_004_MZB_LO_19-01.10.2017","01.10.2017",2017,10,1,0.953523486,1
"FIN_004_MZB_LO_19","FIN_004_MZB_LO_19-27.09.2018","27.09.2018",2018,9,27,1.00001,1
"FIN_004_MZB_LO_19","FIN_004_MZB_LO_19-16.10.2019","16.10.2019",2019,10,16,1.00001,1
"FIN_004_MZB_LO_19","FIN_004_MZB_LO_19-01.09.2020","01.09.2020",2020,9,1,1.00001,1
"FIN_004_MZB_LO_19","FIN_004_MZB_LO_19-21.09.2021","21.09.2021",2021,9,21,0.993890459,1
"FIN_004_MZB_LO_21","FIN_004_MZB_LO_21-09.09.2007","09.09.2007",2007,9,9,0.304357816,4
"FIN_004_MZB_LO_21","FIN_004_MZB_LO_21-18.10.2010","18.10.2010",2010,10,18,0.489195274,3
"FIN_004_MZB_LO_21","FIN_004_MZB_LO_21-07.09.2011","07.09.2011",2011,9,7,0.615843609,2
"FIN_004_MZB_LO_21","FIN_004_MZB_LO_21-16.09.2012","16.09.2012",2012,9,16,0.450481388,3
"FIN_004_MZB_LO_21","FIN_004_MZB_LO_21-22.09.2013","22.09.2013",2013,9,22,0.707701422,2
"FIN_004_MZB_LO_21","FIN_004_MZB_LO_21-14.09.2015","14.09.2015",2015,9,14,0.423772057,3
"FIN_004_MZB_LO_21","FIN_004_MZB_LO_21-20.09.2016","20.09.2016",2016,9,20,0.546113699,3
"FIN_004_MZB_LO_21","FIN_004_MZB_LO_21-25.09.2017","25.09.2017",2017,9,25,0.787810774,2
"FIN_004_MZB_LO_21","FIN_004_MZB_LO_21-17.09.2018","17.09.2018",2018,9,17,0.696997599,2
"FIN_004_MZB_LO_21","FIN_004_MZB_LO_21-20.09.2019","20.09.2019",2019,9,20,0.861760933,1
"FIN_004_MZB_LO_23","FIN_004_MZB_LO_23-01.10.2008","01.10.2008",2008,10,1,0.874498558,1
"FIN_004_MZB_LO_23","FIN_004_MZB_LO_23-07.10.2009","07.10.2009",2009,10,7,0.790347404,2
"FIN_004_MZB_LO_23","FIN_004_MZB_LO_23-27.09.2010","27.09.2010",2010,9,27,0.950121065,1
"FIN_004_MZB_LO_23","FIN_004_MZB_LO_23-21.09.2011","21.09.2011",2011,9,21,1.00001,1
"FIN_004_MZB_LO_23","FIN_004_MZB_LO_23-25.09.2012","25.09.2012",2012,9,25,0.760655348,2
"FIN_004_MZB_LO_23","FIN_004_MZB_LO_23-25.09.2013","25.09.2013",2013,9,25,0.966496432,1
"FIN_004_MZB_LO_23","FIN_004_MZB_LO_23-01.09.2014","01.09.2014",2014,9,1,0.953523486,1
"FIN_004_MZB_LO_23","FIN_004_MZB_LO_23-04.10.2016","04.10.2016",2016,10,4,0.845054297,1
"FIN_004_MZB_LO_23","FIN_004_MZB_LO_23-08.10.2019","08.10.2019",2019,10,8,0.84383229,1
"FIN_004_MZB_LO_24","FIN_004_MZB_LO_24-16.09.2007","16.09.2007",2007,9,16,0.879176404,1
"FIN_004_MZB_LO_24","FIN_004_MZB_LO_24-05.11.2008","05.11.2008",2008,11,5,0.66049072,2
"FIN_004_MZB_LO_24","FIN_004_MZB_LO_24-08.09.2009","08.09.2009",2009,9,8,0.801315635,1
"FIN_004_MZB_LO_24","FIN_004_MZB_LO_24-03.10.2011","03.10.2011",2011,10,3,0.998045882,1
"FIN_004_MZB_LO_24","FIN_004_MZB_LO_24-19.11.2013","19.11.2013",2013,11,19,0.764829879,2
"FIN_004_MZB_LO_24","FIN_004_MZB_LO_24-14.09.2017","14.09.2017",2017,9,14,0.804788381,1
"FIN_004_MZB_LO_24","FIN_004_MZB_LO_24-29.09.2020","29.09.2020",2020,9,29,0.52169998,3
"FIN_004_MZB_LO_27","FIN_004_MZB_LO_27-10.10.2007","10.10.2007",2007,10,10,0.631403447,2
"FIN_004_MZB_LO_27","FIN_004_MZB_LO_27-22.09.2008","22.09.2008",2008,9,22,0.489570641,3
"FIN_004_MZB_LO_27","FIN_004_MZB_LO_27-08.09.2009","08.09.2009",2009,9,8,0.63224606,2
"FIN_004_MZB_LO_27","FIN_004_MZB_LO_27-11.10.2010","11.10.2010",2010,10,11,0.696794525,2
"FIN_004_MZB_LO_27","FIN_004_MZB_LO_27-02.10.2013","02.10.2013",2013,10,2,0.7534733,2
"FIN_004_MZB_LO_27","FIN_004_MZB_LO_27-29.09.2014","29.09.2014",2014,9,29,0.802454185,1
"FIN_004_MZB_LO_27","FIN_004_MZB_LO_27-04.10.2016","04.10.2016",2016,10,4,0.670355723,2
"FIN_004_MZB_LO_27","FIN_004_MZB_LO_27-17.10.2018","17.10.2018",2018,10,17,0.589027701,3
"FIN_004_MZB_LO_28","FIN_004_MZB_LO_28-10.09.2007","10.09.2007",2007,9,10,0.925003333,1
"FIN_004_MZB_LO_28","FIN_004_MZB_LO_28-22.09.2009","22.09.2009",2009,9,22,0.93334,1
"FIN_004_MZB_LO_28","FIN_004_MZB_LO_28-20.09.2010","20.09.2010",2010,9,20,0.854199959,1
"FIN_004_MZB_LO_28","FIN_004_MZB_LO_28-20.09.2011","20.09.2011",2011,9,20,0.850606013,1
"FIN_004_MZB_LO_28","FIN_004_MZB_LO_28-30.10.2012","30.10.2012",2012,10,30,0.927364966,1
"FIN_004_MZB_LO_28","FIN_004_MZB_LO_28-25.09.2013","25.09.2013",2013,9,25,0.87993432,1
"FIN_004_MZB_LO_28","FIN_004_MZB_LO_28-29.09.2014","29.09.2014",2014,9,29,0.957465076,1
"FIN_004_MZB_LO_28","FIN_004_MZB_LO_28-22.09.2016","22.09.2016",2016,9,22,0.901767956,1
"FIN_004_MZB_LO_28","FIN_004_MZB_LO_28-17.10.2017","17.10.2017",2017,10,17,1.00001,1
"FIN_004_MZB_LO_28","FIN_004_MZB_LO_28-19.09.2018","19.09.2018",2018,9,19,0.956496653,1
"FIN_004_MZB_LO_28","FIN_004_MZB_LO_28-17.09.2019","17.09.2019",2019,9,17,0.978211795,1
"FIN_004_MZB_LO_28","FIN_004_MZB_LO_28-14.09.2020","14.09.2020",2020,9,14,0.938224245,1
"FIN_004_MZB_LO_29","FIN_004_MZB_LO_29-29.09.2008","29.09.2008",2008,9,29,0.769700303,2
"FIN_004_MZB_LO_29","FIN_004_MZB_LO_29-24.09.2009","24.09.2009",2009,9,24,0.976350753,1
"FIN_004_MZB_LO_29","FIN_004_MZB_LO_29-30.09.2010","30.09.2010",2010,9,30,0.78103624,2
"FIN_004_MZB_LO_29","FIN_004_MZB_LO_29-11.09.2013","11.09.2013",2013,9,11,0.651040016,2
"FIN_004_MZB_LO_29","FIN_004_MZB_LO_29-16.09.2014","16.09.2014",2014,9,16,0.684298655,2
"FIN_004_MZB_LO_29","FIN_004_MZB_LO_29-29.09.2015","29.09.2015",2015,9,29,0.914289048,1
"FIN_004_MZB_LO_29","FIN_004_MZB_LO_29-05.10.2016","05.10.2016",2016,10,5,0.787885585,2
"FIN_004_MZB_LO_29","FIN_004_MZB_LO_29-07.11.2017","07.11.2017",2017,11,7,0.860960554,1
"FIN_004_MZB_LO_29","FIN_004_MZB_LO_29-18.09.2018","18.09.2018",2018,9,18,0.696797165,2
"FIN_004_MZB_LO_29","FIN_004_MZB_LO_29-24.09.2019","24.09.2019",2019,9,24,0.929715731,1
"FIN_004_MZB_LO_29","FIN_004_MZB_LO_29-24.09.2020","24.09.2020",2020,9,24,0.976350753,1
"FIN_004_MZB_LO_3","FIN_004_MZB_LO_3-13.09.2007","13.09.2007",2007,9,13,0.985235813,1
"FIN_004_MZB_LO_3","FIN_004_MZB_LO_3-29.09.2009","29.09.2009",2009,9,29,1.00001,1
"FIN_004_MZB_LO_3","FIN_004_MZB_LO_3-06.09.2010","06.09.2010",2010,9,6,0.919468803,1
"FIN_004_MZB_LO_3","FIN_004_MZB_LO_3-08.09.2011","08.09.2011",2011,9,8,1.00001,1
"FIN_004_MZB_LO_3","FIN_004_MZB_LO_3-26.09.2012","26.09.2012",2012,9,26,0.904143536,1
"FIN_004_MZB_LO_3","FIN_004_MZB_LO_3-24.09.2013","24.09.2013",2013,9,24,1.00001,1
"FIN_004_MZB_LO_3","FIN_004_MZB_LO_3-03.10.2014","03.10.2014",2014,10,3,1.00001,1
"FIN_004_MZB_LO_3","FIN_004_MZB_LO_3-12.10.2015","12.10.2015",2015,10,12,0.834022249,1
"FIN_004_MZB_LO_3","FIN_004_MZB_LO_3-27.10.2016","27.10.2016",2016,10,27,0.966496432,1
"FIN_004_MZB_LO_3","FIN_004_MZB_LO_3-26.09.2017","26.09.2017",2017,9,26,0.886853486,1
"FIN_004_MZB_LO_3","FIN_004_MZB_LO_3-25.09.2018","25.09.2018",2018,9,25,1.00001,1
"FIN_004_MZB_LO_3","FIN_004_MZB_LO_3-18.10.2020","18.10.2020",2020,10,18,1.00001,1
"FIN_004_MZB_LO_30","FIN_004_MZB_LO_30-18.09.2007","18.09.2007",2007,9,18,0.432616286,3
"FIN_004_MZB_LO_30","FIN_004_MZB_LO_30-12.10.2009","12.10.2009",2009,10,12,0.458518458,3
"FIN_004_MZB_LO_30","FIN_004_MZB_LO_30-27.09.2010","27.09.2010",2010,9,27,0.374497759,4
"FIN_004_MZB_LO_30","FIN_004_MZB_LO_30-12.09.2013","12.09.2013",2013,9,12,0.337856765,4
"FIN_004_MZB_LO_30","FIN_004_MZB_LO_30-15.09.2014","15.09.2014",2014,9,15,0.334814191,4
"FIN_004_MZB_LO_30","FIN_004_MZB_LO_30-28.09.2015","28.09.2015",2015,9,28,0.551326161,3
"FIN_004_MZB_LO_30","FIN_004_MZB_LO_30-18.09.2016","18.09.2016",2016,9,18,0.550600146,3
"FIN_004_MZB_LO_30","FIN_004_MZB_LO_30-18.09.2018","18.09.2018",2018,9,18,0.485721487,3
"FIN_004_MZB_LO_30","FIN_004_MZB_LO_30-23.09.2019","23.09.2019",2019,9,23,0.321828096,4
"FIN_004_MZB_LO_30","FIN_004_MZB_LO_30-27.09.2020","27.09.2020",2020,9,27,0.409202194,3
"FIN_004_MZB_LO_32","FIN_004_MZB_LO_32-17.09.2007","17.09.2007",2007,9,17,0.712391711,2
"FIN_004_MZB_LO_32","FIN_004_MZB_LO_32-21.09.2009","21.09.2009",2009,9,21,0.626170629,2
"FIN_004_MZB_LO_32","FIN_004_MZB_LO_32-27.09.2011","27.09.2011",2011,9,27,0.634906893,2
"FIN_004_MZB_LO_32","FIN_004_MZB_LO_32-18.11.2012","18.11.2012",2012,11,18,0.577956429,3
"FIN_004_MZB_LO_32","FIN_004_MZB_LO_32-23.09.2013","23.09.2013",2013,9,23,0.889958277,1
"FIN_004_MZB_LO_32","FIN_004_MZB_LO_32-12.10.2015","12.10.2015",2015,10,12,0.727190084,2
"FIN_004_MZB_LO_32","FIN_004_MZB_LO_32-14.09.2017","14.09.2017",2017,9,14,0.687356455,2
"FIN_004_MZB_LO_32","FIN_004_MZB_LO_32-07.11.2018","07.11.2018",2018,11,7,0.69939698,2
"FIN_004_MZB_LO_32","FIN_004_MZB_LO_32-21.10.2019","21.10.2019",2019,10,21,0.96989914,1
"FIN_004_MZB_LO_32","FIN_004_MZB_LO_32-30.09.2020","30.09.2020",2020,9,30,1.00001,1
"FIN_004_MZB_LO_32","FIN_004_MZB_LO_32-16.09.2021","16.09.2021",2021,9,16,0.894610221,1
"FIN_004_MZB_LO_34","FIN_004_MZB_LO_34-25.09.2006","25.09.2006",2006,9,25,0.995002547,1
"FIN_004_MZB_LO_34","FIN_004_MZB_LO_34-12.10.2010","12.10.2010",2010,10,12,1.00001,1
"FIN_004_MZB_LO_34","FIN_004_MZB_LO_34-03.09.2012","03.09.2012",2012,9,3,0.619476825,2
"FIN_004_MZB_LO_34","FIN_004_MZB_LO_34-09.09.2013","09.09.2013",2013,9,9,0.615861465,2
"FIN_004_MZB_LO_34","FIN_004_MZB_LO_34-30.09.2014","30.09.2014",2014,9,30,0.960006667,1
"FIN_004_MZB_LO_34","FIN_004_MZB_LO_34-19.09.2016","19.09.2016",2016,9,19,0.950483273,1
"FIN_004_MZB_LO_34","FIN_004_MZB_LO_34-03.10.2017","03.10.2017",2017,10,3,0.867045587,1
"FIN_004_MZB_LO_34","FIN_004_MZB_LO_34-18.09.2018","18.09.2018",2018,9,18,0.398787935,4
"FIN_004_MZB_LO_34","FIN_004_MZB_LO_34-18.09.2019","18.09.2019",2019,9,18,0.800662608,1
"FIN_004_MZB_LO_34","FIN_004_MZB_LO_34-28.09.2020","28.09.2020",2020,9,28,0.836756904,1
"FIN_004_MZB_LO_34","FIN_004_MZB_LO_34-22.09.2021","22.09.2021",2021,9,22,0.916857051,1
"FIN_004_MZB_LO_35","FIN_004_MZB_LO_35-21.10.2007","21.10.2007",2007,10,21,0.663606092,2
"FIN_004_MZB_LO_35","FIN_004_MZB_LO_35-23.09.2009","23.09.2009",2009,9,23,0.852124545,1
"FIN_004_MZB_LO_35","FIN_004_MZB_LO_35-12.09.2010","12.09.2010",2010,9,12,0.336958004,4
"FIN_004_MZB_LO_35","FIN_004_MZB_LO_35-19.09.2012","19.09.2012",2012,9,19,0.31748127,4
"FIN_004_MZB_LO_35","FIN_004_MZB_LO_35-29.09.2013","29.09.2013",2013,9,29,0.495851517,3
"FIN_004_MZB_LO_35","FIN_004_MZB_LO_35-19.10.2014","19.10.2014",2014,10,19,0.699759523,2
"FIN_004_MZB_LO_35","FIN_004_MZB_LO_35-11.10.2016","11.10.2016",2016,10,11,0.759378927,2
"FIN_004_MZB_LO_35","FIN_004_MZB_LO_35-15.10.2017","15.10.2017",2017,10,15,0.475221492,3
"FIN_004_MZB_LO_35","FIN_004_MZB_LO_35-27.09.2018","27.09.2018",2018,9,27,0.693021618,2
"FIN_004_MZB_LO_35","FIN_004_MZB_LO_35-11.09.2019","11.09.2019",2019,9,11,0.055241617,5
"FIN_004_MZB_LO_35","FIN_004_MZB_LO_35-23.09.2020","23.09.2020",2020,9,23,0.769793692,2
"FIN_004_MZB_LO_4","FIN_004_MZB_LO_4-05.09.2006","05.09.2006",2006,9,5,0.807906947,1
"FIN_004_MZB_LO_4","FIN_004_MZB_LO_4-29.09.2008","29.09.2008",2008,9,29,0.796702294,2
"FIN_004_MZB_LO_4","FIN_004_MZB_LO_4-03.10.2010","03.10.2010",2010,10,3,0.787410921,2
"FIN_004_MZB_LO_4","FIN_004_MZB_LO_4-24.09.2013","24.09.2013",2013,9,24,0.64901356,2
"FIN_004_MZB_LO_4","FIN_004_MZB_LO_4-23.09.2014","23.09.2014",2014,9,23,0.661163242,2
"FIN_004_MZB_LO_4","FIN_004_MZB_LO_4-28.09.2015","28.09.2015",2015,9,28,0.647825035,2
"FIN_004_MZB_LO_4","FIN_004_MZB_LO_4-26.10.2016","26.10.2016",2016,10,26,0.553020874,3
"FIN_004_MZB_LO_4","FIN_004_MZB_LO_4-11.10.2018","11.10.2018",2018,10,11,0.529709743,3
"FIN_004_MZB_LO_4","FIN_004_MZB_LO_4-19.09.2019","19.09.2019",2019,9,19,0.812279821,1
"FIN_004_MZB_LO_4","FIN_004_MZB_LO_4-22.10.2020","22.10.2020",2020,10,22,0.828392488,1
"FIN_004_MZB_LO_42","FIN_004_MZB_LO_42-28.10.2007","28.10.2007",2007,10,28,0.634158962,2
"FIN_004_MZB_LO_42","FIN_004_MZB_LO_42-09.09.2009","09.09.2009",2009,9,9,0.732318517,2
"FIN_004_MZB_LO_42","FIN_004_MZB_LO_42-10.10.2010","10.10.2010",2010,10,10,0.817674131,1
"FIN_004_MZB_LO_42","FIN_004_MZB_LO_42-21.11.2011","21.11.2011",2011,11,21,0.676826744,2
"FIN_004_MZB_LO_42","FIN_004_MZB_LO_42-03.10.2013","03.10.2013",2013,10,3,0.82293417,1
"FIN_004_MZB_LO_42","FIN_004_MZB_LO_42-23.09.2014","23.09.2014",2014,9,23,0.647212265,2
"FIN_004_MZB_LO_42","FIN_004_MZB_LO_42-20.10.2015","20.10.2015",2015,10,20,0.675878824,2
"FIN_004_MZB_LO_42","FIN_004_MZB_LO_42-24.10.2016","24.10.2016",2016,10,24,0.636910783,2
"FIN_004_MZB_LO_42","FIN_004_MZB_LO_42-06.09.2017","06.09.2017",2017,9,6,0.756356864,2
"FIN_004_MZB_LO_42","FIN_004_MZB_LO_42-22.10.2018","22.10.2018",2018,10,22,0.59487218,3
"FIN_004_MZB_LO_42","FIN_004_MZB_LO_42-12.10.2020","12.10.2020",2020,10,12,0.682169365,2
"FIN_004_MZB_LO_44","FIN_004_MZB_LO_44-28.09.1999","28.09.1999",1999,9,28,0.533286434,3
"FIN_004_MZB_LO_44","FIN_004_MZB_LO_44-03.10.2003","03.10.2003",2003,10,3,0.648062269,2
"FIN_004_MZB_LO_44","FIN_004_MZB_LO_44-05.10.2009","05.10.2009",2009,10,5,0.613155441,2
"FIN_004_MZB_LO_44","FIN_004_MZB_LO_44-28.09.2010","28.09.2010",2010,9,28,0.78682728,2
"FIN_004_MZB_LO_44","FIN_004_MZB_LO_44-26.09.2011","26.09.2011",2011,9,26,0.693018923,2
"FIN_004_MZB_LO_44","FIN_004_MZB_LO_44-07.10.2012","07.10.2012",2012,10,7,0.810524,1
"FIN_004_MZB_LO_44","FIN_004_MZB_LO_44-10.10.2014","10.10.2014",2014,10,10,0.634053387,2
"FIN_004_MZB_LO_44","FIN_004_MZB_LO_44-05.10.2016","05.10.2016",2016,10,5,0.43665674,3
"FIN_004_MZB_LO_44","FIN_004_MZB_LO_44-18.10.2018","18.10.2018",2018,10,18,0.719097078,2
"FIN_004_MZB_LO_44","FIN_004_MZB_LO_44-27.09.2020","27.09.2020",2020,9,27,0.557080016,3
"FIN_004_MZB_LO_46","FIN_004_MZB_LO_46-30.09.2003","30.09.2003",2003,9,30,0.392086941,4
"FIN_004_MZB_LO_46","FIN_004_MZB_LO_46-23.09.2007","23.09.2007",2007,9,23,0.993890459,1
"FIN_004_MZB_LO_46","FIN_004_MZB_LO_46-27.09.2010","27.09.2010",2010,9,27,0.619650459,2
"FIN_004_MZB_LO_46","FIN_004_MZB_LO_46-13.09.2011","13.09.2011",2011,9,13,0.752561896,2
"FIN_004_MZB_LO_46","FIN_004_MZB_LO_46-24.09.2012","24.09.2012",2012,9,24,0.712500403,2
"FIN_004_MZB_LO_46","FIN_004_MZB_LO_46-09.09.2013","09.09.2013",2013,9,9,0.70796271,2
"FIN_004_MZB_LO_46","FIN_004_MZB_LO_46-15.09.2015","15.09.2015",2015,9,15,0.886853486,1
"FIN_004_MZB_LO_46","FIN_004_MZB_LO_46-03.09.2018","03.09.2018",2018,9,3,0.761579407,2
"FIN_004_MZB_LO_5","FIN_004_MZB_LO_5-22.10.2007","22.10.2007",2007,10,22,0.650099858,2
"FIN_004_MZB_LO_5","FIN_004_MZB_LO_5-22.09.2009","22.09.2009",2009,9,22,0.710429093,2
"FIN_004_MZB_LO_5","FIN_004_MZB_LO_5-01.09.2010","01.09.2010",2010,9,1,0.852185842,1
"FIN_004_MZB_LO_5","FIN_004_MZB_LO_5-20.09.2011","20.09.2011",2011,9,20,0.77989238,2
"FIN_004_MZB_LO_5","FIN_004_MZB_LO_5-28.09.2014","28.09.2014",2014,9,28,0.600256476,2
"FIN_004_MZB_LO_5","FIN_004_MZB_LO_5-18.10.2016","18.10.2016",2016,10,18,0.960115981,1
"FIN_004_MZB_LO_5","FIN_004_MZB_LO_5-25.10.2017","25.10.2017",2017,10,25,0.97302254,1
"FIN_004_MZB_LO_5","FIN_004_MZB_LO_5-25.09.2018","25.09.2018",2018,9,25,0.745035241,2
"FIN_004_MZB_LO_5","FIN_004_MZB_LO_5-23.09.2019","23.09.2019",2019,9,23,0.463993688,3
"FIN_004_MZB_LO_5","FIN_004_MZB_LO_5-21.09.2020","21.09.2020",2020,9,21,0.780062396,2
"FIN_004_MZB_LO_51","FIN_004_MZB_LO_51-20.09.1998","20.09.1998",1998,9,20,0.575414205,3
"FIN_004_MZB_LO_51","FIN_004_MZB_LO_51-21.10.2004","21.10.2004",2004,10,21,0.499605404,3
"FIN_004_MZB_LO_51","FIN_004_MZB_LO_51-02.10.2006","02.10.2006",2006,10,2,0.787181125,2
"FIN_004_MZB_LO_51","FIN_004_MZB_LO_51-27.09.2010","27.09.2010",2010,9,27,0.860623508,1
"FIN_004_MZB_LO_51","FIN_004_MZB_LO_51-19.10.2014","19.10.2014",2014,10,19,0.953523486,1
"FIN_004_MZB_LO_51","FIN_004_MZB_LO_51-18.10.2018","18.10.2018",2018,10,18,0.911314645,1
"FIN_004_MZB_LO_51","FIN_004_MZB_LO_51-05.10.2021","05.10.2021",2021,10,5,1.00001,1
"FIN_004_MZB_LO_53","FIN_004_MZB_LO_53-20.09.1998","20.09.1998",1998,9,20,0.493496326,3
"FIN_004_MZB_LO_53","FIN_004_MZB_LO_53-20.10.2004","20.10.2004",2004,10,20,0.361282912,4
"FIN_004_MZB_LO_53","FIN_004_MZB_LO_53-02.10.2006","02.10.2006",2006,10,2,0.80685,1
"FIN_004_MZB_LO_53","FIN_004_MZB_LO_53-28.09.2010","28.09.2010",2010,9,28,0.852719404,1
"FIN_004_MZB_LO_53","FIN_004_MZB_LO_53-20.10.2014","20.10.2014",2014,10,20,0.918804532,1
"FIN_004_MZB_LO_53","FIN_004_MZB_LO_53-18.10.2018","18.10.2018",2018,10,18,0.847455943,1
"FIN_004_MZB_LO_53","FIN_004_MZB_LO_53-05.10.2020","05.10.2020",2020,10,5,0.990032291,1
"FIN_004_MZB_LO_53","FIN_004_MZB_LO_53-04.10.2021","04.10.2021",2021,10,4,0.924955012,1
"FIN_004_MZB_LO_55","FIN_004_MZB_LO_55-29.10.2000","29.10.2000",2000,10,29,0.284024341,4
"FIN_004_MZB_LO_55","FIN_004_MZB_LO_55-01.10.2003","01.10.2003",2003,10,1,0.03741046,5
"FIN_004_MZB_LO_55","FIN_004_MZB_LO_55-29.09.2006","29.09.2006",2006,9,29,0.287375456,4
"FIN_004_MZB_LO_55","FIN_004_MZB_LO_55-08.10.2009","08.10.2009",2009,10,8,0.418863826,3
"FIN_004_MZB_LO_55","FIN_004_MZB_LO_55-02.10.2012","02.10.2012",2012,10,2,0.587919252,3
"FIN_004_MZB_LO_55","FIN_004_MZB_LO_55-11.10.2016","11.10.2016",2016,10,11,0.448947061,3
"FIN_004_MZB_LO_55","FIN_004_MZB_LO_55-28.09.2020","28.09.2020",2020,9,28,0.698330344,2
"FIN_004_MZB_LO_56","FIN_004_MZB_LO_56-28.09.1999","28.09.1999",1999,9,28,0.395768491,4
"FIN_004_MZB_LO_56","FIN_004_MZB_LO_56-30.10.2000","30.10.2000",2000,10,30,0.51951117,3
"FIN_004_MZB_LO_56","FIN_004_MZB_LO_56-01.10.2003","01.10.2003",2003,10,1,0.541884887,3
"FIN_004_MZB_LO_56","FIN_004_MZB_LO_56-29.09.2006","29.09.2006",2006,9,29,0.572834359,3
"FIN_004_MZB_LO_56","FIN_004_MZB_LO_56-05.10.2009","05.10.2009",2009,10,5,0.61077269,2
"FIN_004_MZB_LO_56","FIN_004_MZB_LO_56-04.10.2010","04.10.2010",2010,10,4,0.670088874,2
"FIN_004_MZB_LO_56","FIN_004_MZB_LO_56-02.10.2012","02.10.2012",2012,10,2,0.702860696,2
"FIN_004_MZB_LO_56","FIN_004_MZB_LO_56-11.10.2016","11.10.2016",2016,10,11,0.689124149,2
"FIN_004_MZB_LO_56","FIN_004_MZB_LO_56-28.09.2020","28.09.2020",2020,9,28,0.833336667,1
"FIN_004_MZB_LO_57","FIN_004_MZB_LO_57-29.09.2006","29.09.2006",2006,9,29,0.631122032,2
"FIN_004_MZB_LO_57","FIN_004_MZB_LO_57-06.10.2009","06.10.2009",2009,10,6,0.609176605,2
"FIN_004_MZB_LO_57","FIN_004_MZB_LO_57-03.10.2010","03.10.2010",2010,10,3,0.654989075,2
"FIN_004_MZB_LO_57","FIN_004_MZB_LO_57-03.10.2012","03.10.2012",2012,10,3,0.741983195,2
"FIN_004_MZB_LO_57","FIN_004_MZB_LO_57-02.11.2014","02.11.2014",2014,11,2,0.701303753,2
"FIN_004_MZB_LO_57","FIN_004_MZB_LO_57-27.09.2015","27.09.2015",2015,9,27,0.690896072,2
"FIN_004_MZB_LO_57","FIN_004_MZB_LO_57-11.10.2016","11.10.2016",2016,10,11,0.578506601,3
"FIN_004_MZB_LO_57","FIN_004_MZB_LO_57-15.10.2018","15.10.2018",2018,10,15,0.584855684,3
"FIN_004_MZB_LO_57","FIN_004_MZB_LO_57-28.09.2020","28.09.2020",2020,9,28,0.678894657,2
"FIN_004_MZB_LO_59","FIN_004_MZB_LO_59-29.10.2000","29.10.2000",2000,10,29,0.805255859,1
"FIN_004_MZB_LO_59","FIN_004_MZB_LO_59-01.10.2003","01.10.2003",2003,10,1,0.211770481,4
"FIN_004_MZB_LO_59","FIN_004_MZB_LO_59-01.10.2006","01.10.2006",2006,10,1,0.253800375,4
"FIN_004_MZB_LO_59","FIN_004_MZB_LO_59-06.10.2009","06.10.2009",2009,10,6,0.36512827,4
"FIN_004_MZB_LO_59","FIN_004_MZB_LO_59-07.10.2012","07.10.2012",2012,10,7,0.517694444,3
"FIN_004_MZB_LO_59","FIN_004_MZB_LO_59-05.10.2016","05.10.2016",2016,10,5,0.199751538,5
"FIN_004_MZB_LO_59","FIN_004_MZB_LO_59-27.09.2020","27.09.2020",2020,9,27,0.578836402,3
"FIN_004_MZB_LO_6","FIN_004_MZB_LO_6-05.09.2007","05.09.2007",2007,9,5,0.985191852,1
"FIN_004_MZB_LO_6","FIN_004_MZB_LO_6-03.11.2011","03.11.2011",2011,11,3,0.946739905,1
"FIN_004_MZB_LO_6","FIN_004_MZB_LO_6-27.09.2012","27.09.2012",2012,9,27,0.690222629,2
"FIN_004_MZB_LO_6","FIN_004_MZB_LO_6-17.09.2013","17.09.2013",2013,9,17,0.805225757,1
"FIN_004_MZB_LO_6","FIN_004_MZB_LO_6-18.09.2014","18.09.2014",2014,9,18,0.679037647,2
"FIN_004_MZB_LO_6","FIN_004_MZB_LO_6-07.10.2015","07.10.2015",2015,10,7,0.853506639,1
"FIN_004_MZB_LO_6","FIN_004_MZB_LO_6-20.10.2016","20.10.2016",2016,10,20,0.79172824,2
"FIN_004_MZB_LO_6","FIN_004_MZB_LO_6-26.09.2017","26.09.2017",2017,9,26,0.872981428,1
"FIN_004_MZB_LO_6","FIN_004_MZB_LO_6-26.09.2018","26.09.2018",2018,9,26,0.726654485,2
"FIN_004_MZB_LO_6","FIN_004_MZB_LO_6-30.10.2019","30.10.2019",2019,10,30,0.759021065,2
"FIN_004_MZB_LO_60","FIN_004_MZB_LO_60-29.10.2000","29.10.2000",2000,10,29,0.241353008,4
"FIN_004_MZB_LO_60","FIN_004_MZB_LO_60-30.09.2006","30.09.2006",2006,9,30,0.428110833,3
"FIN_004_MZB_LO_60","FIN_004_MZB_LO_60-06.10.2009","06.10.2009",2009,10,6,0.426678717,3
"FIN_004_MZB_LO_60","FIN_004_MZB_LO_60-17.10.2012","17.10.2012",2012,10,17,0.299217992,4
"FIN_004_MZB_LO_60","FIN_004_MZB_LO_60-06.10.2016","06.10.2016",2016,10,6,0.186616424,5
"FIN_004_MZB_LO_60","FIN_004_MZB_LO_60-18.10.2018","18.10.2018",2018,10,18,0.203470798,4
"FIN_004_MZB_LO_60","FIN_004_MZB_LO_60-27.09.2020","27.09.2020",2020,9,27,0.387106173,4
"FIN_004_MZB_LO_63","FIN_004_MZB_LO_63-12.09.2006","12.09.2006",2006,9,12,0.72248364,2
"FIN_004_MZB_LO_63","FIN_004_MZB_LO_63-17.09.2007","17.09.2007",2007,9,17,0.918521852,1
"FIN_004_MZB_LO_63","FIN_004_MZB_LO_63-02.09.2008","02.09.2008",2008,9,2,0.52202802,3
"FIN_004_MZB_LO_63","FIN_004_MZB_LO_63-05.10.2009","05.10.2009",2009,10,5,0.798185944,2
"FIN_004_MZB_LO_63","FIN_004_MZB_LO_63-13.10.2010","13.10.2010",2010,10,13,0.934918186,1
"FIN_004_MZB_LO_63","FIN_004_MZB_LO_63-19.10.2011","19.10.2011",2011,10,19,0.558421871,3
"FIN_004_MZB_LO_63","FIN_004_MZB_LO_63-20.09.2012","20.09.2012",2012,9,20,0.530396191,3
"FIN_004_MZB_LO_63","FIN_004_MZB_LO_63-26.09.2013","26.09.2013",2013,9,26,0.928328641,1
"FIN_004_MZB_LO_63","FIN_004_MZB_LO_63-24.11.2014","24.11.2014",2014,11,24,0.67454168,2
"FIN_004_MZB_LO_63","FIN_004_MZB_LO_63-01.10.2017","01.10.2017",2017,10,1,0.668296578,2
"FIN_004_MZB_LO_63","FIN_004_MZB_LO_63-02.09.2020","02.09.2020",2020,9,2,0.976855185,1
"FIN_004_MZB_LO_65","FIN_004_MZB_LO_65-03.10.2006","03.10.2006",2006,10,3,0.665354439,2
"FIN_004_MZB_LO_65","FIN_004_MZB_LO_65-01.09.2009","01.09.2009",2009,9,1,0.901061779,1
"FIN_004_MZB_LO_65","FIN_004_MZB_LO_65-09.09.2011","09.09.2011",2011,9,9,0.981054864,1
"FIN_004_MZB_LO_65","FIN_004_MZB_LO_65-24.09.2014","24.09.2014",2014,9,24,0.939906086,1
"FIN_004_MZB_LO_65","FIN_004_MZB_LO_65-07.09.2016","07.09.2016",2016,9,7,0.702738164,2
"FIN_004_MZB_LO_65","FIN_004_MZB_LO_65-24.09.2020","24.09.2020",2020,9,24,1.00001,1
"FIN_004_MZB_LO_65","FIN_004_MZB_LO_65-08.09.2021","08.09.2021",2021,9,8,0.920223425,1
"FIN_004_MZB_LO_66","FIN_004_MZB_LO_66-03.10.2006","03.10.2006",2006,10,3,0.911801345,1
"FIN_004_MZB_LO_66","FIN_004_MZB_LO_66-01.09.2009","01.09.2009",2009,9,1,0.981891961,1
"FIN_004_MZB_LO_66","FIN_004_MZB_LO_66-09.09.2011","09.09.2011",2011,9,9,0.948358991,1
"FIN_004_MZB_LO_66","FIN_004_MZB_LO_66-23.09.2014","23.09.2014",2014,9,23,0.831104275,1
"FIN_004_MZB_LO_66","FIN_004_MZB_LO_66-08.09.2016","08.09.2016",2016,9,8,0.90609006,1
"FIN_004_MZB_LO_66","FIN_004_MZB_LO_66-23.09.2020","23.09.2020",2020,9,23,1.00001,1
"FIN_004_MZB_LO_66","FIN_004_MZB_LO_66-08.09.2021","08.09.2021",2021,9,8,0.958039991,1
"FIN_004_MZB_LO_67","FIN_004_MZB_LO_67-03.10.2006","03.10.2006",2006,10,3,0.914782967,1
"FIN_004_MZB_LO_67","FIN_004_MZB_LO_67-02.09.2009","02.09.2009",2009,9,2,0.977558063,1
"FIN_004_MZB_LO_67","FIN_004_MZB_LO_67-09.09.2011","09.09.2011",2011,9,9,1.00001,1
"FIN_004_MZB_LO_67","FIN_004_MZB_LO_67-10.09.2014","10.09.2014",2014,9,10,0.849216808,1
"FIN_004_MZB_LO_67","FIN_004_MZB_LO_67-06.09.2016","06.09.2016",2016,9,6,0.876731109,1
"FIN_004_MZB_LO_67","FIN_004_MZB_LO_67-23.09.2020","23.09.2020",2020,9,23,0.937566585,1
"FIN_004_MZB_LO_67","FIN_004_MZB_LO_67-08.09.2021","08.09.2021",2021,9,8,0.703814999,2
"FIN_004_MZB_LO_69","FIN_004_MZB_LO_69-02.10.2006","02.10.2006",2006,10,2,0.816051169,1
"FIN_004_MZB_LO_69","FIN_004_MZB_LO_69-02.09.2009","02.09.2009",2009,9,2,0.944703455,1
"FIN_004_MZB_LO_69","FIN_004_MZB_LO_69-10.09.2011","10.09.2011",2011,9,10,0.959629586,1
"FIN_004_MZB_LO_69","FIN_004_MZB_LO_69-23.09.2014","23.09.2014",2014,9,23,0.915307519,1
"FIN_004_MZB_LO_69","FIN_004_MZB_LO_69-05.09.2016","05.09.2016",2016,9,5,0.858222392,1
"FIN_004_MZB_LO_69","FIN_004_MZB_LO_69-23.09.2020","23.09.2020",2020,9,23,0.939627394,1
"FIN_004_MZB_LO_69","FIN_004_MZB_LO_69-09.09.2021","09.09.2021",2021,9,9,0.88008278,1
"FIN_004_MZB_LO_8","FIN_004_MZB_LO_8-17.10.2007","17.10.2007",2007,10,17,0.776411026,2
"FIN_004_MZB_LO_8","FIN_004_MZB_LO_8-24.09.2008","24.09.2008",2008,9,24,0.731202548,2
"FIN_004_MZB_LO_8","FIN_004_MZB_LO_8-09.09.2009","09.09.2009",2009,9,9,0.716935619,2
"FIN_004_MZB_LO_8","FIN_004_MZB_LO_8-13.10.2010","13.10.2010",2010,10,13,0.811066539,1
"FIN_004_MZB_LO_8","FIN_004_MZB_LO_8-09.11.2011","09.11.2011",2011,11,9,0.703552386,2
"FIN_004_MZB_LO_8","FIN_004_MZB_LO_8-24.09.2013","24.09.2013",2013,9,24,0.558026677,3
"FIN_004_MZB_LO_8","FIN_004_MZB_LO_8-30.09.2014","30.09.2014",2014,9,30,0.447195016,3
"FIN_004_MZB_LO_8","FIN_004_MZB_LO_8-19.10.2015","19.10.2015",2015,10,19,0.635586817,2
"FIN_004_MZB_LO_8","FIN_004_MZB_LO_8-26.09.2016","26.09.2016",2016,9,26,0.696715226,2
"FIN_004_MZB_LO_8","FIN_004_MZB_LO_8-19.09.2017","19.09.2017",2017,9,19,0.628981911,2
"FIN_004_MZB_LO_8","FIN_004_MZB_LO_8-17.10.2018","17.10.2018",2018,10,17,0.748836866,2
"FIN_004_MZB_LO_8","FIN_004_MZB_LO_8-26.10.2020","26.10.2020",2020,10,26,0.831368808,1
"FIN_004_MZB_LO_9","FIN_004_MZB_LO_9-11.10.2006","11.10.2006",2006,10,11,0.688514358,2
"FIN_004_MZB_LO_9","FIN_004_MZB_LO_9-23.09.2009","23.09.2009",2009,9,23,0.455783869,3
"FIN_004_MZB_LO_9","FIN_004_MZB_LO_9-01.09.2010","01.09.2010",2010,9,1,0.693530058,2
"FIN_004_MZB_LO_9","FIN_004_MZB_LO_9-28.09.2011","28.09.2011",2011,9,28,0.7703971,2
"FIN_004_MZB_LO_9","FIN_004_MZB_LO_9-27.09.2012","27.09.2012",2012,9,27,0.805613341,1
"FIN_004_MZB_LO_9","FIN_004_MZB_LO_9-10.10.2013","10.10.2013",2013,10,10,0.795733063,2
"FIN_004_MZB_LO_9","FIN_004_MZB_LO_9-06.10.2014","06.10.2014",2014,10,6,0.73126598,2
"FIN_004_MZB_LO_9","FIN_004_MZB_LO_9-04.10.2015","04.10.2015",2015,10,4,0.764367744,2
"FIN_004_MZB_LO_9","FIN_004_MZB_LO_9-27.10.2016","27.10.2016",2016,10,27,0.709748144,2
"FIN_004_MZB_LO_9","FIN_004_MZB_LO_9-29.10.2017","29.10.2017",2017,10,29,0.843076786,1
"FIN_004_MZB_LO_9","FIN_004_MZB_LO_9-26.09.2018","26.09.2018",2018,9,26,0.757934655,2
"FIN_004_MZB_LO_96","FIN_004_MZB_LO_96-05.09.2007","05.09.2007",2007,9,5,0.989044363,1
"FIN_004_MZB_LO_96","FIN_004_MZB_LO_96-13.09.2010","13.09.2010",2010,9,13,1.00001,1
"FIN_004_MZB_LO_96","FIN_004_MZB_LO_96-26.09.2011","26.09.2011",2011,9,26,0.901453185,1
"FIN_004_MZB_LO_96","FIN_004_MZB_LO_96-16.09.2013","16.09.2013",2013,9,16,0.413559042,3
"FIN_004_MZB_LO_96","FIN_004_MZB_LO_96-29.09.2014","29.09.2014",2014,9,29,0.942098774,1
"FIN_004_MZB_LO_96","FIN_004_MZB_LO_96-15.10.2017","15.10.2017",2017,10,15,0.940576986,1
"FIN_004_MZB_LO_96","FIN_004_MZB_LO_96-15.10.2020","15.10.2020",2020,10,15,0.948786021,1
"FIN_004_MZB_LO_97","FIN_004_MZB_LO_97-20.09.1998","20.09.1998",1998,9,20,0.629458527,2
"FIN_004_MZB_LO_97","FIN_004_MZB_LO_97-20.10.2004","20.10.2004",2004,10,20,0.529064077,3
"FIN_004_MZB_LO_97","FIN_004_MZB_LO_97-01.10.2006","01.10.2006",2006,10,1,1.00001,1
"FIN_004_MZB_LO_97","FIN_004_MZB_LO_97-22.09.2010","22.09.2010",2010,9,22,0.929436036,1
"FIN_004_MZB_LO_97","FIN_004_MZB_LO_97-20.10.2014","20.10.2014",2014,10,20,0.932661914,1
"FIN_004_MZB_LO_97","FIN_004_MZB_LO_97-13.10.2016","13.10.2016",2016,10,13,1.00001,1
"FIN_004_MZB_LO_97","FIN_004_MZB_LO_97-19.10.2018","19.10.2018",2018,10,19,0.975221701,1
"FIN_004_MZB_LO_97","FIN_004_MZB_LO_97-18.09.2019","18.09.2019",2019,9,18,0.90299918,1
"FIN_004_MZB_LO_97","FIN_004_MZB_LO_97-05.10.2021","05.10.2021",2021,10,5,1.00001,1
"FIN_004_MZB_LO_98","FIN_004_MZB_LO_98-20.09.1998","20.09.1998",1998,9,20,0.473525818,3
"FIN_004_MZB_LO_98","FIN_004_MZB_LO_98-21.10.2004","21.10.2004",2004,10,21,0.197427397,5
"FIN_004_MZB_LO_98","FIN_004_MZB_LO_98-02.10.2007","02.10.2007",2007,10,2,0.594153184,3
"FIN_004_MZB_LO_98","FIN_004_MZB_LO_98-21.09.2010","21.09.2010",2010,9,21,0.456781683,3
"FIN_004_MZB_LO_98","FIN_004_MZB_LO_98-19.10.2014","19.10.2014",2014,10,19,0.575485356,3
"FIN_004_MZB_LO_98","FIN_004_MZB_LO_98-06.10.2016","06.10.2016",2016,10,6,0.544714092,3
"FIN_004_MZB_LO_98","FIN_004_MZB_LO_98-18.10.2018","18.10.2018",2018,10,18,0.295245577,4
"FIN_004_MZB_LO_98","FIN_004_MZB_LO_98-18.09.2019","18.09.2019",2019,9,18,0.507287923,3
"FIN_004_MZB_LO_98","FIN_004_MZB_LO_98-04.10.2021","04.10.2021",2021,10,4,0.862591089,1
"FIN_004_MZB_LO_99","FIN_004_MZB_LO_99-03.09.2007","03.09.2007",2007,9,3,0.765893833,2
"FIN_004_MZB_LO_99","FIN_004_MZB_LO_99-22.09.2009","22.09.2009",2009,9,22,0.784064539,2
"FIN_004_MZB_LO_99","FIN_004_MZB_LO_99-22.09.2010","22.09.2010",2010,9,22,0.77899406,2
"FIN_004_MZB_LO_99","FIN_004_MZB_LO_99-10.10.2011","10.10.2011",2011,10,10,0.840676178,1
"FIN_004_MZB_LO_99","FIN_004_MZB_LO_99-16.10.2012","16.10.2012",2012,10,16,0.666875204,2
"FIN_004_MZB_LO_99","FIN_004_MZB_LO_99-22.10.2013","22.10.2013",2013,10,22,0.8861686,1
"FIN_004_MZB_LO_99","FIN_004_MZB_LO_99-27.09.2016","27.09.2016",2016,9,27,0.764182368,2
"FIN_004_MZB_LO_99","FIN_004_MZB_LO_99-09.10.2019","09.10.2019",2019,10,9,0.966496432,1
