"Unique.ID","Samp.ID","Sampling.date","year","month","day","eqr","eqc"
"GER_018_MZB_LO_10","GER_018_MZB_LO_10-21.05.1986","21.05.1986",1986,5,21,0.68,2
"GER_018_MZB_LO_10","GER_018_MZB_LO_10-21.05.1987","21.05.1987",1987,5,21,0.74,2
"GER_018_MZB_LO_10","GER_018_MZB_LO_10-25.05.1988","25.05.1988",1988,5,25,0.616,2
"GER_018_MZB_LO_10","GER_018_MZB_LO_10-31.05.1989","31.05.1989",1989,5,31,0.689,2
"GER_018_MZB_LO_10","GER_018_MZB_LO_10-23.05.1990","23.05.1990",1990,5,23,0.741,2
"GER_018_MZB_LO_10","GER_018_MZB_LO_10-05.06.1991","05.06.1991",1991,6,5,0.76,2
"GER_018_MZB_LO_10","GER_018_MZB_LO_10-03.06.1992","03.06.1992",1992,6,3,0.642,2
"GER_018_MZB_LO_10","GER_018_MZB_LO_10-14.05.1993","14.05.1993",1993,5,14,0.664,2
"GER_018_MZB_LO_10","GER_018_MZB_LO_10-25.05.1994","25.05.1994",1994,5,25,0.53,3
"GER_018_MZB_LO_10","GER_018_MZB_LO_10-24.05.1995","24.05.1995",1995,5,24,0.822,2
"GER_018_MZB_LO_10","GER_018_MZB_LO_10-07.06.1996","07.06.1996",1996,6,7,0.807,2
"GER_018_MZB_LO_10","GER_018_MZB_LO_10-28.05.1997","28.05.1997",1997,5,28,0.65,2
"GER_018_MZB_LO_10","GER_018_MZB_LO_10-21.05.2008","21.05.2008",2008,5,21,0.85,2
"GER_018_MZB_LO_101","GER_018_MZB_LO_101-18.08.1983","18.08.1983",1983,8,18,0.071,5
"GER_018_MZB_LO_101","GER_018_MZB_LO_101-04.10.1985","04.10.1985",1985,10,4,0.047,5
"GER_018_MZB_LO_101","GER_018_MZB_LO_101-09.09.1986","09.09.1986",1986,9,9,0.064,5
"GER_018_MZB_LO_101","GER_018_MZB_LO_101-05.10.1987","05.10.1987",1987,10,5,0.001,5
"GER_018_MZB_LO_101","GER_018_MZB_LO_101-15.08.1988","15.08.1988",1988,8,15,0.02,5
"GER_018_MZB_LO_101","GER_018_MZB_LO_101-17.10.1989","17.10.1989",1989,10,17,0.043,5
"GER_018_MZB_LO_101","GER_018_MZB_LO_101-29.08.1991","29.08.1991",1991,8,29,0.001,5
"GER_018_MZB_LO_101","GER_018_MZB_LO_101-25.08.1992","25.08.1992",1992,8,25,0.001,5
"GER_018_MZB_LO_101","GER_018_MZB_LO_101-19.10.1995","19.10.1995",1995,10,19,0.001,5
"GER_018_MZB_LO_101","GER_018_MZB_LO_101-15.09.1999","15.09.1999",1999,9,15,0.001,5
"GER_018_MZB_LO_101","GER_018_MZB_LO_101-18.09.2000","18.09.2000",2000,9,18,0.006,5
"GER_018_MZB_LO_101","GER_018_MZB_LO_101-07.10.2003","07.10.2003",2003,10,7,0.001,5
"GER_018_MZB_LO_104","GER_018_MZB_LO_104-27.11.1996","27.11.1996",1996,11,27,0.73,2
"GER_018_MZB_LO_104","GER_018_MZB_LO_104-23.11.1997","23.11.1997",1997,11,23,0.883,2
"GER_018_MZB_LO_104","GER_018_MZB_LO_104-21.10.1999","21.10.1999",1999,10,21,0.87,2
"GER_018_MZB_LO_104","GER_018_MZB_LO_104-22.11.2000","22.11.2000",2000,11,22,0.958,2
"GER_018_MZB_LO_104","GER_018_MZB_LO_104-06.11.2001","06.11.2001",2001,11,6,0.907,2
"GER_018_MZB_LO_104","GER_018_MZB_LO_104-29.10.2002","29.10.2002",2002,10,29,0.869,2
"GER_018_MZB_LO_104","GER_018_MZB_LO_104-11.11.2003","11.11.2003",2003,11,11,0.856,2
"GER_018_MZB_LO_104","GER_018_MZB_LO_104-03.11.2004","03.11.2004",2004,11,3,0.795,2
"GER_018_MZB_LO_104","GER_018_MZB_LO_104-19.10.2005","19.10.2005",2005,10,19,0.801,2
"GER_018_MZB_LO_105","GER_018_MZB_LO_105-15.09.1995","15.09.1995",1995,9,15,0.661,4
"GER_018_MZB_LO_105","GER_018_MZB_LO_105-07.08.1996","07.08.1996",1996,8,7,0.941,5
"GER_018_MZB_LO_105","GER_018_MZB_LO_105-29.08.1997","29.08.1997",1997,8,29,0.588,5
"GER_018_MZB_LO_105","GER_018_MZB_LO_105-10.09.1998","10.09.1998",1998,9,10,0.975,5
"GER_018_MZB_LO_105","GER_018_MZB_LO_105-27.07.1999","27.07.1999",1999,7,27,0.864,4
"GER_018_MZB_LO_105","GER_018_MZB_LO_105-03.08.2000","03.08.2000",2000,8,3,0.684,3
"GER_018_MZB_LO_105","GER_018_MZB_LO_105-17.07.2001","17.07.2001",2001,7,17,0.677,5
"GER_018_MZB_LO_105","GER_018_MZB_LO_105-28.08.2002","28.08.2002",2002,8,28,0.706,4
"GER_018_MZB_LO_105","GER_018_MZB_LO_105-12.08.2003","12.08.2003",2003,8,12,0.675,5
"GER_018_MZB_LO_105","GER_018_MZB_LO_105-30.07.2004","30.07.2004",2004,7,30,0.874,4
"GER_018_MZB_LO_105","GER_018_MZB_LO_105-26.07.2005","26.07.2005",2005,7,26,0.933,5
"GER_018_MZB_LO_108","GER_018_MZB_LO_108-30.11.1982","30.11.1982",1982,11,30,0.001,5
"GER_018_MZB_LO_108","GER_018_MZB_LO_108-25.10.1983","25.10.1983",1983,10,25,0.25,4
"GER_018_MZB_LO_108","GER_018_MZB_LO_108-24.10.1985","24.10.1985",1985,10,24,0.131,5
"GER_018_MZB_LO_108","GER_018_MZB_LO_108-10.10.1988","10.10.1988",1988,10,10,0.052,5
"GER_018_MZB_LO_108","GER_018_MZB_LO_108-09.11.1989","09.11.1989",1989,11,9,0.033,5
"GER_018_MZB_LO_108","GER_018_MZB_LO_108-14.10.1991","14.10.1991",1991,10,14,0.001,5
"GER_018_MZB_LO_108","GER_018_MZB_LO_108-22.10.1992","22.10.1992",1992,10,22,0.029,5
"GER_018_MZB_LO_108","GER_018_MZB_LO_108-30.11.1993","30.11.1993",1993,11,30,0.047,5
"GER_018_MZB_LO_108","GER_018_MZB_LO_108-07.11.1995","07.11.1995",1995,11,7,0.069,5
"GER_018_MZB_LO_109","GER_018_MZB_LO_109-25.10.1983","25.10.1983",1983,10,25,0.133,5
"GER_018_MZB_LO_109","GER_018_MZB_LO_109-24.10.1985","24.10.1985",1985,10,24,0.266,4
"GER_018_MZB_LO_109","GER_018_MZB_LO_109-09.11.1988","09.11.1988",1988,11,9,0.079,5
"GER_018_MZB_LO_109","GER_018_MZB_LO_109-09.11.1989","09.11.1989",1989,11,9,0.073,5
"GER_018_MZB_LO_109","GER_018_MZB_LO_109-14.10.1991","14.10.1991",1991,10,14,0.253,4
"GER_018_MZB_LO_109","GER_018_MZB_LO_109-22.10.1992","22.10.1992",1992,10,22,0.185,5
"GER_018_MZB_LO_109","GER_018_MZB_LO_109-30.11.1993","30.11.1993",1993,11,30,0.245,4
"GER_018_MZB_LO_109","GER_018_MZB_LO_109-07.11.1995","07.11.1995",1995,11,7,0.621,2
"GER_018_MZB_LO_109","GER_018_MZB_LO_109-29.10.2003","29.10.2003",2003,10,29,0.61,2
"GER_018_MZB_LO_11","GER_018_MZB_LO_11-23.10.1988","23.10.1988",1988,10,23,0.955,3
"GER_018_MZB_LO_11","GER_018_MZB_LO_11-06.10.1994","06.10.1994",1994,10,6,0.822,2
"GER_018_MZB_LO_11","GER_018_MZB_LO_11-21.10.1999","21.10.1999",1999,10,21,0.811,2
"GER_018_MZB_LO_11","GER_018_MZB_LO_11-29.10.2002","29.10.2002",2002,10,29,0.908,2
"GER_018_MZB_LO_11","GER_018_MZB_LO_11-19.10.2005","19.10.2005",2005,10,19,0.81,2
"GER_018_MZB_LO_11","GER_018_MZB_LO_11-24.10.2007","24.10.2007",2007,10,24,0.908,2
"GER_018_MZB_LO_11","GER_018_MZB_LO_11-23.10.2008","23.10.2008",2008,10,23,0.556,3
"GER_018_MZB_LO_110","GER_018_MZB_LO_110-19.10.1982","19.10.1982",1982,10,19,0.068,5
"GER_018_MZB_LO_110","GER_018_MZB_LO_110-25.10.1983","25.10.1983",1983,10,25,0.228,4
"GER_018_MZB_LO_110","GER_018_MZB_LO_110-24.10.1985","24.10.1985",1985,10,24,0.324,4
"GER_018_MZB_LO_110","GER_018_MZB_LO_110-09.11.1988","09.11.1988",1988,11,9,0.277,4
"GER_018_MZB_LO_110","GER_018_MZB_LO_110-14.10.1991","14.10.1991",1991,10,14,0.214,4
"GER_018_MZB_LO_110","GER_018_MZB_LO_110-22.10.1992","22.10.1992",1992,10,22,0.085,5
"GER_018_MZB_LO_110","GER_018_MZB_LO_110-07.11.1995","07.11.1995",1995,11,7,0.652,2
"GER_018_MZB_LO_110","GER_018_MZB_LO_110-29.10.2003","29.10.2003",2003,10,29,0.503,3
"GER_018_MZB_LO_111","GER_018_MZB_LO_111-19.10.1982","19.10.1982",1982,10,19,0.07,5
"GER_018_MZB_LO_111","GER_018_MZB_LO_111-25.10.1983","25.10.1983",1983,10,25,0.103,5
"GER_018_MZB_LO_111","GER_018_MZB_LO_111-28.10.1985","28.10.1985",1985,10,28,0.359,4
"GER_018_MZB_LO_111","GER_018_MZB_LO_111-24.10.1989","24.10.1989",1989,10,24,0.215,4
"GER_018_MZB_LO_111","GER_018_MZB_LO_111-14.10.1991","14.10.1991",1991,10,14,0.209,4
"GER_018_MZB_LO_111","GER_018_MZB_LO_111-22.10.1992","22.10.1992",1992,10,22,0.138,5
"GER_018_MZB_LO_111","GER_018_MZB_LO_111-28.10.2003","28.10.2003",2003,10,28,0.149,5
"GER_018_MZB_LO_114","GER_018_MZB_LO_114-29.08.1986","29.08.1986",1986,8,29,0.001,5
"GER_018_MZB_LO_114","GER_018_MZB_LO_114-21.10.1988","21.10.1988",1988,10,21,0.001,5
"GER_018_MZB_LO_114","GER_018_MZB_LO_114-30.10.1991","30.10.1991",1991,10,30,0.032,5
"GER_018_MZB_LO_114","GER_018_MZB_LO_114-28.08.1992","28.08.1992",1992,8,28,0.003,5
"GER_018_MZB_LO_114","GER_018_MZB_LO_114-14.08.1996","14.08.1996",1996,8,14,0.067,5
"GER_018_MZB_LO_114","GER_018_MZB_LO_114-10.09.1997","10.09.1997",1997,9,10,0.041,5
"GER_018_MZB_LO_114","GER_018_MZB_LO_114-12.08.1999","12.08.1999",1999,8,12,0.043,5
"GER_018_MZB_LO_114","GER_018_MZB_LO_114-10.10.2000","10.10.2000",2000,10,10,0.09,5
"GER_018_MZB_LO_114","GER_018_MZB_LO_114-09.10.2001","09.10.2001",2001,10,9,0.059,5
"GER_018_MZB_LO_114","GER_018_MZB_LO_114-31.10.2002","31.10.2002",2002,10,31,0.067,5
"GER_018_MZB_LO_114","GER_018_MZB_LO_114-31.10.2003","31.10.2003",2003,10,31,0.022,5
"GER_018_MZB_LO_118","GER_018_MZB_LO_118-09.10.1985","09.10.1985",1985,10,9,0.037,5
"GER_018_MZB_LO_118","GER_018_MZB_LO_118-24.09.1987","24.09.1987",1987,9,24,0.021,5
"GER_018_MZB_LO_118","GER_018_MZB_LO_118-29.09.1988","29.09.1988",1988,9,29,0.001,5
"GER_018_MZB_LO_118","GER_018_MZB_LO_118-20.09.1990","20.09.1990",1990,9,20,0.087,5
"GER_018_MZB_LO_118","GER_018_MZB_LO_118-30.09.1992","30.09.1992",1992,9,30,0.191,5
"GER_018_MZB_LO_118","GER_018_MZB_LO_118-27.10.1994","27.10.1994",1994,10,27,0.229,4
"GER_018_MZB_LO_118","GER_018_MZB_LO_118-10.10.1995","10.10.1995",1995,10,10,0.047,5
"GER_018_MZB_LO_118","GER_018_MZB_LO_118-07.09.1999","07.09.1999",1999,9,7,0.001,5
"GER_018_MZB_LO_118","GER_018_MZB_LO_118-23.10.2003","23.10.2003",2003,10,23,0.001,5
"GER_018_MZB_LO_118","GER_018_MZB_LO_118-02.09.2004","02.09.2004",2004,9,2,0.001,5
"GER_018_MZB_LO_119","GER_018_MZB_LO_119-03.10.1985","03.10.1985",1985,10,3,0.118,5
"GER_018_MZB_LO_119","GER_018_MZB_LO_119-24.09.1987","24.09.1987",1987,9,24,0.02,5
"GER_018_MZB_LO_119","GER_018_MZB_LO_119-29.09.1988","29.09.1988",1988,9,29,0.016,5
"GER_018_MZB_LO_119","GER_018_MZB_LO_119-20.09.1990","20.09.1990",1990,9,20,0.001,5
"GER_018_MZB_LO_119","GER_018_MZB_LO_119-30.09.1992","30.09.1992",1992,9,30,0.001,5
"GER_018_MZB_LO_119","GER_018_MZB_LO_119-27.10.1994","27.10.1994",1994,10,27,0.001,5
"GER_018_MZB_LO_119","GER_018_MZB_LO_119-10.10.1995","10.10.1995",1995,10,10,0.001,5
"GER_018_MZB_LO_119","GER_018_MZB_LO_119-08.10.1996","08.10.1996",1996,10,8,0.001,5
"GER_018_MZB_LO_119","GER_018_MZB_LO_119-23.10.2003","23.10.2003",2003,10,23,0.07,5
"GER_018_MZB_LO_12","GER_018_MZB_LO_12-23.10.1988","23.10.1988",1988,10,23,1,3
"GER_018_MZB_LO_12","GER_018_MZB_LO_12-06.10.1994","06.10.1994",1994,10,6,0.926,2
"GER_018_MZB_LO_12","GER_018_MZB_LO_12-27.11.1996","27.11.1996",1996,11,27,0.984,5
"GER_018_MZB_LO_12","GER_018_MZB_LO_12-23.11.1997","23.11.1997",1997,11,23,0.943,3
"GER_018_MZB_LO_12","GER_018_MZB_LO_12-21.10.1999","21.10.1999",1999,10,21,0.96,3
"GER_018_MZB_LO_12","GER_018_MZB_LO_12-22.11.2000","22.11.2000",2000,11,22,0.875,3
"GER_018_MZB_LO_12","GER_018_MZB_LO_12-06.11.2001","06.11.2001",2001,11,6,1,3
"GER_018_MZB_LO_12","GER_018_MZB_LO_12-29.10.2002","29.10.2002",2002,10,29,0.991,4
"GER_018_MZB_LO_12","GER_018_MZB_LO_12-11.11.2003","11.11.2003",2003,11,11,0.996,3
"GER_018_MZB_LO_12","GER_018_MZB_LO_12-03.11.2004","03.11.2004",2004,11,3,0.911,3
"GER_018_MZB_LO_12","GER_018_MZB_LO_12-19.10.2005","19.10.2005",2005,10,19,0.748,4
"GER_018_MZB_LO_120","GER_018_MZB_LO_120-14.09.1982","14.09.1982",1982,9,14,0.113,5
"GER_018_MZB_LO_120","GER_018_MZB_LO_120-29.08.1984","29.08.1984",1984,8,29,0.001,5
"GER_018_MZB_LO_120","GER_018_MZB_LO_120-03.10.1985","03.10.1985",1985,10,3,0.001,5
"GER_018_MZB_LO_120","GER_018_MZB_LO_120-14.08.1986","14.08.1986",1986,8,14,0.001,5
"GER_018_MZB_LO_120","GER_018_MZB_LO_120-24.09.1987","24.09.1987",1987,9,24,0.001,5
"GER_018_MZB_LO_120","GER_018_MZB_LO_120-28.09.1988","28.09.1988",1988,9,28,0.001,5
"GER_018_MZB_LO_120","GER_018_MZB_LO_120-07.08.1989","07.08.1989",1989,8,7,0.001,5
"GER_018_MZB_LO_120","GER_018_MZB_LO_120-20.09.1990","20.09.1990",1990,9,20,0.026,5
"GER_018_MZB_LO_120","GER_018_MZB_LO_120-30.09.1992","30.09.1992",1992,9,30,0.333,4
"GER_018_MZB_LO_120","GER_018_MZB_LO_120-27.10.1994","27.10.1994",1994,10,27,0.001,5
"GER_018_MZB_LO_120","GER_018_MZB_LO_120-19.10.1995","19.10.1995",1995,10,19,0.113,5
"GER_018_MZB_LO_120","GER_018_MZB_LO_120-08.10.1996","08.10.1996",1996,10,8,0.001,5
"GER_018_MZB_LO_120","GER_018_MZB_LO_120-23.10.2003","23.10.2003",2003,10,23,0.001,5
"GER_018_MZB_LO_121","GER_018_MZB_LO_121-14.09.1982","14.09.1982",1982,9,14,0.001,5
"GER_018_MZB_LO_121","GER_018_MZB_LO_121-17.10.1984","17.10.1984",1984,10,17,0.001,5
"GER_018_MZB_LO_121","GER_018_MZB_LO_121-03.10.1985","03.10.1985",1985,10,3,0.167,5
"GER_018_MZB_LO_121","GER_018_MZB_LO_121-14.08.1986","14.08.1986",1986,8,14,0.019,5
"GER_018_MZB_LO_121","GER_018_MZB_LO_121-07.10.1987","07.10.1987",1987,10,7,0.001,5
"GER_018_MZB_LO_121","GER_018_MZB_LO_121-28.09.1988","28.09.1988",1988,9,28,0.056,5
"GER_018_MZB_LO_121","GER_018_MZB_LO_121-07.08.1989","07.08.1989",1989,8,7,0.001,5
"GER_018_MZB_LO_121","GER_018_MZB_LO_121-19.09.1990","19.09.1990",1990,9,19,0.036,5
"GER_018_MZB_LO_121","GER_018_MZB_LO_121-21.10.1992","21.10.1992",1992,10,21,0.001,5
"GER_018_MZB_LO_121","GER_018_MZB_LO_121-05.10.1993","05.10.1993",1993,10,5,0.001,5
"GER_018_MZB_LO_121","GER_018_MZB_LO_121-18.10.2003","18.10.2003",2003,10,18,0.038,5
"GER_018_MZB_LO_122","GER_018_MZB_LO_122-14.09.1982","14.09.1982",1982,9,14,0.001,5
"GER_018_MZB_LO_122","GER_018_MZB_LO_122-03.10.1985","03.10.1985",1985,10,3,0.001,5
"GER_018_MZB_LO_122","GER_018_MZB_LO_122-24.09.1987","24.09.1987",1987,9,24,0.037,5
"GER_018_MZB_LO_122","GER_018_MZB_LO_122-28.09.1988","28.09.1988",1988,9,28,0.003,5
"GER_018_MZB_LO_122","GER_018_MZB_LO_122-20.09.1990","20.09.1990",1990,9,20,0.001,5
"GER_018_MZB_LO_122","GER_018_MZB_LO_122-30.09.1992","30.09.1992",1992,9,30,0.001,5
"GER_018_MZB_LO_122","GER_018_MZB_LO_122-27.10.1994","27.10.1994",1994,10,27,0.001,5
"GER_018_MZB_LO_122","GER_018_MZB_LO_122-07.09.1999","07.09.1999",1999,9,7,0.053,5
"GER_018_MZB_LO_122","GER_018_MZB_LO_122-12.09.2002","12.09.2002",2002,9,12,0.001,5
"GER_018_MZB_LO_122","GER_018_MZB_LO_122-23.10.2003","23.10.2003",2003,10,23,0.001,5
"GER_018_MZB_LO_123","GER_018_MZB_LO_123-22.09.1983","22.09.1983",1983,9,22,0.105,5
"GER_018_MZB_LO_123","GER_018_MZB_LO_123-26.10.1988","26.10.1988",1988,10,26,0.001,5
"GER_018_MZB_LO_123","GER_018_MZB_LO_123-25.08.1992","25.08.1992",1992,8,25,0.001,5
"GER_018_MZB_LO_123","GER_018_MZB_LO_123-14.09.1993","14.09.1993",1993,9,14,0.001,5
"GER_018_MZB_LO_123","GER_018_MZB_LO_123-19.10.1994","19.10.1994",1994,10,19,0.001,5
"GER_018_MZB_LO_123","GER_018_MZB_LO_123-17.09.1998","17.09.1998",1998,9,17,0.001,5
"GER_018_MZB_LO_123","GER_018_MZB_LO_123-16.09.1999","16.09.1999",1999,9,16,0.001,5
"GER_018_MZB_LO_123","GER_018_MZB_LO_123-12.09.2002","12.09.2002",2002,9,12,0.001,5
"GER_018_MZB_LO_123","GER_018_MZB_LO_123-23.10.2003","23.10.2003",2003,10,23,0.001,5
"GER_018_MZB_LO_123","GER_018_MZB_LO_123-10.08.2004","10.08.2004",2004,8,10,0.001,5
"GER_018_MZB_LO_124","GER_018_MZB_LO_124-22.09.1983","22.09.1983",1983,9,22,0.052,5
"GER_018_MZB_LO_124","GER_018_MZB_LO_124-26.10.1988","26.10.1988",1988,10,26,0.091,5
"GER_018_MZB_LO_124","GER_018_MZB_LO_124-20.09.1990","20.09.1990",1990,9,20,0.042,5
"GER_018_MZB_LO_124","GER_018_MZB_LO_124-25.08.1992","25.08.1992",1992,8,25,0.012,5
"GER_018_MZB_LO_124","GER_018_MZB_LO_124-19.10.1994","19.10.1994",1994,10,19,0.001,5
"GER_018_MZB_LO_124","GER_018_MZB_LO_124-08.10.1996","08.10.1996",1996,10,8,0.016,5
"GER_018_MZB_LO_124","GER_018_MZB_LO_124-07.09.1999","07.09.1999",1999,9,7,0.001,5
"GER_018_MZB_LO_124","GER_018_MZB_LO_124-22.08.2000","22.08.2000",2000,8,22,0.033,5
"GER_018_MZB_LO_124","GER_018_MZB_LO_124-12.09.2002","12.09.2002",2002,9,12,0.001,5
"GER_018_MZB_LO_124","GER_018_MZB_LO_124-09.09.2003","09.09.2003",2003,9,9,0.086,5
"GER_018_MZB_LO_124","GER_018_MZB_LO_124-10.08.2004","10.08.2004",2004,8,10,0.008,5
"GER_018_MZB_LO_125","GER_018_MZB_LO_125-22.09.1983","22.09.1983",1983,9,22,0.041,5
"GER_018_MZB_LO_125","GER_018_MZB_LO_125-26.10.1988","26.10.1988",1988,10,26,0.159,5
"GER_018_MZB_LO_125","GER_018_MZB_LO_125-20.09.1990","20.09.1990",1990,9,20,0.041,5
"GER_018_MZB_LO_125","GER_018_MZB_LO_125-22.09.1992","22.09.1992",1992,9,22,0.014,5
"GER_018_MZB_LO_125","GER_018_MZB_LO_125-14.09.1993","14.09.1993",1993,9,14,0.014,5
"GER_018_MZB_LO_125","GER_018_MZB_LO_125-19.10.1994","19.10.1994",1994,10,19,0.001,5
"GER_018_MZB_LO_125","GER_018_MZB_LO_125-17.09.1998","17.09.1998",1998,9,17,0.001,5
"GER_018_MZB_LO_125","GER_018_MZB_LO_125-16.09.1999","16.09.1999",1999,9,16,0.001,5
"GER_018_MZB_LO_125","GER_018_MZB_LO_125-12.09.2002","12.09.2002",2002,9,12,0.001,5
"GER_018_MZB_LO_125","GER_018_MZB_LO_125-23.10.2003","23.10.2003",2003,10,23,0.001,5
"GER_018_MZB_LO_126","GER_018_MZB_LO_126-14.09.1982","14.09.1982",1982,9,14,0.041,5
"GER_018_MZB_LO_126","GER_018_MZB_LO_126-03.10.1985","03.10.1985",1985,10,3,0.001,5
"GER_018_MZB_LO_126","GER_018_MZB_LO_126-07.10.1987","07.10.1987",1987,10,7,0.001,5
"GER_018_MZB_LO_126","GER_018_MZB_LO_126-28.09.1988","28.09.1988",1988,9,28,0.001,5
"GER_018_MZB_LO_126","GER_018_MZB_LO_126-20.09.1990","20.09.1990",1990,9,20,0.001,5
"GER_018_MZB_LO_126","GER_018_MZB_LO_126-03.09.1992","03.09.1992",1992,9,3,0.001,5
"GER_018_MZB_LO_126","GER_018_MZB_LO_126-27.10.1994","27.10.1994",1994,10,27,0.001,5
"GER_018_MZB_LO_126","GER_018_MZB_LO_126-07.09.1999","07.09.1999",1999,9,7,0.014,5
"GER_018_MZB_LO_126","GER_018_MZB_LO_126-12.09.2002","12.09.2002",2002,9,12,0.001,5
"GER_018_MZB_LO_127","GER_018_MZB_LO_127-14.09.1982","14.09.1982",1982,9,14,0.001,5
"GER_018_MZB_LO_127","GER_018_MZB_LO_127-09.10.1985","09.10.1985",1985,10,9,0.157,5
"GER_018_MZB_LO_127","GER_018_MZB_LO_127-14.08.1986","14.08.1986",1986,8,14,0.001,5
"GER_018_MZB_LO_127","GER_018_MZB_LO_127-07.10.1987","07.10.1987",1987,10,7,0.038,5
"GER_018_MZB_LO_127","GER_018_MZB_LO_127-29.09.1988","29.09.1988",1988,9,29,0.023,5
"GER_018_MZB_LO_127","GER_018_MZB_LO_127-19.09.1990","19.09.1990",1990,9,19,0.001,5
"GER_018_MZB_LO_127","GER_018_MZB_LO_127-21.10.1992","21.10.1992",1992,10,21,0.001,5
"GER_018_MZB_LO_127","GER_018_MZB_LO_127-27.10.1994","27.10.1994",1994,10,27,0.09,5
"GER_018_MZB_LO_127","GER_018_MZB_LO_127-19.10.1995","19.10.1995",1995,10,19,0.001,5
"GER_018_MZB_LO_127","GER_018_MZB_LO_127-08.10.1996","08.10.1996",1996,10,8,0.001,5
"GER_018_MZB_LO_127","GER_018_MZB_LO_127-27.09.1997","27.09.1997",1997,9,27,0.038,5
"GER_018_MZB_LO_127","GER_018_MZB_LO_127-07.09.1999","07.09.1999",1999,9,7,0.001,5
"GER_018_MZB_LO_127","GER_018_MZB_LO_127-22.08.2000","22.08.2000",2000,8,22,0.058,5
"GER_018_MZB_LO_127","GER_018_MZB_LO_127-24.10.2003","24.10.2003",2003,10,24,0.001,5
"GER_018_MZB_LO_128","GER_018_MZB_LO_128-14.09.1982","14.09.1982",1982,9,14,0.001,5
"GER_018_MZB_LO_128","GER_018_MZB_LO_128-09.10.1985","09.10.1985",1985,10,9,0.167,5
"GER_018_MZB_LO_128","GER_018_MZB_LO_128-14.08.1986","14.08.1986",1986,8,14,0.001,5
"GER_018_MZB_LO_128","GER_018_MZB_LO_128-07.10.1987","07.10.1987",1987,10,7,0.001,5
"GER_018_MZB_LO_128","GER_018_MZB_LO_128-29.09.1988","29.09.1988",1988,9,29,0.008,5
"GER_018_MZB_LO_128","GER_018_MZB_LO_128-19.09.1990","19.09.1990",1990,9,19,0.001,5
"GER_018_MZB_LO_128","GER_018_MZB_LO_128-21.10.1992","21.10.1992",1992,10,21,0.001,5
"GER_018_MZB_LO_128","GER_018_MZB_LO_128-27.10.1994","27.10.1994",1994,10,27,0.001,5
"GER_018_MZB_LO_128","GER_018_MZB_LO_128-19.10.1995","19.10.1995",1995,10,19,0.003,5
"GER_018_MZB_LO_128","GER_018_MZB_LO_128-08.10.1996","08.10.1996",1996,10,8,0.001,5
"GER_018_MZB_LO_128","GER_018_MZB_LO_128-16.09.1997","16.09.1997",1997,9,16,0.001,5
"GER_018_MZB_LO_128","GER_018_MZB_LO_128-07.09.1999","07.09.1999",1999,9,7,0.001,5
"GER_018_MZB_LO_128","GER_018_MZB_LO_128-22.08.2000","22.08.2000",2000,8,22,0.026,5
"GER_018_MZB_LO_128","GER_018_MZB_LO_128-24.10.2003","24.10.2003",2003,10,24,0.022,5
"GER_018_MZB_LO_129","GER_018_MZB_LO_129-14.09.1982","14.09.1982",1982,9,14,0.001,5
"GER_018_MZB_LO_129","GER_018_MZB_LO_129-03.10.1985","03.10.1985",1985,10,3,0.088,5
"GER_018_MZB_LO_129","GER_018_MZB_LO_129-07.08.1986","07.08.1986",1986,8,7,0.101,5
"GER_018_MZB_LO_129","GER_018_MZB_LO_129-30.09.1987","30.09.1987",1987,9,30,0.001,5
"GER_018_MZB_LO_129","GER_018_MZB_LO_129-28.09.1988","28.09.1988",1988,9,28,0.001,5
"GER_018_MZB_LO_129","GER_018_MZB_LO_129-12.09.1989","12.09.1989",1989,9,12,0.034,5
"GER_018_MZB_LO_129","GER_018_MZB_LO_129-19.09.1990","19.09.1990",1990,9,19,0.001,5
"GER_018_MZB_LO_129","GER_018_MZB_LO_129-17.10.1991","17.10.1991",1991,10,17,0.066,5
"GER_018_MZB_LO_129","GER_018_MZB_LO_129-21.10.1992","21.10.1992",1992,10,21,0.001,5
"GER_018_MZB_LO_129","GER_018_MZB_LO_129-27.09.1997","27.09.1997",1997,9,27,0.001,5
"GER_018_MZB_LO_129","GER_018_MZB_LO_129-21.09.1999","21.09.1999",1999,9,21,0.047,5
"GER_018_MZB_LO_129","GER_018_MZB_LO_129-17.10.2003","17.10.2003",2003,10,17,0.033,5
"GER_018_MZB_LO_130","GER_018_MZB_LO_130-14.09.1982","14.09.1982",1982,9,14,0.023,5
"GER_018_MZB_LO_130","GER_018_MZB_LO_130-09.10.1985","09.10.1985",1985,10,9,0.167,5
"GER_018_MZB_LO_130","GER_018_MZB_LO_130-07.08.1986","07.08.1986",1986,8,7,0.101,5
"GER_018_MZB_LO_130","GER_018_MZB_LO_130-16.09.1987","16.09.1987",1987,9,16,0.027,5
"GER_018_MZB_LO_130","GER_018_MZB_LO_130-28.09.1988","28.09.1988",1988,9,28,0.038,5
"GER_018_MZB_LO_130","GER_018_MZB_LO_130-19.09.1990","19.09.1990",1990,9,19,0.001,5
"GER_018_MZB_LO_130","GER_018_MZB_LO_130-17.10.1991","17.10.1991",1991,10,17,0.001,5
"GER_018_MZB_LO_130","GER_018_MZB_LO_130-29.09.1997","29.09.1997",1997,9,29,0.001,5
"GER_018_MZB_LO_130","GER_018_MZB_LO_130-21.09.1999","21.09.1999",1999,9,21,0.05,5
"GER_018_MZB_LO_130","GER_018_MZB_LO_130-17.10.2003","17.10.2003",2003,10,17,0.001,5
"GER_018_MZB_LO_131","GER_018_MZB_LO_131-14.09.1982","14.09.1982",1982,9,14,0.001,5
"GER_018_MZB_LO_131","GER_018_MZB_LO_131-09.10.1985","09.10.1985",1985,10,9,0.001,5
"GER_018_MZB_LO_131","GER_018_MZB_LO_131-07.08.1986","07.08.1986",1986,8,7,0.001,5
"GER_018_MZB_LO_131","GER_018_MZB_LO_131-30.09.1987","30.09.1987",1987,9,30,0.001,5
"GER_018_MZB_LO_131","GER_018_MZB_LO_131-28.09.1988","28.09.1988",1988,9,28,0.053,5
"GER_018_MZB_LO_131","GER_018_MZB_LO_131-27.08.1990","27.08.1990",1990,8,27,0.009,5
"GER_018_MZB_LO_131","GER_018_MZB_LO_131-17.10.1991","17.10.1991",1991,10,17,0.001,5
"GER_018_MZB_LO_131","GER_018_MZB_LO_131-24.10.1995","24.10.1995",1995,10,24,0.001,5
"GER_018_MZB_LO_131","GER_018_MZB_LO_131-30.10.1996","30.10.1996",1996,10,30,0.001,5
"GER_018_MZB_LO_131","GER_018_MZB_LO_131-21.09.1999","21.09.1999",1999,9,21,0.001,5
"GER_018_MZB_LO_131","GER_018_MZB_LO_131-17.10.2003","17.10.2003",2003,10,17,0.004,5
"GER_018_MZB_LO_132","GER_018_MZB_LO_132-14.09.1982","14.09.1982",1982,9,14,0.001,5
"GER_018_MZB_LO_132","GER_018_MZB_LO_132-03.10.1985","03.10.1985",1985,10,3,0.016,5
"GER_018_MZB_LO_132","GER_018_MZB_LO_132-07.08.1986","07.08.1986",1986,8,7,0.028,5
"GER_018_MZB_LO_132","GER_018_MZB_LO_132-30.09.1987","30.09.1987",1987,9,30,0.029,5
"GER_018_MZB_LO_132","GER_018_MZB_LO_132-21.09.1988","21.09.1988",1988,9,21,0.095,5
"GER_018_MZB_LO_132","GER_018_MZB_LO_132-27.08.1990","27.08.1990",1990,8,27,0.001,5
"GER_018_MZB_LO_132","GER_018_MZB_LO_132-17.10.1991","17.10.1991",1991,10,17,0.001,5
"GER_018_MZB_LO_132","GER_018_MZB_LO_132-24.10.1995","24.10.1995",1995,10,24,0.001,5
"GER_018_MZB_LO_132","GER_018_MZB_LO_132-30.10.1996","30.10.1996",1996,10,30,0.001,5
"GER_018_MZB_LO_132","GER_018_MZB_LO_132-21.09.1999","21.09.1999",1999,9,21,0.001,5
"GER_018_MZB_LO_133","GER_018_MZB_LO_133-14.09.1982","14.09.1982",1982,9,14,0.063,5
"GER_018_MZB_LO_133","GER_018_MZB_LO_133-26.09.1985","26.09.1985",1985,9,26,0.07,5
"GER_018_MZB_LO_133","GER_018_MZB_LO_133-06.08.1986","06.08.1986",1986,8,6,0.008,5
"GER_018_MZB_LO_133","GER_018_MZB_LO_133-30.09.1987","30.09.1987",1987,9,30,0.001,5
"GER_018_MZB_LO_133","GER_018_MZB_LO_133-21.09.1988","21.09.1988",1988,9,21,0.017,5
"GER_018_MZB_LO_133","GER_018_MZB_LO_133-27.08.1990","27.08.1990",1990,8,27,0.001,5
"GER_018_MZB_LO_133","GER_018_MZB_LO_133-17.10.1991","17.10.1991",1991,10,17,0.001,5
"GER_018_MZB_LO_133","GER_018_MZB_LO_133-27.10.1992","27.10.1992",1992,10,27,0.001,5
"GER_018_MZB_LO_134","GER_018_MZB_LO_134-14.09.1982","14.09.1982",1982,9,14,0.021,5
"GER_018_MZB_LO_134","GER_018_MZB_LO_134-26.09.1985","26.09.1985",1985,9,26,0.012,5
"GER_018_MZB_LO_134","GER_018_MZB_LO_134-06.08.1986","06.08.1986",1986,8,6,0.001,5
"GER_018_MZB_LO_134","GER_018_MZB_LO_134-30.09.1987","30.09.1987",1987,9,30,0.03,5
"GER_018_MZB_LO_134","GER_018_MZB_LO_134-21.09.1988","21.09.1988",1988,9,21,0.043,5
"GER_018_MZB_LO_134","GER_018_MZB_LO_134-27.08.1990","27.08.1990",1990,8,27,0.001,5
"GER_018_MZB_LO_134","GER_018_MZB_LO_134-17.10.1991","17.10.1991",1991,10,17,0.022,5
"GER_018_MZB_LO_134","GER_018_MZB_LO_134-27.10.1992","27.10.1992",1992,10,27,0.019,5
"GER_018_MZB_LO_134","GER_018_MZB_LO_134-24.10.1995","24.10.1995",1995,10,24,0.001,5
"GER_018_MZB_LO_134","GER_018_MZB_LO_134-30.10.1996","30.10.1996",1996,10,30,0.01,5
"GER_018_MZB_LO_135","GER_018_MZB_LO_135-14.09.1982","14.09.1982",1982,9,14,0.001,5
"GER_018_MZB_LO_135","GER_018_MZB_LO_135-26.09.1985","26.09.1985",1985,9,26,0.001,5
"GER_018_MZB_LO_135","GER_018_MZB_LO_135-17.09.1987","17.09.1987",1987,9,17,0.033,5
"GER_018_MZB_LO_135","GER_018_MZB_LO_135-21.09.1988","21.09.1988",1988,9,21,0.057,5
"GER_018_MZB_LO_135","GER_018_MZB_LO_135-15.10.1991","15.10.1991",1991,10,15,0.001,5
"GER_018_MZB_LO_135","GER_018_MZB_LO_135-02.11.1994","02.11.1994",1994,11,2,0.001,5
"GER_018_MZB_LO_135","GER_018_MZB_LO_135-14.11.1996","14.11.1996",1996,11,14,0.001,5
"GER_018_MZB_LO_135","GER_018_MZB_LO_135-16.11.1999","16.11.1999",1999,11,16,0.072,5
"GER_018_MZB_LO_135","GER_018_MZB_LO_135-17.10.2003","17.10.2003",2003,10,17,0.001,5
"GER_018_MZB_LO_136","GER_018_MZB_LO_136-14.09.1982","14.09.1982",1982,9,14,0.004,5
"GER_018_MZB_LO_136","GER_018_MZB_LO_136-26.09.1985","26.09.1985",1985,9,26,0.008,5
"GER_018_MZB_LO_136","GER_018_MZB_LO_136-06.08.1986","06.08.1986",1986,8,6,0.001,5
"GER_018_MZB_LO_136","GER_018_MZB_LO_136-17.09.1987","17.09.1987",1987,9,17,0.001,5
"GER_018_MZB_LO_136","GER_018_MZB_LO_136-21.09.1988","21.09.1988",1988,9,21,0.001,5
"GER_018_MZB_LO_136","GER_018_MZB_LO_136-23.08.1990","23.08.1990",1990,8,23,0.001,5
"GER_018_MZB_LO_136","GER_018_MZB_LO_136-15.10.1991","15.10.1991",1991,10,15,0.001,5
"GER_018_MZB_LO_136","GER_018_MZB_LO_136-03.09.1992","03.09.1992",1992,9,3,0.001,5
"GER_018_MZB_LO_136","GER_018_MZB_LO_136-31.10.1996","31.10.1996",1996,10,31,0.001,5
"GER_018_MZB_LO_136","GER_018_MZB_LO_136-17.10.2003","17.10.2003",2003,10,17,0.001,5
"GER_018_MZB_LO_137","GER_018_MZB_LO_137-14.09.1982","14.09.1982",1982,9,14,0.001,5
"GER_018_MZB_LO_137","GER_018_MZB_LO_137-09.10.1985","09.10.1985",1985,10,9,0.026,5
"GER_018_MZB_LO_137","GER_018_MZB_LO_137-07.08.1986","07.08.1986",1986,8,7,0.041,5
"GER_018_MZB_LO_137","GER_018_MZB_LO_137-17.09.1987","17.09.1987",1987,9,17,0.001,5
"GER_018_MZB_LO_137","GER_018_MZB_LO_137-16.09.1988","16.09.1988",1988,9,16,0.001,5
"GER_018_MZB_LO_137","GER_018_MZB_LO_137-23.08.1990","23.08.1990",1990,8,23,0.039,5
"GER_018_MZB_LO_137","GER_018_MZB_LO_137-15.10.1991","15.10.1991",1991,10,15,0.001,5
"GER_018_MZB_LO_137","GER_018_MZB_LO_137-31.08.1993","31.08.1993",1993,8,31,0.001,5
"GER_018_MZB_LO_137","GER_018_MZB_LO_137-12.10.1995","12.10.1995",1995,10,12,0.001,5
"GER_018_MZB_LO_137","GER_018_MZB_LO_137-30.10.1996","30.10.1996",1996,10,30,0.001,5
"GER_018_MZB_LO_137","GER_018_MZB_LO_137-23.09.1997","23.09.1997",1997,9,23,0.001,5
"GER_018_MZB_LO_137","GER_018_MZB_LO_137-02.09.1999","02.09.1999",1999,9,2,0.001,5
"GER_018_MZB_LO_138","GER_018_MZB_LO_138-14.09.1982","14.09.1982",1982,9,14,0.001,5
"GER_018_MZB_LO_138","GER_018_MZB_LO_138-26.09.1985","26.09.1985",1985,9,26,0.001,5
"GER_018_MZB_LO_138","GER_018_MZB_LO_138-06.08.1986","06.08.1986",1986,8,6,0.041,5
"GER_018_MZB_LO_138","GER_018_MZB_LO_138-17.09.1987","17.09.1987",1987,9,17,0.001,5
"GER_018_MZB_LO_138","GER_018_MZB_LO_138-16.09.1988","16.09.1988",1988,9,16,0.001,5
"GER_018_MZB_LO_138","GER_018_MZB_LO_138-23.08.1990","23.08.1990",1990,8,23,0.001,5
"GER_018_MZB_LO_138","GER_018_MZB_LO_138-15.10.1991","15.10.1991",1991,10,15,0.001,5
"GER_018_MZB_LO_138","GER_018_MZB_LO_138-23.10.1992","23.10.1992",1992,10,23,0.001,5
"GER_018_MZB_LO_138","GER_018_MZB_LO_138-31.08.1993","31.08.1993",1993,8,31,0.001,5
"GER_018_MZB_LO_138","GER_018_MZB_LO_138-23.09.1997","23.09.1997",1997,9,23,0.001,5
"GER_018_MZB_LO_138","GER_018_MZB_LO_138-02.09.1999","02.09.1999",1999,9,2,0.001,5
"GER_018_MZB_LO_139","GER_018_MZB_LO_139-14.09.1982","14.09.1982",1982,9,14,0.001,5
"GER_018_MZB_LO_139","GER_018_MZB_LO_139-26.09.1985","26.09.1985",1985,9,26,0.04,5
"GER_018_MZB_LO_139","GER_018_MZB_LO_139-06.08.1986","06.08.1986",1986,8,6,0.001,5
"GER_018_MZB_LO_139","GER_018_MZB_LO_139-17.09.1987","17.09.1987",1987,9,17,0.001,5
"GER_018_MZB_LO_139","GER_018_MZB_LO_139-16.09.1988","16.09.1988",1988,9,16,0.041,5
"GER_018_MZB_LO_139","GER_018_MZB_LO_139-23.08.1990","23.08.1990",1990,8,23,0.001,5
"GER_018_MZB_LO_139","GER_018_MZB_LO_139-15.10.1991","15.10.1991",1991,10,15,0.001,5
"GER_018_MZB_LO_139","GER_018_MZB_LO_139-23.10.1992","23.10.1992",1992,10,23,0.001,5
"GER_018_MZB_LO_139","GER_018_MZB_LO_139-31.08.1993","31.08.1993",1993,8,31,0.001,5
"GER_018_MZB_LO_139","GER_018_MZB_LO_139-22.09.1994","22.09.1994",1994,9,22,0.001,5
"GER_018_MZB_LO_139","GER_018_MZB_LO_139-12.10.1995","12.10.1995",1995,10,12,0.001,5
"GER_018_MZB_LO_139","GER_018_MZB_LO_139-30.10.1996","30.10.1996",1996,10,30,0.001,5
"GER_018_MZB_LO_139","GER_018_MZB_LO_139-02.09.1999","02.09.1999",1999,9,2,0.018,5
"GER_018_MZB_LO_139","GER_018_MZB_LO_139-17.10.2003","17.10.2003",2003,10,17,0.001,5
"GER_018_MZB_LO_140","GER_018_MZB_LO_140-14.09.1982","14.09.1982",1982,9,14,0.042,5
"GER_018_MZB_LO_140","GER_018_MZB_LO_140-26.09.1985","26.09.1985",1985,9,26,0.072,5
"GER_018_MZB_LO_140","GER_018_MZB_LO_140-17.09.1987","17.09.1987",1987,9,17,0.001,5
"GER_018_MZB_LO_140","GER_018_MZB_LO_140-16.09.1988","16.09.1988",1988,9,16,0.001,5
"GER_018_MZB_LO_140","GER_018_MZB_LO_140-15.10.1991","15.10.1991",1991,10,15,0.001,5
"GER_018_MZB_LO_140","GER_018_MZB_LO_140-23.10.1992","23.10.1992",1992,10,23,0.001,5
"GER_018_MZB_LO_140","GER_018_MZB_LO_140-02.09.1999","02.09.1999",1999,9,2,0.001,5
"GER_018_MZB_LO_140","GER_018_MZB_LO_140-16.10.2003","16.10.2003",2003,10,16,0.01,5
"GER_018_MZB_LO_142","GER_018_MZB_LO_142-24.11.1988","24.11.1988",1988,11,24,0.033,5
"GER_018_MZB_LO_142","GER_018_MZB_LO_142-10.11.1993","10.11.1993",1993,11,10,0.009,5
"GER_018_MZB_LO_142","GER_018_MZB_LO_142-24.11.1994","24.11.1994",1994,11,24,0.001,5
"GER_018_MZB_LO_142","GER_018_MZB_LO_142-05.11.1997","05.11.1997",1997,11,5,0.001,5
"GER_018_MZB_LO_142","GER_018_MZB_LO_142-16.11.1999","16.11.1999",1999,11,16,0.001,5
"GER_018_MZB_LO_142","GER_018_MZB_LO_142-06.11.2001","06.11.2001",2001,11,6,0.012,5
"GER_018_MZB_LO_142","GER_018_MZB_LO_142-15.10.2003","15.10.2003",2003,10,15,0.145,5
"GER_018_MZB_LO_145","GER_018_MZB_LO_145-08.09.1983","08.09.1983",1983,9,8,0.002,5
"GER_018_MZB_LO_145","GER_018_MZB_LO_145-18.09.1985","18.09.1985",1985,9,18,0.001,5
"GER_018_MZB_LO_145","GER_018_MZB_LO_145-13.08.1998","13.08.1998",1998,8,13,0.152,5
"GER_018_MZB_LO_145","GER_018_MZB_LO_145-09.09.1999","09.09.1999",1999,9,9,0.031,5
"GER_018_MZB_LO_145","GER_018_MZB_LO_145-20.09.2000","20.09.2000",2000,9,20,0.024,5
"GER_018_MZB_LO_145","GER_018_MZB_LO_145-08.09.2005","08.09.2005",2005,9,8,0.503,3
"GER_018_MZB_LO_145","GER_018_MZB_LO_145-14.09.2009","14.09.2009",2009,9,14,0.409,3
"GER_018_MZB_LO_145","GER_018_MZB_LO_145-03.08.2012","03.08.2012",2012,8,3,0.487,3
"GER_018_MZB_LO_148","GER_018_MZB_LO_148-16.10.1971","16.10.1971",1971,10,16,0.04,5
"GER_018_MZB_LO_148","GER_018_MZB_LO_148-29.09.1972","29.09.1972",1972,9,29,0.04,5
"GER_018_MZB_LO_148","GER_018_MZB_LO_148-10.09.1973","10.09.1973",1973,9,10,0.001,5
"GER_018_MZB_LO_148","GER_018_MZB_LO_148-10.10.1974","10.10.1974",1974,10,10,0.119,5
"GER_018_MZB_LO_148","GER_018_MZB_LO_148-24.10.1977","24.10.1977",1977,10,24,0.096,5
"GER_018_MZB_LO_148","GER_018_MZB_LO_148-23.10.1978","23.10.1978",1978,10,23,0.493,3
"GER_018_MZB_LO_148","GER_018_MZB_LO_148-22.09.1979","22.09.1979",1979,9,22,0.268,4
"GER_018_MZB_LO_148","GER_018_MZB_LO_148-15.08.1980","15.08.1980",1980,8,15,0.22,4
"GER_018_MZB_LO_148","GER_018_MZB_LO_148-16.09.1982","16.09.1982",1982,9,16,0.014,5
"GER_018_MZB_LO_148","GER_018_MZB_LO_148-11.08.1983","11.08.1983",1983,8,11,0.014,5
"GER_018_MZB_LO_148","GER_018_MZB_LO_148-06.09.1984","06.09.1984",1984,9,6,0.014,5
"GER_018_MZB_LO_148","GER_018_MZB_LO_148-08.08.1985","08.08.1985",1985,8,8,0.177,5
"GER_018_MZB_LO_148","GER_018_MZB_LO_148-14.09.1988","14.09.1988",1988,9,14,0.014,5
"GER_018_MZB_LO_148","GER_018_MZB_LO_148-03.09.1991","03.09.1991",1991,9,3,0.033,5
"GER_018_MZB_LO_148","GER_018_MZB_LO_148-02.09.1992","02.09.1992",1992,9,2,0.028,5
"GER_018_MZB_LO_148","GER_018_MZB_LO_148-10.08.1995","10.08.1995",1995,8,10,0.046,5
"GER_018_MZB_LO_148","GER_018_MZB_LO_148-26.09.1997","26.09.1997",1997,9,26,0.014,5
"GER_018_MZB_LO_148","GER_018_MZB_LO_148-20.08.1998","20.08.1998",1998,8,20,0.066,5
"GER_018_MZB_LO_148","GER_018_MZB_LO_148-09.09.1999","09.09.1999",1999,9,9,0.08,5
"GER_018_MZB_LO_148","GER_018_MZB_LO_148-01.10.2003","01.10.2003",2003,10,1,0.014,5
"GER_018_MZB_LO_148","GER_018_MZB_LO_148-07.08.2004","07.08.2004",2004,8,7,0.156,5
"GER_018_MZB_LO_148","GER_018_MZB_LO_148-03.08.2005","03.08.2005",2005,8,3,0.001,5
"GER_018_MZB_LO_148","GER_018_MZB_LO_148-08.08.2007","08.08.2007",2007,8,8,0.092,5
"GER_018_MZB_LO_151","GER_018_MZB_LO_151-16.10.1985","16.10.1985",1985,10,16,0.068,5
"GER_018_MZB_LO_151","GER_018_MZB_LO_151-22.11.1988","22.11.1988",1988,11,22,0.045,5
"GER_018_MZB_LO_151","GER_018_MZB_LO_151-14.11.1989","14.11.1989",1989,11,14,0.059,5
"GER_018_MZB_LO_151","GER_018_MZB_LO_151-08.11.1990","08.11.1990",1990,11,8,0.047,5
"GER_018_MZB_LO_151","GER_018_MZB_LO_151-07.11.1991","07.11.1991",1991,11,7,0.043,5
"GER_018_MZB_LO_151","GER_018_MZB_LO_151-01.09.1992","01.09.1992",1992,9,1,0.073,5
"GER_018_MZB_LO_151","GER_018_MZB_LO_151-25.11.1993","25.11.1993",1993,11,25,0.131,5
"GER_018_MZB_LO_151","GER_018_MZB_LO_151-26.10.1995","26.10.1995",1995,10,26,0.155,5
"GER_018_MZB_LO_151","GER_018_MZB_LO_151-25.09.2000","25.09.2000",2000,9,25,0.44,3
"GER_018_MZB_LO_151","GER_018_MZB_LO_151-01.10.2003","01.10.2003",2003,10,1,0.677,2
"GER_018_MZB_LO_152","GER_018_MZB_LO_152-18.08.1983","18.08.1983",1983,8,18,0.001,5
"GER_018_MZB_LO_152","GER_018_MZB_LO_152-11.10.1985","11.10.1985",1985,10,11,0.013,5
"GER_018_MZB_LO_152","GER_018_MZB_LO_152-12.09.1986","12.09.1986",1986,9,12,0.044,5
"GER_018_MZB_LO_152","GER_018_MZB_LO_152-09.10.1989","09.10.1989",1989,10,9,0.001,5
"GER_018_MZB_LO_152","GER_018_MZB_LO_152-28.09.1994","28.09.1994",1994,9,28,0.008,5
"GER_018_MZB_LO_152","GER_018_MZB_LO_152-21.08.1995","21.08.1995",1995,8,21,0.003,5
"GER_018_MZB_LO_152","GER_018_MZB_LO_152-11.09.1996","11.09.1996",1996,9,11,0.009,5
"GER_018_MZB_LO_152","GER_018_MZB_LO_152-10.09.1998","10.09.1998",1998,9,10,0.001,5
"GER_018_MZB_LO_152","GER_018_MZB_LO_152-26.08.1999","26.08.1999",1999,8,26,0.009,5
"GER_018_MZB_LO_152","GER_018_MZB_LO_152-03.08.2000","03.08.2000",2000,8,3,0.006,5
"GER_018_MZB_LO_152","GER_018_MZB_LO_152-14.10.2003","14.10.2003",2003,10,14,0.055,5
"GER_018_MZB_LO_19","GER_018_MZB_LO_19-14.09.1982","14.09.1982",1982,9,14,0.067,5
"GER_018_MZB_LO_19","GER_018_MZB_LO_19-03.10.1985","03.10.1985",1985,10,3,0.022,5
"GER_018_MZB_LO_19","GER_018_MZB_LO_19-14.08.1986","14.08.1986",1986,8,14,0.011,5
"GER_018_MZB_LO_19","GER_018_MZB_LO_19-07.10.1987","07.10.1987",1987,10,7,0.001,5
"GER_018_MZB_LO_19","GER_018_MZB_LO_19-28.09.1988","28.09.1988",1988,9,28,0.022,5
"GER_018_MZB_LO_19","GER_018_MZB_LO_19-07.08.1989","07.08.1989",1989,8,7,0.041,5
"GER_018_MZB_LO_19","GER_018_MZB_LO_19-19.09.1990","19.09.1990",1990,9,19,0.04,5
"GER_018_MZB_LO_19","GER_018_MZB_LO_19-21.10.1992","21.10.1992",1992,10,21,0.001,5
"GER_018_MZB_LO_19","GER_018_MZB_LO_19-05.10.1993","05.10.1993",1993,10,5,0.001,5
"GER_018_MZB_LO_19","GER_018_MZB_LO_19-27.10.1994","27.10.1994",1994,10,27,0.001,5
"GER_018_MZB_LO_19","GER_018_MZB_LO_19-19.10.1995","19.10.1995",1995,10,19,0.001,5
"GER_018_MZB_LO_20","GER_018_MZB_LO_20-14.09.1982","14.09.1982",1982,9,14,0.001,5
"GER_018_MZB_LO_20","GER_018_MZB_LO_20-03.10.1985","03.10.1985",1985,10,3,0.167,5
"GER_018_MZB_LO_20","GER_018_MZB_LO_20-07.08.1986","07.08.1986",1986,8,7,0.114,5
"GER_018_MZB_LO_20","GER_018_MZB_LO_20-07.10.1987","07.10.1987",1987,10,7,0.113,5
"GER_018_MZB_LO_20","GER_018_MZB_LO_20-28.09.1988","28.09.1988",1988,9,28,0.078,5
"GER_018_MZB_LO_20","GER_018_MZB_LO_20-07.08.1989","07.08.1989",1989,8,7,0.083,5
"GER_018_MZB_LO_20","GER_018_MZB_LO_20-19.09.1990","19.09.1990",1990,9,19,0.001,5
"GER_018_MZB_LO_20","GER_018_MZB_LO_20-21.10.1992","21.10.1992",1992,10,21,0.001,5
"GER_018_MZB_LO_20","GER_018_MZB_LO_20-29.09.1997","29.09.1997",1997,9,29,0.001,5
"GER_018_MZB_LO_20","GER_018_MZB_LO_20-24.10.2003","24.10.2003",2003,10,24,0.023,5
"GER_018_MZB_LO_21","GER_018_MZB_LO_21-14.09.1982","14.09.1982",1982,9,14,0.044,5
"GER_018_MZB_LO_21","GER_018_MZB_LO_21-03.10.1985","03.10.1985",1985,10,3,0.059,5
"GER_018_MZB_LO_21","GER_018_MZB_LO_21-07.08.1986","07.08.1986",1986,8,7,0.043,5
"GER_018_MZB_LO_21","GER_018_MZB_LO_21-30.09.1987","30.09.1987",1987,9,30,0.044,5
"GER_018_MZB_LO_21","GER_018_MZB_LO_21-28.09.1988","28.09.1988",1988,9,28,0.004,5
"GER_018_MZB_LO_21","GER_018_MZB_LO_21-19.09.1990","19.09.1990",1990,9,19,0.001,5
"GER_018_MZB_LO_21","GER_018_MZB_LO_21-21.09.1999","21.09.1999",1999,9,21,0.001,5
"GER_018_MZB_LO_21","GER_018_MZB_LO_21-17.10.2003","17.10.2003",2003,10,17,0.001,5
"GER_018_MZB_LO_22","GER_018_MZB_LO_22-14.09.1982","14.09.1982",1982,9,14,0.039,5
"GER_018_MZB_LO_22","GER_018_MZB_LO_22-09.10.1985","09.10.1985",1985,10,9,0.054,5
"GER_018_MZB_LO_22","GER_018_MZB_LO_22-07.08.1986","07.08.1986",1986,8,7,0.048,5
"GER_018_MZB_LO_22","GER_018_MZB_LO_22-30.09.1987","30.09.1987",1987,9,30,0.001,5
"GER_018_MZB_LO_22","GER_018_MZB_LO_22-28.09.1988","28.09.1988",1988,9,28,0.03,5
"GER_018_MZB_LO_22","GER_018_MZB_LO_22-27.08.1990","27.08.1990",1990,8,27,0.001,5
"GER_018_MZB_LO_22","GER_018_MZB_LO_22-17.10.1991","17.10.1991",1991,10,17,0.003,5
"GER_018_MZB_LO_22","GER_018_MZB_LO_22-27.10.1992","27.10.1992",1992,10,27,0.001,5
"GER_018_MZB_LO_22","GER_018_MZB_LO_22-24.10.1995","24.10.1995",1995,10,24,0.001,5
"GER_018_MZB_LO_22","GER_018_MZB_LO_22-21.09.1999","21.09.1999",1999,9,21,0.001,5
"GER_018_MZB_LO_23","GER_018_MZB_LO_23-14.09.1982","14.09.1982",1982,9,14,0.03,5
"GER_018_MZB_LO_23","GER_018_MZB_LO_23-03.10.1985","03.10.1985",1985,10,3,0.002,5
"GER_018_MZB_LO_23","GER_018_MZB_LO_23-07.08.1986","07.08.1986",1986,8,7,0.007,5
"GER_018_MZB_LO_23","GER_018_MZB_LO_23-30.09.1987","30.09.1987",1987,9,30,0.001,5
"GER_018_MZB_LO_23","GER_018_MZB_LO_23-21.09.1988","21.09.1988",1988,9,21,0.036,5
"GER_018_MZB_LO_23","GER_018_MZB_LO_23-27.08.1990","27.08.1990",1990,8,27,0.001,5
"GER_018_MZB_LO_23","GER_018_MZB_LO_23-17.10.1991","17.10.1991",1991,10,17,0.001,5
"GER_018_MZB_LO_23","GER_018_MZB_LO_23-27.10.1992","27.10.1992",1992,10,27,0.001,5
"GER_018_MZB_LO_23","GER_018_MZB_LO_23-21.09.1999","21.09.1999",1999,9,21,0.042,5
"GER_018_MZB_LO_24","GER_018_MZB_LO_24-14.09.1982","14.09.1982",1982,9,14,0.001,5
"GER_018_MZB_LO_24","GER_018_MZB_LO_24-09.10.1985","09.10.1985",1985,10,9,0.036,5
"GER_018_MZB_LO_24","GER_018_MZB_LO_24-06.08.1986","06.08.1986",1986,8,6,0.04,5
"GER_018_MZB_LO_24","GER_018_MZB_LO_24-17.09.1987","17.09.1987",1987,9,17,0.001,5
"GER_018_MZB_LO_24","GER_018_MZB_LO_24-16.09.1988","16.09.1988",1988,9,16,0.001,5
"GER_018_MZB_LO_24","GER_018_MZB_LO_24-23.08.1990","23.08.1990",1990,8,23,0.001,5
"GER_018_MZB_LO_24","GER_018_MZB_LO_24-15.10.1991","15.10.1991",1991,10,15,0.001,5
"GER_018_MZB_LO_24","GER_018_MZB_LO_24-23.10.1992","23.10.1992",1992,10,23,0.001,5
"GER_018_MZB_LO_24","GER_018_MZB_LO_24-31.08.1993","31.08.1993",1993,8,31,0.001,5
"GER_018_MZB_LO_24","GER_018_MZB_LO_24-12.10.1995","12.10.1995",1995,10,12,0.001,5
"GER_018_MZB_LO_24","GER_018_MZB_LO_24-30.10.1996","30.10.1996",1996,10,30,0.035,5
"GER_018_MZB_LO_24","GER_018_MZB_LO_24-02.09.1999","02.09.1999",1999,9,2,0.012,5
"GER_018_MZB_LO_25","GER_018_MZB_LO_25-14.09.1982","14.09.1982",1982,9,14,0.001,5
"GER_018_MZB_LO_25","GER_018_MZB_LO_25-26.09.1985","26.09.1985",1985,9,26,0.078,5
"GER_018_MZB_LO_25","GER_018_MZB_LO_25-06.08.1986","06.08.1986",1986,8,6,0.001,5
"GER_018_MZB_LO_25","GER_018_MZB_LO_25-17.09.1987","17.09.1987",1987,9,17,0.11,5
"GER_018_MZB_LO_25","GER_018_MZB_LO_25-16.09.1988","16.09.1988",1988,9,16,0.001,5
"GER_018_MZB_LO_25","GER_018_MZB_LO_25-23.08.1990","23.08.1990",1990,8,23,0.001,5
"GER_018_MZB_LO_25","GER_018_MZB_LO_25-15.10.1991","15.10.1991",1991,10,15,0.001,5
"GER_018_MZB_LO_25","GER_018_MZB_LO_25-23.10.1992","23.10.1992",1992,10,23,0.001,5
"GER_018_MZB_LO_25","GER_018_MZB_LO_25-31.08.1993","31.08.1993",1993,8,31,0.001,5
"GER_018_MZB_LO_25","GER_018_MZB_LO_25-22.09.1994","22.09.1994",1994,9,22,0.001,5
"GER_018_MZB_LO_25","GER_018_MZB_LO_25-02.09.1999","02.09.1999",1999,9,2,0.001,5
"GER_018_MZB_LO_25","GER_018_MZB_LO_25-17.10.2003","17.10.2003",2003,10,17,0.014,5
"GER_018_MZB_LO_26","GER_018_MZB_LO_26-14.09.1982","14.09.1982",1982,9,14,0.001,5
"GER_018_MZB_LO_26","GER_018_MZB_LO_26-26.09.1985","26.09.1985",1985,9,26,0.011,5
"GER_018_MZB_LO_26","GER_018_MZB_LO_26-17.09.1987","17.09.1987",1987,9,17,0.001,5
"GER_018_MZB_LO_26","GER_018_MZB_LO_26-16.09.1988","16.09.1988",1988,9,16,0.001,5
"GER_018_MZB_LO_26","GER_018_MZB_LO_26-15.10.1991","15.10.1991",1991,10,15,0.001,5
"GER_018_MZB_LO_26","GER_018_MZB_LO_26-23.10.1992","23.10.1992",1992,10,23,0.001,5
"GER_018_MZB_LO_26","GER_018_MZB_LO_26-02.09.1999","02.09.1999",1999,9,2,0.001,5
"GER_018_MZB_LO_26","GER_018_MZB_LO_26-16.10.2003","16.10.2003",2003,10,16,0.001,5
"GER_018_MZB_LO_27","GER_018_MZB_LO_27-05.06.1986","05.06.1986",1986,6,5,0.579,3
"GER_018_MZB_LO_27","GER_018_MZB_LO_27-18.06.1987","18.06.1987",1987,6,18,0.832,2
"GER_018_MZB_LO_27","GER_018_MZB_LO_27-21.06.1988","21.06.1988",1988,6,21,0.703,2
"GER_018_MZB_LO_27","GER_018_MZB_LO_27-21.07.1989","21.07.1989",1989,7,21,0.622,2
"GER_018_MZB_LO_27","GER_018_MZB_LO_27-19.06.1990","19.06.1990",1990,6,19,0.578,3
"GER_018_MZB_LO_27","GER_018_MZB_LO_27-14.06.1991","14.06.1991",1991,6,14,0.538,3
"GER_018_MZB_LO_27","GER_018_MZB_LO_27-08.06.1994","08.06.1994",1994,6,8,0.613,2
"GER_018_MZB_LO_27","GER_018_MZB_LO_27-08.06.1995","08.06.1995",1995,6,8,0.62,2
"GER_018_MZB_LO_27","GER_018_MZB_LO_27-05.06.1996","05.06.1996",1996,6,5,0.554,3
"GER_018_MZB_LO_27","GER_018_MZB_LO_27-16.07.1997","16.07.1997",1997,7,16,0.481,3
"GER_018_MZB_LO_27","GER_018_MZB_LO_27-29.06.2000","29.06.2000",2000,6,29,0.506,3
"GER_018_MZB_LO_27","GER_018_MZB_LO_27-23.06.2005","23.06.2005",2005,6,23,0.908,2
"GER_018_MZB_LO_28","GER_018_MZB_LO_28-25.06.1986","25.06.1986",1986,6,25,0.024,5
"GER_018_MZB_LO_28","GER_018_MZB_LO_28-03.07.1987","03.07.1987",1987,7,3,0.061,5
"GER_018_MZB_LO_28","GER_018_MZB_LO_28-08.07.1988","08.07.1988",1988,7,8,0.089,5
"GER_018_MZB_LO_28","GER_018_MZB_LO_28-27.07.1989","27.07.1989",1989,7,27,0.001,5
"GER_018_MZB_LO_28","GER_018_MZB_LO_28-27.06.1990","27.06.1990",1990,6,27,0.048,5
"GER_018_MZB_LO_28","GER_018_MZB_LO_28-23.07.1991","23.07.1991",1991,7,23,0.075,5
"GER_018_MZB_LO_28","GER_018_MZB_LO_28-18.06.1992","18.06.1992",1992,6,18,0.001,5
"GER_018_MZB_LO_28","GER_018_MZB_LO_28-01.06.1993","01.06.1993",1993,6,1,0.092,5
"GER_018_MZB_LO_28","GER_018_MZB_LO_28-07.06.1994","07.06.1994",1994,6,7,0.084,5
"GER_018_MZB_LO_28","GER_018_MZB_LO_28-15.06.1995","15.06.1995",1995,6,15,0.074,5
"GER_018_MZB_LO_28","GER_018_MZB_LO_28-10.07.1997","10.07.1997",1997,7,10,0.13,5
"GER_018_MZB_LO_29","GER_018_MZB_LO_29-03.06.1986","03.06.1986",1986,6,3,0.588,3
"GER_018_MZB_LO_29","GER_018_MZB_LO_29-10.06.1987","10.06.1987",1987,6,10,0.561,3
"GER_018_MZB_LO_29","GER_018_MZB_LO_29-21.06.1988","21.06.1988",1988,6,21,0.655,2
"GER_018_MZB_LO_29","GER_018_MZB_LO_29-15.06.1989","15.06.1989",1989,6,15,0.666,2
"GER_018_MZB_LO_29","GER_018_MZB_LO_29-13.06.1990","13.06.1990",1990,6,13,0.68,2
"GER_018_MZB_LO_29","GER_018_MZB_LO_29-13.06.1991","13.06.1991",1991,6,13,0.544,3
"GER_018_MZB_LO_29","GER_018_MZB_LO_29-09.07.1992","09.07.1992",1992,7,9,0.374,4
"GER_018_MZB_LO_29","GER_018_MZB_LO_29-02.06.1994","02.06.1994",1994,6,2,0.521,3
"GER_018_MZB_LO_29","GER_018_MZB_LO_29-07.06.1995","07.06.1995",1995,6,7,0.553,3
"GER_018_MZB_LO_29","GER_018_MZB_LO_29-06.06.1996","06.06.1996",1996,6,6,0.427,3
"GER_018_MZB_LO_30","GER_018_MZB_LO_30-10.06.1987","10.06.1987",1987,6,10,0.595,3
"GER_018_MZB_LO_30","GER_018_MZB_LO_30-16.06.1988","16.06.1988",1988,6,16,0.738,2
"GER_018_MZB_LO_30","GER_018_MZB_LO_30-06.06.1989","06.06.1989",1989,6,6,0.675,2
"GER_018_MZB_LO_30","GER_018_MZB_LO_30-13.06.1990","13.06.1990",1990,6,13,0.675,2
"GER_018_MZB_LO_30","GER_018_MZB_LO_30-13.06.1991","13.06.1991",1991,6,13,0.499,3
"GER_018_MZB_LO_30","GER_018_MZB_LO_30-09.07.1992","09.07.1992",1992,7,9,0.336,4
"GER_018_MZB_LO_30","GER_018_MZB_LO_30-07.06.1995","07.06.1995",1995,6,7,0.335,4
"GER_018_MZB_LO_30","GER_018_MZB_LO_30-06.06.1996","06.06.1996",1996,6,6,0.525,3
"GER_018_MZB_LO_30","GER_018_MZB_LO_30-31.08.2005","31.08.2005",2005,8,31,0.026,5
"GER_018_MZB_LO_31","GER_018_MZB_LO_31-03.06.1987","03.06.1987",1987,6,3,0.614,2
"GER_018_MZB_LO_31","GER_018_MZB_LO_31-16.06.1988","16.06.1988",1988,6,16,0.389,4
"GER_018_MZB_LO_31","GER_018_MZB_LO_31-06.06.1989","06.06.1989",1989,6,6,0.266,4
"GER_018_MZB_LO_31","GER_018_MZB_LO_31-11.06.1991","11.06.1991",1991,6,11,0.538,3
"GER_018_MZB_LO_31","GER_018_MZB_LO_31-17.07.1992","17.07.1992",1992,7,17,0.34,4
"GER_018_MZB_LO_31","GER_018_MZB_LO_31-16.06.1995","16.06.1995",1995,6,16,0.389,4
"GER_018_MZB_LO_31","GER_018_MZB_LO_31-09.07.1996","09.07.1996",1996,7,9,0.441,3
"GER_018_MZB_LO_31","GER_018_MZB_LO_31-22.06.2004","22.06.2004",2004,6,22,0.466,3
"GER_018_MZB_LO_32","GER_018_MZB_LO_32-14.05.1986","14.05.1986",1986,5,14,0.854,2
"GER_018_MZB_LO_32","GER_018_MZB_LO_32-12.05.1987","12.05.1987",1987,5,12,0.835,2
"GER_018_MZB_LO_32","GER_018_MZB_LO_32-26.05.1988","26.05.1988",1988,5,26,0.881,2
"GER_018_MZB_LO_32","GER_018_MZB_LO_32-30.05.1989","30.05.1989",1989,5,30,0.831,2
"GER_018_MZB_LO_32","GER_018_MZB_LO_32-07.06.1990","07.06.1990",1990,6,7,0.872,2
"GER_018_MZB_LO_32","GER_018_MZB_LO_32-06.06.1991","06.06.1991",1991,6,6,0.863,2
"GER_018_MZB_LO_32","GER_018_MZB_LO_32-27.05.1992","27.05.1992",1992,5,27,0.865,2
"GER_018_MZB_LO_32","GER_018_MZB_LO_32-18.05.1993","18.05.1993",1993,5,18,0.867,2
"GER_018_MZB_LO_32","GER_018_MZB_LO_32-25.05.1994","25.05.1994",1994,5,25,0.719,2
"GER_018_MZB_LO_32","GER_018_MZB_LO_32-08.06.1995","08.06.1995",1995,6,8,0.758,2
"GER_018_MZB_LO_32","GER_018_MZB_LO_32-14.06.1996","14.06.1996",1996,6,14,0.89,2
"GER_018_MZB_LO_32","GER_018_MZB_LO_32-11.07.1997","11.07.1997",1997,7,11,0.634,2
"GER_018_MZB_LO_32","GER_018_MZB_LO_32-21.06.2006","21.06.2006",2006,6,21,0.897,2
"GER_018_MZB_LO_34","GER_018_MZB_LO_34-24.06.1986","24.06.1986",1986,6,24,0.152,5
"GER_018_MZB_LO_34","GER_018_MZB_LO_34-30.06.1987","30.06.1987",1987,6,30,0.153,5
"GER_018_MZB_LO_34","GER_018_MZB_LO_34-26.07.1989","26.07.1989",1989,7,26,0.076,5
"GER_018_MZB_LO_34","GER_018_MZB_LO_34-26.06.1990","26.06.1990",1990,6,26,0.109,5
"GER_018_MZB_LO_34","GER_018_MZB_LO_34-02.07.1992","02.07.1992",1992,7,2,0.214,4
"GER_018_MZB_LO_34","GER_018_MZB_LO_34-14.06.1995","14.06.1995",1995,6,14,0.127,5
"GER_018_MZB_LO_34","GER_018_MZB_LO_34-09.07.1997","09.07.1997",1997,7,9,0.127,5
"GER_018_MZB_LO_35","GER_018_MZB_LO_35-19.08.1988","19.08.1988",1988,8,19,0.001,5
"GER_018_MZB_LO_35","GER_018_MZB_LO_35-22.08.1991","22.08.1991",1991,8,22,0.001,5
"GER_018_MZB_LO_35","GER_018_MZB_LO_35-08.09.1992","08.09.1992",1992,9,8,0.001,5
"GER_018_MZB_LO_35","GER_018_MZB_LO_35-09.09.1993","09.09.1993",1993,9,9,0.01,5
"GER_018_MZB_LO_35","GER_018_MZB_LO_35-30.08.1994","30.08.1994",1994,8,30,0.001,5
"GER_018_MZB_LO_35","GER_018_MZB_LO_35-24.08.1995","24.08.1995",1995,8,24,0.001,5
"GER_018_MZB_LO_35","GER_018_MZB_LO_35-24.09.1996","24.09.1996",1996,9,24,0.001,5
"GER_018_MZB_LO_35","GER_018_MZB_LO_35-13.08.1997","13.08.1997",1997,8,13,0.028,5
"GER_018_MZB_LO_35","GER_018_MZB_LO_35-02.09.1998","02.09.1998",1998,9,2,0.001,5
"GER_018_MZB_LO_35","GER_018_MZB_LO_35-04.09.2001","04.09.2001",2001,9,4,0.087,5
"GER_018_MZB_LO_36","GER_018_MZB_LO_36-31.05.1989","31.05.1989",1989,5,31,0.464,3
"GER_018_MZB_LO_36","GER_018_MZB_LO_36-22.05.1990","22.05.1990",1990,5,22,0.504,3
"GER_018_MZB_LO_36","GER_018_MZB_LO_36-05.06.1991","05.06.1991",1991,6,5,0.432,3
"GER_018_MZB_LO_36","GER_018_MZB_LO_36-30.06.1995","30.06.1995",1995,6,30,0.675,2
"GER_018_MZB_LO_36","GER_018_MZB_LO_36-27.05.1997","27.05.1997",1997,5,27,0.581,3
"GER_018_MZB_LO_36","GER_018_MZB_LO_36-21.05.1999","21.05.1999",1999,5,21,0.699,2
"GER_018_MZB_LO_36","GER_018_MZB_LO_36-20.06.2000","20.06.2000",2000,6,20,0.668,2
"GER_018_MZB_LO_36","GER_018_MZB_LO_36-30.05.2006","30.05.2006",2006,5,30,0.559,3
"GER_018_MZB_LO_37","GER_018_MZB_LO_37-15.06.1986","15.06.1986",1986,6,15,0.315,4
"GER_018_MZB_LO_37","GER_018_MZB_LO_37-01.07.1988","01.07.1988",1988,7,1,0.001,5
"GER_018_MZB_LO_37","GER_018_MZB_LO_37-09.07.1992","09.07.1992",1992,7,9,0.178,5
"GER_018_MZB_LO_37","GER_018_MZB_LO_37-25.08.1994","25.08.1994",1994,8,25,0.009,5
"GER_018_MZB_LO_37","GER_018_MZB_LO_37-22.06.1995","22.06.1995",1995,6,22,0.128,5
"GER_018_MZB_LO_37","GER_018_MZB_LO_37-13.06.1996","13.06.1996",1996,6,13,0.071,5
"GER_018_MZB_LO_37","GER_018_MZB_LO_37-03.06.1999","03.06.1999",1999,6,3,0.102,5
"GER_018_MZB_LO_37","GER_018_MZB_LO_37-05.07.2000","05.07.2000",2000,7,5,0.27,4
"GER_018_MZB_LO_37","GER_018_MZB_LO_37-23.08.2001","23.08.2001",2001,8,23,0.028,5
"GER_018_MZB_LO_37","GER_018_MZB_LO_37-14.06.2006","14.06.2006",2006,6,14,0.04,5
"GER_018_MZB_LO_39","GER_018_MZB_LO_39-28.05.1986","28.05.1986",1986,5,28,0.23,4
"GER_018_MZB_LO_39","GER_018_MZB_LO_39-08.05.1987","08.05.1987",1987,5,8,0.121,5
"GER_018_MZB_LO_39","GER_018_MZB_LO_39-08.07.1988","08.07.1988",1988,7,8,0.229,4
"GER_018_MZB_LO_39","GER_018_MZB_LO_39-10.05.1993","10.05.1993",1993,5,10,0.03,5
"GER_018_MZB_LO_39","GER_018_MZB_LO_39-14.05.1997","14.05.1997",1997,5,14,0.094,5
"GER_018_MZB_LO_39","GER_018_MZB_LO_39-20.05.1998","20.05.1998",1998,5,20,0.116,5
"GER_018_MZB_LO_39","GER_018_MZB_LO_39-08.05.1999","08.05.1999",1999,5,8,0.175,5
"GER_018_MZB_LO_39","GER_018_MZB_LO_39-09.05.2000","09.05.2000",2000,5,9,0.058,5
"GER_018_MZB_LO_39","GER_018_MZB_LO_39-29.05.2006","29.05.2006",2006,5,29,0.115,5
"GER_018_MZB_LO_40","GER_018_MZB_LO_40-22.05.1990","22.05.1990",1990,5,22,0.572,3
"GER_018_MZB_LO_40","GER_018_MZB_LO_40-05.06.1991","05.06.1991",1991,6,5,0.563,3
"GER_018_MZB_LO_40","GER_018_MZB_LO_40-30.06.1995","30.06.1995",1995,6,30,0.524,3
"GER_018_MZB_LO_40","GER_018_MZB_LO_40-27.05.1997","27.05.1997",1997,5,27,0.427,3
"GER_018_MZB_LO_40","GER_018_MZB_LO_40-21.05.1999","21.05.1999",1999,5,21,0.447,3
"GER_018_MZB_LO_40","GER_018_MZB_LO_40-20.06.2000","20.06.2000",2000,6,20,0.647,2
"GER_018_MZB_LO_40","GER_018_MZB_LO_40-30.05.2006","30.05.2006",2006,5,30,0.657,2
"GER_018_MZB_LO_41","GER_018_MZB_LO_41-21.08.1986","21.08.1986",1986,8,21,0.001,5
"GER_018_MZB_LO_41","GER_018_MZB_LO_41-31.08.1990","31.08.1990",1990,8,31,0.001,5
"GER_018_MZB_LO_41","GER_018_MZB_LO_41-02.09.1992","02.09.1992",1992,9,2,0.001,5
"GER_018_MZB_LO_41","GER_018_MZB_LO_41-23.09.1993","23.09.1993",1993,9,23,0.001,5
"GER_018_MZB_LO_41","GER_018_MZB_LO_41-23.08.1995","23.08.1995",1995,8,23,0.001,5
"GER_018_MZB_LO_41","GER_018_MZB_LO_41-26.09.1996","26.09.1996",1996,9,26,0.001,5
"GER_018_MZB_LO_41","GER_018_MZB_LO_41-17.09.1997","17.09.1997",1997,9,17,0.001,5
"GER_018_MZB_LO_41","GER_018_MZB_LO_41-16.09.1998","16.09.1998",1998,9,16,0.001,5
"GER_018_MZB_LO_41","GER_018_MZB_LO_41-05.09.2001","05.09.2001",2001,9,5,0.001,5
"GER_018_MZB_LO_41","GER_018_MZB_LO_41-08.10.2002","08.10.2002",2002,10,8,0.001,5
"GER_018_MZB_LO_41","GER_018_MZB_LO_41-16.09.2003","16.09.2003",2003,9,16,0.001,5
"GER_018_MZB_LO_41","GER_018_MZB_LO_41-08.09.2004","08.09.2004",2004,9,8,0.001,5
"GER_018_MZB_LO_41","GER_018_MZB_LO_41-15.09.2005","15.09.2005",2005,9,15,0.001,5
"GER_018_MZB_LO_41","GER_018_MZB_LO_41-30.08.2006","30.08.2006",2006,8,30,0.518,3
"GER_018_MZB_LO_42","GER_018_MZB_LO_42-03.06.1986","03.06.1986",1986,6,3,0.596,3
"GER_018_MZB_LO_42","GER_018_MZB_LO_42-11.06.1987","11.06.1987",1987,6,11,0.735,2
"GER_018_MZB_LO_42","GER_018_MZB_LO_42-21.06.1988","21.06.1988",1988,6,21,0.654,2
"GER_018_MZB_LO_42","GER_018_MZB_LO_42-07.07.1989","07.07.1989",1989,7,7,0.502,3
"GER_018_MZB_LO_42","GER_018_MZB_LO_42-19.06.1990","19.06.1990",1990,6,19,0.71,2
"GER_018_MZB_LO_42","GER_018_MZB_LO_42-14.06.1991","14.06.1991",1991,6,14,0.729,2
"GER_018_MZB_LO_42","GER_018_MZB_LO_42-15.07.1992","15.07.1992",1992,7,15,0.621,2
"GER_018_MZB_LO_42","GER_018_MZB_LO_42-02.06.1994","02.06.1994",1994,6,2,0.576,3
"GER_018_MZB_LO_42","GER_018_MZB_LO_42-07.06.1995","07.06.1995",1995,6,7,0.667,2
"GER_018_MZB_LO_42","GER_018_MZB_LO_42-06.06.1996","06.06.1996",1996,6,6,0.585,3
"GER_018_MZB_LO_42","GER_018_MZB_LO_42-29.06.2000","29.06.2000",2000,6,29,0.675,2
"GER_018_MZB_LO_42","GER_018_MZB_LO_42-04.07.2006","04.07.2006",2006,7,4,0.847,2
"GER_018_MZB_LO_44","GER_018_MZB_LO_44-10.06.1986","10.06.1986",1986,6,10,0.462,3
"GER_018_MZB_LO_44","GER_018_MZB_LO_44-01.07.1987","01.07.1987",1987,7,1,0.653,2
"GER_018_MZB_LO_44","GER_018_MZB_LO_44-26.06.1990","26.06.1990",1990,6,26,0.455,3
"GER_018_MZB_LO_44","GER_018_MZB_LO_44-20.06.1991","20.06.1991",1991,6,20,0.497,3
"GER_018_MZB_LO_44","GER_018_MZB_LO_44-02.07.1992","02.07.1992",1992,7,2,0.284,4
"GER_018_MZB_LO_44","GER_018_MZB_LO_44-14.06.1995","14.06.1995",1995,6,14,0.547,3
"GER_018_MZB_LO_44","GER_018_MZB_LO_44-05.06.1996","05.06.1996",1996,6,5,0.371,4
"GER_018_MZB_LO_44","GER_018_MZB_LO_44-16.07.1997","16.07.1997",1997,7,16,0.317,4
"GER_018_MZB_LO_44","GER_018_MZB_LO_44-05.07.2009","05.07.2009",2009,7,5,0.001,5
"GER_018_MZB_LO_45","GER_018_MZB_LO_45-16.04.1986","16.04.1986",1986,4,16,0.079,5
"GER_018_MZB_LO_45","GER_018_MZB_LO_45-12.04.1989","12.04.1989",1989,4,12,0.029,5
"GER_018_MZB_LO_45","GER_018_MZB_LO_45-30.06.1992","30.06.1992",1992,6,30,0.117,5
"GER_018_MZB_LO_45","GER_018_MZB_LO_45-03.06.1993","03.06.1993",1993,6,3,0.141,5
"GER_018_MZB_LO_45","GER_018_MZB_LO_45-05.06.1996","05.06.1996",1996,6,5,0.168,5
"GER_018_MZB_LO_45","GER_018_MZB_LO_45-04.04.2008","04.04.2008",2008,4,4,0.182,5
"GER_018_MZB_LO_45","GER_018_MZB_LO_45-27.04.2010","27.04.2010",2010,4,27,0.047,5
"GER_018_MZB_LO_45","GER_018_MZB_LO_45-17.04.2013","17.04.2013",2013,4,17,0.029,5
"GER_018_MZB_LO_46","GER_018_MZB_LO_46-21.08.1986","21.08.1986",1986,8,21,0.145,5
"GER_018_MZB_LO_46","GER_018_MZB_LO_46-10.07.1987","10.07.1987",1987,7,10,0.04,5
"GER_018_MZB_LO_46","GER_018_MZB_LO_46-03.06.1988","03.06.1988",1988,6,3,0.266,4
"GER_018_MZB_LO_46","GER_018_MZB_LO_46-02.06.1989","02.06.1989",1989,6,2,0.337,4
"GER_018_MZB_LO_46","GER_018_MZB_LO_46-23.08.1990","23.08.1990",1990,8,23,0.001,5
"GER_018_MZB_LO_46","GER_018_MZB_LO_46-21.06.1991","21.06.1991",1991,6,21,0.387,4
"GER_018_MZB_LO_46","GER_018_MZB_LO_46-28.07.1992","28.07.1992",1992,7,28,0.382,4
"GER_018_MZB_LO_46","GER_018_MZB_LO_46-08.06.1994","08.06.1994",1994,6,8,0.19,5
"GER_018_MZB_LO_46","GER_018_MZB_LO_46-22.06.1995","22.06.1995",1995,6,22,0.273,4
"GER_018_MZB_LO_46","GER_018_MZB_LO_46-09.07.1996","09.07.1996",1996,7,9,0.327,4
"GER_018_MZB_LO_46","GER_018_MZB_LO_46-08.06.1999","08.06.1999",1999,6,8,0.248,4
"GER_018_MZB_LO_46","GER_018_MZB_LO_46-27.08.2001","27.08.2001",2001,8,27,0.326,4
"GER_018_MZB_LO_46","GER_018_MZB_LO_46-22.06.2006","22.06.2006",2006,6,22,0.452,3
"GER_018_MZB_LO_47","GER_018_MZB_LO_47-26.10.1971","26.10.1971",1971,10,26,0.044,5
"GER_018_MZB_LO_47","GER_018_MZB_LO_47-06.09.1972","06.09.1972",1972,9,6,0.001,5
"GER_018_MZB_LO_47","GER_018_MZB_LO_47-26.10.1977","26.10.1977",1977,10,26,0.001,5
"GER_018_MZB_LO_47","GER_018_MZB_LO_47-26.10.1978","26.10.1978",1978,10,26,0.099,5
"GER_018_MZB_LO_47","GER_018_MZB_LO_47-09.09.1979","09.09.1979",1979,9,9,0.001,5
"GER_018_MZB_LO_47","GER_018_MZB_LO_47-17.09.1980","17.09.1980",1980,9,17,0.028,5
"GER_018_MZB_LO_47","GER_018_MZB_LO_47-16.09.1982","16.09.1982",1982,9,16,0.072,5
"GER_018_MZB_LO_47","GER_018_MZB_LO_47-29.08.1983","29.08.1983",1983,8,29,0.03,5
"GER_018_MZB_LO_47","GER_018_MZB_LO_47-03.09.1984","03.09.1984",1984,9,3,0.1,5
"GER_018_MZB_LO_47","GER_018_MZB_LO_47-01.08.1985","01.08.1985",1985,8,1,0.091,5
"GER_018_MZB_LO_47","GER_018_MZB_LO_47-30.08.1989","30.08.1989",1989,8,30,0.067,5
"GER_018_MZB_LO_47","GER_018_MZB_LO_47-03.08.1990","03.08.1990",1990,8,3,0.152,5
"GER_018_MZB_LO_47","GER_018_MZB_LO_47-04.08.1994","04.08.1994",1994,8,4,0.176,5
"GER_018_MZB_LO_47","GER_018_MZB_LO_47-19.09.1996","19.09.1996",1996,9,19,0.123,5
"GER_018_MZB_LO_47","GER_018_MZB_LO_47-21.08.1998","21.08.1998",1998,8,21,0.171,5
"GER_018_MZB_LO_47","GER_018_MZB_LO_47-25.10.2007","25.10.2007",2007,10,25,0.029,5
"GER_018_MZB_LO_49","GER_018_MZB_LO_49-28.08.1972","28.08.1972",1972,8,28,0.063,5
"GER_018_MZB_LO_49","GER_018_MZB_LO_49-27.08.1973","27.08.1973",1973,8,27,0.072,5
"GER_018_MZB_LO_49","GER_018_MZB_LO_49-06.07.1992","06.07.1992",1992,7,6,0.065,5
"GER_018_MZB_LO_49","GER_018_MZB_LO_49-10.08.1994","10.08.1994",1994,8,10,0.014,5
"GER_018_MZB_LO_49","GER_018_MZB_LO_49-16.08.1995","16.08.1995",1995,8,16,0.015,5
"GER_018_MZB_LO_49","GER_018_MZB_LO_49-21.07.1999","21.07.1999",1999,7,21,0.015,5
"GER_018_MZB_LO_49","GER_018_MZB_LO_49-11.07.2001","11.07.2001",2001,7,11,0.073,5
"GER_018_MZB_LO_49","GER_018_MZB_LO_49-13.08.2003","13.08.2003",2003,8,13,0.451,3
"GER_018_MZB_LO_49","GER_018_MZB_LO_49-17.07.2007","17.07.2007",2007,7,17,0.053,5
"GER_018_MZB_LO_66","GER_018_MZB_LO_66-09.04.1980","09.04.1980",1980,4,9,0.001,5
"GER_018_MZB_LO_66","GER_018_MZB_LO_66-19.05.1992","19.05.1992",1992,5,19,0.032,5
"GER_018_MZB_LO_66","GER_018_MZB_LO_66-17.06.1993","17.06.1993",1993,6,17,0.058,5
"GER_018_MZB_LO_66","GER_018_MZB_LO_66-06.05.1997","06.05.1997",1997,5,6,0.552,3
"GER_018_MZB_LO_66","GER_018_MZB_LO_66-12.05.1998","12.05.1998",1998,5,12,0.457,3
"GER_018_MZB_LO_66","GER_018_MZB_LO_66-28.04.1999","28.04.1999",1999,4,28,0.707,2
"GER_018_MZB_LO_66","GER_018_MZB_LO_66-27.04.2001","27.04.2001",2001,4,27,0.193,5
"GER_018_MZB_LO_66","GER_018_MZB_LO_66-22.05.2002","22.05.2002",2002,5,22,0.149,5
"GER_018_MZB_LO_67","GER_018_MZB_LO_67-01.10.1971","01.10.1971",1971,10,1,0.042,5
"GER_018_MZB_LO_67","GER_018_MZB_LO_67-01.09.1976","01.09.1976",1976,9,1,0.036,5
"GER_018_MZB_LO_67","GER_018_MZB_LO_67-01.10.1977","01.10.1977",1977,10,1,0.061,5
"GER_018_MZB_LO_67","GER_018_MZB_LO_67-01.10.1978","01.10.1978",1978,10,1,0.094,5
"GER_018_MZB_LO_67","GER_018_MZB_LO_67-16.09.1980","16.09.1980",1980,9,16,0.074,5
"GER_018_MZB_LO_67","GER_018_MZB_LO_67-09.09.1982","09.09.1982",1982,9,9,0.076,5
"GER_018_MZB_LO_67","GER_018_MZB_LO_67-08.08.1983","08.08.1983",1983,8,8,0.109,5
"GER_018_MZB_LO_67","GER_018_MZB_LO_67-31.08.1984","31.08.1984",1984,8,31,0.034,5
"GER_018_MZB_LO_67","GER_018_MZB_LO_67-21.08.1985","21.08.1985",1985,8,21,0.024,5
"GER_018_MZB_LO_67","GER_018_MZB_LO_67-26.08.1988","26.08.1988",1988,8,26,0.028,5
"GER_018_MZB_LO_67","GER_018_MZB_LO_67-30.08.1991","30.08.1991",1991,8,30,0.053,5
"GER_018_MZB_LO_67","GER_018_MZB_LO_67-31.08.1992","31.08.1992",1992,8,31,0.064,5
"GER_018_MZB_LO_67","GER_018_MZB_LO_67-23.10.2001","23.10.2001",2001,10,23,0.527,3
"GER_018_MZB_LO_67","GER_018_MZB_LO_67-08.09.2005","08.09.2005",2005,9,8,0.627,2
"GER_018_MZB_LO_70","GER_018_MZB_LO_70-15.06.1983","15.06.1983",1983,6,15,0.746,2
"GER_018_MZB_LO_70","GER_018_MZB_LO_70-20.06.1985","20.06.1985",1985,6,20,0.692,2
"GER_018_MZB_LO_70","GER_018_MZB_LO_70-24.07.1986","24.07.1986",1986,7,24,0.747,2
"GER_018_MZB_LO_70","GER_018_MZB_LO_70-25.05.1987","25.05.1987",1987,5,25,0.804,2
"GER_018_MZB_LO_70","GER_018_MZB_LO_70-23.05.1991","23.05.1991",1991,5,23,0.551,3
"GER_018_MZB_LO_70","GER_018_MZB_LO_70-06.07.1993","06.07.1993",1993,7,6,0.579,3
"GER_018_MZB_LO_70","GER_018_MZB_LO_70-14.07.1994","14.07.1994",1994,7,14,0.77,2
"GER_018_MZB_LO_70","GER_018_MZB_LO_70-20.05.2004","20.05.2004",2004,5,20,0.831,2
"GER_018_MZB_LO_71","GER_018_MZB_LO_71-16.06.1982","16.06.1982",1982,6,16,0.605,2
"GER_018_MZB_LO_71","GER_018_MZB_LO_71-30.06.1983","30.06.1983",1983,6,30,0.505,3
"GER_018_MZB_LO_71","GER_018_MZB_LO_71-02.08.1985","02.08.1985",1985,8,2,0.341,4
"GER_018_MZB_LO_71","GER_018_MZB_LO_71-31.07.1986","31.07.1986",1986,7,31,0.464,3
"GER_018_MZB_LO_71","GER_018_MZB_LO_71-15.07.1987","15.07.1987",1987,7,15,0.398,4
"GER_018_MZB_LO_71","GER_018_MZB_LO_71-15.06.1994","15.06.1994",1994,6,15,0.269,4
"GER_018_MZB_LO_71","GER_018_MZB_LO_71-09.07.1995","09.07.1995",1995,7,9,0.272,4
"GER_018_MZB_LO_71","GER_018_MZB_LO_71-21.08.2002","21.08.2002",2002,8,21,0.174,5
"GER_018_MZB_LO_72","GER_018_MZB_LO_72-25.06.1982","25.06.1982",1982,6,25,0.235,4
"GER_018_MZB_LO_72","GER_018_MZB_LO_72-30.06.1983","30.06.1983",1983,6,30,0.181,5
"GER_018_MZB_LO_72","GER_018_MZB_LO_72-03.07.1985","03.07.1985",1985,7,3,0.172,5
"GER_018_MZB_LO_72","GER_018_MZB_LO_72-31.07.1986","31.07.1986",1986,7,31,0.34,4
"GER_018_MZB_LO_72","GER_018_MZB_LO_72-15.07.1987","15.07.1987",1987,7,15,0.181,5
"GER_018_MZB_LO_72","GER_018_MZB_LO_72-17.06.1993","17.06.1993",1993,6,17,0.184,5
"GER_018_MZB_LO_72","GER_018_MZB_LO_72-10.07.1995","10.07.1995",1995,7,10,0.094,5
"GER_018_MZB_LO_73","GER_018_MZB_LO_73-25.06.1986","25.06.1986",1986,6,25,0.034,5
"GER_018_MZB_LO_73","GER_018_MZB_LO_73-03.07.1987","03.07.1987",1987,7,3,0.114,5
"GER_018_MZB_LO_73","GER_018_MZB_LO_73-08.07.1988","08.07.1988",1988,7,8,0.144,5
"GER_018_MZB_LO_73","GER_018_MZB_LO_73-27.07.1989","27.07.1989",1989,7,27,0.046,5
"GER_018_MZB_LO_73","GER_018_MZB_LO_73-27.06.1990","27.06.1990",1990,6,27,0.007,5
"GER_018_MZB_LO_73","GER_018_MZB_LO_73-23.07.1991","23.07.1991",1991,7,23,0.055,5
"GER_018_MZB_LO_73","GER_018_MZB_LO_73-08.07.1992","08.07.1992",1992,7,8,0.132,5
"GER_018_MZB_LO_73","GER_018_MZB_LO_73-01.06.1993","01.06.1993",1993,6,1,0.038,5
"GER_018_MZB_LO_73","GER_018_MZB_LO_73-09.06.1994","09.06.1994",1994,6,9,0.087,5
"GER_018_MZB_LO_73","GER_018_MZB_LO_73-13.06.1995","13.06.1995",1995,6,13,0.233,4
"GER_018_MZB_LO_73","GER_018_MZB_LO_73-10.07.1997","10.07.1997",1997,7,10,0.245,4
"GER_018_MZB_LO_85","GER_018_MZB_LO_85-01.09.1972","01.09.1972",1972,9,1,0.001,5
"GER_018_MZB_LO_85","GER_018_MZB_LO_85-01.09.1973","01.09.1973",1973,9,1,0.001,5
"GER_018_MZB_LO_85","GER_018_MZB_LO_85-10.10.1974","10.10.1974",1974,10,10,0.001,5
"GER_018_MZB_LO_85","GER_018_MZB_LO_85-01.09.1976","01.09.1976",1976,9,1,0.001,5
"GER_018_MZB_LO_85","GER_018_MZB_LO_85-01.10.1977","01.10.1977",1977,10,1,0.001,5
"GER_018_MZB_LO_85","GER_018_MZB_LO_85-01.10.1978","01.10.1978",1978,10,1,0.001,5
"GER_018_MZB_LO_85","GER_018_MZB_LO_85-27.09.1979","27.09.1979",1979,9,27,0.001,5
"GER_018_MZB_LO_85","GER_018_MZB_LO_85-31.08.1980","31.08.1980",1980,8,31,0.001,5
"GER_018_MZB_LO_85","GER_018_MZB_LO_85-31.08.1981","31.08.1981",1981,8,31,0.001,5
"GER_018_MZB_LO_85","GER_018_MZB_LO_85-31.08.1982","31.08.1982",1982,8,31,0.025,5
"GER_018_MZB_LO_85","GER_018_MZB_LO_85-31.08.1983","31.08.1983",1983,8,31,0.049,5
"GER_018_MZB_LO_85","GER_018_MZB_LO_85-31.08.1984","31.08.1984",1984,8,31,0.125,5
"GER_018_MZB_LO_85","GER_018_MZB_LO_85-08.08.1985","08.08.1985",1985,8,8,0.001,5
"GER_018_MZB_LO_85","GER_018_MZB_LO_85-11.08.1986","11.08.1986",1986,8,11,0.083,5
"GER_018_MZB_LO_85","GER_018_MZB_LO_85-21.09.1987","21.09.1987",1987,9,21,0.076,5
"GER_018_MZB_LO_85","GER_018_MZB_LO_85-01.09.1988","01.09.1988",1988,9,1,0.1,5
"GER_018_MZB_LO_85","GER_018_MZB_LO_85-01.09.1989","01.09.1989",1989,9,1,0.116,5
"GER_018_MZB_LO_85","GER_018_MZB_LO_85-01.08.1990","01.08.1990",1990,8,1,0.165,5
"GER_018_MZB_LO_85","GER_018_MZB_LO_85-01.09.1991","01.09.1991",1991,9,1,0.025,5
"GER_018_MZB_LO_85","GER_018_MZB_LO_85-01.09.1992","01.09.1992",1992,9,1,0.181,5
"GER_018_MZB_LO_85","GER_018_MZB_LO_85-11.08.1994","11.08.1994",1994,8,11,0.15,5
"GER_018_MZB_LO_85","GER_018_MZB_LO_85-01.08.1995","01.08.1995",1995,8,1,0.107,5
"GER_018_MZB_LO_85","GER_018_MZB_LO_85-18.09.1996","18.09.1996",1996,9,18,0.031,5
"GER_018_MZB_LO_85","GER_018_MZB_LO_85-01.09.1997","01.09.1997",1997,9,1,0.001,5
"GER_018_MZB_LO_85","GER_018_MZB_LO_85-01.09.1998","01.09.1998",1998,9,1,0.05,5
"GER_018_MZB_LO_85","GER_018_MZB_LO_85-15.09.1999","15.09.1999",1999,9,15,0.044,5
"GER_018_MZB_LO_85","GER_018_MZB_LO_85-17.10.2001","17.10.2001",2001,10,17,0.001,5
"GER_018_MZB_LO_85","GER_018_MZB_LO_85-21.10.2002","21.10.2002",2002,10,21,0.001,5
"GER_018_MZB_LO_85","GER_018_MZB_LO_85-01.10.2003","01.10.2003",2003,10,1,0.001,5
"GER_018_MZB_LO_85","GER_018_MZB_LO_85-07.08.2004","07.08.2004",2004,8,7,0.031,5
"GER_018_MZB_LO_85","GER_018_MZB_LO_85-03.08.2005","03.08.2005",2005,8,3,0.001,5
"GER_018_MZB_LO_85","GER_018_MZB_LO_85-08.08.2007","08.08.2007",2007,8,8,0.025,5
"GER_018_MZB_LO_87","GER_018_MZB_LO_87-07.10.1983","07.10.1983",1983,10,7,0.367,4
"GER_018_MZB_LO_87","GER_018_MZB_LO_87-05.10.1993","05.10.1993",1993,10,5,0.289,4
"GER_018_MZB_LO_87","GER_018_MZB_LO_87-30.08.1994","30.08.1994",1994,8,30,0.342,4
"GER_018_MZB_LO_87","GER_018_MZB_LO_87-31.08.1995","31.08.1995",1995,8,31,0.447,3
"GER_018_MZB_LO_87","GER_018_MZB_LO_87-18.09.1996","18.09.1996",1996,9,18,0.485,3
"GER_018_MZB_LO_87","GER_018_MZB_LO_87-24.09.1998","24.09.1998",1998,9,24,0.558,3
"GER_018_MZB_LO_87","GER_018_MZB_LO_87-12.08.1999","12.08.1999",1999,8,12,0.493,3
"GER_018_MZB_LO_87","GER_018_MZB_LO_87-10.08.2000","10.08.2000",2000,8,10,0.297,4
"GER_018_MZB_LO_87","GER_018_MZB_LO_87-19.09.2002","19.09.2002",2002,9,19,0.836,2
"GER_018_MZB_LO_87","GER_018_MZB_LO_87-18.10.2003","18.10.2003",2003,10,18,0.835,2
"GER_018_MZB_LO_88","GER_018_MZB_LO_88-15.06.1983","15.06.1983",1983,6,15,0.225,4
"GER_018_MZB_LO_88","GER_018_MZB_LO_88-20.06.1985","20.06.1985",1985,6,20,0.068,5
"GER_018_MZB_LO_88","GER_018_MZB_LO_88-31.07.1986","31.07.1986",1986,7,31,0.003,5
"GER_018_MZB_LO_88","GER_018_MZB_LO_88-25.05.1987","25.05.1987",1987,5,25,0.044,5
"GER_018_MZB_LO_88","GER_018_MZB_LO_88-23.05.1991","23.05.1991",1991,5,23,0.023,5
"GER_018_MZB_LO_88","GER_018_MZB_LO_88-06.07.1993","06.07.1993",1993,7,6,0.011,5
"GER_018_MZB_LO_88","GER_018_MZB_LO_88-14.07.1994","14.07.1994",1994,7,14,0.087,5
"GER_018_MZB_LO_88","GER_018_MZB_LO_88-20.05.2004","20.05.2004",2004,5,20,0.219,4
"GER_018_MZB_LO_88","GER_018_MZB_LO_88-09.06.2007","09.06.2007",2007,6,9,0.521,3
"GER_018_MZB_LO_89","GER_018_MZB_LO_89-18.08.1983","18.08.1983",1983,8,18,0.001,5
"GER_018_MZB_LO_89","GER_018_MZB_LO_89-11.10.1985","11.10.1985",1985,10,11,0.001,5
"GER_018_MZB_LO_89","GER_018_MZB_LO_89-12.09.1986","12.09.1986",1986,9,12,0.02,5
"GER_018_MZB_LO_89","GER_018_MZB_LO_89-09.10.1989","09.10.1989",1989,10,9,0.002,5
"GER_018_MZB_LO_89","GER_018_MZB_LO_89-28.09.1994","28.09.1994",1994,9,28,0.017,5
"GER_018_MZB_LO_89","GER_018_MZB_LO_89-21.08.1995","21.08.1995",1995,8,21,0.001,5
"GER_018_MZB_LO_89","GER_018_MZB_LO_89-11.09.1996","11.09.1996",1996,9,11,0.017,5
"GER_018_MZB_LO_89","GER_018_MZB_LO_89-10.09.1998","10.09.1998",1998,9,10,0.012,5
"GER_018_MZB_LO_89","GER_018_MZB_LO_89-26.08.1999","26.08.1999",1999,8,26,0.008,5
"GER_018_MZB_LO_89","GER_018_MZB_LO_89-03.08.2000","03.08.2000",2000,8,3,0.001,5
"GER_018_MZB_LO_89","GER_018_MZB_LO_89-14.10.2003","14.10.2003",2003,10,14,0.092,5
"GER_018_MZB_LO_89","GER_018_MZB_LO_89-06.09.2006","06.09.2006",2006,9,6,0.001,5
"GER_018_MZB_LO_9","GER_018_MZB_LO_9-20.05.1986","20.05.1986",1986,5,20,0.106,5
"GER_018_MZB_LO_9","GER_018_MZB_LO_9-22.05.1989","22.05.1989",1989,5,22,0.14,5
"GER_018_MZB_LO_9","GER_018_MZB_LO_9-10.05.1991","10.05.1991",1991,5,10,0.069,5
"GER_018_MZB_LO_9","GER_018_MZB_LO_9-30.06.1993","30.06.1993",1993,6,30,0.063,5
"GER_018_MZB_LO_9","GER_018_MZB_LO_9-12.05.1997","12.05.1997",1997,5,12,0.164,5
"GER_018_MZB_LO_9","GER_018_MZB_LO_9-11.05.1998","11.05.1998",1998,5,11,0.141,5
"GER_018_MZB_LO_9","GER_018_MZB_LO_9-27.05.1999","27.05.1999",1999,5,27,0.145,5
"GER_018_MZB_LO_9","GER_018_MZB_LO_9-22.05.2000","22.05.2000",2000,5,22,0.105,5
"GER_018_MZB_LO_9","GER_018_MZB_LO_9-31.05.2006","31.05.2006",2006,5,31,0.001,5
