"Unique.ID","Samp.ID","Sampling.date","year","month","day","eqr","eqc"
"HUN_022_MZB_LO_1","HUN_022_MZB_LO_1-19.06.2007","19.06.2007",2007,6,19,0.182655981,5
"HUN_022_MZB_LO_1","HUN_022_MZB_LO_1-20.05.2008","20.05.2008",2008,5,20,0.043484337,5
"HUN_022_MZB_LO_1","HUN_022_MZB_LO_1-12.05.2009","12.05.2009",2009,5,12,0.430138611,3
"HUN_022_MZB_LO_1","HUN_022_MZB_LO_1-28.06.2011","28.06.2011",2011,6,28,0.229248499,4
"HUN_022_MZB_LO_1","HUN_022_MZB_LO_1-24.04.2012","24.04.2012",2012,4,24,0.009578154,5
"HUN_022_MZB_LO_1","HUN_022_MZB_LO_1-18.06.2013","18.06.2013",2013,6,18,0.332907325,4
"HUN_022_MZB_LO_1","HUN_022_MZB_LO_1-18.06.2014","18.06.2014",2014,6,18,0.45485889,3
"HUN_022_MZB_LO_1","HUN_022_MZB_LO_1-16.04.2015","16.04.2015",2015,4,16,0.365914153,4
"HUN_022_MZB_LO_1","HUN_022_MZB_LO_1-03.05.2016","03.05.2016",2016,5,3,0.363266338,4
"HUN_022_MZB_LO_1","HUN_022_MZB_LO_1-15.05.2017","15.05.2017",2017,5,15,0.34416139,4
"HUN_022_MZB_LO_10","HUN_022_MZB_LO_10-07.10.2007","07.10.2007",2007,10,7,0.817657324,1
"HUN_022_MZB_LO_10","HUN_022_MZB_LO_10-12.09.2008","12.09.2008",2008,9,12,0.791858885,2
"HUN_022_MZB_LO_10","HUN_022_MZB_LO_10-27.10.2009","27.10.2009",2009,10,27,0.271077892,4
"HUN_022_MZB_LO_10","HUN_022_MZB_LO_10-20.08.2010","20.08.2010",2010,8,20,0.592463166,3
"HUN_022_MZB_LO_10","HUN_022_MZB_LO_10-18.08.2011","18.08.2011",2011,8,18,0.745487731,2
"HUN_022_MZB_LO_10","HUN_022_MZB_LO_10-30.08.2012","30.08.2012",2012,8,30,0.931708889,1
"HUN_022_MZB_LO_10","HUN_022_MZB_LO_10-12.09.2013","12.09.2013",2013,9,12,0.768693056,2
"HUN_022_MZB_LO_10","HUN_022_MZB_LO_10-26.08.2014","26.08.2014",2014,8,26,0.78108676,2
"HUN_022_MZB_LO_10","HUN_022_MZB_LO_10-15.09.2015","15.09.2015",2015,9,15,0.82283091,1
"HUN_022_MZB_LO_10","HUN_022_MZB_LO_10-19.09.2016","19.09.2016",2016,9,19,0.843334253,1
"HUN_022_MZB_LO_11","HUN_022_MZB_LO_11-23.06.2005","23.06.2005",2005,6,23,0.594061339,3
"HUN_022_MZB_LO_11","HUN_022_MZB_LO_11-29.06.2006","29.06.2006",2006,6,29,0.630528333,2
"HUN_022_MZB_LO_11","HUN_022_MZB_LO_11-29.06.2007","29.06.2007",2007,6,29,0.690201803,2
"HUN_022_MZB_LO_11","HUN_022_MZB_LO_11-30.04.2008","30.04.2008",2008,4,30,0.665097959,2
"HUN_022_MZB_LO_11","HUN_022_MZB_LO_11-18.06.2009","18.06.2009",2009,6,18,0.662585082,2
"HUN_022_MZB_LO_11","HUN_022_MZB_LO_11-29.04.2010","29.04.2010",2010,4,29,0.721833917,2
"HUN_022_MZB_LO_11","HUN_022_MZB_LO_11-18.04.2011","18.04.2011",2011,4,18,0.528873834,3
"HUN_022_MZB_LO_11","HUN_022_MZB_LO_11-31.05.2012","31.05.2012",2012,5,31,0.729815866,2
"HUN_022_MZB_LO_11","HUN_022_MZB_LO_11-09.04.2014","09.04.2014",2014,4,9,0.77200083,2
"HUN_022_MZB_LO_11","HUN_022_MZB_LO_11-29.04.2015","29.04.2015",2015,4,29,0.730687826,2
"HUN_022_MZB_LO_11","HUN_022_MZB_LO_11-20.04.2016","20.04.2016",2016,4,20,0.616975659,2
"HUN_022_MZB_LO_11","HUN_022_MZB_LO_11-25.04.2017","25.04.2017",2017,4,25,0.846301934,1
"HUN_022_MZB_LO_12","HUN_022_MZB_LO_12-07.10.2007","07.10.2007",2007,10,7,0.965158924,1
"HUN_022_MZB_LO_12","HUN_022_MZB_LO_12-12.09.2008","12.09.2008",2008,9,12,0.871890547,1
"HUN_022_MZB_LO_12","HUN_022_MZB_LO_12-27.10.2009","27.10.2009",2009,10,27,0.749910669,2
"HUN_022_MZB_LO_12","HUN_022_MZB_LO_12-20.08.2010","20.08.2010",2010,8,20,0.831764179,1
"HUN_022_MZB_LO_12","HUN_022_MZB_LO_12-18.08.2011","18.08.2011",2011,8,18,0.706403009,2
"HUN_022_MZB_LO_12","HUN_022_MZB_LO_12-30.08.2012","30.08.2012",2012,8,30,0.957006369,1
"HUN_022_MZB_LO_12","HUN_022_MZB_LO_12-12.09.2013","12.09.2013",2013,9,12,0.908384668,1
"HUN_022_MZB_LO_12","HUN_022_MZB_LO_12-26.08.2014","26.08.2014",2014,8,26,0.964433041,1
"HUN_022_MZB_LO_12","HUN_022_MZB_LO_12-15.09.2015","15.09.2015",2015,9,15,0.867615591,1
"HUN_022_MZB_LO_12","HUN_022_MZB_LO_12-19.09.2016","19.09.2016",2016,9,19,0.911768212,1
"HUN_022_MZB_LO_13","HUN_022_MZB_LO_13-02.09.2007","02.09.2007",2007,9,2,0.886677549,1
"HUN_022_MZB_LO_13","HUN_022_MZB_LO_13-09.09.2008","09.09.2008",2008,9,9,0.910639479,1
"HUN_022_MZB_LO_13","HUN_022_MZB_LO_13-24.08.2009","24.08.2009",2009,8,24,0.777930754,2
"HUN_022_MZB_LO_13","HUN_022_MZB_LO_13-20.08.2010","20.08.2010",2010,8,20,0.784878071,2
"HUN_022_MZB_LO_13","HUN_022_MZB_LO_13-18.08.2011","18.08.2011",2011,8,18,0.915976313,1
"HUN_022_MZB_LO_13","HUN_022_MZB_LO_13-02.08.2012","02.08.2012",2012,8,2,0.667397288,2
"HUN_022_MZB_LO_13","HUN_022_MZB_LO_13-12.09.2013","12.09.2013",2013,9,12,0.890312749,1
"HUN_022_MZB_LO_13","HUN_022_MZB_LO_13-26.08.2014","26.08.2014",2014,8,26,0.951649819,1
"HUN_022_MZB_LO_13","HUN_022_MZB_LO_13-15.09.2015","15.09.2015",2015,9,15,0.904258394,1
"HUN_022_MZB_LO_13","HUN_022_MZB_LO_13-20.09.2016","20.09.2016",2016,9,20,0.844757981,1
"HUN_022_MZB_LO_14","HUN_022_MZB_LO_14-19.04.2005","19.04.2005",2005,4,19,0.76776143,2
"HUN_022_MZB_LO_14","HUN_022_MZB_LO_14-22.05.2006","22.05.2006",2006,5,22,0.697716026,2
"HUN_022_MZB_LO_14","HUN_022_MZB_LO_14-10.05.2007","10.05.2007",2007,5,10,0.701181389,2
"HUN_022_MZB_LO_14","HUN_022_MZB_LO_14-22.04.2008","22.04.2008",2008,4,22,0.629942759,2
"HUN_022_MZB_LO_14","HUN_022_MZB_LO_14-03.04.2009","03.04.2009",2009,4,3,0.663604826,2
"HUN_022_MZB_LO_14","HUN_022_MZB_LO_14-29.04.2010","29.04.2010",2010,4,29,0.709380259,2
"HUN_022_MZB_LO_14","HUN_022_MZB_LO_14-18.04.2011","18.04.2011",2011,4,18,0.677640757,2
"HUN_022_MZB_LO_14","HUN_022_MZB_LO_14-31.05.2012","31.05.2012",2012,5,31,0.624824752,2
"HUN_022_MZB_LO_14","HUN_022_MZB_LO_14-08.05.2013","08.05.2013",2013,5,8,0.65399247,2
"HUN_022_MZB_LO_14","HUN_022_MZB_LO_14-09.04.2014","09.04.2014",2014,4,9,0.726057867,2
"HUN_022_MZB_LO_14","HUN_022_MZB_LO_14-29.04.2015","29.04.2015",2015,4,29,0.775218838,2
"HUN_022_MZB_LO_14","HUN_022_MZB_LO_14-20.04.2016","20.04.2016",2016,4,20,0.813554778,1
"HUN_022_MZB_LO_14","HUN_022_MZB_LO_14-25.04.2017","25.04.2017",2017,4,25,0.680055505,2
"HUN_022_MZB_LO_15","HUN_022_MZB_LO_15-21.09.2005","21.09.2005",2005,9,21,0.447772269,3
"HUN_022_MZB_LO_15","HUN_022_MZB_LO_15-31.08.2006","31.08.2006",2006,8,31,0.411807251,3
"HUN_022_MZB_LO_15","HUN_022_MZB_LO_15-14.09.2007","14.09.2007",2007,9,14,0.479266683,3
"HUN_022_MZB_LO_15","HUN_022_MZB_LO_15-12.09.2008","12.09.2008",2008,9,12,0.533866751,3
"HUN_022_MZB_LO_15","HUN_022_MZB_LO_15-16.09.2009","16.09.2009",2009,9,16,0.575588056,3
"HUN_022_MZB_LO_15","HUN_022_MZB_LO_15-26.08.2010","26.08.2010",2010,8,26,0.72815,2
"HUN_022_MZB_LO_15","HUN_022_MZB_LO_15-11.08.2011","11.08.2011",2011,8,11,0.408401087,3
"HUN_022_MZB_LO_15","HUN_022_MZB_LO_15-04.10.2012","04.10.2012",2012,10,4,0.702694152,2
"HUN_022_MZB_LO_15","HUN_022_MZB_LO_15-23.09.2013","23.09.2013",2013,9,23,0.69084603,2
"HUN_022_MZB_LO_15","HUN_022_MZB_LO_15-03.09.2014","03.09.2014",2014,9,3,0.661698931,2
"HUN_022_MZB_LO_15","HUN_022_MZB_LO_15-08.09.2015","08.09.2015",2015,9,8,0.75172378,2
"HUN_022_MZB_LO_15","HUN_022_MZB_LO_15-09.08.2016","09.08.2016",2016,8,9,0.724567169,2
"HUN_022_MZB_LO_16","HUN_022_MZB_LO_16-08.05.2007","08.05.2007",2007,5,8,0.399845981,4
"HUN_022_MZB_LO_16","HUN_022_MZB_LO_16-25.04.2008","25.04.2008",2008,4,25,0.02307435,5
"HUN_022_MZB_LO_16","HUN_022_MZB_LO_16-02.04.2009","02.04.2009",2009,4,2,0.081896516,5
"HUN_022_MZB_LO_16","HUN_022_MZB_LO_16-05.05.2010","05.05.2010",2010,5,5,0.300551845,4
"HUN_022_MZB_LO_16","HUN_022_MZB_LO_16-06.04.2011","06.04.2011",2011,4,6,0.175443929,5
"HUN_022_MZB_LO_16","HUN_022_MZB_LO_16-18.04.2012","18.04.2012",2012,4,18,0.326420146,4
"HUN_022_MZB_LO_16","HUN_022_MZB_LO_16-18.04.2013","18.04.2013",2013,4,18,0.16476485,5
"HUN_022_MZB_LO_16","HUN_022_MZB_LO_16-03.04.2014","03.04.2014",2014,4,3,0.407857523,3
"HUN_022_MZB_LO_16","HUN_022_MZB_LO_16-22.05.2015","22.05.2015",2015,5,22,0.561972423,3
"HUN_022_MZB_LO_16","HUN_022_MZB_LO_16-13.04.2016","13.04.2016",2016,4,13,0.481492642,3
"HUN_022_MZB_LO_16","HUN_022_MZB_LO_16-15.05.2017","15.05.2017",2017,5,15,0.520772973,3
"HUN_022_MZB_LO_17","HUN_022_MZB_LO_17-05.04.2005","05.04.2005",2005,4,5,0.183312884,5
"HUN_022_MZB_LO_17","HUN_022_MZB_LO_17-26.04.2006","26.04.2006",2006,4,26,0.104241135,5
"HUN_022_MZB_LO_17","HUN_022_MZB_LO_17-08.05.2007","08.05.2007",2007,5,8,0.31027919,4
"HUN_022_MZB_LO_17","HUN_022_MZB_LO_17-02.04.2008","02.04.2008",2008,4,2,0.115195521,5
"HUN_022_MZB_LO_17","HUN_022_MZB_LO_17-02.04.2009","02.04.2009",2009,4,2,0.167358485,5
"HUN_022_MZB_LO_17","HUN_022_MZB_LO_17-12.04.2010","12.04.2010",2010,4,12,0.053829978,5
"HUN_022_MZB_LO_17","HUN_022_MZB_LO_17-18.04.2012","18.04.2012",2012,4,18,0.165821576,5
"HUN_022_MZB_LO_17","HUN_022_MZB_LO_17-18.04.2013","18.04.2013",2013,4,18,0.100760794,5
"HUN_022_MZB_LO_17","HUN_022_MZB_LO_17-22.05.2015","22.05.2015",2015,5,22,0.410375231,3
"HUN_022_MZB_LO_17","HUN_022_MZB_LO_17-05.04.2016","05.04.2016",2016,4,5,0.132025472,5
"HUN_022_MZB_LO_17","HUN_022_MZB_LO_17-15.05.2017","15.05.2017",2017,5,15,0.240970355,4
"HUN_022_MZB_LO_18","HUN_022_MZB_LO_18-11.10.2005","11.10.2005",2005,10,11,0.593497193,3
"HUN_022_MZB_LO_18","HUN_022_MZB_LO_18-02.10.2006","02.10.2006",2006,10,2,0.568733561,3
"HUN_022_MZB_LO_18","HUN_022_MZB_LO_18-01.10.2007","01.10.2007",2007,10,1,0.784707374,2
"HUN_022_MZB_LO_18","HUN_022_MZB_LO_18-10.09.2009","10.09.2009",2009,9,10,0.693374328,2
"HUN_022_MZB_LO_18","HUN_022_MZB_LO_18-01.09.2010","01.09.2010",2010,9,1,0.326017578,4
"HUN_022_MZB_LO_18","HUN_022_MZB_LO_18-12.10.2011","12.10.2011",2011,10,12,0.606914489,2
"HUN_022_MZB_LO_18","HUN_022_MZB_LO_18-07.08.2012","07.08.2012",2012,8,7,0.6499623,2
"HUN_022_MZB_LO_18","HUN_022_MZB_LO_18-01.10.2013","01.10.2013",2013,10,1,0.87966748,1
"HUN_022_MZB_LO_18","HUN_022_MZB_LO_18-17.10.2014","17.10.2014",2014,10,17,0.766842797,2
"HUN_022_MZB_LO_18","HUN_022_MZB_LO_18-16.09.2015","16.09.2015",2015,9,16,0.41476734,3
"HUN_022_MZB_LO_18","HUN_022_MZB_LO_18-07.09.2016","07.09.2016",2016,9,7,0.452058413,3
"HUN_022_MZB_LO_19","HUN_022_MZB_LO_19-09.05.2005","09.05.2005",2005,5,9,0.864457979,1
"HUN_022_MZB_LO_19","HUN_022_MZB_LO_19-10.05.2006","10.05.2006",2006,5,10,0.70323198,2
"HUN_022_MZB_LO_19","HUN_022_MZB_LO_19-14.05.2007","14.05.2007",2007,5,14,0.806589006,1
"HUN_022_MZB_LO_19","HUN_022_MZB_LO_19-23.06.2008","23.06.2008",2008,6,23,0.416040641,3
"HUN_022_MZB_LO_19","HUN_022_MZB_LO_19-12.05.2009","12.05.2009",2009,5,12,0.702642304,2
"HUN_022_MZB_LO_19","HUN_022_MZB_LO_19-31.05.2012","31.05.2012",2012,5,31,0.804634168,1
"HUN_022_MZB_LO_19","HUN_022_MZB_LO_19-09.05.2013","09.05.2013",2013,5,9,0.803882793,1
"HUN_022_MZB_LO_19","HUN_022_MZB_LO_19-11.05.2016","11.05.2016",2016,5,11,0.411649019,3
"HUN_022_MZB_LO_2","HUN_022_MZB_LO_2-28.09.2006","28.09.2006",2006,9,28,0.422953234,3
"HUN_022_MZB_LO_2","HUN_022_MZB_LO_2-17.08.2007","17.08.2007",2007,8,17,0.548874673,3
"HUN_022_MZB_LO_2","HUN_022_MZB_LO_2-19.09.2008","19.09.2008",2008,9,19,0.356966971,4
"HUN_022_MZB_LO_2","HUN_022_MZB_LO_2-22.09.2009","22.09.2009",2009,9,22,0.445137871,3
"HUN_022_MZB_LO_2","HUN_022_MZB_LO_2-29.10.2010","29.10.2010",2010,10,29,0.32372258,4
"HUN_022_MZB_LO_2","HUN_022_MZB_LO_2-27.10.2011","27.10.2011",2011,10,27,0.186588588,5
"HUN_022_MZB_LO_2","HUN_022_MZB_LO_2-12.10.2012","12.10.2012",2012,10,12,0.315588889,4
"HUN_022_MZB_LO_2","HUN_022_MZB_LO_2-03.10.2013","03.10.2013",2013,10,3,0.321558333,4
"HUN_022_MZB_LO_2","HUN_022_MZB_LO_2-10.10.2014","10.10.2014",2014,10,10,0.433009657,3
"HUN_022_MZB_LO_2","HUN_022_MZB_LO_2-01.10.2015","01.10.2015",2015,10,1,0.379418007,4
"HUN_022_MZB_LO_2","HUN_022_MZB_LO_2-31.08.2016","31.08.2016",2016,8,31,0.372699294,4
"HUN_022_MZB_LO_2","HUN_022_MZB_LO_2-31.08.2017","31.08.2017",2017,8,31,0.218276143,4
"HUN_022_MZB_LO_20","HUN_022_MZB_LO_20-09.06.2008","09.06.2008",2008,6,9,0.566784495,3
"HUN_022_MZB_LO_20","HUN_022_MZB_LO_20-25.05.2009","25.05.2009",2009,5,25,0.397354806,4
"HUN_022_MZB_LO_20","HUN_022_MZB_LO_20-04.05.2011","04.05.2011",2011,5,4,0.588363887,3
"HUN_022_MZB_LO_20","HUN_022_MZB_LO_20-09.05.2012","09.05.2012",2012,5,9,0.403894766,3
"HUN_022_MZB_LO_20","HUN_022_MZB_LO_20-07.05.2013","07.05.2013",2013,5,7,0.462397639,3
"HUN_022_MZB_LO_20","HUN_022_MZB_LO_20-05.06.2014","05.06.2014",2014,6,5,0.670338142,2
"HUN_022_MZB_LO_20","HUN_022_MZB_LO_20-18.05.2015","18.05.2015",2015,5,18,0.544411938,3
"HUN_022_MZB_LO_20","HUN_022_MZB_LO_20-10.05.2016","10.05.2016",2016,5,10,0.360375765,4
"HUN_022_MZB_LO_20","HUN_022_MZB_LO_20-19.06.2017","19.06.2017",2017,6,19,0.621129446,2
"HUN_022_MZB_LO_21","HUN_022_MZB_LO_21-08.09.2008","08.09.2008",2008,9,8,0.543894808,3
"HUN_022_MZB_LO_21","HUN_022_MZB_LO_21-12.08.2009","12.08.2009",2009,8,12,0.711703246,2
"HUN_022_MZB_LO_21","HUN_022_MZB_LO_21-30.08.2010","30.08.2010",2010,8,30,0.38292792,4
"HUN_022_MZB_LO_21","HUN_022_MZB_LO_21-21.09.2011","21.09.2011",2011,9,21,0.571269581,3
"HUN_022_MZB_LO_21","HUN_022_MZB_LO_21-01.08.2012","01.08.2012",2012,8,1,0.654038004,2
"HUN_022_MZB_LO_21","HUN_022_MZB_LO_21-11.09.2013","11.09.2013",2013,9,11,0.57018507,3
"HUN_022_MZB_LO_21","HUN_022_MZB_LO_21-06.08.2014","06.08.2014",2014,8,6,0.673886176,2
"HUN_022_MZB_LO_21","HUN_022_MZB_LO_21-06.09.2017","06.09.2017",2017,9,6,0.474371329,3
"HUN_022_MZB_LO_22","HUN_022_MZB_LO_22-11.08.2005","11.08.2005",2005,8,11,0.413694801,3
"HUN_022_MZB_LO_22","HUN_022_MZB_LO_22-13.09.2006","13.09.2006",2006,9,13,0.309211636,4
"HUN_022_MZB_LO_22","HUN_022_MZB_LO_22-18.10.2007","18.10.2007",2007,10,18,0.338853363,4
"HUN_022_MZB_LO_22","HUN_022_MZB_LO_22-29.10.2008","29.10.2008",2008,10,29,0.320845935,4
"HUN_022_MZB_LO_22","HUN_022_MZB_LO_22-24.09.2009","24.09.2009",2009,9,24,0.451035901,3
"HUN_022_MZB_LO_22","HUN_022_MZB_LO_22-06.09.2010","06.09.2010",2010,9,6,0.451283333,3
"HUN_022_MZB_LO_22","HUN_022_MZB_LO_22-25.08.2011","25.08.2011",2011,8,25,0.636784435,2
"HUN_022_MZB_LO_22","HUN_022_MZB_LO_22-06.09.2012","06.09.2012",2012,9,6,0.678427297,2
"HUN_022_MZB_LO_22","HUN_022_MZB_LO_22-02.09.2014","02.09.2014",2014,9,2,0.43321283,3
"HUN_022_MZB_LO_22","HUN_022_MZB_LO_22-18.09.2015","18.09.2015",2015,9,18,0.472625765,3
"HUN_022_MZB_LO_22","HUN_022_MZB_LO_22-08.09.2016","08.09.2016",2016,9,8,0.615229537,2
"HUN_022_MZB_LO_22","HUN_022_MZB_LO_22-02.10.2017","02.10.2017",2017,10,2,0.412373373,3
"HUN_022_MZB_LO_23","HUN_022_MZB_LO_23-18.09.2007","18.09.2007",2007,9,18,0.4198796,3
"HUN_022_MZB_LO_23","HUN_022_MZB_LO_23-14.10.2008","14.10.2008",2008,10,14,0.016678571,5
"HUN_022_MZB_LO_23","HUN_022_MZB_LO_23-01.09.2009","01.09.2009",2009,9,1,0.378171363,4
"HUN_022_MZB_LO_23","HUN_022_MZB_LO_23-13.09.2011","13.09.2011",2011,9,13,0.067322763,5
"HUN_022_MZB_LO_23","HUN_022_MZB_LO_23-26.09.2012","26.09.2012",2012,9,26,0.276522907,4
"HUN_022_MZB_LO_23","HUN_022_MZB_LO_23-20.09.2013","20.09.2013",2013,9,20,0.098309574,5
"HUN_022_MZB_LO_23","HUN_022_MZB_LO_23-14.10.2014","14.10.2014",2014,10,14,0.264984185,4
"HUN_022_MZB_LO_23","HUN_022_MZB_LO_23-24.09.2015","24.09.2015",2015,9,24,0.257129083,4
"HUN_022_MZB_LO_23","HUN_022_MZB_LO_23-14.09.2016","14.09.2016",2016,9,14,0.139721053,5
"HUN_022_MZB_LO_24","HUN_022_MZB_LO_24-18.09.2007","18.09.2007",2007,9,18,0.288920653,4
"HUN_022_MZB_LO_24","HUN_022_MZB_LO_24-07.10.2008","07.10.2008",2008,10,7,0.759857652,2
"HUN_022_MZB_LO_24","HUN_022_MZB_LO_24-06.09.2010","06.09.2010",2010,9,6,0,5
"HUN_022_MZB_LO_24","HUN_022_MZB_LO_24-13.09.2011","13.09.2011",2011,9,13,0.511810215,3
"HUN_022_MZB_LO_24","HUN_022_MZB_LO_24-26.09.2012","26.09.2012",2012,9,26,0.422745893,3
"HUN_022_MZB_LO_24","HUN_022_MZB_LO_24-20.09.2013","20.09.2013",2013,9,20,0.418479092,3
"HUN_022_MZB_LO_24","HUN_022_MZB_LO_24-14.10.2014","14.10.2014",2014,10,14,0.361966071,4
"HUN_022_MZB_LO_24","HUN_022_MZB_LO_24-24.09.2015","24.09.2015",2015,9,24,0.428163431,3
"HUN_022_MZB_LO_24","HUN_022_MZB_LO_24-14.09.2016","14.09.2016",2016,9,14,0.635456234,2
"HUN_022_MZB_LO_25","HUN_022_MZB_LO_25-09.09.2008","09.09.2008",2008,9,9,0.305986784,4
"HUN_022_MZB_LO_25","HUN_022_MZB_LO_25-10.09.2009","10.09.2009",2009,9,10,0.382659139,4
"HUN_022_MZB_LO_25","HUN_022_MZB_LO_25-05.10.2011","05.10.2011",2011,10,5,0.440102648,3
"HUN_022_MZB_LO_25","HUN_022_MZB_LO_25-23.08.2012","23.08.2012",2012,8,23,0.566244763,3
"HUN_022_MZB_LO_25","HUN_022_MZB_LO_25-10.09.2013","10.09.2013",2013,9,10,0.590295766,3
"HUN_022_MZB_LO_25","HUN_022_MZB_LO_25-22.10.2014","22.10.2014",2014,10,22,0.478872784,3
"HUN_022_MZB_LO_25","HUN_022_MZB_LO_25-01.09.2016","01.09.2016",2016,9,1,0.408447744,3
"HUN_022_MZB_LO_25","HUN_022_MZB_LO_25-27.10.2017","27.10.2017",2017,10,27,0.354101786,4
"HUN_022_MZB_LO_28","HUN_022_MZB_LO_28-28.10.2005","28.10.2005",2005,10,28,0.543234119,3
"HUN_022_MZB_LO_28","HUN_022_MZB_LO_28-15.09.2006","15.09.2006",2006,9,15,0.583385726,3
"HUN_022_MZB_LO_28","HUN_022_MZB_LO_28-10.09.2008","10.09.2008",2008,9,10,0.635283892,2
"HUN_022_MZB_LO_28","HUN_022_MZB_LO_28-30.10.2009","30.10.2009",2009,10,30,0.692568628,2
"HUN_022_MZB_LO_28","HUN_022_MZB_LO_28-17.09.2010","17.09.2010",2010,9,17,0.652001297,2
"HUN_022_MZB_LO_28","HUN_022_MZB_LO_28-08.09.2011","08.09.2011",2011,9,8,0.675717904,2
"HUN_022_MZB_LO_28","HUN_022_MZB_LO_28-12.09.2012","12.09.2012",2012,9,12,0.723479924,2
"HUN_022_MZB_LO_28","HUN_022_MZB_LO_28-09.10.2013","09.10.2013",2013,10,9,0.702009859,2
"HUN_022_MZB_LO_28","HUN_022_MZB_LO_28-15.09.2016","15.09.2016",2016,9,15,0.539477451,3
"HUN_022_MZB_LO_28","HUN_022_MZB_LO_28-20.10.2017","20.10.2017",2017,10,20,0.489540519,3
"HUN_022_MZB_LO_29","HUN_022_MZB_LO_29-13.10.2005","13.10.2005",2005,10,13,0.551311236,3
"HUN_022_MZB_LO_29","HUN_022_MZB_LO_29-09.10.2008","09.10.2008",2008,10,9,0.665817954,2
"HUN_022_MZB_LO_29","HUN_022_MZB_LO_29-23.10.2009","23.10.2009",2009,10,23,0.520105792,3
"HUN_022_MZB_LO_29","HUN_022_MZB_LO_29-16.11.2010","16.11.2010",2010,11,16,0.65295372,2
"HUN_022_MZB_LO_29","HUN_022_MZB_LO_29-08.11.2011","08.11.2011",2011,11,8,0.688015437,2
"HUN_022_MZB_LO_29","HUN_022_MZB_LO_29-13.09.2013","13.09.2013",2013,9,13,0.290785777,4
"HUN_022_MZB_LO_29","HUN_022_MZB_LO_29-10.10.2014","10.10.2014",2014,10,10,0.669086984,2
"HUN_022_MZB_LO_29","HUN_022_MZB_LO_29-09.11.2015","09.11.2015",2015,11,9,0.667379973,2
"HUN_022_MZB_LO_3","HUN_022_MZB_LO_3-18.10.2005","18.10.2005",2005,10,18,0.469292188,3
"HUN_022_MZB_LO_3","HUN_022_MZB_LO_3-28.09.2006","28.09.2006",2006,9,28,0.516771695,3
"HUN_022_MZB_LO_3","HUN_022_MZB_LO_3-16.10.2007","16.10.2007",2007,10,16,0.411658468,3
"HUN_022_MZB_LO_3","HUN_022_MZB_LO_3-19.09.2008","19.09.2008",2008,9,19,0.497185067,3
"HUN_022_MZB_LO_3","HUN_022_MZB_LO_3-22.09.2009","22.09.2009",2009,9,22,0.470756533,3
"HUN_022_MZB_LO_3","HUN_022_MZB_LO_3-22.10.2010","22.10.2010",2010,10,22,0.227318625,4
"HUN_022_MZB_LO_3","HUN_022_MZB_LO_3-27.10.2011","27.10.2011",2011,10,27,0.451114846,3
"HUN_022_MZB_LO_3","HUN_022_MZB_LO_3-08.10.2012","08.10.2012",2012,10,8,0.479533997,3
"HUN_022_MZB_LO_3","HUN_022_MZB_LO_3-02.10.2013","02.10.2013",2013,10,2,0.576226912,3
"HUN_022_MZB_LO_3","HUN_022_MZB_LO_3-10.10.2014","10.10.2014",2014,10,10,0.440647238,3
"HUN_022_MZB_LO_3","HUN_022_MZB_LO_3-01.10.2015","01.10.2015",2015,10,1,0.436878431,3
"HUN_022_MZB_LO_3","HUN_022_MZB_LO_3-01.09.2016","01.09.2016",2016,9,1,0.400148318,3
"HUN_022_MZB_LO_3","HUN_022_MZB_LO_3-22.08.2017","22.08.2017",2017,8,22,0.404012034,3
"HUN_022_MZB_LO_30","HUN_022_MZB_LO_30-13.10.2005","13.10.2005",2005,10,13,0.5315494,3
"HUN_022_MZB_LO_30","HUN_022_MZB_LO_30-03.09.2007","03.09.2007",2007,9,3,0.574331954,3
"HUN_022_MZB_LO_30","HUN_022_MZB_LO_30-09.10.2008","09.10.2008",2008,10,9,0.654105657,2
"HUN_022_MZB_LO_30","HUN_022_MZB_LO_30-23.11.2009","23.11.2009",2009,11,23,0.605619775,2
"HUN_022_MZB_LO_30","HUN_022_MZB_LO_30-16.11.2010","16.11.2010",2010,11,16,0.471226596,3
"HUN_022_MZB_LO_30","HUN_022_MZB_LO_30-08.11.2011","08.11.2011",2011,11,8,0.711679094,2
"HUN_022_MZB_LO_30","HUN_022_MZB_LO_30-13.09.2013","13.09.2013",2013,9,13,0.380358566,4
"HUN_022_MZB_LO_30","HUN_022_MZB_LO_30-25.11.2014","25.11.2014",2014,11,25,0.550919501,3
"HUN_022_MZB_LO_30","HUN_022_MZB_LO_30-09.11.2015","09.11.2015",2015,11,9,0.761862585,2
"HUN_022_MZB_LO_30","HUN_022_MZB_LO_30-16.09.2016","16.09.2016",2016,9,16,0.60596699,2
"HUN_022_MZB_LO_30","HUN_022_MZB_LO_30-08.09.2017","08.09.2017",2017,9,8,0.666771822,2
"HUN_022_MZB_LO_31","HUN_022_MZB_LO_31-26.09.2005","26.09.2005",2005,9,26,0.822624419,1
"HUN_022_MZB_LO_31","HUN_022_MZB_LO_31-16.09.2006","16.09.2006",2006,9,16,0.795404708,2
"HUN_022_MZB_LO_31","HUN_022_MZB_LO_31-12.09.2007","12.09.2007",2007,9,12,0.471458906,3
"HUN_022_MZB_LO_31","HUN_022_MZB_LO_31-09.09.2008","09.09.2008",2008,9,9,0.803469624,1
"HUN_022_MZB_LO_31","HUN_022_MZB_LO_31-09.09.2009","09.09.2009",2009,9,9,0.753601267,2
"HUN_022_MZB_LO_31","HUN_022_MZB_LO_31-23.09.2011","23.09.2011",2011,9,23,0.806617175,1
"HUN_022_MZB_LO_31","HUN_022_MZB_LO_31-04.10.2012","04.10.2012",2012,10,4,0.687444092,2
"HUN_022_MZB_LO_31","HUN_022_MZB_LO_31-30.09.2013","30.09.2013",2013,9,30,0.76839132,2
"HUN_022_MZB_LO_31","HUN_022_MZB_LO_31-25.09.2014","25.09.2014",2014,9,25,0.646691136,2
"HUN_022_MZB_LO_31","HUN_022_MZB_LO_31-10.09.2015","10.09.2015",2015,9,10,0.71575663,2
"HUN_022_MZB_LO_31","HUN_022_MZB_LO_31-20.09.2016","20.09.2016",2016,9,20,0.325761918,4
"HUN_022_MZB_LO_31","HUN_022_MZB_LO_31-14.09.2017","14.09.2017",2017,9,14,0.555568182,3
"HUN_022_MZB_LO_32","HUN_022_MZB_LO_32-11.04.2007","11.04.2007",2007,4,11,0.631098054,2
"HUN_022_MZB_LO_32","HUN_022_MZB_LO_32-13.06.2008","13.06.2008",2008,6,13,0.375823621,4
"HUN_022_MZB_LO_32","HUN_022_MZB_LO_32-06.05.2009","06.05.2009",2009,5,6,0.786620192,2
"HUN_022_MZB_LO_32","HUN_022_MZB_LO_32-27.04.2010","27.04.2010",2010,4,27,0.884971959,1
"HUN_022_MZB_LO_32","HUN_022_MZB_LO_32-26.05.2011","26.05.2011",2011,5,26,0.52997081,3
"HUN_022_MZB_LO_32","HUN_022_MZB_LO_32-18.05.2012","18.05.2012",2012,5,18,0.21875,4
"HUN_022_MZB_LO_32","HUN_022_MZB_LO_32-18.06.2014","18.06.2014",2014,6,18,0.575043619,3
"HUN_022_MZB_LO_32","HUN_022_MZB_LO_32-25.06.2015","25.06.2015",2015,6,25,0.638864583,2
"HUN_022_MZB_LO_32","HUN_022_MZB_LO_32-19.05.2016","19.05.2016",2016,5,19,0.421690677,3
"HUN_022_MZB_LO_32","HUN_022_MZB_LO_32-23.05.2017","23.05.2017",2017,5,23,0.61534938,2
"HUN_022_MZB_LO_33","HUN_022_MZB_LO_33-25.10.2005","25.10.2005",2005,10,25,0.236446918,4
"HUN_022_MZB_LO_33","HUN_022_MZB_LO_33-30.09.2006","30.09.2006",2006,9,30,0.219718964,4
"HUN_022_MZB_LO_33","HUN_022_MZB_LO_33-11.09.2007","11.09.2007",2007,9,11,0.276850118,4
"HUN_022_MZB_LO_33","HUN_022_MZB_LO_33-19.09.2008","19.09.2008",2008,9,19,0.094615817,5
"HUN_022_MZB_LO_33","HUN_022_MZB_LO_33-15.09.2009","15.09.2009",2009,9,15,0.472495734,3
"HUN_022_MZB_LO_33","HUN_022_MZB_LO_33-08.10.2010","08.10.2010",2010,10,8,0.407365126,3
"HUN_022_MZB_LO_33","HUN_022_MZB_LO_33-30.09.2011","30.09.2011",2011,9,30,0.343581343,4
"HUN_022_MZB_LO_33","HUN_022_MZB_LO_33-19.10.2012","19.10.2012",2012,10,19,0.471347091,3
"HUN_022_MZB_LO_33","HUN_022_MZB_LO_33-02.10.2014","02.10.2014",2014,10,2,0.510038216,3
"HUN_022_MZB_LO_33","HUN_022_MZB_LO_33-01.10.2015","01.10.2015",2015,10,1,0.604676272,2
"HUN_022_MZB_LO_33","HUN_022_MZB_LO_33-19.09.2016","19.09.2016",2016,9,19,0.251058537,4
"HUN_022_MZB_LO_33","HUN_022_MZB_LO_33-08.09.2017","08.09.2017",2017,9,8,0.402252841,3
"HUN_022_MZB_LO_35","HUN_022_MZB_LO_35-11.08.2005","11.08.2005",2005,8,11,0.432978125,3
"HUN_022_MZB_LO_35","HUN_022_MZB_LO_35-13.09.2006","13.09.2006",2006,9,13,0.319590217,4
"HUN_022_MZB_LO_35","HUN_022_MZB_LO_35-18.10.2007","18.10.2007",2007,10,18,0.393162992,4
"HUN_022_MZB_LO_35","HUN_022_MZB_LO_35-29.10.2008","29.10.2008",2008,10,29,0.48600195,3
"HUN_022_MZB_LO_35","HUN_022_MZB_LO_35-24.09.2009","24.09.2009",2009,9,24,0.494649298,3
"HUN_022_MZB_LO_35","HUN_022_MZB_LO_35-06.09.2010","06.09.2010",2010,9,6,0.242647059,4
"HUN_022_MZB_LO_35","HUN_022_MZB_LO_35-25.08.2011","25.08.2011",2011,8,25,0.46368628,3
"HUN_022_MZB_LO_35","HUN_022_MZB_LO_35-06.09.2012","06.09.2012",2012,9,6,0.512132646,3
"HUN_022_MZB_LO_35","HUN_022_MZB_LO_35-02.09.2014","02.09.2014",2014,9,2,0.43321283,3
"HUN_022_MZB_LO_35","HUN_022_MZB_LO_35-18.09.2015","18.09.2015",2015,9,18,0.347910313,4
"HUN_022_MZB_LO_35","HUN_022_MZB_LO_35-08.09.2016","08.09.2016",2016,9,8,0.509299695,3
"HUN_022_MZB_LO_35","HUN_022_MZB_LO_35-02.10.2017","02.10.2017",2017,10,2,0.259944388,4
"HUN_022_MZB_LO_36","HUN_022_MZB_LO_36-26.09.2005","26.09.2005",2005,9,26,0.387925646,4
"HUN_022_MZB_LO_36","HUN_022_MZB_LO_36-16.09.2006","16.09.2006",2006,9,16,0.737573077,2
"HUN_022_MZB_LO_36","HUN_022_MZB_LO_36-18.09.2008","18.09.2008",2008,9,18,0.705031317,2
"HUN_022_MZB_LO_36","HUN_022_MZB_LO_36-08.09.2009","08.09.2009",2009,9,8,0.805430404,1
"HUN_022_MZB_LO_36","HUN_022_MZB_LO_36-30.09.2010","30.09.2010",2010,9,30,0.547557292,3
"HUN_022_MZB_LO_36","HUN_022_MZB_LO_36-23.09.2011","23.09.2011",2011,9,23,0.847832033,1
"HUN_022_MZB_LO_36","HUN_022_MZB_LO_36-20.09.2012","20.09.2012",2012,9,20,0.705558008,2
"HUN_022_MZB_LO_36","HUN_022_MZB_LO_36-12.09.2013","12.09.2013",2013,9,12,0.689459918,2
"HUN_022_MZB_LO_36","HUN_022_MZB_LO_36-25.09.2014","25.09.2014",2014,9,25,0.640509163,2
"HUN_022_MZB_LO_36","HUN_022_MZB_LO_36-10.09.2015","10.09.2015",2015,9,10,0.834279943,1
"HUN_022_MZB_LO_36","HUN_022_MZB_LO_36-20.09.2016","20.09.2016",2016,9,20,0.731993182,2
"HUN_022_MZB_LO_36","HUN_022_MZB_LO_36-14.09.2017","14.09.2017",2017,9,14,0.763816427,2
"HUN_022_MZB_LO_37","HUN_022_MZB_LO_37-04.05.2005","04.05.2005",2005,5,4,0.683432094,2
"HUN_022_MZB_LO_37","HUN_022_MZB_LO_37-16.05.2006","16.05.2006",2006,5,16,0.465159454,3
"HUN_022_MZB_LO_37","HUN_022_MZB_LO_37-04.04.2007","04.04.2007",2007,4,4,0.534998739,3
"HUN_022_MZB_LO_37","HUN_022_MZB_LO_37-20.05.2008","20.05.2008",2008,5,20,0,5
"HUN_022_MZB_LO_37","HUN_022_MZB_LO_37-12.05.2009","12.05.2009",2009,5,12,0.681360417,2
"HUN_022_MZB_LO_37","HUN_022_MZB_LO_37-29.04.2010","29.04.2010",2010,4,29,0.710313852,2
"HUN_022_MZB_LO_37","HUN_022_MZB_LO_37-27.04.2011","27.04.2011",2011,4,27,0.794969878,2
"HUN_022_MZB_LO_37","HUN_022_MZB_LO_37-07.05.2012","07.05.2012",2012,5,7,0.452212121,3
"HUN_022_MZB_LO_37","HUN_022_MZB_LO_37-22.05.2013","22.05.2013",2013,5,22,0.123031783,5
"HUN_022_MZB_LO_37","HUN_022_MZB_LO_37-09.05.2014","09.05.2014",2014,5,9,0.45795,3
"HUN_022_MZB_LO_37","HUN_022_MZB_LO_37-14.05.2015","14.05.2015",2015,5,14,0.410766513,3
"HUN_022_MZB_LO_37","HUN_022_MZB_LO_37-04.05.2016","04.05.2016",2016,5,4,0.226593864,4
"HUN_022_MZB_LO_37","HUN_022_MZB_LO_37-18.05.2017","18.05.2017",2017,5,18,0.467865152,3
"HUN_022_MZB_LO_38","HUN_022_MZB_LO_38-23.05.2005","23.05.2005",2005,5,23,0.046438462,5
"HUN_022_MZB_LO_38","HUN_022_MZB_LO_38-20.05.2008","20.05.2008",2008,5,20,0.146972409,5
"HUN_022_MZB_LO_38","HUN_022_MZB_LO_38-12.05.2009","12.05.2009",2009,5,12,0.290028123,4
"HUN_022_MZB_LO_38","HUN_022_MZB_LO_38-29.04.2010","29.04.2010",2010,4,29,0.352361178,4
"HUN_022_MZB_LO_38","HUN_022_MZB_LO_38-27.04.2011","27.04.2011",2011,4,27,0.557204583,3
"HUN_022_MZB_LO_38","HUN_022_MZB_LO_38-07.05.2012","07.05.2012",2012,5,7,0.719965789,2
"HUN_022_MZB_LO_38","HUN_022_MZB_LO_38-22.05.2013","22.05.2013",2013,5,22,0.629839286,2
"HUN_022_MZB_LO_38","HUN_022_MZB_LO_38-09.05.2014","09.05.2014",2014,5,9,0.617034884,2
"HUN_022_MZB_LO_38","HUN_022_MZB_LO_38-14.05.2015","14.05.2015",2015,5,14,0.343784326,4
"HUN_022_MZB_LO_38","HUN_022_MZB_LO_38-04.05.2016","04.05.2016",2016,5,4,0.487773288,3
"HUN_022_MZB_LO_38","HUN_022_MZB_LO_38-18.05.2017","18.05.2017",2017,5,18,0.38143349,4
"HUN_022_MZB_LO_39","HUN_022_MZB_LO_39-14.04.2005","14.04.2005",2005,4,14,0.16494113,5
"HUN_022_MZB_LO_39","HUN_022_MZB_LO_39-09.05.2006","09.05.2006",2006,5,9,0.267895894,4
"HUN_022_MZB_LO_39","HUN_022_MZB_LO_39-17.04.2007","17.04.2007",2007,4,17,0.511558566,3
"HUN_022_MZB_LO_39","HUN_022_MZB_LO_39-20.05.2008","20.05.2008",2008,5,20,0.514980137,3
"HUN_022_MZB_LO_39","HUN_022_MZB_LO_39-09.05.2009","09.05.2009",2009,5,9,0.569648117,3
"HUN_022_MZB_LO_39","HUN_022_MZB_LO_39-26.05.2011","26.05.2011",2011,5,26,0.506640396,3
"HUN_022_MZB_LO_39","HUN_022_MZB_LO_39-10.04.2012","10.04.2012",2012,4,10,0.703420588,2
"HUN_022_MZB_LO_39","HUN_022_MZB_LO_39-26.04.2013","26.04.2013",2013,4,26,0.540535565,3
"HUN_022_MZB_LO_39","HUN_022_MZB_LO_39-29.04.2014","29.04.2014",2014,4,29,0.512813879,3
"HUN_022_MZB_LO_39","HUN_022_MZB_LO_39-11.06.2015","11.06.2015",2015,6,11,0.439660814,3
"HUN_022_MZB_LO_39","HUN_022_MZB_LO_39-28.04.2016","28.04.2016",2016,4,28,0.378886735,4
"HUN_022_MZB_LO_39","HUN_022_MZB_LO_39-19.06.2017","19.06.2017",2017,6,19,0.598978888,3
"HUN_022_MZB_LO_4","HUN_022_MZB_LO_4-09.06.2005","09.06.2005",2005,6,9,0.616945272,2
"HUN_022_MZB_LO_4","HUN_022_MZB_LO_4-27.06.2006","27.06.2006",2006,6,27,0.545359419,3
"HUN_022_MZB_LO_4","HUN_022_MZB_LO_4-17.05.2007","17.05.2007",2007,5,17,0.536350653,3
"HUN_022_MZB_LO_4","HUN_022_MZB_LO_4-22.04.2008","22.04.2008",2008,4,22,0.561661009,3
"HUN_022_MZB_LO_4","HUN_022_MZB_LO_4-26.05.2009","26.05.2009",2009,5,26,0.596292215,3
"HUN_022_MZB_LO_4","HUN_022_MZB_LO_4-27.04.2010","27.04.2010",2010,4,27,0.526313462,3
"HUN_022_MZB_LO_4","HUN_022_MZB_LO_4-12.04.2011","12.04.2011",2011,4,12,0.332044331,4
"HUN_022_MZB_LO_4","HUN_022_MZB_LO_4-10.05.2012","10.05.2012",2012,5,10,0.47679817,3
"HUN_022_MZB_LO_4","HUN_022_MZB_LO_4-17.04.2014","17.04.2014",2014,4,17,0.556495239,3
"HUN_022_MZB_LO_4","HUN_022_MZB_LO_4-11.06.2015","11.06.2015",2015,6,11,0.410306082,3
"HUN_022_MZB_LO_4","HUN_022_MZB_LO_4-21.04.2016","21.04.2016",2016,4,21,0.416853313,3
"HUN_022_MZB_LO_4","HUN_022_MZB_LO_4-31.05.2017","31.05.2017",2017,5,31,0.341469835,4
"HUN_022_MZB_LO_40","HUN_022_MZB_LO_40-17.10.2007","17.10.2007",2007,10,17,0.302133756,4
"HUN_022_MZB_LO_40","HUN_022_MZB_LO_40-28.10.2008","28.10.2008",2008,10,28,0.471832261,3
"HUN_022_MZB_LO_40","HUN_022_MZB_LO_40-14.09.2009","14.09.2009",2009,9,14,0.597785399,3
"HUN_022_MZB_LO_40","HUN_022_MZB_LO_40-13.09.2010","13.09.2010",2010,9,13,0.472361719,3
"HUN_022_MZB_LO_40","HUN_022_MZB_LO_40-12.09.2011","12.09.2011",2011,9,12,0.515879321,3
"HUN_022_MZB_LO_40","HUN_022_MZB_LO_40-15.10.2012","15.10.2012",2012,10,15,0.534284035,3
"HUN_022_MZB_LO_40","HUN_022_MZB_LO_40-14.10.2013","14.10.2013",2013,10,14,0.606123829,2
"HUN_022_MZB_LO_40","HUN_022_MZB_LO_40-01.09.2014","01.09.2014",2014,9,1,0.419047034,3
"HUN_022_MZB_LO_40","HUN_022_MZB_LO_40-21.09.2015","21.09.2015",2015,9,21,0.617084841,2
"HUN_022_MZB_LO_40","HUN_022_MZB_LO_40-08.09.2016","08.09.2016",2016,9,8,0.535192172,3
"HUN_022_MZB_LO_40","HUN_022_MZB_LO_40-12.09.2017","12.09.2017",2017,9,12,0.50145507,3
"HUN_022_MZB_LO_41","HUN_022_MZB_LO_41-15.10.2007","15.10.2007",2007,10,15,0.542768466,3
"HUN_022_MZB_LO_41","HUN_022_MZB_LO_41-13.10.2008","13.10.2008",2008,10,13,0.647668167,2
"HUN_022_MZB_LO_41","HUN_022_MZB_LO_41-09.09.2009","09.09.2009",2009,9,9,0.57775622,3
"HUN_022_MZB_LO_41","HUN_022_MZB_LO_41-06.09.2010","06.09.2010",2010,9,6,0.495122463,3
"HUN_022_MZB_LO_41","HUN_022_MZB_LO_41-06.09.2011","06.09.2011",2011,9,6,0.487135104,3
"HUN_022_MZB_LO_41","HUN_022_MZB_LO_41-10.09.2012","10.09.2012",2012,9,10,0.53791163,3
"HUN_022_MZB_LO_41","HUN_022_MZB_LO_41-17.10.2013","17.10.2013",2013,10,17,0.895536674,1
"HUN_022_MZB_LO_41","HUN_022_MZB_LO_41-18.08.2014","18.08.2014",2014,8,18,0.567616532,3
"HUN_022_MZB_LO_41","HUN_022_MZB_LO_41-02.09.2015","02.09.2015",2015,9,2,0.498168182,3
"HUN_022_MZB_LO_41","HUN_022_MZB_LO_41-20.09.2016","20.09.2016",2016,9,20,0.443220187,3
"HUN_022_MZB_LO_41","HUN_022_MZB_LO_41-28.09.2017","28.09.2017",2017,9,28,0.427613624,3
"HUN_022_MZB_LO_42","HUN_022_MZB_LO_42-09.10.2007","09.10.2007",2007,10,9,0.336068654,4
"HUN_022_MZB_LO_42","HUN_022_MZB_LO_42-29.10.2008","29.10.2008",2008,10,29,0.484207463,3
"HUN_022_MZB_LO_42","HUN_022_MZB_LO_42-14.09.2009","14.09.2009",2009,9,14,0.376732601,4
"HUN_022_MZB_LO_42","HUN_022_MZB_LO_42-13.09.2010","13.09.2010",2010,9,13,0.534299386,3
"HUN_022_MZB_LO_42","HUN_022_MZB_LO_42-12.09.2011","12.09.2011",2011,9,12,0.577181305,3
"HUN_022_MZB_LO_42","HUN_022_MZB_LO_42-15.10.2012","15.10.2012",2012,10,15,0.450953731,3
"HUN_022_MZB_LO_42","HUN_022_MZB_LO_42-24.10.2013","24.10.2013",2013,10,24,0.431280769,3
"HUN_022_MZB_LO_42","HUN_022_MZB_LO_42-01.09.2014","01.09.2014",2014,9,1,0.396614951,4
"HUN_022_MZB_LO_42","HUN_022_MZB_LO_42-21.09.2015","21.09.2015",2015,9,21,0.487393382,3
"HUN_022_MZB_LO_42","HUN_022_MZB_LO_42-30.08.2016","30.08.2016",2016,8,30,0.304069263,4
"HUN_022_MZB_LO_42","HUN_022_MZB_LO_42-12.09.2017","12.09.2017",2017,9,12,0.4433,3
"HUN_022_MZB_LO_43","HUN_022_MZB_LO_43-18.09.2006","18.09.2006",2006,9,18,0.55266518,3
"HUN_022_MZB_LO_43","HUN_022_MZB_LO_43-03.09.2007","03.09.2007",2007,9,3,0.498631335,3
"HUN_022_MZB_LO_43","HUN_022_MZB_LO_43-13.10.2008","13.10.2008",2008,10,13,0.670493452,2
"HUN_022_MZB_LO_43","HUN_022_MZB_LO_43-07.10.2009","07.10.2009",2009,10,7,0.617903737,2
"HUN_022_MZB_LO_43","HUN_022_MZB_LO_43-20.10.2010","20.10.2010",2010,10,20,0.256721364,4
"HUN_022_MZB_LO_43","HUN_022_MZB_LO_43-08.09.2011","08.09.2011",2011,9,8,0.713879462,2
"HUN_022_MZB_LO_43","HUN_022_MZB_LO_43-19.09.2012","19.09.2012",2012,9,19,0.690219213,2
"HUN_022_MZB_LO_43","HUN_022_MZB_LO_43-18.09.2013","18.09.2013",2013,9,18,0.511857749,3
"HUN_022_MZB_LO_43","HUN_022_MZB_LO_43-01.10.2014","01.10.2014",2014,10,1,0.622691667,2
"HUN_022_MZB_LO_43","HUN_022_MZB_LO_43-01.09.2015","01.09.2015",2015,9,1,0.647825,2
"HUN_022_MZB_LO_43","HUN_022_MZB_LO_43-07.09.2016","07.09.2016",2016,9,7,0.538217568,3
"HUN_022_MZB_LO_43","HUN_022_MZB_LO_43-06.09.2017","06.09.2017",2017,9,6,0.601620634,2
"HUN_022_MZB_LO_44","HUN_022_MZB_LO_44-18.09.2006","18.09.2006",2006,9,18,0.406961059,3
"HUN_022_MZB_LO_44","HUN_022_MZB_LO_44-03.09.2007","03.09.2007",2007,9,3,0.489175969,3
"HUN_022_MZB_LO_44","HUN_022_MZB_LO_44-13.10.2008","13.10.2008",2008,10,13,0.632298105,2
"HUN_022_MZB_LO_44","HUN_022_MZB_LO_44-07.10.2009","07.10.2009",2009,10,7,0.735565351,2
"HUN_022_MZB_LO_44","HUN_022_MZB_LO_44-21.10.2010","21.10.2010",2010,10,21,0.557968962,3
"HUN_022_MZB_LO_44","HUN_022_MZB_LO_44-08.09.2011","08.09.2011",2011,9,8,0.519240835,3
"HUN_022_MZB_LO_44","HUN_022_MZB_LO_44-19.09.2012","19.09.2012",2012,9,19,0.574963438,3
"HUN_022_MZB_LO_44","HUN_022_MZB_LO_44-18.09.2013","18.09.2013",2013,9,18,0.693898977,2
"HUN_022_MZB_LO_44","HUN_022_MZB_LO_44-01.10.2014","01.10.2014",2014,10,1,0.421599367,3
"HUN_022_MZB_LO_44","HUN_022_MZB_LO_44-01.09.2015","01.09.2015",2015,9,1,0.463115272,3
"HUN_022_MZB_LO_44","HUN_022_MZB_LO_44-07.09.2016","07.09.2016",2016,9,7,0.563954006,3
"HUN_022_MZB_LO_44","HUN_022_MZB_LO_44-06.09.2017","06.09.2017",2017,9,6,0.391088667,4
"HUN_022_MZB_LO_45","HUN_022_MZB_LO_45-03.09.2007","03.09.2007",2007,9,3,0.604665281,2
"HUN_022_MZB_LO_45","HUN_022_MZB_LO_45-14.10.2008","14.10.2008",2008,10,14,0.818477842,1
"HUN_022_MZB_LO_45","HUN_022_MZB_LO_45-09.09.2009","09.09.2009",2009,9,9,0.897315147,1
"HUN_022_MZB_LO_45","HUN_022_MZB_LO_45-21.10.2010","21.10.2010",2010,10,21,0.731018333,2
"HUN_022_MZB_LO_45","HUN_022_MZB_LO_45-08.09.2011","08.09.2011",2011,9,8,0.707689862,2
"HUN_022_MZB_LO_45","HUN_022_MZB_LO_45-19.09.2012","19.09.2012",2012,9,19,0.750736364,2
"HUN_022_MZB_LO_45","HUN_022_MZB_LO_45-18.09.2013","18.09.2013",2013,9,18,0.621664726,2
"HUN_022_MZB_LO_45","HUN_022_MZB_LO_45-01.10.2014","01.10.2014",2014,10,1,0.66286429,2
"HUN_022_MZB_LO_45","HUN_022_MZB_LO_45-01.09.2015","01.09.2015",2015,9,1,0.624975,2
"HUN_022_MZB_LO_45","HUN_022_MZB_LO_45-07.09.2016","07.09.2016",2016,9,7,0.72706625,2
"HUN_022_MZB_LO_45","HUN_022_MZB_LO_45-06.09.2017","06.09.2017",2017,9,6,0.558307509,3
"HUN_022_MZB_LO_46","HUN_022_MZB_LO_46-10.09.2007","10.09.2007",2007,9,10,0.552306944,3
"HUN_022_MZB_LO_46","HUN_022_MZB_LO_46-13.10.2008","13.10.2008",2008,10,13,0.364776869,4
"HUN_022_MZB_LO_46","HUN_022_MZB_LO_46-13.10.2009","13.10.2009",2009,10,13,0.315057069,4
"HUN_022_MZB_LO_46","HUN_022_MZB_LO_46-19.10.2010","19.10.2010",2010,10,19,0.669531013,2
"HUN_022_MZB_LO_46","HUN_022_MZB_LO_46-22.09.2011","22.09.2011",2011,9,22,0.414593351,3
"HUN_022_MZB_LO_46","HUN_022_MZB_LO_46-18.10.2012","18.10.2012",2012,10,18,0.399701173,4
"HUN_022_MZB_LO_46","HUN_022_MZB_LO_46-24.10.2013","24.10.2013",2013,10,24,0.363252093,4
"HUN_022_MZB_LO_46","HUN_022_MZB_LO_46-24.09.2014","24.09.2014",2014,9,24,0.330283404,4
"HUN_022_MZB_LO_46","HUN_022_MZB_LO_46-23.09.2015","23.09.2015",2015,9,23,0.429128727,3
"HUN_022_MZB_LO_46","HUN_022_MZB_LO_46-14.09.2016","14.09.2016",2016,9,14,0.401109101,3
"HUN_022_MZB_LO_46","HUN_022_MZB_LO_46-28.09.2017","28.09.2017",2017,9,28,0.392117651,4
"HUN_022_MZB_LO_47","HUN_022_MZB_LO_47-19.05.2005","19.05.2005",2005,5,19,0.491240987,3
"HUN_022_MZB_LO_47","HUN_022_MZB_LO_47-25.05.2006","25.05.2006",2006,5,25,0.49885458,3
"HUN_022_MZB_LO_47","HUN_022_MZB_LO_47-26.04.2007","26.04.2007",2007,4,26,0.549133926,3
"HUN_022_MZB_LO_47","HUN_022_MZB_LO_47-30.05.2008","30.05.2008",2008,5,30,0.187984458,5
"HUN_022_MZB_LO_47","HUN_022_MZB_LO_47-08.05.2009","08.05.2009",2009,5,8,0.432308365,3
"HUN_022_MZB_LO_47","HUN_022_MZB_LO_47-11.05.2010","11.05.2010",2010,5,11,0.480196388,3
"HUN_022_MZB_LO_47","HUN_022_MZB_LO_47-11.05.2011","11.05.2011",2011,5,11,0.485831571,3
"HUN_022_MZB_LO_47","HUN_022_MZB_LO_47-02.05.2012","02.05.2012",2012,5,2,0.528500728,3
"HUN_022_MZB_LO_47","HUN_022_MZB_LO_47-30.04.2013","30.04.2013",2013,4,30,0.556585173,3
"HUN_022_MZB_LO_47","HUN_022_MZB_LO_47-05.05.2014","05.05.2014",2014,5,5,0.719294055,2
"HUN_022_MZB_LO_47","HUN_022_MZB_LO_47-08.05.2015","08.05.2015",2015,5,8,0.669905059,2
"HUN_022_MZB_LO_47","HUN_022_MZB_LO_47-06.04.2016","06.04.2016",2016,4,6,0.522863787,3
"HUN_022_MZB_LO_48","HUN_022_MZB_LO_48-11.04.2005","11.04.2005",2005,4,11,0.556044215,3
"HUN_022_MZB_LO_48","HUN_022_MZB_LO_48-17.05.2007","17.05.2007",2007,5,17,0.551099405,3
"HUN_022_MZB_LO_48","HUN_022_MZB_LO_48-25.04.2008","25.04.2008",2008,4,25,0.175819283,5
"HUN_022_MZB_LO_48","HUN_022_MZB_LO_48-03.04.2009","03.04.2009",2009,4,3,0.402713748,3
"HUN_022_MZB_LO_48","HUN_022_MZB_LO_48-05.05.2010","05.05.2010",2010,5,5,0.637750494,2
"HUN_022_MZB_LO_48","HUN_022_MZB_LO_48-05.05.2011","05.05.2011",2011,5,5,0.584761091,3
"HUN_022_MZB_LO_48","HUN_022_MZB_LO_48-03.05.2012","03.05.2012",2012,5,3,0.619356835,2
"HUN_022_MZB_LO_48","HUN_022_MZB_LO_48-08.05.2013","08.05.2013",2013,5,8,0.654475734,2
"HUN_022_MZB_LO_48","HUN_022_MZB_LO_48-03.04.2014","03.04.2014",2014,4,3,0.533065231,3
"HUN_022_MZB_LO_48","HUN_022_MZB_LO_48-22.04.2015","22.04.2015",2015,4,22,0.350789749,4
"HUN_022_MZB_LO_48","HUN_022_MZB_LO_48-13.04.2016","13.04.2016",2016,4,13,0.549916069,3
"HUN_022_MZB_LO_48","HUN_022_MZB_LO_48-28.04.2017","28.04.2017",2017,4,28,0.699886395,2
"HUN_022_MZB_LO_49","HUN_022_MZB_LO_49-05.04.2005","05.04.2005",2005,4,5,0.272556094,4
"HUN_022_MZB_LO_49","HUN_022_MZB_LO_49-03.04.2007","03.04.2007",2007,4,3,0.51524012,3
"HUN_022_MZB_LO_49","HUN_022_MZB_LO_49-12.04.2010","12.04.2010",2010,4,12,0.195211537,5
"HUN_022_MZB_LO_49","HUN_022_MZB_LO_49-30.03.2011","30.03.2011",2011,3,30,0.322124534,4
"HUN_022_MZB_LO_49","HUN_022_MZB_LO_49-18.04.2012","18.04.2012",2012,4,18,0.231227096,4
"HUN_022_MZB_LO_49","HUN_022_MZB_LO_49-18.04.2013","18.04.2013",2013,4,18,0.36269678,4
"HUN_022_MZB_LO_49","HUN_022_MZB_LO_49-31.03.2014","31.03.2014",2014,3,31,0.191366306,5
"HUN_022_MZB_LO_49","HUN_022_MZB_LO_49-22.05.2015","22.05.2015",2015,5,22,0.236401467,4
"HUN_022_MZB_LO_5","HUN_022_MZB_LO_5-04.10.2005","04.10.2005",2005,10,4,0.204545455,4
"HUN_022_MZB_LO_5","HUN_022_MZB_LO_5-28.09.2006","28.09.2006",2006,9,28,0.323922377,4
"HUN_022_MZB_LO_5","HUN_022_MZB_LO_5-16.10.2007","16.10.2007",2007,10,16,0.223529079,4
"HUN_022_MZB_LO_5","HUN_022_MZB_LO_5-05.09.2008","05.09.2008",2008,9,5,0.31487368,4
"HUN_022_MZB_LO_5","HUN_022_MZB_LO_5-22.09.2009","22.09.2009",2009,9,22,0.313490516,4
"HUN_022_MZB_LO_5","HUN_022_MZB_LO_5-24.09.2010","24.09.2010",2010,9,24,0.207819024,4
"HUN_022_MZB_LO_5","HUN_022_MZB_LO_5-27.10.2011","27.10.2011",2011,10,27,0.281230733,4
"HUN_022_MZB_LO_5","HUN_022_MZB_LO_5-12.10.2012","12.10.2012",2012,10,12,0.38374934,4
"HUN_022_MZB_LO_5","HUN_022_MZB_LO_5-03.10.2013","03.10.2013",2013,10,3,0.307685978,4
"HUN_022_MZB_LO_5","HUN_022_MZB_LO_5-14.10.2014","14.10.2014",2014,10,14,0.405350041,3
"HUN_022_MZB_LO_5","HUN_022_MZB_LO_5-05.10.2015","05.10.2015",2015,10,5,0.338531815,4
"HUN_022_MZB_LO_5","HUN_022_MZB_LO_5-30.08.2016","30.08.2016",2016,8,30,0.318623826,4
"HUN_022_MZB_LO_5","HUN_022_MZB_LO_5-31.08.2017","31.08.2017",2017,8,31,0.333175735,4
"HUN_022_MZB_LO_50","HUN_022_MZB_LO_50-30.09.2008","30.09.2008",2008,9,30,0.848964309,1
"HUN_022_MZB_LO_50","HUN_022_MZB_LO_50-04.08.2009","04.08.2009",2009,8,4,0.779579866,2
"HUN_022_MZB_LO_50","HUN_022_MZB_LO_50-01.08.2011","01.08.2011",2011,8,1,0.635208824,2
"HUN_022_MZB_LO_50","HUN_022_MZB_LO_50-06.08.2012","06.08.2012",2012,8,6,0.432954307,3
"HUN_022_MZB_LO_50","HUN_022_MZB_LO_50-10.09.2013","10.09.2013",2013,9,10,0.598468791,3
"HUN_022_MZB_LO_50","HUN_022_MZB_LO_50-26.08.2014","26.08.2014",2014,8,26,0.607822886,2
"HUN_022_MZB_LO_50","HUN_022_MZB_LO_50-10.08.2015","10.08.2015",2015,8,10,0.5635125,3
"HUN_022_MZB_LO_50","HUN_022_MZB_LO_50-31.08.2016","31.08.2016",2016,8,31,0.421386622,3
"HUN_022_MZB_LO_50","HUN_022_MZB_LO_50-29.08.2017","29.08.2017",2017,8,29,0.567970771,3
"HUN_022_MZB_LO_51","HUN_022_MZB_LO_51-05.10.2005","05.10.2005",2005,10,5,0.679317541,2
"HUN_022_MZB_LO_51","HUN_022_MZB_LO_51-03.09.2007","03.09.2007",2007,9,3,0.639145588,2
"HUN_022_MZB_LO_51","HUN_022_MZB_LO_51-29.09.2008","29.09.2008",2008,9,29,0.27481828,4
"HUN_022_MZB_LO_51","HUN_022_MZB_LO_51-25.08.2009","25.08.2009",2009,8,25,0.743807697,2
"HUN_022_MZB_LO_51","HUN_022_MZB_LO_51-24.08.2010","24.08.2010",2010,8,24,0.732949636,2
"HUN_022_MZB_LO_51","HUN_022_MZB_LO_51-07.09.2011","07.09.2011",2011,9,7,0.706639197,2
"HUN_022_MZB_LO_51","HUN_022_MZB_LO_51-19.09.2012","19.09.2012",2012,9,19,0.594814652,3
"HUN_022_MZB_LO_51","HUN_022_MZB_LO_51-18.09.2013","18.09.2013",2013,9,18,0.796861259,2
"HUN_022_MZB_LO_51","HUN_022_MZB_LO_51-03.09.2014","03.09.2014",2014,9,3,0.654711918,2
"HUN_022_MZB_LO_51","HUN_022_MZB_LO_51-24.09.2015","24.09.2015",2015,9,24,0.569819021,3
"HUN_022_MZB_LO_51","HUN_022_MZB_LO_51-23.08.2017","23.08.2017",2017,8,23,0.812893948,1
"HUN_022_MZB_LO_52","HUN_022_MZB_LO_52-03.08.2005","03.08.2005",2005,8,3,0.500011056,3
"HUN_022_MZB_LO_52","HUN_022_MZB_LO_52-25.10.2007","25.10.2007",2007,10,25,0.242125,4
"HUN_022_MZB_LO_52","HUN_022_MZB_LO_52-13.08.2008","13.08.2008",2008,8,13,0.310169705,4
"HUN_022_MZB_LO_52","HUN_022_MZB_LO_52-06.08.2009","06.08.2009",2009,8,6,0.701214809,2
"HUN_022_MZB_LO_52","HUN_022_MZB_LO_52-29.09.2010","29.09.2010",2010,9,29,0.5183887,3
"HUN_022_MZB_LO_52","HUN_022_MZB_LO_52-01.09.2011","01.09.2011",2011,9,1,0.55932197,3
"HUN_022_MZB_LO_52","HUN_022_MZB_LO_52-15.08.2012","15.08.2012",2012,8,15,0.630057817,2
"HUN_022_MZB_LO_52","HUN_022_MZB_LO_52-09.09.2013","09.09.2013",2013,9,9,0.454386854,3
"HUN_022_MZB_LO_52","HUN_022_MZB_LO_52-04.09.2014","04.09.2014",2014,9,4,0.18100703,5
"HUN_022_MZB_LO_52","HUN_022_MZB_LO_52-15.09.2015","15.09.2015",2015,9,15,0.515046694,3
"HUN_022_MZB_LO_52","HUN_022_MZB_LO_52-28.09.2016","28.09.2016",2016,9,28,0.454703531,3
"HUN_022_MZB_LO_52","HUN_022_MZB_LO_52-19.09.2017","19.09.2017",2017,9,19,0.364411478,4
"HUN_022_MZB_LO_55","HUN_022_MZB_LO_55-28.10.2005","28.10.2005",2005,10,28,0.421868942,3
"HUN_022_MZB_LO_55","HUN_022_MZB_LO_55-10.09.2008","10.09.2008",2008,9,10,0.549191034,3
"HUN_022_MZB_LO_55","HUN_022_MZB_LO_55-27.10.2009","27.10.2009",2009,10,27,0.509237707,3
"HUN_022_MZB_LO_55","HUN_022_MZB_LO_55-16.09.2010","16.09.2010",2010,9,16,0.607417117,2
"HUN_022_MZB_LO_55","HUN_022_MZB_LO_55-08.09.2011","08.09.2011",2011,9,8,0.695666655,2
"HUN_022_MZB_LO_55","HUN_022_MZB_LO_55-12.09.2012","12.09.2012",2012,9,12,0.396630216,4
"HUN_022_MZB_LO_55","HUN_022_MZB_LO_55-09.10.2013","09.10.2013",2013,10,9,0.522092146,3
"HUN_022_MZB_LO_55","HUN_022_MZB_LO_55-16.09.2016","16.09.2016",2016,9,16,0.671992425,2
"HUN_022_MZB_LO_55","HUN_022_MZB_LO_55-20.10.2017","20.10.2017",2017,10,20,0.507809034,3
"HUN_022_MZB_LO_56","HUN_022_MZB_LO_56-25.10.2005","25.10.2005",2005,10,25,0,5
"HUN_022_MZB_LO_56","HUN_022_MZB_LO_56-17.09.2006","17.09.2006",2006,9,17,0.840656944,1
"HUN_022_MZB_LO_56","HUN_022_MZB_LO_56-19.09.2008","19.09.2008",2008,9,19,0.395934269,4
"HUN_022_MZB_LO_56","HUN_022_MZB_LO_56-09.09.2009","09.09.2009",2009,9,9,0.834580419,1
"HUN_022_MZB_LO_56","HUN_022_MZB_LO_56-08.10.2010","08.10.2010",2010,10,8,0.642228391,2
"HUN_022_MZB_LO_56","HUN_022_MZB_LO_56-30.09.2011","30.09.2011",2011,9,30,0.839432278,1
"HUN_022_MZB_LO_56","HUN_022_MZB_LO_56-04.10.2012","04.10.2012",2012,10,4,0.881301389,1
"HUN_022_MZB_LO_56","HUN_022_MZB_LO_56-30.09.2013","30.09.2013",2013,9,30,0.370129618,4
"HUN_022_MZB_LO_56","HUN_022_MZB_LO_56-02.10.2014","02.10.2014",2014,10,2,0.485674189,3
"HUN_022_MZB_LO_56","HUN_022_MZB_LO_56-01.10.2015","01.10.2015",2015,10,1,0.531023333,3
"HUN_022_MZB_LO_56","HUN_022_MZB_LO_56-04.10.2016","04.10.2016",2016,10,4,0.282345996,4
"HUN_022_MZB_LO_56","HUN_022_MZB_LO_56-16.10.2017","16.10.2017",2017,10,16,0.534707984,3
"HUN_022_MZB_LO_57","HUN_022_MZB_LO_57-13.04.2005","13.04.2005",2005,4,13,0.268465973,4
"HUN_022_MZB_LO_57","HUN_022_MZB_LO_57-09.05.2006","09.05.2006",2006,5,9,0.062797595,5
"HUN_022_MZB_LO_57","HUN_022_MZB_LO_57-17.04.2007","17.04.2007",2007,4,17,0.09851184,5
"HUN_022_MZB_LO_57","HUN_022_MZB_LO_57-06.05.2009","06.05.2009",2009,5,6,0.011143665,5
"HUN_022_MZB_LO_57","HUN_022_MZB_LO_57-26.05.2011","26.05.2011",2011,5,26,0.282082217,4
"HUN_022_MZB_LO_57","HUN_022_MZB_LO_57-10.04.2012","10.04.2012",2012,4,10,0.038515087,5
"HUN_022_MZB_LO_57","HUN_022_MZB_LO_57-29.04.2014","29.04.2014",2014,4,29,0.456679085,3
"HUN_022_MZB_LO_57","HUN_022_MZB_LO_57-11.06.2015","11.06.2015",2015,6,11,0.359593853,4
"HUN_022_MZB_LO_58","HUN_022_MZB_LO_58-10.09.2007","10.09.2007",2007,9,10,0.316282855,4
"HUN_022_MZB_LO_58","HUN_022_MZB_LO_58-13.10.2008","13.10.2008",2008,10,13,0.341009348,4
"HUN_022_MZB_LO_58","HUN_022_MZB_LO_58-13.10.2009","13.10.2009",2009,10,13,0.484104338,3
"HUN_022_MZB_LO_58","HUN_022_MZB_LO_58-05.10.2010","05.10.2010",2010,10,5,0.616294964,2
"HUN_022_MZB_LO_58","HUN_022_MZB_LO_58-22.09.2011","22.09.2011",2011,9,22,0.510357443,3
"HUN_022_MZB_LO_58","HUN_022_MZB_LO_58-18.10.2012","18.10.2012",2012,10,18,0.730101839,2
"HUN_022_MZB_LO_58","HUN_022_MZB_LO_58-05.09.2013","05.09.2013",2013,9,5,0.709943389,2
"HUN_022_MZB_LO_58","HUN_022_MZB_LO_58-10.09.2014","10.09.2014",2014,9,10,0.369765426,4
"HUN_022_MZB_LO_58","HUN_022_MZB_LO_58-09.09.2015","09.09.2015",2015,9,9,0.396831151,4
"HUN_022_MZB_LO_58","HUN_022_MZB_LO_58-21.09.2016","21.09.2016",2016,9,21,0.552062886,3
"HUN_022_MZB_LO_58","HUN_022_MZB_LO_58-13.09.2017","13.09.2017",2017,9,13,0.683317056,2
"HUN_022_MZB_LO_59","HUN_022_MZB_LO_59-11.10.2005","11.10.2005",2005,10,11,0.347094322,4
"HUN_022_MZB_LO_59","HUN_022_MZB_LO_59-14.09.2006","14.09.2006",2006,9,14,0.267335768,4
"HUN_022_MZB_LO_59","HUN_022_MZB_LO_59-23.08.2007","23.08.2007",2007,8,23,0.218507227,4
"HUN_022_MZB_LO_59","HUN_022_MZB_LO_59-26.09.2008","26.09.2008",2008,9,26,0.391680418,4
"HUN_022_MZB_LO_59","HUN_022_MZB_LO_59-16.09.2009","16.09.2009",2009,9,16,0.385910268,4
"HUN_022_MZB_LO_59","HUN_022_MZB_LO_59-15.10.2010","15.10.2010",2010,10,15,0.037340891,5
"HUN_022_MZB_LO_59","HUN_022_MZB_LO_59-30.08.2011","30.08.2011",2011,8,30,0.123974735,5
"HUN_022_MZB_LO_59","HUN_022_MZB_LO_59-05.10.2012","05.10.2012",2012,10,5,0.379038095,4
"HUN_022_MZB_LO_59","HUN_022_MZB_LO_59-03.10.2013","03.10.2013",2013,10,3,0.461439256,3
"HUN_022_MZB_LO_59","HUN_022_MZB_LO_59-14.10.2014","14.10.2014",2014,10,14,0.451192238,3
"HUN_022_MZB_LO_59","HUN_022_MZB_LO_59-09.09.2015","09.09.2015",2015,9,9,0.276497518,4
"HUN_022_MZB_LO_59","HUN_022_MZB_LO_59-30.08.2016","30.08.2016",2016,8,30,0.283624492,4
"HUN_022_MZB_LO_59","HUN_022_MZB_LO_59-31.08.2017","31.08.2017",2017,8,31,0.223060331,4
"HUN_022_MZB_LO_6","HUN_022_MZB_LO_6-19.05.2005","19.05.2005",2005,5,19,0.82803121,1
"HUN_022_MZB_LO_6","HUN_022_MZB_LO_6-25.05.2006","25.05.2006",2006,5,25,0.894144356,1
"HUN_022_MZB_LO_6","HUN_022_MZB_LO_6-22.05.2007","22.05.2007",2007,5,22,0.748658346,2
"HUN_022_MZB_LO_6","HUN_022_MZB_LO_6-11.06.2008","11.06.2008",2008,6,11,0.85226118,1
"HUN_022_MZB_LO_6","HUN_022_MZB_LO_6-27.04.2009","27.04.2009",2009,4,27,0.729509074,2
"HUN_022_MZB_LO_6","HUN_022_MZB_LO_6-27.04.2010","27.04.2010",2010,4,27,0.796663638,2
"HUN_022_MZB_LO_6","HUN_022_MZB_LO_6-12.04.2011","12.04.2011",2011,4,12,0.635581961,2
"HUN_022_MZB_LO_6","HUN_022_MZB_LO_6-10.05.2012","10.05.2012",2012,5,10,0.864586952,1
"HUN_022_MZB_LO_6","HUN_022_MZB_LO_6-29.04.2013","29.04.2013",2013,4,29,0.724357333,2
"HUN_022_MZB_LO_6","HUN_022_MZB_LO_6-16.04.2014","16.04.2014",2014,4,16,0.78438011,2
"HUN_022_MZB_LO_6","HUN_022_MZB_LO_6-21.04.2015","21.04.2015",2015,4,21,0.515962367,3
"HUN_022_MZB_LO_6","HUN_022_MZB_LO_6-18.04.2016","18.04.2016",2016,4,18,0.701177971,2
"HUN_022_MZB_LO_6","HUN_022_MZB_LO_6-10.05.2017","10.05.2017",2017,5,10,0.909555952,1
"HUN_022_MZB_LO_61","HUN_022_MZB_LO_61-07.09.2005","07.09.2005",2005,9,7,0.76440817,2
"HUN_022_MZB_LO_61","HUN_022_MZB_LO_61-24.09.2007","24.09.2007",2007,9,24,0.836913961,1
"HUN_022_MZB_LO_61","HUN_022_MZB_LO_61-04.09.2008","04.09.2008",2008,9,4,0.799174733,2
"HUN_022_MZB_LO_61","HUN_022_MZB_LO_61-09.10.2009","09.10.2009",2009,10,9,0.77350595,2
"HUN_022_MZB_LO_61","HUN_022_MZB_LO_61-15.10.2010","15.10.2010",2010,10,15,0.650457996,2
"HUN_022_MZB_LO_61","HUN_022_MZB_LO_61-30.08.2011","30.08.2011",2011,8,30,0.813564159,1
"HUN_022_MZB_LO_61","HUN_022_MZB_LO_61-23.09.2013","23.09.2013",2013,9,23,0.910316059,1
"HUN_022_MZB_LO_61","HUN_022_MZB_LO_61-08.10.2014","08.10.2014",2014,10,8,0.836440543,1
"HUN_022_MZB_LO_61","HUN_022_MZB_LO_61-08.09.2015","08.09.2015",2015,9,8,0.783948762,2
"HUN_022_MZB_LO_61","HUN_022_MZB_LO_61-30.08.2016","30.08.2016",2016,8,30,0.674951708,2
"HUN_022_MZB_LO_62","HUN_022_MZB_LO_62-03.05.2005","03.05.2005",2005,5,3,0.746732336,2
"HUN_022_MZB_LO_62","HUN_022_MZB_LO_62-22.05.2006","22.05.2006",2006,5,22,0.684328395,2
"HUN_022_MZB_LO_62","HUN_022_MZB_LO_62-10.05.2007","10.05.2007",2007,5,10,0.669988697,2
"HUN_022_MZB_LO_62","HUN_022_MZB_LO_62-22.04.2008","22.04.2008",2008,4,22,0.722401822,2
"HUN_022_MZB_LO_62","HUN_022_MZB_LO_62-20.04.2009","20.04.2009",2009,4,20,0.757942187,2
"HUN_022_MZB_LO_62","HUN_022_MZB_LO_62-29.04.2010","29.04.2010",2010,4,29,0.756122996,2
"HUN_022_MZB_LO_62","HUN_022_MZB_LO_62-20.04.2011","20.04.2011",2011,4,20,0.649264392,2
"HUN_022_MZB_LO_62","HUN_022_MZB_LO_62-05.04.2012","05.04.2012",2012,4,5,0.638718978,2
"HUN_022_MZB_LO_62","HUN_022_MZB_LO_62-09.04.2014","09.04.2014",2014,4,9,0.782826377,2
"HUN_022_MZB_LO_62","HUN_022_MZB_LO_62-22.04.2015","22.04.2015",2015,4,22,0.662558248,2
"HUN_022_MZB_LO_62","HUN_022_MZB_LO_62-20.04.2016","20.04.2016",2016,4,20,0.622352068,2
"HUN_022_MZB_LO_62","HUN_022_MZB_LO_62-04.05.2017","04.05.2017",2017,5,4,0.626902252,2
"HUN_022_MZB_LO_65","HUN_022_MZB_LO_65-06.04.2005","06.04.2005",2005,4,6,0.515209333,3
"HUN_022_MZB_LO_65","HUN_022_MZB_LO_65-29.05.2006","29.05.2006",2006,5,29,0.589935586,3
"HUN_022_MZB_LO_65","HUN_022_MZB_LO_65-29.05.2008","29.05.2008",2008,5,29,0.54594741,3
"HUN_022_MZB_LO_65","HUN_022_MZB_LO_65-13.05.2009","13.05.2009",2009,5,13,0.567980184,3
"HUN_022_MZB_LO_65","HUN_022_MZB_LO_65-03.05.2011","03.05.2011",2011,5,3,0.575354874,3
"HUN_022_MZB_LO_65","HUN_022_MZB_LO_65-11.05.2012","11.05.2012",2012,5,11,0.618489298,2
"HUN_022_MZB_LO_65","HUN_022_MZB_LO_65-30.04.2013","30.04.2013",2013,4,30,0.663165266,2
"HUN_022_MZB_LO_65","HUN_022_MZB_LO_65-30.04.2015","30.04.2015",2015,4,30,0.500941924,3
"HUN_022_MZB_LO_65","HUN_022_MZB_LO_65-11.04.2016","11.04.2016",2016,4,11,0.505202305,3
"HUN_022_MZB_LO_65","HUN_022_MZB_LO_65-19.05.2017","19.05.2017",2017,5,19,0.506353066,3
"HUN_022_MZB_LO_66","HUN_022_MZB_LO_66-08.09.2008","08.09.2008",2008,9,8,0.653032003,2
"HUN_022_MZB_LO_66","HUN_022_MZB_LO_66-12.08.2009","12.08.2009",2009,8,12,0.492397817,3
"HUN_022_MZB_LO_66","HUN_022_MZB_LO_66-30.08.2010","30.08.2010",2010,8,30,0.444380915,3
"HUN_022_MZB_LO_66","HUN_022_MZB_LO_66-21.09.2011","21.09.2011",2011,9,21,0.624609622,2
"HUN_022_MZB_LO_66","HUN_022_MZB_LO_66-06.08.2012","06.08.2012",2012,8,6,0.489464788,3
"HUN_022_MZB_LO_66","HUN_022_MZB_LO_66-10.09.2013","10.09.2013",2013,9,10,0.477482323,3
"HUN_022_MZB_LO_66","HUN_022_MZB_LO_66-06.08.2014","06.08.2014",2014,8,6,0.614836414,2
"HUN_022_MZB_LO_66","HUN_022_MZB_LO_66-05.09.2016","05.09.2016",2016,9,5,0.642314991,2
"HUN_022_MZB_LO_66","HUN_022_MZB_LO_66-02.08.2017","02.08.2017",2017,8,2,0.625882759,2
"HUN_022_MZB_LO_67","HUN_022_MZB_LO_67-11.03.2007","11.03.2007",2007,3,11,0.322397255,4
"HUN_022_MZB_LO_67","HUN_022_MZB_LO_67-15.04.2009","15.04.2009",2009,4,15,0.38551798,4
"HUN_022_MZB_LO_67","HUN_022_MZB_LO_67-09.04.2010","09.04.2010",2010,4,9,0.336239474,4
"HUN_022_MZB_LO_67","HUN_022_MZB_LO_67-11.04.2011","11.04.2011",2011,4,11,0.358442376,4
"HUN_022_MZB_LO_67","HUN_022_MZB_LO_67-23.04.2012","23.04.2012",2012,4,23,0.407834862,3
"HUN_022_MZB_LO_67","HUN_022_MZB_LO_67-03.05.2013","03.05.2013",2013,5,3,0.403735579,3
"HUN_022_MZB_LO_67","HUN_022_MZB_LO_67-05.05.2014","05.05.2014",2014,5,5,0.477340257,3
"HUN_022_MZB_LO_67","HUN_022_MZB_LO_67-20.04.2015","20.04.2015",2015,4,20,0.173062913,5
"HUN_022_MZB_LO_67","HUN_022_MZB_LO_67-05.04.2016","05.04.2016",2016,4,5,0.388009524,4
"HUN_022_MZB_LO_67","HUN_022_MZB_LO_67-11.04.2017","11.04.2017",2017,4,11,0.025856221,5
"HUN_022_MZB_LO_68","HUN_022_MZB_LO_68-29.03.2007","29.03.2007",2007,3,29,0.476988333,3
"HUN_022_MZB_LO_68","HUN_022_MZB_LO_68-20.04.2009","20.04.2009",2009,4,20,0.227239733,4
"HUN_022_MZB_LO_68","HUN_022_MZB_LO_68-07.04.2010","07.04.2010",2010,4,7,0.407644721,3
"HUN_022_MZB_LO_68","HUN_022_MZB_LO_68-23.05.2011","23.05.2011",2011,5,23,0.590239035,3
"HUN_022_MZB_LO_68","HUN_022_MZB_LO_68-23.04.2012","23.04.2012",2012,4,23,0.445784409,3
"HUN_022_MZB_LO_68","HUN_022_MZB_LO_68-15.04.2013","15.04.2013",2013,4,15,0.418139343,3
"HUN_022_MZB_LO_68","HUN_022_MZB_LO_68-28.04.2014","28.04.2014",2014,4,28,0.750183123,2
"HUN_022_MZB_LO_68","HUN_022_MZB_LO_68-13.04.2015","13.04.2015",2015,4,13,0.54050556,3
"HUN_022_MZB_LO_68","HUN_022_MZB_LO_68-19.04.2016","19.04.2016",2016,4,19,0.493694317,3
"HUN_022_MZB_LO_68","HUN_022_MZB_LO_68-25.04.2017","25.04.2017",2017,4,25,0.458655357,3
"HUN_022_MZB_LO_69","HUN_022_MZB_LO_69-02.10.2006","02.10.2006",2006,10,2,0.337718311,4
"HUN_022_MZB_LO_69","HUN_022_MZB_LO_69-15.10.2007","15.10.2007",2007,10,15,0.415007316,3
"HUN_022_MZB_LO_69","HUN_022_MZB_LO_69-06.10.2008","06.10.2008",2008,10,6,0.680515121,2
"HUN_022_MZB_LO_69","HUN_022_MZB_LO_69-09.09.2009","09.09.2009",2009,9,9,0.607870742,2
"HUN_022_MZB_LO_69","HUN_022_MZB_LO_69-06.09.2010","06.09.2010",2010,9,6,0.728385929,2
"HUN_022_MZB_LO_69","HUN_022_MZB_LO_69-06.09.2011","06.09.2011",2011,9,6,0.742026297,2
"HUN_022_MZB_LO_69","HUN_022_MZB_LO_69-19.09.2012","19.09.2012",2012,9,19,0.810063501,1
"HUN_022_MZB_LO_69","HUN_022_MZB_LO_69-18.09.2013","18.09.2013",2013,9,18,0.436015,3
"HUN_022_MZB_LO_69","HUN_022_MZB_LO_69-03.09.2014","03.09.2014",2014,9,3,0.589162948,3
"HUN_022_MZB_LO_69","HUN_022_MZB_LO_69-02.09.2015","02.09.2015",2015,9,2,0.546620755,3
"HUN_022_MZB_LO_69","HUN_022_MZB_LO_69-07.09.2016","07.09.2016",2016,9,7,0.699609756,2
"HUN_022_MZB_LO_69","HUN_022_MZB_LO_69-06.09.2017","06.09.2017",2017,9,6,0.546121698,3
"HUN_022_MZB_LO_7","HUN_022_MZB_LO_7-20.04.2005","20.04.2005",2005,4,20,0.41201986,3
"HUN_022_MZB_LO_7","HUN_022_MZB_LO_7-22.05.2006","22.05.2006",2006,5,22,0.403628739,3
"HUN_022_MZB_LO_7","HUN_022_MZB_LO_7-26.06.2007","26.06.2007",2007,6,26,0.434608247,3
"HUN_022_MZB_LO_7","HUN_022_MZB_LO_7-01.04.2008","01.04.2008",2008,4,1,0.409119104,3
"HUN_022_MZB_LO_7","HUN_022_MZB_LO_7-07.04.2009","07.04.2009",2009,4,7,0.193900047,5
"HUN_022_MZB_LO_7","HUN_022_MZB_LO_7-11.05.2010","11.05.2010",2010,5,11,0.25126845,4
"HUN_022_MZB_LO_7","HUN_022_MZB_LO_7-11.05.2011","11.05.2011",2011,5,11,0.421246169,3
"HUN_022_MZB_LO_7","HUN_022_MZB_LO_7-24.04.2012","24.04.2012",2012,4,24,0.337680411,4
"HUN_022_MZB_LO_7","HUN_022_MZB_LO_7-23.04.2013","23.04.2013",2013,4,23,0.697102879,2
"HUN_022_MZB_LO_7","HUN_022_MZB_LO_7-05.05.2014","05.05.2014",2014,5,5,0.57206747,3
"HUN_022_MZB_LO_7","HUN_022_MZB_LO_7-24.04.2015","24.04.2015",2015,4,24,0.519745445,3
"HUN_022_MZB_LO_7","HUN_022_MZB_LO_7-12.04.2016","12.04.2016",2016,4,12,0.751256151,2
"HUN_022_MZB_LO_7","HUN_022_MZB_LO_7-18.04.2017","18.04.2017",2017,4,18,0.636214178,2
"HUN_022_MZB_LO_70","HUN_022_MZB_LO_70-09.10.2007","09.10.2007",2007,10,9,0.373789321,4
"HUN_022_MZB_LO_70","HUN_022_MZB_LO_70-29.10.2008","29.10.2008",2008,10,29,0.548906387,3
"HUN_022_MZB_LO_70","HUN_022_MZB_LO_70-13.09.2010","13.09.2010",2010,9,13,0.529104286,3
"HUN_022_MZB_LO_70","HUN_022_MZB_LO_70-12.09.2011","12.09.2011",2011,9,12,0.537587121,3
"HUN_022_MZB_LO_70","HUN_022_MZB_LO_70-15.10.2012","15.10.2012",2012,10,15,0.571110772,3
"HUN_022_MZB_LO_70","HUN_022_MZB_LO_70-24.10.2013","24.10.2013",2013,10,24,0.289487944,4
"HUN_022_MZB_LO_70","HUN_022_MZB_LO_70-01.09.2014","01.09.2014",2014,9,1,0.371641341,4
"HUN_022_MZB_LO_70","HUN_022_MZB_LO_70-21.09.2015","21.09.2015",2015,9,21,0.439077155,3
"HUN_022_MZB_LO_70","HUN_022_MZB_LO_70-30.08.2016","30.08.2016",2016,8,30,0.5449125,3
"HUN_022_MZB_LO_70","HUN_022_MZB_LO_70-12.09.2017","12.09.2017",2017,9,12,0.405271429,3
"HUN_022_MZB_LO_71","HUN_022_MZB_LO_71-11.08.2005","11.08.2005",2005,8,11,0.737066812,2
"HUN_022_MZB_LO_71","HUN_022_MZB_LO_71-18.10.2007","18.10.2007",2007,10,18,0.567761601,3
"HUN_022_MZB_LO_71","HUN_022_MZB_LO_71-29.10.2008","29.10.2008",2008,10,29,0.633443613,2
"HUN_022_MZB_LO_71","HUN_022_MZB_LO_71-24.09.2009","24.09.2009",2009,9,24,0.701842874,2
"HUN_022_MZB_LO_71","HUN_022_MZB_LO_71-06.09.2010","06.09.2010",2010,9,6,0.578615899,3
"HUN_022_MZB_LO_71","HUN_022_MZB_LO_71-25.08.2011","25.08.2011",2011,8,25,0.784177699,2
"HUN_022_MZB_LO_71","HUN_022_MZB_LO_71-06.09.2012","06.09.2012",2012,9,6,0.726684913,2
"HUN_022_MZB_LO_71","HUN_022_MZB_LO_71-02.09.2014","02.09.2014",2014,9,2,0.609377266,2
"HUN_022_MZB_LO_71","HUN_022_MZB_LO_71-18.09.2015","18.09.2015",2015,9,18,0.382192349,4
"HUN_022_MZB_LO_71","HUN_022_MZB_LO_71-08.09.2016","08.09.2016",2016,9,8,0.676864129,2
"HUN_022_MZB_LO_71","HUN_022_MZB_LO_71-02.10.2017","02.10.2017",2017,10,2,0.306745492,4
"HUN_022_MZB_LO_72","HUN_022_MZB_LO_72-07.06.2007","07.06.2007",2007,6,7,0.193867588,5
"HUN_022_MZB_LO_72","HUN_022_MZB_LO_72-19.05.2009","19.05.2009",2009,5,19,0.446178927,3
"HUN_022_MZB_LO_72","HUN_022_MZB_LO_72-26.05.2010","26.05.2010",2010,5,26,0.495138122,3
"HUN_022_MZB_LO_72","HUN_022_MZB_LO_72-02.05.2011","02.05.2011",2011,5,2,0.500113288,3
"HUN_022_MZB_LO_72","HUN_022_MZB_LO_72-07.05.2012","07.05.2012",2012,5,7,0.572059727,3
"HUN_022_MZB_LO_72","HUN_022_MZB_LO_72-06.05.2013","06.05.2013",2013,5,6,0.43810673,3
"HUN_022_MZB_LO_72","HUN_022_MZB_LO_72-22.05.2014","22.05.2014",2014,5,22,0.544223537,3
"HUN_022_MZB_LO_72","HUN_022_MZB_LO_72-30.04.2015","30.04.2015",2015,4,30,0.487757001,3
"HUN_022_MZB_LO_72","HUN_022_MZB_LO_72-25.04.2016","25.04.2016",2016,4,25,0.443394517,3
"HUN_022_MZB_LO_72","HUN_022_MZB_LO_72-11.05.2017","11.05.2017",2017,5,11,0.509934006,3
"HUN_022_MZB_LO_73","HUN_022_MZB_LO_73-29.04.2005","29.04.2005",2005,4,29,0.062390789,5
"HUN_022_MZB_LO_73","HUN_022_MZB_LO_73-15.05.2006","15.05.2006",2006,5,15,0.4241044,3
"HUN_022_MZB_LO_73","HUN_022_MZB_LO_73-12.05.2009","12.05.2009",2009,5,12,0.531356442,3
"HUN_022_MZB_LO_73","HUN_022_MZB_LO_73-29.04.2010","29.04.2010",2010,4,29,0.515099719,3
"HUN_022_MZB_LO_73","HUN_022_MZB_LO_73-27.04.2011","27.04.2011",2011,4,27,0.235029998,4
"HUN_022_MZB_LO_73","HUN_022_MZB_LO_73-16.05.2013","16.05.2013",2013,5,16,0.456333333,3
"HUN_022_MZB_LO_73","HUN_022_MZB_LO_73-09.05.2014","09.05.2014",2014,5,9,0.682216781,2
"HUN_022_MZB_LO_73","HUN_022_MZB_LO_73-14.05.2015","14.05.2015",2015,5,14,0.479394118,3
"HUN_022_MZB_LO_74","HUN_022_MZB_LO_74-19.09.2006","19.09.2006",2006,9,19,0.656677756,2
"HUN_022_MZB_LO_74","HUN_022_MZB_LO_74-13.10.2008","13.10.2008",2008,10,13,0.408248583,3
"HUN_022_MZB_LO_74","HUN_022_MZB_LO_74-13.10.2009","13.10.2009",2009,10,13,0.476860122,3
"HUN_022_MZB_LO_74","HUN_022_MZB_LO_74-05.10.2010","05.10.2010",2010,10,5,0.298249176,4
"HUN_022_MZB_LO_74","HUN_022_MZB_LO_74-22.09.2011","22.09.2011",2011,9,22,0.302072174,4
"HUN_022_MZB_LO_74","HUN_022_MZB_LO_74-05.09.2013","05.09.2013",2013,9,5,0.560323889,3
"HUN_022_MZB_LO_74","HUN_022_MZB_LO_74-10.09.2014","10.09.2014",2014,9,10,0.370409375,4
"HUN_022_MZB_LO_74","HUN_022_MZB_LO_74-15.09.2015","15.09.2015",2015,9,15,0.401535547,3
"HUN_022_MZB_LO_74","HUN_022_MZB_LO_74-21.09.2016","21.09.2016",2016,9,21,0.271532759,4
"HUN_022_MZB_LO_74","HUN_022_MZB_LO_74-24.08.2017","24.08.2017",2017,8,24,0.457184613,3
"HUN_022_MZB_LO_75","HUN_022_MZB_LO_75-16.04.2008","16.04.2008",2008,4,16,0.115829022,5
"HUN_022_MZB_LO_75","HUN_022_MZB_LO_75-15.04.2009","15.04.2009",2009,4,15,0,5
"HUN_022_MZB_LO_75","HUN_022_MZB_LO_75-07.04.2010","07.04.2010",2010,4,7,0.00210084,5
"HUN_022_MZB_LO_75","HUN_022_MZB_LO_75-11.04.2011","11.04.2011",2011,4,11,0.011363636,5
"HUN_022_MZB_LO_75","HUN_022_MZB_LO_75-09.05.2012","09.05.2012",2012,5,9,0.041017518,5
"HUN_022_MZB_LO_75","HUN_022_MZB_LO_75-14.04.2014","14.04.2014",2014,4,14,0.301629473,4
"HUN_022_MZB_LO_75","HUN_022_MZB_LO_75-27.04.2015","27.04.2015",2015,4,27,0.05001066,5
"HUN_022_MZB_LO_75","HUN_022_MZB_LO_75-31.05.2016","31.05.2016",2016,5,31,0.471365126,3
"HUN_022_MZB_LO_75","HUN_022_MZB_LO_75-25.04.2017","25.04.2017",2017,4,25,0.163337884,5
"HUN_022_MZB_LO_76","HUN_022_MZB_LO_76-11.04.2005","11.04.2005",2005,4,11,0.3476,4
"HUN_022_MZB_LO_76","HUN_022_MZB_LO_76-16.05.2006","16.05.2006",2006,5,16,0.30250886,4
"HUN_022_MZB_LO_76","HUN_022_MZB_LO_76-17.04.2007","17.04.2007",2007,4,17,0.365110376,4
"HUN_022_MZB_LO_76","HUN_022_MZB_LO_76-12.05.2009","12.05.2009",2009,5,12,0.394563043,4
"HUN_022_MZB_LO_76","HUN_022_MZB_LO_76-29.04.2010","29.04.2010",2010,4,29,0.45632649,3
"HUN_022_MZB_LO_76","HUN_022_MZB_LO_76-27.04.2011","27.04.2011",2011,4,27,0.356173009,4
"HUN_022_MZB_LO_76","HUN_022_MZB_LO_76-17.05.2012","17.05.2012",2012,5,17,0.475466667,3
"HUN_022_MZB_LO_76","HUN_022_MZB_LO_76-30.05.2013","30.05.2013",2013,5,30,0.609475926,2
"HUN_022_MZB_LO_76","HUN_022_MZB_LO_76-10.05.2014","10.05.2014",2014,5,10,0.60156948,2
"HUN_022_MZB_LO_76","HUN_022_MZB_LO_76-14.05.2015","14.05.2015",2015,5,14,0.600517951,2
"HUN_022_MZB_LO_77","HUN_022_MZB_LO_77-01.06.2005","01.06.2005",2005,6,1,0.085289144,5
"HUN_022_MZB_LO_77","HUN_022_MZB_LO_77-02.04.2007","02.04.2007",2007,4,2,0.446245991,3
"HUN_022_MZB_LO_77","HUN_022_MZB_LO_77-21.05.2008","21.05.2008",2008,5,21,0.539545541,3
"HUN_022_MZB_LO_77","HUN_022_MZB_LO_77-04.05.2009","04.05.2009",2009,5,4,0.816639463,1
"HUN_022_MZB_LO_77","HUN_022_MZB_LO_77-12.04.2010","12.04.2010",2010,4,12,0.749645028,2
"HUN_022_MZB_LO_77","HUN_022_MZB_LO_77-02.05.2011","02.05.2011",2011,5,2,0.72827089,2
"HUN_022_MZB_LO_77","HUN_022_MZB_LO_77-18.04.2012","18.04.2012",2012,4,18,0.680882897,2
"HUN_022_MZB_LO_77","HUN_022_MZB_LO_77-15.05.2013","15.05.2013",2013,5,15,0.644517567,2
"HUN_022_MZB_LO_77","HUN_022_MZB_LO_77-07.05.2014","07.05.2014",2014,5,7,0.602640502,2
"HUN_022_MZB_LO_77","HUN_022_MZB_LO_77-06.05.2015","06.05.2015",2015,5,6,0.627447076,2
"HUN_022_MZB_LO_77","HUN_022_MZB_LO_77-05.04.2016","05.04.2016",2016,4,5,0.656247594,2
"HUN_022_MZB_LO_77","HUN_022_MZB_LO_77-04.04.2017","04.04.2017",2017,4,4,0.638235574,2
"HUN_022_MZB_LO_78","HUN_022_MZB_LO_78-09.09.2008","09.09.2008",2008,9,9,0.306072704,4
"HUN_022_MZB_LO_78","HUN_022_MZB_LO_78-11.09.2009","11.09.2009",2009,9,11,0.269934274,4
"HUN_022_MZB_LO_78","HUN_022_MZB_LO_78-07.10.2011","07.10.2011",2011,10,7,0.357377423,4
"HUN_022_MZB_LO_78","HUN_022_MZB_LO_78-13.09.2013","13.09.2013",2013,9,13,0.350784821,4
"HUN_022_MZB_LO_78","HUN_022_MZB_LO_78-22.10.2014","22.10.2014",2014,10,22,0.406971776,3
"HUN_022_MZB_LO_78","HUN_022_MZB_LO_78-21.10.2016","21.10.2016",2016,10,21,0.351829931,4
"HUN_022_MZB_LO_78","HUN_022_MZB_LO_78-26.10.2017","26.10.2017",2017,10,26,0.384921248,4
"HUN_022_MZB_LO_80","HUN_022_MZB_LO_80-09.10.2006","09.10.2006",2006,10,9,0.35260948,4
"HUN_022_MZB_LO_80","HUN_022_MZB_LO_80-17.09.2007","17.09.2007",2007,9,17,0.424839678,3
"HUN_022_MZB_LO_80","HUN_022_MZB_LO_80-24.09.2008","24.09.2008",2008,9,24,0.522392735,3
"HUN_022_MZB_LO_80","HUN_022_MZB_LO_80-19.10.2009","19.10.2009",2009,10,19,0.483018654,3
"HUN_022_MZB_LO_80","HUN_022_MZB_LO_80-11.08.2010","11.08.2010",2010,8,11,0.5224,3
"HUN_022_MZB_LO_80","HUN_022_MZB_LO_80-12.09.2011","12.09.2011",2011,9,12,0.4416347,3
"HUN_022_MZB_LO_80","HUN_022_MZB_LO_80-05.09.2013","05.09.2013",2013,9,5,0.58649386,3
"HUN_022_MZB_LO_80","HUN_022_MZB_LO_80-01.09.2014","01.09.2014",2014,9,1,0.51233273,3
"HUN_022_MZB_LO_80","HUN_022_MZB_LO_80-03.09.2015","03.09.2015",2015,9,3,0.566682637,3
"HUN_022_MZB_LO_80","HUN_022_MZB_LO_80-05.09.2016","05.09.2016",2016,9,5,0.492079878,3
"HUN_022_MZB_LO_80","HUN_022_MZB_LO_80-10.08.2017","10.08.2017",2017,8,10,0.362702556,4
"HUN_022_MZB_LO_80","HUN_022_MZB_LO_80-08.08.2018","08.08.2018",2018,8,8,0.463903074,3
"HUN_022_MZB_LO_80","HUN_022_MZB_LO_80-29.08.2019","29.08.2019",2019,8,29,0.435329327,3
"HUN_022_MZB_LO_81","HUN_022_MZB_LO_81-17.08.2006","17.08.2006",2006,8,17,0.504670757,3
"HUN_022_MZB_LO_81","HUN_022_MZB_LO_81-12.09.2007","12.09.2007",2007,9,12,0.293571875,4
"HUN_022_MZB_LO_81","HUN_022_MZB_LO_81-03.09.2008","03.09.2008",2008,9,3,0.266858043,4
"HUN_022_MZB_LO_81","HUN_022_MZB_LO_81-08.10.2009","08.10.2009",2009,10,8,0.300718913,4
"HUN_022_MZB_LO_81","HUN_022_MZB_LO_81-14.10.2010","14.10.2010",2010,10,14,0.702971476,2
"HUN_022_MZB_LO_81","HUN_022_MZB_LO_81-08.09.2011","08.09.2011",2011,9,8,0.58566108,3
"HUN_022_MZB_LO_81","HUN_022_MZB_LO_81-11.09.2013","11.09.2013",2013,9,11,0.477106646,3
"HUN_022_MZB_LO_81","HUN_022_MZB_LO_81-02.09.2014","02.09.2014",2014,9,2,0.749476532,2
"HUN_022_MZB_LO_81","HUN_022_MZB_LO_81-31.08.2015","31.08.2015",2015,8,31,0.550183858,3
"HUN_022_MZB_LO_81","HUN_022_MZB_LO_81-07.09.2016","07.09.2016",2016,9,7,0.595168777,3
"HUN_022_MZB_LO_81","HUN_022_MZB_LO_81-08.08.2017","08.08.2017",2017,8,8,0.856364289,1
"HUN_022_MZB_LO_81","HUN_022_MZB_LO_81-21.08.2018","21.08.2018",2018,8,21,0.479877273,3
"HUN_022_MZB_LO_82","HUN_022_MZB_LO_82-22.08.2005","22.08.2005",2005,8,22,0.579411017,3
"HUN_022_MZB_LO_82","HUN_022_MZB_LO_82-11.10.2006","11.10.2006",2006,10,11,0.718356747,2
"HUN_022_MZB_LO_82","HUN_022_MZB_LO_82-26.09.2007","26.09.2007",2007,9,26,0.412913698,3
"HUN_022_MZB_LO_82","HUN_022_MZB_LO_82-04.09.2008","04.09.2008",2008,9,4,0.471969856,3
"HUN_022_MZB_LO_82","HUN_022_MZB_LO_82-08.10.2009","08.10.2009",2009,10,8,0.651822175,2
"HUN_022_MZB_LO_82","HUN_022_MZB_LO_82-18.10.2010","18.10.2010",2010,10,18,0.584681577,3
"HUN_022_MZB_LO_82","HUN_022_MZB_LO_82-14.09.2011","14.09.2011",2011,9,14,0.854217526,1
"HUN_022_MZB_LO_82","HUN_022_MZB_LO_82-02.09.2014","02.09.2014",2014,9,2,0.631277179,2
"HUN_022_MZB_LO_82","HUN_022_MZB_LO_82-31.08.2015","31.08.2015",2015,8,31,0.788458009,2
"HUN_022_MZB_LO_82","HUN_022_MZB_LO_82-07.09.2016","07.09.2016",2016,9,7,0.450389245,3
"HUN_022_MZB_LO_82","HUN_022_MZB_LO_82-08.08.2017","08.08.2017",2017,8,8,0.866569595,1
"HUN_022_MZB_LO_82","HUN_022_MZB_LO_82-21.08.2018","21.08.2018",2018,8,21,0.816920392,1
"HUN_022_MZB_LO_82","HUN_022_MZB_LO_82-19.09.2019","19.09.2019",2019,9,19,0.816142024,1
"HUN_022_MZB_LO_83","HUN_022_MZB_LO_83-26.05.2008","26.05.2008",2008,5,26,0.236032809,4
"HUN_022_MZB_LO_83","HUN_022_MZB_LO_83-05.05.2009","05.05.2009",2009,5,5,0.35122703,4
"HUN_022_MZB_LO_83","HUN_022_MZB_LO_83-31.05.2011","31.05.2011",2011,5,31,0.131405044,5
"HUN_022_MZB_LO_83","HUN_022_MZB_LO_83-23.04.2012","23.04.2012",2012,4,23,0.286382751,4
"HUN_022_MZB_LO_83","HUN_022_MZB_LO_83-14.05.2013","14.05.2013",2013,5,14,0.116232203,5
"HUN_022_MZB_LO_83","HUN_022_MZB_LO_83-28.04.2014","28.04.2014",2014,4,28,0.344330491,4
"HUN_022_MZB_LO_83","HUN_022_MZB_LO_83-29.06.2015","29.06.2015",2015,6,29,0.247575472,4
"HUN_022_MZB_LO_83","HUN_022_MZB_LO_83-18.04.2016","18.04.2016",2016,4,18,0.266926012,4
"HUN_022_MZB_LO_83","HUN_022_MZB_LO_83-16.05.2017","16.05.2017",2017,5,16,0.572857737,3
"HUN_022_MZB_LO_83","HUN_022_MZB_LO_83-26.04.2018","26.04.2018",2018,4,26,0.416235766,3
"HUN_022_MZB_LO_83","HUN_022_MZB_LO_83-06.06.2019","06.06.2019",2019,6,6,0.153063372,5
"HUN_022_MZB_LO_84","HUN_022_MZB_LO_84-13.07.2006","13.07.2006",2006,7,13,0.553349263,3
"HUN_022_MZB_LO_84","HUN_022_MZB_LO_84-07.07.2010","07.07.2010",2010,7,7,0.5,3
"HUN_022_MZB_LO_84","HUN_022_MZB_LO_84-30.07.2012","30.07.2012",2012,7,30,0.611905947,2
"HUN_022_MZB_LO_84","HUN_022_MZB_LO_84-05.08.2013","05.08.2013",2013,8,5,0.476689717,3
"HUN_022_MZB_LO_84","HUN_022_MZB_LO_84-28.08.2014","28.08.2014",2014,8,28,0.564823225,3
"HUN_022_MZB_LO_84","HUN_022_MZB_LO_84-27.07.2016","27.07.2016",2016,7,27,0.581345834,3
"HUN_022_MZB_LO_84","HUN_022_MZB_LO_84-11.08.2017","11.08.2017",2017,8,11,0.687962352,2
"HUN_022_MZB_LO_84","HUN_022_MZB_LO_84-02.07.2018","02.07.2018",2018,7,2,0.632636756,2
"HUN_022_MZB_LO_85","HUN_022_MZB_LO_85-24.09.2007","24.09.2007",2007,9,24,0.411964242,3
"HUN_022_MZB_LO_85","HUN_022_MZB_LO_85-03.09.2008","03.09.2008",2008,9,3,0.824107407,1
"HUN_022_MZB_LO_85","HUN_022_MZB_LO_85-25.08.2010","25.08.2010",2010,8,25,0.404891385,3
"HUN_022_MZB_LO_85","HUN_022_MZB_LO_85-13.09.2011","13.09.2011",2011,9,13,0.483945006,3
"HUN_022_MZB_LO_85","HUN_022_MZB_LO_85-05.08.2013","05.08.2013",2013,8,5,0.655784994,2
"HUN_022_MZB_LO_85","HUN_022_MZB_LO_85-09.09.2014","09.09.2014",2014,9,9,0.725074075,2
"HUN_022_MZB_LO_85","HUN_022_MZB_LO_85-27.08.2015","27.08.2015",2015,8,27,0.791112686,2
"HUN_022_MZB_LO_85","HUN_022_MZB_LO_85-31.08.2016","31.08.2016",2016,8,31,0.639953539,2
"HUN_022_MZB_LO_85","HUN_022_MZB_LO_85-09.08.2017","09.08.2017",2017,8,9,0.781927619,2
"HUN_022_MZB_LO_85","HUN_022_MZB_LO_85-21.08.2018","21.08.2018",2018,8,21,0.892281106,1
"HUN_022_MZB_LO_85","HUN_022_MZB_LO_85-16.09.2019","16.09.2019",2019,9,16,0.744679037,2
"HUN_022_MZB_LO_86","HUN_022_MZB_LO_86-17.08.2007","17.08.2007",2007,8,17,0.252540419,4
"HUN_022_MZB_LO_86","HUN_022_MZB_LO_86-21.08.2008","21.08.2008",2008,8,21,0.405167614,3
"HUN_022_MZB_LO_86","HUN_022_MZB_LO_86-12.08.2009","12.08.2009",2009,8,12,0.383773807,4
"HUN_022_MZB_LO_86","HUN_022_MZB_LO_86-24.08.2011","24.08.2011",2011,8,24,0.310388622,4
"HUN_022_MZB_LO_86","HUN_022_MZB_LO_86-10.09.2015","10.09.2015",2015,9,10,0.412074167,3
"HUN_022_MZB_LO_86","HUN_022_MZB_LO_86-08.08.2016","08.08.2016",2016,8,8,0.628843018,2
"HUN_022_MZB_LO_86","HUN_022_MZB_LO_86-13.09.2017","13.09.2017",2017,9,13,0.355891902,4
"HUN_022_MZB_LO_86","HUN_022_MZB_LO_86-23.08.2018","23.08.2018",2018,8,23,0.538245292,3
"HUN_022_MZB_LO_86","HUN_022_MZB_LO_86-27.08.2019","27.08.2019",2019,8,27,0.548712488,3
"HUN_022_MZB_LO_87","HUN_022_MZB_LO_87-22.05.2008","22.05.2008",2008,5,22,0.427267202,3
"HUN_022_MZB_LO_87","HUN_022_MZB_LO_87-27.04.2009","27.04.2009",2009,4,27,0.491206522,3
"HUN_022_MZB_LO_87","HUN_022_MZB_LO_87-20.04.2010","20.04.2010",2010,4,20,0.426656792,3
"HUN_022_MZB_LO_87","HUN_022_MZB_LO_87-31.05.2011","31.05.2011",2011,5,31,0.385409109,4
"HUN_022_MZB_LO_87","HUN_022_MZB_LO_87-23.04.2012","23.04.2012",2012,4,23,0.548410405,3
"HUN_022_MZB_LO_87","HUN_022_MZB_LO_87-14.05.2013","14.05.2013",2013,5,14,0.156556367,5
"HUN_022_MZB_LO_87","HUN_022_MZB_LO_87-30.04.2014","30.04.2014",2014,4,30,0.441756388,3
"HUN_022_MZB_LO_87","HUN_022_MZB_LO_87-29.06.2015","29.06.2015",2015,6,29,0.381303609,4
"HUN_022_MZB_LO_87","HUN_022_MZB_LO_87-18.04.2016","18.04.2016",2016,4,18,0.469883663,3
"HUN_022_MZB_LO_87","HUN_022_MZB_LO_87-16.05.2017","16.05.2017",2017,5,16,0.366427344,4
"HUN_022_MZB_LO_87","HUN_022_MZB_LO_87-26.04.2018","26.04.2018",2018,4,26,0.311231783,4
"HUN_022_MZB_LO_87","HUN_022_MZB_LO_87-29.05.2019","29.05.2019",2019,5,29,0.262798995,4
"HUN_022_MZB_LO_88","HUN_022_MZB_LO_88-22.08.2005","22.08.2005",2005,8,22,0.155544474,5
"HUN_022_MZB_LO_88","HUN_022_MZB_LO_88-22.08.2006","22.08.2006",2006,8,22,0.52707045,3
"HUN_022_MZB_LO_88","HUN_022_MZB_LO_88-17.09.2007","17.09.2007",2007,9,17,0.227603435,4
"HUN_022_MZB_LO_88","HUN_022_MZB_LO_88-22.09.2008","22.09.2008",2008,9,22,0.708071193,2
"HUN_022_MZB_LO_88","HUN_022_MZB_LO_88-19.10.2009","19.10.2009",2009,10,19,0.38302311,4
"HUN_022_MZB_LO_88","HUN_022_MZB_LO_88-11.08.2010","11.08.2010",2010,8,11,0.214621504,4
"HUN_022_MZB_LO_88","HUN_022_MZB_LO_88-12.09.2011","12.09.2011",2011,9,12,0.671268685,2
"HUN_022_MZB_LO_88","HUN_022_MZB_LO_88-05.09.2013","05.09.2013",2013,9,5,0.34968816,4
"HUN_022_MZB_LO_88","HUN_022_MZB_LO_88-26.08.2014","26.08.2014",2014,8,26,0.45490973,3
"HUN_022_MZB_LO_88","HUN_022_MZB_LO_88-03.09.2015","03.09.2015",2015,9,3,0.219679434,4
"HUN_022_MZB_LO_88","HUN_022_MZB_LO_88-05.09.2016","05.09.2016",2016,9,5,0.805780702,1
"HUN_022_MZB_LO_88","HUN_022_MZB_LO_88-10.08.2017","10.08.2017",2017,8,10,0.800516273,1
"HUN_022_MZB_LO_88","HUN_022_MZB_LO_88-08.08.2018","08.08.2018",2018,8,8,0.708978624,2
"HUN_022_MZB_LO_88","HUN_022_MZB_LO_88-29.08.2019","29.08.2019",2019,8,29,0.854460565,1
"HUN_022_MZB_LO_89","HUN_022_MZB_LO_89-16.08.2006","16.08.2006",2006,8,16,0.761311011,2
"HUN_022_MZB_LO_89","HUN_022_MZB_LO_89-14.07.2008","14.07.2008",2008,7,14,0.597563312,3
"HUN_022_MZB_LO_89","HUN_022_MZB_LO_89-13.07.2009","13.07.2009",2009,7,13,0.527320908,3
"HUN_022_MZB_LO_89","HUN_022_MZB_LO_89-04.08.2010","04.08.2010",2010,8,4,0.811956712,1
"HUN_022_MZB_LO_89","HUN_022_MZB_LO_89-11.07.2011","11.07.2011",2011,7,11,0.895721898,1
"HUN_022_MZB_LO_89","HUN_022_MZB_LO_89-29.08.2016","29.08.2016",2016,8,29,0.894073158,1
"HUN_022_MZB_LO_89","HUN_022_MZB_LO_89-08.08.2017","08.08.2017",2017,8,8,0.781241199,2
"HUN_022_MZB_LO_89","HUN_022_MZB_LO_89-09.08.2018","09.08.2018",2018,8,9,0.866127821,1
"HUN_022_MZB_LO_89","HUN_022_MZB_LO_89-26.08.2019","26.08.2019",2019,8,26,0.791765641,2
"HUN_022_MZB_LO_9","HUN_022_MZB_LO_9-07.06.2007","07.06.2007",2007,6,7,0.582567313,3
"HUN_022_MZB_LO_9","HUN_022_MZB_LO_9-08.05.2008","08.05.2008",2008,5,8,0.552321107,3
"HUN_022_MZB_LO_9","HUN_022_MZB_LO_9-25.05.2011","25.05.2011",2011,5,25,0.76668522,2
"HUN_022_MZB_LO_9","HUN_022_MZB_LO_9-16.05.2013","16.05.2013",2013,5,16,0.848542755,1
"HUN_022_MZB_LO_9","HUN_022_MZB_LO_9-07.05.2014","07.05.2014",2014,5,7,0.874063758,1
"HUN_022_MZB_LO_9","HUN_022_MZB_LO_9-04.05.2016","04.05.2016",2016,5,4,0.933128038,1
"HUN_022_MZB_LO_9","HUN_022_MZB_LO_9-05.05.2017","05.05.2017",2017,5,5,0.956099825,1
"HUN_022_MZB_LO_90","HUN_022_MZB_LO_90-15.08.2005","15.08.2005",2005,8,15,0.364376929,4
"HUN_022_MZB_LO_90","HUN_022_MZB_LO_90-24.09.2007","24.09.2007",2007,9,24,0.266953124,4
"HUN_022_MZB_LO_90","HUN_022_MZB_LO_90-26.09.2008","26.09.2008",2008,9,26,0.414615343,3
"HUN_022_MZB_LO_90","HUN_022_MZB_LO_90-07.10.2009","07.10.2009",2009,10,7,0.570968663,3
"HUN_022_MZB_LO_90","HUN_022_MZB_LO_90-13.10.2010","13.10.2010",2010,10,13,0.653266834,2
"HUN_022_MZB_LO_90","HUN_022_MZB_LO_90-13.09.2011","13.09.2011",2011,9,13,0.468848581,3
"HUN_022_MZB_LO_90","HUN_022_MZB_LO_90-05.08.2013","05.08.2013",2013,8,5,0.599919118,3
"HUN_022_MZB_LO_90","HUN_022_MZB_LO_90-09.09.2014","09.09.2014",2014,9,9,0.677094253,2
"HUN_022_MZB_LO_90","HUN_022_MZB_LO_90-27.08.2015","27.08.2015",2015,8,27,0.712610938,2
"HUN_022_MZB_LO_90","HUN_022_MZB_LO_90-30.08.2016","30.08.2016",2016,8,30,0.507937329,3
"HUN_022_MZB_LO_90","HUN_022_MZB_LO_90-09.08.2017","09.08.2017",2017,8,9,0.519924169,3
"HUN_022_MZB_LO_90","HUN_022_MZB_LO_90-21.08.2018","21.08.2018",2018,8,21,0.724795055,2
"HUN_022_MZB_LO_90","HUN_022_MZB_LO_90-16.09.2019","16.09.2019",2019,9,16,0.661396552,2
"HUN_022_MZB_LO_91","HUN_022_MZB_LO_91-01.08.2006","01.08.2006",2006,8,1,0.572571997,3
"HUN_022_MZB_LO_91","HUN_022_MZB_LO_91-21.09.2007","21.09.2007",2007,9,21,0.186036364,5
"HUN_022_MZB_LO_91","HUN_022_MZB_LO_91-23.09.2008","23.09.2008",2008,9,23,0.028323646,5
"HUN_022_MZB_LO_91","HUN_022_MZB_LO_91-08.09.2011","08.09.2011",2011,9,8,0.474583503,3
"HUN_022_MZB_LO_91","HUN_022_MZB_LO_91-09.08.2012","09.08.2012",2012,8,9,0.549687109,3
"HUN_022_MZB_LO_91","HUN_022_MZB_LO_91-12.09.2013","12.09.2013",2013,9,12,0.471754884,3
"HUN_022_MZB_LO_91","HUN_022_MZB_LO_91-11.09.2014","11.09.2014",2014,9,11,0.607908561,2
"HUN_022_MZB_LO_91","HUN_022_MZB_LO_91-28.08.2015","28.08.2015",2015,8,28,0.339418595,4
"HUN_022_MZB_LO_91","HUN_022_MZB_LO_91-14.08.2017","14.08.2017",2017,8,14,0.465904895,3
"HUN_022_MZB_LO_91","HUN_022_MZB_LO_91-16.08.2018","16.08.2018",2018,8,16,0.359387007,4
"HUN_022_MZB_LO_92","HUN_022_MZB_LO_92-22.08.2006","22.08.2006",2006,8,22,0.100025,5
"HUN_022_MZB_LO_92","HUN_022_MZB_LO_92-01.10.2007","01.10.2007",2007,10,1,0.243536406,4
"HUN_022_MZB_LO_92","HUN_022_MZB_LO_92-24.09.2008","24.09.2008",2008,9,24,0.734175893,2
"HUN_022_MZB_LO_92","HUN_022_MZB_LO_92-19.10.2009","19.10.2009",2009,10,19,0.028008929,5
"HUN_022_MZB_LO_92","HUN_022_MZB_LO_92-25.08.2010","25.08.2010",2010,8,25,0.602658492,2
"HUN_022_MZB_LO_92","HUN_022_MZB_LO_92-12.09.2011","12.09.2011",2011,9,12,0.223012939,4
"HUN_022_MZB_LO_92","HUN_022_MZB_LO_92-01.08.2012","01.08.2012",2012,8,1,0.388660568,4
"HUN_022_MZB_LO_92","HUN_022_MZB_LO_92-05.09.2013","05.09.2013",2013,9,5,0.314260884,4
"HUN_022_MZB_LO_92","HUN_022_MZB_LO_92-10.09.2014","10.09.2014",2014,9,10,0.537471875,3
"HUN_022_MZB_LO_92","HUN_022_MZB_LO_92-03.09.2015","03.09.2015",2015,9,3,0.062137979,5
"HUN_022_MZB_LO_92","HUN_022_MZB_LO_92-05.09.2016","05.09.2016",2016,9,5,0.331087347,4
"HUN_022_MZB_LO_92","HUN_022_MZB_LO_92-17.08.2017","17.08.2017",2017,8,17,0.432637229,3
"HUN_022_MZB_LO_92","HUN_022_MZB_LO_92-08.08.2018","08.08.2018",2018,8,8,0.18304476,5
"HUN_022_MZB_LO_92","HUN_022_MZB_LO_92-29.08.2019","29.08.2019",2019,8,29,0.159784827,5
"HUN_022_MZB_LO_93","HUN_022_MZB_LO_93-27.08.2007","27.08.2007",2007,8,27,0.467303462,3
"HUN_022_MZB_LO_93","HUN_022_MZB_LO_93-15.08.2008","15.08.2008",2008,8,15,0.51638664,3
"HUN_022_MZB_LO_93","HUN_022_MZB_LO_93-03.08.2009","03.08.2009",2009,8,3,0.393435188,4
"HUN_022_MZB_LO_93","HUN_022_MZB_LO_93-18.08.2011","18.08.2011",2011,8,18,0.498807152,3
"HUN_022_MZB_LO_93","HUN_022_MZB_LO_93-03.09.2013","03.09.2013",2013,9,3,0.420629394,3
"HUN_022_MZB_LO_93","HUN_022_MZB_LO_93-08.09.2015","08.09.2015",2015,9,8,0.323910728,4
"HUN_022_MZB_LO_93","HUN_022_MZB_LO_93-04.08.2016","04.08.2016",2016,8,4,0.460646801,3
"HUN_022_MZB_LO_93","HUN_022_MZB_LO_93-11.09.2017","11.09.2017",2017,9,11,0.456210096,3
"HUN_022_MZB_LO_93","HUN_022_MZB_LO_93-17.09.2018","17.09.2018",2018,9,17,0.422577469,3
"HUN_022_MZB_LO_93","HUN_022_MZB_LO_93-28.08.2019","28.08.2019",2019,8,28,0.336695655,4
