"Unique.ID","Samp.ID","Sampling.date","year","month","day","eqr","eqc"
"NLD_028_MZB_LO_1","NLD_028_MZB_LO_1-09.06.1981","09.06.1981",1981,6,9,0.711138411,2
"NLD_028_MZB_LO_1","NLD_028_MZB_LO_1-21.06.1982","21.06.1982",1982,6,21,0.713329991,2
"NLD_028_MZB_LO_1","NLD_028_MZB_LO_1-23.05.1983","23.05.1983",1983,5,23,0.642424242,2
"NLD_028_MZB_LO_1","NLD_028_MZB_LO_1-10.05.1984","10.05.1984",1984,5,10,0.690590438,2
"NLD_028_MZB_LO_1","NLD_028_MZB_LO_1-24.04.1985","24.04.1985",1985,4,24,0.866666667,1
"NLD_028_MZB_LO_1","NLD_028_MZB_LO_1-22.04.1986","22.04.1986",1986,4,22,0.726340326,2
"NLD_028_MZB_LO_1","NLD_028_MZB_LO_1-13.05.1987","13.05.1987",1987,5,13,0.713744589,2
"NLD_028_MZB_LO_1","NLD_028_MZB_LO_1-17.05.1988","17.05.1988",1988,5,17,0.674832536,2
"NLD_028_MZB_LO_1","NLD_028_MZB_LO_1-17.04.1989","17.04.1989",1989,4,17,0.663476874,2
"NLD_028_MZB_LO_1","NLD_028_MZB_LO_1-21.05.1990","21.05.1990",1990,5,21,0.568475904,3
"NLD_028_MZB_LO_1","NLD_028_MZB_LO_1-16.05.1991","16.05.1991",1991,5,16,0.534482759,3
"NLD_028_MZB_LO_1","NLD_028_MZB_LO_1-11.04.2005","11.04.2005",2005,4,11,0.675276497,2
"NLD_028_MZB_LO_1","NLD_028_MZB_LO_1-12.04.2010","12.04.2010",2010,4,12,0.225577453,4
"NLD_028_MZB_LO_1","NLD_028_MZB_LO_1-09.04.2014","09.04.2014",2014,4,9,0.721949222,2
"NLD_028_MZB_LO_10","NLD_028_MZB_LO_10-16.04.1984","16.04.1984",1984,4,16,0.373028135,4
"NLD_028_MZB_LO_10","NLD_028_MZB_LO_10-22.04.1985","22.04.1985",1985,4,22,0.293455387,4
"NLD_028_MZB_LO_10","NLD_028_MZB_LO_10-16.04.1986","16.04.1986",1986,4,16,0.407744108,3
"NLD_028_MZB_LO_10","NLD_028_MZB_LO_10-13.05.1987","13.05.1987",1987,5,13,0.411259212,3
"NLD_028_MZB_LO_10","NLD_028_MZB_LO_10-18.05.1988","18.05.1988",1988,5,18,0.51751663,3
"NLD_028_MZB_LO_10","NLD_028_MZB_LO_10-01.06.1999","01.06.1999",1999,6,1,0.495658715,3
"NLD_028_MZB_LO_10","NLD_028_MZB_LO_10-09.04.2008","09.04.2008",2008,4,9,0.575289668,3
"NLD_028_MZB_LO_10","NLD_028_MZB_LO_10-18.05.2009","18.05.2009",2009,5,18,0.385036702,4
"NLD_028_MZB_LO_10","NLD_028_MZB_LO_10-19.04.2010","19.04.2010",2010,4,19,0.484387904,3
"NLD_028_MZB_LO_10","NLD_028_MZB_LO_10-12.05.2011","12.05.2011",2011,5,12,0.390781377,4
"NLD_028_MZB_LO_10","NLD_028_MZB_LO_10-18.04.2012","18.04.2012",2012,4,18,0.485331264,3
"NLD_028_MZB_LO_10","NLD_028_MZB_LO_10-11.04.2013","11.04.2013",2013,4,11,0.388394278,4
"NLD_028_MZB_LO_10","NLD_028_MZB_LO_10-28.04.2014","28.04.2014",2014,4,28,0.443282285,3
"NLD_028_MZB_LO_10","NLD_028_MZB_LO_10-28.04.2015","28.04.2015",2015,4,28,0.403461138,3
"NLD_028_MZB_LO_10","NLD_028_MZB_LO_10-18.04.2016","18.04.2016",2016,4,18,0.398843035,4
"NLD_028_MZB_LO_10","NLD_028_MZB_LO_10-19.04.2017","19.04.2017",2017,4,19,0.428725947,3
"NLD_028_MZB_LO_10","NLD_028_MZB_LO_10-18.04.2018","18.04.2018",2018,4,18,0.387622254,4
"NLD_028_MZB_LO_10","NLD_028_MZB_LO_10-03.04.2019","03.04.2019",2019,4,3,0.301205474,4
"NLD_028_MZB_LO_11","NLD_028_MZB_LO_11-19.09.1984","19.09.1984",1984,9,19,0.507647908,3
"NLD_028_MZB_LO_11","NLD_028_MZB_LO_11-04.09.1985","04.09.1985",1985,9,4,0.554562575,3
"NLD_028_MZB_LO_11","NLD_028_MZB_LO_11-18.09.1986","18.09.1986",1986,9,18,0.730148947,2
"NLD_028_MZB_LO_11","NLD_028_MZB_LO_11-15.09.1988","15.09.1988",1988,9,15,0.548917749,3
"NLD_028_MZB_LO_11","NLD_028_MZB_LO_11-10.09.1989","10.09.1989",1989,9,10,0.561480186,3
"NLD_028_MZB_LO_11","NLD_028_MZB_LO_11-06.09.1990","06.09.1990",1990,9,6,0.410339792,3
"NLD_028_MZB_LO_11","NLD_028_MZB_LO_11-10.09.1991","10.09.1991",1991,9,10,0.490944327,3
"NLD_028_MZB_LO_11","NLD_028_MZB_LO_11-08.09.1992","08.09.1992",1992,9,8,0.546637103,3
"NLD_028_MZB_LO_11","NLD_028_MZB_LO_11-19.10.1993","19.10.1993",1993,10,19,0.651906452,2
"NLD_028_MZB_LO_11","NLD_028_MZB_LO_11-11.10.1994","11.10.1994",1994,10,11,0.574017852,3
"NLD_028_MZB_LO_11","NLD_028_MZB_LO_11-11.10.1995","11.10.1995",1995,10,11,0.551639648,3
"NLD_028_MZB_LO_11","NLD_028_MZB_LO_11-16.09.1997","16.09.1997",1997,9,16,0.533671874,3
"NLD_028_MZB_LO_11","NLD_028_MZB_LO_11-07.09.1998","07.09.1998",1998,9,7,0.641998937,2
"NLD_028_MZB_LO_11","NLD_028_MZB_LO_11-23.10.2001","23.10.2001",2001,10,23,0.561818182,3
"NLD_028_MZB_LO_11","NLD_028_MZB_LO_11-05.10.2004","05.10.2004",2004,10,5,0.509959674,3
"NLD_028_MZB_LO_11","NLD_028_MZB_LO_11-08.10.2007","08.10.2007",2007,10,8,0.492960821,3
"NLD_028_MZB_LO_11","NLD_028_MZB_LO_11-19.10.2009","19.10.2009",2009,10,19,0.422784937,3
"NLD_028_MZB_LO_11","NLD_028_MZB_LO_11-03.10.2012","03.10.2012",2012,10,3,0.491137793,3
"NLD_028_MZB_LO_12","NLD_028_MZB_LO_12-21.04.1981","21.04.1981",1981,4,21,0.338657407,4
"NLD_028_MZB_LO_12","NLD_028_MZB_LO_12-13.04.1984","13.04.1984",1984,4,13,0.40763684,3
"NLD_028_MZB_LO_12","NLD_028_MZB_LO_12-24.04.1985","24.04.1985",1985,4,24,0.383138664,4
"NLD_028_MZB_LO_12","NLD_028_MZB_LO_12-21.04.1986","21.04.1986",1986,4,21,0.542983182,3
"NLD_028_MZB_LO_12","NLD_028_MZB_LO_12-12.05.1987","12.05.1987",1987,5,12,0.423737374,3
"NLD_028_MZB_LO_12","NLD_028_MZB_LO_12-14.05.2008","14.05.2008",2008,5,14,0.528163993,3
"NLD_028_MZB_LO_12","NLD_028_MZB_LO_12-06.05.2009","06.05.2009",2009,5,6,0.512327323,3
"NLD_028_MZB_LO_12","NLD_028_MZB_LO_12-05.05.2010","05.05.2010",2010,5,5,0.532060349,3
"NLD_028_MZB_LO_12","NLD_028_MZB_LO_12-02.05.2011","02.05.2011",2011,5,2,0.557560638,3
"NLD_028_MZB_LO_12","NLD_028_MZB_LO_12-25.04.2012","25.04.2012",2012,4,25,0.527889875,3
"NLD_028_MZB_LO_12","NLD_028_MZB_LO_12-27.05.2013","27.05.2013",2013,5,27,0.449913867,3
"NLD_028_MZB_LO_12","NLD_028_MZB_LO_12-30.04.2014","30.04.2014",2014,4,30,0.556017686,3
"NLD_028_MZB_LO_12","NLD_028_MZB_LO_12-07.04.2015","07.04.2015",2015,4,7,0.598419498,3
"NLD_028_MZB_LO_12","NLD_028_MZB_LO_12-14.04.2016","14.04.2016",2016,4,14,0.531154684,3
"NLD_028_MZB_LO_12","NLD_028_MZB_LO_12-01.05.2017","01.05.2017",2017,5,1,0.64168789,2
"NLD_028_MZB_LO_12","NLD_028_MZB_LO_12-30.04.2018","30.04.2018",2018,4,30,0.427927928,3
"NLD_028_MZB_LO_12","NLD_028_MZB_LO_12-06.05.2019","06.05.2019",2019,5,6,0.386435786,4
"NLD_028_MZB_LO_13","NLD_028_MZB_LO_13-16.09.1980","16.09.1980",1980,9,16,0.385007974,4
"NLD_028_MZB_LO_13","NLD_028_MZB_LO_13-11.09.1984","11.09.1984",1984,9,11,0.376623377,4
"NLD_028_MZB_LO_13","NLD_028_MZB_LO_13-10.09.1985","10.09.1985",1985,9,10,0.394552324,4
"NLD_028_MZB_LO_13","NLD_028_MZB_LO_13-03.09.1986","03.09.1986",1986,9,3,0.543181818,3
"NLD_028_MZB_LO_13","NLD_028_MZB_LO_13-09.09.1987","09.09.1987",1987,9,9,0.541160173,3
"NLD_028_MZB_LO_13","NLD_028_MZB_LO_13-20.09.1988","20.09.1988",1988,9,20,0.50063994,3
"NLD_028_MZB_LO_13","NLD_028_MZB_LO_13-13.09.1989","13.09.1989",1989,9,13,0.655467721,2
"NLD_028_MZB_LO_13","NLD_028_MZB_LO_13-03.09.1990","03.09.1990",1990,9,3,0.568188247,3
"NLD_028_MZB_LO_13","NLD_028_MZB_LO_13-03.09.1991","03.09.1991",1991,9,3,0.369922283,4
"NLD_028_MZB_LO_13","NLD_028_MZB_LO_13-02.09.1992","02.09.1992",1992,9,2,0.538248218,3
"NLD_028_MZB_LO_13","NLD_028_MZB_LO_13-12.10.1993","12.10.1993",1993,10,12,0.363381716,4
"NLD_028_MZB_LO_13","NLD_028_MZB_LO_13-06.09.1994","06.09.1994",1994,9,6,0.551675122,3
"NLD_028_MZB_LO_13","NLD_028_MZB_LO_13-12.09.1995","12.09.1995",1995,9,12,0.502105374,3
"NLD_028_MZB_LO_13","NLD_028_MZB_LO_13-15.10.1998","15.10.1998",1998,10,15,0.616562385,2
"NLD_028_MZB_LO_13","NLD_028_MZB_LO_13-20.11.2001","20.11.2001",2001,11,20,0.498113051,3
"NLD_028_MZB_LO_13","NLD_028_MZB_LO_13-12.10.2004","12.10.2004",2004,10,12,0.599314243,3
"NLD_028_MZB_LO_13","NLD_028_MZB_LO_13-15.10.2007","15.10.2007",2007,10,15,0.421010101,3
"NLD_028_MZB_LO_13","NLD_028_MZB_LO_13-26.10.2009","26.10.2009",2009,10,26,0.599191919,3
"NLD_028_MZB_LO_13","NLD_028_MZB_LO_13-08.10.2012","08.10.2012",2012,10,8,0.589379172,3
"NLD_028_MZB_LO_14","NLD_028_MZB_LO_14-12.09.1984","12.09.1984",1984,9,12,0.386578265,4
"NLD_028_MZB_LO_14","NLD_028_MZB_LO_14-10.09.1985","10.09.1985",1985,9,10,0.457169171,3
"NLD_028_MZB_LO_14","NLD_028_MZB_LO_14-03.09.1986","03.09.1986",1986,9,3,0.392666157,4
"NLD_028_MZB_LO_14","NLD_028_MZB_LO_14-09.09.1987","09.09.1987",1987,9,9,0.401212121,3
"NLD_028_MZB_LO_14","NLD_028_MZB_LO_14-20.09.1988","20.09.1988",1988,9,20,0.439249639,3
"NLD_028_MZB_LO_14","NLD_028_MZB_LO_14-13.09.1989","13.09.1989",1989,9,13,0.410401845,3
"NLD_028_MZB_LO_14","NLD_028_MZB_LO_14-03.09.1990","03.09.1990",1990,9,3,0.456531114,3
"NLD_028_MZB_LO_14","NLD_028_MZB_LO_14-03.09.1991","03.09.1991",1991,9,3,0.25,4
"NLD_028_MZB_LO_14","NLD_028_MZB_LO_14-02.09.1992","02.09.1992",1992,9,2,0.368868334,4
"NLD_028_MZB_LO_14","NLD_028_MZB_LO_14-12.10.1993","12.10.1993",1993,10,12,0.534032634,3
"NLD_028_MZB_LO_14","NLD_028_MZB_LO_14-06.09.1994","06.09.1994",1994,9,6,0.524720893,3
"NLD_028_MZB_LO_14","NLD_028_MZB_LO_14-12.09.1995","12.09.1995",1995,9,12,0.448307248,3
"NLD_028_MZB_LO_14","NLD_028_MZB_LO_14-29.09.1998","29.09.1998",1998,9,29,0.598001404,3
"NLD_028_MZB_LO_14","NLD_028_MZB_LO_14-20.11.2001","20.11.2001",2001,11,20,0.571021605,3
"NLD_028_MZB_LO_14","NLD_028_MZB_LO_14-12.10.2004","12.10.2004",2004,10,12,0.600952536,2
"NLD_028_MZB_LO_14","NLD_028_MZB_LO_14-15.10.2007","15.10.2007",2007,10,15,0.498059134,3
"NLD_028_MZB_LO_14","NLD_028_MZB_LO_14-05.10.2009","05.10.2009",2009,10,5,0.504899846,3
"NLD_028_MZB_LO_14","NLD_028_MZB_LO_14-08.10.2012","08.10.2012",2012,10,8,0.539625473,3
"NLD_028_MZB_LO_15","NLD_028_MZB_LO_15-05.11.1981","05.11.1981",1981,11,5,0.242307692,4
"NLD_028_MZB_LO_15","NLD_028_MZB_LO_15-03.11.1982","03.11.1982",1982,11,3,0.348071343,4
"NLD_028_MZB_LO_15","NLD_028_MZB_LO_15-08.11.1983","08.11.1983",1983,11,8,0.295842294,4
"NLD_028_MZB_LO_15","NLD_028_MZB_LO_15-22.10.1984","22.10.1984",1984,10,22,0.413190458,3
"NLD_028_MZB_LO_15","NLD_028_MZB_LO_15-04.09.1985","04.09.1985",1985,9,4,0.583294923,3
"NLD_028_MZB_LO_15","NLD_028_MZB_LO_15-18.09.1986","18.09.1986",1986,9,18,0.407897153,3
"NLD_028_MZB_LO_15","NLD_028_MZB_LO_15-15.09.1988","15.09.1988",1988,9,15,0.545806726,3
"NLD_028_MZB_LO_15","NLD_028_MZB_LO_15-10.09.1989","10.09.1989",1989,9,10,0.27826087,4
"NLD_028_MZB_LO_15","NLD_028_MZB_LO_15-06.09.1990","06.09.1990",1990,9,6,0.533872126,3
"NLD_028_MZB_LO_15","NLD_028_MZB_LO_15-10.09.1991","10.09.1991",1991,9,10,0.479216109,3
"NLD_028_MZB_LO_15","NLD_028_MZB_LO_15-08.09.1992","08.09.1992",1992,9,8,0.564404122,3
"NLD_028_MZB_LO_15","NLD_028_MZB_LO_15-19.10.1993","19.10.1993",1993,10,19,0.497666667,3
"NLD_028_MZB_LO_15","NLD_028_MZB_LO_15-11.10.1994","11.10.1994",1994,10,11,0.461151369,3
"NLD_028_MZB_LO_15","NLD_028_MZB_LO_15-11.10.1995","11.10.1995",1995,10,11,0.421237502,3
"NLD_028_MZB_LO_15","NLD_028_MZB_LO_15-03.09.1996","03.09.1996",1996,9,3,0.37335415,4
"NLD_028_MZB_LO_15","NLD_028_MZB_LO_15-16.09.1997","16.09.1997",1997,9,16,0.534849562,3
"NLD_028_MZB_LO_15","NLD_028_MZB_LO_15-07.09.1998","07.09.1998",1998,9,7,0.65670798,2
"NLD_028_MZB_LO_15","NLD_028_MZB_LO_15-14.09.1999","14.09.1999",1999,9,14,0.577131278,3
"NLD_028_MZB_LO_15","NLD_028_MZB_LO_15-23.10.2001","23.10.2001",2001,10,23,0.456837607,3
"NLD_028_MZB_LO_15","NLD_028_MZB_LO_15-05.11.2002","05.11.2002",2002,11,5,0.442442774,3
"NLD_028_MZB_LO_15","NLD_028_MZB_LO_15-28.10.2003","28.10.2003",2003,10,28,0.806734007,1
"NLD_028_MZB_LO_15","NLD_028_MZB_LO_15-05.10.2004","05.10.2004",2004,10,5,0.54516129,3
"NLD_028_MZB_LO_15","NLD_028_MZB_LO_15-01.11.2005","01.11.2005",2005,11,1,0.564423299,3
"NLD_028_MZB_LO_15","NLD_028_MZB_LO_15-30.10.2006","30.10.2006",2006,10,30,0.646753455,2
"NLD_028_MZB_LO_15","NLD_028_MZB_LO_15-08.10.2007","08.10.2007",2007,10,8,0.741421225,2
"NLD_028_MZB_LO_15","NLD_028_MZB_LO_15-01.10.2008","01.10.2008",2008,10,1,0.640276754,2
"NLD_028_MZB_LO_15","NLD_028_MZB_LO_15-12.10.2009","12.10.2009",2009,10,12,0.539515894,3
"NLD_028_MZB_LO_15","NLD_028_MZB_LO_15-18.10.2010","18.10.2010",2010,10,18,0.579292174,3
"NLD_028_MZB_LO_15","NLD_028_MZB_LO_15-24.10.2011","24.10.2011",2011,10,24,0.631080766,2
"NLD_028_MZB_LO_15","NLD_028_MZB_LO_15-03.10.2012","03.10.2012",2012,10,3,0.728142559,2
"NLD_028_MZB_LO_16","NLD_028_MZB_LO_16-17.05.1982","17.05.1982",1982,5,17,0.28,4
"NLD_028_MZB_LO_16","NLD_028_MZB_LO_16-10.04.1984","10.04.1984",1984,4,10,0.282352941,4
"NLD_028_MZB_LO_16","NLD_028_MZB_LO_16-19.04.1985","19.04.1985",1985,4,19,0.334883721,4
"NLD_028_MZB_LO_16","NLD_028_MZB_LO_16-29.04.1986","29.04.1986",1986,4,29,0.689369889,2
"NLD_028_MZB_LO_16","NLD_028_MZB_LO_16-25.05.1987","25.05.1987",1987,5,25,0.437852206,3
"NLD_028_MZB_LO_16","NLD_028_MZB_LO_16-24.05.2005","24.05.2005",2005,5,24,0.851724138,1
"NLD_028_MZB_LO_16","NLD_028_MZB_LO_16-04.05.2009","04.05.2009",2009,5,4,0.570119563,3
"NLD_028_MZB_LO_16","NLD_028_MZB_LO_16-25.04.2012","25.04.2012",2012,4,25,0.570547899,3
"NLD_028_MZB_LO_16","NLD_028_MZB_LO_16-16.04.2013","16.04.2013",2013,4,16,0.520594623,3
"NLD_028_MZB_LO_16","NLD_028_MZB_LO_16-08.04.2014","08.04.2014",2014,4,8,0.633699789,2
"NLD_028_MZB_LO_16","NLD_028_MZB_LO_16-20.04.2015","20.04.2015",2015,4,20,0.609263014,2
"NLD_028_MZB_LO_16","NLD_028_MZB_LO_16-14.04.2016","14.04.2016",2016,4,14,0.587274277,3
"NLD_028_MZB_LO_16","NLD_028_MZB_LO_16-24.04.2017","24.04.2017",2017,4,24,0.49016317,3
"NLD_028_MZB_LO_16","NLD_028_MZB_LO_16-09.04.2018","09.04.2018",2018,4,9,0.556668481,3
"NLD_028_MZB_LO_16","NLD_028_MZB_LO_16-01.04.2019","01.04.2019",2019,4,1,0.581275441,3
"NLD_028_MZB_LO_17","NLD_028_MZB_LO_17-05.11.1981","05.11.1981",1981,11,5,0.894117647,1
"NLD_028_MZB_LO_17","NLD_028_MZB_LO_17-03.11.1982","03.11.1982",1982,11,3,0.549634274,3
"NLD_028_MZB_LO_17","NLD_028_MZB_LO_17-08.11.1983","08.11.1983",1983,11,8,0.55300416,3
"NLD_028_MZB_LO_17","NLD_028_MZB_LO_17-18.09.1985","18.09.1985",1985,9,18,0.724618239,2
"NLD_028_MZB_LO_17","NLD_028_MZB_LO_17-25.09.1986","25.09.1986",1986,9,25,0.641868599,2
"NLD_028_MZB_LO_17","NLD_028_MZB_LO_17-10.09.1987","10.09.1987",1987,9,10,0.755661882,2
"NLD_028_MZB_LO_17","NLD_028_MZB_LO_17-26.09.1988","26.09.1988",1988,9,26,0.713986014,2
"NLD_028_MZB_LO_17","NLD_028_MZB_LO_17-28.09.1989","28.09.1989",1989,9,28,0.618606652,2
"NLD_028_MZB_LO_17","NLD_028_MZB_LO_17-06.11.1990","06.11.1990",1990,11,6,0.652319109,2
"NLD_028_MZB_LO_17","NLD_028_MZB_LO_17-09.09.1991","09.09.1991",1991,9,9,0.680429915,2
"NLD_028_MZB_LO_17","NLD_028_MZB_LO_17-08.11.1993","08.11.1993",1993,11,8,0.659203024,2
"NLD_028_MZB_LO_17","NLD_028_MZB_LO_17-30.10.1995","30.10.1995",1995,10,30,0.589905287,3
"NLD_028_MZB_LO_17","NLD_028_MZB_LO_17-03.09.1996","03.09.1996",1996,9,3,0.494598735,3
"NLD_028_MZB_LO_17","NLD_028_MZB_LO_17-16.09.1997","16.09.1997",1997,9,16,0.677821695,2
"NLD_028_MZB_LO_17","NLD_028_MZB_LO_17-01.09.1998","01.09.1998",1998,9,1,0.765123765,2
"NLD_028_MZB_LO_17","NLD_028_MZB_LO_17-09.09.1999","09.09.1999",1999,9,9,0.730530388,2
"NLD_028_MZB_LO_17","NLD_028_MZB_LO_17-23.10.2000","23.10.2000",2000,10,23,0.644097693,2
"NLD_028_MZB_LO_17","NLD_028_MZB_LO_17-22.10.2001","22.10.2001",2001,10,22,0.551591641,3
"NLD_028_MZB_LO_17","NLD_028_MZB_LO_17-05.11.2002","05.11.2002",2002,11,5,0.750349755,2
"NLD_028_MZB_LO_17","NLD_028_MZB_LO_17-22.09.2003","22.09.2003",2003,9,22,0.653218426,2
"NLD_028_MZB_LO_17","NLD_028_MZB_LO_17-05.10.2004","05.10.2004",2004,10,5,0.638048698,2
"NLD_028_MZB_LO_17","NLD_028_MZB_LO_17-10.10.2005","10.10.2005",2005,10,10,0.783448276,2
"NLD_028_MZB_LO_17","NLD_028_MZB_LO_17-06.11.2006","06.11.2006",2006,11,6,0.712687595,2
"NLD_028_MZB_LO_17","NLD_028_MZB_LO_17-08.10.2007","08.10.2007",2007,10,8,0.891304348,1
"NLD_028_MZB_LO_17","NLD_028_MZB_LO_17-01.10.2008","01.10.2008",2008,10,1,0.809022474,1
"NLD_028_MZB_LO_17","NLD_028_MZB_LO_17-12.10.2009","12.10.2009",2009,10,12,0.82717141,1
"NLD_028_MZB_LO_17","NLD_028_MZB_LO_17-18.10.2010","18.10.2010",2010,10,18,0.60171278,2
"NLD_028_MZB_LO_17","NLD_028_MZB_LO_17-24.10.2011","24.10.2011",2011,10,24,0.707378129,2
"NLD_028_MZB_LO_17","NLD_028_MZB_LO_17-03.10.2012","03.10.2012",2012,10,3,0.792485885,2
"NLD_028_MZB_LO_17","NLD_028_MZB_LO_17-10.09.2014","10.09.2014",2014,9,10,0.897777778,1
"NLD_028_MZB_LO_17","NLD_028_MZB_LO_17-07.09.2015","07.09.2015",2015,9,7,0.647052342,2
"NLD_028_MZB_LO_17","NLD_028_MZB_LO_17-08.09.2016","08.09.2016",2016,9,8,0.836734694,1
"NLD_028_MZB_LO_18","NLD_028_MZB_LO_18-11.04.1994","11.04.1994",1994,4,11,0.295150521,4
"NLD_028_MZB_LO_18","NLD_028_MZB_LO_18-08.04.1998","08.04.1998",1998,4,8,0.343038493,4
"NLD_028_MZB_LO_18","NLD_028_MZB_LO_18-03.04.2002","03.04.2002",2002,4,3,0.439075664,3
"NLD_028_MZB_LO_18","NLD_028_MZB_LO_18-02.05.2005","02.05.2005",2005,5,2,0.328609857,4
"NLD_028_MZB_LO_18","NLD_028_MZB_LO_18-09.05.2006","09.05.2006",2006,5,9,0.341633282,4
"NLD_028_MZB_LO_18","NLD_028_MZB_LO_18-03.05.2007","03.05.2007",2007,5,3,0.337762804,4
"NLD_028_MZB_LO_18","NLD_028_MZB_LO_18-23.04.2008","23.04.2008",2008,4,23,0.354187827,4
"NLD_028_MZB_LO_18","NLD_028_MZB_LO_18-18.05.2009","18.05.2009",2009,5,18,0.348788985,4
"NLD_028_MZB_LO_18","NLD_028_MZB_LO_18-20.05.2010","20.05.2010",2010,5,20,0.361682958,4
"NLD_028_MZB_LO_18","NLD_028_MZB_LO_18-19.04.2011","19.04.2011",2011,4,19,0.3118411,4
"NLD_028_MZB_LO_18","NLD_028_MZB_LO_18-03.05.2012","03.05.2012",2012,5,3,0.285749646,4
"NLD_028_MZB_LO_18","NLD_028_MZB_LO_18-06.05.2013","06.05.2013",2013,5,6,0.318095789,4
"NLD_028_MZB_LO_18","NLD_028_MZB_LO_18-16.04.2014","16.04.2014",2014,4,16,0.293791557,4
"NLD_028_MZB_LO_18","NLD_028_MZB_LO_18-07.04.2015","07.04.2015",2015,4,7,0.349141459,4
"NLD_028_MZB_LO_18","NLD_028_MZB_LO_18-13.04.2016","13.04.2016",2016,4,13,0.340994242,4
"NLD_028_MZB_LO_18","NLD_028_MZB_LO_18-24.04.2017","24.04.2017",2017,4,24,0.314400545,4
"NLD_028_MZB_LO_18","NLD_028_MZB_LO_18-23.04.2018","23.04.2018",2018,4,23,0.286038221,4
"NLD_028_MZB_LO_18","NLD_028_MZB_LO_18-23.04.2019","23.04.2019",2019,4,23,0.27145248,4
"NLD_028_MZB_LO_19","NLD_028_MZB_LO_19-04.09.1991","04.09.1991",1991,9,4,0.35915397,4
"NLD_028_MZB_LO_19","NLD_028_MZB_LO_19-01.09.1992","01.09.1992",1992,9,1,0.357426348,4
"NLD_028_MZB_LO_19","NLD_028_MZB_LO_19-14.09.1993","14.09.1993",1993,9,14,0.517606838,3
"NLD_028_MZB_LO_19","NLD_028_MZB_LO_19-07.09.1994","07.09.1994",1994,9,7,0.549235115,3
"NLD_028_MZB_LO_19","NLD_028_MZB_LO_19-18.10.1995","18.10.1995",1995,10,18,0.486442019,3
"NLD_028_MZB_LO_19","NLD_028_MZB_LO_19-04.09.1996","04.09.1996",1996,9,4,0.323092985,4
"NLD_028_MZB_LO_19","NLD_028_MZB_LO_19-11.09.1997","11.09.1997",1997,9,11,0.369614375,4
"NLD_028_MZB_LO_19","NLD_028_MZB_LO_19-14.10.1998","14.10.1998",1998,10,14,0.361871549,4
"NLD_028_MZB_LO_19","NLD_028_MZB_LO_19-20.09.1999","20.09.1999",1999,9,20,0.485414141,3
"NLD_028_MZB_LO_19","NLD_028_MZB_LO_19-14.09.2000","14.09.2000",2000,9,14,0.598095238,3
"NLD_028_MZB_LO_19","NLD_028_MZB_LO_19-27.09.2001","27.09.2001",2001,9,27,0.605617838,2
"NLD_028_MZB_LO_19","NLD_028_MZB_LO_19-12.09.2002","12.09.2002",2002,9,12,0.603920258,2
"NLD_028_MZB_LO_19","NLD_028_MZB_LO_19-25.09.2003","25.09.2003",2003,9,25,0.450929257,3
"NLD_028_MZB_LO_19","NLD_028_MZB_LO_19-27.09.2004","27.09.2004",2004,9,27,0.532369768,3
"NLD_028_MZB_LO_19","NLD_028_MZB_LO_19-12.09.2005","12.09.2005",2005,9,12,0.544426891,3
"NLD_028_MZB_LO_19","NLD_028_MZB_LO_19-05.09.2006","05.09.2006",2006,9,5,0.473358586,3
"NLD_028_MZB_LO_19","NLD_028_MZB_LO_19-08.10.2007","08.10.2007",2007,10,8,0.514193494,3
"NLD_028_MZB_LO_19","NLD_028_MZB_LO_19-22.09.2008","22.09.2008",2008,9,22,0.466304764,3
"NLD_028_MZB_LO_19","NLD_028_MZB_LO_19-08.10.2009","08.10.2009",2009,10,8,0.494091663,3
"NLD_028_MZB_LO_19","NLD_028_MZB_LO_19-08.09.2010","08.09.2010",2010,9,8,0.488814192,3
"NLD_028_MZB_LO_19","NLD_028_MZB_LO_19-08.09.2011","08.09.2011",2011,9,8,0.483651279,3
"NLD_028_MZB_LO_19","NLD_028_MZB_LO_19-20.09.2012","20.09.2012",2012,9,20,0.485236264,3
"NLD_028_MZB_LO_19","NLD_028_MZB_LO_19-09.09.2013","09.09.2013",2013,9,9,0.449574616,3
"NLD_028_MZB_LO_19","NLD_028_MZB_LO_19-18.09.2014","18.09.2014",2014,9,18,0.521611505,3
"NLD_028_MZB_LO_19","NLD_028_MZB_LO_19-21.09.2015","21.09.2015",2015,9,21,0.519318543,3
"NLD_028_MZB_LO_19","NLD_028_MZB_LO_19-05.09.2016","05.09.2016",2016,9,5,0.516520468,3
"NLD_028_MZB_LO_2","NLD_028_MZB_LO_2-29.09.2003","29.09.2003",2003,9,29,0.366899767,4
"NLD_028_MZB_LO_2","NLD_028_MZB_LO_2-19.09.2005","19.09.2005",2005,9,19,0.336189826,4
"NLD_028_MZB_LO_2","NLD_028_MZB_LO_2-15.09.2008","15.09.2008",2008,9,15,0.441028139,3
"NLD_028_MZB_LO_2","NLD_028_MZB_LO_2-14.09.2009","14.09.2009",2009,9,14,0.347123052,4
"NLD_028_MZB_LO_2","NLD_028_MZB_LO_2-13.09.2011","13.09.2011",2011,9,13,0.388534844,4
"NLD_028_MZB_LO_2","NLD_028_MZB_LO_2-09.09.2014","09.09.2014",2014,9,9,0.451054328,3
"NLD_028_MZB_LO_2","NLD_028_MZB_LO_2-26.09.2016","26.09.2016",2016,9,26,0.506295348,3
"NLD_028_MZB_LO_2","NLD_028_MZB_LO_2-07.09.2017","07.09.2017",2017,9,7,0.50266019,3
"NLD_028_MZB_LO_2","NLD_028_MZB_LO_2-26.09.2018","26.09.2018",2018,9,26,0.404166667,3
"NLD_028_MZB_LO_3","NLD_028_MZB_LO_3-19.05.2003","19.05.2003",2003,5,19,0.443730159,3
"NLD_028_MZB_LO_3","NLD_028_MZB_LO_3-06.05.2004","06.05.2004",2004,5,6,0.417056277,3
"NLD_028_MZB_LO_3","NLD_028_MZB_LO_3-18.05.2005","18.05.2005",2005,5,18,0.363470458,4
"NLD_028_MZB_LO_3","NLD_028_MZB_LO_3-11.05.2006","11.05.2006",2006,5,11,0.475438596,3
"NLD_028_MZB_LO_3","NLD_028_MZB_LO_3-22.05.2007","22.05.2007",2007,5,22,0.278681552,4
"NLD_028_MZB_LO_3","NLD_028_MZB_LO_3-14.05.2008","14.05.2008",2008,5,14,0.355820106,4
"NLD_028_MZB_LO_3","NLD_028_MZB_LO_3-25.05.2009","25.05.2009",2009,5,25,0.257627119,4
"NLD_028_MZB_LO_3","NLD_028_MZB_LO_3-27.05.2010","27.05.2010",2010,5,27,0.264285714,4
"NLD_028_MZB_LO_3","NLD_028_MZB_LO_3-13.04.2011","13.04.2011",2011,4,13,0.417929293,3
"NLD_028_MZB_LO_3","NLD_028_MZB_LO_3-14.05.2012","14.05.2012",2012,5,14,0.3702554,4
"NLD_028_MZB_LO_3","NLD_028_MZB_LO_3-15.05.2013","15.05.2013",2013,5,15,0.441568627,3
"NLD_028_MZB_LO_3","NLD_028_MZB_LO_3-21.04.2015","21.04.2015",2015,4,21,0.587710967,3
"NLD_028_MZB_LO_3","NLD_028_MZB_LO_3-25.05.2016","25.05.2016",2016,5,25,0.466304348,3
"NLD_028_MZB_LO_3","NLD_028_MZB_LO_3-15.05.2017","15.05.2017",2017,5,15,0.49999293,3
"NLD_028_MZB_LO_3","NLD_028_MZB_LO_3-17.04.2018","17.04.2018",2018,4,17,0.487948485,3
"NLD_028_MZB_LO_3","NLD_028_MZB_LO_3-30.04.2019","30.04.2019",2019,4,30,0.50547504,3
"NLD_028_MZB_LO_4","NLD_028_MZB_LO_4-23.09.2003","23.09.2003",2003,9,23,0.552693603,3
"NLD_028_MZB_LO_4","NLD_028_MZB_LO_4-20.09.2004","20.09.2004",2004,9,20,0.574569222,3
"NLD_028_MZB_LO_4","NLD_028_MZB_LO_4-14.09.2005","14.09.2005",2005,9,14,0.463493694,3
"NLD_028_MZB_LO_4","NLD_028_MZB_LO_4-15.09.2008","15.09.2008",2008,9,15,0.671992986,2
"NLD_028_MZB_LO_4","NLD_028_MZB_LO_4-15.09.2009","15.09.2009",2009,9,15,0.644598155,2
"NLD_028_MZB_LO_4","NLD_028_MZB_LO_4-15.09.2013","15.09.2013",2013,9,15,0.578653563,3
"NLD_028_MZB_LO_4","NLD_028_MZB_LO_4-09.09.2014","09.09.2014",2014,9,9,0.626780627,2
"NLD_028_MZB_LO_4","NLD_028_MZB_LO_4-21.09.2015","21.09.2015",2015,9,21,0.613001491,2
"NLD_028_MZB_LO_4","NLD_028_MZB_LO_4-19.09.2016","19.09.2016",2016,9,19,0.677254287,2
"NLD_028_MZB_LO_4","NLD_028_MZB_LO_4-07.09.2017","07.09.2017",2017,9,7,0.600324675,2
"NLD_028_MZB_LO_5","NLD_028_MZB_LO_5-06.05.2004","06.05.2004",2004,5,6,0.247457627,4
"NLD_028_MZB_LO_5","NLD_028_MZB_LO_5-08.06.2005","08.06.2005",2005,6,8,0.535507565,3
"NLD_028_MZB_LO_5","NLD_028_MZB_LO_5-11.05.2006","11.05.2006",2006,5,11,0.293126386,4
"NLD_028_MZB_LO_5","NLD_028_MZB_LO_5-31.05.2007","31.05.2007",2007,5,31,0.240625,4
"NLD_028_MZB_LO_5","NLD_028_MZB_LO_5-16.04.2008","16.04.2008",2008,4,16,0.298245614,4
"NLD_028_MZB_LO_5","NLD_028_MZB_LO_5-22.06.2010","22.06.2010",2010,6,22,0.348377208,4
"NLD_028_MZB_LO_5","NLD_028_MZB_LO_5-13.04.2011","13.04.2011",2011,4,13,0.465521256,3
"NLD_028_MZB_LO_5","NLD_028_MZB_LO_5-20.06.2012","20.06.2012",2012,6,20,0.32238806,4
"NLD_028_MZB_LO_5","NLD_028_MZB_LO_5-17.06.2013","17.06.2013",2013,6,17,0.383374283,4
"NLD_028_MZB_LO_5","NLD_028_MZB_LO_5-10.06.2014","10.06.2014",2014,6,10,0.279012346,4
"NLD_028_MZB_LO_5","NLD_028_MZB_LO_5-21.04.2015","21.04.2015",2015,4,21,0.504921336,3
"NLD_028_MZB_LO_5","NLD_028_MZB_LO_5-15.05.2017","15.05.2017",2017,5,15,0.512525542,3
"NLD_028_MZB_LO_5","NLD_028_MZB_LO_5-17.04.2018","17.04.2018",2018,4,17,0.36034632,4
"NLD_028_MZB_LO_5","NLD_028_MZB_LO_5-02.04.2019","02.04.2019",2019,4,2,0.422295896,3
"NLD_028_MZB_LO_6","NLD_028_MZB_LO_6-04.05.1981","04.05.1981",1981,5,4,0.318035637,4
"NLD_028_MZB_LO_6","NLD_028_MZB_LO_6-21.05.2003","21.05.2003",2003,5,21,0.412611238,3
"NLD_028_MZB_LO_6","NLD_028_MZB_LO_6-28.04.2008","28.04.2008",2008,4,28,0.475175175,3
"NLD_028_MZB_LO_6","NLD_028_MZB_LO_6-15.06.2009","15.06.2009",2009,6,15,0.411801468,3
"NLD_028_MZB_LO_6","NLD_028_MZB_LO_6-05.05.2010","05.05.2010",2010,5,5,0.390707071,4
"NLD_028_MZB_LO_6","NLD_028_MZB_LO_6-03.05.2011","03.05.2011",2011,5,3,0.371168358,4
"NLD_028_MZB_LO_6","NLD_028_MZB_LO_6-23.04.2012","23.04.2012",2012,4,23,0.388888889,4
"NLD_028_MZB_LO_6","NLD_028_MZB_LO_6-08.05.2013","08.05.2013",2013,5,8,0.377592593,4
"NLD_028_MZB_LO_6","NLD_028_MZB_LO_6-03.04.2014","03.04.2014",2014,4,3,0.397957158,4
"NLD_028_MZB_LO_6","NLD_028_MZB_LO_6-22.04.2015","22.04.2015",2015,4,22,0.386930918,4
"NLD_028_MZB_LO_6","NLD_028_MZB_LO_6-06.04.2016","06.04.2016",2016,4,6,0.358431765,4
"NLD_028_MZB_LO_6","NLD_028_MZB_LO_6-18.04.2017","18.04.2017",2017,4,18,0.3786694,4
"NLD_028_MZB_LO_6","NLD_028_MZB_LO_6-30.04.2018","30.04.2018",2018,4,30,0.392450824,4
"NLD_028_MZB_LO_6","NLD_028_MZB_LO_6-08.05.2019","08.05.2019",2019,5,8,0.287991388,4
"NLD_028_MZB_LO_7","NLD_028_MZB_LO_7-02.05.1984","02.05.1984",1984,5,2,0.41368861,3
"NLD_028_MZB_LO_7","NLD_028_MZB_LO_7-08.05.1985","08.05.1985",1985,5,8,0.351650943,4
"NLD_028_MZB_LO_7","NLD_028_MZB_LO_7-01.05.1986","01.05.1986",1986,5,1,0.362165633,4
"NLD_028_MZB_LO_7","NLD_028_MZB_LO_7-02.06.1987","02.06.1987",1987,6,2,0.305005501,4
"NLD_028_MZB_LO_7","NLD_028_MZB_LO_7-26.05.1988","26.05.1988",1988,5,26,0.320326763,4
"NLD_028_MZB_LO_7","NLD_028_MZB_LO_7-09.05.2007","09.05.2007",2007,5,9,0.304779212,4
"NLD_028_MZB_LO_7","NLD_028_MZB_LO_7-16.04.2008","16.04.2008",2008,4,16,0.366523826,4
"NLD_028_MZB_LO_7","NLD_028_MZB_LO_7-18.05.2009","18.05.2009",2009,5,18,0.321502714,4
"NLD_028_MZB_LO_7","NLD_028_MZB_LO_7-12.05.2010","12.05.2010",2010,5,12,0.280473373,4
"NLD_028_MZB_LO_7","NLD_028_MZB_LO_7-10.05.2011","10.05.2011",2011,5,10,0.319181096,4
"NLD_028_MZB_LO_7","NLD_028_MZB_LO_7-23.04.2012","23.04.2012",2012,4,23,0.3360744,4
"NLD_028_MZB_LO_7","NLD_028_MZB_LO_7-02.05.2013","02.05.2013",2013,5,2,0.363915489,4
"NLD_028_MZB_LO_7","NLD_028_MZB_LO_7-28.04.2014","28.04.2014",2014,4,28,0.361728395,4
"NLD_028_MZB_LO_7","NLD_028_MZB_LO_7-22.04.2015","22.04.2015",2015,4,22,0.353262032,4
"NLD_028_MZB_LO_7","NLD_028_MZB_LO_7-21.04.2016","21.04.2016",2016,4,21,0.413083838,3
"NLD_028_MZB_LO_7","NLD_028_MZB_LO_7-24.04.2017","24.04.2017",2017,4,24,0.366511014,4
"NLD_028_MZB_LO_7","NLD_028_MZB_LO_7-18.04.2018","18.04.2018",2018,4,18,0.407815608,3
"NLD_028_MZB_LO_7","NLD_028_MZB_LO_7-13.05.2019","13.05.2019",2019,5,13,0.407101597,3
"NLD_028_MZB_LO_8","NLD_028_MZB_LO_8-13.06.1991","13.06.1991",1991,6,13,0.470481853,3
"NLD_028_MZB_LO_8","NLD_028_MZB_LO_8-15.05.2002","15.05.2002",2002,5,15,0.547232584,3
"NLD_028_MZB_LO_8","NLD_028_MZB_LO_8-02.04.2008","02.04.2008",2008,4,2,0.541677834,3
"NLD_028_MZB_LO_8","NLD_028_MZB_LO_8-14.04.2009","14.04.2009",2009,4,14,0.675517751,2
"NLD_028_MZB_LO_8","NLD_028_MZB_LO_8-06.04.2010","06.04.2010",2010,4,6,0.658891646,2
"NLD_028_MZB_LO_8","NLD_028_MZB_LO_8-04.04.2011","04.04.2011",2011,4,4,0.592106586,3
"NLD_028_MZB_LO_8","NLD_028_MZB_LO_8-05.04.2012","05.04.2012",2012,4,5,0.54826664,3
"NLD_028_MZB_LO_8","NLD_028_MZB_LO_8-02.04.2013","02.04.2013",2013,4,2,0.563126069,3
"NLD_028_MZB_LO_8","NLD_028_MZB_LO_8-03.04.2014","03.04.2014",2014,4,3,0.634529915,2
"NLD_028_MZB_LO_8","NLD_028_MZB_LO_8-02.04.2015","02.04.2015",2015,4,2,0.564786325,3
"NLD_028_MZB_LO_8","NLD_028_MZB_LO_8-04.04.2016","04.04.2016",2016,4,4,0.675269805,2
"NLD_028_MZB_LO_8","NLD_028_MZB_LO_8-03.04.2017","03.04.2017",2017,4,3,0.60206044,2
"NLD_028_MZB_LO_8","NLD_028_MZB_LO_8-04.04.2019","04.04.2019",2019,4,4,0.680436391,2
"NLD_028_MZB_LO_9","NLD_028_MZB_LO_9-01.05.1984","01.05.1984",1984,5,1,0.305255834,4
"NLD_028_MZB_LO_9","NLD_028_MZB_LO_9-06.05.1985","06.05.1985",1985,5,6,0.293388889,4
"NLD_028_MZB_LO_9","NLD_028_MZB_LO_9-14.04.1986","14.04.1986",1986,4,14,0.233962264,4
"NLD_028_MZB_LO_9","NLD_028_MZB_LO_9-22.04.1987","22.04.1987",1987,4,22,0.216393443,4
"NLD_028_MZB_LO_9","NLD_028_MZB_LO_9-01.06.1988","01.06.1988",1988,6,1,0.270137771,4
"NLD_028_MZB_LO_9","NLD_028_MZB_LO_9-07.06.1993","07.06.1993",1993,6,7,0.276595745,4
"NLD_028_MZB_LO_9","NLD_028_MZB_LO_9-28.04.2008","28.04.2008",2008,4,28,0.334567901,4
"NLD_028_MZB_LO_9","NLD_028_MZB_LO_9-15.06.2009","15.06.2009",2009,6,15,0.36267007,4
"NLD_028_MZB_LO_9","NLD_028_MZB_LO_9-05.05.2010","05.05.2010",2010,5,5,0.318253968,4
"NLD_028_MZB_LO_9","NLD_028_MZB_LO_9-03.05.2011","03.05.2011",2011,5,3,0.328610067,4
"NLD_028_MZB_LO_9","NLD_028_MZB_LO_9-23.04.2012","23.04.2012",2012,4,23,0.301349011,4
"NLD_028_MZB_LO_9","NLD_028_MZB_LO_9-08.05.2013","08.05.2013",2013,5,8,0.314188034,4
"NLD_028_MZB_LO_9","NLD_028_MZB_LO_9-03.04.2014","03.04.2014",2014,4,3,0.297162868,4
"NLD_028_MZB_LO_9","NLD_028_MZB_LO_9-22.04.2015","22.04.2015",2015,4,22,0.348454792,4
"NLD_028_MZB_LO_9","NLD_028_MZB_LO_9-06.04.2016","06.04.2016",2016,4,6,0.296855346,4
"NLD_028_MZB_LO_9","NLD_028_MZB_LO_9-18.04.2017","18.04.2017",2017,4,18,0.378031022,4
"NLD_028_MZB_LO_9","NLD_028_MZB_LO_9-18.04.2018","18.04.2018",2018,4,18,0.34914191,4
"NLD_028_MZB_LO_9","NLD_028_MZB_LO_9-25.04.2019","25.04.2019",2019,4,25,0.363782051,4
