"Unique.ID","Samp.ID","Sampling.date","year","month","day","eqr","eqc"
"SWE_038_MZB_LO_1","SWE_038_MZB_LO_1-29.09.2000","29.09.2000",2000,9,29,1.014548239,1
"SWE_038_MZB_LO_1","SWE_038_MZB_LO_1-18.09.2001","18.09.2001",2001,9,18,1.020980092,1
"SWE_038_MZB_LO_1","SWE_038_MZB_LO_1-27.09.2002","27.09.2002",2002,9,27,0.888888889,1
"SWE_038_MZB_LO_1","SWE_038_MZB_LO_1-22.09.2003","22.09.2003",2003,9,22,1.053598775,1
"SWE_038_MZB_LO_1","SWE_038_MZB_LO_1-16.09.2004","16.09.2004",2004,9,16,1.035528331,1
"SWE_038_MZB_LO_1","SWE_038_MZB_LO_1-16.09.2005","16.09.2005",2005,9,16,1.054977029,1
"SWE_038_MZB_LO_1","SWE_038_MZB_LO_1-13.09.2006","13.09.2006",2006,9,13,1.041347626,1
"SWE_038_MZB_LO_1","SWE_038_MZB_LO_1-25.09.2007","25.09.2007",2007,9,25,0.972434916,1
"SWE_038_MZB_LO_1","SWE_038_MZB_LO_1-23.09.2008","23.09.2008",2008,9,23,1,1
"SWE_038_MZB_LO_1","SWE_038_MZB_LO_1-01.10.2009","01.10.2009",2009,10,1,1.037212864,1
"SWE_038_MZB_LO_1","SWE_038_MZB_LO_1-13.09.2010","13.09.2010",2010,9,13,1.07856049,1
"SWE_038_MZB_LO_1","SWE_038_MZB_LO_1-11.09.2011","11.09.2011",2011,9,11,1.014548239,1
"SWE_038_MZB_LO_1","SWE_038_MZB_LO_1-12.09.2012","12.09.2012",2012,9,12,0.995405819,1
"SWE_038_MZB_LO_1","SWE_038_MZB_LO_1-19.09.2013","19.09.2013",2013,9,19,1.033690658,1
"SWE_038_MZB_LO_1","SWE_038_MZB_LO_1-17.09.2014","17.09.2014",2014,9,17,1,1
"SWE_038_MZB_LO_1","SWE_038_MZB_LO_1-06.10.2016","06.10.2016",2016,10,6,1.058652374,1
"SWE_038_MZB_LO_1","SWE_038_MZB_LO_1-05.10.2017","05.10.2017",2017,10,5,1,1
"SWE_038_MZB_LO_1","SWE_038_MZB_LO_1-22.09.2018","22.09.2018",2018,9,22,1.059724349,1
"SWE_038_MZB_LO_1","SWE_038_MZB_LO_1-24.09.2019","24.09.2019",2019,9,24,1.105206738,1
"SWE_038_MZB_LO_10","SWE_038_MZB_LO_10-10.10.2007","10.10.2007",2007,10,10,0.989505247,1
"SWE_038_MZB_LO_10","SWE_038_MZB_LO_10-17.09.2008","17.09.2008",2008,9,17,1.011994003,1
"SWE_038_MZB_LO_10","SWE_038_MZB_LO_10-14.09.2009","14.09.2009",2009,9,14,0.996551724,1
"SWE_038_MZB_LO_10","SWE_038_MZB_LO_10-03.09.2012","03.09.2012",2012,9,3,1,1
"SWE_038_MZB_LO_10","SWE_038_MZB_LO_10-02.09.2013","02.09.2013",2013,9,2,0.95952024,1
"SWE_038_MZB_LO_10","SWE_038_MZB_LO_10-11.10.2017","11.10.2017",2017,10,11,1,1
"SWE_038_MZB_LO_10","SWE_038_MZB_LO_10-24.10.2018","24.10.2018",2018,10,24,1,1
"SWE_038_MZB_LO_11","SWE_038_MZB_LO_11-10.11.2003","10.11.2003",2003,11,10,1.163873371,1
"SWE_038_MZB_LO_11","SWE_038_MZB_LO_11-11.10.2004","11.10.2004",2004,10,11,1.068342644,1
"SWE_038_MZB_LO_11","SWE_038_MZB_LO_11-28.10.2005","28.10.2005",2005,10,28,1.198324022,1
"SWE_038_MZB_LO_11","SWE_038_MZB_LO_11-28.10.2006","28.10.2006",2006,10,28,1.168156425,1
"SWE_038_MZB_LO_11","SWE_038_MZB_LO_11-05.11.2007","05.11.2007",2007,11,5,1.194040968,1
"SWE_038_MZB_LO_11","SWE_038_MZB_LO_11-23.10.2008","23.10.2008",2008,10,23,1.158659218,1
"SWE_038_MZB_LO_11","SWE_038_MZB_LO_11-09.10.2009","09.10.2009",2009,10,9,1.254934823,1
"SWE_038_MZB_LO_11","SWE_038_MZB_LO_11-22.10.2010","22.10.2010",2010,10,22,1.14264432,1
"SWE_038_MZB_LO_11","SWE_038_MZB_LO_11-13.10.2011","13.10.2011",2011,10,13,1.163873371,1
"SWE_038_MZB_LO_11","SWE_038_MZB_LO_11-01.10.2012","01.10.2012",2012,10,1,1.199255121,1
"SWE_038_MZB_LO_11","SWE_038_MZB_LO_11-01.10.2013","01.10.2013",2013,10,1,1.222532588,1
"SWE_038_MZB_LO_11","SWE_038_MZB_LO_11-02.10.2014","02.10.2014",2014,10,2,1.194972067,1
"SWE_038_MZB_LO_11","SWE_038_MZB_LO_11-06.10.2015","06.10.2015",2015,10,6,1.185102421,1
"SWE_038_MZB_LO_11","SWE_038_MZB_LO_11-04.10.2016","04.10.2016",2016,10,4,1.117318436,1
"SWE_038_MZB_LO_11","SWE_038_MZB_LO_11-11.10.2017","11.10.2017",2017,10,11,1,1
"SWE_038_MZB_LO_11","SWE_038_MZB_LO_11-30.10.2018","30.10.2018",2018,10,30,1.108007449,1
"SWE_038_MZB_LO_12","SWE_038_MZB_LO_12-30.10.2007","30.10.2007",2007,10,30,1.247672253,1
"SWE_038_MZB_LO_12","SWE_038_MZB_LO_12-27.10.2008","27.10.2008",2008,10,27,1.202048417,1
"SWE_038_MZB_LO_12","SWE_038_MZB_LO_12-16.10.2009","16.10.2009",2009,10,16,1.22160149,1
"SWE_038_MZB_LO_12","SWE_038_MZB_LO_12-23.10.2010","23.10.2010",2010,10,23,1.241527002,1
"SWE_038_MZB_LO_12","SWE_038_MZB_LO_12-13.10.2011","13.10.2011",2011,10,13,1.210428305,1
"SWE_038_MZB_LO_12","SWE_038_MZB_LO_12-03.10.2012","03.10.2012",2012,10,3,1.2858473,1
"SWE_038_MZB_LO_12","SWE_038_MZB_LO_12-22.10.2013","22.10.2013",2013,10,22,1.254934823,1
"SWE_038_MZB_LO_12","SWE_038_MZB_LO_12-03.10.2014","03.10.2014",2014,10,3,1.238733706,1
"SWE_038_MZB_LO_12","SWE_038_MZB_LO_12-05.10.2015","05.10.2015",2015,10,5,1.276908752,1
"SWE_038_MZB_LO_12","SWE_038_MZB_LO_12-04.10.2016","04.10.2016",2016,10,4,1.184357542,1
"SWE_038_MZB_LO_12","SWE_038_MZB_LO_12-01.10.2017","01.10.2017",2017,10,1,1.210428305,1
"SWE_038_MZB_LO_12","SWE_038_MZB_LO_12-30.10.2018","30.10.2018",2018,10,30,1.184357542,1
"SWE_038_MZB_LO_12","SWE_038_MZB_LO_12-01.10.2019","01.10.2019",2019,10,1,1.273743017,1
"SWE_038_MZB_LO_13","SWE_038_MZB_LO_13-03.10.2007","03.10.2007",2007,10,3,1,1
"SWE_038_MZB_LO_13","SWE_038_MZB_LO_13-29.09.2008","29.09.2008",2008,9,29,1,1
"SWE_038_MZB_LO_13","SWE_038_MZB_LO_13-28.09.2009","28.09.2009",2009,9,28,1,1
"SWE_038_MZB_LO_13","SWE_038_MZB_LO_13-21.09.2010","21.09.2010",2010,9,21,1,1
"SWE_038_MZB_LO_13","SWE_038_MZB_LO_13-13.10.2011","13.10.2011",2011,10,13,1,1
"SWE_038_MZB_LO_13","SWE_038_MZB_LO_13-16.10.2012","16.10.2012",2012,10,16,1,1
"SWE_038_MZB_LO_13","SWE_038_MZB_LO_13-15.10.2013","15.10.2013",2013,10,15,1,1
"SWE_038_MZB_LO_13","SWE_038_MZB_LO_13-08.10.2014","08.10.2014",2014,10,8,1,1
"SWE_038_MZB_LO_13","SWE_038_MZB_LO_13-30.09.2015","30.09.2015",2015,9,30,1,1
"SWE_038_MZB_LO_13","SWE_038_MZB_LO_13-18.10.2016","18.10.2016",2016,10,18,1,1
"SWE_038_MZB_LO_13","SWE_038_MZB_LO_13-11.10.2017","11.10.2017",2017,10,11,1,1
"SWE_038_MZB_LO_13","SWE_038_MZB_LO_13-23.10.2018","23.10.2018",2018,10,23,1,1
"SWE_038_MZB_LO_14","SWE_038_MZB_LO_14-27.09.2007","27.09.2007",2007,9,27,1.036600306,1
"SWE_038_MZB_LO_14","SWE_038_MZB_LO_14-09.09.2008","09.09.2008",2008,9,9,1.052220521,1
"SWE_038_MZB_LO_14","SWE_038_MZB_LO_14-11.10.2009","11.10.2009",2009,10,11,1,1
"SWE_038_MZB_LO_14","SWE_038_MZB_LO_14-15.09.2011","15.09.2011",2011,9,15,1,1
"SWE_038_MZB_LO_14","SWE_038_MZB_LO_14-07.09.2012","07.09.2012",2012,9,7,1.088361409,1
"SWE_038_MZB_LO_14","SWE_038_MZB_LO_14-07.09.2013","07.09.2013",2013,9,7,1.05007657,1
"SWE_038_MZB_LO_14","SWE_038_MZB_LO_14-08.09.2014","08.09.2014",2014,9,8,1.090352221,1
"SWE_038_MZB_LO_14","SWE_038_MZB_LO_14-09.09.2015","09.09.2015",2015,9,9,1.09754977,1
"SWE_038_MZB_LO_14","SWE_038_MZB_LO_14-05.09.2016","05.09.2016",2016,9,5,1.078407351,1
"SWE_038_MZB_LO_14","SWE_038_MZB_LO_14-09.09.2017","09.09.2017",2017,9,9,1.043185299,1
"SWE_038_MZB_LO_14","SWE_038_MZB_LO_14-08.09.2018","08.09.2018",2018,9,8,1.032465544,1
"SWE_038_MZB_LO_14","SWE_038_MZB_LO_14-16.09.2019","16.09.2019",2019,9,16,1.071975498,1
"SWE_038_MZB_LO_16","SWE_038_MZB_LO_16-19.09.2007","19.09.2007",2007,9,19,1.09754977,1
"SWE_038_MZB_LO_16","SWE_038_MZB_LO_16-16.09.2008","16.09.2008",2008,9,16,1.078407351,1
"SWE_038_MZB_LO_16","SWE_038_MZB_LO_16-05.10.2009","05.10.2009",2009,10,5,1.111111111,1
"SWE_038_MZB_LO_16","SWE_038_MZB_LO_16-25.09.2010","25.09.2010",2010,9,25,1,1
"SWE_038_MZB_LO_16","SWE_038_MZB_LO_16-26.09.2011","26.09.2011",2011,9,26,1,1
"SWE_038_MZB_LO_16","SWE_038_MZB_LO_16-02.10.2012","02.10.2012",2012,10,2,1.093874426,1
"SWE_038_MZB_LO_16","SWE_038_MZB_LO_16-16.09.2013","16.09.2013",2013,9,16,1,1
"SWE_038_MZB_LO_16","SWE_038_MZB_LO_16-16.09.2014","16.09.2014",2014,9,16,1.106738132,1
"SWE_038_MZB_LO_16","SWE_038_MZB_LO_16-22.09.2015","22.09.2015",2015,9,22,1,1
"SWE_038_MZB_LO_16","SWE_038_MZB_LO_16-05.10.2016","05.10.2016",2016,10,5,1.071975498,1
"SWE_038_MZB_LO_16","SWE_038_MZB_LO_16-03.10.2017","03.10.2017",2017,10,3,1.077641654,1
"SWE_038_MZB_LO_16","SWE_038_MZB_LO_16-21.09.2018","21.09.2018",2018,9,21,1.048085758,1
"SWE_038_MZB_LO_16","SWE_038_MZB_LO_16-25.09.2019","25.09.2019",2019,9,25,1.060643185,1
"SWE_038_MZB_LO_17","SWE_038_MZB_LO_17-27.09.2007","27.09.2007",2007,9,27,0.888888889,1
"SWE_038_MZB_LO_17","SWE_038_MZB_LO_17-19.09.2008","19.09.2008",2008,9,19,0.777777778,1
"SWE_038_MZB_LO_17","SWE_038_MZB_LO_17-06.10.2009","06.10.2009",2009,10,6,0.777777778,1
"SWE_038_MZB_LO_17","SWE_038_MZB_LO_17-17.09.2010","17.09.2010",2010,9,17,0.888888889,1
"SWE_038_MZB_LO_17","SWE_038_MZB_LO_17-26.09.2011","26.09.2011",2011,9,26,0.888888889,1
"SWE_038_MZB_LO_17","SWE_038_MZB_LO_17-04.10.2012","04.10.2012",2012,10,4,0.777777778,1
"SWE_038_MZB_LO_17","SWE_038_MZB_LO_17-24.09.2013","24.09.2013",2013,9,24,0.777777778,1
"SWE_038_MZB_LO_17","SWE_038_MZB_LO_17-14.09.2014","14.09.2014",2014,9,14,0.888888889,1
"SWE_038_MZB_LO_17","SWE_038_MZB_LO_17-21.09.2015","21.09.2015",2015,9,21,0.888888889,1
"SWE_038_MZB_LO_17","SWE_038_MZB_LO_17-04.10.2016","04.10.2016",2016,10,4,0.888888889,1
"SWE_038_MZB_LO_17","SWE_038_MZB_LO_17-02.10.2017","02.10.2017",2017,10,2,0.888888889,1
"SWE_038_MZB_LO_17","SWE_038_MZB_LO_17-21.09.2018","21.09.2018",2018,9,21,0.995405819,1
"SWE_038_MZB_LO_19","SWE_038_MZB_LO_19-14.09.2007","14.09.2007",2007,9,14,1.05007657,1
"SWE_038_MZB_LO_19","SWE_038_MZB_LO_19-15.09.2008","15.09.2008",2008,9,15,1,1
"SWE_038_MZB_LO_19","SWE_038_MZB_LO_19-16.09.2009","16.09.2009",2009,9,16,1.058652374,1
"SWE_038_MZB_LO_19","SWE_038_MZB_LO_19-18.09.2011","18.09.2011",2011,9,18,1,1
"SWE_038_MZB_LO_19","SWE_038_MZB_LO_19-01.10.2012","01.10.2012",2012,10,1,1,1
"SWE_038_MZB_LO_19","SWE_038_MZB_LO_19-16.09.2013","16.09.2013",2013,9,16,1,1
"SWE_038_MZB_LO_19","SWE_038_MZB_LO_19-18.09.2014","18.09.2014",2014,9,18,1.04532925,1
"SWE_038_MZB_LO_19","SWE_038_MZB_LO_19-24.09.2015","24.09.2015",2015,9,24,1,1
"SWE_038_MZB_LO_19","SWE_038_MZB_LO_19-29.09.2016","29.09.2016",2016,9,29,1.091883614,1
"SWE_038_MZB_LO_19","SWE_038_MZB_LO_19-29.09.2017","29.09.2017",2017,9,29,1.071975498,1
"SWE_038_MZB_LO_19","SWE_038_MZB_LO_19-17.09.2018","17.09.2018",2018,9,17,1.091883614,1
"SWE_038_MZB_LO_2","SWE_038_MZB_LO_2-21.10.2004","21.10.2004",2004,10,21,1.124394786,1
"SWE_038_MZB_LO_2","SWE_038_MZB_LO_2-24.11.2005","24.11.2005",2005,11,24,1.117318436,1
"SWE_038_MZB_LO_2","SWE_038_MZB_LO_2-20.11.2007","20.11.2007",2007,11,20,1.033519553,1
"SWE_038_MZB_LO_2","SWE_038_MZB_LO_2-27.11.2008","27.11.2008",2008,11,27,1.102420857,1
"SWE_038_MZB_LO_2","SWE_038_MZB_LO_2-27.10.2009","27.10.2009",2009,10,27,1.124767225,1
"SWE_038_MZB_LO_2","SWE_038_MZB_LO_2-17.11.2010","17.11.2010",2010,11,17,1.117318436,1
"SWE_038_MZB_LO_2","SWE_038_MZB_LO_2-01.11.2011","01.11.2011",2011,11,1,1.095903166,1
"SWE_038_MZB_LO_2","SWE_038_MZB_LO_2-20.11.2012","20.11.2012",2012,11,20,1.144878957,1
"SWE_038_MZB_LO_2","SWE_038_MZB_LO_2-08.10.2013","08.10.2013",2013,10,8,1.124394786,1
"SWE_038_MZB_LO_2","SWE_038_MZB_LO_2-27.11.2014","27.11.2014",2014,11,27,1.110428305,1
"SWE_038_MZB_LO_2","SWE_038_MZB_LO_2-14.10.2015","14.10.2015",2015,10,14,1.138733706,1
"SWE_038_MZB_LO_2","SWE_038_MZB_LO_2-24.10.2016","24.10.2016",2016,10,24,1.124394786,1
"SWE_038_MZB_LO_2","SWE_038_MZB_LO_2-19.10.2017","19.10.2017",2017,10,19,1.160335196,1
"SWE_038_MZB_LO_2","SWE_038_MZB_LO_2-15.10.2018","15.10.2018",2018,10,15,1.123463687,1
"SWE_038_MZB_LO_2","SWE_038_MZB_LO_2-23.10.2019","23.10.2019",2019,10,23,1.160335196,1
"SWE_038_MZB_LO_20","SWE_038_MZB_LO_20-17.10.2007","17.10.2007",2007,10,17,1,1
"SWE_038_MZB_LO_20","SWE_038_MZB_LO_20-16.09.2008","16.09.2008",2008,9,16,1,1
"SWE_038_MZB_LO_20","SWE_038_MZB_LO_20-28.10.2009","28.10.2009",2009,10,28,1.05007657,1
"SWE_038_MZB_LO_20","SWE_038_MZB_LO_20-26.10.2010","26.10.2010",2010,10,26,1.001225115,1
"SWE_038_MZB_LO_20","SWE_038_MZB_LO_20-26.10.2011","26.10.2011",2011,10,26,1.008116386,1
"SWE_038_MZB_LO_20","SWE_038_MZB_LO_20-15.10.2012","15.10.2012",2012,10,15,1.05007657,1
"SWE_038_MZB_LO_20","SWE_038_MZB_LO_20-23.10.2013","23.10.2013",2013,10,23,1,1
"SWE_038_MZB_LO_20","SWE_038_MZB_LO_20-07.10.2014","07.10.2014",2014,10,7,0.888888889,1
"SWE_038_MZB_LO_20","SWE_038_MZB_LO_20-20.10.2015","20.10.2015",2015,10,20,1,1
"SWE_038_MZB_LO_20","SWE_038_MZB_LO_20-18.10.2016","18.10.2016",2016,10,18,0.982695253,1
"SWE_038_MZB_LO_20","SWE_038_MZB_LO_20-04.10.2017","04.10.2017",2017,10,4,0.930627871,1
"SWE_038_MZB_LO_20","SWE_038_MZB_LO_20-25.10.2018","25.10.2018",2018,10,25,1,1
"SWE_038_MZB_LO_21","SWE_038_MZB_LO_21-28.09.2007","28.09.2007",2007,9,28,1,1
"SWE_038_MZB_LO_21","SWE_038_MZB_LO_21-18.09.2008","18.09.2008",2008,9,18,1,1
"SWE_038_MZB_LO_21","SWE_038_MZB_LO_21-15.10.2009","15.10.2009",2009,10,15,1,1
"SWE_038_MZB_LO_21","SWE_038_MZB_LO_21-18.09.2010","18.09.2010",2010,9,18,1.036431784,1
"SWE_038_MZB_LO_21","SWE_038_MZB_LO_21-01.10.2011","01.10.2011",2011,10,1,1.033433283,1
"SWE_038_MZB_LO_21","SWE_038_MZB_LO_21-23.09.2012","23.09.2012",2012,9,23,1,1
"SWE_038_MZB_LO_21","SWE_038_MZB_LO_21-23.09.2013","23.09.2013",2013,9,23,1,1
"SWE_038_MZB_LO_21","SWE_038_MZB_LO_21-21.09.2014","21.09.2014",2014,9,21,1.049475262,1
"SWE_038_MZB_LO_21","SWE_038_MZB_LO_21-19.09.2015","19.09.2015",2015,9,19,1,1
"SWE_038_MZB_LO_21","SWE_038_MZB_LO_21-04.09.2016","04.09.2016",2016,9,4,1,1
"SWE_038_MZB_LO_21","SWE_038_MZB_LO_21-07.09.2017","07.09.2017",2017,9,7,1,1
"SWE_038_MZB_LO_21","SWE_038_MZB_LO_21-06.09.2018","06.09.2018",2018,9,6,1,1
"SWE_038_MZB_LO_21","SWE_038_MZB_LO_21-08.09.2019","08.09.2019",2019,9,8,1,1
"SWE_038_MZB_LO_22","SWE_038_MZB_LO_22-22.10.2007","22.10.2007",2007,10,22,0.988454376,1
"SWE_038_MZB_LO_22","SWE_038_MZB_LO_22-15.10.2008","15.10.2008",2008,10,15,1.013035382,1
"SWE_038_MZB_LO_22","SWE_038_MZB_LO_22-14.10.2009","14.10.2009",2009,10,14,0.956424581,1
"SWE_038_MZB_LO_22","SWE_038_MZB_LO_22-13.10.2010","13.10.2010",2010,10,13,1.020111732,1
"SWE_038_MZB_LO_22","SWE_038_MZB_LO_22-12.10.2011","12.10.2011",2011,10,12,1.080074488,1
"SWE_038_MZB_LO_22","SWE_038_MZB_LO_22-15.10.2012","15.10.2012",2012,10,15,1.024208566,1
"SWE_038_MZB_LO_22","SWE_038_MZB_LO_22-14.10.2013","14.10.2013",2013,10,14,1.024208566,1
"SWE_038_MZB_LO_22","SWE_038_MZB_LO_22-13.10.2014","13.10.2014",2014,10,13,1.013780261,1
"SWE_038_MZB_LO_22","SWE_038_MZB_LO_22-14.10.2015","14.10.2015",2015,10,14,0.998137803,1
"SWE_038_MZB_LO_22","SWE_038_MZB_LO_22-13.10.2016","13.10.2016",2016,10,13,0.962197393,1
"SWE_038_MZB_LO_22","SWE_038_MZB_LO_22-18.10.2017","18.10.2017",2017,10,18,1.030353818,1
"SWE_038_MZB_LO_22","SWE_038_MZB_LO_22-17.10.2018","17.10.2018",2018,10,17,0.969832402,1
"SWE_038_MZB_LO_22","SWE_038_MZB_LO_22-17.10.2019","17.10.2019",2019,10,17,1.004283054,1
"SWE_038_MZB_LO_23","SWE_038_MZB_LO_23-08.10.2007","08.10.2007",2007,10,8,1.15716946,1
"SWE_038_MZB_LO_23","SWE_038_MZB_LO_23-22.10.2008","22.10.2008",2008,10,22,1.086219739,1
"SWE_038_MZB_LO_23","SWE_038_MZB_LO_23-04.10.2009","04.10.2009",2009,10,4,1.049534451,1
"SWE_038_MZB_LO_23","SWE_038_MZB_LO_23-19.10.2010","19.10.2010",2010,10,19,1.083426443,1
"SWE_038_MZB_LO_23","SWE_038_MZB_LO_23-18.10.2011","18.10.2011",2011,10,18,1.096648045,1
"SWE_038_MZB_LO_23","SWE_038_MZB_LO_23-12.10.2012","12.10.2012",2012,10,12,1.086219739,1
"SWE_038_MZB_LO_23","SWE_038_MZB_LO_23-24.10.2013","24.10.2013",2013,10,24,1.098696462,1
"SWE_038_MZB_LO_23","SWE_038_MZB_LO_23-21.10.2014","21.10.2014",2014,10,21,1.086219739,1
"SWE_038_MZB_LO_23","SWE_038_MZB_LO_23-11.11.2015","11.11.2015",2015,11,11,1.174674115,1
"SWE_038_MZB_LO_23","SWE_038_MZB_LO_23-30.10.2016","30.10.2016",2016,10,30,1.083426443,1
"SWE_038_MZB_LO_23","SWE_038_MZB_LO_23-24.10.2017","24.10.2017",2017,10,24,1.024208566,1
"SWE_038_MZB_LO_24","SWE_038_MZB_LO_24-26.09.2007","26.09.2007",2007,9,26,1,1
"SWE_038_MZB_LO_24","SWE_038_MZB_LO_24-26.09.2008","26.09.2008",2008,9,26,1,1
"SWE_038_MZB_LO_24","SWE_038_MZB_LO_24-18.09.2009","18.09.2009",2009,9,18,0.998774885,1
"SWE_038_MZB_LO_24","SWE_038_MZB_LO_24-05.09.2011","05.09.2011",2011,9,5,0.988514548,1
"SWE_038_MZB_LO_24","SWE_038_MZB_LO_24-15.10.2012","15.10.2012",2012,10,15,0.888888889,1
"SWE_038_MZB_LO_24","SWE_038_MZB_LO_24-01.10.2013","01.10.2013",2013,10,1,0.969831547,1
"SWE_038_MZB_LO_24","SWE_038_MZB_LO_24-12.10.2014","12.10.2014",2014,10,12,0.984532925,1
"SWE_038_MZB_LO_24","SWE_038_MZB_LO_24-05.10.2015","05.10.2015",2015,10,5,0.888888889,1
"SWE_038_MZB_LO_24","SWE_038_MZB_LO_24-03.10.2016","03.10.2016",2016,10,3,0.888888889,1
"SWE_038_MZB_LO_24","SWE_038_MZB_LO_24-10.10.2017","10.10.2017",2017,10,10,0.888888889,1
"SWE_038_MZB_LO_24","SWE_038_MZB_LO_24-25.10.2018","25.10.2018",2018,10,25,0.777777778,1
"SWE_038_MZB_LO_24","SWE_038_MZB_LO_24-04.10.2019","04.10.2019",2019,10,4,0.98330781,1
"SWE_038_MZB_LO_25","SWE_038_MZB_LO_25-02.10.2007","02.10.2007",2007,10,2,0.99310987,1
"SWE_038_MZB_LO_25","SWE_038_MZB_LO_25-16.10.2008","16.10.2008",2008,10,16,1.034636872,1
"SWE_038_MZB_LO_25","SWE_038_MZB_LO_25-24.10.2009","24.10.2009",2009,10,24,1.075977654,1
"SWE_038_MZB_LO_25","SWE_038_MZB_LO_25-06.10.2010","06.10.2010",2010,10,6,1.098696462,1
"SWE_038_MZB_LO_25","SWE_038_MZB_LO_25-03.10.2011","03.10.2011",2011,10,3,0.977653631,1
"SWE_038_MZB_LO_25","SWE_038_MZB_LO_25-20.11.2012","20.11.2012",2012,11,20,1.024208566,1
"SWE_038_MZB_LO_25","SWE_038_MZB_LO_25-01.10.2013","01.10.2013",2013,10,1,1.117318436,1
"SWE_038_MZB_LO_25","SWE_038_MZB_LO_25-07.10.2014","07.10.2014",2014,10,7,1.074301676,1
"SWE_038_MZB_LO_25","SWE_038_MZB_LO_25-08.10.2015","08.10.2015",2015,10,8,1.191806331,1
"SWE_038_MZB_LO_25","SWE_038_MZB_LO_25-02.10.2016","02.10.2016",2016,10,2,1.194040968,1
"SWE_038_MZB_LO_25","SWE_038_MZB_LO_25-03.10.2017","03.10.2017",2017,10,3,1.175418994,1
"SWE_038_MZB_LO_25","SWE_038_MZB_LO_25-07.11.2018","07.11.2018",2018,11,7,1.090689013,1
"SWE_038_MZB_LO_26","SWE_038_MZB_LO_26-31.10.2007","31.10.2007",2007,10,31,1,1
"SWE_038_MZB_LO_26","SWE_038_MZB_LO_26-03.11.2008","03.11.2008",2008,11,3,0.8,1
"SWE_038_MZB_LO_26","SWE_038_MZB_LO_26-03.11.2009","03.11.2009",2009,11,3,1,1
"SWE_038_MZB_LO_26","SWE_038_MZB_LO_26-28.10.2010","28.10.2010",2010,10,28,1,1
"SWE_038_MZB_LO_26","SWE_038_MZB_LO_26-21.11.2011","21.11.2011",2011,11,21,0.8,1
"SWE_038_MZB_LO_26","SWE_038_MZB_LO_26-01.11.2012","01.11.2012",2012,11,1,1.124767225,1
"SWE_038_MZB_LO_26","SWE_038_MZB_LO_26-31.10.2013","31.10.2013",2013,10,31,1.067597765,1
"SWE_038_MZB_LO_26","SWE_038_MZB_LO_26-23.10.2014","23.10.2014",2014,10,23,0.8,1
"SWE_038_MZB_LO_26","SWE_038_MZB_LO_26-15.10.2015","15.10.2015",2015,10,15,1.152700186,1
"SWE_038_MZB_LO_26","SWE_038_MZB_LO_26-14.10.2016","14.10.2016",2016,10,14,0.6,2
"SWE_038_MZB_LO_26","SWE_038_MZB_LO_26-24.10.2017","24.10.2017",2017,10,24,0.6,2
"SWE_038_MZB_LO_26","SWE_038_MZB_LO_26-17.10.2018","17.10.2018",2018,10,17,0.8,1
"SWE_038_MZB_LO_27","SWE_038_MZB_LO_27-24.10.2007","24.10.2007",2007,10,24,1.179329609,1
"SWE_038_MZB_LO_27","SWE_038_MZB_LO_27-23.10.2008","23.10.2008",2008,10,23,1.183798883,1
"SWE_038_MZB_LO_27","SWE_038_MZB_LO_27-09.10.2009","09.10.2009",2009,10,9,1.19310987,1
"SWE_038_MZB_LO_27","SWE_038_MZB_LO_27-18.10.2010","18.10.2010",2010,10,18,1.203724395,1
"SWE_038_MZB_LO_27","SWE_038_MZB_LO_27-13.10.2011","13.10.2011",2011,10,13,1.223649907,1
"SWE_038_MZB_LO_27","SWE_038_MZB_LO_27-01.10.2012","01.10.2012",2012,10,1,1.131098696,1
"SWE_038_MZB_LO_27","SWE_038_MZB_LO_27-23.10.2013","23.10.2013",2013,10,23,1.218808194,1
"SWE_038_MZB_LO_27","SWE_038_MZB_LO_27-01.10.2014","01.10.2014",2014,10,1,1.183798883,1
"SWE_038_MZB_LO_27","SWE_038_MZB_LO_27-06.10.2015","06.10.2015",2015,10,6,1.251396648,1
"SWE_038_MZB_LO_27","SWE_038_MZB_LO_27-29.11.2016","29.11.2016",2016,11,29,1.204655493,1
"SWE_038_MZB_LO_27","SWE_038_MZB_LO_27-12.10.2017","12.10.2017",2017,10,12,1.189013035,1
"SWE_038_MZB_LO_27","SWE_038_MZB_LO_27-18.10.2018","18.10.2018",2018,10,18,1.222905028,1
"SWE_038_MZB_LO_27","SWE_038_MZB_LO_27-18.10.2019","18.10.2019",2019,10,18,1.262197393,1
"SWE_038_MZB_LO_28","SWE_038_MZB_LO_28-26.09.2007","26.09.2007",2007,9,26,1,1
"SWE_038_MZB_LO_28","SWE_038_MZB_LO_28-18.09.2008","18.09.2008",2008,9,18,1,1
"SWE_038_MZB_LO_28","SWE_038_MZB_LO_28-17.09.2009","17.09.2009",2009,9,17,1.017304747,1
"SWE_038_MZB_LO_28","SWE_038_MZB_LO_28-21.10.2011","21.10.2011",2011,10,21,1.030781011,1
"SWE_038_MZB_LO_28","SWE_038_MZB_LO_28-07.10.2012","07.10.2012",2012,10,7,1.041347626,1
"SWE_038_MZB_LO_28","SWE_038_MZB_LO_28-14.10.2013","14.10.2013",2013,10,14,1,1
"SWE_038_MZB_LO_28","SWE_038_MZB_LO_28-17.10.2014","17.10.2014",2014,10,17,0.986217458,1
"SWE_038_MZB_LO_28","SWE_038_MZB_LO_28-14.10.2015","14.10.2015",2015,10,14,1,1
"SWE_038_MZB_LO_28","SWE_038_MZB_LO_28-11.10.2016","11.10.2016",2016,10,11,1,1
"SWE_038_MZB_LO_28","SWE_038_MZB_LO_28-10.10.2017","10.10.2017",2017,10,10,0.989586524,1
"SWE_038_MZB_LO_28","SWE_038_MZB_LO_28-24.10.2018","24.10.2018",2018,10,24,0.998774885,1
"SWE_038_MZB_LO_28","SWE_038_MZB_LO_28-03.10.2019","03.10.2019",2019,10,3,1,1
"SWE_038_MZB_LO_29","SWE_038_MZB_LO_29-15.10.2007","15.10.2007",2007,10,15,1,1
"SWE_038_MZB_LO_29","SWE_038_MZB_LO_29-11.10.2008","11.10.2008",2008,10,11,0.888888889,1
"SWE_038_MZB_LO_29","SWE_038_MZB_LO_29-15.10.2009","15.10.2009",2009,10,15,0.98330781,1
"SWE_038_MZB_LO_29","SWE_038_MZB_LO_29-13.10.2010","13.10.2010",2010,10,13,0.888888889,1
"SWE_038_MZB_LO_29","SWE_038_MZB_LO_29-18.10.2011","18.10.2011",2011,10,18,0.964777948,1
"SWE_038_MZB_LO_29","SWE_038_MZB_LO_29-15.10.2012","15.10.2012",2012,10,15,0.967228178,1
"SWE_038_MZB_LO_29","SWE_038_MZB_LO_29-16.10.2013","16.10.2013",2013,10,16,0.888888889,1
"SWE_038_MZB_LO_29","SWE_038_MZB_LO_29-13.10.2014","13.10.2014",2014,10,13,0.888888889,1
"SWE_038_MZB_LO_29","SWE_038_MZB_LO_29-14.10.2015","14.10.2015",2015,10,14,0.888888889,1
"SWE_038_MZB_LO_29","SWE_038_MZB_LO_29-19.10.2016","19.10.2016",2016,10,19,0.666666667,2
"SWE_038_MZB_LO_29","SWE_038_MZB_LO_29-17.10.2017","17.10.2017",2017,10,17,0.777777778,1
"SWE_038_MZB_LO_29","SWE_038_MZB_LO_29-17.10.2018","17.10.2018",2018,10,17,0.888888889,1
"SWE_038_MZB_LO_3","SWE_038_MZB_LO_3-14.09.2007","14.09.2007",2007,9,14,1.029402757,1
"SWE_038_MZB_LO_3","SWE_038_MZB_LO_3-15.09.2008","15.09.2008",2008,9,15,1.035987749,1
"SWE_038_MZB_LO_3","SWE_038_MZB_LO_3-16.09.2009","16.09.2009",2009,9,16,1.055895865,1
"SWE_038_MZB_LO_3","SWE_038_MZB_LO_3-15.09.2010","15.09.2010",2010,9,15,1.055895865,1
"SWE_038_MZB_LO_3","SWE_038_MZB_LO_3-25.09.2011","25.09.2011",2011,9,25,1.029402757,1
"SWE_038_MZB_LO_3","SWE_038_MZB_LO_3-20.09.2012","20.09.2012",2012,9,20,1.045022971,1
"SWE_038_MZB_LO_3","SWE_038_MZB_LO_3-16.09.2013","16.09.2013",2013,9,16,1,1
"SWE_038_MZB_LO_3","SWE_038_MZB_LO_3-18.09.2014","18.09.2014",2014,9,18,0.999846861,1
"SWE_038_MZB_LO_3","SWE_038_MZB_LO_3-24.09.2015","24.09.2015",2015,9,24,0.888888889,1
"SWE_038_MZB_LO_3","SWE_038_MZB_LO_3-29.09.2016","29.09.2016",2016,9,29,1,1
"SWE_038_MZB_LO_3","SWE_038_MZB_LO_3-28.09.2017","28.09.2017",2017,9,28,1,1
"SWE_038_MZB_LO_3","SWE_038_MZB_LO_3-22.09.2018","22.09.2018",2018,9,22,0.888888889,1
"SWE_038_MZB_LO_30","SWE_038_MZB_LO_30-07.10.2007","07.10.2007",2007,10,7,0.777777778,1
"SWE_038_MZB_LO_30","SWE_038_MZB_LO_30-26.09.2008","26.09.2008",2008,9,26,0.777777778,1
"SWE_038_MZB_LO_30","SWE_038_MZB_LO_30-05.10.2009","05.10.2009",2009,10,5,0.777777778,1
"SWE_038_MZB_LO_30","SWE_038_MZB_LO_30-29.09.2010","29.09.2010",2010,9,29,0.777777778,1
"SWE_038_MZB_LO_30","SWE_038_MZB_LO_30-11.10.2011","11.10.2011",2011,10,11,1,1
"SWE_038_MZB_LO_30","SWE_038_MZB_LO_30-17.10.2012","17.10.2012",2012,10,17,0.995405819,1
"SWE_038_MZB_LO_30","SWE_038_MZB_LO_30-16.10.2013","16.10.2013",2013,10,16,0.888888889,1
"SWE_038_MZB_LO_30","SWE_038_MZB_LO_30-17.10.2014","17.10.2014",2014,10,17,0.777777778,1
"SWE_038_MZB_LO_30","SWE_038_MZB_LO_30-28.09.2015","28.09.2015",2015,9,28,0.777777778,1
"SWE_038_MZB_LO_30","SWE_038_MZB_LO_30-10.10.2016","10.10.2016",2016,10,10,0.988514548,1
"SWE_038_MZB_LO_30","SWE_038_MZB_LO_30-02.10.2017","02.10.2017",2017,10,2,0.777777778,1
"SWE_038_MZB_LO_30","SWE_038_MZB_LO_30-16.10.2018","16.10.2018",2018,10,16,0.777777778,1
"SWE_038_MZB_LO_31","SWE_038_MZB_LO_31-22.10.2001","22.10.2001",2001,10,22,1.303538175,1
"SWE_038_MZB_LO_31","SWE_038_MZB_LO_31-21.11.2002","21.11.2002",2002,11,21,1.261266294,1
"SWE_038_MZB_LO_31","SWE_038_MZB_LO_31-18.10.2003","18.10.2003",2003,10,18,1.262197393,1
"SWE_038_MZB_LO_31","SWE_038_MZB_LO_31-08.11.2004","08.11.2004",2004,11,8,1.233705773,1
"SWE_038_MZB_LO_31","SWE_038_MZB_LO_31-21.09.2005","21.09.2005",2005,9,21,1.210428305,1
"SWE_038_MZB_LO_31","SWE_038_MZB_LO_31-28.10.2006","28.10.2006",2006,10,28,1.233705773,1
"SWE_038_MZB_LO_31","SWE_038_MZB_LO_31-30.10.2007","30.10.2007",2007,10,30,1.241527002,1
"SWE_038_MZB_LO_31","SWE_038_MZB_LO_31-27.10.2008","27.10.2008",2008,10,27,1.010986965,1
"SWE_038_MZB_LO_31","SWE_038_MZB_LO_31-16.10.2009","16.10.2009",2009,10,16,1.258845438,1
"SWE_038_MZB_LO_31","SWE_038_MZB_LO_31-23.10.2010","23.10.2010",2010,10,23,1.227374302,1
"SWE_038_MZB_LO_31","SWE_038_MZB_LO_31-13.10.2011","13.10.2011",2011,10,13,1.288640596,1
"SWE_038_MZB_LO_31","SWE_038_MZB_LO_31-02.10.2012","02.10.2012",2012,10,2,1.182122905,1
"SWE_038_MZB_LO_31","SWE_038_MZB_LO_31-22.10.2013","22.10.2013",2013,10,22,1.303538175,1
"SWE_038_MZB_LO_31","SWE_038_MZB_LO_31-03.10.2014","03.10.2014",2014,10,3,1.206331471,1
"SWE_038_MZB_LO_31","SWE_038_MZB_LO_31-05.10.2015","05.10.2015",2015,10,5,1.249162011,1
"SWE_038_MZB_LO_31","SWE_038_MZB_LO_31-04.10.2016","04.10.2016",2016,10,4,1.22160149,1
"SWE_038_MZB_LO_31","SWE_038_MZB_LO_31-04.10.2017","04.10.2017",2017,10,4,1.21452514,1
"SWE_038_MZB_LO_31","SWE_038_MZB_LO_31-30.10.2018","30.10.2018",2018,10,30,1.261266294,1
"SWE_038_MZB_LO_32","SWE_038_MZB_LO_32-17.10.2007","17.10.2007",2007,10,17,1,1
"SWE_038_MZB_LO_32","SWE_038_MZB_LO_32-13.10.2008","13.10.2008",2008,10,13,1,1
"SWE_038_MZB_LO_32","SWE_038_MZB_LO_32-08.10.2009","08.10.2009",2009,10,8,0.946554935,1
"SWE_038_MZB_LO_32","SWE_038_MZB_LO_32-05.10.2010","05.10.2010",2010,10,5,1,1
"SWE_038_MZB_LO_32","SWE_038_MZB_LO_32-25.10.2011","25.10.2011",2011,10,25,1.082867784,1
"SWE_038_MZB_LO_32","SWE_038_MZB_LO_32-16.11.2012","16.11.2012",2012,11,16,1,1
"SWE_038_MZB_LO_32","SWE_038_MZB_LO_32-08.10.2013","08.10.2013",2013,10,8,1,1
"SWE_038_MZB_LO_32","SWE_038_MZB_LO_32-14.10.2014","14.10.2014",2014,10,14,1,1
"SWE_038_MZB_LO_32","SWE_038_MZB_LO_32-14.10.2015","14.10.2015",2015,10,14,1,1
"SWE_038_MZB_LO_32","SWE_038_MZB_LO_32-20.10.2016","20.10.2016",2016,10,20,1,1
"SWE_038_MZB_LO_32","SWE_038_MZB_LO_32-13.10.2017","13.10.2017",2017,10,13,1,1
"SWE_038_MZB_LO_32","SWE_038_MZB_LO_32-17.10.2018","17.10.2018",2018,10,17,1.13538175,1
"SWE_038_MZB_LO_33","SWE_038_MZB_LO_33-27.09.2007","27.09.2007",2007,9,27,0.888888889,1
"SWE_038_MZB_LO_33","SWE_038_MZB_LO_33-23.09.2008","23.09.2008",2008,9,23,0.954722639,1
"SWE_038_MZB_LO_33","SWE_038_MZB_LO_33-16.09.2009","16.09.2009",2009,9,16,0.978410795,1
"SWE_038_MZB_LO_33","SWE_038_MZB_LO_33-21.10.2011","21.10.2011",2011,10,21,0.943628186,1
"SWE_038_MZB_LO_33","SWE_038_MZB_LO_33-07.10.2012","07.10.2012",2012,10,7,0.980209895,1
"SWE_038_MZB_LO_33","SWE_038_MZB_LO_33-14.10.2013","14.10.2013",2013,10,14,0.978410795,1
"SWE_038_MZB_LO_33","SWE_038_MZB_LO_33-17.10.2014","17.10.2014",2014,10,17,1,1
"SWE_038_MZB_LO_33","SWE_038_MZB_LO_33-14.10.2015","14.10.2015",2015,10,14,0.999550225,1
"SWE_038_MZB_LO_33","SWE_038_MZB_LO_33-11.10.2016","11.10.2016",2016,10,11,0.954722639,1
"SWE_038_MZB_LO_33","SWE_038_MZB_LO_33-10.10.2017","10.10.2017",2017,10,10,0.945127436,1
"SWE_038_MZB_LO_33","SWE_038_MZB_LO_33-24.10.2018","24.10.2018",2018,10,24,0.777777778,1
"SWE_038_MZB_LO_33","SWE_038_MZB_LO_33-03.10.2019","03.10.2019",2019,10,3,1.0017991,1
"SWE_038_MZB_LO_34","SWE_038_MZB_LO_34-23.10.2007","23.10.2007",2007,10,23,1.253445065,1
"SWE_038_MZB_LO_34","SWE_038_MZB_LO_34-13.10.2008","13.10.2008",2008,10,13,1.200744879,1
"SWE_038_MZB_LO_34","SWE_038_MZB_LO_34-24.10.2009","24.10.2009",2009,10,24,1.236499069,1
"SWE_038_MZB_LO_34","SWE_038_MZB_LO_34-05.10.2010","05.10.2010",2010,10,5,1.168156425,1
"SWE_038_MZB_LO_34","SWE_038_MZB_LO_34-13.10.2011","13.10.2011",2011,10,13,1.199255121,1
"SWE_038_MZB_LO_34","SWE_038_MZB_LO_34-15.10.2012","15.10.2012",2012,10,15,1.109310987,1
"SWE_038_MZB_LO_34","SWE_038_MZB_LO_34-18.10.2013","18.10.2013",2013,10,18,1.252700186,1
"SWE_038_MZB_LO_34","SWE_038_MZB_LO_34-14.10.2014","14.10.2014",2014,10,14,1.22160149,1
"SWE_038_MZB_LO_34","SWE_038_MZB_LO_34-15.10.2015","15.10.2015",2015,10,15,1.189013035,1
"SWE_038_MZB_LO_34","SWE_038_MZB_LO_34-21.10.2016","21.10.2016",2016,10,21,1.15716946,1
"SWE_038_MZB_LO_34","SWE_038_MZB_LO_34-13.10.2017","13.10.2017",2017,10,13,1.222532588,1
"SWE_038_MZB_LO_34","SWE_038_MZB_LO_34-15.11.2018","15.11.2018",2018,11,15,1.252700186,1
"SWE_038_MZB_LO_34","SWE_038_MZB_LO_34-21.10.2019","21.10.2019",2019,10,21,1.233705773,1
"SWE_038_MZB_LO_36","SWE_038_MZB_LO_36-23.11.2007","23.11.2007",2007,11,23,1.104841713,1
"SWE_038_MZB_LO_36","SWE_038_MZB_LO_36-28.10.2008","28.10.2008",2008,10,28,1.080074488,1
"SWE_038_MZB_LO_36","SWE_038_MZB_LO_36-19.10.2009","19.10.2009",2009,10,19,1.07877095,1
"SWE_038_MZB_LO_36","SWE_038_MZB_LO_36-20.10.2010","20.10.2010",2010,10,20,1.085288641,1
"SWE_038_MZB_LO_36","SWE_038_MZB_LO_36-27.10.2011","27.10.2011",2011,10,27,1.062197393,1
"SWE_038_MZB_LO_36","SWE_038_MZB_LO_36-30.10.2012","30.10.2012",2012,10,30,1.088640596,1
"SWE_038_MZB_LO_36","SWE_038_MZB_LO_36-29.10.2013","29.10.2013",2013,10,29,1.099255121,1
"SWE_038_MZB_LO_36","SWE_038_MZB_LO_36-30.10.2014","30.10.2014",2014,10,30,1.07877095,1
"SWE_038_MZB_LO_36","SWE_038_MZB_LO_36-19.10.2015","19.10.2015",2015,10,19,1.136499069,1
"SWE_038_MZB_LO_36","SWE_038_MZB_LO_36-17.10.2016","17.10.2016",2016,10,17,1.123649907,1
"SWE_038_MZB_LO_36","SWE_038_MZB_LO_36-16.10.2017","16.10.2017",2017,10,16,1.110986965,1
"SWE_038_MZB_LO_36","SWE_038_MZB_LO_36-07.11.2018","07.11.2018",2018,11,7,1.087337058,1
"SWE_038_MZB_LO_37","SWE_038_MZB_LO_37-19.10.2007","19.10.2007",2007,10,19,1.133519553,1
"SWE_038_MZB_LO_37","SWE_038_MZB_LO_37-23.10.2008","23.10.2008",2008,10,23,1.083985102,1
"SWE_038_MZB_LO_37","SWE_038_MZB_LO_37-09.10.2009","09.10.2009",2009,10,9,1.241527002,1
"SWE_038_MZB_LO_37","SWE_038_MZB_LO_37-13.10.2010","13.10.2010",2010,10,13,1.081191806,1
"SWE_038_MZB_LO_37","SWE_038_MZB_LO_37-24.10.2011","24.10.2011",2011,10,24,1.195344507,1
"SWE_038_MZB_LO_37","SWE_038_MZB_LO_37-19.10.2012","19.10.2012",2012,10,19,1.068715084,1
"SWE_038_MZB_LO_37","SWE_038_MZB_LO_37-18.10.2013","18.10.2013",2013,10,18,1.255679702,1
"SWE_038_MZB_LO_37","SWE_038_MZB_LO_37-20.10.2014","20.10.2014",2014,10,20,1.076536313,1
"SWE_038_MZB_LO_37","SWE_038_MZB_LO_37-21.10.2015","21.10.2015",2015,10,21,1.227932961,1
"SWE_038_MZB_LO_37","SWE_038_MZB_LO_37-26.10.2016","26.10.2016",2016,10,26,1.163873371,1
"SWE_038_MZB_LO_37","SWE_038_MZB_LO_37-30.10.2017","30.10.2017",2017,10,30,1.111731844,1
"SWE_038_MZB_LO_37","SWE_038_MZB_LO_37-21.09.2018","21.09.2018",2018,9,21,1,1
"SWE_038_MZB_LO_4","SWE_038_MZB_LO_4-02.10.2007","02.10.2007",2007,10,2,1.205586592,1
"SWE_038_MZB_LO_4","SWE_038_MZB_LO_4-16.10.2008","16.10.2008",2008,10,16,1.295716946,1
"SWE_038_MZB_LO_4","SWE_038_MZB_LO_4-24.10.2009","24.10.2009",2009,10,24,1.331471136,1
"SWE_038_MZB_LO_4","SWE_038_MZB_LO_4-06.10.2010","06.10.2010",2010,10,6,1.258845438,1
"SWE_038_MZB_LO_4","SWE_038_MZB_LO_4-03.10.2011","03.10.2011",2011,10,3,1.303538175,1
"SWE_038_MZB_LO_4","SWE_038_MZB_LO_4-20.11.2012","20.11.2012",2012,11,20,1.266294227,1
"SWE_038_MZB_LO_4","SWE_038_MZB_LO_4-01.10.2013","01.10.2013",2013,10,1,1.281191806,1
"SWE_038_MZB_LO_4","SWE_038_MZB_LO_4-07.10.2014","07.10.2014",2014,10,7,1.296648045,1
"SWE_038_MZB_LO_4","SWE_038_MZB_LO_4-08.10.2015","08.10.2015",2015,10,8,1.288081937,1
"SWE_038_MZB_LO_4","SWE_038_MZB_LO_4-02.10.2016","02.10.2016",2016,10,2,1.274860335,1
"SWE_038_MZB_LO_4","SWE_038_MZB_LO_4-03.10.2017","03.10.2017",2017,10,3,1.217504655,1
"SWE_038_MZB_LO_4","SWE_038_MZB_LO_4-07.11.2018","07.11.2018",2018,11,7,1.266294227,1
"SWE_038_MZB_LO_5","SWE_038_MZB_LO_5-02.10.2000","02.10.2000",2000,10,2,1.04532925,1
"SWE_038_MZB_LO_5","SWE_038_MZB_LO_5-10.10.2001","10.10.2001",2001,10,10,1,1
"SWE_038_MZB_LO_5","SWE_038_MZB_LO_5-01.10.2002","01.10.2002",2002,10,1,0.888888889,1
"SWE_038_MZB_LO_5","SWE_038_MZB_LO_5-07.10.2003","07.10.2003",2003,10,7,1,1
"SWE_038_MZB_LO_5","SWE_038_MZB_LO_5-22.09.2004","22.09.2004",2004,9,22,1,1
"SWE_038_MZB_LO_5","SWE_038_MZB_LO_5-20.09.2005","20.09.2005",2005,9,20,1.098315467,1
"SWE_038_MZB_LO_5","SWE_038_MZB_LO_5-27.09.2006","27.09.2006",2006,9,27,1,1
"SWE_038_MZB_LO_5","SWE_038_MZB_LO_5-02.10.2007","02.10.2007",2007,10,2,1.077794793,1
"SWE_038_MZB_LO_5","SWE_038_MZB_LO_5-26.09.2008","26.09.2008",2008,9,26,1,1
"SWE_038_MZB_LO_5","SWE_038_MZB_LO_5-05.10.2009","05.10.2009",2009,10,5,1.09280245,1
"SWE_038_MZB_LO_5","SWE_038_MZB_LO_5-27.09.2010","27.09.2010",2010,9,27,1,1
"SWE_038_MZB_LO_5","SWE_038_MZB_LO_5-14.10.2011","14.10.2011",2011,10,14,1,1
"SWE_038_MZB_LO_5","SWE_038_MZB_LO_5-29.10.2012","29.10.2012",2012,10,29,0.888888889,1
"SWE_038_MZB_LO_5","SWE_038_MZB_LO_5-16.10.2013","16.10.2013",2013,10,16,1,1
"SWE_038_MZB_LO_5","SWE_038_MZB_LO_5-20.10.2014","20.10.2014",2014,10,20,1,1
"SWE_038_MZB_LO_5","SWE_038_MZB_LO_5-28.09.2015","28.09.2015",2015,9,28,1,1
"SWE_038_MZB_LO_5","SWE_038_MZB_LO_5-10.10.2016","10.10.2016",2016,10,10,0.888888889,1
"SWE_038_MZB_LO_5","SWE_038_MZB_LO_5-02.10.2017","02.10.2017",2017,10,2,1.066156202,1
"SWE_038_MZB_LO_5","SWE_038_MZB_LO_5-16.10.2018","16.10.2018",2018,10,16,0.888888889,1
"SWE_038_MZB_LO_6","SWE_038_MZB_LO_6-19.10.2007","19.10.2007",2007,10,19,1,1
"SWE_038_MZB_LO_6","SWE_038_MZB_LO_6-22.10.2008","22.10.2008",2008,10,22,0.995405819,1
"SWE_038_MZB_LO_6","SWE_038_MZB_LO_6-01.11.2009","01.11.2009",2009,11,1,1,1
"SWE_038_MZB_LO_6","SWE_038_MZB_LO_6-29.10.2010","29.10.2010",2010,10,29,1.026646248,1
"SWE_038_MZB_LO_6","SWE_038_MZB_LO_6-22.10.2011","22.10.2011",2011,10,22,0.888888889,1
"SWE_038_MZB_LO_6","SWE_038_MZB_LO_6-02.11.2012","02.11.2012",2012,11,2,1,1
"SWE_038_MZB_LO_6","SWE_038_MZB_LO_6-19.10.2013","19.10.2013",2013,10,19,1.022511485,1
"SWE_038_MZB_LO_6","SWE_038_MZB_LO_6-16.10.2014","16.10.2014",2014,10,16,0.888888889,1
"SWE_038_MZB_LO_6","SWE_038_MZB_LO_6-13.10.2015","13.10.2015",2015,10,13,0.888888889,1
"SWE_038_MZB_LO_6","SWE_038_MZB_LO_6-15.10.2016","15.10.2016",2016,10,15,0.888888889,1
"SWE_038_MZB_LO_6","SWE_038_MZB_LO_6-11.10.2017","11.10.2017",2017,10,11,0.888888889,1
"SWE_038_MZB_LO_6","SWE_038_MZB_LO_6-02.11.2018","02.11.2018",2018,11,2,1.056661562,1
"SWE_038_MZB_LO_6","SWE_038_MZB_LO_6-09.11.2019","09.11.2019",2019,11,9,0.888888889,1
"SWE_038_MZB_LO_7","SWE_038_MZB_LO_7-23.10.2007","23.10.2007",2007,10,23,1.252700186,1
"SWE_038_MZB_LO_7","SWE_038_MZB_LO_7-23.10.2008","23.10.2008",2008,10,23,1.201489758,1
"SWE_038_MZB_LO_7","SWE_038_MZB_LO_7-16.10.2009","16.10.2009",2009,10,16,1.187150838,1
"SWE_038_MZB_LO_7","SWE_038_MZB_LO_7-08.10.2010","08.10.2010",2010,10,8,1.245437616,1
"SWE_038_MZB_LO_7","SWE_038_MZB_LO_7-26.10.2011","26.10.2011",2011,10,26,1.204655493,1
"SWE_038_MZB_LO_7","SWE_038_MZB_LO_7-22.10.2012","22.10.2012",2012,10,22,1.235195531,1
"SWE_038_MZB_LO_7","SWE_038_MZB_LO_7-11.10.2013","11.10.2013",2013,10,11,1.213407821,1
"SWE_038_MZB_LO_7","SWE_038_MZB_LO_7-16.10.2014","16.10.2014",2014,10,16,1.287150838,1
"SWE_038_MZB_LO_7","SWE_038_MZB_LO_7-20.10.2015","20.10.2015",2015,10,20,1.297392924,1
"SWE_038_MZB_LO_7","SWE_038_MZB_LO_7-31.10.2016","31.10.2016",2016,10,31,1.248789572,1
"SWE_038_MZB_LO_7","SWE_038_MZB_LO_7-20.10.2017","20.10.2017",2017,10,20,1.225139665,1
"SWE_038_MZB_LO_7","SWE_038_MZB_LO_7-20.09.2018","20.09.2018",2018,9,20,1.251210428,1
"SWE_038_MZB_LO_7","SWE_038_MZB_LO_7-28.10.2019","28.10.2019",2019,10,28,1.237802607,1
"SWE_038_MZB_LO_8","SWE_038_MZB_LO_8-16.10.2007","16.10.2007",2007,10,16,1.050837989,1
"SWE_038_MZB_LO_8","SWE_038_MZB_LO_8-23.10.2008","23.10.2008",2008,10,23,1,1
"SWE_038_MZB_LO_8","SWE_038_MZB_LO_8-15.10.2009","15.10.2009",2009,10,15,1.1858473,1
"SWE_038_MZB_LO_8","SWE_038_MZB_LO_8-21.10.2010","21.10.2010",2010,10,21,1.227374302,1
"SWE_038_MZB_LO_8","SWE_038_MZB_LO_8-19.10.2011","19.10.2011",2011,10,19,1.198882682,1
"SWE_038_MZB_LO_8","SWE_038_MZB_LO_8-16.10.2012","16.10.2012",2012,10,16,1.1858473,1
"SWE_038_MZB_LO_8","SWE_038_MZB_LO_8-17.10.2013","17.10.2013",2013,10,17,1.202048417,1
"SWE_038_MZB_LO_8","SWE_038_MZB_LO_8-14.10.2014","14.10.2014",2014,10,14,1.179329609,1
"SWE_038_MZB_LO_8","SWE_038_MZB_LO_8-06.10.2015","06.10.2015",2015,10,6,1.287337058,1
"SWE_038_MZB_LO_8","SWE_038_MZB_LO_8-11.10.2016","11.10.2016",2016,10,11,1.101862197,1
"SWE_038_MZB_LO_8","SWE_038_MZB_LO_8-12.10.2017","12.10.2017",2017,10,12,1.162011173,1
"SWE_038_MZB_LO_8","SWE_038_MZB_LO_8-11.10.2018","11.10.2018",2018,10,11,1.19310987,1
"SWE_038_MZB_LO_9","SWE_038_MZB_LO_9-02.10.2007","02.10.2007",2007,10,2,1.252700186,1
"SWE_038_MZB_LO_9","SWE_038_MZB_LO_9-16.10.2008","16.10.2008",2008,10,16,1.117318436,1
"SWE_038_MZB_LO_9","SWE_038_MZB_LO_9-24.10.2009","24.10.2009",2009,10,24,1.197206704,1
"SWE_038_MZB_LO_9","SWE_038_MZB_LO_9-06.10.2010","06.10.2010",2010,10,6,1.203351955,1
"SWE_038_MZB_LO_9","SWE_038_MZB_LO_9-03.10.2011","03.10.2011",2011,10,3,1.140595903,1
"SWE_038_MZB_LO_9","SWE_038_MZB_LO_9-20.11.2012","20.11.2012",2012,11,20,1.142085661,1
"SWE_038_MZB_LO_9","SWE_038_MZB_LO_9-01.10.2013","01.10.2013",2013,10,1,1.183798883,1
"SWE_038_MZB_LO_9","SWE_038_MZB_LO_9-07.10.2014","07.10.2014",2014,10,7,1.154562384,1
"SWE_038_MZB_LO_9","SWE_038_MZB_LO_9-08.10.2015","08.10.2015",2015,10,8,1.187150838,1
"SWE_038_MZB_LO_9","SWE_038_MZB_LO_9-02.10.2016","02.10.2016",2016,10,2,1.268528864,1
"SWE_038_MZB_LO_9","SWE_038_MZB_LO_9-03.10.2017","03.10.2017",2017,10,3,1.129795158,1
"SWE_038_MZB_LO_9","SWE_038_MZB_LO_9-07.11.2018","07.11.2018",2018,11,7,1.175418994,1
